{
  "date": "2025-03-11",
  "date_of_scrape": "2025-03-12T04:07:40.301Z",
  "tool_version": "0.2.0",
  "number_of_announcements": 131,
  "announcements": [
    {
      "date": "2025-03-11",
      "id": "103364",
      "original_text": "Einreichung neuer Dokumente\nBayern Amtsgericht Augsburg HRB 18093\nStadtwerke Augsburg Holding GmbH – Augsburg",
      "type": "Einreichung neuer Dokumente",
      "state": "Bayern",
      "amtsgericht": "Amtsgericht Augsburg",
      "registernummer": "HRB 18093",
      "registerart": "HRB",
      "company_name": "Stadtwerke Augsburg Holding GmbH",
      "company_seat": "Augsburg",
      "details": "11.03.2025 (Bekanntmachungsdatum)\n\nBayern Amtsgericht Augsburg HRB 18093\nEinreichung neuer Dokumente\n\nStadtwerke Augsburg Holding GmbH\nGesellschaft mit beschränkter Haftung\nAugsburg\n\nDem Amtsgericht Augsburg -Registergericht- ist eine Liste der Mitglieder des Aufsichtsrats eingereicht worden, § 52 Abs. 3 S. 2 GmbHG."
    },
    {
      "date": "2025-03-11",
      "id": "103365",
      "original_text": "Registerbekanntmachung nach dem Umwandlungsgesetz\nBayern Amtsgericht München HRB 294054\nEGYM AG – München",
      "type": "Registerbekanntmachung nach dem Umwandlungsgesetz",
      "state": "Bayern",
      "amtsgericht": "Amtsgericht München",
      "registernummer": "HRB 294054",
      "registerart": "HRB",
      "company_name": "EGYM AG",
      "company_seat": "München",
      "details": "11.03.2025 (Bekanntmachungsdatum)\n\nBayern Amtsgericht München HRB 294054\nRegisterbekanntmachung nach dem Umwandlungsgesetz 10.03.2025 (Eintragungsdatum)\n\nEGYM AG\nAktiengesellschaft\nMünchen\n\nDem Amtsgericht München Registergericht ist am 07.03.2025 der Entwurf eines Verschmelzungsplanes über die geplante Verschmelzung der Gesellschaft als übernehmendem Rechtsträger mit der Aktiengesellschaft nach österreichischem Recht unter Firma EGYM AG mit Sitz in Wien/Österreich (FN 597959 b) eingereicht worden. Die vollständigen Auskünfte über diese Modalitäten können kostenlos eingeholt werden bei EGYM AG z.Hd. des Vorstands Gauermanngasse 2, 1010 Wien/Österreich."
    },
    {
      "date": "2025-03-11",
      "id": "103366",
      "original_text": "Einreichung neuer Dokumente\nBayern Amtsgericht München HRB 252581\nSiemens Energy AG – München",
      "type": "Einreichung neuer Dokumente",
      "state": "Bayern",
      "amtsgericht": "Amtsgericht München",
      "registernummer": "HRB 252581",
      "registerart": "HRB",
      "company_name": "Siemens Energy AG",
      "company_seat": "München",
      "details": "11.03.2025 (Bekanntmachungsdatum)\n\nBayern Amtsgericht München HRB 252581\nEinreichung neuer Dokumente\n\nSiemens Energy AG\nAktiengesellschaft\nMünchen\n\nDem Amtsgericht München -Registergericht- ist eine Liste der Mitglieder des Aufsichtsrats eingereicht worden, § 106 AktG."
    },
    {
      "date": "2025-03-11",
      "id": "103367",
      "original_text": "Löschungsankündigung\nBayern Amtsgericht Ansbach HRB 5662\nPhoenix Beteiligungs- und Service GmbH – Windsbach",
      "type": "Löschungsankündigung",
      "state": "Bayern",
      "amtsgericht": "Amtsgericht Ansbach",
      "registernummer": "HRB 5662",
      "registerart": "HRB",
      "company_name": "Phoenix Beteiligungs- und Service GmbH",
      "company_seat": "Windsbach",
      "details": "11.03.2025 (Bekanntmachungsdatum)\n\nBayern Amtsgericht Ansbach HRB 5662\nLöschungsankündigung\n\nPhoenix Beteiligungs- und Service GmbH\nGesellschaft mit beschränkter Haftung\nWindsbach\n\nDas Registergericht beabsichtigt, die im Handelsregister eingetragene Gesellschaft wegen Vermögenslosigkeit von Amts wegen nach § 394 FamFG zu löschen. Die Frist zur Erhebung eines Widerspruchs ist auf sechs Wochen festgesetzt."
    },
    {
      "date": "2025-03-11",
      "id": "103368",
      "original_text": "Löschungsankündigung\nBayern Amtsgericht Nürnberg HRB 42103\nM3me GmbH – Nürnberg",
      "type": "Löschungsankündigung",
      "state": "Bayern",
      "amtsgericht": "Amtsgericht Nürnberg",
      "registernummer": "HRB 42103",
      "registerart": "HRB",
      "company_name": "M3me GmbH",
      "company_seat": "Nürnberg",
      "details": "11.03.2025 (Bekanntmachungsdatum)\n\nBayern Amtsgericht Nürnberg HRB 42103\nLöschungsankündigung\n\nM3me GmbH\nGesellschaft mit beschränkter Haftung\nNürnberg\n\nDas Registergericht beabsichtigt, die im Handelsregister eingetragene Gesellschaft wegen Vermögenslosigkeit von Amts wegen nach § 394 FamFG zu löschen. Die Frist zur Erhebung eines Widerspruchs ist auf einen Monat festgesetzt."
    },
    {
      "date": "2025-03-11",
      "id": "103369",
      "original_text": "Einreichung neuer Dokumente\nBayern Amtsgericht Augsburg HRB 6164\nLechwerke AG – Augsburg",
      "type": "Einreichung neuer Dokumente",
      "state": "Bayern",
      "amtsgericht": "Amtsgericht Augsburg",
      "registernummer": "HRB 6164",
      "registerart": "HRB",
      "company_name": "Lechwerke AG",
      "company_seat": "Augsburg",
      "details": "11.03.2025 (Bekanntmachungsdatum)\n\nBayern Amtsgericht Augsburg HRB 6164\nEinreichung neuer Dokumente\n\nLechwerke AG\nAktiengesellschaft\nAugsburg\n\nDem Amtsgericht Augsburg -Registergericht- ist der Entwurf eines Verschmelzungsvertrages zwischen der Gesellschaft als übernehmendem Rechtsträger und der LEW Natur Verwaltungs GmbH, Augsburg (Amtsgericht Augsburg  HRB 40213) zur Einsichtnahme eingereicht worden."
    },
    {
      "date": "2025-03-11",
      "id": "103370",
      "original_text": "Einreichung neuer Dokumente\nBayern Amtsgericht München HRB 240852\nSmart Mobile Labs AG – München",
      "type": "Einreichung neuer Dokumente",
      "state": "Bayern",
      "amtsgericht": "Amtsgericht München",
      "registernummer": "HRB 240852",
      "registerart": "HRB",
      "company_name": "Smart Mobile Labs AG",
      "company_seat": "München",
      "details": "11.03.2025 (Bekanntmachungsdatum)\n\nBayern Amtsgericht München HRB 240852\nEinreichung neuer Dokumente 10.03.2025 (Eintragungsdatum)\n\nSmart Mobile Labs AG\nAktiengesellschaft\nMünchen\n\nDem Amtsgericht München -Registergericht- ist eine Liste der Mitglieder des Aufsichtsrats eingereicht worden, § 106 AktG."
    },
    {
      "date": "2025-03-11",
      "id": "103371",
      "original_text": "Registerbekanntmachung nach dem Umwandlungsgesetz\nBayern Amtsgericht München HRB 239607\nQ-Parts24 Verwaltungs-GmbH – Hallbergmoos",
      "type": "Registerbekanntmachung nach dem Umwandlungsgesetz",
      "state": "Bayern",
      "amtsgericht": "Amtsgericht München",
      "registernummer": "HRB 239607",
      "registerart": "HRB",
      "company_name": "Q-Parts24 Verwaltungs-GmbH",
      "company_seat": "Hallbergmoos",
      "details": "11.03.2025 (Bekanntmachungsdatum)\n\nBayern Amtsgericht München HRB 239607\nRegisterbekanntmachung nach dem Umwandlungsgesetz 10.03.2025 (Eintragungsdatum)\n\nQ-Parts24 Verwaltungs-GmbH\nGesellschaft mit beschränkter Haftung\nHallbergmoos\n\nDen Gläubigern der an der Verschmelzung beteiligten Rechtsträger ist, wenn sie binnen sechs Monaten nach dem Tag, an dem die Eintragung der Verschmelzung in das Register des Sitzes desjenigen Rechtsträgers, dessen Gläubiger sie sind, nach § 19 Abs. 3 UmwG als bekannt gemacht gilt, ihren Anspruch nach Grund und Höhe in Textform anmelden, Sicherheit zu leisten, soweit sie nicht Befriedigung verlangen können. Dieses Recht steht den Gläubigern jedoch nur zu, wenn sie glaubhaft machen, dass durch die Verschmelzung die Erfüllung ihrer Forderung gefährdet wird."
    },
    {
      "date": "2025-03-11",
      "id": "103372",
      "original_text": "Löschungsankündigung\nBayern Amtsgericht Nürnberg HRB 20990\nBSC Dr. Bauer & Schreiber GmbH – Nürnberg",
      "type": "Löschungsankündigung",
      "state": "Bayern",
      "amtsgericht": "Amtsgericht Nürnberg",
      "registernummer": "HRB 20990",
      "registerart": "HRB",
      "company_name": "BSC Dr. Bauer & Schreiber GmbH",
      "company_seat": "Nürnberg",
      "details": "11.03.2025 (Bekanntmachungsdatum)\n\nBayern Amtsgericht Nürnberg HRB 20990\nLöschungsankündigung\n\nBSC Dr. Bauer & Schreiber GmbH\nGesellschaft mit beschränkter Haftung\nNürnberg\n\nDas Registergericht beabsichtigt, die im Handelsregister eingetragene Gesellschaft wegen Vermögenslosigkeit von Amts wegen nach § 394 FamFG zu löschen. Die Frist zur Erhebung eines Widerspruchs ist auf einen Monat festgesetzt."
    },
    {
      "date": "2025-03-11",
      "id": "103373",
      "original_text": "Registerbekanntmachung nach dem Umwandlungsgesetz\nBayern Amtsgericht Traunstein HRB 32812\nAGS Werte GmbH – Inzell",
      "type": "Registerbekanntmachung nach dem Umwandlungsgesetz",
      "state": "Bayern",
      "amtsgericht": "Amtsgericht Traunstein",
      "registernummer": "HRB 32812",
      "registerart": "HRB",
      "company_name": "AGS Werte GmbH",
      "company_seat": "Inzell",
      "details": "11.03.2025 (Bekanntmachungsdatum)\n\nBayern Amtsgericht Traunstein HRB 32812\nRegisterbekanntmachung nach dem Umwandlungsgesetz 10.03.2025 (Eintragungsdatum)\n\nAGS Werte GmbH\nGesellschaft mit beschränkter Haftung\nInzell\n\nDen Gläubigern des formwechselnden Rechtsträgers ist, wenn sie binnen sechs Monaten nach dem Tag, an dem die Eintragung des Formwechsels nach § 201 UmwG als bekannt gemacht gilt, ihren Anspruch nach Grund und Höhe in Textform anmelden, Sicherheit zu leisten, soweit sie nicht Befriedigung verlangen können. Dieses Recht steht den Gläubigern jedoch nur zu, wenn sie glaubhaft machen, dass durch den Formwechsel die Erfüllung ihrer Forderung gefährdet wird."
    },
    {
      "date": "2025-03-11",
      "id": "103374",
      "original_text": "Registerbekanntmachung nach dem Umwandlungsgesetz\nBayern Amtsgericht München HRB 246922\ngoetzpartners Holding AG – München",
      "type": "Registerbekanntmachung nach dem Umwandlungsgesetz",
      "state": "Bayern",
      "amtsgericht": "Amtsgericht München",
      "registernummer": "HRB 246922",
      "registerart": "HRB",
      "company_name": "goetzpartners Holding AG",
      "company_seat": "München",
      "details": "11.03.2025 (Bekanntmachungsdatum)\n\nBayern Amtsgericht München HRB 246922\nRegisterbekanntmachung nach dem Umwandlungsgesetz 10.03.2025 (Eintragungsdatum)\n\ngoetzpartners Holding AG\nAktiengesellschaft\nMünchen\n\nDen Gläubigern des formwechselnden Rechtsträgers ist, wenn sie binnen sechs Monaten nach dem Tag, an dem die Eintragung des Formwechsels nach § 201 UmwG als bekannt gemacht gilt, ihren Anspruch nach Grund und Höhe in Textform anmelden, Sicherheit zu leisten, soweit sie nicht Befriedigung verlangen können. Dieses Recht steht den Gläubigern jedoch nur zu, wenn sie glaubhaft machen, dass durch den Formwechsel die Erfüllung ihrer Forderung gefährdet wird."
    },
    {
      "date": "2025-03-11",
      "id": "103375",
      "original_text": "Löschungsankündigung\nBayern Amtsgericht Nürnberg HRB 30203\nZestyBeanz Technologies UG (haftungsbeschränkt) – Nürnberg",
      "type": "Löschungsankündigung",
      "state": "Bayern",
      "amtsgericht": "Amtsgericht Nürnberg",
      "registernummer": "HRB 30203",
      "registerart": "HRB",
      "company_name": "ZestyBeanz Technologies UG (haftungsbeschränkt)",
      "company_seat": "Nürnberg",
      "details": "11.03.2025 (Bekanntmachungsdatum)\n\nBayern Amtsgericht Nürnberg HRB 30203\nLöschungsankündigung\n\nZestyBeanz Technologies UG (haftungsbeschränkt)\nGesellschaft mit beschränkter Haftung\nNürnberg\n\nDas Registergericht beabsichtigt, die im Handelsregister eingetragene Gesellschaft wegen Vermögenslosigkeit von Amts wegen nach § 394 FamFG zu löschen. Die Frist zur Erhebung eines Widerspruchs ist auf einen Monat festgesetzt."
    },
    {
      "date": "2025-03-11",
      "id": "103376",
      "original_text": "Registerbekanntmachung nach dem Umwandlungsgesetz\nBayern Amtsgericht München HRB 283712\nIBITGQ GmbH – Oberhaching",
      "type": "Registerbekanntmachung nach dem Umwandlungsgesetz",
      "state": "Bayern",
      "amtsgericht": "Amtsgericht München",
      "registernummer": "HRB 283712",
      "registerart": "HRB",
      "company_name": "IBITGQ GmbH",
      "company_seat": "Oberhaching",
      "details": "11.03.2025 (Bekanntmachungsdatum)\n\nBayern Amtsgericht München HRB 283712\nRegisterbekanntmachung nach dem Umwandlungsgesetz 10.03.2025 (Eintragungsdatum)\n\nIBITGQ GmbH\nGesellschaft mit beschränkter Haftung\nOberhaching\n\nDen Gläubigern der an der Verschmelzung beteiligten Rechtsträger ist, wenn sie binnen sechs Monaten nach dem Tag, an dem die Eintragung der Verschmelzung in das Register des Sitzes desjenigen Rechtsträgers, dessen Gläubiger sie sind, nach § 19 Abs. 3 UmwG als bekannt gemacht gilt, ihren Anspruch nach Grund und Höhe in Textform anmelden, Sicherheit zu leisten, soweit sie nicht Befriedigung verlangen können. Dieses Recht steht den Gläubigern jedoch nur zu, wenn sie glaubhaft machen, dass durch die Verschmelzung die Erfüllung ihrer Forderung gefährdet wird."
    },
    {
      "date": "2025-03-11",
      "id": "103377",
      "original_text": "Löschungsankündigung\nBayern Amtsgericht München HRB 214252\nBavaria Consulting UG (haftungsbeschränkt) Wirtschafts- und Unternehmensberatung – München",
      "type": "Löschungsankündigung",
      "state": "Bayern",
      "amtsgericht": "Amtsgericht München",
      "registernummer": "HRB 214252",
      "registerart": "HRB",
      "company_name": "Bavaria Consulting UG (haftungsbeschränkt) Wirtschafts- und Unternehmensberatung",
      "company_seat": "München",
      "details": "11.03.2025 (Bekanntmachungsdatum)\n\nBayern Amtsgericht München HRB 214252\nLöschungsankündigung 10.03.2025 (Eintragungsdatum)\n\nBavaria Consulting UG (haftungsbeschränkt) Wirtschafts- und Unternehmensberatung\nGesellschaft mit beschränkter Haftung\nMünchen\n\nDas Registergericht beabsichtigt, die im Handelsregister eingetragene Gesellschaft wegen Vermögenslosigkeit von Amts wegen nach § 394 FamFG zu löschen. Die Frist zur Erhebung eines Widerspruchs ist auf drei Monate festgesetzt."
    },
    {
      "date": "2025-03-11",
      "id": "103378",
      "original_text": "Sonstige Registerbekanntmachung\nBayern Amtsgericht München HRB 290661\nConsultatio AG – München",
      "type": "Sonstige Registerbekanntmachung",
      "state": "Bayern",
      "amtsgericht": "Amtsgericht München",
      "registernummer": "HRB 290661",
      "registerart": "HRB",
      "company_name": "Consultatio AG",
      "company_seat": "München",
      "details": "11.03.2025 (Bekanntmachungsdatum)\n\nBayern Amtsgericht München HRB 290661\nSonstige Registerbekanntmachung 10.03.2025 (Eintragungsdatum)\n\nConsultatio AG\nAktiengesellschaft\nMünchen\n\nDem Amtsgericht München -Registergericht- ist eine Liste der Mitglieder des Aufsichtsrats eingereicht worden, § 106 AktG."
    },
    {
      "date": "2025-03-11",
      "id": "103379",
      "original_text": "Einreichung neuer Dokumente\nBayern Amtsgericht München HRB 170799\nProPack Dichtungen und Packungen AG – Sauerlach",
      "type": "Einreichung neuer Dokumente",
      "state": "Bayern",
      "amtsgericht": "Amtsgericht München",
      "registernummer": "HRB 170799",
      "registerart": "HRB",
      "company_name": "ProPack Dichtungen und Packungen AG",
      "company_seat": "Sauerlach",
      "details": "11.03.2025 (Bekanntmachungsdatum)\n\nBayern Amtsgericht München HRB 170799\nEinreichung neuer Dokumente\n\nProPack Dichtungen und Packungen AG\nAktiengesellschaft\nSauerlach\n\nDem Amtsgericht München -Registergericht- ist eine Liste der Mitglieder des Aufsichtsrats eingereicht worden, § 106 AktG."
    },
    {
      "date": "2025-03-11",
      "id": "103380",
      "original_text": "Löschungsankündigung\nBayern Amtsgericht München HRB 271456\nkopplr GmbH – München",
      "type": "Löschungsankündigung",
      "state": "Bayern",
      "amtsgericht": "Amtsgericht München",
      "registernummer": "HRB 271456",
      "registerart": "HRB",
      "company_name": "kopplr GmbH",
      "company_seat": "München",
      "details": "11.03.2025 (Bekanntmachungsdatum)\n\nBayern Amtsgericht München HRB 271456\nLöschungsankündigung 10.03.2025 (Eintragungsdatum)\n\nkopplr GmbH\nGesellschaft mit beschränkter Haftung\nMünchen\n\nDas Registergericht beabsichtigt, die im Handelsregister eingetragene Gesellschaft wegen Vermögenslosigkeit von Amts wegen nach § 394 FamFG zu löschen. Die Frist zur Erhebung eines Widerspruchs ist auf drei Monate festgesetzt."
    },
    {
      "date": "2025-03-11",
      "id": "103381",
      "original_text": "Löschungsankündigung\nBayern Amtsgericht München HRB 225153\nPNK Promotion GmbH – München",
      "type": "Löschungsankündigung",
      "state": "Bayern",
      "amtsgericht": "Amtsgericht München",
      "registernummer": "HRB 225153",
      "registerart": "HRB",
      "company_name": "PNK Promotion GmbH",
      "company_seat": "München",
      "details": "11.03.2025 (Bekanntmachungsdatum)\n\nBayern Amtsgericht München HRB 225153\nLöschungsankündigung\n\nPNK Promotion GmbH\nGesellschaft mit beschränkter Haftung\nMünchen\n\nDas Registergericht beabsichtigt, die im Handelsregister eingetragene Gesellschaft von Amts wegen nach § 395 FamFG zu löschen. Die Frist zur Erhebung eines Widerspruchs ist auf drei Monate festgesetzt."
    },
    {
      "date": "2025-03-11",
      "id": "103382",
      "original_text": "Löschungsankündigung\nBayern Amtsgericht München HRA 108368\nSecureHead GmbH & Co. KG – Geretsried",
      "type": "Löschungsankündigung",
      "state": "Bayern",
      "amtsgericht": "Amtsgericht München",
      "registernummer": "HRA 108368",
      "registerart": "HRA",
      "company_name": "SecureHead GmbH & Co. KG",
      "company_seat": "Geretsried",
      "details": "11.03.2025 (Bekanntmachungsdatum)\n\nBayern Amtsgericht München HRA 108368\nLöschungsankündigung\n\nSecureHead GmbH & Co. KG\nKommanditgesellschaft\nGeretsried\n\nDas Registergericht beabsichtigt, die im Handelsregister eingetragene Firma von Amts wegen nach § 31 Abs. 2 HGB zu löschen. Die Frist zur Erhebung eines Widerspruchs ist auf drei Monate festgesetzt."
    },
    {
      "date": "2025-03-11",
      "id": "103383",
      "original_text": "Löschungsankündigung\nBayern Amtsgericht München HRA 74668\n3 x 3 Holding GmbH & Co. KG – Ismaning",
      "type": "Löschungsankündigung",
      "state": "Bayern",
      "amtsgericht": "Amtsgericht München",
      "registernummer": "HRA 74668",
      "registerart": "HRA",
      "company_name": "3 x 3 Holding GmbH & Co. KG",
      "company_seat": "Ismaning",
      "details": "11.03.2025 (Bekanntmachungsdatum)\n\nBayern Amtsgericht München HRA 74668\nLöschungsankündigung\n\n3 x 3 Holding GmbH & Co. KG\nKommanditgesellschaft\nIsmaning\n\nDas Registergericht beabsichtigt, die im Handelsregister eingetragene Firma von Amts wegen nach § 31 Abs. 2 HGB zu löschen. Die Frist zur Erhebung eines Widerspruchs ist auf drei Monate festgesetzt."
    },
    {
      "date": "2025-03-11",
      "id": "103384",
      "original_text": "Registerbekanntmachung nach dem Umwandlungsgesetz\nBaden-Württemberg Amtsgericht Freiburg HRB 6445\nAvnet Embedded (Freiburg) GmbH – Eschbach",
      "type": "Registerbekanntmachung nach dem Umwandlungsgesetz",
      "state": "Baden-Württemberg",
      "amtsgericht": "Amtsgericht Freiburg",
      "registernummer": "HRB 6445",
      "registerart": "HRB",
      "company_name": "Avnet Embedded (Freiburg) GmbH",
      "company_seat": "Eschbach",
      "details": "11.03.2025 (Bekanntmachungsdatum)\n\nBaden-Württemberg Amtsgericht Freiburg HRB 6445\nRegisterbekanntmachung nach dem Umwandlungsgesetz 11.03.2025 (Eintragungsdatum)\n\nAvnet Embedded (Freiburg) GmbH\nGesellschaft mit beschränkter Haftung\nEschbach\n\nAls nicht eingetragen wird bekanntgemacht:\nDen Gläubigern der an der Verschmelzung beteiligten Rechtsträger ist, wenn sie binnen sechs Monaten nach dem Tag, an dem die Eintragung der Verschmelzung in das Register des Sitzes desjenigen Rechtsträgers, dessen Gläubiger sie sind, nach § 19 Abs. 3 UmwG als bekanntgemacht gilt, ihren Anspruch nach Grund und Höhe schriftlich anmelden, Sicherheit zu leisten, soweit sie nicht Befriedigung verlangen können. Dieses Recht steht den Gläubigern jedoch nur zu, wenn sie glaubhaft machen, dass durch die Verschmelzung die Erfüllung ihrer Forderung gefährdet wird."
    },
    {
      "date": "2025-03-11",
      "id": "103385",
      "original_text": "Registerbekanntmachung nach dem Umwandlungsgesetz\nSchleswig-Holstein Amtsgericht Flensburg HRB 17504\nJM Hansen Holding GmbH – Braderup",
      "type": "Registerbekanntmachung nach dem Umwandlungsgesetz",
      "state": "Schleswig-Holstein",
      "amtsgericht": "Amtsgericht Flensburg",
      "registernummer": "HRB 17504",
      "registerart": "HRB",
      "company_name": "JM Hansen Holding GmbH",
      "company_seat": "Braderup",
      "details": "11.03.2025 (Bekanntmachungsdatum)\n\nSchleswig-Holstein Amtsgericht Flensburg HRB 17504\nRegisterbekanntmachung nach dem Umwandlungsgesetz 06.03.2025 (Eintragungsdatum)\n\nJM Hansen Holding GmbH\nGesellschaft mit beschränkter Haftung\nBraderup\n\nZu Eintragungsnummer 1 vom 06.03.2025 wird als nicht eingetragen veröffentlicht:\nDen Gläubigern ist, wenn sie binnen sechs Monaten nach dem Tag, an dem die Eintragung der Umwandlung als bekannt gemacht gilt, ihren Anspruch nach Grund und Höhe schriftlich anmelden, Sicherheit zu leisten, soweit sie nicht Befriedigung verlangen können. Dieses Recht steht den Gläubigern jedoch nur zu, wenn sie glaubhaft machen, dass durch die Umwandlung die Erfüllung ihrer Forderung gefährdet wird."
    },
    {
      "date": "2025-03-11",
      "id": "103386",
      "original_text": "Registerbekanntmachung nach dem Umwandlungsgesetz\nSchleswig-Holstein Amtsgericht Pinneberg HRA 9804\nMaron Lebensmittel KG – Meldorf",
      "type": "Registerbekanntmachung nach dem Umwandlungsgesetz",
      "state": "Schleswig-Holstein",
      "amtsgericht": "Amtsgericht Pinneberg",
      "registernummer": "HRA 9804",
      "registerart": "HRA",
      "company_name": "Maron Lebensmittel KG",
      "company_seat": "Meldorf",
      "details": "11.03.2025 (Bekanntmachungsdatum)\n\nSchleswig-Holstein Amtsgericht Pinneberg HRA 9804\nRegisterbekanntmachung nach dem Umwandlungsgesetz 05.03.2025 (Eintragungsdatum)\n\nMaron Lebensmittel KG\nKommanditgesellschaft\nMeldorf\n\nZu Eintragungsnummer 3 vom 05.03.2025 wird als nicht eingetragen veröffentlicht: Den Gläubigern der an der Spaltung beteiligten Rechtsträger ist, wenn sie binnen sechs Monaten nach dem Tag, an dem die Eintragung der Spaltung in das Register des Sitzes desjenigen Rechtsträgers, dessen Gläubiger sie sind, als bekannt gemacht gilt, ihren Anspruch nach Grund und Höhe schriftlich anmelden, Sicherheit zu leisten, soweit sie nicht Befriedigung verlangen können. Dieses Recht steht den Gläubigern jedoch nur zu, wenn sie glaubhaft machen, dass durch die Spaltung die Erfüllung ihrer Forderung gefährdet wird. Das Recht, Sicherheitsleistung zu verlangen, steht Gläubigern nicht zu, die im Falle der Insolvenz ein Recht auf vorzugsweise Befriedigung aus einer Deckungsmasse haben, die nach gesetzlicher Vorschrift zu ihrem Schutz errichtet und staatlich überwacht ist."
    },
    {
      "date": "2025-03-11",
      "id": "103387",
      "original_text": "Einreichung neuer Dokumente\nBerlin Amtsgericht Berlin (Charlottenburg) HRB 89471\nProtektor Lebensversicherungs-AG – Berlin",
      "type": "Einreichung neuer Dokumente",
      "state": "Berlin",
      "amtsgericht": "Amtsgericht Berlin (Charlottenburg)",
      "registernummer": "HRB 89471",
      "registerart": "HRB",
      "company_name": "Protektor Lebensversicherungs-AG",
      "company_seat": "Berlin",
      "details": "11.03.2025 (Bekanntmachungsdatum)\n\nBerlin Amtsgericht Berlin (Charlottenburg) HRB 89471\nEinreichung neuer Dokumente\n\nProtektor Lebensversicherungs-AG\nAktiengesellschaft\nBerlin\n\nAls nicht eingetragen wird veröffentlicht: Es wurde eine neue Liste der Aufsichtsratsmitglieder eingereicht (§ 106 AktG)."
    },
    {
      "date": "2025-03-11",
      "id": "103388",
      "original_text": "Löschungsankündigung\nBerlin Amtsgericht Berlin (Charlottenburg) HRB 184373\nPV-Development Engineers UG (haftungsbeschränkt) – Berlin",
      "type": "Löschungsankündigung",
      "state": "Berlin",
      "amtsgericht": "Amtsgericht Berlin (Charlottenburg)",
      "registernummer": "HRB 184373",
      "registerart": "HRB",
      "company_name": "PV-Development Engineers UG (haftungsbeschränkt)",
      "company_seat": "Berlin",
      "details": "11.03.2025 (Bekanntmachungsdatum)\n\nBerlin Amtsgericht Berlin (Charlottenburg) HRB 184373\nLöschungsankündigung\n\nPV-Development Engineers UG (haftungsbeschränkt)\nGesellschaft mit beschränkter Haftung\nBerlin\n\nBei der nachstehenden Gesellschaft wird das Amtslöschungsverfahren gemäß § 394 FamFG eingeleitet. Widerspruchsfrist 6 Wochen"
    },
    {
      "date": "2025-03-11",
      "id": "103389",
      "original_text": "Löschungsankündigung\nBaden-Württemberg Amtsgericht Stuttgart HRB 768115\nKaBo GmbH – Tübingen",
      "type": "Löschungsankündigung",
      "state": "Baden-Württemberg",
      "amtsgericht": "Amtsgericht Stuttgart",
      "registernummer": "HRB 768115",
      "registerart": "HRB",
      "company_name": "KaBo GmbH",
      "company_seat": "Tübingen",
      "details": "11.03.2025 (Bekanntmachungsdatum)\n\nBaden-Württemberg Amtsgericht Stuttgart HRB 768115\nLöschungsankündigung\n\nKaBo GmbH\nGesellschaft mit beschränkter Haftung\nTübingen\n\nAls nicht eingetragen wird bekanntgemacht:\nDas Gericht beabsichtigt, die Gesellschaft wegen Vermögenslosigkeit im Handelsregister von Amts wegen nach § 394 FamFG zu löschen. Die Frist zur Geltendmachung eines Widerspruchs gegen die beabsichtigte Löschung ist auf zwei Monate ab Veröffentlichung bestimmt."
    },
    {
      "date": "2025-03-11",
      "id": "103390",
      "original_text": "Sonstige Registerbekanntmachung\nSchleswig-Holstein Amtsgericht Lübeck HRB 21834\nManpower Service & Transporte GmbH – Escheburg",
      "type": "Sonstige Registerbekanntmachung",
      "state": "Schleswig-Holstein",
      "amtsgericht": "Amtsgericht Lübeck",
      "registernummer": "HRB 21834",
      "registerart": "HRB",
      "company_name": "Manpower Service & Transporte GmbH",
      "company_seat": "Escheburg",
      "details": "11.03.2025 (Bekanntmachungsdatum)\n\nSchleswig-Holstein Amtsgericht Lübeck HRB 21834\nSonstige Registerbekanntmachung\n\nManpower Service & Transporte GmbH\nGesellschaft mit beschränkter Haftung\nEscheburg\n\nAls nicht eingetragen wird veröffentlicht:\nergeben sich aus den mir vorliegenden Unterlagen Anhaltspunkte dafür, dass die Gesellschaft, als deren Geschäftsführer Sie noch eingetragen sind, vermögenslos ist:\nUnter der Geschäftsanschrift ist die Gesellschaft nicht zu erreichen, der GF ist unbekannten Aufenthalts.\nBeim Finanzamt wurde die Gesellschaft nie steuerrechtlich registriert.\nEs liegt ein Antrag der IHK zu Lübeck auf Amtslöschung vor.\nIch beabsichtige daher, die Gesellschaft wegen Vermögenslosigkeit gemäß § 394 FamFG zu löschen.\nIch bestimme eine Frist von einem Monat zur Geltendmachung eines Widerspruchs gegen die Löschung, § 394 Abs. 2 S. 1 FamFG.\nWeiter bitte ich Sie, mir binnen derselben Frist mitzuteilen, ob die genannte Gesellschaft noch Vermögen hat, ggf. welche Vermögensgegenstände sie besitzt, ob die Gesellschaft noch Partei eines noch nicht rechtskräftig abgeschlossenen Rechtsstreits ist oder ob sonst noch eine Abwicklung stattfindet.\nNach Fristablauf ohne Widerspruch von Ihnen oder anderer Seite wird die Gesellschaft gelöscht."
    },
    {
      "date": "2025-03-11",
      "id": "103391",
      "original_text": "Einreichung neuer Dokumente\nSchleswig-Holstein Amtsgericht Flensburg HRB 1524 HU\nTourismus und Stadtmarketing Husum GmbH – Husum",
      "type": "Einreichung neuer Dokumente",
      "state": "Schleswig-Holstein",
      "amtsgericht": "Amtsgericht Flensburg",
      "registernummer": "HRB 1524 HU",
      "registerart": "HRB",
      "company_name": "Tourismus und Stadtmarketing Husum GmbH",
      "company_seat": "Husum",
      "details": "11.03.2025 (Bekanntmachungsdatum)\n\nSchleswig-Holstein Amtsgericht Flensburg HRB 1524 HU\nEinreichung neuer Dokumente\n\nTourismus und Stadtmarketing Husum GmbH\nGesellschaft mit beschränkter Haftung\nHusum\n\nAls nicht eingetragen wird veröffentlicht: Neue Aufsichtsratsliste nach Änderung eingereicht am 07.03.2025."
    },
    {
      "date": "2025-03-11",
      "id": "103392",
      "original_text": "Registerbekanntmachung nach dem Umwandlungsgesetz\nBaden-Württemberg Amtsgericht Stuttgart HRB 798611\nKrams Gebäudemanagement GmbH – Reutlingen",
      "type": "Registerbekanntmachung nach dem Umwandlungsgesetz",
      "state": "Baden-Württemberg",
      "amtsgericht": "Amtsgericht Stuttgart",
      "registernummer": "HRB 798611",
      "registerart": "HRB",
      "company_name": "Krams Gebäudemanagement GmbH",
      "company_seat": "Reutlingen",
      "details": "11.03.2025 (Bekanntmachungsdatum)\n\nBaden-Württemberg Amtsgericht Stuttgart HRB 798611\nRegisterbekanntmachung nach dem Umwandlungsgesetz 11.03.2025 (Eintragungsdatum)\n\nKrams Gebäudemanagement GmbH\nGesellschaft mit beschränkter Haftung\nReutlingen\n\nAls nicht eingetragen wird bekanntgemacht:\nDen Gläubigern der an der Abspaltung beteiligten Rechtsträger ist, wenn sie binnen sechs Monaten nach dem Tag, an dem die Eintragung der Abspaltung in das Register des Sitzes desjenigen Rechtsträgers, dessen Gläubiger sie sind, nach § 19 Abs. 3 UmwG als bekanntgemacht gilt, ihren Anspruch nach Grund und Höhe schriftlich anmelden, Sicherheit zu leisten, soweit sie nicht Befriedigung verlangen können. Dieses Recht steht den Gläubigern jedoch nur zu, wenn sie glaubhaft machen, dass durch die Abspaltung die Erfüllung ihrer Forderung gefährdet wird."
    },
    {
      "date": "2025-03-11",
      "id": "103393",
      "original_text": "Einreichung neuer Dokumente\nSachsen-Anhalt Amtsgericht Stendal HRB 1783\nStadtwerke Osterburg Gesellschaft mit beschränkter Haftung – Osterburg (Altmark)",
      "type": "Einreichung neuer Dokumente",
      "state": "Sachsen-Anhalt",
      "amtsgericht": "Amtsgericht Stendal",
      "registernummer": "HRB 1783",
      "registerart": "HRB",
      "company_name": "Stadtwerke Osterburg Gesellschaft mit beschränkter Haftung",
      "company_seat": "Osterburg (Altmark)",
      "details": "11.03.2025 (Bekanntmachungsdatum)\n\nSachsen-Anhalt Amtsgericht Stendal HRB 1783\nEinreichung neuer Dokumente 11.03.2025 (Eintragungsdatum)\n\nStadtwerke Osterburg Gesellschaft mit beschränkter Haftung\nGesellschaft mit beschränkter Haftung\nOsterburg (Altmark)\n\nEine Liste der Mitglieder des Aufsichtsrates wurde zum Handelsregister eingereicht."
    },
    {
      "date": "2025-03-11",
      "id": "103394",
      "original_text": "Registerbekanntmachung nach dem Umwandlungsgesetz\nBaden-Württemberg Amtsgericht Stuttgart HRB 350913\nKrams Immobilien GmbH – Reutlingen",
      "type": "Registerbekanntmachung nach dem Umwandlungsgesetz",
      "state": "Baden-Württemberg",
      "amtsgericht": "Amtsgericht Stuttgart",
      "registernummer": "HRB 350913",
      "registerart": "HRB",
      "company_name": "Krams Immobilien GmbH",
      "company_seat": "Reutlingen",
      "details": "11.03.2025 (Bekanntmachungsdatum)\n\nBaden-Württemberg Amtsgericht Stuttgart HRB 350913\nRegisterbekanntmachung nach dem Umwandlungsgesetz 11.03.2025 (Eintragungsdatum)\n\nKrams Immobilien GmbH\nGesellschaft mit beschränkter Haftung\nReutlingen\n\nAls nicht eingetragen wird bekanntgemacht:\nDen Gläubigern der an der Abspaltung beteiligten Rechtsträger ist, wenn sie binnen sechs Monaten nach dem Tag, an dem die Eintragung der Abspaltung in das Register des Sitzes desjenigen Rechtsträgers, dessen Gläubiger sie sind, nach § 19 Abs. 3 UmwG als bekanntgemacht gilt, ihren Anspruch nach Grund und Höhe schriftlich anmelden, Sicherheit zu leisten, soweit sie nicht Befriedigung verlangen können. Dieses Recht steht den Gläubigern jedoch nur zu, wenn sie glaubhaft machen, dass durch die Abspaltung die Erfüllung ihrer Forderung gefährdet wird."
    },
    {
      "date": "2025-03-11",
      "id": "103395",
      "original_text": "Löschungsankündigung\nBerlin Amtsgericht Berlin (Charlottenburg) HRB 127293\nBARmohren30 GmbH – Berlin",
      "type": "Löschungsankündigung",
      "state": "Berlin",
      "amtsgericht": "Amtsgericht Berlin (Charlottenburg)",
      "registernummer": "HRB 127293",
      "registerart": "HRB",
      "company_name": "BARmohren30 GmbH",
      "company_seat": "Berlin",
      "details": "11.03.2025 (Bekanntmachungsdatum)\n\nBerlin Amtsgericht Berlin (Charlottenburg) HRB 127293\nLöschungsankündigung\n\nBARmohren30 GmbH\nGesellschaft mit beschränkter Haftung\nBerlin\n\nBei der nachstehenden Gesellschaft wird das Amtslöschungsverfahren gemäß § 394 FamFG eingeleitet. Widerspruchsfrist\n6 Wochen."
    },
    {
      "date": "2025-03-11",
      "id": "103396",
      "original_text": "Löschungsankündigung\nSaarland Amtsgericht Saarbrücken HRB 23509\n\"Franz Hesedenz Gesellschaft mit beschränkter Haftung\" – Saarlouis",
      "type": "Löschungsankündigung",
      "state": "Saarland",
      "amtsgericht": "Amtsgericht Saarbrücken",
      "registernummer": "HRB 23509",
      "registerart": "HRB",
      "company_name": "\"Franz Hesedenz Gesellschaft mit beschränkter Haftung\"",
      "company_seat": "Saarlouis",
      "details": "11.03.2025 (Bekanntmachungsdatum)\n\nSaarland Amtsgericht Saarbrücken HRB 23509\nLöschungsankündigung\n\n\"Franz Hesedenz Gesellschaft mit beschränkter Haftung\"\nGesellschaft mit beschränkter Haftung\nSaarlouis\n\nEs ist beabsichtigt, die Gesellschaft von Amts wegen gemäß § 394 FamFG wegen Vermögenslosigkeit zu löschen.\nGegen die Löschung von Amts wegen ist das Rechtsmittel des Widerspruchs statthaft. Der Widerspruch ist binnen einer Frist zwei Monaten beginnend mit dem Tag dieser Veröffentlichung durch Einreichen eines Widerspruchsschreibens -schriftlich oder zur Niederschrift der Geschäftsstelle beim Amtsgericht Saarbrücken, -zentrales Handelsregister-, Mainzer Str.178, 66121 Saarbrücken einzulegen.\nDer Widerspruch muss die Bezeichnung der angefochtenen Löschungsankündigung enthalten sowie die Erklärung, dass Widerspruch eingelegt wird. Er ist vom Widerspruchsführer oder seinem Bevollmächtigten zu unterzeichnen.\nDas Widerspruchsschreiben kann auch in der Form eines elektronischen Dokumentes eingereicht werden, das mit einer qualifizierten elektronischen Signatur nach dem Signaturgesetz versehen sein muss (§§ 14 Abs. 2 FamFG, 130a, 298 ZPO)."
    },
    {
      "date": "2025-03-11",
      "id": "103397",
      "original_text": "Löschungsankündigung\nBaden-Württemberg Amtsgericht Mannheim HRB 724645\nC & W GmbH – Waghäusel",
      "type": "Löschungsankündigung",
      "state": "Baden-Württemberg",
      "amtsgericht": "Amtsgericht Mannheim",
      "registernummer": "HRB 724645",
      "registerart": "HRB",
      "company_name": "C & W GmbH",
      "company_seat": "Waghäusel",
      "details": "11.03.2025 (Bekanntmachungsdatum)\n\nBaden-Württemberg Amtsgericht Mannheim HRB 724645\nLöschungsankündigung\n\nC & W GmbH\nGesellschaft mit beschränkter Haftung\nWaghäusel\n\nAls nicht eingetragen wird bekanntgemacht:\nDas Gericht beabsichtigt, die Gesellschaft wegen Vermögenslosigkeit im Handelsregister von Amts wegen nach § 394 FamFG zu löschen. Die Frist zur Geltendmachung eines Widerspruchs gegen die beabsichtigte Löschung ist auf einen Monat ab Veröffentlichung bestimmt."
    },
    {
      "date": "2025-03-11",
      "id": "103398",
      "original_text": "Registerbekanntmachung nach dem Umwandlungsgesetz\nSachsen-Anhalt Amtsgericht Stendal HRB 24758\nAuster Handelsgesellschaft mbH – Halle (Saale)",
      "type": "Registerbekanntmachung nach dem Umwandlungsgesetz",
      "state": "Sachsen-Anhalt",
      "amtsgericht": "Amtsgericht Stendal",
      "registernummer": "HRB 24758",
      "registerart": "HRB",
      "company_name": "Auster Handelsgesellschaft mbH",
      "company_seat": "Halle (Saale)",
      "details": "11.03.2025 (Bekanntmachungsdatum)\n\nSachsen-Anhalt Amtsgericht Stendal HRB 24758\nRegisterbekanntmachung nach dem Umwandlungsgesetz 11.03.2025 (Eintragungsdatum)\n\nAuster Handelsgesellschaft mbH\nGesellschaft mit beschränkter Haftung\nHalle (Saale)\n\nDie Gesellschaft ist auf Grund des Verschmelzungsvertrages vom 26.02.2025 sowie des Beschlusses der Gesellschafterversammlung vom selben Tag mit dem Vermögen des Alleingesellschafters Dr. Andreas Schnarr verschmolzen. Nicht eingetragen:Den Gläubigern der an der Verschmelzung beteiligten Rechtsträger ist, wenn sie binnen sechs Monaten nach dem Tag, an dem die Eintragung der Verschmelzung nach § 19 Abs. 3 UmwG als bekanntgemacht gilt, ihren Anspruch nach Grund und Höhe schriftlich anmelden, Sicherheit zu leisten, soweit sie nicht Befriedigung verlangen können. Dieses Recht steht ihnen jedoch nur zu, wenn sie glaubhaft machen, dass durch die Verschmelzung die Erfüllung ihrer Forderung gefährdet wird."
    },
    {
      "date": "2025-03-11",
      "id": "103399",
      "original_text": "Löschungsankündigung\nBaden-Württemberg Amtsgericht Mannheim HRB 722408\nCoolman Verwaltungs GmbH – Mannheim",
      "type": "Löschungsankündigung",
      "state": "Baden-Württemberg",
      "amtsgericht": "Amtsgericht Mannheim",
      "registernummer": "HRB 722408",
      "registerart": "HRB",
      "company_name": "Coolman Verwaltungs GmbH",
      "company_seat": "Mannheim",
      "details": "11.03.2025 (Bekanntmachungsdatum)\n\nBaden-Württemberg Amtsgericht Mannheim HRB 722408\nLöschungsankündigung\n\nCoolman Verwaltungs GmbH\nGesellschaft mit beschränkter Haftung\nMannheim\n\nDas Gericht beabsichtigt, die Gesellschaft wegen Vermögenslosigkeit im Handelsregister von Amts wegen nach § 394 FamFG zu löschen. Die Frist zur Geltendmachung eines Widerspruchs gegen die beabsichtigte Löschung ist auf einen Monat ab Veröffentlichung bestimmt."
    },
    {
      "date": "2025-03-11",
      "id": "103400",
      "original_text": "Löschungsankündigung\nBrandenburg Amtsgericht Neuruppin HRB 14482\nELBE - Bau SMAH GmbH – Perleberg OT Spiegelhagen",
      "type": "Löschungsankündigung",
      "state": "Brandenburg",
      "amtsgericht": "Amtsgericht Neuruppin",
      "registernummer": "HRB 14482",
      "registerart": "HRB",
      "company_name": "ELBE - Bau SMAH GmbH",
      "company_seat": "Perleberg OT Spiegelhagen",
      "details": "11.03.2025 (Bekanntmachungsdatum)\n\nBrandenburg Amtsgericht Neuruppin HRB 14482\nLöschungsankündigung\n\nELBE - Bau SMAH GmbH\nGesellschaft mit beschränkter Haftung\nPerleberg OT Spiegelhagen\n\nBei der nachstehenden Gesellschaft wird das Amtslöschungsverfahren gemäß § 394 FamFG eingeleitet.\nWiderspruchsfrist: 1 Monat"
    },
    {
      "date": "2025-03-11",
      "id": "103401",
      "original_text": "Registerbekanntmachung nach dem Umwandlungsgesetz\nBaden-Württemberg Amtsgericht Stuttgart HRB 764219\nInovance Technology Europe GmbH – Pleidelsheim",
      "type": "Registerbekanntmachung nach dem Umwandlungsgesetz",
      "state": "Baden-Württemberg",
      "amtsgericht": "Amtsgericht Stuttgart",
      "registernummer": "HRB 764219",
      "registerart": "HRB",
      "company_name": "Inovance Technology Europe GmbH",
      "company_seat": "Pleidelsheim",
      "details": "11.03.2025 (Bekanntmachungsdatum)\n\nBaden-Württemberg Amtsgericht Stuttgart HRB 764219\nRegisterbekanntmachung nach dem Umwandlungsgesetz 11.03.2025 (Eintragungsdatum)\n\nInovance Technology Europe GmbH\nGesellschaft mit beschränkter Haftung\nPleidelsheim\n\nAls nicht eingetragen wird bekanntgemacht:\nDen Gläubigern der an der Abspaltung beteiligten Rechtsträger ist, wenn sie binnen sechs Monaten nach dem Tag, an dem die Eintragung der Abspaltung in das Register des Sitzes desjenigen Rechtsträgers, dessen Gläubiger sie sind, nach § 19 Abs. 3 UmwG als bekanntgemacht gilt, ihren Anspruch nach Grund und Höhe schriftlich anmelden, Sicherheit zu leisten, soweit sie nicht Befriedigung verlangen können. Dieses Recht steht den Gläubigern jedoch nur zu, wenn sie glaubhaft machen, dass durch die Abspaltung die Erfüllung ihrer Forderung gefährdet wird."
    },
    {
      "date": "2025-03-11",
      "id": "103402",
      "original_text": "Einreichung neuer Dokumente\nSchleswig-Holstein Amtsgericht Kiel HRB 2202 RD\nStadtwerke Rendsburg GmbH – Rendsburg",
      "type": "Einreichung neuer Dokumente",
      "state": "Schleswig-Holstein",
      "amtsgericht": "Amtsgericht Kiel",
      "registernummer": "HRB 2202 RD",
      "registerart": "HRB",
      "company_name": "Stadtwerke Rendsburg GmbH",
      "company_seat": "Rendsburg",
      "details": "11.03.2025 (Bekanntmachungsdatum)\n\nSchleswig-Holstein Amtsgericht Kiel HRB 2202 RD\nEinreichung neuer Dokumente\n\nStadtwerke Rendsburg GmbH\nGesellschaft mit beschränkter Haftung\nRendsburg\n\nAls nicht eingetragen wird veröffentlicht: Eine neue Liste der Aufsichtsratsmitglieder ist eingereicht worden."
    },
    {
      "date": "2025-03-11",
      "id": "103403",
      "original_text": "Löschungsankündigung\nBaden-Württemberg Amtsgericht Mannheim HRB 704532\nWRK - GmbH – Höpfingen",
      "type": "Löschungsankündigung",
      "state": "Baden-Württemberg",
      "amtsgericht": "Amtsgericht Mannheim",
      "registernummer": "HRB 704532",
      "registerart": "HRB",
      "company_name": "WRK - GmbH",
      "company_seat": "Höpfingen",
      "details": "11.03.2025 (Bekanntmachungsdatum)\n\nBaden-Württemberg Amtsgericht Mannheim HRB 704532\nLöschungsankündigung\n\nWRK - GmbH\nGesellschaft mit beschränkter Haftung\nHöpfingen\n\nDas Gericht beabsichtigt, die Gesellschaft wegen Vermögenslosigkeit im Handelsregister von Amts wegen nach § 394 FamFG zu löschen. Die Frist zur Geltendmachung eines Widerspruchs gegen die beabsichtigte Löschung ist auf einen Monat ab Veröffentlichung bestimmt."
    },
    {
      "date": "2025-03-11",
      "id": "103404",
      "original_text": "Löschungsankündigung\nBaden-Württemberg Amtsgericht Mannheim HRB 716694\nPirminus GmbH Groß Verbraucher Service – Mannheim",
      "type": "Löschungsankündigung",
      "state": "Baden-Württemberg",
      "amtsgericht": "Amtsgericht Mannheim",
      "registernummer": "HRB 716694",
      "registerart": "HRB",
      "company_name": "Pirminus GmbH Groß Verbraucher Service",
      "company_seat": "Mannheim",
      "details": "11.03.2025 (Bekanntmachungsdatum)\n\nBaden-Württemberg Amtsgericht Mannheim HRB 716694\nLöschungsankündigung\n\nPirminus GmbH Groß Verbraucher Service\nGesellschaft mit beschränkter Haftung\nMannheim\n\nDas Gericht beabsichtigt, die Gesellschaft wegen Vermögenslosigkeit im Handelsregister von Amts wegen nach § 394 FamFG zu löschen. Die Frist zur Geltendmachung eines Widerspruchs gegen die beabsichtigte Löschung ist auf einen Monat ab Veröffentlichung bestimmt."
    },
    {
      "date": "2025-03-11",
      "id": "103405",
      "original_text": "Einreichung neuer Dokumente\nThüringen Amtsgericht Jena HRB 504324\nTSBV Oberhof - event GmbH – Oberhof",
      "type": "Einreichung neuer Dokumente",
      "state": "Thüringen",
      "amtsgericht": "Amtsgericht Jena",
      "registernummer": "HRB 504324",
      "registerart": "HRB",
      "company_name": "TSBV Oberhof - event GmbH",
      "company_seat": "Oberhof",
      "details": "11.03.2025 (Bekanntmachungsdatum)\n\nThüringen Amtsgericht Jena HRB 504324\nEinreichung neuer Dokumente 04.03.2024 (Eintragungsdatum)\n\nTSBV Oberhof - event GmbH\nGesellschaft mit beschränkter Haftung\nOberhof\n\nBekanntmachung gem. § 52 Abs. 3 Satz 2 GmbHG: Aufgrund einer Veränderung in den Personen der Aufsichtsratsmitglieder ist durch die Geschäftsführer eine neue Liste zum Handelsregister eingereicht worden."
    },
    {
      "date": "2025-03-11",
      "id": "103406",
      "original_text": "Einreichung neuer Dokumente\nThüringen Amtsgericht Jena HRB 209073\nBBV Bäder- und Beteiligungsverwaltung Eisenberg GmbH – Eisenberg",
      "type": "Einreichung neuer Dokumente",
      "state": "Thüringen",
      "amtsgericht": "Amtsgericht Jena",
      "registernummer": "HRB 209073",
      "registerart": "HRB",
      "company_name": "BBV Bäder- und Beteiligungsverwaltung Eisenberg GmbH",
      "company_seat": "Eisenberg",
      "details": "11.03.2025 (Bekanntmachungsdatum)\n\nThüringen Amtsgericht Jena HRB 209073\nEinreichung neuer Dokumente\n\nBBV Bäder- und Beteiligungsverwaltung Eisenberg GmbH\nGesellschaft mit beschränkter Haftung\nEisenberg\n\nBekanntmachung gem. § 52 Abs. 3 Satz 2 GmbHG: Aufgrund einer Veränderung in den Personen der Aufsichtsratsmitglieder ist durch die Geschäftsführer eine neue Liste zum Handelsregister eingereicht worden."
    },
    {
      "date": "2025-03-11",
      "id": "103407",
      "original_text": "Sonstige Registerbekanntmachung\nHamburg Amtsgericht Hamburg HRB 153036\nTriboro Holding SE – Hamburg",
      "type": "Sonstige Registerbekanntmachung",
      "state": "Hamburg",
      "amtsgericht": "Amtsgericht Hamburg",
      "registernummer": "HRB 153036",
      "registerart": "HRB",
      "company_name": "Triboro Holding SE",
      "company_seat": "Hamburg",
      "details": "11.03.2025 (Bekanntmachungsdatum)\n\nHamburg Amtsgericht Hamburg HRB 153036\nSonstige Registerbekanntmachung\n\nTriboro Holding SE\nEuropäische Aktiengesellschaft (SE)\nHamburg\n\nAls nicht eingetragen wird bekannt gemacht: Liste des Verwaltungsrats wurde eingereicht."
    },
    {
      "date": "2025-03-11",
      "id": "103408",
      "original_text": "Löschungsankündigung\nBrandenburg Amtsgericht Potsdam HRB 28808\nROHDE+ROHDE Beteiligungs UG (haftungsbeschränkt) – Michendorf",
      "type": "Löschungsankündigung",
      "state": "Brandenburg",
      "amtsgericht": "Amtsgericht Potsdam",
      "registernummer": "HRB 28808",
      "registerart": "HRB",
      "company_name": "ROHDE+ROHDE Beteiligungs UG (haftungsbeschränkt)",
      "company_seat": "Michendorf",
      "details": "11.03.2025 (Bekanntmachungsdatum)\n\nBrandenburg Amtsgericht Potsdam HRB 28808\nLöschungsankündigung\n\nROHDE+ROHDE Beteiligungs UG (haftungsbeschränkt)\nGesellschaft mit beschränkter Haftung\nMichendorf\n\nBei der nachstehenden Gesellschaft wird das Amtslöschungsverfahren gemäß § 394 FamFG eingeleitet. Widerspruchsfrist: 8 Wochen"
    },
    {
      "date": "2025-03-11",
      "id": "103409",
      "original_text": "Einreichung neuer Dokumente\nBaden-Württemberg Amtsgericht Freiburg HRB 19\nFreiburger Stadtbau Gesellschaft mit beschränkter Haftung (FSB) – Freiburg im Breisgau",
      "type": "Einreichung neuer Dokumente",
      "state": "Baden-Württemberg",
      "amtsgericht": "Amtsgericht Freiburg",
      "registernummer": "HRB 19",
      "registerart": "HRB",
      "company_name": "Freiburger Stadtbau Gesellschaft mit beschränkter Haftung (FSB)",
      "company_seat": "Freiburg im Breisgau",
      "details": "11.03.2025 (Bekanntmachungsdatum)\n\nBaden-Württemberg Amtsgericht Freiburg HRB 19\nEinreichung neuer Dokumente\n\nFreiburger Stadtbau Gesellschaft mit beschränkter Haftung (FSB)\nGesellschaft mit beschränkter Haftung\nFreiburg im Breisgau\n\nDie Gesellschaft hat am 11.03.2025 die Liste über die Zusammensetzung des Aufsichtsrats zum Handelsregister eingereicht."
    },
    {
      "date": "2025-03-11",
      "id": "103410",
      "original_text": "Löschungsankündigung\nBaden-Württemberg Amtsgericht Mannheim HRB 9663\nS & N Sanierung & Neubau GmbH – Mannheim",
      "type": "Löschungsankündigung",
      "state": "Baden-Württemberg",
      "amtsgericht": "Amtsgericht Mannheim",
      "registernummer": "HRB 9663",
      "registerart": "HRB",
      "company_name": "S & N Sanierung & Neubau GmbH",
      "company_seat": "Mannheim",
      "details": "11.03.2025 (Bekanntmachungsdatum)\n\nBaden-Württemberg Amtsgericht Mannheim HRB 9663\nLöschungsankündigung\n\nS & N Sanierung & Neubau GmbH\nGesellschaft mit beschränkter Haftung\nMannheim\n\nAls nicht eingetragen wird bekanntgemacht:\nDas Gericht beabsichtigt, die Gesellschaft wegen Vermögenslosigkeit im Handelsregister von Amts wegen nach § 394 FamFG zu löschen. Die Frist zur Geltendmachung eines Widerspruchs gegen die beabsichtigte Löschung ist auf einen Monat ab Veröffentlichung bestimmt."
    },
    {
      "date": "2025-03-11",
      "id": "103411",
      "original_text": "Löschungsankündigung\nBaden-Württemberg Amtsgericht Mannheim HRB 460705\nBlatz-Werbung GmbH – Buchen Odenwald",
      "type": "Löschungsankündigung",
      "state": "Baden-Württemberg",
      "amtsgericht": "Amtsgericht Mannheim",
      "registernummer": "HRB 460705",
      "registerart": "HRB",
      "company_name": "Blatz-Werbung GmbH",
      "company_seat": "Buchen Odenwald",
      "details": "11.03.2025 (Bekanntmachungsdatum)\n\nBaden-Württemberg Amtsgericht Mannheim HRB 460705\nLöschungsankündigung\n\nBlatz-Werbung GmbH\nGesellschaft mit beschränkter Haftung\nBuchen Odenwald\n\nDas Gericht beabsichtigt, die Gesellschaft wegen Vermögenslosigkeit im Handelsregister von Amts wegen nach § 394 FamFG zu löschen. Die Frist zur Geltendmachung eines Widerspruchs gegen die beabsichtigte Löschung ist auf einen Monat ab Veröffentlichung bestimmt."
    },
    {
      "date": "2025-03-11",
      "id": "103412",
      "original_text": "Registerbekanntmachung nach dem Umwandlungsgesetz\nMecklenburg-Vorpommern Amtsgericht Stralsund HRB 22801\neco office GmbH – Grimmen",
      "type": "Registerbekanntmachung nach dem Umwandlungsgesetz",
      "state": "Mecklenburg-Vorpommern",
      "amtsgericht": "Amtsgericht Stralsund",
      "registernummer": "HRB 22801",
      "registerart": "HRB",
      "company_name": "eco office GmbH",
      "company_seat": "Grimmen",
      "details": "11.03.2025 (Bekanntmachungsdatum)\n\nMecklenburg-Vorpommern Amtsgericht Stralsund HRB 22801\nRegisterbekanntmachung nach dem Umwandlungsgesetz 11.03.2025 (Eintragungsdatum)\n\neco office GmbH\nGesellschaft mit beschränkter Haftung\nGrimmen\n\nAls nicht eingetragen wird veröffentlicht: Den Gläubigern der an der Spaltung beteiligten Rechtsträger ist, wenn sie binnen sechs Monaten nach dem Tag, an dem die Eintragung der Spaltung in das Register des Sitzes desjenigen Rechtsträgers, dessen Gläubiger sie sind, nach § 19 Abs. 3 UmwG als bekannt gemacht gilt, ihren Anspruch nach Grund und Höhe schriftlich anmelden, Sicherheit zu leisten, soweit sie nicht Befriedigung verlangen können. Dieses Recht steht den Gläubigern jedoch nur zu, wenn sie glaubhaft machen, dass durch die Spaltung die Erfüllung der Forderung gefährdet wird."
    },
    {
      "date": "2025-03-11",
      "id": "103413",
      "original_text": "Löschungsankündigung\nBaden-Württemberg Amtsgericht Mannheim HRB 723352\nViceram Verwaltungs-GmbH – Heidelberg",
      "type": "Löschungsankündigung",
      "state": "Baden-Württemberg",
      "amtsgericht": "Amtsgericht Mannheim",
      "registernummer": "HRB 723352",
      "registerart": "HRB",
      "company_name": "Viceram Verwaltungs-GmbH",
      "company_seat": "Heidelberg",
      "details": "11.03.2025 (Bekanntmachungsdatum)\n\nBaden-Württemberg Amtsgericht Mannheim HRB 723352\nLöschungsankündigung\n\nViceram Verwaltungs-GmbH\nGesellschaft mit beschränkter Haftung\nHeidelberg\n\nDas Gericht beabsichtigt, die Gesellschaft wegen Vermögenslosigkeit im Handelsregister von Amts wegen nach § 394 FamFG zu löschen. Die Frist zur Geltendmachung eines Widerspruchs gegen die beabsichtigte Löschung ist auf einen Monat ab Veröffentlichung bestimmt."
    },
    {
      "date": "2025-03-11",
      "id": "103414",
      "original_text": "Einreichung neuer Dokumente\nBaden-Württemberg Amtsgericht Stuttgart HRB 728000\nThales Deutschland GmbH – Stuttgart",
      "type": "Einreichung neuer Dokumente",
      "state": "Baden-Württemberg",
      "amtsgericht": "Amtsgericht Stuttgart",
      "registernummer": "HRB 728000",
      "registerart": "HRB",
      "company_name": "Thales Deutschland GmbH",
      "company_seat": "Stuttgart",
      "details": "11.03.2025 (Bekanntmachungsdatum)\n\nBaden-Württemberg Amtsgericht Stuttgart HRB 728000\nEinreichung neuer Dokumente\n\nThales Deutschland GmbH\nGesellschaft mit beschränkter Haftung\nStuttgart\n\nDie Gesellschaft hat am 07.03.2025 die Liste über die Zusammensetzung des Aufsichtsrats zum Handelsregister eingereicht."
    },
    {
      "date": "2025-03-11",
      "id": "103415",
      "original_text": "Löschungsankündigung\nBerlin Amtsgericht Berlin (Charlottenburg) HRB 150430\nFCL Fettchenhauer Construction GmbH – Berlin",
      "type": "Löschungsankündigung",
      "state": "Berlin",
      "amtsgericht": "Amtsgericht Berlin (Charlottenburg)",
      "registernummer": "HRB 150430",
      "registerart": "HRB",
      "company_name": "FCL Fettchenhauer Construction GmbH",
      "company_seat": "Berlin",
      "details": "11.03.2025 (Bekanntmachungsdatum)\n\nBerlin Amtsgericht Berlin (Charlottenburg) HRB 150430\nLöschungsankündigung\n\nFCL Fettchenhauer Construction GmbH\nGesellschaft mit beschränkter Haftung\nBerlin\n\nBei der nachstehenden Gesellschaft wird das Amtslöschungsverfahren gemäß § 394 FamFG eingeleitet. Widerspruchsfrist: 6 Wochen."
    },
    {
      "date": "2025-03-11",
      "id": "103416",
      "original_text": "Löschungsankündigung\nBrandenburg Amtsgericht Potsdam HRB 25887\nVIASOLIS UG (haftungsbeschränkt) – Rathenow",
      "type": "Löschungsankündigung",
      "state": "Brandenburg",
      "amtsgericht": "Amtsgericht Potsdam",
      "registernummer": "HRB 25887",
      "registerart": "HRB",
      "company_name": "VIASOLIS UG (haftungsbeschränkt)",
      "company_seat": "Rathenow",
      "details": "11.03.2025 (Bekanntmachungsdatum)\n\nBrandenburg Amtsgericht Potsdam HRB 25887\nLöschungsankündigung\n\nVIASOLIS UG (haftungsbeschränkt)\nGesellschaft mit beschränkter Haftung\nRathenow\n\nBei der nachstehenden Gesellschaft wird das Amtslöschungsverfahren gemäß § 394 FamFG eingeleitet. Widerspruchsfrist: 8 Wochen"
    },
    {
      "date": "2025-03-11",
      "id": "103417",
      "original_text": "Registerbekanntmachung nach dem Umwandlungsgesetz\nBaden-Württemberg Amtsgericht Stuttgart HRA 742168\nKarlheinz Hüftlein e.K. – Stuttgart",
      "type": "Registerbekanntmachung nach dem Umwandlungsgesetz",
      "state": "Baden-Württemberg",
      "amtsgericht": "Amtsgericht Stuttgart",
      "registernummer": "HRA 742168",
      "registerart": "HRA",
      "company_name": "Karlheinz Hüftlein e.K.",
      "company_seat": "Stuttgart",
      "details": "11.03.2025 (Bekanntmachungsdatum)\n\nBaden-Württemberg Amtsgericht Stuttgart HRA 742168\nRegisterbekanntmachung nach dem Umwandlungsgesetz 11.03.2025 (Eintragungsdatum)\n\nKarlheinz Hüftlein e.K.\nEinzelkaufmann / Einzelkauffrau\nStuttgart\n\nAls nicht eingetragen wird bekanntgemacht:\nDen Gläubigern der an der Verschmelzung beteiligten Rechtsträger ist, wenn sie binnen sechs Monaten nach dem Tag, an dem die Eintragung der Verschmelzung in das Register des Sitzes desjenigen Rechtsträgers, dessen Gläubiger sie sind, nach § 19 Abs. 3 UmwG als bekanntgemacht gilt, ihren Anspruch nach Grund und Höhe schriftlich anmelden, Sicherheit zu leisten, soweit sie nicht Befriedigung verlangen können. Dieses Recht steht den Gläubigern jedoch nur zu, wenn sie glaubhaft machen, dass durch die Verschmelzung die Erfüllung ihrer Forderung gefährdet wird."
    },
    {
      "date": "2025-03-11",
      "id": "103418",
      "original_text": "Registerbekanntmachung nach dem Umwandlungsgesetz\nBerlin Amtsgericht Berlin (Charlottenburg) HRB 154517\nAxel Springer SE – Berlin",
      "type": "Registerbekanntmachung nach dem Umwandlungsgesetz",
      "state": "Berlin",
      "amtsgericht": "Amtsgericht Berlin (Charlottenburg)",
      "registernummer": "HRB 154517",
      "registerart": "HRB",
      "company_name": "Axel Springer SE",
      "company_seat": "Berlin",
      "details": "11.03.2025 (Bekanntmachungsdatum)\n\nBerlin Amtsgericht Berlin (Charlottenburg) HRB 154517\nRegisterbekanntmachung nach dem Umwandlungsgesetz 10.03.2025 (Eintragungsdatum)\n\nAxel Springer SE\nEuropäische Aktiengesellschaft (SE)\nBerlin\n\nZu Eintragungsnummer 105 vom 10.03.2025 wird als nicht eingetragen veröffentlicht: Den Gläubigern der an der Verschmelzung beteiligten Rechtsträger ist, wenn sie binnen sechs Monaten nach dem Tag, an dem die Eintragung der Verschmelzung in das Register des Sitzes desjenigen Rechtsträgers, dessen Gläubiger sie sind, als bekannt gemacht gilt, ihren Anspruch nach Grund und Höhe schriftlich anmelden, Sicherheit zu leisten, soweit sie nicht Befriedigung verlangen können. Dieses Recht steht den Gläubigern jedoch nur zu, wenn sie glaubhaft machen, dass durch die Verschmelzung die Erfüllung ihrer Forderung gefährdet wird. Das Recht, Sicherheitsleistung zu verlangen, steht Gläubigern nicht zu, die im Falle der Insolvenz ein Recht auf vorzugsweise Befriedigung aus einer Deckungsmasse haben, die nach gesetzlicher Vorschrift zu ihrem Schutz errichtet und staatlich überwacht ist."
    },
    {
      "date": "2025-03-11",
      "id": "103419",
      "original_text": "Registerbekanntmachung nach dem Umwandlungsgesetz\nBerlin Amtsgericht Berlin (Charlottenburg) HRB 87210\nAxel Springer Digital GmbH – Berlin",
      "type": "Registerbekanntmachung nach dem Umwandlungsgesetz",
      "state": "Berlin",
      "amtsgericht": "Amtsgericht Berlin (Charlottenburg)",
      "registernummer": "HRB 87210",
      "registerart": "HRB",
      "company_name": "Axel Springer Digital GmbH",
      "company_seat": "Berlin",
      "details": "11.03.2025 (Bekanntmachungsdatum)\n\nBerlin Amtsgericht Berlin (Charlottenburg) HRB 87210\nRegisterbekanntmachung nach dem Umwandlungsgesetz 10.03.2025 (Eintragungsdatum)\n\nAxel Springer Digital GmbH\nGesellschaft mit beschränkter Haftung\nBerlin\n\nZu Eintragungsnummer 38 vom 10.03.2025 wird als nicht eingetragen veröffentlicht: Den Gläubigern der an der Verschmelzung beteiligten Rechtsträger ist, wenn sie binnen sechs Monaten nach dem Tag, an dem die Eintragung der Verschmelzung in das Register des Sitzes desjenigen Rechtsträgers, dessen Gläubiger sie sind, als bekannt gemacht gilt, ihren Anspruch nach Grund und Höhe schriftlich anmelden, Sicherheit zu leisten, soweit sie nicht Befriedigung verlangen können. Dieses Recht steht den Gläubigern jedoch nur zu, wenn sie glaubhaft machen, dass durch die Verschmelzung die Erfüllung ihrer Forderung gefährdet wird. Das Recht, Sicherheitsleistung zu verlangen, steht Gläubigern nicht zu, die im Falle der Insolvenz ein Recht auf vorzugsweise Befriedigung aus einer Deckungsmasse haben, die nach gesetzlicher Vorschrift zu ihrem Schutz errichtet und staatlich überwacht ist."
    },
    {
      "date": "2025-03-11",
      "id": "103420",
      "original_text": "Löschungsankündigung\nBaden-Württemberg Amtsgericht Mannheim HRB 721030\nM.A.T. Rhein-Main Bau GmbH – Neckargemünd",
      "type": "Löschungsankündigung",
      "state": "Baden-Württemberg",
      "amtsgericht": "Amtsgericht Mannheim",
      "registernummer": "HRB 721030",
      "registerart": "HRB",
      "company_name": "M.A.T. Rhein-Main Bau GmbH",
      "company_seat": "Neckargemünd",
      "details": "11.03.2025 (Bekanntmachungsdatum)\n\nBaden-Württemberg Amtsgericht Mannheim HRB 721030\nLöschungsankündigung\n\nM.A.T. Rhein-Main Bau GmbH\nGesellschaft mit beschränkter Haftung\nNeckargemünd\n\nAls nicht eingetragen wird bekanntgemacht:\nDas Gericht beabsichtigt, die Gesellschaft wegen Vermögenslosigkeit im Handelsregister von Amts wegen nach § 394 FamFG zu löschen. Die Frist zur Geltendmachung eines Widerspruchs gegen die beabsichtigte Löschung ist auf einen Monat ab Veröffentlichung bestimmt."
    },
    {
      "date": "2025-03-11",
      "id": "103421",
      "original_text": "Löschungsankündigung\nBaden-Württemberg Amtsgericht Mannheim HRB 719572\nPARKER&SON INTERNATIONAL TRADING LTD – Dielheim",
      "type": "Löschungsankündigung",
      "state": "Baden-Württemberg",
      "amtsgericht": "Amtsgericht Mannheim",
      "registernummer": "HRB 719572",
      "registerart": "HRB",
      "company_name": "PARKER&SON INTERNATIONAL TRADING LTD",
      "company_seat": "Dielheim",
      "details": "11.03.2025 (Bekanntmachungsdatum)\n\nBaden-Württemberg Amtsgericht Mannheim HRB 719572\nLöschungsankündigung\n\nPARKER&SON INTERNATIONAL TRADING LTD\nRechtsform ausländischen Rechts HRB\nDielheim\n\nDas Gericht beabsichtigt, die Eintragung der Zweigniederlassung im Handelsregister wegen des Mangels einer wesentlichen Voraussetzung von Amts wegen nach § 395 FamFG als unzulässig zu löschen. Die Frist zur Geltendmachung eines Widerspruchs gegen die beabsichtigte Löschung ist auf einen Monat ab Veröffentlichung bestimmt."
    },
    {
      "date": "2025-03-11",
      "id": "103422",
      "original_text": "Löschungsankündigung\nMecklenburg-Vorpommern Amtsgericht Schwerin HRA 1667\nMargit Sänger e. K. – Hagenow",
      "type": "Löschungsankündigung",
      "state": "Mecklenburg-Vorpommern",
      "amtsgericht": "Amtsgericht Schwerin",
      "registernummer": "HRA 1667",
      "registerart": "HRA",
      "company_name": "Margit Sänger e. K.",
      "company_seat": "Hagenow",
      "details": "11.03.2025 (Bekanntmachungsdatum)\n\nMecklenburg-Vorpommern Amtsgericht Schwerin HRA 1667\nLöschungsankündigung\n\nMargit Sänger e. K.\nEinzelkaufmann / Einzelkauffrau\nHagenow\n\nDas Amtsgericht Schwerin, Handelsregisterabteilung, beabsichtigt den o.g. Kaufmann gemäß § 31 Abs. 2, § 393 FamFG von Amts wegen zu löschen, wenn nicht binnen eines Monats nach dieser Bekanntmachung hiergegen Widerspruch erhoben wird."
    },
    {
      "date": "2025-03-11",
      "id": "103423",
      "original_text": "Löschungsankündigung\nBrandenburg Amtsgericht Potsdam HRB 28157\nFreiraum Invest GmbH – Kleinmachnow",
      "type": "Löschungsankündigung",
      "state": "Brandenburg",
      "amtsgericht": "Amtsgericht Potsdam",
      "registernummer": "HRB 28157",
      "registerart": "HRB",
      "company_name": "Freiraum Invest GmbH",
      "company_seat": "Kleinmachnow",
      "details": "11.03.2025 (Bekanntmachungsdatum)\n\nBrandenburg Amtsgericht Potsdam HRB 28157\nLöschungsankündigung\n\nFreiraum Invest GmbH\nGesellschaft mit beschränkter Haftung\nKleinmachnow\n\nBei der nachstehenden Gesellschaft wird das Amtslöschungsverfahren gemäß § 394 FamFG eingeleitet. Widerspruchsfrist: 8 Wochen"
    },
    {
      "date": "2025-03-11",
      "id": "103424",
      "original_text": "Einreichung neuer Dokumente\nBrandenburg Amtsgericht Cottbus HRB 4922\nWBD Energiegesellschaft Drebkau mbH – Drebkau",
      "type": "Einreichung neuer Dokumente",
      "state": "Brandenburg",
      "amtsgericht": "Amtsgericht Cottbus",
      "registernummer": "HRB 4922",
      "registerart": "HRB",
      "company_name": "WBD Energiegesellschaft Drebkau mbH",
      "company_seat": "Drebkau",
      "details": "11.03.2025 (Bekanntmachungsdatum)\n\nBrandenburg Amtsgericht Cottbus HRB 4922\nEinreichung neuer Dokumente\n\nWBD Energiegesellschaft Drebkau mbH\nGesellschaft mit beschränkter Haftung\nDrebkau\n\nAls nicht eingetragen wird veröffentlicht:\nDer Geschäftsführer hat eine Liste der Beiratsmitglieder gem. § 52 Abs. 2 Satz 2 GmbHG zum Handelsregister eingereicht"
    },
    {
      "date": "2025-03-11",
      "id": "103425",
      "original_text": "Einreichung neuer Dokumente\nBaden-Württemberg Amtsgericht Freiburg HRB 703905\nMEDICLIN Aktiengesellschaft – Offenburg",
      "type": "Einreichung neuer Dokumente",
      "state": "Baden-Württemberg",
      "amtsgericht": "Amtsgericht Freiburg",
      "registernummer": "HRB 703905",
      "registerart": "HRB",
      "company_name": "MEDICLIN Aktiengesellschaft",
      "company_seat": "Offenburg",
      "details": "11.03.2025 (Bekanntmachungsdatum)\n\nBaden-Württemberg Amtsgericht Freiburg HRB 703905\nEinreichung neuer Dokumente\n\nMEDICLIN Aktiengesellschaft\nAktiengesellschaft\nOffenburg\n\nDie Gesellschaft hat am 10.03.2025 die Liste über die Zusammensetzung des Aufsichtsrats zum Handelsregister eingereicht."
    },
    {
      "date": "2025-03-11",
      "id": "103426",
      "original_text": "Einreichung neuer Dokumente\nBrandenburg Amtsgericht Cottbus HRB 16932\nWBD Netzgesellschaft Drebkau mbH – Drebkau",
      "type": "Einreichung neuer Dokumente",
      "state": "Brandenburg",
      "amtsgericht": "Amtsgericht Cottbus",
      "registernummer": "HRB 16932",
      "registerart": "HRB",
      "company_name": "WBD Netzgesellschaft Drebkau mbH",
      "company_seat": "Drebkau",
      "details": "11.03.2025 (Bekanntmachungsdatum)\n\nBrandenburg Amtsgericht Cottbus HRB 16932\nEinreichung neuer Dokumente\n\nWBD Netzgesellschaft Drebkau mbH\nGesellschaft mit beschränkter Haftung\nDrebkau\n\nAls nicht eingetragen wird veröffentlicht:\nDer Geschäftsführer hat eine Liste der Beiratsmitglieder gem. § 52 Abs. 2 Satz 2 GmbHG zum Handelsregister eingereicht"
    },
    {
      "date": "2025-03-11",
      "id": "103427",
      "original_text": "Registerbekanntmachung nach dem Umwandlungsgesetz\nBrandenburg Amtsgericht Potsdam HRA 8381\nWulkow & Wulkow OHG – Kloster Lehnin",
      "type": "Registerbekanntmachung nach dem Umwandlungsgesetz",
      "state": "Brandenburg",
      "amtsgericht": "Amtsgericht Potsdam",
      "registernummer": "HRA 8381",
      "registerart": "HRA",
      "company_name": "Wulkow & Wulkow OHG",
      "company_seat": "Kloster Lehnin",
      "details": "11.03.2025 (Bekanntmachungsdatum)\n\nBrandenburg Amtsgericht Potsdam HRA 8381\nRegisterbekanntmachung nach dem Umwandlungsgesetz 08.03.2025 (Eintragungsdatum)\n\nWulkow & Wulkow OHG\nOffene Handelsgesellschaft\nKloster Lehnin\n\nZu Eintragungsnummer 2 vom 08.03.2025 wird als nicht eingetragen veröffentlicht:\nDen Gläubigern der am Formwechsel beteiligten Rechtsträger ist, wenn sie binnen sechs Monaten nach dem Tag, an dem die Eintragung des Formwechsels nach § 201 UmwG als bekannt gemacht gilt, ihren Anspruch nach Grund und Höhe schriftlich anmelden, Sicherheit zu leisten, soweit sie nicht Befriedigung erlangen können. Dieses Recht steht den Gläubigern jedoch nur zu, wenn sie glaubhaft machen, dass durch den Formwechsel die Erfüllung ihrer Forderung gefährdet wird."
    },
    {
      "date": "2025-03-11",
      "id": "103428",
      "original_text": "Sonstige Registerbekanntmachung\nBrandenburg Amtsgericht Cottbus HRB 13169\nDATIW UG (haftungsbeschränkt) – Cottbus",
      "type": "Sonstige Registerbekanntmachung",
      "state": "Brandenburg",
      "amtsgericht": "Amtsgericht Cottbus",
      "registernummer": "HRB 13169",
      "registerart": "HRB",
      "company_name": "DATIW UG (haftungsbeschränkt)",
      "company_seat": "Cottbus",
      "details": "11.03.2025 (Bekanntmachungsdatum)\n\nBrandenburg Amtsgericht Cottbus HRB 13169\nSonstige Registerbekanntmachung\n\nDATIW UG (haftungsbeschränkt)\nGesellschaft mit beschränkter Haftung\nCottbus\n\nAls nicht eingetragen wird veröffentlicht: Das Registergericht beabsichtigt die Eintragung des Geschäftsführers gem. § 395 FamFG zu löschen."
    },
    {
      "date": "2025-03-11",
      "id": "103429",
      "original_text": "Löschungsankündigung\nSchleswig-Holstein Amtsgericht Flensburg HRB 3978\nAuto Weding Kraftfahrzeuge GmbH – Handewitt",
      "type": "Löschungsankündigung",
      "state": "Schleswig-Holstein",
      "amtsgericht": "Amtsgericht Flensburg",
      "registernummer": "HRB 3978",
      "registerart": "HRB",
      "company_name": "Auto Weding Kraftfahrzeuge GmbH",
      "company_seat": "Handewitt",
      "details": "11.03.2025 (Bekanntmachungsdatum)\n\nSchleswig-Holstein Amtsgericht Flensburg HRB 3978\nLöschungsankündigung\n\nAuto Weding Kraftfahrzeuge GmbH\nGesellschaft mit beschränkter Haftung\nHandewitt\n\nEs ist die Löschung der nachstehenden Gesellschaft wegen Vermögenslosigkeit gemäß § 394 FamFG beabsichtigt.\nWiderspruchsfrist: 2 Monate."
    },
    {
      "date": "2025-03-11",
      "id": "103430",
      "original_text": "Löschungsankündigung\nSchleswig-Holstein Amtsgericht Pinneberg HRB 17099\nAna-Maria Reinigungsservice UG (haftungsbeschränkt) – Uetersen",
      "type": "Löschungsankündigung",
      "state": "Schleswig-Holstein",
      "amtsgericht": "Amtsgericht Pinneberg",
      "registernummer": "HRB 17099",
      "registerart": "HRB",
      "company_name": "Ana-Maria Reinigungsservice UG (haftungsbeschränkt)",
      "company_seat": "Uetersen",
      "details": "11.03.2025 (Bekanntmachungsdatum)\n\nSchleswig-Holstein Amtsgericht Pinneberg HRB 17099\nLöschungsankündigung\n\nAna-Maria Reinigungsservice UG (haftungsbeschränkt)\nGesellschaft mit beschränkter Haftung\nUetersen\n\nEs ist die Löschung der nachstehenden Gesellschaft wegen Vermögenslosigkeit gemäß § 394 FamFG beabsichtigt. Widerspruchsfrist: 2 Monate."
    },
    {
      "date": "2025-03-11",
      "id": "103431",
      "original_text": "Registerbekanntmachung nach dem Umwandlungsgesetz\nSchleswig-Holstein Amtsgericht Flensburg HRB 17371\nMut Project UG (haftungsbeschränkt). – Selk",
      "type": "Registerbekanntmachung nach dem Umwandlungsgesetz",
      "state": "Schleswig-Holstein",
      "amtsgericht": "Amtsgericht Flensburg",
      "registernummer": "HRB 17371",
      "registerart": "HRB",
      "company_name": "Mut Project UG (haftungsbeschränkt).",
      "company_seat": "Selk",
      "details": "11.03.2025 (Bekanntmachungsdatum)\n\nSchleswig-Holstein Amtsgericht Flensburg HRB 17371\nRegisterbekanntmachung nach dem Umwandlungsgesetz 11.03.2025 (Eintragungsdatum)\n\nMut Project UG (haftungsbeschränkt).\nGesellschaft mit beschränkter Haftung\nSelk\n\nZu Eintragungsnummer 2 vom 11.03.2025 wird als nicht eingetragen veröffentlicht: Den Gläubigern der an der Verschmelzung beteiligten Rechtsträger ist, wenn sie binnen sechs Monaten nach dem Tag, an dem die Eintragung der Verschmelzung in das Register des Sitzes desjenigen Rechtsträgers, dessen Gläubiger sie sind, als bekannt gemacht gilt, ihren Anspruch nach Grund und Höhe in Textform anmelden, Sicherheit zu leisten, soweit sie nicht Befriedigung verlangen können. Dieses Recht steht den Gläubigern jedoch nur zu, wenn sie glaubhaft machen, dass durch die Verschmelzung die Erfüllung ihrer Forderung gefährdet wird."
    },
    {
      "date": "2025-03-11",
      "id": "103432",
      "original_text": "Löschungsankündigung\nBaden-Württemberg Amtsgericht Mannheim HRB 707546\nPremium Immobilien Karlsruhe UG (haftungsbeschränkt) – Karlsruhe",
      "type": "Löschungsankündigung",
      "state": "Baden-Württemberg",
      "amtsgericht": "Amtsgericht Mannheim",
      "registernummer": "HRB 707546",
      "registerart": "HRB",
      "company_name": "Premium Immobilien Karlsruhe UG (haftungsbeschränkt)",
      "company_seat": "Karlsruhe",
      "details": "11.03.2025 (Bekanntmachungsdatum)\n\nBaden-Württemberg Amtsgericht Mannheim HRB 707546\nLöschungsankündigung\n\nPremium Immobilien Karlsruhe UG (haftungsbeschränkt)\nGesellschaft mit beschränkter Haftung\nKarlsruhe\n\nDas Gericht beabsichtigt, die Gesellschaft wegen Vermögenslosigkeit im Handelsregister von Amts wegen nach § 394 FamFG zu löschen. Die Frist zur Geltendmachung eines Widerspruchs gegen die beabsichtigte Löschung ist auf einen Monat ab Veröffentlichung bestimmt."
    },
    {
      "date": "2025-03-11",
      "id": "103433",
      "original_text": "Löschungsankündigung\nBrandenburg Amtsgericht Frankfurt/Oder HRB 13946\nTrio-Bau UG (haftungsbeschränkt) – Bad Freienwalde (Oder)",
      "type": "Löschungsankündigung",
      "state": "Brandenburg",
      "amtsgericht": "Amtsgericht Frankfurt/Oder",
      "registernummer": "HRB 13946",
      "registerart": "HRB",
      "company_name": "Trio-Bau UG (haftungsbeschränkt)",
      "company_seat": "Bad Freienwalde (Oder)",
      "details": "11.03.2025 (Bekanntmachungsdatum)\n\nBrandenburg Amtsgericht Frankfurt/Oder HRB 13946\nLöschungsankündigung\n\nTrio-Bau UG (haftungsbeschränkt)\nGesellschaft mit beschränkter Haftung\nBad Freienwalde (Oder)\n\nBei der nachstehenden Gesellschaft wird das Amtslöschungsverfahren gemäß § 394 Abs. 1 FamFG eingeleitet."
    },
    {
      "date": "2025-03-11",
      "id": "103434",
      "original_text": "Registerbekanntmachung nach dem Umwandlungsgesetz\nHamburg Amtsgericht Hamburg HRB 178464\nProVia Service GmbH – Hamburg",
      "type": "Registerbekanntmachung nach dem Umwandlungsgesetz",
      "state": "Hamburg",
      "amtsgericht": "Amtsgericht Hamburg",
      "registernummer": "HRB 178464",
      "registerart": "HRB",
      "company_name": "ProVia Service GmbH",
      "company_seat": "Hamburg",
      "details": "11.03.2025 (Bekanntmachungsdatum)\n\nHamburg Amtsgericht Hamburg HRB 178464\nRegisterbekanntmachung nach dem Umwandlungsgesetz 11.03.2025 (Eintragungsdatum)\n\nProVia Service GmbH\nGesellschaft mit beschränkter Haftung\nHamburg\n\nAls nicht eingetragen wird bekannt gemacht:\nDen Gläubigern der an der Verschmelzung beteiligten Gesellschaften ist, wenn sie binnen sechs Monaten nach dem Tag, an dem die Eintragung der Verschmelzung in das Register des Sitzes derjenigen Rechtsträger deren Gläubiger sie sind, nach § 19 Absatz 3 UmwG als bekannt gemacht gilt, ihren Anspruch nach Grund und Höhe schriftlich anmelden, Sicherheit zu leisten, soweit sie nicht Befriedigung verlangen können. Dieses Recht steht den Gläubigern jedoch nur zu, wenn sie glaubhaft machen, dass durch die Verschmelzung die Erfüllung ihrer Forderung gefährdet wird."
    },
    {
      "date": "2025-03-11",
      "id": "103435",
      "original_text": "Registerbekanntmachung nach dem Umwandlungsgesetz\nHamburg Amtsgericht Hamburg HRB 178329\nTopWork -TW- GmbH – Hamburg",
      "type": "Registerbekanntmachung nach dem Umwandlungsgesetz",
      "state": "Hamburg",
      "amtsgericht": "Amtsgericht Hamburg",
      "registernummer": "HRB 178329",
      "registerart": "HRB",
      "company_name": "TopWork -TW- GmbH",
      "company_seat": "Hamburg",
      "details": "11.03.2025 (Bekanntmachungsdatum)\n\nHamburg Amtsgericht Hamburg HRB 178329\nRegisterbekanntmachung nach dem Umwandlungsgesetz 11.03.2025 (Eintragungsdatum)\n\nTopWork -TW- GmbH\nGesellschaft mit beschränkter Haftung\nHamburg\n\nAls nicht eingetragen wird bekannt gemacht:\nDen Gläubigern der an der Verschmelzung beteiligten Gesellschaften ist, wenn sie binnen sechs Monaten nach dem Tag, an dem die Eintragung der Verschmelzung in das Register des Sitzes desjenigen Rechtsträgers, dessen Gläubiger sie sind, nach § 19 Absatz 3 UmwG als bekannt gemacht gilt, ihren Anspruch nach Grund und Höhe schriftlich anmelden, Sicherheit zu leisten, soweit sie nicht Befriedigung verlangen können. Dieses Recht steht den Gläubigern jedoch nur zu, wenn sie glaubhaft machen, dass durch die Verschmelzung die Erfüllung ihrer Forderung gefährdet wird."
    },
    {
      "date": "2025-03-11",
      "id": "103436",
      "original_text": "Registerbekanntmachung nach dem Umwandlungsgesetz\nHamburg Amtsgericht Hamburg HRB 178324\nFunFood -FF- GmbH – Hamburg",
      "type": "Registerbekanntmachung nach dem Umwandlungsgesetz",
      "state": "Hamburg",
      "amtsgericht": "Amtsgericht Hamburg",
      "registernummer": "HRB 178324",
      "registerart": "HRB",
      "company_name": "FunFood -FF- GmbH",
      "company_seat": "Hamburg",
      "details": "11.03.2025 (Bekanntmachungsdatum)\n\nHamburg Amtsgericht Hamburg HRB 178324\nRegisterbekanntmachung nach dem Umwandlungsgesetz 11.03.2025 (Eintragungsdatum)\n\nFunFood -FF- GmbH\nGesellschaft mit beschränkter Haftung\nHamburg\n\nAls nicht eingetragen wird bekannt gemacht:\nDen Gläubigern der an der Verschmelzung beteiligten Gesellschaften ist, wenn sie binnen sechs Monaten nach dem Tag, an dem die Eintragung der Verschmelzung in das Register des Sitzes desjenigen Rechtsträgers, dessen Gläubiger sie sind, nach § 19 Absatz 3 UmwG als bekannt gemacht gilt, ihren Anspruch nach Grund und Höhe schriftlich anmelden, Sicherheit zu leisten, soweit sie nicht Befriedigung verlangen können. Dieses Recht steht den Gläubigern jedoch nur zu, wenn sie glaubhaft machen, dass durch die Verschmelzung die Erfüllung ihrer Forderung gefährdet wird."
    },
    {
      "date": "2025-03-11",
      "id": "103437",
      "original_text": "Löschungsankündigung\nMecklenburg-Vorpommern Amtsgericht Schwerin HRB 13894\nAK Beratungsgesellschaft mbH – Schildetal",
      "type": "Löschungsankündigung",
      "state": "Mecklenburg-Vorpommern",
      "amtsgericht": "Amtsgericht Schwerin",
      "registernummer": "HRB 13894",
      "registerart": "HRB",
      "company_name": "AK Beratungsgesellschaft mbH",
      "company_seat": "Schildetal",
      "details": "11.03.2025 (Bekanntmachungsdatum)\n\nMecklenburg-Vorpommern Amtsgericht Schwerin HRB 13894\nLöschungsankündigung\n\nAK Beratungsgesellschaft mbH\nGesellschaft mit beschränkter Haftung\nSchildetal\n\nDas Registergericht beabsichtigt, die im Handelsregister eingetragene Gesellschaft von Amts wegen nach § 395 FamFG zu löschen. Die Frist zur Erhebung eines Widerspruchs gegen die beabsichtigte Löschung wird auf 1 Monat festgesetzt."
    },
    {
      "date": "2025-03-11",
      "id": "103438",
      "original_text": "Löschungsankündigung\nBrandenburg Amtsgericht Potsdam HRB 25685\nPerion-Finanz UG (haftungsbeschränkt) – Groß Kreutz (Havel)",
      "type": "Löschungsankündigung",
      "state": "Brandenburg",
      "amtsgericht": "Amtsgericht Potsdam",
      "registernummer": "HRB 25685",
      "registerart": "HRB",
      "company_name": "Perion-Finanz UG (haftungsbeschränkt)",
      "company_seat": "Groß Kreutz (Havel)",
      "details": "11.03.2025 (Bekanntmachungsdatum)\n\nBrandenburg Amtsgericht Potsdam HRB 25685\nLöschungsankündigung\n\nPerion-Finanz UG (haftungsbeschränkt)\nGesellschaft mit beschränkter Haftung\nGroß Kreutz (Havel)\n\nBei der nachstehenden Gesellschaft wird das Amtslöschungsverfahren gemäß § 394 FamFG eingeleitet."
    },
    {
      "date": "2025-03-11",
      "id": "103439",
      "original_text": "Löschungsankündigung\nSachsen Amtsgericht Dresden HRB 42951\nQay Montage & Handels GmbH – Dresden",
      "type": "Löschungsankündigung",
      "state": "Sachsen",
      "amtsgericht": "Amtsgericht Dresden",
      "registernummer": "HRB 42951",
      "registerart": "HRB",
      "company_name": "Qay Montage & Handels GmbH",
      "company_seat": "Dresden",
      "details": "11.03.2025 (Bekanntmachungsdatum)\n\nSachsen Amtsgericht Dresden HRB 42951\nLöschungsankündigung\n\nQay Montage & Handels GmbH\nGesellschaft mit beschränkter Haftung\nDresden\n\nDas Registergericht beabsichtigt, die im Handelsregister eingetragene Gesellschaft von Amts wegen nach § 394 FamFG zu löschen. Die Frist zu Erhebung eines Widerspruchs gegen die beabsichtigte Löschung wird auf einen Monat festgesetzt."
    },
    {
      "date": "2025-03-11",
      "id": "103440",
      "original_text": "Registerbekanntmachung nach dem Umwandlungsgesetz\nSachsen Amtsgericht Leipzig HRB 39546\nThermocryl Tageslichttechnik GmbH – Jesewitz",
      "type": "Registerbekanntmachung nach dem Umwandlungsgesetz",
      "state": "Sachsen",
      "amtsgericht": "Amtsgericht Leipzig",
      "registernummer": "HRB 39546",
      "registerart": "HRB",
      "company_name": "Thermocryl Tageslichttechnik GmbH",
      "company_seat": "Jesewitz",
      "details": "11.03.2025 (Bekanntmachungsdatum)\n\nSachsen Amtsgericht Leipzig HRB 39546\nRegisterbekanntmachung nach dem Umwandlungsgesetz 11.03.2025 (Eintragungsdatum)\n\nThermocryl Tageslichttechnik GmbH\nGesellschaft mit beschränkter Haftung\nJesewitz\n\nDen Gläubigern der an der Verschmelzung beteiligten Rechtsträger ist, wenn sie binnen sechs Monaten nach dem Tag, an dem die Eintragung der Verschmelzung in das Register des Sitzes desjenigen Rechtsträgers, dessen Gläubiger sie sind, nach § 19 Abs. 3 UmwG als bekannt gemacht gilt, ihren Anspruch nach Grund und Höhe in Textform anmelden, Sicherheit zu leisten, soweit sie nicht Befriedigung verlangen können. Dieses Recht steht den Gläubigern jedoch nur zu, wenn sie glaubhaft machen, dass durch die Verschmelzung die Erfüllung der Forderung gefährdet wird."
    },
    {
      "date": "2025-03-11",
      "id": "103441",
      "original_text": "Einreichung neuer Dokumente\nSachsen Amtsgericht Dresden HRB 10256\nWGR Wohnungs-GmbH Rietschen – Rietschen",
      "type": "Einreichung neuer Dokumente",
      "state": "Sachsen",
      "amtsgericht": "Amtsgericht Dresden",
      "registernummer": "HRB 10256",
      "registerart": "HRB",
      "company_name": "WGR Wohnungs-GmbH Rietschen",
      "company_seat": "Rietschen",
      "details": "11.03.2025 (Bekanntmachungsdatum)\n\nSachsen Amtsgericht Dresden HRB 10256\nEinreichung neuer Dokumente\n\nWGR Wohnungs-GmbH Rietschen\nGesellschaft mit beschränkter Haftung\nRietschen\n\nAm 10.03.2025 wurde beim Handelsregister des Amtsgerichts Dresden die Liste der Mitglieder des Aufsichtsrats gemäß § 52 GmbHG eingereicht."
    },
    {
      "date": "2025-03-11",
      "id": "103442",
      "original_text": "Einreichung neuer Dokumente\nSachsen Amtsgericht Dresden HRB 2993\nGemeinnützige Wohnungsbaugesellschaft Niesky mbH – Niesky",
      "type": "Einreichung neuer Dokumente",
      "state": "Sachsen",
      "amtsgericht": "Amtsgericht Dresden",
      "registernummer": "HRB 2993",
      "registerart": "HRB",
      "company_name": "Gemeinnützige Wohnungsbaugesellschaft Niesky mbH",
      "company_seat": "Niesky",
      "details": "11.03.2025 (Bekanntmachungsdatum)\n\nSachsen Amtsgericht Dresden HRB 2993\nEinreichung neuer Dokumente\n\nGemeinnützige Wohnungsbaugesellschaft Niesky mbH\nGesellschaft mit beschränkter Haftung\nNiesky\n\nAm 10.03.2025 wurde beim Handelsregister des Amtsgerichts Dresden die Liste der Mitglieder des Aufsichtsrats gemäß § 52 GmbHG eingereicht."
    },
    {
      "date": "2025-03-11",
      "id": "103443",
      "original_text": "Löschungsankündigung\nSachsen Amtsgericht Dresden HRB 42188\nHerm-Bau UG (haftungsbeschränkt) – Ostritz",
      "type": "Löschungsankündigung",
      "state": "Sachsen",
      "amtsgericht": "Amtsgericht Dresden",
      "registernummer": "HRB 42188",
      "registerart": "HRB",
      "company_name": "Herm-Bau UG (haftungsbeschränkt)",
      "company_seat": "Ostritz",
      "details": "11.03.2025 (Bekanntmachungsdatum)\n\nSachsen Amtsgericht Dresden HRB 42188\nLöschungsankündigung\n\nHerm-Bau UG (haftungsbeschränkt)\nGesellschaft mit beschränkter Haftung\nOstritz\n\nDas Registergericht beabsichtigt, die im Handelsregister eingetragene Gesellschaft von Amts wegen nach § 394 FamFG zu löschen. Die Frist zu Erhebung eines Widerspruchs gegen die beabsichtigte Löschung wird auf einen Monat festgesetzt."
    },
    {
      "date": "2025-03-11",
      "id": "103444",
      "original_text": "Registerbekanntmachung nach dem Umwandlungsgesetz\nSachsen Amtsgericht Dresden HRA 12220\nAGRAR/SEEDS Hentzschel e.K. – Panschwitz-Kuckau",
      "type": "Registerbekanntmachung nach dem Umwandlungsgesetz",
      "state": "Sachsen",
      "amtsgericht": "Amtsgericht Dresden",
      "registernummer": "HRA 12220",
      "registerart": "HRA",
      "company_name": "AGRAR/SEEDS Hentzschel e.K.",
      "company_seat": "Panschwitz-Kuckau",
      "details": "11.03.2025 (Bekanntmachungsdatum)\n\nSachsen Amtsgericht Dresden HRA 12220\nRegisterbekanntmachung nach dem Umwandlungsgesetz 11.03.2025 (Eintragungsdatum)\n\nAGRAR/SEEDS Hentzschel e.K.\nEinzelkaufmann / Einzelkauffrau\nPanschwitz-Kuckau\n\nDen Gläubigern der an der Ausgliederung beteiligten Rechtsträger ist, wenn sie binnen sechs Monaten nach dem Tag, an dem die Eintragung der Ausgliederung in das Register des Sitzes desjenigen Rechtsträgers, dessen Gläubiger sie sind, nach § 19 Abs. 3 UmwG als bekannt gemacht gilt, ihren Anspruch nach Grund und Höhe in Textform anmelden, Sicherheit zu leisten, soweit sie nicht Befriedigung verlangen können. Dieses Recht steht den Gläubigern jedoch nur zu, wenn sie glaubhaft machen, dass durch die Ausgliederung die Erfüllung der Forderung gefährdet wird."
    },
    {
      "date": "2025-03-11",
      "id": "103445",
      "original_text": "Sonstige Registerbekanntmachung\nSachsen Amtsgericht Leipzig HRB 21624\nDHL Hub Leipzig GmbH – Schkeuditz",
      "type": "Sonstige Registerbekanntmachung",
      "state": "Sachsen",
      "amtsgericht": "Amtsgericht Leipzig",
      "registernummer": "HRB 21624",
      "registerart": "HRB",
      "company_name": "DHL Hub Leipzig GmbH",
      "company_seat": "Schkeuditz",
      "details": "11.03.2025 (Bekanntmachungsdatum)\n\nSachsen Amtsgericht Leipzig HRB 21624\nSonstige Registerbekanntmachung 11.03.2025 (Eintragungsdatum)\n\nDHL Hub Leipzig GmbH\nGesellschaft mit beschränkter Haftung\nSchkeuditz\n\nDen Gläubigern der Gesellschaft, deren Forderungen begründet worden sind bevor die Eintragung der Beendigung des Beherrschungs- und Gewinnabführungsvertrages in das Handelsregister nach § 10 des Handelsgesetzbuches als bekanntgemacht gilt, hat der andere Vertragsteil Sicherheit zu leisten, wenn sie sich binnen sechs Monaten nach der Bekanntmachung der Eintragung zu diesem Zweck bei ihm melden."
    },
    {
      "date": "2025-03-11",
      "id": "103446",
      "original_text": "Löschungsankündigung\nNiedersachsen Amtsgericht Oldenburg (Oldenburg) HRA 207780\nDelme Food Handels GmbH & Co. KG – Delmenhorst",
      "type": "Löschungsankündigung",
      "state": "Niedersachsen",
      "amtsgericht": "Amtsgericht Oldenburg (Oldenburg)",
      "registernummer": "HRA 207780",
      "registerart": "HRA",
      "company_name": "Delme Food Handels GmbH & Co. KG",
      "company_seat": "Delmenhorst",
      "details": "11.03.2025 (Bekanntmachungsdatum)\n\nNiedersachsen Amtsgericht Oldenburg (Oldenburg) HRA 207780\nLöschungsankündigung\n\nDelme Food Handels GmbH & Co. KG\nKommanditgesellschaft\nDelmenhorst\n\nDas Registergericht beabsichtigt, die Firma von Amts wegen nach § 31 Abs. 2 Satz 2 HGB, § 393 FamFG zu löschen. Die Frist zur Erhebung eines Widerspruchs ist auf 1 Monat ab dieser Registerbekanntmachung festgesetzt."
    },
    {
      "date": "2025-03-11",
      "id": "103447",
      "original_text": "Einreichung neuer Dokumente\nNiedersachsen Amtsgericht Braunschweig HRB 201389\nSAMASCH Aktiengesellschaft – Salzgitter-Bad",
      "type": "Einreichung neuer Dokumente",
      "state": "Niedersachsen",
      "amtsgericht": "Amtsgericht Braunschweig",
      "registernummer": "HRB 201389",
      "registerart": "HRB",
      "company_name": "SAMASCH Aktiengesellschaft",
      "company_seat": "Salzgitter-Bad",
      "details": "11.03.2025 (Bekanntmachungsdatum)\n\nNiedersachsen Amtsgericht Braunschweig HRB 201389\nEinreichung neuer Dokumente 11.03.2025 (Eintragungsdatum)\n\nSAMASCH Aktiengesellschaft\nAktiengesellschaft\nSalzgitter-Bad\n\nDie Liste der Mitglieder des Aufsichtsrats wurde beim Registergericht eingereicht."
    },
    {
      "date": "2025-03-11",
      "id": "103448",
      "original_text": "Registerbekanntmachung nach dem Umwandlungsgesetz\nNiedersachsen Amtsgericht Hildesheim HRB 207950\ndigitalshopz GmbH – Giesen",
      "type": "Registerbekanntmachung nach dem Umwandlungsgesetz",
      "state": "Niedersachsen",
      "amtsgericht": "Amtsgericht Hildesheim",
      "registernummer": "HRB 207950",
      "registerart": "HRB",
      "company_name": "digitalshopz GmbH",
      "company_seat": "Giesen",
      "details": "11.03.2025 (Bekanntmachungsdatum)\n\nNiedersachsen Amtsgericht Hildesheim HRB 207950\nRegisterbekanntmachung nach dem Umwandlungsgesetz 11.03.2025 (Eintragungsdatum)\n\ndigitalshopz GmbH\nGesellschaft mit beschränkter Haftung\nGiesen\n\nDen Gläubigern der an der formwechselnden Umwandlung beteiligten Rechtsträger ist, wenn sie binnen sechs Monaten nach dem Tag, an dem die Eintragung der Umwandlung in das Register des Sitzes desjenigen Rechtsträgers, dessen Gläubiger sie sind, nach § 19 Abs. 3 UmwG als bekannt gemacht gilt, ihren Anspruch nach Grund und Höhe schriftlich anmelden, Sicherheit zu leisten, soweit sie nicht Befriedigung verlangen können. Dieses Recht steht den Gläubigern jedoch nur zu, wenn sie glaubhaft machen, dass durch die formwechselnde Umwandlung die Erfüllung der Forderung gefährdet wird."
    },
    {
      "date": "2025-03-11",
      "id": "103449",
      "original_text": "Löschungsankündigung\nNiedersachsen Amtsgericht Osnabrück HRB 220117\nGS Großhandelsolar GmbH – Laar",
      "type": "Löschungsankündigung",
      "state": "Niedersachsen",
      "amtsgericht": "Amtsgericht Osnabrück",
      "registernummer": "HRB 220117",
      "registerart": "HRB",
      "company_name": "GS Großhandelsolar GmbH",
      "company_seat": "Laar",
      "details": "11.03.2025 (Bekanntmachungsdatum)\n\nNiedersachsen Amtsgericht Osnabrück HRB 220117\nLöschungsankündigung 11.03.2025 (Eintragungsdatum)\n\nGS Großhandelsolar GmbH\nGesellschaft mit beschränkter Haftung\nLaar\n\nDas Registergericht beabsichtigt, die Gesellschaft von Amts wegen nach § 394 FamFG wegen Vermögenslosigkeit zu löschen. Die Frist zur Erhebung eines Widerspruchs ist auf 1 Monat ab dieser Registerbekanntmachung festgesetzt."
    },
    {
      "date": "2025-03-11",
      "id": "103450",
      "original_text": "Löschungsankündigung\nNiedersachsen Amtsgericht Osnabrück HRB 214001\nWaldbaum GmbH – Osnabrück",
      "type": "Löschungsankündigung",
      "state": "Niedersachsen",
      "amtsgericht": "Amtsgericht Osnabrück",
      "registernummer": "HRB 214001",
      "registerart": "HRB",
      "company_name": "Waldbaum GmbH",
      "company_seat": "Osnabrück",
      "details": "11.03.2025 (Bekanntmachungsdatum)\n\nNiedersachsen Amtsgericht Osnabrück HRB 214001\nLöschungsankündigung\n\nWaldbaum GmbH\nGesellschaft mit beschränkter Haftung\nOsnabrück\n\nDas Registergericht beabsichtigt, die Gesellschaft von Amts wegen nach § 394 FamFG wegen Vermögenslosigkeit zu löschen. Die Frist zur Erhebung eines Widerspruchs ist auf 1 Monat ab dieser Registerbekanntmachung festgesetzt."
    },
    {
      "date": "2025-03-11",
      "id": "103451",
      "original_text": "Registerbekanntmachung nach dem Umwandlungsgesetz\nNiedersachsen Amtsgericht Lüneburg HRB 203541\nlowcotel GmbH – Embsen",
      "type": "Registerbekanntmachung nach dem Umwandlungsgesetz",
      "state": "Niedersachsen",
      "amtsgericht": "Amtsgericht Lüneburg",
      "registernummer": "HRB 203541",
      "registerart": "HRB",
      "company_name": "lowcotel GmbH",
      "company_seat": "Embsen",
      "details": "11.03.2025 (Bekanntmachungsdatum)\n\nNiedersachsen Amtsgericht Lüneburg HRB 203541\nRegisterbekanntmachung nach dem Umwandlungsgesetz 11.03.2025 (Eintragungsdatum)\n\nlowcotel GmbH\nGesellschaft mit beschränkter Haftung\nEmbsen\n\nDen Gläubigern der an der Verschmelzung beteiligten Rechtsträger ist, wenn sie binnen sechs Monaten nach dem Tag, an dem die Eintragung der Verschmelzung in das Register des Sitzes desjenigen Rechtsträgers, dessen Gläubiger sie sind, nach § 19  Abs.  3 UmwG als bekannt gemacht gilt, ihren Anspruch nach Grund und Höhe schriftlich anmelden, Sicherheit zu leisten, soweit sie nicht Befriedigung verlangen können. Dieses Recht steht den Gläubigern jedoch nur zu, wenn sie glaubhaft machen, dass durch die Verschmelzung die Erfüllung der Forderung gefährdet wird."
    },
    {
      "date": "2025-03-11",
      "id": "103452",
      "original_text": "Registerbekanntmachung nach dem Umwandlungsgesetz\nNiedersachsen Amtsgericht Lüneburg HRB 205280\nadmin-data GmbH – Embsen",
      "type": "Registerbekanntmachung nach dem Umwandlungsgesetz",
      "state": "Niedersachsen",
      "amtsgericht": "Amtsgericht Lüneburg",
      "registernummer": "HRB 205280",
      "registerart": "HRB",
      "company_name": "admin-data GmbH",
      "company_seat": "Embsen",
      "details": "11.03.2025 (Bekanntmachungsdatum)\n\nNiedersachsen Amtsgericht Lüneburg HRB 205280\nRegisterbekanntmachung nach dem Umwandlungsgesetz 11.03.2025 (Eintragungsdatum)\n\nadmin-data GmbH\nGesellschaft mit beschränkter Haftung\nEmbsen\n\nDen Gläubigern der an der Verschmelzung beteiligten Rechtsträger ist, wenn sie binnen sechs Monaten nach dem Tag, an dem die Eintragung der Verschmelzung in das Register des Sitzes desjenigen Rechtsträgers, dessen Gläubiger sie sind, nach § 19  Abs.  3 UmwG als bekannt gemacht gilt, ihren Anspruch nach Grund und Höhe schriftlich anmelden, Sicherheit zu leisten, soweit sie nicht Befriedigung verlangen können. Dieses Recht steht den Gläubigern jedoch nur zu, wenn sie glaubhaft machen, dass durch die Verschmelzung die Erfüllung der Forderung gefährdet wird."
    },
    {
      "date": "2025-03-11",
      "id": "103453",
      "original_text": "Löschungsankündigung\nNiedersachsen Amtsgericht Stadthagen HRB 200416\nmp Automobile GmbH – Stadthagen",
      "type": "Löschungsankündigung",
      "state": "Niedersachsen",
      "amtsgericht": "Amtsgericht Stadthagen",
      "registernummer": "HRB 200416",
      "registerart": "HRB",
      "company_name": "mp Automobile GmbH",
      "company_seat": "Stadthagen",
      "details": "11.03.2025 (Bekanntmachungsdatum)\n\nNiedersachsen Amtsgericht Stadthagen HRB 200416\nLöschungsankündigung\n\nmp Automobile GmbH\nGesellschaft mit beschränkter Haftung\nStadthagen\n\nDas Registergericht beabsichtigt, die Gesellschaft von Amts wegen nach § 394 FamFG zu löschen. Die Frist zur Erhebung eines Widerspruchs ist auf 1 Monat ab dieser Registerbekanntmachung festgesetzt."
    },
    {
      "date": "2025-03-11",
      "id": "103454",
      "original_text": "Registerbekanntmachung nach dem Umwandlungsgesetz\nNiedersachsen Amtsgericht Oldenburg (Oldenburg) HRB 202523\nJ. Müller Aktiengesellschaft – Brake/Unterweser",
      "type": "Registerbekanntmachung nach dem Umwandlungsgesetz",
      "state": "Niedersachsen",
      "amtsgericht": "Amtsgericht Oldenburg (Oldenburg)",
      "registernummer": "HRB 202523",
      "registerart": "HRB",
      "company_name": "J. Müller Aktiengesellschaft",
      "company_seat": "Brake/Unterweser",
      "details": "11.03.2025 (Bekanntmachungsdatum)\n\nNiedersachsen Amtsgericht Oldenburg (Oldenburg) HRB 202523\nRegisterbekanntmachung nach dem Umwandlungsgesetz\n\nJ. Müller Aktiengesellschaft\nAktiengesellschaft\nBrake/Unterweser\n\nEs wird darauf hingewiesen, dass ein Verschmelzungsplan oder sein Entwurf über eine grenzüberschreitende Verschmelzung zur Aufnahme mit der J. Müller Alpha AG mit Sitz in Wien/Österreich (Österreichisches Firmenbuch FN 639025 v) (Aktiengesellschaft nach österreichischem Recht) beim Handelsregister eingereicht worden ist.\nDie J. Müller Alpha AG mit Sitz in Wien, Österreich, soll als übertragender Rechtsträger auf die J. Müller Aktiengesellschaft mit Sitz in Brake/Unterweser, Deutschland, als übernehmender Rechtsträger im Wege der Verschmelzung zur Aufnahme ohne Liquidation gemäß Art. 17 Abs. 2 lit. a) der Verordnung (EG) Nr. 2157/2001 des Rates vom 8. Oktober 2001 über das Statut der Europäischen Gesellschaft (SE) (nachstehend \"SE-VO\") verschmolzen werden, wobei die J. Müller Aktiengesellschaft mit Wirksamwerden der Verschmelzung die Rechtsform einer Europäischen Gesellschaft (Societas Europaea, SE) annimmt.\nFür die sich verschmelzenden Gesellschaften werden daher gemäß Art. 21 lit. a) bis e) SE-VO die folgenden Angaben bekannt gemacht:\n1. J. Müller Aktiengesellschaft\na) Rechtsform, Firma und Sitz\nRechtsform: Aktiengesellschaft nach deutschem Recht\nFirma: J. Müller Aktiengesellschaft\nSitz: Brake/Unterweser, Deutschland, eingetragen im Handelsregister des Amtsgerichts Oldenburg unter HRB 202523\nb) Register, bei dem die in Art. 3 Abs. 2 der Richtlinie 68/151/EWG genannten Urkunden hinterlegt worden sind, sowie die Nummer der Eintragung in das Register\nHandelsregister des Amtsgerichts Oldenburg, Deutschland, unter HRB 202523. Dort sind die Unterlagen nach Art. 3 Abs. 2 der Richtlinie 68/151/EWG hinterlegt.\nc) Hinweis auf die Modalitäten für die Ausübung der Rechte der Gläubiger der J. Müller Aktiengesellschaft gemäß Art. 24 Abs. 1 lit. a) bis c) SE-VO sowie die Anschrift, unter der erschöpfende Auskünfte über diese Modalitäten kostenlos eingeholt werden können\nGemäß Art. 24 Abs. 1 SE-VO findet unter Berücksichtigung des grenzüberschreitenden Charakters der Verschmelzung das Recht des Mitgliedsstaates, das jeweils für die sich verschmelzenden Gesellschaften gilt, zum Schutz der Interessen der Gläubiger der sich verschmelzenden Gesellschaften wie bei einer Verschmelzung von Aktiengesellschaften Anwendung.\nIm deutschen Recht ist der Gläubigerschutz in § 22 Umwandlungsgesetz (nachstehend \"UmwG\") geregelt. Danach ist den Gläubigern der J. Müller Aktiengesellschaft Sicherheit zu leisten, soweit sie nicht Befriedigung verlangen können, wenn sie binnen sechs Monaten (Art. 24 Abs. 1 SE-VO i. V. m. § 22 UmwG) nach Offenlegung der Eintragung (Art. 15 Abs. 2 SE-VO bzw. Art. 28 SE-VO), ihren Anspruch nach Grund und Höhe schriftlich anmelden. Die Eintragung der Verschmelzung gilt als bekannt gemacht mit ihrer erstmaligen Abrufbarkeit über das nach § 9 Abs. 1 HGB bestimmte elektronische Informations- und Kommunikationssystem. Die Eintragung gilt mit dem Ablauf des Tages der Eintragung als bekannt gemacht.\nDieses Recht steht den Gläubigern der J. Müller Aktiengesellschaft allerdings nur zu, wenn sie glaubhaft machen, dass durch die Verschmelzung die Erfüllung ihrer Forderung gefährdet wird. Die Gläubiger sind in der Bekanntmachung der jeweiligen Eintragung auf dieses Recht hinzuweisen. Gemäß § 22 Abs. 2 UmwG steht das Recht, Sicherheitsleistung zu verlangen, Gläubigern nicht zu, die im Falle der Insolvenz ein Recht auf vorzugsweise Befriedigung aus einer Deckungsmasse haben, die nach gesetzlichen Vorschriften zu ihrem Schutz errichtet und staatlich überwacht ist.\nFür Anleihegläubiger der J. Müller Aktiengesellschaft (insbesondere Gläubiger von Wandel-, Options- und Gewinnanleihen) sowie für Inhaber von mit Sonderrechten ausgestatteten Wertpapieren außer Aktien (z. B. Inhaber von Genussscheinen der J. Müller Aktiengesellschaft) sind keine besonderen Maßnahmen vorgesehen. Für sie gelten die vorstehend beschriebenen Gläubigerschutzrechte.\nDie speziellen Gläubigerschutzrechte nach §§ 8, 13 des Gesetzes zur Ausführung der SE-VO (nachstehend \"SEAG\") finden hier keine Anwendung, weil der künftige Sitz der J. Müller SE in Brake/Unterweser, Deutschland, und damit aus deutscher Sicht im Inland sein wird.\nJ. Müller Aktiengesellschaft z.Hd. des Vorstands, Neustadtstr. 15, 26919 Brake Deutschland\nd) Hinweis auf die Modalitäten für die Ausübung der Rechte der Minderheitsaktionäre der J. Müller Aktiengesellschaft gemäß Art. 24 Abs. 1 lit. a) bis c) SEVO sowie die Anschrift, unter der erschöpfende Auskünfte über diese Modalitäten kostenlos eingeholt werden können\nGemäß Art. 24 Abs. 2 SE-VO kann jeder Mitgliedstaat in Bezug auf die sich verschmelzenden Gesellschaften, die seinem Recht unterliegen, Vorschriften erlassen, um einen angemessenen Schutz der Minderheitsaktionäre, die sich gegen die Verschmelzung ausgesprochen haben, zu gewährleisten.\nAktionäre der J. Müller Aktiengesellschaft haben im vorliegenden Fall kein Barabfindungsrecht. Zwar haben die Aktionäre der übertragenden Gesellschaft nach § 7 SEAG ein Barabfindungsrecht, sofern der Sitz der künftigen SE aus deutscher Sicht im Ausland ist. Da die J. Müller Aktiengesellschaft aufnehmende Gesellschaft ist und der künftige Sitz der J. Müller SE in Brake/Unterweser, Deutschland, und damit aus deutscher Sicht im Inland sein wird, findet § 7 SEAG keine Anwendung. Aktionäre der J. Müller Aktiengesellschaft haben im vorliegenden Fall keinen Anspruch auf Verbesserung des Umtauschverhältnisses. Der in § 6 SEAG geregelte Anspruch auf Verbesserung des Umtauschverhältnisses steht nur den Aktionären der übertragenden Gesellschaft zur Verfügung. Da die J. Müller Aktiengesellschaft aufnehmende Gesellschaft ist, findet § 6 SEAG keine Anwendung. Unter folgender Anschrift können kostenlos erschöpfende Auskünfte über die Modalitäten der Ausübung der Rechte der Minderheitsaktionäre der J. Müller Aktiengesellschaft eingeholt werden:\nJ. Müller Aktiengesellschaft z.Hd. des Vorstands, Neustadtstr. 15, 26919 Brake Deutschland\n2. J. Müller Alpha AG\na) Rechtsform, Firma und Sitz\nRechtsform: Aktiengesellschaft nach österreichischem Recht\nFirma: J. Müller Alpha AG\nSitz: Wien, Österreich, eingetragen im Firmenbuch des Handelsgerichts Wien unter FN 639025 v\nb) Register, bei dem die in Art. 3 Abs. 2 der Richtlinie 68/151/EWG genannten Urkunden hinterlegt worden sind, sowie die Nummer der Eintragung in das Register\nFirmenbuch des Handelsgerichts Wien, Österreich unter FN 639025 v. Dort sind die Unterlagen nach Art. 3 Abs. 2 der Richtlinie 68/151/EWG hinterlegt.\n3. Firma und Sitz der J. Müller SE\nDie durch die Verschmelzung der J. Müller Alpha AG auf die J. Müller Aktiengesellschaft entstehende SE wird voraussichtlich unter J. Müller SE firmieren und ihren Sitz in Brake/Unterweser, Deutschland, haben."
    },
    {
      "date": "2025-03-11",
      "id": "103455",
      "original_text": "Löschungsankündigung\nBremen Amtsgericht Bremen HRB 30327\nHIKO'S Logistik Service GmbH – Bremen",
      "type": "Löschungsankündigung",
      "state": "Bremen",
      "amtsgericht": "Amtsgericht Bremen",
      "registernummer": "HRB 30327",
      "registerart": "HRB",
      "company_name": "HIKO'S Logistik Service GmbH",
      "company_seat": "Bremen",
      "details": "11.03.2025 (Bekanntmachungsdatum)\n\nBremen Amtsgericht Bremen HRB 30327\nLöschungsankündigung\n\nHIKO'S Logistik Service GmbH\nGesellschaft mit beschränkter Haftung\nBremen\n\nEs ist beabsichtigt die im Handelsregister eingetragene Gesellschaft von Amts wegen gemäß § 394 FamFG zu löschen. Gegen die Löschung kann beim AG Bremen schriftlich oder zu Protokoll der Geschäftsstelle Widerspruch eingelegt werden. Widerspruchsfrist 4 Wochen."
    },
    {
      "date": "2025-03-11",
      "id": "103456",
      "original_text": "Löschungsankündigung\nBremen Amtsgericht Bremen HRB 37482\nMulti Dienstleistung GmbH – Bremen",
      "type": "Löschungsankündigung",
      "state": "Bremen",
      "amtsgericht": "Amtsgericht Bremen",
      "registernummer": "HRB 37482",
      "registerart": "HRB",
      "company_name": "Multi Dienstleistung GmbH",
      "company_seat": "Bremen",
      "details": "11.03.2025 (Bekanntmachungsdatum)\n\nBremen Amtsgericht Bremen HRB 37482\nLöschungsankündigung\n\nMulti Dienstleistung GmbH\nGesellschaft mit beschränkter Haftung\nBremen\n\nEs ist beabsichtigt die im Handelsregister eingetragene Gesellschaft von Amts wegen gemäß § 394 FamFG zu löschen. Gegen die Löschung kann beim AG Bremen schriftlich oder zu Protokoll der Geschäftsstelle Widerspruch eingelegt werden. Widerspruchsfrist 4 Wochen."
    },
    {
      "date": "2025-03-11",
      "id": "103457",
      "original_text": "Löschungsankündigung\nBremen Amtsgericht Bremen HRB 35265\nConcept Partner UG (haftungsbeschränkt) – Bremerhaven",
      "type": "Löschungsankündigung",
      "state": "Bremen",
      "amtsgericht": "Amtsgericht Bremen",
      "registernummer": "HRB 35265",
      "registerart": "HRB",
      "company_name": "Concept Partner UG (haftungsbeschränkt)",
      "company_seat": "Bremerhaven",
      "details": "11.03.2025 (Bekanntmachungsdatum)\n\nBremen Amtsgericht Bremen HRB 35265\nLöschungsankündigung\n\nConcept Partner UG (haftungsbeschränkt)\nGesellschaft mit beschränkter Haftung\nBremerhaven\n\nEs ist beabsichtigt die im Handelsregister eingetragene Gesellschaft von Amts wegen gemäß § 394 FamFG zu löschen. Gegen die Löschung kann beim AG Bremen schriftlich oder zu Protokoll der Geschäftsstelle Widerspruch eingelegt werden. Widerspruchsfrist 4 Wochen."
    },
    {
      "date": "2025-03-11",
      "id": "103458",
      "original_text": "Sonstige Registerbekanntmachung\nRheinland-Pfalz Amtsgericht Wittlich HRB 44475\nPRIMUS Concept Pflegeimmobilien Prüm GmbH – Prüm",
      "type": "Sonstige Registerbekanntmachung",
      "state": "Rheinland-Pfalz",
      "amtsgericht": "Amtsgericht Wittlich",
      "registernummer": "HRB 44475",
      "registerart": "HRB",
      "company_name": "PRIMUS Concept Pflegeimmobilien Prüm GmbH",
      "company_seat": "Prüm",
      "details": "11.03.2025 (Bekanntmachungsdatum)\n\nRheinland-Pfalz Amtsgericht Wittlich HRB 44475\nSonstige Registerbekanntmachung 11.03.2025 (Eintragungsdatum)\n\nPRIMUS Concept Pflegeimmobilien Prüm GmbH\nGesellschaft mit beschränkter Haftung\nPrüm\n\nAls nicht eingetragen wird veröffentlicht: Den Gläubigern der Gesellschaft, deren Forderungen begründet worden sind, bevor die Eintragung der Beendigung des Beherrschungs- und Gewinnabführungsvertrages in das Handelsregister nach § 10 des Handelsgesetzbuches als bekanntgemacht gilt, hat der andere Vertragsteil Sicherheit zu leisten, wenn sie sich binnen sechs Monaten nach der Bekanntmachung der Eintragung zu diesem Zweck bei ihm melden."
    },
    {
      "date": "2025-03-11",
      "id": "103459",
      "original_text": "Registerbekanntmachung nach dem Umwandlungsgesetz\nNordrhein-Westfalen Amtsgericht Iserlohn HRB 5616\nSIP Grundbesitz & Anlagen AG – Altena",
      "type": "Registerbekanntmachung nach dem Umwandlungsgesetz",
      "state": "Nordrhein-Westfalen",
      "amtsgericht": "Amtsgericht Iserlohn",
      "registernummer": "HRB 5616",
      "registerart": "HRB",
      "company_name": "SIP Grundbesitz & Anlagen AG",
      "company_seat": "Altena",
      "details": "11.03.2025 (Bekanntmachungsdatum)\n\nNordrhein-Westfalen Amtsgericht Iserlohn HRB 5616\nRegisterbekanntmachung nach dem Umwandlungsgesetz 27.02.2025 (Eintragungsdatum)\n\nSIP Grundbesitz & Anlagen AG\nAktiengesellschaft\nAltena\n\nDen Gläubigern der an der formwechselnden Umwandlung beteiligten Rechtsträger ist, wenn sie binnen sechs Monaten nach dem Tag, an dem die Eintragung der formwechselnden Umwandlung in das Register des Sitzes desjenigen Rechtsträgers, dessen Gläubiger sie sind, nach § 19 Absatz 3 UmwG als bekanntgemacht gilt, ihren Anspruch nach Grund und Höhe schriftlich anmelden, Sicherheit zu leisten, soweit sie nicht Befriedigung verlangen können. Dieses Recht steht den Gläubigern jedoch nur zu, wenn sie glaubhaft machen, dass durch die formwechselnden Umwandlung die Erfüllung ihrer Forderung gefährdet wird."
    },
    {
      "date": "2025-03-11",
      "id": "103460",
      "original_text": "Registerbekanntmachung nach dem Umwandlungsgesetz\nNordrhein-Westfalen Amtsgericht Köln HRB 56171\nTÜV Rheinland Energy & Environment GmbH – Köln",
      "type": "Registerbekanntmachung nach dem Umwandlungsgesetz",
      "state": "Nordrhein-Westfalen",
      "amtsgericht": "Amtsgericht Köln",
      "registernummer": "HRB 56171",
      "registerart": "HRB",
      "company_name": "TÜV Rheinland Energy & Environment GmbH",
      "company_seat": "Köln",
      "details": "11.03.2025 (Bekanntmachungsdatum)\n\nNordrhein-Westfalen Amtsgericht Köln HRB 56171\nRegisterbekanntmachung nach dem Umwandlungsgesetz 11.03.2025 (Eintragungsdatum)\n\nTÜV Rheinland Energy & Environment GmbH\nGesellschaft mit beschränkter Haftung\nKöln\n\nDen Gläubigern der an der Verschmelzung beteiligten Rechtsträger ist, wenn sie binnen sechs Monaten nach dem Tag, an dem die Eintragung der Verschmelzung in das Register des Sitzes desjenigen Rechtsträgers, dessen Gläubiger sie sind, nach § 19 Absatz 3 UmwG als bekanntgemacht gilt, ihren Anspruch nach Grund und Höhe schriftlich anmelden, Sicherheit zu leisten, soweit sie nicht Befriedigung verlangen können. Dieses Recht steht den Gläubigern jedoch nur zu, wenn sie glaubhaft machen, dass durch die Verschmelzung die Erfüllung ihrer Forderung gefährdet wird."
    },
    {
      "date": "2025-03-11",
      "id": "103461",
      "original_text": "Löschungsankündigung\nNordrhein-Westfalen Amtsgericht Düsseldorf HRB 91968\nDE&AS Security GmbH – Düsseldorf",
      "type": "Löschungsankündigung",
      "state": "Nordrhein-Westfalen",
      "amtsgericht": "Amtsgericht Düsseldorf",
      "registernummer": "HRB 91968",
      "registerart": "HRB",
      "company_name": "DE&AS Security GmbH",
      "company_seat": "Düsseldorf",
      "details": "11.03.2025 (Bekanntmachungsdatum)\n\nNordrhein-Westfalen Amtsgericht Düsseldorf HRB 91968\nLöschungsankündigung\n\nDE&AS Security GmbH\nGesellschaft mit beschränkter Haftung\nDüsseldorf\n\nDas Registergericht beabsichtigt die Gesellschaft von Amts wegen nach § 394 FamFG zu löschen. Die Frist zur Erhebung eines Widerspruchs ist auf 3 Wochen festgesetzt.\n\nRechtsbehelfsbelehrung:\nDas Widerspruchsrecht steht jedem zu, der an der Unterlassung der Löschung ein berechtigtes Interesse hat. Der Widerspruch ist bei dem Amtsgericht Düsseldorf -Registergericht-, Werdener Straße 1, 40227 Düsseldorf schriftlich in deutscher Sprache oder zur Niederschrift der Geschäftsstelle einzulegen. Der Widerspruch kann auch zur Niederschrift der Geschäftsstelle eines jeden Amtsgerichtes abgegeben werden. Die Einlegung ist auch durch Übertragung eines elektronischen Dokuments an die elektronische Poststelle des Gerichts möglich. Das elektronische Dokument muss für die Bearbeitung durch das Gericht geeignet und mit einer qualifizierten elektronischen Signatur der verantwortenden Person versehen sein oder von der verantwortenden Person signiert und auf einem sicheren Übermittlungsweg gemäß § 130a ZPO nach näherer Maßgabe der Verordnung über die technischen Rahmenbedingungen des elektronischen Rechtsverkehrs und über das besondere elektronische Behördenpostfach (BGBl. I, S.3803) eingereicht werden. Weitere Informationen erhalten Sie auf der Internetseite www.justiz.de.\nDer Widerspruch muss spätestens innerhalb der gesetzten Frist nach dem Datum der Bekanntmachung der Löschungsankündigung bei dem Amtsgericht - Registergericht - Düsseldorf eingegangen sein.  Dies gilt auch dann, wenn der Widerspruch zur Niederschrift der Geschäftsstelle eines anderen Amtsgerichtes abgegeben wurde. Die Frist beginnt mit dem Tage der Bekanntmachung der Löschungsankündigung in dem für die Bekanntmachung der Eintragungen in das Handelsregister bestimmten elektronischen Informations- und Kommunikationssystem nach § 10 des Handelsgesetzbuches. Fällt das Ende der Frist auf einen Sonntag, einen allgemeinen Feiertag oder Sonnabend, so endet die Frist mit Ablauf des nächsten Werktages.\nDer Widerspruch muss die Bezeichnung der angefochtenen Löschungsankündigung sowie die Erklärung enthalten, dass Widerspruch gegen diese Löschungsankündigung eingelegt wird. Er ist zu unterzeichnen und soll begründet werden."
    },
    {
      "date": "2025-03-11",
      "id": "103462",
      "original_text": "Registerbekanntmachung nach dem Umwandlungsgesetz\nNordrhein-Westfalen Amtsgericht Düsseldorf HRB 107892\nSpin Zero GmbH – Düsseldorf",
      "type": "Registerbekanntmachung nach dem Umwandlungsgesetz",
      "state": "Nordrhein-Westfalen",
      "amtsgericht": "Amtsgericht Düsseldorf",
      "registernummer": "HRB 107892",
      "registerart": "HRB",
      "company_name": "Spin Zero GmbH",
      "company_seat": "Düsseldorf",
      "details": "11.03.2025 (Bekanntmachungsdatum)\n\nNordrhein-Westfalen Amtsgericht Düsseldorf HRB 107892\nRegisterbekanntmachung nach dem Umwandlungsgesetz 11.03.2025 (Eintragungsdatum)\n\nSpin Zero GmbH\nGesellschaft mit beschränkter Haftung\nDüsseldorf\n\nDie Gesellschaft hat Gläubigern, deren Forderungen vor dieser Bekanntmachung begründet worden sind, Sicherheit zu leisten, soweit sie nicht Befriedigung verlangen können, wenn sie sich binnen sechs Monaten zu diesem Zweck melden. Den Gläubigern der an der Verschmelzung beteiligten Rechtsträger ist, wenn sie binnen sechs Monaten nach dem Tag, an dem die Eintragung der Verschmelzung in das Register des Sitzes desjenigen Rechtsträgers, dessen Gläubiger sie sind, nach § 19 Absatz 3 UmwG als bekanntgemacht gilt, ihren Anspruch nach Grund und Höhe schriftlich anmelden, Sicherheit zu leisten, soweit sie nicht Befriedigung verlangen können. Dieses Recht steht den Gläubigern jedoch nur zu, wenn sie glaubhaft machen, dass durch die Verschmelzung die Erfüllung ihrer Forderung gefährdet wird."
    },
    {
      "date": "2025-03-11",
      "id": "103463",
      "original_text": "Löschungsankündigung\nNordrhein-Westfalen Amtsgericht Wuppertal HRB 27846\nGetränke Költerhoff GmbH – Velbert",
      "type": "Löschungsankündigung",
      "state": "Nordrhein-Westfalen",
      "amtsgericht": "Amtsgericht Wuppertal",
      "registernummer": "HRB 27846",
      "registerart": "HRB",
      "company_name": "Getränke Költerhoff GmbH",
      "company_seat": "Velbert",
      "details": "11.03.2025 (Bekanntmachungsdatum)\n\nNordrhein-Westfalen Amtsgericht Wuppertal HRB 27846\nLöschungsankündigung\n\nGetränke Költerhoff GmbH\nGesellschaft mit beschränkter Haftung\nVelbert\n\nDas Registergericht beabsichtigt die Gesellschaft von Amts wegen nach § 394 FamFG zu löschen. Die Frist zur Erhebung eines Widerspruchs ist auf einen Monat festgesetzt."
    },
    {
      "date": "2025-03-11",
      "id": "103464",
      "original_text": "Löschungsankündigung\nNordrhein-Westfalen Amtsgericht Dortmund HRB 28879\nSparkassen-Erschließungs-Gesellschaft mbH -ein Unternehmen der Sparkasse an der Lippe- – Lünen",
      "type": "Löschungsankündigung",
      "state": "Nordrhein-Westfalen",
      "amtsgericht": "Amtsgericht Dortmund",
      "registernummer": "HRB 28879",
      "registerart": "HRB",
      "company_name": "Sparkassen-Erschließungs-Gesellschaft mbH -ein Unternehmen der Sparkasse an der Lippe-",
      "company_seat": "Lünen",
      "details": "11.03.2025 (Bekanntmachungsdatum)\n\nNordrhein-Westfalen Amtsgericht Dortmund HRB 28879\nLöschungsankündigung 10.03.2025 (Eintragungsdatum)\n\nSparkassen-Erschließungs-Gesellschaft mbH -ein Unternehmen der Sparkasse an der Lippe-\nGesellschaft mit beschränkter Haftung\nLünen\n\nDas Registergericht beabsichtigt die Gesellschaft von Amts wegen nach § 394 FamFG zu löschen. Die Frist zur Erhebung eines Widerspruchs ist auf zwei Monate festgesetzt."
    },
    {
      "date": "2025-03-11",
      "id": "103465",
      "original_text": "Löschungsankündigung\nNordrhein-Westfalen Amtsgericht Wuppertal HRB 27878\nAlonso Automobile GmbH – Velbert",
      "type": "Löschungsankündigung",
      "state": "Nordrhein-Westfalen",
      "amtsgericht": "Amtsgericht Wuppertal",
      "registernummer": "HRB 27878",
      "registerart": "HRB",
      "company_name": "Alonso Automobile GmbH",
      "company_seat": "Velbert",
      "details": "11.03.2025 (Bekanntmachungsdatum)\n\nNordrhein-Westfalen Amtsgericht Wuppertal HRB 27878\nLöschungsankündigung 10.03.2025 (Eintragungsdatum)\n\nAlonso Automobile GmbH\nGesellschaft mit beschränkter Haftung\nVelbert\n\nDas Registergericht beabsichtigt die Gesellschaft von Amts wegen nach § 394 FamFG zu löschen. Die Frist zur Erhebung eines Widerspruchs ist auf einen Monat festgesetzt."
    },
    {
      "date": "2025-03-11",
      "id": "103466",
      "original_text": "Registerbekanntmachung nach dem Umwandlungsgesetz\nNordrhein-Westfalen Amtsgericht Münster HRA 4813\nPaul-Uwe Einfalt Elektro- und Klimatechnik e.K. – Münster",
      "type": "Registerbekanntmachung nach dem Umwandlungsgesetz",
      "state": "Nordrhein-Westfalen",
      "amtsgericht": "Amtsgericht Münster",
      "registernummer": "HRA 4813",
      "registerart": "HRA",
      "company_name": "Paul-Uwe Einfalt Elektro- und Klimatechnik e.K.",
      "company_seat": "Münster",
      "details": "11.03.2025 (Bekanntmachungsdatum)\n\nNordrhein-Westfalen Amtsgericht Münster HRA 4813\nRegisterbekanntmachung nach dem Umwandlungsgesetz 11.03.2025 (Eintragungsdatum)\n\nPaul-Uwe Einfalt Elektro- und Klimatechnik e.K.\nEinzelkaufmann / Einzelkauffrau\nMünster\n\nDen Gläubigern der an der Ausgliederung beteiligten Rechtsträger ist, wenn sie binnen sechs Monaten nach dem Tag, an dem die Eintragung der Ausgliederung in das Register des Sitzes desjenigen Rechtsträgers, dessen Gläubiger sie sind, nach § 19 Absatz 3 UmwG als bekanntgemacht gilt, ihren Anspruch nach Grund und Höhe schriftlich anmelden, Sicherheit zu leisten, soweit sie nicht Befriedigung verlangen können. Dieses Recht steht den Gläubigern jedoch nur zu, wenn sie glaubhaft machen, dass durch die Ausgliederung die Erfüllung ihrer Forderung gefährdet wird."
    },
    {
      "date": "2025-03-11",
      "id": "103467",
      "original_text": "Löschungsankündigung\nNordrhein-Westfalen Amtsgericht Köln HRB 56358\nNEW LIFE BALANCE Verwaltungs-GmbH – Rösrath",
      "type": "Löschungsankündigung",
      "state": "Nordrhein-Westfalen",
      "amtsgericht": "Amtsgericht Köln",
      "registernummer": "HRB 56358",
      "registerart": "HRB",
      "company_name": "NEW LIFE BALANCE Verwaltungs-GmbH",
      "company_seat": "Rösrath",
      "details": "11.03.2025 (Bekanntmachungsdatum)\n\nNordrhein-Westfalen Amtsgericht Köln HRB 56358\nLöschungsankündigung\n\nNEW LIFE BALANCE Verwaltungs-GmbH\nGesellschaft mit beschränkter Haftung\nRösrath\n\nDas Registergericht beabsichtigt, die im Handelsregister eingetragene Gesellschaft gemäß § 394 Absatz 1 FamFG wegen Vermögenslosigkeit von Amts wegen zu löschen. Gegen diese Verfügung kann Widerspruch eingelegt werden. Die Frist zur Erhebung eines Widerspruchs gegen die beabsichtigte Löschung von Amts wegen ist auf einen Monat festgesetzt. Rechtsbehelfsbelehrung: Gegen diese Verfügung können Sie Widerspruch einlegen. Der Widerspruch ist bei dem Amtsgericht Köln, Reichenspergerplatz 1, 50670 Köln schriftlich in deutscher Sprache oder zur Niederschrift der Geschäftsstelle einzulegen. Der Widerspruch kann auch zur Niederschrift der Geschäftsstelle eines jeden Amtsgerichtes abgegeben werden. Die Einlegung ist auch durch Übertragung eines elektronischen Dokuments an die elektronische Poststelle des Gerichts möglich. Das elektronische Dokument muss für die Bearbeitung durch das Gericht geeignet und mit einer qualifizierten elektronischen Signatur der verantwortenden Person versehen sein oder von der verantwortenden Person signiert und auf einem sicheren Übermittlungsweg gemäß § 130a ZPO nach näherer Maßgabe der Verordnung über die technischen Rahmenbedingungen des elektronischen Rechtsverkehrs und über das besondere elektronische Behördenpostfach (BGBl. I, S.3803) eingereicht werden. Weitere Informationen erhalten Sie auf der Internetseite www.justiz.de.Der Widerspruch muss spätestens innerhalb der gesetzten Frist bei dem Amtsgericht Köln eingegangen sein. Dies gilt auch dann, wenn der Widerspruch zur Niederschrift der Geschäftsstelle eines anderen Amtsgerichtes abgegeben wurde. Die Frist beginnt mit der Veröffentlichung. Fällt das Ende der Frist auf einen Sonntag, einen allgemeinen Feiertag oder Sonnabend, so endet die Frist mit Ablauf des nächsten Werktages.\n\nDer Widerspruch muss die Bezeichnung der angefochtenen Verfügung sowie die Erklärung enthalten, dass Widerspruch gegen diese Verfügung eingelegt wird. Er ist zu unterzeichnen und soll begründet werden."
    },
    {
      "date": "2025-03-11",
      "id": "103468",
      "original_text": "Sonstige Registerbekanntmachung\nNordrhein-Westfalen Amtsgericht Köln HRB 85281\nCovestro AG – Leverkusen",
      "type": "Sonstige Registerbekanntmachung",
      "state": "Nordrhein-Westfalen",
      "amtsgericht": "Amtsgericht Köln",
      "registernummer": "HRB 85281",
      "registerart": "HRB",
      "company_name": "Covestro AG",
      "company_seat": "Leverkusen",
      "details": "11.03.2025 (Bekanntmachungsdatum)\n\nNordrhein-Westfalen Amtsgericht Köln HRB 85281\nSonstige Registerbekanntmachung\n\nCovestro AG\nAktiengesellschaft\nLeverkusen\n\nDem Registergericht ist eine Liste der Mitglieder des Aufsichtsrates eingereicht worden."
    },
    {
      "date": "2025-03-11",
      "id": "103469",
      "original_text": "Registerbekanntmachung nach dem Umwandlungsgesetz\nNordrhein-Westfalen Amtsgericht Köln HRB 56171\nTÜV Rheinland Energy & Environment GmbH – Köln",
      "type": "Registerbekanntmachung nach dem Umwandlungsgesetz",
      "state": "Nordrhein-Westfalen",
      "amtsgericht": "Amtsgericht Köln",
      "registernummer": "HRB 56171",
      "registerart": "HRB",
      "company_name": "TÜV Rheinland Energy & Environment GmbH",
      "company_seat": "Köln",
      "details": "11.03.2025 (Bekanntmachungsdatum)\n\nNordrhein-Westfalen Amtsgericht Köln HRB 56171\nRegisterbekanntmachung nach dem Umwandlungsgesetz 11.03.2025 (Eintragungsdatum)\n\nTÜV Rheinland Energy & Environment GmbH\nGesellschaft mit beschränkter Haftung\nKöln\n\nDen Gläubigern der an der Verschmelzung beteiligten Rechtsträger ist, wenn sie binnen sechs Monaten nach dem Tag, an dem die Eintragung der Verschmelzung in das Register des Sitzes desjenigen Rechtsträgers, dessen Gläubiger sie sind, nach § 19 Absatz 3 UmwG als bekanntgemacht gilt, ihren Anspruch nach Grund und Höhe schriftlich anmelden, Sicherheit zu leisten, soweit sie nicht Befriedigung verlangen können. Dieses Recht steht den Gläubigern jedoch nur zu, wenn sie glaubhaft machen, dass durch die Verschmelzung die Erfüllung ihrer Forderung gefährdet wird."
    },
    {
      "date": "2025-03-11",
      "id": "103470",
      "original_text": "Löschungsankündigung\nNordrhein-Westfalen Amtsgericht Bochum HRB 16895\nKala Bau GmbH – Witten",
      "type": "Löschungsankündigung",
      "state": "Nordrhein-Westfalen",
      "amtsgericht": "Amtsgericht Bochum",
      "registernummer": "HRB 16895",
      "registerart": "HRB",
      "company_name": "Kala Bau GmbH",
      "company_seat": "Witten",
      "details": "11.03.2025 (Bekanntmachungsdatum)\n\nNordrhein-Westfalen Amtsgericht Bochum HRB 16895\nLöschungsankündigung 12.03.2025 (Eintragungsdatum)\n\nKala Bau GmbH\nGesellschaft mit beschränkter Haftung\nWitten\n\nDas Registergericht beabsichtigt die Gesellschaft von Amts wegen nach § 394 FamFG zu löschen. Die Frist zur Erhebung eines Widerspruchs ist auf drei Monate festgesetzt."
    },
    {
      "date": "2025-03-11",
      "id": "103471",
      "original_text": "Löschungsankündigung\nNordrhein-Westfalen Amtsgericht Düsseldorf HRB 30234\nDACO-Holding GmbH – Düsseldorf",
      "type": "Löschungsankündigung",
      "state": "Nordrhein-Westfalen",
      "amtsgericht": "Amtsgericht Düsseldorf",
      "registernummer": "HRB 30234",
      "registerart": "HRB",
      "company_name": "DACO-Holding GmbH",
      "company_seat": "Düsseldorf",
      "details": "11.03.2025 (Bekanntmachungsdatum)\n\nNordrhein-Westfalen Amtsgericht Düsseldorf HRB 30234\nLöschungsankündigung\n\nDACO-Holding GmbH\nGesellschaft mit beschränkter Haftung\nDüsseldorf\n\nEs ist beabsichtigt, die Gesellschaft wegen Vermögenslosigkeit aufgrund des § 394 Abs. 1 FamFG zu löschen.\nFrist zur Geltendmachung eines Widerspruchs: 3 Wochen.\n\nRechtsbehelfsbelehrung:\nDas Widerspruchsrecht steht jedem zu, der an der Unterlassung der Löschung ein berechtigtes Interesse hat. Der Widerspruch ist bei dem Amtsgericht Düsseldorf -Registergericht-, Werdener Straße 1, 40227 Düsseldorf schriftlich in deutscher Sprache oder zur Niederschrift der Geschäftsstelle einzulegen. Der Widerspruch kann auch zur Niederschrift der Geschäftsstelle eines jeden Amtsgerichtes abgegeben werden. Die Einlegung ist auch durch Übertragung eines elektronischen Dokuments an die elektronische Poststelle des Gerichts möglich. Das elektronische Dokument muss für die Bearbeitung durch das Gericht geeignet und mit einer qualifizierten elektronischen Signatur der verantwortenden Person versehen sein oder von der verantwortenden Person signiert und auf einem sicheren Übermittlungsweg gemäß § 130a ZPO nach näherer Maßgabe der Verordnung über die technischen Rahmenbedingungen des elektronischen Rechtsverkehrs und über das besondere elektronische Behördenpostfach (BGBl. I, S.3803) eingereicht werden. Weitere Informationen erhalten Sie auf der Internetseite www.justiz.de.\nDer Widerspruch muss spätestens innerhalb der gesetzten Frist nach dem Datum der Bekanntmachung der Löschungsankündigung bei dem Amtsgericht - Registergericht - Düsseldorf eingegangen sein.  Dies gilt auch dann, wenn der Widerspruch zur Niederschrift der Geschäftsstelle eines anderen Amtsgerichtes abgegeben wurde. Die Frist beginnt mit dem Tage der Bekanntmachung der Löschungsankündigung in dem für die Bekanntmachung der Eintragungen in das Handelsregister bestimmten elektronischen Informations- und Kommunikationssystem nach § 10 des Handelsgesetzbuches. Fällt das Ende der Frist auf einen Sonntag, einen allgemeinen Feiertag oder Sonnabend, so endet die Frist mit Ablauf des nächsten Werktages.\nDer Widerspruch muss die Bezeichnung der angefochtenen Löschungsankündigung sowie die Erklärung enthalten, dass Widerspruch gegen diese Löschungsankündigung eingelegt wird. Er ist zu unterzeichnen und soll begründet werden."
    },
    {
      "date": "2025-03-11",
      "id": "103472",
      "original_text": "Registerbekanntmachung nach dem Umwandlungsgesetz\nNordrhein-Westfalen Amtsgericht Köln HRB 63817\nTVT.media Produktions GmbH – Köln",
      "type": "Registerbekanntmachung nach dem Umwandlungsgesetz",
      "state": "Nordrhein-Westfalen",
      "amtsgericht": "Amtsgericht Köln",
      "registernummer": "HRB 63817",
      "registerart": "HRB",
      "company_name": "TVT.media Produktions GmbH",
      "company_seat": "Köln",
      "details": "11.03.2025 (Bekanntmachungsdatum)\n\nNordrhein-Westfalen Amtsgericht Köln HRB 63817\nRegisterbekanntmachung nach dem Umwandlungsgesetz 11.03.2025 (Eintragungsdatum)\n\nTVT.media Produktions GmbH\nGesellschaft mit beschränkter Haftung\nKöln\n\nDen Gläubigern der an der Verschmelzung beteiligten Rechtsträger ist, wenn sie binnen sechs Monaten nach dem Tag, an dem die Eintragung der Verschmelzung in das Register des Sitzes desjenigen Rechtsträgers, dessen Gläubiger sie sind, nach § 19 Absatz 3 UmwG als bekanntgemacht gilt, ihren Anspruch nach Grund und Höhe schriftlich anmelden, Sicherheit zu leisten, soweit sie nicht Befriedigung verlangen können. Dieses Recht steht den Gläubigern jedoch nur zu, wenn sie glaubhaft machen, dass durch die Verschmelzung die Erfüllung ihrer Forderung gefährdet wird."
    },
    {
      "date": "2025-03-11",
      "id": "103473",
      "original_text": "Löschungsankündigung\nNordrhein-Westfalen Amtsgericht Essen HRB 26746\nB & C creative GmbH – Essen",
      "type": "Löschungsankündigung",
      "state": "Nordrhein-Westfalen",
      "amtsgericht": "Amtsgericht Essen",
      "registernummer": "HRB 26746",
      "registerart": "HRB",
      "company_name": "B & C creative GmbH",
      "company_seat": "Essen",
      "details": "11.03.2025 (Bekanntmachungsdatum)\n\nNordrhein-Westfalen Amtsgericht Essen HRB 26746\nLöschungsankündigung\n\nB & C creative GmbH\nGesellschaft mit beschränkter Haftung\nEssen\n\nDas Registergericht beabsichtigt die Gesellschaft von Amts wegen nach § 394 FamFG zu löschen. Die Frist zur Erhebung eines Widerspruchs ist auf einen Monat festgesetzt."
    },
    {
      "date": "2025-03-11",
      "id": "103474",
      "original_text": "Registerbekanntmachung nach dem Umwandlungsgesetz\nNordrhein-Westfalen Amtsgericht Essen HRB 30812\nFitX SE – Essen",
      "type": "Registerbekanntmachung nach dem Umwandlungsgesetz",
      "state": "Nordrhein-Westfalen",
      "amtsgericht": "Amtsgericht Essen",
      "registernummer": "HRB 30812",
      "registerart": "HRB",
      "company_name": "FitX SE",
      "company_seat": "Essen",
      "details": "11.03.2025 (Bekanntmachungsdatum)\n\nNordrhein-Westfalen Amtsgericht Essen HRB 30812\nRegisterbekanntmachung nach dem Umwandlungsgesetz 11.03.2025 (Eintragungsdatum)\n\nFitX SE\nEuropäische Aktiengesellschaft (SE)\nEssen\n\nDen Gläubigern der an der Verschmelzung beteiligten Rechtsträger ist, wenn sie binnen sechs Monaten nach dem Tag, an dem die Eintragung der Verschmelzung in das Register des Sitzes desjenigen Rechtsträgers, dessen Gläubiger sie sind, nach § 19 Absatz 3 UmwG als bekanntgemacht gilt, ihren Anspruch nach Grund und Höhe schriftlich anmelden, Sicherheit zu leisten, soweit sie nicht Befriedigung verlangen können. Dieses Recht steht den Gläubigern jedoch nur zu, wenn sie glaubhaft machen, dass durch die Verschmelzung die Erfüllung ihrer Forderung gefährdet wird."
    },
    {
      "date": "2025-03-11",
      "id": "103475",
      "original_text": "Löschungsankündigung\nNordrhein-Westfalen Amtsgericht Wuppertal HRB 29260\nKS Theaterbetriebe GmbH – Wuppertal",
      "type": "Löschungsankündigung",
      "state": "Nordrhein-Westfalen",
      "amtsgericht": "Amtsgericht Wuppertal",
      "registernummer": "HRB 29260",
      "registerart": "HRB",
      "company_name": "KS Theaterbetriebe GmbH",
      "company_seat": "Wuppertal",
      "details": "11.03.2025 (Bekanntmachungsdatum)\n\nNordrhein-Westfalen Amtsgericht Wuppertal HRB 29260\nLöschungsankündigung\n\nKS Theaterbetriebe GmbH\nGesellschaft mit beschränkter Haftung\nWuppertal\n\nDas Registergericht beabsichtigt die Gesellschaft von Amts wegen nach § 394 FamFG zu löschen. Die Frist zur Erhebung eines Widerspruchs ist auf einen Monat festgesetzt."
    },
    {
      "date": "2025-03-11",
      "id": "103476",
      "original_text": "Registerbekanntmachung nach dem Umwandlungsgesetz\nNordrhein-Westfalen Amtsgericht Münster HRA 12025\nEEK Einfalt Elektro- und Klimatechnik GmbH & Co. KG – Münster",
      "type": "Registerbekanntmachung nach dem Umwandlungsgesetz",
      "state": "Nordrhein-Westfalen",
      "amtsgericht": "Amtsgericht Münster",
      "registernummer": "HRA 12025",
      "registerart": "HRA",
      "company_name": "EEK Einfalt Elektro- und Klimatechnik GmbH & Co. KG",
      "company_seat": "Münster",
      "details": "11.03.2025 (Bekanntmachungsdatum)\n\nNordrhein-Westfalen Amtsgericht Münster HRA 12025\nRegisterbekanntmachung nach dem Umwandlungsgesetz 11.03.2025 (Eintragungsdatum)\n\nEEK Einfalt Elektro- und Klimatechnik GmbH & Co. KG\nKommanditgesellschaft\nMünster\n\nDen Gläubigern der an der Ausgliederung beteiligten Rechtsträger ist, wenn sie binnen sechs Monaten nach dem Tag, an dem die Eintragung der Ausgliederung in das Register des Sitzes desjenigen Rechtsträgers, dessen Gläubiger sie sind, nach § 19 Absatz 3 UmwG als bekanntgemacht gilt, ihren Anspruch nach Grund und Höhe schriftlich anmelden, Sicherheit zu leisten, soweit sie nicht Befriedigung verlangen können. Dieses Recht steht den Gläubigern jedoch nur zu, wenn sie glaubhaft machen, dass durch die Ausgliederung die Erfüllung ihrer Forderung gefährdet wird."
    },
    {
      "date": "2025-03-11",
      "id": "103477",
      "original_text": "Registerbekanntmachung nach dem Umwandlungsgesetz\nNordrhein-Westfalen Amtsgericht Köln HRB 44178\nTVT.media GmbH – Köln",
      "type": "Registerbekanntmachung nach dem Umwandlungsgesetz",
      "state": "Nordrhein-Westfalen",
      "amtsgericht": "Amtsgericht Köln",
      "registernummer": "HRB 44178",
      "registerart": "HRB",
      "company_name": "TVT.media GmbH",
      "company_seat": "Köln",
      "details": "11.03.2025 (Bekanntmachungsdatum)\n\nNordrhein-Westfalen Amtsgericht Köln HRB 44178\nRegisterbekanntmachung nach dem Umwandlungsgesetz 11.03.2025 (Eintragungsdatum)\n\nTVT.media GmbH\nGesellschaft mit beschränkter Haftung\nKöln\n\nDen Gläubigern der an der Verschmelzung beteiligten Rechtsträger ist, wenn sie binnen sechs Monaten nach dem Tag, an dem die Eintragung der Verschmelzung in das Register des Sitzes desjenigen Rechtsträgers, dessen Gläubiger sie sind, nach § 19 Absatz 3 UmwG als bekanntgemacht gilt, ihren Anspruch nach Grund und Höhe schriftlich anmelden, Sicherheit zu leisten, soweit sie nicht Befriedigung verlangen können. Dieses Recht steht den Gläubigern jedoch nur zu, wenn sie glaubhaft machen, dass durch die Verschmelzung die Erfüllung ihrer Forderung gefährdet wird."
    },
    {
      "date": "2025-03-11",
      "id": "103478",
      "original_text": "Einreichung neuer Dokumente\nNordrhein-Westfalen Amtsgericht Düsseldorf HRB 12073\nÖRAG Rechtsschutzversicherungs-Aktiengesellschaft – Düsseldorf",
      "type": "Einreichung neuer Dokumente",
      "state": "Nordrhein-Westfalen",
      "amtsgericht": "Amtsgericht Düsseldorf",
      "registernummer": "HRB 12073",
      "registerart": "HRB",
      "company_name": "ÖRAG Rechtsschutzversicherungs-Aktiengesellschaft",
      "company_seat": "Düsseldorf",
      "details": "11.03.2025 (Bekanntmachungsdatum)\n\nNordrhein-Westfalen Amtsgericht Düsseldorf HRB 12073\nEinreichung neuer Dokumente\n\nÖRAG Rechtsschutzversicherungs-Aktiengesellschaft\nAktiengesellschaft\nDüsseldorf\n\nDem Registergericht ist eine Liste der Mitglieder des Aufsichtsrates eingereicht worden."
    },
    {
      "date": "2025-03-11",
      "id": "103479",
      "original_text": "Löschungsankündigung\nNordrhein-Westfalen Amtsgericht Mönchengladbach HRB 14812\nH.T.G. GmbH – Mönchengladbach",
      "type": "Löschungsankündigung",
      "state": "Nordrhein-Westfalen",
      "amtsgericht": "Amtsgericht Mönchengladbach",
      "registernummer": "HRB 14812",
      "registerart": "HRB",
      "company_name": "H.T.G. GmbH",
      "company_seat": "Mönchengladbach",
      "details": "11.03.2025 (Bekanntmachungsdatum)\n\nNordrhein-Westfalen Amtsgericht Mönchengladbach HRB 14812\nLöschungsankündigung 11.03.2025 (Eintragungsdatum)\n\nH.T.G. GmbH\nGesellschaft mit beschränkter Haftung\nMönchengladbach\n\nDas Registergericht beabsichtigt die Gesellschaft von Amts wegen nach § 394 FamFG zu löschen. Die Frist zur Erhebung eines Widerspruchs ist auf drei Monate festgesetzt."
    },
    {
      "date": "2025-03-11",
      "id": "103480",
      "original_text": "Registerbekanntmachung nach dem Umwandlungsgesetz\nSachsen Amtsgericht Leipzig HRB 1694\nPROKULIT Rolladentechnik GmbH – Jesewitz",
      "type": "Registerbekanntmachung nach dem Umwandlungsgesetz",
      "state": "Sachsen",
      "amtsgericht": "Amtsgericht Leipzig",
      "registernummer": "HRB 1694",
      "registerart": "HRB",
      "company_name": "PROKULIT Rolladentechnik GmbH",
      "company_seat": "Jesewitz",
      "details": "11.03.2025 (Bekanntmachungsdatum)\n\nSachsen Amtsgericht Leipzig HRB 1694\nRegisterbekanntmachung nach dem Umwandlungsgesetz 11.03.2025 (Eintragungsdatum)\n\nPROKULIT Rolladentechnik GmbH\nGesellschaft mit beschränkter Haftung\nJesewitz\n\nDen Gläubigern der an der Verschmelzung beteiligten Rechtsträger ist, wenn sie binnen sechs Monaten nach dem Tag, an dem die Eintragung der Verschmelzung in das Register des Sitzes desjenigen Rechtsträgers, dessen Gläubiger sie sind, nach § 19 Abs. 3 UmwG als bekannt gemacht gilt, ihren Anspruch nach Grund und Höhe in Textform anmelden, Sicherheit zu leisten, soweit sie nicht Befriedigung verlangen können. Dieses Recht steht den Gläubigern jedoch nur zu, wenn sie glaubhaft machen, dass durch die Verschmelzung die Erfüllung der Forderung gefährdet wird."
    },
    {
      "date": "2025-03-11",
      "id": "103481",
      "original_text": "Registerbekanntmachung nach dem Umwandlungsgesetz\nThüringen Amtsgericht Jena HRB 522994\nKöber - Die mobile Krankenpflege GmbH – Bürgel",
      "type": "Registerbekanntmachung nach dem Umwandlungsgesetz",
      "state": "Thüringen",
      "amtsgericht": "Amtsgericht Jena",
      "registernummer": "HRB 522994",
      "registerart": "HRB",
      "company_name": "Köber - Die mobile Krankenpflege GmbH",
      "company_seat": "Bürgel",
      "details": "11.03.2025 (Bekanntmachungsdatum)\n\nThüringen Amtsgericht Jena HRB 522994\nRegisterbekanntmachung nach dem Umwandlungsgesetz 11.03.2025 (Eintragungsdatum)\n\nKöber - Die mobile Krankenpflege GmbH\nGesellschaft mit beschränkter Haftung\nBürgel\n\nNicht eingetragen: Den Gläubigern der an der Ausgliederung beteiligten Rechtsträger, ist wenn sie binnen sechs Monaten nach dem Tag, an dem die Eintragung der Ausgliederung in das Register des Sitzes desjenigen Rechtsträgers, dessen Gläubiger sie sind, nach §§125, 19 Abs. 3 UmwG als bekanntgemacht gilt, ihren Anspruch nach Grund und Höhe schriftlich anmelden, Sicherheit zu leisten, soweit sie nicht Befriedigung verlangen können. Dieses Recht steht ihnen jedoch nur zu, wenn sie glaubhaft machen, daß durch die Ausgliederung die Erfüllung ihrer Forderung gefährdet wird."
    },
    {
      "date": "2025-03-11",
      "id": "103482",
      "original_text": "Registerbekanntmachung nach dem Umwandlungsgesetz\nThüringen Amtsgericht Jena HRA 506961\nKöber - Die mobile Krankenpflege e. K. – Bürgel",
      "type": "Registerbekanntmachung nach dem Umwandlungsgesetz",
      "state": "Thüringen",
      "amtsgericht": "Amtsgericht Jena",
      "registernummer": "HRA 506961",
      "registerart": "HRA",
      "company_name": "Köber - Die mobile Krankenpflege e. K.",
      "company_seat": "Bürgel",
      "details": "11.03.2025 (Bekanntmachungsdatum)\n\nThüringen Amtsgericht Jena HRA 506961\nRegisterbekanntmachung nach dem Umwandlungsgesetz 11.03.2025 (Eintragungsdatum)\n\nKöber - Die mobile Krankenpflege e. K.\nEinzelkaufmann / Einzelkauffrau\nBürgel\n\nNicht eingetragen: Den Gläubigern der an der Ausgliederung beteiligten Rechtsträger, ist wenn sie binnen sechs Monaten nach dem Tag, an dem die Eintragung der Ausgliederung in das Register des Sitzes desjenigen Rechtsträgers, dessen Gläubiger sie sind, nach §§125, 19 Abs. 3 UmwG als bekanntgemacht gilt, ihren Anspruch nach Grund und Höhe schriftlich anmelden, Sicherheit zu leisten, soweit sie nicht Befriedigung verlangen können. Dieses Recht steht ihnen jedoch nur zu, wenn sie glaubhaft machen, daß durch die Ausgliederung die Erfüllung ihrer Forderung gefährdet wird."
    },
    {
      "date": "2025-03-11",
      "id": "103483",
      "original_text": "Löschungsankündigung\nHessen Amtsgericht Offenbach am Main HRA 22058\nHWH Winter Gesellschaft mbH und Co. KG – Hainburg",
      "type": "Löschungsankündigung",
      "state": "Hessen",
      "amtsgericht": "Amtsgericht Offenbach am Main",
      "registernummer": "HRA 22058",
      "registerart": "HRA",
      "company_name": "HWH Winter Gesellschaft mbH und Co. KG",
      "company_seat": "Hainburg",
      "details": "11.03.2025 (Bekanntmachungsdatum)\n\nHessen Amtsgericht Offenbach am Main HRA 22058\nLöschungsankündigung\n\nHWH Winter Gesellschaft mbH und Co. KG\nKommanditgesellschaft\nHainburg\n\nDas Registergericht beabsichtigt die im Handelsregister eingetragene Firma von Amts wegen nach § 394 FamFG zu löschen. Die Frist zur Erhebung eines Widerspruchs gegen die beabsichtigte Löschung wird auf 3 Monate festgesetzt."
    },
    {
      "date": "2025-03-11",
      "id": "103484",
      "original_text": "Löschungsankündigung\nHessen Amtsgericht Offenbach am Main HRB 51088\nDSD GmbH – Neu-Isenburg",
      "type": "Löschungsankündigung",
      "state": "Hessen",
      "amtsgericht": "Amtsgericht Offenbach am Main",
      "registernummer": "HRB 51088",
      "registerart": "HRB",
      "company_name": "DSD GmbH",
      "company_seat": "Neu-Isenburg",
      "details": "11.03.2025 (Bekanntmachungsdatum)\n\nHessen Amtsgericht Offenbach am Main HRB 51088\nLöschungsankündigung\n\nDSD GmbH\nGesellschaft mit beschränkter Haftung\nNeu-Isenburg\n\nDas Registergericht beabsichtigt die im Handelsregister eingetragene Gesellschaft von Amts wegen nach § 394 FamFG zu löschen. Die Frist zur Erhebung eines Widerspruchs gegen die beabsichtigte Löschung wird auf 3 Monate festgesetzt."
    },
    {
      "date": "2025-03-11",
      "id": "103485",
      "original_text": "Löschungsankündigung\nHessen Amtsgericht Frankfurt am Main HRB 128216\nAlles Buntes GmbH – Frankfurt am Main",
      "type": "Löschungsankündigung",
      "state": "Hessen",
      "amtsgericht": "Amtsgericht Frankfurt am Main",
      "registernummer": "HRB 128216",
      "registerart": "HRB",
      "company_name": "Alles Buntes GmbH",
      "company_seat": "Frankfurt am Main",
      "details": "11.03.2025 (Bekanntmachungsdatum)\n\nHessen Amtsgericht Frankfurt am Main HRB 128216\nLöschungsankündigung\n\nAlles Buntes GmbH\nGesellschaft mit beschränkter Haftung\nFrankfurt am Main\n\nDas Registergericht beabsichtigt die im Handelsregister eingetragene Gesellschaft von Amts wegen nach § 394 FamFG zu löschen. Hiergegen kann innerhalb eines Zeitraums von 3 Monaten nach dieser Veröffentlichung Widerspruch bei dem Amtsgericht Frankfurt am Main eingelegt werden."
    },
    {
      "date": "2025-03-11",
      "id": "103486",
      "original_text": "Löschungsankündigung\nHessen Amtsgericht Offenbach am Main HRA 41392\nbc Objekt e.k. – Offenbach am Main",
      "type": "Löschungsankündigung",
      "state": "Hessen",
      "amtsgericht": "Amtsgericht Offenbach am Main",
      "registernummer": "HRA 41392",
      "registerart": "HRA",
      "company_name": "bc Objekt e.k.",
      "company_seat": "Offenbach am Main",
      "details": "11.03.2025 (Bekanntmachungsdatum)\n\nHessen Amtsgericht Offenbach am Main HRA 41392\nLöschungsankündigung 11.03.2025 (Eintragungsdatum)\n\nbc Objekt e.k.\nEinzelkaufmann / Einzelkauffrau\nOffenbach am Main\n\nDas Registergericht beabsichtigt die im Handelsregister eingetragene Firma von Amts wegen nach § 31 Abs. 2 Satz 2 HGB i.V.m. § 393 FamFG zu löschen. Die Frist zur Erhebung eines Widerspruchs gegen die beabsichtigte Löschung wird auf 3 Monate festgesetzt."
    },
    {
      "date": "2025-03-11",
      "id": "103487",
      "original_text": "Löschungsankündigung\nHessen Amtsgericht Offenbach am Main HRB 56132\nLUXEB Trading UG (haftungsbeschränkt) – Mühlheim am Main",
      "type": "Löschungsankündigung",
      "state": "Hessen",
      "amtsgericht": "Amtsgericht Offenbach am Main",
      "registernummer": "HRB 56132",
      "registerart": "HRB",
      "company_name": "LUXEB Trading UG (haftungsbeschränkt)",
      "company_seat": "Mühlheim am Main",
      "details": "11.03.2025 (Bekanntmachungsdatum)\n\nHessen Amtsgericht Offenbach am Main HRB 56132\nLöschungsankündigung 11.03.2025 (Eintragungsdatum)\n\nLUXEB Trading UG (haftungsbeschränkt)\nGesellschaft mit beschränkter Haftung\nMühlheim am Main\n\nDas Registergericht beabsichtigt die im Handelsregister eingetragene Gesellschaft von Amts wegen nach § 394 FamFG zu löschen. Die Frist zur Erhebung eines Widerspruchs gegen die beabsichtigte Löschung wird auf 3 Monate festgesetzt."
    },
    {
      "date": "2025-03-11",
      "id": "103488",
      "original_text": "Löschungsankündigung\nHessen Amtsgericht Offenbach am Main HRB 50797\nAUTOMOTIVE Plus Handel & Vermietung GmbH – Offenbach am Main",
      "type": "Löschungsankündigung",
      "state": "Hessen",
      "amtsgericht": "Amtsgericht Offenbach am Main",
      "registernummer": "HRB 50797",
      "registerart": "HRB",
      "company_name": "AUTOMOTIVE Plus Handel & Vermietung GmbH",
      "company_seat": "Offenbach am Main",
      "details": "11.03.2025 (Bekanntmachungsdatum)\n\nHessen Amtsgericht Offenbach am Main HRB 50797\nLöschungsankündigung\n\nAUTOMOTIVE Plus Handel & Vermietung GmbH\nGesellschaft mit beschränkter Haftung\nOffenbach am Main\n\nDas Registergericht beabsichtigt die im Hndelsregister eingetragene Gesellschaft von Amts wegen nach § 394 FamFG zu löschen. Die Frist zur Erhebung eines Widerspruchs gegen die beabsichtigte Löschung wird auf 3 Monate festgesetzt."
    },
    {
      "date": "2025-03-11",
      "id": "103489",
      "original_text": "Löschungsankündigung\nHessen Amtsgericht Offenbach am Main HRB 54698\nCuverid Group Verwaltungs GmbH – Neu-Isenburg",
      "type": "Löschungsankündigung",
      "state": "Hessen",
      "amtsgericht": "Amtsgericht Offenbach am Main",
      "registernummer": "HRB 54698",
      "registerart": "HRB",
      "company_name": "Cuverid Group Verwaltungs GmbH",
      "company_seat": "Neu-Isenburg",
      "details": "11.03.2025 (Bekanntmachungsdatum)\n\nHessen Amtsgericht Offenbach am Main HRB 54698\nLöschungsankündigung\n\nCuverid Group Verwaltungs GmbH\nGesellschaft mit beschränkter Haftung\nNeu-Isenburg\n\nDas Registergericht beabsichtigt die im Handelsregister eingetragene Gesellschaft von Amts wegen nach § 394 FamFG zu löschen. Die Frist zur Erhebung eines Widerspruchs gegen die beabsichtigte Löschung wird auf 3 Monate festgesetzt."
    },
    {
      "date": "2025-03-11",
      "id": "103490",
      "original_text": "Löschungsankündigung\nHessen Amtsgericht Offenbach am Main HRB 46988\nEJR Gerüstbau GmbH – Neu-Isenburg",
      "type": "Löschungsankündigung",
      "state": "Hessen",
      "amtsgericht": "Amtsgericht Offenbach am Main",
      "registernummer": "HRB 46988",
      "registerart": "HRB",
      "company_name": "EJR Gerüstbau GmbH",
      "company_seat": "Neu-Isenburg",
      "details": "11.03.2025 (Bekanntmachungsdatum)\n\nHessen Amtsgericht Offenbach am Main HRB 46988\nLöschungsankündigung\n\nEJR Gerüstbau GmbH\nGesellschaft mit beschränkter Haftung\nNeu-Isenburg\n\nDas Registergericht beabsichtigt die im Handelsregister eingetragene Gesellschaft von Amts wegen nach § 394 FamFG zu löschen. Die Frist zur Erhebung eines Widerspruchs gegen die beabsichtigte Löschung wird auf 3 Monate festgesetzt."
    },
    {
      "date": "2025-03-11",
      "id": "103491",
      "original_text": "Einreichung neuer Dokumente\nHessen Amtsgericht Fulda HRB 2099\nJOBAG Personaldienstleistungen AG – Fulda",
      "type": "Einreichung neuer Dokumente",
      "state": "Hessen",
      "amtsgericht": "Amtsgericht Fulda",
      "registernummer": "HRB 2099",
      "registerart": "HRB",
      "company_name": "JOBAG Personaldienstleistungen AG",
      "company_seat": "Fulda",
      "details": "11.03.2025 (Bekanntmachungsdatum)\n\nHessen Amtsgericht Fulda HRB 2099\nEinreichung neuer Dokumente\n\nJOBAG Personaldienstleistungen AG\nAktiengesellschaft\nFulda\n\nDurch eine Änderung in den Personen der Aufsichtsratsmitglieder ist eine Liste der Mitglieder des Aufsichtsrates zum Handelsregister eingereicht worden."
    },
    {
      "date": "2025-03-11",
      "id": "103492",
      "original_text": "Sonstige Registerbekanntmachung\nHessen Amtsgericht Darmstadt VR 3395\nArbeitsgemeinschaft Onlineforschung e.V. – Darmstadt",
      "type": "Sonstige Registerbekanntmachung",
      "state": "Hessen",
      "amtsgericht": "Amtsgericht Darmstadt",
      "registernummer": "VR 3395",
      "registerart": "VR",
      "company_name": "Arbeitsgemeinschaft Onlineforschung e.V.",
      "company_seat": "Darmstadt",
      "details": "11.03.2025 (Bekanntmachungsdatum)\n\nHessen Amtsgericht Darmstadt VR 3395\nSonstige Registerbekanntmachung 11.03.2025 (Eintragungsdatum)\n\nArbeitsgemeinschaft Onlineforschung e.V.\neingetragener Verein\nDarmstadt\n\nDer Verein ist aufgelöst."
    },
    {
      "date": "2025-03-11",
      "id": "103493",
      "original_text": "Löschungsankündigung\nHessen Amtsgericht Offenbach am Main HRB 53998\nFCS FirstClass Services GmbH – Offenbach am Main",
      "type": "Löschungsankündigung",
      "state": "Hessen",
      "amtsgericht": "Amtsgericht Offenbach am Main",
      "registernummer": "HRB 53998",
      "registerart": "HRB",
      "company_name": "FCS FirstClass Services GmbH",
      "company_seat": "Offenbach am Main",
      "details": "11.03.2025 (Bekanntmachungsdatum)\n\nHessen Amtsgericht Offenbach am Main HRB 53998\nLöschungsankündigung\n\nFCS FirstClass Services GmbH\nGesellschaft mit beschränkter Haftung\nOffenbach am Main\n\nDas Registergericht beabsichtigt die im Handelsregister eingetragene Gesellschaft von Amts wegen nach § 394 FamFG zu löschen. Die Frist zur Erhebung eines Widerspruchs gegen die beabsichtigte Löschung wird auf 3 Monate festgesetzt."
    },
    {
      "date": "2025-03-11",
      "id": "103494",
      "original_text": "Registerbekanntmachung nach dem Umwandlungsgesetz\nHessen Amtsgericht Darmstadt HRB 107047\nMepla Software GmbH – Darmstadt",
      "type": "Registerbekanntmachung nach dem Umwandlungsgesetz",
      "state": "Hessen",
      "amtsgericht": "Amtsgericht Darmstadt",
      "registernummer": "HRB 107047",
      "registerart": "HRB",
      "company_name": "Mepla Software GmbH",
      "company_seat": "Darmstadt",
      "details": "11.03.2025 (Bekanntmachungsdatum)\n\nHessen Amtsgericht Darmstadt HRB 107047\nRegisterbekanntmachung nach dem Umwandlungsgesetz 11.03.2025 (Eintragungsdatum)\n\nMepla Software GmbH\nGesellschaft mit beschränkter Haftung\nDarmstadt\n\nDen Gläubigern der an der Ausgliederung beteiligten Rechtsträger ist, wenn sie binnen sechs Monaten nach dem Tag, an dem die Eintragung der Ausgliederung in das Register des Sitzes derjenigen Rechtsträger deren Gläubiger sie sind, nach §§ 125, 19 Absatz 3 UmwG bekannt gemacht worden ist, ihren Anspruch nach Grund und Höhe schriftlich anmelden, Sicherheit zu leisten, soweit sie nicht Befriedigung verlangen können. Dieses Recht steht den Gläubigern jedoch nur zu, wenn sie glaubhaft machen, dass durch die Ausgliederung die Erfüllung ihrer Forderung gefährdet wird."
    }
  ]
}