{
  "date": "2025-03-01",
  "date_of_scrape": "2025-03-02T04:03:20.289Z",
  "tool_version": "0.2.0",
  "number_of_announcements": 20,
  "announcements": [
    {
      "date": "2025-03-01",
      "id": "102631",
      "original_text": "Registerbekanntmachung nach dem Umwandlungsgesetz\nBayern Amtsgericht München HRB 187762\nTeam! Licensing GmbH – München",
      "type": "Registerbekanntmachung nach dem Umwandlungsgesetz",
      "state": "Bayern",
      "amtsgericht": "Amtsgericht München",
      "registernummer": "HRB 187762",
      "registerart": "HRB",
      "company_name": "Team! Licensing GmbH",
      "company_seat": "München",
      "details": "01.03.2025 (Bekanntmachungsdatum)\n\nBayern Amtsgericht München HRB 187762\nRegisterbekanntmachung nach dem Umwandlungsgesetz 28.02.2025 (Eintragungsdatum)\n\nTeam! Licensing GmbH\nGesellschaft mit beschränkter Haftung\nMünchen\n\nDen Gläubigern der an der Verschmelzung beteiligten Rechtsträger ist, wenn sie binnen sechs Monaten nach dem Tag, an dem die Eintragung der Verschmelzung in das Register des Sitzes desjenigen Rechtsträgers, dessen Gläubiger sie sind, nach § 19 Abs. 3 UmwG als bekannt gemacht gilt, ihren Anspruch nach Grund und Höhe in Textform anmelden, Sicherheit zu leisten, soweit sie nicht Befriedigung verlangen können. Dieses Recht steht den Gläubigern jedoch nur zu, wenn sie glaubhaft machen, dass durch die Verschmelzung die Erfüllung ihrer Forderung gefährdet wird."
    },
    {
      "date": "2025-03-01",
      "id": "102632",
      "original_text": "Registerbekanntmachung nach dem Umwandlungsgesetz\nBayern Amtsgericht Fürth HRB 17622\nGigel UG (haftungsbeschränkt) – Fürth",
      "type": "Registerbekanntmachung nach dem Umwandlungsgesetz",
      "state": "Bayern",
      "amtsgericht": "Amtsgericht Fürth",
      "registernummer": "HRB 17622",
      "registerart": "HRB",
      "company_name": "Gigel UG (haftungsbeschränkt)",
      "company_seat": "Fürth",
      "details": "01.03.2025 (Bekanntmachungsdatum)\n\nBayern Amtsgericht Fürth HRB 17622\nRegisterbekanntmachung nach dem Umwandlungsgesetz 28.02.2025 (Eintragungsdatum)\n\nGigel UG (haftungsbeschränkt)\nGesellschaft mit beschränkter Haftung\nFürth\n\nDen Gläubigern der an der Verschmelzung beteiligten Rechtsträger ist, wenn sie binnen sechs Monaten nach dem Tag, an dem die Eintragung der Verschmelzung in das Register des Sitzes desjenigen Rechtsträgers, dessen Gläubiger sie sind, nach § 19 Abs. 3 UmwG als bekannt gemacht gilt, ihren Anspruch nach Grund und Höhe in Textform anmelden, Sicherheit zu leisten, soweit sie nicht Befriedigung verlangen können. Dieses Recht steht den Gläubigern jedoch nur zu, wenn sie glaubhaft machen, dass durch die Verschmelzung die Erfüllung ihrer Forderung gefährdet wird."
    },
    {
      "date": "2025-03-01",
      "id": "102633",
      "original_text": "Registerbekanntmachung nach dem Umwandlungsgesetz\nBayern Amtsgericht Augsburg HRA 21580\nSchaller OHG – Schwifting",
      "type": "Registerbekanntmachung nach dem Umwandlungsgesetz",
      "state": "Bayern",
      "amtsgericht": "Amtsgericht Augsburg",
      "registernummer": "HRA 21580",
      "registerart": "HRA",
      "company_name": "Schaller OHG",
      "company_seat": "Schwifting",
      "details": "01.03.2025 (Bekanntmachungsdatum)\n\nBayern Amtsgericht Augsburg HRA 21580\nRegisterbekanntmachung nach dem Umwandlungsgesetz 28.02.2025 (Eintragungsdatum)\n\nSchaller OHG\nOffene Handelsgesellschaft\nSchwifting\n\nDen Gläubigern des formwechselnden Rechtsträgers ist, wenn sie binnen sechs Monaten nach dem Tag, an dem die Eintragung des Formwechsels nach § 201 UmwG als bekannt gemacht gilt, ihren Anspruch nach Grund und Höhe in Textform anmelden, Sicherheit zu leisten, soweit sie nicht Befriedigung verlangen können. Dieses Recht steht den Gläubigern jedoch nur zu, wenn sie glaubhaft machen, dass durch den Formwechsel die Erfüllung ihrer Forderung gefährdet wird."
    },
    {
      "date": "2025-03-01",
      "id": "102634",
      "original_text": "Registerbekanntmachung nach dem Umwandlungsgesetz\nBayern Amtsgericht München HRB 252114\nPlahoma Eleven GmbH – München",
      "type": "Registerbekanntmachung nach dem Umwandlungsgesetz",
      "state": "Bayern",
      "amtsgericht": "Amtsgericht München",
      "registernummer": "HRB 252114",
      "registerart": "HRB",
      "company_name": "Plahoma Eleven GmbH",
      "company_seat": "München",
      "details": "01.03.2025 (Bekanntmachungsdatum)\n\nBayern Amtsgericht München HRB 252114\nRegisterbekanntmachung nach dem Umwandlungsgesetz 28.02.2025 (Eintragungsdatum)\n\nPlahoma Eleven GmbH\nGesellschaft mit beschränkter Haftung\nMünchen\n\nDen Gläubigern der an der Verschmelzung beteiligten Rechtsträger ist, wenn sie binnen sechs Monaten nach dem Tag, an dem die Eintragung der Verschmelzung in das Register des Sitzes desjenigen Rechtsträgers, dessen Gläubiger sie sind, nach § 19 Abs. 3 UmwG als bekannt gemacht gilt, ihren Anspruch nach Grund und Höhe schriftlich anmelden, Sicherheit zu leisten, soweit sie nicht Befriedigung verlangen können. Dieses Recht steht den Gläubigern jedoch nur zu, wenn sie glaubhaft machen, dass durch die Verschmelzung die Erfüllung ihrer Forderung gefährdet wird."
    },
    {
      "date": "2025-03-01",
      "id": "102635",
      "original_text": "Löschungsankündigung\nBayern Amtsgericht Nürnberg HRB 35743\nKML Putz & Stuck UG (haftungsbeschränkt) – Nürnberg",
      "type": "Löschungsankündigung",
      "state": "Bayern",
      "amtsgericht": "Amtsgericht Nürnberg",
      "registernummer": "HRB 35743",
      "registerart": "HRB",
      "company_name": "KML Putz & Stuck UG (haftungsbeschränkt)",
      "company_seat": "Nürnberg",
      "details": "01.03.2025 (Bekanntmachungsdatum)\n\nBayern Amtsgericht Nürnberg HRB 35743\nLöschungsankündigung\n\nKML Putz & Stuck UG (haftungsbeschränkt)\nGesellschaft mit beschränkter Haftung\nNürnberg\n\nDas Registergericht beabsichtigt, die im Handelsregister eingetragene Gesellschaft wegen Vermögenslosigkeit von Amts wegen nach § 394 FamFG zu löschen. Die Frist zur Erhebung eines Widerspruchs ist auf einen Monat festgesetzt."
    },
    {
      "date": "2025-03-01",
      "id": "102636",
      "original_text": "Löschungsankündigung\nBayern Amtsgericht Nürnberg HRB 35743\nKML Putz & Stuck UG (haftungsbeschränkt) – Nürnberg",
      "type": "Löschungsankündigung",
      "state": "Bayern",
      "amtsgericht": "Amtsgericht Nürnberg",
      "registernummer": "HRB 35743",
      "registerart": "HRB",
      "company_name": "KML Putz & Stuck UG (haftungsbeschränkt)",
      "company_seat": "Nürnberg",
      "details": "01.03.2025 (Bekanntmachungsdatum)\n\nBayern Amtsgericht Nürnberg HRB 35743\nLöschungsankündigung\n\nKML Putz & Stuck UG (haftungsbeschränkt)\nGesellschaft mit beschränkter Haftung\nNürnberg\n\nDas Registergericht beabsichtigt, die im Handelsregister eingetragene Gesellschaft wegen Vermögenslosigkeit von Amts wegen nach § 394 FamFG zu löschen. Die Frist zur Erhebung eines Widerspruchs ist auf einen Monat festgesetzt."
    },
    {
      "date": "2025-03-01",
      "id": "102637",
      "original_text": "Registerbekanntmachung nach dem Umwandlungsgesetz\nBayern Amtsgericht München HRB 297821\nAutohaus Kevek GmbH – Miesbach",
      "type": "Registerbekanntmachung nach dem Umwandlungsgesetz",
      "state": "Bayern",
      "amtsgericht": "Amtsgericht München",
      "registernummer": "HRB 297821",
      "registerart": "HRB",
      "company_name": "Autohaus Kevek GmbH",
      "company_seat": "Miesbach",
      "details": "01.03.2025 (Bekanntmachungsdatum)\n\nBayern Amtsgericht München HRB 297821\nRegisterbekanntmachung nach dem Umwandlungsgesetz 28.02.2025 (Eintragungsdatum)\n\nAutohaus Kevek GmbH\nGesellschaft mit beschränkter Haftung\nMiesbach\n\nDen Gläubigern der an der Ausgliederung beteiligten Rechtsträger ist, wenn sie binnen sechs Monaten nach dem Tag, an dem die Eintragung der Ausgliederung in das Register des Sitzes desjenigen Rechtsträgers, dessen Gläubiger sie sind, nach §§ 125, 19 Abs. 3 UmwG als bekannt gemacht gilt, ihren Anspruch nach Grund und Höhe in Textform anmelden, Sicherheit zu leisten, soweit sie nicht Befriedigung verlangen können. Dieses Recht steht den Gläubigern jedoch nur zu, wenn sie glaubhaft machen, dass durch die Ausgliederung die Erfüllung ihrer Forderung gefährdet wird."
    },
    {
      "date": "2025-03-01",
      "id": "102638",
      "original_text": "Registerbekanntmachung nach dem Umwandlungsgesetz\nBayern Amtsgericht München HRB 112769\nCopyright Promotions Licensing Group GmbH – München",
      "type": "Registerbekanntmachung nach dem Umwandlungsgesetz",
      "state": "Bayern",
      "amtsgericht": "Amtsgericht München",
      "registernummer": "HRB 112769",
      "registerart": "HRB",
      "company_name": "Copyright Promotions Licensing Group GmbH",
      "company_seat": "München",
      "details": "01.03.2025 (Bekanntmachungsdatum)\n\nBayern Amtsgericht München HRB 112769\nRegisterbekanntmachung nach dem Umwandlungsgesetz 28.02.2025 (Eintragungsdatum)\n\nCopyright Promotions Licensing Group GmbH\nGesellschaft mit beschränkter Haftung\nMünchen\n\nDen Gläubigern der an der Verschmelzung beteiligten Rechtsträger ist, wenn sie binnen sechs Monaten nach dem Tag, an dem die Eintragung der Verschmelzung in das Register des Sitzes desjenigen Rechtsträgers, dessen Gläubiger sie sind, nach § 19 Abs. 3 UmwG als bekannt gemacht gilt, ihren Anspruch nach Grund und Höhe in Textform anmelden, Sicherheit zu leisten, soweit sie nicht Befriedigung verlangen können. Dieses Recht steht den Gläubigern jedoch nur zu, wenn sie glaubhaft machen, dass durch die Verschmelzung die Erfüllung ihrer Forderung gefährdet wird."
    },
    {
      "date": "2025-03-01",
      "id": "102639",
      "original_text": "Löschungsankündigung\nBayern Amtsgericht Nürnberg HRB 21848\nNBF Massivhaus GmbH – Parsberg",
      "type": "Löschungsankündigung",
      "state": "Bayern",
      "amtsgericht": "Amtsgericht Nürnberg",
      "registernummer": "HRB 21848",
      "registerart": "HRB",
      "company_name": "NBF Massivhaus GmbH",
      "company_seat": "Parsberg",
      "details": "01.03.2025 (Bekanntmachungsdatum)\n\nBayern Amtsgericht Nürnberg HRB 21848\nLöschungsankündigung\n\nNBF Massivhaus GmbH\nGesellschaft mit beschränkter Haftung\nParsberg\n\nDas Registergericht beabsichtigt, die im Handelsregister eingetragene Gesellschaft wegen Vermögenslosigkeit von Amts wegen nach § 394 FamFG zu löschen. Die Frist zur Erhebung eines Widerspruchs ist auf einen Monat festgesetzt."
    },
    {
      "date": "2025-03-01",
      "id": "102640",
      "original_text": "Löschungsankündigung\nBayern Amtsgericht Nürnberg HRB 32547\nEA Trading GmbH – Nürnberg",
      "type": "Löschungsankündigung",
      "state": "Bayern",
      "amtsgericht": "Amtsgericht Nürnberg",
      "registernummer": "HRB 32547",
      "registerart": "HRB",
      "company_name": "EA Trading GmbH",
      "company_seat": "Nürnberg",
      "details": "01.03.2025 (Bekanntmachungsdatum)\n\nBayern Amtsgericht Nürnberg HRB 32547\nLöschungsankündigung\n\nEA Trading GmbH\nGesellschaft mit beschränkter Haftung\nNürnberg\n\nDas Registergericht beabsichtigt, die im Handelsregister eingetragene Gesellschaft wegen Vermögenslosigkeit von Amts wegen nach § 394 FamFG zu löschen. Die Frist zur Erhebung eines Widerspruchs ist auf einen Monat festgesetzt."
    },
    {
      "date": "2025-03-01",
      "id": "102641",
      "original_text": "Löschungsankündigung\nBayern Amtsgericht Nürnberg HRB 32547\nEA Trading GmbH – Nürnberg",
      "type": "Löschungsankündigung",
      "state": "Bayern",
      "amtsgericht": "Amtsgericht Nürnberg",
      "registernummer": "HRB 32547",
      "registerart": "HRB",
      "company_name": "EA Trading GmbH",
      "company_seat": "Nürnberg",
      "details": "01.03.2025 (Bekanntmachungsdatum)\n\nBayern Amtsgericht Nürnberg HRB 32547\nLöschungsankündigung\n\nEA Trading GmbH\nGesellschaft mit beschränkter Haftung\nNürnberg\n\nDas Registergericht beabsichtigt, die im Handelsregister eingetragene Gesellschaft wegen Vermögenslosigkeit von Amts wegen nach § 394 FamFG zu löschen. Die Frist zur Erhebung eines Widerspruchs ist auf einen Monat festgesetzt."
    },
    {
      "date": "2025-03-01",
      "id": "102642",
      "original_text": "Löschungsankündigung\nBayern Amtsgericht München HRB 163205\nVideri Concept GmbH – München",
      "type": "Löschungsankündigung",
      "state": "Bayern",
      "amtsgericht": "Amtsgericht München",
      "registernummer": "HRB 163205",
      "registerart": "HRB",
      "company_name": "Videri Concept GmbH",
      "company_seat": "München",
      "details": "01.03.2025 (Bekanntmachungsdatum)\n\nBayern Amtsgericht München HRB 163205\nLöschungsankündigung 28.02.2025 (Eintragungsdatum)\n\nVideri Concept GmbH\nGesellschaft mit beschränkter Haftung\nMünchen\n\nDas Registergericht beabsichtigt, die im Handelsregister eingetragene Gesellschaft wegen Vermögenslosigkeit von Amts wegen nach § 394 FamFG zu löschen. Die Frist zur Erhebung eines Widerspruchs ist auf drei Monate festgesetzt."
    },
    {
      "date": "2025-03-01",
      "id": "102643",
      "original_text": "Registerbekanntmachung nach dem Umwandlungsgesetz\nBayern Amtsgericht Augsburg HRB 1272\nVVS Verpackungs- und Versandservice GmbH – Aichach",
      "type": "Registerbekanntmachung nach dem Umwandlungsgesetz",
      "state": "Bayern",
      "amtsgericht": "Amtsgericht Augsburg",
      "registernummer": "HRB 1272",
      "registerart": "HRB",
      "company_name": "VVS Verpackungs- und Versandservice GmbH",
      "company_seat": "Aichach",
      "details": "01.03.2025 (Bekanntmachungsdatum)\n\nBayern Amtsgericht Augsburg HRB 1272\nRegisterbekanntmachung nach dem Umwandlungsgesetz 28.02.2025 (Eintragungsdatum)\n\nVVS Verpackungs- und Versandservice GmbH\nGesellschaft mit beschränkter Haftung\nAichach\n\nDen Gläubigern der an der Verschmelzung beteiligten Rechtsträger ist, wenn sie binnen sechs Monaten nach dem Tag, an dem die Eintragung der Verschmelzung in das Register des Sitzes desjenigen Rechtsträgers, dessen Gläubiger sie sind, nach § 19 Abs. 3 UmwG als bekannt gemacht gilt, ihren Anspruch nach Grund und Höhe in Textform anmelden, Sicherheit zu leisten, soweit sie nicht Befriedigung verlangen können. Dieses Recht steht den Gläubigern jedoch nur zu, wenn sie glaubhaft machen, dass durch die Verschmelzung die Erfüllung ihrer Forderung gefährdet wird."
    },
    {
      "date": "2025-03-01",
      "id": "102644",
      "original_text": "Einreichung neuer Dokumente\nBayern Amtsgericht München HRB 283006\ninnoscripta AG – München",
      "type": "Einreichung neuer Dokumente",
      "state": "Bayern",
      "amtsgericht": "Amtsgericht München",
      "registernummer": "HRB 283006",
      "registerart": "HRB",
      "company_name": "innoscripta AG",
      "company_seat": "München",
      "details": "01.03.2025 (Bekanntmachungsdatum)\n\nBayern Amtsgericht München HRB 283006\nEinreichung neuer Dokumente\n\ninnoscripta AG\nAktiengesellschaft\nMünchen\n\nDem Amtsgericht München -Registergericht- ist eine Liste der Mitglieder des Aufsichtsrats eingereicht worden, § 106 AktG."
    },
    {
      "date": "2025-03-01",
      "id": "102645",
      "original_text": "Löschungsankündigung\nBayern Amtsgericht München HRA 99165\nGante & Pairan Service GmbH & Co. KG – München",
      "type": "Löschungsankündigung",
      "state": "Bayern",
      "amtsgericht": "Amtsgericht München",
      "registernummer": "HRA 99165",
      "registerart": "HRA",
      "company_name": "Gante & Pairan Service GmbH & Co. KG",
      "company_seat": "München",
      "details": "01.03.2025 (Bekanntmachungsdatum)\n\nBayern Amtsgericht München HRA 99165\nLöschungsankündigung\n\nGante & Pairan Service GmbH & Co. KG\nKommanditgesellschaft\nMünchen\n\nDas Registergericht beabsichtigt, die im Handelsregister eingetragene Firma von Amts wegen nach § 31 Abs. 2 HGB zu löschen. Die Frist zur Erhebung eines Widerspruchs ist auf drei Monate festgesetzt."
    },
    {
      "date": "2025-03-01",
      "id": "102646",
      "original_text": "Löschungsankündigung\nBayern Amtsgericht München HRA 107364\nNymphenburger Immobilien Verwaltung GmbH & Co. KG – München",
      "type": "Löschungsankündigung",
      "state": "Bayern",
      "amtsgericht": "Amtsgericht München",
      "registernummer": "HRA 107364",
      "registerart": "HRA",
      "company_name": "Nymphenburger Immobilien Verwaltung GmbH & Co. KG",
      "company_seat": "München",
      "details": "01.03.2025 (Bekanntmachungsdatum)\n\nBayern Amtsgericht München HRA 107364\nLöschungsankündigung 28.02.2025 (Eintragungsdatum)\n\nNymphenburger Immobilien Verwaltung GmbH & Co. KG\nKommanditgesellschaft\nMünchen\n\nDas Registergericht beabsichtigt, die im Handelsregister eingetragene Firma von Amts wegen nach § 31 Abs. 2 HGB zu löschen. Die Frist zur Erhebung eines Widerspruchs ist auf drei Monate festgesetzt."
    },
    {
      "date": "2025-03-01",
      "id": "102647",
      "original_text": "Registerbekanntmachung nach dem Umwandlungsgesetz\nBayern Amtsgericht Fürth HRA 12524\nSergej Gigel Trade Management e.K. – Fürth",
      "type": "Registerbekanntmachung nach dem Umwandlungsgesetz",
      "state": "Bayern",
      "amtsgericht": "Amtsgericht Fürth",
      "registernummer": "HRA 12524",
      "registerart": "HRA",
      "company_name": "Sergej Gigel Trade Management e.K.",
      "company_seat": "Fürth",
      "details": "01.03.2025 (Bekanntmachungsdatum)\n\nBayern Amtsgericht Fürth HRA 12524\nRegisterbekanntmachung nach dem Umwandlungsgesetz 28.02.2025 (Eintragungsdatum)\n\nSergej Gigel Trade Management e.K.\nEinzelkaufmann / Einzelkauffrau\nFürth\n\nDen Gläubigern der an der Verschmelzung beteiligten Rechtsträger ist, wenn sie binnen sechs Monaten nach dem Tag, an dem die Eintragung der Verschmelzung in das Register des Sitzes desjenigen Rechtsträgers, dessen Gläubiger sie sind, nach § 19 Abs. 3 UmwG als bekannt gemacht gilt, ihren Anspruch nach Grund und Höhe in Textform anmelden, Sicherheit zu leisten, soweit sie nicht Befriedigung verlangen können. Dieses Recht steht den Gläubigern jedoch nur zu, wenn sie glaubhaft machen, dass durch die Verschmelzung die Erfüllung ihrer Forderung gefährdet wird."
    },
    {
      "date": "2025-03-01",
      "id": "102648",
      "original_text": "Registerbekanntmachung nach dem Umwandlungsgesetz\nBayern Amtsgericht Augsburg HRB 1040\nMayer & Söhne Verwaltung GmbH – Aichach",
      "type": "Registerbekanntmachung nach dem Umwandlungsgesetz",
      "state": "Bayern",
      "amtsgericht": "Amtsgericht Augsburg",
      "registernummer": "HRB 1040",
      "registerart": "HRB",
      "company_name": "Mayer & Söhne Verwaltung GmbH",
      "company_seat": "Aichach",
      "details": "01.03.2025 (Bekanntmachungsdatum)\n\nBayern Amtsgericht Augsburg HRB 1040\nRegisterbekanntmachung nach dem Umwandlungsgesetz 28.02.2025 (Eintragungsdatum)\n\nMayer & Söhne Verwaltung GmbH\nGesellschaft mit beschränkter Haftung\nAichach\n\nDen Gläubigern der an der Verschmelzung beteiligten Rechtsträger ist, wenn sie binnen sechs Monaten nach dem Tag, an dem die Eintragung der Verschmelzung in das Register des Sitzes desjenigen Rechtsträgers, dessen Gläubiger sie sind, nach § 19 Abs. 3 UmwG als bekannt gemacht gilt, ihren Anspruch nach Grund und Höhe in Textform anmelden, Sicherheit zu leisten, soweit sie nicht Befriedigung verlangen können. Dieses Recht steht den Gläubigern jedoch nur zu, wenn sie glaubhaft machen, dass durch die Verschmelzung die Erfüllung ihrer Forderung gefährdet wird."
    },
    {
      "date": "2025-03-01",
      "id": "102649",
      "original_text": "Registerbekanntmachung nach dem Umwandlungsgesetz\nBayern Amtsgericht München HRA 120726\nKrönner Konditorei Kaffeehaus und Schokoladenmanufaktur KG – Garmisch-Partenkirchen",
      "type": "Registerbekanntmachung nach dem Umwandlungsgesetz",
      "state": "Bayern",
      "amtsgericht": "Amtsgericht München",
      "registernummer": "HRA 120726",
      "registerart": "HRA",
      "company_name": "Krönner Konditorei Kaffeehaus und Schokoladenmanufaktur KG",
      "company_seat": "Garmisch-Partenkirchen",
      "details": "01.03.2025 (Bekanntmachungsdatum)\n\nBayern Amtsgericht München HRA 120726\nRegisterbekanntmachung nach dem Umwandlungsgesetz 28.02.2025 (Eintragungsdatum)\n\nKrönner Konditorei Kaffeehaus und Schokoladenmanufaktur KG\nKommanditgesellschaft\nGarmisch-Partenkirchen\n\nDen Gläubigern der an der Ausgliederung beteiligten Rechtsträger ist, wenn sie binnen sechs Monaten nach dem Tag, an dem die Eintragung der Ausgliederung in das Register des Sitzes desjenigen Rechtsträgers, dessen Gläubiger sie sind, nach §§ 125, 19 Abs. 3 UmwG als bekannt gemacht gilt, ihren Anspruch nach Grund und Höhe in Textform anmelden, Sicherheit zu leisten, soweit sie nicht Befriedigung verlangen können. Dieses Recht steht den Gläubigern jedoch nur zu, wenn sie glaubhaft machen, dass durch die Ausgliederung die Erfüllung ihrer Forderung gefährdet wird."
    },
    {
      "date": "2025-03-01",
      "id": "102650",
      "original_text": "Registerbekanntmachung nach dem Umwandlungsgesetz\nBayern Amtsgericht Schweinfurt HRB 9239\nJOTKA GmbH – Heustreu",
      "type": "Registerbekanntmachung nach dem Umwandlungsgesetz",
      "state": "Bayern",
      "amtsgericht": "Amtsgericht Schweinfurt",
      "registernummer": "HRB 9239",
      "registerart": "HRB",
      "company_name": "JOTKA GmbH",
      "company_seat": "Heustreu",
      "details": "01.03.2025 (Bekanntmachungsdatum)\n\nBayern Amtsgericht Schweinfurt HRB 9239\nRegisterbekanntmachung nach dem Umwandlungsgesetz 28.02.2025 (Eintragungsdatum)\n\nJOTKA GmbH\nGesellschaft mit beschränkter Haftung\nHeustreu\n\nDen Gläubigern der an der Verschmelzung beteiligten Rechtsträger ist, wenn sie binnen sechs Monaten nach dem Tag, an dem die Eintragung der Verschmelzung in das Register des Sitzes desjenigen Rechtsträgers, dessen Gläubiger sie sind, nach § 19 Abs. 3 UmwG als bekannt gemacht gilt, ihren Anspruch nach Grund und Höhe in Textform anmelden, Sicherheit zu leisten, soweit sie nicht Befriedigung verlangen können. Dieses Recht steht den Gläubigern jedoch nur zu, wenn sie glaubhaft machen, dass durch die Verschmelzung die Erfüllung ihrer Forderung gefährdet wird."
    }
  ]
}