{
  "date": "2025-03-04",
  "date_of_scrape": "2025-03-05T04:08:21.856Z",
  "tool_version": "0.2.0",
  "number_of_announcements": 119,
  "announcements": [
    {
      "date": "2025-03-04",
      "id": "102759",
      "original_text": "Löschungsankündigung\nBayern Amtsgericht Passau HRB 5781\nStratex Textilvertriebs- und Handels-GmbH – Passau",
      "type": "Löschungsankündigung",
      "state": "Bayern",
      "amtsgericht": "Amtsgericht Passau",
      "registernummer": "HRB 5781",
      "registerart": "HRB",
      "company_name": "Stratex Textilvertriebs- und Handels-GmbH",
      "company_seat": "Passau",
      "details": "04.03.2025 (Bekanntmachungsdatum)\n\nBayern Amtsgericht Passau HRB 5781\nLöschungsankündigung\n\nStratex Textilvertriebs- und Handels-GmbH\nGesellschaft mit beschränkter Haftung\nPassau\n\nDas Registergericht beabsichtigt, die im Handelsregister eingetragene Gesellschaft wegen Vermögenslosigkeit von Amts wegen nach § 394 FamFG zu löschen. Die Frist zur Erhebung eines Widerspruchs ist auf einen Monat festgesetzt."
    },
    {
      "date": "2025-03-04",
      "id": "102760",
      "original_text": "Sonstige Registerbekanntmachung\nBayern Amtsgericht Hof HRB 6257\nRausch & Pausch SE – Selb",
      "type": "Sonstige Registerbekanntmachung",
      "state": "Bayern",
      "amtsgericht": "Amtsgericht Hof",
      "registernummer": "HRB 6257",
      "registerart": "HRB",
      "company_name": "Rausch & Pausch SE",
      "company_seat": "Selb",
      "details": "04.03.2025 (Bekanntmachungsdatum)\n\nBayern Amtsgericht Hof HRB 6257\nSonstige Registerbekanntmachung\n\nRausch & Pausch SE\nEuropäische Aktiengesellschaft (SE)\nSelb\n\nDem #Re.Name ist eine Liste der Mitglieder des Aufsichtsrats eingereicht worden, Art. 9 Abs. 1 Buchst. c (ii) SE-VO i.V.m. § 106 AktG."
    },
    {
      "date": "2025-03-04",
      "id": "102761",
      "original_text": "Löschungsankündigung\nBayern Amtsgericht Nürnberg HRB 19201\nHELIOS TRANS GmbH – Nürnberg",
      "type": "Löschungsankündigung",
      "state": "Bayern",
      "amtsgericht": "Amtsgericht Nürnberg",
      "registernummer": "HRB 19201",
      "registerart": "HRB",
      "company_name": "HELIOS TRANS GmbH",
      "company_seat": "Nürnberg",
      "details": "04.03.2025 (Bekanntmachungsdatum)\n\nBayern Amtsgericht Nürnberg HRB 19201\nLöschungsankündigung\n\nHELIOS TRANS GmbH\nGesellschaft mit beschränkter Haftung\nNürnberg\n\nDas Registergericht beabsichtigt, die im Handelsregister eingetragene Gesellschaft wegen Vermögenslosigkeit von Amts wegen nach § 394 FamFG zu löschen. Die Frist zur Erhebung eines Widerspruchs ist auf einen Monat festgesetzt."
    },
    {
      "date": "2025-03-04",
      "id": "102762",
      "original_text": "Registerbekanntmachung nach dem Umwandlungsgesetz\nBayern Amtsgericht München HRB 271650\nVIVENTEC SHK-03 GmbH – München",
      "type": "Registerbekanntmachung nach dem Umwandlungsgesetz",
      "state": "Bayern",
      "amtsgericht": "Amtsgericht München",
      "registernummer": "HRB 271650",
      "registerart": "HRB",
      "company_name": "VIVENTEC SHK-03 GmbH",
      "company_seat": "München",
      "details": "04.03.2025 (Bekanntmachungsdatum)\n\nBayern Amtsgericht München HRB 271650\nRegisterbekanntmachung nach dem Umwandlungsgesetz 03.03.2025 (Eintragungsdatum)\n\nVIVENTEC SHK-03 GmbH\nGesellschaft mit beschränkter Haftung\nMünchen\n\nDen Gläubigern der an der Verschmelzung beteiligten Rechtsträger ist, wenn sie binnen sechs Monaten nach dem Tag, an dem die Eintragung der Verschmelzung in das Register des Sitzes desjenigen Rechtsträgers, dessen Gläubiger sie sind, nach § 19 Abs. 3 UmwG als bekannt gemacht gilt, ihren Anspruch nach Grund und Höhe in Textform anmelden, Sicherheit zu leisten, soweit sie nicht Befriedigung verlangen können. Dieses Recht steht den Gläubigern jedoch nur zu, wenn sie glaubhaft machen, dass durch die Verschmelzung die Erfüllung ihrer Forderung gefährdet wird."
    },
    {
      "date": "2025-03-04",
      "id": "102763",
      "original_text": "Löschungsankündigung\nBayern Amtsgericht Nürnberg HRB 36156\nAntica Casa UG (haftungsbeschränkt) – Altdorf b. Nürnberg",
      "type": "Löschungsankündigung",
      "state": "Bayern",
      "amtsgericht": "Amtsgericht Nürnberg",
      "registernummer": "HRB 36156",
      "registerart": "HRB",
      "company_name": "Antica Casa UG (haftungsbeschränkt)",
      "company_seat": "Altdorf b. Nürnberg",
      "details": "04.03.2025 (Bekanntmachungsdatum)\n\nBayern Amtsgericht Nürnberg HRB 36156\nLöschungsankündigung\n\nAntica Casa UG (haftungsbeschränkt)\nGesellschaft mit beschränkter Haftung\nAltdorf b. Nürnberg\n\nDas Registergericht beabsichtigt, die im Handelsregister eingetragene Gesellschaft wegen Vermögenslosigkeit von Amts wegen nach § 394 FamFG zu löschen. Die Frist zur Erhebung eines Widerspruchs ist auf einen Monat festgesetzt."
    },
    {
      "date": "2025-03-04",
      "id": "102764",
      "original_text": "Sonstige Registerbekanntmachung\nBayern Amtsgericht Bayreuth HRB 8323\nKlaus Krauß Finanzberatung GmbH – Hummeltal",
      "type": "Sonstige Registerbekanntmachung",
      "state": "Bayern",
      "amtsgericht": "Amtsgericht Bayreuth",
      "registernummer": "HRB 8323",
      "registerart": "HRB",
      "company_name": "Klaus Krauß Finanzberatung GmbH",
      "company_seat": "Hummeltal",
      "details": "04.03.2025 (Bekanntmachungsdatum)\n\nBayern Amtsgericht Bayreuth HRB 8323\nSonstige Registerbekanntmachung 03.03.2025 (Eintragungsdatum)\n\nKlaus Krauß Finanzberatung GmbH\nGesellschaft mit beschränkter Haftung\nHummeltal\n\nDen Gläubigern der an der Ausgliederung beteiligten Rechtsträger ist, wenn sie binnen sechs Monaten nach dem Tag, an dem die Eintragung der Ausgliederung in das Register des Sitzes desjenigen Rechtsträgers, dessen Gläubiger sie sind, nach §§ 125, 19 Abs. 3 UmwG als bekannt gemacht gilt, ihren Anspruch nach Grund und Höhe in Textform anmelden, Sicherheit zu leisten, soweit sie nicht Befriedigung verlangen können. Dieses Recht steht den Gläubigern jedoch nur zu, wenn sie glaubhaft machen, dass durch die Ausgliederung die Erfüllung ihrer Forderung gefährdet wird."
    },
    {
      "date": "2025-03-04",
      "id": "102765",
      "original_text": "Registerbekanntmachung nach dem Umwandlungsgesetz\nBayern Amtsgericht München HRB 47007\nSecurifix GmbH – Karlsfeld",
      "type": "Registerbekanntmachung nach dem Umwandlungsgesetz",
      "state": "Bayern",
      "amtsgericht": "Amtsgericht München",
      "registernummer": "HRB 47007",
      "registerart": "HRB",
      "company_name": "Securifix GmbH",
      "company_seat": "Karlsfeld",
      "details": "04.03.2025 (Bekanntmachungsdatum)\n\nBayern Amtsgericht München HRB 47007\nRegisterbekanntmachung nach dem Umwandlungsgesetz 03.03.2025 (Eintragungsdatum)\n\nSecurifix GmbH\nGesellschaft mit beschränkter Haftung\nKarlsfeld\n\nDen Gläubigern der an der Verschmelzung beteiligten Rechtsträger ist, wenn sie binnen sechs Monaten nach dem Tag, an dem die Eintragung der Verschmelzung in das Register des Sitzes desjenigen Rechtsträgers, dessen Gläubiger sie sind, nach § 19 Abs. 3 UmwG als bekannt gemacht gilt, ihren Anspruch nach Grund und Höhe in Textform anmelden, Sicherheit zu leisten, soweit sie nicht Befriedigung verlangen können. Dieses Recht steht den Gläubigern jedoch nur zu, wenn sie glaubhaft machen, dass durch die Verschmelzung die Erfüllung ihrer Forderung gefährdet wird."
    },
    {
      "date": "2025-03-04",
      "id": "102766",
      "original_text": "Registerbekanntmachung nach dem Umwandlungsgesetz\nBayern Amtsgericht Ingolstadt HRB 6025\nPrinceps AG – Egweil",
      "type": "Registerbekanntmachung nach dem Umwandlungsgesetz",
      "state": "Bayern",
      "amtsgericht": "Amtsgericht Ingolstadt",
      "registernummer": "HRB 6025",
      "registerart": "HRB",
      "company_name": "Princeps AG",
      "company_seat": "Egweil",
      "details": "04.03.2025 (Bekanntmachungsdatum)\n\nBayern Amtsgericht Ingolstadt HRB 6025\nRegisterbekanntmachung nach dem Umwandlungsgesetz 03.03.2025 (Eintragungsdatum)\n\nPrinceps AG\nAktiengesellschaft\nEgweil\n\nDen Gläubigern des formwechselnden Rechtsträgers ist, wenn sie binnen sechs Monaten nach dem Tag, an dem die Eintragung des Formwechsels nach § 201 UmwG als bekannt gemacht gilt, ihren Anspruch nach Grund und Höhe in Textform anmelden, Sicherheit zu leisten, soweit sie nicht Befriedigung verlangen können. Dieses Recht steht den Gläubigern jedoch nur zu, wenn sie glaubhaft machen, dass durch den Formwechsel die Erfüllung ihrer Forderung gefährdet wird."
    },
    {
      "date": "2025-03-04",
      "id": "102767",
      "original_text": "Einreichung neuer Dokumente\nBayern Amtsgericht Nürnberg HRB 17149\nB12 IT-Systemhaus AG – Nürnberg",
      "type": "Einreichung neuer Dokumente",
      "state": "Bayern",
      "amtsgericht": "Amtsgericht Nürnberg",
      "registernummer": "HRB 17149",
      "registerart": "HRB",
      "company_name": "B12 IT-Systemhaus AG",
      "company_seat": "Nürnberg",
      "details": "04.03.2025 (Bekanntmachungsdatum)\n\nBayern Amtsgericht Nürnberg HRB 17149\nEinreichung neuer Dokumente\n\nB12 IT-Systemhaus AG\nAktiengesellschaft\nNürnberg\n\nDem Amtsgericht Nürnberg -Registergericht- ist eine Liste der Mitglieder des Aufsichtsrats eingereicht worden, § 106 AktG."
    },
    {
      "date": "2025-03-04",
      "id": "102768",
      "original_text": "Registerbekanntmachung nach dem Umwandlungsgesetz\nBayern Amtsgericht München HRA 120237\nIbrahim Kevek e.K. – Miesbach",
      "type": "Registerbekanntmachung nach dem Umwandlungsgesetz",
      "state": "Bayern",
      "amtsgericht": "Amtsgericht München",
      "registernummer": "HRA 120237",
      "registerart": "HRA",
      "company_name": "Ibrahim Kevek e.K.",
      "company_seat": "Miesbach",
      "details": "04.03.2025 (Bekanntmachungsdatum)\n\nBayern Amtsgericht München HRA 120237\nRegisterbekanntmachung nach dem Umwandlungsgesetz 03.03.2025 (Eintragungsdatum)\n\nIbrahim Kevek e.K.\nEinzelkaufmann / Einzelkauffrau\nMiesbach\n\nDen Gläubigern der an der Ausgliederung beteiligten Rechtsträger ist, wenn sie binnen sechs Monaten nach dem Tag, an dem die Eintragung der Ausgliederung in das Register des Sitzes desjenigen Rechtsträgers, dessen Gläubiger sie sind, nach §§ 125, 19 Abs. 3 UmwG als bekannt gemacht gilt, ihren Anspruch nach Grund und Höhe in Textform anmelden, Sicherheit zu leisten, soweit sie nicht Befriedigung verlangen können. Dieses Recht steht den Gläubigern jedoch nur zu, wenn sie glaubhaft machen, dass durch die Ausgliederung die Erfüllung ihrer Forderung gefährdet wird."
    },
    {
      "date": "2025-03-04",
      "id": "102769",
      "original_text": "Einreichung neuer Dokumente\nBayern Amtsgericht Augsburg HRB 6589\nDialog Lebensversicherungs-Aktiengesellschaft – Augsburg",
      "type": "Einreichung neuer Dokumente",
      "state": "Bayern",
      "amtsgericht": "Amtsgericht Augsburg",
      "registernummer": "HRB 6589",
      "registerart": "HRB",
      "company_name": "Dialog Lebensversicherungs-Aktiengesellschaft",
      "company_seat": "Augsburg",
      "details": "04.03.2025 (Bekanntmachungsdatum)\n\nBayern Amtsgericht Augsburg HRB 6589\nEinreichung neuer Dokumente\n\nDialog Lebensversicherungs-Aktiengesellschaft\nAktiengesellschaft\nAugsburg\n\nDem Amtsgericht Augsburg -Registergericht- ist eine Liste der Mitglieder des Aufsichtsrats eingereicht worden, § 106 AktG."
    },
    {
      "date": "2025-03-04",
      "id": "102770",
      "original_text": "Einreichung neuer Dokumente\nBayern Amtsgericht München HRB 237595\nCognizant Mobility GmbH – München",
      "type": "Einreichung neuer Dokumente",
      "state": "Bayern",
      "amtsgericht": "Amtsgericht München",
      "registernummer": "HRB 237595",
      "registerart": "HRB",
      "company_name": "Cognizant Mobility GmbH",
      "company_seat": "München",
      "details": "04.03.2025 (Bekanntmachungsdatum)\n\nBayern Amtsgericht München HRB 237595\nEinreichung neuer Dokumente 03.03.2025 (Eintragungsdatum)\n\nCognizant Mobility GmbH\nGesellschaft mit beschränkter Haftung\nMünchen\n\nDem #Re.Name ist eine Liste der Mitglieder des Aufsichtsrats eingereicht worden, § 52 Abs. 3 S. 2 GmbHG."
    },
    {
      "date": "2025-03-04",
      "id": "102771",
      "original_text": "Löschungsankündigung\nBayern Amtsgericht München HRB 237288\nSapore UG (haftungsbeschränkt) – Tutzing",
      "type": "Löschungsankündigung",
      "state": "Bayern",
      "amtsgericht": "Amtsgericht München",
      "registernummer": "HRB 237288",
      "registerart": "HRB",
      "company_name": "Sapore UG (haftungsbeschränkt)",
      "company_seat": "Tutzing",
      "details": "04.03.2025 (Bekanntmachungsdatum)\n\nBayern Amtsgericht München HRB 237288\nLöschungsankündigung\n\nSapore UG (haftungsbeschränkt)\nGesellschaft mit beschränkter Haftung\nTutzing\n\nDas Registergericht beabsichtigt, die im Handelsregister eingetragene Gesellschaft wegen Vermögenslosigkeit von Amts wegen nach § 394 FamFG zu löschen. Die Frist zur Erhebung eines Widerspruchs ist auf drei Monate festgesetzt."
    },
    {
      "date": "2025-03-04",
      "id": "102772",
      "original_text": "Einreichung neuer Dokumente\nBayern Amtsgericht München HRB 126904\nCS CLEAN SYSTEMS AG – Ismaning",
      "type": "Einreichung neuer Dokumente",
      "state": "Bayern",
      "amtsgericht": "Amtsgericht München",
      "registernummer": "HRB 126904",
      "registerart": "HRB",
      "company_name": "CS CLEAN SYSTEMS AG",
      "company_seat": "Ismaning",
      "details": "04.03.2025 (Bekanntmachungsdatum)\n\nBayern Amtsgericht München HRB 126904\nEinreichung neuer Dokumente\n\nCS CLEAN SYSTEMS AG\nAktiengesellschaft\nIsmaning\n\nDem Amtsgericht München -Registergericht- ist eine Liste der Mitglieder des Aufsichtsrats eingereicht worden, § 106 AktG."
    },
    {
      "date": "2025-03-04",
      "id": "102773",
      "original_text": "Registerbekanntmachung nach dem Umwandlungsgesetz\nBayern Amtsgericht Kempten (Allgäu) HRA 11643\nCompetente planen bauen & wohnen OHG – Sonthofen",
      "type": "Registerbekanntmachung nach dem Umwandlungsgesetz",
      "state": "Bayern",
      "amtsgericht": "Amtsgericht Kempten (Allgäu)",
      "registernummer": "HRA 11643",
      "registerart": "HRA",
      "company_name": "Competente planen bauen & wohnen OHG",
      "company_seat": "Sonthofen",
      "details": "04.03.2025 (Bekanntmachungsdatum)\n\nBayern Amtsgericht Kempten (Allgäu) HRA 11643\nRegisterbekanntmachung nach dem Umwandlungsgesetz 02.03.2025 (Eintragungsdatum)\n\nCompetente planen bauen & wohnen OHG\nOffene Handelsgesellschaft\nSonthofen\n\nDen Gläubigern des formwechselnden Rechtsträgers ist, wenn sie binnen sechs Monaten nach dem Tag, an dem die Eintragung des Formwechsels nach § 201 UmwG als bekannt gemacht gilt, ihren Anspruch nach Grund und Höhe in Textform anmelden, Sicherheit zu leisten, soweit sie nicht Befriedigung verlangen können. Dieses Recht steht den Gläubigern jedoch nur zu, wenn sie glaubhaft machen, dass durch den Formwechsel die Erfüllung ihrer Forderung gefährdet wird."
    },
    {
      "date": "2025-03-04",
      "id": "102774",
      "original_text": "Registerbekanntmachung nach dem Umwandlungsgesetz\nBayern Amtsgericht München HRB 297982\nidgard GmbH – München",
      "type": "Registerbekanntmachung nach dem Umwandlungsgesetz",
      "state": "Bayern",
      "amtsgericht": "Amtsgericht München",
      "registernummer": "HRB 297982",
      "registerart": "HRB",
      "company_name": "idgard GmbH",
      "company_seat": "München",
      "details": "04.03.2025 (Bekanntmachungsdatum)\n\nBayern Amtsgericht München HRB 297982\nRegisterbekanntmachung nach dem Umwandlungsgesetz 03.03.2025 (Eintragungsdatum)\n\nidgard GmbH\nGesellschaft mit beschränkter Haftung\nMünchen\n\nDen Gläubigern der an der Ausgliederung beteiligten Rechtsträger ist, wenn sie binnen sechs Monaten nach dem Tag, an dem die Eintragung der Ausgliederung in das Register des Sitzes desjenigen Rechtsträgers, dessen Gläubiger sie sind, nach §§ 125, 19 Abs. 3 UmwG als bekannt gemacht gilt, ihren Anspruch nach Grund und Höhe in Textform anmelden, Sicherheit zu leisten, soweit sie nicht Befriedigung verlangen können. Dieses Recht steht den Gläubigern jedoch nur zu, wenn sie glaubhaft machen, dass durch die Ausgliederung die Erfüllung ihrer Forderung gefährdet wird."
    },
    {
      "date": "2025-03-04",
      "id": "102775",
      "original_text": "Registerbekanntmachung nach dem Umwandlungsgesetz\nBayern Amtsgericht München HRB 244945\nEficode GmbH – München",
      "type": "Registerbekanntmachung nach dem Umwandlungsgesetz",
      "state": "Bayern",
      "amtsgericht": "Amtsgericht München",
      "registernummer": "HRB 244945",
      "registerart": "HRB",
      "company_name": "Eficode GmbH",
      "company_seat": "München",
      "details": "04.03.2025 (Bekanntmachungsdatum)\n\nBayern Amtsgericht München HRB 244945\nRegisterbekanntmachung nach dem Umwandlungsgesetz 03.03.2025 (Eintragungsdatum)\n\nEficode GmbH\nGesellschaft mit beschränkter Haftung\nMünchen\n\nDen Gläubigern der an der Verschmelzung beteiligten Rechtsträger ist, wenn sie binnen sechs Monaten nach dem Tag, an dem die Eintragung der Verschmelzung in das Register des Sitzes desjenigen Rechtsträgers, dessen Gläubiger sie sind, nach § 19 Abs. 3 UmwG als bekannt gemacht gilt, ihren Anspruch nach Grund und Höhe in Textform anmelden, Sicherheit zu leisten, soweit sie nicht Befriedigung verlangen können. Dieses Recht steht den Gläubigern jedoch nur zu, wenn sie glaubhaft machen, dass durch die Verschmelzung die Erfüllung ihrer Forderung gefährdet wird."
    },
    {
      "date": "2025-03-04",
      "id": "102776",
      "original_text": "Registerbekanntmachung nach dem Umwandlungsgesetz\nBayern Amtsgericht München HRB 270553\nRENNER Gebäudetechnik GmbH – München",
      "type": "Registerbekanntmachung nach dem Umwandlungsgesetz",
      "state": "Bayern",
      "amtsgericht": "Amtsgericht München",
      "registernummer": "HRB 270553",
      "registerart": "HRB",
      "company_name": "RENNER Gebäudetechnik GmbH",
      "company_seat": "München",
      "details": "04.03.2025 (Bekanntmachungsdatum)\n\nBayern Amtsgericht München HRB 270553\nRegisterbekanntmachung nach dem Umwandlungsgesetz 03.03.2025 (Eintragungsdatum)\n\nRENNER Gebäudetechnik GmbH\nGesellschaft mit beschränkter Haftung\nMünchen\n\nDen Gläubigern der an der Verschmelzung beteiligten Rechtsträger ist, wenn sie binnen sechs Monaten nach dem Tag, an dem die Eintragung der Verschmelzung in das Register des Sitzes desjenigen Rechtsträgers, dessen Gläubiger sie sind, nach § 19 Abs. 3 UmwG als bekannt gemacht gilt, ihren Anspruch nach Grund und Höhe in Textform anmelden, Sicherheit zu leisten, soweit sie nicht Befriedigung verlangen können. Dieses Recht steht den Gläubigern jedoch nur zu, wenn sie glaubhaft machen, dass durch die Verschmelzung die Erfüllung ihrer Forderung gefährdet wird."
    },
    {
      "date": "2025-03-04",
      "id": "102777",
      "original_text": "Löschungsankündigung\nBayern Amtsgericht Nürnberg HRB 32676\nProMax Consult GmbH – Nürnberg",
      "type": "Löschungsankündigung",
      "state": "Bayern",
      "amtsgericht": "Amtsgericht Nürnberg",
      "registernummer": "HRB 32676",
      "registerart": "HRB",
      "company_name": "ProMax Consult GmbH",
      "company_seat": "Nürnberg",
      "details": "04.03.2025 (Bekanntmachungsdatum)\n\nBayern Amtsgericht Nürnberg HRB 32676\nLöschungsankündigung\n\nProMax Consult GmbH\nGesellschaft mit beschränkter Haftung\nNürnberg\n\nDas Registergericht beabsichtigt, die im Handelsregister eingetragene Gesellschaft wegen Vermögenslosigkeit von Amts wegen nach § 394 FamFG zu löschen. Die Frist zur Erhebung eines Widerspruchs ist auf einen Monat festgesetzt."
    },
    {
      "date": "2025-03-04",
      "id": "102778",
      "original_text": "Registerbekanntmachung nach dem Umwandlungsgesetz\nBayern Amtsgericht München HRB 275431\nOctopus Energy Services Germany GmbH – München",
      "type": "Registerbekanntmachung nach dem Umwandlungsgesetz",
      "state": "Bayern",
      "amtsgericht": "Amtsgericht München",
      "registernummer": "HRB 275431",
      "registerart": "HRB",
      "company_name": "Octopus Energy Services Germany GmbH",
      "company_seat": "München",
      "details": "04.03.2025 (Bekanntmachungsdatum)\n\nBayern Amtsgericht München HRB 275431\nRegisterbekanntmachung nach dem Umwandlungsgesetz 01.03.2025 (Eintragungsdatum)\n\nOctopus Energy Services Germany GmbH\nGesellschaft mit beschränkter Haftung\nMünchen\n\nDen Gläubigern der an der Verschmelzung beteiligten Rechtsträger ist, wenn sie binnen sechs Monaten nach dem Tag, an dem die Eintragung der Verschmelzung in das Register des Sitzes desjenigen Rechtsträgers, dessen Gläubiger sie sind, nach § 19 Abs. 3 UmwG als bekannt gemacht gilt, ihren Anspruch nach Grund und Höhe in Textform anmelden, Sicherheit zu leisten, soweit sie nicht Befriedigung verlangen können. Dieses Recht steht den Gläubigern jedoch nur zu, wenn sie glaubhaft machen, dass durch die Verschmelzung die Erfüllung ihrer Forderung gefährdet wird."
    },
    {
      "date": "2025-03-04",
      "id": "102779",
      "original_text": "Löschungsankündigung\nBayern Amtsgericht Regensburg HRB 9699\nGalvamedix GmbH – Regensburg",
      "type": "Löschungsankündigung",
      "state": "Bayern",
      "amtsgericht": "Amtsgericht Regensburg",
      "registernummer": "HRB 9699",
      "registerart": "HRB",
      "company_name": "Galvamedix GmbH",
      "company_seat": "Regensburg",
      "details": "04.03.2025 (Bekanntmachungsdatum)\n\nBayern Amtsgericht Regensburg HRB 9699\nLöschungsankündigung 03.03.2025 (Eintragungsdatum)\n\nGalvamedix GmbH\nGesellschaft mit beschränkter Haftung\nRegensburg\n\nDas Registergericht beabsichtigt, die im Handelsregister eingetragene Gesellschaft wegen Vermögenslosigkeit von Amts wegen nach § 394 FamFG zu löschen. Die Frist zur Erhebung eines Widerspruchs ist auf einen Monat festgesetzt."
    },
    {
      "date": "2025-03-04",
      "id": "102780",
      "original_text": "Einreichung neuer Dokumente\nBayern Amtsgericht Memmingen HRB 18947\nEhrmann SE – Oberschönegg",
      "type": "Einreichung neuer Dokumente",
      "state": "Bayern",
      "amtsgericht": "Amtsgericht Memmingen",
      "registernummer": "HRB 18947",
      "registerart": "HRB",
      "company_name": "Ehrmann SE",
      "company_seat": "Oberschönegg",
      "details": "04.03.2025 (Bekanntmachungsdatum)\n\nBayern Amtsgericht Memmingen HRB 18947\nEinreichung neuer Dokumente 28.02.2025 (Eintragungsdatum)\n\nEhrmann SE\nEuropäische Aktiengesellschaft (SE)\nOberschönegg\n\nDem Amtsgericht Memmingen -Registergericht- ist eine Liste der Mitglieder des Aufsichtsrats eingereicht worden, Art. 9 Abs. 1 Buchst. c (ii) SE-VO i.V.m. § 106 AktG."
    },
    {
      "date": "2025-03-04",
      "id": "102781",
      "original_text": "Löschungsankündigung\nBayern Amtsgericht Nürnberg HRB 9320\nEiscafe Roma GmbH – Nürnberg",
      "type": "Löschungsankündigung",
      "state": "Bayern",
      "amtsgericht": "Amtsgericht Nürnberg",
      "registernummer": "HRB 9320",
      "registerart": "HRB",
      "company_name": "Eiscafe Roma GmbH",
      "company_seat": "Nürnberg",
      "details": "04.03.2025 (Bekanntmachungsdatum)\n\nBayern Amtsgericht Nürnberg HRB 9320\nLöschungsankündigung\n\nEiscafe Roma GmbH\nGesellschaft mit beschränkter Haftung\nNürnberg\n\nDas Registergericht beabsichtigt, die im Handelsregister eingetragene Gesellschaft wegen Vermögenslosigkeit von Amts wegen nach § 394 FamFG zu löschen. Die Frist zur Erhebung eines Widerspruchs ist auf einen Monat festgesetzt."
    },
    {
      "date": "2025-03-04",
      "id": "102782",
      "original_text": "Registerbekanntmachung nach dem Umwandlungsgesetz\nBayern Amtsgericht Kempten (Allgäu) HRB 10713\nCompetente planen bauen & wohnen GmbH – Sonthofen",
      "type": "Registerbekanntmachung nach dem Umwandlungsgesetz",
      "state": "Bayern",
      "amtsgericht": "Amtsgericht Kempten (Allgäu)",
      "registernummer": "HRB 10713",
      "registerart": "HRB",
      "company_name": "Competente planen bauen & wohnen GmbH",
      "company_seat": "Sonthofen",
      "details": "04.03.2025 (Bekanntmachungsdatum)\n\nBayern Amtsgericht Kempten (Allgäu) HRB 10713\nRegisterbekanntmachung nach dem Umwandlungsgesetz 02.03.2025 (Eintragungsdatum)\n\nCompetente planen bauen & wohnen GmbH\nGesellschaft mit beschränkter Haftung\nSonthofen\n\nDen Gläubigern des formwechselnden Rechtsträgers ist, wenn sie binnen sechs Monaten nach dem Tag, an dem die Eintragung des Formwechsels nach § 201 UmwG als bekannt gemacht gilt, ihren Anspruch nach Grund und Höhe in Textform anmelden, Sicherheit zu leisten, soweit sie nicht Befriedigung verlangen können. Dieses Recht steht den Gläubigern jedoch nur zu, wenn sie glaubhaft machen, dass durch den Formwechsel die Erfüllung ihrer Forderung gefährdet wird."
    },
    {
      "date": "2025-03-04",
      "id": "102783",
      "original_text": "Registerbekanntmachung nach dem Umwandlungsgesetz\nBerlin Amtsgericht Berlin (Charlottenburg) HRB 208967\nVolkswagen Group Charging GmbH – Berlin",
      "type": "Registerbekanntmachung nach dem Umwandlungsgesetz",
      "state": "Berlin",
      "amtsgericht": "Amtsgericht Berlin (Charlottenburg)",
      "registernummer": "HRB 208967",
      "registerart": "HRB",
      "company_name": "Volkswagen Group Charging GmbH",
      "company_seat": "Berlin",
      "details": "04.03.2025 (Bekanntmachungsdatum)\n\nBerlin Amtsgericht Berlin (Charlottenburg) HRB 208967\nRegisterbekanntmachung nach dem Umwandlungsgesetz 03.03.2025 (Eintragungsdatum)\n\nVolkswagen Group Charging GmbH\nGesellschaft mit beschränkter Haftung\nBerlin\n\nZu Eintragungsnummer 12 vom 03.03.2025 wird als nicht eingetragen veröffentlicht:\n\nDen Gläubigern der an der Spaltung beteiligten Rechtsträger ist, wenn sie binnen sechs Monaten nach dem Tag, an dem die Eintragung der Spaltung in das Register des Sitzes desjenigen Rechtsträgers, dessen Gläubiger sie sind, als bekannt gemacht gilt, ihren Anspruch nach Grund und Höhe schriftlich anmelden, Sicherheit zu leisten, soweit sie nicht Befriedigung verlangen können. Dieses Recht steht den Gläubigern jedoch nur zu, wenn sie glaubhaft machen, dass durch die Spaltung die Erfüllung ihrer Forderung gefährdet wird. Das Recht, Sicherheitsleistung zu verlangen, steht Gläubigern nicht zu, die im Falle der Insolvenz ein Recht auf vorzugsweise Befriedigung aus einer Deckungsmasse haben, die nach gesetzlicher Vorschrift zu ihrem Schutz errichtet und staatlich überwacht ist."
    },
    {
      "date": "2025-03-04",
      "id": "102784",
      "original_text": "Löschungsankündigung\nBrandenburg Amtsgericht Neuruppin HRB 12039\nIBS GmbH – Schwedt/Oder",
      "type": "Löschungsankündigung",
      "state": "Brandenburg",
      "amtsgericht": "Amtsgericht Neuruppin",
      "registernummer": "HRB 12039",
      "registerart": "HRB",
      "company_name": "IBS GmbH",
      "company_seat": "Schwedt/Oder",
      "details": "04.03.2025 (Bekanntmachungsdatum)\n\nBrandenburg Amtsgericht Neuruppin HRB 12039\nLöschungsankündigung\n\nIBS GmbH\nGesellschaft mit beschränkter Haftung\nSchwedt/Oder\n\nBei der nachstehenden Gesellschaft wird das Amtslöschungsverfahren gemäß § 394 FamFG eingeleitet.\nWiderspruchsfrist: 1 Monat"
    },
    {
      "date": "2025-03-04",
      "id": "102785",
      "original_text": "Löschungsankündigung\nBaden-Württemberg Amtsgericht Stuttgart HRB 781450\nTRS talents recruiting services UG (haftungsbeschränkt) – Reutlingen",
      "type": "Löschungsankündigung",
      "state": "Baden-Württemberg",
      "amtsgericht": "Amtsgericht Stuttgart",
      "registernummer": "HRB 781450",
      "registerart": "HRB",
      "company_name": "TRS talents recruiting services UG (haftungsbeschränkt)",
      "company_seat": "Reutlingen",
      "details": "04.03.2025 (Bekanntmachungsdatum)\n\nBaden-Württemberg Amtsgericht Stuttgart HRB 781450\nLöschungsankündigung\n\nTRS talents recruiting services UG (haftungsbeschränkt)\nGesellschaft mit beschränkter Haftung\nReutlingen\n\nDas Gericht beabsichtigt, die Gesellschaft wegen Vermögenslosigkeit im Handelsregister von Amts wegen nach § 394 FamFG zu löschen. Die Frist zur Geltendmachung eines Widerspruchs gegen die beabsichtigte Löschung ist auf zwei Monate ab Veröffentlichung bestimmt."
    },
    {
      "date": "2025-03-04",
      "id": "102786",
      "original_text": "Sonstige Registerbekanntmachung\nBaden-Württemberg Amtsgericht Stuttgart HRB 782931\nMack & Schühle International GmbH – Owen",
      "type": "Sonstige Registerbekanntmachung",
      "state": "Baden-Württemberg",
      "amtsgericht": "Amtsgericht Stuttgart",
      "registernummer": "HRB 782931",
      "registerart": "HRB",
      "company_name": "Mack & Schühle International GmbH",
      "company_seat": "Owen",
      "details": "04.03.2025 (Bekanntmachungsdatum)\n\nBaden-Württemberg Amtsgericht Stuttgart HRB 782931\nSonstige Registerbekanntmachung 04.03.2025 (Eintragungsdatum)\n\nMack & Schühle International GmbH\nGesellschaft mit beschränkter Haftung\nOwen\n\nDen Gläubigern der Gesellschaft, deren Forderungen begründet worden sind, bevor die Eintragung der Beendigung des Vertrages in das Handelsregister nach § 10 HGB als bekanntgemacht gilt, ist vom anderen Vertragsteil Sicherheit zu leisten, wenn sie sich binnen sechs Monaten nach der Bekanntmachung zu diesem Zweck bei ihm melden."
    },
    {
      "date": "2025-03-04",
      "id": "102787",
      "original_text": "Sonstige Registerbekanntmachung\nHamburg Amtsgericht Hamburg HRB 29727\nHamburger Lebenshilfe-Werk gGmbH – Hamburg",
      "type": "Sonstige Registerbekanntmachung",
      "state": "Hamburg",
      "amtsgericht": "Amtsgericht Hamburg",
      "registernummer": "HRB 29727",
      "registerart": "HRB",
      "company_name": "Hamburger Lebenshilfe-Werk gGmbH",
      "company_seat": "Hamburg",
      "details": "04.03.2025 (Bekanntmachungsdatum)\n\nHamburg Amtsgericht Hamburg HRB 29727\nSonstige Registerbekanntmachung\n\nHamburger Lebenshilfe-Werk gGmbH\nGesellschaft mit beschränkter Haftung\nHamburg\n\nAls nicht eingetragen wird bekannt gemacht: Liste des Aufsichtsrats wurde eingereicht."
    },
    {
      "date": "2025-03-04",
      "id": "102788",
      "original_text": "Löschungsankündigung\nBaden-Württemberg Amtsgericht Mannheim HRA 710096\nAHA! Service e.K. – Mannheim",
      "type": "Löschungsankündigung",
      "state": "Baden-Württemberg",
      "amtsgericht": "Amtsgericht Mannheim",
      "registernummer": "HRA 710096",
      "registerart": "HRA",
      "company_name": "AHA! Service e.K.",
      "company_seat": "Mannheim",
      "details": "04.03.2025 (Bekanntmachungsdatum)\n\nBaden-Württemberg Amtsgericht Mannheim HRA 710096\nLöschungsankündigung\n\nAHA! Service e.K.\nEinzelkaufmann / Einzelkauffrau\nMannheim\n\nDas Registergericht beabsichtigt, die Firma im Handelsregister von Amts wegen nach § 31 Abs. 2 HGB zu löschen. Die Frist zur Geltendmachung eines Widerspruchs gegen die beabsichtigte Löschung ist auf einen Monat ab Veröffentlichung bestimmt."
    },
    {
      "date": "2025-03-04",
      "id": "102789",
      "original_text": "Registerbekanntmachung nach dem Umwandlungsgesetz\nSchleswig-Holstein Amtsgericht Lübeck HRB 25482\nRühaak Steuerberatungsgesellschaft mbH – Ahrensburg",
      "type": "Registerbekanntmachung nach dem Umwandlungsgesetz",
      "state": "Schleswig-Holstein",
      "amtsgericht": "Amtsgericht Lübeck",
      "registernummer": "HRB 25482",
      "registerart": "HRB",
      "company_name": "Rühaak Steuerberatungsgesellschaft mbH",
      "company_seat": "Ahrensburg",
      "details": "04.03.2025 (Bekanntmachungsdatum)\n\nSchleswig-Holstein Amtsgericht Lübeck HRB 25482\nRegisterbekanntmachung nach dem Umwandlungsgesetz 03.03.2025 (Eintragungsdatum)\n\nRühaak Steuerberatungsgesellschaft mbH\nGesellschaft mit beschränkter Haftung\nAhrensburg\n\nZu Eintragungsnummer 2 vom 03.03.2025 wird als nicht eingetragen veröffentlicht: Den Gläubigern der an der Spaltung beteiligten Rechtsträger ist, wenn sie binnen sechs Monaten nach dem Tag, an dem die Eintragung der Spaltung in das Register des Sitzes desjenigen Rechtsträgers, dessen Gläubiger sie sind, als bekannt gemacht gilt, ihren Anspruch nach Grund und Höhe schriftlich anmelden, Sicherheit zu leisten, soweit sie nicht Befriedigung verlangen können. Dieses Recht steht den Gläubigern jedoch nur zu, wenn sie glaubhaft machen, dass durch die Spaltung die Erfüllung ihrer Forderung gefährdet wird."
    },
    {
      "date": "2025-03-04",
      "id": "102790",
      "original_text": "Registerbekanntmachung nach dem Umwandlungsgesetz\nBrandenburg Amtsgericht Potsdam HRB 31697\ninit.voice GmbH – Bad Belzig",
      "type": "Registerbekanntmachung nach dem Umwandlungsgesetz",
      "state": "Brandenburg",
      "amtsgericht": "Amtsgericht Potsdam",
      "registernummer": "HRB 31697",
      "registerart": "HRB",
      "company_name": "init.voice GmbH",
      "company_seat": "Bad Belzig",
      "details": "04.03.2025 (Bekanntmachungsdatum)\n\nBrandenburg Amtsgericht Potsdam HRB 31697\nRegisterbekanntmachung nach dem Umwandlungsgesetz 26.02.2025 (Eintragungsdatum)\n\ninit.voice GmbH\nGesellschaft mit beschränkter Haftung\nBad Belzig\n\nZu Eintragungsnummer 4 vom 26.02.2025 wird als nicht eingetragen veröffentlicht: Den Gläubigern der an der Verschmelzung beteiligten Rechtsträger ist, wenn sie binnen sechs Monaten nach dem Tag, an dem die Eintragung der Verschmelzung in das Register des Sitzes desjenigen Rechtsträgers, dessen Gläubiger sie sind, als bekannt gemacht gilt, ihren Anspruch nach Grund und Höhe schriftlich anmelden, Sicherheit zu leisten, soweit sie nicht Befriedigung verlangen können. Dieses Recht steht den Gläubigern jedoch nur zu, wenn sie glaubhaft machen, dass durch die Verschmelzung die Erfüllung ihrer Forderung gefährdet"
    },
    {
      "date": "2025-03-04",
      "id": "102791",
      "original_text": "Registerbekanntmachung nach dem Umwandlungsgesetz\nBerlin Amtsgericht Berlin (Charlottenburg) HRB 233678\nOrgazign Ventures GmbH – Berlin",
      "type": "Registerbekanntmachung nach dem Umwandlungsgesetz",
      "state": "Berlin",
      "amtsgericht": "Amtsgericht Berlin (Charlottenburg)",
      "registernummer": "HRB 233678",
      "registerart": "HRB",
      "company_name": "Orgazign Ventures GmbH",
      "company_seat": "Berlin",
      "details": "04.03.2025 (Bekanntmachungsdatum)\n\nBerlin Amtsgericht Berlin (Charlottenburg) HRB 233678\nRegisterbekanntmachung nach dem Umwandlungsgesetz 04.03.2025 (Eintragungsdatum)\n\nOrgazign Ventures GmbH\nGesellschaft mit beschränkter Haftung\nBerlin\n\nZu Eintragungsnummer 4 vom 04.03.2025 wird als nicht eingetragen veröffentlicht: Den Gläubigern der an der Verschmelzung beteiligten Rechtsträger ist, wenn sie binnen sechs Monaten nach dem Tag, an dem die Eintragung der Verschmelzung in das Register des Sitzes desjenigen Rechtsträgers, dessen Gläubiger sie sind, als bekannt gemacht gilt, ihren Anspruch nach Grund und Höhe schriftlich anmelden, Sicherheit zu leisten, soweit sie nicht Befriedigung verlangen können. Dieses Recht steht den Gläubigern jedoch nur zu, wenn sie glaubhaft machen, dass durch die Verschmelzung die Erfüllung ihrer Forderung gefährdet wird. Das Recht, Sicherheitsleistung zu verlangen, steht Gläubigern nicht zu, die im Falle der Insolvenz ein Recht auf vorzugsweise Befriedigung aus einer Deckungsmasse haben, die nach gesetzlicher Vorschrift zu ihrem Schutz errichtet und staatlich überwacht ist."
    },
    {
      "date": "2025-03-04",
      "id": "102792",
      "original_text": "Registerbekanntmachung nach dem Umwandlungsgesetz\nBerlin Amtsgericht Berlin (Charlottenburg) HRB 234932\nOrgazign Solutions GmbH – Berlin",
      "type": "Registerbekanntmachung nach dem Umwandlungsgesetz",
      "state": "Berlin",
      "amtsgericht": "Amtsgericht Berlin (Charlottenburg)",
      "registernummer": "HRB 234932",
      "registerart": "HRB",
      "company_name": "Orgazign Solutions GmbH",
      "company_seat": "Berlin",
      "details": "04.03.2025 (Bekanntmachungsdatum)\n\nBerlin Amtsgericht Berlin (Charlottenburg) HRB 234932\nRegisterbekanntmachung nach dem Umwandlungsgesetz 04.03.2025 (Eintragungsdatum)\n\nOrgazign Solutions GmbH\nGesellschaft mit beschränkter Haftung\nBerlin\n\nZu Eintragungsnummer 3 vom 04.03.2025 wird als nicht eingetragen veröffentlicht: Den Gläubigern der an der Verschmelzung beteiligten Rechtsträger ist, wenn sie binnen sechs Monaten nach dem Tag, an dem die Eintragung der Verschmelzung in das Register des Sitzes desjenigen Rechtsträgers, dessen Gläubiger sie sind, als bekannt gemacht gilt, ihren Anspruch nach Grund und Höhe schriftlich anmelden, Sicherheit zu leisten, soweit sie nicht Befriedigung verlangen können. Dieses Recht steht den Gläubigern jedoch nur zu, wenn sie glaubhaft machen, dass durch die Verschmelzung die Erfüllung ihrer Forderung gefährdet wird. Das Recht, Sicherheitsleistung zu verlangen, steht Gläubigern nicht zu, die im Falle der Insolvenz ein Recht auf vorzugsweise Befriedigung aus einer Deckungsmasse haben, die nach gesetzlicher Vorschrift zu ihrem Schutz errichtet und staatlich überwacht ist."
    },
    {
      "date": "2025-03-04",
      "id": "102793",
      "original_text": "Löschungsankündigung\nNordrhein-Westfalen Amtsgericht Coesfeld HRB 20171\nFacilities Services GmbH – Gronau",
      "type": "Löschungsankündigung",
      "state": "Nordrhein-Westfalen",
      "amtsgericht": "Amtsgericht Coesfeld",
      "registernummer": "HRB 20171",
      "registerart": "HRB",
      "company_name": "Facilities Services GmbH",
      "company_seat": "Gronau",
      "details": "04.03.2025 (Bekanntmachungsdatum)\n\nNordrhein-Westfalen Amtsgericht Coesfeld HRB 20171\nLöschungsankündigung\n\nFacilities Services GmbH\nGesellschaft mit beschränkter Haftung\nGronau\n\nDas Registergericht beabsichtigt, den Rechtsträger wegen Vermögenslosigkeit gemäß § 394 FamFG von Amts wegen zu löschen.\n\nGegen diese Verfügung kann Widerspruch eingelegt werden. Die Frist zur Erhebung eines Widerspruchs gegen die beabsichtigte Löschung ist auf zwei Monate ab Veröffentlichung festgesetzt."
    },
    {
      "date": "2025-03-04",
      "id": "102794",
      "original_text": "Löschungsankündigung\nBaden-Württemberg Amtsgericht Stuttgart HRB 736799\nSHN Management UG (haftungsbeschränkt) – Stuttgart",
      "type": "Löschungsankündigung",
      "state": "Baden-Württemberg",
      "amtsgericht": "Amtsgericht Stuttgart",
      "registernummer": "HRB 736799",
      "registerart": "HRB",
      "company_name": "SHN Management UG (haftungsbeschränkt)",
      "company_seat": "Stuttgart",
      "details": "04.03.2025 (Bekanntmachungsdatum)\n\nBaden-Württemberg Amtsgericht Stuttgart HRB 736799\nLöschungsankündigung\n\nSHN Management UG (haftungsbeschränkt)\nGesellschaft mit beschränkter Haftung\nStuttgart\n\nAls nicht eingetragen wird bekanntgemacht:\nDas Gericht beabsichtigt, die Gesellschaft wegen Vermögenslosigkeit im Handelsregister von Amts wegen nach § 394 FamFG zu löschen. Die Frist zur Geltendmachung eines Widerspruchs gegen die beabsichtigte Löschung ist auf zwei Monate ab Veröffentlichung bestimmt."
    },
    {
      "date": "2025-03-04",
      "id": "102795",
      "original_text": "Registerbekanntmachung nach dem Umwandlungsgesetz\nBaden-Württemberg Amtsgericht Freiburg PR 700270\nHenne Korn Landschaftsarchitekten PartGmbB – Freiburg im Breisgau",
      "type": "Registerbekanntmachung nach dem Umwandlungsgesetz",
      "state": "Baden-Württemberg",
      "amtsgericht": "Amtsgericht Freiburg",
      "registernummer": "PR 700270",
      "registerart": "PR",
      "company_name": "Henne Korn Landschaftsarchitekten PartGmbB",
      "company_seat": "Freiburg im Breisgau",
      "details": "04.03.2025 (Bekanntmachungsdatum)\n\nBaden-Württemberg Amtsgericht Freiburg PR 700270\nRegisterbekanntmachung nach dem Umwandlungsgesetz 04.03.2025 (Eintragungsdatum)\n\nHenne Korn Landschaftsarchitekten PartGmbB\nPartnerschaftsgesellschaft\nFreiburg im Breisgau\n\nAls nicht eingetragen wird bekanntgemacht:\nDen Gläubigern der an der Verschmelzung beteiligten Rechtsträger ist, wenn sie binnen sechs Monaten nach dem Tag, an dem die Eintragung der Verschmelzung in das Register des Sitzes desjenigen Rechtsträgers, dessen Gläubiger sie sind, nach § 19 Abs. 3 UmwG als bekanntgemacht gilt, ihren Anspruch nach Grund und Höhe schriftlich anmelden, Sicherheit zu leisten, soweit sie nicht Befriedigung verlangen können. Dieses Recht steht den Gläubigern jedoch nur zu, wenn sie glaubhaft machen, dass durch die Verschmelzung die Erfüllung ihrer Forderung gefährdet wird."
    },
    {
      "date": "2025-03-04",
      "id": "102796",
      "original_text": "Einreichung neuer Dokumente\nBrandenburg Amtsgericht Potsdam HRB 26405\nFreibad Kiebitzberge GmbH – Kleinmachnow",
      "type": "Einreichung neuer Dokumente",
      "state": "Brandenburg",
      "amtsgericht": "Amtsgericht Potsdam",
      "registernummer": "HRB 26405",
      "registerart": "HRB",
      "company_name": "Freibad Kiebitzberge GmbH",
      "company_seat": "Kleinmachnow",
      "details": "04.03.2025 (Bekanntmachungsdatum)\n\nBrandenburg Amtsgericht Potsdam HRB 26405\nEinreichung neuer Dokumente\n\nFreibad Kiebitzberge GmbH\nGesellschaft mit beschränkter Haftung\nKleinmachnow\n\nAls nicht eingetragen wird bekanntgemacht :\nEine Liste der Mitglieder des Aufsichtsrates wurde zum Handelsregister eingereicht."
    },
    {
      "date": "2025-03-04",
      "id": "102797",
      "original_text": "Registerbekanntmachung nach dem Umwandlungsgesetz\nBerlin Amtsgericht Berlin (Charlottenburg) HRB 272653\nTWONATURALS GmbH – Berlin",
      "type": "Registerbekanntmachung nach dem Umwandlungsgesetz",
      "state": "Berlin",
      "amtsgericht": "Amtsgericht Berlin (Charlottenburg)",
      "registernummer": "HRB 272653",
      "registerart": "HRB",
      "company_name": "TWONATURALS GmbH",
      "company_seat": "Berlin",
      "details": "04.03.2025 (Bekanntmachungsdatum)\n\nBerlin Amtsgericht Berlin (Charlottenburg) HRB 272653\nRegisterbekanntmachung nach dem Umwandlungsgesetz 26.02.2025 (Eintragungsdatum)\n\nTWONATURALS GmbH\nGesellschaft mit beschränkter Haftung\nBerlin\n\nZu Eintragungsnummer 1 vom 26.02.2025 wird als nicht eingetragen veröffentlicht: Den Gläubigern ist, wenn sie binnen sechs Monaten nach dem Tag, an dem die Eintragung der Umwandlung als bekannt gemacht gilt, ihren Anspruch nach Grund und Höhe schriftlich anmelden, Sicherheit zu leisten, soweit sie nicht Befriedigung verlangen können. Dieses Recht steht den Gläubigern jedoch nur zu, wenn sie glaubhaft machen, dass durch die Umwandlung die Erfüllung ihrer Forderung gefährdet wird. Das Recht, Sicherheitsleistung zu verlangen, steht Gläubigern nicht zu, die im Falle der Insolvenz ein Recht auf vorzugsweise Befriedigung aus einer Deckungsmasse haben, die nach gesetzlicher Vorschrift zu ihrem Schutz errichtet und staatlich überwacht ist."
    },
    {
      "date": "2025-03-04",
      "id": "102798",
      "original_text": "Sonstige Registerbekanntmachung\nHamburg Amtsgericht Hamburg HRB 68929\nNavata GmbH – Hamburg",
      "type": "Sonstige Registerbekanntmachung",
      "state": "Hamburg",
      "amtsgericht": "Amtsgericht Hamburg",
      "registernummer": "HRB 68929",
      "registerart": "HRB",
      "company_name": "Navata GmbH",
      "company_seat": "Hamburg",
      "details": "04.03.2025 (Bekanntmachungsdatum)\n\nHamburg Amtsgericht Hamburg HRB 68929\nSonstige Registerbekanntmachung 04.03.2025 (Eintragungsdatum)\n\nNavata GmbH\nGesellschaft mit beschränkter Haftung\nHamburg\n\nAls nicht eingetragen wird bekannt gemacht: Den Gläubigern der Gesellschaft, deren Forderungen begründet worden sind, bevor die Eintragung der Vertragsbeendigung in das Handelsregister nach § 10 HGB als bekannt gemacht gilt, ist vom anderen Vertragsteil Sicherheit zu leisten, wenn sie sich binnen 6 Monaten nach Bekanntmachung der Eintragung zu diesem Zweck bei ihm melden."
    },
    {
      "date": "2025-03-04",
      "id": "102799",
      "original_text": "Registerbekanntmachung nach dem Umwandlungsgesetz\nBerlin Amtsgericht Berlin (Charlottenburg) HRA 58459\nTele Columbus Multimedia GmbH & Co. KG – Berlin",
      "type": "Registerbekanntmachung nach dem Umwandlungsgesetz",
      "state": "Berlin",
      "amtsgericht": "Amtsgericht Berlin (Charlottenburg)",
      "registernummer": "HRA 58459",
      "registerart": "HRA",
      "company_name": "Tele Columbus Multimedia GmbH & Co. KG",
      "company_seat": "Berlin",
      "details": "04.03.2025 (Bekanntmachungsdatum)\n\nBerlin Amtsgericht Berlin (Charlottenburg) HRA 58459\nRegisterbekanntmachung nach dem Umwandlungsgesetz 03.03.2025 (Eintragungsdatum)\n\nTele Columbus Multimedia GmbH & Co. KG\nKommanditgesellschaft\nBerlin\n\nZu Eintragungsnummer 15 vom 03.03.2025 wird als nicht eingetragen veröffentlicht: Den Gläubigern der an der Verschmelzung beteiligten Rechtsträger ist, wenn sie binnen sechs Monaten nach dem Tag, an dem die Eintragung der Verschmelzung in das Register des Sitzes desjenigen Rechtsträgers, dessen Gläubiger sie sind, als bekannt gemacht gilt, ihren Anspruch nach Grund und Höhe schriftlich anmelden, Sicherheit zu leisten, soweit sie nicht Befriedigung verlangen können. Dieses Recht steht den Gläubigern jedoch nur zu, wenn sie glaubhaft machen, dass durch die Verschmelzung die Erfüllung ihrer Forderung gefährdet wird. Das Recht, Sicherheitsleistung zu verlangen, steht Gläubigern nicht zu, die im Falle der Insolvenz ein Recht auf vorzugsweise Befriedigung aus einer Deckungsmasse haben, die nach gesetzlicher Vorschrift zu ihrem Schutz errichtet und staatlich überwacht ist."
    },
    {
      "date": "2025-03-04",
      "id": "102800",
      "original_text": "Registerbekanntmachung nach dem Umwandlungsgesetz\nBerlin Amtsgericht Berlin (Charlottenburg) HRB 207637\nTele Columbus Geschäftskunden Vertriebs GmbH – Berlin",
      "type": "Registerbekanntmachung nach dem Umwandlungsgesetz",
      "state": "Berlin",
      "amtsgericht": "Amtsgericht Berlin (Charlottenburg)",
      "registernummer": "HRB 207637",
      "registerart": "HRB",
      "company_name": "Tele Columbus Geschäftskunden Vertriebs GmbH",
      "company_seat": "Berlin",
      "details": "04.03.2025 (Bekanntmachungsdatum)\n\nBerlin Amtsgericht Berlin (Charlottenburg) HRB 207637\nRegisterbekanntmachung nach dem Umwandlungsgesetz 03.03.2025 (Eintragungsdatum)\n\nTele Columbus Geschäftskunden Vertriebs GmbH\nGesellschaft mit beschränkter Haftung\nBerlin\n\nZu Eintragungsnummer 11 vom 03.03.2025 wird als nicht eingetragen veröffentlicht: Den Gläubigern der an der Verschmelzung beteiligten Rechtsträger ist, wenn sie binnen sechs Monaten nach dem Tag, an dem die Eintragung der Verschmelzung in das Register des Sitzes desjenigen Rechtsträgers, dessen Gläubiger sie sind, als bekannt gemacht gilt, ihren Anspruch nach Grund und Höhe schriftlich anmelden, Sicherheit zu leisten, soweit sie nicht Befriedigung verlangen können. Dieses Recht steht den Gläubigern jedoch nur zu, wenn sie glaubhaft machen, dass durch die Verschmelzung die Erfüllung ihrer Forderung gefährdet wird. Das Recht, Sicherheitsleistung zu verlangen, steht Gläubigern nicht zu, die im Falle der Insolvenz ein Recht auf vorzugsweise Befriedigung aus einer Deckungsmasse haben, die nach gesetzlicher Vorschrift zu ihrem Schutz errichtet und staatlich überwacht ist."
    },
    {
      "date": "2025-03-04",
      "id": "102801",
      "original_text": "Sonstige Registerbekanntmachung\nBerlin Amtsgericht Berlin (Charlottenburg) HRB 207637\nTele Columbus Geschäftskunden Vertriebs GmbH – Berlin",
      "type": "Sonstige Registerbekanntmachung",
      "state": "Berlin",
      "amtsgericht": "Amtsgericht Berlin (Charlottenburg)",
      "registernummer": "HRB 207637",
      "registerart": "HRB",
      "company_name": "Tele Columbus Geschäftskunden Vertriebs GmbH",
      "company_seat": "Berlin",
      "details": "04.03.2025 (Bekanntmachungsdatum)\n\nBerlin Amtsgericht Berlin (Charlottenburg) HRB 207637\nSonstige Registerbekanntmachung\n\nTele Columbus Geschäftskunden Vertriebs GmbH\nGesellschaft mit beschränkter Haftung\nBerlin\n\nAls nicht eingetragen wird veröffentlicht: Der andere Vertragsteil hat den Gläubigern dieses Rechtsträgers, deren Forderungen begründet worden sind, bevor die Eintragung der Beendigung dieses Vertrages in das Handelsregister nach § 10 des Handelsgesetzbuches als bekannt gemacht gilt, Sicherheit zu leisten, wenn sie sich binnen sechs Monaten nach der Bekanntmachung der Eintragung zu diesem Zweck bei ihm melden. Dieses Recht steht den Gläubigern nicht zu, die im Fall des Insolvenzverfahrens ein Recht auf vorzugsweise Befriedigung aus der Deckungsmasse haben, die nach gesetzlicher Vorschrift zu ihrem Schutz errichtet und staatlich überwacht ist."
    },
    {
      "date": "2025-03-04",
      "id": "102802",
      "original_text": "Einreichung neuer Dokumente\nBaden-Württemberg Amtsgericht Stuttgart HRB 262498\nStädtische Wohnungsgesellschaft Waiblingen Gesellschaft mit beschränkter Haftung – Waiblingen",
      "type": "Einreichung neuer Dokumente",
      "state": "Baden-Württemberg",
      "amtsgericht": "Amtsgericht Stuttgart",
      "registernummer": "HRB 262498",
      "registerart": "HRB",
      "company_name": "Städtische Wohnungsgesellschaft Waiblingen Gesellschaft mit beschränkter Haftung",
      "company_seat": "Waiblingen",
      "details": "04.03.2025 (Bekanntmachungsdatum)\n\nBaden-Württemberg Amtsgericht Stuttgart HRB 262498\nEinreichung neuer Dokumente\n\nStädtische Wohnungsgesellschaft Waiblingen Gesellschaft mit beschränkter Haftung\nGesellschaft mit beschränkter Haftung\nWaiblingen\n\nDie Gesellschaft hat am 25.02.2025 die Liste über die Zusammensetzung des Aufsichtsrats zum Handelsregister eingereicht."
    },
    {
      "date": "2025-03-04",
      "id": "102803",
      "original_text": "Löschungsankündigung\nBerlin Amtsgericht Berlin (Charlottenburg) HRB 122385\nCABital Berlin GmbH – Berlin",
      "type": "Löschungsankündigung",
      "state": "Berlin",
      "amtsgericht": "Amtsgericht Berlin (Charlottenburg)",
      "registernummer": "HRB 122385",
      "registerart": "HRB",
      "company_name": "CABital Berlin GmbH",
      "company_seat": "Berlin",
      "details": "04.03.2025 (Bekanntmachungsdatum)\n\nBerlin Amtsgericht Berlin (Charlottenburg) HRB 122385\nLöschungsankündigung\n\nCABital Berlin GmbH\nGesellschaft mit beschränkter Haftung\nBerlin\n\nBei der nachstehenden Gesellschaft wird das Amtslöschungsverfahren gemäß § 394 FamFG eingeleitet. Widerspruchsfrist 6 Wochen"
    },
    {
      "date": "2025-03-04",
      "id": "102804",
      "original_text": "Registerbekanntmachung nach dem Umwandlungsgesetz\nSchleswig-Holstein Amtsgericht Lübeck HRB 24232\ni+ GmbH – Schwarzenbek",
      "type": "Registerbekanntmachung nach dem Umwandlungsgesetz",
      "state": "Schleswig-Holstein",
      "amtsgericht": "Amtsgericht Lübeck",
      "registernummer": "HRB 24232",
      "registerart": "HRB",
      "company_name": "i+ GmbH",
      "company_seat": "Schwarzenbek",
      "details": "04.03.2025 (Bekanntmachungsdatum)\n\nSchleswig-Holstein Amtsgericht Lübeck HRB 24232\nRegisterbekanntmachung nach dem Umwandlungsgesetz 21.02.2025 (Eintragungsdatum)\n\ni+ GmbH\nGesellschaft mit beschränkter Haftung\nSchwarzenbek\n\nZu Eintragungsnummer 2 vom 21.02.2025 wird als nicht eingetragen veröffentlicht:\nDen Gläubigern der an der Verschmelzung beteiligten Rechtsträger ist, wenn sie binnen sechs Monaten nach dem Tag, an dem die Eintragung der Verschmelzung in das Register des Sitzes desjenigen Rechtsträgers, dessen Gläubiger sie sind, als bekannt gemacht gilt, ihren Anspruch nach Grund und Höhe schriftlich anmelden, Sicherheit zu leisten, soweit sie nicht Befriedigung verlangen können. Dieses Recht steht den Gläubigern jedoch nur zu, wenn sie glaubhaft machen, dass durch die Verschmelzung die Erfüllung ihrer Forderung gefährdet wird."
    },
    {
      "date": "2025-03-04",
      "id": "102805",
      "original_text": "Löschungsankündigung\nThüringen Amtsgericht Jena HRB 511276\nmpc Music Pool Concerts GmbH – Ilmtal-Weinstraße",
      "type": "Löschungsankündigung",
      "state": "Thüringen",
      "amtsgericht": "Amtsgericht Jena",
      "registernummer": "HRB 511276",
      "registerart": "HRB",
      "company_name": "mpc Music Pool Concerts GmbH",
      "company_seat": "Ilmtal-Weinstraße",
      "details": "04.03.2025 (Bekanntmachungsdatum)\n\nThüringen Amtsgericht Jena HRB 511276\nLöschungsankündigung\n\nmpc Music Pool Concerts GmbH\nGesellschaft mit beschränkter Haftung\nIlmtal-Weinstraße\n\nDas Registergericht beabsichtigt, die im Handelsregister eingetragene Gesellschaft wegen Vermögenslosigkeit nach § 394 FamFG von Amts wegen zu löschen. Die Frist zur Erhebung eines Widerspruchs gegen die beabsichtigte Löschung wird auf 6 Wochen festgesetzt."
    },
    {
      "date": "2025-03-04",
      "id": "102806",
      "original_text": "Löschungsankündigung\nThüringen Amtsgericht Jena HRB 203886\nRWP-Gase-Technik-Service GmbH – Gera",
      "type": "Löschungsankündigung",
      "state": "Thüringen",
      "amtsgericht": "Amtsgericht Jena",
      "registernummer": "HRB 203886",
      "registerart": "HRB",
      "company_name": "RWP-Gase-Technik-Service GmbH",
      "company_seat": "Gera",
      "details": "04.03.2025 (Bekanntmachungsdatum)\n\nThüringen Amtsgericht Jena HRB 203886\nLöschungsankündigung\n\nRWP-Gase-Technik-Service GmbH\nGesellschaft mit beschränkter Haftung\nGera\n\nDas Registergericht beabsichtigt, die im Handelsregister eingetragene Gesellschaft wegen Vermögenslosigkeit nach § 394 FamFG von Amts wegen zu löschen. Die Frist zur Erhebung eines Widerspruchs gegen die beabsichtigte Löschung wird auf 6 Wochen festgesetzt."
    },
    {
      "date": "2025-03-04",
      "id": "102807",
      "original_text": "Registerbekanntmachung nach dem Umwandlungsgesetz\nThüringen Amtsgericht Jena HRB 204318\nRSG Family Office GmbH – Gera",
      "type": "Registerbekanntmachung nach dem Umwandlungsgesetz",
      "state": "Thüringen",
      "amtsgericht": "Amtsgericht Jena",
      "registernummer": "HRB 204318",
      "registerart": "HRB",
      "company_name": "RSG Family Office GmbH",
      "company_seat": "Gera",
      "details": "04.03.2025 (Bekanntmachungsdatum)\n\nThüringen Amtsgericht Jena HRB 204318\nRegisterbekanntmachung nach dem Umwandlungsgesetz 04.03.2025 (Eintragungsdatum)\n\nRSG Family Office GmbH\nGesellschaft mit beschränkter Haftung\nGera\n\nNicht eingetragen: Den Gläubigern des formwechselnden  Rechtsträgers, ist wenn sie binnen sechs Monaten nach dem Tag, an dem die Eintragung des Formwechsels nach § 201 UmwG als bekanntgemacht gilt, ihren Anspruch nach Grund und Höhe schriftlich anmelden, Sicherheit zu leisten, soweit sie nicht Befriedigung verlangen können. Dieses Recht steht ihnen jedoch nur zu, wenn sie glaubhaft machen, daß durch den Formwechsel die Erfüllung ihrer Forderung gefährdet wird."
    },
    {
      "date": "2025-03-04",
      "id": "102808",
      "original_text": "Sonstige Registerbekanntmachung\nThüringen Amtsgericht Bad Salzungen VR 300907\nSubkultur 469 e.V. – Tiefenort",
      "type": "Sonstige Registerbekanntmachung",
      "state": "Thüringen",
      "amtsgericht": "Amtsgericht Bad Salzungen",
      "registernummer": "VR 300907",
      "registerart": "VR",
      "company_name": "Subkultur 469 e.V.",
      "company_seat": "Tiefenort",
      "details": "04.03.2025 (Bekanntmachungsdatum)\n\nThüringen Amtsgericht Bad Salzungen VR 300907\nSonstige Registerbekanntmachung 21.02.2025 (Eintragungsdatum)\n\nSubkultur 469 e.V.\neingetragener Verein\nTiefenort"
    },
    {
      "date": "2025-03-04",
      "id": "102809",
      "original_text": "Löschungsankündigung\nSchleswig-Holstein Amtsgericht Pinneberg HRB 14890\nNordtime Logistics GmbH – Breitenburg",
      "type": "Löschungsankündigung",
      "state": "Schleswig-Holstein",
      "amtsgericht": "Amtsgericht Pinneberg",
      "registernummer": "HRB 14890",
      "registerart": "HRB",
      "company_name": "Nordtime Logistics GmbH",
      "company_seat": "Breitenburg",
      "details": "04.03.2025 (Bekanntmachungsdatum)\n\nSchleswig-Holstein Amtsgericht Pinneberg HRB 14890\nLöschungsankündigung\n\nNordtime Logistics GmbH\nGesellschaft mit beschränkter Haftung\nBreitenburg\n\nEs ist die Löschung der nachstehenden Gesellschaft wegen Vermögenslosigkeit gemäß § 394 FamFG beabsichtigt. Widerspruchsfrist: 2 Monate."
    },
    {
      "date": "2025-03-04",
      "id": "102810",
      "original_text": "Registerbekanntmachung nach dem Umwandlungsgesetz\nBaden-Württemberg Amtsgericht Stuttgart HRB 211464\nVöhringer GmbH – Plochingen",
      "type": "Registerbekanntmachung nach dem Umwandlungsgesetz",
      "state": "Baden-Württemberg",
      "amtsgericht": "Amtsgericht Stuttgart",
      "registernummer": "HRB 211464",
      "registerart": "HRB",
      "company_name": "Vöhringer GmbH",
      "company_seat": "Plochingen",
      "details": "04.03.2025 (Bekanntmachungsdatum)\n\nBaden-Württemberg Amtsgericht Stuttgart HRB 211464\nRegisterbekanntmachung nach dem Umwandlungsgesetz 04.03.2025 (Eintragungsdatum)\n\nVöhringer GmbH\nGesellschaft mit beschränkter Haftung\nPlochingen\n\nAls nicht eingetragen wird bekanntgemacht:\nDen Gläubigern der an der Verschmelzung beteiligten Rechtsträger ist, wenn sie binnen sechs Monaten nach dem Tag, an dem die Eintragung der Verschmelzung in das Register des Sitzes desjenigen Rechtsträgers, dessen Gläubiger sie sind, nach § 19 Abs. 3 UmwG als bekanntgemacht gilt, ihren Anspruch nach Grund und Höhe schriftlich anmelden, Sicherheit zu leisten, soweit sie nicht Befriedigung verlangen können. Dieses Recht steht den Gläubigern jedoch nur zu, wenn sie glaubhaft machen, dass durch die Verschmelzung die Erfüllung ihrer Forderung gefährdet wird."
    },
    {
      "date": "2025-03-04",
      "id": "102811",
      "original_text": "Löschungsankündigung\nBaden-Württemberg Amtsgericht Stuttgart HRA 721101\nSchmid Solution GmbH & Co. KG – Ditzingen",
      "type": "Löschungsankündigung",
      "state": "Baden-Württemberg",
      "amtsgericht": "Amtsgericht Stuttgart",
      "registernummer": "HRA 721101",
      "registerart": "HRA",
      "company_name": "Schmid Solution GmbH & Co. KG",
      "company_seat": "Ditzingen",
      "details": "04.03.2025 (Bekanntmachungsdatum)\n\nBaden-Württemberg Amtsgericht Stuttgart HRA 721101\nLöschungsankündigung\n\nSchmid Solution GmbH & Co. KG\nKommanditgesellschaft\nDitzingen\n\nAls nicht eingetragen wird bekanntgemacht:\nDas Gericht beabsichtigt, die Gesellschaft wegen Vermögenslosigkeit im Handelsregister von Amts wegen nach § 394 FamFG zu löschen. Die Frist zur Geltendmachung eines Widerspruchs gegen die beabsichtigte Löschung ist auf zwei Monate ab Veröffentlichung bestimmt."
    },
    {
      "date": "2025-03-04",
      "id": "102812",
      "original_text": "Löschungsankündigung\nBerlin Amtsgericht Berlin (Charlottenburg) HRB 255941\nSprint Clean 28/7 UG (haftungsbeschränkt) – Berlin",
      "type": "Löschungsankündigung",
      "state": "Berlin",
      "amtsgericht": "Amtsgericht Berlin (Charlottenburg)",
      "registernummer": "HRB 255941",
      "registerart": "HRB",
      "company_name": "Sprint Clean 28/7 UG (haftungsbeschränkt)",
      "company_seat": "Berlin",
      "details": "04.03.2025 (Bekanntmachungsdatum)\n\nBerlin Amtsgericht Berlin (Charlottenburg) HRB 255941\nLöschungsankündigung\n\nSprint Clean 28/7 UG (haftungsbeschränkt)\nGesellschaft mit beschränkter Haftung\nBerlin\n\nBei der nachstehenden Gesellschaft wird das Amtslöschungsverfahren gemäß § 394 FamFG eingeleitet. Widerspruchsfrist 6 Wochen"
    },
    {
      "date": "2025-03-04",
      "id": "102813",
      "original_text": "Registerbekanntmachung nach dem Umwandlungsgesetz\nBerlin Amtsgericht Berlin (Charlottenburg) HRB 161632\nWG-DATA GmbH – Berlin",
      "type": "Registerbekanntmachung nach dem Umwandlungsgesetz",
      "state": "Berlin",
      "amtsgericht": "Amtsgericht Berlin (Charlottenburg)",
      "registernummer": "HRB 161632",
      "registerart": "HRB",
      "company_name": "WG-DATA GmbH",
      "company_seat": "Berlin",
      "details": "04.03.2025 (Bekanntmachungsdatum)\n\nBerlin Amtsgericht Berlin (Charlottenburg) HRB 161632\nRegisterbekanntmachung nach dem Umwandlungsgesetz 03.03.2025 (Eintragungsdatum)\n\nWG-DATA GmbH\nGesellschaft mit beschränkter Haftung\nBerlin\n\nZu Eintragungsnummer 11 vom 03.03.2025 wird als nicht eingetragen veröffentlicht:Den Gläubigern der an der Verschmelzung beteiligten Rechtsträger ist, wenn sie binnen sechs Monaten nach dem Tag, an dem die Eintragung der Verschmelzung in das Register des Sitzes desjenigen Rechtsträgers, dessen Gläubiger sie sind, als bekannt gemacht gilt, ihren Anspruch nach Grund und Höhe schriftlich anmelden, Sicherheit zu leisten, soweit sie nicht Befriedigung verlangen können. Dieses Recht steht den Gläubigern jedoch nur zu, wenn sie glaubhaft machen, dass durch die Verschmelzung die Erfüllung ihrer Forderung gefährdet wird. Das Recht, Sicherheitsleistung zu verlangen, steht Gläubigern nicht zu, die im Falle der Insolvenz ein Recht auf vorzugsweise Befriedigung aus einer Deckungsmasse haben, die nach gesetzlicher Vorschrift zu ihrem Schutz errichtet und staatlich überwacht ist."
    },
    {
      "date": "2025-03-04",
      "id": "102814",
      "original_text": "Löschungsankündigung\nBerlin Amtsgericht Berlin (Charlottenburg) HRB 90737\nPlaisir Verwaltungs-GmbH – Berlin",
      "type": "Löschungsankündigung",
      "state": "Berlin",
      "amtsgericht": "Amtsgericht Berlin (Charlottenburg)",
      "registernummer": "HRB 90737",
      "registerart": "HRB",
      "company_name": "Plaisir Verwaltungs-GmbH",
      "company_seat": "Berlin",
      "details": "04.03.2025 (Bekanntmachungsdatum)\n\nBerlin Amtsgericht Berlin (Charlottenburg) HRB 90737\nLöschungsankündigung\n\nPlaisir Verwaltungs-GmbH\nGesellschaft mit beschränkter Haftung\nBerlin\n\nBei der nachstehenden Gesellschaft wird das Amtslöschungsverfahren gemäß § 394 FamFG eingeleitet. Widerspruchsfrist 6 Wochen"
    },
    {
      "date": "2025-03-04",
      "id": "102815",
      "original_text": "Löschungsankündigung\nBerlin Amtsgericht Berlin (Charlottenburg) HRB 189272\nBSA Buch Sicherheitsdienst und Ausbildungs GmbH – Berlin",
      "type": "Löschungsankündigung",
      "state": "Berlin",
      "amtsgericht": "Amtsgericht Berlin (Charlottenburg)",
      "registernummer": "HRB 189272",
      "registerart": "HRB",
      "company_name": "BSA Buch Sicherheitsdienst und Ausbildungs GmbH",
      "company_seat": "Berlin",
      "details": "04.03.2025 (Bekanntmachungsdatum)\n\nBerlin Amtsgericht Berlin (Charlottenburg) HRB 189272\nLöschungsankündigung\n\nBSA Buch Sicherheitsdienst und Ausbildungs GmbH\nGesellschaft mit beschränkter Haftung\nBerlin\n\nBei der nachstehenden Gesellschaft wird das Amtslöschungsverfahren gemäß § 394 FamFG eingeleitet. Widerspruchsfrist\n6 Wochen."
    },
    {
      "date": "2025-03-04",
      "id": "102816",
      "original_text": "Registerbekanntmachung nach dem Umwandlungsgesetz\nSchleswig-Holstein Amtsgericht Kiel HRB 282 RD\nPaul Schütze GmbH – Bordesholm",
      "type": "Registerbekanntmachung nach dem Umwandlungsgesetz",
      "state": "Schleswig-Holstein",
      "amtsgericht": "Amtsgericht Kiel",
      "registernummer": "HRB 282 RD",
      "registerart": "HRB",
      "company_name": "Paul Schütze GmbH",
      "company_seat": "Bordesholm",
      "details": "04.03.2025 (Bekanntmachungsdatum)\n\nSchleswig-Holstein Amtsgericht Kiel HRB 282 RD\nRegisterbekanntmachung nach dem Umwandlungsgesetz 03.03.2025 (Eintragungsdatum)\n\nPaul Schütze GmbH\nGesellschaft mit beschränkter Haftung\nBordesholm\n\nZu Eintragungsnummer 6 vom 03.03.2025 wird als nicht eingetragen veröffentlicht:  Den Gläubigern der an der Verschmelzung beteiligten Rechtsträger ist, wenn sie binnen sechs Monaten nach dem Tag, an dem die Eintragung der Verschmelzung in das Register des Sitzes desjenigen Rechtsträgers, dessen Gläubiger sie sind, nach § 19 Abs. 3 UmwG bekannt gemacht worden ist, ihren Anspruch nach Grund und Höhe schriftlich anmelden, Sicherheit zu leisten, soweit sie nicht Befriedigung verlangen können. Dieses Recht steht den Gläubigern jedoch nur zu, wenn sie glaubhaft machen, dass durch die Verschmelzung die Erfüllung ihrer Forderung gefährdet wird."
    },
    {
      "date": "2025-03-04",
      "id": "102817",
      "original_text": "Löschungsankündigung\nBerlin Amtsgericht Berlin (Charlottenburg) HRB 150427\nBogdan Mobilfunk GmbH – Berlin",
      "type": "Löschungsankündigung",
      "state": "Berlin",
      "amtsgericht": "Amtsgericht Berlin (Charlottenburg)",
      "registernummer": "HRB 150427",
      "registerart": "HRB",
      "company_name": "Bogdan Mobilfunk GmbH",
      "company_seat": "Berlin",
      "details": "04.03.2025 (Bekanntmachungsdatum)\n\nBerlin Amtsgericht Berlin (Charlottenburg) HRB 150427\nLöschungsankündigung\n\nBogdan Mobilfunk GmbH\nGesellschaft mit beschränkter Haftung\nBerlin\n\nBei der nachstehenden Gesellschaft wird das Amtslöschungsverfahren gemäß § 394 FamFG eingeleitet. Widerspruchsfrist 6 Wochen"
    },
    {
      "date": "2025-03-04",
      "id": "102818",
      "original_text": "Einreichung neuer Dokumente\nBaden-Württemberg Amtsgericht Freiburg HRB 370699\nStädtische Wohnbaugesellschaft Kehl mit beschränkter Haftung – Kehl",
      "type": "Einreichung neuer Dokumente",
      "state": "Baden-Württemberg",
      "amtsgericht": "Amtsgericht Freiburg",
      "registernummer": "HRB 370699",
      "registerart": "HRB",
      "company_name": "Städtische Wohnbaugesellschaft Kehl mit beschränkter Haftung",
      "company_seat": "Kehl",
      "details": "04.03.2025 (Bekanntmachungsdatum)\n\nBaden-Württemberg Amtsgericht Freiburg HRB 370699\nEinreichung neuer Dokumente 04.03.2025 (Eintragungsdatum)\n\nStädtische Wohnbaugesellschaft Kehl mit beschränkter Haftung\nGesellschaft mit beschränkter Haftung\nKehl\n\nAls nicht eingetragen wird bekanntgemacht:\nDie Gesellschaft hat am 28.02.2025 die Liste über die Zusammensetzung des Aufsichtsrats zum Handelsregister eingereicht."
    },
    {
      "date": "2025-03-04",
      "id": "102819",
      "original_text": "Löschungsankündigung\nBaden-Württemberg Amtsgericht Stuttgart HRB 732371\nBauunternehmung Albert Schwarz GmbH – Esslingen am Neckar",
      "type": "Löschungsankündigung",
      "state": "Baden-Württemberg",
      "amtsgericht": "Amtsgericht Stuttgart",
      "registernummer": "HRB 732371",
      "registerart": "HRB",
      "company_name": "Bauunternehmung Albert Schwarz GmbH",
      "company_seat": "Esslingen am Neckar",
      "details": "04.03.2025 (Bekanntmachungsdatum)\n\nBaden-Württemberg Amtsgericht Stuttgart HRB 732371\nLöschungsankündigung 04.03.2025 (Eintragungsdatum)\n\nBauunternehmung Albert Schwarz GmbH\nGesellschaft mit beschränkter Haftung\nEsslingen am Neckar\n\nDas Gericht beabsichtigt, die Gesellschaft wegen Vermögenslosigkeit im Handelsregister von Amts wegen nach § 394 FamFG zu löschen. Die Frist zur Geltendmachung eines Widerspruchs gegen die beabsichtigte Löschung ist auf zwei Monate ab Veröffentlichung bestimmt."
    },
    {
      "date": "2025-03-04",
      "id": "102820",
      "original_text": "Löschungsankündigung\nBaden-Württemberg Amtsgericht Stuttgart HRB 769417\nMerz Hoch- & Tiefbau GmbH – Metzingen",
      "type": "Löschungsankündigung",
      "state": "Baden-Württemberg",
      "amtsgericht": "Amtsgericht Stuttgart",
      "registernummer": "HRB 769417",
      "registerart": "HRB",
      "company_name": "Merz Hoch- & Tiefbau GmbH",
      "company_seat": "Metzingen",
      "details": "04.03.2025 (Bekanntmachungsdatum)\n\nBaden-Württemberg Amtsgericht Stuttgart HRB 769417\nLöschungsankündigung\n\nMerz Hoch- & Tiefbau GmbH\nGesellschaft mit beschränkter Haftung\nMetzingen\n\nDas Gericht beabsichtigt, die Gesellschaft wegen Vermögenslosigkeit im Handelsregister von Amts wegen nach § 394 FamFG zu löschen. Die Frist zur Geltendmachung eines Widerspruchs gegen die beabsichtigte Löschung ist auf zwei Monate ab Veröffentlichung bestimmt."
    },
    {
      "date": "2025-03-04",
      "id": "102821",
      "original_text": "Registerbekanntmachung nach dem Umwandlungsgesetz\nBerlin Amtsgericht Berlin (Charlottenburg) HRB 185662\nHertha BSC Stadion GmbH – Berlin",
      "type": "Registerbekanntmachung nach dem Umwandlungsgesetz",
      "state": "Berlin",
      "amtsgericht": "Amtsgericht Berlin (Charlottenburg)",
      "registernummer": "HRB 185662",
      "registerart": "HRB",
      "company_name": "Hertha BSC Stadion GmbH",
      "company_seat": "Berlin",
      "details": "04.03.2025 (Bekanntmachungsdatum)\n\nBerlin Amtsgericht Berlin (Charlottenburg) HRB 185662\nRegisterbekanntmachung nach dem Umwandlungsgesetz 03.03.2025 (Eintragungsdatum)\n\nHertha BSC Stadion GmbH\nGesellschaft mit beschränkter Haftung\nBerlin\n\nZu Eintragungsnummer 6 vom 03.03.2025 wird als nicht eingetragen veröffentlicht: Den Gläubigern der an der Verschmelzung beteiligten Rechtsträger ist, wenn sie binnen sechs Monaten nach dem Tag, an dem die Eintragung der Verschmelzung in das Register des Sitzes desjenigen Rechtsträgers, dessen Gläubiger sie sind, als bekannt gemacht gilt, ihren Anspruch nach Grund und Höhe schriftlich anmelden, Sicherheit zu leisten, soweit sie nicht Befriedigung verlangen können. Dieses Recht steht den Gläubigern jedoch nur zu, wenn sie glaubhaft machen, dass durch die Verschmelzung die Erfüllung ihrer Forderung gefährdet wird. Das Recht, Sicherheitsleistung zu verlangen, steht Gläubigern nicht zu, die im Falle der Insolvenz ein Recht auf vorzugsweise Befriedigung aus einer Deckungsmasse haben, die nach gesetzlicher Vorschrift zu ihrem Schutz errichtet und staatlich überwacht ist."
    },
    {
      "date": "2025-03-04",
      "id": "102822",
      "original_text": "Registerbekanntmachung nach dem Umwandlungsgesetz\nBerlin Amtsgericht Berlin (Charlottenburg) HRB 185662\nHertha BSC Stadion GmbH – Berlin",
      "type": "Registerbekanntmachung nach dem Umwandlungsgesetz",
      "state": "Berlin",
      "amtsgericht": "Amtsgericht Berlin (Charlottenburg)",
      "registernummer": "HRB 185662",
      "registerart": "HRB",
      "company_name": "Hertha BSC Stadion GmbH",
      "company_seat": "Berlin",
      "details": "04.03.2025 (Bekanntmachungsdatum)\n\nBerlin Amtsgericht Berlin (Charlottenburg) HRB 185662\nRegisterbekanntmachung nach dem Umwandlungsgesetz 03.03.2025 (Eintragungsdatum)\n\nHertha BSC Stadion GmbH\nGesellschaft mit beschränkter Haftung\nBerlin\n\nZu Eintragungsnummer 7 vom 03.03.2025 wird als nicht eingetragen veröffentlicht: Den Gläubigern der an der Verschmelzung beteiligten Rechtsträger ist, wenn sie binnen sechs Monaten nach dem Tag, an dem die Eintragung der Verschmelzung in das Register des Sitzes desjenigen Rechtsträgers, dessen Gläubiger sie sind, als bekannt gemacht gilt, ihren Anspruch nach Grund und Höhe schriftlich anmelden, Sicherheit zu leisten, soweit sie nicht Befriedigung verlangen können. Dieses Recht steht den Gläubigern jedoch nur zu, wenn sie glaubhaft machen, dass durch die Verschmelzung die Erfüllung ihrer Forderung gefährdet wird. Das Recht, Sicherheitsleistung zu verlangen, steht Gläubigern nicht zu, die im Falle der Insolvenz ein Recht auf vorzugsweise Befriedigung aus einer Deckungsmasse haben, die nach gesetzlicher Vorschrift zu ihrem Schutz errichtet und staatlich überwacht ist."
    },
    {
      "date": "2025-03-04",
      "id": "102823",
      "original_text": "Registerbekanntmachung nach dem Umwandlungsgesetz\nBerlin Amtsgericht Berlin (Charlottenburg) HRB 185662\nHertha BSC Stadion GmbH – Berlin",
      "type": "Registerbekanntmachung nach dem Umwandlungsgesetz",
      "state": "Berlin",
      "amtsgericht": "Amtsgericht Berlin (Charlottenburg)",
      "registernummer": "HRB 185662",
      "registerart": "HRB",
      "company_name": "Hertha BSC Stadion GmbH",
      "company_seat": "Berlin",
      "details": "04.03.2025 (Bekanntmachungsdatum)\n\nBerlin Amtsgericht Berlin (Charlottenburg) HRB 185662\nRegisterbekanntmachung nach dem Umwandlungsgesetz 03.03.2025 (Eintragungsdatum)\n\nHertha BSC Stadion GmbH\nGesellschaft mit beschränkter Haftung\nBerlin\n\nZu Eintragungsnummer 8 vom 03.03.2025 wird als nicht eingetragen veröffentlicht: Den Gläubigern der an der Verschmelzung beteiligten Rechtsträger ist, wenn sie binnen sechs Monaten nach dem Tag, an dem die Eintragung der Verschmelzung in das Register des Sitzes desjenigen Rechtsträgers, dessen Gläubiger sie sind, als bekannt gemacht gilt, ihren Anspruch nach Grund und Höhe schriftlich anmelden, Sicherheit zu leisten, soweit sie nicht Befriedigung verlangen können. Dieses Recht steht den Gläubigern jedoch nur zu, wenn sie glaubhaft machen, dass durch die Verschmelzung die Erfüllung ihrer Forderung gefährdet wird. Das Recht, Sicherheitsleistung zu verlangen, steht Gläubigern nicht zu, die im Falle der Insolvenz ein Recht auf vorzugsweise Befriedigung aus einer Deckungsmasse haben, die nach gesetzlicher Vorschrift zu ihrem Schutz errichtet und staatlich überwacht ist."
    },
    {
      "date": "2025-03-04",
      "id": "102824",
      "original_text": "Registerbekanntmachung nach dem Umwandlungsgesetz\nBerlin Amtsgericht Berlin (Charlottenburg) HRB 186565\nSWC GmbH – Berlin",
      "type": "Registerbekanntmachung nach dem Umwandlungsgesetz",
      "state": "Berlin",
      "amtsgericht": "Amtsgericht Berlin (Charlottenburg)",
      "registernummer": "HRB 186565",
      "registerart": "HRB",
      "company_name": "SWC GmbH",
      "company_seat": "Berlin",
      "details": "04.03.2025 (Bekanntmachungsdatum)\n\nBerlin Amtsgericht Berlin (Charlottenburg) HRB 186565\nRegisterbekanntmachung nach dem Umwandlungsgesetz 03.03.2025 (Eintragungsdatum)\n\nSWC GmbH\nGesellschaft mit beschränkter Haftung\nBerlin\n\nZu Eintragungsnummer 5 vom 03.03.2025 wird als nicht eingetragen veröffentlicht: Den Gläubigern der an der Verschmelzung beteiligten Rechtsträger ist, wenn sie binnen sechs Monaten nach dem Tag, an dem die Eintragung der Verschmelzung in das Register des Sitzes desjenigen Rechtsträgers, dessen Gläubiger sie sind, als bekannt gemacht gilt, ihren Anspruch nach Grund und Höhe schriftlich anmelden, Sicherheit zu leisten, soweit sie nicht Befriedigung verlangen können. Dieses Recht steht den Gläubigern jedoch nur zu, wenn sie glaubhaft machen, dass durch die Verschmelzung die Erfüllung ihrer Forderung gefährdet wird. Das Recht, Sicherheitsleistung zu verlangen, steht Gläubigern nicht zu, die im Falle der Insolvenz ein Recht auf vorzugsweise Befriedigung aus einer Deckungsmasse haben, die nach gesetzlicher Vorschrift zu ihrem Schutz errichtet und staatlich überwacht ist."
    },
    {
      "date": "2025-03-04",
      "id": "102825",
      "original_text": "Einreichung neuer Dokumente\nBaden-Württemberg Amtsgericht Mannheim HRB 725128\nSOU AG – Schwetzingen",
      "type": "Einreichung neuer Dokumente",
      "state": "Baden-Württemberg",
      "amtsgericht": "Amtsgericht Mannheim",
      "registernummer": "HRB 725128",
      "registerart": "HRB",
      "company_name": "SOU AG",
      "company_seat": "Schwetzingen",
      "details": "04.03.2025 (Bekanntmachungsdatum)\n\nBaden-Württemberg Amtsgericht Mannheim HRB 725128\nEinreichung neuer Dokumente\n\nSOU AG\nAktiengesellschaft\nSchwetzingen\n\nDie Gesellschaft hat am 12.02.2025 die Liste über die Zusammensetzung des Aufsichtsrats zum Handelsregister eingereicht."
    },
    {
      "date": "2025-03-04",
      "id": "102826",
      "original_text": "Einreichung neuer Dokumente\nBaden-Württemberg Amtsgericht Freiburg HRB 5979\nAbfallwirtschaft und Stadtreinigung Freiburg GmbH – Freiburg im Breisgau",
      "type": "Einreichung neuer Dokumente",
      "state": "Baden-Württemberg",
      "amtsgericht": "Amtsgericht Freiburg",
      "registernummer": "HRB 5979",
      "registerart": "HRB",
      "company_name": "Abfallwirtschaft und Stadtreinigung Freiburg GmbH",
      "company_seat": "Freiburg im Breisgau",
      "details": "04.03.2025 (Bekanntmachungsdatum)\n\nBaden-Württemberg Amtsgericht Freiburg HRB 5979\nEinreichung neuer Dokumente\n\nAbfallwirtschaft und Stadtreinigung Freiburg GmbH\nGesellschaft mit beschränkter Haftung\nFreiburg im Breisgau\n\nDie Gesellschaft hat am 20.02.2025 die Liste über die Zusammensetzung des Aufsichtsrats zum Handelsregister eingereicht."
    },
    {
      "date": "2025-03-04",
      "id": "102827",
      "original_text": "Registerbekanntmachung nach dem Umwandlungsgesetz\nBerlin Amtsgericht Berlin (Charlottenburg) HRB 131215\nHertha BSC Lizenz GmbH – Berlin",
      "type": "Registerbekanntmachung nach dem Umwandlungsgesetz",
      "state": "Berlin",
      "amtsgericht": "Amtsgericht Berlin (Charlottenburg)",
      "registernummer": "HRB 131215",
      "registerart": "HRB",
      "company_name": "Hertha BSC Lizenz GmbH",
      "company_seat": "Berlin",
      "details": "04.03.2025 (Bekanntmachungsdatum)\n\nBerlin Amtsgericht Berlin (Charlottenburg) HRB 131215\nRegisterbekanntmachung nach dem Umwandlungsgesetz 04.03.2025 (Eintragungsdatum)\n\nHertha BSC Lizenz GmbH\nGesellschaft mit beschränkter Haftung\nBerlin\n\nZu Eintragungsnummer 5 vom 04.03.2025 wird als nicht eingetragen veröffentlicht: Den Gläubigern der an der Verschmelzung beteiligten Rechtsträger ist, wenn sie binnen sechs Monaten nach dem Tag, an dem die Eintragung der Verschmelzung in das Register des Sitzes desjenigen Rechtsträgers, dessen Gläubiger sie sind, als bekannt gemacht gilt, ihren Anspruch nach Grund und Höhe schriftlich anmelden, Sicherheit zu leisten, soweit sie nicht Befriedigung verlangen können. Dieses Recht steht den Gläubigern jedoch nur zu, wenn sie glaubhaft machen, dass durch die Verschmelzung die Erfüllung ihrer Forderung gefährdet wird. Das Recht, Sicherheitsleistung zu verlangen, steht Gläubigern nicht zu, die im Falle der Insolvenz ein Recht auf vorzugsweise Befriedigung aus einer Deckungsmasse haben, die nach gesetzlicher Vorschrift zu ihrem Schutz errichtet und staatlich überwacht ist."
    },
    {
      "date": "2025-03-04",
      "id": "102828",
      "original_text": "Registerbekanntmachung nach dem Umwandlungsgesetz\nBerlin Amtsgericht Berlin (Charlottenburg) HRB 93056\nHertha BSC Infrastruktur GmbH – Berlin",
      "type": "Registerbekanntmachung nach dem Umwandlungsgesetz",
      "state": "Berlin",
      "amtsgericht": "Amtsgericht Berlin (Charlottenburg)",
      "registernummer": "HRB 93056",
      "registerart": "HRB",
      "company_name": "Hertha BSC Infrastruktur GmbH",
      "company_seat": "Berlin",
      "details": "04.03.2025 (Bekanntmachungsdatum)\n\nBerlin Amtsgericht Berlin (Charlottenburg) HRB 93056\nRegisterbekanntmachung nach dem Umwandlungsgesetz 03.03.2025 (Eintragungsdatum)\n\nHertha BSC Infrastruktur GmbH\nGesellschaft mit beschränkter Haftung\nBerlin\n\nZu Eintragungsnummer 8 vom 03.03.2025 wird als nicht eingetragen veröffentlicht: Den Gläubigern der an der Verschmelzung beteiligten Rechtsträger ist, wenn sie binnen sechs Monaten nach dem Tag, an dem die Eintragung der Verschmelzung in das Register des Sitzes desjenigen Rechtsträgers, dessen Gläubiger sie sind, als bekannt gemacht gilt, ihren Anspruch nach Grund und Höhe schriftlich anmelden, Sicherheit zu leisten, soweit sie nicht Befriedigung verlangen können. Dieses Recht steht den Gläubigern jedoch nur zu, wenn sie glaubhaft machen, dass durch die Verschmelzung die Erfüllung ihrer Forderung gefährdet wird. Das Recht, Sicherheitsleistung zu verlangen, steht Gläubigern nicht zu, die im Falle der Insolvenz ein Recht auf vorzugsweise Befriedigung aus einer Deckungsmasse haben, die nach gesetzlicher Vorschrift zu ihrem Schutz errichtet und staatlich überwacht ist."
    },
    {
      "date": "2025-03-04",
      "id": "102829",
      "original_text": "Löschungsankündigung\nSachsen Amtsgericht Dresden HRB 11952\nHorst Uhlig Grundstückgesellschaft mbH – Dresden",
      "type": "Löschungsankündigung",
      "state": "Sachsen",
      "amtsgericht": "Amtsgericht Dresden",
      "registernummer": "HRB 11952",
      "registerart": "HRB",
      "company_name": "Horst Uhlig Grundstückgesellschaft mbH",
      "company_seat": "Dresden",
      "details": "04.03.2025 (Bekanntmachungsdatum)\n\nSachsen Amtsgericht Dresden HRB 11952\nLöschungsankündigung\n\nHorst Uhlig Grundstückgesellschaft mbH\nGesellschaft mit beschränkter Haftung\nDresden\n\nDas Registergericht beabsichtigt, die im Handelsregister eingetragene Gesellschaft von Amts wegen nach § 394 FamFG zu löschen. Die Frist zu Erhebung eines Widerspruchs gegen die beabsichtigte Löschung wird auf einen Monat festgesetzt."
    },
    {
      "date": "2025-03-04",
      "id": "102830",
      "original_text": "Löschungsankündigung\nSachsen Amtsgericht Chemnitz HRB 27721\nDer grüne Drache Unternehmensberatungs GmbH – Reichenbach im Vogtland",
      "type": "Löschungsankündigung",
      "state": "Sachsen",
      "amtsgericht": "Amtsgericht Chemnitz",
      "registernummer": "HRB 27721",
      "registerart": "HRB",
      "company_name": "Der grüne Drache Unternehmensberatungs GmbH",
      "company_seat": "Reichenbach im Vogtland",
      "details": "04.03.2025 (Bekanntmachungsdatum)\n\nSachsen Amtsgericht Chemnitz HRB 27721\nLöschungsankündigung\n\nDer grüne Drache Unternehmensberatungs GmbH\nGesellschaft mit beschränkter Haftung\nReichenbach im Vogtland\n\nDas Registergericht beabsichtigt, die im Handelsregister eingetragene Gesellschaft von Amts wegen nach § 394 FamFG zu löschen. Die Frist zu Erhebung eines Widerspruchs gegen die beabsichtigte Löschung wird auf einen Monat festgesetzt."
    },
    {
      "date": "2025-03-04",
      "id": "102831",
      "original_text": "Registerbekanntmachung nach dem Umwandlungsgesetz\nNiedersachsen Amtsgericht Hannover HRB 208192\nskinXpert GmbH – Hannover",
      "type": "Registerbekanntmachung nach dem Umwandlungsgesetz",
      "state": "Niedersachsen",
      "amtsgericht": "Amtsgericht Hannover",
      "registernummer": "HRB 208192",
      "registerart": "HRB",
      "company_name": "skinXpert GmbH",
      "company_seat": "Hannover",
      "details": "04.03.2025 (Bekanntmachungsdatum)\n\nNiedersachsen Amtsgericht Hannover HRB 208192\nRegisterbekanntmachung nach dem Umwandlungsgesetz 04.03.2025 (Eintragungsdatum)\n\nskinXpert GmbH\nGesellschaft mit beschränkter Haftung\nHannover\n\nDen Gläubigern der an der Verschmelzung beteiligten Rechtsträger ist, wenn sie binnen sechs Monaten nach dem Tag, an dem die Eintragung der Verschmelzung in das Register des Sitzes desjenigen Rechtsträgers, dessen Gläubiger sie sind, nach § 19  Abs.  3 UmwG als bekannt gemacht gilt, ihren Anspruch nach Grund und Höhe schriftlich anmelden, Sicherheit zu leisten, soweit sie nicht Befriedigung verlangen können. Dieses Recht steht den Gläubigern jedoch nur zu, wenn sie glaubhaft machen, dass durch die Verschmelzung die Erfüllung der Forderung gefährdet wird."
    },
    {
      "date": "2025-03-04",
      "id": "102832",
      "original_text": "Registerbekanntmachung nach dem Umwandlungsgesetz\nNiedersachsen Amtsgericht Osnabrück VR 1822\nSpielmannszug Osnabrück-Haste e.V. – Osnabrück",
      "type": "Registerbekanntmachung nach dem Umwandlungsgesetz",
      "state": "Niedersachsen",
      "amtsgericht": "Amtsgericht Osnabrück",
      "registernummer": "VR 1822",
      "registerart": "VR",
      "company_name": "Spielmannszug Osnabrück-Haste e.V.",
      "company_seat": "Osnabrück",
      "details": "04.03.2025 (Bekanntmachungsdatum)\n\nNiedersachsen Amtsgericht Osnabrück VR 1822\nRegisterbekanntmachung nach dem Umwandlungsgesetz 04.03.2025 (Eintragungsdatum)\n\nSpielmannszug Osnabrück-Haste e.V.\neingetragener Verein\nOsnabrück\n\nDen Gläubigern der an der Verschmelzung beteiligten Rechtsträger ist, wenn sie binnen sechs Monaten nach dem Tag, an dem die Eintragung der Verschmelzung in das Register des Sitzes desjenigen Rechtsträgers, dessen Gläubiger sie sind, nach § 19  Abs.  3 UmwG als bekannt gemacht gilt, ihren Anspruch nach Grund und Höhe schriftlich anmelden, Sicherheit zu leisten, soweit sie nicht Befriedigung verlangen können. Dieses Recht steht den Gläubigern jedoch nur zu, wenn sie glaubhaft machen, dass durch die Verschmelzung die Erfüllung der Forderung gefährdet wird."
    },
    {
      "date": "2025-03-04",
      "id": "102833",
      "original_text": "Löschungsankündigung\nNiedersachsen Amtsgericht Osnabrück HRB 209913\nCamos UG (haftungsbeschränkt) – Osnabrück",
      "type": "Löschungsankündigung",
      "state": "Niedersachsen",
      "amtsgericht": "Amtsgericht Osnabrück",
      "registernummer": "HRB 209913",
      "registerart": "HRB",
      "company_name": "Camos UG (haftungsbeschränkt)",
      "company_seat": "Osnabrück",
      "details": "04.03.2025 (Bekanntmachungsdatum)\n\nNiedersachsen Amtsgericht Osnabrück HRB 209913\nLöschungsankündigung\n\nCamos UG (haftungsbeschränkt)\nGesellschaft mit beschränkter Haftung\nOsnabrück\n\nDas Registergericht beabsichtigt, die Gesellschaft von Amts wegen nach § 394 FamFG wegen Vermögenslosigkeit zu löschen. Die Frist zur Erhebung eines Widerspruchs ist auf 1 Monat ab dieser Registerbekanntmachung festgesetzt."
    },
    {
      "date": "2025-03-04",
      "id": "102834",
      "original_text": "Löschungsankündigung\nNiedersachsen Amtsgericht Braunschweig HRB 206328\nMama`s Diner UG (haftungsbeschränkt) – Braunschweig",
      "type": "Löschungsankündigung",
      "state": "Niedersachsen",
      "amtsgericht": "Amtsgericht Braunschweig",
      "registernummer": "HRB 206328",
      "registerart": "HRB",
      "company_name": "Mama`s Diner UG (haftungsbeschränkt)",
      "company_seat": "Braunschweig",
      "details": "04.03.2025 (Bekanntmachungsdatum)\n\nNiedersachsen Amtsgericht Braunschweig HRB 206328\nLöschungsankündigung\n\nMama`s Diner UG (haftungsbeschränkt)\nGesellschaft mit beschränkter Haftung\nBraunschweig\n\nDas Registergericht beabsichtigt, die Gesellschaft von Amts wegen nach § 394 FamFG zu löschen. Die Frist zur Erhebung eines Widerspruchs ist auf 1 Monat ab dieser Registerbekanntmachung festgesetzt."
    },
    {
      "date": "2025-03-04",
      "id": "102835",
      "original_text": "Löschungsankündigung\nNiedersachsen Amtsgericht Osnabrück HRB 219696\nZahid Masalci Transporte UG (haftungsbeschränkt) – Melle",
      "type": "Löschungsankündigung",
      "state": "Niedersachsen",
      "amtsgericht": "Amtsgericht Osnabrück",
      "registernummer": "HRB 219696",
      "registerart": "HRB",
      "company_name": "Zahid Masalci Transporte UG (haftungsbeschränkt)",
      "company_seat": "Melle",
      "details": "04.03.2025 (Bekanntmachungsdatum)\n\nNiedersachsen Amtsgericht Osnabrück HRB 219696\nLöschungsankündigung\n\nZahid Masalci Transporte UG (haftungsbeschränkt)\nGesellschaft mit beschränkter Haftung\nMelle\n\nDas Registergericht beabsichtigt, die Gesellschaft von Amts wegen nach § 394 FamFG wegen Vermögenslosigkeit zu löschen. Die Frist zur Erhebung eines Widerspruchs ist auf 1 Monat ab dieser Registerbekanntmachung festgesetzt."
    },
    {
      "date": "2025-03-04",
      "id": "102836",
      "original_text": "Registerbekanntmachung nach dem Umwandlungsgesetz\nNiedersachsen Amtsgericht Osnabrück VR 1852\nSpielmannszug Hollage von 1956 e. V. – Wallenhorst",
      "type": "Registerbekanntmachung nach dem Umwandlungsgesetz",
      "state": "Niedersachsen",
      "amtsgericht": "Amtsgericht Osnabrück",
      "registernummer": "VR 1852",
      "registerart": "VR",
      "company_name": "Spielmannszug Hollage von 1956 e. V.",
      "company_seat": "Wallenhorst",
      "details": "04.03.2025 (Bekanntmachungsdatum)\n\nNiedersachsen Amtsgericht Osnabrück VR 1852\nRegisterbekanntmachung nach dem Umwandlungsgesetz 04.03.2025 (Eintragungsdatum)\n\nSpielmannszug Hollage von 1956 e. V.\neingetragener Verein\nWallenhorst\n\nDen Gläubigern der an der Verschmelzung beteiligten Rechtsträger ist, wenn sie binnen sechs Monaten nach dem Tag, an dem die Eintragung der Verschmelzung in das Register des Sitzes desjenigen Rechtsträgers, dessen Gläubiger sie sind, nach § 19  Abs.  3 UmwG als bekannt gemacht gilt, ihren Anspruch nach Grund und Höhe schriftlich anmelden, Sicherheit zu leisten, soweit sie nicht Befriedigung verlangen können. Dieses Recht steht den Gläubigern jedoch nur zu, wenn sie glaubhaft machen, dass durch die Verschmelzung die Erfüllung der Forderung gefährdet wird."
    },
    {
      "date": "2025-03-04",
      "id": "102837",
      "original_text": "Löschungsankündigung\nNiedersachsen Amtsgericht Braunschweig HRB 207692\nAdeg Bau UG (haftungsbeschränkt) – Braunschweig",
      "type": "Löschungsankündigung",
      "state": "Niedersachsen",
      "amtsgericht": "Amtsgericht Braunschweig",
      "registernummer": "HRB 207692",
      "registerart": "HRB",
      "company_name": "Adeg Bau UG (haftungsbeschränkt)",
      "company_seat": "Braunschweig",
      "details": "04.03.2025 (Bekanntmachungsdatum)\n\nNiedersachsen Amtsgericht Braunschweig HRB 207692\nLöschungsankündigung\n\nAdeg Bau UG (haftungsbeschränkt)\nGesellschaft mit beschränkter Haftung\nBraunschweig\n\nDas Registergericht beabsichtigt, die Gesellschaft von Amts wegen nach § 394 FamFG zu löschen. Die Frist zur Erhebung eines Widerspruchs ist auf 1 Monat ab dieser Registerbekanntmachung festgesetzt."
    },
    {
      "date": "2025-03-04",
      "id": "102838",
      "original_text": "Registerbekanntmachung nach dem Umwandlungsgesetz\nNiedersachsen Amtsgericht Hannover HRB 201071\nPodologie und Kosmetik Dr. Stedler GmbH – Hannover",
      "type": "Registerbekanntmachung nach dem Umwandlungsgesetz",
      "state": "Niedersachsen",
      "amtsgericht": "Amtsgericht Hannover",
      "registernummer": "HRB 201071",
      "registerart": "HRB",
      "company_name": "Podologie und Kosmetik Dr. Stedler GmbH",
      "company_seat": "Hannover",
      "details": "04.03.2025 (Bekanntmachungsdatum)\n\nNiedersachsen Amtsgericht Hannover HRB 201071\nRegisterbekanntmachung nach dem Umwandlungsgesetz 04.03.2025 (Eintragungsdatum)\n\nPodologie und Kosmetik Dr. Stedler GmbH\nGesellschaft mit beschränkter Haftung\nHannover\n\nDen Gläubigern der an der Verschmelzung beteiligten Rechtsträger ist, wenn sie binnen sechs Monaten nach dem Tag, an dem die Eintragung der Verschmelzung in das Register des Sitzes desjenigen Rechtsträgers, dessen Gläubiger sie sind, nach § 19  Abs.  3 UmwG als bekannt gemacht gilt, ihren Anspruch nach Grund und Höhe schriftlich anmelden, Sicherheit zu leisten, soweit sie nicht Befriedigung verlangen können. Dieses Recht steht den Gläubigern jedoch nur zu, wenn sie glaubhaft machen, dass durch die Verschmelzung die Erfüllung der Forderung gefährdet wird."
    },
    {
      "date": "2025-03-04",
      "id": "102839",
      "original_text": "Löschungsankündigung\nRheinland-Pfalz Amtsgericht Landau HRB 32738\nNoel Jung GmbH – Rheinzabern",
      "type": "Löschungsankündigung",
      "state": "Rheinland-Pfalz",
      "amtsgericht": "Amtsgericht Landau",
      "registernummer": "HRB 32738",
      "registerart": "HRB",
      "company_name": "Noel Jung GmbH",
      "company_seat": "Rheinzabern",
      "details": "04.03.2025 (Bekanntmachungsdatum)\n\nRheinland-Pfalz Amtsgericht Landau HRB 32738\nLöschungsankündigung\n\nNoel Jung GmbH\nGesellschaft mit beschränkter Haftung\nRheinzabern\n\nDas Registergericht beabsichtigt die Gesellschaft von Amts wegen nach § 394 FamFG zu löschen. Die Frist zur Erhebung eines Widerspruchs ist auf einen Monat festgesetzt."
    },
    {
      "date": "2025-03-04",
      "id": "102840",
      "original_text": "Einreichung neuer Dokumente\nBremen Amtsgericht Bremen HRB 20536\nhmmh multimediahaus AG – Bremen",
      "type": "Einreichung neuer Dokumente",
      "state": "Bremen",
      "amtsgericht": "Amtsgericht Bremen",
      "registernummer": "HRB 20536",
      "registerart": "HRB",
      "company_name": "hmmh multimediahaus AG",
      "company_seat": "Bremen",
      "details": "04.03.2025 (Bekanntmachungsdatum)\n\nBremen Amtsgericht Bremen HRB 20536\nEinreichung neuer Dokumente\n\nhmmh multimediahaus AG\nAktiengesellschaft\nBremen\n\nAls nicht eingetragen wird bekannt gemacht: Liste des Aufsichtsrats wurde eingereicht."
    },
    {
      "date": "2025-03-04",
      "id": "102841",
      "original_text": "Registerbekanntmachung nach dem Umwandlungsgesetz\nBremen Amtsgericht Bremen HRA 30629\nNedis B.V. & Co. KG – Bremen",
      "type": "Registerbekanntmachung nach dem Umwandlungsgesetz",
      "state": "Bremen",
      "amtsgericht": "Amtsgericht Bremen",
      "registernummer": "HRA 30629",
      "registerart": "HRA",
      "company_name": "Nedis B.V. & Co. KG",
      "company_seat": "Bremen",
      "details": "04.03.2025 (Bekanntmachungsdatum)\n\nBremen Amtsgericht Bremen HRA 30629\nRegisterbekanntmachung nach dem Umwandlungsgesetz 27.02.2025 (Eintragungsdatum)\n\nNedis B.V. & Co. KG\nKommanditgesellschaft\nBremen\n\nZu Eintragungsnummer 1 vom 27.02.2025 wird als nicht eingetragen veröffentlicht:  Den Gläubigern ist, wenn sie binnen sechs Monaten nach dem Tag, an dem die Eintragung der Umwandlung als bekannt gemacht gilt, ihren Anspruch nach Grund und Höhe schriftlich anmelden, Sicherheit zu leisten, soweit sie nicht Befriedigung verlangen können. Dieses Recht steht den Gläubigern jedoch nur zu, wenn sie glaubhaft machen, dass durch die Umwandlung die Erfüllung ihrer Forderung gefährdet wird. Das Recht, Sicherheitsleistung zu verlangen, steht Gläubigern nicht zu, die im Falle der Insolvenz ein Recht auf vorzugsweise Befriedigung aus einer Deckungsmasse haben, die nach gesetzlicher Vorschrift zu ihrem Schutz errichtet und staatlich überwacht ist."
    },
    {
      "date": "2025-03-04",
      "id": "102842",
      "original_text": "Einreichung neuer Dokumente\nBremen Amtsgericht Bremen HRB 3204 BHV\nZoo am Meer Bremerhaven GmbH – Bremerhaven",
      "type": "Einreichung neuer Dokumente",
      "state": "Bremen",
      "amtsgericht": "Amtsgericht Bremen",
      "registernummer": "HRB 3204 BHV",
      "registerart": "HRB",
      "company_name": "Zoo am Meer Bremerhaven GmbH",
      "company_seat": "Bremerhaven",
      "details": "04.03.2025 (Bekanntmachungsdatum)\n\nBremen Amtsgericht Bremen HRB 3204 BHV\nEinreichung neuer Dokumente\n\nZoo am Meer Bremerhaven GmbH\nGesellschaft mit beschränkter Haftung\nBremerhaven\n\nAls nicht eingetragen wird bekannt gemacht: Liste des Aufsichtsrats wurde eingereicht."
    },
    {
      "date": "2025-03-04",
      "id": "102843",
      "original_text": "Registerbekanntmachung nach dem Umwandlungsgesetz\nBremen Amtsgericht Bremen HRB 30945\nSouthport Harburg Entwicklungsgesellschaft mbH – Bremen",
      "type": "Registerbekanntmachung nach dem Umwandlungsgesetz",
      "state": "Bremen",
      "amtsgericht": "Amtsgericht Bremen",
      "registernummer": "HRB 30945",
      "registerart": "HRB",
      "company_name": "Southport Harburg Entwicklungsgesellschaft mbH",
      "company_seat": "Bremen",
      "details": "04.03.2025 (Bekanntmachungsdatum)\n\nBremen Amtsgericht Bremen HRB 30945\nRegisterbekanntmachung nach dem Umwandlungsgesetz 26.02.2025 (Eintragungsdatum)\n\nSouthport Harburg Entwicklungsgesellschaft mbH\nGesellschaft mit beschränkter Haftung\nBremen\n\nZu Eintragungsnummer 4 vom 26.02.2025 wird als nicht eingetragen veröffentlicht: Gläubigern, deren Forderungen begründet worden sind, bevor die Eintragung des Beschlusses als nach § 10 des Handelsgesetzbuches bekannt gemacht gilt, ist, wenn sie sich binnen sechs Monaten nach der Bekanntmachung zu diesem Zweck melden, Sicherheit zu leisten, soweit sie nicht Befriedigung verlangen können. Dieses Recht steht den Gläubigern nicht zu, die im Fall des Insolvenzverfahrens ein Recht auf vorzugsweise Befriedigung aus der Deckungsmasse haben, die nach gesetzlicher Vorschrift zu ihrem Schutz errichtet und staatlich überwacht ist."
    },
    {
      "date": "2025-03-04",
      "id": "102844",
      "original_text": "Löschungsankündigung\nBremen Amtsgericht Bremen HRB 33467\nBvL UG (haftungsbeschränkt) – Bremen",
      "type": "Löschungsankündigung",
      "state": "Bremen",
      "amtsgericht": "Amtsgericht Bremen",
      "registernummer": "HRB 33467",
      "registerart": "HRB",
      "company_name": "BvL UG (haftungsbeschränkt)",
      "company_seat": "Bremen",
      "details": "04.03.2025 (Bekanntmachungsdatum)\n\nBremen Amtsgericht Bremen HRB 33467\nLöschungsankündigung\n\nBvL UG (haftungsbeschränkt)\nGesellschaft mit beschränkter Haftung\nBremen\n\nEs ist beabsichtigt die im Handelsregister eingetragene Gesellschaft von Amts wegen gemäß § 394 FamFG zu löschen. Gegen die Löschung kann beim AG Bremen schriftlich oder zu Protokoll der Geschäftsstelle Widerspruch eingelegt werden. Widerspruchsfrist 4 Wochen."
    },
    {
      "date": "2025-03-04",
      "id": "102845",
      "original_text": "Löschungsankündigung\nBremen Amtsgericht Bremen HRB 37749\nPrima Gebäudereinigung GmbH – Bremen",
      "type": "Löschungsankündigung",
      "state": "Bremen",
      "amtsgericht": "Amtsgericht Bremen",
      "registernummer": "HRB 37749",
      "registerart": "HRB",
      "company_name": "Prima Gebäudereinigung GmbH",
      "company_seat": "Bremen",
      "details": "04.03.2025 (Bekanntmachungsdatum)\n\nBremen Amtsgericht Bremen HRB 37749\nLöschungsankündigung\n\nPrima Gebäudereinigung GmbH\nGesellschaft mit beschränkter Haftung\nBremen\n\nEs ist beabsichtigt die im Handelsregister eingetragene Gesellschaft von Amts wegen gemäß § 394 FamFG zu löschen. Gegen die Löschung kann beim AG Bremen schriftlich oder zu Protokoll der Geschäftsstelle Widerspruch eingelegt werden. Widerspruchsfrist 4 Wochen."
    },
    {
      "date": "2025-03-04",
      "id": "102846",
      "original_text": "Registerbekanntmachung nach dem Umwandlungsgesetz\nBremen Amtsgericht Bremen HRB 37545\nNedis GmbH – Bremen",
      "type": "Registerbekanntmachung nach dem Umwandlungsgesetz",
      "state": "Bremen",
      "amtsgericht": "Amtsgericht Bremen",
      "registernummer": "HRB 37545",
      "registerart": "HRB",
      "company_name": "Nedis GmbH",
      "company_seat": "Bremen",
      "details": "04.03.2025 (Bekanntmachungsdatum)\n\nBremen Amtsgericht Bremen HRB 37545\nRegisterbekanntmachung nach dem Umwandlungsgesetz 27.02.2025 (Eintragungsdatum)\n\nNedis GmbH\nGesellschaft mit beschränkter Haftung\nBremen\n\nZu Eintragungsnummer 6 vom 27.02.2025 wird als nicht eingetragen veröffentlicht: Den Gläubigern ist, wenn sie binnen sechs Monaten nach dem Tag, an dem die Eintragung der Umwandlung als bekannt gemacht gilt, ihren Anspruch nach Grund und Höhe schriftlich anmelden, Sicherheit zu leisten, soweit sie nicht Befriedigung verlangen können. Dieses Recht steht den Gläubigern jedoch nur zu, wenn sie glaubhaft machen, dass durch die Umwandlung die Erfüllung ihrer Forderung gefährdet wird. Das Recht, Sicherheitsleistung zu verlangen, steht Gläubigern nicht zu, die im Falle der Insolvenz ein Recht auf vorzugsweise Befriedigung aus einer Deckungsmasse haben, die nach gesetzlicher Vorschrift zu ihrem Schutz errichtet und staatlich überwacht ist."
    },
    {
      "date": "2025-03-04",
      "id": "102847",
      "original_text": "Einreichung neuer Dokumente\nBremen Amtsgericht Bremen HRB 8628\nThermo Fisher Scientific (Bremen) GmbH – Bremen",
      "type": "Einreichung neuer Dokumente",
      "state": "Bremen",
      "amtsgericht": "Amtsgericht Bremen",
      "registernummer": "HRB 8628",
      "registerart": "HRB",
      "company_name": "Thermo Fisher Scientific (Bremen) GmbH",
      "company_seat": "Bremen",
      "details": "04.03.2025 (Bekanntmachungsdatum)\n\nBremen Amtsgericht Bremen HRB 8628\nEinreichung neuer Dokumente\n\nThermo Fisher Scientific (Bremen) GmbH\nGesellschaft mit beschränkter Haftung\nBremen\n\nAls nicht eingetragen wird veröffentlicht: Liste des Aufsichtsrats wurde eingereicht."
    },
    {
      "date": "2025-03-04",
      "id": "102848",
      "original_text": "Löschungsankündigung\nNordrhein-Westfalen Amtsgericht Düsseldorf HRB 90909\nVB20 Studios GmbH – Düsseldorf",
      "type": "Löschungsankündigung",
      "state": "Nordrhein-Westfalen",
      "amtsgericht": "Amtsgericht Düsseldorf",
      "registernummer": "HRB 90909",
      "registerart": "HRB",
      "company_name": "VB20 Studios GmbH",
      "company_seat": "Düsseldorf",
      "details": "04.03.2025 (Bekanntmachungsdatum)\n\nNordrhein-Westfalen Amtsgericht Düsseldorf HRB 90909\nLöschungsankündigung\n\nVB20 Studios GmbH\nGesellschaft mit beschränkter Haftung\nDüsseldorf\n\nEs ist beabsichtigt, die Gesellschaft wegen Vermögenslosigkeit aufgrund § 394 Abs. 1 FamFG zu löschen.\nFrist zur Geltendmachung eines Widerspruchs: 3 Wochen.\n\nRechtsbehelfsbelehrung:\nDas Widerspruchsrecht steht jedem zu, der an der Unterlassung der Löschung ein berechtigtes Interesse hat. Der Widerspruch ist bei dem Amtsgericht Düsseldorf -Registergericht-, Werdener Straße 1, 40227 Düsseldorf schriftlich in deutscher Sprache oder zur Niederschrift der Geschäftsstelle einzulegen. Der Widerspruch kann auch zur Niederschrift der Geschäftsstelle eines jeden Amtsgerichtes abgegeben werden. Die Einlegung ist auch durch Übertragung eines elektronischen Dokuments an die elektronische Poststelle des Gerichts möglich. Das elektronische Dokument muss für die Bearbeitung durch das Gericht geeignet und mit einer qualifizierten elektronischen Signatur der verantwortenden Person versehen sein oder von der verantwortenden Person signiert und auf einem sicheren Übermittlungsweg gemäß § 130a ZPO nach näherer Maßgabe der Verordnung über die technischen Rahmenbedingungen des elektronischen Rechtsverkehrs und über das besondere elektronische Behördenpostfach (BGBl. I, S.3803) eingereicht werden. Weitere Informationen erhalten Sie auf der Internetseite www.justiz.de.\nDer Widerspruch muss spätestens innerhalb der gesetzten Frist nach dem Datum der Bekanntmachung der Löschungsankündigung bei dem Amtsgericht - Registergericht - Düsseldorf eingegangen sein.  Dies gilt auch dann, wenn der Widerspruch zur Niederschrift der Geschäftsstelle eines anderen Amtsgerichtes abgegeben wurde. Die Frist beginnt mit dem Tage der Bekanntmachung der Löschungsankündigung in dem für die Bekanntmachung der Eintragungen in das Handelsregister bestimmten elektronischen Informations- und Kommunikationssystem nach § 10 des Handelsgesetzbuches. Fällt das Ende der Frist auf einen Sonntag, einen allgemeinen Feiertag oder Sonnabend, so endet die Frist mit Ablauf des nächsten Werktages.\nDer Widerspruch muss die Bezeichnung der angefochtenen Löschungsankündigung sowie die Erklärung enthalten, dass Widerspruch gegen diese Löschungsankündigung eingelegt wird. Er ist zu unterzeichnen und soll begründet werden."
    },
    {
      "date": "2025-03-04",
      "id": "102849",
      "original_text": "Löschungsankündigung\nNordrhein-Westfalen Amtsgericht Siegen HRA 4473\nDipl .-Ing. Friedrich Horchler GmbH & Co. Kommanditgesellschaft – Freudenberg",
      "type": "Löschungsankündigung",
      "state": "Nordrhein-Westfalen",
      "amtsgericht": "Amtsgericht Siegen",
      "registernummer": "HRA 4473",
      "registerart": "HRA",
      "company_name": "Dipl .-Ing. Friedrich Horchler GmbH & Co. Kommanditgesellschaft",
      "company_seat": "Freudenberg",
      "details": "04.03.2025 (Bekanntmachungsdatum)\n\nNordrhein-Westfalen Amtsgericht Siegen HRA 4473\nLöschungsankündigung\n\nDipl .-Ing. Friedrich Horchler GmbH & Co. Kommanditgesellschaft\nKommanditgesellschaft\nFreudenberg\n\nDas Registergericht beabsichtigt die Firma von Amts wegen nach § 394 FamFG zu löschen. Die Frist zur Erhebung eines Widerspruchs ist auf einen Monat festgesetzt."
    },
    {
      "date": "2025-03-04",
      "id": "102850",
      "original_text": "Einreichung neuer Dokumente\nNordrhein-Westfalen Amtsgericht Köln HRB 43262\nGWG Wohnungsgesellschaft mit beschränkter Haftung Rhein-Erft – Hürth",
      "type": "Einreichung neuer Dokumente",
      "state": "Nordrhein-Westfalen",
      "amtsgericht": "Amtsgericht Köln",
      "registernummer": "HRB 43262",
      "registerart": "HRB",
      "company_name": "GWG Wohnungsgesellschaft mit beschränkter Haftung Rhein-Erft",
      "company_seat": "Hürth",
      "details": "04.03.2025 (Bekanntmachungsdatum)\n\nNordrhein-Westfalen Amtsgericht Köln HRB 43262\nEinreichung neuer Dokumente\n\nGWG Wohnungsgesellschaft mit beschränkter Haftung Rhein-Erft\nGesellschaft mit beschränkter Haftung\nHürth\n\nDem Registergericht ist eine Liste der Mitglieder des Aufsichtsrates eingereicht worden."
    },
    {
      "date": "2025-03-04",
      "id": "102851",
      "original_text": "Löschungsankündigung\nNordrhein-Westfalen Amtsgericht Aachen HRB 23097\niTOXX Services UG (haftungsbeschränkt) – Aachen",
      "type": "Löschungsankündigung",
      "state": "Nordrhein-Westfalen",
      "amtsgericht": "Amtsgericht Aachen",
      "registernummer": "HRB 23097",
      "registerart": "HRB",
      "company_name": "iTOXX Services UG (haftungsbeschränkt)",
      "company_seat": "Aachen",
      "details": "04.03.2025 (Bekanntmachungsdatum)\n\nNordrhein-Westfalen Amtsgericht Aachen HRB 23097\nLöschungsankündigung\n\niTOXX Services UG (haftungsbeschränkt)\nGesellschaft mit beschränkter Haftung\nAachen\n\nDas Registergericht beabsichtigt, von Amts wegen die Gesellschaft wegen Vermögenslosigkeit nach § 394 FamFG zu löschen,  weil das Finanzamt Aachen-Stadt           mit Schreiben vom 17.02.2025 Umstände mitgeteilt hat, aufgrund derer das Gericht davon überzeugt ist, dass die Gesellschaft vollständig vermögenslos ist. Zur Geltendmachung des Widerspruchs gegen die beabsichtigte Löschung wird hiermit eine Frist von einem Monat ab Veröffentlichung dieser Ankündigung bestimmt. Rechtsbehelfsbelehrung:  Gegen diese Verfügung kann Widerspruch eingelegt werden. Zum Widerspruch ist jeder berechtigt, der an der Unterlassung der Löschung ein berechtigtes Interesse hat. Der Widerspruch ist bei dem Amtsgericht Aachen, Adalbertsteinweg 92, 52070 Aachen schriftlich in deutscher Sprache oder zur Niederschrift der Geschäftsstelle einzulegen. Der Widerspruch kann auch zur Niederschrift der Geschäftsstelle eines jeden Amtsgerichtes abgegeben werden. Der Widerspruch muss spätestens innerhalb der gesetzten Frist nach der Bekanntgabe der Verfügung bei dem Amtsgericht Aachen eingegangen sein. Dies gilt auch dann, wenn der Widerspruch zur Niederschrift der Geschäftsstelle eines anderen Amtsgerichtes abgegeben wurde. Die Frist beginnt mit der Bekanntgabe der Verfügung durch Veröffentlichung. Fällt das Ende der Frist auf einen Sonntag, einen allgemeinen Feiertag oder Sonnabend, so endet die Frist mit Ablauf des nächsten Werktages.  Der Widerspruch muss die Bezeichnung der angefochtenen Verfügung sowie die Erklärung enthalten, dass Widerspruch gegen diese Verfügung eingelegt wird. Er ist zu unterzeichnen und soll begründet werden. Die Einlegung ist auch durch Übertragung eines elektronischen Dokuments an die elektronische Poststelle des Gerichts möglich. Das elektronische Dokument muss für die Bearbeitung durch das Gericht geeignet und mit einer qualifizierten elektronischen Signatur der verantwortenden Person versehen sein oder von der verantwortenden Person signiert und auf einem sicheren Übermittlungsweg gemäß § 130 a ZPO nach näherer Maßgabe der Verordnung über die technischen Rahmenbedingungen des elektronischen Rechtsverkehrs und über das besondere elektronische Behördenpostfach (BGBl. I, S. 3803) eingereicht werden. Weitere Informationen erhalten Sie auf der Internetseite www.justiz.de."
    },
    {
      "date": "2025-03-04",
      "id": "102852",
      "original_text": "Registerbekanntmachung nach dem Umwandlungsgesetz\nNordrhein-Westfalen Amtsgericht Köln HRA 37756\nTaylan Günaydin Industries e.K. – Leverkusen",
      "type": "Registerbekanntmachung nach dem Umwandlungsgesetz",
      "state": "Nordrhein-Westfalen",
      "amtsgericht": "Amtsgericht Köln",
      "registernummer": "HRA 37756",
      "registerart": "HRA",
      "company_name": "Taylan Günaydin Industries e.K.",
      "company_seat": "Leverkusen",
      "details": "04.03.2025 (Bekanntmachungsdatum)\n\nNordrhein-Westfalen Amtsgericht Köln HRA 37756\nRegisterbekanntmachung nach dem Umwandlungsgesetz 04.03.2025 (Eintragungsdatum)\n\nTaylan Günaydin Industries e.K.\nEinzelkaufmann / Einzelkauffrau\nLeverkusen\n\nDen Gläubigern der an der Ausgliederung beteiligten Rechtsträger ist, wenn sie binnen sechs Monaten nach dem Tag, an dem die Eintragung der Ausgliederung in das Register des Sitzes desjenigen Rechtsträgers, dessen Gläubiger sie sind, nach § 19 Absatz 3 UmwG als bekanntgemacht gilt, ihren Anspruch nach Grund und Höhe schriftlich anmelden, Sicherheit zu leisten, soweit sie nicht Befriedigung verlangen können. Dieses Recht steht den Gläubigern jedoch nur zu, wenn sie glaubhaft machen, dass durch die Ausgliederung die Erfüllung ihrer Forderung gefährdet wird."
    },
    {
      "date": "2025-03-04",
      "id": "102853",
      "original_text": "Registerbekanntmachung nach dem Umwandlungsgesetz\nNordrhein-Westfalen Amtsgericht Duisburg HRB 37923\nLinara Oberhausen GmbH – Oberhausen",
      "type": "Registerbekanntmachung nach dem Umwandlungsgesetz",
      "state": "Nordrhein-Westfalen",
      "amtsgericht": "Amtsgericht Duisburg",
      "registernummer": "HRB 37923",
      "registerart": "HRB",
      "company_name": "Linara Oberhausen GmbH",
      "company_seat": "Oberhausen",
      "details": "04.03.2025 (Bekanntmachungsdatum)\n\nNordrhein-Westfalen Amtsgericht Duisburg HRB 37923\nRegisterbekanntmachung nach dem Umwandlungsgesetz 04.03.2025 (Eintragungsdatum)\n\nLinara Oberhausen GmbH\nGesellschaft mit beschränkter Haftung\nOberhausen\n\nDie Gesellschaft hat Gläubigern, deren Forderungen vor dieser Bekanntmachung begründet worden sind, Sicherheit zu leisten, soweit sie nicht Befriedigung verlangen können, wenn sie sich binnen sechs Monaten zu diesem Zweck melden."
    },
    {
      "date": "2025-03-04",
      "id": "102854",
      "original_text": "Registerbekanntmachung nach dem Umwandlungsgesetz\nNordrhein-Westfalen Amtsgericht Dortmund HRB 37004\nCAMTEC Stecksysteme GmbH – Werne",
      "type": "Registerbekanntmachung nach dem Umwandlungsgesetz",
      "state": "Nordrhein-Westfalen",
      "amtsgericht": "Amtsgericht Dortmund",
      "registernummer": "HRB 37004",
      "registerart": "HRB",
      "company_name": "CAMTEC Stecksysteme GmbH",
      "company_seat": "Werne",
      "details": "04.03.2025 (Bekanntmachungsdatum)\n\nNordrhein-Westfalen Amtsgericht Dortmund HRB 37004\nRegisterbekanntmachung nach dem Umwandlungsgesetz 04.03.2025 (Eintragungsdatum)\n\nCAMTEC Stecksysteme GmbH\nGesellschaft mit beschränkter Haftung\nWerne\n\nDen Gläubigern der an der Ausgliederung beteiligten Rechtsträger ist, wenn sie binnen sechs Monaten nach dem Tag, an dem die Eintragung der Ausgliederung in das Register des Sitzes desjenigen Rechtsträgers, dessen Gläubiger sie sind, nach § 19 Absatz 3 UmwG als bekanntgemacht gilt, ihren Anspruch nach Grund und Höhe schriftlich anmelden, Sicherheit zu leisten, soweit sie nicht Befriedigung verlangen können. Dieses Recht steht den Gläubigern jedoch nur zu, wenn sie glaubhaft machen, dass durch die Ausgliederung die Erfüllung ihrer Forderung gefährdet wird."
    },
    {
      "date": "2025-03-04",
      "id": "102855",
      "original_text": "Registerbekanntmachung nach dem Umwandlungsgesetz\nNordrhein-Westfalen Amtsgericht Köln HRB 122378\nTayotec Industries GmbH – Leverkusen",
      "type": "Registerbekanntmachung nach dem Umwandlungsgesetz",
      "state": "Nordrhein-Westfalen",
      "amtsgericht": "Amtsgericht Köln",
      "registernummer": "HRB 122378",
      "registerart": "HRB",
      "company_name": "Tayotec Industries GmbH",
      "company_seat": "Leverkusen",
      "details": "04.03.2025 (Bekanntmachungsdatum)\n\nNordrhein-Westfalen Amtsgericht Köln HRB 122378\nRegisterbekanntmachung nach dem Umwandlungsgesetz 04.03.2025 (Eintragungsdatum)\n\nTayotec Industries GmbH\nGesellschaft mit beschränkter Haftung\nLeverkusen\n\nDen Gläubigern der an der Ausgliederung beteiligten Rechtsträger ist, wenn sie binnen sechs Monaten nach dem Tag, an dem die Eintragung der Ausgliederung in das Register des Sitzes desjenigen Rechtsträgers, dessen Gläubiger sie sind, nach § 19 Absatz 3 UmwG als bekanntgemacht gilt, ihren Anspruch nach Grund und Höhe schriftlich anmelden, Sicherheit zu leisten, soweit sie nicht Befriedigung verlangen können. Dieses Recht steht den Gläubigern jedoch nur zu, wenn sie glaubhaft machen, dass durch die Ausgliederung die Erfüllung ihrer Forderung gefährdet wird."
    },
    {
      "date": "2025-03-04",
      "id": "102856",
      "original_text": "Sonstige Registerbekanntmachung\nNordrhein-Westfalen Amtsgericht Paderborn HRB 12895\nVoltabox AG – Paderborn",
      "type": "Sonstige Registerbekanntmachung",
      "state": "Nordrhein-Westfalen",
      "amtsgericht": "Amtsgericht Paderborn",
      "registernummer": "HRB 12895",
      "registerart": "HRB",
      "company_name": "Voltabox AG",
      "company_seat": "Paderborn",
      "details": "04.03.2025 (Bekanntmachungsdatum)\n\nNordrhein-Westfalen Amtsgericht Paderborn HRB 12895\nSonstige Registerbekanntmachung 24.02.2025 (Eintragungsdatum)\n\nVoltabox AG\nAktiengesellschaft\nPaderborn\n\nDem Registergericht ist eine Liste der Mitglieder des Aufsichtsrates eingereicht worden."
    },
    {
      "date": "2025-03-04",
      "id": "102857",
      "original_text": "Registerbekanntmachung nach dem Umwandlungsgesetz\nNordrhein-Westfalen Amtsgericht Köln HRB 81207\nMTH Holding GmbH – Wiehl",
      "type": "Registerbekanntmachung nach dem Umwandlungsgesetz",
      "state": "Nordrhein-Westfalen",
      "amtsgericht": "Amtsgericht Köln",
      "registernummer": "HRB 81207",
      "registerart": "HRB",
      "company_name": "MTH Holding GmbH",
      "company_seat": "Wiehl",
      "details": "04.03.2025 (Bekanntmachungsdatum)\n\nNordrhein-Westfalen Amtsgericht Köln HRB 81207\nRegisterbekanntmachung nach dem Umwandlungsgesetz 04.03.2025 (Eintragungsdatum)\n\nMTH Holding GmbH\nGesellschaft mit beschränkter Haftung\nWiehl\n\nDen Gläubigern der an der Verschmelzung beteiligten Rechtsträger ist, wenn sie binnen sechs Monaten nach dem Tag, an dem die Eintragung der Verschmelzung in das Register des Sitzes desjenigen Rechtsträgers, dessen Gläubiger sie sind, nach § 19 Absatz 3 UmwG als bekanntgemacht gilt, ihren Anspruch nach Grund und Höhe schriftlich anmelden, Sicherheit zu leisten, soweit sie nicht Befriedigung verlangen können. Dieses Recht steht den Gläubigern jedoch nur zu, wenn sie glaubhaft machen, dass durch die Verschmelzung die Erfüllung ihrer Forderung gefährdet wird."
    },
    {
      "date": "2025-03-04",
      "id": "102858",
      "original_text": "Löschungsankündigung\nNordrhein-Westfalen Amtsgericht Düsseldorf HRA 21378\n5 AIRES GmbH & Co. KG – Düsseldorf",
      "type": "Löschungsankündigung",
      "state": "Nordrhein-Westfalen",
      "amtsgericht": "Amtsgericht Düsseldorf",
      "registernummer": "HRA 21378",
      "registerart": "HRA",
      "company_name": "5 AIRES GmbH & Co. KG",
      "company_seat": "Düsseldorf",
      "details": "04.03.2025 (Bekanntmachungsdatum)\n\nNordrhein-Westfalen Amtsgericht Düsseldorf HRA 21378\nLöschungsankündigung\n\n5 AIRES GmbH & Co. KG\nKommanditgesellschaft\nDüsseldorf\n\nEs ist beabsichtigt, die Gesellschaft wegen Vermögenslosigkeit aufgrund des § 394 Abs. 4 FamFG zu löschen, da offenbar keine Vermögenswerte mehr vorhanden sind und bereits die persönlich haftende Gesellschafterin wegen Vermögenslosigkeit gelöscht worden ist.\nFrist zur Geltendmachung eines Widerspruchs: 1 Monat.\n\nRechtsbehelfsbelehrung:\nDas Widerspruchsrecht steht jedem zu, der an der Unterlassung der Löschung ein berechtigtes Interesse hat. Der Widerspruch ist bei dem Amtsgericht Düsseldorf -Registergericht-, Werdener Straße 1, 40227 Düsseldorf schriftlich in deutscher Sprache oder zur Niederschrift der Geschäftsstelle einzulegen. Der Widerspruch kann auch zur Niederschrift der Geschäftsstelle eines jeden Amtsgerichtes abgegeben werden. Die Einlegung ist auch durch Übertragung eines elektronischen Dokuments an die elektronische Poststelle des Gerichts möglich. Das elektronische Dokument muss für die Bearbeitung durch das Gericht geeignet und mit einer qualifizierten elektronischen Signatur der verantwortenden Person versehen sein oder von der verantwortenden Person signiert und auf einem sicheren Übermittlungsweg gemäß § 130a ZPO nach näherer Maßgabe der Verordnung über die technischen Rahmenbedingungen des elektronischen Rechtsverkehrs und über das besondere elektronische Behördenpostfach (BGBl. I, S.3803) eingereicht werden. Weitere Informationen erhalten Sie auf der Internetseite www.justiz.de.\nDer Widerspruch muss spätestens innerhalb der gesetzten Frist nach dem Datum der Bekanntmachung der Löschungsankündigung bei dem Amtsgericht - Registergericht - Düsseldorf eingegangen sein.  Dies gilt auch dann, wenn der Widerspruch zur Niederschrift der Geschäftsstelle eines anderen Amtsgerichtes abgegeben wurde. Die Frist beginnt mit dem Tage der Bekanntmachung der Löschungsankündigung in dem für die Bekanntmachung der Eintragungen in das Handelsregister bestimmten elektronischen Informations- und Kommunikationssystem nach § 10 des Handelsgesetzbuches. Fällt das Ende der Frist auf einen Sonntag, einen allgemeinen Feiertag oder Sonnabend, so endet die Frist mit Ablauf des nächsten Werktages.\nDer Widerspruch muss die Bezeichnung der angefochtenen Löschungsankündigung sowie die Erklärung enthalten, dass Widerspruch gegen diese Löschungsankündigung eingelegt wird. Er ist zu unterzeichnen und soll begründet werden."
    },
    {
      "date": "2025-03-04",
      "id": "102859",
      "original_text": "Sonstige Registerbekanntmachung\nNordrhein-Westfalen Amtsgericht Siegburg HRB 458\nRhein-Sieg-Verkehrsgesellschaft mbH – Troisdorf",
      "type": "Sonstige Registerbekanntmachung",
      "state": "Nordrhein-Westfalen",
      "amtsgericht": "Amtsgericht Siegburg",
      "registernummer": "HRB 458",
      "registerart": "HRB",
      "company_name": "Rhein-Sieg-Verkehrsgesellschaft mbH",
      "company_seat": "Troisdorf",
      "details": "04.03.2025 (Bekanntmachungsdatum)\n\nNordrhein-Westfalen Amtsgericht Siegburg HRB 458\nSonstige Registerbekanntmachung\n\nRhein-Sieg-Verkehrsgesellschaft mbH\nGesellschaft mit beschränkter Haftung\nTroisdorf\n\nDem Registergericht ist eine neue Liste der Mitglieder des Aufsichtsrates eingereicht worden."
    },
    {
      "date": "2025-03-04",
      "id": "102860",
      "original_text": "Löschungsankündigung\nNordrhein-Westfalen Amtsgericht Siegburg HRB 8392\nHebat Verwaltungsgesellschaft mbH – Bad Honnef",
      "type": "Löschungsankündigung",
      "state": "Nordrhein-Westfalen",
      "amtsgericht": "Amtsgericht Siegburg",
      "registernummer": "HRB 8392",
      "registerart": "HRB",
      "company_name": "Hebat Verwaltungsgesellschaft mbH",
      "company_seat": "Bad Honnef",
      "details": "04.03.2025 (Bekanntmachungsdatum)\n\nNordrhein-Westfalen Amtsgericht Siegburg HRB 8392\nLöschungsankündigung\n\nHebat Verwaltungsgesellschaft mbH\nGesellschaft mit beschränkter Haftung\nBad Honnef\n\nDas Registergericht hat glaubhafte Kenntnis erlangt, dass die Gesellschaft vermögenslos geworden ist, da Zwangsvollstreckungsmaßnahmen des Finanzamtes Sankt Augustin erfolglos geblieben sind.\n\nEs ist daher beabsichtigt, die Gesellschaft nach § 394 FamFG im Handelsregister wegen Vermögenslosigkeit zu löschen.\n\nEinwände gegen die Löschung sind durch Widerspruch binnen einer Frist von 3 Monaten geltend zu machen, andernfalls die Löschung erfolgen wird.\n\nEinzulegen ist der Widerspruch bei dem Amtsgericht Siegburg, Neue Poststraße 16, 53721 Siegburg, und zwar entweder schriftlich in deutscher Sprache oder mündlich zur Niederschrift der Geschäftsstelle. Der Widerspruch kann auch zur Niederschrift der Geschäftsstelle eines jeden Amtsgerichts abgegeben werden. Der Widerspruch ist binnen der in der Verfügung bestimmten Frist einzulegen. Die Frist ist nur gewahrt, wenn der Widerspruch rechtzeitig bei dem Amtsgericht Siegburg eingeht, auch wenn der Widerspruch zur Niederschrift der Geschäftsstelle eines anderen Amtsgerichts abgegeben wurde. Die Frist beginnt jeweils mit der schriftlichen Bekanntgabe der Verfügung an die Beteiligten. Kann die schriftliche Bekanntgabe an einen Beteiligten nicht bewirkt werden, beginnt die Frist spätestens mit Ablauf von fünf Monaten nach Erlass der Verfügung. Die Bekanntgabe ist entweder durch Zustellung oder am dritten Tage nach Aufgabe zur Post bewirkt. Sofern die Löschung noch nicht erfolgt ist, kann der Widerspruch auch noch nach Ablauf der Frist eingelegt werden. Fällt das Ende der Frist auf einen Sonnabend, einen Sonntag oder einen allgemeinen Feiertag, endet die Frist mit Ablauf des nächsten Werktages. Der Widerspruch ist zu unterzeichnen. Eine Begründung des Widerspruchs ist nicht vorgeschrieben."
    },
    {
      "date": "2025-03-04",
      "id": "102861",
      "original_text": "Löschungsankündigung\nNordrhein-Westfalen Amtsgericht Dortmund HRB 24349\nMein PflegeService GmbH – Dortmund",
      "type": "Löschungsankündigung",
      "state": "Nordrhein-Westfalen",
      "amtsgericht": "Amtsgericht Dortmund",
      "registernummer": "HRB 24349",
      "registerart": "HRB",
      "company_name": "Mein PflegeService GmbH",
      "company_seat": "Dortmund",
      "details": "04.03.2025 (Bekanntmachungsdatum)\n\nNordrhein-Westfalen Amtsgericht Dortmund HRB 24349\nLöschungsankündigung\n\nMein PflegeService GmbH\nGesellschaft mit beschränkter Haftung\nDortmund\n\nDas Registergericht beabsichtigt die Gesellschaft von Amts wegen nach § 394 FamFG zu löschen. Die Frist zur Erhebung eines Widerspruchs ist auf zwei Monate festgesetzt."
    },
    {
      "date": "2025-03-04",
      "id": "102862",
      "original_text": "Einreichung neuer Dokumente\nNordrhein-Westfalen Amtsgericht Gütersloh HRB 6882\nBaxter Oncology GmbH – Halle",
      "type": "Einreichung neuer Dokumente",
      "state": "Nordrhein-Westfalen",
      "amtsgericht": "Amtsgericht Gütersloh",
      "registernummer": "HRB 6882",
      "registerart": "HRB",
      "company_name": "Baxter Oncology GmbH",
      "company_seat": "Halle",
      "details": "04.03.2025 (Bekanntmachungsdatum)\n\nNordrhein-Westfalen Amtsgericht Gütersloh HRB 6882\nEinreichung neuer Dokumente\n\nBaxter Oncology GmbH\nGesellschaft mit beschränkter Haftung\nHalle\n\nDem Registergericht ist eine neue Liste der Mitglieder des Aufsichtsrates eingereicht worden."
    },
    {
      "date": "2025-03-04",
      "id": "102863",
      "original_text": "Löschungsankündigung\nNordrhein-Westfalen Amtsgericht Siegen HRB 9148\nQuaas Beteiligungs-GmbH – Kreuztal",
      "type": "Löschungsankündigung",
      "state": "Nordrhein-Westfalen",
      "amtsgericht": "Amtsgericht Siegen",
      "registernummer": "HRB 9148",
      "registerart": "HRB",
      "company_name": "Quaas Beteiligungs-GmbH",
      "company_seat": "Kreuztal",
      "details": "04.03.2025 (Bekanntmachungsdatum)\n\nNordrhein-Westfalen Amtsgericht Siegen HRB 9148\nLöschungsankündigung\n\nQuaas Beteiligungs-GmbH\nGesellschaft mit beschränkter Haftung\nKreuztal\n\nDas Registergericht beabsichtigt die Gesellschaft von Amts wegen nach § 394 FamFG zu löschen. Die Frist zur Erhebung eines Widerspruchs ist auf drei Monate festgesetzt."
    },
    {
      "date": "2025-03-04",
      "id": "102864",
      "original_text": "Löschungsankündigung\nHessen Amtsgericht Fritzlar HRB 12545\nAlternativ Services & Logistics Freight Forwarding GmbH – Fritzlar",
      "type": "Löschungsankündigung",
      "state": "Hessen",
      "amtsgericht": "Amtsgericht Fritzlar",
      "registernummer": "HRB 12545",
      "registerart": "HRB",
      "company_name": "Alternativ Services & Logistics Freight Forwarding GmbH",
      "company_seat": "Fritzlar",
      "details": "04.03.2025 (Bekanntmachungsdatum)\n\nHessen Amtsgericht Fritzlar HRB 12545\nLöschungsankündigung 04.03.2025 (Eintragungsdatum)\n\nAlternativ Services & Logistics Freight Forwarding GmbH\nGesellschaft mit beschränkter Haftung\nFritzlar\n\nDas Registergericht beabsichtigt die im Handelsregister eingetragene Gesellschaft von Amts wegen nach § 394 FamFG zu löschen. Die Frist zur Erhebung eines Widerspruchs gegen die beabsichtigte Löschung wird auf 3 Monate festgesetzt."
    },
    {
      "date": "2025-03-04",
      "id": "102865",
      "original_text": "Einreichung neuer Dokumente\nHessen Amtsgericht Frankfurt am Main HRB 45655\nVR Smart Finanz AG – Eschborn",
      "type": "Einreichung neuer Dokumente",
      "state": "Hessen",
      "amtsgericht": "Amtsgericht Frankfurt am Main",
      "registernummer": "HRB 45655",
      "registerart": "HRB",
      "company_name": "VR Smart Finanz AG",
      "company_seat": "Eschborn",
      "details": "04.03.2025 (Bekanntmachungsdatum)\n\nHessen Amtsgericht Frankfurt am Main HRB 45655\nEinreichung neuer Dokumente 04.03.2025 (Eintragungsdatum)\n\nVR Smart Finanz AG\nAktiengesellschaft\nEschborn\n\nDurch eine Änderung in den Personen der Aufsichtsratsmitglieder ist eine Liste der Mitglieder des Aufsichtsrates zum Handelsregister eingereicht worden."
    },
    {
      "date": "2025-03-04",
      "id": "102866",
      "original_text": "Registerbekanntmachung nach dem Umwandlungsgesetz\nHessen Amtsgericht Königstein HRA 4108\nStinett GmbH & Co. KG – Königstein im Taunus",
      "type": "Registerbekanntmachung nach dem Umwandlungsgesetz",
      "state": "Hessen",
      "amtsgericht": "Amtsgericht Königstein",
      "registernummer": "HRA 4108",
      "registerart": "HRA",
      "company_name": "Stinett GmbH & Co. KG",
      "company_seat": "Königstein im Taunus",
      "details": "04.03.2025 (Bekanntmachungsdatum)\n\nHessen Amtsgericht Königstein HRA 4108\nRegisterbekanntmachung nach dem Umwandlungsgesetz 04.03.2025 (Eintragungsdatum)\n\nStinett GmbH & Co. KG\nKommanditgesellschaft\nKönigstein im Taunus\n\nDen Gläubigern der an der formwechselnden Umwandlung beteiligten Rechtsträger ist, wenn sie binnen sechs Monaten nach dem Tag, an dem die Eintragung der formwechselnden Umwandlung in das Register des Sitzes desjenigen Rechtsträgers, dessen Gläubiger sie sind, nach § 201 UmwG bekannt gemacht worden ist, ihren Anspruch nach Grund und Höhe schriftlich anmelden, Sicherheit zu leisten, soweit sie nicht Befriedigung verlangen können. Dieses Recht steht den Gläubigern jedoch nur zu, wenn sie glaubhaft machen, dass durch die formwechselnden Umwandlung die Erfüllung ihrer Forderung gefährdet wird."
    },
    {
      "date": "2025-03-04",
      "id": "102867",
      "original_text": "Löschungsankündigung\nHessen Amtsgericht Darmstadt HRB 71089\nF. Levita Malergeschäft Gesellschaft mit beschränkter Haftung – Bad König",
      "type": "Löschungsankündigung",
      "state": "Hessen",
      "amtsgericht": "Amtsgericht Darmstadt",
      "registernummer": "HRB 71089",
      "registerart": "HRB",
      "company_name": "F. Levita Malergeschäft Gesellschaft mit beschränkter Haftung",
      "company_seat": "Bad König",
      "details": "04.03.2025 (Bekanntmachungsdatum)\n\nHessen Amtsgericht Darmstadt HRB 71089\nLöschungsankündigung\n\nF. Levita Malergeschäft Gesellschaft mit beschränkter Haftung\nGesellschaft mit beschränkter Haftung\nBad König\n\nDas Registergericht beabsichtigt die im Handelsregister eingetragene Gesellschaft von Amts wegen nach § 394 FamFG zu löschen. Die Frist zur Erhebung eines Widerspruchs gegen die beabsichtigte Löschung wird auf 3 Monate festgesetzt."
    },
    {
      "date": "2025-03-04",
      "id": "102868",
      "original_text": "Registerbekanntmachung nach dem Umwandlungsgesetz\nHessen Amtsgericht Darmstadt HRA 87664\nJörg Schimpf Betriebs e.K. – Oberzent",
      "type": "Registerbekanntmachung nach dem Umwandlungsgesetz",
      "state": "Hessen",
      "amtsgericht": "Amtsgericht Darmstadt",
      "registernummer": "HRA 87664",
      "registerart": "HRA",
      "company_name": "Jörg Schimpf Betriebs e.K.",
      "company_seat": "Oberzent",
      "details": "04.03.2025 (Bekanntmachungsdatum)\n\nHessen Amtsgericht Darmstadt HRA 87664\nRegisterbekanntmachung nach dem Umwandlungsgesetz 04.03.2025 (Eintragungsdatum)\n\nJörg Schimpf Betriebs e.K.\nEinzelkaufmann / Einzelkauffrau\nOberzent\n\nDen Gläubigern der an der Ausgliederung beteiligten Rechtsträger ist, wenn sie binnen sechs Monaten nach dem Tag, an dem die Eintragung der Ausgliederung in das Register des Sitzes derjenigen Rechtsträger deren Gläubiger sie sind, nach §§ 125, 19 Absatz 3 UmwG bekannt gemacht worden ist, ihren Anspruch nach Grund und Höhe schriftlich anmelden, Sicherheit zu leisten, soweit sie nicht Befriedigung verlangen können. Dieses Recht steht den Gläubigern jedoch nur zu, wenn sie glaubhaft machen, dass durch die Ausgliederung die Erfüllung ihrer Forderung gefährdet wird."
    },
    {
      "date": "2025-03-04",
      "id": "102869",
      "original_text": "Löschungsankündigung\nHessen Amtsgericht Frankfurt am Main HRB 100650\nF.I.S.I. Energy GmbH – Frankfurt am Main",
      "type": "Löschungsankündigung",
      "state": "Hessen",
      "amtsgericht": "Amtsgericht Frankfurt am Main",
      "registernummer": "HRB 100650",
      "registerart": "HRB",
      "company_name": "F.I.S.I. Energy GmbH",
      "company_seat": "Frankfurt am Main",
      "details": "04.03.2025 (Bekanntmachungsdatum)\n\nHessen Amtsgericht Frankfurt am Main HRB 100650\nLöschungsankündigung 04.03.2025 (Eintragungsdatum)\n\nF.I.S.I. Energy GmbH\nGesellschaft mit beschränkter Haftung\nFrankfurt am Main\n\nDas Registergericht beabsichtigt die im Handelsregister eingetragene Gesellschaft von Amts wegen nach § 394 FamFG zu löschen. Die Frist zur Erhebung eines Widerspruchs gegen die beabsichtigte Löschung wird auf 1 Monat festgesetzt."
    },
    {
      "date": "2025-03-04",
      "id": "102870",
      "original_text": "Registerbekanntmachung nach dem Umwandlungsgesetz\nHessen Amtsgericht Gießen HRB 5032\nVibrantz Diegel GmbH – Alsfeld",
      "type": "Registerbekanntmachung nach dem Umwandlungsgesetz",
      "state": "Hessen",
      "amtsgericht": "Amtsgericht Gießen",
      "registernummer": "HRB 5032",
      "registerart": "HRB",
      "company_name": "Vibrantz Diegel GmbH",
      "company_seat": "Alsfeld",
      "details": "04.03.2025 (Bekanntmachungsdatum)\n\nHessen Amtsgericht Gießen HRB 5032\nRegisterbekanntmachung nach dem Umwandlungsgesetz 04.03.2025 (Eintragungsdatum)\n\nVibrantz Diegel GmbH\nGesellschaft mit beschränkter Haftung\nAlsfeld\n\nDen Gläubigern der an der Verschmelzung beteiligten Rechtsträger ist, wenn sie binnen sechs Monaten nach dem Tag, an dem die Eintragung der Verschmelzung in das Register des Sitzes desjenigen Rechtsträgers, dessen Gläubiger sie sind, nach § 19 Absatz 3 UmwG bekannt gemacht worden ist, ihren Anspruch nach Grund und Höhe schriftlich anmelden, Sicherheit zu leisten, soweit sie nicht Befriedigung verlangen können. Dieses Recht steht den Gläubigern jedoch nur zu, wenn sie glaubhaft machen, dass durch die Verschmelzung die Erfüllung ihrer Forderung gefährdet wird."
    },
    {
      "date": "2025-03-04",
      "id": "102871",
      "original_text": "Sonstige Registerbekanntmachung\nHessen Amtsgericht Frankfurt am Main HRB 9135\nDWS Investment GmbH – Frankfurt am Main",
      "type": "Sonstige Registerbekanntmachung",
      "state": "Hessen",
      "amtsgericht": "Amtsgericht Frankfurt am Main",
      "registernummer": "HRB 9135",
      "registerart": "HRB",
      "company_name": "DWS Investment GmbH",
      "company_seat": "Frankfurt am Main",
      "details": "04.03.2025 (Bekanntmachungsdatum)\n\nHessen Amtsgericht Frankfurt am Main HRB 9135\nSonstige Registerbekanntmachung\n\nDWS Investment GmbH\nGesellschaft mit beschränkter Haftung\nFrankfurt am Main\n\nDurch eine Änderung in den Personen der Aufsichtsratsmitglieder ist eine Liste der Mitglieder des Aufsichtsrates zum Handelsregister eingereicht worden."
    },
    {
      "date": "2025-03-04",
      "id": "102872",
      "original_text": "Registerbekanntmachung nach dem Umwandlungsgesetz\nHessen Amtsgericht Gießen HRB 7013\nMarata International GmbH – Alsfeld",
      "type": "Registerbekanntmachung nach dem Umwandlungsgesetz",
      "state": "Hessen",
      "amtsgericht": "Amtsgericht Gießen",
      "registernummer": "HRB 7013",
      "registerart": "HRB",
      "company_name": "Marata International GmbH",
      "company_seat": "Alsfeld",
      "details": "04.03.2025 (Bekanntmachungsdatum)\n\nHessen Amtsgericht Gießen HRB 7013\nRegisterbekanntmachung nach dem Umwandlungsgesetz 04.03.2025 (Eintragungsdatum)\n\nMarata International GmbH\nGesellschaft mit beschränkter Haftung\nAlsfeld\n\nDen Gläubigern der an der Verschmelzung beteiligten Rechtsträger ist, wenn sie binnen sechs Monaten nach dem Tag, an dem die Eintragung der Verschmelzung in das Register des Sitzes desjenigen Rechtsträgers, dessen Gläubiger sie sind, nach § 19 Absatz 3 UmwG bekannt gemacht worden ist, ihren Anspruch nach Grund und Höhe schriftlich anmelden, Sicherheit zu leisten, soweit sie nicht Befriedigung verlangen können. Dieses Recht steht den Gläubigern jedoch nur zu, wenn sie glaubhaft machen, dass durch die Verschmelzung die Erfüllung ihrer Forderung gefährdet wird."
    },
    {
      "date": "2025-03-04",
      "id": "102873",
      "original_text": "Registerbekanntmachung nach dem Umwandlungsgesetz\nHessen Amtsgericht Darmstadt HRA 87672\nJ. Schimpf Besitzgesellschaft mbH & Co. KG – Oberzent",
      "type": "Registerbekanntmachung nach dem Umwandlungsgesetz",
      "state": "Hessen",
      "amtsgericht": "Amtsgericht Darmstadt",
      "registernummer": "HRA 87672",
      "registerart": "HRA",
      "company_name": "J. Schimpf Besitzgesellschaft mbH & Co. KG",
      "company_seat": "Oberzent",
      "details": "04.03.2025 (Bekanntmachungsdatum)\n\nHessen Amtsgericht Darmstadt HRA 87672\nRegisterbekanntmachung nach dem Umwandlungsgesetz 04.03.2025 (Eintragungsdatum)\n\nJ. Schimpf Besitzgesellschaft mbH & Co. KG\nKommanditgesellschaft\nOberzent\n\nDen Gläubigern der an der Ausgliederung beteiligten Rechtsträger ist, wenn sie binnen sechs Monaten nach dem Tag, an dem die Eintragung der Ausgliederung in das Register des Sitzes derjenigen Rechtsträger deren Gläubiger sie sind, nach §§ 125, 19 Absatz 3 UmwG bekannt gemacht worden ist, ihren Anspruch nach Grund und Höhe schriftlich anmelden, Sicherheit zu leisten, soweit sie nicht Befriedigung verlangen können. Dieses Recht steht den Gläubigern jedoch nur zu, wenn sie glaubhaft machen, dass durch die Ausgliederung die Erfüllung ihrer Forderung gefährdet wird."
    },
    {
      "date": "2025-03-04",
      "id": "102874",
      "original_text": "Einreichung neuer Dokumente\nHessen Amtsgericht Friedberg HRB 1755\nORD Oberhessische Recycling Dienste GmbH – Friedberg/H.",
      "type": "Einreichung neuer Dokumente",
      "state": "Hessen",
      "amtsgericht": "Amtsgericht Friedberg",
      "registernummer": "HRB 1755",
      "registerart": "HRB",
      "company_name": "ORD Oberhessische Recycling Dienste GmbH",
      "company_seat": "Friedberg/H.",
      "details": "04.03.2025 (Bekanntmachungsdatum)\n\nHessen Amtsgericht Friedberg HRB 1755\nEinreichung neuer Dokumente 04.03.2025 (Eintragungsdatum)\n\nORD Oberhessische Recycling Dienste GmbH\nGesellschaft mit beschränkter Haftung\nFriedberg/H.\n\nDurch eine Änderung in den Personen der Aufsichtsratsmitglieder ist eine Liste der Mitglieder des Aufsichtsrates zum Handelsregister eingereicht worden."
    },
    {
      "date": "2025-03-04",
      "id": "102875",
      "original_text": "Löschungsankündigung\nHessen Amtsgericht Frankfurt am Main HRB 132818\nMorgenVier Business GmbH – Frankfurt am Main",
      "type": "Löschungsankündigung",
      "state": "Hessen",
      "amtsgericht": "Amtsgericht Frankfurt am Main",
      "registernummer": "HRB 132818",
      "registerart": "HRB",
      "company_name": "MorgenVier Business GmbH",
      "company_seat": "Frankfurt am Main",
      "details": "04.03.2025 (Bekanntmachungsdatum)\n\nHessen Amtsgericht Frankfurt am Main HRB 132818\nLöschungsankündigung 04.03.2025 (Eintragungsdatum)\n\nMorgenVier Business GmbH\nGesellschaft mit beschränkter Haftung\nFrankfurt am Main\n\nDas Registergericht beabsichtigt die im Handelsregister eingetragene Gesellschaft von Amts wegen nach § 394 FamFG zu löschen. Die Frist zur Erhebung eines Widerspruchs gegen die beabsichtigte Löschung wird auf 3 Monate festgesetzt."
    },
    {
      "date": "2025-03-04",
      "id": "102876",
      "original_text": "Löschungsankündigung\nHessen Amtsgericht Frankfurt am Main HRB 105614\nSteko Bau GmbH – Hattersheim",
      "type": "Löschungsankündigung",
      "state": "Hessen",
      "amtsgericht": "Amtsgericht Frankfurt am Main",
      "registernummer": "HRB 105614",
      "registerart": "HRB",
      "company_name": "Steko Bau GmbH",
      "company_seat": "Hattersheim",
      "details": "04.03.2025 (Bekanntmachungsdatum)\n\nHessen Amtsgericht Frankfurt am Main HRB 105614\nLöschungsankündigung 04.03.2025 (Eintragungsdatum)\n\nSteko Bau GmbH\nGesellschaft mit beschränkter Haftung\nHattersheim\n\nDas Registergericht beabsichtigt die im Handelsregister eingetragene Gesellschaft von Amts wegen nach § 394 FamFG zu löschen. Die Frist zur Erhebung eines Widerspruchs gegen die beabsichtigte Löschung wird auf 3 Monate festgesetzt."
    },
    {
      "date": "2025-03-04",
      "id": "102877",
      "original_text": "Registerbekanntmachung nach dem Umwandlungsgesetz\nHessen Amtsgericht Frankfurt am Main HRB 28469\nInvesco Asset Management Deutschland GmbH – Frankfurt am Main",
      "type": "Registerbekanntmachung nach dem Umwandlungsgesetz",
      "state": "Hessen",
      "amtsgericht": "Amtsgericht Frankfurt am Main",
      "registernummer": "HRB 28469",
      "registerart": "HRB",
      "company_name": "Invesco Asset Management Deutschland GmbH",
      "company_seat": "Frankfurt am Main",
      "details": "04.03.2025 (Bekanntmachungsdatum)\n\nHessen Amtsgericht Frankfurt am Main HRB 28469\nRegisterbekanntmachung nach dem Umwandlungsgesetz\n\nInvesco Asset Management Deutschland GmbH\nGesellschaft mit beschränkter Haftung\nFrankfurt am Main\n\nDem Registergericht ist der Entwurf eines Verschmelzungsplans über die geplante grenzüberschreitende Verschmelzung eingereicht worden.\n\nDie Invesco Asset Management Deutschland GmbH mit Sitz in Frankfurt am Main, Deutschland, eingetragen im Handelsregister des Amtsgerichts Frankfurt am Main unter HRB 28469, soll als übertragender Rechtsträger im Wege einer grenzüberschreitenden Verschmelzung durch Aufnahme auf die INVESCO Asset Management S.A., einer nach dem Recht des Großherzogtums Luxemburg gegründeten und bestehenden Aktiengesellschaft (société anonyme) mit Sitz in Luxemburg, eingetragen im luxemburgischen Handels- und Gesellschaftsregister (Registre de commerce\net des sociétés Luxembourg - RCS) unter der Nummer B38049, als übernehmendem Rechtsträger im Wege der Verschmelzung durch Aufnahme (ohne Liquidation) gemäß §§ 305 ff. UmwG und gemäß Artikel 1020-1 ff., und insbesondere gemäß Artikel 1025-1 ff. des luxemburgischen Gesetzes vom 10. August 1915 über Handelsgesellschaften verschmolzen werden.\n\nGemäß § 308 UmwG wird hiermit der gemeinsame Verschmelzungsplan für die grenzüberschreitende Verschmelzung der Invesco Asset Management Deutschland GmbH auf die INVESCO Asset Management S.A. vom 3. März 2025, UVZ-Nr. 245/2025 F der Notarin Dr. Sabine Funke mit dem Amtssitz in Frankfurt am Main, zum Handelsregister eingereicht mit der Bitte um unverzügliche Bekanntmachung nach § 308 Abs. 1 Satz 2 UmwG in Verbindung mit § 10 Handelsgesetzbuch (HGB).\n\nDen Gläubigern der übertragenden Gesellschaft ist Sicherheit zu leisten, wenn sie innerhalb einer Frist von zwei Monaten nach Bekanntmachung des Verschmelzungsplans glaubhaft machen, dass durch die Verschmelzung die Erfüllung ihrer Forderung gefährdet wird. Die Anteilseigner der übertragenden Gesellschaft haben bei grenzüberschreitenden Verschmelzungen einen Anspruch auf angemessene Abfindung, sofern sie der Verschmelzung widersprochen haben; gegebenenfalls steht ihnen auch ein Anspruch auf bare Zuzahlung zu.\n\nHiermit wird gemäß § 308 Abs. 1 Satz 3 UmwG der folgende lnhalt der gemäß § 308 Abs. 1 Satz 2 UmwG bekannt zu machenden Angaben mitgeteilt:\na) Zu § 308 Abs. 1 Satz 2 Nr. 1 UmwG: Der gemeinsame Verschmelzungsplan vom 3. März 2025 einschließlich der Satzung der übernehmenden Gesellschaft wurde mit diesem Schreiben beim Handelsregister Frankfurt am Main eingereicht.\nb) Zu § 308 Abs. 1 Satz 2 Nr. 2 UmwG: An der Verschmelzung sind folgende Rechtsträger beteiligt:\naa) lnvesco Asset Management Deutschland GmbH mit Sitz in Frankfurt am Main, Deutschland, eingetragen im Handelsregister des Amtsgerichts Frankfurt am Main unter HRB 28469 als übertragende Rechtsträgerin;\nbb) INVESCO Asset Management S.A., eine nach dem Recht des Großherzogtums Luxemburg gegründeten und bestehenden Aktiengesellschaft (société anonyme), mit Sitz in Luxemburg, eingetragen im luxemburgischen Handels- und Gesellschaftsregister (RCS) unter der Nummer B38049 als übernehmende Rechtsträgerin.\n\nc) Zu § 308 Abs. 1 Satz 2 Nr. 3 UmwG: Die Registerangaben zu den beteiligten Gesellschaften lauten wie folgt:\naa) Invesco Asset Management Deutschland GmbH, die übertragende Rechtsträgerin, ist im Handelsregister des Amtsgerichts Frankfurt am Main unter Nummer HRB 28469 eingetragen.\nbb) INVESCO Asset Management S.A., die übernehmende Rechtsträgerin, ist im Luxemburger Handel- und Gesellschaftsregister (Registre de commerce et des sociétés Luxembourg - RCS) unter Nummer B38049 eingetragen.\nd) Zu § 308 Abs. 1 Satz 2 Nr. 4 UmwG: Die Anteilsinhaber und Gläubiger der an der Verschmelzung beteiligten Gesellschaften sowie die zuständigen Betriebsräte (bzw. soweit es keinen Betriebsrat gibt, die Arbeitnehmer der an der Verschmelzung beteiligten Gesellschaften), können etwaige Bemerkungen und Stellungnahmen zum Verschmelzungsplan bis spätestens fünf Arbeitstage vor dem Tag der Gesellschafterversammlung bzw. Hauptversammlung der an der Verschmelzung beteiligten\nGesellschaften, die über die grenzüberschreitende Verschmelzung beschließen, übermitteln.\nDie Gesellschafterversammlung der lnvesco Asset Management Deutschland GmbH, in der über die Zustimmung zum Verschmelzungsplan Beschluss gefasst werden soil, soli am 16. April 2025 stattfinden.\nDie Hauptversammlung der INVESCO Asset Management S.A., in der über die Zustimmung zum Verschmelzungsplan Beschluss gefasst werden soli, wird gemäß Artikel 1025-5 Abs. 1 N° 1 des luxemburgischen Gesetzes vom 10. August 1915 über Handelsgesellschaften frühestens einen Monat nach der Veröffentlichung des Verschmelzungsplans im Recueil Electronique des Soci&és et Associations von Luxemburg stattfinden.\nDie Stellungnahmen von Anteilsinhabern, Gläubigern und des Betriebsrats der Invesco Asset Management Deutschland GmbH sind wie folgt zu adressieren:\n\nInvesco Asset Management Deutschland GmbH\nAn der Welle 5\n60322 Frankfurt am Main\nGermany\nuksecretariat@invesco.com"
    }
  ]
}