{
  "date": "2025-03-07",
  "date_of_scrape": "2025-03-08T04:08:12.341Z",
  "tool_version": "0.2.0",
  "number_of_announcements": 114,
  "announcements": [
    {
      "date": "2025-03-07",
      "id": "103122",
      "original_text": "Registerbekanntmachung nach dem Umwandlungsgesetz\nBayern Amtsgericht München HRB 300586\nBaunova Bayern GmbH – München",
      "type": "Registerbekanntmachung nach dem Umwandlungsgesetz",
      "state": "Bayern",
      "amtsgericht": "Amtsgericht München",
      "registernummer": "HRB 300586",
      "registerart": "HRB",
      "company_name": "Baunova Bayern GmbH",
      "company_seat": "München",
      "details": "07.03.2025 (Bekanntmachungsdatum)\n\nBayern Amtsgericht München HRB 300586\nRegisterbekanntmachung nach dem Umwandlungsgesetz 06.03.2025 (Eintragungsdatum)\n\nBaunova Bayern GmbH\nGesellschaft mit beschränkter Haftung\nMünchen\n\nDen Gläubigern der an der Ausgliederung beteiligten Rechtsträger ist, wenn sie binnen sechs Monaten nach dem Tag, an dem die Eintragung der Ausgliederung in das Register des Sitzes desjenigen Rechtsträgers, dessen Gläubiger sie sind, nach §§ 125, 19 Abs. 3 UmwG als bekannt gemacht gilt, ihren Anspruch nach Grund und Höhe in Textform anmelden, Sicherheit zu leisten, soweit sie nicht Befriedigung verlangen können. Dieses Recht steht den Gläubigern jedoch nur zu, wenn sie glaubhaft machen, dass durch die Ausgliederung die Erfüllung ihrer Forderung gefährdet wird."
    },
    {
      "date": "2025-03-07",
      "id": "103123",
      "original_text": "Löschungsankündigung\nBayern Amtsgericht Traunstein HRA 1663\nAlpengasthof \"Feuriger Tatzlwurm\" Karl Kiesl e.K. – Oberaudorf",
      "type": "Löschungsankündigung",
      "state": "Bayern",
      "amtsgericht": "Amtsgericht Traunstein",
      "registernummer": "HRA 1663",
      "registerart": "HRA",
      "company_name": "Alpengasthof \"Feuriger Tatzlwurm\" Karl Kiesl e.K.",
      "company_seat": "Oberaudorf",
      "details": "07.03.2025 (Bekanntmachungsdatum)\n\nBayern Amtsgericht Traunstein HRA 1663\nLöschungsankündigung\n\nAlpengasthof \"Feuriger Tatzlwurm\" Karl Kiesl e.K.\nEinzelkaufmann / Einzelkauffrau\nOberaudorf\n\nDas Registergericht beabsichtigt, die im Handelsregister eingetragene Firma von Amts wegen nach § 31 Abs. 2 HGB zu löschen. Die Frist zur Erhebung eines Widerspruchs ist auf drei Monate festgesetzt. Eine Erzwingung der Anmeldung des Erlöschens im Wege des Zwangsgeldverfahrens ist nicht möglich, da keine Anschrift des Inhabers/Gesellschafters bekannt ist oder ermittelt werden konnte."
    },
    {
      "date": "2025-03-07",
      "id": "103124",
      "original_text": "Sonstige Registerbekanntmachung\nBayern Amtsgericht Würzburg HRB 11816\nPhoenix Spiel- und Unterhaltungsautomaten Betriebsgesellschaft m.b.H. – Waldbrunn",
      "type": "Sonstige Registerbekanntmachung",
      "state": "Bayern",
      "amtsgericht": "Amtsgericht Würzburg",
      "registernummer": "HRB 11816",
      "registerart": "HRB",
      "company_name": "Phoenix Spiel- und Unterhaltungsautomaten Betriebsgesellschaft m.b.H.",
      "company_seat": "Waldbrunn",
      "details": "07.03.2025 (Bekanntmachungsdatum)\n\nBayern Amtsgericht Würzburg HRB 11816\nSonstige Registerbekanntmachung 06.03.2025 (Eintragungsdatum)\n\nPhoenix Spiel- und Unterhaltungsautomaten Betriebsgesellschaft m.b.H.\nGesellschaft mit beschränkter Haftung\nWaldbrunn\n\nDen Gläubigern der Gesellschaft, deren Forderungen begründet worden sind, bevor die Eintragung der Beendigung des Beherrschungs- und Gewinnabführungsvertrages in das Handelsregister nach § 10 des Handelsgesetzbuches als bekanntgemacht gilt, hat der andere Vertragsteil Sicherheit zu leisten, wenn sie sich binnen sechs Monaten nach der Bekanntmachung der Eintragung zu diesem Zweck bei ihm melden."
    },
    {
      "date": "2025-03-07",
      "id": "103125",
      "original_text": "Einreichung neuer Dokumente\nBayern Amtsgericht Regensburg HRB 11076\nPelamon Opportunity GmbH & Co KGaA – Regensburg",
      "type": "Einreichung neuer Dokumente",
      "state": "Bayern",
      "amtsgericht": "Amtsgericht Regensburg",
      "registernummer": "HRB 11076",
      "registerart": "HRB",
      "company_name": "Pelamon Opportunity GmbH & Co KGaA",
      "company_seat": "Regensburg",
      "details": "07.03.2025 (Bekanntmachungsdatum)\n\nBayern Amtsgericht Regensburg HRB 11076\nEinreichung neuer Dokumente\n\nPelamon Opportunity GmbH & Co KGaA\nKommanditgesellschaft auf Aktien\nRegensburg\n\nDem Amtsgericht Regensburg -Registergericht- isteine Liste der Mitglieder des Aufsichtsrats eingereicht worden, §§ 278 Abs. 3, 106 AktG."
    },
    {
      "date": "2025-03-07",
      "id": "103126",
      "original_text": "Registerbekanntmachung nach dem Umwandlungsgesetz\nBayern Amtsgericht Traunstein HRB 30630\nMatthews Marking Systems Holding GmbH – Aschau i.Chiemgau",
      "type": "Registerbekanntmachung nach dem Umwandlungsgesetz",
      "state": "Bayern",
      "amtsgericht": "Amtsgericht Traunstein",
      "registernummer": "HRB 30630",
      "registerart": "HRB",
      "company_name": "Matthews Marking Systems Holding GmbH",
      "company_seat": "Aschau i.Chiemgau",
      "details": "07.03.2025 (Bekanntmachungsdatum)\n\nBayern Amtsgericht Traunstein HRB 30630\nRegisterbekanntmachung nach dem Umwandlungsgesetz 06.03.2025 (Eintragungsdatum)\n\nMatthews Marking Systems Holding GmbH\nGesellschaft mit beschränkter Haftung\nAschau i.Chiemgau\n\nDen Gläubigern der an der Verschmelzung beteiligten Rechtsträger ist, wenn sie binnen sechs Monaten nach dem Tag, an dem die Eintragung der Verschmelzung in das Register des Sitzes desjenigen Rechtsträgers, dessen Gläubiger sie sind, nach § 19 Abs. 3 UmwG als bekannt gemacht gilt, ihren Anspruch nach Grund und Höhe in Textform anmelden, Sicherheit zu leisten, soweit sie nicht Befriedigung verlangen können. Dieses Recht steht den Gläubigern jedoch nur zu, wenn sie glaubhaft machen, dass durch die Verschmelzung die Erfüllung ihrer Forderung gefährdet wird."
    },
    {
      "date": "2025-03-07",
      "id": "103127",
      "original_text": "Sonstige Registerbekanntmachung\nBayern Amtsgericht Regensburg HRB 8522\nams-OSRAM International GmbH – Regensburg",
      "type": "Sonstige Registerbekanntmachung",
      "state": "Bayern",
      "amtsgericht": "Amtsgericht Regensburg",
      "registernummer": "HRB 8522",
      "registerart": "HRB",
      "company_name": "ams-OSRAM International GmbH",
      "company_seat": "Regensburg",
      "details": "07.03.2025 (Bekanntmachungsdatum)\n\nBayern Amtsgericht Regensburg HRB 8522\nSonstige Registerbekanntmachung\n\nams-OSRAM International GmbH\nGesellschaft mit beschränkter Haftung\nRegensburg\n\nDem Amtsgericht Regensburg -Registergericht- ist eine Liste der Mitglieder des Aufsichtsrats eingereicht worden, § 52 Abs. 3 S. 2 GmbHG."
    },
    {
      "date": "2025-03-07",
      "id": "103128",
      "original_text": "Löschungsankündigung\nBayern Amtsgericht München HRB 240342\nMen.Care UG (haftungsbeschränkt) – München",
      "type": "Löschungsankündigung",
      "state": "Bayern",
      "amtsgericht": "Amtsgericht München",
      "registernummer": "HRB 240342",
      "registerart": "HRB",
      "company_name": "Men.Care UG (haftungsbeschränkt)",
      "company_seat": "München",
      "details": "07.03.2025 (Bekanntmachungsdatum)\n\nBayern Amtsgericht München HRB 240342\nLöschungsankündigung 06.03.2025 (Eintragungsdatum)\n\nMen.Care UG (haftungsbeschränkt)\nGesellschaft mit beschränkter Haftung\nMünchen\n\nDas Registergericht beabsichtigt, die im Handelsregister eingetragene Gesellschaft wegen Vermögenslosigkeit von Amts wegen nach § 394 FamFG zu löschen. Die Frist zur Erhebung eines Widerspruchs ist auf drei Monate festgesetzt."
    },
    {
      "date": "2025-03-07",
      "id": "103129",
      "original_text": "Registerbekanntmachung nach dem Umwandlungsgesetz\nBayern Amtsgericht Landshut HRB 4528\nHAPPY Lagerverkauf GmbH – Altdorf",
      "type": "Registerbekanntmachung nach dem Umwandlungsgesetz",
      "state": "Bayern",
      "amtsgericht": "Amtsgericht Landshut",
      "registernummer": "HRB 4528",
      "registerart": "HRB",
      "company_name": "HAPPY Lagerverkauf GmbH",
      "company_seat": "Altdorf",
      "details": "07.03.2025 (Bekanntmachungsdatum)\n\nBayern Amtsgericht Landshut HRB 4528\nRegisterbekanntmachung nach dem Umwandlungsgesetz 06.03.2025 (Eintragungsdatum)\n\nHAPPY Lagerverkauf GmbH\nGesellschaft mit beschränkter Haftung\nAltdorf\n\nDen Gläubigern der an der Verschmelzung beteiligten Rechtsträger ist, wenn sie binnen sechs Monaten nach dem Tag, an dem die Eintragung der Verschmelzung in das Register des Sitzes desjenigen Rechtsträgers, dessen Gläubiger sie sind, nach § 19 Abs. 3 UmwG als bekannt gemacht gilt, ihren Anspruch nach Grund und Höhe in Textform anmelden, Sicherheit zu leisten, soweit sie nicht Befriedigung verlangen können. Dieses Recht steht den Gläubigern jedoch nur zu, wenn sie glaubhaft machen, dass durch die Verschmelzung die Erfüllung ihrer Forderung gefährdet wird."
    },
    {
      "date": "2025-03-07",
      "id": "103130",
      "original_text": "Registerbekanntmachung nach dem Umwandlungsgesetz\nBayern Amtsgericht Landshut HRB 1302\nPrechler GmbH – Weng",
      "type": "Registerbekanntmachung nach dem Umwandlungsgesetz",
      "state": "Bayern",
      "amtsgericht": "Amtsgericht Landshut",
      "registernummer": "HRB 1302",
      "registerart": "HRB",
      "company_name": "Prechler GmbH",
      "company_seat": "Weng",
      "details": "07.03.2025 (Bekanntmachungsdatum)\n\nBayern Amtsgericht Landshut HRB 1302\nRegisterbekanntmachung nach dem Umwandlungsgesetz 06.03.2025 (Eintragungsdatum)\n\nPrechler GmbH\nGesellschaft mit beschränkter Haftung\nWeng\n\nDen Gläubigern der an der Verschmelzung beteiligten Rechtsträger ist, wenn sie binnen sechs Monaten nach dem Tag, an dem die Eintragung der Verschmelzung in das Register des Sitzes desjenigen Rechtsträgers, dessen Gläubiger sie sind, nach § 19 Abs. 3 UmwG als bekannt gemacht gilt, ihren Anspruch nach Grund und Höhe in Textform anmelden, Sicherheit zu leisten, soweit sie nicht Befriedigung verlangen können. Dieses Recht steht den Gläubigern jedoch nur zu, wenn sie glaubhaft machen, dass durch die Verschmelzung die Erfüllung ihrer Forderung gefährdet wird."
    },
    {
      "date": "2025-03-07",
      "id": "103131",
      "original_text": "Registerbekanntmachung nach dem Umwandlungsgesetz\nBayern Amtsgericht Landshut HRA 12817\nElektro Stefan Fränzl e.K. – Velden",
      "type": "Registerbekanntmachung nach dem Umwandlungsgesetz",
      "state": "Bayern",
      "amtsgericht": "Amtsgericht Landshut",
      "registernummer": "HRA 12817",
      "registerart": "HRA",
      "company_name": "Elektro Stefan Fränzl e.K.",
      "company_seat": "Velden",
      "details": "07.03.2025 (Bekanntmachungsdatum)\n\nBayern Amtsgericht Landshut HRA 12817\nRegisterbekanntmachung nach dem Umwandlungsgesetz 06.03.2025 (Eintragungsdatum)\n\nElektro Stefan Fränzl e.K.\nEinzelkaufmann / Einzelkauffrau\nVelden\n\nDen Gläubigern der an der Ausgliederung beteiligten Rechtsträger ist, wenn sie binnen sechs Monaten nach dem Tag, an dem die Eintragung der Ausgliederung in das Register des Sitzes desjenigen Rechtsträgers, dessen Gläubiger sie sind, nach §§ 125, 19 Abs. 3 UmwG als bekannt gemacht gilt, ihren Anspruch nach Grund und Höhe in Textform anmelden, Sicherheit zu leisten, soweit sie nicht Befriedigung verlangen können. Dieses Recht steht den Gläubigern jedoch nur zu, wenn sie glaubhaft machen, dass durch die Ausgliederung die Erfüllung ihrer Forderung gefährdet wird."
    },
    {
      "date": "2025-03-07",
      "id": "103132",
      "original_text": "Sonstige Registerbekanntmachung\nBayern Amtsgericht Bayreuth HRB 5688\nit-visual GmbH – Kulmbach",
      "type": "Sonstige Registerbekanntmachung",
      "state": "Bayern",
      "amtsgericht": "Amtsgericht Bayreuth",
      "registernummer": "HRB 5688",
      "registerart": "HRB",
      "company_name": "it-visual GmbH",
      "company_seat": "Kulmbach",
      "details": "07.03.2025 (Bekanntmachungsdatum)\n\nBayern Amtsgericht Bayreuth HRB 5688\nSonstige Registerbekanntmachung 06.03.2025 (Eintragungsdatum)\n\nit-visual GmbH\nGesellschaft mit beschränkter Haftung\nKulmbach\n\nDen Gläubigern der an der Verschmelzung beteiligten Rechtsträger ist, wenn sie binnen sechs Monaten nach dem Tag, an dem die Eintragung der Verschmelzung in das Register des Sitzes desjenigen Rechtsträgers, dessen Gläubiger sie sind, nach § 19 Abs. 3 UmwG als bekannt gemacht gilt, ihren Anspruch nach Grund und Höhe in Textform anmelden, Sicherheit zu leisten, soweit sie nicht Befriedigung verlangen können. Dieses Recht steht den Gläubigern jedoch nur zu, wenn sie glaubhaft machen, dass durch die Verschmelzung die Erfüllung ihrer Forderung gefährdet wird."
    },
    {
      "date": "2025-03-07",
      "id": "103133",
      "original_text": "Löschungsankündigung\nBayern Amtsgericht München HRB 202797\nEVENT ARENA GmbH – München",
      "type": "Löschungsankündigung",
      "state": "Bayern",
      "amtsgericht": "Amtsgericht München",
      "registernummer": "HRB 202797",
      "registerart": "HRB",
      "company_name": "EVENT ARENA GmbH",
      "company_seat": "München",
      "details": "07.03.2025 (Bekanntmachungsdatum)\n\nBayern Amtsgericht München HRB 202797\nLöschungsankündigung\n\nEVENT ARENA GmbH\nGesellschaft mit beschränkter Haftung\nMünchen\n\nDas Registergericht beabsichtigt, die im Handelsregister eingetragene Gesellschaft wegen Vermögenslosigkeit von Amts wegen nach § 394 FamFG zu löschen. Die Frist zur Erhebung eines Widerspruchs ist auf drei Monate festgesetzt."
    },
    {
      "date": "2025-03-07",
      "id": "103134",
      "original_text": "Registerbekanntmachung nach dem Umwandlungsgesetz\nBayern Amtsgericht München HRB 122988\nBau + Plan Ingenieurgesellschaft mbH – München",
      "type": "Registerbekanntmachung nach dem Umwandlungsgesetz",
      "state": "Bayern",
      "amtsgericht": "Amtsgericht München",
      "registernummer": "HRB 122988",
      "registerart": "HRB",
      "company_name": "Bau + Plan Ingenieurgesellschaft mbH",
      "company_seat": "München",
      "details": "07.03.2025 (Bekanntmachungsdatum)\n\nBayern Amtsgericht München HRB 122988\nRegisterbekanntmachung nach dem Umwandlungsgesetz 06.03.2025 (Eintragungsdatum)\n\nBau + Plan Ingenieurgesellschaft mbH\nGesellschaft mit beschränkter Haftung\nMünchen\n\nDen Gläubigern der an der Verschmelzung beteiligten Rechtsträger ist, wenn sie binnen sechs Monaten nach dem Tag, an dem die Eintragung der Verschmelzung in das Register des Sitzes desjenigen Rechtsträgers, dessen Gläubiger sie sind, nach § 19 Abs. 3 UmwG als bekannt gemacht gilt, ihren Anspruch nach Grund und Höhe in Textform anmelden, Sicherheit zu leisten, soweit sie nicht Befriedigung verlangen können. Dieses Recht steht den Gläubigern jedoch nur zu, wenn sie glaubhaft machen, dass durch die Verschmelzung die Erfüllung ihrer Forderung gefährdet wird."
    },
    {
      "date": "2025-03-07",
      "id": "103135",
      "original_text": "Sonstige Registerbekanntmachung\nBayern Amtsgericht Bayreuth HRB 7211\nML Empire GmbH – Kulmbach",
      "type": "Sonstige Registerbekanntmachung",
      "state": "Bayern",
      "amtsgericht": "Amtsgericht Bayreuth",
      "registernummer": "HRB 7211",
      "registerart": "HRB",
      "company_name": "ML Empire GmbH",
      "company_seat": "Kulmbach",
      "details": "07.03.2025 (Bekanntmachungsdatum)\n\nBayern Amtsgericht Bayreuth HRB 7211\nSonstige Registerbekanntmachung 06.03.2025 (Eintragungsdatum)\n\nML Empire GmbH\nGesellschaft mit beschränkter Haftung\nKulmbach\n\nDen Gläubigern der an der Verschmelzung beteiligten Rechtsträger ist, wenn sie binnen sechs Monaten nach dem Tag, an dem die Eintragung der Verschmelzung in das Register des Sitzes desjenigen Rechtsträgers, dessen Gläubiger sie sind, nach § 19 Abs. 3 UmwG als bekannt gemacht gilt, ihren Anspruch nach Grund und Höhe in Textform anmelden, Sicherheit zu leisten, soweit sie nicht Befriedigung verlangen können. Dieses Recht steht den Gläubigern jedoch nur zu, wenn sie glaubhaft machen, dass durch die Verschmelzung die Erfüllung ihrer Forderung gefährdet wird."
    },
    {
      "date": "2025-03-07",
      "id": "103136",
      "original_text": "Einreichung neuer Dokumente\nBayern Amtsgericht München HRB 6933\nNeff GmbH – München",
      "type": "Einreichung neuer Dokumente",
      "state": "Bayern",
      "amtsgericht": "Amtsgericht München",
      "registernummer": "HRB 6933",
      "registerart": "HRB",
      "company_name": "Neff GmbH",
      "company_seat": "München",
      "details": "07.03.2025 (Bekanntmachungsdatum)\n\nBayern Amtsgericht München HRB 6933\nEinreichung neuer Dokumente\n\nNeff GmbH\nGesellschaft mit beschränkter Haftung\nMünchen\n\nDem Amtsgericht München -Registergericht- ist eine Liste der Mitglieder des Aufsichtsrats eingereicht worden, § 52 Abs. 3 S. 2 GmbHG."
    },
    {
      "date": "2025-03-07",
      "id": "103137",
      "original_text": "Registerbekanntmachung nach dem Umwandlungsgesetz\nBayern Amtsgericht Landshut HRB 5480\nWalter Outlet GmbH – Altdorf",
      "type": "Registerbekanntmachung nach dem Umwandlungsgesetz",
      "state": "Bayern",
      "amtsgericht": "Amtsgericht Landshut",
      "registernummer": "HRB 5480",
      "registerart": "HRB",
      "company_name": "Walter Outlet GmbH",
      "company_seat": "Altdorf",
      "details": "07.03.2025 (Bekanntmachungsdatum)\n\nBayern Amtsgericht Landshut HRB 5480\nRegisterbekanntmachung nach dem Umwandlungsgesetz 06.03.2025 (Eintragungsdatum)\n\nWalter Outlet GmbH\nGesellschaft mit beschränkter Haftung\nAltdorf\n\nDen Gläubigern der an der Verschmelzung beteiligten Rechtsträger ist, wenn sie binnen sechs Monaten nach dem Tag, an dem die Eintragung der Verschmelzung in das Register des Sitzes desjenigen Rechtsträgers, dessen Gläubiger sie sind, nach § 19 Abs. 3 UmwG als bekannt gemacht gilt, ihren Anspruch nach Grund und Höhe in Textform anmelden, Sicherheit zu leisten, soweit sie nicht Befriedigung verlangen können. Dieses Recht steht den Gläubigern jedoch nur zu, wenn sie glaubhaft machen, dass durch die Verschmelzung die Erfüllung ihrer Forderung gefährdet wird."
    },
    {
      "date": "2025-03-07",
      "id": "103138",
      "original_text": "Registerbekanntmachung nach dem Umwandlungsgesetz\nBayern Amtsgericht Landshut HRA 12759\nStefan Fränzl GmbH & Co. KG – Velden",
      "type": "Registerbekanntmachung nach dem Umwandlungsgesetz",
      "state": "Bayern",
      "amtsgericht": "Amtsgericht Landshut",
      "registernummer": "HRA 12759",
      "registerart": "HRA",
      "company_name": "Stefan Fränzl GmbH & Co. KG",
      "company_seat": "Velden",
      "details": "07.03.2025 (Bekanntmachungsdatum)\n\nBayern Amtsgericht Landshut HRA 12759\nRegisterbekanntmachung nach dem Umwandlungsgesetz 06.03.2025 (Eintragungsdatum)\n\nStefan Fränzl GmbH & Co. KG\nKommanditgesellschaft\nVelden\n\nDen Gläubigern der an der Ausgliederung beteiligten Rechtsträger ist, wenn sie binnen sechs Monaten nach dem Tag, an dem die Eintragung der Ausgliederung in das Register des Sitzes desjenigen Rechtsträgers, dessen Gläubiger sie sind, nach §§ 125, 19 Abs. 3 UmwG als bekannt gemacht gilt, ihren Anspruch nach Grund und Höhe in Textform anmelden, Sicherheit zu leisten, soweit sie nicht Befriedigung verlangen können. Dieses Recht steht den Gläubigern jedoch nur zu, wenn sie glaubhaft machen, dass durch die Ausgliederung die Erfüllung ihrer Forderung gefährdet wird."
    },
    {
      "date": "2025-03-07",
      "id": "103139",
      "original_text": "Löschungsankündigung\nBayern Amtsgericht Landshut HRB 11708\nSiass Tortenatelier UG (haftungsbeschränkt) – Landshut",
      "type": "Löschungsankündigung",
      "state": "Bayern",
      "amtsgericht": "Amtsgericht Landshut",
      "registernummer": "HRB 11708",
      "registerart": "HRB",
      "company_name": "Siass Tortenatelier UG (haftungsbeschränkt)",
      "company_seat": "Landshut",
      "details": "07.03.2025 (Bekanntmachungsdatum)\n\nBayern Amtsgericht Landshut HRB 11708\nLöschungsankündigung\n\nSiass Tortenatelier UG (haftungsbeschränkt)\nGesellschaft mit beschränkter Haftung\nLandshut\n\nDas Registergericht beabsichtigt, die im Handelsregister eingetragene Gesellschaft wegen Vermögenslosigkeit von Amts wegen nach § 394 FamFG zu löschen. Die Frist zur Erhebung eines Widerspruchs ist auf einen Monat festgesetzt."
    },
    {
      "date": "2025-03-07",
      "id": "103140",
      "original_text": "Löschungsankündigung\nBaden-Württemberg Amtsgericht Stuttgart HRB 747059\nFilderland Germany International Business & Service GmbH – Filderstadt",
      "type": "Löschungsankündigung",
      "state": "Baden-Württemberg",
      "amtsgericht": "Amtsgericht Stuttgart",
      "registernummer": "HRB 747059",
      "registerart": "HRB",
      "company_name": "Filderland Germany International Business & Service GmbH",
      "company_seat": "Filderstadt",
      "details": "07.03.2025 (Bekanntmachungsdatum)\n\nBaden-Württemberg Amtsgericht Stuttgart HRB 747059\nLöschungsankündigung\n\nFilderland Germany International Business & Service GmbH\nGesellschaft mit beschränkter Haftung\nFilderstadt\n\nAls nicht eingetragen wird bekanntgemacht:\nDas Gericht beabsichtigt, die Gesellschaft wegen Vermögenslosigkeit im Handelsregister von Amts wegen nach § 394 FamFG zu löschen. Die Frist zur Geltendmachung eines Widerspruchs gegen die beabsichtigte Löschung ist auf zwei Monate ab Veröffentlichung bestimmt."
    },
    {
      "date": "2025-03-07",
      "id": "103141",
      "original_text": "Löschungsankündigung\nBerlin Amtsgericht Berlin (Charlottenburg) HRB 169212\nCecia Beteiligungs UG (haftungsbeschränkt) – Berlin",
      "type": "Löschungsankündigung",
      "state": "Berlin",
      "amtsgericht": "Amtsgericht Berlin (Charlottenburg)",
      "registernummer": "HRB 169212",
      "registerart": "HRB",
      "company_name": "Cecia Beteiligungs UG (haftungsbeschränkt)",
      "company_seat": "Berlin",
      "details": "07.03.2025 (Bekanntmachungsdatum)\n\nBerlin Amtsgericht Berlin (Charlottenburg) HRB 169212\nLöschungsankündigung\n\nCecia Beteiligungs UG (haftungsbeschränkt)\nGesellschaft mit beschränkter Haftung\nBerlin\n\nBei der nachstehenden Gesellschaft wird das Amtslöschungsverfahren gemäß § 394 FamFG eingeleitet. Widerspruchsfrist 6 Wochen"
    },
    {
      "date": "2025-03-07",
      "id": "103142",
      "original_text": "Einreichung neuer Dokumente\nSachsen-Anhalt Amtsgericht Stendal HRB 16356\nKöthen Kultur und Marketing GmbH – Köthen (Anhalt)",
      "type": "Einreichung neuer Dokumente",
      "state": "Sachsen-Anhalt",
      "amtsgericht": "Amtsgericht Stendal",
      "registernummer": "HRB 16356",
      "registerart": "HRB",
      "company_name": "Köthen Kultur und Marketing GmbH",
      "company_seat": "Köthen (Anhalt)",
      "details": "07.03.2025 (Bekanntmachungsdatum)\n\nSachsen-Anhalt Amtsgericht Stendal HRB 16356\nEinreichung neuer Dokumente\n\nKöthen Kultur und Marketing GmbH\nGesellschaft mit beschränkter Haftung\nKöthen (Anhalt)\n\nEine Liste der Mitglieder des Aufsichtsrates wurde zum Handelsregister eingereicht."
    },
    {
      "date": "2025-03-07",
      "id": "103143",
      "original_text": "Sonstige Registerbekanntmachung\nHamburg Amtsgericht Hamburg HRB 73684\nVarengold Bank AG – Hamburg",
      "type": "Sonstige Registerbekanntmachung",
      "state": "Hamburg",
      "amtsgericht": "Amtsgericht Hamburg",
      "registernummer": "HRB 73684",
      "registerart": "HRB",
      "company_name": "Varengold Bank AG",
      "company_seat": "Hamburg",
      "details": "07.03.2025 (Bekanntmachungsdatum)\n\nHamburg Amtsgericht Hamburg HRB 73684\nSonstige Registerbekanntmachung\n\nVarengold Bank AG\nAktiengesellschaft\nHamburg\n\nAls nicht eingetragen wird bekannt gemacht: Liste des Aufsichtsrats wurde eingereicht."
    },
    {
      "date": "2025-03-07",
      "id": "103144",
      "original_text": "Löschungsankündigung\nBaden-Württemberg Amtsgericht Mannheim HRB 722212\nBH Bautenschutz UG (haftungsbeschränkt) – Mannheim",
      "type": "Löschungsankündigung",
      "state": "Baden-Württemberg",
      "amtsgericht": "Amtsgericht Mannheim",
      "registernummer": "HRB 722212",
      "registerart": "HRB",
      "company_name": "BH Bautenschutz UG (haftungsbeschränkt)",
      "company_seat": "Mannheim",
      "details": "07.03.2025 (Bekanntmachungsdatum)\n\nBaden-Württemberg Amtsgericht Mannheim HRB 722212\nLöschungsankündigung 07.03.2025 (Eintragungsdatum)\n\nBH Bautenschutz UG (haftungsbeschränkt)\nGesellschaft mit beschränkter Haftung\nMannheim\n\nDas Gericht beabsichtigt, die Gesellschaft wegen Vermögenslosigkeit im Handelsregister von Amts wegen nach § 394 FamFG zu löschen. Die Frist zur Geltendmachung eines Widerspruchs gegen die beabsichtigte Löschung ist auf einen Monat ab Veröffentlichung bestimmt."
    },
    {
      "date": "2025-03-07",
      "id": "103145",
      "original_text": "Registerbekanntmachung nach dem Umwandlungsgesetz\nBaden-Württemberg Amtsgericht Freiburg HRB 720788\nVINO Software GmbH – Emmendingen",
      "type": "Registerbekanntmachung nach dem Umwandlungsgesetz",
      "state": "Baden-Württemberg",
      "amtsgericht": "Amtsgericht Freiburg",
      "registernummer": "HRB 720788",
      "registerart": "HRB",
      "company_name": "VINO Software GmbH",
      "company_seat": "Emmendingen",
      "details": "07.03.2025 (Bekanntmachungsdatum)\n\nBaden-Württemberg Amtsgericht Freiburg HRB 720788\nRegisterbekanntmachung nach dem Umwandlungsgesetz 07.03.2025 (Eintragungsdatum)\n\nVINO Software GmbH\nGesellschaft mit beschränkter Haftung\nEmmendingen\n\nAls nicht eingetragen wird bekanntgemacht:\nDen Gläubigern der an der Verschmelzung beteiligten Rechtsträger ist, wenn sie binnen sechs Monaten nach dem Tag, an dem die Eintragung der Verschmelzung in das Register des Sitzes desjenigen Rechtsträgers, dessen Gläubiger sie sind, nach § 19 Abs. 3 UmwG als bekanntgemacht gilt, ihren Anspruch nach Grund und Höhe schriftlich anmelden, Sicherheit zu leisten, soweit sie nicht Befriedigung verlangen können. Dieses Recht steht den Gläubigern jedoch nur zu, wenn sie glaubhaft machen, dass durch die Verschmelzung die Erfüllung ihrer Forderung gefährdet wird."
    },
    {
      "date": "2025-03-07",
      "id": "103146",
      "original_text": "Registerbekanntmachung nach dem Umwandlungsgesetz\nBaden-Württemberg Amtsgericht Freiburg HRB 261165\nWeinmann Business Solutions GmbH – Emmendingen",
      "type": "Registerbekanntmachung nach dem Umwandlungsgesetz",
      "state": "Baden-Württemberg",
      "amtsgericht": "Amtsgericht Freiburg",
      "registernummer": "HRB 261165",
      "registerart": "HRB",
      "company_name": "Weinmann Business Solutions GmbH",
      "company_seat": "Emmendingen",
      "details": "07.03.2025 (Bekanntmachungsdatum)\n\nBaden-Württemberg Amtsgericht Freiburg HRB 261165\nRegisterbekanntmachung nach dem Umwandlungsgesetz 07.03.2025 (Eintragungsdatum)\n\nWeinmann Business Solutions GmbH\nGesellschaft mit beschränkter Haftung\nEmmendingen\n\nAls nicht eingetragen wird bekanntgemacht:\nDen Gläubigern der an der Verschmelzung beteiligten Rechtsträger ist, wenn sie binnen sechs Monaten nach dem Tag, an dem die Eintragung der Verschmelzung in das Register des Sitzes desjenigen Rechtsträgers, dessen Gläubiger sie sind, nach § 19 Abs. 3 UmwG als bekanntgemacht gilt, ihren Anspruch nach Grund und Höhe schriftlich anmelden, Sicherheit zu leisten, soweit sie nicht Befriedigung verlangen können. Dieses Recht steht den Gläubigern jedoch nur zu, wenn sie glaubhaft machen, dass durch die Verschmelzung die Erfüllung ihrer Forderung gefährdet wird."
    },
    {
      "date": "2025-03-07",
      "id": "103147",
      "original_text": "Löschungsankündigung\nBerlin Amtsgericht Berlin (Charlottenburg) HRB 180441\nACHEM GERMANY GmbH – Berlin",
      "type": "Löschungsankündigung",
      "state": "Berlin",
      "amtsgericht": "Amtsgericht Berlin (Charlottenburg)",
      "registernummer": "HRB 180441",
      "registerart": "HRB",
      "company_name": "ACHEM GERMANY GmbH",
      "company_seat": "Berlin",
      "details": "07.03.2025 (Bekanntmachungsdatum)\n\nBerlin Amtsgericht Berlin (Charlottenburg) HRB 180441\nLöschungsankündigung\n\nACHEM GERMANY GmbH\nGesellschaft mit beschränkter Haftung\nBerlin\n\nBei der nachstehenden Gesellschaft wird das Amtslöschungsverfahren gemäß § 394 FamFG eingeleitet. Widerspruchsfrist 6 Wochen"
    },
    {
      "date": "2025-03-07",
      "id": "103148",
      "original_text": "Registerbekanntmachung nach dem Umwandlungsgesetz\nBaden-Württemberg Amtsgericht Mannheim HRB 103631\nTria Technologies GmbH – Stutensee",
      "type": "Registerbekanntmachung nach dem Umwandlungsgesetz",
      "state": "Baden-Württemberg",
      "amtsgericht": "Amtsgericht Mannheim",
      "registernummer": "HRB 103631",
      "registerart": "HRB",
      "company_name": "Tria Technologies GmbH",
      "company_seat": "Stutensee",
      "details": "07.03.2025 (Bekanntmachungsdatum)\n\nBaden-Württemberg Amtsgericht Mannheim HRB 103631\nRegisterbekanntmachung nach dem Umwandlungsgesetz 07.03.2025 (Eintragungsdatum)\n\nTria Technologies GmbH\nGesellschaft mit beschränkter Haftung\nStutensee\n\nAls nicht eingetragen wird bekanntgemacht:\nDen Gläubigern der an der Verschmelzung beteiligten Rechtsträger ist, wenn sie binnen sechs Monaten nach dem Tag, an dem die Eintragung der Verschmelzung in das Register des Sitzes desjenigen Rechtsträgers, dessen Gläubiger sie sind, nach § 19 Abs. 3 UmwG als bekanntgemacht gilt, ihren Anspruch nach Grund und Höhe schriftlich anmelden, Sicherheit zu leisten, soweit sie nicht Befriedigung verlangen können. Dieses Recht steht den Gläubigern jedoch nur zu, wenn sie glaubhaft machen, dass durch die Verschmelzung die Erfüllung ihrer Forderung gefährdet wird."
    },
    {
      "date": "2025-03-07",
      "id": "103149",
      "original_text": "Löschungsankündigung\nBaden-Württemberg Amtsgericht Stuttgart HRB 773868\nDisplay Union UG (haftungsbeschränkt) – Steinheim an der Murr",
      "type": "Löschungsankündigung",
      "state": "Baden-Württemberg",
      "amtsgericht": "Amtsgericht Stuttgart",
      "registernummer": "HRB 773868",
      "registerart": "HRB",
      "company_name": "Display Union UG (haftungsbeschränkt)",
      "company_seat": "Steinheim an der Murr",
      "details": "07.03.2025 (Bekanntmachungsdatum)\n\nBaden-Württemberg Amtsgericht Stuttgart HRB 773868\nLöschungsankündigung\n\nDisplay Union UG (haftungsbeschränkt)\nGesellschaft mit beschränkter Haftung\nSteinheim an der Murr\n\nDas Gericht beabsichtigt, die Gesellschaft wegen Vermögenslosigkeit im Handelsregister von Amts wegen nach § 394 FamFG zu löschen. Die Frist zur Geltendmachung eines Widerspruchs gegen die beabsichtigte Löschung ist auf zwei Monate ab Veröffentlichung bestimmt."
    },
    {
      "date": "2025-03-07",
      "id": "103150",
      "original_text": "Registerbekanntmachung nach dem Umwandlungsgesetz\nHamburg Amtsgericht Hamburg HRB 189926\nBiesterfeld SE – Hamburg",
      "type": "Registerbekanntmachung nach dem Umwandlungsgesetz",
      "state": "Hamburg",
      "amtsgericht": "Amtsgericht Hamburg",
      "registernummer": "HRB 189926",
      "registerart": "HRB",
      "company_name": "Biesterfeld SE",
      "company_seat": "Hamburg",
      "details": "07.03.2025 (Bekanntmachungsdatum)\n\nHamburg Amtsgericht Hamburg HRB 189926\nRegisterbekanntmachung nach dem Umwandlungsgesetz 07.03.2025 (Eintragungsdatum)\n\nBiesterfeld SE\nEuropäische Aktiengesellschaft (SE)\nHamburg\n\nAls nicht eingetragen wird bekanntgemacht:\nDie Gesellschaft hat den Entwurf eines Verschmelzungsvertrages mit der BIT-SERV GmbH mit Sitz in Hamburg (Amtsgericht Hamburg,  HRB 76432 - übertragender Rechsträger) zum Handelsregister eingereicht.\nAuf die eingereichten Unterlagen wird verwiesen."
    },
    {
      "date": "2025-03-07",
      "id": "103151",
      "original_text": "Registerbekanntmachung nach dem Umwandlungsgesetz\nHamburg Amtsgericht Hamburg HRB 189926\nBiesterfeld SE – Hamburg",
      "type": "Registerbekanntmachung nach dem Umwandlungsgesetz",
      "state": "Hamburg",
      "amtsgericht": "Amtsgericht Hamburg",
      "registernummer": "HRB 189926",
      "registerart": "HRB",
      "company_name": "Biesterfeld SE",
      "company_seat": "Hamburg",
      "details": "07.03.2025 (Bekanntmachungsdatum)\n\nHamburg Amtsgericht Hamburg HRB 189926\nRegisterbekanntmachung nach dem Umwandlungsgesetz 07.03.2025 (Eintragungsdatum)\n\nBiesterfeld SE\nEuropäische Aktiengesellschaft (SE)\nHamburg\n\nAls nicht eingetragen wird bekanntgemacht:\nDie Gesellschaft hat den Entwurf eines Verschmelzungsvertrages mit der Biesterfeld ChemLogS GmbH mit Sitz in Hamburg (Amtsgericht Hamburg, HRB 102258 - übertragender Rechsträger) zum Handelsregister eingereicht.\nAuf die eingereichten Unterlagen wird verwiesen."
    },
    {
      "date": "2025-03-07",
      "id": "103152",
      "original_text": "Registerbekanntmachung nach dem Umwandlungsgesetz\nBaden-Württemberg Amtsgericht Stuttgart HRB 798847\nobjektfabrik GmbH – Ludwigsburg",
      "type": "Registerbekanntmachung nach dem Umwandlungsgesetz",
      "state": "Baden-Württemberg",
      "amtsgericht": "Amtsgericht Stuttgart",
      "registernummer": "HRB 798847",
      "registerart": "HRB",
      "company_name": "objektfabrik GmbH",
      "company_seat": "Ludwigsburg",
      "details": "07.03.2025 (Bekanntmachungsdatum)\n\nBaden-Württemberg Amtsgericht Stuttgart HRB 798847\nRegisterbekanntmachung nach dem Umwandlungsgesetz 07.03.2025 (Eintragungsdatum)\n\nobjektfabrik GmbH\nGesellschaft mit beschränkter Haftung\nLudwigsburg\n\nAls nicht eingetragen wird bekanntgemacht:\nDen Gläubigern der an der Ausgliederung beteiligten Rechtsträger ist, wenn sie binnen sechs Monaten nach dem Tag, an dem die Eintragung der Ausgliederung in das Register des Sitzes desjenigen Rechtsträgers, dessen Gläubiger sie sind, nach § 19 Abs. 3 UmwG als bekanntgemacht gilt, ihren Anspruch nach Grund und Höhe schriftlich anmelden, Sicherheit zu leisten, soweit sie nicht Befriedigung verlangen können. Dieses Recht steht den Gläubigern jedoch nur zu, wenn sie glaubhaft machen, dass durch die Ausgliederung die Erfüllung ihrer Forderung gefährdet wird."
    },
    {
      "date": "2025-03-07",
      "id": "103153",
      "original_text": "Registerbekanntmachung nach dem Umwandlungsgesetz\nBaden-Württemberg Amtsgericht Stuttgart HRB 755850\nRettenmaier Spedition GmbH – Tuttlingen",
      "type": "Registerbekanntmachung nach dem Umwandlungsgesetz",
      "state": "Baden-Württemberg",
      "amtsgericht": "Amtsgericht Stuttgart",
      "registernummer": "HRB 755850",
      "registerart": "HRB",
      "company_name": "Rettenmaier Spedition GmbH",
      "company_seat": "Tuttlingen",
      "details": "07.03.2025 (Bekanntmachungsdatum)\n\nBaden-Württemberg Amtsgericht Stuttgart HRB 755850\nRegisterbekanntmachung nach dem Umwandlungsgesetz 25.02.2025 (Eintragungsdatum)\n\nRettenmaier Spedition GmbH\nGesellschaft mit beschränkter Haftung\nTuttlingen\n\nAls nicht eingetragen wird bekanntgemacht:\nDen Gläubigern der an der Verschmelzung beteiligten Rechtsträger ist, wenn sie binnen sechs Monaten nach dem Tag, an dem die Eintragung der Verschmelzung in das Register des Sitzes desjenigen Rechtsträgers, dessen Gläubiger sie sind, nach § 19 Abs. 3 UmwG als bekanntgemacht gilt, ihren Anspruch nach Grund und Höhe schriftlich anmelden, Sicherheit zu leisten, soweit sie nicht Befriedigung verlangen können. Dieses Recht steht den Gläubigern jedoch nur zu, wenn sie glaubhaft machen, dass durch die Verschmelzung die Erfüllung ihrer Forderung gefährdet wird."
    },
    {
      "date": "2025-03-07",
      "id": "103154",
      "original_text": "Einreichung neuer Dokumente\nBaden-Württemberg Amtsgericht Freiburg HRB 300584\nHELIOS Kliniken Breisgau- Hochschwarzwald GmbH – Müllheim",
      "type": "Einreichung neuer Dokumente",
      "state": "Baden-Württemberg",
      "amtsgericht": "Amtsgericht Freiburg",
      "registernummer": "HRB 300584",
      "registerart": "HRB",
      "company_name": "HELIOS Kliniken Breisgau- Hochschwarzwald GmbH",
      "company_seat": "Müllheim",
      "details": "07.03.2025 (Bekanntmachungsdatum)\n\nBaden-Württemberg Amtsgericht Freiburg HRB 300584\nEinreichung neuer Dokumente 07.03.2025 (Eintragungsdatum)\n\nHELIOS Kliniken Breisgau- Hochschwarzwald GmbH\nGesellschaft mit beschränkter Haftung\nMüllheim\n\nDie Gesellschaft hat am 27.02.2025 die Liste über die Zusammensetzung des Aufsichtsrats zum Handelsregister eingereicht."
    },
    {
      "date": "2025-03-07",
      "id": "103155",
      "original_text": "Registerbekanntmachung nach dem Umwandlungsgesetz\nSchleswig-Holstein Amtsgericht Kiel HRA 1070\nMöbel Rixen e. K. – Kiel",
      "type": "Registerbekanntmachung nach dem Umwandlungsgesetz",
      "state": "Schleswig-Holstein",
      "amtsgericht": "Amtsgericht Kiel",
      "registernummer": "HRA 1070",
      "registerart": "HRA",
      "company_name": "Möbel Rixen e. K.",
      "company_seat": "Kiel",
      "details": "07.03.2025 (Bekanntmachungsdatum)\n\nSchleswig-Holstein Amtsgericht Kiel HRA 1070\nRegisterbekanntmachung nach dem Umwandlungsgesetz 07.03.2025 (Eintragungsdatum)\n\nMöbel Rixen e. K.\nEinzelkaufmann / Einzelkauffrau\nKiel\n\nZu Eintragungsnummer 7 vom 07.03.2025 wird als nicht eingetragen veröffentlicht: Den Gläubigern der an der Spaltung beteiligten Rechtsträger ist, wenn sie binnen sechs Monaten nach dem Tag, an dem die Eintragung der Spaltung in das Register des Sitzes desjenigen Rechtsträgers, dessen Gläubiger sie sind,  bekannt gemacht worden ist, ihren Anspruch nach Grund und Höhe schriftlich anmelden, Sicherheit zu leisten, soweit sie nicht Befriedigung verlangen können. Dieses Recht steht den Gläubigern jedoch nur zu, wenn sie glaubhaft machen, dass durch die Spaltung die Erfüllung ihrer Forderung gefährdet wird."
    },
    {
      "date": "2025-03-07",
      "id": "103156",
      "original_text": "Einreichung neuer Dokumente\nThüringen Amtsgericht Jena HRB 201250\nGWB \"Elstertal\" Geraer Wohnungsbaugesellschaft mbH – Gera",
      "type": "Einreichung neuer Dokumente",
      "state": "Thüringen",
      "amtsgericht": "Amtsgericht Jena",
      "registernummer": "HRB 201250",
      "registerart": "HRB",
      "company_name": "GWB \"Elstertal\" Geraer Wohnungsbaugesellschaft mbH",
      "company_seat": "Gera",
      "details": "07.03.2025 (Bekanntmachungsdatum)\n\nThüringen Amtsgericht Jena HRB 201250\nEinreichung neuer Dokumente\n\nGWB \"Elstertal\" Geraer Wohnungsbaugesellschaft mbH\nGesellschaft mit beschränkter Haftung\nGera\n\nBekanntmachung gem. § 52 Abs. 3 Satz 2 GmbHG: Aufgrund einer Veränderung in den Personen der Aufsichtsratsmitglieder ist durch die Geschäftsführer eine neue Liste zum Handelsregister eingereicht worden."
    },
    {
      "date": "2025-03-07",
      "id": "103157",
      "original_text": "Registerbekanntmachung nach dem Umwandlungsgesetz\nSchleswig-Holstein Amtsgericht Lübeck HRB 25949\nPeter Bendig Versicherungen GmbH – Barsbüttel",
      "type": "Registerbekanntmachung nach dem Umwandlungsgesetz",
      "state": "Schleswig-Holstein",
      "amtsgericht": "Amtsgericht Lübeck",
      "registernummer": "HRB 25949",
      "registerart": "HRB",
      "company_name": "Peter Bendig Versicherungen GmbH",
      "company_seat": "Barsbüttel",
      "details": "07.03.2025 (Bekanntmachungsdatum)\n\nSchleswig-Holstein Amtsgericht Lübeck HRB 25949\nRegisterbekanntmachung nach dem Umwandlungsgesetz 06.03.2025 (Eintragungsdatum)\n\nPeter Bendig Versicherungen GmbH\nGesellschaft mit beschränkter Haftung\nBarsbüttel\n\nZu Eintragungsnummer 1 vom 06.03.2025 wird als nicht eingetragen veröffentlicht: Den Gläubigern ist, wenn sie binnen sechs Monaten nach dem Tag, an dem die Eintragung der Umwandlung als bekannt gemacht gilt, ihren Anspruch nach Grund und Höhe schriftlich anmelden, Sicherheit zu leisten, soweit sie nicht Befriedigung verlangen können. Dieses Recht steht den Gläubigern jedoch nur zu, wenn sie glaubhaft machen, dass durch die Umwandlung die Erfüllung ihrer Forderung gefährdet wird."
    },
    {
      "date": "2025-03-07",
      "id": "103158",
      "original_text": "Löschungsankündigung\nHamburg Amtsgericht Hamburg VR 23468\nYESILÇAM Deutsch-Türkischer Kulturverein e.V. – Hamburg",
      "type": "Löschungsankündigung",
      "state": "Hamburg",
      "amtsgericht": "Amtsgericht Hamburg",
      "registernummer": "VR 23468",
      "registerart": "VR",
      "company_name": "YESILÇAM Deutsch-Türkischer Kulturverein e.V.",
      "company_seat": "Hamburg",
      "details": "07.03.2025 (Bekanntmachungsdatum)\n\nHamburg Amtsgericht Hamburg VR 23468\nLöschungsankündigung\n\nYESILÇAM Deutsch-Türkischer Kulturverein e.V.\neingetragener Verein\nHamburg\n\nDas Registergericht beabsichtigt, den im Vereinsregister eingetragenen Verein von Amts wegen nach § 395 FamFG, § 4 Abs. 2 S. 2 Ziff. 1 VRV zu löschen, da nach den angestellten Ermittlungen dieser Verein offenbar nach Wegfall sämtlicher Mitglieder nicht mehr besteht. Die Frist zur Erhebung eines Widerspruchs gegen die beabsichtigte Löschung wird auf 3 Monate festgesetzt."
    },
    {
      "date": "2025-03-07",
      "id": "103159",
      "original_text": "Löschungsankündigung\nHamburg Amtsgericht Hamburg VR 22170\nBundesverband Internetmedizin e.V. – Hamburg",
      "type": "Löschungsankündigung",
      "state": "Hamburg",
      "amtsgericht": "Amtsgericht Hamburg",
      "registernummer": "VR 22170",
      "registerart": "VR",
      "company_name": "Bundesverband Internetmedizin e.V.",
      "company_seat": "Hamburg",
      "details": "07.03.2025 (Bekanntmachungsdatum)\n\nHamburg Amtsgericht Hamburg VR 22170\nLöschungsankündigung\n\nBundesverband Internetmedizin e.V.\neingetragener Verein\nHamburg\n\nDas Registergericht beabsichtigt, den im Vereinsregister eingetragenen Verein von Amts wegen nach § 395 FamFG, § 4 Abs. 2 S. 2 Ziff. 1 VRV zu löschen, da nach den angestellten Ermittlungen dieser Verein offenbar nach Wegfall sämtlicher Mitglieder nicht mehr besteht. Die Frist zur Erhebung eines Widerspruchs gegen die beabsichtigte Löschung wird auf 3 Monate festgesetzt."
    },
    {
      "date": "2025-03-07",
      "id": "103160",
      "original_text": "Registerbekanntmachung nach dem Umwandlungsgesetz\nNordrhein-Westfalen Amtsgericht Coesfeld HRB 4395\nChange Culture Consultants AG – Raesfeld",
      "type": "Registerbekanntmachung nach dem Umwandlungsgesetz",
      "state": "Nordrhein-Westfalen",
      "amtsgericht": "Amtsgericht Coesfeld",
      "registernummer": "HRB 4395",
      "registerart": "HRB",
      "company_name": "Change Culture Consultants AG",
      "company_seat": "Raesfeld",
      "details": "07.03.2025 (Bekanntmachungsdatum)\n\nNordrhein-Westfalen Amtsgericht Coesfeld HRB 4395\nRegisterbekanntmachung nach dem Umwandlungsgesetz 07.03.2025 (Eintragungsdatum)\n\nChange Culture Consultants AG\nAktiengesellschaft\nRaesfeld\n\nDen Gläubigern der an der Verschmelzung beteiligten Rechtsträger ist, wenn sie binnen sechs Monaten nach dem Tag, an dem die Eintragung der Verschmelzung in das Register des Sitzes desjenigen Rechtsträgers, dessen Gläubiger sie sind, nach § 19 Absatz 3 UmwG als bekanntgemacht gilt, ihren Anspruch nach Grund und Höhe schriftlich anmelden, Sicherheit zu leisten, soweit sie nicht Befriedigung verlangen können. Dieses Recht steht den Gläubigern jedoch nur zu, wenn sie glaubhaft machen, dass durch die Verschmelzung die Erfüllung ihrer Forderung gefährdet wird."
    },
    {
      "date": "2025-03-07",
      "id": "103161",
      "original_text": "Registerbekanntmachung nach dem Umwandlungsgesetz\nSchleswig-Holstein Amtsgericht Lübeck HRB 19775\nZK Methfesselstraße 3 GmbH – Oststeinbek",
      "type": "Registerbekanntmachung nach dem Umwandlungsgesetz",
      "state": "Schleswig-Holstein",
      "amtsgericht": "Amtsgericht Lübeck",
      "registernummer": "HRB 19775",
      "registerart": "HRB",
      "company_name": "ZK Methfesselstraße 3 GmbH",
      "company_seat": "Oststeinbek",
      "details": "07.03.2025 (Bekanntmachungsdatum)\n\nSchleswig-Holstein Amtsgericht Lübeck HRB 19775\nRegisterbekanntmachung nach dem Umwandlungsgesetz 06.03.2025 (Eintragungsdatum)\n\nZK Methfesselstraße 3 GmbH\nGesellschaft mit beschränkter Haftung\nOststeinbek\n\nZu Eintragungsnummer 3 vom 06.03.2025 wird als nicht eingetragen veröffentlicht: Den Gläubigern der an der Verschmelzung beteiligten Rechtsträger ist, wenn sie binnen sechs Monaten nach dem Tag, an dem die Eintragung der Verschmelzung in das Register des Sitzes desjenigen Rechtsträgers, dessen Gläubiger sie sind, als bekannt gemacht gilt, ihren Anspruch nach Grund und Höhe schriftlich anmelden, Sicherheit zu leisten, soweit sie nicht Befriedigung verlangen können. Dieses Recht steht den Gläubigern jedoch nur zu, wenn sie glaubhaft machen, dass durch die Verschmelzung die Erfüllung ihrer Forderung gefährdet wird."
    },
    {
      "date": "2025-03-07",
      "id": "103162",
      "original_text": "Registerbekanntmachung nach dem Umwandlungsgesetz\nBaden-Württemberg Amtsgericht Stuttgart HRB 460757\nKACO ELEKTROTECHNIK GmbH – Aldingen",
      "type": "Registerbekanntmachung nach dem Umwandlungsgesetz",
      "state": "Baden-Württemberg",
      "amtsgericht": "Amtsgericht Stuttgart",
      "registernummer": "HRB 460757",
      "registerart": "HRB",
      "company_name": "KACO ELEKTROTECHNIK GmbH",
      "company_seat": "Aldingen",
      "details": "07.03.2025 (Bekanntmachungsdatum)\n\nBaden-Württemberg Amtsgericht Stuttgart HRB 460757\nRegisterbekanntmachung nach dem Umwandlungsgesetz 07.03.2025 (Eintragungsdatum)\n\nKACO ELEKTROTECHNIK GmbH\nGesellschaft mit beschränkter Haftung\nAldingen\n\nAls nicht eingetragen wird bekanntgemacht:\nDen Gläubigern der an der Verschmelzung beteiligten Rechtsträger ist, wenn sie binnen sechs Monaten nach dem Tag, an dem die Eintragung der Verschmelzung in das Register des Sitzes desjenigen Rechtsträgers, dessen Gläubiger sie sind, nach § 19 Abs. 3 UmwG als bekanntgemacht gilt, ihren Anspruch nach Grund und Höhe schriftlich anmelden, Sicherheit zu leisten, soweit sie nicht Befriedigung verlangen können. Dieses Recht steht den Gläubigern jedoch nur zu, wenn sie glaubhaft machen, dass durch die Verschmelzung die Erfüllung ihrer Forderung gefährdet wird."
    },
    {
      "date": "2025-03-07",
      "id": "103163",
      "original_text": "Einreichung neuer Dokumente\nBaden-Württemberg Amtsgericht Freiburg HRB 703073\nJobRad GmbH – Freiburg im Breisgau",
      "type": "Einreichung neuer Dokumente",
      "state": "Baden-Württemberg",
      "amtsgericht": "Amtsgericht Freiburg",
      "registernummer": "HRB 703073",
      "registerart": "HRB",
      "company_name": "JobRad GmbH",
      "company_seat": "Freiburg im Breisgau",
      "details": "07.03.2025 (Bekanntmachungsdatum)\n\nBaden-Württemberg Amtsgericht Freiburg HRB 703073\nEinreichung neuer Dokumente\n\nJobRad GmbH\nGesellschaft mit beschränkter Haftung\nFreiburg im Breisgau\n\nDie Gesellschaft hat am 25.02.2025 die Liste über die Zusammensetzung des Aufsichtsrats zum Handelsregister eingereicht."
    },
    {
      "date": "2025-03-07",
      "id": "103164",
      "original_text": "Löschungsankündigung\nBerlin Amtsgericht Berlin (Charlottenburg) HRB 126913\nLuSoHe - Gesellschaft für Projektentwicklung mbH – Berlin",
      "type": "Löschungsankündigung",
      "state": "Berlin",
      "amtsgericht": "Amtsgericht Berlin (Charlottenburg)",
      "registernummer": "HRB 126913",
      "registerart": "HRB",
      "company_name": "LuSoHe - Gesellschaft für Projektentwicklung mbH",
      "company_seat": "Berlin",
      "details": "07.03.2025 (Bekanntmachungsdatum)\n\nBerlin Amtsgericht Berlin (Charlottenburg) HRB 126913\nLöschungsankündigung\n\nLuSoHe - Gesellschaft für Projektentwicklung mbH\nGesellschaft mit beschränkter Haftung\nBerlin\n\nBei der nachstehenden Gesellschaft wird das Amtslöschungsverfahren gemäß § 394 FamFG eingeleitet. Widerspruchsfrist 6 Wochen"
    },
    {
      "date": "2025-03-07",
      "id": "103165",
      "original_text": "Löschungsankündigung\nBerlin Amtsgericht Berlin (Charlottenburg) HRB 268406\nDidier&Riff Globale Handelsgesellschaft UG (haftungsbeschränkt) – Berlin",
      "type": "Löschungsankündigung",
      "state": "Berlin",
      "amtsgericht": "Amtsgericht Berlin (Charlottenburg)",
      "registernummer": "HRB 268406",
      "registerart": "HRB",
      "company_name": "Didier&Riff Globale Handelsgesellschaft UG (haftungsbeschränkt)",
      "company_seat": "Berlin",
      "details": "07.03.2025 (Bekanntmachungsdatum)\n\nBerlin Amtsgericht Berlin (Charlottenburg) HRB 268406\nLöschungsankündigung\n\nDidier&Riff Globale Handelsgesellschaft UG (haftungsbeschränkt)\nGesellschaft mit beschränkter Haftung\nBerlin\n\nBei der nachstehenden Gesellschaft wird das Amtslöschungsverfahren gemäß § 394 FamFG eingeleitet. Widerspruchsfrist 6 Wochen"
    },
    {
      "date": "2025-03-07",
      "id": "103166",
      "original_text": "Löschungsankündigung\nBaden-Württemberg Amtsgericht Stuttgart HRB 360520\nWG Wohn- und Geschäftsbauten GmbH – Dettingen an der Erms",
      "type": "Löschungsankündigung",
      "state": "Baden-Württemberg",
      "amtsgericht": "Amtsgericht Stuttgart",
      "registernummer": "HRB 360520",
      "registerart": "HRB",
      "company_name": "WG Wohn- und Geschäftsbauten GmbH",
      "company_seat": "Dettingen an der Erms",
      "details": "07.03.2025 (Bekanntmachungsdatum)\n\nBaden-Württemberg Amtsgericht Stuttgart HRB 360520\nLöschungsankündigung\n\nWG Wohn- und Geschäftsbauten GmbH\nGesellschaft mit beschränkter Haftung\nDettingen an der Erms\n\nAls nicht eingetragen wird bekanntgemacht:\nDas Gericht beabsichtigt, die Gesellschaft wegen Vermögenslosigkeit im Handelsregister von Amts wegen nach § 394 FamFG zu löschen. Die Frist zur Geltendmachung eines Widerspruchs gegen die beabsichtigte Löschung ist auf zwei Monate ab Veröffentlichung bestimmt."
    },
    {
      "date": "2025-03-07",
      "id": "103167",
      "original_text": "Sonstige Registerbekanntmachung\nBerlin Amtsgericht Berlin (Charlottenburg) HRB 195152\nStayClean Grundbesitz GmbH – Berlin",
      "type": "Sonstige Registerbekanntmachung",
      "state": "Berlin",
      "amtsgericht": "Amtsgericht Berlin (Charlottenburg)",
      "registernummer": "HRB 195152",
      "registerart": "HRB",
      "company_name": "StayClean Grundbesitz GmbH",
      "company_seat": "Berlin",
      "details": "07.03.2025 (Bekanntmachungsdatum)\n\nBerlin Amtsgericht Berlin (Charlottenburg) HRB 195152\nSonstige Registerbekanntmachung\n\nStayClean Grundbesitz GmbH\nGesellschaft mit beschränkter Haftung\nBerlin\n\nAls nicht eingetragen wird veröffentlicht: Der andere Vertragsteil hat den Gläubigern dieses Rechtsträgers, deren Forderungen begründet worden sind, bevor die Eintragung der Beendigung dieses Vertrages in das Handelsregister nach § 10 des Handelsgesetzbuches als bekannt gemacht gilt, Sicherheit zu leisten, wenn sie sich binnen sechs Monaten nach der Bekanntmachung der Eintragung zu diesem Zweck bei ihm melden. Dieses Recht steht den Gläubigern nicht zu, die im Fall des Insolvenzverfahrens ein Recht auf vorzugsweise Befriedigung aus der Deckungsmasse haben, die nach gesetzlicher Vorschrift zu ihrem Schutz errichtet und staatlich überwacht ist."
    },
    {
      "date": "2025-03-07",
      "id": "103168",
      "original_text": "Registerbekanntmachung nach dem Umwandlungsgesetz\nBaden-Württemberg Amtsgericht Stuttgart HRB 401197\nAlbstadtwerke GmbH – Albstadt",
      "type": "Registerbekanntmachung nach dem Umwandlungsgesetz",
      "state": "Baden-Württemberg",
      "amtsgericht": "Amtsgericht Stuttgart",
      "registernummer": "HRB 401197",
      "registerart": "HRB",
      "company_name": "Albstadtwerke GmbH",
      "company_seat": "Albstadt",
      "details": "07.03.2025 (Bekanntmachungsdatum)\n\nBaden-Württemberg Amtsgericht Stuttgart HRB 401197\nRegisterbekanntmachung nach dem Umwandlungsgesetz 07.03.2025 (Eintragungsdatum)\n\nAlbstadtwerke GmbH\nGesellschaft mit beschränkter Haftung\nAlbstadt\n\nDen Gläubigern der an der Verschmelzung beteiligten Rechtsträger ist, wenn sie binnen sechs Monaten nach dem Tag, an dem die Eintragung der Verschmelzung in das Register des Sitzes desjenigen Rechtsträgers, dessen Gläubiger sie sind, nach § 19 Abs. 3 UmwG als bekanntgemacht gilt, ihren Anspruch nach Grund und Höhe schriftlich anmelden, Sicherheit zu leisten, soweit sie nicht Befriedigung verlangen können. Dieses Recht steht den Gläubigern jedoch nur zu, wenn sie glaubhaft machen, dass durch die Verschmelzung die Erfüllung ihrer Forderung gefährdet wird."
    },
    {
      "date": "2025-03-07",
      "id": "103169",
      "original_text": "Registerbekanntmachung nach dem Umwandlungsgesetz\nSchleswig-Holstein Amtsgericht Lübeck HRA 1360 RE\nPeter Bendig & Co. Versicherungen KG – Barsbüttel",
      "type": "Registerbekanntmachung nach dem Umwandlungsgesetz",
      "state": "Schleswig-Holstein",
      "amtsgericht": "Amtsgericht Lübeck",
      "registernummer": "HRA 1360 RE",
      "registerart": "HRA",
      "company_name": "Peter Bendig & Co. Versicherungen KG",
      "company_seat": "Barsbüttel",
      "details": "07.03.2025 (Bekanntmachungsdatum)\n\nSchleswig-Holstein Amtsgericht Lübeck HRA 1360 RE\nRegisterbekanntmachung nach dem Umwandlungsgesetz 06.03.2025 (Eintragungsdatum)\n\nPeter Bendig & Co. Versicherungen KG\nKommanditgesellschaft\nBarsbüttel\n\nZu Eintragungsnummer 8 vom 06.03.2025 wird als nicht eingetragen veröffentlicht:\nAls nicht eingetragen wird veröffentlicht: Den Gläubigern ist, wenn sie binnen sechs Monaten nach dem Tag, an dem die Eintragung der Umwandlung als bekannt gemacht gilt, ihren Anspruch nach Grund und Höhe schriftlich anmelden, Sicherheit zu leisten, soweit sie nicht Befriedigung verlangen können. Dieses Recht steht den Gläubigern jedoch nur zu, wenn sie glaubhaft machen, dass durch die Umwandlung die Erfüllung ihrer Forderung gefährdet wird."
    },
    {
      "date": "2025-03-07",
      "id": "103170",
      "original_text": "Registerbekanntmachung nach dem Umwandlungsgesetz\nHamburg Amtsgericht Hamburg HRB 98971\nCEE Holding S.à r.l. & Co. KGaA – Hamburg",
      "type": "Registerbekanntmachung nach dem Umwandlungsgesetz",
      "state": "Hamburg",
      "amtsgericht": "Amtsgericht Hamburg",
      "registernummer": "HRB 98971",
      "registerart": "HRB",
      "company_name": "CEE Holding S.à r.l. & Co. KGaA",
      "company_seat": "Hamburg",
      "details": "07.03.2025 (Bekanntmachungsdatum)\n\nHamburg Amtsgericht Hamburg HRB 98971\nRegisterbekanntmachung nach dem Umwandlungsgesetz 07.03.2025 (Eintragungsdatum)\n\nCEE Holding S.à r.l. & Co. KGaA\nKommanditgesellschaft auf Aktien\nHamburg\n\nAls nicht eingetragen wird bekanntgemacht:\nEs wird darauf hingewiesen, dass Entwurf eines Verschmelzungsplan über eine grenzüberschreitende Verschmelzung zur Aufnahme mit der CEE RF9 Holding S.à r.l. mit Sitz in Wecker/Luxemburg (Registre de Commerce et des Sociétés B286281) (société à responsabilité limitée - Gesellschaft mit beschränkter Haftung  nach luxemburgischem Recht) als übernehmende Gesellschaft beim Handelsregister eingereicht worden ist.\nDie Anteilsinhaber, die Gläubiger sowie die zuständigen Betriebsräte der an der grenzüberschreitenden Verschmelzung beteiligten Gesellschaften oder, soweit es keinen Betriebsrat gibt, die Arbeitnehmer der an der grenzüberschreitenden Verschmelzung beteiligten Gesellschaften, können der jeweiligen Gesellschaft spätestens fünf Arbeitstage vor dem Tag der Hauptversammlung Bemerkungen zum Verschmelzungsplan übermitteln."
    },
    {
      "date": "2025-03-07",
      "id": "103171",
      "original_text": "Löschungsankündigung\nBerlin Amtsgericht Berlin (Charlottenburg) HRB 68395\nAdelante Reisen GmbH – Berlin",
      "type": "Löschungsankündigung",
      "state": "Berlin",
      "amtsgericht": "Amtsgericht Berlin (Charlottenburg)",
      "registernummer": "HRB 68395",
      "registerart": "HRB",
      "company_name": "Adelante Reisen GmbH",
      "company_seat": "Berlin",
      "details": "07.03.2025 (Bekanntmachungsdatum)\n\nBerlin Amtsgericht Berlin (Charlottenburg) HRB 68395\nLöschungsankündigung\n\nAdelante Reisen GmbH\nGesellschaft mit beschränkter Haftung\nBerlin\n\nBei der nachstehenden Gesellschaft wird das Amtslöschungsverfahren gemäß § 394 FamFG eingeleitet. Widerspruchsfrist: 6 Wochen."
    },
    {
      "date": "2025-03-07",
      "id": "103172",
      "original_text": "Sonstige Registerbekanntmachung\nSachsen Amtsgericht Dresden HRB 5745\nWohnbau Radeberg Kommunale Wohnungsbaugesellschaft mbH – Radeberg",
      "type": "Sonstige Registerbekanntmachung",
      "state": "Sachsen",
      "amtsgericht": "Amtsgericht Dresden",
      "registernummer": "HRB 5745",
      "registerart": "HRB",
      "company_name": "Wohnbau Radeberg Kommunale Wohnungsbaugesellschaft mbH",
      "company_seat": "Radeberg",
      "details": "07.03.2025 (Bekanntmachungsdatum)\n\nSachsen Amtsgericht Dresden HRB 5745\nSonstige Registerbekanntmachung\n\nWohnbau Radeberg Kommunale Wohnungsbaugesellschaft mbH\nGesellschaft mit beschränkter Haftung\nRadeberg\n\nAm 06.03.2025 wurde beim Handelsregister des Amtsgerichts Dresden die Liste der Mitglieder des Aufsichtsrats gemäß § 52 GmbHG eingereicht."
    },
    {
      "date": "2025-03-07",
      "id": "103173",
      "original_text": "Registerbekanntmachung nach dem Umwandlungsgesetz\nSachsen Amtsgericht Leipzig HRB 12367\nAIRTEC Gesellschaft für Umweltmessungen mbH – Leipzig",
      "type": "Registerbekanntmachung nach dem Umwandlungsgesetz",
      "state": "Sachsen",
      "amtsgericht": "Amtsgericht Leipzig",
      "registernummer": "HRB 12367",
      "registerart": "HRB",
      "company_name": "AIRTEC Gesellschaft für Umweltmessungen mbH",
      "company_seat": "Leipzig",
      "details": "07.03.2025 (Bekanntmachungsdatum)\n\nSachsen Amtsgericht Leipzig HRB 12367\nRegisterbekanntmachung nach dem Umwandlungsgesetz 07.03.2025 (Eintragungsdatum)\n\nAIRTEC Gesellschaft für Umweltmessungen mbH\nGesellschaft mit beschränkter Haftung\nLeipzig\n\nDen Gläubigern der an der Verschmelzung beteiligten Rechtsträger ist, wenn sie binnen sechs Monaten nach dem Tag, an dem die Eintragung der Verschmelzung in das Register des Sitzes desjenigen Rechtsträgers, dessen Gläubiger sie sind, nach § 19 Abs. 3 UmwG als bekannt gemacht gilt, ihren Anspruch nach Grund und Höhe in Textform anmelden, Sicherheit zu leisten, soweit sie nicht Befriedigung verlangen können. Dieses Recht steht den Gläubigern jedoch nur zu, wenn sie glaubhaft machen, dass durch die Verschmelzung die Erfüllung der Forderung gefährdet wird."
    },
    {
      "date": "2025-03-07",
      "id": "103174",
      "original_text": "Löschungsankündigung\nSachsen Amtsgericht Leipzig HRB 32867\nI&I Bayerische Investment Management GmbH – Leipzig",
      "type": "Löschungsankündigung",
      "state": "Sachsen",
      "amtsgericht": "Amtsgericht Leipzig",
      "registernummer": "HRB 32867",
      "registerart": "HRB",
      "company_name": "I&I Bayerische Investment Management GmbH",
      "company_seat": "Leipzig",
      "details": "07.03.2025 (Bekanntmachungsdatum)\n\nSachsen Amtsgericht Leipzig HRB 32867\nLöschungsankündigung\n\nI&I Bayerische Investment Management GmbH\nGesellschaft mit beschränkter Haftung\nLeipzig\n\nDas Registergericht beabsichtigt, die im Handelsregister eingetragene Gesellschaft von Amts wegen nach § 394 FamFG zu löschen. Die Frist zu Erhebung eines Widerspruchs gegen die beabsichtigte Löschung wird auf einen Monat festgesetzt."
    },
    {
      "date": "2025-03-07",
      "id": "103175",
      "original_text": "Löschungsankündigung\nNiedersachsen Amtsgericht Aurich HRA 203470\nKamex Immobilien I GmbH & Co. KG – Leer",
      "type": "Löschungsankündigung",
      "state": "Niedersachsen",
      "amtsgericht": "Amtsgericht Aurich",
      "registernummer": "HRA 203470",
      "registerart": "HRA",
      "company_name": "Kamex Immobilien I GmbH & Co. KG",
      "company_seat": "Leer",
      "details": "07.03.2025 (Bekanntmachungsdatum)\n\nNiedersachsen Amtsgericht Aurich HRA 203470\nLöschungsankündigung 07.03.2025 (Eintragungsdatum)\n\nKamex Immobilien I GmbH & Co. KG\nKommanditgesellschaft\nLeer\n\nDas Registergericht beabsichtigt, die Firma von Amts wegen nach § 394 FamFG zu löschen. Die Frist zur Erhebung eines Widerspruchs ist auf 3 Monaten ab dieser Registerbekanntmachung festgesetzt."
    },
    {
      "date": "2025-03-07",
      "id": "103176",
      "original_text": "Registerbekanntmachung nach dem Umwandlungsgesetz\nNiedersachsen Amtsgericht Hannover HRB 224430\nHR PE GmbH – Hannover",
      "type": "Registerbekanntmachung nach dem Umwandlungsgesetz",
      "state": "Niedersachsen",
      "amtsgericht": "Amtsgericht Hannover",
      "registernummer": "HRB 224430",
      "registerart": "HRB",
      "company_name": "HR PE GmbH",
      "company_seat": "Hannover",
      "details": "07.03.2025 (Bekanntmachungsdatum)\n\nNiedersachsen Amtsgericht Hannover HRB 224430\nRegisterbekanntmachung nach dem Umwandlungsgesetz 07.03.2025 (Eintragungsdatum)\n\nHR PE GmbH\nGesellschaft mit beschränkter Haftung\nHannover\n\nDen Gläubigern der an der Verschmelzung beteiligten Rechtsträger ist, wenn sie binnen sechs Monaten nach dem Tag, an dem die Eintragung der Verschmelzung in das Register des Sitzes desjenigen Rechtsträgers, dessen Gläubiger sie sind, nach § 19  Abs.  3 UmwG als bekannt gemacht gilt, ihren Anspruch nach Grund und Höhe schriftlich anmelden, Sicherheit zu leisten, soweit sie nicht Befriedigung verlangen können. Dieses Recht steht den Gläubigern jedoch nur zu, wenn sie glaubhaft machen, dass durch die Verschmelzung die Erfüllung der Forderung gefährdet wird."
    },
    {
      "date": "2025-03-07",
      "id": "103177",
      "original_text": "Registerbekanntmachung nach dem Umwandlungsgesetz\nNiedersachsen Amtsgericht Hannover HRB 227506\nHannover Re Private Equity Beteiligungen GmbH – Hannover",
      "type": "Registerbekanntmachung nach dem Umwandlungsgesetz",
      "state": "Niedersachsen",
      "amtsgericht": "Amtsgericht Hannover",
      "registernummer": "HRB 227506",
      "registerart": "HRB",
      "company_name": "Hannover Re Private Equity Beteiligungen GmbH",
      "company_seat": "Hannover",
      "details": "07.03.2025 (Bekanntmachungsdatum)\n\nNiedersachsen Amtsgericht Hannover HRB 227506\nRegisterbekanntmachung nach dem Umwandlungsgesetz 07.03.2025 (Eintragungsdatum)\n\nHannover Re Private Equity Beteiligungen GmbH\nGesellschaft mit beschränkter Haftung\nHannover\n\nDen Gläubigern der an der Verschmelzung beteiligten Rechtsträger ist, wenn sie binnen sechs Monaten nach dem Tag, an dem die Eintragung der Verschmelzung in das Register des Sitzes desjenigen Rechtsträgers, dessen Gläubiger sie sind, nach § 19  Abs.  3 UmwG als bekannt gemacht gilt, ihren Anspruch nach Grund und Höhe schriftlich anmelden, Sicherheit zu leisten, soweit sie nicht Befriedigung verlangen können. Dieses Recht steht den Gläubigern jedoch nur zu, wenn sie glaubhaft machen, dass durch die Verschmelzung die Erfüllung der Forderung gefährdet wird."
    },
    {
      "date": "2025-03-07",
      "id": "103178",
      "original_text": "Registerbekanntmachung nach dem Umwandlungsgesetz\nNiedersachsen Amtsgericht Tostedt HRB 211392\nAlbers & Albers Vermögensverwaltung GmbH – Buchholz i. d. N.",
      "type": "Registerbekanntmachung nach dem Umwandlungsgesetz",
      "state": "Niedersachsen",
      "amtsgericht": "Amtsgericht Tostedt",
      "registernummer": "HRB 211392",
      "registerart": "HRB",
      "company_name": "Albers & Albers Vermögensverwaltung GmbH",
      "company_seat": "Buchholz i. d. N.",
      "details": "07.03.2025 (Bekanntmachungsdatum)\n\nNiedersachsen Amtsgericht Tostedt HRB 211392\nRegisterbekanntmachung nach dem Umwandlungsgesetz 07.03.2025 (Eintragungsdatum)\n\nAlbers & Albers Vermögensverwaltung GmbH\nGesellschaft mit beschränkter Haftung\nBuchholz i. d. N.\n\nDen Gläubigern der an der formwechselnden Umwandlung beteiligten Rechtsträger ist, wenn sie binnen sechs Monaten nach dem Tag, an dem die Eintragung der Umwandlung in das Register des Sitzes desjenigen Rechtsträgers, dessen Gläubiger sie sind, nach § 19 Abs. 3 UmwG als bekannt gemacht gilt, ihren Anspruch nach Grund und Höhe schriftlich anmelden, Sicherheit zu leisten, soweit sie nicht Befriedigung verlangen können. Dieses Recht steht den Gläubigern jedoch nur zu, wenn sie glaubhaft machen, dass durch die formwechselnde Umwandlung die Erfüllung der Forderung gefährdet wird."
    },
    {
      "date": "2025-03-07",
      "id": "103179",
      "original_text": "Einreichung neuer Dokumente\nNiedersachsen Amtsgericht Braunschweig HRB 200232\nVolkswagen Versicherung Aktiengesellschaft – Braunschweig",
      "type": "Einreichung neuer Dokumente",
      "state": "Niedersachsen",
      "amtsgericht": "Amtsgericht Braunschweig",
      "registernummer": "HRB 200232",
      "registerart": "HRB",
      "company_name": "Volkswagen Versicherung Aktiengesellschaft",
      "company_seat": "Braunschweig",
      "details": "07.03.2025 (Bekanntmachungsdatum)\n\nNiedersachsen Amtsgericht Braunschweig HRB 200232\nEinreichung neuer Dokumente\n\nVolkswagen Versicherung Aktiengesellschaft\nAktiengesellschaft\nBraunschweig\n\nDie Liste der Mitglieder des Aufsichtsrats wurde beim Registergericht eingereicht."
    },
    {
      "date": "2025-03-07",
      "id": "103180",
      "original_text": "Registerbekanntmachung nach dem Umwandlungsgesetz\nNiedersachsen Amtsgericht Hannover HRA 206385\nPodologie Steffen Hartmann e.K. – Bad Münder",
      "type": "Registerbekanntmachung nach dem Umwandlungsgesetz",
      "state": "Niedersachsen",
      "amtsgericht": "Amtsgericht Hannover",
      "registernummer": "HRA 206385",
      "registerart": "HRA",
      "company_name": "Podologie Steffen Hartmann e.K.",
      "company_seat": "Bad Münder",
      "details": "07.03.2025 (Bekanntmachungsdatum)\n\nNiedersachsen Amtsgericht Hannover HRA 206385\nRegisterbekanntmachung nach dem Umwandlungsgesetz 07.03.2025 (Eintragungsdatum)\n\nPodologie Steffen Hartmann e.K.\nEinzelkaufmann / Einzelkauffrau\nBad Münder\n\nDen Gläubigern der an der Ausgliederung beteiligten Rechtsträger ist, wenn sie binnen sechs Monaten nach dem Tag, an dem die Eintragung der Ausgliederung in das Register des Sitzes desjenigen Rechtsträgers, dessen Gläubiger sie sind, nach § 19 Abs. 3 UmwG als bekannt gemacht gilt, ihren Anspruch nach Grund und Höhe schriftlich anmelden, Sicherheit zu leisten, soweit sie nicht Befriedigung verlangen können. Dieses Recht steht den Gläubigern jedoch nur zu, wenn sie glaubhaft machen, dass durch die Ausgliederung die Erfüllung der Forderung gefährdet wird."
    },
    {
      "date": "2025-03-07",
      "id": "103181",
      "original_text": "Einreichung neuer Dokumente\nNiedersachsen Amtsgericht Stadthagen HRB 200185\nDiakonie-Pflegedienst Schaumburg gemeinnützige GmbH – Ahnsen",
      "type": "Einreichung neuer Dokumente",
      "state": "Niedersachsen",
      "amtsgericht": "Amtsgericht Stadthagen",
      "registernummer": "HRB 200185",
      "registerart": "HRB",
      "company_name": "Diakonie-Pflegedienst Schaumburg gemeinnützige GmbH",
      "company_seat": "Ahnsen",
      "details": "07.03.2025 (Bekanntmachungsdatum)\n\nNiedersachsen Amtsgericht Stadthagen HRB 200185\nEinreichung neuer Dokumente 05.03.2025 (Eintragungsdatum)\n\nDiakonie-Pflegedienst Schaumburg gemeinnützige GmbH\nGesellschaft mit beschränkter Haftung\nAhnsen\n\nDie Liste der Mitglieder des Aufsichtsrats wurde beim Registergericht eingereicht."
    },
    {
      "date": "2025-03-07",
      "id": "103182",
      "original_text": "Einreichung neuer Dokumente\nNiedersachsen Amtsgericht Hannover HRB 3809\nhanova GEWERBE GmbH – Hannover",
      "type": "Einreichung neuer Dokumente",
      "state": "Niedersachsen",
      "amtsgericht": "Amtsgericht Hannover",
      "registernummer": "HRB 3809",
      "registerart": "HRB",
      "company_name": "hanova GEWERBE GmbH",
      "company_seat": "Hannover",
      "details": "07.03.2025 (Bekanntmachungsdatum)\n\nNiedersachsen Amtsgericht Hannover HRB 3809\nEinreichung neuer Dokumente\n\nhanova GEWERBE GmbH\nGesellschaft mit beschränkter Haftung\nHannover\n\nDie Liste der Mitglieder des Aufsichtsrats wurde beim Registergericht eingereicht."
    },
    {
      "date": "2025-03-07",
      "id": "103183",
      "original_text": "Registerbekanntmachung nach dem Umwandlungsgesetz\nNiedersachsen Amtsgericht Walsrode HRB 206903\nBremermann Beteiligungs GmbH – Stuhr",
      "type": "Registerbekanntmachung nach dem Umwandlungsgesetz",
      "state": "Niedersachsen",
      "amtsgericht": "Amtsgericht Walsrode",
      "registernummer": "HRB 206903",
      "registerart": "HRB",
      "company_name": "Bremermann Beteiligungs GmbH",
      "company_seat": "Stuhr",
      "details": "07.03.2025 (Bekanntmachungsdatum)\n\nNiedersachsen Amtsgericht Walsrode HRB 206903\nRegisterbekanntmachung nach dem Umwandlungsgesetz 07.03.2025 (Eintragungsdatum)\n\nBremermann Beteiligungs GmbH\nGesellschaft mit beschränkter Haftung\nStuhr\n\nDen Gläubigern der an der Verschmelzung beteiligten Rechtsträger ist, wenn sie binnen sechs Monaten nach dem Tag, an dem die Eintragung der Verschmelzung in das Register des Sitzes desjenigen Rechtsträgers, dessen Gläubiger sie sind, nach § 19  Abs.  3 UmwG als bekannt gemacht gilt, ihren Anspruch nach Grund und Höhe schriftlich anmelden, Sicherheit zu leisten, soweit sie nicht Befriedigung verlangen können. Dieses Recht steht den Gläubigern jedoch nur zu, wenn sie glaubhaft machen, dass durch die Verschmelzung die Erfüllung der Forderung gefährdet wird."
    },
    {
      "date": "2025-03-07",
      "id": "103184",
      "original_text": "Registerbekanntmachung nach dem Umwandlungsgesetz\nNiedersachsen Amtsgericht Walsrode HRB 203614\neluno GmbH – Stuhr",
      "type": "Registerbekanntmachung nach dem Umwandlungsgesetz",
      "state": "Niedersachsen",
      "amtsgericht": "Amtsgericht Walsrode",
      "registernummer": "HRB 203614",
      "registerart": "HRB",
      "company_name": "eluno GmbH",
      "company_seat": "Stuhr",
      "details": "07.03.2025 (Bekanntmachungsdatum)\n\nNiedersachsen Amtsgericht Walsrode HRB 203614\nRegisterbekanntmachung nach dem Umwandlungsgesetz 07.03.2025 (Eintragungsdatum)\n\neluno GmbH\nGesellschaft mit beschränkter Haftung\nStuhr\n\nDen Gläubigern der an der Verschmelzung beteiligten Rechtsträger ist, wenn sie binnen sechs Monaten nach dem Tag, an dem die Eintragung der Verschmelzung in das Register des Sitzes desjenigen Rechtsträgers, dessen Gläubiger sie sind, nach § 19  Abs.  3 UmwG als bekannt gemacht gilt, ihren Anspruch nach Grund und Höhe schriftlich anmelden, Sicherheit zu leisten, soweit sie nicht Befriedigung verlangen können. Dieses Recht steht den Gläubigern jedoch nur zu, wenn sie glaubhaft machen, dass durch die Verschmelzung die Erfüllung der Forderung gefährdet wird."
    },
    {
      "date": "2025-03-07",
      "id": "103185",
      "original_text": "Registerbekanntmachung nach dem Umwandlungsgesetz\nNiedersachsen Amtsgericht Tostedt HRA 204772\nPlatin 2194. GmbH & Co. Verwaltungs KG – Buchholz i.d.N.",
      "type": "Registerbekanntmachung nach dem Umwandlungsgesetz",
      "state": "Niedersachsen",
      "amtsgericht": "Amtsgericht Tostedt",
      "registernummer": "HRA 204772",
      "registerart": "HRA",
      "company_name": "Platin 2194. GmbH & Co. Verwaltungs KG",
      "company_seat": "Buchholz i.d.N.",
      "details": "07.03.2025 (Bekanntmachungsdatum)\n\nNiedersachsen Amtsgericht Tostedt HRA 204772\nRegisterbekanntmachung nach dem Umwandlungsgesetz 07.03.2025 (Eintragungsdatum)\n\nPlatin 2194. GmbH & Co. Verwaltungs KG\nKommanditgesellschaft\nBuchholz i.d.N.\n\nDen Gläubigern der an der formwechselnden Umwandlung beteiligten Rechtsträger ist, wenn sie binnen sechs Monaten nach dem Tag, an dem die Eintragung der Umwandlung in das Register des Sitzes desjenigen Rechtsträgers, dessen Gläubiger sie sind, nach § 19 Abs. 3 UmwG als bekannt gemacht gilt, ihren Anspruch nach Grund und Höhe schriftlich anmelden, Sicherheit zu leisten, soweit sie nicht Befriedigung verlangen können. Dieses Recht steht den Gläubigern jedoch nur zu, wenn sie glaubhaft machen, dass durch die formwechselnde Umwandlung die Erfüllung der Forderung gefährdet wird."
    },
    {
      "date": "2025-03-07",
      "id": "103186",
      "original_text": "Registerbekanntmachung nach dem Umwandlungsgesetz\nNiedersachsen Amtsgericht Hannover HRB 227678\nGesundheitseinrichtungen Steffen Hartmann GmbH – Bad Münder",
      "type": "Registerbekanntmachung nach dem Umwandlungsgesetz",
      "state": "Niedersachsen",
      "amtsgericht": "Amtsgericht Hannover",
      "registernummer": "HRB 227678",
      "registerart": "HRB",
      "company_name": "Gesundheitseinrichtungen Steffen Hartmann GmbH",
      "company_seat": "Bad Münder",
      "details": "07.03.2025 (Bekanntmachungsdatum)\n\nNiedersachsen Amtsgericht Hannover HRB 227678\nRegisterbekanntmachung nach dem Umwandlungsgesetz 07.03.2025 (Eintragungsdatum)\n\nGesundheitseinrichtungen Steffen Hartmann GmbH\nGesellschaft mit beschränkter Haftung\nBad Münder\n\nDen Gläubigern der an der Ausgliederung beteiligten Rechtsträger ist, wenn sie binnen sechs Monaten nach dem Tag, an dem die Eintragung der Ausgliederung in das Register des Sitzes desjenigen Rechtsträgers, dessen Gläubiger sie sind, nach § 19 Abs. 3 UmwG als bekannt gemacht gilt, ihren Anspruch nach Grund und Höhe schriftlich anmelden, Sicherheit zu leisten, soweit sie nicht Befriedigung verlangen können. Dieses Recht steht den Gläubigern jedoch nur zu, wenn sie glaubhaft machen, dass durch die Ausgliederung die Erfüllung der Forderung gefährdet wird."
    },
    {
      "date": "2025-03-07",
      "id": "103187",
      "original_text": "Löschungsankündigung\nBremen Amtsgericht Bremen HRB 30206\nRusReklama UG (haftungsbeschränkt) – Bremen",
      "type": "Löschungsankündigung",
      "state": "Bremen",
      "amtsgericht": "Amtsgericht Bremen",
      "registernummer": "HRB 30206",
      "registerart": "HRB",
      "company_name": "RusReklama UG (haftungsbeschränkt)",
      "company_seat": "Bremen",
      "details": "07.03.2025 (Bekanntmachungsdatum)\n\nBremen Amtsgericht Bremen HRB 30206\nLöschungsankündigung\n\nRusReklama UG (haftungsbeschränkt)\nGesellschaft mit beschränkter Haftung\nBremen\n\nEs ist beabsichtigt die im Handelsregister eingetragene Gesellschaft von Amts wegen gemäß § 394 FamFG zu löschen. Gegen die Löschung kann beim AG Bremen schriftlich oder zu Protokoll der Geschäftsstelle Widerspruch eingelegt werden. Widerspruchsfrist 4 Wochen."
    },
    {
      "date": "2025-03-07",
      "id": "103188",
      "original_text": "Löschungsankündigung\nBremen Amtsgericht Bremen HRB 39905\nH & W GmbH – Bremen",
      "type": "Löschungsankündigung",
      "state": "Bremen",
      "amtsgericht": "Amtsgericht Bremen",
      "registernummer": "HRB 39905",
      "registerart": "HRB",
      "company_name": "H & W GmbH",
      "company_seat": "Bremen",
      "details": "07.03.2025 (Bekanntmachungsdatum)\n\nBremen Amtsgericht Bremen HRB 39905\nLöschungsankündigung\n\nH & W GmbH\nGesellschaft mit beschränkter Haftung\nBremen\n\nEs ist beabsichtigt die im Handelsregister eingetragene Gesellschaft von Amts wegen gemäß § 394 FamFG zu löschen. Gegen die Löschung kann beim AG Bremen schriftlich oder zu Protokoll der Geschäftsstelle Widerspruch eingelegt werden. Widerspruchsfrist 4 Wochen."
    },
    {
      "date": "2025-03-07",
      "id": "103189",
      "original_text": "Registerbekanntmachung nach dem Umwandlungsgesetz\nBremen Amtsgericht Bremen HRB 33995\natacama blooms Verwaltungs GmbH – Bremen",
      "type": "Registerbekanntmachung nach dem Umwandlungsgesetz",
      "state": "Bremen",
      "amtsgericht": "Amtsgericht Bremen",
      "registernummer": "HRB 33995",
      "registerart": "HRB",
      "company_name": "atacama blooms Verwaltungs GmbH",
      "company_seat": "Bremen",
      "details": "07.03.2025 (Bekanntmachungsdatum)\n\nBremen Amtsgericht Bremen HRB 33995\nRegisterbekanntmachung nach dem Umwandlungsgesetz 05.03.2025 (Eintragungsdatum)\n\natacama blooms Verwaltungs GmbH\nGesellschaft mit beschränkter Haftung\nBremen\n\nZu Eintragungsnummer 6 vom 05.03.2025 wird als nicht eingetragen veröffentlicht: Gläubigern, deren Forderungen begründet worden sind, bevor die Eintragung des Beschlusses als nach § 10 des Handelsgesetzbuches bekannt gemacht gilt, ist, wenn sie sich binnen sechs Monaten nach der Bekanntmachung zu diesem Zweck melden, Sicherheit zu leisten, soweit sie nicht Befriedigung verlangen können. Dieses Recht steht den Gläubigern nicht zu, die im Fall des Insolvenzverfahrens ein Recht auf vorzugsweise Befriedigung aus der Deckungsmasse haben, die nach gesetzlicher Vorschrift zu ihrem Schutz errichtet und staatlich überwacht ist."
    },
    {
      "date": "2025-03-07",
      "id": "103190",
      "original_text": "Löschungsankündigung\nRheinland-Pfalz Amtsgericht Montabaur HRA 20535\nSchulte GmbH & Co. KG – Buchholz-Mendt",
      "type": "Löschungsankündigung",
      "state": "Rheinland-Pfalz",
      "amtsgericht": "Amtsgericht Montabaur",
      "registernummer": "HRA 20535",
      "registerart": "HRA",
      "company_name": "Schulte GmbH & Co. KG",
      "company_seat": "Buchholz-Mendt",
      "details": "07.03.2025 (Bekanntmachungsdatum)\n\nRheinland-Pfalz Amtsgericht Montabaur HRA 20535\nLöschungsankündigung\n\nSchulte GmbH & Co. KG\nKommanditgesellschaft\nBuchholz-Mendt\n\nDas Registergericht beabsichtigt die Firma von Amts wegen nach § 394 FamFG zu löschen. Die Frist zur Erhebung eines Widerspruchs ist auf einen Monat festgesetzt."
    },
    {
      "date": "2025-03-07",
      "id": "103191",
      "original_text": "Einreichung neuer Dokumente\nNordrhein-Westfalen Amtsgericht Bad Oeynhausen HRB 6541\nAhlers AG – Herford",
      "type": "Einreichung neuer Dokumente",
      "state": "Nordrhein-Westfalen",
      "amtsgericht": "Amtsgericht Bad Oeynhausen",
      "registernummer": "HRB 6541",
      "registerart": "HRB",
      "company_name": "Ahlers AG",
      "company_seat": "Herford",
      "details": "07.03.2025 (Bekanntmachungsdatum)\n\nNordrhein-Westfalen Amtsgericht Bad Oeynhausen HRB 6541\nEinreichung neuer Dokumente\n\nAhlers AG\nAktiengesellschaft\nHerford\n\nDem Registergericht ist eine neue Liste der Mitglieder des Aufsichtsrates eingereicht worden."
    },
    {
      "date": "2025-03-07",
      "id": "103192",
      "original_text": "Registerbekanntmachung nach dem Umwandlungsgesetz\nNordrhein-Westfalen Amtsgericht Köln HRB 112582\nEpta Kältetechnik West Verwaltungs GmbH – Köln",
      "type": "Registerbekanntmachung nach dem Umwandlungsgesetz",
      "state": "Nordrhein-Westfalen",
      "amtsgericht": "Amtsgericht Köln",
      "registernummer": "HRB 112582",
      "registerart": "HRB",
      "company_name": "Epta Kältetechnik West Verwaltungs GmbH",
      "company_seat": "Köln",
      "details": "07.03.2025 (Bekanntmachungsdatum)\n\nNordrhein-Westfalen Amtsgericht Köln HRB 112582\nRegisterbekanntmachung nach dem Umwandlungsgesetz 07.03.2025 (Eintragungsdatum)\n\nEpta Kältetechnik West Verwaltungs GmbH\nGesellschaft mit beschränkter Haftung\nKöln\n\nDen Gläubigern der an der Verschmelzung beteiligten Rechtsträger ist, wenn sie binnen sechs Monaten nach dem Tag, an dem die Eintragung der Verschmelzung in das Register des Sitzes desjenigen Rechtsträgers, dessen Gläubiger sie sind, nach § 19 Absatz 3 UmwG als bekanntgemacht gilt, ihren Anspruch nach Grund und Höhe schriftlich anmelden, Sicherheit zu leisten, soweit sie nicht Befriedigung verlangen können. Dieses Recht steht den Gläubigern jedoch nur zu, wenn sie glaubhaft machen, dass durch die Verschmelzung die Erfüllung ihrer Forderung gefährdet wird."
    },
    {
      "date": "2025-03-07",
      "id": "103193",
      "original_text": "Sonstige Registerbekanntmachung\nNordrhein-Westfalen Amtsgericht Köln HRB 115531\nRaiffeisen Waren-Zentrale Rhein-Main AG – Köln",
      "type": "Sonstige Registerbekanntmachung",
      "state": "Nordrhein-Westfalen",
      "amtsgericht": "Amtsgericht Köln",
      "registernummer": "HRB 115531",
      "registerart": "HRB",
      "company_name": "Raiffeisen Waren-Zentrale Rhein-Main AG",
      "company_seat": "Köln",
      "details": "07.03.2025 (Bekanntmachungsdatum)\n\nNordrhein-Westfalen Amtsgericht Köln HRB 115531\nSonstige Registerbekanntmachung\n\nRaiffeisen Waren-Zentrale Rhein-Main AG\nAktiengesellschaft\nKöln\n\nDem Registergericht ist eine Liste der Mitglieder des Aufsichtsrates eingereicht worden."
    },
    {
      "date": "2025-03-07",
      "id": "103194",
      "original_text": "Registerbekanntmachung nach dem Umwandlungsgesetz\nNordrhein-Westfalen Amtsgericht Steinfurt HRB 12297\nEficode Germany GmbH – Hörstel",
      "type": "Registerbekanntmachung nach dem Umwandlungsgesetz",
      "state": "Nordrhein-Westfalen",
      "amtsgericht": "Amtsgericht Steinfurt",
      "registernummer": "HRB 12297",
      "registerart": "HRB",
      "company_name": "Eficode Germany GmbH",
      "company_seat": "Hörstel",
      "details": "07.03.2025 (Bekanntmachungsdatum)\n\nNordrhein-Westfalen Amtsgericht Steinfurt HRB 12297\nRegisterbekanntmachung nach dem Umwandlungsgesetz 07.03.2025 (Eintragungsdatum)\n\nEficode Germany GmbH\nGesellschaft mit beschränkter Haftung\nHörstel\n\nDen Gläubigern der an der Verschmelzung beteiligten Rechtsträger ist, wenn sie binnen sechs Monaten nach dem Tag, an dem die Eintragung der Verschmelzung in das Register des Sitzes derjenigen Rechtsträger deren Gläubiger sie sind, nach § 19 Absatz 3 UmwG als bekanntgemacht gilt, ihren Anspruch nach Grund und Höhe schriftlich anmelden, Sicherheit zu leisten, soweit sie nicht Befriedigung verlangen können. Dieses Recht steht den Gläubigern jedoch nur zu, wenn sie glaubhaft machen, dass durch die Verschmelzung die Erfüllung ihrer Forderung gefährdet wird."
    },
    {
      "date": "2025-03-07",
      "id": "103195",
      "original_text": "Einreichung neuer Dokumente\nNordrhein-Westfalen Amtsgericht Köln HRB 111811\nMed 360° SE – Leverkusen",
      "type": "Einreichung neuer Dokumente",
      "state": "Nordrhein-Westfalen",
      "amtsgericht": "Amtsgericht Köln",
      "registernummer": "HRB 111811",
      "registerart": "HRB",
      "company_name": "Med 360° SE",
      "company_seat": "Leverkusen",
      "details": "07.03.2025 (Bekanntmachungsdatum)\n\nNordrhein-Westfalen Amtsgericht Köln HRB 111811\nEinreichung neuer Dokumente\n\nMed 360° SE\nEuropäische Aktiengesellschaft (SE)\nLeverkusen\n\nDem Registergericht ist eine Liste der Mitglieder des Aufsichtsrates eingereicht worden."
    },
    {
      "date": "2025-03-07",
      "id": "103196",
      "original_text": "Registerbekanntmachung nach dem Umwandlungsgesetz\nNordrhein-Westfalen Amtsgericht Köln HRB 94685\nPKM Solutions GmbH – Leverkusen",
      "type": "Registerbekanntmachung nach dem Umwandlungsgesetz",
      "state": "Nordrhein-Westfalen",
      "amtsgericht": "Amtsgericht Köln",
      "registernummer": "HRB 94685",
      "registerart": "HRB",
      "company_name": "PKM Solutions GmbH",
      "company_seat": "Leverkusen",
      "details": "07.03.2025 (Bekanntmachungsdatum)\n\nNordrhein-Westfalen Amtsgericht Köln HRB 94685\nRegisterbekanntmachung nach dem Umwandlungsgesetz 07.03.2025 (Eintragungsdatum)\n\nPKM Solutions GmbH\nGesellschaft mit beschränkter Haftung\nLeverkusen\n\nDen Gläubigern der an der Verschmelzung beteiligten Rechtsträger ist, wenn sie binnen sechs Monaten nach dem Tag, an dem die Eintragung der Verschmelzung in das Register des Sitzes desjenigen Rechtsträgers, dessen Gläubiger sie sind, nach § 19 Absatz 3 UmwG als bekanntgemacht gilt, ihren Anspruch nach Grund und Höhe schriftlich anmelden, Sicherheit zu leisten, soweit sie nicht Befriedigung verlangen können. Dieses Recht steht den Gläubigern jedoch nur zu, wenn sie glaubhaft machen, dass durch die Verschmelzung die Erfüllung ihrer Forderung gefährdet wird."
    },
    {
      "date": "2025-03-07",
      "id": "103197",
      "original_text": "Löschungsankündigung\nNordrhein-Westfalen Amtsgericht Wuppertal HRB 31737\ndopadis GmbH – Remscheid",
      "type": "Löschungsankündigung",
      "state": "Nordrhein-Westfalen",
      "amtsgericht": "Amtsgericht Wuppertal",
      "registernummer": "HRB 31737",
      "registerart": "HRB",
      "company_name": "dopadis GmbH",
      "company_seat": "Remscheid",
      "details": "07.03.2025 (Bekanntmachungsdatum)\n\nNordrhein-Westfalen Amtsgericht Wuppertal HRB 31737\nLöschungsankündigung\n\ndopadis GmbH\nGesellschaft mit beschränkter Haftung\nRemscheid\n\nDas Registergericht beabsichtigt die Gesellschaft von Amts wegen nach § 394 FamFG zu löschen. Die Frist zur Erhebung eines Widerspruchs ist auf einen Monat festgesetzt."
    },
    {
      "date": "2025-03-07",
      "id": "103198",
      "original_text": "Einreichung neuer Dokumente\nNordrhein-Westfalen Amtsgericht Dortmund HRB 33599\nb.value Deutsche Biotechnologie Beteiligungsaktiengesellschaft – Dortmund",
      "type": "Einreichung neuer Dokumente",
      "state": "Nordrhein-Westfalen",
      "amtsgericht": "Amtsgericht Dortmund",
      "registernummer": "HRB 33599",
      "registerart": "HRB",
      "company_name": "b.value Deutsche Biotechnologie Beteiligungsaktiengesellschaft",
      "company_seat": "Dortmund",
      "details": "07.03.2025 (Bekanntmachungsdatum)\n\nNordrhein-Westfalen Amtsgericht Dortmund HRB 33599\nEinreichung neuer Dokumente\n\nb.value Deutsche Biotechnologie Beteiligungsaktiengesellschaft\nAktiengesellschaft\nDortmund\n\nDem Registergericht ist eine neue Liste der Mitglieder des Aufsichtsrates eingereicht worden."
    },
    {
      "date": "2025-03-07",
      "id": "103199",
      "original_text": "Registerbekanntmachung nach dem Umwandlungsgesetz\nNordrhein-Westfalen Amtsgericht Köln HRB 104614\nPKM Health GmbH – Leverkusen",
      "type": "Registerbekanntmachung nach dem Umwandlungsgesetz",
      "state": "Nordrhein-Westfalen",
      "amtsgericht": "Amtsgericht Köln",
      "registernummer": "HRB 104614",
      "registerart": "HRB",
      "company_name": "PKM Health GmbH",
      "company_seat": "Leverkusen",
      "details": "07.03.2025 (Bekanntmachungsdatum)\n\nNordrhein-Westfalen Amtsgericht Köln HRB 104614\nRegisterbekanntmachung nach dem Umwandlungsgesetz 07.03.2025 (Eintragungsdatum)\n\nPKM Health GmbH\nGesellschaft mit beschränkter Haftung\nLeverkusen\n\nDen Gläubigern der an der Verschmelzung beteiligten Rechtsträger ist, wenn sie binnen sechs Monaten nach dem Tag, an dem die Eintragung der Verschmelzung in das Register des Sitzes desjenigen Rechtsträgers, dessen Gläubiger sie sind, nach § 19 Absatz 3 UmwG als bekanntgemacht gilt, ihren Anspruch nach Grund und Höhe schriftlich anmelden, Sicherheit zu leisten, soweit sie nicht Befriedigung verlangen können. Dieses Recht steht den Gläubigern jedoch nur zu, wenn sie glaubhaft machen, dass durch die Verschmelzung die Erfüllung ihrer Forderung gefährdet wird."
    },
    {
      "date": "2025-03-07",
      "id": "103200",
      "original_text": "Registerbekanntmachung nach dem Umwandlungsgesetz\nNordrhein-Westfalen Amtsgericht Hamm HRB 11265\nKonato GmbH – Unna",
      "type": "Registerbekanntmachung nach dem Umwandlungsgesetz",
      "state": "Nordrhein-Westfalen",
      "amtsgericht": "Amtsgericht Hamm",
      "registernummer": "HRB 11265",
      "registerart": "HRB",
      "company_name": "Konato GmbH",
      "company_seat": "Unna",
      "details": "07.03.2025 (Bekanntmachungsdatum)\n\nNordrhein-Westfalen Amtsgericht Hamm HRB 11265\nRegisterbekanntmachung nach dem Umwandlungsgesetz 07.03.2025 (Eintragungsdatum)\n\nKonato GmbH\nGesellschaft mit beschränkter Haftung\nUnna\n\nDen Gläubigern der an der Verschmelzung beteiligten Rechtsträger ist, wenn sie binnen sechs Monaten nach dem Tag, an dem die Eintragung der Verschmelzung in das Register des Sitzes desjenigen Rechtsträgers, dessen Gläubiger sie sind, nach § 19 Absatz 3 UmwG als bekanntgemacht gilt, ihren Anspruch nach Grund und Höhe schriftlich anmelden, Sicherheit zu leisten, soweit sie nicht Befriedigung verlangen können. Dieses Recht steht den Gläubigern jedoch nur zu, wenn sie glaubhaft machen, dass durch die Verschmelzung die Erfüllung ihrer Forderung gefährdet wird."
    },
    {
      "date": "2025-03-07",
      "id": "103201",
      "original_text": "Sonstige Registerbekanntmachung\nNordrhein-Westfalen Amtsgericht Köln HRB 49903\nCurrenta Geschäftsführungs-GmbH – Leverkusen",
      "type": "Sonstige Registerbekanntmachung",
      "state": "Nordrhein-Westfalen",
      "amtsgericht": "Amtsgericht Köln",
      "registernummer": "HRB 49903",
      "registerart": "HRB",
      "company_name": "Currenta Geschäftsführungs-GmbH",
      "company_seat": "Leverkusen",
      "details": "07.03.2025 (Bekanntmachungsdatum)\n\nNordrhein-Westfalen Amtsgericht Köln HRB 49903\nSonstige Registerbekanntmachung\n\nCurrenta Geschäftsführungs-GmbH\nGesellschaft mit beschränkter Haftung\nLeverkusen\n\nDem Registergericht ist eine Liste der Mitglieder des Aufsichtsrates eingereicht worden."
    },
    {
      "date": "2025-03-07",
      "id": "103202",
      "original_text": "Einreichung neuer Dokumente\nNordrhein-Westfalen Amtsgericht Bochum HRB 9537\nWaterkotte GmbH – Herne",
      "type": "Einreichung neuer Dokumente",
      "state": "Nordrhein-Westfalen",
      "amtsgericht": "Amtsgericht Bochum",
      "registernummer": "HRB 9537",
      "registerart": "HRB",
      "company_name": "Waterkotte GmbH",
      "company_seat": "Herne",
      "details": "07.03.2025 (Bekanntmachungsdatum)\n\nNordrhein-Westfalen Amtsgericht Bochum HRB 9537\nEinreichung neuer Dokumente 07.03.2025 (Eintragungsdatum)\n\nWaterkotte GmbH\nGesellschaft mit beschränkter Haftung\nHerne\n\nDem Registergericht ist eine neue Liste der Mitglieder des Aufsichtsrates eingereicht worden."
    },
    {
      "date": "2025-03-07",
      "id": "103203",
      "original_text": "Registerbekanntmachung nach dem Umwandlungsgesetz\nNordrhein-Westfalen Amtsgericht Recklinghausen HRB 9778\nSKTEC GmbH – Herten",
      "type": "Registerbekanntmachung nach dem Umwandlungsgesetz",
      "state": "Nordrhein-Westfalen",
      "amtsgericht": "Amtsgericht Recklinghausen",
      "registernummer": "HRB 9778",
      "registerart": "HRB",
      "company_name": "SKTEC GmbH",
      "company_seat": "Herten",
      "details": "07.03.2025 (Bekanntmachungsdatum)\n\nNordrhein-Westfalen Amtsgericht Recklinghausen HRB 9778\nRegisterbekanntmachung nach dem Umwandlungsgesetz 07.03.2025 (Eintragungsdatum)\n\nSKTEC GmbH\nGesellschaft mit beschränkter Haftung\nHerten\n\nDen Gläubigern der an der Ausgliederung beteiligten Rechtsträger ist, wenn sie binnen sechs Monaten nach dem Tag, an dem die Eintragung der Ausgliederung in das Register des Sitzes desjenigen Rechtsträgers, dessen Gläubiger sie sind, nach § 19 Absatz 3 UmwG als bekanntgemacht gilt, ihren Anspruch nach Grund und Höhe schriftlich anmelden, Sicherheit zu leisten, soweit sie nicht Befriedigung verlangen können. Dieses Recht steht den Gläubigern jedoch nur zu, wenn sie glaubhaft machen, dass durch die Ausgliederung die Erfüllung ihrer Forderung gefährdet wird."
    },
    {
      "date": "2025-03-07",
      "id": "103204",
      "original_text": "Löschungsankündigung\nNordrhein-Westfalen Amtsgericht Düsseldorf HRB 100030\nneo-zone GmbH – Düsseldorf",
      "type": "Löschungsankündigung",
      "state": "Nordrhein-Westfalen",
      "amtsgericht": "Amtsgericht Düsseldorf",
      "registernummer": "HRB 100030",
      "registerart": "HRB",
      "company_name": "neo-zone GmbH",
      "company_seat": "Düsseldorf",
      "details": "07.03.2025 (Bekanntmachungsdatum)\n\nNordrhein-Westfalen Amtsgericht Düsseldorf HRB 100030\nLöschungsankündigung\n\nneo-zone GmbH\nGesellschaft mit beschränkter Haftung\nDüsseldorf\n\nDas Registergericht beabsichtigt die Gesellschaft von Amts wegen nach § 394 Abs. 1 FamFG zu löschen. Die Frist zur Erhebung eines Widerspruchs ist auf 3 Wochen festgesetzt.\n\nRechtsbehelfsbelehrung:\nDas Widerspruchsrecht steht jedem zu, der an der Unterlassung der Löschung ein berechtigtes Interesse hat. Der Widerspruch ist bei dem Amtsgericht Düsseldorf -Registergericht-, Werdener Straße 1, 40227 Düsseldorf schriftlich in deutscher Sprache oder zur Niederschrift der Geschäftsstelle einzulegen. Der Widerspruch kann auch zur Niederschrift der Geschäftsstelle eines jeden Amtsgerichtes abgegeben werden. Die Einlegung ist auch durch Übertragung eines elektronischen Dokuments an die elektronische Poststelle des Gerichts möglich. Das elektronische Dokument muss für die Bearbeitung durch das Gericht geeignet und mit einer qualifizierten elektronischen Signatur der verantwortenden Person versehen sein oder von der verantwortenden Person signiert und auf einem sicheren Übermittlungsweg gemäß § 130a ZPO nach näherer Maßgabe der Verordnung über die technischen Rahmenbedingungen des elektronischen Rechtsverkehrs und über das besondere elektronische Behördenpostfach (BGBl. I, S.3803) eingereicht werden. Weitere Informationen erhalten Sie auf der Internetseite www.justiz.de.\nDer Widerspruch muss spätestens innerhalb der gesetzten Frist nach dem Datum der Bekanntmachung der Löschungsankündigung bei dem Amtsgericht - Registergericht - Düsseldorf eingegangen sein.  Dies gilt auch dann, wenn der Widerspruch zur Niederschrift der Geschäftsstelle eines anderen Amtsgerichtes abgegeben wurde. Die Frist beginnt mit dem Tage der Bekanntmachung der Löschungsankündigung in dem für die Bekanntmachung der Eintragungen in das Handelsregister bestimmten elektronischen Informations- und Kommunikationssystem nach § 10 des Handelsgesetzbuches. Fällt das Ende der Frist auf einen Sonntag, einen allgemeinen Feiertag oder Sonnabend, so endet die Frist mit Ablauf des nächsten Werktages.\nDer Widerspruch muss die Bezeichnung der angefochtenen Löschungsankündigung sowie die Erklärung enthalten, dass Widerspruch gegen diese Löschungsankündigung eingelegt wird. Er ist zu unterzeichnen und soll begründet werden."
    },
    {
      "date": "2025-03-07",
      "id": "103205",
      "original_text": "Löschungsankündigung\nNordrhein-Westfalen Amtsgericht Duisburg HRA 8053\nGrundrendite Liegenschaften & Co. Beteiligungs oHG – Oberhausen",
      "type": "Löschungsankündigung",
      "state": "Nordrhein-Westfalen",
      "amtsgericht": "Amtsgericht Duisburg",
      "registernummer": "HRA 8053",
      "registerart": "HRA",
      "company_name": "Grundrendite Liegenschaften & Co. Beteiligungs oHG",
      "company_seat": "Oberhausen",
      "details": "07.03.2025 (Bekanntmachungsdatum)\n\nNordrhein-Westfalen Amtsgericht Duisburg HRA 8053\nLöschungsankündigung\n\nGrundrendite Liegenschaften & Co. Beteiligungs oHG\nOffene Handelsgesellschaft\nOberhausen\n\nDas Registergericht beabsichtigt, die im Handelsregister unter HRA 8053  eingetragene Gesellschaft Grundrendite Liegenschaften & Co.Beteiligungs oHG mit Sitz in Oberhausen gemäß §§ 31 Abs. 2 HGB, 393 FamFG zu löschen.\nWiderspruchsfrist: 3 Monate\n\nRechtsbehelfsbelehrung\nDer Widerspruch ist bei dem Amtsgericht Duisburg, Kardinal-Galen-Str. 124-132, 47058 Duisburg schriftlich in deutscher Sprache oder zur Niederschrift der Geschäftsstelle einzulegen. Der Widerspruch kann auch zur Niederschrift der Geschäftsstelle eines jeden Amtsgerichtes abgegeben werden. Die Einlegung ist auch durch Übertragung eines elektronischen Dokuments an die elektronische Poststelle des Gerichts möglich. Das elektronische Dokument muss für die Bearbeitung durch das Gericht geeignet und mit einer qualifizierten elektronischen Signatur der verantwortenden Person versehen sein oder von der verantwortenden Person signiert und auf einem sicheren Übermittlungsweg gemäß § 130 a ZPO nach näherer Maßgabe der Verordnung über die technischen Rahmenbedingungen des elektronischen Rechtsverkehrs und über das besondere elektronische Behördenpostfach (BGBl. I, S. 3803) eingereicht werden. Weitere Informationen erhalten Sie auf der Internetseite www.justiz.de <http://www.justiz.de>. Der Widerspruch muss spätestens innerhalb der gesetzten Frist bei dem Amtsgericht Duisburg eingegangen sein. Dies gilt auch dann, wenn der Widerspruch zur Niederschrift der Geschäftsstelle eines anderen Amtsgerichtes abgegeben wurde. Die Frist beginnt mit der Veröffentlichung. Fällt das Ende der Frist auf einen Sonntag, einen allgemeinen Feiertag oder Sonnabend, so endet die Frist mit Ablauf des nächsten Werktages. Der Widerspruch muss die Bezeichnung der angefochtenen Verfügung sowie die Erklärung enthalten, dass Widerspruch gegen diese Verfügung eingelegt wird. Er ist zu unterzeichnen und soll begründet werden."
    },
    {
      "date": "2025-03-07",
      "id": "103206",
      "original_text": "Einreichung neuer Dokumente\nNordrhein-Westfalen Amtsgericht Essen HRB 17487\nOpen Grid Europe GmbH – Essen",
      "type": "Einreichung neuer Dokumente",
      "state": "Nordrhein-Westfalen",
      "amtsgericht": "Amtsgericht Essen",
      "registernummer": "HRB 17487",
      "registerart": "HRB",
      "company_name": "Open Grid Europe GmbH",
      "company_seat": "Essen",
      "details": "07.03.2025 (Bekanntmachungsdatum)\n\nNordrhein-Westfalen Amtsgericht Essen HRB 17487\nEinreichung neuer Dokumente\n\nOpen Grid Europe GmbH\nGesellschaft mit beschränkter Haftung\nEssen\n\nDem Registergericht ist eine neue Liste der Mitglieder des Aufsichtsrates eingereicht worden."
    },
    {
      "date": "2025-03-07",
      "id": "103207",
      "original_text": "Registerbekanntmachung nach dem Umwandlungsgesetz\nNordrhein-Westfalen Amtsgericht Köln HRB 94685\nPKM Solutions GmbH – Leverkusen",
      "type": "Registerbekanntmachung nach dem Umwandlungsgesetz",
      "state": "Nordrhein-Westfalen",
      "amtsgericht": "Amtsgericht Köln",
      "registernummer": "HRB 94685",
      "registerart": "HRB",
      "company_name": "PKM Solutions GmbH",
      "company_seat": "Leverkusen",
      "details": "07.03.2025 (Bekanntmachungsdatum)\n\nNordrhein-Westfalen Amtsgericht Köln HRB 94685\nRegisterbekanntmachung nach dem Umwandlungsgesetz 07.03.2025 (Eintragungsdatum)\n\nPKM Solutions GmbH\nGesellschaft mit beschränkter Haftung\nLeverkusen\n\nDen Gläubigern der an der Verschmelzung beteiligten Rechtsträger ist, wenn sie binnen sechs Monaten nach dem Tag, an dem die Eintragung der Verschmelzung in das Register des Sitzes desjenigen Rechtsträgers, dessen Gläubiger sie sind, nach § 19 Absatz 3 UmwG als bekanntgemacht gilt, ihren Anspruch nach Grund und Höhe schriftlich anmelden, Sicherheit zu leisten, soweit sie nicht Befriedigung verlangen können. Dieses Recht steht den Gläubigern jedoch nur zu, wenn sie glaubhaft machen, dass durch die Verschmelzung die Erfüllung ihrer Forderung gefährdet wird."
    },
    {
      "date": "2025-03-07",
      "id": "103208",
      "original_text": "Registerbekanntmachung nach dem Umwandlungsgesetz\nNordrhein-Westfalen Amtsgericht Köln HRB 97378\nPKM Immobilien GmbH – Leverkusen",
      "type": "Registerbekanntmachung nach dem Umwandlungsgesetz",
      "state": "Nordrhein-Westfalen",
      "amtsgericht": "Amtsgericht Köln",
      "registernummer": "HRB 97378",
      "registerart": "HRB",
      "company_name": "PKM Immobilien GmbH",
      "company_seat": "Leverkusen",
      "details": "07.03.2025 (Bekanntmachungsdatum)\n\nNordrhein-Westfalen Amtsgericht Köln HRB 97378\nRegisterbekanntmachung nach dem Umwandlungsgesetz 07.03.2025 (Eintragungsdatum)\n\nPKM Immobilien GmbH\nGesellschaft mit beschränkter Haftung\nLeverkusen\n\nDen Gläubigern der an der Verschmelzung beteiligten Rechtsträger ist, wenn sie binnen sechs Monaten nach dem Tag, an dem die Eintragung der Verschmelzung in das Register des Sitzes desjenigen Rechtsträgers, dessen Gläubiger sie sind, nach § 19 Absatz 3 UmwG als bekanntgemacht gilt, ihren Anspruch nach Grund und Höhe schriftlich anmelden, Sicherheit zu leisten, soweit sie nicht Befriedigung verlangen können. Dieses Recht steht den Gläubigern jedoch nur zu, wenn sie glaubhaft machen, dass durch die Verschmelzung die Erfüllung ihrer Forderung gefährdet wird."
    },
    {
      "date": "2025-03-07",
      "id": "103209",
      "original_text": "Löschungsankündigung\nNordrhein-Westfalen Amtsgericht Dortmund HRB 31814\nCiobanu UG (haftungsbeschränkt) – Dortmund",
      "type": "Löschungsankündigung",
      "state": "Nordrhein-Westfalen",
      "amtsgericht": "Amtsgericht Dortmund",
      "registernummer": "HRB 31814",
      "registerart": "HRB",
      "company_name": "Ciobanu UG (haftungsbeschränkt)",
      "company_seat": "Dortmund",
      "details": "07.03.2025 (Bekanntmachungsdatum)\n\nNordrhein-Westfalen Amtsgericht Dortmund HRB 31814\nLöschungsankündigung\n\nCiobanu UG (haftungsbeschränkt)\nGesellschaft mit beschränkter Haftung\nDortmund\n\nDas Registergericht beabsichtigt die Gesellschaft von Amts wegen nach § 394 FamFG zu löschen. Die Frist zur Erhebung eines Widerspruchs ist auf zwei Monate festgesetzt."
    },
    {
      "date": "2025-03-07",
      "id": "103210",
      "original_text": "Registerbekanntmachung nach dem Umwandlungsgesetz\nNordrhein-Westfalen Amtsgericht Steinfurt HRB 12297\nEficode Germany GmbH – Hörstel",
      "type": "Registerbekanntmachung nach dem Umwandlungsgesetz",
      "state": "Nordrhein-Westfalen",
      "amtsgericht": "Amtsgericht Steinfurt",
      "registernummer": "HRB 12297",
      "registerart": "HRB",
      "company_name": "Eficode Germany GmbH",
      "company_seat": "Hörstel",
      "details": "07.03.2025 (Bekanntmachungsdatum)\n\nNordrhein-Westfalen Amtsgericht Steinfurt HRB 12297\nRegisterbekanntmachung nach dem Umwandlungsgesetz 07.03.2025 (Eintragungsdatum)\n\nEficode Germany GmbH\nGesellschaft mit beschränkter Haftung\nHörstel\n\nDen Gläubigern der an der Verschmelzung beteiligten Rechtsträger ist, wenn sie binnen sechs Monaten nach dem Tag, an dem die Eintragung der Verschmelzung in das Register des Sitzes derjenigen Rechtsträger deren Gläubiger sie sind, nach § 19 Absatz 3 UmwG als bekanntgemacht gilt, ihren Anspruch nach Grund und Höhe schriftlich anmelden, Sicherheit zu leisten, soweit sie nicht Befriedigung verlangen können. Dieses Recht steht den Gläubigern jedoch nur zu, wenn sie glaubhaft machen, dass durch die Verschmelzung die Erfüllung ihrer Forderung gefährdet wird."
    },
    {
      "date": "2025-03-07",
      "id": "103211",
      "original_text": "Löschungsankündigung\nNordrhein-Westfalen Amtsgericht Düsseldorf HRB 100675\nWeber Sanierungsteam GmbH – Düsseldorf",
      "type": "Löschungsankündigung",
      "state": "Nordrhein-Westfalen",
      "amtsgericht": "Amtsgericht Düsseldorf",
      "registernummer": "HRB 100675",
      "registerart": "HRB",
      "company_name": "Weber Sanierungsteam GmbH",
      "company_seat": "Düsseldorf",
      "details": "07.03.2025 (Bekanntmachungsdatum)\n\nNordrhein-Westfalen Amtsgericht Düsseldorf HRB 100675\nLöschungsankündigung\n\nWeber Sanierungsteam GmbH\nGesellschaft mit beschränkter Haftung\nDüsseldorf\n\nDas Registergericht beabsichtigt die Gesellschaft von Amts wegen nach § 394 FamFG zu löschen. Die Frist zur Erhebung eines Widerspruchs ist auf 3 Wochen festgesetzt.\n\nRechtsbehelfsbelehrung:\nDas Widerspruchsrecht steht jedem zu, der an der Unterlassung der Löschung ein berechtigtes Interesse hat. Der Widerspruch ist bei dem Amtsgericht Düsseldorf -Registergericht-, Werdener Straße 1, 40227 Düsseldorf schriftlich in deutscher Sprache oder zur Niederschrift der Geschäftsstelle einzulegen. Der Widerspruch kann auch zur Niederschrift der Geschäftsstelle eines jeden Amtsgerichtes abgegeben werden. Die Einlegung ist auch durch Übertragung eines elektronischen Dokuments an die elektronische Poststelle des Gerichts möglich. Das elektronische Dokument muss für die Bearbeitung durch das Gericht geeignet und mit einer qualifizierten elektronischen Signatur der verantwortenden Person versehen sein oder von der verantwortenden Person signiert und auf einem sicheren Übermittlungsweg gemäß § 130a ZPO nach näherer Maßgabe der Verordnung über die technischen Rahmenbedingungen des elektronischen Rechtsverkehrs und über das besondere elektronische Behördenpostfach (BGBl. I, S.3803) eingereicht werden. Weitere Informationen erhalten Sie auf der Internetseite www.justiz.de.\nDer Widerspruch muss spätestens innerhalb der gesetzten Frist nach dem Datum der Bekanntmachung der Löschungsankündigung bei dem Amtsgericht - Registergericht - Düsseldorf eingegangen sein.  Dies gilt auch dann, wenn der Widerspruch zur Niederschrift der Geschäftsstelle eines anderen Amtsgerichtes abgegeben wurde. Die Frist beginnt mit dem Tage der Bekanntmachung der Löschungsankündigung in dem für die Bekanntmachung der Eintragungen in das Handelsregister bestimmten elektronischen Informations- und Kommunikationssystem nach § 10 des Handelsgesetzbuches. Fällt das Ende der Frist auf einen Sonntag, einen allgemeinen Feiertag oder Sonnabend, so endet die Frist mit Ablauf des nächsten Werktages.\nDer Widerspruch muss die Bezeichnung der angefochtenen Löschungsankündigung sowie die Erklärung enthalten, dass Widerspruch gegen diese Löschungsankündigung eingelegt wird. Er ist zu unterzeichnen und soll begründet werden."
    },
    {
      "date": "2025-03-07",
      "id": "103212",
      "original_text": "Löschungsankündigung\nNordrhein-Westfalen Amtsgericht Wuppertal HRB 28914\nFaßbeck UG (haftungsbeschränkt) Handwerker Service – Wuppertal",
      "type": "Löschungsankündigung",
      "state": "Nordrhein-Westfalen",
      "amtsgericht": "Amtsgericht Wuppertal",
      "registernummer": "HRB 28914",
      "registerart": "HRB",
      "company_name": "Faßbeck UG (haftungsbeschränkt) Handwerker Service",
      "company_seat": "Wuppertal",
      "details": "07.03.2025 (Bekanntmachungsdatum)\n\nNordrhein-Westfalen Amtsgericht Wuppertal HRB 28914\nLöschungsankündigung\n\nFaßbeck UG (haftungsbeschränkt) Handwerker Service\nGesellschaft mit beschränkter Haftung\nWuppertal\n\nDas Registergericht beabsichtigt die Gesellschaft von Amts wegen nach § 394 FamFG zu löschen. Die Frist zur Erhebung eines Widerspruchs ist auf einen Monat festgesetzt."
    },
    {
      "date": "2025-03-07",
      "id": "103213",
      "original_text": "Löschungsankündigung\nNordrhein-Westfalen Amtsgericht Dortmund HRA 16007\nSEXTRO ENGINEERING GmbH & Co. KG – Werne",
      "type": "Löschungsankündigung",
      "state": "Nordrhein-Westfalen",
      "amtsgericht": "Amtsgericht Dortmund",
      "registernummer": "HRA 16007",
      "registerart": "HRA",
      "company_name": "SEXTRO ENGINEERING GmbH & Co. KG",
      "company_seat": "Werne",
      "details": "07.03.2025 (Bekanntmachungsdatum)\n\nNordrhein-Westfalen Amtsgericht Dortmund HRA 16007\nLöschungsankündigung 07.03.2025 (Eintragungsdatum)\n\nSEXTRO ENGINEERING GmbH & Co. KG\nKommanditgesellschaft\nWerne\n\nDas Registergericht beabsichtigt die Firma von Amts wegen nach §§ 31 Abs. 2 HGB, 393 FamFG zu löschen. Die Frist zur Erhebung eines Widerspruchs ist auf drei Monate festgesetzt."
    },
    {
      "date": "2025-03-07",
      "id": "103214",
      "original_text": "Registerbekanntmachung nach dem Umwandlungsgesetz\nNordrhein-Westfalen Amtsgericht Recklinghausen HRA 6830\nSKTEC Kornelia Söth e.K. – Herten",
      "type": "Registerbekanntmachung nach dem Umwandlungsgesetz",
      "state": "Nordrhein-Westfalen",
      "amtsgericht": "Amtsgericht Recklinghausen",
      "registernummer": "HRA 6830",
      "registerart": "HRA",
      "company_name": "SKTEC Kornelia Söth e.K.",
      "company_seat": "Herten",
      "details": "07.03.2025 (Bekanntmachungsdatum)\n\nNordrhein-Westfalen Amtsgericht Recklinghausen HRA 6830\nRegisterbekanntmachung nach dem Umwandlungsgesetz 07.03.2025 (Eintragungsdatum)\n\nSKTEC Kornelia Söth e.K.\nEinzelkaufmann / Einzelkauffrau\nHerten\n\nDen Gläubigern der an der Ausgliederung beteiligten Rechtsträger ist, wenn sie binnen sechs Monaten nach dem Tag, an dem die Eintragung der Ausgliederung in das Register des Sitzes desjenigen Rechtsträgers, dessen Gläubiger sie sind, nach § 19 Absatz 3 UmwG als bekanntgemacht gilt, ihren Anspruch nach Grund und Höhe schriftlich anmelden, Sicherheit zu leisten, soweit sie nicht Befriedigung verlangen können. Dieses Recht steht den Gläubigern jedoch nur zu, wenn sie glaubhaft machen, dass durch die Ausgliederung die Erfüllung ihrer Forderung gefährdet wird."
    },
    {
      "date": "2025-03-07",
      "id": "103215",
      "original_text": "Einreichung neuer Dokumente\nNordrhein-Westfalen Amtsgericht Essen HRB 24298\nVier Gas Services Management GmbH – Essen",
      "type": "Einreichung neuer Dokumente",
      "state": "Nordrhein-Westfalen",
      "amtsgericht": "Amtsgericht Essen",
      "registernummer": "HRB 24298",
      "registerart": "HRB",
      "company_name": "Vier Gas Services Management GmbH",
      "company_seat": "Essen",
      "details": "07.03.2025 (Bekanntmachungsdatum)\n\nNordrhein-Westfalen Amtsgericht Essen HRB 24298\nEinreichung neuer Dokumente 07.03.2025 (Eintragungsdatum)\n\nVier Gas Services Management GmbH\nGesellschaft mit beschränkter Haftung\nEssen\n\nDem Registergericht ist eine neue Liste der Mitglieder des Aufsichtsrates eingereicht worden."
    },
    {
      "date": "2025-03-07",
      "id": "103216",
      "original_text": "Löschungsankündigung\nNordrhein-Westfalen Amtsgericht Düsseldorf HRB 68278\nENTEF UG (haftungsbeschränkt) – Düsseldorf",
      "type": "Löschungsankündigung",
      "state": "Nordrhein-Westfalen",
      "amtsgericht": "Amtsgericht Düsseldorf",
      "registernummer": "HRB 68278",
      "registerart": "HRB",
      "company_name": "ENTEF UG (haftungsbeschränkt)",
      "company_seat": "Düsseldorf",
      "details": "07.03.2025 (Bekanntmachungsdatum)\n\nNordrhein-Westfalen Amtsgericht Düsseldorf HRB 68278\nLöschungsankündigung\n\nENTEF UG (haftungsbeschränkt)\nGesellschaft mit beschränkter Haftung\nDüsseldorf\n\nDas Registergericht beabsichtigt die Gesellschaft von Amts wegen nach § 394 FamFG zu löschen. Die Frist zur Erhebung eines Widerspruchs ist auf 3 Wochen festgesetzt.\n\nRechtsbehelfsbelehrung:\nDas Widerspruchsrecht steht jedem zu, der an der Unterlassung der Löschung ein berechtigtes Interesse hat. Der Widerspruch ist bei dem Amtsgericht Düsseldorf -Registergericht-, Werdener Straße 1, 40227 Düsseldorf schriftlich in deutscher Sprache oder zur Niederschrift der Geschäftsstelle einzulegen. Der Widerspruch kann auch zur Niederschrift der Geschäftsstelle eines jeden Amtsgerichtes abgegeben werden. Die Einlegung ist auch durch Übertragung eines elektronischen Dokuments an die elektronische Poststelle des Gerichts möglich. Das elektronische Dokument muss für die Bearbeitung durch das Gericht geeignet und mit einer qualifizierten elektronischen Signatur der verantwortenden Person versehen sein oder von der verantwortenden Person signiert und auf einem sicheren Übermittlungsweg gemäß § 130a ZPO nach näherer Maßgabe der Verordnung über die technischen Rahmenbedingungen des elektronischen Rechtsverkehrs und über das besondere elektronische Behördenpostfach (BGBl. I, S.3803) eingereicht werden. Weitere Informationen erhalten Sie auf der Internetseite www.justiz.de.\nDer Widerspruch muss spätestens innerhalb der gesetzten Frist nach dem Datum der Bekanntmachung der Löschungsankündigung bei dem Amtsgericht - Registergericht - Düsseldorf eingegangen sein.  Dies gilt auch dann, wenn der Widerspruch zur Niederschrift der Geschäftsstelle eines anderen Amtsgerichtes abgegeben wurde. Die Frist beginnt mit dem Tage der Bekanntmachung der Löschungsankündigung in dem für die Bekanntmachung der Eintragungen in das Handelsregister bestimmten elektronischen Informations- und Kommunikationssystem nach § 10 des Handelsgesetzbuches. Fällt das Ende der Frist auf einen Sonntag, einen allgemeinen Feiertag oder Sonnabend, so endet die Frist mit Ablauf des nächsten Werktages.\nDer Widerspruch muss die Bezeichnung der angefochtenen Löschungsankündigung sowie die Erklärung enthalten, dass Widerspruch gegen diese Löschungsankündigung eingelegt wird. Er ist zu unterzeichnen und soll begründet werden."
    },
    {
      "date": "2025-03-07",
      "id": "103217",
      "original_text": "Löschungsankündigung\nNordrhein-Westfalen Amtsgericht Düsseldorf HRB 99889\nSHIBAHAMAYA GmbH – Düsseldorf",
      "type": "Löschungsankündigung",
      "state": "Nordrhein-Westfalen",
      "amtsgericht": "Amtsgericht Düsseldorf",
      "registernummer": "HRB 99889",
      "registerart": "HRB",
      "company_name": "SHIBAHAMAYA GmbH",
      "company_seat": "Düsseldorf",
      "details": "07.03.2025 (Bekanntmachungsdatum)\n\nNordrhein-Westfalen Amtsgericht Düsseldorf HRB 99889\nLöschungsankündigung\n\nSHIBAHAMAYA GmbH\nGesellschaft mit beschränkter Haftung\nDüsseldorf\n\nDas Registergericht beabsichtigt die Gesellschaft von Amts wegen nach § 394 FamFG zu löschen. Die Frist zur Erhebung eines Widerspruchs ist auf 3 Wochen festgesetzt.\n\nRechtsbehelfsbelehrung:\nDas Widerspruchsrecht steht jedem zu, der an der Unterlassung der Löschung ein berechtigtes Interesse hat. Der Widerspruch ist bei dem Amtsgericht Düsseldorf -Registergericht-, Werdener Straße 1, 40227 Düsseldorf schriftlich in deutscher Sprache oder zur Niederschrift der Geschäftsstelle einzulegen. Der Widerspruch kann auch zur Niederschrift der Geschäftsstelle eines jeden Amtsgerichtes abgegeben werden. Die Einlegung ist auch durch Übertragung eines elektronischen Dokuments an die elektronische Poststelle des Gerichts möglich. Das elektronische Dokument muss für die Bearbeitung durch das Gericht geeignet und mit einer qualifizierten elektronischen Signatur der verantwortenden Person versehen sein oder von der verantwortenden Person signiert und auf einem sicheren Übermittlungsweg gemäß § 130a ZPO nach näherer Maßgabe der Verordnung über die technischen Rahmenbedingungen des elektronischen Rechtsverkehrs und über das besondere elektronische Behördenpostfach (BGBl. I, S.3803) eingereicht werden. Weitere Informationen erhalten Sie auf der Internetseite www.justiz.de.\nDer Widerspruch muss spätestens innerhalb der gesetzten Frist nach dem Datum der Bekanntmachung der Löschungsankündigung bei dem Amtsgericht - Registergericht - Düsseldorf eingegangen sein.  Dies gilt auch dann, wenn der Widerspruch zur Niederschrift der Geschäftsstelle eines anderen Amtsgerichtes abgegeben wurde. Die Frist beginnt mit dem Tage der Bekanntmachung der Löschungsankündigung in dem für die Bekanntmachung der Eintragungen in das Handelsregister bestimmten elektronischen Informations- und Kommunikationssystem nach § 10 des Handelsgesetzbuches. Fällt das Ende der Frist auf einen Sonntag, einen allgemeinen Feiertag oder Sonnabend, so endet die Frist mit Ablauf des nächsten Werktages.\nDer Widerspruch muss die Bezeichnung der angefochtenen Löschungsankündigung sowie die Erklärung enthalten, dass Widerspruch gegen diese Löschungsankündigung eingelegt wird. Er ist zu unterzeichnen und soll begründet werden."
    },
    {
      "date": "2025-03-07",
      "id": "103218",
      "original_text": "Löschungsankündigung\nNordrhein-Westfalen Amtsgericht Düsseldorf HRB 99742\nStrong Security GmbH – Düsseldorf",
      "type": "Löschungsankündigung",
      "state": "Nordrhein-Westfalen",
      "amtsgericht": "Amtsgericht Düsseldorf",
      "registernummer": "HRB 99742",
      "registerart": "HRB",
      "company_name": "Strong Security GmbH",
      "company_seat": "Düsseldorf",
      "details": "07.03.2025 (Bekanntmachungsdatum)\n\nNordrhein-Westfalen Amtsgericht Düsseldorf HRB 99742\nLöschungsankündigung\n\nStrong Security GmbH\nGesellschaft mit beschränkter Haftung\nDüsseldorf\n\nDas Registergericht beabsichtigt die Gesellschaft von Amts wegen nach § 394 FamFG zu löschen. Die Frist zur Erhebung eines Widerspruchs ist auf 3 Wochen festgesetzt.\n\nRechtsbehelfsbelehrung:\nDas Widerspruchsrecht steht jedem zu, der an der Unterlassung der Löschung ein berechtigtes Interesse hat. Der Widerspruch ist bei dem Amtsgericht Düsseldorf -Registergericht-, Werdener Straße 1, 40227 Düsseldorf schriftlich in deutscher Sprache oder zur Niederschrift der Geschäftsstelle einzulegen. Der Widerspruch kann auch zur Niederschrift der Geschäftsstelle eines jeden Amtsgerichtes abgegeben werden. Die Einlegung ist auch durch Übertragung eines elektronischen Dokuments an die elektronische Poststelle des Gerichts möglich. Das elektronische Dokument muss für die Bearbeitung durch das Gericht geeignet und mit einer qualifizierten elektronischen Signatur der verantwortenden Person versehen sein oder von der verantwortenden Person signiert und auf einem sicheren Übermittlungsweg gemäß § 130a ZPO nach näherer Maßgabe der Verordnung über die technischen Rahmenbedingungen des elektronischen Rechtsverkehrs und über das besondere elektronische Behördenpostfach (BGBl. I, S.3803) eingereicht werden. Weitere Informationen erhalten Sie auf der Internetseite www.justiz.de.\nDer Widerspruch muss spätestens innerhalb der gesetzten Frist nach dem Datum der Bekanntmachung der Löschungsankündigung bei dem Amtsgericht - Registergericht - Düsseldorf eingegangen sein.  Dies gilt auch dann, wenn der Widerspruch zur Niederschrift der Geschäftsstelle eines anderen Amtsgerichtes abgegeben wurde. Die Frist beginnt mit dem Tage der Bekanntmachung der Löschungsankündigung in dem für die Bekanntmachung der Eintragungen in das Handelsregister bestimmten elektronischen Informations- und Kommunikationssystem nach § 10 des Handelsgesetzbuches. Fällt das Ende der Frist auf einen Sonntag, einen allgemeinen Feiertag oder Sonnabend, so endet die Frist mit Ablauf des nächsten Werktages.\nDer Widerspruch muss die Bezeichnung der angefochtenen Löschungsankündigung sowie die Erklärung enthalten, dass Widerspruch gegen diese Löschungsankündigung eingelegt wird. Er ist zu unterzeichnen und soll begründet werden."
    },
    {
      "date": "2025-03-07",
      "id": "103219",
      "original_text": "Einreichung neuer Dokumente\nHessen Amtsgericht Offenbach am Main VR 1226\nLämmerspieler Jagdhornbläser \"Freunde der Jagdmusik\" – Mühlheim am Main",
      "type": "Einreichung neuer Dokumente",
      "state": "Hessen",
      "amtsgericht": "Amtsgericht Offenbach am Main",
      "registernummer": "VR 1226",
      "registerart": "VR",
      "company_name": "Lämmerspieler Jagdhornbläser \"Freunde der Jagdmusik\"",
      "company_seat": "Mühlheim am Main",
      "details": "07.03.2025 (Bekanntmachungsdatum)\n\nHessen Amtsgericht Offenbach am Main VR 1226\nEinreichung neuer Dokumente 07.03.2025 (Eintragungsdatum)\n\nLämmerspieler Jagdhornbläser \"Freunde der Jagdmusik\"\neingetragener Verein\nMühlheim am Main\n\nDer Verein ist aufgelöst."
    },
    {
      "date": "2025-03-07",
      "id": "103220",
      "original_text": "Löschungsankündigung\nHessen Amtsgericht Frankfurt am Main HRA 51945\nNaGa Solarpark Gorgast GmbH & Co. KG – Frankfurt am Main",
      "type": "Löschungsankündigung",
      "state": "Hessen",
      "amtsgericht": "Amtsgericht Frankfurt am Main",
      "registernummer": "HRA 51945",
      "registerart": "HRA",
      "company_name": "NaGa Solarpark Gorgast GmbH & Co. KG",
      "company_seat": "Frankfurt am Main",
      "details": "07.03.2025 (Bekanntmachungsdatum)\n\nHessen Amtsgericht Frankfurt am Main HRA 51945\nLöschungsankündigung 07.03.2025 (Eintragungsdatum)\n\nNaGa Solarpark Gorgast GmbH & Co. KG\nKommanditgesellschaft\nFrankfurt am Main\n\nDen Gläubigern der an der formwechselnden Umwandlung beteiligten Rechtsträger ist, wenn sie binnen sechs Monaten nach dem Tag, an dem die Eintragung der formwechselnden Umwandlung in das Register des Sitzes derjenigen Rechtsträger deren Gläubiger sie sind, nach § 201 UmwG bekannt gemacht worden ist, ihren Anspruch nach Grund und Höhe schriftlich anmelden, Sicherheit zu leisten, soweit sie nicht Befriedigung verlangen können. Dieses Recht steht den Gläubigern jedoch nur zu, wenn sie glaubhaft machen, dass durch die formwechselnden Umwandlung die Erfüllung ihrer Forderung gefährdet wird."
    },
    {
      "date": "2025-03-07",
      "id": "103221",
      "original_text": "Registerbekanntmachung nach dem Umwandlungsgesetz\nHessen Amtsgericht Frankfurt am Main HRA 53818\nEnzo Venturino e.K. – Bad Vilbel",
      "type": "Registerbekanntmachung nach dem Umwandlungsgesetz",
      "state": "Hessen",
      "amtsgericht": "Amtsgericht Frankfurt am Main",
      "registernummer": "HRA 53818",
      "registerart": "HRA",
      "company_name": "Enzo Venturino e.K.",
      "company_seat": "Bad Vilbel",
      "details": "07.03.2025 (Bekanntmachungsdatum)\n\nHessen Amtsgericht Frankfurt am Main HRA 53818\nRegisterbekanntmachung nach dem Umwandlungsgesetz 07.03.2025 (Eintragungsdatum)\n\nEnzo Venturino e.K.\nEinzelkaufmann / Einzelkauffrau\nBad Vilbel\n\nDen Gläubigern der an der Verschmelzung beteiligten Rechtsträger ist, wenn sie binnen sechs Monaten nach dem Tag, an dem die Eintragung der Verschmelzung in das Register des Sitzes desjenigen Rechtsträgers, dessen Gläubiger sie sind, nach § 19 Absatz 3 UmwG bekannt gemacht worden ist, ihren Anspruch nach Grund und Höhe schriftlich anmelden, Sicherheit zu leisten, soweit sie nicht Befriedigung verlangen können. Dieses Recht steht den Gläubigern jedoch nur zu, wenn sie glaubhaft machen, dass durch die Verschmelzung die Erfüllung ihrer Forderung gefährdet wird."
    },
    {
      "date": "2025-03-07",
      "id": "103222",
      "original_text": "Registerbekanntmachung nach dem Umwandlungsgesetz\nHessen Amtsgericht Offenbach am Main HRB 11546\nStratec 2000 Beteiligungsgesellschaft mbH – Heusenstamm",
      "type": "Registerbekanntmachung nach dem Umwandlungsgesetz",
      "state": "Hessen",
      "amtsgericht": "Amtsgericht Offenbach am Main",
      "registernummer": "HRB 11546",
      "registerart": "HRB",
      "company_name": "Stratec 2000 Beteiligungsgesellschaft mbH",
      "company_seat": "Heusenstamm",
      "details": "07.03.2025 (Bekanntmachungsdatum)\n\nHessen Amtsgericht Offenbach am Main HRB 11546\nRegisterbekanntmachung nach dem Umwandlungsgesetz 07.03.2025 (Eintragungsdatum)\n\nStratec 2000 Beteiligungsgesellschaft mbH\nGesellschaft mit beschränkter Haftung\nHeusenstamm\n\nDen Gläubigern der an der Verschmelzung beteiligten Rechtsträger ist, wenn sie binnen sechs Monaten nach dem Tag, an dem die Eintragung der Verschmelzung in das Register des Sitzes desjenigen Rechtsträgers, dessen Gläubiger sie sind, nach § 19 Absatz 3 UmwG bekannt gemacht worden ist, ihren Anspruch nach Grund und Höhe schriftlich anmelden, Sicherheit zu leisten, soweit sie nicht Befriedigung verlangen können. Dieses Recht steht den Gläubigern jedoch nur zu, wenn sie glaubhaft machen, dass durch die Verschmelzung die Erfüllung ihrer Forderung gefährdet wird."
    },
    {
      "date": "2025-03-07",
      "id": "103223",
      "original_text": "Einreichung neuer Dokumente\nHessen Amtsgericht Bad Homburg v.d.H. HRB 11654\nFresenius Kabi Aktiengesellschaft – Bad Homburg v. d. Höhe",
      "type": "Einreichung neuer Dokumente",
      "state": "Hessen",
      "amtsgericht": "Amtsgericht Bad Homburg v.d.H.",
      "registernummer": "HRB 11654",
      "registerart": "HRB",
      "company_name": "Fresenius Kabi Aktiengesellschaft",
      "company_seat": "Bad Homburg v. d. Höhe",
      "details": "07.03.2025 (Bekanntmachungsdatum)\n\nHessen Amtsgericht Bad Homburg v.d.H. HRB 11654\nEinreichung neuer Dokumente\n\nFresenius Kabi Aktiengesellschaft\nAktiengesellschaft\nBad Homburg v. d. Höhe\n\nDurch eine Änderung in den Personen der Aufsichtsratsmitglieder ist eine Liste der Mitglieder des Aufsichtsrates zum Handelsregister eingereicht worden."
    },
    {
      "date": "2025-03-07",
      "id": "103224",
      "original_text": "Einreichung neuer Dokumente\nHessen Amtsgericht Friedberg HRB 2556\nEnergie und Versorgung Butzbach GmbH – Butzbach",
      "type": "Einreichung neuer Dokumente",
      "state": "Hessen",
      "amtsgericht": "Amtsgericht Friedberg",
      "registernummer": "HRB 2556",
      "registerart": "HRB",
      "company_name": "Energie und Versorgung Butzbach GmbH",
      "company_seat": "Butzbach",
      "details": "07.03.2025 (Bekanntmachungsdatum)\n\nHessen Amtsgericht Friedberg HRB 2556\nEinreichung neuer Dokumente\n\nEnergie und Versorgung Butzbach GmbH\nGesellschaft mit beschränkter Haftung\nButzbach\n\nDurch eine Änderung in den Personen der Aufsichtsratsmitglieder ist eine Liste der Mitglieder des Aufsichtsrates zum Handelsregister eingereicht worden."
    },
    {
      "date": "2025-03-07",
      "id": "103225",
      "original_text": "Löschungsankündigung\nHessen Amtsgericht Offenbach am Main HRA 9819\nd. k. automation e.K. – Offenbach am Main",
      "type": "Löschungsankündigung",
      "state": "Hessen",
      "amtsgericht": "Amtsgericht Offenbach am Main",
      "registernummer": "HRA 9819",
      "registerart": "HRA",
      "company_name": "d. k. automation e.K.",
      "company_seat": "Offenbach am Main",
      "details": "07.03.2025 (Bekanntmachungsdatum)\n\nHessen Amtsgericht Offenbach am Main HRA 9819\nLöschungsankündigung\n\nd. k. automation e.K.\nEinzelkaufmann / Einzelkauffrau\nOffenbach am Main\n\nDas Registergericht beabsichtigt die im Handelsregister eingetragene Firma von Amts wegen nach § 31 Abs. 2 Satz 2 HGB i.V.m. § 393 FamFG zu löschen. Die Frist zur Erhebung eines Widerspruchs gegen die beabsichtigte Löschung wird auf 3 Monate festgesetzt."
    },
    {
      "date": "2025-03-07",
      "id": "103226",
      "original_text": "Registerbekanntmachung nach dem Umwandlungsgesetz\nHessen Amtsgericht Frankfurt am Main HRA 52987\nDIC 27 Portfolio GmbH & Co. KG – Frankfurt am Main",
      "type": "Registerbekanntmachung nach dem Umwandlungsgesetz",
      "state": "Hessen",
      "amtsgericht": "Amtsgericht Frankfurt am Main",
      "registernummer": "HRA 52987",
      "registerart": "HRA",
      "company_name": "DIC 27 Portfolio GmbH & Co. KG",
      "company_seat": "Frankfurt am Main",
      "details": "07.03.2025 (Bekanntmachungsdatum)\n\nHessen Amtsgericht Frankfurt am Main HRA 52987\nRegisterbekanntmachung nach dem Umwandlungsgesetz 07.03.2025 (Eintragungsdatum)\n\nDIC 27 Portfolio GmbH & Co. KG\nKommanditgesellschaft\nFrankfurt am Main\n\nDen Gläubigern der an der Verschmelzung beteiligten Rechtsträger ist, wenn sie binnen sechs Monaten nach dem Tag, an dem die Eintragung der Verschmelzung in das Register des Sitzes desjenigen Rechtsträgers, dessen Gläubiger sie sind, nach § 19 Absatz 3 UmwG bekannt gemacht worden ist, ihren Anspruch nach Grund und Höhe schriftlich anmelden, Sicherheit zu leisten, soweit sie nicht Befriedigung verlangen können. Dieses Recht steht den Gläubigern jedoch nur zu, wenn sie glaubhaft machen, dass durch die Verschmelzung die Erfüllung ihrer Forderung gefährdet wird."
    },
    {
      "date": "2025-03-07",
      "id": "103227",
      "original_text": "Registerbekanntmachung nach dem Umwandlungsgesetz\nHessen Amtsgericht Offenbach am Main HRA 9808\nStratec 2000 GmbH & Co. KG – Heusenstamm",
      "type": "Registerbekanntmachung nach dem Umwandlungsgesetz",
      "state": "Hessen",
      "amtsgericht": "Amtsgericht Offenbach am Main",
      "registernummer": "HRA 9808",
      "registerart": "HRA",
      "company_name": "Stratec 2000 GmbH & Co. KG",
      "company_seat": "Heusenstamm",
      "details": "07.03.2025 (Bekanntmachungsdatum)\n\nHessen Amtsgericht Offenbach am Main HRA 9808\nRegisterbekanntmachung nach dem Umwandlungsgesetz 07.03.2025 (Eintragungsdatum)\n\nStratec 2000 GmbH & Co. KG\nKommanditgesellschaft\nHeusenstamm\n\nDen Gläubigern der an der Verschmelzung beteiligten Rechtsträger ist, wenn sie binnen sechs Monaten nach dem Tag, an dem die Eintragung der Verschmelzung in das Register des Sitzes desjenigen Rechtsträgers, dessen Gläubiger sie sind, nach § 19 Absatz 3 UmwG bekannt gemacht worden ist, ihren Anspruch nach Grund und Höhe schriftlich anmelden, Sicherheit zu leisten, soweit sie nicht Befriedigung verlangen können. Dieses Recht steht den Gläubigern jedoch nur zu, wenn sie glaubhaft machen, dass durch die Verschmelzung die Erfüllung ihrer Forderung gefährdet wird."
    },
    {
      "date": "2025-03-07",
      "id": "103228",
      "original_text": "Registerbekanntmachung nach dem Umwandlungsgesetz\nHessen Amtsgericht Frankfurt am Main HRA 49310\nGlobal Tower GmbH & Co. KG – Frankfurt am Main",
      "type": "Registerbekanntmachung nach dem Umwandlungsgesetz",
      "state": "Hessen",
      "amtsgericht": "Amtsgericht Frankfurt am Main",
      "registernummer": "HRA 49310",
      "registerart": "HRA",
      "company_name": "Global Tower GmbH & Co. KG",
      "company_seat": "Frankfurt am Main",
      "details": "07.03.2025 (Bekanntmachungsdatum)\n\nHessen Amtsgericht Frankfurt am Main HRA 49310\nRegisterbekanntmachung nach dem Umwandlungsgesetz 07.03.2025 (Eintragungsdatum)\n\nGlobal Tower GmbH & Co. KG\nKommanditgesellschaft\nFrankfurt am Main\n\nDen Gläubigern der an der Verschmelzung beteiligten Rechtsträger ist, wenn sie binnen sechs Monaten nach dem Tag, an dem die Eintragung der Verschmelzung in das Register des Sitzes desjenigen Rechtsträgers, dessen Gläubiger sie sind, nach § 19 Absatz 3 UmwG bekannt gemacht worden ist, ihren Anspruch nach Grund und Höhe schriftlich anmelden, Sicherheit zu leisten, soweit sie nicht Befriedigung verlangen können. Dieses Recht steht den Gläubigern jedoch nur zu, wenn sie glaubhaft machen, dass durch die Verschmelzung die Erfüllung ihrer Forderung gefährdet wird."
    },
    {
      "date": "2025-03-07",
      "id": "103229",
      "original_text": "Löschungsankündigung\nHessen Amtsgericht Friedberg HRB 1816\nWWB Werbe- und Wirtschaftsberatung Gesellschaft mit beschränkter Haftung – Bad Nauheim",
      "type": "Löschungsankündigung",
      "state": "Hessen",
      "amtsgericht": "Amtsgericht Friedberg",
      "registernummer": "HRB 1816",
      "registerart": "HRB",
      "company_name": "WWB Werbe- und Wirtschaftsberatung Gesellschaft mit beschränkter Haftung",
      "company_seat": "Bad Nauheim",
      "details": "07.03.2025 (Bekanntmachungsdatum)\n\nHessen Amtsgericht Friedberg HRB 1816\nLöschungsankündigung\n\nWWB Werbe- und Wirtschaftsberatung Gesellschaft mit beschränkter Haftung\nGesellschaft mit beschränkter Haftung\nBad Nauheim\n\nDas Registergericht beabsichtigt die im Handelsregister eingetragene Gesellschaft von Amts wegen nach § 394 FamFG zu löschen. Die Frist zur Erhebung eines Widerspruchs gegen die beabsichtigte Löschung wird auf 3 Monate festgesetzt."
    },
    {
      "date": "2025-03-07",
      "id": "103230",
      "original_text": "Löschungsankündigung\nHessen Amtsgericht Frankfurt am Main HRB 106023\nStore Entrance GmbH – Frankfurt am Main",
      "type": "Löschungsankündigung",
      "state": "Hessen",
      "amtsgericht": "Amtsgericht Frankfurt am Main",
      "registernummer": "HRB 106023",
      "registerart": "HRB",
      "company_name": "Store Entrance GmbH",
      "company_seat": "Frankfurt am Main",
      "details": "07.03.2025 (Bekanntmachungsdatum)\n\nHessen Amtsgericht Frankfurt am Main HRB 106023\nLöschungsankündigung\n\nStore Entrance GmbH\nGesellschaft mit beschränkter Haftung\nFrankfurt am Main\n\nDas Registergericht beabsichtigt die im Handelsregister eingetragene Gesellschaft von Amts wegen nach § 394 FamFG zu löschen. Die Frist zur Erhebung eines Widerspruchs gegen die beabsichtigte Löschung wird auf 1 Monat festgesetzt."
    },
    {
      "date": "2025-03-07",
      "id": "103231",
      "original_text": "Registerbekanntmachung nach dem Umwandlungsgesetz\nHessen Amtsgericht Frankfurt am Main GsR 128\nThomas C. Sauer & Söhne eGbR – Frankfurt am Main",
      "type": "Registerbekanntmachung nach dem Umwandlungsgesetz",
      "state": "Hessen",
      "amtsgericht": "Amtsgericht Frankfurt am Main",
      "registernummer": "GsR 128",
      "registerart": "GsR",
      "company_name": "Thomas C. Sauer & Söhne eGbR",
      "company_seat": "Frankfurt am Main",
      "details": "07.03.2025 (Bekanntmachungsdatum)\n\nHessen Amtsgericht Frankfurt am Main GsR 128\nRegisterbekanntmachung nach dem Umwandlungsgesetz 07.03.2025 (Eintragungsdatum)\n\nThomas C. Sauer & Söhne eGbR\nGesellschaft bürgerlichen Rechts\nFrankfurt am Main\n\nDen Gläubigern der an der formwechselnden Umwandlung beteiligten Rechtsträger ist, wenn sie binnen sechs Monaten nach dem Tag, an dem die Eintragung der formwechselnden Umwandlung in das Register des Sitzes desjenigen Rechtsträgers, dessen Gläubiger sie sind, nach § 201 UmwG bekannt gemacht worden ist, ihren Anspruch nach Grund und Höhe schriftlich anmelden, Sicherheit zu leisten, soweit sie nicht Befriedigung verlangen können. Dieses Recht steht den Gläubigern jedoch nur zu, wenn sie glaubhaft machen, dass durch die formwechselnden Umwandlung die Erfüllung ihrer Forderung gefährdet wird."
    },
    {
      "date": "2025-03-07",
      "id": "103232",
      "original_text": "Registerbekanntmachung nach dem Umwandlungsgesetz\nHessen Amtsgericht Frankfurt am Main HRB 137970\nNaGa Solarpark Gorgast GmbH – Frankfurt am Main",
      "type": "Registerbekanntmachung nach dem Umwandlungsgesetz",
      "state": "Hessen",
      "amtsgericht": "Amtsgericht Frankfurt am Main",
      "registernummer": "HRB 137970",
      "registerart": "HRB",
      "company_name": "NaGa Solarpark Gorgast GmbH",
      "company_seat": "Frankfurt am Main",
      "details": "07.03.2025 (Bekanntmachungsdatum)\n\nHessen Amtsgericht Frankfurt am Main HRB 137970\nRegisterbekanntmachung nach dem Umwandlungsgesetz 07.03.2025 (Eintragungsdatum)\n\nNaGa Solarpark Gorgast GmbH\nGesellschaft mit beschränkter Haftung\nFrankfurt am Main\n\nDen Gläubigern der an der formwechselnden Umwandlung beteiligten Rechtsträger ist, wenn sie binnen sechs Monaten nach dem Tag, an dem die Eintragung der formwechselnden Umwandlung in das Register des Sitzes desjenigen Rechtsträgers, dessen Gläubiger sie sind, nach § 201 UmwG bekannt gemacht worden ist, ihren Anspruch nach Grund und Höhe schriftlich anmelden, Sicherheit zu leisten, soweit sie nicht Befriedigung verlangen können. Dieses Recht steht den Gläubigern jedoch nur zu, wenn sie glaubhaft machen, dass durch die formwechselnden Umwandlung die Erfüllung ihrer Forderung gefährdet wird."
    },
    {
      "date": "2025-03-07",
      "id": "103233",
      "original_text": "Löschungsankündigung\nHessen Amtsgericht Frankfurt am Main HRB 109738\nPRIMERA GEBÄUDEMANAGEMENT UG (haftungsbeschränkt) – Frankfurt am Main",
      "type": "Löschungsankündigung",
      "state": "Hessen",
      "amtsgericht": "Amtsgericht Frankfurt am Main",
      "registernummer": "HRB 109738",
      "registerart": "HRB",
      "company_name": "PRIMERA GEBÄUDEMANAGEMENT UG (haftungsbeschränkt)",
      "company_seat": "Frankfurt am Main",
      "details": "07.03.2025 (Bekanntmachungsdatum)\n\nHessen Amtsgericht Frankfurt am Main HRB 109738\nLöschungsankündigung\n\nPRIMERA GEBÄUDEMANAGEMENT UG (haftungsbeschränkt)\nGesellschaft mit beschränkter Haftung\nFrankfurt am Main\n\nDas Registergericht beabsichtigt die im Handelsregister eingetragene Gesellschaft von Amts wegen nach § 394 FamFG zu löschen. Die Frist zur Erhebung eines Widerspruchs gegen die beabsichtigte Löschung wird auf 1 Monat festgesetzt."
    },
    {
      "date": "2025-03-07",
      "id": "103234",
      "original_text": "Löschungsankündigung\nHessen Amtsgericht Frankfurt am Main HRA 48791\nGutwerk Mönchengladbach GmbH & Co. KG – Frankfurt am Main",
      "type": "Löschungsankündigung",
      "state": "Hessen",
      "amtsgericht": "Amtsgericht Frankfurt am Main",
      "registernummer": "HRA 48791",
      "registerart": "HRA",
      "company_name": "Gutwerk Mönchengladbach GmbH & Co. KG",
      "company_seat": "Frankfurt am Main",
      "details": "07.03.2025 (Bekanntmachungsdatum)\n\nHessen Amtsgericht Frankfurt am Main HRA 48791\nLöschungsankündigung\n\nGutwerk Mönchengladbach GmbH & Co. KG\nKommanditgesellschaft\nFrankfurt am Main\n\nDas Registergericht beabsichtigt die im Handelsregister eingetragene Firma von Amts wegen nach § 394 FamFG zu löschen. Die Frist zur Erhebung eines Widerspruchs gegen die beabsichtigte Löschung wird auf 1 Monat festgesetzt."
    },
    {
      "date": "2025-03-07",
      "id": "103235",
      "original_text": "Sonstige Registerbekanntmachung\nHessen Amtsgericht Offenbach am Main VR 5800\nDeutsch- Türkischer Freundschafts- und Kulturverein – Dreieich",
      "type": "Sonstige Registerbekanntmachung",
      "state": "Hessen",
      "amtsgericht": "Amtsgericht Offenbach am Main",
      "registernummer": "VR 5800",
      "registerart": "VR",
      "company_name": "Deutsch- Türkischer Freundschafts- und Kulturverein",
      "company_seat": "Dreieich",
      "details": "07.03.2025 (Bekanntmachungsdatum)\n\nHessen Amtsgericht Offenbach am Main VR 5800\nSonstige Registerbekanntmachung 07.03.2025 (Eintragungsdatum)\n\nDeutsch- Türkischer Freundschafts- und Kulturverein\neingetragener Verein\nDreieich\n\nDer Verein ist aufgelöst."
    }
  ]
}