{
  "date": "2025-03-08",
  "date_of_scrape": "2025-03-09T04:02:32.934Z",
  "tool_version": "0.2.0",
  "number_of_announcements": 11,
  "announcements": [
    {
      "date": "2025-03-08",
      "id": "103236",
      "original_text": "Registerbekanntmachung nach dem Umwandlungsgesetz\nBayern Amtsgericht München HRB 300601\nMaffei GmbH & Co. KGaA – München",
      "type": "Registerbekanntmachung nach dem Umwandlungsgesetz",
      "state": "Bayern",
      "amtsgericht": "Amtsgericht München",
      "registernummer": "HRB 300601",
      "registerart": "HRB",
      "company_name": "Maffei GmbH & Co. KGaA",
      "company_seat": "München",
      "details": "08.03.2025 (Bekanntmachungsdatum)\n\nBayern Amtsgericht München HRB 300601\nRegisterbekanntmachung nach dem Umwandlungsgesetz 07.03.2025 (Eintragungsdatum)\n\nMaffei GmbH & Co. KGaA\nKommanditgesellschaft auf Aktien\nMünchen\n\nDen Gläubigern des formwechselnden Rechtsträgers ist, wenn sie binnen sechs Monaten nach dem Tag, an dem die Eintragung des Formwechsels nach § 201 UmwG als bekannt gemacht gilt, ihren Anspruch nach Grund und Höhe in Textform anmelden, Sicherheit zu leisten, soweit sie nicht Befriedigung verlangen können. Dieses Recht steht den Gläubigern jedoch nur zu, wenn sie glaubhaft machen, dass durch den Formwechsel die Erfüllung ihrer Forderung gefährdet wird."
    },
    {
      "date": "2025-03-08",
      "id": "103237",
      "original_text": "Löschungsankündigung\nBayern Amtsgericht München HRB 127362\nELVESTUS AG – München",
      "type": "Löschungsankündigung",
      "state": "Bayern",
      "amtsgericht": "Amtsgericht München",
      "registernummer": "HRB 127362",
      "registerart": "HRB",
      "company_name": "ELVESTUS AG",
      "company_seat": "München",
      "details": "08.03.2025 (Bekanntmachungsdatum)\n\nBayern Amtsgericht München HRB 127362\nLöschungsankündigung 07.03.2025 (Eintragungsdatum)\n\nELVESTUS AG\nAktiengesellschaft\nMünchen\n\nDas Registergericht beabsichtigt, die im Handelsregister eingetragene Gesellschaft wegen Vermögenslosigkeit von Amts wegen nach § 394 FamFG zu löschen. Die Frist zur Erhebung eines Widerspruchs ist auf drei Monate festgesetzt."
    },
    {
      "date": "2025-03-08",
      "id": "103238",
      "original_text": "Registerbekanntmachung nach dem Umwandlungsgesetz\nBayern Amtsgericht München HRB 174026\nKLA-Tencor GmbH – München",
      "type": "Registerbekanntmachung nach dem Umwandlungsgesetz",
      "state": "Bayern",
      "amtsgericht": "Amtsgericht München",
      "registernummer": "HRB 174026",
      "registerart": "HRB",
      "company_name": "KLA-Tencor GmbH",
      "company_seat": "München",
      "details": "08.03.2025 (Bekanntmachungsdatum)\n\nBayern Amtsgericht München HRB 174026\nRegisterbekanntmachung nach dem Umwandlungsgesetz 07.03.2025 (Eintragungsdatum)\n\nKLA-Tencor GmbH\nGesellschaft mit beschränkter Haftung\nMünchen\n\nDen Gläubigern der an der Verschmelzung beteiligten Rechtsträger ist, wenn sie binnen sechs Monaten nach dem Tag, an dem die Eintragung der Verschmelzung in das Register des Sitzes desjenigen Rechtsträgers, dessen Gläubiger sie sind, nach § 19 Abs. 3 UmwG als bekannt gemacht gilt, ihren Anspruch nach Grund und Höhe in Textform anmelden, Sicherheit zu leisten, soweit sie nicht Befriedigung verlangen können. Dieses Recht steht den Gläubigern jedoch nur zu, wenn sie glaubhaft machen, dass durch die Verschmelzung die Erfüllung ihrer Forderung gefährdet wird."
    },
    {
      "date": "2025-03-08",
      "id": "103239",
      "original_text": "Registerbekanntmachung nach dem Umwandlungsgesetz\nBayern Amtsgericht Coburg HRA 4208\nDietze & Schell Maschinenfabrik GmbH & Co. KG – Coburg",
      "type": "Registerbekanntmachung nach dem Umwandlungsgesetz",
      "state": "Bayern",
      "amtsgericht": "Amtsgericht Coburg",
      "registernummer": "HRA 4208",
      "registerart": "HRA",
      "company_name": "Dietze & Schell Maschinenfabrik GmbH & Co. KG",
      "company_seat": "Coburg",
      "details": "08.03.2025 (Bekanntmachungsdatum)\n\nBayern Amtsgericht Coburg HRA 4208\nRegisterbekanntmachung nach dem Umwandlungsgesetz 06.03.2025 (Eintragungsdatum)\n\nDietze & Schell Maschinenfabrik GmbH & Co. KG\nKommanditgesellschaft\nCoburg\n\nDen Gläubigern der an der Verschmelzung beteiligten Rechtsträger ist, wenn sie binnen sechs Monaten nach dem Tag, an dem die Eintragung der Verschmelzung in das Register des Sitzes desjenigen Rechtsträgers, dessen Gläubiger sie sind, nach § 19 Abs. 3 UmwG als bekannt gemacht gilt, ihren Anspruch nach Grund und Höhe in Textform anmelden, Sicherheit zu leisten, soweit sie nicht Befriedigung verlangen können. Dieses Recht steht den Gläubigern jedoch nur zu, wenn sie glaubhaft machen, dass durch die Verschmelzung die Erfüllung ihrer Forderung gefährdet wird."
    },
    {
      "date": "2025-03-08",
      "id": "103240",
      "original_text": "Registerbekanntmachung nach dem Umwandlungsgesetz\nBayern Amtsgericht Würzburg HRB 7422\nAnFiLo Buchhaltungen GmbH – Zell am Main",
      "type": "Registerbekanntmachung nach dem Umwandlungsgesetz",
      "state": "Bayern",
      "amtsgericht": "Amtsgericht Würzburg",
      "registernummer": "HRB 7422",
      "registerart": "HRB",
      "company_name": "AnFiLo Buchhaltungen GmbH",
      "company_seat": "Zell am Main",
      "details": "08.03.2025 (Bekanntmachungsdatum)\n\nBayern Amtsgericht Würzburg HRB 7422\nRegisterbekanntmachung nach dem Umwandlungsgesetz 07.03.2025 (Eintragungsdatum)\n\nAnFiLo Buchhaltungen GmbH\nGesellschaft mit beschränkter Haftung\nZell am Main\n\nDen Gläubigern der an der Verschmelzung beteiligten Rechtsträger ist, wenn sie binnen sechs Monaten nach dem Tag, an dem die Eintragung der Verschmelzung in das Register des Sitzes desjenigen Rechtsträgers, dessen Gläubiger sie sind, nach § 19 Abs. 3 UmwG als bekannt gemacht gilt, ihren Anspruch nach Grund und Höhe in Textform anmelden, Sicherheit zu leisten, soweit sie nicht Befriedigung verlangen können. Dieses Recht steht den Gläubigern jedoch nur zu, wenn sie glaubhaft machen, dass durch die Verschmelzung die Erfüllung ihrer Forderung gefährdet wird."
    },
    {
      "date": "2025-03-08",
      "id": "103241",
      "original_text": "Sonstige Registerbekanntmachung\nBayern Amtsgericht München HRB 279024\nMunitec Vertriebs-GmbH – Hallbergmoos",
      "type": "Sonstige Registerbekanntmachung",
      "state": "Bayern",
      "amtsgericht": "Amtsgericht München",
      "registernummer": "HRB 279024",
      "registerart": "HRB",
      "company_name": "Munitec Vertriebs-GmbH",
      "company_seat": "Hallbergmoos",
      "details": "08.03.2025 (Bekanntmachungsdatum)\n\nBayern Amtsgericht München HRB 279024\nSonstige Registerbekanntmachung 07.03.2025 (Eintragungsdatum)\n\nMunitec Vertriebs-GmbH\nGesellschaft mit beschränkter Haftung\nHallbergmoos\n\nDen Gläubigern der Gesellschaft, deren Forderungen begründet worden sind, bevor die Eintragung der Beendigung des Gewinnabführungsvertrages in das Handelsregister nach § 10 des Handelsgesetzbuches als bekanntgemacht gilt, hat der andere Vertragsteil Sicherheit zu leisten, wenn sie sich binnen sechs Monaten nach der Bekanntmachung der Eintragung zu diesem Zweck bei ihm melden."
    },
    {
      "date": "2025-03-08",
      "id": "103242",
      "original_text": "Sonstige Registerbekanntmachung\nBayern Amtsgericht München HRB 257807\nOne Touch Football AG – München",
      "type": "Sonstige Registerbekanntmachung",
      "state": "Bayern",
      "amtsgericht": "Amtsgericht München",
      "registernummer": "HRB 257807",
      "registerart": "HRB",
      "company_name": "One Touch Football AG",
      "company_seat": "München",
      "details": "08.03.2025 (Bekanntmachungsdatum)\n\nBayern Amtsgericht München HRB 257807\nSonstige Registerbekanntmachung 07.03.2025 (Eintragungsdatum)\n\nOne Touch Football AG\nAktiengesellschaft\nMünchen\n\nDem Amtsgericht München -Registergericht- ist eine Liste der Mitglieder des Aufsichtsrats eingereicht worden, § 106 AktG."
    },
    {
      "date": "2025-03-08",
      "id": "103243",
      "original_text": "Registerbekanntmachung nach dem Umwandlungsgesetz\nBayern Amtsgericht Coburg HRB 5866\nSIMA Germany GmbH – Coburg",
      "type": "Registerbekanntmachung nach dem Umwandlungsgesetz",
      "state": "Bayern",
      "amtsgericht": "Amtsgericht Coburg",
      "registernummer": "HRB 5866",
      "registerart": "HRB",
      "company_name": "SIMA Germany GmbH",
      "company_seat": "Coburg",
      "details": "08.03.2025 (Bekanntmachungsdatum)\n\nBayern Amtsgericht Coburg HRB 5866\nRegisterbekanntmachung nach dem Umwandlungsgesetz 06.03.2025 (Eintragungsdatum)\n\nSIMA Germany GmbH\nGesellschaft mit beschränkter Haftung\nCoburg\n\nDen Gläubigern der an der Verschmelzung beteiligten Rechtsträger ist, wenn sie binnen sechs Monaten nach dem Tag, an dem die Eintragung der Verschmelzung in das Register des Sitzes desjenigen Rechtsträgers, dessen Gläubiger sie sind, nach § 19 Abs. 3 UmwG als bekannt gemacht gilt, ihren Anspruch nach Grund und Höhe in Textform anmelden, Sicherheit zu leisten, soweit sie nicht Befriedigung verlangen können. Dieses Recht steht den Gläubigern jedoch nur zu, wenn sie glaubhaft machen, dass durch die Verschmelzung die Erfüllung ihrer Forderung gefährdet wird."
    },
    {
      "date": "2025-03-08",
      "id": "103244",
      "original_text": "Löschungsankündigung\nBayern Amtsgericht Nürnberg HRB 19179\nLeonardo IT + Consulting AG – Nürnberg",
      "type": "Löschungsankündigung",
      "state": "Bayern",
      "amtsgericht": "Amtsgericht Nürnberg",
      "registernummer": "HRB 19179",
      "registerart": "HRB",
      "company_name": "Leonardo IT + Consulting AG",
      "company_seat": "Nürnberg",
      "details": "08.03.2025 (Bekanntmachungsdatum)\n\nBayern Amtsgericht Nürnberg HRB 19179\nLöschungsankündigung\n\nLeonardo IT + Consulting AG\nAktiengesellschaft\nNürnberg\n\nDas Registergericht beabsichtigt, die im Handelsregister eingetragene Gesellschaft wegen Vermögenslosigkeit von Amts wegen nach § 394 FamFG zu löschen. Die Frist zur Erhebung eines Widerspruchs ist auf einen Monat festgesetzt."
    },
    {
      "date": "2025-03-08",
      "id": "103245",
      "original_text": "Löschungsankündigung\nBayern Amtsgericht Kempten (Allgäu) HRB 14112\nM&E HOMES GmbH – Lechbruck am See",
      "type": "Löschungsankündigung",
      "state": "Bayern",
      "amtsgericht": "Amtsgericht Kempten (Allgäu)",
      "registernummer": "HRB 14112",
      "registerart": "HRB",
      "company_name": "M&E HOMES GmbH",
      "company_seat": "Lechbruck am See",
      "details": "08.03.2025 (Bekanntmachungsdatum)\n\nBayern Amtsgericht Kempten (Allgäu) HRB 14112\nLöschungsankündigung\n\nM&E HOMES GmbH\nGesellschaft mit beschränkter Haftung\nLechbruck am See\n\nDas Registergericht beabsichtigt, die im Handelsregister eingetragene Gesellschaft wegen Vermögenslosigkeit von Amts wegen nach § 394 FamFG zu löschen. Die Frist zur Erhebung eines Widerspruchs ist auf einen Monat festgesetzt."
    },
    {
      "date": "2025-03-08",
      "id": "103246",
      "original_text": "Registerbekanntmachung nach dem Umwandlungsgesetz\nBayern Amtsgericht München HRB 281893\nFonterelli SPAC 3 AG – München",
      "type": "Registerbekanntmachung nach dem Umwandlungsgesetz",
      "state": "Bayern",
      "amtsgericht": "Amtsgericht München",
      "registernummer": "HRB 281893",
      "registerart": "HRB",
      "company_name": "Fonterelli SPAC 3 AG",
      "company_seat": "München",
      "details": "08.03.2025 (Bekanntmachungsdatum)\n\nBayern Amtsgericht München HRB 281893\nRegisterbekanntmachung nach dem Umwandlungsgesetz 07.03.2025 (Eintragungsdatum)\n\nFonterelli SPAC 3 AG\nAktiengesellschaft\nMünchen\n\nDen Gläubigern des formwechselnden Rechtsträgers ist, wenn sie binnen sechs Monaten nach dem Tag, an dem die Eintragung des Formwechsels nach § 201 UmwG als bekannt gemacht gilt, ihren Anspruch nach Grund und Höhe in Textform anmelden, Sicherheit zu leisten, soweit sie nicht Befriedigung verlangen können. Dieses Recht steht den Gläubigern jedoch nur zu, wenn sie glaubhaft machen, dass durch den Formwechsel die Erfüllung ihrer Forderung gefährdet wird."
    }
  ]
}