{
  "date": "2025-03-06",
  "date_of_scrape": "2025-03-07T04:08:00.611Z",
  "tool_version": "0.2.0",
  "number_of_announcements": 114,
  "announcements": [
    {
      "date": "2025-03-06",
      "id": "103008",
      "original_text": "Einreichung neuer Dokumente\nBayern Amtsgericht Augsburg HRB 32748\nSURTECO GmbH – Buttenwiesen",
      "type": "Einreichung neuer Dokumente",
      "state": "Bayern",
      "amtsgericht": "Amtsgericht Augsburg",
      "registernummer": "HRB 32748",
      "registerart": "HRB",
      "company_name": "SURTECO GmbH",
      "company_seat": "Buttenwiesen",
      "details": "06.03.2025 (Bekanntmachungsdatum)\n\nBayern Amtsgericht Augsburg HRB 32748\nEinreichung neuer Dokumente\n\nSURTECO GmbH\nGesellschaft mit beschränkter Haftung\nButtenwiesen\n\nDem Amtsgericht Augsburg -Registergericht- ist eine Liste der Mitglieder des Aufsichtsrats eingereicht worden, § 52 Abs. 3 S. 2 GmbHG."
    },
    {
      "date": "2025-03-06",
      "id": "103009",
      "original_text": "Einreichung neuer Dokumente\nBayern Amtsgericht München HRB 96869\nTÜV SÜD Industrie Service GmbH – München",
      "type": "Einreichung neuer Dokumente",
      "state": "Bayern",
      "amtsgericht": "Amtsgericht München",
      "registernummer": "HRB 96869",
      "registerart": "HRB",
      "company_name": "TÜV SÜD Industrie Service GmbH",
      "company_seat": "München",
      "details": "06.03.2025 (Bekanntmachungsdatum)\n\nBayern Amtsgericht München HRB 96869\nEinreichung neuer Dokumente\n\nTÜV SÜD Industrie Service GmbH\nGesellschaft mit beschränkter Haftung\nMünchen\n\nDem Amtsgericht München -Registergericht- ist eine Liste der Mitglieder des Aufsichtsrats eingereicht worden, § 52 Abs. 3 S. 2 GmbHG."
    },
    {
      "date": "2025-03-06",
      "id": "103010",
      "original_text": "Löschungsankündigung\nBayern Amtsgericht Nürnberg HRB 32337\nio Infrastruktur Services UG (haftungsbeschränkt) – Nürnberg",
      "type": "Löschungsankündigung",
      "state": "Bayern",
      "amtsgericht": "Amtsgericht Nürnberg",
      "registernummer": "HRB 32337",
      "registerart": "HRB",
      "company_name": "io Infrastruktur Services UG (haftungsbeschränkt)",
      "company_seat": "Nürnberg",
      "details": "06.03.2025 (Bekanntmachungsdatum)\n\nBayern Amtsgericht Nürnberg HRB 32337\nLöschungsankündigung\n\nio Infrastruktur Services UG (haftungsbeschränkt)\nGesellschaft mit beschränkter Haftung\nNürnberg\n\nDas Registergericht beabsichtigt, die im Handelsregister eingetragene Gesellschaft wegen Vermögenslosigkeit von Amts wegen nach § 394 FamFG zu löschen. Die Frist zur Erhebung eines Widerspruchs ist auf einen Monat festgesetzt."
    },
    {
      "date": "2025-03-06",
      "id": "103011",
      "original_text": "Löschungsankündigung\nBayern Amtsgericht München HRB 246985\nD&M-Tech UG (haftungsbeschränkt) – München",
      "type": "Löschungsankündigung",
      "state": "Bayern",
      "amtsgericht": "Amtsgericht München",
      "registernummer": "HRB 246985",
      "registerart": "HRB",
      "company_name": "D&M-Tech UG (haftungsbeschränkt)",
      "company_seat": "München",
      "details": "06.03.2025 (Bekanntmachungsdatum)\n\nBayern Amtsgericht München HRB 246985\nLöschungsankündigung 05.03.2025 (Eintragungsdatum)\n\nD&M-Tech UG (haftungsbeschränkt)\nGesellschaft mit beschränkter Haftung\nMünchen\n\nDas Registergericht beabsichtigt, die im Handelsregister eingetragene Gesellschaft wegen Vermögenslosigkeit von Amts wegen nach § 394 FamFG zu löschen. Die Frist zur Erhebung eines Widerspruchs ist auf drei Monate festgesetzt."
    },
    {
      "date": "2025-03-06",
      "id": "103012",
      "original_text": "Registerbekanntmachung nach dem Umwandlungsgesetz\nBayern Amtsgericht Ansbach HRB 5939\nSTAVIS Verwaltungs GmbH – Weidenbach",
      "type": "Registerbekanntmachung nach dem Umwandlungsgesetz",
      "state": "Bayern",
      "amtsgericht": "Amtsgericht Ansbach",
      "registernummer": "HRB 5939",
      "registerart": "HRB",
      "company_name": "STAVIS Verwaltungs GmbH",
      "company_seat": "Weidenbach",
      "details": "06.03.2025 (Bekanntmachungsdatum)\n\nBayern Amtsgericht Ansbach HRB 5939\nRegisterbekanntmachung nach dem Umwandlungsgesetz 05.03.2025 (Eintragungsdatum)\n\nSTAVIS Verwaltungs GmbH\nGesellschaft mit beschränkter Haftung\nWeidenbach\n\nDen Gläubigern der an der Verschmelzung beteiligten Rechtsträger ist, wenn sie binnen sechs Monaten nach dem Tag, an dem die Eintragung der Verschmelzung in das Register des Sitzes desjenigen Rechtsträgers, dessen Gläubiger sie sind, nach § 19 Abs. 3 UmwG als bekannt gemacht gilt, ihren Anspruch nach Grund und Höhe in Textform anmelden, Sicherheit zu leisten, soweit sie nicht Befriedigung verlangen können. Dieses Recht steht den Gläubigern jedoch nur zu, wenn sie glaubhaft machen, dass durch die Verschmelzung die Erfüllung ihrer Forderung gefährdet wird."
    },
    {
      "date": "2025-03-06",
      "id": "103013",
      "original_text": "Löschungsankündigung\nBayern Amtsgericht Nürnberg HRB 36647\nQM Logistik GmbH – Berg b.Neumarkt i.d.OPf.",
      "type": "Löschungsankündigung",
      "state": "Bayern",
      "amtsgericht": "Amtsgericht Nürnberg",
      "registernummer": "HRB 36647",
      "registerart": "HRB",
      "company_name": "QM Logistik GmbH",
      "company_seat": "Berg b.Neumarkt i.d.OPf.",
      "details": "06.03.2025 (Bekanntmachungsdatum)\n\nBayern Amtsgericht Nürnberg HRB 36647\nLöschungsankündigung\n\nQM Logistik GmbH\nGesellschaft mit beschränkter Haftung\nBerg b.Neumarkt i.d.OPf.\n\nDas Registergericht beabsichtigt, die im Handelsregister eingetragene Gesellschaft wegen Vermögenslosigkeit von Amts wegen nach § 394 FamFG zu löschen. Die Frist zur Erhebung eines Widerspruchs ist auf einen Monat festgesetzt."
    },
    {
      "date": "2025-03-06",
      "id": "103014",
      "original_text": "Löschungsankündigung\nBayern Amtsgericht Aschaffenburg HRB 14005\nPortal2america UG (haftungsbeschränkt) – Mömbris",
      "type": "Löschungsankündigung",
      "state": "Bayern",
      "amtsgericht": "Amtsgericht Aschaffenburg",
      "registernummer": "HRB 14005",
      "registerart": "HRB",
      "company_name": "Portal2america UG (haftungsbeschränkt)",
      "company_seat": "Mömbris",
      "details": "06.03.2025 (Bekanntmachungsdatum)\n\nBayern Amtsgericht Aschaffenburg HRB 14005\nLöschungsankündigung\n\nPortal2america UG (haftungsbeschränkt)\nGesellschaft mit beschränkter Haftung\nMömbris\n\nDas Registergericht beabsichtigt, die im Handelsregister eingetragene Gesellschaft wegen Vermögenslosigkeit von Amts wegen nach § 394 FamFG zu löschen. Die Frist zur Erhebung eines Widerspruchs ist auf drei Monate festgesetzt."
    },
    {
      "date": "2025-03-06",
      "id": "103015",
      "original_text": "Löschungsankündigung\nBayern Amtsgericht Nürnberg HRB 30415\nHeinrich Bau GmbH – Nürnberg",
      "type": "Löschungsankündigung",
      "state": "Bayern",
      "amtsgericht": "Amtsgericht Nürnberg",
      "registernummer": "HRB 30415",
      "registerart": "HRB",
      "company_name": "Heinrich Bau GmbH",
      "company_seat": "Nürnberg",
      "details": "06.03.2025 (Bekanntmachungsdatum)\n\nBayern Amtsgericht Nürnberg HRB 30415\nLöschungsankündigung\n\nHeinrich Bau GmbH\nGesellschaft mit beschränkter Haftung\nNürnberg\n\nDas Registergericht beabsichtigt, die im Handelsregister eingetragene Gesellschaft wegen Vermögenslosigkeit von Amts wegen nach § 394 FamFG zu löschen. Die Frist zur Erhebung eines Widerspruchs ist auf einen Monat festgesetzt."
    },
    {
      "date": "2025-03-06",
      "id": "103016",
      "original_text": "Registerbekanntmachung nach dem Umwandlungsgesetz\nBayern Amtsgericht Landshut HRA 12818\nformativ-b GmbH & Co. KG – Dingolfing",
      "type": "Registerbekanntmachung nach dem Umwandlungsgesetz",
      "state": "Bayern",
      "amtsgericht": "Amtsgericht Landshut",
      "registernummer": "HRA 12818",
      "registerart": "HRA",
      "company_name": "formativ-b GmbH & Co. KG",
      "company_seat": "Dingolfing",
      "details": "06.03.2025 (Bekanntmachungsdatum)\n\nBayern Amtsgericht Landshut HRA 12818\nRegisterbekanntmachung nach dem Umwandlungsgesetz 05.03.2025 (Eintragungsdatum)\n\nformativ-b GmbH & Co. KG\nKommanditgesellschaft\nDingolfing\n\nDen Gläubigern der an der Ausgliederung beteiligten Rechtsträger ist, wenn sie binnen sechs Monaten nach dem Tag, an dem die Eintragung der Ausgliederung in das Register des Sitzes desjenigen Rechtsträgers, dessen Gläubiger sie sind, nach §§ 125, 19 Abs. 3 UmwG als bekannt gemacht gilt, ihren Anspruch nach Grund und Höhe in Textform anmelden, Sicherheit zu leisten, soweit sie nicht Befriedigung verlangen können. Dieses Recht steht den Gläubigern jedoch nur zu, wenn sie glaubhaft machen, dass durch die Ausgliederung die Erfüllung ihrer Forderung gefährdet wird."
    },
    {
      "date": "2025-03-06",
      "id": "103017",
      "original_text": "Löschungsankündigung\nBayern Amtsgericht Nürnberg HRB 30454\ncrypsilon technologies GmbH – Nürnberg",
      "type": "Löschungsankündigung",
      "state": "Bayern",
      "amtsgericht": "Amtsgericht Nürnberg",
      "registernummer": "HRB 30454",
      "registerart": "HRB",
      "company_name": "crypsilon technologies GmbH",
      "company_seat": "Nürnberg",
      "details": "06.03.2025 (Bekanntmachungsdatum)\n\nBayern Amtsgericht Nürnberg HRB 30454\nLöschungsankündigung\n\ncrypsilon technologies GmbH\nGesellschaft mit beschränkter Haftung\nNürnberg\n\nDas Registergericht beabsichtigt, die im Handelsregister eingetragene Gesellschaft wegen Vermögenslosigkeit von Amts wegen nach § 394 FamFG zu löschen. Die Frist zur Erhebung eines Widerspruchs ist auf einen Monat festgesetzt."
    },
    {
      "date": "2025-03-06",
      "id": "103018",
      "original_text": "Einreichung neuer Dokumente\nBayern Amtsgericht München HRB 246833\nEncavis Asset Management AG – Neubiberg",
      "type": "Einreichung neuer Dokumente",
      "state": "Bayern",
      "amtsgericht": "Amtsgericht München",
      "registernummer": "HRB 246833",
      "registerart": "HRB",
      "company_name": "Encavis Asset Management AG",
      "company_seat": "Neubiberg",
      "details": "06.03.2025 (Bekanntmachungsdatum)\n\nBayern Amtsgericht München HRB 246833\nEinreichung neuer Dokumente\n\nEncavis Asset Management AG\nAktiengesellschaft\nNeubiberg\n\nDem Amtsgericht München -Registergericht- ist eine Liste der Mitglieder des Aufsichtsrats eingereicht worden, § 106 AktG."
    },
    {
      "date": "2025-03-06",
      "id": "103019",
      "original_text": "Registerbekanntmachung nach dem Umwandlungsgesetz\nBayern Amtsgericht Ansbach HRB 7890\nSTAVIS GmbH – Weidenbach",
      "type": "Registerbekanntmachung nach dem Umwandlungsgesetz",
      "state": "Bayern",
      "amtsgericht": "Amtsgericht Ansbach",
      "registernummer": "HRB 7890",
      "registerart": "HRB",
      "company_name": "STAVIS GmbH",
      "company_seat": "Weidenbach",
      "details": "06.03.2025 (Bekanntmachungsdatum)\n\nBayern Amtsgericht Ansbach HRB 7890\nRegisterbekanntmachung nach dem Umwandlungsgesetz 05.03.2025 (Eintragungsdatum)\n\nSTAVIS GmbH\nGesellschaft mit beschränkter Haftung\nWeidenbach\n\nDen Gläubigern der an der Verschmelzung beteiligten Rechtsträger ist, wenn sie binnen sechs Monaten nach dem Tag, an dem die Eintragung der Verschmelzung in das Register des Sitzes desjenigen Rechtsträgers, dessen Gläubiger sie sind, nach § 19 Abs. 3 UmwG als bekannt gemacht gilt, ihren Anspruch nach Grund und Höhe in Textform anmelden, Sicherheit zu leisten, soweit sie nicht Befriedigung verlangen können. Dieses Recht steht den Gläubigern jedoch nur zu, wenn sie glaubhaft machen, dass durch die Verschmelzung die Erfüllung ihrer Forderung gefährdet wird."
    },
    {
      "date": "2025-03-06",
      "id": "103020",
      "original_text": "Registerbekanntmachung nach dem Umwandlungsgesetz\nBayern Amtsgericht München HRB 295680\nWaldegg IV Verwaltung GmbH – München",
      "type": "Registerbekanntmachung nach dem Umwandlungsgesetz",
      "state": "Bayern",
      "amtsgericht": "Amtsgericht München",
      "registernummer": "HRB 295680",
      "registerart": "HRB",
      "company_name": "Waldegg IV Verwaltung GmbH",
      "company_seat": "München",
      "details": "06.03.2025 (Bekanntmachungsdatum)\n\nBayern Amtsgericht München HRB 295680\nRegisterbekanntmachung nach dem Umwandlungsgesetz 05.03.2025 (Eintragungsdatum)\n\nWaldegg IV Verwaltung GmbH\nGesellschaft mit beschränkter Haftung\nMünchen\n\nDen Gläubigern des formwechselnden Rechtsträgers ist, wenn sie binnen sechs Monaten nach dem Tag, an dem die Eintragung des Formwechsels nach § 201 UmwG als bekannt gemacht gilt, ihren Anspruch nach Grund und Höhe in Textform anmelden, Sicherheit zu leisten, soweit sie nicht Befriedigung verlangen können. Dieses Recht steht den Gläubigern jedoch nur zu, wenn sie glaubhaft machen, dass durch den Formwechsel die Erfüllung ihrer Forderung gefährdet wird."
    },
    {
      "date": "2025-03-06",
      "id": "103021",
      "original_text": "Löschungsankündigung\nBayern Amtsgericht Nürnberg HRB 33210\nDEBANG Export & Import GmbH – Nürnberg",
      "type": "Löschungsankündigung",
      "state": "Bayern",
      "amtsgericht": "Amtsgericht Nürnberg",
      "registernummer": "HRB 33210",
      "registerart": "HRB",
      "company_name": "DEBANG Export & Import GmbH",
      "company_seat": "Nürnberg",
      "details": "06.03.2025 (Bekanntmachungsdatum)\n\nBayern Amtsgericht Nürnberg HRB 33210\nLöschungsankündigung\n\nDEBANG Export & Import GmbH\nGesellschaft mit beschränkter Haftung\nNürnberg\n\nDas Registergericht beabsichtigt, die im Handelsregister eingetragene Gesellschaft wegen Vermögenslosigkeit von Amts wegen nach § 394 FamFG zu löschen. Die Frist zur Erhebung eines Widerspruchs ist auf einen Monat festgesetzt."
    },
    {
      "date": "2025-03-06",
      "id": "103022",
      "original_text": "Löschungsankündigung\nBayern Amtsgericht Nürnberg HRB 36437\nThermoelement GmbH – Nürnberg",
      "type": "Löschungsankündigung",
      "state": "Bayern",
      "amtsgericht": "Amtsgericht Nürnberg",
      "registernummer": "HRB 36437",
      "registerart": "HRB",
      "company_name": "Thermoelement GmbH",
      "company_seat": "Nürnberg",
      "details": "06.03.2025 (Bekanntmachungsdatum)\n\nBayern Amtsgericht Nürnberg HRB 36437\nLöschungsankündigung\n\nThermoelement GmbH\nGesellschaft mit beschränkter Haftung\nNürnberg\n\nDas Registergericht beabsichtigt, die im Handelsregister eingetragene Gesellschaft wegen Vermögenslosigkeit von Amts wegen nach § 394 FamFG zu löschen. Die Frist zur Erhebung eines Widerspruchs ist auf einen Monat festgesetzt."
    },
    {
      "date": "2025-03-06",
      "id": "103023",
      "original_text": "Registerbekanntmachung nach dem Umwandlungsgesetz\nBayern Amtsgericht München HRB 279095\nSilo Energy GmbH – Grünwald",
      "type": "Registerbekanntmachung nach dem Umwandlungsgesetz",
      "state": "Bayern",
      "amtsgericht": "Amtsgericht München",
      "registernummer": "HRB 279095",
      "registerart": "HRB",
      "company_name": "Silo Energy GmbH",
      "company_seat": "Grünwald",
      "details": "06.03.2025 (Bekanntmachungsdatum)\n\nBayern Amtsgericht München HRB 279095\nRegisterbekanntmachung nach dem Umwandlungsgesetz 05.03.2025 (Eintragungsdatum)\n\nSilo Energy GmbH\nGesellschaft mit beschränkter Haftung\nGrünwald\n\nDen Gläubigern der an der Verschmelzung beteiligten Rechtsträger ist, wenn sie binnen sechs Monaten nach dem Tag, an dem die Eintragung der Verschmelzung in das Register des Sitzes desjenigen Rechtsträgers, dessen Gläubiger sie sind, nach § 19 Abs. 3 UmwG als bekannt gemacht gilt, ihren Anspruch nach Grund und Höhe in Textform anmelden, Sicherheit zu leisten, soweit sie nicht Befriedigung verlangen können. Dieses Recht steht den Gläubigern jedoch nur zu, wenn sie glaubhaft machen, dass durch die Verschmelzung die Erfüllung ihrer Forderung gefährdet wird."
    },
    {
      "date": "2025-03-06",
      "id": "103024",
      "original_text": "Registerbekanntmachung nach dem Umwandlungsgesetz\nBayern Amtsgericht Landshut HRA 12727\nAlexander Bock IT-Dienstleistungen e.K. – Dingolfing",
      "type": "Registerbekanntmachung nach dem Umwandlungsgesetz",
      "state": "Bayern",
      "amtsgericht": "Amtsgericht Landshut",
      "registernummer": "HRA 12727",
      "registerart": "HRA",
      "company_name": "Alexander Bock IT-Dienstleistungen e.K.",
      "company_seat": "Dingolfing",
      "details": "06.03.2025 (Bekanntmachungsdatum)\n\nBayern Amtsgericht Landshut HRA 12727\nRegisterbekanntmachung nach dem Umwandlungsgesetz 05.03.2025 (Eintragungsdatum)\n\nAlexander Bock IT-Dienstleistungen e.K.\nEinzelkaufmann / Einzelkauffrau\nDingolfing\n\nDen Gläubigern der an der Ausgliederung beteiligten Rechtsträger ist, wenn sie binnen sechs Monaten nach dem Tag, an dem die Eintragung der Ausgliederung in das Register des Sitzes desjenigen Rechtsträgers, dessen Gläubiger sie sind, nach §§ 125, 19 Abs. 3 UmwG als bekannt gemacht gilt, ihren Anspruch nach Grund und Höhe in Textform anmelden, Sicherheit zu leisten, soweit sie nicht Befriedigung verlangen können. Dieses Recht steht den Gläubigern jedoch nur zu, wenn sie glaubhaft machen, dass durch die Ausgliederung die Erfüllung ihrer Forderung gefährdet wird."
    },
    {
      "date": "2025-03-06",
      "id": "103025",
      "original_text": "Einreichung neuer Dokumente\nBerlin Amtsgericht Berlin (Charlottenburg) HRB 212254\nMammut Kies & Sand Aktiengesellschaft – Berlin",
      "type": "Einreichung neuer Dokumente",
      "state": "Berlin",
      "amtsgericht": "Amtsgericht Berlin (Charlottenburg)",
      "registernummer": "HRB 212254",
      "registerart": "HRB",
      "company_name": "Mammut Kies & Sand Aktiengesellschaft",
      "company_seat": "Berlin",
      "details": "06.03.2025 (Bekanntmachungsdatum)\n\nBerlin Amtsgericht Berlin (Charlottenburg) HRB 212254\nEinreichung neuer Dokumente\n\nMammut Kies & Sand Aktiengesellschaft\nAktiengesellschaft\nBerlin\n\nAls nicht eingetragen wird veröffentlicht:Es wurde eine neue Liste der Aufsichtsratsmitglieder eingereicht (§ 106 AktG)."
    },
    {
      "date": "2025-03-06",
      "id": "103026",
      "original_text": "Registerbekanntmachung nach dem Umwandlungsgesetz\nBaden-Württemberg Amtsgericht Mannheim HRB 460709\nBBW GmbH – Höpfingen",
      "type": "Registerbekanntmachung nach dem Umwandlungsgesetz",
      "state": "Baden-Württemberg",
      "amtsgericht": "Amtsgericht Mannheim",
      "registernummer": "HRB 460709",
      "registerart": "HRB",
      "company_name": "BBW GmbH",
      "company_seat": "Höpfingen",
      "details": "06.03.2025 (Bekanntmachungsdatum)\n\nBaden-Württemberg Amtsgericht Mannheim HRB 460709\nRegisterbekanntmachung nach dem Umwandlungsgesetz 06.03.2025 (Eintragungsdatum)\n\nBBW GmbH\nGesellschaft mit beschränkter Haftung\nHöpfingen\n\nAls nicht eingetragen wird bekanntgemacht: Den Gläubigern der an der Verschmelzung beteiligten Rechtsträger ist, wenn sie binnen sechs Monaten nach dem Tag, an dem die Eintragung der Verschmelzung in das Register des Sitzes desjenigen Rechtsträgers, dessen Gläubiger sie sind, nach § 19 Abs. 3 UmwG als bekanntgemacht gilt, ihren Anspruch nach Grund und Höhe schriftlich anmelden, Sicherheit zu leisten, soweit sie nicht Befriedigung verlangen können. Dieses Recht steht den Gläubigern jedoch nur zu, wenn sie glaubhaft machen, dass durch die Verschmelzung die Erfüllung ihrer Forderung gefährdet wird."
    },
    {
      "date": "2025-03-06",
      "id": "103027",
      "original_text": "Löschungsankündigung\nBaden-Württemberg Amtsgericht Stuttgart HRB 740447\nWindpark Harrienstedt Verwaltungs GmbH – Wolfschlugen",
      "type": "Löschungsankündigung",
      "state": "Baden-Württemberg",
      "amtsgericht": "Amtsgericht Stuttgart",
      "registernummer": "HRB 740447",
      "registerart": "HRB",
      "company_name": "Windpark Harrienstedt Verwaltungs GmbH",
      "company_seat": "Wolfschlugen",
      "details": "06.03.2025 (Bekanntmachungsdatum)\n\nBaden-Württemberg Amtsgericht Stuttgart HRB 740447\nLöschungsankündigung\n\nWindpark Harrienstedt Verwaltungs GmbH\nGesellschaft mit beschränkter Haftung\nWolfschlugen\n\nAls nicht eingetragen wird bekanntgemacht:\nDas Gericht beabsichtigt, die Gesellschaft wegen Vermögenslosigkeit im Handelsregister von Amts wegen nach § 394 FamFG zu löschen. Die Frist zur Geltendmachung eines Widerspruchs gegen die beabsichtigte Löschung ist auf zwei Monate ab Veröffentlichung bestimmt."
    },
    {
      "date": "2025-03-06",
      "id": "103028",
      "original_text": "Löschungsankündigung\nBaden-Württemberg Amtsgericht Stuttgart HRA 720624\nPROGRIND Ltd. & Co KG – Böblingen",
      "type": "Löschungsankündigung",
      "state": "Baden-Württemberg",
      "amtsgericht": "Amtsgericht Stuttgart",
      "registernummer": "HRA 720624",
      "registerart": "HRA",
      "company_name": "PROGRIND Ltd. & Co KG",
      "company_seat": "Böblingen",
      "details": "06.03.2025 (Bekanntmachungsdatum)\n\nBaden-Württemberg Amtsgericht Stuttgart HRA 720624\nLöschungsankündigung\n\nPROGRIND Ltd. & Co KG\nKommanditgesellschaft\nBöblingen\n\nAls nicht eingetragen wird bekanntgemacht:\nDas Gericht beabsichtigt, die Gesellschaft wegen Vermögenslosigkeit im Handelsregister von Amts wegen nach § 394 FamFG zu löschen. Die Frist zur Geltendmachung eines Widerspruchs gegen die beabsichtigte Löschung ist auf zwei Monate ab Veröffentlichung bestimmt."
    },
    {
      "date": "2025-03-06",
      "id": "103029",
      "original_text": "Einreichung neuer Dokumente\nBerlin Amtsgericht Berlin (Charlottenburg) HRB 256346\nSmart InsurTech AG – Berlin",
      "type": "Einreichung neuer Dokumente",
      "state": "Berlin",
      "amtsgericht": "Amtsgericht Berlin (Charlottenburg)",
      "registernummer": "HRB 256346",
      "registerart": "HRB",
      "company_name": "Smart InsurTech AG",
      "company_seat": "Berlin",
      "details": "06.03.2025 (Bekanntmachungsdatum)\n\nBerlin Amtsgericht Berlin (Charlottenburg) HRB 256346\nEinreichung neuer Dokumente\n\nSmart InsurTech AG\nAktiengesellschaft\nBerlin\n\nAls nicht eingetragen wird veröffentlicht:Es wurde eine neue Liste der Aufsichtsratsmitglieder eingereicht (§ 106 AktG)."
    },
    {
      "date": "2025-03-06",
      "id": "103030",
      "original_text": "Einreichung neuer Dokumente\nBaden-Württemberg Amtsgericht Freiburg HRB 381837\nLAUT Aktiengesellschaft – Konstanz",
      "type": "Einreichung neuer Dokumente",
      "state": "Baden-Württemberg",
      "amtsgericht": "Amtsgericht Freiburg",
      "registernummer": "HRB 381837",
      "registerart": "HRB",
      "company_name": "LAUT Aktiengesellschaft",
      "company_seat": "Konstanz",
      "details": "06.03.2025 (Bekanntmachungsdatum)\n\nBaden-Württemberg Amtsgericht Freiburg HRB 381837\nEinreichung neuer Dokumente\n\nLAUT Aktiengesellschaft\nAktiengesellschaft\nKonstanz\n\nDie Gesellschaft hat am 04.03.2025 die Liste über die Zusammensetzung des Aufsichtsrats zum Handelsregister eingereicht."
    },
    {
      "date": "2025-03-06",
      "id": "103031",
      "original_text": "Registerbekanntmachung nach dem Umwandlungsgesetz\nHamburg Amtsgericht Hamburg HRB 178924\naglog UG (haftungsbeschränkt) – Hamburg",
      "type": "Registerbekanntmachung nach dem Umwandlungsgesetz",
      "state": "Hamburg",
      "amtsgericht": "Amtsgericht Hamburg",
      "registernummer": "HRB 178924",
      "registerart": "HRB",
      "company_name": "aglog UG (haftungsbeschränkt)",
      "company_seat": "Hamburg",
      "details": "06.03.2025 (Bekanntmachungsdatum)\n\nHamburg Amtsgericht Hamburg HRB 178924\nRegisterbekanntmachung nach dem Umwandlungsgesetz 04.03.2025 (Eintragungsdatum)\n\naglog UG (haftungsbeschränkt)\nGesellschaft mit beschränkter Haftung\nHamburg\n\nAls nicht eingetragen wird bekannt gemacht:\nDen Gläubigern der an der Verschmelzung beteiligten Gesellschaften ist, wenn sie binnen sechs Monaten nach dem Tag, an dem die Eintragung der Verschmelzung in das Register des Sitzes desjenigen Rechtsträgers, dessen Gläubiger sie sind, nach § 19 Absatz 3 UmwG als bekannt gemacht gilt, ihren Anspruch nach Grund und Höhe schriftlich anmelden, Sicherheit zu leisten, soweit sie nicht Befriedigung verlangen können. Dieses Recht steht den Gläubigern jedoch nur zu, wenn sie glaubhaft machen, dass durch die Verschmelzung die Erfüllung ihrer Forderung gefährdet wird."
    },
    {
      "date": "2025-03-06",
      "id": "103032",
      "original_text": "Registerbekanntmachung nach dem Umwandlungsgesetz\nHamburg Amtsgericht Hamburg HRB 79085\nPJ Complector GmbH – Hamburg",
      "type": "Registerbekanntmachung nach dem Umwandlungsgesetz",
      "state": "Hamburg",
      "amtsgericht": "Amtsgericht Hamburg",
      "registernummer": "HRB 79085",
      "registerart": "HRB",
      "company_name": "PJ Complector GmbH",
      "company_seat": "Hamburg",
      "details": "06.03.2025 (Bekanntmachungsdatum)\n\nHamburg Amtsgericht Hamburg HRB 79085\nRegisterbekanntmachung nach dem Umwandlungsgesetz 13.02.2025 (Eintragungsdatum)\n\nPJ Complector GmbH\nGesellschaft mit beschränkter Haftung\nHamburg\n\nAls nicht eingetragen wird bekannt gemacht:\nDen Gläubigern der an der Verschmelzung beteiligten Gesellschaften ist, wenn sie binnen sechs Monaten nach dem Tag, an dem die Eintragung der Verschmelzung in das Register des Sitzes desjenigen Rechtsträgers, dessen Gläubiger sie sind, nach § 19 Absatz 3 UmwG als bekannt gemacht gilt, ihren Anspruch nach Grund und Höhe schriftlich anmelden, Sicherheit zu leisten, soweit sie nicht Befriedigung verlangen können. Dieses Recht steht den Gläubigern jedoch nur zu, wenn sie glaubhaft machen, dass durch die Verschmelzung die Erfüllung ihrer Forderung gefährdet wird."
    },
    {
      "date": "2025-03-06",
      "id": "103033",
      "original_text": "Registerbekanntmachung nach dem Umwandlungsgesetz\nHamburg Amtsgericht Hamburg HRB 125481\nOtto Wulff Südkap GmbH – Hamburg",
      "type": "Registerbekanntmachung nach dem Umwandlungsgesetz",
      "state": "Hamburg",
      "amtsgericht": "Amtsgericht Hamburg",
      "registernummer": "HRB 125481",
      "registerart": "HRB",
      "company_name": "Otto Wulff Südkap GmbH",
      "company_seat": "Hamburg",
      "details": "06.03.2025 (Bekanntmachungsdatum)\n\nHamburg Amtsgericht Hamburg HRB 125481\nRegisterbekanntmachung nach dem Umwandlungsgesetz 03.03.2025 (Eintragungsdatum)\n\nOtto Wulff Südkap GmbH\nGesellschaft mit beschränkter Haftung\nHamburg\n\nAls nicht eingetragen wird bekannt gemacht:\nDen Gläubigern der an der Verschmelzung beteiligten Gesellschaften ist, wenn sie binnen sechs Monaten nach dem Tag, an dem die Eintragung der Verschmelzung in das Register des Sitzes desjenigen Rechtsträgers, dessen Gläubiger sie sind, nach § 19 Absatz 3 UmwG als bekannt gemacht gilt, ihren Anspruch nach Grund und Höhe schriftlich anmelden, Sicherheit zu leisten, soweit sie nicht Befriedigung verlangen können. Dieses Recht steht den Gläubigern jedoch nur zu, wenn sie glaubhaft machen, dass durch die Verschmelzung die Erfüllung ihrer Forderung gefährdet wird."
    },
    {
      "date": "2025-03-06",
      "id": "103034",
      "original_text": "Registerbekanntmachung nach dem Umwandlungsgesetz\nBaden-Württemberg Amtsgericht Ulm VR 530239\nChorverband Hohenstaufen e.V. – Göppingen",
      "type": "Registerbekanntmachung nach dem Umwandlungsgesetz",
      "state": "Baden-Württemberg",
      "amtsgericht": "Amtsgericht Ulm",
      "registernummer": "VR 530239",
      "registerart": "VR",
      "company_name": "Chorverband Hohenstaufen e.V.",
      "company_seat": "Göppingen",
      "details": "06.03.2025 (Bekanntmachungsdatum)\n\nBaden-Württemberg Amtsgericht Ulm VR 530239\nRegisterbekanntmachung nach dem Umwandlungsgesetz 06.03.2025 (Eintragungsdatum)\n\nChorverband Hohenstaufen e.V.\neingetragener Verein\nGöppingen\n\nAls nicht eingetragen wird bekanntgemacht:\nDen Gläubigern der an der Verschmelzung beteiligten Rechtsträger ist, wenn sie binnen sechs Monaten nach dem Tag, an dem die Eintragung der Verschmelzung in das Register des Sitzes desjenigen Rechtsträgers, dessen Gläubiger sie sind, nach § 19 Abs. 3 UmwG als bekanntgemacht gilt, ihren Anspruch nach Grund und Höhe schriftlich anmelden, Sicherheit zu leisten, soweit sie nicht Befriedigung verlangen können. Dieses Recht steht den Gläubigern jedoch nur zu, wenn sie glaubhaft machen, dass durch die Verschmelzung die Erfüllung ihrer Forderung gefährdet wird."
    },
    {
      "date": "2025-03-06",
      "id": "103035",
      "original_text": "Registerbekanntmachung nach dem Umwandlungsgesetz\nBaden-Württemberg Amtsgericht Ulm VR 700254\nChorverband Rems-Fils e.V. – Göppingen",
      "type": "Registerbekanntmachung nach dem Umwandlungsgesetz",
      "state": "Baden-Württemberg",
      "amtsgericht": "Amtsgericht Ulm",
      "registernummer": "VR 700254",
      "registerart": "VR",
      "company_name": "Chorverband Rems-Fils e.V.",
      "company_seat": "Göppingen",
      "details": "06.03.2025 (Bekanntmachungsdatum)\n\nBaden-Württemberg Amtsgericht Ulm VR 700254\nRegisterbekanntmachung nach dem Umwandlungsgesetz 06.03.2025 (Eintragungsdatum)\n\nChorverband Rems-Fils e.V.\neingetragener Verein\nGöppingen\n\nAls nicht eingetragen wird bekanntgemacht:\nDen Gläubigern der an der Verschmelzung beteiligten Rechtsträger ist, wenn sie binnen sechs Monaten nach dem Tag, an dem die Eintragung der Verschmelzung in das Register des Sitzes desjenigen Rechtsträgers, dessen Gläubiger sie sind, nach § 19 Abs. 3 UmwG als bekanntgemacht gilt, ihren Anspruch nach Grund und Höhe schriftlich anmelden, Sicherheit zu leisten, soweit sie nicht Befriedigung verlangen können. Dieses Recht steht den Gläubigern jedoch nur zu, wenn sie glaubhaft machen, dass durch die Verschmelzung die Erfüllung ihrer Forderung gefährdet wird."
    },
    {
      "date": "2025-03-06",
      "id": "103036",
      "original_text": "Registerbekanntmachung nach dem Umwandlungsgesetz\nBaden-Württemberg Amtsgericht Freiburg HRB 725651\nEDEKA Rechenzentrum Süd Betriebs GmbH – Offenburg",
      "type": "Registerbekanntmachung nach dem Umwandlungsgesetz",
      "state": "Baden-Württemberg",
      "amtsgericht": "Amtsgericht Freiburg",
      "registernummer": "HRB 725651",
      "registerart": "HRB",
      "company_name": "EDEKA Rechenzentrum Süd Betriebs GmbH",
      "company_seat": "Offenburg",
      "details": "06.03.2025 (Bekanntmachungsdatum)\n\nBaden-Württemberg Amtsgericht Freiburg HRB 725651\nRegisterbekanntmachung nach dem Umwandlungsgesetz 06.03.2025 (Eintragungsdatum)\n\nEDEKA Rechenzentrum Süd Betriebs GmbH\nGesellschaft mit beschränkter Haftung\nOffenburg\n\nDen Gläubigern der an der Verschmelzung beteiligten Rechtsträger ist, wenn sie binnen sechs Monaten nach dem Tag, an dem die Eintragung der Verschmelzung in das Register des Sitzes desjenigen Rechtsträgers, dessen Gläubiger sie sind, nach § 19 Abs. 3 UmwG als bekanntgemacht gilt, ihren Anspruch nach Grund und Höhe schriftlich anmelden, Sicherheit zu leisten, soweit sie nicht Befriedigung verlangen können. Dieses Recht steht den Gläubigern jedoch nur zu, wenn sie glaubhaft machen, dass durch die Verschmelzung die Erfüllung ihrer Forderung gefährdet wird."
    },
    {
      "date": "2025-03-06",
      "id": "103037",
      "original_text": "Registerbekanntmachung nach dem Umwandlungsgesetz\nSchleswig-Holstein Amtsgericht Kiel HRB 27536\nDentalästhetik Schiwek GmbH – Osterrönfeld",
      "type": "Registerbekanntmachung nach dem Umwandlungsgesetz",
      "state": "Schleswig-Holstein",
      "amtsgericht": "Amtsgericht Kiel",
      "registernummer": "HRB 27536",
      "registerart": "HRB",
      "company_name": "Dentalästhetik Schiwek GmbH",
      "company_seat": "Osterrönfeld",
      "details": "06.03.2025 (Bekanntmachungsdatum)\n\nSchleswig-Holstein Amtsgericht Kiel HRB 27536\nRegisterbekanntmachung nach dem Umwandlungsgesetz 04.03.2025 (Eintragungsdatum)\n\nDentalästhetik Schiwek GmbH\nGesellschaft mit beschränkter Haftung\nOsterrönfeld\n\nZu Eintragungsnummer 2 vom 04.03.2025 wird als nicht eingetragen veröffentlicht: Den Gläubigern der an der Spaltung beteiligten Rechtsträger ist, wenn sie binnen sechs Monaten nach dem Tag, an dem die Eintragung der Spaltung in das Register des Sitzes desjenigen Rechtsträgers, dessen Gläubiger sie sind,  bekannt gemacht worden ist, ihren Anspruch nach Grund und Höhe schriftlich anmelden, Sicherheit zu leisten, soweit sie nicht Befriedigung verlangen können. Dieses Recht steht den Gläubigern jedoch nur zu, wenn sie glaubhaft machen, dass durch die Spaltung die Erfüllung ihrer Forderung gefährdet wird."
    },
    {
      "date": "2025-03-06",
      "id": "103038",
      "original_text": "Registerbekanntmachung nach dem Umwandlungsgesetz\nBaden-Württemberg Amtsgericht Stuttgart HRB 784914\nInternational Metal Service Süd GmbH – Fellbach",
      "type": "Registerbekanntmachung nach dem Umwandlungsgesetz",
      "state": "Baden-Württemberg",
      "amtsgericht": "Amtsgericht Stuttgart",
      "registernummer": "HRB 784914",
      "registerart": "HRB",
      "company_name": "International Metal Service Süd GmbH",
      "company_seat": "Fellbach",
      "details": "06.03.2025 (Bekanntmachungsdatum)\n\nBaden-Württemberg Amtsgericht Stuttgart HRB 784914\nRegisterbekanntmachung nach dem Umwandlungsgesetz 06.03.2025 (Eintragungsdatum)\n\nInternational Metal Service Süd GmbH\nGesellschaft mit beschränkter Haftung\nFellbach\n\nAls nicht eingetragen wird bekanntgemacht:\nDen Gläubigern der an der Verschmelzung beteiligten Rechtsträger ist, wenn sie binnen sechs Monaten nach dem Tag, an dem die Eintragung der Verschmelzung in das Register des Sitzes desjenigen Rechtsträgers, dessen Gläubiger sie sind, nach § 19 Abs. 3 UmwG als bekanntgemacht gilt, ihren Anspruch nach Grund und Höhe schriftlich anmelden, Sicherheit zu leisten, soweit sie nicht Befriedigung verlangen können. Dieses Recht steht den Gläubigern jedoch nur zu, wenn sie glaubhaft machen, dass durch die Verschmelzung die Erfüllung ihrer Forderung gefährdet wird."
    },
    {
      "date": "2025-03-06",
      "id": "103039",
      "original_text": "Registerbekanntmachung nach dem Umwandlungsgesetz\nSchleswig-Holstein Amtsgericht Pinneberg HRA 9844\nEdeka Maron Inhaber Michael Maron e.K. – Meldorf",
      "type": "Registerbekanntmachung nach dem Umwandlungsgesetz",
      "state": "Schleswig-Holstein",
      "amtsgericht": "Amtsgericht Pinneberg",
      "registernummer": "HRA 9844",
      "registerart": "HRA",
      "company_name": "Edeka Maron Inhaber Michael Maron e.K.",
      "company_seat": "Meldorf",
      "details": "06.03.2025 (Bekanntmachungsdatum)\n\nSchleswig-Holstein Amtsgericht Pinneberg HRA 9844\nRegisterbekanntmachung nach dem Umwandlungsgesetz 05.03.2025 (Eintragungsdatum)\n\nEdeka Maron Inhaber Michael Maron e.K.\nEinzelkaufmann / Einzelkauffrau\nMeldorf\n\nAls nicht eingetragen wird veröffentlicht: Den Gläubigern ist, wenn sie binnen sechs Monaten nach dem Tag, an dem die Eintragung der Umwandlung als bekannt gemacht gilt, ihren Anspruch nach Grund und Höhe schriftlich anmelden, Sicherheit zu leisten, soweit sie nicht Befriedigung verlangen können. Dieses Recht steht den Gläubigern jedoch nur zu, wenn sie glaubhaft machen, dass durch die Umwandlung die Erfüllung ihrer Forderung gefährdet wird. Das Recht, Sicherheitsleistung zu verlangen, steht Gläubigern nicht zu, die im Falle der Insolvenz ein Recht auf vorzugsweise Befriedigung aus einer Deckungsmasse haben, die nach gesetzlicher Vorschrift zu ihrem Schutz errichtet und staatlich überwacht ist."
    },
    {
      "date": "2025-03-06",
      "id": "103040",
      "original_text": "Einreichung neuer Dokumente\nBaden-Württemberg Amtsgericht Stuttgart HRB 110\nEd. Züblin Aktiengesellschaft – Stuttgart",
      "type": "Einreichung neuer Dokumente",
      "state": "Baden-Württemberg",
      "amtsgericht": "Amtsgericht Stuttgart",
      "registernummer": "HRB 110",
      "registerart": "HRB",
      "company_name": "Ed. Züblin Aktiengesellschaft",
      "company_seat": "Stuttgart",
      "details": "06.03.2025 (Bekanntmachungsdatum)\n\nBaden-Württemberg Amtsgericht Stuttgart HRB 110\nEinreichung neuer Dokumente\n\nEd. Züblin Aktiengesellschaft\nAktiengesellschaft\nStuttgart\n\nDie Gesellschaft hat am 20.01.2025 die Liste über die Zusammensetzung des Aufsichtsrats zum Handelsregister eingereicht."
    },
    {
      "date": "2025-03-06",
      "id": "103041",
      "original_text": "Registerbekanntmachung nach dem Umwandlungsgesetz\nBaden-Württemberg Amtsgericht Stuttgart HRB 744909\nBäderbetriebsgesellschaft Albstadt mbH – Albstadt",
      "type": "Registerbekanntmachung nach dem Umwandlungsgesetz",
      "state": "Baden-Württemberg",
      "amtsgericht": "Amtsgericht Stuttgart",
      "registernummer": "HRB 744909",
      "registerart": "HRB",
      "company_name": "Bäderbetriebsgesellschaft Albstadt mbH",
      "company_seat": "Albstadt",
      "details": "06.03.2025 (Bekanntmachungsdatum)\n\nBaden-Württemberg Amtsgericht Stuttgart HRB 744909\nRegisterbekanntmachung nach dem Umwandlungsgesetz 06.03.2025 (Eintragungsdatum)\n\nBäderbetriebsgesellschaft Albstadt mbH\nGesellschaft mit beschränkter Haftung\nAlbstadt\n\nDen Gläubigern der an der Verschmelzung beteiligten Rechtsträger ist, wenn sie binnen sechs Monaten nach dem Tag, an dem die Eintragung der Verschmelzung in das Register des Sitzes desjenigen Rechtsträgers, dessen Gläubiger sie sind, nach § 19 Abs. 3 UmwG als bekanntgemacht gilt, ihren Anspruch nach Grund und Höhe schriftlich anmelden, Sicherheit zu leisten, soweit sie nicht Befriedigung verlangen können. Dieses Recht steht den Gläubigern jedoch nur zu, wenn sie glaubhaft machen, dass durch die Verschmelzung die Erfüllung ihrer Forderung gefährdet wird."
    },
    {
      "date": "2025-03-06",
      "id": "103042",
      "original_text": "Löschungsankündigung\nBerlin Amtsgericht Berlin (Charlottenburg) HRB 156420\nAlfaStream GmbH – Berlin",
      "type": "Löschungsankündigung",
      "state": "Berlin",
      "amtsgericht": "Amtsgericht Berlin (Charlottenburg)",
      "registernummer": "HRB 156420",
      "registerart": "HRB",
      "company_name": "AlfaStream GmbH",
      "company_seat": "Berlin",
      "details": "06.03.2025 (Bekanntmachungsdatum)\n\nBerlin Amtsgericht Berlin (Charlottenburg) HRB 156420\nLöschungsankündigung\n\nAlfaStream GmbH\nGesellschaft mit beschränkter Haftung\nBerlin\n\nBei der nachstehenden Gesellschaft wird das Amtslöschungsverfahren gemäß § 394 FamFG eingeleitet. Widerspruchsfrist 6 Wochen"
    },
    {
      "date": "2025-03-06",
      "id": "103043",
      "original_text": "Registerbekanntmachung nach dem Umwandlungsgesetz\nBaden-Württemberg Amtsgericht Mannheim HRB 739102\nGreen Cuts GmbH – Heidelberg",
      "type": "Registerbekanntmachung nach dem Umwandlungsgesetz",
      "state": "Baden-Württemberg",
      "amtsgericht": "Amtsgericht Mannheim",
      "registernummer": "HRB 739102",
      "registerart": "HRB",
      "company_name": "Green Cuts GmbH",
      "company_seat": "Heidelberg",
      "details": "06.03.2025 (Bekanntmachungsdatum)\n\nBaden-Württemberg Amtsgericht Mannheim HRB 739102\nRegisterbekanntmachung nach dem Umwandlungsgesetz 06.03.2025 (Eintragungsdatum)\n\nGreen Cuts GmbH\nGesellschaft mit beschränkter Haftung\nHeidelberg\n\nDen Gläubigern der an der Verschmelzung beteiligten Rechtsträger ist, wenn sie binnen sechs Monaten nach dem Tag, an dem die Eintragung der Verschmelzung in das Register des Sitzes desjenigen Rechtsträgers, dessen Gläubiger sie sind, nach § 19 Abs. 3 UmwG als bekanntgemacht gilt, ihren Anspruch nach Grund und Höhe schriftlich anmelden, Sicherheit zu leisten, soweit sie nicht Befriedigung verlangen können. Dieses Recht steht den Gläubigern jedoch nur zu, wenn sie glaubhaft machen, dass durch die Verschmelzung die Erfüllung ihrer Forderung gefährdet wird."
    },
    {
      "date": "2025-03-06",
      "id": "103044",
      "original_text": "Registerbekanntmachung nach dem Umwandlungsgesetz\nBaden-Württemberg Amtsgericht Mannheim HRB 728821\nstark.marketing GmbH – Heidelberg",
      "type": "Registerbekanntmachung nach dem Umwandlungsgesetz",
      "state": "Baden-Württemberg",
      "amtsgericht": "Amtsgericht Mannheim",
      "registernummer": "HRB 728821",
      "registerart": "HRB",
      "company_name": "stark.marketing GmbH",
      "company_seat": "Heidelberg",
      "details": "06.03.2025 (Bekanntmachungsdatum)\n\nBaden-Württemberg Amtsgericht Mannheim HRB 728821\nRegisterbekanntmachung nach dem Umwandlungsgesetz 06.03.2025 (Eintragungsdatum)\n\nstark.marketing GmbH\nGesellschaft mit beschränkter Haftung\nHeidelberg\n\nDen Gläubigern der an der Verschmelzung beteiligten Rechtsträger ist, wenn sie binnen sechs Monaten nach dem Tag, an dem die Eintragung der Verschmelzung in das Register des Sitzes desjenigen Rechtsträgers, dessen Gläubiger sie sind, nach § 19 Abs. 3 UmwG als bekanntgemacht gilt, ihren Anspruch nach Grund und Höhe schriftlich anmelden, Sicherheit zu leisten, soweit sie nicht Befriedigung verlangen können. Dieses Recht steht den Gläubigern jedoch nur zu, wenn sie glaubhaft machen, dass durch die Verschmelzung die Erfüllung ihrer Forderung gefährdet wird."
    },
    {
      "date": "2025-03-06",
      "id": "103045",
      "original_text": "Sonstige Registerbekanntmachung\nBaden-Württemberg Amtsgericht Mannheim HRB 450221\nPOLIFILM OSTERBURKEN GmbH – Osterburken",
      "type": "Sonstige Registerbekanntmachung",
      "state": "Baden-Württemberg",
      "amtsgericht": "Amtsgericht Mannheim",
      "registernummer": "HRB 450221",
      "registerart": "HRB",
      "company_name": "POLIFILM OSTERBURKEN GmbH",
      "company_seat": "Osterburken",
      "details": "06.03.2025 (Bekanntmachungsdatum)\n\nBaden-Württemberg Amtsgericht Mannheim HRB 450221\nSonstige Registerbekanntmachung 06.03.2025 (Eintragungsdatum)\n\nPOLIFILM OSTERBURKEN GmbH\nGesellschaft mit beschränkter Haftung\nOsterburken\n\nDen Gläubigern der Gesellschaft, deren Forderungen begründet worden sind, bevor die Eintragung der Beendigung des Vertrages in das Handelsregister nach § 10 HGB als bekanntgemacht gilt, ist vom anderen Vertragsteil Sicherheit zu leisten, wenn sie sich binnen sechs Monaten nach der Bekanntmachung zu diesem Zweck bei ihm melden."
    },
    {
      "date": "2025-03-06",
      "id": "103046",
      "original_text": "Löschungsankündigung\nBaden-Württemberg Amtsgericht Stuttgart HRB 15099\nBetzel GmbH – Stuttgart",
      "type": "Löschungsankündigung",
      "state": "Baden-Württemberg",
      "amtsgericht": "Amtsgericht Stuttgart",
      "registernummer": "HRB 15099",
      "registerart": "HRB",
      "company_name": "Betzel GmbH",
      "company_seat": "Stuttgart",
      "details": "06.03.2025 (Bekanntmachungsdatum)\n\nBaden-Württemberg Amtsgericht Stuttgart HRB 15099\nLöschungsankündigung\n\nBetzel GmbH\nGesellschaft mit beschränkter Haftung\nStuttgart\n\nAls nicht eingetragen wird bekanntgemacht:\nDas Gericht beabsichtigt, die Gesellschaft wegen Vermögenslosigkeit im Handelsregister von Amts wegen nach § 394 FamFG zu löschen. Die Frist zur Geltendmachung eines Widerspruchs gegen die beabsichtigte Löschung ist auf zwei Monate ab Veröffentlichung bestimmt."
    },
    {
      "date": "2025-03-06",
      "id": "103047",
      "original_text": "Löschungsankündigung\nBerlin Amtsgericht Berlin (Charlottenburg) HRB 184863\nPRW GmbH – Berlin",
      "type": "Löschungsankündigung",
      "state": "Berlin",
      "amtsgericht": "Amtsgericht Berlin (Charlottenburg)",
      "registernummer": "HRB 184863",
      "registerart": "HRB",
      "company_name": "PRW GmbH",
      "company_seat": "Berlin",
      "details": "06.03.2025 (Bekanntmachungsdatum)\n\nBerlin Amtsgericht Berlin (Charlottenburg) HRB 184863\nLöschungsankündigung\n\nPRW GmbH\nGesellschaft mit beschränkter Haftung\nBerlin\n\nBei der nachstehenden Gesellschaft wird das Amtslöschungsverfahren gemäß § 394 FamFG eingeleitet. Widerspruchsfrist 6 Wochen"
    },
    {
      "date": "2025-03-06",
      "id": "103048",
      "original_text": "Löschungsankündigung\nBerlin Amtsgericht Berlin (Charlottenburg) HRB 216025\ndoor2IT GmbH – Berlin",
      "type": "Löschungsankündigung",
      "state": "Berlin",
      "amtsgericht": "Amtsgericht Berlin (Charlottenburg)",
      "registernummer": "HRB 216025",
      "registerart": "HRB",
      "company_name": "door2IT GmbH",
      "company_seat": "Berlin",
      "details": "06.03.2025 (Bekanntmachungsdatum)\n\nBerlin Amtsgericht Berlin (Charlottenburg) HRB 216025\nLöschungsankündigung\n\ndoor2IT GmbH\nGesellschaft mit beschränkter Haftung\nBerlin\n\nBei der nachstehenden Gesellschaft wird das Amtslöschungsverfahren gemäß § 394 FamFG eingeleitet. Widerspruchsfrist 6 Wochen"
    },
    {
      "date": "2025-03-06",
      "id": "103049",
      "original_text": "Registerbekanntmachung nach dem Umwandlungsgesetz\nBerlin Amtsgericht Berlin (Charlottenburg) HRB 248502\nEvergroup Invest GmbH – Berlin",
      "type": "Registerbekanntmachung nach dem Umwandlungsgesetz",
      "state": "Berlin",
      "amtsgericht": "Amtsgericht Berlin (Charlottenburg)",
      "registernummer": "HRB 248502",
      "registerart": "HRB",
      "company_name": "Evergroup Invest GmbH",
      "company_seat": "Berlin",
      "details": "06.03.2025 (Bekanntmachungsdatum)\n\nBerlin Amtsgericht Berlin (Charlottenburg) HRB 248502\nRegisterbekanntmachung nach dem Umwandlungsgesetz 06.03.2025 (Eintragungsdatum)\n\nEvergroup Invest GmbH\nGesellschaft mit beschränkter Haftung\nBerlin\n\nZu Eintragungsnummer 4 vom 06.03.2025 wird als nicht eingetragen veröffentlicht: Den Gläubigern der an der Verschmelzung beteiligten Rechtsträger ist, wenn sie binnen sechs Monaten nach dem Tag, an dem die Eintragung der Verschmelzung in das Register des Sitzes desjenigen Rechtsträgers, dessen Gläubiger sie sind, als bekannt gemacht gilt, ihren Anspruch nach Grund und Höhe schriftlich anmelden, Sicherheit zu leisten, soweit sie nicht Befriedigung verlangen können. Dieses Recht steht den Gläubigern jedoch nur zu, wenn sie glaubhaft machen, dass durch die Verschmelzung die Erfüllung ihrer Forderung gefährdet wird. Das Recht, Sicherheitsleistung zu verlangen, steht Gläubigern nicht zu, die im Falle der Insolvenz ein Recht auf vorzugsweise Befriedigung aus einer Deckungsmasse haben, die nach gesetzlicher Vorschrift zu ihrem Schutz errichtet und staatlich überwacht ist."
    },
    {
      "date": "2025-03-06",
      "id": "103050",
      "original_text": "Registerbekanntmachung nach dem Umwandlungsgesetz\nBaden-Württemberg Amtsgericht Stuttgart HRB 798826\nAS Immo GmbH – Balingen",
      "type": "Registerbekanntmachung nach dem Umwandlungsgesetz",
      "state": "Baden-Württemberg",
      "amtsgericht": "Amtsgericht Stuttgart",
      "registernummer": "HRB 798826",
      "registerart": "HRB",
      "company_name": "AS Immo GmbH",
      "company_seat": "Balingen",
      "details": "06.03.2025 (Bekanntmachungsdatum)\n\nBaden-Württemberg Amtsgericht Stuttgart HRB 798826\nRegisterbekanntmachung nach dem Umwandlungsgesetz 06.03.2025 (Eintragungsdatum)\n\nAS Immo GmbH\nGesellschaft mit beschränkter Haftung\nBalingen\n\nDen Gläubigern der an der grenzüberschreitenden Ausgliederung beteiligten übernehmenden Rechtsträger ist, wenn sie binnen sechs Monaten nach dem Tag, an dem die Eintragung der Spaltung in das Register des Sitzes desjenigen Rechtsträgers, dessen Gläubiger sie sind, nach § 19 Absatz 3 UmwG als bekanntgemacht gilt, ihren Anspruch nach Grund und Höhe schriftlich anmelden, Sicherheit zu leisten, soweit sie nicht Befriedigung verlangen können.\nDieses Recht steht den Gläubigern jedoch nur zu, wenn sie glaubhaft machen, dass durch die Spaltung die Erfüllung ihrer Forderung gefährdet wird.  Als nicht eingetragen wird bekanntgemacht:\nDen Gläubigern der an der Ausgliederung beteiligten Rechtsträger ist, wenn sie binnen sechs Monaten nach dem Tag, an dem die Eintragung der Ausgliederung in das Register des Sitzes desjenigen Rechtsträgers, dessen Gläubiger sie sind, nach § 19 Abs. 3 UmwG als bekanntgemacht gilt, ihren Anspruch nach Grund und Höhe schriftlich anmelden, Sicherheit zu leisten, soweit sie nicht Befriedigung verlangen können. Dieses Recht steht den Gläubigern jedoch nur zu, wenn sie glaubhaft machen, dass durch die Ausgliederung die Erfüllung ihrer Forderung gefährdet wird."
    },
    {
      "date": "2025-03-06",
      "id": "103051",
      "original_text": "Registerbekanntmachung nach dem Umwandlungsgesetz\nNordrhein-Westfalen Amtsgericht Coesfeld HRB 18870\nLinara Ahaus GmbH – Ahaus",
      "type": "Registerbekanntmachung nach dem Umwandlungsgesetz",
      "state": "Nordrhein-Westfalen",
      "amtsgericht": "Amtsgericht Coesfeld",
      "registernummer": "HRB 18870",
      "registerart": "HRB",
      "company_name": "Linara Ahaus GmbH",
      "company_seat": "Ahaus",
      "details": "06.03.2025 (Bekanntmachungsdatum)\n\nNordrhein-Westfalen Amtsgericht Coesfeld HRB 18870\nRegisterbekanntmachung nach dem Umwandlungsgesetz 06.03.2025 (Eintragungsdatum)\n\nLinara Ahaus GmbH\nGesellschaft mit beschränkter Haftung\nAhaus\n\nDen Gläubigern der an der Verschmelzung beteiligten Rechtsträger ist, wenn sie binnen sechs Monaten nach dem Tag, an dem die Eintragung der Verschmelzung in das Register des Sitzes derjenigen Rechtsträger deren Gläubiger sie sind, nach § 19 Absatz 3 UmwG als bekanntgemacht gilt, ihren Anspruch nach Grund und Höhe schriftlich anmelden, Sicherheit zu leisten, soweit sie nicht Befriedigung verlangen können. Dieses Recht steht den Gläubigern jedoch nur zu, wenn sie glaubhaft machen, dass durch die Verschmelzung die Erfüllung ihrer Forderung gefährdet wird."
    },
    {
      "date": "2025-03-06",
      "id": "103052",
      "original_text": "Sonstige Registerbekanntmachung\nSchleswig-Holstein Amtsgericht Lübeck HRB 18696\nMADEINITALY \"Vecchio Borgo\" GmbH – Bargteheide",
      "type": "Sonstige Registerbekanntmachung",
      "state": "Schleswig-Holstein",
      "amtsgericht": "Amtsgericht Lübeck",
      "registernummer": "HRB 18696",
      "registerart": "HRB",
      "company_name": "MADEINITALY \"Vecchio Borgo\" GmbH",
      "company_seat": "Bargteheide",
      "details": "06.03.2025 (Bekanntmachungsdatum)\n\nSchleswig-Holstein Amtsgericht Lübeck HRB 18696\nSonstige Registerbekanntmachung\n\nMADEINITALY \"Vecchio Borgo\" GmbH\nGesellschaft mit beschränkter Haftung\nBargteheide\n\nAls nicht eingetragen wird veröffentlicht:\nergeben sich aus den vorliegenden Unterlagen Anhaltspunkte dafür, dass die Gesellschaft vermögenslos ist:\n\nDie Gesellschaft und der Geschäftsführer persönlich sind seit 2021 postalisch nicht zu erreichen bzw. unbekannt verzogen. Die IHK und das Finanzamt haben einer Löschung der Gesellschaft zugestimmt und das Gewerbe wurde von Amts wegen abgemeldet.\n\nIch beabsichtige daher, die Gesellschaft wegen Vermögenslosigkeit gemäß § 394 FamFG zu löschen.\n\nIch bestimme eine Frist von einem Monat zur Geltendmachung eines Widerspruchs gegen die Löschung, § 394 Abs. 2 S. 1 FamFG.\n\nWeiter bitte ich Sie, mir binnen derselben Frist mitzuteilen, ob die genannte Gesellschaft noch Vermögen hat, ggf. welche Vermögensgegenstände sie besitzt, ob die Gesellschaft noch Partei eines noch nicht rechtskräftig abgeschlossenen Rechtsstreits ist oder ob sonst noch eine Abwicklung stattfindet.\n\nNach Fristablauf ohne Widerspruch von Ihnen oder anderer Seite wird die Gesellschaft gelöscht."
    },
    {
      "date": "2025-03-06",
      "id": "103053",
      "original_text": "Registerbekanntmachung nach dem Umwandlungsgesetz\nBaden-Württemberg Amtsgericht Stuttgart HRB 761682\nKern Holding GmbH – Balingen",
      "type": "Registerbekanntmachung nach dem Umwandlungsgesetz",
      "state": "Baden-Württemberg",
      "amtsgericht": "Amtsgericht Stuttgart",
      "registernummer": "HRB 761682",
      "registerart": "HRB",
      "company_name": "Kern Holding GmbH",
      "company_seat": "Balingen",
      "details": "06.03.2025 (Bekanntmachungsdatum)\n\nBaden-Württemberg Amtsgericht Stuttgart HRB 761682\nRegisterbekanntmachung nach dem Umwandlungsgesetz 06.03.2025 (Eintragungsdatum)\n\nKern Holding GmbH\nGesellschaft mit beschränkter Haftung\nBalingen\n\nAls nicht eingetragen wird bekanntgemacht:\nDen Gläubigern der an der Ausgliederung beteiligten Rechtsträger ist, wenn sie binnen sechs Monaten nach dem Tag, an dem die Eintragung der Ausgliederung in das Register des Sitzes desjenigen Rechtsträgers, dessen Gläubiger sie sind, nach § 19 Abs. 3 UmwG als bekanntgemacht gilt, ihren Anspruch nach Grund und Höhe schriftlich anmelden, Sicherheit zu leisten, soweit sie nicht Befriedigung verlangen können. Dieses Recht steht den Gläubigern jedoch nur zu, wenn sie glaubhaft machen, dass durch die Ausgliederung die Erfüllung ihrer Forderung gefährdet wird."
    },
    {
      "date": "2025-03-06",
      "id": "103054",
      "original_text": "Einreichung neuer Dokumente\nBerlin Amtsgericht Berlin (Charlottenburg) HRB 87492\nVivantes Rehabilitation GmbH – Berlin",
      "type": "Einreichung neuer Dokumente",
      "state": "Berlin",
      "amtsgericht": "Amtsgericht Berlin (Charlottenburg)",
      "registernummer": "HRB 87492",
      "registerart": "HRB",
      "company_name": "Vivantes Rehabilitation GmbH",
      "company_seat": "Berlin",
      "details": "06.03.2025 (Bekanntmachungsdatum)\n\nBerlin Amtsgericht Berlin (Charlottenburg) HRB 87492\nEinreichung neuer Dokumente\n\nVivantes Rehabilitation GmbH\nGesellschaft mit beschränkter Haftung\nBerlin\n\nAls nicht eingetragen wird veröffentlicht: Es wurde eine neue Liste der Aufsichtsratsmitglieder eingereicht (§52 GmbHG)."
    },
    {
      "date": "2025-03-06",
      "id": "103055",
      "original_text": "Registerbekanntmachung nach dem Umwandlungsgesetz\nBaden-Württemberg Amtsgericht Stuttgart HRB 727394\nbestpac GmbH – Heilbronn",
      "type": "Registerbekanntmachung nach dem Umwandlungsgesetz",
      "state": "Baden-Württemberg",
      "amtsgericht": "Amtsgericht Stuttgart",
      "registernummer": "HRB 727394",
      "registerart": "HRB",
      "company_name": "bestpac GmbH",
      "company_seat": "Heilbronn",
      "details": "06.03.2025 (Bekanntmachungsdatum)\n\nBaden-Württemberg Amtsgericht Stuttgart HRB 727394\nRegisterbekanntmachung nach dem Umwandlungsgesetz 06.03.2025 (Eintragungsdatum)\n\nbestpac GmbH\nGesellschaft mit beschränkter Haftung\nHeilbronn\n\nAls nicht eingetragen wird bekanntgemacht:\nDen Gläubigern der an der Verschmelzung beteiligten Rechtsträger ist, wenn sie binnen sechs Monaten nach dem Tag, an dem die Eintragung der Verschmelzung in das Register des Sitzes desjenigen Rechtsträgers, dessen Gläubiger sie sind, nach § 19 Abs. 3 UmwG als bekanntgemacht gilt, ihren Anspruch nach Grund und Höhe schriftlich anmelden, Sicherheit zu leisten, soweit sie nicht Befriedigung verlangen können. Dieses Recht steht den Gläubigern jedoch nur zu, wenn sie glaubhaft machen, dass durch die Verschmelzung die Erfüllung ihrer Forderung gefährdet wird."
    },
    {
      "date": "2025-03-06",
      "id": "103056",
      "original_text": "Löschungsankündigung\nSaarland Amtsgericht Saarbrücken HRB 109685\nA & G Straßenbau UG (haftungsbeschränkt) – Großrosseln",
      "type": "Löschungsankündigung",
      "state": "Saarland",
      "amtsgericht": "Amtsgericht Saarbrücken",
      "registernummer": "HRB 109685",
      "registerart": "HRB",
      "company_name": "A & G Straßenbau UG (haftungsbeschränkt)",
      "company_seat": "Großrosseln",
      "details": "06.03.2025 (Bekanntmachungsdatum)\n\nSaarland Amtsgericht Saarbrücken HRB 109685\nLöschungsankündigung 24.01.2025 (Eintragungsdatum)\n\nA & G Straßenbau UG (haftungsbeschränkt)\nGesellschaft mit beschränkter Haftung\nGroßrosseln\n\nEs ist beabsichtigt, die Gesellschaft von Amts wegen gemäß § 394 FamFG wegen Vermögenslosigkeit zu löschen.\nGegen die Löschung von Amts wegen ist das Rechtsmittel des Widerspruchs statthaft. Der Widerspruch ist binnen einer Frist zwei Monaten beginnend mit dem Tag dieser Veröffentlichung durch Einreichen eines Widerspruchsschreibens -schriftlich oder zur Niederschrift der Geschäftsstelle beim Amtsgericht Saarbrücken, -zentrales Handelsregister-, Mainzerstr.178, 66121 Saarbrücken einzulegen.\nDer Widerspruch muss die Bezeichnung der angefochtenen Löschungsankündigung enthalten sowie die Erklärung, dass Widerspruch eingelegt wird. Er ist vom Widerspruchsführer oder seinem Bevollmächtigten zu unterzeichnen.\nDas Widerspruchsschreiben kann auch in der Form eines elektronischen Dokumentes eingereicht werden, das mit einer qualifizierten elektronischen Signatur nach dem Signaturgesetz versehen sein muss (§§ 14 Abs. 2 FamFG, 130a, 298 ZPO)."
    },
    {
      "date": "2025-03-06",
      "id": "103057",
      "original_text": "Einreichung neuer Dokumente\nBaden-Württemberg Amtsgericht Stuttgart HRB 354465\nRieber Management GmbH – Reutlingen",
      "type": "Einreichung neuer Dokumente",
      "state": "Baden-Württemberg",
      "amtsgericht": "Amtsgericht Stuttgart",
      "registernummer": "HRB 354465",
      "registerart": "HRB",
      "company_name": "Rieber Management GmbH",
      "company_seat": "Reutlingen",
      "details": "06.03.2025 (Bekanntmachungsdatum)\n\nBaden-Württemberg Amtsgericht Stuttgart HRB 354465\nEinreichung neuer Dokumente\n\nRieber Management GmbH\nGesellschaft mit beschränkter Haftung\nReutlingen\n\nDie Gesellschaft hat am 03.03.2025 die Liste über die Zusammensetzung des Aufsichtsrats zum Handelsregister eingereicht."
    },
    {
      "date": "2025-03-06",
      "id": "103058",
      "original_text": "Löschungsankündigung\nSchleswig-Holstein Amtsgericht Lübeck HRB 21609\nFRESCO GmbH – Reinfeld",
      "type": "Löschungsankündigung",
      "state": "Schleswig-Holstein",
      "amtsgericht": "Amtsgericht Lübeck",
      "registernummer": "HRB 21609",
      "registerart": "HRB",
      "company_name": "FRESCO GmbH",
      "company_seat": "Reinfeld",
      "details": "06.03.2025 (Bekanntmachungsdatum)\n\nSchleswig-Holstein Amtsgericht Lübeck HRB 21609\nLöschungsankündigung\n\nFRESCO GmbH\nGesellschaft mit beschränkter Haftung\nReinfeld\n\nEs ist die Löschung der nachstehenden Gesellschaft wegen Vermögenslosigkeit gemäß § 394 FamFG beabsichtigt. Widerspruchsfrist: 1 Monat."
    },
    {
      "date": "2025-03-06",
      "id": "103059",
      "original_text": "Löschungsankündigung\nSachsen Amtsgericht Dresden HRB 36245\nRK Raumkonzept UG (haftungsbeschränkt) – Wilsdruff",
      "type": "Löschungsankündigung",
      "state": "Sachsen",
      "amtsgericht": "Amtsgericht Dresden",
      "registernummer": "HRB 36245",
      "registerart": "HRB",
      "company_name": "RK Raumkonzept UG (haftungsbeschränkt)",
      "company_seat": "Wilsdruff",
      "details": "06.03.2025 (Bekanntmachungsdatum)\n\nSachsen Amtsgericht Dresden HRB 36245\nLöschungsankündigung\n\nRK Raumkonzept UG (haftungsbeschränkt)\nGesellschaft mit beschränkter Haftung\nWilsdruff\n\nDas Registergericht beabsichtigt, die im Handelsregister eingetragene Gesellschaft von Amts wegen nach § 394 FamFG zu löschen. Die Frist zu Erhebung eines Widerspruchs gegen die beabsichtigte Löschung wird auf einen Monat festgesetzt."
    },
    {
      "date": "2025-03-06",
      "id": "103060",
      "original_text": "Löschungsankündigung\nSachsen Amtsgericht Dresden HRB 36884\nSolutions4Energy24 UG (haftungsbeschränkt) – Dresden",
      "type": "Löschungsankündigung",
      "state": "Sachsen",
      "amtsgericht": "Amtsgericht Dresden",
      "registernummer": "HRB 36884",
      "registerart": "HRB",
      "company_name": "Solutions4Energy24 UG (haftungsbeschränkt)",
      "company_seat": "Dresden",
      "details": "06.03.2025 (Bekanntmachungsdatum)\n\nSachsen Amtsgericht Dresden HRB 36884\nLöschungsankündigung\n\nSolutions4Energy24 UG (haftungsbeschränkt)\nGesellschaft mit beschränkter Haftung\nDresden\n\nDas Registergericht beabsichtigt, die im Handelsregister eingetragene Gesellschaft von Amts wegen nach § 394 FamFG zu löschen. Die Frist zu Erhebung eines Widerspruchs gegen die beabsichtigte Löschung wird auf einen Monat festgesetzt."
    },
    {
      "date": "2025-03-06",
      "id": "103061",
      "original_text": "Registerbekanntmachung nach dem Umwandlungsgesetz\nSachsen Amtsgericht Chemnitz HRB 31501\nGK Software SE – Schöneck/Vogtl.",
      "type": "Registerbekanntmachung nach dem Umwandlungsgesetz",
      "state": "Sachsen",
      "amtsgericht": "Amtsgericht Chemnitz",
      "registernummer": "HRB 31501",
      "registerart": "HRB",
      "company_name": "GK Software SE",
      "company_seat": "Schöneck/Vogtl.",
      "details": "06.03.2025 (Bekanntmachungsdatum)\n\nSachsen Amtsgericht Chemnitz HRB 31501\nRegisterbekanntmachung nach dem Umwandlungsgesetz\n\nGK Software SE\nEuropäische Aktiengesellschaft (SE)\nSchöneck/Vogtl.\n\nGemäß § 61 UmwG wird bekanntgemacht, dass die Gesellschaft den Entwurf des\nVerschmelzungsvertrages zwischen der Gesellschaft und der Unified Experience UG (haftungsbeschränkt) mit Sitz in Schwarmstedt (Amtsgerichts Walsrode HRB 209196) übersandt hat."
    },
    {
      "date": "2025-03-06",
      "id": "103062",
      "original_text": "Löschungsankündigung\nSachsen Amtsgericht Chemnitz HRB 31732\nJAY-C GmbH – Chemnitz",
      "type": "Löschungsankündigung",
      "state": "Sachsen",
      "amtsgericht": "Amtsgericht Chemnitz",
      "registernummer": "HRB 31732",
      "registerart": "HRB",
      "company_name": "JAY-C GmbH",
      "company_seat": "Chemnitz",
      "details": "06.03.2025 (Bekanntmachungsdatum)\n\nSachsen Amtsgericht Chemnitz HRB 31732\nLöschungsankündigung\n\nJAY-C GmbH\nGesellschaft mit beschränkter Haftung\nChemnitz\n\nDas Registergericht beabsichtigt, die im Handelsregister eingetragene Gesellschaft von Amts wegen nach § 394 FamFG zu löschen. Die Frist zu Erhebung eines Widerspruchs gegen die beabsichtigte Löschung wird auf einen Monat festgesetzt."
    },
    {
      "date": "2025-03-06",
      "id": "103063",
      "original_text": "Löschungsankündigung\nSachsen Amtsgericht Dresden HRB 117\nBau Union Süd GmbH – Dresden",
      "type": "Löschungsankündigung",
      "state": "Sachsen",
      "amtsgericht": "Amtsgericht Dresden",
      "registernummer": "HRB 117",
      "registerart": "HRB",
      "company_name": "Bau Union Süd GmbH",
      "company_seat": "Dresden",
      "details": "06.03.2025 (Bekanntmachungsdatum)\n\nSachsen Amtsgericht Dresden HRB 117\nLöschungsankündigung\n\nBau Union Süd GmbH\nGesellschaft mit beschränkter Haftung\nDresden\n\nDas Registergericht beabsichtigt, die im Handelsregister eingetragene Gesellschaft von Amts wegen nach § 394 FamFG zu löschen. Die Frist zu Erhebung eines Widerspruchs gegen die beabsichtigte Löschung wird auf einen Monat festgesetzt."
    },
    {
      "date": "2025-03-06",
      "id": "103064",
      "original_text": "Löschungsankündigung\nSachsen Amtsgericht Leipzig VR 7602\nJugendforum Krostitz e.V. – Krostitz",
      "type": "Löschungsankündigung",
      "state": "Sachsen",
      "amtsgericht": "Amtsgericht Leipzig",
      "registernummer": "VR 7602",
      "registerart": "VR",
      "company_name": "Jugendforum Krostitz e.V.",
      "company_seat": "Krostitz",
      "details": "06.03.2025 (Bekanntmachungsdatum)\n\nSachsen Amtsgericht Leipzig VR 7602\nLöschungsankündigung\n\nJugendforum Krostitz e.V.\neingetragener Verein\nKrostitz\n\nDas Gericht beabsichtigt, gemäß § 4 Absatz 2 Ziffer 1 der Verordnung über das Vereinsregister das Registerblatt  des Vereins zu schließen, da nach den Ermittlungen des Gerichts sämtliche Mitglieder aus dem Verein ausgeschieden sind. Zur Geltendmachung eines Widerspruchs gegen die beabsichtigte Schließung wird eine Frist von einem Monat nach der Veröffentlichung bestimmt."
    },
    {
      "date": "2025-03-06",
      "id": "103065",
      "original_text": "Einreichung neuer Dokumente\nSachsen Amtsgericht Chemnitz HRB 4323\nStadtwerke - Erdgas Plauen GmbH – Plauen",
      "type": "Einreichung neuer Dokumente",
      "state": "Sachsen",
      "amtsgericht": "Amtsgericht Chemnitz",
      "registernummer": "HRB 4323",
      "registerart": "HRB",
      "company_name": "Stadtwerke - Erdgas Plauen GmbH",
      "company_seat": "Plauen",
      "details": "06.03.2025 (Bekanntmachungsdatum)\n\nSachsen Amtsgericht Chemnitz HRB 4323\nEinreichung neuer Dokumente\n\nStadtwerke - Erdgas Plauen GmbH\nGesellschaft mit beschränkter Haftung\nPlauen\n\nAm 04.03.2025 wurde beim Handelsregister des Amtsgerichts Chemnitz die Liste der Mitglieder des Aufsichtsrats gemäß § 52 GmbHG eingereicht."
    },
    {
      "date": "2025-03-06",
      "id": "103066",
      "original_text": "Registerbekanntmachung nach dem Umwandlungsgesetz\nNiedersachsen Amtsgericht Aurich HRB 207112\nFosen Schiffbau Holding UG (haftungsbeschränkt) – Rhauderfehn",
      "type": "Registerbekanntmachung nach dem Umwandlungsgesetz",
      "state": "Niedersachsen",
      "amtsgericht": "Amtsgericht Aurich",
      "registernummer": "HRB 207112",
      "registerart": "HRB",
      "company_name": "Fosen Schiffbau Holding UG (haftungsbeschränkt)",
      "company_seat": "Rhauderfehn",
      "details": "06.03.2025 (Bekanntmachungsdatum)\n\nNiedersachsen Amtsgericht Aurich HRB 207112\nRegisterbekanntmachung nach dem Umwandlungsgesetz 06.03.2025 (Eintragungsdatum)\n\nFosen Schiffbau Holding UG (haftungsbeschränkt)\nGesellschaft mit beschränkter Haftung\nRhauderfehn\n\nDen Gläubigern der an der Verschmelzung beteiligten Rechtsträger ist, wenn sie binnen sechs Monaten nach dem Tag, an dem die Eintragung der Verschmelzung in das Register des Sitzes desjenigen Rechtsträgers, dessen Gläubiger sie sind, nach § 19  Abs.  3 UmwG als bekannt gemacht gilt, ihren Anspruch nach Grund und Höhe schriftlich anmelden, Sicherheit zu leisten, soweit sie nicht Befriedigung verlangen können. Dieses Recht steht den Gläubigern jedoch nur zu, wenn sie glaubhaft machen, dass durch die Verschmelzung die Erfüllung der Forderung gefährdet wird."
    },
    {
      "date": "2025-03-06",
      "id": "103067",
      "original_text": "Registerbekanntmachung nach dem Umwandlungsgesetz\nNiedersachsen Amtsgericht Aurich HRB 200112\nFritzen & Co. Inselbaustoffe GmbH – Emden",
      "type": "Registerbekanntmachung nach dem Umwandlungsgesetz",
      "state": "Niedersachsen",
      "amtsgericht": "Amtsgericht Aurich",
      "registernummer": "HRB 200112",
      "registerart": "HRB",
      "company_name": "Fritzen & Co. Inselbaustoffe GmbH",
      "company_seat": "Emden",
      "details": "06.03.2025 (Bekanntmachungsdatum)\n\nNiedersachsen Amtsgericht Aurich HRB 200112\nRegisterbekanntmachung nach dem Umwandlungsgesetz 03.03.2025 (Eintragungsdatum)\n\nFritzen & Co. Inselbaustoffe GmbH\nGesellschaft mit beschränkter Haftung\nEmden\n\nDen Gläubigern der an der Verschmelzung beteiligten Rechtsträger ist, wenn sie binnen sechs Monaten nach dem Tag, an dem die Eintragung der Verschmelzung in das Register des Sitzes desjenigen Rechtsträgers, dessen Gläubiger sie sind, nach § 19  Abs.  3 UmwG als bekannt gemacht gilt, ihren Anspruch nach Grund und Höhe schriftlich anmelden, Sicherheit zu leisten, soweit sie nicht Befriedigung verlangen können. Dieses Recht steht den Gläubigern jedoch nur zu, wenn sie glaubhaft machen, dass durch die Verschmelzung die Erfüllung der Forderung gefährdet wird."
    },
    {
      "date": "2025-03-06",
      "id": "103068",
      "original_text": "Löschungsankündigung\nNiedersachsen Amtsgericht Tostedt HRB 204423\nFreshDirect GmbH – Rosengarten",
      "type": "Löschungsankündigung",
      "state": "Niedersachsen",
      "amtsgericht": "Amtsgericht Tostedt",
      "registernummer": "HRB 204423",
      "registerart": "HRB",
      "company_name": "FreshDirect GmbH",
      "company_seat": "Rosengarten",
      "details": "06.03.2025 (Bekanntmachungsdatum)\n\nNiedersachsen Amtsgericht Tostedt HRB 204423\nLöschungsankündigung 06.03.2025 (Eintragungsdatum)\n\nFreshDirect GmbH\nGesellschaft mit beschränkter Haftung\nRosengarten\n\nDas Registergericht beabsichtigt, die Gesellschaft von Amts wegen nach § 394 FamFG zu löschen. Die Frist zur Erhebung eines Widerspruchs ist auf 1 Monat ab dieser Registerbekanntmachung festgesetzt."
    },
    {
      "date": "2025-03-06",
      "id": "103069",
      "original_text": "Einreichung neuer Dokumente\nNiedersachsen Amtsgericht Oldenburg (Oldenburg) HRB 211657\nNZH Nordenham Zinc Holding GmbH – Nordenham",
      "type": "Einreichung neuer Dokumente",
      "state": "Niedersachsen",
      "amtsgericht": "Amtsgericht Oldenburg (Oldenburg)",
      "registernummer": "HRB 211657",
      "registerart": "HRB",
      "company_name": "NZH Nordenham Zinc Holding GmbH",
      "company_seat": "Nordenham",
      "details": "06.03.2025 (Bekanntmachungsdatum)\n\nNiedersachsen Amtsgericht Oldenburg (Oldenburg) HRB 211657\nEinreichung neuer Dokumente\n\nNZH Nordenham Zinc Holding GmbH\nGesellschaft mit beschränkter Haftung\nNordenham\n\nDie Liste der Mitglieder des Aufsichtsrats wurde beim Registergericht eingereicht."
    },
    {
      "date": "2025-03-06",
      "id": "103070",
      "original_text": "Einreichung neuer Dokumente\nNiedersachsen Amtsgericht Hildesheim HRB 202841\nKSM Castings Group GmbH – Hildesheim",
      "type": "Einreichung neuer Dokumente",
      "state": "Niedersachsen",
      "amtsgericht": "Amtsgericht Hildesheim",
      "registernummer": "HRB 202841",
      "registerart": "HRB",
      "company_name": "KSM Castings Group GmbH",
      "company_seat": "Hildesheim",
      "details": "06.03.2025 (Bekanntmachungsdatum)\n\nNiedersachsen Amtsgericht Hildesheim HRB 202841\nEinreichung neuer Dokumente\n\nKSM Castings Group GmbH\nGesellschaft mit beschränkter Haftung\nHildesheim\n\nDie Liste der Mitglieder des Aufsichtsrats wurde beim Registergericht eingereicht."
    },
    {
      "date": "2025-03-06",
      "id": "103071",
      "original_text": "Einreichung neuer Dokumente\nNiedersachsen Amtsgericht Stadthagen HRB 202130\nLandesgartenschau Bad Nenndorf gGmbH – Bad Nenndorf",
      "type": "Einreichung neuer Dokumente",
      "state": "Niedersachsen",
      "amtsgericht": "Amtsgericht Stadthagen",
      "registernummer": "HRB 202130",
      "registerart": "HRB",
      "company_name": "Landesgartenschau Bad Nenndorf gGmbH",
      "company_seat": "Bad Nenndorf",
      "details": "06.03.2025 (Bekanntmachungsdatum)\n\nNiedersachsen Amtsgericht Stadthagen HRB 202130\nEinreichung neuer Dokumente 05.03.2025 (Eintragungsdatum)\n\nLandesgartenschau Bad Nenndorf gGmbH\nGesellschaft mit beschränkter Haftung\nBad Nenndorf\n\nDie Liste der Mitglieder des Aufsichtsrats wurde beim Registergericht eingereicht."
    },
    {
      "date": "2025-03-06",
      "id": "103072",
      "original_text": "Einreichung neuer Dokumente\nNiedersachsen Amtsgericht Braunschweig HRB 204705\nGoslarsche Höfe - Integrationsbetrieb - gemeinnützige GmbH – Goslar",
      "type": "Einreichung neuer Dokumente",
      "state": "Niedersachsen",
      "amtsgericht": "Amtsgericht Braunschweig",
      "registernummer": "HRB 204705",
      "registerart": "HRB",
      "company_name": "Goslarsche Höfe - Integrationsbetrieb - gemeinnützige GmbH",
      "company_seat": "Goslar",
      "details": "06.03.2025 (Bekanntmachungsdatum)\n\nNiedersachsen Amtsgericht Braunschweig HRB 204705\nEinreichung neuer Dokumente\n\nGoslarsche Höfe - Integrationsbetrieb - gemeinnützige GmbH\nGesellschaft mit beschränkter Haftung\nGoslar\n\nDie Liste der Mitglieder des Aufsichtsrats wurde beim Registergericht eingereicht."
    },
    {
      "date": "2025-03-06",
      "id": "103073",
      "original_text": "Registerbekanntmachung nach dem Umwandlungsgesetz\nNiedersachsen Amtsgericht Aurich HRB 206361\nFosen Deutschland Holding GmbH – Rhauderfehn",
      "type": "Registerbekanntmachung nach dem Umwandlungsgesetz",
      "state": "Niedersachsen",
      "amtsgericht": "Amtsgericht Aurich",
      "registernummer": "HRB 206361",
      "registerart": "HRB",
      "company_name": "Fosen Deutschland Holding GmbH",
      "company_seat": "Rhauderfehn",
      "details": "06.03.2025 (Bekanntmachungsdatum)\n\nNiedersachsen Amtsgericht Aurich HRB 206361\nRegisterbekanntmachung nach dem Umwandlungsgesetz 06.03.2025 (Eintragungsdatum)\n\nFosen Deutschland Holding GmbH\nGesellschaft mit beschränkter Haftung\nRhauderfehn\n\nDen Gläubigern der an der Verschmelzung beteiligten Rechtsträger ist, wenn sie binnen sechs Monaten nach dem Tag, an dem die Eintragung der Verschmelzung in das Register des Sitzes desjenigen Rechtsträgers, dessen Gläubiger sie sind, nach § 19  Abs.  3 UmwG als bekannt gemacht gilt, ihren Anspruch nach Grund und Höhe schriftlich anmelden, Sicherheit zu leisten, soweit sie nicht Befriedigung verlangen können. Dieses Recht steht den Gläubigern jedoch nur zu, wenn sie glaubhaft machen, dass durch die Verschmelzung die Erfüllung der Forderung gefährdet wird."
    },
    {
      "date": "2025-03-06",
      "id": "103074",
      "original_text": "Löschungsankündigung\nNiedersachsen Amtsgericht Braunschweig HRA 6569\nOmnibus- und Ferien-Reisebüro Hermann Demann Nachf. Marlies Bache – Braunschweig",
      "type": "Löschungsankündigung",
      "state": "Niedersachsen",
      "amtsgericht": "Amtsgericht Braunschweig",
      "registernummer": "HRA 6569",
      "registerart": "HRA",
      "company_name": "Omnibus- und Ferien-Reisebüro Hermann Demann Nachf. Marlies Bache",
      "company_seat": "Braunschweig",
      "details": "06.03.2025 (Bekanntmachungsdatum)\n\nNiedersachsen Amtsgericht Braunschweig HRA 6569\nLöschungsankündigung\n\nOmnibus- und Ferien-Reisebüro Hermann Demann Nachf. Marlies Bache\nEinzelkaufmann / Einzelkauffrau\nBraunschweig\n\nDas Registergericht beabsichtigt, die Firma von Amts wegen nach § 31 Abs. 2 Satz 2 HGB, § 393 FamFG zu löschen. Die Frist zur Erhebung eines Widerspruchs ist auf 1 Monat ab dieser Registerbekanntmachung festgesetzt."
    },
    {
      "date": "2025-03-06",
      "id": "103075",
      "original_text": "Löschungsankündigung\nNiedersachsen Amtsgericht Hildesheim HRB 203812\nMeetings-Incentives-Travel GmbH – Uetze",
      "type": "Löschungsankündigung",
      "state": "Niedersachsen",
      "amtsgericht": "Amtsgericht Hildesheim",
      "registernummer": "HRB 203812",
      "registerart": "HRB",
      "company_name": "Meetings-Incentives-Travel GmbH",
      "company_seat": "Uetze",
      "details": "06.03.2025 (Bekanntmachungsdatum)\n\nNiedersachsen Amtsgericht Hildesheim HRB 203812\nLöschungsankündigung\n\nMeetings-Incentives-Travel GmbH\nGesellschaft mit beschränkter Haftung\nUetze\n\nDas Registergericht beabsichtigt, die Gesellschaft von Amts wegen nach § 394 FamFG zu löschen. Die Frist zur Erhebung eines Widerspruchs ist auf 1 Monat ab dieser Registerbekanntmachung festgesetzt."
    },
    {
      "date": "2025-03-06",
      "id": "103076",
      "original_text": "Löschungsankündigung\nNiedersachsen Amtsgericht Oldenburg (Oldenburg) HRB 215337\nScherenzauber Char-Nell UG (haftungsbeschränkt) – Oldenburg",
      "type": "Löschungsankündigung",
      "state": "Niedersachsen",
      "amtsgericht": "Amtsgericht Oldenburg (Oldenburg)",
      "registernummer": "HRB 215337",
      "registerart": "HRB",
      "company_name": "Scherenzauber Char-Nell UG (haftungsbeschränkt)",
      "company_seat": "Oldenburg",
      "details": "06.03.2025 (Bekanntmachungsdatum)\n\nNiedersachsen Amtsgericht Oldenburg (Oldenburg) HRB 215337\nLöschungsankündigung\n\nScherenzauber Char-Nell UG (haftungsbeschränkt)\nGesellschaft mit beschränkter Haftung\nOldenburg\n\nDas Registergericht beabsichtigt, die Gesellschaft von Amts wegen nach § 394 FamFG zu löschen. Die Frist zur Erhebung eines Widerspruchs ist auf 1 Monat ab dieser Registerbekanntmachung festgesetzt."
    },
    {
      "date": "2025-03-06",
      "id": "103077",
      "original_text": "Registerbekanntmachung nach dem Umwandlungsgesetz\nNiedersachsen Amtsgericht Aurich HRB 206361\nFosen Deutschland Holding GmbH – Rhauderfehn",
      "type": "Registerbekanntmachung nach dem Umwandlungsgesetz",
      "state": "Niedersachsen",
      "amtsgericht": "Amtsgericht Aurich",
      "registernummer": "HRB 206361",
      "registerart": "HRB",
      "company_name": "Fosen Deutschland Holding GmbH",
      "company_seat": "Rhauderfehn",
      "details": "06.03.2025 (Bekanntmachungsdatum)\n\nNiedersachsen Amtsgericht Aurich HRB 206361\nRegisterbekanntmachung nach dem Umwandlungsgesetz 06.03.2025 (Eintragungsdatum)\n\nFosen Deutschland Holding GmbH\nGesellschaft mit beschränkter Haftung\nRhauderfehn\n\nDen Gläubigern der an der Verschmelzung beteiligten Rechtsträger ist, wenn sie binnen sechs Monaten nach dem Tag, an dem die Eintragung der Verschmelzung in das Register des Sitzes desjenigen Rechtsträgers, dessen Gläubiger sie sind, nach § 19  Abs.  3 UmwG als bekannt gemacht gilt, ihren Anspruch nach Grund und Höhe schriftlich anmelden, Sicherheit zu leisten, soweit sie nicht Befriedigung verlangen können. Dieses Recht steht den Gläubigern jedoch nur zu, wenn sie glaubhaft machen, dass durch die Verschmelzung die Erfüllung der Forderung gefährdet wird."
    },
    {
      "date": "2025-03-06",
      "id": "103078",
      "original_text": "Einreichung neuer Dokumente\nNiedersachsen Amtsgericht Walsrode HRB 121584\nLilienthaler Diakonie gemeinnützige GmbH – Lilienthal",
      "type": "Einreichung neuer Dokumente",
      "state": "Niedersachsen",
      "amtsgericht": "Amtsgericht Walsrode",
      "registernummer": "HRB 121584",
      "registerart": "HRB",
      "company_name": "Lilienthaler Diakonie gemeinnützige GmbH",
      "company_seat": "Lilienthal",
      "details": "06.03.2025 (Bekanntmachungsdatum)\n\nNiedersachsen Amtsgericht Walsrode HRB 121584\nEinreichung neuer Dokumente\n\nLilienthaler Diakonie gemeinnützige GmbH\nGesellschaft mit beschränkter Haftung\nLilienthal\n\nDie Liste der Mitglieder des Aufsichtsrats wurde beim Registergericht eingereicht."
    },
    {
      "date": "2025-03-06",
      "id": "103079",
      "original_text": "Registerbekanntmachung nach dem Umwandlungsgesetz\nNiedersachsen Amtsgericht Braunschweig HRB 2643\nVenenzentrum und Wirbelsäulenzentrum Braunschweig GmbH – Braunschweig",
      "type": "Registerbekanntmachung nach dem Umwandlungsgesetz",
      "state": "Niedersachsen",
      "amtsgericht": "Amtsgericht Braunschweig",
      "registernummer": "HRB 2643",
      "registerart": "HRB",
      "company_name": "Venenzentrum und Wirbelsäulenzentrum Braunschweig GmbH",
      "company_seat": "Braunschweig",
      "details": "06.03.2025 (Bekanntmachungsdatum)\n\nNiedersachsen Amtsgericht Braunschweig HRB 2643\nRegisterbekanntmachung nach dem Umwandlungsgesetz 06.03.2025 (Eintragungsdatum)\n\nVenenzentrum und Wirbelsäulenzentrum Braunschweig GmbH\nGesellschaft mit beschränkter Haftung\nBraunschweig\n\nDen Gläubigern der an der Verschmelzung beteiligten Rechtsträger ist, wenn sie binnen sechs Monaten nach dem Tag, an dem die Eintragung der Verschmelzung in das Register des Sitzes desjenigen Rechtsträgers, dessen Gläubiger sie sind, nach § 19  Abs.  3 UmwG als bekannt gemacht gilt, ihren Anspruch nach Grund und Höhe schriftlich anmelden, Sicherheit zu leisten, soweit sie nicht Befriedigung verlangen können. Dieses Recht steht den Gläubigern jedoch nur zu, wenn sie glaubhaft machen, dass durch die Verschmelzung die Erfüllung der Forderung gefährdet wird."
    },
    {
      "date": "2025-03-06",
      "id": "103080",
      "original_text": "Registerbekanntmachung nach dem Umwandlungsgesetz\nNiedersachsen Amtsgericht Aurich HRB 207448\nFosen Yard GmbH – Rhauderfehn",
      "type": "Registerbekanntmachung nach dem Umwandlungsgesetz",
      "state": "Niedersachsen",
      "amtsgericht": "Amtsgericht Aurich",
      "registernummer": "HRB 207448",
      "registerart": "HRB",
      "company_name": "Fosen Yard GmbH",
      "company_seat": "Rhauderfehn",
      "details": "06.03.2025 (Bekanntmachungsdatum)\n\nNiedersachsen Amtsgericht Aurich HRB 207448\nRegisterbekanntmachung nach dem Umwandlungsgesetz 06.03.2025 (Eintragungsdatum)\n\nFosen Yard GmbH\nGesellschaft mit beschränkter Haftung\nRhauderfehn\n\nDen Gläubigern der an der Verschmelzung beteiligten Rechtsträger ist, wenn sie binnen sechs Monaten nach dem Tag, an dem die Eintragung der Verschmelzung in das Register des Sitzes desjenigen Rechtsträgers, dessen Gläubiger sie sind, nach § 19  Abs.  3 UmwG als bekannt gemacht gilt, ihren Anspruch nach Grund und Höhe schriftlich anmelden, Sicherheit zu leisten, soweit sie nicht Befriedigung verlangen können. Dieses Recht steht den Gläubigern jedoch nur zu, wenn sie glaubhaft machen, dass durch die Verschmelzung die Erfüllung der Forderung gefährdet wird."
    },
    {
      "date": "2025-03-06",
      "id": "103081",
      "original_text": "Löschungsankündigung\nRheinland-Pfalz Amtsgericht Zweibrücken HRB 31797\nLG Consulting GmbH – Zweibrücken",
      "type": "Löschungsankündigung",
      "state": "Rheinland-Pfalz",
      "amtsgericht": "Amtsgericht Zweibrücken",
      "registernummer": "HRB 31797",
      "registerart": "HRB",
      "company_name": "LG Consulting GmbH",
      "company_seat": "Zweibrücken",
      "details": "06.03.2025 (Bekanntmachungsdatum)\n\nRheinland-Pfalz Amtsgericht Zweibrücken HRB 31797\nLöschungsankündigung\n\nLG Consulting GmbH\nGesellschaft mit beschränkter Haftung\nZweibrücken\n\nDas Registergericht beabsichtigt die Gesellschaft von Amts wegen nach § 394 FamFG zu löschen. Die Frist zur Erhebung eines Widerspruchs ist auf einen Monat festgesetzt."
    },
    {
      "date": "2025-03-06",
      "id": "103082",
      "original_text": "Löschungsankündigung\nRheinland-Pfalz Amtsgericht Mainz HRB 50125\nAktion Gebäudereinigung GmbH – Worms",
      "type": "Löschungsankündigung",
      "state": "Rheinland-Pfalz",
      "amtsgericht": "Amtsgericht Mainz",
      "registernummer": "HRB 50125",
      "registerart": "HRB",
      "company_name": "Aktion Gebäudereinigung GmbH",
      "company_seat": "Worms",
      "details": "06.03.2025 (Bekanntmachungsdatum)\n\nRheinland-Pfalz Amtsgericht Mainz HRB 50125\nLöschungsankündigung\n\nAktion Gebäudereinigung GmbH\nGesellschaft mit beschränkter Haftung\nWorms\n\nDas Registergericht beabsichtigt die Gesellschaft von Amts wegen nach § 394 FamFG zu löschen. Die Frist zur Erhebung eines Widerspruchs ist auf einen Monat festgesetzt."
    },
    {
      "date": "2025-03-06",
      "id": "103083",
      "original_text": "Einreichung neuer Dokumente\nRheinland-Pfalz Amtsgericht Ludwigshafen a.Rhein (Ludwigshafen) HRB 69277\nSHE International AG – Ludwigshafen am Rhein",
      "type": "Einreichung neuer Dokumente",
      "state": "Rheinland-Pfalz",
      "amtsgericht": "Amtsgericht Ludwigshafen a.Rhein (Ludwigshafen)",
      "registernummer": "HRB 69277",
      "registerart": "HRB",
      "company_name": "SHE International AG",
      "company_seat": "Ludwigshafen am Rhein",
      "details": "06.03.2025 (Bekanntmachungsdatum)\n\nRheinland-Pfalz Amtsgericht Ludwigshafen a.Rhein (Ludwigshafen) HRB 69277\nEinreichung neuer Dokumente\n\nSHE International AG\nAktiengesellschaft\nLudwigshafen am Rhein\n\nDem Registergericht ist eine Liste der Mitglieder des Aufsichtsrates eingereicht worden."
    },
    {
      "date": "2025-03-06",
      "id": "103084",
      "original_text": "Einreichung neuer Dokumente\nRheinland-Pfalz Amtsgericht Ludwigshafen a.Rhein (Ludwigshafen) HRB 4593\nSHE Informationstechnologie AG – Ludwigshafen/Rh..",
      "type": "Einreichung neuer Dokumente",
      "state": "Rheinland-Pfalz",
      "amtsgericht": "Amtsgericht Ludwigshafen a.Rhein (Ludwigshafen)",
      "registernummer": "HRB 4593",
      "registerart": "HRB",
      "company_name": "SHE Informationstechnologie AG",
      "company_seat": "Ludwigshafen/Rh..",
      "details": "06.03.2025 (Bekanntmachungsdatum)\n\nRheinland-Pfalz Amtsgericht Ludwigshafen a.Rhein (Ludwigshafen) HRB 4593\nEinreichung neuer Dokumente\n\nSHE Informationstechnologie AG\nAktiengesellschaft\nLudwigshafen/Rh..\n\nDem Registergericht ist eine Liste der Mitglieder des Aufsichtsrates eingereicht worden."
    },
    {
      "date": "2025-03-06",
      "id": "103085",
      "original_text": "Löschungsankündigung\nBremen Amtsgericht Bremen HRB 17994\nRK Gastronomietechnik GmbH – Bremen",
      "type": "Löschungsankündigung",
      "state": "Bremen",
      "amtsgericht": "Amtsgericht Bremen",
      "registernummer": "HRB 17994",
      "registerart": "HRB",
      "company_name": "RK Gastronomietechnik GmbH",
      "company_seat": "Bremen",
      "details": "06.03.2025 (Bekanntmachungsdatum)\n\nBremen Amtsgericht Bremen HRB 17994\nLöschungsankündigung\n\nRK Gastronomietechnik GmbH\nGesellschaft mit beschränkter Haftung\nBremen\n\nEs ist beabsichtigt die im Handelsregister eingetragene Gesellschaft von Amts wegen gemäß § 394 FamFG zu löschen. Gegen die Löschung kann beim AG Bremen schriftlich oder zu Protokoll der Geschäftsstelle Widerspruch eingelegt werden. Widerspruchsfrist 4 Wochen."
    },
    {
      "date": "2025-03-06",
      "id": "103086",
      "original_text": "Löschungsankündigung\nBremen Amtsgericht Bremen HRB 38141\nRajah Natursteinhandel UG (haftungsbeschränkt) – Bremen",
      "type": "Löschungsankündigung",
      "state": "Bremen",
      "amtsgericht": "Amtsgericht Bremen",
      "registernummer": "HRB 38141",
      "registerart": "HRB",
      "company_name": "Rajah Natursteinhandel UG (haftungsbeschränkt)",
      "company_seat": "Bremen",
      "details": "06.03.2025 (Bekanntmachungsdatum)\n\nBremen Amtsgericht Bremen HRB 38141\nLöschungsankündigung\n\nRajah Natursteinhandel UG (haftungsbeschränkt)\nGesellschaft mit beschränkter Haftung\nBremen\n\nEs ist beabsichtigt die im Handelsregister eingetragene Gesellschaft von Amts wegen gemäß § 394 FamFG zu löschen. Gegen die Löschung kann beim AG Bremen schriftlich oder zu Protokoll der Geschäftsstelle Widerspruch eingelegt werden. Widerspruchsfrist 4 Wochen."
    },
    {
      "date": "2025-03-06",
      "id": "103087",
      "original_text": "Löschungsankündigung\nBremen Amtsgericht Bremen HRB 35995\nSchutzanlagen und Stahlbautechnik GmbH – Bremen",
      "type": "Löschungsankündigung",
      "state": "Bremen",
      "amtsgericht": "Amtsgericht Bremen",
      "registernummer": "HRB 35995",
      "registerart": "HRB",
      "company_name": "Schutzanlagen und Stahlbautechnik GmbH",
      "company_seat": "Bremen",
      "details": "06.03.2025 (Bekanntmachungsdatum)\n\nBremen Amtsgericht Bremen HRB 35995\nLöschungsankündigung\n\nSchutzanlagen und Stahlbautechnik GmbH\nGesellschaft mit beschränkter Haftung\nBremen\n\nEs ist beabsichtigt die im Handelsregister eingetragene Gesellschaft von Amts wegen gemäß § 394 FamFG zu löschen. Gegen die Löschung kann beim AG Bremen schriftlich oder zu Protokoll der Geschäftsstelle Widerspruch eingelegt werden. Widerspruchsfrist 4 Wochen."
    },
    {
      "date": "2025-03-06",
      "id": "103088",
      "original_text": "Löschungsankündigung\nNordrhein-Westfalen Amtsgericht Wuppertal HRB 30735\nAP Holding GmbH – Erkrath",
      "type": "Löschungsankündigung",
      "state": "Nordrhein-Westfalen",
      "amtsgericht": "Amtsgericht Wuppertal",
      "registernummer": "HRB 30735",
      "registerart": "HRB",
      "company_name": "AP Holding GmbH",
      "company_seat": "Erkrath",
      "details": "06.03.2025 (Bekanntmachungsdatum)\n\nNordrhein-Westfalen Amtsgericht Wuppertal HRB 30735\nLöschungsankündigung\n\nAP Holding GmbH\nGesellschaft mit beschränkter Haftung\nErkrath\n\nDas Registergericht beabsichtigt die Gesellschaft von Amts wegen nach § 394 FamFG zu löschen. Die Frist zur Erhebung eines Widerspruchs ist auf einen Monat festgesetzt."
    },
    {
      "date": "2025-03-06",
      "id": "103089",
      "original_text": "Löschungsankündigung\nNordrhein-Westfalen Amtsgericht Hamm HRB 7483\nNova Hausverwaltung GmbH – Holzwickede",
      "type": "Löschungsankündigung",
      "state": "Nordrhein-Westfalen",
      "amtsgericht": "Amtsgericht Hamm",
      "registernummer": "HRB 7483",
      "registerart": "HRB",
      "company_name": "Nova Hausverwaltung GmbH",
      "company_seat": "Holzwickede",
      "details": "06.03.2025 (Bekanntmachungsdatum)\n\nNordrhein-Westfalen Amtsgericht Hamm HRB 7483\nLöschungsankündigung\n\nNova Hausverwaltung GmbH\nGesellschaft mit beschränkter Haftung\nHolzwickede\n\nDas Registergericht beabsichtigt die Gesellschaft von Amts wegen nach § 394 FamFG zu löschen. Die Frist zur Erhebung eines Widerspruchs ist auf drei Monate festgesetzt."
    },
    {
      "date": "2025-03-06",
      "id": "103090",
      "original_text": "Löschungsankündigung\nNordrhein-Westfalen Amtsgericht Essen HRB 24399\nMLP Fashion UG (haftungsbeschränkt) – Essen",
      "type": "Löschungsankündigung",
      "state": "Nordrhein-Westfalen",
      "amtsgericht": "Amtsgericht Essen",
      "registernummer": "HRB 24399",
      "registerart": "HRB",
      "company_name": "MLP Fashion UG (haftungsbeschränkt)",
      "company_seat": "Essen",
      "details": "06.03.2025 (Bekanntmachungsdatum)\n\nNordrhein-Westfalen Amtsgericht Essen HRB 24399\nLöschungsankündigung\n\nMLP Fashion UG (haftungsbeschränkt)\nGesellschaft mit beschränkter Haftung\nEssen\n\nDas Registergericht beabsichtigt die Gesellschaft von Amts wegen nach § 394 FamFG zu löschen. Die Frist zur Erhebung eines Widerspruchs ist auf einen Monat festgesetzt."
    },
    {
      "date": "2025-03-06",
      "id": "103091",
      "original_text": "Löschungsankündigung\nNordrhein-Westfalen Amtsgericht Bonn HRB 25605\nE L I T GmbH – Bonn",
      "type": "Löschungsankündigung",
      "state": "Nordrhein-Westfalen",
      "amtsgericht": "Amtsgericht Bonn",
      "registernummer": "HRB 25605",
      "registerart": "HRB",
      "company_name": "E L I T GmbH",
      "company_seat": "Bonn",
      "details": "06.03.2025 (Bekanntmachungsdatum)\n\nNordrhein-Westfalen Amtsgericht Bonn HRB 25605\nLöschungsankündigung\n\nE L I T GmbH\nGesellschaft mit beschränkter Haftung\nBonn\n\nDas Registergericht beabsichtigt die Gesellschaft von Amts wegen nach § 394 FamFG zu löschen. Die Frist zur Erhebung eines Widerspruchs ist auf einen Monat festgesetzt."
    },
    {
      "date": "2025-03-06",
      "id": "103092",
      "original_text": "Registerbekanntmachung nach dem Umwandlungsgesetz\nNordrhein-Westfalen Amtsgericht Köln HRB 39144\nBOS Büro- und Objekteinrichtungen GmbH – Wiehl",
      "type": "Registerbekanntmachung nach dem Umwandlungsgesetz",
      "state": "Nordrhein-Westfalen",
      "amtsgericht": "Amtsgericht Köln",
      "registernummer": "HRB 39144",
      "registerart": "HRB",
      "company_name": "BOS Büro- und Objekteinrichtungen GmbH",
      "company_seat": "Wiehl",
      "details": "06.03.2025 (Bekanntmachungsdatum)\n\nNordrhein-Westfalen Amtsgericht Köln HRB 39144\nRegisterbekanntmachung nach dem Umwandlungsgesetz 06.03.2025 (Eintragungsdatum)\n\nBOS Büro- und Objekteinrichtungen GmbH\nGesellschaft mit beschränkter Haftung\nWiehl\n\nDen Gläubigern der an der Verschmelzung beteiligten Rechtsträger ist, wenn sie binnen sechs Monaten nach dem Tag, an dem die Eintragung der Verschmelzung in das Register des Sitzes desjenigen Rechtsträgers, dessen Gläubiger sie sind, nach § 19 Absatz 3 UmwG als bekanntgemacht gilt, ihren Anspruch nach Grund und Höhe schriftlich anmelden, Sicherheit zu leisten, soweit sie nicht Befriedigung verlangen können. Dieses Recht steht den Gläubigern jedoch nur zu, wenn sie glaubhaft machen, dass durch die Verschmelzung die Erfüllung ihrer Forderung gefährdet wird."
    },
    {
      "date": "2025-03-06",
      "id": "103093",
      "original_text": "Registerbekanntmachung nach dem Umwandlungsgesetz\nNordrhein-Westfalen Amtsgericht Neuss HRB 23776\nCube Contracting 4 GmbH – Kaarst",
      "type": "Registerbekanntmachung nach dem Umwandlungsgesetz",
      "state": "Nordrhein-Westfalen",
      "amtsgericht": "Amtsgericht Neuss",
      "registernummer": "HRB 23776",
      "registerart": "HRB",
      "company_name": "Cube Contracting 4 GmbH",
      "company_seat": "Kaarst",
      "details": "06.03.2025 (Bekanntmachungsdatum)\n\nNordrhein-Westfalen Amtsgericht Neuss HRB 23776\nRegisterbekanntmachung nach dem Umwandlungsgesetz 06.03.2025 (Eintragungsdatum)\n\nCube Contracting 4 GmbH\nGesellschaft mit beschränkter Haftung\nKaarst\n\nDen Gläubigern der an der Verschmelzung beteiligten Rechtsträger ist, wenn sie binnen sechs Monaten nach dem Tag, an dem die Eintragung der Verschmelzung in das Register des Sitzes derjenigen Rechtsträger deren Gläubiger sie sind, nach § 19 Absatz 3 UmwG als bekanntgemacht gilt, ihren Anspruch nach Grund und Höhe schriftlich anmelden, Sicherheit zu leisten, soweit sie nicht Befriedigung verlangen können. Dieses Recht steht den Gläubigern jedoch nur zu, wenn sie glaubhaft machen, dass durch die Verschmelzung die Erfüllung ihrer Forderung gefährdet wird."
    },
    {
      "date": "2025-03-06",
      "id": "103094",
      "original_text": "Registerbekanntmachung nach dem Umwandlungsgesetz\nNordrhein-Westfalen Amtsgericht Paderborn HRA 8244\nHeinrich Amedick e. K. Inhaber Dustin Amedick – Lichtenau",
      "type": "Registerbekanntmachung nach dem Umwandlungsgesetz",
      "state": "Nordrhein-Westfalen",
      "amtsgericht": "Amtsgericht Paderborn",
      "registernummer": "HRA 8244",
      "registerart": "HRA",
      "company_name": "Heinrich Amedick e. K. Inhaber Dustin Amedick",
      "company_seat": "Lichtenau",
      "details": "06.03.2025 (Bekanntmachungsdatum)\n\nNordrhein-Westfalen Amtsgericht Paderborn HRA 8244\nRegisterbekanntmachung nach dem Umwandlungsgesetz 06.03.2025 (Eintragungsdatum)\n\nHeinrich Amedick e. K. Inhaber Dustin Amedick\nEinzelkaufmann / Einzelkauffrau\nLichtenau\n\nDen Gläubigern der an der Ausgliederung beteiligten Rechtsträger ist, wenn sie binnen sechs Monaten nach dem Tag, an dem die Eintragung der Ausgliederung in das Register des Sitzes desjenigen Rechtsträgers, dessen Gläubiger sie sind, nach § 19 Absatz 3 UmwG als bekanntgemacht gilt, ihren Anspruch nach Grund und Höhe schriftlich anmelden, Sicherheit zu leisten, soweit sie nicht Befriedigung verlangen können. Dieses Recht steht den Gläubigern jedoch nur zu, wenn sie glaubhaft machen, dass durch die Ausgliederung die Erfüllung ihrer Forderung gefährdet wird."
    },
    {
      "date": "2025-03-06",
      "id": "103095",
      "original_text": "Einreichung neuer Dokumente\nNordrhein-Westfalen Amtsgericht Köln HRB 35407\nNetempire AG – Köln",
      "type": "Einreichung neuer Dokumente",
      "state": "Nordrhein-Westfalen",
      "amtsgericht": "Amtsgericht Köln",
      "registernummer": "HRB 35407",
      "registerart": "HRB",
      "company_name": "Netempire AG",
      "company_seat": "Köln",
      "details": "06.03.2025 (Bekanntmachungsdatum)\n\nNordrhein-Westfalen Amtsgericht Köln HRB 35407\nEinreichung neuer Dokumente\n\nNetempire AG\nAktiengesellschaft\nKöln\n\nDem Registergericht ist eine Liste der Mitglieder des Aufsichtsrates eingereicht worden."
    },
    {
      "date": "2025-03-06",
      "id": "103096",
      "original_text": "Löschungsankündigung\nNordrhein-Westfalen Amtsgericht Bochum HRB 20954\nH+V Construction UG (haftungsbeschränkt) – Bochum",
      "type": "Löschungsankündigung",
      "state": "Nordrhein-Westfalen",
      "amtsgericht": "Amtsgericht Bochum",
      "registernummer": "HRB 20954",
      "registerart": "HRB",
      "company_name": "H+V Construction UG (haftungsbeschränkt)",
      "company_seat": "Bochum",
      "details": "06.03.2025 (Bekanntmachungsdatum)\n\nNordrhein-Westfalen Amtsgericht Bochum HRB 20954\nLöschungsankündigung 07.03.2025 (Eintragungsdatum)\n\nH+V Construction UG (haftungsbeschränkt)\nGesellschaft mit beschränkter Haftung\nBochum\n\nDas Registergericht beabsichtigt die Gesellschaft von Amts wegen nach § 394 FamFG zu löschen. Die Frist zur Erhebung eines Widerspruchs ist auf drei Monate festgesetzt."
    },
    {
      "date": "2025-03-06",
      "id": "103097",
      "original_text": "Löschungsankündigung\nNordrhein-Westfalen Amtsgericht Bochum HRB 15674\nPatrick Kalff UG (haftungsbeschränkt) – Bochum",
      "type": "Löschungsankündigung",
      "state": "Nordrhein-Westfalen",
      "amtsgericht": "Amtsgericht Bochum",
      "registernummer": "HRB 15674",
      "registerart": "HRB",
      "company_name": "Patrick Kalff UG (haftungsbeschränkt)",
      "company_seat": "Bochum",
      "details": "06.03.2025 (Bekanntmachungsdatum)\n\nNordrhein-Westfalen Amtsgericht Bochum HRB 15674\nLöschungsankündigung 07.03.2025 (Eintragungsdatum)\n\nPatrick Kalff UG (haftungsbeschränkt)\nGesellschaft mit beschränkter Haftung\nBochum\n\nDas Registergericht beabsichtigt die Gesellschaft von Amts wegen nach § 394 FamFG zu löschen. Die Frist zur Erhebung eines Widerspruchs ist auf drei Monate festgesetzt."
    },
    {
      "date": "2025-03-06",
      "id": "103098",
      "original_text": "Löschungsankündigung\nNordrhein-Westfalen Amtsgericht Dortmund HRB 33328\nup Verwaltungs UG (haftungsbeschränkt) – Dortmund",
      "type": "Löschungsankündigung",
      "state": "Nordrhein-Westfalen",
      "amtsgericht": "Amtsgericht Dortmund",
      "registernummer": "HRB 33328",
      "registerart": "HRB",
      "company_name": "up Verwaltungs UG (haftungsbeschränkt)",
      "company_seat": "Dortmund",
      "details": "06.03.2025 (Bekanntmachungsdatum)\n\nNordrhein-Westfalen Amtsgericht Dortmund HRB 33328\nLöschungsankündigung 06.03.2025 (Eintragungsdatum)\n\nup Verwaltungs UG (haftungsbeschränkt)\nGesellschaft mit beschränkter Haftung\nDortmund\n\nDas Registergericht beabsichtigt die Gesellschaft von Amts wegen nach § 394 FamFG zu löschen. Die Frist zur Erhebung eines Widerspruchs ist auf zwei Monate festgesetzt."
    },
    {
      "date": "2025-03-06",
      "id": "103099",
      "original_text": "Registerbekanntmachung nach dem Umwandlungsgesetz\nNordrhein-Westfalen Amtsgericht Essen HRB 19639\nHOCHTIEF ViCon GmbH – Essen",
      "type": "Registerbekanntmachung nach dem Umwandlungsgesetz",
      "state": "Nordrhein-Westfalen",
      "amtsgericht": "Amtsgericht Essen",
      "registernummer": "HRB 19639",
      "registerart": "HRB",
      "company_name": "HOCHTIEF ViCon GmbH",
      "company_seat": "Essen",
      "details": "06.03.2025 (Bekanntmachungsdatum)\n\nNordrhein-Westfalen Amtsgericht Essen HRB 19639\nRegisterbekanntmachung nach dem Umwandlungsgesetz 06.03.2025 (Eintragungsdatum)\n\nHOCHTIEF ViCon GmbH\nGesellschaft mit beschränkter Haftung\nEssen\n\nDen Gläubigern der an der Verschmelzung beteiligten Rechtsträger ist, wenn sie binnen sechs Monaten nach dem Tag, an dem die Eintragung der Verschmelzung in das Register des Sitzes derjenigen Rechtsträger deren Gläubiger sie sind, nach § 19 Absatz 3 UmwG als bekanntgemacht gilt, ihren Anspruch nach Grund und Höhe schriftlich anmelden, Sicherheit zu leisten, soweit sie nicht Befriedigung verlangen können. Dieses Recht steht den Gläubigern jedoch nur zu, wenn sie glaubhaft machen, dass durch die Verschmelzung die Erfüllung ihrer Forderung gefährdet wird."
    },
    {
      "date": "2025-03-06",
      "id": "103100",
      "original_text": "Registerbekanntmachung nach dem Umwandlungsgesetz\nNordrhein-Westfalen Amtsgericht Paderborn HRA 7119\nWolle Rödel GmbH & Co. KG – Paderborn",
      "type": "Registerbekanntmachung nach dem Umwandlungsgesetz",
      "state": "Nordrhein-Westfalen",
      "amtsgericht": "Amtsgericht Paderborn",
      "registernummer": "HRA 7119",
      "registerart": "HRA",
      "company_name": "Wolle Rödel GmbH & Co. KG",
      "company_seat": "Paderborn",
      "details": "06.03.2025 (Bekanntmachungsdatum)\n\nNordrhein-Westfalen Amtsgericht Paderborn HRA 7119\nRegisterbekanntmachung nach dem Umwandlungsgesetz 06.03.2025 (Eintragungsdatum)\n\nWolle Rödel GmbH & Co. KG\nKommanditgesellschaft\nPaderborn\n\nDen Gläubigern der an der Verschmelzung beteiligten Rechtsträger ist, wenn sie binnen sechs Monaten nach dem Tag, an dem die Eintragung der Verschmelzung in das Register des Sitzes desjenigen Rechtsträgers, dessen Gläubiger sie sind, nach § 19 Absatz 3 UmwG als bekanntgemacht gilt, ihren Anspruch nach Grund und Höhe schriftlich anmelden, Sicherheit zu leisten, soweit sie nicht Befriedigung verlangen können. Dieses Recht steht den Gläubigern jedoch nur zu, wenn sie glaubhaft machen, dass durch die Verschmelzung die Erfüllung ihrer Forderung gefährdet wird."
    },
    {
      "date": "2025-03-06",
      "id": "103101",
      "original_text": "Löschungsankündigung\nNordrhein-Westfalen Amtsgericht Gelsenkirchen HRB 12361\nXCL Technologies (Deutschland) GmbH – Gelsenkirchen",
      "type": "Löschungsankündigung",
      "state": "Nordrhein-Westfalen",
      "amtsgericht": "Amtsgericht Gelsenkirchen",
      "registernummer": "HRB 12361",
      "registerart": "HRB",
      "company_name": "XCL Technologies (Deutschland) GmbH",
      "company_seat": "Gelsenkirchen",
      "details": "06.03.2025 (Bekanntmachungsdatum)\n\nNordrhein-Westfalen Amtsgericht Gelsenkirchen HRB 12361\nLöschungsankündigung\n\nXCL Technologies (Deutschland) GmbH\nGesellschaft mit beschränkter Haftung\nGelsenkirchen\n\nDas Gericht beabsichtigt, die Gesellschaft XCL Technologies (Deutschland) GmbH mit Sitz in Gelsenkirchen, HRB 12361 Amtsgericht Gelsenkirchen, wegen Vermögenslosigkeit zu löschen.\n\nHiermit wird denjenigen, die an der Unterlassung der Löschung ein berechtigtes Interesse haben, gem. § 394 Abs. 2 FamFG Gelegenheit gegeben, gegen dieses Vorhaben binnen eines Monats nach dieser Bekanntmachung Widerspruch einzulegen. Der Widerspruch kann schriftlich oder zu Protokoll der Geschäftsstelle erhoben werden."
    },
    {
      "date": "2025-03-06",
      "id": "103102",
      "original_text": "Löschungsankündigung\nNordrhein-Westfalen Amtsgericht Wuppertal HRB 29221\nBKS Banca Kurier und Service UG (haftungsbeschränkt) – Wuppertal",
      "type": "Löschungsankündigung",
      "state": "Nordrhein-Westfalen",
      "amtsgericht": "Amtsgericht Wuppertal",
      "registernummer": "HRB 29221",
      "registerart": "HRB",
      "company_name": "BKS Banca Kurier und Service UG (haftungsbeschränkt)",
      "company_seat": "Wuppertal",
      "details": "06.03.2025 (Bekanntmachungsdatum)\n\nNordrhein-Westfalen Amtsgericht Wuppertal HRB 29221\nLöschungsankündigung 05.03.2025 (Eintragungsdatum)\n\nBKS Banca Kurier und Service UG (haftungsbeschränkt)\nGesellschaft mit beschränkter Haftung\nWuppertal\n\nDas Registergericht beabsichtigt die Gesellschaft von Amts wegen nach § 394 FamFG zu löschen. Die Frist zur Erhebung eines Widerspruchs ist auf einen Monat festgesetzt."
    },
    {
      "date": "2025-03-06",
      "id": "103103",
      "original_text": "Löschungsankündigung\nNordrhein-Westfalen Amtsgericht Dortmund HRB 22824\nFS Handelsgesellschaft mbH – Selm",
      "type": "Löschungsankündigung",
      "state": "Nordrhein-Westfalen",
      "amtsgericht": "Amtsgericht Dortmund",
      "registernummer": "HRB 22824",
      "registerart": "HRB",
      "company_name": "FS Handelsgesellschaft mbH",
      "company_seat": "Selm",
      "details": "06.03.2025 (Bekanntmachungsdatum)\n\nNordrhein-Westfalen Amtsgericht Dortmund HRB 22824\nLöschungsankündigung\n\nFS Handelsgesellschaft mbH\nGesellschaft mit beschränkter Haftung\nSelm\n\nDas Registergericht beabsichtigt die Gesellschaft von Amts wegen nach § 394 FamFG zu löschen. Die Frist zur Erhebung eines Widerspruchs ist auf zwei Monate festgesetzt."
    },
    {
      "date": "2025-03-06",
      "id": "103104",
      "original_text": "Löschungsankündigung\nNordrhein-Westfalen Amtsgericht Mönchengladbach HRB 19027\nBSG UG (haftungsbeschränkt) – Mönchengladbach",
      "type": "Löschungsankündigung",
      "state": "Nordrhein-Westfalen",
      "amtsgericht": "Amtsgericht Mönchengladbach",
      "registernummer": "HRB 19027",
      "registerart": "HRB",
      "company_name": "BSG UG (haftungsbeschränkt)",
      "company_seat": "Mönchengladbach",
      "details": "06.03.2025 (Bekanntmachungsdatum)\n\nNordrhein-Westfalen Amtsgericht Mönchengladbach HRB 19027\nLöschungsankündigung\n\nBSG UG (haftungsbeschränkt)\nGesellschaft mit beschränkter Haftung\nMönchengladbach\n\nBSG UG (haftungsbeschränkt), Mönchengladbach (Amtsgericht Mönchengladbach, HRB 19027).\nDas Registergericht beabsichtigt, die im Handelsregister eingetragene Gesellschaft gemäß § 394 Absatz 1 FamFG wegen Vermögenslosigkeit von Amts wegen zu löschen. Gegen diese Verfügung kann Widerspruch eingelegt werden. Die Frist zur Erhebung eines Widerspruchs gegen die beabsichtigte Löschung von Amts wegen ist auf drei Monate festgesetzt."
    },
    {
      "date": "2025-03-06",
      "id": "103105",
      "original_text": "Sonstige Registerbekanntmachung\nNordrhein-Westfalen Amtsgericht Düsseldorf HRB 85246\nRex by Night UG (haftungsbeschränkt) – Düsseldorf",
      "type": "Sonstige Registerbekanntmachung",
      "state": "Nordrhein-Westfalen",
      "amtsgericht": "Amtsgericht Düsseldorf",
      "registernummer": "HRB 85246",
      "registerart": "HRB",
      "company_name": "Rex by Night UG (haftungsbeschränkt)",
      "company_seat": "Düsseldorf",
      "details": "06.03.2025 (Bekanntmachungsdatum)\n\nNordrhein-Westfalen Amtsgericht Düsseldorf HRB 85246\nSonstige Registerbekanntmachung 06.03.2025 (Eintragungsdatum)\n\nRex by Night UG (haftungsbeschränkt)\nGesellschaft mit beschränkter Haftung\nDüsseldorf\n\nDie Gesellschaft ist aufgelöst. Von Amts wegen eingetragen."
    },
    {
      "date": "2025-03-06",
      "id": "103106",
      "original_text": "Löschungsankündigung\nNordrhein-Westfalen Amtsgericht Dortmund HRB 32266\nP.I.A. Pflege im Alter UG (haftungsbeschränkt) – Castrop-Rauxel",
      "type": "Löschungsankündigung",
      "state": "Nordrhein-Westfalen",
      "amtsgericht": "Amtsgericht Dortmund",
      "registernummer": "HRB 32266",
      "registerart": "HRB",
      "company_name": "P.I.A. Pflege im Alter UG (haftungsbeschränkt)",
      "company_seat": "Castrop-Rauxel",
      "details": "06.03.2025 (Bekanntmachungsdatum)\n\nNordrhein-Westfalen Amtsgericht Dortmund HRB 32266\nLöschungsankündigung 06.03.2025 (Eintragungsdatum)\n\nP.I.A. Pflege im Alter UG (haftungsbeschränkt)\nGesellschaft mit beschränkter Haftung\nCastrop-Rauxel\n\nDas Registergericht beabsichtigt die Gesellschaft von Amts wegen nach § 394 FamFG zu löschen. Die Frist zur Erhebung eines Widerspruchs ist auf zwei Monate festgesetzt."
    },
    {
      "date": "2025-03-06",
      "id": "103107",
      "original_text": "Sonstige Registerbekanntmachung\nNordrhein-Westfalen Amtsgericht Düsseldorf HRB 89859\nNICEFIELDS GmbH – Düsseldorf",
      "type": "Sonstige Registerbekanntmachung",
      "state": "Nordrhein-Westfalen",
      "amtsgericht": "Amtsgericht Düsseldorf",
      "registernummer": "HRB 89859",
      "registerart": "HRB",
      "company_name": "NICEFIELDS GmbH",
      "company_seat": "Düsseldorf",
      "details": "06.03.2025 (Bekanntmachungsdatum)\n\nNordrhein-Westfalen Amtsgericht Düsseldorf HRB 89859\nSonstige Registerbekanntmachung 06.03.2025 (Eintragungsdatum)\n\nNICEFIELDS GmbH\nGesellschaft mit beschränkter Haftung\nDüsseldorf\n\nDie Gesellschaft ist aufgelöst. Von Amts wegen eingetragen."
    },
    {
      "date": "2025-03-06",
      "id": "103108",
      "original_text": "Löschungsankündigung\nNordrhein-Westfalen Amtsgericht Düsseldorf HRB 101590\nACL Projekt GmbH – Düsseldorf",
      "type": "Löschungsankündigung",
      "state": "Nordrhein-Westfalen",
      "amtsgericht": "Amtsgericht Düsseldorf",
      "registernummer": "HRB 101590",
      "registerart": "HRB",
      "company_name": "ACL Projekt GmbH",
      "company_seat": "Düsseldorf",
      "details": "06.03.2025 (Bekanntmachungsdatum)\n\nNordrhein-Westfalen Amtsgericht Düsseldorf HRB 101590\nLöschungsankündigung\n\nACL Projekt GmbH\nGesellschaft mit beschränkter Haftung\nDüsseldorf\n\nDas Registergericht beabsichtigt die Gesellschaft von Amts wegen nach § 394 Abs. 1 FamFG zu löschen. Die Frist zur Erhebung eines Widerspruchs ist auf 3 Wochen festgesetzt.\n\nRechtsbehelfsbelehrung:\nDas Widerspruchsrecht steht jedem zu, der an der Unterlassung der Löschung ein berechtigtes Interesse hat. Der Widerspruch ist bei dem Amtsgericht Düsseldorf -Registergericht-, Werdener Straße 1, 40227 Düsseldorf schriftlich in deutscher Sprache oder zur Niederschrift der Geschäftsstelle einzulegen. Der Widerspruch kann auch zur Niederschrift der Geschäftsstelle eines jeden Amtsgerichtes abgegeben werden. Die Einlegung ist auch durch Übertragung eines elektronischen Dokuments an die elektronische Poststelle des Gerichts möglich. Das elektronische Dokument muss für die Bearbeitung durch das Gericht geeignet und mit einer qualifizierten elektronischen Signatur der verantwortenden Person versehen sein oder von der verantwortenden Person signiert und auf einem sicheren Übermittlungsweg gemäß § 130a ZPO nach näherer Maßgabe der Verordnung über die technischen Rahmenbedingungen des elektronischen Rechtsverkehrs und über das besondere elektronische Behördenpostfach (BGBl. I, S.3803) eingereicht werden. Weitere Informationen erhalten Sie auf der Internetseite www.justiz.de.\nDer Widerspruch muss spätestens innerhalb der gesetzten Frist nach dem Datum der Bekanntmachung der Löschungsankündigung bei dem Amtsgericht - Registergericht - Düsseldorf eingegangen sein.  Dies gilt auch dann, wenn der Widerspruch zur Niederschrift der Geschäftsstelle eines anderen Amtsgerichtes abgegeben wurde. Die Frist beginnt mit dem Tage der Bekanntmachung der Löschungsankündigung in dem für die Bekanntmachung der Eintragungen in das Handelsregister bestimmten elektronischen Informations- und Kommunikationssystem nach § 10 des Handelsgesetzbuches. Fällt das Ende der Frist auf einen Sonntag, einen allgemeinen Feiertag oder Sonnabend, so endet die Frist mit Ablauf des nächsten Werktages.\nDer Widerspruch muss die Bezeichnung der angefochtenen Löschungsankündigung sowie die Erklärung enthalten, dass Widerspruch gegen diese Löschungsankündigung eingelegt wird. Er ist zu unterzeichnen und soll begründet werden."
    },
    {
      "date": "2025-03-06",
      "id": "103109",
      "original_text": "Registerbekanntmachung nach dem Umwandlungsgesetz\nNordrhein-Westfalen Amtsgericht Aachen HRB 28369\nquip GmbH – Baesweiler",
      "type": "Registerbekanntmachung nach dem Umwandlungsgesetz",
      "state": "Nordrhein-Westfalen",
      "amtsgericht": "Amtsgericht Aachen",
      "registernummer": "HRB 28369",
      "registerart": "HRB",
      "company_name": "quip GmbH",
      "company_seat": "Baesweiler",
      "details": "06.03.2025 (Bekanntmachungsdatum)\n\nNordrhein-Westfalen Amtsgericht Aachen HRB 28369\nRegisterbekanntmachung nach dem Umwandlungsgesetz 06.03.2025 (Eintragungsdatum)\n\nquip GmbH\nGesellschaft mit beschränkter Haftung\nBaesweiler\n\nDen Gläubigern der an der Verschmelzung beteiligten Rechtsträger ist, wenn sie binnen sechs Monaten nach dem Tag, an dem die Eintragung der Verschmelzung in das Register des Sitzes derjenigen Rechtsträger deren Gläubiger sie sind, nach § 19 Absatz 3 UmwG als bekanntgemacht gilt, ihren Anspruch nach Grund und Höhe schriftlich anmelden, Sicherheit zu leisten, soweit sie nicht Befriedigung verlangen können. Dieses Recht steht den Gläubigern jedoch nur zu, wenn sie glaubhaft machen, dass durch die Verschmelzung die Erfüllung ihrer Forderung gefährdet wird."
    },
    {
      "date": "2025-03-06",
      "id": "103110",
      "original_text": "Registerbekanntmachung nach dem Umwandlungsgesetz\nNordrhein-Westfalen Amtsgericht Aachen HRB 21020\nQuip Süd GmbH – Baesweiler",
      "type": "Registerbekanntmachung nach dem Umwandlungsgesetz",
      "state": "Nordrhein-Westfalen",
      "amtsgericht": "Amtsgericht Aachen",
      "registernummer": "HRB 21020",
      "registerart": "HRB",
      "company_name": "Quip Süd GmbH",
      "company_seat": "Baesweiler",
      "details": "06.03.2025 (Bekanntmachungsdatum)\n\nNordrhein-Westfalen Amtsgericht Aachen HRB 21020\nRegisterbekanntmachung nach dem Umwandlungsgesetz 06.03.2025 (Eintragungsdatum)\n\nQuip Süd GmbH\nGesellschaft mit beschränkter Haftung\nBaesweiler\n\nDen Gläubigern der an der Verschmelzung beteiligten Rechtsträger ist, wenn sie binnen sechs Monaten nach dem Tag, an dem die Eintragung der Verschmelzung in das Register des Sitzes derjenigen Rechtsträger deren Gläubiger sie sind, nach § 19 Absatz 3 UmwG als bekanntgemacht gilt, ihren Anspruch nach Grund und Höhe schriftlich anmelden, Sicherheit zu leisten, soweit sie nicht Befriedigung verlangen können. Dieses Recht steht den Gläubigern jedoch nur zu, wenn sie glaubhaft machen, dass durch die Verschmelzung die Erfüllung ihrer Forderung gefährdet wird."
    },
    {
      "date": "2025-03-06",
      "id": "103111",
      "original_text": "Registerbekanntmachung nach dem Umwandlungsgesetz\nThüringen Amtsgericht Jena HRB 518629\nAuto Buch GmbH – Jena",
      "type": "Registerbekanntmachung nach dem Umwandlungsgesetz",
      "state": "Thüringen",
      "amtsgericht": "Amtsgericht Jena",
      "registernummer": "HRB 518629",
      "registerart": "HRB",
      "company_name": "Auto Buch GmbH",
      "company_seat": "Jena",
      "details": "06.03.2025 (Bekanntmachungsdatum)\n\nThüringen Amtsgericht Jena HRB 518629\nRegisterbekanntmachung nach dem Umwandlungsgesetz 06.03.2025 (Eintragungsdatum)\n\nAuto Buch GmbH\nGesellschaft mit beschränkter Haftung\nJena\n\nNicht eingetragen: Den Gläubigern der an der Verschmelzung beteiligten Rechtsträger, ist wenn sie binnen sechs Monaten nach dem Tag, an dem die Eintragung der Verschmelzung in das Register des Sitzes desjenigen Rechtsträgers, dessen Gläubiger sie sind,  nach § 19 Abs. 3 UmwG als bekanntgemacht gilt, ihren Anspruch nach Grund und Höhe schriftlich anmelden, Sicherheit zu leisten, soweit sie nicht Befriedigung verlangen können. Dieses Recht steht ihnen jedoch nur zu, wenn sie glaubhaft machen, daß durch die Verschmelzung die Erfüllung ihrer Forderung gefährdet wird."
    },
    {
      "date": "2025-03-06",
      "id": "103112",
      "original_text": "Registerbekanntmachung nach dem Umwandlungsgesetz\nThüringen Amtsgericht Jena HRB 516968\nCaravan Center Thüringen GmbH – Jena",
      "type": "Registerbekanntmachung nach dem Umwandlungsgesetz",
      "state": "Thüringen",
      "amtsgericht": "Amtsgericht Jena",
      "registernummer": "HRB 516968",
      "registerart": "HRB",
      "company_name": "Caravan Center Thüringen GmbH",
      "company_seat": "Jena",
      "details": "06.03.2025 (Bekanntmachungsdatum)\n\nThüringen Amtsgericht Jena HRB 516968\nRegisterbekanntmachung nach dem Umwandlungsgesetz 06.03.2025 (Eintragungsdatum)\n\nCaravan Center Thüringen GmbH\nGesellschaft mit beschränkter Haftung\nJena\n\nNicht eingetragen: Den Gläubigern der an der Verschmelzung beteiligten Rechtsträger, ist wenn sie binnen sechs Monaten nach dem Tag, an dem die Eintragung der Verschmelzung in das Register des Sitzes desjenigen Rechtsträgers, dessen Gläubiger sie sind,  nach § 19 Abs. 3 UmwG als bekanntgemacht gilt, ihren Anspruch nach Grund und Höhe schriftlich anmelden, Sicherheit zu leisten, soweit sie nicht Befriedigung verlangen können. Dieses Recht steht ihnen jedoch nur zu, wenn sie glaubhaft machen, daß durch die Verschmelzung die Erfüllung ihrer Forderung gefährdet wird."
    },
    {
      "date": "2025-03-06",
      "id": "103113",
      "original_text": "Einreichung neuer Dokumente\nHessen Amtsgericht Offenbach am Main HRB 42105\nJOST-Werke Deutschland GmbH – Neu-Isenburg",
      "type": "Einreichung neuer Dokumente",
      "state": "Hessen",
      "amtsgericht": "Amtsgericht Offenbach am Main",
      "registernummer": "HRB 42105",
      "registerart": "HRB",
      "company_name": "JOST-Werke Deutschland GmbH",
      "company_seat": "Neu-Isenburg",
      "details": "06.03.2025 (Bekanntmachungsdatum)\n\nHessen Amtsgericht Offenbach am Main HRB 42105\nEinreichung neuer Dokumente 06.03.2025 (Eintragungsdatum)\n\nJOST-Werke Deutschland GmbH\nGesellschaft mit beschränkter Haftung\nNeu-Isenburg\n\nDurch eine Änderung in den Personen der Aufsichtsratsmitglieder ist eine Liste der Mitglieder des Aufsichtsrates zum Handelsregister eingereicht worden."
    },
    {
      "date": "2025-03-06",
      "id": "103114",
      "original_text": "Sonstige Registerbekanntmachung\nHessen Amtsgericht Kassel VR 4489\nEiskunst- und Rollschuhlauf Verein Kassel – Kassel",
      "type": "Sonstige Registerbekanntmachung",
      "state": "Hessen",
      "amtsgericht": "Amtsgericht Kassel",
      "registernummer": "VR 4489",
      "registerart": "VR",
      "company_name": "Eiskunst- und Rollschuhlauf Verein Kassel",
      "company_seat": "Kassel",
      "details": "06.03.2025 (Bekanntmachungsdatum)\n\nHessen Amtsgericht Kassel VR 4489\nSonstige Registerbekanntmachung 06.03.2025 (Eintragungsdatum)\n\nEiskunst- und Rollschuhlauf Verein Kassel\neingetragener Verein\nKassel\n\nDer Verein ist aufgelöst."
    },
    {
      "date": "2025-03-06",
      "id": "103115",
      "original_text": "Sonstige Registerbekanntmachung\nHessen Amtsgericht Darmstadt VR 60749\nEl Gato – Bürstadt",
      "type": "Sonstige Registerbekanntmachung",
      "state": "Hessen",
      "amtsgericht": "Amtsgericht Darmstadt",
      "registernummer": "VR 60749",
      "registerart": "VR",
      "company_name": "El Gato",
      "company_seat": "Bürstadt",
      "details": "06.03.2025 (Bekanntmachungsdatum)\n\nHessen Amtsgericht Darmstadt VR 60749\nSonstige Registerbekanntmachung 06.03.2025 (Eintragungsdatum)\n\nEl Gato\neingetragener Verein\nBürstadt\n\nDer Verein ist aufgelöst."
    },
    {
      "date": "2025-03-06",
      "id": "103116",
      "original_text": "Registerbekanntmachung nach dem Umwandlungsgesetz\nHessen Amtsgericht Frankfurt am Main HRB 137947\nNaGa Solarpark Manschnow GmbH – Frankfurt am Main",
      "type": "Registerbekanntmachung nach dem Umwandlungsgesetz",
      "state": "Hessen",
      "amtsgericht": "Amtsgericht Frankfurt am Main",
      "registernummer": "HRB 137947",
      "registerart": "HRB",
      "company_name": "NaGa Solarpark Manschnow GmbH",
      "company_seat": "Frankfurt am Main",
      "details": "06.03.2025 (Bekanntmachungsdatum)\n\nHessen Amtsgericht Frankfurt am Main HRB 137947\nRegisterbekanntmachung nach dem Umwandlungsgesetz 06.03.2025 (Eintragungsdatum)\n\nNaGa Solarpark Manschnow GmbH\nGesellschaft mit beschränkter Haftung\nFrankfurt am Main\n\nDen Gläubigern der Gesellschaft, deren Forderungen begründet worden sind, bevor die Eintragung der Beendigung des Vertrags in das Handelsregister nach § 10 HGB bekannt gemacht worden ist, ist vom anderen Vertragsteil Sicherheit zu leisten, wenn sie sich binnen sechs Monaten nach dieser Bekanntmachung zu diesem Zweck bei ihm melden.Den Gläubigern der an der formwechselnden Umwandlung beteiligten Rechtsträger ist, wenn sie binnen sechs Monaten nach dem Tag, an dem die Eintragung der formwechselnden Umwandlung in das Register des Sitzes derjenigen Rechtsträger deren Gläubiger sie sind, nach § 201 UmwG bekannt gemacht worden ist, ihren Anspruch nach Grund und Höhe schriftlich anmelden, Sicherheit zu leisten, soweit sie nicht Befriedigung verlangen können. Dieses Recht steht den Gläubigern jedoch nur zu, wenn sie glaubhaft machen, dass durch die formwechselnden Umwandlung die Erfüllung ihrer Forderung gefährdet wird."
    },
    {
      "date": "2025-03-06",
      "id": "103117",
      "original_text": "Registerbekanntmachung nach dem Umwandlungsgesetz\nHessen Amtsgericht Frankfurt am Main HRB 80355\nDIC HI Objekt Frankfurt Theodor-Heuss-Allee GmbH – Frankfurt am Main",
      "type": "Registerbekanntmachung nach dem Umwandlungsgesetz",
      "state": "Hessen",
      "amtsgericht": "Amtsgericht Frankfurt am Main",
      "registernummer": "HRB 80355",
      "registerart": "HRB",
      "company_name": "DIC HI Objekt Frankfurt Theodor-Heuss-Allee GmbH",
      "company_seat": "Frankfurt am Main",
      "details": "06.03.2025 (Bekanntmachungsdatum)\n\nHessen Amtsgericht Frankfurt am Main HRB 80355\nRegisterbekanntmachung nach dem Umwandlungsgesetz 06.03.2025 (Eintragungsdatum)\n\nDIC HI Objekt Frankfurt Theodor-Heuss-Allee GmbH\nGesellschaft mit beschränkter Haftung\nFrankfurt am Main\n\nDen Gläubigern der an der Verschmelzung beteiligten Rechtsträger ist, wenn sie binnen sechs Monaten nach dem Tag, an dem die Eintragung der Verschmelzung in das Register des Sitzes desjenigen Rechtsträgers, dessen Gläubiger sie sind, nach § 19 Absatz 3 UmwG bekannt gemacht worden ist, ihren Anspruch nach Grund und Höhe schriftlich anmelden, Sicherheit zu leisten, soweit sie nicht Befriedigung verlangen können. Dieses Recht steht den Gläubigern jedoch nur zu, wenn sie glaubhaft machen, dass durch die Verschmelzung die Erfüllung ihrer Forderung gefährdet wird."
    },
    {
      "date": "2025-03-06",
      "id": "103118",
      "original_text": "Einreichung neuer Dokumente\nHessen Amtsgericht Offenbach am Main HRB 40398\nEFiS Aktiengesellschaft – Dreieich",
      "type": "Einreichung neuer Dokumente",
      "state": "Hessen",
      "amtsgericht": "Amtsgericht Offenbach am Main",
      "registernummer": "HRB 40398",
      "registerart": "HRB",
      "company_name": "EFiS Aktiengesellschaft",
      "company_seat": "Dreieich",
      "details": "06.03.2025 (Bekanntmachungsdatum)\n\nHessen Amtsgericht Offenbach am Main HRB 40398\nEinreichung neuer Dokumente\n\nEFiS Aktiengesellschaft\nAktiengesellschaft\nDreieich\n\nDurch eine Änderung in den Personen der Aufsichtsratsmitglieder ist eine Liste der Mitglieder des Aufsichtsrates zum Handelsregister eingereicht worden."
    },
    {
      "date": "2025-03-06",
      "id": "103119",
      "original_text": "Registerbekanntmachung nach dem Umwandlungsgesetz\nHessen Amtsgericht Frankfurt am Main HRA 51944\nNaGa Solarpark Manschnow GmbH & Co. KG – Frankfurt am Main",
      "type": "Registerbekanntmachung nach dem Umwandlungsgesetz",
      "state": "Hessen",
      "amtsgericht": "Amtsgericht Frankfurt am Main",
      "registernummer": "HRA 51944",
      "registerart": "HRA",
      "company_name": "NaGa Solarpark Manschnow GmbH & Co. KG",
      "company_seat": "Frankfurt am Main",
      "details": "06.03.2025 (Bekanntmachungsdatum)\n\nHessen Amtsgericht Frankfurt am Main HRA 51944\nRegisterbekanntmachung nach dem Umwandlungsgesetz 06.03.2025 (Eintragungsdatum)\n\nNaGa Solarpark Manschnow GmbH & Co. KG\nKommanditgesellschaft\nFrankfurt am Main\n\nDen Gläubigern der an der formwechselnden Umwandlung beteiligten Rechtsträger ist, wenn sie binnen sechs Monaten nach dem Tag, an dem die Eintragung der formwechselnden Umwandlung in das Register des Sitzes derjenigen Rechtsträger deren Gläubiger sie sind, nach § 201 UmwG bekannt gemacht worden ist, ihren Anspruch nach Grund und Höhe schriftlich anmelden, Sicherheit zu leisten, soweit sie nicht Befriedigung verlangen können. Dieses Recht steht den Gläubigern jedoch nur zu, wenn sie glaubhaft machen, dass durch die formwechselnden Umwandlung die Erfüllung ihrer Forderung gefährdet wird."
    },
    {
      "date": "2025-03-06",
      "id": "103120",
      "original_text": "Löschungsankündigung\nHessen Amtsgericht Hanau HRB 91938\nGiso Vermiet-GmbH – Freigericht",
      "type": "Löschungsankündigung",
      "state": "Hessen",
      "amtsgericht": "Amtsgericht Hanau",
      "registernummer": "HRB 91938",
      "registerart": "HRB",
      "company_name": "Giso Vermiet-GmbH",
      "company_seat": "Freigericht",
      "details": "06.03.2025 (Bekanntmachungsdatum)\n\nHessen Amtsgericht Hanau HRB 91938\nLöschungsankündigung\n\nGiso Vermiet-GmbH\nGesellschaft mit beschränkter Haftung\nFreigericht\n\nDas Registergericht beabsichtigt die im Handelsregister eingetragene Gesellschaft von Amts wegen nach § 394 FamFG zu löschen. Die Frist zur Erhebung eines Widerspruchs gegen die beabsichtigte Löschung wird auf 3 Monate festgesetzt."
    },
    {
      "date": "2025-03-06",
      "id": "103121",
      "original_text": "Löschungsankündigung\nHessen Amtsgericht Frankfurt am Main HRB 119702\nSculptBuddy GmbH – Frankfurt am Main",
      "type": "Löschungsankündigung",
      "state": "Hessen",
      "amtsgericht": "Amtsgericht Frankfurt am Main",
      "registernummer": "HRB 119702",
      "registerart": "HRB",
      "company_name": "SculptBuddy GmbH",
      "company_seat": "Frankfurt am Main",
      "details": "06.03.2025 (Bekanntmachungsdatum)\n\nHessen Amtsgericht Frankfurt am Main HRB 119702\nLöschungsankündigung 06.03.2025 (Eintragungsdatum)\n\nSculptBuddy GmbH\nGesellschaft mit beschränkter Haftung\nFrankfurt am Main\n\nEs ist beabsichtigt die Gesellschaft wegen Vermögenslosigkeit gemäß § 394 FamFG von Amts wegen zu löschen. Hiergegen kann innerhalb eines Monats nach dieser Veröffentlichung Widerspruch bei dem Amtsgericht Frankfurt am Main eingelegt werden."
    }
  ]
}