{
  "date": "2025-03-15",
  "date_of_scrape": "2025-03-31T11:10:56.721Z",
  "tool_version": "0.2.0",
  "number_of_announcements": 13,
  "announcements": [
    {
      "date": "2025-03-15",
      "id": "103888",
      "original_text": "Löschungsankündigung\nBayern Amtsgericht München HRB 238908\nTou Bakali Süd GmbH – Kirchseeon",
      "type": "Löschungsankündigung",
      "state": "Bayern",
      "amtsgericht": "Amtsgericht München",
      "registernummer": "HRB 238908",
      "registerart": "HRB",
      "company_name": "Tou Bakali Süd GmbH",
      "company_seat": "Kirchseeon",
      "details": "15.03.2025 (Bekanntmachungsdatum)\n\nBayern Amtsgericht München HRB 238908\nLöschungsankündigung 14.03.2025 (Eintragungsdatum)\n\nTou Bakali Süd GmbH\nGesellschaft mit beschränkter Haftung\nKirchseeon\n\nDas Registergericht beabsichtigt, die im Handelsregister eingetragene Gesellschaft wegen Vermögenslosigkeit von Amts wegen nach § 394 FamFG zu löschen. Die Frist zur Erhebung eines Widerspruchs ist auf drei Monate festgesetzt."
    },
    {
      "date": "2025-03-15",
      "id": "103889",
      "original_text": "Einreichung neuer Dokumente\nBayern Amtsgericht München HRB 246403\nImmowert Bewertungsgesellschaft AG – München",
      "type": "Einreichung neuer Dokumente",
      "state": "Bayern",
      "amtsgericht": "Amtsgericht München",
      "registernummer": "HRB 246403",
      "registerart": "HRB",
      "company_name": "Immowert Bewertungsgesellschaft AG",
      "company_seat": "München",
      "details": "15.03.2025 (Bekanntmachungsdatum)\n\nBayern Amtsgericht München HRB 246403\nEinreichung neuer Dokumente\n\nImmowert Bewertungsgesellschaft AG\nAktiengesellschaft\nMünchen\n\nDem Amtsgericht München -Registergericht- ist eine Liste der Mitglieder des Aufsichtsrats eingereicht worden, § 106 AktG."
    },
    {
      "date": "2025-03-15",
      "id": "103890",
      "original_text": "Löschungsankündigung\nBayern Amtsgericht München HRB 247869\nRJ-Garten UG (haftungsbeschränkt) – Puchheim",
      "type": "Löschungsankündigung",
      "state": "Bayern",
      "amtsgericht": "Amtsgericht München",
      "registernummer": "HRB 247869",
      "registerart": "HRB",
      "company_name": "RJ-Garten UG (haftungsbeschränkt)",
      "company_seat": "Puchheim",
      "details": "15.03.2025 (Bekanntmachungsdatum)\n\nBayern Amtsgericht München HRB 247869\nLöschungsankündigung\n\nRJ-Garten UG (haftungsbeschränkt)\nGesellschaft mit beschränkter Haftung\nPuchheim\n\nDas Registergericht beabsichtigt, die im Handelsregister eingetragene Gesellschaft wegen Vermögenslosigkeit von Amts wegen nach § 394 FamFG zu löschen. Die Frist zur Erhebung eines Widerspruchs ist auf drei Monate festgesetzt."
    },
    {
      "date": "2025-03-15",
      "id": "103891",
      "original_text": "Löschungsankündigung\nBayern Amtsgericht Bayreuth HRB 3422\nLEONARDO Haus GmbH – Goldkronach",
      "type": "Löschungsankündigung",
      "state": "Bayern",
      "amtsgericht": "Amtsgericht Bayreuth",
      "registernummer": "HRB 3422",
      "registerart": "HRB",
      "company_name": "LEONARDO Haus GmbH",
      "company_seat": "Goldkronach",
      "details": "15.03.2025 (Bekanntmachungsdatum)\n\nBayern Amtsgericht Bayreuth HRB 3422\nLöschungsankündigung\n\nLEONARDO Haus GmbH\nGesellschaft mit beschränkter Haftung\nGoldkronach\n\nDas Registergericht beabsichtigt, die im Handelsregister eingetragene Gesellschaft wegen Vermögenslosigkeit von Amts wegen nach § 394 FamFG zu löschen. Die Frist zur Erhebung eines Widerspruchs ist auf einen Monat ab Zustellung oder Veröffentlichung dieses Schreibens festgesetzt."
    },
    {
      "date": "2025-03-15",
      "id": "103892",
      "original_text": "Registerbekanntmachung nach dem Umwandlungsgesetz\nBayern Amtsgericht München HRB 286480\nCastenow Karma GmbH – München",
      "type": "Registerbekanntmachung nach dem Umwandlungsgesetz",
      "state": "Bayern",
      "amtsgericht": "Amtsgericht München",
      "registernummer": "HRB 286480",
      "registerart": "HRB",
      "company_name": "Castenow Karma GmbH",
      "company_seat": "München",
      "details": "15.03.2025 (Bekanntmachungsdatum)\n\nBayern Amtsgericht München HRB 286480\nRegisterbekanntmachung nach dem Umwandlungsgesetz 14.03.2025 (Eintragungsdatum)\n\nCastenow Karma GmbH\nGesellschaft mit beschränkter Haftung\nMünchen\n\nDen Gläubigern der an der Verschmelzung beteiligten Rechtsträger ist, wenn sie binnen sechs Monaten nach dem Tag, an dem die Eintragung der Verschmelzung in das Register des Sitzes desjenigen Rechtsträgers, dessen Gläubiger sie sind, nach § 19 Abs. 3 UmwG als bekannt gemacht gilt, ihren Anspruch nach Grund und Höhe in Textform anmelden, Sicherheit zu leisten, soweit sie nicht Befriedigung verlangen können. Dieses Recht steht den Gläubigern jedoch nur zu, wenn sie glaubhaft machen, dass durch die Verschmelzung die Erfüllung ihrer Forderung gefährdet wird."
    },
    {
      "date": "2025-03-15",
      "id": "103893",
      "original_text": "Löschungsankündigung\nBayern Amtsgericht Nürnberg HRB 28345\nHM Bau-Maschinen-Miete Ltd. Niederlassung Deutschland – Nürnberg",
      "type": "Löschungsankündigung",
      "state": "Bayern",
      "amtsgericht": "Amtsgericht Nürnberg",
      "registernummer": "HRB 28345",
      "registerart": "HRB",
      "company_name": "HM Bau-Maschinen-Miete Ltd. Niederlassung Deutschland",
      "company_seat": "Nürnberg",
      "details": "15.03.2025 (Bekanntmachungsdatum)\n\nBayern Amtsgericht Nürnberg HRB 28345\nLöschungsankündigung\n\nHM Bau-Maschinen-Miete Ltd. Niederlassung Deutschland\nRechtsform ausländischen Rechts HRB\nNürnberg\n\nDas Registergericht beabsichtigt, die im Handelsregister eingetragene Gesellschaft von Amts wegen nach § 395 FamFG zu löschen. Die Frist zur Erhebung eines Widerspruchs ist auf einen Monat festgesetzt."
    },
    {
      "date": "2025-03-15",
      "id": "103894",
      "original_text": "Löschungsankündigung\nBayern Amtsgericht Kempten (Allgäu) HRB 15094\nRossini an der alten Bleiche GmbH – Kempten (Allgäu)",
      "type": "Löschungsankündigung",
      "state": "Bayern",
      "amtsgericht": "Amtsgericht Kempten (Allgäu)",
      "registernummer": "HRB 15094",
      "registerart": "HRB",
      "company_name": "Rossini an der alten Bleiche GmbH",
      "company_seat": "Kempten (Allgäu)",
      "details": "15.03.2025 (Bekanntmachungsdatum)\n\nBayern Amtsgericht Kempten (Allgäu) HRB 15094\nLöschungsankündigung\n\nRossini an der alten Bleiche GmbH\nGesellschaft mit beschränkter Haftung\nKempten (Allgäu)\n\nDas Registergericht beabsichtigt, die im Handelsregister eingetragene Gesellschaft wegen Vermögenslosigkeit von Amts wegen nach § 394 FamFG zu löschen. Die Frist zur Erhebung eines Widerspruchs ist auf einen Monat festgesetzt."
    },
    {
      "date": "2025-03-15",
      "id": "103895",
      "original_text": "Registerbekanntmachung nach dem Umwandlungsgesetz\nBayern Amtsgericht Landshut HRB 1302\nPrechler GmbH – Weng",
      "type": "Registerbekanntmachung nach dem Umwandlungsgesetz",
      "state": "Bayern",
      "amtsgericht": "Amtsgericht Landshut",
      "registernummer": "HRB 1302",
      "registerart": "HRB",
      "company_name": "Prechler GmbH",
      "company_seat": "Weng",
      "details": "15.03.2025 (Bekanntmachungsdatum)\n\nBayern Amtsgericht Landshut HRB 1302\nRegisterbekanntmachung nach dem Umwandlungsgesetz 14.03.2025 (Eintragungsdatum)\n\nPrechler GmbH\nGesellschaft mit beschränkter Haftung\nWeng\n\nDen Gläubigern der an der Verschmelzung beteiligten Rechtsträger ist, wenn sie binnen sechs Monaten nach dem Tag, an dem die Eintragung der Verschmelzung in das Register des Sitzes desjenigen Rechtsträgers, dessen Gläubiger sie sind, nach § 19 Abs. 3 UmwG als bekannt gemacht gilt, ihren Anspruch nach Grund und Höhe in Textform anmelden, Sicherheit zu leisten, soweit sie nicht Befriedigung verlangen können. Dieses Recht steht den Gläubigern jedoch nur zu, wenn sie glaubhaft machen, dass durch die Verschmelzung die Erfüllung ihrer Forderung gefährdet wird."
    },
    {
      "date": "2025-03-15",
      "id": "103896",
      "original_text": "Löschungsankündigung\nBayern Amtsgericht Bayreuth HRB 4842\nQuantor Verwaltungs GmbH – Bayreuth",
      "type": "Löschungsankündigung",
      "state": "Bayern",
      "amtsgericht": "Amtsgericht Bayreuth",
      "registernummer": "HRB 4842",
      "registerart": "HRB",
      "company_name": "Quantor Verwaltungs GmbH",
      "company_seat": "Bayreuth",
      "details": "15.03.2025 (Bekanntmachungsdatum)\n\nBayern Amtsgericht Bayreuth HRB 4842\nLöschungsankündigung\n\nQuantor Verwaltungs GmbH\nGesellschaft mit beschränkter Haftung\nBayreuth\n\nDas Registergericht beabsichtigt, die im Handelsregister eingetragene Gesellschaft wegen Vermögenslosigkeit von Amts wegen nach § 394 FamFG zu löschen. Die Frist zur Erhebung eines Widerspruchs ist auf drei Monate festgesetzt."
    },
    {
      "date": "2025-03-15",
      "id": "103897",
      "original_text": "Einreichung neuer Dokumente\nBayern Amtsgericht München HRB 261218\nLIVIA Finance III AG – München",
      "type": "Einreichung neuer Dokumente",
      "state": "Bayern",
      "amtsgericht": "Amtsgericht München",
      "registernummer": "HRB 261218",
      "registerart": "HRB",
      "company_name": "LIVIA Finance III AG",
      "company_seat": "München",
      "details": "15.03.2025 (Bekanntmachungsdatum)\n\nBayern Amtsgericht München HRB 261218\nEinreichung neuer Dokumente 14.03.2025 (Eintragungsdatum)\n\nLIVIA Finance III AG\nAktiengesellschaft\nMünchen\n\nDem Amtsgericht München -Registergericht- ist eine Liste der Mitglieder des Aufsichtsrats eingereicht worden, § 106 AktG."
    },
    {
      "date": "2025-03-15",
      "id": "103898",
      "original_text": "Registerbekanntmachung nach dem Umwandlungsgesetz\nBayern Amtsgericht München HRB 298991\nDorst Technologies GmbH – Kochel a.See",
      "type": "Registerbekanntmachung nach dem Umwandlungsgesetz",
      "state": "Bayern",
      "amtsgericht": "Amtsgericht München",
      "registernummer": "HRB 298991",
      "registerart": "HRB",
      "company_name": "Dorst Technologies GmbH",
      "company_seat": "Kochel a.See",
      "details": "15.03.2025 (Bekanntmachungsdatum)\n\nBayern Amtsgericht München HRB 298991\nRegisterbekanntmachung nach dem Umwandlungsgesetz 14.03.2025 (Eintragungsdatum)\n\nDorst Technologies GmbH\nGesellschaft mit beschränkter Haftung\nKochel a.See\n\nDen Gläubigern der an der Verschmelzung beteiligten Rechtsträger ist, wenn sie binnen sechs Monaten nach dem Tag, an dem die Eintragung der Verschmelzung in das Register des Sitzes desjenigen Rechtsträgers, dessen Gläubiger sie sind, nach § 19 Abs. 3 UmwG als bekannt gemacht gilt, ihren Anspruch nach Grund und Höhe in Textform anmelden, Sicherheit zu leisten, soweit sie nicht Befriedigung verlangen können. Dieses Recht steht den Gläubigern jedoch nur zu, wenn sie glaubhaft machen, dass durch die Verschmelzung die Erfüllung ihrer Forderung gefährdet wird."
    },
    {
      "date": "2025-03-15",
      "id": "103899",
      "original_text": "Registerbekanntmachung nach dem Umwandlungsgesetz\nBayern Amtsgericht Landshut HRA 6776\nJosef Prechler, Metzgerei e. K. – Weng",
      "type": "Registerbekanntmachung nach dem Umwandlungsgesetz",
      "state": "Bayern",
      "amtsgericht": "Amtsgericht Landshut",
      "registernummer": "HRA 6776",
      "registerart": "HRA",
      "company_name": "Josef Prechler, Metzgerei e. K.",
      "company_seat": "Weng",
      "details": "15.03.2025 (Bekanntmachungsdatum)\n\nBayern Amtsgericht Landshut HRA 6776\nRegisterbekanntmachung nach dem Umwandlungsgesetz 14.03.2025 (Eintragungsdatum)\n\nJosef Prechler, Metzgerei e. K.\nEinzelkaufmann / Einzelkauffrau\nWeng\n\nDen Gläubigern der an der Verschmelzung beteiligten Rechtsträger ist, wenn sie binnen sechs Monaten nach dem Tag, an dem die Eintragung der Verschmelzung in das Register des Sitzes desjenigen Rechtsträgers, dessen Gläubiger sie sind, nach § 19 Abs. 3 UmwG als bekannt gemacht gilt, ihren Anspruch nach Grund und Höhe in Textform anmelden, Sicherheit zu leisten, soweit sie nicht Befriedigung verlangen können. Dieses Recht steht den Gläubigern jedoch nur zu, wenn sie glaubhaft machen, dass durch die Verschmelzung die Erfüllung ihrer Forderung gefährdet wird."
    },
    {
      "date": "2025-03-15",
      "id": "103900",
      "original_text": "Registerbekanntmachung nach dem Umwandlungsgesetz\nBayern Amtsgericht Nürnberg HRB 40181\nAS Holding GmbH – Schnaittach",
      "type": "Registerbekanntmachung nach dem Umwandlungsgesetz",
      "state": "Bayern",
      "amtsgericht": "Amtsgericht Nürnberg",
      "registernummer": "HRB 40181",
      "registerart": "HRB",
      "company_name": "AS Holding GmbH",
      "company_seat": "Schnaittach",
      "details": "15.03.2025 (Bekanntmachungsdatum)\n\nBayern Amtsgericht Nürnberg HRB 40181\nRegisterbekanntmachung nach dem Umwandlungsgesetz 14.03.2025 (Eintragungsdatum)\n\nAS Holding GmbH\nGesellschaft mit beschränkter Haftung\nSchnaittach\n\nDen Gläubigern der an der Verschmelzung beteiligten Rechtsträger ist, wenn sie binnen sechs Monaten nach dem Tag, an dem die Eintragung der Verschmelzung in das Register des Sitzes desjenigen Rechtsträgers, dessen Gläubiger sie sind, nach § 19 Abs. 3 UmwG als bekannt gemacht gilt, ihren Anspruch nach Grund und Höhe in Textform anmelden, Sicherheit zu leisten, soweit sie nicht Befriedigung verlangen können. Dieses Recht steht den Gläubigern jedoch nur zu, wenn sie glaubhaft machen, dass durch die Verschmelzung die Erfüllung ihrer Forderung gefährdet wird."
    }
  ]
}