{
  "date": "2025-03-10",
  "date_of_scrape": "2025-03-11T04:07:34.304Z",
  "tool_version": "0.2.0",
  "number_of_announcements": 117,
  "announcements": [
    {
      "date": "2025-03-10",
      "id": "103247",
      "original_text": "Löschungsankündigung\nSachsen-Anhalt Amtsgericht Stendal HRB 35037\nIdeal Baudienstleistung GmbH – Halle (Saale)",
      "type": "Löschungsankündigung",
      "state": "Sachsen-Anhalt",
      "amtsgericht": "Amtsgericht Stendal",
      "registernummer": "HRB 35037",
      "registerart": "HRB",
      "company_name": "Ideal Baudienstleistung GmbH",
      "company_seat": "Halle (Saale)",
      "details": "10.03.2025 (Bekanntmachungsdatum)\n\nSachsen-Anhalt Amtsgericht Stendal HRB 35037\nLöschungsankündigung\n\nIdeal Baudienstleistung GmbH\nGesellschaft mit beschränkter Haftung\nHalle (Saale)\n\nDas Registergericht beabsichtigt, nachfolgende im Handelregister eingetragenen Firmen von Amts wegen nach § 394 FamFG zu löschen. Die Frist zu Erhebung eines Widerspruchs wird auf drei Monate festgesetzt."
    },
    {
      "date": "2025-03-10",
      "id": "103248",
      "original_text": "Sonstige Registerbekanntmachung\nSachsen-Anhalt Amtsgericht Stendal HRB 107599\nAbwassergesellschaft Halberstadt GmbH – Halberstadt",
      "type": "Sonstige Registerbekanntmachung",
      "state": "Sachsen-Anhalt",
      "amtsgericht": "Amtsgericht Stendal",
      "registernummer": "HRB 107599",
      "registerart": "HRB",
      "company_name": "Abwassergesellschaft Halberstadt GmbH",
      "company_seat": "Halberstadt",
      "details": "10.03.2025 (Bekanntmachungsdatum)\n\nSachsen-Anhalt Amtsgericht Stendal HRB 107599\nSonstige Registerbekanntmachung\n\nAbwassergesellschaft Halberstadt GmbH\nGesellschaft mit beschränkter Haftung\nHalberstadt\n\nEine Liste der Mitglieder des Aufsichtsrates wurde zum Handelsregister eingereicht."
    },
    {
      "date": "2025-03-10",
      "id": "103249",
      "original_text": "Einreichung neuer Dokumente\nBaden-Württemberg Amtsgericht Freiburg HRB 541873\nMZV-Dienstleistungsgesellschaft mbH – Rielasingen-Worblingen",
      "type": "Einreichung neuer Dokumente",
      "state": "Baden-Württemberg",
      "amtsgericht": "Amtsgericht Freiburg",
      "registernummer": "HRB 541873",
      "registerart": "HRB",
      "company_name": "MZV-Dienstleistungsgesellschaft mbH",
      "company_seat": "Rielasingen-Worblingen",
      "details": "10.03.2025 (Bekanntmachungsdatum)\n\nBaden-Württemberg Amtsgericht Freiburg HRB 541873\nEinreichung neuer Dokumente 10.03.2025 (Eintragungsdatum)\n\nMZV-Dienstleistungsgesellschaft mbH\nGesellschaft mit beschränkter Haftung\nRielasingen-Worblingen\n\nDie Gesellschaft hat am 07.03.2025 die Liste über die Zusammensetzung des Aufsichtsrats zum Handelsregister eingereicht."
    },
    {
      "date": "2025-03-10",
      "id": "103250",
      "original_text": "Löschungsankündigung\nBrandenburg Amtsgericht Potsdam HRB 26970\nEHIS Emmanuel Haus & Industrie Service GmbH – Nuthe-Urstromtal",
      "type": "Löschungsankündigung",
      "state": "Brandenburg",
      "amtsgericht": "Amtsgericht Potsdam",
      "registernummer": "HRB 26970",
      "registerart": "HRB",
      "company_name": "EHIS Emmanuel Haus & Industrie Service GmbH",
      "company_seat": "Nuthe-Urstromtal",
      "details": "10.03.2025 (Bekanntmachungsdatum)\n\nBrandenburg Amtsgericht Potsdam HRB 26970\nLöschungsankündigung\n\nEHIS Emmanuel Haus & Industrie Service GmbH\nGesellschaft mit beschränkter Haftung\nNuthe-Urstromtal\n\nBei der nachstehenden Gesellschaft wird das Amtslöschungsverfahren gemäß § 394 FamFG eingeleitet. Widerspruchsfrist: 8 Wochen."
    },
    {
      "date": "2025-03-10",
      "id": "103251",
      "original_text": "Einreichung neuer Dokumente\nBaden-Württemberg Amtsgericht Mannheim HRB 433058\nFreudenberg Rückversicherung AG – Weinheim",
      "type": "Einreichung neuer Dokumente",
      "state": "Baden-Württemberg",
      "amtsgericht": "Amtsgericht Mannheim",
      "registernummer": "HRB 433058",
      "registerart": "HRB",
      "company_name": "Freudenberg Rückversicherung AG",
      "company_seat": "Weinheim",
      "details": "10.03.2025 (Bekanntmachungsdatum)\n\nBaden-Württemberg Amtsgericht Mannheim HRB 433058\nEinreichung neuer Dokumente\n\nFreudenberg Rückversicherung AG\nAktiengesellschaft\nWeinheim\n\nDie Gesellschaft hat am 07.03.2025 die Liste über die Zusammensetzung des Aufsichtsrats zum Handelsregister eingereicht."
    },
    {
      "date": "2025-03-10",
      "id": "103252",
      "original_text": "Löschungsankündigung\nBerlin Amtsgericht Berlin (Charlottenburg) HRB 211701\nBoda Bau GmbH – Berlin",
      "type": "Löschungsankündigung",
      "state": "Berlin",
      "amtsgericht": "Amtsgericht Berlin (Charlottenburg)",
      "registernummer": "HRB 211701",
      "registerart": "HRB",
      "company_name": "Boda Bau GmbH",
      "company_seat": "Berlin",
      "details": "10.03.2025 (Bekanntmachungsdatum)\n\nBerlin Amtsgericht Berlin (Charlottenburg) HRB 211701\nLöschungsankündigung\n\nBoda Bau GmbH\nGesellschaft mit beschränkter Haftung\nBerlin\n\nBei der nachstehenden Gesellschaft wird das Amtslöschungsverfahren gemäß § 394 FamFG eingeleitet. Widerspruchsfrist 6 Wochen"
    },
    {
      "date": "2025-03-10",
      "id": "103253",
      "original_text": "Einreichung neuer Dokumente\nBaden-Württemberg Amtsgericht Stuttgart HRB 206107\nTRUMPF Financial Services GmbH – Ditzingen",
      "type": "Einreichung neuer Dokumente",
      "state": "Baden-Württemberg",
      "amtsgericht": "Amtsgericht Stuttgart",
      "registernummer": "HRB 206107",
      "registerart": "HRB",
      "company_name": "TRUMPF Financial Services GmbH",
      "company_seat": "Ditzingen",
      "details": "10.03.2025 (Bekanntmachungsdatum)\n\nBaden-Württemberg Amtsgericht Stuttgart HRB 206107\nEinreichung neuer Dokumente\n\nTRUMPF Financial Services GmbH\nGesellschaft mit beschränkter Haftung\nDitzingen\n\nDie Gesellschaft hat am 07.03.2025 die Liste über die Zusammensetzung des Aufsichtsrats zum Handelsregister eingereicht."
    },
    {
      "date": "2025-03-10",
      "id": "103254",
      "original_text": "Registerbekanntmachung nach dem Umwandlungsgesetz\nBaden-Württemberg Amtsgericht Stuttgart HRB 789374\ngotec GmbH global online technologies – Altbach",
      "type": "Registerbekanntmachung nach dem Umwandlungsgesetz",
      "state": "Baden-Württemberg",
      "amtsgericht": "Amtsgericht Stuttgart",
      "registernummer": "HRB 789374",
      "registerart": "HRB",
      "company_name": "gotec GmbH global online technologies",
      "company_seat": "Altbach",
      "details": "10.03.2025 (Bekanntmachungsdatum)\n\nBaden-Württemberg Amtsgericht Stuttgart HRB 789374\nRegisterbekanntmachung nach dem Umwandlungsgesetz 10.03.2025 (Eintragungsdatum)\n\ngotec GmbH global online technologies\nGesellschaft mit beschränkter Haftung\nAltbach\n\nDen Gläubigern der an der Verschmelzung beteiligten Rechtsträger ist, wenn sie binnen sechs Monaten nach dem Tag, an dem die Eintragung der Verschmelzung in das Register des Sitzes desjenigen Rechtsträgers, dessen Gläubiger sie sind, nach § 19 Abs. 3 UmwG als bekanntgemacht gilt, ihren Anspruch nach Grund und Höhe schriftlich anmelden, Sicherheit zu leisten, soweit sie nicht Befriedigung verlangen können. Dieses Recht steht den Gläubigern jedoch nur zu, wenn sie glaubhaft machen, dass durch die Verschmelzung die Erfüllung ihrer Forderung gefährdet wird."
    },
    {
      "date": "2025-03-10",
      "id": "103255",
      "original_text": "Einreichung neuer Dokumente\nSchleswig-Holstein Amtsgericht Flensburg HRB 9370\nSchleswiger Grundstücksentwicklungsgesellschaft mbH – Schleswig",
      "type": "Einreichung neuer Dokumente",
      "state": "Schleswig-Holstein",
      "amtsgericht": "Amtsgericht Flensburg",
      "registernummer": "HRB 9370",
      "registerart": "HRB",
      "company_name": "Schleswiger Grundstücksentwicklungsgesellschaft mbH",
      "company_seat": "Schleswig",
      "details": "10.03.2025 (Bekanntmachungsdatum)\n\nSchleswig-Holstein Amtsgericht Flensburg HRB 9370\nEinreichung neuer Dokumente\n\nSchleswiger Grundstücksentwicklungsgesellschaft mbH\nGesellschaft mit beschränkter Haftung\nSchleswig\n\nNeue Aufsichtsratsliste nach Änderung eingereicht am 07.03.2025."
    },
    {
      "date": "2025-03-10",
      "id": "103256",
      "original_text": "Löschungsankündigung\nBaden-Württemberg Amtsgericht Mannheim HRB 103591\nZZ - Antriebe GmbH – Karlsruhe",
      "type": "Löschungsankündigung",
      "state": "Baden-Württemberg",
      "amtsgericht": "Amtsgericht Mannheim",
      "registernummer": "HRB 103591",
      "registerart": "HRB",
      "company_name": "ZZ - Antriebe GmbH",
      "company_seat": "Karlsruhe",
      "details": "10.03.2025 (Bekanntmachungsdatum)\n\nBaden-Württemberg Amtsgericht Mannheim HRB 103591\nLöschungsankündigung\n\nZZ - Antriebe GmbH\nGesellschaft mit beschränkter Haftung\nKarlsruhe\n\nAls nicht eingetragen wird bekanntgemacht:\nDas Gericht beabsichtigt, die Gesellschaft wegen Vermögenslosigkeit im Handelsregister von Amts wegen nach § 394 FamFG zu löschen. Die Frist zur Geltendmachung eines Widerspruchs gegen die beabsichtigte Löschung ist auf einen Monat ab Veröffentlichung bestimmt."
    },
    {
      "date": "2025-03-10",
      "id": "103257",
      "original_text": "Löschungsankündigung\nBaden-Württemberg Amtsgericht Freiburg HRA 707082\nDahinten Immobilien KG – Lahr",
      "type": "Löschungsankündigung",
      "state": "Baden-Württemberg",
      "amtsgericht": "Amtsgericht Freiburg",
      "registernummer": "HRA 707082",
      "registerart": "HRA",
      "company_name": "Dahinten Immobilien KG",
      "company_seat": "Lahr",
      "details": "10.03.2025 (Bekanntmachungsdatum)\n\nBaden-Württemberg Amtsgericht Freiburg HRA 707082\nLöschungsankündigung\n\nDahinten Immobilien KG\nKommanditgesellschaft\nLahr\n\nAls nicht eingetragen wird bekanntgemacht:\nDas Gericht beabsichtigt, die Gesellschaft im Handelsregister von Amts wegen nach § 31 Abs. 2 HGB zu löschen. Die Frist zur Geltendmachung eines Widerspruchs gegen die beabsichtigte Löschung ist auf einen Monat ab Veröffentlichung bestimmt."
    },
    {
      "date": "2025-03-10",
      "id": "103258",
      "original_text": "Löschungsankündigung\nSchleswig-Holstein Amtsgericht Lübeck HRB 13229\nFITAL GmbH – Fehmarn",
      "type": "Löschungsankündigung",
      "state": "Schleswig-Holstein",
      "amtsgericht": "Amtsgericht Lübeck",
      "registernummer": "HRB 13229",
      "registerart": "HRB",
      "company_name": "FITAL GmbH",
      "company_seat": "Fehmarn",
      "details": "10.03.2025 (Bekanntmachungsdatum)\n\nSchleswig-Holstein Amtsgericht Lübeck HRB 13229\nLöschungsankündigung\n\nFITAL GmbH\nGesellschaft mit beschränkter Haftung\nFehmarn\n\nEs ist die Löschung der nachstehenden Gesellschaft wegen Vermögenslosigkeit gemäß § 394 FamFG beabsichtigt. Widerspruchsfrist: 1 Monat"
    },
    {
      "date": "2025-03-10",
      "id": "103259",
      "original_text": "Löschungsankündigung\nSaarland Amtsgericht Saarbrücken HRB 104983\nOJO Gastro GmbH – Illingen",
      "type": "Löschungsankündigung",
      "state": "Saarland",
      "amtsgericht": "Amtsgericht Saarbrücken",
      "registernummer": "HRB 104983",
      "registerart": "HRB",
      "company_name": "OJO Gastro GmbH",
      "company_seat": "Illingen",
      "details": "10.03.2025 (Bekanntmachungsdatum)\n\nSaarland Amtsgericht Saarbrücken HRB 104983\nLöschungsankündigung\n\nOJO Gastro GmbH\nGesellschaft mit beschränkter Haftung\nIllingen\n\nEs ist beabsichtigt, die Gesellschaft von Amts wegen gemäß § 394 FamFG wegen Vermögenslosigkeit zu löschen.\nGegen die Löschung von Amts wegen ist das Rechtsmittel des Widerspruchs statthaft. Der Widerspruch ist binnen einer Frist zwei Monaten beginnend mit dem Tag dieser Veröffentlichung durch Einreichen eines Widerspruchsschreibens -schriftlich oder zur Niederschrift der Geschäftsstelle beim Amtsgericht Saarbrücken, -zentrales Handelsregister-, Mainzerstr.178, 66121 Saarbrücken einzulegen.\nDer Widerspruch muss die Bezeichnung der angefochtenen Löschungsankündigung enthalten sowie die Erklärung, dass Widerspruch eingelegt wird. Er ist vom Widerspruchsführer oder seinem Bevollmächtigten zu unterzeichnen.\nDas Widerspruchsschreiben kann auch in der Form eines elektronischen Dokumentes eingereicht werden, das mit einer qualifizierten elektronischen Signatur nach dem Signaturgesetz versehen sein muss (§§ 14 Abs. 2 FamFG, 130a, 298 ZPO)."
    },
    {
      "date": "2025-03-10",
      "id": "103260",
      "original_text": "Registerbekanntmachung nach dem Umwandlungsgesetz\nBaden-Württemberg Amtsgericht Stuttgart HRA 741924\nobjektfabrik Joachim Tuchel e.K. – Ludwigsburg",
      "type": "Registerbekanntmachung nach dem Umwandlungsgesetz",
      "state": "Baden-Württemberg",
      "amtsgericht": "Amtsgericht Stuttgart",
      "registernummer": "HRA 741924",
      "registerart": "HRA",
      "company_name": "objektfabrik Joachim Tuchel e.K.",
      "company_seat": "Ludwigsburg",
      "details": "10.03.2025 (Bekanntmachungsdatum)\n\nBaden-Württemberg Amtsgericht Stuttgart HRA 741924\nRegisterbekanntmachung nach dem Umwandlungsgesetz 10.03.2025 (Eintragungsdatum)\n\nobjektfabrik Joachim Tuchel e.K.\nEinzelkaufmann / Einzelkauffrau\nLudwigsburg\n\nAls nicht eingetragen wird bekanntgemacht:\nDen Gläubigern der an der Ausgliederung beteiligten Rechtsträger ist, wenn sie binnen sechs Monaten nach dem Tag, an dem die Eintragung der Ausgliederung in das Register des Sitzes desjenigen Rechtsträgers, dessen Gläubiger sie sind, nach § 19 Abs. 3 UmwG als bekanntgemacht gilt, ihren Anspruch nach Grund und Höhe schriftlich anmelden, Sicherheit zu leisten, soweit sie nicht Befriedigung verlangen können. Dieses Recht steht den Gläubigern jedoch nur zu, wenn sie glaubhaft machen, dass durch die Ausgliederung die Erfüllung ihrer Forderung gefährdet wird."
    },
    {
      "date": "2025-03-10",
      "id": "103261",
      "original_text": "Löschungsankündigung\nSaarland Amtsgericht Saarbrücken HRB 103560\nBK-Solution UG (haftungsbeschränkt) – Schiffweiler",
      "type": "Löschungsankündigung",
      "state": "Saarland",
      "amtsgericht": "Amtsgericht Saarbrücken",
      "registernummer": "HRB 103560",
      "registerart": "HRB",
      "company_name": "BK-Solution UG (haftungsbeschränkt)",
      "company_seat": "Schiffweiler",
      "details": "10.03.2025 (Bekanntmachungsdatum)\n\nSaarland Amtsgericht Saarbrücken HRB 103560\nLöschungsankündigung\n\nBK-Solution UG (haftungsbeschränkt)\nGesellschaft mit beschränkter Haftung\nSchiffweiler\n\nEs ist beabsichtigt, die Gesellschaft von Amts wegen gemäß § 394 FamFG wegen Vermögenslosigkeit zu löschen.\nGegen die Löschung von Amts wegen ist das Rechtsmittel des Widerspruchs statthaft. Der Widerspruch ist binnen einer Frist von 2 Monaten beginnend mit dem Tag dieser Veröffentlichung durch Einreichen eines Widerspruchsschreibens -schriftlich oder zur Niederschrift der Geschäftsstelle beim Amtsgericht Saarbrücken, -zentrales Handelsregister-, Mainzerstr.178, 66121 Saarbrücken einzulegen.\nDer Widerspruch muss die Bezeichnung der angefochtenen Löschungsankündigung enthalten sowie die Erklärung, dass Widerspruch eingelegt wird. Er ist vom Widerspruchsführer oder seinem Bevollmächtigten zu unterzeichnen.\nDas Widerspruchsschreiben kann auch in der Form eines elektronischen Dokumentes eingereicht werden, das mit einer qualifizierten elektronischen Signatur nach dem Signaturgesetz versehen sein muss (§§ 14 Abs. 2 FamFG, 130a, 298 ZPO)."
    },
    {
      "date": "2025-03-10",
      "id": "103262",
      "original_text": "Registerbekanntmachung nach dem Umwandlungsgesetz\nSaarland Amtsgericht Saarbrücken HRB 33057\nHoffmann GmbH Personaldienstleistung – St.Ingbert",
      "type": "Registerbekanntmachung nach dem Umwandlungsgesetz",
      "state": "Saarland",
      "amtsgericht": "Amtsgericht Saarbrücken",
      "registernummer": "HRB 33057",
      "registerart": "HRB",
      "company_name": "Hoffmann GmbH Personaldienstleistung",
      "company_seat": "St.Ingbert",
      "details": "10.03.2025 (Bekanntmachungsdatum)\n\nSaarland Amtsgericht Saarbrücken HRB 33057\nRegisterbekanntmachung nach dem Umwandlungsgesetz 10.03.2025 (Eintragungsdatum)\n\nHoffmann GmbH Personaldienstleistung\nGesellschaft mit beschränkter Haftung\nSt.Ingbert\n\nAls nicht eingetragen wird bekannt gemacht: Den Gläubigern der an der Verschmelzung beteiligten Gesellschaften ist, wenn sie binnen sechs Monaten nach dem Tag, an dem die Eintragung der Verschmelzung in das Register des Sitzes desjenigen Rechtsträgers, dessen Gläubiger sie sind, nach § 19 Absatz 3 UmwG bekannt gemacht worden ist, ihren Anspruch nach Grund und Höhe schriftlich anmelden, Sicherheit zu leisten, soweit sie nicht Befriedigung verlangen können. Dieses Recht steht den Gläubigern jedoch nur zu, wenn sie glaubhaft machen, dass durch die Verschmelzung die Erfüllung ihrer Forderung gefährdet wird."
    },
    {
      "date": "2025-03-10",
      "id": "103263",
      "original_text": "Registerbekanntmachung nach dem Umwandlungsgesetz\nSchleswig-Holstein Amtsgericht Kiel HRA 12576\nRixen GmbH & Co. KG – Kiel",
      "type": "Registerbekanntmachung nach dem Umwandlungsgesetz",
      "state": "Schleswig-Holstein",
      "amtsgericht": "Amtsgericht Kiel",
      "registernummer": "HRA 12576",
      "registerart": "HRA",
      "company_name": "Rixen GmbH & Co. KG",
      "company_seat": "Kiel",
      "details": "10.03.2025 (Bekanntmachungsdatum)\n\nSchleswig-Holstein Amtsgericht Kiel HRA 12576\nRegisterbekanntmachung nach dem Umwandlungsgesetz 07.03.2025 (Eintragungsdatum)\n\nRixen GmbH & Co. KG\nKommanditgesellschaft\nKiel\n\nZu Eintragungsnummer 2 vom 07.03.2025 wird als nicht eingetragen veröffentlicht: Den Gläubigern der an der Spaltung beteiligten Rechtsträger ist, wenn sie binnen sechs Monaten nach dem Tag, an dem die Eintragung der Spaltung in das Register des Sitzes desjenigen Rechtsträgers, dessen Gläubiger sie sind,  bekannt gemacht worden ist, ihren Anspruch nach Grund und Höhe schriftlich anmelden, Sicherheit zu leisten, soweit sie nicht Befriedigung verlangen können. Dieses Recht steht den Gläubigern jedoch nur zu, wenn sie glaubhaft machen, dass durch die Spaltung die Erfüllung ihrer Forderung gefährdet wird."
    },
    {
      "date": "2025-03-10",
      "id": "103264",
      "original_text": "Registerbekanntmachung nach dem Umwandlungsgesetz\nSchleswig-Holstein Amtsgericht Lübeck HRB 22525\nZK Eulenstraße 56 GmbH – Oststeinbek",
      "type": "Registerbekanntmachung nach dem Umwandlungsgesetz",
      "state": "Schleswig-Holstein",
      "amtsgericht": "Amtsgericht Lübeck",
      "registernummer": "HRB 22525",
      "registerart": "HRB",
      "company_name": "ZK Eulenstraße 56 GmbH",
      "company_seat": "Oststeinbek",
      "details": "10.03.2025 (Bekanntmachungsdatum)\n\nSchleswig-Holstein Amtsgericht Lübeck HRB 22525\nRegisterbekanntmachung nach dem Umwandlungsgesetz 06.03.2025 (Eintragungsdatum)\n\nZK Eulenstraße 56 GmbH\nGesellschaft mit beschränkter Haftung\nOststeinbek\n\nZu Eintragungsnummer 2 vom 06.03.2025 wird als nicht eingetragen veröffentlicht:\nAls nicht eingetragen wird veröffentlicht: Den Gläubigern der an der Verschmelzung beteiligten Rechtsträger ist, wenn sie binnen sechs Monaten nach dem Tag, an dem die Eintragung der Verschmelzung in das Register des Sitzes desjenigen Rechtsträgers, dessen Gläubiger sie sind, als bekannt gemacht gilt, ihren Anspruch nach Grund und Höhe schriftlich anmelden, Sicherheit zu leisten, soweit sie nicht Befriedigung verlangen können. Dieses Recht steht den Gläubigern jedoch nur zu, wenn sie glaubhaft machen, dass durch die Verschmelzung die Erfüllung ihrer Forderung gefährdet wird."
    },
    {
      "date": "2025-03-10",
      "id": "103265",
      "original_text": "Einreichung neuer Dokumente\nThüringen Amtsgericht Jena HRB 201296\nCarl Zeiss Jena GmbH – Jena",
      "type": "Einreichung neuer Dokumente",
      "state": "Thüringen",
      "amtsgericht": "Amtsgericht Jena",
      "registernummer": "HRB 201296",
      "registerart": "HRB",
      "company_name": "Carl Zeiss Jena GmbH",
      "company_seat": "Jena",
      "details": "10.03.2025 (Bekanntmachungsdatum)\n\nThüringen Amtsgericht Jena HRB 201296\nEinreichung neuer Dokumente 10.03.2025 (Eintragungsdatum)\n\nCarl Zeiss Jena GmbH\nGesellschaft mit beschränkter Haftung\nJena\n\nBekanntmachung gem. § 52 Abs. 3 Satz 2 GmbHG: Aufgrund einer Veränderung in den Personen der Aufsichtsratsmitglieder ist durch die Geschäftsführer eine neue Liste zum Handelsregister eingereicht worden."
    },
    {
      "date": "2025-03-10",
      "id": "103266",
      "original_text": "Registerbekanntmachung nach dem Umwandlungsgesetz\nSachsen-Anhalt Amtsgericht Stendal HRB 112057\nBÖRDE Agrar-Betreuungs GmbH – Magdeburg",
      "type": "Registerbekanntmachung nach dem Umwandlungsgesetz",
      "state": "Sachsen-Anhalt",
      "amtsgericht": "Amtsgericht Stendal",
      "registernummer": "HRB 112057",
      "registerart": "HRB",
      "company_name": "BÖRDE Agrar-Betreuungs GmbH",
      "company_seat": "Magdeburg",
      "details": "10.03.2025 (Bekanntmachungsdatum)\n\nSachsen-Anhalt Amtsgericht Stendal HRB 112057\nRegisterbekanntmachung nach dem Umwandlungsgesetz 10.03.2025 (Eintragungsdatum)\n\nBÖRDE Agrar-Betreuungs GmbH\nGesellschaft mit beschränkter Haftung\nMagdeburg\n\nDie Gesellschaft ist auf Grund des Verschmelzungsvertrages vom 06.02.2025 sowie des Beschlusses der Gesellschafterversammlung vom selben Tag mit dem Vermögen des Alleingesellschafters Kossak Olaf, Magdeburg, *26.05.1967, verschmolzen. Nicht eingetragen:\nDen Gläubigern der an der Verschmelzung beteiligten Rechtsträger ist, wenn sie binnen sechs Monaten nach dem Tag, an dem die Eintragung der Verschmelzung nach § 19 Abs. 3 UmwG als bekanntgemacht gilt, ihren Anspruch nach Grund und Höhe schriftlich anmelden, Sicherheit zu leisten, soweit sie nicht Befriedigung verlangen können. Dieses Recht steht ihnen jedoch nur zu, wenn sie glaubhaft machen, dass durch die Verschmelzung die Erfüllung ihrer Forderung gefährdet wird."
    },
    {
      "date": "2025-03-10",
      "id": "103267",
      "original_text": "Registerbekanntmachung nach dem Umwandlungsgesetz\nBaden-Württemberg Amtsgericht Stuttgart HRB 570105\nBausparkasse Schwäbisch Hall Aktiengesellschaft - Bausparkasse der Volksbanken und Raiffeisenbanken - – Schwäbisch Hall",
      "type": "Registerbekanntmachung nach dem Umwandlungsgesetz",
      "state": "Baden-Württemberg",
      "amtsgericht": "Amtsgericht Stuttgart",
      "registernummer": "HRB 570105",
      "registerart": "HRB",
      "company_name": "Bausparkasse Schwäbisch Hall Aktiengesellschaft - Bausparkasse der Volksbanken und Raiffeisenbanken -",
      "company_seat": "Schwäbisch Hall",
      "details": "10.03.2025 (Bekanntmachungsdatum)\n\nBaden-Württemberg Amtsgericht Stuttgart HRB 570105\nRegisterbekanntmachung nach dem Umwandlungsgesetz\n\nBausparkasse Schwäbisch Hall Aktiengesellschaft - Bausparkasse der Volksbanken und Raiffeisenbanken -\nAktiengesellschaft\nSchwäbisch Hall\n\nDie Gesellschaft hat am 07.03.2025 den Verschmelzungsvertrag vom 25.02.2025 zwischen \"Schwäbisch Hall Transformation GmbH\", Schwäbisch Hall (Amtsgericht Amtsgericht Stuttgart HRB 571052)\nund der hiesigen Gesellschaft (übernehmender Rechtsträger) zum Handelsregister eingereicht."
    },
    {
      "date": "2025-03-10",
      "id": "103268",
      "original_text": "Registerbekanntmachung nach dem Umwandlungsgesetz\nMecklenburg-Vorpommern Amtsgericht Neubrandenburg HRB 6227\nSHB Büro-, Grundstücks- & Gebäudeservice GmbH Service Hilfe Betreuung – Burg Stargard",
      "type": "Registerbekanntmachung nach dem Umwandlungsgesetz",
      "state": "Mecklenburg-Vorpommern",
      "amtsgericht": "Amtsgericht Neubrandenburg",
      "registernummer": "HRB 6227",
      "registerart": "HRB",
      "company_name": "SHB Büro-, Grundstücks- & Gebäudeservice GmbH Service Hilfe Betreuung",
      "company_seat": "Burg Stargard",
      "details": "10.03.2025 (Bekanntmachungsdatum)\n\nMecklenburg-Vorpommern Amtsgericht Neubrandenburg HRB 6227\nRegisterbekanntmachung nach dem Umwandlungsgesetz 10.03.2025 (Eintragungsdatum)\n\nSHB Büro-, Grundstücks- & Gebäudeservice GmbH Service Hilfe Betreuung\nGesellschaft mit beschränkter Haftung\nBurg Stargard\n\nDen Gläubigern der an der grenzüberschreitenden Verschmelzung beteiligten übernehmenden Rechtsträger ist, wenn sie binnen sechs Monaten nach dem Tag, an dem die Eintragung der Verschmelzung in das Register des Sitzes desjenigen Rechtsträgers, dessen Gläubiger sie sind, nach § 19 Absatz 3 UmwG als bekanntgemacht gilt, ihren Anspruch nach Grund und Höhe in Textform anmelden, Sicherheit zu leisten, soweit sie nicht Befriedigung verlangen können.\n\nDieses Recht steht den Gläubigern jedoch nur zu, wenn sie glaubhaft machen, dass durch die Verschmelzung die Erfüllung ihrer Forderung gefährdet wird."
    },
    {
      "date": "2025-03-10",
      "id": "103269",
      "original_text": "Registerbekanntmachung nach dem Umwandlungsgesetz\nMecklenburg-Vorpommern Amtsgericht Neubrandenburg HRB 2469\nSTEEN Glas- und Gebäudereinigung GmbH – Burg Stargard",
      "type": "Registerbekanntmachung nach dem Umwandlungsgesetz",
      "state": "Mecklenburg-Vorpommern",
      "amtsgericht": "Amtsgericht Neubrandenburg",
      "registernummer": "HRB 2469",
      "registerart": "HRB",
      "company_name": "STEEN Glas- und Gebäudereinigung GmbH",
      "company_seat": "Burg Stargard",
      "details": "10.03.2025 (Bekanntmachungsdatum)\n\nMecklenburg-Vorpommern Amtsgericht Neubrandenburg HRB 2469\nRegisterbekanntmachung nach dem Umwandlungsgesetz 10.03.2025 (Eintragungsdatum)\n\nSTEEN Glas- und Gebäudereinigung GmbH\nGesellschaft mit beschränkter Haftung\nBurg Stargard\n\nDen Gläubigern der an der grenzüberschreitenden Verschmelzung beteiligten übernehmenden Rechtsträger ist, wenn sie binnen sechs Monaten nach dem Tag, an dem die Eintragung der Verschmelzung in das Register des Sitzes desjenigen Rechtsträgers, dessen Gläubiger sie sind, nach § 19 Absatz 3 UmwG als bekanntgemacht gilt, ihren Anspruch nach Grund und Höhe in Textform anmelden, Sicherheit zu leisten, soweit sie nicht Befriedigung verlangen können.\n\nDieses Recht steht den Gläubigern jedoch nur zu, wenn sie glaubhaft machen, dass durch die Verschmelzung die Erfüllung ihrer Forderung gefährdet wird."
    },
    {
      "date": "2025-03-10",
      "id": "103270",
      "original_text": "Löschungsankündigung\nNordrhein-Westfalen Amtsgericht Coesfeld HRB 17479\nGlobel Ventilation UG (haftungsbeschränkt) – Gronau",
      "type": "Löschungsankündigung",
      "state": "Nordrhein-Westfalen",
      "amtsgericht": "Amtsgericht Coesfeld",
      "registernummer": "HRB 17479",
      "registerart": "HRB",
      "company_name": "Globel Ventilation UG (haftungsbeschränkt)",
      "company_seat": "Gronau",
      "details": "10.03.2025 (Bekanntmachungsdatum)\n\nNordrhein-Westfalen Amtsgericht Coesfeld HRB 17479\nLöschungsankündigung\n\nGlobel Ventilation UG (haftungsbeschränkt)\nGesellschaft mit beschränkter Haftung\nGronau\n\nDas Registergericht beabsichtigt, den Rechtsträger wegen Vermögenslosigkeit gemäß § 394 FamFG von Amts wegen zu löschen.\n\nGegen diese Verfügung kann Widerspruch eingelegt werden. Die Frist zur Erhebung eines Widerspruchs gegen die beabsichtigte Löschung ist auf zwei Monate ab Veröffentlichung festgesetzt."
    },
    {
      "date": "2025-03-10",
      "id": "103271",
      "original_text": "Registerbekanntmachung nach dem Umwandlungsgesetz\nBrandenburg Amtsgericht Cottbus HRB 16749\nGierkezeile 17 Projekt GmbH – Schönefeld",
      "type": "Registerbekanntmachung nach dem Umwandlungsgesetz",
      "state": "Brandenburg",
      "amtsgericht": "Amtsgericht Cottbus",
      "registernummer": "HRB 16749",
      "registerart": "HRB",
      "company_name": "Gierkezeile 17 Projekt GmbH",
      "company_seat": "Schönefeld",
      "details": "10.03.2025 (Bekanntmachungsdatum)\n\nBrandenburg Amtsgericht Cottbus HRB 16749\nRegisterbekanntmachung nach dem Umwandlungsgesetz 10.03.2025 (Eintragungsdatum)\n\nGierkezeile 17 Projekt GmbH\nGesellschaft mit beschränkter Haftung\nSchönefeld\n\nDen Gläubigern der an der Verschmelzung beteiligten Rechtsträger ist, wenn sie binnen sechs Monaten nach dem Tag, an dem die Eintragung der Verschmelzung in das Register des Sitzes desjenigen Rechtsträgers, dessen Gläubiger sie sind, als bekannt gemacht gilt, ihren Anspruch nach Grund und Höhe schriftlich anmelden, Sicherheit zu leisten, soweit sie nicht Befriedigung verlangen können. Dieses Recht steht den Gläubigern jedoch nur zu, wenn sie glaubhaft machen, dass durch die Verschmelzung die Erfüllung ihrer Forderung gefährdet wird."
    },
    {
      "date": "2025-03-10",
      "id": "103272",
      "original_text": "Registerbekanntmachung nach dem Umwandlungsgesetz\nBaden-Württemberg Amtsgericht Stuttgart HRB 797865\nInovance Technology Deutschland GmbH – Pleidelsheim",
      "type": "Registerbekanntmachung nach dem Umwandlungsgesetz",
      "state": "Baden-Württemberg",
      "amtsgericht": "Amtsgericht Stuttgart",
      "registernummer": "HRB 797865",
      "registerart": "HRB",
      "company_name": "Inovance Technology Deutschland GmbH",
      "company_seat": "Pleidelsheim",
      "details": "10.03.2025 (Bekanntmachungsdatum)\n\nBaden-Württemberg Amtsgericht Stuttgart HRB 797865\nRegisterbekanntmachung nach dem Umwandlungsgesetz 10.03.2025 (Eintragungsdatum)\n\nInovance Technology Deutschland GmbH\nGesellschaft mit beschränkter Haftung\nPleidelsheim\n\nAls nicht eingetragen wird bekanntgemacht:\nDen Gläubigern der an der Abspaltung beteiligten Rechtsträger ist, wenn sie binnen sechs Monaten nach dem Tag, an dem die Eintragung der Abspaltung in das Register des Sitzes desjenigen Rechtsträgers, dessen Gläubiger sie sind, nach § 19 Abs. 3 UmwG als bekanntgemacht gilt, ihren Anspruch nach Grund und Höhe schriftlich anmelden, Sicherheit zu leisten, soweit sie nicht Befriedigung verlangen können. Dieses Recht steht den Gläubigern jedoch nur zu, wenn sie glaubhaft machen, dass durch die Abspaltung die Erfüllung ihrer Forderung gefährdet wird."
    },
    {
      "date": "2025-03-10",
      "id": "103273",
      "original_text": "Einreichung neuer Dokumente\nBaden-Württemberg Amtsgericht Stuttgart HRB 20215\nTourismus Marketing GmbH Baden-Württemberg – Stuttgart",
      "type": "Einreichung neuer Dokumente",
      "state": "Baden-Württemberg",
      "amtsgericht": "Amtsgericht Stuttgart",
      "registernummer": "HRB 20215",
      "registerart": "HRB",
      "company_name": "Tourismus Marketing GmbH Baden-Württemberg",
      "company_seat": "Stuttgart",
      "details": "10.03.2025 (Bekanntmachungsdatum)\n\nBaden-Württemberg Amtsgericht Stuttgart HRB 20215\nEinreichung neuer Dokumente\n\nTourismus Marketing GmbH Baden-Württemberg\nGesellschaft mit beschränkter Haftung\nStuttgart\n\nDie Gesellschaft hat am 06.03.2025 die Liste über die Zusammensetzung des Aufsichtsrats zum Handelsregister eingereicht."
    },
    {
      "date": "2025-03-10",
      "id": "103274",
      "original_text": "Löschungsankündigung\nBaden-Württemberg Amtsgericht Freiburg HRB 722211\nATW Holding GmbH – Gottmadingen",
      "type": "Löschungsankündigung",
      "state": "Baden-Württemberg",
      "amtsgericht": "Amtsgericht Freiburg",
      "registernummer": "HRB 722211",
      "registerart": "HRB",
      "company_name": "ATW Holding GmbH",
      "company_seat": "Gottmadingen",
      "details": "10.03.2025 (Bekanntmachungsdatum)\n\nBaden-Württemberg Amtsgericht Freiburg HRB 722211\nLöschungsankündigung 10.03.2025 (Eintragungsdatum)\n\nATW Holding GmbH\nGesellschaft mit beschränkter Haftung\nGottmadingen\n\nAls nicht eingetragen wird bekanntgemacht:\nDas Gericht beabsichtigt, die Gesellschaft wegen Vermögenslosigkeit im Handelsregister von Amts wegen nach § 394 FamFG zu löschen. Die Frist zur Geltendmachung eines Widerspruchs gegen die beabsichtigte Löschung ist auf einen Monat ab Veröffentlichung bestimmt."
    },
    {
      "date": "2025-03-10",
      "id": "103275",
      "original_text": "Registerbekanntmachung nach dem Umwandlungsgesetz\nBerlin Amtsgericht Berlin (Charlottenburg) PR 681\nDGS Ingenieurgesellschaft für Projektmanagement Sonnenburg - Gözalan Part mbB – Berlin",
      "type": "Registerbekanntmachung nach dem Umwandlungsgesetz",
      "state": "Berlin",
      "amtsgericht": "Amtsgericht Berlin (Charlottenburg)",
      "registernummer": "PR 681",
      "registerart": "PR",
      "company_name": "DGS Ingenieurgesellschaft für Projektmanagement Sonnenburg - Gözalan Part mbB",
      "company_seat": "Berlin",
      "details": "10.03.2025 (Bekanntmachungsdatum)\n\nBerlin Amtsgericht Berlin (Charlottenburg) PR 681\nRegisterbekanntmachung nach dem Umwandlungsgesetz 07.03.2025 (Eintragungsdatum)\n\nDGS Ingenieurgesellschaft für Projektmanagement Sonnenburg - Gözalan Part mbB\nPartnerschaftsgesellschaft\nBerlin\n\nZu Eintragungsnummer 4 vom 07.03.2025 wird als nicht eingetragen veröffentlicht: Den Gläubigern ist, wenn sie binnen sechs Monaten nach dem Tag, an dem die Eintragung der Umwandlung als bekannt gemacht gilt, ihren Anspruch nach Grund und Höhe schriftlich anmelden, Sicherheit zu leisten, soweit sie nicht Befriedigung verlangen können. Dieses Recht steht den Gläubigern jedoch nur zu, wenn sie glaubhaft machen, dass durch die Umwandlung die Erfüllung ihrer Forderung gefährdet wird. Das Recht, Sicherheitsleistung zu verlangen, steht Gläubigern nicht zu, die im Falle der Insolvenz ein Recht auf vorzugsweise Befriedigung aus einer Deckungsmasse haben, die nach gesetzlicher Vorschrift zu ihrem Schutz errichtet und staatlich überwacht ist."
    },
    {
      "date": "2025-03-10",
      "id": "103276",
      "original_text": "Registerbekanntmachung nach dem Umwandlungsgesetz\nBrandenburg Amtsgericht Cottbus HRB 16742\nImmoPUNKT Berlin GmbH – Schönefeld",
      "type": "Registerbekanntmachung nach dem Umwandlungsgesetz",
      "state": "Brandenburg",
      "amtsgericht": "Amtsgericht Cottbus",
      "registernummer": "HRB 16742",
      "registerart": "HRB",
      "company_name": "ImmoPUNKT Berlin GmbH",
      "company_seat": "Schönefeld",
      "details": "10.03.2025 (Bekanntmachungsdatum)\n\nBrandenburg Amtsgericht Cottbus HRB 16742\nRegisterbekanntmachung nach dem Umwandlungsgesetz 10.03.2025 (Eintragungsdatum)\n\nImmoPUNKT Berlin GmbH\nGesellschaft mit beschränkter Haftung\nSchönefeld\n\nZu Eintragungsnummer 3 vom 10.03.2025 wird als nicht eingetragen veröffentlicht:\nAls nicht eingetragen wird veröffentlicht:\nDen Gläubigern der an der Verschmelzung beteiligten Rechtsträger ist, wenn sie binnen sechs Monaten nach dem Tag, an dem die Eintragung der Verschmelzung in das Register des Sitzes desjenigen Rechtsträgers, dessen Gläubiger sie sind, als bekannt gemacht gilt, ihren Anspruch nach Grund und Höhe schriftlich anmelden, Sicherheit zu leisten, soweit sie nicht Befriedigung verlangen können. Dieses Recht steht den Gläubigern jedoch nur zu, wenn sie glaubhaft machen, dass durch die Verschmelzung die Erfüllung ihrer Forderung gefährdet wird"
    },
    {
      "date": "2025-03-10",
      "id": "103277",
      "original_text": "Sonstige Registerbekanntmachung\nBerlin Amtsgericht Berlin (Charlottenburg) HRB 190577\nPandox Dexter Cologne PropCo GmbH – Berlin",
      "type": "Sonstige Registerbekanntmachung",
      "state": "Berlin",
      "amtsgericht": "Amtsgericht Berlin (Charlottenburg)",
      "registernummer": "HRB 190577",
      "registerart": "HRB",
      "company_name": "Pandox Dexter Cologne PropCo GmbH",
      "company_seat": "Berlin",
      "details": "10.03.2025 (Bekanntmachungsdatum)\n\nBerlin Amtsgericht Berlin (Charlottenburg) HRB 190577\nSonstige Registerbekanntmachung 10.03.2025 (Eintragungsdatum)\n\nPandox Dexter Cologne PropCo GmbH\nGesellschaft mit beschränkter Haftung\nBerlin\n\nAls nicht eingetragen wird veröffentlicht: Der andere Vertragsteil hat den Gläubigern dieses Rechtsträgers, deren Forderungen begründet worden sind, bevor die Eintragung der Beendigung dieses Vertrages in das Handelsregister nach § 10 des Handelsgesetzbuches als bekannt gemacht gilt, Sicherheit zu leisten, wenn sie sich binnen sechs Monaten nach der Bekanntmachung der Eintragung zu diesem Zweck bei ihm melden. Dieses Recht steht den Gläubigern nicht zu, die im Fall des Insolvenzverfahrens ein Recht auf vorzugsweise Befriedigung aus der Deckungsmasse haben, die nach gesetzlicher Vorschrift zu ihrem Schutz errichtet und staatlich überwacht ist."
    },
    {
      "date": "2025-03-10",
      "id": "103278",
      "original_text": "Registerbekanntmachung nach dem Umwandlungsgesetz\nSchleswig-Holstein Amtsgericht Lübeck HRB 14524\nKOS Wulff Fusion GmbH – Beschendorf",
      "type": "Registerbekanntmachung nach dem Umwandlungsgesetz",
      "state": "Schleswig-Holstein",
      "amtsgericht": "Amtsgericht Lübeck",
      "registernummer": "HRB 14524",
      "registerart": "HRB",
      "company_name": "KOS Wulff Fusion GmbH",
      "company_seat": "Beschendorf",
      "details": "10.03.2025 (Bekanntmachungsdatum)\n\nSchleswig-Holstein Amtsgericht Lübeck HRB 14524\nRegisterbekanntmachung nach dem Umwandlungsgesetz 10.03.2025 (Eintragungsdatum)\n\nKOS Wulff Fusion GmbH\nGesellschaft mit beschränkter Haftung\nBeschendorf\n\nZu Eintragungsnummer 7 vom 10.03.2025 wird als nicht eingetragen veröffentlicht: Den Gläubigern der an der Verschmelzung beteiligten Rechtsträger ist, wenn sie binnen sechs Monaten nach dem Tag, an dem die Eintragung der Verschmelzung in das Register des Sitzes desjenigen Rechtsträgers, dessen Gläubiger sie sind, als bekannt gemacht gilt, ihren Anspruch nach Grund und Höhe schriftlich anmelden, Sicherheit zu leisten, soweit sie nicht Befriedigung verlangen können. Dieses Recht steht den Gläubigern jedoch nur zu, wenn sie glaubhaft machen, dass durch die Verschmelzung die Erfüllung ihrer Forderung gefährdet wird."
    },
    {
      "date": "2025-03-10",
      "id": "103279",
      "original_text": "Registerbekanntmachung nach dem Umwandlungsgesetz\nBaden-Württemberg Amtsgericht Stuttgart HRB 798847\nobjektfabrik GmbH – Ludwigsburg",
      "type": "Registerbekanntmachung nach dem Umwandlungsgesetz",
      "state": "Baden-Württemberg",
      "amtsgericht": "Amtsgericht Stuttgart",
      "registernummer": "HRB 798847",
      "registerart": "HRB",
      "company_name": "objektfabrik GmbH",
      "company_seat": "Ludwigsburg",
      "details": "10.03.2025 (Bekanntmachungsdatum)\n\nBaden-Württemberg Amtsgericht Stuttgart HRB 798847\nRegisterbekanntmachung nach dem Umwandlungsgesetz 10.03.2025 (Eintragungsdatum)\n\nobjektfabrik GmbH\nGesellschaft mit beschränkter Haftung\nLudwigsburg\n\nAls nicht eingetragen wird bekanntgemacht:\nDen Gläubigern der an der Ausgliederung beteiligten Rechtsträger ist, wenn sie binnen sechs Monaten nach dem Tag, an dem die Eintragung der Ausgliederung in das Register des Sitzes desjenigen Rechtsträgers, dessen Gläubiger sie sind, nach § 19 Abs. 3 UmwG als bekanntgemacht gilt, ihren Anspruch nach Grund und Höhe schriftlich anmelden, Sicherheit zu leisten, soweit sie nicht Befriedigung verlangen können. Dieses Recht steht den Gläubigern jedoch nur zu, wenn sie glaubhaft machen, dass durch die Ausgliederung die Erfüllung ihrer Forderung gefährdet wird."
    },
    {
      "date": "2025-03-10",
      "id": "103280",
      "original_text": "Registerbekanntmachung nach dem Umwandlungsgesetz\nHamburg Amtsgericht Hamburg HRB 101025\nJoJo Beteiligungs- und Verwaltungs GmbH – Hamburg",
      "type": "Registerbekanntmachung nach dem Umwandlungsgesetz",
      "state": "Hamburg",
      "amtsgericht": "Amtsgericht Hamburg",
      "registernummer": "HRB 101025",
      "registerart": "HRB",
      "company_name": "JoJo Beteiligungs- und Verwaltungs GmbH",
      "company_seat": "Hamburg",
      "details": "10.03.2025 (Bekanntmachungsdatum)\n\nHamburg Amtsgericht Hamburg HRB 101025\nRegisterbekanntmachung nach dem Umwandlungsgesetz 10.03.2025 (Eintragungsdatum)\n\nJoJo Beteiligungs- und Verwaltungs GmbH\nGesellschaft mit beschränkter Haftung\nHamburg\n\nAls nicht eingetragen wird bekannt gemacht:\nDen Gläubigern der an der Verschmelzung beteiligten Gesellschaften ist, wenn sie binnen sechs Monaten nach dem Tag, an dem die Eintragung der Verschmelzung in das Register des Sitzes desjenigen Rechtsträgers, dessen Gläubiger sie sind, nach § 19 Absatz 3 UmwG als bekannt gemacht gilt, ihren Anspruch nach Grund und Höhe schriftlich anmelden, Sicherheit zu leisten, soweit sie nicht Befriedigung verlangen können. Dieses Recht steht den Gläubigern jedoch nur zu, wenn sie glaubhaft machen, dass durch die Verschmelzung die Erfüllung ihrer Forderung gefährdet wird."
    },
    {
      "date": "2025-03-10",
      "id": "103281",
      "original_text": "Registerbekanntmachung nach dem Umwandlungsgesetz\nHamburg Amtsgericht Hamburg HRA 100311\nJoJo Beteiligungs oHG – Hamburg",
      "type": "Registerbekanntmachung nach dem Umwandlungsgesetz",
      "state": "Hamburg",
      "amtsgericht": "Amtsgericht Hamburg",
      "registernummer": "HRA 100311",
      "registerart": "HRA",
      "company_name": "JoJo Beteiligungs oHG",
      "company_seat": "Hamburg",
      "details": "10.03.2025 (Bekanntmachungsdatum)\n\nHamburg Amtsgericht Hamburg HRA 100311\nRegisterbekanntmachung nach dem Umwandlungsgesetz 10.03.2025 (Eintragungsdatum)\n\nJoJo Beteiligungs oHG\nKommanditgesellschaft\nHamburg\n\nAls nicht eingetragen wird bekannt gemacht:\nDen Gläubigern der an der Verschmelzung beteiligten Gesellschaften ist, wenn sie binnen sechs Monaten nach dem Tag, an dem die Eintragung der Verschmelzung in das Register des Sitzes desjenigen Rechtsträgers, dessen Gläubiger sie sind, nach § 19 Absatz 3 UmwG als bekannt gemacht gilt, ihren Anspruch nach Grund und Höhe schriftlich anmelden, Sicherheit zu leisten, soweit sie nicht Befriedigung verlangen können. Dieses Recht steht den Gläubigern jedoch nur zu, wenn sie glaubhaft machen, dass durch die Verschmelzung die Erfüllung ihrer Forderung gefährdet wird."
    },
    {
      "date": "2025-03-10",
      "id": "103282",
      "original_text": "Registerbekanntmachung nach dem Umwandlungsgesetz\nBerlin Amtsgericht Berlin (Charlottenburg) HRB 272957\nDGS Ingenieurgesellschaft für Projektmanagement mbH – Berlin",
      "type": "Registerbekanntmachung nach dem Umwandlungsgesetz",
      "state": "Berlin",
      "amtsgericht": "Amtsgericht Berlin (Charlottenburg)",
      "registernummer": "HRB 272957",
      "registerart": "HRB",
      "company_name": "DGS Ingenieurgesellschaft für Projektmanagement mbH",
      "company_seat": "Berlin",
      "details": "10.03.2025 (Bekanntmachungsdatum)\n\nBerlin Amtsgericht Berlin (Charlottenburg) HRB 272957\nRegisterbekanntmachung nach dem Umwandlungsgesetz 07.03.2025 (Eintragungsdatum)\n\nDGS Ingenieurgesellschaft für Projektmanagement mbH\nGesellschaft mit beschränkter Haftung\nBerlin\n\nZu Eintragungsnummer 1 vom 07.03.2025 wird als nicht eingetragen veröffentlicht: Den Gläubigern ist, wenn sie binnen sechs Monaten nach dem Tag, an dem die Eintragung der Umwandlung als bekannt gemacht gilt, ihren Anspruch nach Grund und Höhe schriftlich anmelden, Sicherheit zu leisten, soweit sie nicht Befriedigung verlangen können. Dieses Recht steht den Gläubigern jedoch nur zu, wenn sie glaubhaft machen, dass durch die Umwandlung die Erfüllung ihrer Forderung gefährdet wird. Das Recht, Sicherheitsleistung zu verlangen, steht Gläubigern nicht zu, die im Falle der Insolvenz ein Recht auf vorzugsweise Befriedigung aus einer Deckungsmasse haben, die nach gesetzlicher Vorschrift zu ihrem Schutz errichtet und staatlich überwacht ist."
    },
    {
      "date": "2025-03-10",
      "id": "103283",
      "original_text": "Sonstige Registerbekanntmachung\nSchleswig-Holstein Amtsgericht Lübeck HRB 24200\nOana Bau- und Handel GmbH – Ahrensburg",
      "type": "Sonstige Registerbekanntmachung",
      "state": "Schleswig-Holstein",
      "amtsgericht": "Amtsgericht Lübeck",
      "registernummer": "HRB 24200",
      "registerart": "HRB",
      "company_name": "Oana Bau- und Handel GmbH",
      "company_seat": "Ahrensburg",
      "details": "10.03.2025 (Bekanntmachungsdatum)\n\nSchleswig-Holstein Amtsgericht Lübeck HRB 24200\nSonstige Registerbekanntmachung\n\nOana Bau- und Handel GmbH\nGesellschaft mit beschränkter Haftung\nAhrensburg\n\nAls nicht eingetragen wird veröffentlicht:\nergeben sich aus den mir vorliegenden Unterlagen Anhaltspunkte dafür, dass die Gesellschaft vermögenslos ist:\nAntrag des Finanzamtes Hamburg-Harburg vom 30.09.2024 auf Löschung der Gesellschaft von Amts wegen aufgrund Vermögenslosigkeit. Es bestehen offene Steuerrückstände und Steuererklärungen werden nicht mehr eingereicht.\nDie Gesellschaft ist nicht mehr erreichbar und die Geschäftsführerin unbekannt verzogen.\nIch beabsichtige daher, die Gesellschaft wegen Vermögenslosigkeit gemäß § 394 FamFG zu löschen.\nIch bestimme eine Frist von einem Monat zur Geltendmachung eines Widerspruchs gegen die Löschung, § 394 Abs. 2 S. 1 FamFG.\nWeiter bitte ich Sie, mir binnen derselben Frist mitzuteilen, ob die genannte Gesellschaft noch Vermögen hat, ggf. welche Vermögensgegenstände sie besitzt, ob die Gesellschaft noch Partei eines noch nicht rechtskräftig abgeschlossenen Rechtsstreits ist oder ob sonst noch eine Abwicklung stattfindet.\nNach Fristablauf ohne Widerspruch von Ihnen oder anderer Seite wird die Gesellschaft gelöscht."
    },
    {
      "date": "2025-03-10",
      "id": "103284",
      "original_text": "Registerbekanntmachung nach dem Umwandlungsgesetz\nBaden-Württemberg Amtsgericht Stuttgart HRA 729364\nNatursteine Sebastian Kabitzsch GmbH & Co. KG – Eppingen",
      "type": "Registerbekanntmachung nach dem Umwandlungsgesetz",
      "state": "Baden-Württemberg",
      "amtsgericht": "Amtsgericht Stuttgart",
      "registernummer": "HRA 729364",
      "registerart": "HRA",
      "company_name": "Natursteine Sebastian Kabitzsch GmbH & Co. KG",
      "company_seat": "Eppingen",
      "details": "10.03.2025 (Bekanntmachungsdatum)\n\nBaden-Württemberg Amtsgericht Stuttgart HRA 729364\nRegisterbekanntmachung nach dem Umwandlungsgesetz 10.03.2025 (Eintragungsdatum)\n\nNatursteine Sebastian Kabitzsch GmbH & Co. KG\nKommanditgesellschaft\nEppingen\n\nAls nicht eingetragen wird bekanntgemacht:\nDen Gläubigern des an dem Formwechsel beteiligten Rechtsträgers ist, wenn sie binnen sechs Monaten nach dem Tag, an dem die Eintragung des Formwechsels in das Register des Sitzes desjenigen Rechtsträgers, dessen Gläubiger sie sind, nach § 19 Abs. 3 UmwG als bekanntgemacht gilt, ihren Anspruch nach Grund und Höhe schriftlich anmelden, Sicherheit zu leisten, soweit sie nicht Befriedigung verlangen können. Dieses Recht steht den Gläubigern jedoch nur zu, wenn sie glaubhaft machen, dass durch den Formwechsel die Erfüllung ihrer Forderung gefährdet wird."
    },
    {
      "date": "2025-03-10",
      "id": "103285",
      "original_text": "Löschungsankündigung\nBaden-Württemberg Amtsgericht Ulm HRA 726374\nHuse Murtic e.K. – Heidenheim an der Brenz",
      "type": "Löschungsankündigung",
      "state": "Baden-Württemberg",
      "amtsgericht": "Amtsgericht Ulm",
      "registernummer": "HRA 726374",
      "registerart": "HRA",
      "company_name": "Huse Murtic e.K.",
      "company_seat": "Heidenheim an der Brenz",
      "details": "10.03.2025 (Bekanntmachungsdatum)\n\nBaden-Württemberg Amtsgericht Ulm HRA 726374\nLöschungsankündigung\n\nHuse Murtic e.K.\nEinzelkaufmann / Einzelkauffrau\nHeidenheim an der Brenz\n\nAls nicht eingetragen wird bekanntgemacht:\nDas Registergericht beabsichtigt, die Firma im Handelsregister von Amts wegen nach § 31 Abs. 2 HGB zu löschen. Die Frist zur Geltendmachung eines Widerspruchs gegen die beabsichtigte Löschung ist auf einen Monat ab Veröffentlichung bestimmt."
    },
    {
      "date": "2025-03-10",
      "id": "103286",
      "original_text": "Registerbekanntmachung nach dem Umwandlungsgesetz\nBaden-Württemberg Amtsgericht Stuttgart HRB 724260\nHüfftlein Immobilien GmbH – Stuttgart",
      "type": "Registerbekanntmachung nach dem Umwandlungsgesetz",
      "state": "Baden-Württemberg",
      "amtsgericht": "Amtsgericht Stuttgart",
      "registernummer": "HRB 724260",
      "registerart": "HRB",
      "company_name": "Hüfftlein Immobilien GmbH",
      "company_seat": "Stuttgart",
      "details": "10.03.2025 (Bekanntmachungsdatum)\n\nBaden-Württemberg Amtsgericht Stuttgart HRB 724260\nRegisterbekanntmachung nach dem Umwandlungsgesetz 10.03.2025 (Eintragungsdatum)\n\nHüfftlein Immobilien GmbH\nGesellschaft mit beschränkter Haftung\nStuttgart\n\nAls nicht eingetragen wird bekanntgemacht:\nDen Gläubigern der an der Verschmelzung beteiligten Rechtsträger ist, wenn sie binnen sechs Monaten nach dem Tag, an dem die Eintragung der Verschmelzung in das Register des Sitzes desjenigen Rechtsträgers, dessen Gläubiger sie sind, nach § 19 Abs. 3 UmwG als bekanntgemacht gilt, ihren Anspruch nach Grund und Höhe schriftlich anmelden, Sicherheit zu leisten, soweit sie nicht Befriedigung verlangen können. Dieses Recht steht den Gläubigern jedoch nur zu, wenn sie glaubhaft machen, dass durch die Verschmelzung die Erfüllung ihrer Forderung gefährdet wird."
    },
    {
      "date": "2025-03-10",
      "id": "103287",
      "original_text": "Einreichung neuer Dokumente\nBerlin Amtsgericht Berlin (Charlottenburg) HRB 83891\nMEDIA CONSULTA International Holding Aktiengesellschaft – Berlin",
      "type": "Einreichung neuer Dokumente",
      "state": "Berlin",
      "amtsgericht": "Amtsgericht Berlin (Charlottenburg)",
      "registernummer": "HRB 83891",
      "registerart": "HRB",
      "company_name": "MEDIA CONSULTA International Holding Aktiengesellschaft",
      "company_seat": "Berlin",
      "details": "10.03.2025 (Bekanntmachungsdatum)\n\nBerlin Amtsgericht Berlin (Charlottenburg) HRB 83891\nEinreichung neuer Dokumente\n\nMEDIA CONSULTA International Holding Aktiengesellschaft\nAktiengesellschaft\nBerlin\n\nAls nicht eingetragen wird veröffentlicht:\nEs wurde eine neue Liste der Aufsichtsratsmitglieder eingereicht (§ 106 AktG)."
    },
    {
      "date": "2025-03-10",
      "id": "103288",
      "original_text": "Einreichung neuer Dokumente\nBerlin Amtsgericht Berlin (Charlottenburg) HRB 182217\nPD - Berater der öffentlichen Hand GmbH – Berlin",
      "type": "Einreichung neuer Dokumente",
      "state": "Berlin",
      "amtsgericht": "Amtsgericht Berlin (Charlottenburg)",
      "registernummer": "HRB 182217",
      "registerart": "HRB",
      "company_name": "PD - Berater der öffentlichen Hand GmbH",
      "company_seat": "Berlin",
      "details": "10.03.2025 (Bekanntmachungsdatum)\n\nBerlin Amtsgericht Berlin (Charlottenburg) HRB 182217\nEinreichung neuer Dokumente\n\nPD - Berater der öffentlichen Hand GmbH\nGesellschaft mit beschränkter Haftung\nBerlin\n\nAls nicht eingetragen wird veröffentlicht: Es wurde eine neue Liste der Aufsichtsratsmitglieder eingereicht (§52 GmbHG)."
    },
    {
      "date": "2025-03-10",
      "id": "103289",
      "original_text": "Registerbekanntmachung nach dem Umwandlungsgesetz\nSchleswig-Holstein Amtsgericht Lübeck HRB 21309\nNordic Grundstücks UG (haftungsbeschränkt) – Elmenhorst",
      "type": "Registerbekanntmachung nach dem Umwandlungsgesetz",
      "state": "Schleswig-Holstein",
      "amtsgericht": "Amtsgericht Lübeck",
      "registernummer": "HRB 21309",
      "registerart": "HRB",
      "company_name": "Nordic Grundstücks UG (haftungsbeschränkt)",
      "company_seat": "Elmenhorst",
      "details": "10.03.2025 (Bekanntmachungsdatum)\n\nSchleswig-Holstein Amtsgericht Lübeck HRB 21309\nRegisterbekanntmachung nach dem Umwandlungsgesetz 07.03.2025 (Eintragungsdatum)\n\nNordic Grundstücks UG (haftungsbeschränkt)\nGesellschaft mit beschränkter Haftung\nElmenhorst\n\nZu Eintragungsnummer 3 vom 07.03.2025 wird als nicht eingetragen veröffentlicht: Den Gläubigern der an der Verschmelzung beteiligten Rechtsträger ist, wenn sie binnen sechs Monaten nach dem Tag, an dem die Eintragung der Verschmelzung in das Register des Sitzes desjenigen Rechtsträgers, dessen Gläubiger sie sind, als bekannt gemacht gilt, ihren Anspruch nach Grund und Höhe schriftlich anmelden, Sicherheit zu leisten, soweit sie nicht Befriedigung verlangen können. Dieses Recht steht den Gläubigern jedoch nur zu, wenn sie glaubhaft machen, dass durch die Verschmelzung die Erfüllung ihrer Forderung gefährdet wird."
    },
    {
      "date": "2025-03-10",
      "id": "103290",
      "original_text": "Löschungsankündigung\nBaden-Württemberg Amtsgericht Stuttgart HRB 775272\nAI+IQ Games App- und Brettspiele GmbH – Stuttgart",
      "type": "Löschungsankündigung",
      "state": "Baden-Württemberg",
      "amtsgericht": "Amtsgericht Stuttgart",
      "registernummer": "HRB 775272",
      "registerart": "HRB",
      "company_name": "AI+IQ Games App- und Brettspiele GmbH",
      "company_seat": "Stuttgart",
      "details": "10.03.2025 (Bekanntmachungsdatum)\n\nBaden-Württemberg Amtsgericht Stuttgart HRB 775272\nLöschungsankündigung\n\nAI+IQ Games App- und Brettspiele GmbH\nGesellschaft mit beschränkter Haftung\nStuttgart\n\nDas Gericht beabsichtigt, die Gesellschaft wegen Vermögenslosigkeit im Handelsregister von Amts wegen nach § 394 FamFG zu löschen. Die Frist zur Geltendmachung eines Widerspruchs gegen die beabsichtigte Löschung ist auf zwei Monate ab Veröffentlichung bestimmt."
    },
    {
      "date": "2025-03-10",
      "id": "103291",
      "original_text": "Registerbekanntmachung nach dem Umwandlungsgesetz\nSchleswig-Holstein Amtsgericht Lübeck HRB 20938\nHBN Projekt UG (haftungsbeschränkt) – Elmenhorst",
      "type": "Registerbekanntmachung nach dem Umwandlungsgesetz",
      "state": "Schleswig-Holstein",
      "amtsgericht": "Amtsgericht Lübeck",
      "registernummer": "HRB 20938",
      "registerart": "HRB",
      "company_name": "HBN Projekt UG (haftungsbeschränkt)",
      "company_seat": "Elmenhorst",
      "details": "10.03.2025 (Bekanntmachungsdatum)\n\nSchleswig-Holstein Amtsgericht Lübeck HRB 20938\nRegisterbekanntmachung nach dem Umwandlungsgesetz 07.03.2025 (Eintragungsdatum)\n\nHBN Projekt UG (haftungsbeschränkt)\nGesellschaft mit beschränkter Haftung\nElmenhorst\n\nAls nicht eingetragen wird veröffentlicht: Den Gläubigern der an der Verschmelzung beteiligten Rechtsträger ist, wenn sie binnen sechs Monaten nach dem Tag, an dem die Eintragung der Verschmelzung in das Register des Sitzes desjenigen Rechtsträgers, dessen Gläubiger sie sind, als bekannt gemacht gilt, ihren Anspruch nach Grund und Höhe schriftlich anmelden, Sicherheit zu leisten, soweit sie nicht Befriedigung verlangen können. Dieses Recht steht den Gläubigern jedoch nur zu, wenn sie glaubhaft machen, dass durch die Verschmelzung die Erfüllung ihrer Forderung gefährdet wird."
    },
    {
      "date": "2025-03-10",
      "id": "103292",
      "original_text": "Registerbekanntmachung nach dem Umwandlungsgesetz\nSchleswig-Holstein Amtsgericht Lübeck HRB 21040\nBaltic Grundstücks UG (haftungsbeschränkt) – Elmenhorst",
      "type": "Registerbekanntmachung nach dem Umwandlungsgesetz",
      "state": "Schleswig-Holstein",
      "amtsgericht": "Amtsgericht Lübeck",
      "registernummer": "HRB 21040",
      "registerart": "HRB",
      "company_name": "Baltic Grundstücks UG (haftungsbeschränkt)",
      "company_seat": "Elmenhorst",
      "details": "10.03.2025 (Bekanntmachungsdatum)\n\nSchleswig-Holstein Amtsgericht Lübeck HRB 21040\nRegisterbekanntmachung nach dem Umwandlungsgesetz 07.03.2025 (Eintragungsdatum)\n\nBaltic Grundstücks UG (haftungsbeschränkt)\nGesellschaft mit beschränkter Haftung\nElmenhorst\n\nAls nicht eingetragen wird veröffentlicht: Den Gläubigern der an der Verschmelzung beteiligten Rechtsträger ist, wenn sie binnen sechs Monaten nach dem Tag, an dem die Eintragung der Verschmelzung in das Register des Sitzes desjenigen Rechtsträgers, dessen Gläubiger sie sind, als bekannt gemacht gilt, ihren Anspruch nach Grund und Höhe schriftlich anmelden, Sicherheit zu leisten, soweit sie nicht Befriedigung verlangen können. Dieses Recht steht den Gläubigern jedoch nur zu, wenn sie glaubhaft machen, dass durch die Verschmelzung die Erfüllung ihrer Forderung gefährdet wird."
    },
    {
      "date": "2025-03-10",
      "id": "103293",
      "original_text": "Registerbekanntmachung nach dem Umwandlungsgesetz\nSchleswig-Holstein Amtsgericht Lübeck HRB 20938\nHBN Projekt UG (haftungsbeschränkt) – Elmenhorst",
      "type": "Registerbekanntmachung nach dem Umwandlungsgesetz",
      "state": "Schleswig-Holstein",
      "amtsgericht": "Amtsgericht Lübeck",
      "registernummer": "HRB 20938",
      "registerart": "HRB",
      "company_name": "HBN Projekt UG (haftungsbeschränkt)",
      "company_seat": "Elmenhorst",
      "details": "10.03.2025 (Bekanntmachungsdatum)\n\nSchleswig-Holstein Amtsgericht Lübeck HRB 20938\nRegisterbekanntmachung nach dem Umwandlungsgesetz 07.03.2025 (Eintragungsdatum)\n\nHBN Projekt UG (haftungsbeschränkt)\nGesellschaft mit beschränkter Haftung\nElmenhorst\n\nAls nicht eingetragen wird veröffentlicht: Den Gläubigern der an der Verschmelzung beteiligten Rechtsträger ist, wenn sie binnen sechs Monaten nach dem Tag, an dem die Eintragung der Verschmelzung in das Register des Sitzes desjenigen Rechtsträgers, dessen Gläubiger sie sind, als bekannt gemacht gilt, ihren Anspruch nach Grund und Höhe schriftlich anmelden, Sicherheit zu leisten, soweit sie nicht Befriedigung verlangen können. Dieses Recht steht den Gläubigern jedoch nur zu, wenn sie glaubhaft machen, dass durch die Verschmelzung die Erfüllung ihrer Forderung gefährdet wird."
    },
    {
      "date": "2025-03-10",
      "id": "103294",
      "original_text": "Löschungsankündigung\nSachsen Amtsgericht Leipzig HRA 15206\nACL Musik Box Taucha UG (haftungsbeschränkt) & Co. KG – Taucha",
      "type": "Löschungsankündigung",
      "state": "Sachsen",
      "amtsgericht": "Amtsgericht Leipzig",
      "registernummer": "HRA 15206",
      "registerart": "HRA",
      "company_name": "ACL Musik Box Taucha UG (haftungsbeschränkt) & Co. KG",
      "company_seat": "Taucha",
      "details": "10.03.2025 (Bekanntmachungsdatum)\n\nSachsen Amtsgericht Leipzig HRA 15206\nLöschungsankündigung\n\nACL Musik Box Taucha UG (haftungsbeschränkt) & Co. KG\nKommanditgesellschaft\nTaucha\n\nDas Registergericht beabsichtigt, die im Handelsregister eingetragene Gesellschaft von Amts wegen nach § 394 FamFG zu löschen. Die Frist zu Erhebung eines Widerspruchs gegen die beabsichtigte Löschung wird auf einen Monat festgesetzt."
    },
    {
      "date": "2025-03-10",
      "id": "103295",
      "original_text": "Sonstige Registerbekanntmachung\nSachsen Amtsgericht Leipzig HRB 23498\nAerologic GmbH – Schkeuditz",
      "type": "Sonstige Registerbekanntmachung",
      "state": "Sachsen",
      "amtsgericht": "Amtsgericht Leipzig",
      "registernummer": "HRB 23498",
      "registerart": "HRB",
      "company_name": "Aerologic GmbH",
      "company_seat": "Schkeuditz",
      "details": "10.03.2025 (Bekanntmachungsdatum)\n\nSachsen Amtsgericht Leipzig HRB 23498\nSonstige Registerbekanntmachung\n\nAerologic GmbH\nGesellschaft mit beschränkter Haftung\nSchkeuditz\n\nAm 05.03.2025 wurde beim Handelsregister des Amtsgerichts Leipzig die Liste der Mitglieder des Aufsichtsrats gemäß § 52 GmbHG eingereicht."
    },
    {
      "date": "2025-03-10",
      "id": "103296",
      "original_text": "Löschungsankündigung\nSachsen Amtsgericht Dresden HRB 35056\nK.M.F.T. DRESDEN Unternehmergesellschaft (haftungsbeschränkt) – Dresden",
      "type": "Löschungsankündigung",
      "state": "Sachsen",
      "amtsgericht": "Amtsgericht Dresden",
      "registernummer": "HRB 35056",
      "registerart": "HRB",
      "company_name": "K.M.F.T. DRESDEN Unternehmergesellschaft (haftungsbeschränkt)",
      "company_seat": "Dresden",
      "details": "10.03.2025 (Bekanntmachungsdatum)\n\nSachsen Amtsgericht Dresden HRB 35056\nLöschungsankündigung\n\nK.M.F.T. DRESDEN Unternehmergesellschaft (haftungsbeschränkt)\nGesellschaft mit beschränkter Haftung\nDresden\n\nDas Registergericht beabsichtigt, die im Handelsregister eingetragene Gesellschaft von Amts wegen nach § 394 FamFG zu löschen. Die Frist zu Erhebung eines Widerspruchs gegen die beabsichtigte Löschung wird auf einen Monat festgesetzt."
    },
    {
      "date": "2025-03-10",
      "id": "103297",
      "original_text": "Registerbekanntmachung nach dem Umwandlungsgesetz\nSachsen Amtsgericht Leipzig HRB 33208\nKSE GmbH Steuerberatungsgesellschaft – Markkleeberg",
      "type": "Registerbekanntmachung nach dem Umwandlungsgesetz",
      "state": "Sachsen",
      "amtsgericht": "Amtsgericht Leipzig",
      "registernummer": "HRB 33208",
      "registerart": "HRB",
      "company_name": "KSE GmbH Steuerberatungsgesellschaft",
      "company_seat": "Markkleeberg",
      "details": "10.03.2025 (Bekanntmachungsdatum)\n\nSachsen Amtsgericht Leipzig HRB 33208\nRegisterbekanntmachung nach dem Umwandlungsgesetz 10.03.2025 (Eintragungsdatum)\n\nKSE GmbH Steuerberatungsgesellschaft\nGesellschaft mit beschränkter Haftung\nMarkkleeberg\n\nDen Gläubigern der an der Verschmelzung beteiligten Rechtsträger ist, wenn sie binnen sechs Monaten nach dem Tag, an dem die Eintragung der Verschmelzung in das Register des Sitzes desjenigen Rechtsträgers, dessen Gläubiger sie sind, nach § 19 Abs. 3 UmwG als bekannt gemacht gilt, ihren Anspruch nach Grund und Höhe in Textform anmelden, Sicherheit zu leisten, soweit sie nicht Befriedigung verlangen können. Dieses Recht steht den Gläubigern jedoch nur zu, wenn sie glaubhaft machen, dass durch die Verschmelzung die Erfüllung der Forderung gefährdet wird."
    },
    {
      "date": "2025-03-10",
      "id": "103298",
      "original_text": "Löschungsankündigung\nSachsen Amtsgericht Dresden HRB 32840\nRösler Service UG (haftungsbeschränkt) – Großenhain",
      "type": "Löschungsankündigung",
      "state": "Sachsen",
      "amtsgericht": "Amtsgericht Dresden",
      "registernummer": "HRB 32840",
      "registerart": "HRB",
      "company_name": "Rösler Service UG (haftungsbeschränkt)",
      "company_seat": "Großenhain",
      "details": "10.03.2025 (Bekanntmachungsdatum)\n\nSachsen Amtsgericht Dresden HRB 32840\nLöschungsankündigung\n\nRösler Service UG (haftungsbeschränkt)\nGesellschaft mit beschränkter Haftung\nGroßenhain\n\nDas Registergericht beabsichtigt, die im Handelsregister eingetragene Gesellschaft von Amts wegen nach § 394 FamFG zu löschen. Die Frist zu Erhebung eines Widerspruchs gegen die beabsichtigte Löschung wird auf einen Monat festgesetzt."
    },
    {
      "date": "2025-03-10",
      "id": "103299",
      "original_text": "Registerbekanntmachung nach dem Umwandlungsgesetz\nSachsen Amtsgericht Leipzig HRB 37288\nWB Steuerberatungsgesellschaft mbH – Markkleeberg",
      "type": "Registerbekanntmachung nach dem Umwandlungsgesetz",
      "state": "Sachsen",
      "amtsgericht": "Amtsgericht Leipzig",
      "registernummer": "HRB 37288",
      "registerart": "HRB",
      "company_name": "WB Steuerberatungsgesellschaft mbH",
      "company_seat": "Markkleeberg",
      "details": "10.03.2025 (Bekanntmachungsdatum)\n\nSachsen Amtsgericht Leipzig HRB 37288\nRegisterbekanntmachung nach dem Umwandlungsgesetz 10.03.2025 (Eintragungsdatum)\n\nWB Steuerberatungsgesellschaft mbH\nGesellschaft mit beschränkter Haftung\nMarkkleeberg\n\nDen Gläubigern der an der Verschmelzung beteiligten Rechtsträger ist, wenn sie binnen sechs Monaten nach dem Tag, an dem die Eintragung der Verschmelzung in das Register des Sitzes desjenigen Rechtsträgers, dessen Gläubiger sie sind, nach § 19 Abs. 3 UmwG als bekannt gemacht gilt, ihren Anspruch nach Grund und Höhe in Textform anmelden, Sicherheit zu leisten, soweit sie nicht Befriedigung verlangen können. Dieses Recht steht den Gläubigern jedoch nur zu, wenn sie glaubhaft machen, dass durch die Verschmelzung die Erfüllung der Forderung gefährdet wird."
    },
    {
      "date": "2025-03-10",
      "id": "103300",
      "original_text": "Sonstige Registerbekanntmachung\nSachsen Amtsgericht Leipzig HRB 37288\nWB Steuerberatungsgesellschaft mbH – Markkleeberg",
      "type": "Sonstige Registerbekanntmachung",
      "state": "Sachsen",
      "amtsgericht": "Amtsgericht Leipzig",
      "registernummer": "HRB 37288",
      "registerart": "HRB",
      "company_name": "WB Steuerberatungsgesellschaft mbH",
      "company_seat": "Markkleeberg",
      "details": "10.03.2025 (Bekanntmachungsdatum)\n\nSachsen Amtsgericht Leipzig HRB 37288\nSonstige Registerbekanntmachung 10.03.2025 (Eintragungsdatum)\n\nWB Steuerberatungsgesellschaft mbH\nGesellschaft mit beschränkter Haftung\nMarkkleeberg\n\nDen Gläubigern der Gesellschaft, deren Forderungen begründet worden sind bevor die Eintragung der Beendigung des Beherrschungs- und Gewinnabführungsvertrages in das Handelsregister nach § 10 des Handelsgesetzbuches als bekanntgemacht gilt, hat der andere Vertragsteil Sicherheit zu leisten, wenn sie sich binnen sechs Monaten nach der Bekanntmachung der Eintragung zu diesem Zweck bei ihm melden."
    },
    {
      "date": "2025-03-10",
      "id": "103301",
      "original_text": "Registerbekanntmachung nach dem Umwandlungsgesetz\nSachsen Amtsgericht Dresden HRB 6025\nDr. Sporenberg Umweltschutz Meßtechnik GmbH – Bad Muskau",
      "type": "Registerbekanntmachung nach dem Umwandlungsgesetz",
      "state": "Sachsen",
      "amtsgericht": "Amtsgericht Dresden",
      "registernummer": "HRB 6025",
      "registerart": "HRB",
      "company_name": "Dr. Sporenberg Umweltschutz Meßtechnik GmbH",
      "company_seat": "Bad Muskau",
      "details": "10.03.2025 (Bekanntmachungsdatum)\n\nSachsen Amtsgericht Dresden HRB 6025\nRegisterbekanntmachung nach dem Umwandlungsgesetz 10.03.2025 (Eintragungsdatum)\n\nDr. Sporenberg Umweltschutz Meßtechnik GmbH\nGesellschaft mit beschränkter Haftung\nBad Muskau\n\nDen Gläubigern der an der Verschmelzung beteiligten Rechtsträger ist, wenn sie binnen sechs Monaten nach dem Tag, an dem die Eintragung der Verschmelzung in das Register des Sitzes desjenigen Rechtsträgers, dessen Gläubiger sie sind, nach § 19 Abs. 3 UmwG als bekannt gemacht gilt, ihren Anspruch nach Grund und Höhe in Textform anmelden, Sicherheit zu leisten, soweit sie nicht Befriedigung verlangen können. Dieses Recht steht den Gläubigern jedoch nur zu, wenn sie glaubhaft machen, dass durch die Verschmelzung die Erfüllung der Forderung gefährdet wird."
    },
    {
      "date": "2025-03-10",
      "id": "103302",
      "original_text": "Registerbekanntmachung nach dem Umwandlungsgesetz\nNiedersachsen Amtsgericht Hannover HRB 224665\nHR AI Komplementär GmbH – Hannover",
      "type": "Registerbekanntmachung nach dem Umwandlungsgesetz",
      "state": "Niedersachsen",
      "amtsgericht": "Amtsgericht Hannover",
      "registernummer": "HRB 224665",
      "registerart": "HRB",
      "company_name": "HR AI Komplementär GmbH",
      "company_seat": "Hannover",
      "details": "10.03.2025 (Bekanntmachungsdatum)\n\nNiedersachsen Amtsgericht Hannover HRB 224665\nRegisterbekanntmachung nach dem Umwandlungsgesetz 10.03.2025 (Eintragungsdatum)\n\nHR AI Komplementär GmbH\nGesellschaft mit beschränkter Haftung\nHannover\n\nDen Gläubigern der an der Verschmelzung beteiligten Rechtsträger ist, wenn sie binnen sechs Monaten nach dem Tag, an dem die Eintragung der Verschmelzung in das Register des Sitzes desjenigen Rechtsträgers, dessen Gläubiger sie sind, nach § 19  Abs.  3 UmwG als bekannt gemacht gilt, ihren Anspruch nach Grund und Höhe schriftlich anmelden, Sicherheit zu leisten, soweit sie nicht Befriedigung verlangen können. Dieses Recht steht den Gläubigern jedoch nur zu, wenn sie glaubhaft machen, dass durch die Verschmelzung die Erfüllung der Forderung gefährdet wird."
    },
    {
      "date": "2025-03-10",
      "id": "103303",
      "original_text": "Registerbekanntmachung nach dem Umwandlungsgesetz\nNiedersachsen Amtsgericht Hannover HRB 227526\nE+S Private Equity Beteiligungen GmbH – Hannover",
      "type": "Registerbekanntmachung nach dem Umwandlungsgesetz",
      "state": "Niedersachsen",
      "amtsgericht": "Amtsgericht Hannover",
      "registernummer": "HRB 227526",
      "registerart": "HRB",
      "company_name": "E+S Private Equity Beteiligungen GmbH",
      "company_seat": "Hannover",
      "details": "10.03.2025 (Bekanntmachungsdatum)\n\nNiedersachsen Amtsgericht Hannover HRB 227526\nRegisterbekanntmachung nach dem Umwandlungsgesetz 10.03.2025 (Eintragungsdatum)\n\nE+S Private Equity Beteiligungen GmbH\nGesellschaft mit beschränkter Haftung\nHannover\n\nDen Gläubigern der an der Verschmelzung beteiligten Rechtsträger ist, wenn sie binnen sechs Monaten nach dem Tag, an dem die Eintragung der Verschmelzung in das Register des Sitzes desjenigen Rechtsträgers, dessen Gläubiger sie sind, nach § 19  Abs.  3 UmwG als bekannt gemacht gilt, ihren Anspruch nach Grund und Höhe schriftlich anmelden, Sicherheit zu leisten, soweit sie nicht Befriedigung verlangen können. Dieses Recht steht den Gläubigern jedoch nur zu, wenn sie glaubhaft machen, dass durch die Verschmelzung die Erfüllung der Forderung gefährdet wird."
    },
    {
      "date": "2025-03-10",
      "id": "103304",
      "original_text": "Sonstige Registerbekanntmachung\nNiedersachsen Amtsgericht Lüneburg GnR 120028 früher Amtsgericht Dannenberg (Elbe)\nUelzena eG – Uelzen",
      "type": "Sonstige Registerbekanntmachung",
      "state": "Niedersachsen",
      "amtsgericht": "Amtsgericht Lüneburg",
      "registernummer": "GnR 120028",
      "registerart": "GnR",
      "company_name": "Uelzena eG",
      "company_seat": "Uelzen",
      "former_amtsgericht": "Dannenberg (Elbe)",
      "details": "10.03.2025 (Bekanntmachungsdatum)\n\nNiedersachsen Amtsgericht Lüneburg GnR 120028 früher Amtsgericht Dannenberg (Elbe)\nSonstige Registerbekanntmachung 10.03.2025 (Eintragungsdatum)\n\nUelzena eG\neingetragene Genossenschaft\nUelzen\n\nNeue Regelung: Der Geschäftsanteil beträgt 20,00 EURO. Auf den Geschäftsanteil sind 4,00 EURO sofort nach Eintragung in die Mitgliederliste einzuzahlen. Den Gläubigern der Genossenschaft ist, wenn sie sich binnen sechs Monaten nach dieser Bekanntmachung zu diesem Zweck bei der Genossenschaft melden, Sicherheit zu leisten, soweit sie nicht Befriedigung verlangen können."
    },
    {
      "date": "2025-03-10",
      "id": "103305",
      "original_text": "Registerbekanntmachung nach dem Umwandlungsgesetz\nNiedersachsen Amtsgericht Hannover HRB 208528\nHAPEP II Komplementär GmbH – Hannover",
      "type": "Registerbekanntmachung nach dem Umwandlungsgesetz",
      "state": "Niedersachsen",
      "amtsgericht": "Amtsgericht Hannover",
      "registernummer": "HRB 208528",
      "registerart": "HRB",
      "company_name": "HAPEP II Komplementär GmbH",
      "company_seat": "Hannover",
      "details": "10.03.2025 (Bekanntmachungsdatum)\n\nNiedersachsen Amtsgericht Hannover HRB 208528\nRegisterbekanntmachung nach dem Umwandlungsgesetz 10.03.2025 (Eintragungsdatum)\n\nHAPEP II Komplementär GmbH\nGesellschaft mit beschränkter Haftung\nHannover\n\nDen Gläubigern der an der Verschmelzung beteiligten Rechtsträger ist, wenn sie binnen sechs Monaten nach dem Tag, an dem die Eintragung der Verschmelzung in das Register des Sitzes desjenigen Rechtsträgers, dessen Gläubiger sie sind, nach § 19  Abs.  3 UmwG als bekannt gemacht gilt, ihren Anspruch nach Grund und Höhe schriftlich anmelden, Sicherheit zu leisten, soweit sie nicht Befriedigung verlangen können. Dieses Recht steht den Gläubigern jedoch nur zu, wenn sie glaubhaft machen, dass durch die Verschmelzung die Erfüllung der Forderung gefährdet wird."
    },
    {
      "date": "2025-03-10",
      "id": "103306",
      "original_text": "Registerbekanntmachung nach dem Umwandlungsgesetz\nNiedersachsen Amtsgericht Hannover HRB 224421\nE+S PE GmbH – Hannover",
      "type": "Registerbekanntmachung nach dem Umwandlungsgesetz",
      "state": "Niedersachsen",
      "amtsgericht": "Amtsgericht Hannover",
      "registernummer": "HRB 224421",
      "registerart": "HRB",
      "company_name": "E+S PE GmbH",
      "company_seat": "Hannover",
      "details": "10.03.2025 (Bekanntmachungsdatum)\n\nNiedersachsen Amtsgericht Hannover HRB 224421\nRegisterbekanntmachung nach dem Umwandlungsgesetz 10.03.2025 (Eintragungsdatum)\n\nE+S PE GmbH\nGesellschaft mit beschränkter Haftung\nHannover\n\nDen Gläubigern der an der Verschmelzung beteiligten Rechtsträger ist, wenn sie binnen sechs Monaten nach dem Tag, an dem die Eintragung der Verschmelzung in das Register des Sitzes desjenigen Rechtsträgers, dessen Gläubiger sie sind, nach § 19  Abs.  3 UmwG als bekannt gemacht gilt, ihren Anspruch nach Grund und Höhe schriftlich anmelden, Sicherheit zu leisten, soweit sie nicht Befriedigung verlangen können. Dieses Recht steht den Gläubigern jedoch nur zu, wenn sie glaubhaft machen, dass durch die Verschmelzung die Erfüllung der Forderung gefährdet wird."
    },
    {
      "date": "2025-03-10",
      "id": "103307",
      "original_text": "Einreichung neuer Dokumente\nNiedersachsen Amtsgericht Oldenburg (Oldenburg) HRB 130563 früher Amtsgericht Wilhelmshaven\nSVG Sicherheitsverwaltungs AG – Wilhelmshaven",
      "type": "Einreichung neuer Dokumente",
      "state": "Niedersachsen",
      "amtsgericht": "Amtsgericht Oldenburg (Oldenburg)",
      "registernummer": "HRB 130563",
      "registerart": "HRB",
      "company_name": "SVG Sicherheitsverwaltungs AG",
      "company_seat": "Wilhelmshaven",
      "former_amtsgericht": "Wilhelmshaven",
      "details": "10.03.2025 (Bekanntmachungsdatum)\n\nNiedersachsen Amtsgericht Oldenburg (Oldenburg) HRB 130563 früher Amtsgericht Wilhelmshaven\nEinreichung neuer Dokumente\n\nSVG Sicherheitsverwaltungs AG\nAktiengesellschaft\nWilhelmshaven\n\nDie Liste der Mitglieder des Aufsichtsrats wurde beim Registergericht eingereicht."
    },
    {
      "date": "2025-03-10",
      "id": "103308",
      "original_text": "Löschungsankündigung\nNiedersachsen Amtsgericht Oldenburg (Oldenburg) HRB 219018\nMotoo Bausanierungs GmbH – Oldenburg",
      "type": "Löschungsankündigung",
      "state": "Niedersachsen",
      "amtsgericht": "Amtsgericht Oldenburg (Oldenburg)",
      "registernummer": "HRB 219018",
      "registerart": "HRB",
      "company_name": "Motoo Bausanierungs GmbH",
      "company_seat": "Oldenburg",
      "details": "10.03.2025 (Bekanntmachungsdatum)\n\nNiedersachsen Amtsgericht Oldenburg (Oldenburg) HRB 219018\nLöschungsankündigung\n\nMotoo Bausanierungs GmbH\nGesellschaft mit beschränkter Haftung\nOldenburg\n\nDas Registergericht beabsichtigt, die Gesellschaft von Amts wegen nach § 394 FamFG zu löschen. Die Frist zur Erhebung eines Widerspruchs ist auf 1 Monat ab dieser Registerbekanntmachung festgesetzt."
    },
    {
      "date": "2025-03-10",
      "id": "103309",
      "original_text": "Löschungsankündigung\nNiedersachsen Amtsgericht Hannover HRA 205121\nE-Max-Mobility GmbH & Co. KG – Hannover",
      "type": "Löschungsankündigung",
      "state": "Niedersachsen",
      "amtsgericht": "Amtsgericht Hannover",
      "registernummer": "HRA 205121",
      "registerart": "HRA",
      "company_name": "E-Max-Mobility GmbH & Co. KG",
      "company_seat": "Hannover",
      "details": "10.03.2025 (Bekanntmachungsdatum)\n\nNiedersachsen Amtsgericht Hannover HRA 205121\nLöschungsankündigung 10.03.2025 (Eintragungsdatum)\n\nE-Max-Mobility GmbH & Co. KG\nKommanditgesellschaft\nHannover\n\nDas Registergericht beabsichtigt, die Firma von Amts wegen nach § 31 Abs. 2 Satz 2 HGB, § 393 FamFG zu löschen. Die Frist zur Erhebung eines Widerspruchs ist auf 1 Monat ab dieser Registerbekanntmachung festgesetzt."
    },
    {
      "date": "2025-03-10",
      "id": "103310",
      "original_text": "Registerbekanntmachung nach dem Umwandlungsgesetz\nNiedersachsen Amtsgericht Hannover HRA 205965\nHWDS PARTNER LLC & Co. KG – Hannover",
      "type": "Registerbekanntmachung nach dem Umwandlungsgesetz",
      "state": "Niedersachsen",
      "amtsgericht": "Amtsgericht Hannover",
      "registernummer": "HRA 205965",
      "registerart": "HRA",
      "company_name": "HWDS PARTNER LLC & Co. KG",
      "company_seat": "Hannover",
      "details": "10.03.2025 (Bekanntmachungsdatum)\n\nNiedersachsen Amtsgericht Hannover HRA 205965\nRegisterbekanntmachung nach dem Umwandlungsgesetz 10.03.2025 (Eintragungsdatum)\n\nHWDS PARTNER LLC & Co. KG\nKommanditgesellschaft\nHannover\n\nDen Gläubigern der an der Verschmelzung beteiligten Rechtsträger ist, wenn sie binnen sechs Monaten nach dem Tag, an dem die Eintragung der Verschmelzung in das Register des Sitzes desjenigen Rechtsträgers, dessen Gläubiger sie sind, nach § 19  Abs.  3 UmwG als bekannt gemacht gilt, ihren Anspruch nach Grund und Höhe schriftlich anmelden, Sicherheit zu leisten, soweit sie nicht Befriedigung verlangen können. Dieses Recht steht den Gläubigern jedoch nur zu, wenn sie glaubhaft machen, dass durch die Verschmelzung die Erfüllung der Forderung gefährdet wird."
    },
    {
      "date": "2025-03-10",
      "id": "103311",
      "original_text": "Löschungsankündigung\nNiedersachsen Amtsgericht Braunschweig HRB 206228\nbraubar GmbH – Wolfenbüttel",
      "type": "Löschungsankündigung",
      "state": "Niedersachsen",
      "amtsgericht": "Amtsgericht Braunschweig",
      "registernummer": "HRB 206228",
      "registerart": "HRB",
      "company_name": "braubar GmbH",
      "company_seat": "Wolfenbüttel",
      "details": "10.03.2025 (Bekanntmachungsdatum)\n\nNiedersachsen Amtsgericht Braunschweig HRB 206228\nLöschungsankündigung\n\nbraubar GmbH\nGesellschaft mit beschränkter Haftung\nWolfenbüttel\n\nDas Registergericht beabsichtigt, die Gesellschaft von Amts wegen nach § 394 FamFG zu löschen. Die Frist zur Erhebung eines Widerspruchs ist auf 1 Monat ab dieser Registerbekanntmachung festgesetzt."
    },
    {
      "date": "2025-03-10",
      "id": "103312",
      "original_text": "Sonstige Registerbekanntmachung\nNiedersachsen Amtsgericht Oldenburg (Oldenburg) HRB 100435 früher Amtsgericht Brake\nATB Nordenham GmbH – Nordenham",
      "type": "Sonstige Registerbekanntmachung",
      "state": "Niedersachsen",
      "amtsgericht": "Amtsgericht Oldenburg (Oldenburg)",
      "registernummer": "HRB 100435",
      "registerart": "HRB",
      "company_name": "ATB Nordenham GmbH",
      "company_seat": "Nordenham",
      "former_amtsgericht": "Brake",
      "details": "10.03.2025 (Bekanntmachungsdatum)\n\nNiedersachsen Amtsgericht Oldenburg (Oldenburg) HRB 100435 früher Amtsgericht Brake\nSonstige Registerbekanntmachung 10.03.2025 (Eintragungsdatum)\n\nATB Nordenham GmbH\nGesellschaft mit beschränkter Haftung\nNordenham\n\nDen Gläubigern der Gesellschaft, deren Forderungen begründet worden sind, bevor die Eintragung der Beendigung des Vertrages in das Handelsregister nach § 10 HGB als bekanntgemacht gilt, ist vom anderen Vertragsteil Sicherheit zu leisten, wenn sie sich binnen sechs Monaten nach der Bekanntmachung zu diesem Zweck bei ihm melden."
    },
    {
      "date": "2025-03-10",
      "id": "103313",
      "original_text": "Einreichung neuer Dokumente\nRheinland-Pfalz Amtsgericht Wittlich HRB 3974\nclean rex Hundehygiene AG – Trier",
      "type": "Einreichung neuer Dokumente",
      "state": "Rheinland-Pfalz",
      "amtsgericht": "Amtsgericht Wittlich",
      "registernummer": "HRB 3974",
      "registerart": "HRB",
      "company_name": "clean rex Hundehygiene AG",
      "company_seat": "Trier",
      "details": "10.03.2025 (Bekanntmachungsdatum)\n\nRheinland-Pfalz Amtsgericht Wittlich HRB 3974\nEinreichung neuer Dokumente\n\nclean rex Hundehygiene AG\nAktiengesellschaft\nTrier\n\nDem Registergericht ist eine neue Liste der Mitglieder des Aufsichtsrates eingereicht worden."
    },
    {
      "date": "2025-03-10",
      "id": "103314",
      "original_text": "Registerbekanntmachung nach dem Umwandlungsgesetz\nRheinland-Pfalz Amtsgericht Koblenz VR 994\nLeichtathletik-Verband Rheinland e.V. (LVR) – Koblenz",
      "type": "Registerbekanntmachung nach dem Umwandlungsgesetz",
      "state": "Rheinland-Pfalz",
      "amtsgericht": "Amtsgericht Koblenz",
      "registernummer": "VR 994",
      "registerart": "VR",
      "company_name": "Leichtathletik-Verband Rheinland e.V. (LVR)",
      "company_seat": "Koblenz",
      "details": "10.03.2025 (Bekanntmachungsdatum)\n\nRheinland-Pfalz Amtsgericht Koblenz VR 994\nRegisterbekanntmachung nach dem Umwandlungsgesetz 10.03.2025 (Eintragungsdatum)\n\nLeichtathletik-Verband Rheinland e.V. (LVR)\neingetragener Verein\nKoblenz\n\nAls nicht eingetragen wird veröffentlicht: Den Gläubigern der an der Verschmelzung beteiligten Rechtsträger ist, wenn sie binnen sechs Monaten nach dem Tag, an dem die Eintragung der Verschmelzung in das Register des Sitzes desjenigen Rechtsträgers,dessen Gläubiger sie sind, nach § 19 Abs. 3 UmwG als bekannt gemacht gilt, ihren Anspruch nach Grund und Höhe schriftlich anmelden, Sicherheit zu leisten, soweit sie nicht Befriedigung verlangen können. Dieses Recht steht den Gläubigern jedoch nur zu, wenn sie glaubhaft machen, dass durch die Verschmelzung die Erfüllungd er Forderung gefährdet wird."
    },
    {
      "date": "2025-03-10",
      "id": "103315",
      "original_text": "Einreichung neuer Dokumente\nRheinland-Pfalz Amtsgericht Koblenz HRB 20748\nMMG Aluminium AG – Mayen",
      "type": "Einreichung neuer Dokumente",
      "state": "Rheinland-Pfalz",
      "amtsgericht": "Amtsgericht Koblenz",
      "registernummer": "HRB 20748",
      "registerart": "HRB",
      "company_name": "MMG Aluminium AG",
      "company_seat": "Mayen",
      "details": "10.03.2025 (Bekanntmachungsdatum)\n\nRheinland-Pfalz Amtsgericht Koblenz HRB 20748\nEinreichung neuer Dokumente\n\nMMG Aluminium AG\nAktiengesellschaft\nMayen\n\nDem Registergericht ist eine neue Liste der Mitglieder des Aufsichtsrates eingereicht worden."
    },
    {
      "date": "2025-03-10",
      "id": "103316",
      "original_text": "Registerbekanntmachung nach dem Umwandlungsgesetz\nRheinland-Pfalz Amtsgericht Wittlich HRB 3974\nclean rex Hundehygiene AG – Trier",
      "type": "Registerbekanntmachung nach dem Umwandlungsgesetz",
      "state": "Rheinland-Pfalz",
      "amtsgericht": "Amtsgericht Wittlich",
      "registernummer": "HRB 3974",
      "registerart": "HRB",
      "company_name": "clean rex Hundehygiene AG",
      "company_seat": "Trier",
      "details": "10.03.2025 (Bekanntmachungsdatum)\n\nRheinland-Pfalz Amtsgericht Wittlich HRB 3974\nRegisterbekanntmachung nach dem Umwandlungsgesetz 10.03.2025 (Eintragungsdatum)\n\nclean rex Hundehygiene AG\nAktiengesellschaft\nTrier\n\nAls nicht eingetragen wird veröffentlicht: Den Gläubigern der an der Verschmelzung beteiligten Rechtsträger ist, wenn sie binnen sechs Monaten nach dem Tag, an dem die Eintragung der Verschmelzung in das Register des Sitzes desjenigen Rechtsträgers, dessen Gläubiger sie sind, nach § 19 Abs. 3 UmwG als bekannt gemacht gilt, ihren Anspruch nach Grund und Höhe schriftlich anmelden, Sicherheit zu leisten, soweit sie nicht Befriedigung verlangen können. Dieses Recht steht den Gläubigern jedoch nur zu, wenn sie glaubhaft machen, dass durch die Verschmelzung die Erfüllung der Forderung gefährdet wird."
    },
    {
      "date": "2025-03-10",
      "id": "103317",
      "original_text": "Löschungsankündigung\nBremen Amtsgericht Bremen HRB 3402\nMüller & Sohn Beteiligungsgesellschaft mit beschränkter Haftung – Bremen",
      "type": "Löschungsankündigung",
      "state": "Bremen",
      "amtsgericht": "Amtsgericht Bremen",
      "registernummer": "HRB 3402",
      "registerart": "HRB",
      "company_name": "Müller & Sohn Beteiligungsgesellschaft mit beschränkter Haftung",
      "company_seat": "Bremen",
      "details": "10.03.2025 (Bekanntmachungsdatum)\n\nBremen Amtsgericht Bremen HRB 3402\nLöschungsankündigung\n\nMüller & Sohn Beteiligungsgesellschaft mit beschränkter Haftung\nGesellschaft mit beschränkter Haftung\nBremen\n\nEs ist beabsichtigt die im Handelsregister eingetragene Gesellschaft von Amts wegen gemäß § 394 FamFG zu löschen. Gegen die Löschung kann beim AG Bremen schriftlich oder zu Protokoll der Geschäftsstelle Widerspruch eingelegt werden. Widerspruchsfrist 4 Wochen."
    },
    {
      "date": "2025-03-10",
      "id": "103318",
      "original_text": "Löschungsankündigung\nBremen Amtsgericht Bremen HRA 29171\nCINC O Fairmietergemeinschaft GmbH & Co. KG – Bremen",
      "type": "Löschungsankündigung",
      "state": "Bremen",
      "amtsgericht": "Amtsgericht Bremen",
      "registernummer": "HRA 29171",
      "registerart": "HRA",
      "company_name": "CINC O Fairmietergemeinschaft GmbH & Co. KG",
      "company_seat": "Bremen",
      "details": "10.03.2025 (Bekanntmachungsdatum)\n\nBremen Amtsgericht Bremen HRA 29171\nLöschungsankündigung\n\nCINC O Fairmietergemeinschaft GmbH & Co. KG\nKommanditgesellschaft\nBremen\n\nEs ist beabsichtigt die im Handelsregister eingetragene Gesellschaft von Amts wegen gemäß § 394 FamFG zu löschen. Gegen die Löschung kann beim AG Bremen schriftlich oder zu Protokoll der Geschäftsstelle Widerspruch eingelegt werden. Widerspruchsfrist 4 Wochen."
    },
    {
      "date": "2025-03-10",
      "id": "103319",
      "original_text": "Löschungsankündigung\nBremen Amtsgericht Bremen HRA 29212\nCP Hückelhoven GmbH & Co. KG – Bremen",
      "type": "Löschungsankündigung",
      "state": "Bremen",
      "amtsgericht": "Amtsgericht Bremen",
      "registernummer": "HRA 29212",
      "registerart": "HRA",
      "company_name": "CP Hückelhoven GmbH & Co. KG",
      "company_seat": "Bremen",
      "details": "10.03.2025 (Bekanntmachungsdatum)\n\nBremen Amtsgericht Bremen HRA 29212\nLöschungsankündigung\n\nCP Hückelhoven GmbH & Co. KG\nKommanditgesellschaft\nBremen\n\nEs ist beabsichtigt die im Handelsregister eingetragene Firma von Amts wegen gemäß § 31 Abs.2 HGB zu löschen. Gegen die Löschung kann beim AG Bremen schriftlich oder zu Protokoll der Geschäftsstelle Widerspruch eingelegt werden. Widerspruchsfrist 4 Wochen."
    },
    {
      "date": "2025-03-10",
      "id": "103320",
      "original_text": "Löschungsankündigung\nNordrhein-Westfalen Amtsgericht Aachen HRB 18760\nInvesta Novex UG (haftungsbeschränkt) – Stolberg",
      "type": "Löschungsankündigung",
      "state": "Nordrhein-Westfalen",
      "amtsgericht": "Amtsgericht Aachen",
      "registernummer": "HRB 18760",
      "registerart": "HRB",
      "company_name": "Investa Novex UG (haftungsbeschränkt)",
      "company_seat": "Stolberg",
      "details": "10.03.2025 (Bekanntmachungsdatum)\n\nNordrhein-Westfalen Amtsgericht Aachen HRB 18760\nLöschungsankündigung\n\nInvesta Novex UG (haftungsbeschränkt)\nGesellschaft mit beschränkter Haftung\nStolberg\n\nDas Registergericht beabsichtigt, von Amts wegen die Gesellschaft wegen Vermögenslosigkeit nach § 394 FamFG zu löschen,  weil das Finanzamt  Aachen-Kreis         mit Schreiben vom  26.02.2025 Umstände mitgeteilt hat, aufgrund derer das Gericht davon überzeugt ist, dass die Gesellschaft vollständig vermögenslos ist. Zur Geltendmachung des Widerspruchs gegen die beabsichtigte Löschung wird hiermit eine Frist von einem Monat ab Veröffentlichung dieser Ankündigung bestimmt. Rechtsbehelfsbelehrung: Gegen diese Verfügung kann Widerspruch eingelegt werden. Zum Widerspruch ist jeder berechtigt, der an der Unterlassung der Löschung ein berechtigtes Interesse hat.Der Widerspruch ist bei dem Amtsgericht Aachen, Adalbertsteinweg 92, 52070 Aachen schriftlich in deutscher Sprache oder zur Niederschrift der Geschäftsstelle einzulegen. Der Widerspruch kann auch zur Niederschrift der Geschäftsstelle eines jeden Amtsgerichtes abgegeben werden. Der Widerspruch muss spätestens innerhalb der gesetzten Frist nach der Bekanntgabe der Verfügung bei dem Amtsgericht Aachen eingegangen sein. Dies gilt auch dann, wenn der Widerspruch zur Niederschrift der Geschäftsstelle eines anderen Amtsgerichtes abgegeben wurde. Die Frist beginnt mit der Bekanntgabe der Verfügung durch Veröffentlichung. Fällt das Ende der Frist auf einen Sonntag, einen allgemeinen Feiertag oder Sonnabend, so endet die Frist mit Ablauf des nächsten Werktages. Der Widerspruch muss die Bezeichnung der angefochtenen Verfügung sowie die Erklärung enthalten, dass Widerspruch gegen diese Verfügung eingelegt wird. Er ist zu unterzeichnen und soll begründet werden.Die Einlegung ist auch durch Übertragung eines elektronischen Dokuments an die elektronische Poststelle des Gerichts möglich. Das elektronische Dokument muss für die Bearbeitung durch das Gericht geeignet und mit einer qualifizierten elektronischen Signatur der verantwortenden Person versehen sein oder von der verantwortenden Person signiert und auf einem sicheren Übermittlungsweg gemäß § 130 a ZPO nach näherer Maßgabe der Verordnung über die technischen Rahmenbedingungen des elektronischen Rechtsverkehrs und über das besondere elektronische Behördenpostfach (BGBl. I, S. 3803) eingereicht werden. Weitere Informationen erhalten Sie auf der Internetseite www.justiz.de."
    },
    {
      "date": "2025-03-10",
      "id": "103321",
      "original_text": "Löschungsankündigung\nNordrhein-Westfalen Amtsgericht Bochum HRB 18407\nWeFraServ-Logistik UG (haftungsbeschränkt) – Witten",
      "type": "Löschungsankündigung",
      "state": "Nordrhein-Westfalen",
      "amtsgericht": "Amtsgericht Bochum",
      "registernummer": "HRB 18407",
      "registerart": "HRB",
      "company_name": "WeFraServ-Logistik UG (haftungsbeschränkt)",
      "company_seat": "Witten",
      "details": "10.03.2025 (Bekanntmachungsdatum)\n\nNordrhein-Westfalen Amtsgericht Bochum HRB 18407\nLöschungsankündigung\n\nWeFraServ-Logistik UG (haftungsbeschränkt)\nGesellschaft mit beschränkter Haftung\nWitten\n\nDas Registergericht beabsichtigt die Gesellschaft von Amts wegen nach § 394 FamFG zu löschen. Die Frist zur Erhebung eines Widerspruchs ist auf drei Monate festgesetzt."
    },
    {
      "date": "2025-03-10",
      "id": "103322",
      "original_text": "Einreichung neuer Dokumente\nNordrhein-Westfalen Amtsgericht Duisburg HRB 9629\nWasserwerke Dinslaken Gesellschaft mit beschränkter Haftung – Dinslaken",
      "type": "Einreichung neuer Dokumente",
      "state": "Nordrhein-Westfalen",
      "amtsgericht": "Amtsgericht Duisburg",
      "registernummer": "HRB 9629",
      "registerart": "HRB",
      "company_name": "Wasserwerke Dinslaken Gesellschaft mit beschränkter Haftung",
      "company_seat": "Dinslaken",
      "details": "10.03.2025 (Bekanntmachungsdatum)\n\nNordrhein-Westfalen Amtsgericht Duisburg HRB 9629\nEinreichung neuer Dokumente\n\nWasserwerke Dinslaken Gesellschaft mit beschränkter Haftung\nGesellschaft mit beschränkter Haftung\nDinslaken\n\nDem Registergericht ist eine Liste der Mitglieder des Aufsichtsrates eingereicht worden."
    },
    {
      "date": "2025-03-10",
      "id": "103323",
      "original_text": "Registerbekanntmachung nach dem Umwandlungsgesetz\nNordrhein-Westfalen Amtsgericht Düsseldorf HRB 92194\nMountventures GmbH – Düsseldorf",
      "type": "Registerbekanntmachung nach dem Umwandlungsgesetz",
      "state": "Nordrhein-Westfalen",
      "amtsgericht": "Amtsgericht Düsseldorf",
      "registernummer": "HRB 92194",
      "registerart": "HRB",
      "company_name": "Mountventures GmbH",
      "company_seat": "Düsseldorf",
      "details": "10.03.2025 (Bekanntmachungsdatum)\n\nNordrhein-Westfalen Amtsgericht Düsseldorf HRB 92194\nRegisterbekanntmachung nach dem Umwandlungsgesetz 10.03.2025 (Eintragungsdatum)\n\nMountventures GmbH\nGesellschaft mit beschränkter Haftung\nDüsseldorf\n\nDen Gläubigern der an der Verschmelzung beteiligten Rechtsträger ist, wenn sie binnen sechs Monaten nach dem Tag, an dem die Eintragung der Verschmelzung in das Register des Sitzes desjenigen Rechtsträgers, dessen Gläubiger sie sind, nach § 19 Absatz 3 UmwG als bekanntgemacht gilt, ihren Anspruch nach Grund und Höhe schriftlich anmelden, Sicherheit zu leisten, soweit sie nicht Befriedigung verlangen können. Dieses Recht steht den Gläubigern jedoch nur zu, wenn sie glaubhaft machen, dass durch die Verschmelzung die Erfüllung ihrer Forderung gefährdet wird."
    },
    {
      "date": "2025-03-10",
      "id": "103324",
      "original_text": "Löschungsankündigung\nNordrhein-Westfalen Amtsgericht Dortmund HRB 33955\nS&M Holz- & Bautenschutz UG (haftungsbeschränkt) – Dortmund",
      "type": "Löschungsankündigung",
      "state": "Nordrhein-Westfalen",
      "amtsgericht": "Amtsgericht Dortmund",
      "registernummer": "HRB 33955",
      "registerart": "HRB",
      "company_name": "S&M Holz- & Bautenschutz UG (haftungsbeschränkt)",
      "company_seat": "Dortmund",
      "details": "10.03.2025 (Bekanntmachungsdatum)\n\nNordrhein-Westfalen Amtsgericht Dortmund HRB 33955\nLöschungsankündigung\n\nS&M Holz- & Bautenschutz UG (haftungsbeschränkt)\nGesellschaft mit beschränkter Haftung\nDortmund\n\nDas Registergericht beabsichtigt die Gesellschaft von Amts wegen nach § 394 FamFG zu löschen. Die Frist zur Erhebung eines Widerspruchs ist auf zwei Monate festgesetzt."
    },
    {
      "date": "2025-03-10",
      "id": "103325",
      "original_text": "Löschungsankündigung\nNordrhein-Westfalen Amtsgericht Dortmund HRB 31160\nWolf Gastronomie UG (haftungsbeschränkt) – Dortmund",
      "type": "Löschungsankündigung",
      "state": "Nordrhein-Westfalen",
      "amtsgericht": "Amtsgericht Dortmund",
      "registernummer": "HRB 31160",
      "registerart": "HRB",
      "company_name": "Wolf Gastronomie UG (haftungsbeschränkt)",
      "company_seat": "Dortmund",
      "details": "10.03.2025 (Bekanntmachungsdatum)\n\nNordrhein-Westfalen Amtsgericht Dortmund HRB 31160\nLöschungsankündigung\n\nWolf Gastronomie UG (haftungsbeschränkt)\nGesellschaft mit beschränkter Haftung\nDortmund\n\nDas Registergericht beabsichtigt die Gesellschaft von Amts wegen nach § 394 FamFG zu löschen. Die Frist zur Erhebung eines Widerspruchs ist auf zwei Monate festgesetzt."
    },
    {
      "date": "2025-03-10",
      "id": "103326",
      "original_text": "Einreichung neuer Dokumente\nNordrhein-Westfalen Amtsgericht Köln HRB 49892\nCovestro Deutschland AG – Leverkusen",
      "type": "Einreichung neuer Dokumente",
      "state": "Nordrhein-Westfalen",
      "amtsgericht": "Amtsgericht Köln",
      "registernummer": "HRB 49892",
      "registerart": "HRB",
      "company_name": "Covestro Deutschland AG",
      "company_seat": "Leverkusen",
      "details": "10.03.2025 (Bekanntmachungsdatum)\n\nNordrhein-Westfalen Amtsgericht Köln HRB 49892\nEinreichung neuer Dokumente\n\nCovestro Deutschland AG\nAktiengesellschaft\nLeverkusen\n\nDem Registergericht ist eine Liste der Mitglieder des Aufsichtsrates eingereicht worden."
    },
    {
      "date": "2025-03-10",
      "id": "103327",
      "original_text": "Löschungsankündigung\nNordrhein-Westfalen Amtsgericht Münster HRB 9530\nSanitop-Wingenroth Verwaltungs GmbH – Warendorf",
      "type": "Löschungsankündigung",
      "state": "Nordrhein-Westfalen",
      "amtsgericht": "Amtsgericht Münster",
      "registernummer": "HRB 9530",
      "registerart": "HRB",
      "company_name": "Sanitop-Wingenroth Verwaltungs GmbH",
      "company_seat": "Warendorf",
      "details": "10.03.2025 (Bekanntmachungsdatum)\n\nNordrhein-Westfalen Amtsgericht Münster HRB 9530\nLöschungsankündigung\n\nSanitop-Wingenroth Verwaltungs GmbH\nGesellschaft mit beschränkter Haftung\nWarendorf\n\nDas Registergericht beabsichtigt die Gesellschaft von Amts wegen nach § 394 FamFG zu löschen. Die Frist zur Erhebung eines Widerspruchs ist auf Drei Wochen festgesetzt."
    },
    {
      "date": "2025-03-10",
      "id": "103328",
      "original_text": "Löschungsankündigung\nNordrhein-Westfalen Amtsgericht Bad Oeynhausen HRB 12743\nMH Direktbau VerwaltungsGmbH – Löhne",
      "type": "Löschungsankündigung",
      "state": "Nordrhein-Westfalen",
      "amtsgericht": "Amtsgericht Bad Oeynhausen",
      "registernummer": "HRB 12743",
      "registerart": "HRB",
      "company_name": "MH Direktbau VerwaltungsGmbH",
      "company_seat": "Löhne",
      "details": "10.03.2025 (Bekanntmachungsdatum)\n\nNordrhein-Westfalen Amtsgericht Bad Oeynhausen HRB 12743\nLöschungsankündigung\n\nMH Direktbau VerwaltungsGmbH\nGesellschaft mit beschränkter Haftung\nLöhne\n\nDas Registergericht beabsichtigt die Gesellschaft von Amts wegen nach § 394 FamFG zu löschen. Die Frist zur Erhebung eines Widerspruchs ist auf einen Monat festgesetzt."
    },
    {
      "date": "2025-03-10",
      "id": "103329",
      "original_text": "Registerbekanntmachung nach dem Umwandlungsgesetz\nNordrhein-Westfalen Amtsgericht Arnsberg GsR 334\nSchnier & Voss eGbR – Meschede",
      "type": "Registerbekanntmachung nach dem Umwandlungsgesetz",
      "state": "Nordrhein-Westfalen",
      "amtsgericht": "Amtsgericht Arnsberg",
      "registernummer": "GsR 334",
      "registerart": "GsR",
      "company_name": "Schnier & Voss eGbR",
      "company_seat": "Meschede",
      "details": "10.03.2025 (Bekanntmachungsdatum)\n\nNordrhein-Westfalen Amtsgericht Arnsberg GsR 334\nRegisterbekanntmachung nach dem Umwandlungsgesetz 10.03.2025 (Eintragungsdatum)\n\nSchnier & Voss eGbR\nGesellschaft bürgerlichen Rechts\nMeschede\n\nDen Gläubigern der an der formwechselnden Umwandlung beteiligten Rechtsträger ist, wenn sie binnen sechs Monaten nach dem Tag, an dem die Eintragung der formwechselnden Umwandlung in das Register des Sitzes derjenigen Rechtsträger deren Gläubiger sie sind, nach § 19 Absatz 3 UmwG als bekanntgemacht gilt, ihren Anspruch nach Grund und Höhe schriftlich anmelden, Sicherheit zu leisten, soweit sie nicht Befriedigung verlangen können. Dieses Recht steht den Gläubigern jedoch nur zu, wenn sie glaubhaft machen, dass durch die formwechselnden Umwandlung die Erfüllung ihrer Forderung gefährdet wird."
    },
    {
      "date": "2025-03-10",
      "id": "103330",
      "original_text": "Löschungsankündigung\nNordrhein-Westfalen Amtsgericht Duisburg HRB 34399\nLogo Trockenbau GmbH – Oberhausen",
      "type": "Löschungsankündigung",
      "state": "Nordrhein-Westfalen",
      "amtsgericht": "Amtsgericht Duisburg",
      "registernummer": "HRB 34399",
      "registerart": "HRB",
      "company_name": "Logo Trockenbau GmbH",
      "company_seat": "Oberhausen",
      "details": "10.03.2025 (Bekanntmachungsdatum)\n\nNordrhein-Westfalen Amtsgericht Duisburg HRB 34399\nLöschungsankündigung 10.03.2025 (Eintragungsdatum)\n\nLogo Trockenbau GmbH\nGesellschaft mit beschränkter Haftung\nOberhausen\n\nHRB 34399:\nLogo Trockenbau GmbH, Oberhausen\nBrücktorstraße 61, 46045 Oberhausen.\nDas Registergericht beabsichtigt, die im Handelsregister eingetragene Gesellschaft gemäß § 394 FamFG wegen Vermögenslosigkeit von Amts wegen zu löschen. Gegen diese Verfügung kann Widerspruch eingelegt werden. Die Frist zur Erhebung eines Widerspruchs gegen die beabsichtigte Löschung von Amts wegen ist auf drei Monate festgesetzt. Rechtsbehelfsbelehrung Der Widerspruch ist bei dem Amtsgericht Duisburg, Kardinal-Galen-Str. 124-132, 47058 Duisburg schriftlich in deutscher Sprache oder zur Niederschrift der Geschäftsstelle einzulegen. Der Widerspruch kann auch zur Niederschrift der Geschäftsstelle eines jeden Amtsgerichtes abgegeben werden. Die Einlegung ist auch durch Übertragung eines elektronischen Dokuments an die elektronische Poststelle des Gerichts möglich. Das elektronische Dokument muss für die Bearbeitung durch das Gericht geeignet und mit einer qualifizierten elektronischen Signatur der verantwortenden Person versehen sein oder von der verantwortenden Person signiert und auf einem sicheren Übermittlungsweg gemäß § 130 a ZPO nach näherer Maßgabe der Verordnung über die technischen Rahmenbedingungen des elektronischen Rechtsverkehrs und über das besondere elektronische Behördenpostfach (BGBl. I, S. 3803) eingereicht werden. Weitere Informationen erhalten Sie auf der Internetseite www.justiz.de <http://www.justiz.de>. Der Widerspruch muss spätestens innerhalb der gesetzten Frist bei dem Amtsgericht Duisburg eingegangen sein. Dies gilt auch dann, wenn der Widerspruch zur Niederschrift der Geschäftsstelle eines anderen Amtsgerichtes abgegeben wurde. Die Frist beginnt mit der Veröffentlichung. Fällt das Ende der Frist auf einen Sonntag, einen allgemeinen Feiertag oder Sonnabend, so endet die Frist mit Ablauf des nächsten Werktages. Der Widerspruch muss die Bezeichnung der angefochtenen Verfügung sowie die Erklärung enthalten, dass Widerspruch gegen diese Verfügung eingelegt wird. Er ist zu unterzeichnen und soll begründet werden."
    },
    {
      "date": "2025-03-10",
      "id": "103331",
      "original_text": "Registerbekanntmachung nach dem Umwandlungsgesetz\nNordrhein-Westfalen Amtsgericht Duisburg HRB 15064\nFamilie Julius Thyssen Verwaltungsgesellschaft mbH – Mülheim an der Ruhr",
      "type": "Registerbekanntmachung nach dem Umwandlungsgesetz",
      "state": "Nordrhein-Westfalen",
      "amtsgericht": "Amtsgericht Duisburg",
      "registernummer": "HRB 15064",
      "registerart": "HRB",
      "company_name": "Familie Julius Thyssen Verwaltungsgesellschaft mbH",
      "company_seat": "Mülheim an der Ruhr",
      "details": "10.03.2025 (Bekanntmachungsdatum)\n\nNordrhein-Westfalen Amtsgericht Duisburg HRB 15064\nRegisterbekanntmachung nach dem Umwandlungsgesetz 10.03.2025 (Eintragungsdatum)\n\nFamilie Julius Thyssen Verwaltungsgesellschaft mbH\nGesellschaft mit beschränkter Haftung\nMülheim an der Ruhr\n\nDie Gesellschaft hat Gläubigern, deren Forderungen vor dieser Bekanntmachung begründet worden sind, Sicherheit zu leisten, soweit sie nicht Befriedigung verlangen können, wenn sie sich binnen sechs Monaten zu diesem Zweck melden."
    },
    {
      "date": "2025-03-10",
      "id": "103332",
      "original_text": "Löschungsankündigung\nNordrhein-Westfalen Amtsgericht Bochum HRB 18277\nArmeda Immobilien GmbH – Witten",
      "type": "Löschungsankündigung",
      "state": "Nordrhein-Westfalen",
      "amtsgericht": "Amtsgericht Bochum",
      "registernummer": "HRB 18277",
      "registerart": "HRB",
      "company_name": "Armeda Immobilien GmbH",
      "company_seat": "Witten",
      "details": "10.03.2025 (Bekanntmachungsdatum)\n\nNordrhein-Westfalen Amtsgericht Bochum HRB 18277\nLöschungsankündigung\n\nArmeda Immobilien GmbH\nGesellschaft mit beschränkter Haftung\nWitten\n\nDas Registergericht beabsichtigt die Gesellschaft von Amts wegen nach § 394 FamFG zu löschen. Die Frist zur Erhebung eines Widerspruchs ist auf drei Monate festgesetzt."
    },
    {
      "date": "2025-03-10",
      "id": "103333",
      "original_text": "Registerbekanntmachung nach dem Umwandlungsgesetz\nNordrhein-Westfalen Amtsgericht Hagen HRA 6594\nTCND e.Kfr. – Schwelm",
      "type": "Registerbekanntmachung nach dem Umwandlungsgesetz",
      "state": "Nordrhein-Westfalen",
      "amtsgericht": "Amtsgericht Hagen",
      "registernummer": "HRA 6594",
      "registerart": "HRA",
      "company_name": "TCND e.Kfr.",
      "company_seat": "Schwelm",
      "details": "10.03.2025 (Bekanntmachungsdatum)\n\nNordrhein-Westfalen Amtsgericht Hagen HRA 6594\nRegisterbekanntmachung nach dem Umwandlungsgesetz 10.03.2025 (Eintragungsdatum)\n\nTCND e.Kfr.\nEinzelkaufmann / Einzelkauffrau\nSchwelm\n\nDen Gläubigern der an der Ausgliederung beteiligten Rechtsträger ist, wenn sie binnen sechs Monaten nach dem Tag, an dem die Eintragung der Ausgliederung in das Register des Sitzes derjenigen Rechtsträger deren Gläubiger sie sind, nach § 19 Absatz 3 UmwG als bekanntgemacht gilt, ihren Anspruch nach Grund und Höhe schriftlich anmelden, Sicherheit zu leisten, soweit sie nicht Befriedigung verlangen können. Dieses Recht steht den Gläubigern jedoch nur zu, wenn sie glaubhaft machen, dass durch die Ausgliederung die Erfüllung ihrer Forderung gefährdet wird."
    },
    {
      "date": "2025-03-10",
      "id": "103334",
      "original_text": "Registerbekanntmachung nach dem Umwandlungsgesetz\nNordrhein-Westfalen Amtsgericht Düsseldorf HRB 104393\nAccelerate Bidco 2 GmbH – Düsseldorf",
      "type": "Registerbekanntmachung nach dem Umwandlungsgesetz",
      "state": "Nordrhein-Westfalen",
      "amtsgericht": "Amtsgericht Düsseldorf",
      "registernummer": "HRB 104393",
      "registerart": "HRB",
      "company_name": "Accelerate Bidco 2 GmbH",
      "company_seat": "Düsseldorf",
      "details": "10.03.2025 (Bekanntmachungsdatum)\n\nNordrhein-Westfalen Amtsgericht Düsseldorf HRB 104393\nRegisterbekanntmachung nach dem Umwandlungsgesetz 10.03.2025 (Eintragungsdatum)\n\nAccelerate Bidco 2 GmbH\nGesellschaft mit beschränkter Haftung\nDüsseldorf\n\nDen Gläubigern der an der Verschmelzung beteiligten Rechtsträger ist, wenn sie binnen sechs Monaten nach dem Tag, an dem die Eintragung der Verschmelzung in das Register des Sitzes desjenigen Rechtsträgers, dessen Gläubiger sie sind, nach § 19 Absatz 3 UmwG als bekanntgemacht gilt, ihren Anspruch nach Grund und Höhe schriftlich anmelden, Sicherheit zu leisten, soweit sie nicht Befriedigung verlangen können. Dieses Recht steht den Gläubigern jedoch nur zu, wenn sie glaubhaft machen, dass durch die Verschmelzung die Erfüllung ihrer Forderung gefährdet wird."
    },
    {
      "date": "2025-03-10",
      "id": "103335",
      "original_text": "Registerbekanntmachung nach dem Umwandlungsgesetz\nNordrhein-Westfalen Amtsgericht Duisburg HRB 16114\nFJT Familie Nette Verwaltungsgesellschaft mbH – Mülheim an der Ruhr",
      "type": "Registerbekanntmachung nach dem Umwandlungsgesetz",
      "state": "Nordrhein-Westfalen",
      "amtsgericht": "Amtsgericht Duisburg",
      "registernummer": "HRB 16114",
      "registerart": "HRB",
      "company_name": "FJT Familie Nette Verwaltungsgesellschaft mbH",
      "company_seat": "Mülheim an der Ruhr",
      "details": "10.03.2025 (Bekanntmachungsdatum)\n\nNordrhein-Westfalen Amtsgericht Duisburg HRB 16114\nRegisterbekanntmachung nach dem Umwandlungsgesetz 10.03.2025 (Eintragungsdatum)\n\nFJT Familie Nette Verwaltungsgesellschaft mbH\nGesellschaft mit beschränkter Haftung\nMülheim an der Ruhr\n\nDie Gesellschaft hat Gläubigern, deren Forderungen vor dieser Bekanntmachung begründet worden sind, Sicherheit zu leisten, soweit sie nicht Befriedigung verlangen können, wenn sie sich binnen sechs Monaten zu diesem Zweck melden."
    },
    {
      "date": "2025-03-10",
      "id": "103336",
      "original_text": "Sonstige Registerbekanntmachung\nNordrhein-Westfalen Amtsgericht Düsseldorf HRB 81009\nFYTA Company GmbH – Düsseldorf",
      "type": "Sonstige Registerbekanntmachung",
      "state": "Nordrhein-Westfalen",
      "amtsgericht": "Amtsgericht Düsseldorf",
      "registernummer": "HRB 81009",
      "registerart": "HRB",
      "company_name": "FYTA Company GmbH",
      "company_seat": "Düsseldorf",
      "details": "10.03.2025 (Bekanntmachungsdatum)\n\nNordrhein-Westfalen Amtsgericht Düsseldorf HRB 81009\nSonstige Registerbekanntmachung 10.03.2025 (Eintragungsdatum)\n\nFYTA Company GmbH\nGesellschaft mit beschränkter Haftung\nDüsseldorf\n\nDie Gesellschaft ist aufgelöst. Von Amts wegen eingetragen."
    },
    {
      "date": "2025-03-10",
      "id": "103337",
      "original_text": "Registerbekanntmachung nach dem Umwandlungsgesetz\nNordrhein-Westfalen Amtsgericht Hagen HRB 11911\nH-INK SWT UG (haftungsbeschränkt) – Schwerte",
      "type": "Registerbekanntmachung nach dem Umwandlungsgesetz",
      "state": "Nordrhein-Westfalen",
      "amtsgericht": "Amtsgericht Hagen",
      "registernummer": "HRB 11911",
      "registerart": "HRB",
      "company_name": "H-INK SWT UG (haftungsbeschränkt)",
      "company_seat": "Schwerte",
      "details": "10.03.2025 (Bekanntmachungsdatum)\n\nNordrhein-Westfalen Amtsgericht Hagen HRB 11911\nRegisterbekanntmachung nach dem Umwandlungsgesetz 10.03.2025 (Eintragungsdatum)\n\nH-INK SWT UG (haftungsbeschränkt)\nGesellschaft mit beschränkter Haftung\nSchwerte\n\nDen Gläubigern der an der Verschmelzung beteiligten Rechtsträger ist, wenn sie binnen sechs Monaten nach dem Tag, an dem die Eintragung der Verschmelzung in das Register des Sitzes desjenigen Rechtsträgers, dessen Gläubiger sie sind, nach § 19 Abs. 3 UmwG als bekannt gemacht gilt, ihren Anspruch nach Grund und Höhe schriftlich anmelden, Sicherheit zu leisten, soweit sie nicht Befriedigung verlangen können. Dieses Recht steht ihnen jedoch nur zu, wenn sie glaubhaft machen, dass durch die Verschmelzung die Erfüllung ihrer Forderung gefährdet wird."
    },
    {
      "date": "2025-03-10",
      "id": "103338",
      "original_text": "Sonstige Registerbekanntmachung\nNordrhein-Westfalen Amtsgericht Düsseldorf HRB 82441\nModivation Holding GmbH – Ratingen",
      "type": "Sonstige Registerbekanntmachung",
      "state": "Nordrhein-Westfalen",
      "amtsgericht": "Amtsgericht Düsseldorf",
      "registernummer": "HRB 82441",
      "registerart": "HRB",
      "company_name": "Modivation Holding GmbH",
      "company_seat": "Ratingen",
      "details": "10.03.2025 (Bekanntmachungsdatum)\n\nNordrhein-Westfalen Amtsgericht Düsseldorf HRB 82441\nSonstige Registerbekanntmachung 10.03.2025 (Eintragungsdatum)\n\nModivation Holding GmbH\nGesellschaft mit beschränkter Haftung\nRatingen\n\nDie Gesellschaft ist aufgelöst. Von Amts wegen eingetragen."
    },
    {
      "date": "2025-03-10",
      "id": "103339",
      "original_text": "Einreichung neuer Dokumente\nNordrhein-Westfalen Amtsgericht Bonn HRB 18384\nDeutsche Gesellschaft für Internationale Zusammenarbeit (GIZ) GmbH – Bonn und Eschborn",
      "type": "Einreichung neuer Dokumente",
      "state": "Nordrhein-Westfalen",
      "amtsgericht": "Amtsgericht Bonn",
      "registernummer": "HRB 18384",
      "registerart": "HRB",
      "company_name": "Deutsche Gesellschaft für Internationale Zusammenarbeit (GIZ) GmbH",
      "company_seat": "Bonn und Eschborn",
      "details": "10.03.2025 (Bekanntmachungsdatum)\n\nNordrhein-Westfalen Amtsgericht Bonn HRB 18384\nEinreichung neuer Dokumente 10.03.2025 (Eintragungsdatum)\n\nDeutsche Gesellschaft für Internationale Zusammenarbeit (GIZ) GmbH\nGesellschaft mit beschränkter Haftung\nBonn und Eschborn\n\nDem Registergericht ist eine neue Liste der Mitglieder des Aufsichtsrates eingereicht worden."
    },
    {
      "date": "2025-03-10",
      "id": "103340",
      "original_text": "Löschungsankündigung\nNordrhein-Westfalen Amtsgericht Mönchengladbach HRB 17782\nCytowake Germany GmbH – Mönchengladbach",
      "type": "Löschungsankündigung",
      "state": "Nordrhein-Westfalen",
      "amtsgericht": "Amtsgericht Mönchengladbach",
      "registernummer": "HRB 17782",
      "registerart": "HRB",
      "company_name": "Cytowake Germany GmbH",
      "company_seat": "Mönchengladbach",
      "details": "10.03.2025 (Bekanntmachungsdatum)\n\nNordrhein-Westfalen Amtsgericht Mönchengladbach HRB 17782\nLöschungsankündigung\n\nCytowake Germany GmbH\nGesellschaft mit beschränkter Haftung\nMönchengladbach\n\nDas Registergericht beabsichtigt, die im Handelsregister eingetragene Gesellschaft gemäß § 394 Absatz 1 FamFG wegen Vermögenslosigkeit von Amts wegen zu löschen. Gegen diese Verfügung kann Widerspruch eingelegt werden. Die Frist zur Erhebung eines Widerspruchs gegen die beabsichtigte Löschung von Amts wegen ist auf drei Monate festgesetzt."
    },
    {
      "date": "2025-03-10",
      "id": "103341",
      "original_text": "Löschungsankündigung\nNordrhein-Westfalen Amtsgericht Gelsenkirchen HRA 2456\nBuchhandlung Horst Erlenkämper, Inhaber Ralf Becker – Bottrop",
      "type": "Löschungsankündigung",
      "state": "Nordrhein-Westfalen",
      "amtsgericht": "Amtsgericht Gelsenkirchen",
      "registernummer": "HRA 2456",
      "registerart": "HRA",
      "company_name": "Buchhandlung Horst Erlenkämper, Inhaber Ralf Becker",
      "company_seat": "Bottrop",
      "details": "10.03.2025 (Bekanntmachungsdatum)\n\nNordrhein-Westfalen Amtsgericht Gelsenkirchen HRA 2456\nLöschungsankündigung\n\nBuchhandlung Horst Erlenkämper, Inhaber Ralf Becker\nEinzelkaufmann / Einzelkauffrau\nBottrop\n\nDas Registergericht beabsichtigt die Firma von Amts wegen nach § 31 Abs. 2 HGB, § 393 FamFG zu löschen. Die Frist zur Erhebung eines Widerspruchs ist auf einen Monat festgesetzt.\n\nRechtsbehelfsbelehrung:\n\nGegen diese Verfügung kann Widerspruch eingelegt werden.\n\nDer Widerspruch ist bei dem Amtsgericht Gelsenkirchen, Bochumer Straße 79, 45886 Gelsenkirchen schriftlich in deutscher Sprache oder zur Niederschrift der Geschäftsstelle einzulegen. Der Widerspruch kann auch zur Niederschrift der Geschäftsstelle eines jeden Amtsgerichtes abgegeben werden.\n\nDer Widerspruch muss spätestens innerhalb der gesetzten Frist bei dem Amtsgericht Gelsenkirchen eingegangen sein. Dies gilt auch dann, wenn der Widerspruch zur Niederschrift der Geschäftsstelle eines anderen Amtsgerichtes abgegeben wurde. Die Frist beginnt mit der Veröffentlichung. Fällt das Ende der Frist auf einen Sonntag, einen allgemeinen Feiertag oder Sonnabend, so endet die Frist mit Ablauf des nächsten Werktages.\n\nDer Widerspruch muss die Bezeichnung der angefochtenen Verfügung sowie die Erklärung enthalten, dass Widerspruch gegen diese Verfügung eingelegt wird. Er ist zu unterzeichnen und soll begründet werden.\n\nHinweis zum elektronischen Rechtsverkehr:\nDie Einlegung ist auch durch Übertragung eines elektronischen Dokuments an die elektronische Poststelle des Gerichts möglich. Das elektronische Dokument muss für die Bearbeitung durch das Gericht geeignet und mit einer qualifizierten elektronischen Signatur der verantwortenden Person versehen sein oder von der verantwortenden Person signiert und auf einem sicheren Übermittlungsweg gemäß § 130a ZPO nach näherer Maßgabe der Verordnung über die technischen Rahmenbedingungen des elektronischen Rechtsverkehrs und über das besondere elektronische Behördenpostfach (BGBl. 2017 I, S. 3803) eingereicht werden. Auf die Pflicht zur elektronischen Einreichung durch professionelle Einreicher/innen ab dem 01.01.2022 durch das Gesetz zum Ausbau des elektronischen Rechtsverkehrs mit den Gerichten vom 10. Oktober 2013, das Gesetz zur Einführung der elektronischen Akte in der Justiz und zur weiteren Förderung des elektronischen Rechtsverkehrs vom 5. Juli 2017 und das Gesetz zum Ausbau des elektronischen Rechtsverkehrs mit den Gerichten und zur Änderung weiterer Vorschriften vom 05.10.2021 wird hingewiesen.\nWeitere Informationen erhalten Sie auf der Internetseite www.justiz.de."
    },
    {
      "date": "2025-03-10",
      "id": "103342",
      "original_text": "Löschungsankündigung\nNordrhein-Westfalen Amtsgericht Düren HRB 8824\nDarber GmbH – Düren",
      "type": "Löschungsankündigung",
      "state": "Nordrhein-Westfalen",
      "amtsgericht": "Amtsgericht Düren",
      "registernummer": "HRB 8824",
      "registerart": "HRB",
      "company_name": "Darber GmbH",
      "company_seat": "Düren",
      "details": "10.03.2025 (Bekanntmachungsdatum)\n\nNordrhein-Westfalen Amtsgericht Düren HRB 8824\nLöschungsankündigung\n\nDarber GmbH\nGesellschaft mit beschränkter Haftung\nDüren\n\nDas Registergericht beabsichtigt die Gesellschaft von Amts wegen nach § 394 FamFG zu löschen. Die Frist zur Erhebung eines Widerspruchs ist auf drei Monate festgesetzt."
    },
    {
      "date": "2025-03-10",
      "id": "103343",
      "original_text": "Registerbekanntmachung nach dem Umwandlungsgesetz\nNordrhein-Westfalen Amtsgericht Münster HRB 22288\nfinstreet GmbH – Münster",
      "type": "Registerbekanntmachung nach dem Umwandlungsgesetz",
      "state": "Nordrhein-Westfalen",
      "amtsgericht": "Amtsgericht Münster",
      "registernummer": "HRB 22288",
      "registerart": "HRB",
      "company_name": "finstreet GmbH",
      "company_seat": "Münster",
      "details": "10.03.2025 (Bekanntmachungsdatum)\n\nNordrhein-Westfalen Amtsgericht Münster HRB 22288\nRegisterbekanntmachung nach dem Umwandlungsgesetz 10.03.2025 (Eintragungsdatum)\n\nfinstreet GmbH\nGesellschaft mit beschränkter Haftung\nMünster\n\nDen Gläubigern der an der Abspaltung beteiligten Rechtsträger ist, wenn sie binnen sechs Monaten nach dem Tag, an dem die Eintragung der Abspaltung in das Register des Sitzes desjenigen Rechtsträgers, dessen Gläubiger sie sind, nach § 19 Absatz 3 UmwG als bekanntgemacht gilt, ihren Anspruch nach Grund und Höhe schriftlich anmelden, Sicherheit zu leisten, soweit sie nicht Befriedigung verlangen können. Dieses Recht steht den Gläubigern jedoch nur zu, wenn sie glaubhaft machen, dass durch die Abspaltung die Erfüllung ihrer Forderung gefährdet wird."
    },
    {
      "date": "2025-03-10",
      "id": "103344",
      "original_text": "Registerbekanntmachung nach dem Umwandlungsgesetz\nNordrhein-Westfalen Amtsgericht Düsseldorf HRB 58338\nBrûlée GmbH – Düsseldorf",
      "type": "Registerbekanntmachung nach dem Umwandlungsgesetz",
      "state": "Nordrhein-Westfalen",
      "amtsgericht": "Amtsgericht Düsseldorf",
      "registernummer": "HRB 58338",
      "registerart": "HRB",
      "company_name": "Brûlée GmbH",
      "company_seat": "Düsseldorf",
      "details": "10.03.2025 (Bekanntmachungsdatum)\n\nNordrhein-Westfalen Amtsgericht Düsseldorf HRB 58338\nRegisterbekanntmachung nach dem Umwandlungsgesetz 10.03.2025 (Eintragungsdatum)\n\nBrûlée GmbH\nGesellschaft mit beschränkter Haftung\nDüsseldorf\n\nDen Gläubigern der an der Verschmelzung beteiligten Rechtsträger ist, wenn sie binnen sechs Monaten nach dem Tag, an dem die Eintragung der Verschmelzung in das Register des Sitzes desjenigen Rechtsträgers, dessen Gläubiger sie sind, nach § 19 Absatz 3 UmwG als bekanntgemacht gilt, ihren Anspruch nach Grund und Höhe schriftlich anmelden, Sicherheit zu leisten, soweit sie nicht Befriedigung verlangen können. Dieses Recht steht den Gläubigern jedoch nur zu, wenn sie glaubhaft machen, dass durch die Verschmelzung die Erfüllung ihrer Forderung gefährdet wird."
    },
    {
      "date": "2025-03-10",
      "id": "103345",
      "original_text": "Einreichung neuer Dokumente\nThüringen Amtsgericht Jena HRB 205234\nNetzgesellschaft Eisenberg mbH – Eisenberg",
      "type": "Einreichung neuer Dokumente",
      "state": "Thüringen",
      "amtsgericht": "Amtsgericht Jena",
      "registernummer": "HRB 205234",
      "registerart": "HRB",
      "company_name": "Netzgesellschaft Eisenberg mbH",
      "company_seat": "Eisenberg",
      "details": "10.03.2025 (Bekanntmachungsdatum)\n\nThüringen Amtsgericht Jena HRB 205234\nEinreichung neuer Dokumente 04.07.2024 (Eintragungsdatum)\n\nNetzgesellschaft Eisenberg mbH\nGesellschaft mit beschränkter Haftung\nEisenberg\n\nBekanntmachung gem. § 52 Abs. 3 Satz 2 GmbHG: Aufgrund einer Veränderung in den Personen der Aufsichtsratsmitglieder ist durch die Geschäftsführer eine neue Liste zum Handelsregister eingereicht worden."
    },
    {
      "date": "2025-03-10",
      "id": "103346",
      "original_text": "Einreichung neuer Dokumente\nThüringen Amtsgericht Jena HRB 502474\nBHE Bioheizkraftwerk Eisenberg GmbH – Eisenberg",
      "type": "Einreichung neuer Dokumente",
      "state": "Thüringen",
      "amtsgericht": "Amtsgericht Jena",
      "registernummer": "HRB 502474",
      "registerart": "HRB",
      "company_name": "BHE Bioheizkraftwerk Eisenberg GmbH",
      "company_seat": "Eisenberg",
      "details": "10.03.2025 (Bekanntmachungsdatum)\n\nThüringen Amtsgericht Jena HRB 502474\nEinreichung neuer Dokumente 19.02.2025 (Eintragungsdatum)\n\nBHE Bioheizkraftwerk Eisenberg GmbH\nGesellschaft mit beschränkter Haftung\nEisenberg\n\nBekanntmachung gem. § 52 Abs. 3 Satz 2 GmbHG: Aufgrund einer Veränderung in den Personen der Aufsichtsratsmitglieder ist durch die Geschäftsführer eine neue Liste zum Handelsregister eingereicht worden."
    },
    {
      "date": "2025-03-10",
      "id": "103347",
      "original_text": "Einreichung neuer Dokumente\nThüringen Amtsgericht Jena HRB 510659\nStadtwerke Eisenberg Energie GmbH – Eisenberg",
      "type": "Einreichung neuer Dokumente",
      "state": "Thüringen",
      "amtsgericht": "Amtsgericht Jena",
      "registernummer": "HRB 510659",
      "registerart": "HRB",
      "company_name": "Stadtwerke Eisenberg Energie GmbH",
      "company_seat": "Eisenberg",
      "details": "10.03.2025 (Bekanntmachungsdatum)\n\nThüringen Amtsgericht Jena HRB 510659\nEinreichung neuer Dokumente 25.11.2024 (Eintragungsdatum)\n\nStadtwerke Eisenberg Energie GmbH\nGesellschaft mit beschränkter Haftung\nEisenberg\n\nBekanntmachung gem. § 52 Abs. 3 Satz 2 GmbHG: Aufgrund einer Veränderung in den Personen der Aufsichtsratsmitglieder ist durch die Geschäftsführer eine neue Liste zum Handelsregister eingereicht worden."
    },
    {
      "date": "2025-03-10",
      "id": "103348",
      "original_text": "Registerbekanntmachung nach dem Umwandlungsgesetz\nHessen Amtsgericht Frankfurt am Main HRB 137985\nNaGa Solarpark Werbig GmbH – Frankfurt am Main",
      "type": "Registerbekanntmachung nach dem Umwandlungsgesetz",
      "state": "Hessen",
      "amtsgericht": "Amtsgericht Frankfurt am Main",
      "registernummer": "HRB 137985",
      "registerart": "HRB",
      "company_name": "NaGa Solarpark Werbig GmbH",
      "company_seat": "Frankfurt am Main",
      "details": "10.03.2025 (Bekanntmachungsdatum)\n\nHessen Amtsgericht Frankfurt am Main HRB 137985\nRegisterbekanntmachung nach dem Umwandlungsgesetz 10.03.2025 (Eintragungsdatum)\n\nNaGa Solarpark Werbig GmbH\nGesellschaft mit beschränkter Haftung\nFrankfurt am Main\n\nDen Gläubigern der an der formwechselnden Umwandlung beteiligten Rechtsträger ist, wenn sie binnen sechs Monaten nach dem Tag, an dem die Eintragung der formwechselnden Umwandlung in das Register des Sitzes derjenigen Rechtsträger deren Gläubiger sie sind, nach § 201 UmwG bekannt gemacht worden ist, ihren Anspruch nach Grund und Höhe schriftlich anmelden, Sicherheit zu leisten, soweit sie nicht Befriedigung verlangen können. Dieses Recht steht den Gläubigern jedoch nur zu, wenn sie glaubhaft machen, dass durch die formwechselnden Umwandlung die Erfüllung ihrer Forderung gefährdet wird."
    },
    {
      "date": "2025-03-10",
      "id": "103349",
      "original_text": "Registerbekanntmachung nach dem Umwandlungsgesetz\nHessen Amtsgericht Frankfurt am Main HRA 53138\nNaGa Solarpark Werbig GmbH & Co. KG – Frankfurt am Main",
      "type": "Registerbekanntmachung nach dem Umwandlungsgesetz",
      "state": "Hessen",
      "amtsgericht": "Amtsgericht Frankfurt am Main",
      "registernummer": "HRA 53138",
      "registerart": "HRA",
      "company_name": "NaGa Solarpark Werbig GmbH & Co. KG",
      "company_seat": "Frankfurt am Main",
      "details": "10.03.2025 (Bekanntmachungsdatum)\n\nHessen Amtsgericht Frankfurt am Main HRA 53138\nRegisterbekanntmachung nach dem Umwandlungsgesetz 10.03.2025 (Eintragungsdatum)\n\nNaGa Solarpark Werbig GmbH & Co. KG\nKommanditgesellschaft\nFrankfurt am Main\n\nDen Gläubigern der an der formwechselnden Umwandlung beteiligten Rechtsträger ist, wenn sie binnen sechs Monaten nach dem Tag, an dem die Eintragung der formwechselnden Umwandlung in das Register des Sitzes derjenigen Rechtsträger deren Gläubiger sie sind, nach § 201 UmwG bekannt gemacht worden ist, ihren Anspruch nach Grund und Höhe schriftlich anmelden, Sicherheit zu leisten, soweit sie nicht Befriedigung verlangen können. Dieses Recht steht den Gläubigern jedoch nur zu, wenn sie glaubhaft machen, dass durch die formwechselnden Umwandlung die Erfüllung ihrer Forderung gefährdet wird."
    },
    {
      "date": "2025-03-10",
      "id": "103350",
      "original_text": "Löschungsankündigung\nHessen Amtsgericht Hanau HRB 12900\nTopHaus-HG Plan u. Bau GmbH – Langenselbold",
      "type": "Löschungsankündigung",
      "state": "Hessen",
      "amtsgericht": "Amtsgericht Hanau",
      "registernummer": "HRB 12900",
      "registerart": "HRB",
      "company_name": "TopHaus-HG Plan u. Bau GmbH",
      "company_seat": "Langenselbold",
      "details": "10.03.2025 (Bekanntmachungsdatum)\n\nHessen Amtsgericht Hanau HRB 12900\nLöschungsankündigung\n\nTopHaus-HG Plan u. Bau GmbH\nGesellschaft mit beschränkter Haftung\nLangenselbold\n\nDas Registergericht beabsichtigt, die im Handelsregister eingetragene Gesellschaft von Amts wegen nach § 394 FamFG zu löschen. Die Frist zur Erhebung eines Widerspruchs gegen die beabsichtigte Löschung wird auf 3 Monate festgesetzt."
    },
    {
      "date": "2025-03-10",
      "id": "103351",
      "original_text": "Löschungsankündigung\nHessen Amtsgericht Frankfurt am Main HRB 116686\nSprichlaut GmbH – Frankfurt am Main",
      "type": "Löschungsankündigung",
      "state": "Hessen",
      "amtsgericht": "Amtsgericht Frankfurt am Main",
      "registernummer": "HRB 116686",
      "registerart": "HRB",
      "company_name": "Sprichlaut GmbH",
      "company_seat": "Frankfurt am Main",
      "details": "10.03.2025 (Bekanntmachungsdatum)\n\nHessen Amtsgericht Frankfurt am Main HRB 116686\nLöschungsankündigung\n\nSprichlaut GmbH\nGesellschaft mit beschränkter Haftung\nFrankfurt am Main\n\nEs ist beabsichtigt, die Gesellschaft wegen Vermögenslosigkeit gemäß § 394 FamFG von Amts wegen im Handelsregister zu löschen. Hiergegen kann innerhalb eines Monats nach dieser Veröffentlichung Widerspruch bei dem Amtsgericht Frankfurt am Main eingelegt werden."
    },
    {
      "date": "2025-03-10",
      "id": "103352",
      "original_text": "Registerbekanntmachung nach dem Umwandlungsgesetz\nHessen Amtsgericht Gießen HRB 11655\nBarfuss Ingenieure GmbH – Wartenberg",
      "type": "Registerbekanntmachung nach dem Umwandlungsgesetz",
      "state": "Hessen",
      "amtsgericht": "Amtsgericht Gießen",
      "registernummer": "HRB 11655",
      "registerart": "HRB",
      "company_name": "Barfuss Ingenieure GmbH",
      "company_seat": "Wartenberg",
      "details": "10.03.2025 (Bekanntmachungsdatum)\n\nHessen Amtsgericht Gießen HRB 11655\nRegisterbekanntmachung nach dem Umwandlungsgesetz 10.03.2025 (Eintragungsdatum)\n\nBarfuss Ingenieure GmbH\nGesellschaft mit beschränkter Haftung\nWartenberg\n\nDen Gläubigern der an der Ausgliederung beteiligten Rechtsträger ist, wenn sie binnen sechs Monaten nach dem Tag, an dem die Eintragung der Ausgliederung in das Register des Sitzes desjenigen Rechtsträgers, dessen Gläubiger sie sind, nach §§ 125, 19 Absatz 3 UmwG bekannt gemacht worden ist, ihren Anspruch nach Grund und Höhe schriftlich anmelden, Sicherheit zu leisten, soweit sie nicht Befriedigung verlangen können. Dieses Recht steht den Gläubigern jedoch nur zu, wenn sie glaubhaft machen, dass durch die Ausgliederung die Erfüllung ihrer Forderung gefährdet wird."
    },
    {
      "date": "2025-03-10",
      "id": "103353",
      "original_text": "Einreichung neuer Dokumente\nHessen Amtsgericht Frankfurt am Main HRB 47289\nUnion Asset Management Holding AG – Frankfurt am Main",
      "type": "Einreichung neuer Dokumente",
      "state": "Hessen",
      "amtsgericht": "Amtsgericht Frankfurt am Main",
      "registernummer": "HRB 47289",
      "registerart": "HRB",
      "company_name": "Union Asset Management Holding AG",
      "company_seat": "Frankfurt am Main",
      "details": "10.03.2025 (Bekanntmachungsdatum)\n\nHessen Amtsgericht Frankfurt am Main HRB 47289\nEinreichung neuer Dokumente\n\nUnion Asset Management Holding AG\nAktiengesellschaft\nFrankfurt am Main\n\nDurch eine Änderung in den Personen der Aufsichtsratsmitglieder ist eine Liste der Mitglieder des Aufsichtsrates zum Handelsregister eingereicht worden."
    },
    {
      "date": "2025-03-10",
      "id": "103354",
      "original_text": "Registerbekanntmachung nach dem Umwandlungsgesetz\nHessen Amtsgericht Gießen HRA 5412\nIngenieurbüro Philipp Barfuss e.K. – Wartenberg",
      "type": "Registerbekanntmachung nach dem Umwandlungsgesetz",
      "state": "Hessen",
      "amtsgericht": "Amtsgericht Gießen",
      "registernummer": "HRA 5412",
      "registerart": "HRA",
      "company_name": "Ingenieurbüro Philipp Barfuss e.K.",
      "company_seat": "Wartenberg",
      "details": "10.03.2025 (Bekanntmachungsdatum)\n\nHessen Amtsgericht Gießen HRA 5412\nRegisterbekanntmachung nach dem Umwandlungsgesetz 10.03.2025 (Eintragungsdatum)\n\nIngenieurbüro Philipp Barfuss e.K.\nEinzelkaufmann / Einzelkauffrau\nWartenberg\n\nDen Gläubigern der an der Ausgliederung beteiligten Rechtsträger ist, wenn sie binnen sechs Monaten nach dem Tag, an dem die Eintragung der Ausgliederung in das Register des Sitzes desjenigen Rechtsträgers, dessen Gläubiger sie sind, nach §§ 125, 19 Absatz 3 UmwG bekannt gemacht worden ist, ihren Anspruch nach Grund und Höhe schriftlich anmelden, Sicherheit zu leisten, soweit sie nicht Befriedigung verlangen können. Dieses Recht steht den Gläubigern jedoch nur zu, wenn sie glaubhaft machen, dass durch die Ausgliederung die Erfüllung ihrer Forderung gefährdet wird."
    },
    {
      "date": "2025-03-10",
      "id": "103355",
      "original_text": "Sonstige Registerbekanntmachung\nHessen Amtsgericht Marburg VR 511\nRadfahrverein \"Sport\" 1910 Ockershausen – Ockershausen",
      "type": "Sonstige Registerbekanntmachung",
      "state": "Hessen",
      "amtsgericht": "Amtsgericht Marburg",
      "registernummer": "VR 511",
      "registerart": "VR",
      "company_name": "Radfahrverein \"Sport\" 1910 Ockershausen",
      "company_seat": "Ockershausen",
      "details": "10.03.2025 (Bekanntmachungsdatum)\n\nHessen Amtsgericht Marburg VR 511\nSonstige Registerbekanntmachung 06.03.2025 (Eintragungsdatum)\n\nRadfahrverein \"Sport\" 1910 Ockershausen\neingetragener Verein\nOckershausen\n\nDer Verein ist aufgelöst."
    },
    {
      "date": "2025-03-10",
      "id": "103356",
      "original_text": "Einreichung neuer Dokumente\nHessen Amtsgericht Offenbach am Main HRB 8642\nStadtwerke Neu-Isenburg GmbH – Neu-Isenburg",
      "type": "Einreichung neuer Dokumente",
      "state": "Hessen",
      "amtsgericht": "Amtsgericht Offenbach am Main",
      "registernummer": "HRB 8642",
      "registerart": "HRB",
      "company_name": "Stadtwerke Neu-Isenburg GmbH",
      "company_seat": "Neu-Isenburg",
      "details": "10.03.2025 (Bekanntmachungsdatum)\n\nHessen Amtsgericht Offenbach am Main HRB 8642\nEinreichung neuer Dokumente 10.03.2025 (Eintragungsdatum)\n\nStadtwerke Neu-Isenburg GmbH\nGesellschaft mit beschränkter Haftung\nNeu-Isenburg\n\nDurch eine Änderung in den Personen der Aufsichtsratsmitglieder ist eine Liste der Mitglieder des Aufsichtsrates zum Handelsregister eingereicht worden."
    },
    {
      "date": "2025-03-10",
      "id": "103357",
      "original_text": "Einreichung neuer Dokumente\nHessen Amtsgericht Darmstadt HRB 98297\nSEGULA TECHNOLOGIES GmbH – Rüsselsheim",
      "type": "Einreichung neuer Dokumente",
      "state": "Hessen",
      "amtsgericht": "Amtsgericht Darmstadt",
      "registernummer": "HRB 98297",
      "registerart": "HRB",
      "company_name": "SEGULA TECHNOLOGIES GmbH",
      "company_seat": "Rüsselsheim",
      "details": "10.03.2025 (Bekanntmachungsdatum)\n\nHessen Amtsgericht Darmstadt HRB 98297\nEinreichung neuer Dokumente 10.03.2025 (Eintragungsdatum)\n\nSEGULA TECHNOLOGIES GmbH\nGesellschaft mit beschränkter Haftung\nRüsselsheim\n\nWegen Änderungen in den Personen der Aufsichtsratsmitglieder ist eine Liste der Mitglieder des Aufsichtsrates zum Handelsregister eingereicht worden."
    },
    {
      "date": "2025-03-10",
      "id": "103358",
      "original_text": "Löschungsankündigung\nHessen Amtsgericht Fritzlar HRB 12158\nMucha GmbH – Morschen",
      "type": "Löschungsankündigung",
      "state": "Hessen",
      "amtsgericht": "Amtsgericht Fritzlar",
      "registernummer": "HRB 12158",
      "registerart": "HRB",
      "company_name": "Mucha GmbH",
      "company_seat": "Morschen",
      "details": "10.03.2025 (Bekanntmachungsdatum)\n\nHessen Amtsgericht Fritzlar HRB 12158\nLöschungsankündigung 10.03.2025 (Eintragungsdatum)\n\nMucha GmbH\nGesellschaft mit beschränkter Haftung\nMorschen\n\nDas Registergericht beabsichtigt die im Handelsregister eingetragene Gesellschaft von Amts wegen nach § 394 FamFG zu löschen. Die Frist zur Erhebung eines Widerspruchs gegen die beabsichtigte Löschung wird auf 3 Monate festgesetzt."
    },
    {
      "date": "2025-03-10",
      "id": "103359",
      "original_text": "Löschungsankündigung\nHessen Amtsgericht Darmstadt HRB 97085\nUCS Logistik & Handling Service GmbH – Rüsselsheim",
      "type": "Löschungsankündigung",
      "state": "Hessen",
      "amtsgericht": "Amtsgericht Darmstadt",
      "registernummer": "HRB 97085",
      "registerart": "HRB",
      "company_name": "UCS Logistik & Handling Service GmbH",
      "company_seat": "Rüsselsheim",
      "details": "10.03.2025 (Bekanntmachungsdatum)\n\nHessen Amtsgericht Darmstadt HRB 97085\nLöschungsankündigung\n\nUCS Logistik & Handling Service GmbH\nGesellschaft mit beschränkter Haftung\nRüsselsheim\n\nDas Registergericht beabsichtigt die im Handelsregister eingetragene Gesellschaft von Amts wegen nach § 394 FamFG zu löschen. Die Frist zur Erhebung eines Widerspruchs gegen die beabsichtigte Löschung wird auf 3 Monate festgesetzt."
    },
    {
      "date": "2025-03-10",
      "id": "103360",
      "original_text": "Sonstige Registerbekanntmachung\nHessen Amtsgericht Offenbach am Main VR 1404\nOffenbacher Pensionärsverein der AXA Konzern und DBV Unternehmen – Offenbach am Main",
      "type": "Sonstige Registerbekanntmachung",
      "state": "Hessen",
      "amtsgericht": "Amtsgericht Offenbach am Main",
      "registernummer": "VR 1404",
      "registerart": "VR",
      "company_name": "Offenbacher Pensionärsverein der AXA Konzern und DBV Unternehmen",
      "company_seat": "Offenbach am Main",
      "details": "10.03.2025 (Bekanntmachungsdatum)\n\nHessen Amtsgericht Offenbach am Main VR 1404\nSonstige Registerbekanntmachung 10.03.2025 (Eintragungsdatum)\n\nOffenbacher Pensionärsverein der AXA Konzern und DBV Unternehmen\neingetragener Verein\nOffenbach am Main\n\nDer Verein ist aufgelöst."
    },
    {
      "date": "2025-03-10",
      "id": "103361",
      "original_text": "Einreichung neuer Dokumente\nHessen Amtsgericht Frankfurt am Main HRB 55497\nSage GmbH – Frankfurt am Main",
      "type": "Einreichung neuer Dokumente",
      "state": "Hessen",
      "amtsgericht": "Amtsgericht Frankfurt am Main",
      "registernummer": "HRB 55497",
      "registerart": "HRB",
      "company_name": "Sage GmbH",
      "company_seat": "Frankfurt am Main",
      "details": "10.03.2025 (Bekanntmachungsdatum)\n\nHessen Amtsgericht Frankfurt am Main HRB 55497\nEinreichung neuer Dokumente 10.03.2025 (Eintragungsdatum)\n\nSage GmbH\nGesellschaft mit beschränkter Haftung\nFrankfurt am Main\n\nDurch eine Änderung in den Personen der Aufsichtsratsmitglieder ist eine Liste der Mitglieder des Aufsichtsrates zum Handelsregister eingereicht worden."
    },
    {
      "date": "2025-03-10",
      "id": "103362",
      "original_text": "Löschungsankündigung\nHessen Amtsgericht Frankfurt am Main HRB 118787\nRO Baugesellschaft UG (haftungsbeschränkt) – Frankfurt am Main",
      "type": "Löschungsankündigung",
      "state": "Hessen",
      "amtsgericht": "Amtsgericht Frankfurt am Main",
      "registernummer": "HRB 118787",
      "registerart": "HRB",
      "company_name": "RO Baugesellschaft UG (haftungsbeschränkt)",
      "company_seat": "Frankfurt am Main",
      "details": "10.03.2025 (Bekanntmachungsdatum)\n\nHessen Amtsgericht Frankfurt am Main HRB 118787\nLöschungsankündigung\n\nRO Baugesellschaft UG (haftungsbeschränkt)\nGesellschaft mit beschränkter Haftung\nFrankfurt am Main\n\nDas Registergericht beabsichtigt die im Handelsregister eingetragene Gesellschaft von Amts wegen nach § 394 FamFG zu löschen. Hiergegen kann innerhalb eines Zeitraums von 1 Monat nach dieser Veröffentlichung Widerspruch bei dem Amtsgericht Frankfurt am Main eingelegt werden."
    },
    {
      "date": "2025-03-10",
      "id": "103363",
      "original_text": "Löschungsankündigung\nHessen Amtsgericht Offenbach am Main HRB 53086\nID Solutions UG (haftungsbeschränkt) – Heusenstamm",
      "type": "Löschungsankündigung",
      "state": "Hessen",
      "amtsgericht": "Amtsgericht Offenbach am Main",
      "registernummer": "HRB 53086",
      "registerart": "HRB",
      "company_name": "ID Solutions UG (haftungsbeschränkt)",
      "company_seat": "Heusenstamm",
      "details": "10.03.2025 (Bekanntmachungsdatum)\n\nHessen Amtsgericht Offenbach am Main HRB 53086\nLöschungsankündigung\n\nID Solutions UG (haftungsbeschränkt)\nGesellschaft mit beschränkter Haftung\nHeusenstamm\n\nDas Registergericht beabsichtigt die im Handelsregister eingetragene Gesellschaft von Amts wegen nach § 394 FamFG zu löschen. Die Frist zur Erhebung eines Widerspruchs gegen die beabsichtigte Löschung wird auf 3 Monate festgesetzt."
    }
  ]
}