{
  "date": "2026-02-21",
  "date_of_scrape": "2026-02-22T04:36:55.832Z",
  "tool_version": "0.2.0",
  "number_of_announcements": 13,
  "announcements": [
    {
      "date": "2026-02-21",
      "id": "145809",
      "original_text": "Löschungsankündigung\nBayern Amtsgericht München HRB 178544\nB&S 2008 BO Europe GmbH – München",
      "type": "Löschungsankündigung",
      "state": "Bayern",
      "amtsgericht": "Amtsgericht München",
      "registernummer": "HRB 178544",
      "registerart": "HRB",
      "company_name": "B&S 2008 BO Europe GmbH",
      "company_seat": "München",
      "details": "21.02.2026 (Bekanntmachungsdatum)\n\nBayern Amtsgericht München HRB 178544\nLöschungsankündigung 20.02.2026 (Eintragungsdatum)\n\nB&S 2008 BO Europe GmbH\nGesellschaft mit beschränkter Haftung\nMünchen\n\nDen Gläubigern der an der Verschmelzung beteiligten Rechtsträger ist, wenn sie binnen sechs Monaten nach dem Tag, an dem die Eintragung der Verschmelzung in das Register des Sitzes desjenigen Rechtsträgers, dessen Gläubiger sie sind, nach § 19 Abs. 3 UmwG als bekannt gemacht gilt, ihren Anspruch nach Grund und Höhe in Textform anmelden, Sicherheit zu leisten, soweit sie nicht Befriedigung verlangen können. Dieses Recht steht den Gläubigern jedoch nur zu, wenn sie glaubhaft machen, dass durch die Verschmelzung die Erfüllung ihrer Forderung gefährdet wird."
    },
    {
      "date": "2026-02-21",
      "id": "145810",
      "original_text": "Einreichung neuer Dokumente\nBayern Amtsgericht München HRB 289472\nUniCredit Bank GmbH – München",
      "type": "Einreichung neuer Dokumente",
      "state": "Bayern",
      "amtsgericht": "Amtsgericht München",
      "registernummer": "HRB 289472",
      "registerart": "HRB",
      "company_name": "UniCredit Bank GmbH",
      "company_seat": "München",
      "details": "21.02.2026 (Bekanntmachungsdatum)\n\nBayern Amtsgericht München HRB 289472\nEinreichung neuer Dokumente\n\nUniCredit Bank GmbH\nGesellschaft mit beschränkter Haftung\nMünchen\n\nDem Amtsgericht München -Registergericht- ist eine Liste der Mitglieder des Aufsichtsrats eingereicht worden, § 52 Abs. 3 S. 2 GmbHG."
    },
    {
      "date": "2026-02-21",
      "id": "145811",
      "original_text": "Sonstige Registerbekanntmachung\nBayern Amtsgericht Memmingen HRB 14609\nHYPE GmbH FINAL DESIGN – Leipheim",
      "type": "Sonstige Registerbekanntmachung",
      "state": "Bayern",
      "amtsgericht": "Amtsgericht Memmingen",
      "registernummer": "HRB 14609",
      "registerart": "HRB",
      "company_name": "HYPE GmbH FINAL DESIGN",
      "company_seat": "Leipheim",
      "details": "21.02.2026 (Bekanntmachungsdatum)\n\nBayern Amtsgericht Memmingen HRB 14609\nSonstige Registerbekanntmachung 20.02.2026 (Eintragungsdatum)\n\nHYPE GmbH FINAL DESIGN\nGesellschaft mit beschränkter Haftung\nLeipheim\n\nDen Gläubigern der Gesellschaft, deren Forderungen begründet worden sind, bevor die Eintragung der Beendigung des Beherrschungs- und Gewinnabführungsvertrages in das Handelsregister nach § 10 des Handelsgesetzbuches als bekanntgemacht gilt, hat der andere Vertragsteil Sicherheit zu leisten, wenn sie sich binnen sechs Monaten nach der Bekanntmachung der Eintragung zu diesem Zweck bei ihm melden."
    },
    {
      "date": "2026-02-21",
      "id": "145812",
      "original_text": "Löschungsankündigung\nBayern Amtsgericht Nürnberg HRB 31474\nEuro Style Trade GmbH – Nürnberg",
      "type": "Löschungsankündigung",
      "state": "Bayern",
      "amtsgericht": "Amtsgericht Nürnberg",
      "registernummer": "HRB 31474",
      "registerart": "HRB",
      "company_name": "Euro Style Trade GmbH",
      "company_seat": "Nürnberg",
      "details": "21.02.2026 (Bekanntmachungsdatum)\n\nBayern Amtsgericht Nürnberg HRB 31474\nLöschungsankündigung 20.02.2026 (Eintragungsdatum)\n\nEuro Style Trade GmbH\nGesellschaft mit beschränkter Haftung\nNürnberg\n\nDas Registergericht beabsichtigt, die im Handelsregister eingetragene Gesellschaft wegen Vermögenslosigkeit von Amts wegen nach § 394 FamFG zu löschen. Die Frist zur Erhebung eines Widerspruchs ist auf einen Monat festgesetzt."
    },
    {
      "date": "2026-02-21",
      "id": "145813",
      "original_text": "Einreichung neuer Dokumente\nBayern Amtsgericht Memmingen HRB 16690\nFlughafen Memmingen GmbH – Memmingerberg",
      "type": "Einreichung neuer Dokumente",
      "state": "Bayern",
      "amtsgericht": "Amtsgericht Memmingen",
      "registernummer": "HRB 16690",
      "registerart": "HRB",
      "company_name": "Flughafen Memmingen GmbH",
      "company_seat": "Memmingerberg",
      "details": "21.02.2026 (Bekanntmachungsdatum)\n\nBayern Amtsgericht Memmingen HRB 16690\nEinreichung neuer Dokumente 20.02.2026 (Eintragungsdatum)\n\nFlughafen Memmingen GmbH\nGesellschaft mit beschränkter Haftung\nMemmingerberg\n\nDem Amtsgericht Memmingen -Registergericht- ist eine Liste der Mitglieder des Aufsichtsrats eingereicht worden, § 52 Abs. 3 S. 2 GmbHG."
    },
    {
      "date": "2026-02-21",
      "id": "145814",
      "original_text": "Einreichung neuer Dokumente\nBayern Amtsgericht Fürth HRB 17076\nERGO Direkt AG – Fürth",
      "type": "Einreichung neuer Dokumente",
      "state": "Bayern",
      "amtsgericht": "Amtsgericht Fürth",
      "registernummer": "HRB 17076",
      "registerart": "HRB",
      "company_name": "ERGO Direkt AG",
      "company_seat": "Fürth",
      "details": "21.02.2026 (Bekanntmachungsdatum)\n\nBayern Amtsgericht Fürth HRB 17076\nEinreichung neuer Dokumente 20.02.2026 (Eintragungsdatum)\n\nERGO Direkt AG\nAktiengesellschaft\nFürth\n\nDem Amtsgericht Fürth -Registergericht- ist eine Liste der Mitglieder des Aufsichtsrats eingereicht worden, § 106 AktG."
    },
    {
      "date": "2026-02-21",
      "id": "145815",
      "original_text": "Registerbekanntmachung nach dem Umwandlungsgesetz\nBayern Amtsgericht München HRB 154747\nMETA Immobilien GmbH – Pöcking",
      "type": "Registerbekanntmachung nach dem Umwandlungsgesetz",
      "state": "Bayern",
      "amtsgericht": "Amtsgericht München",
      "registernummer": "HRB 154747",
      "registerart": "HRB",
      "company_name": "META Immobilien GmbH",
      "company_seat": "Pöcking",
      "details": "21.02.2026 (Bekanntmachungsdatum)\n\nBayern Amtsgericht München HRB 154747\nRegisterbekanntmachung nach dem Umwandlungsgesetz 20.02.2026 (Eintragungsdatum)\n\nMETA Immobilien GmbH\nGesellschaft mit beschränkter Haftung\nPöcking\n\nDen Gläubigern der an der Verschmelzung beteiligten Rechtsträger ist, wenn sie binnen sechs Monaten nach dem Tag, an dem die Eintragung der Verschmelzung in das Register des Sitzes desjenigen Rechtsträgers, dessen Gläubiger sie sind, nach § 19 Abs. 3 UmwG als bekannt gemacht gilt, ihren Anspruch nach Grund und Höhe in Textform anmelden, Sicherheit zu leisten, soweit sie nicht Befriedigung verlangen können. Dieses Recht steht den Gläubigern jedoch nur zu, wenn sie glaubhaft machen, dass durch die Verschmelzung die Erfüllung ihrer Forderung gefährdet wird."
    },
    {
      "date": "2026-02-21",
      "id": "145816",
      "original_text": "Registerbekanntmachung nach dem Umwandlungsgesetz\nBayern Amtsgericht München HRB 199545\nMETA Hotel München Ost GmbH – Pöcking",
      "type": "Registerbekanntmachung nach dem Umwandlungsgesetz",
      "state": "Bayern",
      "amtsgericht": "Amtsgericht München",
      "registernummer": "HRB 199545",
      "registerart": "HRB",
      "company_name": "META Hotel München Ost GmbH",
      "company_seat": "Pöcking",
      "details": "21.02.2026 (Bekanntmachungsdatum)\n\nBayern Amtsgericht München HRB 199545\nRegisterbekanntmachung nach dem Umwandlungsgesetz 20.02.2026 (Eintragungsdatum)\n\nMETA Hotel München Ost GmbH\nGesellschaft mit beschränkter Haftung\nPöcking\n\nDen Gläubigern der an der Verschmelzung beteiligten Rechtsträger ist, wenn sie binnen sechs Monaten nach dem Tag, an dem die Eintragung der Verschmelzung in das Register des Sitzes desjenigen Rechtsträgers, dessen Gläubiger sie sind, nach § 19 Abs. 3 UmwG als bekannt gemacht gilt, ihren Anspruch nach Grund und Höhe in Textform anmelden, Sicherheit zu leisten, soweit sie nicht Befriedigung verlangen können. Dieses Recht steht den Gläubigern jedoch nur zu, wenn sie glaubhaft machen, dass durch die Verschmelzung die Erfüllung ihrer Forderung gefährdet wird."
    },
    {
      "date": "2026-02-21",
      "id": "145817",
      "original_text": "Registerbekanntmachung nach dem Umwandlungsgesetz\nBayern Amtsgericht Würzburg HRB 9244\nEIKONA AG – Volkach",
      "type": "Registerbekanntmachung nach dem Umwandlungsgesetz",
      "state": "Bayern",
      "amtsgericht": "Amtsgericht Würzburg",
      "registernummer": "HRB 9244",
      "registerart": "HRB",
      "company_name": "EIKONA AG",
      "company_seat": "Volkach",
      "details": "21.02.2026 (Bekanntmachungsdatum)\n\nBayern Amtsgericht Würzburg HRB 9244\nRegisterbekanntmachung nach dem Umwandlungsgesetz 20.02.2026 (Eintragungsdatum)\n\nEIKONA AG\nAktiengesellschaft\nVolkach\n\nDen Gläubigern des formwechselnden Rechtsträgers ist, wenn sie binnen sechs Monaten nach dem Tag, an dem die Eintragung des Formwechsels nach § 201 UmwG als bekannt gemacht gilt, ihren Anspruch nach Grund und Höhe in Textform anmelden, Sicherheit zu leisten, soweit sie nicht Befriedigung verlangen können. Dieses Recht steht den Gläubigern jedoch nur zu, wenn sie glaubhaft machen, dass durch den Formwechsel die Erfüllung ihrer Forderung gefährdet wird."
    },
    {
      "date": "2026-02-21",
      "id": "145818",
      "original_text": "Einreichung neuer Dokumente\nBayern Amtsgericht München HRB 295455\nMW-MCar AG – München",
      "type": "Einreichung neuer Dokumente",
      "state": "Bayern",
      "amtsgericht": "Amtsgericht München",
      "registernummer": "HRB 295455",
      "registerart": "HRB",
      "company_name": "MW-MCar AG",
      "company_seat": "München",
      "details": "21.02.2026 (Bekanntmachungsdatum)\n\nBayern Amtsgericht München HRB 295455\nEinreichung neuer Dokumente 20.02.2026 (Eintragungsdatum)\n\nMW-MCar AG\nAktiengesellschaft\nMünchen\n\nDem Amtsgericht München -Registergericht- ist eine Liste der Mitglieder des Aufsichtsrats eingereicht worden, § 106 AktG."
    },
    {
      "date": "2026-02-21",
      "id": "145819",
      "original_text": "Löschungsankündigung\nBayern Amtsgericht Nürnberg HRB 40426\nEnrique Kostial Logistik GmbH – Schwabach",
      "type": "Löschungsankündigung",
      "state": "Bayern",
      "amtsgericht": "Amtsgericht Nürnberg",
      "registernummer": "HRB 40426",
      "registerart": "HRB",
      "company_name": "Enrique Kostial Logistik GmbH",
      "company_seat": "Schwabach",
      "details": "21.02.2026 (Bekanntmachungsdatum)\n\nBayern Amtsgericht Nürnberg HRB 40426\nLöschungsankündigung\n\nEnrique Kostial Logistik GmbH\nGesellschaft mit beschränkter Haftung\nSchwabach\n\nDas Registergericht beabsichtigt, die im Handelsregister eingetragene Gesellschaft wegen Vermögenslosigkeit von Amts wegen nach § 394 FamFG zu löschen. Die Frist zur Erhebung eines Widerspruchs ist auf einen Monat festgesetzt."
    },
    {
      "date": "2026-02-21",
      "id": "145820",
      "original_text": "Registerbekanntmachung nach dem Umwandlungsgesetz\nBayern Amtsgericht München HRB 205565\nSCUR24 Holding GmbH – München",
      "type": "Registerbekanntmachung nach dem Umwandlungsgesetz",
      "state": "Bayern",
      "amtsgericht": "Amtsgericht München",
      "registernummer": "HRB 205565",
      "registerart": "HRB",
      "company_name": "SCUR24 Holding GmbH",
      "company_seat": "München",
      "details": "21.02.2026 (Bekanntmachungsdatum)\n\nBayern Amtsgericht München HRB 205565\nRegisterbekanntmachung nach dem Umwandlungsgesetz 20.02.2026 (Eintragungsdatum)\n\nSCUR24 Holding GmbH\nGesellschaft mit beschränkter Haftung\nMünchen\n\nDen Gläubigern der an der Verschmelzung beteiligten Rechtsträger ist, wenn sie binnen sechs Monaten nach dem Tag, an dem die Eintragung der Verschmelzung in das Register des Sitzes desjenigen Rechtsträgers, dessen Gläubiger sie sind, nach § 19 Abs. 3 UmwG als bekannt gemacht gilt, ihren Anspruch nach Grund und Höhe in Textform anmelden, Sicherheit zu leisten, soweit sie nicht Befriedigung verlangen können. Dieses Recht steht den Gläubigern jedoch nur zu, wenn sie glaubhaft machen, dass durch die Verschmelzung die Erfüllung ihrer Forderung gefährdet wird."
    },
    {
      "date": "2026-02-21",
      "id": "145821",
      "original_text": "Löschungsankündigung\nBayern Amtsgericht Würzburg HRA 5884\nLeontis Equity Fund Easy Select I GmbH & Co. KG – Dettelbach",
      "type": "Löschungsankündigung",
      "state": "Bayern",
      "amtsgericht": "Amtsgericht Würzburg",
      "registernummer": "HRA 5884",
      "registerart": "HRA",
      "company_name": "Leontis Equity Fund Easy Select I GmbH & Co. KG",
      "company_seat": "Dettelbach",
      "details": "21.02.2026 (Bekanntmachungsdatum)\n\nBayern Amtsgericht Würzburg HRA 5884\nLöschungsankündigung\n\nLeontis Equity Fund Easy Select I GmbH & Co. KG\nKommanditgesellschaft\nDettelbach\n\nDas Registergericht beabsichtigt, die im Handelsregister eingetragene Firma wegen Vermögenslosigkeit von Amts wegen nach § 394 FamFG zu löschen. Die Frist zur Erhebung eines Widerspruchs ist auf drei Monate festgesetzt."
    }
  ]
}