{
  "date": "2026-02-16",
  "date_of_scrape": "2026-02-17T04:40:36.549Z",
  "tool_version": "0.2.0",
  "number_of_announcements": 72,
  "announcements": [
    {
      "date": "2026-02-16",
      "id": "145156",
      "original_text": "Löschungsankündigung\nBerlin Amtsgericht Berlin (Charlottenburg) HRB 106425\nExordium GmbH – Berlin",
      "type": "Löschungsankündigung",
      "state": "Berlin",
      "amtsgericht": "Amtsgericht Berlin (Charlottenburg)",
      "registernummer": "HRB 106425",
      "registerart": "HRB",
      "company_name": "Exordium GmbH",
      "company_seat": "Berlin",
      "details": "16.02.2026 (Bekanntmachungsdatum)\n\nBerlin Amtsgericht Berlin (Charlottenburg) HRB 106425\nLöschungsankündigung\n\nExordium GmbH\nGesellschaft mit beschränkter Haftung\nBerlin\n\nBei der nachstehenden Gesellschaft wird das Amtslöschungsverfahren gemäß § 394 FamFG eingeleitet. Widerspruchsfrist\n6 Wochen."
    },
    {
      "date": "2026-02-16",
      "id": "145157",
      "original_text": "Registerbekanntmachung nach dem Umwandlungsgesetz\nBaden-Württemberg Amtsgericht Mannheim HRB 756694\nMMA Akademie Karlsruhe GmbH – Karlsruhe",
      "type": "Registerbekanntmachung nach dem Umwandlungsgesetz",
      "state": "Baden-Württemberg",
      "amtsgericht": "Amtsgericht Mannheim",
      "registernummer": "HRB 756694",
      "registerart": "HRB",
      "company_name": "MMA Akademie Karlsruhe GmbH",
      "company_seat": "Karlsruhe",
      "details": "16.02.2026 (Bekanntmachungsdatum)\n\nBaden-Württemberg Amtsgericht Mannheim HRB 756694\nRegisterbekanntmachung nach dem Umwandlungsgesetz 16.02.2026 (Eintragungsdatum)\n\nMMA Akademie Karlsruhe GmbH\nGesellschaft mit beschränkter Haftung\nKarlsruhe\n\nAls nicht eingetragen wird bekanntgemacht:\nDen Gläubigern der an der Ausgliederung beteiligten Rechtsträger ist, wenn sie binnen sechs Monaten nach dem Tag, an dem die Eintragung der Ausgliederung in das Register des Sitzes desjenigen Rechtsträgers, dessen Gläubiger sie sind, nach § 19 Abs. 3 UmwG als bekanntgemacht gilt, ihren Anspruch nach Grund und Höhe schriftlich anmelden, Sicherheit zu leisten, soweit sie nicht Befriedigung verlangen können. Dieses Recht steht den Gläubigern jedoch nur zu, wenn sie glaubhaft machen, dass durch die Ausgliederung die Erfüllung ihrer Forderung gefährdet wird."
    },
    {
      "date": "2026-02-16",
      "id": "145158",
      "original_text": "Einreichung neuer Dokumente\nBerlin Amtsgericht Berlin (Charlottenburg) HRB 186507\nMEDWING GmbH – Berlin",
      "type": "Einreichung neuer Dokumente",
      "state": "Berlin",
      "amtsgericht": "Amtsgericht Berlin (Charlottenburg)",
      "registernummer": "HRB 186507",
      "registerart": "HRB",
      "company_name": "MEDWING GmbH",
      "company_seat": "Berlin",
      "details": "16.02.2026 (Bekanntmachungsdatum)\n\nBerlin Amtsgericht Berlin (Charlottenburg) HRB 186507\nEinreichung neuer Dokumente\n\nMEDWING GmbH\nGesellschaft mit beschränkter Haftung\nBerlin\n\nAls nicht eingetragen wird veröffentlicht: Es wurde eine neue Liste der Aufsichtsratsmitglieder eingereicht (§52 GmbHG)."
    },
    {
      "date": "2026-02-16",
      "id": "145159",
      "original_text": "Registerbekanntmachung nach dem Umwandlungsgesetz\nBaden-Württemberg Amtsgericht Mannheim HRA 713038\nMMA Akademie Sebastian Heil e.K. – Karlsruhe",
      "type": "Registerbekanntmachung nach dem Umwandlungsgesetz",
      "state": "Baden-Württemberg",
      "amtsgericht": "Amtsgericht Mannheim",
      "registernummer": "HRA 713038",
      "registerart": "HRA",
      "company_name": "MMA Akademie Sebastian Heil e.K.",
      "company_seat": "Karlsruhe",
      "details": "16.02.2026 (Bekanntmachungsdatum)\n\nBaden-Württemberg Amtsgericht Mannheim HRA 713038\nRegisterbekanntmachung nach dem Umwandlungsgesetz 16.02.2026 (Eintragungsdatum)\n\nMMA Akademie Sebastian Heil e.K.\nEinzelkaufmann / Einzelkauffrau\nKarlsruhe\n\nAls nicht eingetragen wird bekanntgemacht:Den Gläubigern der an der Ausgliederung beteiligten Rechtsträger ist, wenn sie binnen sechs Monaten nach dem Tag, an dem die Eintragung der Ausgliederung in das Register des Sitzes desjenigen Rechtsträgers, dessen Gläubiger sie sind, nach § 19 Abs. 3 UmwG als bekanntgemacht gilt, ihren Anspruch nach Grund und Höhe schriftlich anmelden, Sicherheit zu leisten, soweit sie nicht Befriedigung verlangen können. Dieses Recht steht den Gläubigern jedoch nur zu, wenn sie glaubhaft machen, dass durch die Ausgliederung die Erfüllung ihrer Forderung gefährdet wird."
    },
    {
      "date": "2026-02-16",
      "id": "145160",
      "original_text": "Einreichung neuer Dokumente\nBaden-Württemberg Amtsgericht Mannheim HRB 240414\nStadtwerke Bretten Gesellschaft mit beschränkter Haftung – Bretten",
      "type": "Einreichung neuer Dokumente",
      "state": "Baden-Württemberg",
      "amtsgericht": "Amtsgericht Mannheim",
      "registernummer": "HRB 240414",
      "registerart": "HRB",
      "company_name": "Stadtwerke Bretten Gesellschaft mit beschränkter Haftung",
      "company_seat": "Bretten",
      "details": "16.02.2026 (Bekanntmachungsdatum)\n\nBaden-Württemberg Amtsgericht Mannheim HRB 240414\nEinreichung neuer Dokumente\n\nStadtwerke Bretten Gesellschaft mit beschränkter Haftung\nGesellschaft mit beschränkter Haftung\nBretten\n\nDie Gesellschaft hat am 12.02.2026 die Liste über die Zusammensetzung des Aufsichtsrats zum Handelsregister eingereicht."
    },
    {
      "date": "2026-02-16",
      "id": "145161",
      "original_text": "Registerbekanntmachung nach dem Umwandlungsgesetz\nBaden-Württemberg Amtsgericht Mannheim HRB 755772\nBoredBrands Studio GmbH – Heidelberg",
      "type": "Registerbekanntmachung nach dem Umwandlungsgesetz",
      "state": "Baden-Württemberg",
      "amtsgericht": "Amtsgericht Mannheim",
      "registernummer": "HRB 755772",
      "registerart": "HRB",
      "company_name": "BoredBrands Studio GmbH",
      "company_seat": "Heidelberg",
      "details": "16.02.2026 (Bekanntmachungsdatum)\n\nBaden-Württemberg Amtsgericht Mannheim HRB 755772\nRegisterbekanntmachung nach dem Umwandlungsgesetz 16.02.2026 (Eintragungsdatum)\n\nBoredBrands Studio GmbH\nGesellschaft mit beschränkter Haftung\nHeidelberg\n\nDen Gläubigern der an der Ausgliederung beteiligten Rechtsträger ist, wenn sie binnen sechs Monaten nach dem Tag, an dem die Eintragung der Ausgliederung in das Register des Sitzes desjenigen Rechtsträgers, dessen Gläubiger sie sind, nach § 19 Abs. 3 UmwG als bekanntgemacht gilt, ihren Anspruch nach Grund und Höhe schriftlich anmelden, Sicherheit zu leisten, soweit sie nicht Befriedigung verlangen können. Dieses Recht steht den Gläubigern jedoch nur zu, wenn sie glaubhaft machen, dass durch die Ausgliederung die Erfüllung ihrer Forderung gefährdet wird."
    },
    {
      "date": "2026-02-16",
      "id": "145162",
      "original_text": "Registerbekanntmachung nach dem Umwandlungsgesetz\nBaden-Württemberg Amtsgericht Mannheim HRA 712811\nChantalle Alberstadt e.K. – Heidelberg",
      "type": "Registerbekanntmachung nach dem Umwandlungsgesetz",
      "state": "Baden-Württemberg",
      "amtsgericht": "Amtsgericht Mannheim",
      "registernummer": "HRA 712811",
      "registerart": "HRA",
      "company_name": "Chantalle Alberstadt e.K.",
      "company_seat": "Heidelberg",
      "details": "16.02.2026 (Bekanntmachungsdatum)\n\nBaden-Württemberg Amtsgericht Mannheim HRA 712811\nRegisterbekanntmachung nach dem Umwandlungsgesetz 16.02.2026 (Eintragungsdatum)\n\nChantalle Alberstadt e.K.\nEinzelkaufmann / Einzelkauffrau\nHeidelberg\n\nAls nicht eingetragen wird bekanntgemacht:\nDen Gläubigern der an der Ausgliederung beteiligten Rechtsträger ist, wenn sie binnen sechs Monaten nach dem Tag, an dem die Eintragung der Ausgliederung in das Register des Sitzes desjenigen Rechtsträgers, dessen Gläubiger sie sind, nach § 19 Abs. 3 UmwG als bekanntgemacht gilt, ihren Anspruch nach Grund und Höhe schriftlich anmelden, Sicherheit zu leisten, soweit sie nicht Befriedigung verlangen können. Dieses Recht steht den Gläubigern jedoch nur zu, wenn sie glaubhaft machen, dass durch die Ausgliederung die Erfüllung ihrer Forderung gefährdet wird."
    },
    {
      "date": "2026-02-16",
      "id": "145163",
      "original_text": "Registerbekanntmachung nach dem Umwandlungsgesetz\nBaden-Württemberg Amtsgericht Mannheim HRB 746392\nHornung & Reimer DIE Mittelstandsberater GmbH – Rastatt",
      "type": "Registerbekanntmachung nach dem Umwandlungsgesetz",
      "state": "Baden-Württemberg",
      "amtsgericht": "Amtsgericht Mannheim",
      "registernummer": "HRB 746392",
      "registerart": "HRB",
      "company_name": "Hornung & Reimer DIE Mittelstandsberater GmbH",
      "company_seat": "Rastatt",
      "details": "16.02.2026 (Bekanntmachungsdatum)\n\nBaden-Württemberg Amtsgericht Mannheim HRB 746392\nRegisterbekanntmachung nach dem Umwandlungsgesetz 16.02.2026 (Eintragungsdatum)\n\nHornung & Reimer DIE Mittelstandsberater GmbH\nGesellschaft mit beschränkter Haftung\nRastatt\n\nAls nicht eingetragen wird bekanntgemacht:\nDen Gläubigern der an der Verschmelzung beteiligten Rechtsträger ist, wenn sie binnen sechs Monaten nach dem Tag, an dem die Eintragung der Verschmelzung in das Register des Sitzes desjenigen Rechtsträgers, dessen Gläubiger sie sind, nach § 19 Abs. 3 UmwG als bekanntgemacht gilt, ihren Anspruch nach Grund und Höhe schriftlich anmelden, Sicherheit zu leisten, soweit sie nicht Befriedigung verlangen können. Dieses Recht steht den Gläubigern jedoch nur zu, wenn sie glaubhaft machen, dass durch die Verschmelzung die Erfüllung ihrer Forderung gefährdet wird."
    },
    {
      "date": "2026-02-16",
      "id": "145164",
      "original_text": "Einreichung neuer Dokumente\nBrandenburg Amtsgericht Potsdam HRB 39539\nT-Cell AG – Falkensee",
      "type": "Einreichung neuer Dokumente",
      "state": "Brandenburg",
      "amtsgericht": "Amtsgericht Potsdam",
      "registernummer": "HRB 39539",
      "registerart": "HRB",
      "company_name": "T-Cell AG",
      "company_seat": "Falkensee",
      "details": "16.02.2026 (Bekanntmachungsdatum)\n\nBrandenburg Amtsgericht Potsdam HRB 39539\nEinreichung neuer Dokumente\n\nT-Cell AG\nAktiengesellschaft\nFalkensee\n\nAls nicht eingetragen wird veröffentlicht: Eine Liste der Mitglieder des Aufsichtsrates wurde zum Handelsregister eingereicht."
    },
    {
      "date": "2026-02-16",
      "id": "145165",
      "original_text": "Löschungsankündigung\nBaden-Württemberg Amtsgericht Freiburg HRB 711454\nReitstall Müller GmbH – Gundelfingen",
      "type": "Löschungsankündigung",
      "state": "Baden-Württemberg",
      "amtsgericht": "Amtsgericht Freiburg",
      "registernummer": "HRB 711454",
      "registerart": "HRB",
      "company_name": "Reitstall Müller GmbH",
      "company_seat": "Gundelfingen",
      "details": "16.02.2026 (Bekanntmachungsdatum)\n\nBaden-Württemberg Amtsgericht Freiburg HRB 711454\nLöschungsankündigung\n\nReitstall Müller GmbH\nGesellschaft mit beschränkter Haftung\nGundelfingen\n\nDas Gericht beabsichtigt, die Gesellschaft wegen Vermögenslosigkeit im Handelsregister von Amts wegen nach § 394 FamFG zu löschen. Die Frist zur Geltendmachung eines Widerspruchs gegen die beabsichtigte Löschung ist auf einen Monat ab Veröffentlichung bestimmt."
    },
    {
      "date": "2026-02-16",
      "id": "145166",
      "original_text": "Löschungsankündigung\nBrandenburg Amtsgericht Potsdam HRB 16507\nNorwig GmbH – Ziesar",
      "type": "Löschungsankündigung",
      "state": "Brandenburg",
      "amtsgericht": "Amtsgericht Potsdam",
      "registernummer": "HRB 16507",
      "registerart": "HRB",
      "company_name": "Norwig GmbH",
      "company_seat": "Ziesar",
      "details": "16.02.2026 (Bekanntmachungsdatum)\n\nBrandenburg Amtsgericht Potsdam HRB 16507\nLöschungsankündigung\n\nNorwig GmbH\nGesellschaft mit beschränkter Haftung\nZiesar\n\nBei der nachstehenden Gesellschaft wird das Amtslöschungsverfahren gemäß § 394 FamFG eingeleitet. Widerspruchsfrist: 8 Wochen."
    },
    {
      "date": "2026-02-16",
      "id": "145167",
      "original_text": "Löschungsankündigung\nBerlin Amtsgericht Berlin (Charlottenburg) HRB 194374\nExpress Rapid Logistik GmbH – Berlin",
      "type": "Löschungsankündigung",
      "state": "Berlin",
      "amtsgericht": "Amtsgericht Berlin (Charlottenburg)",
      "registernummer": "HRB 194374",
      "registerart": "HRB",
      "company_name": "Express Rapid Logistik GmbH",
      "company_seat": "Berlin",
      "details": "16.02.2026 (Bekanntmachungsdatum)\n\nBerlin Amtsgericht Berlin (Charlottenburg) HRB 194374\nLöschungsankündigung\n\nExpress Rapid Logistik GmbH\nGesellschaft mit beschränkter Haftung\nBerlin\n\nBei der nachstehenden Gesellschaft wird das Amtslöschungsverfahren gemäß § 394 FamFG eingeleitet. Widerspruchsfrist 6 Wochen"
    },
    {
      "date": "2026-02-16",
      "id": "145168",
      "original_text": "Löschungsankündigung\nSchleswig-Holstein Amtsgericht Flensburg HRB 16749\nSDFL GmbH – Tolk",
      "type": "Löschungsankündigung",
      "state": "Schleswig-Holstein",
      "amtsgericht": "Amtsgericht Flensburg",
      "registernummer": "HRB 16749",
      "registerart": "HRB",
      "company_name": "SDFL GmbH",
      "company_seat": "Tolk",
      "details": "16.02.2026 (Bekanntmachungsdatum)\n\nSchleswig-Holstein Amtsgericht Flensburg HRB 16749\nLöschungsankündigung\n\nSDFL GmbH\nGesellschaft mit beschränkter Haftung\nTolk\n\nEs ist die Löschung der nachstehenden Gesellschaft wegen Vermögenslosigkeit gemäß § 394 FamFG von Amts wegen beabsichtigt.\nWiderspruchsfrist: 2 Monate"
    },
    {
      "date": "2026-02-16",
      "id": "145169",
      "original_text": "Sonstige Registerbekanntmachung\nSachsen-Anhalt Amtsgericht Stendal HRB 8879\nMittag GmbH – Quedlinburg",
      "type": "Sonstige Registerbekanntmachung",
      "state": "Sachsen-Anhalt",
      "amtsgericht": "Amtsgericht Stendal",
      "registernummer": "HRB 8879",
      "registerart": "HRB",
      "company_name": "Mittag GmbH",
      "company_seat": "Quedlinburg",
      "details": "16.02.2026 (Bekanntmachungsdatum)\n\nSachsen-Anhalt Amtsgericht Stendal HRB 8879\nSonstige Registerbekanntmachung 16.02.2026 (Eintragungsdatum)\n\nMittag GmbH\nGesellschaft mit beschränkter Haftung\nQuedlinburg\n\nNicht eingetragen:\nAls nicht eingetragen wird veröffentlicht: Den Gläubigern der Gesellschaft, deren Forderungen begründet worden sind bevor die Eintragung der Beendigung des #DV.Art(Text=\"Art des Vertrages auswählen\",Eingabe=\"Beherrschungs- und Gewinnabführungsvertrages\",\"Beherrschungsvertrages\",\"Gewinnabführungsvertrages\",\"Teilgewinnabführungsvertrages\")  in das Handelsregister nach § 10 des Handelsgesetzbuches als bekanntgemacht gilt, hat der andere Vertragsteil Sicherheit zu leisten, wenn sie sich binnen sechs Monaten nach der Bekanntmachung der Eintragung zu diesem Zweck bei ihm melden."
    },
    {
      "date": "2026-02-16",
      "id": "145170",
      "original_text": "Registerbekanntmachung nach dem Umwandlungsgesetz\nBerlin Amtsgericht Berlin (Charlottenburg) HRB 67376\nI.G.E.A. 2001 Immobilien-Verwaltungsgesellschaft mbH – Berlin",
      "type": "Registerbekanntmachung nach dem Umwandlungsgesetz",
      "state": "Berlin",
      "amtsgericht": "Amtsgericht Berlin (Charlottenburg)",
      "registernummer": "HRB 67376",
      "registerart": "HRB",
      "company_name": "I.G.E.A. 2001 Immobilien-Verwaltungsgesellschaft mbH",
      "company_seat": "Berlin",
      "details": "16.02.2026 (Bekanntmachungsdatum)\n\nBerlin Amtsgericht Berlin (Charlottenburg) HRB 67376\nRegisterbekanntmachung nach dem Umwandlungsgesetz 13.02.2026 (Eintragungsdatum)\n\nI.G.E.A. 2001 Immobilien-Verwaltungsgesellschaft mbH\nGesellschaft mit beschränkter Haftung\nBerlin\n\nZu Eintragungsnummer 5 vom 13.02.2026 wird als nicht eingetragen veröffentlicht: Den Gläubigern ist, wenn sie binnen sechs Monaten nach dem Tag, an dem die Eintragung der Umwandlung als bekannt gemacht gilt, ihren Anspruch nach Grund und Höhe schriftlich anmelden, Sicherheit zu leisten, soweit sie nicht Befriedigung verlangen können. Dieses Recht steht den Gläubigern jedoch nur zu, wenn sie glaubhaft machen, dass durch die Umwandlung die Erfüllung ihrer Forderung gefährdet wird. Das Recht, Sicherheitsleistung zu verlangen, steht Gläubigern nicht zu, die im Falle der Insolvenz ein Recht auf vorzugsweise Befriedigung aus einer Deckungsmasse haben, die nach gesetzlicher Vorschrift zu ihrem Schutz errichtet und staatlich überwacht ist."
    },
    {
      "date": "2026-02-16",
      "id": "145171",
      "original_text": "Löschungsankündigung\nBerlin Amtsgericht Berlin (Charlottenburg) HRB 198491\nr24 Food & Beverage GmbH – Berlin",
      "type": "Löschungsankündigung",
      "state": "Berlin",
      "amtsgericht": "Amtsgericht Berlin (Charlottenburg)",
      "registernummer": "HRB 198491",
      "registerart": "HRB",
      "company_name": "r24 Food & Beverage GmbH",
      "company_seat": "Berlin",
      "details": "16.02.2026 (Bekanntmachungsdatum)\n\nBerlin Amtsgericht Berlin (Charlottenburg) HRB 198491\nLöschungsankündigung\n\nr24 Food & Beverage GmbH\nGesellschaft mit beschränkter Haftung\nBerlin\n\nBei der nachstehenden Gesellschaft wird das Amtslöschungsverfahren gemäß § 394 FamFG eingeleitet. Widerspruchsfrist 6 Wochen"
    },
    {
      "date": "2026-02-16",
      "id": "145172",
      "original_text": "Sonstige Registerbekanntmachung\nBrandenburg Amtsgericht Potsdam HRB 28939\nCEVA Logistics CFS Eurohub Fulfilment GmbH – Großbeeren",
      "type": "Sonstige Registerbekanntmachung",
      "state": "Brandenburg",
      "amtsgericht": "Amtsgericht Potsdam",
      "registernummer": "HRB 28939",
      "registerart": "HRB",
      "company_name": "CEVA Logistics CFS Eurohub Fulfilment GmbH",
      "company_seat": "Großbeeren",
      "details": "16.02.2026 (Bekanntmachungsdatum)\n\nBrandenburg Amtsgericht Potsdam HRB 28939\nSonstige Registerbekanntmachung\n\nCEVA Logistics CFS Eurohub Fulfilment GmbH\nGesellschaft mit beschränkter Haftung\nGroßbeeren\n\nAls nicht eingetragen wird veröffentlicht: Den Gläubigern der Gesellschaft, deren Forderungen begründet worden sind, bevor die Eintragung der Beendigung des Vertrages in das Handelsregister  nach § 10 des Handelsgesetzbuches bekannt gemacht worden ist, ist, wenn sie sich binnen sechs Monaten nach der Bekanntmachung der Eintragung zu diesem Zweck melden, von dem anderen Vertragsteil Sicherheit zu leisten."
    },
    {
      "date": "2026-02-16",
      "id": "145173",
      "original_text": "Sonstige Registerbekanntmachung\nBaden-Württemberg Amtsgericht Mannheim HRB 502272\nKLINGEL medical metal GmbH – Pforzheim",
      "type": "Sonstige Registerbekanntmachung",
      "state": "Baden-Württemberg",
      "amtsgericht": "Amtsgericht Mannheim",
      "registernummer": "HRB 502272",
      "registerart": "HRB",
      "company_name": "KLINGEL medical metal GmbH",
      "company_seat": "Pforzheim",
      "details": "16.02.2026 (Bekanntmachungsdatum)\n\nBaden-Württemberg Amtsgericht Mannheim HRB 502272\nSonstige Registerbekanntmachung 16.02.2026 (Eintragungsdatum)\n\nKLINGEL medical metal GmbH\nGesellschaft mit beschränkter Haftung\nPforzheim\n\nDen Gläubigern der Gesellschaft, deren Forderungen begründet worden sind, bevor die Eintragung der Beendigung des Vertrages in das Handelsregister nach § 10 HGB als bekanntgemacht gilt, ist vom anderen Vertragsteil Sicherheit zu leisten, wenn sie sich binnen sechs Monaten nach der Bekanntmachung zu diesem Zweck bei ihm melden."
    },
    {
      "date": "2026-02-16",
      "id": "145174",
      "original_text": "Sonstige Registerbekanntmachung\nSchleswig-Holstein Amtsgericht Lübeck HRB 15074\nVfBG Verwaltungsgesellschaft für Beteiligungshandel GmbH – Ahrensburg",
      "type": "Sonstige Registerbekanntmachung",
      "state": "Schleswig-Holstein",
      "amtsgericht": "Amtsgericht Lübeck",
      "registernummer": "HRB 15074",
      "registerart": "HRB",
      "company_name": "VfBG Verwaltungsgesellschaft für Beteiligungshandel GmbH",
      "company_seat": "Ahrensburg",
      "details": "16.02.2026 (Bekanntmachungsdatum)\n\nSchleswig-Holstein Amtsgericht Lübeck HRB 15074\nSonstige Registerbekanntmachung\n\nVfBG Verwaltungsgesellschaft für Beteiligungshandel  GmbH\nGesellschaft mit beschränkter Haftung\nAhrensburg\n\nAls nicht eingetragen wird veröffentlicht: Der andere Vertragsteil hat den Gläubigern dieses Rechtsträgers, dessen Forderungen begründet worden sind, bevor die Eintragung der Beendigung dieses Vertrages in das Handelsregister nach § 10 des Handelsgesetzbuches als bekannt gemacht gilt, Sicherheit zu leisten, wenn sie sich binnen sechs Monaten nach der Bekanntmachung der Eintragung zu diesem Zweck bei ihm melden. Dieses Recht steht den Gläubigern nicht zu, die im Fall des Insolvenzverfahrens ein Recht auf vorzugsweise Befriedigung aus der Deckungsmasse haben, die nach gesetzlicher Vorschrift zu ihrem Schutz errichtet und staatlich überwacht ist."
    },
    {
      "date": "2026-02-16",
      "id": "145175",
      "original_text": "Löschungsankündigung\nBerlin Amtsgericht Berlin (Charlottenburg) HRB 220939\nCryptotesters UG (haftungsbeschränkt) – Berlin",
      "type": "Löschungsankündigung",
      "state": "Berlin",
      "amtsgericht": "Amtsgericht Berlin (Charlottenburg)",
      "registernummer": "HRB 220939",
      "registerart": "HRB",
      "company_name": "Cryptotesters UG (haftungsbeschränkt)",
      "company_seat": "Berlin",
      "details": "16.02.2026 (Bekanntmachungsdatum)\n\nBerlin Amtsgericht Berlin (Charlottenburg) HRB 220939\nLöschungsankündigung\n\nCryptotesters UG (haftungsbeschränkt)\nGesellschaft mit beschränkter Haftung\nBerlin\n\nBei der nachstehenden Gesellschaft wird das Amtslöschungsverfahren gemäß § 394 FamFG eingeleitet. Widerspruchsfrist 6 Wochen"
    },
    {
      "date": "2026-02-16",
      "id": "145176",
      "original_text": "Löschungsankündigung\nBaden-Württemberg Amtsgericht Stuttgart HRA 722792\nCMO Capital Premium Fonds I GmbH & Co. KG – Stuttgart",
      "type": "Löschungsankündigung",
      "state": "Baden-Württemberg",
      "amtsgericht": "Amtsgericht Stuttgart",
      "registernummer": "HRA 722792",
      "registerart": "HRA",
      "company_name": "CMO Capital Premium Fonds I GmbH & Co. KG",
      "company_seat": "Stuttgart",
      "details": "16.02.2026 (Bekanntmachungsdatum)\n\nBaden-Württemberg Amtsgericht Stuttgart HRA 722792\nLöschungsankündigung\n\nCMO Capital Premium Fonds I GmbH & Co. KG\nKommanditgesellschaft\nStuttgart\n\nDas Gericht beabsichtigt, die Gesellschaft wegen des Mangels einer wesentlichen Voraussetzung als Unzulässigkeit im Handelsregister von Amts wegen nach § 395 FamFG zu löschen. Die Frist zur Geltendmachung eines Widerspruchs gegen die beabsichtigte Löschung ist auf zwei Monate ab Veröffentlichung bestimmt."
    },
    {
      "date": "2026-02-16",
      "id": "145177",
      "original_text": "Löschungsankündigung\nBaden-Württemberg Amtsgericht Stuttgart HRB 773907\nGirrbach Kanaltechnik GmbH – Unterreichenbach",
      "type": "Löschungsankündigung",
      "state": "Baden-Württemberg",
      "amtsgericht": "Amtsgericht Stuttgart",
      "registernummer": "HRB 773907",
      "registerart": "HRB",
      "company_name": "Girrbach Kanaltechnik GmbH",
      "company_seat": "Unterreichenbach",
      "details": "16.02.2026 (Bekanntmachungsdatum)\n\nBaden-Württemberg Amtsgericht Stuttgart HRB 773907\nLöschungsankündigung\n\nGirrbach Kanaltechnik GmbH\nGesellschaft mit beschränkter Haftung\nUnterreichenbach\n\nDas Gericht beabsichtigt, die Gesellschaft wegen Vermögenslosigkeit im Handelsregister von Amts wegen nach § 394 FamFG zu löschen. Die Frist zur Geltendmachung eines Widerspruchs gegen die beabsichtigte Löschung ist auf zwei Monate ab Veröffentlichung bestimmt."
    },
    {
      "date": "2026-02-16",
      "id": "145178",
      "original_text": "Sonstige Registerbekanntmachung\nBaden-Württemberg Amtsgericht Mannheim HRB 716637\nWIDIX AG – Rheinstetten",
      "type": "Sonstige Registerbekanntmachung",
      "state": "Baden-Württemberg",
      "amtsgericht": "Amtsgericht Mannheim",
      "registernummer": "HRB 716637",
      "registerart": "HRB",
      "company_name": "WIDIX AG",
      "company_seat": "Rheinstetten",
      "details": "16.02.2026 (Bekanntmachungsdatum)\n\nBaden-Württemberg Amtsgericht Mannheim HRB 716637\nSonstige Registerbekanntmachung\n\nWIDIX AG\nAktiengesellschaft\nRheinstetten\n\nDie Gesellschaft hat am 29.09.2025 die Liste über die Zusammensetzung des Aufsichtsrats zum Handelsregister eingereicht."
    },
    {
      "date": "2026-02-16",
      "id": "145179",
      "original_text": "Löschungsankündigung\nSchleswig-Holstein Amtsgericht Lübeck HRB 24522\nBuchtvolk Brewing GmbH – Scharbeutz",
      "type": "Löschungsankündigung",
      "state": "Schleswig-Holstein",
      "amtsgericht": "Amtsgericht Lübeck",
      "registernummer": "HRB 24522",
      "registerart": "HRB",
      "company_name": "Buchtvolk Brewing GmbH",
      "company_seat": "Scharbeutz",
      "details": "16.02.2026 (Bekanntmachungsdatum)\n\nSchleswig-Holstein Amtsgericht Lübeck HRB 24522\nLöschungsankündigung\n\nBuchtvolk Brewing GmbH\nGesellschaft mit beschränkter Haftung\nScharbeutz\n\nEs ist die Löschung der nachstehenden Gesellschaft wegen Vermögenslosigkeit gemäß § 394 FamFG beabsichtigt.\nBeatwizard UG (haftungsbeschränkt), z. Hd. Geschäftsführer Alexej Grohe, Einsiedelstraße 30-34, 23554 Lübeck\nIn der Handelsregistersache der Beatwizard UG (haftungsbeschränkt)\nergeben sich aus den mir vorliegenden Unterlagen Anhaltspunkte dafür, dass die Gesellschaft, als deren Geschäftsführer Sie noch eingetragen sind, vermögenslos ist:\nDie Gesellschaft ist durch rechtskräftige Abweisung eines Antrags auf Eröffnung des Insolvenzverfahrens mangels einer die Kosten des Verfahrens deckenden Masse auf Grund des § 60 Abs. 1 Nr. 5 GmbHG aufgelöst. (Beschluss des Amtsgerichts Lübeck vom 10.12.2025 AZ: 53a IN 252/25)\nIch beabsichtige daher, die Gesellschaft wegen Vermögenslosigkeit gemäß § 394 FamFG zu löschen.\nIch bestimme eine Frist von einem Monat zur Geltendmachung eines Widerspruchs gegen die Löschung, § 394 Abs. 2 S. 1 FamFG.\nGgf. bitte ich Sie, mir binnen derselben Frist mitzuteilen, ob die genannte Gesellschaft noch Vermögen hat, welche Vermögensgegenstände sie besitzt, ob die Gesellschaft noch Partei eines noch nicht rechtskräftig abgeschlossenen Rechtsstreits ist, ob noch Rückforderungen der Gesellschaft gegenüber dem Finanzamt bestehen, ob die Gesellschaft noch an einer anderen Gesellschaft beteiligt ist, ob Grundbucheintragungen der Gesellschaft bestehen oder ob sonst noch eine Abwicklung stattfindet.\nNach Fristablauf ohne Widerspruch von Ihnen oder anderer Seite wird die Gesellschaft gelöscht.\nDammann, Rechtspflegerin"
    },
    {
      "date": "2026-02-16",
      "id": "145180",
      "original_text": "Löschungsankündigung\nSchleswig-Holstein Amtsgericht Flensburg HRB 14819\nScandinavian Autohaus GmbH – Harrislee",
      "type": "Löschungsankündigung",
      "state": "Schleswig-Holstein",
      "amtsgericht": "Amtsgericht Flensburg",
      "registernummer": "HRB 14819",
      "registerart": "HRB",
      "company_name": "Scandinavian Autohaus GmbH",
      "company_seat": "Harrislee",
      "details": "16.02.2026 (Bekanntmachungsdatum)\n\nSchleswig-Holstein Amtsgericht Flensburg HRB 14819\nLöschungsankündigung\n\nScandinavian Autohaus GmbH\nGesellschaft mit beschränkter Haftung\nHarrislee\n\nEs ist die Löschung der nachstehenden Gesellschaft wegen Vermögenslosigkeit gemäß § 394 FamFG beabsichtigt.\nWiderspruchsfrist: 2 Monate"
    },
    {
      "date": "2026-02-16",
      "id": "145181",
      "original_text": "Löschungsankündigung\nBerlin Amtsgericht Berlin (Charlottenburg) HRA 49855\nSpree-Living-Area GmbH & Co. KG – Berlin",
      "type": "Löschungsankündigung",
      "state": "Berlin",
      "amtsgericht": "Amtsgericht Berlin (Charlottenburg)",
      "registernummer": "HRA 49855",
      "registerart": "HRA",
      "company_name": "Spree-Living-Area GmbH & Co. KG",
      "company_seat": "Berlin",
      "details": "16.02.2026 (Bekanntmachungsdatum)\n\nBerlin Amtsgericht Berlin (Charlottenburg) HRA 49855\nLöschungsankündigung\n\nSpree-Living-Area GmbH & Co. KG\nKommanditgesellschaft\nBerlin\n\nBei dem nachstehenden Unternehmen / der nachstehenden Gesellschaft wird das Amtslöschungsverfahren gemäß § 31 Abs. 2 HGB eingeleitet. Widerspruchsfrist 1 Monat"
    },
    {
      "date": "2026-02-16",
      "id": "145182",
      "original_text": "Löschungsankündigung\nBerlin Amtsgericht Berlin (Charlottenburg) HRB 262381\nQB BAU UG (haftungsbeschränkt) – Berlin",
      "type": "Löschungsankündigung",
      "state": "Berlin",
      "amtsgericht": "Amtsgericht Berlin (Charlottenburg)",
      "registernummer": "HRB 262381",
      "registerart": "HRB",
      "company_name": "QB BAU UG (haftungsbeschränkt)",
      "company_seat": "Berlin",
      "details": "16.02.2026 (Bekanntmachungsdatum)\n\nBerlin Amtsgericht Berlin (Charlottenburg) HRB 262381\nLöschungsankündigung\n\nQB BAU UG (haftungsbeschränkt)\nGesellschaft mit beschränkter Haftung\nBerlin\n\nBei der nachstehenden Gesellschaft wird das Amtslöschungsverfahren gemäß § 394 FamFG eingeleitet. Widerspruchsfrist 6 Wochen"
    },
    {
      "date": "2026-02-16",
      "id": "145183",
      "original_text": "Löschungsankündigung\nBerlin Amtsgericht Berlin (Charlottenburg) HRB 253442\nCAP Bauausführungen GmbH – Berlin",
      "type": "Löschungsankündigung",
      "state": "Berlin",
      "amtsgericht": "Amtsgericht Berlin (Charlottenburg)",
      "registernummer": "HRB 253442",
      "registerart": "HRB",
      "company_name": "CAP Bauausführungen GmbH",
      "company_seat": "Berlin",
      "details": "16.02.2026 (Bekanntmachungsdatum)\n\nBerlin Amtsgericht Berlin (Charlottenburg) HRB 253442\nLöschungsankündigung\n\nCAP Bauausführungen GmbH\nGesellschaft mit beschränkter Haftung\nBerlin\n\nBei der nachstehenden Gesellschaft wird das Amtslöschungsverfahren gemäß § 394 FamFG eingeleitet. Widerspruchsfrist 6 Wochen"
    },
    {
      "date": "2026-02-16",
      "id": "145184",
      "original_text": "Löschungsankündigung\nSchleswig-Holstein Amtsgericht Kiel HRB 27382\nSchwarze Gold UG (haftungsbeschränkt) – Bad Bramstedt",
      "type": "Löschungsankündigung",
      "state": "Schleswig-Holstein",
      "amtsgericht": "Amtsgericht Kiel",
      "registernummer": "HRB 27382",
      "registerart": "HRB",
      "company_name": "Schwarze Gold UG (haftungsbeschränkt)",
      "company_seat": "Bad Bramstedt",
      "details": "16.02.2026 (Bekanntmachungsdatum)\n\nSchleswig-Holstein Amtsgericht Kiel HRB 27382\nLöschungsankündigung\n\nSchwarze Gold UG (haftungsbeschränkt)\nGesellschaft mit beschränkter Haftung\nBad Bramstedt\n\nEs ist die Löschung der nachstehenden Gesellschaft wegen Vermögenslosigkeit gemäß § 394 FamFG beabsichtigt. Widerspruchsfrist: 2 Monate."
    },
    {
      "date": "2026-02-16",
      "id": "145185",
      "original_text": "Registerbekanntmachung nach dem Umwandlungsgesetz\nThüringen Amtsgericht Jena HRB 404936\nORLOB Verwaltungs GmbH – Leinefelde-Worbis",
      "type": "Registerbekanntmachung nach dem Umwandlungsgesetz",
      "state": "Thüringen",
      "amtsgericht": "Amtsgericht Jena",
      "registernummer": "HRB 404936",
      "registerart": "HRB",
      "company_name": "ORLOB Verwaltungs GmbH",
      "company_seat": "Leinefelde-Worbis",
      "details": "16.02.2026 (Bekanntmachungsdatum)\n\nThüringen Amtsgericht Jena HRB 404936\nRegisterbekanntmachung nach dem Umwandlungsgesetz 16.02.2026 (Eintragungsdatum)\n\nORLOB Verwaltungs GmbH\nGesellschaft mit beschränkter Haftung\nLeinefelde-Worbis\n\nNicht eingetragen: Den Gläubigern der an der Verschmelzung beteiligten Rechtsträger, ist wenn sie binnen sechs Monaten nach dem Tag, an dem die Eintragung der Verschmelzung in das Register des Sitzes desjenigen Rechtsträgers, dessen Gläubiger sie sind,  nach § 19 Abs. 3 UmwG als bekanntgemacht gilt, ihren Anspruch nach Grund und Höhe schriftlich anmelden, Sicherheit zu leisten, soweit sie nicht Befriedigung verlangen können. Dieses Recht steht ihnen jedoch nur zu, wenn sie glaubhaft machen, daß durch die Verschmelzung die Erfüllung ihrer Forderung gefährdet wird."
    },
    {
      "date": "2026-02-16",
      "id": "145186",
      "original_text": "Sonstige Registerbekanntmachung\nBrandenburg Amtsgericht Potsdam HRB 37747\nM&S MoveSmooth GmbH – Großbeeren",
      "type": "Sonstige Registerbekanntmachung",
      "state": "Brandenburg",
      "amtsgericht": "Amtsgericht Potsdam",
      "registernummer": "HRB 37747",
      "registerart": "HRB",
      "company_name": "M&S MoveSmooth GmbH",
      "company_seat": "Großbeeren",
      "details": "16.02.2026 (Bekanntmachungsdatum)\n\nBrandenburg Amtsgericht Potsdam HRB 37747\nSonstige Registerbekanntmachung\n\nM&S MoveSmooth GmbH\nGesellschaft mit beschränkter Haftung\nGroßbeeren\n\nAls nicht eingetragen wird veröffentlicht: Das am 31.05.2025 eingeleitete Amtslöschungsverfahren wird mit Beschluss vom 14.02.2026 aufgehoben."
    },
    {
      "date": "2026-02-16",
      "id": "145187",
      "original_text": "Registerbekanntmachung nach dem Umwandlungsgesetz\nBaden-Württemberg Amtsgericht Freiburg HRB 730059\nSonnenrain Verwaltungs GmbH – Herrischried",
      "type": "Registerbekanntmachung nach dem Umwandlungsgesetz",
      "state": "Baden-Württemberg",
      "amtsgericht": "Amtsgericht Freiburg",
      "registernummer": "HRB 730059",
      "registerart": "HRB",
      "company_name": "Sonnenrain Verwaltungs GmbH",
      "company_seat": "Herrischried",
      "details": "16.02.2026 (Bekanntmachungsdatum)\n\nBaden-Württemberg Amtsgericht Freiburg HRB 730059\nRegisterbekanntmachung nach dem Umwandlungsgesetz 16.02.2026 (Eintragungsdatum)\n\nSonnenrain Verwaltungs GmbH\nGesellschaft mit beschränkter Haftung\nHerrischried\n\nDie Gesellschaft ist auf die \"Seniorenstift Sonnenrain GmbH\" (Amtsgericht Freiburg, HRB 713213) verschmolzen. Den Gläubigern der an der Verschmelzung beteiligten Rechtsträger ist, wenn sie binnen sechs Monaten nach dem Tag, an dem die Eintragung der Verschmelzung in das Register des Sitzes desjenigen Rechtsträgers, dessen Gläubiger sie sind, nach § 19 Abs. 3 UmwG als bekanntgemacht gilt, ihren Anspruch nach Grund und Höhe schriftlich anmelden, Sicherheit zu leisten, soweit sie nicht Befriedigung verlangen können. Dieses Recht steht den Gläubigern jedoch nur zu, wenn sie glaubhaft machen, dass durch die Verschmelzung die Erfüllung ihrer Forderung gefährdet wird."
    },
    {
      "date": "2026-02-16",
      "id": "145188",
      "original_text": "Löschungsankündigung\nBerlin Amtsgericht Berlin (Charlottenburg) HRB 222307\nEazy Limo GmbH – Berlin",
      "type": "Löschungsankündigung",
      "state": "Berlin",
      "amtsgericht": "Amtsgericht Berlin (Charlottenburg)",
      "registernummer": "HRB 222307",
      "registerart": "HRB",
      "company_name": "Eazy Limo GmbH",
      "company_seat": "Berlin",
      "details": "16.02.2026 (Bekanntmachungsdatum)\n\nBerlin Amtsgericht Berlin (Charlottenburg) HRB 222307\nLöschungsankündigung\n\nEazy Limo GmbH\nGesellschaft mit beschränkter Haftung\nBerlin\n\nBei der nachstehenden Gesellschaft wird das Amtslöschungsverfahren gemäß § 394 FamFG eingeleitet. Widerspruchsfrist 6 Wochen"
    },
    {
      "date": "2026-02-16",
      "id": "145189",
      "original_text": "Registerbekanntmachung nach dem Umwandlungsgesetz\nBaden-Württemberg Amtsgericht Freiburg HRB 713213\nSeniorenstift Sonnenrain GmbH – Herrischried",
      "type": "Registerbekanntmachung nach dem Umwandlungsgesetz",
      "state": "Baden-Württemberg",
      "amtsgericht": "Amtsgericht Freiburg",
      "registernummer": "HRB 713213",
      "registerart": "HRB",
      "company_name": "Seniorenstift Sonnenrain GmbH",
      "company_seat": "Herrischried",
      "details": "16.02.2026 (Bekanntmachungsdatum)\n\nBaden-Württemberg Amtsgericht Freiburg HRB 713213\nRegisterbekanntmachung nach dem Umwandlungsgesetz 16.02.2026 (Eintragungsdatum)\n\nSeniorenstift Sonnenrain GmbH\nGesellschaft mit beschränkter Haftung\nHerrischried\n\nAls nicht eingetragen wird bekanntgemacht:\nDen Gläubigern der an der Verschmelzung beteiligten Rechtsträger ist, wenn sie binnen sechs Monaten nach dem Tag, an dem die Eintragung der Verschmelzung in das Register des Sitzes desjenigen Rechtsträgers, dessen Gläubiger sie sind, nach § 19 Abs. 3 UmwG als bekanntgemacht gilt, ihren Anspruch nach Grund und Höhe schriftlich anmelden, Sicherheit zu leisten, soweit sie nicht Befriedigung verlangen können. Dieses Recht steht den Gläubigern jedoch nur zu, wenn sie glaubhaft machen, dass durch die Verschmelzung die Erfüllung ihrer Forderung gefährdet wird."
    },
    {
      "date": "2026-02-16",
      "id": "145190",
      "original_text": "Sonstige Registerbekanntmachung\nBaden-Württemberg Amtsgericht Mannheim GnR 360013\nBaugenossenschaft Busenbach e.G. – Waldbronn",
      "type": "Sonstige Registerbekanntmachung",
      "state": "Baden-Württemberg",
      "amtsgericht": "Amtsgericht Mannheim",
      "registernummer": "GnR 360013",
      "registerart": "GnR",
      "company_name": "Baugenossenschaft Busenbach e.G.",
      "company_seat": "Waldbronn",
      "details": "16.02.2026 (Bekanntmachungsdatum)\n\nBaden-Württemberg Amtsgericht Mannheim GnR 360013\nSonstige Registerbekanntmachung 16.02.2026 (Eintragungsdatum)\n\nBaugenossenschaft Busenbach e.G.\neingetragene Genossenschaft\nWaldbronn\n\nAls nicht eingetragen wird bekanntgemacht:\nDie Verpflichtung der Genossen, Nachschüsse zur Insolvenzmasse zu leisten, wurde aufgehoben. Den Gläubigern der Genossenschaft ist, wenn sie sich binnen sechs Monaten nach der Bekanntmachung bei der Genossenschaft zu diesem Zweck melden, Sicherheit zu leisten, soweit sie nicht Befriedigung verlangen können."
    },
    {
      "date": "2026-02-16",
      "id": "145191",
      "original_text": "Sonstige Registerbekanntmachung\nBaden-Württemberg Amtsgericht Mannheim HRB 700323\nMovilizer GmbH – Mannheim",
      "type": "Sonstige Registerbekanntmachung",
      "state": "Baden-Württemberg",
      "amtsgericht": "Amtsgericht Mannheim",
      "registernummer": "HRB 700323",
      "registerart": "HRB",
      "company_name": "Movilizer GmbH",
      "company_seat": "Mannheim",
      "details": "16.02.2026 (Bekanntmachungsdatum)\n\nBaden-Württemberg Amtsgericht Mannheim HRB 700323\nSonstige Registerbekanntmachung 16.02.2026 (Eintragungsdatum)\n\nMovilizer GmbH\nGesellschaft mit beschränkter Haftung\nMannheim\n\nDen Gläubigern der Gesellschaft, deren Forderungen begründet worden sind, bevor die Eintragung der Beendigung des Vertrages in das Handelsregister nach § 10 HGB als bekanntgemacht gilt, ist vom anderen Vertragsteil Sicherheit zu leisten, wenn sie sich binnen sechs Monaten nach der Bekanntmachung zu diesem Zweck bei ihm melden."
    },
    {
      "date": "2026-02-16",
      "id": "145192",
      "original_text": "Registerbekanntmachung nach dem Umwandlungsgesetz\nBaden-Württemberg Amtsgericht Mannheim HRB 751494\nFelten GmbH – Mosbach",
      "type": "Registerbekanntmachung nach dem Umwandlungsgesetz",
      "state": "Baden-Württemberg",
      "amtsgericht": "Amtsgericht Mannheim",
      "registernummer": "HRB 751494",
      "registerart": "HRB",
      "company_name": "Felten GmbH",
      "company_seat": "Mosbach",
      "details": "16.02.2026 (Bekanntmachungsdatum)\n\nBaden-Württemberg Amtsgericht Mannheim HRB 751494\nRegisterbekanntmachung nach dem Umwandlungsgesetz 16.02.2026 (Eintragungsdatum)\n\nFelten GmbH\nGesellschaft mit beschränkter Haftung\nMosbach\n\nAls nicht eingetragen wird bekanntgemacht:\nDen Gläubigern der an der Verschmelzung beteiligten Rechtsträger ist, wenn sie binnen sechs Monaten nach dem Tag, an dem die Eintragung der Verschmelzung in das Register des Sitzes desjenigen Rechtsträgers, dessen Gläubiger sie sind, nach § 19 Abs. 3 UmwG als bekanntgemacht gilt, ihren Anspruch nach Grund und Höhe schriftlich anmelden, Sicherheit zu leisten, soweit sie nicht Befriedigung verlangen können. Dieses Recht steht den Gläubigern jedoch nur zu, wenn sie glaubhaft machen, dass durch die Verschmelzung die Erfüllung ihrer Forderung gefährdet wird."
    },
    {
      "date": "2026-02-16",
      "id": "145193",
      "original_text": "Registerbekanntmachung nach dem Umwandlungsgesetz\nBaden-Württemberg Amtsgericht Stuttgart HRA 738898\nReusch Energietechnik GmbH & Co. KG – Metzingen",
      "type": "Registerbekanntmachung nach dem Umwandlungsgesetz",
      "state": "Baden-Württemberg",
      "amtsgericht": "Amtsgericht Stuttgart",
      "registernummer": "HRA 738898",
      "registerart": "HRA",
      "company_name": "Reusch Energietechnik GmbH & Co. KG",
      "company_seat": "Metzingen",
      "details": "16.02.2026 (Bekanntmachungsdatum)\n\nBaden-Württemberg Amtsgericht Stuttgart HRA 738898\nRegisterbekanntmachung nach dem Umwandlungsgesetz 16.02.2026 (Eintragungsdatum)\n\nReusch Energietechnik GmbH & Co. KG\nKommanditgesellschaft\nMetzingen\n\nAls nicht eingetragen wird bekanntgemacht:\nDen Gläubigern der an der Verschmelzung beteiligten Rechtsträger ist, wenn sie binnen sechs Monaten nach dem Tag, an dem die Eintragung der Verschmelzung in das Register des Sitzes desjenigen Rechtsträgers, dessen Gläubiger sie sind, nach § 19 Abs. 3 UmwG als bekanntgemacht gilt, ihren Anspruch nach Grund und Höhe schriftlich anmelden, Sicherheit zu leisten, soweit sie nicht Befriedigung verlangen können. Dieses Recht steht den Gläubigern jedoch nur zu, wenn sie glaubhaft machen, dass durch die Verschmelzung die Erfüllung ihrer Forderung gefährdet wird."
    },
    {
      "date": "2026-02-16",
      "id": "145194",
      "original_text": "Registerbekanntmachung nach dem Umwandlungsgesetz\nBaden-Württemberg Amtsgericht Mannheim HRB 756438\nBaumgärtner EDV GmbH – Wimsheim",
      "type": "Registerbekanntmachung nach dem Umwandlungsgesetz",
      "state": "Baden-Württemberg",
      "amtsgericht": "Amtsgericht Mannheim",
      "registernummer": "HRB 756438",
      "registerart": "HRB",
      "company_name": "Baumgärtner EDV GmbH",
      "company_seat": "Wimsheim",
      "details": "16.02.2026 (Bekanntmachungsdatum)\n\nBaden-Württemberg Amtsgericht Mannheim HRB 756438\nRegisterbekanntmachung nach dem Umwandlungsgesetz 16.02.2026 (Eintragungsdatum)\n\nBaumgärtner EDV GmbH\nGesellschaft mit beschränkter Haftung\nWimsheim\n\nAls nicht eingetragen wird bekanntgemacht:Den Gläubigern der an der Ausgliederung beteiligten Rechtsträger ist, wenn sie binnen sechs Monaten nach dem Tag, an dem die Eintragung der Ausgliederung in das Register des Sitzes desjenigen Rechtsträgers, dessen Gläubiger sie sind, nach § 19 Abs. 3 UmwG als bekanntgemacht gilt, ihren Anspruch nach Grund und Höhe schriftlich anmelden, Sicherheit zu leisten, soweit sie nicht Befriedigung verlangen können. Dieses Recht steht den Gläubigern jedoch nur zu, wenn sie glaubhaft machen, dass durch die Ausgliederung die Erfüllung ihrer Forderung gefährdet wird."
    },
    {
      "date": "2026-02-16",
      "id": "145195",
      "original_text": "Registerbekanntmachung nach dem Umwandlungsgesetz\nBaden-Württemberg Amtsgericht Mannheim HRA 712863\nSteffen Baumgärtner EDV e. K. – Wimsheim",
      "type": "Registerbekanntmachung nach dem Umwandlungsgesetz",
      "state": "Baden-Württemberg",
      "amtsgericht": "Amtsgericht Mannheim",
      "registernummer": "HRA 712863",
      "registerart": "HRA",
      "company_name": "Steffen Baumgärtner EDV e. K.",
      "company_seat": "Wimsheim",
      "details": "16.02.2026 (Bekanntmachungsdatum)\n\nBaden-Württemberg Amtsgericht Mannheim HRA 712863\nRegisterbekanntmachung nach dem Umwandlungsgesetz 16.02.2026 (Eintragungsdatum)\n\nSteffen Baumgärtner EDV e. K.\nEinzelkaufmann / Einzelkauffrau\nWimsheim\n\nAls nicht eingetragen wird bekanntgemacht:\nDen Gläubigern der an der Ausgliederung beteiligten Rechtsträger ist, wenn sie binnen sechs Monaten nach dem Tag, an dem die Eintragung der Ausgliederung in das Register des Sitzes desjenigen Rechtsträgers, dessen Gläubiger sie sind, nach § 19 Abs. 3 UmwG als bekanntgemacht gilt, ihren Anspruch nach Grund und Höhe schriftlich anmelden, Sicherheit zu leisten, soweit sie nicht Befriedigung verlangen können. Dieses Recht steht den Gläubigern jedoch nur zu, wenn sie glaubhaft machen, dass durch die Ausgliederung die Erfüllung ihrer Forderung gefährdet wird."
    },
    {
      "date": "2026-02-16",
      "id": "145196",
      "original_text": "Sonstige Registerbekanntmachung\nBaden-Württemberg Amtsgericht Ulm HRB 748647\nRapp SE – Weingarten",
      "type": "Sonstige Registerbekanntmachung",
      "state": "Baden-Württemberg",
      "amtsgericht": "Amtsgericht Ulm",
      "registernummer": "HRB 748647",
      "registerart": "HRB",
      "company_name": "Rapp SE",
      "company_seat": "Weingarten",
      "details": "16.02.2026 (Bekanntmachungsdatum)\n\nBaden-Württemberg Amtsgericht Ulm HRB 748647\nSonstige Registerbekanntmachung\n\nRapp SE\nEuropäische Aktiengesellschaft (SE)\nWeingarten\n\nDie Gesellschaft hat am 12.02.2026 die Liste über die Zusammensetzung des Aufsichtsrats/Verwaltungsrats zum Handelsregister eingereicht."
    },
    {
      "date": "2026-02-16",
      "id": "145197",
      "original_text": "Löschungsankündigung\nBerlin Amtsgericht Berlin (Charlottenburg) HRB 86483\n\"Promotec\" International AG – Berlin",
      "type": "Löschungsankündigung",
      "state": "Berlin",
      "amtsgericht": "Amtsgericht Berlin (Charlottenburg)",
      "registernummer": "HRB 86483",
      "registerart": "HRB",
      "company_name": "\"Promotec\" International AG",
      "company_seat": "Berlin",
      "details": "16.02.2026 (Bekanntmachungsdatum)\n\nBerlin Amtsgericht Berlin (Charlottenburg) HRB 86483\nLöschungsankündigung\n\n\"Promotec\" International AG\nAktiengesellschaft\nBerlin\n\nBei der nachstehenden Gesellschaft wird das Amtslöschungsverfahren gemäß § 394 FamFG eingeleitet. Widerspruchsfrist 6 Wochen"
    },
    {
      "date": "2026-02-16",
      "id": "145198",
      "original_text": "Einreichung neuer Dokumente\nBaden-Württemberg Amtsgericht Stuttgart GnR 380072\nFeldweg eG – Ammerbuch",
      "type": "Einreichung neuer Dokumente",
      "state": "Baden-Württemberg",
      "amtsgericht": "Amtsgericht Stuttgart",
      "registernummer": "GnR 380072",
      "registerart": "GnR",
      "company_name": "Feldweg eG",
      "company_seat": "Ammerbuch",
      "details": "16.02.2026 (Bekanntmachungsdatum)\n\nBaden-Württemberg Amtsgericht Stuttgart GnR 380072\nEinreichung neuer Dokumente 16.02.2026 (Eintragungsdatum)\n\nFeldweg eG\neingetragene Genossenschaft\nAmmerbuch\n\nDie Gesellschaft hat am 13.02.2026 die Liste über die Zusammensetzung des Aufsichtsrats zum Handelsregister eingereicht."
    },
    {
      "date": "2026-02-16",
      "id": "145199",
      "original_text": "Sonstige Registerbekanntmachung\nBaden-Württemberg Amtsgericht Mannheim HRB 708987\nSt. Josef Betriebsträger gemeinnützige GmbH – Pforzheim",
      "type": "Sonstige Registerbekanntmachung",
      "state": "Baden-Württemberg",
      "amtsgericht": "Amtsgericht Mannheim",
      "registernummer": "HRB 708987",
      "registerart": "HRB",
      "company_name": "St. Josef Betriebsträger gemeinnützige GmbH",
      "company_seat": "Pforzheim",
      "details": "16.02.2026 (Bekanntmachungsdatum)\n\nBaden-Württemberg Amtsgericht Mannheim HRB 708987\nSonstige Registerbekanntmachung 16.02.2026 (Eintragungsdatum)\n\nSt. Josef Betriebsträger gemeinnützige GmbH\nGesellschaft mit beschränkter Haftung\nPforzheim\n\nDie Gesellschaft hat am 15.01.2026 die Liste über die Zusammensetzung des Aufsichtsrats zum Handelsregister eingereicht."
    },
    {
      "date": "2026-02-16",
      "id": "145200",
      "original_text": "Registerbekanntmachung nach dem Umwandlungsgesetz\nSchleswig-Holstein Amtsgericht Pinneberg HRB 12905\nMusti´s Food GmbH – Brunsbüttel",
      "type": "Registerbekanntmachung nach dem Umwandlungsgesetz",
      "state": "Schleswig-Holstein",
      "amtsgericht": "Amtsgericht Pinneberg",
      "registernummer": "HRB 12905",
      "registerart": "HRB",
      "company_name": "Musti´s Food GmbH",
      "company_seat": "Brunsbüttel",
      "details": "16.02.2026 (Bekanntmachungsdatum)\n\nSchleswig-Holstein Amtsgericht Pinneberg HRB 12905\nRegisterbekanntmachung nach dem Umwandlungsgesetz 13.02.2026 (Eintragungsdatum)\n\nMusti´s Food GmbH\nGesellschaft mit beschränkter Haftung\nBrunsbüttel\n\nZu Eintragungsnummer 3 vom 13.02.2026 wird als nicht eingetragen veröffentlicht:  Den Gläubigern der an der Verschmelzung beteiligten Rechtsträger ist, wenn sie binnen sechs Monaten nach dem Tag, an dem die Eintragung der Verschmelzung in das Register des Sitzes desjenigen Rechtsträgers, dessen Gläubiger sie sind, als bekannt gemacht gilt, ihren Anspruch nach Grund und Höhe schriftlich anmelden, Sicherheit zu leisten, soweit sie nicht Befriedigung verlangen können. Dieses Recht steht den Gläubigern jedoch nur zu, wenn sie glaubhaft machen, dass durch die Verschmelzung die Erfüllung ihrer Forderung gefährdet wird. Das Recht, Sicherheitsleistung zu verlangen, steht Gläubigern nicht zu, die im Falle der Insolvenz ein Recht auf vorzugsweise Befriedigung aus einer Deckungsmasse haben, die nach gesetzlicher Vorschrift zu ihrem Schutz errichtet und staatlich überwacht ist."
    },
    {
      "date": "2026-02-16",
      "id": "145201",
      "original_text": "Registerbekanntmachung nach dem Umwandlungsgesetz\nBaden-Württemberg Amtsgericht Stuttgart VR 480214\nHaus- und Grundeigentümerverein Oberndorf und Umgebung – Oberndorf am Neckar",
      "type": "Registerbekanntmachung nach dem Umwandlungsgesetz",
      "state": "Baden-Württemberg",
      "amtsgericht": "Amtsgericht Stuttgart",
      "registernummer": "VR 480214",
      "registerart": "VR",
      "company_name": "Haus- und Grundeigentümerverein Oberndorf und Umgebung",
      "company_seat": "Oberndorf am Neckar",
      "details": "16.02.2026 (Bekanntmachungsdatum)\n\nBaden-Württemberg Amtsgericht Stuttgart VR 480214\nRegisterbekanntmachung nach dem Umwandlungsgesetz 16.02.2026 (Eintragungsdatum)\n\nHaus- und Grundeigentümerverein Oberndorf und Umgebung\neingetragener Verein\nOberndorf am Neckar\n\nDen Gläubigern der an der Verschmelzung beteiligten Rechtsträger ist, wenn sie binnen sechs Monaten nach dem Tag, an dem die Eintragung der Verschmelzung in das Register des Sitzes desjenigen Rechtsträgers, dessen Gläubiger sie sind, nach § 19 Abs. 3 UmwG als bekanntgemacht gilt, ihren Anspruch nach Grund und Höhe schriftlich anmelden, Sicherheit zu leisten, soweit sie nicht Befriedigung verlangen können. Dieses Recht steht den Gläubigern jedoch nur zu, wenn sie glaubhaft machen, dass durch die Verschmelzung die Erfüllung ihrer Forderung gefährdet wird."
    },
    {
      "date": "2026-02-16",
      "id": "145202",
      "original_text": "Löschungsankündigung\nSachsen Amtsgericht Chemnitz HRB 36445\nWachschutz Meinl UG (haftungsbeschränkt) – Falkenstein/Vogtl.",
      "type": "Löschungsankündigung",
      "state": "Sachsen",
      "amtsgericht": "Amtsgericht Chemnitz",
      "registernummer": "HRB 36445",
      "registerart": "HRB",
      "company_name": "Wachschutz Meinl UG (haftungsbeschränkt)",
      "company_seat": "Falkenstein/Vogtl.",
      "details": "16.02.2026 (Bekanntmachungsdatum)\n\nSachsen Amtsgericht Chemnitz HRB 36445\nLöschungsankündigung 16.02.2026 (Eintragungsdatum)\n\nWachschutz Meinl UG (haftungsbeschränkt)\nGesellschaft mit beschränkter Haftung\nFalkenstein/Vogtl.\n\nDas Registergericht beabsichtigt, die im Handelsregister eingetragene Gesellschaft von Amts wegen nach § 394 FamFG zu löschen. Die Frist zu Erhebung eines Widerspruchs gegen die beabsichtigte Löschung wird auf einen Monat festgesetzt."
    },
    {
      "date": "2026-02-16",
      "id": "145203",
      "original_text": "Sonstige Registerbekanntmachung\nSachsen Amtsgericht Leipzig HRB 43311\nMichels Sachsenklinik SE – Leipzig",
      "type": "Sonstige Registerbekanntmachung",
      "state": "Sachsen",
      "amtsgericht": "Amtsgericht Leipzig",
      "registernummer": "HRB 43311",
      "registerart": "HRB",
      "company_name": "Michels Sachsenklinik SE",
      "company_seat": "Leipzig",
      "details": "16.02.2026 (Bekanntmachungsdatum)\n\nSachsen Amtsgericht Leipzig HRB 43311\nSonstige Registerbekanntmachung\n\nMichels Sachsenklinik SE\nEuropäische Aktiengesellschaft (SE)\nLeipzig\n\nAm 11.02.2026 wurde beim Handelsregister des Amtsgerichts Leipzig die Liste der Mitglieder des Aufsichtsrats gemäß § 106 AktG eingereicht."
    },
    {
      "date": "2026-02-16",
      "id": "145204",
      "original_text": "Löschungsankündigung\nSachsen Amtsgericht Chemnitz HRB 31795\nRWS Handels- und Verwaltungs UG (haftungsbeschränkt) – Pausa-Mühltroff",
      "type": "Löschungsankündigung",
      "state": "Sachsen",
      "amtsgericht": "Amtsgericht Chemnitz",
      "registernummer": "HRB 31795",
      "registerart": "HRB",
      "company_name": "RWS Handels- und Verwaltungs UG (haftungsbeschränkt)",
      "company_seat": "Pausa-Mühltroff",
      "details": "16.02.2026 (Bekanntmachungsdatum)\n\nSachsen Amtsgericht Chemnitz HRB 31795\nLöschungsankündigung\n\nRWS Handels- und Verwaltungs UG (haftungsbeschränkt)\nGesellschaft mit beschränkter Haftung\nPausa-Mühltroff\n\nDas Registergericht beabsichtigt, die im Handelsregister eingetragene Gesellschaft von Amts wegen nach § 394 FamFG zu löschen. Die Frist zu Erhebung eines Widerspruchs gegen die beabsichtigte Löschung wird auf einen Monat festgesetzt."
    },
    {
      "date": "2026-02-16",
      "id": "145205",
      "original_text": "Registerbekanntmachung nach dem Umwandlungsgesetz\nSachsen Amtsgericht Dresden GsR 1036\nVorwerk Laucha eGbR – Löbau",
      "type": "Registerbekanntmachung nach dem Umwandlungsgesetz",
      "state": "Sachsen",
      "amtsgericht": "Amtsgericht Dresden",
      "registernummer": "GsR 1036",
      "registerart": "GsR",
      "company_name": "Vorwerk Laucha eGbR",
      "company_seat": "Löbau",
      "details": "16.02.2026 (Bekanntmachungsdatum)\n\nSachsen Amtsgericht Dresden GsR 1036\nRegisterbekanntmachung nach dem Umwandlungsgesetz 16.02.2026 (Eintragungsdatum)\n\nVorwerk Laucha eGbR\nGesellschaft bürgerlichen Rechts\nLöbau\n\nDen Gläubigern der an der Umwandlung beteiligten Rechtsträger ist, wenn sie binnen sechs Monaten nach dem Tag, an dem die Eintragung der Umwandlung in das Register des Sitzes desjenigen Rechtsträgers, dessen Gläubiger sie sind, nach § 19 Abs. 3 UmwG als bekannt gemacht gilt, ihren Anspruch nach Grund und Höhe in Textform anmelden, Sicherheit zu leisten, soweit sie nicht Befriedigung verlangen können. Dieses Recht steht den Gläubigern jedoch nur zu, wenn sie glaubhaft machen, dass durch die Umwandlung die Erfüllung der Forderung gefährdet wird."
    },
    {
      "date": "2026-02-16",
      "id": "145206",
      "original_text": "Löschungsankündigung\nSachsen Amtsgericht Dresden HRB 24172\nSST Stahl- und Stanztechnik GmbH – Hohwald",
      "type": "Löschungsankündigung",
      "state": "Sachsen",
      "amtsgericht": "Amtsgericht Dresden",
      "registernummer": "HRB 24172",
      "registerart": "HRB",
      "company_name": "SST Stahl- und Stanztechnik GmbH",
      "company_seat": "Hohwald",
      "details": "16.02.2026 (Bekanntmachungsdatum)\n\nSachsen Amtsgericht Dresden HRB 24172\nLöschungsankündigung\n\nSST Stahl- und Stanztechnik GmbH\nGesellschaft mit beschränkter Haftung\nHohwald\n\nDas Registergericht beabsichtigt, die im Handelsregister eingetragene Gesellschaft von Amts wegen nach § 394 FamFG zu löschen. Die Frist zu Erhebung eines Widerspruchs gegen die beabsichtigte Löschung wird auf einen Monat festgesetzt."
    },
    {
      "date": "2026-02-16",
      "id": "145207",
      "original_text": "Löschungsankündigung\nSachsen Amtsgericht Dresden HRB 29627\nANVILEX GmbH – Dresden",
      "type": "Löschungsankündigung",
      "state": "Sachsen",
      "amtsgericht": "Amtsgericht Dresden",
      "registernummer": "HRB 29627",
      "registerart": "HRB",
      "company_name": "ANVILEX GmbH",
      "company_seat": "Dresden",
      "details": "16.02.2026 (Bekanntmachungsdatum)\n\nSachsen Amtsgericht Dresden HRB 29627\nLöschungsankündigung\n\nANVILEX GmbH\nGesellschaft mit beschränkter Haftung\nDresden\n\nDas Registergericht beabsichtigt, die im Handelsregister eingetragene Gesellschaft von Amts wegen nach § 394 FamFG zu löschen. Die Frist zu Erhebung eines Widerspruchs gegen die beabsichtigte Löschung wird auf einen Monat festgesetzt."
    },
    {
      "date": "2026-02-16",
      "id": "145208",
      "original_text": "Löschungsankündigung\nNiedersachsen Amtsgericht Göttingen VR 130485\nTouristik-Information Töpferdorf Fredelsloh e.V. – Fredelsloh",
      "type": "Löschungsankündigung",
      "state": "Niedersachsen",
      "amtsgericht": "Amtsgericht Göttingen",
      "registernummer": "VR 130485",
      "registerart": "VR",
      "company_name": "Touristik-Information Töpferdorf Fredelsloh e.V.",
      "company_seat": "Fredelsloh",
      "details": "16.02.2026 (Bekanntmachungsdatum)\n\nNiedersachsen Amtsgericht Göttingen VR 130485\nLöschungsankündigung\n\nTouristik-Information Töpferdorf Fredelsloh e.V.\neingetragener Verein\nFredelsloh\n\nDas Registergericht beabsichtigt, den Verein die Rechtsfähigkeit zu entziehen, § 73 BGB. Sollte der Verein noch bestehen und mehr als 2 Mitglieder haben, wird um diesbezügliche Mitteilung und Angabe der Mitglieder (mit Namen+ Anschrift) gebeten.\nDie Frist zur Erhebung eines Widerspruchs ist auf 1 Monat ab dieser Registerbekanntmachung festgesetzt."
    },
    {
      "date": "2026-02-16",
      "id": "145209",
      "original_text": "Einreichung neuer Dokumente\nNiedersachsen Amtsgericht Osnabrück HRB 100756 früher Amtsgericht Lingen (Ems)\nWirtschaftsbetriebe Lingen GmbH – Lingen/Ems",
      "type": "Einreichung neuer Dokumente",
      "state": "Niedersachsen",
      "amtsgericht": "Amtsgericht Osnabrück",
      "registernummer": "HRB 100756",
      "registerart": "HRB",
      "company_name": "Wirtschaftsbetriebe Lingen GmbH",
      "company_seat": "Lingen/Ems",
      "former_amtsgericht": "Lingen (Ems)",
      "details": "16.02.2026 (Bekanntmachungsdatum)\n\nNiedersachsen Amtsgericht Osnabrück HRB 100756 früher Amtsgericht Lingen (Ems)\nEinreichung neuer Dokumente 16.02.2026 (Eintragungsdatum)\n\nWirtschaftsbetriebe Lingen GmbH\nGesellschaft mit beschränkter Haftung\nLingen/Ems\n\nDie Liste der Mitglieder des Aufsichtsrats wurde beim Registergericht eingereicht."
    },
    {
      "date": "2026-02-16",
      "id": "145210",
      "original_text": "Registerbekanntmachung nach dem Umwandlungsgesetz\nNiedersachsen Amtsgericht Walsrode HRB 208342\nSTB Wöltjen GmbH – Steimbke",
      "type": "Registerbekanntmachung nach dem Umwandlungsgesetz",
      "state": "Niedersachsen",
      "amtsgericht": "Amtsgericht Walsrode",
      "registernummer": "HRB 208342",
      "registerart": "HRB",
      "company_name": "STB Wöltjen GmbH",
      "company_seat": "Steimbke",
      "details": "16.02.2026 (Bekanntmachungsdatum)\n\nNiedersachsen Amtsgericht Walsrode HRB 208342\nRegisterbekanntmachung nach dem Umwandlungsgesetz 16.02.2026 (Eintragungsdatum)\n\nSTB Wöltjen GmbH\nGesellschaft mit beschränkter Haftung\nSteimbke\n\nDen Gläubigern der an der Verschmelzung beteiligten Rechtsträger ist, wenn sie binnen sechs Monaten nach dem Tag, an dem die Eintragung der Verschmelzung in das Register des Sitzes desjenigen Rechtsträgers, dessen Gläubiger sie sind, nach § 19  Abs.  3 UmwG als bekannt gemacht gilt, ihren Anspruch nach Grund und Höhe schriftlich anmelden, Sicherheit zu leisten, soweit sie nicht Befriedigung verlangen können. Dieses Recht steht den Gläubigern jedoch nur zu, wenn sie glaubhaft machen, dass durch die Verschmelzung die Erfüllung der Forderung gefährdet wird."
    },
    {
      "date": "2026-02-16",
      "id": "145211",
      "original_text": "Registerbekanntmachung nach dem Umwandlungsgesetz\nNiedersachsen Amtsgericht Tostedt HRB 4122\nOVERSEAS-FREIGHTERS NVOCC Services GmbH – Neu Wulmstorf",
      "type": "Registerbekanntmachung nach dem Umwandlungsgesetz",
      "state": "Niedersachsen",
      "amtsgericht": "Amtsgericht Tostedt",
      "registernummer": "HRB 4122",
      "registerart": "HRB",
      "company_name": "OVERSEAS-FREIGHTERS NVOCC Services GmbH",
      "company_seat": "Neu Wulmstorf",
      "details": "16.02.2026 (Bekanntmachungsdatum)\n\nNiedersachsen Amtsgericht Tostedt HRB 4122\nRegisterbekanntmachung nach dem Umwandlungsgesetz 13.02.2026 (Eintragungsdatum)\n\nOVERSEAS-FREIGHTERS NVOCC Services GmbH\nGesellschaft mit beschränkter Haftung\nNeu Wulmstorf\n\nDen Gläubigern der an der formwechselnden Umwandlung beteiligten Rechtsträger ist, wenn sie binnen sechs Monaten nach dem Tag, an dem die Eintragung der Umwandlung in das Register des Sitzes desjenigen Rechtsträgers, dessen Gläubiger sie sind, nach § 19 Abs. 3 UmwG als bekannt gemacht gilt, ihren Anspruch nach Grund und Höhe schriftlich anmelden, Sicherheit zu leisten, soweit sie nicht Befriedigung verlangen können. Dieses Recht steht den Gläubigern jedoch nur zu, wenn sie glaubhaft machen, dass durch die formwechselnde Umwandlung die Erfüllung der Forderung gefährdet wird."
    },
    {
      "date": "2026-02-16",
      "id": "145212",
      "original_text": "Einreichung neuer Dokumente\nNiedersachsen Amtsgericht Oldenburg (Oldenburg) HRB 219399\nFriesen Elektra Green Energy AG – Sande",
      "type": "Einreichung neuer Dokumente",
      "state": "Niedersachsen",
      "amtsgericht": "Amtsgericht Oldenburg (Oldenburg)",
      "registernummer": "HRB 219399",
      "registerart": "HRB",
      "company_name": "Friesen Elektra Green Energy AG",
      "company_seat": "Sande",
      "details": "16.02.2026 (Bekanntmachungsdatum)\n\nNiedersachsen Amtsgericht Oldenburg (Oldenburg) HRB 219399\nEinreichung neuer Dokumente 16.02.2025 (Eintragungsdatum)\n\nFriesen Elektra Green Energy AG\nAktiengesellschaft\nSande\n\nDie Liste der Mitglieder des Aufsichtsrats wurde beim Registergericht eingereicht."
    },
    {
      "date": "2026-02-16",
      "id": "145213",
      "original_text": "Einreichung neuer Dokumente\nNiedersachsen Amtsgericht Hannover HRB 59699\nProvinzial Krankenversicherung Hannover AG – Hannover",
      "type": "Einreichung neuer Dokumente",
      "state": "Niedersachsen",
      "amtsgericht": "Amtsgericht Hannover",
      "registernummer": "HRB 59699",
      "registerart": "HRB",
      "company_name": "Provinzial Krankenversicherung Hannover AG",
      "company_seat": "Hannover",
      "details": "16.02.2026 (Bekanntmachungsdatum)\n\nNiedersachsen Amtsgericht Hannover HRB 59699\nEinreichung neuer Dokumente\n\nProvinzial Krankenversicherung Hannover AG\nAktiengesellschaft\nHannover\n\nDie Liste der Mitglieder des Aufsichtsrats wurde beim Registergericht eingereicht."
    },
    {
      "date": "2026-02-16",
      "id": "145214",
      "original_text": "Löschungsankündigung\nNiedersachsen Amtsgericht Hildesheim HRB 205606\nOrlowski Bau GmbH – Uetze",
      "type": "Löschungsankündigung",
      "state": "Niedersachsen",
      "amtsgericht": "Amtsgericht Hildesheim",
      "registernummer": "HRB 205606",
      "registerart": "HRB",
      "company_name": "Orlowski Bau GmbH",
      "company_seat": "Uetze",
      "details": "16.02.2026 (Bekanntmachungsdatum)\n\nNiedersachsen Amtsgericht Hildesheim HRB 205606\nLöschungsankündigung\n\nOrlowski Bau GmbH\nGesellschaft mit beschränkter Haftung\nUetze\n\nDas Registergericht beabsichtigt, die Gesellschaft von Amts wegen nach § 394 FamFG zu löschen. Die Frist zur Erhebung eines Widerspruchs ist auf 1 Monat ab dieser Registerbekanntmachung festgesetzt."
    },
    {
      "date": "2026-02-16",
      "id": "145215",
      "original_text": "Sonstige Registerbekanntmachung\nNiedersachsen Amtsgericht Hannover HRB 51177\nSSV SCHADENSCHUTZVERBAND GmbH – Hannover",
      "type": "Sonstige Registerbekanntmachung",
      "state": "Niedersachsen",
      "amtsgericht": "Amtsgericht Hannover",
      "registernummer": "HRB 51177",
      "registerart": "HRB",
      "company_name": "SSV SCHADENSCHUTZVERBAND GmbH",
      "company_seat": "Hannover",
      "details": "16.02.2026 (Bekanntmachungsdatum)\n\nNiedersachsen Amtsgericht Hannover HRB 51177\nSonstige Registerbekanntmachung 16.02.2026 (Eintragungsdatum)\n\nSSV SCHADENSCHUTZVERBAND GmbH\nGesellschaft mit beschränkter Haftung\nHannover\n\nDen Gläubigern der Gesellschaft, deren Forderungen begründet worden sind, bevor die Eintragung der Beendigung des Vertrages in das Handelsregister nach § 10 HGB als bekanntgemacht gilt, ist vom anderen Vertragsteil Sicherheit zu leisten, wenn sie sich binnen sechs Monaten nach der Bekanntmachung zu diesem Zweck bei ihm melden."
    },
    {
      "date": "2026-02-16",
      "id": "145216",
      "original_text": "Löschungsankündigung\nNiedersachsen Amtsgericht Osnabrück HRA 207096\nKW Lux GmbH & Co. KG – Werlte",
      "type": "Löschungsankündigung",
      "state": "Niedersachsen",
      "amtsgericht": "Amtsgericht Osnabrück",
      "registernummer": "HRA 207096",
      "registerart": "HRA",
      "company_name": "KW Lux GmbH & Co. KG",
      "company_seat": "Werlte",
      "details": "16.02.2026 (Bekanntmachungsdatum)\n\nNiedersachsen Amtsgericht Osnabrück HRA 207096\nLöschungsankündigung\n\nKW Lux GmbH & Co. KG\nKommanditgesellschaft\nWerlte\n\nDas Registergericht beabsichtigt, die Firma von Amts wegen nach § 395 FamFG wegen Vermögenlosigkeit zu löschen. Die Frist zur Erhebung eines Widerspruchs ist auf 1 Monat ab dieser Registerbekanntmachung festgesetzt."
    },
    {
      "date": "2026-02-16",
      "id": "145217",
      "original_text": "Sonstige Registerbekanntmachung\nNiedersachsen Amtsgericht Hildesheim HRB 3467\nWinter Baustoffe GmbH – Hildesheim",
      "type": "Sonstige Registerbekanntmachung",
      "state": "Niedersachsen",
      "amtsgericht": "Amtsgericht Hildesheim",
      "registernummer": "HRB 3467",
      "registerart": "HRB",
      "company_name": "Winter Baustoffe GmbH",
      "company_seat": "Hildesheim",
      "details": "16.02.2026 (Bekanntmachungsdatum)\n\nNiedersachsen Amtsgericht Hildesheim HRB 3467\nSonstige Registerbekanntmachung 16.02.2026 (Eintragungsdatum)\n\nWinter Baustoffe GmbH\nGesellschaft mit beschränkter Haftung\nHildesheim\n\nDen Gläubigern der Gesellschaft, deren Forderungen begründet worden sind, bevor die Eintragung der Beendigung des Vertrages in das Handelsregister nach § 10 des Handelsgesetzbuches als bekanntgemacht gilt, hat der andere Vertragsteil Sicherheit zu leisten, wenn sie sich binnen sechs Monaten nach der Bekanntmachung der Eintragung zu diesem Zweck bei ihm melden"
    },
    {
      "date": "2026-02-16",
      "id": "145218",
      "original_text": "Registerbekanntmachung nach dem Umwandlungsgesetz\nNiedersachsen Amtsgericht Hannover HRB 222210\nLigena GmbH – Neustadt a. Rbge.",
      "type": "Registerbekanntmachung nach dem Umwandlungsgesetz",
      "state": "Niedersachsen",
      "amtsgericht": "Amtsgericht Hannover",
      "registernummer": "HRB 222210",
      "registerart": "HRB",
      "company_name": "Ligena GmbH",
      "company_seat": "Neustadt a. Rbge.",
      "details": "16.02.2026 (Bekanntmachungsdatum)\n\nNiedersachsen Amtsgericht Hannover HRB 222210\nRegisterbekanntmachung nach dem Umwandlungsgesetz 16.02.2026 (Eintragungsdatum)\n\nLigena GmbH\nGesellschaft mit beschränkter Haftung\nNeustadt a. Rbge.\n\nDen Gläubigern der an der Verschmelzung beteiligten Rechtsträger ist, wenn sie binnen sechs Monaten nach dem Tag, an dem die Eintragung der Verschmelzung in das Register des Sitzes desjenigen Rechtsträgers, dessen Gläubiger sie sind, nach § 19  Abs.  3 UmwG als bekannt gemacht gilt, ihren Anspruch nach Grund und Höhe schriftlich anmelden, Sicherheit zu leisten, soweit sie nicht Befriedigung verlangen können. Dieses Recht steht den Gläubigern jedoch nur zu, wenn sie glaubhaft machen, dass durch die Verschmelzung die Erfüllung der Forderung gefährdet wird."
    },
    {
      "date": "2026-02-16",
      "id": "145219",
      "original_text": "Löschungsankündigung\nRheinland-Pfalz Amtsgericht Wittlich HRB 45753\nLaub Haus GmbH – Gusterath",
      "type": "Löschungsankündigung",
      "state": "Rheinland-Pfalz",
      "amtsgericht": "Amtsgericht Wittlich",
      "registernummer": "HRB 45753",
      "registerart": "HRB",
      "company_name": "Laub Haus GmbH",
      "company_seat": "Gusterath",
      "details": "16.02.2026 (Bekanntmachungsdatum)\n\nRheinland-Pfalz Amtsgericht Wittlich HRB 45753\nLöschungsankündigung\n\nLaub Haus GmbH\nGesellschaft mit beschränkter Haftung\nGusterath\n\nDas Registergericht beabsichtigt die Gesellschaft von Amts wegen nach § 394 FamFG zu löschen. Die Frist zur Erhebung eines Widerspruchs ist auf einen Monat festgesetzt."
    },
    {
      "date": "2026-02-16",
      "id": "145220",
      "original_text": "Registerbekanntmachung nach dem Umwandlungsgesetz\nNordrhein-Westfalen Amtsgericht Köln HRB 46046\nAVS Verkehrssicherung GmbH – Leverkusen",
      "type": "Registerbekanntmachung nach dem Umwandlungsgesetz",
      "state": "Nordrhein-Westfalen",
      "amtsgericht": "Amtsgericht Köln",
      "registernummer": "HRB 46046",
      "registerart": "HRB",
      "company_name": "AVS Verkehrssicherung GmbH",
      "company_seat": "Leverkusen",
      "details": "16.02.2026 (Bekanntmachungsdatum)\n\nNordrhein-Westfalen Amtsgericht Köln HRB 46046\nRegisterbekanntmachung nach dem Umwandlungsgesetz 16.02.2026 (Eintragungsdatum)\n\nAVS Verkehrssicherung GmbH\nGesellschaft mit beschränkter Haftung\nLeverkusen\n\nDen Gläubigern der an der Verschmelzung beteiligten Rechtsträger ist, wenn sie binnen sechs Monaten nach dem Tag, an dem die Eintragung der Verschmelzung in das Register des Sitzes desjenigen Rechtsträgers, dessen Gläubiger sie sind, nach § 19 Absatz 3 UmwG als bekanntgemacht gilt, ihren Anspruch nach Grund und Höhe schriftlich anmelden, Sicherheit zu leisten, soweit sie nicht Befriedigung verlangen können. Dieses Recht steht den Gläubigern jedoch nur zu, wenn sie glaubhaft machen, dass durch die Verschmelzung die Erfüllung ihrer Forderung gefährdet wird."
    },
    {
      "date": "2026-02-16",
      "id": "145221",
      "original_text": "Einreichung neuer Dokumente\nHessen Amtsgericht Frankfurt am Main HRB 84850\nATLAS Vertriebsservice GmbH – Frankfurt am Main",
      "type": "Einreichung neuer Dokumente",
      "state": "Hessen",
      "amtsgericht": "Amtsgericht Frankfurt am Main",
      "registernummer": "HRB 84850",
      "registerart": "HRB",
      "company_name": "ATLAS Vertriebsservice GmbH",
      "company_seat": "Frankfurt am Main",
      "details": "16.02.2026 (Bekanntmachungsdatum)\n\nHessen Amtsgericht Frankfurt am Main HRB 84850\nEinreichung neuer Dokumente\n\nATLAS Vertriebsservice GmbH\nGesellschaft mit beschränkter Haftung\nFrankfurt am Main\n\nDurch eine Änderung in den Personen der Aufsichtsratsmitglieder ist eine Liste der Mitglieder des Aufsichtsrates zum Handelsregister eingereicht worden."
    },
    {
      "date": "2026-02-16",
      "id": "145222",
      "original_text": "Registerbekanntmachung nach dem Umwandlungsgesetz\nHessen Amtsgericht Frankfurt am Main HRB 130206\nPlatin 2383. GmbH – Frankfurt am Main",
      "type": "Registerbekanntmachung nach dem Umwandlungsgesetz",
      "state": "Hessen",
      "amtsgericht": "Amtsgericht Frankfurt am Main",
      "registernummer": "HRB 130206",
      "registerart": "HRB",
      "company_name": "Platin 2383. GmbH",
      "company_seat": "Frankfurt am Main",
      "details": "16.02.2026 (Bekanntmachungsdatum)\n\nHessen Amtsgericht Frankfurt am Main HRB 130206\nRegisterbekanntmachung nach dem Umwandlungsgesetz 16.02.2026 (Eintragungsdatum)\n\nPlatin 2383. GmbH\nGesellschaft mit beschränkter Haftung\nFrankfurt am Main\n\nDen Gläubigern der an der Verschmelzung beteiligten Rechtsträger ist, wenn sie binnen sechs Monaten nach dem Tag, an dem die Eintragung der Verschmelzung in das Register des Sitzes desjenigen Rechtsträgers, dessen Gläubiger sie sind, nach § 19 Absatz 3 UmwG bekannt gemacht worden ist, ihren Anspruch nach Grund und Höhe schriftlich anmelden, Sicherheit zu leisten, soweit sie nicht Befriedigung verlangen können. Dieses Recht steht den Gläubigern jedoch nur zu, wenn sie glaubhaft machen, dass durch die Verschmelzung die Erfüllung ihrer Forderung gefährdet wird."
    },
    {
      "date": "2026-02-16",
      "id": "145223",
      "original_text": "Löschungsankündigung\nHessen Amtsgericht Wiesbaden HRB 30783\nKuPa Germany GmbH – Wiesbaden",
      "type": "Löschungsankündigung",
      "state": "Hessen",
      "amtsgericht": "Amtsgericht Wiesbaden",
      "registernummer": "HRB 30783",
      "registerart": "HRB",
      "company_name": "KuPa Germany GmbH",
      "company_seat": "Wiesbaden",
      "details": "16.02.2026 (Bekanntmachungsdatum)\n\nHessen Amtsgericht Wiesbaden HRB 30783\nLöschungsankündigung\n\nKuPa Germany GmbH\nGesellschaft mit beschränkter Haftung\nWiesbaden\n\nDas Registergericht beabsichtigt die im Handelsregister eingetragene Gesellschaft von Amts wegen nach § 394 FamFG zu löschen. Die Frist zur Erhebung eines Widerspruchs gegen die beabsichtigte Löschung wird auf 3 Monate festgesetzt."
    },
    {
      "date": "2026-02-16",
      "id": "145224",
      "original_text": "Sonstige Registerbekanntmachung\nHessen Amtsgericht Frankfurt am Main HRB 7685\nTreuhandverwaltung IGEMET Gesellschaft mit beschränkter Haftung – Frankfurt am Main",
      "type": "Sonstige Registerbekanntmachung",
      "state": "Hessen",
      "amtsgericht": "Amtsgericht Frankfurt am Main",
      "registernummer": "HRB 7685",
      "registerart": "HRB",
      "company_name": "Treuhandverwaltung IGEMET Gesellschaft mit beschränkter Haftung",
      "company_seat": "Frankfurt am Main",
      "details": "16.02.2026 (Bekanntmachungsdatum)\n\nHessen Amtsgericht Frankfurt am Main HRB 7685\nSonstige Registerbekanntmachung 16.02.2026 (Eintragungsdatum)\n\nTreuhandverwaltung IGEMET Gesellschaft mit beschränkter Haftung\nGesellschaft mit beschränkter Haftung\nFrankfurt am Main\n\nDurch eine Änderung in den Personen der Aufsichtsratsmitglieder ist eine Liste der Mitglieder des Aufsichtsrates zum Handelsregister eingereicht worden."
    },
    {
      "date": "2026-02-16",
      "id": "145225",
      "original_text": "Sonstige Registerbekanntmachung\nHessen Amtsgericht Wiesbaden VR 6037\ncon brio e.V. – Hochheim am Main",
      "type": "Sonstige Registerbekanntmachung",
      "state": "Hessen",
      "amtsgericht": "Amtsgericht Wiesbaden",
      "registernummer": "VR 6037",
      "registerart": "VR",
      "company_name": "con brio e.V.",
      "company_seat": "Hochheim am Main",
      "details": "16.02.2026 (Bekanntmachungsdatum)\n\nHessen Amtsgericht Wiesbaden VR 6037\nSonstige Registerbekanntmachung 16.02.2026 (Eintragungsdatum)\n\ncon brio e.V.\neingetragener Verein\nHochheim am Main\n\nDer Verein ist aufgelöst."
    },
    {
      "date": "2026-02-16",
      "id": "145226",
      "original_text": "Löschungsankündigung\nHessen Amtsgericht Wiesbaden HRB 29192\ntre Immobilien Project GmbH – Wiesbaden",
      "type": "Löschungsankündigung",
      "state": "Hessen",
      "amtsgericht": "Amtsgericht Wiesbaden",
      "registernummer": "HRB 29192",
      "registerart": "HRB",
      "company_name": "tre Immobilien Project GmbH",
      "company_seat": "Wiesbaden",
      "details": "16.02.2026 (Bekanntmachungsdatum)\n\nHessen Amtsgericht Wiesbaden HRB 29192\nLöschungsankündigung\n\ntre Immobilien Project GmbH\nGesellschaft mit beschränkter Haftung\nWiesbaden\n\nDas Registergericht beabsichtigt die im Handelsregister eingetragene Gesellschaft von Amts wegen nach § 394 FamFG zu löschen. Die Frist zur Erhebung eines Widerspruchs gegen die beabsichtigte Löschung wird auf 3 Monate festgesetzt."
    },
    {
      "date": "2026-02-16",
      "id": "145227",
      "original_text": "Registerbekanntmachung nach dem Umwandlungsgesetz\nHessen Amtsgericht Frankfurt am Main HRB 130787\nPlatin 2385. GmbH – Frankfurt am Main",
      "type": "Registerbekanntmachung nach dem Umwandlungsgesetz",
      "state": "Hessen",
      "amtsgericht": "Amtsgericht Frankfurt am Main",
      "registernummer": "HRB 130787",
      "registerart": "HRB",
      "company_name": "Platin 2385. GmbH",
      "company_seat": "Frankfurt am Main",
      "details": "16.02.2026 (Bekanntmachungsdatum)\n\nHessen Amtsgericht Frankfurt am Main HRB 130787\nRegisterbekanntmachung nach dem Umwandlungsgesetz 16.02.2026 (Eintragungsdatum)\n\nPlatin 2385. GmbH\nGesellschaft mit beschränkter Haftung\nFrankfurt am Main\n\nDen Gläubigern der an der Verschmelzung beteiligten Rechtsträger ist, wenn sie binnen sechs Monaten nach dem Tag, an dem die Eintragung der Verschmelzung in das Register des Sitzes desjenigen Rechtsträgers, dessen Gläubiger sie sind, nach § 19 Absatz 3 UmwG bekannt gemacht worden ist, ihren Anspruch nach Grund und Höhe schriftlich anmelden, Sicherheit zu leisten, soweit sie nicht Befriedigung verlangen können. Dieses Recht steht den Gläubigern jedoch nur zu, wenn sie glaubhaft machen, dass durch die Verschmelzung die Erfüllung ihrer Forderung gefährdet wird."
    }
  ]
}