{
  "date": "2026-02-19",
  "date_of_scrape": "2026-02-20T04:41:09.346Z",
  "tool_version": "0.2.0",
  "number_of_announcements": 221,
  "announcements": [
    {
      "date": "2026-02-19",
      "id": "145487",
      "original_text": "Einreichung neuer Dokumente\nBayern Amtsgericht München HRB 181879\nBiogasEquity Beteiligungs AG – München",
      "type": "Einreichung neuer Dokumente",
      "state": "Bayern",
      "amtsgericht": "Amtsgericht München",
      "registernummer": "HRB 181879",
      "registerart": "HRB",
      "company_name": "BiogasEquity Beteiligungs AG",
      "company_seat": "München",
      "details": "19.02.2026 (Bekanntmachungsdatum)\n\nBayern Amtsgericht München HRB 181879\nEinreichung neuer Dokumente\n\nBiogasEquity Beteiligungs AG\nAktiengesellschaft\nMünchen\n\nDem Amtsgericht München -Registergericht- ist eine Liste der Mitglieder des Aufsichtsrats eingereicht worden, § 106 AktG."
    },
    {
      "date": "2026-02-19",
      "id": "145488",
      "original_text": "Registerbekanntmachung nach dem Umwandlungsgesetz\nBayern Amtsgericht München HRB 308845\nBittl PV-Anlagen GmbH – Schongau",
      "type": "Registerbekanntmachung nach dem Umwandlungsgesetz",
      "state": "Bayern",
      "amtsgericht": "Amtsgericht München",
      "registernummer": "HRB 308845",
      "registerart": "HRB",
      "company_name": "Bittl PV-Anlagen GmbH",
      "company_seat": "Schongau",
      "details": "19.02.2026 (Bekanntmachungsdatum)\n\nBayern Amtsgericht München HRB 308845\nRegisterbekanntmachung nach dem Umwandlungsgesetz 18.02.2026 (Eintragungsdatum)\n\nBittl PV-Anlagen GmbH\nGesellschaft mit beschränkter Haftung\nSchongau\n\nDen Gläubigern der an der Ausgliederung beteiligten Rechtsträger ist, wenn sie binnen sechs Monaten nach dem Tag, an dem die Eintragung der Ausgliederung in das Register des Sitzes desjenigen Rechtsträgers, dessen Gläubiger sie sind, nach §§ 125, 19 Abs. 3 UmwG als bekannt gemacht gilt, ihren Anspruch nach Grund und Höhe in Textform anmelden, Sicherheit zu leisten, soweit sie nicht Befriedigung verlangen können. Dieses Recht steht den Gläubigern jedoch nur zu, wenn sie glaubhaft machen, dass durch die Ausgliederung die Erfüllung ihrer Forderung gefährdet wird."
    },
    {
      "date": "2026-02-19",
      "id": "145489",
      "original_text": "Einreichung neuer Dokumente\nBayern Amtsgericht München HRB 125275\nKulturGut AG – München",
      "type": "Einreichung neuer Dokumente",
      "state": "Bayern",
      "amtsgericht": "Amtsgericht München",
      "registernummer": "HRB 125275",
      "registerart": "HRB",
      "company_name": "KulturGut AG",
      "company_seat": "München",
      "details": "19.02.2026 (Bekanntmachungsdatum)\n\nBayern Amtsgericht München HRB 125275\nEinreichung neuer Dokumente\n\nKulturGut AG\nAktiengesellschaft\nMünchen\n\nDem Amtsgericht München -Registergericht- ist eine Liste der Mitglieder des Aufsichtsrats eingereicht worden, § 106 AktG."
    },
    {
      "date": "2026-02-19",
      "id": "145490",
      "original_text": "Einreichung neuer Dokumente\nBayern Amtsgericht Regensburg HRB 8381\nDVMA Deutsche Vermögensmakler Aktiengesellschaft – Regensburg",
      "type": "Einreichung neuer Dokumente",
      "state": "Bayern",
      "amtsgericht": "Amtsgericht Regensburg",
      "registernummer": "HRB 8381",
      "registerart": "HRB",
      "company_name": "DVMA Deutsche Vermögensmakler Aktiengesellschaft",
      "company_seat": "Regensburg",
      "details": "19.02.2026 (Bekanntmachungsdatum)\n\nBayern Amtsgericht Regensburg HRB 8381\nEinreichung neuer Dokumente 18.02.2026 (Eintragungsdatum)\n\nDVMA Deutsche Vermögensmakler Aktiengesellschaft\nAktiengesellschaft\nRegensburg\n\nDem Amtsgericht Regensburg -Registergericht- ist eine Liste der Mitglieder des Aufsichtsrats eingereicht worden, § 106 AktG."
    },
    {
      "date": "2026-02-19",
      "id": "145491",
      "original_text": "Löschungsankündigung\nBayern Amtsgericht München HRB 203650\n4 EVER YOUTH UG (haftungsbeschränkt) – München",
      "type": "Löschungsankündigung",
      "state": "Bayern",
      "amtsgericht": "Amtsgericht München",
      "registernummer": "HRB 203650",
      "registerart": "HRB",
      "company_name": "4 EVER YOUTH UG (haftungsbeschränkt)",
      "company_seat": "München",
      "details": "19.02.2026 (Bekanntmachungsdatum)\n\nBayern Amtsgericht München HRB 203650\nLöschungsankündigung 18.02.2026 (Eintragungsdatum)\n\n4 EVER YOUTH UG (haftungsbeschränkt)\nGesellschaft mit beschränkter Haftung\nMünchen\n\nDas Registergericht beabsichtigt, die im Handelsregister eingetragene Gesellschaft wegen Vermögenslosigkeit von Amts wegen nach § 394 FamFG zu löschen. #insert(Text=\"zztb_V_Widerspruchsfrist\")"
    },
    {
      "date": "2026-02-19",
      "id": "145492",
      "original_text": "Sonstige Registerbekanntmachung\nBayern Amtsgericht München HRB 226395\nPHÖNIX-Seniorenzentrum Zwei Linden GmbH – München",
      "type": "Sonstige Registerbekanntmachung",
      "state": "Bayern",
      "amtsgericht": "Amtsgericht München",
      "registernummer": "HRB 226395",
      "registerart": "HRB",
      "company_name": "PHÖNIX-Seniorenzentrum Zwei Linden GmbH",
      "company_seat": "München",
      "details": "19.02.2026 (Bekanntmachungsdatum)\n\nBayern Amtsgericht München HRB 226395\nSonstige Registerbekanntmachung 18.02.2026 (Eintragungsdatum)\n\nPHÖNIX-Seniorenzentrum Zwei Linden GmbH\nGesellschaft mit beschränkter Haftung\nMünchen\n\nDen Gläubigern der Gesellschaft, deren Forderungen begründet worden sind, bevor die Eintragung der Beendigung des Beherrschungs- und Gewinnabführungsvertrages in das Handelsregister nach § 10 des Handelsgesetzbuches als bekanntgemacht gilt, hat der andere Vertragsteil Sicherheit zu leisten, wenn sie sich binnen sechs Monaten nach der Bekanntmachung der Eintragung zu diesem Zweck bei ihm melden."
    },
    {
      "date": "2026-02-19",
      "id": "145493",
      "original_text": "Registerbekanntmachung nach dem Umwandlungsgesetz\nBayern Amtsgericht Memmingen HRB 20019\nInstreamMedia GmbH – Memmingen",
      "type": "Registerbekanntmachung nach dem Umwandlungsgesetz",
      "state": "Bayern",
      "amtsgericht": "Amtsgericht Memmingen",
      "registernummer": "HRB 20019",
      "registerart": "HRB",
      "company_name": "InstreamMedia GmbH",
      "company_seat": "Memmingen",
      "details": "19.02.2026 (Bekanntmachungsdatum)\n\nBayern Amtsgericht Memmingen HRB 20019\nRegisterbekanntmachung nach dem Umwandlungsgesetz 18.02.2026 (Eintragungsdatum)\n\nInstreamMedia GmbH\nGesellschaft mit beschränkter Haftung\nMemmingen\n\nDen Gläubigern der an der Verschmelzung beteiligten Rechtsträger ist, wenn sie binnen sechs Monaten nach dem Tag, an dem die Eintragung der Verschmelzung in das Register des Sitzes desjenigen Rechtsträgers, dessen Gläubiger sie sind, nach § 19 Abs. 3 UmwG als bekannt gemacht gilt, ihren Anspruch nach Grund und Höhe in Textform anmelden, Sicherheit zu leisten, soweit sie nicht Befriedigung verlangen können. Dieses Recht steht den Gläubigern jedoch nur zu, wenn sie glaubhaft machen, dass durch die Verschmelzung die Erfüllung ihrer Forderung gefährdet wird."
    },
    {
      "date": "2026-02-19",
      "id": "145494",
      "original_text": "Löschungsankündigung\nBayern Amtsgericht Hof HRB 4089\nVidi & Vici GmbH – Konradsreuth",
      "type": "Löschungsankündigung",
      "state": "Bayern",
      "amtsgericht": "Amtsgericht Hof",
      "registernummer": "HRB 4089",
      "registerart": "HRB",
      "company_name": "Vidi & Vici GmbH",
      "company_seat": "Konradsreuth",
      "details": "19.02.2026 (Bekanntmachungsdatum)\n\nBayern Amtsgericht Hof HRB 4089\nLöschungsankündigung\n\nVidi & Vici GmbH\nGesellschaft mit beschränkter Haftung\nKonradsreuth\n\nDas Registergericht beabsichtigt, die im Handelsregister eingetragene Gesellschaft wegen Vermögenslosigkeit von Amts wegen nach § 394 FamFG zu löschen. Die Frist zur Erhebung eines Widerspruchs ist auf sechs Wochen festgesetzt."
    },
    {
      "date": "2026-02-19",
      "id": "145495",
      "original_text": "Löschungsankündigung\nBayern Amtsgericht Bayreuth HRB 5931\nbau-werk industriebau schneider UG (haftungsbeschränkt) – Kulmbach",
      "type": "Löschungsankündigung",
      "state": "Bayern",
      "amtsgericht": "Amtsgericht Bayreuth",
      "registernummer": "HRB 5931",
      "registerart": "HRB",
      "company_name": "bau-werk industriebau schneider UG (haftungsbeschränkt)",
      "company_seat": "Kulmbach",
      "details": "19.02.2026 (Bekanntmachungsdatum)\n\nBayern Amtsgericht Bayreuth HRB 5931\nLöschungsankündigung\n\nbau-werk industriebau schneider UG (haftungsbeschränkt)\nGesellschaft mit beschränkter Haftung\nKulmbach\n\nDas Registergericht beabsichtigt, die im Handelsregister eingetragene Gesellschaft wegen Vermögenslosigkeit von Amts wegen nach § 394 FamFG zu löschen. Die Frist zur Erhebung eines Widerspruchs ist auf einen Monat festgesetzt."
    },
    {
      "date": "2026-02-19",
      "id": "145496",
      "original_text": "Registerbekanntmachung nach dem Umwandlungsgesetz\nBayern Amtsgericht München HRB 307733\nLifecycle Media GmbH – Grafrath",
      "type": "Registerbekanntmachung nach dem Umwandlungsgesetz",
      "state": "Bayern",
      "amtsgericht": "Amtsgericht München",
      "registernummer": "HRB 307733",
      "registerart": "HRB",
      "company_name": "Lifecycle Media GmbH",
      "company_seat": "Grafrath",
      "details": "19.02.2026 (Bekanntmachungsdatum)\n\nBayern Amtsgericht München HRB 307733\nRegisterbekanntmachung nach dem Umwandlungsgesetz 18.02.2026 (Eintragungsdatum)\n\nLifecycle Media GmbH\nGesellschaft mit beschränkter Haftung\nGrafrath\n\nDen Gläubigern der an der Ausgliederung beteiligten Rechtsträger ist, wenn sie binnen sechs Monaten nach dem Tag, an dem die Eintragung der Ausgliederung in das Register des Sitzes desjenigen Rechtsträgers, dessen Gläubiger sie sind, nach §§ 125, 19 Abs. 3 UmwG als bekannt gemacht gilt, ihren Anspruch nach Grund und Höhe in Textform anmelden, Sicherheit zu leisten, soweit sie nicht Befriedigung verlangen können. Dieses Recht steht den Gläubigern jedoch nur zu, wenn sie glaubhaft machen, dass durch die Ausgliederung die Erfüllung ihrer Forderung gefährdet wird."
    },
    {
      "date": "2026-02-19",
      "id": "145497",
      "original_text": "Löschungsankündigung\nBayern Amtsgericht München HRB 71449\nim-f-ass, Versicherungs-, Immobilien- und Finanzmakler GmbH – München",
      "type": "Löschungsankündigung",
      "state": "Bayern",
      "amtsgericht": "Amtsgericht München",
      "registernummer": "HRB 71449",
      "registerart": "HRB",
      "company_name": "im-f-ass, Versicherungs-, Immobilien- und Finanzmakler GmbH",
      "company_seat": "München",
      "details": "19.02.2026 (Bekanntmachungsdatum)\n\nBayern Amtsgericht München HRB 71449\nLöschungsankündigung 18.02.2026 (Eintragungsdatum)\n\nim-f-ass, Versicherungs-, Immobilien- und Finanzmakler GmbH\nGesellschaft mit beschränkter Haftung\nMünchen\n\nDas Registergericht beabsichtigt, die im Handelsregister eingetragene Gesellschaft wegen Vermögenslosigkeit von Amts wegen nach § 394 FamFG zu löschen. Die Frist zur Erhebung eines Widerspruchs ist auf drei Monate festgesetzt."
    },
    {
      "date": "2026-02-19",
      "id": "145498",
      "original_text": "Registerbekanntmachung nach dem Umwandlungsgesetz\nBayern Amtsgericht München HRB 228322\nTQ-Real Estate GmbH – Seefeld",
      "type": "Registerbekanntmachung nach dem Umwandlungsgesetz",
      "state": "Bayern",
      "amtsgericht": "Amtsgericht München",
      "registernummer": "HRB 228322",
      "registerart": "HRB",
      "company_name": "TQ-Real Estate GmbH",
      "company_seat": "Seefeld",
      "details": "19.02.2026 (Bekanntmachungsdatum)\n\nBayern Amtsgericht München HRB 228322\nRegisterbekanntmachung nach dem Umwandlungsgesetz 18.02.2026 (Eintragungsdatum)\n\nTQ-Real Estate GmbH\nGesellschaft mit beschränkter Haftung\nSeefeld\n\nDen Gläubigern der an der Verschmelzung beteiligten Rechtsträger ist, wenn sie binnen sechs Monaten nach dem Tag, an dem die Eintragung der Verschmelzung in das Register des Sitzes desjenigen Rechtsträgers, dessen Gläubiger sie sind, nach § 19 Abs. 3 UmwG als bekannt gemacht gilt, ihren Anspruch nach Grund und Höhe in Textform anmelden, Sicherheit zu leisten, soweit sie nicht Befriedigung verlangen können. Dieses Recht steht den Gläubigern jedoch nur zu, wenn sie glaubhaft machen, dass durch die Verschmelzung die Erfüllung ihrer Forderung gefährdet wird."
    },
    {
      "date": "2026-02-19",
      "id": "145499",
      "original_text": "Registerbekanntmachung nach dem Umwandlungsgesetz\nBayern Amtsgericht München HRB 178537\nB&S 2008 BO General GmbH – München",
      "type": "Registerbekanntmachung nach dem Umwandlungsgesetz",
      "state": "Bayern",
      "amtsgericht": "Amtsgericht München",
      "registernummer": "HRB 178537",
      "registerart": "HRB",
      "company_name": "B&S 2008 BO General GmbH",
      "company_seat": "München",
      "details": "19.02.2026 (Bekanntmachungsdatum)\n\nBayern Amtsgericht München HRB 178537\nRegisterbekanntmachung nach dem Umwandlungsgesetz 18.02.2026 (Eintragungsdatum)\n\nB&S 2008 BO General GmbH\nGesellschaft mit beschränkter Haftung\nMünchen\n\nDen Gläubigern der an der Verschmelzung beteiligten Rechtsträger ist, wenn sie binnen sechs Monaten nach dem Tag, an dem die Eintragung der Verschmelzung in das Register des Sitzes desjenigen Rechtsträgers, dessen Gläubiger sie sind, nach § 19 Abs. 3 UmwG als bekannt gemacht gilt, ihren Anspruch nach Grund und Höhe in Textform anmelden, Sicherheit zu leisten, soweit sie nicht Befriedigung verlangen können. Dieses Recht steht den Gläubigern jedoch nur zu, wenn sie glaubhaft machen, dass durch die Verschmelzung die Erfüllung ihrer Forderung gefährdet wird."
    },
    {
      "date": "2026-02-19",
      "id": "145500",
      "original_text": "Registerbekanntmachung nach dem Umwandlungsgesetz\nBayern Amtsgericht Memmingen HRB 16473\nnova UG (haftungsbeschränkt) – Memmingen",
      "type": "Registerbekanntmachung nach dem Umwandlungsgesetz",
      "state": "Bayern",
      "amtsgericht": "Amtsgericht Memmingen",
      "registernummer": "HRB 16473",
      "registerart": "HRB",
      "company_name": "nova UG (haftungsbeschränkt)",
      "company_seat": "Memmingen",
      "details": "19.02.2026 (Bekanntmachungsdatum)\n\nBayern Amtsgericht Memmingen HRB 16473\nRegisterbekanntmachung nach dem Umwandlungsgesetz 18.02.2026 (Eintragungsdatum)\n\nnova UG (haftungsbeschränkt)\nGesellschaft mit beschränkter Haftung\nMemmingen\n\nDen Gläubigern der an der Verschmelzung beteiligten Rechtsträger ist, wenn sie binnen sechs Monaten nach dem Tag, an dem die Eintragung der Verschmelzung in das Register des Sitzes desjenigen Rechtsträgers, dessen Gläubiger sie sind, nach § 19 Abs. 3 UmwG als bekannt gemacht gilt, ihren Anspruch nach Grund und Höhe in Textform anmelden, Sicherheit zu leisten, soweit sie nicht Befriedigung verlangen können. Dieses Recht steht den Gläubigern jedoch nur zu, wenn sie glaubhaft machen, dass durch die Verschmelzung die Erfüllung ihrer Forderung gefährdet wird."
    },
    {
      "date": "2026-02-19",
      "id": "145501",
      "original_text": "Einreichung neuer Dokumente\nBayern Amtsgericht München HRB 214729\nLufthansa CityLine GmbH – München",
      "type": "Einreichung neuer Dokumente",
      "state": "Bayern",
      "amtsgericht": "Amtsgericht München",
      "registernummer": "HRB 214729",
      "registerart": "HRB",
      "company_name": "Lufthansa CityLine GmbH",
      "company_seat": "München",
      "details": "19.02.2026 (Bekanntmachungsdatum)\n\nBayern Amtsgericht München HRB 214729\nEinreichung neuer Dokumente 18.02.2026 (Eintragungsdatum)\n\nLufthansa CityLine GmbH\nGesellschaft mit beschränkter Haftung\nMünchen\n\nDem Amtsgericht München -Registergericht- ist eine Liste der Mitglieder des Aufsichtsrats eingereicht worden, § 52 Abs. 3 S. 2 GmbHG."
    },
    {
      "date": "2026-02-19",
      "id": "145502",
      "original_text": "Registerbekanntmachung nach dem Umwandlungsgesetz\nBayern Amtsgericht München HRB 304481\nITP Business Services GmbH – München",
      "type": "Registerbekanntmachung nach dem Umwandlungsgesetz",
      "state": "Bayern",
      "amtsgericht": "Amtsgericht München",
      "registernummer": "HRB 304481",
      "registerart": "HRB",
      "company_name": "ITP Business Services GmbH",
      "company_seat": "München",
      "details": "19.02.2026 (Bekanntmachungsdatum)\n\nBayern Amtsgericht München HRB 304481\nRegisterbekanntmachung nach dem Umwandlungsgesetz 18.02.2026 (Eintragungsdatum)\n\nITP Business Services GmbH\nGesellschaft mit beschränkter Haftung\nMünchen\n\nDen Gläubigern der an der Verschmelzung beteiligten Rechtsträger ist, wenn sie binnen sechs Monaten nach dem Tag, an dem die Eintragung der Verschmelzung in das Register des Sitzes desjenigen Rechtsträgers, dessen Gläubiger sie sind, nach § 19 Abs. 3 UmwG als bekannt gemacht gilt, ihren Anspruch nach Grund und Höhe in Textform anmelden, Sicherheit zu leisten, soweit sie nicht Befriedigung verlangen können. Dieses Recht steht den Gläubigern jedoch nur zu, wenn sie glaubhaft machen, dass durch die Verschmelzung die Erfüllung ihrer Forderung gefährdet wird."
    },
    {
      "date": "2026-02-19",
      "id": "145503",
      "original_text": "Registerbekanntmachung nach dem Umwandlungsgesetz\nBayern Amtsgericht München HRB 305478\nDeubner Holding GmbH – München",
      "type": "Registerbekanntmachung nach dem Umwandlungsgesetz",
      "state": "Bayern",
      "amtsgericht": "Amtsgericht München",
      "registernummer": "HRB 305478",
      "registerart": "HRB",
      "company_name": "Deubner Holding GmbH",
      "company_seat": "München",
      "details": "19.02.2026 (Bekanntmachungsdatum)\n\nBayern Amtsgericht München HRB 305478\nRegisterbekanntmachung nach dem Umwandlungsgesetz 18.02.2026 (Eintragungsdatum)\n\nDeubner Holding GmbH\nGesellschaft mit beschränkter Haftung\nMünchen\n\nDen Gläubigern der an der Spaltung beteiligten Rechtsträger ist, wenn sie binnen sechs Monaten nach dem Tag, an dem die Eintragung der Spaltung in das Register des Sitzes desjenigen Rechtsträgers, dessen Gläubiger sie sind, nach §§ 125, 19 Abs. 3 UmwG als bekannt gemacht gilt, ihren Anspruch nach Grund und Höhe in Textform anmelden, Sicherheit zu leisten, soweit sie nicht Befriedigung verlangen können. Dieses Recht steht den Gläubigern jedoch nur zu, wenn sie glaubhaft machen, dass durch die Spaltung die Erfüllung ihrer Forderung gefährdet wird."
    },
    {
      "date": "2026-02-19",
      "id": "145504",
      "original_text": "Löschungsankündigung\nSaarland Amtsgericht Saarbrücken HRB 52799\nKFT Kunststoff-Fenster-Technik Irsch GmbH – Saarwellingen",
      "type": "Löschungsankündigung",
      "state": "Saarland",
      "amtsgericht": "Amtsgericht Saarbrücken",
      "registernummer": "HRB 52799",
      "registerart": "HRB",
      "company_name": "KFT Kunststoff-Fenster-Technik Irsch GmbH",
      "company_seat": "Saarwellingen",
      "details": "19.02.2026 (Bekanntmachungsdatum)\n\nSaarland Amtsgericht Saarbrücken HRB 52799\nLöschungsankündigung\n\nKFT Kunststoff-Fenster-Technik Irsch GmbH\nGesellschaft mit beschränkter Haftung\nSaarwellingen\n\nEs ist beabsichtigt, die Gesellschaft von Amts wegen gemäß § 394 FamFG wegen Vermögenslosigkeit zu löschen.\nGegen die Löschung von Amts wegen ist das Rechtsmittel des Widerspruchs statthaft. Der Widerspruch ist binnen einer Frist einem Monat beginnend mit dem Tag dieser Veröffentlichung durch Einreichen eines Widerspruchsschreibens -schriftlich oder zur Niederschrift der Geschäftsstelle beim Amtsgericht Saarbrücken, -zentrales Handelsregister-, Mainzerstr.178, 66121 Saarbrücken einzulegen.\nDer Widerspruch muss die Bezeichnung der angefochtenen Löschungsankündigung enthalten sowie die Erklärung, dass Widerspruch eingelegt wird. Er ist vom Widerspruchsführer oder seinem Bevollmächtigten zu unterzeichnen.\nDas Widerspruchsschreiben kann auch in der Form eines elektronischen Dokumentes eingereicht werden, das mit einer qualifizierten elektronischen Signatur nach dem Signaturgesetz versehen sein muss (§§ 14 Abs. 2 FamFG, 130a, 298 ZPO)."
    },
    {
      "date": "2026-02-19",
      "id": "145505",
      "original_text": "Löschungsankündigung\nSaarland Amtsgericht Saarbrücken HRB 103944\nph3D GmbH – Tholey",
      "type": "Löschungsankündigung",
      "state": "Saarland",
      "amtsgericht": "Amtsgericht Saarbrücken",
      "registernummer": "HRB 103944",
      "registerart": "HRB",
      "company_name": "ph3D GmbH",
      "company_seat": "Tholey",
      "details": "19.02.2026 (Bekanntmachungsdatum)\n\nSaarland Amtsgericht Saarbrücken HRB 103944\nLöschungsankündigung\n\nph3D GmbH\nGesellschaft mit beschränkter Haftung\nTholey\n\nEs ist beabsichtigt, die Gesellschaft von Amts wegen gemäß § 394 FamFG wegen Vermögenslosigkeit zu löschen.\nGegen die Löschung von Amts wegen ist das Rechtsmittel des Widerspruchs statthaft. Der Widerspruch ist binnen einer Frist zwei Monaten beginnend mit dem Tag dieser Veröffentlichung durch Einreichen eines Widerspruchsschreibens -schriftlich oder zur Niederschrift der Geschäftsstelle beim Amtsgericht Saarbrücken, -zentrales Handelsregister-, Mainzerstr.178, 66121 Saarbrücken einzulegen.\nDer Widerspruch muss die Bezeichnung der angefochtenen Löschungsankündigung enthalten sowie die Erklärung, dass Widerspruch eingelegt wird. Er ist vom Widerspruchsführer oder seinem Bevollmächtigten zu unterzeichnen.\nDas Widerspruchsschreiben kann auch in der Form eines elektronischen Dokumentes eingereicht werden, das mit einer qualifizierten elektronischen Signatur nach dem Signaturgesetz versehen sein muss (§§ 14 Abs. 2 FamFG, 130a, 298 ZPO)."
    },
    {
      "date": "2026-02-19",
      "id": "145506",
      "original_text": "Registerbekanntmachung nach dem Umwandlungsgesetz\nSaarland Amtsgericht Saarbrücken HRB 33057\nOpus Holding GmbH – Homburg",
      "type": "Registerbekanntmachung nach dem Umwandlungsgesetz",
      "state": "Saarland",
      "amtsgericht": "Amtsgericht Saarbrücken",
      "registernummer": "HRB 33057",
      "registerart": "HRB",
      "company_name": "Opus Holding GmbH",
      "company_seat": "Homburg",
      "details": "19.02.2026 (Bekanntmachungsdatum)\n\nSaarland Amtsgericht Saarbrücken HRB 33057\nRegisterbekanntmachung nach dem Umwandlungsgesetz 17.02.2026 (Eintragungsdatum)\n\nOpus Holding GmbH\nGesellschaft mit beschränkter Haftung\nHomburg\n\nAls nicht eingetragen wird bekannt gemacht: Den Gläubigern der an der Verschmelzung beteiligten Gesellschaften ist, wenn sie binnen sechs Monaten nach dem Tag, an dem die Eintragung der Verschmelzung in das Register des Sitzes desjenigen Rechtsträgers, dessen Gläubiger sie sind, nach § 19 Absatz 3 UmwG bekannt gemacht worden ist, ihren Anspruch nach Grund und Höhe schriftlich anmelden, Sicherheit zu leisten, soweit sie nicht Befriedigung verlangen können. Dieses Recht steht den Gläubigern jedoch nur zu, wenn sie glaubhaft machen, dass durch die Verschmelzung die Erfüllung ihrer Forderung gefährdet wird."
    },
    {
      "date": "2026-02-19",
      "id": "145507",
      "original_text": "Registerbekanntmachung nach dem Umwandlungsgesetz\nSaarland Amtsgericht Saarbrücken HRB 110928\nconTeyor Germany GmbH – Bous",
      "type": "Registerbekanntmachung nach dem Umwandlungsgesetz",
      "state": "Saarland",
      "amtsgericht": "Amtsgericht Saarbrücken",
      "registernummer": "HRB 110928",
      "registerart": "HRB",
      "company_name": "conTeyor Germany GmbH",
      "company_seat": "Bous",
      "details": "19.02.2026 (Bekanntmachungsdatum)\n\nSaarland Amtsgericht Saarbrücken HRB 110928\nRegisterbekanntmachung nach dem Umwandlungsgesetz 19.02.2026 (Eintragungsdatum)\n\nconTeyor Germany GmbH\nGesellschaft mit beschränkter Haftung\nBous\n\nAls nicht eingetragen wird bekannt gemacht: Den Gläubigern der an der Verschmelzung beteiligten Gesellschaften ist, wenn sie binnen sechs Monaten nach dem Tag, an dem die Eintragung der Verschmelzung in das Register des Sitzes desjenigen Rechtsträgers, dessen Gläubiger sie sind, nach § 19 Absatz 3 UmwG bekannt gemacht worden ist, ihren Anspruch nach Grund und Höhe schriftlich anmelden, Sicherheit zu leisten, soweit sie nicht Befriedigung verlangen können. Dieses Recht steht den Gläubigern jedoch nur zu, wenn sie glaubhaft machen, dass durch die Verschmelzung die Erfüllung ihrer Forderung gefährdet wird."
    },
    {
      "date": "2026-02-19",
      "id": "145508",
      "original_text": "Registerbekanntmachung nach dem Umwandlungsgesetz\nSaarland Amtsgericht Saarbrücken HRB 16064\nKTP Kunststoff Palettentechnik GmbH – Bous",
      "type": "Registerbekanntmachung nach dem Umwandlungsgesetz",
      "state": "Saarland",
      "amtsgericht": "Amtsgericht Saarbrücken",
      "registernummer": "HRB 16064",
      "registerart": "HRB",
      "company_name": "KTP Kunststoff Palettentechnik GmbH",
      "company_seat": "Bous",
      "details": "19.02.2026 (Bekanntmachungsdatum)\n\nSaarland Amtsgericht Saarbrücken HRB 16064\nRegisterbekanntmachung nach dem Umwandlungsgesetz 19.02.2026 (Eintragungsdatum)\n\nKTP Kunststoff Palettentechnik GmbH\nGesellschaft mit beschränkter Haftung\nBous\n\nAls nicht eingetragen wird bekannt gemacht: Den Gläubigern der an der Verschmelzung beteiligten Gesellschaften ist, wenn sie binnen sechs Monaten nach dem Tag, an dem die Eintragung der Verschmelzung in das Register des Sitzes desjenigen Rechtsträgers, dessen Gläubiger sie sind, nach § 19 Absatz 3 UmwG bekannt gemacht worden ist, ihren Anspruch nach Grund und Höhe schriftlich anmelden, Sicherheit zu leisten, soweit sie nicht Befriedigung verlangen können. Dieses Recht steht den Gläubigern jedoch nur zu, wenn sie glaubhaft machen, dass durch die Verschmelzung die Erfüllung ihrer Forderung gefährdet wird."
    },
    {
      "date": "2026-02-19",
      "id": "145509",
      "original_text": "Einreichung neuer Dokumente\nBaden-Württemberg Amtsgericht Mannheim HRB 738474\nabtis Holding AG – Pforzheim",
      "type": "Einreichung neuer Dokumente",
      "state": "Baden-Württemberg",
      "amtsgericht": "Amtsgericht Mannheim",
      "registernummer": "HRB 738474",
      "registerart": "HRB",
      "company_name": "abtis Holding AG",
      "company_seat": "Pforzheim",
      "details": "19.02.2026 (Bekanntmachungsdatum)\n\nBaden-Württemberg Amtsgericht Mannheim HRB 738474\nEinreichung neuer Dokumente\n\nabtis Holding AG\nAktiengesellschaft\nPforzheim\n\nDie Gesellschaft hat am 18.02.2026 die Liste über die Zusammensetzung des Aufsichtsrats zum Handelsregister eingereicht."
    },
    {
      "date": "2026-02-19",
      "id": "145510",
      "original_text": "Sonstige Registerbekanntmachung\nBaden-Württemberg Amtsgericht Mannheim HRB 330082\nHeidelberg Materials AG – Heidelberg",
      "type": "Sonstige Registerbekanntmachung",
      "state": "Baden-Württemberg",
      "amtsgericht": "Amtsgericht Mannheim",
      "registernummer": "HRB 330082",
      "registerart": "HRB",
      "company_name": "Heidelberg Materials AG",
      "company_seat": "Heidelberg",
      "details": "19.02.2026 (Bekanntmachungsdatum)\n\nBaden-Württemberg Amtsgericht Mannheim HRB 330082\nSonstige Registerbekanntmachung 19.02.2026 (Eintragungsdatum)\n\nHeidelberg Materials AG\nAktiengesellschaft\nHeidelberg\n\nDen Gläubigern, deren Forderungen begründet worden sind, bevor die Eintragung des Beschlusses bekanntgemacht worden ist, ist, wenn sie sich binnen sechs Monaten nach der Bekanntmachung zu diesem Zweck melden, Sicherheit zu leisten, soweit sie nicht Befriedigung verlangen können."
    },
    {
      "date": "2026-02-19",
      "id": "145511",
      "original_text": "Löschungsankündigung\nBaden-Württemberg Amtsgericht Ulm HRB 725704\nBio-Genuss GmbH Gesellschaft für Nahrung und Schulspeisen – Amtzell",
      "type": "Löschungsankündigung",
      "state": "Baden-Württemberg",
      "amtsgericht": "Amtsgericht Ulm",
      "registernummer": "HRB 725704",
      "registerart": "HRB",
      "company_name": "Bio-Genuss GmbH Gesellschaft für Nahrung und Schulspeisen",
      "company_seat": "Amtzell",
      "details": "19.02.2026 (Bekanntmachungsdatum)\n\nBaden-Württemberg Amtsgericht Ulm HRB 725704\nLöschungsankündigung\n\nBio-Genuss GmbH Gesellschaft für Nahrung und Schulspeisen\nGesellschaft mit beschränkter Haftung\nAmtzell\n\nDas Gericht beabsichtigt, die Gesellschaft wegen Vermögenslosigkeit im Handelsregister von Amts wegen nach § 394 FamFG zu löschen. Die Frist zur Geltendmachung eines Widerspruchs gegen die beabsichtigte Löschung ist auf  einen Monat ab Veröffentlichung bestimmt."
    },
    {
      "date": "2026-02-19",
      "id": "145512",
      "original_text": "Einreichung neuer Dokumente\nMecklenburg-Vorpommern Amtsgericht Stralsund HRB 21058\nCover Invest AG – Buschvitz",
      "type": "Einreichung neuer Dokumente",
      "state": "Mecklenburg-Vorpommern",
      "amtsgericht": "Amtsgericht Stralsund",
      "registernummer": "HRB 21058",
      "registerart": "HRB",
      "company_name": "Cover Invest AG",
      "company_seat": "Buschvitz",
      "details": "19.02.2026 (Bekanntmachungsdatum)\n\nMecklenburg-Vorpommern Amtsgericht Stralsund HRB 21058\nEinreichung neuer Dokumente\n\nCover Invest AG\nAktiengesellschaft\nBuschvitz"
    },
    {
      "date": "2026-02-19",
      "id": "145513",
      "original_text": "Löschungsankündigung\nBerlin Amtsgericht Berlin (Charlottenburg) HRB 118805\nGerMon Invest GmbH – Berlin",
      "type": "Löschungsankündigung",
      "state": "Berlin",
      "amtsgericht": "Amtsgericht Berlin (Charlottenburg)",
      "registernummer": "HRB 118805",
      "registerart": "HRB",
      "company_name": "GerMon Invest GmbH",
      "company_seat": "Berlin",
      "details": "19.02.2026 (Bekanntmachungsdatum)\n\nBerlin Amtsgericht Berlin (Charlottenburg) HRB 118805\nLöschungsankündigung\n\nGerMon Invest GmbH\nGesellschaft mit beschränkter Haftung\nBerlin\n\nBei der nachstehenden Gesellschaft wird das Amtslöschungsverfahren gemäß § 394 FamFG eingeleitet. Widerspruchsfrist 6 Wochen"
    },
    {
      "date": "2026-02-19",
      "id": "145514",
      "original_text": "Einreichung neuer Dokumente\nBerlin Amtsgericht Berlin (Charlottenburg) HRB 321\nTUI AG – Berlin und Hannover",
      "type": "Einreichung neuer Dokumente",
      "state": "Berlin",
      "amtsgericht": "Amtsgericht Berlin (Charlottenburg)",
      "registernummer": "HRB 321",
      "registerart": "HRB",
      "company_name": "TUI AG",
      "company_seat": "Berlin und Hannover",
      "details": "19.02.2026 (Bekanntmachungsdatum)\n\nBerlin Amtsgericht Berlin (Charlottenburg) HRB 321\nEinreichung neuer Dokumente\n\nTUI AG\nAktiengesellschaft\nBerlin und Hannover\n\nAls nicht eingetragen wird veröffentlicht: Es wurde eine neue Liste der Aufsichtsratsmitglieder eingereicht (§ 106 AktG)."
    },
    {
      "date": "2026-02-19",
      "id": "145515",
      "original_text": "Registerbekanntmachung nach dem Umwandlungsgesetz\nBaden-Württemberg Amtsgericht Stuttgart VR 250703\nHausener Schneckentheater e . V. – Weil der Stadt",
      "type": "Registerbekanntmachung nach dem Umwandlungsgesetz",
      "state": "Baden-Württemberg",
      "amtsgericht": "Amtsgericht Stuttgart",
      "registernummer": "VR 250703",
      "registerart": "VR",
      "company_name": "Hausener Schneckentheater e . V.",
      "company_seat": "Weil der Stadt",
      "details": "19.02.2026 (Bekanntmachungsdatum)\n\nBaden-Württemberg Amtsgericht Stuttgart VR 250703\nRegisterbekanntmachung nach dem Umwandlungsgesetz 19.02.2026 (Eintragungsdatum)\n\nHausener Schneckentheater e . V.\neingetragener Verein\nWeil der Stadt\n\nDen Gläubigern der an der Verschmelzung beteiligten Rechtsträger ist, wenn sie binnen sechs Monaten nach dem Tag, an dem die Eintragung der Verschmelzung in das Register des Sitzes desjenigen Rechtsträgers, dessen Gläubiger sie sind, nach § 19 Abs. 3 UmwG als bekanntgemacht gilt, ihren Anspruch nach Grund und Höhe schriftlich anmelden, Sicherheit zu leisten, soweit sie nicht Befriedigung verlangen können. Dieses Recht steht den Gläubigern jedoch nur zu, wenn sie glaubhaft machen, dass durch die Verschmelzung die Erfüllung ihrer Forderung gefährdet wird."
    },
    {
      "date": "2026-02-19",
      "id": "145516",
      "original_text": "Registerbekanntmachung nach dem Umwandlungsgesetz\nHamburg Amtsgericht Hamburg HRB 64712\nAARSLEFF Spezialtiefbau GmbH – Hamburg",
      "type": "Registerbekanntmachung nach dem Umwandlungsgesetz",
      "state": "Hamburg",
      "amtsgericht": "Amtsgericht Hamburg",
      "registernummer": "HRB 64712",
      "registerart": "HRB",
      "company_name": "AARSLEFF Spezialtiefbau GmbH",
      "company_seat": "Hamburg",
      "details": "19.02.2026 (Bekanntmachungsdatum)\n\nHamburg Amtsgericht Hamburg HRB 64712\nRegisterbekanntmachung nach dem Umwandlungsgesetz 19.02.2026 (Eintragungsdatum)\n\nAARSLEFF Spezialtiefbau GmbH\nGesellschaft mit beschränkter Haftung\nHamburg\n\nAls nicht eingetragen wird bekannt gemacht:\nDen Gläubigern der an der Verschmelzung beteiligten Gesellschaften ist, wenn sie binnen sechs Monaten nach dem Tag, an dem die Eintragung der Verschmelzung in das Register des Sitzes desjenigen Rechtsträgers, dessen Gläubiger sie sind, nach § 19 Absatz 3 UmwG als bekannt gemacht gilt, ihren Anspruch nach Grund und Höhe schriftlich anmelden, Sicherheit zu leisten, soweit sie nicht Befriedigung verlangen können. Dieses Recht steht den Gläubigern jedoch nur zu, wenn sie glaubhaft machen, dass durch die Verschmelzung die Erfüllung ihrer Forderung gefährdet wird."
    },
    {
      "date": "2026-02-19",
      "id": "145517",
      "original_text": "Registerbekanntmachung nach dem Umwandlungsgesetz\nBrandenburg Amtsgericht Cottbus HRA 4455\nFelicini Berganini e.K. – Schönefeld",
      "type": "Registerbekanntmachung nach dem Umwandlungsgesetz",
      "state": "Brandenburg",
      "amtsgericht": "Amtsgericht Cottbus",
      "registernummer": "HRA 4455",
      "registerart": "HRA",
      "company_name": "Felicini Berganini e.K.",
      "company_seat": "Schönefeld",
      "details": "19.02.2026 (Bekanntmachungsdatum)\n\nBrandenburg Amtsgericht Cottbus HRA 4455\nRegisterbekanntmachung nach dem Umwandlungsgesetz 18.02.2026 (Eintragungsdatum)\n\nFelicini Berganini e.K.\nEinzelkaufmann / Einzelkauffrau\nSchönefeld\n\nZu Eintragungsnummer 2 vom 18.02.2026 wird als nicht eingetragen veröffentlicht:\nDen Gläubigern der an der Ausgliederung beteiligten Rechtsträger ist, wenn sie binnen sechs Monaten nach dem Tag, an dem die Eintragung der Ausgliederung in das Register des Sitzes desjenigen Rechtsträgers, dessen Gläubiger sie sind, als bekannt gemacht gilt, ihren Anspruch nach Grund und Höhe schriftlich anmelden, Sicherheit zu leisten, soweit sie nicht Befriedigung verlangen können. Dieses Recht steht den Gläubigern jedoch nur zu, wenn sie glaubhaft machen, dass durch die Ausgliederung die Erfüllung ihrer Forderung gefährdet wird"
    },
    {
      "date": "2026-02-19",
      "id": "145518",
      "original_text": "Löschungsankündigung\nBrandenburg Amtsgericht Potsdam HRB 32492\nSmart Streaming Solutions Voicetra GmbH – Potsdam",
      "type": "Löschungsankündigung",
      "state": "Brandenburg",
      "amtsgericht": "Amtsgericht Potsdam",
      "registernummer": "HRB 32492",
      "registerart": "HRB",
      "company_name": "Smart Streaming Solutions Voicetra GmbH",
      "company_seat": "Potsdam",
      "details": "19.02.2026 (Bekanntmachungsdatum)\n\nBrandenburg Amtsgericht Potsdam HRB 32492\nLöschungsankündigung\n\nSmart Streaming Solutions Voicetra GmbH\nGesellschaft mit beschränkter Haftung\nPotsdam\n\nBei der nachstehenden Gesellschaft wird das Amtslöschungsverfahren gemäß § 394 FamFG eingeleitet. Widerspruchsfrist: 8 Wochen"
    },
    {
      "date": "2026-02-19",
      "id": "145519",
      "original_text": "Löschungsankündigung\nHamburg Amtsgericht Hamburg HRB 86961\nPhenomena GmbH – Hamburg",
      "type": "Löschungsankündigung",
      "state": "Hamburg",
      "amtsgericht": "Amtsgericht Hamburg",
      "registernummer": "HRB 86961",
      "registerart": "HRB",
      "company_name": "Phenomena GmbH",
      "company_seat": "Hamburg",
      "details": "19.02.2026 (Bekanntmachungsdatum)\n\nHamburg Amtsgericht Hamburg HRB 86961\nLöschungsankündigung\n\nPhenomena GmbH\nGesellschaft mit beschränkter Haftung\nHamburg\n\nDas Registergericht beabsichtigt, die im Handelsregister eingetragene Gesellschaft von Amts wegen nach § 394 FamFG zu löschen. Die Frist zur Erhebung eines Widerspruchs gegen die beabsichtigte Löschung wird auf 3 Monate festgesetzt."
    },
    {
      "date": "2026-02-19",
      "id": "145520",
      "original_text": "Löschungsankündigung\nHamburg Amtsgericht Hamburg HRB 127267\nEulanco UG (haftungsbeschränkt) – Hamburg",
      "type": "Löschungsankündigung",
      "state": "Hamburg",
      "amtsgericht": "Amtsgericht Hamburg",
      "registernummer": "HRB 127267",
      "registerart": "HRB",
      "company_name": "Eulanco UG (haftungsbeschränkt)",
      "company_seat": "Hamburg",
      "details": "19.02.2026 (Bekanntmachungsdatum)\n\nHamburg Amtsgericht Hamburg HRB 127267\nLöschungsankündigung\n\nEulanco UG (haftungsbeschränkt)\nGesellschaft mit beschränkter Haftung\nHamburg\n\nDas Registergericht beabsichtigt, die im Handelsregister eingetragene Gesellschaft von Amts wegen nach § 394 FamFG zu löschen. Die Frist zur Erhebung eines Widerspruchs gegen die beabsichtigte Löschung wird auf 3 Monate festgesetzt."
    },
    {
      "date": "2026-02-19",
      "id": "145521",
      "original_text": "Löschungsankündigung\nHamburg Amtsgericht Hamburg HRB 84252\n\"Ilya\" Baugesellschaft mbH – Hamburg",
      "type": "Löschungsankündigung",
      "state": "Hamburg",
      "amtsgericht": "Amtsgericht Hamburg",
      "registernummer": "HRB 84252",
      "registerart": "HRB",
      "company_name": "\"Ilya\" Baugesellschaft mbH",
      "company_seat": "Hamburg",
      "details": "19.02.2026 (Bekanntmachungsdatum)\n\nHamburg Amtsgericht Hamburg HRB 84252\nLöschungsankündigung\n\n\"Ilya\" Baugesellschaft mbH\nGesellschaft mit beschränkter Haftung\nHamburg\n\nDas Registergericht beabsichtigt, die im Handelsregister eingetragene Gesellschaft von Amts wegen nach § 394 FamFG zu löschen. Die Frist zur Erhebung eines Widerspruchs gegen die beabsichtigte Löschung wird auf 3 Monate festgesetzt."
    },
    {
      "date": "2026-02-19",
      "id": "145522",
      "original_text": "Löschungsankündigung\nHamburg Amtsgericht Hamburg HRB 117588\n\"SFT-Maschinenbau\" GmbH – Hamburg",
      "type": "Löschungsankündigung",
      "state": "Hamburg",
      "amtsgericht": "Amtsgericht Hamburg",
      "registernummer": "HRB 117588",
      "registerart": "HRB",
      "company_name": "\"SFT-Maschinenbau\" GmbH",
      "company_seat": "Hamburg",
      "details": "19.02.2026 (Bekanntmachungsdatum)\n\nHamburg Amtsgericht Hamburg HRB 117588\nLöschungsankündigung\n\n\"SFT-Maschinenbau\" GmbH\nGesellschaft mit beschränkter Haftung\nHamburg\n\nDas Registergericht beabsichtigt, die im Handelsregister eingetragene Gesellschaft von Amts wegen nach § 394 FamFG zu löschen. Die Frist zur Erhebung eines Widerspruchs gegen die beabsichtigte Löschung wird auf 3 Monate festgesetzt."
    },
    {
      "date": "2026-02-19",
      "id": "145523",
      "original_text": "Löschungsankündigung\nHamburg Amtsgericht Hamburg HRB 127602\nPRPi GmbH – Hamburg",
      "type": "Löschungsankündigung",
      "state": "Hamburg",
      "amtsgericht": "Amtsgericht Hamburg",
      "registernummer": "HRB 127602",
      "registerart": "HRB",
      "company_name": "PRPi GmbH",
      "company_seat": "Hamburg",
      "details": "19.02.2026 (Bekanntmachungsdatum)\n\nHamburg Amtsgericht Hamburg HRB 127602\nLöschungsankündigung\n\nPRPi GmbH\nGesellschaft mit beschränkter Haftung\nHamburg\n\nDas Registergericht beabsichtigt, die im Handelsregister eingetragene Gesellschaft von Amts wegen nach § 394 FamFG zu löschen. Die Frist zur Erhebung eines Widerspruchs gegen die beabsichtigte Löschung wird auf 3 Monate festgesetzt."
    },
    {
      "date": "2026-02-19",
      "id": "145524",
      "original_text": "Löschungsankündigung\nHamburg Amtsgericht Hamburg HRB 160175\nMidYeah Germany GmbH – Hamburg",
      "type": "Löschungsankündigung",
      "state": "Hamburg",
      "amtsgericht": "Amtsgericht Hamburg",
      "registernummer": "HRB 160175",
      "registerart": "HRB",
      "company_name": "MidYeah Germany GmbH",
      "company_seat": "Hamburg",
      "details": "19.02.2026 (Bekanntmachungsdatum)\n\nHamburg Amtsgericht Hamburg HRB 160175\nLöschungsankündigung\n\nMidYeah Germany GmbH\nGesellschaft mit beschränkter Haftung\nHamburg\n\nDas Registergericht beabsichtigt, die im Handelsregister eingetragene Gesellschaft von Amts wegen nach § 394 FamFG zu löschen. Die Frist zur Erhebung eines Widerspruchs gegen die beabsichtigte Löschung wird auf 3 Monate festgesetzt."
    },
    {
      "date": "2026-02-19",
      "id": "145525",
      "original_text": "Löschungsankündigung\nHamburg Amtsgericht Hamburg HRB 162011\nIWS International Water Solutions Vertrieb GmbH – Hamburg",
      "type": "Löschungsankündigung",
      "state": "Hamburg",
      "amtsgericht": "Amtsgericht Hamburg",
      "registernummer": "HRB 162011",
      "registerart": "HRB",
      "company_name": "IWS International Water Solutions Vertrieb GmbH",
      "company_seat": "Hamburg",
      "details": "19.02.2026 (Bekanntmachungsdatum)\n\nHamburg Amtsgericht Hamburg HRB 162011\nLöschungsankündigung\n\nIWS International Water Solutions Vertrieb GmbH\nGesellschaft mit beschränkter Haftung\nHamburg\n\nDas Registergericht beabsichtigt, die im Handelsregister eingetragene Gesellschaft von Amts wegen nach § 394 FamFG zu löschen. Die Frist zur Erhebung eines Widerspruchs gegen die beabsichtigte Löschung wird auf 3 Monate festgesetzt."
    },
    {
      "date": "2026-02-19",
      "id": "145526",
      "original_text": "Löschungsankündigung\nHamburg Amtsgericht Hamburg HRB 163659\nIVY & Friends GmbH – Hamburg",
      "type": "Löschungsankündigung",
      "state": "Hamburg",
      "amtsgericht": "Amtsgericht Hamburg",
      "registernummer": "HRB 163659",
      "registerart": "HRB",
      "company_name": "IVY & Friends GmbH",
      "company_seat": "Hamburg",
      "details": "19.02.2026 (Bekanntmachungsdatum)\n\nHamburg Amtsgericht Hamburg HRB 163659\nLöschungsankündigung\n\nIVY & Friends GmbH\nGesellschaft mit beschränkter Haftung\nHamburg\n\nDas Registergericht beabsichtigt, die im Handelsregister eingetragene Gesellschaft von Amts wegen nach § 394 FamFG zu löschen. Die Frist zur Erhebung eines Widerspruchs gegen die beabsichtigte Löschung wird auf 3 Monate festgesetzt."
    },
    {
      "date": "2026-02-19",
      "id": "145527",
      "original_text": "Löschungsankündigung\nHamburg Amtsgericht Hamburg HRB 166987\nProperia GmbH – Hamburg",
      "type": "Löschungsankündigung",
      "state": "Hamburg",
      "amtsgericht": "Amtsgericht Hamburg",
      "registernummer": "HRB 166987",
      "registerart": "HRB",
      "company_name": "Properia GmbH",
      "company_seat": "Hamburg",
      "details": "19.02.2026 (Bekanntmachungsdatum)\n\nHamburg Amtsgericht Hamburg HRB 166987\nLöschungsankündigung\n\nProperia GmbH\nGesellschaft mit beschränkter Haftung\nHamburg\n\nDas Registergericht beabsichtigt, die im Handelsregister eingetragene Gesellschaft von Amts wegen nach § 394 FamFG zu löschen. Die Frist zur Erhebung eines Widerspruchs gegen die beabsichtigte Löschung wird auf 3 Monate festgesetzt."
    },
    {
      "date": "2026-02-19",
      "id": "145528",
      "original_text": "Löschungsankündigung\nHamburg Amtsgericht Hamburg HRB 136505\nPowergreen Germany GmbH – Hamburg",
      "type": "Löschungsankündigung",
      "state": "Hamburg",
      "amtsgericht": "Amtsgericht Hamburg",
      "registernummer": "HRB 136505",
      "registerart": "HRB",
      "company_name": "Powergreen Germany GmbH",
      "company_seat": "Hamburg",
      "details": "19.02.2026 (Bekanntmachungsdatum)\n\nHamburg Amtsgericht Hamburg HRB 136505\nLöschungsankündigung\n\nPowergreen Germany GmbH\nGesellschaft mit beschränkter Haftung\nHamburg\n\nDas Registergericht beabsichtigt, die im Handelsregister eingetragene Gesellschaft von Amts wegen nach § 394 FamFG zu löschen. Die Frist zur Erhebung eines Widerspruchs gegen die beabsichtigte Löschung wird auf 3 Monate festgesetzt."
    },
    {
      "date": "2026-02-19",
      "id": "145529",
      "original_text": "Löschungsankündigung\nHamburg Amtsgericht Hamburg HRB 144247\nAlfeco GmbH – Hamburg",
      "type": "Löschungsankündigung",
      "state": "Hamburg",
      "amtsgericht": "Amtsgericht Hamburg",
      "registernummer": "HRB 144247",
      "registerart": "HRB",
      "company_name": "Alfeco GmbH",
      "company_seat": "Hamburg",
      "details": "19.02.2026 (Bekanntmachungsdatum)\n\nHamburg Amtsgericht Hamburg HRB 144247\nLöschungsankündigung\n\nAlfeco GmbH\nGesellschaft mit beschränkter Haftung\nHamburg\n\nDas Registergericht beabsichtigt, die im Handelsregister eingetragene Gesellschaft von Amts wegen nach § 394 FamFG zu löschen. Die Frist zur Erhebung eines Widerspruchs gegen die beabsichtigte Löschung wird auf 3 Monate festgesetzt."
    },
    {
      "date": "2026-02-19",
      "id": "145530",
      "original_text": "Löschungsankündigung\nHamburg Amtsgericht Hamburg HRB 128485\nPegasos Dienstleistungs GmbH – Hamburg",
      "type": "Löschungsankündigung",
      "state": "Hamburg",
      "amtsgericht": "Amtsgericht Hamburg",
      "registernummer": "HRB 128485",
      "registerart": "HRB",
      "company_name": "Pegasos Dienstleistungs GmbH",
      "company_seat": "Hamburg",
      "details": "19.02.2026 (Bekanntmachungsdatum)\n\nHamburg Amtsgericht Hamburg HRB 128485\nLöschungsankündigung\n\nPegasos Dienstleistungs GmbH\nGesellschaft mit beschränkter Haftung\nHamburg\n\nDas Registergericht beabsichtigt, die im Handelsregister eingetragene Gesellschaft von Amts wegen nach § 394 FamFG zu löschen. Die Frist zur Erhebung eines Widerspruchs gegen die beabsichtigte Löschung wird auf 3 Monate festgesetzt."
    },
    {
      "date": "2026-02-19",
      "id": "145531",
      "original_text": "Löschungsankündigung\nHamburg Amtsgericht Hamburg HRB 138285\nURFALI GmbH – Hamburg",
      "type": "Löschungsankündigung",
      "state": "Hamburg",
      "amtsgericht": "Amtsgericht Hamburg",
      "registernummer": "HRB 138285",
      "registerart": "HRB",
      "company_name": "URFALI GmbH",
      "company_seat": "Hamburg",
      "details": "19.02.2026 (Bekanntmachungsdatum)\n\nHamburg Amtsgericht Hamburg HRB 138285\nLöschungsankündigung\n\nURFALI GmbH\nGesellschaft mit beschränkter Haftung\nHamburg\n\nDas Registergericht beabsichtigt, die im Handelsregister eingetragene Gesellschaft von Amts wegen nach § 394 FamFG zu löschen. Die Frist zur Erhebung eines Widerspruchs gegen die beabsichtigte Löschung wird auf 3 Monate festgesetzt."
    },
    {
      "date": "2026-02-19",
      "id": "145532",
      "original_text": "Löschungsankündigung\nHamburg Amtsgericht Hamburg HRB 164040\nProdukt Jomono UG (haftungsbeschränkt) – Hamburg",
      "type": "Löschungsankündigung",
      "state": "Hamburg",
      "amtsgericht": "Amtsgericht Hamburg",
      "registernummer": "HRB 164040",
      "registerart": "HRB",
      "company_name": "Produkt Jomono UG (haftungsbeschränkt)",
      "company_seat": "Hamburg",
      "details": "19.02.2026 (Bekanntmachungsdatum)\n\nHamburg Amtsgericht Hamburg HRB 164040\nLöschungsankündigung\n\nProdukt Jomono UG (haftungsbeschränkt)\nGesellschaft mit beschränkter Haftung\nHamburg\n\nDas Registergericht beabsichtigt, die im Handelsregister eingetragene Gesellschaft von Amts wegen nach § 394 FamFG zu löschen. Die Frist zur Erhebung eines Widerspruchs gegen die beabsichtigte Löschung wird auf 3 Monate festgesetzt."
    },
    {
      "date": "2026-02-19",
      "id": "145533",
      "original_text": "Löschungsankündigung\nHamburg Amtsgericht Hamburg HRB 167984\nPositiva GmbH – Hamburg",
      "type": "Löschungsankündigung",
      "state": "Hamburg",
      "amtsgericht": "Amtsgericht Hamburg",
      "registernummer": "HRB 167984",
      "registerart": "HRB",
      "company_name": "Positiva GmbH",
      "company_seat": "Hamburg",
      "details": "19.02.2026 (Bekanntmachungsdatum)\n\nHamburg Amtsgericht Hamburg HRB 167984\nLöschungsankündigung\n\nPositiva GmbH\nGesellschaft mit beschränkter Haftung\nHamburg\n\nDas Registergericht beabsichtigt, die im Handelsregister eingetragene Gesellschaft von Amts wegen nach § 394 FamFG zu löschen. Die Frist zur Erhebung eines Widerspruchs gegen die beabsichtigte Löschung wird auf 3 Monate festgesetzt."
    },
    {
      "date": "2026-02-19",
      "id": "145534",
      "original_text": "Löschungsankündigung\nHamburg Amtsgericht Hamburg HRB 152777\nVast Global GmbH – Hamburg",
      "type": "Löschungsankündigung",
      "state": "Hamburg",
      "amtsgericht": "Amtsgericht Hamburg",
      "registernummer": "HRB 152777",
      "registerart": "HRB",
      "company_name": "Vast Global GmbH",
      "company_seat": "Hamburg",
      "details": "19.02.2026 (Bekanntmachungsdatum)\n\nHamburg Amtsgericht Hamburg HRB 152777\nLöschungsankündigung\n\nVast Global GmbH\nGesellschaft mit beschränkter Haftung\nHamburg\n\nDas Registergericht beabsichtigt, die im Handelsregister eingetragene Gesellschaft von Amts wegen nach § 394 FamFG zu löschen. Die Frist zur Erhebung eines Widerspruchs gegen die beabsichtigte Löschung wird auf 3 Monate festgesetzt."
    },
    {
      "date": "2026-02-19",
      "id": "145535",
      "original_text": "Löschungsankündigung\nHamburg Amtsgericht Hamburg HRB 154531\nSMP Holding GmbH – Hamburg",
      "type": "Löschungsankündigung",
      "state": "Hamburg",
      "amtsgericht": "Amtsgericht Hamburg",
      "registernummer": "HRB 154531",
      "registerart": "HRB",
      "company_name": "SMP Holding GmbH",
      "company_seat": "Hamburg",
      "details": "19.02.2026 (Bekanntmachungsdatum)\n\nHamburg Amtsgericht Hamburg HRB 154531\nLöschungsankündigung\n\nSMP Holding GmbH\nGesellschaft mit beschränkter Haftung\nHamburg\n\nDas Registergericht beabsichtigt, die im Handelsregister eingetragene Gesellschaft von Amts wegen nach § 394 FamFG zu löschen. Die Frist zur Erhebung eines Widerspruchs gegen die beabsichtigte Löschung wird auf 3 Monate festgesetzt."
    },
    {
      "date": "2026-02-19",
      "id": "145536",
      "original_text": "Löschungsankündigung\nHamburg Amtsgericht Hamburg HRB 157163\nGolden Adler E-Commerce GmbH – Hamburg",
      "type": "Löschungsankündigung",
      "state": "Hamburg",
      "amtsgericht": "Amtsgericht Hamburg",
      "registernummer": "HRB 157163",
      "registerart": "HRB",
      "company_name": "Golden Adler E-Commerce GmbH",
      "company_seat": "Hamburg",
      "details": "19.02.2026 (Bekanntmachungsdatum)\n\nHamburg Amtsgericht Hamburg HRB 157163\nLöschungsankündigung\n\nGolden Adler E-Commerce GmbH\nGesellschaft mit beschränkter Haftung\nHamburg\n\nDas Registergericht beabsichtigt, die im Handelsregister eingetragene Gesellschaft von Amts wegen nach § 394 FamFG zu löschen. Die Frist zur Erhebung eines Widerspruchs gegen die beabsichtigte Löschung wird auf 3 Monate festgesetzt."
    },
    {
      "date": "2026-02-19",
      "id": "145537",
      "original_text": "Sonstige Registerbekanntmachung\nThüringen Amtsgericht Gotha VR 141707\nInitiative für Siebleben e.V. – Gotha OT Siebleben",
      "type": "Sonstige Registerbekanntmachung",
      "state": "Thüringen",
      "amtsgericht": "Amtsgericht Gotha",
      "registernummer": "VR 141707",
      "registerart": "VR",
      "company_name": "Initiative für Siebleben e.V.",
      "company_seat": "Gotha OT Siebleben",
      "details": "19.02.2026 (Bekanntmachungsdatum)\n\nThüringen Amtsgericht Gotha VR 141707\nSonstige Registerbekanntmachung 19.02.2026 (Eintragungsdatum)\n\nInitiative für Siebleben e.V.\neingetragener Verein\nGotha OT Siebleben"
    },
    {
      "date": "2026-02-19",
      "id": "145538",
      "original_text": "Sonstige Registerbekanntmachung\nThüringen Amtsgericht Gotha VR 141708\nJohannisloge Ernst zum Compass e. V. – Gotha",
      "type": "Sonstige Registerbekanntmachung",
      "state": "Thüringen",
      "amtsgericht": "Amtsgericht Gotha",
      "registernummer": "VR 141708",
      "registerart": "VR",
      "company_name": "Johannisloge Ernst zum Compass e. V.",
      "company_seat": "Gotha",
      "details": "19.02.2026 (Bekanntmachungsdatum)\n\nThüringen Amtsgericht Gotha VR 141708\nSonstige Registerbekanntmachung 19.02.2026 (Eintragungsdatum)\n\nJohannisloge Ernst zum Compass e. V.\neingetragener Verein\nGotha"
    },
    {
      "date": "2026-02-19",
      "id": "145539",
      "original_text": "Löschungsankündigung\nThüringen Amtsgericht Jena HRB 508365\nThuringia Dental Chemie GmbH – Schmalkalden",
      "type": "Löschungsankündigung",
      "state": "Thüringen",
      "amtsgericht": "Amtsgericht Jena",
      "registernummer": "HRB 508365",
      "registerart": "HRB",
      "company_name": "Thuringia Dental Chemie GmbH",
      "company_seat": "Schmalkalden",
      "details": "19.02.2026 (Bekanntmachungsdatum)\n\nThüringen Amtsgericht Jena HRB 508365\nLöschungsankündigung\n\nThuringia Dental Chemie GmbH\nGesellschaft mit beschränkter Haftung\nSchmalkalden\n\nDas Registergericht beabsichtigt, die im Handelsregister eingetragene Gesellschaft wegen Vermögenslosigkeit nach § 394 FamFG von Amts wegen zu löschen. Die Frist zur Erhebung eines Widerspruchs gegen die beabsichtigte Löschung wird auf 6 Wochen festgesetzt."
    },
    {
      "date": "2026-02-19",
      "id": "145540",
      "original_text": "Löschungsankündigung\nHamburg Amtsgericht Hamburg HRB 177563\nXeris GmbH – Hamburg",
      "type": "Löschungsankündigung",
      "state": "Hamburg",
      "amtsgericht": "Amtsgericht Hamburg",
      "registernummer": "HRB 177563",
      "registerart": "HRB",
      "company_name": "Xeris GmbH",
      "company_seat": "Hamburg",
      "details": "19.02.2026 (Bekanntmachungsdatum)\n\nHamburg Amtsgericht Hamburg HRB 177563\nLöschungsankündigung\n\nXeris GmbH\nGesellschaft mit beschränkter Haftung\nHamburg\n\nDas Registergericht beabsichtigt, die im Handelsregister eingetragene Gesellschaft von Amts wegen nach § 394 FamFG zu löschen. Die Frist zur Erhebung eines Widerspruchs gegen die beabsichtigte Löschung wird auf 3 Monate festgesetzt."
    },
    {
      "date": "2026-02-19",
      "id": "145541",
      "original_text": "Löschungsankündigung\nHamburg Amtsgericht Hamburg HRB 181560\nSchraub Dienstleistungen GmbH – Hamburg",
      "type": "Löschungsankündigung",
      "state": "Hamburg",
      "amtsgericht": "Amtsgericht Hamburg",
      "registernummer": "HRB 181560",
      "registerart": "HRB",
      "company_name": "Schraub Dienstleistungen GmbH",
      "company_seat": "Hamburg",
      "details": "19.02.2026 (Bekanntmachungsdatum)\n\nHamburg Amtsgericht Hamburg HRB 181560\nLöschungsankündigung\n\nSchraub Dienstleistungen GmbH\nGesellschaft mit beschränkter Haftung\nHamburg\n\nDas Registergericht beabsichtigt, die im Handelsregister eingetragene Gesellschaft von Amts wegen nach § 394 FamFG zu löschen. Die Frist zur Erhebung eines Widerspruchs gegen die beabsichtigte Löschung wird auf 3 Monate festgesetzt."
    },
    {
      "date": "2026-02-19",
      "id": "145542",
      "original_text": "Löschungsankündigung\nHamburg Amtsgericht Hamburg HRB 184657\nRron Bau UG (haftungsbeschränkt) – Hamburg",
      "type": "Löschungsankündigung",
      "state": "Hamburg",
      "amtsgericht": "Amtsgericht Hamburg",
      "registernummer": "HRB 184657",
      "registerart": "HRB",
      "company_name": "Rron Bau UG (haftungsbeschränkt)",
      "company_seat": "Hamburg",
      "details": "19.02.2026 (Bekanntmachungsdatum)\n\nHamburg Amtsgericht Hamburg HRB 184657\nLöschungsankündigung\n\nRron Bau UG (haftungsbeschränkt)\nGesellschaft mit beschränkter Haftung\nHamburg\n\nDas Registergericht beabsichtigt, die im Handelsregister eingetragene Gesellschaft von Amts wegen nach § 394 FamFG zu löschen. Die Frist zur Erhebung eines Widerspruchs gegen die beabsichtigte Löschung wird auf 3 Monate festgesetzt."
    },
    {
      "date": "2026-02-19",
      "id": "145543",
      "original_text": "Löschungsankündigung\nHamburg Amtsgericht Hamburg HRB 176183\nSalesheads Executive Search LLC Niederlassung Deutschland – Hamburg",
      "type": "Löschungsankündigung",
      "state": "Hamburg",
      "amtsgericht": "Amtsgericht Hamburg",
      "registernummer": "HRB 176183",
      "registerart": "HRB",
      "company_name": "Salesheads Executive Search LLC Niederlassung Deutschland",
      "company_seat": "Hamburg",
      "details": "19.02.2026 (Bekanntmachungsdatum)\n\nHamburg Amtsgericht Hamburg HRB 176183\nLöschungsankündigung\n\nSalesheads Executive Search LLC Niederlassung Deutschland\nRechtsform ausländischen Rechts HRB\nHamburg\n\nWie dem Gericht bekannt geworden ist, wird die Zweigniederlassung offenbar nicht mehr\nunterhalten.\nDie Eintragung der Zweigniederlassung ist damit wegen des Mangels einer wesentlichen\nVoraussetzung unzulässig geworden. Das Registergericht beabsichtigt daher, die\nZweigniederlassung gemäß § 395 des Gesetzes über das Verfahren in Familiensachen und\nin Angelegenheiten der freiwiligen Gerichtsbarkeit (FamFG) von Amts wegen zu löschen.\nHiermit erfolgt die Benachrichtigung von der beabsichtigten Löschung.\nZur Geltendmachung eines Widerspruches wird eine Frist von einem Monat beginnend mit\nder Veröffentlichung dieses Aufgebots gesetzt (§ 395 Abs. 2 S 1 FamFG).\nSofern hier binnen der genannten Frist kein Widerspruch eingeht, wird das Gericht die\nEintragung der Zweigniederlassung von Amts wegen löschen."
    },
    {
      "date": "2026-02-19",
      "id": "145544",
      "original_text": "Löschungsankündigung\nHamburg Amtsgericht Hamburg HRB 178939\nSANA Dienstleistungen GmbH – Hamburg",
      "type": "Löschungsankündigung",
      "state": "Hamburg",
      "amtsgericht": "Amtsgericht Hamburg",
      "registernummer": "HRB 178939",
      "registerart": "HRB",
      "company_name": "SANA Dienstleistungen GmbH",
      "company_seat": "Hamburg",
      "details": "19.02.2026 (Bekanntmachungsdatum)\n\nHamburg Amtsgericht Hamburg HRB 178939\nLöschungsankündigung\n\nSANA Dienstleistungen GmbH\nGesellschaft mit beschränkter Haftung\nHamburg\n\nDas Registergericht beabsichtigt, die im Handelsregister eingetragene Gesellschaft von Amts wegen nach § 394 FamFG zu löschen. Die Frist zur Erhebung eines Widerspruchs gegen die beabsichtigte Löschung wird auf 3 Monate festgesetzt."
    },
    {
      "date": "2026-02-19",
      "id": "145545",
      "original_text": "Löschungsankündigung\nHamburg Amtsgericht Hamburg HRB 183378\nDiB Transport & Logistik GmbH – Hamburg",
      "type": "Löschungsankündigung",
      "state": "Hamburg",
      "amtsgericht": "Amtsgericht Hamburg",
      "registernummer": "HRB 183378",
      "registerart": "HRB",
      "company_name": "DiB Transport & Logistik GmbH",
      "company_seat": "Hamburg",
      "details": "19.02.2026 (Bekanntmachungsdatum)\n\nHamburg Amtsgericht Hamburg HRB 183378\nLöschungsankündigung\n\nDiB Transport & Logistik GmbH\nGesellschaft mit beschränkter Haftung\nHamburg\n\nDas Registergericht beabsichtigt, die im Handelsregister eingetragene Gesellschaft von Amts wegen nach § 394 FamFG zu löschen. Die Frist zur Erhebung eines Widerspruchs gegen die beabsichtigte Löschung wird auf 3 Monate festgesetzt."
    },
    {
      "date": "2026-02-19",
      "id": "145546",
      "original_text": "Löschungsankündigung\nHamburg Amtsgericht Hamburg HRB 167995\nFarido Food GmbH – Hamburg",
      "type": "Löschungsankündigung",
      "state": "Hamburg",
      "amtsgericht": "Amtsgericht Hamburg",
      "registernummer": "HRB 167995",
      "registerart": "HRB",
      "company_name": "Farido Food GmbH",
      "company_seat": "Hamburg",
      "details": "19.02.2026 (Bekanntmachungsdatum)\n\nHamburg Amtsgericht Hamburg HRB 167995\nLöschungsankündigung\n\nFarido Food GmbH\nGesellschaft mit beschränkter Haftung\nHamburg\n\nDas Registergericht beabsichtigt, die im Handelsregister eingetragene Gesellschaft von Amts wegen nach § 394 FamFG zu löschen. Die Frist zur Erhebung eines Widerspruchs gegen die beabsichtigte Löschung wird auf 3 Monate festgesetzt."
    },
    {
      "date": "2026-02-19",
      "id": "145547",
      "original_text": "Löschungsankündigung\nHamburg Amtsgericht Hamburg HRB 172959\nSTARTBROAD UG (haftungsbeschränkt) – Hamburg",
      "type": "Löschungsankündigung",
      "state": "Hamburg",
      "amtsgericht": "Amtsgericht Hamburg",
      "registernummer": "HRB 172959",
      "registerart": "HRB",
      "company_name": "STARTBROAD UG (haftungsbeschränkt)",
      "company_seat": "Hamburg",
      "details": "19.02.2026 (Bekanntmachungsdatum)\n\nHamburg Amtsgericht Hamburg HRB 172959\nLöschungsankündigung\n\nSTARTBROAD UG (haftungsbeschränkt)\nGesellschaft mit beschränkter Haftung\nHamburg\n\nDas Registergericht beabsichtigt, die im Handelsregister eingetragene Gesellschaft von Amts wegen nach § 394 FamFG zu löschen. Die Frist zur Erhebung eines Widerspruchs gegen die beabsichtigte Löschung wird auf 3 Monate festgesetzt."
    },
    {
      "date": "2026-02-19",
      "id": "145548",
      "original_text": "Löschungsankündigung\nHamburg Amtsgericht Hamburg HRB 172651\nMSN Metropol Service Nord GmbH – Hamburg",
      "type": "Löschungsankündigung",
      "state": "Hamburg",
      "amtsgericht": "Amtsgericht Hamburg",
      "registernummer": "HRB 172651",
      "registerart": "HRB",
      "company_name": "MSN Metropol Service Nord GmbH",
      "company_seat": "Hamburg",
      "details": "19.02.2026 (Bekanntmachungsdatum)\n\nHamburg Amtsgericht Hamburg HRB 172651\nLöschungsankündigung\n\nMSN Metropol Service Nord GmbH\nGesellschaft mit beschränkter Haftung\nHamburg\n\nDas Registergericht beabsichtigt, die im Handelsregister eingetragene Gesellschaft von Amts wegen nach § 394 FamFG zu löschen. Die Frist zur Erhebung eines Widerspruchs gegen die beabsichtigte Löschung wird auf 3 Monate festgesetzt."
    },
    {
      "date": "2026-02-19",
      "id": "145549",
      "original_text": "Löschungsankündigung\nHamburg Amtsgericht Hamburg HRB 172769\nSaranskkabel-Optika GmbH – Hamburg",
      "type": "Löschungsankündigung",
      "state": "Hamburg",
      "amtsgericht": "Amtsgericht Hamburg",
      "registernummer": "HRB 172769",
      "registerart": "HRB",
      "company_name": "Saranskkabel-Optika GmbH",
      "company_seat": "Hamburg",
      "details": "19.02.2026 (Bekanntmachungsdatum)\n\nHamburg Amtsgericht Hamburg HRB 172769\nLöschungsankündigung\n\nSaranskkabel-Optika GmbH\nGesellschaft mit beschränkter Haftung\nHamburg\n\nDas Registergericht beabsichtigt, die im Handelsregister eingetragene Gesellschaft von Amts wegen nach § 394 FamFG zu löschen. Die Frist zur Erhebung eines Widerspruchs gegen die beabsichtigte Löschung wird auf 3 Monate festgesetzt."
    },
    {
      "date": "2026-02-19",
      "id": "145550",
      "original_text": "Löschungsankündigung\nHamburg Amtsgericht Hamburg HRB 188718\nMatz Bau GmbH – Hamburg",
      "type": "Löschungsankündigung",
      "state": "Hamburg",
      "amtsgericht": "Amtsgericht Hamburg",
      "registernummer": "HRB 188718",
      "registerart": "HRB",
      "company_name": "Matz Bau GmbH",
      "company_seat": "Hamburg",
      "details": "19.02.2026 (Bekanntmachungsdatum)\n\nHamburg Amtsgericht Hamburg HRB 188718\nLöschungsankündigung\n\nMatz Bau GmbH\nGesellschaft mit beschränkter Haftung\nHamburg\n\nDas Registergericht beabsichtigt, die im Handelsregister eingetragene Gesellschaft von Amts wegen nach § 394 FamFG zu löschen. Die Frist zur Erhebung eines Widerspruchs gegen die beabsichtigte Löschung wird auf 3 Monate festgesetzt."
    },
    {
      "date": "2026-02-19",
      "id": "145551",
      "original_text": "Löschungsankündigung\nHamburg Amtsgericht Hamburg GnR 955\nDAS TAXI Funk & Service eG – Hamburg",
      "type": "Löschungsankündigung",
      "state": "Hamburg",
      "amtsgericht": "Amtsgericht Hamburg",
      "registernummer": "GnR 955",
      "registerart": "GnR",
      "company_name": "DAS TAXI Funk & Service eG",
      "company_seat": "Hamburg",
      "details": "19.02.2026 (Bekanntmachungsdatum)\n\nHamburg Amtsgericht Hamburg GnR 955\nLöschungsankündigung\n\nDAS TAXI Funk & Service eG\neingetragene Genossenschaft\nHamburg\n\nDas Registergericht beabsichtigt, die im Handelsregister eingetragene Genossenschaft von Amts wegen nach § 394 FamFG zu löschen. Die Frist zur Erhebung eines Widerspruchs gegen die beabsichtigte Löschung wird auf 3 Monate festgesetzt."
    },
    {
      "date": "2026-02-19",
      "id": "145552",
      "original_text": "Löschungsankündigung\nHamburg Amtsgericht Hamburg HRB 84183\nAdler Trading GmbH – Hamburg",
      "type": "Löschungsankündigung",
      "state": "Hamburg",
      "amtsgericht": "Amtsgericht Hamburg",
      "registernummer": "HRB 84183",
      "registerart": "HRB",
      "company_name": "Adler Trading GmbH",
      "company_seat": "Hamburg",
      "details": "19.02.2026 (Bekanntmachungsdatum)\n\nHamburg Amtsgericht Hamburg HRB 84183\nLöschungsankündigung\n\nAdler Trading GmbH\nGesellschaft mit beschränkter Haftung\nHamburg\n\nDas Registergericht beabsichtigt, die im Handelsregister eingetragene Gesellschaft von Amts wegen nach § 394 FamFG zu löschen. Die Frist zur Erhebung eines Widerspruchs gegen die beabsichtigte Löschung wird auf 3 Monate festgesetzt."
    },
    {
      "date": "2026-02-19",
      "id": "145553",
      "original_text": "Löschungsankündigung\nHamburg Amtsgericht Hamburg HRB 186174\nDSK Holding GmbH – Hamburg",
      "type": "Löschungsankündigung",
      "state": "Hamburg",
      "amtsgericht": "Amtsgericht Hamburg",
      "registernummer": "HRB 186174",
      "registerart": "HRB",
      "company_name": "DSK Holding GmbH",
      "company_seat": "Hamburg",
      "details": "19.02.2026 (Bekanntmachungsdatum)\n\nHamburg Amtsgericht Hamburg HRB 186174\nLöschungsankündigung\n\nDSK Holding GmbH\nGesellschaft mit beschränkter Haftung\nHamburg\n\nDas Registergericht beabsichtigt, die im Handelsregister eingetragene Gesellschaft von Amts wegen nach § 394 FamFG zu löschen. Die Frist zur Erhebung eines Widerspruchs gegen die beabsichtigte Löschung wird auf 3 Monate festgesetzt."
    },
    {
      "date": "2026-02-19",
      "id": "145554",
      "original_text": "Löschungsankündigung\nHamburg Amtsgericht Hamburg HRB 186576\nSurfcloud DE UG (haftungsbeschränkt) – Hamburg",
      "type": "Löschungsankündigung",
      "state": "Hamburg",
      "amtsgericht": "Amtsgericht Hamburg",
      "registernummer": "HRB 186576",
      "registerart": "HRB",
      "company_name": "Surfcloud DE UG (haftungsbeschränkt)",
      "company_seat": "Hamburg",
      "details": "19.02.2026 (Bekanntmachungsdatum)\n\nHamburg Amtsgericht Hamburg HRB 186576\nLöschungsankündigung\n\nSurfcloud DE UG (haftungsbeschränkt)\nGesellschaft mit beschränkter Haftung\nHamburg\n\nDas Registergericht beabsichtigt, die im Handelsregister eingetragene Gesellschaft von Amts wegen nach § 394 FamFG zu löschen. Die Frist zur Erhebung eines Widerspruchs gegen die beabsichtigte Löschung wird auf 3 Monate festgesetzt."
    },
    {
      "date": "2026-02-19",
      "id": "145555",
      "original_text": "Löschungsankündigung\nHamburg Amtsgericht Hamburg HRA 117327\nBok Holstenstraße Lieferservice UG (haftungsbeschränkt) & Co. KG – Hamburg",
      "type": "Löschungsankündigung",
      "state": "Hamburg",
      "amtsgericht": "Amtsgericht Hamburg",
      "registernummer": "HRA 117327",
      "registerart": "HRA",
      "company_name": "Bok Holstenstraße Lieferservice UG (haftungsbeschränkt) & Co. KG",
      "company_seat": "Hamburg",
      "details": "19.02.2026 (Bekanntmachungsdatum)\n\nHamburg Amtsgericht Hamburg HRA 117327\nLöschungsankündigung\n\nBok Holstenstraße Lieferservice UG (haftungsbeschränkt) & Co. KG\nKommanditgesellschaft\nHamburg\n\nDas Registergericht beabsichtigt, die im Handelsregister eingetragene Gesellschaft von Amts wegen nach § 394 FamFG zu löschen. Die Frist zur Erhebung eines Widerspruchs gegen die beabsichtigte Löschung wird auf 3 Monate festgesetzt."
    },
    {
      "date": "2026-02-19",
      "id": "145556",
      "original_text": "Löschungsankündigung\nHamburg Amtsgericht Hamburg HRB 52418\nICP Gesellschaft für International Cards Processing mbH – Hamburg",
      "type": "Löschungsankündigung",
      "state": "Hamburg",
      "amtsgericht": "Amtsgericht Hamburg",
      "registernummer": "HRB 52418",
      "registerart": "HRB",
      "company_name": "ICP Gesellschaft für International Cards Processing mbH",
      "company_seat": "Hamburg",
      "details": "19.02.2026 (Bekanntmachungsdatum)\n\nHamburg Amtsgericht Hamburg HRB 52418\nLöschungsankündigung\n\nICP Gesellschaft für International Cards Processing mbH\nGesellschaft mit beschränkter Haftung\nHamburg\n\nDas Registergericht beabsichtigt, die im Handelsregister eingetragene Gesellschaft von Amts wegen nach § 394 FamFG zu löschen. Die Frist zur Erhebung eines Widerspruchs gegen die beabsichtigte Löschung wird auf 3 Monate festgesetzt."
    },
    {
      "date": "2026-02-19",
      "id": "145557",
      "original_text": "Löschungsankündigung\nHamburg Amtsgericht Hamburg HRB 95910\nPatriarch Trust GmbH – Hamburg",
      "type": "Löschungsankündigung",
      "state": "Hamburg",
      "amtsgericht": "Amtsgericht Hamburg",
      "registernummer": "HRB 95910",
      "registerart": "HRB",
      "company_name": "Patriarch Trust GmbH",
      "company_seat": "Hamburg",
      "details": "19.02.2026 (Bekanntmachungsdatum)\n\nHamburg Amtsgericht Hamburg HRB 95910\nLöschungsankündigung\n\nPatriarch Trust GmbH\nGesellschaft mit beschränkter Haftung\nHamburg\n\nDas Registergericht beabsichtigt, die im Handelsregister eingetragene Gesellschaft von Amts wegen nach § 394 FamFG zu löschen. Die Frist zur Erhebung eines Widerspruchs gegen die beabsichtigte Löschung wird auf 3 Monate festgesetzt."
    },
    {
      "date": "2026-02-19",
      "id": "145558",
      "original_text": "Löschungsankündigung\nHamburg Amtsgericht Hamburg HRB 102166\nNDA Nord-Deutsche Industrieanlagenbau GmbH – Hamburg",
      "type": "Löschungsankündigung",
      "state": "Hamburg",
      "amtsgericht": "Amtsgericht Hamburg",
      "registernummer": "HRB 102166",
      "registerart": "HRB",
      "company_name": "NDA Nord-Deutsche Industrieanlagenbau GmbH",
      "company_seat": "Hamburg",
      "details": "19.02.2026 (Bekanntmachungsdatum)\n\nHamburg Amtsgericht Hamburg HRB 102166\nLöschungsankündigung\n\nNDA Nord-Deutsche Industrieanlagenbau GmbH\nGesellschaft mit beschränkter Haftung\nHamburg\n\nDas Registergericht beabsichtigt, die im Handelsregister eingetragene Gesellschaft von Amts wegen nach § 394 FamFG zu löschen. Die Frist zur Erhebung eines Widerspruchs gegen die beabsichtigte Löschung wird auf 3 Monate festgesetzt."
    },
    {
      "date": "2026-02-19",
      "id": "145559",
      "original_text": "Registerbekanntmachung nach dem Umwandlungsgesetz\nSchleswig-Holstein Amtsgericht Kiel HRB 2453 NO\nGustav Kindt GmbH – Ellerau",
      "type": "Registerbekanntmachung nach dem Umwandlungsgesetz",
      "state": "Schleswig-Holstein",
      "amtsgericht": "Amtsgericht Kiel",
      "registernummer": "HRB 2453 NO",
      "registerart": "HRB",
      "company_name": "Gustav Kindt GmbH",
      "company_seat": "Ellerau",
      "details": "19.02.2026 (Bekanntmachungsdatum)\n\nSchleswig-Holstein Amtsgericht Kiel HRB 2453 NO\nRegisterbekanntmachung nach dem Umwandlungsgesetz 18.02.2026 (Eintragungsdatum)\n\nGustav Kindt GmbH\nGesellschaft mit beschränkter Haftung\nEllerau\n\nZu Eintragungsnummer 15 vom 18.02.2026 wird als nicht eingetragen veröffentlicht:  Den Gläubigern der an der Spaltung beteiligten Rechtsträger ist, wenn sie binnen sechs Monaten nach dem Tag, an dem die Eintragung der Spaltung in das Register des Sitzes desjenigen Rechtsträgers, dessen Gläubiger sie sind,  bekannt gemacht worden ist, ihren Anspruch nach Grund und Höhe schriftlich anmelden, Sicherheit zu leisten, soweit sie nicht Befriedigung verlangen können. Dieses Recht steht den Gläubigern jedoch nur zu, wenn sie glaubhaft machen, dass durch die Spaltung die Erfüllung ihrer Forderung gefährdet wird."
    },
    {
      "date": "2026-02-19",
      "id": "145560",
      "original_text": "Löschungsankündigung\nHamburg Amtsgericht Hamburg HRB 139965\nSC Resort Invest GmbH – Hamburg",
      "type": "Löschungsankündigung",
      "state": "Hamburg",
      "amtsgericht": "Amtsgericht Hamburg",
      "registernummer": "HRB 139965",
      "registerart": "HRB",
      "company_name": "SC Resort Invest GmbH",
      "company_seat": "Hamburg",
      "details": "19.02.2026 (Bekanntmachungsdatum)\n\nHamburg Amtsgericht Hamburg HRB 139965\nLöschungsankündigung\n\nSC Resort Invest GmbH\nGesellschaft mit beschränkter Haftung\nHamburg\n\nDas Registergericht beabsichtigt, die im Handelsregister eingetragene Gesellschaft von Amts wegen nach § 394 FamFG zu löschen. Die Frist zur Erhebung eines Widerspruchs gegen die beabsichtigte Löschung wird auf 3 Monate festgesetzt."
    },
    {
      "date": "2026-02-19",
      "id": "145561",
      "original_text": "Löschungsankündigung\nHamburg Amtsgericht Hamburg HRB 142988\nIY Food GmbH – Hamburg",
      "type": "Löschungsankündigung",
      "state": "Hamburg",
      "amtsgericht": "Amtsgericht Hamburg",
      "registernummer": "HRB 142988",
      "registerart": "HRB",
      "company_name": "IY Food GmbH",
      "company_seat": "Hamburg",
      "details": "19.02.2026 (Bekanntmachungsdatum)\n\nHamburg Amtsgericht Hamburg HRB 142988\nLöschungsankündigung\n\nIY Food GmbH\nGesellschaft mit beschränkter Haftung\nHamburg\n\nDas Registergericht beabsichtigt, die im Handelsregister eingetragene Gesellschaft von Amts wegen nach § 394 FamFG zu löschen. Die Frist zur Erhebung eines Widerspruchs gegen die beabsichtigte Löschung wird auf 3 Monate festgesetzt."
    },
    {
      "date": "2026-02-19",
      "id": "145562",
      "original_text": "Löschungsankündigung\nHamburg Amtsgericht Hamburg HRB 113124\n01 DID Digital GmbH – Hamburg",
      "type": "Löschungsankündigung",
      "state": "Hamburg",
      "amtsgericht": "Amtsgericht Hamburg",
      "registernummer": "HRB 113124",
      "registerart": "HRB",
      "company_name": "01 DID Digital GmbH",
      "company_seat": "Hamburg",
      "details": "19.02.2026 (Bekanntmachungsdatum)\n\nHamburg Amtsgericht Hamburg HRB 113124\nLöschungsankündigung\n\n01 DID Digital GmbH\nGesellschaft mit beschränkter Haftung\nHamburg\n\nDas Registergericht beabsichtigt, die im Handelsregister eingetragene Gesellschaft von Amts wegen nach § 394 FamFG zu löschen. Die Frist zur Erhebung eines Widerspruchs gegen die beabsichtigte Löschung wird auf 3 Monate festgesetzt."
    },
    {
      "date": "2026-02-19",
      "id": "145563",
      "original_text": "Löschungsankündigung\nHamburg Amtsgericht Hamburg HRB 111562\nPort Laguna Rechlin GmbH – Hamburg",
      "type": "Löschungsankündigung",
      "state": "Hamburg",
      "amtsgericht": "Amtsgericht Hamburg",
      "registernummer": "HRB 111562",
      "registerart": "HRB",
      "company_name": "Port Laguna Rechlin GmbH",
      "company_seat": "Hamburg",
      "details": "19.02.2026 (Bekanntmachungsdatum)\n\nHamburg Amtsgericht Hamburg HRB 111562\nLöschungsankündigung\n\nPort Laguna Rechlin GmbH\nGesellschaft mit beschränkter Haftung\nHamburg\n\nDas Registergericht beabsichtigt, die im Handelsregister eingetragene Gesellschaft von Amts wegen nach § 394 FamFG zu löschen. Die Frist zur Erhebung eines Widerspruchs gegen die beabsichtigte Löschung wird auf 3 Monate festgesetzt."
    },
    {
      "date": "2026-02-19",
      "id": "145564",
      "original_text": "Löschungsankündigung\nHamburg Amtsgericht Hamburg HRB 113607\nKIC Home GmbH – Hamburg",
      "type": "Löschungsankündigung",
      "state": "Hamburg",
      "amtsgericht": "Amtsgericht Hamburg",
      "registernummer": "HRB 113607",
      "registerart": "HRB",
      "company_name": "KIC Home GmbH",
      "company_seat": "Hamburg",
      "details": "19.02.2026 (Bekanntmachungsdatum)\n\nHamburg Amtsgericht Hamburg HRB 113607\nLöschungsankündigung\n\nKIC Home GmbH\nGesellschaft mit beschränkter Haftung\nHamburg\n\nDas Registergericht beabsichtigt, die im Handelsregister eingetragene Gesellschaft von Amts wegen nach § 394 FamFG zu löschen. Die Frist zur Erhebung eines Widerspruchs gegen die beabsichtigte Löschung wird auf 3 Monate festgesetzt."
    },
    {
      "date": "2026-02-19",
      "id": "145565",
      "original_text": "Löschungsankündigung\nHamburg Amtsgericht Hamburg HRB 119048\nPRO source GmbH – Hamburg",
      "type": "Löschungsankündigung",
      "state": "Hamburg",
      "amtsgericht": "Amtsgericht Hamburg",
      "registernummer": "HRB 119048",
      "registerart": "HRB",
      "company_name": "PRO source GmbH",
      "company_seat": "Hamburg",
      "details": "19.02.2026 (Bekanntmachungsdatum)\n\nHamburg Amtsgericht Hamburg HRB 119048\nLöschungsankündigung\n\nPRO source GmbH\nGesellschaft mit beschränkter Haftung\nHamburg\n\nDas Registergericht beabsichtigt, die im Handelsregister eingetragene Gesellschaft von Amts wegen nach § 394 FamFG zu löschen. Die Frist zur Erhebung eines Widerspruchs gegen die beabsichtigte Löschung wird auf 3 Monate festgesetzt."
    },
    {
      "date": "2026-02-19",
      "id": "145566",
      "original_text": "Löschungsankündigung\nHamburg Amtsgericht Hamburg HRB 140250\nVORTEX International GmbH – Hamburg",
      "type": "Löschungsankündigung",
      "state": "Hamburg",
      "amtsgericht": "Amtsgericht Hamburg",
      "registernummer": "HRB 140250",
      "registerart": "HRB",
      "company_name": "VORTEX International GmbH",
      "company_seat": "Hamburg",
      "details": "19.02.2026 (Bekanntmachungsdatum)\n\nHamburg Amtsgericht Hamburg HRB 140250\nLöschungsankündigung\n\nVORTEX International GmbH\nGesellschaft mit beschränkter Haftung\nHamburg\n\nDas Registergericht beabsichtigt, die im Handelsregister eingetragene Gesellschaft von Amts wegen nach § 394 FamFG zu löschen. Die Frist zur Erhebung eines Widerspruchs gegen die beabsichtigte Löschung wird auf 3 Monate festgesetzt."
    },
    {
      "date": "2026-02-19",
      "id": "145567",
      "original_text": "Löschungsankündigung\nBerlin Amtsgericht Berlin (Charlottenburg) HRB 248911\nALG Putz GmbH – Berlin",
      "type": "Löschungsankündigung",
      "state": "Berlin",
      "amtsgericht": "Amtsgericht Berlin (Charlottenburg)",
      "registernummer": "HRB 248911",
      "registerart": "HRB",
      "company_name": "ALG Putz GmbH",
      "company_seat": "Berlin",
      "details": "19.02.2026 (Bekanntmachungsdatum)\n\nBerlin Amtsgericht Berlin (Charlottenburg) HRB 248911\nLöschungsankündigung\n\nALG Putz GmbH\nGesellschaft mit beschränkter Haftung\nBerlin\n\nBei der nachstehenden Gesellschaft wird das Amtslöschungsverfahren gemäß § 394 FamFG eingeleitet. Widerspruchsfrist 6 Wochen"
    },
    {
      "date": "2026-02-19",
      "id": "145568",
      "original_text": "Löschungsankündigung\nHamburg Amtsgericht Hamburg HRB 151111\nSAB Dienstleistung und Abbruch GmbH – Hamburg",
      "type": "Löschungsankündigung",
      "state": "Hamburg",
      "amtsgericht": "Amtsgericht Hamburg",
      "registernummer": "HRB 151111",
      "registerart": "HRB",
      "company_name": "SAB Dienstleistung und Abbruch GmbH",
      "company_seat": "Hamburg",
      "details": "19.02.2026 (Bekanntmachungsdatum)\n\nHamburg Amtsgericht Hamburg HRB 151111\nLöschungsankündigung\n\nSAB Dienstleistung und Abbruch GmbH\nGesellschaft mit beschränkter Haftung\nHamburg\n\nDas Registergericht beabsichtigt, die im Handelsregister eingetragene Gesellschaft von Amts wegen nach § 394 FamFG zu löschen. Die Frist zur Erhebung eines Widerspruchs gegen die beabsichtigte Löschung wird auf 3 Monate festgesetzt."
    },
    {
      "date": "2026-02-19",
      "id": "145569",
      "original_text": "Löschungsankündigung\nHamburg Amtsgericht Hamburg HRB 145269\nZiehFest Technik GmbH – Hamburg",
      "type": "Löschungsankündigung",
      "state": "Hamburg",
      "amtsgericht": "Amtsgericht Hamburg",
      "registernummer": "HRB 145269",
      "registerart": "HRB",
      "company_name": "ZiehFest Technik GmbH",
      "company_seat": "Hamburg",
      "details": "19.02.2026 (Bekanntmachungsdatum)\n\nHamburg Amtsgericht Hamburg HRB 145269\nLöschungsankündigung\n\nZiehFest Technik GmbH\nGesellschaft mit beschränkter Haftung\nHamburg\n\nDas Registergericht beabsichtigt, die im Handelsregister eingetragene Gesellschaft von Amts wegen nach § 394 FamFG zu löschen. Die Frist zur Erhebung eines Widerspruchs gegen die beabsichtigte Löschung wird auf 3 Monate festgesetzt."
    },
    {
      "date": "2026-02-19",
      "id": "145570",
      "original_text": "Löschungsankündigung\nHamburg Amtsgericht Hamburg HRB 152272\nHKS Fulfilment Solution GmbH – Hamburg",
      "type": "Löschungsankündigung",
      "state": "Hamburg",
      "amtsgericht": "Amtsgericht Hamburg",
      "registernummer": "HRB 152272",
      "registerart": "HRB",
      "company_name": "HKS Fulfilment Solution GmbH",
      "company_seat": "Hamburg",
      "details": "19.02.2026 (Bekanntmachungsdatum)\n\nHamburg Amtsgericht Hamburg HRB 152272\nLöschungsankündigung\n\nHKS Fulfilment Solution GmbH\nGesellschaft mit beschränkter Haftung\nHamburg\n\nDas Registergericht beabsichtigt, die im Handelsregister eingetragene Gesellschaft von Amts wegen nach § 394 FamFG zu löschen. Die Frist zur Erhebung eines Widerspruchs gegen die beabsichtigte Löschung wird auf 3 Monate festgesetzt."
    },
    {
      "date": "2026-02-19",
      "id": "145571",
      "original_text": "Löschungsankündigung\nHamburg Amtsgericht Hamburg HRB 153567\nPalmarium Travel & Events GmbH – Hamburg",
      "type": "Löschungsankündigung",
      "state": "Hamburg",
      "amtsgericht": "Amtsgericht Hamburg",
      "registernummer": "HRB 153567",
      "registerart": "HRB",
      "company_name": "Palmarium Travel & Events GmbH",
      "company_seat": "Hamburg",
      "details": "19.02.2026 (Bekanntmachungsdatum)\n\nHamburg Amtsgericht Hamburg HRB 153567\nLöschungsankündigung\n\nPalmarium Travel & Events GmbH\nGesellschaft mit beschränkter Haftung\nHamburg\n\nDas Registergericht beabsichtigt, die im Handelsregister eingetragene Gesellschaft von Amts wegen nach § 394 FamFG zu löschen. Die Frist zur Erhebung eines Widerspruchs gegen die beabsichtigte Löschung wird auf 3 Monate festgesetzt."
    },
    {
      "date": "2026-02-19",
      "id": "145572",
      "original_text": "Löschungsankündigung\nHamburg Amtsgericht Hamburg HRB 154935\nFoody-Hamburg UG (haftungsbeschränkt) – Hamburg",
      "type": "Löschungsankündigung",
      "state": "Hamburg",
      "amtsgericht": "Amtsgericht Hamburg",
      "registernummer": "HRB 154935",
      "registerart": "HRB",
      "company_name": "Foody-Hamburg UG (haftungsbeschränkt)",
      "company_seat": "Hamburg",
      "details": "19.02.2026 (Bekanntmachungsdatum)\n\nHamburg Amtsgericht Hamburg HRB 154935\nLöschungsankündigung\n\nFoody-Hamburg UG (haftungsbeschränkt)\nGesellschaft mit beschränkter Haftung\nHamburg\n\nDas Registergericht beabsichtigt, die im Handelsregister eingetragene Gesellschaft von Amts wegen nach § 394 FamFG zu löschen. Die Frist zur Erhebung eines Widerspruchs gegen die beabsichtigte Löschung wird auf 3 Monate festgesetzt."
    },
    {
      "date": "2026-02-19",
      "id": "145573",
      "original_text": "Löschungsankündigung\nHamburg Amtsgericht Hamburg HRB 156849\nCuore Technology Hamburg GmbH – Hamburg",
      "type": "Löschungsankündigung",
      "state": "Hamburg",
      "amtsgericht": "Amtsgericht Hamburg",
      "registernummer": "HRB 156849",
      "registerart": "HRB",
      "company_name": "Cuore Technology Hamburg GmbH",
      "company_seat": "Hamburg",
      "details": "19.02.2026 (Bekanntmachungsdatum)\n\nHamburg Amtsgericht Hamburg HRB 156849\nLöschungsankündigung\n\nCuore Technology Hamburg GmbH\nGesellschaft mit beschränkter Haftung\nHamburg\n\nDas Registergericht beabsichtigt, die im Handelsregister eingetragene Gesellschaft von Amts wegen nach § 394 FamFG zu löschen. Die Frist zur Erhebung eines Widerspruchs gegen die beabsichtigte Löschung wird auf 3 Monate festgesetzt."
    },
    {
      "date": "2026-02-19",
      "id": "145574",
      "original_text": "Löschungsankündigung\nHamburg Amtsgericht Hamburg HRB 162600\nVENCUNIA UG (haftungsbeschränkt) – Hamburg",
      "type": "Löschungsankündigung",
      "state": "Hamburg",
      "amtsgericht": "Amtsgericht Hamburg",
      "registernummer": "HRB 162600",
      "registerart": "HRB",
      "company_name": "VENCUNIA UG (haftungsbeschränkt)",
      "company_seat": "Hamburg",
      "details": "19.02.2026 (Bekanntmachungsdatum)\n\nHamburg Amtsgericht Hamburg HRB 162600\nLöschungsankündigung\n\nVENCUNIA UG (haftungsbeschränkt)\nGesellschaft mit beschränkter Haftung\nHamburg\n\nDas Registergericht beabsichtigt, die im Handelsregister eingetragene Gesellschaft von Amts wegen nach § 394 FamFG zu löschen. Die Frist zur Erhebung eines Widerspruchs gegen die beabsichtigte Löschung wird auf 3 Monate festgesetzt."
    },
    {
      "date": "2026-02-19",
      "id": "145575",
      "original_text": "Löschungsankündigung\nHamburg Amtsgericht Hamburg HRB 163604\nPoyraz Sam UG (haftungsbeschränkt) – Hamburg",
      "type": "Löschungsankündigung",
      "state": "Hamburg",
      "amtsgericht": "Amtsgericht Hamburg",
      "registernummer": "HRB 163604",
      "registerart": "HRB",
      "company_name": "Poyraz Sam UG (haftungsbeschränkt)",
      "company_seat": "Hamburg",
      "details": "19.02.2026 (Bekanntmachungsdatum)\n\nHamburg Amtsgericht Hamburg HRB 163604\nLöschungsankündigung\n\nPoyraz Sam UG (haftungsbeschränkt)\nGesellschaft mit beschränkter Haftung\nHamburg\n\nDas Registergericht beabsichtigt, die im Handelsregister eingetragene Gesellschaft von Amts wegen nach § 394 FamFG zu löschen. Die Frist zur Erhebung eines Widerspruchs gegen die beabsichtigte Löschung wird auf 3 Monate festgesetzt."
    },
    {
      "date": "2026-02-19",
      "id": "145576",
      "original_text": "Löschungsankündigung\nHamburg Amtsgericht Hamburg HRB 165979\nTOP-GUARDS Personalvermittlung GmbH – Hamburg",
      "type": "Löschungsankündigung",
      "state": "Hamburg",
      "amtsgericht": "Amtsgericht Hamburg",
      "registernummer": "HRB 165979",
      "registerart": "HRB",
      "company_name": "TOP-GUARDS Personalvermittlung GmbH",
      "company_seat": "Hamburg",
      "details": "19.02.2026 (Bekanntmachungsdatum)\n\nHamburg Amtsgericht Hamburg HRB 165979\nLöschungsankündigung\n\nTOP-GUARDS Personalvermittlung GmbH\nGesellschaft mit beschränkter Haftung\nHamburg\n\nDas Registergericht beabsichtigt, die im Handelsregister eingetragene Gesellschaft von Amts wegen nach § 394 FamFG zu löschen. Die Frist zur Erhebung eines Widerspruchs gegen die beabsichtigte Löschung wird auf 3 Monate festgesetzt."
    },
    {
      "date": "2026-02-19",
      "id": "145577",
      "original_text": "Löschungsankündigung\nHamburg Amtsgericht Hamburg HRB 173602\nSkora Security UG (haftungsbeschränkt) – Hamburg",
      "type": "Löschungsankündigung",
      "state": "Hamburg",
      "amtsgericht": "Amtsgericht Hamburg",
      "registernummer": "HRB 173602",
      "registerart": "HRB",
      "company_name": "Skora Security UG (haftungsbeschränkt)",
      "company_seat": "Hamburg",
      "details": "19.02.2026 (Bekanntmachungsdatum)\n\nHamburg Amtsgericht Hamburg HRB 173602\nLöschungsankündigung\n\nSkora Security UG (haftungsbeschränkt)\nGesellschaft mit beschränkter Haftung\nHamburg\n\nDas Registergericht beabsichtigt, die im Handelsregister eingetragene Gesellschaft von Amts wegen nach § 394 FamFG zu löschen. Die Frist zur Erhebung eines Widerspruchs gegen die beabsichtigte Löschung wird auf 3 Monate festgesetzt."
    },
    {
      "date": "2026-02-19",
      "id": "145578",
      "original_text": "Löschungsankündigung\nHamburg Amtsgericht Hamburg HRB 176725\nLOTUS Logistik 24 GmbH – Hamburg",
      "type": "Löschungsankündigung",
      "state": "Hamburg",
      "amtsgericht": "Amtsgericht Hamburg",
      "registernummer": "HRB 176725",
      "registerart": "HRB",
      "company_name": "LOTUS Logistik 24 GmbH",
      "company_seat": "Hamburg",
      "details": "19.02.2026 (Bekanntmachungsdatum)\n\nHamburg Amtsgericht Hamburg HRB 176725\nLöschungsankündigung\n\nLOTUS Logistik 24 GmbH\nGesellschaft mit beschränkter Haftung\nHamburg\n\nDas Registergericht beabsichtigt, die im Handelsregister eingetragene Gesellschaft von Amts wegen nach § 394 FamFG zu löschen. Die Frist zur Erhebung eines Widerspruchs gegen die beabsichtigte Löschung wird auf 3 Monate festgesetzt."
    },
    {
      "date": "2026-02-19",
      "id": "145579",
      "original_text": "Löschungsankündigung\nHamburg Amtsgericht Hamburg HRB 154151\nHRS Dienstleistung AK-HA GmbH – Hamburg",
      "type": "Löschungsankündigung",
      "state": "Hamburg",
      "amtsgericht": "Amtsgericht Hamburg",
      "registernummer": "HRB 154151",
      "registerart": "HRB",
      "company_name": "HRS Dienstleistung AK-HA GmbH",
      "company_seat": "Hamburg",
      "details": "19.02.2026 (Bekanntmachungsdatum)\n\nHamburg Amtsgericht Hamburg HRB 154151\nLöschungsankündigung\n\nHRS Dienstleistung AK-HA GmbH\nGesellschaft mit beschränkter Haftung\nHamburg\n\nDas Registergericht beabsichtigt, die im Handelsregister eingetragene Gesellschaft von Amts wegen nach § 394 FamFG zu löschen. Die Frist zur Erhebung eines Widerspruchs gegen die beabsichtigte Löschung wird auf 3 Monate festgesetzt."
    },
    {
      "date": "2026-02-19",
      "id": "145580",
      "original_text": "Löschungsankündigung\nHamburg Amtsgericht Hamburg HRB 155273\nPyramids Media GmbH – Hamburg",
      "type": "Löschungsankündigung",
      "state": "Hamburg",
      "amtsgericht": "Amtsgericht Hamburg",
      "registernummer": "HRB 155273",
      "registerart": "HRB",
      "company_name": "Pyramids Media GmbH",
      "company_seat": "Hamburg",
      "details": "19.02.2026 (Bekanntmachungsdatum)\n\nHamburg Amtsgericht Hamburg HRB 155273\nLöschungsankündigung\n\nPyramids Media GmbH\nGesellschaft mit beschränkter Haftung\nHamburg\n\nDas Registergericht beabsichtigt, die im Handelsregister eingetragene Gesellschaft von Amts wegen nach § 394 FamFG zu löschen. Die Frist zur Erhebung eines Widerspruchs gegen die beabsichtigte Löschung wird auf 3 Monate festgesetzt."
    },
    {
      "date": "2026-02-19",
      "id": "145581",
      "original_text": "Löschungsankündigung\nHamburg Amtsgericht Hamburg HRB 159363\nmy-morrow.com GmbH – Hamburg",
      "type": "Löschungsankündigung",
      "state": "Hamburg",
      "amtsgericht": "Amtsgericht Hamburg",
      "registernummer": "HRB 159363",
      "registerart": "HRB",
      "company_name": "my-morrow.com GmbH",
      "company_seat": "Hamburg",
      "details": "19.02.2026 (Bekanntmachungsdatum)\n\nHamburg Amtsgericht Hamburg HRB 159363\nLöschungsankündigung\n\nmy-morrow.com GmbH\nGesellschaft mit beschränkter Haftung\nHamburg\n\nDas Registergericht beabsichtigt, die im Handelsregister eingetragene Gesellschaft von Amts wegen nach § 394 FamFG zu löschen. Die Frist zur Erhebung eines Widerspruchs gegen die beabsichtigte Löschung wird auf 3 Monate festgesetzt."
    },
    {
      "date": "2026-02-19",
      "id": "145582",
      "original_text": "Löschungsankündigung\nHamburg Amtsgericht Hamburg HRB 164936\nEnergy And Water Development Corp – Hamburg",
      "type": "Löschungsankündigung",
      "state": "Hamburg",
      "amtsgericht": "Amtsgericht Hamburg",
      "registernummer": "HRB 164936",
      "registerart": "HRB",
      "company_name": "Energy And Water Development Corp",
      "company_seat": "Hamburg",
      "details": "19.02.2026 (Bekanntmachungsdatum)\n\nHamburg Amtsgericht Hamburg HRB 164936\nLöschungsankündigung\n\nEnergy And Water Development Corp\nRechtsform ausländischen Rechts HRB\nHamburg\n\nDas Registergericht beabsichtigt, die im Handelsregister eingetragene Gesellschaft von Amts wegen nach § 394 FamFG zu löschen. Die Frist zur Erhebung eines Widerspruchs gegen die beabsichtigte Löschung wird auf 3 Monate festgesetzt."
    },
    {
      "date": "2026-02-19",
      "id": "145583",
      "original_text": "Löschungsankündigung\nHamburg Amtsgericht Hamburg HRB 167619\nSansin GmbH – Hamburg",
      "type": "Löschungsankündigung",
      "state": "Hamburg",
      "amtsgericht": "Amtsgericht Hamburg",
      "registernummer": "HRB 167619",
      "registerart": "HRB",
      "company_name": "Sansin GmbH",
      "company_seat": "Hamburg",
      "details": "19.02.2026 (Bekanntmachungsdatum)\n\nHamburg Amtsgericht Hamburg HRB 167619\nLöschungsankündigung\n\nSansin GmbH\nGesellschaft mit beschränkter Haftung\nHamburg\n\nDas Registergericht beabsichtigt, die im Handelsregister eingetragene Gesellschaft von Amts wegen nach § 394 FamFG zu löschen. Die Frist zur Erhebung eines Widerspruchs gegen die beabsichtigte Löschung wird auf 3 Monate festgesetzt."
    },
    {
      "date": "2026-02-19",
      "id": "145584",
      "original_text": "Löschungsankündigung\nHamburg Amtsgericht Hamburg HRB 173736\nSASA-GmbH – Hamburg",
      "type": "Löschungsankündigung",
      "state": "Hamburg",
      "amtsgericht": "Amtsgericht Hamburg",
      "registernummer": "HRB 173736",
      "registerart": "HRB",
      "company_name": "SASA-GmbH",
      "company_seat": "Hamburg",
      "details": "19.02.2026 (Bekanntmachungsdatum)\n\nHamburg Amtsgericht Hamburg HRB 173736\nLöschungsankündigung\n\nSASA-GmbH\nGesellschaft mit beschränkter Haftung\nHamburg\n\nDas Registergericht beabsichtigt, die im Handelsregister eingetragene Gesellschaft von Amts wegen nach § 394 FamFG zu löschen. Die Frist zur Erhebung eines Widerspruchs gegen die beabsichtigte Löschung wird auf 3 Monate festgesetzt."
    },
    {
      "date": "2026-02-19",
      "id": "145585",
      "original_text": "Löschungsankündigung\nHamburg Amtsgericht Hamburg HRB 177413\nLima Bau UG (haftungsbeschränkt) – Hamburg",
      "type": "Löschungsankündigung",
      "state": "Hamburg",
      "amtsgericht": "Amtsgericht Hamburg",
      "registernummer": "HRB 177413",
      "registerart": "HRB",
      "company_name": "Lima Bau UG (haftungsbeschränkt)",
      "company_seat": "Hamburg",
      "details": "19.02.2026 (Bekanntmachungsdatum)\n\nHamburg Amtsgericht Hamburg HRB 177413\nLöschungsankündigung\n\nLima Bau UG (haftungsbeschränkt)\nGesellschaft mit beschränkter Haftung\nHamburg\n\nDas Registergericht beabsichtigt, die im Handelsregister eingetragene Gesellschaft von Amts wegen nach § 394 FamFG zu löschen. Die Frist zur Erhebung eines Widerspruchs gegen die beabsichtigte Löschung wird auf 3 Monate festgesetzt."
    },
    {
      "date": "2026-02-19",
      "id": "145586",
      "original_text": "Einreichung neuer Dokumente\nSaarland Amtsgericht Saarbrücken HRB 104390\nCISPA - Helmholtz-Zentrum für Informationssicherheit gGmbH – Saarbrücken",
      "type": "Einreichung neuer Dokumente",
      "state": "Saarland",
      "amtsgericht": "Amtsgericht Saarbrücken",
      "registernummer": "HRB 104390",
      "registerart": "HRB",
      "company_name": "CISPA - Helmholtz-Zentrum für Informationssicherheit gGmbH",
      "company_seat": "Saarbrücken",
      "details": "19.02.2026 (Bekanntmachungsdatum)\n\nSaarland Amtsgericht Saarbrücken HRB 104390\nEinreichung neuer Dokumente\n\nCISPA - Helmholtz-Zentrum für Informationssicherheit gGmbH\nGesellschaft mit beschränkter Haftung\nSaarbrücken\n\nDie Geschäftsführung der Gesellschaft hat eine Liste der Mitglieder des Aufsichtsrats zum Handelsregister eingereicht (§ 52 Abs. 3 Satz 2 GmbHG)."
    },
    {
      "date": "2026-02-19",
      "id": "145587",
      "original_text": "Löschungsankündigung\nHamburg Amtsgericht Hamburg HRB 180831\nAMS Verwaltungsgesellschaft mbH – Hamburg",
      "type": "Löschungsankündigung",
      "state": "Hamburg",
      "amtsgericht": "Amtsgericht Hamburg",
      "registernummer": "HRB 180831",
      "registerart": "HRB",
      "company_name": "AMS Verwaltungsgesellschaft mbH",
      "company_seat": "Hamburg",
      "details": "19.02.2026 (Bekanntmachungsdatum)\n\nHamburg Amtsgericht Hamburg HRB 180831\nLöschungsankündigung\n\nAMS Verwaltungsgesellschaft mbH\nGesellschaft mit beschränkter Haftung\nHamburg\n\nDas Registergericht beabsichtigt, die im Handelsregister eingetragene Gesellschaft von Amts wegen nach § 394 FamFG zu löschen. Die Frist zur Erhebung eines Widerspruchs gegen die beabsichtigte Löschung wird auf 3 Monate festgesetzt."
    },
    {
      "date": "2026-02-19",
      "id": "145588",
      "original_text": "Löschungsankündigung\nHamburg Amtsgericht Hamburg HRB 182487\nDPO Vermittlung & Dienstleistung UG (haftungsbeschränkt) – Hamburg",
      "type": "Löschungsankündigung",
      "state": "Hamburg",
      "amtsgericht": "Amtsgericht Hamburg",
      "registernummer": "HRB 182487",
      "registerart": "HRB",
      "company_name": "DPO Vermittlung & Dienstleistung UG (haftungsbeschränkt)",
      "company_seat": "Hamburg",
      "details": "19.02.2026 (Bekanntmachungsdatum)\n\nHamburg Amtsgericht Hamburg HRB 182487\nLöschungsankündigung\n\nDPO Vermittlung & Dienstleistung UG (haftungsbeschränkt)\nGesellschaft mit beschränkter Haftung\nHamburg\n\nDas Registergericht beabsichtigt, die im Handelsregister eingetragene Gesellschaft von Amts wegen nach § 394 FamFG zu löschen. Die Frist zur Erhebung eines Widerspruchs gegen die beabsichtigte Löschung wird auf 3 Monate festgesetzt."
    },
    {
      "date": "2026-02-19",
      "id": "145589",
      "original_text": "Löschungsankündigung\nHamburg Amtsgericht Hamburg HRB 184665\nMonolit Transport GmbH – Hamburg",
      "type": "Löschungsankündigung",
      "state": "Hamburg",
      "amtsgericht": "Amtsgericht Hamburg",
      "registernummer": "HRB 184665",
      "registerart": "HRB",
      "company_name": "Monolit Transport GmbH",
      "company_seat": "Hamburg",
      "details": "19.02.2026 (Bekanntmachungsdatum)\n\nHamburg Amtsgericht Hamburg HRB 184665\nLöschungsankündigung\n\nMonolit Transport GmbH\nGesellschaft mit beschränkter Haftung\nHamburg\n\nDas Registergericht beabsichtigt, die im Handelsregister eingetragene Gesellschaft von Amts wegen nach § 394 FamFG zu löschen. Die Frist zur Erhebung eines Widerspruchs gegen die beabsichtigte Löschung wird auf 3 Monate festgesetzt."
    },
    {
      "date": "2026-02-19",
      "id": "145590",
      "original_text": "Löschungsankündigung\nHamburg Amtsgericht Hamburg HRB 185587\nAuruminvest Briefmarken und Münzen Handel GmbH – Hamburg",
      "type": "Löschungsankündigung",
      "state": "Hamburg",
      "amtsgericht": "Amtsgericht Hamburg",
      "registernummer": "HRB 185587",
      "registerart": "HRB",
      "company_name": "Auruminvest Briefmarken und Münzen Handel GmbH",
      "company_seat": "Hamburg",
      "details": "19.02.2026 (Bekanntmachungsdatum)\n\nHamburg Amtsgericht Hamburg HRB 185587\nLöschungsankündigung\n\nAuruminvest Briefmarken und Münzen Handel GmbH\nGesellschaft mit beschränkter Haftung\nHamburg\n\nDas Registergericht beabsichtigt, die im Handelsregister eingetragene Gesellschaft von Amts wegen nach § 394 FamFG zu löschen. Die Frist zur Erhebung eines Widerspruchs gegen die beabsichtigte Löschung wird auf 3 Monate festgesetzt."
    },
    {
      "date": "2026-02-19",
      "id": "145591",
      "original_text": "Löschungsankündigung\nHamburg Amtsgericht Hamburg HRB 190327\nKDI Consulting UG (haftungsbeschränkt) – Hamburg",
      "type": "Löschungsankündigung",
      "state": "Hamburg",
      "amtsgericht": "Amtsgericht Hamburg",
      "registernummer": "HRB 190327",
      "registerart": "HRB",
      "company_name": "KDI Consulting UG (haftungsbeschränkt)",
      "company_seat": "Hamburg",
      "details": "19.02.2026 (Bekanntmachungsdatum)\n\nHamburg Amtsgericht Hamburg HRB 190327\nLöschungsankündigung\n\nKDI Consulting UG (haftungsbeschränkt)\nGesellschaft mit beschränkter Haftung\nHamburg\n\nDas Registergericht beabsichtigt, die im Handelsregister eingetragene Gesellschaft von Amts wegen nach § 394 FamFG zu löschen. Die Frist zur Erhebung eines Widerspruchs gegen die beabsichtigte Löschung wird auf 3 Monate festgesetzt."
    },
    {
      "date": "2026-02-19",
      "id": "145592",
      "original_text": "Löschungsankündigung\nHamburg Amtsgericht Hamburg HRB 179618\nTE Bauleistungen UG (haftungsbeschränkt) – Hamburg",
      "type": "Löschungsankündigung",
      "state": "Hamburg",
      "amtsgericht": "Amtsgericht Hamburg",
      "registernummer": "HRB 179618",
      "registerart": "HRB",
      "company_name": "TE Bauleistungen UG (haftungsbeschränkt)",
      "company_seat": "Hamburg",
      "details": "19.02.2026 (Bekanntmachungsdatum)\n\nHamburg Amtsgericht Hamburg HRB 179618\nLöschungsankündigung\n\nTE Bauleistungen UG (haftungsbeschränkt)\nGesellschaft mit beschränkter Haftung\nHamburg\n\nDas Verfahren zur Löschung der o.a. Gesellschaft nach § 394 FamFG aufgrund von\nVermögenslosigkeit wurde eingestellt. Das Registergericht beabsichtigt derzeit nicht mehr,\ndie im Handelsregister eingetragene Gesellschaft von Amts wegen nach § 394 FamFG zu\nlöschen."
    },
    {
      "date": "2026-02-19",
      "id": "145593",
      "original_text": "Löschungsankündigung\nHamburg Amtsgericht Hamburg HRB 181778\nMalMoh UG (haftungsbeschränkt) – Hamburg",
      "type": "Löschungsankündigung",
      "state": "Hamburg",
      "amtsgericht": "Amtsgericht Hamburg",
      "registernummer": "HRB 181778",
      "registerart": "HRB",
      "company_name": "MalMoh UG (haftungsbeschränkt)",
      "company_seat": "Hamburg",
      "details": "19.02.2026 (Bekanntmachungsdatum)\n\nHamburg Amtsgericht Hamburg HRB 181778\nLöschungsankündigung\n\nMalMoh UG (haftungsbeschränkt)\nGesellschaft mit beschränkter Haftung\nHamburg\n\nDas Registergericht beabsichtigt, die im Handelsregister eingetragene Gesellschaft von Amts wegen nach § 394 FamFG zu löschen. Die Frist zur Erhebung eines Widerspruchs gegen die beabsichtigte Löschung wird auf 3 Monate festgesetzt."
    },
    {
      "date": "2026-02-19",
      "id": "145594",
      "original_text": "Löschungsankündigung\nHamburg Amtsgericht Hamburg HRB 178298\nScope Limited GmbH – Hamburg",
      "type": "Löschungsankündigung",
      "state": "Hamburg",
      "amtsgericht": "Amtsgericht Hamburg",
      "registernummer": "HRB 178298",
      "registerart": "HRB",
      "company_name": "Scope Limited GmbH",
      "company_seat": "Hamburg",
      "details": "19.02.2026 (Bekanntmachungsdatum)\n\nHamburg Amtsgericht Hamburg HRB 178298\nLöschungsankündigung\n\nScope Limited GmbH\nGesellschaft mit beschränkter Haftung\nHamburg\n\nDas Registergericht beabsichtigt, die im Handelsregister eingetragene Gesellschaft von Amts wegen nach § 394 FamFG zu löschen. Die Frist zur Erhebung eines Widerspruchs gegen die beabsichtigte Löschung wird auf 3 Monate festgesetzt."
    },
    {
      "date": "2026-02-19",
      "id": "145595",
      "original_text": "Löschungsankündigung\nHamburg Amtsgericht Hamburg HRB 183296\nAndresen Gerüstbau GmbH – Hamburg",
      "type": "Löschungsankündigung",
      "state": "Hamburg",
      "amtsgericht": "Amtsgericht Hamburg",
      "registernummer": "HRB 183296",
      "registerart": "HRB",
      "company_name": "Andresen Gerüstbau GmbH",
      "company_seat": "Hamburg",
      "details": "19.02.2026 (Bekanntmachungsdatum)\n\nHamburg Amtsgericht Hamburg HRB 183296\nLöschungsankündigung\n\nAndresen Gerüstbau GmbH\nGesellschaft mit beschränkter Haftung\nHamburg\n\nDas Registergericht beabsichtigt, die im Handelsregister eingetragene Gesellschaft von Amts wegen nach § 394 FamFG zu löschen. Die Frist zur Erhebung eines Widerspruchs gegen die beabsichtigte Löschung wird auf 3 Monate festgesetzt."
    },
    {
      "date": "2026-02-19",
      "id": "145596",
      "original_text": "Löschungsankündigung\nHamburg Amtsgericht Hamburg HRB 184946\nN&O Nord Ost Dienstleistungs GmbH – Hamburg",
      "type": "Löschungsankündigung",
      "state": "Hamburg",
      "amtsgericht": "Amtsgericht Hamburg",
      "registernummer": "HRB 184946",
      "registerart": "HRB",
      "company_name": "N&O Nord Ost Dienstleistungs GmbH",
      "company_seat": "Hamburg",
      "details": "19.02.2026 (Bekanntmachungsdatum)\n\nHamburg Amtsgericht Hamburg HRB 184946\nLöschungsankündigung\n\nN&O Nord Ost Dienstleistungs GmbH\nGesellschaft mit beschränkter Haftung\nHamburg\n\nDas Registergericht beabsichtigt, die im Handelsregister eingetragene Gesellschaft von Amts wegen nach § 394 FamFG zu löschen. Die Frist zur Erhebung eines Widerspruchs gegen die beabsichtigte Löschung wird auf 3 Monate festgesetzt."
    },
    {
      "date": "2026-02-19",
      "id": "145597",
      "original_text": "Löschungsankündigung\nHamburg Amtsgericht Hamburg HRB 189535\nATX Logistik GmbH – Hamburg",
      "type": "Löschungsankündigung",
      "state": "Hamburg",
      "amtsgericht": "Amtsgericht Hamburg",
      "registernummer": "HRB 189535",
      "registerart": "HRB",
      "company_name": "ATX Logistik GmbH",
      "company_seat": "Hamburg",
      "details": "19.02.2026 (Bekanntmachungsdatum)\n\nHamburg Amtsgericht Hamburg HRB 189535\nLöschungsankündigung\n\nATX Logistik GmbH\nGesellschaft mit beschränkter Haftung\nHamburg\n\nDas Registergericht beabsichtigt, die im Handelsregister eingetragene Gesellschaft von Amts wegen nach § 394 FamFG zu löschen. Die Frist zur Erhebung eines Widerspruchs gegen die beabsichtigte Löschung wird auf 3 Monate festgesetzt."
    },
    {
      "date": "2026-02-19",
      "id": "145598",
      "original_text": "Löschungsankündigung\nHamburg Amtsgericht Hamburg HRA 1270\nWolff & Olsen Fashion GmbH & Co. KG – Hamburg",
      "type": "Löschungsankündigung",
      "state": "Hamburg",
      "amtsgericht": "Amtsgericht Hamburg",
      "registernummer": "HRA 1270",
      "registerart": "HRA",
      "company_name": "Wolff & Olsen Fashion GmbH & Co. KG",
      "company_seat": "Hamburg",
      "details": "19.02.2026 (Bekanntmachungsdatum)\n\nHamburg Amtsgericht Hamburg HRA 1270\nLöschungsankündigung\n\nWolff & Olsen Fashion GmbH & Co. KG\nKommanditgesellschaft\nHamburg\n\nDas Registergericht beabsichtigt, die im Handelsregister eingetragene Gesellschaft von Amts wegen nach § 394 FamFG zu löschen. Die Frist zur Erhebung eines Widerspruchs gegen die beabsichtigte Löschung wird auf 3 Monate festgesetzt."
    },
    {
      "date": "2026-02-19",
      "id": "145599",
      "original_text": "Löschungsankündigung\nHamburg Amtsgericht Hamburg HRA 101209\nSteiner + Company GmbH & Co. KG – Hamburg",
      "type": "Löschungsankündigung",
      "state": "Hamburg",
      "amtsgericht": "Amtsgericht Hamburg",
      "registernummer": "HRA 101209",
      "registerart": "HRA",
      "company_name": "Steiner + Company GmbH & Co. KG",
      "company_seat": "Hamburg",
      "details": "19.02.2026 (Bekanntmachungsdatum)\n\nHamburg Amtsgericht Hamburg HRA 101209\nLöschungsankündigung\n\nSteiner + Company GmbH & Co. KG\nKommanditgesellschaft\nHamburg\n\nDas Registergericht beabsichtigt, die im Handelsregister eingetragene Gesellschaft von Amts wegen nach § 394 FamFG zu löschen. Die Frist zur Erhebung eines Widerspruchs gegen die beabsichtigte Löschung wird auf 3 Monate festgesetzt."
    },
    {
      "date": "2026-02-19",
      "id": "145600",
      "original_text": "Löschungsankündigung\nBaden-Württemberg Amtsgericht Mannheim HRB 708292\nOliver Lukossek Karosseriefachbetrieb GmbH – Waibstadt",
      "type": "Löschungsankündigung",
      "state": "Baden-Württemberg",
      "amtsgericht": "Amtsgericht Mannheim",
      "registernummer": "HRB 708292",
      "registerart": "HRB",
      "company_name": "Oliver Lukossek Karosseriefachbetrieb GmbH",
      "company_seat": "Waibstadt",
      "details": "19.02.2026 (Bekanntmachungsdatum)\n\nBaden-Württemberg Amtsgericht Mannheim HRB 708292\nLöschungsankündigung\n\nOliver Lukossek Karosseriefachbetrieb GmbH\nGesellschaft mit beschränkter Haftung\nWaibstadt\n\nDas Gericht beabsichtigt, die Gesellschaft wegen Vermögenslosigkeit im Handelsregister von Amts wegen nach § 394 FamFG zu löschen. Die Frist zur Geltendmachung eines Widerspruchs gegen die beabsichtigte Löschung ist auf einen Monat ab Veröffentlichung bestimmt."
    },
    {
      "date": "2026-02-19",
      "id": "145601",
      "original_text": "Registerbekanntmachung nach dem Umwandlungsgesetz\nBaden-Württemberg Amtsgericht Stuttgart HRB 580302\nMeister Verwaltungs-GmbH – Öhringen",
      "type": "Registerbekanntmachung nach dem Umwandlungsgesetz",
      "state": "Baden-Württemberg",
      "amtsgericht": "Amtsgericht Stuttgart",
      "registernummer": "HRB 580302",
      "registerart": "HRB",
      "company_name": "Meister Verwaltungs-GmbH",
      "company_seat": "Öhringen",
      "details": "19.02.2026 (Bekanntmachungsdatum)\n\nBaden-Württemberg Amtsgericht Stuttgart HRB 580302\nRegisterbekanntmachung nach dem Umwandlungsgesetz 19.02.2026 (Eintragungsdatum)\n\nMeister Verwaltungs-GmbH\nGesellschaft mit beschränkter Haftung\nÖhringen\n\nDen Gläubigern der an der Verschmelzung beteiligten Rechtsträger ist, wenn sie binnen sechs Monaten nach dem Tag, an dem die Eintragung der Verschmelzung in das Register des Sitzes desjenigen Rechtsträgers, dessen Gläubiger sie sind, nach § 19 Abs. 3 UmwG als bekanntgemacht gilt, ihren Anspruch nach Grund und Höhe schriftlich anmelden, Sicherheit zu leisten, soweit sie nicht Befriedigung verlangen können. Dieses Recht steht den Gläubigern jedoch nur zu, wenn sie glaubhaft machen, dass durch die Verschmelzung die Erfüllung ihrer Forderung gefährdet wird."
    },
    {
      "date": "2026-02-19",
      "id": "145602",
      "original_text": "Löschungsankündigung\nBerlin Amtsgericht Berlin (Charlottenburg) HRB 129188\nSeatris Investment GmbH – Berlin",
      "type": "Löschungsankündigung",
      "state": "Berlin",
      "amtsgericht": "Amtsgericht Berlin (Charlottenburg)",
      "registernummer": "HRB 129188",
      "registerart": "HRB",
      "company_name": "Seatris Investment GmbH",
      "company_seat": "Berlin",
      "details": "19.02.2026 (Bekanntmachungsdatum)\n\nBerlin Amtsgericht Berlin (Charlottenburg) HRB 129188\nLöschungsankündigung\n\nSeatris Investment GmbH\nGesellschaft mit beschränkter Haftung\nBerlin\n\nBei der nachstehenden Gesellschaft wird das Amtslöschungsverfahren gemäß § 394 FamFG eingeleitet. Widerspruchsfrist 6 Wochen"
    },
    {
      "date": "2026-02-19",
      "id": "145603",
      "original_text": "Löschungsankündigung\nHamburg Amtsgericht Hamburg VR 15451\nVerband der Immobilienverwalter der Freien und Hansestadt Hamburg e.V. – Hamburg",
      "type": "Löschungsankündigung",
      "state": "Hamburg",
      "amtsgericht": "Amtsgericht Hamburg",
      "registernummer": "VR 15451",
      "registerart": "VR",
      "company_name": "Verband der Immobilienverwalter der Freien und Hansestadt Hamburg e.V.",
      "company_seat": "Hamburg",
      "details": "19.02.2026 (Bekanntmachungsdatum)\n\nHamburg Amtsgericht Hamburg VR 15451\nLöschungsankündigung\n\nVerband der Immobilienverwalter der Freien und Hansestadt Hamburg e.V.\neingetragener Verein\nHamburg\n\nDas Registergericht beabsichtigt, den im Vereinsregister eingetragenen Verein von Amts wegen nach § 395 FamFG zu löschen, da nach den angestellten  Ermittlungen dieser Verein offenbar nicht mehr besteht. Die Frist zur Erhebung eines Widerspruchs gegen die beabsichtigte Löschung wird auf 3 Monate festgesetzt."
    },
    {
      "date": "2026-02-19",
      "id": "145604",
      "original_text": "Löschungsankündigung\nHamburg Amtsgericht Hamburg VR 18832\nKreativ Werkstatt e.V. – Hamburg",
      "type": "Löschungsankündigung",
      "state": "Hamburg",
      "amtsgericht": "Amtsgericht Hamburg",
      "registernummer": "VR 18832",
      "registerart": "VR",
      "company_name": "Kreativ Werkstatt e.V.",
      "company_seat": "Hamburg",
      "details": "19.02.2026 (Bekanntmachungsdatum)\n\nHamburg Amtsgericht Hamburg VR 18832\nLöschungsankündigung\n\nKreativ Werkstatt e.V.\neingetragener Verein\nHamburg\n\nDas Registergericht beabsichtigt, den im Vereinsregister eingetragenen Verein von Amts wegen nach § 395 FamFG zu löschen, da nach den angestellten  Ermittlungen dieser Verein offenbar nicht mehr besteht. Die Frist zur Erhebung eines Widerspruchs gegen die beabsichtigte Löschung wird auf 3 Monate festgesetzt."
    },
    {
      "date": "2026-02-19",
      "id": "145605",
      "original_text": "Löschungsankündigung\nHamburg Amtsgericht Hamburg HRA 129319\nA & C Escort Management GmbH & Co. KG – Hamburg",
      "type": "Löschungsankündigung",
      "state": "Hamburg",
      "amtsgericht": "Amtsgericht Hamburg",
      "registernummer": "HRA 129319",
      "registerart": "HRA",
      "company_name": "A & C Escort Management GmbH & Co. KG",
      "company_seat": "Hamburg",
      "details": "19.02.2026 (Bekanntmachungsdatum)\n\nHamburg Amtsgericht Hamburg HRA 129319\nLöschungsankündigung\n\nA & C Escort Management GmbH & Co. KG\nKommanditgesellschaft\nHamburg\n\nDas Registergericht beabsichtigt, die im Handelsregister eingetragene Firma von Amts wegen nach § 31 Abs. 2 HBG zu löschen. Die Frist zur Erhebung eines Widerspruchs gegen die beabsichtigte Löschung wird auf 3 Monate festgesetzt."
    },
    {
      "date": "2026-02-19",
      "id": "145606",
      "original_text": "Löschungsankündigung\nHamburg Amtsgericht Hamburg HRA 131930\nSahelo e.K. – Hamburg",
      "type": "Löschungsankündigung",
      "state": "Hamburg",
      "amtsgericht": "Amtsgericht Hamburg",
      "registernummer": "HRA 131930",
      "registerart": "HRA",
      "company_name": "Sahelo e.K.",
      "company_seat": "Hamburg",
      "details": "19.02.2026 (Bekanntmachungsdatum)\n\nHamburg Amtsgericht Hamburg HRA 131930\nLöschungsankündigung\n\nSahelo e.K.\nEinzelkaufmann\nHamburg\n\nDas Registergericht beabsichtigt, die im Handelsregister eingetragene Firma von Amts wegen nach § 31 Abs. 2 HBG zu löschen. Die Frist zur Erhebung eines Widerspruchs gegen die beabsichtigte Löschung wird auf 3 Monate festgesetzt."
    },
    {
      "date": "2026-02-19",
      "id": "145607",
      "original_text": "Löschungsankündigung\nMecklenburg-Vorpommern Amtsgericht Rostock HRB 9111\nBMR Spezialleistungen GmbH Rostock – Rostock",
      "type": "Löschungsankündigung",
      "state": "Mecklenburg-Vorpommern",
      "amtsgericht": "Amtsgericht Rostock",
      "registernummer": "HRB 9111",
      "registerart": "HRB",
      "company_name": "BMR Spezialleistungen GmbH Rostock",
      "company_seat": "Rostock",
      "details": "19.02.2026 (Bekanntmachungsdatum)\n\nMecklenburg-Vorpommern Amtsgericht Rostock HRB 9111\nLöschungsankündigung\n\nBMR Spezialleistungen GmbH Rostock\nGesellschaft mit beschränkter Haftung\nRostock\n\nDas Registergericht beabsichtigt, die im Handelsregister eingetragene Gesellschaft von Amts wegen nach § 394 FamFG zu löschen. Die Frist zur Erhebung eines Widerspruchs gegen die beabsichtigte Löschung wird auf einen Monat festgesetzt."
    },
    {
      "date": "2026-02-19",
      "id": "145608",
      "original_text": "Löschungsankündigung\nHamburg Amtsgericht Hamburg HRB 158424\nWinWin Consultings GmbH – Hamburg",
      "type": "Löschungsankündigung",
      "state": "Hamburg",
      "amtsgericht": "Amtsgericht Hamburg",
      "registernummer": "HRB 158424",
      "registerart": "HRB",
      "company_name": "WinWin Consultings GmbH",
      "company_seat": "Hamburg",
      "details": "19.02.2026 (Bekanntmachungsdatum)\n\nHamburg Amtsgericht Hamburg HRB 158424\nLöschungsankündigung\n\nWinWin Consultings GmbH\nGesellschaft mit beschränkter Haftung\nHamburg\n\nDas Registergericht beabsichtigt, die im Handelsregister eingetragene Gesellschaft von Amts wegen nach § 394 FamFG zu löschen. Die Frist zur Erhebung eines Widerspruchs gegen die beabsichtigte Löschung wird auf 3 Monate festgesetzt."
    },
    {
      "date": "2026-02-19",
      "id": "145609",
      "original_text": "Registerbekanntmachung nach dem Umwandlungsgesetz\nBerlin Amtsgericht Berlin (Charlottenburg) HRA 65068\nChange Financials e.K. – Berlin",
      "type": "Registerbekanntmachung nach dem Umwandlungsgesetz",
      "state": "Berlin",
      "amtsgericht": "Amtsgericht Berlin (Charlottenburg)",
      "registernummer": "HRA 65068",
      "registerart": "HRA",
      "company_name": "Change Financials e.K.",
      "company_seat": "Berlin",
      "details": "19.02.2026 (Bekanntmachungsdatum)\n\nBerlin Amtsgericht Berlin (Charlottenburg) HRA 65068\nRegisterbekanntmachung nach dem Umwandlungsgesetz 18.02.2026 (Eintragungsdatum)\n\nChange Financials e.K.\nEinzelkaufmann / Einzelkauffrau\nBerlin\n\nZu Eintragungsnummer 2 vom 18.02.2026 wird als nicht eingetragen veröffentlicht: Den Gläubigern der an der Spaltung beteiligten Rechtsträger ist, wenn sie binnen sechs Monaten nach dem Tag, an dem die Eintragung der Spaltung in das Register des Sitzes desjenigen Rechtsträgers, dessen Gläubiger sie sind, als bekannt gemacht gilt, ihren Anspruch nach Grund und Höhe schriftlich anmelden, Sicherheit zu leisten, soweit sie nicht Befriedigung verlangen können. Dieses Recht steht den Gläubigern jedoch nur zu, wenn sie glaubhaft machen, dass durch die Spaltung die Erfüllung ihrer Forderung gefährdet wird. Das Recht, Sicherheitsleistung zu verlangen, steht Gläubigern nicht zu, die im Falle der Insolvenz ein Recht auf vorzugsweise Befriedigung aus einer Deckungsmasse haben, die nach gesetzlicher Vorschrift zu ihrem Schutz errichtet und staatlich überwacht ist."
    },
    {
      "date": "2026-02-19",
      "id": "145610",
      "original_text": "Löschungsankündigung\nNordrhein-Westfalen Amtsgericht Coesfeld HRB 12858\nSanum VITALIS Beteiligungs GmbH – Reken",
      "type": "Löschungsankündigung",
      "state": "Nordrhein-Westfalen",
      "amtsgericht": "Amtsgericht Coesfeld",
      "registernummer": "HRB 12858",
      "registerart": "HRB",
      "company_name": "Sanum VITALIS Beteiligungs GmbH",
      "company_seat": "Reken",
      "details": "19.02.2026 (Bekanntmachungsdatum)\n\nNordrhein-Westfalen Amtsgericht Coesfeld HRB 12858\nLöschungsankündigung\n\nSanum VITALIS Beteiligungs GmbH\nGesellschaft mit beschränkter Haftung\nReken\n\nDas Registergericht beabsichtigt, den Rechtsträger wegen Vermögenslosigkeit gemäß § 394 FamFG von Amts wegen zu löschen.\n\nGegen diese Verfügung kann Widerspruch eingelegt werden. Die Frist zur Erhebung eines Widerspruchs gegen die beabsichtigte Löschung ist auf zwei Monate ab Veröffentlichung festgesetzt."
    },
    {
      "date": "2026-02-19",
      "id": "145611",
      "original_text": "Löschungsankündigung\nMecklenburg-Vorpommern Amtsgericht Rostock HRB 14905\nvyble AG – Rostock",
      "type": "Löschungsankündigung",
      "state": "Mecklenburg-Vorpommern",
      "amtsgericht": "Amtsgericht Rostock",
      "registernummer": "HRB 14905",
      "registerart": "HRB",
      "company_name": "vyble AG",
      "company_seat": "Rostock",
      "details": "19.02.2026 (Bekanntmachungsdatum)\n\nMecklenburg-Vorpommern Amtsgericht Rostock HRB 14905\nLöschungsankündigung\n\nvyble AG\nAktiengesellschaft\nRostock\n\nDas Registergericht beabsichtigt, die im Handelsregister eingetragene Gesellschaft von Amts wegen nach § 394 FamFG zu löschen. Die Frist zur Erhebung eines Widerspruchs gegen die beabsichtigte Löschung wird auf einen Monat festgesetzt."
    },
    {
      "date": "2026-02-19",
      "id": "145612",
      "original_text": "Registerbekanntmachung nach dem Umwandlungsgesetz\nBerlin Amtsgericht Berlin (Charlottenburg) HRB 281713\nWE25 GmbH – Berlin",
      "type": "Registerbekanntmachung nach dem Umwandlungsgesetz",
      "state": "Berlin",
      "amtsgericht": "Amtsgericht Berlin (Charlottenburg)",
      "registernummer": "HRB 281713",
      "registerart": "HRB",
      "company_name": "WE25 GmbH",
      "company_seat": "Berlin",
      "details": "19.02.2026 (Bekanntmachungsdatum)\n\nBerlin Amtsgericht Berlin (Charlottenburg) HRB 281713\nRegisterbekanntmachung nach dem Umwandlungsgesetz 18.02.2026 (Eintragungsdatum)\n\nWE25 GmbH\nGesellschaft mit beschränkter Haftung\nBerlin\n\nZu Eintragungsnummer 3 vom 18.02.2026 wird als nicht eingetragen veröffentlicht: Den Gläubigern der an der Spaltung beteiligten Rechtsträger ist, wenn sie binnen sechs Monaten nach dem Tag, an dem die Eintragung der Spaltung in das Register des Sitzes desjenigen Rechtsträgers, dessen Gläubiger sie sind, als bekannt gemacht gilt, ihren Anspruch nach Grund und Höhe schriftlich anmelden, Sicherheit zu leisten, soweit sie nicht Befriedigung verlangen können. Dieses Recht steht den Gläubigern jedoch nur zu, wenn sie glaubhaft machen, dass durch die Spaltung die Erfüllung ihrer Forderung gefährdet wird. Das Recht, Sicherheitsleistung zu verlangen, steht Gläubigern nicht zu, die im Falle der Insolvenz ein Recht auf vorzugsweise Befriedigung aus einer Deckungsmasse haben, die nach gesetzlicher Vorschrift zu ihrem Schutz errichtet und staatlich überwacht ist."
    },
    {
      "date": "2026-02-19",
      "id": "145613",
      "original_text": "Sonstige Registerbekanntmachung\nBaden-Württemberg Amtsgericht Ulm HRB 725751\nGeberit Logistik GmbH – Pfullendorf",
      "type": "Sonstige Registerbekanntmachung",
      "state": "Baden-Württemberg",
      "amtsgericht": "Amtsgericht Ulm",
      "registernummer": "HRB 725751",
      "registerart": "HRB",
      "company_name": "Geberit Logistik GmbH",
      "company_seat": "Pfullendorf",
      "details": "19.02.2026 (Bekanntmachungsdatum)\n\nBaden-Württemberg Amtsgericht Ulm HRB 725751\nSonstige Registerbekanntmachung 19.02.2026 (Eintragungsdatum)\n\nGeberit Logistik GmbH\nGesellschaft mit beschränkter Haftung\nPfullendorf\n\nDen Gläubigern der Gesellschaft, deren Forderungen begründet worden sind, bevor die Eintragung der Beendigung des Vertrages in das Handelsregister nach § 10 HGB als bekanntgemacht gilt, ist vom anderen Vertragsteil Sicherheit zu leisten, wenn sie sich binnen sechs Monaten nach der Bekanntmachung zu diesem Zweck bei ihm melden."
    },
    {
      "date": "2026-02-19",
      "id": "145614",
      "original_text": "Einreichung neuer Dokumente\nBaden-Württemberg Amtsgericht Ulm HRB 721361\nGroupe SEB WMF Retail GmbH – Geislingen an der Steige",
      "type": "Einreichung neuer Dokumente",
      "state": "Baden-Württemberg",
      "amtsgericht": "Amtsgericht Ulm",
      "registernummer": "HRB 721361",
      "registerart": "HRB",
      "company_name": "Groupe SEB WMF Retail GmbH",
      "company_seat": "Geislingen an der Steige",
      "details": "19.02.2026 (Bekanntmachungsdatum)\n\nBaden-Württemberg Amtsgericht Ulm HRB 721361\nEinreichung neuer Dokumente 19.02.2026 (Eintragungsdatum)\n\nGroupe SEB WMF Retail GmbH\nGesellschaft mit beschränkter Haftung\nGeislingen an der Steige\n\nDie Gesellschaft hat am 19.02.2026 die Liste über die Zusammensetzung des Aufsichtsrats zum Handelsregister eingereicht."
    },
    {
      "date": "2026-02-19",
      "id": "145615",
      "original_text": "Einreichung neuer Dokumente\nBaden-Württemberg Amtsgericht Stuttgart HRB 751119\nMercedes-Benz Versicherung AG – Stuttgart",
      "type": "Einreichung neuer Dokumente",
      "state": "Baden-Württemberg",
      "amtsgericht": "Amtsgericht Stuttgart",
      "registernummer": "HRB 751119",
      "registerart": "HRB",
      "company_name": "Mercedes-Benz Versicherung AG",
      "company_seat": "Stuttgart",
      "details": "19.02.2026 (Bekanntmachungsdatum)\n\nBaden-Württemberg Amtsgericht Stuttgart HRB 751119\nEinreichung neuer Dokumente\n\nMercedes-Benz Versicherung AG\nAktiengesellschaft\nStuttgart\n\nDie Gesellschaft hat am 11.02.2026 die Liste über die Zusammensetzung des Aufsichtsrats zum Handelsregister eingereicht."
    },
    {
      "date": "2026-02-19",
      "id": "145616",
      "original_text": "Löschungsankündigung\nSaarland Amtsgericht Saarbrücken HRB 105316\nPERFORMANCE-Bau GmbH – Dillingen/Saar",
      "type": "Löschungsankündigung",
      "state": "Saarland",
      "amtsgericht": "Amtsgericht Saarbrücken",
      "registernummer": "HRB 105316",
      "registerart": "HRB",
      "company_name": "PERFORMANCE-Bau GmbH",
      "company_seat": "Dillingen/Saar",
      "details": "19.02.2026 (Bekanntmachungsdatum)\n\nSaarland Amtsgericht Saarbrücken HRB 105316\nLöschungsankündigung 19.02.2026 (Eintragungsdatum)\n\nPERFORMANCE-Bau GmbH\nGesellschaft mit beschränkter Haftung\nDillingen/Saar\n\nEs ist beabsichtigt, die Gesellschaft von Amts wegen gemäß § 394 FamFG wegen Vermögenslosigkeit zu löschen. Gegen die Löschung von Amts wegen ist das Rechtsmittel des Widerspruchs statthaft. Der Widerspruch ist binnen einer Frist von zwei Monaten beginnend mit dem Tag dieser Veröffentlichung durch Einreichen eines Widerspruchsschreibens -schriftlich oder zur Niederschrift der Geschäftsstelle- beim Amtsgericht Saarbrücken, -zentrales Handelsregister-, Mainzerstr.178, 66121 Saarbrücken einzulegen. Der Widerspruch muss die Bezeichnung der angefochtenen Löschungsankündigung enthalten sowie die Erklärung, dass Widerspruch eingelegt wird. Er ist vom Widerspruchsführer oder seinem Bevollmächtigten zu unterzeichnen."
    },
    {
      "date": "2026-02-19",
      "id": "145617",
      "original_text": "Löschungsankündigung\nBaden-Württemberg Amtsgericht Freiburg HRB 709911\ni-punkt Sprachdienstleistungen UG (haftungsbeschränkt) – Freiburg im Breisgau",
      "type": "Löschungsankündigung",
      "state": "Baden-Württemberg",
      "amtsgericht": "Amtsgericht Freiburg",
      "registernummer": "HRB 709911",
      "registerart": "HRB",
      "company_name": "i-punkt Sprachdienstleistungen UG (haftungsbeschränkt)",
      "company_seat": "Freiburg im Breisgau",
      "details": "19.02.2026 (Bekanntmachungsdatum)\n\nBaden-Württemberg Amtsgericht Freiburg HRB 709911\nLöschungsankündigung\n\ni-punkt Sprachdienstleistungen UG (haftungsbeschränkt)\nGesellschaft mit beschränkter Haftung\nFreiburg im Breisgau\n\nAls nicht eingetragen wird bekanntgemacht:\nDas Gericht beabsichtigt, die Gesellschaft wegen Vermögenslosigkeit im Handelsregister von Amts wegen nach § 394 FamFG zu löschen. Die Frist zur Geltendmachung eines Widerspruchs gegen die beabsichtigte Löschung ist auf einen Monat ab Veröffentlichung bestimmt."
    },
    {
      "date": "2026-02-19",
      "id": "145618",
      "original_text": "Löschungsankündigung\nSchleswig-Holstein Amtsgericht Lübeck HRB 24617\nRUNDUMBAU UG (haftungsbeschränkt) – Glinde",
      "type": "Löschungsankündigung",
      "state": "Schleswig-Holstein",
      "amtsgericht": "Amtsgericht Lübeck",
      "registernummer": "HRB 24617",
      "registerart": "HRB",
      "company_name": "RUNDUMBAU UG (haftungsbeschränkt)",
      "company_seat": "Glinde",
      "details": "19.02.2026 (Bekanntmachungsdatum)\n\nSchleswig-Holstein Amtsgericht Lübeck HRB 24617\nLöschungsankündigung\n\nRUNDUMBAU UG (haftungsbeschränkt)\nGesellschaft mit beschränkter Haftung\nGlinde\n\nAn Frau Amanda Petrauskaite\n- per Veröffentlichung -\n\nSehr geehrte Frau Petrauskaite,\n\nin der Handelsregistersache der\nRUNDUMBAU UG (haftungsbeschränkt)\n\nergeben sich aus den hier vorliegenden Unterlagen Anhaltspunkte dafür, dass die Gesellschaft, als deren Geschäftsführer Sie noch eingetragen sind, vermögenslos ist.\n\nDas Finanzamt Stormarn hat mit Schreiben vom 05.02.2026 die Löschung der Gesellschaft von Amts wegen beantragt.\n\nEs ist beabsichtigt, die Gesellschaft wegen Vermögenslosigkeit gemäß § 394 FamFG zu löschen.\n\nHiermit wird eine Frist von    3 Monaten     zur Geltendmachung eines Widerspruchs gegen die Löschung bestimmt, § 394 Abs. 2 S. 1 FamFG.\n\nNach Fristablauf ohne Widerspruch von Ihnen oder anderer Seite wird die Gesellschaft gelöscht.\n\nMit freundlichen Grüßen\n\nSchuppenhauer\nDipl.-Rechtspflegerin (FH)"
    },
    {
      "date": "2026-02-19",
      "id": "145619",
      "original_text": "Registerbekanntmachung nach dem Umwandlungsgesetz\nBaden-Württemberg Amtsgericht Mannheim GsR 365\nMVZ Labor Dr. Limbach & Kollegen eGbR – Heidelberg",
      "type": "Registerbekanntmachung nach dem Umwandlungsgesetz",
      "state": "Baden-Württemberg",
      "amtsgericht": "Amtsgericht Mannheim",
      "registernummer": "GsR 365",
      "registerart": "GsR",
      "company_name": "MVZ Labor Dr. Limbach & Kollegen eGbR",
      "company_seat": "Heidelberg",
      "details": "19.02.2026 (Bekanntmachungsdatum)\n\nBaden-Württemberg Amtsgericht Mannheim GsR 365\nRegisterbekanntmachung nach dem Umwandlungsgesetz 19.02.2026 (Eintragungsdatum)\n\nMVZ Labor Dr. Limbach & Kollegen eGbR\nGesellschaft bürgerlichen Rechts\nHeidelberg\n\nDen Gläubigern der an der Verschmelzung beteiligten Rechtsträger ist, wenn sie binnen sechs Monaten nach dem Tag, an dem die Eintragung der Verschmelzung in das Register des Sitzes desjenigen Rechtsträgers, dessen Gläubiger sie sind, nach § 19 Abs. 3 UmwG als bekanntgemacht gilt, ihren Anspruch nach Grund und Höhe schriftlich anmelden, Sicherheit zu leisten, soweit sie nicht Befriedigung verlangen können. Dieses Recht steht den Gläubigern jedoch nur zu, wenn sie glaubhaft machen, dass durch die Verschmelzung die Erfüllung ihrer Forderung gefährdet wird."
    },
    {
      "date": "2026-02-19",
      "id": "145620",
      "original_text": "Registerbekanntmachung nach dem Umwandlungsgesetz\nBaden-Württemberg Amtsgericht Ulm HRB 749403\nSCM Europe AG – Niederstetten",
      "type": "Registerbekanntmachung nach dem Umwandlungsgesetz",
      "state": "Baden-Württemberg",
      "amtsgericht": "Amtsgericht Ulm",
      "registernummer": "HRB 749403",
      "registerart": "HRB",
      "company_name": "SCM Europe AG",
      "company_seat": "Niederstetten",
      "details": "19.02.2026 (Bekanntmachungsdatum)\n\nBaden-Württemberg Amtsgericht Ulm HRB 749403\nRegisterbekanntmachung nach dem Umwandlungsgesetz 19.02.2026 (Eintragungsdatum)\n\nSCM Europe AG\nAktiengesellschaft\nNiederstetten\n\nAls nicht eingetragen wird bekanntgemacht:\nDen Gläubigern des an dem Formwechsel beteiligten Rechtsträgers ist, wenn sie binnen sechs Monaten nach dem Tag, an dem die Eintragung des Formwechsels in das Register des Sitzes desjenigen Rechtsträgers, dessen Gläubiger sie sind, nach § 19 Abs. 3 UmwG als bekanntgemacht gilt, ihren Anspruch nach Grund und Höhe schriftlich anmelden, Sicherheit zu leisten, soweit sie nicht Befriedigung verlangen können. Dieses Recht steht den Gläubigern jedoch nur zu, wenn sie glaubhaft machen, dass durch den Formwechsel die Erfüllung ihrer Forderung gefährdet wird."
    },
    {
      "date": "2026-02-19",
      "id": "145621",
      "original_text": "Registerbekanntmachung nach dem Umwandlungsgesetz\nSchleswig-Holstein Amtsgericht Lübeck HRB 20302\nCJ Espellohweg 8 GmbH – Oststeinbek",
      "type": "Registerbekanntmachung nach dem Umwandlungsgesetz",
      "state": "Schleswig-Holstein",
      "amtsgericht": "Amtsgericht Lübeck",
      "registernummer": "HRB 20302",
      "registerart": "HRB",
      "company_name": "CJ Espellohweg 8 GmbH",
      "company_seat": "Oststeinbek",
      "details": "19.02.2026 (Bekanntmachungsdatum)\n\nSchleswig-Holstein Amtsgericht Lübeck HRB 20302\nRegisterbekanntmachung nach dem Umwandlungsgesetz 17.02.2026 (Eintragungsdatum)\n\nCJ Espellohweg 8 GmbH\nGesellschaft mit beschränkter Haftung\nOststeinbek\n\nAls nicht eingetragen wird veröffentlicht: Den Gläubigern ist, wenn sie binnen sechs Monaten nach dem Tag, an dem die Eintragung der Umwandlung als bekannt gemacht gilt, ihren Anspruch nach Grund und Höhe schriftlich anmelden, Sicherheit zu leisten, soweit sie nicht Befriedigung verlangen können. Dieses Recht steht den Gläubigern jedoch nur zu, wenn sie glaubhaft machen, dass durch die Umwandlung die Erfüllung ihrer Forderung gefährdet wird.Zu Eintragungsnummer 2 vom 17.02.2026 wird als nicht eingetragen veröffentlicht:"
    },
    {
      "date": "2026-02-19",
      "id": "145622",
      "original_text": "Löschungsankündigung\nSaarland Amtsgericht Saarbrücken HRB 107514\nSaDi UG (haftungsbeschränkt) – Saarbrücken",
      "type": "Löschungsankündigung",
      "state": "Saarland",
      "amtsgericht": "Amtsgericht Saarbrücken",
      "registernummer": "HRB 107514",
      "registerart": "HRB",
      "company_name": "SaDi UG (haftungsbeschränkt)",
      "company_seat": "Saarbrücken",
      "details": "19.02.2026 (Bekanntmachungsdatum)\n\nSaarland Amtsgericht Saarbrücken HRB 107514\nLöschungsankündigung 19.02.2026 (Eintragungsdatum)\n\nSaDi UG (haftungsbeschränkt)\nGesellschaft mit beschränkter Haftung\nSaarbrücken\n\nEs ist beabsichtigt, die Gesellschaft von Amts wegen gemäß § 394 FamFG wegen Vermögenslosigkeit zu löschen. Gegen die Löschung von Amts wegen ist das Rechtsmittel des Widerspruchs statthaft. Der Widerspruch ist binnen einer Frist von zwei Monaten beginnend mit dem Tag dieser Veröffentlichung durch Einreichen eines Widerspruchsschreibens -schriftlich oder zur Niederschrift der Geschäftsstelle- beim Amtsgericht Saarbrücken, -zentrales Handelsregister-, Mainzerstr.178, 66121 Saarbrücken einzulegen. Der Widerspruch muss die Bezeichnung der angefochtenen Löschungsankündigung enthalten sowie die Erklärung, dass Widerspruch eingelegt wird. Er ist vom Widerspruchsführer oder seinem Bevollmächtigten zu unterzeichnen."
    },
    {
      "date": "2026-02-19",
      "id": "145623",
      "original_text": "Löschungsankündigung\nMecklenburg-Vorpommern Amtsgericht Rostock HRB 11566\nR.W. Mecklenburger Personalservice GmbH – Rostock",
      "type": "Löschungsankündigung",
      "state": "Mecklenburg-Vorpommern",
      "amtsgericht": "Amtsgericht Rostock",
      "registernummer": "HRB 11566",
      "registerart": "HRB",
      "company_name": "R.W. Mecklenburger Personalservice GmbH",
      "company_seat": "Rostock",
      "details": "19.02.2026 (Bekanntmachungsdatum)\n\nMecklenburg-Vorpommern Amtsgericht Rostock HRB 11566\nLöschungsankündigung\n\nR.W. Mecklenburger Personalservice GmbH\nGesellschaft mit beschränkter Haftung\nRostock\n\nDas Registergericht beabsichtigt, die im Handelsregister eingetragene Gesellschaft von Amts wegen nach § 394 FamFG zu löschen. Die Frist zur Erhebung eines Widerspruchs gegen die beabsichtigte Löschung wird auf einen Monat festgesetzt."
    },
    {
      "date": "2026-02-19",
      "id": "145624",
      "original_text": "Registerbekanntmachung nach dem Umwandlungsgesetz\nBaden-Württemberg Amtsgericht Ulm HRB 751446\nSCM Europe GmbH – Niederstetten",
      "type": "Registerbekanntmachung nach dem Umwandlungsgesetz",
      "state": "Baden-Württemberg",
      "amtsgericht": "Amtsgericht Ulm",
      "registernummer": "HRB 751446",
      "registerart": "HRB",
      "company_name": "SCM Europe GmbH",
      "company_seat": "Niederstetten",
      "details": "19.02.2026 (Bekanntmachungsdatum)\n\nBaden-Württemberg Amtsgericht Ulm HRB 751446\nRegisterbekanntmachung nach dem Umwandlungsgesetz 19.02.2026 (Eintragungsdatum)\n\nSCM Europe GmbH\nGesellschaft mit beschränkter Haftung\nNiederstetten\n\nAls nicht eingetragen wird bekanntgemacht:\nDen Gläubigern des an dem Formwechsel beteiligten Rechtsträgers ist, wenn sie binnen sechs Monaten nach dem Tag, an dem die Eintragung des Formwechsels in das Register des Sitzes desjenigen Rechtsträgers, dessen Gläubiger sie sind, nach § 19 Abs. 3 UmwG als bekanntgemacht gilt, ihren Anspruch nach Grund und Höhe schriftlich anmelden, Sicherheit zu leisten, soweit sie nicht Befriedigung verlangen können. Dieses Recht steht den Gläubigern jedoch nur zu, wenn sie glaubhaft machen, dass durch den Formwechsel die Erfüllung ihrer Forderung gefährdet wird."
    },
    {
      "date": "2026-02-19",
      "id": "145625",
      "original_text": "Einreichung neuer Dokumente\nBerlin Amtsgericht Berlin (Charlottenburg) HRB 112411\nNOW GmbH - Nationale Organisation für den Wandel in der Mobilität – Berlin",
      "type": "Einreichung neuer Dokumente",
      "state": "Berlin",
      "amtsgericht": "Amtsgericht Berlin (Charlottenburg)",
      "registernummer": "HRB 112411",
      "registerart": "HRB",
      "company_name": "NOW GmbH - Nationale Organisation für den Wandel in der Mobilität",
      "company_seat": "Berlin",
      "details": "19.02.2026 (Bekanntmachungsdatum)\n\nBerlin Amtsgericht Berlin (Charlottenburg) HRB 112411\nEinreichung neuer Dokumente\n\nNOW GmbH - Nationale Organisation für den Wandel in der Mobilität\nGesellschaft mit beschränkter Haftung\nBerlin\n\nAls nicht eingetragen wird veröffentlicht: Es wurde eine neue Liste der Aufsichtsratsmitglieder eingereicht (§ 52 GmbHG)."
    },
    {
      "date": "2026-02-19",
      "id": "145626",
      "original_text": "Einreichung neuer Dokumente\nBaden-Württemberg Amtsgericht Stuttgart HRB 24899\nDienste für Menschen gGmbH – Esslingen am Neckar",
      "type": "Einreichung neuer Dokumente",
      "state": "Baden-Württemberg",
      "amtsgericht": "Amtsgericht Stuttgart",
      "registernummer": "HRB 24899",
      "registerart": "HRB",
      "company_name": "Dienste für Menschen gGmbH",
      "company_seat": "Esslingen am Neckar",
      "details": "19.02.2026 (Bekanntmachungsdatum)\n\nBaden-Württemberg Amtsgericht Stuttgart HRB 24899\nEinreichung neuer Dokumente\n\nDienste für Menschen gGmbH\nGesellschaft mit beschränkter Haftung\nEsslingen am Neckar\n\nDie Gesellschaft hat am 18.02.2026 die Liste über die Zusammensetzung des Aufsichtsrats zum Handelsregister eingereicht."
    },
    {
      "date": "2026-02-19",
      "id": "145627",
      "original_text": "Einreichung neuer Dokumente\nBerlin Amtsgericht Berlin (Charlottenburg) HRB 158413\nprovitro AG – Berlin",
      "type": "Einreichung neuer Dokumente",
      "state": "Berlin",
      "amtsgericht": "Amtsgericht Berlin (Charlottenburg)",
      "registernummer": "HRB 158413",
      "registerart": "HRB",
      "company_name": "provitro AG",
      "company_seat": "Berlin",
      "details": "19.02.2026 (Bekanntmachungsdatum)\n\nBerlin Amtsgericht Berlin (Charlottenburg) HRB 158413\nEinreichung neuer Dokumente\n\nprovitro AG\nAktiengesellschaft\nBerlin\n\nAls nicht eingetragen wird veröffentlicht: Es wurde eine neue Liste der Aufsichtsratsmitglieder eingereicht (§ 106 AktG)."
    },
    {
      "date": "2026-02-19",
      "id": "145628",
      "original_text": "Sonstige Registerbekanntmachung\nHamburg Amtsgericht Hamburg HRB 40057\nBINNENALSTER - Beteiligungsgesellschaft mbH – Hamburg",
      "type": "Sonstige Registerbekanntmachung",
      "state": "Hamburg",
      "amtsgericht": "Amtsgericht Hamburg",
      "registernummer": "HRB 40057",
      "registerart": "HRB",
      "company_name": "BINNENALSTER - Beteiligungsgesellschaft mbH",
      "company_seat": "Hamburg",
      "details": "19.02.2026 (Bekanntmachungsdatum)\n\nHamburg Amtsgericht Hamburg HRB 40057\nSonstige Registerbekanntmachung 19.02.2026 (Eintragungsdatum)\n\nBINNENALSTER - Beteiligungsgesellschaft mbH\nGesellschaft mit beschränkter Haftung\nHamburg\n\nAls nicht eingetragen wird bekannt gemacht:  Den Gläubigern der Gesellschaft, deren Forderungen begründet worden sind, bevor die Eintragung der Vertragsbeendigung in das Handelsregister nach § 10 HGB als bekannt gemacht gilt, ist vom anderen Vertragsteil Sicherheit zu leisten, wenn sie sich binnen 6 Monaten nach Bekanntmachung der Eintragung zu diesem Zweck bei ihm melden."
    },
    {
      "date": "2026-02-19",
      "id": "145629",
      "original_text": "Registerbekanntmachung nach dem Umwandlungsgesetz\nHamburg Amtsgericht Hamburg HRB 76565\nEdel Music & Entertainment GmbH – Hamburg",
      "type": "Registerbekanntmachung nach dem Umwandlungsgesetz",
      "state": "Hamburg",
      "amtsgericht": "Amtsgericht Hamburg",
      "registernummer": "HRB 76565",
      "registerart": "HRB",
      "company_name": "Edel Music & Entertainment GmbH",
      "company_seat": "Hamburg",
      "details": "19.02.2026 (Bekanntmachungsdatum)\n\nHamburg Amtsgericht Hamburg HRB 76565\nRegisterbekanntmachung nach dem Umwandlungsgesetz 19.02.2026 (Eintragungsdatum)\n\nEdel Music & Entertainment GmbH\nGesellschaft mit beschränkter Haftung\nHamburg\n\nAls nicht eingetragen wird bekannt gemacht:\nDen Gläubigern der an der Verschmelzung beteiligten Gesellschaften ist, wenn sie binnen sechs Monaten nach dem Tag, an dem die Eintragung der Verschmelzung in das Register des Sitzes desjenigen Rechtsträgers, dessen Gläubiger sie sind, nach § 19 Absatz 3 UmwG als bekannt gemacht gilt, ihren Anspruch nach Grund und Höhe schriftlich anmelden, Sicherheit zu leisten, soweit sie nicht Befriedigung verlangen können. Dieses Recht steht den Gläubigern jedoch nur zu, wenn sie glaubhaft machen, dass durch die Verschmelzung die Erfüllung ihrer Forderung gefährdet wird."
    },
    {
      "date": "2026-02-19",
      "id": "145630",
      "original_text": "Registerbekanntmachung nach dem Umwandlungsgesetz\nHamburg Amtsgericht Hamburg HRB 39210\nJUMBO Neue Medien und Verlag GmbH – Hamburg",
      "type": "Registerbekanntmachung nach dem Umwandlungsgesetz",
      "state": "Hamburg",
      "amtsgericht": "Amtsgericht Hamburg",
      "registernummer": "HRB 39210",
      "registerart": "HRB",
      "company_name": "JUMBO Neue Medien und Verlag GmbH",
      "company_seat": "Hamburg",
      "details": "19.02.2026 (Bekanntmachungsdatum)\n\nHamburg Amtsgericht Hamburg HRB 39210\nRegisterbekanntmachung nach dem Umwandlungsgesetz 19.02.2026 (Eintragungsdatum)\n\nJUMBO Neue Medien und Verlag GmbH\nGesellschaft mit beschränkter Haftung\nHamburg\n\nAls nicht eingetragen wird bekannt gemacht:\nDen Gläubigern der an der Verschmelzung beteiligten Gesellschaften ist, wenn sie binnen sechs Monaten nach dem Tag, an dem die Eintragung der Verschmelzung in das Register des Sitzes desjenigen Rechtsträgers, dessen Gläubiger sie sind, nach § 19 Absatz 3 UmwG als bekannt gemacht gilt, ihren Anspruch nach Grund und Höhe schriftlich anmelden, Sicherheit zu leisten, soweit sie nicht Befriedigung verlangen können. Dieses Recht steht den Gläubigern jedoch nur zu, wenn sie glaubhaft machen, dass durch die Verschmelzung die Erfüllung ihrer Forderung gefährdet wird."
    },
    {
      "date": "2026-02-19",
      "id": "145631",
      "original_text": "Registerbekanntmachung nach dem Umwandlungsgesetz\nSachsen Amtsgericht Dresden HRB 6478\nVerlag Dresdner Nachrichten Verwaltungs-GmbH – Dresden",
      "type": "Registerbekanntmachung nach dem Umwandlungsgesetz",
      "state": "Sachsen",
      "amtsgericht": "Amtsgericht Dresden",
      "registernummer": "HRB 6478",
      "registerart": "HRB",
      "company_name": "Verlag Dresdner Nachrichten Verwaltungs-GmbH",
      "company_seat": "Dresden",
      "details": "19.02.2026 (Bekanntmachungsdatum)\n\nSachsen Amtsgericht Dresden HRB 6478\nRegisterbekanntmachung nach dem Umwandlungsgesetz 19.02.2026 (Eintragungsdatum)\n\nVerlag Dresdner Nachrichten Verwaltungs-GmbH\nGesellschaft mit beschränkter Haftung\nDresden\n\nDen Gläubigern der an der Verschmelzung beteiligten Rechtsträger ist, wenn sie binnen sechs Monaten nach dem Tag, an dem die Eintragung der Verschmelzung in das Register des Sitzes desjenigen Rechtsträgers, dessen Gläubiger sie sind, nach § 19 Abs. 3 UmwG als bekannt gemacht gilt, ihren Anspruch nach Grund und Höhe in Textform anmelden, Sicherheit zu leisten, soweit sie nicht Befriedigung verlangen können. Dieses Recht steht den Gläubigern jedoch nur zu, wenn sie glaubhaft machen, dass durch die Verschmelzung die Erfüllung der Forderung gefährdet wird."
    },
    {
      "date": "2026-02-19",
      "id": "145632",
      "original_text": "Löschungsankündigung\nSachsen Amtsgericht Leipzig VR 4786\nKampfsportclub 09 e.V. – Leipzig",
      "type": "Löschungsankündigung",
      "state": "Sachsen",
      "amtsgericht": "Amtsgericht Leipzig",
      "registernummer": "VR 4786",
      "registerart": "VR",
      "company_name": "Kampfsportclub 09 e.V.",
      "company_seat": "Leipzig",
      "details": "19.02.2026 (Bekanntmachungsdatum)\n\nSachsen Amtsgericht Leipzig VR 4786\nLöschungsankündigung\n\nKampfsportclub 09 e.V.\neingetragener Verein\nLeipzig\n\nDas Gericht beabsichtigt, gemäß § 4 Absatz 2 Ziffer 1 der Verordnung über das Vereinsregister das Registerblatt  des Vereins zu schließen, da nach Mitteilung eines bisherigen Vorstandsmitglieds sämtliche Mitglieder aus dem Verein ausgeschieden sind. Zur Geltendmachung eines Widerspruchs gegen die beabsichtigte Schließung wird eine Frist von einem Monat nach der Veröffentlichung bestimmt."
    },
    {
      "date": "2026-02-19",
      "id": "145633",
      "original_text": "Sonstige Registerbekanntmachung\nSachsen Amtsgericht Leipzig HRB 10001\nWohnungsgesellschaft der Stadt Delitzsch mbH – Delitzsch",
      "type": "Sonstige Registerbekanntmachung",
      "state": "Sachsen",
      "amtsgericht": "Amtsgericht Leipzig",
      "registernummer": "HRB 10001",
      "registerart": "HRB",
      "company_name": "Wohnungsgesellschaft der Stadt Delitzsch mbH",
      "company_seat": "Delitzsch",
      "details": "19.02.2026 (Bekanntmachungsdatum)\n\nSachsen Amtsgericht Leipzig HRB 10001\nSonstige Registerbekanntmachung\n\nWohnungsgesellschaft der Stadt Delitzsch mbH\nGesellschaft mit beschränkter Haftung\nDelitzsch\n\nAm 17.02.2026 wurde beim Handelsregister des Amtsgerichts Leipzig die Liste der Mitglieder des Aufsichtsrats gemäß § 52 GmbHG eingereicht."
    },
    {
      "date": "2026-02-19",
      "id": "145634",
      "original_text": "Löschungsankündigung\nNiedersachsen Amtsgericht Hildesheim HRB 207514\nWert-Investition Projekt 166 GmbH – Sarstedt",
      "type": "Löschungsankündigung",
      "state": "Niedersachsen",
      "amtsgericht": "Amtsgericht Hildesheim",
      "registernummer": "HRB 207514",
      "registerart": "HRB",
      "company_name": "Wert-Investition Projekt 166 GmbH",
      "company_seat": "Sarstedt",
      "details": "19.02.2026 (Bekanntmachungsdatum)\n\nNiedersachsen Amtsgericht Hildesheim HRB 207514\nLöschungsankündigung\n\nWert-Investition Projekt 166 GmbH\nGesellschaft mit beschränkter Haftung\nSarstedt\n\nDas Registergericht beabsichtigt, die Gesellschaft von Amts wegen nach § 394 FamFG zu löschen. Die Frist zur Erhebung eines Widerspruchs ist auf 1 Monat ab dieser Registerbekanntmachung festgesetzt."
    },
    {
      "date": "2026-02-19",
      "id": "145635",
      "original_text": "Löschungsankündigung\nNiedersachsen Amtsgericht Braunschweig HRB 206190\nCity Cab Braunschweig GmbH – Braunschweig",
      "type": "Löschungsankündigung",
      "state": "Niedersachsen",
      "amtsgericht": "Amtsgericht Braunschweig",
      "registernummer": "HRB 206190",
      "registerart": "HRB",
      "company_name": "City Cab Braunschweig GmbH",
      "company_seat": "Braunschweig",
      "details": "19.02.2026 (Bekanntmachungsdatum)\n\nNiedersachsen Amtsgericht Braunschweig HRB 206190\nLöschungsankündigung\n\nCity Cab Braunschweig GmbH\nGesellschaft mit beschränkter Haftung\nBraunschweig\n\nDas Registergericht beabsichtigt, die Gesellschaft von Amts wegen nach § 394 FamFG zu löschen. Die Frist zur Erhebung eines Widerspruchs ist auf 1 Monat ab dieser Registerbekanntmachung festgesetzt."
    },
    {
      "date": "2026-02-19",
      "id": "145636",
      "original_text": "Registerbekanntmachung nach dem Umwandlungsgesetz\nNiedersachsen Amtsgericht Tostedt HRB 207775\nhardt.company GmbH – Buxtehude",
      "type": "Registerbekanntmachung nach dem Umwandlungsgesetz",
      "state": "Niedersachsen",
      "amtsgericht": "Amtsgericht Tostedt",
      "registernummer": "HRB 207775",
      "registerart": "HRB",
      "company_name": "hardt.company GmbH",
      "company_seat": "Buxtehude",
      "details": "19.02.2026 (Bekanntmachungsdatum)\n\nNiedersachsen Amtsgericht Tostedt HRB 207775\nRegisterbekanntmachung nach dem Umwandlungsgesetz 19.02.2026 (Eintragungsdatum)\n\nhardt.company GmbH\nGesellschaft mit beschränkter Haftung\nBuxtehude\n\nDen Gläubigern der an der Verschmelzung beteiligten Rechtsträger ist, wenn sie binnen sechs Monaten nach dem Tag, an dem die Eintragung der Verschmelzung in das Register des Sitzes desjenigen Rechtsträgers, dessen Gläubiger sie sind, nach § 19  Abs.  3 UmwG als bekannt gemacht gilt, ihren Anspruch nach Grund und Höhe schriftlich anmelden, Sicherheit zu leisten, soweit sie nicht Befriedigung verlangen können. Dieses Recht steht den Gläubigern jedoch nur zu, wenn sie glaubhaft machen, dass durch die Verschmelzung die Erfüllung der Forderung gefährdet wird."
    },
    {
      "date": "2026-02-19",
      "id": "145637",
      "original_text": "Registerbekanntmachung nach dem Umwandlungsgesetz\nNiedersachsen Amtsgericht Tostedt HRB 208206\nhelfyi GmbH – Buxtehude",
      "type": "Registerbekanntmachung nach dem Umwandlungsgesetz",
      "state": "Niedersachsen",
      "amtsgericht": "Amtsgericht Tostedt",
      "registernummer": "HRB 208206",
      "registerart": "HRB",
      "company_name": "helfyi GmbH",
      "company_seat": "Buxtehude",
      "details": "19.02.2026 (Bekanntmachungsdatum)\n\nNiedersachsen Amtsgericht Tostedt HRB 208206\nRegisterbekanntmachung nach dem Umwandlungsgesetz 19.02.2026 (Eintragungsdatum)\n\nhelfyi GmbH\nGesellschaft mit beschränkter Haftung\nBuxtehude\n\nDen Gläubigern der an der Verschmelzung beteiligten Rechtsträger ist, wenn sie binnen sechs Monaten nach dem Tag, an dem die Eintragung der Verschmelzung in das Register des Sitzes desjenigen Rechtsträgers, dessen Gläubiger sie sind, nach § 19  Abs.  3 UmwG als bekannt gemacht gilt, ihren Anspruch nach Grund und Höhe schriftlich anmelden, Sicherheit zu leisten, soweit sie nicht Befriedigung verlangen können. Dieses Recht steht den Gläubigern jedoch nur zu, wenn sie glaubhaft machen, dass durch die Verschmelzung die Erfüllung der Forderung gefährdet wird."
    },
    {
      "date": "2026-02-19",
      "id": "145638",
      "original_text": "Löschungsankündigung\nNiedersachsen Amtsgericht Hildesheim HRB 207808\nceb UG (haftungsbeschränkt) – Sibbesse",
      "type": "Löschungsankündigung",
      "state": "Niedersachsen",
      "amtsgericht": "Amtsgericht Hildesheim",
      "registernummer": "HRB 207808",
      "registerart": "HRB",
      "company_name": "ceb UG (haftungsbeschränkt)",
      "company_seat": "Sibbesse",
      "details": "19.02.2026 (Bekanntmachungsdatum)\n\nNiedersachsen Amtsgericht Hildesheim HRB 207808\nLöschungsankündigung\n\nceb UG (haftungsbeschränkt)\nGesellschaft mit beschränkter Haftung\nSibbesse\n\nDas Registergericht beabsichtigt, die Gesellschaft von Amts wegen nach § 394 FamFG zu löschen. Die Frist zur Erhebung eines Widerspruchs ist auf 1 Monat ab dieser Registerbekanntmachung festgesetzt."
    },
    {
      "date": "2026-02-19",
      "id": "145639",
      "original_text": "Registerbekanntmachung nach dem Umwandlungsgesetz\nBaden-Württemberg Amtsgericht Stuttgart HRA 580480\nMEISTER Holding GmbH & Co. KG – Öhringen",
      "type": "Registerbekanntmachung nach dem Umwandlungsgesetz",
      "state": "Baden-Württemberg",
      "amtsgericht": "Amtsgericht Stuttgart",
      "registernummer": "HRA 580480",
      "registerart": "HRA",
      "company_name": "MEISTER Holding GmbH & Co. KG",
      "company_seat": "Öhringen",
      "details": "19.02.2026 (Bekanntmachungsdatum)\n\nBaden-Württemberg Amtsgericht Stuttgart HRA 580480\nRegisterbekanntmachung nach dem Umwandlungsgesetz 19.02.2026 (Eintragungsdatum)\n\nMEISTER Holding GmbH & Co. KG\nKommanditgesellschaft\nÖhringen\n\nAls nicht eingetragen wird bekanntgemacht:\nDen Gläubigern der an der Verschmelzung beteiligten Rechtsträger ist, wenn sie binnen sechs Monaten nach dem Tag, an dem die Eintragung der Verschmelzung in das Register des Sitzes desjenigen Rechtsträgers, dessen Gläubiger sie sind, nach § 19 Abs. 3 UmwG als bekanntgemacht gilt, ihren Anspruch nach Grund und Höhe schriftlich anmelden, Sicherheit zu leisten, soweit sie nicht Befriedigung verlangen können. Dieses Recht steht den Gläubigern jedoch nur zu, wenn sie glaubhaft machen, dass durch die Verschmelzung die Erfüllung ihrer Forderung gefährdet wird."
    },
    {
      "date": "2026-02-19",
      "id": "145640",
      "original_text": "Löschungsankündigung\nBremen Amtsgericht Bremen HRB 40533\nSMP Energieplanung GmbH – Bremen",
      "type": "Löschungsankündigung",
      "state": "Bremen",
      "amtsgericht": "Amtsgericht Bremen",
      "registernummer": "HRB 40533",
      "registerart": "HRB",
      "company_name": "SMP Energieplanung GmbH",
      "company_seat": "Bremen",
      "details": "19.02.2026 (Bekanntmachungsdatum)\n\nBremen Amtsgericht Bremen HRB 40533\nLöschungsankündigung\n\nSMP Energieplanung GmbH\nGesellschaft mit beschränkter Haftung\nBremen\n\nEs ist beabsichtigt die im Handelsregister eingetragene Gesellschaft von Amts wegen gemäß § 394 FamFG zu löschen. Gegen die Löschung kann beim AG Bremen schriftlich oder zu Protokoll der Geschäftsstelle Widerspruch eingelegt werden. Widerspruchsfrist 4 Wochen."
    },
    {
      "date": "2026-02-19",
      "id": "145641",
      "original_text": "Löschungsankündigung\nBremen Amtsgericht Bremen HRB 39634\nCOURAGE system GmbH – Bremen",
      "type": "Löschungsankündigung",
      "state": "Bremen",
      "amtsgericht": "Amtsgericht Bremen",
      "registernummer": "HRB 39634",
      "registerart": "HRB",
      "company_name": "COURAGE system GmbH",
      "company_seat": "Bremen",
      "details": "19.02.2026 (Bekanntmachungsdatum)\n\nBremen Amtsgericht Bremen HRB 39634\nLöschungsankündigung\n\nCOURAGE system GmbH\nGesellschaft mit beschränkter Haftung\nBremen\n\nEs ist beabsichtigt die im Handelsregister eingetragene Gesellschaft von Amts wegen gemäß § 394 FamFG zu löschen. Gegen die Löschung kann beim AG Bremen schriftlich oder zu Protokoll der Geschäftsstelle Widerspruch eingelegt werden. Widerspruchsfrist 4 Wochen."
    },
    {
      "date": "2026-02-19",
      "id": "145642",
      "original_text": "Registerbekanntmachung nach dem Umwandlungsgesetz\nBremen Amtsgericht Bremen VR 6454\nBremer Literaturhaus (virt) e.V. – Bremen",
      "type": "Registerbekanntmachung nach dem Umwandlungsgesetz",
      "state": "Bremen",
      "amtsgericht": "Amtsgericht Bremen",
      "registernummer": "VR 6454",
      "registerart": "VR",
      "company_name": "Bremer Literaturhaus (virt) e.V.",
      "company_seat": "Bremen",
      "details": "19.02.2026 (Bekanntmachungsdatum)\n\nBremen Amtsgericht Bremen VR 6454\nRegisterbekanntmachung nach dem Umwandlungsgesetz 17.02.2026 (Eintragungsdatum)\n\nBremer Literaturhaus (virt) e.V.\neingetragener Verein\nBremen\n\nAls nicht eingetragen wird veröffentlicht: Den Gläubigern der an der Verschmelzung beteiligten Rechtsträger ist, wenn sie binnen sechs Monaten nach dem Tag, an dem die Eintragung der Verschmelzung in das Register des Sitzes desjenigen Rechtsträgers, dessen Gläubiger sie sind, als bekannt gemacht gilt, ihren Anspruch nach Grund und Höhe schriftlich anmelden, Sicherheit zu leisten, soweit sie nicht Befriedigung verlangen können. Dieses Recht steht den Gläubigern jedoch nur zu, wenn sie glaubhaft machen, dass durch die Verschmelzung die Erfüllung ihrer Forderung gefährdet wird. Das Recht, Sicherheitsleistung zu verlangen, steht Gläubigern nicht zu, die im Falle der Insolvenz ein Recht auf vorzugsweise Befriedigung aus einer Deckungsmasse haben, die nach gesetzlicher Vorschrift zu ihrem Schutz errichtet und staatlich überwacht ist."
    },
    {
      "date": "2026-02-19",
      "id": "145643",
      "original_text": "Einreichung neuer Dokumente\nRheinland-Pfalz Amtsgericht Koblenz HRB 227\nKoblenzer Wohnungsbaugesellschaft mbH – Koblenz",
      "type": "Einreichung neuer Dokumente",
      "state": "Rheinland-Pfalz",
      "amtsgericht": "Amtsgericht Koblenz",
      "registernummer": "HRB 227",
      "registerart": "HRB",
      "company_name": "Koblenzer Wohnungsbaugesellschaft mbH",
      "company_seat": "Koblenz",
      "details": "19.02.2026 (Bekanntmachungsdatum)\n\nRheinland-Pfalz Amtsgericht Koblenz HRB 227\nEinreichung neuer Dokumente 19.02.2026 (Eintragungsdatum)\n\nKoblenzer Wohnungsbaugesellschaft mbH\nGesellschaft mit beschränkter Haftung\nKoblenz\n\nDem Registergericht ist eine neue Liste der Mitglieder des Aufsichtsrates eingereicht worden."
    },
    {
      "date": "2026-02-19",
      "id": "145644",
      "original_text": "Registerbekanntmachung nach dem Umwandlungsgesetz\nRheinland-Pfalz Amtsgericht Koblenz HRA 23418\nFarbdepot Andreas Weber e.K. Maler- und Lackiermeister – Hönningen",
      "type": "Registerbekanntmachung nach dem Umwandlungsgesetz",
      "state": "Rheinland-Pfalz",
      "amtsgericht": "Amtsgericht Koblenz",
      "registernummer": "HRA 23418",
      "registerart": "HRA",
      "company_name": "Farbdepot Andreas Weber e.K. Maler- und Lackiermeister",
      "company_seat": "Hönningen",
      "details": "19.02.2026 (Bekanntmachungsdatum)\n\nRheinland-Pfalz Amtsgericht Koblenz HRA 23418\nRegisterbekanntmachung nach dem Umwandlungsgesetz 19.02.2026 (Eintragungsdatum)\n\nFarbdepot Andreas Weber e.K. Maler- und Lackiermeister\nEinzelkaufmann / Einzelkauffrau\nHönningen\n\nAls nicht eingetragen wird veröffentlicht: Den Gläubigern der an der Ausgliederung beteiligten Rechtsträger ist, wenn sie binnen sechs Monaten nac hdem Tag, an dem die Eintragung der Ausgliederung in das Register des Sitzes desjenigen Rechtsträgers, dessen Gläubiger sie sind, nach § 19 Abs. 3 UmwG als bekannt gemacht gilt, ihren Anspruch nach Grund und Höhe schriftlich anmelden, Sicherheit zu leisten, soweit sie nicht Befriedigung verlangen können. Dieses Recht steht den Gläubigern jedoch nur zu, wenn sie glaubhaft machen, dass durch die Ausgliederung die Erfüllung der Forderung gefährdet wird."
    },
    {
      "date": "2026-02-19",
      "id": "145645",
      "original_text": "Registerbekanntmachung nach dem Umwandlungsgesetz\nRheinland-Pfalz Amtsgericht Koblenz HRB 31618\nFarbdepot Weber GmbH – Hönningen",
      "type": "Registerbekanntmachung nach dem Umwandlungsgesetz",
      "state": "Rheinland-Pfalz",
      "amtsgericht": "Amtsgericht Koblenz",
      "registernummer": "HRB 31618",
      "registerart": "HRB",
      "company_name": "Farbdepot Weber GmbH",
      "company_seat": "Hönningen",
      "details": "19.02.2026 (Bekanntmachungsdatum)\n\nRheinland-Pfalz Amtsgericht Koblenz HRB 31618\nRegisterbekanntmachung nach dem Umwandlungsgesetz 19.02.2026 (Eintragungsdatum)\n\nFarbdepot Weber GmbH\nGesellschaft mit beschränkter Haftung\nHönningen\n\nAls nicht eingetragen wird veröffentlicht: Den Gläubigern der an der Ausgliederung beteiligten Rechtsträger ist, wenn sie binnen sechs Monaten nac hdem Tag, an dem die Eintragung der Ausgliederung in das Register des Sitzes desjenigen Rechtsträgers, dessen Gläubiger sie sind, nach § 19 Abs. 3 UmwG als bekannt gemacht gilt, ihren Anspruch nach Grund und Höhe schriftlich anmelden, Sicherheit zu leisten, soweit sie nicht Befriedigung verlangen können. Dieses Recht steht den Gläubigern jedoch nur zu, wenn sie glaubhaft machen, dass durch die Ausgliederung die Erfüllung der Forderung gefährdet wird."
    },
    {
      "date": "2026-02-19",
      "id": "145646",
      "original_text": "Registerbekanntmachung nach dem Umwandlungsgesetz\nNordrhein-Westfalen Amtsgericht Köln HRB 73329\nCE Gastro GmbH – Frechen",
      "type": "Registerbekanntmachung nach dem Umwandlungsgesetz",
      "state": "Nordrhein-Westfalen",
      "amtsgericht": "Amtsgericht Köln",
      "registernummer": "HRB 73329",
      "registerart": "HRB",
      "company_name": "CE Gastro GmbH",
      "company_seat": "Frechen",
      "details": "19.02.2026 (Bekanntmachungsdatum)\n\nNordrhein-Westfalen Amtsgericht Köln HRB 73329\nRegisterbekanntmachung nach dem Umwandlungsgesetz 19.02.2026 (Eintragungsdatum)\n\nCE Gastro GmbH\nGesellschaft mit beschränkter Haftung\nFrechen\n\nDen Gläubigern der an der Verschmelzung beteiligten Rechtsträger ist, wenn sie binnen sechs Monaten nach dem Tag, an dem die Eintragung der Verschmelzung in das Register des Sitzes desjenigen Rechtsträgers, dessen Gläubiger sie sind, nach § 19 Absatz 3 UmwG als bekanntgemacht gilt, ihren Anspruch nach Grund und Höhe schriftlich anmelden, Sicherheit zu leisten, soweit sie nicht Befriedigung verlangen können. Dieses Recht steht den Gläubigern jedoch nur zu, wenn sie glaubhaft machen, dass durch die Verschmelzung die Erfüllung ihrer Forderung gefährdet wird."
    },
    {
      "date": "2026-02-19",
      "id": "145647",
      "original_text": "Löschungsankündigung\nNordrhein-Westfalen Amtsgericht Dortmund HRA 19350\n18 Karat Tobacco e. K. – Dortmund",
      "type": "Löschungsankündigung",
      "state": "Nordrhein-Westfalen",
      "amtsgericht": "Amtsgericht Dortmund",
      "registernummer": "HRA 19350",
      "registerart": "HRA",
      "company_name": "18 Karat Tobacco e. K.",
      "company_seat": "Dortmund",
      "details": "19.02.2026 (Bekanntmachungsdatum)\n\nNordrhein-Westfalen Amtsgericht Dortmund HRA 19350\nLöschungsankündigung\n\n18 Karat Tobacco e. K.\nEinzelkaufmann / Einzelkauffrau\nDortmund\n\nDas Registergericht beabsichtigt die Firma von Amts wegen nach § 31 Abs. 2 HGB, § 395 FamFG zu löschen. Die Frist zur Erhebung eines Widerspruchs ist auf drei Monate festgesetzt."
    },
    {
      "date": "2026-02-19",
      "id": "145648",
      "original_text": "Löschungsankündigung\nNordrhein-Westfalen Amtsgericht Bielefeld HRB 38365\nFlightdeck Systems GmbH – Schloß Holte-Stukenbrock",
      "type": "Löschungsankündigung",
      "state": "Nordrhein-Westfalen",
      "amtsgericht": "Amtsgericht Bielefeld",
      "registernummer": "HRB 38365",
      "registerart": "HRB",
      "company_name": "Flightdeck Systems GmbH",
      "company_seat": "Schloß Holte-Stukenbrock",
      "details": "19.02.2026 (Bekanntmachungsdatum)\n\nNordrhein-Westfalen Amtsgericht Bielefeld HRB 38365\nLöschungsankündigung\n\nFlightdeck Systems GmbH\nGesellschaft mit beschränkter Haftung\nSchloß Holte-Stukenbrock\n\nDas Registergericht beabsichtigt, die im Handelsregister eingetragene Gesellschaft von Amts wegen nach § 394 Abs. 1 Satz 2 FamFG wegen Vermögenslosigkeit zu löschen. Die Frist zur Erhebung eines Widerspruchs ist auf 6 Wochen festgesetzt."
    },
    {
      "date": "2026-02-19",
      "id": "145649",
      "original_text": "Registerbekanntmachung nach dem Umwandlungsgesetz\nNordrhein-Westfalen Amtsgericht Düsseldorf HRB 12702\nMESSETURM DÜSSELDORF Verwaltungsgesellschaft mit beschränkter Haftung – Düsseldorf",
      "type": "Registerbekanntmachung nach dem Umwandlungsgesetz",
      "state": "Nordrhein-Westfalen",
      "amtsgericht": "Amtsgericht Düsseldorf",
      "registernummer": "HRB 12702",
      "registerart": "HRB",
      "company_name": "MESSETURM DÜSSELDORF Verwaltungsgesellschaft mit beschränkter Haftung",
      "company_seat": "Düsseldorf",
      "details": "19.02.2026 (Bekanntmachungsdatum)\n\nNordrhein-Westfalen Amtsgericht Düsseldorf HRB 12702\nRegisterbekanntmachung nach dem Umwandlungsgesetz 19.02.2026 (Eintragungsdatum)\n\nMESSETURM DÜSSELDORF Verwaltungsgesellschaft mit beschränkter Haftung\nGesellschaft mit beschränkter Haftung\nDüsseldorf\n\nDen Gläubigern der an der Verschmelzung beteiligten Rechtsträger ist, wenn sie binnen sechs Monaten nach dem Tag, an dem die Eintragung der Verschmelzung in das Register des Sitzes desjenigen Rechtsträgers, dessen Gläubiger sie sind, nach § 19 Absatz 3 UmwG als bekanntgemacht gilt, ihren Anspruch nach Grund und Höhe schriftlich anmelden, Sicherheit zu leisten, soweit sie nicht Befriedigung verlangen können. Dieses Recht steht den Gläubigern jedoch nur zu, wenn sie glaubhaft machen, dass durch die Verschmelzung die Erfüllung ihrer Forderung gefährdet wird."
    },
    {
      "date": "2026-02-19",
      "id": "145650",
      "original_text": "Registerbekanntmachung nach dem Umwandlungsgesetz\nNordrhein-Westfalen Amtsgericht Düsseldorf HRB 97639\nFPM 1 GmbH – Langenfeld",
      "type": "Registerbekanntmachung nach dem Umwandlungsgesetz",
      "state": "Nordrhein-Westfalen",
      "amtsgericht": "Amtsgericht Düsseldorf",
      "registernummer": "HRB 97639",
      "registerart": "HRB",
      "company_name": "FPM 1 GmbH",
      "company_seat": "Langenfeld",
      "details": "19.02.2026 (Bekanntmachungsdatum)\n\nNordrhein-Westfalen Amtsgericht Düsseldorf HRB 97639\nRegisterbekanntmachung nach dem Umwandlungsgesetz 19.02.2026 (Eintragungsdatum)\n\nFPM 1 GmbH\nGesellschaft mit beschränkter Haftung\nLangenfeld\n\nDen Gläubigern der an der Verschmelzung beteiligten Rechtsträger ist, wenn sie binnen sechs Monaten nach dem Tag, an dem die Eintragung der Verschmelzung in das Register des Sitzes desjenigen Rechtsträgers, dessen Gläubiger sie sind, nach § 19 Absatz 3 UmwG als bekanntgemacht gilt, ihren Anspruch nach Grund und Höhe schriftlich anmelden, Sicherheit zu leisten, soweit sie nicht Befriedigung verlangen können. Dieses Recht steht den Gläubigern jedoch nur zu, wenn sie glaubhaft machen, dass durch die Verschmelzung die Erfüllung ihrer Forderung gefährdet wird."
    },
    {
      "date": "2026-02-19",
      "id": "145651",
      "original_text": "Löschungsankündigung\nNordrhein-Westfalen Amtsgericht Düsseldorf HRB 88988\nYourmoneyback.de GmbH – Düsseldorf",
      "type": "Löschungsankündigung",
      "state": "Nordrhein-Westfalen",
      "amtsgericht": "Amtsgericht Düsseldorf",
      "registernummer": "HRB 88988",
      "registerart": "HRB",
      "company_name": "Yourmoneyback.de GmbH",
      "company_seat": "Düsseldorf",
      "details": "19.02.2026 (Bekanntmachungsdatum)\n\nNordrhein-Westfalen Amtsgericht Düsseldorf HRB 88988\nLöschungsankündigung\n\nYourmoneyback.de GmbH\nGesellschaft mit beschränkter Haftung\nDüsseldorf\n\nDas Registergericht beabsichtigt die Gesellschaft von Amts wegen nach § 394 FamFG zu löschen. Die Frist zur Erhebung eines Widerspruchs ist auf 3 Wochen festgesetzt.\n\nRechtsbehelfsbelehrung:\nDas Widerspruchsrecht steht jedem zu, der an der Unterlassung der Löschung ein berechtigtes Interesse hat. Der Widerspruch ist bei dem Amtsgericht Düsseldorf -Registergericht-, Werdener Straße 1, 40227 Düsseldorf schriftlich in deutscher Sprache oder zur Niederschrift der Geschäftsstelle einzulegen. Der Widerspruch kann auch zur Niederschrift der Geschäftsstelle eines jeden Amtsgerichtes abgegeben werden. Die Einlegung ist auch durch Übertragung eines elektronischen Dokuments an die elektronische Poststelle des Gerichts möglich. Das elektronische Dokument muss für die Bearbeitung durch das Gericht geeignet und mit einer qualifizierten elektronischen Signatur der verantwortenden Person versehen sein oder von der verantwortenden Person signiert und auf einem sicheren Übermittlungsweg gemäß § 130a ZPO nach näherer Maßgabe der Verordnung über die technischen Rahmenbedingungen des elektronischen Rechtsverkehrs und über das besondere elektronische Behördenpostfach (BGBl. I, S.3803) eingereicht werden. Weitere Informationen erhalten Sie auf der Internetseite www.justiz.de.\nDer Widerspruch muss spätestens innerhalb der gesetzten Frist nach dem Datum der Bekanntmachung der Löschungsankündigung bei dem Amtsgericht - Registergericht - Düsseldorf eingegangen sein.  Dies gilt auch dann, wenn der Widerspruch zur Niederschrift der Geschäftsstelle eines anderen Amtsgerichtes abgegeben wurde. Die Frist beginnt mit dem Tage der Bekanntmachung der Löschungsankündigung in dem für die Bekanntmachung der Eintragungen in das Handelsregister bestimmten elektronischen Informations- und Kommunikationssystem nach § 10 des Handelsgesetzbuches. Fällt das Ende der Frist auf einen Sonntag, einen allgemeinen Feiertag oder Sonnabend, so endet die Frist mit Ablauf des nächsten Werktages.\nDer Widerspruch muss die Bezeichnung der angefochtenen Löschungsankündigung sowie die Erklärung enthalten, dass Widerspruch gegen diese Löschungsankündigung eingelegt wird. Er ist zu unterzeichnen und soll begründet werden."
    },
    {
      "date": "2026-02-19",
      "id": "145652",
      "original_text": "Löschungsankündigung\nNordrhein-Westfalen Amtsgericht Köln HRB 83193\nnextmarkets Pro GmbH – Köln",
      "type": "Löschungsankündigung",
      "state": "Nordrhein-Westfalen",
      "amtsgericht": "Amtsgericht Köln",
      "registernummer": "HRB 83193",
      "registerart": "HRB",
      "company_name": "nextmarkets Pro GmbH",
      "company_seat": "Köln",
      "details": "19.02.2026 (Bekanntmachungsdatum)\n\nNordrhein-Westfalen Amtsgericht Köln HRB 83193\nLöschungsankündigung\n\nnextmarkets Pro GmbH\nGesellschaft mit beschränkter Haftung\nKöln\n\nDas Registergericht beabsichtigt die Gesellschaft von Amts wegen nach § 394 FamFG zu löschen. Die Frist zur Erhebung eines Widerspruchs ist auf einen Monat festgesetzt."
    },
    {
      "date": "2026-02-19",
      "id": "145653",
      "original_text": "Löschungsankündigung\nNordrhein-Westfalen Amtsgericht Dortmund HRB 33014\nPhönix Marketing UG (haftungsbeschränkt) – Dortmund",
      "type": "Löschungsankündigung",
      "state": "Nordrhein-Westfalen",
      "amtsgericht": "Amtsgericht Dortmund",
      "registernummer": "HRB 33014",
      "registerart": "HRB",
      "company_name": "Phönix Marketing UG (haftungsbeschränkt)",
      "company_seat": "Dortmund",
      "details": "19.02.2026 (Bekanntmachungsdatum)\n\nNordrhein-Westfalen Amtsgericht Dortmund HRB 33014\nLöschungsankündigung\n\nPhönix Marketing UG (haftungsbeschränkt)\nGesellschaft mit beschränkter Haftung\nDortmund\n\nDas Registergericht beabsichtigt die Gesellschaft von Amts wegen nach § 394 FamFG zu löschen. Die Frist zur Erhebung eines Widerspruchs ist auf zwei Monate festgesetzt."
    },
    {
      "date": "2026-02-19",
      "id": "145654",
      "original_text": "Löschungsankündigung\nNordrhein-Westfalen Amtsgericht Düsseldorf HRB 102152\nAKSYON Beteiligungs GmbH – Düsseldorf",
      "type": "Löschungsankündigung",
      "state": "Nordrhein-Westfalen",
      "amtsgericht": "Amtsgericht Düsseldorf",
      "registernummer": "HRB 102152",
      "registerart": "HRB",
      "company_name": "AKSYON Beteiligungs GmbH",
      "company_seat": "Düsseldorf",
      "details": "19.02.2026 (Bekanntmachungsdatum)\n\nNordrhein-Westfalen Amtsgericht Düsseldorf HRB 102152\nLöschungsankündigung\n\nAKSYON Beteiligungs GmbH\nGesellschaft mit beschränkter Haftung\nDüsseldorf\n\nDas Registergericht beabsichtigt die Gesellschaft von Amts wegen nach § 394 Abs. 1 FamFG zu löschen. Die Frist zur Erhebung eines Widerspruchs ist auf 3 Wochen festgesetzt.\n\nRechtsbehelfsbelehrung:\nDas Widerspruchsrecht steht jedem zu, der an der Unterlassung der Löschung ein berechtigtes Interesse hat. Der Widerspruch ist bei dem Amtsgericht Düsseldorf -Registergericht-, Werdener Straße 1, 40227 Düsseldorf schriftlich in deutscher Sprache oder zur Niederschrift der Geschäftsstelle einzulegen. Der Widerspruch kann auch zur Niederschrift der Geschäftsstelle eines jeden Amtsgerichtes abgegeben werden. Die Einlegung ist auch durch Übertragung eines elektronischen Dokuments an die elektronische Poststelle des Gerichts möglich. Das elektronische Dokument muss für die Bearbeitung durch das Gericht geeignet und mit einer qualifizierten elektronischen Signatur der verantwortenden Person versehen sein oder von der verantwortenden Person signiert und auf einem sicheren Übermittlungsweg gemäß § 130a ZPO nach näherer Maßgabe der Verordnung über die technischen Rahmenbedingungen des elektronischen Rechtsverkehrs und über das besondere elektronische Behördenpostfach (BGBl. I, S.3803) eingereicht werden. Weitere Informationen erhalten Sie auf der Internetseite www.justiz.de.\nDer Widerspruch muss spätestens innerhalb der gesetzten Frist nach dem Datum der Bekanntmachung der Löschungsankündigung bei dem Amtsgericht - Registergericht - Düsseldorf eingegangen sein.  Dies gilt auch dann, wenn der Widerspruch zur Niederschrift der Geschäftsstelle eines anderen Amtsgerichtes abgegeben wurde. Die Frist beginnt mit dem Tage der Bekanntmachung der Löschungsankündigung in dem für die Bekanntmachung der Eintragungen in das Handelsregister bestimmten elektronischen Informations- und Kommunikationssystem nach § 10 des Handelsgesetzbuches. Fällt das Ende der Frist auf einen Sonntag, einen allgemeinen Feiertag oder Sonnabend, so endet die Frist mit Ablauf des nächsten Werktages.\nDer Widerspruch muss die Bezeichnung der angefochtenen Löschungsankündigung sowie die Erklärung enthalten, dass Widerspruch gegen diese Löschungsankündigung eingelegt wird. Er ist zu unterzeichnen und soll begründet werden."
    },
    {
      "date": "2026-02-19",
      "id": "145655",
      "original_text": "Löschungsankündigung\nNordrhein-Westfalen Amtsgericht Krefeld VR 4096 früher Amtsgericht Nettetal\nKarnevalsgesellschaft Hinsbecker Jüüte eingetragener Verein – Nettetal",
      "type": "Löschungsankündigung",
      "state": "Nordrhein-Westfalen",
      "amtsgericht": "Amtsgericht Krefeld",
      "registernummer": "VR 4096",
      "registerart": "VR",
      "company_name": "Karnevalsgesellschaft Hinsbecker Jüüte eingetragener Verein",
      "company_seat": "Nettetal",
      "former_amtsgericht": "Nettetal",
      "details": "19.02.2026 (Bekanntmachungsdatum)\n\nNordrhein-Westfalen Amtsgericht Krefeld VR 4096 früher Amtsgericht Nettetal\nLöschungsankündigung\n\nKarnevalsgesellschaft Hinsbecker Jüüte eingetragener Verein\neingetragener Verein\nNettetal\n\nDas Registergericht beabsichtigt, den im Vereinsregister eingetragenen Verein gemäß Wegfall aller Mitglieder von Amts wegen zu löschen.\n\nGegen diese Verfügung kann Widerspruch eingelegt werden. Die Frist zur Erhebung eines Widerspruchs gegen die beabsichtigte Löschung von Amts wegen ist auf 6 Wochen festgesetzt."
    },
    {
      "date": "2026-02-19",
      "id": "145656",
      "original_text": "Registerbekanntmachung nach dem Umwandlungsgesetz\nNordrhein-Westfalen Amtsgericht Siegen VR 5202 früher Amtsgericht Olpe\nCaritasverband in Südwestfalen e.V. – Olpe",
      "type": "Registerbekanntmachung nach dem Umwandlungsgesetz",
      "state": "Nordrhein-Westfalen",
      "amtsgericht": "Amtsgericht Siegen",
      "registernummer": "VR 5202",
      "registerart": "VR",
      "company_name": "Caritasverband in Südwestfalen e.V.",
      "company_seat": "Olpe",
      "former_amtsgericht": "Olpe",
      "details": "19.02.2026 (Bekanntmachungsdatum)\n\nNordrhein-Westfalen Amtsgericht Siegen VR 5202 früher Amtsgericht Olpe\nRegisterbekanntmachung nach dem Umwandlungsgesetz 19.02.2026 (Eintragungsdatum)\n\nCaritasverband in Südwestfalen e.V.\neingetragener Verein\nOlpe\n\nDen Gläubigern der an der Verschmelzung beteiligten Rechtsträger ist, wenn sie binnen sechs Monaten nach dem Tag, an dem die Eintragung der Verschmelzung in das Register des Sitzes desjenigen Rechtsträgers, dessen Gläubiger sie sind, nach § 19 Absatz 3 UmwG als bekanntgemacht gilt, ihren Anspruch nach Grund und Höhe schriftlich anmelden, Sicherheit zu leisten, soweit sie nicht Befriedigung verlangen können. Dieses Recht steht den Gläubigern jedoch nur zu, wenn sie glaubhaft machen, dass durch die Verschmelzung die Erfüllung ihrer Forderung gefährdet wird."
    },
    {
      "date": "2026-02-19",
      "id": "145657",
      "original_text": "Registerbekanntmachung nach dem Umwandlungsgesetz\nNordrhein-Westfalen Amtsgericht Duisburg HRB 15707\nElomech Elektroanlagen GmbH – Mülheim an der Ruhr",
      "type": "Registerbekanntmachung nach dem Umwandlungsgesetz",
      "state": "Nordrhein-Westfalen",
      "amtsgericht": "Amtsgericht Duisburg",
      "registernummer": "HRB 15707",
      "registerart": "HRB",
      "company_name": "Elomech Elektroanlagen GmbH",
      "company_seat": "Mülheim an der Ruhr",
      "details": "19.02.2026 (Bekanntmachungsdatum)\n\nNordrhein-Westfalen Amtsgericht Duisburg HRB 15707\nRegisterbekanntmachung nach dem Umwandlungsgesetz 19.02.2026 (Eintragungsdatum)\n\nElomech Elektroanlagen GmbH\nGesellschaft mit beschränkter Haftung\nMülheim an der Ruhr\n\nDie Gesellschaft hat Gläubigern, deren Forderungen vor dieser Bekanntmachung begründet worden sind, Sicherheit zu leisten, soweit sie nicht Befriedigung verlangen können, wenn sie sich binnen sechs Monaten zu diesem Zweck melden."
    },
    {
      "date": "2026-02-19",
      "id": "145658",
      "original_text": "Sonstige Registerbekanntmachung\nNordrhein-Westfalen Amtsgericht Recklinghausen HRB 5610\njunikum Gesellschaft für Jugendhilfe und Familien St. Agnes mbH – Oer-Erkenschwick",
      "type": "Sonstige Registerbekanntmachung",
      "state": "Nordrhein-Westfalen",
      "amtsgericht": "Amtsgericht Recklinghausen",
      "registernummer": "HRB 5610",
      "registerart": "HRB",
      "company_name": "junikum Gesellschaft für Jugendhilfe und Familien St. Agnes mbH",
      "company_seat": "Oer-Erkenschwick",
      "details": "19.02.2026 (Bekanntmachungsdatum)\n\nNordrhein-Westfalen Amtsgericht Recklinghausen HRB 5610\nSonstige Registerbekanntmachung 19.02.2026 (Eintragungsdatum)\n\njunikum Gesellschaft für Jugendhilfe und Familien St. Agnes mbH\nGesellschaft mit beschränkter Haftung\nOer-Erkenschwick\n\nDem Registergericht ist eine neue Liste der Mitglieder des Aufsichtsrates eingereicht worden."
    },
    {
      "date": "2026-02-19",
      "id": "145659",
      "original_text": "Löschungsankündigung\nNordrhein-Westfalen Amtsgericht Dortmund HRB 24253\nTainer Media Kommunikations und Vertriebs UG (haftungsbeschränkt) – Dortmund",
      "type": "Löschungsankündigung",
      "state": "Nordrhein-Westfalen",
      "amtsgericht": "Amtsgericht Dortmund",
      "registernummer": "HRB 24253",
      "registerart": "HRB",
      "company_name": "Tainer Media Kommunikations und Vertriebs UG (haftungsbeschränkt)",
      "company_seat": "Dortmund",
      "details": "19.02.2026 (Bekanntmachungsdatum)\n\nNordrhein-Westfalen Amtsgericht Dortmund HRB 24253\nLöschungsankündigung\n\nTainer Media Kommunikations und Vertriebs UG (haftungsbeschränkt)\nGesellschaft mit beschränkter Haftung\nDortmund\n\nDas Registergericht beabsichtigt die Gesellschaft von Amts wegen nach § 394 FamFG zu löschen. Die Frist zur Erhebung eines Widerspruchs ist auf zwei Monate festgesetzt."
    },
    {
      "date": "2026-02-19",
      "id": "145660",
      "original_text": "Einreichung neuer Dokumente\nNordrhein-Westfalen Amtsgericht Bonn HRB 6792\nDeutsche Post AG – Bonn",
      "type": "Einreichung neuer Dokumente",
      "state": "Nordrhein-Westfalen",
      "amtsgericht": "Amtsgericht Bonn",
      "registernummer": "HRB 6792",
      "registerart": "HRB",
      "company_name": "Deutsche Post AG",
      "company_seat": "Bonn",
      "details": "19.02.2026 (Bekanntmachungsdatum)\n\nNordrhein-Westfalen Amtsgericht Bonn HRB 6792\nEinreichung neuer Dokumente\n\nDeutsche Post AG\nAktiengesellschaft\nBonn\n\nDem Registergericht ist eine neue Liste der Mitglieder des Aufsichtsrates eingereicht worden."
    },
    {
      "date": "2026-02-19",
      "id": "145661",
      "original_text": "Löschungsankündigung\nNordrhein-Westfalen Amtsgericht Düsseldorf HRB 69308\nKICO International GmbH – Düsseldorf",
      "type": "Löschungsankündigung",
      "state": "Nordrhein-Westfalen",
      "amtsgericht": "Amtsgericht Düsseldorf",
      "registernummer": "HRB 69308",
      "registerart": "HRB",
      "company_name": "KICO International GmbH",
      "company_seat": "Düsseldorf",
      "details": "19.02.2026 (Bekanntmachungsdatum)\n\nNordrhein-Westfalen Amtsgericht Düsseldorf HRB 69308\nLöschungsankündigung\n\nKICO International GmbH\nGesellschaft mit beschränkter Haftung\nDüsseldorf\n\nDas Registergericht beabsichtigt die Gesellschaft von Amts wegen nach § 394 FamFG zu löschen. Die Frist zur Erhebung eines Widerspruchs ist auf 3 Wochen festgesetzt.\n\nRechtsbehelfsbelehrung:\nDas Widerspruchsrecht steht jedem zu, der an der Unterlassung der Löschung ein berechtigtes Interesse hat. Der Widerspruch ist bei dem Amtsgericht Düsseldorf -Registergericht-, Werdener Straße 1, 40227 Düsseldorf schriftlich in deutscher Sprache oder zur Niederschrift der Geschäftsstelle einzulegen. Der Widerspruch kann auch zur Niederschrift der Geschäftsstelle eines jeden Amtsgerichtes abgegeben werden. Die Einlegung ist auch durch Übertragung eines elektronischen Dokuments an die elektronische Poststelle des Gerichts möglich. Das elektronische Dokument muss für die Bearbeitung durch das Gericht geeignet und mit einer qualifizierten elektronischen Signatur der verantwortenden Person versehen sein oder von der verantwortenden Person signiert und auf einem sicheren Übermittlungsweg gemäß § 130a ZPO nach näherer Maßgabe der Verordnung über die technischen Rahmenbedingungen des elektronischen Rechtsverkehrs und über das besondere elektronische Behördenpostfach (BGBl. I, S.3803) eingereicht werden. Weitere Informationen erhalten Sie auf der Internetseite www.justiz.de.\nDer Widerspruch muss spätestens innerhalb der gesetzten Frist nach dem Datum der Bekanntmachung der Löschungsankündigung bei dem Amtsgericht - Registergericht - Düsseldorf eingegangen sein.  Dies gilt auch dann, wenn der Widerspruch zur Niederschrift der Geschäftsstelle eines anderen Amtsgerichtes abgegeben wurde. Die Frist beginnt mit dem Tage der Bekanntmachung der Löschungsankündigung in dem für die Bekanntmachung der Eintragungen in das Handelsregister bestimmten elektronischen Informations- und Kommunikationssystem nach § 10 des Handelsgesetzbuches. Fällt das Ende der Frist auf einen Sonntag, einen allgemeinen Feiertag oder Sonnabend, so endet die Frist mit Ablauf des nächsten Werktages.\nDer Widerspruch muss die Bezeichnung der angefochtenen Löschungsankündigung sowie die Erklärung enthalten, dass Widerspruch gegen diese Löschungsankündigung eingelegt wird. Er ist zu unterzeichnen und soll begründet werden."
    },
    {
      "date": "2026-02-19",
      "id": "145662",
      "original_text": "Registerbekanntmachung nach dem Umwandlungsgesetz\nNordrhein-Westfalen Amtsgericht Düsseldorf HRB 107845\nFPM Immobilien GmbH – Langenfeld",
      "type": "Registerbekanntmachung nach dem Umwandlungsgesetz",
      "state": "Nordrhein-Westfalen",
      "amtsgericht": "Amtsgericht Düsseldorf",
      "registernummer": "HRB 107845",
      "registerart": "HRB",
      "company_name": "FPM Immobilien GmbH",
      "company_seat": "Langenfeld",
      "details": "19.02.2026 (Bekanntmachungsdatum)\n\nNordrhein-Westfalen Amtsgericht Düsseldorf HRB 107845\nRegisterbekanntmachung nach dem Umwandlungsgesetz 19.02.2026 (Eintragungsdatum)\n\nFPM Immobilien GmbH\nGesellschaft mit beschränkter Haftung\nLangenfeld\n\nDen Gläubigern der an der Verschmelzung beteiligten Rechtsträger ist, wenn sie binnen sechs Monaten nach dem Tag, an dem die Eintragung der Verschmelzung in das Register des Sitzes desjenigen Rechtsträgers, dessen Gläubiger sie sind, nach § 19 Absatz 3 UmwG als bekanntgemacht gilt, ihren Anspruch nach Grund und Höhe schriftlich anmelden, Sicherheit zu leisten, soweit sie nicht Befriedigung verlangen können. Dieses Recht steht den Gläubigern jedoch nur zu, wenn sie glaubhaft machen, dass durch die Verschmelzung die Erfüllung ihrer Forderung gefährdet wird."
    },
    {
      "date": "2026-02-19",
      "id": "145663",
      "original_text": "Einreichung neuer Dokumente\nNordrhein-Westfalen Amtsgericht Köln HRB 103919\nSysfacts AG – Köln",
      "type": "Einreichung neuer Dokumente",
      "state": "Nordrhein-Westfalen",
      "amtsgericht": "Amtsgericht Köln",
      "registernummer": "HRB 103919",
      "registerart": "HRB",
      "company_name": "Sysfacts AG",
      "company_seat": "Köln",
      "details": "19.02.2026 (Bekanntmachungsdatum)\n\nNordrhein-Westfalen Amtsgericht Köln HRB 103919\nEinreichung neuer Dokumente\n\nSysfacts AG\nAktiengesellschaft\nKöln\n\nDem Registergericht ist eine neue Liste der Mitglieder des Aufsichtsrates eingereicht worden."
    },
    {
      "date": "2026-02-19",
      "id": "145664",
      "original_text": "Löschungsankündigung\nNordrhein-Westfalen Amtsgericht Düsseldorf HRB 82803\nLTU Gebäudereinigung GmbH – Ratingen",
      "type": "Löschungsankündigung",
      "state": "Nordrhein-Westfalen",
      "amtsgericht": "Amtsgericht Düsseldorf",
      "registernummer": "HRB 82803",
      "registerart": "HRB",
      "company_name": "LTU Gebäudereinigung GmbH",
      "company_seat": "Ratingen",
      "details": "19.02.2026 (Bekanntmachungsdatum)\n\nNordrhein-Westfalen Amtsgericht Düsseldorf HRB 82803\nLöschungsankündigung\n\nLTU Gebäudereinigung GmbH\nGesellschaft mit beschränkter Haftung\nRatingen\n\nDas Registergericht beabsichtigt die Gesellschaft von Amts wegen nach § 394 FamFG zu löschen. Die Frist zur Erhebung eines Widerspruchs ist auf 3 Wochen festgesetzt.\n\nRechtsbehelfsbelehrung:\nDas Widerspruchsrecht steht jedem zu, der an der Unterlassung der Löschung ein berechtigtes Interesse hat. Der Widerspruch ist bei dem Amtsgericht Düsseldorf -Registergericht-, Werdener Straße 1, 40227 Düsseldorf schriftlich in deutscher Sprache oder zur Niederschrift der Geschäftsstelle einzulegen. Der Widerspruch kann auch zur Niederschrift der Geschäftsstelle eines jeden Amtsgerichtes abgegeben werden. Die Einlegung ist auch durch Übertragung eines elektronischen Dokuments an die elektronische Poststelle des Gerichts möglich. Das elektronische Dokument muss für die Bearbeitung durch das Gericht geeignet und mit einer qualifizierten elektronischen Signatur der verantwortenden Person versehen sein oder von der verantwortenden Person signiert und auf einem sicheren Übermittlungsweg gemäß § 130a ZPO nach näherer Maßgabe der Verordnung über die technischen Rahmenbedingungen des elektronischen Rechtsverkehrs und über das besondere elektronische Behördenpostfach (BGBl. I, S.3803) eingereicht werden. Weitere Informationen erhalten Sie auf der Internetseite www.justiz.de.\nDer Widerspruch muss spätestens innerhalb der gesetzten Frist nach dem Datum der Bekanntmachung der Löschungsankündigung bei dem Amtsgericht - Registergericht - Düsseldorf eingegangen sein.  Dies gilt auch dann, wenn der Widerspruch zur Niederschrift der Geschäftsstelle eines anderen Amtsgerichtes abgegeben wurde. Die Frist beginnt mit dem Tage der Bekanntmachung der Löschungsankündigung in dem für die Bekanntmachung der Eintragungen in das Handelsregister bestimmten elektronischen Informations- und Kommunikationssystem nach § 10 des Handelsgesetzbuches. Fällt das Ende der Frist auf einen Sonntag, einen allgemeinen Feiertag oder Sonnabend, so endet die Frist mit Ablauf des nächsten Werktages.\nDer Widerspruch muss die Bezeichnung der angefochtenen Löschungsankündigung sowie die Erklärung enthalten, dass Widerspruch gegen diese Löschungsankündigung eingelegt wird. Er ist zu unterzeichnen und soll begründet werden."
    },
    {
      "date": "2026-02-19",
      "id": "145665",
      "original_text": "Löschungsankündigung\nNordrhein-Westfalen Amtsgericht Köln HRB 65705\nSteinwerk UG (haftungsbeschränkt) – Köln",
      "type": "Löschungsankündigung",
      "state": "Nordrhein-Westfalen",
      "amtsgericht": "Amtsgericht Köln",
      "registernummer": "HRB 65705",
      "registerart": "HRB",
      "company_name": "Steinwerk UG (haftungsbeschränkt)",
      "company_seat": "Köln",
      "details": "19.02.2026 (Bekanntmachungsdatum)\n\nNordrhein-Westfalen Amtsgericht Köln HRB 65705\nLöschungsankündigung 19.02.2026 (Eintragungsdatum)\n\nSteinwerk UG (haftungsbeschränkt)\nGesellschaft mit beschränkter Haftung\nKöln\n\nDas Registergericht beabsichtigt die Gesellschaft von Amts wegen nach § 394 FamFG zu löschen. Die Frist zur Erhebung eines Widerspruchs ist auf einen Monat festgesetzt."
    },
    {
      "date": "2026-02-19",
      "id": "145666",
      "original_text": "Einreichung neuer Dokumente\nNordrhein-Westfalen Amtsgericht Köln HRB 7432\nRegionalverkehr Köln Gesellschaft mit beschränkter Haftung ( RVK) – Köln",
      "type": "Einreichung neuer Dokumente",
      "state": "Nordrhein-Westfalen",
      "amtsgericht": "Amtsgericht Köln",
      "registernummer": "HRB 7432",
      "registerart": "HRB",
      "company_name": "Regionalverkehr Köln Gesellschaft mit beschränkter Haftung ( RVK)",
      "company_seat": "Köln",
      "details": "19.02.2026 (Bekanntmachungsdatum)\n\nNordrhein-Westfalen Amtsgericht Köln HRB 7432\nEinreichung neuer Dokumente\n\nRegionalverkehr Köln Gesellschaft mit beschränkter Haftung ( RVK)\nGesellschaft mit beschränkter Haftung\nKöln\n\nDem Registergericht ist eine neue Liste der Mitglieder des Aufsichtsrates eingereicht worden."
    },
    {
      "date": "2026-02-19",
      "id": "145667",
      "original_text": "Löschungsankündigung\nNordrhein-Westfalen Amtsgericht Düsseldorf HRB 100818\nAraka GmbH – Düsseldorf",
      "type": "Löschungsankündigung",
      "state": "Nordrhein-Westfalen",
      "amtsgericht": "Amtsgericht Düsseldorf",
      "registernummer": "HRB 100818",
      "registerart": "HRB",
      "company_name": "Araka GmbH",
      "company_seat": "Düsseldorf",
      "details": "19.02.2026 (Bekanntmachungsdatum)\n\nNordrhein-Westfalen Amtsgericht Düsseldorf HRB 100818\nLöschungsankündigung\n\nAraka GmbH\nGesellschaft mit beschränkter Haftung\nDüsseldorf\n\nDas Registergericht beabsichtigt die Gesellschaft von Amts wegen nach § 394 FamFG zu löschen. Die Frist zur Erhebung eines Widerspruchs ist auf 3 Wochen festgesetzt.\n\nRechtsbehelfsbelehrung:\nDas Widerspruchsrecht steht jedem zu, der an der Unterlassung der Löschung ein berechtigtes Interesse hat. Der Widerspruch ist bei dem Amtsgericht Düsseldorf -Registergericht-, Werdener Straße 1, 40227 Düsseldorf schriftlich in deutscher Sprache oder zur Niederschrift der Geschäftsstelle einzulegen. Der Widerspruch kann auch zur Niederschrift der Geschäftsstelle eines jeden Amtsgerichtes abgegeben werden. Die Einlegung ist auch durch Übertragung eines elektronischen Dokuments an die elektronische Poststelle des Gerichts möglich. Das elektronische Dokument muss für die Bearbeitung durch das Gericht geeignet und mit einer qualifizierten elektronischen Signatur der verantwortenden Person versehen sein oder von der verantwortenden Person signiert und auf einem sicheren Übermittlungsweg gemäß § 130a ZPO nach näherer Maßgabe der Verordnung über die technischen Rahmenbedingungen des elektronischen Rechtsverkehrs und über das besondere elektronische Behördenpostfach (BGBl. I, S.3803) eingereicht werden. Weitere Informationen erhalten Sie auf der Internetseite www.justiz.de.\nDer Widerspruch muss spätestens innerhalb der gesetzten Frist nach dem Datum der Bekanntmachung der Löschungsankündigung bei dem Amtsgericht - Registergericht - Düsseldorf eingegangen sein.  Dies gilt auch dann, wenn der Widerspruch zur Niederschrift der Geschäftsstelle eines anderen Amtsgerichtes abgegeben wurde. Die Frist beginnt mit dem Tage der Bekanntmachung der Löschungsankündigung in dem für die Bekanntmachung der Eintragungen in das Handelsregister bestimmten elektronischen Informations- und Kommunikationssystem nach § 10 des Handelsgesetzbuches. Fällt das Ende der Frist auf einen Sonntag, einen allgemeinen Feiertag oder Sonnabend, so endet die Frist mit Ablauf des nächsten Werktages.\nDer Widerspruch muss die Bezeichnung der angefochtenen Löschungsankündigung sowie die Erklärung enthalten, dass Widerspruch gegen diese Löschungsankündigung eingelegt wird. Er ist zu unterzeichnen und soll begründet werden."
    },
    {
      "date": "2026-02-19",
      "id": "145668",
      "original_text": "Registerbekanntmachung nach dem Umwandlungsgesetz\nNordrhein-Westfalen Amtsgericht Köln HRB 100024\nCE Bonn GmbH – Frechen",
      "type": "Registerbekanntmachung nach dem Umwandlungsgesetz",
      "state": "Nordrhein-Westfalen",
      "amtsgericht": "Amtsgericht Köln",
      "registernummer": "HRB 100024",
      "registerart": "HRB",
      "company_name": "CE Bonn GmbH",
      "company_seat": "Frechen",
      "details": "19.02.2026 (Bekanntmachungsdatum)\n\nNordrhein-Westfalen Amtsgericht Köln HRB 100024\nRegisterbekanntmachung nach dem Umwandlungsgesetz 19.02.2026 (Eintragungsdatum)\n\nCE Bonn GmbH\nGesellschaft mit beschränkter Haftung\nFrechen\n\nDen Gläubigern der an der Verschmelzung beteiligten Rechtsträger ist, wenn sie binnen sechs Monaten nach dem Tag, an dem die Eintragung der Verschmelzung in das Register des Sitzes desjenigen Rechtsträgers, dessen Gläubiger sie sind, nach § 19 Absatz 3 UmwG als bekanntgemacht gilt, ihren Anspruch nach Grund und Höhe schriftlich anmelden, Sicherheit zu leisten, soweit sie nicht Befriedigung verlangen können. Dieses Recht steht den Gläubigern jedoch nur zu, wenn sie glaubhaft machen, dass durch die Verschmelzung die Erfüllung ihrer Forderung gefährdet wird."
    },
    {
      "date": "2026-02-19",
      "id": "145669",
      "original_text": "Einreichung neuer Dokumente\nNordrhein-Westfalen Amtsgericht Düsseldorf HRB 81054\nISS Communication Services GmbH – Düsseldorf",
      "type": "Einreichung neuer Dokumente",
      "state": "Nordrhein-Westfalen",
      "amtsgericht": "Amtsgericht Düsseldorf",
      "registernummer": "HRB 81054",
      "registerart": "HRB",
      "company_name": "ISS Communication Services GmbH",
      "company_seat": "Düsseldorf",
      "details": "19.02.2026 (Bekanntmachungsdatum)\n\nNordrhein-Westfalen Amtsgericht Düsseldorf HRB 81054\nEinreichung neuer Dokumente 19.02.2026 (Eintragungsdatum)\n\nISS Communication Services GmbH\nGesellschaft mit beschränkter Haftung\nDüsseldorf\n\nDem Registergericht ist eine Liste der Mitglieder des Aufsichtsrates eingereicht worden."
    },
    {
      "date": "2026-02-19",
      "id": "145670",
      "original_text": "Einreichung neuer Dokumente\nNordrhein-Westfalen Amtsgericht Düsseldorf HRB 103569\nWe.Network Community SE – Düsseldorf",
      "type": "Einreichung neuer Dokumente",
      "state": "Nordrhein-Westfalen",
      "amtsgericht": "Amtsgericht Düsseldorf",
      "registernummer": "HRB 103569",
      "registerart": "HRB",
      "company_name": "We.Network Community SE",
      "company_seat": "Düsseldorf",
      "details": "19.02.2026 (Bekanntmachungsdatum)\n\nNordrhein-Westfalen Amtsgericht Düsseldorf HRB 103569\nEinreichung neuer Dokumente 19.02.2026 (Eintragungsdatum)\n\nWe.Network Community SE\nEuropäische Aktiengesellschaft (SE)\nDüsseldorf\n\nDem Registergericht ist eine Liste der Mitglieder des Aufsichtsrates eingereicht worden."
    },
    {
      "date": "2026-02-19",
      "id": "145671",
      "original_text": "Registerbekanntmachung nach dem Umwandlungsgesetz\nNordrhein-Westfalen Amtsgericht Aachen HRB 23325\nFSM GmbH – Aachen",
      "type": "Registerbekanntmachung nach dem Umwandlungsgesetz",
      "state": "Nordrhein-Westfalen",
      "amtsgericht": "Amtsgericht Aachen",
      "registernummer": "HRB 23325",
      "registerart": "HRB",
      "company_name": "FSM GmbH",
      "company_seat": "Aachen",
      "details": "19.02.2026 (Bekanntmachungsdatum)\n\nNordrhein-Westfalen Amtsgericht Aachen HRB 23325\nRegisterbekanntmachung nach dem Umwandlungsgesetz 19.02.2026 (Eintragungsdatum)\n\nFSM GmbH\nGesellschaft mit beschränkter Haftung\nAachen\n\nDen Gläubigern der an der Verschmelzung beteiligten Rechtsträger ist, wenn sie binnen sechs Monaten nach dem Tag, an dem die Eintragung der Verschmelzung in das Register des Sitzes derjenigen Rechtsträger deren Gläubiger sie sind, nach § 19 Absatz 3 UmwG als bekanntgemacht gilt, ihren Anspruch nach Grund und Höhe schriftlich anmelden, Sicherheit zu leisten, soweit sie nicht Befriedigung verlangen können. Dieses Recht steht den Gläubigern jedoch nur zu, wenn sie glaubhaft machen, dass durch die Verschmelzung die Erfüllung ihrer Forderung gefährdet wird."
    },
    {
      "date": "2026-02-19",
      "id": "145672",
      "original_text": "Registerbekanntmachung nach dem Umwandlungsgesetz\nNordrhein-Westfalen Amtsgericht Düsseldorf HRB 111967\nZentiva GmbH – Monheim am Rhein",
      "type": "Registerbekanntmachung nach dem Umwandlungsgesetz",
      "state": "Nordrhein-Westfalen",
      "amtsgericht": "Amtsgericht Düsseldorf",
      "registernummer": "HRB 111967",
      "registerart": "HRB",
      "company_name": "Zentiva GmbH",
      "company_seat": "Monheim am Rhein",
      "details": "19.02.2026 (Bekanntmachungsdatum)\n\nNordrhein-Westfalen Amtsgericht Düsseldorf HRB 111967\nRegisterbekanntmachung nach dem Umwandlungsgesetz 19.02.2026 (Eintragungsdatum)\n\nZentiva GmbH\nGesellschaft mit beschränkter Haftung\nMonheim am Rhein\n\nDen Gläubigern der an der formwechselnden Umwandlung beteiligten Rechtsträger ist, wenn sie binnen sechs Monaten nach dem Tag, an dem die Eintragung der formwechselnden Umwandlung in das Register des Sitzes desjenigen Rechtsträgers, dessen Gläubiger sie sind, nach § 19 Absatz 3 UmwG als bekanntgemacht gilt, ihren Anspruch nach Grund und Höhe schriftlich anmelden, Sicherheit zu leisten, soweit sie nicht Befriedigung verlangen können. Dieses Recht steht den Gläubigern jedoch nur zu, wenn sie glaubhaft machen, dass durch die formwechselnden Umwandlung die Erfüllung ihrer Forderung gefährdet wird."
    },
    {
      "date": "2026-02-19",
      "id": "145673",
      "original_text": "Registerbekanntmachung nach dem Umwandlungsgesetz\nNordrhein-Westfalen Amtsgericht Duisburg HRB 9561\nteloplan Ingenieurgesellschaft mbH – Mülheim an der Ruhr",
      "type": "Registerbekanntmachung nach dem Umwandlungsgesetz",
      "state": "Nordrhein-Westfalen",
      "amtsgericht": "Amtsgericht Duisburg",
      "registernummer": "HRB 9561",
      "registerart": "HRB",
      "company_name": "teloplan Ingenieurgesellschaft mbH",
      "company_seat": "Mülheim an der Ruhr",
      "details": "19.02.2026 (Bekanntmachungsdatum)\n\nNordrhein-Westfalen Amtsgericht Duisburg HRB 9561\nRegisterbekanntmachung nach dem Umwandlungsgesetz 19.02.2026 (Eintragungsdatum)\n\nteloplan Ingenieurgesellschaft mbH\nGesellschaft mit beschränkter Haftung\nMülheim an der Ruhr\n\nDie Gesellschaft hat Gläubigern, deren Forderungen vor dieser Bekanntmachung begründet worden sind, Sicherheit zu leisten, soweit sie nicht Befriedigung verlangen können, wenn sie sich binnen sechs Monaten zu diesem Zweck melden."
    },
    {
      "date": "2026-02-19",
      "id": "145674",
      "original_text": "Löschungsankündigung\nNordrhein-Westfalen Amtsgericht Gütersloh HRB 10636\nRoggenkamp Dairy GmbH – Gütersloh",
      "type": "Löschungsankündigung",
      "state": "Nordrhein-Westfalen",
      "amtsgericht": "Amtsgericht Gütersloh",
      "registernummer": "HRB 10636",
      "registerart": "HRB",
      "company_name": "Roggenkamp Dairy GmbH",
      "company_seat": "Gütersloh",
      "details": "19.02.2026 (Bekanntmachungsdatum)\n\nNordrhein-Westfalen Amtsgericht Gütersloh HRB 10636\nLöschungsankündigung 19.02.2026 (Eintragungsdatum)\n\nRoggenkamp Dairy GmbH\nGesellschaft mit beschränkter Haftung\nGütersloh\n\nDas Registergericht beabsichtigt die Gesellschaft von Amts wegen nach § 394 FamFG zu löschen. Die Frist zur Erhebung eines Widerspruchs ist auf einen Monat festgesetzt."
    },
    {
      "date": "2026-02-19",
      "id": "145675",
      "original_text": "Löschungsankündigung\nNordrhein-Westfalen Amtsgericht Siegen HRB 9776\nFlexxSys GmbH – Freudenberg",
      "type": "Löschungsankündigung",
      "state": "Nordrhein-Westfalen",
      "amtsgericht": "Amtsgericht Siegen",
      "registernummer": "HRB 9776",
      "registerart": "HRB",
      "company_name": "FlexxSys GmbH",
      "company_seat": "Freudenberg",
      "details": "19.02.2026 (Bekanntmachungsdatum)\n\nNordrhein-Westfalen Amtsgericht Siegen HRB 9776\nLöschungsankündigung\n\nFlexxSys GmbH\nGesellschaft mit beschränkter Haftung\nFreudenberg\n\nDas Registergericht beabsichtigt die Gesellschaft von Amts wegen nach § 394 FamFG zu löschen. Die Frist zur Erhebung eines Widerspruchs ist auf drei Monate festgesetzt."
    },
    {
      "date": "2026-02-19",
      "id": "145676",
      "original_text": "Registerbekanntmachung nach dem Umwandlungsgesetz\nNordrhein-Westfalen Amtsgericht Köln HRB 124982\nScannell Deutschland No. 011 GmbH – Köln",
      "type": "Registerbekanntmachung nach dem Umwandlungsgesetz",
      "state": "Nordrhein-Westfalen",
      "amtsgericht": "Amtsgericht Köln",
      "registernummer": "HRB 124982",
      "registerart": "HRB",
      "company_name": "Scannell Deutschland No. 011 GmbH",
      "company_seat": "Köln",
      "details": "19.02.2026 (Bekanntmachungsdatum)\n\nNordrhein-Westfalen Amtsgericht Köln HRB 124982\nRegisterbekanntmachung nach dem Umwandlungsgesetz\n\nScannell Deutschland No. 011 GmbH\nGesellschaft mit beschränkter Haftung\nKöln\n\nEs wird darauf hingewiesen, dass ein Verschmelzungsplan oder sein Entwurf über eine grenzüberschreitende Verschmelzung zur Aufnahme mit folgenden Rechtsträgern beim Handelsregister eingereicht worden ist:  - Scannell Properties Germany 2 S.à.r.l. mit Sitz in Luxemburg/Luxemburg (Registre de commerce et des sociétés B252118) (société à responsabilité limitée - Gesellschaft mit beschränkter Haftung  nach luxemburgischem Recht)\n\nDie Anteilsinhaber, die Gläubiger sowie die zuständigen Betriebsräte der an der grenzüberschreitenden Verschmelzung beteiligten Gesellschaften oder, soweit es keinen Betriebsrat gibt, die Arbeitnehmer der an der grenzüberschreitenden Verschmelzung beteiligten Gesellschaften, können der jeweiligen Gesellschaft spätestens fünf Arbeitstage vor dem Tag der Gesellschafterversammlung Bemerkungen zum Verschmelzungsplan übermitteln."
    },
    {
      "date": "2026-02-19",
      "id": "145677",
      "original_text": "Löschungsankündigung\nNordrhein-Westfalen Amtsgericht Köln HRB 118554\nAutohaus und Meisterwerkstatt Benz GmbH – Leverkusen",
      "type": "Löschungsankündigung",
      "state": "Nordrhein-Westfalen",
      "amtsgericht": "Amtsgericht Köln",
      "registernummer": "HRB 118554",
      "registerart": "HRB",
      "company_name": "Autohaus und Meisterwerkstatt Benz GmbH",
      "company_seat": "Leverkusen",
      "details": "19.02.2026 (Bekanntmachungsdatum)\n\nNordrhein-Westfalen Amtsgericht Köln HRB 118554\nLöschungsankündigung 19.02.2026 (Eintragungsdatum)\n\nAutohaus und Meisterwerkstatt Benz GmbH\nGesellschaft mit beschränkter Haftung\nLeverkusen\n\nDas Registergericht beabsichtigt die Gesellschaft von Amts wegen nach § 394 FamFG zu löschen. Die Frist zur Erhebung eines Widerspruchs ist auf einen Monat festgesetzt."
    },
    {
      "date": "2026-02-19",
      "id": "145678",
      "original_text": "Löschungsankündigung\nNordrhein-Westfalen Amtsgericht Aachen HRB 20365\nDREI G UG (haftungsbeschränkt) – Aachen",
      "type": "Löschungsankündigung",
      "state": "Nordrhein-Westfalen",
      "amtsgericht": "Amtsgericht Aachen",
      "registernummer": "HRB 20365",
      "registerart": "HRB",
      "company_name": "DREI G UG (haftungsbeschränkt)",
      "company_seat": "Aachen",
      "details": "19.02.2026 (Bekanntmachungsdatum)\n\nNordrhein-Westfalen Amtsgericht Aachen HRB 20365\nLöschungsankündigung\n\nDREI G UG (haftungsbeschränkt)\nGesellschaft mit beschränkter Haftung\nAachen\n\nDas Registergericht beabsichtigt, von Amts wegen die Gesellschaft wegen\nVermögenslosigkeit nach § 394 FamFG zu löschen, weil das Finanzamt\nAachen-Stadt mit Schreiben vom 05.01.2026 Umstände mitgeteilt hat, aufgrund\nderer das Gericht davon überzeugt ist, dass die Gesellschaft vollständig\nvermögenslos ist.\nZur Geltendmachung des Widerspruchs gegen die beabsichtigte Löschung wird\nhiermit eine Frist von einem Monat ab Veröffentlichung dieser Ankündigung\nbestimmt.Das Registergericht beabsichtigt, von Amts wegen die Gesellschaft wegen Vermögenslosigkeit nach § 394 FamFG zu löschen.\n\nZur Geltendmachung des Widerspruchs gegen die beabsichtigte Löschung wird hiermit eine Frist von einem Monat ab Veröffentlichung dieser Ankündigung bestimmt.\n\nRechtsbehelfsbelehrung:\n\nGegen diese Verfügung kann Widerspruch eingelegt werden. Zum Widerspruch ist jeder berechtigt, der an der Unterlassung der Löschung ein berechtigtes Interesse hat.\n\nDer Widerspruch ist bei dem Amtsgericht Aachen, Adalbertsteinweg 92, 52070 Aachen schriftlich in deutscher Sprache oder zur Niederschrift der Geschäftsstelle einzulegen. Der Widerspruch kann auch zur Niederschrift der Geschäftsstelle eines jeden Amtsgerichtes abgegeben werden.\n\nDer Widerspruch muss spätestens innerhalb der gesetzten Frist nach der Bekanntgabe der Verfügung bei dem Amtsgericht Aachen eingegangen sein. Dies gilt auch dann, wenn der Widerspruch zur Niederschrift der Geschäftsstelle eines anderen Amtsgerichtes abgegeben wurde. Die Frist beginnt mit der Bekanntgabe der Verfügung durch Veröffentlichung. Fällt das Ende der Frist auf einen Sonntag, einen allgemeinen Feiertag oder Sonnabend, so endet die Frist mit Ablauf des nächsten Werktages.\n\nDer Widerspruch muss die Bezeichnung der angefochtenen Verfügung sowie die Erklärung enthalten, dass Widerspruch gegen diese Verfügung eingelegt wird. Er ist zu unterzeichnen und soll begründet werden.\n\nDie Einlegung ist auch durch Übertragung eines elektronischen Dokuments an die elektronische Poststelle des Gerichts möglich. Das elektronische Dokument muss für die Bearbeitung durch das Gericht geeignet und mit einer qualifizierten elektronischen Signatur der verantwortenden Person versehen sein oder von der verantwortenden Person signiert und auf einem sicheren Übermittlungsweg gemäß § 130 a ZPO nach näherer Maßgabe der Verordnung über die technischen Rahmenbedingungen des elektronischen Rechtsverkehrs und über das besondere elektronische Behördenpostfach (BGBl. I, S. 3803) eingereicht werden. Weitere Informationen erhalten Sie auf der Internetseite www.justiz.de."
    },
    {
      "date": "2026-02-19",
      "id": "145679",
      "original_text": "Löschungsankündigung\nNordrhein-Westfalen Amtsgericht Krefeld HRB 14274\nFassaden Schröder UG (haftungsbeschränkt) – Krefeld",
      "type": "Löschungsankündigung",
      "state": "Nordrhein-Westfalen",
      "amtsgericht": "Amtsgericht Krefeld",
      "registernummer": "HRB 14274",
      "registerart": "HRB",
      "company_name": "Fassaden Schröder UG (haftungsbeschränkt)",
      "company_seat": "Krefeld",
      "details": "19.02.2026 (Bekanntmachungsdatum)\n\nNordrhein-Westfalen Amtsgericht Krefeld HRB 14274\nLöschungsankündigung\n\nFassaden Schröder UG (haftungsbeschränkt)\nGesellschaft mit beschränkter Haftung\nKrefeld\n\nDas Registergericht beabsichtigt die Gesellschaft von Amts wegen nach § 394 FamFG zu löschen. Die Frist zur Erhebung eines Widerspruchs ist auf einen Monat festgesetzt."
    },
    {
      "date": "2026-02-19",
      "id": "145680",
      "original_text": "Registerbekanntmachung nach dem Umwandlungsgesetz\nNordrhein-Westfalen Amtsgericht Siegen VR 999\nCaritasverband Siegen-Wittgenstein e. V – Siegen",
      "type": "Registerbekanntmachung nach dem Umwandlungsgesetz",
      "state": "Nordrhein-Westfalen",
      "amtsgericht": "Amtsgericht Siegen",
      "registernummer": "VR 999",
      "registerart": "VR",
      "company_name": "Caritasverband Siegen-Wittgenstein e. V",
      "company_seat": "Siegen",
      "details": "19.02.2026 (Bekanntmachungsdatum)\n\nNordrhein-Westfalen Amtsgericht Siegen VR 999\nRegisterbekanntmachung nach dem Umwandlungsgesetz 19.02.2026 (Eintragungsdatum)\n\nCaritasverband Siegen-Wittgenstein e. V\neingetragener Verein\nSiegen\n\nDen Gläubigern der an der Verschmelzung beteiligten Rechtsträger ist, wenn sie binnen sechs Monaten nach dem Tag, an dem die Eintragung der Verschmelzung in das Register des Sitzes desjenigen Rechtsträgers, dessen Gläubiger sie sind, nach § 19 Absatz 3 UmwG als bekanntgemacht gilt, ihren Anspruch nach Grund und Höhe schriftlich anmelden, Sicherheit zu leisten, soweit sie nicht Befriedigung verlangen können. Dieses Recht steht den Gläubigern jedoch nur zu, wenn sie glaubhaft machen, dass durch die Verschmelzung die Erfüllung ihrer Forderung gefährdet wird."
    },
    {
      "date": "2026-02-19",
      "id": "145681",
      "original_text": "Einreichung neuer Dokumente\nNordrhein-Westfalen Amtsgericht Essen HRB 12983\nRGE Servicegesellschaft Essen mbH – Essen",
      "type": "Einreichung neuer Dokumente",
      "state": "Nordrhein-Westfalen",
      "amtsgericht": "Amtsgericht Essen",
      "registernummer": "HRB 12983",
      "registerart": "HRB",
      "company_name": "RGE Servicegesellschaft Essen mbH",
      "company_seat": "Essen",
      "details": "19.02.2026 (Bekanntmachungsdatum)\n\nNordrhein-Westfalen Amtsgericht Essen HRB 12983\nEinreichung neuer Dokumente\n\nRGE Servicegesellschaft Essen mbH\nGesellschaft mit beschränkter Haftung\nEssen\n\nDem Registergericht ist eine neue Liste der Mitglieder des Aufsichtsrates eingereicht worden."
    },
    {
      "date": "2026-02-19",
      "id": "145682",
      "original_text": "Registerbekanntmachung nach dem Umwandlungsgesetz\nNordrhein-Westfalen Amtsgericht Düsseldorf HRB 111132\nZentiva AG – Monheim am Rhein",
      "type": "Registerbekanntmachung nach dem Umwandlungsgesetz",
      "state": "Nordrhein-Westfalen",
      "amtsgericht": "Amtsgericht Düsseldorf",
      "registernummer": "HRB 111132",
      "registerart": "HRB",
      "company_name": "Zentiva AG",
      "company_seat": "Monheim am Rhein",
      "details": "19.02.2026 (Bekanntmachungsdatum)\n\nNordrhein-Westfalen Amtsgericht Düsseldorf HRB 111132\nRegisterbekanntmachung nach dem Umwandlungsgesetz 19.02.2026 (Eintragungsdatum)\n\nZentiva AG\nAktiengesellschaft\nMonheim am Rhein\n\nDen Gläubigern der an der formwechselnden Umwandlung beteiligten Rechtsträger ist, wenn sie binnen sechs Monaten nach dem Tag, an dem die Eintragung der formwechselnden Umwandlung in das Register des Sitzes desjenigen Rechtsträgers, dessen Gläubiger sie sind, nach § 19 Absatz 3 UmwG als bekanntgemacht gilt, ihren Anspruch nach Grund und Höhe schriftlich anmelden, Sicherheit zu leisten, soweit sie nicht Befriedigung verlangen können. Dieses Recht steht den Gläubigern jedoch nur zu, wenn sie glaubhaft machen, dass durch die formwechselnden Umwandlung die Erfüllung ihrer Forderung gefährdet wird."
    },
    {
      "date": "2026-02-19",
      "id": "145683",
      "original_text": "Löschungsankündigung\nNordrhein-Westfalen Amtsgericht Düren HRB 8949\nLIMA WAWAI UG (haftungsbeschränkt) – Düren",
      "type": "Löschungsankündigung",
      "state": "Nordrhein-Westfalen",
      "amtsgericht": "Amtsgericht Düren",
      "registernummer": "HRB 8949",
      "registerart": "HRB",
      "company_name": "LIMA WAWAI UG (haftungsbeschränkt)",
      "company_seat": "Düren",
      "details": "19.02.2026 (Bekanntmachungsdatum)\n\nNordrhein-Westfalen Amtsgericht Düren HRB 8949\nLöschungsankündigung\n\nLIMA WAWAI UG (haftungsbeschränkt)\nGesellschaft mit beschränkter Haftung\nDüren\n\nDas Registergericht beabsichtigt die Gesellschaft von Amts wegen nach § 394 FamFG zu löschen. Die Frist zur Erhebung eines Widerspruchs ist auf drei Monate festgesetzt."
    },
    {
      "date": "2026-02-19",
      "id": "145684",
      "original_text": "Löschungsankündigung\nNordrhein-Westfalen Amtsgericht Siegen HRB 13264\nMEH metal & pump GmbH – Siegen",
      "type": "Löschungsankündigung",
      "state": "Nordrhein-Westfalen",
      "amtsgericht": "Amtsgericht Siegen",
      "registernummer": "HRB 13264",
      "registerart": "HRB",
      "company_name": "MEH metal & pump GmbH",
      "company_seat": "Siegen",
      "details": "19.02.2026 (Bekanntmachungsdatum)\n\nNordrhein-Westfalen Amtsgericht Siegen HRB 13264\nLöschungsankündigung\n\nMEH metal & pump GmbH\nGesellschaft mit beschränkter Haftung\nSiegen\n\nDas Registergericht beabsichtigt die Gesellschaft von Amts wegen nach § 394 FamFG zu löschen. Die Frist zur Erhebung eines Widerspruchs ist auf drei Monate festgesetzt."
    },
    {
      "date": "2026-02-19",
      "id": "145685",
      "original_text": "Registerbekanntmachung nach dem Umwandlungsgesetz\nNordrhein-Westfalen Amtsgericht Düsseldorf HRB 63\nMesse Düsseldorf GmbH – Düsseldorf",
      "type": "Registerbekanntmachung nach dem Umwandlungsgesetz",
      "state": "Nordrhein-Westfalen",
      "amtsgericht": "Amtsgericht Düsseldorf",
      "registernummer": "HRB 63",
      "registerart": "HRB",
      "company_name": "Messe Düsseldorf GmbH",
      "company_seat": "Düsseldorf",
      "details": "19.02.2026 (Bekanntmachungsdatum)\n\nNordrhein-Westfalen Amtsgericht Düsseldorf HRB 63\nRegisterbekanntmachung nach dem Umwandlungsgesetz 19.02.2026 (Eintragungsdatum)\n\nMesse Düsseldorf GmbH\nGesellschaft mit beschränkter Haftung\nDüsseldorf\n\nDen Gläubigern der an der Verschmelzung beteiligten Rechtsträger ist, wenn sie binnen sechs Monaten nach dem Tag, an dem die Eintragung der Verschmelzung in das Register des Sitzes desjenigen Rechtsträgers, dessen Gläubiger sie sind, nach § 19 Absatz 3 UmwG als bekanntgemacht gilt, ihren Anspruch nach Grund und Höhe schriftlich anmelden, Sicherheit zu leisten, soweit sie nicht Befriedigung verlangen können. Dieses Recht steht den Gläubigern jedoch nur zu, wenn sie glaubhaft machen, dass durch die Verschmelzung die Erfüllung ihrer Forderung gefährdet wird."
    },
    {
      "date": "2026-02-19",
      "id": "145686",
      "original_text": "Registerbekanntmachung nach dem Umwandlungsgesetz\nThüringen Amtsgericht Jena HRB 518326\nL2AM GmbH – Jena",
      "type": "Registerbekanntmachung nach dem Umwandlungsgesetz",
      "state": "Thüringen",
      "amtsgericht": "Amtsgericht Jena",
      "registernummer": "HRB 518326",
      "registerart": "HRB",
      "company_name": "L2AM GmbH",
      "company_seat": "Jena",
      "details": "19.02.2026 (Bekanntmachungsdatum)\n\nThüringen Amtsgericht Jena HRB 518326\nRegisterbekanntmachung nach dem Umwandlungsgesetz 19.02.2026 (Eintragungsdatum)\n\nL2AM GmbH\nGesellschaft mit beschränkter Haftung\nJena\n\nNicht eingetragen: Den Gläubigern der an der Verschmelzung beteiligten Rechtsträger, ist wenn sie binnen sechs Monaten nach dem Tag, an dem die Eintragung der Verschmelzung in das Register des Sitzes desjenigen Rechtsträgers, dessen Gläubiger sie sind,  nach § 19 Abs. 3 UmwG als bekanntgemacht gilt, ihren Anspruch nach Grund und Höhe schriftlich anmelden, Sicherheit zu leisten, soweit sie nicht Befriedigung verlangen können. Dieses Recht steht ihnen jedoch nur zu, wenn sie glaubhaft machen, daß durch die Verschmelzung die Erfüllung ihrer Forderung gefährdet wird."
    },
    {
      "date": "2026-02-19",
      "id": "145687",
      "original_text": "Registerbekanntmachung nach dem Umwandlungsgesetz\nThüringen Amtsgericht Jena HRB 203078\nhewe fensterbau Mörsdorf GmbH – Mörsdorf",
      "type": "Registerbekanntmachung nach dem Umwandlungsgesetz",
      "state": "Thüringen",
      "amtsgericht": "Amtsgericht Jena",
      "registernummer": "HRB 203078",
      "registerart": "HRB",
      "company_name": "hewe fensterbau Mörsdorf GmbH",
      "company_seat": "Mörsdorf",
      "details": "19.02.2026 (Bekanntmachungsdatum)\n\nThüringen Amtsgericht Jena HRB 203078\nRegisterbekanntmachung nach dem Umwandlungsgesetz 19.02.2026 (Eintragungsdatum)\n\nhewe fensterbau Mörsdorf GmbH\nGesellschaft mit beschränkter Haftung\nMörsdorf\n\nNicht eingetragen: Den Gläubigern der an der Verschmelzung beteiligten Rechtsträger, ist wenn sie binnen sechs Monaten nach dem Tag, an dem die Eintragung der Verschmelzung in das Register des Sitzes desjenigen Rechtsträgers, dessen Gläubiger sie sind,  nach § 19 Abs. 3 UmwG als bekanntgemacht gilt, ihren Anspruch nach Grund und Höhe schriftlich anmelden, Sicherheit zu leisten, soweit sie nicht Befriedigung verlangen können. Dieses Recht steht ihnen jedoch nur zu, wenn sie glaubhaft machen, daß durch die Verschmelzung die Erfüllung ihrer Forderung gefährdet wird."
    },
    {
      "date": "2026-02-19",
      "id": "145688",
      "original_text": "Registerbekanntmachung nach dem Umwandlungsgesetz\nThüringen Amtsgericht Jena HRB 202020\nMathys Orthopädie GmbH – Mörsdorf",
      "type": "Registerbekanntmachung nach dem Umwandlungsgesetz",
      "state": "Thüringen",
      "amtsgericht": "Amtsgericht Jena",
      "registernummer": "HRB 202020",
      "registerart": "HRB",
      "company_name": "Mathys Orthopädie GmbH",
      "company_seat": "Mörsdorf",
      "details": "19.02.2026 (Bekanntmachungsdatum)\n\nThüringen Amtsgericht Jena HRB 202020\nRegisterbekanntmachung nach dem Umwandlungsgesetz 19.02.2026 (Eintragungsdatum)\n\nMathys Orthopädie GmbH\nGesellschaft mit beschränkter Haftung\nMörsdorf\n\nNicht eingetragen: Den Gläubigern der an der Verschmelzung beteiligten Rechtsträger, ist wenn sie binnen sechs Monaten nach dem Tag, an dem die Eintragung der Verschmelzung in das Register des Sitzes desjenigen Rechtsträgers, dessen Gläubiger sie sind,  nach § 19 Abs. 3 UmwG als bekanntgemacht gilt, ihren Anspruch nach Grund und Höhe schriftlich anmelden, Sicherheit zu leisten, soweit sie nicht Befriedigung verlangen können. Dieses Recht steht ihnen jedoch nur zu, wenn sie glaubhaft machen, daß durch die Verschmelzung die Erfüllung ihrer Forderung gefährdet wird."
    },
    {
      "date": "2026-02-19",
      "id": "145689",
      "original_text": "Löschungsankündigung\nBaden-Württemberg Amtsgericht Freiburg HRA 702100\nPower-Montage GmbH & Co. KG – Donaueschingen",
      "type": "Löschungsankündigung",
      "state": "Baden-Württemberg",
      "amtsgericht": "Amtsgericht Freiburg",
      "registernummer": "HRA 702100",
      "registerart": "HRA",
      "company_name": "Power-Montage GmbH & Co. KG",
      "company_seat": "Donaueschingen",
      "details": "19.02.2026 (Bekanntmachungsdatum)\n\nBaden-Württemberg Amtsgericht Freiburg HRA 702100\nLöschungsankündigung\n\nPower-Montage GmbH & Co. KG\nKommanditgesellschaft\nDonaueschingen\n\nAls nicht eingetragen wird bekanntgemacht:\nDas Gericht beabsichtigt, die Gesellschaft wegen Vermögenslosigkeit im Handelsregister von Amts wegen nach § 394 FamFG zu löschen. Die Frist zur Geltendmachung eines Widerspruchs gegen die beabsichtigte Löschung ist auf einen Monat ab Veröffentlichung bestimmt."
    },
    {
      "date": "2026-02-19",
      "id": "145690",
      "original_text": "Löschungsankündigung\nHessen Amtsgericht Wetzlar HRB 9582\nGB-KmT Holding Verwaltungs-UG (haftungsbeschränkt) – Dillenburg",
      "type": "Löschungsankündigung",
      "state": "Hessen",
      "amtsgericht": "Amtsgericht Wetzlar",
      "registernummer": "HRB 9582",
      "registerart": "HRB",
      "company_name": "GB-KmT Holding Verwaltungs-UG (haftungsbeschränkt)",
      "company_seat": "Dillenburg",
      "details": "19.02.2026 (Bekanntmachungsdatum)\n\nHessen Amtsgericht Wetzlar HRB 9582\nLöschungsankündigung\n\nGB-KmT Holding Verwaltungs-UG (haftungsbeschränkt)\nGesellschaft mit beschränkter Haftung\nDillenburg\n\nDas Registergericht beabsichtigt die im Handelsregister eingetragene Gesellschaft von Amts wegen nach § 394 FamFG zu löschen. Die Frist zur Erhebung eines Widerspruchs gegen die beabsichtigte Löschung wird auf 6 Wochen festgesetzt."
    },
    {
      "date": "2026-02-19",
      "id": "145691",
      "original_text": "Sonstige Registerbekanntmachung\nHessen Amtsgericht Eschwege HRB 2941\nDeutsches Rotes Kreuz Soziale Dienste Werra-Meißner gGmbH – Witzenhausen",
      "type": "Sonstige Registerbekanntmachung",
      "state": "Hessen",
      "amtsgericht": "Amtsgericht Eschwege",
      "registernummer": "HRB 2941",
      "registerart": "HRB",
      "company_name": "Deutsches Rotes Kreuz Soziale Dienste Werra-Meißner gGmbH",
      "company_seat": "Witzenhausen",
      "details": "19.02.2026 (Bekanntmachungsdatum)\n\nHessen Amtsgericht Eschwege HRB 2941\nSonstige Registerbekanntmachung 19.02.2026 (Eintragungsdatum)\n\nDeutsches Rotes Kreuz Soziale Dienste Werra-Meißner gGmbH\nGesellschaft mit beschränkter Haftung\nWitzenhausen\n\nDurch Änderungen in den Personen der Aufsichtsratsmitglieder sind Listen der Mitglieder des Aufsichtsrates zum Handelsregister eingereicht worden."
    },
    {
      "date": "2026-02-19",
      "id": "145692",
      "original_text": "Löschungsankündigung\nHessen Amtsgericht Wiesbaden HRB 29206\nQM-Serv-AIP GmbH – Hohenstein",
      "type": "Löschungsankündigung",
      "state": "Hessen",
      "amtsgericht": "Amtsgericht Wiesbaden",
      "registernummer": "HRB 29206",
      "registerart": "HRB",
      "company_name": "QM-Serv-AIP GmbH",
      "company_seat": "Hohenstein",
      "details": "19.02.2026 (Bekanntmachungsdatum)\n\nHessen Amtsgericht Wiesbaden HRB 29206\nLöschungsankündigung\n\nQM-Serv-AIP GmbH\nGesellschaft mit beschränkter Haftung\nHohenstein\n\nDas Registergericht beabsichtigt die im Handelsregister eingetragene Gesellschaft von Amts wegen nach § 394 FamFG zu löschen. Die Frist zur Erhebung eines Widerspruchs gegen die beabsichtigte Löschung wird auf 3 Monate festgesetzt."
    },
    {
      "date": "2026-02-19",
      "id": "145693",
      "original_text": "Einreichung neuer Dokumente\nHessen Amtsgericht Wetzlar HRB 13\nBosch Thermotechnik GmbH – Wetzlar",
      "type": "Einreichung neuer Dokumente",
      "state": "Hessen",
      "amtsgericht": "Amtsgericht Wetzlar",
      "registernummer": "HRB 13",
      "registerart": "HRB",
      "company_name": "Bosch Thermotechnik GmbH",
      "company_seat": "Wetzlar",
      "details": "19.02.2026 (Bekanntmachungsdatum)\n\nHessen Amtsgericht Wetzlar HRB 13\nEinreichung neuer Dokumente\n\nBosch Thermotechnik GmbH\nGesellschaft mit beschränkter Haftung\nWetzlar\n\nDurch eine Änderung in den Personen der Aufsichtsratsmitglieder ist eine Liste der Mitglieder des Aufsichtsrates zum Handelsregister eingereicht worden."
    },
    {
      "date": "2026-02-19",
      "id": "145694",
      "original_text": "Registerbekanntmachung nach dem Umwandlungsgesetz\nHessen Amtsgericht Frankfurt am Main HRB 90085\nLufthansa Cargo Aktiengesellschaft – Frankfurt am Main",
      "type": "Registerbekanntmachung nach dem Umwandlungsgesetz",
      "state": "Hessen",
      "amtsgericht": "Amtsgericht Frankfurt am Main",
      "registernummer": "HRB 90085",
      "registerart": "HRB",
      "company_name": "Lufthansa Cargo Aktiengesellschaft",
      "company_seat": "Frankfurt am Main",
      "details": "19.02.2026 (Bekanntmachungsdatum)\n\nHessen Amtsgericht Frankfurt am Main HRB 90085\nRegisterbekanntmachung nach dem Umwandlungsgesetz 19.02.2026 (Eintragungsdatum)\n\nLufthansa Cargo Aktiengesellschaft\nAktiengesellschaft\nFrankfurt am Main\n\nDie Gesellschaft hat den Entwurf des Abspaltungssvertrages zwischen ihr und der time:matters GmbH mit dem Sitz in Neu-Isenburg, eingetragen im Handelsregister\ndes Amtsgerichts Offenbach unter HRB 42983, zur Einsichtnahme eingereicht."
    },
    {
      "date": "2026-02-19",
      "id": "145695",
      "original_text": "Sonstige Registerbekanntmachung\nHessen Amtsgericht Frankfurt am Main HRB 8242\nHofheimer Wohnungsbaugesellschaft mit beschränkter Haftung – Hofheim am Taunus",
      "type": "Sonstige Registerbekanntmachung",
      "state": "Hessen",
      "amtsgericht": "Amtsgericht Frankfurt am Main",
      "registernummer": "HRB 8242",
      "registerart": "HRB",
      "company_name": "Hofheimer Wohnungsbaugesellschaft mit beschränkter Haftung",
      "company_seat": "Hofheim am Taunus",
      "details": "19.02.2026 (Bekanntmachungsdatum)\n\nHessen Amtsgericht Frankfurt am Main HRB 8242\nSonstige Registerbekanntmachung 19.02.2026 (Eintragungsdatum)\n\nHofheimer Wohnungsbaugesellschaft mit beschränkter Haftung\nGesellschaft mit beschränkter Haftung\nHofheim am Taunus\n\nDurch eine Änderung in den Personen der Aufsichtsratsmitglieder ist eine Liste der Mitglieder des Aufsichtsrates zum Handelsregister eingereicht worden."
    },
    {
      "date": "2026-02-19",
      "id": "145696",
      "original_text": "Registerbekanntmachung nach dem Umwandlungsgesetz\nHessen Amtsgericht Frankfurt am Main HRB 89293\nAMG Invest GmbH – Frankfurt am Main",
      "type": "Registerbekanntmachung nach dem Umwandlungsgesetz",
      "state": "Hessen",
      "amtsgericht": "Amtsgericht Frankfurt am Main",
      "registernummer": "HRB 89293",
      "registerart": "HRB",
      "company_name": "AMG Invest GmbH",
      "company_seat": "Frankfurt am Main",
      "details": "19.02.2026 (Bekanntmachungsdatum)\n\nHessen Amtsgericht Frankfurt am Main HRB 89293\nRegisterbekanntmachung nach dem Umwandlungsgesetz 19.02.2026 (Eintragungsdatum)\n\nAMG Invest GmbH\nGesellschaft mit beschränkter Haftung\nFrankfurt am Main\n\nDen Gläubigern der an der Verschmelzung beteiligten Rechtsträger ist, wenn sie binnen sechs Monaten nach dem Tag, an dem die Eintragung der Verschmelzung in das Register des Sitzes desjenigen Rechtsträgers, dessen Gläubiger sie sind, nach § 19 Absatz 3 UmwG bekannt gemacht worden ist, ihren Anspruch nach Grund und Höhe schriftlich anmelden, Sicherheit zu leisten, soweit sie nicht Befriedigung verlangen können. Dieses Recht steht den Gläubigern jedoch nur zu, wenn sie glaubhaft machen, dass durch die Verschmelzung die Erfüllung ihrer Forderung gefährdet wird."
    },
    {
      "date": "2026-02-19",
      "id": "145697",
      "original_text": "Löschungsankündigung\nHessen Amtsgericht Frankfurt am Main HRB 110716\nX-LINE MOTORS GmbH – Frankfurt am Main",
      "type": "Löschungsankündigung",
      "state": "Hessen",
      "amtsgericht": "Amtsgericht Frankfurt am Main",
      "registernummer": "HRB 110716",
      "registerart": "HRB",
      "company_name": "X-LINE MOTORS GmbH",
      "company_seat": "Frankfurt am Main",
      "details": "19.02.2026 (Bekanntmachungsdatum)\n\nHessen Amtsgericht Frankfurt am Main HRB 110716\nLöschungsankündigung 19.02.2026 (Eintragungsdatum)\n\nX-LINE MOTORS GmbH\nGesellschaft mit beschränkter Haftung\nFrankfurt am Main\n\nDas Registergericht beabsichtigt die im Handelsregister eingetragene Gesellschaft von Amts wegen nach § 394 FamFG zu löschen. Die Frist zur Erhebung eines Widerspruchs gegen die beabsichtigte Löschung wird auf 1 Monat festgesetzt."
    },
    {
      "date": "2026-02-19",
      "id": "145698",
      "original_text": "Registerbekanntmachung nach dem Umwandlungsgesetz\nHessen Amtsgericht Frankfurt am Main HRB 114333\nAMG Technologies GmbH – Frankfurt am Main",
      "type": "Registerbekanntmachung nach dem Umwandlungsgesetz",
      "state": "Hessen",
      "amtsgericht": "Amtsgericht Frankfurt am Main",
      "registernummer": "HRB 114333",
      "registerart": "HRB",
      "company_name": "AMG Technologies GmbH",
      "company_seat": "Frankfurt am Main",
      "details": "19.02.2026 (Bekanntmachungsdatum)\n\nHessen Amtsgericht Frankfurt am Main HRB 114333\nRegisterbekanntmachung nach dem Umwandlungsgesetz 19.02.2026 (Eintragungsdatum)\n\nAMG Technologies GmbH\nGesellschaft mit beschränkter Haftung\nFrankfurt am Main\n\nDen Gläubigern der an der Verschmelzung beteiligten Rechtsträger ist, wenn sie binnen sechs Monaten nach dem Tag, an dem die Eintragung der Verschmelzung in das Register des Sitzes desjenigen Rechtsträgers, dessen Gläubiger sie sind, nach § 19 Absatz 3 UmwG bekannt gemacht worden ist, ihren Anspruch nach Grund und Höhe schriftlich anmelden, Sicherheit zu leisten, soweit sie nicht Befriedigung verlangen können. Dieses Recht steht den Gläubigern jedoch nur zu, wenn sie glaubhaft machen, dass durch die Verschmelzung die Erfüllung ihrer Forderung gefährdet wird."
    },
    {
      "date": "2026-02-19",
      "id": "145699",
      "original_text": "Einreichung neuer Dokumente\nHessen Amtsgericht Wiesbaden HRB 23016\nMCE Bank GmbH – Flörsheim am Main",
      "type": "Einreichung neuer Dokumente",
      "state": "Hessen",
      "amtsgericht": "Amtsgericht Wiesbaden",
      "registernummer": "HRB 23016",
      "registerart": "HRB",
      "company_name": "MCE Bank GmbH",
      "company_seat": "Flörsheim am Main",
      "details": "19.02.2026 (Bekanntmachungsdatum)\n\nHessen Amtsgericht Wiesbaden HRB 23016\nEinreichung neuer Dokumente\n\nMCE Bank GmbH\nGesellschaft mit beschränkter Haftung\nFlörsheim am Main\n\nDurch eine Änderung in den Personen der Aufsichtsratsmitglieder ist eine Liste der Mitglieder des Aufsichtsrates zum Handelsregister eingereicht worden."
    },
    {
      "date": "2026-02-19",
      "id": "145700",
      "original_text": "Löschungsankündigung\nHessen Amtsgericht Darmstadt HRB 104226\nT&A Bahndienste UG (haftungsbeschränkt) – Darmstadt",
      "type": "Löschungsankündigung",
      "state": "Hessen",
      "amtsgericht": "Amtsgericht Darmstadt",
      "registernummer": "HRB 104226",
      "registerart": "HRB",
      "company_name": "T&A Bahndienste UG (haftungsbeschränkt)",
      "company_seat": "Darmstadt",
      "details": "19.02.2026 (Bekanntmachungsdatum)\n\nHessen Amtsgericht Darmstadt HRB 104226\nLöschungsankündigung\n\nT&A Bahndienste UG (haftungsbeschränkt)\nGesellschaft mit beschränkter Haftung\nDarmstadt\n\nDas Registergericht beabsichtigt die im Handelsregister eingetragene Gesellschaft von Amts wegen nach § 394 FamFG zu löschen. Die Frist zur Erhebung eines Widerspruchs gegen die beabsichtigte Löschung wird auf 3 Monate festgesetzt."
    },
    {
      "date": "2026-02-19",
      "id": "145701",
      "original_text": "Löschungsankündigung\nHessen Amtsgericht Wiesbaden HRB 31778\nEichenwald Verwaltung und Beteiligung GmbH – Oestrich-Winkel",
      "type": "Löschungsankündigung",
      "state": "Hessen",
      "amtsgericht": "Amtsgericht Wiesbaden",
      "registernummer": "HRB 31778",
      "registerart": "HRB",
      "company_name": "Eichenwald Verwaltung und Beteiligung GmbH",
      "company_seat": "Oestrich-Winkel",
      "details": "19.02.2026 (Bekanntmachungsdatum)\n\nHessen Amtsgericht Wiesbaden HRB 31778\nLöschungsankündigung\n\nEichenwald Verwaltung und Beteiligung GmbH\nGesellschaft mit beschränkter Haftung\nOestrich-Winkel\n\nDas Registergericht beabsichtigt die im Handelsregister eingetragene Gesellschaft von Amts wegen nach § 394 FamFG zu löschen. Die Frist zur Erhebung eines Widerspruchs gegen die beabsichtigte Löschung wird auf 3 Monate festgesetzt."
    },
    {
      "date": "2026-02-19",
      "id": "145702",
      "original_text": "Löschungsankündigung\nHessen Amtsgericht Frankfurt am Main HRB 90017\nBit Composer Online GmbH – Eschborn",
      "type": "Löschungsankündigung",
      "state": "Hessen",
      "amtsgericht": "Amtsgericht Frankfurt am Main",
      "registernummer": "HRB 90017",
      "registerart": "HRB",
      "company_name": "Bit Composer Online GmbH",
      "company_seat": "Eschborn",
      "details": "19.02.2026 (Bekanntmachungsdatum)\n\nHessen Amtsgericht Frankfurt am Main HRB 90017\nLöschungsankündigung\n\nBit Composer Online GmbH\nGesellschaft mit beschränkter Haftung\nEschborn\n\nEs ist beabsichtigt, die Gesellschaft wegen Vermögenslosigkeit gemäß § 394 FamFG von Amts wegen\nim Handelsregister zu löschen.\nHiergegen kann binnen 1 Monats Widerspruch beim Amtsgericht Frankfurt am Main eingelegt werden."
    },
    {
      "date": "2026-02-19",
      "id": "145703",
      "original_text": "Sonstige Registerbekanntmachung\nHessen Amtsgericht Gießen VR 2915\nKneipp-Verein Romrod e.V. – Romrod",
      "type": "Sonstige Registerbekanntmachung",
      "state": "Hessen",
      "amtsgericht": "Amtsgericht Gießen",
      "registernummer": "VR 2915",
      "registerart": "VR",
      "company_name": "Kneipp-Verein Romrod e.V.",
      "company_seat": "Romrod",
      "details": "19.02.2026 (Bekanntmachungsdatum)\n\nHessen Amtsgericht Gießen VR 2915\nSonstige Registerbekanntmachung 19.02.2026 (Eintragungsdatum)\n\nKneipp-Verein Romrod e.V.\neingetragener Verein\nRomrod\n\nDer Verein ist aufgelöst."
    },
    {
      "date": "2026-02-19",
      "id": "145704",
      "original_text": "Löschungsankündigung\nHessen Amtsgericht Frankfurt am Main HRB 128461\nOpus Bau- und Sanierungsgesellschaft mbH – Frankfurt am Main",
      "type": "Löschungsankündigung",
      "state": "Hessen",
      "amtsgericht": "Amtsgericht Frankfurt am Main",
      "registernummer": "HRB 128461",
      "registerart": "HRB",
      "company_name": "Opus Bau- und Sanierungsgesellschaft mbH",
      "company_seat": "Frankfurt am Main",
      "details": "19.02.2026 (Bekanntmachungsdatum)\n\nHessen Amtsgericht Frankfurt am Main HRB 128461\nLöschungsankündigung\n\nOpus Bau- und Sanierungsgesellschaft mbH\nGesellschaft mit beschränkter Haftung\nFrankfurt am Main\n\nEs ist beabsichtigt, die Gesellschaft wegen Vermögenslosigkeit gemäß § 394 FamFG von Amts wegen im Handelsregister zu löschen. Hiergegen kann innerhalb eines Monats nach dieser Veröffentlichung Widerspruch bei dem Amtsgericht Frankfurt am Main eingelegt werden."
    },
    {
      "date": "2026-02-19",
      "id": "145705",
      "original_text": "Löschungsankündigung\nHessen Amtsgericht Hanau HRB 93679\nGKT Consulting Center GmbH – Hanau",
      "type": "Löschungsankündigung",
      "state": "Hessen",
      "amtsgericht": "Amtsgericht Hanau",
      "registernummer": "HRB 93679",
      "registerart": "HRB",
      "company_name": "GKT Consulting Center GmbH",
      "company_seat": "Hanau",
      "details": "19.02.2026 (Bekanntmachungsdatum)\n\nHessen Amtsgericht Hanau HRB 93679\nLöschungsankündigung\n\nGKT Consulting Center GmbH\nGesellschaft mit beschränkter Haftung\nHanau\n\nDas Registergericht beabsichtigt die im Handelsregister eingetragene Gesellschaft von Amts wegen nach § 394 FamFG zu löschen. Die Frist zur Erhebung eines Widerspruchs gegen die beabsichtigte Löschung wird auf 3 Monate festgesetzt."
    },
    {
      "date": "2026-02-19",
      "id": "145706",
      "original_text": "Löschungsankündigung\nHessen Amtsgericht Frankfurt am Main HRA 47790\nAdaMas 6 WS GmbH & Co. KG – Frankfurt am Main",
      "type": "Löschungsankündigung",
      "state": "Hessen",
      "amtsgericht": "Amtsgericht Frankfurt am Main",
      "registernummer": "HRA 47790",
      "registerart": "HRA",
      "company_name": "AdaMas 6 WS GmbH & Co. KG",
      "company_seat": "Frankfurt am Main",
      "details": "19.02.2026 (Bekanntmachungsdatum)\n\nHessen Amtsgericht Frankfurt am Main HRA 47790\nLöschungsankündigung\n\nAdaMas 6 WS GmbH & Co. KG\nKommanditgesellschaft\nFrankfurt am Main\n\nDas Registergericht beabsichtigt die im Handelsregister eingetragene Firma von Amts wegen nach § 394 FamFG zu löschen. Die Frist zur Erhebung eines Widerspruchs gegen die beabsichtigte Löschung wird auf 1 Monate festgesetzt."
    },
    {
      "date": "2026-02-19",
      "id": "145707",
      "original_text": "Löschungsankündigung\nHessen Amtsgericht Frankfurt am Main HRB 124713\nAlgorithm Template GmbH – Frankfurt am Main",
      "type": "Löschungsankündigung",
      "state": "Hessen",
      "amtsgericht": "Amtsgericht Frankfurt am Main",
      "registernummer": "HRB 124713",
      "registerart": "HRB",
      "company_name": "Algorithm Template GmbH",
      "company_seat": "Frankfurt am Main",
      "details": "19.02.2026 (Bekanntmachungsdatum)\n\nHessen Amtsgericht Frankfurt am Main HRB 124713\nLöschungsankündigung 10.10.2025 (Eintragungsdatum)\n\nAlgorithm Template GmbH\nGesellschaft mit beschränkter Haftung\nFrankfurt am Main\n\nEs ist beabsichtigt, die Gesellschaft wegen Vermögenslosigkeit gemäß § 394 FamFG von Amts wegen\nim Handelsregister zu löschen.\nHiergegen kann binnen 3 Monaten Widerspruch beim Amtsgericht Frankfurt am Main eingelegt werden."
    }
  ]
}