{
  "date": "2026-02-02",
  "date_of_scrape": "2026-02-03T04:38:31.357Z",
  "tool_version": "0.2.0",
  "number_of_announcements": 92,
  "announcements": [
    {
      "date": "2026-02-02",
      "id": "144031",
      "original_text": "Löschungsankündigung\nSaarland Amtsgericht Saarbrücken HRB 107453\nBlaumanns UG (haftungsbeschränkt) – St. Ingbert",
      "type": "Löschungsankündigung",
      "state": "Saarland",
      "amtsgericht": "Amtsgericht Saarbrücken",
      "registernummer": "HRB 107453",
      "registerart": "HRB",
      "company_name": "Blaumanns UG (haftungsbeschränkt)",
      "company_seat": "St. Ingbert",
      "details": "02.02.2026 (Bekanntmachungsdatum)\n\nSaarland Amtsgericht Saarbrücken HRB 107453\nLöschungsankündigung\n\nBlaumanns UG (haftungsbeschränkt)\nGesellschaft mit beschränkter Haftung\nSt. Ingbert\n\nEs ist beabsichtigt, die Gesellschaft von Amts wegen gemäß § 394 FamFG wegen Vermögenslosigkeit zu löschen.\nGegen die Löschung von Amts wegen ist das Rechtsmittel des Widerspruchs statthaft. Der Widerspruch ist binnen einer Frist zwei Monaten beginnend mit dem Tag dieser Veröffentlichung durch Einreichen eines Widerspruchsschreibens -schriftlich oder zur Niederschrift der Geschäftsstelle beim Amtsgericht Saarbrücken, -zentrales Handelsregister-, Mainzerstr.178, 66121 Saarbrücken einzulegen.\nDer Widerspruch muss die Bezeichnung der angefochtenen Löschungsankündigung enthalten sowie die Erklärung, dass Widerspruch eingelegt wird. Er ist vom Widerspruchsführer oder seinem Bevollmächtigten zu unterzeichnen.\nDas Widerspruchsschreiben kann auch in der Form eines elektronischen Dokumentes eingereicht werden, das mit einer qualifizierten elektronischen Signatur nach dem Signaturgesetz versehen sein muss (§§ 14 Abs. 2 FamFG, 130a, 298 ZPO)."
    },
    {
      "date": "2026-02-02",
      "id": "144032",
      "original_text": "Registerbekanntmachung nach dem Umwandlungsgesetz\nSaarland Amtsgericht Saarbrücken HRB 15906\nCorvis Holding GmbH – Ottweiler",
      "type": "Registerbekanntmachung nach dem Umwandlungsgesetz",
      "state": "Saarland",
      "amtsgericht": "Amtsgericht Saarbrücken",
      "registernummer": "HRB 15906",
      "registerart": "HRB",
      "company_name": "Corvis Holding GmbH",
      "company_seat": "Ottweiler",
      "details": "02.02.2026 (Bekanntmachungsdatum)\n\nSaarland Amtsgericht Saarbrücken HRB 15906\nRegisterbekanntmachung nach dem Umwandlungsgesetz 02.02.2026 (Eintragungsdatum)\n\nCorvis Holding GmbH\nGesellschaft mit beschränkter Haftung\nOttweiler\n\nAls nicht eingetragen wird bekannt gemacht: Den Gläubigern der an der Verschmelzung beteiligten Gesellschaften ist, wenn sie binnen sechs Monaten nach dem Tag, an dem die Eintragung der Verschmelzung in das Register des Sitzes derjenigen Rechtsträger deren Gläubiger sie sind, nach § 19 Absatz 3 UmwG bekannt gemacht worden ist, ihren Anspruch nach Grund und Höhe schriftlich anmelden, Sicherheit zu leisten, soweit sie nicht Befriedigung verlangen können. Dieses Recht steht den Gläubigern jedoch nur zu, wenn sie glaubhaft machen, dass durch die Verschmelzung die Erfüllung ihrer Forderung gefährdet wird."
    },
    {
      "date": "2026-02-02",
      "id": "144033",
      "original_text": "Registerbekanntmachung nach dem Umwandlungsgesetz\nSaarland Amtsgericht Saarbrücken HRB 101433\nCorvis Management Verwaltungs GmbH – Ottweiler",
      "type": "Registerbekanntmachung nach dem Umwandlungsgesetz",
      "state": "Saarland",
      "amtsgericht": "Amtsgericht Saarbrücken",
      "registernummer": "HRB 101433",
      "registerart": "HRB",
      "company_name": "Corvis Management Verwaltungs GmbH",
      "company_seat": "Ottweiler",
      "details": "02.02.2026 (Bekanntmachungsdatum)\n\nSaarland Amtsgericht Saarbrücken HRB 101433\nRegisterbekanntmachung nach dem Umwandlungsgesetz 02.02.2026 (Eintragungsdatum)\n\nCorvis Management Verwaltungs GmbH\nGesellschaft mit beschränkter Haftung\nOttweiler\n\nAls nicht eingetragen wird bekannt gemacht: Den Gläubigern der an der Verschmelzung beteiligten Gesellschaften ist, wenn sie binnen sechs Monaten nach dem Tag, an dem die Eintragung der Verschmelzung in das Register des Sitzes derjenigen Rechtsträger deren Gläubiger sie sind, nach § 19 Absatz 3 UmwG bekannt gemacht worden ist, ihren Anspruch nach Grund und Höhe schriftlich anmelden, Sicherheit zu leisten, soweit sie nicht Befriedigung verlangen können. Dieses Recht steht den Gläubigern jedoch nur zu, wenn sie glaubhaft machen, dass durch die Verschmelzung die Erfüllung ihrer Forderung gefährdet wird."
    },
    {
      "date": "2026-02-02",
      "id": "144034",
      "original_text": "Registerbekanntmachung nach dem Umwandlungsgesetz\nSchleswig-Holstein Amtsgericht Kiel HRB 29012\nCaterpillar Investment GmbH – Kiel",
      "type": "Registerbekanntmachung nach dem Umwandlungsgesetz",
      "state": "Schleswig-Holstein",
      "amtsgericht": "Amtsgericht Kiel",
      "registernummer": "HRB 29012",
      "registerart": "HRB",
      "company_name": "Caterpillar Investment GmbH",
      "company_seat": "Kiel",
      "details": "02.02.2026 (Bekanntmachungsdatum)\n\nSchleswig-Holstein Amtsgericht Kiel HRB 29012\nRegisterbekanntmachung nach dem Umwandlungsgesetz 28.01.2026 (Eintragungsdatum)\n\nCaterpillar Investment GmbH\nGesellschaft mit beschränkter Haftung\nKiel\n\nAls nicht eingetragen wird veröffentlicht: Den Gläubigern ist, wenn sie binnen sechs Monaten nach dem Tag, an dem die Eintragung der Umwandlung bekannt gemacht worden ist, ihren Anspruch nach Grund und Höhe schriftlich anmelden, Sicherheit zu leisten, soweit sie nicht Befriedigung verlangen können. Dieses Recht steht den Gläubigern jedoch nur zu, wenn sie glaubhaft machen, dass durch die Umwandlung die Erfüllung ihrer Forderung gefährdet wird."
    },
    {
      "date": "2026-02-02",
      "id": "144035",
      "original_text": "Registerbekanntmachung nach dem Umwandlungsgesetz\nHamburg Amtsgericht Hamburg HRB 158290\nSmart Healthcare Solutions GmbH – Hamburg",
      "type": "Registerbekanntmachung nach dem Umwandlungsgesetz",
      "state": "Hamburg",
      "amtsgericht": "Amtsgericht Hamburg",
      "registernummer": "HRB 158290",
      "registerart": "HRB",
      "company_name": "Smart Healthcare Solutions GmbH",
      "company_seat": "Hamburg",
      "details": "02.02.2026 (Bekanntmachungsdatum)\n\nHamburg Amtsgericht Hamburg HRB 158290\nRegisterbekanntmachung nach dem Umwandlungsgesetz 02.02.2026 (Eintragungsdatum)\n\nSmart Healthcare Solutions GmbH\nGesellschaft mit beschränkter Haftung\nHamburg\n\nAls nicht eingetragen wird bekannt gemacht:\nDen Gläubigern der an der Verschmelzung beteiligten Gesellschaften ist, wenn sie binnen sechs Monaten nach dem Tag, an dem die Eintragung der Verschmelzung in das Register des Sitzes desjenigen Rechtsträgers, dessen Gläubiger sie sind, nach § 19 Absatz 3 UmwG als bekannt gemacht gilt, ihren Anspruch nach Grund und Höhe schriftlich anmelden, Sicherheit zu leisten, soweit sie nicht Befriedigung verlangen können. Dieses Recht steht den Gläubigern jedoch nur zu, wenn sie glaubhaft machen, dass durch die Verschmelzung die Erfüllung ihrer Forderung gefährdet wird."
    },
    {
      "date": "2026-02-02",
      "id": "144036",
      "original_text": "Löschungsankündigung\nBrandenburg Amtsgericht Potsdam HRB 26499\nSense Convent Hotel Michendorf GmbH – Michendorf",
      "type": "Löschungsankündigung",
      "state": "Brandenburg",
      "amtsgericht": "Amtsgericht Potsdam",
      "registernummer": "HRB 26499",
      "registerart": "HRB",
      "company_name": "Sense Convent Hotel Michendorf GmbH",
      "company_seat": "Michendorf",
      "details": "02.02.2026 (Bekanntmachungsdatum)\n\nBrandenburg Amtsgericht Potsdam HRB 26499\nLöschungsankündigung\n\nSense Convent Hotel Michendorf GmbH\nGesellschaft mit beschränkter Haftung\nMichendorf\n\nBei der nachstehenden Gesellschaft wird das Amtslöschungsverfahren gemäß § 394 FamFG eingeleitet. Widerspruchsfrist 8 Wochen."
    },
    {
      "date": "2026-02-02",
      "id": "144037",
      "original_text": "Löschungsankündigung\nBrandenburg Amtsgericht Potsdam HRB 34178\nSFB Kompakt GmbH – Zossen",
      "type": "Löschungsankündigung",
      "state": "Brandenburg",
      "amtsgericht": "Amtsgericht Potsdam",
      "registernummer": "HRB 34178",
      "registerart": "HRB",
      "company_name": "SFB Kompakt GmbH",
      "company_seat": "Zossen",
      "details": "02.02.2026 (Bekanntmachungsdatum)\n\nBrandenburg Amtsgericht Potsdam HRB 34178\nLöschungsankündigung\n\nSFB Kompakt GmbH\nGesellschaft mit beschränkter Haftung\nZossen\n\nBei der nachstehenden Gesellschaft wird das Amtslöschungsverfahren gemäß § 394 FamFG eingeleitet. Widerspruchsfrist: 8 Wochen."
    },
    {
      "date": "2026-02-02",
      "id": "144038",
      "original_text": "Registerbekanntmachung nach dem Umwandlungsgesetz\nMecklenburg-Vorpommern Amtsgericht Schwerin HRB 14509\nBIOCEN AG & Co. KGaA – Wismar",
      "type": "Registerbekanntmachung nach dem Umwandlungsgesetz",
      "state": "Mecklenburg-Vorpommern",
      "amtsgericht": "Amtsgericht Schwerin",
      "registernummer": "HRB 14509",
      "registerart": "HRB",
      "company_name": "BIOCEN AG & Co. KGaA",
      "company_seat": "Wismar",
      "details": "02.02.2026 (Bekanntmachungsdatum)\n\nMecklenburg-Vorpommern Amtsgericht Schwerin HRB 14509\nRegisterbekanntmachung nach dem Umwandlungsgesetz 02.02.2026 (Eintragungsdatum)\n\nBIOCEN AG & Co. KGaA\nKommanditgesellschaft auf Aktien\nWismar\n\nDen Gläubigern der am Formwechsel beteiligten Rechtsträger ist, wenn sie binnen sechs Monaten nach dem Tag, an dem die Eintragung des Formwechsels in das Register des Sitzes desjenigen Rechtsträgers, dessen Gläubiger sie sind, nach § 201 UmwG als bekanntgemacht gilt, ihren Anspruch nach Grund und Höhe schriftlich anmelden, Sicherheit zu leisten, soweit sie nicht Befriedigung verlangen können. Dieses Recht steht den Gläubigern jedoch nur zu, wenn sie glaubhaft machen, dass durch den Formwechsel die Erfüllung ihrer Forderung gefährdet wird."
    },
    {
      "date": "2026-02-02",
      "id": "144039",
      "original_text": "Registerbekanntmachung nach dem Umwandlungsgesetz\nMecklenburg-Vorpommern Amtsgericht Schwerin HRB 15475\nBiocen Beteiligungsgesellschaft mbH – Wismar",
      "type": "Registerbekanntmachung nach dem Umwandlungsgesetz",
      "state": "Mecklenburg-Vorpommern",
      "amtsgericht": "Amtsgericht Schwerin",
      "registernummer": "HRB 15475",
      "registerart": "HRB",
      "company_name": "Biocen Beteiligungsgesellschaft mbH",
      "company_seat": "Wismar",
      "details": "02.02.2026 (Bekanntmachungsdatum)\n\nMecklenburg-Vorpommern Amtsgericht Schwerin HRB 15475\nRegisterbekanntmachung nach dem Umwandlungsgesetz 02.02.2026 (Eintragungsdatum)\n\nBiocen Beteiligungsgesellschaft mbH\nGesellschaft mit beschränkter Haftung\nWismar\n\nDen Gläubigern der am Formwechsel beteiligten Rechtsträger ist, wenn sie binnen sechs Monaten nach dem Tag, an dem die Eintragung des Formwechsels in das Register des Sitzes desjenigen Rechtsträgers, dessen Gläubiger sie sind, nach § 201 UmwG als bekanntgemacht gilt, ihren Anspruch nach Grund und Höhe schriftlich anmelden, Sicherheit zu leisten, soweit sie nicht Befriedigung verlangen können. Dieses Recht steht den Gläubigern jedoch nur zu, wenn sie glaubhaft machen, dass durch den Formwechsel die Erfüllung ihrer Forderung gefährdet wird."
    },
    {
      "date": "2026-02-02",
      "id": "144040",
      "original_text": "Löschungsankündigung\nBerlin Amtsgericht Berlin (Charlottenburg) HRB 220891\nBBB Gastro GmbH – Berlin",
      "type": "Löschungsankündigung",
      "state": "Berlin",
      "amtsgericht": "Amtsgericht Berlin (Charlottenburg)",
      "registernummer": "HRB 220891",
      "registerart": "HRB",
      "company_name": "BBB Gastro GmbH",
      "company_seat": "Berlin",
      "details": "02.02.2026 (Bekanntmachungsdatum)\n\nBerlin Amtsgericht Berlin (Charlottenburg) HRB 220891\nLöschungsankündigung\n\nBBB Gastro GmbH\nGesellschaft mit beschränkter Haftung\nBerlin\n\nBei der nachstehenden Gesellschaft wird das Amtslöschungsverfahren gemäß § 394 FamFG eingeleitet. Widerspruchsfrist 6 Wochen"
    },
    {
      "date": "2026-02-02",
      "id": "144041",
      "original_text": "Registerbekanntmachung nach dem Umwandlungsgesetz\nSchleswig-Holstein Amtsgericht Lübeck HRB 1436 RZ\nclaus rodenberg waldkontor gmbh – Kastorf",
      "type": "Registerbekanntmachung nach dem Umwandlungsgesetz",
      "state": "Schleswig-Holstein",
      "amtsgericht": "Amtsgericht Lübeck",
      "registernummer": "HRB 1436 RZ",
      "registerart": "HRB",
      "company_name": "claus rodenberg waldkontor gmbh",
      "company_seat": "Kastorf",
      "details": "02.02.2026 (Bekanntmachungsdatum)\n\nSchleswig-Holstein Amtsgericht Lübeck HRB 1436 RZ\nRegisterbekanntmachung nach dem Umwandlungsgesetz 30.01.2026 (Eintragungsdatum)\n\nclaus rodenberg waldkontor gmbh\nGesellschaft mit beschränkter Haftung\nKastorf\n\nZu Eintragungsnummer 8 vom 30.01.2026 wird als nicht eingetragen veröffentlicht:\nDen Gläubigern ist, wenn sie binnen sechs Monaten nach dem Tag, an dem die Eintragung der Umwandlung als bekannt gemacht gilt, ihren Anspruch nach Grund und Höhe schriftlich anmelden, Sicherheit zu leisten, soweit sie nicht Befriedigung verlangen können. Dieses Recht steht den Gläubigern jedoch nur zu, wenn sie glaubhaft machen, dass durch die Umwandlung die Erfüllung ihrer Forderung gefährdet wird."
    },
    {
      "date": "2026-02-02",
      "id": "144042",
      "original_text": "Sonstige Registerbekanntmachung\nBerlin Amtsgericht Berlin (Charlottenburg) HRB 221538\nDAH Photovoltaik 5. GmbH – Berlin",
      "type": "Sonstige Registerbekanntmachung",
      "state": "Berlin",
      "amtsgericht": "Amtsgericht Berlin (Charlottenburg)",
      "registernummer": "HRB 221538",
      "registerart": "HRB",
      "company_name": "DAH Photovoltaik 5. GmbH",
      "company_seat": "Berlin",
      "details": "02.02.2026 (Bekanntmachungsdatum)\n\nBerlin Amtsgericht Berlin (Charlottenburg) HRB 221538\nSonstige Registerbekanntmachung 30.01.2026 (Eintragungsdatum)\n\nDAH Photovoltaik 5. GmbH\nGesellschaft mit beschränkter Haftung\nBerlin\n\nAls nicht eingetragen wird veröffentlicht: Der andere Vertragsteil hat den Gläubigern dieses Rechtsträgers, deren Forderungen begründet worden sind, bevor die Eintragung der Beendigung dieses Vertrages in das Handelsregister nach § 10 des Handelsgesetzbuches als bekannt gemacht gilt, Sicherheit zu leisten, wenn sie sich binnen sechs Monaten nach der Bekanntmachung der Eintragung zu diesem Zweck bei ihm melden. Dieses Recht steht den Gläubigern nicht zu, die im Fall des Insolvenzverfahrens ein Recht auf vorzugsweise Befriedigung aus der Deckungsmasse haben, die nach gesetzlicher Vorschrift zu ihrem Schutz errichtet und staatlich überwacht ist."
    },
    {
      "date": "2026-02-02",
      "id": "144043",
      "original_text": "Einreichung neuer Dokumente\nBaden-Württemberg Amtsgericht Freiburg HRB 5943\nCerdia Produktions GmbH – Freiburg im Breisgau",
      "type": "Einreichung neuer Dokumente",
      "state": "Baden-Württemberg",
      "amtsgericht": "Amtsgericht Freiburg",
      "registernummer": "HRB 5943",
      "registerart": "HRB",
      "company_name": "Cerdia Produktions GmbH",
      "company_seat": "Freiburg im Breisgau",
      "details": "02.02.2026 (Bekanntmachungsdatum)\n\nBaden-Württemberg Amtsgericht Freiburg HRB 5943\nEinreichung neuer Dokumente 02.02.2026 (Eintragungsdatum)\n\nCerdia Produktions GmbH\nGesellschaft mit beschränkter Haftung\nFreiburg im Breisgau\n\nAls nicht eingetragen wird bekanntgemacht:\nDie Gesellschaft hat am 30.01.2026 die Liste über die Zusammensetzung des Aufsichtsrats zum Handelsregister eingereicht."
    },
    {
      "date": "2026-02-02",
      "id": "144044",
      "original_text": "Einreichung neuer Dokumente\nBaden-Württemberg Amtsgericht Stuttgart HRB 771782\nHeller Management SE – Nürtingen",
      "type": "Einreichung neuer Dokumente",
      "state": "Baden-Württemberg",
      "amtsgericht": "Amtsgericht Stuttgart",
      "registernummer": "HRB 771782",
      "registerart": "HRB",
      "company_name": "Heller Management SE",
      "company_seat": "Nürtingen",
      "details": "02.02.2026 (Bekanntmachungsdatum)\n\nBaden-Württemberg Amtsgericht Stuttgart HRB 771782\nEinreichung neuer Dokumente 02.02.2026 (Eintragungsdatum)\n\nHeller Management SE\nEuropäische Aktiengesellschaft (SE)\nNürtingen\n\nDie Gesellschaft hat am 30.01.2026 die Liste über die Zusammensetzung des Aufsichtsrats zum Handelsregister eingereicht."
    },
    {
      "date": "2026-02-02",
      "id": "144045",
      "original_text": "Einreichung neuer Dokumente\nSaarland Amtsgericht Saarbrücken HRB 17782\nStadtwerke Dillingen/Saar Netzgesellschaft mbH – Dillingen/Saar",
      "type": "Einreichung neuer Dokumente",
      "state": "Saarland",
      "amtsgericht": "Amtsgericht Saarbrücken",
      "registernummer": "HRB 17782",
      "registerart": "HRB",
      "company_name": "Stadtwerke Dillingen/Saar Netzgesellschaft mbH",
      "company_seat": "Dillingen/Saar",
      "details": "02.02.2026 (Bekanntmachungsdatum)\n\nSaarland Amtsgericht Saarbrücken HRB 17782\nEinreichung neuer Dokumente\n\nStadtwerke Dillingen/Saar Netzgesellschaft mbH\nGesellschaft mit beschränkter Haftung\nDillingen/Saar\n\nDie Geschäftsführung der Gesellschaft hat eine Liste der Mitglieder des Aufsichtsrats zum Handelsregister eingereicht (§ 52 Abs. 3 Satz 2 GmbHG)."
    },
    {
      "date": "2026-02-02",
      "id": "144046",
      "original_text": "Einreichung neuer Dokumente\nSchleswig-Holstein Amtsgericht Flensburg HRB 5581\nDiakonisches Werk Südtondern gGmbH – Niebüll",
      "type": "Einreichung neuer Dokumente",
      "state": "Schleswig-Holstein",
      "amtsgericht": "Amtsgericht Flensburg",
      "registernummer": "HRB 5581",
      "registerart": "HRB",
      "company_name": "Diakonisches Werk Südtondern gGmbH",
      "company_seat": "Niebüll",
      "details": "02.02.2026 (Bekanntmachungsdatum)\n\nSchleswig-Holstein Amtsgericht Flensburg HRB 5581\nEinreichung neuer Dokumente\n\nDiakonisches Werk Südtondern gGmbH\nGesellschaft mit beschränkter Haftung\nNiebüll\n\nNeue Aufsichtsratsliste nach Änderung eingereicht am 30.01.2026."
    },
    {
      "date": "2026-02-02",
      "id": "144047",
      "original_text": "Einreichung neuer Dokumente\nHamburg Amtsgericht Hamburg HRB 134509\nNASCO Energie & Rohstoff AG – Hamburg",
      "type": "Einreichung neuer Dokumente",
      "state": "Hamburg",
      "amtsgericht": "Amtsgericht Hamburg",
      "registernummer": "HRB 134509",
      "registerart": "HRB",
      "company_name": "NASCO Energie & Rohstoff AG",
      "company_seat": "Hamburg",
      "details": "02.02.2026 (Bekanntmachungsdatum)\n\nHamburg Amtsgericht Hamburg HRB 134509\nEinreichung neuer Dokumente 02.02.2026 (Eintragungsdatum)\n\nNASCO Energie & Rohstoff AG\nAktiengesellschaft\nHamburg\n\nAls nicht eingetragen wird bekannt gemacht:\nDer Vorstand hat mit Beschluss vom 19.11.2025 mit Zustimmung des Aufsichtsrats vom 19.11.2025 unter Ausnutzung der von der Hauptversammlung der Gesellschaft am 13. Dezember 2023 beschlossenen Ermächtigung eine Wandelschuldverschreibung im Gesamtnennbetrag von bis zu EUR 8.000.000,00 ausgegeben.\nDen Aktionären wurde ein Bezugsrecht in Form eines mittelbaren Bezugsrechts gewährt. Hierzu wurde die Bankhaus Gebrüder Martin AG, Schlossplatz 7, 73033 Göppingen zum Bezug der Schuldverschreibungen mit der Verpflichtung zugelassen, diese den Aktionären zum Bezug anzubieten. Es werden Wandlungsrechte auf insgesamt bis zu 720.000 neue Aktien zu einem anfänglichen Wandlungspreis von EUR 10,55 je Aktie gewährt. Wegen der näheren Einzelheiten wird auf die zur Hinterlegung eingereichten Beschlüsse verwiesen."
    },
    {
      "date": "2026-02-02",
      "id": "144048",
      "original_text": "Registerbekanntmachung nach dem Umwandlungsgesetz\nBaden-Württemberg Amtsgericht Freiburg HRB 712182\nKrematorium Südbaden GmbH – Eschbach",
      "type": "Registerbekanntmachung nach dem Umwandlungsgesetz",
      "state": "Baden-Württemberg",
      "amtsgericht": "Amtsgericht Freiburg",
      "registernummer": "HRB 712182",
      "registerart": "HRB",
      "company_name": "Krematorium Südbaden GmbH",
      "company_seat": "Eschbach",
      "details": "02.02.2026 (Bekanntmachungsdatum)\n\nBaden-Württemberg Amtsgericht Freiburg HRB 712182\nRegisterbekanntmachung nach dem Umwandlungsgesetz 02.02.2026 (Eintragungsdatum)\n\nKrematorium Südbaden GmbH\nGesellschaft mit beschränkter Haftung\nEschbach\n\nAls nicht eingetragen wird bekanntgemacht:\nDen Gläubigern der an der Ausgliederung beteiligten Rechtsträger ist, wenn sie binnen sechs Monaten nach dem Tag, an dem die Eintragung der Ausgliederung in das Register des Sitzes desjenigen Rechtsträgers, dessen Gläubiger sie sind, nach § 19 Abs. 3 UmwG als bekanntgemacht gilt, ihren Anspruch nach Grund und Höhe schriftlich anmelden, Sicherheit zu leisten, soweit sie nicht Befriedigung verlangen können. Dieses Recht steht den Gläubigern jedoch nur zu, wenn sie glaubhaft machen, dass durch die Ausgliederung die Erfüllung ihrer Forderung gefährdet wird."
    },
    {
      "date": "2026-02-02",
      "id": "144049",
      "original_text": "Registerbekanntmachung nach dem Umwandlungsgesetz\nSchleswig-Holstein Amtsgericht Kiel HRB 20205\nTG Holding GmbH – Hasenkrug",
      "type": "Registerbekanntmachung nach dem Umwandlungsgesetz",
      "state": "Schleswig-Holstein",
      "amtsgericht": "Amtsgericht Kiel",
      "registernummer": "HRB 20205",
      "registerart": "HRB",
      "company_name": "TG Holding GmbH",
      "company_seat": "Hasenkrug",
      "details": "02.02.2026 (Bekanntmachungsdatum)\n\nSchleswig-Holstein Amtsgericht Kiel HRB 20205\nRegisterbekanntmachung nach dem Umwandlungsgesetz 28.01.2026 (Eintragungsdatum)\n\nTG Holding GmbH\nGesellschaft mit beschränkter Haftung\nHasenkrug\n\nZu Eintragungsnummer 3 vom 28.01.2026 wird als nicht eingetragen veröffentlicht:  Als nicht eingetragen wird veröffentlicht: Den Gläubigern der an der Verschmelzung beteiligten Rechtsträger ist, wenn sie binnen sechs Monaten nach dem Tag, an dem die Eintragung der Verschmelzung in das Register des Sitzes desjenigen Rechtsträgers, dessen Gläubiger sie sind, nach § 19 Abs. 3 UmwG bekannt gemacht worden ist, ihren Anspruch nach Grund und Höhe schriftlich anmelden, Sicherheit zu leisten, soweit sie nicht Befriedigung verlangen können. Dieses Recht steht den Gläubigern jedoch nur zu, wenn sie glaubhaft machen, dass durch die Verschmelzung die Erfüllung ihrer Forderung gefährdet wird."
    },
    {
      "date": "2026-02-02",
      "id": "144050",
      "original_text": "Registerbekanntmachung nach dem Umwandlungsgesetz\nBaden-Württemberg Amtsgericht Stuttgart HRB 783458\nMC Shape Ehningen GmbH – Nagold",
      "type": "Registerbekanntmachung nach dem Umwandlungsgesetz",
      "state": "Baden-Württemberg",
      "amtsgericht": "Amtsgericht Stuttgart",
      "registernummer": "HRB 783458",
      "registerart": "HRB",
      "company_name": "MC Shape Ehningen GmbH",
      "company_seat": "Nagold",
      "details": "02.02.2026 (Bekanntmachungsdatum)\n\nBaden-Württemberg Amtsgericht Stuttgart HRB 783458\nRegisterbekanntmachung nach dem Umwandlungsgesetz 02.02.2026 (Eintragungsdatum)\n\nMC Shape Ehningen GmbH\nGesellschaft mit beschränkter Haftung\nNagold\n\nAls nicht eingetragen wird bekanntgemacht:\nDen Gläubigern der an der Verschmelzung beteiligten Rechtsträger ist, wenn sie binnen sechs Monaten nach dem Tag, an dem die Eintragung der Verschmelzung in das Register des Sitzes desjenigen Rechtsträgers, dessen Gläubiger sie sind, nach § 19 Abs. 3 UmwG als bekanntgemacht gilt, ihren Anspruch nach Grund und Höhe schriftlich anmelden, Sicherheit zu leisten, soweit sie nicht Befriedigung verlangen können. Dieses Recht steht den Gläubigern jedoch nur zu, wenn sie glaubhaft machen, dass durch die Verschmelzung die Erfüllung ihrer Forderung gefährdet wird."
    },
    {
      "date": "2026-02-02",
      "id": "144051",
      "original_text": "Sonstige Registerbekanntmachung\nHamburg Amtsgericht Hamburg HRB 125957\nProduction Resource Group AG – Hamburg",
      "type": "Sonstige Registerbekanntmachung",
      "state": "Hamburg",
      "amtsgericht": "Amtsgericht Hamburg",
      "registernummer": "HRB 125957",
      "registerart": "HRB",
      "company_name": "Production Resource Group AG",
      "company_seat": "Hamburg",
      "details": "02.02.2026 (Bekanntmachungsdatum)\n\nHamburg Amtsgericht Hamburg HRB 125957\nSonstige Registerbekanntmachung\n\nProduction Resource Group AG\nAktiengesellschaft\nHamburg\n\nAls nicht eingetragen wird bekannt gemacht: Liste des Aufsichtsrats wurde eingereicht."
    },
    {
      "date": "2026-02-02",
      "id": "144052",
      "original_text": "Sonstige Registerbekanntmachung\nBaden-Württemberg Amtsgericht Stuttgart HRB 106880\nMittelstädt S C R GmbH – Lehrensteinsfeld",
      "type": "Sonstige Registerbekanntmachung",
      "state": "Baden-Württemberg",
      "amtsgericht": "Amtsgericht Stuttgart",
      "registernummer": "HRB 106880",
      "registerart": "HRB",
      "company_name": "Mittelstädt S C R GmbH",
      "company_seat": "Lehrensteinsfeld",
      "details": "02.02.2026 (Bekanntmachungsdatum)\n\nBaden-Württemberg Amtsgericht Stuttgart HRB 106880\nSonstige Registerbekanntmachung 02.02.2026 (Eintragungsdatum)\n\nMittelstädt S C R GmbH\nGesellschaft mit beschränkter Haftung\nLehrensteinsfeld\n\nAls nicht eingetragen wird bekanntgemacht:\nDen Gläubigern der Gesellschaft, deren Forderungen begründet worden sind, bevor die Eintragung der Beendigung des Vertrages in das Handelsregister nach § 10 HGB als bekanntgemacht gilt, ist vom anderen Vertragsteil Sicherheit zu leisten, wenn sie sich binnen sechs Monaten nach der Bekanntmachung zu diesem Zweck bei ihm melden."
    },
    {
      "date": "2026-02-02",
      "id": "144053",
      "original_text": "Sonstige Registerbekanntmachung\nBaden-Württemberg Amtsgericht Stuttgart HRB 103880\nMittelstädt Special-Car-Handelsgesellschaft mit beschränkter Haftung – Lehrensteinsfeld",
      "type": "Sonstige Registerbekanntmachung",
      "state": "Baden-Württemberg",
      "amtsgericht": "Amtsgericht Stuttgart",
      "registernummer": "HRB 103880",
      "registerart": "HRB",
      "company_name": "Mittelstädt Special-Car-Handelsgesellschaft mit beschränkter Haftung",
      "company_seat": "Lehrensteinsfeld",
      "details": "02.02.2026 (Bekanntmachungsdatum)\n\nBaden-Württemberg Amtsgericht Stuttgart HRB 103880\nSonstige Registerbekanntmachung 02.02.2026 (Eintragungsdatum)\n\nMittelstädt Special-Car-Handelsgesellschaft mit beschränkter Haftung\nGesellschaft mit beschränkter Haftung\nLehrensteinsfeld\n\nAls nicht eingetragen wird bekanntgemacht:\nDen Gläubigern der Gesellschaft, deren Forderungen begründet worden sind, bevor die Eintragung der Beendigung des Vertrages in das Handelsregister nach § 10 HGB als bekanntgemacht gilt, ist vom anderen Vertragsteil Sicherheit zu leisten, wenn sie sich binnen sechs Monaten nach der Bekanntmachung zu diesem Zweck bei ihm melden."
    },
    {
      "date": "2026-02-02",
      "id": "144054",
      "original_text": "Sonstige Registerbekanntmachung\nHamburg Amtsgericht Hamburg HRB 25866\nGrossmann & Berger GmbH – Hamburg",
      "type": "Sonstige Registerbekanntmachung",
      "state": "Hamburg",
      "amtsgericht": "Amtsgericht Hamburg",
      "registernummer": "HRB 25866",
      "registerart": "HRB",
      "company_name": "Grossmann & Berger GmbH",
      "company_seat": "Hamburg",
      "details": "02.02.2026 (Bekanntmachungsdatum)\n\nHamburg Amtsgericht Hamburg HRB 25866\nSonstige Registerbekanntmachung 21.01.2026 (Eintragungsdatum)\n\nGrossmann & Berger GmbH\nGesellschaft mit beschränkter Haftung\nHamburg\n\nAls nicht eingetragen wird bekannt gemacht: Liste des Aufsichtsrats wurde eingereicht."
    },
    {
      "date": "2026-02-02",
      "id": "144055",
      "original_text": "Löschungsankündigung\nSachsen-Anhalt Amtsgericht Stendal VR 42767\nRassegeflügelzuchtverein (RGZV) Reddeber e.V. – Reddeber",
      "type": "Löschungsankündigung",
      "state": "Sachsen-Anhalt",
      "amtsgericht": "Amtsgericht Stendal",
      "registernummer": "VR 42767",
      "registerart": "VR",
      "company_name": "Rassegeflügelzuchtverein (RGZV) Reddeber e.V.",
      "company_seat": "Reddeber",
      "details": "02.02.2026 (Bekanntmachungsdatum)\n\nSachsen-Anhalt Amtsgericht Stendal VR 42767\nLöschungsankündigung 02.02.2026 (Eintragungsdatum)\n\nRassegeflügelzuchtverein (RGZV) Reddeber e.V.\neingetragener Verein\nReddeber\n\nDas Registergericht beabsichtigt, nachfolgenden Verein wegen Mitgliederlosigkeit von Amts wegen zu löschen. Die Frist zur Erhebung eines Widerspruchs gegen die beabsichtigte Löschung wird auf drei Monate festgesetzt"
    },
    {
      "date": "2026-02-02",
      "id": "144056",
      "original_text": "Löschungsankündigung\nBrandenburg Amtsgericht Neuruppin HRB 12580\nKemik Pharma GmbH – Rheinsberg",
      "type": "Löschungsankündigung",
      "state": "Brandenburg",
      "amtsgericht": "Amtsgericht Neuruppin",
      "registernummer": "HRB 12580",
      "registerart": "HRB",
      "company_name": "Kemik Pharma GmbH",
      "company_seat": "Rheinsberg",
      "details": "02.02.2026 (Bekanntmachungsdatum)\n\nBrandenburg Amtsgericht Neuruppin HRB 12580\nLöschungsankündigung\n\nKemik Pharma GmbH\nGesellschaft mit beschränkter Haftung\nRheinsberg\n\nBei der nachstehenden Gesellschaft wird das Amtslöschungsverfahren gemäß § 394 FamFG eingeleitet.\n\nWiderspruchsfrist: 1 Monat"
    },
    {
      "date": "2026-02-02",
      "id": "144057",
      "original_text": "Sonstige Registerbekanntmachung\nSachsen Amtsgericht Chemnitz HRB 21641\nSozialbetriebe Mittleres Erzgebirge gGmbH – Olbernhau",
      "type": "Sonstige Registerbekanntmachung",
      "state": "Sachsen",
      "amtsgericht": "Amtsgericht Chemnitz",
      "registernummer": "HRB 21641",
      "registerart": "HRB",
      "company_name": "Sozialbetriebe Mittleres Erzgebirge gGmbH",
      "company_seat": "Olbernhau",
      "details": "02.02.2026 (Bekanntmachungsdatum)\n\nSachsen Amtsgericht Chemnitz HRB 21641\nSonstige Registerbekanntmachung\n\nSozialbetriebe Mittleres Erzgebirge gGmbH\nGesellschaft mit beschränkter Haftung\nOlbernhau\n\nAm 22.01.2026 wurde beim Handelsregister des Amtsgerichts Chemnitz die Liste der Mitglieder des Aufsichtsrats gemäß § 52 GmbHG eingereicht."
    },
    {
      "date": "2026-02-02",
      "id": "144058",
      "original_text": "Löschungsankündigung\nSachsen Amtsgericht Dresden HRB 27736\nPro Ratio Immobilien GmbH – Dresden",
      "type": "Löschungsankündigung",
      "state": "Sachsen",
      "amtsgericht": "Amtsgericht Dresden",
      "registernummer": "HRB 27736",
      "registerart": "HRB",
      "company_name": "Pro Ratio Immobilien GmbH",
      "company_seat": "Dresden",
      "details": "02.02.2026 (Bekanntmachungsdatum)\n\nSachsen Amtsgericht Dresden HRB 27736\nLöschungsankündigung\n\nPro Ratio Immobilien GmbH\nGesellschaft mit beschränkter Haftung\nDresden\n\nDas Registergericht beabsichtigt, die im Handelsregister eingetragene Gesellschaft von Amts wegen nach § 394 FamFG zu löschen. Die Frist zu Erhebung eines Widerspruchs gegen die beabsichtigte Löschung wird auf einen Monat festgesetzt."
    },
    {
      "date": "2026-02-02",
      "id": "144059",
      "original_text": "Einreichung neuer Dokumente\nSachsen Amtsgericht Chemnitz HRB 7103\nStadtwerke Reichenbach/Vogtland GmbH – Reichenbach im Vogtland",
      "type": "Einreichung neuer Dokumente",
      "state": "Sachsen",
      "amtsgericht": "Amtsgericht Chemnitz",
      "registernummer": "HRB 7103",
      "registerart": "HRB",
      "company_name": "Stadtwerke Reichenbach/Vogtland GmbH",
      "company_seat": "Reichenbach im Vogtland",
      "details": "02.02.2026 (Bekanntmachungsdatum)\n\nSachsen Amtsgericht Chemnitz HRB 7103\nEinreichung neuer Dokumente\n\nStadtwerke Reichenbach/Vogtland GmbH\nGesellschaft mit beschränkter Haftung\nReichenbach im Vogtland\n\nAm 13.01.2026 wurde beim Handelsregister des Amtsgerichts Chemnitz die Liste der Mitglieder des Aufsichtsrats gemäß § 52 GmbHG eingereicht."
    },
    {
      "date": "2026-02-02",
      "id": "144060",
      "original_text": "Registerbekanntmachung nach dem Umwandlungsgesetz\nSachsen Amtsgericht Dresden HRB 27612\nSECUPAY AG – Pulsnitz",
      "type": "Registerbekanntmachung nach dem Umwandlungsgesetz",
      "state": "Sachsen",
      "amtsgericht": "Amtsgericht Dresden",
      "registernummer": "HRB 27612",
      "registerart": "HRB",
      "company_name": "SECUPAY AG",
      "company_seat": "Pulsnitz",
      "details": "02.02.2026 (Bekanntmachungsdatum)\n\nSachsen Amtsgericht Dresden HRB 27612\nRegisterbekanntmachung nach dem Umwandlungsgesetz\n\nSECUPAY AG\nAktiengesellschaft\nPulsnitz\n\nGemäß § 61 UmwG wird bekannt gemacht: Zum Handelsregister ist der Entwurf eines Verschmelzungsvertrages der Gesellschaft als übernehmender Gesellschaft mit der hp.weber GmbH & POS-cash KG mit Sitz in Pulsnitz (Amtsgericht Dresden, HRA 5691) als übertragender Gesellschaft eingereicht worden."
    },
    {
      "date": "2026-02-02",
      "id": "144061",
      "original_text": "Löschungsankündigung\nSachsen Amtsgericht Leipzig HRB 40567\nLion Trans UG (haftungsbeschränkt) – Leipzig",
      "type": "Löschungsankündigung",
      "state": "Sachsen",
      "amtsgericht": "Amtsgericht Leipzig",
      "registernummer": "HRB 40567",
      "registerart": "HRB",
      "company_name": "Lion Trans UG (haftungsbeschränkt)",
      "company_seat": "Leipzig",
      "details": "02.02.2026 (Bekanntmachungsdatum)\n\nSachsen Amtsgericht Leipzig HRB 40567\nLöschungsankündigung\n\nLion Trans UG (haftungsbeschränkt)\nGesellschaft mit beschränkter Haftung\nLeipzig\n\nDas Registergericht beabsichtigt, die im Handelsregister eingetragene Gesellschaft von Amts wegen nach § 394 FamFG zu löschen. Die Frist zu Erhebung eines Widerspruchs gegen die beabsichtigte Löschung wird auf einen Monat festgesetzt."
    },
    {
      "date": "2026-02-02",
      "id": "144062",
      "original_text": "Löschungsankündigung\nSachsen Amtsgericht Dresden HRB 31538\nCogado Verwaltungs UG (haftungsbeschränkt) – Dresden",
      "type": "Löschungsankündigung",
      "state": "Sachsen",
      "amtsgericht": "Amtsgericht Dresden",
      "registernummer": "HRB 31538",
      "registerart": "HRB",
      "company_name": "Cogado Verwaltungs UG (haftungsbeschränkt)",
      "company_seat": "Dresden",
      "details": "02.02.2026 (Bekanntmachungsdatum)\n\nSachsen Amtsgericht Dresden HRB 31538\nLöschungsankündigung\n\nCogado Verwaltungs UG (haftungsbeschränkt)\nGesellschaft mit beschränkter Haftung\nDresden\n\nDas Registergericht beabsichtigt, die im Handelsregister eingetragene Gesellschaft von Amts wegen nach § 394 FamFG zu löschen. Die Frist zu Erhebung eines Widerspruchs gegen die beabsichtigte Löschung wird auf einen Monat festgesetzt."
    },
    {
      "date": "2026-02-02",
      "id": "144063",
      "original_text": "Löschungsankündigung\nSachsen Amtsgericht Leipzig HRB 12587\nSerena Fassaden und Dämmtechnik GmbH – Taucha",
      "type": "Löschungsankündigung",
      "state": "Sachsen",
      "amtsgericht": "Amtsgericht Leipzig",
      "registernummer": "HRB 12587",
      "registerart": "HRB",
      "company_name": "Serena Fassaden und Dämmtechnik GmbH",
      "company_seat": "Taucha",
      "details": "02.02.2026 (Bekanntmachungsdatum)\n\nSachsen Amtsgericht Leipzig HRB 12587\nLöschungsankündigung\n\nSerena Fassaden und Dämmtechnik GmbH\nGesellschaft mit beschränkter Haftung\nTaucha\n\nDas Registergericht beabsichtigt, die im Handelsregister eingetragene Gesellschaft von Amts wegen nach § 394 FamFG zu löschen. Die Frist zu Erhebung eines Widerspruchs gegen die beabsichtigte Löschung wird auf einen Monat festgesetzt."
    },
    {
      "date": "2026-02-02",
      "id": "144064",
      "original_text": "Löschungsankündigung\nSachsen Amtsgericht Chemnitz HRB 31648\nvision-z.de gemeinnützige UG (haftungsbeschränkt) – Schwarzenberg/Erzgeb.",
      "type": "Löschungsankündigung",
      "state": "Sachsen",
      "amtsgericht": "Amtsgericht Chemnitz",
      "registernummer": "HRB 31648",
      "registerart": "HRB",
      "company_name": "vision-z.de gemeinnützige UG (haftungsbeschränkt)",
      "company_seat": "Schwarzenberg/Erzgeb.",
      "details": "02.02.2026 (Bekanntmachungsdatum)\n\nSachsen Amtsgericht Chemnitz HRB 31648\nLöschungsankündigung 02.02.2026 (Eintragungsdatum)\n\nvision-z.de gemeinnützige UG (haftungsbeschränkt)\nGesellschaft mit beschränkter Haftung\nSchwarzenberg/Erzgeb.\n\nDas Registergericht beabsichtigt, die im Handelsregister eingetragene Gesellschaft von Amts wegen nach § 394 FamFG zu löschen. Die Frist zu Erhebung eines Widerspruchs gegen die beabsichtigte Löschung wird auf einen Monat festgesetzt."
    },
    {
      "date": "2026-02-02",
      "id": "144065",
      "original_text": "Einreichung neuer Dokumente\nSachsen Amtsgericht Chemnitz HRB 18244\naetka AG – Hartmannsdorf",
      "type": "Einreichung neuer Dokumente",
      "state": "Sachsen",
      "amtsgericht": "Amtsgericht Chemnitz",
      "registernummer": "HRB 18244",
      "registerart": "HRB",
      "company_name": "aetka AG",
      "company_seat": "Hartmannsdorf",
      "details": "02.02.2026 (Bekanntmachungsdatum)\n\nSachsen Amtsgericht Chemnitz HRB 18244\nEinreichung neuer Dokumente\n\naetka AG\nAktiengesellschaft\nHartmannsdorf\n\nAm 22.01.2026 wurde beim Handelsregister des Amtsgerichts Chemnitz die Liste der Mitglieder des Aufsichtsrats gemäß § 106 AktG eingereicht."
    },
    {
      "date": "2026-02-02",
      "id": "144066",
      "original_text": "Löschungsankündigung\nNiedersachsen Amtsgericht Hildesheim HRB 210134\nMS Event und Coaching UG (haftungsbeschränkt) – Wittingen",
      "type": "Löschungsankündigung",
      "state": "Niedersachsen",
      "amtsgericht": "Amtsgericht Hildesheim",
      "registernummer": "HRB 210134",
      "registerart": "HRB",
      "company_name": "MS Event und Coaching UG (haftungsbeschränkt)",
      "company_seat": "Wittingen",
      "details": "02.02.2026 (Bekanntmachungsdatum)\n\nNiedersachsen Amtsgericht Hildesheim HRB 210134\nLöschungsankündigung\n\nMS Event und Coaching UG (haftungsbeschränkt)\nGesellschaft mit beschränkter Haftung\nWittingen\n\nDas Registergericht beabsichtigt, die Gesellschaft von Amts wegen nach § 394 FamFG zu löschen. Die Frist zur Erhebung eines Widerspruchs ist auf 1 Monat ab dieser Registerbekanntmachung festgesetzt."
    },
    {
      "date": "2026-02-02",
      "id": "144067",
      "original_text": "Registerbekanntmachung nach dem Umwandlungsgesetz\nNiedersachsen Amtsgericht Hannover HRB 56613\nZeitungs-Vertriebs-GmbH Laatzen – Hannover",
      "type": "Registerbekanntmachung nach dem Umwandlungsgesetz",
      "state": "Niedersachsen",
      "amtsgericht": "Amtsgericht Hannover",
      "registernummer": "HRB 56613",
      "registerart": "HRB",
      "company_name": "Zeitungs-Vertriebs-GmbH Laatzen",
      "company_seat": "Hannover",
      "details": "02.02.2026 (Bekanntmachungsdatum)\n\nNiedersachsen Amtsgericht Hannover HRB 56613\nRegisterbekanntmachung nach dem Umwandlungsgesetz 02.02.2026 (Eintragungsdatum)\n\nZeitungs-Vertriebs-GmbH Laatzen\nGesellschaft mit beschränkter Haftung\nHannover\n\nDen Gläubigern der an der Verschmelzung beteiligten Rechtsträger ist, wenn sie binnen sechs Monaten nach dem Tag, an dem die Eintragung der Verschmelzung in das Register des Sitzes desjenigen Rechtsträgers, dessen Gläubiger sie sind, nach § 19  Abs.  3 UmwG als bekannt gemacht gilt, ihren Anspruch nach Grund und Höhe schriftlich anmelden, Sicherheit zu leisten, soweit sie nicht Befriedigung verlangen können. Dieses Recht steht den Gläubigern jedoch nur zu, wenn sie glaubhaft machen, dass durch die Verschmelzung die Erfüllung der Forderung gefährdet wird."
    },
    {
      "date": "2026-02-02",
      "id": "144068",
      "original_text": "Einreichung neuer Dokumente\nNiedersachsen Amtsgericht Osnabrück HRB 122437\nSeniorenzentrum St. Martinus GmbH Wohnen - Pflege - Begegnung - Sozialstation – Haren (Ems)",
      "type": "Einreichung neuer Dokumente",
      "state": "Niedersachsen",
      "amtsgericht": "Amtsgericht Osnabrück",
      "registernummer": "HRB 122437",
      "registerart": "HRB",
      "company_name": "Seniorenzentrum St. Martinus GmbH Wohnen - Pflege - Begegnung - Sozialstation",
      "company_seat": "Haren (Ems)",
      "details": "02.02.2026 (Bekanntmachungsdatum)\n\nNiedersachsen Amtsgericht Osnabrück HRB 122437\nEinreichung neuer Dokumente 02.02.2026 (Eintragungsdatum)\n\nSeniorenzentrum St. Martinus GmbH Wohnen - Pflege - Begegnung - Sozialstation\nGesellschaft mit beschränkter Haftung\nHaren (Ems)\n\nDie Liste der Mitglieder des Aufsichtsrats wurde beim Registergericht eingereicht."
    },
    {
      "date": "2026-02-02",
      "id": "144069",
      "original_text": "Registerbekanntmachung nach dem Umwandlungsgesetz\nNiedersachsen Amtsgericht Hannover HRB 205938\nPressevertrieb Döhren GmbH – Hannover",
      "type": "Registerbekanntmachung nach dem Umwandlungsgesetz",
      "state": "Niedersachsen",
      "amtsgericht": "Amtsgericht Hannover",
      "registernummer": "HRB 205938",
      "registerart": "HRB",
      "company_name": "Pressevertrieb Döhren GmbH",
      "company_seat": "Hannover",
      "details": "02.02.2026 (Bekanntmachungsdatum)\n\nNiedersachsen Amtsgericht Hannover HRB 205938\nRegisterbekanntmachung nach dem Umwandlungsgesetz 02.02.2026 (Eintragungsdatum)\n\nPressevertrieb Döhren GmbH\nGesellschaft mit beschränkter Haftung\nHannover\n\nDen Gläubigern der an der Verschmelzung beteiligten Rechtsträger ist, wenn sie binnen sechs Monaten nach dem Tag, an dem die Eintragung der Verschmelzung in das Register des Sitzes desjenigen Rechtsträgers, dessen Gläubiger sie sind, nach § 19  Abs.  3 UmwG als bekannt gemacht gilt, ihren Anspruch nach Grund und Höhe schriftlich anmelden, Sicherheit zu leisten, soweit sie nicht Befriedigung verlangen können. Dieses Recht steht den Gläubigern jedoch nur zu, wenn sie glaubhaft machen, dass durch die Verschmelzung die Erfüllung der Forderung gefährdet wird."
    },
    {
      "date": "2026-02-02",
      "id": "144070",
      "original_text": "Einreichung neuer Dokumente\nNiedersachsen Amtsgericht Hannover HRB 213321\nLeineNetz GmbH – Neustadt am Rübenberge",
      "type": "Einreichung neuer Dokumente",
      "state": "Niedersachsen",
      "amtsgericht": "Amtsgericht Hannover",
      "registernummer": "HRB 213321",
      "registerart": "HRB",
      "company_name": "LeineNetz GmbH",
      "company_seat": "Neustadt am Rübenberge",
      "details": "02.02.2026 (Bekanntmachungsdatum)\n\nNiedersachsen Amtsgericht Hannover HRB 213321\nEinreichung neuer Dokumente\n\nLeineNetz GmbH\nGesellschaft mit beschränkter Haftung\nNeustadt am Rübenberge\n\nDie Liste der Mitglieder des Aufsichtsrats wurde beim Registergericht eingereicht."
    },
    {
      "date": "2026-02-02",
      "id": "144071",
      "original_text": "Sonstige Registerbekanntmachung\nNiedersachsen Amtsgericht Hannover HRB 58488\naquaLaatzium Freizeit-GmbH – Laatzen",
      "type": "Sonstige Registerbekanntmachung",
      "state": "Niedersachsen",
      "amtsgericht": "Amtsgericht Hannover",
      "registernummer": "HRB 58488",
      "registerart": "HRB",
      "company_name": "aquaLaatzium Freizeit-GmbH",
      "company_seat": "Laatzen",
      "details": "02.02.2026 (Bekanntmachungsdatum)\n\nNiedersachsen Amtsgericht Hannover HRB 58488\nSonstige Registerbekanntmachung\n\naquaLaatzium Freizeit-GmbH\nGesellschaft mit beschränkter Haftung\nLaatzen\n\nDie Liste der Mitglieder des Aufsichtsrats wurde beim Registergericht eingereicht."
    },
    {
      "date": "2026-02-02",
      "id": "144072",
      "original_text": "Löschungsankündigung\nNiedersachsen Amtsgericht Tostedt HRB 204967\nFS Founders Holding GmbH – Buchholz i. d. N.",
      "type": "Löschungsankündigung",
      "state": "Niedersachsen",
      "amtsgericht": "Amtsgericht Tostedt",
      "registernummer": "HRB 204967",
      "registerart": "HRB",
      "company_name": "FS Founders Holding GmbH",
      "company_seat": "Buchholz i. d. N.",
      "details": "02.02.2026 (Bekanntmachungsdatum)\n\nNiedersachsen Amtsgericht Tostedt HRB 204967\nLöschungsankündigung\n\nFS Founders Holding GmbH\nGesellschaft mit beschränkter Haftung\nBuchholz i. d. N.\n\nDas Registergericht beabsichtigt, die Gesellschaft von Amts wegen nach § 394 FamFG zu löschen. Die Frist zur Erhebung eines Widerspruchs ist auf 1 Monat ab dieser Registerbekanntmachung festgesetzt."
    },
    {
      "date": "2026-02-02",
      "id": "144073",
      "original_text": "Löschungsankündigung\nNiedersachsen Amtsgericht Hildesheim HRB 1539\nOkayglas GmbH – Hildesheim",
      "type": "Löschungsankündigung",
      "state": "Niedersachsen",
      "amtsgericht": "Amtsgericht Hildesheim",
      "registernummer": "HRB 1539",
      "registerart": "HRB",
      "company_name": "Okayglas GmbH",
      "company_seat": "Hildesheim",
      "details": "02.02.2026 (Bekanntmachungsdatum)\n\nNiedersachsen Amtsgericht Hildesheim HRB 1539\nLöschungsankündigung\n\nOkayglas GmbH\nGesellschaft mit beschränkter Haftung\nHildesheim\n\nDas Registergericht beabsichtigt, die Gesellschaft von Amts wegen nach § 394 FamFG zu löschen. Die Frist zur Erhebung eines Widerspruchs ist auf 1 Monat ab dieser Registerbekanntmachung festgesetzt."
    },
    {
      "date": "2026-02-02",
      "id": "144074",
      "original_text": "Löschungsankündigung\nNiedersachsen Amtsgericht Tostedt HRB 206827\nGrafik + Druck Rolf Brandt UG (haftungsbeschränkt) – Stade",
      "type": "Löschungsankündigung",
      "state": "Niedersachsen",
      "amtsgericht": "Amtsgericht Tostedt",
      "registernummer": "HRB 206827",
      "registerart": "HRB",
      "company_name": "Grafik + Druck Rolf Brandt UG (haftungsbeschränkt)",
      "company_seat": "Stade",
      "details": "02.02.2026 (Bekanntmachungsdatum)\n\nNiedersachsen Amtsgericht Tostedt HRB 206827\nLöschungsankündigung\n\nGrafik + Druck Rolf Brandt UG (haftungsbeschränkt)\nGesellschaft mit beschränkter Haftung\nStade\n\nDas Registergericht beabsichtigt, die Gesellschaft von Amts wegen nach § 394 FamFG zu löschen. Die Frist zur Erhebung eines Widerspruchs ist auf 1 Monat ab dieser Registerbekanntmachung festgesetzt."
    },
    {
      "date": "2026-02-02",
      "id": "144075",
      "original_text": "Löschungsankündigung\nNiedersachsen Amtsgericht Hildesheim HRB 205473\nImmoGrund GmbH – Gifhorn",
      "type": "Löschungsankündigung",
      "state": "Niedersachsen",
      "amtsgericht": "Amtsgericht Hildesheim",
      "registernummer": "HRB 205473",
      "registerart": "HRB",
      "company_name": "ImmoGrund GmbH",
      "company_seat": "Gifhorn",
      "details": "02.02.2026 (Bekanntmachungsdatum)\n\nNiedersachsen Amtsgericht Hildesheim HRB 205473\nLöschungsankündigung\n\nImmoGrund GmbH\nGesellschaft mit beschränkter Haftung\nGifhorn\n\nDas Registergericht beabsichtigt, die Gesellschaft von Amts wegen nach § 394 FamFG zu löschen. Die Frist zur Erhebung eines Widerspruchs ist auf 1 Monat ab dieser Registerbekanntmachung festgesetzt."
    },
    {
      "date": "2026-02-02",
      "id": "144076",
      "original_text": "Registerbekanntmachung nach dem Umwandlungsgesetz\nRheinland-Pfalz Amtsgericht Mainz HRB 54303\nHALLEBACH+KOLLEGEN GmbH Wirtschaftsprüfungsgesellschaft – Osthofen",
      "type": "Registerbekanntmachung nach dem Umwandlungsgesetz",
      "state": "Rheinland-Pfalz",
      "amtsgericht": "Amtsgericht Mainz",
      "registernummer": "HRB 54303",
      "registerart": "HRB",
      "company_name": "HALLEBACH+KOLLEGEN GmbH Wirtschaftsprüfungsgesellschaft",
      "company_seat": "Osthofen",
      "details": "02.02.2026 (Bekanntmachungsdatum)\n\nRheinland-Pfalz Amtsgericht Mainz HRB 54303\nRegisterbekanntmachung nach dem Umwandlungsgesetz 02.02.2026 (Eintragungsdatum)\n\nHALLEBACH+KOLLEGEN GmbH Wirtschaftsprüfungsgesellschaft\nGesellschaft mit beschränkter Haftung\nOsthofen\n\nAls nicht eingetragen wird veröffentlicht: Den Gläubigern der an der Verschmelzung beteiligten Rechtsträger ist, wenn sie binnen sechs Monaten nach dem Tag, an dem die Eintragung der Verschmelzung in das Register des Sitzes desjenigen Rechtsträgers, dessen Gläubiger sie sind, nach § 19 Abs. 3 UmwG als bekannt gemacht gilt, ihren Anspruch nach Grund und Höhe schriftlich anmelden, Sicherheit zu leisten, soweit sie nicht Befriedigung verlangen können. Dieses Recht steht den Gläubigern jedoch nur zu, wenn sie glaubhaft machen, dass durch die Verschmelzung die Erfüllung der Forderung gefährdet wird."
    },
    {
      "date": "2026-02-02",
      "id": "144077",
      "original_text": "Löschungsankündigung\nRheinland-Pfalz Amtsgericht Ludwigshafen a.Rhein (Ludwigshafen) HRB 65598\nGatsby Beteiligungen UG (haftungsbeschränkt) – Ludwigshafen",
      "type": "Löschungsankündigung",
      "state": "Rheinland-Pfalz",
      "amtsgericht": "Amtsgericht Ludwigshafen a.Rhein (Ludwigshafen)",
      "registernummer": "HRB 65598",
      "registerart": "HRB",
      "company_name": "Gatsby Beteiligungen UG (haftungsbeschränkt)",
      "company_seat": "Ludwigshafen",
      "details": "02.02.2026 (Bekanntmachungsdatum)\n\nRheinland-Pfalz Amtsgericht Ludwigshafen a.Rhein (Ludwigshafen) HRB 65598\nLöschungsankündigung 02.02.2026 (Eintragungsdatum)\n\nGatsby Beteiligungen UG (haftungsbeschränkt)\nGesellschaft mit beschränkter Haftung\nLudwigshafen\n\nDas Registergericht beabsichtigt die Gesellschaft von Amts wegen nach § 394 FamFG zu löschen. Die Frist zur Erhebung eines Widerspruchs ist auf einen Monat festgesetzt."
    },
    {
      "date": "2026-02-02",
      "id": "144078",
      "original_text": "Registerbekanntmachung nach dem Umwandlungsgesetz\nRheinland-Pfalz Amtsgericht Koblenz HRB 22106\nKfz Klinik Klein GmbH – Mülheim-Kärlich",
      "type": "Registerbekanntmachung nach dem Umwandlungsgesetz",
      "state": "Rheinland-Pfalz",
      "amtsgericht": "Amtsgericht Koblenz",
      "registernummer": "HRB 22106",
      "registerart": "HRB",
      "company_name": "Kfz Klinik Klein GmbH",
      "company_seat": "Mülheim-Kärlich",
      "details": "02.02.2026 (Bekanntmachungsdatum)\n\nRheinland-Pfalz Amtsgericht Koblenz HRB 22106\nRegisterbekanntmachung nach dem Umwandlungsgesetz 02.02.2026 (Eintragungsdatum)\n\nKfz Klinik Klein GmbH\nGesellschaft mit beschränkter Haftung\nMülheim-Kärlich\n\nAls nicht eingetragen wird veröffentlicht: Den Gläubigern der an der Ausgliederung beteiligten Rechtsträger ist, wenn sie binnen sechs Monaten nach dem Tag, an dem die Eintragung der Ausgliederung in das Register des Sitzes desjenigen Rechtsträgers, dessen Gläubiger sie sind, nach § 19 Abs. 3 UmwG als bekannt gemacht gilt, ihren Anspruch nach Grund und Höhe schriftlich anmelden, Sicherheit zu leisten, soweit sie nicht Befriedigung verlangen können. Dieses Recht steht den Gläubigern jedoch nur zu, wenn sie glaubhaft machen, dass durch die Ausgliederung die Erfüllung der Forderung gefährdet wird."
    },
    {
      "date": "2026-02-02",
      "id": "144079",
      "original_text": "Registerbekanntmachung nach dem Umwandlungsgesetz\nRheinland-Pfalz Amtsgericht Koblenz HRA 23333\nPeter Klein Vermietung e.K. – Mülheim-Kärlich",
      "type": "Registerbekanntmachung nach dem Umwandlungsgesetz",
      "state": "Rheinland-Pfalz",
      "amtsgericht": "Amtsgericht Koblenz",
      "registernummer": "HRA 23333",
      "registerart": "HRA",
      "company_name": "Peter Klein Vermietung e.K.",
      "company_seat": "Mülheim-Kärlich",
      "details": "02.02.2026 (Bekanntmachungsdatum)\n\nRheinland-Pfalz Amtsgericht Koblenz HRA 23333\nRegisterbekanntmachung nach dem Umwandlungsgesetz 02.02.2026 (Eintragungsdatum)\n\nPeter Klein Vermietung e.K.\nEinzelkaufmann / Einzelkauffrau\nMülheim-Kärlich\n\nAls nicht eingetragen wird veröffentlicht: Den Gläubigern der an der Ausgliederung beteiligten Rechtsträger ist, wenn sie binnen sechs Monaten nac hdem Tag, an dem die Eintragung der Ausgliederung in das Register des Sitzes desjenigen Rechtsträgers, dessen Gläubiger sie sind, nach § 19 Abs. 3 UmwG als bekannt gemacht gilt, ihren Anspruch nach Grund und Höhe schriftlich anmelden, Sicherheit zu leisten, soweit sie nicht Befriedigung verlangen können. Dieses Recht steht den Gläubigern jedoch nur zu, wenn sie glaubhaft machen, dass durch die Ausgliederung die Erfüllung der Forderung gefährdet wird."
    },
    {
      "date": "2026-02-02",
      "id": "144080",
      "original_text": "Löschungsankündigung\nRheinland-Pfalz Amtsgericht Montabaur HRB 3169\nFriedrich GmbH – Geisig",
      "type": "Löschungsankündigung",
      "state": "Rheinland-Pfalz",
      "amtsgericht": "Amtsgericht Montabaur",
      "registernummer": "HRB 3169",
      "registerart": "HRB",
      "company_name": "Friedrich GmbH",
      "company_seat": "Geisig",
      "details": "02.02.2026 (Bekanntmachungsdatum)\n\nRheinland-Pfalz Amtsgericht Montabaur HRB 3169\nLöschungsankündigung\n\nFriedrich GmbH\nGesellschaft mit beschränkter Haftung\nGeisig\n\nDas Registergericht beabsichtigt die Gesellschaft von Amts wegen nach § 394 FamFG zu löschen. Die Frist zur Erhebung eines Widerspruchs ist auf 1 Monat festgesetzt."
    },
    {
      "date": "2026-02-02",
      "id": "144081",
      "original_text": "Löschungsankündigung\nNordrhein-Westfalen Amtsgericht Köln HRB 75672\nTOKIOO GmbH – Köln",
      "type": "Löschungsankündigung",
      "state": "Nordrhein-Westfalen",
      "amtsgericht": "Amtsgericht Köln",
      "registernummer": "HRB 75672",
      "registerart": "HRB",
      "company_name": "TOKIOO GmbH",
      "company_seat": "Köln",
      "details": "02.02.2026 (Bekanntmachungsdatum)\n\nNordrhein-Westfalen Amtsgericht Köln HRB 75672\nLöschungsankündigung\n\nTOKIOO GmbH\nGesellschaft mit beschränkter Haftung\nKöln\n\nDas Registergericht beabsichtigt die Gesellschaft von Amts wegen nach § 394 FamFG zu löschen. Die Frist zur Erhebung eines Widerspruchs ist auf einen Monat festgesetzt."
    },
    {
      "date": "2026-02-02",
      "id": "144082",
      "original_text": "Registerbekanntmachung nach dem Umwandlungsgesetz\nNordrhein-Westfalen Amtsgericht Paderborn HRA 9021\nBunte Immobilien GmbH & Co. KG – Paderborn",
      "type": "Registerbekanntmachung nach dem Umwandlungsgesetz",
      "state": "Nordrhein-Westfalen",
      "amtsgericht": "Amtsgericht Paderborn",
      "registernummer": "HRA 9021",
      "registerart": "HRA",
      "company_name": "Bunte Immobilien GmbH & Co. KG",
      "company_seat": "Paderborn",
      "details": "02.02.2026 (Bekanntmachungsdatum)\n\nNordrhein-Westfalen Amtsgericht Paderborn HRA 9021\nRegisterbekanntmachung nach dem Umwandlungsgesetz 02.02.2026 (Eintragungsdatum)\n\nBunte Immobilien GmbH & Co. KG\nKommanditgesellschaft\nPaderborn\n\nDen Gläubigern der an der Ausgliederung beteiligten Rechtsträger ist, wenn sie binnen sechs Monaten nach dem Tag, an dem die Eintragung der Ausgliederung in das Register des Sitzes desjenigen Rechtsträgers, dessen Gläubiger sie sind, nach § 19 Absatz 3 UmwG als bekanntgemacht gilt, ihren Anspruch nach Grund und Höhe schriftlich anmelden, Sicherheit zu leisten, soweit sie nicht Befriedigung verlangen können. Dieses Recht steht den Gläubigern jedoch nur zu, wenn sie glaubhaft machen, dass durch die Ausgliederung die Erfüllung ihrer Forderung gefährdet wird."
    },
    {
      "date": "2026-02-02",
      "id": "144083",
      "original_text": "Registerbekanntmachung nach dem Umwandlungsgesetz\nNordrhein-Westfalen Amtsgericht Kleve VR 1324\nSt. Johannes Nepomuk Schützenbruderschaft Alt-Lintfort von 1753 e.V. – Kamp-Lintfort",
      "type": "Registerbekanntmachung nach dem Umwandlungsgesetz",
      "state": "Nordrhein-Westfalen",
      "amtsgericht": "Amtsgericht Kleve",
      "registernummer": "VR 1324",
      "registerart": "VR",
      "company_name": "St. Johannes Nepomuk Schützenbruderschaft Alt-Lintfort von 1753 e.V.",
      "company_seat": "Kamp-Lintfort",
      "details": "02.02.2026 (Bekanntmachungsdatum)\n\nNordrhein-Westfalen Amtsgericht Kleve VR 1324\nRegisterbekanntmachung nach dem Umwandlungsgesetz 02.02.2026 (Eintragungsdatum)\n\nSt. Johannes Nepomuk Schützenbruderschaft Alt-Lintfort von 1753 e.V.\neingetragener Verein\nKamp-Lintfort\n\nDen Gläubigern der an der Verschmelzung beteiligten Rechtsträger ist, wenn sie binnen sechs Monaten nach dem Tag, an dem die Eintragung der Verschmelzung in das Register des Sitzes desjenigen Rechtsträgers, dessen Gläubiger sie sind, nach § 19 Absatz 3 UmwG als bekanntgemacht gilt, ihren Anspruch nach Grund und Höhe schriftlich anmelden, Sicherheit zu leisten, soweit sie nicht Befriedigung verlangen können. Dieses Recht steht den Gläubigern jedoch nur zu, wenn sie glaubhaft machen, dass durch die Verschmelzung die Erfüllung ihrer Forderung gefährdet wird."
    },
    {
      "date": "2026-02-02",
      "id": "144084",
      "original_text": "Einreichung neuer Dokumente\nNordrhein-Westfalen Amtsgericht Duisburg HRB 1171\nDuisburger Versorgungs- und Verkehrsgesellschaft mit beschränkter Haftung – Duisburg",
      "type": "Einreichung neuer Dokumente",
      "state": "Nordrhein-Westfalen",
      "amtsgericht": "Amtsgericht Duisburg",
      "registernummer": "HRB 1171",
      "registerart": "HRB",
      "company_name": "Duisburger Versorgungs- und Verkehrsgesellschaft mit beschränkter Haftung",
      "company_seat": "Duisburg",
      "details": "02.02.2026 (Bekanntmachungsdatum)\n\nNordrhein-Westfalen Amtsgericht Duisburg HRB 1171\nEinreichung neuer Dokumente\n\nDuisburger Versorgungs- und Verkehrsgesellschaft mit beschränkter Haftung\nGesellschaft mit beschränkter Haftung\nDuisburg\n\nDem Registergericht ist eine neue Liste der Mitglieder des Aufsichtsrates eingereicht worden."
    },
    {
      "date": "2026-02-02",
      "id": "144085",
      "original_text": "Löschungsankündigung\nNordrhein-Westfalen Amtsgericht Dortmund HRB 13682\nVKH-Klinik Beteiligungen GmbH – Dortmund",
      "type": "Löschungsankündigung",
      "state": "Nordrhein-Westfalen",
      "amtsgericht": "Amtsgericht Dortmund",
      "registernummer": "HRB 13682",
      "registerart": "HRB",
      "company_name": "VKH-Klinik Beteiligungen GmbH",
      "company_seat": "Dortmund",
      "details": "02.02.2026 (Bekanntmachungsdatum)\n\nNordrhein-Westfalen Amtsgericht Dortmund HRB 13682\nLöschungsankündigung 30.01.2026 (Eintragungsdatum)\n\nVKH-Klinik Beteiligungen GmbH\nGesellschaft mit beschränkter Haftung\nDortmund\n\nDas Registergericht beabsichtigt die Gesellschaft von Amts wegen nach § 394 FamFG zu löschen. Die Frist zur Erhebung eines Widerspruchs ist auf zwei Monate festgesetzt."
    },
    {
      "date": "2026-02-02",
      "id": "144086",
      "original_text": "Einreichung neuer Dokumente\nNordrhein-Westfalen Amtsgericht Duisburg HRB 18681\nMülheimer Seniorendienste gGmbH – Mülheim an der Ruhr",
      "type": "Einreichung neuer Dokumente",
      "state": "Nordrhein-Westfalen",
      "amtsgericht": "Amtsgericht Duisburg",
      "registernummer": "HRB 18681",
      "registerart": "HRB",
      "company_name": "Mülheimer Seniorendienste gGmbH",
      "company_seat": "Mülheim an der Ruhr",
      "details": "02.02.2026 (Bekanntmachungsdatum)\n\nNordrhein-Westfalen Amtsgericht Duisburg HRB 18681\nEinreichung neuer Dokumente\n\nMülheimer Seniorendienste gGmbH\nGesellschaft mit beschränkter Haftung\nMülheim an der Ruhr\n\nDem Registergericht ist eine neue Liste der Mitglieder des Aufsichtsrates eingereicht worden."
    },
    {
      "date": "2026-02-02",
      "id": "144087",
      "original_text": "Löschungsankündigung\nNordrhein-Westfalen Amtsgericht Köln HRB 69820\nCONOPERA Verwaltungs-GmbH – Köln",
      "type": "Löschungsankündigung",
      "state": "Nordrhein-Westfalen",
      "amtsgericht": "Amtsgericht Köln",
      "registernummer": "HRB 69820",
      "registerart": "HRB",
      "company_name": "CONOPERA Verwaltungs-GmbH",
      "company_seat": "Köln",
      "details": "02.02.2026 (Bekanntmachungsdatum)\n\nNordrhein-Westfalen Amtsgericht Köln HRB 69820\nLöschungsankündigung\n\nCONOPERA Verwaltungs-GmbH\nGesellschaft mit beschränkter Haftung\nKöln\n\nDas Registergericht beabsichtigt die Gesellschaft von Amts wegen nach § 394 FamFG zu löschen. Die Frist zur Erhebung eines Widerspruchs ist auf einen Monat festgesetzt."
    },
    {
      "date": "2026-02-02",
      "id": "144088",
      "original_text": "Registerbekanntmachung nach dem Umwandlungsgesetz\nNordrhein-Westfalen Amtsgericht Paderborn HRA 9109\ndSPACE SE & Co. KG – Paderborn",
      "type": "Registerbekanntmachung nach dem Umwandlungsgesetz",
      "state": "Nordrhein-Westfalen",
      "amtsgericht": "Amtsgericht Paderborn",
      "registernummer": "HRA 9109",
      "registerart": "HRA",
      "company_name": "dSPACE SE & Co. KG",
      "company_seat": "Paderborn",
      "details": "02.02.2026 (Bekanntmachungsdatum)\n\nNordrhein-Westfalen Amtsgericht Paderborn HRA 9109\nRegisterbekanntmachung nach dem Umwandlungsgesetz 02.02.2026 (Eintragungsdatum)\n\ndSPACE SE & Co. KG\nKommanditgesellschaft\nPaderborn\n\nDen Gläubigern der an der formwechselnden Umwandlung beteiligten Rechtsträger ist, wenn sie binnen sechs Monaten nach dem Tag, an dem die Eintragung der formwechselnden Umwandlung in das Register des Sitzes desjenigen Rechtsträgers, dessen Gläubiger sie sind, nach § 19 Absatz 3 UmwG als bekanntgemacht gilt, ihren Anspruch nach Grund und Höhe schriftlich anmelden, Sicherheit zu leisten, soweit sie nicht Befriedigung verlangen können. Dieses Recht steht den Gläubigern jedoch nur zu, wenn sie glaubhaft machen, dass durch die formwechselnden Umwandlung die Erfüllung ihrer Forderung gefährdet wird."
    },
    {
      "date": "2026-02-02",
      "id": "144089",
      "original_text": "Einreichung neuer Dokumente\nNordrhein-Westfalen Amtsgericht Duisburg HRB 9638\nFernwärmeversorgung Niederrhein Gesellschaft mit beschränkter Haftung – Dinslaken",
      "type": "Einreichung neuer Dokumente",
      "state": "Nordrhein-Westfalen",
      "amtsgericht": "Amtsgericht Duisburg",
      "registernummer": "HRB 9638",
      "registerart": "HRB",
      "company_name": "Fernwärmeversorgung Niederrhein Gesellschaft mit beschränkter Haftung",
      "company_seat": "Dinslaken",
      "details": "02.02.2026 (Bekanntmachungsdatum)\n\nNordrhein-Westfalen Amtsgericht Duisburg HRB 9638\nEinreichung neuer Dokumente\n\nFernwärmeversorgung Niederrhein Gesellschaft mit beschränkter Haftung\nGesellschaft mit beschränkter Haftung\nDinslaken\n\nDem Registergericht ist eine Liste der Mitglieder des Aufsichtsrates eingereicht worden."
    },
    {
      "date": "2026-02-02",
      "id": "144090",
      "original_text": "Einreichung neuer Dokumente\nNordrhein-Westfalen Amtsgericht Dortmund HRB 19076\nSIGNAL IDUNA Holding Aktiengesellschaft – Dortmund",
      "type": "Einreichung neuer Dokumente",
      "state": "Nordrhein-Westfalen",
      "amtsgericht": "Amtsgericht Dortmund",
      "registernummer": "HRB 19076",
      "registerart": "HRB",
      "company_name": "SIGNAL IDUNA Holding Aktiengesellschaft",
      "company_seat": "Dortmund",
      "details": "02.02.2026 (Bekanntmachungsdatum)\n\nNordrhein-Westfalen Amtsgericht Dortmund HRB 19076\nEinreichung neuer Dokumente\n\nSIGNAL IDUNA Holding Aktiengesellschaft\nAktiengesellschaft\nDortmund\n\nDem Registergericht ist eine neue Liste der Mitglieder des Aufsichtsrates eingereicht worden."
    },
    {
      "date": "2026-02-02",
      "id": "144091",
      "original_text": "Registerbekanntmachung nach dem Umwandlungsgesetz\nNordrhein-Westfalen Amtsgericht Köln HRB 52355\nBVG Besitz- und Verwaltungsgesellschaft für technologieorientierte Unternehmungen mbH – Burscheid",
      "type": "Registerbekanntmachung nach dem Umwandlungsgesetz",
      "state": "Nordrhein-Westfalen",
      "amtsgericht": "Amtsgericht Köln",
      "registernummer": "HRB 52355",
      "registerart": "HRB",
      "company_name": "BVG Besitz- und Verwaltungsgesellschaft für technologieorientierte Unternehmungen mbH",
      "company_seat": "Burscheid",
      "details": "02.02.2026 (Bekanntmachungsdatum)\n\nNordrhein-Westfalen Amtsgericht Köln HRB 52355\nRegisterbekanntmachung nach dem Umwandlungsgesetz 02.02.2026 (Eintragungsdatum)\n\nBVG Besitz- und Verwaltungsgesellschaft für technologieorientierte Unternehmungen mbH\nGesellschaft mit beschränkter Haftung\nBurscheid\n\nDen Gläubigern der an der Abspaltung beteiligten Rechtsträger ist, wenn sie binnen sechs Monaten nach dem Tag, an dem die Eintragung der Abspaltung in das Register des Sitzes desjenigen Rechtsträgers, dessen Gläubiger sie sind, nach § 19 Absatz 3 UmwG als bekanntgemacht gilt, ihren Anspruch nach Grund und Höhe schriftlich anmelden, Sicherheit zu leisten, soweit sie nicht Befriedigung verlangen können. Dieses Recht steht den Gläubigern jedoch nur zu, wenn sie glaubhaft machen, dass durch die Abspaltung die Erfüllung ihrer Forderung gefährdet wird."
    },
    {
      "date": "2026-02-02",
      "id": "144092",
      "original_text": "Registerbekanntmachung nach dem Umwandlungsgesetz\nNordrhein-Westfalen Amtsgericht Gütersloh HRA 5238\nRodejohann e.K. – Rietberg",
      "type": "Registerbekanntmachung nach dem Umwandlungsgesetz",
      "state": "Nordrhein-Westfalen",
      "amtsgericht": "Amtsgericht Gütersloh",
      "registernummer": "HRA 5238",
      "registerart": "HRA",
      "company_name": "Rodejohann e.K.",
      "company_seat": "Rietberg",
      "details": "02.02.2026 (Bekanntmachungsdatum)\n\nNordrhein-Westfalen Amtsgericht Gütersloh HRA 5238\nRegisterbekanntmachung nach dem Umwandlungsgesetz 27.01.2026 (Eintragungsdatum)\n\nRodejohann e.K.\nEinzelkaufmann / Einzelkauffrau\nRietberg\n\nDen Gläubigern der an der Ausgliederung beteiligten Rechtsträger ist, wenn sie binnen sechs Monaten nach dem Tag, an dem die Eintragung der Ausgliederung in das Register des Sitzes desjenigen Rechtsträgers, dessen Gläubiger sie sind, nach § 19 Absatz 3 UmwG als bekanntgemacht gilt, ihren Anspruch nach Grund und Höhe schriftlich anmelden, Sicherheit zu leisten, soweit sie nicht Befriedigung verlangen können. Dieses Recht steht den Gläubigern jedoch nur zu, wenn sie glaubhaft machen, dass durch die Ausgliederung die Erfüllung ihrer Forderung gefährdet wird."
    },
    {
      "date": "2026-02-02",
      "id": "144093",
      "original_text": "Registerbekanntmachung nach dem Umwandlungsgesetz\nNordrhein-Westfalen Amtsgericht Duisburg HRB 24229\nTKL Service GmbH – Duisburg",
      "type": "Registerbekanntmachung nach dem Umwandlungsgesetz",
      "state": "Nordrhein-Westfalen",
      "amtsgericht": "Amtsgericht Duisburg",
      "registernummer": "HRB 24229",
      "registerart": "HRB",
      "company_name": "TKL Service GmbH",
      "company_seat": "Duisburg",
      "details": "02.02.2026 (Bekanntmachungsdatum)\n\nNordrhein-Westfalen Amtsgericht Duisburg HRB 24229\nRegisterbekanntmachung nach dem Umwandlungsgesetz 02.02.2026 (Eintragungsdatum)\n\nTKL Service GmbH\nGesellschaft mit beschränkter Haftung\nDuisburg\n\nDie Gesellschaft hat Gläubigern, deren Forderungen vor dieser Bekanntmachung begründet worden sind, Sicherheit zu leisten, soweit sie nicht Befriedigung verlangen können, wenn sie sich binnen sechs Monaten zu diesem Zweck melden."
    },
    {
      "date": "2026-02-02",
      "id": "144094",
      "original_text": "Löschungsankündigung\nNordrhein-Westfalen Amtsgericht Düsseldorf HRB 18844\nFuchs-Greven Handels GmbH – Düsseldorf",
      "type": "Löschungsankündigung",
      "state": "Nordrhein-Westfalen",
      "amtsgericht": "Amtsgericht Düsseldorf",
      "registernummer": "HRB 18844",
      "registerart": "HRB",
      "company_name": "Fuchs-Greven Handels GmbH",
      "company_seat": "Düsseldorf",
      "details": "02.02.2026 (Bekanntmachungsdatum)\n\nNordrhein-Westfalen Amtsgericht Düsseldorf HRB 18844\nLöschungsankündigung\n\nFuchs-Greven Handels GmbH\nGesellschaft mit beschränkter Haftung\nDüsseldorf\n\nDas Registergericht beabsichtigt die Gesellschaft von Amts wegen nach § 394 Abs. 1 FamFG zu löschen. Die Frist zur Erhebung eines Widerspruchs ist auf 3 Wochen festgesetzt.\n\nRechtsbehelfsbelehrung:\nDas Widerspruchsrecht steht jedem zu, der an der Unterlassung der Löschung ein berechtigtes Interesse hat. Der Widerspruch ist bei dem Amtsgericht Düsseldorf -Registergericht-, Werdener Straße 1, 40227 Düsseldorf schriftlich in deutscher Sprache oder zur Niederschrift der Geschäftsstelle einzulegen. Der Widerspruch kann auch zur Niederschrift der Geschäftsstelle eines jeden Amtsgerichtes abgegeben werden. Die Einlegung ist auch durch Übertragung eines elektronischen Dokuments an die elektronische Poststelle des Gerichts möglich. Das elektronische Dokument muss für die Bearbeitung durch das Gericht geeignet und mit einer qualifizierten elektronischen Signatur der verantwortenden Person versehen sein oder von der verantwortenden Person signiert und auf einem sicheren Übermittlungsweg gemäß § 130a ZPO nach näherer Maßgabe der Verordnung über die technischen Rahmenbedingungen des elektronischen Rechtsverkehrs und über das besondere elektronische Behördenpostfach (BGBl. I, S.3803) eingereicht werden. Weitere Informationen erhalten Sie auf der Internetseite www.justiz.de.\nDer Widerspruch muss spätestens innerhalb der gesetzten Frist nach dem Datum der Bekanntmachung der Löschungsankündigung bei dem Amtsgericht - Registergericht - Düsseldorf eingegangen sein.  Dies gilt auch dann, wenn der Widerspruch zur Niederschrift der Geschäftsstelle eines anderen Amtsgerichtes abgegeben wurde. Die Frist beginnt mit dem Tage der Bekanntmachung der Löschungsankündigung in dem für die Bekanntmachung der Eintragungen in das Handelsregister bestimmten elektronischen Informations- und Kommunikationssystem nach § 10 des Handelsgesetzbuches. Fällt das Ende der Frist auf einen Sonntag, einen allgemeinen Feiertag oder Sonnabend, so endet die Frist mit Ablauf des nächsten Werktages.\nDer Widerspruch muss die Bezeichnung der angefochtenen Löschungsankündigung sowie die Erklärung enthalten, dass Widerspruch gegen diese Löschungsankündigung eingelegt wird. Er ist zu unterzeichnen und soll begründet werden."
    },
    {
      "date": "2026-02-02",
      "id": "144095",
      "original_text": "Sonstige Registerbekanntmachung\nNordrhein-Westfalen Amtsgericht Essen HRA 11934\nUwe Krause Sanitär & Heizungsbau e.K., Inhaber Mathhias van Leyen – Hattingen",
      "type": "Sonstige Registerbekanntmachung",
      "state": "Nordrhein-Westfalen",
      "amtsgericht": "Amtsgericht Essen",
      "registernummer": "HRA 11934",
      "registerart": "HRA",
      "company_name": "Uwe Krause Sanitär & Heizungsbau e.K., Inhaber Mathhias van Leyen",
      "company_seat": "Hattingen",
      "details": "02.02.2026 (Bekanntmachungsdatum)\n\nNordrhein-Westfalen Amtsgericht Essen HRA 11934\nSonstige Registerbekanntmachung 30.01.2026 (Eintragungsdatum)\n\nUwe Krause Sanitär & Heizungsbau e.K., Inhaber Mathhias van Leyen\nEinzelkaufmann / Einzelkauffrau\nHattingen\n\nFolgender Haftungsausschluss wird hiermit berichtigend gem. §25 II HGB bekannt gegeben:\nDer Übergang der in dem Betriebe des Geschäfts entstandenen Verbindlichkeiten und Forderungen ist beim Erwerb des Geschäfts durch den neuen Inhaber ausgeschlossen."
    },
    {
      "date": "2026-02-02",
      "id": "144096",
      "original_text": "Registerbekanntmachung nach dem Umwandlungsgesetz\nNordrhein-Westfalen Amtsgericht Köln HRB 92078\nREWE Berlin Logistik GmbH – Köln",
      "type": "Registerbekanntmachung nach dem Umwandlungsgesetz",
      "state": "Nordrhein-Westfalen",
      "amtsgericht": "Amtsgericht Köln",
      "registernummer": "HRB 92078",
      "registerart": "HRB",
      "company_name": "REWE Berlin Logistik GmbH",
      "company_seat": "Köln",
      "details": "02.02.2026 (Bekanntmachungsdatum)\n\nNordrhein-Westfalen Amtsgericht Köln HRB 92078\nRegisterbekanntmachung nach dem Umwandlungsgesetz 02.02.2026 (Eintragungsdatum)\n\nREWE Berlin Logistik GmbH\nGesellschaft mit beschränkter Haftung\nKöln\n\nDen Gläubigern der an der Verschmelzung beteiligten Rechtsträger ist, wenn sie binnen sechs Monaten nach dem Tag, an dem die Eintragung der Verschmelzung in das Register des Sitzes desjenigen Rechtsträgers, dessen Gläubiger sie sind, nach § 19 Absatz 3 UmwG als bekanntgemacht gilt, ihren Anspruch nach Grund und Höhe schriftlich anmelden, Sicherheit zu leisten, soweit sie nicht Befriedigung verlangen können. Dieses Recht steht den Gläubigern jedoch nur zu, wenn sie glaubhaft machen, dass durch die Verschmelzung die Erfüllung ihrer Forderung gefährdet wird."
    },
    {
      "date": "2026-02-02",
      "id": "144097",
      "original_text": "Löschungsankündigung\nNordrhein-Westfalen Amtsgericht Essen HRB 31835\nSK BEST GmbH – Essen",
      "type": "Löschungsankündigung",
      "state": "Nordrhein-Westfalen",
      "amtsgericht": "Amtsgericht Essen",
      "registernummer": "HRB 31835",
      "registerart": "HRB",
      "company_name": "SK BEST GmbH",
      "company_seat": "Essen",
      "details": "02.02.2026 (Bekanntmachungsdatum)\n\nNordrhein-Westfalen Amtsgericht Essen HRB 31835\nLöschungsankündigung\n\nSK BEST GmbH\nGesellschaft mit beschränkter Haftung\nEssen\n\nDas Registergericht beabsichtigt die Gesellschaft von Amts wegen nach § 394 FamFG zu löschen. Die Frist zur Erhebung eines Widerspruchs ist auf einen Monat festgesetzt."
    },
    {
      "date": "2026-02-02",
      "id": "144098",
      "original_text": "Registerbekanntmachung nach dem Umwandlungsgesetz\nNordrhein-Westfalen Amtsgericht Düsseldorf HRB 111716\nSBR-net Consulting GmbH – Düsseldorf",
      "type": "Registerbekanntmachung nach dem Umwandlungsgesetz",
      "state": "Nordrhein-Westfalen",
      "amtsgericht": "Amtsgericht Düsseldorf",
      "registernummer": "HRB 111716",
      "registerart": "HRB",
      "company_name": "SBR-net Consulting GmbH",
      "company_seat": "Düsseldorf",
      "details": "02.02.2026 (Bekanntmachungsdatum)\n\nNordrhein-Westfalen Amtsgericht Düsseldorf HRB 111716\nRegisterbekanntmachung nach dem Umwandlungsgesetz 02.02.2026 (Eintragungsdatum)\n\nSBR-net Consulting GmbH\nGesellschaft mit beschränkter Haftung\nDüsseldorf\n\nDen Gläubigern der an der formwechselnden Umwandlung beteiligten Rechtsträger ist, wenn sie binnen sechs Monaten nach dem Tag, an dem die Eintragung der formwechselnden Umwandlung in das Register des Sitzes desjenigen Rechtsträgers, dessen Gläubiger sie sind, nach § 19 Absatz 3 UmwG als bekanntgemacht gilt, ihren Anspruch nach Grund und Höhe schriftlich anmelden, Sicherheit zu leisten, soweit sie nicht Befriedigung verlangen können. Dieses Recht steht den Gläubigern jedoch nur zu, wenn sie glaubhaft machen, dass durch die formwechselnden Umwandlung die Erfüllung ihrer Forderung gefährdet wird."
    },
    {
      "date": "2026-02-02",
      "id": "144099",
      "original_text": "Einreichung neuer Dokumente\nNordrhein-Westfalen Amtsgericht Dortmund HRB 8204\nPVAG Polizeiversicherungs-Aktiengesellschaft – Dortmund",
      "type": "Einreichung neuer Dokumente",
      "state": "Nordrhein-Westfalen",
      "amtsgericht": "Amtsgericht Dortmund",
      "registernummer": "HRB 8204",
      "registerart": "HRB",
      "company_name": "PVAG Polizeiversicherungs-Aktiengesellschaft",
      "company_seat": "Dortmund",
      "details": "02.02.2026 (Bekanntmachungsdatum)\n\nNordrhein-Westfalen Amtsgericht Dortmund HRB 8204\nEinreichung neuer Dokumente 02.02.2026 (Eintragungsdatum)\n\nPVAG Polizeiversicherungs-Aktiengesellschaft\nAktiengesellschaft\nDortmund\n\nDem Registergericht ist eine neue Liste der Mitglieder des Aufsichtsrates eingereicht worden."
    },
    {
      "date": "2026-02-02",
      "id": "144100",
      "original_text": "Sonstige Registerbekanntmachung\nNordrhein-Westfalen Amtsgericht Aachen HRB 19652\nElysée-Palast Aachen Immobilien GmbH – Aachen",
      "type": "Sonstige Registerbekanntmachung",
      "state": "Nordrhein-Westfalen",
      "amtsgericht": "Amtsgericht Aachen",
      "registernummer": "HRB 19652",
      "registerart": "HRB",
      "company_name": "Elysée-Palast Aachen Immobilien GmbH",
      "company_seat": "Aachen",
      "details": "02.02.2026 (Bekanntmachungsdatum)\n\nNordrhein-Westfalen Amtsgericht Aachen HRB 19652\nSonstige Registerbekanntmachung 02.02.2026 (Eintragungsdatum)\n\nElysée-Palast Aachen Immobilien GmbH\nGesellschaft mit beschränkter Haftung\nAachen\n\nAls nicht eingetragen wird veröffentlicht: Den Gläubigern der Gesellschaft, deren Forderungen begründet worden sind bevor die Eintragung der Beendigung des Beherrschungs- und Gewinnabführungsvertrages  in das Handelsregister nach § 10 des Handelsgesetzbuches als bekanntgemacht gilt, hat der andere Vertragsteil Sicherheit zu leisten, wenn sie sich binnen sechs Monaten nach der Bekanntmachung der Eintragung zu diesem Zweck bei ihm melden."
    },
    {
      "date": "2026-02-02",
      "id": "144101",
      "original_text": "Registerbekanntmachung nach dem Umwandlungsgesetz\nNordrhein-Westfalen Amtsgericht Duisburg HRB 24364\nTKL GmbH – Duisburg",
      "type": "Registerbekanntmachung nach dem Umwandlungsgesetz",
      "state": "Nordrhein-Westfalen",
      "amtsgericht": "Amtsgericht Duisburg",
      "registernummer": "HRB 24364",
      "registerart": "HRB",
      "company_name": "TKL GmbH",
      "company_seat": "Duisburg",
      "details": "02.02.2026 (Bekanntmachungsdatum)\n\nNordrhein-Westfalen Amtsgericht Duisburg HRB 24364\nRegisterbekanntmachung nach dem Umwandlungsgesetz 02.02.2026 (Eintragungsdatum)\n\nTKL GmbH\nGesellschaft mit beschränkter Haftung\nDuisburg\n\nDie Gesellschaft hat Gläubigern, deren Forderungen vor dieser Bekanntmachung begründet worden sind, Sicherheit zu leisten, soweit sie nicht Befriedigung verlangen können, wenn sie sich binnen sechs Monaten zu diesem Zweck melden."
    },
    {
      "date": "2026-02-02",
      "id": "144102",
      "original_text": "Registerbekanntmachung nach dem Umwandlungsgesetz\nNordrhein-Westfalen Amtsgericht Essen PR 4868\nEbbinghaus Partnerschaft mbB Wirtschaftsprüfungsgesellschaft Steuerberatungsgesellschaft – Solingen",
      "type": "Registerbekanntmachung nach dem Umwandlungsgesetz",
      "state": "Nordrhein-Westfalen",
      "amtsgericht": "Amtsgericht Essen",
      "registernummer": "PR 4868",
      "registerart": "PR",
      "company_name": "Ebbinghaus Partnerschaft mbB Wirtschaftsprüfungsgesellschaft Steuerberatungsgesellschaft",
      "company_seat": "Solingen",
      "details": "02.02.2026 (Bekanntmachungsdatum)\n\nNordrhein-Westfalen Amtsgericht Essen PR 4868\nRegisterbekanntmachung nach dem Umwandlungsgesetz 02.02.2026 (Eintragungsdatum)\n\nEbbinghaus Partnerschaft mbB Wirtschaftsprüfungsgesellschaft Steuerberatungsgesellschaft\nPartnerschaftsgesellschaft\nSolingen\n\nDen Gläubigern der an der formwechselnden Umwandlung beteiligten Rechtsträger ist, wenn sie binnen sechs Monaten nach dem Tag, an dem die Eintragung der formwechselnden Umwandlung in das Register des Sitzes desjenigen Rechtsträgers, dessen Gläubiger sie sind, nach § 19 Absatz 3 UmwG als bekanntgemacht gilt, ihren Anspruch nach Grund und Höhe schriftlich anmelden, Sicherheit zu leisten, soweit sie nicht Befriedigung verlangen können. Dieses Recht steht den Gläubigern jedoch nur zu, wenn sie glaubhaft machen, dass durch die formwechselnden Umwandlung die Erfüllung ihrer Forderung gefährdet wird."
    },
    {
      "date": "2026-02-02",
      "id": "144103",
      "original_text": "Registerbekanntmachung nach dem Umwandlungsgesetz\nNordrhein-Westfalen Amtsgericht Köln HRB 52355\nBVG Besitz- und Verwaltungsgesellschaft für technologieorientierte Unternehmungen mbH – Burscheid",
      "type": "Registerbekanntmachung nach dem Umwandlungsgesetz",
      "state": "Nordrhein-Westfalen",
      "amtsgericht": "Amtsgericht Köln",
      "registernummer": "HRB 52355",
      "registerart": "HRB",
      "company_name": "BVG Besitz- und Verwaltungsgesellschaft für technologieorientierte Unternehmungen mbH",
      "company_seat": "Burscheid",
      "details": "02.02.2026 (Bekanntmachungsdatum)\n\nNordrhein-Westfalen Amtsgericht Köln HRB 52355\nRegisterbekanntmachung nach dem Umwandlungsgesetz 02.02.2026 (Eintragungsdatum)\n\nBVG Besitz- und Verwaltungsgesellschaft für technologieorientierte Unternehmungen mbH\nGesellschaft mit beschränkter Haftung\nBurscheid\n\nDen Gläubigern der an der Abspaltung beteiligten Rechtsträger ist, wenn sie binnen sechs Monaten nach dem Tag, an dem die Eintragung der Abspaltung in das Register des Sitzes desjenigen Rechtsträgers, dessen Gläubiger sie sind, nach § 19 Absatz 3 UmwG als bekanntgemacht gilt, ihren Anspruch nach Grund und Höhe schriftlich anmelden, Sicherheit zu leisten, soweit sie nicht Befriedigung verlangen können. Dieses Recht steht den Gläubigern jedoch nur zu, wenn sie glaubhaft machen, dass durch die Abspaltung die Erfüllung ihrer Forderung gefährdet wird."
    },
    {
      "date": "2026-02-02",
      "id": "144104",
      "original_text": "Registerbekanntmachung nach dem Umwandlungsgesetz\nNordrhein-Westfalen Amtsgericht Paderborn HRB 1439\ndSPACE GmbH – Paderborn",
      "type": "Registerbekanntmachung nach dem Umwandlungsgesetz",
      "state": "Nordrhein-Westfalen",
      "amtsgericht": "Amtsgericht Paderborn",
      "registernummer": "HRB 1439",
      "registerart": "HRB",
      "company_name": "dSPACE GmbH",
      "company_seat": "Paderborn",
      "details": "02.02.2026 (Bekanntmachungsdatum)\n\nNordrhein-Westfalen Amtsgericht Paderborn HRB 1439\nRegisterbekanntmachung nach dem Umwandlungsgesetz 02.02.2026 (Eintragungsdatum)\n\ndSPACE GmbH\nGesellschaft mit beschränkter Haftung\nPaderborn\n\nDen Gläubigern der an der formwechselnden Umwandlung beteiligten Rechtsträger ist, wenn sie binnen sechs Monaten nach dem Tag, an dem die Eintragung der formwechselnden Umwandlung in das Register des Sitzes desjenigen Rechtsträgers, dessen Gläubiger sie sind, nach § 19 Absatz 3 UmwG als bekanntgemacht gilt, ihren Anspruch nach Grund und Höhe schriftlich anmelden, Sicherheit zu leisten, soweit sie nicht Befriedigung verlangen können. Dieses Recht steht den Gläubigern jedoch nur zu, wenn sie glaubhaft machen, dass durch die formwechselnden Umwandlung die Erfüllung ihrer Forderung gefährdet wird."
    },
    {
      "date": "2026-02-02",
      "id": "144105",
      "original_text": "Registerbekanntmachung nach dem Umwandlungsgesetz\nNordrhein-Westfalen Amtsgericht Köln HRA 38585\nDienstleistungszentrum Südmarkt GmbH & Co. oHG – Köln",
      "type": "Registerbekanntmachung nach dem Umwandlungsgesetz",
      "state": "Nordrhein-Westfalen",
      "amtsgericht": "Amtsgericht Köln",
      "registernummer": "HRA 38585",
      "registerart": "HRA",
      "company_name": "Dienstleistungszentrum Südmarkt GmbH & Co. oHG",
      "company_seat": "Köln",
      "details": "02.02.2026 (Bekanntmachungsdatum)\n\nNordrhein-Westfalen Amtsgericht Köln HRA 38585\nRegisterbekanntmachung nach dem Umwandlungsgesetz 02.02.2026 (Eintragungsdatum)\n\nDienstleistungszentrum Südmarkt GmbH & Co. oHG\nOffene Handelsgesellschaft\nKöln\n\nDie Gesellschaft hat Gläubigern, deren Forderungen vor dieser Bekanntmachung begründet worden sind, Sicherheit zu leisten, soweit sie nicht Befriedigung verlangen können, wenn sie sich binnen sechs Monaten zu diesem Zweck melden."
    },
    {
      "date": "2026-02-02",
      "id": "144106",
      "original_text": "Registerbekanntmachung nach dem Umwandlungsgesetz\nNordrhein-Westfalen Amtsgericht Düsseldorf HRB 49559\nSBR-net Consulting AG – Düsseldorf",
      "type": "Registerbekanntmachung nach dem Umwandlungsgesetz",
      "state": "Nordrhein-Westfalen",
      "amtsgericht": "Amtsgericht Düsseldorf",
      "registernummer": "HRB 49559",
      "registerart": "HRB",
      "company_name": "SBR-net Consulting AG",
      "company_seat": "Düsseldorf",
      "details": "02.02.2026 (Bekanntmachungsdatum)\n\nNordrhein-Westfalen Amtsgericht Düsseldorf HRB 49559\nRegisterbekanntmachung nach dem Umwandlungsgesetz 02.02.2026 (Eintragungsdatum)\n\nSBR-net Consulting AG\nAktiengesellschaft\nDüsseldorf\n\nDen Gläubigern der an der formwechselnden Umwandlung beteiligten Rechtsträger ist, wenn sie binnen sechs Monaten nach dem Tag, an dem die Eintragung der formwechselnden Umwandlung in das Register des Sitzes desjenigen Rechtsträgers, dessen Gläubiger sie sind, nach § 19 Absatz 3 UmwG als bekanntgemacht gilt, ihren Anspruch nach Grund und Höhe schriftlich anmelden, Sicherheit zu leisten, soweit sie nicht Befriedigung verlangen können. Dieses Recht steht den Gläubigern jedoch nur zu, wenn sie glaubhaft machen, dass durch die formwechselnden Umwandlung die Erfüllung ihrer Forderung gefährdet wird."
    },
    {
      "date": "2026-02-02",
      "id": "144107",
      "original_text": "Sonstige Registerbekanntmachung\nHessen Amtsgericht Frankfurt am Main HRB 133969\nAtlas Supermarkt GmbH – Frankfurt am Main",
      "type": "Sonstige Registerbekanntmachung",
      "state": "Hessen",
      "amtsgericht": "Amtsgericht Frankfurt am Main",
      "registernummer": "HRB 133969",
      "registerart": "HRB",
      "company_name": "Atlas Supermarkt GmbH",
      "company_seat": "Frankfurt am Main",
      "details": "02.02.2026 (Bekanntmachungsdatum)\n\nHessen Amtsgericht Frankfurt am Main HRB 133969\nSonstige Registerbekanntmachung 02.02.2026 (Eintragungsdatum)\n\nAtlas Supermarkt GmbH\nGesellschaft mit beschränkter Haftung\nFrankfurt am Main\n\nDie Gesellschaft hat Gläubigern, deren Forderungen vor dieser Bekanntmachung begründet worden sind, Sicherheit zu leisten, soweit sie nicht Befriedigung verlangen können, wenn sie sich binnen sechs Monaten nach dieser Bekanntmachung zu diesem Zweck melden."
    },
    {
      "date": "2026-02-02",
      "id": "144108",
      "original_text": "Registerbekanntmachung nach dem Umwandlungsgesetz\nHessen Amtsgericht Darmstadt HRA 87946\nGSS Gesellschaft für Stahlbau und Schweißtechnik KG – Bischofsheim",
      "type": "Registerbekanntmachung nach dem Umwandlungsgesetz",
      "state": "Hessen",
      "amtsgericht": "Amtsgericht Darmstadt",
      "registernummer": "HRA 87946",
      "registerart": "HRA",
      "company_name": "GSS Gesellschaft für Stahlbau und Schweißtechnik KG",
      "company_seat": "Bischofsheim",
      "details": "02.02.2026 (Bekanntmachungsdatum)\n\nHessen Amtsgericht Darmstadt HRA 87946\nRegisterbekanntmachung nach dem Umwandlungsgesetz 02.02.2026 (Eintragungsdatum)\n\nGSS Gesellschaft für Stahlbau und Schweißtechnik KG\nKommanditgesellschaft\nBischofsheim\n\nDen Gläubigern der an der formwechselnden Umwandlung beteiligten Rechtsträger ist, wenn sie binnen sechs Monaten nach dem Tag, an dem die Eintragung der formwechselnden Umwandlung in das Register des Sitzes derjenigen Rechtsträger deren Gläubiger sie sind, nach § 201 UmwG bekannt gemacht worden ist, ihren Anspruch nach Grund und Höhe schriftlich anmelden, Sicherheit zu leisten, soweit sie nicht Befriedigung verlangen können. Dieses Recht steht den Gläubigern jedoch nur zu, wenn sie glaubhaft machen, dass durch die formwechselnden Umwandlung die Erfüllung ihrer Forderung gefährdet wird."
    },
    {
      "date": "2026-02-02",
      "id": "144109",
      "original_text": "Einreichung neuer Dokumente\nHessen Amtsgericht Frankfurt am Main HRB 119629\nEW Discover GmbH – Frankfurt am Main",
      "type": "Einreichung neuer Dokumente",
      "state": "Hessen",
      "amtsgericht": "Amtsgericht Frankfurt am Main",
      "registernummer": "HRB 119629",
      "registerart": "HRB",
      "company_name": "EW Discover GmbH",
      "company_seat": "Frankfurt am Main",
      "details": "02.02.2026 (Bekanntmachungsdatum)\n\nHessen Amtsgericht Frankfurt am Main HRB 119629\nEinreichung neuer Dokumente 02.02.2026 (Eintragungsdatum)\n\nEW Discover GmbH\nGesellschaft mit beschränkter Haftung\nFrankfurt am Main\n\nDurch eine Änderung in den Personen der Aufsichtsratsmitglieder ist eine Liste der Mitglieder des Aufsichtsrates zum Handelsregister eingereicht worden."
    },
    {
      "date": "2026-02-02",
      "id": "144110",
      "original_text": "Löschungsankündigung\nHessen Amtsgericht Frankfurt am Main HRB 90460\nPowerland AG – Frankfurt am Main",
      "type": "Löschungsankündigung",
      "state": "Hessen",
      "amtsgericht": "Amtsgericht Frankfurt am Main",
      "registernummer": "HRB 90460",
      "registerart": "HRB",
      "company_name": "Powerland AG",
      "company_seat": "Frankfurt am Main",
      "details": "02.02.2026 (Bekanntmachungsdatum)\n\nHessen Amtsgericht Frankfurt am Main HRB 90460\nLöschungsankündigung\n\nPowerland AG\nAktiengesellschaft\nFrankfurt am Main\n\nDas Registergericht beabsichtigt die im Handelsregister eingetragene Gesellschaft von Amts wegen nach § 394 FamFG zu löschen. Die Frist zur Erhebung eines Widerspruchs gegen die beabsichtigte Löschung wird auf 3 Monate festgesetzt."
    },
    {
      "date": "2026-02-02",
      "id": "144111",
      "original_text": "Registerbekanntmachung nach dem Umwandlungsgesetz\nHessen Amtsgericht Darmstadt HRB 85403\nDietz Holding GmbH – Bensheim",
      "type": "Registerbekanntmachung nach dem Umwandlungsgesetz",
      "state": "Hessen",
      "amtsgericht": "Amtsgericht Darmstadt",
      "registernummer": "HRB 85403",
      "registerart": "HRB",
      "company_name": "Dietz Holding GmbH",
      "company_seat": "Bensheim",
      "details": "02.02.2026 (Bekanntmachungsdatum)\n\nHessen Amtsgericht Darmstadt HRB 85403\nRegisterbekanntmachung nach dem Umwandlungsgesetz 01.02.2026 (Eintragungsdatum)\n\nDietz Holding GmbH\nGesellschaft mit beschränkter Haftung\nBensheim\n\nDen Gläubigern der an der Verschmelzung beteiligten Rechtsträger ist, wenn sie binnen sechs Monaten nach dem Tag, an dem die Eintragung der Verschmelzung in das Register des Sitzes desjenigen Rechtsträgers, dessen Gläubiger sie sind, nach § 19 Absatz 3 UmwG bekannt gemacht worden ist, ihren Anspruch nach Grund und Höhe schriftlich anmelden, Sicherheit zu leisten, soweit sie nicht Befriedigung verlangen können. Dieses Recht steht den Gläubigern jedoch nur zu, wenn sie glaubhaft machen, dass durch die Verschmelzung die Erfüllung ihrer Forderung gefährdet wird."
    },
    {
      "date": "2026-02-02",
      "id": "144112",
      "original_text": "Sonstige Registerbekanntmachung\nHessen Amtsgericht Marburg VR 4860\nAngelburger Senioren Computer Club - ASCC – Angelburg",
      "type": "Sonstige Registerbekanntmachung",
      "state": "Hessen",
      "amtsgericht": "Amtsgericht Marburg",
      "registernummer": "VR 4860",
      "registerart": "VR",
      "company_name": "Angelburger Senioren Computer Club - ASCC",
      "company_seat": "Angelburg",
      "details": "02.02.2026 (Bekanntmachungsdatum)\n\nHessen Amtsgericht Marburg VR 4860\nSonstige Registerbekanntmachung 24.01.2026 (Eintragungsdatum)\n\nAngelburger Senioren Computer Club - ASCC\neingetragener Verein\nAngelburg\n\nDer Verein ist aufgelöst."
    },
    {
      "date": "2026-02-02",
      "id": "144113",
      "original_text": "Löschungsankündigung\nHessen Amtsgericht Frankfurt am Main HRB 106491\nDämmTech GmbH – Frankfurt am Main",
      "type": "Löschungsankündigung",
      "state": "Hessen",
      "amtsgericht": "Amtsgericht Frankfurt am Main",
      "registernummer": "HRB 106491",
      "registerart": "HRB",
      "company_name": "DämmTech GmbH",
      "company_seat": "Frankfurt am Main",
      "details": "02.02.2026 (Bekanntmachungsdatum)\n\nHessen Amtsgericht Frankfurt am Main HRB 106491\nLöschungsankündigung\n\nDämmTech GmbH\nGesellschaft mit beschränkter Haftung\nFrankfurt am Main\n\nDas Registergericht beabsichtigt die im Handelsregister eingetragene Gesellschaft von Amts wegen nach § 394 FamFG zu löschen. Die Frist zur Erhebung eines Widerspruchs gegen die beabsichtigte Löschung wird auf 1 Monat festgesetzt."
    },
    {
      "date": "2026-02-02",
      "id": "144114",
      "original_text": "Löschungsankündigung\nHessen Amtsgericht Frankfurt am Main HRB 99756\nMd.Lab GmbH – Frankfurt am Main",
      "type": "Löschungsankündigung",
      "state": "Hessen",
      "amtsgericht": "Amtsgericht Frankfurt am Main",
      "registernummer": "HRB 99756",
      "registerart": "HRB",
      "company_name": "Md.Lab GmbH",
      "company_seat": "Frankfurt am Main",
      "details": "02.02.2026 (Bekanntmachungsdatum)\n\nHessen Amtsgericht Frankfurt am Main HRB 99756\nLöschungsankündigung\n\nMd.Lab GmbH\nGesellschaft mit beschränkter Haftung\nFrankfurt am Main\n\nDas Registergericht beabsichtigt die im Handelsregister eingetragene Gesellschaft von Amts wegen nach § 394 FamFG zu löschen. Die Frist zur Erhebung eines Widerspruchs gegen die beabsichtigte Löschung wird auf 1 Monate festgesetzt."
    },
    {
      "date": "2026-02-02",
      "id": "144115",
      "original_text": "Einreichung neuer Dokumente\nHessen Amtsgericht Darmstadt HRB 99032\nBest Entertainment AG – Bischofsheim",
      "type": "Einreichung neuer Dokumente",
      "state": "Hessen",
      "amtsgericht": "Amtsgericht Darmstadt",
      "registernummer": "HRB 99032",
      "registerart": "HRB",
      "company_name": "Best Entertainment AG",
      "company_seat": "Bischofsheim",
      "details": "02.02.2026 (Bekanntmachungsdatum)\n\nHessen Amtsgericht Darmstadt HRB 99032\nEinreichung neuer Dokumente 02.02.2026 (Eintragungsdatum)\n\nBest Entertainment AG\nAktiengesellschaft\nBischofsheim\n\nDurch eine Änderung in den Personen der Aufsichtsratsmitglieder ist eine Liste der Mitglieder des Aufsichtsrates zum Handelsregister eingereicht worden."
    },
    {
      "date": "2026-02-02",
      "id": "144116",
      "original_text": "Löschungsankündigung\nHessen Amtsgericht Gießen HRB 8712\nBeatus Bau Verwaltungs GmbH – Grünberg",
      "type": "Löschungsankündigung",
      "state": "Hessen",
      "amtsgericht": "Amtsgericht Gießen",
      "registernummer": "HRB 8712",
      "registerart": "HRB",
      "company_name": "Beatus Bau Verwaltungs GmbH",
      "company_seat": "Grünberg",
      "details": "02.02.2026 (Bekanntmachungsdatum)\n\nHessen Amtsgericht Gießen HRB 8712\nLöschungsankündigung\n\nBeatus Bau Verwaltungs GmbH\nGesellschaft mit beschränkter Haftung\nGrünberg\n\nEs ist beabsichtigt, die Gesellschaft wegen Vermögenslosigkeit gem. § 394 FamFG von Amts wegen zu löschen.\n\nHiergegen kann innerhalb von drei Monaten nach dieser Veröffentlichung Widerspruch bei dem Amtsgericht Gießen eingelegt werden.\n\nSollte Widerspruch eingelegt werden, dürfte dies nur mit Begründung erfolgsversprechend sein. Insbesondere sollte vorhandenes Vermögen der Gesellschaft innerhalb der genannten Frist nachgewiesen werden."
    },
    {
      "date": "2026-02-02",
      "id": "144117",
      "original_text": "Einreichung neuer Dokumente\nHessen Amtsgericht Frankfurt am Main HRB 106354\nFraport Ausbau Süd GmbH – Frankfurt am Main",
      "type": "Einreichung neuer Dokumente",
      "state": "Hessen",
      "amtsgericht": "Amtsgericht Frankfurt am Main",
      "registernummer": "HRB 106354",
      "registerart": "HRB",
      "company_name": "Fraport Ausbau Süd GmbH",
      "company_seat": "Frankfurt am Main",
      "details": "02.02.2026 (Bekanntmachungsdatum)\n\nHessen Amtsgericht Frankfurt am Main HRB 106354\nEinreichung neuer Dokumente 02.02.2026 (Eintragungsdatum)\n\nFraport Ausbau Süd GmbH\nGesellschaft mit beschränkter Haftung\nFrankfurt am Main\n\nDurch eine Änderung in den Personen der Aufsichtsratsmitglieder ist eine Liste der Mitglieder des Aufsichtsrates zum Handelsregister eingereicht worden."
    },
    {
      "date": "2026-02-02",
      "id": "144118",
      "original_text": "Registerbekanntmachung nach dem Umwandlungsgesetz\nHessen Amtsgericht Darmstadt HRB 93136\nDietz Grundbesitz Kuppenheim GmbH – Bensheim",
      "type": "Registerbekanntmachung nach dem Umwandlungsgesetz",
      "state": "Hessen",
      "amtsgericht": "Amtsgericht Darmstadt",
      "registernummer": "HRB 93136",
      "registerart": "HRB",
      "company_name": "Dietz Grundbesitz Kuppenheim GmbH",
      "company_seat": "Bensheim",
      "details": "02.02.2026 (Bekanntmachungsdatum)\n\nHessen Amtsgericht Darmstadt HRB 93136\nRegisterbekanntmachung nach dem Umwandlungsgesetz 01.02.2026 (Eintragungsdatum)\n\nDietz Grundbesitz Kuppenheim GmbH\nGesellschaft mit beschränkter Haftung\nBensheim\n\nDen Gläubigern der an der Verschmelzung beteiligten Rechtsträger ist, wenn sie binnen sechs Monaten nach dem Tag, an dem die Eintragung der Verschmelzung in das Register des Sitzes desjenigen Rechtsträgers, dessen Gläubiger sie sind, nach § 19 Absatz 3 UmwG bekannt gemacht worden ist, ihren Anspruch nach Grund und Höhe schriftlich anmelden, Sicherheit zu leisten, soweit sie nicht Befriedigung verlangen können. Dieses Recht steht den Gläubigern jedoch nur zu, wenn sie glaubhaft machen, dass durch die Verschmelzung die Erfüllung ihrer Forderung gefährdet wird."
    },
    {
      "date": "2026-02-02",
      "id": "144119",
      "original_text": "Registerbekanntmachung nach dem Umwandlungsgesetz\nHessen Amtsgericht Darmstadt HRB 94338\nAddVision Holding GmbH – Roßdorf",
      "type": "Registerbekanntmachung nach dem Umwandlungsgesetz",
      "state": "Hessen",
      "amtsgericht": "Amtsgericht Darmstadt",
      "registernummer": "HRB 94338",
      "registerart": "HRB",
      "company_name": "AddVision Holding GmbH",
      "company_seat": "Roßdorf",
      "details": "02.02.2026 (Bekanntmachungsdatum)\n\nHessen Amtsgericht Darmstadt HRB 94338\nRegisterbekanntmachung nach dem Umwandlungsgesetz 01.02.2026 (Eintragungsdatum)\n\nAddVision Holding GmbH\nGesellschaft mit beschränkter Haftung\nRoßdorf\n\nDen Gläubigern der an der Verschmelzung beteiligten Rechtsträger ist, wenn sie binnen sechs Monaten nach dem Tag, an dem die Eintragung der Verschmelzung in das Register des Sitzes desjenigen Rechtsträgers, dessen Gläubiger sie sind, nach § 19 Absatz 3 UmwG bekannt gemacht worden ist, ihren Anspruch nach Grund und Höhe schriftlich anmelden, Sicherheit zu leisten, soweit sie nicht Befriedigung verlangen können. Dieses Recht steht den Gläubigern jedoch nur zu, wenn sie glaubhaft machen, dass durch die Verschmelzung die Erfüllung ihrer Forderung gefährdet wird."
    },
    {
      "date": "2026-02-02",
      "id": "144120",
      "original_text": "Registerbekanntmachung nach dem Umwandlungsgesetz\nHessen Amtsgericht Darmstadt HRB 94314\nAddVision GmbH – Roßdorf",
      "type": "Registerbekanntmachung nach dem Umwandlungsgesetz",
      "state": "Hessen",
      "amtsgericht": "Amtsgericht Darmstadt",
      "registernummer": "HRB 94314",
      "registerart": "HRB",
      "company_name": "AddVision GmbH",
      "company_seat": "Roßdorf",
      "details": "02.02.2026 (Bekanntmachungsdatum)\n\nHessen Amtsgericht Darmstadt HRB 94314\nRegisterbekanntmachung nach dem Umwandlungsgesetz 01.02.2026 (Eintragungsdatum)\n\nAddVision GmbH\nGesellschaft mit beschränkter Haftung\nRoßdorf\n\nDen Gläubigern der an der Verschmelzung beteiligten Rechtsträger ist, wenn sie binnen sechs Monaten nach dem Tag, an dem die Eintragung der Verschmelzung in das Register des Sitzes desjenigen Rechtsträgers, dessen Gläubiger sie sind, nach § 19 Absatz 3 UmwG bekannt gemacht worden ist, ihren Anspruch nach Grund und Höhe schriftlich anmelden, Sicherheit zu leisten, soweit sie nicht Befriedigung verlangen können. Dieses Recht steht den Gläubigern jedoch nur zu, wenn sie glaubhaft machen, dass durch die Verschmelzung die Erfüllung ihrer Forderung gefährdet wird."
    },
    {
      "date": "2026-02-02",
      "id": "144121",
      "original_text": "Löschungsankündigung\nHessen Amtsgericht Frankfurt am Main HRB 88561\nTriton III Holding 4 GmbH – Frankfurt am Main",
      "type": "Löschungsankündigung",
      "state": "Hessen",
      "amtsgericht": "Amtsgericht Frankfurt am Main",
      "registernummer": "HRB 88561",
      "registerart": "HRB",
      "company_name": "Triton III Holding 4 GmbH",
      "company_seat": "Frankfurt am Main",
      "details": "02.02.2026 (Bekanntmachungsdatum)\n\nHessen Amtsgericht Frankfurt am Main HRB 88561\nLöschungsankündigung\n\nTriton III Holding 4 GmbH\nGesellschaft mit beschränkter Haftung\nFrankfurt am Main\n\nEs ist beabsichtigt, die Gesellschaft wegen Vermögenslosigkeit gemäß § 394 FamFG von Amts wegen im Handelsregister zu löschen. Hiergegen kann innerhalb eines Monats nach dieser Veröffentlichung Widerspruch bei dem Amtsgericht Frankfurt am Main eingelegt werden."
    },
    {
      "date": "2026-02-02",
      "id": "144122",
      "original_text": "Löschungsankündigung\nHessen Amtsgericht Bad Homburg v.d.H. HRB 14678\nVJ Bau GmbH – Steinbach (Taunus)",
      "type": "Löschungsankündigung",
      "state": "Hessen",
      "amtsgericht": "Amtsgericht Bad Homburg v.d.H.",
      "registernummer": "HRB 14678",
      "registerart": "HRB",
      "company_name": "VJ Bau GmbH",
      "company_seat": "Steinbach (Taunus)",
      "details": "02.02.2026 (Bekanntmachungsdatum)\n\nHessen Amtsgericht Bad Homburg v.d.H. HRB 14678\nLöschungsankündigung\n\nVJ Bau GmbH\nGesellschaft mit beschränkter Haftung\nSteinbach (Taunus)\n\nDas Registergericht beabsichtigt die im Handelsregister eingetragene Gesellschaft von Amts wegen nach § 394 FamFG zu löschen. Die Frist zur Erhebung eines Widerspruchs gegen die beabsichtigte Löschung wird auf 3 Monate festgesetzt."
    }
  ]
}