{
  "date": "2026-02-14",
  "date_of_scrape": "2026-02-15T04:40:40.304Z",
  "tool_version": "0.2.0",
  "number_of_announcements": 11,
  "announcements": [
    {
      "date": "2026-02-14",
      "id": "145145",
      "original_text": "Löschungsankündigung\nBayern Amtsgericht München HRB 252270\nAGNI GmbH – Gräfelfing",
      "type": "Löschungsankündigung",
      "state": "Bayern",
      "amtsgericht": "Amtsgericht München",
      "registernummer": "HRB 252270",
      "registerart": "HRB",
      "company_name": "AGNI GmbH",
      "company_seat": "Gräfelfing",
      "details": "14.02.2026 (Bekanntmachungsdatum)\n\nBayern Amtsgericht München HRB 252270\nLöschungsankündigung\n\nAGNI GmbH\nGesellschaft mit beschränkter Haftung\nGräfelfing\n\nDas Registergericht beabsichtigt, die im Handelsregister eingetragene Gesellschaft wegen Vermögenslosigkeit von Amts wegen nach § 394 FamFG zu löschen. Die Frist zur Erhebung eines Widerspruchs ist auf drei Monate festgesetzt."
    },
    {
      "date": "2026-02-14",
      "id": "145146",
      "original_text": "Einreichung neuer Dokumente\nBayern Amtsgericht München HRB 246011\nPORR GmbH & Co. KGaA – München",
      "type": "Einreichung neuer Dokumente",
      "state": "Bayern",
      "amtsgericht": "Amtsgericht München",
      "registernummer": "HRB 246011",
      "registerart": "HRB",
      "company_name": "PORR GmbH & Co. KGaA",
      "company_seat": "München",
      "details": "14.02.2026 (Bekanntmachungsdatum)\n\nBayern Amtsgericht München HRB 246011\nEinreichung neuer Dokumente\n\nPORR GmbH & Co. KGaA\nKommanditgesellschaft auf Aktien\nMünchen\n\nDem Amtsgericht München -Registergericht- ist eine Liste der Mitglieder des Aufsichtsrats eingereicht worden, §§ 278 Abs. 3, 106 AktG."
    },
    {
      "date": "2026-02-14",
      "id": "145147",
      "original_text": "Einreichung neuer Dokumente\nBayern Amtsgericht Regensburg HRB 5287\nTELIS FINANZ Vermittlung Aktiengesellschaft – Regensburg",
      "type": "Einreichung neuer Dokumente",
      "state": "Bayern",
      "amtsgericht": "Amtsgericht Regensburg",
      "registernummer": "HRB 5287",
      "registerart": "HRB",
      "company_name": "TELIS FINANZ Vermittlung Aktiengesellschaft",
      "company_seat": "Regensburg",
      "details": "14.02.2026 (Bekanntmachungsdatum)\n\nBayern Amtsgericht Regensburg HRB 5287\nEinreichung neuer Dokumente 21.01.2026 (Eintragungsdatum)\n\nTELIS FINANZ Vermittlung Aktiengesellschaft\nAktiengesellschaft\nRegensburg\n\nDem #Re.Name ist eine Liste der Mitglieder des Aufsichtsrats eingereicht worden, § 106 AktG."
    },
    {
      "date": "2026-02-14",
      "id": "145148",
      "original_text": "Einreichung neuer Dokumente\nBayern Amtsgericht München HRB 281850\nFujitsu ND Solutions AG – München",
      "type": "Einreichung neuer Dokumente",
      "state": "Bayern",
      "amtsgericht": "Amtsgericht München",
      "registernummer": "HRB 281850",
      "registerart": "HRB",
      "company_name": "Fujitsu ND Solutions AG",
      "company_seat": "München",
      "details": "14.02.2026 (Bekanntmachungsdatum)\n\nBayern Amtsgericht München HRB 281850\nEinreichung neuer Dokumente 13.02.2026 (Eintragungsdatum)\n\nFujitsu ND Solutions AG\nAktiengesellschaft\nMünchen\n\nDem #Re.Name ist eine Liste der Mitglieder des Aufsichtsrats eingereicht worden, § 106 AktG."
    },
    {
      "date": "2026-02-14",
      "id": "145149",
      "original_text": "Registerbekanntmachung nach dem Umwandlungsgesetz\nBayern Amtsgericht Nürnberg HRB 26358\nPENSIO GmbH – Nürnberg",
      "type": "Registerbekanntmachung nach dem Umwandlungsgesetz",
      "state": "Bayern",
      "amtsgericht": "Amtsgericht Nürnberg",
      "registernummer": "HRB 26358",
      "registerart": "HRB",
      "company_name": "PENSIO GmbH",
      "company_seat": "Nürnberg",
      "details": "14.02.2026 (Bekanntmachungsdatum)\n\nBayern Amtsgericht Nürnberg HRB 26358\nRegisterbekanntmachung nach dem Umwandlungsgesetz 13.02.2026 (Eintragungsdatum)\n\nPENSIO GmbH\nGesellschaft mit beschränkter Haftung\nNürnberg\n\nDen Gläubigern der an der Ausgliederung beteiligten Rechtsträger ist, wenn sie binnen sechs Monaten nach dem Tag, an dem die Eintragung der Ausgliederung in das Register des Sitzes desjenigen Rechtsträgers, dessen Gläubiger sie sind, nach §§ 125, 19 Abs. 3 UmwG als bekannt gemacht gilt, ihren Anspruch nach Grund und Höhe in Textform anmelden, Sicherheit zu leisten, soweit sie nicht Befriedigung verlangen können. Dieses Recht steht den Gläubigern jedoch nur zu, wenn sie glaubhaft machen, dass durch die Ausgliederung die Erfüllung ihrer Forderung gefährdet wird."
    },
    {
      "date": "2026-02-14",
      "id": "145150",
      "original_text": "Löschungsankündigung\nBayern Amtsgericht München HRB 72497\nPKL PRODUKTIONS-KAPAZITÄTEN-LEASING VERMIETUNGS- Gesellschaft für mobile Investitionsgüter mit beschränkter Haftung – München",
      "type": "Löschungsankündigung",
      "state": "Bayern",
      "amtsgericht": "Amtsgericht München",
      "registernummer": "HRB 72497",
      "registerart": "HRB",
      "company_name": "PKL PRODUKTIONS-KAPAZITÄTEN-LEASING VERMIETUNGS- Gesellschaft für mobile Investitionsgüter mit beschränkter Haftung",
      "company_seat": "München",
      "details": "14.02.2026 (Bekanntmachungsdatum)\n\nBayern Amtsgericht München HRB 72497\nLöschungsankündigung\n\nPKL PRODUKTIONS-KAPAZITÄTEN-LEASING VERMIETUNGS- Gesellschaft für mobile Investitionsgüter mit beschränkter Haftung\nGesellschaft mit beschränkter Haftung\nMünchen\n\nDas Registergericht beabsichtigt, die im Handelsregister eingetragene Gesellschaft wegen Vermögenslosigkeit von Amts wegen nach § 394 FamFG zu löschen. Die Frist zur Erhebung eines Widerspruchs ist auf drei Monate festgesetzt."
    },
    {
      "date": "2026-02-14",
      "id": "145151",
      "original_text": "Einreichung neuer Dokumente\nBayern Amtsgericht München HRB 140509\nGAF AG – München",
      "type": "Einreichung neuer Dokumente",
      "state": "Bayern",
      "amtsgericht": "Amtsgericht München",
      "registernummer": "HRB 140509",
      "registerart": "HRB",
      "company_name": "GAF AG",
      "company_seat": "München",
      "details": "14.02.2026 (Bekanntmachungsdatum)\n\nBayern Amtsgericht München HRB 140509\nEinreichung neuer Dokumente 13.02.2026 (Eintragungsdatum)\n\nGAF AG\nAktiengesellschaft\nMünchen\n\nDem Amtsgericht München -Registergericht- ist eine Liste der Mitglieder des Aufsichtsrats eingereicht worden, § 106 AktG."
    },
    {
      "date": "2026-02-14",
      "id": "145152",
      "original_text": "Registerbekanntmachung nach dem Umwandlungsgesetz\nBayern Amtsgericht Nürnberg HRA 13623\nlavinias Finanzplanung e.K. – Nürnberg",
      "type": "Registerbekanntmachung nach dem Umwandlungsgesetz",
      "state": "Bayern",
      "amtsgericht": "Amtsgericht Nürnberg",
      "registernummer": "HRA 13623",
      "registerart": "HRA",
      "company_name": "lavinias Finanzplanung e.K.",
      "company_seat": "Nürnberg",
      "details": "14.02.2026 (Bekanntmachungsdatum)\n\nBayern Amtsgericht Nürnberg HRA 13623\nRegisterbekanntmachung nach dem Umwandlungsgesetz 13.02.2026 (Eintragungsdatum)\n\nlavinias Finanzplanung e.K.\nEinzelkaufmann / Einzelkauffrau\nNürnberg\n\nDen Gläubigern der an der Ausgliederung beteiligten Rechtsträger ist, wenn sie binnen sechs Monaten nach dem Tag, an dem die Eintragung der Ausgliederung in das Register des Sitzes desjenigen Rechtsträgers, dessen Gläubiger sie sind, nach §§ 125, 19 Abs. 3 UmwG als bekannt gemacht gilt, ihren Anspruch nach Grund und Höhe in Textform anmelden, Sicherheit zu leisten, soweit sie nicht Befriedigung verlangen können. Dieses Recht steht den Gläubigern jedoch nur zu, wenn sie glaubhaft machen, dass durch die Ausgliederung die Erfüllung ihrer Forderung gefährdet wird."
    },
    {
      "date": "2026-02-14",
      "id": "145153",
      "original_text": "Registerbekanntmachung nach dem Umwandlungsgesetz\nBayern Amtsgericht München HRB 157537\nFlowCAD CAE Solutions GmbH – Feldkirchen",
      "type": "Registerbekanntmachung nach dem Umwandlungsgesetz",
      "state": "Bayern",
      "amtsgericht": "Amtsgericht München",
      "registernummer": "HRB 157537",
      "registerart": "HRB",
      "company_name": "FlowCAD CAE Solutions GmbH",
      "company_seat": "Feldkirchen",
      "details": "14.02.2026 (Bekanntmachungsdatum)\n\nBayern Amtsgericht München HRB 157537\nRegisterbekanntmachung nach dem Umwandlungsgesetz 13.02.2026 (Eintragungsdatum)\n\nFlowCAD CAE Solutions GmbH\nGesellschaft mit beschränkter Haftung\nFeldkirchen\n\nDen Gläubigern der an der Verschmelzung beteiligten Rechtsträger ist, wenn sie binnen sechs Monaten nach dem Tag, an dem die Eintragung der Verschmelzung in das Register des Sitzes desjenigen Rechtsträgers, dessen Gläubiger sie sind, nach § 19 Abs. 3 UmwG als bekannt gemacht gilt, ihren Anspruch nach Grund und Höhe in Textform anmelden, Sicherheit zu leisten, soweit sie nicht Befriedigung verlangen können. Dieses Recht steht den Gläubigern jedoch nur zu, wenn sie glaubhaft machen, dass durch die Verschmelzung die Erfüllung ihrer Forderung gefährdet wird. des formwechselnden Rechtsträgers ist, wenn sie binnen sechs Monaten nach dem Tag, an dem die Eintragung des Formwechsels nach § 201 UmwG als bekannt gemacht gilt, ihren Anspruch nach Grund und Höhe in Textform anmelden, Sicherheit zu leisten, soweit sie nicht Befriedigung verlangen können. Dieses Recht steht den Gläubigern jedoch nur zu, wenn sie glaubhaft machen, dass durch den Formwechsel die Erfüllung ihrer Forderung gefährdet wird."
    },
    {
      "date": "2026-02-14",
      "id": "145154",
      "original_text": "Einreichung neuer Dokumente\nBayern Amtsgericht München HRB 235854\nInfinity Investment AG – Grünwald",
      "type": "Einreichung neuer Dokumente",
      "state": "Bayern",
      "amtsgericht": "Amtsgericht München",
      "registernummer": "HRB 235854",
      "registerart": "HRB",
      "company_name": "Infinity Investment AG",
      "company_seat": "Grünwald",
      "details": "14.02.2026 (Bekanntmachungsdatum)\n\nBayern Amtsgericht München HRB 235854\nEinreichung neuer Dokumente 13.02.2026 (Eintragungsdatum)\n\nInfinity Investment AG\nAktiengesellschaft\nGrünwald\n\nDem Amtsgericht München -Registergericht- ist eine Liste der Mitglieder des Aufsichtsrats eingereicht worden, § 106 AktG."
    },
    {
      "date": "2026-02-14",
      "id": "145155",
      "original_text": "Registerbekanntmachung nach dem Umwandlungsgesetz\nNordrhein-Westfalen Amtsgericht Köln HRB 41354\nJockel Brandschutztechnik-Service GmbH – Köln",
      "type": "Registerbekanntmachung nach dem Umwandlungsgesetz",
      "state": "Nordrhein-Westfalen",
      "amtsgericht": "Amtsgericht Köln",
      "registernummer": "HRB 41354",
      "registerart": "HRB",
      "company_name": "Jockel Brandschutztechnik-Service GmbH",
      "company_seat": "Köln",
      "details": "14.02.2026 (Bekanntmachungsdatum)\n\nNordrhein-Westfalen Amtsgericht Köln HRB 41354\nRegisterbekanntmachung nach dem Umwandlungsgesetz 14.02.2026 (Eintragungsdatum)\n\nJockel Brandschutztechnik-Service GmbH\nGesellschaft mit beschränkter Haftung\nKöln\n\nDen Gläubigern der an der Verschmelzung beteiligten Rechtsträger ist, wenn sie binnen sechs Monaten nach dem Tag, an dem die Eintragung der Verschmelzung in das Register des Sitzes desjenigen Rechtsträgers, dessen Gläubiger sie sind, nach § 19 Absatz 3 UmwG als bekanntgemacht gilt, ihren Anspruch nach Grund und Höhe schriftlich anmelden, Sicherheit zu leisten, soweit sie nicht Befriedigung verlangen können. Dieses Recht steht den Gläubigern jedoch nur zu, wenn sie glaubhaft machen, dass durch die Verschmelzung die Erfüllung ihrer Forderung gefährdet wird."
    }
  ]
}