{
  "date": "2026-02-20",
  "date_of_scrape": "2026-02-21T04:35:33.157Z",
  "tool_version": "0.2.0",
  "number_of_announcements": 101,
  "announcements": [
    {
      "date": "2026-02-20",
      "id": "145708",
      "original_text": "Einreichung neuer Dokumente\nBayern Amtsgericht Nürnberg HRB 22271\nBio-Gate AG – Nürnberg",
      "type": "Einreichung neuer Dokumente",
      "state": "Bayern",
      "amtsgericht": "Amtsgericht Nürnberg",
      "registernummer": "HRB 22271",
      "registerart": "HRB",
      "company_name": "Bio-Gate AG",
      "company_seat": "Nürnberg",
      "details": "20.02.2026 (Bekanntmachungsdatum)\n\nBayern Amtsgericht Nürnberg HRB 22271\nEinreichung neuer Dokumente\n\nBio-Gate AG\nAktiengesellschaft\nNürnberg\n\nDem Amtsgericht Nürnberg -Registergericht- ist eine Liste der Mitglieder des Aufsichtsrats eingereicht worden, § 106 AktG."
    },
    {
      "date": "2026-02-20",
      "id": "145709",
      "original_text": "Löschungsankündigung\nBayern Amtsgericht Traunstein HRB 30161\nMaKu Altbausanierung GmbH – Kiefersfelden",
      "type": "Löschungsankündigung",
      "state": "Bayern",
      "amtsgericht": "Amtsgericht Traunstein",
      "registernummer": "HRB 30161",
      "registerart": "HRB",
      "company_name": "MaKu Altbausanierung GmbH",
      "company_seat": "Kiefersfelden",
      "details": "20.02.2026 (Bekanntmachungsdatum)\n\nBayern Amtsgericht Traunstein HRB 30161\nLöschungsankündigung 19.02.2026 (Eintragungsdatum)\n\nMaKu Altbausanierung GmbH\nGesellschaft mit beschränkter Haftung\nKiefersfelden\n\nDas Registergericht beabsichtigt, die im Handelsregister eingetragene Gesellschaft wegen Vermögenslosigkeit von Amts wegen nach § 394 FamFG zu löschen. Die Frist zur Erhebung eines Widerspruchs ist auf einen Monat festgesetzt."
    },
    {
      "date": "2026-02-20",
      "id": "145710",
      "original_text": "Löschungsankündigung\nBayern Amtsgericht München HRB 235818\nMUC-PM Münchner Consulting & Personalmanagement GmbH – München",
      "type": "Löschungsankündigung",
      "state": "Bayern",
      "amtsgericht": "Amtsgericht München",
      "registernummer": "HRB 235818",
      "registerart": "HRB",
      "company_name": "MUC-PM Münchner Consulting & Personalmanagement GmbH",
      "company_seat": "München",
      "details": "20.02.2026 (Bekanntmachungsdatum)\n\nBayern Amtsgericht München HRB 235818\nLöschungsankündigung 19.02.2026 (Eintragungsdatum)\n\nMUC-PM Münchner Consulting & Personalmanagement GmbH\nGesellschaft mit beschränkter Haftung\nMünchen\n\nDas Registergericht beabsichtigt, die im Handelsregister eingetragene Gesellschaft wegen Vermögenslosigkeit von Amts wegen nach § 394 FamFG zu löschen. Die Frist zur Erhebung eines Widerspruchs ist auf drei Monate festgesetzt."
    },
    {
      "date": "2026-02-20",
      "id": "145711",
      "original_text": "Einreichung neuer Dokumente\nBayern Amtsgericht Aschaffenburg HRB 16331\nUnicornis GmbH – Kleinostheim",
      "type": "Einreichung neuer Dokumente",
      "state": "Bayern",
      "amtsgericht": "Amtsgericht Aschaffenburg",
      "registernummer": "HRB 16331",
      "registerart": "HRB",
      "company_name": "Unicornis GmbH",
      "company_seat": "Kleinostheim",
      "details": "20.02.2026 (Bekanntmachungsdatum)\n\nBayern Amtsgericht Aschaffenburg HRB 16331\nEinreichung neuer Dokumente\n\nUnicornis GmbH\nGesellschaft mit beschränkter Haftung\nKleinostheim\n\nDem Amtsgericht Aschaffenburg -Registergericht- ist eine Liste der Mitglieder des Aufsichtsrats eingereicht worden, § 52 Abs. 3 S. 2 GmbHG."
    },
    {
      "date": "2026-02-20",
      "id": "145712",
      "original_text": "Registerbekanntmachung nach dem Umwandlungsgesetz\nBayern Amtsgericht München HRB 133172\nOcchio GmbH – München",
      "type": "Registerbekanntmachung nach dem Umwandlungsgesetz",
      "state": "Bayern",
      "amtsgericht": "Amtsgericht München",
      "registernummer": "HRB 133172",
      "registerart": "HRB",
      "company_name": "Occhio GmbH",
      "company_seat": "München",
      "details": "20.02.2026 (Bekanntmachungsdatum)\n\nBayern Amtsgericht München HRB 133172\nRegisterbekanntmachung nach dem Umwandlungsgesetz 19.02.2026 (Eintragungsdatum)\n\nOcchio GmbH\nGesellschaft mit beschränkter Haftung\nMünchen\n\nDen Gläubigern der an der Verschmelzung beteiligten Rechtsträger ist, wenn sie binnen sechs Monaten nach dem Tag, an dem die Eintragung der Verschmelzung in das Register des Sitzes desjenigen Rechtsträgers, dessen Gläubiger sie sind, nach § 19 Abs. 3 UmwG als bekannt gemacht gilt, ihren Anspruch nach Grund und Höhe in Textform anmelden, Sicherheit zu leisten, soweit sie nicht Befriedigung verlangen können. Dieses Recht steht den Gläubigern jedoch nur zu, wenn sie glaubhaft machen, dass durch die Verschmelzung die Erfüllung ihrer Forderung gefährdet wird."
    },
    {
      "date": "2026-02-20",
      "id": "145713",
      "original_text": "Löschungsankündigung\nBayern Amtsgericht Passau HRB 12952\nBLAUWERT Regionalentwicklung GmbH – Pocking",
      "type": "Löschungsankündigung",
      "state": "Bayern",
      "amtsgericht": "Amtsgericht Passau",
      "registernummer": "HRB 12952",
      "registerart": "HRB",
      "company_name": "BLAUWERT Regionalentwicklung GmbH",
      "company_seat": "Pocking",
      "details": "20.02.2026 (Bekanntmachungsdatum)\n\nBayern Amtsgericht Passau HRB 12952\nLöschungsankündigung\n\nBLAUWERT Regionalentwicklung GmbH\nGesellschaft mit beschränkter Haftung\nPocking\n\nDas Registergericht beabsichtigt, die im Handelsregister eingetragene Gesellschaft wegen Vermögenslosigkeit von Amts wegen nach § 394 FamFG zu löschen. Die Frist zur Erhebung eines Widerspruchs ist auf einen Monat festgesetzt."
    },
    {
      "date": "2026-02-20",
      "id": "145714",
      "original_text": "Registerbekanntmachung nach dem Umwandlungsgesetz\nBayern Amtsgericht Weiden i. d. OPf. HRA 1656\nFaltenbacher Jalousienbau GmbH & Co. KG – Erbendorf",
      "type": "Registerbekanntmachung nach dem Umwandlungsgesetz",
      "state": "Bayern",
      "amtsgericht": "Amtsgericht Weiden i. d. OPf.",
      "registernummer": "HRA 1656",
      "registerart": "HRA",
      "company_name": "Faltenbacher Jalousienbau GmbH & Co. KG",
      "company_seat": "Erbendorf",
      "details": "20.02.2026 (Bekanntmachungsdatum)\n\nBayern Amtsgericht Weiden i. d. OPf. HRA 1656\nRegisterbekanntmachung nach dem Umwandlungsgesetz 19.02.2026 (Eintragungsdatum)\n\nFaltenbacher Jalousienbau GmbH & Co. KG\nKommanditgesellschaft\nErbendorf\n\nDen Gläubigern der an der Spaltung beteiligten Rechtsträger ist, wenn sie binnen sechs Monaten nach dem Tag, an dem die Eintragung der Spaltung in das Register des Sitzes desjenigen Rechtsträgers, dessen Gläubiger sie sind, nach §§ 125, 19 Abs. 3 UmwG als bekannt gemacht gilt, ihren Anspruch nach Grund und Höhe in Textform anmelden, Sicherheit zu leisten, soweit sie nicht Befriedigung verlangen können. Dieses Recht steht den Gläubigern jedoch nur zu, wenn sie glaubhaft machen, dass durch die Spaltung die Erfüllung ihrer Forderung gefährdet wird."
    },
    {
      "date": "2026-02-20",
      "id": "145715",
      "original_text": "Einreichung neuer Dokumente\nBayern Amtsgericht Augsburg HRB 6164\nLechwerke AG – Augsburg",
      "type": "Einreichung neuer Dokumente",
      "state": "Bayern",
      "amtsgericht": "Amtsgericht Augsburg",
      "registernummer": "HRB 6164",
      "registerart": "HRB",
      "company_name": "Lechwerke AG",
      "company_seat": "Augsburg",
      "details": "20.02.2026 (Bekanntmachungsdatum)\n\nBayern Amtsgericht Augsburg HRB 6164\nEinreichung neuer Dokumente\n\nLechwerke AG\nAktiengesellschaft\nAugsburg\n\nDem Amtsgericht Augsburg -Registergericht- ist eine Liste der Mitglieder des Aufsichtsrats eingereicht worden, § 106 AktG."
    },
    {
      "date": "2026-02-20",
      "id": "145716",
      "original_text": "Sonstige Registerbekanntmachung\nBayern Amtsgericht Nürnberg HRB 21087\nKrankenhaus Rummelsberg GmbH – Schwarzenbruck",
      "type": "Sonstige Registerbekanntmachung",
      "state": "Bayern",
      "amtsgericht": "Amtsgericht Nürnberg",
      "registernummer": "HRB 21087",
      "registerart": "HRB",
      "company_name": "Krankenhaus Rummelsberg GmbH",
      "company_seat": "Schwarzenbruck",
      "details": "20.02.2026 (Bekanntmachungsdatum)\n\nBayern Amtsgericht Nürnberg HRB 21087\nSonstige Registerbekanntmachung\n\nKrankenhaus Rummelsberg GmbH\nGesellschaft mit beschränkter Haftung\nSchwarzenbruck\n\nDem Amtsgericht Nürnberg -Registergericht- ist eine Liste der Mitglieder des Aufsichtsrats eingereicht worden, § 52 Abs. 3 S. 2 GmbHG."
    },
    {
      "date": "2026-02-20",
      "id": "145717",
      "original_text": "Registerbekanntmachung nach dem Umwandlungsgesetz\nBayern Amtsgericht München HRB 134596\nvon Braun & Schreiber Nominees GmbH – München",
      "type": "Registerbekanntmachung nach dem Umwandlungsgesetz",
      "state": "Bayern",
      "amtsgericht": "Amtsgericht München",
      "registernummer": "HRB 134596",
      "registerart": "HRB",
      "company_name": "von Braun & Schreiber Nominees GmbH",
      "company_seat": "München",
      "details": "20.02.2026 (Bekanntmachungsdatum)\n\nBayern Amtsgericht München HRB 134596\nRegisterbekanntmachung nach dem Umwandlungsgesetz 19.02.2026 (Eintragungsdatum)\n\nvon Braun & Schreiber Nominees GmbH\nGesellschaft mit beschränkter Haftung\nMünchen\n\nDen Gläubigern der an der Verschmelzung beteiligten Rechtsträger ist, wenn sie binnen sechs Monaten nach dem Tag, an dem die Eintragung der Verschmelzung in das Register des Sitzes desjenigen Rechtsträgers, dessen Gläubiger sie sind, nach § 19 Abs. 3 UmwG als bekannt gemacht gilt, ihren Anspruch nach Grund und Höhe in Textform anmelden, Sicherheit zu leisten, soweit sie nicht Befriedigung verlangen können. Dieses Recht steht den Gläubigern jedoch nur zu, wenn sie glaubhaft machen, dass durch die Verschmelzung die Erfüllung ihrer Forderung gefährdet wird."
    },
    {
      "date": "2026-02-20",
      "id": "145718",
      "original_text": "Registerbekanntmachung nach dem Umwandlungsgesetz\nBayern Amtsgericht München HRB 180340\nBayWa r.e. Energieprojekte Verwaltungs GmbH – München",
      "type": "Registerbekanntmachung nach dem Umwandlungsgesetz",
      "state": "Bayern",
      "amtsgericht": "Amtsgericht München",
      "registernummer": "HRB 180340",
      "registerart": "HRB",
      "company_name": "BayWa r.e. Energieprojekte Verwaltungs GmbH",
      "company_seat": "München",
      "details": "20.02.2026 (Bekanntmachungsdatum)\n\nBayern Amtsgericht München HRB 180340\nRegisterbekanntmachung nach dem Umwandlungsgesetz 19.02.2026 (Eintragungsdatum)\n\nBayWa r.e. Energieprojekte Verwaltungs GmbH\nGesellschaft mit beschränkter Haftung\nMünchen\n\nDen Gläubigern der an der Verschmelzung beteiligten Rechtsträger ist, wenn sie binnen sechs Monaten nach dem Tag, an dem die Eintragung der Verschmelzung in das Register des Sitzes desjenigen Rechtsträgers, dessen Gläubiger sie sind, nach § 19 Abs. 3 UmwG als bekannt gemacht gilt, ihren Anspruch nach Grund und Höhe in Textform anmelden, Sicherheit zu leisten, soweit sie nicht Befriedigung verlangen können. Dieses Recht steht den Gläubigern jedoch nur zu, wenn sie glaubhaft machen, dass durch die Verschmelzung die Erfüllung ihrer Forderung gefährdet wird."
    },
    {
      "date": "2026-02-20",
      "id": "145719",
      "original_text": "Löschungsankündigung\nBayern Amtsgericht Nürnberg HRB 27644\nTIQPON UG (haftungsbeschränkt) – Nürnberg",
      "type": "Löschungsankündigung",
      "state": "Bayern",
      "amtsgericht": "Amtsgericht Nürnberg",
      "registernummer": "HRB 27644",
      "registerart": "HRB",
      "company_name": "TIQPON UG (haftungsbeschränkt)",
      "company_seat": "Nürnberg",
      "details": "20.02.2026 (Bekanntmachungsdatum)\n\nBayern Amtsgericht Nürnberg HRB 27644\nLöschungsankündigung\n\nTIQPON UG (haftungsbeschränkt)\nGesellschaft mit beschränkter Haftung\nNürnberg\n\nDas Registergericht beabsichtigt, die im Handelsregister eingetragene Gesellschaft wegen Vermögenslosigkeit von Amts wegen nach § 394 FamFG zu löschen. Die Frist zur Erhebung eines Widerspruchs ist auf einen Monat festgesetzt."
    },
    {
      "date": "2026-02-20",
      "id": "145720",
      "original_text": "Sonstige Registerbekanntmachung\nBayern Amtsgericht München HRB 302407\nKyon-93 Battery Storage GmbH – München",
      "type": "Sonstige Registerbekanntmachung",
      "state": "Bayern",
      "amtsgericht": "Amtsgericht München",
      "registernummer": "HRB 302407",
      "registerart": "HRB",
      "company_name": "Kyon-93 Battery Storage GmbH",
      "company_seat": "München",
      "details": "20.02.2026 (Bekanntmachungsdatum)\n\nBayern Amtsgericht München HRB 302407\nSonstige Registerbekanntmachung 19.02.2026 (Eintragungsdatum)\n\nKyon-93 Battery Storage GmbH\nGesellschaft mit beschränkter Haftung\nMünchen\n\nDen Gläubigern der Gesellschaft, deren Forderungen begründet worden sind, bevor die Eintragung der Beendigung des Gewinnabführungsvertrages in das Handelsregister nach § 10 des Handelsgesetzbuches als bekanntgemacht gilt, hat der andere Vertragsteil Sicherheit zu leisten, wenn sie sich binnen sechs Monaten nach der Bekanntmachung der Eintragung zu diesem Zweck bei ihm melden."
    },
    {
      "date": "2026-02-20",
      "id": "145721",
      "original_text": "Löschungsankündigung\nBayern Amtsgericht München HRB 268276\nMercAgro GmbH – München",
      "type": "Löschungsankündigung",
      "state": "Bayern",
      "amtsgericht": "Amtsgericht München",
      "registernummer": "HRB 268276",
      "registerart": "HRB",
      "company_name": "MercAgro GmbH",
      "company_seat": "München",
      "details": "20.02.2026 (Bekanntmachungsdatum)\n\nBayern Amtsgericht München HRB 268276\nLöschungsankündigung\n\nMercAgro GmbH\nGesellschaft mit beschränkter Haftung\nMünchen\n\nDas Registergericht beabsichtigt, die im Handelsregister eingetragene Gesellschaft wegen Vermögenslosigkeit von Amts wegen nach § 394 FamFG zu löschen. Die Frist zur Erhebung eines Widerspruchs ist auf drei Monate festgesetzt."
    },
    {
      "date": "2026-02-20",
      "id": "145722",
      "original_text": "Löschungsankündigung\nBayern Amtsgericht München HRB 197477\nDiar München GmbH – München",
      "type": "Löschungsankündigung",
      "state": "Bayern",
      "amtsgericht": "Amtsgericht München",
      "registernummer": "HRB 197477",
      "registerart": "HRB",
      "company_name": "Diar München GmbH",
      "company_seat": "München",
      "details": "20.02.2026 (Bekanntmachungsdatum)\n\nBayern Amtsgericht München HRB 197477\nLöschungsankündigung\n\nDiar München GmbH\nGesellschaft mit beschränkter Haftung\nMünchen\n\nDas Registergericht beabsichtigt, die im Handelsregister eingetragene Gesellschaft wegen Vermögenslosigkeit von Amts wegen nach § 394 FamFG zu löschen. Die Frist zur Erhebung eines Widerspruchs ist auf drei Monate festgesetzt."
    },
    {
      "date": "2026-02-20",
      "id": "145723",
      "original_text": "Registerbekanntmachung nach dem Umwandlungsgesetz\nBayern Amtsgericht München HRB 303421\nMAKERY Consulting GmbH – München",
      "type": "Registerbekanntmachung nach dem Umwandlungsgesetz",
      "state": "Bayern",
      "amtsgericht": "Amtsgericht München",
      "registernummer": "HRB 303421",
      "registerart": "HRB",
      "company_name": "MAKERY Consulting GmbH",
      "company_seat": "München",
      "details": "20.02.2026 (Bekanntmachungsdatum)\n\nBayern Amtsgericht München HRB 303421\nRegisterbekanntmachung nach dem Umwandlungsgesetz 19.02.2026 (Eintragungsdatum)\n\nMAKERY Consulting GmbH\nGesellschaft mit beschränkter Haftung\nMünchen\n\nDen Gläubigern der an der Verschmelzung beteiligten Rechtsträger ist, wenn sie binnen sechs Monaten nach dem Tag, an dem die Eintragung der Verschmelzung in das Register des Sitzes desjenigen Rechtsträgers, dessen Gläubiger sie sind, nach § 19 Abs. 3 UmwG als bekannt gemacht gilt, ihren Anspruch nach Grund und Höhe in Textform anmelden, Sicherheit zu leisten, soweit sie nicht Befriedigung verlangen können. Dieses Recht steht den Gläubigern jedoch nur zu, wenn sie glaubhaft machen, dass durch die Verschmelzung die Erfüllung ihrer Forderung gefährdet wird."
    },
    {
      "date": "2026-02-20",
      "id": "145724",
      "original_text": "Registerbekanntmachung nach dem Umwandlungsgesetz\nBayern Amtsgericht Weiden i. d. OPf. HRA 3310\nFaltenbacher Immobilien GmbH & Co. KG – Erbendorf",
      "type": "Registerbekanntmachung nach dem Umwandlungsgesetz",
      "state": "Bayern",
      "amtsgericht": "Amtsgericht Weiden i. d. OPf.",
      "registernummer": "HRA 3310",
      "registerart": "HRA",
      "company_name": "Faltenbacher Immobilien GmbH & Co. KG",
      "company_seat": "Erbendorf",
      "details": "20.02.2026 (Bekanntmachungsdatum)\n\nBayern Amtsgericht Weiden i. d. OPf. HRA 3310\nRegisterbekanntmachung nach dem Umwandlungsgesetz 19.02.2026 (Eintragungsdatum)\n\nFaltenbacher Immobilien GmbH & Co. KG\nKommanditgesellschaft\nErbendorf\n\nDen Gläubigern der an der Spaltung beteiligten Rechtsträger ist, wenn sie binnen sechs Monaten nach dem Tag, an dem die Eintragung der Spaltung in das Register des Sitzes desjenigen Rechtsträgers, dessen Gläubiger sie sind, nach §§ 125, 19 Abs. 3 UmwG als bekannt gemacht gilt, ihren Anspruch nach Grund und Höhe in Textform anmelden, Sicherheit zu leisten, soweit sie nicht Befriedigung verlangen können. Dieses Recht steht den Gläubigern jedoch nur zu, wenn sie glaubhaft machen, dass durch die Spaltung die Erfüllung ihrer Forderung gefährdet wird."
    },
    {
      "date": "2026-02-20",
      "id": "145725",
      "original_text": "Löschungsankündigung\nBerlin Amtsgericht Berlin (Charlottenburg) HRB 141593\nAlfa Vita Life Science GmbH – Berlin",
      "type": "Löschungsankündigung",
      "state": "Berlin",
      "amtsgericht": "Amtsgericht Berlin (Charlottenburg)",
      "registernummer": "HRB 141593",
      "registerart": "HRB",
      "company_name": "Alfa Vita Life Science GmbH",
      "company_seat": "Berlin",
      "details": "20.02.2026 (Bekanntmachungsdatum)\n\nBerlin Amtsgericht Berlin (Charlottenburg) HRB 141593\nLöschungsankündigung\n\nAlfa Vita Life Science GmbH\nGesellschaft mit beschränkter Haftung\nBerlin\n\nBei der nachstehenden Gesellschaft wird das Amtslöschungsverfahren gemäß § 394 FamFG eingeleitet. Widerspruchsfrist 6 Wochen"
    },
    {
      "date": "2026-02-20",
      "id": "145726",
      "original_text": "Löschungsankündigung\nBerlin Amtsgericht Berlin (Charlottenburg) HRB 177371\nMichael Suiter Consulting UG (haftungsbeschränkt) – Berlin",
      "type": "Löschungsankündigung",
      "state": "Berlin",
      "amtsgericht": "Amtsgericht Berlin (Charlottenburg)",
      "registernummer": "HRB 177371",
      "registerart": "HRB",
      "company_name": "Michael Suiter Consulting UG (haftungsbeschränkt)",
      "company_seat": "Berlin",
      "details": "20.02.2026 (Bekanntmachungsdatum)\n\nBerlin Amtsgericht Berlin (Charlottenburg) HRB 177371\nLöschungsankündigung\n\nMichael Suiter Consulting UG (haftungsbeschränkt)\nGesellschaft mit beschränkter Haftung\nBerlin\n\nBei der nachstehenden Gesellschaft wird das Amtslöschungsverfahren gemäß § 394 FamFG eingeleitet. Widerspruchsfrist 6 Wochen"
    },
    {
      "date": "2026-02-20",
      "id": "145727",
      "original_text": "Löschungsankündigung\nBerlin Amtsgericht Berlin (Charlottenburg) HRB 239416\nSBC Bau-Tech Solar GmbH – Berlin",
      "type": "Löschungsankündigung",
      "state": "Berlin",
      "amtsgericht": "Amtsgericht Berlin (Charlottenburg)",
      "registernummer": "HRB 239416",
      "registerart": "HRB",
      "company_name": "SBC Bau-Tech Solar GmbH",
      "company_seat": "Berlin",
      "details": "20.02.2026 (Bekanntmachungsdatum)\n\nBerlin Amtsgericht Berlin (Charlottenburg) HRB 239416\nLöschungsankündigung\n\nSBC Bau-Tech Solar GmbH\nGesellschaft mit beschränkter Haftung\nBerlin\n\nBei der nachstehenden Gesellschaft wird das Amtslöschungsverfahren gemäß § 394 FamFG eingeleitet. Widerspruchsfrist 6 Wochen"
    },
    {
      "date": "2026-02-20",
      "id": "145728",
      "original_text": "Registerbekanntmachung nach dem Umwandlungsgesetz\nBaden-Württemberg Amtsgericht Mannheim HRA 361084\nSchneider Grundstücksgesellschaft eins GmbH & Co KG – Ettlingen",
      "type": "Registerbekanntmachung nach dem Umwandlungsgesetz",
      "state": "Baden-Württemberg",
      "amtsgericht": "Amtsgericht Mannheim",
      "registernummer": "HRA 361084",
      "registerart": "HRA",
      "company_name": "Schneider Grundstücksgesellschaft eins GmbH & Co KG",
      "company_seat": "Ettlingen",
      "details": "20.02.2026 (Bekanntmachungsdatum)\n\nBaden-Württemberg Amtsgericht Mannheim HRA 361084\nRegisterbekanntmachung nach dem Umwandlungsgesetz 20.02.2026 (Eintragungsdatum)\n\nSchneider Grundstücksgesellschaft eins GmbH & Co KG\nKommanditgesellschaft\nEttlingen\n\nDen Gläubigern der an der Verschmelzung beteiligten Rechtsträger ist, wenn sie binnen sechs Monaten nach dem Tag, an dem die Eintragung der Verschmelzung in das Register des Sitzes desjenigen Rechtsträgers, dessen Gläubiger sie sind, nach § 19 Abs. 3 UmwG als bekanntgemacht gilt, ihren Anspruch nach Grund und Höhe schriftlich anmelden, Sicherheit zu leisten, soweit sie nicht Befriedigung verlangen können. Dieses Recht steht den Gläubigern jedoch nur zu, wenn sie glaubhaft machen, dass durch die Verschmelzung die Erfüllung ihrer Forderung gefährdet wird."
    },
    {
      "date": "2026-02-20",
      "id": "145729",
      "original_text": "Löschungsankündigung\nBerlin Amtsgericht Berlin (Charlottenburg) HRB 179789\nImmoxX Invest - Consult GmbH – Berlin",
      "type": "Löschungsankündigung",
      "state": "Berlin",
      "amtsgericht": "Amtsgericht Berlin (Charlottenburg)",
      "registernummer": "HRB 179789",
      "registerart": "HRB",
      "company_name": "ImmoxX Invest - Consult GmbH",
      "company_seat": "Berlin",
      "details": "20.02.2026 (Bekanntmachungsdatum)\n\nBerlin Amtsgericht Berlin (Charlottenburg) HRB 179789\nLöschungsankündigung\n\nImmoxX Invest - Consult GmbH\nGesellschaft mit beschränkter Haftung\nBerlin\n\nBei der nachstehenden Gesellschaft wird das Amtslöschungsverfahren gemäß § 394 FamFG eingeleitet. Widerspruchsfrist 6 Wochen"
    },
    {
      "date": "2026-02-20",
      "id": "145730",
      "original_text": "Löschungsankündigung\nBerlin Amtsgericht Berlin (Charlottenburg) HRB 231214\nPFL Bad Berka UG (haftungsbeschränkt) – Berlin",
      "type": "Löschungsankündigung",
      "state": "Berlin",
      "amtsgericht": "Amtsgericht Berlin (Charlottenburg)",
      "registernummer": "HRB 231214",
      "registerart": "HRB",
      "company_name": "PFL Bad Berka UG (haftungsbeschränkt)",
      "company_seat": "Berlin",
      "details": "20.02.2026 (Bekanntmachungsdatum)\n\nBerlin Amtsgericht Berlin (Charlottenburg) HRB 231214\nLöschungsankündigung\n\nPFL Bad Berka UG (haftungsbeschränkt)\nGesellschaft mit beschränkter Haftung\nBerlin\n\nBei der nachstehenden Gesellschaft wird das Amtslöschungsverfahren gemäß § 394 FamFG eingeleitet. Widerspruchsfrist 6 Wochen"
    },
    {
      "date": "2026-02-20",
      "id": "145731",
      "original_text": "Registerbekanntmachung nach dem Umwandlungsgesetz\nNordrhein-Westfalen Amtsgericht Coesfeld HRB 10514\nTB Verwaltungs GmbH – Bocholt",
      "type": "Registerbekanntmachung nach dem Umwandlungsgesetz",
      "state": "Nordrhein-Westfalen",
      "amtsgericht": "Amtsgericht Coesfeld",
      "registernummer": "HRB 10514",
      "registerart": "HRB",
      "company_name": "TB Verwaltungs GmbH",
      "company_seat": "Bocholt",
      "details": "20.02.2026 (Bekanntmachungsdatum)\n\nNordrhein-Westfalen Amtsgericht Coesfeld HRB 10514\nRegisterbekanntmachung nach dem Umwandlungsgesetz 20.02.2026 (Eintragungsdatum)\n\nTB Verwaltungs GmbH\nGesellschaft mit beschränkter Haftung\nBocholt\n\nDen Gläubigern der an der Verschmelzung beteiligten Rechtsträger ist, wenn sie binnen sechs Monaten nach dem Tag, an dem die Eintragung der Verschmelzung in das Register des Sitzes desjenigen Rechtsträgers, dessen Gläubiger sie sind, nach § 19 Absatz 3 UmwG als bekanntgemacht gilt, ihren Anspruch nach Grund und Höhe schriftlich anmelden, Sicherheit zu leisten, soweit sie nicht Befriedigung verlangen können. Dieses Recht steht den Gläubigern jedoch nur zu, wenn sie glaubhaft machen, dass durch die Verschmelzung die Erfüllung ihrer Forderung gefährdet wird."
    },
    {
      "date": "2026-02-20",
      "id": "145732",
      "original_text": "Löschungsankündigung\nBaden-Württemberg Amtsgericht Mannheim HRB 721065\nALFA-BAU GmbH – Mannheim",
      "type": "Löschungsankündigung",
      "state": "Baden-Württemberg",
      "amtsgericht": "Amtsgericht Mannheim",
      "registernummer": "HRB 721065",
      "registerart": "HRB",
      "company_name": "ALFA-BAU GmbH",
      "company_seat": "Mannheim",
      "details": "20.02.2026 (Bekanntmachungsdatum)\n\nBaden-Württemberg Amtsgericht Mannheim HRB 721065\nLöschungsankündigung\n\nALFA-BAU GmbH\nGesellschaft mit beschränkter Haftung\nMannheim\n\nDas Gericht beabsichtigt, die Gesellschaft wegen Vermögenslosigkeit im Handelsregister von Amts wegen nach § 394 FamFG zu löschen. Die Frist zur Geltendmachung eines Widerspruchs gegen die beabsichtigte Löschung ist auf einen Monat ab Veröffentlichung bestimmt."
    },
    {
      "date": "2026-02-20",
      "id": "145733",
      "original_text": "Einreichung neuer Dokumente\nBaden-Württemberg Amtsgericht Stuttgart HRB 727797\nDieter von Holtzbrinck Vermögensverwaltung GmbH – Stuttgart",
      "type": "Einreichung neuer Dokumente",
      "state": "Baden-Württemberg",
      "amtsgericht": "Amtsgericht Stuttgart",
      "registernummer": "HRB 727797",
      "registerart": "HRB",
      "company_name": "Dieter von Holtzbrinck Vermögensverwaltung GmbH",
      "company_seat": "Stuttgart",
      "details": "20.02.2026 (Bekanntmachungsdatum)\n\nBaden-Württemberg Amtsgericht Stuttgart HRB 727797\nEinreichung neuer Dokumente\n\nDieter von Holtzbrinck Vermögensverwaltung GmbH\nGesellschaft mit beschränkter Haftung\nStuttgart\n\nDie Gesellschaft hat am 03.02.2026 die Liste über die Zusammensetzung des Aufsichtsrats zum Handelsregister eingereicht."
    },
    {
      "date": "2026-02-20",
      "id": "145734",
      "original_text": "Löschungsankündigung\nHamburg Amtsgericht Hamburg HRB 169748\nDEWIGO (DEALING WITH GOODS) GmbH – Hamburg",
      "type": "Löschungsankündigung",
      "state": "Hamburg",
      "amtsgericht": "Amtsgericht Hamburg",
      "registernummer": "HRB 169748",
      "registerart": "HRB",
      "company_name": "DEWIGO (DEALING WITH GOODS) GmbH",
      "company_seat": "Hamburg",
      "details": "20.02.2026 (Bekanntmachungsdatum)\n\nHamburg Amtsgericht Hamburg HRB 169748\nLöschungsankündigung\n\nDEWIGO (DEALING WITH GOODS) GmbH\nGesellschaft mit beschränkter Haftung\nHamburg\n\nDas Registergericht beabsichtigt, die im Handelsregister eingetragene Gesellschaft von Amts wegen nach § 394 FamFG zu löschen. Die Frist zur Erhebung eines Widerspruchs gegen die beabsichtigte Löschung wird auf 3 Monate festgesetzt."
    },
    {
      "date": "2026-02-20",
      "id": "145735",
      "original_text": "Löschungsankündigung\nBerlin Amtsgericht Berlin (Charlottenburg) HRB 256882\nAutoLux UA GmbH – Berlin",
      "type": "Löschungsankündigung",
      "state": "Berlin",
      "amtsgericht": "Amtsgericht Berlin (Charlottenburg)",
      "registernummer": "HRB 256882",
      "registerart": "HRB",
      "company_name": "AutoLux UA GmbH",
      "company_seat": "Berlin",
      "details": "20.02.2026 (Bekanntmachungsdatum)\n\nBerlin Amtsgericht Berlin (Charlottenburg) HRB 256882\nLöschungsankündigung\n\nAutoLux UA GmbH\nGesellschaft mit beschränkter Haftung\nBerlin\n\nBei der nachstehenden Gesellschaft wird das Amtslöschungsverfahren gemäß § 394 FamFG eingeleitet. Widerspruchsfrist 6 Wochen"
    },
    {
      "date": "2026-02-20",
      "id": "145736",
      "original_text": "Einreichung neuer Dokumente\nMecklenburg-Vorpommern Amtsgericht Stralsund HRB 329 früher Amtsgericht Rostock\nBerufsförderungswerk Stralsund Gesellschaft mit beschränkter Haftung – Stralsund",
      "type": "Einreichung neuer Dokumente",
      "state": "Mecklenburg-Vorpommern",
      "amtsgericht": "Amtsgericht Stralsund",
      "registernummer": "HRB 329",
      "registerart": "HRB",
      "company_name": "Berufsförderungswerk Stralsund Gesellschaft mit beschränkter Haftung",
      "company_seat": "Stralsund",
      "former_amtsgericht": "Rostock",
      "details": "20.02.2026 (Bekanntmachungsdatum)\n\nMecklenburg-Vorpommern Amtsgericht Stralsund HRB 329 früher Amtsgericht Rostock\nEinreichung neuer Dokumente\n\nBerufsförderungswerk Stralsund Gesellschaft mit beschränkter Haftung\nGesellschaft mit beschränkter Haftung\nStralsund"
    },
    {
      "date": "2026-02-20",
      "id": "145737",
      "original_text": "Löschungsankündigung\nBerlin Amtsgericht Berlin (Charlottenburg) HRB 157135\nHarmonia Projekt GmbH – Berlin",
      "type": "Löschungsankündigung",
      "state": "Berlin",
      "amtsgericht": "Amtsgericht Berlin (Charlottenburg)",
      "registernummer": "HRB 157135",
      "registerart": "HRB",
      "company_name": "Harmonia Projekt GmbH",
      "company_seat": "Berlin",
      "details": "20.02.2026 (Bekanntmachungsdatum)\n\nBerlin Amtsgericht Berlin (Charlottenburg) HRB 157135\nLöschungsankündigung\n\nHarmonia Projekt GmbH\nGesellschaft mit beschränkter Haftung\nBerlin\n\nBei der nachstehenden Gesellschaft wird das Amtslöschungsverfahren gemäß § 394 FamFG eingeleitet. Widerspruchsfrist 6 Wochen"
    },
    {
      "date": "2026-02-20",
      "id": "145738",
      "original_text": "Registerbekanntmachung nach dem Umwandlungsgesetz\nBaden-Württemberg Amtsgericht Stuttgart HRB 775407\nAUDERE LC-Invest No. 1 GmbH – Fellbach",
      "type": "Registerbekanntmachung nach dem Umwandlungsgesetz",
      "state": "Baden-Württemberg",
      "amtsgericht": "Amtsgericht Stuttgart",
      "registernummer": "HRB 775407",
      "registerart": "HRB",
      "company_name": "AUDERE LC-Invest No. 1 GmbH",
      "company_seat": "Fellbach",
      "details": "20.02.2026 (Bekanntmachungsdatum)\n\nBaden-Württemberg Amtsgericht Stuttgart HRB 775407\nRegisterbekanntmachung nach dem Umwandlungsgesetz 20.02.2026 (Eintragungsdatum)\n\nAUDERE LC-Invest No. 1 GmbH\nGesellschaft mit beschränkter Haftung\nFellbach\n\nDen Gläubigern der an der Verschmelzung beteiligten Rechtsträger ist, wenn sie binnen sechs Monaten nach dem Tag, an dem die Eintragung der Verschmelzung in das Register des Sitzes desjenigen Rechtsträgers, dessen Gläubiger sie sind, nach § 19 Abs. 3 UmwG als bekanntgemacht gilt, ihren Anspruch nach Grund und Höhe schriftlich anmelden, Sicherheit zu leisten, soweit sie nicht Befriedigung verlangen können. Dieses Recht steht den Gläubigern jedoch nur zu, wenn sie glaubhaft machen, dass durch die Verschmelzung die Erfüllung ihrer Forderung gefährdet wird."
    },
    {
      "date": "2026-02-20",
      "id": "145739",
      "original_text": "Einreichung neuer Dokumente\nBaden-Württemberg Amtsgericht Stuttgart HRB 758721\nDATAGROUP SE – Pliezhausen",
      "type": "Einreichung neuer Dokumente",
      "state": "Baden-Württemberg",
      "amtsgericht": "Amtsgericht Stuttgart",
      "registernummer": "HRB 758721",
      "registerart": "HRB",
      "company_name": "DATAGROUP SE",
      "company_seat": "Pliezhausen",
      "details": "20.02.2026 (Bekanntmachungsdatum)\n\nBaden-Württemberg Amtsgericht Stuttgart HRB 758721\nEinreichung neuer Dokumente\n\nDATAGROUP SE\nEuropäische Aktiengesellschaft (SE)\nPliezhausen\n\nDie Gesellschaft hat am 19.02.2026 die Liste über die Zusammensetzung des Aufsichtsrats zum Handelsregister eingereicht."
    },
    {
      "date": "2026-02-20",
      "id": "145740",
      "original_text": "Registerbekanntmachung nach dem Umwandlungsgesetz\nBaden-Württemberg Amtsgericht Mannheim HRB 724708\nW + L 2 UG (haftungsbeschränkt) – Gaggenau",
      "type": "Registerbekanntmachung nach dem Umwandlungsgesetz",
      "state": "Baden-Württemberg",
      "amtsgericht": "Amtsgericht Mannheim",
      "registernummer": "HRB 724708",
      "registerart": "HRB",
      "company_name": "W + L 2 UG (haftungsbeschränkt)",
      "company_seat": "Gaggenau",
      "details": "20.02.2026 (Bekanntmachungsdatum)\n\nBaden-Württemberg Amtsgericht Mannheim HRB 724708\nRegisterbekanntmachung nach dem Umwandlungsgesetz 20.02.2026 (Eintragungsdatum)\n\nW + L 2 UG (haftungsbeschränkt)\nGesellschaft mit beschränkter Haftung\nGaggenau\n\nDen Gläubigern der an der Verschmelzung beteiligten Rechtsträger ist, wenn sie binnen sechs Monaten nach dem Tag, an dem die Eintragung der Verschmelzung in das Register des Sitzes desjenigen Rechtsträgers, dessen Gläubiger sie sind, nach § 19 Abs. 3 UmwG als bekanntgemacht gilt, ihren Anspruch nach Grund und Höhe schriftlich anmelden, Sicherheit zu leisten, soweit sie nicht Befriedigung verlangen können. Dieses Recht steht den Gläubigern jedoch nur zu, wenn sie glaubhaft machen, dass durch die Verschmelzung die Erfüllung ihrer Forderung gefährdet wird."
    },
    {
      "date": "2026-02-20",
      "id": "145741",
      "original_text": "Registerbekanntmachung nach dem Umwandlungsgesetz\nHamburg Amtsgericht Hamburg HRB 189539\nKinesso GmbH – Hamburg",
      "type": "Registerbekanntmachung nach dem Umwandlungsgesetz",
      "state": "Hamburg",
      "amtsgericht": "Amtsgericht Hamburg",
      "registernummer": "HRB 189539",
      "registerart": "HRB",
      "company_name": "Kinesso GmbH",
      "company_seat": "Hamburg",
      "details": "20.02.2026 (Bekanntmachungsdatum)\n\nHamburg Amtsgericht Hamburg HRB 189539\nRegisterbekanntmachung nach dem Umwandlungsgesetz 20.02.2026 (Eintragungsdatum)\n\nKinesso GmbH\nGesellschaft mit beschränkter Haftung\nHamburg\n\nAls nicht eingetragen wird bekannt gemacht:\nDen Gläubigern der an der Verschmelzung beteiligten Gesellschaften ist, wenn sie binnen sechs Monaten nach dem Tag, an dem die Eintragung der Verschmelzung in das Register des Sitzes desjenigen Rechtsträgers, dessen Gläubiger sie sind, nach § 19 Absatz 3 UmwG als bekannt gemacht gilt, ihren Anspruch nach Grund und Höhe schriftlich anmelden, Sicherheit zu leisten, soweit sie nicht Befriedigung verlangen können. Dieses Recht steht den Gläubigern jedoch nur zu, wenn sie glaubhaft machen, dass durch die Verschmelzung die Erfüllung ihrer Forderung gefährdet wird."
    },
    {
      "date": "2026-02-20",
      "id": "145742",
      "original_text": "Registerbekanntmachung nach dem Umwandlungsgesetz\nHamburg Amtsgericht Hamburg HRB 124460\nMediabrands Digital GmbH – Hamburg",
      "type": "Registerbekanntmachung nach dem Umwandlungsgesetz",
      "state": "Hamburg",
      "amtsgericht": "Amtsgericht Hamburg",
      "registernummer": "HRB 124460",
      "registerart": "HRB",
      "company_name": "Mediabrands Digital GmbH",
      "company_seat": "Hamburg",
      "details": "20.02.2026 (Bekanntmachungsdatum)\n\nHamburg Amtsgericht Hamburg HRB 124460\nRegisterbekanntmachung nach dem Umwandlungsgesetz 20.02.2026 (Eintragungsdatum)\n\nMediabrands Digital GmbH\nGesellschaft mit beschränkter Haftung\nHamburg\n\nAls nicht eingetragen wird bekannt gemacht:\nDen Gläubigern der an der Verschmelzung beteiligten Gesellschaften ist, wenn sie binnen sechs Monaten nach dem Tag, an dem die Eintragung der Verschmelzung in das Register des Sitzes desjenigen Rechtsträgers, dessen Gläubiger sie sind, nach § 19 Absatz 3 UmwG als bekannt gemacht gilt, ihren Anspruch nach Grund und Höhe schriftlich anmelden, Sicherheit zu leisten, soweit sie nicht Befriedigung verlangen können. Dieses Recht steht den Gläubigern jedoch nur zu, wenn sie glaubhaft machen, dass durch die Verschmelzung die Erfüllung ihrer Forderung gefährdet wird."
    },
    {
      "date": "2026-02-20",
      "id": "145743",
      "original_text": "Registerbekanntmachung nach dem Umwandlungsgesetz\nBaden-Württemberg Amtsgericht Stuttgart HRA 738548\nHeller GmbH & Co. KG – Kornwestheim",
      "type": "Registerbekanntmachung nach dem Umwandlungsgesetz",
      "state": "Baden-Württemberg",
      "amtsgericht": "Amtsgericht Stuttgart",
      "registernummer": "HRA 738548",
      "registerart": "HRA",
      "company_name": "Heller GmbH & Co. KG",
      "company_seat": "Kornwestheim",
      "details": "20.02.2026 (Bekanntmachungsdatum)\n\nBaden-Württemberg Amtsgericht Stuttgart HRA 738548\nRegisterbekanntmachung nach dem Umwandlungsgesetz 20.02.2026 (Eintragungsdatum)\n\nHeller GmbH & Co. KG\nKommanditgesellschaft\nKornwestheim\n\nAls nicht eingetragen wird bekanntgemacht:\nDen Gläubigern des an dem Formwechsel beteiligten Rechtsträgers ist, wenn sie binnen sechs Monaten nach dem Tag, an dem die Eintragung des Formwechsels in das Register des Sitzes desjenigen Rechtsträgers, dessen Gläubiger sie sind, nach § 19 Abs. 3 UmwG als bekanntgemacht gilt, ihren Anspruch nach Grund und Höhe schriftlich anmelden, Sicherheit zu leisten, soweit sie nicht Befriedigung verlangen können. Dieses Recht steht den Gläubigern jedoch nur zu, wenn sie glaubhaft machen, dass durch den Formwechsel die Erfüllung ihrer Forderung gefährdet wird."
    },
    {
      "date": "2026-02-20",
      "id": "145744",
      "original_text": "Löschungsankündigung\nBrandenburg Amtsgericht Frankfurt/Oder HRB 15080\nKattenbusch UG (haftungsbeschränkt) – Müncheberg",
      "type": "Löschungsankündigung",
      "state": "Brandenburg",
      "amtsgericht": "Amtsgericht Frankfurt/Oder",
      "registernummer": "HRB 15080",
      "registerart": "HRB",
      "company_name": "Kattenbusch UG (haftungsbeschränkt)",
      "company_seat": "Müncheberg",
      "details": "20.02.2026 (Bekanntmachungsdatum)\n\nBrandenburg Amtsgericht Frankfurt/Oder HRB 15080\nLöschungsankündigung\n\nKattenbusch UG (haftungsbeschränkt)\nGesellschaft mit beschränkter Haftung\nMüncheberg\n\nBei der nachstehenden Gesellschaft wird das Amtslöschungsverfahren gemäß § 394 FamFG eingeleitet."
    },
    {
      "date": "2026-02-20",
      "id": "145745",
      "original_text": "Einreichung neuer Dokumente\nBaden-Württemberg Amtsgericht Stuttgart HRB 758328\nDiconium Group GmbH – Stuttgart",
      "type": "Einreichung neuer Dokumente",
      "state": "Baden-Württemberg",
      "amtsgericht": "Amtsgericht Stuttgart",
      "registernummer": "HRB 758328",
      "registerart": "HRB",
      "company_name": "Diconium Group GmbH",
      "company_seat": "Stuttgart",
      "details": "20.02.2026 (Bekanntmachungsdatum)\n\nBaden-Württemberg Amtsgericht Stuttgart HRB 758328\nEinreichung neuer Dokumente\n\nDiconium Group GmbH\nGesellschaft mit beschränkter Haftung\nStuttgart\n\nDie Gesellschaft hat am 13.02.2026 die Liste über die Zusammensetzung des Aufsichtsrats zum Handelsregister eingereicht."
    },
    {
      "date": "2026-02-20",
      "id": "145746",
      "original_text": "Einreichung neuer Dokumente\nSaarland Amtsgericht Saarbrücken HRB 8485\njuris GmbH Juristisches Informationssystem für die Bundesrepublik Deutschland – Saarbrücken",
      "type": "Einreichung neuer Dokumente",
      "state": "Saarland",
      "amtsgericht": "Amtsgericht Saarbrücken",
      "registernummer": "HRB 8485",
      "registerart": "HRB",
      "company_name": "juris GmbH Juristisches Informationssystem für die Bundesrepublik Deutschland",
      "company_seat": "Saarbrücken",
      "details": "20.02.2026 (Bekanntmachungsdatum)\n\nSaarland Amtsgericht Saarbrücken HRB 8485\nEinreichung neuer Dokumente\n\njuris GmbH Juristisches Informationssystem für die Bundesrepublik Deutschland\nGesellschaft mit beschränkter Haftung\nSaarbrücken\n\nDie Geschäftsführung der Gesellschaft hat eine Liste der Mitglieder des Aufsichtsrats zum Handelsregister eingereicht (§ 52 Abs. 3 Satz 2 GmbHG)."
    },
    {
      "date": "2026-02-20",
      "id": "145747",
      "original_text": "Sonstige Registerbekanntmachung\nBrandenburg Amtsgericht Frankfurt/Oder HRB 3784\nGGAB-Gemeinnützige Gesellschaft für Alten- und Behindertenpflege mbH Bernau – Bernau bei Berlin",
      "type": "Sonstige Registerbekanntmachung",
      "state": "Brandenburg",
      "amtsgericht": "Amtsgericht Frankfurt/Oder",
      "registernummer": "HRB 3784",
      "registerart": "HRB",
      "company_name": "GGAB-Gemeinnützige Gesellschaft für Alten- und Behindertenpflege mbH Bernau",
      "company_seat": "Bernau bei Berlin",
      "details": "20.02.2026 (Bekanntmachungsdatum)\n\nBrandenburg Amtsgericht Frankfurt/Oder HRB 3784\nSonstige Registerbekanntmachung\n\nGGAB-Gemeinnützige Gesellschaft für Alten- und Behindertenpflege mbH Bernau\nGesellschaft mit beschränkter Haftung\nBernau bei Berlin\n\nAls nicht eingetragen wird veröffentlicht: Als nicht eingetragen wird veröffentlicht: Änderungen in der Zusammensetzung des Aufsichtsrates aus der Vergangenheit wurden angezeigt und zum Handelsregister eingereicht."
    },
    {
      "date": "2026-02-20",
      "id": "145748",
      "original_text": "Einreichung neuer Dokumente\nBaden-Württemberg Amtsgericht Mannheim HRB 109736\nSchrauben-Jäger AG – Karlsruhe",
      "type": "Einreichung neuer Dokumente",
      "state": "Baden-Württemberg",
      "amtsgericht": "Amtsgericht Mannheim",
      "registernummer": "HRB 109736",
      "registerart": "HRB",
      "company_name": "Schrauben-Jäger AG",
      "company_seat": "Karlsruhe",
      "details": "20.02.2026 (Bekanntmachungsdatum)\n\nBaden-Württemberg Amtsgericht Mannheim HRB 109736\nEinreichung neuer Dokumente 20.02.2026 (Eintragungsdatum)\n\nSchrauben-Jäger AG\nAktiengesellschaft\nKarlsruhe\n\nDie Gesellschaft hat am 29.01.2026 die Liste über die Zusammensetzung des Aufsichtsrats zum Handelsregister eingereicht."
    },
    {
      "date": "2026-02-20",
      "id": "145749",
      "original_text": "Einreichung neuer Dokumente\nBerlin Amtsgericht Berlin (Charlottenburg) HRB 71136\nAhorn AG – Berlin",
      "type": "Einreichung neuer Dokumente",
      "state": "Berlin",
      "amtsgericht": "Amtsgericht Berlin (Charlottenburg)",
      "registernummer": "HRB 71136",
      "registerart": "HRB",
      "company_name": "Ahorn AG",
      "company_seat": "Berlin",
      "details": "20.02.2026 (Bekanntmachungsdatum)\n\nBerlin Amtsgericht Berlin (Charlottenburg) HRB 71136\nEinreichung neuer Dokumente\n\nAhorn AG\nAktiengesellschaft\nBerlin\n\nAls nicht eingetragen wird veröffentlicht:\nEs wurde eine neue Liste der Aufsichtsratsmitglieder eingereicht (§ 106 AktG)."
    },
    {
      "date": "2026-02-20",
      "id": "145750",
      "original_text": "Löschungsankündigung\nSchleswig-Holstein Amtsgericht Lübeck HRB 1199 RZ\nW & K Schweißtechnik Handelsgesellschaft mbH – Ratzeburg",
      "type": "Löschungsankündigung",
      "state": "Schleswig-Holstein",
      "amtsgericht": "Amtsgericht Lübeck",
      "registernummer": "HRB 1199 RZ",
      "registerart": "HRB",
      "company_name": "W & K Schweißtechnik Handelsgesellschaft mbH",
      "company_seat": "Ratzeburg",
      "details": "20.02.2026 (Bekanntmachungsdatum)\n\nSchleswig-Holstein Amtsgericht Lübeck HRB 1199 RZ\nLöschungsankündigung\n\nW & K Schweißtechnik Handelsgesellschaft mbH\nGesellschaft mit beschränkter Haftung\nRatzeburg\n\nEs ist die Löschung der nachstehenden Gesellschaft wegen Vermögenslosigkeit gemäß § 394 FamFG beabsichtigt.\nHerrn Martin Wille als GF. der Firma\nW & K Schweißtechnik Handelsgesellschaft mbH\nBahnhofsallee 38, 23909 Ratzeburg\nin der Handelsregistersache der W & K Schweißtechnik Handelsgesellschaft mbH\nergeben sich aus den mir vorliegenden Unterlagen Anhaltspunkte dafür, dass die Gesellschaft, als deren Geschäftsführer Sie noch eingetragen sind, vermögenslos ist:\nDie Eröffnung des Insolvenzverfahrens wurde mangels einer die Kosten des Verfahrens deckenden Masse abgewiesen.\nIch beabsichtige daher, die Gesellschaft wegen Vermögenslosigkeit gemäß § 394 FamFG zu löschen.\nIch bestimme eine Frist von einem Monat zur Geltendmachung eines Widerspruchs gegen die Löschung, § 394 Abs. 2 S. 1 FamFG.\nWeiter bitte ich Sie, mir binnen derselben Frist mitzuteilen, ob die genannte Gesellschaft noch Vermögen hat, ggf. welche Vermögensgegenstände sie besitzt, ob die Gesellschaft noch Partei eines noch nicht rechtskräftig abgeschlossenen Rechtsstreits ist oder ob sonst noch eine Abwicklung stattfindet.\nNach Fristablauf ohne Widerspruch von Ihnen oder anderer Seite wird die Gesellschaft gelöscht.\n\nKistenmacher, Rechtspflegerin"
    },
    {
      "date": "2026-02-20",
      "id": "145751",
      "original_text": "Löschungsankündigung\nBerlin Amtsgericht Berlin (Charlottenburg) HRB 210839\nBeroni Direct UG (haftungsbeschränkt) – Berlin",
      "type": "Löschungsankündigung",
      "state": "Berlin",
      "amtsgericht": "Amtsgericht Berlin (Charlottenburg)",
      "registernummer": "HRB 210839",
      "registerart": "HRB",
      "company_name": "Beroni Direct UG (haftungsbeschränkt)",
      "company_seat": "Berlin",
      "details": "20.02.2026 (Bekanntmachungsdatum)\n\nBerlin Amtsgericht Berlin (Charlottenburg) HRB 210839\nLöschungsankündigung\n\nBeroni Direct UG (haftungsbeschränkt)\nGesellschaft mit beschränkter Haftung\nBerlin\n\nBei der nachstehenden Gesellschaft wird das Amtslöschungsverfahren gemäß § 394 FamFG eingeleitet. Widerspruchsfrist 6 Wochen"
    },
    {
      "date": "2026-02-20",
      "id": "145752",
      "original_text": "Löschungsankündigung\nSaarland Amtsgericht Saarbrücken HRA 21886\nOtmar Falk GmbH & Co. KG – Dillingen",
      "type": "Löschungsankündigung",
      "state": "Saarland",
      "amtsgericht": "Amtsgericht Saarbrücken",
      "registernummer": "HRA 21886",
      "registerart": "HRA",
      "company_name": "Otmar Falk GmbH & Co. KG",
      "company_seat": "Dillingen",
      "details": "20.02.2026 (Bekanntmachungsdatum)\n\nSaarland Amtsgericht Saarbrücken HRA 21886\nLöschungsankündigung\n\nOtmar Falk GmbH & Co. KG\nKommanditgesellschaft\nDillingen\n\nEs ist beabsichtigt, die Gesellschaft von Amts wegen gemäß § 394 FamFG wegen Vermögenslosigkeit zu löschen.\nGegen die Löschung von Amts wegen ist das Rechtsmittel des Widerspruchs statthaft. Der Widerspruch ist binnen einer Frist von einem Monat beginnend mit dem Tag dieser Veröffentlichung durch Einreichen eines Widerspruchsschreibens -schriftlich oder zur Niederschrift der Geschäftsstelle beim Amtsgericht Saarbrücken, -zentrales Handelsregister-, Mainzerstr.178, 66121 Saarbrücken einzulegen.\nDer Widerspruch muss die Bezeichnung der angefochtenen Löschungsankündigung enthalten sowie die Erklärung, dass Widerspruch eingelegt wird. Er ist vom Widerspruchsführer oder seinem Bevollmächtigten zu unterzeichnen.\nDas Widerspruchsschreiben kann auch in der Form eines elektronischen Dokumentes eingereicht werden, das mit einer qualifizierten elektronischen Signatur nach dem Signaturgesetz versehen sein muss (§§ 14 Abs. 2 FamFG, 130a, 298 ZPO)."
    },
    {
      "date": "2026-02-20",
      "id": "145753",
      "original_text": "Sonstige Registerbekanntmachung\nBerlin Amtsgericht Berlin (Charlottenburg) HRB 213015\nDr. Klein Wowi Digital AG – Berlin",
      "type": "Sonstige Registerbekanntmachung",
      "state": "Berlin",
      "amtsgericht": "Amtsgericht Berlin (Charlottenburg)",
      "registernummer": "HRB 213015",
      "registerart": "HRB",
      "company_name": "Dr. Klein Wowi Digital AG",
      "company_seat": "Berlin",
      "details": "20.02.2026 (Bekanntmachungsdatum)\n\nBerlin Amtsgericht Berlin (Charlottenburg) HRB 213015\nSonstige Registerbekanntmachung\n\nDr. Klein Wowi Digital AG\nAktiengesellschaft\nBerlin\n\nZu Eintragungsnummer 11 vom 19.02.2026 wird als nicht eingetragen veröffentlicht: Der andere Vertragsteil hat den Gläubigern dieses Rechtsträgers, deren Forderungen begründet worden sind, bevor die Eintragung der Beendigung dieses Vertrages in das Handelsregister nach § 10 des Handelsgesetzbuches als bekannt gemacht gilt, Sicherheit zu leisten, wenn sie sich binnen sechs Monaten nach der Bekanntmachung der Eintragung zu diesem Zweck bei ihm melden. Dieses Recht steht den Gläubigern nicht zu, die im Fall des Insolvenzverfahrens ein Recht auf vorzugsweise Befriedigung aus der Deckungsmasse haben, die nach gesetzlicher Vorschrift zu ihrem Schutz errichtet und staatlich überwacht ist."
    },
    {
      "date": "2026-02-20",
      "id": "145754",
      "original_text": "Löschungsankündigung\nBerlin Amtsgericht Berlin (Charlottenburg) HRB 178335\npi.pe GmbH – Berlin",
      "type": "Löschungsankündigung",
      "state": "Berlin",
      "amtsgericht": "Amtsgericht Berlin (Charlottenburg)",
      "registernummer": "HRB 178335",
      "registerart": "HRB",
      "company_name": "pi.pe GmbH",
      "company_seat": "Berlin",
      "details": "20.02.2026 (Bekanntmachungsdatum)\n\nBerlin Amtsgericht Berlin (Charlottenburg) HRB 178335\nLöschungsankündigung\n\npi.pe GmbH\nGesellschaft mit beschränkter Haftung\nBerlin\n\nBei der nachstehenden Gesellschaft wird das Amtslöschungsverfahren gemäß § 394 FamFG eingeleitet. Widerspruchsfrist 6 Wochen"
    },
    {
      "date": "2026-02-20",
      "id": "145755",
      "original_text": "Löschungsankündigung\nHamburg Amtsgericht Hamburg HRB 191375\nDeltapharm GmbH – Hamburg",
      "type": "Löschungsankündigung",
      "state": "Hamburg",
      "amtsgericht": "Amtsgericht Hamburg",
      "registernummer": "HRB 191375",
      "registerart": "HRB",
      "company_name": "Deltapharm GmbH",
      "company_seat": "Hamburg",
      "details": "20.02.2026 (Bekanntmachungsdatum)\n\nHamburg Amtsgericht Hamburg HRB 191375\nLöschungsankündigung\n\nDeltapharm GmbH\nGesellschaft mit beschränkter Haftung\nHamburg\n\nDas Registergericht beabsichtigt, die im Handelsregister eingetragene Gesellschaft von Amts wegen nach § 394 FamFG zu löschen. Die Frist zur Erhebung eines Widerspruchs gegen die beabsichtigte Löschung wird auf 3 Monate festgesetzt."
    },
    {
      "date": "2026-02-20",
      "id": "145756",
      "original_text": "Löschungsankündigung\nHamburg Amtsgericht Hamburg HRB 159658\nE²T Systemtechnik GmbH – Hamburg",
      "type": "Löschungsankündigung",
      "state": "Hamburg",
      "amtsgericht": "Amtsgericht Hamburg",
      "registernummer": "HRB 159658",
      "registerart": "HRB",
      "company_name": "E²T Systemtechnik GmbH",
      "company_seat": "Hamburg",
      "details": "20.02.2026 (Bekanntmachungsdatum)\n\nHamburg Amtsgericht Hamburg HRB 159658\nLöschungsankündigung\n\nE²T Systemtechnik GmbH\nGesellschaft mit beschränkter Haftung\nHamburg\n\nDas Registergericht beabsichtigt, die im Handelsregister eingetragene Gesellschaft von Amts wegen nach § 394 FamFG zu löschen. Die Frist zur Erhebung eines Widerspruchs gegen die beabsichtigte Löschung wird auf 3 Monate festgesetzt."
    },
    {
      "date": "2026-02-20",
      "id": "145757",
      "original_text": "Löschungsankündigung\nHamburg Amtsgericht Hamburg HRB 62065\nEnvac Deutschland GmbH – Hamburg",
      "type": "Löschungsankündigung",
      "state": "Hamburg",
      "amtsgericht": "Amtsgericht Hamburg",
      "registernummer": "HRB 62065",
      "registerart": "HRB",
      "company_name": "Envac Deutschland GmbH",
      "company_seat": "Hamburg",
      "details": "20.02.2026 (Bekanntmachungsdatum)\n\nHamburg Amtsgericht Hamburg HRB 62065\nLöschungsankündigung\n\nEnvac Deutschland GmbH\nGesellschaft mit beschränkter Haftung\nHamburg\n\nDas Registergericht beabsichtigt, die im Handelsregister eingetragene Gesellschaft von Amts wegen nach § 394 FamFG zu löschen. Die Frist zur Erhebung eines Widerspruchs gegen die beabsichtigte Löschung wird auf 3 Monate festgesetzt."
    },
    {
      "date": "2026-02-20",
      "id": "145758",
      "original_text": "Löschungsankündigung\nBerlin Amtsgericht Berlin (Charlottenburg) HRB 159497\nB-World Retail GmbH – Berlin",
      "type": "Löschungsankündigung",
      "state": "Berlin",
      "amtsgericht": "Amtsgericht Berlin (Charlottenburg)",
      "registernummer": "HRB 159497",
      "registerart": "HRB",
      "company_name": "B-World Retail GmbH",
      "company_seat": "Berlin",
      "details": "20.02.2026 (Bekanntmachungsdatum)\n\nBerlin Amtsgericht Berlin (Charlottenburg) HRB 159497\nLöschungsankündigung\n\nB-World Retail GmbH\nGesellschaft mit beschränkter Haftung\nBerlin\n\nBei der nachstehenden Gesellschaft wird das Amtslöschungsverfahren gemäß § 394 FamFG eingeleitet. Widerspruchsfrist 6 Wochen"
    },
    {
      "date": "2026-02-20",
      "id": "145759",
      "original_text": "Registerbekanntmachung nach dem Umwandlungsgesetz\nBerlin Amtsgericht Berlin (Charlottenburg) HRB 213277\nPrevent Holding GmbH – Berlin",
      "type": "Registerbekanntmachung nach dem Umwandlungsgesetz",
      "state": "Berlin",
      "amtsgericht": "Amtsgericht Berlin (Charlottenburg)",
      "registernummer": "HRB 213277",
      "registerart": "HRB",
      "company_name": "Prevent Holding GmbH",
      "company_seat": "Berlin",
      "details": "20.02.2026 (Bekanntmachungsdatum)\n\nBerlin Amtsgericht Berlin (Charlottenburg) HRB 213277\nRegisterbekanntmachung nach dem Umwandlungsgesetz 19.02.2026 (Eintragungsdatum)\n\nPrevent Holding GmbH\nGesellschaft mit beschränkter Haftung\nBerlin\n\nZu Eintragungsnummer 4 vom 19.02.2026 wird als nicht eingetragen veröffentlicht: Den Gläubigern der an der Verschmelzung beteiligten Rechtsträger ist, wenn sie binnen sechs Monaten nach dem Tag, an dem die Eintragung der Verschmelzung in das Register des Sitzes desjenigen Rechtsträgers, dessen Gläubiger sie sind, als bekannt gemacht gilt, ihren Anspruch nach Grund und Höhe schriftlich anmelden, Sicherheit zu leisten, soweit sie nicht Befriedigung verlangen können. Dieses Recht steht den Gläubigern jedoch nur zu, wenn sie glaubhaft machen, dass durch die Verschmelzung die Erfüllung ihrer Forderung gefährdet wird. Das Recht, Sicherheitsleistung zu verlangen, steht Gläubigern nicht zu, die im Falle der Insolvenz ein Recht auf vorzugsweise Befriedigung aus einer Deckungsmasse haben, die nach gesetzlicher Vorschrift zu ihrem Schutz errichtet und staatlich überwacht ist."
    },
    {
      "date": "2026-02-20",
      "id": "145760",
      "original_text": "Einreichung neuer Dokumente\nBaden-Württemberg Amtsgericht Stuttgart HRB 109053\nS+P Ingenieure AG – Heilbronn",
      "type": "Einreichung neuer Dokumente",
      "state": "Baden-Württemberg",
      "amtsgericht": "Amtsgericht Stuttgart",
      "registernummer": "HRB 109053",
      "registerart": "HRB",
      "company_name": "S+P Ingenieure AG",
      "company_seat": "Heilbronn",
      "details": "20.02.2026 (Bekanntmachungsdatum)\n\nBaden-Württemberg Amtsgericht Stuttgart HRB 109053\nEinreichung neuer Dokumente\n\nS+P Ingenieure AG\nAktiengesellschaft\nHeilbronn\n\nDie Gesellschaft hat am 06.02.2026 die Liste über die Zusammensetzung des Aufsichtsrats zum Handelsregister eingereicht."
    },
    {
      "date": "2026-02-20",
      "id": "145761",
      "original_text": "Löschungsankündigung\nBaden-Württemberg Amtsgericht Freiburg HRB 714521\nKSB Klingler Schaumbeton GmbH – Rheinau",
      "type": "Löschungsankündigung",
      "state": "Baden-Württemberg",
      "amtsgericht": "Amtsgericht Freiburg",
      "registernummer": "HRB 714521",
      "registerart": "HRB",
      "company_name": "KSB Klingler Schaumbeton GmbH",
      "company_seat": "Rheinau",
      "details": "20.02.2026 (Bekanntmachungsdatum)\n\nBaden-Württemberg Amtsgericht Freiburg HRB 714521\nLöschungsankündigung\n\nKSB Klingler Schaumbeton GmbH\nGesellschaft mit beschränkter Haftung\nRheinau\n\nAls nicht eingetragen wird bekanntgemacht:\nDas Gericht beabsichtigt, die Gesellschaft wegen Vermögenslosigkeit im Handelsregister von Amts wegen nach § 394 FamFG zu löschen. Die Frist zur Geltendmachung eines Widerspruchs gegen die beabsichtigte Löschung ist auf einen Monat ab Veröffentlichung bestimmt."
    },
    {
      "date": "2026-02-20",
      "id": "145762",
      "original_text": "Löschungsankündigung\nSachsen Amtsgericht Leipzig HRB 31680\nSENSUS Zeitarbeit GmbH – Leipzig",
      "type": "Löschungsankündigung",
      "state": "Sachsen",
      "amtsgericht": "Amtsgericht Leipzig",
      "registernummer": "HRB 31680",
      "registerart": "HRB",
      "company_name": "SENSUS Zeitarbeit GmbH",
      "company_seat": "Leipzig",
      "details": "20.02.2026 (Bekanntmachungsdatum)\n\nSachsen Amtsgericht Leipzig HRB 31680\nLöschungsankündigung\n\nSENSUS Zeitarbeit GmbH\nGesellschaft mit beschränkter Haftung\nLeipzig\n\nDas Registergericht beabsichtigt, den im Handelsregister eingetragenen Geschäftsführer Tamàs Mihàly Pikò von Amts wegen nach § 395 Absatz 1 FamFG zu löschen. Die Frist zu Erhebung eines Widerspruchs gegen die beabsichtigte Löschung wird auf einen Monat festgesetzt."
    },
    {
      "date": "2026-02-20",
      "id": "145763",
      "original_text": "Einreichung neuer Dokumente\nNiedersachsen Amtsgericht Hannover HRB 58469\nPreussenElektra GmbH – Hannover",
      "type": "Einreichung neuer Dokumente",
      "state": "Niedersachsen",
      "amtsgericht": "Amtsgericht Hannover",
      "registernummer": "HRB 58469",
      "registerart": "HRB",
      "company_name": "PreussenElektra GmbH",
      "company_seat": "Hannover",
      "details": "20.02.2026 (Bekanntmachungsdatum)\n\nNiedersachsen Amtsgericht Hannover HRB 58469\nEinreichung neuer Dokumente\n\nPreussenElektra GmbH\nGesellschaft mit beschränkter Haftung\nHannover\n\nDie Liste der Mitglieder des Aufsichtsrats wurde beim Registergericht eingereicht."
    },
    {
      "date": "2026-02-20",
      "id": "145764",
      "original_text": "Löschungsankündigung\nNiedersachsen Amtsgericht Osnabrück HRB 213404\nMzB - Planen und Bauen GmbH – Bersenbrück",
      "type": "Löschungsankündigung",
      "state": "Niedersachsen",
      "amtsgericht": "Amtsgericht Osnabrück",
      "registernummer": "HRB 213404",
      "registerart": "HRB",
      "company_name": "MzB - Planen und Bauen GmbH",
      "company_seat": "Bersenbrück",
      "details": "20.02.2026 (Bekanntmachungsdatum)\n\nNiedersachsen Amtsgericht Osnabrück HRB 213404\nLöschungsankündigung\n\nMzB - Planen und Bauen GmbH\nGesellschaft mit beschränkter Haftung\nBersenbrück\n\nDas Registergericht beabsichtigt, die Gesellschaft von Amts wegen nach § 394 FamFG wegen Vermögenslosigkeit zu löschen. Die Frist zur Erhebung eines Widerspruchs ist auf 1 Monat ab dieser Registerbekanntmachung festgesetzt."
    },
    {
      "date": "2026-02-20",
      "id": "145765",
      "original_text": "Löschungsankündigung\nNiedersachsen Amtsgericht Lüneburg HRB 209523\nGergert Dienstleistungen & Transporte UG (haftungsbeschränkt) – Celle",
      "type": "Löschungsankündigung",
      "state": "Niedersachsen",
      "amtsgericht": "Amtsgericht Lüneburg",
      "registernummer": "HRB 209523",
      "registerart": "HRB",
      "company_name": "Gergert Dienstleistungen & Transporte UG (haftungsbeschränkt)",
      "company_seat": "Celle",
      "details": "20.02.2026 (Bekanntmachungsdatum)\n\nNiedersachsen Amtsgericht Lüneburg HRB 209523\nLöschungsankündigung 13.02.2026 (Eintragungsdatum)\n\nGergert Dienstleistungen & Transporte UG (haftungsbeschränkt)\nGesellschaft mit beschränkter Haftung\nCelle\n\nDas Registergericht beabsichtigt, die Gesellschaft von Amts wegen nach § 394 FamFG zu löschen. Die Frist zur Erhebung eines Widerspruchs ist auf 1 Monat ab dieser Registerbekanntmachung festgesetzt."
    },
    {
      "date": "2026-02-20",
      "id": "145766",
      "original_text": "Registerbekanntmachung nach dem Umwandlungsgesetz\nNiedersachsen Amtsgericht Lüneburg GnR 200066\nLiVe eG – Winsen (Luhe)",
      "type": "Registerbekanntmachung nach dem Umwandlungsgesetz",
      "state": "Niedersachsen",
      "amtsgericht": "Amtsgericht Lüneburg",
      "registernummer": "GnR 200066",
      "registerart": "GnR",
      "company_name": "LiVe eG",
      "company_seat": "Winsen (Luhe)",
      "details": "20.02.2026 (Bekanntmachungsdatum)\n\nNiedersachsen Amtsgericht Lüneburg GnR 200066\nRegisterbekanntmachung nach dem Umwandlungsgesetz 20.02.2026 (Eintragungsdatum)\n\nLiVe eG\neingetragene Genossenschaft\nWinsen (Luhe)\n\nDen Gläubigern der an der formwechselnden Umwandlung beteiligten Rechtsträger ist, wenn sie binnen sechs Monaten nach dem Tag, an dem die Eintragung der Umwandlung in das Register des Sitzes desjenigen Rechtsträgers, dessen Gläubiger sie sind, nach § 19 Abs. 3 UmwG als bekannt gemacht gilt, ihren Anspruch nach Grund und Höhe schriftlich anmelden, Sicherheit zu leisten, soweit sie nicht Befriedigung verlangen können. Dieses Recht steht den Gläubigern jedoch nur zu, wenn sie glaubhaft machen, dass durch die formwechselnde Umwandlung die Erfüllung der Forderung gefährdet wird."
    },
    {
      "date": "2026-02-20",
      "id": "145767",
      "original_text": "Registerbekanntmachung nach dem Umwandlungsgesetz\nNiedersachsen Amtsgericht Lüneburg HRA 203293\nLiVe Leistungszentrum innovatives Verkaufstraining GmbH & Co. KG – Winsen (Luhe)",
      "type": "Registerbekanntmachung nach dem Umwandlungsgesetz",
      "state": "Niedersachsen",
      "amtsgericht": "Amtsgericht Lüneburg",
      "registernummer": "HRA 203293",
      "registerart": "HRA",
      "company_name": "LiVe Leistungszentrum innovatives Verkaufstraining GmbH & Co. KG",
      "company_seat": "Winsen (Luhe)",
      "details": "20.02.2026 (Bekanntmachungsdatum)\n\nNiedersachsen Amtsgericht Lüneburg HRA 203293\nRegisterbekanntmachung nach dem Umwandlungsgesetz 20.02.2026 (Eintragungsdatum)\n\nLiVe Leistungszentrum innovatives Verkaufstraining GmbH & Co. KG\nKommanditgesellschaft\nWinsen (Luhe)\n\nDen Gläubigern der an der formwechselnden Umwandlung beteiligten Rechtsträger ist, wenn sie binnen sechs Monaten nach dem Tag, an dem die Eintragung der Umwandlung in das Register des Sitzes desjenigen Rechtsträgers, dessen Gläubiger sie sind, nach § 19 Abs. 3 UmwG als bekannt gemacht gilt, ihren Anspruch nach Grund und Höhe schriftlich anmelden, Sicherheit zu leisten, soweit sie nicht Befriedigung verlangen können. Dieses Recht steht den Gläubigern jedoch nur zu, wenn sie glaubhaft machen, dass durch die formwechselnde Umwandlung die Erfüllung der Forderung gefährdet wird."
    },
    {
      "date": "2026-02-20",
      "id": "145768",
      "original_text": "Löschungsankündigung\nNiedersachsen Amtsgericht Hildesheim HRB 101474 früher Amtsgericht Gifhorn\nRother Verwaltungs GmbH – Peine",
      "type": "Löschungsankündigung",
      "state": "Niedersachsen",
      "amtsgericht": "Amtsgericht Hildesheim",
      "registernummer": "HRB 101474",
      "registerart": "HRB",
      "company_name": "Rother Verwaltungs GmbH",
      "company_seat": "Peine",
      "former_amtsgericht": "Gifhorn",
      "details": "20.02.2026 (Bekanntmachungsdatum)\n\nNiedersachsen Amtsgericht Hildesheim HRB 101474 früher Amtsgericht Gifhorn\nLöschungsankündigung\n\nRother Verwaltungs GmbH\nGesellschaft mit beschränkter Haftung\nPeine\n\nDas Registergericht beabsichtigt, die Gesellschaft von Amts wegen nach § 394 FamFG zu löschen. Die Frist zur Erhebung eines Widerspruchs ist auf 1 Monat ab dieser Registerbekanntmachung festgesetzt."
    },
    {
      "date": "2026-02-20",
      "id": "145769",
      "original_text": "Löschungsankündigung\nNiedersachsen Amtsgericht Hildesheim HRB 206988\nRoschan UG (haftungsbeschränkt) – Sarstedt",
      "type": "Löschungsankündigung",
      "state": "Niedersachsen",
      "amtsgericht": "Amtsgericht Hildesheim",
      "registernummer": "HRB 206988",
      "registerart": "HRB",
      "company_name": "Roschan UG (haftungsbeschränkt)",
      "company_seat": "Sarstedt",
      "details": "20.02.2026 (Bekanntmachungsdatum)\n\nNiedersachsen Amtsgericht Hildesheim HRB 206988\nLöschungsankündigung\n\nRoschan UG (haftungsbeschränkt)\nGesellschaft mit beschränkter Haftung\nSarstedt\n\nDas Registergericht beabsichtigt, die Gesellschaft von Amts wegen nach § 394 FamFG zu löschen. Die Frist zur Erhebung eines Widerspruchs ist auf 1 Monat ab dieser Registerbekanntmachung festgesetzt."
    },
    {
      "date": "2026-02-20",
      "id": "145770",
      "original_text": "Einreichung neuer Dokumente\nNiedersachsen Amtsgericht Osnabrück HRB 100028 früher Amtsgericht Lingen (Ems)\nAdvanced Nuclear Fuels GmbH – Lingen (Ems)",
      "type": "Einreichung neuer Dokumente",
      "state": "Niedersachsen",
      "amtsgericht": "Amtsgericht Osnabrück",
      "registernummer": "HRB 100028",
      "registerart": "HRB",
      "company_name": "Advanced Nuclear Fuels GmbH",
      "company_seat": "Lingen (Ems)",
      "former_amtsgericht": "Lingen (Ems)",
      "details": "20.02.2026 (Bekanntmachungsdatum)\n\nNiedersachsen Amtsgericht Osnabrück HRB 100028 früher Amtsgericht Lingen (Ems)\nEinreichung neuer Dokumente\n\nAdvanced Nuclear Fuels GmbH\nGesellschaft mit beschränkter Haftung\nLingen (Ems)\n\nDie Liste der Mitglieder des Aufsichtsrats wurde beim Registergericht eingereicht."
    },
    {
      "date": "2026-02-20",
      "id": "145771",
      "original_text": "Löschungsankündigung\nNiedersachsen Amtsgericht Osnabrück HRB 211752\nWWW Weingalerie Melle GmbH – Melle",
      "type": "Löschungsankündigung",
      "state": "Niedersachsen",
      "amtsgericht": "Amtsgericht Osnabrück",
      "registernummer": "HRB 211752",
      "registerart": "HRB",
      "company_name": "WWW Weingalerie Melle GmbH",
      "company_seat": "Melle",
      "details": "20.02.2026 (Bekanntmachungsdatum)\n\nNiedersachsen Amtsgericht Osnabrück HRB 211752\nLöschungsankündigung\n\nWWW Weingalerie Melle GmbH\nGesellschaft mit beschränkter Haftung\nMelle\n\nDas Registergericht beabsichtigt, die Gesellschaft von Amts wegen nach § 394 FamFG wegen Vermögenslosigkeit zu löschen. Die Frist zur Erhebung eines Widerspruchs ist auf 1 Monat ab dieser Registerbekanntmachung festgesetzt."
    },
    {
      "date": "2026-02-20",
      "id": "145772",
      "original_text": "Löschungsankündigung\nRheinland-Pfalz Amtsgericht Mainz HRB 45132\nRhein-Blau GmbH – Mainz",
      "type": "Löschungsankündigung",
      "state": "Rheinland-Pfalz",
      "amtsgericht": "Amtsgericht Mainz",
      "registernummer": "HRB 45132",
      "registerart": "HRB",
      "company_name": "Rhein-Blau GmbH",
      "company_seat": "Mainz",
      "details": "20.02.2026 (Bekanntmachungsdatum)\n\nRheinland-Pfalz Amtsgericht Mainz HRB 45132\nLöschungsankündigung\n\nRhein-Blau GmbH\nGesellschaft mit beschränkter Haftung\nMainz\n\nDas Registergericht beabsichtigt die Gesellschaft von Amts wegen nach § 394 FamFG zu löschen. Die Frist zur Erhebung eines Widerspruchs ist auf einen Monat festgesetzt."
    },
    {
      "date": "2026-02-20",
      "id": "145773",
      "original_text": "Einreichung neuer Dokumente\nRheinland-Pfalz Amtsgericht Montabaur HRB 20841\nVecoplan AG – Bad Marienberg",
      "type": "Einreichung neuer Dokumente",
      "state": "Rheinland-Pfalz",
      "amtsgericht": "Amtsgericht Montabaur",
      "registernummer": "HRB 20841",
      "registerart": "HRB",
      "company_name": "Vecoplan AG",
      "company_seat": "Bad Marienberg",
      "details": "20.02.2026 (Bekanntmachungsdatum)\n\nRheinland-Pfalz Amtsgericht Montabaur HRB 20841\nEinreichung neuer Dokumente 20.02.2026 (Eintragungsdatum)\n\nVecoplan AG\nAktiengesellschaft\nBad Marienberg\n\nDem Registergericht ist eine neue Liste der Mitglieder des Aufsichtsrates eingereicht worden."
    },
    {
      "date": "2026-02-20",
      "id": "145774",
      "original_text": "Löschungsankündigung\nBremen Amtsgericht Bremen HRB 38476\nPoules Trading GmbH – Bremen",
      "type": "Löschungsankündigung",
      "state": "Bremen",
      "amtsgericht": "Amtsgericht Bremen",
      "registernummer": "HRB 38476",
      "registerart": "HRB",
      "company_name": "Poules Trading GmbH",
      "company_seat": "Bremen",
      "details": "20.02.2026 (Bekanntmachungsdatum)\n\nBremen Amtsgericht Bremen HRB 38476\nLöschungsankündigung\n\nPoules Trading GmbH\nGesellschaft mit beschränkter Haftung\nBremen\n\nEs ist beabsichtigt die im Handelsregister eingetragene Gesellschaft von Amts wegen gemäß § 394 FamFG zu löschen. Gegen die Löschung kann beim AG Bremen schriftlich oder zu Protokoll der Geschäftsstelle Widerspruch eingelegt werden. Widerspruchsfrist 4 Wochen."
    },
    {
      "date": "2026-02-20",
      "id": "145775",
      "original_text": "Löschungsankündigung\nBremen Amtsgericht Bremen HRB 2939 BHV\nBetreuungs- und Pflegedienstleistungsgesellschaft mit beschränkter Haftung (BPLG) – Bremerhaven",
      "type": "Löschungsankündigung",
      "state": "Bremen",
      "amtsgericht": "Amtsgericht Bremen",
      "registernummer": "HRB 2939 BHV",
      "registerart": "HRB",
      "company_name": "Betreuungs- und Pflegedienstleistungsgesellschaft mit beschränkter Haftung (BPLG)",
      "company_seat": "Bremerhaven",
      "details": "20.02.2026 (Bekanntmachungsdatum)\n\nBremen Amtsgericht Bremen HRB 2939 BHV\nLöschungsankündigung\n\nBetreuungs- und Pflegedienstleistungsgesellschaft mit beschränkter Haftung (BPLG)\nGesellschaft mit beschränkter Haftung\nBremerhaven\n\nEs ist beabsichtigt die im Handelsregister eingetragene Gesellschaft von Amts wegen gemäß § 394 FamFG zu löschen. Gegen die Löschung kann beim AG Bremen schriftlich oder zu Protokoll der Geschäftsstelle Widerspruch eingelegt werden. Widerspruchsfrist 4 Wochen."
    },
    {
      "date": "2026-02-20",
      "id": "145776",
      "original_text": "Löschungsankündigung\nNordrhein-Westfalen Amtsgericht Düsseldorf HRB 96296\nTinos Bar VIP GmbH – Düsseldorf",
      "type": "Löschungsankündigung",
      "state": "Nordrhein-Westfalen",
      "amtsgericht": "Amtsgericht Düsseldorf",
      "registernummer": "HRB 96296",
      "registerart": "HRB",
      "company_name": "Tinos Bar VIP GmbH",
      "company_seat": "Düsseldorf",
      "details": "20.02.2026 (Bekanntmachungsdatum)\n\nNordrhein-Westfalen Amtsgericht Düsseldorf HRB 96296\nLöschungsankündigung\n\nTinos Bar VIP GmbH\nGesellschaft mit beschränkter Haftung\nDüsseldorf\n\nDas Registergericht beabsichtigt die Gesellschaft von Amts wegen nach § 394 FamFG zu löschen. Die Frist zur Erhebung eines Widerspruchs ist auf #DV.Fr(Text=\"Bitte wählen Sie die Widerspruchsfrist aus!\",Eingabe=\"einen Monat\",\"zwei Monate\",\"drei Monate\",\"#insert(Text=\"Freitext\")\"|\"freier Text\") festgesetzt.\n\nRechtsbehelfsbelehrung:\nDas Widerspruchsrecht steht jedem zu, der an der Unterlassung der Löschung ein berechtigtes Interesse hat. Der Widerspruch ist bei dem Amtsgericht Düsseldorf -Registergericht-, Werdener Straße 1, 40227 Düsseldorf schriftlich in deutscher Sprache oder zur Niederschrift der Geschäftsstelle einzulegen. Der Widerspruch kann auch zur Niederschrift der Geschäftsstelle eines jeden Amtsgerichtes abgegeben werden. Die Einlegung ist auch durch Übertragung eines elektronischen Dokuments an die elektronische Poststelle des Gerichts möglich. Das elektronische Dokument muss für die Bearbeitung durch das Gericht geeignet und mit einer qualifizierten elektronischen Signatur der verantwortenden Person versehen sein oder von der verantwortenden Person signiert und auf einem sicheren Übermittlungsweg gemäß § 130a ZPO nach näherer Maßgabe der Verordnung über die technischen Rahmenbedingungen des elektronischen Rechtsverkehrs und über das besondere elektronische Behördenpostfach (BGBl. I, S.3803) eingereicht werden. Weitere Informationen erhalten Sie auf der Internetseite www.justiz.de.\nDer Widerspruch muss spätestens innerhalb der gesetzten Frist nach dem Datum der Bekanntmachung der Löschungsankündigung bei dem Amtsgericht - Registergericht - Düsseldorf eingegangen sein.  Dies gilt auch dann, wenn der Widerspruch zur Niederschrift der Geschäftsstelle eines anderen Amtsgerichtes abgegeben wurde. Die Frist beginnt mit dem Tage der Bekanntmachung der Löschungsankündigung in dem für die Bekanntmachung der Eintragungen in das Handelsregister bestimmten elektronischen Informations- und Kommunikationssystem nach § 10 des Handelsgesetzbuches. Fällt das Ende der Frist auf einen Sonntag, einen allgemeinen Feiertag oder Sonnabend, so endet die Frist mit Ablauf des nächsten Werktages.\nDer Widerspruch muss die Bezeichnung der angefochtenen Löschungsankündigung sowie die Erklärung enthalten, dass Widerspruch gegen diese Löschungsankündigung eingelegt wird. Er ist zu unterzeichnen und soll begründet werden."
    },
    {
      "date": "2026-02-20",
      "id": "145777",
      "original_text": "Registerbekanntmachung nach dem Umwandlungsgesetz\nNordrhein-Westfalen Amtsgericht Hamm VR 680\n1. Fußball-Club Pelkum 1924 – Hamm",
      "type": "Registerbekanntmachung nach dem Umwandlungsgesetz",
      "state": "Nordrhein-Westfalen",
      "amtsgericht": "Amtsgericht Hamm",
      "registernummer": "VR 680",
      "registerart": "VR",
      "company_name": "1. Fußball-Club Pelkum 1924",
      "company_seat": "Hamm",
      "details": "20.02.2026 (Bekanntmachungsdatum)\n\nNordrhein-Westfalen Amtsgericht Hamm VR 680\nRegisterbekanntmachung nach dem Umwandlungsgesetz 20.02.2026 (Eintragungsdatum)\n\n1. Fußball-Club Pelkum 1924\neingetragener Verein\nHamm\n\nDen Gläubigern der an der Verschmelzung beteiligten Rechtsträger ist, wenn sie binnen sechs Monaten nach dem Tag, an dem die Eintragung der Verschmelzung in das Register des Sitzes derjenigen Rechtsträger deren Gläubiger sie sind, nach § 19 Absatz 3 UmwG als bekanntgemacht gilt, ihren Anspruch nach Grund und Höhe schriftlich anmelden, Sicherheit zu leisten, soweit sie nicht Befriedigung verlangen können. Dieses Recht steht den Gläubigern jedoch nur zu, wenn sie glaubhaft machen, dass durch die Verschmelzung die Erfüllung ihrer Forderung gefährdet wird."
    },
    {
      "date": "2026-02-20",
      "id": "145778",
      "original_text": "Löschungsankündigung\nNordrhein-Westfalen Amtsgericht Dortmund HRB 28416\nNovamur GmbH – Dortmund",
      "type": "Löschungsankündigung",
      "state": "Nordrhein-Westfalen",
      "amtsgericht": "Amtsgericht Dortmund",
      "registernummer": "HRB 28416",
      "registerart": "HRB",
      "company_name": "Novamur GmbH",
      "company_seat": "Dortmund",
      "details": "20.02.2026 (Bekanntmachungsdatum)\n\nNordrhein-Westfalen Amtsgericht Dortmund HRB 28416\nLöschungsankündigung\n\nNovamur GmbH\nGesellschaft mit beschränkter Haftung\nDortmund\n\nDas Registergericht beabsichtigt die Gesellschaft von Amts wegen nach § 394 FamFG zu löschen. Die Frist zur Erhebung eines Widerspruchs ist auf zwei Monate festgesetzt."
    },
    {
      "date": "2026-02-20",
      "id": "145779",
      "original_text": "Registerbekanntmachung nach dem Umwandlungsgesetz\nNordrhein-Westfalen Amtsgericht Köln HRB 103995\nSMARTY Cologne Uptown GmbH – Köln",
      "type": "Registerbekanntmachung nach dem Umwandlungsgesetz",
      "state": "Nordrhein-Westfalen",
      "amtsgericht": "Amtsgericht Köln",
      "registernummer": "HRB 103995",
      "registerart": "HRB",
      "company_name": "SMARTY Cologne Uptown GmbH",
      "company_seat": "Köln",
      "details": "20.02.2026 (Bekanntmachungsdatum)\n\nNordrhein-Westfalen Amtsgericht Köln HRB 103995\nRegisterbekanntmachung nach dem Umwandlungsgesetz 20.02.2026 (Eintragungsdatum)\n\nSMARTY Cologne Uptown GmbH\nGesellschaft mit beschränkter Haftung\nKöln\n\nDen Gläubigern der an der Abspaltung beteiligten Rechtsträger ist, wenn sie binnen sechs Monaten nach dem Tag, an dem die Eintragung der Abspaltung in das Register des Sitzes desjenigen Rechtsträgers, dessen Gläubiger sie sind, nach § 19 Absatz 3 UmwG als bekanntgemacht gilt, ihren Anspruch nach Grund und Höhe schriftlich anmelden, Sicherheit zu leisten, soweit sie nicht Befriedigung verlangen können. Dieses Recht steht den Gläubigern jedoch nur zu, wenn sie glaubhaft machen, dass durch die Abspaltung die Erfüllung ihrer Forderung gefährdet wird."
    },
    {
      "date": "2026-02-20",
      "id": "145780",
      "original_text": "Löschungsankündigung\nNordrhein-Westfalen Amtsgericht Siegburg HRB 14641\nGS PROJEKT BAU GmbH – Königswinter",
      "type": "Löschungsankündigung",
      "state": "Nordrhein-Westfalen",
      "amtsgericht": "Amtsgericht Siegburg",
      "registernummer": "HRB 14641",
      "registerart": "HRB",
      "company_name": "GS PROJEKT BAU GmbH",
      "company_seat": "Königswinter",
      "details": "20.02.2026 (Bekanntmachungsdatum)\n\nNordrhein-Westfalen Amtsgericht Siegburg HRB 14641\nLöschungsankündigung\n\nGS PROJEKT BAU GmbH\nGesellschaft mit beschränkter Haftung\nKönigswinter\n\nDas Registergericht hat glaubhafte Kenntnis erlangt, dass die Gesellschaft vermögenslos geworden ist, da ein Insolvenzverfahren durchgeführt und nach § 200 InsO aufgehoben wurde.\nEs ist daher beabsichtigt, die Gesellschaft nach § 394 FamFG im Handelsregister wegen Vermögenslosigkeit zu löschen.\nEinwände gegen die Löschung sind durch Widerspruch binnen einer Frist von 3 Monaten geltend zu machen, andernfalls die Löschung erfolgen wird.\nEinzulegen ist der Widerspruch bei dem Amtsgericht Siegburg, Neue Poststraße 16, 53721 Siegburg, und zwar entweder schriftlich in deutscher Sprache oder mündlich zur Niederschrift der Geschäftsstelle. Der Widerspruch kann auch zur Niederschrift der Geschäftsstelle eines jeden Amtsgerichts abgegeben werden. Der Widerspruch ist binnen der in der Verfügung bestimmten Frist einzulegen. Die Frist ist nur gewahrt, wenn der Widerspruch rechtzeitig bei dem Amtsgericht Siegburg eingeht, auch wenn der Widerspruch zur Niederschrift der Geschäftsstelle eines anderen Amtsgerichts abgegeben wurde. Die Frist beginnt jeweils mit der schriftlichen Bekanntgabe der Verfügung an die Beteiligten. Kann die schriftliche Bekanntgabe an einen Beteiligten nicht bewirkt werden, beginnt die Frist spätestens mit Ablauf von fünf Monaten nach Erlass der Verfügung. Die Bekanntgabe ist entweder durch Zustellung oder am dritten Tage nach Aufgabe zur Post bewirkt. Sofern die Löschung noch nicht erfolgt ist, kann der Widerspruch auch noch nach Ablauf der Frist eingelegt werden. Fällt das Ende der Frist auf einen Sonnabend, einen Sonntag oder einen allgemeinen Feiertag, endet die Frist mit Ablauf des nächsten Werktages. Der Widerspruch ist zu unterzeichnen. Eine Begründung des Widerspruchs ist nicht vorgeschrieben."
    },
    {
      "date": "2026-02-20",
      "id": "145781",
      "original_text": "Registerbekanntmachung nach dem Umwandlungsgesetz\nNordrhein-Westfalen Amtsgericht Düsseldorf HRB 14628\nGoethe + Schweitzer GmbH – Düsseldorf",
      "type": "Registerbekanntmachung nach dem Umwandlungsgesetz",
      "state": "Nordrhein-Westfalen",
      "amtsgericht": "Amtsgericht Düsseldorf",
      "registernummer": "HRB 14628",
      "registerart": "HRB",
      "company_name": "Goethe + Schweitzer GmbH",
      "company_seat": "Düsseldorf",
      "details": "20.02.2026 (Bekanntmachungsdatum)\n\nNordrhein-Westfalen Amtsgericht Düsseldorf HRB 14628\nRegisterbekanntmachung nach dem Umwandlungsgesetz 20.02.2026 (Eintragungsdatum)\n\nGoethe + Schweitzer GmbH\nGesellschaft mit beschränkter Haftung\nDüsseldorf\n\nDen Gläubigern der an der Verschmelzung beteiligten Rechtsträger ist, wenn sie binnen sechs Monaten nach dem Tag, an dem die Eintragung der Verschmelzung in das Register des Sitzes desjenigen Rechtsträgers, dessen Gläubiger sie sind, nach § 19 Absatz 3 UmwG als bekanntgemacht gilt, ihren Anspruch nach Grund und Höhe schriftlich anmelden, Sicherheit zu leisten, soweit sie nicht Befriedigung verlangen können. Dieses Recht steht den Gläubigern jedoch nur zu, wenn sie glaubhaft machen, dass durch die Verschmelzung die Erfüllung ihrer Forderung gefährdet wird."
    },
    {
      "date": "2026-02-20",
      "id": "145782",
      "original_text": "Registerbekanntmachung nach dem Umwandlungsgesetz\nNordrhein-Westfalen Amtsgericht Essen HRB 13892\nSalvia Gebäudetechnik West GmbH – Essen",
      "type": "Registerbekanntmachung nach dem Umwandlungsgesetz",
      "state": "Nordrhein-Westfalen",
      "amtsgericht": "Amtsgericht Essen",
      "registernummer": "HRB 13892",
      "registerart": "HRB",
      "company_name": "Salvia Gebäudetechnik West GmbH",
      "company_seat": "Essen",
      "details": "20.02.2026 (Bekanntmachungsdatum)\n\nNordrhein-Westfalen Amtsgericht Essen HRB 13892\nRegisterbekanntmachung nach dem Umwandlungsgesetz 20.02.2026 (Eintragungsdatum)\n\nSalvia Gebäudetechnik West GmbH\nGesellschaft mit beschränkter Haftung\nEssen\n\nDen Gläubigern der an der Verschmelzung beteiligten Rechtsträger ist, wenn sie binnen sechs Monaten nach dem Tag, an dem die Eintragung der Verschmelzung in das Register des Sitzes desjenigen Rechtsträgers, dessen Gläubiger sie sind, nach § 19 Absatz 3 UmwG als bekanntgemacht gilt, ihren Anspruch nach Grund und Höhe schriftlich anmelden, Sicherheit zu leisten, soweit sie nicht Befriedigung verlangen können. Dieses Recht steht den Gläubigern jedoch nur zu, wenn sie glaubhaft machen, dass durch die Verschmelzung die Erfüllung ihrer Forderung gefährdet wird."
    },
    {
      "date": "2026-02-20",
      "id": "145783",
      "original_text": "Registerbekanntmachung nach dem Umwandlungsgesetz\nNordrhein-Westfalen Amtsgericht Düsseldorf HRB 105401\nS&G Data Center GmbH – Düsseldorf",
      "type": "Registerbekanntmachung nach dem Umwandlungsgesetz",
      "state": "Nordrhein-Westfalen",
      "amtsgericht": "Amtsgericht Düsseldorf",
      "registernummer": "HRB 105401",
      "registerart": "HRB",
      "company_name": "S&G Data Center GmbH",
      "company_seat": "Düsseldorf",
      "details": "20.02.2026 (Bekanntmachungsdatum)\n\nNordrhein-Westfalen Amtsgericht Düsseldorf HRB 105401\nRegisterbekanntmachung nach dem Umwandlungsgesetz 20.02.2026 (Eintragungsdatum)\n\nS&G Data Center GmbH\nGesellschaft mit beschränkter Haftung\nDüsseldorf\n\nDen Gläubigern der an der Verschmelzung beteiligten Rechtsträger ist, wenn sie binnen sechs Monaten nach dem Tag, an dem die Eintragung der Verschmelzung in das Register des Sitzes desjenigen Rechtsträgers, dessen Gläubiger sie sind, nach § 19 Absatz 3 UmwG als bekanntgemacht gilt, ihren Anspruch nach Grund und Höhe schriftlich anmelden, Sicherheit zu leisten, soweit sie nicht Befriedigung verlangen können. Dieses Recht steht den Gläubigern jedoch nur zu, wenn sie glaubhaft machen, dass durch die Verschmelzung die Erfüllung ihrer Forderung gefährdet wird."
    },
    {
      "date": "2026-02-20",
      "id": "145784",
      "original_text": "Löschungsankündigung\nNordrhein-Westfalen Amtsgericht Düsseldorf HRB 69700\nOverseas Metal Supply GmbH – Düsseldorf",
      "type": "Löschungsankündigung",
      "state": "Nordrhein-Westfalen",
      "amtsgericht": "Amtsgericht Düsseldorf",
      "registernummer": "HRB 69700",
      "registerart": "HRB",
      "company_name": "Overseas Metal Supply GmbH",
      "company_seat": "Düsseldorf",
      "details": "20.02.2026 (Bekanntmachungsdatum)\n\nNordrhein-Westfalen Amtsgericht Düsseldorf HRB 69700\nLöschungsankündigung\n\nOverseas Metal Supply GmbH\nGesellschaft mit beschränkter Haftung\nDüsseldorf\n\nDas Registergericht beabsichtigt die Gesellschaft von Amts wegen nach § 394 Abs. 1 FamFG zu löschen. Die Frist zur Erhebung eines Widerspruchs ist auf 3 Wochen festgesetzt.\n\nRechtsbehelfsbelehrung:\nDas Widerspruchsrecht steht jedem zu, der an der Unterlassung der Löschung ein berechtigtes Interesse hat. Der Widerspruch ist bei dem Amtsgericht Düsseldorf -Registergericht-, Werdener Straße 1, 40227 Düsseldorf schriftlich in deutscher Sprache oder zur Niederschrift der Geschäftsstelle einzulegen. Der Widerspruch kann auch zur Niederschrift der Geschäftsstelle eines jeden Amtsgerichtes abgegeben werden. Die Einlegung ist auch durch Übertragung eines elektronischen Dokuments an die elektronische Poststelle des Gerichts möglich. Das elektronische Dokument muss für die Bearbeitung durch das Gericht geeignet und mit einer qualifizierten elektronischen Signatur der verantwortenden Person versehen sein oder von der verantwortenden Person signiert und auf einem sicheren Übermittlungsweg gemäß § 130a ZPO nach näherer Maßgabe der Verordnung über die technischen Rahmenbedingungen des elektronischen Rechtsverkehrs und über das besondere elektronische Behördenpostfach (BGBl. I, S.3803) eingereicht werden. Weitere Informationen erhalten Sie auf der Internetseite www.justiz.de.\nDer Widerspruch muss spätestens innerhalb der gesetzten Frist nach dem Datum der Bekanntmachung der Löschungsankündigung bei dem Amtsgericht - Registergericht - Düsseldorf eingegangen sein.  Dies gilt auch dann, wenn der Widerspruch zur Niederschrift der Geschäftsstelle eines anderen Amtsgerichtes abgegeben wurde. Die Frist beginnt mit dem Tage der Bekanntmachung der Löschungsankündigung in dem für die Bekanntmachung der Eintragungen in das Handelsregister bestimmten elektronischen Informations- und Kommunikationssystem nach § 10 des Handelsgesetzbuches. Fällt das Ende der Frist auf einen Sonntag, einen allgemeinen Feiertag oder Sonnabend, so endet die Frist mit Ablauf des nächsten Werktages.\nDer Widerspruch muss die Bezeichnung der angefochtenen Löschungsankündigung sowie die Erklärung enthalten, dass Widerspruch gegen diese Löschungsankündigung eingelegt wird. Er ist zu unterzeichnen und soll begründet werden."
    },
    {
      "date": "2026-02-20",
      "id": "145785",
      "original_text": "Löschungsankündigung\nNordrhein-Westfalen Amtsgericht Essen HRB 30990\nSWEDOO Technology GmbH – Essen",
      "type": "Löschungsankündigung",
      "state": "Nordrhein-Westfalen",
      "amtsgericht": "Amtsgericht Essen",
      "registernummer": "HRB 30990",
      "registerart": "HRB",
      "company_name": "SWEDOO Technology GmbH",
      "company_seat": "Essen",
      "details": "20.02.2026 (Bekanntmachungsdatum)\n\nNordrhein-Westfalen Amtsgericht Essen HRB 30990\nLöschungsankündigung\n\nSWEDOO Technology GmbH\nGesellschaft mit beschränkter Haftung\nEssen\n\nDas Registergericht beabsichtigt die Gesellschaft von Amts wegen nach § 394 FamFG zu löschen. Die Frist zur Erhebung eines Widerspruchs ist auf einen Monat festgesetzt."
    },
    {
      "date": "2026-02-20",
      "id": "145786",
      "original_text": "Registerbekanntmachung nach dem Umwandlungsgesetz\nNordrhein-Westfalen Amtsgericht Köln HRB 82246\nPreZero Stoffstrom Management GmbH – Köln",
      "type": "Registerbekanntmachung nach dem Umwandlungsgesetz",
      "state": "Nordrhein-Westfalen",
      "amtsgericht": "Amtsgericht Köln",
      "registernummer": "HRB 82246",
      "registerart": "HRB",
      "company_name": "PreZero Stoffstrom Management GmbH",
      "company_seat": "Köln",
      "details": "20.02.2026 (Bekanntmachungsdatum)\n\nNordrhein-Westfalen Amtsgericht Köln HRB 82246\nRegisterbekanntmachung nach dem Umwandlungsgesetz 20.02.2026 (Eintragungsdatum)\n\nPreZero Stoffstrom Management GmbH\nGesellschaft mit beschränkter Haftung\nKöln\n\nDen Gläubigern der an der Verschmelzung beteiligten Rechtsträger ist, wenn sie binnen sechs Monaten nach dem Tag, an dem die Eintragung der Verschmelzung in das Register des Sitzes desjenigen Rechtsträgers, dessen Gläubiger sie sind, nach § 19 Absatz 3 UmwG als bekanntgemacht gilt, ihren Anspruch nach Grund und Höhe schriftlich anmelden, Sicherheit zu leisten, soweit sie nicht Befriedigung verlangen können. Dieses Recht steht den Gläubigern jedoch nur zu, wenn sie glaubhaft machen, dass durch die Verschmelzung die Erfüllung ihrer Forderung gefährdet wird."
    },
    {
      "date": "2026-02-20",
      "id": "145787",
      "original_text": "Registerbekanntmachung nach dem Umwandlungsgesetz\nNordrhein-Westfalen Amtsgericht Köln HRA 38133\nHKK \"Hemmerich Kälte Klima\" e. K – Bergheim",
      "type": "Registerbekanntmachung nach dem Umwandlungsgesetz",
      "state": "Nordrhein-Westfalen",
      "amtsgericht": "Amtsgericht Köln",
      "registernummer": "HRA 38133",
      "registerart": "HRA",
      "company_name": "HKK \"Hemmerich Kälte Klima\" e. K",
      "company_seat": "Bergheim",
      "details": "20.02.2026 (Bekanntmachungsdatum)\n\nNordrhein-Westfalen Amtsgericht Köln HRA 38133\nRegisterbekanntmachung nach dem Umwandlungsgesetz 20.02.2026 (Eintragungsdatum)\n\nHKK \"Hemmerich Kälte Klima\" e. K\nEinzelkaufmann / Einzelkauffrau\nBergheim\n\nDen Gläubigern der an der Ausgliederung beteiligten Rechtsträger ist, wenn sie binnen sechs Monaten nach dem Tag, an dem die Eintragung der Ausgliederung in das Register des Sitzes desjenigen Rechtsträgers, dessen Gläubiger sie sind, nach § 19 Absatz 3 UmwG als bekanntgemacht gilt, ihren Anspruch nach Grund und Höhe schriftlich anmelden, Sicherheit zu leisten, soweit sie nicht Befriedigung verlangen können. Dieses Recht steht den Gläubigern jedoch nur zu, wenn sie glaubhaft machen, dass durch die Ausgliederung die Erfüllung ihrer Forderung gefährdet wird."
    },
    {
      "date": "2026-02-20",
      "id": "145788",
      "original_text": "Registerbekanntmachung nach dem Umwandlungsgesetz\nNordrhein-Westfalen Amtsgericht Köln HRB 89056\nSMARTY Zeitwohnen GmbH – Köln",
      "type": "Registerbekanntmachung nach dem Umwandlungsgesetz",
      "state": "Nordrhein-Westfalen",
      "amtsgericht": "Amtsgericht Köln",
      "registernummer": "HRB 89056",
      "registerart": "HRB",
      "company_name": "SMARTY Zeitwohnen GmbH",
      "company_seat": "Köln",
      "details": "20.02.2026 (Bekanntmachungsdatum)\n\nNordrhein-Westfalen Amtsgericht Köln HRB 89056\nRegisterbekanntmachung nach dem Umwandlungsgesetz 20.02.2026 (Eintragungsdatum)\n\nSMARTY Zeitwohnen GmbH\nGesellschaft mit beschränkter Haftung\nKöln\n\nDen Gläubigern der an der Abspaltung beteiligten Rechtsträger ist, wenn sie binnen sechs Monaten nach dem Tag, an dem die Eintragung der Abspaltung in das Register des Sitzes desjenigen Rechtsträgers, dessen Gläubiger sie sind, nach § 19 Absatz 3 UmwG als bekanntgemacht gilt, ihren Anspruch nach Grund und Höhe schriftlich anmelden, Sicherheit zu leisten, soweit sie nicht Befriedigung verlangen können. Dieses Recht steht den Gläubigern jedoch nur zu, wenn sie glaubhaft machen, dass durch die Abspaltung die Erfüllung ihrer Forderung gefährdet wird."
    },
    {
      "date": "2026-02-20",
      "id": "145789",
      "original_text": "Registerbekanntmachung nach dem Umwandlungsgesetz\nNordrhein-Westfalen Amtsgericht Bochum HRB 22618\nDui Sushi Bochum GmbH – Bochum",
      "type": "Registerbekanntmachung nach dem Umwandlungsgesetz",
      "state": "Nordrhein-Westfalen",
      "amtsgericht": "Amtsgericht Bochum",
      "registernummer": "HRB 22618",
      "registerart": "HRB",
      "company_name": "Dui Sushi Bochum GmbH",
      "company_seat": "Bochum",
      "details": "20.02.2026 (Bekanntmachungsdatum)\n\nNordrhein-Westfalen Amtsgericht Bochum HRB 22618\nRegisterbekanntmachung nach dem Umwandlungsgesetz 19.02.2026 (Eintragungsdatum)\n\nDui Sushi Bochum GmbH\nGesellschaft mit beschränkter Haftung\nBochum\n\nDen Gläubigern der an der Ausgliederung beteiligten Rechtsträger ist, wenn sie binnen sechs Monaten nach dem Tag, an dem die Eintragung der Ausgliederung in das Register des Sitzes desjenigen Rechtsträgers, dessen Gläubiger sie sind, nach § 19 Absatz 3 UmwG als bekanntgemacht gilt, ihren Anspruch nach Grund und Höhe schriftlich anmelden, Sicherheit zu leisten, soweit sie nicht Befriedigung verlangen können. Dieses Recht steht den Gläubigern jedoch nur zu, wenn sie glaubhaft machen, dass durch die Ausgliederung die Erfüllung ihrer Forderung gefährdet wird."
    },
    {
      "date": "2026-02-20",
      "id": "145790",
      "original_text": "Löschungsankündigung\nNordrhein-Westfalen Amtsgericht Paderborn HRB 5680\nAA Absicherungs- u. Aufsperrdienst GmbH – Geseke",
      "type": "Löschungsankündigung",
      "state": "Nordrhein-Westfalen",
      "amtsgericht": "Amtsgericht Paderborn",
      "registernummer": "HRB 5680",
      "registerart": "HRB",
      "company_name": "AA Absicherungs- u. Aufsperrdienst GmbH",
      "company_seat": "Geseke",
      "details": "20.02.2026 (Bekanntmachungsdatum)\n\nNordrhein-Westfalen Amtsgericht Paderborn HRB 5680\nLöschungsankündigung\n\nAA Absicherungs- u. Aufsperrdienst GmbH\nGesellschaft mit beschränkter Haftung\nGeseke\n\nDas Registergericht beabsichtigt die Gesellschaft von Amts wegen nach § 394 FamFG zu löschen. Die Frist zur Erhebung eines Widerspruchs ist auf einen Monat festgesetzt."
    },
    {
      "date": "2026-02-20",
      "id": "145791",
      "original_text": "Löschungsankündigung\nNordrhein-Westfalen Amtsgericht Düsseldorf HRB 71365\ncura vitae häusliche Betreuung UG (haftungsbeschränkt) – Düsseldorf",
      "type": "Löschungsankündigung",
      "state": "Nordrhein-Westfalen",
      "amtsgericht": "Amtsgericht Düsseldorf",
      "registernummer": "HRB 71365",
      "registerart": "HRB",
      "company_name": "cura vitae häusliche Betreuung UG (haftungsbeschränkt)",
      "company_seat": "Düsseldorf",
      "details": "20.02.2026 (Bekanntmachungsdatum)\n\nNordrhein-Westfalen Amtsgericht Düsseldorf HRB 71365\nLöschungsankündigung\n\ncura vitae häusliche Betreuung UG (haftungsbeschränkt)\nGesellschaft mit beschränkter Haftung\nDüsseldorf\n\nDas Registergericht beabsichtigt die Gesellschaft von Amts wegen nach § 394 FamFG zu löschen. Die Frist zur Erhebung eines Widerspruchs ist auf 3 Wochen festgesetzt.\n\nRechtsbehelfsbelehrung:\nDas Widerspruchsrecht steht jedem zu, der an der Unterlassung der Löschung ein berechtigtes Interesse hat. Der Widerspruch ist bei dem Amtsgericht Düsseldorf -Registergericht-, Werdener Straße 1, 40227 Düsseldorf schriftlich in deutscher Sprache oder zur Niederschrift der Geschäftsstelle einzulegen. Der Widerspruch kann auch zur Niederschrift der Geschäftsstelle eines jeden Amtsgerichtes abgegeben werden. Die Einlegung ist auch durch Übertragung eines elektronischen Dokuments an die elektronische Poststelle des Gerichts möglich. Das elektronische Dokument muss für die Bearbeitung durch das Gericht geeignet und mit einer qualifizierten elektronischen Signatur der verantwortenden Person versehen sein oder von der verantwortenden Person signiert und auf einem sicheren Übermittlungsweg gemäß § 130a ZPO nach näherer Maßgabe der Verordnung über die technischen Rahmenbedingungen des elektronischen Rechtsverkehrs und über das besondere elektronische Behördenpostfach (BGBl. I, S.3803) eingereicht werden. Weitere Informationen erhalten Sie auf der Internetseite www.justiz.de.\nDer Widerspruch muss spätestens innerhalb der gesetzten Frist nach dem Datum der Bekanntmachung der Löschungsankündigung bei dem Amtsgericht - Registergericht - Düsseldorf eingegangen sein.  Dies gilt auch dann, wenn der Widerspruch zur Niederschrift der Geschäftsstelle eines anderen Amtsgerichtes abgegeben wurde. Die Frist beginnt mit dem Tage der Bekanntmachung der Löschungsankündigung in dem für die Bekanntmachung der Eintragungen in das Handelsregister bestimmten elektronischen Informations- und Kommunikationssystem nach § 10 des Handelsgesetzbuches. Fällt das Ende der Frist auf einen Sonntag, einen allgemeinen Feiertag oder Sonnabend, so endet die Frist mit Ablauf des nächsten Werktages.\nDer Widerspruch muss die Bezeichnung der angefochtenen Löschungsankündigung sowie die Erklärung enthalten, dass Widerspruch gegen diese Löschungsankündigung eingelegt wird. Er ist zu unterzeichnen und soll begründet werden."
    },
    {
      "date": "2026-02-20",
      "id": "145792",
      "original_text": "Registerbekanntmachung nach dem Umwandlungsgesetz\nNordrhein-Westfalen Amtsgericht Köln HRA 38633\nEigen Grundstücksverwaltung GmbH & Co. KG – Leverkusen",
      "type": "Registerbekanntmachung nach dem Umwandlungsgesetz",
      "state": "Nordrhein-Westfalen",
      "amtsgericht": "Amtsgericht Köln",
      "registernummer": "HRA 38633",
      "registerart": "HRA",
      "company_name": "Eigen Grundstücksverwaltung GmbH & Co. KG",
      "company_seat": "Leverkusen",
      "details": "20.02.2026 (Bekanntmachungsdatum)\n\nNordrhein-Westfalen Amtsgericht Köln HRA 38633\nRegisterbekanntmachung nach dem Umwandlungsgesetz 20.02.2026 (Eintragungsdatum)\n\nEigen Grundstücksverwaltung GmbH & Co. KG\nKommanditgesellschaft\nLeverkusen\n\nDen Gläubigern der an der formwechselnden Umwandlung beteiligten Rechtsträger ist, wenn sie binnen sechs Monaten nach dem Tag, an dem die Eintragung der formwechselnden Umwandlung in das Register des Sitzes desjenigen Rechtsträgers, dessen Gläubiger sie sind, nach § 19 Absatz 3 UmwG als bekanntgemacht gilt, ihren Anspruch nach Grund und Höhe schriftlich anmelden, Sicherheit zu leisten, soweit sie nicht Befriedigung verlangen können. Dieses Recht steht den Gläubigern jedoch nur zu, wenn sie glaubhaft machen, dass durch die formwechselnden Umwandlung die Erfüllung ihrer Forderung gefährdet wird."
    },
    {
      "date": "2026-02-20",
      "id": "145793",
      "original_text": "Löschungsankündigung\nNordrhein-Westfalen Amtsgericht Duisburg HRB 25775\nWorld Trading Food GmbH – Duisburg",
      "type": "Löschungsankündigung",
      "state": "Nordrhein-Westfalen",
      "amtsgericht": "Amtsgericht Duisburg",
      "registernummer": "HRB 25775",
      "registerart": "HRB",
      "company_name": "World Trading Food GmbH",
      "company_seat": "Duisburg",
      "details": "20.02.2026 (Bekanntmachungsdatum)\n\nNordrhein-Westfalen Amtsgericht Duisburg HRB 25775\nLöschungsankündigung\n\nWorld Trading Food GmbH\nGesellschaft mit beschränkter Haftung\nDuisburg\n\nDas Registergericht beabsichtigt, die im Handelsregister unter HRB 25775  eingetragene Gesellschaft World Trading Food GmbH  gemäß § 394 FamFG wegen Vermögenslosigkeit von Amts wegen zu löschen.\nGegen diese Verfügung kann Widerspruch eingelegt werden. Die Frist zur Erhebung eines Widerspruchs gegen die beabsichtigte Löschung von Amts wegen ist auf drei Monate festgesetzt.\n\nRechtsbehelfsbelehrung\nDer Widerspruch ist bei dem Amtsgericht Duisburg, Kardinal-Galen-Str. 124-132, 47058 Duisburg schriftlich in deutscher Sprache oder zur Niederschrift der Geschäftsstelle einzulegen. Der Widerspruch kann auch zur Niederschrift der Geschäftsstelle eines jeden Amtsgerichtes abgegeben werden.\nDie Einlegung ist auch durch Übertragung eines elektronischen Dokuments an die elektronische Poststelle des Gerichts möglich. Das elektronische Dokument muss für die Bearbeitung durch das Gericht geeignet und mit einer qualifizierten elektronischen Signatur der verantwortenden Person versehen sein oder von der verantwortenden Person signiert und auf einem sicheren Übermittlungsweg gemäß § 130 a ZPO nach näherer Maßgabe der Verordnung über die technischen Rahmenbedingungen des elektronischen Rechtsverkehrs und über das besondere elektronische Behördenpostfach (BGBl. I, S. 3803) eingereicht werden. Weitere Informationen erhalten Sie auf der Internetseite www.justiz.de.\n\nDer Widerspruch muss spätestens innerhalb der gesetzten Frist bei dem Amtsgericht Duisburg eingegangen sein. Dies gilt auch dann, wenn der Widerspruch zur Niederschrift der Geschäftsstelle eines anderen Amtsgerichtes abgegeben wurde. Die Frist beginnt mit der Veröffentlichung. Fällt das Ende der Frist auf einen Sonntag, einen allgemeinen Feiertag oder Sonnabend, so endet die Frist mit Ablauf des nächsten Werktages.\n\nDer Widerspruch muss die Bezeichnung der angefochtenen Verfügung sowie die Erklärung enthalten, dass Widerspruch gegen diese Verfügung eingelegt wird. Er ist zu unterzeichnen und soll begründet werden."
    },
    {
      "date": "2026-02-20",
      "id": "145794",
      "original_text": "Löschungsankündigung\nNordrhein-Westfalen Amtsgericht Siegburg HRB 15806\nULTRA Schaltelemente UG (haftungsbeschränkt) – Troisdorf",
      "type": "Löschungsankündigung",
      "state": "Nordrhein-Westfalen",
      "amtsgericht": "Amtsgericht Siegburg",
      "registernummer": "HRB 15806",
      "registerart": "HRB",
      "company_name": "ULTRA Schaltelemente UG (haftungsbeschränkt)",
      "company_seat": "Troisdorf",
      "details": "20.02.2026 (Bekanntmachungsdatum)\n\nNordrhein-Westfalen Amtsgericht Siegburg HRB 15806\nLöschungsankündigung\n\nULTRA Schaltelemente UG (haftungsbeschränkt)\nGesellschaft mit beschränkter Haftung\nTroisdorf\n\nDas Registergericht hat glaubhafte Kenntnis erlangt, dass die Gesellschaft vermögenslos geworden ist.\n\nEs ist daher beabsichtigt, die Gesellschaft nach § 394 FamFG im Handelsregister wegen Vermögenslosigkeit zu löschen.\nEinwände gegen die Löschung sind durch Widerspruch binnen einer Frist von 3 Monaten geltend zu machen, andernfalls die Löschung erfolgen wird.\n\nEinzulegen ist der Widerspruch bei dem Amtsgericht Siegburg, Neue Poststraße 16, 53721 Siegburg, und zwar entweder schriftlich in deutscher Sprache oder mündlich zur Niederschrift der Geschäftsstelle. Der Widerspruch kann auch zur Niederschrift der Geschäftsstelle eines jeden Amtsgerichts abgegeben werden. Der Widerspruch ist binnen der in der Verfügung bestimmten Frist einzulegen. Die Frist ist nur gewahrt, wenn der Widerspruch rechtzeitig bei dem Amtsgericht Siegburg eingeht, auch wenn der Widerspruch zur Niederschrift der Geschäftsstelle eines anderen Amtsgerichts abgegeben wurde. Die Frist beginnt jeweils mit der schriftlichen Bekanntgabe der Verfügung an die Beteiligten. Kann die schriftliche Bekanntgabe an einen Beteiligten nicht bewirkt werden, beginnt die Frist spätestens mit Ablauf von fünf Monaten nach Erlass der Verfügung. Die Bekanntgabe ist entweder durch Zustellung oder am dritten Tage nach Aufgabe zur Post bewirkt. Sofern die Löschung noch nicht erfolgt ist, kann der Widerspruch auch noch nach Ablauf der Frist eingelegt werden. Fällt das Ende der Frist auf einen Sonnabend, einen Sonntag oder einen allgemeinen Feiertag, endet die Frist mit Ablauf des nächsten Werktages. Der Widerspruch ist zu unterzeichnen. Eine Begründung des Widerspruchs ist nicht vorgeschrieben."
    },
    {
      "date": "2026-02-20",
      "id": "145795",
      "original_text": "Sonstige Registerbekanntmachung\nHessen Amtsgericht Fritzlar VR 201\nElisabeth - Konferenz e. V. – Fritzlar",
      "type": "Sonstige Registerbekanntmachung",
      "state": "Hessen",
      "amtsgericht": "Amtsgericht Fritzlar",
      "registernummer": "VR 201",
      "registerart": "VR",
      "company_name": "Elisabeth - Konferenz e. V.",
      "company_seat": "Fritzlar",
      "details": "20.02.2026 (Bekanntmachungsdatum)\n\nHessen Amtsgericht Fritzlar VR 201\nSonstige Registerbekanntmachung 20.02.2026 (Eintragungsdatum)\n\nElisabeth - Konferenz e. V.\neingetragener Verein\nFritzlar\n\nDer Verein ist aufgelöst."
    },
    {
      "date": "2026-02-20",
      "id": "145796",
      "original_text": "Löschungsankündigung\nHessen Amtsgericht Frankfurt am Main HRB 130668\nSR Mobile GmbH – Frankfurt am Main",
      "type": "Löschungsankündigung",
      "state": "Hessen",
      "amtsgericht": "Amtsgericht Frankfurt am Main",
      "registernummer": "HRB 130668",
      "registerart": "HRB",
      "company_name": "SR Mobile GmbH",
      "company_seat": "Frankfurt am Main",
      "details": "20.02.2026 (Bekanntmachungsdatum)\n\nHessen Amtsgericht Frankfurt am Main HRB 130668\nLöschungsankündigung 20.02.2026 (Eintragungsdatum)\n\nSR Mobile GmbH\nGesellschaft mit beschränkter Haftung\nFrankfurt am Main\n\nDas Registergericht beabsichtigt die im Handelsregister eingetragene Gesellschaft von Amts wegen nach § 394 FamFG zu löschen. Die Frist zur Erhebung eines Widerspruchs gegen die beabsichtigte Löschung wird auf 1 Monat festgesetzt."
    },
    {
      "date": "2026-02-20",
      "id": "145797",
      "original_text": "Registerbekanntmachung nach dem Umwandlungsgesetz\nHessen Amtsgericht Darmstadt GsR 960\nEFE Verwaltungs B.V. & Co. eGbR – Eppertshausen",
      "type": "Registerbekanntmachung nach dem Umwandlungsgesetz",
      "state": "Hessen",
      "amtsgericht": "Amtsgericht Darmstadt",
      "registernummer": "GsR 960",
      "registerart": "GsR",
      "company_name": "EFE Verwaltungs B.V. & Co. eGbR",
      "company_seat": "Eppertshausen",
      "details": "20.02.2026 (Bekanntmachungsdatum)\n\nHessen Amtsgericht Darmstadt GsR 960\nRegisterbekanntmachung nach dem Umwandlungsgesetz 20.02.2026 (Eintragungsdatum)\n\nEFE Verwaltungs B.V. & Co. eGbR\nGesellschaft bürgerlichen Rechts\nEppertshausen\n\nDen Gläubigern der an der formwechselnden Umwandlung beteiligten Rechtsträger ist, wenn sie binnen sechs Monaten nach dem Tag, an dem die Eintragung der formwechselnden Umwandlung in das Register des Sitzes derjenigen Rechtsträger deren Gläubiger sie sind, nach § 201 UmwG bekannt gemacht worden ist, ihren Anspruch nach Grund und Höhe schriftlich anmelden, Sicherheit zu leisten, soweit sie nicht Befriedigung verlangen können. Dieses Recht steht den Gläubigern jedoch nur zu, wenn sie glaubhaft machen, dass durch die formwechselnden Umwandlung die Erfüllung ihrer Forderung gefährdet wird."
    },
    {
      "date": "2026-02-20",
      "id": "145798",
      "original_text": "Löschungsankündigung\nHessen Amtsgericht Wiesbaden HRB 27915\nCS Protection UG (haftungsbeschränkt) – Wiesbaden",
      "type": "Löschungsankündigung",
      "state": "Hessen",
      "amtsgericht": "Amtsgericht Wiesbaden",
      "registernummer": "HRB 27915",
      "registerart": "HRB",
      "company_name": "CS Protection UG (haftungsbeschränkt)",
      "company_seat": "Wiesbaden",
      "details": "20.02.2026 (Bekanntmachungsdatum)\n\nHessen Amtsgericht Wiesbaden HRB 27915\nLöschungsankündigung\n\nCS Protection UG (haftungsbeschränkt)\nGesellschaft mit beschränkter Haftung\nWiesbaden\n\nDas Registergericht beabsichtigt die im Handelsregister eingetragene Gesellschaft von Amts wegen nach § 394 FamFG zu löschen. Die Frist zur Erhebung eines Widerspruchs gegen die beabsichtigte Löschung wird auf 3 Monate festgesetzt."
    },
    {
      "date": "2026-02-20",
      "id": "145799",
      "original_text": "Registerbekanntmachung nach dem Umwandlungsgesetz\nHessen Amtsgericht Hanau HRB 100534\nGesundheits-, Therapie- und Schulungszentrum Wiegand GmbH – Maintal",
      "type": "Registerbekanntmachung nach dem Umwandlungsgesetz",
      "state": "Hessen",
      "amtsgericht": "Amtsgericht Hanau",
      "registernummer": "HRB 100534",
      "registerart": "HRB",
      "company_name": "Gesundheits-, Therapie- und Schulungszentrum Wiegand GmbH",
      "company_seat": "Maintal",
      "details": "20.02.2026 (Bekanntmachungsdatum)\n\nHessen Amtsgericht Hanau HRB 100534\nRegisterbekanntmachung nach dem Umwandlungsgesetz 20.02.2026 (Eintragungsdatum)\n\nGesundheits-, Therapie- und Schulungszentrum Wiegand GmbH\nGesellschaft mit beschränkter Haftung\nMaintal\n\nDen Gläubigern der an der Ausgliederung beteiligten Rechtsträger ist, wenn sie binnen sechs Monaten nach dem Tag, an dem die Eintragung der Ausgliederung in das Register des Sitzes desjenigen Rechtsträgers, dessen Gläubiger sie sind, nach §§ 125, 19 Absatz 3 UmwG bekannt gemacht worden ist, ihren Anspruch nach Grund und Höhe schriftlich anmelden, Sicherheit zu leisten, soweit sie nicht Befriedigung verlangen können. Dieses Recht steht den Gläubigern jedoch nur zu, wenn sie glaubhaft machen, dass durch die Ausgliederung die Erfüllung ihrer Forderung gefährdet wird."
    },
    {
      "date": "2026-02-20",
      "id": "145800",
      "original_text": "Registerbekanntmachung nach dem Umwandlungsgesetz\nHessen Amtsgericht Darmstadt HRB 108116\nEFE Multimedia GmbH – Eppertshausen",
      "type": "Registerbekanntmachung nach dem Umwandlungsgesetz",
      "state": "Hessen",
      "amtsgericht": "Amtsgericht Darmstadt",
      "registernummer": "HRB 108116",
      "registerart": "HRB",
      "company_name": "EFE Multimedia GmbH",
      "company_seat": "Eppertshausen",
      "details": "20.02.2026 (Bekanntmachungsdatum)\n\nHessen Amtsgericht Darmstadt HRB 108116\nRegisterbekanntmachung nach dem Umwandlungsgesetz 20.02.2026 (Eintragungsdatum)\n\nEFE Multimedia GmbH\nGesellschaft mit beschränkter Haftung\nEppertshausen\n\nDen Gläubigern der an der formwechselnden Umwandlung beteiligten Rechtsträger ist, wenn sie binnen sechs Monaten nach dem Tag, an dem die Eintragung der formwechselnden Umwandlung in das Register des Sitzes derjenigen Rechtsträger deren Gläubiger sie sind, nach § 201 UmwG bekannt gemacht worden ist, ihren Anspruch nach Grund und Höhe schriftlich anmelden, Sicherheit zu leisten, soweit sie nicht Befriedigung verlangen können. Dieses Recht steht den Gläubigern jedoch nur zu, wenn sie glaubhaft machen, dass durch die formwechselnden Umwandlung die Erfüllung ihrer Forderung gefährdet wird."
    },
    {
      "date": "2026-02-20",
      "id": "145801",
      "original_text": "Löschungsankündigung\nHessen Amtsgericht Frankfurt am Main HRB 116024\nSF Pools Frankfurt GmbH – Frankfurt am Main",
      "type": "Löschungsankündigung",
      "state": "Hessen",
      "amtsgericht": "Amtsgericht Frankfurt am Main",
      "registernummer": "HRB 116024",
      "registerart": "HRB",
      "company_name": "SF Pools Frankfurt GmbH",
      "company_seat": "Frankfurt am Main",
      "details": "20.02.2026 (Bekanntmachungsdatum)\n\nHessen Amtsgericht Frankfurt am Main HRB 116024\nLöschungsankündigung 20.02.2026 (Eintragungsdatum)\n\nSF Pools Frankfurt GmbH\nGesellschaft mit beschränkter Haftung\nFrankfurt am Main\n\nDas Registergericht beabsichtigt die im Handelsregister eingetragene Gesellschaft von Amts wegen nach § 394 FamFG zu löschen. Die Frist zur Erhebung eines Widerspruchs gegen die beabsichtigte Löschung wird auf 1 Monat festgesetzt."
    },
    {
      "date": "2026-02-20",
      "id": "145802",
      "original_text": "Löschungsankündigung\nHessen Amtsgericht Frankfurt am Main HRB 122235\nAlfaBee AG – Frankfurt am Main",
      "type": "Löschungsankündigung",
      "state": "Hessen",
      "amtsgericht": "Amtsgericht Frankfurt am Main",
      "registernummer": "HRB 122235",
      "registerart": "HRB",
      "company_name": "AlfaBee AG",
      "company_seat": "Frankfurt am Main",
      "details": "20.02.2026 (Bekanntmachungsdatum)\n\nHessen Amtsgericht Frankfurt am Main HRB 122235\nLöschungsankündigung\n\nAlfaBee AG\nAktiengesellschaft\nFrankfurt am Main\n\nDas Registergericht beabsichtigt die im Handelsregister eingetragene Gesellschaft von Amts wegen nach § 394 FamFG zu löschen. Die Frist zur Erhebung eines Widerspruchs gegen die beabsichtigte Löschung wird auf 1 Monat festgesetzt."
    },
    {
      "date": "2026-02-20",
      "id": "145803",
      "original_text": "Einreichung neuer Dokumente\nHessen Amtsgericht Limburg HRB 33\nBauunternehmung Albert Weil Aktiengesellschaft – Limburg a. d. Lahn",
      "type": "Einreichung neuer Dokumente",
      "state": "Hessen",
      "amtsgericht": "Amtsgericht Limburg",
      "registernummer": "HRB 33",
      "registerart": "HRB",
      "company_name": "Bauunternehmung Albert Weil Aktiengesellschaft",
      "company_seat": "Limburg a. d. Lahn",
      "details": "20.02.2026 (Bekanntmachungsdatum)\n\nHessen Amtsgericht Limburg HRB 33\nEinreichung neuer Dokumente 20.02.2026 (Eintragungsdatum)\n\nBauunternehmung Albert Weil Aktiengesellschaft\nAktiengesellschaft\nLimburg a. d. Lahn\n\nDurch eine Änderung in den Personen der Aufsichtsratsmitglieder ist eine Liste der Mitglieder des Aufsichtsrates zum Handelsregister eingereicht worden."
    },
    {
      "date": "2026-02-20",
      "id": "145804",
      "original_text": "Löschungsankündigung\nHessen Amtsgericht Frankfurt am Main HRB 122892\nREEF Technology Germany GmbH – Frankfurt am Main",
      "type": "Löschungsankündigung",
      "state": "Hessen",
      "amtsgericht": "Amtsgericht Frankfurt am Main",
      "registernummer": "HRB 122892",
      "registerart": "HRB",
      "company_name": "REEF Technology Germany GmbH",
      "company_seat": "Frankfurt am Main",
      "details": "20.02.2026 (Bekanntmachungsdatum)\n\nHessen Amtsgericht Frankfurt am Main HRB 122892\nLöschungsankündigung\n\nREEF Technology Germany GmbH\nGesellschaft mit beschränkter Haftung\nFrankfurt am Main\n\nDas Registergericht beabsichtigt die im Handelsregister eingetragene Gesellschaft von Amts wegen nach § 394 FamFG zu löschen. Die Frist zur Erhebung eines Widerspruchs gegen die beabsichtigte Löschung wird auf 1 Monat festgesetzt."
    },
    {
      "date": "2026-02-20",
      "id": "145805",
      "original_text": "Löschungsankündigung\nHessen Amtsgericht Frankfurt am Main HRB 83742\nEKSA Wohnungsgesellschaft mbH – Frankfurt am Main",
      "type": "Löschungsankündigung",
      "state": "Hessen",
      "amtsgericht": "Amtsgericht Frankfurt am Main",
      "registernummer": "HRB 83742",
      "registerart": "HRB",
      "company_name": "EKSA Wohnungsgesellschaft mbH",
      "company_seat": "Frankfurt am Main",
      "details": "20.02.2026 (Bekanntmachungsdatum)\n\nHessen Amtsgericht Frankfurt am Main HRB 83742\nLöschungsankündigung 20.02.2026 (Eintragungsdatum)\n\nEKSA Wohnungsgesellschaft mbH\nGesellschaft mit beschränkter Haftung\nFrankfurt am Main\n\nDas Registergericht beabsichtigt die im Handelsregister eingetragene Gesellschaft von Amts wegen nach § 394 FamFG zu löschen. Die Frist zur Erhebung eines Widerspruchs gegen die beabsichtigte Löschung wird auf 1 Monat festgesetzt."
    },
    {
      "date": "2026-02-20",
      "id": "145806",
      "original_text": "Löschungsankündigung\nHessen Amtsgericht Frankfurt am Main HRB 121791\nTRXF UG (haftungsbeschränkt) – Frankfurt am Main",
      "type": "Löschungsankündigung",
      "state": "Hessen",
      "amtsgericht": "Amtsgericht Frankfurt am Main",
      "registernummer": "HRB 121791",
      "registerart": "HRB",
      "company_name": "TRXF UG (haftungsbeschränkt)",
      "company_seat": "Frankfurt am Main",
      "details": "20.02.2026 (Bekanntmachungsdatum)\n\nHessen Amtsgericht Frankfurt am Main HRB 121791\nLöschungsankündigung\n\nTRXF UG (haftungsbeschränkt)\nGesellschaft mit beschränkter Haftung\nFrankfurt am Main\n\nDas Registergericht beabsichtigt die im Handelsregister eingetragene Gesellschaft von Amts wegen nach § 394 FamFG zu löschen. Die Frist zur Erhebung eines Widerspruchs gegen die beabsichtigte Löschung wird auf 1 Monat festgesetzt."
    },
    {
      "date": "2026-02-20",
      "id": "145807",
      "original_text": "Einreichung neuer Dokumente\nHessen Amtsgericht Frankfurt am Main HRB 104150\nceterion AG – Bad Vilbel",
      "type": "Einreichung neuer Dokumente",
      "state": "Hessen",
      "amtsgericht": "Amtsgericht Frankfurt am Main",
      "registernummer": "HRB 104150",
      "registerart": "HRB",
      "company_name": "ceterion AG",
      "company_seat": "Bad Vilbel",
      "details": "20.02.2026 (Bekanntmachungsdatum)\n\nHessen Amtsgericht Frankfurt am Main HRB 104150\nEinreichung neuer Dokumente\n\nceterion AG\nAktiengesellschaft\nBad Vilbel\n\nDurch eine Änderung in den Personen der Aufsichtsratsmitglieder ist eine Liste der Mitglieder des Aufsichtsrates zum Handelsregister eingereicht worden."
    },
    {
      "date": "2026-02-20",
      "id": "145808",
      "original_text": "Registerbekanntmachung nach dem Umwandlungsgesetz\nHessen Amtsgericht Hanau HRA 94366\nOsteopathie Maureen Wiegand e.K. – Maintal",
      "type": "Registerbekanntmachung nach dem Umwandlungsgesetz",
      "state": "Hessen",
      "amtsgericht": "Amtsgericht Hanau",
      "registernummer": "HRA 94366",
      "registerart": "HRA",
      "company_name": "Osteopathie Maureen Wiegand e.K.",
      "company_seat": "Maintal",
      "details": "20.02.2026 (Bekanntmachungsdatum)\n\nHessen Amtsgericht Hanau HRA 94366\nRegisterbekanntmachung nach dem Umwandlungsgesetz 20.02.2026 (Eintragungsdatum)\n\nOsteopathie Maureen Wiegand e.K.\nEinzelkaufmann / Einzelkauffrau\nMaintal\n\nDen Gläubigern der an der Ausgliederung beteiligten Rechtsträger ist, wenn sie binnen sechs Monaten nach dem Tag, an dem die Eintragung der Ausgliederung in das Register des Sitzes desjenigen Rechtsträgers, dessen Gläubiger sie sind, nach §§ 125, 19 Absatz 3 UmwG bekannt gemacht worden ist, ihren Anspruch nach Grund und Höhe schriftlich anmelden, Sicherheit zu leisten, soweit sie nicht Befriedigung verlangen können. Dieses Recht steht den Gläubigern jedoch nur zu, wenn sie glaubhaft machen, dass durch die Ausgliederung die Erfüllung ihrer Forderung gefährdet wird."
    }
  ]
}