{
  "date": "2026-02-10",
  "date_of_scrape": "2026-02-11T04:48:34.916Z",
  "tool_version": "0.2.0",
  "number_of_announcements": 106,
  "announcements": [
    {
      "date": "2026-02-10",
      "id": "144684",
      "original_text": "Einreichung neuer Dokumente\nBayern Amtsgericht Würzburg HRB 9244\nEIKONA AG – Volkach",
      "type": "Einreichung neuer Dokumente",
      "state": "Bayern",
      "amtsgericht": "Amtsgericht Würzburg",
      "registernummer": "HRB 9244",
      "registerart": "HRB",
      "company_name": "EIKONA AG",
      "company_seat": "Volkach",
      "details": "10.02.2026 (Bekanntmachungsdatum)\n\nBayern Amtsgericht Würzburg HRB 9244\nEinreichung neuer Dokumente\n\nEIKONA AG\nAktiengesellschaft\nVolkach\n\nDem Amtsgericht Würzburg -Registergericht- ist eine Liste der Mitglieder des Aufsichtsrats eingereicht worden, § 106 AktG."
    },
    {
      "date": "2026-02-10",
      "id": "144685",
      "original_text": "Registerbekanntmachung nach dem Umwandlungsgesetz\nBayern Amtsgericht Fürth HRB 22429\nExpectleads GmbH – Erlangen",
      "type": "Registerbekanntmachung nach dem Umwandlungsgesetz",
      "state": "Bayern",
      "amtsgericht": "Amtsgericht Fürth",
      "registernummer": "HRB 22429",
      "registerart": "HRB",
      "company_name": "Expectleads GmbH",
      "company_seat": "Erlangen",
      "details": "10.02.2026 (Bekanntmachungsdatum)\n\nBayern Amtsgericht Fürth HRB 22429\nRegisterbekanntmachung nach dem Umwandlungsgesetz 09.02.2026 (Eintragungsdatum)\n\nExpectleads GmbH\nGesellschaft mit beschränkter Haftung\nErlangen\n\nDen Gläubigern des formwechselnden Rechtsträgers ist, wenn sie binnen sechs Monaten nach dem Tag, an dem die Eintragung des Formwechsels nach § 201 UmwG als bekannt gemacht gilt, ihren Anspruch nach Grund und Höhe in Textform anmelden, Sicherheit zu leisten, soweit sie nicht Befriedigung verlangen können. Dieses Recht steht den Gläubigern jedoch nur zu, wenn sie glaubhaft machen, dass durch den Formwechsel die Erfüllung ihrer Forderung gefährdet wird."
    },
    {
      "date": "2026-02-10",
      "id": "144686",
      "original_text": "Registerbekanntmachung nach dem Umwandlungsgesetz\nBayern Amtsgericht Straubing VR 200093\nSchützenverein Leiblfing e.V. – Leiblfing",
      "type": "Registerbekanntmachung nach dem Umwandlungsgesetz",
      "state": "Bayern",
      "amtsgericht": "Amtsgericht Straubing",
      "registernummer": "VR 200093",
      "registerart": "VR",
      "company_name": "Schützenverein Leiblfing e.V.",
      "company_seat": "Leiblfing",
      "details": "10.02.2026 (Bekanntmachungsdatum)\n\nBayern Amtsgericht Straubing VR 200093\nRegisterbekanntmachung nach dem Umwandlungsgesetz 09.02.2026 (Eintragungsdatum)\n\nSchützenverein Leiblfing e.V.\neingetragener Verein\nLeiblfing\n\nDen Gläubigern #dv.auswahl(Text=\"Bitte zutreffendes auswählen:\",Eingabe=\n\n\"der an der Verschmelzung beteiligten Rechtsträger ist, wenn sie binnen sechs Monaten nach dem Tag, an dem die Eintragung der Verschmelzung in das Register des Sitzes desjenigen Rechtsträgers, dessen Gläubiger sie sind, nach § 19 Abs. 3 UmwG als bekannt gemacht gilt, ihren Anspruch nach Grund und Höhe in Textform anmelden, Sicherheit zu leisten, soweit sie nicht Befriedigung verlangen können. Dieses Recht steht den Gläubigern jedoch nur zu, wenn sie glaubhaft machen, dass durch die Verschmelzung die Erfüllung ihrer Forderung gefährdet wird.\"|\"Verschmelzung\","
    },
    {
      "date": "2026-02-10",
      "id": "144687",
      "original_text": "Löschungsankündigung\nBayern Amtsgericht Ingolstadt HRB 7533\nVanillaWorks UG (haftungsbeschränkt) – Ingolstadt",
      "type": "Löschungsankündigung",
      "state": "Bayern",
      "amtsgericht": "Amtsgericht Ingolstadt",
      "registernummer": "HRB 7533",
      "registerart": "HRB",
      "company_name": "VanillaWorks UG (haftungsbeschränkt)",
      "company_seat": "Ingolstadt",
      "details": "10.02.2026 (Bekanntmachungsdatum)\n\nBayern Amtsgericht Ingolstadt HRB 7533\nLöschungsankündigung\n\nVanillaWorks UG (haftungsbeschränkt)\nGesellschaft mit beschränkter Haftung\nIngolstadt\n\nDas Registergericht beabsichtigt, die im Handelsregister eingetragene Gesellschaft wegen Vermögenslosigkeit von Amts wegen nach § 394 FamFG zu löschen. #insert(Text=\"zztb_V_Widerspruchsfrist\")"
    },
    {
      "date": "2026-02-10",
      "id": "144688",
      "original_text": "Registerbekanntmachung nach dem Umwandlungsgesetz\nBayern Amtsgericht München HRB 281936\nPNZ C23 Beteiligungs UG (haftungsbeschränkt) – München",
      "type": "Registerbekanntmachung nach dem Umwandlungsgesetz",
      "state": "Bayern",
      "amtsgericht": "Amtsgericht München",
      "registernummer": "HRB 281936",
      "registerart": "HRB",
      "company_name": "PNZ C23 Beteiligungs UG (haftungsbeschränkt)",
      "company_seat": "München",
      "details": "10.02.2026 (Bekanntmachungsdatum)\n\nBayern Amtsgericht München HRB 281936\nRegisterbekanntmachung nach dem Umwandlungsgesetz 09.02.2026 (Eintragungsdatum)\n\nPNZ C23 Beteiligungs UG (haftungsbeschränkt)\nGesellschaft mit beschränkter Haftung\nMünchen\n\nDen Gläubigern der an der Verschmelzung beteiligten Rechtsträger ist, wenn sie binnen sechs Monaten nach dem Tag, an dem die Eintragung der Verschmelzung in das Register des Sitzes desjenigen Rechtsträgers, dessen Gläubiger sie sind, nach § 19 Abs. 3 UmwG als bekannt gemacht gilt, ihren Anspruch nach Grund und Höhe in Textform anmelden, Sicherheit zu leisten, soweit sie nicht Befriedigung verlangen können. Dieses Recht steht den Gläubigern jedoch nur zu, wenn sie glaubhaft machen, dass durch die Verschmelzung die Erfüllung ihrer Forderung gefährdet wird."
    },
    {
      "date": "2026-02-10",
      "id": "144689",
      "original_text": "Einreichung neuer Dokumente\nBayern Amtsgericht München HRB 176747\nWaterRise AG – München",
      "type": "Einreichung neuer Dokumente",
      "state": "Bayern",
      "amtsgericht": "Amtsgericht München",
      "registernummer": "HRB 176747",
      "registerart": "HRB",
      "company_name": "WaterRise AG",
      "company_seat": "München",
      "details": "10.02.2026 (Bekanntmachungsdatum)\n\nBayern Amtsgericht München HRB 176747\nEinreichung neuer Dokumente 09.02.2026 (Eintragungsdatum)\n\nWaterRise AG\nAktiengesellschaft\nMünchen\n\nDem Amtsgericht München -Registergericht- ist eine Liste der Mitglieder des Aufsichtsrats eingereicht worden, § 106 AktG."
    },
    {
      "date": "2026-02-10",
      "id": "144690",
      "original_text": "Löschungsankündigung\nBayern Amtsgericht Nürnberg HRB 32647\nHoier UG (haftungsbeschränkt) – Burgthann",
      "type": "Löschungsankündigung",
      "state": "Bayern",
      "amtsgericht": "Amtsgericht Nürnberg",
      "registernummer": "HRB 32647",
      "registerart": "HRB",
      "company_name": "Hoier UG (haftungsbeschränkt)",
      "company_seat": "Burgthann",
      "details": "10.02.2026 (Bekanntmachungsdatum)\n\nBayern Amtsgericht Nürnberg HRB 32647\nLöschungsankündigung\n\nHoier UG (haftungsbeschränkt)\nGesellschaft mit beschränkter Haftung\nBurgthann\n\nDas Registergericht beabsichtigt, die im Handelsregister eingetragene Gesellschaft wegen Vermögenslosigkeit von Amts wegen nach § 394 FamFG zu löschen. Die Frist zur Erhebung eines Widerspruchs ist auf einen Monat festgesetzt."
    },
    {
      "date": "2026-02-10",
      "id": "144691",
      "original_text": "Registerbekanntmachung nach dem Umwandlungsgesetz\nBayern Amtsgericht Landshut HRA 12958\nGruber Elektro- und Systemtechnik e.K. – Schalkham",
      "type": "Registerbekanntmachung nach dem Umwandlungsgesetz",
      "state": "Bayern",
      "amtsgericht": "Amtsgericht Landshut",
      "registernummer": "HRA 12958",
      "registerart": "HRA",
      "company_name": "Gruber Elektro- und Systemtechnik e.K.",
      "company_seat": "Schalkham",
      "details": "10.02.2026 (Bekanntmachungsdatum)\n\nBayern Amtsgericht Landshut HRA 12958\nRegisterbekanntmachung nach dem Umwandlungsgesetz 09.02.2026 (Eintragungsdatum)\n\nGruber Elektro- und Systemtechnik e.K.\nEinzelkaufmann / Einzelkauffrau\nSchalkham\n\nDen Gläubigern der an der Ausgliederung beteiligten Rechtsträger ist, wenn sie binnen sechs Monaten nach dem Tag, an dem die Eintragung der Ausgliederung in das Register des Sitzes desjenigen Rechtsträgers, dessen Gläubiger sie sind, nach §§ 125, 19 Abs. 3 UmwG als bekannt gemacht gilt, ihren Anspruch nach Grund und Höhe in Textform anmelden, Sicherheit zu leisten, soweit sie nicht Befriedigung verlangen können. Dieses Recht steht den Gläubigern jedoch nur zu, wenn sie glaubhaft machen, dass durch die Ausgliederung die Erfüllung ihrer Forderung gefährdet wird."
    },
    {
      "date": "2026-02-10",
      "id": "144692",
      "original_text": "Einreichung neuer Dokumente\nBayern Amtsgericht München HRB 181247\nAquantec AG – München",
      "type": "Einreichung neuer Dokumente",
      "state": "Bayern",
      "amtsgericht": "Amtsgericht München",
      "registernummer": "HRB 181247",
      "registerart": "HRB",
      "company_name": "Aquantec AG",
      "company_seat": "München",
      "details": "10.02.2026 (Bekanntmachungsdatum)\n\nBayern Amtsgericht München HRB 181247\nEinreichung neuer Dokumente 09.02.2026 (Eintragungsdatum)\n\nAquantec AG\nAktiengesellschaft\nMünchen\n\nDem Amtsgericht München -Registergericht- ist eine Liste der Mitglieder des Aufsichtsrats eingereicht worden, § 106 AktG."
    },
    {
      "date": "2026-02-10",
      "id": "144693",
      "original_text": "Registerbekanntmachung nach dem Umwandlungsgesetz\nBayern Amtsgericht Straubing VR 520\nAitrachschützen Sunzing - Leiblfing e.V. – Leiblfing",
      "type": "Registerbekanntmachung nach dem Umwandlungsgesetz",
      "state": "Bayern",
      "amtsgericht": "Amtsgericht Straubing",
      "registernummer": "VR 520",
      "registerart": "VR",
      "company_name": "Aitrachschützen Sunzing - Leiblfing e.V.",
      "company_seat": "Leiblfing",
      "details": "10.02.2026 (Bekanntmachungsdatum)\n\nBayern Amtsgericht Straubing VR 520\nRegisterbekanntmachung nach dem Umwandlungsgesetz 09.02.2026 (Eintragungsdatum)\n\nAitrachschützen Sunzing - Leiblfing e.V.\neingetragener Verein\nLeiblfing\n\nDen Gläubigern #dv.auswahl(Text=\"Bitte zutreffendes auswählen:\",Eingabe=\n\n\"der an der Verschmelzung beteiligten Rechtsträger ist, wenn sie binnen sechs Monaten nach dem Tag, an dem die Eintragung der Verschmelzung in das Register des Sitzes desjenigen Rechtsträgers, dessen Gläubiger sie sind, nach § 19 Abs. 3 UmwG als bekannt gemacht gilt, ihren Anspruch nach Grund und Höhe in Textform anmelden, Sicherheit zu leisten, soweit sie nicht Befriedigung verlangen können. Dieses Recht steht den Gläubigern jedoch nur zu, wenn sie glaubhaft machen, dass durch die Verschmelzung die Erfüllung ihrer Forderung gefährdet wird.\"|\"Verschmelzung\","
    },
    {
      "date": "2026-02-10",
      "id": "144694",
      "original_text": "Löschungsankündigung\nBayern Amtsgericht Bayreuth HRB 4791\nadapter4you GmbH – Bischofsgrün",
      "type": "Löschungsankündigung",
      "state": "Bayern",
      "amtsgericht": "Amtsgericht Bayreuth",
      "registernummer": "HRB 4791",
      "registerart": "HRB",
      "company_name": "adapter4you GmbH",
      "company_seat": "Bischofsgrün",
      "details": "10.02.2026 (Bekanntmachungsdatum)\n\nBayern Amtsgericht Bayreuth HRB 4791\nLöschungsankündigung\n\nadapter4you GmbH\nGesellschaft mit beschränkter Haftung\nBischofsgrün\n\nDas Registergericht beabsichtigt, die im Handelsregister eingetragene Gesellschaft wegen Vermögenslosigkeit von Amts wegen nach § 394 FamFG zu löschen. Die Frist zur Erhebung eines Widerspruchs ist auf einen Monat festgesetzt."
    },
    {
      "date": "2026-02-10",
      "id": "144695",
      "original_text": "Einreichung neuer Dokumente\nBayern Amtsgericht München HRB 274569\nLombardi Art Consulting AG – München",
      "type": "Einreichung neuer Dokumente",
      "state": "Bayern",
      "amtsgericht": "Amtsgericht München",
      "registernummer": "HRB 274569",
      "registerart": "HRB",
      "company_name": "Lombardi Art Consulting AG",
      "company_seat": "München",
      "details": "10.02.2026 (Bekanntmachungsdatum)\n\nBayern Amtsgericht München HRB 274569\nEinreichung neuer Dokumente\n\nLombardi Art Consulting AG\nAktiengesellschaft\nMünchen\n\nDem Amtsgericht München -Registergericht- ist eine Liste der Mitglieder des Aufsichtsrats eingereicht worden, § 106 AktG."
    },
    {
      "date": "2026-02-10",
      "id": "144696",
      "original_text": "Löschungsankündigung\nBayern Amtsgericht München HRB 116700\nKunstsalon Franke-Schenk GmbH – München",
      "type": "Löschungsankündigung",
      "state": "Bayern",
      "amtsgericht": "Amtsgericht München",
      "registernummer": "HRB 116700",
      "registerart": "HRB",
      "company_name": "Kunstsalon Franke-Schenk GmbH",
      "company_seat": "München",
      "details": "10.02.2026 (Bekanntmachungsdatum)\n\nBayern Amtsgericht München HRB 116700\nLöschungsankündigung 09.02.2026 (Eintragungsdatum)\n\nKunstsalon Franke-Schenk GmbH\nGesellschaft mit beschränkter Haftung\nMünchen\n\nDas Registergericht beabsichtigt, die im Handelsregister eingetragene Gesellschaft wegen Vermögenslosigkeit von Amts wegen nach § 394 FamFG zu löschen. Die Frist zur Erhebung eines Widerspruchs ist auf drei Monate festgesetzt."
    },
    {
      "date": "2026-02-10",
      "id": "144697",
      "original_text": "Löschungsankündigung\nBayern Amtsgericht München HRB 126377\nWertiBau 96 Kft. Budapest, Niederlassung Deutschland – Unterschleißheim",
      "type": "Löschungsankündigung",
      "state": "Bayern",
      "amtsgericht": "Amtsgericht München",
      "registernummer": "HRB 126377",
      "registerart": "HRB",
      "company_name": "WertiBau 96 Kft. Budapest, Niederlassung Deutschland",
      "company_seat": "Unterschleißheim",
      "details": "10.02.2026 (Bekanntmachungsdatum)\n\nBayern Amtsgericht München HRB 126377\nLöschungsankündigung\n\nWertiBau 96 Kft. Budapest, Niederlassung Deutschland\nRechtsform ausländischen Rechts HRB\nUnterschleißheim\n\nDas Registergericht beabsichtigt, die im Handelsregister eingetragene Gesellschaft wegen Vermögenslosigkeit von Amts wegen nach § 394 FamFG zu löschen. Die Frist zur Erhebung eines Widerspruchs ist auf drei Monate festgesetzt."
    },
    {
      "date": "2026-02-10",
      "id": "144698",
      "original_text": "Löschungsankündigung\nBayern Amtsgericht Augsburg HRB 38311\nVivadiva GmbH – Mering",
      "type": "Löschungsankündigung",
      "state": "Bayern",
      "amtsgericht": "Amtsgericht Augsburg",
      "registernummer": "HRB 38311",
      "registerart": "HRB",
      "company_name": "Vivadiva GmbH",
      "company_seat": "Mering",
      "details": "10.02.2026 (Bekanntmachungsdatum)\n\nBayern Amtsgericht Augsburg HRB 38311\nLöschungsankündigung\n\nVivadiva GmbH\nGesellschaft mit beschränkter Haftung\nMering\n\nDas Registergericht beabsichtigt, die im Handelsregister eingetragene Gesellschaft wegen Vermögenslosigkeit von Amts wegen nach § 394 FamFG zu löschen. Die Frist zur Erhebung eines Widerspruchs ist auf einen Monat festgesetzt."
    },
    {
      "date": "2026-02-10",
      "id": "144699",
      "original_text": "Registerbekanntmachung nach dem Umwandlungsgesetz\nBayern Amtsgericht München HRB 276385\nZenKenKan UG (haftungsbeschränkt) – München",
      "type": "Registerbekanntmachung nach dem Umwandlungsgesetz",
      "state": "Bayern",
      "amtsgericht": "Amtsgericht München",
      "registernummer": "HRB 276385",
      "registerart": "HRB",
      "company_name": "ZenKenKan UG (haftungsbeschränkt)",
      "company_seat": "München",
      "details": "10.02.2026 (Bekanntmachungsdatum)\n\nBayern Amtsgericht München HRB 276385\nRegisterbekanntmachung nach dem Umwandlungsgesetz 09.02.2026 (Eintragungsdatum)\n\nZenKenKan UG (haftungsbeschränkt)\nGesellschaft mit beschränkter Haftung\nMünchen\n\nDen Gläubigern der an der Verschmelzung beteiligten Rechtsträger ist, wenn sie binnen sechs Monaten nach dem Tag, an dem die Eintragung der Verschmelzung in das Register des Sitzes desjenigen Rechtsträgers, dessen Gläubiger sie sind, nach § 19 Abs. 3 UmwG als bekannt gemacht gilt, ihren Anspruch nach Grund und Höhe in Textform anmelden, Sicherheit zu leisten, soweit sie nicht Befriedigung verlangen können. Dieses Recht steht den Gläubigern jedoch nur zu, wenn sie glaubhaft machen, dass durch die Verschmelzung die Erfüllung ihrer Forderung gefährdet wird."
    },
    {
      "date": "2026-02-10",
      "id": "144700",
      "original_text": "Löschungsankündigung\nBayern Amtsgericht Bayreuth VR 236\nVerein Jugendhilfe e.V. – Bayreuth",
      "type": "Löschungsankündigung",
      "state": "Bayern",
      "amtsgericht": "Amtsgericht Bayreuth",
      "registernummer": "VR 236",
      "registerart": "VR",
      "company_name": "Verein Jugendhilfe e.V.",
      "company_seat": "Bayreuth",
      "details": "10.02.2026 (Bekanntmachungsdatum)\n\nBayern Amtsgericht Bayreuth VR 236\nLöschungsankündigung\n\nVerein Jugendhilfe e.V.\neingetragener Verein\nBayreuth\n\nDas Registergericht beabsichtigt, den im Vereinsregister eingetragenen Verein von Amts wegen nach § 395 FamFG wegen Wegfalls aller Mitglieder zu löschen. Die Frist zur Erhebung eines Widerspruchs ist auf sechs Wochen festgesetzt."
    },
    {
      "date": "2026-02-10",
      "id": "144701",
      "original_text": "Registerbekanntmachung nach dem Umwandlungsgesetz\nBayern Amtsgericht München HRB 299002\nGoldburg Holding GmbH – Gilching",
      "type": "Registerbekanntmachung nach dem Umwandlungsgesetz",
      "state": "Bayern",
      "amtsgericht": "Amtsgericht München",
      "registernummer": "HRB 299002",
      "registerart": "HRB",
      "company_name": "Goldburg Holding GmbH",
      "company_seat": "Gilching",
      "details": "10.02.2026 (Bekanntmachungsdatum)\n\nBayern Amtsgericht München HRB 299002\nRegisterbekanntmachung nach dem Umwandlungsgesetz 09.02.2026 (Eintragungsdatum)\n\nGoldburg Holding GmbH\nGesellschaft mit beschränkter Haftung\nGilching\n\nDen Gläubigern der an der Ausgliederung beteiligten Rechtsträger ist, wenn sie binnen sechs Monaten nach dem Tag, an dem die Eintragung der Ausgliederung in das Register des Sitzes desjenigen Rechtsträgers, dessen Gläubiger sie sind, nach §§ 125, 19 Abs. 3 UmwG als bekannt gemacht gilt, ihren Anspruch nach Grund und Höhe in Textform anmelden, Sicherheit zu leisten, soweit sie nicht Befriedigung verlangen können. Dieses Recht steht den Gläubigern jedoch nur zu, wenn sie glaubhaft machen, dass durch die Ausgliederung die Erfüllung ihrer Forderung gefährdet wird."
    },
    {
      "date": "2026-02-10",
      "id": "144702",
      "original_text": "Registerbekanntmachung nach dem Umwandlungsgesetz\nBayern Amtsgericht Fürth GsR 447\nexpectleads Rittmayer und Pfeiffer GmbH & Co. eGbR – Gutenstetten",
      "type": "Registerbekanntmachung nach dem Umwandlungsgesetz",
      "state": "Bayern",
      "amtsgericht": "Amtsgericht Fürth",
      "registernummer": "GsR 447",
      "registerart": "GsR",
      "company_name": "expectleads Rittmayer und Pfeiffer GmbH & Co. eGbR",
      "company_seat": "Gutenstetten",
      "details": "10.02.2026 (Bekanntmachungsdatum)\n\nBayern Amtsgericht Fürth GsR 447\nRegisterbekanntmachung nach dem Umwandlungsgesetz 09.02.2026 (Eintragungsdatum)\n\nexpectleads Rittmayer und Pfeiffer GmbH & Co. eGbR\nGesellschaft bürgerlichen Rechts\nGutenstetten\n\nDen Gläubigern des formwechselnden Rechtsträgers ist, wenn sie binnen sechs Monaten nach dem Tag, an dem die Eintragung des Formwechsels nach § 201 UmwG als bekannt gemacht gilt, ihren Anspruch nach Grund und Höhe in Textform anmelden, Sicherheit zu leisten, soweit sie nicht Befriedigung verlangen können. Dieses Recht steht den Gläubigern jedoch nur zu, wenn sie glaubhaft machen, dass durch den Formwechsel die Erfüllung ihrer Forderung gefährdet wird."
    },
    {
      "date": "2026-02-10",
      "id": "144703",
      "original_text": "Löschungsankündigung\nBayern Amtsgericht München HRB 256107\nHaus und Projektierungs UG (haftungsbeschränkt) – Sauerlach",
      "type": "Löschungsankündigung",
      "state": "Bayern",
      "amtsgericht": "Amtsgericht München",
      "registernummer": "HRB 256107",
      "registerart": "HRB",
      "company_name": "Haus und Projektierungs UG (haftungsbeschränkt)",
      "company_seat": "Sauerlach",
      "details": "10.02.2026 (Bekanntmachungsdatum)\n\nBayern Amtsgericht München HRB 256107\nLöschungsankündigung 09.02.2026 (Eintragungsdatum)\n\nHaus und Projektierungs UG (haftungsbeschränkt)\nGesellschaft mit beschränkter Haftung\nSauerlach\n\nDas Registergericht beabsichtigt, die im Handelsregister eingetragene Gesellschaft wegen Vermögenslosigkeit von Amts wegen nach § 394 FamFG zu löschen. Die Frist zur Erhebung eines Widerspruchs ist auf drei Monate festgesetzt."
    },
    {
      "date": "2026-02-10",
      "id": "144704",
      "original_text": "Registerbekanntmachung nach dem Umwandlungsgesetz\nBayern Amtsgericht München HRB 309532\nHaroro Immo GmbH – Aschheim",
      "type": "Registerbekanntmachung nach dem Umwandlungsgesetz",
      "state": "Bayern",
      "amtsgericht": "Amtsgericht München",
      "registernummer": "HRB 309532",
      "registerart": "HRB",
      "company_name": "Haroro Immo GmbH",
      "company_seat": "Aschheim",
      "details": "10.02.2026 (Bekanntmachungsdatum)\n\nBayern Amtsgericht München HRB 309532\nRegisterbekanntmachung nach dem Umwandlungsgesetz 09.02.2026 (Eintragungsdatum)\n\nHaroro Immo GmbH\nGesellschaft mit beschränkter Haftung\nAschheim\n\nDen Gläubigern des formwechselnden Rechtsträgers ist, wenn sie binnen sechs Monaten nach dem Tag, an dem die Eintragung des Formwechsels nach § 201 UmwG als bekannt gemacht gilt, ihren Anspruch nach Grund und Höhe in Textform anmelden, Sicherheit zu leisten, soweit sie nicht Befriedigung verlangen können. Dieses Recht steht den Gläubigern jedoch nur zu, wenn sie glaubhaft machen, dass durch den Formwechsel die Erfüllung ihrer Forderung gefährdet wird."
    },
    {
      "date": "2026-02-10",
      "id": "144705",
      "original_text": "Einreichung neuer Dokumente\nBrandenburg Amtsgericht Neuruppin HRB 10018\nPCK Raffinerie GmbH – Schwedt/Oder",
      "type": "Einreichung neuer Dokumente",
      "state": "Brandenburg",
      "amtsgericht": "Amtsgericht Neuruppin",
      "registernummer": "HRB 10018",
      "registerart": "HRB",
      "company_name": "PCK Raffinerie GmbH",
      "company_seat": "Schwedt/Oder",
      "details": "10.02.2026 (Bekanntmachungsdatum)\n\nBrandenburg Amtsgericht Neuruppin HRB 10018\nEinreichung neuer Dokumente\n\nPCK Raffinerie GmbH\nGesellschaft mit beschränkter Haftung\nSchwedt/Oder\n\nAls nicht eingetragen wird veröffentlicht: Eine Liste der Mitglieder des Aufsichtsrates wurde zum Handelsregister eingereicht."
    },
    {
      "date": "2026-02-10",
      "id": "144706",
      "original_text": "Registerbekanntmachung nach dem Umwandlungsgesetz\nBaden-Württemberg Amtsgericht Freiburg HRA 709065\nWindmuehle Lee OHG – Konstanz",
      "type": "Registerbekanntmachung nach dem Umwandlungsgesetz",
      "state": "Baden-Württemberg",
      "amtsgericht": "Amtsgericht Freiburg",
      "registernummer": "HRA 709065",
      "registerart": "HRA",
      "company_name": "Windmuehle Lee OHG",
      "company_seat": "Konstanz",
      "details": "10.02.2026 (Bekanntmachungsdatum)\n\nBaden-Württemberg Amtsgericht Freiburg HRA 709065\nRegisterbekanntmachung nach dem Umwandlungsgesetz 10.02.2026 (Eintragungsdatum)\n\nWindmuehle Lee OHG\nOffene Handelsgesellschaft\nKonstanz\n\nAls nicht eingetragen wird bekanntgemacht:\nDen Gläubigern der an der Ausgliederung beteiligten Rechtsträger ist, wenn sie binnen sechs Monaten nach dem Tag, an dem die Eintragung der Ausgliederung in das Register des Sitzes desjenigen Rechtsträgers, dessen Gläubiger sie sind, nach § 19 Abs. 3 UmwG als bekanntgemacht gilt, ihren Anspruch nach Grund und Höhe schriftlich anmelden, Sicherheit zu leisten, soweit sie nicht Befriedigung verlangen können. Dieses Recht steht den Gläubigern jedoch nur zu, wenn sie glaubhaft machen, dass durch die Ausgliederung die Erfüllung ihrer Forderung gefährdet wird."
    },
    {
      "date": "2026-02-10",
      "id": "144707",
      "original_text": "Löschungsankündigung\nBerlin Amtsgericht Berlin (Charlottenburg) HRB 196149\nTonsser UG (haftungsbeschränkt) – Berlin",
      "type": "Löschungsankündigung",
      "state": "Berlin",
      "amtsgericht": "Amtsgericht Berlin (Charlottenburg)",
      "registernummer": "HRB 196149",
      "registerart": "HRB",
      "company_name": "Tonsser UG (haftungsbeschränkt)",
      "company_seat": "Berlin",
      "details": "10.02.2026 (Bekanntmachungsdatum)\n\nBerlin Amtsgericht Berlin (Charlottenburg) HRB 196149\nLöschungsankündigung\n\nTonsser UG (haftungsbeschränkt)\nGesellschaft mit beschränkter Haftung\nBerlin\n\nBei der nachstehenden Gesellschaft wird das Amtslöschungsverfahren gemäß § 394 FamFG eingeleitet. Widerspruchsfrist 6 Wochen"
    },
    {
      "date": "2026-02-10",
      "id": "144708",
      "original_text": "Löschungsankündigung\nBerlin Amtsgericht Berlin (Charlottenburg) HRB 245897\nRM Industrie Service GmbH – Berlin",
      "type": "Löschungsankündigung",
      "state": "Berlin",
      "amtsgericht": "Amtsgericht Berlin (Charlottenburg)",
      "registernummer": "HRB 245897",
      "registerart": "HRB",
      "company_name": "RM Industrie Service GmbH",
      "company_seat": "Berlin",
      "details": "10.02.2026 (Bekanntmachungsdatum)\n\nBerlin Amtsgericht Berlin (Charlottenburg) HRB 245897\nLöschungsankündigung\n\nRM Industrie Service GmbH\nGesellschaft mit beschränkter Haftung\nBerlin\n\nBei der nachstehenden Gesellschaft wird das Amtslöschungsverfahren gemäß § 394 FamFG eingeleitet. Widerspruchsfrist 6 Wochen"
    },
    {
      "date": "2026-02-10",
      "id": "144709",
      "original_text": "Löschungsankündigung\nBerlin Amtsgericht Berlin (Charlottenburg) HRB 180729\nRapsodi GmbH – Berlin",
      "type": "Löschungsankündigung",
      "state": "Berlin",
      "amtsgericht": "Amtsgericht Berlin (Charlottenburg)",
      "registernummer": "HRB 180729",
      "registerart": "HRB",
      "company_name": "Rapsodi GmbH",
      "company_seat": "Berlin",
      "details": "10.02.2026 (Bekanntmachungsdatum)\n\nBerlin Amtsgericht Berlin (Charlottenburg) HRB 180729\nLöschungsankündigung\n\nRapsodi GmbH\nGesellschaft mit beschränkter Haftung\nBerlin\n\nBei der nachstehenden Gesellschaft wird das Amtslöschungsverfahren gemäß § 394 FamFG eingeleitet. Widerspruchsfrist 6 Wochen"
    },
    {
      "date": "2026-02-10",
      "id": "144710",
      "original_text": "Registerbekanntmachung nach dem Umwandlungsgesetz\nBaden-Württemberg Amtsgericht Stuttgart HRA 742827\nTotal-Tankstelle Oberndorf a.N. e.K. - Inh. Petra Buomann – Oberndorf am Neckar",
      "type": "Registerbekanntmachung nach dem Umwandlungsgesetz",
      "state": "Baden-Württemberg",
      "amtsgericht": "Amtsgericht Stuttgart",
      "registernummer": "HRA 742827",
      "registerart": "HRA",
      "company_name": "Total-Tankstelle Oberndorf a.N. e.K. - Inh. Petra Buomann",
      "company_seat": "Oberndorf am Neckar",
      "details": "10.02.2026 (Bekanntmachungsdatum)\n\nBaden-Württemberg Amtsgericht Stuttgart HRA 742827\nRegisterbekanntmachung nach dem Umwandlungsgesetz 10.02.2026 (Eintragungsdatum)\n\nTotal-Tankstelle Oberndorf a.N. e.K. - Inh. Petra Buomann\nEinzelkaufmann / Einzelkauffrau\nOberndorf am Neckar\n\nDen Gläubigern der an der Ausgliederung beteiligten Rechtsträger ist, wenn sie binnen sechs Monaten nach dem Tag, an dem die Eintragung der Ausgliederung in das Register des Sitzes desjenigen Rechtsträgers, dessen Gläubiger sie sind, nach § 19 Abs. 3 UmwG als bekanntgemacht gilt, ihren Anspruch nach Grund und Höhe schriftlich anmelden, Sicherheit zu leisten, soweit sie nicht Befriedigung verlangen können. Dieses Recht steht den Gläubigern jedoch nur zu, wenn sie glaubhaft machen, dass durch die Ausgliederung die Erfüllung ihrer Forderung gefährdet wird."
    },
    {
      "date": "2026-02-10",
      "id": "144711",
      "original_text": "Sonstige Registerbekanntmachung\nBerlin Amtsgericht Berlin (Charlottenburg) HRB 240101\n030 Knowledge & Networking GmbH – Berlin",
      "type": "Sonstige Registerbekanntmachung",
      "state": "Berlin",
      "amtsgericht": "Amtsgericht Berlin (Charlottenburg)",
      "registernummer": "HRB 240101",
      "registerart": "HRB",
      "company_name": "030 Knowledge & Networking GmbH",
      "company_seat": "Berlin",
      "details": "10.02.2026 (Bekanntmachungsdatum)\n\nBerlin Amtsgericht Berlin (Charlottenburg) HRB 240101\nSonstige Registerbekanntmachung\n\n030 Knowledge & Networking GmbH\nGesellschaft mit beschränkter Haftung\nBerlin\n\nAls nicht eingetragen wird veröffentlicht: Den Gläubigern der an der Verschmelzung beteiligten Rechtsträger ist, wenn sie binnen sechs Monaten nach dem Tag, an dem die Eintragung der Verschmelzung in das Register des Sitzes desjenigen Rechtsträgers, dessen Gläubiger sie sind, als bekannt gemacht gilt, ihren Anspruch nach Grund und Höhe schriftlich anmelden, Sicherheit zu leisten, soweit sie nicht Befriedigung verlangen können. Dieses Recht steht den Gläubigern jedoch nur zu, wenn sie glaubhaft machen, dass durch die Verschmelzung die Erfüllung ihrer Forderung gefährdet wird. Das Recht, Sicherheitsleistung zu verlangen, steht Gläubigern nicht zu, die im Falle der Insolvenz ein Recht auf vorzugsweise Befriedigung aus einer Deckungsmasse haben, die nach gesetzlicher Vorschrift zu ihrem Schutz errichtet und staatlich überwacht ist."
    },
    {
      "date": "2026-02-10",
      "id": "144712",
      "original_text": "Registerbekanntmachung nach dem Umwandlungsgesetz\nThüringen Amtsgericht Jena HRA 506396\nimmitec Energie PV GmbH & Co. KG – Weimar",
      "type": "Registerbekanntmachung nach dem Umwandlungsgesetz",
      "state": "Thüringen",
      "amtsgericht": "Amtsgericht Jena",
      "registernummer": "HRA 506396",
      "registerart": "HRA",
      "company_name": "immitec Energie PV GmbH & Co. KG",
      "company_seat": "Weimar",
      "details": "10.02.2026 (Bekanntmachungsdatum)\n\nThüringen Amtsgericht Jena HRA 506396\nRegisterbekanntmachung nach dem Umwandlungsgesetz 10.02.2026 (Eintragungsdatum)\n\nimmitec Energie PV GmbH & Co. KG\nKommanditgesellschaft\nWeimar\n\nNicht eingetragen: Den Gläubigern der an der Verschmelzung beteiligten Rechtsträger, ist wenn sie binnen sechs Monaten nach dem Tag, an dem die Eintragung der Verschmelzung in das Register des Sitzes desjenigen Rechtsträgers, dessen Gläubiger sie sind,  nach § 19 Abs. 3 UmwG als bekanntgemacht gilt, ihren Anspruch nach Grund und Höhe schriftlich anmelden, Sicherheit zu leisten, soweit sie nicht Befriedigung verlangen können. Dieses Recht steht ihnen jedoch nur zu, wenn sie glaubhaft machen, daß durch die Verschmelzung die Erfüllung ihrer Forderung gefährdet wird."
    },
    {
      "date": "2026-02-10",
      "id": "144713",
      "original_text": "Registerbekanntmachung nach dem Umwandlungsgesetz\nThüringen Amtsgericht Jena GsR 943\nRö28 Solarpark eGbR – Weimar",
      "type": "Registerbekanntmachung nach dem Umwandlungsgesetz",
      "state": "Thüringen",
      "amtsgericht": "Amtsgericht Jena",
      "registernummer": "GsR 943",
      "registerart": "GsR",
      "company_name": "Rö28 Solarpark eGbR",
      "company_seat": "Weimar",
      "details": "10.02.2026 (Bekanntmachungsdatum)\n\nThüringen Amtsgericht Jena GsR 943\nRegisterbekanntmachung nach dem Umwandlungsgesetz 10.02.2026 (Eintragungsdatum)\n\nRö28 Solarpark eGbR\nGesellschaft bürgerlichen Rechts\nWeimar\n\nNicht eingetragen: Den Gläubigern der an der Verschmelzung beteiligten Rechtsträger, ist wenn sie binnen sechs Monaten nach dem Tag, an dem die Eintragung der Verschmelzung in das Register des Sitzes desjenigen Rechtsträgers, dessen Gläubiger sie sind,  nach § 19 Abs. 3 UmwG als bekanntgemacht gilt, ihren Anspruch nach Grund und Höhe schriftlich anmelden, Sicherheit zu leisten, soweit sie nicht Befriedigung verlangen können. Dieses Recht steht ihnen jedoch nur zu, wenn sie glaubhaft machen, daß durch die Verschmelzung die Erfüllung ihrer Forderung gefährdet wird."
    },
    {
      "date": "2026-02-10",
      "id": "144714",
      "original_text": "Registerbekanntmachung nach dem Umwandlungsgesetz\nBaden-Württemberg Amtsgericht Freiburg HRA 709272\nBrugger Elektrotechnik GmbH & Co. KG – Villingen-Schwenningen",
      "type": "Registerbekanntmachung nach dem Umwandlungsgesetz",
      "state": "Baden-Württemberg",
      "amtsgericht": "Amtsgericht Freiburg",
      "registernummer": "HRA 709272",
      "registerart": "HRA",
      "company_name": "Brugger Elektrotechnik GmbH & Co. KG",
      "company_seat": "Villingen-Schwenningen",
      "details": "10.02.2026 (Bekanntmachungsdatum)\n\nBaden-Württemberg Amtsgericht Freiburg HRA 709272\nRegisterbekanntmachung nach dem Umwandlungsgesetz 10.02.2026 (Eintragungsdatum)\n\nBrugger Elektrotechnik GmbH & Co. KG\nKommanditgesellschaft\nVillingen-Schwenningen\n\nAls nicht eingetragen wird bekanntgemacht:\nDen Gläubigern der an der Ausgliederung beteiligten Rechtsträger ist, wenn sie binnen sechs Monaten nach dem Tag, an dem die Eintragung der Ausgliederung in das Register des Sitzes desjenigen Rechtsträgers, dessen Gläubiger sie sind, nach § 19 Abs. 3 UmwG als bekanntgemacht gilt, ihren Anspruch nach Grund und Höhe schriftlich anmelden, Sicherheit zu leisten, soweit sie nicht Befriedigung verlangen können. Dieses Recht steht den Gläubigern jedoch nur zu, wenn sie glaubhaft machen, dass durch die Ausgliederung die Erfüllung ihrer Forderung gefährdet wird."
    },
    {
      "date": "2026-02-10",
      "id": "144715",
      "original_text": "Einreichung neuer Dokumente\nSchleswig-Holstein Amtsgericht Lübeck HRB 227 BS\nMaritim Hotelgesellschaft mbH – Timmendorfer Strand",
      "type": "Einreichung neuer Dokumente",
      "state": "Schleswig-Holstein",
      "amtsgericht": "Amtsgericht Lübeck",
      "registernummer": "HRB 227 BS",
      "registerart": "HRB",
      "company_name": "Maritim Hotelgesellschaft mbH",
      "company_seat": "Timmendorfer Strand",
      "details": "10.02.2026 (Bekanntmachungsdatum)\n\nSchleswig-Holstein Amtsgericht Lübeck HRB 227 BS\nEinreichung neuer Dokumente\n\nMaritim Hotelgesellschaft mbH\nGesellschaft mit beschränkter Haftung\nTimmendorfer Strand\n\nAls nicht eingetragen wird veröffentlicht: Die Gesellschaft hat eine neue Liste der Aufsichtsratmitglieder mit Datum 02.02.2026 zum Handelsregister eingereicht."
    },
    {
      "date": "2026-02-10",
      "id": "144716",
      "original_text": "Löschungsankündigung\nBrandenburg Amtsgericht Potsdam HRB 26690\nM & C -Betriebe UG (haftungsbeschränkt) – Brandenburg an der Havel",
      "type": "Löschungsankündigung",
      "state": "Brandenburg",
      "amtsgericht": "Amtsgericht Potsdam",
      "registernummer": "HRB 26690",
      "registerart": "HRB",
      "company_name": "M & C -Betriebe UG (haftungsbeschränkt)",
      "company_seat": "Brandenburg an der Havel",
      "details": "10.02.2026 (Bekanntmachungsdatum)\n\nBrandenburg Amtsgericht Potsdam HRB 26690\nLöschungsankündigung\n\nM & C -Betriebe UG (haftungsbeschränkt)\nGesellschaft mit beschränkter Haftung\nBrandenburg an der Havel\n\nBei der nachstehenden Gesellschaft wird das Amtslöschungsverfahren gemäß § 394 FamFG eingeleitet. Widerspruchsfrist: 8 Wochen."
    },
    {
      "date": "2026-02-10",
      "id": "144717",
      "original_text": "Registerbekanntmachung nach dem Umwandlungsgesetz\nBaden-Württemberg Amtsgericht Freiburg HRA 709191\nBernhard Sütterlin Besitzfirma e. K. – Lörrach",
      "type": "Registerbekanntmachung nach dem Umwandlungsgesetz",
      "state": "Baden-Württemberg",
      "amtsgericht": "Amtsgericht Freiburg",
      "registernummer": "HRA 709191",
      "registerart": "HRA",
      "company_name": "Bernhard Sütterlin Besitzfirma e. K.",
      "company_seat": "Lörrach",
      "details": "10.02.2026 (Bekanntmachungsdatum)\n\nBaden-Württemberg Amtsgericht Freiburg HRA 709191\nRegisterbekanntmachung nach dem Umwandlungsgesetz 10.02.2026 (Eintragungsdatum)\n\nBernhard Sütterlin Besitzfirma e. K.\nEinzelkaufmann / Einzelkauffrau\nLörrach\n\nAls nicht eingetragen wird bekanntgemacht:\nDen Gläubigern der an der Ausgliederung beteiligten Rechtsträger ist, wenn sie binnen sechs Monaten nach dem Tag, an dem die Eintragung der Ausgliederung in das Register des Sitzes desjenigen Rechtsträgers, dessen Gläubiger sie sind, nach § 19 Abs. 3 UmwG als bekanntgemacht gilt, ihren Anspruch nach Grund und Höhe schriftlich anmelden, Sicherheit zu leisten, soweit sie nicht Befriedigung verlangen können. Dieses Recht steht den Gläubigern jedoch nur zu, wenn sie glaubhaft machen, dass durch die Ausgliederung die Erfüllung ihrer Forderung gefährdet wird."
    },
    {
      "date": "2026-02-10",
      "id": "144718",
      "original_text": "Löschungsankündigung\nSaarland Amtsgericht Saarbrücken HRB 19991\nANRO Anlagen- und Rohrleitungsbau GmbH – Dillingen",
      "type": "Löschungsankündigung",
      "state": "Saarland",
      "amtsgericht": "Amtsgericht Saarbrücken",
      "registernummer": "HRB 19991",
      "registerart": "HRB",
      "company_name": "ANRO Anlagen- und Rohrleitungsbau GmbH",
      "company_seat": "Dillingen",
      "details": "10.02.2026 (Bekanntmachungsdatum)\n\nSaarland Amtsgericht Saarbrücken HRB 19991\nLöschungsankündigung\n\nANRO Anlagen- und Rohrleitungsbau GmbH\nGesellschaft mit beschränkter Haftung\nDillingen\n\nEs ist beabsichtigt, die Gesellschaft von Amts wegen gemäß § 394 FamFG wegen Vermögenslosigkeit zu löschen.\nGegen die Löschung von Amts wegen ist das Rechtsmittel des Widerspruchs statthaft. Der Widerspruch ist binnen einer Frist von 1 Monat beginnend mit dem Tag dieser Veröffentlichung durch Einreichen eines Widerspruchsschreibens -schriftlich oder zur Niederschrift der Geschäftsstelle beim Amtsgericht Saarbrücken, -zentrales Handelsregister-, Mainzerstr.178, 66121 Saarbrücken einzulegen.\nDer Widerspruch muss die Bezeichnung der angefochtenen Löschungsankündigung enthalten sowie die Erklärung, dass Widerspruch eingelegt wird. Er ist vom Widerspruchsführer oder seinem Bevollmächtigten zu unterzeichnen.\nDas Widerspruchsschreiben kann auch in der Form eines elektronischen Dokumentes eingereicht werden, das mit einer qualifizierten elektronischen Signatur nach dem Signaturgesetz versehen sein muss (§§ 14 Abs. 2 FamFG, 130a, 298 ZPO)."
    },
    {
      "date": "2026-02-10",
      "id": "144719",
      "original_text": "Registerbekanntmachung nach dem Umwandlungsgesetz\nBaden-Württemberg Amtsgericht Freiburg HRA 709209\nSütterlin Besitz GmbH & Co. KG – Lörrach",
      "type": "Registerbekanntmachung nach dem Umwandlungsgesetz",
      "state": "Baden-Württemberg",
      "amtsgericht": "Amtsgericht Freiburg",
      "registernummer": "HRA 709209",
      "registerart": "HRA",
      "company_name": "Sütterlin Besitz GmbH & Co. KG",
      "company_seat": "Lörrach",
      "details": "10.02.2026 (Bekanntmachungsdatum)\n\nBaden-Württemberg Amtsgericht Freiburg HRA 709209\nRegisterbekanntmachung nach dem Umwandlungsgesetz 10.02.2026 (Eintragungsdatum)\n\nSütterlin Besitz GmbH & Co. KG\nKommanditgesellschaft\nLörrach\n\nAls nicht eingetragen wird bekanntgemacht:\nDen Gläubigern der an der Ausgliederung beteiligten Rechtsträger ist, wenn sie binnen sechs Monaten nach dem Tag, an dem die Eintragung der Ausgliederung in das Register des Sitzes desjenigen Rechtsträgers, dessen Gläubiger sie sind, nach § 19 Abs. 3 UmwG als bekanntgemacht gilt, ihren Anspruch nach Grund und Höhe schriftlich anmelden, Sicherheit zu leisten, soweit sie nicht Befriedigung verlangen können. Dieses Recht steht den Gläubigern jedoch nur zu, wenn sie glaubhaft machen, dass durch die Ausgliederung die Erfüllung ihrer Forderung gefährdet wird."
    },
    {
      "date": "2026-02-10",
      "id": "144720",
      "original_text": "Registerbekanntmachung nach dem Umwandlungsgesetz\nBerlin Amtsgericht Berlin (Charlottenburg) HRB 199673\nBSMV Liegenschaften GmbH – Berlin",
      "type": "Registerbekanntmachung nach dem Umwandlungsgesetz",
      "state": "Berlin",
      "amtsgericht": "Amtsgericht Berlin (Charlottenburg)",
      "registernummer": "HRB 199673",
      "registerart": "HRB",
      "company_name": "BSMV Liegenschaften GmbH",
      "company_seat": "Berlin",
      "details": "10.02.2026 (Bekanntmachungsdatum)\n\nBerlin Amtsgericht Berlin (Charlottenburg) HRB 199673\nRegisterbekanntmachung nach dem Umwandlungsgesetz 09.02.2026 (Eintragungsdatum)\n\nBSMV Liegenschaften GmbH\nGesellschaft mit beschränkter Haftung\nBerlin\n\nZu Eintragungsnummer 16 vom 09.02.2026 wird als nicht eingetragen veröffentlicht: Den Gläubigern der an der Verschmelzung beteiligten Rechtsträger ist, wenn sie binnen sechs Monaten nach dem Tag, an dem die Eintragung der Verschmelzung in das Register des Sitzes desjenigen Rechtsträgers, dessen Gläubiger sie sind, als bekannt gemacht gilt, ihren Anspruch nach Grund und Höhe schriftlich anmelden, Sicherheit zu leisten, soweit sie nicht Befriedigung verlangen können. Dieses Recht steht den Gläubigern jedoch nur zu, wenn sie glaubhaft machen, dass durch die Verschmelzung die Erfüllung ihrer Forderung gefährdet wird. Das Recht, Sicherheitsleistung zu verlangen, steht Gläubigern nicht zu, die im Falle der Insolvenz ein Recht auf vorzugsweise Befriedigung aus einer Deckungsmasse haben, die nach gesetzlicher Vorschrift zu ihrem Schutz errichtet und staatlich überwacht ist."
    },
    {
      "date": "2026-02-10",
      "id": "144721",
      "original_text": "Registerbekanntmachung nach dem Umwandlungsgesetz\nBerlin Amtsgericht Berlin (Charlottenburg) HRB 270081\nKS13 Liegenschaften GmbH – Berlin",
      "type": "Registerbekanntmachung nach dem Umwandlungsgesetz",
      "state": "Berlin",
      "amtsgericht": "Amtsgericht Berlin (Charlottenburg)",
      "registernummer": "HRB 270081",
      "registerart": "HRB",
      "company_name": "KS13 Liegenschaften GmbH",
      "company_seat": "Berlin",
      "details": "10.02.2026 (Bekanntmachungsdatum)\n\nBerlin Amtsgericht Berlin (Charlottenburg) HRB 270081\nRegisterbekanntmachung nach dem Umwandlungsgesetz 09.02.2026 (Eintragungsdatum)\n\nKS13 Liegenschaften GmbH\nGesellschaft mit beschränkter Haftung\nBerlin\n\nZu Eintragungsnummer 4 vom 09.02.2026 wird als nicht eingetragen veröffentlicht: Den Gläubigern der an der Verschmelzung beteiligten Rechtsträger ist, wenn sie binnen sechs Monaten nach dem Tag, an dem die Eintragung der Verschmelzung in das Register des Sitzes desjenigen Rechtsträgers, dessen Gläubiger sie sind, als bekannt gemacht gilt, ihren Anspruch nach Grund und Höhe schriftlich anmelden, Sicherheit zu leisten, soweit sie nicht Befriedigung verlangen können. Dieses Recht steht den Gläubigern jedoch nur zu, wenn sie glaubhaft machen, dass durch die Verschmelzung die Erfüllung ihrer Forderung gefährdet wird. Das Recht, Sicherheitsleistung zu verlangen, steht Gläubigern nicht zu, die im Falle der Insolvenz ein Recht auf vorzugsweise Befriedigung aus einer Deckungsmasse haben, die nach gesetzlicher Vorschrift zu ihrem Schutz errichtet und staatlich überwacht ist."
    },
    {
      "date": "2026-02-10",
      "id": "144722",
      "original_text": "Registerbekanntmachung nach dem Umwandlungsgesetz\nBaden-Württemberg Amtsgericht Stuttgart HRB 759404\nBachmann Americas GmbH – Stuttgart",
      "type": "Registerbekanntmachung nach dem Umwandlungsgesetz",
      "state": "Baden-Württemberg",
      "amtsgericht": "Amtsgericht Stuttgart",
      "registernummer": "HRB 759404",
      "registerart": "HRB",
      "company_name": "Bachmann Americas GmbH",
      "company_seat": "Stuttgart",
      "details": "10.02.2026 (Bekanntmachungsdatum)\n\nBaden-Württemberg Amtsgericht Stuttgart HRB 759404\nRegisterbekanntmachung nach dem Umwandlungsgesetz 10.02.2026 (Eintragungsdatum)\n\nBachmann Americas GmbH\nGesellschaft mit beschränkter Haftung\nStuttgart\n\nDen Gläubigern der an der Verschmelzung beteiligten Rechtsträger ist, wenn sie binnen sechs Monaten nach dem Tag, an dem die Eintragung der Verschmelzung in das Register des Sitzes desjenigen Rechtsträgers, dessen Gläubiger sie sind, nach § 19 Abs. 3 UmwG als bekanntgemacht gilt, ihren Anspruch nach Grund und Höhe schriftlich anmelden, Sicherheit zu leisten, soweit sie nicht Befriedigung verlangen können. Dieses Recht steht den Gläubigern jedoch nur zu, wenn sie glaubhaft machen, dass durch die Verschmelzung die Erfüllung ihrer Forderung gefährdet wird."
    },
    {
      "date": "2026-02-10",
      "id": "144723",
      "original_text": "Registerbekanntmachung nach dem Umwandlungsgesetz\nBaden-Württemberg Amtsgericht Stuttgart HRB 401196\nPulse Biomedical GmbH – Winterlingen",
      "type": "Registerbekanntmachung nach dem Umwandlungsgesetz",
      "state": "Baden-Württemberg",
      "amtsgericht": "Amtsgericht Stuttgart",
      "registernummer": "HRB 401196",
      "registerart": "HRB",
      "company_name": "Pulse Biomedical GmbH",
      "company_seat": "Winterlingen",
      "details": "10.02.2026 (Bekanntmachungsdatum)\n\nBaden-Württemberg Amtsgericht Stuttgart HRB 401196\nRegisterbekanntmachung nach dem Umwandlungsgesetz 10.02.2026 (Eintragungsdatum)\n\nPulse Biomedical GmbH\nGesellschaft mit beschränkter Haftung\nWinterlingen\n\nAls nicht eingetragen wird bekanntgemacht:\nDen Gläubigern der an der Verschmelzung beteiligten Rechtsträger ist, wenn sie binnen sechs Monaten nach dem Tag, an dem die Eintragung der Verschmelzung in das Register des Sitzes desjenigen Rechtsträgers, dessen Gläubiger sie sind, nach § 19 Abs. 3 UmwG als bekanntgemacht gilt, ihren Anspruch nach Grund und Höhe schriftlich anmelden, Sicherheit zu leisten, soweit sie nicht Befriedigung verlangen können. Dieses Recht steht den Gläubigern jedoch nur zu, wenn sie glaubhaft machen, dass durch die Verschmelzung die Erfüllung ihrer Forderung gefährdet wird."
    },
    {
      "date": "2026-02-10",
      "id": "144724",
      "original_text": "Löschungsankündigung\nBaden-Württemberg Amtsgericht Mannheim HRB 520222\nJohannes Rebel GmbH – Durmersheim",
      "type": "Löschungsankündigung",
      "state": "Baden-Württemberg",
      "amtsgericht": "Amtsgericht Mannheim",
      "registernummer": "HRB 520222",
      "registerart": "HRB",
      "company_name": "Johannes Rebel GmbH",
      "company_seat": "Durmersheim",
      "details": "10.02.2026 (Bekanntmachungsdatum)\n\nBaden-Württemberg Amtsgericht Mannheim HRB 520222\nLöschungsankündigung 10.02.2026 (Eintragungsdatum)\n\nJohannes Rebel GmbH\nGesellschaft mit beschränkter Haftung\nDurmersheim\n\nDas Gericht beabsichtigt, die Gesellschaft wegen Vermögenslosigkeit im Handelsregister von Amts wegen nach § 394 FamFG zu löschen. Die Frist zur Geltendmachung eines Widerspruchs gegen die beabsichtigte Löschung ist auf einen Monat ab Veröffentlichung bestimmt."
    },
    {
      "date": "2026-02-10",
      "id": "144725",
      "original_text": "Löschungsankündigung\nSchleswig-Holstein Amtsgericht Lübeck HRB 24573\nJohn Bau UG (haftungsbeschränkt) – Barsbüttel",
      "type": "Löschungsankündigung",
      "state": "Schleswig-Holstein",
      "amtsgericht": "Amtsgericht Lübeck",
      "registernummer": "HRB 24573",
      "registerart": "HRB",
      "company_name": "John Bau UG (haftungsbeschränkt)",
      "company_seat": "Barsbüttel",
      "details": "10.02.2026 (Bekanntmachungsdatum)\n\nSchleswig-Holstein Amtsgericht Lübeck HRB 24573\nLöschungsankündigung\n\nJohn Bau UG (haftungsbeschränkt)\nGesellschaft mit beschränkter Haftung\nBarsbüttel\n\nAn Herrn Wojciech Marek Piwinski\n-per Veröffentlichung -\n\nSehr geehrter Herr Wojciech Marek Piwinski,\n\nin der Handelsregistersache der\nJohn Bau UG (haftungsbeschränkt)\n\nergeben sich aus den mir vorliegenden Unterlagen Anhaltspunkte dafür, dass die Gesellschaft, als deren Geschäftsführer Sie noch eingetragen sind, vermögenslos ist:\n\nSchreiben der AOK Rheinland/Hamburg-Die Gesundheitskasse vom 07.08.2025, Schreiben des Finanzamtes Stormarn vom 27.08.2025. Zudem ist die Gesellschaft unter der eingetragenen Geschäftsanschrift nicht mehr zu erreichen.\n\nIch beabsichtige daher, die Gesellschaft wegen Vermögenslosigkeit gemäß § 394 FamFG zu löschen.\n\nIch bestimme eine Frist von einem Monat zur Geltendmachung eines Widerspruchs gegen die Löschung, § 394 Abs. 2 S. 1 FamFG.\n\nWeiter bitte ich Sie, mir binnen derselben Frist mitzuteilen, ob die genannte Gesellschaft noch Vermögen hat, ggf. welche Vermögensgegenstände sie besitzt, ob die Gesellschaft noch Partei eines noch nicht rechtskräftig abgeschlossenen Rechtsstreits ist oder ob sonst noch eine Abwicklung stattfindet.\n\nNach Fristablauf ohne Widerspruch von Ihnen oder anderer Seite wird die Gesellschaft gelöscht.\n\nMit freundlichen Grüßen\n\nSteder\nDipl.-Rechtspflegerin (FH)"
    },
    {
      "date": "2026-02-10",
      "id": "144726",
      "original_text": "Löschungsankündigung\nBerlin Amtsgericht Berlin (Charlottenburg) HRB 147296\nDK Global Spare Parts Enterprise GmbH – Berlin",
      "type": "Löschungsankündigung",
      "state": "Berlin",
      "amtsgericht": "Amtsgericht Berlin (Charlottenburg)",
      "registernummer": "HRB 147296",
      "registerart": "HRB",
      "company_name": "DK Global Spare Parts Enterprise GmbH",
      "company_seat": "Berlin",
      "details": "10.02.2026 (Bekanntmachungsdatum)\n\nBerlin Amtsgericht Berlin (Charlottenburg) HRB 147296\nLöschungsankündigung\n\nDK Global Spare Parts Enterprise GmbH\nGesellschaft mit beschränkter Haftung\nBerlin\n\nBei der nachstehenden Gesellschaft wird das Amtslöschungsverfahren gemäß § 394 FamFG eingeleitet. Widerspruchsfrist 6 Wochen"
    },
    {
      "date": "2026-02-10",
      "id": "144727",
      "original_text": "Registerbekanntmachung nach dem Umwandlungsgesetz\nMecklenburg-Vorpommern Amtsgericht Stralsund HRB 7094\nLDG-Landwirtschaftliche Dienstleistungen GmbH – Süderholz",
      "type": "Registerbekanntmachung nach dem Umwandlungsgesetz",
      "state": "Mecklenburg-Vorpommern",
      "amtsgericht": "Amtsgericht Stralsund",
      "registernummer": "HRB 7094",
      "registerart": "HRB",
      "company_name": "LDG-Landwirtschaftliche Dienstleistungen GmbH",
      "company_seat": "Süderholz",
      "details": "10.02.2026 (Bekanntmachungsdatum)\n\nMecklenburg-Vorpommern Amtsgericht Stralsund HRB 7094\nRegisterbekanntmachung nach dem Umwandlungsgesetz 10.02.2026 (Eintragungsdatum)\n\nLDG-Landwirtschaftliche Dienstleistungen GmbH\nGesellschaft mit beschränkter Haftung\nSüderholz\n\nAls nicht eingetragen wird veröffentlicht: Den Gläubigern der an der Verschmelzung beteiligten Rechtsträger ist, wenn sie binnen sechs Monaten nach dem Tag, an dem die Eintragung der Verschmelzung in das Register des Sitzes desjenigen Rechtsträgers, dessen Gläubiger sie sind, nach § 19 Abs. 3 UmwG als bekannt gemacht gilt,\nihren Anspruch nach Grund und Höhe in Textform anmelden, Sicherheit zu leisten, soweit sie nicht Befriedigung verlangen können. Dieses Recht steht den Gläubigern jedoch nur zu, wenn sie glaubhaft machen, dass durch die Verschmelzung die Erfüllung der Forderung gefährdet wird."
    },
    {
      "date": "2026-02-10",
      "id": "144728",
      "original_text": "Registerbekanntmachung nach dem Umwandlungsgesetz\nMecklenburg-Vorpommern Amtsgericht Stralsund HRB 300 früher Amtsgericht Rostock\nAgrargesellschaft Kandelin GmbH – Kandelin",
      "type": "Registerbekanntmachung nach dem Umwandlungsgesetz",
      "state": "Mecklenburg-Vorpommern",
      "amtsgericht": "Amtsgericht Stralsund",
      "registernummer": "HRB 300",
      "registerart": "HRB",
      "company_name": "Agrargesellschaft Kandelin GmbH",
      "company_seat": "Kandelin",
      "former_amtsgericht": "Rostock",
      "details": "10.02.2026 (Bekanntmachungsdatum)\n\nMecklenburg-Vorpommern Amtsgericht Stralsund HRB 300 früher Amtsgericht Rostock\nRegisterbekanntmachung nach dem Umwandlungsgesetz 10.02.2026 (Eintragungsdatum)\n\nAgrargesellschaft Kandelin GmbH\nGesellschaft mit beschränkter Haftung\nKandelin\n\nAls nicht eingetragen wird veröffentlicht: Den Gläubigern der an der Verschmelzung beteiligten Rechtsträger ist, wenn sie binnen sechs Monaten nach dem Tag, an dem die Eintragung der Verschmelzung in das Register des Sitzes desjenigen Rechtsträgers, dessen Gläubiger sie sind, nach § 19 Abs. 3 UmwG als bekannt gemacht gilt,\nihren Anspruch nach Grund und Höhe in Textform anmelden, Sicherheit zu leisten, soweit sie nicht Befriedigung verlangen können. Dieses Recht steht den Gläubigern jedoch nur zu, wenn sie glaubhaft machen, dass durch die Verschmelzung die Erfüllung der Forderung gefährdet wird."
    },
    {
      "date": "2026-02-10",
      "id": "144729",
      "original_text": "Registerbekanntmachung nach dem Umwandlungsgesetz\nBerlin Amtsgericht Berlin (Charlottenburg) HRB 251305\nHeimvorteil Berlin GmbH – Berlin",
      "type": "Registerbekanntmachung nach dem Umwandlungsgesetz",
      "state": "Berlin",
      "amtsgericht": "Amtsgericht Berlin (Charlottenburg)",
      "registernummer": "HRB 251305",
      "registerart": "HRB",
      "company_name": "Heimvorteil Berlin GmbH",
      "company_seat": "Berlin",
      "details": "10.02.2026 (Bekanntmachungsdatum)\n\nBerlin Amtsgericht Berlin (Charlottenburg) HRB 251305\nRegisterbekanntmachung nach dem Umwandlungsgesetz 09.02.2026 (Eintragungsdatum)\n\nHeimvorteil Berlin GmbH\nGesellschaft mit beschränkter Haftung\nBerlin\n\nZu Eintragungsnummer 3 vom 09.02.2026 wird als nicht eingetragen veröffentlicht: Den Gläubigern der an der Verschmelzung beteiligten Rechtsträger ist, wenn sie binnen sechs Monaten nach dem Tag, an dem die Eintragung der Verschmelzung in das Register des Sitzes desjenigen Rechtsträgers, dessen Gläubiger sie sind, als bekannt gemacht gilt, ihren Anspruch nach Grund und Höhe schriftlich anmelden, Sicherheit zu leisten, soweit sie nicht Befriedigung verlangen können. Dieses Recht steht den Gläubigern jedoch nur zu, wenn sie glaubhaft machen, dass durch die Verschmelzung die Erfüllung ihrer Forderung gefährdet wird. Das Recht, Sicherheitsleistung zu verlangen, steht Gläubigern nicht zu, die im Falle der Insolvenz ein Recht auf vorzugsweise Befriedigung aus einer Deckungsmasse haben, die nach gesetzlicher Vorschrift zu ihrem Schutz errichtet und staatlich überwacht ist."
    },
    {
      "date": "2026-02-10",
      "id": "144730",
      "original_text": "Einreichung neuer Dokumente\nBaden-Württemberg Amtsgericht Stuttgart HRB 106469\nErschließungsgesellschaft Gewerbegebiet Weinsberg-Ellhofen GmbH – Weinsberg",
      "type": "Einreichung neuer Dokumente",
      "state": "Baden-Württemberg",
      "amtsgericht": "Amtsgericht Stuttgart",
      "registernummer": "HRB 106469",
      "registerart": "HRB",
      "company_name": "Erschließungsgesellschaft Gewerbegebiet Weinsberg-Ellhofen GmbH",
      "company_seat": "Weinsberg",
      "details": "10.02.2026 (Bekanntmachungsdatum)\n\nBaden-Württemberg Amtsgericht Stuttgart HRB 106469\nEinreichung neuer Dokumente\n\nErschließungsgesellschaft Gewerbegebiet Weinsberg-Ellhofen GmbH\nGesellschaft mit beschränkter Haftung\nWeinsberg\n\nDie Gesellschaft hat am 10.02.2026 die Liste über die Zusammensetzung des Aufsichtsrats zum Handelsregister eingereicht."
    },
    {
      "date": "2026-02-10",
      "id": "144731",
      "original_text": "Einreichung neuer Dokumente\nBrandenburg Amtsgericht Frankfurt/Oder HRB 4825\nMesse und Veranstaltungs GmbH Frankfurt (Oder) – Frankfurt (Oder)",
      "type": "Einreichung neuer Dokumente",
      "state": "Brandenburg",
      "amtsgericht": "Amtsgericht Frankfurt/Oder",
      "registernummer": "HRB 4825",
      "registerart": "HRB",
      "company_name": "Messe und Veranstaltungs GmbH Frankfurt (Oder)",
      "company_seat": "Frankfurt (Oder)",
      "details": "10.02.2026 (Bekanntmachungsdatum)\n\nBrandenburg Amtsgericht Frankfurt/Oder HRB 4825\nEinreichung neuer Dokumente 06.02.2026 (Eintragungsdatum)\n\nMesse und Veranstaltungs GmbH Frankfurt (Oder)\nGesellschaft mit beschränkter Haftung\nFrankfurt (Oder)\n\nAls nicht eingetragen wird veröffentlicht: Die Gesellschaft hat Änderungen im Aufsichtsrat angezeigt. § 104 AktG"
    },
    {
      "date": "2026-02-10",
      "id": "144732",
      "original_text": "Einreichung neuer Dokumente\nBaden-Württemberg Amtsgericht Freiburg HRB 411223\nLaguna Freizeitanlagen- und Stadthallenbetriebsgesellschaft mbH – Weil am Rhein",
      "type": "Einreichung neuer Dokumente",
      "state": "Baden-Württemberg",
      "amtsgericht": "Amtsgericht Freiburg",
      "registernummer": "HRB 411223",
      "registerart": "HRB",
      "company_name": "Laguna Freizeitanlagen- und Stadthallenbetriebsgesellschaft mbH",
      "company_seat": "Weil am Rhein",
      "details": "10.02.2026 (Bekanntmachungsdatum)\n\nBaden-Württemberg Amtsgericht Freiburg HRB 411223\nEinreichung neuer Dokumente\n\nLaguna Freizeitanlagen- und Stadthallenbetriebsgesellschaft mbH\nGesellschaft mit beschränkter Haftung\nWeil am Rhein\n\nDie Gesellschaft hat am 09.02.2026 die Liste über die Zusammensetzung des Aufsichtsrats zum Handelsregister eingereicht."
    },
    {
      "date": "2026-02-10",
      "id": "144733",
      "original_text": "Löschungsankündigung\nSachsen Amtsgericht Chemnitz HRB 32014\nNoodle Station UG (haftungsbeschränkt) – Breitenbrunn/Erzgeb.",
      "type": "Löschungsankündigung",
      "state": "Sachsen",
      "amtsgericht": "Amtsgericht Chemnitz",
      "registernummer": "HRB 32014",
      "registerart": "HRB",
      "company_name": "Noodle Station UG (haftungsbeschränkt)",
      "company_seat": "Breitenbrunn/Erzgeb.",
      "details": "10.02.2026 (Bekanntmachungsdatum)\n\nSachsen Amtsgericht Chemnitz HRB 32014\nLöschungsankündigung 10.02.0206 (Eintragungsdatum)\n\nNoodle Station UG (haftungsbeschränkt)\nGesellschaft mit beschränkter Haftung\nBreitenbrunn/Erzgeb.\n\nDas Registergericht beabsichtigt, die im Handelsregister eingetragene Gesellschaft von Amts wegen nach § 394 FamFG zu löschen. Die Frist zu Erhebung eines Widerspruchs gegen die beabsichtigte Löschung wird auf einen Monat festgesetzt."
    },
    {
      "date": "2026-02-10",
      "id": "144734",
      "original_text": "Löschungsankündigung\nSachsen Amtsgericht Chemnitz HRB 32014\nNoodle Station UG (haftungsbeschränkt) – Breitenbrunn/Erzgeb.",
      "type": "Löschungsankündigung",
      "state": "Sachsen",
      "amtsgericht": "Amtsgericht Chemnitz",
      "registernummer": "HRB 32014",
      "registerart": "HRB",
      "company_name": "Noodle Station UG (haftungsbeschränkt)",
      "company_seat": "Breitenbrunn/Erzgeb.",
      "details": "10.02.2026 (Bekanntmachungsdatum)\n\nSachsen Amtsgericht Chemnitz HRB 32014\nLöschungsankündigung 10.02.2026 (Eintragungsdatum)\n\nNoodle Station UG (haftungsbeschränkt)\nGesellschaft mit beschränkter Haftung\nBreitenbrunn/Erzgeb.\n\nDas Registergericht beabsichtigt, die im Handelsregister eingetragene Gesellschaft von Amts wegen nach § 394 FamFG zu löschen. Die Frist zu Erhebung eines Widerspruchs gegen die beabsichtigte Löschung wird auf einen Monat festgesetzt."
    },
    {
      "date": "2026-02-10",
      "id": "144735",
      "original_text": "Sonstige Registerbekanntmachung\nSachsen Amtsgericht Leipzig HRB 22014\nONTRAS Gastransport GmbH – Leipzig",
      "type": "Sonstige Registerbekanntmachung",
      "state": "Sachsen",
      "amtsgericht": "Amtsgericht Leipzig",
      "registernummer": "HRB 22014",
      "registerart": "HRB",
      "company_name": "ONTRAS Gastransport GmbH",
      "company_seat": "Leipzig",
      "details": "10.02.2026 (Bekanntmachungsdatum)\n\nSachsen Amtsgericht Leipzig HRB 22014\nSonstige Registerbekanntmachung\n\nONTRAS Gastransport GmbH\nGesellschaft mit beschränkter Haftung\nLeipzig\n\nAm 06.02.2026 wurde beim Handelsregister des Amtsgerichts Leipzig die Liste der Mitglieder des Aufsichtsrats gemäß § 52 GmbHG eingereicht."
    },
    {
      "date": "2026-02-10",
      "id": "144736",
      "original_text": "Sonstige Registerbekanntmachung\nBaden-Württemberg Amtsgericht Ulm HRB 745906\nTeamViewer SE – Göppingen",
      "type": "Sonstige Registerbekanntmachung",
      "state": "Baden-Württemberg",
      "amtsgericht": "Amtsgericht Ulm",
      "registernummer": "HRB 745906",
      "registerart": "HRB",
      "company_name": "TeamViewer SE",
      "company_seat": "Göppingen",
      "details": "10.02.2026 (Bekanntmachungsdatum)\n\nBaden-Württemberg Amtsgericht Ulm HRB 745906\nSonstige Registerbekanntmachung 10.02.2026 (Eintragungsdatum)\n\nTeamViewer SE\nEuropäische Aktiengesellschaft (SE)\nGöppingen\n\nAls nicht eingetragen wird bekanntgemacht:\nDen Gläubigern, deren Forderungen begründet worden sind, bevor die Eintragung des Beschlusses bekanntgemacht worden ist, ist, wenn sie sich binnen sechs Monaten nach der Bekanntmachung zu diesem Zweck melden, Sicherheit zu leisten, soweit sie nicht Befriedigung verlangen können."
    },
    {
      "date": "2026-02-10",
      "id": "144737",
      "original_text": "Löschungsankündigung\nNiedersachsen Amtsgericht Osnabrück HRB 210568\nThomasLloyd Cleantech Infrastructure Holding GmbH – Langen",
      "type": "Löschungsankündigung",
      "state": "Niedersachsen",
      "amtsgericht": "Amtsgericht Osnabrück",
      "registernummer": "HRB 210568",
      "registerart": "HRB",
      "company_name": "ThomasLloyd Cleantech Infrastructure Holding GmbH",
      "company_seat": "Langen",
      "details": "10.02.2026 (Bekanntmachungsdatum)\n\nNiedersachsen Amtsgericht Osnabrück HRB 210568\nLöschungsankündigung\n\nThomasLloyd Cleantech Infrastructure Holding GmbH\nGesellschaft mit beschränkter Haftung\nLangen\n\nDas Registergericht beabsichtigt, die Eintragung zur laufenden Nr. 5 des chronologischen Registerblattes vom 24.06.2024 von Amts wegen nach § 395 FamFG zu löschen. Die Frist zur Erhebung eines Widerspruchs ist auf 1 Monat ab dieser Registerbekanntmachung festgesetzt."
    },
    {
      "date": "2026-02-10",
      "id": "144738",
      "original_text": "Registerbekanntmachung nach dem Umwandlungsgesetz\nNiedersachsen Amtsgericht Tostedt VR 150028\nFischereiverein Selsingen e.V. von 1951 – Selsingen",
      "type": "Registerbekanntmachung nach dem Umwandlungsgesetz",
      "state": "Niedersachsen",
      "amtsgericht": "Amtsgericht Tostedt",
      "registernummer": "VR 150028",
      "registerart": "VR",
      "company_name": "Fischereiverein Selsingen e.V. von 1951",
      "company_seat": "Selsingen",
      "details": "10.02.2026 (Bekanntmachungsdatum)\n\nNiedersachsen Amtsgericht Tostedt VR 150028\nRegisterbekanntmachung nach dem Umwandlungsgesetz 10.02.2026 (Eintragungsdatum)\n\nFischereiverein Selsingen e.V. von 1951\neingetragener Verein\nSelsingen\n\nDen Gläubigern der an der Verschmelzung beteiligten Rechtsträger ist, wenn sie binnen sechs Monaten nach dem Tag, an dem die Eintragung der Verschmelzung in das Register des Sitzes desjenigen Rechtsträgers, dessen Gläubiger sie sind, nach § 19  Abs.  3 UmwG als bekannt gemacht gilt, ihren Anspruch nach Grund und Höhe schriftlich anmelden, Sicherheit zu leisten, soweit sie nicht Befriedigung verlangen können. Dieses Recht steht den Gläubigern jedoch nur zu, wenn sie glaubhaft machen, dass durch die Verschmelzung die Erfüllung der Forderung gefährdet wird."
    },
    {
      "date": "2026-02-10",
      "id": "144739",
      "original_text": "Registerbekanntmachung nach dem Umwandlungsgesetz\nNiedersachsen Amtsgericht Tostedt VR 150138\nAngelsportverein Sandbostel e.V. – Sandbostel",
      "type": "Registerbekanntmachung nach dem Umwandlungsgesetz",
      "state": "Niedersachsen",
      "amtsgericht": "Amtsgericht Tostedt",
      "registernummer": "VR 150138",
      "registerart": "VR",
      "company_name": "Angelsportverein Sandbostel e.V.",
      "company_seat": "Sandbostel",
      "details": "10.02.2026 (Bekanntmachungsdatum)\n\nNiedersachsen Amtsgericht Tostedt VR 150138\nRegisterbekanntmachung nach dem Umwandlungsgesetz 10.02.2026 (Eintragungsdatum)\n\nAngelsportverein Sandbostel e.V.\neingetragener Verein\nSandbostel\n\nDen Gläubigern der an der Verschmelzung beteiligten Rechtsträger ist, wenn sie binnen sechs Monaten nach dem Tag, an dem die Eintragung der Verschmelzung in das Register des Sitzes desjenigen Rechtsträgers, dessen Gläubiger sie sind, nach § 19  Abs.  3 UmwG als bekannt gemacht gilt, ihren Anspruch nach Grund und Höhe schriftlich anmelden, Sicherheit zu leisten, soweit sie nicht Befriedigung verlangen können. Dieses Recht steht den Gläubigern jedoch nur zu, wenn sie glaubhaft machen, dass durch die Verschmelzung die Erfüllung der Forderung gefährdet wird."
    },
    {
      "date": "2026-02-10",
      "id": "144740",
      "original_text": "Löschungsankündigung\nNiedersachsen Amtsgericht Oldenburg (Oldenburg) HRB 208787\nKlarmann Bau GmbH – Wiefelstede",
      "type": "Löschungsankündigung",
      "state": "Niedersachsen",
      "amtsgericht": "Amtsgericht Oldenburg (Oldenburg)",
      "registernummer": "HRB 208787",
      "registerart": "HRB",
      "company_name": "Klarmann Bau GmbH",
      "company_seat": "Wiefelstede",
      "details": "10.02.2026 (Bekanntmachungsdatum)\n\nNiedersachsen Amtsgericht Oldenburg (Oldenburg) HRB 208787\nLöschungsankündigung\n\nKlarmann Bau GmbH\nGesellschaft mit beschränkter Haftung\nWiefelstede\n\nDas Registergericht beabsichtigt, die Gesellschaft von Amts wegen nach § 394 FamFG zu löschen. Die Frist zur Erhebung eines Widerspruchs ist auf 1 Monat ab dieser Registerbekanntmachung festgesetzt."
    },
    {
      "date": "2026-02-10",
      "id": "144741",
      "original_text": "Registerbekanntmachung nach dem Umwandlungsgesetz\nNiedersachsen Amtsgericht Hannover PR 119\nGarbe & Flügge Steuerberatungsgesellschaft Partnerschaft mbB – Hannover",
      "type": "Registerbekanntmachung nach dem Umwandlungsgesetz",
      "state": "Niedersachsen",
      "amtsgericht": "Amtsgericht Hannover",
      "registernummer": "PR 119",
      "registerart": "PR",
      "company_name": "Garbe & Flügge Steuerberatungsgesellschaft Partnerschaft mbB",
      "company_seat": "Hannover",
      "details": "10.02.2026 (Bekanntmachungsdatum)\n\nNiedersachsen Amtsgericht Hannover PR 119\nRegisterbekanntmachung nach dem Umwandlungsgesetz 10.02.2026 (Eintragungsdatum)\n\nGarbe & Flügge Steuerberatungsgesellschaft Partnerschaft mbB\nPartnerschaftsgesellschaft\nHannover\n\nDen Gläubigern der an der Verschmelzung beteiligten Rechtsträger ist, wenn sie binnen sechs Monaten nach dem Tag, an dem die Eintragung der Verschmelzung in das Register des Sitzes desjenigen Rechtsträgers, dessen Gläubiger sie sind, nach § 19  Abs.  3 UmwG als bekannt gemacht gilt, ihren Anspruch nach Grund und Höhe schriftlich anmelden, Sicherheit zu leisten, soweit sie nicht Befriedigung verlangen können. Dieses Recht steht den Gläubigern jedoch nur zu, wenn sie glaubhaft machen, dass durch die Verschmelzung die Erfüllung der Forderung gefährdet wird."
    },
    {
      "date": "2026-02-10",
      "id": "144742",
      "original_text": "Registerbekanntmachung nach dem Umwandlungsgesetz\nNiedersachsen Amtsgericht Hannover PR 200035\nHübner & Bayer Partnerschaft Steuerberatungsgesellschaft mbB – Hannover",
      "type": "Registerbekanntmachung nach dem Umwandlungsgesetz",
      "state": "Niedersachsen",
      "amtsgericht": "Amtsgericht Hannover",
      "registernummer": "PR 200035",
      "registerart": "PR",
      "company_name": "Hübner & Bayer Partnerschaft Steuerberatungsgesellschaft mbB",
      "company_seat": "Hannover",
      "details": "10.02.2026 (Bekanntmachungsdatum)\n\nNiedersachsen Amtsgericht Hannover PR 200035\nRegisterbekanntmachung nach dem Umwandlungsgesetz 10.02.2026 (Eintragungsdatum)\n\nHübner & Bayer Partnerschaft Steuerberatungsgesellschaft mbB\nPartnerschaftsgesellschaft\nHannover\n\nDen Gläubigern der an der Verschmelzung beteiligten Rechtsträger ist, wenn sie binnen sechs Monaten nach dem Tag, an dem die Eintragung der Verschmelzung in das Register des Sitzes desjenigen Rechtsträgers, dessen Gläubiger sie sind, nach § 19  Abs.  3 UmwG als bekannt gemacht gilt, ihren Anspruch nach Grund und Höhe schriftlich anmelden, Sicherheit zu leisten, soweit sie nicht Befriedigung verlangen können. Dieses Recht steht den Gläubigern jedoch nur zu, wenn sie glaubhaft machen, dass durch die Verschmelzung die Erfüllung der Forderung gefährdet wird."
    },
    {
      "date": "2026-02-10",
      "id": "144743",
      "original_text": "Einreichung neuer Dokumente\nNiedersachsen Amtsgericht Braunschweig HRB 208203\nCARIAD SE – Wolfsburg",
      "type": "Einreichung neuer Dokumente",
      "state": "Niedersachsen",
      "amtsgericht": "Amtsgericht Braunschweig",
      "registernummer": "HRB 208203",
      "registerart": "HRB",
      "company_name": "CARIAD SE",
      "company_seat": "Wolfsburg",
      "details": "10.02.2026 (Bekanntmachungsdatum)\n\nNiedersachsen Amtsgericht Braunschweig HRB 208203\nEinreichung neuer Dokumente 10.02.2026 (Eintragungsdatum)\n\nCARIAD SE\nEuropäische Aktiengesellschaft (SE)\nWolfsburg\n\nDie Liste der Mitglieder des Aufsichtsrats wurde beim Registergericht eingereicht."
    },
    {
      "date": "2026-02-10",
      "id": "144744",
      "original_text": "Löschungsankündigung\nNiedersachsen Amtsgericht Hildesheim HRB 207335\nMarkus.Binscheck Dienstleistungen UG (haftungsbeschränkt) – Edemissen",
      "type": "Löschungsankündigung",
      "state": "Niedersachsen",
      "amtsgericht": "Amtsgericht Hildesheim",
      "registernummer": "HRB 207335",
      "registerart": "HRB",
      "company_name": "Markus.Binscheck Dienstleistungen UG (haftungsbeschränkt)",
      "company_seat": "Edemissen",
      "details": "10.02.2026 (Bekanntmachungsdatum)\n\nNiedersachsen Amtsgericht Hildesheim HRB 207335\nLöschungsankündigung\n\nMarkus.Binscheck Dienstleistungen UG (haftungsbeschränkt)\nGesellschaft mit beschränkter Haftung\nEdemissen\n\nDas Registergericht beabsichtigt, die Gesellschaft von Amts wegen nach § 394 FamFG zu löschen. Die Frist zur Erhebung eines Widerspruchs ist auf 1 Monat ab dieser Registerbekanntmachung festgesetzt."
    },
    {
      "date": "2026-02-10",
      "id": "144745",
      "original_text": "Löschungsankündigung\nRheinland-Pfalz Amtsgericht Kaiserslautern HRB 33195\nMyskins Medien UG (haftungsbeschränkt) – Otterbach",
      "type": "Löschungsankündigung",
      "state": "Rheinland-Pfalz",
      "amtsgericht": "Amtsgericht Kaiserslautern",
      "registernummer": "HRB 33195",
      "registerart": "HRB",
      "company_name": "Myskins Medien UG (haftungsbeschränkt)",
      "company_seat": "Otterbach",
      "details": "10.02.2026 (Bekanntmachungsdatum)\n\nRheinland-Pfalz Amtsgericht Kaiserslautern HRB 33195\nLöschungsankündigung 10.02.2026 (Eintragungsdatum)\n\nMyskins Medien UG (haftungsbeschränkt)\nGesellschaft mit beschränkter Haftung\nOtterbach\n\nDas Registergericht beabsichtigt die vorgenannte Firma gemäß § 394\nFamFG wegen Vermögenslosigkeit zu löschen. Widerspruch gegen die\nLöschung kann nur binnen 3 Monaten ab Veröffentlichung dieser Verfügung\neingelegt werden."
    },
    {
      "date": "2026-02-10",
      "id": "144746",
      "original_text": "Löschungsankündigung\nRheinland-Pfalz Amtsgericht Zweibrücken HRB 30939\nKompakt - Baumanagement GmbH – Pirmasens",
      "type": "Löschungsankündigung",
      "state": "Rheinland-Pfalz",
      "amtsgericht": "Amtsgericht Zweibrücken",
      "registernummer": "HRB 30939",
      "registerart": "HRB",
      "company_name": "Kompakt - Baumanagement GmbH",
      "company_seat": "Pirmasens",
      "details": "10.02.2026 (Bekanntmachungsdatum)\n\nRheinland-Pfalz Amtsgericht Zweibrücken HRB 30939\nLöschungsankündigung\n\nKompakt - Baumanagement GmbH\nGesellschaft mit beschränkter Haftung\nPirmasens\n\nDas Registergericht beabsichtigt die Gesellschaft von Amts wegen nach § 394 FamFG zu löschen. Die Frist zur Erhebung eines Widerspruchs ist auf einen Monat festgesetzt."
    },
    {
      "date": "2026-02-10",
      "id": "144747",
      "original_text": "Registerbekanntmachung nach dem Umwandlungsgesetz\nNordrhein-Westfalen Amtsgericht Arnsberg HRA 9436\nKTH Solution GmbH & Co. KG – Soest",
      "type": "Registerbekanntmachung nach dem Umwandlungsgesetz",
      "state": "Nordrhein-Westfalen",
      "amtsgericht": "Amtsgericht Arnsberg",
      "registernummer": "HRA 9436",
      "registerart": "HRA",
      "company_name": "KTH Solution GmbH & Co. KG",
      "company_seat": "Soest",
      "details": "10.02.2026 (Bekanntmachungsdatum)\n\nNordrhein-Westfalen Amtsgericht Arnsberg HRA 9436\nRegisterbekanntmachung nach dem Umwandlungsgesetz 10.02.2026 (Eintragungsdatum)\n\nKTH Solution GmbH & Co. KG\nKommanditgesellschaft\nSoest\n\nDen Gläubigern der an der Ausgliederung beteiligten Rechtsträger ist, wenn sie binnen sechs Monaten nach dem Tag, an dem die Eintragung der Ausgliederung in das Register des Sitzes desjenigen Rechtsträgers, dessen Gläubiger sie sind, nach § 19 Absatz 3 UmwG als bekanntgemacht gilt, ihren Anspruch nach Grund und Höhe schriftlich anmelden, Sicherheit zu leisten, soweit sie nicht Befriedigung verlangen können. Dieses Recht steht den Gläubigern jedoch nur zu, wenn sie glaubhaft machen, dass durch die Ausgliederung die Erfüllung ihrer Forderung gefährdet wird."
    },
    {
      "date": "2026-02-10",
      "id": "144748",
      "original_text": "Löschungsankündigung\nNordrhein-Westfalen Amtsgericht Köln HRB 122047\nHuDo Logistics UG (haftungsbeschränkt) – Köln",
      "type": "Löschungsankündigung",
      "state": "Nordrhein-Westfalen",
      "amtsgericht": "Amtsgericht Köln",
      "registernummer": "HRB 122047",
      "registerart": "HRB",
      "company_name": "HuDo Logistics UG (haftungsbeschränkt)",
      "company_seat": "Köln",
      "details": "10.02.2026 (Bekanntmachungsdatum)\n\nNordrhein-Westfalen Amtsgericht Köln HRB 122047\nLöschungsankündigung\n\nHuDo Logistics UG (haftungsbeschränkt)\nGesellschaft mit beschränkter Haftung\nKöln\n\nDas Registergericht beabsichtigt, die im Handelsregister eingetragene Gesellschaft gemäß § 394 Absatz 1 FamFG wegen Vermögenslosigkeit von Amts wegen zu löschen. Gegen diese Verfügung kann Widerspruch eingelegt werden. Die Frist zur Erhebung eines Widerspruchs gegen die beabsichtigte Löschung von Amts wegen ist auf einen Monat festgesetzt. Rechtsbehelfsbelehrung: Gegen diese Verfügung können Sie Widerspruch einlegen. Der Widerspruch ist bei dem Amtsgericht Köln, Reichenspergerplatz 1, 50670 Köln schriftlich in deutscher Sprache oder zur Niederschrift der Geschäftsstelle einzulegen. Der Widerspruch kann auch zur Niederschrift der Geschäftsstelle eines jeden Amtsgerichtes abgegeben werden. Die Einlegung ist auch durch Übertragung eines elektronischen Dokuments an die elektronische Poststelle des Gerichts möglich. Das elektronische Dokument muss für die Bearbeitung durch das Gericht geeignet und mit einer qualifizierten elektronischen Signatur der verantwortenden Person versehen sein oder von der verantwortenden Person signiert und auf einem sicheren Übermittlungsweg gemäß § 130a ZPO nach näherer Maßgabe der Verordnung über die technischen Rahmenbedingungen des elektronischen Rechtsverkehrs und über das besondere elektronische Behördenpostfach (BGBl. I, S.3803) eingereicht werden. Weitere Informationen erhalten Sie auf der Internetseite www.justiz.de.Der Widerspruch muss spätestens innerhalb der gesetzten Frist bei dem Amtsgericht Köln eingegangen sein. Dies gilt auch dann, wenn der Widerspruch zur Niederschrift der Geschäftsstelle eines anderen Amtsgerichtes abgegeben wurde. Die Frist beginnt mit der Veröffentlichung. Fällt das Ende der Frist auf einen Sonntag, einen allgemeinen Feiertag oder Sonnabend, so endet die Frist mit Ablauf des nächsten Werktages.\n\nDer Widerspruch muss die Bezeichnung der angefochtenen Verfügung sowie die Erklärung enthalten, dass Widerspruch gegen diese Verfügung eingelegt wird. Er ist zu unterzeichnen und soll begründet werden."
    },
    {
      "date": "2026-02-10",
      "id": "144749",
      "original_text": "Registerbekanntmachung nach dem Umwandlungsgesetz\nNordrhein-Westfalen Amtsgericht Arnsberg HRA 9364\nKerstin Hofmann e.K. – Soest",
      "type": "Registerbekanntmachung nach dem Umwandlungsgesetz",
      "state": "Nordrhein-Westfalen",
      "amtsgericht": "Amtsgericht Arnsberg",
      "registernummer": "HRA 9364",
      "registerart": "HRA",
      "company_name": "Kerstin Hofmann e.K.",
      "company_seat": "Soest",
      "details": "10.02.2026 (Bekanntmachungsdatum)\n\nNordrhein-Westfalen Amtsgericht Arnsberg HRA 9364\nRegisterbekanntmachung nach dem Umwandlungsgesetz 10.02.2026 (Eintragungsdatum)\n\nKerstin Hofmann e.K.\nEinzelkaufmann / Einzelkauffrau\nSoest\n\nDen Gläubigern der an der Ausgliederung beteiligten Rechtsträger ist, wenn sie binnen sechs Monaten nach dem Tag, an dem die Eintragung der Ausgliederung in das Register des Sitzes derjenigen Rechtsträger deren Gläubiger sie sind, nach § 19 Absatz 3 UmwG als bekanntgemacht gilt, ihren Anspruch nach Grund und Höhe schriftlich anmelden, Sicherheit zu leisten, soweit sie nicht Befriedigung verlangen können. Dieses Recht steht den Gläubigern jedoch nur zu, wenn sie glaubhaft machen, dass durch die Ausgliederung die Erfüllung ihrer Forderung gefährdet wird."
    },
    {
      "date": "2026-02-10",
      "id": "144750",
      "original_text": "Löschungsankündigung\nNordrhein-Westfalen Amtsgericht Bonn HRB 8397\nProconsult Finance-Software GmbH. – Bonn",
      "type": "Löschungsankündigung",
      "state": "Nordrhein-Westfalen",
      "amtsgericht": "Amtsgericht Bonn",
      "registernummer": "HRB 8397",
      "registerart": "HRB",
      "company_name": "Proconsult Finance-Software GmbH.",
      "company_seat": "Bonn",
      "details": "10.02.2026 (Bekanntmachungsdatum)\n\nNordrhein-Westfalen Amtsgericht Bonn HRB 8397\nLöschungsankündigung\n\nProconsult Finance-Software GmbH.\nGesellschaft mit beschränkter Haftung\nBonn\n\nDas Registergericht beabsichtigt die Gesellschaft von Amts wegen nach § 394 FamFG zu löschen. Die Frist zur Erhebung eines Widerspruchs ist auf einen Monat festgesetzt."
    },
    {
      "date": "2026-02-10",
      "id": "144751",
      "original_text": "Löschungsankündigung\nNordrhein-Westfalen Amtsgericht Bielefeld HRA 16733\nGentschenfeld e.K. Inh. Michael Ottovordemgentschenfelde – Schloß Holte-Stukenbrock",
      "type": "Löschungsankündigung",
      "state": "Nordrhein-Westfalen",
      "amtsgericht": "Amtsgericht Bielefeld",
      "registernummer": "HRA 16733",
      "registerart": "HRA",
      "company_name": "Gentschenfeld e.K. Inh. Michael Ottovordemgentschenfelde",
      "company_seat": "Schloß Holte-Stukenbrock",
      "details": "10.02.2026 (Bekanntmachungsdatum)\n\nNordrhein-Westfalen Amtsgericht Bielefeld HRA 16733\nLöschungsankündigung 10.02.2026 (Eintragungsdatum)\n\nGentschenfeld e.K. Inh. Michael Ottovordemgentschenfelde\nEinzelkaufmann / Einzelkauffrau\nSchloß Holte-Stukenbrock\n\nDas Registergericht beabsichtigt die Firma von Amts wegen nach § 31 Abs. 2 HGB, § 393 FamFG zu löschen. Die Frist zur Erhebung eines Widerspruchs ist auf einen Monat festgesetzt."
    },
    {
      "date": "2026-02-10",
      "id": "144752",
      "original_text": "Löschungsankündigung\nBremen Amtsgericht Bremen HRB 31146\nTUB GmbH – Bremen",
      "type": "Löschungsankündigung",
      "state": "Bremen",
      "amtsgericht": "Amtsgericht Bremen",
      "registernummer": "HRB 31146",
      "registerart": "HRB",
      "company_name": "TUB GmbH",
      "company_seat": "Bremen",
      "details": "10.02.2026 (Bekanntmachungsdatum)\n\nBremen Amtsgericht Bremen HRB 31146\nLöschungsankündigung\n\nTUB GmbH\nGesellschaft mit beschränkter Haftung\nBremen\n\nEs ist beabsichtigt die im Handelsregister eingetragene Gesellschaft von Amts wegen gemäß § 394 FamFG zu löschen. Gegen die Löschung kann beim AG Bremen schriftlich oder zu Protokoll der Geschäftsstelle Widerspruch eingelegt werden. Widerspruchsfrist 4 Wochen."
    },
    {
      "date": "2026-02-10",
      "id": "144753",
      "original_text": "Löschungsankündigung\nBremen Amtsgericht Bremen HRA 2203 BHV\nGustav W. Rogge GmbH & Co. KG Bauunternehmung – Bremerhaven",
      "type": "Löschungsankündigung",
      "state": "Bremen",
      "amtsgericht": "Amtsgericht Bremen",
      "registernummer": "HRA 2203 BHV",
      "registerart": "HRA",
      "company_name": "Gustav W. Rogge GmbH & Co. KG Bauunternehmung",
      "company_seat": "Bremerhaven",
      "details": "10.02.2026 (Bekanntmachungsdatum)\n\nBremen Amtsgericht Bremen HRA 2203 BHV\nLöschungsankündigung\n\nGustav W. Rogge GmbH & Co. KG Bauunternehmung\nKommanditgesellschaft\nBremerhaven\n\nEs ist beabsichtigt die im Handelsregister eingetragene Firma von Amts wegen gemäß § 31 Abs.2 HGB zu löschen. Gegen die Löschung kann beim AG Bremen schriftlich oder zu Protokoll der Geschäftsstelle Widerspruch eingelegt werden. Widerspruchsfrist 4 Wochen."
    },
    {
      "date": "2026-02-10",
      "id": "144754",
      "original_text": "Einreichung neuer Dokumente\nNordrhein-Westfalen Amtsgericht Krefeld HRB 13014\nthyssenkrupp Materials Processing Europe GmbH – Krefeld",
      "type": "Einreichung neuer Dokumente",
      "state": "Nordrhein-Westfalen",
      "amtsgericht": "Amtsgericht Krefeld",
      "registernummer": "HRB 13014",
      "registerart": "HRB",
      "company_name": "thyssenkrupp Materials Processing Europe GmbH",
      "company_seat": "Krefeld",
      "details": "10.02.2026 (Bekanntmachungsdatum)\n\nNordrhein-Westfalen Amtsgericht Krefeld HRB 13014\nEinreichung neuer Dokumente\n\nthyssenkrupp Materials Processing Europe GmbH\nGesellschaft mit beschränkter Haftung\nKrefeld\n\nDem Registergericht ist eine neue Liste der Mitglieder des Aufsichtsrates eingereicht worden."
    },
    {
      "date": "2026-02-10",
      "id": "144755",
      "original_text": "Löschungsankündigung\nNordrhein-Westfalen Amtsgericht Krefeld HRB 20477\nWaldgasthaus Galgenvenn GmbH – Nettetal",
      "type": "Löschungsankündigung",
      "state": "Nordrhein-Westfalen",
      "amtsgericht": "Amtsgericht Krefeld",
      "registernummer": "HRB 20477",
      "registerart": "HRB",
      "company_name": "Waldgasthaus Galgenvenn GmbH",
      "company_seat": "Nettetal",
      "details": "10.02.2026 (Bekanntmachungsdatum)\n\nNordrhein-Westfalen Amtsgericht Krefeld HRB 20477\nLöschungsankündigung\n\nWaldgasthaus Galgenvenn GmbH\nGesellschaft mit beschränkter Haftung\nNettetal\n\nDas Registergericht beabsichtigt die Gesellschaft von Amts wegen nach § 394 FamFG zu löschen. Die Frist zur Erhebung eines Widerspruchs ist auf einen Monat festgesetzt."
    },
    {
      "date": "2026-02-10",
      "id": "144756",
      "original_text": "Löschungsankündigung\nNordrhein-Westfalen Amtsgericht Wuppertal HRB 34581\nSA-TU GmbH – Wuppertal",
      "type": "Löschungsankündigung",
      "state": "Nordrhein-Westfalen",
      "amtsgericht": "Amtsgericht Wuppertal",
      "registernummer": "HRB 34581",
      "registerart": "HRB",
      "company_name": "SA-TU GmbH",
      "company_seat": "Wuppertal",
      "details": "10.02.2026 (Bekanntmachungsdatum)\n\nNordrhein-Westfalen Amtsgericht Wuppertal HRB 34581\nLöschungsankündigung 09.02.2026 (Eintragungsdatum)\n\nSA-TU GmbH\nGesellschaft mit beschränkter Haftung\nWuppertal\n\nDas Registergericht beabsichtigt die Gesellschaft von Amts wegen nach § 394 FamFG zu löschen. Die Frist zur Erhebung eines Widerspruchs ist auf #DV.Fr(Text=\"Bitte wählen Sie die Widerspruchsfrist aus!\",Eingabe=\"einen Monat\",\"zwei Monate\",\"drei Monate\",\"#insert(Text=\"Freitext\")\"|\"freier Text\") festgesetzt."
    },
    {
      "date": "2026-02-10",
      "id": "144757",
      "original_text": "Einreichung neuer Dokumente\nNordrhein-Westfalen Amtsgericht Essen HRB 30055\ncitadelle systems AG – Essen",
      "type": "Einreichung neuer Dokumente",
      "state": "Nordrhein-Westfalen",
      "amtsgericht": "Amtsgericht Essen",
      "registernummer": "HRB 30055",
      "registerart": "HRB",
      "company_name": "citadelle systems AG",
      "company_seat": "Essen",
      "details": "10.02.2026 (Bekanntmachungsdatum)\n\nNordrhein-Westfalen Amtsgericht Essen HRB 30055\nEinreichung neuer Dokumente\n\ncitadelle systems AG\nAktiengesellschaft\nEssen\n\nDem Registergericht ist eine neue Liste der Mitglieder des Aufsichtsrates eingereicht worden."
    },
    {
      "date": "2026-02-10",
      "id": "144758",
      "original_text": "Registerbekanntmachung nach dem Umwandlungsgesetz\nNordrhein-Westfalen Amtsgericht Essen HRA 9183\nHermann Majert GmbH & Co Kommanditgesellschaft – Essen",
      "type": "Registerbekanntmachung nach dem Umwandlungsgesetz",
      "state": "Nordrhein-Westfalen",
      "amtsgericht": "Amtsgericht Essen",
      "registernummer": "HRA 9183",
      "registerart": "HRA",
      "company_name": "Hermann Majert GmbH & Co Kommanditgesellschaft",
      "company_seat": "Essen",
      "details": "10.02.2026 (Bekanntmachungsdatum)\n\nNordrhein-Westfalen Amtsgericht Essen HRA 9183\nRegisterbekanntmachung nach dem Umwandlungsgesetz 10.02.2026 (Eintragungsdatum)\n\nHermann Majert GmbH & Co Kommanditgesellschaft\nKommanditgesellschaft\nEssen\n\nAls nicht eingetragen wird bekanntgemacht:\nDen Gläubigern der an der Verschmelzung beteiligten Rechtsträger ist, wenn sie binnen sechs Monaten nach dem Tag, an dem die Eintragung der Verschmelzung in das Register des Sitzes desjenigen Rechtsträgers, dessen Gläubiger sie sind, nach § 19 Absatz 3 UmwG als bekanntgemacht gilt, ihren Anspruch nach Grund und Höhe schriftlich anmelden, Sicherheit zu leisten, soweit sie nicht Befriedigung verlangen können. Dieses Recht steht den Gläubigern jedoch nur zu, wenn sie glaubhaft machen, dass durch die Verschmelzung die Erfüllung ihrer Forderung gefährdet wird."
    },
    {
      "date": "2026-02-10",
      "id": "144759",
      "original_text": "Löschungsankündigung\nNordrhein-Westfalen Amtsgericht Essen HRB 34190\nDSO Sicherheitsdienst & Service GmbH – Essen",
      "type": "Löschungsankündigung",
      "state": "Nordrhein-Westfalen",
      "amtsgericht": "Amtsgericht Essen",
      "registernummer": "HRB 34190",
      "registerart": "HRB",
      "company_name": "DSO Sicherheitsdienst & Service GmbH",
      "company_seat": "Essen",
      "details": "10.02.2026 (Bekanntmachungsdatum)\n\nNordrhein-Westfalen Amtsgericht Essen HRB 34190\nLöschungsankündigung\n\nDSO Sicherheitsdienst & Service GmbH\nGesellschaft mit beschränkter Haftung\nEssen\n\nDas Registergericht beabsichtigt die Gesellschaft von Amts wegen nach § 394 FamFG zu löschen. Die Frist zur Erhebung eines Widerspruchs ist auf einen Monat festgesetzt."
    },
    {
      "date": "2026-02-10",
      "id": "144760",
      "original_text": "Löschungsankündigung\nNordrhein-Westfalen Amtsgericht Dortmund HRB 30409\nFriedchens Gastronomie- und Verwaltungsgesellschaft mbH – Dortmund",
      "type": "Löschungsankündigung",
      "state": "Nordrhein-Westfalen",
      "amtsgericht": "Amtsgericht Dortmund",
      "registernummer": "HRB 30409",
      "registerart": "HRB",
      "company_name": "Friedchens Gastronomie- und Verwaltungsgesellschaft mbH",
      "company_seat": "Dortmund",
      "details": "10.02.2026 (Bekanntmachungsdatum)\n\nNordrhein-Westfalen Amtsgericht Dortmund HRB 30409\nLöschungsankündigung\n\nFriedchens Gastronomie- und Verwaltungsgesellschaft mbH\nGesellschaft mit beschränkter Haftung\nDortmund\n\nDas Registergericht beabsichtigt die Gesellschaft von Amts wegen nach § 394 FamFG zu löschen. Die Frist zur Erhebung eines Widerspruchs ist auf zwei Monate festgesetzt."
    },
    {
      "date": "2026-02-10",
      "id": "144761",
      "original_text": "Löschungsankündigung\nNordrhein-Westfalen Amtsgericht Gelsenkirchen HRB 14843\nPIYA Vertrieb- und Handel UG (haftungsbeschränkt) – Gladbeck",
      "type": "Löschungsankündigung",
      "state": "Nordrhein-Westfalen",
      "amtsgericht": "Amtsgericht Gelsenkirchen",
      "registernummer": "HRB 14843",
      "registerart": "HRB",
      "company_name": "PIYA Vertrieb- und Handel UG (haftungsbeschränkt)",
      "company_seat": "Gladbeck",
      "details": "10.02.2026 (Bekanntmachungsdatum)\n\nNordrhein-Westfalen Amtsgericht Gelsenkirchen HRB 14843\nLöschungsankündigung\n\nPIYA Vertrieb- und Handel UG (haftungsbeschränkt)\nGesellschaft mit beschränkter Haftung\nGladbeck\n\nDas Gericht beabsichtigt, die Gesellschaft PIYA Vertrieb- und Handel UG (haftungsbeschränkt) mit Sitz in Gladbeck, HRB 14843 Amtsgericht Gelsenkirchen, wegen Vermögenslosigkeit zu löschen.\nHiermit wird denjenigen, die an der Unterlassung der Löschung ein berechtigtes\nInteresse haben, gem. § 394 Abs. 2 FamFG Gelegenheit gegeben, gegen dieses\nVorhaben binnen eines Monats nach dieser Bekanntmachung Widerspruch\neinzulegen. Der Widerspruch kann schriftlich oder zu Protokoll der Geschäftsstelle erhoben werden."
    },
    {
      "date": "2026-02-10",
      "id": "144762",
      "original_text": "Einreichung neuer Dokumente\nNordrhein-Westfalen Amtsgericht Duisburg HRB 9100\nCommerz Direktservice GmbH – Duisburg",
      "type": "Einreichung neuer Dokumente",
      "state": "Nordrhein-Westfalen",
      "amtsgericht": "Amtsgericht Duisburg",
      "registernummer": "HRB 9100",
      "registerart": "HRB",
      "company_name": "Commerz Direktservice GmbH",
      "company_seat": "Duisburg",
      "details": "10.02.2026 (Bekanntmachungsdatum)\n\nNordrhein-Westfalen Amtsgericht Duisburg HRB 9100\nEinreichung neuer Dokumente\n\nCommerz Direktservice GmbH\nGesellschaft mit beschränkter Haftung\nDuisburg\n\nDem Registergericht ist eine Liste der Mitglieder des Aufsichtsrates eingereicht worden."
    },
    {
      "date": "2026-02-10",
      "id": "144763",
      "original_text": "Einreichung neuer Dokumente\nNordrhein-Westfalen Amtsgericht Krefeld HRB 13014\nthyssenkrupp Materials Processing Europe GmbH – Krefeld",
      "type": "Einreichung neuer Dokumente",
      "state": "Nordrhein-Westfalen",
      "amtsgericht": "Amtsgericht Krefeld",
      "registernummer": "HRB 13014",
      "registerart": "HRB",
      "company_name": "thyssenkrupp Materials Processing Europe GmbH",
      "company_seat": "Krefeld",
      "details": "10.02.2026 (Bekanntmachungsdatum)\n\nNordrhein-Westfalen Amtsgericht Krefeld HRB 13014\nEinreichung neuer Dokumente\n\nthyssenkrupp Materials Processing Europe GmbH\nGesellschaft mit beschränkter Haftung\nKrefeld\n\nDem Registergericht ist eine neue Liste der Mitglieder des Aufsichtsrates eingereicht worden."
    },
    {
      "date": "2026-02-10",
      "id": "144764",
      "original_text": "Löschungsankündigung\nNordrhein-Westfalen Amtsgericht Köln HRB 112856\nANBA Handel GmbH – Köln",
      "type": "Löschungsankündigung",
      "state": "Nordrhein-Westfalen",
      "amtsgericht": "Amtsgericht Köln",
      "registernummer": "HRB 112856",
      "registerart": "HRB",
      "company_name": "ANBA Handel GmbH",
      "company_seat": "Köln",
      "details": "10.02.2026 (Bekanntmachungsdatum)\n\nNordrhein-Westfalen Amtsgericht Köln HRB 112856\nLöschungsankündigung 10.02.2026 (Eintragungsdatum)\n\nANBA Handel GmbH\nGesellschaft mit beschränkter Haftung\nKöln\n\nDas Registergericht beabsichtigt die Gesellschaft von Amts wegen nach § 394 FamFG zu löschen. Die Frist zur Erhebung eines Widerspruchs ist auf einen Monat festgesetzt."
    },
    {
      "date": "2026-02-10",
      "id": "144765",
      "original_text": "Registerbekanntmachung nach dem Umwandlungsgesetz\nNordrhein-Westfalen Amtsgericht Münster HRB 6287\nwst.ag – Münster",
      "type": "Registerbekanntmachung nach dem Umwandlungsgesetz",
      "state": "Nordrhein-Westfalen",
      "amtsgericht": "Amtsgericht Münster",
      "registernummer": "HRB 6287",
      "registerart": "HRB",
      "company_name": "wst.ag",
      "company_seat": "Münster",
      "details": "10.02.2026 (Bekanntmachungsdatum)\n\nNordrhein-Westfalen Amtsgericht Münster HRB 6287\nRegisterbekanntmachung nach dem Umwandlungsgesetz 10.02.2026 (Eintragungsdatum)\n\nwst.ag\nAktiengesellschaft\nMünster\n\nDen Gläubigern der an der formwechselnden Umwandlung beteiligten Rechtsträger ist, wenn sie binnen sechs Monaten nach dem Tag, an dem die Eintragung der formwechselnden Umwandlung in das Register des Sitzes desjenigen Rechtsträgers, dessen Gläubiger sie sind, nach § 19 Absatz 3 UmwG als bekanntgemacht gilt, ihren Anspruch nach Grund und Höhe schriftlich anmelden, Sicherheit zu leisten, soweit sie nicht Befriedigung verlangen können. Dieses Recht steht den Gläubigern jedoch nur zu, wenn sie glaubhaft machen, dass durch die formwechselnden Umwandlung die Erfüllung ihrer Forderung gefährdet wird.Den Gläubigern der an der formwechselnden Umwandlung beteiligten Rechtsträger ist, wenn sie binnen sechs Monaten nach dem Tag, an dem die Eintragung der formwechselnden Umwandlung in das Register des Sitzes desjenigen Rechtsträgers, dessen Gläubiger sie sind, nach § 19 Absatz 3 UmwG als bekanntgemacht gilt, ihren Anspruch nach Grund und Höhe schriftlich anmelden, Sicherheit zu leisten, soweit sie nicht Befriedigung verlangen können. Dieses Recht steht den Gläubigern jedoch nur zu, wenn sie glaubhaft machen, dass durch die formwechselnden Umwandlung die Erfüllung ihrer Forderung gefährdet wird."
    },
    {
      "date": "2026-02-10",
      "id": "144766",
      "original_text": "Löschungsankündigung\nNordrhein-Westfalen Amtsgericht Krefeld HRB 16573\nteNeues Media Holding GmbH – Kempen",
      "type": "Löschungsankündigung",
      "state": "Nordrhein-Westfalen",
      "amtsgericht": "Amtsgericht Krefeld",
      "registernummer": "HRB 16573",
      "registerart": "HRB",
      "company_name": "teNeues Media Holding GmbH",
      "company_seat": "Kempen",
      "details": "10.02.2026 (Bekanntmachungsdatum)\n\nNordrhein-Westfalen Amtsgericht Krefeld HRB 16573\nLöschungsankündigung\n\nteNeues Media Holding GmbH\nGesellschaft mit beschränkter Haftung\nKempen\n\nDas Registergericht beabsichtigt die Gesellschaft von Amts wegen nach § 394 FamFG zu löschen. Die Frist zur Erhebung eines Widerspruchs ist auf einen Monat festgesetzt."
    },
    {
      "date": "2026-02-10",
      "id": "144767",
      "original_text": "Registerbekanntmachung nach dem Umwandlungsgesetz\nNordrhein-Westfalen Amtsgericht Hagen HRB 5600\nBERCO Deutschland GmbH – Ennepetal",
      "type": "Registerbekanntmachung nach dem Umwandlungsgesetz",
      "state": "Nordrhein-Westfalen",
      "amtsgericht": "Amtsgericht Hagen",
      "registernummer": "HRB 5600",
      "registerart": "HRB",
      "company_name": "BERCO Deutschland GmbH",
      "company_seat": "Ennepetal",
      "details": "10.02.2026 (Bekanntmachungsdatum)\n\nNordrhein-Westfalen Amtsgericht Hagen HRB 5600\nRegisterbekanntmachung nach dem Umwandlungsgesetz 10.02.2026 (Eintragungsdatum)\n\nBERCO Deutschland GmbH\nGesellschaft mit beschränkter Haftung\nEnnepetal\n\nDen Gläubigern der an der Verschmelzung beteiligten Rechtsträger ist, wenn sie binnen sechs Monaten nach dem Tag, an dem die Eintragung der Verschmelzung in das Register des Sitzes desjenigen Rechtsträgers, dessen Gläubiger sie sind, nach § 19 Absatz 3 UmwG als bekanntgemacht gilt, ihren Anspruch nach Grund und Höhe schriftlich anmelden, Sicherheit zu leisten, soweit sie nicht Befriedigung verlangen können. Dieses Recht steht den Gläubigern jedoch nur zu, wenn sie glaubhaft machen, dass durch die Verschmelzung die Erfüllung ihrer Forderung gefährdet wird."
    },
    {
      "date": "2026-02-10",
      "id": "144768",
      "original_text": "Einreichung neuer Dokumente\nNordrhein-Westfalen Amtsgericht Düsseldorf HRB 61123\nUniper Global Commodities SE – Düsseldorf",
      "type": "Einreichung neuer Dokumente",
      "state": "Nordrhein-Westfalen",
      "amtsgericht": "Amtsgericht Düsseldorf",
      "registernummer": "HRB 61123",
      "registerart": "HRB",
      "company_name": "Uniper Global Commodities SE",
      "company_seat": "Düsseldorf",
      "details": "10.02.2026 (Bekanntmachungsdatum)\n\nNordrhein-Westfalen Amtsgericht Düsseldorf HRB 61123\nEinreichung neuer Dokumente\n\nUniper Global Commodities SE\nEuropäische Aktiengesellschaft (SE)\nDüsseldorf\n\nDem Registergericht ist eine Liste der Mitglieder des Aufsichtsrates eingereicht worden."
    },
    {
      "date": "2026-02-10",
      "id": "144769",
      "original_text": "Löschungsankündigung\nNordrhein-Westfalen Amtsgericht Aachen HRB 20894\nZHAN Werkzeug und Maschinenbau Handel GmbH – Aachen",
      "type": "Löschungsankündigung",
      "state": "Nordrhein-Westfalen",
      "amtsgericht": "Amtsgericht Aachen",
      "registernummer": "HRB 20894",
      "registerart": "HRB",
      "company_name": "ZHAN Werkzeug und Maschinenbau Handel GmbH",
      "company_seat": "Aachen",
      "details": "10.02.2026 (Bekanntmachungsdatum)\n\nNordrhein-Westfalen Amtsgericht Aachen HRB 20894\nLöschungsankündigung\n\nZHAN Werkzeug und Maschinenbau Handel GmbH\nGesellschaft mit beschränkter Haftung\nAachen\n\nDas Registergericht beabsichtigt, von Amts wegen die Gesellschaft wegen\nVermögenslosigkeit nach § 394 FamFG zu löschen, weil das Finanzamt\nAachen-Stadt mit Schreiben vom 09.01.2026 und später Umstände mitgeteilt hat, aufgrund derer das Gericht davon überzeugt ist, dass die Gesellschaft vollständig vermögenslos ist. Insbesondere sind mögliche Ansprüche gegen die aus der Volksrepublik China stammende Alleingesellschafterin und einzige Geschäftsführerin auf Volleinzahlung ihrer Einlage wirtschaftlich wertlos, da diese unbekannten Aufenthalt ist. Von der bisherigen Anschrift, einem Studentenwohnheim, wurde sie von Amts wegen abgemeldet.\n\nZur Geltendmachung des Widerspruchs gegen die beabsichtigte Löschung wird hiermit eine Frist von einem Monat ab Veröffentlichung dieser Ankündigung bestimmt.\n\nRechtsbehelfsbelehrung:\n\nGegen diese Verfügung kann Widerspruch eingelegt werden. Zum Widerspruch ist jeder berechtigt, der an der Unterlassung der Löschung ein berechtigtes Interesse hat.\n\nDer Widerspruch ist bei dem Amtsgericht Aachen, Adalbertsteinweg 92, 52070 Aachen schriftlich in deutscher Sprache oder zur Niederschrift der Geschäftsstelle einzulegen. Der Widerspruch kann auch zur Niederschrift der Geschäftsstelle eines jeden Amtsgerichtes abgegeben werden.\n\nDer Widerspruch muss spätestens innerhalb der gesetzten Frist nach der Bekanntgabe der Verfügung bei dem Amtsgericht Aachen eingegangen sein. Dies gilt auch dann, wenn der Widerspruch zur Niederschrift der Geschäftsstelle eines anderen Amtsgerichtes abgegeben wurde. Die Frist beginnt mit der Bekanntgabe der Verfügung durch Veröffentlichung. Fällt das Ende der Frist auf einen Sonntag, einen allgemeinen Feiertag oder Sonnabend, so endet die Frist mit Ablauf des nächsten Werktages.\n\nDer Widerspruch muss die Bezeichnung der angefochtenen Verfügung sowie die Erklärung enthalten, dass Widerspruch gegen diese Verfügung eingelegt wird. Er ist zu unterzeichnen und soll begründet werden.\n\nDie Einlegung ist auch durch Übertragung eines elektronischen Dokuments an die elektronische Poststelle des Gerichts möglich. Das elektronische Dokument muss für die Bearbeitung durch das Gericht geeignet und mit einer qualifizierten elektronischen Signatur der verantwortenden Person versehen sein oder von der verantwortenden Person signiert und auf einem sicheren Übermittlungsweg gemäß § 130 a ZPO nach näherer Maßgabe der Verordnung über die technischen Rahmenbedingungen des elektronischen Rechtsverkehrs und über das besondere elektronische Behördenpostfach (BGBl. I, S. 3803) eingereicht werden. Weitere Informationen erhalten Sie auf der Internetseite www.justiz.de."
    },
    {
      "date": "2026-02-10",
      "id": "144770",
      "original_text": "Löschungsankündigung\nNordrhein-Westfalen Amtsgericht Krefeld HRB 17157\nClever Business UG (haftungsbeschränkt) – Brüggen",
      "type": "Löschungsankündigung",
      "state": "Nordrhein-Westfalen",
      "amtsgericht": "Amtsgericht Krefeld",
      "registernummer": "HRB 17157",
      "registerart": "HRB",
      "company_name": "Clever Business UG (haftungsbeschränkt)",
      "company_seat": "Brüggen",
      "details": "10.02.2026 (Bekanntmachungsdatum)\n\nNordrhein-Westfalen Amtsgericht Krefeld HRB 17157\nLöschungsankündigung\n\nClever Business UG (haftungsbeschränkt)\nGesellschaft mit beschränkter Haftung\nBrüggen\n\nDas Registergericht beabsichtigt die Gesellschaft von Amts wegen nach § 394 FamFG zu löschen. Die Frist zur Erhebung eines Widerspruchs ist auf einen Monat festgesetzt."
    },
    {
      "date": "2026-02-10",
      "id": "144771",
      "original_text": "Löschungsankündigung\nNordrhein-Westfalen Amtsgericht Düsseldorf HRB 93337\nTechnisches Wälzlagerhaus GmbH – Düsseldorf",
      "type": "Löschungsankündigung",
      "state": "Nordrhein-Westfalen",
      "amtsgericht": "Amtsgericht Düsseldorf",
      "registernummer": "HRB 93337",
      "registerart": "HRB",
      "company_name": "Technisches Wälzlagerhaus GmbH",
      "company_seat": "Düsseldorf",
      "details": "10.02.2026 (Bekanntmachungsdatum)\n\nNordrhein-Westfalen Amtsgericht Düsseldorf HRB 93337\nLöschungsankündigung\n\nTechnisches Wälzlagerhaus GmbH\nGesellschaft mit beschränkter Haftung\nDüsseldorf\n\nDas Registergericht beabsichtigt die Gesellschaft von Amts wegen nach § 394 FamFG zu löschen. Die Frist zur Erhebung eines Widerspruchs ist auf 3 Wochen festgesetzt.\n\nRechtsbehelfsbelehrung:\nDas Widerspruchsrecht steht jedem zu, der an der Unterlassung der Löschung ein berechtigtes Interesse hat. Der Widerspruch ist bei dem Amtsgericht Düsseldorf -Registergericht-, Werdener Straße 1, 40227 Düsseldorf schriftlich in deutscher Sprache oder zur Niederschrift der Geschäftsstelle einzulegen. Der Widerspruch kann auch zur Niederschrift der Geschäftsstelle eines jeden Amtsgerichtes abgegeben werden. Die Einlegung ist auch durch Übertragung eines elektronischen Dokuments an die elektronische Poststelle des Gerichts möglich. Das elektronische Dokument muss für die Bearbeitung durch das Gericht geeignet und mit einer qualifizierten elektronischen Signatur der verantwortenden Person versehen sein oder von der verantwortenden Person signiert und auf einem sicheren Übermittlungsweg gemäß § 130a ZPO nach näherer Maßgabe der Verordnung über die technischen Rahmenbedingungen des elektronischen Rechtsverkehrs und über das besondere elektronische Behördenpostfach (BGBl. I, S.3803) eingereicht werden. Weitere Informationen erhalten Sie auf der Internetseite www.justiz.de.\nDer Widerspruch muss spätestens innerhalb der gesetzten Frist nach dem Datum der Bekanntmachung der Löschungsankündigung bei dem Amtsgericht - Registergericht - Düsseldorf eingegangen sein.  Dies gilt auch dann, wenn der Widerspruch zur Niederschrift der Geschäftsstelle eines anderen Amtsgerichtes abgegeben wurde. Die Frist beginnt mit dem Tage der Bekanntmachung der Löschungsankündigung in dem für die Bekanntmachung der Eintragungen in das Handelsregister bestimmten elektronischen Informations- und Kommunikationssystem nach § 10 des Handelsgesetzbuches. Fällt das Ende der Frist auf einen Sonntag, einen allgemeinen Feiertag oder Sonnabend, so endet die Frist mit Ablauf des nächsten Werktages.\nDer Widerspruch muss die Bezeichnung der angefochtenen Löschungsankündigung sowie die Erklärung enthalten, dass Widerspruch gegen diese Löschungsankündigung eingelegt wird. Er ist zu unterzeichnen und soll begründet werden."
    },
    {
      "date": "2026-02-10",
      "id": "144772",
      "original_text": "Registerbekanntmachung nach dem Umwandlungsgesetz\nNordrhein-Westfalen Amtsgericht Münster HRB 23310\nwe es te GmbH – Münster",
      "type": "Registerbekanntmachung nach dem Umwandlungsgesetz",
      "state": "Nordrhein-Westfalen",
      "amtsgericht": "Amtsgericht Münster",
      "registernummer": "HRB 23310",
      "registerart": "HRB",
      "company_name": "we es te GmbH",
      "company_seat": "Münster",
      "details": "10.02.2026 (Bekanntmachungsdatum)\n\nNordrhein-Westfalen Amtsgericht Münster HRB 23310\nRegisterbekanntmachung nach dem Umwandlungsgesetz 10.02.2026 (Eintragungsdatum)\n\nwe es te GmbH\nGesellschaft mit beschränkter Haftung\nMünster\n\nDen Gläubigern der an der formwechselnden Umwandlung beteiligten Rechtsträger ist, wenn sie binnen sechs Monaten nach dem Tag, an dem die Eintragung der formwechselnden Umwandlung in das Register des Sitzes desjenigen Rechtsträgers, dessen Gläubiger sie sind, nach § 19 Absatz 3 UmwG als bekanntgemacht gilt, ihren Anspruch nach Grund und Höhe schriftlich anmelden, Sicherheit zu leisten, soweit sie nicht Befriedigung verlangen können. Dieses Recht steht den Gläubigern jedoch nur zu, wenn sie glaubhaft machen, dass durch die formwechselnden Umwandlung die Erfüllung ihrer Forderung gefährdet wird."
    },
    {
      "date": "2026-02-10",
      "id": "144773",
      "original_text": "Löschungsankündigung\nNordrhein-Westfalen Amtsgericht Köln HRB 50905\nJP Hair Company Jürgen Petter GmbH – Köln",
      "type": "Löschungsankündigung",
      "state": "Nordrhein-Westfalen",
      "amtsgericht": "Amtsgericht Köln",
      "registernummer": "HRB 50905",
      "registerart": "HRB",
      "company_name": "JP Hair Company Jürgen Petter GmbH",
      "company_seat": "Köln",
      "details": "10.02.2026 (Bekanntmachungsdatum)\n\nNordrhein-Westfalen Amtsgericht Köln HRB 50905\nLöschungsankündigung 10.02.2026 (Eintragungsdatum)\n\nJP Hair Company Jürgen Petter GmbH\nGesellschaft mit beschränkter Haftung\nKöln\n\nDas Registergericht beabsichtigt die Gesellschaft von Amts wegen nach § 394 FamFG zu löschen. Die Frist zur Erhebung eines Widerspruchs ist auf einen Monat festgesetzt."
    },
    {
      "date": "2026-02-10",
      "id": "144774",
      "original_text": "Registerbekanntmachung nach dem Umwandlungsgesetz\nNordrhein-Westfalen Amtsgericht Düsseldorf HRB 98258\nLinimed NRW GmbH – Düsseldorf",
      "type": "Registerbekanntmachung nach dem Umwandlungsgesetz",
      "state": "Nordrhein-Westfalen",
      "amtsgericht": "Amtsgericht Düsseldorf",
      "registernummer": "HRB 98258",
      "registerart": "HRB",
      "company_name": "Linimed NRW GmbH",
      "company_seat": "Düsseldorf",
      "details": "10.02.2026 (Bekanntmachungsdatum)\n\nNordrhein-Westfalen Amtsgericht Düsseldorf HRB 98258\nRegisterbekanntmachung nach dem Umwandlungsgesetz 10.02.2026 (Eintragungsdatum)\n\nLinimed NRW GmbH\nGesellschaft mit beschränkter Haftung\nDüsseldorf\n\nDen Gläubigern der an der Verschmelzung beteiligten Rechtsträger ist, wenn sie binnen sechs Monaten nach dem Tag, an dem die Eintragung der Verschmelzung in das Register des Sitzes desjenigen Rechtsträgers, dessen Gläubiger sie sind, nach § 19 Absatz 3 UmwG als bekanntgemacht gilt, ihren Anspruch nach Grund und Höhe schriftlich anmelden, Sicherheit zu leisten, soweit sie nicht Befriedigung verlangen können. Dieses Recht steht den Gläubigern jedoch nur zu, wenn sie glaubhaft machen, dass durch die Verschmelzung die Erfüllung ihrer Forderung gefährdet wird."
    },
    {
      "date": "2026-02-10",
      "id": "144775",
      "original_text": "Registerbekanntmachung nach dem Umwandlungsgesetz\nNordrhein-Westfalen Amtsgericht Köln HRB 37210\nsepago GmbH – Köln",
      "type": "Registerbekanntmachung nach dem Umwandlungsgesetz",
      "state": "Nordrhein-Westfalen",
      "amtsgericht": "Amtsgericht Köln",
      "registernummer": "HRB 37210",
      "registerart": "HRB",
      "company_name": "sepago GmbH",
      "company_seat": "Köln",
      "details": "10.02.2026 (Bekanntmachungsdatum)\n\nNordrhein-Westfalen Amtsgericht Köln HRB 37210\nRegisterbekanntmachung nach dem Umwandlungsgesetz 10.02.2026 (Eintragungsdatum)\n\nsepago GmbH\nGesellschaft mit beschränkter Haftung\nKöln\n\nDen Gläubigern der an der Verschmelzung beteiligten Rechtsträger ist, wenn sie binnen sechs Monaten nach dem Tag, an dem die Eintragung der Verschmelzung in das Register des Sitzes desjenigen Rechtsträgers, dessen Gläubiger sie sind, nach § 19 Absatz 3 UmwG als bekanntgemacht gilt, ihren Anspruch nach Grund und Höhe schriftlich anmelden, Sicherheit zu leisten, soweit sie nicht Befriedigung verlangen können. Dieses Recht steht den Gläubigern jedoch nur zu, wenn sie glaubhaft machen, dass durch die Verschmelzung die Erfüllung ihrer Forderung gefährdet wird."
    },
    {
      "date": "2026-02-10",
      "id": "144776",
      "original_text": "Löschungsankündigung\nNordrhein-Westfalen Amtsgericht Köln HRB 103143\nFO-AR Hausbau GmbH – Köln",
      "type": "Löschungsankündigung",
      "state": "Nordrhein-Westfalen",
      "amtsgericht": "Amtsgericht Köln",
      "registernummer": "HRB 103143",
      "registerart": "HRB",
      "company_name": "FO-AR Hausbau GmbH",
      "company_seat": "Köln",
      "details": "10.02.2026 (Bekanntmachungsdatum)\n\nNordrhein-Westfalen Amtsgericht Köln HRB 103143\nLöschungsankündigung\n\nFO-AR Hausbau GmbH\nGesellschaft mit beschränkter Haftung\nKöln\n\nDas Registergericht beabsichtigt die Gesellschaft von Amts wegen nach § 394 FamFG zu löschen. Die Frist zur Erhebung eines Widerspruchs ist auf einen Monat festgesetzt."
    },
    {
      "date": "2026-02-10",
      "id": "144777",
      "original_text": "Löschungsankündigung\nHessen Amtsgericht Hanau HRB 93668\nDie Zeit Gesellschaft für Personalservice GmbH – Bruchköbel",
      "type": "Löschungsankündigung",
      "state": "Hessen",
      "amtsgericht": "Amtsgericht Hanau",
      "registernummer": "HRB 93668",
      "registerart": "HRB",
      "company_name": "Die Zeit Gesellschaft für Personalservice GmbH",
      "company_seat": "Bruchköbel",
      "details": "10.02.2026 (Bekanntmachungsdatum)\n\nHessen Amtsgericht Hanau HRB 93668\nLöschungsankündigung\n\nDie Zeit Gesellschaft für Personalservice GmbH\nGesellschaft mit beschränkter Haftung\nBruchköbel\n\nDas Registergericht beabsichtigt die im Handelsregister eingetragene Gesellschaft von Amts wegen nach § 394 FamFG zu löschen. Die Frist zur Erhebung eines Widerspruchs gegen die beabsichtigte Löschung wird auf 3 Monate festgesetzt."
    },
    {
      "date": "2026-02-10",
      "id": "144778",
      "original_text": "Registerbekanntmachung nach dem Umwandlungsgesetz\nHessen Amtsgericht Frankfurt am Main HRB 134985\nFrankfurt Wohnland GmbH – Frankfurt am Main",
      "type": "Registerbekanntmachung nach dem Umwandlungsgesetz",
      "state": "Hessen",
      "amtsgericht": "Amtsgericht Frankfurt am Main",
      "registernummer": "HRB 134985",
      "registerart": "HRB",
      "company_name": "Frankfurt Wohnland GmbH",
      "company_seat": "Frankfurt am Main",
      "details": "10.02.2026 (Bekanntmachungsdatum)\n\nHessen Amtsgericht Frankfurt am Main HRB 134985\nRegisterbekanntmachung nach dem Umwandlungsgesetz 10.02.2026 (Eintragungsdatum)\n\nFrankfurt Wohnland GmbH\nGesellschaft mit beschränkter Haftung\nFrankfurt am Main\n\nEs wird darauf hingewiesen, dass ein Formwechselplan oder sein Entwurf über einen grenzüberschreitenden Formwechsel in die Platinum PropCo S.a. r.l. mit Sitz in Luxemburg beim Handelsregister eingereicht worden ist.\n\nDie Anteilsinhaber, die Gläubiger sowie die zuständigen Betriebsräte der an dem grenzüberschreitenden Formwechsel beteiligten Gesellschaft oder, soweit es keinen Betriebsrat gibt, die Arbeitnehmer der an dem grenzüberschreitenden Formwechsel beteiligten Gesellschaft, können der Gesellschaft spätestens fünf Arbeitstage vor dem Tag der Gesellschafterversammlung zum Formwechselplan übermitteln."
    },
    {
      "date": "2026-02-10",
      "id": "144779",
      "original_text": "Sonstige Registerbekanntmachung\nHessen Amtsgericht Fritzlar VR 1277\nFörderverein Bundespräsident-Theodor-Heuss-Schule Homberg – Homberg (Efze)",
      "type": "Sonstige Registerbekanntmachung",
      "state": "Hessen",
      "amtsgericht": "Amtsgericht Fritzlar",
      "registernummer": "VR 1277",
      "registerart": "VR",
      "company_name": "Förderverein Bundespräsident-Theodor-Heuss-Schule Homberg",
      "company_seat": "Homberg (Efze)",
      "details": "10.02.2026 (Bekanntmachungsdatum)\n\nHessen Amtsgericht Fritzlar VR 1277\nSonstige Registerbekanntmachung 10.02.2026 (Eintragungsdatum)\n\nFörderverein Bundespräsident-Theodor-Heuss-Schule Homberg\neingetragener Verein\nHomberg (Efze)\n\nDer Verein ist aufgelöst."
    },
    {
      "date": "2026-02-10",
      "id": "144780",
      "original_text": "Einreichung neuer Dokumente\nHessen Amtsgericht Frankfurt am Main HRB 75145\nChinook deSign AG – Frankfurt am Main",
      "type": "Einreichung neuer Dokumente",
      "state": "Hessen",
      "amtsgericht": "Amtsgericht Frankfurt am Main",
      "registernummer": "HRB 75145",
      "registerart": "HRB",
      "company_name": "Chinook deSign AG",
      "company_seat": "Frankfurt am Main",
      "details": "10.02.2026 (Bekanntmachungsdatum)\n\nHessen Amtsgericht Frankfurt am Main HRB 75145\nEinreichung neuer Dokumente\n\nChinook deSign AG\nAktiengesellschaft\nFrankfurt am Main\n\nDurch eine Änderung in den Personen der Aufsichtsratsmitglieder ist eine Liste der Mitglieder des Aufsichtsrates zum Handelsregister eingereicht worden."
    },
    {
      "date": "2026-02-10",
      "id": "144781",
      "original_text": "Sonstige Registerbekanntmachung\nHessen Amtsgericht Wiesbaden VR 5478\nTraditionsverein Flugabwehrregiment 5 Lorch e.V. – Lorch",
      "type": "Sonstige Registerbekanntmachung",
      "state": "Hessen",
      "amtsgericht": "Amtsgericht Wiesbaden",
      "registernummer": "VR 5478",
      "registerart": "VR",
      "company_name": "Traditionsverein Flugabwehrregiment 5 Lorch e.V.",
      "company_seat": "Lorch",
      "details": "10.02.2026 (Bekanntmachungsdatum)\n\nHessen Amtsgericht Wiesbaden VR 5478\nSonstige Registerbekanntmachung 10.02.2026 (Eintragungsdatum)\n\nTraditionsverein Flugabwehrregiment 5 Lorch e.V.\neingetragener Verein\nLorch\n\nDer Verein ist aufgelöst."
    },
    {
      "date": "2026-02-10",
      "id": "144782",
      "original_text": "Löschungsankündigung\nHessen Amtsgericht Frankfurt am Main HRB 108558\nMax Bau GmbH – Frankfurt am Main",
      "type": "Löschungsankündigung",
      "state": "Hessen",
      "amtsgericht": "Amtsgericht Frankfurt am Main",
      "registernummer": "HRB 108558",
      "registerart": "HRB",
      "company_name": "Max Bau GmbH",
      "company_seat": "Frankfurt am Main",
      "details": "10.02.2026 (Bekanntmachungsdatum)\n\nHessen Amtsgericht Frankfurt am Main HRB 108558\nLöschungsankündigung\n\nMax Bau GmbH\nGesellschaft mit beschränkter Haftung\nFrankfurt am Main\n\nEs ist beabsichtigt, die Gesellschaft wegen Vermögenslosigkeit gemäß § 394 FamFG von Amts wegen im Handelsregister zu löschen. Hiergegen kann innerhalb eines Monats nach dieser Veröffentlichung Widerspruch bei dem Amtsgericht Frankfurt am Main eingelegt werden."
    },
    {
      "date": "2026-02-10",
      "id": "144783",
      "original_text": "Löschungsankündigung\nHessen Amtsgericht Frankfurt am Main HRB 123935\nM&N Service GmbH – Frankfurt am Main",
      "type": "Löschungsankündigung",
      "state": "Hessen",
      "amtsgericht": "Amtsgericht Frankfurt am Main",
      "registernummer": "HRB 123935",
      "registerart": "HRB",
      "company_name": "M&N Service GmbH",
      "company_seat": "Frankfurt am Main",
      "details": "10.02.2026 (Bekanntmachungsdatum)\n\nHessen Amtsgericht Frankfurt am Main HRB 123935\nLöschungsankündigung\n\nM&N Service GmbH\nGesellschaft mit beschränkter Haftung\nFrankfurt am Main\n\nDas Registergericht beabsichtigt die im Handelsregister eingetragene Gesellschaft von Amts wegen nach § 394 FamFG zu löschen. Die Frist zur Erhebung eines Widerspruchs gegen die beabsichtigte Löschung wird auf 1 Monat festgesetzt."
    },
    {
      "date": "2026-02-10",
      "id": "144784",
      "original_text": "Löschungsankündigung\nHessen Amtsgericht Frankfurt am Main HRB 113690\nStefan Industriemontage GmbH – Frankfurt am Main",
      "type": "Löschungsankündigung",
      "state": "Hessen",
      "amtsgericht": "Amtsgericht Frankfurt am Main",
      "registernummer": "HRB 113690",
      "registerart": "HRB",
      "company_name": "Stefan Industriemontage GmbH",
      "company_seat": "Frankfurt am Main",
      "details": "10.02.2026 (Bekanntmachungsdatum)\n\nHessen Amtsgericht Frankfurt am Main HRB 113690\nLöschungsankündigung\n\nStefan Industriemontage GmbH\nGesellschaft mit beschränkter Haftung\nFrankfurt am Main\n\nDas Registergericht beabsichtigt die im Handelsregister eingetragene Gesellschaft von Amts wegen nach § 394 FamFG zu löschen. Die Frist zur Erhebung eines Widerspruchs gegen die beabsichtigte Löschung wird auf 1 Monat festgesetzt."
    },
    {
      "date": "2026-02-10",
      "id": "144785",
      "original_text": "Löschungsankündigung\nHessen Amtsgericht Frankfurt am Main HRB 133096\nEASTEN SUN UG (haftungsbeschränkt) – Frankfurt am Main",
      "type": "Löschungsankündigung",
      "state": "Hessen",
      "amtsgericht": "Amtsgericht Frankfurt am Main",
      "registernummer": "HRB 133096",
      "registerart": "HRB",
      "company_name": "EASTEN SUN UG (haftungsbeschränkt)",
      "company_seat": "Frankfurt am Main",
      "details": "10.02.2026 (Bekanntmachungsdatum)\n\nHessen Amtsgericht Frankfurt am Main HRB 133096\nLöschungsankündigung\n\nEASTEN SUN UG (haftungsbeschränkt)\nGesellschaft mit beschränkter Haftung\nFrankfurt am Main\n\nDas Registergericht beabsichtigt die im Handelsregister eingetragene Gesellschaft von Amts wegen nach § 394 FamFG zu löschen. Die Frist zur Erhebung eines Widerspruchs gegen die beabsichtigte Löschung wird auf 2 Monate festgesetzt."
    },
    {
      "date": "2026-02-10",
      "id": "144786",
      "original_text": "Sonstige Registerbekanntmachung\nHessen Amtsgericht Darmstadt VR 83941\nVerein zum Wohl der Tiere e.V., Gnadenhof Abendrot – Hirschhorn (Neckar)",
      "type": "Sonstige Registerbekanntmachung",
      "state": "Hessen",
      "amtsgericht": "Amtsgericht Darmstadt",
      "registernummer": "VR 83941",
      "registerart": "VR",
      "company_name": "Verein zum Wohl der Tiere e.V., Gnadenhof Abendrot",
      "company_seat": "Hirschhorn (Neckar)",
      "details": "10.02.2026 (Bekanntmachungsdatum)\n\nHessen Amtsgericht Darmstadt VR 83941\nSonstige Registerbekanntmachung 10.02.2026 (Eintragungsdatum)\n\nVerein zum Wohl der Tiere e.V., Gnadenhof Abendrot\neingetragener Verein\nHirschhorn (Neckar)\n\nDer Verein ist aufgelöst."
    },
    {
      "date": "2026-02-10",
      "id": "144787",
      "original_text": "Einreichung neuer Dokumente\nHessen Amtsgericht Frankfurt am Main HRB 117643\nFelix Zukunftsstiftung & Co. KGaA – Frankfurt am Main",
      "type": "Einreichung neuer Dokumente",
      "state": "Hessen",
      "amtsgericht": "Amtsgericht Frankfurt am Main",
      "registernummer": "HRB 117643",
      "registerart": "HRB",
      "company_name": "Felix Zukunftsstiftung & Co. KGaA",
      "company_seat": "Frankfurt am Main",
      "details": "10.02.2026 (Bekanntmachungsdatum)\n\nHessen Amtsgericht Frankfurt am Main HRB 117643\nEinreichung neuer Dokumente\n\nFelix Zukunftsstiftung & Co. KGaA\nKommanditgesellschaft auf Aktien\nFrankfurt am Main\n\nDurch eine Änderung in den Personen der Aufsichtsratsmitglieder ist eine Liste der Mitglieder des Aufsichtsrates zum Handelsregister eingereicht worden."
    },
    {
      "date": "2026-02-10",
      "id": "144788",
      "original_text": "Registerbekanntmachung nach dem Umwandlungsgesetz\nHessen Amtsgericht Darmstadt HRB 61044\nHorst Zöller GmbH Schlosserei und Metallbau – Lampertheim",
      "type": "Registerbekanntmachung nach dem Umwandlungsgesetz",
      "state": "Hessen",
      "amtsgericht": "Amtsgericht Darmstadt",
      "registernummer": "HRB 61044",
      "registerart": "HRB",
      "company_name": "Horst Zöller GmbH Schlosserei und Metallbau",
      "company_seat": "Lampertheim",
      "details": "10.02.2026 (Bekanntmachungsdatum)\n\nHessen Amtsgericht Darmstadt HRB 61044\nRegisterbekanntmachung nach dem Umwandlungsgesetz 10.02.2026 (Eintragungsdatum)\n\nHorst Zöller GmbH Schlosserei und Metallbau\nGesellschaft mit beschränkter Haftung\nLampertheim\n\nIm übrigen wird auf den Verschmelzungsvertrag vom #DV.VertragDatum(Text=\"Bitte geben Sie das Datum des Verschmelzungsvertrages ein!\") Bezug genommen."
    },
    {
      "date": "2026-02-10",
      "id": "144789",
      "original_text": "Löschungsankündigung\nHessen Amtsgericht Frankfurt am Main HRB 108017\nInmotion Cars GmbH – Frankfurt am Main",
      "type": "Löschungsankündigung",
      "state": "Hessen",
      "amtsgericht": "Amtsgericht Frankfurt am Main",
      "registernummer": "HRB 108017",
      "registerart": "HRB",
      "company_name": "Inmotion Cars GmbH",
      "company_seat": "Frankfurt am Main",
      "details": "10.02.2026 (Bekanntmachungsdatum)\n\nHessen Amtsgericht Frankfurt am Main HRB 108017\nLöschungsankündigung\n\nInmotion Cars GmbH\nGesellschaft mit beschränkter Haftung\nFrankfurt am Main\n\nEs ist beabsichtigt die Gesellschaft wegen Vermögenslosigkeit gemäß § 394 FamFG von Amts wegen zu löschen. Hiergegen kann innerhalb eines Monats nach dieser Veröffentlichung Widerspruch bei dem Amtsgericht Frankfurt am Main eingelegt werden."
    }
  ]
}