{
  "date": "2026-02-07",
  "date_of_scrape": "2026-02-08T04:47:07.826Z",
  "tool_version": "0.2.0",
  "number_of_announcements": 20,
  "announcements": [
    {
      "date": "2026-02-07",
      "id": "144588",
      "original_text": "Registerbekanntmachung nach dem Umwandlungsgesetz\nBayern Amtsgericht München HRB 138283\nSupplyOn Aktiengesellschaft – Hallbergmoos",
      "type": "Registerbekanntmachung nach dem Umwandlungsgesetz",
      "state": "Bayern",
      "amtsgericht": "Amtsgericht München",
      "registernummer": "HRB 138283",
      "registerart": "HRB",
      "company_name": "SupplyOn Aktiengesellschaft",
      "company_seat": "Hallbergmoos",
      "details": "07.02.2026 (Bekanntmachungsdatum)\n\nBayern Amtsgericht München HRB 138283\nRegisterbekanntmachung nach dem Umwandlungsgesetz 06.02.2026 (Eintragungsdatum)\n\nSupplyOn Aktiengesellschaft\nAktiengesellschaft\nHallbergmoos\n\nDen Gläubigern der an der Verschmelzung beteiligten Rechtsträger ist, wenn sie binnen sechs Monaten nach dem Tag, an dem die Eintragung der Verschmelzung in das Register des Sitzes desjenigen Rechtsträgers, dessen Gläubiger sie sind, nach § 19 Abs. 3 UmwG als bekannt gemacht gilt, ihren Anspruch nach Grund und Höhe in Textform anmelden, Sicherheit zu leisten, soweit sie nicht Befriedigung verlangen können. Dieses Recht steht den Gläubigern jedoch nur zu, wenn sie glaubhaft machen, dass durch die Verschmelzung die Erfüllung ihrer Forderung gefährdet wird."
    },
    {
      "date": "2026-02-07",
      "id": "144589",
      "original_text": "Einreichung neuer Dokumente\nBayern Amtsgericht Nürnberg HRB 25736\nEckart GmbH – Hartenstein",
      "type": "Einreichung neuer Dokumente",
      "state": "Bayern",
      "amtsgericht": "Amtsgericht Nürnberg",
      "registernummer": "HRB 25736",
      "registerart": "HRB",
      "company_name": "Eckart GmbH",
      "company_seat": "Hartenstein",
      "details": "07.02.2026 (Bekanntmachungsdatum)\n\nBayern Amtsgericht Nürnberg HRB 25736\nEinreichung neuer Dokumente\n\nEckart GmbH\nGesellschaft mit beschränkter Haftung\nHartenstein\n\nDem Amtsgericht Nürnberg -Registergericht- ist eine Liste der Mitglieder des Aufsichtsrats eingereicht worden, § 52 Abs. 3 S. 2 GmbHG."
    },
    {
      "date": "2026-02-07",
      "id": "144590",
      "original_text": "Registerbekanntmachung nach dem Umwandlungsgesetz\nBayern Amtsgericht Nürnberg HRB 19393\nManu Dextra GmbH Gesellschaft für Engineering & Consulting – Nürnberg",
      "type": "Registerbekanntmachung nach dem Umwandlungsgesetz",
      "state": "Bayern",
      "amtsgericht": "Amtsgericht Nürnberg",
      "registernummer": "HRB 19393",
      "registerart": "HRB",
      "company_name": "Manu Dextra GmbH Gesellschaft für Engineering & Consulting",
      "company_seat": "Nürnberg",
      "details": "07.02.2026 (Bekanntmachungsdatum)\n\nBayern Amtsgericht Nürnberg HRB 19393\nRegisterbekanntmachung nach dem Umwandlungsgesetz 06.02.2026 (Eintragungsdatum)\n\nManu Dextra GmbH Gesellschaft für Engineering & Consulting\nGesellschaft mit beschränkter Haftung\nNürnberg\n\nDen Gläubigern der an der Verschmelzung beteiligten Rechtsträger ist, wenn sie binnen sechs Monaten nach dem Tag, an dem die Eintragung der Verschmelzung in das Register des Sitzes desjenigen Rechtsträgers, dessen Gläubiger sie sind, nach § 19 Abs. 3 UmwG als bekannt gemacht gilt, ihren Anspruch nach Grund und Höhe in Textform anmelden, Sicherheit zu leisten, soweit sie nicht Befriedigung verlangen können. Dieses Recht steht den Gläubigern jedoch nur zu, wenn sie glaubhaft machen, dass durch die Verschmelzung die Erfüllung ihrer Forderung gefährdet wird."
    },
    {
      "date": "2026-02-07",
      "id": "144591",
      "original_text": "Registerbekanntmachung nach dem Umwandlungsgesetz\nBayern Amtsgericht München HRB 282604\nKWP II Unterried UG (haftungsbeschränkt) – München",
      "type": "Registerbekanntmachung nach dem Umwandlungsgesetz",
      "state": "Bayern",
      "amtsgericht": "Amtsgericht München",
      "registernummer": "HRB 282604",
      "registerart": "HRB",
      "company_name": "KWP II Unterried UG (haftungsbeschränkt)",
      "company_seat": "München",
      "details": "07.02.2026 (Bekanntmachungsdatum)\n\nBayern Amtsgericht München HRB 282604\nRegisterbekanntmachung nach dem Umwandlungsgesetz 06.02.2026 (Eintragungsdatum)\n\nKWP II Unterried UG (haftungsbeschränkt)\nGesellschaft mit beschränkter Haftung\nMünchen\n\nDen Gläubigern der an der Verschmelzung beteiligten Rechtsträger ist, wenn sie binnen sechs Monaten nach dem Tag, an dem die Eintragung der Verschmelzung in das Register des Sitzes desjenigen Rechtsträgers, dessen Gläubiger sie sind, nach § 19 Abs. 3 UmwG als bekannt gemacht gilt, ihren Anspruch nach Grund und Höhe in Textform anmelden, Sicherheit zu leisten, soweit sie nicht Befriedigung verlangen können. Dieses Recht steht den Gläubigern jedoch nur zu, wenn sie glaubhaft machen, dass durch die Verschmelzung die Erfüllung ihrer Forderung gefährdet wird."
    },
    {
      "date": "2026-02-07",
      "id": "144592",
      "original_text": "Registerbekanntmachung nach dem Umwandlungsgesetz\nBayern Amtsgericht München GsR 3142\napexmedia - Johanna Hartung & Timon Hartung eGbR – Grünwald",
      "type": "Registerbekanntmachung nach dem Umwandlungsgesetz",
      "state": "Bayern",
      "amtsgericht": "Amtsgericht München",
      "registernummer": "GsR 3142",
      "registerart": "GsR",
      "company_name": "apexmedia - Johanna Hartung & Timon Hartung eGbR",
      "company_seat": "Grünwald",
      "details": "07.02.2026 (Bekanntmachungsdatum)\n\nBayern Amtsgericht München GsR 3142\nRegisterbekanntmachung nach dem Umwandlungsgesetz 06.02.2026 (Eintragungsdatum)\n\napexmedia - Johanna Hartung & Timon Hartung eGbR\nGesellschaft bürgerlichen Rechts\nGrünwald\n\nDen Gläubigern des formwechselnden Rechtsträgers ist, wenn sie binnen sechs Monaten nach dem Tag, an dem die Eintragung des Formwechsels nach § 201 UmwG als bekannt gemacht gilt, ihren Anspruch nach Grund und Höhe in Textform anmelden, Sicherheit zu leisten, soweit sie nicht Befriedigung verlangen können. Dieses Recht steht den Gläubigern jedoch nur zu, wenn sie glaubhaft machen, dass durch den Formwechsel die Erfüllung ihrer Forderung gefährdet wird."
    },
    {
      "date": "2026-02-07",
      "id": "144593",
      "original_text": "Registerbekanntmachung nach dem Umwandlungsgesetz\nBayern Amtsgericht Augsburg HRB 33719\nA-DIGITAL one GmbH – Augsburg",
      "type": "Registerbekanntmachung nach dem Umwandlungsgesetz",
      "state": "Bayern",
      "amtsgericht": "Amtsgericht Augsburg",
      "registernummer": "HRB 33719",
      "registerart": "HRB",
      "company_name": "A-DIGITAL one GmbH",
      "company_seat": "Augsburg",
      "details": "07.02.2026 (Bekanntmachungsdatum)\n\nBayern Amtsgericht Augsburg HRB 33719\nRegisterbekanntmachung nach dem Umwandlungsgesetz 06.02.2026 (Eintragungsdatum)\n\nA-DIGITAL one GmbH\nGesellschaft mit beschränkter Haftung\nAugsburg\n\nDen Gläubigern der an der Verschmelzung beteiligten Rechtsträger ist, wenn sie binnen sechs Monaten nach dem Tag, an dem die Eintragung der Verschmelzung in das Register des Sitzes desjenigen Rechtsträgers, dessen Gläubiger sie sind, nach § 19 Abs. 3 UmwG als bekannt gemacht gilt, ihren Anspruch nach Grund und Höhe in Textform anmelden, Sicherheit zu leisten, soweit sie nicht Befriedigung verlangen können. Dieses Recht steht den Gläubigern jedoch nur zu, wenn sie glaubhaft machen, dass durch die Verschmelzung die Erfüllung ihrer Forderung gefährdet wird."
    },
    {
      "date": "2026-02-07",
      "id": "144594",
      "original_text": "Registerbekanntmachung nach dem Umwandlungsgesetz\nBayern Amtsgericht München HRB 304355\nJafari Holding GmbH – München",
      "type": "Registerbekanntmachung nach dem Umwandlungsgesetz",
      "state": "Bayern",
      "amtsgericht": "Amtsgericht München",
      "registernummer": "HRB 304355",
      "registerart": "HRB",
      "company_name": "Jafari Holding GmbH",
      "company_seat": "München",
      "details": "07.02.2026 (Bekanntmachungsdatum)\n\nBayern Amtsgericht München HRB 304355\nRegisterbekanntmachung nach dem Umwandlungsgesetz 06.02.2026 (Eintragungsdatum)\n\nJafari Holding GmbH\nGesellschaft mit beschränkter Haftung\nMünchen\n\nDen Gläubigern der an der Spaltung beteiligten Rechtsträger ist, wenn sie binnen sechs Monaten nach dem Tag, an dem die Eintragung der Spaltung in das Register des Sitzes desjenigen Rechtsträgers, dessen Gläubiger sie sind, nach §§ 125, 19 Abs. 3 UmwG als bekannt gemacht gilt, ihren Anspruch nach Grund und Höhe in Textform anmelden, Sicherheit zu leisten, soweit sie nicht Befriedigung verlangen können. Dieses Recht steht den Gläubigern jedoch nur zu, wenn sie glaubhaft machen, dass durch die Spaltung die Erfüllung ihrer Forderung gefährdet wird."
    },
    {
      "date": "2026-02-07",
      "id": "144595",
      "original_text": "Registerbekanntmachung nach dem Umwandlungsgesetz\nBayern Amtsgericht München HRB 282625\nKWP II Altertheim UG (haftungsbeschränkt) – München",
      "type": "Registerbekanntmachung nach dem Umwandlungsgesetz",
      "state": "Bayern",
      "amtsgericht": "Amtsgericht München",
      "registernummer": "HRB 282625",
      "registerart": "HRB",
      "company_name": "KWP II Altertheim UG (haftungsbeschränkt)",
      "company_seat": "München",
      "details": "07.02.2026 (Bekanntmachungsdatum)\n\nBayern Amtsgericht München HRB 282625\nRegisterbekanntmachung nach dem Umwandlungsgesetz 06.02.2026 (Eintragungsdatum)\n\nKWP II Altertheim UG (haftungsbeschränkt)\nGesellschaft mit beschränkter Haftung\nMünchen\n\nDen Gläubigern der an der Verschmelzung beteiligten Rechtsträger ist, wenn sie binnen sechs Monaten nach dem Tag, an dem die Eintragung der Verschmelzung in das Register des Sitzes desjenigen Rechtsträgers, dessen Gläubiger sie sind, nach § 19 Abs. 3 UmwG als bekannt gemacht gilt, ihren Anspruch nach Grund und Höhe in Textform anmelden, Sicherheit zu leisten, soweit sie nicht Befriedigung verlangen können. Dieses Recht steht den Gläubigern jedoch nur zu, wenn sie glaubhaft machen, dass durch die Verschmelzung die Erfüllung ihrer Forderung gefährdet wird."
    },
    {
      "date": "2026-02-07",
      "id": "144596",
      "original_text": "Registerbekanntmachung nach dem Umwandlungsgesetz\nBayern Amtsgericht München HRB 235042\nEOS Capital Partners II GmbH – München",
      "type": "Registerbekanntmachung nach dem Umwandlungsgesetz",
      "state": "Bayern",
      "amtsgericht": "Amtsgericht München",
      "registernummer": "HRB 235042",
      "registerart": "HRB",
      "company_name": "EOS Capital Partners II GmbH",
      "company_seat": "München",
      "details": "07.02.2026 (Bekanntmachungsdatum)\n\nBayern Amtsgericht München HRB 235042\nRegisterbekanntmachung nach dem Umwandlungsgesetz 06.02.2026 (Eintragungsdatum)\n\nEOS Capital Partners II GmbH\nGesellschaft mit beschränkter Haftung\nMünchen\n\nDen Gläubigern der an der Verschmelzung beteiligten Rechtsträger ist, wenn sie binnen sechs Monaten nach dem Tag, an dem die Eintragung der Verschmelzung in das Register des Sitzes desjenigen Rechtsträgers, dessen Gläubiger sie sind, nach § 19 Abs. 3 UmwG als bekannt gemacht gilt, ihren Anspruch nach Grund und Höhe in Textform anmelden, Sicherheit zu leisten, soweit sie nicht Befriedigung verlangen können. Dieses Recht steht den Gläubigern jedoch nur zu, wenn sie glaubhaft machen, dass durch die Verschmelzung die Erfüllung ihrer Forderung gefährdet wird."
    },
    {
      "date": "2026-02-07",
      "id": "144597",
      "original_text": "Löschungsankündigung\nBayern Amtsgericht Coburg HRB 6954\nFML RE Projekt 4 GmbH – Coburg",
      "type": "Löschungsankündigung",
      "state": "Bayern",
      "amtsgericht": "Amtsgericht Coburg",
      "registernummer": "HRB 6954",
      "registerart": "HRB",
      "company_name": "FML RE Projekt 4 GmbH",
      "company_seat": "Coburg",
      "details": "07.02.2026 (Bekanntmachungsdatum)\n\nBayern Amtsgericht Coburg HRB 6954\nLöschungsankündigung 06.02.2026 (Eintragungsdatum)\n\nFML RE Projekt 4 GmbH\nGesellschaft mit beschränkter Haftung\nCoburg\n\nDas Registergericht beabsichtigt, die im Handelsregister eingetragene Gesellschaft wegen Vermögenslosigkeit von Amts wegen nach § 394 FamFG zu löschen. Die Frist zur Erhebung eines Widerspruchs ist auf sechs Wochen festgesetzt."
    },
    {
      "date": "2026-02-07",
      "id": "144598",
      "original_text": "Registerbekanntmachung nach dem Umwandlungsgesetz\nBayern Amtsgericht München HRB 306892\nRepairFix GmbH – München",
      "type": "Registerbekanntmachung nach dem Umwandlungsgesetz",
      "state": "Bayern",
      "amtsgericht": "Amtsgericht München",
      "registernummer": "HRB 306892",
      "registerart": "HRB",
      "company_name": "RepairFix GmbH",
      "company_seat": "München",
      "details": "07.02.2026 (Bekanntmachungsdatum)\n\nBayern Amtsgericht München HRB 306892\nRegisterbekanntmachung nach dem Umwandlungsgesetz 06.02.2026 (Eintragungsdatum)\n\nRepairFix GmbH\nGesellschaft mit beschränkter Haftung\nMünchen\n\nDen Gläubigern der an der Verschmelzung beteiligten Rechtsträger ist, wenn sie binnen sechs Monaten nach dem Tag, an dem die Eintragung der Verschmelzung in das Register des Sitzes desjenigen Rechtsträgers, dessen Gläubiger sie sind, nach § 19 Abs. 3 UmwG als bekannt gemacht gilt, ihren Anspruch nach Grund und Höhe in Textform anmelden, Sicherheit zu leisten, soweit sie nicht Befriedigung verlangen können. Dieses Recht steht den Gläubigern jedoch nur zu, wenn sie glaubhaft machen, dass durch die Verschmelzung die Erfüllung ihrer Forderung gefährdet wird."
    },
    {
      "date": "2026-02-07",
      "id": "144599",
      "original_text": "Registerbekanntmachung nach dem Umwandlungsgesetz\nBayern Amtsgericht München HRB 262324\nCoboCons GmbH – München",
      "type": "Registerbekanntmachung nach dem Umwandlungsgesetz",
      "state": "Bayern",
      "amtsgericht": "Amtsgericht München",
      "registernummer": "HRB 262324",
      "registerart": "HRB",
      "company_name": "CoboCons GmbH",
      "company_seat": "München",
      "details": "07.02.2026 (Bekanntmachungsdatum)\n\nBayern Amtsgericht München HRB 262324\nRegisterbekanntmachung nach dem Umwandlungsgesetz 06.02.2026 (Eintragungsdatum)\n\nCoboCons GmbH\nGesellschaft mit beschränkter Haftung\nMünchen\n\nDen Gläubigern der an der Verschmelzung beteiligten Rechtsträger ist, wenn sie binnen sechs Monaten nach dem Tag, an dem die Eintragung der Verschmelzung in das Register des Sitzes desjenigen Rechtsträgers, dessen Gläubiger sie sind, nach § 19 Abs. 3 UmwG als bekannt gemacht gilt, ihren Anspruch nach Grund und Höhe in Textform anmelden, Sicherheit zu leisten, soweit sie nicht Befriedigung verlangen können. Dieses Recht steht den Gläubigern jedoch nur zu, wenn sie glaubhaft machen, dass durch die Verschmelzung die Erfüllung ihrer Forderung gefährdet wird."
    },
    {
      "date": "2026-02-07",
      "id": "144600",
      "original_text": "Registerbekanntmachung nach dem Umwandlungsgesetz\nBayern Amtsgericht München HRB 246833\nEncavis Asset Management AG – Neubiberg",
      "type": "Registerbekanntmachung nach dem Umwandlungsgesetz",
      "state": "Bayern",
      "amtsgericht": "Amtsgericht München",
      "registernummer": "HRB 246833",
      "registerart": "HRB",
      "company_name": "Encavis Asset Management AG",
      "company_seat": "Neubiberg",
      "details": "07.02.2026 (Bekanntmachungsdatum)\n\nBayern Amtsgericht München HRB 246833\nRegisterbekanntmachung nach dem Umwandlungsgesetz 06.02.2026 (Eintragungsdatum)\n\nEncavis Asset Management AG\nAktiengesellschaft\nNeubiberg\n\nDen Gläubigern der an der Verschmelzung beteiligten Rechtsträger ist, wenn sie binnen sechs Monaten nach dem Tag, an dem die Eintragung der Verschmelzung in das Register des Sitzes desjenigen Rechtsträgers, dessen Gläubiger sie sind, nach § 19 Abs. 3 UmwG als bekannt gemacht gilt, ihren Anspruch nach Grund und Höhe in Textform anmelden, Sicherheit zu leisten, soweit sie nicht Befriedigung verlangen können. Dieses Recht steht den Gläubigern jedoch nur zu, wenn sie glaubhaft machen, dass durch die Verschmelzung die Erfüllung ihrer Forderung gefährdet wird."
    },
    {
      "date": "2026-02-07",
      "id": "144601",
      "original_text": "Registerbekanntmachung nach dem Umwandlungsgesetz\nBayern Amtsgericht München HRB 278087\nIoannidis Holding UG (haftungsbeschränkt) – München",
      "type": "Registerbekanntmachung nach dem Umwandlungsgesetz",
      "state": "Bayern",
      "amtsgericht": "Amtsgericht München",
      "registernummer": "HRB 278087",
      "registerart": "HRB",
      "company_name": "Ioannidis Holding UG (haftungsbeschränkt)",
      "company_seat": "München",
      "details": "07.02.2026 (Bekanntmachungsdatum)\n\nBayern Amtsgericht München HRB 278087\nRegisterbekanntmachung nach dem Umwandlungsgesetz 06.02.2026 (Eintragungsdatum)\n\nIoannidis Holding UG (haftungsbeschränkt)\nGesellschaft mit beschränkter Haftung\nMünchen\n\nDen Gläubigern der an der Verschmelzung beteiligten Rechtsträger ist, wenn sie binnen sechs Monaten nach dem Tag, an dem die Eintragung der Verschmelzung in das Register des Sitzes desjenigen Rechtsträgers, dessen Gläubiger sie sind, nach § 19 Abs. 3 UmwG als bekannt gemacht gilt, ihren Anspruch nach Grund und Höhe in Textform anmelden, Sicherheit zu leisten, soweit sie nicht Befriedigung verlangen können. Dieses Recht steht den Gläubigern jedoch nur zu, wenn sie glaubhaft machen, dass durch die Verschmelzung die Erfüllung ihrer Forderung gefährdet wird."
    },
    {
      "date": "2026-02-07",
      "id": "144602",
      "original_text": "Registerbekanntmachung nach dem Umwandlungsgesetz\nBayern Amtsgericht Augsburg HRA 10799\nJÄGER OHG Abschlepp- und Bergungsdienst – Gersthofen",
      "type": "Registerbekanntmachung nach dem Umwandlungsgesetz",
      "state": "Bayern",
      "amtsgericht": "Amtsgericht Augsburg",
      "registernummer": "HRA 10799",
      "registerart": "HRA",
      "company_name": "JÄGER OHG Abschlepp- und Bergungsdienst",
      "company_seat": "Gersthofen",
      "details": "07.02.2026 (Bekanntmachungsdatum)\n\nBayern Amtsgericht Augsburg HRA 10799\nRegisterbekanntmachung nach dem Umwandlungsgesetz 06.02.2026 (Eintragungsdatum)\n\nJÄGER OHG Abschlepp- und Bergungsdienst\nOffene Handelsgesellschaft\nGersthofen\n\nDen Gläubigern des formwechselnden Rechtsträgers ist, wenn sie binnen sechs Monaten nach dem Tag, an dem die Eintragung des Formwechsels nach § 201 UmwG als bekannt gemacht gilt, ihren Anspruch nach Grund und Höhe in Textform anmelden, Sicherheit zu leisten, soweit sie nicht Befriedigung verlangen können. Dieses Recht steht den Gläubigern jedoch nur zu, wenn sie glaubhaft machen, dass durch den Formwechsel die Erfüllung ihrer Forderung gefährdet wird."
    },
    {
      "date": "2026-02-07",
      "id": "144603",
      "original_text": "Löschungsankündigung\nBayern Amtsgericht Bayreuth HRB 6727\nLoMa Logistik & Facility Management GmbH – Bayreuth",
      "type": "Löschungsankündigung",
      "state": "Bayern",
      "amtsgericht": "Amtsgericht Bayreuth",
      "registernummer": "HRB 6727",
      "registerart": "HRB",
      "company_name": "LoMa Logistik & Facility Management GmbH",
      "company_seat": "Bayreuth",
      "details": "07.02.2026 (Bekanntmachungsdatum)\n\nBayern Amtsgericht Bayreuth HRB 6727\nLöschungsankündigung\n\nLoMa Logistik & Facility Management GmbH\nGesellschaft mit beschränkter Haftung\nBayreuth\n\nDas Registergericht beabsichtigt, die im Handelsregister eingetragene Gesellschaft wegen Vermögenslosigkeit von Amts wegen nach § 394 FamFG zu löschen. Die Frist zur Erhebung eines Widerspruchs ist auf einen Monat festgesetzt."
    },
    {
      "date": "2026-02-07",
      "id": "144604",
      "original_text": "Einreichung neuer Dokumente\nBayern Amtsgericht München HRB 292066\nAgile Robots SE – München",
      "type": "Einreichung neuer Dokumente",
      "state": "Bayern",
      "amtsgericht": "Amtsgericht München",
      "registernummer": "HRB 292066",
      "registerart": "HRB",
      "company_name": "Agile Robots SE",
      "company_seat": "München",
      "details": "07.02.2026 (Bekanntmachungsdatum)\n\nBayern Amtsgericht München HRB 292066\nEinreichung neuer Dokumente 06.02.2026 (Eintragungsdatum)\n\nAgile Robots SE\nEuropäische Aktiengesellschaft (SE)\nMünchen\n\nDem Amtsgericht München -Registergericht- ist eine Liste der Mitglieder des Aufsichtsrats eingereicht worden, Art. 9 Abs. 1 Buchst. c (ii) SE-VO i.V.m. § 106 AktG."
    },
    {
      "date": "2026-02-07",
      "id": "144605",
      "original_text": "Löschungsankündigung\nBayern Amtsgericht München HRA 118307\nDachfreund24 GmbH & Co. KG – Aschheim",
      "type": "Löschungsankündigung",
      "state": "Bayern",
      "amtsgericht": "Amtsgericht München",
      "registernummer": "HRA 118307",
      "registerart": "HRA",
      "company_name": "Dachfreund24 GmbH & Co. KG",
      "company_seat": "Aschheim",
      "details": "07.02.2026 (Bekanntmachungsdatum)\n\nBayern Amtsgericht München HRA 118307\nLöschungsankündigung 06.02.2026 (Eintragungsdatum)\n\nDachfreund24 GmbH & Co. KG\nKommanditgesellschaft\nAschheim\n\nDas Registergericht beabsichtigt, die im Handelsregister eingetragene Firma von Amts wegen nach § 31 Abs. 2 HGB zu löschen. Die Frist zur Erhebung eines Widerspruchs ist auf drei Monate festgesetzt."
    },
    {
      "date": "2026-02-07",
      "id": "144606",
      "original_text": "Registerbekanntmachung nach dem Umwandlungsgesetz\nNordrhein-Westfalen Amtsgericht Bad Oeynhausen HRB 8024\nKlüter Papierverarbeitung GmbH – Bünde",
      "type": "Registerbekanntmachung nach dem Umwandlungsgesetz",
      "state": "Nordrhein-Westfalen",
      "amtsgericht": "Amtsgericht Bad Oeynhausen",
      "registernummer": "HRB 8024",
      "registerart": "HRB",
      "company_name": "Klüter Papierverarbeitung GmbH",
      "company_seat": "Bünde",
      "details": "07.02.2026 (Bekanntmachungsdatum)\n\nNordrhein-Westfalen Amtsgericht Bad Oeynhausen HRB 8024\nRegisterbekanntmachung nach dem Umwandlungsgesetz 07.02.2026 (Eintragungsdatum)\n\nKlüter Papierverarbeitung GmbH\nGesellschaft mit beschränkter Haftung\nBünde\n\nDen Gläubigern der an der Verschmelzung beteiligten Rechtsträger ist, wenn sie binnen sechs Monaten nach dem Tag, an dem die Eintragung der Verschmelzung in das Register des Sitzes desjenigen Rechtsträgers, dessen Gläubiger sie sind, nach § 19 Absatz 3 UmwG als bekanntgemacht gilt, ihren Anspruch nach Grund und Höhe schriftlich anmelden, Sicherheit zu leisten, soweit sie nicht Befriedigung verlangen können. Dieses Recht steht den Gläubigern jedoch nur zu, wenn sie glaubhaft machen, dass durch die Verschmelzung die Erfüllung ihrer Forderung gefährdet wird."
    },
    {
      "date": "2026-02-07",
      "id": "144607",
      "original_text": "Registerbekanntmachung nach dem Umwandlungsgesetz\nNordrhein-Westfalen Amtsgericht Bad Oeynhausen HRB 11909\nKlüter Druckveredelung GmbH – Bünde",
      "type": "Registerbekanntmachung nach dem Umwandlungsgesetz",
      "state": "Nordrhein-Westfalen",
      "amtsgericht": "Amtsgericht Bad Oeynhausen",
      "registernummer": "HRB 11909",
      "registerart": "HRB",
      "company_name": "Klüter Druckveredelung GmbH",
      "company_seat": "Bünde",
      "details": "07.02.2026 (Bekanntmachungsdatum)\n\nNordrhein-Westfalen Amtsgericht Bad Oeynhausen HRB 11909\nRegisterbekanntmachung nach dem Umwandlungsgesetz 07.02.2026 (Eintragungsdatum)\n\nKlüter Druckveredelung GmbH\nGesellschaft mit beschränkter Haftung\nBünde\n\nDen Gläubigern der an der Verschmelzung beteiligten Rechtsträger ist, wenn sie binnen sechs Monaten nach dem Tag, an dem die Eintragung der Verschmelzung in das Register des Sitzes desjenigen Rechtsträgers, dessen Gläubiger sie sind, nach § 19 Absatz 3 UmwG als bekanntgemacht gilt, ihren Anspruch nach Grund und Höhe schriftlich anmelden, Sicherheit zu leisten, soweit sie nicht Befriedigung verlangen können. Dieses Recht steht den Gläubigern jedoch nur zu, wenn sie glaubhaft machen, dass durch die Verschmelzung die Erfüllung ihrer Forderung gefährdet wird."
    }
  ]
}