{
  "date": "2026-02-05",
  "date_of_scrape": "2026-02-06T04:40:38.510Z",
  "tool_version": "0.2.0",
  "number_of_announcements": 125,
  "announcements": [
    {
      "date": "2026-02-05",
      "id": "144357",
      "original_text": "Löschungsankündigung\nBayern Amtsgericht München HRB 100673\nNEST Baubetreuungsgesellschaft mbH – München",
      "type": "Löschungsankündigung",
      "state": "Bayern",
      "amtsgericht": "Amtsgericht München",
      "registernummer": "HRB 100673",
      "registerart": "HRB",
      "company_name": "NEST Baubetreuungsgesellschaft mbH",
      "company_seat": "München",
      "details": "05.02.2026 (Bekanntmachungsdatum)\n\nBayern Amtsgericht München HRB 100673\nLöschungsankündigung\n\nNEST Baubetreuungsgesellschaft mbH\nGesellschaft mit beschränkter Haftung\nMünchen\n\nDas Registergericht beabsichtigt, die im Handelsregister eingetragene Gesellschaft wegen Vermögenslosigkeit von Amts wegen nach § 394 FamFG zu löschen. Die Frist zur Erhebung eines Widerspruchs ist auf drei Monate festgesetzt."
    },
    {
      "date": "2026-02-05",
      "id": "144358",
      "original_text": "Registerbekanntmachung nach dem Umwandlungsgesetz\nBayern Amtsgericht München HRB 211515\nACONEXT Engineering GmbH – München",
      "type": "Registerbekanntmachung nach dem Umwandlungsgesetz",
      "state": "Bayern",
      "amtsgericht": "Amtsgericht München",
      "registernummer": "HRB 211515",
      "registerart": "HRB",
      "company_name": "ACONEXT Engineering GmbH",
      "company_seat": "München",
      "details": "05.02.2026 (Bekanntmachungsdatum)\n\nBayern Amtsgericht München HRB 211515\nRegisterbekanntmachung nach dem Umwandlungsgesetz 04.02.2026 (Eintragungsdatum)\n\nACONEXT Engineering GmbH\nGesellschaft mit beschränkter Haftung\nMünchen\n\nDen Gläubigern der an der Verschmelzung beteiligten Rechtsträger ist, wenn sie binnen sechs Monaten nach dem Tag, an dem die Eintragung der Verschmelzung in das Register des Sitzes desjenigen Rechtsträgers, dessen Gläubiger sie sind, nach § 19 Abs. 3 UmwG als bekannt gemacht gilt, ihren Anspruch nach Grund und Höhe in Textform anmelden, Sicherheit zu leisten, soweit sie nicht Befriedigung verlangen können. Dieses Recht steht den Gläubigern jedoch nur zu, wenn sie glaubhaft machen, dass durch die Verschmelzung die Erfüllung ihrer Forderung gefährdet wird."
    },
    {
      "date": "2026-02-05",
      "id": "144359",
      "original_text": "Löschungsankündigung\nBayern Amtsgericht München HRB 264375\nPopovici GmbH – Planegg",
      "type": "Löschungsankündigung",
      "state": "Bayern",
      "amtsgericht": "Amtsgericht München",
      "registernummer": "HRB 264375",
      "registerart": "HRB",
      "company_name": "Popovici GmbH",
      "company_seat": "Planegg",
      "details": "05.02.2026 (Bekanntmachungsdatum)\n\nBayern Amtsgericht München HRB 264375\nLöschungsankündigung\n\nPopovici GmbH\nGesellschaft mit beschränkter Haftung\nPlanegg\n\nDas Registergericht beabsichtigt, die im Handelsregister eingetragene Gesellschaft wegen Vermögenslosigkeit von Amts wegen nach § 394 FamFG zu löschen. Die Frist zur Erhebung eines Widerspruchs ist auf drei Monate festgesetzt."
    },
    {
      "date": "2026-02-05",
      "id": "144360",
      "original_text": "Einreichung neuer Dokumente\nBayern Amtsgericht Ingolstadt HRB 10456\nBAUER Resources GmbH – Schrobenhausen",
      "type": "Einreichung neuer Dokumente",
      "state": "Bayern",
      "amtsgericht": "Amtsgericht Ingolstadt",
      "registernummer": "HRB 10456",
      "registerart": "HRB",
      "company_name": "BAUER Resources GmbH",
      "company_seat": "Schrobenhausen",
      "details": "05.02.2026 (Bekanntmachungsdatum)\n\nBayern Amtsgericht Ingolstadt HRB 10456\nEinreichung neuer Dokumente\n\nBAUER Resources GmbH\nGesellschaft mit beschränkter Haftung\nSchrobenhausen\n\nDem Amtsgericht Ingolstadt -Registergericht- ist eine Liste der Mitglieder des Aufsichtsrats eingereicht worden, § 52 Abs. 3 S. 2 GmbHG."
    },
    {
      "date": "2026-02-05",
      "id": "144361",
      "original_text": "Registerbekanntmachung nach dem Umwandlungsgesetz\nBayern Amtsgericht Augsburg HRB 41564\nRing Zone GmbH – Gersthofen",
      "type": "Registerbekanntmachung nach dem Umwandlungsgesetz",
      "state": "Bayern",
      "amtsgericht": "Amtsgericht Augsburg",
      "registernummer": "HRB 41564",
      "registerart": "HRB",
      "company_name": "Ring Zone GmbH",
      "company_seat": "Gersthofen",
      "details": "05.02.2026 (Bekanntmachungsdatum)\n\nBayern Amtsgericht Augsburg HRB 41564\nRegisterbekanntmachung nach dem Umwandlungsgesetz 04.02.2026 (Eintragungsdatum)\n\nRing Zone GmbH\nGesellschaft mit beschränkter Haftung\nGersthofen\n\nDen Gläubigern der an der Verschmelzung beteiligten Rechtsträger ist, wenn sie binnen sechs Monaten nach dem Tag, an dem die Eintragung der Verschmelzung in das Register des Sitzes desjenigen Rechtsträgers, dessen Gläubiger sie sind, nach § 19 Abs. 3 UmwG als bekannt gemacht gilt, ihren Anspruch nach Grund und Höhe in Textform anmelden, Sicherheit zu leisten, soweit sie nicht Befriedigung verlangen können. Dieses Recht steht den Gläubigern jedoch nur zu, wenn sie glaubhaft machen, dass durch die Verschmelzung die Erfüllung ihrer Forderung gefährdet wird."
    },
    {
      "date": "2026-02-05",
      "id": "144362",
      "original_text": "Registerbekanntmachung nach dem Umwandlungsgesetz\nBayern Amtsgericht München HRB 307733\nLifecycle Media GmbH – Grafrath",
      "type": "Registerbekanntmachung nach dem Umwandlungsgesetz",
      "state": "Bayern",
      "amtsgericht": "Amtsgericht München",
      "registernummer": "HRB 307733",
      "registerart": "HRB",
      "company_name": "Lifecycle Media GmbH",
      "company_seat": "Grafrath",
      "details": "05.02.2026 (Bekanntmachungsdatum)\n\nBayern Amtsgericht München HRB 307733\nRegisterbekanntmachung nach dem Umwandlungsgesetz 04.02.2026 (Eintragungsdatum)\n\nLifecycle Media GmbH\nGesellschaft mit beschränkter Haftung\nGrafrath\n\nDen Gläubigern der an der Ausgliederung beteiligten Rechtsträger ist, wenn sie binnen sechs Monaten nach dem Tag, an dem die Eintragung der Ausgliederung in das Register des Sitzes desjenigen Rechtsträgers, dessen Gläubiger sie sind, nach §§ 125, 19 Abs. 3 UmwG als bekannt gemacht gilt, ihren Anspruch nach Grund und Höhe in Textform anmelden, Sicherheit zu leisten, soweit sie nicht Befriedigung verlangen können. Dieses Recht steht den Gläubigern jedoch nur zu, wenn sie glaubhaft machen, dass durch die Ausgliederung die Erfüllung ihrer Forderung gefährdet wird."
    },
    {
      "date": "2026-02-05",
      "id": "144363",
      "original_text": "Registerbekanntmachung nach dem Umwandlungsgesetz\nBayern Amtsgericht Kempten (Allgäu) HRB 18727\nDentallabor Bach GmbH – Marktoberdorf",
      "type": "Registerbekanntmachung nach dem Umwandlungsgesetz",
      "state": "Bayern",
      "amtsgericht": "Amtsgericht Kempten (Allgäu)",
      "registernummer": "HRB 18727",
      "registerart": "HRB",
      "company_name": "Dentallabor Bach GmbH",
      "company_seat": "Marktoberdorf",
      "details": "05.02.2026 (Bekanntmachungsdatum)\n\nBayern Amtsgericht Kempten (Allgäu) HRB 18727\nRegisterbekanntmachung nach dem Umwandlungsgesetz 04.02.2026 (Eintragungsdatum)\n\nDentallabor Bach GmbH\nGesellschaft mit beschränkter Haftung\nMarktoberdorf\n\nDen Gläubigern des formwechselnden Rechtsträgers ist, wenn sie binnen sechs Monaten nach dem Tag, an dem die Eintragung des Formwechsels nach § 201 UmwG als bekannt gemacht gilt, ihren Anspruch nach Grund und Höhe in Textform anmelden, Sicherheit zu leisten, soweit sie nicht Befriedigung verlangen können. Dieses Recht steht den Gläubigern jedoch nur zu, wenn sie glaubhaft machen, dass durch den Formwechsel die Erfüllung ihrer Forderung gefährdet wird."
    },
    {
      "date": "2026-02-05",
      "id": "144364",
      "original_text": "Einreichung neuer Dokumente\nBayern Amtsgericht Traunstein HRB 18045\nMAFO Systemtechnik AG – Teisendorf",
      "type": "Einreichung neuer Dokumente",
      "state": "Bayern",
      "amtsgericht": "Amtsgericht Traunstein",
      "registernummer": "HRB 18045",
      "registerart": "HRB",
      "company_name": "MAFO Systemtechnik AG",
      "company_seat": "Teisendorf",
      "details": "05.02.2026 (Bekanntmachungsdatum)\n\nBayern Amtsgericht Traunstein HRB 18045\nEinreichung neuer Dokumente 04.02.2026 (Eintragungsdatum)\n\nMAFO Systemtechnik AG\nAktiengesellschaft\nTeisendorf\n\nDem Amtsgericht Traunstein -Registergericht- ist eine Liste der Mitglieder des Aufsichtsrats eingereicht worden, § 106 AktG."
    },
    {
      "date": "2026-02-05",
      "id": "144365",
      "original_text": "Löschungsankündigung\nBayern Amtsgericht Regensburg HRB 14365\nGreen Power GmbH – Regensburg",
      "type": "Löschungsankündigung",
      "state": "Bayern",
      "amtsgericht": "Amtsgericht Regensburg",
      "registernummer": "HRB 14365",
      "registerart": "HRB",
      "company_name": "Green Power GmbH",
      "company_seat": "Regensburg",
      "details": "05.02.2026 (Bekanntmachungsdatum)\n\nBayern Amtsgericht Regensburg HRB 14365\nLöschungsankündigung 04.02.2026 (Eintragungsdatum)\n\nGreen Power GmbH\nGesellschaft mit beschränkter Haftung\nRegensburg\n\nDas Registergericht beabsichtigt, die im Handelsregister eingetragene Gesellschaft wegen Vermögenslosigkeit von Amts wegen nach § 394 FamFG zu löschen. Die Frist zur Erhebung eines Widerspruchs ist auf zwei Monate festgesetzt."
    },
    {
      "date": "2026-02-05",
      "id": "144366",
      "original_text": "Registerbekanntmachung nach dem Umwandlungsgesetz\nBayern Amtsgericht München GsR 38\nRoggermaier Immo eGbR – Aschheim",
      "type": "Registerbekanntmachung nach dem Umwandlungsgesetz",
      "state": "Bayern",
      "amtsgericht": "Amtsgericht München",
      "registernummer": "GsR 38",
      "registerart": "GsR",
      "company_name": "Roggermaier Immo eGbR",
      "company_seat": "Aschheim",
      "details": "05.02.2026 (Bekanntmachungsdatum)\n\nBayern Amtsgericht München GsR 38\nRegisterbekanntmachung nach dem Umwandlungsgesetz 04.02.2026 (Eintragungsdatum)\n\nRoggermaier Immo eGbR\nGesellschaft bürgerlichen Rechts\nAschheim\n\nDen Gläubigern des formwechselnden Rechtsträgers ist, wenn sie binnen sechs Monaten nach dem Tag, an dem die Eintragung des Formwechsels nach § 201 UmwG als bekannt gemacht gilt, ihren Anspruch nach Grund und Höhe in Textform anmelden, Sicherheit zu leisten, soweit sie nicht Befriedigung verlangen können. Dieses Recht steht den Gläubigern jedoch nur zu, wenn sie glaubhaft machen, dass durch den Formwechsel die Erfüllung ihrer Forderung gefährdet wird."
    },
    {
      "date": "2026-02-05",
      "id": "144367",
      "original_text": "Löschungsankündigung\nBayern Amtsgericht München HRB 52107\nAbwicklungsgesellschaft DKA GmbH – München",
      "type": "Löschungsankündigung",
      "state": "Bayern",
      "amtsgericht": "Amtsgericht München",
      "registernummer": "HRB 52107",
      "registerart": "HRB",
      "company_name": "Abwicklungsgesellschaft DKA GmbH",
      "company_seat": "München",
      "details": "05.02.2026 (Bekanntmachungsdatum)\n\nBayern Amtsgericht München HRB 52107\nLöschungsankündigung 04.02.2026 (Eintragungsdatum)\n\nAbwicklungsgesellschaft DKA GmbH\nGesellschaft mit beschränkter Haftung\nMünchen\n\nDas Registergericht beabsichtigt, die im Handelsregister eingetragene Gesellschaft wegen Vermögenslosigkeit von Amts wegen nach § 394 FamFG zu löschen. Die Frist zur Erhebung eines Widerspruchs ist auf drei Monate festgesetzt."
    },
    {
      "date": "2026-02-05",
      "id": "144368",
      "original_text": "Registerbekanntmachung nach dem Umwandlungsgesetz\nBayern Amtsgericht Kempten (Allgäu) HRA 10630\nDentallabor Bach KG – Marktoberdorf",
      "type": "Registerbekanntmachung nach dem Umwandlungsgesetz",
      "state": "Bayern",
      "amtsgericht": "Amtsgericht Kempten (Allgäu)",
      "registernummer": "HRA 10630",
      "registerart": "HRA",
      "company_name": "Dentallabor Bach KG",
      "company_seat": "Marktoberdorf",
      "details": "05.02.2026 (Bekanntmachungsdatum)\n\nBayern Amtsgericht Kempten (Allgäu) HRA 10630\nRegisterbekanntmachung nach dem Umwandlungsgesetz 04.02.2026 (Eintragungsdatum)\n\nDentallabor Bach KG\nKommanditgesellschaft\nMarktoberdorf\n\nDen Gläubigern des formwechselnden Rechtsträgers ist, wenn sie binnen sechs Monaten nach dem Tag, an dem die Eintragung des Formwechsels nach § 201 UmwG als bekannt gemacht gilt, ihren Anspruch nach Grund und Höhe in Textform anmelden, Sicherheit zu leisten, soweit sie nicht Befriedigung verlangen können. Dieses Recht steht den Gläubigern jedoch nur zu, wenn sie glaubhaft machen, dass durch den Formwechsel die Erfüllung ihrer Forderung gefährdet wird."
    },
    {
      "date": "2026-02-05",
      "id": "144369",
      "original_text": "Löschungsankündigung\nBayern Amtsgericht Aschaffenburg HRB 15809\nAres Beteiligungen UG (haftungsbeschränkt) – Erlenbach am Main",
      "type": "Löschungsankündigung",
      "state": "Bayern",
      "amtsgericht": "Amtsgericht Aschaffenburg",
      "registernummer": "HRB 15809",
      "registerart": "HRB",
      "company_name": "Ares Beteiligungen UG (haftungsbeschränkt)",
      "company_seat": "Erlenbach am Main",
      "details": "05.02.2026 (Bekanntmachungsdatum)\n\nBayern Amtsgericht Aschaffenburg HRB 15809\nLöschungsankündigung\n\nAres Beteiligungen UG (haftungsbeschränkt)\nGesellschaft mit beschränkter Haftung\nErlenbach am Main\n\nDas Registergericht beabsichtigt, die im Handelsregister eingetragene Gesellschaft wegen Vermögenslosigkeit von Amts wegen nach § 394 FamFG zu löschen. Die Frist zur Erhebung eines Widerspruchs ist auf drei Monate festgesetzt."
    },
    {
      "date": "2026-02-05",
      "id": "144370",
      "original_text": "Einreichung neuer Dokumente\nBayern Amtsgericht Passau HRB 6016\nLm-therm Elektrotechnik AG – Aldersbach",
      "type": "Einreichung neuer Dokumente",
      "state": "Bayern",
      "amtsgericht": "Amtsgericht Passau",
      "registernummer": "HRB 6016",
      "registerart": "HRB",
      "company_name": "Lm-therm Elektrotechnik AG",
      "company_seat": "Aldersbach",
      "details": "05.02.2026 (Bekanntmachungsdatum)\n\nBayern Amtsgericht Passau HRB 6016\nEinreichung neuer Dokumente 04.02.2026 (Eintragungsdatum)\n\nLm-therm Elektrotechnik AG\nAktiengesellschaft\nAldersbach\n\nDem #Re.Name ist eine Liste der Mitglieder des Aufsichtsrats eingereicht worden, § 106 AktG."
    },
    {
      "date": "2026-02-05",
      "id": "144371",
      "original_text": "Sonstige Registerbekanntmachung\nBayern Amtsgericht München HRB 267804\nThe Satin Crew GmbH – Gmund a.Tegernsee",
      "type": "Sonstige Registerbekanntmachung",
      "state": "Bayern",
      "amtsgericht": "Amtsgericht München",
      "registernummer": "HRB 267804",
      "registerart": "HRB",
      "company_name": "The Satin Crew GmbH",
      "company_seat": "Gmund a.Tegernsee",
      "details": "05.02.2026 (Bekanntmachungsdatum)\n\nBayern Amtsgericht München HRB 267804\nSonstige Registerbekanntmachung 04.02.2026 (Eintragungsdatum)\n\nThe Satin Crew GmbH\nGesellschaft mit beschränkter Haftung\nGmund a.Tegernsee\n\nDen Gläubigern der Gesellschaft, deren Forderungen begründet worden sind, bevor die Eintragung der Beendigung des Gewinnabführungsvertrages in das Handelsregister nach § 10 des Handelsgesetzbuches als bekanntgemacht gilt, hat der andere Vertragsteil Sicherheit zu leisten, wenn sie sich binnen sechs Monaten nach der Bekanntmachung der Eintragung zu diesem Zweck bei ihm melden."
    },
    {
      "date": "2026-02-05",
      "id": "144372",
      "original_text": "Einreichung neuer Dokumente\nBayern Amtsgericht München HRB 225439\nCelonis SE – München",
      "type": "Einreichung neuer Dokumente",
      "state": "Bayern",
      "amtsgericht": "Amtsgericht München",
      "registernummer": "HRB 225439",
      "registerart": "HRB",
      "company_name": "Celonis SE",
      "company_seat": "München",
      "details": "05.02.2026 (Bekanntmachungsdatum)\n\nBayern Amtsgericht München HRB 225439\nEinreichung neuer Dokumente\n\nCelonis SE\nEuropäische Aktiengesellschaft (SE)\nMünchen\n\nDem Amtsgericht München -Registergericht- ist eine Liste der Mitglieder des Aufsichtsrats eingereicht worden, Art. 9 Abs. 1 Buchst. c (ii) SE-VO i.V.m. § 106 AktG."
    },
    {
      "date": "2026-02-05",
      "id": "144373",
      "original_text": "Registerbekanntmachung nach dem Umwandlungsgesetz\nBayern Amtsgericht Würzburg HRB 16095\nKai Meckelein GmbH – Uettingen",
      "type": "Registerbekanntmachung nach dem Umwandlungsgesetz",
      "state": "Bayern",
      "amtsgericht": "Amtsgericht Würzburg",
      "registernummer": "HRB 16095",
      "registerart": "HRB",
      "company_name": "Kai Meckelein GmbH",
      "company_seat": "Uettingen",
      "details": "05.02.2026 (Bekanntmachungsdatum)\n\nBayern Amtsgericht Würzburg HRB 16095\nRegisterbekanntmachung nach dem Umwandlungsgesetz 04.02.2026 (Eintragungsdatum)\n\nKai Meckelein GmbH\nGesellschaft mit beschränkter Haftung\nUettingen\n\nDen Gläubigern des formwechselnden Rechtsträgers ist, wenn sie binnen sechs Monaten nach dem Tag, an dem die Eintragung des Formwechsels nach § 201 UmwG als bekannt gemacht gilt, ihren Anspruch nach Grund und Höhe in Textform anmelden, Sicherheit zu leisten, soweit sie nicht Befriedigung verlangen können. Dieses Recht steht den Gläubigern jedoch nur zu, wenn sie glaubhaft machen, dass durch den Formwechsel die Erfüllung ihrer Forderung gefährdet wird."
    },
    {
      "date": "2026-02-05",
      "id": "144374",
      "original_text": "Einreichung neuer Dokumente\nBayern Amtsgericht Bamberg HRB 5601\nSPL Powerlines Germany GmbH – Forchheim",
      "type": "Einreichung neuer Dokumente",
      "state": "Bayern",
      "amtsgericht": "Amtsgericht Bamberg",
      "registernummer": "HRB 5601",
      "registerart": "HRB",
      "company_name": "SPL Powerlines Germany GmbH",
      "company_seat": "Forchheim",
      "details": "05.02.2026 (Bekanntmachungsdatum)\n\nBayern Amtsgericht Bamberg HRB 5601\nEinreichung neuer Dokumente 04.02.2026 (Eintragungsdatum)\n\nSPL Powerlines Germany GmbH\nGesellschaft mit beschränkter Haftung\nForchheim\n\nDem Amtsgericht Bamberg -Registergericht- ist eine Liste der Mitglieder des Aufsichtsrats eingereicht worden, § 52 Abs. 3 S. 2 GmbHG."
    },
    {
      "date": "2026-02-05",
      "id": "144375",
      "original_text": "Löschungsankündigung\nBayern Amtsgericht Nürnberg HRB 27289\nLPL24 - Löhlein+Pukowski Logistics und Services UG (haftungsbeschränkt) – Nürnberg",
      "type": "Löschungsankündigung",
      "state": "Bayern",
      "amtsgericht": "Amtsgericht Nürnberg",
      "registernummer": "HRB 27289",
      "registerart": "HRB",
      "company_name": "LPL24 - Löhlein+Pukowski Logistics und Services UG (haftungsbeschränkt)",
      "company_seat": "Nürnberg",
      "details": "05.02.2026 (Bekanntmachungsdatum)\n\nBayern Amtsgericht Nürnberg HRB 27289\nLöschungsankündigung\n\nLPL24 - Löhlein+Pukowski Logistics und Services UG (haftungsbeschränkt)\nGesellschaft mit beschränkter Haftung\nNürnberg\n\nDas Registergericht beabsichtigt, die im Handelsregister eingetragene Gesellschaft wegen Vermögenslosigkeit von Amts wegen nach § 394 FamFG zu löschen. Die Frist zur Erhebung eines Widerspruchs ist auf einen Monat festgesetzt."
    },
    {
      "date": "2026-02-05",
      "id": "144376",
      "original_text": "Einreichung neuer Dokumente\nBayern Amtsgericht Nürnberg HRB 25279\nPfleiderer Deutschland GmbH – Neumarkt i.d.OPf.",
      "type": "Einreichung neuer Dokumente",
      "state": "Bayern",
      "amtsgericht": "Amtsgericht Nürnberg",
      "registernummer": "HRB 25279",
      "registerart": "HRB",
      "company_name": "Pfleiderer Deutschland GmbH",
      "company_seat": "Neumarkt i.d.OPf.",
      "details": "05.02.2026 (Bekanntmachungsdatum)\n\nBayern Amtsgericht Nürnberg HRB 25279\nEinreichung neuer Dokumente\n\nPfleiderer Deutschland GmbH\nGesellschaft mit beschränkter Haftung\nNeumarkt i.d.OPf.\n\nDem Amtsgericht Nürnberg -Registergericht- ist eine Liste der Mitglieder des Aufsichtsrats eingereicht worden, § 52 Abs. 3 S. 2 GmbHG."
    },
    {
      "date": "2026-02-05",
      "id": "144377",
      "original_text": "Registerbekanntmachung nach dem Umwandlungsgesetz\nBayern Amtsgericht Augsburg HRB 39927\nTK Vermögensverwaltung GmbH – Gersthofen",
      "type": "Registerbekanntmachung nach dem Umwandlungsgesetz",
      "state": "Bayern",
      "amtsgericht": "Amtsgericht Augsburg",
      "registernummer": "HRB 39927",
      "registerart": "HRB",
      "company_name": "TK Vermögensverwaltung GmbH",
      "company_seat": "Gersthofen",
      "details": "05.02.2026 (Bekanntmachungsdatum)\n\nBayern Amtsgericht Augsburg HRB 39927\nRegisterbekanntmachung nach dem Umwandlungsgesetz 04.02.2026 (Eintragungsdatum)\n\nTK Vermögensverwaltung GmbH\nGesellschaft mit beschränkter Haftung\nGersthofen\n\nDen Gläubigern der an der Verschmelzung beteiligten Rechtsträger ist, wenn sie binnen sechs Monaten nach dem Tag, an dem die Eintragung der Verschmelzung in das Register des Sitzes desjenigen Rechtsträgers, dessen Gläubiger sie sind, nach § 19 Abs. 3 UmwG als bekannt gemacht gilt, ihren Anspruch nach Grund und Höhe in Textform anmelden, Sicherheit zu leisten, soweit sie nicht Befriedigung verlangen können. Dieses Recht steht den Gläubigern jedoch nur zu, wenn sie glaubhaft machen, dass durch die Verschmelzung die Erfüllung ihrer Forderung gefährdet wird."
    },
    {
      "date": "2026-02-05",
      "id": "144378",
      "original_text": "Registerbekanntmachung nach dem Umwandlungsgesetz\nBayern Amtsgericht München HRB 308074\nMiet Event GmbH – Krailling",
      "type": "Registerbekanntmachung nach dem Umwandlungsgesetz",
      "state": "Bayern",
      "amtsgericht": "Amtsgericht München",
      "registernummer": "HRB 308074",
      "registerart": "HRB",
      "company_name": "Miet Event GmbH",
      "company_seat": "Krailling",
      "details": "05.02.2026 (Bekanntmachungsdatum)\n\nBayern Amtsgericht München HRB 308074\nRegisterbekanntmachung nach dem Umwandlungsgesetz 04.02.2026 (Eintragungsdatum)\n\nMiet Event GmbH\nGesellschaft mit beschränkter Haftung\nKrailling\n\nDen Gläubigern der an der Ausgliederung beteiligten Rechtsträger ist, wenn sie binnen sechs Monaten nach dem Tag, an dem die Eintragung der Ausgliederung in das Register des Sitzes desjenigen Rechtsträgers, dessen Gläubiger sie sind, nach §§ 125, 19 Abs. 3 UmwG als bekannt gemacht gilt, ihren Anspruch nach Grund und Höhe in Textform anmelden, Sicherheit zu leisten, soweit sie nicht Befriedigung verlangen können. Dieses Recht steht den Gläubigern jedoch nur zu, wenn sie glaubhaft machen, dass durch die Ausgliederung die Erfüllung ihrer Forderung gefährdet wird."
    },
    {
      "date": "2026-02-05",
      "id": "144379",
      "original_text": "Registerbekanntmachung nach dem Umwandlungsgesetz\nBayern Amtsgericht Würzburg GnR 293\nKai Meckelein eG – Uettingen",
      "type": "Registerbekanntmachung nach dem Umwandlungsgesetz",
      "state": "Bayern",
      "amtsgericht": "Amtsgericht Würzburg",
      "registernummer": "GnR 293",
      "registerart": "GnR",
      "company_name": "Kai Meckelein eG",
      "company_seat": "Uettingen",
      "details": "05.02.2026 (Bekanntmachungsdatum)\n\nBayern Amtsgericht Würzburg GnR 293\nRegisterbekanntmachung nach dem Umwandlungsgesetz 04.02.2026 (Eintragungsdatum)\n\nKai Meckelein eG\neingetragene Genossenschaft\nUettingen\n\nDen Gläubigern des formwechselnden Rechtsträgers ist, wenn sie binnen sechs Monaten nach dem Tag, an dem die Eintragung des Formwechsels nach § 201 UmwG als bekannt gemacht gilt, ihren Anspruch nach Grund und Höhe in Textform anmelden, Sicherheit zu leisten, soweit sie nicht Befriedigung verlangen können. Dieses Recht steht den Gläubigern jedoch nur zu, wenn sie glaubhaft machen, dass durch den Formwechsel die Erfüllung ihrer Forderung gefährdet wird."
    },
    {
      "date": "2026-02-05",
      "id": "144380",
      "original_text": "Einreichung neuer Dokumente\nBayern Amtsgericht Nürnberg HRB 22863\nconplement AG – Nürnberg",
      "type": "Einreichung neuer Dokumente",
      "state": "Bayern",
      "amtsgericht": "Amtsgericht Nürnberg",
      "registernummer": "HRB 22863",
      "registerart": "HRB",
      "company_name": "conplement AG",
      "company_seat": "Nürnberg",
      "details": "05.02.2026 (Bekanntmachungsdatum)\n\nBayern Amtsgericht Nürnberg HRB 22863\nEinreichung neuer Dokumente 04.02.2026 (Eintragungsdatum)\n\nconplement AG\nAktiengesellschaft\nNürnberg\n\nDem Amtsgericht Nürnberg -Registergericht- ist eine Liste der Mitglieder des Aufsichtsrats eingereicht worden, § 106 AktG."
    },
    {
      "date": "2026-02-05",
      "id": "144381",
      "original_text": "Registerbekanntmachung nach dem Umwandlungsgesetz\nBayern Amtsgericht München HRB 245548\nAURELIUS Development Sixteen GmbH – Grünwald",
      "type": "Registerbekanntmachung nach dem Umwandlungsgesetz",
      "state": "Bayern",
      "amtsgericht": "Amtsgericht München",
      "registernummer": "HRB 245548",
      "registerart": "HRB",
      "company_name": "AURELIUS Development Sixteen GmbH",
      "company_seat": "Grünwald",
      "details": "05.02.2026 (Bekanntmachungsdatum)\n\nBayern Amtsgericht München HRB 245548\nRegisterbekanntmachung nach dem Umwandlungsgesetz 04.02.2026 (Eintragungsdatum)\n\nAURELIUS Development Sixteen GmbH\nGesellschaft mit beschränkter Haftung\nGrünwald\n\nDen Gläubigern des formwechselnden Rechtsträgers ist, wenn sie binnen sechs Monaten nach dem Tag, an dem die Eintragung des Formwechsels nach § 201 UmwG als bekannt gemacht gilt, ihren Anspruch nach Grund und Höhe in Textform anmelden, Sicherheit zu leisten, soweit sie nicht Befriedigung verlangen können. Dieses Recht steht den Gläubigern jedoch nur zu, wenn sie glaubhaft machen, dass durch den Formwechsel die Erfüllung ihrer Forderung gefährdet wird."
    },
    {
      "date": "2026-02-05",
      "id": "144382",
      "original_text": "Einreichung neuer Dokumente\nBayern Amtsgericht Kempten (Allgäu) HRB 12226\nDACHSER Verwaltungs-SE – Kempten (Allgäu)",
      "type": "Einreichung neuer Dokumente",
      "state": "Bayern",
      "amtsgericht": "Amtsgericht Kempten (Allgäu)",
      "registernummer": "HRB 12226",
      "registerart": "HRB",
      "company_name": "DACHSER Verwaltungs-SE",
      "company_seat": "Kempten (Allgäu)",
      "details": "05.02.2026 (Bekanntmachungsdatum)\n\nBayern Amtsgericht Kempten (Allgäu) HRB 12226\nEinreichung neuer Dokumente 28.01.2026 (Eintragungsdatum)\n\nDACHSER Verwaltungs-SE\nEuropäische Aktiengesellschaft (SE)\nKempten (Allgäu)\n\nDem Amtsgericht Kempten (Allgäu) -Registergericht- ist eine Liste der Mitglieder des Aufsichtsrats eingereicht worden, Art. 9 Abs. 1 Buchst. c (ii) SE-VO i.V.m. § 106 AktG."
    },
    {
      "date": "2026-02-05",
      "id": "144383",
      "original_text": "Löschungsankündigung\nBaden-Württemberg Amtsgericht Freiburg HRB 711947\nPPC Baden GmbH – Offenburg",
      "type": "Löschungsankündigung",
      "state": "Baden-Württemberg",
      "amtsgericht": "Amtsgericht Freiburg",
      "registernummer": "HRB 711947",
      "registerart": "HRB",
      "company_name": "PPC Baden GmbH",
      "company_seat": "Offenburg",
      "details": "05.02.2026 (Bekanntmachungsdatum)\n\nBaden-Württemberg Amtsgericht Freiburg HRB 711947\nLöschungsankündigung 05.02.2026 (Eintragungsdatum)\n\nPPC Baden GmbH\nGesellschaft mit beschränkter Haftung\nOffenburg\n\nAls nicht eingetragen wird bekanntgemacht:\nDas Gericht beabsichtigt, die Gesellschaft wegen Vermögenslosigkeit im Handelsregister von Amts wegen nach § 394 FamFG zu löschen. Die Frist zur Geltendmachung eines Widerspruchs gegen die beabsichtigte Löschung ist auf einen Monat ab Veröffentlichung bestimmt."
    },
    {
      "date": "2026-02-05",
      "id": "144384",
      "original_text": "Löschungsankündigung\nMecklenburg-Vorpommern Amtsgericht Rostock HRB 4024\nMIW Motorenwerke GmbH – Güstrow",
      "type": "Löschungsankündigung",
      "state": "Mecklenburg-Vorpommern",
      "amtsgericht": "Amtsgericht Rostock",
      "registernummer": "HRB 4024",
      "registerart": "HRB",
      "company_name": "MIW Motorenwerke GmbH",
      "company_seat": "Güstrow",
      "details": "05.02.2026 (Bekanntmachungsdatum)\n\nMecklenburg-Vorpommern Amtsgericht Rostock HRB 4024\nLöschungsankündigung\n\nMIW Motorenwerke GmbH\nGesellschaft mit beschränkter Haftung\nGüstrow\n\nDas Registergericht beabsichtigt, die im Handelsregister eingetragene Gesellschaft von Amts wegen nach § 394 FamFG zu löschen. Die Frist zur Erhebung eines Widerspruchs gegen die beabsichtigte Löschung wird auf 1 Monat festgesetzt."
    },
    {
      "date": "2026-02-05",
      "id": "144385",
      "original_text": "Registerbekanntmachung nach dem Umwandlungsgesetz\nBaden-Württemberg Amtsgericht Freiburg HRB 734892\nLoudin Immobilien GmbH – Freiburg im Breisgau",
      "type": "Registerbekanntmachung nach dem Umwandlungsgesetz",
      "state": "Baden-Württemberg",
      "amtsgericht": "Amtsgericht Freiburg",
      "registernummer": "HRB 734892",
      "registerart": "HRB",
      "company_name": "Loudin Immobilien GmbH",
      "company_seat": "Freiburg im Breisgau",
      "details": "05.02.2026 (Bekanntmachungsdatum)\n\nBaden-Württemberg Amtsgericht Freiburg HRB 734892\nRegisterbekanntmachung nach dem Umwandlungsgesetz 05.02.2026 (Eintragungsdatum)\n\nLoudin Immobilien GmbH\nGesellschaft mit beschränkter Haftung\nFreiburg im Breisgau\n\nAls nicht eingetragen wird bekanntgemacht:\nDen Gläubigern der an der Ausgliederung beteiligten Rechtsträger ist, wenn sie binnen sechs Monaten nach dem Tag, an dem die Eintragung der Ausgliederung in das Register des Sitzes desjenigen Rechtsträgers, dessen Gläubiger sie sind, nach § 19 Abs. 3 UmwG als bekanntgemacht gilt, ihren Anspruch nach Grund und Höhe schriftlich anmelden, Sicherheit zu leisten, soweit sie nicht Befriedigung verlangen können. Dieses Recht steht den Gläubigern jedoch nur zu, wenn sie glaubhaft machen, dass durch die Ausgliederung die Erfüllung ihrer Forderung gefährdet wird."
    },
    {
      "date": "2026-02-05",
      "id": "144386",
      "original_text": "Löschungsankündigung\nBerlin Amtsgericht Berlin (Charlottenburg) HRB 118944\nEKS Immobilien-Projekte GmbH – Berlin",
      "type": "Löschungsankündigung",
      "state": "Berlin",
      "amtsgericht": "Amtsgericht Berlin (Charlottenburg)",
      "registernummer": "HRB 118944",
      "registerart": "HRB",
      "company_name": "EKS Immobilien-Projekte GmbH",
      "company_seat": "Berlin",
      "details": "05.02.2026 (Bekanntmachungsdatum)\n\nBerlin Amtsgericht Berlin (Charlottenburg) HRB 118944\nLöschungsankündigung\n\nEKS Immobilien-Projekte GmbH\nGesellschaft mit beschränkter Haftung\nBerlin\n\nBei der nachstehenden Gesellschaft wird das Amtslöschungsverfahren gemäß § 394 FamFG eingeleitet. Widerspruchsfrist 6 Wochen"
    },
    {
      "date": "2026-02-05",
      "id": "144387",
      "original_text": "Löschungsankündigung\nBerlin Amtsgericht Berlin (Charlottenburg) HRB 195943\nKurt Gastro GmbH – Berlin",
      "type": "Löschungsankündigung",
      "state": "Berlin",
      "amtsgericht": "Amtsgericht Berlin (Charlottenburg)",
      "registernummer": "HRB 195943",
      "registerart": "HRB",
      "company_name": "Kurt Gastro GmbH",
      "company_seat": "Berlin",
      "details": "05.02.2026 (Bekanntmachungsdatum)\n\nBerlin Amtsgericht Berlin (Charlottenburg) HRB 195943\nLöschungsankündigung\n\nKurt Gastro GmbH\nGesellschaft mit beschränkter Haftung\nBerlin\n\nBei der nachstehenden Gesellschaft wird das Amtslöschungsverfahren gemäß § 394 FamFG eingeleitet. Widerspruchsfrist 6 Wochen"
    },
    {
      "date": "2026-02-05",
      "id": "144388",
      "original_text": "Registerbekanntmachung nach dem Umwandlungsgesetz\nBaden-Württemberg Amtsgericht Freiburg HRA 709375\nMansur Loudin Immobilien e.K. – Freiburg im Breisgau",
      "type": "Registerbekanntmachung nach dem Umwandlungsgesetz",
      "state": "Baden-Württemberg",
      "amtsgericht": "Amtsgericht Freiburg",
      "registernummer": "HRA 709375",
      "registerart": "HRA",
      "company_name": "Mansur Loudin Immobilien e.K.",
      "company_seat": "Freiburg im Breisgau",
      "details": "05.02.2026 (Bekanntmachungsdatum)\n\nBaden-Württemberg Amtsgericht Freiburg HRA 709375\nRegisterbekanntmachung nach dem Umwandlungsgesetz 05.02.2026 (Eintragungsdatum)\n\nMansur Loudin Immobilien e.K.\nEinzelkaufmann / Einzelkauffrau\nFreiburg im Breisgau\n\nAls nicht eingetragen wird bekanntgemacht:\nDen Gläubigern der an der Ausgliederung beteiligten Rechtsträger ist, wenn sie binnen sechs Monaten nach dem Tag, an dem die Eintragung der Ausgliederung in das Register des Sitzes desjenigen Rechtsträgers, dessen Gläubiger sie sind, nach § 19 Abs. 3 UmwG als bekanntgemacht gilt, ihren Anspruch nach Grund und Höhe schriftlich anmelden, Sicherheit zu leisten, soweit sie nicht Befriedigung verlangen können. Dieses Recht steht den Gläubigern jedoch nur zu, wenn sie glaubhaft machen, dass durch die Ausgliederung die Erfüllung ihrer Forderung gefährdet wird."
    },
    {
      "date": "2026-02-05",
      "id": "144389",
      "original_text": "Einreichung neuer Dokumente\nSchleswig-Holstein Amtsgericht Pinneberg HRB 651\nUNION AGRICOLE HOLDING Aktiengesellschaft – Pinneberg",
      "type": "Einreichung neuer Dokumente",
      "state": "Schleswig-Holstein",
      "amtsgericht": "Amtsgericht Pinneberg",
      "registernummer": "HRB 651",
      "registerart": "HRB",
      "company_name": "UNION AGRICOLE HOLDING Aktiengesellschaft",
      "company_seat": "Pinneberg",
      "details": "05.02.2026 (Bekanntmachungsdatum)\n\nSchleswig-Holstein Amtsgericht Pinneberg HRB 651\nEinreichung neuer Dokumente\n\nUNION AGRICOLE HOLDING Aktiengesellschaft\nAktiengesellschaft\nPinneberg\n\nAls nicht eingetragen wird veröffentlicht: Es ist eine neue Liste der Aufsichtsratsmitglieder gemäß § 106 2. Hs. AktG i.V.m. § 10 HGB zum Handelsregister eingereicht worden."
    },
    {
      "date": "2026-02-05",
      "id": "144390",
      "original_text": "Löschungsankündigung\nBerlin Amtsgericht Berlin (Charlottenburg) HRB 265049\nTraumstoff UG (haftungsbeschränkt) – Berlin",
      "type": "Löschungsankündigung",
      "state": "Berlin",
      "amtsgericht": "Amtsgericht Berlin (Charlottenburg)",
      "registernummer": "HRB 265049",
      "registerart": "HRB",
      "company_name": "Traumstoff UG (haftungsbeschränkt)",
      "company_seat": "Berlin",
      "details": "05.02.2026 (Bekanntmachungsdatum)\n\nBerlin Amtsgericht Berlin (Charlottenburg) HRB 265049\nLöschungsankündigung\n\nTraumstoff UG (haftungsbeschränkt)\nGesellschaft mit beschränkter Haftung\nBerlin\n\nBei der nachstehenden Gesellschaft wird das Amtslöschungsverfahren gemäß § 394 FamFG eingeleitet. Widerspruchsfrist 6 Wochen"
    },
    {
      "date": "2026-02-05",
      "id": "144391",
      "original_text": "Löschungsankündigung\nBerlin Amtsgericht Berlin (Charlottenburg) HRB 155158\nP. Burck GmbH – Berlin",
      "type": "Löschungsankündigung",
      "state": "Berlin",
      "amtsgericht": "Amtsgericht Berlin (Charlottenburg)",
      "registernummer": "HRB 155158",
      "registerart": "HRB",
      "company_name": "P. Burck GmbH",
      "company_seat": "Berlin",
      "details": "05.02.2026 (Bekanntmachungsdatum)\n\nBerlin Amtsgericht Berlin (Charlottenburg) HRB 155158\nLöschungsankündigung\n\nP. Burck GmbH\nGesellschaft mit beschränkter Haftung\nBerlin\n\nBei der nachstehenden Gesellschaft wird das Amtslöschungsverfahren gemäß § 394 FamFG eingeleitet. Widerspruchsfrist 6 Wochen"
    },
    {
      "date": "2026-02-05",
      "id": "144392",
      "original_text": "Einreichung neuer Dokumente\nBerlin Amtsgericht Berlin (Charlottenburg) HRB 112678\nspectrumK GmbH – Berlin",
      "type": "Einreichung neuer Dokumente",
      "state": "Berlin",
      "amtsgericht": "Amtsgericht Berlin (Charlottenburg)",
      "registernummer": "HRB 112678",
      "registerart": "HRB",
      "company_name": "spectrumK GmbH",
      "company_seat": "Berlin",
      "details": "05.02.2026 (Bekanntmachungsdatum)\n\nBerlin Amtsgericht Berlin (Charlottenburg) HRB 112678\nEinreichung neuer Dokumente\n\nspectrumK GmbH\nGesellschaft mit beschränkter Haftung\nBerlin\n\nAls nicht eingetragen wird veröffentlicht: Es wurde eine neue Liste der Aufsichtsratsmitglieder eingereicht (§52 GmbHG)."
    },
    {
      "date": "2026-02-05",
      "id": "144393",
      "original_text": "Registerbekanntmachung nach dem Umwandlungsgesetz\nBerlin Amtsgericht Berlin (Charlottenburg) HRA 48975\nResort Zum Kranichsee GmbH & Co. Loipenhaus KG – Berlin",
      "type": "Registerbekanntmachung nach dem Umwandlungsgesetz",
      "state": "Berlin",
      "amtsgericht": "Amtsgericht Berlin (Charlottenburg)",
      "registernummer": "HRA 48975",
      "registerart": "HRA",
      "company_name": "Resort Zum Kranichsee GmbH & Co. Loipenhaus KG",
      "company_seat": "Berlin",
      "details": "05.02.2026 (Bekanntmachungsdatum)\n\nBerlin Amtsgericht Berlin (Charlottenburg) HRA 48975\nRegisterbekanntmachung nach dem Umwandlungsgesetz 04.02.2026 (Eintragungsdatum)\n\nResort Zum Kranichsee GmbH & Co. Loipenhaus KG\nKommanditgesellschaft\nBerlin\n\nZu Eintragungsnummer 7 vom 04.02.2026 wird als nicht eingetragen veröffentlicht: Den Gläubigern der an der Verschmelzung beteiligten Rechtsträger ist, wenn sie binnen sechs Monaten nach dem Tag, an dem die Eintragung der Verschmelzung in das Register des Sitzes desjenigen Rechtsträgers, dessen Gläubiger sie sind, als bekannt gemacht gilt, ihren Anspruch nach Grund und Höhe schriftlich anmelden, Sicherheit zu leisten, soweit sie nicht Befriedigung verlangen können. Dieses Recht steht den Gläubigern jedoch nur zu, wenn sie glaubhaft machen, dass durch die Verschmelzung die Erfüllung ihrer Forderung gefährdet wird. Das Recht, Sicherheitsleistung zu verlangen, steht Gläubigern nicht zu, die im Falle der Insolvenz ein Recht auf vorzugsweise Befriedigung aus einer Deckungsmasse haben, die nach gesetzlicher Vorschrift zu ihrem Schutz errichtet und staatlich überwacht ist."
    },
    {
      "date": "2026-02-05",
      "id": "144394",
      "original_text": "Registerbekanntmachung nach dem Umwandlungsgesetz\nBaden-Württemberg Amtsgericht Ulm HRB 650078\nHans Dinslage GmbH – Uttenweiler",
      "type": "Registerbekanntmachung nach dem Umwandlungsgesetz",
      "state": "Baden-Württemberg",
      "amtsgericht": "Amtsgericht Ulm",
      "registernummer": "HRB 650078",
      "registerart": "HRB",
      "company_name": "Hans Dinslage GmbH",
      "company_seat": "Uttenweiler",
      "details": "05.02.2026 (Bekanntmachungsdatum)\n\nBaden-Württemberg Amtsgericht Ulm HRB 650078\nRegisterbekanntmachung nach dem Umwandlungsgesetz 05.02.2026 (Eintragungsdatum)\n\nHans Dinslage GmbH\nGesellschaft mit beschränkter Haftung\nUttenweiler\n\nDen Gläubigern der an der Verschmelzung beteiligten Rechtsträger ist, wenn sie binnen sechs Monaten nach dem Tag, an dem die Eintragung der Verschmelzung in das Register des Sitzes desjenigen Rechtsträgers, dessen Gläubiger sie sind, nach § 19 Abs. 3 UmwG als bekanntgemacht gilt, ihren Anspruch nach Grund und Höhe schriftlich anmelden, Sicherheit zu leisten, soweit sie nicht Befriedigung verlangen können. Dieses Recht steht den Gläubigern jedoch nur zu, wenn sie glaubhaft machen, dass durch die Verschmelzung die Erfüllung ihrer Forderung gefährdet wird."
    },
    {
      "date": "2026-02-05",
      "id": "144395",
      "original_text": "Registerbekanntmachung nach dem Umwandlungsgesetz\nBerlin Amtsgericht Berlin (Charlottenburg) HRA 47820\nResort Zum Kranichsee GmbH & Co. Immobilien KG – Berlin",
      "type": "Registerbekanntmachung nach dem Umwandlungsgesetz",
      "state": "Berlin",
      "amtsgericht": "Amtsgericht Berlin (Charlottenburg)",
      "registernummer": "HRA 47820",
      "registerart": "HRA",
      "company_name": "Resort Zum Kranichsee GmbH & Co. Immobilien KG",
      "company_seat": "Berlin",
      "details": "05.02.2026 (Bekanntmachungsdatum)\n\nBerlin Amtsgericht Berlin (Charlottenburg) HRA 47820\nRegisterbekanntmachung nach dem Umwandlungsgesetz 04.02.2026 (Eintragungsdatum)\n\nResort Zum Kranichsee GmbH & Co. Immobilien KG\nKommanditgesellschaft\nBerlin\n\nZu Eintragungsnummer 7 vom 04.02.2026 wird als nicht eingetragen veröffentlicht: Den Gläubigern der an der Verschmelzung beteiligten Rechtsträger ist, wenn sie binnen sechs Monaten nach dem Tag, an dem die Eintragung der Verschmelzung in das Register des Sitzes desjenigen Rechtsträgers, dessen Gläubiger sie sind, als bekannt gemacht gilt, ihren Anspruch nach Grund und Höhe schriftlich anmelden, Sicherheit zu leisten, soweit sie nicht Befriedigung verlangen können. Dieses Recht steht den Gläubigern jedoch nur zu, wenn sie glaubhaft machen, dass durch die Verschmelzung die Erfüllung ihrer Forderung gefährdet wird. Das Recht, Sicherheitsleistung zu verlangen, steht Gläubigern nicht zu, die im Falle der Insolvenz ein Recht auf vorzugsweise Befriedigung aus einer Deckungsmasse haben, die nach gesetzlicher Vorschrift zu ihrem Schutz errichtet und staatlich überwacht ist."
    },
    {
      "date": "2026-02-05",
      "id": "144396",
      "original_text": "Löschungsankündigung\nBerlin Amtsgericht Berlin (Charlottenburg) HRB 187850\nBEKA Wisch & Weg GmbH – Berlin",
      "type": "Löschungsankündigung",
      "state": "Berlin",
      "amtsgericht": "Amtsgericht Berlin (Charlottenburg)",
      "registernummer": "HRB 187850",
      "registerart": "HRB",
      "company_name": "BEKA Wisch & Weg GmbH",
      "company_seat": "Berlin",
      "details": "05.02.2026 (Bekanntmachungsdatum)\n\nBerlin Amtsgericht Berlin (Charlottenburg) HRB 187850\nLöschungsankündigung\n\nBEKA Wisch & Weg GmbH\nGesellschaft mit beschränkter Haftung\nBerlin\n\nBei der nachstehenden Gesellschaft wird das Amtslöschungsverfahren gemäß § 394 FamFG eingeleitet. Widerspruchsfrist 6 Wochen"
    },
    {
      "date": "2026-02-05",
      "id": "144397",
      "original_text": "Einreichung neuer Dokumente\nBaden-Württemberg Amtsgericht Mannheim HRB 240219\nKommunalbau GmbH Gesellschaft für Stadterneuerung und Stadtentwicklung Bretten – Bretten",
      "type": "Einreichung neuer Dokumente",
      "state": "Baden-Württemberg",
      "amtsgericht": "Amtsgericht Mannheim",
      "registernummer": "HRB 240219",
      "registerart": "HRB",
      "company_name": "Kommunalbau GmbH Gesellschaft für Stadterneuerung und Stadtentwicklung Bretten",
      "company_seat": "Bretten",
      "details": "05.02.2026 (Bekanntmachungsdatum)\n\nBaden-Württemberg Amtsgericht Mannheim HRB 240219\nEinreichung neuer Dokumente\n\nKommunalbau GmbH Gesellschaft für Stadterneuerung und Stadtentwicklung Bretten\nGesellschaft mit beschränkter Haftung\nBretten\n\nDie Gesellschaft hat am 02.02.2026 die Liste über die Zusammensetzung des Aufsichtsrats zum Handelsregister eingereicht."
    },
    {
      "date": "2026-02-05",
      "id": "144398",
      "original_text": "Löschungsankündigung\nBerlin Amtsgericht Berlin (Charlottenburg) HRA 61912\nPlacil Betten GmbH & Co. KG – Berlin",
      "type": "Löschungsankündigung",
      "state": "Berlin",
      "amtsgericht": "Amtsgericht Berlin (Charlottenburg)",
      "registernummer": "HRA 61912",
      "registerart": "HRA",
      "company_name": "Placil Betten GmbH & Co. KG",
      "company_seat": "Berlin",
      "details": "05.02.2026 (Bekanntmachungsdatum)\n\nBerlin Amtsgericht Berlin (Charlottenburg) HRA 61912\nLöschungsankündigung\n\nPlacil Betten GmbH & Co. KG\nKommanditgesellschaft\nBerlin\n\nBei dem nachstehenden Unternehmen / der nachstehenden Gesellschaft wird das Amtslöschungsverfahren gemäß § 31 Abs. 2 HGB eingeleitet. Widerspruchsfrist 1 Monat"
    },
    {
      "date": "2026-02-05",
      "id": "144399",
      "original_text": "Löschungsankündigung\nBerlin Amtsgericht Berlin (Charlottenburg) HRB 105434\nSAPHIR Bau GmbH – Berlin",
      "type": "Löschungsankündigung",
      "state": "Berlin",
      "amtsgericht": "Amtsgericht Berlin (Charlottenburg)",
      "registernummer": "HRB 105434",
      "registerart": "HRB",
      "company_name": "SAPHIR Bau GmbH",
      "company_seat": "Berlin",
      "details": "05.02.2026 (Bekanntmachungsdatum)\n\nBerlin Amtsgericht Berlin (Charlottenburg) HRB 105434\nLöschungsankündigung\n\nSAPHIR Bau GmbH\nGesellschaft mit beschränkter Haftung\nBerlin\n\nEs ist beabsichtigt, die Eintragung des Geschäftsführers Tevfik Öztürk wegen Mangels einer wesentlichen Voraussetzung gemäß § 395 FamFG von Amts wegen zu löschen. Widerspruchsfrist 2 Wochen"
    },
    {
      "date": "2026-02-05",
      "id": "144400",
      "original_text": "Registerbekanntmachung nach dem Umwandlungsgesetz\nHamburg Amtsgericht Hamburg HRB 159246\nAllgemeiner Feuerschutz AFS UG (haftungsbeschränkt) – Hamburg",
      "type": "Registerbekanntmachung nach dem Umwandlungsgesetz",
      "state": "Hamburg",
      "amtsgericht": "Amtsgericht Hamburg",
      "registernummer": "HRB 159246",
      "registerart": "HRB",
      "company_name": "Allgemeiner Feuerschutz AFS UG (haftungsbeschränkt)",
      "company_seat": "Hamburg",
      "details": "05.02.2026 (Bekanntmachungsdatum)\n\nHamburg Amtsgericht Hamburg HRB 159246\nRegisterbekanntmachung nach dem Umwandlungsgesetz 05.02.2026 (Eintragungsdatum)\n\nAllgemeiner Feuerschutz AFS UG (haftungsbeschränkt)\nGesellschaft mit beschränkter Haftung\nHamburg\n\nAls nicht eingetragen wird bekannt gemacht:\nDen Gläubigern der an der formwechselnden Umwandlung beteiligten Gesellschaften ist, wenn sie binnen sechs Monaten nach dem Tag, an dem die Eintragung der formwechselnden Umwandlung in das Register des Sitzes desjenigen Rechtsträgers, dessen Gläubiger sie sind, nach § 19 Absatz 3 UmwG als bekannt gemacht gilt, ihren Anspruch nach Grund und Höhe schriftlich anmelden, Sicherheit zu leisten, soweit sie nicht Befriedigung verlangen können. Dieses Recht steht den Gläubigern jedoch nur zu, wenn sie glaubhaft machen, dass durch die formwechselnde Umwandlung die Erfüllung ihrer Forderung gefährdet wird."
    },
    {
      "date": "2026-02-05",
      "id": "144401",
      "original_text": "Sonstige Registerbekanntmachung\nBerlin Amtsgericht Berlin (Charlottenburg) HRB 5041\nBBB Bürgschaftsbank zu Berlin-Brandenburg GmbH – Berlin",
      "type": "Sonstige Registerbekanntmachung",
      "state": "Berlin",
      "amtsgericht": "Amtsgericht Berlin (Charlottenburg)",
      "registernummer": "HRB 5041",
      "registerart": "HRB",
      "company_name": "BBB Bürgschaftsbank zu Berlin-Brandenburg GmbH",
      "company_seat": "Berlin",
      "details": "05.02.2026 (Bekanntmachungsdatum)\n\nBerlin Amtsgericht Berlin (Charlottenburg) HRB 5041\nSonstige Registerbekanntmachung\n\nBBB Bürgschaftsbank zu Berlin-Brandenburg GmbH\nGesellschaft mit beschränkter Haftung\nBerlin\n\nAls nicht eingetragen wird veröffentlicht:Es wurde eine neue Liste der Aufsichtsratsmitglieder eingereicht (§52 GmbHG)."
    },
    {
      "date": "2026-02-05",
      "id": "144402",
      "original_text": "Einreichung neuer Dokumente\nBerlin Amtsgericht Berlin (Charlottenburg) HRB 194757\nInter Stadt- und Wohnungsbau Real Estate AG – Berlin",
      "type": "Einreichung neuer Dokumente",
      "state": "Berlin",
      "amtsgericht": "Amtsgericht Berlin (Charlottenburg)",
      "registernummer": "HRB 194757",
      "registerart": "HRB",
      "company_name": "Inter Stadt- und Wohnungsbau Real Estate AG",
      "company_seat": "Berlin",
      "details": "05.02.2026 (Bekanntmachungsdatum)\n\nBerlin Amtsgericht Berlin (Charlottenburg) HRB 194757\nEinreichung neuer Dokumente\n\nInter Stadt- und Wohnungsbau Real Estate AG\nAktiengesellschaft\nBerlin\n\nAls nicht eingetragen wird veröffentlicht: Es wurde eine neue Liste der Aufsichtsratsmitglieder eingereicht (§ 106 AktG)."
    },
    {
      "date": "2026-02-05",
      "id": "144403",
      "original_text": "Einreichung neuer Dokumente\nBaden-Württemberg Amtsgericht Ulm HRB 736132\nFinedining Topco GmbH – Geislingen an der Steige",
      "type": "Einreichung neuer Dokumente",
      "state": "Baden-Württemberg",
      "amtsgericht": "Amtsgericht Ulm",
      "registernummer": "HRB 736132",
      "registerart": "HRB",
      "company_name": "Finedining Topco GmbH",
      "company_seat": "Geislingen an der Steige",
      "details": "05.02.2026 (Bekanntmachungsdatum)\n\nBaden-Württemberg Amtsgericht Ulm HRB 736132\nEinreichung neuer Dokumente\n\nFinedining Topco GmbH\nGesellschaft mit beschränkter Haftung\nGeislingen an der Steige\n\nDie Gesellschaft hat am 04.02.2026 die Liste über die Zusammensetzung des Aufsichtsrats zum Handelsregister eingereicht."
    },
    {
      "date": "2026-02-05",
      "id": "144404",
      "original_text": "Registerbekanntmachung nach dem Umwandlungsgesetz\nBaden-Württemberg Amtsgericht Stuttgart HRB 22719\nFirst Data Mobile Solutions GmbH – Stuttgart",
      "type": "Registerbekanntmachung nach dem Umwandlungsgesetz",
      "state": "Baden-Württemberg",
      "amtsgericht": "Amtsgericht Stuttgart",
      "registernummer": "HRB 22719",
      "registerart": "HRB",
      "company_name": "First Data Mobile Solutions GmbH",
      "company_seat": "Stuttgart",
      "details": "05.02.2026 (Bekanntmachungsdatum)\n\nBaden-Württemberg Amtsgericht Stuttgart HRB 22719\nRegisterbekanntmachung nach dem Umwandlungsgesetz 05.02.2026 (Eintragungsdatum)\n\nFirst Data Mobile Solutions GmbH\nGesellschaft mit beschränkter Haftung\nStuttgart\n\nAls nicht eingetragen wird bekanntgemacht:\nDen Gläubigern der an der Verschmelzung beteiligten Rechtsträger ist, wenn sie binnen sechs Monaten nach dem Tag, an dem die Eintragung der Verschmelzung in das Register des Sitzes desjenigen Rechtsträgers, dessen Gläubiger sie sind, nach § 19 Abs. 3 UmwG als bekanntgemacht gilt, ihren Anspruch nach Grund und Höhe schriftlich anmelden, Sicherheit zu leisten, soweit sie nicht Befriedigung verlangen können. Dieses Recht steht den Gläubigern jedoch nur zu, wenn sie glaubhaft machen, dass durch die Verschmelzung die Erfüllung ihrer Forderung gefährdet wird."
    },
    {
      "date": "2026-02-05",
      "id": "144405",
      "original_text": "Löschungsankündigung\nBerlin Amtsgericht Berlin (Charlottenburg) HRB 102461\nNS Donau Shipping Verwaltungs GmbH – Berlin",
      "type": "Löschungsankündigung",
      "state": "Berlin",
      "amtsgericht": "Amtsgericht Berlin (Charlottenburg)",
      "registernummer": "HRB 102461",
      "registerart": "HRB",
      "company_name": "NS Donau Shipping Verwaltungs GmbH",
      "company_seat": "Berlin",
      "details": "05.02.2026 (Bekanntmachungsdatum)\n\nBerlin Amtsgericht Berlin (Charlottenburg) HRB 102461\nLöschungsankündigung\n\nNS Donau Shipping Verwaltungs GmbH\nGesellschaft mit beschränkter Haftung\nBerlin\n\nBei der nachstehenden Gesellschaft wird das Amtslöschungsverfahren gemäß § 394 FamFG eingeleitet. Widerspruchsfrist 6 Wochen"
    },
    {
      "date": "2026-02-05",
      "id": "144406",
      "original_text": "Sonstige Registerbekanntmachung\nMecklenburg-Vorpommern Amtsgericht Rostock HRB 5807\nLaager Wohnungsgesellschaft mbH (LWG) – Laage",
      "type": "Sonstige Registerbekanntmachung",
      "state": "Mecklenburg-Vorpommern",
      "amtsgericht": "Amtsgericht Rostock",
      "registernummer": "HRB 5807",
      "registerart": "HRB",
      "company_name": "Laager Wohnungsgesellschaft mbH (LWG)",
      "company_seat": "Laage",
      "details": "05.02.2026 (Bekanntmachungsdatum)\n\nMecklenburg-Vorpommern Amtsgericht Rostock HRB 5807\nSonstige Registerbekanntmachung\n\nLaager Wohnungsgesellschaft mbH (LWG)\nGesellschaft mit beschränkter Haftung\nLaage\n\nEine Liste der Mitglieder des Aufsichtsrats ist zum Handelsregister eingereicht worden."
    },
    {
      "date": "2026-02-05",
      "id": "144407",
      "original_text": "Sonstige Registerbekanntmachung\nHamburg Amtsgericht Hamburg HRB 42686\nCINEGATE GmbH – Hamburg",
      "type": "Sonstige Registerbekanntmachung",
      "state": "Hamburg",
      "amtsgericht": "Amtsgericht Hamburg",
      "registernummer": "HRB 42686",
      "registerart": "HRB",
      "company_name": "CINEGATE GmbH",
      "company_seat": "Hamburg",
      "details": "05.02.2026 (Bekanntmachungsdatum)\n\nHamburg Amtsgericht Hamburg HRB 42686\nSonstige Registerbekanntmachung 05.02.2026 (Eintragungsdatum)\n\nCINEGATE GmbH\nGesellschaft mit beschränkter Haftung\nHamburg\n\nAls nicht eingetragen wird bekannt gemacht:  Den Gläubigern der Gesellschaft, deren Forderungen begründet worden sind, bevor die Eintragung der Vertragsbeendigung in das Handelsregister nach § 10 HGB als bekannt gemacht gilt, ist vom anderen Vertragsteil Sicherheit zu leisten, wenn sie sich binnen 6 Monaten nach Bekanntmachung der Eintragung zu diesem Zweck bei ihm melden."
    },
    {
      "date": "2026-02-05",
      "id": "144408",
      "original_text": "Registerbekanntmachung nach dem Umwandlungsgesetz\nBaden-Württemberg Amtsgericht Stuttgart HRB 803668\nRöchling Medical Waldachtal GmbH – Waldachtal",
      "type": "Registerbekanntmachung nach dem Umwandlungsgesetz",
      "state": "Baden-Württemberg",
      "amtsgericht": "Amtsgericht Stuttgart",
      "registernummer": "HRB 803668",
      "registerart": "HRB",
      "company_name": "Röchling Medical Waldachtal GmbH",
      "company_seat": "Waldachtal",
      "details": "05.02.2026 (Bekanntmachungsdatum)\n\nBaden-Württemberg Amtsgericht Stuttgart HRB 803668\nRegisterbekanntmachung nach dem Umwandlungsgesetz 05.02.2026 (Eintragungsdatum)\n\nRöchling Medical Waldachtal GmbH\nGesellschaft mit beschränkter Haftung\nWaldachtal\n\nDen Gläubigern der an der Verschmelzung beteiligten Rechtsträger ist, wenn sie binnen sechs Monaten nach dem Tag, an dem die Eintragung der Verschmelzung in das Register des Sitzes desjenigen Rechtsträgers, dessen Gläubiger sie sind, nach § 19 Abs. 3 UmwG als bekanntgemacht gilt, ihren Anspruch nach Grund und Höhe schriftlich anmelden, Sicherheit zu leisten, soweit sie nicht Befriedigung verlangen können. Dieses Recht steht den Gläubigern jedoch nur zu, wenn sie glaubhaft machen, dass durch die Verschmelzung die Erfüllung ihrer Forderung gefährdet wird."
    },
    {
      "date": "2026-02-05",
      "id": "144409",
      "original_text": "Einreichung neuer Dokumente\nBaden-Württemberg Amtsgericht Mannheim HRB 109922\nAudials AG – Karlsruhe",
      "type": "Einreichung neuer Dokumente",
      "state": "Baden-Württemberg",
      "amtsgericht": "Amtsgericht Mannheim",
      "registernummer": "HRB 109922",
      "registerart": "HRB",
      "company_name": "Audials AG",
      "company_seat": "Karlsruhe",
      "details": "05.02.2026 (Bekanntmachungsdatum)\n\nBaden-Württemberg Amtsgericht Mannheim HRB 109922\nEinreichung neuer Dokumente 05.02.2026 (Eintragungsdatum)\n\nAudials AG\nAktiengesellschaft\nKarlsruhe\n\nDie Gesellschaft hat am 12.01.2026 die Liste über die Zusammensetzung des Aufsichtsrats zum Handelsregister eingereicht."
    },
    {
      "date": "2026-02-05",
      "id": "144410",
      "original_text": "Registerbekanntmachung nach dem Umwandlungsgesetz\nBaden-Württemberg Amtsgericht Stuttgart HRA 727649\nWollensak Objekt GmbH & Co. KG – Waldachtal",
      "type": "Registerbekanntmachung nach dem Umwandlungsgesetz",
      "state": "Baden-Württemberg",
      "amtsgericht": "Amtsgericht Stuttgart",
      "registernummer": "HRA 727649",
      "registerart": "HRA",
      "company_name": "Wollensak Objekt GmbH & Co. KG",
      "company_seat": "Waldachtal",
      "details": "05.02.2026 (Bekanntmachungsdatum)\n\nBaden-Württemberg Amtsgericht Stuttgart HRA 727649\nRegisterbekanntmachung nach dem Umwandlungsgesetz 05.02.2026 (Eintragungsdatum)\n\nWollensak Objekt GmbH & Co. KG\nKommanditgesellschaft\nWaldachtal\n\nAls nicht eingetragen wird bekanntgemacht:\nDen Gläubigern des an dem Formwechsel beteiligten Rechtsträgers ist, wenn sie binnen sechs Monaten nach dem Tag, an dem die Eintragung des Formwechsels in das Register des Sitzes desjenigen Rechtsträgers, dessen Gläubiger sie sind, nach § 19 Abs. 3 UmwG als bekanntgemacht gilt, ihren Anspruch nach Grund und Höhe schriftlich anmelden, Sicherheit zu leisten, soweit sie nicht Befriedigung verlangen können. Dieses Recht steht den Gläubigern jedoch nur zu, wenn sie glaubhaft machen, dass durch den Formwechsel die Erfüllung ihrer Forderung gefährdet wird."
    },
    {
      "date": "2026-02-05",
      "id": "144411",
      "original_text": "Einreichung neuer Dokumente\nBaden-Württemberg Amtsgericht Stuttgart HRB 17102\nNVBW - Nahverkehrsgesellschaft Baden-Württemberg mbH – Stuttgart",
      "type": "Einreichung neuer Dokumente",
      "state": "Baden-Württemberg",
      "amtsgericht": "Amtsgericht Stuttgart",
      "registernummer": "HRB 17102",
      "registerart": "HRB",
      "company_name": "NVBW - Nahverkehrsgesellschaft Baden-Württemberg mbH",
      "company_seat": "Stuttgart",
      "details": "05.02.2026 (Bekanntmachungsdatum)\n\nBaden-Württemberg Amtsgericht Stuttgart HRB 17102\nEinreichung neuer Dokumente\n\nNVBW - Nahverkehrsgesellschaft Baden-Württemberg mbH\nGesellschaft mit beschränkter Haftung\nStuttgart\n\nDie Gesellschaft hat am 03.02.2026 die Liste über die Zusammensetzung des Aufsichtsrats zum Handelsregister eingereicht."
    },
    {
      "date": "2026-02-05",
      "id": "144412",
      "original_text": "Einreichung neuer Dokumente\nBaden-Württemberg Amtsgericht Stuttgart HRB 69\nStuttgarter Straßenbahnen Aktiengesellschaft – Stuttgart",
      "type": "Einreichung neuer Dokumente",
      "state": "Baden-Württemberg",
      "amtsgericht": "Amtsgericht Stuttgart",
      "registernummer": "HRB 69",
      "registerart": "HRB",
      "company_name": "Stuttgarter Straßenbahnen Aktiengesellschaft",
      "company_seat": "Stuttgart",
      "details": "05.02.2026 (Bekanntmachungsdatum)\n\nBaden-Württemberg Amtsgericht Stuttgart HRB 69\nEinreichung neuer Dokumente\n\nStuttgarter Straßenbahnen Aktiengesellschaft\nAktiengesellschaft\nStuttgart\n\nDie Gesellschaft hat am 04.02.2026 die Liste über die Zusammensetzung des Aufsichtsrats zum Handelsregister eingereicht."
    },
    {
      "date": "2026-02-05",
      "id": "144413",
      "original_text": "Einreichung neuer Dokumente\nHamburg Amtsgericht Hamburg HRB 26058\nHCCR Hamburger Container- und Chassis-Reparatur- Gesellschaft mbH – Hamburg",
      "type": "Einreichung neuer Dokumente",
      "state": "Hamburg",
      "amtsgericht": "Amtsgericht Hamburg",
      "registernummer": "HRB 26058",
      "registerart": "HRB",
      "company_name": "HCCR Hamburger Container- und Chassis-Reparatur- Gesellschaft mbH",
      "company_seat": "Hamburg",
      "details": "05.02.2026 (Bekanntmachungsdatum)\n\nHamburg Amtsgericht Hamburg HRB 26058\nEinreichung neuer Dokumente\n\nHCCR Hamburger Container- und Chassis-Reparatur- Gesellschaft mbH\nGesellschaft mit beschränkter Haftung\nHamburg\n\nAls nicht eingetragen wird bekannt gemacht: Liste des Aufsichtsrats wurde eingereicht."
    },
    {
      "date": "2026-02-05",
      "id": "144414",
      "original_text": "Registerbekanntmachung nach dem Umwandlungsgesetz\nBaden-Württemberg Amtsgericht Stuttgart HRB 773829\nGötz Immotrans GmbH – Weilheim an der Teck",
      "type": "Registerbekanntmachung nach dem Umwandlungsgesetz",
      "state": "Baden-Württemberg",
      "amtsgericht": "Amtsgericht Stuttgart",
      "registernummer": "HRB 773829",
      "registerart": "HRB",
      "company_name": "Götz Immotrans GmbH",
      "company_seat": "Weilheim an der Teck",
      "details": "05.02.2026 (Bekanntmachungsdatum)\n\nBaden-Württemberg Amtsgericht Stuttgart HRB 773829\nRegisterbekanntmachung nach dem Umwandlungsgesetz 05.02.2026 (Eintragungsdatum)\n\nGötz Immotrans GmbH\nGesellschaft mit beschränkter Haftung\nWeilheim an der Teck\n\nDen Gläubigern der an der Verschmelzung beteiligten Rechtsträger ist, wenn sie binnen sechs Monaten nach dem Tag, an dem die Eintragung der Verschmelzung in das Register des Sitzes desjenigen Rechtsträgers, dessen Gläubiger sie sind, nach § 19 Abs. 3 UmwG als bekanntgemacht gilt, ihren Anspruch nach Grund und Höhe schriftlich anmelden, Sicherheit zu leisten, soweit sie nicht Befriedigung verlangen können. Dieses Recht steht den Gläubigern jedoch nur zu, wenn sie glaubhaft machen, dass durch die Verschmelzung die Erfüllung ihrer Forderung gefährdet wird."
    },
    {
      "date": "2026-02-05",
      "id": "144415",
      "original_text": "Löschungsankündigung\nSachsen Amtsgericht Dresden HRB 13924\nVIBA - Baubedarf - GmbH Sachsen – Neustadt/Sachsen",
      "type": "Löschungsankündigung",
      "state": "Sachsen",
      "amtsgericht": "Amtsgericht Dresden",
      "registernummer": "HRB 13924",
      "registerart": "HRB",
      "company_name": "VIBA - Baubedarf - GmbH Sachsen",
      "company_seat": "Neustadt/Sachsen",
      "details": "05.02.2026 (Bekanntmachungsdatum)\n\nSachsen Amtsgericht Dresden HRB 13924\nLöschungsankündigung\n\nVIBA - Baubedarf - GmbH Sachsen\nGesellschaft mit beschränkter Haftung\nNeustadt/Sachsen\n\nDas Registergericht beabsichtigt, die im Handelsregister eingetragene Gesellschaft von Amts wegen nach § 394 FamFG zu löschen. Die Frist zu Erhebung eines Widerspruchs gegen die beabsichtigte Löschung wird auf einen Monat festgesetzt."
    },
    {
      "date": "2026-02-05",
      "id": "144416",
      "original_text": "Einreichung neuer Dokumente\nSachsen Amtsgericht Chemnitz HRB 3890\nZwickauer Energieversorgung GmbH – Zwickau",
      "type": "Einreichung neuer Dokumente",
      "state": "Sachsen",
      "amtsgericht": "Amtsgericht Chemnitz",
      "registernummer": "HRB 3890",
      "registerart": "HRB",
      "company_name": "Zwickauer Energieversorgung GmbH",
      "company_seat": "Zwickau",
      "details": "05.02.2026 (Bekanntmachungsdatum)\n\nSachsen Amtsgericht Chemnitz HRB 3890\nEinreichung neuer Dokumente\n\nZwickauer Energieversorgung GmbH\nGesellschaft mit beschränkter Haftung\nZwickau\n\nAm  04.02.2026 wurde beim Handelsregister des Amtsgerichts Chemnitz die Liste der Mitglieder des Aufsichtsrats gemäß § 52 GmbHG eingereicht."
    },
    {
      "date": "2026-02-05",
      "id": "144417",
      "original_text": "Löschungsankündigung\nSachsen Amtsgericht Dresden HRB 6799\nE.T.G. Elektrotechnik Gröditz Gesellschaft mit beschränkter Haftung – Gröditz",
      "type": "Löschungsankündigung",
      "state": "Sachsen",
      "amtsgericht": "Amtsgericht Dresden",
      "registernummer": "HRB 6799",
      "registerart": "HRB",
      "company_name": "E.T.G. Elektrotechnik Gröditz Gesellschaft mit beschränkter Haftung",
      "company_seat": "Gröditz",
      "details": "05.02.2026 (Bekanntmachungsdatum)\n\nSachsen Amtsgericht Dresden HRB 6799\nLöschungsankündigung\n\nE.T.G. Elektrotechnik Gröditz Gesellschaft mit beschränkter Haftung\nGesellschaft mit beschränkter Haftung\nGröditz\n\nDas Registergericht beabsichtigt, die im Handelsregister eingetragene Gesellschaft von Amts wegen nach § 394 FamFG zu löschen. Die Frist zu Erhebung eines Widerspruchs gegen die beabsichtigte Löschung wird auf einen Monat festgesetzt."
    },
    {
      "date": "2026-02-05",
      "id": "144418",
      "original_text": "Löschungsankündigung\nSachsen Amtsgericht Dresden HRB 40197\nElbgastronomie FKD UG (haftungsbeschränkt) – Dresden",
      "type": "Löschungsankündigung",
      "state": "Sachsen",
      "amtsgericht": "Amtsgericht Dresden",
      "registernummer": "HRB 40197",
      "registerart": "HRB",
      "company_name": "Elbgastronomie FKD UG (haftungsbeschränkt)",
      "company_seat": "Dresden",
      "details": "05.02.2026 (Bekanntmachungsdatum)\n\nSachsen Amtsgericht Dresden HRB 40197\nLöschungsankündigung\n\nElbgastronomie FKD UG (haftungsbeschränkt)\nGesellschaft mit beschränkter Haftung\nDresden\n\nDas Registergericht beabsichtigt, die im Handelsregister eingetragene Gesellschaft von Amts wegen nach § 394 FamFG zu löschen. Die Frist zu Erhebung eines Widerspruchs gegen die beabsichtigte Löschung wird auf einen Monat festgesetzt."
    },
    {
      "date": "2026-02-05",
      "id": "144419",
      "original_text": "Sonstige Registerbekanntmachung\nSachsen Amtsgericht Leipzig HRB 15106\nSaxonia Media Filmproduktionsgesellschaft mbH – Leipzig",
      "type": "Sonstige Registerbekanntmachung",
      "state": "Sachsen",
      "amtsgericht": "Amtsgericht Leipzig",
      "registernummer": "HRB 15106",
      "registerart": "HRB",
      "company_name": "Saxonia Media Filmproduktionsgesellschaft mbH",
      "company_seat": "Leipzig",
      "details": "05.02.2026 (Bekanntmachungsdatum)\n\nSachsen Amtsgericht Leipzig HRB 15106\nSonstige Registerbekanntmachung\n\nSaxonia Media Filmproduktionsgesellschaft mbH\nGesellschaft mit beschränkter Haftung\nLeipzig\n\nAm 04.02.2026 wurde beim Handelsregister des Amtsgerichts Leipzig die Liste der Mitglieder des Aufsichtsrats gemäß § 52 GmbHG eingereicht."
    },
    {
      "date": "2026-02-05",
      "id": "144420",
      "original_text": "Registerbekanntmachung nach dem Umwandlungsgesetz\nSachsen Amtsgericht Chemnitz HRB 36043\nMVZ diagnosticum GmbH – Neukirchen/Erzgeb.",
      "type": "Registerbekanntmachung nach dem Umwandlungsgesetz",
      "state": "Sachsen",
      "amtsgericht": "Amtsgericht Chemnitz",
      "registernummer": "HRB 36043",
      "registerart": "HRB",
      "company_name": "MVZ diagnosticum GmbH",
      "company_seat": "Neukirchen/Erzgeb.",
      "details": "05.02.2026 (Bekanntmachungsdatum)\n\nSachsen Amtsgericht Chemnitz HRB 36043\nRegisterbekanntmachung nach dem Umwandlungsgesetz 05.02.2026 (Eintragungsdatum)\n\nMVZ diagnosticum GmbH\nGesellschaft mit beschränkter Haftung\nNeukirchen/Erzgeb.\n\nDen Gläubigern der an der Verschmelzung beteiligten Rechtsträger ist, wenn sie binnen sechs Monaten nach dem Tag, an dem die Eintragung der Verschmelzung in das Register des Sitzes desjenigen Rechtsträgers, dessen Gläubiger sie sind, nach § 19 Abs. 3 UmwG als bekannt gemacht gilt, ihren Anspruch nach Grund und Höhe in Textform anmelden, Sicherheit zu leisten, soweit sie nicht Befriedigung verlangen können. Dieses Recht steht den Gläubigern jedoch nur zu, wenn sie glaubhaft machen, dass durch die Verschmelzung die Erfüllung der Forderung gefährdet wird."
    },
    {
      "date": "2026-02-05",
      "id": "144421",
      "original_text": "Einreichung neuer Dokumente\nSachsen Amtsgericht Dresden HRB 10706\nSEEG Stadtentwicklungs- und Stadterneuerungsgesellschaft Meißen mbH – Meißen",
      "type": "Einreichung neuer Dokumente",
      "state": "Sachsen",
      "amtsgericht": "Amtsgericht Dresden",
      "registernummer": "HRB 10706",
      "registerart": "HRB",
      "company_name": "SEEG Stadtentwicklungs- und Stadterneuerungsgesellschaft Meißen mbH",
      "company_seat": "Meißen",
      "details": "05.02.2026 (Bekanntmachungsdatum)\n\nSachsen Amtsgericht Dresden HRB 10706\nEinreichung neuer Dokumente\n\nSEEG Stadtentwicklungs- und Stadterneuerungsgesellschaft Meißen mbH\nGesellschaft mit beschränkter Haftung\nMeißen\n\nAm 05.02.2026 wurde beim Handelsregister des Amtsgerichts Dresden die Liste der Mitglieder des Aufsichtsrats gemäß § 52 GmbHG eingereicht."
    },
    {
      "date": "2026-02-05",
      "id": "144422",
      "original_text": "Einreichung neuer Dokumente\nSachsen Amtsgericht Leipzig HRB 34840\nGNotDS Gesellschaft für notariellen Datenschutz mit beschränkter Haftung – Leipzig",
      "type": "Einreichung neuer Dokumente",
      "state": "Sachsen",
      "amtsgericht": "Amtsgericht Leipzig",
      "registernummer": "HRB 34840",
      "registerart": "HRB",
      "company_name": "GNotDS Gesellschaft für notariellen Datenschutz mit beschränkter Haftung",
      "company_seat": "Leipzig",
      "details": "05.02.2026 (Bekanntmachungsdatum)\n\nSachsen Amtsgericht Leipzig HRB 34840\nEinreichung neuer Dokumente\n\nGNotDS Gesellschaft für notariellen Datenschutz mit beschränkter Haftung\nGesellschaft mit beschränkter Haftung\nLeipzig\n\nAm 13.01.2026 wurde beim Handelsregister des Amtsgerichts Leipzig die Liste der Mitglieder des Aufsichtsrats gemäß § 52 GmbHG eingereicht."
    },
    {
      "date": "2026-02-05",
      "id": "144423",
      "original_text": "Registerbekanntmachung nach dem Umwandlungsgesetz\nSachsen Amtsgericht Dresden HRB 39690\nDER Reisecenter TUI GmbH – Dresden",
      "type": "Registerbekanntmachung nach dem Umwandlungsgesetz",
      "state": "Sachsen",
      "amtsgericht": "Amtsgericht Dresden",
      "registernummer": "HRB 39690",
      "registerart": "HRB",
      "company_name": "DER Reisecenter TUI GmbH",
      "company_seat": "Dresden",
      "details": "05.02.2026 (Bekanntmachungsdatum)\n\nSachsen Amtsgericht Dresden HRB 39690\nRegisterbekanntmachung nach dem Umwandlungsgesetz 05.02.2026 (Eintragungsdatum)\n\nDER Reisecenter TUI GmbH\nGesellschaft mit beschränkter Haftung\nDresden\n\nDen Gläubigern der an der Verschmelzung beteiligten Rechtsträger ist, wenn sie binnen sechs Monaten nach dem Tag, an dem die Eintragung der Verschmelzung in das Register des Sitzes desjenigen Rechtsträgers, dessen Gläubiger sie sind, nach § 19 Abs. 3 UmwG als bekannt gemacht gilt, ihren Anspruch nach Grund und Höhe in Textform anmelden, Sicherheit zu leisten, soweit sie nicht Befriedigung verlangen können. Dieses Recht steht den Gläubigern jedoch nur zu, wenn sie glaubhaft machen, dass durch die Verschmelzung die Erfüllung der Forderung gefährdet wird."
    },
    {
      "date": "2026-02-05",
      "id": "144424",
      "original_text": "Einreichung neuer Dokumente\nSachsen Amtsgericht Dresden HRB 8092\nSparkassen-Versicherung Sachsen Lebensversicherung Aktiengesellschaft – Dresden",
      "type": "Einreichung neuer Dokumente",
      "state": "Sachsen",
      "amtsgericht": "Amtsgericht Dresden",
      "registernummer": "HRB 8092",
      "registerart": "HRB",
      "company_name": "Sparkassen-Versicherung Sachsen Lebensversicherung Aktiengesellschaft",
      "company_seat": "Dresden",
      "details": "05.02.2026 (Bekanntmachungsdatum)\n\nSachsen Amtsgericht Dresden HRB 8092\nEinreichung neuer Dokumente\n\nSparkassen-Versicherung Sachsen Lebensversicherung Aktiengesellschaft\nAktiengesellschaft\nDresden\n\nAm 03.02.2026 wurde beim Handelsregister des Amtsgerichts Dresden die Liste der Mitglieder des Aufsichtsrats gemäß § 106 AktG eingereicht."
    },
    {
      "date": "2026-02-05",
      "id": "144425",
      "original_text": "Registerbekanntmachung nach dem Umwandlungsgesetz\nNiedersachsen Amtsgericht Hannover PR 201171\nHDT Hartmann Düvelmeyer Timmermann & Partner Partnerschaftsgesellschaft mbB Wirtschaftsprüfer Steuerberater Rechtsanwälte – Osnabrück",
      "type": "Registerbekanntmachung nach dem Umwandlungsgesetz",
      "state": "Niedersachsen",
      "amtsgericht": "Amtsgericht Hannover",
      "registernummer": "PR 201171",
      "registerart": "PR",
      "company_name": "HDT Hartmann Düvelmeyer Timmermann & Partner Partnerschaftsgesellschaft mbB Wirtschaftsprüfer Steuerberater Rechtsanwälte",
      "company_seat": "Osnabrück",
      "details": "05.02.2026 (Bekanntmachungsdatum)\n\nNiedersachsen Amtsgericht Hannover PR 201171\nRegisterbekanntmachung nach dem Umwandlungsgesetz 05.02.2026 (Eintragungsdatum)\n\nHDT Hartmann Düvelmeyer Timmermann & Partner Partnerschaftsgesellschaft mbB Wirtschaftsprüfer Steuerberater Rechtsanwälte\nPartnerschaftsgesellschaft\nOsnabrück\n\nDen Gläubigern der an der Abspaltung beteiligten Rechtsträger ist, wenn sie binnen sechs Monaten nach dem Tag, an dem die Eintragung der Abspaltung in das Register des Sitzes desjenigen Rechtsträgers, dessen Gläubiger sie sind, nach § 19 Abs. 3 UmwG als bekannt gemacht gilt, ihren Anspruch nach Grund und Höhe schriftlich anmelden, Sicherheit zu leisten, soweit sie nicht Befriedigung verlangen können. Dieses Recht steht den Gläubigern jedoch nur zu, wenn sie glaubhaft machen, dass durch die Abspaltung die Erfüllung der Forderung gefährdet wird."
    },
    {
      "date": "2026-02-05",
      "id": "144426",
      "original_text": "Einreichung neuer Dokumente\nNiedersachsen Amtsgericht Hannover HRB 100345 früher Amtsgericht Hameln\nBHW Bausparkasse Aktiengesellschaft – Hameln",
      "type": "Einreichung neuer Dokumente",
      "state": "Niedersachsen",
      "amtsgericht": "Amtsgericht Hannover",
      "registernummer": "HRB 100345",
      "registerart": "HRB",
      "company_name": "BHW Bausparkasse Aktiengesellschaft",
      "company_seat": "Hameln",
      "former_amtsgericht": "Hameln",
      "details": "05.02.2026 (Bekanntmachungsdatum)\n\nNiedersachsen Amtsgericht Hannover HRB 100345 früher Amtsgericht Hameln\nEinreichung neuer Dokumente\n\nBHW Bausparkasse Aktiengesellschaft\nAktiengesellschaft\nHameln\n\nDie Liste der Mitglieder des Aufsichtsrats wurde beim Registergericht eingereicht."
    },
    {
      "date": "2026-02-05",
      "id": "144427",
      "original_text": "Löschungsankündigung\nNiedersachsen Amtsgericht Braunschweig HRA 100416 früher Amtsgericht Wolfsburg\nHandelskontor Walt OHG – Wolfsburg",
      "type": "Löschungsankündigung",
      "state": "Niedersachsen",
      "amtsgericht": "Amtsgericht Braunschweig",
      "registernummer": "HRA 100416",
      "registerart": "HRA",
      "company_name": "Handelskontor Walt OHG",
      "company_seat": "Wolfsburg",
      "former_amtsgericht": "Wolfsburg",
      "details": "05.02.2026 (Bekanntmachungsdatum)\n\nNiedersachsen Amtsgericht Braunschweig HRA 100416 früher Amtsgericht Wolfsburg\nLöschungsankündigung 05.02.2026 (Eintragungsdatum)\n\nHandelskontor Walt OHG\nOffene Handelsgesellschaft\nWolfsburg\n\nDas Registergericht beabsichtigt, die Firma von Amts wegen nach § 31 Abs. 2 Satz 2 HGB, § 393 FamFG zu löschen. Die Frist zur Erhebung eines Widerspruchs ist auf 1 Monat ab dieser Registerbekanntmachung festgesetzt."
    },
    {
      "date": "2026-02-05",
      "id": "144428",
      "original_text": "Registerbekanntmachung nach dem Umwandlungsgesetz\nNiedersachsen Amtsgericht Hannover HRA 206895\nDie Servicequelle GmbH & Co. KG – Hannover",
      "type": "Registerbekanntmachung nach dem Umwandlungsgesetz",
      "state": "Niedersachsen",
      "amtsgericht": "Amtsgericht Hannover",
      "registernummer": "HRA 206895",
      "registerart": "HRA",
      "company_name": "Die Servicequelle GmbH & Co. KG",
      "company_seat": "Hannover",
      "details": "05.02.2026 (Bekanntmachungsdatum)\n\nNiedersachsen Amtsgericht Hannover HRA 206895\nRegisterbekanntmachung nach dem Umwandlungsgesetz 05.02.2026 (Eintragungsdatum)\n\nDie Servicequelle GmbH & Co. KG\nKommanditgesellschaft\nHannover\n\nDen Gläubigern der an der Ausgliederung beteiligten Rechtsträger ist, wenn sie binnen sechs Monaten nach dem Tag, an dem die Eintragung der Ausgliederung in das Register des Sitzes desjenigen Rechtsträgers, dessen Gläubiger sie sind, nach § 19 Abs. 3 UmwG als bekannt gemacht gilt, ihren Anspruch nach Grund und Höhe schriftlich anmelden, Sicherheit zu leisten, soweit sie nicht Befriedigung verlangen können. Dieses Recht steht den Gläubigern jedoch nur zu, wenn sie glaubhaft machen, dass durch die Ausgliederung die Erfüllung der Forderung gefährdet wird."
    },
    {
      "date": "2026-02-05",
      "id": "144429",
      "original_text": "Einreichung neuer Dokumente\nNiedersachsen Amtsgericht Hannover HRB 226570\nWohnRaum Niedersachsen GmbH – Hannover",
      "type": "Einreichung neuer Dokumente",
      "state": "Niedersachsen",
      "amtsgericht": "Amtsgericht Hannover",
      "registernummer": "HRB 226570",
      "registerart": "HRB",
      "company_name": "WohnRaum Niedersachsen GmbH",
      "company_seat": "Hannover",
      "details": "05.02.2026 (Bekanntmachungsdatum)\n\nNiedersachsen Amtsgericht Hannover HRB 226570\nEinreichung neuer Dokumente\n\nWohnRaum Niedersachsen GmbH\nGesellschaft mit beschränkter Haftung\nHannover\n\nDie Liste der Mitglieder des Aufsichtsrats wurde beim Registergericht eingereicht."
    },
    {
      "date": "2026-02-05",
      "id": "144430",
      "original_text": "Einreichung neuer Dokumente\nNiedersachsen Amtsgericht Braunschweig HRB 207746\nviversus gemeinnützige Aktiengesellschaft – Langelsheim",
      "type": "Einreichung neuer Dokumente",
      "state": "Niedersachsen",
      "amtsgericht": "Amtsgericht Braunschweig",
      "registernummer": "HRB 207746",
      "registerart": "HRB",
      "company_name": "viversus gemeinnützige Aktiengesellschaft",
      "company_seat": "Langelsheim",
      "details": "05.02.2026 (Bekanntmachungsdatum)\n\nNiedersachsen Amtsgericht Braunschweig HRB 207746\nEinreichung neuer Dokumente 05.02.2026 (Eintragungsdatum)\n\nviversus gemeinnützige Aktiengesellschaft\nAktiengesellschaft\nLangelsheim\n\nDie Liste der Mitglieder des Aufsichtsrats wurde beim Registergericht eingereicht."
    },
    {
      "date": "2026-02-05",
      "id": "144431",
      "original_text": "Sonstige Registerbekanntmachung\nNiedersachsen Amtsgericht Hannover HRB 58251\nAltes Rathaus Gastronomie Betriebs GmbH – Hannover",
      "type": "Sonstige Registerbekanntmachung",
      "state": "Niedersachsen",
      "amtsgericht": "Amtsgericht Hannover",
      "registernummer": "HRB 58251",
      "registerart": "HRB",
      "company_name": "Altes Rathaus Gastronomie Betriebs GmbH",
      "company_seat": "Hannover",
      "details": "05.02.2026 (Bekanntmachungsdatum)\n\nNiedersachsen Amtsgericht Hannover HRB 58251\nSonstige Registerbekanntmachung 05.02.2026 (Eintragungsdatum)\n\nAltes Rathaus Gastronomie Betriebs GmbH\nGesellschaft mit beschränkter Haftung\nHannover\n\nDen Gläubigern der Gesellschaft, deren Forderungen begründet worden sind, bevor die Eintragung der Beendigung/Kündigung des Unternehmensvertrages in das Handelsregister nach § 10 des Handelsgesetzbuches als bekanntgemacht gilt, hat der andere Vertragsteil Sicherheit zu leisten, wenn sie sich binnen sechs Monaten nach der Bekanntmachung der Eintragung zu diesem Zweck bei ihm melden."
    },
    {
      "date": "2026-02-05",
      "id": "144432",
      "original_text": "Registerbekanntmachung nach dem Umwandlungsgesetz\nNiedersachsen Amtsgericht Oldenburg (Oldenburg) HRB 220010\nCambusa Gastro- und Vermietungs-UG (haftungsbeschränkt) – Oldenburg (Oldb)",
      "type": "Registerbekanntmachung nach dem Umwandlungsgesetz",
      "state": "Niedersachsen",
      "amtsgericht": "Amtsgericht Oldenburg (Oldenburg)",
      "registernummer": "HRB 220010",
      "registerart": "HRB",
      "company_name": "Cambusa Gastro- und Vermietungs-UG (haftungsbeschränkt)",
      "company_seat": "Oldenburg (Oldb)",
      "details": "05.02.2026 (Bekanntmachungsdatum)\n\nNiedersachsen Amtsgericht Oldenburg (Oldenburg) HRB 220010\nRegisterbekanntmachung nach dem Umwandlungsgesetz 05.02.2026 (Eintragungsdatum)\n\nCambusa Gastro- und Vermietungs-UG (haftungsbeschränkt)\nGesellschaft mit beschränkter Haftung\nOldenburg (Oldb)\n\nDen Gläubigern der an der Verschmelzung beteiligten Rechtsträger ist, wenn sie binnen sechs Monaten nach dem Tag, an dem die Eintragung der Verschmelzung in das Register des Sitzes desjenigen Rechtsträgers, dessen Gläubiger sie sind, nach § 19  Abs.  3 UmwG als bekannt gemacht gilt, ihren Anspruch nach Grund und Höhe schriftlich anmelden, Sicherheit zu leisten, soweit sie nicht Befriedigung verlangen können. Dieses Recht steht den Gläubigern jedoch nur zu, wenn sie glaubhaft machen, dass durch die Verschmelzung die Erfüllung der Forderung gefährdet wird."
    },
    {
      "date": "2026-02-05",
      "id": "144433",
      "original_text": "Löschungsankündigung\nNiedersachsen Amtsgericht Aurich HRB 205266\nPfiffikus ME Uplengen UG (haftungsbeschränkt) – Uplengen",
      "type": "Löschungsankündigung",
      "state": "Niedersachsen",
      "amtsgericht": "Amtsgericht Aurich",
      "registernummer": "HRB 205266",
      "registerart": "HRB",
      "company_name": "Pfiffikus ME Uplengen UG (haftungsbeschränkt)",
      "company_seat": "Uplengen",
      "details": "05.02.2026 (Bekanntmachungsdatum)\n\nNiedersachsen Amtsgericht Aurich HRB 205266\nLöschungsankündigung 05.02.2026 (Eintragungsdatum)\n\nPfiffikus ME Uplengen UG (haftungsbeschränkt)\nGesellschaft mit beschränkter Haftung\nUplengen\n\nDas Registergericht beabsichtigt, den Geschäftsführer von Amts wegen nach § 395 FamFG zu löschen. Die Frist zur Erhebung eines Widerspruchs ist auf 1 Monat ab dieser Registerbekanntmachung festgesetzt."
    },
    {
      "date": "2026-02-05",
      "id": "144434",
      "original_text": "Löschungsankündigung\nNiedersachsen Amtsgericht Braunschweig HRB 208660\nNext Level UG (haftungsbeschränkt) – Helmstedt",
      "type": "Löschungsankündigung",
      "state": "Niedersachsen",
      "amtsgericht": "Amtsgericht Braunschweig",
      "registernummer": "HRB 208660",
      "registerart": "HRB",
      "company_name": "Next Level UG (haftungsbeschränkt)",
      "company_seat": "Helmstedt",
      "details": "05.02.2026 (Bekanntmachungsdatum)\n\nNiedersachsen Amtsgericht Braunschweig HRB 208660\nLöschungsankündigung\n\nNext Level UG (haftungsbeschränkt)\nGesellschaft mit beschränkter Haftung\nHelmstedt\n\nDas Registergericht beabsichtigt, die Gesellschaft von Amts wegen nach § 394 FamFG zu löschen. Die Frist zur Erhebung eines Widerspruchs ist auf 1 Monat ab dieser Registerbekanntmachung festgesetzt."
    },
    {
      "date": "2026-02-05",
      "id": "144435",
      "original_text": "Registerbekanntmachung nach dem Umwandlungsgesetz\nRheinland-Pfalz Amtsgericht Ludwigshafen a.Rhein (Ludwigshafen) HRB 60885\nBBV Systems GmbH – Bobenheim-Roxheim",
      "type": "Registerbekanntmachung nach dem Umwandlungsgesetz",
      "state": "Rheinland-Pfalz",
      "amtsgericht": "Amtsgericht Ludwigshafen a.Rhein (Ludwigshafen)",
      "registernummer": "HRB 60885",
      "registerart": "HRB",
      "company_name": "BBV Systems GmbH",
      "company_seat": "Bobenheim-Roxheim",
      "details": "05.02.2026 (Bekanntmachungsdatum)\n\nRheinland-Pfalz Amtsgericht Ludwigshafen a.Rhein (Ludwigshafen) HRB 60885\nRegisterbekanntmachung nach dem Umwandlungsgesetz\n\nBBV Systems GmbH\nGesellschaft mit beschränkter Haftung\nBobenheim-Roxheim\n\nEs wird darauf hingewiesen, dass der Entwurf des Verschmelzungsplans beim Handelsregister eingereicht worden ist. An der Verschmelzung sind die BBV Systems sp.z o.o., eine Gesellschaft mit beschränkter Haftung nach polnischem Recht mit Sitz in Gdańsk, Polen, als übertragende Gesellschaft und die BBV Systems GmbH, eine Gesellschaft mit beschränkter Haftung mit Sitz in Bobenheim-Roxheim als übernehmende Gesellschaft beteiligt. Die BBV Systems GmbH ist unter HRB 60885 beim Handelsregister des Amtsgerichts Ludwigshafen am Rhein eingetragen. Die BBV Systems sp.z o.o. ist im Unternehmerregister des Landesgerichtsregisters geführt vom Amtsgericht für Gdańsk-Północ in Gdańsk, 7. Wirtschaftsabteilung des Landesgerichtsregisters, unter der Nummer KRS 0000351108 eingetragen. Es wird darauf hingewiesen, dass die Anteilsinhaber sowie die Gläubiger der an der grenzüberschreitenden Verschmelzung beteiligten Gesellschaften und der bei der BBV Systems GmbH eingerichtete Betriebsrat, der bei der Alleingesellschafterin der BBV Systems GmbH, der bei der Implenia Specialties GmbH mit Sitz in Raunheim, eingetragen beim Handelsregister des Amtsgerichts Darmstadt unter HRB 101280, eingerichtete Spartenbetriebsrat, der bei der Implenia Deutschland GmbH mit Sitz in Raunheim, eingetragen beim Handelsregister des Amtsgerichts Darmstadt unter HRB 97948, eingerichtete Konzernbetriebsrat sowie vorsorglich der ab Frühjahr 2026 zuständige, bei der Implenia Civil Engineering GmbH mit Sitz in Raunheim, eingetragen beim Handelsregister Darmstadt unter HRB 97949 eingerichtete Spartenbetriebsrat Civil Engineering spätestens bis zum 6. März 2026 Bemerkungen zum Verschmelzungsplan übermitteln können (§ 308 Abs. 1 Satz 2 Nr. 4 Buchst. a), b) UmwG). Die BBV Systems sp.z o.o., beschäftigt keine Arbeitnehmer."
    },
    {
      "date": "2026-02-05",
      "id": "144436",
      "original_text": "Sonstige Registerbekanntmachung\nNordrhein-Westfalen Amtsgericht Gelsenkirchen HRB 12405\nEndlos-Spezial-Papier GmbH – Gladbeck",
      "type": "Sonstige Registerbekanntmachung",
      "state": "Nordrhein-Westfalen",
      "amtsgericht": "Amtsgericht Gelsenkirchen",
      "registernummer": "HRB 12405",
      "registerart": "HRB",
      "company_name": "Endlos-Spezial-Papier GmbH",
      "company_seat": "Gladbeck",
      "details": "05.02.2026 (Bekanntmachungsdatum)\n\nNordrhein-Westfalen Amtsgericht Gelsenkirchen HRB 12405\nSonstige Registerbekanntmachung 05.02.2026 (Eintragungsdatum)\n\nEndlos-Spezial-Papier GmbH\nGesellschaft mit beschränkter Haftung\nGladbeck\n\nAls nicht eingetragen wird veröffentlicht: Den Gläubigern der Gesellschaft, deren Forderungen begründet worden sind bevor die Eintragung der Beendigung des Beherrschungs- und Gewinnabführungsvertrages in das Handelsregister nach § 10 des Handelsgesetzbuches als bekanntgemacht gilt, hat der andere Vertragsteil Sicherheit zu leisten, wenn sie sich binnen sechs Monaten nach der Bekanntmachung der Eintragung zu diesem Zweck bei ihm melden."
    },
    {
      "date": "2026-02-05",
      "id": "144437",
      "original_text": "Einreichung neuer Dokumente\nNordrhein-Westfalen Amtsgericht Essen HRB 24298\nVier Gas Services Management GmbH – Essen",
      "type": "Einreichung neuer Dokumente",
      "state": "Nordrhein-Westfalen",
      "amtsgericht": "Amtsgericht Essen",
      "registernummer": "HRB 24298",
      "registerart": "HRB",
      "company_name": "Vier Gas Services Management GmbH",
      "company_seat": "Essen",
      "details": "05.02.2026 (Bekanntmachungsdatum)\n\nNordrhein-Westfalen Amtsgericht Essen HRB 24298\nEinreichung neuer Dokumente\n\nVier Gas Services Management GmbH\nGesellschaft mit beschränkter Haftung\nEssen\n\nDem Registergericht ist eine neue Liste der Mitglieder des Aufsichtsrates eingereicht worden."
    },
    {
      "date": "2026-02-05",
      "id": "144438",
      "original_text": "Einreichung neuer Dokumente\nNordrhein-Westfalen Amtsgericht Köln HRB 65425\nEnergiewirtschaftliches Institut an der Universität zu Köln gGmbH – Köln",
      "type": "Einreichung neuer Dokumente",
      "state": "Nordrhein-Westfalen",
      "amtsgericht": "Amtsgericht Köln",
      "registernummer": "HRB 65425",
      "registerart": "HRB",
      "company_name": "Energiewirtschaftliches Institut an der Universität zu Köln gGmbH",
      "company_seat": "Köln",
      "details": "05.02.2026 (Bekanntmachungsdatum)\n\nNordrhein-Westfalen Amtsgericht Köln HRB 65425\nEinreichung neuer Dokumente 05.02.2026 (Eintragungsdatum)\n\nEnergiewirtschaftliches Institut an der Universität zu Köln gGmbH\nGesellschaft mit beschränkter Haftung\nKöln\n\nDem Registergericht ist eine neue Liste der Mitglieder des Aufsichtsrates eingereicht worden."
    },
    {
      "date": "2026-02-05",
      "id": "144439",
      "original_text": "Löschungsankündigung\nNordrhein-Westfalen Amtsgericht Siegen HRB 5337\nChristofferhaus Siegen gemeinnützige Gesellschaft mit beschränkter Haftung – Siegen",
      "type": "Löschungsankündigung",
      "state": "Nordrhein-Westfalen",
      "amtsgericht": "Amtsgericht Siegen",
      "registernummer": "HRB 5337",
      "registerart": "HRB",
      "company_name": "Christofferhaus Siegen gemeinnützige Gesellschaft mit beschränkter Haftung",
      "company_seat": "Siegen",
      "details": "05.02.2026 (Bekanntmachungsdatum)\n\nNordrhein-Westfalen Amtsgericht Siegen HRB 5337\nLöschungsankündigung\n\nChristofferhaus  Siegen gemeinnützige Gesellschaft mit beschränkter Haftung\nGesellschaft mit beschränkter Haftung\nSiegen\n\nDas Registergericht beabsichtigt die Gesellschaft von Amts wegen nach § 394 FamFG zu löschen. Die Frist zur Erhebung eines Widerspruchs ist auf drei Monate festgesetzt."
    },
    {
      "date": "2026-02-05",
      "id": "144440",
      "original_text": "Einreichung neuer Dokumente\nNordrhein-Westfalen Amtsgericht Köln HRB 65897\nDeutsche Netzmarketing GmbH – Köln",
      "type": "Einreichung neuer Dokumente",
      "state": "Nordrhein-Westfalen",
      "amtsgericht": "Amtsgericht Köln",
      "registernummer": "HRB 65897",
      "registerart": "HRB",
      "company_name": "Deutsche Netzmarketing GmbH",
      "company_seat": "Köln",
      "details": "05.02.2026 (Bekanntmachungsdatum)\n\nNordrhein-Westfalen Amtsgericht Köln HRB 65897\nEinreichung neuer Dokumente\n\nDeutsche Netzmarketing GmbH\nGesellschaft mit beschränkter Haftung\nKöln\n\nDem Registergericht ist eine Liste der Mitglieder des Aufsichtsrates eingereicht worden."
    },
    {
      "date": "2026-02-05",
      "id": "144441",
      "original_text": "Löschungsankündigung\nNordrhein-Westfalen Amtsgericht Duisburg HRB 34839\nNeva Express GmbH – Duisburg",
      "type": "Löschungsankündigung",
      "state": "Nordrhein-Westfalen",
      "amtsgericht": "Amtsgericht Duisburg",
      "registernummer": "HRB 34839",
      "registerart": "HRB",
      "company_name": "Neva Express GmbH",
      "company_seat": "Duisburg",
      "details": "05.02.2026 (Bekanntmachungsdatum)\n\nNordrhein-Westfalen Amtsgericht Duisburg HRB 34839\nLöschungsankündigung 05.02.2026 (Eintragungsdatum)\n\nNeva Express GmbH\nGesellschaft mit beschränkter Haftung\nDuisburg\n\nHRB 34839:\nNeva Express GmbH, Duisburg\nFriedrich-Alfred-Straße 60 A, 47226 Duisburg.\nDas Registergericht beabsichtigt, die im Handelsregister eingetragene Gesellschaft gemäß § 394 FamFG wegen Vermögenslosigkeit von Amts wegen zu löschen. Gegen diese Verfügung kann Widerspruch eingelegt werden. Die Frist zur Erhebung eines Widerspruchs gegen die beabsichtigte Löschung von Amts wegen ist auf drei Monate festgesetzt.\nRechtsbehelfsbelehrung Der Widerspruch ist bei dem Amtsgericht Duisburg, Kardinal-Galen-Str. 124-132, 47058 Duisburg schriftlich in deutscher Sprache oder zur Niederschrift der Geschäftsstelle einzulegen. Der Widerspruch kann auch zur Niederschrift der Geschäftsstelle eines jeden Amtsgerichtes abgegeben werden. Die Einlegung ist auch durch Übertragung eines elektronischen Dokuments an die elektronische Poststelle des Gerichts möglich. Das elektronische Dokument muss für die Bearbeitung durch das Gericht geeignet und mit einer qualifizierten elektronischen Signatur der verantwortenden Person versehen sein oder von der verantwortenden Person signiert und auf einem sicheren Übermittlungsweg gemäß § 130 a ZPO nach näherer Maßgabe der Verordnung über die technischen Rahmenbedingungen des elektronischen Rechtsverkehrs und über das besondere elektronische Behördenpostfach (BGBl. I, S. 3803) eingereicht werden. Weitere Informationen erhalten Sie auf der Internetseite www.justiz.de. Der Widerspruch muss spätestens innerhalb der gesetzten Frist bei dem Amtsgericht Duisburg eingegangen sein. Dies gilt auch dann, wenn der Widerspruch zur Niederschrift der Geschäftsstelle eines anderen Amtsgerichtes abgegeben wurde. Die Frist beginnt mit der Veröffentlichung. Fällt das Ende der Frist auf einen Sonntag, einen allgemeinen Feiertag oder Sonnabend, so endet die Frist mit Ablauf des nächsten Werktages. Der Widerspruch muss die Bezeichnung der angefochtenen Verfügung sowie die Erklärung enthalten, dass Widerspruch gegen diese Verfügung eingelegt wird. Er ist zu unterzeichnen und soll begründet werden."
    },
    {
      "date": "2026-02-05",
      "id": "144442",
      "original_text": "Sonstige Registerbekanntmachung\nNordrhein-Westfalen Amtsgericht Düsseldorf HRB 78068\nwonderjeans GmbH – Düsseldorf",
      "type": "Sonstige Registerbekanntmachung",
      "state": "Nordrhein-Westfalen",
      "amtsgericht": "Amtsgericht Düsseldorf",
      "registernummer": "HRB 78068",
      "registerart": "HRB",
      "company_name": "wonderjeans GmbH",
      "company_seat": "Düsseldorf",
      "details": "05.02.2026 (Bekanntmachungsdatum)\n\nNordrhein-Westfalen Amtsgericht Düsseldorf HRB 78068\nSonstige Registerbekanntmachung 05.02.2026 (Eintragungsdatum)\n\nwonderjeans GmbH\nGesellschaft mit beschränkter Haftung\nDüsseldorf\n\nAls nicht eingetragen wird veröffentlicht: Den Gläubigern der Gesellschaft, deren Forderungen begründet worden sind bevor die Eintragung der Beendigung des Beherrschungs- und Gewinnabführungsvertrages  in das Handelsregister nach § 10 des Handelsgesetzbuches als bekanntgemacht gilt, hat der andere Vertragsteil Sicherheit zu leisten, wenn sie sich binnen sechs Monaten nach der Bekanntmachung der Eintragung zu diesem Zweck bei ihm melden."
    },
    {
      "date": "2026-02-05",
      "id": "144443",
      "original_text": "Registerbekanntmachung nach dem Umwandlungsgesetz\nNordrhein-Westfalen Amtsgericht Köln HRB 126583\nINDICAMUS GmbH – Köln",
      "type": "Registerbekanntmachung nach dem Umwandlungsgesetz",
      "state": "Nordrhein-Westfalen",
      "amtsgericht": "Amtsgericht Köln",
      "registernummer": "HRB 126583",
      "registerart": "HRB",
      "company_name": "INDICAMUS GmbH",
      "company_seat": "Köln",
      "details": "05.02.2026 (Bekanntmachungsdatum)\n\nNordrhein-Westfalen Amtsgericht Köln HRB 126583\nRegisterbekanntmachung nach dem Umwandlungsgesetz 05.02.2026 (Eintragungsdatum)\n\nINDICAMUS GmbH\nGesellschaft mit beschränkter Haftung\nKöln\n\nDen Gläubigern der an der formwechselnden Umwandlung beteiligten Rechtsträger ist, wenn sie binnen sechs Monaten nach dem Tag, an dem die Eintragung der formwechselnden Umwandlung in das Register des Sitzes desjenigen Rechtsträgers, dessen Gläubiger sie sind, nach § 19 Absatz 3 UmwG als bekanntgemacht gilt, ihren Anspruch nach Grund und Höhe schriftlich anmelden, Sicherheit zu leisten, soweit sie nicht Befriedigung verlangen können. Dieses Recht steht den Gläubigern jedoch nur zu, wenn sie glaubhaft machen, dass durch die formwechselnden Umwandlung die Erfüllung ihrer Forderung gefährdet wird."
    },
    {
      "date": "2026-02-05",
      "id": "144444",
      "original_text": "Löschungsankündigung\nNordrhein-Westfalen Amtsgericht Hagen HRB 10657\nAlpha UG (haftungsbeschränkt) – Ennepetal",
      "type": "Löschungsankündigung",
      "state": "Nordrhein-Westfalen",
      "amtsgericht": "Amtsgericht Hagen",
      "registernummer": "HRB 10657",
      "registerart": "HRB",
      "company_name": "Alpha UG (haftungsbeschränkt)",
      "company_seat": "Ennepetal",
      "details": "05.02.2026 (Bekanntmachungsdatum)\n\nNordrhein-Westfalen Amtsgericht Hagen HRB 10657\nLöschungsankündigung\n\nAlpha UG (haftungsbeschränkt)\nGesellschaft mit beschränkter Haftung\nEnnepetal\n\nIn obiger Handelsregistersache wird bekannt gemacht:\nDas Registergericht beabsichtigt, die im Handelsregister eingetragene Gesellschaft gemäß § 394 I FamFG wegen Vermögenslosigkeit von Amts wegen zu löschen. Gegen diese Verfügung kann Widerspruch eingelegt werden. Die Frist zur Erhebung eines Widerspruchs gegen die beabsichtigte Löschung von Amts wegen ist auf drei Monate festgesetzt.\n\nRechtsbehelfsbelehrung:\nGegen diese Verfügung können Sie Widerspruch einlegen.\n\nDer Widerspruch ist bei dem Amtsgericht Hagen, Heinitzstraße 42, 58097 Hagen schriftlich in deutscher Sprache oder zur Niederschrift der Geschäftsstelle einzulegen. Der Widerspruch kann auch zur Niederschrift der Geschäftsstelle eines jeden Amtsgerichts abgegeben werden.\n\nDer Widerspruch muss spätestens innerhalb der gesetzten Frist bei dem Amtsgericht Hagen eingegangen sein. Dies gilt auch dann, wenn der Widerspruch zur Geschäftsstelle eines anderen Amtsgerichtes abgegeben wurde. Die Frist beginnt mit der Veröffentlichung. Fällt das Ende der Frist auf einen Sonntag, einen allgemeinen Feiertag oder Sonnabend, so endet die Frist mit Ablauf des nächsten Werktages.\n\nDer Widerspruch muss die Bezeichnung der angefochtenen Verfügung sowie die Erklärung erhalten, dass Widerspruch gegen diese Verfügung eingelegt wird. Er ist zu unterzeichnen und soll begründet werden.\nDas Registergericht beabsichtigt die Gesellschaft von Amts wegen nach § 394 FamFG zu löschen. Die Frist zur Erhebung eines Widerspruchs ist auf #DV.Fr(Text=\"Bitte wählen Sie die Widerspruchsfrist aus!\",Eingabe=\"einen Monat\",\"zwei Monate\",\"drei Monate\",\"#insert(Text=\"Freitext\")\"|\"freier Text\") festgesetzt."
    },
    {
      "date": "2026-02-05",
      "id": "144445",
      "original_text": "Einreichung neuer Dokumente\nNordrhein-Westfalen Amtsgericht Dortmund HRB 19417\nEDG Entsorgung Dortmund GmbH – Dortmund",
      "type": "Einreichung neuer Dokumente",
      "state": "Nordrhein-Westfalen",
      "amtsgericht": "Amtsgericht Dortmund",
      "registernummer": "HRB 19417",
      "registerart": "HRB",
      "company_name": "EDG Entsorgung Dortmund GmbH",
      "company_seat": "Dortmund",
      "details": "05.02.2026 (Bekanntmachungsdatum)\n\nNordrhein-Westfalen Amtsgericht Dortmund HRB 19417\nEinreichung neuer Dokumente\n\nEDG Entsorgung Dortmund GmbH\nGesellschaft mit beschränkter Haftung\nDortmund\n\nDem Registergericht ist eine neue Liste der Mitglieder des Aufsichtsrates eingereicht worden."
    },
    {
      "date": "2026-02-05",
      "id": "144446",
      "original_text": "Einreichung neuer Dokumente\nNordrhein-Westfalen Amtsgericht Duisburg HRB 14763\nMülheimer Stadtmarketing- und Tourismus GmbH (MST) – Mülheim an der Ruhr",
      "type": "Einreichung neuer Dokumente",
      "state": "Nordrhein-Westfalen",
      "amtsgericht": "Amtsgericht Duisburg",
      "registernummer": "HRB 14763",
      "registerart": "HRB",
      "company_name": "Mülheimer Stadtmarketing- und Tourismus GmbH (MST)",
      "company_seat": "Mülheim an der Ruhr",
      "details": "05.02.2026 (Bekanntmachungsdatum)\n\nNordrhein-Westfalen Amtsgericht Duisburg HRB 14763\nEinreichung neuer Dokumente\n\nMülheimer Stadtmarketing- und Tourismus GmbH (MST)\nGesellschaft mit beschränkter Haftung\nMülheim an der Ruhr\n\nDem Registergericht ist eine neue Liste der Mitglieder des Aufsichtsrates eingereicht worden."
    },
    {
      "date": "2026-02-05",
      "id": "144447",
      "original_text": "Einreichung neuer Dokumente\nNordrhein-Westfalen Amtsgericht Bochum HRB 127\nVBW Bauen und Wohnen GmbH – Bochum",
      "type": "Einreichung neuer Dokumente",
      "state": "Nordrhein-Westfalen",
      "amtsgericht": "Amtsgericht Bochum",
      "registernummer": "HRB 127",
      "registerart": "HRB",
      "company_name": "VBW Bauen und Wohnen GmbH",
      "company_seat": "Bochum",
      "details": "05.02.2026 (Bekanntmachungsdatum)\n\nNordrhein-Westfalen Amtsgericht Bochum HRB 127\nEinreichung neuer Dokumente\n\nVBW Bauen und Wohnen GmbH\nGesellschaft mit beschränkter Haftung\nBochum\n\nDem Registergericht ist eine neue Liste der Mitglieder des Aufsichtsrates eingereicht worden."
    },
    {
      "date": "2026-02-05",
      "id": "144448",
      "original_text": "Löschungsankündigung\nNordrhein-Westfalen Amtsgericht Hamm HRB 10669\nBLOND Business UG (haftungsbeschränkt) – Fröndenberg",
      "type": "Löschungsankündigung",
      "state": "Nordrhein-Westfalen",
      "amtsgericht": "Amtsgericht Hamm",
      "registernummer": "HRB 10669",
      "registerart": "HRB",
      "company_name": "BLOND Business UG (haftungsbeschränkt)",
      "company_seat": "Fröndenberg",
      "details": "05.02.2026 (Bekanntmachungsdatum)\n\nNordrhein-Westfalen Amtsgericht Hamm HRB 10669\nLöschungsankündigung\n\nBLOND Business UG (haftungsbeschränkt)\nGesellschaft mit beschränkter Haftung\nFröndenberg\n\nDas Registergericht beabsichtigt die Gesellschaft von Amts wegen nach § 394 FamFG zu löschen. Die Frist zur Erhebung eines Widerspruchs ist auf drei Monate festgesetzt."
    },
    {
      "date": "2026-02-05",
      "id": "144449",
      "original_text": "Einreichung neuer Dokumente\nNordrhein-Westfalen Amtsgericht Dortmund HRB 12299\nDOKOM Gesellschaft für Telekommunikation mbH – Dortmund",
      "type": "Einreichung neuer Dokumente",
      "state": "Nordrhein-Westfalen",
      "amtsgericht": "Amtsgericht Dortmund",
      "registernummer": "HRB 12299",
      "registerart": "HRB",
      "company_name": "DOKOM Gesellschaft für Telekommunikation mbH",
      "company_seat": "Dortmund",
      "details": "05.02.2026 (Bekanntmachungsdatum)\n\nNordrhein-Westfalen Amtsgericht Dortmund HRB 12299\nEinreichung neuer Dokumente\n\nDOKOM Gesellschaft für Telekommunikation mbH\nGesellschaft mit beschränkter Haftung\nDortmund\n\nDem Registergericht ist eine neue Liste der Mitglieder des Aufsichtsrates eingereicht worden."
    },
    {
      "date": "2026-02-05",
      "id": "144450",
      "original_text": "Löschungsankündigung\nNordrhein-Westfalen Amtsgericht Düsseldorf HRB 98339\nF&B Autoarena KFZ-SERVICE UG (haftungsbeschränkt) – Hilden",
      "type": "Löschungsankündigung",
      "state": "Nordrhein-Westfalen",
      "amtsgericht": "Amtsgericht Düsseldorf",
      "registernummer": "HRB 98339",
      "registerart": "HRB",
      "company_name": "F&B Autoarena KFZ-SERVICE UG (haftungsbeschränkt)",
      "company_seat": "Hilden",
      "details": "05.02.2026 (Bekanntmachungsdatum)\n\nNordrhein-Westfalen Amtsgericht Düsseldorf HRB 98339\nLöschungsankündigung\n\nF&B Autoarena KFZ-SERVICE UG (haftungsbeschränkt)\nGesellschaft mit beschränkter Haftung\nHilden\n\nDas Registergericht beabsichtigt die Gesellschaft von Amts wegen nach § 394 Abs. 1 FamFG zu löschen. Die Frist zur Erhebung eines Widerspruchs ist auf 3 Wochen festgesetzt.\n\nRechtsbehelfsbelehrung:\nDas Widerspruchsrecht steht jedem zu, der an der Unterlassung der Löschung ein berechtigtes Interesse hat. Der Widerspruch ist bei dem Amtsgericht Düsseldorf -Registergericht-, Werdener Straße 1, 40227 Düsseldorf schriftlich in deutscher Sprache oder zur Niederschrift der Geschäftsstelle einzulegen. Der Widerspruch kann auch zur Niederschrift der Geschäftsstelle eines jeden Amtsgerichtes abgegeben werden. Die Einlegung ist auch durch Übertragung eines elektronischen Dokuments an die elektronische Poststelle des Gerichts möglich. Das elektronische Dokument muss für die Bearbeitung durch das Gericht geeignet und mit einer qualifizierten elektronischen Signatur der verantwortenden Person versehen sein oder von der verantwortenden Person signiert und auf einem sicheren Übermittlungsweg gemäß § 130a ZPO nach näherer Maßgabe der Verordnung über die technischen Rahmenbedingungen des elektronischen Rechtsverkehrs und über das besondere elektronische Behördenpostfach (BGBl. I, S.3803) eingereicht werden. Weitere Informationen erhalten Sie auf der Internetseite www.justiz.de.\nDer Widerspruch muss spätestens innerhalb der gesetzten Frist nach dem Datum der Bekanntmachung der Löschungsankündigung bei dem Amtsgericht - Registergericht - Düsseldorf eingegangen sein.  Dies gilt auch dann, wenn der Widerspruch zur Niederschrift der Geschäftsstelle eines anderen Amtsgerichtes abgegeben wurde. Die Frist beginnt mit dem Tage der Bekanntmachung der Löschungsankündigung in dem für die Bekanntmachung der Eintragungen in das Handelsregister bestimmten elektronischen Informations- und Kommunikationssystem nach § 10 des Handelsgesetzbuches. Fällt das Ende der Frist auf einen Sonntag, einen allgemeinen Feiertag oder Sonnabend, so endet die Frist mit Ablauf des nächsten Werktages.\nDer Widerspruch muss die Bezeichnung der angefochtenen Löschungsankündigung sowie die Erklärung enthalten, dass Widerspruch gegen diese Löschungsankündigung eingelegt wird. Er ist zu unterzeichnen und soll begründet werden."
    },
    {
      "date": "2026-02-05",
      "id": "144451",
      "original_text": "Löschungsankündigung\nNordrhein-Westfalen Amtsgericht Hagen HRB 11386\nDeep Gerüstbau Service GmbH – Hagen",
      "type": "Löschungsankündigung",
      "state": "Nordrhein-Westfalen",
      "amtsgericht": "Amtsgericht Hagen",
      "registernummer": "HRB 11386",
      "registerart": "HRB",
      "company_name": "Deep Gerüstbau Service GmbH",
      "company_seat": "Hagen",
      "details": "05.02.2026 (Bekanntmachungsdatum)\n\nNordrhein-Westfalen Amtsgericht Hagen HRB 11386\nLöschungsankündigung\n\nDeep Gerüstbau Service GmbH\nGesellschaft mit beschränkter Haftung\nHagen\n\nIn obiger Handelsregistersache wird bekannt gemacht:\nDas Registergericht beabsichtigt, die im Handelsregister eingetragene\nGesellschaft gemäß § 394 I FamFG wegen Vermögenslosigkeit von Amts\nwegen zu löschen. Gegen diese Verfügung kann Widerspruch eingelegt\nwerden. Die Frist zur Erhebung eines Widerspruchs gegen die\nbeabsichtigte Löschung von Amts wegen ist auf drei Monate festgesetzt.\nRechtsbehelfsbelehrung:\nGegen diese Verfügung können Sie Widerspruch einlegen.\nDer Widerspruch ist bei dem Amtsgericht Hagen, Heinitzstraße 42, 58097\nHagen schriftlich in deutscher Sprache oder zur Niederschrift der\nGeschäftsstelle einzulegen. Der Widerspruch kann auch zur Niederschrift\nder Geschäftsstelle eines jeden Amtsgerichts abgegeben werden.\nDer Widerspruch muss spätestens innerhalb der gesetzten Frist bei dem\nAmtsgericht Hagen eingegangen sein. Dies gilt auch dann, wenn der\nWiderspruch zur Geschäftsstelle eines anderen Amtsgerichtes abgegeben\nwurde. Die Frist beginnt mit der Veröffentlichung. Fällt das Ende der\nFrist auf einen Sonntag, einen allgemeinen Feiertag oder Sonnabend, so\nendet die Frist mit Ablauf des nächsten Werktages.\nDer Widerspruch muss die Bezeichnung der angefochtenen Verfügung\nsowie die Erklärung erhalten, dass Widerspruch gegen diese Verfügung\neingelegt wird. Er ist zu unterzeichnen und soll begründet werden."
    },
    {
      "date": "2026-02-05",
      "id": "144452",
      "original_text": "Löschungsankündigung\nNordrhein-Westfalen Amtsgericht Gütersloh HRB 10628\nBrackhues Wohnbau GmbH – Herzebrock-Clarholz",
      "type": "Löschungsankündigung",
      "state": "Nordrhein-Westfalen",
      "amtsgericht": "Amtsgericht Gütersloh",
      "registernummer": "HRB 10628",
      "registerart": "HRB",
      "company_name": "Brackhues Wohnbau GmbH",
      "company_seat": "Herzebrock-Clarholz",
      "details": "05.02.2026 (Bekanntmachungsdatum)\n\nNordrhein-Westfalen Amtsgericht Gütersloh HRB 10628\nLöschungsankündigung 05.02.2026 (Eintragungsdatum)\n\nBrackhues Wohnbau GmbH\nGesellschaft mit beschränkter Haftung\nHerzebrock-Clarholz\n\nDas Registergericht beabsichtigt die Gesellschaft von Amts wegen nach § 394 FamFG zu löschen. Die Frist zur Erhebung eines Widerspruchs ist auf einen Monat festgesetzt."
    },
    {
      "date": "2026-02-05",
      "id": "144453",
      "original_text": "Löschungsankündigung\nNordrhein-Westfalen Amtsgericht Bad Oeynhausen HRB 16005\nSchuster Systembau UG (haftungsbeschränkt) – Bad Oeynhausen",
      "type": "Löschungsankündigung",
      "state": "Nordrhein-Westfalen",
      "amtsgericht": "Amtsgericht Bad Oeynhausen",
      "registernummer": "HRB 16005",
      "registerart": "HRB",
      "company_name": "Schuster Systembau UG (haftungsbeschränkt)",
      "company_seat": "Bad Oeynhausen",
      "details": "05.02.2026 (Bekanntmachungsdatum)\n\nNordrhein-Westfalen Amtsgericht Bad Oeynhausen HRB 16005\nLöschungsankündigung\n\nSchuster Systembau UG (haftungsbeschränkt)\nGesellschaft mit beschränkter Haftung\nBad Oeynhausen\n\nDas Registergericht beabsichtigt die Gesellschaft von Amts wegen nach § 394 FamFG zu löschen. Die Frist zur Erhebung eines Widerspruchs ist auf einen Monat festgesetzt."
    },
    {
      "date": "2026-02-05",
      "id": "144454",
      "original_text": "Registerbekanntmachung nach dem Umwandlungsgesetz\nNordrhein-Westfalen Amtsgericht Köln HRA 38389\nIndicamus Ossadnik & Feldmann GmbH & Co. oHG – Köln",
      "type": "Registerbekanntmachung nach dem Umwandlungsgesetz",
      "state": "Nordrhein-Westfalen",
      "amtsgericht": "Amtsgericht Köln",
      "registernummer": "HRA 38389",
      "registerart": "HRA",
      "company_name": "Indicamus Ossadnik & Feldmann GmbH & Co. oHG",
      "company_seat": "Köln",
      "details": "05.02.2026 (Bekanntmachungsdatum)\n\nNordrhein-Westfalen Amtsgericht Köln HRA 38389\nRegisterbekanntmachung nach dem Umwandlungsgesetz 05.02.2026 (Eintragungsdatum)\n\nIndicamus Ossadnik & Feldmann GmbH & Co. oHG\nOffene Handelsgesellschaft\nKöln\n\nDen Gläubigern der an der formwechselnden Umwandlung beteiligten Rechtsträger ist, wenn sie binnen sechs Monaten nach dem Tag, an dem die Eintragung der formwechselnden Umwandlung in das Register des Sitzes desjenigen Rechtsträgers, dessen Gläubiger sie sind, nach § 19 Absatz 3 UmwG als bekanntgemacht gilt, ihren Anspruch nach Grund und Höhe schriftlich anmelden, Sicherheit zu leisten, soweit sie nicht Befriedigung verlangen können. Dieses Recht steht den Gläubigern jedoch nur zu, wenn sie glaubhaft machen, dass durch die formwechselnden Umwandlung die Erfüllung ihrer Forderung gefährdet wird."
    },
    {
      "date": "2026-02-05",
      "id": "144455",
      "original_text": "Einreichung neuer Dokumente\nNordrhein-Westfalen Amtsgericht Duisburg HRB 9633\nStadtwerke Dinslaken GmbH – Dinslaken",
      "type": "Einreichung neuer Dokumente",
      "state": "Nordrhein-Westfalen",
      "amtsgericht": "Amtsgericht Duisburg",
      "registernummer": "HRB 9633",
      "registerart": "HRB",
      "company_name": "Stadtwerke Dinslaken GmbH",
      "company_seat": "Dinslaken",
      "details": "05.02.2026 (Bekanntmachungsdatum)\n\nNordrhein-Westfalen Amtsgericht Duisburg HRB 9633\nEinreichung neuer Dokumente\n\nStadtwerke Dinslaken GmbH\nGesellschaft mit beschränkter Haftung\nDinslaken\n\nDem Registergericht ist eine neue Liste der Mitglieder des Aufsichtsrates eingereicht worden."
    },
    {
      "date": "2026-02-05",
      "id": "144456",
      "original_text": "Einreichung neuer Dokumente\nNordrhein-Westfalen Amtsgericht Duisburg HRB 17194\nStadtentwässerung Mülheim an der Ruhr GmbH – Mülheim an der Ruhr",
      "type": "Einreichung neuer Dokumente",
      "state": "Nordrhein-Westfalen",
      "amtsgericht": "Amtsgericht Duisburg",
      "registernummer": "HRB 17194",
      "registerart": "HRB",
      "company_name": "Stadtentwässerung Mülheim an der Ruhr GmbH",
      "company_seat": "Mülheim an der Ruhr",
      "details": "05.02.2026 (Bekanntmachungsdatum)\n\nNordrhein-Westfalen Amtsgericht Duisburg HRB 17194\nEinreichung neuer Dokumente\n\nStadtentwässerung Mülheim an der Ruhr GmbH\nGesellschaft mit beschränkter Haftung\nMülheim an der Ruhr\n\nDem Registergericht ist eine Liste der Mitglieder des Aufsichtsrates eingereicht worden."
    },
    {
      "date": "2026-02-05",
      "id": "144457",
      "original_text": "Löschungsankündigung\nNordrhein-Westfalen Amtsgericht Duisburg HRB 39078\ndecoria handmade UG (haftungsbeschränkt) – Oberhausen",
      "type": "Löschungsankündigung",
      "state": "Nordrhein-Westfalen",
      "amtsgericht": "Amtsgericht Duisburg",
      "registernummer": "HRB 39078",
      "registerart": "HRB",
      "company_name": "decoria handmade UG (haftungsbeschränkt)",
      "company_seat": "Oberhausen",
      "details": "05.02.2026 (Bekanntmachungsdatum)\n\nNordrhein-Westfalen Amtsgericht Duisburg HRB 39078\nLöschungsankündigung 05.02.2026 (Eintragungsdatum)\n\ndecoria handmade UG (haftungsbeschränkt)\nGesellschaft mit beschränkter Haftung\nOberhausen\n\nHRB 39078\ndecoria handmade UG (haftungsbeschränkt)\nOberhausen,\nStöckmannstr. 72\n46045 Oberhausen\nDas Registergericht beabsichtigt, die im Handelsregister eingetragene Gesellschaft gemäß § 394 Absatz 1 FamFG wegen Vermögenslosigkeit von Amts wegen zu löschen. Gegen diese Verfügung kann Widerspruch eingelegt werden. Die Frist zur Erhebung eines Widerspruchs gegen die beabsichtigte Löschung von Amts wegen ist auf drei Monate festgesetzt. Rechtsbehelfsbelehrung Der Widerspruch ist bei dem Amtsgericht Duisburg, Kardinal-Galen-Str. 124-132, 47058 Duisburg schriftlich in deutscher Sprache oder zur Niederschrift der Geschäftsstelle einzulegen. Der Widerspruch kann auch zur Niederschrift der Geschäftsstelle eines jeden Amtsgerichtes abgegeben werden. Die Einlegung ist auch durch Übertragung eines elektronischen Dokuments an die elektronische Poststelle des Gerichts möglich. Das elektronische Dokument muss für die Bearbeitung durch das Gericht geeignet und mit einer qualifizierten elektronischen Signatur der verantwortenden Person versehen sein oder von der verantwortenden Person signiert und auf einem sicheren Übermittlungsweg gemäß § 130 a ZPO nach näherer Maßgabe der Verordnung über die technischen Rahmenbedingungen des elektronischen Rechtsverkehrs und über das besondere elektronische Behördenpostfach (BGBl. I, S. 3803) eingereicht werden. Weitere Informationen erhalten Sie auf der Internetseite www.justiz.de <http://www.justiz.de> <<http://www.justiz.de>>. Der Widerspruch muss spätestens innerhalb der gesetzten Frist bei dem Amtsgericht Duisburg eingegangen sein. Dies gilt auch dann, wenn der Widerspruch zur Niederschrift der Geschäftsstelle eines anderen Amtsgerichtes abgegeben wurde. Die Frist beginnt mit der Veröffentlichung. Fällt das Ende der Frist auf einen Sonntag, einen allgemeinen Feiertag oder Sonnabend, so endet die Frist mit Ablauf des nächsten Werktages. Der Widerspruch muss die Bezeichnung der angefochtenen Verfügung sowie die Erklärung enthalten, dass Widerspruch gegen diese Verfügung eingelegt wird. Er ist zu unterzeichnen und soll begründet werden."
    },
    {
      "date": "2026-02-05",
      "id": "144458",
      "original_text": "Einreichung neuer Dokumente\nNordrhein-Westfalen Amtsgericht Dortmund HRB 9696\nEDG Holding GmbH – Dortmund",
      "type": "Einreichung neuer Dokumente",
      "state": "Nordrhein-Westfalen",
      "amtsgericht": "Amtsgericht Dortmund",
      "registernummer": "HRB 9696",
      "registerart": "HRB",
      "company_name": "EDG Holding GmbH",
      "company_seat": "Dortmund",
      "details": "05.02.2026 (Bekanntmachungsdatum)\n\nNordrhein-Westfalen Amtsgericht Dortmund HRB 9696\nEinreichung neuer Dokumente\n\nEDG Holding GmbH\nGesellschaft mit beschränkter Haftung\nDortmund\n\nDem Registergericht ist eine neue Liste der Mitglieder des Aufsichtsrates eingereicht worden."
    },
    {
      "date": "2026-02-05",
      "id": "144459",
      "original_text": "Löschungsankündigung\nNordrhein-Westfalen Amtsgericht Dortmund HRB 31009\nUltimate Skins UG (haftungsbeschränkt) – Dortmund",
      "type": "Löschungsankündigung",
      "state": "Nordrhein-Westfalen",
      "amtsgericht": "Amtsgericht Dortmund",
      "registernummer": "HRB 31009",
      "registerart": "HRB",
      "company_name": "Ultimate Skins UG (haftungsbeschränkt)",
      "company_seat": "Dortmund",
      "details": "05.02.2026 (Bekanntmachungsdatum)\n\nNordrhein-Westfalen Amtsgericht Dortmund HRB 31009\nLöschungsankündigung\n\nUltimate Skins UG (haftungsbeschränkt)\nGesellschaft mit beschränkter Haftung\nDortmund\n\nDas Registergericht beabsichtigt die Gesellschaft von Amts wegen nach § 394 FamFG zu löschen. Die Frist zur Erhebung eines Widerspruchs ist auf zwei Monate festgesetzt."
    },
    {
      "date": "2026-02-05",
      "id": "144460",
      "original_text": "Registerbekanntmachung nach dem Umwandlungsgesetz\nNordrhein-Westfalen Amtsgericht Köln HRB 125035\nDENUS Dreihundertsiebenundvierzig Unternehmensverwaltungs GmbH – Köln",
      "type": "Registerbekanntmachung nach dem Umwandlungsgesetz",
      "state": "Nordrhein-Westfalen",
      "amtsgericht": "Amtsgericht Köln",
      "registernummer": "HRB 125035",
      "registerart": "HRB",
      "company_name": "DENUS Dreihundertsiebenundvierzig Unternehmensverwaltungs GmbH",
      "company_seat": "Köln",
      "details": "05.02.2026 (Bekanntmachungsdatum)\n\nNordrhein-Westfalen Amtsgericht Köln HRB 125035\nRegisterbekanntmachung nach dem Umwandlungsgesetz 05.02.2026 (Eintragungsdatum)\n\nDENUS Dreihundertsiebenundvierzig Unternehmensverwaltungs GmbH\nGesellschaft mit beschränkter Haftung\nKöln\n\nDen Gläubigern der an der Abspaltung beteiligten Rechtsträger ist, wenn sie binnen sechs Monaten nach dem Tag, an dem die Eintragung der Abspaltung in das Register des Sitzes desjenigen Rechtsträgers, dessen Gläubiger sie sind, nach § 19 Absatz 3 UmwG als bekanntgemacht gilt, ihren Anspruch nach Grund und Höhe schriftlich anmelden, Sicherheit zu leisten, soweit sie nicht Befriedigung verlangen können. Dieses Recht steht den Gläubigern jedoch nur zu, wenn sie glaubhaft machen, dass durch die Abspaltung die Erfüllung ihrer Forderung gefährdet wird."
    },
    {
      "date": "2026-02-05",
      "id": "144461",
      "original_text": "Einreichung neuer Dokumente\nNordrhein-Westfalen Amtsgericht Köln HRB 77909\nBN & Partners Capital AG – Erftstadt",
      "type": "Einreichung neuer Dokumente",
      "state": "Nordrhein-Westfalen",
      "amtsgericht": "Amtsgericht Köln",
      "registernummer": "HRB 77909",
      "registerart": "HRB",
      "company_name": "BN & Partners Capital AG",
      "company_seat": "Erftstadt",
      "details": "05.02.2026 (Bekanntmachungsdatum)\n\nNordrhein-Westfalen Amtsgericht Köln HRB 77909\nEinreichung neuer Dokumente\n\nBN & Partners Capital AG\nAktiengesellschaft\nErftstadt\n\nDem Registergericht ist eine neue Liste der Mitglieder des Aufsichtsrates eingereicht worden."
    },
    {
      "date": "2026-02-05",
      "id": "144462",
      "original_text": "Registerbekanntmachung nach dem Umwandlungsgesetz\nHessen Amtsgericht Offenbach am Main HRB 48315\nRoos Malermeister GmbH – Dreieich",
      "type": "Registerbekanntmachung nach dem Umwandlungsgesetz",
      "state": "Hessen",
      "amtsgericht": "Amtsgericht Offenbach am Main",
      "registernummer": "HRB 48315",
      "registerart": "HRB",
      "company_name": "Roos Malermeister GmbH",
      "company_seat": "Dreieich",
      "details": "05.02.2026 (Bekanntmachungsdatum)\n\nHessen Amtsgericht Offenbach am Main HRB 48315\nRegisterbekanntmachung nach dem Umwandlungsgesetz 05.02.2026 (Eintragungsdatum)\n\nRoos Malermeister GmbH\nGesellschaft mit beschränkter Haftung\nDreieich\n\nDen Gläubigern der an der Verschmelzung beteiligten Rechtsträger ist, wenn sie binnen sechs Monaten nach dem Tag, an dem die Eintragung der Verschmelzung in das Register des Sitzes desjenigen Rechtsträgers, dessen Gläubiger sie sind, nach § 19 Absatz 3 UmwG bekannt gemacht worden ist, ihren Anspruch nach Grund und Höhe schriftlich anmelden, Sicherheit zu leisten, soweit sie nicht Befriedigung verlangen können. Dieses Recht steht den Gläubigern jedoch nur zu, wenn sie glaubhaft machen, dass durch die Verschmelzung die Erfüllung ihrer Forderung gefährdet wird."
    },
    {
      "date": "2026-02-05",
      "id": "144463",
      "original_text": "Einreichung neuer Dokumente\nHessen Amtsgericht Frankfurt am Main HRB 83600\nGAIA Verwaltungs AG – Frankfurt am Main",
      "type": "Einreichung neuer Dokumente",
      "state": "Hessen",
      "amtsgericht": "Amtsgericht Frankfurt am Main",
      "registernummer": "HRB 83600",
      "registerart": "HRB",
      "company_name": "GAIA Verwaltungs AG",
      "company_seat": "Frankfurt am Main",
      "details": "05.02.2026 (Bekanntmachungsdatum)\n\nHessen Amtsgericht Frankfurt am Main HRB 83600\nEinreichung neuer Dokumente\n\nGAIA Verwaltungs AG\nAktiengesellschaft\nFrankfurt am Main\n\nDurch eine Änderung in den Personen der Aufsichtsratsmitglieder ist eine Liste der Mitglieder des Aufsichtsrates zum Handelsregister eingereicht worden."
    },
    {
      "date": "2026-02-05",
      "id": "144464",
      "original_text": "Einreichung neuer Dokumente\nHessen Amtsgericht Darmstadt HRB 25883\nKLN Ultraschall AG – Heppenheim (Bergstraße)",
      "type": "Einreichung neuer Dokumente",
      "state": "Hessen",
      "amtsgericht": "Amtsgericht Darmstadt",
      "registernummer": "HRB 25883",
      "registerart": "HRB",
      "company_name": "KLN Ultraschall AG",
      "company_seat": "Heppenheim (Bergstraße)",
      "details": "05.02.2026 (Bekanntmachungsdatum)\n\nHessen Amtsgericht Darmstadt HRB 25883\nEinreichung neuer Dokumente\n\nKLN Ultraschall AG\nAktiengesellschaft\nHeppenheim (Bergstraße)\n\nWegen Änderungen in den Personen der Aufsichtsratsmitglieder ist eine Liste der Mitglieder des Aufsichtsrates zum Handelsregister eingereicht worden."
    },
    {
      "date": "2026-02-05",
      "id": "144465",
      "original_text": "Löschungsankündigung\nHessen Amtsgericht Hanau HRB 96885\nHA Bau GmbH – Hanau",
      "type": "Löschungsankündigung",
      "state": "Hessen",
      "amtsgericht": "Amtsgericht Hanau",
      "registernummer": "HRB 96885",
      "registerart": "HRB",
      "company_name": "HA Bau GmbH",
      "company_seat": "Hanau",
      "details": "05.02.2026 (Bekanntmachungsdatum)\n\nHessen Amtsgericht Hanau HRB 96885\nLöschungsankündigung\n\nHA Bau GmbH\nGesellschaft mit beschränkter Haftung\nHanau\n\nDas Registergericht beabsichtigt die im Handelsregister eingetragene Gesellschaft von Amts wegen nach § 394 FamFG zu löschen. Die Frist zur Erhebung eines Widerspruchs gegen die beabsichtigte Löschung wird auf 3 Monate festgesetzt."
    },
    {
      "date": "2026-02-05",
      "id": "144466",
      "original_text": "Löschungsankündigung\nHessen Amtsgericht Frankfurt am Main HRB 121850\nPK Sarang UG (haftungsbeschränkt) – Frankfurt am Main",
      "type": "Löschungsankündigung",
      "state": "Hessen",
      "amtsgericht": "Amtsgericht Frankfurt am Main",
      "registernummer": "HRB 121850",
      "registerart": "HRB",
      "company_name": "PK Sarang UG (haftungsbeschränkt)",
      "company_seat": "Frankfurt am Main",
      "details": "05.02.2026 (Bekanntmachungsdatum)\n\nHessen Amtsgericht Frankfurt am Main HRB 121850\nLöschungsankündigung\n\nPK Sarang UG (haftungsbeschränkt)\nGesellschaft mit beschränkter Haftung\nFrankfurt am Main\n\nEs ist beabsichtigt, die Gesellschaft wegen Vermögenslosigkeit gemäß § 394 FamFG von Amts wegen im Handelsregister zu löschen. Hiergegen kann innerhalb eines Monats nach dieser Veröffentlichung Widerspruch bei dem Amtsgericht Frankfurt am Main eingelegt werden."
    },
    {
      "date": "2026-02-05",
      "id": "144467",
      "original_text": "Registerbekanntmachung nach dem Umwandlungsgesetz\nHessen Amtsgericht Marburg HRB 7662\nMuscle Club Stadtallendorf GmbH – Stadtallendorf",
      "type": "Registerbekanntmachung nach dem Umwandlungsgesetz",
      "state": "Hessen",
      "amtsgericht": "Amtsgericht Marburg",
      "registernummer": "HRB 7662",
      "registerart": "HRB",
      "company_name": "Muscle Club Stadtallendorf GmbH",
      "company_seat": "Stadtallendorf",
      "details": "05.02.2026 (Bekanntmachungsdatum)\n\nHessen Amtsgericht Marburg HRB 7662\nRegisterbekanntmachung nach dem Umwandlungsgesetz 05.02.2026 (Eintragungsdatum)\n\nMuscle Club Stadtallendorf GmbH\nGesellschaft mit beschränkter Haftung\nStadtallendorf\n\nDen Gläubigern der an der Verschmelzung beteiligten Rechtsträger ist, wenn sie binnen sechs Monaten nach dem Tag, an dem die Eintragung der Verschmelzung in das Register des Sitzes desjenigen Rechtsträgers, dessen Gläubiger sie sind, nach § 19 Absatz 3 UmwG bekannt gemacht worden ist, ihren Anspruch nach Grund und Höhe schriftlich anmelden, Sicherheit zu leisten, soweit sie nicht Befriedigung verlangen können. Dieses Recht steht den Gläubigern jedoch nur zu, wenn sie glaubhaft machen, dass durch die Verschmelzung die Erfüllung ihrer Forderung gefährdet wird."
    },
    {
      "date": "2026-02-05",
      "id": "144468",
      "original_text": "Registerbekanntmachung nach dem Umwandlungsgesetz\nHessen Amtsgericht Hanau HRB 99611\nZankel Engineering GmbH – Gründau",
      "type": "Registerbekanntmachung nach dem Umwandlungsgesetz",
      "state": "Hessen",
      "amtsgericht": "Amtsgericht Hanau",
      "registernummer": "HRB 99611",
      "registerart": "HRB",
      "company_name": "Zankel Engineering GmbH",
      "company_seat": "Gründau",
      "details": "05.02.2026 (Bekanntmachungsdatum)\n\nHessen Amtsgericht Hanau HRB 99611\nRegisterbekanntmachung nach dem Umwandlungsgesetz 05.02.2026 (Eintragungsdatum)\n\nZankel Engineering GmbH\nGesellschaft mit beschränkter Haftung\nGründau\n\nDen Gläubigern der an der Verschmelzung beteiligten Rechtsträger ist, wenn sie binnen sechs Monaten nach dem Tag, an dem die Eintragung der Verschmelzung in das Register des Sitzes desjenigen Rechtsträgers, dessen Gläubiger sie sind, nach § 19 Absatz 3 UmwG bekannt gemacht worden ist, ihren Anspruch nach Grund und Höhe schriftlich anmelden, Sicherheit zu leisten, soweit sie nicht Befriedigung verlangen können. Dieses Recht steht den Gläubigern jedoch nur zu, wenn sie glaubhaft machen, dass durch die Verschmelzung die Erfüllung ihrer Forderung gefährdet wird."
    },
    {
      "date": "2026-02-05",
      "id": "144469",
      "original_text": "Sonstige Registerbekanntmachung\nHessen Amtsgericht Limburg VR 513\nReiterfreunde Selters 1980 – Selters (Taunus)-Eisenbach",
      "type": "Sonstige Registerbekanntmachung",
      "state": "Hessen",
      "amtsgericht": "Amtsgericht Limburg",
      "registernummer": "VR 513",
      "registerart": "VR",
      "company_name": "Reiterfreunde Selters 1980",
      "company_seat": "Selters (Taunus)-Eisenbach",
      "details": "05.02.2026 (Bekanntmachungsdatum)\n\nHessen Amtsgericht Limburg VR 513\nSonstige Registerbekanntmachung 05.02.2026 (Eintragungsdatum)\n\nReiterfreunde Selters 1980\neingetragener Verein\nSelters (Taunus)-Eisenbach\n\nDer Verein ist aufgelöst."
    },
    {
      "date": "2026-02-05",
      "id": "144470",
      "original_text": "Löschungsankündigung\nHessen Amtsgericht Frankfurt am Main HRB 123047\nEvendora Handel UG (haftungsbeschränkt) – Frankfurt am Main",
      "type": "Löschungsankündigung",
      "state": "Hessen",
      "amtsgericht": "Amtsgericht Frankfurt am Main",
      "registernummer": "HRB 123047",
      "registerart": "HRB",
      "company_name": "Evendora Handel UG (haftungsbeschränkt)",
      "company_seat": "Frankfurt am Main",
      "details": "05.02.2026 (Bekanntmachungsdatum)\n\nHessen Amtsgericht Frankfurt am Main HRB 123047\nLöschungsankündigung\n\nEvendora Handel UG (haftungsbeschränkt)\nGesellschaft mit beschränkter Haftung\nFrankfurt am Main\n\nEs ist beabsichtigt die Gesellschaft wegen Vermögenslosigkeit gemäß § 394 FamFG von Amts wegen zu löschen. Hiergegen kann innerhalb eines Monats nach dieser Veröffentlichung Widerspruch bei dem Amtsgericht Frankfurt am Main eingelegt werden."
    },
    {
      "date": "2026-02-05",
      "id": "144471",
      "original_text": "Löschungsankündigung\nHessen Amtsgericht Frankfurt am Main HRB 91552\nA. G. Bau GmbH – Frankfurt am Main",
      "type": "Löschungsankündigung",
      "state": "Hessen",
      "amtsgericht": "Amtsgericht Frankfurt am Main",
      "registernummer": "HRB 91552",
      "registerart": "HRB",
      "company_name": "A. G. Bau GmbH",
      "company_seat": "Frankfurt am Main",
      "details": "05.02.2026 (Bekanntmachungsdatum)\n\nHessen Amtsgericht Frankfurt am Main HRB 91552\nLöschungsankündigung\n\nA. G. Bau GmbH\nGesellschaft mit beschränkter Haftung\nFrankfurt am Main\n\nEs ist beabsichtig, die Gesellschaft wegen Vermögenslosigkeit gemäß § 394 FamFG von Amts wegen im Handelsregister zu löschen. Hiergegen kann innerhalb eines Zeitraums von 1 Monat nach dieser Veröffentlichung Widerspruch bei dem Amtsgericht Frankfurt am Main eingelegt werden."
    },
    {
      "date": "2026-02-05",
      "id": "144472",
      "original_text": "Einreichung neuer Dokumente\nHessen Amtsgericht Frankfurt am Main HRB 111049\nINSTANT IPO SE – Frankfurt am Main",
      "type": "Einreichung neuer Dokumente",
      "state": "Hessen",
      "amtsgericht": "Amtsgericht Frankfurt am Main",
      "registernummer": "HRB 111049",
      "registerart": "HRB",
      "company_name": "INSTANT IPO SE",
      "company_seat": "Frankfurt am Main",
      "details": "05.02.2026 (Bekanntmachungsdatum)\n\nHessen Amtsgericht Frankfurt am Main HRB 111049\nEinreichung neuer Dokumente\n\nINSTANT IPO SE\nEuropäische Aktiengesellschaft (SE)\nFrankfurt am Main\n\nDurch eine Änderung in den Personen der Verwaltungsratsmitglieder ist eine Liste der Mitglieder des Verwaltungsrates zum Handelsregister eingereicht worden."
    },
    {
      "date": "2026-02-05",
      "id": "144473",
      "original_text": "Löschungsankündigung\nHessen Amtsgericht Hanau HRB 98421\nD-OV - Deine Objektverwaltung GmbH – Jossgrund",
      "type": "Löschungsankündigung",
      "state": "Hessen",
      "amtsgericht": "Amtsgericht Hanau",
      "registernummer": "HRB 98421",
      "registerart": "HRB",
      "company_name": "D-OV - Deine Objektverwaltung GmbH",
      "company_seat": "Jossgrund",
      "details": "05.02.2026 (Bekanntmachungsdatum)\n\nHessen Amtsgericht Hanau HRB 98421\nLöschungsankündigung\n\nD-OV - Deine Objektverwaltung GmbH\nGesellschaft mit beschränkter Haftung\nJossgrund\n\nDas Registergericht beabsichtigt den im Handelsregister eingetragenen Geschäftsführer Dugandzic, Toni, Jossgrund, *28.12.1986 von Amts wegen nach § 395 FamFG zu löschen. Die Frist zur Erhebung eines Widerspruchs gegen die beabsichtigte Löschung wird auf 3 Monate festgesetzt."
    },
    {
      "date": "2026-02-05",
      "id": "144474",
      "original_text": "Löschungsankündigung\nHessen Amtsgericht Wiesbaden HRB 30666\nÖSN-Wohnbau GmbH – Wiesbaden",
      "type": "Löschungsankündigung",
      "state": "Hessen",
      "amtsgericht": "Amtsgericht Wiesbaden",
      "registernummer": "HRB 30666",
      "registerart": "HRB",
      "company_name": "ÖSN-Wohnbau GmbH",
      "company_seat": "Wiesbaden",
      "details": "05.02.2026 (Bekanntmachungsdatum)\n\nHessen Amtsgericht Wiesbaden HRB 30666\nLöschungsankündigung\n\nÖSN-Wohnbau GmbH\nGesellschaft mit beschränkter Haftung\nWiesbaden\n\nDas Registergericht beabsichtigt die im Handelsregister eingetragene Gesellschaft von Amts wegen nach § 394 FamFG zu löschen. Die Frist zur Erhebung eines Widerspruchs gegen die beabsichtigte Löschung wird auf 3 Monate festgesetzt."
    },
    {
      "date": "2026-02-05",
      "id": "144475",
      "original_text": "Sonstige Registerbekanntmachung\nHessen Amtsgericht Darmstadt VR 2124\nFreie Wähler Weiterstadt – Weiterstadt",
      "type": "Sonstige Registerbekanntmachung",
      "state": "Hessen",
      "amtsgericht": "Amtsgericht Darmstadt",
      "registernummer": "VR 2124",
      "registerart": "VR",
      "company_name": "Freie Wähler Weiterstadt",
      "company_seat": "Weiterstadt",
      "details": "05.02.2026 (Bekanntmachungsdatum)\n\nHessen Amtsgericht Darmstadt VR 2124\nSonstige Registerbekanntmachung 05.02.2026 (Eintragungsdatum)\n\nFreie Wähler Weiterstadt\neingetragener Verein\nWeiterstadt\n\nDer Verein ist aufgelöst."
    },
    {
      "date": "2026-02-05",
      "id": "144476",
      "original_text": "Löschungsankündigung\nHessen Amtsgericht Frankfurt am Main HRB 116887\nDeluxe Bau GmbH – Eschborn",
      "type": "Löschungsankündigung",
      "state": "Hessen",
      "amtsgericht": "Amtsgericht Frankfurt am Main",
      "registernummer": "HRB 116887",
      "registerart": "HRB",
      "company_name": "Deluxe Bau GmbH",
      "company_seat": "Eschborn",
      "details": "05.02.2026 (Bekanntmachungsdatum)\n\nHessen Amtsgericht Frankfurt am Main HRB 116887\nLöschungsankündigung\n\nDeluxe Bau GmbH\nGesellschaft mit beschränkter Haftung\nEschborn\n\nEs ist beabsichtigt, die Gesellschaft wegen Vermögenslosigkeit gemäß § 394 FamFG von Amts wegen im Handelsregister zu löschen. Hiergegen kann innerhalb eines Monats nach dieser Veröffentlichung Widerspruch bei dem Amtsgericht Frankfurt am Main eingelegt werden."
    },
    {
      "date": "2026-02-05",
      "id": "144477",
      "original_text": "Registerbekanntmachung nach dem Umwandlungsgesetz\nHessen Amtsgericht Frankfurt am Main HRB 82015\nDIC 26 Portfolio GmbH – Frankfurt am Main",
      "type": "Registerbekanntmachung nach dem Umwandlungsgesetz",
      "state": "Hessen",
      "amtsgericht": "Amtsgericht Frankfurt am Main",
      "registernummer": "HRB 82015",
      "registerart": "HRB",
      "company_name": "DIC 26 Portfolio GmbH",
      "company_seat": "Frankfurt am Main",
      "details": "05.02.2026 (Bekanntmachungsdatum)\n\nHessen Amtsgericht Frankfurt am Main HRB 82015\nRegisterbekanntmachung nach dem Umwandlungsgesetz 05.02.2026 (Eintragungsdatum)\n\nDIC 26 Portfolio GmbH\nGesellschaft mit beschränkter Haftung\nFrankfurt am Main\n\nDen Gläubigern der an der Verschmelzung beteiligten Rechtsträger ist, wenn sie binnen sechs Monaten nach dem Tag, an dem die Eintragung der Verschmelzung in das Register des Sitzes desjenigen Rechtsträgers, dessen Gläubiger sie sind, nach § 19 Absatz 3 UmwG bekannt gemacht worden ist, ihren Anspruch nach Grund und Höhe schriftlich anmelden, Sicherheit zu leisten, soweit sie nicht Befriedigung verlangen können. Dieses Recht steht den Gläubigern jedoch nur zu, wenn sie glaubhaft machen, dass durch die Verschmelzung die Erfüllung ihrer Forderung gefährdet wird."
    },
    {
      "date": "2026-02-05",
      "id": "144478",
      "original_text": "Löschungsankündigung\nHessen Amtsgericht Frankfurt am Main HRB 96084\nPrestige PD GmbH – Hofheim",
      "type": "Löschungsankündigung",
      "state": "Hessen",
      "amtsgericht": "Amtsgericht Frankfurt am Main",
      "registernummer": "HRB 96084",
      "registerart": "HRB",
      "company_name": "Prestige PD GmbH",
      "company_seat": "Hofheim",
      "details": "05.02.2026 (Bekanntmachungsdatum)\n\nHessen Amtsgericht Frankfurt am Main HRB 96084\nLöschungsankündigung\n\nPrestige PD GmbH\nGesellschaft mit beschränkter Haftung\nHofheim\n\nEs ist beabsichtigt, die Gesellschaft wegen Vermögenslosigkeit gemäß § 394 FamFG von Amts wegen im Handelsregister zu löschen. Hiergegen kann innerhalb eines Monats nach dieser Veröffentlichung Widerspruch bei dem Amtsgericht Frankfurt am Main eingelegt werden."
    },
    {
      "date": "2026-02-05",
      "id": "144479",
      "original_text": "Registerbekanntmachung nach dem Umwandlungsgesetz\nHessen Amtsgericht Frankfurt am Main HRB 127237\nWartpress GmbH – Frankfurt am Main",
      "type": "Registerbekanntmachung nach dem Umwandlungsgesetz",
      "state": "Hessen",
      "amtsgericht": "Amtsgericht Frankfurt am Main",
      "registernummer": "HRB 127237",
      "registerart": "HRB",
      "company_name": "Wartpress GmbH",
      "company_seat": "Frankfurt am Main",
      "details": "05.02.2026 (Bekanntmachungsdatum)\n\nHessen Amtsgericht Frankfurt am Main HRB 127237\nRegisterbekanntmachung nach dem Umwandlungsgesetz 05.02.2026 (Eintragungsdatum)\n\nWartpress GmbH\nGesellschaft mit beschränkter Haftung\nFrankfurt am Main\n\nDen Gläubigern der an der Verschmelzung beteiligten Rechtsträger ist, wenn sie binnen sechs Monaten nach dem Tag, an dem die Eintragung der Verschmelzung in das Register des Sitzes desjenigen Rechtsträgers, dessen Gläubiger sie sind, nach § 19 Absatz 3 UmwG bekannt gemacht worden ist, ihren Anspruch nach Grund und Höhe schriftlich anmelden, Sicherheit zu leisten, soweit sie nicht Befriedigung verlangen können. Dieses Recht steht den Gläubigern jedoch nur zu, wenn sie glaubhaft machen, dass durch die Verschmelzung die Erfüllung ihrer Forderung gefährdet wird."
    },
    {
      "date": "2026-02-05",
      "id": "144480",
      "original_text": "Registerbekanntmachung nach dem Umwandlungsgesetz\nHessen Amtsgericht Frankfurt am Main HRB 82048\nDIC 26 Wiesbaden GmbH – Frankfurt am Main",
      "type": "Registerbekanntmachung nach dem Umwandlungsgesetz",
      "state": "Hessen",
      "amtsgericht": "Amtsgericht Frankfurt am Main",
      "registernummer": "HRB 82048",
      "registerart": "HRB",
      "company_name": "DIC 26 Wiesbaden GmbH",
      "company_seat": "Frankfurt am Main",
      "details": "05.02.2026 (Bekanntmachungsdatum)\n\nHessen Amtsgericht Frankfurt am Main HRB 82048\nRegisterbekanntmachung nach dem Umwandlungsgesetz 05.02.2026 (Eintragungsdatum)\n\nDIC 26 Wiesbaden GmbH\nGesellschaft mit beschränkter Haftung\nFrankfurt am Main\n\nDen Gläubigern der an der Verschmelzung beteiligten Rechtsträger ist, wenn sie binnen sechs Monaten nach dem Tag, an dem die Eintragung der Verschmelzung in das Register des Sitzes desjenigen Rechtsträgers, dessen Gläubiger sie sind, nach § 19 Absatz 3 UmwG bekannt gemacht worden ist, ihren Anspruch nach Grund und Höhe schriftlich anmelden, Sicherheit zu leisten, soweit sie nicht Befriedigung verlangen können. Dieses Recht steht den Gläubigern jedoch nur zu, wenn sie glaubhaft machen, dass durch die Verschmelzung die Erfüllung ihrer Forderung gefährdet wird."
    },
    {
      "date": "2026-02-05",
      "id": "144481",
      "original_text": "Sonstige Registerbekanntmachung\nHessen Amtsgericht Frankfurt am Main HRB 128539\nStabilus SE – Frankfurt am Main",
      "type": "Sonstige Registerbekanntmachung",
      "state": "Hessen",
      "amtsgericht": "Amtsgericht Frankfurt am Main",
      "registernummer": "HRB 128539",
      "registerart": "HRB",
      "company_name": "Stabilus SE",
      "company_seat": "Frankfurt am Main",
      "details": "05.02.2026 (Bekanntmachungsdatum)\n\nHessen Amtsgericht Frankfurt am Main HRB 128539\nSonstige Registerbekanntmachung 05.02.2026 (Eintragungsdatum)\n\nStabilus SE\nEuropäische Aktiengesellschaft (SE)\nFrankfurt am Main\n\nDurch eine Änderung in den Personen der Aufsichtsratsmitglieder ist eine Liste der Mitglieder des Aufsichtsrates zum Handelsregister eingereicht worden."
    }
  ]
}