{
  "date": "2026-02-11",
  "date_of_scrape": "2026-02-12T04:45:08.709Z",
  "tool_version": "0.2.0",
  "number_of_announcements": 124,
  "announcements": [
    {
      "date": "2026-02-11",
      "id": "144790",
      "original_text": "Registerbekanntmachung nach dem Umwandlungsgesetz\nBayern Amtsgericht München HRB 173943\nCARSYNC GmbH – München",
      "type": "Registerbekanntmachung nach dem Umwandlungsgesetz",
      "state": "Bayern",
      "amtsgericht": "Amtsgericht München",
      "registernummer": "HRB 173943",
      "registerart": "HRB",
      "company_name": "CARSYNC GmbH",
      "company_seat": "München",
      "details": "11.02.2026 (Bekanntmachungsdatum)\n\nBayern Amtsgericht München HRB 173943\nRegisterbekanntmachung nach dem Umwandlungsgesetz 10.02.2026 (Eintragungsdatum)\n\nCARSYNC GmbH\nGesellschaft mit beschränkter Haftung\nMünchen\n\nDen Gläubigern der an der Verschmelzung beteiligten Rechtsträger ist, wenn sie binnen sechs Monaten nach dem Tag, an dem die Eintragung der Verschmelzung in das Register des Sitzes desjenigen Rechtsträgers, dessen Gläubiger sie sind, nach § 19 Abs. 3 UmwG als bekannt gemacht gilt, ihren Anspruch nach Grund und Höhe in Textform anmelden, Sicherheit zu leisten, soweit sie nicht Befriedigung verlangen können. Dieses Recht steht den Gläubigern jedoch nur zu, wenn sie glaubhaft machen, dass durch die Verschmelzung die Erfüllung ihrer Forderung gefährdet wird."
    },
    {
      "date": "2026-02-11",
      "id": "144791",
      "original_text": "Löschungsankündigung\nBayern Amtsgericht Nürnberg HRB 13613\nKitty-Werbung GmbH – Postbauer-Heng",
      "type": "Löschungsankündigung",
      "state": "Bayern",
      "amtsgericht": "Amtsgericht Nürnberg",
      "registernummer": "HRB 13613",
      "registerart": "HRB",
      "company_name": "Kitty-Werbung GmbH",
      "company_seat": "Postbauer-Heng",
      "details": "11.02.2026 (Bekanntmachungsdatum)\n\nBayern Amtsgericht Nürnberg HRB 13613\nLöschungsankündigung\n\nKitty-Werbung GmbH\nGesellschaft mit beschränkter Haftung\nPostbauer-Heng\n\nDas Registergericht beabsichtigt, die im Handelsregister eingetragene Gesellschaft wegen Vermögenslosigkeit von Amts wegen nach § 394 FamFG zu löschen. Die Frist zur Erhebung eines Widerspruchs ist auf einen Monat festgesetzt."
    },
    {
      "date": "2026-02-11",
      "id": "144792",
      "original_text": "Löschungsankündigung\nBayern Amtsgericht Regensburg HRB 12173\nLiquest GmbH – Cham",
      "type": "Löschungsankündigung",
      "state": "Bayern",
      "amtsgericht": "Amtsgericht Regensburg",
      "registernummer": "HRB 12173",
      "registerart": "HRB",
      "company_name": "Liquest GmbH",
      "company_seat": "Cham",
      "details": "11.02.2026 (Bekanntmachungsdatum)\n\nBayern Amtsgericht Regensburg HRB 12173\nLöschungsankündigung 10.02.2026 (Eintragungsdatum)\n\nLiquest GmbH\nGesellschaft mit beschränkter Haftung\nCham\n\nDas Registergericht beabsichtigt, den im Handelsregister eingetragenen Geschäftsführer Karl Rupert Dischler von Amts wegen nach § 395 FamFG zu löschen. Die Frist zur Erhebung eines Widerspruchs ist auf einen Monat festgesetzt."
    },
    {
      "date": "2026-02-11",
      "id": "144793",
      "original_text": "Löschungsankündigung\nBayern Amtsgericht Nürnberg HRB 32606\nDie Jägerei Waffenhandelsgesellschaft mbH – Nürnberg",
      "type": "Löschungsankündigung",
      "state": "Bayern",
      "amtsgericht": "Amtsgericht Nürnberg",
      "registernummer": "HRB 32606",
      "registerart": "HRB",
      "company_name": "Die Jägerei Waffenhandelsgesellschaft mbH",
      "company_seat": "Nürnberg",
      "details": "11.02.2026 (Bekanntmachungsdatum)\n\nBayern Amtsgericht Nürnberg HRB 32606\nLöschungsankündigung\n\nDie Jägerei Waffenhandelsgesellschaft mbH\nGesellschaft mit beschränkter Haftung\nNürnberg\n\nDas Registergericht beabsichtigt, die im Handelsregister eingetragene Gesellschaft wegen Vermögenslosigkeit von Amts wegen nach § 394 FamFG zu löschen. Die Frist zur Erhebung eines Widerspruchs ist auf einen Monat festgesetzt."
    },
    {
      "date": "2026-02-11",
      "id": "144794",
      "original_text": "Sonstige Registerbekanntmachung\nBayern Amtsgericht München HRB 107323\nMulti Bauelemente Service Vertrieb von elektronischen Bauelementen GmbH – Forstinning",
      "type": "Sonstige Registerbekanntmachung",
      "state": "Bayern",
      "amtsgericht": "Amtsgericht München",
      "registernummer": "HRB 107323",
      "registerart": "HRB",
      "company_name": "Multi Bauelemente Service Vertrieb von elektronischen Bauelementen GmbH",
      "company_seat": "Forstinning",
      "details": "11.02.2026 (Bekanntmachungsdatum)\n\nBayern Amtsgericht München HRB 107323\nSonstige Registerbekanntmachung 10.02.2026 (Eintragungsdatum)\n\nMulti Bauelemente Service Vertrieb von elektronischen Bauelementen GmbH\nGesellschaft mit beschränkter Haftung\nForstinning\n\nDen Gläubigern der Gesellschaft, deren Forderungen begründet worden sind, bevor die Eintragung der Beendigung des Gewinnabführungsvertrages in das Handelsregister nach § 10 des Handelsgesetzbuches als bekanntgemacht gilt, hat der andere Vertragsteil Sicherheit zu leisten, wenn sie sich binnen sechs Monaten nach der Bekanntmachung der Eintragung zu diesem Zweck bei ihm melden."
    },
    {
      "date": "2026-02-11",
      "id": "144795",
      "original_text": "Einreichung neuer Dokumente\nBayern Amtsgericht München HRB 264451\nSchön Klinik SE – München",
      "type": "Einreichung neuer Dokumente",
      "state": "Bayern",
      "amtsgericht": "Amtsgericht München",
      "registernummer": "HRB 264451",
      "registerart": "HRB",
      "company_name": "Schön Klinik SE",
      "company_seat": "München",
      "details": "11.02.2026 (Bekanntmachungsdatum)\n\nBayern Amtsgericht München HRB 264451\nEinreichung neuer Dokumente 10.02.2026 (Eintragungsdatum)\n\nSchön Klinik SE\nEuropäische Aktiengesellschaft (SE)\nMünchen\n\nDem Amtsgericht München -Registergericht- ist eine Liste der Mitglieder des Aufsichtsrats eingereicht worden, Art. 9 Abs. 1 Buchst. c (ii) SE-VO i.V.m. § 106 AktG."
    },
    {
      "date": "2026-02-11",
      "id": "144796",
      "original_text": "Löschungsankündigung\nBayern Amtsgericht Nürnberg HRB 33518\nclearworks UG (haftungsbeschränkt) – Nürnberg",
      "type": "Löschungsankündigung",
      "state": "Bayern",
      "amtsgericht": "Amtsgericht Nürnberg",
      "registernummer": "HRB 33518",
      "registerart": "HRB",
      "company_name": "clearworks UG (haftungsbeschränkt)",
      "company_seat": "Nürnberg",
      "details": "11.02.2026 (Bekanntmachungsdatum)\n\nBayern Amtsgericht Nürnberg HRB 33518\nLöschungsankündigung\n\nclearworks UG (haftungsbeschränkt)\nGesellschaft mit beschränkter Haftung\nNürnberg\n\nDas Registergericht beabsichtigt, die im Handelsregister eingetragene Gesellschaft wegen Vermögenslosigkeit von Amts wegen nach § 394 FamFG zu löschen. Die Frist zur Erhebung eines Widerspruchs ist auf einen Monat festgesetzt."
    },
    {
      "date": "2026-02-11",
      "id": "144797",
      "original_text": "Löschungsankündigung\nBayern Amtsgericht München HRB 223328\nMolding Technology Germany GmbH – München",
      "type": "Löschungsankündigung",
      "state": "Bayern",
      "amtsgericht": "Amtsgericht München",
      "registernummer": "HRB 223328",
      "registerart": "HRB",
      "company_name": "Molding Technology Germany GmbH",
      "company_seat": "München",
      "details": "11.02.2026 (Bekanntmachungsdatum)\n\nBayern Amtsgericht München HRB 223328\nLöschungsankündigung 10.02.2026 (Eintragungsdatum)\n\nMolding Technology Germany GmbH\nGesellschaft mit beschränkter Haftung\nMünchen\n\nDas Registergericht beabsichtigt, die im Handelsregister eingetragene Gesellschaft wegen Vermögenslosigkeit von Amts wegen nach § 394 FamFG zu löschen. Die Frist zur Erhebung eines Widerspruchs ist auf drei Monate festgesetzt."
    },
    {
      "date": "2026-02-11",
      "id": "144798",
      "original_text": "Löschungsankündigung\nBayern Amtsgericht München HRB 243525\nSpeed Trockenbau UG (haftungsbeschränkt) – München",
      "type": "Löschungsankündigung",
      "state": "Bayern",
      "amtsgericht": "Amtsgericht München",
      "registernummer": "HRB 243525",
      "registerart": "HRB",
      "company_name": "Speed Trockenbau UG (haftungsbeschränkt)",
      "company_seat": "München",
      "details": "11.02.2026 (Bekanntmachungsdatum)\n\nBayern Amtsgericht München HRB 243525\nLöschungsankündigung 10.02.2026 (Eintragungsdatum)\n\nSpeed Trockenbau UG (haftungsbeschränkt)\nGesellschaft mit beschränkter Haftung\nMünchen\n\nDas Registergericht beabsichtigt, die im Handelsregister eingetragene Gesellschaft wegen Vermögenslosigkeit von Amts wegen nach § 394 FamFG zu löschen. Die Frist zur Erhebung eines Widerspruchs ist auf drei Monate festgesetzt."
    },
    {
      "date": "2026-02-11",
      "id": "144799",
      "original_text": "Einreichung neuer Dokumente\nBayern Amtsgericht Fürth HRB 18056\nVII. ALDI Verwaltungs-SE – Adelsdorf",
      "type": "Einreichung neuer Dokumente",
      "state": "Bayern",
      "amtsgericht": "Amtsgericht Fürth",
      "registernummer": "HRB 18056",
      "registerart": "HRB",
      "company_name": "VII. ALDI Verwaltungs-SE",
      "company_seat": "Adelsdorf",
      "details": "11.02.2026 (Bekanntmachungsdatum)\n\nBayern Amtsgericht Fürth HRB 18056\nEinreichung neuer Dokumente 10.02.2026 (Eintragungsdatum)\n\nVII. ALDI Verwaltungs-SE\nEuropäische Aktiengesellschaft (SE)\nAdelsdorf\n\nDem Amtsgericht Fürth -Registergericht- ist eine Liste der Mitglieder des Aufsichtsrats eingereicht worden, Art. 9 Abs. 1 Buchst. c (ii) SE-VO i.V.m. § 106 AktG."
    },
    {
      "date": "2026-02-11",
      "id": "144800",
      "original_text": "Registerbekanntmachung nach dem Umwandlungsgesetz\nBayern Amtsgericht München HRB 226330\nPHÖNIX - Haus Roggenberg - Pflegeheim GmbH – München",
      "type": "Registerbekanntmachung nach dem Umwandlungsgesetz",
      "state": "Bayern",
      "amtsgericht": "Amtsgericht München",
      "registernummer": "HRB 226330",
      "registerart": "HRB",
      "company_name": "PHÖNIX - Haus Roggenberg - Pflegeheim GmbH",
      "company_seat": "München",
      "details": "11.02.2026 (Bekanntmachungsdatum)\n\nBayern Amtsgericht München HRB 226330\nRegisterbekanntmachung nach dem Umwandlungsgesetz 10.02.2026 (Eintragungsdatum)\n\nPHÖNIX - Haus Roggenberg - Pflegeheim GmbH\nGesellschaft mit beschränkter Haftung\nMünchen\n\nDen Gläubigern der an der Verschmelzung beteiligten Rechtsträger ist, wenn sie binnen sechs Monaten nach dem Tag, an dem die Eintragung der Verschmelzung in das Register des Sitzes desjenigen Rechtsträgers, dessen Gläubiger sie sind, nach § 19 Abs. 3 UmwG als bekannt gemacht gilt, ihren Anspruch nach Grund und Höhe in Textform anmelden, Sicherheit zu leisten, soweit sie nicht Befriedigung verlangen können. Dieses Recht steht den Gläubigern jedoch nur zu, wenn sie glaubhaft machen, dass durch die Verschmelzung die Erfüllung ihrer Forderung gefährdet wird."
    },
    {
      "date": "2026-02-11",
      "id": "144801",
      "original_text": "Registerbekanntmachung nach dem Umwandlungsgesetz\nBayern Amtsgericht München HRB 197816\ncompany bike solutions GmbH – München",
      "type": "Registerbekanntmachung nach dem Umwandlungsgesetz",
      "state": "Bayern",
      "amtsgericht": "Amtsgericht München",
      "registernummer": "HRB 197816",
      "registerart": "HRB",
      "company_name": "company bike solutions GmbH",
      "company_seat": "München",
      "details": "11.02.2026 (Bekanntmachungsdatum)\n\nBayern Amtsgericht München HRB 197816\nRegisterbekanntmachung nach dem Umwandlungsgesetz 10.02.2026 (Eintragungsdatum)\n\ncompany bike solutions GmbH\nGesellschaft mit beschränkter Haftung\nMünchen\n\nDen Gläubigern der an der Verschmelzung beteiligten Rechtsträger ist, wenn sie binnen sechs Monaten nach dem Tag, an dem die Eintragung der Verschmelzung in das Register des Sitzes desjenigen Rechtsträgers, dessen Gläubiger sie sind, nach § 19 Abs. 3 UmwG als bekannt gemacht gilt, ihren Anspruch nach Grund und Höhe in Textform anmelden, Sicherheit zu leisten, soweit sie nicht Befriedigung verlangen können. Dieses Recht steht den Gläubigern jedoch nur zu, wenn sie glaubhaft machen, dass durch die Verschmelzung die Erfüllung ihrer Forderung gefährdet wird."
    },
    {
      "date": "2026-02-11",
      "id": "144802",
      "original_text": "Registerbekanntmachung nach dem Umwandlungsgesetz\nBayern Amtsgericht München HRB 304035\nSCUR-Alpha 1900 GmbH – München",
      "type": "Registerbekanntmachung nach dem Umwandlungsgesetz",
      "state": "Bayern",
      "amtsgericht": "Amtsgericht München",
      "registernummer": "HRB 304035",
      "registerart": "HRB",
      "company_name": "SCUR-Alpha 1900 GmbH",
      "company_seat": "München",
      "details": "11.02.2026 (Bekanntmachungsdatum)\n\nBayern Amtsgericht München HRB 304035\nRegisterbekanntmachung nach dem Umwandlungsgesetz 10.02.2026 (Eintragungsdatum)\n\nSCUR-Alpha 1900 GmbH\nGesellschaft mit beschränkter Haftung\nMünchen\n\nDen Gläubigern der an der Verschmelzung beteiligten Rechtsträger ist, wenn sie binnen sechs Monaten nach dem Tag, an dem die Eintragung der Verschmelzung in das Register des Sitzes desjenigen Rechtsträgers, dessen Gläubiger sie sind, nach § 19 Abs. 3 UmwG als bekannt gemacht gilt, ihren Anspruch nach Grund und Höhe in Textform anmelden, Sicherheit zu leisten, soweit sie nicht Befriedigung verlangen können. Dieses Recht steht den Gläubigern jedoch nur zu, wenn sie glaubhaft machen, dass durch die Verschmelzung die Erfüllung ihrer Forderung gefährdet wird."
    },
    {
      "date": "2026-02-11",
      "id": "144803",
      "original_text": "Registerbekanntmachung nach dem Umwandlungsgesetz\nBayern Amtsgericht München HRB 228322\nTQ-Real Estate GmbH – Seefeld",
      "type": "Registerbekanntmachung nach dem Umwandlungsgesetz",
      "state": "Bayern",
      "amtsgericht": "Amtsgericht München",
      "registernummer": "HRB 228322",
      "registerart": "HRB",
      "company_name": "TQ-Real Estate GmbH",
      "company_seat": "Seefeld",
      "details": "11.02.2026 (Bekanntmachungsdatum)\n\nBayern Amtsgericht München HRB 228322\nRegisterbekanntmachung nach dem Umwandlungsgesetz 10.02.2026 (Eintragungsdatum)\n\nTQ-Real Estate GmbH\nGesellschaft mit beschränkter Haftung\nSeefeld\n\nDen Gläubigern der an der Verschmelzung beteiligten Rechtsträger ist, wenn sie binnen sechs Monaten nach dem Tag, an dem die Eintragung der Verschmelzung in das Register des Sitzes desjenigen Rechtsträgers, dessen Gläubiger sie sind, nach § 19 Abs. 3 UmwG als bekannt gemacht gilt, ihren Anspruch nach Grund und Höhe in Textform anmelden, Sicherheit zu leisten, soweit sie nicht Befriedigung verlangen können. Dieses Recht steht den Gläubigern jedoch nur zu, wenn sie glaubhaft machen, dass durch die Verschmelzung die Erfüllung ihrer Forderung gefährdet wird."
    },
    {
      "date": "2026-02-11",
      "id": "144804",
      "original_text": "Registerbekanntmachung nach dem Umwandlungsgesetz\nBayern Amtsgericht München HRB 295841\nDBL R Invest GmbH – München",
      "type": "Registerbekanntmachung nach dem Umwandlungsgesetz",
      "state": "Bayern",
      "amtsgericht": "Amtsgericht München",
      "registernummer": "HRB 295841",
      "registerart": "HRB",
      "company_name": "DBL R Invest GmbH",
      "company_seat": "München",
      "details": "11.02.2026 (Bekanntmachungsdatum)\n\nBayern Amtsgericht München HRB 295841\nRegisterbekanntmachung nach dem Umwandlungsgesetz 10.02.2026 (Eintragungsdatum)\n\nDBL R Invest GmbH\nGesellschaft mit beschränkter Haftung\nMünchen\n\nDen Gläubigern der an der Verschmelzung beteiligten Rechtsträger ist, wenn sie binnen sechs Monaten nach dem Tag, an dem die Eintragung der Verschmelzung in das Register des Sitzes desjenigen Rechtsträgers, dessen Gläubiger sie sind, nach § 19 Abs. 3 UmwG als bekannt gemacht gilt, ihren Anspruch nach Grund und Höhe in Textform anmelden, Sicherheit zu leisten, soweit sie nicht Befriedigung verlangen können. Dieses Recht steht den Gläubigern jedoch nur zu, wenn sie glaubhaft machen, dass durch die Verschmelzung die Erfüllung ihrer Forderung gefährdet wird."
    },
    {
      "date": "2026-02-11",
      "id": "144805",
      "original_text": "Registerbekanntmachung nach dem Umwandlungsgesetz\nBayern Amtsgericht München HRB 230727\nAFINUM Achte Verwaltungs GmbH – München",
      "type": "Registerbekanntmachung nach dem Umwandlungsgesetz",
      "state": "Bayern",
      "amtsgericht": "Amtsgericht München",
      "registernummer": "HRB 230727",
      "registerart": "HRB",
      "company_name": "AFINUM Achte Verwaltungs GmbH",
      "company_seat": "München",
      "details": "11.02.2026 (Bekanntmachungsdatum)\n\nBayern Amtsgericht München HRB 230727\nRegisterbekanntmachung nach dem Umwandlungsgesetz 10.02.2026 (Eintragungsdatum)\n\nAFINUM Achte Verwaltungs GmbH\nGesellschaft mit beschränkter Haftung\nMünchen\n\nDen Gläubigern der an der Verschmelzung beteiligten Rechtsträger ist, wenn sie binnen sechs Monaten nach dem Tag, an dem die Eintragung der Verschmelzung in das Register des Sitzes desjenigen Rechtsträgers, dessen Gläubiger sie sind, nach § 19 Abs. 3 UmwG als bekannt gemacht gilt, ihren Anspruch nach Grund und Höhe in Textform anmelden, Sicherheit zu leisten, soweit sie nicht Befriedigung verlangen können. Dieses Recht steht den Gläubigern jedoch nur zu, wenn sie glaubhaft machen, dass durch die Verschmelzung die Erfüllung ihrer Forderung gefährdet wird."
    },
    {
      "date": "2026-02-11",
      "id": "144806",
      "original_text": "Einreichung neuer Dokumente\nBayern Amtsgericht Regensburg HRB 9964\nDömges Architekten AG – Regensburg",
      "type": "Einreichung neuer Dokumente",
      "state": "Bayern",
      "amtsgericht": "Amtsgericht Regensburg",
      "registernummer": "HRB 9964",
      "registerart": "HRB",
      "company_name": "Dömges Architekten AG",
      "company_seat": "Regensburg",
      "details": "11.02.2026 (Bekanntmachungsdatum)\n\nBayern Amtsgericht Regensburg HRB 9964\nEinreichung neuer Dokumente\n\nDömges Architekten AG\nAktiengesellschaft\nRegensburg\n\nDem Amtsgericht Regensburg -Registergericht- ist eine Liste der Mitglieder des Aufsichtsrats eingereicht worden, § 106 AktG."
    },
    {
      "date": "2026-02-11",
      "id": "144807",
      "original_text": "Registerbekanntmachung nach dem Umwandlungsgesetz\nBayern Amtsgericht München HRB 226330\nKorian Eschenpark GmbH – München",
      "type": "Registerbekanntmachung nach dem Umwandlungsgesetz",
      "state": "Bayern",
      "amtsgericht": "Amtsgericht München",
      "registernummer": "HRB 226330",
      "registerart": "HRB",
      "company_name": "Korian Eschenpark GmbH",
      "company_seat": "München",
      "details": "11.02.2026 (Bekanntmachungsdatum)\n\nBayern Amtsgericht München HRB 226330\nRegisterbekanntmachung nach dem Umwandlungsgesetz 10.02.2026 (Eintragungsdatum)\n\nKorian Eschenpark GmbH\nGesellschaft mit beschränkter Haftung\nMünchen\n\nDen Gläubigern der an der Verschmelzung beteiligten Rechtsträger ist, wenn sie binnen sechs Monaten nach dem Tag, an dem die Eintragung der Verschmelzung in das Register des Sitzes desjenigen Rechtsträgers, dessen Gläubiger sie sind, nach § 19 Abs. 3 UmwG als bekannt gemacht gilt, ihren Anspruch nach Grund und Höhe in Textform anmelden, Sicherheit zu leisten, soweit sie nicht Befriedigung verlangen können. Dieses Recht steht den Gläubigern jedoch nur zu, wenn sie glaubhaft machen, dass durch die Verschmelzung die Erfüllung ihrer Forderung gefährdet wird."
    },
    {
      "date": "2026-02-11",
      "id": "144808",
      "original_text": "Löschungsankündigung\nBayern Amtsgericht Würzburg HRA 5879\nLeontis Equity Fund Premium Select I GmbH & Co. KG – Dettelbach",
      "type": "Löschungsankündigung",
      "state": "Bayern",
      "amtsgericht": "Amtsgericht Würzburg",
      "registernummer": "HRA 5879",
      "registerart": "HRA",
      "company_name": "Leontis Equity Fund Premium Select I GmbH & Co. KG",
      "company_seat": "Dettelbach",
      "details": "11.02.2026 (Bekanntmachungsdatum)\n\nBayern Amtsgericht Würzburg HRA 5879\nLöschungsankündigung\n\nLeontis Equity Fund Premium Select I GmbH & Co. KG\nKommanditgesellschaft\nDettelbach\n\nDas Registergericht beabsichtigt, die im Handelsregister eingetragene Firma wegen Vermögenslosigkeit von Amts wegen nach § 394 FamFG zu löschen. Die Frist zur Erhebung eines Widerspruchs ist auf drei Monate festgesetzt."
    },
    {
      "date": "2026-02-11",
      "id": "144809",
      "original_text": "Registerbekanntmachung nach dem Umwandlungsgesetz\nBayern Amtsgericht München HRA 104578\nGreen City Energy Kraftwerkspark III GmbH & Co. KG – München",
      "type": "Registerbekanntmachung nach dem Umwandlungsgesetz",
      "state": "Bayern",
      "amtsgericht": "Amtsgericht München",
      "registernummer": "HRA 104578",
      "registerart": "HRA",
      "company_name": "Green City Energy Kraftwerkspark III GmbH & Co. KG",
      "company_seat": "München",
      "details": "11.02.2026 (Bekanntmachungsdatum)\n\nBayern Amtsgericht München HRA 104578\nRegisterbekanntmachung nach dem Umwandlungsgesetz 10.02.2026 (Eintragungsdatum)\n\nGreen City Energy Kraftwerkspark III GmbH & Co. KG\nKommanditgesellschaft\nMünchen\n\nDen Gläubigern der an der Verschmelzung beteiligten Rechtsträger ist, wenn sie binnen sechs Monaten nach dem Tag, an dem die Eintragung der Verschmelzung in das Register des Sitzes desjenigen Rechtsträgers, dessen Gläubiger sie sind, nach § 19 Abs. 3 UmwG als bekannt gemacht gilt, ihren Anspruch nach Grund und Höhe in Textform anmelden, Sicherheit zu leisten, soweit sie nicht Befriedigung verlangen können. Dieses Recht steht den Gläubigern jedoch nur zu, wenn sie glaubhaft machen, dass durch die Verschmelzung die Erfüllung ihrer Forderung gefährdet wird."
    },
    {
      "date": "2026-02-11",
      "id": "144810",
      "original_text": "Registerbekanntmachung nach dem Umwandlungsgesetz\nBayern Amtsgericht München HRA 104578\nGreen City Energy Kraftwerkspark III GmbH & Co. KG – München",
      "type": "Registerbekanntmachung nach dem Umwandlungsgesetz",
      "state": "Bayern",
      "amtsgericht": "Amtsgericht München",
      "registernummer": "HRA 104578",
      "registerart": "HRA",
      "company_name": "Green City Energy Kraftwerkspark III GmbH & Co. KG",
      "company_seat": "München",
      "details": "11.02.2026 (Bekanntmachungsdatum)\n\nBayern Amtsgericht München HRA 104578\nRegisterbekanntmachung nach dem Umwandlungsgesetz 10.02.2026 (Eintragungsdatum)\n\nGreen City Energy Kraftwerkspark III GmbH & Co. KG\nKommanditgesellschaft\nMünchen\n\nDen Gläubigern der an der Verschmelzung beteiligten Rechtsträger ist, wenn sie binnen sechs Monaten nach dem Tag, an dem die Eintragung der Verschmelzung in das Register des Sitzes desjenigen Rechtsträgers, dessen Gläubiger sie sind, nach § 19 Abs. 3 UmwG als bekannt gemacht gilt, ihren Anspruch nach Grund und Höhe in Textform anmelden, Sicherheit zu leisten, soweit sie nicht Befriedigung verlangen können. Dieses Recht steht den Gläubigern jedoch nur zu, wenn sie glaubhaft machen, dass durch die Verschmelzung die Erfüllung ihrer Forderung gefährdet wird."
    },
    {
      "date": "2026-02-11",
      "id": "144811",
      "original_text": "Löschungsankündigung\nBayern Amtsgericht Nürnberg HRB 28916\nmyfone GmbH – Nürnberg",
      "type": "Löschungsankündigung",
      "state": "Bayern",
      "amtsgericht": "Amtsgericht Nürnberg",
      "registernummer": "HRB 28916",
      "registerart": "HRB",
      "company_name": "myfone GmbH",
      "company_seat": "Nürnberg",
      "details": "11.02.2026 (Bekanntmachungsdatum)\n\nBayern Amtsgericht Nürnberg HRB 28916\nLöschungsankündigung\n\nmyfone GmbH\nGesellschaft mit beschränkter Haftung\nNürnberg\n\nDas Registergericht beabsichtigt, die im Handelsregister eingetragene Gesellschaft wegen Vermögenslosigkeit von Amts wegen nach § 394 FamFG zu löschen. Die Frist zur Erhebung eines Widerspruchs ist auf einen Monat festgesetzt."
    },
    {
      "date": "2026-02-11",
      "id": "144812",
      "original_text": "Registerbekanntmachung nach dem Umwandlungsgesetz\nBayern Amtsgericht München HRB 241080\nUVG Umspannwerk Verwaltungsgesellschaft mbH – Neubiberg",
      "type": "Registerbekanntmachung nach dem Umwandlungsgesetz",
      "state": "Bayern",
      "amtsgericht": "Amtsgericht München",
      "registernummer": "HRB 241080",
      "registerart": "HRB",
      "company_name": "UVG Umspannwerk Verwaltungsgesellschaft mbH",
      "company_seat": "Neubiberg",
      "details": "11.02.2026 (Bekanntmachungsdatum)\n\nBayern Amtsgericht München HRB 241080\nRegisterbekanntmachung nach dem Umwandlungsgesetz 10.02.2026 (Eintragungsdatum)\n\nUVG Umspannwerk Verwaltungsgesellschaft mbH\nGesellschaft mit beschränkter Haftung\nNeubiberg\n\nDen Gläubigern der an der Verschmelzung beteiligten Rechtsträger ist, wenn sie binnen sechs Monaten nach dem Tag, an dem die Eintragung der Verschmelzung in das Register des Sitzes desjenigen Rechtsträgers, dessen Gläubiger sie sind, nach § 19 Abs. 3 UmwG als bekannt gemacht gilt, ihren Anspruch nach Grund und Höhe in Textform anmelden, Sicherheit zu leisten, soweit sie nicht Befriedigung verlangen können. Dieses Recht steht den Gläubigern jedoch nur zu, wenn sie glaubhaft machen, dass durch die Verschmelzung die Erfüllung ihrer Forderung gefährdet wird."
    },
    {
      "date": "2026-02-11",
      "id": "144813",
      "original_text": "Registerbekanntmachung nach dem Umwandlungsgesetz\nBayern Amtsgericht München HRA 104578\nGreen City Energy Kraftwerkspark III GmbH & Co. KG – München",
      "type": "Registerbekanntmachung nach dem Umwandlungsgesetz",
      "state": "Bayern",
      "amtsgericht": "Amtsgericht München",
      "registernummer": "HRA 104578",
      "registerart": "HRA",
      "company_name": "Green City Energy Kraftwerkspark III GmbH & Co. KG",
      "company_seat": "München",
      "details": "11.02.2026 (Bekanntmachungsdatum)\n\nBayern Amtsgericht München HRA 104578\nRegisterbekanntmachung nach dem Umwandlungsgesetz 10.02.2026 (Eintragungsdatum)\n\nGreen City Energy Kraftwerkspark III GmbH & Co. KG\nKommanditgesellschaft\nMünchen\n\nDen Gläubigern der an der Verschmelzung beteiligten Rechtsträger ist, wenn sie binnen sechs Monaten nach dem Tag, an dem die Eintragung der Verschmelzung in das Register des Sitzes desjenigen Rechtsträgers, dessen Gläubiger sie sind, nach § 19 Abs. 3 UmwG als bekannt gemacht gilt, ihren Anspruch nach Grund und Höhe in Textform anmelden, Sicherheit zu leisten, soweit sie nicht Befriedigung verlangen können. Dieses Recht steht den Gläubigern jedoch nur zu, wenn sie glaubhaft machen, dass durch die Verschmelzung die Erfüllung ihrer Forderung gefährdet wird."
    },
    {
      "date": "2026-02-11",
      "id": "144814",
      "original_text": "Löschungsankündigung\nBayern Amtsgericht München HRB 232224\nR & P GmbH – München",
      "type": "Löschungsankündigung",
      "state": "Bayern",
      "amtsgericht": "Amtsgericht München",
      "registernummer": "HRB 232224",
      "registerart": "HRB",
      "company_name": "R & P GmbH",
      "company_seat": "München",
      "details": "11.02.2026 (Bekanntmachungsdatum)\n\nBayern Amtsgericht München HRB 232224\nLöschungsankündigung 10.02.2026 (Eintragungsdatum)\n\nR & P GmbH\nGesellschaft mit beschränkter Haftung\nMünchen\n\nDas Registergericht beabsichtigt, die im Handelsregister eingetragene Gesellschaft wegen Vermögenslosigkeit von Amts wegen nach § 394 FamFG zu löschen. Die Frist zur Erhebung eines Widerspruchs ist auf drei Monate festgesetzt."
    },
    {
      "date": "2026-02-11",
      "id": "144815",
      "original_text": "Löschungsankündigung\nBayern Amtsgericht München HRB 202128\nMDG Munich Development Group GmbH – München",
      "type": "Löschungsankündigung",
      "state": "Bayern",
      "amtsgericht": "Amtsgericht München",
      "registernummer": "HRB 202128",
      "registerart": "HRB",
      "company_name": "MDG Munich Development Group GmbH",
      "company_seat": "München",
      "details": "11.02.2026 (Bekanntmachungsdatum)\n\nBayern Amtsgericht München HRB 202128\nLöschungsankündigung 10.02.2026 (Eintragungsdatum)\n\nMDG Munich Development Group GmbH\nGesellschaft mit beschränkter Haftung\nMünchen\n\nDas Registergericht beabsichtigt, die im Handelsregister eingetragene Gesellschaft wegen Vermögenslosigkeit von Amts wegen nach § 394 FamFG zu löschen. Die Frist zur Erhebung eines Widerspruchs ist auf drei Monate festgesetzt."
    },
    {
      "date": "2026-02-11",
      "id": "144816",
      "original_text": "Registerbekanntmachung nach dem Umwandlungsgesetz\nBayern Amtsgericht München HRB 131212\nMUNPAR Möbelvertriebsgesellschaft mbH – München",
      "type": "Registerbekanntmachung nach dem Umwandlungsgesetz",
      "state": "Bayern",
      "amtsgericht": "Amtsgericht München",
      "registernummer": "HRB 131212",
      "registerart": "HRB",
      "company_name": "MUNPAR Möbelvertriebsgesellschaft mbH",
      "company_seat": "München",
      "details": "11.02.2026 (Bekanntmachungsdatum)\n\nBayern Amtsgericht München HRB 131212\nRegisterbekanntmachung nach dem Umwandlungsgesetz 10.02.2026 (Eintragungsdatum)\n\nMUNPAR Möbelvertriebsgesellschaft mbH\nGesellschaft mit beschränkter Haftung\nMünchen\n\nDen Gläubigern der an der Verschmelzung beteiligten Rechtsträger ist, wenn sie binnen sechs Monaten nach dem Tag, an dem die Eintragung der Verschmelzung in das Register des Sitzes desjenigen Rechtsträgers, dessen Gläubiger sie sind, nach § 19 Abs. 3 UmwG als bekannt gemacht gilt, ihren Anspruch nach Grund und Höhe in Textform anmelden, Sicherheit zu leisten, soweit sie nicht Befriedigung verlangen können. Dieses Recht steht den Gläubigern jedoch nur zu, wenn sie glaubhaft machen, dass durch die Verschmelzung die Erfüllung ihrer Forderung gefährdet wird."
    },
    {
      "date": "2026-02-11",
      "id": "144817",
      "original_text": "Sonstige Registerbekanntmachung\nBayern Amtsgericht München HRB 300724\nbrainymotion GmbH – München",
      "type": "Sonstige Registerbekanntmachung",
      "state": "Bayern",
      "amtsgericht": "Amtsgericht München",
      "registernummer": "HRB 300724",
      "registerart": "HRB",
      "company_name": "brainymotion GmbH",
      "company_seat": "München",
      "details": "11.02.2026 (Bekanntmachungsdatum)\n\nBayern Amtsgericht München HRB 300724\nSonstige Registerbekanntmachung 10.02.2026 (Eintragungsdatum)\n\nbrainymotion GmbH\nGesellschaft mit beschränkter Haftung\nMünchen\n\nDen Gläubigern der Gesellschaft, deren Forderungen begründet worden sind, bevor die Eintragung der Beendigung des Beherrschungs- und Gewinnabführungsvertrages in das Handelsregister nach § 10 des Handelsgesetzbuches als bekanntgemacht gilt, hat der andere Vertragsteil Sicherheit zu leisten, wenn sie sich binnen sechs Monaten nach der Bekanntmachung der Eintragung zu diesem Zweck bei ihm melden."
    },
    {
      "date": "2026-02-11",
      "id": "144818",
      "original_text": "Löschungsankündigung\nBayern Amtsgericht Nürnberg HRB 33119\nBAT DAT Sushi running GmbH – Nürnberg",
      "type": "Löschungsankündigung",
      "state": "Bayern",
      "amtsgericht": "Amtsgericht Nürnberg",
      "registernummer": "HRB 33119",
      "registerart": "HRB",
      "company_name": "BAT DAT Sushi running GmbH",
      "company_seat": "Nürnberg",
      "details": "11.02.2026 (Bekanntmachungsdatum)\n\nBayern Amtsgericht Nürnberg HRB 33119\nLöschungsankündigung\n\nBAT DAT Sushi running GmbH\nGesellschaft mit beschränkter Haftung\nNürnberg\n\nDas Registergericht beabsichtigt, die im Handelsregister eingetragene Gesellschaft wegen Vermögenslosigkeit von Amts wegen nach § 394 FamFG zu löschen. Die Frist zur Erhebung eines Widerspruchs ist auf einen Monat festgesetzt."
    },
    {
      "date": "2026-02-11",
      "id": "144819",
      "original_text": "Löschungsankündigung\nBerlin Amtsgericht Berlin (Charlottenburg) HRB 153252\nMG Trocknungstechnik GmbH – Berlin",
      "type": "Löschungsankündigung",
      "state": "Berlin",
      "amtsgericht": "Amtsgericht Berlin (Charlottenburg)",
      "registernummer": "HRB 153252",
      "registerart": "HRB",
      "company_name": "MG Trocknungstechnik GmbH",
      "company_seat": "Berlin",
      "details": "11.02.2026 (Bekanntmachungsdatum)\n\nBerlin Amtsgericht Berlin (Charlottenburg) HRB 153252\nLöschungsankündigung\n\nMG Trocknungstechnik GmbH\nGesellschaft mit beschränkter Haftung\nBerlin\n\nBei der nachstehenden Gesellschaft wird das Amtslöschungsverfahren gemäß § 394 FamFG eingeleitet. Widerspruchsfrist: 6 Wochen."
    },
    {
      "date": "2026-02-11",
      "id": "144820",
      "original_text": "Löschungsankündigung\nBerlin Amtsgericht Berlin (Charlottenburg) HRB 55272\nA.A.S. American Auto Service GmbH – Berlin",
      "type": "Löschungsankündigung",
      "state": "Berlin",
      "amtsgericht": "Amtsgericht Berlin (Charlottenburg)",
      "registernummer": "HRB 55272",
      "registerart": "HRB",
      "company_name": "A.A.S. American Auto Service GmbH",
      "company_seat": "Berlin",
      "details": "11.02.2026 (Bekanntmachungsdatum)\n\nBerlin Amtsgericht Berlin (Charlottenburg) HRB 55272\nLöschungsankündigung\n\nA.A.S. American Auto Service GmbH\nGesellschaft mit beschränkter Haftung\nBerlin\n\nBei der nachstehenden Gesellschaft wird das Amtslöschungsverfahren gemäß § 394 FamFG eingeleitet. Widerspruchsfrist: 6 Wochen."
    },
    {
      "date": "2026-02-11",
      "id": "144821",
      "original_text": "Registerbekanntmachung nach dem Umwandlungsgesetz\nSchleswig-Holstein Amtsgericht Lübeck HRB 14524\nKOS Wulff Fusion GmbH – Beschendorf",
      "type": "Registerbekanntmachung nach dem Umwandlungsgesetz",
      "state": "Schleswig-Holstein",
      "amtsgericht": "Amtsgericht Lübeck",
      "registernummer": "HRB 14524",
      "registerart": "HRB",
      "company_name": "KOS Wulff Fusion GmbH",
      "company_seat": "Beschendorf",
      "details": "11.02.2026 (Bekanntmachungsdatum)\n\nSchleswig-Holstein Amtsgericht Lübeck HRB 14524\nRegisterbekanntmachung nach dem Umwandlungsgesetz 10.02.2026 (Eintragungsdatum)\n\nKOS Wulff Fusion GmbH\nGesellschaft mit beschränkter Haftung\nBeschendorf\n\nZu Eintragungsnummer 9 vom 10.02.2026 wird als nicht eingetragen veröffentlicht:  Den Gläubigern der an der Verschmelzung beteiligten Rechtsträger ist, wenn sie binnen sechs Monaten nach dem Tag, an dem die Eintragung der Verschmelzung in das Register des Sitzes desjenigen Rechtsträgers, dessen Gläubiger sie sind, als bekannt gemacht gilt, ihren Anspruch nach Grund und Höhe schriftlich anmelden, Sicherheit zu leisten, soweit sie nicht Befriedigung verlangen können. Dieses Recht steht den Gläubigern jedoch nur zu, wenn sie glaubhaft machen, dass durch die Verschmelzung die Erfüllung ihrer Forderung gefährdet wird."
    },
    {
      "date": "2026-02-11",
      "id": "144822",
      "original_text": "Löschungsankündigung\nBaden-Württemberg Amtsgericht Freiburg HRB 731128\nAdamu Venture UG (haftungsbeschränkt) – Freiburg im Breisgau",
      "type": "Löschungsankündigung",
      "state": "Baden-Württemberg",
      "amtsgericht": "Amtsgericht Freiburg",
      "registernummer": "HRB 731128",
      "registerart": "HRB",
      "company_name": "Adamu Venture UG (haftungsbeschränkt)",
      "company_seat": "Freiburg im Breisgau",
      "details": "11.02.2026 (Bekanntmachungsdatum)\n\nBaden-Württemberg Amtsgericht Freiburg HRB 731128\nLöschungsankündigung\n\nAdamu Venture UG (haftungsbeschränkt)\nGesellschaft mit beschränkter Haftung\nFreiburg im Breisgau\n\nAls nicht eingetragen wird bekanntgemacht:\nDas Gericht beabsichtigt, die Gesellschaft wegen Vermögenslosigkeit im Handelsregister von Amts wegen nach § 394 FamFG zu löschen. Die Frist zur Geltendmachung eines Widerspruchs gegen die beabsichtigte Löschung ist auf einen Monat ab Veröffentlichung bestimmt."
    },
    {
      "date": "2026-02-11",
      "id": "144823",
      "original_text": "Löschungsankündigung\nBerlin Amtsgericht Berlin (Charlottenburg) HRB 269319\nTHH Trend Haus Hamburg UG (haftungsbeschränkt) – Berlin",
      "type": "Löschungsankündigung",
      "state": "Berlin",
      "amtsgericht": "Amtsgericht Berlin (Charlottenburg)",
      "registernummer": "HRB 269319",
      "registerart": "HRB",
      "company_name": "THH Trend Haus Hamburg UG (haftungsbeschränkt)",
      "company_seat": "Berlin",
      "details": "11.02.2026 (Bekanntmachungsdatum)\n\nBerlin Amtsgericht Berlin (Charlottenburg) HRB 269319\nLöschungsankündigung\n\nTHH Trend Haus Hamburg UG (haftungsbeschränkt)\nGesellschaft mit beschränkter Haftung\nBerlin\n\nBei der nachstehenden Gesellschaft wird das Amtslöschungsverfahren gemäß § 394 FamFG eingeleitet. Widerspruchsfrist 6 Wochen"
    },
    {
      "date": "2026-02-11",
      "id": "144824",
      "original_text": "Löschungsankündigung\nBerlin Amtsgericht Berlin (Charlottenburg) HRB 233816\nHK Drive GmbH – Berlin",
      "type": "Löschungsankündigung",
      "state": "Berlin",
      "amtsgericht": "Amtsgericht Berlin (Charlottenburg)",
      "registernummer": "HRB 233816",
      "registerart": "HRB",
      "company_name": "HK Drive GmbH",
      "company_seat": "Berlin",
      "details": "11.02.2026 (Bekanntmachungsdatum)\n\nBerlin Amtsgericht Berlin (Charlottenburg) HRB 233816\nLöschungsankündigung\n\nHK Drive GmbH\nGesellschaft mit beschränkter Haftung\nBerlin\n\nBei der nachstehenden Gesellschaft wird das Amtslöschungsverfahren gemäß § 394 FamFG eingeleitet. Widerspruchsfrist 6 Wochen"
    },
    {
      "date": "2026-02-11",
      "id": "144825",
      "original_text": "Registerbekanntmachung nach dem Umwandlungsgesetz\nHamburg Amtsgericht Hamburg HRB 157714\nAeroImpulse GmbH – Hamburg",
      "type": "Registerbekanntmachung nach dem Umwandlungsgesetz",
      "state": "Hamburg",
      "amtsgericht": "Amtsgericht Hamburg",
      "registernummer": "HRB 157714",
      "registerart": "HRB",
      "company_name": "AeroImpulse GmbH",
      "company_seat": "Hamburg",
      "details": "11.02.2026 (Bekanntmachungsdatum)\n\nHamburg Amtsgericht Hamburg HRB 157714\nRegisterbekanntmachung nach dem Umwandlungsgesetz 11.02.2026 (Eintragungsdatum)\n\nAeroImpulse GmbH\nGesellschaft mit beschränkter Haftung\nHamburg\n\nAls nicht eingetragen wird bekannt gemacht:\nDen Gläubigern der an der formwechselnden Umwandlung beteiligten Gesellschaften ist, wenn sie binnen sechs Monaten nach dem Tag, an dem die Eintragung der formwechselnden Umwandlung in das Register des Sitzes desjenigen Rechtsträgers, dessen Gläubiger sie sind, nach § 19 Absatz 3 UmwG als bekannt gemacht gilt, ihren Anspruch nach Grund und Höhe schriftlich anmelden, Sicherheit zu leisten, soweit sie nicht Befriedigung verlangen können. Dieses Recht steht den Gläubigern jedoch nur zu, wenn sie glaubhaft machen, dass durch die formwechselnde Umwandlung die Erfüllung ihrer Forderung gefährdet wird."
    },
    {
      "date": "2026-02-11",
      "id": "144826",
      "original_text": "Registerbekanntmachung nach dem Umwandlungsgesetz\nHamburg Amtsgericht Hamburg HRB 103006\nUNISONO Aktiengesellschaft – Hamburg",
      "type": "Registerbekanntmachung nach dem Umwandlungsgesetz",
      "state": "Hamburg",
      "amtsgericht": "Amtsgericht Hamburg",
      "registernummer": "HRB 103006",
      "registerart": "HRB",
      "company_name": "UNISONO Aktiengesellschaft",
      "company_seat": "Hamburg",
      "details": "11.02.2026 (Bekanntmachungsdatum)\n\nHamburg Amtsgericht Hamburg HRB 103006\nRegisterbekanntmachung nach dem Umwandlungsgesetz 11.02.2026 (Eintragungsdatum)\n\nUNISONO Aktiengesellschaft\nAktiengesellschaft\nHamburg\n\nAls nicht eingetragen wird bekannt gemacht:\nDen Gläubigern der an der formwechselnden Umwandlung beteiligten Gesellschaften ist, wenn sie binnen sechs Monaten nach dem Tag, an dem die Eintragung der formwechselnden Umwandlung in das Register des Sitzes desjenigen Rechtsträgers, dessen Gläubiger sie sind, nach § 19 Absatz 3 UmwG als bekannt gemacht gilt, ihren Anspruch nach Grund und Höhe schriftlich anmelden, Sicherheit zu leisten, soweit sie nicht Befriedigung verlangen können. Dieses Recht steht den Gläubigern jedoch nur zu, wenn sie glaubhaft machen, dass durch die formwechselnde Umwandlung die Erfüllung ihrer Forderung gefährdet wird."
    },
    {
      "date": "2026-02-11",
      "id": "144827",
      "original_text": "Sonstige Registerbekanntmachung\nBrandenburg Amtsgericht Cottbus HRB 17527\nDTS GmbH – Schönefeld",
      "type": "Sonstige Registerbekanntmachung",
      "state": "Brandenburg",
      "amtsgericht": "Amtsgericht Cottbus",
      "registernummer": "HRB 17527",
      "registerart": "HRB",
      "company_name": "DTS GmbH",
      "company_seat": "Schönefeld",
      "details": "11.02.2026 (Bekanntmachungsdatum)\n\nBrandenburg Amtsgericht Cottbus HRB 17527\nSonstige Registerbekanntmachung\n\nDTS GmbH\nGesellschaft mit beschränkter Haftung\nSchönefeld\n\nDie Gesellschaft ist durch Abweisung des Antrages auf Eröffnung des Insolvenzverfahrens mangels Masse aufgelöst."
    },
    {
      "date": "2026-02-11",
      "id": "144828",
      "original_text": "Löschungsankündigung\nBaden-Württemberg Amtsgericht Freiburg HRB 726294\nATR GmbH – Steinen",
      "type": "Löschungsankündigung",
      "state": "Baden-Württemberg",
      "amtsgericht": "Amtsgericht Freiburg",
      "registernummer": "HRB 726294",
      "registerart": "HRB",
      "company_name": "ATR GmbH",
      "company_seat": "Steinen",
      "details": "11.02.2026 (Bekanntmachungsdatum)\n\nBaden-Württemberg Amtsgericht Freiburg HRB 726294\nLöschungsankündigung\n\nATR GmbH\nGesellschaft mit beschränkter Haftung\nSteinen\n\nAls nicht eingetragen wird bekanntgemacht:\nDas Gericht beabsichtigt, die Gesellschaft wegen Vermögenslosigkeit im Handelsregister von Amts wegen nach § 394 FamFG zu löschen. Die Frist zur Geltendmachung eines Widerspruchs gegen die beabsichtigte Löschung ist auf einen Monat ab Veröffentlichung bestimmt."
    },
    {
      "date": "2026-02-11",
      "id": "144829",
      "original_text": "Einreichung neuer Dokumente\nBaden-Württemberg Amtsgericht Mannheim HRB 570181\nStädtische Holding Wertheim GmbH – Wertheim",
      "type": "Einreichung neuer Dokumente",
      "state": "Baden-Württemberg",
      "amtsgericht": "Amtsgericht Mannheim",
      "registernummer": "HRB 570181",
      "registerart": "HRB",
      "company_name": "Städtische Holding Wertheim GmbH",
      "company_seat": "Wertheim",
      "details": "11.02.2026 (Bekanntmachungsdatum)\n\nBaden-Württemberg Amtsgericht Mannheim HRB 570181\nEinreichung neuer Dokumente\n\nStädtische Holding Wertheim GmbH\nGesellschaft mit beschränkter Haftung\nWertheim\n\nDie Gesellschaft hat am 10.02.2026 die Liste über die Zusammensetzung des Aufsichtsrats zum Handelsregister eingereicht."
    },
    {
      "date": "2026-02-11",
      "id": "144830",
      "original_text": "Einreichung neuer Dokumente\nBerlin Amtsgericht Berlin (Charlottenburg) HRB 107929\nid Immobilien in Deutschland Aktiengesellschaft – Berlin",
      "type": "Einreichung neuer Dokumente",
      "state": "Berlin",
      "amtsgericht": "Amtsgericht Berlin (Charlottenburg)",
      "registernummer": "HRB 107929",
      "registerart": "HRB",
      "company_name": "id Immobilien in Deutschland Aktiengesellschaft",
      "company_seat": "Berlin",
      "details": "11.02.2026 (Bekanntmachungsdatum)\n\nBerlin Amtsgericht Berlin (Charlottenburg) HRB 107929\nEinreichung neuer Dokumente\n\nid Immobilien in Deutschland Aktiengesellschaft\nAktiengesellschaft\nBerlin\n\nAls nicht eingetragen wird veröffentlicht:\n\nEs wurde eine neue Liste der Aufsichtsratsmitglieder eingereicht (§ 106 AktG)."
    },
    {
      "date": "2026-02-11",
      "id": "144831",
      "original_text": "Registerbekanntmachung nach dem Umwandlungsgesetz\nSachsen-Anhalt Amtsgericht Stendal HRA 5971\nEckert Signalanlagenbau e.K. – Schkopau",
      "type": "Registerbekanntmachung nach dem Umwandlungsgesetz",
      "state": "Sachsen-Anhalt",
      "amtsgericht": "Amtsgericht Stendal",
      "registernummer": "HRA 5971",
      "registerart": "HRA",
      "company_name": "Eckert Signalanlagenbau e.K.",
      "company_seat": "Schkopau",
      "details": "11.02.2026 (Bekanntmachungsdatum)\n\nSachsen-Anhalt Amtsgericht Stendal HRA 5971\nRegisterbekanntmachung nach dem Umwandlungsgesetz 11.02.2026 (Eintragungsdatum)\n\nEckert Signalanlagenbau e.K.\nEinzelkaufmann / Einzelkauffrau\nSchkopau\n\nNicht eingetragen:\nDen Gläubigern der an der Ausgliederung beteiligten Rechtsträger, ist wenn sie binnen sechs Monaten nach dem Tag, an dem die Eintragung der Ausgliederung nach §§125, 19 Abs. 3 UmwG als bekanntgemacht gilt, ihren Anspruch nach Grund und Höhe schriftlich anmelden, Sicherheit zu leisten, soweit sie nicht Befriedigung verlangen können. Diese Recht steht ihnen jedoch nur zu, wenn sie glaubhaft machen, dass durch die Ausgliederung die Erfüllung ihrer Forderung gefährdet wird."
    },
    {
      "date": "2026-02-11",
      "id": "144832",
      "original_text": "Löschungsankündigung\nBaden-Württemberg Amtsgericht Freiburg HRB 732017\nAFQ Bau GmbH – Freiburg im Breisgau",
      "type": "Löschungsankündigung",
      "state": "Baden-Württemberg",
      "amtsgericht": "Amtsgericht Freiburg",
      "registernummer": "HRB 732017",
      "registerart": "HRB",
      "company_name": "AFQ Bau GmbH",
      "company_seat": "Freiburg im Breisgau",
      "details": "11.02.2026 (Bekanntmachungsdatum)\n\nBaden-Württemberg Amtsgericht Freiburg HRB 732017\nLöschungsankündigung\n\nAFQ Bau GmbH\nGesellschaft mit beschränkter Haftung\nFreiburg im Breisgau\n\nAls nicht eingetragen wird bekanntgemacht:\nDas Gericht beabsichtigt, die Gesellschaft wegen Vermögenslosigkeit im Handelsregister von Amts wegen nach § 394 FamFG zu löschen. Die Frist zur Geltendmachung eines Widerspruchs gegen die beabsichtigte Löschung ist auf einen Monat ab Veröffentlichung bestimmt."
    },
    {
      "date": "2026-02-11",
      "id": "144833",
      "original_text": "Sonstige Registerbekanntmachung\nSchleswig-Holstein Amtsgericht Lübeck HRB 23059\nElektro H.E.B.Z GmbH – Barsbüttel",
      "type": "Sonstige Registerbekanntmachung",
      "state": "Schleswig-Holstein",
      "amtsgericht": "Amtsgericht Lübeck",
      "registernummer": "HRB 23059",
      "registerart": "HRB",
      "company_name": "Elektro H.E.B.Z GmbH",
      "company_seat": "Barsbüttel",
      "details": "11.02.2026 (Bekanntmachungsdatum)\n\nSchleswig-Holstein Amtsgericht Lübeck HRB 23059\nSonstige Registerbekanntmachung\n\nElektro H.E.B.Z GmbH\nGesellschaft mit beschränkter Haftung\nBarsbüttel\n\nAls nicht eingetragen wird folgendes Schreiben an den Geschäftsführer Daniel Lewandowski, zur Zeit unbekannten Aufenthalts, veröffentlicht:\n\nSehr geehrter Herr Lewandowski,\n\nin der Handelsregistersache der\n\nElektro H.E.B.Z GmbH\n\nergeben sich aus den mir vorliegenden Unterlagen Anhaltspunkte dafür, dass die Gesellschaft, als deren Geschäftsführer Sie noch eingetragen sind, vermögenslos ist:\n\nLöschungsantrag des Finanzamts Stormarn vom 30.01.2026\n\nIch beabsichtige daher, die Gesellschaft wegen Vermögenslosigkeit gemäß § 394 FamFG zu löschen.\n\nIch bestimme eine Frist von einem Monat zur Geltendmachung eines Widerspruchs gegen die Löschung, § 394 Abs. 2 S. 1 FamFG.\n\nWeiter bitte ich Sie, mir binnen derselben Frist mitzuteilen, ob die genannte Gesellschaft noch Vermögen hat, ggf. welche Vermögensgegenstände sie besitzt, ob die Gesellschaft noch Partei eines noch nicht rechtskräftig abgeschlossenen Rechtsstreits ist oder ob sonst noch eine Abwicklung stattfindet.\n\nNach Fristablauf ohne Widerspruch von Ihnen oder anderer Seite wird die Gesellschaft gelöscht.\n\nMit freundlichen Grüßen\n\nOstermann\nDipl.-Rechtspflegerin (FH)"
    },
    {
      "date": "2026-02-11",
      "id": "144834",
      "original_text": "Löschungsankündigung\nBaden-Württemberg Amtsgericht Freiburg HRB 732015\nAFA Landschaftsbau GmbH – Freiburg im Breisgau",
      "type": "Löschungsankündigung",
      "state": "Baden-Württemberg",
      "amtsgericht": "Amtsgericht Freiburg",
      "registernummer": "HRB 732015",
      "registerart": "HRB",
      "company_name": "AFA Landschaftsbau GmbH",
      "company_seat": "Freiburg im Breisgau",
      "details": "11.02.2026 (Bekanntmachungsdatum)\n\nBaden-Württemberg Amtsgericht Freiburg HRB 732015\nLöschungsankündigung\n\nAFA Landschaftsbau GmbH\nGesellschaft mit beschränkter Haftung\nFreiburg im Breisgau\n\nAls nicht eingetragen wird bekanntgemacht:\nDas Gericht beabsichtigt, die Gesellschaft wegen Vermögenslosigkeit im Handelsregister von Amts wegen nach § 394 FamFG zu löschen. Die Frist zur Geltendmachung eines Widerspruchs gegen die beabsichtigte Löschung ist auf einen Monat ab Veröffentlichung bestimmt."
    },
    {
      "date": "2026-02-11",
      "id": "144835",
      "original_text": "Löschungsankündigung\nBaden-Württemberg Amtsgericht Freiburg HRB 727217\nAdva Trade UG (haftungsbeschränkt) – Freiburg im Breisgau",
      "type": "Löschungsankündigung",
      "state": "Baden-Württemberg",
      "amtsgericht": "Amtsgericht Freiburg",
      "registernummer": "HRB 727217",
      "registerart": "HRB",
      "company_name": "Adva Trade UG (haftungsbeschränkt)",
      "company_seat": "Freiburg im Breisgau",
      "details": "11.02.2026 (Bekanntmachungsdatum)\n\nBaden-Württemberg Amtsgericht Freiburg HRB 727217\nLöschungsankündigung\n\nAdva Trade UG (haftungsbeschränkt)\nGesellschaft mit beschränkter Haftung\nFreiburg im Breisgau\n\nAls nicht eingetragen wird bekanntgemacht:\nDas Gericht beabsichtigt, die Gesellschaft wegen Vermögenslosigkeit im Handelsregister von Amts wegen nach § 394 FamFG zu löschen. Die Frist zur Geltendmachung eines Widerspruchs gegen die beabsichtigte Löschung ist auf einen Monat ab Veröffentlichung bestimmt."
    },
    {
      "date": "2026-02-11",
      "id": "144836",
      "original_text": "Löschungsankündigung\nBaden-Württemberg Amtsgericht Freiburg HRB 727217\nAdva Trade UG (haftungsbeschränkt) – Freiburg im Breisgau",
      "type": "Löschungsankündigung",
      "state": "Baden-Württemberg",
      "amtsgericht": "Amtsgericht Freiburg",
      "registernummer": "HRB 727217",
      "registerart": "HRB",
      "company_name": "Adva Trade UG (haftungsbeschränkt)",
      "company_seat": "Freiburg im Breisgau",
      "details": "11.02.2026 (Bekanntmachungsdatum)\n\nBaden-Württemberg Amtsgericht Freiburg HRB 727217\nLöschungsankündigung\n\nAdva Trade UG (haftungsbeschränkt)\nGesellschaft mit beschränkter Haftung\nFreiburg im Breisgau\n\nAls nicht eingetragen wird bekanntgemacht:\nDas Gericht beabsichtigt, die Gesellschaft wegen Vermögenslosigkeit im Handelsregister von Amts wegen nach § 394 FamFG zu löschen. Die Frist zur Geltendmachung eines Widerspruchs gegen die beabsichtigte Löschung ist auf einen Monat ab Veröffentlichung bestimmt."
    },
    {
      "date": "2026-02-11",
      "id": "144837",
      "original_text": "Registerbekanntmachung nach dem Umwandlungsgesetz\nBaden-Württemberg Amtsgericht Stuttgart HRB 746916\nandani GmbH – Stuttgart",
      "type": "Registerbekanntmachung nach dem Umwandlungsgesetz",
      "state": "Baden-Württemberg",
      "amtsgericht": "Amtsgericht Stuttgart",
      "registernummer": "HRB 746916",
      "registerart": "HRB",
      "company_name": "andani GmbH",
      "company_seat": "Stuttgart",
      "details": "11.02.2026 (Bekanntmachungsdatum)\n\nBaden-Württemberg Amtsgericht Stuttgart HRB 746916\nRegisterbekanntmachung nach dem Umwandlungsgesetz 11.02.2026 (Eintragungsdatum)\n\nandani GmbH\nGesellschaft mit beschränkter Haftung\nStuttgart\n\nAls nicht eingetragen wird bekanntgemacht:\nDen Gläubigern der an der Abspaltung beteiligten Rechtsträger ist, wenn sie binnen sechs Monaten nach dem Tag, an dem die Eintragung der Abspaltung in das Register des Sitzes desjenigen Rechtsträgers, dessen Gläubiger sie sind, nach § 19 Abs. 3 UmwG als bekanntgemacht gilt, ihren Anspruch nach Grund und Höhe schriftlich anmelden, Sicherheit zu leisten, soweit sie nicht Befriedigung verlangen können. Dieses Recht steht den Gläubigern jedoch nur zu, wenn sie glaubhaft machen, dass durch die Abspaltung die Erfüllung ihrer Forderung gefährdet wird."
    },
    {
      "date": "2026-02-11",
      "id": "144838",
      "original_text": "Löschungsankündigung\nBerlin Amtsgericht Berlin (Charlottenburg) HRB 128733\nDND Remont GmbH – Berlin",
      "type": "Löschungsankündigung",
      "state": "Berlin",
      "amtsgericht": "Amtsgericht Berlin (Charlottenburg)",
      "registernummer": "HRB 128733",
      "registerart": "HRB",
      "company_name": "DND Remont GmbH",
      "company_seat": "Berlin",
      "details": "11.02.2026 (Bekanntmachungsdatum)\n\nBerlin Amtsgericht Berlin (Charlottenburg) HRB 128733\nLöschungsankündigung\n\nDND Remont GmbH\nGesellschaft mit beschränkter Haftung\nBerlin\n\nBei der nachstehenden Gesellschaft wird das Amtslöschungsverfahren gemäß § 394 FamFG eingeleitet. Widerspruchsfrist 6 Wochen"
    },
    {
      "date": "2026-02-11",
      "id": "144839",
      "original_text": "Einreichung neuer Dokumente\nBrandenburg Amtsgericht Frankfurt/Oder HRB 3444\nStadtwerke Eisenhüttenstadt, Gesellschaft mit beschränkter Haftung – Eisenhüttenstadt",
      "type": "Einreichung neuer Dokumente",
      "state": "Brandenburg",
      "amtsgericht": "Amtsgericht Frankfurt/Oder",
      "registernummer": "HRB 3444",
      "registerart": "HRB",
      "company_name": "Stadtwerke Eisenhüttenstadt, Gesellschaft mit beschränkter Haftung",
      "company_seat": "Eisenhüttenstadt",
      "details": "11.02.2026 (Bekanntmachungsdatum)\n\nBrandenburg Amtsgericht Frankfurt/Oder HRB 3444\nEinreichung neuer Dokumente\n\nStadtwerke Eisenhüttenstadt, Gesellschaft mit beschränkter Haftung\nGesellschaft mit beschränkter Haftung\nEisenhüttenstadt\n\nAls nicht eingetragen wird veröffentlicht: Als nicht eingetragen wird veröffentlicht: Eine Liste der Mitglieder des Aufsichtsrates vom 19.01.2026 wurde zum Handelsregister eingereicht."
    },
    {
      "date": "2026-02-11",
      "id": "144840",
      "original_text": "Einreichung neuer Dokumente\nBaden-Württemberg Amtsgericht Stuttgart HRB 721326\nBechtle Managed Services Holding AG – Neckarsulm",
      "type": "Einreichung neuer Dokumente",
      "state": "Baden-Württemberg",
      "amtsgericht": "Amtsgericht Stuttgart",
      "registernummer": "HRB 721326",
      "registerart": "HRB",
      "company_name": "Bechtle Managed Services Holding AG",
      "company_seat": "Neckarsulm",
      "details": "11.02.2026 (Bekanntmachungsdatum)\n\nBaden-Württemberg Amtsgericht Stuttgart HRB 721326\nEinreichung neuer Dokumente\n\nBechtle Managed Services Holding AG\nAktiengesellschaft\nNeckarsulm\n\nDie Gesellschaft hat am 11.02.2026 die Liste über die Zusammensetzung des Aufsichtsrats zum Handelsregister eingereicht."
    },
    {
      "date": "2026-02-11",
      "id": "144841",
      "original_text": "Registerbekanntmachung nach dem Umwandlungsgesetz\nThüringen Amtsgericht Jena HRA 507132\nMaik Frenkel e.K. – Meuselwitz",
      "type": "Registerbekanntmachung nach dem Umwandlungsgesetz",
      "state": "Thüringen",
      "amtsgericht": "Amtsgericht Jena",
      "registernummer": "HRA 507132",
      "registerart": "HRA",
      "company_name": "Maik Frenkel e.K.",
      "company_seat": "Meuselwitz",
      "details": "11.02.2026 (Bekanntmachungsdatum)\n\nThüringen Amtsgericht Jena HRA 507132\nRegisterbekanntmachung nach dem Umwandlungsgesetz 11.02.2026 (Eintragungsdatum)\n\nMaik Frenkel e.K.\nEinzelkaufmann / Einzelkauffrau\nMeuselwitz\n\nDas von dem Einzelkaufmann Frenkel, Maik, Meuselwitz, *02.12.1987 unter der Firma Maik Frenkel e.K. mit dem Sitz in Meuselwitz betriebene Unternehmen ist aus dem Vermögen gemäß Ausgliederungsplan vom 18.08.2025, mit Nachtrag vom 12.11.2025 auf die neu gegründete Maik Frenkel Dienstleistungs GmbH mit dem Sitz in Meuselwitz (Amtsgericht Jena HRB 524265) ausgegliedert.\nDie Firma ist erloschen. Von Amts wegen eingetragen aufgrund § 155 UmwG.\nNicht eingetragen: Den Gläubigern der an der Ausgliederung beteiligten Rechtsträger, ist wenn sie binnen sechs Monaten nach dem Tag, an dem die Eintragung der Ausgliederung in das Register des Sitzes desjenigen Rechtsträgers, dessen Gläubiger sie sind, nach §§125, 19 Abs. 3 UmwG als bekanntgemacht gilt, ihren Anspruch nach Grund und Höhe schriftlich anmelden, Sicherheit zu leisten, soweit sie nicht Befriedigung verlangen können. Dieses Recht steht ihnen jedoch nur zu, wenn sie glaubhaft machen, daß durch die Ausgliederung die Erfüllung ihrer Forderung gefährdet wird."
    },
    {
      "date": "2026-02-11",
      "id": "144842",
      "original_text": "Löschungsankündigung\nThüringen Amtsgericht Jena HRB 301937\nClassic Haushaltsgeräte GmbH – Steinbach-Hallenberg",
      "type": "Löschungsankündigung",
      "state": "Thüringen",
      "amtsgericht": "Amtsgericht Jena",
      "registernummer": "HRB 301937",
      "registerart": "HRB",
      "company_name": "Classic Haushaltsgeräte GmbH",
      "company_seat": "Steinbach-Hallenberg",
      "details": "11.02.2026 (Bekanntmachungsdatum)\n\nThüringen Amtsgericht Jena HRB 301937\nLöschungsankündigung\n\nClassic Haushaltsgeräte GmbH\nGesellschaft mit beschränkter Haftung\nSteinbach-Hallenberg\n\nDas Registergericht beabsichtigt, die im Handelsregister eingetragene Gesellschaft wegen Vermögenslosigkeit nach § 394 FamFG von Amts wegen zu löschen. Die Frist zur Erhebung eines Widerspruchs gegen die beabsichtigte Löschung wird auf 6 Wochen festgesetzt."
    },
    {
      "date": "2026-02-11",
      "id": "144843",
      "original_text": "Löschungsankündigung\nBerlin Amtsgericht Berlin (Charlottenburg) HRB 247856\nGENDAS GmbH – Berlin",
      "type": "Löschungsankündigung",
      "state": "Berlin",
      "amtsgericht": "Amtsgericht Berlin (Charlottenburg)",
      "registernummer": "HRB 247856",
      "registerart": "HRB",
      "company_name": "GENDAS GmbH",
      "company_seat": "Berlin",
      "details": "11.02.2026 (Bekanntmachungsdatum)\n\nBerlin Amtsgericht Berlin (Charlottenburg) HRB 247856\nLöschungsankündigung\n\nGENDAS GmbH\nGesellschaft mit beschränkter Haftung\nBerlin\n\nBei der nachstehenden Gesellschaft wird das Amtslöschungsverfahren gemäß § 394 FamFG eingeleitet. Widerspruchsfrist 6 Wochen"
    },
    {
      "date": "2026-02-11",
      "id": "144844",
      "original_text": "Einreichung neuer Dokumente\nSchleswig-Holstein Amtsgericht Kiel HRB 1246 RD\nAbfallwirtschaft Rendsburg-Eckernförde GmbH – Borgstedt",
      "type": "Einreichung neuer Dokumente",
      "state": "Schleswig-Holstein",
      "amtsgericht": "Amtsgericht Kiel",
      "registernummer": "HRB 1246 RD",
      "registerart": "HRB",
      "company_name": "Abfallwirtschaft Rendsburg-Eckernförde GmbH",
      "company_seat": "Borgstedt",
      "details": "11.02.2026 (Bekanntmachungsdatum)\n\nSchleswig-Holstein Amtsgericht Kiel HRB 1246 RD\nEinreichung neuer Dokumente\n\nAbfallwirtschaft Rendsburg-Eckernförde GmbH\nGesellschaft mit beschränkter Haftung\nBorgstedt\n\nAls nicht eingetragen wird veröffentlicht: Eine neue Liste der Aufsichtsratsmitglieder ist eingereicht worden."
    },
    {
      "date": "2026-02-11",
      "id": "144845",
      "original_text": "Sonstige Registerbekanntmachung\nHamburg Amtsgericht Hamburg HRB 113611\nBP Europa SE – Hamburg",
      "type": "Sonstige Registerbekanntmachung",
      "state": "Hamburg",
      "amtsgericht": "Amtsgericht Hamburg",
      "registernummer": "HRB 113611",
      "registerart": "HRB",
      "company_name": "BP Europa SE",
      "company_seat": "Hamburg",
      "details": "11.02.2026 (Bekanntmachungsdatum)\n\nHamburg Amtsgericht Hamburg HRB 113611\nSonstige Registerbekanntmachung\n\nBP Europa SE\nEuropäische Aktiengesellschaft (SE)\nHamburg\n\nAls nicht eingetragen wird bekannt gemacht: Liste des Aufsichtsrats wurde eingereicht."
    },
    {
      "date": "2026-02-11",
      "id": "144846",
      "original_text": "Registerbekanntmachung nach dem Umwandlungsgesetz\nHamburg Amtsgericht Hamburg HRB 64223\nHS-Hamburger Software Beteiligungs-GmbH – Hamburg",
      "type": "Registerbekanntmachung nach dem Umwandlungsgesetz",
      "state": "Hamburg",
      "amtsgericht": "Amtsgericht Hamburg",
      "registernummer": "HRB 64223",
      "registerart": "HRB",
      "company_name": "HS-Hamburger Software Beteiligungs-GmbH",
      "company_seat": "Hamburg",
      "details": "11.02.2026 (Bekanntmachungsdatum)\n\nHamburg Amtsgericht Hamburg HRB 64223\nRegisterbekanntmachung nach dem Umwandlungsgesetz 11.02.2026 (Eintragungsdatum)\n\nHS-Hamburger Software Beteiligungs-GmbH\nGesellschaft mit beschränkter Haftung\nHamburg\n\nAls nicht eingetragen wird bekannt gemacht:\nDen Gläubigern der an der Verschmelzung beteiligten Gesellschaften ist, wenn sie binnen sechs Monaten nach dem Tag, an dem die Eintragung der Verschmelzung in das Register des Sitzes desjenigen Rechtsträgers, dessen Gläubiger sie sind, nach § 19 Absatz 3 UmwG als bekannt gemacht gilt, ihren Anspruch nach Grund und Höhe schriftlich anmelden, Sicherheit zu leisten, soweit sie nicht Befriedigung verlangen können. Dieses Recht steht den Gläubigern jedoch nur zu, wenn sie glaubhaft machen, dass durch die Verschmelzung die Erfüllung ihrer Forderung gefährdet wird."
    },
    {
      "date": "2026-02-11",
      "id": "144847",
      "original_text": "Registerbekanntmachung nach dem Umwandlungsgesetz\nHamburg Amtsgericht Hamburg HRB 59552\nHS - Hamburger Software GmbH – Hamburg",
      "type": "Registerbekanntmachung nach dem Umwandlungsgesetz",
      "state": "Hamburg",
      "amtsgericht": "Amtsgericht Hamburg",
      "registernummer": "HRB 59552",
      "registerart": "HRB",
      "company_name": "HS - Hamburger Software GmbH",
      "company_seat": "Hamburg",
      "details": "11.02.2026 (Bekanntmachungsdatum)\n\nHamburg Amtsgericht Hamburg HRB 59552\nRegisterbekanntmachung nach dem Umwandlungsgesetz 11.02.2026 (Eintragungsdatum)\n\nHS - Hamburger Software GmbH\nGesellschaft mit beschränkter Haftung\nHamburg\n\nAls nicht eingetragen wird bekannt gemacht:\nDen Gläubigern der an der Verschmelzung beteiligten Gesellschaften ist, wenn sie binnen sechs Monaten nach dem Tag, an dem die Eintragung der Verschmelzung in das Register des Sitzes desjenigen Rechtsträgers, dessen Gläubiger sie sind, nach § 19 Absatz 3 UmwG als bekannt gemacht gilt, ihren Anspruch nach Grund und Höhe schriftlich anmelden, Sicherheit zu leisten, soweit sie nicht Befriedigung verlangen können. Dieses Recht steht den Gläubigern jedoch nur zu, wenn sie glaubhaft machen, dass durch die Verschmelzung die Erfüllung ihrer Forderung gefährdet wird."
    },
    {
      "date": "2026-02-11",
      "id": "144848",
      "original_text": "Löschungsankündigung\nBerlin Amtsgericht Berlin (Charlottenburg) HRB 214840\nOVO Energy Germany GmbH – Berlin",
      "type": "Löschungsankündigung",
      "state": "Berlin",
      "amtsgericht": "Amtsgericht Berlin (Charlottenburg)",
      "registernummer": "HRB 214840",
      "registerart": "HRB",
      "company_name": "OVO Energy Germany GmbH",
      "company_seat": "Berlin",
      "details": "11.02.2026 (Bekanntmachungsdatum)\n\nBerlin Amtsgericht Berlin (Charlottenburg) HRB 214840\nLöschungsankündigung\n\nOVO Energy Germany GmbH\nGesellschaft mit beschränkter Haftung\nBerlin\n\nBei der nachstehenden Gesellschaft wird das Amtslöschungsverfahren gemäß § 394 FamFG eingeleitet. Widerspruchsfrist 6 Wochen"
    },
    {
      "date": "2026-02-11",
      "id": "144849",
      "original_text": "Einreichung neuer Dokumente\nBaden-Württemberg Amtsgericht Stuttgart HRB 743620\nXENIOS AG – Heilbronn",
      "type": "Einreichung neuer Dokumente",
      "state": "Baden-Württemberg",
      "amtsgericht": "Amtsgericht Stuttgart",
      "registernummer": "HRB 743620",
      "registerart": "HRB",
      "company_name": "XENIOS AG",
      "company_seat": "Heilbronn",
      "details": "11.02.2026 (Bekanntmachungsdatum)\n\nBaden-Württemberg Amtsgericht Stuttgart HRB 743620\nEinreichung neuer Dokumente\n\nXENIOS AG\nAktiengesellschaft\nHeilbronn\n\nDie Gesellschaft hat am 10.02.2026 die Liste über die Zusammensetzung des Aufsichtsrats zum Handelsregister eingereicht."
    },
    {
      "date": "2026-02-11",
      "id": "144850",
      "original_text": "Löschungsankündigung\nBerlin Amtsgericht Berlin (Charlottenburg) HRB 220415\nBerlin Lieferbox UG (haftungsbeschränkt) – Berlin",
      "type": "Löschungsankündigung",
      "state": "Berlin",
      "amtsgericht": "Amtsgericht Berlin (Charlottenburg)",
      "registernummer": "HRB 220415",
      "registerart": "HRB",
      "company_name": "Berlin Lieferbox UG (haftungsbeschränkt)",
      "company_seat": "Berlin",
      "details": "11.02.2026 (Bekanntmachungsdatum)\n\nBerlin Amtsgericht Berlin (Charlottenburg) HRB 220415\nLöschungsankündigung\n\nBerlin Lieferbox UG (haftungsbeschränkt)\nGesellschaft mit beschränkter Haftung\nBerlin\n\nBei der nachstehenden Gesellschaft wird das Amtslöschungsverfahren gemäß § 394 FamFG eingeleitet. Widerspruchsfrist\n6 Wochen."
    },
    {
      "date": "2026-02-11",
      "id": "144851",
      "original_text": "Einreichung neuer Dokumente\nHamburg Amtsgericht Hamburg HRB 87117\nELIM Diakonie GmbH – Hamburg",
      "type": "Einreichung neuer Dokumente",
      "state": "Hamburg",
      "amtsgericht": "Amtsgericht Hamburg",
      "registernummer": "HRB 87117",
      "registerart": "HRB",
      "company_name": "ELIM Diakonie GmbH",
      "company_seat": "Hamburg",
      "details": "11.02.2026 (Bekanntmachungsdatum)\n\nHamburg Amtsgericht Hamburg HRB 87117\nEinreichung neuer Dokumente\n\nELIM Diakonie GmbH\nGesellschaft mit beschränkter Haftung\nHamburg\n\nAls nicht eingetragen wird bekannt gemacht: Liste des Aufsichtsrats wurde eingereicht."
    },
    {
      "date": "2026-02-11",
      "id": "144852",
      "original_text": "Einreichung neuer Dokumente\nSchleswig-Holstein Amtsgericht Pinneberg HRB 1793 EL\nPeter Kölln GmbH & Co. KGaA – Elmshorn",
      "type": "Einreichung neuer Dokumente",
      "state": "Schleswig-Holstein",
      "amtsgericht": "Amtsgericht Pinneberg",
      "registernummer": "HRB 1793 EL",
      "registerart": "HRB",
      "company_name": "Peter Kölln GmbH & Co. KGaA",
      "company_seat": "Elmshorn",
      "details": "11.02.2026 (Bekanntmachungsdatum)\n\nSchleswig-Holstein Amtsgericht Pinneberg HRB 1793 EL\nEinreichung neuer Dokumente\n\nPeter Kölln GmbH & Co. KGaA\nKommanditgesellschaft auf Aktien\nElmshorn\n\nAls nicht eingetragen wird veröffentlicht: Gemäß § 10 HGB wurde eine neue Liste der Aufsichtsratsmitglieder zum Register eingereicht."
    },
    {
      "date": "2026-02-11",
      "id": "144853",
      "original_text": "Einreichung neuer Dokumente\nSchleswig-Holstein Amtsgericht Kiel HRB 23326\nIGEFA Beteiligung SE – Neumünster",
      "type": "Einreichung neuer Dokumente",
      "state": "Schleswig-Holstein",
      "amtsgericht": "Amtsgericht Kiel",
      "registernummer": "HRB 23326",
      "registerart": "HRB",
      "company_name": "IGEFA Beteiligung SE",
      "company_seat": "Neumünster",
      "details": "11.02.2026 (Bekanntmachungsdatum)\n\nSchleswig-Holstein Amtsgericht Kiel HRB 23326\nEinreichung neuer Dokumente\n\nIGEFA Beteiligung SE\nEuropäische Aktiengesellschaft (SE)\nNeumünster\n\nAls nicht eingetragen wird veröffentlicht:Eine neue Liste der Aufsichtsratsmitglieder ist eingereicht worden."
    },
    {
      "date": "2026-02-11",
      "id": "144854",
      "original_text": "Löschungsankündigung\nBaden-Württemberg Amtsgericht Stuttgart HRB 752501\nOliver Kern Kompetenz GmbH – Großbottwar",
      "type": "Löschungsankündigung",
      "state": "Baden-Württemberg",
      "amtsgericht": "Amtsgericht Stuttgart",
      "registernummer": "HRB 752501",
      "registerart": "HRB",
      "company_name": "Oliver Kern Kompetenz GmbH",
      "company_seat": "Großbottwar",
      "details": "11.02.2026 (Bekanntmachungsdatum)\n\nBaden-Württemberg Amtsgericht Stuttgart HRB 752501\nLöschungsankündigung\n\nOliver Kern Kompetenz GmbH\nGesellschaft mit beschränkter Haftung\nGroßbottwar\n\nAls nicht eingetragen wird bekanntgemacht:\nDas Gericht beabsichtigt, die Gesellschaft wegen Vermögenslosigkeit im Handelsregister von Amts wegen nach § 394 FamFG zu löschen. Die Frist zur Geltendmachung eines Widerspruchs gegen die beabsichtigte Löschung ist auf zwei Monate ab Veröffentlichung bestimmt."
    },
    {
      "date": "2026-02-11",
      "id": "144855",
      "original_text": "Sonstige Registerbekanntmachung\nBerlin Amtsgericht Berlin (Charlottenburg) HRB 259342\nBriesen PV GmbH – Berlin",
      "type": "Sonstige Registerbekanntmachung",
      "state": "Berlin",
      "amtsgericht": "Amtsgericht Berlin (Charlottenburg)",
      "registernummer": "HRB 259342",
      "registerart": "HRB",
      "company_name": "Briesen PV GmbH",
      "company_seat": "Berlin",
      "details": "11.02.2026 (Bekanntmachungsdatum)\n\nBerlin Amtsgericht Berlin (Charlottenburg) HRB 259342\nSonstige Registerbekanntmachung\n\nBriesen PV GmbH\nGesellschaft mit beschränkter Haftung\nBerlin\n\nAls nicht eingetragen wird veröffentlicht: Der mit der Kintlein & Ose GmbH & Co. KG mit Sitz in Berlin (Amtsgericht Charlottenburg, HRA 48919 B) bestehende Gewinnabführungsvertrag vom 25.01.2024 ist durch Aufhebungsvertrag vom 07.07.2025 mit Wirkung zum Ablauf des laufenden Geschäftsjahres der Gesellschaft (31.12.2025) beendet worden."
    },
    {
      "date": "2026-02-11",
      "id": "144856",
      "original_text": "Registerbekanntmachung nach dem Umwandlungsgesetz\nBaden-Württemberg Amtsgericht Stuttgart HRB 758700\nJim's Club GmbH – Dornstetten",
      "type": "Registerbekanntmachung nach dem Umwandlungsgesetz",
      "state": "Baden-Württemberg",
      "amtsgericht": "Amtsgericht Stuttgart",
      "registernummer": "HRB 758700",
      "registerart": "HRB",
      "company_name": "Jim's Club GmbH",
      "company_seat": "Dornstetten",
      "details": "11.02.2026 (Bekanntmachungsdatum)\n\nBaden-Württemberg Amtsgericht Stuttgart HRB 758700\nRegisterbekanntmachung nach dem Umwandlungsgesetz 11.02.2026 (Eintragungsdatum)\n\nJim's Club GmbH\nGesellschaft mit beschränkter Haftung\nDornstetten\n\nAls nicht eingetragen wird bekanntgemacht:\nDen Gläubigern der an der Verschmelzung beteiligten Rechtsträger ist, wenn sie binnen sechs Monaten nach dem Tag, an dem die Eintragung der Verschmelzung in das Register des Sitzes desjenigen Rechtsträgers, dessen Gläubiger sie sind, nach § 19 Abs. 3 UmwG als bekanntgemacht gilt, ihren Anspruch nach Grund und Höhe schriftlich anmelden, Sicherheit zu leisten, soweit sie nicht Befriedigung verlangen können. Dieses Recht steht den Gläubigern jedoch nur zu, wenn sie glaubhaft machen, dass durch die Verschmelzung die Erfüllung ihrer Forderung gefährdet wird."
    },
    {
      "date": "2026-02-11",
      "id": "144857",
      "original_text": "Einreichung neuer Dokumente\nHamburg Amtsgericht Hamburg HRB 184335\nHoyer SE – Hamburg",
      "type": "Einreichung neuer Dokumente",
      "state": "Hamburg",
      "amtsgericht": "Amtsgericht Hamburg",
      "registernummer": "HRB 184335",
      "registerart": "HRB",
      "company_name": "Hoyer SE",
      "company_seat": "Hamburg",
      "details": "11.02.2026 (Bekanntmachungsdatum)\n\nHamburg Amtsgericht Hamburg HRB 184335\nEinreichung neuer Dokumente\n\nHoyer SE\nEuropäische Aktiengesellschaft (SE)\nHamburg\n\nAls nicht eingetragen wird bekannt gemacht: Liste des Aufsichtsrats wurde eingereicht."
    },
    {
      "date": "2026-02-11",
      "id": "144858",
      "original_text": "Registerbekanntmachung nach dem Umwandlungsgesetz\nBaden-Württemberg Amtsgericht Stuttgart HRA 742885\nPascal Wirth Holding e.K. – Fellbach",
      "type": "Registerbekanntmachung nach dem Umwandlungsgesetz",
      "state": "Baden-Württemberg",
      "amtsgericht": "Amtsgericht Stuttgart",
      "registernummer": "HRA 742885",
      "registerart": "HRA",
      "company_name": "Pascal Wirth Holding e.K.",
      "company_seat": "Fellbach",
      "details": "11.02.2026 (Bekanntmachungsdatum)\n\nBaden-Württemberg Amtsgericht Stuttgart HRA 742885\nRegisterbekanntmachung nach dem Umwandlungsgesetz 11.02.2026 (Eintragungsdatum)\n\nPascal Wirth Holding e.K.\nEinzelkaufmann / Einzelkauffrau\nFellbach\n\nAls nicht eingetragen wird bekanntgemacht:\nDen Gläubigern der an der Ausgliederung beteiligten Rechtsträger ist, wenn sie binnen sechs Monaten nach dem Tag, an dem die Eintragung der Ausgliederung in das Register des Sitzes desjenigen Rechtsträgers, dessen Gläubiger sie sind, nach § 19 Abs. 3 UmwG als bekanntgemacht gilt, ihren Anspruch nach Grund und Höhe schriftlich anmelden, Sicherheit zu leisten, soweit sie nicht Befriedigung verlangen können. Dieses Recht steht den Gläubigern jedoch nur zu, wenn sie glaubhaft machen, dass durch die Ausgliederung die Erfüllung ihrer Forderung gefährdet wird."
    },
    {
      "date": "2026-02-11",
      "id": "144859",
      "original_text": "Sonstige Registerbekanntmachung\nBaden-Württemberg Amtsgericht Stuttgart HRB 400596\nGottlieb Gühring Beteiligungsgesellschaft mbH – Albstadt",
      "type": "Sonstige Registerbekanntmachung",
      "state": "Baden-Württemberg",
      "amtsgericht": "Amtsgericht Stuttgart",
      "registernummer": "HRB 400596",
      "registerart": "HRB",
      "company_name": "Gottlieb Gühring Beteiligungsgesellschaft mbH",
      "company_seat": "Albstadt",
      "details": "11.02.2026 (Bekanntmachungsdatum)\n\nBaden-Württemberg Amtsgericht Stuttgart HRB 400596\nSonstige Registerbekanntmachung\n\nGottlieb Gühring Beteiligungsgesellschaft mbH\nGesellschaft mit beschränkter Haftung\nAlbstadt\n\nDie Gesellschaft hat am 08.01.2026 die Neufassung des Gesellschaftsvertrags beschlossen. Die Bestimmungen zum Beirat wurden aufgehoben."
    },
    {
      "date": "2026-02-11",
      "id": "144860",
      "original_text": "Registerbekanntmachung nach dem Umwandlungsgesetz\nBaden-Württemberg Amtsgericht Stuttgart HRB 773829\nGötz Immotrans GmbH – Weilheim an der Teck",
      "type": "Registerbekanntmachung nach dem Umwandlungsgesetz",
      "state": "Baden-Württemberg",
      "amtsgericht": "Amtsgericht Stuttgart",
      "registernummer": "HRB 773829",
      "registerart": "HRB",
      "company_name": "Götz Immotrans GmbH",
      "company_seat": "Weilheim an der Teck",
      "details": "11.02.2026 (Bekanntmachungsdatum)\n\nBaden-Württemberg Amtsgericht Stuttgart HRB 773829\nRegisterbekanntmachung nach dem Umwandlungsgesetz 11.02.2026 (Eintragungsdatum)\n\nGötz Immotrans GmbH\nGesellschaft mit beschränkter Haftung\nWeilheim an der Teck\n\nDen Gläubigern der an der Verschmelzung beteiligten Rechtsträger ist, wenn sie binnen sechs Monaten nach dem Tag, an dem die Eintragung der Verschmelzung in das Register des Sitzes desjenigen Rechtsträgers, dessen Gläubiger sie sind, nach § 19 Abs. 3 UmwG als bekanntgemacht gilt, ihren Anspruch nach Grund und Höhe schriftlich anmelden, Sicherheit zu leisten, soweit sie nicht Befriedigung verlangen können. Dieses Recht steht den Gläubigern jedoch nur zu, wenn sie glaubhaft machen, dass durch die Verschmelzung die Erfüllung ihrer Forderung gefährdet wird."
    },
    {
      "date": "2026-02-11",
      "id": "144861",
      "original_text": "Registerbekanntmachung nach dem Umwandlungsgesetz\nBaden-Württemberg Amtsgericht Mannheim HRB 757272\nKiefer Holding GmbH – Mönsheim",
      "type": "Registerbekanntmachung nach dem Umwandlungsgesetz",
      "state": "Baden-Württemberg",
      "amtsgericht": "Amtsgericht Mannheim",
      "registernummer": "HRB 757272",
      "registerart": "HRB",
      "company_name": "Kiefer Holding GmbH",
      "company_seat": "Mönsheim",
      "details": "11.02.2026 (Bekanntmachungsdatum)\n\nBaden-Württemberg Amtsgericht Mannheim HRB 757272\nRegisterbekanntmachung nach dem Umwandlungsgesetz 11.02.2026 (Eintragungsdatum)\n\nKiefer Holding GmbH\nGesellschaft mit beschränkter Haftung\nMönsheim\n\nDen Gläubigern der an der Ausgliederung beteiligten Rechtsträger ist, wenn sie binnen sechs Monaten nach dem Tag, an dem die Eintragung der Ausgliederung in das Register des Sitzes desjenigen Rechtsträgers, dessen Gläubiger sie sind, nach § 19 Abs. 3 UmwG als bekanntgemacht gilt, ihren Anspruch nach Grund und Höhe schriftlich anmelden, Sicherheit zu leisten, soweit sie nicht Befriedigung verlangen können. Dieses Recht steht den Gläubigern jedoch nur zu, wenn sie glaubhaft machen, dass durch die Ausgliederung die Erfüllung ihrer Forderung gefährdet wird."
    },
    {
      "date": "2026-02-11",
      "id": "144862",
      "original_text": "Sonstige Registerbekanntmachung\nBerlin Amtsgericht Berlin (Charlottenburg) HRB 200842\nHypoport InsurTech AG – Berlin",
      "type": "Sonstige Registerbekanntmachung",
      "state": "Berlin",
      "amtsgericht": "Amtsgericht Berlin (Charlottenburg)",
      "registernummer": "HRB 200842",
      "registerart": "HRB",
      "company_name": "Hypoport InsurTech AG",
      "company_seat": "Berlin",
      "details": "11.02.2026 (Bekanntmachungsdatum)\n\nBerlin Amtsgericht Berlin (Charlottenburg) HRB 200842\nSonstige Registerbekanntmachung 11.02.2026 (Eintragungsdatum)\n\nHypoport InsurTech AG\nAktiengesellschaft\nBerlin\n\nAls nicht eingetragen wird veröffentlicht: Der andere Vertragsteil hat den Gläubigern dieses Rechtsträgers, deren Forderungen begründet worden sind, bevor die Eintragung der Beendigung dieses Vertrages in das Handelsregister nach § 10 des Handelsgesetzbuches als bekannt gemacht gilt, Sicherheit zu leisten, wenn sie sich binnen sechs Monaten nach der Bekanntmachung der Eintragung zu diesem Zweck bei ihm melden. Dieses Recht steht den Gläubigern nicht zu, die im Fall des Insolvenzverfahrens ein Recht auf vorzugsweise Befriedigung aus der Deckungsmasse haben, die nach gesetzlicher Vorschrift zu ihrem Schutz errichtet und staatlich überwacht ist."
    },
    {
      "date": "2026-02-11",
      "id": "144863",
      "original_text": "Einreichung neuer Dokumente\nBerlin Amtsgericht Berlin (Charlottenburg) HRB 117846\nwooga GmbH – Berlin",
      "type": "Einreichung neuer Dokumente",
      "state": "Berlin",
      "amtsgericht": "Amtsgericht Berlin (Charlottenburg)",
      "registernummer": "HRB 117846",
      "registerart": "HRB",
      "company_name": "wooga GmbH",
      "company_seat": "Berlin",
      "details": "11.02.2026 (Bekanntmachungsdatum)\n\nBerlin Amtsgericht Berlin (Charlottenburg) HRB 117846\nEinreichung neuer Dokumente\n\nwooga GmbH\nGesellschaft mit beschränkter Haftung\nBerlin\n\nAls nicht eingetragen wird veröffentlicht:\nEs wurde eine neue Liste der Beiratsmitglieder eingereicht (§52 GmbHG)."
    },
    {
      "date": "2026-02-11",
      "id": "144864",
      "original_text": "Löschungsankündigung\nSaarland Amtsgericht Saarbrücken HRB 104984\nMONDIAL TISSUS GmbH – Saarbrücken",
      "type": "Löschungsankündigung",
      "state": "Saarland",
      "amtsgericht": "Amtsgericht Saarbrücken",
      "registernummer": "HRB 104984",
      "registerart": "HRB",
      "company_name": "MONDIAL TISSUS GmbH",
      "company_seat": "Saarbrücken",
      "details": "11.02.2026 (Bekanntmachungsdatum)\n\nSaarland Amtsgericht Saarbrücken HRB 104984\nLöschungsankündigung\n\nMONDIAL TISSUS GmbH\nGesellschaft mit beschränkter Haftung\nSaarbrücken\n\nEs ist beabsichtigt, die Gesellschaft von Amts wegen gemäß § 394 FamFG wegen Vermögenslosigkeit zu löschen. Gegen die Löschung von Amts wegen ist das Rechtsmittel des Widerspruchs statthaft. Der Widerspruch ist binnen einer Frist von 3 Monaten beginnend mit dem Tag dieser Veröffentlichung durch Einreichen eines Widerspruchsschreibens -schriftlich oder zur Niederschrift der Geschäftsstelle- beim Amtsgericht Saarbrücken, -zentrales Handelsregister-, Mainzerstr.178, 66121 Saarbrücken einzulegen. Der Widerspruch muss die Bezeichnung der angefochtenen Löschungsankündigung enthalten sowie die Erklärung, dass Widerspruch eingelegt wird. Er ist vom Widerspruchsführer oder seinem Bevollmächtigten zu unterzeichnen."
    },
    {
      "date": "2026-02-11",
      "id": "144865",
      "original_text": "Löschungsankündigung\nSachsen Amtsgericht Leipzig HRB 25640\nCENTERPACK-INTERWORLD GmbH – Leipzig",
      "type": "Löschungsankündigung",
      "state": "Sachsen",
      "amtsgericht": "Amtsgericht Leipzig",
      "registernummer": "HRB 25640",
      "registerart": "HRB",
      "company_name": "CENTERPACK-INTERWORLD GmbH",
      "company_seat": "Leipzig",
      "details": "11.02.2026 (Bekanntmachungsdatum)\n\nSachsen Amtsgericht Leipzig HRB 25640\nLöschungsankündigung\n\nCENTERPACK-INTERWORLD GmbH\nGesellschaft mit beschränkter Haftung\nLeipzig\n\nDas Registergericht beabsichtigt, die im Handelsregister eingetragene Gesellschaft von Amts wegen nach § 394 FamFG zu löschen. Die Frist zu Erhebung eines Widerspruchs gegen die beabsichtigte Löschung wird auf einen Monat festgesetzt."
    },
    {
      "date": "2026-02-11",
      "id": "144866",
      "original_text": "Registerbekanntmachung nach dem Umwandlungsgesetz\nNiedersachsen Amtsgericht Hannover HRB 217556\nGemini Invest GmbH – Hannover",
      "type": "Registerbekanntmachung nach dem Umwandlungsgesetz",
      "state": "Niedersachsen",
      "amtsgericht": "Amtsgericht Hannover",
      "registernummer": "HRB 217556",
      "registerart": "HRB",
      "company_name": "Gemini Invest GmbH",
      "company_seat": "Hannover",
      "details": "11.02.2026 (Bekanntmachungsdatum)\n\nNiedersachsen Amtsgericht Hannover HRB 217556\nRegisterbekanntmachung nach dem Umwandlungsgesetz 11.02.2026 (Eintragungsdatum)\n\nGemini Invest GmbH\nGesellschaft mit beschränkter Haftung\nHannover\n\nDen Gläubigern der an der Verschmelzung beteiligten Rechtsträger ist, wenn sie binnen sechs Monaten nach dem Tag, an dem die Eintragung der Verschmelzung in das Register des Sitzes desjenigen Rechtsträgers, dessen Gläubiger sie sind, nach § 19  Abs.  3 UmwG als bekannt gemacht gilt, ihren Anspruch nach Grund und Höhe schriftlich anmelden, Sicherheit zu leisten, soweit sie nicht Befriedigung verlangen können. Dieses Recht steht den Gläubigern jedoch nur zu, wenn sie glaubhaft machen, dass durch die Verschmelzung die Erfüllung der Forderung gefährdet wird."
    },
    {
      "date": "2026-02-11",
      "id": "144867",
      "original_text": "Löschungsankündigung\nNiedersachsen Amtsgericht Braunschweig HRB 5055\nWäha-Plan GmbH – Braunschweig",
      "type": "Löschungsankündigung",
      "state": "Niedersachsen",
      "amtsgericht": "Amtsgericht Braunschweig",
      "registernummer": "HRB 5055",
      "registerart": "HRB",
      "company_name": "Wäha-Plan GmbH",
      "company_seat": "Braunschweig",
      "details": "11.02.2026 (Bekanntmachungsdatum)\n\nNiedersachsen Amtsgericht Braunschweig HRB 5055\nLöschungsankündigung 11.02.2026 (Eintragungsdatum)\n\nWäha-Plan GmbH\nGesellschaft mit beschränkter Haftung\nBraunschweig\n\nDas Registergericht beabsichtigt, die Gesellschaft von Amts wegen nach § 394 FamFG zu löschen. Die Frist zur Erhebung eines Widerspruchs ist auf 1 Monat ab dieser Registerbekanntmachung festgesetzt."
    },
    {
      "date": "2026-02-11",
      "id": "144868",
      "original_text": "Sonstige Registerbekanntmachung\nNiedersachsen Amtsgericht Oldenburg (Oldenburg) HRB 5236\nEWE NETZ GmbH – Oldenburg",
      "type": "Sonstige Registerbekanntmachung",
      "state": "Niedersachsen",
      "amtsgericht": "Amtsgericht Oldenburg (Oldenburg)",
      "registernummer": "HRB 5236",
      "registerart": "HRB",
      "company_name": "EWE NETZ GmbH",
      "company_seat": "Oldenburg",
      "details": "11.02.2026 (Bekanntmachungsdatum)\n\nNiedersachsen Amtsgericht Oldenburg (Oldenburg) HRB 5236\nSonstige Registerbekanntmachung\n\nEWE NETZ GmbH\nGesellschaft mit beschränkter Haftung\nOldenburg\n\nDie Liste der Mitglieder des Aufsichtsrats wurde beim Registergericht eingereicht."
    },
    {
      "date": "2026-02-11",
      "id": "144869",
      "original_text": "Registerbekanntmachung nach dem Umwandlungsgesetz\nNiedersachsen Amtsgericht Hannover HRB 217635\nAdvoCar Software GmbH – Hannover",
      "type": "Registerbekanntmachung nach dem Umwandlungsgesetz",
      "state": "Niedersachsen",
      "amtsgericht": "Amtsgericht Hannover",
      "registernummer": "HRB 217635",
      "registerart": "HRB",
      "company_name": "AdvoCar Software GmbH",
      "company_seat": "Hannover",
      "details": "11.02.2026 (Bekanntmachungsdatum)\n\nNiedersachsen Amtsgericht Hannover HRB 217635\nRegisterbekanntmachung nach dem Umwandlungsgesetz 11.02.2026 (Eintragungsdatum)\n\nAdvoCar Software GmbH\nGesellschaft mit beschränkter Haftung\nHannover\n\nDen Gläubigern der an der Verschmelzung beteiligten Rechtsträger ist, wenn sie binnen sechs Monaten nach dem Tag, an dem die Eintragung der Verschmelzung in das Register des Sitzes desjenigen Rechtsträgers, dessen Gläubiger sie sind, nach § 19  Abs.  3 UmwG als bekannt gemacht gilt, ihren Anspruch nach Grund und Höhe schriftlich anmelden, Sicherheit zu leisten, soweit sie nicht Befriedigung verlangen können. Dieses Recht steht den Gläubigern jedoch nur zu, wenn sie glaubhaft machen, dass durch die Verschmelzung die Erfüllung der Forderung gefährdet wird."
    },
    {
      "date": "2026-02-11",
      "id": "144870",
      "original_text": "Einreichung neuer Dokumente\nNiedersachsen Amtsgericht Braunschweig HRB 119\nNibelungen-Wohnbau-GmbH Braunschweig – Braunschweig",
      "type": "Einreichung neuer Dokumente",
      "state": "Niedersachsen",
      "amtsgericht": "Amtsgericht Braunschweig",
      "registernummer": "HRB 119",
      "registerart": "HRB",
      "company_name": "Nibelungen-Wohnbau-GmbH Braunschweig",
      "company_seat": "Braunschweig",
      "details": "11.02.2026 (Bekanntmachungsdatum)\n\nNiedersachsen Amtsgericht Braunschweig HRB 119\nEinreichung neuer Dokumente 11.02.2026 (Eintragungsdatum)\n\nNibelungen-Wohnbau-GmbH Braunschweig\nGesellschaft mit beschränkter Haftung\nBraunschweig\n\nDie Liste der Mitglieder des Aufsichtsrats wurde beim Registergericht eingereicht."
    },
    {
      "date": "2026-02-11",
      "id": "144871",
      "original_text": "Löschungsankündigung\nBremen Amtsgericht Bremen HRB 23133\nDolzer Bremen GmbH – Bremen",
      "type": "Löschungsankündigung",
      "state": "Bremen",
      "amtsgericht": "Amtsgericht Bremen",
      "registernummer": "HRB 23133",
      "registerart": "HRB",
      "company_name": "Dolzer Bremen GmbH",
      "company_seat": "Bremen",
      "details": "11.02.2026 (Bekanntmachungsdatum)\n\nBremen Amtsgericht Bremen HRB 23133\nLöschungsankündigung\n\nDolzer Bremen GmbH\nGesellschaft mit beschränkter Haftung\nBremen\n\nEs ist beabsichtigt die im Handelsregister eingetragene Gesellschaft von Amts wegen gemäß § 394 FamFG zu löschen. Gegen die Löschung kann beim AG Bremen schriftlich oder zu Protokoll der Geschäftsstelle Widerspruch eingelegt werden. Widerspruchsfrist 4 Wochen."
    },
    {
      "date": "2026-02-11",
      "id": "144872",
      "original_text": "Löschungsankündigung\nRheinland-Pfalz Amtsgericht Zweibrücken HRB 21590\nWalter Egner Verwaltungs-GmbH – Pirmasens",
      "type": "Löschungsankündigung",
      "state": "Rheinland-Pfalz",
      "amtsgericht": "Amtsgericht Zweibrücken",
      "registernummer": "HRB 21590",
      "registerart": "HRB",
      "company_name": "Walter Egner Verwaltungs-GmbH",
      "company_seat": "Pirmasens",
      "details": "11.02.2026 (Bekanntmachungsdatum)\n\nRheinland-Pfalz Amtsgericht Zweibrücken HRB 21590\nLöschungsankündigung\n\nWalter Egner Verwaltungs-GmbH\nGesellschaft mit beschränkter Haftung\nPirmasens\n\nDas Registergericht beabsichtigt die Gesellschaft von Amts wegen nach § 394 FamFG zu löschen. Die Frist zur Erhebung eines Widerspruchs ist auf einen Monat festgesetzt."
    },
    {
      "date": "2026-02-11",
      "id": "144873",
      "original_text": "Löschungsankündigung\nRheinland-Pfalz Amtsgericht Ludwigshafen a.Rhein (Ludwigshafen) HRB 65949\nCASH GAME GmbH – Mutterstadt",
      "type": "Löschungsankündigung",
      "state": "Rheinland-Pfalz",
      "amtsgericht": "Amtsgericht Ludwigshafen a.Rhein (Ludwigshafen)",
      "registernummer": "HRB 65949",
      "registerart": "HRB",
      "company_name": "CASH GAME GmbH",
      "company_seat": "Mutterstadt",
      "details": "11.02.2026 (Bekanntmachungsdatum)\n\nRheinland-Pfalz Amtsgericht Ludwigshafen a.Rhein (Ludwigshafen) HRB 65949\nLöschungsankündigung\n\nCASH GAME GmbH\nGesellschaft mit beschränkter Haftung\nMutterstadt\n\nDas Registergericht beabsichtigt die Gesellschaft von Amts wegen nach § 394 FamFG zu löschen. Die Frist zur Erhebung eines Widerspruchs ist auf einen Monat festgesetzt."
    },
    {
      "date": "2026-02-11",
      "id": "144874",
      "original_text": "Einreichung neuer Dokumente\nRheinland-Pfalz Amtsgericht Kaiserslautern HRB 30804\nSWK Stadtwerke Kaiserslautern Versorgungs-AG – Kaiserslautern",
      "type": "Einreichung neuer Dokumente",
      "state": "Rheinland-Pfalz",
      "amtsgericht": "Amtsgericht Kaiserslautern",
      "registernummer": "HRB 30804",
      "registerart": "HRB",
      "company_name": "SWK Stadtwerke Kaiserslautern Versorgungs-AG",
      "company_seat": "Kaiserslautern",
      "details": "11.02.2026 (Bekanntmachungsdatum)\n\nRheinland-Pfalz Amtsgericht Kaiserslautern HRB 30804\nEinreichung neuer Dokumente\n\nSWK Stadtwerke Kaiserslautern Versorgungs-AG\nAktiengesellschaft\nKaiserslautern\n\nDem Registergericht ist eine neue Liste der Mitglieder des Aufsichtsrates eingereicht worden."
    },
    {
      "date": "2026-02-11",
      "id": "144875",
      "original_text": "Sonstige Registerbekanntmachung\nRheinland-Pfalz Amtsgericht Wittlich HRB 32262\nEFS - Euro Forming Services GmbH – Bitburg",
      "type": "Sonstige Registerbekanntmachung",
      "state": "Rheinland-Pfalz",
      "amtsgericht": "Amtsgericht Wittlich",
      "registernummer": "HRB 32262",
      "registerart": "HRB",
      "company_name": "EFS - Euro Forming Services GmbH",
      "company_seat": "Bitburg",
      "details": "11.02.2026 (Bekanntmachungsdatum)\n\nRheinland-Pfalz Amtsgericht Wittlich HRB 32262\nSonstige Registerbekanntmachung 11.02.2026 (Eintragungsdatum)\n\nEFS - Euro Forming Services GmbH\nGesellschaft mit beschränkter Haftung\nBitburg\n\nAls nicht eingetragen wird veröffentlicht: Den Gläubigern der Gesellschaft, deren Forderungen begründet worden sind, bevor die Eintragung der Beendigung des Beherrschungs- und Ergebnisabführungsvertrages in das Handelsregister nach § 10 des Handelsgesetzbuches als bekanntgemacht gilt, hat der andere Vertragsteil Sicherheit zu leisten, wenn sie sich binnen sechs Monaten nach der Bekanntmachung der Eintragung zu diesem Zweck bei ihm melden."
    },
    {
      "date": "2026-02-11",
      "id": "144876",
      "original_text": "Sonstige Registerbekanntmachung\nNordrhein-Westfalen Amtsgericht Düsseldorf HRB 33732\nDeutsche Bestattungsvorsorge Treuhand Aktiengesellschaft – Düsseldorf",
      "type": "Sonstige Registerbekanntmachung",
      "state": "Nordrhein-Westfalen",
      "amtsgericht": "Amtsgericht Düsseldorf",
      "registernummer": "HRB 33732",
      "registerart": "HRB",
      "company_name": "Deutsche Bestattungsvorsorge Treuhand Aktiengesellschaft",
      "company_seat": "Düsseldorf",
      "details": "11.02.2026 (Bekanntmachungsdatum)\n\nNordrhein-Westfalen Amtsgericht Düsseldorf HRB 33732\nSonstige Registerbekanntmachung\n\nDeutsche Bestattungsvorsorge Treuhand Aktiengesellschaft\nAktiengesellschaft\nDüsseldorf\n\nDem Registergericht ist eine Liste der Mitglieder des Aufsichtsrates eingereicht worden."
    },
    {
      "date": "2026-02-11",
      "id": "144877",
      "original_text": "Registerbekanntmachung nach dem Umwandlungsgesetz\nNordrhein-Westfalen Amtsgericht Siegburg HRB 11906\nANREIT 2 GmbH – Troisdorf",
      "type": "Registerbekanntmachung nach dem Umwandlungsgesetz",
      "state": "Nordrhein-Westfalen",
      "amtsgericht": "Amtsgericht Siegburg",
      "registernummer": "HRB 11906",
      "registerart": "HRB",
      "company_name": "ANREIT 2 GmbH",
      "company_seat": "Troisdorf",
      "details": "11.02.2026 (Bekanntmachungsdatum)\n\nNordrhein-Westfalen Amtsgericht Siegburg HRB 11906\nRegisterbekanntmachung nach dem Umwandlungsgesetz 11.02.2026 (Eintragungsdatum)\n\nANREIT 2 GmbH\nGesellschaft mit beschränkter Haftung\nTroisdorf\n\nDen Gläubigern der an der Verschmelzung beteiligten Rechtsträger ist, wenn sie binnen sechs Monaten nach dem Tag, an dem die Eintragung der Verschmelzung in das Register des Sitzes desjenigen Rechtsträgers, dessen Gläubiger sie sind, nach § 19 Absatz 3 UmwG als bekanntgemacht gilt, ihren Anspruch nach Grund und Höhe schriftlich anmelden, Sicherheit zu leisten, soweit sie nicht Befriedigung verlangen können. Dieses Recht steht den Gläubigern jedoch nur zu, wenn sie glaubhaft machen, dass durch die Verschmelzung die Erfüllung ihrer Forderung gefährdet wird."
    },
    {
      "date": "2026-02-11",
      "id": "144878",
      "original_text": "Löschungsankündigung\nNordrhein-Westfalen Amtsgericht Düsseldorf HRB 92616\nWell Life Trade GmbH – Düsseldorf",
      "type": "Löschungsankündigung",
      "state": "Nordrhein-Westfalen",
      "amtsgericht": "Amtsgericht Düsseldorf",
      "registernummer": "HRB 92616",
      "registerart": "HRB",
      "company_name": "Well Life Trade GmbH",
      "company_seat": "Düsseldorf",
      "details": "11.02.2026 (Bekanntmachungsdatum)\n\nNordrhein-Westfalen Amtsgericht Düsseldorf HRB 92616\nLöschungsankündigung\n\nWell Life Trade GmbH\nGesellschaft mit beschränkter Haftung\nDüsseldorf\n\nDas Registergericht beabsichtigt die Gesellschaft von Amts wegen nach § 394 Abs. 1 FamFG zu löschen. Die Frist zur Erhebung eines Widerspruchs ist auf einen Monat festgesetzt.\n\nRechtsbehelfsbelehrung:\nDas Widerspruchsrecht steht jedem zu, der an der Unterlassung der Löschung ein berechtigtes Interesse hat. Der Widerspruch ist bei dem Amtsgericht Düsseldorf -Registergericht-, Werdener Straße 1, 40227 Düsseldorf schriftlich in deutscher Sprache oder zur Niederschrift der Geschäftsstelle einzulegen. Der Widerspruch kann auch zur Niederschrift der Geschäftsstelle eines jeden Amtsgerichtes abgegeben werden. Die Einlegung ist auch durch Übertragung eines elektronischen Dokuments an die elektronische Poststelle des Gerichts möglich. Das elektronische Dokument muss für die Bearbeitung durch das Gericht geeignet und mit einer qualifizierten elektronischen Signatur der verantwortenden Person versehen sein oder von der verantwortenden Person signiert und auf einem sicheren Übermittlungsweg gemäß § 130a ZPO nach näherer Maßgabe der Verordnung über die technischen Rahmenbedingungen des elektronischen Rechtsverkehrs und über das besondere elektronische Behördenpostfach (BGBl. I, S.3803) eingereicht werden. Weitere Informationen erhalten Sie auf der Internetseite www.justiz.de.\nDer Widerspruch muss spätestens innerhalb der gesetzten Frist nach dem Datum der Bekanntmachung der Löschungsankündigung bei dem Amtsgericht - Registergericht - Düsseldorf eingegangen sein.  Dies gilt auch dann, wenn der Widerspruch zur Niederschrift der Geschäftsstelle eines anderen Amtsgerichtes abgegeben wurde. Die Frist beginnt mit dem Tage der Bekanntmachung der Löschungsankündigung in dem für die Bekanntmachung der Eintragungen in das Handelsregister bestimmten elektronischen Informations- und Kommunikationssystem nach § 10 des Handelsgesetzbuches. Fällt das Ende der Frist auf einen Sonntag, einen allgemeinen Feiertag oder Sonnabend, so endet die Frist mit Ablauf des nächsten Werktages.\nDer Widerspruch muss die Bezeichnung der angefochtenen Löschungsankündigung sowie die Erklärung enthalten, dass Widerspruch gegen diese Löschungsankündigung eingelegt wird. Er ist zu unterzeichnen und soll begründet werden."
    },
    {
      "date": "2026-02-11",
      "id": "144879",
      "original_text": "Löschungsankündigung\nNordrhein-Westfalen Amtsgericht Düsseldorf HRB 90274\nindini Deutschland GmbH – Düsseldorf",
      "type": "Löschungsankündigung",
      "state": "Nordrhein-Westfalen",
      "amtsgericht": "Amtsgericht Düsseldorf",
      "registernummer": "HRB 90274",
      "registerart": "HRB",
      "company_name": "indini Deutschland GmbH",
      "company_seat": "Düsseldorf",
      "details": "11.02.2026 (Bekanntmachungsdatum)\n\nNordrhein-Westfalen Amtsgericht Düsseldorf HRB 90274\nLöschungsankündigung\n\nindini Deutschland GmbH\nGesellschaft mit beschränkter Haftung\nDüsseldorf\n\nDas Registergericht beabsichtigt die Gesellschaft von Amts wegen nach § 394 FamFG zu löschen. Die Frist zur Erhebung eines Widerspruchs ist auf 3 Wochen festgesetzt.\n\nRechtsbehelfsbelehrung:\nDas Widerspruchsrecht steht jedem zu, der an der Unterlassung der Löschung ein berechtigtes Interesse hat. Der Widerspruch ist bei dem Amtsgericht Düsseldorf -Registergericht-, Werdener Straße 1, 40227 Düsseldorf schriftlich in deutscher Sprache oder zur Niederschrift der Geschäftsstelle einzulegen. Der Widerspruch kann auch zur Niederschrift der Geschäftsstelle eines jeden Amtsgerichtes abgegeben werden. Die Einlegung ist auch durch Übertragung eines elektronischen Dokuments an die elektronische Poststelle des Gerichts möglich. Das elektronische Dokument muss für die Bearbeitung durch das Gericht geeignet und mit einer qualifizierten elektronischen Signatur der verantwortenden Person versehen sein oder von der verantwortenden Person signiert und auf einem sicheren Übermittlungsweg gemäß § 130a ZPO nach näherer Maßgabe der Verordnung über die technischen Rahmenbedingungen des elektronischen Rechtsverkehrs und über das besondere elektronische Behördenpostfach (BGBl. I, S.3803) eingereicht werden. Weitere Informationen erhalten Sie auf der Internetseite www.justiz.de.\nDer Widerspruch muss spätestens innerhalb der gesetzten Frist nach dem Datum der Bekanntmachung der Löschungsankündigung bei dem Amtsgericht - Registergericht - Düsseldorf eingegangen sein.  Dies gilt auch dann, wenn der Widerspruch zur Niederschrift der Geschäftsstelle eines anderen Amtsgerichtes abgegeben wurde. Die Frist beginnt mit dem Tage der Bekanntmachung der Löschungsankündigung in dem für die Bekanntmachung der Eintragungen in das Handelsregister bestimmten elektronischen Informations- und Kommunikationssystem nach § 10 des Handelsgesetzbuches. Fällt das Ende der Frist auf einen Sonntag, einen allgemeinen Feiertag oder Sonnabend, so endet die Frist mit Ablauf des nächsten Werktages.\nDer Widerspruch muss die Bezeichnung der angefochtenen Löschungsankündigung sowie die Erklärung enthalten, dass Widerspruch gegen diese Löschungsankündigung eingelegt wird. Er ist zu unterzeichnen und soll begründet werden."
    },
    {
      "date": "2026-02-11",
      "id": "144880",
      "original_text": "Löschungsankündigung\nNordrhein-Westfalen Amtsgericht Krefeld HRB 14301\nHtN Consulting und Management Holding GmbH – Kempen",
      "type": "Löschungsankündigung",
      "state": "Nordrhein-Westfalen",
      "amtsgericht": "Amtsgericht Krefeld",
      "registernummer": "HRB 14301",
      "registerart": "HRB",
      "company_name": "HtN Consulting und Management Holding GmbH",
      "company_seat": "Kempen",
      "details": "11.02.2026 (Bekanntmachungsdatum)\n\nNordrhein-Westfalen Amtsgericht Krefeld HRB 14301\nLöschungsankündigung\n\nHtN Consulting und Management Holding GmbH\nGesellschaft mit beschränkter Haftung\nKempen\n\nDas Registergericht beabsichtigt die Gesellschaft von Amts wegen nach § 394 FamFG zu löschen. Die Frist zur Erhebung eines Widerspruchs ist auf einen Monat festgesetzt."
    },
    {
      "date": "2026-02-11",
      "id": "144881",
      "original_text": "Einreichung neuer Dokumente\nNordrhein-Westfalen Amtsgericht Paderborn HRB 11572\nWestfalen Weser Netz GmbH – Paderborn",
      "type": "Einreichung neuer Dokumente",
      "state": "Nordrhein-Westfalen",
      "amtsgericht": "Amtsgericht Paderborn",
      "registernummer": "HRB 11572",
      "registerart": "HRB",
      "company_name": "Westfalen Weser Netz GmbH",
      "company_seat": "Paderborn",
      "details": "11.02.2026 (Bekanntmachungsdatum)\n\nNordrhein-Westfalen Amtsgericht Paderborn HRB 11572\nEinreichung neuer Dokumente\n\nWestfalen Weser Netz GmbH\nGesellschaft mit beschränkter Haftung\nPaderborn\n\nDem Registergericht ist eine Liste der Mitglieder des Aufsichtsrates eingereicht worden."
    },
    {
      "date": "2026-02-11",
      "id": "144882",
      "original_text": "Löschungsankündigung\nNordrhein-Westfalen Amtsgericht Essen HRB 31946\nTVG-GmbH – Essen",
      "type": "Löschungsankündigung",
      "state": "Nordrhein-Westfalen",
      "amtsgericht": "Amtsgericht Essen",
      "registernummer": "HRB 31946",
      "registerart": "HRB",
      "company_name": "TVG-GmbH",
      "company_seat": "Essen",
      "details": "11.02.2026 (Bekanntmachungsdatum)\n\nNordrhein-Westfalen Amtsgericht Essen HRB 31946\nLöschungsankündigung 11.02.2026 (Eintragungsdatum)\n\nTVG-GmbH\nGesellschaft mit beschränkter Haftung\nEssen\n\nDas Registergericht beabsichtigt die Gesellschaft von Amts wegen nach § 394 FamFG zu löschen. Die Frist zur Erhebung eines Widerspruchs ist auf einen Monat festgesetzt."
    },
    {
      "date": "2026-02-11",
      "id": "144883",
      "original_text": "Löschungsankündigung\nNordrhein-Westfalen Amtsgericht Gelsenkirchen HRB 16833\nElla Elson UG (haftungsbeschränkt) – Marl",
      "type": "Löschungsankündigung",
      "state": "Nordrhein-Westfalen",
      "amtsgericht": "Amtsgericht Gelsenkirchen",
      "registernummer": "HRB 16833",
      "registerart": "HRB",
      "company_name": "Ella Elson UG (haftungsbeschränkt)",
      "company_seat": "Marl",
      "details": "11.02.2026 (Bekanntmachungsdatum)\n\nNordrhein-Westfalen Amtsgericht Gelsenkirchen HRB 16833\nLöschungsankündigung\n\nElla Elson UG (haftungsbeschränkt)\nGesellschaft mit beschränkter Haftung\nMarl\n\nDas Gericht beabsichtigt, die Eintragung der Frau Dr. Antonella Beatrice Mendelsohn als alleinige Geschäftsführerin der in seinem Handelsregister unter HRB 16833 Amtsgericht Gelsenkirchen eingetragenen Ella Elson UG (haftungsbeschränkt) mit Sitz in Marl gemäß § 395 Abs. 1 FamFG wegen Unrichtigkeit von Amts wegen zu löschen.\nHiermit wird denjenigen, die an der Unterlassung der Löschung ein berechtigtes\nInteresse haben, gem. §§ 395 Abs. 2 Satz 2, 394 Abs. 2 FamFG Gelegenheit\ngegeben, gegen dieses Vorhaben binnen eines Monats nach dieser\nBekanntmachung Widerspruch einzulegen. Der Widerspruch kann schriftlich oder zu Protokoll der Geschäftsstelle erhoben werden."
    },
    {
      "date": "2026-02-11",
      "id": "144884",
      "original_text": "Löschungsankündigung\nNordrhein-Westfalen Amtsgericht Bad Oeynhausen HRA 9957\nUKMC GmbH & Co. KG – Bad Oeynhausen",
      "type": "Löschungsankündigung",
      "state": "Nordrhein-Westfalen",
      "amtsgericht": "Amtsgericht Bad Oeynhausen",
      "registernummer": "HRA 9957",
      "registerart": "HRA",
      "company_name": "UKMC GmbH & Co. KG",
      "company_seat": "Bad Oeynhausen",
      "details": "11.02.2026 (Bekanntmachungsdatum)\n\nNordrhein-Westfalen Amtsgericht Bad Oeynhausen HRA 9957\nLöschungsankündigung 23.10.2025 (Eintragungsdatum)\n\nUKMC GmbH & Co. KG\nKommanditgesellschaft\nBad Oeynhausen\n\nDas Registergericht beabsichtigt, die Firma von Amts wegen nach §§ 31 Absatz 2, 6 Absatz 1 HGB, § 393 FamFG zu löschen. Die Frist zur Erhebung eines Widerspruchs ist auf sechs Wochen festgesetzt. Rechtsbehelfsbelehrung Gegen diese Verfügung kann Widerspruch eingelegt werden. Der Widerspruch ist bei dem Amtsgericht Bad Oeynhausen, Bismarckstraße 12, 32545 Bad Oeynhausen schriftlich in deutscher Sprache oder zur Niederschrift der Geschäftsstelle einzulegen. Der Widerspruch kann auch zur Niederschrift der Geschäftsstelle eines jeden Amtsgerichtes abgegeben werden. Die Einlegung ist auch durch Übertragung eines elektronischen Dokuments an die elektronische Poststelle des Gerichts möglich. Der Widerspruch muss spätestens innerhalb der gesetzten Frist nach der schriftlichen Bekanntgabe der Verfügung bei dem Amtsgericht Bad Oeynhausen eingegangen sein. Dies gilt auch dann, wenn der Widerspruch zur Niederschrift der Geschäftsstelle eines anderen Amtsgerichtes abgegeben wurde. Der Widerspruch muss die Bezeichnung der angefochtenen Verfügung sowie die Erklärung enthalten, dass Widerspruch gegen diese Verfügung eingelegt wird. Er ist zu unterzeichnen und soll begründet werden."
    },
    {
      "date": "2026-02-11",
      "id": "144885",
      "original_text": "Sonstige Registerbekanntmachung\nNordrhein-Westfalen Amtsgericht Dortmund HRB 30954\nSkin Lounge Dortmund UG (haftungsbeschränkt) – Dortmund",
      "type": "Sonstige Registerbekanntmachung",
      "state": "Nordrhein-Westfalen",
      "amtsgericht": "Amtsgericht Dortmund",
      "registernummer": "HRB 30954",
      "registerart": "HRB",
      "company_name": "Skin Lounge Dortmund UG (haftungsbeschränkt)",
      "company_seat": "Dortmund",
      "details": "11.02.2026 (Bekanntmachungsdatum)\n\nNordrhein-Westfalen Amtsgericht Dortmund HRB 30954\nSonstige Registerbekanntmachung 11.02.2025 (Eintragungsdatum)\n\nSkin Lounge Dortmund UG (haftungsbeschränkt)\nGesellschaft mit beschränkter Haftung\nDortmund\n\nAls nicht eingetragen wird veröffentlicht: Den Gläubigern der Gesellschaft, deren Forderungen begründet worden sind bevor die Eintragung der Beendigung des Beherrschungs- und Gewinnabführungsvertrages  in das Handelsregister nach § 10 des Handelsgesetzbuches als bekanntgemacht gilt, hat der andere Vertragsteil Sicherheit zu leisten, wenn sie sich binnen sechs Monaten nach der Bekanntmachung der Eintragung zu diesem Zweck bei ihm melden."
    },
    {
      "date": "2026-02-11",
      "id": "144886",
      "original_text": "Einreichung neuer Dokumente\nNordrhein-Westfalen Amtsgericht Aachen HRB 28507\nMVZ RMK GmbH – Würselen",
      "type": "Einreichung neuer Dokumente",
      "state": "Nordrhein-Westfalen",
      "amtsgericht": "Amtsgericht Aachen",
      "registernummer": "HRB 28507",
      "registerart": "HRB",
      "company_name": "MVZ RMK GmbH",
      "company_seat": "Würselen",
      "details": "11.02.2026 (Bekanntmachungsdatum)\n\nNordrhein-Westfalen Amtsgericht Aachen HRB 28507\nEinreichung neuer Dokumente\n\nMVZ RMK GmbH\nGesellschaft mit beschränkter Haftung\nWürselen\n\nDem Registergericht ist eine Liste der Mitglieder des Aufsichtsrates eingereicht worden."
    },
    {
      "date": "2026-02-11",
      "id": "144887",
      "original_text": "Löschungsankündigung\nNordrhein-Westfalen Amtsgericht Mönchengladbach HRB 22140\nSpektrum Telekom GmbH – Viersen",
      "type": "Löschungsankündigung",
      "state": "Nordrhein-Westfalen",
      "amtsgericht": "Amtsgericht Mönchengladbach",
      "registernummer": "HRB 22140",
      "registerart": "HRB",
      "company_name": "Spektrum Telekom GmbH",
      "company_seat": "Viersen",
      "details": "11.02.2026 (Bekanntmachungsdatum)\n\nNordrhein-Westfalen Amtsgericht Mönchengladbach HRB 22140\nLöschungsankündigung 11.02.2026 (Eintragungsdatum)\n\nSpektrum Telekom GmbH\nGesellschaft mit beschränkter Haftung\nViersen\n\nDas Registergericht beabsichtigt die Gesellschaft von Amts wegen nach § 394 FamFG zu löschen. Die Frist zur Erhebung eines Widerspruchs ist auf drei Monate festgesetzt."
    },
    {
      "date": "2026-02-11",
      "id": "144888",
      "original_text": "Einreichung neuer Dokumente\nNordrhein-Westfalen Amtsgericht Siegburg HRB 1095\nStadtwerke Hennef (Sieg) GmbH – Hennef",
      "type": "Einreichung neuer Dokumente",
      "state": "Nordrhein-Westfalen",
      "amtsgericht": "Amtsgericht Siegburg",
      "registernummer": "HRB 1095",
      "registerart": "HRB",
      "company_name": "Stadtwerke Hennef (Sieg) GmbH",
      "company_seat": "Hennef",
      "details": "11.02.2026 (Bekanntmachungsdatum)\n\nNordrhein-Westfalen Amtsgericht Siegburg HRB 1095\nEinreichung neuer Dokumente\n\nStadtwerke Hennef (Sieg) GmbH\nGesellschaft mit beschränkter Haftung\nHennef\n\nDem Registergericht ist eine Liste der Mitglieder des Aufsichtsrates eingereicht worden."
    },
    {
      "date": "2026-02-11",
      "id": "144889",
      "original_text": "Einreichung neuer Dokumente\nNordrhein-Westfalen Amtsgericht Gelsenkirchen HRB 5141\nGesellschaft für Bauen und Wohnen, Bottrop mit beschränkter Haftung – Bottrop",
      "type": "Einreichung neuer Dokumente",
      "state": "Nordrhein-Westfalen",
      "amtsgericht": "Amtsgericht Gelsenkirchen",
      "registernummer": "HRB 5141",
      "registerart": "HRB",
      "company_name": "Gesellschaft für Bauen und Wohnen, Bottrop mit beschränkter Haftung",
      "company_seat": "Bottrop",
      "details": "11.02.2026 (Bekanntmachungsdatum)\n\nNordrhein-Westfalen Amtsgericht Gelsenkirchen HRB 5141\nEinreichung neuer Dokumente\n\nGesellschaft für Bauen und Wohnen, Bottrop mit beschränkter Haftung\nGesellschaft mit beschränkter Haftung\nBottrop\n\nDem Registergericht ist eine neue Liste der Mitglieder des Aufsichtsrates eingereicht worden."
    },
    {
      "date": "2026-02-11",
      "id": "144890",
      "original_text": "Löschungsankündigung\nNordrhein-Westfalen Amtsgericht Wuppertal HRB 26745\niokom UG (haftungsbeschränkt) – Solingen",
      "type": "Löschungsankündigung",
      "state": "Nordrhein-Westfalen",
      "amtsgericht": "Amtsgericht Wuppertal",
      "registernummer": "HRB 26745",
      "registerart": "HRB",
      "company_name": "iokom UG (haftungsbeschränkt)",
      "company_seat": "Solingen",
      "details": "11.02.2026 (Bekanntmachungsdatum)\n\nNordrhein-Westfalen Amtsgericht Wuppertal HRB 26745\nLöschungsankündigung\n\niokom UG (haftungsbeschränkt)\nGesellschaft mit beschränkter Haftung\nSolingen\n\nDas Registergericht beabsichtigt die Gesellschaft von Amts wegen nach § 394 FamFG zu löschen. Die Frist zur Erhebung eines Widerspruchs ist auf einen Monat festgesetzt."
    },
    {
      "date": "2026-02-11",
      "id": "144891",
      "original_text": "Registerbekanntmachung nach dem Umwandlungsgesetz\nNordrhein-Westfalen Amtsgericht Essen HRB 21754\nthyssenkrupp Technologies Beteiligungen GmbH – Essen",
      "type": "Registerbekanntmachung nach dem Umwandlungsgesetz",
      "state": "Nordrhein-Westfalen",
      "amtsgericht": "Amtsgericht Essen",
      "registernummer": "HRB 21754",
      "registerart": "HRB",
      "company_name": "thyssenkrupp Technologies Beteiligungen GmbH",
      "company_seat": "Essen",
      "details": "11.02.2026 (Bekanntmachungsdatum)\n\nNordrhein-Westfalen Amtsgericht Essen HRB 21754\nRegisterbekanntmachung nach dem Umwandlungsgesetz 11.02.2026 (Eintragungsdatum)\n\nthyssenkrupp Technologies Beteiligungen GmbH\nGesellschaft mit beschränkter Haftung\nEssen\n\nDen Gläubigern der an der Verschmelzung beteiligten Rechtsträger ist, wenn sie binnen sechs Monaten nach dem Tag, an dem die Eintragung der Verschmelzung in das Register des Sitzes desjenigen Rechtsträgers, dessen Gläubiger sie sind, nach § 19 Absatz 3 UmwG als bekanntgemacht gilt, ihren Anspruch nach Grund und Höhe schriftlich anmelden, Sicherheit zu leisten, soweit sie nicht Befriedigung verlangen können. Dieses Recht steht den Gläubigern jedoch nur zu, wenn sie glaubhaft machen, dass durch die Verschmelzung die Erfüllung ihrer Forderung gefährdet wird."
    },
    {
      "date": "2026-02-11",
      "id": "144892",
      "original_text": "Löschungsankündigung\nNordrhein-Westfalen Amtsgericht Wuppertal HRB 3872\nGROTE BAD EINRICHTUNG + GE - GASHEIZUNGEN GmbH – Wuppertal",
      "type": "Löschungsankündigung",
      "state": "Nordrhein-Westfalen",
      "amtsgericht": "Amtsgericht Wuppertal",
      "registernummer": "HRB 3872",
      "registerart": "HRB",
      "company_name": "GROTE BAD EINRICHTUNG + GE - GASHEIZUNGEN GmbH",
      "company_seat": "Wuppertal",
      "details": "11.02.2026 (Bekanntmachungsdatum)\n\nNordrhein-Westfalen Amtsgericht Wuppertal HRB 3872\nLöschungsankündigung\n\nGROTE BAD  EINRICHTUNG + GE - GASHEIZUNGEN GmbH\nGesellschaft mit beschränkter Haftung\nWuppertal\n\nDas Registergericht beabsichtigt die Gesellschaft von Amts wegen nach § 394 FamFG zu löschen. Die Frist zur Erhebung eines Widerspruchs ist auf einen Monat festgesetzt."
    },
    {
      "date": "2026-02-11",
      "id": "144893",
      "original_text": "Registerbekanntmachung nach dem Umwandlungsgesetz\nNordrhein-Westfalen Amtsgericht Essen HRB 13892\nSalvia Gebäudetechnik West GmbH – Essen",
      "type": "Registerbekanntmachung nach dem Umwandlungsgesetz",
      "state": "Nordrhein-Westfalen",
      "amtsgericht": "Amtsgericht Essen",
      "registernummer": "HRB 13892",
      "registerart": "HRB",
      "company_name": "Salvia Gebäudetechnik West GmbH",
      "company_seat": "Essen",
      "details": "11.02.2026 (Bekanntmachungsdatum)\n\nNordrhein-Westfalen Amtsgericht Essen HRB 13892\nRegisterbekanntmachung nach dem Umwandlungsgesetz 11.02.2026 (Eintragungsdatum)\n\nSalvia Gebäudetechnik West GmbH\nGesellschaft mit beschränkter Haftung\nEssen\n\nDen Gläubigern der an der Verschmelzung beteiligten Rechtsträger ist, wenn sie binnen sechs Monaten nach dem Tag, an dem die Eintragung der Verschmelzung in das Register des Sitzes desjenigen Rechtsträgers, dessen Gläubiger sie sind, nach § 19 Absatz 3 UmwG als bekanntgemacht gilt, ihren Anspruch nach Grund und Höhe schriftlich anmelden, Sicherheit zu leisten, soweit sie nicht Befriedigung verlangen können. Dieses Recht steht den Gläubigern jedoch nur zu, wenn sie glaubhaft machen, dass durch die Verschmelzung die Erfüllung ihrer Forderung gefährdet wird."
    },
    {
      "date": "2026-02-11",
      "id": "144894",
      "original_text": "Löschungsankündigung\nNordrhein-Westfalen Amtsgericht Siegburg HRB 9445\nELMA-Tech AG – Morsbach",
      "type": "Löschungsankündigung",
      "state": "Nordrhein-Westfalen",
      "amtsgericht": "Amtsgericht Siegburg",
      "registernummer": "HRB 9445",
      "registerart": "HRB",
      "company_name": "ELMA-Tech AG",
      "company_seat": "Morsbach",
      "details": "11.02.2026 (Bekanntmachungsdatum)\n\nNordrhein-Westfalen Amtsgericht Siegburg HRB 9445\nLöschungsankündigung\n\nELMA-Tech AG\nAktiengesellschaft\nMorsbach\n\nDas Registergericht hat glaubhafte Kenntnis erlangt, dass die Gesellschaft\nvermögenslos geworden ist, da ein Insolvenzverfahren durchgeführt und nach § 200 InsO aufgehoben wurde.\nEs ist daher beabsichtigt, die Gesellschaft nach § 394 FamFG im\nHandelsregister wegen Vermögenslosigkeit zu löschen.\nEinwände gegen die Löschung sind durch Widerspruch binnen einer Frist von\n3 Monaten geltend zu machen, andernfalls die Löschung erfolgen wird.\nEinzulegen ist der Widerspruch bei dem Amtsgericht Siegburg, Neue\nPoststraße 16, 53721 Siegburg, und zwar entweder schriftlich in deutscher\nSprache oder mündlich zur Niederschrift der Geschäftsstelle. Der\nWiderspruch kann auch zur Niederschrift der Geschäftsstelle eines jeden\nAmtsgerichts abgegeben werden. Der Widerspruch ist binnen der in der\nVerfügung bestimmten Frist einzulegen. Die Frist ist nur gewahrt, wenn der\nWiderspruch rechtzeitig bei dem Amtsgericht Siegburg eingeht, auch wenn\nder Widerspruch zur Niederschrift der Geschäftsstelle eines anderen\nAmtsgerichts abgegeben wurde. Die Frist beginnt jeweils mit der schriftlichen\nBekanntgabe der Verfügung an die Beteiligten. Kann die schriftliche\nBekanntgabe an einen Beteiligten nicht bewirkt werden, beginnt die Frist\nspätestens mit Ablauf von fünf Monaten nach Erlass der Verfügung. Die\nBekanntgabe ist entweder durch Zustellung oder am dritten Tage nach\nAufgabe zur Post bewirkt. Sofern die Löschung noch nicht erfolgt ist, kann der\nWiderspruch auch noch nach Ablauf der Frist eingelegt werden. Fällt das\nEnde der Frist auf einen Sonnabend, einen Sonntag oder einen allgemeinen\nFeiertag, endet die Frist mit Ablauf des nächsten Werktages. Der\nWiderspruch ist zu unterzeichnen. Eine Begründung des Widerspruchs ist\nnicht vorgeschrieben."
    },
    {
      "date": "2026-02-11",
      "id": "144895",
      "original_text": "Registerbekanntmachung nach dem Umwandlungsgesetz\nThüringen Amtsgericht Jena HRB 512990\nRATFINANZ Makler UG (haftungsbeschränkt) – Steinbach-Hallenberg",
      "type": "Registerbekanntmachung nach dem Umwandlungsgesetz",
      "state": "Thüringen",
      "amtsgericht": "Amtsgericht Jena",
      "registernummer": "HRB 512990",
      "registerart": "HRB",
      "company_name": "RATFINANZ Makler UG (haftungsbeschränkt)",
      "company_seat": "Steinbach-Hallenberg",
      "details": "11.02.2026 (Bekanntmachungsdatum)\n\nThüringen Amtsgericht Jena HRB 512990\nRegisterbekanntmachung nach dem Umwandlungsgesetz 06.01.2026 (Eintragungsdatum)\n\nRATFINANZ Makler UG (haftungsbeschränkt)\nGesellschaft mit beschränkter Haftung\nSteinbach-Hallenberg\n\nNicht eingetragen: Den Gläubigern der an der Verschmelzung beteiligten Rechtsträger, ist wenn sie binnen sechs Monaten nach dem Tag, an dem die Eintragung der Verschmelzung in das Register des Sitzes desjenigen Rechtsträgers, dessen Gläubiger sie sind,  nach § 19 Abs. 3 UmwG als bekanntgemacht gilt, ihren Anspruch nach Grund und Höhe schriftlich anmelden, Sicherheit zu leisten, soweit sie nicht Befriedigung verlangen können. Dieses Recht steht ihnen jedoch nur zu, wenn sie glaubhaft machen, daß durch die Verschmelzung die Erfüllung ihrer Forderung gefährdet wird."
    },
    {
      "date": "2026-02-11",
      "id": "144896",
      "original_text": "Löschungsankündigung\nThüringen Amtsgericht Jena HRB 512145\nWeber UG (haftungsbeschränkt) – Pößneck",
      "type": "Löschungsankündigung",
      "state": "Thüringen",
      "amtsgericht": "Amtsgericht Jena",
      "registernummer": "HRB 512145",
      "registerart": "HRB",
      "company_name": "Weber UG (haftungsbeschränkt)",
      "company_seat": "Pößneck",
      "details": "11.02.2026 (Bekanntmachungsdatum)\n\nThüringen Amtsgericht Jena HRB 512145\nLöschungsankündigung\n\nWeber UG (haftungsbeschränkt)\nGesellschaft mit beschränkter Haftung\nPößneck\n\nDas Registergericht beabsichtigt, die im Handelsregister eingetragene Gesellschaft wegen Vermögenslosigkeit nach § 394 FamFG von Amts wegen zu löschen. Die Frist zur Erhebung eines Widerspruchs gegen die beabsichtigte Löschung wird auf 6 Wochen festgesetzt."
    },
    {
      "date": "2026-02-11",
      "id": "144897",
      "original_text": "Registerbekanntmachung nach dem Umwandlungsgesetz\nHessen Amtsgericht Frankfurt am Main HRB 110364\nAACCLAIM GmbH – Frankfurt am Main",
      "type": "Registerbekanntmachung nach dem Umwandlungsgesetz",
      "state": "Hessen",
      "amtsgericht": "Amtsgericht Frankfurt am Main",
      "registernummer": "HRB 110364",
      "registerart": "HRB",
      "company_name": "AACCLAIM GmbH",
      "company_seat": "Frankfurt am Main",
      "details": "11.02.2026 (Bekanntmachungsdatum)\n\nHessen Amtsgericht Frankfurt am Main HRB 110364\nRegisterbekanntmachung nach dem Umwandlungsgesetz 11.02.2026 (Eintragungsdatum)\n\nAACCLAIM GmbH\nGesellschaft mit beschränkter Haftung\nFrankfurt am Main\n\nDen Gläubigern der an der Verschmelzung beteiligten Rechtsträger ist, wenn sie binnen sechs Monaten nach dem Tag, an dem die Eintragung der Verschmelzung in das Register des Sitzes desjenigen Rechtsträgers, dessen Gläubiger sie sind, nach § 19 Absatz 3 UmwG bekannt gemacht worden ist, ihren Anspruch nach Grund und Höhe schriftlich anmelden, Sicherheit zu leisten, soweit sie nicht Befriedigung verlangen können. Dieses Recht steht den Gläubigern jedoch nur zu, wenn sie glaubhaft machen, dass durch die Verschmelzung die Erfüllung ihrer Forderung gefährdet wird."
    },
    {
      "date": "2026-02-11",
      "id": "144898",
      "original_text": "Registerbekanntmachung nach dem Umwandlungsgesetz\nHessen Amtsgericht Frankfurt am Main HRB 110364\nAACCLAIM GmbH – Frankfurt am Main",
      "type": "Registerbekanntmachung nach dem Umwandlungsgesetz",
      "state": "Hessen",
      "amtsgericht": "Amtsgericht Frankfurt am Main",
      "registernummer": "HRB 110364",
      "registerart": "HRB",
      "company_name": "AACCLAIM GmbH",
      "company_seat": "Frankfurt am Main",
      "details": "11.02.2026 (Bekanntmachungsdatum)\n\nHessen Amtsgericht Frankfurt am Main HRB 110364\nRegisterbekanntmachung nach dem Umwandlungsgesetz 11.02.2026 (Eintragungsdatum)\n\nAACCLAIM GmbH\nGesellschaft mit beschränkter Haftung\nFrankfurt am Main\n\nDen Gläubigern der an der Verschmelzung beteiligten Rechtsträger ist, wenn sie binnen sechs Monaten nach dem Tag, an dem die Eintragung der Verschmelzung in das Register des Sitzes desjenigen Rechtsträgers, dessen Gläubiger sie sind, nach § 19 Absatz 3 UmwG bekannt gemacht worden ist, ihren Anspruch nach Grund und Höhe schriftlich anmelden, Sicherheit zu leisten, soweit sie nicht Befriedigung verlangen können. Dieses Recht steht den Gläubigern jedoch nur zu, wenn sie glaubhaft machen, dass durch die Verschmelzung die Erfüllung ihrer Forderung gefährdet wird."
    },
    {
      "date": "2026-02-11",
      "id": "144899",
      "original_text": "Löschungsankündigung\nHessen Amtsgericht Offenbach am Main HRB 50270\nTITAN Testzentrum One UG (haftungsbeschränkt) – Hainburg",
      "type": "Löschungsankündigung",
      "state": "Hessen",
      "amtsgericht": "Amtsgericht Offenbach am Main",
      "registernummer": "HRB 50270",
      "registerart": "HRB",
      "company_name": "TITAN Testzentrum One UG (haftungsbeschränkt)",
      "company_seat": "Hainburg",
      "details": "11.02.2026 (Bekanntmachungsdatum)\n\nHessen Amtsgericht Offenbach am Main HRB 50270\nLöschungsankündigung\n\nTITAN Testzentrum One UG (haftungsbeschränkt)\nGesellschaft mit beschränkter Haftung\nHainburg\n\nDas Registergericht beabsichtigt die im Handelsregister eingetragene Gesellschaft von Amts wegen nach § 394 FamFG zu löschen. Die Frist zur Erhebung eines Widerspruchs gegen die beabsichtigte Löschung wird auf 3 Monate festgesetzt."
    },
    {
      "date": "2026-02-11",
      "id": "144900",
      "original_text": "Einreichung neuer Dokumente\nHessen Amtsgericht Frankfurt am Main HRB 50879\nDB InfraGO Aktiengesellschaft – Frankfurt am Main",
      "type": "Einreichung neuer Dokumente",
      "state": "Hessen",
      "amtsgericht": "Amtsgericht Frankfurt am Main",
      "registernummer": "HRB 50879",
      "registerart": "HRB",
      "company_name": "DB InfraGO Aktiengesellschaft",
      "company_seat": "Frankfurt am Main",
      "details": "11.02.2026 (Bekanntmachungsdatum)\n\nHessen Amtsgericht Frankfurt am Main HRB 50879\nEinreichung neuer Dokumente 11.02.2026 (Eintragungsdatum)\n\nDB InfraGO Aktiengesellschaft\nAktiengesellschaft\nFrankfurt am Main\n\nDurch eine Änderung in den Personen der Aufsichtsratsmitglieder ist eine Liste der Mitglieder des Aufsichtsrates zum Handelsregister eingereicht worden."
    },
    {
      "date": "2026-02-11",
      "id": "144901",
      "original_text": "Löschungsankündigung\nHessen Amtsgericht Offenbach am Main HRB 55484\nGart GmbH – Offenbach am Main",
      "type": "Löschungsankündigung",
      "state": "Hessen",
      "amtsgericht": "Amtsgericht Offenbach am Main",
      "registernummer": "HRB 55484",
      "registerart": "HRB",
      "company_name": "Gart GmbH",
      "company_seat": "Offenbach am Main",
      "details": "11.02.2026 (Bekanntmachungsdatum)\n\nHessen Amtsgericht Offenbach am Main HRB 55484\nLöschungsankündigung\n\nGart GmbH\nGesellschaft mit beschränkter Haftung\nOffenbach am Main\n\nDas Registergericht beabsichtigt die im Handelsregister eingetragene Gesellschaft von Amts wegen nach § 394 FamFG zu löschen. Die Frist zur Erhebung eines Widerspruchs gegen die beabsichtigte Löschung wird auf 3 Monate festgesetzt."
    },
    {
      "date": "2026-02-11",
      "id": "144902",
      "original_text": "Löschungsankündigung\nHessen Amtsgericht Hanau HRB 99112\nMahsara GmbH – Maintal",
      "type": "Löschungsankündigung",
      "state": "Hessen",
      "amtsgericht": "Amtsgericht Hanau",
      "registernummer": "HRB 99112",
      "registerart": "HRB",
      "company_name": "Mahsara GmbH",
      "company_seat": "Maintal",
      "details": "11.02.2026 (Bekanntmachungsdatum)\n\nHessen Amtsgericht Hanau HRB 99112\nLöschungsankündigung\n\nMahsara GmbH\nGesellschaft mit beschränkter Haftung\nMaintal\n\nDas Registergericht beabsichtigt die im Handelsregister eingetragene Gesellschaft von Amts wegen nach § 394 FamFG zu löschen. Die Frist zur Erhebung eines Widerspruchs gegen die beabsichtigte Löschung wird auf 3 Monate festgesetzt."
    },
    {
      "date": "2026-02-11",
      "id": "144903",
      "original_text": "Einreichung neuer Dokumente\nHessen Amtsgericht Frankfurt am Main HRB 57679\nBRANICKS Group AG – Frankfurt am Main",
      "type": "Einreichung neuer Dokumente",
      "state": "Hessen",
      "amtsgericht": "Amtsgericht Frankfurt am Main",
      "registernummer": "HRB 57679",
      "registerart": "HRB",
      "company_name": "BRANICKS Group AG",
      "company_seat": "Frankfurt am Main",
      "details": "11.02.2026 (Bekanntmachungsdatum)\n\nHessen Amtsgericht Frankfurt am Main HRB 57679\nEinreichung neuer Dokumente 11.02.2026 (Eintragungsdatum)\n\nBRANICKS Group AG\nAktiengesellschaft\nFrankfurt am Main\n\nDurch eine Änderung in den Personen der Aufsichtsratsmitglieder ist eine Liste der Mitglieder des Aufsichtsrates zum Handelsregister eingereicht worden."
    },
    {
      "date": "2026-02-11",
      "id": "144904",
      "original_text": "Registerbekanntmachung nach dem Umwandlungsgesetz\nHessen Amtsgericht Frankfurt am Main HRB 98646\nArchitectural Research und Design GmbH – Frankfurt am Main",
      "type": "Registerbekanntmachung nach dem Umwandlungsgesetz",
      "state": "Hessen",
      "amtsgericht": "Amtsgericht Frankfurt am Main",
      "registernummer": "HRB 98646",
      "registerart": "HRB",
      "company_name": "Architectural Research und Design GmbH",
      "company_seat": "Frankfurt am Main",
      "details": "11.02.2026 (Bekanntmachungsdatum)\n\nHessen Amtsgericht Frankfurt am Main HRB 98646\nRegisterbekanntmachung nach dem Umwandlungsgesetz 11.02.2026 (Eintragungsdatum)\n\nArchitectural Research und Design GmbH\nGesellschaft mit beschränkter Haftung\nFrankfurt am Main\n\nDen Gläubigern der an der Verschmelzung beteiligten Rechtsträger ist, wenn sie binnen sechs Monaten nach dem Tag, an dem die Eintragung der Verschmelzung in das Register des Sitzes desjenigen Rechtsträgers, dessen Gläubiger sie sind, nach § 19 Absatz 3 UmwG bekannt gemacht worden ist, ihren Anspruch nach Grund und Höhe schriftlich anmelden, Sicherheit zu leisten, soweit sie nicht Befriedigung verlangen können. Dieses Recht steht den Gläubigern jedoch nur zu, wenn sie glaubhaft machen, dass durch die Verschmelzung die Erfüllung ihrer Forderung gefährdet wird."
    },
    {
      "date": "2026-02-11",
      "id": "144905",
      "original_text": "Einreichung neuer Dokumente\nHessen Amtsgericht Bad Homburg v.d.H. HRB 12623\nOptinova Investmentaktiengesellschaft mit Teilgesellschaftsvermögen – Oberursel (Taunus)",
      "type": "Einreichung neuer Dokumente",
      "state": "Hessen",
      "amtsgericht": "Amtsgericht Bad Homburg v.d.H.",
      "registernummer": "HRB 12623",
      "registerart": "HRB",
      "company_name": "Optinova Investmentaktiengesellschaft mit Teilgesellschaftsvermögen",
      "company_seat": "Oberursel (Taunus)",
      "details": "11.02.2026 (Bekanntmachungsdatum)\n\nHessen Amtsgericht Bad Homburg v.d.H. HRB 12623\nEinreichung neuer Dokumente\n\nOptinova Investmentaktiengesellschaft mit Teilgesellschaftsvermögen\nAktiengesellschaft\nOberursel (Taunus)\n\nDurch eine Änderung in den Personen der Aufsichtsratsmitglieder ist eine Liste der Mitglieder des Aufsichtsrates zum Handelsregister eingereicht worden."
    },
    {
      "date": "2026-02-11",
      "id": "144906",
      "original_text": "Sonstige Registerbekanntmachung\nHessen Amtsgericht Darmstadt VR 2623\nFreunde und Förderer des Abendgymnasiums Darmstadt e.V. – Darmstadt",
      "type": "Sonstige Registerbekanntmachung",
      "state": "Hessen",
      "amtsgericht": "Amtsgericht Darmstadt",
      "registernummer": "VR 2623",
      "registerart": "VR",
      "company_name": "Freunde und Förderer des Abendgymnasiums Darmstadt e.V.",
      "company_seat": "Darmstadt",
      "details": "11.02.2026 (Bekanntmachungsdatum)\n\nHessen Amtsgericht Darmstadt VR 2623\nSonstige Registerbekanntmachung 11.02.2026 (Eintragungsdatum)\n\nFreunde und Förderer des Abendgymnasiums Darmstadt e.V.\neingetragener Verein\nDarmstadt\n\nDer Verein ist aufgelöst."
    },
    {
      "date": "2026-02-11",
      "id": "144907",
      "original_text": "Löschungsankündigung\nHessen Amtsgericht Bad Hersfeld HRA 1096\nBiber-Neon GmbH & Co. Lichtwerbung KG – Bebra",
      "type": "Löschungsankündigung",
      "state": "Hessen",
      "amtsgericht": "Amtsgericht Bad Hersfeld",
      "registernummer": "HRA 1096",
      "registerart": "HRA",
      "company_name": "Biber-Neon GmbH & Co. Lichtwerbung KG",
      "company_seat": "Bebra",
      "details": "11.02.2026 (Bekanntmachungsdatum)\n\nHessen Amtsgericht Bad Hersfeld HRA 1096\nLöschungsankündigung\n\nBiber-Neon GmbH & Co. Lichtwerbung KG\nKommanditgesellschaft\nBebra\n\nDas Registergericht beabsichtigt die im Handelsregister eingetragene Firma von Amts wegen nach § 394 FamFG zu löschen. Die Frist zur Erhebung eines Widerspruchs gegen die beabsichtigte Löschung wird auf 6 Wochen festgesetzt."
    },
    {
      "date": "2026-02-11",
      "id": "144908",
      "original_text": "Löschungsankündigung\nHessen Amtsgericht Hanau HRB 3876\nGalaxy Jeans und Sportswear Gesellschaft mit beschränkter Haftung – Hanau",
      "type": "Löschungsankündigung",
      "state": "Hessen",
      "amtsgericht": "Amtsgericht Hanau",
      "registernummer": "HRB 3876",
      "registerart": "HRB",
      "company_name": "Galaxy Jeans und Sportswear Gesellschaft mit beschränkter Haftung",
      "company_seat": "Hanau",
      "details": "11.02.2026 (Bekanntmachungsdatum)\n\nHessen Amtsgericht Hanau HRB 3876\nLöschungsankündigung\n\nGalaxy Jeans und Sportswear Gesellschaft mit beschränkter Haftung\nGesellschaft mit beschränkter Haftung\nHanau\n\nDas Registergericht beabsichtigt die im Handelsregister eingetragene Gesellschaft von Amts wegen nach § 394 FamFG zu löschen. Die Frist zur Erhebung eines Widerspruchs gegen die beabsichtigte Löschung wird auf 3 Monate festgesetzt."
    },
    {
      "date": "2026-02-11",
      "id": "144909",
      "original_text": "Löschungsankündigung\nHessen Amtsgericht Bad Hersfeld HRB 1311\nBiber-Neon Verwaltungs GmbH – Bebra",
      "type": "Löschungsankündigung",
      "state": "Hessen",
      "amtsgericht": "Amtsgericht Bad Hersfeld",
      "registernummer": "HRB 1311",
      "registerart": "HRB",
      "company_name": "Biber-Neon Verwaltungs GmbH",
      "company_seat": "Bebra",
      "details": "11.02.2026 (Bekanntmachungsdatum)\n\nHessen Amtsgericht Bad Hersfeld HRB 1311\nLöschungsankündigung\n\nBiber-Neon Verwaltungs GmbH\nGesellschaft mit beschränkter Haftung\nBebra\n\nDas Registergericht beabsichtigt die im Handelsregister eingetragene Gesellschaft von Amts wegen nach § 394 FamFG zu löschen. Die Frist zur Erhebung eines Widerspruchs gegen die beabsichtigte Löschung wird auf 6 Wochen festgesetzt."
    },
    {
      "date": "2026-02-11",
      "id": "144910",
      "original_text": "Löschungsankündigung\nHessen Amtsgericht Frankfurt am Main HRA 46883\nHabona Deutsche Einzelhandelsimmobilien Fonds 03 GmbH & Co. KG – Eschborn",
      "type": "Löschungsankündigung",
      "state": "Hessen",
      "amtsgericht": "Amtsgericht Frankfurt am Main",
      "registernummer": "HRA 46883",
      "registerart": "HRA",
      "company_name": "Habona Deutsche Einzelhandelsimmobilien Fonds 03 GmbH & Co. KG",
      "company_seat": "Eschborn",
      "details": "11.02.2026 (Bekanntmachungsdatum)\n\nHessen Amtsgericht Frankfurt am Main HRA 46883\nLöschungsankündigung\n\nHabona Deutsche Einzelhandelsimmobilien Fonds 03 GmbH & Co. KG\nKommanditgesellschaft\nEschborn\n\nEs ist beabsichtigt, die Gesellschaft wegen Vermögenslosigkeit gemäß § 394 FamFG von Amts wegen im Handelsregister zu löschen. Hiergegen kann innerhalb eines Monats nach dieser Veröffentlichung Widerspruch bei dem Amtsgericht Frankfurt am Main eingelegt werden."
    },
    {
      "date": "2026-02-11",
      "id": "144911",
      "original_text": "Registerbekanntmachung nach dem Umwandlungsgesetz\nHessen Amtsgericht Frankfurt am Main HRB 111402\nSoma House GmbH – Frankfurt am Main",
      "type": "Registerbekanntmachung nach dem Umwandlungsgesetz",
      "state": "Hessen",
      "amtsgericht": "Amtsgericht Frankfurt am Main",
      "registernummer": "HRB 111402",
      "registerart": "HRB",
      "company_name": "Soma House GmbH",
      "company_seat": "Frankfurt am Main",
      "details": "11.02.2026 (Bekanntmachungsdatum)\n\nHessen Amtsgericht Frankfurt am Main HRB 111402\nRegisterbekanntmachung nach dem Umwandlungsgesetz 11.02.2026 (Eintragungsdatum)\n\nSoma House GmbH\nGesellschaft mit beschränkter Haftung\nFrankfurt am Main\n\nDen Gläubigern der an der Verschmelzung beteiligten Rechtsträger ist, wenn sie binnen sechs Monaten nach dem Tag, an dem die Eintragung der Verschmelzung in das Register des Sitzes desjenigen Rechtsträgers, dessen Gläubiger sie sind, nach § 19 Absatz 3 UmwG bekannt gemacht worden ist, ihren Anspruch nach Grund und Höhe schriftlich anmelden, Sicherheit zu leisten, soweit sie nicht Befriedigung verlangen können. Dieses Recht steht den Gläubigern jedoch nur zu, wenn sie glaubhaft machen, dass durch die Verschmelzung die Erfüllung ihrer Forderung gefährdet wird."
    },
    {
      "date": "2026-02-11",
      "id": "144912",
      "original_text": "Löschungsankündigung\nHessen Amtsgericht Offenbach am Main HRB 48901\nARKADASCH UG (haftungsbeschränkt) – Offenbach am Main",
      "type": "Löschungsankündigung",
      "state": "Hessen",
      "amtsgericht": "Amtsgericht Offenbach am Main",
      "registernummer": "HRB 48901",
      "registerart": "HRB",
      "company_name": "ARKADASCH UG (haftungsbeschränkt)",
      "company_seat": "Offenbach am Main",
      "details": "11.02.2026 (Bekanntmachungsdatum)\n\nHessen Amtsgericht Offenbach am Main HRB 48901\nLöschungsankündigung\n\nARKADASCH UG (haftungsbeschränkt)\nGesellschaft mit beschränkter Haftung\nOffenbach am Main\n\nDas Registergericht beabsichtigt die im Handelsregister eingetragene Gesellschaft von Amts wegen nach § 394 FamFG zu löschen. Die Frist zur Erhebung eines Widerspruchs gegen die beabsichtigte Löschung wird auf 3 Monate festgesetzt."
    },
    {
      "date": "2026-02-11",
      "id": "98",
      "original_text": "Sonderregisterbekanntmachung OHNE Bezug zum elektr. Register\nBerlin Amtsgericht Berlin (Charlottenburg)\n99 AR 5027/24 B (Altgericht: Amtsgericht Berlin-Mitte/HRB 4609\nDeutsche Eisengießerei und Maschinenfabrik GmbH",
      "type": "Sonderregisterbekanntmachung OHNE Bezug zum elektr. Register",
      "state": "Berlin",
      "amtsgericht": "Amtsgericht Berlin (Charlottenburg)",
      "company_name": "Deutsche Eisengießerei und Maschinenfabrik GmbH",
      "sonderegister_referenz": "99 AR 5027/24 B (Altgericht: Amtsgericht Berlin-Mitte/HRB 4609",
      "details": "11.02.2026 (Bekanntmachungsdatum)\n\nBerlin Amtsgericht Berlin (Charlottenburg)\n99 AR 5027/24 B (Altgericht: Amtsgericht Berlin-Mitte/HRB 4609\nSonderregisterbekanntmachung OHNE Bezug zum elektr. Register\n\nDeutsche Eisengießerei und Maschinenfabrik GmbH\n\nIn dem unternehmensrechtlichen Verfahren der\n\nDeutsche Eisengießerei und Maschinenfabrik GmbH, 99 AR 5027/24 (ehemals HRB 4609)\n\nliegt dem Registergericht aktuell ein Antrag vom 04.11.2025 mit Ergänzung vom 01.12.2025 des Notariatsverwalters Dr. Felix Ritter, Kurfürstendamm 74, 10709 Berlin, mit folgendem Inhalt vor:\n\n„[…] zu der oben genannten Gesellschaft gibt es zwei Eintragungen in den Grundbüchern des Amtsgerichts Neukölln von Britz Blatt 9383 und 1272 in Abt. II lfd. Nr. 6 (Blatt 1272) bzw. Nr. 1 (Blatt 9383).\nDiese Belastungen sollen gelöscht werden. Insoweit wurde ich beauftragt. Da die Gesellschaft bereits gelöscht wurde (Nach Aussage des Grundbuchamtes bereits 1931) müsste eine Nachtragsliquidation angestoßen werden, damit die entsprechende Löschungsbewilligung erteilt werden kann.\nIch bitte daher darum, diese einzuleiten. Die Grundbuchauszüge sind beigefügt.\n\n„[…] Als Aufgabenkreis schlägt der Unterzeichner vor: Wahrnehmung der Rechte und Pflichten der gelöschten Gesellschaft hinsichtlich der Löschung der in den Grundbüchern des Amtsgerichts Neukölln von Britz Blätter 1272 und 9383 zu Gunsten der Gesellschaft eingetragenen Rechte.“\n\nDas Registergericht beabsichtigt zum jetzigen Zeitpunkt, diesem Antrag stattzugeben, soweit nicht binnen einer Frist von einem Monat ab Veröffentlichung Widerspruch erhoben wird.\nEin Widerspruch ist entsprechend schriftlich oder elektronisch bei dem Amtsgericht Charlottenburg, DG Hardenbergstraße 31, 10623 Berlin, zum o.g. Aktenzeichen einzureichen. Der Widerspruch ist zu begründen, da eine Berücksichtigung im Verfahren andernfalls nicht erfolgen kann."
    }
  ]
}