{
  "date": "2026-02-13",
  "date_of_scrape": "2026-02-14T04:36:44.218Z",
  "tool_version": "0.2.0",
  "number_of_announcements": 84,
  "announcements": [
    {
      "date": "2026-02-13",
      "id": "145061",
      "original_text": "Einreichung neuer Dokumente\nBayern Amtsgericht Nürnberg HRB 31601\nSchultheiß Projektentwicklung AG – Nürnberg",
      "type": "Einreichung neuer Dokumente",
      "state": "Bayern",
      "amtsgericht": "Amtsgericht Nürnberg",
      "registernummer": "HRB 31601",
      "registerart": "HRB",
      "company_name": "Schultheiß Projektentwicklung AG",
      "company_seat": "Nürnberg",
      "details": "13.02.2026 (Bekanntmachungsdatum)\n\nBayern Amtsgericht Nürnberg HRB 31601\nEinreichung neuer Dokumente 12.02.2026 (Eintragungsdatum)\n\nSchultheiß Projektentwicklung AG\nAktiengesellschaft\nNürnberg\n\nDem Amtsgericht Nürnberg -Registergericht- ist eine Liste der Mitglieder des Aufsichtsrats eingereicht worden, § 106 AktG."
    },
    {
      "date": "2026-02-13",
      "id": "145062",
      "original_text": "Einreichung neuer Dokumente\nBayern Amtsgericht Augsburg HRB 18823\nUPM-Kymmene Beteiligungs GmbH – Augsburg",
      "type": "Einreichung neuer Dokumente",
      "state": "Bayern",
      "amtsgericht": "Amtsgericht Augsburg",
      "registernummer": "HRB 18823",
      "registerart": "HRB",
      "company_name": "UPM-Kymmene Beteiligungs GmbH",
      "company_seat": "Augsburg",
      "details": "13.02.2026 (Bekanntmachungsdatum)\n\nBayern Amtsgericht Augsburg HRB 18823\nEinreichung neuer Dokumente 12.12.2026 (Eintragungsdatum)\n\nUPM-Kymmene Beteiligungs GmbH\nGesellschaft mit beschränkter Haftung\nAugsburg\n\nDem Amtsgericht Augsburg -Registergericht- ist eine Liste der Mitglieder des Aufsichtsrats eingereicht worden, § 52 Abs. 3 S. 2 GmbHG."
    },
    {
      "date": "2026-02-13",
      "id": "145063",
      "original_text": "Löschungsankündigung\nBayern Amtsgericht Coburg HRB 3155\nBeate Lang Marketing & Design GmbH – Niederfüllbach",
      "type": "Löschungsankündigung",
      "state": "Bayern",
      "amtsgericht": "Amtsgericht Coburg",
      "registernummer": "HRB 3155",
      "registerart": "HRB",
      "company_name": "Beate Lang Marketing & Design GmbH",
      "company_seat": "Niederfüllbach",
      "details": "13.02.2026 (Bekanntmachungsdatum)\n\nBayern Amtsgericht Coburg HRB 3155\nLöschungsankündigung\n\nBeate Lang Marketing & Design GmbH\nGesellschaft mit beschränkter Haftung\nNiederfüllbach\n\nDas Registergericht beabsichtigt, die im Handelsregister eingetragene Gesellschaft wegen Vermögenslosigkeit von Amts wegen nach § 394 FamFG zu löschen. Die Frist zur Erhebung eines Widerspruchs ist auf sechs Wochen festgesetzt."
    },
    {
      "date": "2026-02-13",
      "id": "145064",
      "original_text": "Registerbekanntmachung nach dem Umwandlungsgesetz\nBayern Amtsgericht München HRB 121723\nacura Steuerberatungsgesellschaft mbH – Dorfen",
      "type": "Registerbekanntmachung nach dem Umwandlungsgesetz",
      "state": "Bayern",
      "amtsgericht": "Amtsgericht München",
      "registernummer": "HRB 121723",
      "registerart": "HRB",
      "company_name": "acura Steuerberatungsgesellschaft mbH",
      "company_seat": "Dorfen",
      "details": "13.02.2026 (Bekanntmachungsdatum)\n\nBayern Amtsgericht München HRB 121723\nRegisterbekanntmachung nach dem Umwandlungsgesetz 12.02.2026 (Eintragungsdatum)\n\nacura Steuerberatungsgesellschaft mbH\nGesellschaft mit beschränkter Haftung\nDorfen\n\nDen Gläubigern der an der Verschmelzung beteiligten Rechtsträger ist, wenn sie binnen sechs Monaten nach dem Tag, an dem die Eintragung der Verschmelzung in das Register des Sitzes desjenigen Rechtsträgers, dessen Gläubiger sie sind, nach § 19 Abs. 3 UmwG als bekannt gemacht gilt, ihren Anspruch nach Grund und Höhe in Textform anmelden, Sicherheit zu leisten, soweit sie nicht Befriedigung verlangen können. Dieses Recht steht den Gläubigern jedoch nur zu, wenn sie glaubhaft machen, dass durch die Verschmelzung die Erfüllung ihrer Forderung gefährdet wird."
    },
    {
      "date": "2026-02-13",
      "id": "145065",
      "original_text": "Registerbekanntmachung nach dem Umwandlungsgesetz\nBayern Amtsgericht Augsburg HRA 21697\nHörgeräte Schmitz e.K. – Welden",
      "type": "Registerbekanntmachung nach dem Umwandlungsgesetz",
      "state": "Bayern",
      "amtsgericht": "Amtsgericht Augsburg",
      "registernummer": "HRA 21697",
      "registerart": "HRA",
      "company_name": "Hörgeräte Schmitz e.K.",
      "company_seat": "Welden",
      "details": "13.02.2026 (Bekanntmachungsdatum)\n\nBayern Amtsgericht Augsburg HRA 21697\nRegisterbekanntmachung nach dem Umwandlungsgesetz 12.02.2026 (Eintragungsdatum)\n\nHörgeräte Schmitz e.K.\nEinzelkaufmann / Einzelkauffrau\nWelden\n\nDen Gläubigern der an der Ausgliederung beteiligten Rechtsträger ist, wenn sie binnen sechs Monaten nach dem Tag, an dem die Eintragung der Ausgliederung in das Register des Sitzes desjenigen Rechtsträgers, dessen Gläubiger sie sind, nach §§ 125, 19 Abs. 3 UmwG als bekannt gemacht gilt, ihren Anspruch nach Grund und Höhe in Textform anmelden, Sicherheit zu leisten, soweit sie nicht Befriedigung verlangen können. Dieses Recht steht den Gläubigern jedoch nur zu, wenn sie glaubhaft machen, dass durch die Ausgliederung die Erfüllung ihrer Forderung gefährdet wird."
    },
    {
      "date": "2026-02-13",
      "id": "145066",
      "original_text": "Registerbekanntmachung nach dem Umwandlungsgesetz\nBayern Amtsgericht Augsburg HRB 40206\nKini Hören GmbH – Friedberg",
      "type": "Registerbekanntmachung nach dem Umwandlungsgesetz",
      "state": "Bayern",
      "amtsgericht": "Amtsgericht Augsburg",
      "registernummer": "HRB 40206",
      "registerart": "HRB",
      "company_name": "Kini Hören GmbH",
      "company_seat": "Friedberg",
      "details": "13.02.2026 (Bekanntmachungsdatum)\n\nBayern Amtsgericht Augsburg HRB 40206\nRegisterbekanntmachung nach dem Umwandlungsgesetz 12.02.2026 (Eintragungsdatum)\n\nKini Hören GmbH\nGesellschaft mit beschränkter Haftung\nFriedberg\n\nDen Gläubigern der an der Ausgliederung beteiligten Rechtsträger ist, wenn sie binnen sechs Monaten nach dem Tag, an dem die Eintragung der Ausgliederung in das Register des Sitzes desjenigen Rechtsträgers, dessen Gläubiger sie sind, nach §§ 125, 19 Abs. 3 UmwG als bekannt gemacht gilt, ihren Anspruch nach Grund und Höhe in Textform anmelden, Sicherheit zu leisten, soweit sie nicht Befriedigung verlangen können. Dieses Recht steht den Gläubigern jedoch nur zu, wenn sie glaubhaft machen, dass durch die Ausgliederung die Erfüllung ihrer Forderung gefährdet wird."
    },
    {
      "date": "2026-02-13",
      "id": "145067",
      "original_text": "Registerbekanntmachung nach dem Umwandlungsgesetz\nBayern Amtsgericht Hof HRB 7281\nVölkel Biogasanlage GmbH – Schauenstein",
      "type": "Registerbekanntmachung nach dem Umwandlungsgesetz",
      "state": "Bayern",
      "amtsgericht": "Amtsgericht Hof",
      "registernummer": "HRB 7281",
      "registerart": "HRB",
      "company_name": "Völkel Biogasanlage GmbH",
      "company_seat": "Schauenstein",
      "details": "13.02.2026 (Bekanntmachungsdatum)\n\nBayern Amtsgericht Hof HRB 7281\nRegisterbekanntmachung nach dem Umwandlungsgesetz 12.02.2026 (Eintragungsdatum)\n\nVölkel Biogasanlage GmbH\nGesellschaft mit beschränkter Haftung\nSchauenstein\n\nDen Gläubigern der an der Ausgliederung beteiligten Rechtsträger ist, wenn sie binnen sechs Monaten nach dem Tag, an dem die Eintragung der Ausgliederung in das Register des Sitzes desjenigen Rechtsträgers, dessen Gläubiger sie sind, nach §§ 125, 19 Abs. 3 UmwG als bekannt gemacht gilt, ihren Anspruch nach Grund und Höhe in Textform anmelden, Sicherheit zu leisten, soweit sie nicht Befriedigung verlangen können. Dieses Recht steht den Gläubigern jedoch nur zu, wenn sie glaubhaft machen, dass durch die Ausgliederung die Erfüllung ihrer Forderung gefährdet wird."
    },
    {
      "date": "2026-02-13",
      "id": "145068",
      "original_text": "Registerbekanntmachung nach dem Umwandlungsgesetz\nBayern Amtsgericht Bamberg HRA 9491\nGünther Vermögens- und Beteiligungs GmbH & Co. KG – Bamberg",
      "type": "Registerbekanntmachung nach dem Umwandlungsgesetz",
      "state": "Bayern",
      "amtsgericht": "Amtsgericht Bamberg",
      "registernummer": "HRA 9491",
      "registerart": "HRA",
      "company_name": "Günther Vermögens- und Beteiligungs GmbH & Co. KG",
      "company_seat": "Bamberg",
      "details": "13.02.2026 (Bekanntmachungsdatum)\n\nBayern Amtsgericht Bamberg HRA 9491\nRegisterbekanntmachung nach dem Umwandlungsgesetz 12.02.2026 (Eintragungsdatum)\n\nGünther Vermögens- und Beteiligungs GmbH & Co. KG\nKommanditgesellschaft\nBamberg\n\nDen Gläubigern der an der Verschmelzung beteiligten Rechtsträger ist, wenn sie binnen sechs Monaten nach dem Tag, an dem die Eintragung der Verschmelzung in das Register des Sitzes desjenigen Rechtsträgers, dessen Gläubiger sie sind, nach § 19 Abs. 3 UmwG als bekannt gemacht gilt, ihren Anspruch nach Grund und Höhe in Textform anmelden, Sicherheit zu leisten, soweit sie nicht Befriedigung verlangen können. Dieses Recht steht den Gläubigern jedoch nur zu, wenn sie glaubhaft machen, dass durch die Verschmelzung die Erfüllung ihrer Forderung gefährdet wird."
    },
    {
      "date": "2026-02-13",
      "id": "145069",
      "original_text": "Registerbekanntmachung nach dem Umwandlungsgesetz\nBayern Amtsgericht Augsburg HRA 21696\nKini Hören Michael Schmitz e.K., Inh. Michael Schmitz – Friedberg",
      "type": "Registerbekanntmachung nach dem Umwandlungsgesetz",
      "state": "Bayern",
      "amtsgericht": "Amtsgericht Augsburg",
      "registernummer": "HRA 21696",
      "registerart": "HRA",
      "company_name": "Kini Hören Michael Schmitz e.K., Inh. Michael Schmitz",
      "company_seat": "Friedberg",
      "details": "13.02.2026 (Bekanntmachungsdatum)\n\nBayern Amtsgericht Augsburg HRA 21696\nRegisterbekanntmachung nach dem Umwandlungsgesetz 12.02.2026 (Eintragungsdatum)\n\nKini Hören Michael Schmitz e.K., Inh. Michael Schmitz\nEinzelkaufmann / Einzelkauffrau\nFriedberg\n\nDen Gläubigern der an der Ausgliederung beteiligten Rechtsträger ist, wenn sie binnen sechs Monaten nach dem Tag, an dem die Eintragung der Ausgliederung in das Register des Sitzes desjenigen Rechtsträgers, dessen Gläubiger sie sind, nach §§ 125, 19 Abs. 3 UmwG als bekannt gemacht gilt, ihren Anspruch nach Grund und Höhe in Textform anmelden, Sicherheit zu leisten, soweit sie nicht Befriedigung verlangen können. Dieses Recht steht den Gläubigern jedoch nur zu, wenn sie glaubhaft machen, dass durch die Ausgliederung die Erfüllung ihrer Forderung gefährdet wird."
    },
    {
      "date": "2026-02-13",
      "id": "145070",
      "original_text": "Registerbekanntmachung nach dem Umwandlungsgesetz\nBayern Amtsgericht Hof HRA 4998\nSebastian Völkel - Biogasanlage e.K. – Schauenstein",
      "type": "Registerbekanntmachung nach dem Umwandlungsgesetz",
      "state": "Bayern",
      "amtsgericht": "Amtsgericht Hof",
      "registernummer": "HRA 4998",
      "registerart": "HRA",
      "company_name": "Sebastian Völkel - Biogasanlage e.K.",
      "company_seat": "Schauenstein",
      "details": "13.02.2026 (Bekanntmachungsdatum)\n\nBayern Amtsgericht Hof HRA 4998\nRegisterbekanntmachung nach dem Umwandlungsgesetz 12.02.2026 (Eintragungsdatum)\n\nSebastian Völkel - Biogasanlage e.K.\nEinzelkaufmann / Einzelkauffrau\nSchauenstein\n\nDen Gläubigern der an der Ausgliederung beteiligten Rechtsträger ist, wenn sie binnen sechs Monaten nach dem Tag, an dem die Eintragung der Ausgliederung in das Register des Sitzes desjenigen Rechtsträgers, dessen Gläubiger sie sind, nach §§ 125, 19 Abs. 3 UmwG als bekannt gemacht gilt, ihren Anspruch nach Grund und Höhe in Textform anmelden, Sicherheit zu leisten, soweit sie nicht Befriedigung verlangen können. Dieses Recht steht den Gläubigern jedoch nur zu, wenn sie glaubhaft machen, dass durch die Ausgliederung die Erfüllung ihrer Forderung gefährdet wird."
    },
    {
      "date": "2026-02-13",
      "id": "145071",
      "original_text": "Sonstige Registerbekanntmachung\nBayern Amtsgericht Augsburg HRB 33719\nA-DIGITAL one GmbH – Augsburg",
      "type": "Sonstige Registerbekanntmachung",
      "state": "Bayern",
      "amtsgericht": "Amtsgericht Augsburg",
      "registernummer": "HRB 33719",
      "registerart": "HRB",
      "company_name": "A-DIGITAL one GmbH",
      "company_seat": "Augsburg",
      "details": "13.02.2026 (Bekanntmachungsdatum)\n\nBayern Amtsgericht Augsburg HRB 33719\nSonstige Registerbekanntmachung 12.02.2026 (Eintragungsdatum)\n\nA-DIGITAL one GmbH\nGesellschaft mit beschränkter Haftung\nAugsburg\n\nDen Gläubigern der Gesellschaft, deren Forderungen begründet worden sind, bevor die Eintragung der Beendigung des Beherrschungs- und Gewinnabführungsvertrages in das Handelsregister nach § 10 des Handelsgesetzbuches als bekanntgemacht gilt, hat der andere Vertragsteil Sicherheit zu leisten, wenn sie sich binnen sechs Monaten nach der Bekanntmachung der Eintragung zu diesem Zweck bei ihm melden."
    },
    {
      "date": "2026-02-13",
      "id": "145072",
      "original_text": "Registerbekanntmachung nach dem Umwandlungsgesetz\nBayern Amtsgericht München HRB 296098\nWATZL Construction GmbH – Grünwald",
      "type": "Registerbekanntmachung nach dem Umwandlungsgesetz",
      "state": "Bayern",
      "amtsgericht": "Amtsgericht München",
      "registernummer": "HRB 296098",
      "registerart": "HRB",
      "company_name": "WATZL Construction GmbH",
      "company_seat": "Grünwald",
      "details": "13.02.2026 (Bekanntmachungsdatum)\n\nBayern Amtsgericht München HRB 296098\nRegisterbekanntmachung nach dem Umwandlungsgesetz 12.02.2026 (Eintragungsdatum)\n\nWATZL Construction GmbH\nGesellschaft mit beschränkter Haftung\nGrünwald\n\nDen Gläubigern der an der Verschmelzung beteiligten Rechtsträger ist, wenn sie binnen sechs Monaten nach dem Tag, an dem die Eintragung der Verschmelzung in das Register des Sitzes desjenigen Rechtsträgers, dessen Gläubiger sie sind, nach § 19 Abs. 3 UmwG als bekannt gemacht gilt, ihren Anspruch nach Grund und Höhe in Textform anmelden, Sicherheit zu leisten, soweit sie nicht Befriedigung verlangen können. Dieses Recht steht den Gläubigern jedoch nur zu, wenn sie glaubhaft machen, dass durch die Verschmelzung die Erfüllung ihrer Forderung gefährdet wird."
    },
    {
      "date": "2026-02-13",
      "id": "145073",
      "original_text": "Einreichung neuer Dokumente\nBayern Amtsgericht Kempten (Allgäu) HRB 7247\nSozialstation der Caritas und der Diakonie Oberallgäu gemeinnützige GmbH – Sonthofen",
      "type": "Einreichung neuer Dokumente",
      "state": "Bayern",
      "amtsgericht": "Amtsgericht Kempten (Allgäu)",
      "registernummer": "HRB 7247",
      "registerart": "HRB",
      "company_name": "Sozialstation der Caritas und der Diakonie Oberallgäu gemeinnützige GmbH",
      "company_seat": "Sonthofen",
      "details": "13.02.2026 (Bekanntmachungsdatum)\n\nBayern Amtsgericht Kempten (Allgäu) HRB 7247\nEinreichung neuer Dokumente 12.02.2026 (Eintragungsdatum)\n\nSozialstation der Caritas und der Diakonie Oberallgäu gemeinnützige GmbH\nGesellschaft mit beschränkter Haftung\nSonthofen\n\nDem Amtsgericht Kempten (Allgäu) -Registergericht- ist eine Liste der Mitglieder des Aufsichtsrats eingereicht worden, § 52 Abs. 3 S. 2 GmbHG."
    },
    {
      "date": "2026-02-13",
      "id": "145074",
      "original_text": "Löschungsankündigung\nBaden-Württemberg Amtsgericht Mannheim HRB 722161\nBienen-Center Vertriebs GmbH – Kronau",
      "type": "Löschungsankündigung",
      "state": "Baden-Württemberg",
      "amtsgericht": "Amtsgericht Mannheim",
      "registernummer": "HRB 722161",
      "registerart": "HRB",
      "company_name": "Bienen-Center Vertriebs GmbH",
      "company_seat": "Kronau",
      "details": "13.02.2026 (Bekanntmachungsdatum)\n\nBaden-Württemberg Amtsgericht Mannheim HRB 722161\nLöschungsankündigung\n\nBienen-Center Vertriebs GmbH\nGesellschaft mit beschränkter Haftung\nKronau\n\nAls nicht eingetragen wird bekanntgemacht:\nDas Gericht beabsichtigt, die Gesellschaft wegen Vermögenslosigkeit im Handelsregister von Amts wegen nach § 394 FamFG zu löschen. Die Frist zur Geltendmachung eines Widerspruchs gegen die beabsichtigte Löschung ist auf einen Monat ab Veröffentlichung bestimmt."
    },
    {
      "date": "2026-02-13",
      "id": "145075",
      "original_text": "Einreichung neuer Dokumente\nSaarland Amtsgericht Saarbrücken HRB 23304\nStadtwerke Dillingen/Saar GmbH – Dillingen",
      "type": "Einreichung neuer Dokumente",
      "state": "Saarland",
      "amtsgericht": "Amtsgericht Saarbrücken",
      "registernummer": "HRB 23304",
      "registerart": "HRB",
      "company_name": "Stadtwerke Dillingen/Saar GmbH",
      "company_seat": "Dillingen",
      "details": "13.02.2026 (Bekanntmachungsdatum)\n\nSaarland Amtsgericht Saarbrücken HRB 23304\nEinreichung neuer Dokumente\n\nStadtwerke Dillingen/Saar GmbH\nGesellschaft mit beschränkter Haftung\nDillingen\n\nDie Geschäftsführung der Gesellschaft hat eine Liste der Mitglieder des Aufsichtsrats zum Handelsregister eingereicht (§ 52 Abs. 3 Satz 2 GmbHG)."
    },
    {
      "date": "2026-02-13",
      "id": "145076",
      "original_text": "Einreichung neuer Dokumente\nSchleswig-Holstein Amtsgericht Kiel HRB 3282 NO\nTECAR INTERNATIONAL TRADE GMBH – Norderstedt",
      "type": "Einreichung neuer Dokumente",
      "state": "Schleswig-Holstein",
      "amtsgericht": "Amtsgericht Kiel",
      "registernummer": "HRB 3282 NO",
      "registerart": "HRB",
      "company_name": "TECAR INTERNATIONAL TRADE GMBH",
      "company_seat": "Norderstedt",
      "details": "13.02.2026 (Bekanntmachungsdatum)\n\nSchleswig-Holstein Amtsgericht Kiel HRB 3282 NO\nEinreichung neuer Dokumente\n\nTECAR INTERNATIONAL TRADE GMBH\nGesellschaft mit beschränkter Haftung\nNorderstedt\n\nAls nicht eingetragen wird veröffentlicht:\nEine neue Liste der Aufsichtsratsmitglieder ist eingereicht worden."
    },
    {
      "date": "2026-02-13",
      "id": "145077",
      "original_text": "Einreichung neuer Dokumente\nBerlin Amtsgericht Berlin (Charlottenburg) HRB 258185\nib vogt Operation Services Niederlande GmbH – Berlin",
      "type": "Einreichung neuer Dokumente",
      "state": "Berlin",
      "amtsgericht": "Amtsgericht Berlin (Charlottenburg)",
      "registernummer": "HRB 258185",
      "registerart": "HRB",
      "company_name": "ib vogt Operation Services Niederlande GmbH",
      "company_seat": "Berlin",
      "details": "13.02.2026 (Bekanntmachungsdatum)\n\nBerlin Amtsgericht Berlin (Charlottenburg) HRB 258185\nEinreichung neuer Dokumente\n\nib vogt Operation Services Niederlande GmbH\nGesellschaft mit beschränkter Haftung\nBerlin\n\nAls nicht eingetragen wird gem. § 10 HGB veröffentlicht: Die Gesellschaft hat den Entwurf eines Verschmelzungsplans zum Handelsregister eingereicht. An der Verschmelzung sind folgende Gesellschaften beteiligt:\nAls übertragende Gesellschaft die ib vogt Operation Services Niederlande GmbH, eine Gesellschaft mit beschränkter Haftung nach deutschem Recht mit dem Sitz in Berlin, Deutschland; als übernehmende Gesellschaft, die Klaer Maintenance Services B.V., eine Gesellschaft mit beschränkter Haftung nach niederländischem Recht mit dem Sitz in Groningen, Niederlande.\nDie übertragende Gesellschaft, die ib vogt Operation Services Niederlande GmbH, ist eingetragen im Handelsregister des Amtsgerichts Charlottenburg unter HRB 258185 B. Die übernehmende Gesellschaft, die Klaer Maintenance Services B.V., ist eingetragen in der Kamer van Koophandel unter der Nummer 91504856.\nEin Verschmelzungsbeschluss der Anteilsinhaber der übertragenden Gesellschaft gemäß § 312 Absatz 2 UmwG in Verbindung mit § 307 Absatz 3 ist nicht erforderlich. Die Beurkundung des Verschmelzungsplans soll am 18. Mai 2026 erfolgen.\nDie Anteilsinhaber und Gläubiger der Klaer Maintenance Services B.V. können spätestens fünf Arbeitstage vor dem Tag der Gesellschafterversammlung Bemerkungen zum Verschmelzungsplan übermitteln. Die Gesellschafterversammlung der Klaer Maintenance Services B.V. wird am 18. Mai 2026 stattfinden. Die Bemerkungen sind postalisch zu übermitteln an die folgende Anschrift: Klaer Maintenance Services B.V., Emmasingel 4, 9726AH Groningen, Niederlande.\nWeder die übertragende noch die übernehmende Gesellschaft verfügt über Arbeitnehmer oder einen Betriebsrat."
    },
    {
      "date": "2026-02-13",
      "id": "145078",
      "original_text": "Sonstige Registerbekanntmachung\nSachsen-Anhalt Amtsgericht Stendal HRB 109790\nOtto von Guericke Immobilien GmbH – Magdeburg",
      "type": "Sonstige Registerbekanntmachung",
      "state": "Sachsen-Anhalt",
      "amtsgericht": "Amtsgericht Stendal",
      "registernummer": "HRB 109790",
      "registerart": "HRB",
      "company_name": "Otto von Guericke Immobilien GmbH",
      "company_seat": "Magdeburg",
      "details": "13.02.2026 (Bekanntmachungsdatum)\n\nSachsen-Anhalt Amtsgericht Stendal HRB 109790\nSonstige Registerbekanntmachung 13.02.2026 (Eintragungsdatum)\n\nOtto von Guericke Immobilien GmbH\nGesellschaft mit beschränkter Haftung\nMagdeburg\n\nNicht eingetragen:\nAls nicht eingetragen wird veröffentlicht: Den Gläubigern der Gesellschaft, deren Forderungen begründet worden sind bevor die Eintragung der Beendigung des #DV.Art(Text=\"Art des Vertrages auswählen\",Eingabe=\"Beherrschungs- und Gewinnabführungsvertrages\",\"Beherrschungsvertrages\",\"Gewinnabführungsvertrages\",\"Teilgewinnabführungsvertrages\")  in das Handelsregister nach § 10 des Handelsgesetzbuches als bekanntgemacht gilt, hat der andere Vertragsteil Sicherheit zu leisten, wenn sie sich binnen sechs Monaten nach der Bekanntmachung der Eintragung zu diesem Zweck bei ihm melden."
    },
    {
      "date": "2026-02-13",
      "id": "145079",
      "original_text": "Registerbekanntmachung nach dem Umwandlungsgesetz\nSachsen-Anhalt Amtsgericht Stendal HRA 8404\nWilhelm Abel e.K. – Bismark (Altmark) OT Schorstedt",
      "type": "Registerbekanntmachung nach dem Umwandlungsgesetz",
      "state": "Sachsen-Anhalt",
      "amtsgericht": "Amtsgericht Stendal",
      "registernummer": "HRA 8404",
      "registerart": "HRA",
      "company_name": "Wilhelm Abel e.K.",
      "company_seat": "Bismark (Altmark) OT Schorstedt",
      "details": "13.02.2026 (Bekanntmachungsdatum)\n\nSachsen-Anhalt Amtsgericht Stendal HRA 8404\nRegisterbekanntmachung nach dem Umwandlungsgesetz 13.02.2026 (Eintragungsdatum)\n\nWilhelm Abel e.K.\nEinzelkaufmann / Einzelkauffrau\nBismark (Altmark) OT Schorstedt\n\nNicht eingetragen:\nDen Gläubigern der an der Ausgliederung beteiligten Rechtsträger, ist wenn sie binnen sechs Monaten nach dem Tag, an dem die Eintragung der Ausgliederung nach §§125, 19 Abs. 3 UmwG als bekanntgemacht gilt, ihren Anspruch nach Grund und Höhe schriftlich anmelden, Sicherheit zu leisten, soweit sie nicht Befriedigung verlangen können. Diese Recht steht ihnen jedoch nur zu, wenn sie glaubhaft machen, dass durch die Ausgliederung die Erfüllung ihrer Forderung gefährdet wird."
    },
    {
      "date": "2026-02-13",
      "id": "145080",
      "original_text": "Registerbekanntmachung nach dem Umwandlungsgesetz\nSachsen-Anhalt Amtsgericht Stendal HRA 8411\nAbel Nutzfahrzeuge OHG – Bismark (Altmark) OT Schorstedt",
      "type": "Registerbekanntmachung nach dem Umwandlungsgesetz",
      "state": "Sachsen-Anhalt",
      "amtsgericht": "Amtsgericht Stendal",
      "registernummer": "HRA 8411",
      "registerart": "HRA",
      "company_name": "Abel Nutzfahrzeuge OHG",
      "company_seat": "Bismark (Altmark) OT Schorstedt",
      "details": "13.02.2026 (Bekanntmachungsdatum)\n\nSachsen-Anhalt Amtsgericht Stendal HRA 8411\nRegisterbekanntmachung nach dem Umwandlungsgesetz 13.02.2026 (Eintragungsdatum)\n\nAbel Nutzfahrzeuge OHG\nOffene Handelsgesellschaft\nBismark (Altmark) OT Schorstedt\n\nNicht eingetragen:\nDen Gläubigern der an der Ausgliederung beteiligten Rechtsträger, ist wenn sie binnen sechs Monaten nach dem Tag, an dem die Eintragung der Ausgliederung nach §§125, 19 Abs. 3 UmwG als bekanntgemacht gilt, ihren Anspruch nach Grund und Höhe schriftlich anmelden, Sicherheit zu leisten, soweit sie nicht Befriedigung verlangen können. Diese Recht steht ihnen jedoch nur zu, wenn sie glaubhaft machen, dass durch die Ausgliederung die Erfüllung ihrer Forderung gefährdet wird."
    },
    {
      "date": "2026-02-13",
      "id": "145081",
      "original_text": "Löschungsankündigung\nMecklenburg-Vorpommern Amtsgericht Rostock HRB 13578\nAlphaLith GmbH – Teterow",
      "type": "Löschungsankündigung",
      "state": "Mecklenburg-Vorpommern",
      "amtsgericht": "Amtsgericht Rostock",
      "registernummer": "HRB 13578",
      "registerart": "HRB",
      "company_name": "AlphaLith GmbH",
      "company_seat": "Teterow",
      "details": "13.02.2026 (Bekanntmachungsdatum)\n\nMecklenburg-Vorpommern Amtsgericht Rostock HRB 13578\nLöschungsankündigung\n\nAlphaLith GmbH\nGesellschaft mit beschränkter Haftung\nTeterow\n\nDas Registergericht beabsichtigt, die im Handelsregister eingetragene Gesellschaft von Amts wegen nach § 394 FamFG zu löschen. Die Frist zur Erhebung eines Widerspruchs gegen die beabsichtigte Löschung wird auf 1 Monat festgesetzt."
    },
    {
      "date": "2026-02-13",
      "id": "145082",
      "original_text": "Registerbekanntmachung nach dem Umwandlungsgesetz\nBaden-Württemberg Amtsgericht Mannheim HRB 432008\nMenz Fertigungs-Service GmbH – Laudenbach",
      "type": "Registerbekanntmachung nach dem Umwandlungsgesetz",
      "state": "Baden-Württemberg",
      "amtsgericht": "Amtsgericht Mannheim",
      "registernummer": "HRB 432008",
      "registerart": "HRB",
      "company_name": "Menz Fertigungs-Service GmbH",
      "company_seat": "Laudenbach",
      "details": "13.02.2026 (Bekanntmachungsdatum)\n\nBaden-Württemberg Amtsgericht Mannheim HRB 432008\nRegisterbekanntmachung nach dem Umwandlungsgesetz 13.02.2026 (Eintragungsdatum)\n\nMenz Fertigungs-Service GmbH\nGesellschaft mit beschränkter Haftung\nLaudenbach\n\nDen Gläubigern der an der Verschmelzung beteiligten Rechtsträger ist, wenn sie binnen sechs Monaten nach dem Tag, an dem die Eintragung der Verschmelzung in das Register des Sitzes desjenigen Rechtsträgers, dessen Gläubiger sie sind, nach § 19 Abs. 3 UmwG als bekanntgemacht gilt, ihren Anspruch nach Grund und Höhe schriftlich anmelden, Sicherheit zu leisten, soweit sie nicht Befriedigung verlangen können. Dieses Recht steht den Gläubigern jedoch nur zu, wenn sie glaubhaft machen, dass durch die Verschmelzung die Erfüllung ihrer Forderung gefährdet wird."
    },
    {
      "date": "2026-02-13",
      "id": "145083",
      "original_text": "Einreichung neuer Dokumente\nBaden-Württemberg Amtsgericht Ulm HRB 748646\nTOX SE – Weingarten",
      "type": "Einreichung neuer Dokumente",
      "state": "Baden-Württemberg",
      "amtsgericht": "Amtsgericht Ulm",
      "registernummer": "HRB 748646",
      "registerart": "HRB",
      "company_name": "TOX SE",
      "company_seat": "Weingarten",
      "details": "13.02.2026 (Bekanntmachungsdatum)\n\nBaden-Württemberg Amtsgericht Ulm HRB 748646\nEinreichung neuer Dokumente\n\nTOX SE\nEuropäische Aktiengesellschaft (SE)\nWeingarten\n\nDie Gesellschaft hat am 12.02.2026 die Liste über die Zusammensetzung des Verwaltungsrats zum Handelsregister eingereicht."
    },
    {
      "date": "2026-02-13",
      "id": "145084",
      "original_text": "Registerbekanntmachung nach dem Umwandlungsgesetz\nNordrhein-Westfalen Amtsgericht Coesfeld HRB 10672\nTB Beratungs GmbH – Bocholt",
      "type": "Registerbekanntmachung nach dem Umwandlungsgesetz",
      "state": "Nordrhein-Westfalen",
      "amtsgericht": "Amtsgericht Coesfeld",
      "registernummer": "HRB 10672",
      "registerart": "HRB",
      "company_name": "TB Beratungs GmbH",
      "company_seat": "Bocholt",
      "details": "13.02.2026 (Bekanntmachungsdatum)\n\nNordrhein-Westfalen Amtsgericht Coesfeld HRB 10672\nRegisterbekanntmachung nach dem Umwandlungsgesetz 13.02.2026 (Eintragungsdatum)\n\nTB Beratungs GmbH\nGesellschaft mit beschränkter Haftung\nBocholt\n\nDen Gläubigern der an der Verschmelzung beteiligten Rechtsträger ist, wenn sie binnen sechs Monaten nach dem Tag, an dem die Eintragung der Verschmelzung in das Register des Sitzes derjenigen Rechtsträger deren Gläubiger sie sind, nach § 19 Absatz 3 UmwG als bekanntgemacht gilt, ihren Anspruch nach Grund und Höhe schriftlich anmelden, Sicherheit zu leisten, soweit sie nicht Befriedigung verlangen können. Dieses Recht steht den Gläubigern jedoch nur zu, wenn sie glaubhaft machen, dass durch die Verschmelzung die Erfüllung ihrer Forderung gefährdet wird. Das Recht, Sicherheitsleistung zu verlangen, steht Gläubigern nicht zu, die im Fall des Insolvenzverfahrens ein Recht auf vorzugsweise Befriedigung aus einer Deckungsmasse haben, die nach gesetzlicher Vorschrift zu ihrem Schutz errichtet und staatlich überwacht ist."
    },
    {
      "date": "2026-02-13",
      "id": "145085",
      "original_text": "Löschungsankündigung\nBaden-Württemberg Amtsgericht Ulm HRB 532285\nHolding Stuttgarter Straße GmbH – Göppingen",
      "type": "Löschungsankündigung",
      "state": "Baden-Württemberg",
      "amtsgericht": "Amtsgericht Ulm",
      "registernummer": "HRB 532285",
      "registerart": "HRB",
      "company_name": "Holding Stuttgarter Straße GmbH",
      "company_seat": "Göppingen",
      "details": "13.02.2026 (Bekanntmachungsdatum)\n\nBaden-Württemberg Amtsgericht Ulm HRB 532285\nLöschungsankündigung\n\nHolding Stuttgarter Straße GmbH\nGesellschaft mit beschränkter Haftung\nGöppingen\n\nAls nicht eingetragen wird bekanntgemacht:\nDas Gericht beabsichtigt, die Gesellschaft wegen Vermögenslosigkeit im Handelsregister von Amts wegen nach § 394 FamFG zu löschen. Die Frist zur Geltendmachung eines Widerspruchs gegen die beabsichtigte Löschung ist auf  einen Monat ab Veröffentlichung bestimmt."
    },
    {
      "date": "2026-02-13",
      "id": "145086",
      "original_text": "Registerbekanntmachung nach dem Umwandlungsgesetz\nMecklenburg-Vorpommern Amtsgericht Schwerin HRB 4752\nSteesower Agrar GmbH – Göhren",
      "type": "Registerbekanntmachung nach dem Umwandlungsgesetz",
      "state": "Mecklenburg-Vorpommern",
      "amtsgericht": "Amtsgericht Schwerin",
      "registernummer": "HRB 4752",
      "registerart": "HRB",
      "company_name": "Steesower Agrar GmbH",
      "company_seat": "Göhren",
      "details": "13.02.2026 (Bekanntmachungsdatum)\n\nMecklenburg-Vorpommern Amtsgericht Schwerin HRB 4752\nRegisterbekanntmachung nach dem Umwandlungsgesetz 13.02.2026 (Eintragungsdatum)\n\nSteesower Agrar GmbH\nGesellschaft mit beschränkter Haftung\nGöhren\n\nDen Gläubigern der an der Verschmelzung beteiligten Gesellschaften ist, wenn sie binnen sechs Monaten nach dem Tag, an dem die Eintragung der Verschmelzungen in das Register des Sitzes desjenigen Rechtsträgers, dessen Gläubiger sie sind, nach § 19 Absatz 3 UmwG als bekanntgemacht gilt, ihren Anspruch nach Grund und Höhe schriftlich anmelden, Sicherheit zu leisten, soweit sie nicht Befriedigung verlangen können. Dieses Recht steht den Gläubigern jedoch nur zu, wenn sie glaubhaft machen, dass durch die Verschmelzung die Erfüllung ihrer Forderung gefährdet wird."
    },
    {
      "date": "2026-02-13",
      "id": "145087",
      "original_text": "Registerbekanntmachung nach dem Umwandlungsgesetz\nBaden-Württemberg Amtsgericht Ulm HRB 746242\nHolzArt Treppen GmbH – Langenburg",
      "type": "Registerbekanntmachung nach dem Umwandlungsgesetz",
      "state": "Baden-Württemberg",
      "amtsgericht": "Amtsgericht Ulm",
      "registernummer": "HRB 746242",
      "registerart": "HRB",
      "company_name": "HolzArt Treppen GmbH",
      "company_seat": "Langenburg",
      "details": "13.02.2026 (Bekanntmachungsdatum)\n\nBaden-Württemberg Amtsgericht Ulm HRB 746242\nRegisterbekanntmachung nach dem Umwandlungsgesetz 13.02.2026 (Eintragungsdatum)\n\nHolzArt Treppen GmbH\nGesellschaft mit beschränkter Haftung\nLangenburg\n\nAls nicht eingetragen wird bekanntgemacht:\nDen Gläubigern der an der Verschmelzung beteiligten Rechtsträger ist, wenn sie binnen sechs Monaten nach dem Tag, an dem die Eintragung der Verschmelzung in das Register des Sitzes desjenigen Rechtsträgers, dessen Gläubiger sie sind, nach § 19 Abs. 3 UmwG als bekanntgemacht gilt, ihren Anspruch nach Grund und Höhe schriftlich anmelden, Sicherheit zu leisten, soweit sie nicht Befriedigung verlangen können. Dieses Recht steht den Gläubigern jedoch nur zu, wenn sie glaubhaft machen, dass durch die Verschmelzung die Erfüllung ihrer Forderung gefährdet wird."
    },
    {
      "date": "2026-02-13",
      "id": "145088",
      "original_text": "Registerbekanntmachung nach dem Umwandlungsgesetz\nSchleswig-Holstein Amtsgericht Kiel HRB 25461\nBRUBAKER NL Immobilien Verwaltungsgesellschaft mbH – Henstedt-Ulzburg",
      "type": "Registerbekanntmachung nach dem Umwandlungsgesetz",
      "state": "Schleswig-Holstein",
      "amtsgericht": "Amtsgericht Kiel",
      "registernummer": "HRB 25461",
      "registerart": "HRB",
      "company_name": "BRUBAKER NL Immobilien Verwaltungsgesellschaft mbH",
      "company_seat": "Henstedt-Ulzburg",
      "details": "13.02.2026 (Bekanntmachungsdatum)\n\nSchleswig-Holstein Amtsgericht Kiel HRB 25461\nRegisterbekanntmachung nach dem Umwandlungsgesetz 12.02.2026 (Eintragungsdatum)\n\nBRUBAKER NL Immobilien Verwaltungsgesellschaft mbH\nGesellschaft mit beschränkter Haftung\nHenstedt-Ulzburg\n\nAls nicht eingetragen wird veröffentlicht: Den Gläubigern ist, wenn sie binnen sechs Monaten nach dem Tag, an dem die Eintragung der Umwandlung bekannt gemacht worden ist, ihren Anspruch nach Grund und Höhe schriftlich anmelden, Sicherheit zu leisten, soweit sie nicht Befriedigung verlangen können. Dieses Recht steht den Gläubigern jedoch nur zu, wenn sie glaubhaft machen, dass durch die Umwandlung die Erfüllung ihrer Forderung gefährdet wird."
    },
    {
      "date": "2026-02-13",
      "id": "145089",
      "original_text": "Registerbekanntmachung nach dem Umwandlungsgesetz\nBaden-Württemberg Amtsgericht Ulm HRA 690453\nDIVACO Holding AG & Co. KG – Langenburg",
      "type": "Registerbekanntmachung nach dem Umwandlungsgesetz",
      "state": "Baden-Württemberg",
      "amtsgericht": "Amtsgericht Ulm",
      "registernummer": "HRA 690453",
      "registerart": "HRA",
      "company_name": "DIVACO Holding AG & Co. KG",
      "company_seat": "Langenburg",
      "details": "13.02.2026 (Bekanntmachungsdatum)\n\nBaden-Württemberg Amtsgericht Ulm HRA 690453\nRegisterbekanntmachung nach dem Umwandlungsgesetz 13.02.2026 (Eintragungsdatum)\n\nDIVACO Holding AG & Co. KG\nKommanditgesellschaft\nLangenburg\n\nAls nicht eingetragen wird bekanntgemacht:\nDen Gläubigern der an der Verschmelzung beteiligten Rechtsträger ist, wenn sie binnen sechs Monaten nach dem Tag, an dem die Eintragung der Verschmelzung in das Register des Sitzes desjenigen Rechtsträgers, dessen Gläubiger sie sind, nach § 19 Abs. 3 UmwG als bekanntgemacht gilt, ihren Anspruch nach Grund und Höhe schriftlich anmelden, Sicherheit zu leisten, soweit sie nicht Befriedigung verlangen können. Dieses Recht steht den Gläubigern jedoch nur zu, wenn sie glaubhaft machen, dass durch die Verschmelzung die Erfüllung ihrer Forderung gefährdet wird."
    },
    {
      "date": "2026-02-13",
      "id": "145090",
      "original_text": "Registerbekanntmachung nach dem Umwandlungsgesetz\nBaden-Württemberg Amtsgericht Ulm GsR 2080\nWindpark Beckum Elker VI Verwaltung eGbR Ellwangen – Ellwangen Jagst",
      "type": "Registerbekanntmachung nach dem Umwandlungsgesetz",
      "state": "Baden-Württemberg",
      "amtsgericht": "Amtsgericht Ulm",
      "registernummer": "GsR 2080",
      "registerart": "GsR",
      "company_name": "Windpark Beckum Elker VI Verwaltung eGbR Ellwangen",
      "company_seat": "Ellwangen Jagst",
      "details": "13.02.2026 (Bekanntmachungsdatum)\n\nBaden-Württemberg Amtsgericht Ulm GsR 2080\nRegisterbekanntmachung nach dem Umwandlungsgesetz 13.02.2026 (Eintragungsdatum)\n\nWindpark Beckum Elker VI Verwaltung eGbR Ellwangen\nGesellschaft bürgerlichen Rechts\nEllwangen Jagst\n\nAls nicht eingetragen wird bekanntgemacht:\nDen Gläubigern des an dem Formwechsel beteiligten Rechtsträgers ist, wenn sie binnen sechs Monaten nach dem Tag, an dem die Eintragung des Formwechsels in das Register des Sitzes desjenigen Rechtsträgers, dessen Gläubiger sie sind, nach § 19 Abs. 3 UmwG als bekanntgemacht gilt, ihren Anspruch nach Grund und Höhe schriftlich anmelden, Sicherheit zu leisten, soweit sie nicht Befriedigung verlangen können. Dieses Recht steht den Gläubigern jedoch nur zu, wenn sie glaubhaft machen, dass durch den Formwechsel die Erfüllung ihrer Forderung gefährdet wird."
    },
    {
      "date": "2026-02-13",
      "id": "145091",
      "original_text": "Registerbekanntmachung nach dem Umwandlungsgesetz\nBaden-Württemberg Amtsgericht Ulm HRB 723954\nWindpark Beckum Elker VI Verwaltung GmbH Ellwangen – Ellwangen Jagst",
      "type": "Registerbekanntmachung nach dem Umwandlungsgesetz",
      "state": "Baden-Württemberg",
      "amtsgericht": "Amtsgericht Ulm",
      "registernummer": "HRB 723954",
      "registerart": "HRB",
      "company_name": "Windpark Beckum Elker VI Verwaltung GmbH Ellwangen",
      "company_seat": "Ellwangen Jagst",
      "details": "13.02.2026 (Bekanntmachungsdatum)\n\nBaden-Württemberg Amtsgericht Ulm HRB 723954\nRegisterbekanntmachung nach dem Umwandlungsgesetz 13.02.2026 (Eintragungsdatum)\n\nWindpark Beckum Elker VI Verwaltung GmbH Ellwangen\nGesellschaft mit beschränkter Haftung\nEllwangen Jagst\n\nAls nicht eingetragen wird bekanntgemacht:\nDen Gläubigern des an dem Formwechsel beteiligten Rechtsträgers ist, wenn sie binnen sechs Monaten nach dem Tag, an dem die Eintragung des Formwechsels in das Register des Sitzes desjenigen Rechtsträgers, dessen Gläubiger sie sind, nach § 19 Abs. 3 UmwG als bekanntgemacht gilt, ihren Anspruch nach Grund und Höhe schriftlich anmelden, Sicherheit zu leisten, soweit sie nicht Befriedigung verlangen können. Dieses Recht steht den Gläubigern jedoch nur zu, wenn sie glaubhaft machen, dass durch den Formwechsel die Erfüllung ihrer Forderung gefährdet wird."
    },
    {
      "date": "2026-02-13",
      "id": "145092",
      "original_text": "Registerbekanntmachung nach dem Umwandlungsgesetz\nBaden-Württemberg Amtsgericht Freiburg HRA 709318\nBrugger H. Elektrotechnik e.K. – Villingen-Schwenningen",
      "type": "Registerbekanntmachung nach dem Umwandlungsgesetz",
      "state": "Baden-Württemberg",
      "amtsgericht": "Amtsgericht Freiburg",
      "registernummer": "HRA 709318",
      "registerart": "HRA",
      "company_name": "Brugger H. Elektrotechnik e.K.",
      "company_seat": "Villingen-Schwenningen",
      "details": "13.02.2026 (Bekanntmachungsdatum)\n\nBaden-Württemberg Amtsgericht Freiburg HRA 709318\nRegisterbekanntmachung nach dem Umwandlungsgesetz 13.02.2026 (Eintragungsdatum)\n\nBrugger H. Elektrotechnik e.K.\nEinzelkaufmann / Einzelkauffrau\nVillingen-Schwenningen\n\nAls nicht eingetragen wird bekanntgemacht:\nDen Gläubigern der an der Ausgliederung beteiligten Rechtsträger ist, wenn sie binnen sechs Monaten nach dem Tag, an dem die Eintragung der Ausgliederung in das Register des Sitzes desjenigen Rechtsträgers, dessen Gläubiger sie sind, nach § 19 Abs. 3 UmwG als bekanntgemacht gilt, ihren Anspruch nach Grund und Höhe schriftlich anmelden, Sicherheit zu leisten, soweit sie nicht Befriedigung verlangen können. Dieses Recht steht den Gläubigern jedoch nur zu, wenn sie glaubhaft machen, dass durch die Ausgliederung die Erfüllung ihrer Forderung gefährdet wird."
    },
    {
      "date": "2026-02-13",
      "id": "145093",
      "original_text": "Sonstige Registerbekanntmachung\nThüringen Amtsgericht Jena HRB 524147\nAvery Dennison Central Europe GmbH – Gotha",
      "type": "Sonstige Registerbekanntmachung",
      "state": "Thüringen",
      "amtsgericht": "Amtsgericht Jena",
      "registernummer": "HRB 524147",
      "registerart": "HRB",
      "company_name": "Avery Dennison Central Europe GmbH",
      "company_seat": "Gotha",
      "details": "13.02.2026 (Bekanntmachungsdatum)\n\nThüringen Amtsgericht Jena HRB 524147\nSonstige Registerbekanntmachung 13.02.2026 (Eintragungsdatum)\n\nAvery Dennison Central Europe GmbH\nGesellschaft mit beschränkter Haftung\nGotha\n\nNicht eingetragen: Den Gläubigern der Gesellschaft, deren Forderungen begründet worden sind, bevor die Eintragung der Beendigung des Vertrages in das Handelsregister nach § 10 des Handelsgesetzbuches als bekanntgemacht gilt, hat der andere Vertragsteil Sicherheit zu leisten, wenn sie sich binnen sechs Monaten nach der Bekanntmachung der Eintragung zu diesem Zweck bei ihm melden."
    },
    {
      "date": "2026-02-13",
      "id": "145094",
      "original_text": "Einreichung neuer Dokumente\nThüringen Amtsgericht Jena HRB 205623\nCarl Zeiss Meditec AG – Jena",
      "type": "Einreichung neuer Dokumente",
      "state": "Thüringen",
      "amtsgericht": "Amtsgericht Jena",
      "registernummer": "HRB 205623",
      "registerart": "HRB",
      "company_name": "Carl Zeiss Meditec AG",
      "company_seat": "Jena",
      "details": "13.02.2026 (Bekanntmachungsdatum)\n\nThüringen Amtsgericht Jena HRB 205623\nEinreichung neuer Dokumente 13.02.2026 (Eintragungsdatum)\n\nCarl Zeiss Meditec AG\nAktiengesellschaft\nJena\n\nBekanntmachung gem. § 106 AktG: Aufgrund einer Veränderung in den Personen der Aufsichtsratsmitglieder ist durch den Vorstand eine neue Liste zum Handelsregister eingereicht worden."
    },
    {
      "date": "2026-02-13",
      "id": "145095",
      "original_text": "Sonstige Registerbekanntmachung\nThüringen Amtsgericht Jena HRB 524021\nContemporary Amperex Technology Thuringia SE – Arnstadt",
      "type": "Sonstige Registerbekanntmachung",
      "state": "Thüringen",
      "amtsgericht": "Amtsgericht Jena",
      "registernummer": "HRB 524021",
      "registerart": "HRB",
      "company_name": "Contemporary Amperex Technology Thuringia SE",
      "company_seat": "Arnstadt",
      "details": "13.02.2026 (Bekanntmachungsdatum)\n\nThüringen Amtsgericht Jena HRB 524021\nSonstige Registerbekanntmachung\n\nContemporary Amperex Technology Thuringia SE\nEuropäische Aktiengesellschaft (SE)\nArnstadt\n\nBekanntmachung gem. § 106 AktG: Aufgrund einer Veränderung in den Personen der Aufsichtsratsmitglieder ist durch den Vorstand eine neue Liste zum Handelsregister eingereicht worden."
    },
    {
      "date": "2026-02-13",
      "id": "145096",
      "original_text": "Sonstige Registerbekanntmachung\nBerlin Amtsgericht Berlin (Charlottenburg) HRB 280064\nDisplaywachstum Deutschland AG – Berlin",
      "type": "Sonstige Registerbekanntmachung",
      "state": "Berlin",
      "amtsgericht": "Amtsgericht Berlin (Charlottenburg)",
      "registernummer": "HRB 280064",
      "registerart": "HRB",
      "company_name": "Displaywachstum Deutschland AG",
      "company_seat": "Berlin",
      "details": "13.02.2026 (Bekanntmachungsdatum)\n\nBerlin Amtsgericht Berlin (Charlottenburg) HRB 280064\nSonstige Registerbekanntmachung\n\nDisplaywachstum Deutschland AG\nAktiengesellschaft\nBerlin\n\nAls nicht eingetragen wird veröffentlicht: Es wurde eine neue Liste der Aufsichtsratsmitglieder eingereicht (§ 106 AktG)."
    },
    {
      "date": "2026-02-13",
      "id": "145097",
      "original_text": "Sonstige Registerbekanntmachung\nBerlin Amtsgericht Berlin (Charlottenburg) HRB 280063\nDisplaywachstum Deutschland Projekt 1 AG – Berlin",
      "type": "Sonstige Registerbekanntmachung",
      "state": "Berlin",
      "amtsgericht": "Amtsgericht Berlin (Charlottenburg)",
      "registernummer": "HRB 280063",
      "registerart": "HRB",
      "company_name": "Displaywachstum Deutschland Projekt 1 AG",
      "company_seat": "Berlin",
      "details": "13.02.2026 (Bekanntmachungsdatum)\n\nBerlin Amtsgericht Berlin (Charlottenburg) HRB 280063\nSonstige Registerbekanntmachung\n\nDisplaywachstum Deutschland Projekt 1 AG\nAktiengesellschaft\nBerlin\n\nAls nicht eingetragen wird veröffentlicht: Es wurde eine neue Liste der Aufsichtsratsmitglieder eingereicht (§ 106 AktG)."
    },
    {
      "date": "2026-02-13",
      "id": "145098",
      "original_text": "Löschungsankündigung\nBerlin Amtsgericht Berlin (Charlottenburg) HRB 243527\nRAPTOR Bau GmbH – Berlin",
      "type": "Löschungsankündigung",
      "state": "Berlin",
      "amtsgericht": "Amtsgericht Berlin (Charlottenburg)",
      "registernummer": "HRB 243527",
      "registerart": "HRB",
      "company_name": "RAPTOR Bau GmbH",
      "company_seat": "Berlin",
      "details": "13.02.2026 (Bekanntmachungsdatum)\n\nBerlin Amtsgericht Berlin (Charlottenburg) HRB 243527\nLöschungsankündigung\n\nRAPTOR Bau GmbH\nGesellschaft mit beschränkter Haftung\nBerlin\n\nBei der nachstehenden Gesellschaft wird das Amtslöschungsverfahren gemäß § 394 FamFG eingeleitet. Widerspruchsfrist 6 Wochen"
    },
    {
      "date": "2026-02-13",
      "id": "145099",
      "original_text": "Sonstige Registerbekanntmachung\nBerlin Amtsgericht Berlin (Charlottenburg) HRB 171527\nSEC Consult Deutschland Unternehmensberatung GmbH – Berlin",
      "type": "Sonstige Registerbekanntmachung",
      "state": "Berlin",
      "amtsgericht": "Amtsgericht Berlin (Charlottenburg)",
      "registernummer": "HRB 171527",
      "registerart": "HRB",
      "company_name": "SEC Consult Deutschland Unternehmensberatung GmbH",
      "company_seat": "Berlin",
      "details": "13.02.2026 (Bekanntmachungsdatum)\n\nBerlin Amtsgericht Berlin (Charlottenburg) HRB 171527\nSonstige Registerbekanntmachung\n\nSEC Consult Deutschland Unternehmensberatung GmbH\nGesellschaft mit beschränkter Haftung\nBerlin\n\nAls nicht eingetragen wird veröffentlicht: Der andere Vertragsteil hat den Gläubigern dieses Rechtsträgers, deren Forderungen begründet worden sind, bevor die Eintragung der Beendigung dieses Vertrages in das Handelsregister nach § 10 des Handelsgesetzbuches als bekannt gemacht gilt, Sicherheit zu leisten, wenn sie sich binnen sechs Monaten nach der Bekanntmachung der Eintragung zu diesem Zweck bei ihm melden. Dieses Recht steht den Gläubigern nicht zu, die im Fall des Insolvenzverfahrens ein Recht auf vorzugsweise Befriedigung aus der Deckungsmasse haben, die nach gesetzlicher Vorschrift zu ihrem Schutz errichtet und staatlich überwacht ist."
    },
    {
      "date": "2026-02-13",
      "id": "145100",
      "original_text": "Einreichung neuer Dokumente\nBerlin Amtsgericht Berlin (Charlottenburg) HRB 184501\nTurbit Systems GmbH – Berlin",
      "type": "Einreichung neuer Dokumente",
      "state": "Berlin",
      "amtsgericht": "Amtsgericht Berlin (Charlottenburg)",
      "registernummer": "HRB 184501",
      "registerart": "HRB",
      "company_name": "Turbit Systems GmbH",
      "company_seat": "Berlin",
      "details": "13.02.2026 (Bekanntmachungsdatum)\n\nBerlin Amtsgericht Berlin (Charlottenburg) HRB 184501\nEinreichung neuer Dokumente\n\nTurbit Systems GmbH\nGesellschaft mit beschränkter Haftung\nBerlin\n\nAls nicht eingetragen wird veröffentlicht: Es wurde eine neue Liste der Beiratsmitglieder eingereicht (§52 GmbHG)."
    },
    {
      "date": "2026-02-13",
      "id": "145101",
      "original_text": "Einreichung neuer Dokumente\nBaden-Württemberg Amtsgericht Stuttgart HRB 22937\nMercedes-Benz Bank AG – Stuttgart",
      "type": "Einreichung neuer Dokumente",
      "state": "Baden-Württemberg",
      "amtsgericht": "Amtsgericht Stuttgart",
      "registernummer": "HRB 22937",
      "registerart": "HRB",
      "company_name": "Mercedes-Benz Bank AG",
      "company_seat": "Stuttgart",
      "details": "13.02.2026 (Bekanntmachungsdatum)\n\nBaden-Württemberg Amtsgericht Stuttgart HRB 22937\nEinreichung neuer Dokumente\n\nMercedes-Benz Bank AG\nAktiengesellschaft\nStuttgart\n\nDie Gesellschaft hat am 11.02.2026 die Liste über die Zusammensetzung des Aufsichtsrats zum Handelsregister eingereicht."
    },
    {
      "date": "2026-02-13",
      "id": "145102",
      "original_text": "Löschungsankündigung\nBaden-Württemberg Amtsgericht Stuttgart HRB 751792\nS & E Global Immobilien GmbH – Zimmern ob Rottweil",
      "type": "Löschungsankündigung",
      "state": "Baden-Württemberg",
      "amtsgericht": "Amtsgericht Stuttgart",
      "registernummer": "HRB 751792",
      "registerart": "HRB",
      "company_name": "S & E Global Immobilien GmbH",
      "company_seat": "Zimmern ob Rottweil",
      "details": "13.02.2026 (Bekanntmachungsdatum)\n\nBaden-Württemberg Amtsgericht Stuttgart HRB 751792\nLöschungsankündigung\n\nS & E Global Immobilien GmbH\nGesellschaft mit beschränkter Haftung\nZimmern ob Rottweil\n\nDas Gericht beabsichtigt, die Gesellschaft wegen Vermögenslosigkeit im Handelsregister von Amts wegen nach § 394 FamFG zu löschen. Die Frist zur Geltendmachung eines Widerspruchs gegen die beabsichtigte Löschung ist auf zwei Monate ab Veröffentlichung bestimmt."
    },
    {
      "date": "2026-02-13",
      "id": "145103",
      "original_text": "Einreichung neuer Dokumente\nSchleswig-Holstein Amtsgericht Pinneberg HRB 8648\nEnbycon Holding AG – Pinneberg",
      "type": "Einreichung neuer Dokumente",
      "state": "Schleswig-Holstein",
      "amtsgericht": "Amtsgericht Pinneberg",
      "registernummer": "HRB 8648",
      "registerart": "HRB",
      "company_name": "Enbycon Holding AG",
      "company_seat": "Pinneberg",
      "details": "13.02.2026 (Bekanntmachungsdatum)\n\nSchleswig-Holstein Amtsgericht Pinneberg HRB 8648\nEinreichung neuer Dokumente\n\nEnbycon Holding AG\nAktiengesellschaft\nPinneberg\n\nAls nicht eingetragen wird veröffentlicht: Es wurde eine neue Liste der Aufsichtsratsmitglieder gem.§ 106 AktG zum Handelsregister eingereicht."
    },
    {
      "date": "2026-02-13",
      "id": "145104",
      "original_text": "Registerbekanntmachung nach dem Umwandlungsgesetz\nBaden-Württemberg Amtsgericht Stuttgart HRB 803364\nparowi Holding GmbH – Fellbach",
      "type": "Registerbekanntmachung nach dem Umwandlungsgesetz",
      "state": "Baden-Württemberg",
      "amtsgericht": "Amtsgericht Stuttgart",
      "registernummer": "HRB 803364",
      "registerart": "HRB",
      "company_name": "parowi Holding GmbH",
      "company_seat": "Fellbach",
      "details": "13.02.2026 (Bekanntmachungsdatum)\n\nBaden-Württemberg Amtsgericht Stuttgart HRB 803364\nRegisterbekanntmachung nach dem Umwandlungsgesetz 13.02.2026 (Eintragungsdatum)\n\nparowi Holding GmbH\nGesellschaft mit beschränkter Haftung\nFellbach\n\nDen Gläubigern der an der Ausgliederung beteiligten Rechtsträger ist, wenn sie binnen sechs Monaten nach dem Tag, an dem die Eintragung der Ausgliederung in das Register des Sitzes desjenigen Rechtsträgers, dessen Gläubiger sie sind, nach § 19 Abs. 3 UmwG als bekanntgemacht gilt, ihren Anspruch nach Grund und Höhe schriftlich anmelden, Sicherheit zu leisten, soweit sie nicht Befriedigung verlangen können. Dieses Recht steht den Gläubigern jedoch nur zu, wenn sie glaubhaft machen, dass durch die Ausgliederung die Erfüllung ihrer Forderung gefährdet wird."
    },
    {
      "date": "2026-02-13",
      "id": "145105",
      "original_text": "Registerbekanntmachung nach dem Umwandlungsgesetz\nBaden-Württemberg Amtsgericht Freiburg HRB 717498\nSoll & Haben GmbH – Rheinau",
      "type": "Registerbekanntmachung nach dem Umwandlungsgesetz",
      "state": "Baden-Württemberg",
      "amtsgericht": "Amtsgericht Freiburg",
      "registernummer": "HRB 717498",
      "registerart": "HRB",
      "company_name": "Soll & Haben GmbH",
      "company_seat": "Rheinau",
      "details": "13.02.2026 (Bekanntmachungsdatum)\n\nBaden-Württemberg Amtsgericht Freiburg HRB 717498\nRegisterbekanntmachung nach dem Umwandlungsgesetz 13.02.2026 (Eintragungsdatum)\n\nSoll & Haben GmbH\nGesellschaft mit beschränkter Haftung\nRheinau\n\nDie Gesellschaft (übertragender Rechtsträger) ist mit der Gesellschaft mit beschränkter Haftung \"Hornung & Reimer DIE Mittelstandsberater GmbH\", Rastatt (Amtsgericht Mannheim HRB 746392) verschmolzen.\nDen Gläubigern der an der Verschmelzung beteiligten Rechtsträger ist, wenn sie binnen sechs Monaten nach dem Tag, an dem die Eintragung der Verschmelzung in das Register des Sitzes desjenigen Rechtsträgers, dessen Gläubiger sie sind, nach § 19 Abs. 3 UmwG als bekanntgemacht gilt, ihren Anspruch nach Grund und Höhe schriftlich anmelden, Sicherheit zu leisten, soweit sie nicht Befriedigung verlangen können. Dieses Recht steht den Gläubigern jedoch nur zu, wenn sie glaubhaft machen, dass durch die Verschmelzung die Erfüllung ihrer Forderung gefährdet wird."
    },
    {
      "date": "2026-02-13",
      "id": "145106",
      "original_text": "Einreichung neuer Dokumente\nSachsen Amtsgericht Chemnitz HRB 20040\nKBE Kommunale Beteiligungsgesellschaft mbH an der envia – Chemnitz",
      "type": "Einreichung neuer Dokumente",
      "state": "Sachsen",
      "amtsgericht": "Amtsgericht Chemnitz",
      "registernummer": "HRB 20040",
      "registerart": "HRB",
      "company_name": "KBE Kommunale Beteiligungsgesellschaft mbH an der envia",
      "company_seat": "Chemnitz",
      "details": "13.02.2026 (Bekanntmachungsdatum)\n\nSachsen Amtsgericht Chemnitz HRB 20040\nEinreichung neuer Dokumente\n\nKBE Kommunale Beteiligungsgesellschaft mbH an der envia\nGesellschaft mit beschränkter Haftung\nChemnitz\n\nAm 12.02.2026 wurde beim Handelsregister des Amtsgerichts Chemnitz die Liste der Mitglieder des Aufsichtsrats gemäß § 52 GmbHG eingereicht."
    },
    {
      "date": "2026-02-13",
      "id": "145107",
      "original_text": "Registerbekanntmachung nach dem Umwandlungsgesetz\nBaden-Württemberg Amtsgericht Freiburg HRB 735002\nZitberg Überdachungen Donaueschingen GmbH – Donaueschingen",
      "type": "Registerbekanntmachung nach dem Umwandlungsgesetz",
      "state": "Baden-Württemberg",
      "amtsgericht": "Amtsgericht Freiburg",
      "registernummer": "HRB 735002",
      "registerart": "HRB",
      "company_name": "Zitberg Überdachungen Donaueschingen GmbH",
      "company_seat": "Donaueschingen",
      "details": "13.02.2026 (Bekanntmachungsdatum)\n\nBaden-Württemberg Amtsgericht Freiburg HRB 735002\nRegisterbekanntmachung nach dem Umwandlungsgesetz 13.02.2026 (Eintragungsdatum)\n\nZitberg Überdachungen Donaueschingen GmbH\nGesellschaft mit beschränkter Haftung\nDonaueschingen\n\nAls nicht eingetragen wird bekanntgemacht:\nDen Gläubigern der an der Abspaltung beteiligten Rechtsträger ist, wenn sie binnen sechs Monaten nach dem Tag, an dem die Eintragung der Abspaltung in das Register des Sitzes desjenigen Rechtsträgers, dessen Gläubiger sie sind, nach § 19 Abs. 3 UmwG als bekanntgemacht gilt, ihren Anspruch nach Grund und Höhe schriftlich anmelden, Sicherheit zu leisten, soweit sie nicht Befriedigung verlangen können. Dieses Recht steht den Gläubigern jedoch nur zu, wenn sie glaubhaft machen, dass durch die Abspaltung die Erfüllung ihrer Forderung gefährdet wird."
    },
    {
      "date": "2026-02-13",
      "id": "145108",
      "original_text": "Registerbekanntmachung nach dem Umwandlungsgesetz\nBaden-Württemberg Amtsgericht Freiburg HRB 715886\nZitberg Überdachungen GmbH – Donaueschingen",
      "type": "Registerbekanntmachung nach dem Umwandlungsgesetz",
      "state": "Baden-Württemberg",
      "amtsgericht": "Amtsgericht Freiburg",
      "registernummer": "HRB 715886",
      "registerart": "HRB",
      "company_name": "Zitberg Überdachungen GmbH",
      "company_seat": "Donaueschingen",
      "details": "13.02.2026 (Bekanntmachungsdatum)\n\nBaden-Württemberg Amtsgericht Freiburg HRB 715886\nRegisterbekanntmachung nach dem Umwandlungsgesetz 13.02.2026 (Eintragungsdatum)\n\nZitberg Überdachungen GmbH\nGesellschaft mit beschränkter Haftung\nDonaueschingen\n\nDiese Gesellschaft hat zwei Teilbetriebe zum Zwecke der Neugründung von Gesellschaften mit beschränkter Haftung abgespalten: den Teilbetrieb Göppingen auf die neugegründete \"Zitberg Überdachungen Göppingen GmbH\", Eislingen (Amtsgericht Ulm, HRB 750414) und den Teilbetrieb Donaueschingen auf die neugegründete \"Zitberg Überdachungen Donaueschingen GmbH\", Donaueschingen (Amtsgericht Freiburg i. Br., HRB 735002) (Abspaltung zur Neugründung). Den Gläubigern der an der Abspaltung beteiligten Rechtsträger ist, wenn sie binnen sechs Monaten nach dem Tag, an dem die Eintragung der Abspaltung in das Register des Sitzes desjenigen Rechtsträgers, dessen Gläubiger sie sind, nach § 19 Abs. 3 UmwG als bekanntgemacht gilt, ihren Anspruch nach Grund und Höhe schriftlich anmelden, Sicherheit zu leisten, soweit sie nicht Befriedigung verlangen können. Dieses Recht steht den Gläubigern jedoch nur zu, wenn sie glaubhaft machen, dass durch die Abspaltung die Erfüllung ihrer Forderung gefährdet wird."
    },
    {
      "date": "2026-02-13",
      "id": "145109",
      "original_text": "Löschungsankündigung\nNiedersachsen Amtsgericht Braunschweig HRB 205630\nBT-Bau GmbH – Seesen",
      "type": "Löschungsankündigung",
      "state": "Niedersachsen",
      "amtsgericht": "Amtsgericht Braunschweig",
      "registernummer": "HRB 205630",
      "registerart": "HRB",
      "company_name": "BT-Bau GmbH",
      "company_seat": "Seesen",
      "details": "13.02.2026 (Bekanntmachungsdatum)\n\nNiedersachsen Amtsgericht Braunschweig HRB 205630\nLöschungsankündigung\n\nBT-Bau GmbH\nGesellschaft mit beschränkter Haftung\nSeesen\n\nDas Registergericht beabsichtigt, die Gesellschaft von Amts wegen nach § 394 FamFG zu löschen. Die Frist zur Erhebung eines Widerspruchs ist auf 1 Monat ab dieser Registerbekanntmachung festgesetzt."
    },
    {
      "date": "2026-02-13",
      "id": "145110",
      "original_text": "Löschungsankündigung\nNiedersachsen Amtsgericht Hildesheim HRB 207008\nAM Bewehrungsarbeiten GmbH – Hildesheim",
      "type": "Löschungsankündigung",
      "state": "Niedersachsen",
      "amtsgericht": "Amtsgericht Hildesheim",
      "registernummer": "HRB 207008",
      "registerart": "HRB",
      "company_name": "AM Bewehrungsarbeiten GmbH",
      "company_seat": "Hildesheim",
      "details": "13.02.2026 (Bekanntmachungsdatum)\n\nNiedersachsen Amtsgericht Hildesheim HRB 207008\nLöschungsankündigung\n\nAM Bewehrungsarbeiten GmbH\nGesellschaft mit beschränkter Haftung\nHildesheim\n\nDas Registergericht beabsichtigt, die Gesellschaft von Amts wegen nach § 394 FamFG zu löschen. Die Frist zur Erhebung eines Widerspruchs ist auf 1 Monat ab dieser Registerbekanntmachung festgesetzt."
    },
    {
      "date": "2026-02-13",
      "id": "145111",
      "original_text": "Löschungsankündigung\nRheinland-Pfalz Amtsgericht Bad Kreuznach HRB 4094\nSchnipp Massivhaus GmbH – Schweppenhausen",
      "type": "Löschungsankündigung",
      "state": "Rheinland-Pfalz",
      "amtsgericht": "Amtsgericht Bad Kreuznach",
      "registernummer": "HRB 4094",
      "registerart": "HRB",
      "company_name": "Schnipp Massivhaus GmbH",
      "company_seat": "Schweppenhausen",
      "details": "13.02.2026 (Bekanntmachungsdatum)\n\nRheinland-Pfalz Amtsgericht Bad Kreuznach HRB 4094\nLöschungsankündigung\n\nSchnipp Massivhaus GmbH\nGesellschaft mit beschränkter Haftung\nSchweppenhausen\n\nDas Registergericht beabsichtigt die Gesellschaft wegen Vermögenslosigkeit im Handelsregister von Amts wegen nach § 394 FamFG zu löschen. Die Frist zur Erhebung eines Widerspruchs gegen die beabsichtigte Löschung ist auf einen Monat ab Veröffentlichung bestimmt."
    },
    {
      "date": "2026-02-13",
      "id": "145112",
      "original_text": "Sonstige Registerbekanntmachung\nBremen Amtsgericht Bremen HRB 3579 BHV\nNORDSEE Holding GmbH – Bremerhaven",
      "type": "Sonstige Registerbekanntmachung",
      "state": "Bremen",
      "amtsgericht": "Amtsgericht Bremen",
      "registernummer": "HRB 3579 BHV",
      "registerart": "HRB",
      "company_name": "NORDSEE Holding GmbH",
      "company_seat": "Bremerhaven",
      "details": "13.02.2026 (Bekanntmachungsdatum)\n\nBremen Amtsgericht Bremen HRB 3579 BHV\nSonstige Registerbekanntmachung\n\nNORDSEE Holding GmbH\nGesellschaft mit beschränkter Haftung\nBremerhaven\n\nAls nicht eingetragen wird veröffentlicht: Gläubigern, deren Forderungen begründet worden sind, bevor die Eintragung des Beschlusses als nach § 10 des Handelsgesetzbuches bekannt gemacht gilt, ist, wenn sie sich binnen sechs Monaten nach der Bekanntmachung zu diesem Zweck melden, Sicherheit zu leisten, soweit sie nicht Befriedigung verlangen können. Dieses Recht steht den Gläubigern nicht zu, die im Fall des Insolvenzverfahrens ein Recht auf vorzugsweise Befriedigung aus der Deckungsmasse haben, die nach gesetzlicher Vorschrift zu ihrem Schutz errichtet und staatlich überwacht ist."
    },
    {
      "date": "2026-02-13",
      "id": "145113",
      "original_text": "Registerbekanntmachung nach dem Umwandlungsgesetz\nNordrhein-Westfalen Amtsgericht Essen HRA 11954\nDui Sushi Essen e.K. – Essen",
      "type": "Registerbekanntmachung nach dem Umwandlungsgesetz",
      "state": "Nordrhein-Westfalen",
      "amtsgericht": "Amtsgericht Essen",
      "registernummer": "HRA 11954",
      "registerart": "HRA",
      "company_name": "Dui Sushi Essen e.K.",
      "company_seat": "Essen",
      "details": "13.02.2026 (Bekanntmachungsdatum)\n\nNordrhein-Westfalen Amtsgericht Essen HRA 11954\nRegisterbekanntmachung nach dem Umwandlungsgesetz 13.02.2026 (Eintragungsdatum)\n\nDui Sushi Essen e.K.\nEinzelkaufmann / Einzelkauffrau\nEssen\n\nDen Gläubigern der an der Ausgliederung beteiligten Rechtsträger ist, wenn sie binnen sechs Monaten nach dem Tag, an dem die Eintragung der Ausgliederung in das Register des Sitzes desjenigen Rechtsträgers, dessen Gläubiger sie sind, nach § 19 Absatz 3 UmwG als bekanntgemacht gilt, ihren Anspruch nach Grund und Höhe schriftlich anmelden, Sicherheit zu leisten, soweit sie nicht Befriedigung verlangen können. Dieses Recht steht den Gläubigern jedoch nur zu, wenn sie glaubhaft machen, dass durch die Ausgliederung die Erfüllung ihrer Forderung gefährdet wird."
    },
    {
      "date": "2026-02-13",
      "id": "145114",
      "original_text": "Löschungsankündigung\nNordrhein-Westfalen Amtsgericht Dortmund HRB 32809\nLUKA GmbH – Dortmund",
      "type": "Löschungsankündigung",
      "state": "Nordrhein-Westfalen",
      "amtsgericht": "Amtsgericht Dortmund",
      "registernummer": "HRB 32809",
      "registerart": "HRB",
      "company_name": "LUKA GmbH",
      "company_seat": "Dortmund",
      "details": "13.02.2026 (Bekanntmachungsdatum)\n\nNordrhein-Westfalen Amtsgericht Dortmund HRB 32809\nLöschungsankündigung\n\nLUKA GmbH\nGesellschaft mit beschränkter Haftung\nDortmund\n\nDas Registergericht beabsichtigt die Gesellschaft von Amts wegen nach § 394 FamFG zu löschen. Die Frist zur Erhebung eines Widerspruchs ist auf zwei Monate festgesetzt."
    },
    {
      "date": "2026-02-13",
      "id": "145115",
      "original_text": "Einreichung neuer Dokumente\nNordrhein-Westfalen Amtsgericht Köln HRB 226\nFlughafen Köln/Bonn Gesellschaft mit beschränkter Haftung – Köln",
      "type": "Einreichung neuer Dokumente",
      "state": "Nordrhein-Westfalen",
      "amtsgericht": "Amtsgericht Köln",
      "registernummer": "HRB 226",
      "registerart": "HRB",
      "company_name": "Flughafen Köln/Bonn Gesellschaft mit beschränkter Haftung",
      "company_seat": "Köln",
      "details": "13.02.2026 (Bekanntmachungsdatum)\n\nNordrhein-Westfalen Amtsgericht Köln HRB 226\nEinreichung neuer Dokumente\n\nFlughafen Köln/Bonn Gesellschaft mit beschränkter Haftung\nGesellschaft mit beschränkter Haftung\nKöln\n\nDem Registergericht ist eine Liste der Mitglieder des Aufsichtsrates eingereicht worden."
    },
    {
      "date": "2026-02-13",
      "id": "145116",
      "original_text": "Einreichung neuer Dokumente\nNordrhein-Westfalen Amtsgericht Düsseldorf HRB 80676\nSPIE Efficient Facilities GmbH – Düsseldorf",
      "type": "Einreichung neuer Dokumente",
      "state": "Nordrhein-Westfalen",
      "amtsgericht": "Amtsgericht Düsseldorf",
      "registernummer": "HRB 80676",
      "registerart": "HRB",
      "company_name": "SPIE Efficient Facilities GmbH",
      "company_seat": "Düsseldorf",
      "details": "13.02.2026 (Bekanntmachungsdatum)\n\nNordrhein-Westfalen Amtsgericht Düsseldorf HRB 80676\nEinreichung neuer Dokumente\n\nSPIE Efficient Facilities GmbH\nGesellschaft mit beschränkter Haftung\nDüsseldorf\n\nDem Registergericht ist eine Liste der Mitglieder des Aufsichtsrates eingereicht worden."
    },
    {
      "date": "2026-02-13",
      "id": "145117",
      "original_text": "Löschungsankündigung\nNordrhein-Westfalen Amtsgericht Mönchengladbach HRB 13714\nMongol Hann GmbH – Hückelhoven",
      "type": "Löschungsankündigung",
      "state": "Nordrhein-Westfalen",
      "amtsgericht": "Amtsgericht Mönchengladbach",
      "registernummer": "HRB 13714",
      "registerart": "HRB",
      "company_name": "Mongol Hann GmbH",
      "company_seat": "Hückelhoven",
      "details": "13.02.2026 (Bekanntmachungsdatum)\n\nNordrhein-Westfalen Amtsgericht Mönchengladbach HRB 13714\nLöschungsankündigung 13.02.2026 (Eintragungsdatum)\n\nMongol Hann GmbH\nGesellschaft mit beschränkter Haftung\nHückelhoven\n\nDas Registergericht beabsichtigt die Gesellschaft von Amts wegen nach § 394 FamFG zu löschen. Die Frist zur Erhebung eines Widerspruchs ist auf zwei Monate festgesetzt."
    },
    {
      "date": "2026-02-13",
      "id": "145118",
      "original_text": "Registerbekanntmachung nach dem Umwandlungsgesetz\nNordrhein-Westfalen Amtsgericht Essen HRB 15950\nLuttermann GmbH – Essen",
      "type": "Registerbekanntmachung nach dem Umwandlungsgesetz",
      "state": "Nordrhein-Westfalen",
      "amtsgericht": "Amtsgericht Essen",
      "registernummer": "HRB 15950",
      "registerart": "HRB",
      "company_name": "Luttermann GmbH",
      "company_seat": "Essen",
      "details": "13.02.2026 (Bekanntmachungsdatum)\n\nNordrhein-Westfalen Amtsgericht Essen HRB 15950\nRegisterbekanntmachung nach dem Umwandlungsgesetz 13.02.2026 (Eintragungsdatum)\n\nLuttermann GmbH\nGesellschaft mit beschränkter Haftung\nEssen\n\nDen Gläubigern der an der Verschmelzung beteiligten Rechtsträger ist, wenn sie binnen sechs Monaten nach dem Tag, an dem die Eintragung der Verschmelzung in das Register des Sitzes desjenigen Rechtsträgers, dessen Gläubiger sie sind, nach § 19 Absatz 3 UmwG als bekanntgemacht gilt, ihren Anspruch nach Grund und Höhe schriftlich anmelden, Sicherheit zu leisten, soweit sie nicht Befriedigung verlangen können. Dieses Recht steht den Gläubigern jedoch nur zu, wenn sie glaubhaft machen, dass durch die Verschmelzung die Erfüllung ihrer Forderung gefährdet wird."
    },
    {
      "date": "2026-02-13",
      "id": "145119",
      "original_text": "Löschungsankündigung\nNordrhein-Westfalen Amtsgericht Dortmund HRB 29428\nInnoreal Immobilien UG (haftungsbeschränkt) – Dortmund",
      "type": "Löschungsankündigung",
      "state": "Nordrhein-Westfalen",
      "amtsgericht": "Amtsgericht Dortmund",
      "registernummer": "HRB 29428",
      "registerart": "HRB",
      "company_name": "Innoreal Immobilien UG (haftungsbeschränkt)",
      "company_seat": "Dortmund",
      "details": "13.02.2026 (Bekanntmachungsdatum)\n\nNordrhein-Westfalen Amtsgericht Dortmund HRB 29428\nLöschungsankündigung 13.02.2026 (Eintragungsdatum)\n\nInnoreal Immobilien UG (haftungsbeschränkt)\nGesellschaft mit beschränkter Haftung\nDortmund\n\nDas Registergericht beabsichtigt die Gesellschaft von Amts wegen nach § 394 FamFG zu löschen. Die Frist zur Erhebung eines Widerspruchs ist auf zwei Monate festgesetzt."
    },
    {
      "date": "2026-02-13",
      "id": "145120",
      "original_text": "Registerbekanntmachung nach dem Umwandlungsgesetz\nNordrhein-Westfalen Amtsgericht Münster HRB 8569\nEffekta Beteiligungs-Aktiengesellschaft – Münster",
      "type": "Registerbekanntmachung nach dem Umwandlungsgesetz",
      "state": "Nordrhein-Westfalen",
      "amtsgericht": "Amtsgericht Münster",
      "registernummer": "HRB 8569",
      "registerart": "HRB",
      "company_name": "Effekta Beteiligungs-Aktiengesellschaft",
      "company_seat": "Münster",
      "details": "13.02.2026 (Bekanntmachungsdatum)\n\nNordrhein-Westfalen Amtsgericht Münster HRB 8569\nRegisterbekanntmachung nach dem Umwandlungsgesetz 13.02.2026 (Eintragungsdatum)\n\nEffekta Beteiligungs-Aktiengesellschaft\nAktiengesellschaft\nMünster\n\nDen Gläubigern der an der formwechselnden Umwandlung beteiligten Rechtsträger ist, wenn sie binnen sechs Monaten nach dem Tag, an dem die Eintragung der formwechselnden Umwandlung in das Register des Sitzes desjenigen Rechtsträgers, dessen Gläubiger sie sind, nach § 19 Absatz 3 UmwG als bekanntgemacht gilt, ihren Anspruch nach Grund und Höhe schriftlich anmelden, Sicherheit zu leisten, soweit sie nicht Befriedigung verlangen können. Dieses Recht steht den Gläubigern jedoch nur zu, wenn sie glaubhaft machen, dass durch die formwechselnden Umwandlung die Erfüllung ihrer Forderung gefährdet wird."
    },
    {
      "date": "2026-02-13",
      "id": "145121",
      "original_text": "Löschungsankündigung\nNordrhein-Westfalen Amtsgericht Düsseldorf HRB 90369\nRolls Royal Donuts GmbH – Düsseldorf",
      "type": "Löschungsankündigung",
      "state": "Nordrhein-Westfalen",
      "amtsgericht": "Amtsgericht Düsseldorf",
      "registernummer": "HRB 90369",
      "registerart": "HRB",
      "company_name": "Rolls Royal Donuts GmbH",
      "company_seat": "Düsseldorf",
      "details": "13.02.2026 (Bekanntmachungsdatum)\n\nNordrhein-Westfalen Amtsgericht Düsseldorf HRB 90369\nLöschungsankündigung\n\nRolls Royal Donuts GmbH\nGesellschaft mit beschränkter Haftung\nDüsseldorf\n\nDas Registergericht beabsichtigt die Gesellschaft von Amts wegen nach § 394 FamFG zu löschen. Die Frist zur Erhebung eines Widerspruchs ist auf 3 Wochen festgesetzt.\n\nRechtsbehelfsbelehrung:\nDas Widerspruchsrecht steht jedem zu, der an der Unterlassung der Löschung ein berechtigtes Interesse hat. Der Widerspruch ist bei dem Amtsgericht Düsseldorf -Registergericht-, Werdener Straße 1, 40227 Düsseldorf schriftlich in deutscher Sprache oder zur Niederschrift der Geschäftsstelle einzulegen. Der Widerspruch kann auch zur Niederschrift der Geschäftsstelle eines jeden Amtsgerichtes abgegeben werden. Die Einlegung ist auch durch Übertragung eines elektronischen Dokuments an die elektronische Poststelle des Gerichts möglich. Das elektronische Dokument muss für die Bearbeitung durch das Gericht geeignet und mit einer qualifizierten elektronischen Signatur der verantwortenden Person versehen sein oder von der verantwortenden Person signiert und auf einem sicheren Übermittlungsweg gemäß § 130a ZPO nach näherer Maßgabe der Verordnung über die technischen Rahmenbedingungen des elektronischen Rechtsverkehrs und über das besondere elektronische Behördenpostfach (BGBl. I, S.3803) eingereicht werden. Weitere Informationen erhalten Sie auf der Internetseite www.justiz.de.\nDer Widerspruch muss spätestens innerhalb der gesetzten Frist nach dem Datum der Bekanntmachung der Löschungsankündigung bei dem Amtsgericht - Registergericht - Düsseldorf eingegangen sein.  Dies gilt auch dann, wenn der Widerspruch zur Niederschrift der Geschäftsstelle eines anderen Amtsgerichtes abgegeben wurde. Die Frist beginnt mit dem Tage der Bekanntmachung der Löschungsankündigung in dem für die Bekanntmachung der Eintragungen in das Handelsregister bestimmten elektronischen Informations- und Kommunikationssystem nach § 10 des Handelsgesetzbuches. Fällt das Ende der Frist auf einen Sonntag, einen allgemeinen Feiertag oder Sonnabend, so endet die Frist mit Ablauf des nächsten Werktages.\nDer Widerspruch muss die Bezeichnung der angefochtenen Löschungsankündigung sowie die Erklärung enthalten, dass Widerspruch gegen diese Löschungsankündigung eingelegt wird. Er ist zu unterzeichnen und soll begründet werden."
    },
    {
      "date": "2026-02-13",
      "id": "145122",
      "original_text": "Löschungsankündigung\nNordrhein-Westfalen Amtsgericht Aachen HRB 19667\nNextSteps GmbH – Aachen",
      "type": "Löschungsankündigung",
      "state": "Nordrhein-Westfalen",
      "amtsgericht": "Amtsgericht Aachen",
      "registernummer": "HRB 19667",
      "registerart": "HRB",
      "company_name": "NextSteps GmbH",
      "company_seat": "Aachen",
      "details": "13.02.2026 (Bekanntmachungsdatum)\n\nNordrhein-Westfalen Amtsgericht Aachen HRB 19667\nLöschungsankündigung\n\nNextSteps GmbH\nGesellschaft mit beschränkter Haftung\nAachen\n\nDas Registergericht beabsichtigt, von Amts wegen die Gesellschaft wegen\nVermögenslosigkeit nach § 394 FamFG zu löschen, nachdem der Geschäftsführer am\n11.12.2025 für die Gesellschaft die Vermögensauskunft abgegeben hat und die\nGesellschaft danach vollständig vermögenslos ist.\n\nZur Geltendmachung des Widerspruchs gegen die beabsichtigte Löschung wird hiermit eine Frist von einem Monat ab Veröffentlichung dieser Ankündigung bestimmt.\n\nRechtsbehelfsbelehrung:\n\nGegen diese Verfügung kann Widerspruch eingelegt werden. Zum Widerspruch ist jeder berechtigt, der an der Unterlassung der Löschung ein berechtigtes Interesse hat.\n\nDer Widerspruch ist bei dem Amtsgericht Aachen, Adalbertsteinweg 92, 52070 Aachen schriftlich in deutscher Sprache oder zur Niederschrift der Geschäftsstelle einzulegen. Der Widerspruch kann auch zur Niederschrift der Geschäftsstelle eines jeden Amtsgerichtes abgegeben werden.\n\nDer Widerspruch muss spätestens innerhalb der gesetzten Frist nach der Bekanntgabe der Verfügung bei dem Amtsgericht Aachen eingegangen sein. Dies gilt auch dann, wenn der Widerspruch zur Niederschrift der Geschäftsstelle eines anderen Amtsgerichtes abgegeben wurde. Die Frist beginnt mit der Bekanntgabe der Verfügung durch Veröffentlichung. Fällt das Ende der Frist auf einen Sonntag, einen allgemeinen Feiertag oder Sonnabend, so endet die Frist mit Ablauf des nächsten Werktages.\n\nDer Widerspruch muss die Bezeichnung der angefochtenen Verfügung sowie die Erklärung enthalten, dass Widerspruch gegen diese Verfügung eingelegt wird. Er ist zu unterzeichnen und soll begründet werden.\n\nDie Einlegung ist auch durch Übertragung eines elektronischen Dokuments an die elektronische Poststelle des Gerichts möglich. Das elektronische Dokument muss für die Bearbeitung durch das Gericht geeignet und mit einer qualifizierten elektronischen Signatur der verantwortenden Person versehen sein oder von der verantwortenden Person signiert und auf einem sicheren Übermittlungsweg gemäß § 130 a ZPO nach näherer Maßgabe der Verordnung über die technischen Rahmenbedingungen des elektronischen Rechtsverkehrs und über das besondere elektronische Behördenpostfach (BGBl. I, S. 3803) eingereicht werden. Weitere Informationen erhalten Sie auf der Internetseite www.justiz.de."
    },
    {
      "date": "2026-02-13",
      "id": "145123",
      "original_text": "Löschungsankündigung\nNordrhein-Westfalen Amtsgericht Bochum HRB 17767\nESA Sanierung GmbH – Herne",
      "type": "Löschungsankündigung",
      "state": "Nordrhein-Westfalen",
      "amtsgericht": "Amtsgericht Bochum",
      "registernummer": "HRB 17767",
      "registerart": "HRB",
      "company_name": "ESA Sanierung GmbH",
      "company_seat": "Herne",
      "details": "13.02.2026 (Bekanntmachungsdatum)\n\nNordrhein-Westfalen Amtsgericht Bochum HRB 17767\nLöschungsankündigung 14.02.2026 (Eintragungsdatum)\n\nESA Sanierung GmbH\nGesellschaft mit beschränkter Haftung\nHerne\n\nDas Registergericht beabsichtigt die Gesellschaft von Amts wegen nach § 394 FamFG zu löschen. Die Frist zur Erhebung eines Widerspruchs ist auf drei Monate festgesetzt."
    },
    {
      "date": "2026-02-13",
      "id": "145124",
      "original_text": "Einreichung neuer Dokumente\nNordrhein-Westfalen Amtsgericht Köln HRB 21298\nAXA Versicherung Aktiengesellschaft – Köln",
      "type": "Einreichung neuer Dokumente",
      "state": "Nordrhein-Westfalen",
      "amtsgericht": "Amtsgericht Köln",
      "registernummer": "HRB 21298",
      "registerart": "HRB",
      "company_name": "AXA Versicherung Aktiengesellschaft",
      "company_seat": "Köln",
      "details": "13.02.2026 (Bekanntmachungsdatum)\n\nNordrhein-Westfalen Amtsgericht Köln HRB 21298\nEinreichung neuer Dokumente 13.02.2026 (Eintragungsdatum)\n\nAXA Versicherung Aktiengesellschaft\nAktiengesellschaft\nKöln\n\nDem Registergericht ist eine neue Liste der Mitglieder des Aufsichtsrates eingereicht worden."
    },
    {
      "date": "2026-02-13",
      "id": "145125",
      "original_text": "Löschungsankündigung\nNordrhein-Westfalen Amtsgericht Aachen HRB 23715\nSpees Straßen- und Tiefbau GmbH – Aachen",
      "type": "Löschungsankündigung",
      "state": "Nordrhein-Westfalen",
      "amtsgericht": "Amtsgericht Aachen",
      "registernummer": "HRB 23715",
      "registerart": "HRB",
      "company_name": "Spees Straßen- und Tiefbau GmbH",
      "company_seat": "Aachen",
      "details": "13.02.2026 (Bekanntmachungsdatum)\n\nNordrhein-Westfalen Amtsgericht Aachen HRB 23715\nLöschungsankündigung 19.01.2026 (Eintragungsdatum)\n\nSpees Straßen- und Tiefbau GmbH\nGesellschaft mit beschränkter Haftung\nAachen\n\nDas Registergericht beabsichtigt, von Amts wegen die Gesellschaft wegen Vermögenslosigkeit nach § 394 FamFG zu löschen, weil das Insolvenzverfahren\nAmtsgericht Aachen (Az.: 92 IN 105/25) beendet und Vermögen der Gesellschaft nicht mehr erkennbar ist.\n\nZur Geltendmachung des Widerspruchs gegen die beabsichtigte Löschung wird hiermit eine Frist von einem Monat ab Veröffentlichung dieser Ankündigung bestimmt.\n\nRechtsbehelfsbelehrung:\n\nGegen diese Verfügung kann Widerspruch eingelegt werden. Zum Widerspruch ist jeder berechtigt, der an der Unterlassung der Löschung ein berechtigtes Interesse hat.\n\nDer Widerspruch ist bei dem Amtsgericht Aachen, Adalbertsteinweg 92, 52070 Aachen schriftlich in deutscher Sprache oder zur Niederschrift der Geschäftsstelle einzulegen. Der Widerspruch kann auch zur Niederschrift der Geschäftsstelle eines jeden Amtsgerichtes abgegeben werden.\n\nDer Widerspruch muss spätestens innerhalb der gesetzten Frist nach der Bekanntgabe der Verfügung bei dem Amtsgericht Aachen eingegangen sein. Dies gilt auch dann, wenn der Widerspruch zur Niederschrift der Geschäftsstelle eines anderen Amtsgerichtes abgegeben wurde. Die Frist beginnt mit der Bekanntgabe der Verfügung durch Veröffentlichung. Fällt das Ende der Frist auf einen Sonntag, einen allgemeinen Feiertag oder Sonnabend, so endet die Frist mit Ablauf des nächsten Werktages.\n\nDer Widerspruch muss die Bezeichnung der angefochtenen Verfügung sowie die Erklärung enthalten, dass Widerspruch gegen diese Verfügung eingelegt wird. Er ist zu unterzeichnen und soll begründet werden.\n\nDie Einlegung ist auch durch Übertragung eines elektronischen Dokuments an die elektronische Poststelle des Gerichts möglich. Das elektronische Dokument muss für die Bearbeitung durch das Gericht geeignet und mit einer qualifizierten elektronischen Signatur der verantwortenden Person versehen sein oder von der verantwortenden Person signiert und auf einem sicheren Übermittlungsweg gemäß § 130 a ZPO nach näherer Maßgabe der Verordnung über die technischen Rahmenbedingungen des elektronischen Rechtsverkehrs und über das besondere elektronische Behördenpostfach (BGBl. I, S. 3803) eingereicht werden. Weitere Informationen erhalten Sie auf der Internetseite www.justiz.de."
    },
    {
      "date": "2026-02-13",
      "id": "145126",
      "original_text": "Löschungsankündigung\nNordrhein-Westfalen Amtsgericht Bonn HRB 21730\nGarmes GmbH – Bonn",
      "type": "Löschungsankündigung",
      "state": "Nordrhein-Westfalen",
      "amtsgericht": "Amtsgericht Bonn",
      "registernummer": "HRB 21730",
      "registerart": "HRB",
      "company_name": "Garmes GmbH",
      "company_seat": "Bonn",
      "details": "13.02.2026 (Bekanntmachungsdatum)\n\nNordrhein-Westfalen Amtsgericht Bonn HRB 21730\nLöschungsankündigung\n\nGarmes GmbH\nGesellschaft mit beschränkter Haftung\nBonn\n\nDas Registergericht beabsichtigt die Gesellschaft von Amts wegen nach § 394 FamFG zu löschen. Die Frist zur Erhebung eines Widerspruchs ist auf einen Monat festgesetzt."
    },
    {
      "date": "2026-02-13",
      "id": "145127",
      "original_text": "Löschungsankündigung\nNordrhein-Westfalen Amtsgericht Köln HRB 107579\nA231 GmbH – Engelskirchen",
      "type": "Löschungsankündigung",
      "state": "Nordrhein-Westfalen",
      "amtsgericht": "Amtsgericht Köln",
      "registernummer": "HRB 107579",
      "registerart": "HRB",
      "company_name": "A231 GmbH",
      "company_seat": "Engelskirchen",
      "details": "13.02.2026 (Bekanntmachungsdatum)\n\nNordrhein-Westfalen Amtsgericht Köln HRB 107579\nLöschungsankündigung\n\nA231 GmbH\nGesellschaft mit beschränkter Haftung\nEngelskirchen\n\nDas Registergericht beabsichtigt die Gesellschaft von Amts wegen nach § 394 FamFG zu löschen. Die Frist zur Erhebung eines Widerspruchs ist auf einen Monat festgesetzt."
    },
    {
      "date": "2026-02-13",
      "id": "145128",
      "original_text": "Registerbekanntmachung nach dem Umwandlungsgesetz\nNordrhein-Westfalen Amtsgericht Siegen GsR 454\nVollgas-Nachfolge eGbR – Netphen",
      "type": "Registerbekanntmachung nach dem Umwandlungsgesetz",
      "state": "Nordrhein-Westfalen",
      "amtsgericht": "Amtsgericht Siegen",
      "registernummer": "GsR 454",
      "registerart": "GsR",
      "company_name": "Vollgas-Nachfolge eGbR",
      "company_seat": "Netphen",
      "details": "13.02.2026 (Bekanntmachungsdatum)\n\nNordrhein-Westfalen Amtsgericht Siegen GsR 454\nRegisterbekanntmachung nach dem Umwandlungsgesetz 13.02.2026 (Eintragungsdatum)\n\nVollgas-Nachfolge eGbR\nGesellschaft bürgerlichen Rechts\nNetphen\n\nDen Gläubigern der an der formwechselnden Umwandlung beteiligten Rechtsträger ist, wenn sie binnen sechs Monaten nach dem Tag, an dem die Eintragung der formwechselnden Umwandlung in das Register des Sitzes desjenigen Rechtsträgers, dessen Gläubiger sie sind, nach § 19 Absatz 3 UmwG als bekanntgemacht gilt, ihren Anspruch nach Grund und Höhe schriftlich anmelden, Sicherheit zu leisten, soweit sie nicht Befriedigung verlangen können. Dieses Recht steht den Gläubigern jedoch nur zu, wenn sie glaubhaft machen, dass durch die formwechselnden Umwandlung die Erfüllung ihrer Forderung gefährdet wird."
    },
    {
      "date": "2026-02-13",
      "id": "145129",
      "original_text": "Einreichung neuer Dokumente\nNordrhein-Westfalen Amtsgericht Iserlohn HRB 3898\nMVG Märkische Verkehrsgesellschaft GmbH – Lüdenscheid",
      "type": "Einreichung neuer Dokumente",
      "state": "Nordrhein-Westfalen",
      "amtsgericht": "Amtsgericht Iserlohn",
      "registernummer": "HRB 3898",
      "registerart": "HRB",
      "company_name": "MVG Märkische Verkehrsgesellschaft GmbH",
      "company_seat": "Lüdenscheid",
      "details": "13.02.2026 (Bekanntmachungsdatum)\n\nNordrhein-Westfalen Amtsgericht Iserlohn HRB 3898\nEinreichung neuer Dokumente\n\nMVG Märkische Verkehrsgesellschaft GmbH\nGesellschaft mit beschränkter Haftung\nLüdenscheid\n\nDem Registergericht ist eine neue Liste der Mitglieder des Aufsichtsrates eingereicht worden."
    },
    {
      "date": "2026-02-13",
      "id": "145130",
      "original_text": "Registerbekanntmachung nach dem Umwandlungsgesetz\nNordrhein-Westfalen Amtsgericht Münster HRB 12850\n42clue GmbH – Münster",
      "type": "Registerbekanntmachung nach dem Umwandlungsgesetz",
      "state": "Nordrhein-Westfalen",
      "amtsgericht": "Amtsgericht Münster",
      "registernummer": "HRB 12850",
      "registerart": "HRB",
      "company_name": "42clue GmbH",
      "company_seat": "Münster",
      "details": "13.02.2026 (Bekanntmachungsdatum)\n\nNordrhein-Westfalen Amtsgericht Münster HRB 12850\nRegisterbekanntmachung nach dem Umwandlungsgesetz 13.02.2026 (Eintragungsdatum)\n\n42clue GmbH\nGesellschaft mit beschränkter Haftung\nMünster\n\nDen Gläubigern der an der Verschmelzung beteiligten Rechtsträger ist, wenn sie binnen sechs Monaten nach dem Tag, an dem die Eintragung der Verschmelzung in das Register des Sitzes desjenigen Rechtsträgers, dessen Gläubiger sie sind, nach § 19 Absatz 3 UmwG als bekanntgemacht gilt, ihren Anspruch nach Grund und Höhe schriftlich anmelden, Sicherheit zu leisten, soweit sie nicht Befriedigung verlangen können. Dieses Recht steht den Gläubigern jedoch nur zu, wenn sie glaubhaft machen, dass durch die Verschmelzung die Erfüllung ihrer Forderung gefährdet wird."
    },
    {
      "date": "2026-02-13",
      "id": "145131",
      "original_text": "Registerbekanntmachung nach dem Umwandlungsgesetz\nNordrhein-Westfalen Amtsgericht Münster HRB 22912\nnicos GmbH – Münster",
      "type": "Registerbekanntmachung nach dem Umwandlungsgesetz",
      "state": "Nordrhein-Westfalen",
      "amtsgericht": "Amtsgericht Münster",
      "registernummer": "HRB 22912",
      "registerart": "HRB",
      "company_name": "nicos GmbH",
      "company_seat": "Münster",
      "details": "13.02.2026 (Bekanntmachungsdatum)\n\nNordrhein-Westfalen Amtsgericht Münster HRB 22912\nRegisterbekanntmachung nach dem Umwandlungsgesetz 13.02.2026 (Eintragungsdatum)\n\nnicos GmbH\nGesellschaft mit beschränkter Haftung\nMünster\n\nDen Gläubigern der an der Verschmelzung beteiligten Rechtsträger ist, wenn sie binnen sechs Monaten nach dem Tag, an dem die Eintragung der Verschmelzung in das Register des Sitzes desjenigen Rechtsträgers, dessen Gläubiger sie sind, nach § 19 Absatz 3 UmwG als bekanntgemacht gilt, ihren Anspruch nach Grund und Höhe schriftlich anmelden, Sicherheit zu leisten, soweit sie nicht Befriedigung verlangen können. Dieses Recht steht den Gläubigern jedoch nur zu, wenn sie glaubhaft machen, dass durch die Verschmelzung die Erfüllung ihrer Forderung gefährdet wird."
    },
    {
      "date": "2026-02-13",
      "id": "145132",
      "original_text": "Registerbekanntmachung nach dem Umwandlungsgesetz\nNordrhein-Westfalen Amtsgericht Bad Oeynhausen HRB 12313\nfaschingsfactory.com GmbH – Espelkamp",
      "type": "Registerbekanntmachung nach dem Umwandlungsgesetz",
      "state": "Nordrhein-Westfalen",
      "amtsgericht": "Amtsgericht Bad Oeynhausen",
      "registernummer": "HRB 12313",
      "registerart": "HRB",
      "company_name": "faschingsfactory.com GmbH",
      "company_seat": "Espelkamp",
      "details": "13.02.2026 (Bekanntmachungsdatum)\n\nNordrhein-Westfalen Amtsgericht Bad Oeynhausen HRB 12313\nRegisterbekanntmachung nach dem Umwandlungsgesetz 13.02.2026 (Eintragungsdatum)\n\nfaschingsfactory.com GmbH\nGesellschaft mit beschränkter Haftung\nEspelkamp\n\nDen Gläubigern der an der Verschmelzung beteiligten Rechtsträger ist, wenn sie binnen sechs Monaten nach dem Tag, an dem die Eintragung der Verschmelzung in das Register des Sitzes desjenigen Rechtsträgers, dessen Gläubiger sie sind, nach § 19 Absatz 3 UmwG als bekanntgemacht gilt, ihren Anspruch nach Grund und Höhe schriftlich anmelden, Sicherheit zu leisten, soweit sie nicht Befriedigung verlangen können. Dieses Recht steht den Gläubigern jedoch nur zu, wenn sie glaubhaft machen, dass durch die Verschmelzung die Erfüllung ihrer Forderung gefährdet wird."
    },
    {
      "date": "2026-02-13",
      "id": "145133",
      "original_text": "Löschungsankündigung\nNordrhein-Westfalen Amtsgericht Mönchengladbach HRA 7954\nYekta GmbH & Co. KG – Mönchengladbach",
      "type": "Löschungsankündigung",
      "state": "Nordrhein-Westfalen",
      "amtsgericht": "Amtsgericht Mönchengladbach",
      "registernummer": "HRA 7954",
      "registerart": "HRA",
      "company_name": "Yekta GmbH & Co. KG",
      "company_seat": "Mönchengladbach",
      "details": "13.02.2026 (Bekanntmachungsdatum)\n\nNordrhein-Westfalen Amtsgericht Mönchengladbach HRA 7954\nLöschungsankündigung 13.02.2026 (Eintragungsdatum)\n\nYekta GmbH & Co. KG\nKommanditgesellschaft\nMönchengladbach\n\nDas Registergericht beabsichtigt die Firma von Amts wegen nach § 394 FamFG zu löschen. Die Frist zur Erhebung eines Widerspruchs ist auf drei Monate festgesetzt."
    },
    {
      "date": "2026-02-13",
      "id": "145134",
      "original_text": "Löschungsankündigung\nNordrhein-Westfalen Amtsgericht Bonn HRB 25381\nNenok & Geti GmbH – Bonn",
      "type": "Löschungsankündigung",
      "state": "Nordrhein-Westfalen",
      "amtsgericht": "Amtsgericht Bonn",
      "registernummer": "HRB 25381",
      "registerart": "HRB",
      "company_name": "Nenok & Geti GmbH",
      "company_seat": "Bonn",
      "details": "13.02.2026 (Bekanntmachungsdatum)\n\nNordrhein-Westfalen Amtsgericht Bonn HRB 25381\nLöschungsankündigung\n\nNenok & Geti GmbH\nGesellschaft mit beschränkter Haftung\nBonn\n\nDas Registergericht beabsichtigt die Gesellschaft von Amts wegen nach § 394 FamFG zu löschen. Die Frist zur Erhebung eines Widerspruchs ist auf einen Monat festgesetzt."
    },
    {
      "date": "2026-02-13",
      "id": "145135",
      "original_text": "Einreichung neuer Dokumente\nNordrhein-Westfalen Amtsgericht Köln HRB 3495\nAmpega Investment GmbH – Köln",
      "type": "Einreichung neuer Dokumente",
      "state": "Nordrhein-Westfalen",
      "amtsgericht": "Amtsgericht Köln",
      "registernummer": "HRB 3495",
      "registerart": "HRB",
      "company_name": "Ampega Investment GmbH",
      "company_seat": "Köln",
      "details": "13.02.2026 (Bekanntmachungsdatum)\n\nNordrhein-Westfalen Amtsgericht Köln HRB 3495\nEinreichung neuer Dokumente 13.02.2026 (Eintragungsdatum)\n\nAmpega Investment GmbH\nGesellschaft mit beschränkter Haftung\nKöln\n\nDem Registergericht ist eine neue Liste der Mitglieder des Aufsichtsrates eingereicht worden."
    },
    {
      "date": "2026-02-13",
      "id": "145136",
      "original_text": "Registerbekanntmachung nach dem Umwandlungsgesetz\nBrandenburg Amtsgericht Potsdam HRB 9935\nBierverlag Bernd Krajewski GmbH – Seddiner See",
      "type": "Registerbekanntmachung nach dem Umwandlungsgesetz",
      "state": "Brandenburg",
      "amtsgericht": "Amtsgericht Potsdam",
      "registernummer": "HRB 9935",
      "registerart": "HRB",
      "company_name": "Bierverlag Bernd Krajewski GmbH",
      "company_seat": "Seddiner See",
      "details": "13.02.2026 (Bekanntmachungsdatum)\n\nBrandenburg Amtsgericht Potsdam HRB 9935\nRegisterbekanntmachung nach dem Umwandlungsgesetz 13.02.2026 (Eintragungsdatum)\n\nBierverlag Bernd Krajewski GmbH\nGesellschaft mit beschränkter Haftung\nSeddiner See\n\nZu Eintragungsnummer 7 vom 13.02.2026 wird als nicht eingetragen veröffentlicht:\nDen Gläubigern der an der Verschmelzung beteiligten Rechtsträger ist, wenn sie binnen sechs Monaten nach dem Tag, an dem die Eintragung der Verschmelzung in das Register des Sitzes desjenigen Rechtsträgers, dessen Gläubiger sie sind, als bekannt gemacht gilt, ihren Anspruch nach Grund und Höhe schriftlich anmelden, Sicherheit zu leisten, soweit sie nicht Befriedigung verlangen können. Dieses Recht steht den Gläubigern jedoch nur zu, wenn sie glaubhaft machen, dass durch die Verschmelzung die Erfüllung ihrer Forderung gefährdet wird."
    },
    {
      "date": "2026-02-13",
      "id": "145137",
      "original_text": "Löschungsankündigung\nThüringen Amtsgericht Jena HRB 515983\nSolution99 GmbH – Serba",
      "type": "Löschungsankündigung",
      "state": "Thüringen",
      "amtsgericht": "Amtsgericht Jena",
      "registernummer": "HRB 515983",
      "registerart": "HRB",
      "company_name": "Solution99 GmbH",
      "company_seat": "Serba",
      "details": "13.02.2026 (Bekanntmachungsdatum)\n\nThüringen Amtsgericht Jena HRB 515983\nLöschungsankündigung\n\nSolution99 GmbH\nGesellschaft mit beschränkter Haftung\nSerba\n\nDas Registergericht beabsichtigt, die im Handelsregister eingetragene Gesellschaft wegen Vermögenslosigkeit nach § 394 FamFG von Amts wegen zu löschen. Die Frist zur Erhebung eines Widerspruchs gegen die beabsichtigte Löschung wird auf 6 Wochen festgesetzt."
    },
    {
      "date": "2026-02-13",
      "id": "145138",
      "original_text": "Löschungsankündigung\nHessen Amtsgericht Frankfurt am Main HRB 108835\nLianLv Deutschland GmbH – Frankfurt am Main",
      "type": "Löschungsankündigung",
      "state": "Hessen",
      "amtsgericht": "Amtsgericht Frankfurt am Main",
      "registernummer": "HRB 108835",
      "registerart": "HRB",
      "company_name": "LianLv Deutschland GmbH",
      "company_seat": "Frankfurt am Main",
      "details": "13.02.2026 (Bekanntmachungsdatum)\n\nHessen Amtsgericht Frankfurt am Main HRB 108835\nLöschungsankündigung\n\nLianLv Deutschland GmbH\nGesellschaft mit beschränkter Haftung\nFrankfurt am Main\n\nDas Registergericht beabsichtigt die im Handelsregister eingetragene Gesellschaft von Amts wegen nach § 394 FamFG zu löschen. Die Frist zur Erhebung eines Widerspruchs gegen die beabsichtigte Löschung wird auf 1 Monat festgesetzt."
    },
    {
      "date": "2026-02-13",
      "id": "145139",
      "original_text": "Einreichung neuer Dokumente\nHessen Amtsgericht Limburg HRB 7005\nMUCH Gruppe Holding KGaA – Limburg",
      "type": "Einreichung neuer Dokumente",
      "state": "Hessen",
      "amtsgericht": "Amtsgericht Limburg",
      "registernummer": "HRB 7005",
      "registerart": "HRB",
      "company_name": "MUCH Gruppe Holding KGaA",
      "company_seat": "Limburg",
      "details": "13.02.2026 (Bekanntmachungsdatum)\n\nHessen Amtsgericht Limburg HRB 7005\nEinreichung neuer Dokumente 13.02.2026 (Eintragungsdatum)\n\nMUCH Gruppe Holding KGaA\nKommanditgesellschaft auf Aktien\nLimburg\n\nDurch eine Änderung in den Personen der Aufsichtsratsmitglieder ist eine Liste der Mitglieder des Aufsichtsrates zum Handelsregister eingereicht worden."
    },
    {
      "date": "2026-02-13",
      "id": "145140",
      "original_text": "Löschungsankündigung\nHessen Amtsgericht Wiesbaden HRB 31018\nNICO Residential GmbH – Wiesbaden",
      "type": "Löschungsankündigung",
      "state": "Hessen",
      "amtsgericht": "Amtsgericht Wiesbaden",
      "registernummer": "HRB 31018",
      "registerart": "HRB",
      "company_name": "NICO Residential GmbH",
      "company_seat": "Wiesbaden",
      "details": "13.02.2026 (Bekanntmachungsdatum)\n\nHessen Amtsgericht Wiesbaden HRB 31018\nLöschungsankündigung\n\nNICO Residential GmbH\nGesellschaft mit beschränkter Haftung\nWiesbaden\n\nDas Registergericht beabsichtigt die im Handelsregister eingetragene Gesellschaft von Amts wegen nach § 394 FamFG zu löschen. Die Frist zur Erhebung eines Widerspruchs gegen die beabsichtigte Löschung wird auf 3 Monate festgesetzt."
    },
    {
      "date": "2026-02-13",
      "id": "145141",
      "original_text": "Sonstige Registerbekanntmachung\nHessen Amtsgericht Wetzlar VR 4718\nFörderverein der Wirtschaftsjunioren Wetzlar e.V. – Wetzlar",
      "type": "Sonstige Registerbekanntmachung",
      "state": "Hessen",
      "amtsgericht": "Amtsgericht Wetzlar",
      "registernummer": "VR 4718",
      "registerart": "VR",
      "company_name": "Förderverein der Wirtschaftsjunioren Wetzlar e.V.",
      "company_seat": "Wetzlar",
      "details": "13.02.2026 (Bekanntmachungsdatum)\n\nHessen Amtsgericht Wetzlar VR 4718\nSonstige Registerbekanntmachung 13.02.2026 (Eintragungsdatum)\n\nFörderverein der Wirtschaftsjunioren Wetzlar e.V.\neingetragener Verein\nWetzlar\n\nDer Verein ist aufgelöst."
    },
    {
      "date": "2026-02-13",
      "id": "145142",
      "original_text": "Löschungsankündigung\nHessen Amtsgericht Hanau HRB 97566\nDanomed UG (haftungsbeschränkt) – Maintal",
      "type": "Löschungsankündigung",
      "state": "Hessen",
      "amtsgericht": "Amtsgericht Hanau",
      "registernummer": "HRB 97566",
      "registerart": "HRB",
      "company_name": "Danomed UG (haftungsbeschränkt)",
      "company_seat": "Maintal",
      "details": "13.02.2026 (Bekanntmachungsdatum)\n\nHessen Amtsgericht Hanau HRB 97566\nLöschungsankündigung\n\nDanomed UG (haftungsbeschränkt)\nGesellschaft mit beschränkter Haftung\nMaintal\n\nDas Registergericht beabsichtigt die im Handelsregister eingetragene Gesellschaft von Amts wegen nach § 394 FamFG zu löschen. Die Frist zur Erhebung eines Widerspruchs gegen die beabsichtigte Löschung wird auf 3 Monate festgesetzt."
    },
    {
      "date": "2026-02-13",
      "id": "145143",
      "original_text": "Sonstige Registerbekanntmachung\nHessen Amtsgericht Wiesbaden VR 2845\nGrand Prix-Verein für Rassekatzen – Wiesbaden",
      "type": "Sonstige Registerbekanntmachung",
      "state": "Hessen",
      "amtsgericht": "Amtsgericht Wiesbaden",
      "registernummer": "VR 2845",
      "registerart": "VR",
      "company_name": "Grand Prix-Verein für Rassekatzen",
      "company_seat": "Wiesbaden",
      "details": "13.02.2026 (Bekanntmachungsdatum)\n\nHessen Amtsgericht Wiesbaden VR 2845\nSonstige Registerbekanntmachung 13.02.2026 (Eintragungsdatum)\n\nGrand Prix-Verein für Rassekatzen\neingetragener Verein\nWiesbaden\n\nDer Verein ist aufgelöst."
    },
    {
      "date": "2026-02-13",
      "id": "145144",
      "original_text": "Sonstige Registerbekanntmachung\nHessen Amtsgericht Kassel VR 4066\nAQUATOPIA – Wolfhagen",
      "type": "Sonstige Registerbekanntmachung",
      "state": "Hessen",
      "amtsgericht": "Amtsgericht Kassel",
      "registernummer": "VR 4066",
      "registerart": "VR",
      "company_name": "AQUATOPIA",
      "company_seat": "Wolfhagen",
      "details": "13.02.2026 (Bekanntmachungsdatum)\n\nHessen Amtsgericht Kassel VR 4066\nSonstige Registerbekanntmachung 13.02.2026 (Eintragungsdatum)\n\nAQUATOPIA\neingetragener Verein\nWolfhagen\n\nDer Verein ist aufgelöst."
    }
  ]
}