{
  "date": "2026-02-18",
  "date_of_scrape": "2026-02-19T04:41:43.796Z",
  "tool_version": "0.2.0",
  "number_of_announcements": 118,
  "announcements": [
    {
      "date": "2026-02-18",
      "id": "145369",
      "original_text": "Registerbekanntmachung nach dem Umwandlungsgesetz\nBayern Amtsgericht Traunstein HRB 18531\nBayerische Vermögen Holding AG Unternehmensberatung, Projektentwicklung und Beteiligungsmanagement Aktiengesellschaft – Ruhpolding",
      "type": "Registerbekanntmachung nach dem Umwandlungsgesetz",
      "state": "Bayern",
      "amtsgericht": "Amtsgericht Traunstein",
      "registernummer": "HRB 18531",
      "registerart": "HRB",
      "company_name": "Bayerische Vermögen Holding AG Unternehmensberatung, Projektentwicklung und Beteiligungsmanagement Aktiengesellschaft",
      "company_seat": "Ruhpolding",
      "details": "18.02.2026 (Bekanntmachungsdatum)\n\nBayern Amtsgericht Traunstein HRB 18531\nRegisterbekanntmachung nach dem Umwandlungsgesetz 17.02.2026 (Eintragungsdatum)\n\nBayerische Vermögen Holding AG Unternehmensberatung, Projektentwicklung und Beteiligungsmanagement Aktiengesellschaft\nAktiengesellschaft\nRuhpolding\n\nDen Gläubigern des formwechselnden Rechtsträgers ist, wenn sie binnen sechs Monaten nach dem Tag, an dem die Eintragung des Formwechsels nach § 201 UmwG als bekannt gemacht gilt, ihren Anspruch nach Grund und Höhe in Textform anmelden, Sicherheit zu leisten, soweit sie nicht Befriedigung verlangen können. Dieses Recht steht den Gläubigern jedoch nur zu, wenn sie glaubhaft machen, dass durch den Formwechsel die Erfüllung ihrer Forderung gefährdet wird."
    },
    {
      "date": "2026-02-18",
      "id": "145370",
      "original_text": "Registerbekanntmachung nach dem Umwandlungsgesetz\nBayern Amtsgericht München HRB 204580\nLHI Kapitalverwaltungsgesellschaft mbH – Pullach i.Isartal",
      "type": "Registerbekanntmachung nach dem Umwandlungsgesetz",
      "state": "Bayern",
      "amtsgericht": "Amtsgericht München",
      "registernummer": "HRB 204580",
      "registerart": "HRB",
      "company_name": "LHI Kapitalverwaltungsgesellschaft mbH",
      "company_seat": "Pullach i.Isartal",
      "details": "18.02.2026 (Bekanntmachungsdatum)\n\nBayern Amtsgericht München HRB 204580\nRegisterbekanntmachung nach dem Umwandlungsgesetz 17.02.2026 (Eintragungsdatum)\n\nLHI Kapitalverwaltungsgesellschaft mbH\nGesellschaft mit beschränkter Haftung\nPullach i.Isartal\n\nDen Gläubigern der an der Verschmelzung beteiligten Rechtsträger ist, wenn sie binnen sechs Monaten nach dem Tag, an dem die Eintragung der Verschmelzung in das Register des Sitzes desjenigen Rechtsträgers, dessen Gläubiger sie sind, nach § 19 Abs. 3 UmwG als bekannt gemacht gilt, ihren Anspruch nach Grund und Höhe in Textform anmelden, Sicherheit zu leisten, soweit sie nicht Befriedigung verlangen können. Dieses Recht steht den Gläubigern jedoch nur zu, wenn sie glaubhaft machen, dass durch die Verschmelzung die Erfüllung ihrer Forderung gefährdet wird."
    },
    {
      "date": "2026-02-18",
      "id": "145371",
      "original_text": "Löschungsankündigung\nBayern Amtsgericht München HRB 222695\nGeorgios GmbH – München",
      "type": "Löschungsankündigung",
      "state": "Bayern",
      "amtsgericht": "Amtsgericht München",
      "registernummer": "HRB 222695",
      "registerart": "HRB",
      "company_name": "Georgios GmbH",
      "company_seat": "München",
      "details": "18.02.2026 (Bekanntmachungsdatum)\n\nBayern Amtsgericht München HRB 222695\nLöschungsankündigung\n\nGeorgios GmbH\nGesellschaft mit beschränkter Haftung\nMünchen\n\nDas Registergericht beabsichtigt, die im Handelsregister eingetragene Gesellschaft wegen Vermögenslosigkeit von Amts wegen nach § 394 FamFG zu löschen. Die Frist zur Erhebung eines Widerspruchs ist auf drei Monate festgesetzt."
    },
    {
      "date": "2026-02-18",
      "id": "145372",
      "original_text": "Löschungsankündigung\nBayern Amtsgericht Traunstein HRB 26214\nBier Vertrieb Logistik GmbH – Burghausen",
      "type": "Löschungsankündigung",
      "state": "Bayern",
      "amtsgericht": "Amtsgericht Traunstein",
      "registernummer": "HRB 26214",
      "registerart": "HRB",
      "company_name": "Bier Vertrieb Logistik GmbH",
      "company_seat": "Burghausen",
      "details": "18.02.2026 (Bekanntmachungsdatum)\n\nBayern Amtsgericht Traunstein HRB 26214\nLöschungsankündigung 17.02.2026 (Eintragungsdatum)\n\nBier Vertrieb Logistik GmbH\nGesellschaft mit beschränkter Haftung\nBurghausen\n\nDas Registergericht beabsichtigt, die im Handelsregister eingetragene Gesellschaft wegen Vermögenslosigkeit von Amts wegen nach § 394 FamFG zu löschen. Die Frist zur Erhebung eines Widerspruchs ist auf einen Monat festgesetzt."
    },
    {
      "date": "2026-02-18",
      "id": "145373",
      "original_text": "Löschungsankündigung\nBayern Amtsgericht Amberg HRB 7540\nA.I. Industry GmbH – Amberg",
      "type": "Löschungsankündigung",
      "state": "Bayern",
      "amtsgericht": "Amtsgericht Amberg",
      "registernummer": "HRB 7540",
      "registerart": "HRB",
      "company_name": "A.I. Industry GmbH",
      "company_seat": "Amberg",
      "details": "18.02.2026 (Bekanntmachungsdatum)\n\nBayern Amtsgericht Amberg HRB 7540\nLöschungsankündigung\n\nA.I. Industry GmbH\nGesellschaft mit beschränkter Haftung\nAmberg\n\nDas Registergericht beabsichtigt, die im Handelsregister eingetragene Gesellschaft wegen Vermögenslosigkeit von Amts wegen nach § 394 FamFG zu löschen. Die Frist zur Erhebung eines Widerspruchs ist auf sechs Wochen festgesetzt."
    },
    {
      "date": "2026-02-18",
      "id": "145374",
      "original_text": "Registerbekanntmachung nach dem Umwandlungsgesetz\nBayern Amtsgericht München HRB 282625\nKWP II Altertheim UG (haftungsbeschränkt) – München",
      "type": "Registerbekanntmachung nach dem Umwandlungsgesetz",
      "state": "Bayern",
      "amtsgericht": "Amtsgericht München",
      "registernummer": "HRB 282625",
      "registerart": "HRB",
      "company_name": "KWP II Altertheim UG (haftungsbeschränkt)",
      "company_seat": "München",
      "details": "18.02.2026 (Bekanntmachungsdatum)\n\nBayern Amtsgericht München HRB 282625\nRegisterbekanntmachung nach dem Umwandlungsgesetz 17.02.2026 (Eintragungsdatum)\n\nKWP II Altertheim UG (haftungsbeschränkt)\nGesellschaft mit beschränkter Haftung\nMünchen\n\nDen Gläubigern der an der Verschmelzung beteiligten Rechtsträger ist, wenn sie binnen sechs Monaten nach dem Tag, an dem die Eintragung der Verschmelzung in das Register des Sitzes desjenigen Rechtsträgers, dessen Gläubiger sie sind, nach § 19 Abs. 3 UmwG als bekannt gemacht gilt, ihren Anspruch nach Grund und Höhe in Textform anmelden, Sicherheit zu leisten, soweit sie nicht Befriedigung verlangen können. Dieses Recht steht den Gläubigern jedoch nur zu, wenn sie glaubhaft machen, dass durch die Verschmelzung die Erfüllung ihrer Forderung gefährdet wird."
    },
    {
      "date": "2026-02-18",
      "id": "145375",
      "original_text": "Registerbekanntmachung nach dem Umwandlungsgesetz\nBayern Amtsgericht Traunstein HRB 34972\nBayerische Vermögen Holding GmbH Unternehmensberatung, Projektentwicklung und Beteiligungsmanagement – Ruhpolding",
      "type": "Registerbekanntmachung nach dem Umwandlungsgesetz",
      "state": "Bayern",
      "amtsgericht": "Amtsgericht Traunstein",
      "registernummer": "HRB 34972",
      "registerart": "HRB",
      "company_name": "Bayerische Vermögen Holding GmbH Unternehmensberatung, Projektentwicklung und Beteiligungsmanagement",
      "company_seat": "Ruhpolding",
      "details": "18.02.2026 (Bekanntmachungsdatum)\n\nBayern Amtsgericht Traunstein HRB 34972\nRegisterbekanntmachung nach dem Umwandlungsgesetz 17.02.2026 (Eintragungsdatum)\n\nBayerische Vermögen Holding GmbH Unternehmensberatung, Projektentwicklung und Beteiligungsmanagement\nGesellschaft mit beschränkter Haftung\nRuhpolding\n\nDen Gläubigern des formwechselnden Rechtsträgers ist, wenn sie binnen sechs Monaten nach dem Tag, an dem die Eintragung des Formwechsels nach § 201 UmwG als bekannt gemacht gilt, ihren Anspruch nach Grund und Höhe in Textform anmelden, Sicherheit zu leisten, soweit sie nicht Befriedigung verlangen können. Dieses Recht steht den Gläubigern jedoch nur zu, wenn sie glaubhaft machen, dass durch den Formwechsel die Erfüllung ihrer Forderung gefährdet wird."
    },
    {
      "date": "2026-02-18",
      "id": "145376",
      "original_text": "Registerbekanntmachung nach dem Umwandlungsgesetz\nBayern Amtsgericht München HRB 302283\nGruber Verwaltungs GmbH – Sauerlach",
      "type": "Registerbekanntmachung nach dem Umwandlungsgesetz",
      "state": "Bayern",
      "amtsgericht": "Amtsgericht München",
      "registernummer": "HRB 302283",
      "registerart": "HRB",
      "company_name": "Gruber Verwaltungs GmbH",
      "company_seat": "Sauerlach",
      "details": "18.02.2026 (Bekanntmachungsdatum)\n\nBayern Amtsgericht München HRB 302283\nRegisterbekanntmachung nach dem Umwandlungsgesetz 17.02.2026 (Eintragungsdatum)\n\nGruber Verwaltungs GmbH\nGesellschaft mit beschränkter Haftung\nSauerlach\n\nDen Gläubigern der an der Verschmelzung beteiligten Rechtsträger ist, wenn sie binnen sechs Monaten nach dem Tag, an dem die Eintragung der Verschmelzung in das Register des Sitzes desjenigen Rechtsträgers, dessen Gläubiger sie sind, nach § 19 Abs. 3 UmwG als bekannt gemacht gilt, ihren Anspruch nach Grund und Höhe in Textform anmelden, Sicherheit zu leisten, soweit sie nicht Befriedigung verlangen können. Dieses Recht steht den Gläubigern jedoch nur zu, wenn sie glaubhaft machen, dass durch die Verschmelzung die Erfüllung ihrer Forderung gefährdet wird."
    },
    {
      "date": "2026-02-18",
      "id": "145377",
      "original_text": "Registerbekanntmachung nach dem Umwandlungsgesetz\nBayern Amtsgericht München HRB 282880\nAugustinum Berchtesgadener Land gemeinnützige GmbH – München",
      "type": "Registerbekanntmachung nach dem Umwandlungsgesetz",
      "state": "Bayern",
      "amtsgericht": "Amtsgericht München",
      "registernummer": "HRB 282880",
      "registerart": "HRB",
      "company_name": "Augustinum Berchtesgadener Land gemeinnützige GmbH",
      "company_seat": "München",
      "details": "18.02.2026 (Bekanntmachungsdatum)\n\nBayern Amtsgericht München HRB 282880\nRegisterbekanntmachung nach dem Umwandlungsgesetz 17.02.2026 (Eintragungsdatum)\n\nAugustinum Berchtesgadener Land gemeinnützige GmbH\nGesellschaft mit beschränkter Haftung\nMünchen\n\nDen Gläubigern der an der Verschmelzung beteiligten Rechtsträger ist, wenn sie binnen sechs Monaten nach dem Tag, an dem die Eintragung der Verschmelzung in das Register des Sitzes desjenigen Rechtsträgers, dessen Gläubiger sie sind, nach § 19 Abs. 3 UmwG als bekannt gemacht gilt, ihren Anspruch nach Grund und Höhe in Textform anmelden, Sicherheit zu leisten, soweit sie nicht Befriedigung verlangen können. Dieses Recht steht den Gläubigern jedoch nur zu, wenn sie glaubhaft machen, dass durch die Verschmelzung die Erfüllung ihrer Forderung gefährdet wird."
    },
    {
      "date": "2026-02-18",
      "id": "145378",
      "original_text": "Registerbekanntmachung nach dem Umwandlungsgesetz\nBayern Amtsgericht München HRB 240398\nLEDES GmbH – München",
      "type": "Registerbekanntmachung nach dem Umwandlungsgesetz",
      "state": "Bayern",
      "amtsgericht": "Amtsgericht München",
      "registernummer": "HRB 240398",
      "registerart": "HRB",
      "company_name": "LEDES GmbH",
      "company_seat": "München",
      "details": "18.02.2026 (Bekanntmachungsdatum)\n\nBayern Amtsgericht München HRB 240398\nRegisterbekanntmachung nach dem Umwandlungsgesetz 17.02.2026 (Eintragungsdatum)\n\nLEDES GmbH\nGesellschaft mit beschränkter Haftung\nMünchen\n\nDen Gläubigern der an der Verschmelzung beteiligten Rechtsträger ist, wenn sie binnen sechs Monaten nach dem Tag, an dem die Eintragung der Verschmelzung in das Register des Sitzes desjenigen Rechtsträgers, dessen Gläubiger sie sind, nach § 19 Abs. 3 UmwG als bekannt gemacht gilt, ihren Anspruch nach Grund und Höhe in Textform anmelden, Sicherheit zu leisten, soweit sie nicht Befriedigung verlangen können. Dieses Recht steht den Gläubigern jedoch nur zu, wenn sie glaubhaft machen, dass durch die Verschmelzung die Erfüllung ihrer Forderung gefährdet wird."
    },
    {
      "date": "2026-02-18",
      "id": "145379",
      "original_text": "Registerbekanntmachung nach dem Umwandlungsgesetz\nBayern Amtsgericht München HRB 305385\nGruber Immobilien GmbH – Sauerlach",
      "type": "Registerbekanntmachung nach dem Umwandlungsgesetz",
      "state": "Bayern",
      "amtsgericht": "Amtsgericht München",
      "registernummer": "HRB 305385",
      "registerart": "HRB",
      "company_name": "Gruber Immobilien GmbH",
      "company_seat": "Sauerlach",
      "details": "18.02.2026 (Bekanntmachungsdatum)\n\nBayern Amtsgericht München HRB 305385\nRegisterbekanntmachung nach dem Umwandlungsgesetz 17.02.2026 (Eintragungsdatum)\n\nGruber Immobilien GmbH\nGesellschaft mit beschränkter Haftung\nSauerlach\n\nDen Gläubigern der an der Verschmelzung beteiligten Rechtsträger ist, wenn sie binnen sechs Monaten nach dem Tag, an dem die Eintragung der Verschmelzung in das Register des Sitzes desjenigen Rechtsträgers, dessen Gläubiger sie sind, nach § 19 Abs. 3 UmwG als bekannt gemacht gilt, ihren Anspruch nach Grund und Höhe in Textform anmelden, Sicherheit zu leisten, soweit sie nicht Befriedigung verlangen können. Dieses Recht steht den Gläubigern jedoch nur zu, wenn sie glaubhaft machen, dass durch die Verschmelzung die Erfüllung ihrer Forderung gefährdet wird."
    },
    {
      "date": "2026-02-18",
      "id": "145380",
      "original_text": "Einreichung neuer Dokumente\nBayern Amtsgericht München HRB 240362\nBavarian International School (BIS) gemeinnützige Aktiengesellschaft – München",
      "type": "Einreichung neuer Dokumente",
      "state": "Bayern",
      "amtsgericht": "Amtsgericht München",
      "registernummer": "HRB 240362",
      "registerart": "HRB",
      "company_name": "Bavarian International School (BIS) gemeinnützige Aktiengesellschaft",
      "company_seat": "München",
      "details": "18.02.2026 (Bekanntmachungsdatum)\n\nBayern Amtsgericht München HRB 240362\nEinreichung neuer Dokumente\n\nBavarian International School (BIS) gemeinnützige Aktiengesellschaft\nAktiengesellschaft\nMünchen\n\nDem Amtsgericht München -Registergericht- ist eine Liste der Mitglieder des Aufsichtsrats eingereicht worden, § 106 AktG."
    },
    {
      "date": "2026-02-18",
      "id": "145381",
      "original_text": "Registerbekanntmachung nach dem Umwandlungsgesetz\nBayern Amtsgericht Bayreuth HRA 4977\nMarc Jersch e.K. – Kulmbach",
      "type": "Registerbekanntmachung nach dem Umwandlungsgesetz",
      "state": "Bayern",
      "amtsgericht": "Amtsgericht Bayreuth",
      "registernummer": "HRA 4977",
      "registerart": "HRA",
      "company_name": "Marc Jersch e.K.",
      "company_seat": "Kulmbach",
      "details": "18.02.2026 (Bekanntmachungsdatum)\n\nBayern Amtsgericht Bayreuth HRA 4977\nRegisterbekanntmachung nach dem Umwandlungsgesetz 17.02.2026 (Eintragungsdatum)\n\nMarc Jersch e.K.\nEinzelkaufmann / Einzelkauffrau\nKulmbach\n\nDen Gläubigern der an der Ausgliederung beteiligten Rechtsträger ist, wenn sie binnen sechs Monaten nach dem Tag, an dem die Eintragung der Ausgliederung in das Register des Sitzes desjenigen Rechtsträgers, dessen Gläubiger sie sind, nach §§ 125, 19 Abs. 3 UmwG als bekannt gemacht gilt, ihren Anspruch nach Grund und Höhe in Textform anmelden, Sicherheit zu leisten, soweit sie nicht Befriedigung verlangen können. Dieses Recht steht den Gläubigern jedoch nur zu, wenn sie glaubhaft machen, dass durch die Ausgliederung die Erfüllung ihrer Forderung gefährdet wird."
    },
    {
      "date": "2026-02-18",
      "id": "145382",
      "original_text": "Registerbekanntmachung nach dem Umwandlungsgesetz\nBayern Amtsgericht München HRB 95484\nLHI Fondsverwaltung GmbH – Pullach i. Isartal",
      "type": "Registerbekanntmachung nach dem Umwandlungsgesetz",
      "state": "Bayern",
      "amtsgericht": "Amtsgericht München",
      "registernummer": "HRB 95484",
      "registerart": "HRB",
      "company_name": "LHI Fondsverwaltung GmbH",
      "company_seat": "Pullach i. Isartal",
      "details": "18.02.2026 (Bekanntmachungsdatum)\n\nBayern Amtsgericht München HRB 95484\nRegisterbekanntmachung nach dem Umwandlungsgesetz 17.02.2026 (Eintragungsdatum)\n\nLHI Fondsverwaltung GmbH\nGesellschaft mit beschränkter Haftung\nPullach i. Isartal\n\nDen Gläubigern der an der Verschmelzung beteiligten Rechtsträger ist, wenn sie binnen sechs Monaten nach dem Tag, an dem die Eintragung der Verschmelzung in das Register des Sitzes desjenigen Rechtsträgers, dessen Gläubiger sie sind, nach § 19 Abs. 3 UmwG als bekannt gemacht gilt, ihren Anspruch nach Grund und Höhe in Textform anmelden, Sicherheit zu leisten, soweit sie nicht Befriedigung verlangen können. Dieses Recht steht den Gläubigern jedoch nur zu, wenn sie glaubhaft machen, dass durch die Verschmelzung die Erfüllung ihrer Forderung gefährdet wird."
    },
    {
      "date": "2026-02-18",
      "id": "145383",
      "original_text": "Registerbekanntmachung nach dem Umwandlungsgesetz\nBerlin Amtsgericht Berlin (Charlottenburg) HRB 218353\nPrecapitalPartners GmbH – Berlin",
      "type": "Registerbekanntmachung nach dem Umwandlungsgesetz",
      "state": "Berlin",
      "amtsgericht": "Amtsgericht Berlin (Charlottenburg)",
      "registernummer": "HRB 218353",
      "registerart": "HRB",
      "company_name": "PrecapitalPartners GmbH",
      "company_seat": "Berlin",
      "details": "18.02.2026 (Bekanntmachungsdatum)\n\nBerlin Amtsgericht Berlin (Charlottenburg) HRB 218353\nRegisterbekanntmachung nach dem Umwandlungsgesetz 17.02.2026 (Eintragungsdatum)\n\nPrecapitalPartners GmbH\nGesellschaft mit beschränkter Haftung\nBerlin\n\nZu Eintragungsnummer 4 vom 17.02.2026 wird als nicht eingetragen veröffentlicht: Den Gläubigern der an der Verschmelzung beteiligten Rechtsträger ist, wenn sie binnen sechs Monaten nach dem Tag, an dem die Eintragung der Verschmelzung in das Register des Sitzes desjenigen Rechtsträgers, dessen Gläubiger sie sind, als bekannt gemacht gilt, ihren Anspruch nach Grund und Höhe schriftlich anmelden, Sicherheit zu leisten, soweit sie nicht Befriedigung verlangen können. Dieses Recht steht den Gläubigern jedoch nur zu, wenn sie glaubhaft machen, dass durch die Verschmelzung die Erfüllung ihrer Forderung gefährdet wird. Das Recht, Sicherheitsleistung zu verlangen, steht Gläubigern nicht zu, die im Falle der Insolvenz ein Recht auf vorzugsweise Befriedigung aus einer Deckungsmasse haben, die nach gesetzlicher Vorschrift zu ihrem Schutz errichtet und staatlich überwacht ist."
    },
    {
      "date": "2026-02-18",
      "id": "145384",
      "original_text": "Registerbekanntmachung nach dem Umwandlungsgesetz\nBerlin Amtsgericht Berlin (Charlottenburg) HRB 219322\nPrecapital Holding GmbH – Berlin",
      "type": "Registerbekanntmachung nach dem Umwandlungsgesetz",
      "state": "Berlin",
      "amtsgericht": "Amtsgericht Berlin (Charlottenburg)",
      "registernummer": "HRB 219322",
      "registerart": "HRB",
      "company_name": "Precapital Holding GmbH",
      "company_seat": "Berlin",
      "details": "18.02.2026 (Bekanntmachungsdatum)\n\nBerlin Amtsgericht Berlin (Charlottenburg) HRB 219322\nRegisterbekanntmachung nach dem Umwandlungsgesetz 17.02.2026 (Eintragungsdatum)\n\nPrecapital Holding GmbH\nGesellschaft mit beschränkter Haftung\nBerlin\n\nZu Eintragungsnummer 7 vom 17.02.2026 wird als nicht eingetragen veröffentlicht: Den Gläubigern der an der Verschmelzung beteiligten Rechtsträger ist, wenn sie binnen sechs Monaten nach dem Tag, an dem die Eintragung der Verschmelzung in das Register des Sitzes desjenigen Rechtsträgers, dessen Gläubiger sie sind, als bekannt gemacht gilt, ihren Anspruch nach Grund und Höhe schriftlich anmelden, Sicherheit zu leisten, soweit sie nicht Befriedigung verlangen können. Dieses Recht steht den Gläubigern jedoch nur zu, wenn sie glaubhaft machen, dass durch die Verschmelzung die Erfüllung ihrer Forderung gefährdet wird. Das Recht, Sicherheitsleistung zu verlangen, steht Gläubigern nicht zu, die im Falle der Insolvenz ein Recht auf vorzugsweise Befriedigung aus einer Deckungsmasse haben, die nach gesetzlicher Vorschrift zu ihrem Schutz errichtet und staatlich überwacht ist."
    },
    {
      "date": "2026-02-18",
      "id": "145385",
      "original_text": "Löschungsankündigung\nSchleswig-Holstein Amtsgericht Lübeck HRB 24716\nEAWD Logistik GmbH – Bargteheide",
      "type": "Löschungsankündigung",
      "state": "Schleswig-Holstein",
      "amtsgericht": "Amtsgericht Lübeck",
      "registernummer": "HRB 24716",
      "registerart": "HRB",
      "company_name": "EAWD Logistik GmbH",
      "company_seat": "Bargteheide",
      "details": "18.02.2026 (Bekanntmachungsdatum)\n\nSchleswig-Holstein Amtsgericht Lübeck HRB 24716\nLöschungsankündigung\n\nEAWD Logistik GmbH\nGesellschaft mit beschränkter Haftung\nBargteheide\n\nEs ist die Löschung der nachstehenden Gesellschaft wegen Vermögenslosigkeit gemäß § 394 FamFG beabsichtigt."
    },
    {
      "date": "2026-02-18",
      "id": "145386",
      "original_text": "Registerbekanntmachung nach dem Umwandlungsgesetz\nBaden-Württemberg Amtsgericht Stuttgart HRB 242091\nRainer Kolb GmbH – Stuttgart",
      "type": "Registerbekanntmachung nach dem Umwandlungsgesetz",
      "state": "Baden-Württemberg",
      "amtsgericht": "Amtsgericht Stuttgart",
      "registernummer": "HRB 242091",
      "registerart": "HRB",
      "company_name": "Rainer Kolb GmbH",
      "company_seat": "Stuttgart",
      "details": "18.02.2026 (Bekanntmachungsdatum)\n\nBaden-Württemberg Amtsgericht Stuttgart HRB 242091\nRegisterbekanntmachung nach dem Umwandlungsgesetz 18.02.2026 (Eintragungsdatum)\n\nRainer Kolb GmbH\nGesellschaft mit beschränkter Haftung\nStuttgart\n\nAls nicht eingetragen wird bekanntgemacht:\nDen Gläubigern der an der Verschmelzung beteiligten Rechtsträger ist, wenn sie binnen sechs Monaten nach dem Tag, an dem die Eintragung der Verschmelzung in das Register des Sitzes desjenigen Rechtsträgers, dessen Gläubiger sie sind, nach § 19 Abs. 3 UmwG als bekanntgemacht gilt, ihren Anspruch nach Grund und Höhe schriftlich anmelden, Sicherheit zu leisten, soweit sie nicht Befriedigung verlangen können. Dieses Recht steht den Gläubigern jedoch nur zu, wenn sie glaubhaft machen, dass durch die Verschmelzung die Erfüllung ihrer Forderung gefährdet wird."
    },
    {
      "date": "2026-02-18",
      "id": "145387",
      "original_text": "Löschungsankündigung\nBerlin Amtsgericht Berlin (Charlottenburg) HRB 177519\nKRONOT UG (haftungsbeschränkt) – Berlin",
      "type": "Löschungsankündigung",
      "state": "Berlin",
      "amtsgericht": "Amtsgericht Berlin (Charlottenburg)",
      "registernummer": "HRB 177519",
      "registerart": "HRB",
      "company_name": "KRONOT UG (haftungsbeschränkt)",
      "company_seat": "Berlin",
      "details": "18.02.2026 (Bekanntmachungsdatum)\n\nBerlin Amtsgericht Berlin (Charlottenburg) HRB 177519\nLöschungsankündigung\n\nKRONOT UG (haftungsbeschränkt)\nGesellschaft mit beschränkter Haftung\nBerlin\n\nBei der nachstehenden Gesellschaft wird das Amtslöschungsverfahren gemäß § 394 FamFG eingeleitet. Widerspruchsfrist 6 Wochen"
    },
    {
      "date": "2026-02-18",
      "id": "145388",
      "original_text": "Registerbekanntmachung nach dem Umwandlungsgesetz\nHamburg Amtsgericht Hamburg HRB 15826\nLothar Müller Gesellschaft mit beschränkter Haftung – Hamburg",
      "type": "Registerbekanntmachung nach dem Umwandlungsgesetz",
      "state": "Hamburg",
      "amtsgericht": "Amtsgericht Hamburg",
      "registernummer": "HRB 15826",
      "registerart": "HRB",
      "company_name": "Lothar Müller Gesellschaft mit beschränkter Haftung",
      "company_seat": "Hamburg",
      "details": "18.02.2026 (Bekanntmachungsdatum)\n\nHamburg Amtsgericht Hamburg HRB 15826\nRegisterbekanntmachung nach dem Umwandlungsgesetz 18.02.2026 (Eintragungsdatum)\n\nLothar Müller Gesellschaft mit beschränkter Haftung\nGesellschaft mit beschränkter Haftung\nHamburg\n\nAls nicht eingetragen wird bekannt gemacht:\nDen Gläubigern der an der Verschmelzung beteiligten Gesellschaften ist, wenn sie binnen sechs Monaten nach dem Tag, an dem die Eintragung der Verschmelzung in das Register des Sitzes desjenigen Rechtsträgers, dessen Gläubiger sie sind, nach § 19 Absatz 3 UmwG als bekannt gemacht gilt, ihren Anspruch nach Grund und Höhe schriftlich anmelden, Sicherheit zu leisten, soweit sie nicht Befriedigung verlangen können. Dieses Recht steht den Gläubigern jedoch nur zu, wenn sie glaubhaft machen, dass durch die Verschmelzung die Erfüllung ihrer Forderung gefährdet wird."
    },
    {
      "date": "2026-02-18",
      "id": "145389",
      "original_text": "Registerbekanntmachung nach dem Umwandlungsgesetz\nHamburg Amtsgericht Hamburg HRB 196761\nJulius Grube Schiffswerft GmbH – Hamburg",
      "type": "Registerbekanntmachung nach dem Umwandlungsgesetz",
      "state": "Hamburg",
      "amtsgericht": "Amtsgericht Hamburg",
      "registernummer": "HRB 196761",
      "registerart": "HRB",
      "company_name": "Julius Grube Schiffswerft GmbH",
      "company_seat": "Hamburg",
      "details": "18.02.2026 (Bekanntmachungsdatum)\n\nHamburg Amtsgericht Hamburg HRB 196761\nRegisterbekanntmachung nach dem Umwandlungsgesetz 18.02.2026 (Eintragungsdatum)\n\nJulius Grube Schiffswerft GmbH\nGesellschaft mit beschränkter Haftung\nHamburg\n\nAls nicht eingetragen wird bekannt gemacht:\nDen Gläubigern der an der Verschmelzung beteiligten Gesellschaften ist, wenn sie binnen sechs Monaten nach dem Tag, an dem die Eintragung der Verschmelzung in das Register des Sitzes desjenigen Rechtsträgers, dessen Gläubiger sie sind, nach § 19 Absatz 3 UmwG als bekannt gemacht gilt, ihren Anspruch nach Grund und Höhe schriftlich anmelden, Sicherheit zu leisten, soweit sie nicht Befriedigung verlangen können. Dieses Recht steht den Gläubigern jedoch nur zu, wenn sie glaubhaft machen, dass durch die Verschmelzung die Erfüllung ihrer Forderung gefährdet wird."
    },
    {
      "date": "2026-02-18",
      "id": "145390",
      "original_text": "Registerbekanntmachung nach dem Umwandlungsgesetz\nHamburg Amtsgericht Hamburg HRB 183318\nPlus Energie Werft UG (haftungsbeschränkt) – Hamburg",
      "type": "Registerbekanntmachung nach dem Umwandlungsgesetz",
      "state": "Hamburg",
      "amtsgericht": "Amtsgericht Hamburg",
      "registernummer": "HRB 183318",
      "registerart": "HRB",
      "company_name": "Plus Energie Werft UG (haftungsbeschränkt)",
      "company_seat": "Hamburg",
      "details": "18.02.2026 (Bekanntmachungsdatum)\n\nHamburg Amtsgericht Hamburg HRB 183318\nRegisterbekanntmachung nach dem Umwandlungsgesetz 18.02.2026 (Eintragungsdatum)\n\nPlus Energie Werft UG (haftungsbeschränkt)\nGesellschaft mit beschränkter Haftung\nHamburg\n\nAls nicht eingetragen wird bekannt gemacht:\nDen Gläubigern der an der Verschmelzung beteiligten Gesellschaften ist, wenn sie binnen sechs Monaten nach dem Tag, an dem die Eintragung der Verschmelzung in das Register des Sitzes desjenigen Rechtsträgers, dessen Gläubiger sie sind, nach § 19 Absatz 3 UmwG als bekannt gemacht gilt, ihren Anspruch nach Grund und Höhe schriftlich anmelden, Sicherheit zu leisten, soweit sie nicht Befriedigung verlangen können. Dieses Recht steht den Gläubigern jedoch nur zu, wenn sie glaubhaft machen, dass durch die Verschmelzung die Erfüllung ihrer Forderung gefährdet wird."
    },
    {
      "date": "2026-02-18",
      "id": "145391",
      "original_text": "Registerbekanntmachung nach dem Umwandlungsgesetz\nHamburg Amtsgericht Hamburg HRB 196761\nJulius Grube Schiffswerft GmbH – Hamburg",
      "type": "Registerbekanntmachung nach dem Umwandlungsgesetz",
      "state": "Hamburg",
      "amtsgericht": "Amtsgericht Hamburg",
      "registernummer": "HRB 196761",
      "registerart": "HRB",
      "company_name": "Julius Grube Schiffswerft GmbH",
      "company_seat": "Hamburg",
      "details": "18.02.2026 (Bekanntmachungsdatum)\n\nHamburg Amtsgericht Hamburg HRB 196761\nRegisterbekanntmachung nach dem Umwandlungsgesetz 18.02.2026 (Eintragungsdatum)\n\nJulius Grube Schiffswerft GmbH\nGesellschaft mit beschränkter Haftung\nHamburg\n\nAls nicht eingetragen wird bekannt gemacht:\nDen Gläubigern der an der Verschmelzung beteiligten Gesellschaften ist, wenn sie binnen sechs Monaten nach dem Tag, an dem die Eintragung der Verschmelzung in das Register des Sitzes desjenigen Rechtsträgers, dessen Gläubiger sie sind, nach § 19 Absatz 3 UmwG als bekannt gemacht gilt, ihren Anspruch nach Grund und Höhe schriftlich anmelden, Sicherheit zu leisten, soweit sie nicht Befriedigung verlangen können. Dieses Recht steht den Gläubigern jedoch nur zu, wenn sie glaubhaft machen, dass durch die Verschmelzung die Erfüllung ihrer Forderung gefährdet wird."
    },
    {
      "date": "2026-02-18",
      "id": "145392",
      "original_text": "Löschungsankündigung\nSaarland Amtsgericht Saarbrücken HRB 100213\nMinotaurus Investment Consulting UG (haftungsbeschränkt) – Merchweiler",
      "type": "Löschungsankündigung",
      "state": "Saarland",
      "amtsgericht": "Amtsgericht Saarbrücken",
      "registernummer": "HRB 100213",
      "registerart": "HRB",
      "company_name": "Minotaurus Investment Consulting UG (haftungsbeschränkt)",
      "company_seat": "Merchweiler",
      "details": "18.02.2026 (Bekanntmachungsdatum)\n\nSaarland Amtsgericht Saarbrücken HRB 100213\nLöschungsankündigung 18.02.2026 (Eintragungsdatum)\n\nMinotaurus Investment Consulting UG (haftungsbeschränkt)\nGesellschaft mit beschränkter Haftung\nMerchweiler\n\nEs ist beabsichtigt, die Gesellschaft von Amts wegen gemäß § 394 FamFG wegen Vermögenslosigkeit zu löschen. Gegen die Löschung von Amts wegen ist das Rechtsmittel des Widerspruchs statthaft. Der Widerspruch ist binnen einer Frist von 3 Monaten beginnend mit dem Tag dieser Veröffentlichung durch Einreichen eines Widerspruchsschreibens -schriftlich oder zur Niederschrift der Geschäftsstelle- beim Amtsgericht Saarbrücken, -zentrales Handelsregister-, Mainzerstr.178, 66121 Saarbrücken einzulegen. Der Widerspruch muss die Bezeichnung der angefochtenen Löschungsankündigung enthalten sowie die Erklärung, dass Widerspruch eingelegt wird. Er ist vom Widerspruchsführer oder seinem Bevollmächtigten zu unterzeichnen."
    },
    {
      "date": "2026-02-18",
      "id": "145393",
      "original_text": "Einreichung neuer Dokumente\nBaden-Württemberg Amtsgericht Mannheim HRB 107865\nKVVH - Karlsruher Versorgungs-, Verkehrs- und Hafen GmbH – Karlsruhe",
      "type": "Einreichung neuer Dokumente",
      "state": "Baden-Württemberg",
      "amtsgericht": "Amtsgericht Mannheim",
      "registernummer": "HRB 107865",
      "registerart": "HRB",
      "company_name": "KVVH - Karlsruher Versorgungs-, Verkehrs- und Hafen GmbH",
      "company_seat": "Karlsruhe",
      "details": "18.02.2026 (Bekanntmachungsdatum)\n\nBaden-Württemberg Amtsgericht Mannheim HRB 107865\nEinreichung neuer Dokumente\n\nKVVH - Karlsruher Versorgungs-, Verkehrs- und Hafen GmbH\nGesellschaft mit beschränkter Haftung\nKarlsruhe\n\nDie Gesellschaft hat am 09.02.2026 die Liste über die Zusammensetzung des Aufsichtsrats zum Handelsregister eingereicht."
    },
    {
      "date": "2026-02-18",
      "id": "145394",
      "original_text": "Registerbekanntmachung nach dem Umwandlungsgesetz\nSchleswig-Holstein Amtsgericht Kiel HRB 27559\nGustav Kindt Agri Trading GmbH – Ellerau",
      "type": "Registerbekanntmachung nach dem Umwandlungsgesetz",
      "state": "Schleswig-Holstein",
      "amtsgericht": "Amtsgericht Kiel",
      "registernummer": "HRB 27559",
      "registerart": "HRB",
      "company_name": "Gustav Kindt Agri Trading GmbH",
      "company_seat": "Ellerau",
      "details": "18.02.2026 (Bekanntmachungsdatum)\n\nSchleswig-Holstein Amtsgericht Kiel HRB 27559\nRegisterbekanntmachung nach dem Umwandlungsgesetz 18.02.2026 (Eintragungsdatum)\n\nGustav Kindt Agri Trading GmbH\nGesellschaft mit beschränkter Haftung\nEllerau\n\nZu Eintragungsnummer 3 vom 18.02.2026 wird als nicht eingetragen veröffentlicht:  Den Gläubigern der an der Spaltung beteiligten Rechtsträger ist, wenn sie binnen sechs Monaten nach dem Tag, an dem die Eintragung der Spaltung in das Register des Sitzes desjenigen Rechtsträgers, dessen Gläubiger sie sind,  bekannt gemacht worden ist, ihren Anspruch nach Grund und Höhe schriftlich anmelden, Sicherheit zu leisten, soweit sie nicht Befriedigung verlangen können. Dieses Recht steht den Gläubigern jedoch nur zu, wenn sie glaubhaft machen, dass durch die Spaltung die Erfüllung ihrer Forderung gefährdet wird."
    },
    {
      "date": "2026-02-18",
      "id": "145395",
      "original_text": "Registerbekanntmachung nach dem Umwandlungsgesetz\nHamburg Amtsgericht Hamburg HRB 163178\nCatchup Connect GmbH – Hamburg",
      "type": "Registerbekanntmachung nach dem Umwandlungsgesetz",
      "state": "Hamburg",
      "amtsgericht": "Amtsgericht Hamburg",
      "registernummer": "HRB 163178",
      "registerart": "HRB",
      "company_name": "Catchup Connect GmbH",
      "company_seat": "Hamburg",
      "details": "18.02.2026 (Bekanntmachungsdatum)\n\nHamburg Amtsgericht Hamburg HRB 163178\nRegisterbekanntmachung nach dem Umwandlungsgesetz 18.02.2026 (Eintragungsdatum)\n\nCatchup Connect GmbH\nGesellschaft mit beschränkter Haftung\nHamburg\n\nAls nicht eingetragen wird bekannt gemacht:\nDen Gläubigern der an der Verschmelzung beteiligten Gesellschaften ist, wenn sie binnen sechs Monaten nach dem Tag, an dem die Eintragung der Verschmelzung in das Register des Sitzes desjenigen Rechtsträgers, dessen Gläubiger sie sind, nach § 19 Absatz 3 UmwG als bekannt gemacht gilt, ihren Anspruch nach Grund und Höhe schriftlich anmelden, Sicherheit zu leisten, soweit sie nicht Befriedigung verlangen können. Dieses Recht steht den Gläubigern jedoch nur zu, wenn sie glaubhaft machen, dass durch die Verschmelzung die Erfüllung ihrer Forderung gefährdet wird."
    },
    {
      "date": "2026-02-18",
      "id": "145396",
      "original_text": "Registerbekanntmachung nach dem Umwandlungsgesetz\nHamburg Amtsgericht Hamburg HRA 125782\nCatchup Applications KG – Hamburg",
      "type": "Registerbekanntmachung nach dem Umwandlungsgesetz",
      "state": "Hamburg",
      "amtsgericht": "Amtsgericht Hamburg",
      "registernummer": "HRA 125782",
      "registerart": "HRA",
      "company_name": "Catchup Applications KG",
      "company_seat": "Hamburg",
      "details": "18.02.2026 (Bekanntmachungsdatum)\n\nHamburg Amtsgericht Hamburg HRA 125782\nRegisterbekanntmachung nach dem Umwandlungsgesetz 18.02.2026 (Eintragungsdatum)\n\nCatchup Applications KG\nKommanditgesellschaft\nHamburg\n\nAls nicht eingetragen wird bekannt gemacht:\nDen Gläubigern der an der Verschmelzung beteiligten Gesellschaften ist, wenn sie binnen sechs Monaten nach dem Tag, an dem die Eintragung der Verschmelzung in das Register des Sitzes desjenigen Rechtsträgers, dessen Gläubiger sie sind, nach § 19 Absatz 3 UmwG als bekannt gemacht gilt, ihren Anspruch nach Grund und Höhe schriftlich anmelden, Sicherheit zu leisten, soweit sie nicht Befriedigung verlangen können. Dieses Recht steht den Gläubigern jedoch nur zu, wenn sie glaubhaft machen, dass durch die Verschmelzung die Erfüllung ihrer Forderung gefährdet wird."
    },
    {
      "date": "2026-02-18",
      "id": "145397",
      "original_text": "Einreichung neuer Dokumente\nBaden-Württemberg Amtsgericht Stuttgart HRB 722731\nEvangelische Heimstiftung GmbH – Stuttgart",
      "type": "Einreichung neuer Dokumente",
      "state": "Baden-Württemberg",
      "amtsgericht": "Amtsgericht Stuttgart",
      "registernummer": "HRB 722731",
      "registerart": "HRB",
      "company_name": "Evangelische Heimstiftung GmbH",
      "company_seat": "Stuttgart",
      "details": "18.02.2026 (Bekanntmachungsdatum)\n\nBaden-Württemberg Amtsgericht Stuttgart HRB 722731\nEinreichung neuer Dokumente\n\nEvangelische Heimstiftung GmbH\nGesellschaft mit beschränkter Haftung\nStuttgart\n\nDie Gesellschaft hat am 02.02.2026 die Liste über die Zusammensetzung des Aufsichtsrats zum Handelsregister eingereicht."
    },
    {
      "date": "2026-02-18",
      "id": "145398",
      "original_text": "Registerbekanntmachung nach dem Umwandlungsgesetz\nBaden-Württemberg Amtsgericht Freiburg HRB 733501\nJK Invest GmbH – Waldshut-Tiengen",
      "type": "Registerbekanntmachung nach dem Umwandlungsgesetz",
      "state": "Baden-Württemberg",
      "amtsgericht": "Amtsgericht Freiburg",
      "registernummer": "HRB 733501",
      "registerart": "HRB",
      "company_name": "JK Invest GmbH",
      "company_seat": "Waldshut-Tiengen",
      "details": "18.02.2026 (Bekanntmachungsdatum)\n\nBaden-Württemberg Amtsgericht Freiburg HRB 733501\nRegisterbekanntmachung nach dem Umwandlungsgesetz 18.02.2026 (Eintragungsdatum)\n\nJK Invest GmbH\nGesellschaft mit beschränkter Haftung\nWaldshut-Tiengen\n\nDen Gläubigern der an der Verschmelzung beteiligten Rechtsträger ist, wenn sie binnen sechs Monaten nach dem Tag, an dem die Eintragung der Verschmelzung in das Register des Sitzes desjenigen Rechtsträgers, dessen Gläubiger sie sind, nach § 19 Abs. 3 UmwG als bekanntgemacht gilt, ihren Anspruch nach Grund und Höhe schriftlich anmelden, Sicherheit zu leisten, soweit sie nicht Befriedigung verlangen können. Dieses Recht steht den Gläubigern jedoch nur zu, wenn sie glaubhaft machen, dass durch die Verschmelzung die Erfüllung ihrer Forderung gefährdet wird."
    },
    {
      "date": "2026-02-18",
      "id": "145399",
      "original_text": "Registerbekanntmachung nach dem Umwandlungsgesetz\nSchleswig-Holstein Amtsgericht Lübeck HRB 6\nGabler Maschinenbau GmbH – Lübeck",
      "type": "Registerbekanntmachung nach dem Umwandlungsgesetz",
      "state": "Schleswig-Holstein",
      "amtsgericht": "Amtsgericht Lübeck",
      "registernummer": "HRB 6",
      "registerart": "HRB",
      "company_name": "Gabler Maschinenbau GmbH",
      "company_seat": "Lübeck",
      "details": "18.02.2026 (Bekanntmachungsdatum)\n\nSchleswig-Holstein Amtsgericht Lübeck HRB 6\nRegisterbekanntmachung nach dem Umwandlungsgesetz 18.02.2026 (Eintragungsdatum)\n\nGabler Maschinenbau GmbH\nGesellschaft mit beschränkter Haftung\nLübeck\n\nAls nicht eingetragen wird veröffentlicht: Den Gläubigern ist, wenn sie binnen sechs Monaten nach dem Tag, an dem die Eintragung der Umwandlung als bekannt gemacht gilt, ihren Anspruch nach Grund und Höhe schriftlich anmelden, Sicherheit zu leisten, soweit sie nicht Befriedigung verlangen können. Dieses Recht steht den Gläubigern jedoch nur zu, wenn sie glaubhaft machen, dass durch die Umwandlung die Erfüllung ihrer Forderung gefährdet wird."
    },
    {
      "date": "2026-02-18",
      "id": "145400",
      "original_text": "Registerbekanntmachung nach dem Umwandlungsgesetz\nBaden-Württemberg Amtsgericht Freiburg HRB 621605\nHDW Strahltechnik Strittmatter GmbH – Waldshut-Tiengen",
      "type": "Registerbekanntmachung nach dem Umwandlungsgesetz",
      "state": "Baden-Württemberg",
      "amtsgericht": "Amtsgericht Freiburg",
      "registernummer": "HRB 621605",
      "registerart": "HRB",
      "company_name": "HDW Strahltechnik Strittmatter GmbH",
      "company_seat": "Waldshut-Tiengen",
      "details": "18.02.2026 (Bekanntmachungsdatum)\n\nBaden-Württemberg Amtsgericht Freiburg HRB 621605\nRegisterbekanntmachung nach dem Umwandlungsgesetz 18.02.2026 (Eintragungsdatum)\n\nHDW Strahltechnik Strittmatter GmbH\nGesellschaft mit beschränkter Haftung\nWaldshut-Tiengen\n\nDen Gläubigern der an der Verschmelzung beteiligten Rechtsträger ist, wenn sie binnen sechs Monaten nach dem Tag, an dem die Eintragung der Verschmelzung in das Register des Sitzes desjenigen Rechtsträgers, dessen Gläubiger sie sind, nach § 19 Abs. 3 UmwG als bekanntgemacht gilt, ihren Anspruch nach Grund und Höhe schriftlich anmelden, Sicherheit zu leisten, soweit sie nicht Befriedigung verlangen können. Dieses Recht steht den Gläubigern jedoch nur zu, wenn sie glaubhaft machen, dass durch die Verschmelzung die Erfüllung ihrer Forderung gefährdet wird."
    },
    {
      "date": "2026-02-18",
      "id": "145401",
      "original_text": "Registerbekanntmachung nach dem Umwandlungsgesetz\nBaden-Württemberg Amtsgericht Mannheim HRB 728660\nMAX MARK TRADING GmbH – Karlsruhe",
      "type": "Registerbekanntmachung nach dem Umwandlungsgesetz",
      "state": "Baden-Württemberg",
      "amtsgericht": "Amtsgericht Mannheim",
      "registernummer": "HRB 728660",
      "registerart": "HRB",
      "company_name": "MAX MARK TRADING GmbH",
      "company_seat": "Karlsruhe",
      "details": "18.02.2026 (Bekanntmachungsdatum)\n\nBaden-Württemberg Amtsgericht Mannheim HRB 728660\nRegisterbekanntmachung nach dem Umwandlungsgesetz 18.02.2026 (Eintragungsdatum)\n\nMAX MARK TRADING GmbH\nGesellschaft mit beschränkter Haftung\nKarlsruhe\n\nDen Gläubigern der an der Verschmelzung beteiligten Rechtsträger ist, wenn sie binnen sechs Monaten nach dem Tag, an dem die Eintragung der Verschmelzung in das Register des Sitzes desjenigen Rechtsträgers, dessen Gläubiger sie sind, nach § 19 Abs. 3 UmwG als bekanntgemacht gilt, ihren Anspruch nach Grund und Höhe schriftlich anmelden, Sicherheit zu leisten, soweit sie nicht Befriedigung verlangen können. Dieses Recht steht den Gläubigern jedoch nur zu, wenn sie glaubhaft machen, dass durch die Verschmelzung die Erfüllung ihrer Forderung gefährdet wird."
    },
    {
      "date": "2026-02-18",
      "id": "145402",
      "original_text": "Registerbekanntmachung nach dem Umwandlungsgesetz\nSchleswig-Holstein Amtsgericht Lübeck HRB 27196\nGabler Group AG – Lübeck",
      "type": "Registerbekanntmachung nach dem Umwandlungsgesetz",
      "state": "Schleswig-Holstein",
      "amtsgericht": "Amtsgericht Lübeck",
      "registernummer": "HRB 27196",
      "registerart": "HRB",
      "company_name": "Gabler Group AG",
      "company_seat": "Lübeck",
      "details": "18.02.2026 (Bekanntmachungsdatum)\n\nSchleswig-Holstein Amtsgericht Lübeck HRB 27196\nRegisterbekanntmachung nach dem Umwandlungsgesetz 18.02.2026 (Eintragungsdatum)\n\nGabler Group AG\nAktiengesellschaft\nLübeck\n\nZu Eintragungsnummer 1 vom 18.02.2026 wird als nicht eingetragen veröffentlicht:\nDen Gläubigern ist, wenn sie binnen sechs Monaten nach dem Tag, an dem die Eintragung der Umwandlung als bekannt gemacht gilt, ihren Anspruch nach Grund und Höhe schriftlich anmelden, Sicherheit zu leisten, soweit sie nicht Befriedigung verlangen können. Dieses Recht steht den Gläubigern jedoch nur zu, wenn sie glaubhaft machen, dass durch die Umwandlung die Erfüllung ihrer Forderung gefährdet wird."
    },
    {
      "date": "2026-02-18",
      "id": "145403",
      "original_text": "Einreichung neuer Dokumente\nBaden-Württemberg Amtsgericht Freiburg HRB 540034\nConstellium Singen GmbH – Singen Hohentwiel",
      "type": "Einreichung neuer Dokumente",
      "state": "Baden-Württemberg",
      "amtsgericht": "Amtsgericht Freiburg",
      "registernummer": "HRB 540034",
      "registerart": "HRB",
      "company_name": "Constellium Singen GmbH",
      "company_seat": "Singen Hohentwiel",
      "details": "18.02.2026 (Bekanntmachungsdatum)\n\nBaden-Württemberg Amtsgericht Freiburg HRB 540034\nEinreichung neuer Dokumente\n\nConstellium Singen GmbH\nGesellschaft mit beschränkter Haftung\nSingen Hohentwiel\n\nDie Gesellschaft hat am 17.02.2026 die Liste über die Zusammensetzung des Aufsichtsrats zum Handelsregister eingereicht."
    },
    {
      "date": "2026-02-18",
      "id": "145404",
      "original_text": "Einreichung neuer Dokumente\nBaden-Württemberg Amtsgericht Mannheim HRB 108751\nCAS Software AG – Karlsruhe",
      "type": "Einreichung neuer Dokumente",
      "state": "Baden-Württemberg",
      "amtsgericht": "Amtsgericht Mannheim",
      "registernummer": "HRB 108751",
      "registerart": "HRB",
      "company_name": "CAS Software AG",
      "company_seat": "Karlsruhe",
      "details": "18.02.2026 (Bekanntmachungsdatum)\n\nBaden-Württemberg Amtsgericht Mannheim HRB 108751\nEinreichung neuer Dokumente\n\nCAS Software AG\nAktiengesellschaft\nKarlsruhe\n\nDie Gesellschaft hat am 14.02.2026 die Liste über die Zusammensetzung des Aufsichtsrats zum Handelsregister eingereicht."
    },
    {
      "date": "2026-02-18",
      "id": "145405",
      "original_text": "Löschungsankündigung\nBaden-Württemberg Amtsgericht Freiburg HRB 719735\nWalterson UG (haftungsbeschränkt) – Villingen-Schwenningen",
      "type": "Löschungsankündigung",
      "state": "Baden-Württemberg",
      "amtsgericht": "Amtsgericht Freiburg",
      "registernummer": "HRB 719735",
      "registerart": "HRB",
      "company_name": "Walterson UG (haftungsbeschränkt)",
      "company_seat": "Villingen-Schwenningen",
      "details": "18.02.2026 (Bekanntmachungsdatum)\n\nBaden-Württemberg Amtsgericht Freiburg HRB 719735\nLöschungsankündigung\n\nWalterson UG (haftungsbeschränkt)\nGesellschaft mit beschränkter Haftung\nVillingen-Schwenningen\n\nAls nicht eingetragen wird bekanntgemacht:\nDas Gericht beabsichtigt, die Gesellschaft wegen Vermögenslosigkeit im Handelsregister von Amts wegen nach § 394 FamFG zu löschen. Die Frist zur Geltendmachung eines Widerspruchs gegen die beabsichtigte Löschung ist auf einen Monat ab Veröffentlichung bestimmt."
    },
    {
      "date": "2026-02-18",
      "id": "145406",
      "original_text": "Einreichung neuer Dokumente\nThüringen Amtsgericht Jena HRB 517739\nMVZ Sozialwerk Meiningen gGmbH – Meiningen",
      "type": "Einreichung neuer Dokumente",
      "state": "Thüringen",
      "amtsgericht": "Amtsgericht Jena",
      "registernummer": "HRB 517739",
      "registerart": "HRB",
      "company_name": "MVZ Sozialwerk Meiningen gGmbH",
      "company_seat": "Meiningen",
      "details": "18.02.2026 (Bekanntmachungsdatum)\n\nThüringen Amtsgericht Jena HRB 517739\nEinreichung neuer Dokumente 18.02.2026 (Eintragungsdatum)\n\nMVZ Sozialwerk Meiningen gGmbH\nGesellschaft mit beschränkter Haftung\nMeiningen\n\nBekanntmachung gem. § 52 Abs. 3 Satz 2 GmbHG: Aufgrund einer Veränderung in den Personen der Aufsichtsratsmitglieder ist durch die Geschäftsführer eine neue Liste zum Handelsregister eingereicht worden."
    },
    {
      "date": "2026-02-18",
      "id": "145407",
      "original_text": "Löschungsankündigung\nThüringen Amtsgericht Jena HRB 514176\nDAHARO Verwaltungs GmbH – Sonneberg",
      "type": "Löschungsankündigung",
      "state": "Thüringen",
      "amtsgericht": "Amtsgericht Jena",
      "registernummer": "HRB 514176",
      "registerart": "HRB",
      "company_name": "DAHARO Verwaltungs GmbH",
      "company_seat": "Sonneberg",
      "details": "18.02.2026 (Bekanntmachungsdatum)\n\nThüringen Amtsgericht Jena HRB 514176\nLöschungsankündigung\n\nDAHARO Verwaltungs GmbH\nGesellschaft mit beschränkter Haftung\nSonneberg\n\nDas Registergericht beabsichtigt, die im Handelsregister eingetragene Gesellschaft wegen Vermögenslosigkeit nach § 394 FamFG von Amts wegen zu löschen. Die Frist zur Erhebung eines Widerspruchs gegen die beabsichtigte Löschung wird auf 6 Wochen festgesetzt."
    },
    {
      "date": "2026-02-18",
      "id": "145408",
      "original_text": "Löschungsankündigung\nSchleswig-Holstein Amtsgericht Lübeck HRB 14663\nAM Speditions UG (haftungsbeschränkt) – Timmendorfer Strand",
      "type": "Löschungsankündigung",
      "state": "Schleswig-Holstein",
      "amtsgericht": "Amtsgericht Lübeck",
      "registernummer": "HRB 14663",
      "registerart": "HRB",
      "company_name": "AM Speditions UG (haftungsbeschränkt)",
      "company_seat": "Timmendorfer Strand",
      "details": "18.02.2026 (Bekanntmachungsdatum)\n\nSchleswig-Holstein Amtsgericht Lübeck HRB 14663\nLöschungsankündigung\n\nAM Speditions UG (haftungsbeschränkt)\nGesellschaft mit beschränkter Haftung\nTimmendorfer Strand\n\nEs ist die Löschung der nachstehenden Gesellschaft wegen Vermögenslosigkeit gemäß § 394 FamFG beabsichtigt. Widerspruchsfrist: 1 Monat."
    },
    {
      "date": "2026-02-18",
      "id": "145409",
      "original_text": "Löschungsankündigung\nBaden-Württemberg Amtsgericht Stuttgart HRB 740408\nR&B Eins UG (haftungsbeschränkt) – Stuttgart",
      "type": "Löschungsankündigung",
      "state": "Baden-Württemberg",
      "amtsgericht": "Amtsgericht Stuttgart",
      "registernummer": "HRB 740408",
      "registerart": "HRB",
      "company_name": "R&B Eins UG (haftungsbeschränkt)",
      "company_seat": "Stuttgart",
      "details": "18.02.2026 (Bekanntmachungsdatum)\n\nBaden-Württemberg Amtsgericht Stuttgart HRB 740408\nLöschungsankündigung\n\nR&B Eins UG (haftungsbeschränkt)\nGesellschaft mit beschränkter Haftung\nStuttgart\n\nDas Gericht beabsichtigt, die Gesellschaft wegen Vermögenslosigkeit im Handelsregister von Amts wegen nach § 394 FamFG zu löschen. Die Frist zur Geltendmachung eines Widerspruchs gegen die beabsichtigte Löschung ist auf zwei Monate ab Veröffentlichung bestimmt."
    },
    {
      "date": "2026-02-18",
      "id": "145410",
      "original_text": "Registerbekanntmachung nach dem Umwandlungsgesetz\nHamburg Amtsgericht Hamburg HRB 184314\nFünfunddreißigste PMB Management SE – Hamburg",
      "type": "Registerbekanntmachung nach dem Umwandlungsgesetz",
      "state": "Hamburg",
      "amtsgericht": "Amtsgericht Hamburg",
      "registernummer": "HRB 184314",
      "registerart": "HRB",
      "company_name": "Fünfunddreißigste PMB Management SE",
      "company_seat": "Hamburg",
      "details": "18.02.2026 (Bekanntmachungsdatum)\n\nHamburg Amtsgericht Hamburg HRB 184314\nRegisterbekanntmachung nach dem Umwandlungsgesetz 18.02.2026 (Eintragungsdatum)\n\nFünfunddreißigste PMB Management SE\nEuropäische Aktiengesellschaft (SE)\nHamburg\n\nAls nicht eingetragen wird bekannt gemacht:\nDen Gläubigern der an der Verschmelzung beteiligten Gesellschaften ist, wenn sie binnen sechs Monaten nach dem Tag, an dem die Eintragung der Verschmelzung in das Register des Sitzes desjenigen Rechtsträgers, dessen Gläubiger sie sind, nach § 19 Absatz 3 UmwG als bekannt gemacht gilt, ihren Anspruch nach Grund und Höhe schriftlich anmelden, Sicherheit zu leisten, soweit sie nicht Befriedigung verlangen können. Dieses Recht steht den Gläubigern jedoch nur zu, wenn sie glaubhaft machen, dass durch die Verschmelzung die Erfüllung ihrer Forderung gefährdet wird."
    },
    {
      "date": "2026-02-18",
      "id": "145411",
      "original_text": "Registerbekanntmachung nach dem Umwandlungsgesetz\nHamburg Amtsgericht Hamburg HRB 152667\nVierunddreißigste PMB Management GmbH – Hamburg",
      "type": "Registerbekanntmachung nach dem Umwandlungsgesetz",
      "state": "Hamburg",
      "amtsgericht": "Amtsgericht Hamburg",
      "registernummer": "HRB 152667",
      "registerart": "HRB",
      "company_name": "Vierunddreißigste PMB Management GmbH",
      "company_seat": "Hamburg",
      "details": "18.02.2026 (Bekanntmachungsdatum)\n\nHamburg Amtsgericht Hamburg HRB 152667\nRegisterbekanntmachung nach dem Umwandlungsgesetz 18.02.2026 (Eintragungsdatum)\n\nVierunddreißigste PMB Management GmbH\nGesellschaft mit beschränkter Haftung\nHamburg\n\nAls nicht eingetragen wird bekannt gemacht:\nDen Gläubigern der an der Verschmelzung beteiligten Gesellschaften ist, wenn sie binnen sechs Monaten nach dem Tag, an dem die Eintragung der Verschmelzung in das Register des Sitzes desjenigen Rechtsträgers, dessen Gläubiger sie sind, nach § 19 Absatz 3 UmwG als bekannt gemacht gilt, ihren Anspruch nach Grund und Höhe schriftlich anmelden, Sicherheit zu leisten, soweit sie nicht Befriedigung verlangen können. Dieses Recht steht den Gläubigern jedoch nur zu, wenn sie glaubhaft machen, dass durch die Verschmelzung die Erfüllung ihrer Forderung gefährdet wird."
    },
    {
      "date": "2026-02-18",
      "id": "145412",
      "original_text": "Einreichung neuer Dokumente\nBerlin Amtsgericht Berlin (Charlottenburg) HRB 151206\nGERB Beteiligungs GmbH – Berlin",
      "type": "Einreichung neuer Dokumente",
      "state": "Berlin",
      "amtsgericht": "Amtsgericht Berlin (Charlottenburg)",
      "registernummer": "HRB 151206",
      "registerart": "HRB",
      "company_name": "GERB Beteiligungs GmbH",
      "company_seat": "Berlin",
      "details": "18.02.2026 (Bekanntmachungsdatum)\n\nBerlin Amtsgericht Berlin (Charlottenburg) HRB 151206\nEinreichung neuer Dokumente\n\nGERB Beteiligungs GmbH\nGesellschaft mit beschränkter Haftung\nBerlin\n\nAls nicht eingetragen wird veröffentlicht:Es wurde eine neue Liste der Aufsichtsratsmitglieder eingereicht (§52 GmbHG)."
    },
    {
      "date": "2026-02-18",
      "id": "145413",
      "original_text": "Löschungsankündigung\nBerlin Amtsgericht Berlin (Charlottenburg) HRB 249719\nBF Industries UG (haftungsbeschränkt) – Berlin",
      "type": "Löschungsankündigung",
      "state": "Berlin",
      "amtsgericht": "Amtsgericht Berlin (Charlottenburg)",
      "registernummer": "HRB 249719",
      "registerart": "HRB",
      "company_name": "BF Industries UG (haftungsbeschränkt)",
      "company_seat": "Berlin",
      "details": "18.02.2026 (Bekanntmachungsdatum)\n\nBerlin Amtsgericht Berlin (Charlottenburg) HRB 249719\nLöschungsankündigung\n\nBF Industries UG (haftungsbeschränkt)\nGesellschaft mit beschränkter Haftung\nBerlin\n\nBei der nachstehenden Gesellschaft wird das Amtslöschungsverfahren gemäß § 394 FamFG eingeleitet. Widerspruchsfrist 6 Wochen"
    },
    {
      "date": "2026-02-18",
      "id": "145414",
      "original_text": "Registerbekanntmachung nach dem Umwandlungsgesetz\nHamburg Amtsgericht Hamburg HRB 102771\nSLI Zweite Beteiligungsgesellschaft mbH – Hamburg",
      "type": "Registerbekanntmachung nach dem Umwandlungsgesetz",
      "state": "Hamburg",
      "amtsgericht": "Amtsgericht Hamburg",
      "registernummer": "HRB 102771",
      "registerart": "HRB",
      "company_name": "SLI Zweite Beteiligungsgesellschaft mbH",
      "company_seat": "Hamburg",
      "details": "18.02.2026 (Bekanntmachungsdatum)\n\nHamburg Amtsgericht Hamburg HRB 102771\nRegisterbekanntmachung nach dem Umwandlungsgesetz 18.02.2026 (Eintragungsdatum)\n\nSLI Zweite Beteiligungsgesellschaft mbH\nGesellschaft mit beschränkter Haftung\nHamburg\n\nAls nicht eingetragen wird bekannt gemacht:\nDen Gläubigern der an der Verschmelzung beteiligten Gesellschaften ist, wenn sie binnen sechs Monaten nach dem Tag, an dem die Eintragung der Verschmelzung in das Register des Sitzes desjenigen Rechtsträgers, dessen Gläubiger sie sind, nach § 19 Absatz 3 UmwG als bekannt gemacht gilt, ihren Anspruch nach Grund und Höhe schriftlich anmelden, Sicherheit zu leisten, soweit sie nicht Befriedigung verlangen können. Dieses Recht steht den Gläubigern jedoch nur zu, wenn sie glaubhaft machen, dass durch die Verschmelzung die Erfüllung ihrer Forderung gefährdet wird."
    },
    {
      "date": "2026-02-18",
      "id": "145415",
      "original_text": "Registerbekanntmachung nach dem Umwandlungsgesetz\nHamburg Amtsgericht Hamburg HRB 82966\nSchroeder & Co. Vertriebsgesellschaft mbH – Hamburg",
      "type": "Registerbekanntmachung nach dem Umwandlungsgesetz",
      "state": "Hamburg",
      "amtsgericht": "Amtsgericht Hamburg",
      "registernummer": "HRB 82966",
      "registerart": "HRB",
      "company_name": "Schroeder & Co. Vertriebsgesellschaft mbH",
      "company_seat": "Hamburg",
      "details": "18.02.2026 (Bekanntmachungsdatum)\n\nHamburg Amtsgericht Hamburg HRB 82966\nRegisterbekanntmachung nach dem Umwandlungsgesetz 18.02.2026 (Eintragungsdatum)\n\nSchroeder & Co. Vertriebsgesellschaft mbH\nGesellschaft mit beschränkter Haftung\nHamburg\n\nAls nicht eingetragen wird bekannt gemacht:\nDen Gläubigern der an der Verschmelzung beteiligten Gesellschaften ist, wenn sie binnen sechs Monaten nach dem Tag, an dem die Eintragung der Verschmelzung in das Register des Sitzes desjenigen Rechtsträgers, dessen Gläubiger sie sind, nach § 19 Absatz 3 UmwG als bekannt gemacht gilt, ihren Anspruch nach Grund und Höhe schriftlich anmelden, Sicherheit zu leisten, soweit sie nicht Befriedigung verlangen können. Dieses Recht steht den Gläubigern jedoch nur zu, wenn sie glaubhaft machen, dass durch die Verschmelzung die Erfüllung ihrer Forderung gefährdet wird."
    },
    {
      "date": "2026-02-18",
      "id": "145416",
      "original_text": "Registerbekanntmachung nach dem Umwandlungsgesetz\nHamburg Amtsgericht Hamburg HRB 100141\nSchroeder Verwaltung Logistik Investment Fonds GmbH – Hamburg",
      "type": "Registerbekanntmachung nach dem Umwandlungsgesetz",
      "state": "Hamburg",
      "amtsgericht": "Amtsgericht Hamburg",
      "registernummer": "HRB 100141",
      "registerart": "HRB",
      "company_name": "Schroeder Verwaltung Logistik Investment Fonds GmbH",
      "company_seat": "Hamburg",
      "details": "18.02.2026 (Bekanntmachungsdatum)\n\nHamburg Amtsgericht Hamburg HRB 100141\nRegisterbekanntmachung nach dem Umwandlungsgesetz 18.02.2026 (Eintragungsdatum)\n\nSchroeder Verwaltung Logistik Investment Fonds GmbH\nGesellschaft mit beschränkter Haftung\nHamburg\n\nAls nicht eingetragen wird bekannt gemacht:\nDen Gläubigern der an der Verschmelzung beteiligten Gesellschaften ist, wenn sie binnen sechs Monaten nach dem Tag, an dem die Eintragung der Verschmelzung in das Register des Sitzes desjenigen Rechtsträgers, dessen Gläubiger sie sind, nach § 19 Absatz 3 UmwG als bekannt gemacht gilt, ihren Anspruch nach Grund und Höhe schriftlich anmelden, Sicherheit zu leisten, soweit sie nicht Befriedigung verlangen können. Dieses Recht steht den Gläubigern jedoch nur zu, wenn sie glaubhaft machen, dass durch die Verschmelzung die Erfüllung ihrer Forderung gefährdet wird."
    },
    {
      "date": "2026-02-18",
      "id": "145417",
      "original_text": "Registerbekanntmachung nach dem Umwandlungsgesetz\nHamburg Amtsgericht Hamburg HRB 82966\nSchroeder & Co. Vertriebsgesellschaft mbH – Hamburg",
      "type": "Registerbekanntmachung nach dem Umwandlungsgesetz",
      "state": "Hamburg",
      "amtsgericht": "Amtsgericht Hamburg",
      "registernummer": "HRB 82966",
      "registerart": "HRB",
      "company_name": "Schroeder & Co. Vertriebsgesellschaft mbH",
      "company_seat": "Hamburg",
      "details": "18.02.2026 (Bekanntmachungsdatum)\n\nHamburg Amtsgericht Hamburg HRB 82966\nRegisterbekanntmachung nach dem Umwandlungsgesetz 18.02.2026 (Eintragungsdatum)\n\nSchroeder & Co. Vertriebsgesellschaft mbH\nGesellschaft mit beschränkter Haftung\nHamburg\n\nAls nicht eingetragen wird bekannt gemacht:\nDen Gläubigern der an der Verschmelzung beteiligten Gesellschaften ist, wenn sie binnen sechs Monaten nach dem Tag, an dem die Eintragung der Verschmelzung in das Register des Sitzes desjenigen Rechtsträgers, dessen Gläubiger sie sind, nach § 19 Absatz 3 UmwG als bekannt gemacht gilt, ihren Anspruch nach Grund und Höhe schriftlich anmelden, Sicherheit zu leisten, soweit sie nicht Befriedigung verlangen können. Dieses Recht steht den Gläubigern jedoch nur zu, wenn sie glaubhaft machen, dass durch die Verschmelzung die Erfüllung ihrer Forderung gefährdet wird."
    },
    {
      "date": "2026-02-18",
      "id": "145418",
      "original_text": "Registerbekanntmachung nach dem Umwandlungsgesetz\nBaden-Württemberg Amtsgericht Mannheim HRB 440684\nMPDV Mikrolab GmbH, Mikroprozessordatenverarbeitung und Mikroprozessorlabor – Mosbach",
      "type": "Registerbekanntmachung nach dem Umwandlungsgesetz",
      "state": "Baden-Württemberg",
      "amtsgericht": "Amtsgericht Mannheim",
      "registernummer": "HRB 440684",
      "registerart": "HRB",
      "company_name": "MPDV Mikrolab GmbH, Mikroprozessordatenverarbeitung und Mikroprozessorlabor",
      "company_seat": "Mosbach",
      "details": "18.02.2026 (Bekanntmachungsdatum)\n\nBaden-Württemberg Amtsgericht Mannheim HRB 440684\nRegisterbekanntmachung nach dem Umwandlungsgesetz 18.02.2026 (Eintragungsdatum)\n\nMPDV Mikrolab GmbH, Mikroprozessordatenverarbeitung und Mikroprozessorlabor\nGesellschaft mit beschränkter Haftung\nMosbach\n\nDen Gläubigern der an der Verschmelzung beteiligten Rechtsträger ist, wenn sie binnen sechs Monaten nach dem Tag, an dem die Eintragung der Verschmelzung in das Register des Sitzes desjenigen Rechtsträgers, dessen Gläubiger sie sind, nach § 19 Abs. 3 UmwG als bekanntgemacht gilt, ihren Anspruch nach Grund und Höhe schriftlich anmelden, Sicherheit zu leisten, soweit sie nicht Befriedigung verlangen können. Dieses Recht steht den Gläubigern jedoch nur zu, wenn sie glaubhaft machen, dass durch die Verschmelzung die Erfüllung ihrer Forderung gefährdet wird."
    },
    {
      "date": "2026-02-18",
      "id": "145419",
      "original_text": "Registerbekanntmachung nach dem Umwandlungsgesetz\nHamburg Amtsgericht Hamburg HRB 100719\nSchroeder Verwaltung Logistik Investment Zwei GmbH – Hamburg",
      "type": "Registerbekanntmachung nach dem Umwandlungsgesetz",
      "state": "Hamburg",
      "amtsgericht": "Amtsgericht Hamburg",
      "registernummer": "HRB 100719",
      "registerart": "HRB",
      "company_name": "Schroeder Verwaltung Logistik Investment Zwei GmbH",
      "company_seat": "Hamburg",
      "details": "18.02.2026 (Bekanntmachungsdatum)\n\nHamburg Amtsgericht Hamburg HRB 100719\nRegisterbekanntmachung nach dem Umwandlungsgesetz 18.02.2026 (Eintragungsdatum)\n\nSchroeder Verwaltung Logistik Investment Zwei GmbH\nGesellschaft mit beschränkter Haftung\nHamburg\n\nAls nicht eingetragen wird bekannt gemacht:\nDen Gläubigern der an der Verschmelzung beteiligten Gesellschaften ist, wenn sie binnen sechs Monaten nach dem Tag, an dem die Eintragung der Verschmelzung in das Register des Sitzes desjenigen Rechtsträgers, dessen Gläubiger sie sind, nach § 19 Absatz 3 UmwG als bekannt gemacht gilt, ihren Anspruch nach Grund und Höhe schriftlich anmelden, Sicherheit zu leisten, soweit sie nicht Befriedigung verlangen können. Dieses Recht steht den Gläubigern jedoch nur zu, wenn sie glaubhaft machen, dass durch die Verschmelzung die Erfüllung ihrer Forderung gefährdet wird."
    },
    {
      "date": "2026-02-18",
      "id": "145420",
      "original_text": "Registerbekanntmachung nach dem Umwandlungsgesetz\nHamburg Amtsgericht Hamburg HRB 82966\nSchroeder & Co. Vertriebsgesellschaft mbH – Hamburg",
      "type": "Registerbekanntmachung nach dem Umwandlungsgesetz",
      "state": "Hamburg",
      "amtsgericht": "Amtsgericht Hamburg",
      "registernummer": "HRB 82966",
      "registerart": "HRB",
      "company_name": "Schroeder & Co. Vertriebsgesellschaft mbH",
      "company_seat": "Hamburg",
      "details": "18.02.2026 (Bekanntmachungsdatum)\n\nHamburg Amtsgericht Hamburg HRB 82966\nRegisterbekanntmachung nach dem Umwandlungsgesetz 18.02.2026 (Eintragungsdatum)\n\nSchroeder & Co. Vertriebsgesellschaft mbH\nGesellschaft mit beschränkter Haftung\nHamburg\n\nAls nicht eingetragen wird bekannt gemacht:\nDen Gläubigern der an der Verschmelzung beteiligten Gesellschaften ist, wenn sie binnen sechs Monaten nach dem Tag, an dem die Eintragung der Verschmelzung in das Register des Sitzes desjenigen Rechtsträgers, dessen Gläubiger sie sind, nach § 19 Absatz 3 UmwG als bekannt gemacht gilt, ihren Anspruch nach Grund und Höhe schriftlich anmelden, Sicherheit zu leisten, soweit sie nicht Befriedigung verlangen können. Dieses Recht steht den Gläubigern jedoch nur zu, wenn sie glaubhaft machen, dass durch die Verschmelzung die Erfüllung ihrer Forderung gefährdet wird."
    },
    {
      "date": "2026-02-18",
      "id": "145421",
      "original_text": "Registerbekanntmachung nach dem Umwandlungsgesetz\nHamburg Amtsgericht Hamburg HRB 100703\nSLI Beteiligungsgesellschaft mbH – Hamburg",
      "type": "Registerbekanntmachung nach dem Umwandlungsgesetz",
      "state": "Hamburg",
      "amtsgericht": "Amtsgericht Hamburg",
      "registernummer": "HRB 100703",
      "registerart": "HRB",
      "company_name": "SLI Beteiligungsgesellschaft mbH",
      "company_seat": "Hamburg",
      "details": "18.02.2026 (Bekanntmachungsdatum)\n\nHamburg Amtsgericht Hamburg HRB 100703\nRegisterbekanntmachung nach dem Umwandlungsgesetz 18.02.2026 (Eintragungsdatum)\n\nSLI Beteiligungsgesellschaft mbH\nGesellschaft mit beschränkter Haftung\nHamburg\n\nAls nicht eingetragen wird bekannt gemacht:\nDen Gläubigern der an der Verschmelzung beteiligten Gesellschaften ist, wenn sie binnen sechs Monaten nach dem Tag, an dem die Eintragung der Verschmelzung in das Register des Sitzes desjenigen Rechtsträgers, dessen Gläubiger sie sind, nach § 19 Absatz 3 UmwG als bekannt gemacht gilt, ihren Anspruch nach Grund und Höhe schriftlich anmelden, Sicherheit zu leisten, soweit sie nicht Befriedigung verlangen können. Dieses Recht steht den Gläubigern jedoch nur zu, wenn sie glaubhaft machen, dass durch die Verschmelzung die Erfüllung ihrer Forderung gefährdet wird."
    },
    {
      "date": "2026-02-18",
      "id": "145422",
      "original_text": "Registerbekanntmachung nach dem Umwandlungsgesetz\nHamburg Amtsgericht Hamburg HRB 82966\nSchroeder & Co. Vertriebsgesellschaft mbH – Hamburg",
      "type": "Registerbekanntmachung nach dem Umwandlungsgesetz",
      "state": "Hamburg",
      "amtsgericht": "Amtsgericht Hamburg",
      "registernummer": "HRB 82966",
      "registerart": "HRB",
      "company_name": "Schroeder & Co. Vertriebsgesellschaft mbH",
      "company_seat": "Hamburg",
      "details": "18.02.2026 (Bekanntmachungsdatum)\n\nHamburg Amtsgericht Hamburg HRB 82966\nRegisterbekanntmachung nach dem Umwandlungsgesetz 18.02.2026 (Eintragungsdatum)\n\nSchroeder & Co. Vertriebsgesellschaft mbH\nGesellschaft mit beschränkter Haftung\nHamburg\n\nAls nicht eingetragen wird bekannt gemacht:\nDen Gläubigern der an der Verschmelzung beteiligten Gesellschaften ist, wenn sie binnen sechs Monaten nach dem Tag, an dem die Eintragung der Verschmelzung in das Register des Sitzes desjenigen Rechtsträgers, dessen Gläubiger sie sind, nach § 19 Absatz 3 UmwG als bekannt gemacht gilt, ihren Anspruch nach Grund und Höhe schriftlich anmelden, Sicherheit zu leisten, soweit sie nicht Befriedigung verlangen können. Dieses Recht steht den Gläubigern jedoch nur zu, wenn sie glaubhaft machen, dass durch die Verschmelzung die Erfüllung ihrer Forderung gefährdet wird."
    },
    {
      "date": "2026-02-18",
      "id": "145423",
      "original_text": "Löschungsankündigung\nSchleswig-Holstein Amtsgericht Flensburg HRB 6168\nHSL Wind Verwaltungs GmbH – Harrislee",
      "type": "Löschungsankündigung",
      "state": "Schleswig-Holstein",
      "amtsgericht": "Amtsgericht Flensburg",
      "registernummer": "HRB 6168",
      "registerart": "HRB",
      "company_name": "HSL Wind Verwaltungs GmbH",
      "company_seat": "Harrislee",
      "details": "18.02.2026 (Bekanntmachungsdatum)\n\nSchleswig-Holstein Amtsgericht Flensburg HRB 6168\nLöschungsankündigung\n\nHSL Wind Verwaltungs GmbH\nGesellschaft mit beschränkter Haftung\nHarrislee\n\nEs ist die Löschung der nachstehenden Gesellschaft wegen Vermögenslosigkeit gemäß § 394 FamFG beabsichtigt.\nWiderspruchsfrist: 2 Monate."
    },
    {
      "date": "2026-02-18",
      "id": "145424",
      "original_text": "Einreichung neuer Dokumente\nHamburg Amtsgericht Hamburg HRB 191315\nNovadrives SE – Hamburg",
      "type": "Einreichung neuer Dokumente",
      "state": "Hamburg",
      "amtsgericht": "Amtsgericht Hamburg",
      "registernummer": "HRB 191315",
      "registerart": "HRB",
      "company_name": "Novadrives SE",
      "company_seat": "Hamburg",
      "details": "18.02.2026 (Bekanntmachungsdatum)\n\nHamburg Amtsgericht Hamburg HRB 191315\nEinreichung neuer Dokumente 17.02.2026 (Eintragungsdatum)\n\nNovadrives SE\nEuropäische Aktiengesellschaft (SE)\nHamburg\n\nAls nicht eingetragen wird bekannt gemacht: Liste des Verwaltungsrats wurde eingereicht."
    },
    {
      "date": "2026-02-18",
      "id": "145425",
      "original_text": "Löschungsankündigung\nNordrhein-Westfalen Amtsgericht Coesfeld HRB 22445\nLuxurycarrentalsnl UG (haftungsbeschränkt) – Gronau",
      "type": "Löschungsankündigung",
      "state": "Nordrhein-Westfalen",
      "amtsgericht": "Amtsgericht Coesfeld",
      "registernummer": "HRB 22445",
      "registerart": "HRB",
      "company_name": "Luxurycarrentalsnl UG (haftungsbeschränkt)",
      "company_seat": "Gronau",
      "details": "18.02.2026 (Bekanntmachungsdatum)\n\nNordrhein-Westfalen Amtsgericht Coesfeld HRB 22445\nLöschungsankündigung\n\nLuxurycarrentalsnl UG (haftungsbeschränkt)\nGesellschaft mit beschränkter Haftung\nGronau\n\nDas Registergericht beabsichtigt, den Rechtsträger wegen Vermögenslosigkeit gemäß § 394 FamFG von Amts wegen zu löschen.\n\nGegen diese Verfügung kann Widerspruch eingelegt werden. Die Frist zur Erhebung eines Widerspruchs gegen die beabsichtigte Löschung ist auf zwei Monate ab Veröffentlichung festgesetzt."
    },
    {
      "date": "2026-02-18",
      "id": "145426",
      "original_text": "Löschungsankündigung\nSchleswig-Holstein Amtsgericht Kiel HRB 23258\nCryptoKux UG (haftungsbeschränkt) – Kiel",
      "type": "Löschungsankündigung",
      "state": "Schleswig-Holstein",
      "amtsgericht": "Amtsgericht Kiel",
      "registernummer": "HRB 23258",
      "registerart": "HRB",
      "company_name": "CryptoKux UG (haftungsbeschränkt)",
      "company_seat": "Kiel",
      "details": "18.02.2026 (Bekanntmachungsdatum)\n\nSchleswig-Holstein Amtsgericht Kiel HRB 23258\nLöschungsankündigung\n\nCryptoKux UG (haftungsbeschränkt)\nGesellschaft mit beschränkter Haftung\nKiel\n\nEs ist die Löschung der nachstehenden Gesellschaft wegen Vermögenslosigkeit gemäß § 394 FamFG beabsichtigt. Widerspruchsfrist: 2 Monate."
    },
    {
      "date": "2026-02-18",
      "id": "145427",
      "original_text": "Löschungsankündigung\nBrandenburg Amtsgericht Potsdam HRB 29485\nIBBG mbH – Falkensee",
      "type": "Löschungsankündigung",
      "state": "Brandenburg",
      "amtsgericht": "Amtsgericht Potsdam",
      "registernummer": "HRB 29485",
      "registerart": "HRB",
      "company_name": "IBBG mbH",
      "company_seat": "Falkensee",
      "details": "18.02.2026 (Bekanntmachungsdatum)\n\nBrandenburg Amtsgericht Potsdam HRB 29485\nLöschungsankündigung\n\nIBBG mbH\nGesellschaft mit beschränkter Haftung\nFalkensee\n\nBei der nachstehenden Gesellschaft wird das Amtslöschungsverfahren gemäß § 394 FamFG eingeleitet."
    },
    {
      "date": "2026-02-18",
      "id": "145428",
      "original_text": "Einreichung neuer Dokumente\nBerlin Amtsgericht Berlin (Charlottenburg) HRB 80443\nBundesdruckerei Gruppe GmbH – Berlin",
      "type": "Einreichung neuer Dokumente",
      "state": "Berlin",
      "amtsgericht": "Amtsgericht Berlin (Charlottenburg)",
      "registernummer": "HRB 80443",
      "registerart": "HRB",
      "company_name": "Bundesdruckerei Gruppe GmbH",
      "company_seat": "Berlin",
      "details": "18.02.2026 (Bekanntmachungsdatum)\n\nBerlin Amtsgericht Berlin (Charlottenburg) HRB 80443\nEinreichung neuer Dokumente\n\nBundesdruckerei Gruppe GmbH\nGesellschaft mit beschränkter Haftung\nBerlin\n\nAls nicht eingetragen wird veröffentlicht: Es wurde eine neue Liste der Aufsichtsratsmitglieder eingereicht (§52 GmbHG)."
    },
    {
      "date": "2026-02-18",
      "id": "145429",
      "original_text": "Löschungsankündigung\nBerlin Amtsgericht Berlin (Charlottenburg) HRB 150136\nLENNA Management GmbH – Berlin",
      "type": "Löschungsankündigung",
      "state": "Berlin",
      "amtsgericht": "Amtsgericht Berlin (Charlottenburg)",
      "registernummer": "HRB 150136",
      "registerart": "HRB",
      "company_name": "LENNA Management GmbH",
      "company_seat": "Berlin",
      "details": "18.02.2026 (Bekanntmachungsdatum)\n\nBerlin Amtsgericht Berlin (Charlottenburg) HRB 150136\nLöschungsankündigung\n\nLENNA Management GmbH\nGesellschaft mit beschränkter Haftung\nBerlin\n\nBei der nachstehenden Gesellschaft wird das Amtslöschungsverfahren gemäß § 394 FamFG eingeleitet. Widerspruchsfrist 6 Wochen"
    },
    {
      "date": "2026-02-18",
      "id": "145430",
      "original_text": "Registerbekanntmachung nach dem Umwandlungsgesetz\nBaden-Württemberg Amtsgericht Mannheim HRA 360356\nKaufhaus Schneider KG – Ettlingen",
      "type": "Registerbekanntmachung nach dem Umwandlungsgesetz",
      "state": "Baden-Württemberg",
      "amtsgericht": "Amtsgericht Mannheim",
      "registernummer": "HRA 360356",
      "registerart": "HRA",
      "company_name": "Kaufhaus Schneider KG",
      "company_seat": "Ettlingen",
      "details": "18.02.2026 (Bekanntmachungsdatum)\n\nBaden-Württemberg Amtsgericht Mannheim HRA 360356\nRegisterbekanntmachung nach dem Umwandlungsgesetz 18.02.2026 (Eintragungsdatum)\n\nKaufhaus Schneider KG\nKommanditgesellschaft\nEttlingen\n\nAls nicht eingetragen wird bekanntgemacht:\nDen Gläubigern der an der Verschmelzung beteiligten Rechtsträger ist, wenn sie binnen sechs Monaten nach dem Tag, an dem die Eintragung der Verschmelzung in das Register des Sitzes desjenigen Rechtsträgers, dessen Gläubiger sie sind, nach § 19 Abs. 3 UmwG als bekanntgemacht gilt, ihren Anspruch nach Grund und Höhe schriftlich anmelden, Sicherheit zu leisten, soweit sie nicht Befriedigung verlangen können. Dieses Recht steht den Gläubigern jedoch nur zu, wenn sie glaubhaft machen, dass durch die Verschmelzung die Erfüllung ihrer Forderung gefährdet wird."
    },
    {
      "date": "2026-02-18",
      "id": "145431",
      "original_text": "Löschungsankündigung\nBaden-Württemberg Amtsgericht Ulm HRB 725837\nYeah & Boi GmbH – Aalen",
      "type": "Löschungsankündigung",
      "state": "Baden-Württemberg",
      "amtsgericht": "Amtsgericht Ulm",
      "registernummer": "HRB 725837",
      "registerart": "HRB",
      "company_name": "Yeah & Boi GmbH",
      "company_seat": "Aalen",
      "details": "18.02.2026 (Bekanntmachungsdatum)\n\nBaden-Württemberg Amtsgericht Ulm HRB 725837\nLöschungsankündigung\n\nYeah & Boi GmbH\nGesellschaft mit beschränkter Haftung\nAalen\n\nAls nicht eingetragen wird bekanntgemacht:\nDas Gericht beabsichtigt, die Gesellschaft wegen Vermögenslosigkeit im Handelsregister von Amts wegen nach § 394 FamFG zu löschen. Die Frist zur Geltendmachung eines Widerspruchs gegen die beabsichtigte Löschung ist auf  einen Monat ab Veröffentlichung bestimmt."
    },
    {
      "date": "2026-02-18",
      "id": "145432",
      "original_text": "Löschungsankündigung\nBrandenburg Amtsgericht Potsdam HRB 34655\nVITO GmbH – Blankenfelde-Mahlow",
      "type": "Löschungsankündigung",
      "state": "Brandenburg",
      "amtsgericht": "Amtsgericht Potsdam",
      "registernummer": "HRB 34655",
      "registerart": "HRB",
      "company_name": "VITO GmbH",
      "company_seat": "Blankenfelde-Mahlow",
      "details": "18.02.2026 (Bekanntmachungsdatum)\n\nBrandenburg Amtsgericht Potsdam HRB 34655\nLöschungsankündigung\n\nVITO GmbH\nGesellschaft mit beschränkter Haftung\nBlankenfelde-Mahlow\n\nBei der nachstehenden Gesellschaft wird das Amtslöschungsverfahren gemäß § 394 FamFG eingeleitet."
    },
    {
      "date": "2026-02-18",
      "id": "145433",
      "original_text": "Löschungsankündigung\nBerlin Amtsgericht Berlin (Charlottenburg) HRB 166137\nTehbau GmbH – Berlin",
      "type": "Löschungsankündigung",
      "state": "Berlin",
      "amtsgericht": "Amtsgericht Berlin (Charlottenburg)",
      "registernummer": "HRB 166137",
      "registerart": "HRB",
      "company_name": "Tehbau GmbH",
      "company_seat": "Berlin",
      "details": "18.02.2026 (Bekanntmachungsdatum)\n\nBerlin Amtsgericht Berlin (Charlottenburg) HRB 166137\nLöschungsankündigung\n\nTehbau GmbH\nGesellschaft mit beschränkter Haftung\nBerlin\n\nBei der nachstehenden Gesellschaft wird das Amtslöschungsverfahren gemäß § 394 FamFG eingeleitet. Widerspruchsfrist 6 Wochen"
    },
    {
      "date": "2026-02-18",
      "id": "145434",
      "original_text": "Löschungsankündigung\nSchleswig-Holstein Amtsgericht Pinneberg HRB 15953\nWohnen und Leben Norddeutsche Grundstücksgesellschaft mbH – Breitenburg",
      "type": "Löschungsankündigung",
      "state": "Schleswig-Holstein",
      "amtsgericht": "Amtsgericht Pinneberg",
      "registernummer": "HRB 15953",
      "registerart": "HRB",
      "company_name": "Wohnen und Leben Norddeutsche Grundstücksgesellschaft mbH",
      "company_seat": "Breitenburg",
      "details": "18.02.2026 (Bekanntmachungsdatum)\n\nSchleswig-Holstein Amtsgericht Pinneberg HRB 15953\nLöschungsankündigung\n\nWohnen und Leben Norddeutsche Grundstücksgesellschaft mbH\nGesellschaft mit beschränkter Haftung\nBreitenburg\n\nEs ist die Löschung der nachstehenden Gesellschaft wegen Vermögenslosigkeit gemäß § 394 FamFG beabsichtigt. Widerspruchsfrist: 2 Monate."
    },
    {
      "date": "2026-02-18",
      "id": "145435",
      "original_text": "Löschungsankündigung\nBerlin Amtsgericht Berlin (Charlottenburg) HRB 176136\nSecon food GmbH – Berlin",
      "type": "Löschungsankündigung",
      "state": "Berlin",
      "amtsgericht": "Amtsgericht Berlin (Charlottenburg)",
      "registernummer": "HRB 176136",
      "registerart": "HRB",
      "company_name": "Secon food GmbH",
      "company_seat": "Berlin",
      "details": "18.02.2026 (Bekanntmachungsdatum)\n\nBerlin Amtsgericht Berlin (Charlottenburg) HRB 176136\nLöschungsankündigung\n\nSecon food GmbH\nGesellschaft mit beschränkter Haftung\nBerlin\n\nBei der nachstehenden Gesellschaft wird das Amtslöschungsverfahren gemäß § 394 FamFG eingeleitet. Widerspruchsfrist 6 Wochen"
    },
    {
      "date": "2026-02-18",
      "id": "145436",
      "original_text": "Einreichung neuer Dokumente\nBerlin Amtsgericht Berlin (Charlottenburg) HRB 173825\nLOCON LOGISTIK & CONSULTING AKTIENGESELLSCHAFT – Berlin",
      "type": "Einreichung neuer Dokumente",
      "state": "Berlin",
      "amtsgericht": "Amtsgericht Berlin (Charlottenburg)",
      "registernummer": "HRB 173825",
      "registerart": "HRB",
      "company_name": "LOCON LOGISTIK & CONSULTING AKTIENGESELLSCHAFT",
      "company_seat": "Berlin",
      "details": "18.02.2026 (Bekanntmachungsdatum)\n\nBerlin Amtsgericht Berlin (Charlottenburg) HRB 173825\nEinreichung neuer Dokumente\n\nLOCON LOGISTIK & CONSULTING AKTIENGESELLSCHAFT\nAktiengesellschaft\nBerlin\n\nAls nicht eingetragen wird veröffentlicht:\nEs wurde eine neue Liste der Aufsichtsratsmitglieder eingereicht (§ 106 AktG)."
    },
    {
      "date": "2026-02-18",
      "id": "145437",
      "original_text": "Löschungsankündigung\nBrandenburg Amtsgericht Potsdam HRB 40265\nPL Premium Security GmbH – Potsdam",
      "type": "Löschungsankündigung",
      "state": "Brandenburg",
      "amtsgericht": "Amtsgericht Potsdam",
      "registernummer": "HRB 40265",
      "registerart": "HRB",
      "company_name": "PL Premium Security GmbH",
      "company_seat": "Potsdam",
      "details": "18.02.2026 (Bekanntmachungsdatum)\n\nBrandenburg Amtsgericht Potsdam HRB 40265\nLöschungsankündigung\n\nPL Premium Security GmbH\nGesellschaft mit beschränkter Haftung\nPotsdam\n\nBei der nachstehenden Gesellschaft wird das Amtslöschungsverfahren gemäß § 394 FamFG eingeleitet."
    },
    {
      "date": "2026-02-18",
      "id": "145438",
      "original_text": "Registerbekanntmachung nach dem Umwandlungsgesetz\nHamburg Amtsgericht Hamburg HRB 188005\nMikado Media GmbH – Hamburg",
      "type": "Registerbekanntmachung nach dem Umwandlungsgesetz",
      "state": "Hamburg",
      "amtsgericht": "Amtsgericht Hamburg",
      "registernummer": "HRB 188005",
      "registerart": "HRB",
      "company_name": "Mikado Media GmbH",
      "company_seat": "Hamburg",
      "details": "18.02.2026 (Bekanntmachungsdatum)\n\nHamburg Amtsgericht Hamburg HRB 188005\nRegisterbekanntmachung nach dem Umwandlungsgesetz 18.02.2026 (Eintragungsdatum)\n\nMikado Media GmbH\nGesellschaft mit beschränkter Haftung\nHamburg\n\nAls nicht eingetragen wird bekannt gemacht:\nDen Gläubigern der an der Verschmelzung beteiligten Gesellschaften ist, wenn sie binnen sechs Monaten nach dem Tag, an dem die Eintragung der Verschmelzung in das Register des Sitzes desjenigen Rechtsträgers, dessen Gläubiger sie sind, nach § 19 Absatz 3 UmwG als bekannt gemacht gilt, ihren Anspruch nach Grund und Höhe schriftlich anmelden, Sicherheit zu leisten, soweit sie nicht Befriedigung verlangen können. Dieses Recht steht den Gläubigern jedoch nur zu, wenn sie glaubhaft machen, dass durch die Verschmelzung die Erfüllung ihrer Forderung gefährdet wird."
    },
    {
      "date": "2026-02-18",
      "id": "145439",
      "original_text": "Registerbekanntmachung nach dem Umwandlungsgesetz\nHamburg Amtsgericht Hamburg HRB 92517\nJürgen Hunke Verwaltungs GmbH – Hamburg",
      "type": "Registerbekanntmachung nach dem Umwandlungsgesetz",
      "state": "Hamburg",
      "amtsgericht": "Amtsgericht Hamburg",
      "registernummer": "HRB 92517",
      "registerart": "HRB",
      "company_name": "Jürgen Hunke Verwaltungs GmbH",
      "company_seat": "Hamburg",
      "details": "18.02.2026 (Bekanntmachungsdatum)\n\nHamburg Amtsgericht Hamburg HRB 92517\nRegisterbekanntmachung nach dem Umwandlungsgesetz 18.02.2026 (Eintragungsdatum)\n\nJürgen Hunke Verwaltungs GmbH\nGesellschaft mit beschränkter Haftung\nHamburg\n\nAls nicht eingetragen wird bekannt gemacht:\nDen Gläubigern der an der Verschmelzung beteiligten Gesellschaften ist, wenn sie binnen sechs Monaten nach dem Tag, an dem die Eintragung der Verschmelzung in das Register des Sitzes desjenigen Rechtsträgers, dessen Gläubiger sie sind, nach § 19 Absatz 3 UmwG als bekannt gemacht gilt, ihren Anspruch nach Grund und Höhe schriftlich anmelden, Sicherheit zu leisten, soweit sie nicht Befriedigung verlangen können. Dieses Recht steht den Gläubigern jedoch nur zu, wenn sie glaubhaft machen, dass durch die Verschmelzung die Erfüllung ihrer Forderung gefährdet wird."
    },
    {
      "date": "2026-02-18",
      "id": "145440",
      "original_text": "Löschungsankündigung\nSachsen Amtsgericht Dresden HRB 19915\nKlemm Immobilien GmbH – Riesa",
      "type": "Löschungsankündigung",
      "state": "Sachsen",
      "amtsgericht": "Amtsgericht Dresden",
      "registernummer": "HRB 19915",
      "registerart": "HRB",
      "company_name": "Klemm Immobilien GmbH",
      "company_seat": "Riesa",
      "details": "18.02.2026 (Bekanntmachungsdatum)\n\nSachsen Amtsgericht Dresden HRB 19915\nLöschungsankündigung\n\nKlemm Immobilien GmbH\nGesellschaft mit beschränkter Haftung\nRiesa\n\nDas Registergericht beabsichtigt, die im Handelsregister eingetragene Gesellschaft von Amts wegen nach § 394 FamFG zu löschen. Die Frist zu Erhebung eines Widerspruchs gegen die beabsichtigte Löschung wird auf einen Monat festgesetzt."
    },
    {
      "date": "2026-02-18",
      "id": "145441",
      "original_text": "Löschungsankündigung\nBrandenburg Amtsgericht Potsdam HRB 23855\nAcademy of holistic medicine Akademie für ganzheitliche Medizin UG (haftungsbeschränkt) – Falkensee",
      "type": "Löschungsankündigung",
      "state": "Brandenburg",
      "amtsgericht": "Amtsgericht Potsdam",
      "registernummer": "HRB 23855",
      "registerart": "HRB",
      "company_name": "Academy of holistic medicine Akademie für ganzheitliche Medizin UG (haftungsbeschränkt)",
      "company_seat": "Falkensee",
      "details": "18.02.2026 (Bekanntmachungsdatum)\n\nBrandenburg Amtsgericht Potsdam HRB 23855\nLöschungsankündigung\n\nAcademy of holistic medicine Akademie für ganzheitliche Medizin UG (haftungsbeschränkt)\nGesellschaft mit beschränkter Haftung\nFalkensee\n\nBei der nachstehenden Gesellschaft wird das Amtslöschungsverfahren gemäß § 394 FamFG eingeleitet."
    },
    {
      "date": "2026-02-18",
      "id": "145442",
      "original_text": "Löschungsankündigung\nNiedersachsen Amtsgericht Hildesheim HRB 3555\nSelco Maschinenelemente GmbH – Giesen",
      "type": "Löschungsankündigung",
      "state": "Niedersachsen",
      "amtsgericht": "Amtsgericht Hildesheim",
      "registernummer": "HRB 3555",
      "registerart": "HRB",
      "company_name": "Selco Maschinenelemente GmbH",
      "company_seat": "Giesen",
      "details": "18.02.2026 (Bekanntmachungsdatum)\n\nNiedersachsen Amtsgericht Hildesheim HRB 3555\nLöschungsankündigung\n\nSelco Maschinenelemente GmbH\nGesellschaft mit beschränkter Haftung\nGiesen\n\nDas Registergericht beabsichtigt, die Gesellschaft von Amts wegen nach § 394 FamFG zu löschen. Die Frist zur Erhebung eines Widerspruchs ist auf 1 Monat ab dieser Registerbekanntmachung festgesetzt."
    },
    {
      "date": "2026-02-18",
      "id": "145443",
      "original_text": "Registerbekanntmachung nach dem Umwandlungsgesetz\nNiedersachsen Amtsgericht Hannover GsR 426\nRöbeck Immobilien eGbR – Hannover",
      "type": "Registerbekanntmachung nach dem Umwandlungsgesetz",
      "state": "Niedersachsen",
      "amtsgericht": "Amtsgericht Hannover",
      "registernummer": "GsR 426",
      "registerart": "GsR",
      "company_name": "Röbeck Immobilien eGbR",
      "company_seat": "Hannover",
      "details": "18.02.2026 (Bekanntmachungsdatum)\n\nNiedersachsen Amtsgericht Hannover GsR 426\nRegisterbekanntmachung nach dem Umwandlungsgesetz 18.02.2026 (Eintragungsdatum)\n\nRöbeck Immobilien eGbR\nGesellschaft bürgerlichen Rechts\nHannover\n\nDen Gläubigern der an der formwechselnden Umwandlung beteiligten Rechtsträger ist, wenn sie binnen sechs Monaten nach dem Tag, an dem die Eintragung der Umwandlung in das Register des Sitzes desjenigen Rechtsträgers, dessen Gläubiger sie sind, nach § 19 Abs. 3 UmwG als bekannt gemacht gilt, ihren Anspruch nach Grund und Höhe schriftlich anmelden, Sicherheit zu leisten, soweit sie nicht Befriedigung verlangen können. Dieses Recht steht den Gläubigern jedoch nur zu, wenn sie glaubhaft machen, dass durch die formwechselnde Umwandlung die Erfüllung der Forderung gefährdet wird."
    },
    {
      "date": "2026-02-18",
      "id": "145444",
      "original_text": "Sonstige Registerbekanntmachung\nNiedersachsen Amtsgericht Hannover HRB 210076\nmiovent AG – Hannover",
      "type": "Sonstige Registerbekanntmachung",
      "state": "Niedersachsen",
      "amtsgericht": "Amtsgericht Hannover",
      "registernummer": "HRB 210076",
      "registerart": "HRB",
      "company_name": "miovent AG",
      "company_seat": "Hannover",
      "details": "18.02.2026 (Bekanntmachungsdatum)\n\nNiedersachsen Amtsgericht Hannover HRB 210076\nSonstige Registerbekanntmachung\n\nmiovent AG\nAktiengesellschaft\nHannover\n\nDie Liste der Mitglieder des Aufsichtsrats wurde beim Registergericht eingereicht."
    },
    {
      "date": "2026-02-18",
      "id": "145445",
      "original_text": "Registerbekanntmachung nach dem Umwandlungsgesetz\nNiedersachsen Amtsgericht Hannover HRB 230236\nRöbeck Immobilien GmbH – Hannover",
      "type": "Registerbekanntmachung nach dem Umwandlungsgesetz",
      "state": "Niedersachsen",
      "amtsgericht": "Amtsgericht Hannover",
      "registernummer": "HRB 230236",
      "registerart": "HRB",
      "company_name": "Röbeck Immobilien GmbH",
      "company_seat": "Hannover",
      "details": "18.02.2026 (Bekanntmachungsdatum)\n\nNiedersachsen Amtsgericht Hannover HRB 230236\nRegisterbekanntmachung nach dem Umwandlungsgesetz 18.02.2026 (Eintragungsdatum)\n\nRöbeck Immobilien GmbH\nGesellschaft mit beschränkter Haftung\nHannover\n\nDen Gläubigern der an der formwechselnden Umwandlung beteiligten Rechtsträger ist, wenn sie binnen sechs Monaten nach dem Tag, an dem die Eintragung der Umwandlung in das Register des Sitzes desjenigen Rechtsträgers, dessen Gläubiger sie sind, nach § 19 Abs. 3 UmwG als bekannt gemacht gilt, ihren Anspruch nach Grund und Höhe schriftlich anmelden, Sicherheit zu leisten, soweit sie nicht Befriedigung verlangen können. Dieses Recht steht den Gläubigern jedoch nur zu, wenn sie glaubhaft machen, dass durch die formwechselnde Umwandlung die Erfüllung der Forderung gefährdet wird."
    },
    {
      "date": "2026-02-18",
      "id": "145446",
      "original_text": "Löschungsankündigung\nNiedersachsen Amtsgericht Osnabrück VR 100461\nTouristikverein Freren-Lengerich-Spelle – Freren",
      "type": "Löschungsankündigung",
      "state": "Niedersachsen",
      "amtsgericht": "Amtsgericht Osnabrück",
      "registernummer": "VR 100461",
      "registerart": "VR",
      "company_name": "Touristikverein Freren-Lengerich-Spelle",
      "company_seat": "Freren",
      "details": "18.02.2026 (Bekanntmachungsdatum)\n\nNiedersachsen Amtsgericht Osnabrück VR 100461\nLöschungsankündigung\n\nTouristikverein Freren-Lengerich-Spelle\neingetragener Verein\nFreren\n\nDas Registergericht beabsichtigt, den Verein infolge Wegfalls aller Mitglieder von Amts wegen nach § 395 FamFG zu löschen. Die Frist zur Erhebung eines Widerspruchs ist auf 1 Monat ab dieser Registerbekanntmachung festgesetzt."
    },
    {
      "date": "2026-02-18",
      "id": "145447",
      "original_text": "Registerbekanntmachung nach dem Umwandlungsgesetz\nNiedersachsen Amtsgericht Tostedt HRB 206712\nSUNSET X GmbH – Geestland",
      "type": "Registerbekanntmachung nach dem Umwandlungsgesetz",
      "state": "Niedersachsen",
      "amtsgericht": "Amtsgericht Tostedt",
      "registernummer": "HRB 206712",
      "registerart": "HRB",
      "company_name": "SUNSET X GmbH",
      "company_seat": "Geestland",
      "details": "18.02.2026 (Bekanntmachungsdatum)\n\nNiedersachsen Amtsgericht Tostedt HRB 206712\nRegisterbekanntmachung nach dem Umwandlungsgesetz 18.02.2026 (Eintragungsdatum)\n\nSUNSET X GmbH\nGesellschaft mit beschränkter Haftung\nGeestland\n\nDen Gläubigern der an der Verschmelzung beteiligten Rechtsträger ist, wenn sie binnen sechs Monaten nach dem Tag, an dem die Eintragung der Verschmelzung in das Register des Sitzes desjenigen Rechtsträgers, dessen Gläubiger sie sind, nach § 19  Abs.  3 UmwG als bekannt gemacht gilt, ihren Anspruch nach Grund und Höhe schriftlich anmelden, Sicherheit zu leisten, soweit sie nicht Befriedigung verlangen können. Dieses Recht steht den Gläubigern jedoch nur zu, wenn sie glaubhaft machen, dass durch die Verschmelzung die Erfüllung der Forderung gefährdet wird."
    },
    {
      "date": "2026-02-18",
      "id": "145448",
      "original_text": "Sonstige Registerbekanntmachung\nNiedersachsen Amtsgericht Hannover HRB 110532 früher Amtsgericht Neustadt a. Rbge. (Neustadt)\nStadtwerke Garbsen GmbH – Garbsen",
      "type": "Sonstige Registerbekanntmachung",
      "state": "Niedersachsen",
      "amtsgericht": "Amtsgericht Hannover",
      "registernummer": "HRB 110532",
      "registerart": "HRB",
      "company_name": "Stadtwerke Garbsen GmbH",
      "company_seat": "Garbsen",
      "former_amtsgericht": "Neustadt a. Rbge. (Neustadt)",
      "details": "18.02.2026 (Bekanntmachungsdatum)\n\nNiedersachsen Amtsgericht Hannover HRB 110532 früher Amtsgericht Neustadt a. Rbge. (Neustadt)\nSonstige Registerbekanntmachung\n\nStadtwerke Garbsen GmbH\nGesellschaft mit beschränkter Haftung\nGarbsen\n\nDie Liste der Mitglieder des Aufsichtsrats wurde beim Registergericht eingereicht."
    },
    {
      "date": "2026-02-18",
      "id": "145449",
      "original_text": "Registerbekanntmachung nach dem Umwandlungsgesetz\nNiedersachsen Amtsgericht Lüneburg HRB 210205\nFax.de Verwaltungs GmbH – Seevetal",
      "type": "Registerbekanntmachung nach dem Umwandlungsgesetz",
      "state": "Niedersachsen",
      "amtsgericht": "Amtsgericht Lüneburg",
      "registernummer": "HRB 210205",
      "registerart": "HRB",
      "company_name": "Fax.de Verwaltungs GmbH",
      "company_seat": "Seevetal",
      "details": "18.02.2026 (Bekanntmachungsdatum)\n\nNiedersachsen Amtsgericht Lüneburg HRB 210205\nRegisterbekanntmachung nach dem Umwandlungsgesetz 18.02.2026 (Eintragungsdatum)\n\nFax.de Verwaltungs GmbH\nGesellschaft mit beschränkter Haftung\nSeevetal\n\nDen Gläubigern der an der Verschmelzung beteiligten Rechtsträger ist, wenn sie binnen sechs Monaten nach dem Tag, an dem die Eintragung der Verschmelzung in das Register des Sitzes desjenigen Rechtsträgers, dessen Gläubiger sie sind, nach § 19  Abs.  3 UmwG als bekannt gemacht gilt, ihren Anspruch nach Grund und Höhe schriftlich anmelden, Sicherheit zu leisten, soweit sie nicht Befriedigung verlangen können. Dieses Recht steht den Gläubigern jedoch nur zu, wenn sie glaubhaft machen, dass durch die Verschmelzung die Erfüllung der Forderung gefährdet wird."
    },
    {
      "date": "2026-02-18",
      "id": "145450",
      "original_text": "Sonstige Registerbekanntmachung\nRheinland-Pfalz Amtsgericht Wittlich HRB 44785\nDigital 1A GmbH – Daun",
      "type": "Sonstige Registerbekanntmachung",
      "state": "Rheinland-Pfalz",
      "amtsgericht": "Amtsgericht Wittlich",
      "registernummer": "HRB 44785",
      "registerart": "HRB",
      "company_name": "Digital 1A GmbH",
      "company_seat": "Daun",
      "details": "18.02.2026 (Bekanntmachungsdatum)\n\nRheinland-Pfalz Amtsgericht Wittlich HRB 44785\nSonstige Registerbekanntmachung 18.02.2026 (Eintragungsdatum)\n\nDigital 1A GmbH\nGesellschaft mit beschränkter Haftung\nDaun\n\nAls nicht eingetragen wird veröffentlicht: Den Gläubigern der Gesellschaft, deren Forderungen begründet worden sind, bevor die Eintragung der Beendigung des Ergebnisabführungsvertrages in das Handelsregister nach § 10 des Handelsgesetzbuches als bekanntgemacht gilt, hat der andere Vertragsteil Sicherheit zu leisten, wenn sie sich binnen sechs Monaten nach der Bekanntmachung der Eintragung zu diesem Zweck bei ihm melden."
    },
    {
      "date": "2026-02-18",
      "id": "145451",
      "original_text": "Registerbekanntmachung nach dem Umwandlungsgesetz\nRheinland-Pfalz Amtsgericht Koblenz VR 3271\n\"IHK-Akademie Koblenz e.V.\" - Bildungseinrichtung der Industrie- und Handelskammer Koblenz - – Koblenz",
      "type": "Registerbekanntmachung nach dem Umwandlungsgesetz",
      "state": "Rheinland-Pfalz",
      "amtsgericht": "Amtsgericht Koblenz",
      "registernummer": "VR 3271",
      "registerart": "VR",
      "company_name": "\"IHK-Akademie Koblenz e.V.\" - Bildungseinrichtung der Industrie- und Handelskammer Koblenz -",
      "company_seat": "Koblenz",
      "details": "18.02.2026 (Bekanntmachungsdatum)\n\nRheinland-Pfalz Amtsgericht Koblenz VR 3271\nRegisterbekanntmachung nach dem Umwandlungsgesetz 18.02.2026 (Eintragungsdatum)\n\n\"IHK-Akademie Koblenz e.V.\" - Bildungseinrichtung der Industrie- und Handelskammer Koblenz -\neingetragener Verein\nKoblenz\n\nGläubigern des bisherigen Rechtsträgers ist unter den Voraussetzungen der §§ 204, 22 UmwG Sicherheit zu leisten.Als nicht eingetragen wird veröffentlicht: Den Gläubigern der an der Umwandlungbeteiligten Rechtsträger ist, wenn sie binnen sechs Monaten nach dem Tag, an dem die Eintragung der Umwandlung in das Register des Sitzes desjenigen Rechtsträgers, dessen Gläubiger sie sind, nach § 19 Abs. 3 UmwG als bekannt gemacht gilt, ihren Anspruch nach Grund und Höhe schriftlich anmelden, Sicherheit zu leisten, soweit sie nicht Befriedigung verlangen können. Dieses Recht steht den Gläubigern jedoch nur zu, wenn sie glaubhaft machen, dass durch die Umwandlung die Erfüllung der Forderung gefährdet wird."
    },
    {
      "date": "2026-02-18",
      "id": "145452",
      "original_text": "Registerbekanntmachung nach dem Umwandlungsgesetz\nBremen Amtsgericht Bremen VR 3876\nVerein Bremer Literaturkontor e.V. – Bremen",
      "type": "Registerbekanntmachung nach dem Umwandlungsgesetz",
      "state": "Bremen",
      "amtsgericht": "Amtsgericht Bremen",
      "registernummer": "VR 3876",
      "registerart": "VR",
      "company_name": "Verein Bremer Literaturkontor e.V.",
      "company_seat": "Bremen",
      "details": "18.02.2026 (Bekanntmachungsdatum)\n\nBremen Amtsgericht Bremen VR 3876\nRegisterbekanntmachung nach dem Umwandlungsgesetz 17.02.2026 (Eintragungsdatum)\n\nVerein Bremer Literaturkontor e.V.\neingetragener Verein\nBremen\n\nZu Eintragungsnummer 9 vom 17.02.2026 wird als nicht eingetragen veröffentlicht: Den Gläubigern der an der Verschmelzung beteiligten Rechtsträger ist, wenn sie binnen sechs Monaten nach dem Tag, an dem die Eintragung der Verschmelzung in das Register des Sitzes desjenigen Rechtsträgers, dessen Gläubiger sie sind, als bekannt gemacht gilt, ihren Anspruch nach Grund und Höhe schriftlich anmelden, Sicherheit zu leisten, soweit sie nicht Befriedigung verlangen können. Dieses Recht steht den Gläubigern jedoch nur zu, wenn sie glaubhaft machen, dass durch die Verschmelzung die Erfüllung ihrer Forderung gefährdet wird. Das Recht, Sicherheitsleistung zu verlangen, steht Gläubigern nicht zu, die im Falle der Insolvenz ein Recht auf vorzugsweise Befriedigung aus einer Deckungsmasse haben, die nach gesetzlicher Vorschrift zu ihrem Schutz errichtet und staatlich überwacht ist."
    },
    {
      "date": "2026-02-18",
      "id": "145453",
      "original_text": "Löschungsankündigung\nNordrhein-Westfalen Amtsgericht Siegburg HRB 12951\nHast Speditions-GmbH – Nümbrecht",
      "type": "Löschungsankündigung",
      "state": "Nordrhein-Westfalen",
      "amtsgericht": "Amtsgericht Siegburg",
      "registernummer": "HRB 12951",
      "registerart": "HRB",
      "company_name": "Hast Speditions-GmbH",
      "company_seat": "Nümbrecht",
      "details": "18.02.2026 (Bekanntmachungsdatum)\n\nNordrhein-Westfalen Amtsgericht Siegburg HRB 12951\nLöschungsankündigung\n\nHast Speditions-GmbH\nGesellschaft mit beschränkter Haftung\nNümbrecht\n\nDas Registergericht hat glaubhafte Kenntnis erlangt, dass die Gesellschaft vermögenslos geworden ist, da ein Insolvenzverfahren durchgeführt und nach § 200 InsO aufgehoben wurde.\n\nEs ist daher beabsichtigt, die Gesellschaft nach § 394 FamFG im Handelsregister wegen Vermögenslosigkeit zu löschen.\nEinwände gegen die Löschung sind durch Widerspruch binnen einer Frist von 3 Monaten geltend zu machen, andernfalls die Löschung erfolgen wird.\n\nEinzulegen ist der Widerspruch bei dem Amtsgericht Siegburg, Neue Poststraße 16, 53721 Siegburg, und zwar entweder schriftlich in deutscher Sprache oder mündlich zur Niederschrift der Geschäftsstelle. Der Widerspruch kann auch zur Niederschrift der Geschäftsstelle eines jeden Amtsgerichts abgegeben werden. Der Widerspruch ist binnen der in der Verfügung bestimmten Frist einzulegen. Die Frist ist nur gewahrt, wenn der Widerspruch rechtzeitig bei dem Amtsgericht Siegburg eingeht, auch wenn der Widerspruch zur Niederschrift der Geschäftsstelle eines anderen Amtsgerichts abgegeben wurde. Die Frist beginnt jeweils mit der schriftlichen Bekanntgabe der Verfügung an die Beteiligten. Kann die schriftliche Bekanntgabe an einen Beteiligten nicht bewirkt werden, beginnt die Frist spätestens mit Ablauf von fünf Monaten nach Erlass der Verfügung. Die Bekanntgabe ist entweder durch Zustellung oder am dritten Tage nach Aufgabe zur Post bewirkt. Sofern die Löschung noch nicht erfolgt ist, kann der Widerspruch auch noch nach Ablauf der Frist eingelegt werden. Fällt das Ende der Frist auf einen Sonnabend, einen Sonntag oder einen allgemeinen Feiertag, endet die Frist mit Ablauf des nächsten Werktages. Der Widerspruch ist zu unterzeichnen. Eine Begründung des Widerspruchs ist nicht vorgeschrieben."
    },
    {
      "date": "2026-02-18",
      "id": "145454",
      "original_text": "Löschungsankündigung\nNordrhein-Westfalen Amtsgericht Hagen HRB 12025\nIFT GmbH – Hagen",
      "type": "Löschungsankündigung",
      "state": "Nordrhein-Westfalen",
      "amtsgericht": "Amtsgericht Hagen",
      "registernummer": "HRB 12025",
      "registerart": "HRB",
      "company_name": "IFT GmbH",
      "company_seat": "Hagen",
      "details": "18.02.2026 (Bekanntmachungsdatum)\n\nNordrhein-Westfalen Amtsgericht Hagen HRB 12025\nLöschungsankündigung\n\nIFT GmbH\nGesellschaft mit beschränkter Haftung\nHagen\n\nEs wird bekannt gemacht:\nDas Registergericht beabsichtigt, die im Handelsregister eingetragene Gesellschaft gemäß § 394 I FamFG wegen Vermögenslosigkeit von Amts wegen zu löschen. Gegen diese Verfügung kann Widerspruch eingelegt werden. Die Frist zur Erhebung eines Widerspruchs gegen die beabsichtigte Löschung von Amts wegen ist auf drei Monate festgesetzt.\nRechtsbehelfsbelehrung:\nGegen diese Verfügung können Sie Widerspruch einlegen.\nDer Widerspruch ist bei dem Amtsgericht Hagen, Heinitzstraße 42, 58097 Hagen schriftlich in deutscher Sprache oder zur Niederschrift der Geschäftsstelle einzulegen. Der Widerspruch kann auch zur Niederschrift der Geschäftsstelle eines jeden Amtsgerichts abgegeben werden.\nDer Widerspruch muss spätestens innerhalb der gesetzten Frist bei dem Amtsgericht Hagen eingegangen sein. Dies gilt auch dann, wenn der Widerspruch zur Geschäftsstelle eines anderen Amtsgerichtes abgegeben wurde. Die Frist beginnt mit der Veröffentlichung. Fällt das Ende der Frist auf einen Sonntag, einen allgemeinen Feiertag oder Sonnabend, so endet die Frist mit Ablauf des nächsten Werktages.\nDer Widerspruch muss die Bezeichnung der angefochtenen Verfügung sowie die Erklärung erhalten, dass Widerspruch gegen diese Verfügung eingelegt wird. Er ist zu unterzeichnen und soll begründet werden."
    },
    {
      "date": "2026-02-18",
      "id": "145455",
      "original_text": "Registerbekanntmachung nach dem Umwandlungsgesetz\nNordrhein-Westfalen Amtsgericht Bad Oeynhausen HRB 2868\nDenios Direct GmbH – Bad Oeynhausen",
      "type": "Registerbekanntmachung nach dem Umwandlungsgesetz",
      "state": "Nordrhein-Westfalen",
      "amtsgericht": "Amtsgericht Bad Oeynhausen",
      "registernummer": "HRB 2868",
      "registerart": "HRB",
      "company_name": "Denios Direct GmbH",
      "company_seat": "Bad Oeynhausen",
      "details": "18.02.2026 (Bekanntmachungsdatum)\n\nNordrhein-Westfalen Amtsgericht Bad Oeynhausen HRB 2868\nRegisterbekanntmachung nach dem Umwandlungsgesetz 18.02.2026 (Eintragungsdatum)\n\nDenios Direct GmbH\nGesellschaft mit beschränkter Haftung\nBad Oeynhausen\n\nDen Gläubigern der an der Verschmelzung beteiligten Rechtsträger ist, wenn sie binnen sechs Monaten nach dem Tag, an dem die Eintragung der Verschmelzung in das Register des Sitzes desjenigen Rechtsträgers, dessen Gläubiger sie sind, nach § 19 Absatz 3 UmwG als bekanntgemacht gilt, ihren Anspruch nach Grund und Höhe schriftlich anmelden, Sicherheit zu leisten, soweit sie nicht Befriedigung verlangen können. Dieses Recht steht den Gläubigern jedoch nur zu, wenn sie glaubhaft machen, dass durch die Verschmelzung die Erfüllung ihrer Forderung gefährdet wird."
    },
    {
      "date": "2026-02-18",
      "id": "145456",
      "original_text": "Löschungsankündigung\nNordrhein-Westfalen Amtsgericht Kleve HRB 19553\nABG GmbH – Wachtendonk",
      "type": "Löschungsankündigung",
      "state": "Nordrhein-Westfalen",
      "amtsgericht": "Amtsgericht Kleve",
      "registernummer": "HRB 19553",
      "registerart": "HRB",
      "company_name": "ABG GmbH",
      "company_seat": "Wachtendonk",
      "details": "18.02.2026 (Bekanntmachungsdatum)\n\nNordrhein-Westfalen Amtsgericht Kleve HRB 19553\nLöschungsankündigung\n\nABG GmbH\nGesellschaft mit beschränkter Haftung\nWachtendonk\n\nDas Registergericht beabsichtigt die Gesellschaft von Amts wegen nach § 394 FamFG zu löschen. Die Frist zur Erhebung eines Widerspruchs ist auf einen Monat festgesetzt."
    },
    {
      "date": "2026-02-18",
      "id": "145457",
      "original_text": "Löschungsankündigung\nNordrhein-Westfalen Amtsgericht Siegburg HRB 18414\nBiplus - Bildungsinstitut plus GmbH – Niederkassel",
      "type": "Löschungsankündigung",
      "state": "Nordrhein-Westfalen",
      "amtsgericht": "Amtsgericht Siegburg",
      "registernummer": "HRB 18414",
      "registerart": "HRB",
      "company_name": "Biplus - Bildungsinstitut plus GmbH",
      "company_seat": "Niederkassel",
      "details": "18.02.2026 (Bekanntmachungsdatum)\n\nNordrhein-Westfalen Amtsgericht Siegburg HRB 18414\nLöschungsankündigung\n\nBiplus - Bildungsinstitut plus GmbH\nGesellschaft mit beschränkter Haftung\nNiederkassel\n\nDas Registergericht hat glaubhafte Kenntnis erlangt, dass die Gesellschaft vermögenslos geworden ist, da\nein Insolvenzeröffnungsantrag mangels Masse nach § 26 InsO zurückgewiesen wurde.\n\nEs ist daher beabsichtigt, die Gesellschaft nach § 394 FamFG im Handelsregister wegen Vermögenslosigkeit zu löschen.\nEinwände gegen die Löschung sind durch Widerspruch binnen einer Frist von 3 Monaten geltend zu machen, andernfalls die Löschung erfolgen wird.\n\nEinzulegen ist der Widerspruch bei dem Amtsgericht Siegburg, Neue Poststraße 16, 53721 Siegburg, und zwar entweder schriftlich in deutscher Sprache oder mündlich zur Niederschrift der Geschäftsstelle. Der Widerspruch kann auch zur Niederschrift der Geschäftsstelle eines jeden Amtsgerichts abgegeben werden. Der Widerspruch ist binnen der in der Verfügung bestimmten Frist einzulegen. Die Frist ist nur gewahrt, wenn der Widerspruch rechtzeitig bei dem Amtsgericht Siegburg eingeht, auch wenn der Widerspruch zur Niederschrift der Geschäftsstelle eines anderen Amtsgerichts abgegeben wurde. Die Frist beginnt jeweils mit der schriftlichen Bekanntgabe der Verfügung an die Beteiligten. Kann die schriftliche Bekanntgabe an einen Beteiligten nicht bewirkt werden, beginnt die Frist spätestens mit Ablauf von fünf Monaten nach Erlass der Verfügung. Die Bekanntgabe ist entweder durch Zustellung oder am dritten Tage nach Aufgabe zur Post bewirkt. Sofern die Löschung noch nicht erfolgt ist, kann der Widerspruch auch noch nach Ablauf der Frist eingelegt werden. Fällt das Ende der Frist auf einen Sonnabend, einen Sonntag oder einen allgemeinen Feiertag, endet die Frist mit Ablauf des nächsten Werktages. Der Widerspruch ist zu unterzeichnen. Eine Begründung des Widerspruchs ist nicht vorgeschrieben."
    },
    {
      "date": "2026-02-18",
      "id": "145458",
      "original_text": "Sonstige Registerbekanntmachung\nNordrhein-Westfalen Amtsgericht Bonn HRB 17553\nPriogo AG – Zülpich",
      "type": "Sonstige Registerbekanntmachung",
      "state": "Nordrhein-Westfalen",
      "amtsgericht": "Amtsgericht Bonn",
      "registernummer": "HRB 17553",
      "registerart": "HRB",
      "company_name": "Priogo AG",
      "company_seat": "Zülpich",
      "details": "18.02.2026 (Bekanntmachungsdatum)\n\nNordrhein-Westfalen Amtsgericht Bonn HRB 17553\nSonstige Registerbekanntmachung 18.02.2026 (Eintragungsdatum)\n\nPriogo AG\nAktiengesellschaft\nZülpich"
    },
    {
      "date": "2026-02-18",
      "id": "145459",
      "original_text": "Löschungsankündigung\nNordrhein-Westfalen Amtsgericht Siegburg HRB 11336\nSchellenberg Haustechnik UG (haftungsbeschränkt) – Nümbrecht",
      "type": "Löschungsankündigung",
      "state": "Nordrhein-Westfalen",
      "amtsgericht": "Amtsgericht Siegburg",
      "registernummer": "HRB 11336",
      "registerart": "HRB",
      "company_name": "Schellenberg Haustechnik UG (haftungsbeschränkt)",
      "company_seat": "Nümbrecht",
      "details": "18.02.2026 (Bekanntmachungsdatum)\n\nNordrhein-Westfalen Amtsgericht Siegburg HRB 11336\nLöschungsankündigung\n\nSchellenberg Haustechnik UG (haftungsbeschränkt)\nGesellschaft mit beschränkter Haftung\nNümbrecht\n\nDas Registergericht hat glaubhafte Kenntnis erlangt, dass die Gesellschaft vermögenslos geworden ist. Es ist daher beabsichtigt, die Gesellschaft nach § 394 FamFG im Handelsregister wegen Vermögenslosigkeit zu löschen. Einwände gegen die Löschung sind durch Widerspruch binnen einer Frist von 3 Monaten geltend zu machen, andernfalls die Löschung erfolgen wird. Einzulegen ist der Widerspruch bei dem Amtsgericht Siegburg, Neue Poststraße 16, 53721 Siegburg, und zwar entweder schriftlich in deutscher Sprache oder mündlich zur Niederschrift der Geschäftsstelle. Der Widerspruch kann auch zur Niederschrift der Geschäftsstelle eines jeden Amtsgerichts abgegeben werden. Der Widerspruch ist binnen der in der Verfügung bestimmten Frist einzulegen. Die Frist ist nur gewahrt, wenn der Widerspruch rechtzeitig bei dem Amtsgericht Siegburg eingeht, auch wenn der Widerspruch zur Niederschrift der Geschäftsstelle eines anderen Amtsgerichts abgegeben wurde. Die Frist beginnt jeweils mit der schriftlichen Bekanntgabe der Verfügung an die Beteiligten. Kann die schriftliche Bekanntgabe an einen Beteiligten nicht bewirkt werden, beginnt die Frist spätestens mit Ablauf von fünf Monaten nach Erlass der Verfügung. Die Bekanntgabe ist entweder durch Zustellung oder am dritten Tage nach Aufgabe zur Post bewirkt. Sofern die Löschung noch nicht erfolgt ist, kann der Widerspruch auch noch nach Ablauf der Frist eingelegt werden. Fällt das Ende der Frist auf einen Sonnabend, einen Sonntag oder einen"
    },
    {
      "date": "2026-02-18",
      "id": "145460",
      "original_text": "Registerbekanntmachung nach dem Umwandlungsgesetz\nNordrhein-Westfalen Amtsgericht Bad Oeynhausen HRB 18195\nDENIOS SE – Bad Oeynhausen",
      "type": "Registerbekanntmachung nach dem Umwandlungsgesetz",
      "state": "Nordrhein-Westfalen",
      "amtsgericht": "Amtsgericht Bad Oeynhausen",
      "registernummer": "HRB 18195",
      "registerart": "HRB",
      "company_name": "DENIOS SE",
      "company_seat": "Bad Oeynhausen",
      "details": "18.02.2026 (Bekanntmachungsdatum)\n\nNordrhein-Westfalen Amtsgericht Bad Oeynhausen HRB 18195\nRegisterbekanntmachung nach dem Umwandlungsgesetz 18.02.2026 (Eintragungsdatum)\n\nDENIOS SE\nEuropäische Aktiengesellschaft (SE)\nBad Oeynhausen\n\nDen Gläubigern der an der Verschmelzung beteiligten Rechtsträger ist, wenn sie binnen sechs Monaten nach dem Tag, an dem die Eintragung der Verschmelzung in das Register des Sitzes desjenigen Rechtsträgers, dessen Gläubiger sie sind, nach § 19 Absatz 3 UmwG als bekanntgemacht gilt, ihren Anspruch nach Grund und Höhe schriftlich anmelden, Sicherheit zu leisten, soweit sie nicht Befriedigung verlangen können. Dieses Recht steht den Gläubigern jedoch nur zu, wenn sie glaubhaft machen, dass durch die Verschmelzung die Erfüllung ihrer Forderung gefährdet wird."
    },
    {
      "date": "2026-02-18",
      "id": "145461",
      "original_text": "Einreichung neuer Dokumente\nNordrhein-Westfalen Amtsgericht Iserlohn HRB 4063\nMEG Märkische Eisenbahngesellschaft mit beschränkter Haftung – Lüdenscheid",
      "type": "Einreichung neuer Dokumente",
      "state": "Nordrhein-Westfalen",
      "amtsgericht": "Amtsgericht Iserlohn",
      "registernummer": "HRB 4063",
      "registerart": "HRB",
      "company_name": "MEG Märkische Eisenbahngesellschaft mit beschränkter Haftung",
      "company_seat": "Lüdenscheid",
      "details": "18.02.2026 (Bekanntmachungsdatum)\n\nNordrhein-Westfalen Amtsgericht Iserlohn HRB 4063\nEinreichung neuer Dokumente 11.02.2026 (Eintragungsdatum)\n\nMEG Märkische Eisenbahngesellschaft mit beschränkter Haftung\nGesellschaft mit beschränkter Haftung\nLüdenscheid\n\nDem Registergericht ist eine neue Liste der Mitglieder des Aufsichtsrates eingereicht worden."
    },
    {
      "date": "2026-02-18",
      "id": "145462",
      "original_text": "Löschungsankündigung\nNordrhein-Westfalen Amtsgericht Neuss HRB 22807\nBrickau Hoch-Tiefbau GmbH – Meerbusch",
      "type": "Löschungsankündigung",
      "state": "Nordrhein-Westfalen",
      "amtsgericht": "Amtsgericht Neuss",
      "registernummer": "HRB 22807",
      "registerart": "HRB",
      "company_name": "Brickau Hoch-Tiefbau GmbH",
      "company_seat": "Meerbusch",
      "details": "18.02.2026 (Bekanntmachungsdatum)\n\nNordrhein-Westfalen Amtsgericht Neuss HRB 22807\nLöschungsankündigung 17.02.2026 (Eintragungsdatum)\n\nBrickau Hoch-Tiefbau GmbH\nGesellschaft mit beschränkter Haftung\nMeerbusch\n\nEs ist beabsichtigt, die Gesellschaft wegen Vermögenslosigkeit aufgrund des § 394 Abs. 1 FamFG zu löschen. Frist zur Geltendmachung eines Widerspruchs: 1 Monat.\n\nRechtsbehelfsbelehrung:\nGegen diese Verfügung können Sie Widerspruch einlegen.\nDer Widerspruch ist bei dem Amtsgericht Neuss - Registergericht -, Breite Str. 48, 41460 Neuss schriftlich in deutscher Sprache oder zur Niederschrift der Geschäftsstelle einzulegen.\nDer Widerspruch kann auch zur Niederschrift der Geschäftsstelle eines jeden Amtsgerichtes abgegeben werden.\nDie Einlegung ist auch durch Übertragung eines elektronischen Dokuments an die elektronische Poststelle des Gerichts möglich. Das elektronische Dokument muss für die Bearbeitung durch das Gericht geeignet und mit einer qualifizierten elektronischen Signatur der verantwortenden Person versehen sein oder von der verantwortenden Person signiert und auf einem sicheren Übermittlungsweg gemäß § 130a ZPO nach näherer Maßgabe der Verordnung über die technischen Rahmenbedingungen des elektronischen Rechtsverkehrs und über das besondere elektronische Behördenpostfach (BGBl. I, S.3803) eingereicht werden. Weitere Informationen erhalten Sie auf der Internetseite www.justiz.de.\nDer Widerspruch muss spätestens innerhalb der gesetzten Frist nach der schriftlichen Bekanntgabe der Verfügung bei dem Amtsgericht - Registergericht - Neuss eingegangen sein. Dies gilt auch dann, wenn der Widerspruch zur Niederschrift der Geschäftsstelle eines anderen Amtsgerichtes abgegeben wurde. Die Frist beginnt mit der schriftlichen Bekanntgabe der Verfügung. Die Bekanntgabe ist entweder durch Zustellung oder am dritten Tage nach Aufgabe zur Post bewirkt. Fällt das Ende der Frist auf einen Sonntag, einen allgemeinen Feiertag oder Sonnabend, so endet die Frist mit Ablauf des nächsten Werktages.\n\nDer Widerspruch muss die Bezeichnung der angefochtenen Verfügung sowie die Erklärung enthalten, dass Widerspruch gegen diese Verfügung eingelegt wird. Er ist zu unterzeichnen und soll begründet werden."
    },
    {
      "date": "2026-02-18",
      "id": "145463",
      "original_text": "Einreichung neuer Dokumente\nNordrhein-Westfalen Amtsgericht Gelsenkirchen HRB 168\nBochum-Gelsenkirchener Bahngesellschaft mit beschränkter Haftung – Gelsenkirchen",
      "type": "Einreichung neuer Dokumente",
      "state": "Nordrhein-Westfalen",
      "amtsgericht": "Amtsgericht Gelsenkirchen",
      "registernummer": "HRB 168",
      "registerart": "HRB",
      "company_name": "Bochum-Gelsenkirchener Bahngesellschaft mit beschränkter Haftung",
      "company_seat": "Gelsenkirchen",
      "details": "18.02.2026 (Bekanntmachungsdatum)\n\nNordrhein-Westfalen Amtsgericht Gelsenkirchen HRB 168\nEinreichung neuer Dokumente\n\nBochum-Gelsenkirchener Bahngesellschaft mit beschränkter Haftung\nGesellschaft mit beschränkter Haftung\nGelsenkirchen\n\nDem Registergericht ist eine neue Liste der Mitglieder des Aufsichtsrates eingereicht worden."
    },
    {
      "date": "2026-02-18",
      "id": "145464",
      "original_text": "Löschungsankündigung\nNordrhein-Westfalen Amtsgericht Köln HRB 108172\nPIXI UG (haftungsbeschränkt) – Köln",
      "type": "Löschungsankündigung",
      "state": "Nordrhein-Westfalen",
      "amtsgericht": "Amtsgericht Köln",
      "registernummer": "HRB 108172",
      "registerart": "HRB",
      "company_name": "PIXI UG (haftungsbeschränkt)",
      "company_seat": "Köln",
      "details": "18.02.2026 (Bekanntmachungsdatum)\n\nNordrhein-Westfalen Amtsgericht Köln HRB 108172\nLöschungsankündigung\n\nPIXI UG (haftungsbeschränkt)\nGesellschaft mit beschränkter Haftung\nKöln\n\nDas Registergericht beabsichtigt die Gesellschaft von Amts wegen nach § 394 FamFG zu löschen. Die Frist zur Erhebung eines Widerspruchs ist auf einen Monat festgesetzt."
    },
    {
      "date": "2026-02-18",
      "id": "145465",
      "original_text": "Registerbekanntmachung nach dem Umwandlungsgesetz\nNordrhein-Westfalen Amtsgericht Steinfurt HRB 15796\nBolero Schwerin Gastro GmbH – Emsdetten",
      "type": "Registerbekanntmachung nach dem Umwandlungsgesetz",
      "state": "Nordrhein-Westfalen",
      "amtsgericht": "Amtsgericht Steinfurt",
      "registernummer": "HRB 15796",
      "registerart": "HRB",
      "company_name": "Bolero Schwerin Gastro GmbH",
      "company_seat": "Emsdetten",
      "details": "18.02.2026 (Bekanntmachungsdatum)\n\nNordrhein-Westfalen Amtsgericht Steinfurt HRB 15796\nRegisterbekanntmachung nach dem Umwandlungsgesetz 18.02.2026 (Eintragungsdatum)\n\nBolero Schwerin Gastro GmbH\nGesellschaft mit beschränkter Haftung\nEmsdetten\n\nDen Gläubigern der an der Verschmelzung beteiligten Rechtsträger ist, wenn sie binnen sechs Monaten nach dem Tag, an dem die Eintragung der Verschmelzung in das Register des Sitzes desjenigen Rechtsträgers, dessen Gläubiger sie sind, nach § 19 Absatz 3 UmwG als bekanntgemacht gilt, ihren Anspruch nach Grund und Höhe schriftlich anmelden, Sicherheit zu leisten, soweit sie nicht Befriedigung verlangen können. Dieses Recht steht den Gläubigern jedoch nur zu, wenn sie glaubhaft machen, dass durch die Verschmelzung die Erfüllung ihrer Forderung gefährdet wird."
    },
    {
      "date": "2026-02-18",
      "id": "145466",
      "original_text": "Löschungsankündigung\nNordrhein-Westfalen Amtsgericht Duisburg HRB 26532\nMost Wanted Cars GmbH – Duisburg",
      "type": "Löschungsankündigung",
      "state": "Nordrhein-Westfalen",
      "amtsgericht": "Amtsgericht Duisburg",
      "registernummer": "HRB 26532",
      "registerart": "HRB",
      "company_name": "Most Wanted Cars GmbH",
      "company_seat": "Duisburg",
      "details": "18.02.2026 (Bekanntmachungsdatum)\n\nNordrhein-Westfalen Amtsgericht Duisburg HRB 26532\nLöschungsankündigung\n\nMost Wanted Cars GmbH\nGesellschaft mit beschränkter Haftung\nDuisburg\n\nDas Registergericht beabsichtigt, die im Handelsregister unter HRB 26532 eingetragene Gesellschaft Most Wanted Cars GmbH  gemäß § 394 FamFG wegen Vermögenslosigkeit von Amts wegen zu löschen. Gegen diese Verfügung kann Widerspruch eingelegt werden. Die Frist zur Erhebung eines Widerspruchs gegen die beabsichtigte Löschung von Amts wegen ist auf drei Monate festgesetzt. Rechtsbehelfsbelehrung Der Widerspruch ist bei dem Amtsgericht Duisburg, Kardinal-Galen-Str. 124-132, 47058 Duisburg schriftlich in deutscher Sprache oder zur Niederschrift der Geschäftsstelle einzulegen. Der Widerspruch kann auch zur Niederschrift der Geschäftsstelle eines jeden Amtsgerichtes abgegeben werden. Die Einlegung ist auch durch Übertragung eines elektronischen Dokuments an die elektronische Poststelle des Gerichts möglich. Das elektronische Dokument muss für die Bearbeitung durch das Gericht geeignet und mit einer qualifizierten elektronischen Signatur der verantwortenden Person versehen sein oder von der verantwortenden Person signiert und auf einem sicheren Übermittlungsweg gemäß § 130 a ZPO nach näherer Maßgabe der Verordnung über die technischen Rahmenbedingungen des elektronischen Rechtsverkehrs und über das besondere elektronische Behördenpostfach (BGBl. I, S. 3803) eingereicht werden. Weitere Informationen erhalten Sie auf der Internetseite www.justiz.de <http://www.justiz.de>. Der Widerspruch muss spätestens innerhalb der gesetzten Frist bei dem Amtsgericht Duisburg eingegangen sein. Dies gilt auch dann, wenn der Widerspruch zur Niederschrift der Geschäftsstelle eines anderen Amtsgerichtes abgegeben wurde. Die Frist beginnt mit der Veröffentlichung. Fällt das Ende der Frist auf einen Sonntag, einen allgemeinen Feiertag oder Sonnabend, so endet die Frist mit Ablauf des nächsten Werktages. Der Widerspruch muss die Bezeichnung der angefochtenen Verfügung sowie die Erklärung enthalten, dass Widerspruch gegen diese Verfügung eingelegt wird. Er ist zu unterzeichnen und soll begründet werden."
    },
    {
      "date": "2026-02-18",
      "id": "145467",
      "original_text": "Registerbekanntmachung nach dem Umwandlungsgesetz\nNordrhein-Westfalen Amtsgericht Hamm HRB 12134\nSchwagerus Capital GmbH – Hamm",
      "type": "Registerbekanntmachung nach dem Umwandlungsgesetz",
      "state": "Nordrhein-Westfalen",
      "amtsgericht": "Amtsgericht Hamm",
      "registernummer": "HRB 12134",
      "registerart": "HRB",
      "company_name": "Schwagerus Capital GmbH",
      "company_seat": "Hamm",
      "details": "18.02.2026 (Bekanntmachungsdatum)\n\nNordrhein-Westfalen Amtsgericht Hamm HRB 12134\nRegisterbekanntmachung nach dem Umwandlungsgesetz 18.02.2026 (Eintragungsdatum)\n\nSchwagerus Capital GmbH\nGesellschaft mit beschränkter Haftung\nHamm\n\nDen Gläubigern der an der Ausgliederung beteiligten Rechtsträger ist, wenn sie binnen sechs Monaten nach dem Tag, an dem die Eintragung der Ausgliederung in das Register des Sitzes desjenigen Rechtsträgers, dessen Gläubiger sie sind, nach § 19 Absatz 3 UmwG als bekanntgemacht gilt, ihren Anspruch nach Grund und Höhe schriftlich anmelden, Sicherheit zu leisten, soweit sie nicht Befriedigung verlangen können. Dieses Recht steht den Gläubigern jedoch nur zu, wenn sie glaubhaft machen, dass durch die Ausgliederung die Erfüllung ihrer Forderung gefährdet wird."
    },
    {
      "date": "2026-02-18",
      "id": "145468",
      "original_text": "Einreichung neuer Dokumente\nNordrhein-Westfalen Amtsgericht Bad Oeynhausen HRB 12643\nDB Systemtechnik GmbH – Minden",
      "type": "Einreichung neuer Dokumente",
      "state": "Nordrhein-Westfalen",
      "amtsgericht": "Amtsgericht Bad Oeynhausen",
      "registernummer": "HRB 12643",
      "registerart": "HRB",
      "company_name": "DB Systemtechnik GmbH",
      "company_seat": "Minden",
      "details": "18.02.2026 (Bekanntmachungsdatum)\n\nNordrhein-Westfalen Amtsgericht Bad Oeynhausen HRB 12643\nEinreichung neuer Dokumente\n\nDB Systemtechnik GmbH\nGesellschaft mit beschränkter Haftung\nMinden\n\nDem Registergericht ist eine neue Liste der Mitglieder des Aufsichtsrates eingereicht worden."
    },
    {
      "date": "2026-02-18",
      "id": "145469",
      "original_text": "Löschungsankündigung\nNordrhein-Westfalen Amtsgericht Bonn HRB 7659\nVivendum Grundbesitz-Vermietungs-Verwaltungs GmbH – Bonn",
      "type": "Löschungsankündigung",
      "state": "Nordrhein-Westfalen",
      "amtsgericht": "Amtsgericht Bonn",
      "registernummer": "HRB 7659",
      "registerart": "HRB",
      "company_name": "Vivendum Grundbesitz-Vermietungs-Verwaltungs GmbH",
      "company_seat": "Bonn",
      "details": "18.02.2026 (Bekanntmachungsdatum)\n\nNordrhein-Westfalen Amtsgericht Bonn HRB 7659\nLöschungsankündigung\n\nVivendum Grundbesitz-Vermietungs-Verwaltungs GmbH\nGesellschaft mit beschränkter Haftung\nBonn\n\nDas Registergericht beabsichtigt die Gesellschaft von Amts wegen nach § 394 FamFG zu löschen. Die Frist zur Erhebung eines Widerspruchs ist auf einen Monat festgesetzt."
    },
    {
      "date": "2026-02-18",
      "id": "145470",
      "original_text": "Einreichung neuer Dokumente\nNordrhein-Westfalen Amtsgericht Essen HRB 4170\nStadtwerke Essen Aktiengesellschaft – Essen",
      "type": "Einreichung neuer Dokumente",
      "state": "Nordrhein-Westfalen",
      "amtsgericht": "Amtsgericht Essen",
      "registernummer": "HRB 4170",
      "registerart": "HRB",
      "company_name": "Stadtwerke Essen Aktiengesellschaft",
      "company_seat": "Essen",
      "details": "18.02.2026 (Bekanntmachungsdatum)\n\nNordrhein-Westfalen Amtsgericht Essen HRB 4170\nEinreichung neuer Dokumente\n\nStadtwerke Essen Aktiengesellschaft\nAktiengesellschaft\nEssen\n\nDem Registergericht ist eine neue Liste der Mitglieder des Aufsichtsrates eingereicht worden."
    },
    {
      "date": "2026-02-18",
      "id": "145471",
      "original_text": "Löschungsankündigung\nNordrhein-Westfalen Amtsgericht Recklinghausen VR 2737\nIrish Folk and more e.V. – Oer-Erkenschwick",
      "type": "Löschungsankündigung",
      "state": "Nordrhein-Westfalen",
      "amtsgericht": "Amtsgericht Recklinghausen",
      "registernummer": "VR 2737",
      "registerart": "VR",
      "company_name": "Irish Folk and more e.V.",
      "company_seat": "Oer-Erkenschwick",
      "details": "18.02.2026 (Bekanntmachungsdatum)\n\nNordrhein-Westfalen Amtsgericht Recklinghausen VR 2737\nLöschungsankündigung 18.02.2026 (Eintragungsdatum)\n\nIrish Folk and more e.V.\neingetragener Verein\nOer-Erkenschwick\n\nDas Registergericht beabsichtigt, den im Vereinsregister eingetragenen Verein gemäß § 395 FamFG von Amts wegen zu löschen.\n\nGegen diese Verfügung kann Widerspruch eingelegt werden. Die Frist zur Erhebung eines Widerspruchs gegen die beabsichtigte Löschung von Amts wegen ist auf drei Monate festgesetzt."
    },
    {
      "date": "2026-02-18",
      "id": "145472",
      "original_text": "Löschungsankündigung\nNordrhein-Westfalen Amtsgericht Siegburg HRB 12781\nESES Energy, Security & Environmental Solutions GmbH – Sankt Augustin",
      "type": "Löschungsankündigung",
      "state": "Nordrhein-Westfalen",
      "amtsgericht": "Amtsgericht Siegburg",
      "registernummer": "HRB 12781",
      "registerart": "HRB",
      "company_name": "ESES Energy, Security & Environmental Solutions GmbH",
      "company_seat": "Sankt Augustin",
      "details": "18.02.2026 (Bekanntmachungsdatum)\n\nNordrhein-Westfalen Amtsgericht Siegburg HRB 12781\nLöschungsankündigung\n\nESES Energy, Security & Environmental Solutions GmbH\nGesellschaft mit beschränkter Haftung\nSankt Augustin\n\nDas Registergericht hat glaubhafte Kenntnis erlangt, dass die Gesellschaft vermögenslos geworden ist. Es ist daher beabsichtigt, die Gesellschaft nach § 394 FamFG im Handelsregister wegen Vermögenslosigkeit zu löschen. Einwände gegen die Löschung sind durch Widerspruch binnen einer Frist von 3 Monaten geltend zu machen, andernfalls die Löschung erfolgen wird. Einzulegen ist der Widerspruch bei dem Amtsgericht Siegburg, Neue Poststraße 16, 53721 Siegburg, und zwar entweder schriftlich in deutscher Sprache oder mündlich zur Niederschrift der Geschäftsstelle. Der Widerspruch kann auch zur Niederschrift der Geschäftsstelle eines jeden Amtsgerichts abgegeben werden. Der Widerspruch ist binnen der in der Verfügung bestimmten Frist einzulegen. Die Frist ist nur gewahrt, wenn der Widerspruch rechtzeitig bei dem Amtsgericht Siegburg eingeht, auch wenn der Widerspruch zur Niederschrift der Geschäftsstelle eines anderen Amtsgerichts abgegeben wurde. Die Frist beginnt jeweils mit der schriftlichen Bekanntgabe der Verfügung an die Beteiligten. Kann die schriftliche Bekanntgabe an einen Beteiligten nicht bewirkt werden, beginnt die Frist spätestens mit Ablauf von fünf Monaten nach Erlass der Verfügung. Die Bekanntgabe ist entweder durch Zustellung oder am dritten Tage nach Aufgabe zur Post bewirkt. Sofern die Löschung noch nicht erfolgt ist, kann der Widerspruch auch noch nach Ablauf der Frist eingelegt werden. Fällt das Ende der Frist auf einen Sonnabend, einen Sonntag oder einen"
    },
    {
      "date": "2026-02-18",
      "id": "145473",
      "original_text": "Löschungsankündigung\nNordrhein-Westfalen Amtsgericht Neuss HRB 22183\nVLV Personaldienstleistungen GmbH – Kaarst",
      "type": "Löschungsankündigung",
      "state": "Nordrhein-Westfalen",
      "amtsgericht": "Amtsgericht Neuss",
      "registernummer": "HRB 22183",
      "registerart": "HRB",
      "company_name": "VLV Personaldienstleistungen GmbH",
      "company_seat": "Kaarst",
      "details": "18.02.2026 (Bekanntmachungsdatum)\n\nNordrhein-Westfalen Amtsgericht Neuss HRB 22183\nLöschungsankündigung 26.01.2026 (Eintragungsdatum)\n\nVLV Personaldienstleistungen GmbH\nGesellschaft mit beschränkter Haftung\nKaarst\n\nDas Registergericht beabsichtigt die Gesellschaft wegen Vermögenslosigkeit aufgrund des § 394 Abs. 1 FamFG zu löschen. Frist zur Geltendmachung eines Widerspruchs: 1 Monat.\nRechtsbehelfsbelehrung:\nGegen diese Verfügung können Sie Widerspruch einlegen.\nDer Widerspruch ist bei dem Amtsgericht Neuss - Registergericht -, Breite Str. 48, 41460 Neuss schriftlich in deutscher Sprache oder zur Niederschrift der Geschäftsstelle einzulegen.\nDer Widerspruch kann auch zur Niederschrift der Geschäftsstelle eines jeden Amtsgerichtes abgegeben werden.\nDie Einlegung ist auch durch Übertragung eines elektronischen Dokuments an die elektronische Poststelle des Gerichts möglich. Das elektronische Dokument muss für die Bearbeitung durch das Gericht geeignet und mit einer qualifizierten elektronischen Signatur der verantwortenden Person versehen sein oder von der verantwortenden Person signiert und auf einem sicheren Übermittlungsweg gemäß § 130a ZPO nach näherer Maßgabe der Verordnung über die technischen Rahmenbedingungen des elektronischen Rechtsverkehrs und über das besondere elektronische Behördenpostfach (BGBl. I, S.3803) eingereicht werden. Weitere Informationen erhalten Sie auf der Internetseite www.justiz.de.\nDer Widerspruch muss spätestens innerhalb der gesetzten Frist nach der schriftlichen Bekanntgabe der Verfügung bei dem Amtsgericht - Registergericht - Neuss eingegangen sein. Dies gilt auch dann, wenn der Widerspruch zur Niederschrift der Geschäftsstelle eines anderen Amtsgerichtes abgegeben wurde. Die Frist beginnt mit der schriftlichen Bekanntgabe der Verfügung. Die Bekanntgabe ist entweder durch Zustellung oder am dritten Tage nach Aufgabe zur Post bewirkt. Fällt das Ende der Frist auf einen Sonntag, einen allgemeinen Feiertag oder Sonnabend, so endet die Frist mit Ablauf des nächsten Werktages.\nDer Widerspruch muss die Bezeichnung der angefochtenen Verfügung sowie die Erklärung enthalten, dass Widerspruch gegen diese Verfügung eingelegt wird. Er ist zu unterzeichnen und soll begründet werden."
    },
    {
      "date": "2026-02-18",
      "id": "145474",
      "original_text": "Sonstige Registerbekanntmachung\nHessen Amtsgericht Wiesbaden HRB 36045\nHessenFonds Beteiligungen GmbH – Wiesbaden",
      "type": "Sonstige Registerbekanntmachung",
      "state": "Hessen",
      "amtsgericht": "Amtsgericht Wiesbaden",
      "registernummer": "HRB 36045",
      "registerart": "HRB",
      "company_name": "HessenFonds Beteiligungen GmbH",
      "company_seat": "Wiesbaden",
      "details": "18.02.2026 (Bekanntmachungsdatum)\n\nHessen Amtsgericht Wiesbaden HRB 36045\nSonstige Registerbekanntmachung 18.02.2026 (Eintragungsdatum)\n\nHessenFonds Beteiligungen GmbH\nGesellschaft mit beschränkter Haftung\nWiesbaden\n\nDurch eine Änderung in den Personen der Aufsichtsratsmitglieder ist eine Liste der Mitglieder des Aufsichtsrates zum Handelsregister eingereicht worden."
    },
    {
      "date": "2026-02-18",
      "id": "145475",
      "original_text": "Löschungsankündigung\nHessen Amtsgericht Frankfurt am Main HRB 122491\nSFS Security & Facility Service GmbH – Frankfurt am Main",
      "type": "Löschungsankündigung",
      "state": "Hessen",
      "amtsgericht": "Amtsgericht Frankfurt am Main",
      "registernummer": "HRB 122491",
      "registerart": "HRB",
      "company_name": "SFS Security & Facility Service GmbH",
      "company_seat": "Frankfurt am Main",
      "details": "18.02.2026 (Bekanntmachungsdatum)\n\nHessen Amtsgericht Frankfurt am Main HRB 122491\nLöschungsankündigung\n\nSFS Security & Facility Service GmbH\nGesellschaft mit beschränkter Haftung\nFrankfurt am Main\n\nEs ist beabsichtig, die Gesellschaft wegen Vermögenslosigkeit gemäß § 394 FamFG von Amts wegen im Handelsregister zu löschen. Hiergegen kann innerhalb eines Zeitraums von 1 Monat nach dieser Veröffentlichung Widerspruch bei dem Amtsgericht Frankfurt am Main eingelegt werden."
    },
    {
      "date": "2026-02-18",
      "id": "145476",
      "original_text": "Registerbekanntmachung nach dem Umwandlungsgesetz\nHessen Amtsgericht Frankfurt am Main HRB 142003\nQuadrat Verwaltung GmbH – Frankfurt am Main",
      "type": "Registerbekanntmachung nach dem Umwandlungsgesetz",
      "state": "Hessen",
      "amtsgericht": "Amtsgericht Frankfurt am Main",
      "registernummer": "HRB 142003",
      "registerart": "HRB",
      "company_name": "Quadrat Verwaltung GmbH",
      "company_seat": "Frankfurt am Main",
      "details": "18.02.2026 (Bekanntmachungsdatum)\n\nHessen Amtsgericht Frankfurt am Main HRB 142003\nRegisterbekanntmachung nach dem Umwandlungsgesetz 18.02.2026 (Eintragungsdatum)\n\nQuadrat Verwaltung GmbH\nGesellschaft mit beschränkter Haftung\nFrankfurt am Main\n\nDen Gläubigern der an der Ausgliederung beteiligten Rechtsträger ist, wenn sie binnen sechs Monaten nach dem Tag, an dem die Eintragung der Ausgliederung in das Register des Sitzes desjenigen Rechtsträgers, dessen Gläubiger sie sind, nach §§ 125, 19 Absatz 3 UmwG bekannt gemacht worden ist, ihren Anspruch nach Grund und Höhe schriftlich anmelden, Sicherheit zu leisten, soweit sie nicht Befriedigung verlangen können. Dieses Recht steht den Gläubigern jedoch nur zu, wenn sie glaubhaft machen, dass durch die Ausgliederung die Erfüllung ihrer Forderung gefährdet wird."
    },
    {
      "date": "2026-02-18",
      "id": "145477",
      "original_text": "Sonstige Registerbekanntmachung\nHessen Amtsgericht Marburg VR 3950\nBurschenschaft Neukirchen – Neukirchen",
      "type": "Sonstige Registerbekanntmachung",
      "state": "Hessen",
      "amtsgericht": "Amtsgericht Marburg",
      "registernummer": "VR 3950",
      "registerart": "VR",
      "company_name": "Burschenschaft Neukirchen",
      "company_seat": "Neukirchen",
      "details": "18.02.2026 (Bekanntmachungsdatum)\n\nHessen Amtsgericht Marburg VR 3950\nSonstige Registerbekanntmachung 16.02.2026 (Eintragungsdatum)\n\nBurschenschaft Neukirchen\neingetragener Verein\nNeukirchen"
    },
    {
      "date": "2026-02-18",
      "id": "145478",
      "original_text": "Sonstige Registerbekanntmachung\nHessen Amtsgericht Friedberg GnR 263\nVolksbank Butzbach eG – Butzbach",
      "type": "Sonstige Registerbekanntmachung",
      "state": "Hessen",
      "amtsgericht": "Amtsgericht Friedberg",
      "registernummer": "GnR 263",
      "registerart": "GnR",
      "company_name": "Volksbank Butzbach eG",
      "company_seat": "Butzbach",
      "details": "18.02.2026 (Bekanntmachungsdatum)\n\nHessen Amtsgericht Friedberg GnR 263\nSonstige Registerbekanntmachung 26.08.2025 (Eintragungsdatum)\n\nVolksbank Butzbach eG\neingetragene Genossenschaft\nButzbach\n\nNeue Regelung: Den Gläubigern der Genossenschaft ist, wenn sie sich binnen sechs Monaten nach dieser Bekanntmachung zu diesem Zweck bei der Genossenschaft melden, Sicherheit zu leisten, soweit sie nicht Befriedigung verlangen können."
    },
    {
      "date": "2026-02-18",
      "id": "145479",
      "original_text": "Sonstige Registerbekanntmachung\nHessen Amtsgericht Friedberg GnR 263\nVolksbank Butzbach eG – Butzbach",
      "type": "Sonstige Registerbekanntmachung",
      "state": "Hessen",
      "amtsgericht": "Amtsgericht Friedberg",
      "registernummer": "GnR 263",
      "registerart": "GnR",
      "company_name": "Volksbank Butzbach eG",
      "company_seat": "Butzbach",
      "details": "18.02.2026 (Bekanntmachungsdatum)\n\nHessen Amtsgericht Friedberg GnR 263\nSonstige Registerbekanntmachung 26.08.2025 (Eintragungsdatum)\n\nVolksbank Butzbach eG\neingetragene Genossenschaft\nButzbach\n\nNeue Regelung: Den Gläubigern der Genossenschaft ist, wenn sie sich binnen sechs Monaten nach dieser Bekanntmachung zu diesem Zweck bei der Genossenschaft melden, Sicherheit zu leisten, soweit sie nicht Befriedigung verlangen können."
    },
    {
      "date": "2026-02-18",
      "id": "145480",
      "original_text": "Sonstige Registerbekanntmachung\nHessen Amtsgericht Marburg VR 1431\nElternverein des Hortes der Brüder-Grimm-Schule – Marburg",
      "type": "Sonstige Registerbekanntmachung",
      "state": "Hessen",
      "amtsgericht": "Amtsgericht Marburg",
      "registernummer": "VR 1431",
      "registerart": "VR",
      "company_name": "Elternverein des Hortes der Brüder-Grimm-Schule",
      "company_seat": "Marburg",
      "details": "18.02.2026 (Bekanntmachungsdatum)\n\nHessen Amtsgericht Marburg VR 1431\nSonstige Registerbekanntmachung 18.02.2026 (Eintragungsdatum)\n\nElternverein des Hortes der Brüder-Grimm-Schule\neingetragener Verein\nMarburg\n\nDer Verein ist aufgelöst."
    },
    {
      "date": "2026-02-18",
      "id": "145481",
      "original_text": "Registerbekanntmachung nach dem Umwandlungsgesetz\nHessen Amtsgericht Korbach HRB 654\nHessenklinik Stadtkrankenhaus Korbach gGmbH – Korbach",
      "type": "Registerbekanntmachung nach dem Umwandlungsgesetz",
      "state": "Hessen",
      "amtsgericht": "Amtsgericht Korbach",
      "registernummer": "HRB 654",
      "registerart": "HRB",
      "company_name": "Hessenklinik Stadtkrankenhaus Korbach gGmbH",
      "company_seat": "Korbach",
      "details": "18.02.2026 (Bekanntmachungsdatum)\n\nHessen Amtsgericht Korbach HRB 654\nRegisterbekanntmachung nach dem Umwandlungsgesetz 18.02.2026 (Eintragungsdatum)\n\nHessenklinik Stadtkrankenhaus Korbach gGmbH\nGesellschaft mit beschränkter Haftung\nKorbach\n\nDen Gläubigern der an der Abspaltung beteiligten Rechtsträger ist, wenn sie binnen sechs Monaten nach dem Tag, an dem die Eintragung der Abspaltung in das Register des Sitzes desjenigen Rechtsträgers, dessen Gläubiger sie sind, nach §§ 125, 19 Absatz 3 UmwG bekannt gemacht worden ist, ihren Anspruch nach Grund und Höhe schriftlich anmelden, Sicherheit zu leisten, soweit sie nicht Befriedigung verlangen können. Dieses Recht steht den Gläubigern jedoch nur zu, wenn sie glaubhaft machen, dass durch die Abspaltung die Erfüllung ihrer Forderung gefährdet wird."
    },
    {
      "date": "2026-02-18",
      "id": "145482",
      "original_text": "Einreichung neuer Dokumente\nHessen Amtsgericht Frankfurt am Main HRB 133359\nZurich Insurance Europe AG – Frankfurt am Main",
      "type": "Einreichung neuer Dokumente",
      "state": "Hessen",
      "amtsgericht": "Amtsgericht Frankfurt am Main",
      "registernummer": "HRB 133359",
      "registerart": "HRB",
      "company_name": "Zurich Insurance Europe AG",
      "company_seat": "Frankfurt am Main",
      "details": "18.02.2026 (Bekanntmachungsdatum)\n\nHessen Amtsgericht Frankfurt am Main HRB 133359\nEinreichung neuer Dokumente\n\nZurich Insurance Europe AG\nAktiengesellschaft\nFrankfurt am Main\n\nDurch eine Änderung in den Personen der Aufsichtsratsmitglieder ist eine Liste der Mitglieder des Aufsichtsrates zum Handelsregister eingereicht worden."
    },
    {
      "date": "2026-02-18",
      "id": "145483",
      "original_text": "Registerbekanntmachung nach dem Umwandlungsgesetz\nHessen Amtsgericht Frankfurt am Main HRA 54026\nWeigandt e. K. – Frankfurt am Main",
      "type": "Registerbekanntmachung nach dem Umwandlungsgesetz",
      "state": "Hessen",
      "amtsgericht": "Amtsgericht Frankfurt am Main",
      "registernummer": "HRA 54026",
      "registerart": "HRA",
      "company_name": "Weigandt e. K.",
      "company_seat": "Frankfurt am Main",
      "details": "18.02.2026 (Bekanntmachungsdatum)\n\nHessen Amtsgericht Frankfurt am Main HRA 54026\nRegisterbekanntmachung nach dem Umwandlungsgesetz 18.02.2026 (Eintragungsdatum)\n\nWeigandt e. K.\nEinzelkaufmann / Einzelkauffrau\nFrankfurt am Main\n\nDen Gläubigern der an der Ausgliederung beteiligten Rechtsträger ist, wenn sie binnen sechs Monaten nach dem Tag, an dem die Eintragung der Ausgliederung in das Register des Sitzes desjenigen Rechtsträgers, dessen Gläubiger sie sind, nach §§ 125, 19 Absatz 3 UmwG bekannt gemacht worden ist, ihren Anspruch nach Grund und Höhe schriftlich anmelden, Sicherheit zu leisten, soweit sie nicht Befriedigung verlangen können. Dieses Recht steht den Gläubigern jedoch nur zu, wenn sie glaubhaft machen, dass durch die Ausgliederung die Erfüllung ihrer Forderung gefährdet wird."
    },
    {
      "date": "2026-02-18",
      "id": "145484",
      "original_text": "Einreichung neuer Dokumente\nHessen Amtsgericht Gießen HRB 11740\nDigital CFO AG – Gießen",
      "type": "Einreichung neuer Dokumente",
      "state": "Hessen",
      "amtsgericht": "Amtsgericht Gießen",
      "registernummer": "HRB 11740",
      "registerart": "HRB",
      "company_name": "Digital CFO AG",
      "company_seat": "Gießen",
      "details": "18.02.2026 (Bekanntmachungsdatum)\n\nHessen Amtsgericht Gießen HRB 11740\nEinreichung neuer Dokumente\n\nDigital CFO AG\nAktiengesellschaft\nGießen\n\nAufgrund einer Änderung in den Personen der Aufsichtsratsmitglieder ist eine Liste der Mitglieder des Aufsichtsrates zum Handelsregister eingereicht worden."
    },
    {
      "date": "2026-02-18",
      "id": "145485",
      "original_text": "Einreichung neuer Dokumente\nHessen Amtsgericht Bad Homburg v.d.H. HRB 16817\nTaunus Trust AG – Bad Homburg v. d. Höhe",
      "type": "Einreichung neuer Dokumente",
      "state": "Hessen",
      "amtsgericht": "Amtsgericht Bad Homburg v.d.H.",
      "registernummer": "HRB 16817",
      "registerart": "HRB",
      "company_name": "Taunus Trust AG",
      "company_seat": "Bad Homburg v. d. Höhe",
      "details": "18.02.2026 (Bekanntmachungsdatum)\n\nHessen Amtsgericht Bad Homburg v.d.H. HRB 16817\nEinreichung neuer Dokumente\n\nTaunus Trust AG\nAktiengesellschaft\nBad Homburg v. d. Höhe\n\nDurch eine Änderung in den Personen der Aufsichtsratsmitglieder ist eine Liste der Mitglieder des Aufsichtsrates zum Handelsregister eingereicht worden."
    },
    {
      "date": "2026-02-18",
      "id": "145486",
      "original_text": "Registerbekanntmachung nach dem Umwandlungsgesetz\nHessen Amtsgericht Korbach HRB 2694\nHaus am Nordwall Holding gGmbH – Korbach",
      "type": "Registerbekanntmachung nach dem Umwandlungsgesetz",
      "state": "Hessen",
      "amtsgericht": "Amtsgericht Korbach",
      "registernummer": "HRB 2694",
      "registerart": "HRB",
      "company_name": "Haus am Nordwall Holding gGmbH",
      "company_seat": "Korbach",
      "details": "18.02.2026 (Bekanntmachungsdatum)\n\nHessen Amtsgericht Korbach HRB 2694\nRegisterbekanntmachung nach dem Umwandlungsgesetz 18.02.2026 (Eintragungsdatum)\n\nHaus am Nordwall Holding gGmbH\nGesellschaft mit beschränkter Haftung\nKorbach\n\nDen Gläubigern der an der Abspaltung beteiligten Rechtsträger ist, wenn sie binnen sechs Monaten nach dem Tag, an dem die Eintragung der Abspaltung in das Register des Sitzes desjenigen Rechtsträgers, dessen Gläubiger sie sind, nach §§ 125, 19 Absatz 3 UmwG bekannt gemacht worden ist, ihren Anspruch nach Grund und Höhe schriftlich anmelden, Sicherheit zu leisten, soweit sie nicht Befriedigung verlangen können. Dieses Recht steht den Gläubigern jedoch nur zu, wenn sie glaubhaft machen, dass durch die Abspaltung die Erfüllung ihrer Forderung gefährdet wird."
    }
  ]
}