{
  "date": "2026-02-12",
  "date_of_scrape": "2026-02-13T04:43:46.921Z",
  "tool_version": "0.2.0",
  "number_of_announcements": 149,
  "announcements": [
    {
      "date": "2026-02-12",
      "id": "144913",
      "original_text": "Einreichung neuer Dokumente\nBayern Amtsgericht Augsburg HRB 759\nOettinger Brauerei GmbH – Oettingen",
      "type": "Einreichung neuer Dokumente",
      "state": "Bayern",
      "amtsgericht": "Amtsgericht Augsburg",
      "registernummer": "HRB 759",
      "registerart": "HRB",
      "company_name": "Oettinger Brauerei GmbH",
      "company_seat": "Oettingen",
      "details": "12.02.2026 (Bekanntmachungsdatum)\n\nBayern Amtsgericht Augsburg HRB 759\nEinreichung neuer Dokumente 11.02.2026 (Eintragungsdatum)\n\nOettinger Brauerei GmbH\nGesellschaft mit beschränkter Haftung\nOettingen\n\nDem Amtsgericht Augsburg -Registergericht- ist eine Liste der Mitglieder des Aufsichtsrats eingereicht worden, § 52 Abs. 3 S. 2 GmbHG."
    },
    {
      "date": "2026-02-12",
      "id": "144914",
      "original_text": "Registerbekanntmachung nach dem Umwandlungsgesetz\nBayern Amtsgericht München HRB 297240\nEKW Immobilienverwaltung GmbH – München",
      "type": "Registerbekanntmachung nach dem Umwandlungsgesetz",
      "state": "Bayern",
      "amtsgericht": "Amtsgericht München",
      "registernummer": "HRB 297240",
      "registerart": "HRB",
      "company_name": "EKW Immobilienverwaltung GmbH",
      "company_seat": "München",
      "details": "12.02.2026 (Bekanntmachungsdatum)\n\nBayern Amtsgericht München HRB 297240\nRegisterbekanntmachung nach dem Umwandlungsgesetz 11.02.2026 (Eintragungsdatum)\n\nEKW Immobilienverwaltung GmbH\nGesellschaft mit beschränkter Haftung\nMünchen\n\nDen Gläubigern der an der Verschmelzung beteiligten Rechtsträger ist, wenn sie binnen sechs Monaten nach dem Tag, an dem die Eintragung der Verschmelzung in das Register des Sitzes desjenigen Rechtsträgers, dessen Gläubiger sie sind, nach § 19 Abs. 3 UmwG als bekannt gemacht gilt, ihren Anspruch nach Grund und Höhe in Textform anmelden, Sicherheit zu leisten, soweit sie nicht Befriedigung verlangen können. Dieses Recht steht den Gläubigern jedoch nur zu, wenn sie glaubhaft machen, dass durch die Verschmelzung die Erfüllung ihrer Forderung gefährdet wird."
    },
    {
      "date": "2026-02-12",
      "id": "144915",
      "original_text": "Registerbekanntmachung nach dem Umwandlungsgesetz\nBayern Amtsgericht München HRB 285046\nKWP III Sindersdorf UG (haftungsbeschränkt) – München",
      "type": "Registerbekanntmachung nach dem Umwandlungsgesetz",
      "state": "Bayern",
      "amtsgericht": "Amtsgericht München",
      "registernummer": "HRB 285046",
      "registerart": "HRB",
      "company_name": "KWP III Sindersdorf UG (haftungsbeschränkt)",
      "company_seat": "München",
      "details": "12.02.2026 (Bekanntmachungsdatum)\n\nBayern Amtsgericht München HRB 285046\nRegisterbekanntmachung nach dem Umwandlungsgesetz 11.02.2026 (Eintragungsdatum)\n\nKWP III Sindersdorf UG (haftungsbeschränkt)\nGesellschaft mit beschränkter Haftung\nMünchen\n\nDen Gläubigern der an der Verschmelzung beteiligten Rechtsträger ist, wenn sie binnen sechs Monaten nach dem Tag, an dem die Eintragung der Verschmelzung in das Register des Sitzes desjenigen Rechtsträgers, dessen Gläubiger sie sind, nach § 19 Abs. 3 UmwG als bekannt gemacht gilt, ihren Anspruch nach Grund und Höhe in Textform anmelden, Sicherheit zu leisten, soweit sie nicht Befriedigung verlangen können. Dieses Recht steht den Gläubigern jedoch nur zu, wenn sie glaubhaft machen, dass durch die Verschmelzung die Erfüllung ihrer Forderung gefährdet wird."
    },
    {
      "date": "2026-02-12",
      "id": "144916",
      "original_text": "Registerbekanntmachung nach dem Umwandlungsgesetz\nBayern Amtsgericht Nürnberg HRA 20451\nGrigorios Ziouzios Restaurant + Pension e.K. – Nürnberg",
      "type": "Registerbekanntmachung nach dem Umwandlungsgesetz",
      "state": "Bayern",
      "amtsgericht": "Amtsgericht Nürnberg",
      "registernummer": "HRA 20451",
      "registerart": "HRA",
      "company_name": "Grigorios Ziouzios Restaurant + Pension e.K.",
      "company_seat": "Nürnberg",
      "details": "12.02.2026 (Bekanntmachungsdatum)\n\nBayern Amtsgericht Nürnberg HRA 20451\nRegisterbekanntmachung nach dem Umwandlungsgesetz 11.02.2026 (Eintragungsdatum)\n\nGrigorios Ziouzios Restaurant + Pension e.K.\nEinzelkaufmann / Einzelkauffrau\nNürnberg\n\nDen Gläubigern der an der Ausgliederung beteiligten Rechtsträger ist, wenn sie binnen sechs Monaten nach dem Tag, an dem die Eintragung der Ausgliederung in das Register des Sitzes desjenigen Rechtsträgers, dessen Gläubiger sie sind, nach §§ 125, 19 Abs. 3 UmwG als bekannt gemacht gilt, ihren Anspruch nach Grund und Höhe in Textform anmelden, Sicherheit zu leisten, soweit sie nicht Befriedigung verlangen können. Dieses Recht steht den Gläubigern jedoch nur zu, wenn sie glaubhaft machen, dass durch die Ausgliederung die Erfüllung ihrer Forderung gefährdet wird."
    },
    {
      "date": "2026-02-12",
      "id": "144917",
      "original_text": "Registerbekanntmachung nach dem Umwandlungsgesetz\nBayern Amtsgericht München HRA 101129\nGreen City Energy Kraftwerkspark II GmbH & Co. KG – München",
      "type": "Registerbekanntmachung nach dem Umwandlungsgesetz",
      "state": "Bayern",
      "amtsgericht": "Amtsgericht München",
      "registernummer": "HRA 101129",
      "registerart": "HRA",
      "company_name": "Green City Energy Kraftwerkspark II GmbH & Co. KG",
      "company_seat": "München",
      "details": "12.02.2026 (Bekanntmachungsdatum)\n\nBayern Amtsgericht München HRA 101129\nRegisterbekanntmachung nach dem Umwandlungsgesetz 11.02.2026 (Eintragungsdatum)\n\nGreen City Energy Kraftwerkspark II GmbH & Co. KG\nKommanditgesellschaft\nMünchen\n\nDen Gläubigern der an der Verschmelzung beteiligten Rechtsträger ist, wenn sie binnen sechs Monaten nach dem Tag, an dem die Eintragung der Verschmelzung in das Register des Sitzes desjenigen Rechtsträgers, dessen Gläubiger sie sind, nach § 19 Abs. 3 UmwG als bekannt gemacht gilt, ihren Anspruch nach Grund und Höhe in Textform anmelden, Sicherheit zu leisten, soweit sie nicht Befriedigung verlangen können. Dieses Recht steht den Gläubigern jedoch nur zu, wenn sie glaubhaft machen, dass durch die Verschmelzung die Erfüllung ihrer Forderung gefährdet wird."
    },
    {
      "date": "2026-02-12",
      "id": "144918",
      "original_text": "Einreichung neuer Dokumente\nBayern Amtsgericht München HRB 144217\nHVB Immobilien AG – München",
      "type": "Einreichung neuer Dokumente",
      "state": "Bayern",
      "amtsgericht": "Amtsgericht München",
      "registernummer": "HRB 144217",
      "registerart": "HRB",
      "company_name": "HVB Immobilien AG",
      "company_seat": "München",
      "details": "12.02.2026 (Bekanntmachungsdatum)\n\nBayern Amtsgericht München HRB 144217\nEinreichung neuer Dokumente\n\nHVB Immobilien AG\nAktiengesellschaft\nMünchen\n\nDem Amtsgericht München -Registergericht- ist eine Liste der Mitglieder des Aufsichtsrats eingereicht worden, § 106 AktG."
    },
    {
      "date": "2026-02-12",
      "id": "144919",
      "original_text": "Registerbekanntmachung nach dem Umwandlungsgesetz\nBayern Amtsgericht Fürth HRB 16632\nP&P Objekt 26 GmbH – Fürth",
      "type": "Registerbekanntmachung nach dem Umwandlungsgesetz",
      "state": "Bayern",
      "amtsgericht": "Amtsgericht Fürth",
      "registernummer": "HRB 16632",
      "registerart": "HRB",
      "company_name": "P&P Objekt 26 GmbH",
      "company_seat": "Fürth",
      "details": "12.02.2026 (Bekanntmachungsdatum)\n\nBayern Amtsgericht Fürth HRB 16632\nRegisterbekanntmachung nach dem Umwandlungsgesetz 11.02.2026 (Eintragungsdatum)\n\nP&P Objekt 26 GmbH\nGesellschaft mit beschränkter Haftung\nFürth\n\nDen Gläubigern der an der Verschmelzung beteiligten Rechtsträger ist, wenn sie binnen sechs Monaten nach dem Tag, an dem die Eintragung der Verschmelzung in das Register des Sitzes desjenigen Rechtsträgers, dessen Gläubiger sie sind, nach § 19 Abs. 3 UmwG als bekannt gemacht gilt, ihren Anspruch nach Grund und Höhe in Textform anmelden, Sicherheit zu leisten, soweit sie nicht Befriedigung verlangen können. Dieses Recht steht den Gläubigern jedoch nur zu, wenn sie glaubhaft machen, dass durch die Verschmelzung die Erfüllung ihrer Forderung gefährdet wird."
    },
    {
      "date": "2026-02-12",
      "id": "144920",
      "original_text": "Sonstige Registerbekanntmachung\nBayern Amtsgericht München HRB 226399\nPHÖNIX-Seniorenzentrum Am Muppberg GmbH – München",
      "type": "Sonstige Registerbekanntmachung",
      "state": "Bayern",
      "amtsgericht": "Amtsgericht München",
      "registernummer": "HRB 226399",
      "registerart": "HRB",
      "company_name": "PHÖNIX-Seniorenzentrum Am Muppberg GmbH",
      "company_seat": "München",
      "details": "12.02.2026 (Bekanntmachungsdatum)\n\nBayern Amtsgericht München HRB 226399\nSonstige Registerbekanntmachung 11.02.2026 (Eintragungsdatum)\n\nPHÖNIX-Seniorenzentrum Am Muppberg GmbH\nGesellschaft mit beschränkter Haftung\nMünchen\n\nDen Gläubigern der Gesellschaft, deren Forderungen begründet worden sind, bevor die Eintragung der Beendigung des Beherrschungs- und Gewinnabführungsvertrages in das Handelsregister nach § 10 des Handelsgesetzbuches als bekanntgemacht gilt, hat der andere Vertragsteil Sicherheit zu leisten, wenn sie sich binnen sechs Monaten nach der Bekanntmachung der Eintragung zu diesem Zweck bei ihm melden."
    },
    {
      "date": "2026-02-12",
      "id": "144921",
      "original_text": "Registerbekanntmachung nach dem Umwandlungsgesetz\nBayern Amtsgericht München HRA 122080\nBittl PV-Anlagen e.K. – Schongau",
      "type": "Registerbekanntmachung nach dem Umwandlungsgesetz",
      "state": "Bayern",
      "amtsgericht": "Amtsgericht München",
      "registernummer": "HRA 122080",
      "registerart": "HRA",
      "company_name": "Bittl PV-Anlagen e.K.",
      "company_seat": "Schongau",
      "details": "12.02.2026 (Bekanntmachungsdatum)\n\nBayern Amtsgericht München HRA 122080\nRegisterbekanntmachung nach dem Umwandlungsgesetz 11.02.2026 (Eintragungsdatum)\n\nBittl PV-Anlagen e.K.\nEinzelkaufmann / Einzelkauffrau\nSchongau\n\nDen Gläubigern der an der Ausgliederung beteiligten Rechtsträger ist, wenn sie binnen sechs Monaten nach dem Tag, an dem die Eintragung der Ausgliederung in das Register des Sitzes desjenigen Rechtsträgers, dessen Gläubiger sie sind, nach §§ 125, 19 Abs. 3 UmwG als bekannt gemacht gilt, ihren Anspruch nach Grund und Höhe in Textform anmelden, Sicherheit zu leisten, soweit sie nicht Befriedigung verlangen können. Dieses Recht steht den Gläubigern jedoch nur zu, wenn sie glaubhaft machen, dass durch die Ausgliederung die Erfüllung ihrer Forderung gefährdet wird."
    },
    {
      "date": "2026-02-12",
      "id": "144922",
      "original_text": "Einreichung neuer Dokumente\nBayern Amtsgericht München HRB 126904\nCS CLEAN SYSTEMS AG – Ismaning",
      "type": "Einreichung neuer Dokumente",
      "state": "Bayern",
      "amtsgericht": "Amtsgericht München",
      "registernummer": "HRB 126904",
      "registerart": "HRB",
      "company_name": "CS CLEAN SYSTEMS AG",
      "company_seat": "Ismaning",
      "details": "12.02.2026 (Bekanntmachungsdatum)\n\nBayern Amtsgericht München HRB 126904\nEinreichung neuer Dokumente 11.02.2026 (Eintragungsdatum)\n\nCS CLEAN SYSTEMS AG\nAktiengesellschaft\nIsmaning\n\nDem Amtsgericht München -Registergericht- ist eine Liste der Mitglieder des Aufsichtsrats eingereicht worden, § 106 AktG."
    },
    {
      "date": "2026-02-12",
      "id": "144923",
      "original_text": "Registerbekanntmachung nach dem Umwandlungsgesetz\nBayern Amtsgericht Weiden i. d. OPf. HRB 3559\nCHPW GmbH – Weiden",
      "type": "Registerbekanntmachung nach dem Umwandlungsgesetz",
      "state": "Bayern",
      "amtsgericht": "Amtsgericht Weiden i. d. OPf.",
      "registernummer": "HRB 3559",
      "registerart": "HRB",
      "company_name": "CHPW GmbH",
      "company_seat": "Weiden",
      "details": "12.02.2026 (Bekanntmachungsdatum)\n\nBayern Amtsgericht Weiden i. d. OPf. HRB 3559\nRegisterbekanntmachung nach dem Umwandlungsgesetz 11.02.2026 (Eintragungsdatum)\n\nCHPW GmbH\nGesellschaft mit beschränkter Haftung\nWeiden\n\nDen Gläubigernder an der Verschmelzung beteiligten Rechtsträger ist, wenn sie binnen sechs Monaten nach dem Tag, an dem die Eintragung der Verschmelzung in das Register des Sitzes desjenigen Rechtsträgers, dessen Gläubiger sie sind, nach § 19 Abs. 3 UmwG als bekannt gemacht gilt, ihren Anspruch nach Grund und Höhe in Textform anmelden, Sicherheit zu leisten, soweit sie nicht Befriedigung verlangen können. Dieses Recht steht den Gläubigern jedoch nur zu, wenn sie glaubhaft machen, dass durch die Verschmelzung die Erfüllung ihrer Forderung gefährdet wird."
    },
    {
      "date": "2026-02-12",
      "id": "144924",
      "original_text": "Einreichung neuer Dokumente\nBayern Amtsgericht Nürnberg HRB 18678\nQRC Group AG – Nürnberg",
      "type": "Einreichung neuer Dokumente",
      "state": "Bayern",
      "amtsgericht": "Amtsgericht Nürnberg",
      "registernummer": "HRB 18678",
      "registerart": "HRB",
      "company_name": "QRC Group AG",
      "company_seat": "Nürnberg",
      "details": "12.02.2026 (Bekanntmachungsdatum)\n\nBayern Amtsgericht Nürnberg HRB 18678\nEinreichung neuer Dokumente\n\nQRC Group AG\nAktiengesellschaft\nNürnberg\n\nDem Amtsgericht Nürnberg -Registergericht- sind Listen der Mitglieder des Aufsichtsrats eingereicht worden, § 106 AktG."
    },
    {
      "date": "2026-02-12",
      "id": "144925",
      "original_text": "Registerbekanntmachung nach dem Umwandlungsgesetz\nBayern Amtsgericht Passau HRB 13188\nBK Elektrik GmbH – Passau",
      "type": "Registerbekanntmachung nach dem Umwandlungsgesetz",
      "state": "Bayern",
      "amtsgericht": "Amtsgericht Passau",
      "registernummer": "HRB 13188",
      "registerart": "HRB",
      "company_name": "BK Elektrik GmbH",
      "company_seat": "Passau",
      "details": "12.02.2026 (Bekanntmachungsdatum)\n\nBayern Amtsgericht Passau HRB 13188\nRegisterbekanntmachung nach dem Umwandlungsgesetz 11.02.2026 (Eintragungsdatum)\n\nBK Elektrik GmbH\nGesellschaft mit beschränkter Haftung\nPassau\n\nDen Gläubigern der an der Ausgliederung beteiligten Rechtsträger ist, wenn sie binnen sechs Monaten nach dem Tag, an dem die Eintragung der Ausgliederung in das Register des Sitzes desjenigen Rechtsträgers, dessen Gläubiger sie sind, nach §§ 125, 19 Abs. 3 UmwG als bekannt gemacht gilt, ihren Anspruch nach Grund und Höhe in Textform anmelden, Sicherheit zu leisten, soweit sie nicht Befriedigung verlangen können. Dieses Recht steht den Gläubigern jedoch nur zu, wenn sie glaubhaft machen, dass durch die Ausgliederung die Erfüllung ihrer Forderung gefährdet wird."
    },
    {
      "date": "2026-02-12",
      "id": "144926",
      "original_text": "Einreichung neuer Dokumente\nBayern Amtsgericht München HRB 199587\nWebasto SE – Gauting",
      "type": "Einreichung neuer Dokumente",
      "state": "Bayern",
      "amtsgericht": "Amtsgericht München",
      "registernummer": "HRB 199587",
      "registerart": "HRB",
      "company_name": "Webasto SE",
      "company_seat": "Gauting",
      "details": "12.02.2026 (Bekanntmachungsdatum)\n\nBayern Amtsgericht München HRB 199587\nEinreichung neuer Dokumente\n\nWebasto SE\nEuropäische Aktiengesellschaft (SE)\nGauting\n\nDem Amtsgericht München -Registergericht- ist eine Liste der Mitglieder des Aufsichtsrats eingereicht worden, Art. 9 Abs. 1 Buchst. c (ii) SE-VO i.V.m. § 106 AktG."
    },
    {
      "date": "2026-02-12",
      "id": "144927",
      "original_text": "Registerbekanntmachung nach dem Umwandlungsgesetz\nBayern Amtsgericht Fürth HRB 16888\nP&P Objekt 33 GmbH – Fürth",
      "type": "Registerbekanntmachung nach dem Umwandlungsgesetz",
      "state": "Bayern",
      "amtsgericht": "Amtsgericht Fürth",
      "registernummer": "HRB 16888",
      "registerart": "HRB",
      "company_name": "P&P Objekt 33 GmbH",
      "company_seat": "Fürth",
      "details": "12.02.2026 (Bekanntmachungsdatum)\n\nBayern Amtsgericht Fürth HRB 16888\nRegisterbekanntmachung nach dem Umwandlungsgesetz 11.02.2026 (Eintragungsdatum)\n\nP&P Objekt 33 GmbH\nGesellschaft mit beschränkter Haftung\nFürth\n\nDen Gläubigern der an der Verschmelzung beteiligten Rechtsträger ist, wenn sie binnen sechs Monaten nach dem Tag, an dem die Eintragung der Verschmelzung in das Register des Sitzes desjenigen Rechtsträgers, dessen Gläubiger sie sind, nach § 19 Abs. 3 UmwG als bekannt gemacht gilt, ihren Anspruch nach Grund und Höhe in Textform anmelden, Sicherheit zu leisten, soweit sie nicht Befriedigung verlangen können. Dieses Recht steht den Gläubigern jedoch nur zu, wenn sie glaubhaft machen, dass durch die Verschmelzung die Erfüllung ihrer Forderung gefährdet wird."
    },
    {
      "date": "2026-02-12",
      "id": "144928",
      "original_text": "Löschungsankündigung\nBayern Amtsgericht München HRB 242758\nNSE Holding UG (haftungsbeschränkt) – München",
      "type": "Löschungsankündigung",
      "state": "Bayern",
      "amtsgericht": "Amtsgericht München",
      "registernummer": "HRB 242758",
      "registerart": "HRB",
      "company_name": "NSE Holding UG (haftungsbeschränkt)",
      "company_seat": "München",
      "details": "12.02.2026 (Bekanntmachungsdatum)\n\nBayern Amtsgericht München HRB 242758\nLöschungsankündigung\n\nNSE Holding UG (haftungsbeschränkt)\nGesellschaft mit beschränkter Haftung\nMünchen\n\nDas Registergericht beabsichtigt, die im Handelsregister eingetragene Gesellschaft wegen Vermögenslosigkeit von Amts wegen nach § 394 FamFG zu löschen. Die Frist zur Erhebung eines Widerspruchs ist auf einen Monat festgesetzt."
    },
    {
      "date": "2026-02-12",
      "id": "144929",
      "original_text": "Löschungsankündigung\nBayern Amtsgericht Landshut HRB 10933\nReiseservice Görg UG (haftungsbeschränkt) – Buch am Erlbach",
      "type": "Löschungsankündigung",
      "state": "Bayern",
      "amtsgericht": "Amtsgericht Landshut",
      "registernummer": "HRB 10933",
      "registerart": "HRB",
      "company_name": "Reiseservice Görg UG (haftungsbeschränkt)",
      "company_seat": "Buch am Erlbach",
      "details": "12.02.2026 (Bekanntmachungsdatum)\n\nBayern Amtsgericht Landshut HRB 10933\nLöschungsankündigung\n\nReiseservice Görg UG (haftungsbeschränkt)\nGesellschaft mit beschränkter Haftung\nBuch am Erlbach\n\nDas Registergericht beabsichtigt, die im Handelsregister eingetragene Gesellschaft wegen Vermögenslosigkeit von Amts wegen nach § 394 FamFG zu löschen. Die Frist zur Erhebung eines Widerspruchs ist auf einen Monat festgesetzt."
    },
    {
      "date": "2026-02-12",
      "id": "144930",
      "original_text": "Löschungsankündigung\nBayern Amtsgericht München HRA 8372\nHermann Fäger - GmbH & Co. KG – München",
      "type": "Löschungsankündigung",
      "state": "Bayern",
      "amtsgericht": "Amtsgericht München",
      "registernummer": "HRA 8372",
      "registerart": "HRA",
      "company_name": "Hermann Fäger - GmbH & Co. KG",
      "company_seat": "München",
      "details": "12.02.2026 (Bekanntmachungsdatum)\n\nBayern Amtsgericht München HRA 8372\nLöschungsankündigung\n\nHermann Fäger - GmbH & Co. KG\nKommanditgesellschaft\nMünchen\n\nDas Registergericht beabsichtigt, die im Handelsregister eingetragene Firma von Amts wegen nach § 31 Abs. 2 HGB zu löschen. Die Frist zur Erhebung eines Widerspruchs ist auf drei Monate festgesetzt."
    },
    {
      "date": "2026-02-12",
      "id": "144931",
      "original_text": "Einreichung neuer Dokumente\nBayern Amtsgericht München HRB 227195\nAllane SE – Garching",
      "type": "Einreichung neuer Dokumente",
      "state": "Bayern",
      "amtsgericht": "Amtsgericht München",
      "registernummer": "HRB 227195",
      "registerart": "HRB",
      "company_name": "Allane SE",
      "company_seat": "Garching",
      "details": "12.02.2026 (Bekanntmachungsdatum)\n\nBayern Amtsgericht München HRB 227195\nEinreichung neuer Dokumente\n\nAllane SE\nEuropäische Aktiengesellschaft (SE)\nGarching\n\nDem Amtsgericht München -Registergericht- ist eine Liste der Mitglieder des Aufsichtsrats eingereicht worden, Art. 9 Abs. 1 Buchst. c (ii) SE-VO i.V.m. § 106 AktG."
    },
    {
      "date": "2026-02-12",
      "id": "144932",
      "original_text": "Löschungsankündigung\nBayern Amtsgericht München HRB 287273\nAllelon UG (haftungsbeschränkt) – München",
      "type": "Löschungsankündigung",
      "state": "Bayern",
      "amtsgericht": "Amtsgericht München",
      "registernummer": "HRB 287273",
      "registerart": "HRB",
      "company_name": "Allelon UG (haftungsbeschränkt)",
      "company_seat": "München",
      "details": "12.02.2026 (Bekanntmachungsdatum)\n\nBayern Amtsgericht München HRB 287273\nLöschungsankündigung\n\nAllelon UG (haftungsbeschränkt)\nGesellschaft mit beschränkter Haftung\nMünchen\n\nDas Registergericht beabsichtigt, die im Handelsregister eingetragene Gesellschaft wegen Vermögenslosigkeit von Amts wegen nach § 394 FamFG zu löschen. Die Frist zur Erhebung eines Widerspruchs ist auf einen Monat festgesetzt."
    },
    {
      "date": "2026-02-12",
      "id": "144933",
      "original_text": "Registerbekanntmachung nach dem Umwandlungsgesetz\nBayern Amtsgericht München HRB 118420\nMontagedienst Bernhart GmbH – Kirchberg",
      "type": "Registerbekanntmachung nach dem Umwandlungsgesetz",
      "state": "Bayern",
      "amtsgericht": "Amtsgericht München",
      "registernummer": "HRB 118420",
      "registerart": "HRB",
      "company_name": "Montagedienst Bernhart GmbH",
      "company_seat": "Kirchberg",
      "details": "12.02.2026 (Bekanntmachungsdatum)\n\nBayern Amtsgericht München HRB 118420\nRegisterbekanntmachung nach dem Umwandlungsgesetz 11.02.2026 (Eintragungsdatum)\n\nMontagedienst Bernhart GmbH\nGesellschaft mit beschränkter Haftung\nKirchberg\n\nDen Gläubigern der an der Verschmelzung beteiligten Rechtsträger ist, wenn sie binnen sechs Monaten nach dem Tag, an dem die Eintragung der Verschmelzung in das Register des Sitzes desjenigen Rechtsträgers, dessen Gläubiger sie sind, nach § 19 Abs. 3 UmwG als bekannt gemacht gilt, ihren Anspruch nach Grund und Höhe in Textform anmelden, Sicherheit zu leisten, soweit sie nicht Befriedigung verlangen können. Dieses Recht steht den Gläubigern jedoch nur zu, wenn sie glaubhaft machen, dass durch die Verschmelzung die Erfüllung ihrer Forderung gefährdet wird."
    },
    {
      "date": "2026-02-12",
      "id": "144934",
      "original_text": "Registerbekanntmachung nach dem Umwandlungsgesetz\nBayern Amtsgericht München HRA 121990\nFelix Kuffner e.K. – Grafrath",
      "type": "Registerbekanntmachung nach dem Umwandlungsgesetz",
      "state": "Bayern",
      "amtsgericht": "Amtsgericht München",
      "registernummer": "HRA 121990",
      "registerart": "HRA",
      "company_name": "Felix Kuffner e.K.",
      "company_seat": "Grafrath",
      "details": "12.02.2026 (Bekanntmachungsdatum)\n\nBayern Amtsgericht München HRA 121990\nRegisterbekanntmachung nach dem Umwandlungsgesetz 11.02.2026 (Eintragungsdatum)\n\nFelix Kuffner e.K.\nEinzelkaufmann / Einzelkauffrau\nGrafrath\n\nDen Gläubigern der an der Ausgliederung beteiligten Rechtsträger ist, wenn sie binnen sechs Monaten nach dem Tag, an dem die Eintragung der Ausgliederung in das Register des Sitzes desjenigen Rechtsträgers, dessen Gläubiger sie sind, nach §§ 125, 19 Abs. 3 UmwG als bekannt gemacht gilt, ihren Anspruch nach Grund und Höhe in Textform anmelden, Sicherheit zu leisten, soweit sie nicht Befriedigung verlangen können. Dieses Recht steht den Gläubigern jedoch nur zu, wenn sie glaubhaft machen, dass durch die Ausgliederung die Erfüllung ihrer Forderung gefährdet wird."
    },
    {
      "date": "2026-02-12",
      "id": "144935",
      "original_text": "Löschungsankündigung\nBayern Amtsgericht München HRB 287260\nDXKang GmbH – Hohenbrunn",
      "type": "Löschungsankündigung",
      "state": "Bayern",
      "amtsgericht": "Amtsgericht München",
      "registernummer": "HRB 287260",
      "registerart": "HRB",
      "company_name": "DXKang GmbH",
      "company_seat": "Hohenbrunn",
      "details": "12.02.2026 (Bekanntmachungsdatum)\n\nBayern Amtsgericht München HRB 287260\nLöschungsankündigung\n\nDXKang GmbH\nGesellschaft mit beschränkter Haftung\nHohenbrunn\n\nDas Registergericht beabsichtigt, die im Handelsregister eingetragene Gesellschaft wegen Vermögenslosigkeit von Amts wegen nach § 394 FamFG zu löschen. Die Frist zur Erhebung eines Widerspruchs ist auf einen Monat festgesetzt."
    },
    {
      "date": "2026-02-12",
      "id": "144936",
      "original_text": "Sonstige Registerbekanntmachung\nBayern Amtsgericht München HRB 206318\nSistems GmbH – Markt Schwaben",
      "type": "Sonstige Registerbekanntmachung",
      "state": "Bayern",
      "amtsgericht": "Amtsgericht München",
      "registernummer": "HRB 206318",
      "registerart": "HRB",
      "company_name": "Sistems GmbH",
      "company_seat": "Markt Schwaben",
      "details": "12.02.2026 (Bekanntmachungsdatum)\n\nBayern Amtsgericht München HRB 206318\nSonstige Registerbekanntmachung 11.02.2026 (Eintragungsdatum)\n\nSistems GmbH\nGesellschaft mit beschränkter Haftung\nMarkt Schwaben\n\nDen Gläubigern der Gesellschaft, deren Forderungen begründet worden sind, bevor die Eintragung der Beendigung des Gewinnabführungsvertrages in das Handelsregister nach § 10 des Handelsgesetzbuches als bekanntgemacht gilt, hat der andere Vertragsteil Sicherheit zu leisten, wenn sie sich binnen sechs Monaten nach der Bekanntmachung der Eintragung zu diesem Zweck bei ihm melden."
    },
    {
      "date": "2026-02-12",
      "id": "144937",
      "original_text": "Registerbekanntmachung nach dem Umwandlungsgesetz\nBayern Amtsgericht München HRA 101129\nGreen City Energy Kraftwerkspark II GmbH & Co. KG – München",
      "type": "Registerbekanntmachung nach dem Umwandlungsgesetz",
      "state": "Bayern",
      "amtsgericht": "Amtsgericht München",
      "registernummer": "HRA 101129",
      "registerart": "HRA",
      "company_name": "Green City Energy Kraftwerkspark II GmbH & Co. KG",
      "company_seat": "München",
      "details": "12.02.2026 (Bekanntmachungsdatum)\n\nBayern Amtsgericht München HRA 101129\nRegisterbekanntmachung nach dem Umwandlungsgesetz 11.02.2026 (Eintragungsdatum)\n\nGreen City Energy Kraftwerkspark II GmbH & Co. KG\nKommanditgesellschaft\nMünchen\n\nDen Gläubigern der an der Verschmelzung beteiligten Rechtsträger ist, wenn sie binnen sechs Monaten nach dem Tag, an dem die Eintragung der Verschmelzung in das Register des Sitzes desjenigen Rechtsträgers, dessen Gläubiger sie sind, nach § 19 Abs. 3 UmwG als bekannt gemacht gilt, ihren Anspruch nach Grund und Höhe in Textform anmelden, Sicherheit zu leisten, soweit sie nicht Befriedigung verlangen können. Dieses Recht steht den Gläubigern jedoch nur zu, wenn sie glaubhaft machen, dass durch die Verschmelzung die Erfüllung ihrer Forderung gefährdet wird."
    },
    {
      "date": "2026-02-12",
      "id": "144938",
      "original_text": "Registerbekanntmachung nach dem Umwandlungsgesetz\nBayern Amtsgericht Passau HRA 14055\nBK Elektrik e.K. – Passau",
      "type": "Registerbekanntmachung nach dem Umwandlungsgesetz",
      "state": "Bayern",
      "amtsgericht": "Amtsgericht Passau",
      "registernummer": "HRA 14055",
      "registerart": "HRA",
      "company_name": "BK Elektrik e.K.",
      "company_seat": "Passau",
      "details": "12.02.2026 (Bekanntmachungsdatum)\n\nBayern Amtsgericht Passau HRA 14055\nRegisterbekanntmachung nach dem Umwandlungsgesetz 11.02.2026 (Eintragungsdatum)\n\nBK Elektrik e.K.\nEinzelkaufmann / Einzelkauffrau\nPassau\n\nDen Gläubigern der an der Ausgliederung beteiligten Rechtsträger ist, wenn sie binnen sechs Monaten nach dem Tag, an dem die Eintragung der Ausgliederung in das Register des Sitzes desjenigen Rechtsträgers, dessen Gläubiger sie sind, nach §§ 125, 19 Abs. 3 UmwG als bekannt gemacht gilt, ihren Anspruch nach Grund und Höhe in Textform anmelden, Sicherheit zu leisten, soweit sie nicht Befriedigung verlangen können. Dieses Recht steht den Gläubigern jedoch nur zu, wenn sie glaubhaft machen, dass durch die Ausgliederung die Erfüllung ihrer Forderung gefährdet wird."
    },
    {
      "date": "2026-02-12",
      "id": "144939",
      "original_text": "Sonstige Registerbekanntmachung\nBayern Amtsgericht München HRB 307605\nJoblocal GmbH – München",
      "type": "Sonstige Registerbekanntmachung",
      "state": "Bayern",
      "amtsgericht": "Amtsgericht München",
      "registernummer": "HRB 307605",
      "registerart": "HRB",
      "company_name": "Joblocal GmbH",
      "company_seat": "München",
      "details": "12.02.2026 (Bekanntmachungsdatum)\n\nBayern Amtsgericht München HRB 307605\nSonstige Registerbekanntmachung 11.02.2026 (Eintragungsdatum)\n\nJoblocal GmbH\nGesellschaft mit beschränkter Haftung\nMünchen\n\nDen Gläubigern der Gesellschaft, deren Forderungen begründet worden sind, bevor die Eintragung der Beendigung des Gewinnabführungsvertrages in das Handelsregister nach § 10 des Handelsgesetzbuches als bekanntgemacht gilt, hat der andere Vertragsteil Sicherheit zu leisten, wenn sie sich binnen sechs Monaten nach der Bekanntmachung der Eintragung zu diesem Zweck bei ihm melden."
    },
    {
      "date": "2026-02-12",
      "id": "144940",
      "original_text": "Registerbekanntmachung nach dem Umwandlungsgesetz\nBayern Amtsgericht Traunstein HRB 11278\nFisca Steuerberatungsgesellschaft mbH – Pleiskirchen",
      "type": "Registerbekanntmachung nach dem Umwandlungsgesetz",
      "state": "Bayern",
      "amtsgericht": "Amtsgericht Traunstein",
      "registernummer": "HRB 11278",
      "registerart": "HRB",
      "company_name": "Fisca Steuerberatungsgesellschaft mbH",
      "company_seat": "Pleiskirchen",
      "details": "12.02.2026 (Bekanntmachungsdatum)\n\nBayern Amtsgericht Traunstein HRB 11278\nRegisterbekanntmachung nach dem Umwandlungsgesetz 11.02.2026 (Eintragungsdatum)\n\nFisca Steuerberatungsgesellschaft mbH\nGesellschaft mit beschränkter Haftung\nPleiskirchen\n\nDen Gläubigern der an der Verschmelzung beteiligten Rechtsträger ist, wenn sie binnen sechs Monaten nach dem Tag, an dem die Eintragung der Verschmelzung in das Register des Sitzes desjenigen Rechtsträgers, dessen Gläubiger sie sind, nach § 19 Abs. 3 UmwG als bekannt gemacht gilt, ihren Anspruch nach Grund und Höhe in Textform anmelden, Sicherheit zu leisten, soweit sie nicht Befriedigung verlangen können. Dieses Recht steht den Gläubigern jedoch nur zu, wenn sie glaubhaft machen, dass durch die Verschmelzung die Erfüllung ihrer Forderung gefährdet wird."
    },
    {
      "date": "2026-02-12",
      "id": "144941",
      "original_text": "Registerbekanntmachung nach dem Umwandlungsgesetz\nBayern Amtsgericht Nürnberg HRA 20455\nZiouzios Gastro UG (haftungsbeschränkt) & Co. KG – Nürnberg",
      "type": "Registerbekanntmachung nach dem Umwandlungsgesetz",
      "state": "Bayern",
      "amtsgericht": "Amtsgericht Nürnberg",
      "registernummer": "HRA 20455",
      "registerart": "HRA",
      "company_name": "Ziouzios Gastro UG (haftungsbeschränkt) & Co. KG",
      "company_seat": "Nürnberg",
      "details": "12.02.2026 (Bekanntmachungsdatum)\n\nBayern Amtsgericht Nürnberg HRA 20455\nRegisterbekanntmachung nach dem Umwandlungsgesetz 11.02.2026 (Eintragungsdatum)\n\nZiouzios Gastro UG (haftungsbeschränkt) & Co. KG\nKommanditgesellschaft\nNürnberg\n\nDen Gläubigern der an der Ausgliederung beteiligten Rechtsträger ist, wenn sie binnen sechs Monaten nach dem Tag, an dem die Eintragung der Ausgliederung in das Register des Sitzes desjenigen Rechtsträgers, dessen Gläubiger sie sind, nach §§ 125, 19 Abs. 3 UmwG als bekannt gemacht gilt, ihren Anspruch nach Grund und Höhe in Textform anmelden, Sicherheit zu leisten, soweit sie nicht Befriedigung verlangen können. Dieses Recht steht den Gläubigern jedoch nur zu, wenn sie glaubhaft machen, dass durch die Ausgliederung die Erfüllung ihrer Forderung gefährdet wird."
    },
    {
      "date": "2026-02-12",
      "id": "144942",
      "original_text": "Löschungsankündigung\nBayern Amtsgericht München HRB 230513\nAH Komplementär UG (haftungsbeschränkt) – München",
      "type": "Löschungsankündigung",
      "state": "Bayern",
      "amtsgericht": "Amtsgericht München",
      "registernummer": "HRB 230513",
      "registerart": "HRB",
      "company_name": "AH Komplementär UG (haftungsbeschränkt)",
      "company_seat": "München",
      "details": "12.02.2026 (Bekanntmachungsdatum)\n\nBayern Amtsgericht München HRB 230513\nLöschungsankündigung 11.02.2026 (Eintragungsdatum)\n\nAH Komplementär UG (haftungsbeschränkt)\nGesellschaft mit beschränkter Haftung\nMünchen\n\nDas Registergericht beabsichtigt, die im Handelsregister eingetragene Gesellschaft wegen Vermögenslosigkeit von Amts wegen nach § 394 FamFG zu löschen. Die Frist zur Erhebung eines Widerspruchs ist auf drei Monate festgesetzt."
    },
    {
      "date": "2026-02-12",
      "id": "144943",
      "original_text": "Löschungsankündigung\nBayern Amtsgericht Landshut HRB 12539\nWooden Globe GmbH – Rottenburg a.d.Laaber",
      "type": "Löschungsankündigung",
      "state": "Bayern",
      "amtsgericht": "Amtsgericht Landshut",
      "registernummer": "HRB 12539",
      "registerart": "HRB",
      "company_name": "Wooden Globe GmbH",
      "company_seat": "Rottenburg a.d.Laaber",
      "details": "12.02.2026 (Bekanntmachungsdatum)\n\nBayern Amtsgericht Landshut HRB 12539\nLöschungsankündigung\n\nWooden Globe GmbH\nGesellschaft mit beschränkter Haftung\nRottenburg a.d.Laaber\n\nDas Registergericht beabsichtigt, die im Handelsregister eingetragene Gesellschaft wegen Vermögenslosigkeit von Amts wegen nach § 394 FamFG zu löschen. Die Frist zur Erhebung eines Widerspruchs ist auf einen Monat festgesetzt."
    },
    {
      "date": "2026-02-12",
      "id": "144944",
      "original_text": "Löschungsankündigung\nBaden-Württemberg Amtsgericht Stuttgart HRA 241938\nFensterbau Seitter GmbH & Co. – Sindelfingen",
      "type": "Löschungsankündigung",
      "state": "Baden-Württemberg",
      "amtsgericht": "Amtsgericht Stuttgart",
      "registernummer": "HRA 241938",
      "registerart": "HRA",
      "company_name": "Fensterbau Seitter GmbH & Co.",
      "company_seat": "Sindelfingen",
      "details": "12.02.2026 (Bekanntmachungsdatum)\n\nBaden-Württemberg Amtsgericht Stuttgart HRA 241938\nLöschungsankündigung\n\nFensterbau Seitter GmbH & Co.\nKommanditgesellschaft\nSindelfingen\n\nDas Gericht beabsichtigt, die Gesellschaft wegen Vermögenslosigkeit im Handelsregister von Amts wegen nach § 394 FamFG zu löschen. Die Frist zur Geltendmachung eines Widerspruchs gegen die beabsichtigte Löschung ist auf zwei Monate ab Veröffentlichung bestimmt."
    },
    {
      "date": "2026-02-12",
      "id": "144945",
      "original_text": "Registerbekanntmachung nach dem Umwandlungsgesetz\nBaden-Württemberg Amtsgericht Mannheim HRB 757274\nMulackstraße 29 Berlin Verwaltungs GmbH – Heidelberg",
      "type": "Registerbekanntmachung nach dem Umwandlungsgesetz",
      "state": "Baden-Württemberg",
      "amtsgericht": "Amtsgericht Mannheim",
      "registernummer": "HRB 757274",
      "registerart": "HRB",
      "company_name": "Mulackstraße 29 Berlin Verwaltungs GmbH",
      "company_seat": "Heidelberg",
      "details": "12.02.2026 (Bekanntmachungsdatum)\n\nBaden-Württemberg Amtsgericht Mannheim HRB 757274\nRegisterbekanntmachung nach dem Umwandlungsgesetz 12.02.2026 (Eintragungsdatum)\n\nMulackstraße 29 Berlin Verwaltungs GmbH\nGesellschaft mit beschränkter Haftung\nHeidelberg\n\nAls nicht eingetragen wird bekanntgemacht:\nDen Gläubigern des an dem Formwechsel beteiligten Rechtsträgers ist, wenn sie binnen sechs Monaten nach dem Tag, an dem die Eintragung des Formwechsels in das Register des Sitzes desjenigen Rechtsträgers, dessen Gläubiger sie sind, nach § 19 Abs. 3 UmwG als bekanntgemacht gilt, ihren Anspruch nach Grund und Höhe schriftlich anmelden, Sicherheit zu leisten, soweit sie nicht Befriedigung verlangen können. Dieses Recht steht den Gläubigern jedoch nur zu, wenn sie glaubhaft machen, dass durch den Formwechsel die Erfüllung ihrer Forderung gefährdet wird."
    },
    {
      "date": "2026-02-12",
      "id": "144946",
      "original_text": "Sonstige Registerbekanntmachung\nBerlin Amtsgericht Berlin (Charlottenburg) HRB 124048\nVattenfall GmbH – Berlin",
      "type": "Sonstige Registerbekanntmachung",
      "state": "Berlin",
      "amtsgericht": "Amtsgericht Berlin (Charlottenburg)",
      "registernummer": "HRB 124048",
      "registerart": "HRB",
      "company_name": "Vattenfall GmbH",
      "company_seat": "Berlin",
      "details": "12.02.2026 (Bekanntmachungsdatum)\n\nBerlin Amtsgericht Berlin (Charlottenburg) HRB 124048\nSonstige Registerbekanntmachung\n\nVattenfall GmbH\nGesellschaft mit beschränkter Haftung\nBerlin\n\nEs wurde eine neue Liste der Aufsichtsratsmitglieder eingereicht (§52 GmbHG).Als nicht eingetragen wird veröffentlicht:"
    },
    {
      "date": "2026-02-12",
      "id": "144947",
      "original_text": "Registerbekanntmachung nach dem Umwandlungsgesetz\nBaden-Württemberg Amtsgericht Ulm HRB 733428\nSalvia NRW GmbH – Eislingen",
      "type": "Registerbekanntmachung nach dem Umwandlungsgesetz",
      "state": "Baden-Württemberg",
      "amtsgericht": "Amtsgericht Ulm",
      "registernummer": "HRB 733428",
      "registerart": "HRB",
      "company_name": "Salvia NRW GmbH",
      "company_seat": "Eislingen",
      "details": "12.02.2026 (Bekanntmachungsdatum)\n\nBaden-Württemberg Amtsgericht Ulm HRB 733428\nRegisterbekanntmachung nach dem Umwandlungsgesetz 12.02.2026 (Eintragungsdatum)\n\nSalvia NRW GmbH\nGesellschaft mit beschränkter Haftung\nEislingen\n\nAls nicht eingetragen wird bekanntgemacht:\nDen Gläubigern der an der Verschmelzung beteiligten Rechtsträger ist, wenn sie binnen sechs Monaten nach dem Tag, an dem die Eintragung der Verschmelzung in das Register des Sitzes desjenigen Rechtsträgers, dessen Gläubiger sie sind, nach § 19 Abs. 3 UmwG als bekanntgemacht gilt, ihren Anspruch nach Grund und Höhe schriftlich anmelden, Sicherheit zu leisten, soweit sie nicht Befriedigung verlangen können. Dieses Recht steht den Gläubigern jedoch nur zu, wenn sie glaubhaft machen, dass durch die Verschmelzung die Erfüllung ihrer Forderung gefährdet wird."
    },
    {
      "date": "2026-02-12",
      "id": "144948",
      "original_text": "Registerbekanntmachung nach dem Umwandlungsgesetz\nBaden-Württemberg Amtsgericht Mannheim HRA 709657\nMulackstraße 29 Berlin Grundstücksentwicklungs GmbH & Co. KG – Heidelberg",
      "type": "Registerbekanntmachung nach dem Umwandlungsgesetz",
      "state": "Baden-Württemberg",
      "amtsgericht": "Amtsgericht Mannheim",
      "registernummer": "HRA 709657",
      "registerart": "HRA",
      "company_name": "Mulackstraße 29 Berlin Grundstücksentwicklungs GmbH & Co. KG",
      "company_seat": "Heidelberg",
      "details": "12.02.2026 (Bekanntmachungsdatum)\n\nBaden-Württemberg Amtsgericht Mannheim HRA 709657\nRegisterbekanntmachung nach dem Umwandlungsgesetz 12.02.2026 (Eintragungsdatum)\n\nMulackstraße 29 Berlin Grundstücksentwicklungs GmbH & Co. KG\nKommanditgesellschaft\nHeidelberg\n\nAls nicht eingetragen wird bekanntgemacht:\nDen Gläubigern des an dem Formwechsel beteiligten Rechtsträgers ist, wenn sie binnen sechs Monaten nach dem Tag, an dem die Eintragung des Formwechsels in das Register des Sitzes desjenigen Rechtsträgers, dessen Gläubiger sie sind, nach § 19 Abs. 3 UmwG als bekanntgemacht gilt, ihren Anspruch nach Grund und Höhe schriftlich anmelden, Sicherheit zu leisten, soweit sie nicht Befriedigung verlangen können. Dieses Recht steht den Gläubigern jedoch nur zu, wenn sie glaubhaft machen, dass durch den Formwechsel die Erfüllung ihrer Forderung gefährdet wird."
    },
    {
      "date": "2026-02-12",
      "id": "144949",
      "original_text": "Löschungsankündigung\nBrandenburg Amtsgericht Potsdam HRB 39528\nBlack Seven Cars UG (haftungsbeschränkt) – Potsdam",
      "type": "Löschungsankündigung",
      "state": "Brandenburg",
      "amtsgericht": "Amtsgericht Potsdam",
      "registernummer": "HRB 39528",
      "registerart": "HRB",
      "company_name": "Black Seven Cars UG (haftungsbeschränkt)",
      "company_seat": "Potsdam",
      "details": "12.02.2026 (Bekanntmachungsdatum)\n\nBrandenburg Amtsgericht Potsdam HRB 39528\nLöschungsankündigung\n\nBlack Seven Cars UG (haftungsbeschränkt)\nGesellschaft mit beschränkter Haftung\nPotsdam\n\nBei der nachstehenden Gesellschaft wird das Amtslöschungsverfahren gemäß § 394 FamFG eingeleitet. Widerspruchsfrist: 8 Wochen."
    },
    {
      "date": "2026-02-12",
      "id": "144950",
      "original_text": "Löschungsankündigung\nBrandenburg Amtsgericht Potsdam HRB 32997\nNeues Jüterbog II Projektentwicklungsgesellschaft mbH – Jüterbog",
      "type": "Löschungsankündigung",
      "state": "Brandenburg",
      "amtsgericht": "Amtsgericht Potsdam",
      "registernummer": "HRB 32997",
      "registerart": "HRB",
      "company_name": "Neues Jüterbog II Projektentwicklungsgesellschaft mbH",
      "company_seat": "Jüterbog",
      "details": "12.02.2026 (Bekanntmachungsdatum)\n\nBrandenburg Amtsgericht Potsdam HRB 32997\nLöschungsankündigung\n\nNeues Jüterbog II Projektentwicklungsgesellschaft mbH\nGesellschaft mit beschränkter Haftung\nJüterbog\n\nBei der nachstehenden Gesellschaft wird das Amtslöschungsverfahren gemäß § 394 FamFG eingeleitet. Widerspruchsfrist: 8 Wochen."
    },
    {
      "date": "2026-02-12",
      "id": "144951",
      "original_text": "Löschungsankündigung\nSaarland Amtsgericht Saarbrücken HRB 19350\nEaster-Bo UG (haftungsbeschränkt) – Eppelborn",
      "type": "Löschungsankündigung",
      "state": "Saarland",
      "amtsgericht": "Amtsgericht Saarbrücken",
      "registernummer": "HRB 19350",
      "registerart": "HRB",
      "company_name": "Easter-Bo UG (haftungsbeschränkt)",
      "company_seat": "Eppelborn",
      "details": "12.02.2026 (Bekanntmachungsdatum)\n\nSaarland Amtsgericht Saarbrücken HRB 19350\nLöschungsankündigung\n\nEaster-Bo UG (haftungsbeschränkt)\nGesellschaft mit beschränkter Haftung\nEppelborn\n\nEs ist beabsichtigt, die Gesellschaft von Amts wegen gemäß § 394 FamFG wegen Vermögenslosigkeit zu löschen.\nGegen die Löschung von Amts wegen ist das Rechtsmittel des Widerspruchs statthaft. Der Widerspruch ist binnen einer Frist zwei Monaten beginnend mit dem Tag dieser Veröffentlichung durch Einreichen eines Widerspruchsschreibens -schriftlich oder zur Niederschrift der Geschäftsstelle beim Amtsgericht Saarbrücken, -zentrales Handelsregister-, Mainzerstr.178, 66121 Saarbrücken einzulegen.\nDer Widerspruch muss die Bezeichnung der angefochtenen Löschungsankündigung enthalten sowie die Erklärung, dass Widerspruch eingelegt wird. Er ist vom Widerspruchsführer oder seinem Bevollmächtigten zu unterzeichnen.\nDas Widerspruchsschreiben kann auch in der Form eines elektronischen Dokumentes eingereicht werden, das mit einer qualifizierten elektronischen Signatur nach dem Signaturgesetz versehen sein muss (§§ 14 Abs. 2 FamFG, 130a, 298 ZPO)."
    },
    {
      "date": "2026-02-12",
      "id": "144952",
      "original_text": "Löschungsankündigung\nSaarland Amtsgericht Saarbrücken HRB 108969\nAKTIV Bau GmbH – Homburg",
      "type": "Löschungsankündigung",
      "state": "Saarland",
      "amtsgericht": "Amtsgericht Saarbrücken",
      "registernummer": "HRB 108969",
      "registerart": "HRB",
      "company_name": "AKTIV Bau GmbH",
      "company_seat": "Homburg",
      "details": "12.02.2026 (Bekanntmachungsdatum)\n\nSaarland Amtsgericht Saarbrücken HRB 108969\nLöschungsankündigung\n\nAKTIV Bau GmbH\nGesellschaft mit beschränkter Haftung\nHomburg\n\nEs ist beabsichtigt, die Gesellschaft von Amts wegen gemäß § 394 FamFG wegen Vermögenslosigkeit zu löschen.\nGegen die Löschung von Amts wegen ist das Rechtsmittel des Widerspruchs statthaft. Der Widerspruch ist binnen einer Frist drei Monaten beginnend mit dem Tag dieser Veröffentlichung durch Einreichen eines Widerspruchsschreibens -schriftlich oder zur Niederschrift der Geschäftsstelle beim Amtsgericht Saarbrücken, -zentrales Handelsregister-, Mainzerstr.178, 66121 Saarbrücken einzulegen.\nDer Widerspruch muss die Bezeichnung der angefochtenen Löschungsankündigung enthalten sowie die Erklärung, dass Widerspruch eingelegt wird. Er ist vom Widerspruchsführer oder seinem Bevollmächtigten zu unterzeichnen.\nDas Widerspruchsschreiben kann auch in der Form eines elektronischen Dokumentes eingereicht werden, das mit einer qualifizierten elektronischen Signatur nach dem Signaturgesetz versehen sein muss (§§ 14 Abs. 2 FamFG, 130a, 298 ZPO)."
    },
    {
      "date": "2026-02-12",
      "id": "144953",
      "original_text": "Einreichung neuer Dokumente\nSaarland Amtsgericht Saarbrücken HRB 14175\nIWM AssekuranzService AG – Nonnweiler",
      "type": "Einreichung neuer Dokumente",
      "state": "Saarland",
      "amtsgericht": "Amtsgericht Saarbrücken",
      "registernummer": "HRB 14175",
      "registerart": "HRB",
      "company_name": "IWM AssekuranzService AG",
      "company_seat": "Nonnweiler",
      "details": "12.02.2026 (Bekanntmachungsdatum)\n\nSaarland Amtsgericht Saarbrücken HRB 14175\nEinreichung neuer Dokumente 12.02.2026 (Eintragungsdatum)\n\nIWM AssekuranzService AG\nAktiengesellschaft\nNonnweiler\n\nDer Vorstand der Gesellschaft hat eine Liste der Mitglieder des Aufsichtsrats zum Handelsregister eingereicht (§ 106 AktG)."
    },
    {
      "date": "2026-02-12",
      "id": "144954",
      "original_text": "Registerbekanntmachung nach dem Umwandlungsgesetz\nSchleswig-Holstein Amtsgericht Kiel HRA 12879\nGünter Kroll e.K. – Preetz",
      "type": "Registerbekanntmachung nach dem Umwandlungsgesetz",
      "state": "Schleswig-Holstein",
      "amtsgericht": "Amtsgericht Kiel",
      "registernummer": "HRA 12879",
      "registerart": "HRA",
      "company_name": "Günter Kroll e.K.",
      "company_seat": "Preetz",
      "details": "12.02.2026 (Bekanntmachungsdatum)\n\nSchleswig-Holstein Amtsgericht Kiel HRA 12879\nRegisterbekanntmachung nach dem Umwandlungsgesetz 11.02.2026 (Eintragungsdatum)\n\nGünter Kroll e.K.\nEinzelkaufmann / Einzelkauffrau\nPreetz\n\nAls nicht eingetragen wird veröffentlicht: Den Gläubigern der an der Spaltung beteiligten Rechtsträger ist, wenn sie binnen sechs Monaten nach dem Tag, an dem die Eintragung der Spaltung in das Register des Sitzes desjenigen Rechtsträgers, dessen Gläubiger sie sind,  bekannt gemacht worden ist, ihren Anspruch nach Grund und Höhe schriftlich anmelden, Sicherheit zu leisten, soweit sie nicht Befriedigung verlangen können. Dieses Recht steht den Gläubigern jedoch nur zu, wenn sie glaubhaft machen, dass durch die Spaltung die Erfüllung ihrer Forderung gefährdet wird."
    },
    {
      "date": "2026-02-12",
      "id": "144955",
      "original_text": "Löschungsankündigung\nBerlin Amtsgericht Berlin (Charlottenburg) HRB 36134\nGVL Gastronomische Versorgungsleistung GmbH – Berlin",
      "type": "Löschungsankündigung",
      "state": "Berlin",
      "amtsgericht": "Amtsgericht Berlin (Charlottenburg)",
      "registernummer": "HRB 36134",
      "registerart": "HRB",
      "company_name": "GVL Gastronomische Versorgungsleistung GmbH",
      "company_seat": "Berlin",
      "details": "12.02.2026 (Bekanntmachungsdatum)\n\nBerlin Amtsgericht Berlin (Charlottenburg) HRB 36134\nLöschungsankündigung\n\nGVL Gastronomische Versorgungsleistung GmbH\nGesellschaft mit beschränkter Haftung\nBerlin\n\nBei der nachstehenden Gesellschaft wird das Amtslöschungsverfahren gemäß § 394 FamFG eingeleitet. Widerspruchsfrist 6 Wochen"
    },
    {
      "date": "2026-02-12",
      "id": "144956",
      "original_text": "Einreichung neuer Dokumente\nBrandenburg Amtsgericht Neuruppin HRB 1300\nGesundheitszentrum Wittenberge GmbH – Wittenberge",
      "type": "Einreichung neuer Dokumente",
      "state": "Brandenburg",
      "amtsgericht": "Amtsgericht Neuruppin",
      "registernummer": "HRB 1300",
      "registerart": "HRB",
      "company_name": "Gesundheitszentrum Wittenberge GmbH",
      "company_seat": "Wittenberge",
      "details": "12.02.2026 (Bekanntmachungsdatum)\n\nBrandenburg Amtsgericht Neuruppin HRB 1300\nEinreichung neuer Dokumente\n\nGesundheitszentrum Wittenberge GmbH\nGesellschaft mit beschränkter Haftung\nWittenberge\n\nAls nicht eingetragen wird veröffentlicht: Eine Liste der Mitglieder des Aufsichtsrates wurde zum Handelsregister eingereicht."
    },
    {
      "date": "2026-02-12",
      "id": "144957",
      "original_text": "Sonstige Registerbekanntmachung\nSaarland Amtsgericht Saarbrücken HRB 100517\nAltes Stadtbad Projekt GmbH – Merzig",
      "type": "Sonstige Registerbekanntmachung",
      "state": "Saarland",
      "amtsgericht": "Amtsgericht Saarbrücken",
      "registernummer": "HRB 100517",
      "registerart": "HRB",
      "company_name": "Altes Stadtbad Projekt GmbH",
      "company_seat": "Merzig",
      "details": "12.02.2026 (Bekanntmachungsdatum)\n\nSaarland Amtsgericht Saarbrücken HRB 100517\nSonstige Registerbekanntmachung 12.02.2026 (Eintragungsdatum)\n\nAltes Stadtbad Projekt GmbH\nGesellschaft mit beschränkter Haftung\nMerzig\n\nDem Registergericht ist ein Verschmelzungsplan über die geplante Verschmelzung der Gesellschaft mit beschränkter Haftung nach deutschem Recht unter der Firma Altes Stadtbad Projekt GmbH mit Sitz in Saarbrücken HRB 100517 mit der Aktiengesellschaft nach luxemburgischen Recht unter der Firma EUROFERTIGBAU A.G. mit Sitz in Schwebsingen B86311 eingereicht worden."
    },
    {
      "date": "2026-02-12",
      "id": "144958",
      "original_text": "Sonstige Registerbekanntmachung\nSaarland Amtsgericht Saarbrücken HRB 100517\nAltes Stadtbad Projekt GmbH – Merzig",
      "type": "Sonstige Registerbekanntmachung",
      "state": "Saarland",
      "amtsgericht": "Amtsgericht Saarbrücken",
      "registernummer": "HRB 100517",
      "registerart": "HRB",
      "company_name": "Altes Stadtbad Projekt GmbH",
      "company_seat": "Merzig",
      "details": "12.02.2026 (Bekanntmachungsdatum)\n\nSaarland Amtsgericht Saarbrücken HRB 100517\nSonstige Registerbekanntmachung 12.02.2026 (Eintragungsdatum)\n\nAltes Stadtbad Projekt GmbH\nGesellschaft mit beschränkter Haftung\nMerzig\n\nv.A.w. berichtigt bzw. Sitz der übertragenden GmbH:\nDem Registergericht ist ein Verschmelzungsplan über die geplante Verschmelzung der Gesellschaft mit beschränkter Haftung nach deutschem Recht unter der Firma Altes Stadtbad Projekt GmbH mit Sitz in Merzig HRB 100517 mit der Aktiengesellschaft nach luxemburgischen\nRecht unter der Firma EUROFERTIGBAU A.G. mit Sitz in Schwebsingen B86311 eingereicht worden."
    },
    {
      "date": "2026-02-12",
      "id": "144959",
      "original_text": "Registerbekanntmachung nach dem Umwandlungsgesetz\nBerlin Amtsgericht Berlin (Charlottenburg) HRB 201015\nMcMakler Nord GmbH – Berlin",
      "type": "Registerbekanntmachung nach dem Umwandlungsgesetz",
      "state": "Berlin",
      "amtsgericht": "Amtsgericht Berlin (Charlottenburg)",
      "registernummer": "HRB 201015",
      "registerart": "HRB",
      "company_name": "McMakler Nord GmbH",
      "company_seat": "Berlin",
      "details": "12.02.2026 (Bekanntmachungsdatum)\n\nBerlin Amtsgericht Berlin (Charlottenburg) HRB 201015\nRegisterbekanntmachung nach dem Umwandlungsgesetz 10.02.2026 (Eintragungsdatum)\n\nMcMakler Nord GmbH\nGesellschaft mit beschränkter Haftung\nBerlin\n\nZu Eintragungsnummer 14 vom 10.02.2026 wird als nicht eingetragen veröffentlicht: Den Gläubigern der an der Verschmelzung beteiligten Rechtsträger ist, wenn sie binnen sechs Monaten nach dem Tag, an dem die Eintragung der Verschmelzung in das Register des Sitzes desjenigen Rechtsträgers, dessen Gläubiger sie sind, als bekannt gemacht gilt, ihren Anspruch nach Grund und Höhe schriftlich anmelden, Sicherheit zu leisten, soweit sie nicht Befriedigung verlangen können. Dieses Recht steht den Gläubigern jedoch nur zu, wenn sie glaubhaft machen, dass durch die Verschmelzung die Erfüllung ihrer Forderung gefährdet wird. Das Recht, Sicherheitsleistung zu verlangen, steht Gläubigern nicht zu, die im Falle der Insolvenz ein Recht auf vorzugsweise Befriedigung aus einer Deckungsmasse haben, die nach gesetzlicher Vorschrift zu ihrem Schutz errichtet und staatlich überwacht ist."
    },
    {
      "date": "2026-02-12",
      "id": "144960",
      "original_text": "Registerbekanntmachung nach dem Umwandlungsgesetz\nBerlin Amtsgericht Berlin (Charlottenburg) HRB 201037\nMcMakler Ost GmbH – Berlin",
      "type": "Registerbekanntmachung nach dem Umwandlungsgesetz",
      "state": "Berlin",
      "amtsgericht": "Amtsgericht Berlin (Charlottenburg)",
      "registernummer": "HRB 201037",
      "registerart": "HRB",
      "company_name": "McMakler Ost GmbH",
      "company_seat": "Berlin",
      "details": "12.02.2026 (Bekanntmachungsdatum)\n\nBerlin Amtsgericht Berlin (Charlottenburg) HRB 201037\nRegisterbekanntmachung nach dem Umwandlungsgesetz 10.02.2026 (Eintragungsdatum)\n\nMcMakler Ost GmbH\nGesellschaft mit beschränkter Haftung\nBerlin\n\nZu Eintragungsnummer 13 vom 10.02.2026 wird als nicht eingetragen veröffentlicht: Den Gläubigern der an der Verschmelzung beteiligten Rechtsträger ist, wenn sie binnen sechs Monaten nach dem Tag, an dem die Eintragung der Verschmelzung in das Register des Sitzes desjenigen Rechtsträgers, dessen Gläubiger sie sind, als bekannt gemacht gilt, ihren Anspruch nach Grund und Höhe schriftlich anmelden, Sicherheit zu leisten, soweit sie nicht Befriedigung verlangen können. Dieses Recht steht den Gläubigern jedoch nur zu, wenn sie glaubhaft machen, dass durch die Verschmelzung die Erfüllung ihrer Forderung gefährdet wird. Das Recht, Sicherheitsleistung zu verlangen, steht Gläubigern nicht zu, die im Falle der Insolvenz ein Recht auf vorzugsweise Befriedigung aus einer Deckungsmasse haben, die nach gesetzlicher Vorschrift zu ihrem Schutz errichtet und staatlich überwacht ist."
    },
    {
      "date": "2026-02-12",
      "id": "144961",
      "original_text": "Registerbekanntmachung nach dem Umwandlungsgesetz\nBerlin Amtsgericht Berlin (Charlottenburg) HRB 169669\nMcMakler West GmbH – Berlin",
      "type": "Registerbekanntmachung nach dem Umwandlungsgesetz",
      "state": "Berlin",
      "amtsgericht": "Amtsgericht Berlin (Charlottenburg)",
      "registernummer": "HRB 169669",
      "registerart": "HRB",
      "company_name": "McMakler West GmbH",
      "company_seat": "Berlin",
      "details": "12.02.2026 (Bekanntmachungsdatum)\n\nBerlin Amtsgericht Berlin (Charlottenburg) HRB 169669\nRegisterbekanntmachung nach dem Umwandlungsgesetz 10.02.2026 (Eintragungsdatum)\n\nMcMakler West GmbH\nGesellschaft mit beschränkter Haftung\nBerlin\n\nZu Eintragungsnummer 13 vom 10.02.2026 wird als nicht eingetragen veröffentlicht: Den Gläubigern der an der Verschmelzung beteiligten Rechtsträger ist, wenn sie binnen sechs Monaten nach dem Tag, an dem die Eintragung der Verschmelzung in das Register des Sitzes desjenigen Rechtsträgers, dessen Gläubiger sie sind, als bekannt gemacht gilt, ihren Anspruch nach Grund und Höhe schriftlich anmelden, Sicherheit zu leisten, soweit sie nicht Befriedigung verlangen können. Dieses Recht steht den Gläubigern jedoch nur zu, wenn sie glaubhaft machen, dass durch die Verschmelzung die Erfüllung ihrer Forderung gefährdet wird. Das Recht, Sicherheitsleistung zu verlangen, steht Gläubigern nicht zu, die im Falle der Insolvenz ein Recht auf vorzugsweise Befriedigung aus einer Deckungsmasse haben, die nach gesetzlicher Vorschrift zu ihrem Schutz errichtet und staatlich überwacht ist."
    },
    {
      "date": "2026-02-12",
      "id": "144962",
      "original_text": "Sonstige Registerbekanntmachung\nBerlin Amtsgericht Berlin (Charlottenburg) HRB 169669\nMcMakler West GmbH – Berlin",
      "type": "Sonstige Registerbekanntmachung",
      "state": "Berlin",
      "amtsgericht": "Amtsgericht Berlin (Charlottenburg)",
      "registernummer": "HRB 169669",
      "registerart": "HRB",
      "company_name": "McMakler West GmbH",
      "company_seat": "Berlin",
      "details": "12.02.2026 (Bekanntmachungsdatum)\n\nBerlin Amtsgericht Berlin (Charlottenburg) HRB 169669\nSonstige Registerbekanntmachung\n\nMcMakler West GmbH\nGesellschaft mit beschränkter Haftung\nBerlin\n\nAls nicht eingetragen wird veröffentlicht: Der andere Vertragsteil hat den Gläubigern dieses Rechtsträgers, deren Forderungen begründet worden sind, bevor die Eintragung der Beendigung dieses Vertrages in das Handelsregister nach § 10 des Handelsgesetzbuches als bekannt gemacht gilt, Sicherheit zu leisten, wenn sie sich binnen sechs Monaten nach der Bekanntmachung der Eintragung zu diesem Zweck bei ihm melden. Dieses Recht steht den Gläubigern nicht zu, die im Fall des Insolvenzverfahrens ein Recht auf vorzugsweise Befriedigung aus der Deckungsmasse haben, die nach gesetzlicher Vorschrift zu ihrem Schutz errichtet und staatlich überwacht ist."
    },
    {
      "date": "2026-02-12",
      "id": "144963",
      "original_text": "Registerbekanntmachung nach dem Umwandlungsgesetz\nBerlin Amtsgericht Berlin (Charlottenburg) HRB 169669\nMcMakler West GmbH – Berlin",
      "type": "Registerbekanntmachung nach dem Umwandlungsgesetz",
      "state": "Berlin",
      "amtsgericht": "Amtsgericht Berlin (Charlottenburg)",
      "registernummer": "HRB 169669",
      "registerart": "HRB",
      "company_name": "McMakler West GmbH",
      "company_seat": "Berlin",
      "details": "12.02.2026 (Bekanntmachungsdatum)\n\nBerlin Amtsgericht Berlin (Charlottenburg) HRB 169669\nRegisterbekanntmachung nach dem Umwandlungsgesetz 10.02.2026 (Eintragungsdatum)\n\nMcMakler West GmbH\nGesellschaft mit beschränkter Haftung\nBerlin\n\nZu Eintragungsnummer 13 vom 10.02.2026 wird als nicht eingetragen veröffentlicht: Den Gläubigern der an der Verschmelzung beteiligten Rechtsträger ist, wenn sie binnen sechs Monaten nach dem Tag, an dem die Eintragung der Verschmelzung in das Register des Sitzes desjenigen Rechtsträgers, dessen Gläubiger sie sind, als bekannt gemacht gilt, ihren Anspruch nach Grund und Höhe schriftlich anmelden, Sicherheit zu leisten, soweit sie nicht Befriedigung verlangen können. Dieses Recht steht den Gläubigern jedoch nur zu, wenn sie glaubhaft machen, dass durch die Verschmelzung die Erfüllung ihrer Forderung gefährdet wird. Das Recht, Sicherheitsleistung zu verlangen, steht Gläubigern nicht zu, die im Falle der Insolvenz ein Recht auf vorzugsweise Befriedigung aus einer Deckungsmasse haben, die nach gesetzlicher Vorschrift zu ihrem Schutz errichtet und staatlich überwacht ist. Der andere Vertragsteil hat den Gläubigern dieses Rechtsträgers, deren Forderungen begründet worden sind, bevor die Eintragung der Beendigung dieses Vertrages in das Handelsregister nach § 10 des Handelsgesetzbuches als bekannt gemacht gilt, Sicherheit zu leisten, wenn sie sich binnen sechs Monaten nach der Bekanntmachung der Eintragung zu diesem Zweck bei ihm melden. Dieses Recht steht den Gläubigern nicht zu, die im Fall des Insolvenzverfahrens ein Recht auf vorzugsweise Befriedigung aus der Deckungsmasse haben, die nach gesetzlicher Vorschrift zu ihrem Schutz errichtet und staatlich überwacht ist."
    },
    {
      "date": "2026-02-12",
      "id": "144964",
      "original_text": "Löschungsankündigung\nBerlin Amtsgericht Berlin (Charlottenburg) HRB 188232\nScaleBridge Partners GmbH – Berlin",
      "type": "Löschungsankündigung",
      "state": "Berlin",
      "amtsgericht": "Amtsgericht Berlin (Charlottenburg)",
      "registernummer": "HRB 188232",
      "registerart": "HRB",
      "company_name": "ScaleBridge Partners GmbH",
      "company_seat": "Berlin",
      "details": "12.02.2026 (Bekanntmachungsdatum)\n\nBerlin Amtsgericht Berlin (Charlottenburg) HRB 188232\nLöschungsankündigung\n\nScaleBridge Partners GmbH\nGesellschaft mit beschränkter Haftung\nBerlin\n\nBei der nachstehenden Gesellschaft wird das Amtslöschungsverfahren gemäß § 394 FamFG eingeleitet. Widerspruchsfrist 6 Wochen"
    },
    {
      "date": "2026-02-12",
      "id": "144965",
      "original_text": "Löschungsankündigung\nBerlin Amtsgericht Berlin (Charlottenburg) HRB 214228\nANXy Trading UG (haftungsbeschränkt) – Berlin",
      "type": "Löschungsankündigung",
      "state": "Berlin",
      "amtsgericht": "Amtsgericht Berlin (Charlottenburg)",
      "registernummer": "HRB 214228",
      "registerart": "HRB",
      "company_name": "ANXy Trading UG (haftungsbeschränkt)",
      "company_seat": "Berlin",
      "details": "12.02.2026 (Bekanntmachungsdatum)\n\nBerlin Amtsgericht Berlin (Charlottenburg) HRB 214228\nLöschungsankündigung\n\nANXy Trading UG (haftungsbeschränkt)\nGesellschaft mit beschränkter Haftung\nBerlin\n\nBei der nachstehenden Gesellschaft wird das Amtslöschungsverfahren gemäß § 394 FamFG eingeleitet. Widerspruchsfrist 6 Wochen"
    },
    {
      "date": "2026-02-12",
      "id": "144966",
      "original_text": "Registerbekanntmachung nach dem Umwandlungsgesetz\nSchleswig-Holstein Amtsgericht Kiel HRB 23387\nKryptofabrik Verwaltungs GmbH – Preetz",
      "type": "Registerbekanntmachung nach dem Umwandlungsgesetz",
      "state": "Schleswig-Holstein",
      "amtsgericht": "Amtsgericht Kiel",
      "registernummer": "HRB 23387",
      "registerart": "HRB",
      "company_name": "Kryptofabrik Verwaltungs GmbH",
      "company_seat": "Preetz",
      "details": "12.02.2026 (Bekanntmachungsdatum)\n\nSchleswig-Holstein Amtsgericht Kiel HRB 23387\nRegisterbekanntmachung nach dem Umwandlungsgesetz 11.02.2026 (Eintragungsdatum)\n\nKryptofabrik Verwaltungs GmbH\nGesellschaft mit beschränkter Haftung\nPreetz\n\nZu Eintragungsnummer 3 vom 11.02.2026 wird als nicht eingetragen veröffentlicht: Den Gläubigern der an der Verschmelzung beteiligten Rechtsträger ist, wenn sie binnen sechs Monaten nach dem Tag, an dem die Eintragung der Verschmelzung in das Register des Sitzes desjenigen Rechtsträgers, dessen Gläubiger sie sind, nach § 19 Abs. 3 UmwG bekannt gemacht worden ist, ihren Anspruch nach Grund und Höhe schriftlich anmelden, Sicherheit zu leisten, soweit sie nicht Befriedigung verlangen können. Dieses Recht steht den Gläubigern jedoch nur zu, wenn sie glaubhaft machen, dass durch die Verschmelzung die Erfüllung ihrer Forderung gefährdet wird."
    },
    {
      "date": "2026-02-12",
      "id": "144967",
      "original_text": "Einreichung neuer Dokumente\nBaden-Württemberg Amtsgericht Stuttgart HRB 15690\nAntenne Radio-Verwaltungsgesellschaft mbH – Stuttgart",
      "type": "Einreichung neuer Dokumente",
      "state": "Baden-Württemberg",
      "amtsgericht": "Amtsgericht Stuttgart",
      "registernummer": "HRB 15690",
      "registerart": "HRB",
      "company_name": "Antenne Radio-Verwaltungsgesellschaft mbH",
      "company_seat": "Stuttgart",
      "details": "12.02.2026 (Bekanntmachungsdatum)\n\nBaden-Württemberg Amtsgericht Stuttgart HRB 15690\nEinreichung neuer Dokumente 12.02.2026 (Eintragungsdatum)\n\nAntenne Radio-Verwaltungsgesellschaft mbH\nGesellschaft mit beschränkter Haftung\nStuttgart\n\nAls nicht eingetragen wird bekanntgemacht:\nDie Gesellschaft hat am 13.01.2026 die Liste über die Zusammensetzung des Verwaltungsrats zum Handelsregister eingereicht."
    },
    {
      "date": "2026-02-12",
      "id": "144968",
      "original_text": "Einreichung neuer Dokumente\nBaden-Württemberg Amtsgericht Stuttgart HRB 21369\nNAG Nationale Automobil-Gesellschaft Aktiengesellschaft – Stuttgart",
      "type": "Einreichung neuer Dokumente",
      "state": "Baden-Württemberg",
      "amtsgericht": "Amtsgericht Stuttgart",
      "registernummer": "HRB 21369",
      "registerart": "HRB",
      "company_name": "NAG Nationale Automobil-Gesellschaft Aktiengesellschaft",
      "company_seat": "Stuttgart",
      "details": "12.02.2026 (Bekanntmachungsdatum)\n\nBaden-Württemberg Amtsgericht Stuttgart HRB 21369\nEinreichung neuer Dokumente\n\nNAG Nationale Automobil-Gesellschaft Aktiengesellschaft\nAktiengesellschaft\nStuttgart\n\nDie Gesellschaft hat am 11.02.2026 die Liste über die Zusammensetzung des Aufsichtsrats zum Handelsregister eingereicht."
    },
    {
      "date": "2026-02-12",
      "id": "144969",
      "original_text": "Registerbekanntmachung nach dem Umwandlungsgesetz\nBaden-Württemberg Amtsgericht Freiburg GsR 1521\nMK Holding eGbR – Dogern",
      "type": "Registerbekanntmachung nach dem Umwandlungsgesetz",
      "state": "Baden-Württemberg",
      "amtsgericht": "Amtsgericht Freiburg",
      "registernummer": "GsR 1521",
      "registerart": "GsR",
      "company_name": "MK Holding eGbR",
      "company_seat": "Dogern",
      "details": "12.02.2026 (Bekanntmachungsdatum)\n\nBaden-Württemberg Amtsgericht Freiburg GsR 1521\nRegisterbekanntmachung nach dem Umwandlungsgesetz 12.02.2026 (Eintragungsdatum)\n\nMK Holding eGbR\nGesellschaft bürgerlichen Rechts\nDogern\n\nAls nicht eingetragen wird bekanntgemacht:\nDen Gläubigern des an dem Formwechsel beteiligten Rechtsträgers ist, wenn sie binnen sechs Monaten nach dem Tag, an dem die Eintragung des Formwechsels in das Register des Sitzes desjenigen Rechtsträgers, dessen Gläubiger sie sind, nach § 19 Abs. 3 UmwG als bekanntgemacht gilt, ihren Anspruch nach Grund und Höhe schriftlich anmelden, Sicherheit zu leisten, soweit sie nicht Befriedigung verlangen können. Dieses Recht steht den Gläubigern jedoch nur zu, wenn sie glaubhaft machen, dass durch den Formwechsel die Erfüllung ihrer Forderung gefährdet wird."
    },
    {
      "date": "2026-02-12",
      "id": "144970",
      "original_text": "Löschungsankündigung\nBrandenburg Amtsgericht Potsdam HRB 24154\nCOMEGU GmbH – Brandenburg an der Havel",
      "type": "Löschungsankündigung",
      "state": "Brandenburg",
      "amtsgericht": "Amtsgericht Potsdam",
      "registernummer": "HRB 24154",
      "registerart": "HRB",
      "company_name": "COMEGU GmbH",
      "company_seat": "Brandenburg an der Havel",
      "details": "12.02.2026 (Bekanntmachungsdatum)\n\nBrandenburg Amtsgericht Potsdam HRB 24154\nLöschungsankündigung\n\nCOMEGU GmbH\nGesellschaft mit beschränkter Haftung\nBrandenburg an der Havel\n\nBei der nachstehenden Gesellschaft wird das Amtslöschungsverfahren gemäß § 394 FamFG eingeleitet. Widerspruchsfrist 8 Wochen."
    },
    {
      "date": "2026-02-12",
      "id": "144971",
      "original_text": "Registerbekanntmachung nach dem Umwandlungsgesetz\nBerlin Amtsgericht Berlin (Charlottenburg) HRA 51410\nBerlin Food Company GmbH & Co. KG – Berlin",
      "type": "Registerbekanntmachung nach dem Umwandlungsgesetz",
      "state": "Berlin",
      "amtsgericht": "Amtsgericht Berlin (Charlottenburg)",
      "registernummer": "HRA 51410",
      "registerart": "HRA",
      "company_name": "Berlin Food Company GmbH & Co. KG",
      "company_seat": "Berlin",
      "details": "12.02.2026 (Bekanntmachungsdatum)\n\nBerlin Amtsgericht Berlin (Charlottenburg) HRA 51410\nRegisterbekanntmachung nach dem Umwandlungsgesetz 11.02.2026 (Eintragungsdatum)\n\nBerlin Food Company GmbH & Co. KG\nKommanditgesellschaft\nBerlin\n\nZu Eintragungsnummer 2 vom 11.02.2026 wird als nicht eingetragen veröffentlicht: Den Gläubigern ist, wenn sie binnen sechs Monaten nach dem Tag, an dem die Eintragung der Umwandlung als bekannt gemacht gilt, ihren Anspruch nach Grund und Höhe schriftlich anmelden, Sicherheit zu leisten, soweit sie nicht Befriedigung verlangen können. Dieses Recht steht den Gläubigern jedoch nur zu, wenn sie glaubhaft machen, dass durch die Umwandlung die Erfüllung ihrer Forderung gefährdet wird. Das Recht, Sicherheitsleistung zu verlangen, steht Gläubigern nicht zu, die im Falle der Insolvenz ein Recht auf vorzugsweise Befriedigung aus einer Deckungsmasse haben, die nach gesetzlicher Vorschrift zu ihrem Schutz errichtet und staatlich überwacht ist."
    },
    {
      "date": "2026-02-12",
      "id": "144972",
      "original_text": "Registerbekanntmachung nach dem Umwandlungsgesetz\nBerlin Amtsgericht Berlin (Charlottenburg) HRB 283858\nBerlin Food Company GmbH – Berlin",
      "type": "Registerbekanntmachung nach dem Umwandlungsgesetz",
      "state": "Berlin",
      "amtsgericht": "Amtsgericht Berlin (Charlottenburg)",
      "registernummer": "HRB 283858",
      "registerart": "HRB",
      "company_name": "Berlin Food Company GmbH",
      "company_seat": "Berlin",
      "details": "12.02.2026 (Bekanntmachungsdatum)\n\nBerlin Amtsgericht Berlin (Charlottenburg) HRB 283858\nRegisterbekanntmachung nach dem Umwandlungsgesetz 11.02.2026 (Eintragungsdatum)\n\nBerlin Food Company GmbH\nGesellschaft mit beschränkter Haftung\nBerlin\n\nZu Eintragungsnummer 1 vom 11.02.2026 wird als nicht eingetragen veröffentlicht:Den Gläubigern ist, wenn sie binnen sechs Monaten nach dem Tag, an dem die Eintragung der Umwandlung als bekannt gemacht gilt, ihren Anspruch nach Grund und Höhe schriftlich anmelden, Sicherheit zu leisten, soweit sie nicht Befriedigung verlangen können. Dieses Recht steht den Gläubigern jedoch nur zu, wenn sie glaubhaft machen, dass durch die Umwandlung die Erfüllung ihrer Forderung gefährdet wird. Das Recht, Sicherheitsleistung zu verlangen, steht Gläubigern nicht zu, die im Falle der Insolvenz ein Recht auf vorzugsweise Befriedigung aus einer Deckungsmasse haben, die nach gesetzlicher Vorschrift zu ihrem Schutz errichtet und staatlich überwacht ist."
    },
    {
      "date": "2026-02-12",
      "id": "144973",
      "original_text": "Registerbekanntmachung nach dem Umwandlungsgesetz\nSchleswig-Holstein Amtsgericht Kiel HRA 12890\nGünter Kroll Projekt GmbH & Co. KG – Preetz",
      "type": "Registerbekanntmachung nach dem Umwandlungsgesetz",
      "state": "Schleswig-Holstein",
      "amtsgericht": "Amtsgericht Kiel",
      "registernummer": "HRA 12890",
      "registerart": "HRA",
      "company_name": "Günter Kroll Projekt GmbH & Co. KG",
      "company_seat": "Preetz",
      "details": "12.02.2026 (Bekanntmachungsdatum)\n\nSchleswig-Holstein Amtsgericht Kiel HRA 12890\nRegisterbekanntmachung nach dem Umwandlungsgesetz 11.02.2026 (Eintragungsdatum)\n\nGünter Kroll Projekt GmbH & Co. KG\nKommanditgesellschaft\nPreetz\n\nZu Eintragungsnummer 2 vom 11.02.2026 wird als nicht eingetragen veröffentlicht:  Den Gläubigern der an der Spaltung beteiligten Rechtsträger ist, wenn sie binnen sechs Monaten nach dem Tag, an dem die Eintragung der Spaltung in das Register des Sitzes desjenigen Rechtsträgers, dessen Gläubiger sie sind,  bekannt gemacht worden ist, ihren Anspruch nach Grund und Höhe schriftlich anmelden, Sicherheit zu leisten, soweit sie nicht Befriedigung verlangen können. Dieses Recht steht den Gläubigern jedoch nur zu, wenn sie glaubhaft machen, dass durch die Spaltung die Erfüllung ihrer Forderung gefährdet wird."
    },
    {
      "date": "2026-02-12",
      "id": "144974",
      "original_text": "Löschungsankündigung\nBrandenburg Amtsgericht Frankfurt/Oder HRB 17227\nSD Bauplanungs GmbH – Gosen-Neu Zittau",
      "type": "Löschungsankündigung",
      "state": "Brandenburg",
      "amtsgericht": "Amtsgericht Frankfurt/Oder",
      "registernummer": "HRB 17227",
      "registerart": "HRB",
      "company_name": "SD Bauplanungs GmbH",
      "company_seat": "Gosen-Neu Zittau",
      "details": "12.02.2026 (Bekanntmachungsdatum)\n\nBrandenburg Amtsgericht Frankfurt/Oder HRB 17227\nLöschungsankündigung\n\nSD Bauplanungs GmbH\nGesellschaft mit beschränkter Haftung\nGosen-Neu Zittau\n\nBei der nachstehenden Gesellschaft wird das Amtslöschungsverfahren gemäß § 394 Abs. 1 FamFG eingeleitet."
    },
    {
      "date": "2026-02-12",
      "id": "144975",
      "original_text": "Registerbekanntmachung nach dem Umwandlungsgesetz\nThüringen Amtsgericht Jena HRA 506779\nKiesewetter Vermögensverwaltung e.K. – Geratal",
      "type": "Registerbekanntmachung nach dem Umwandlungsgesetz",
      "state": "Thüringen",
      "amtsgericht": "Amtsgericht Jena",
      "registernummer": "HRA 506779",
      "registerart": "HRA",
      "company_name": "Kiesewetter Vermögensverwaltung e.K.",
      "company_seat": "Geratal",
      "details": "12.02.2026 (Bekanntmachungsdatum)\n\nThüringen Amtsgericht Jena HRA 506779\nRegisterbekanntmachung nach dem Umwandlungsgesetz 12.02.2026 (Eintragungsdatum)\n\nKiesewetter Vermögensverwaltung e.K.\nEinzelkaufmann / Einzelkauffrau\nGeratal\n\nNicht eingetragen: Den Gläubigern der an der Ausgliederung beteiligten Rechtsträger, ist wenn sie binnen sechs Monaten nach dem Tag, an dem die Eintragung der Ausgliederung in das Register des Sitzes desjenigen Rechtsträgers, dessen Gläubiger sie sind, nach §§125, 19 Abs. 3 UmwG als bekanntgemacht gilt, ihren Anspruch nach Grund und Höhe schriftlich anmelden, Sicherheit zu leisten, soweit sie nicht Befriedigung verlangen können. Dieses Recht steht ihnen jedoch nur zu, wenn sie glaubhaft machen, daß durch die Ausgliederung die Erfüllung ihrer Forderung gefährdet wird."
    },
    {
      "date": "2026-02-12",
      "id": "144976",
      "original_text": "Registerbekanntmachung nach dem Umwandlungsgesetz\nThüringen Amtsgericht Jena HRB 522096\nKVV Kiesewetter Vermögensverwaltungs GmbH – Geratal",
      "type": "Registerbekanntmachung nach dem Umwandlungsgesetz",
      "state": "Thüringen",
      "amtsgericht": "Amtsgericht Jena",
      "registernummer": "HRB 522096",
      "registerart": "HRB",
      "company_name": "KVV Kiesewetter Vermögensverwaltungs GmbH",
      "company_seat": "Geratal",
      "details": "12.02.2026 (Bekanntmachungsdatum)\n\nThüringen Amtsgericht Jena HRB 522096\nRegisterbekanntmachung nach dem Umwandlungsgesetz 12.02.2026 (Eintragungsdatum)\n\nKVV Kiesewetter Vermögensverwaltungs GmbH\nGesellschaft mit beschränkter Haftung\nGeratal\n\nNicht eingetragen: Den Gläubigern der an der Ausgliederung beteiligten Rechtsträger, ist wenn sie binnen sechs Monaten nach dem Tag, an dem die Eintragung der Ausgliederung in das Register des Sitzes desjenigen Rechtsträgers, dessen Gläubiger sie sind, nach §§125, 19 Abs. 3 UmwG als bekanntgemacht gilt, ihren Anspruch nach Grund und Höhe schriftlich anmelden, Sicherheit zu leisten, soweit sie nicht Befriedigung verlangen können. Dieses Recht steht ihnen jedoch nur zu, wenn sie glaubhaft machen, daß durch die Ausgliederung die Erfüllung ihrer Forderung gefährdet wird."
    },
    {
      "date": "2026-02-12",
      "id": "144977",
      "original_text": "Registerbekanntmachung nach dem Umwandlungsgesetz\nHamburg Amtsgericht Hamburg HRB 133482\nGoodMills Deutschland GmbH – Hamburg",
      "type": "Registerbekanntmachung nach dem Umwandlungsgesetz",
      "state": "Hamburg",
      "amtsgericht": "Amtsgericht Hamburg",
      "registernummer": "HRB 133482",
      "registerart": "HRB",
      "company_name": "GoodMills Deutschland GmbH",
      "company_seat": "Hamburg",
      "details": "12.02.2026 (Bekanntmachungsdatum)\n\nHamburg Amtsgericht Hamburg HRB 133482\nRegisterbekanntmachung nach dem Umwandlungsgesetz 12.02.2026 (Eintragungsdatum)\n\nGoodMills Deutschland GmbH\nGesellschaft mit beschränkter Haftung\nHamburg\n\nAls nicht eingetragen wird bekannt gemacht:\nDen Gläubigern der an der Verschmelzung beteiligten Gesellschaften ist, wenn sie binnen sechs Monaten nach dem Tag, an dem die Eintragung der Verschmelzung in das Register des Sitzes desjenigen Rechtsträgers, dessen Gläubiger sie sind, nach § 19 Absatz 3 UmwG als bekannt gemacht gilt, ihren Anspruch nach Grund und Höhe schriftlich anmelden, Sicherheit zu leisten, soweit sie nicht Befriedigung verlangen können. Dieses Recht steht den Gläubigern jedoch nur zu, wenn sie glaubhaft machen, dass durch die Verschmelzung die Erfüllung ihrer Forderung gefährdet wird."
    },
    {
      "date": "2026-02-12",
      "id": "144978",
      "original_text": "Registerbekanntmachung nach dem Umwandlungsgesetz\nMecklenburg-Vorpommern Amtsgericht Neubrandenburg HRB 20710\nStange Grünanlagen & Winterdienst GmbH – Neubrandenburg",
      "type": "Registerbekanntmachung nach dem Umwandlungsgesetz",
      "state": "Mecklenburg-Vorpommern",
      "amtsgericht": "Amtsgericht Neubrandenburg",
      "registernummer": "HRB 20710",
      "registerart": "HRB",
      "company_name": "Stange Grünanlagen & Winterdienst GmbH",
      "company_seat": "Neubrandenburg",
      "details": "12.02.2026 (Bekanntmachungsdatum)\n\nMecklenburg-Vorpommern Amtsgericht Neubrandenburg HRB 20710\nRegisterbekanntmachung nach dem Umwandlungsgesetz 12.02.2026 (Eintragungsdatum)\n\nStange Grünanlagen & Winterdienst GmbH\nGesellschaft mit beschränkter Haftung\nNeubrandenburg\n\nAls nicht eingetragen wird veröffentlicht: Den Gläubigern der an der Verschmelzung beteiligten Rechtsträger ist, wenn sie binnen sechs Monaten nach dem Tag, an dem die Eintragung der Verschmelzung in das Register des Sitzes desjenigen Rechtsträgers, dessen Gläubiger sie sind, nach § 19 Abs. 3 UmwG als bekannt gemacht gilt,\nihren Anspruch nach Grund und Höhe in Textform anmelden, Sicherheit zu leisten, soweit sie nicht Befriedigung verlangen können. Dieses Recht steht den Gläubigern jedoch nur zu, wenn sie glaubhaft machen, dass durch die Verschmelzung die Erfüllung der Forderung gefährdet wird."
    },
    {
      "date": "2026-02-12",
      "id": "144979",
      "original_text": "Einreichung neuer Dokumente\nBrandenburg Amtsgericht Potsdam HRB 31827\nGlycoUniverse GmbH & Co. Kommanditgesellschaft auf Aktien – Potsdam",
      "type": "Einreichung neuer Dokumente",
      "state": "Brandenburg",
      "amtsgericht": "Amtsgericht Potsdam",
      "registernummer": "HRB 31827",
      "registerart": "HRB",
      "company_name": "GlycoUniverse GmbH & Co. Kommanditgesellschaft auf Aktien",
      "company_seat": "Potsdam",
      "details": "12.02.2026 (Bekanntmachungsdatum)\n\nBrandenburg Amtsgericht Potsdam HRB 31827\nEinreichung neuer Dokumente\n\nGlycoUniverse GmbH & Co. Kommanditgesellschaft auf Aktien\nKommanditgesellschaft auf Aktien\nPotsdam\n\nAls nicht eingetragen wird bekanntgemacht: Eine Liste der Mitglieder des Aufsichtsrates wurde zum Handelsregister eingereicht."
    },
    {
      "date": "2026-02-12",
      "id": "144980",
      "original_text": "Sonstige Registerbekanntmachung\nBerlin Amtsgericht Berlin (Charlottenburg) HRB 133604\nFlaconi GmbH – Berlin",
      "type": "Sonstige Registerbekanntmachung",
      "state": "Berlin",
      "amtsgericht": "Amtsgericht Berlin (Charlottenburg)",
      "registernummer": "HRB 133604",
      "registerart": "HRB",
      "company_name": "Flaconi GmbH",
      "company_seat": "Berlin",
      "details": "12.02.2026 (Bekanntmachungsdatum)\n\nBerlin Amtsgericht Berlin (Charlottenburg) HRB 133604\nSonstige Registerbekanntmachung\n\nFlaconi GmbH\nGesellschaft mit beschränkter Haftung\nBerlin\n\nAls nicht eingetragen wird veröffentlicht: Der andere Vertragsteil hat den Gläubigern dieses Rechtsträgers, deren Forderungen begründet worden sind, bevor die Eintragung der Beendigung dieses Vertrages in das Handelsregister nach § 10 des Handelsgesetzbuches als bekannt gemacht gilt, Sicherheit zu leisten, wenn sie sich binnen sechs Monaten nach der Bekanntmachung der Eintragung zu diesem Zweck bei ihm melden. Dieses Recht steht den Gläubigern nicht zu, die im Fall des Insolvenzverfahrens ein Recht auf vorzugsweise Befriedigung aus der Deckungsmasse haben, die nach gesetzlicher Vorschrift zu ihrem Schutz errichtet und staatlich überwacht ist."
    },
    {
      "date": "2026-02-12",
      "id": "144981",
      "original_text": "Registerbekanntmachung nach dem Umwandlungsgesetz\nHamburg Amtsgericht Hamburg HRB 156864\nCastellmühle Krefeld GmbH – Hamburg",
      "type": "Registerbekanntmachung nach dem Umwandlungsgesetz",
      "state": "Hamburg",
      "amtsgericht": "Amtsgericht Hamburg",
      "registernummer": "HRB 156864",
      "registerart": "HRB",
      "company_name": "Castellmühle Krefeld GmbH",
      "company_seat": "Hamburg",
      "details": "12.02.2026 (Bekanntmachungsdatum)\n\nHamburg Amtsgericht Hamburg HRB 156864\nRegisterbekanntmachung nach dem Umwandlungsgesetz 12.02.2026 (Eintragungsdatum)\n\nCastellmühle Krefeld GmbH\nGesellschaft mit beschränkter Haftung\nHamburg\n\nAls nicht eingetragen wird bekannt gemacht:\nDen Gläubigern der an der Verschmelzung beteiligten Gesellschaften ist, wenn sie binnen sechs Monaten nach dem Tag, an dem die Eintragung der Verschmelzung in das Register des Sitzes desjenigen Rechtsträgers, dessen Gläubiger sie sind, nach § 19 Absatz 3 UmwG als bekannt gemacht gilt, ihren Anspruch nach Grund und Höhe schriftlich anmelden, Sicherheit zu leisten, soweit sie nicht Befriedigung verlangen können. Dieses Recht steht den Gläubigern jedoch nur zu, wenn sie glaubhaft machen, dass durch die Verschmelzung die Erfüllung ihrer Forderung gefährdet wird."
    },
    {
      "date": "2026-02-12",
      "id": "144982",
      "original_text": "Registerbekanntmachung nach dem Umwandlungsgesetz\nMecklenburg-Vorpommern Amtsgericht Neubrandenburg HRB 21029\nKommunal Service Neubrandenburg GmbH – Neubrandenburg",
      "type": "Registerbekanntmachung nach dem Umwandlungsgesetz",
      "state": "Mecklenburg-Vorpommern",
      "amtsgericht": "Amtsgericht Neubrandenburg",
      "registernummer": "HRB 21029",
      "registerart": "HRB",
      "company_name": "Kommunal Service Neubrandenburg GmbH",
      "company_seat": "Neubrandenburg",
      "details": "12.02.2026 (Bekanntmachungsdatum)\n\nMecklenburg-Vorpommern Amtsgericht Neubrandenburg HRB 21029\nRegisterbekanntmachung nach dem Umwandlungsgesetz 12.02.2026 (Eintragungsdatum)\n\nKommunal Service Neubrandenburg GmbH\nGesellschaft mit beschränkter Haftung\nNeubrandenburg\n\nAls nicht eingetragen wird veröffentlicht: Den Gläubigern der an der Verschmelzung beteiligten Rechtsträger ist, wenn sie binnen sechs Monaten nach dem Tag, an dem die Eintragung der Verschmelzung in das Register des Sitzes desjenigen Rechtsträgers, dessen Gläubiger sie sind, nach § 19 Abs. 3 UmwG als bekannt gemacht gilt,\nihren Anspruch nach Grund und Höhe in Textform anmelden, Sicherheit zu leisten, soweit sie nicht Befriedigung verlangen können. Dieses Recht steht den Gläubigern jedoch nur zu, wenn sie glaubhaft machen, dass durch die Verschmelzung die Erfüllung der Forderung gefährdet wird."
    },
    {
      "date": "2026-02-12",
      "id": "144983",
      "original_text": "Löschungsankündigung\nBerlin Amtsgericht Berlin (Charlottenburg) HRB 231716\nB4REAL GmbH – Berlin",
      "type": "Löschungsankündigung",
      "state": "Berlin",
      "amtsgericht": "Amtsgericht Berlin (Charlottenburg)",
      "registernummer": "HRB 231716",
      "registerart": "HRB",
      "company_name": "B4REAL GmbH",
      "company_seat": "Berlin",
      "details": "12.02.2026 (Bekanntmachungsdatum)\n\nBerlin Amtsgericht Berlin (Charlottenburg) HRB 231716\nLöschungsankündigung\n\nB4REAL GmbH\nGesellschaft mit beschränkter Haftung\nBerlin\n\nBei der nachstehenden Gesellschaft wird das Amtslöschungsverfahren gemäß § 394 FamFG eingeleitet. Widerspruchsfrist 6 Wochen"
    },
    {
      "date": "2026-02-12",
      "id": "144984",
      "original_text": "Registerbekanntmachung nach dem Umwandlungsgesetz\nHamburg Amtsgericht Hamburg HRB 133270\nEOLI Invest GmbH – Hamburg",
      "type": "Registerbekanntmachung nach dem Umwandlungsgesetz",
      "state": "Hamburg",
      "amtsgericht": "Amtsgericht Hamburg",
      "registernummer": "HRB 133270",
      "registerart": "HRB",
      "company_name": "EOLI Invest GmbH",
      "company_seat": "Hamburg",
      "details": "12.02.2026 (Bekanntmachungsdatum)\n\nHamburg Amtsgericht Hamburg HRB 133270\nRegisterbekanntmachung nach dem Umwandlungsgesetz\n\nEOLI Invest GmbH\nGesellschaft mit beschränkter Haftung\nHamburg\n\n1. Die Gesellschaft hat gemäß § 10 HGB den Entwurf eines Verschmelzungsplans betreffend einer grenzüberschreitenden Verschmelzung zum Handelsregister eingereicht.\nGemäß § 308 UmwG werden folgende Angaben bekannt gemacht:\n\n2. An der grenzüberschreitenden Verschmelzung sind beteiligt\na) als übernehmende Gesellschaft die EOLI Beteiligung GmbH mit dem Sitz in Wien / Österreich eine Gesellschaft mit beschränkter Haftung nach österreichischem Recht, und\nb) als übertragende Gesellschaft die EOLI Invest GmbH mit Sitz in Hamburg, eine Gesellschaft mit beschränkter Haftung nach deutschem Recht.\n\n3. Die übernehmende Gesellschaft ist eingetragen im Firmenbuch der Republik Österreich unter der Firmenbuchnummer FN 418533s, die übertragende Gesellschaft ist eingetragen im Handelsregister des Amtsgerichts Hamburg (Deutschland) unter der Registernummer HRB 133270.\n\n4. Ein Hinweis an folgende Personen, dass sie der jeweiligen Gesellschaft spätestens fünf Arbeitstage vor dem 31. März 2026 (dies ist der früheste Tag, an dem der Verschmelzungsplan beurkundet werden soll und Verschmelzungsbeschlüsse - sofern sie erforderlich oder dienlich sind - gefasst werden sollen) Bemerkungen zum Verschmelzungsplan übermitteln können:\nan die Gesellschafter sowie die Gläubiger der an der grenzüberschreitenden Verschmelzung beteiligten Gesellschaften.\nEin Hinweis an die Betriebsräte oder an die Arbeitnehmer der an der Verschmelzung beteiligten Gesellschaften (§ 308 Abs, l Nr. 4b) UmwG) ist entbehrlich, da keine der beteiligten Gesellschaften über einen Betriebsrat verfügt oder Arbeitnehmer beschäftigt."
    },
    {
      "date": "2026-02-12",
      "id": "144985",
      "original_text": "Sonstige Registerbekanntmachung\nHamburg Amtsgericht Hamburg HRB 132400\nLH Physio GmbH – Hamburg",
      "type": "Sonstige Registerbekanntmachung",
      "state": "Hamburg",
      "amtsgericht": "Amtsgericht Hamburg",
      "registernummer": "HRB 132400",
      "registerart": "HRB",
      "company_name": "LH Physio GmbH",
      "company_seat": "Hamburg",
      "details": "12.02.2026 (Bekanntmachungsdatum)\n\nHamburg Amtsgericht Hamburg HRB 132400\nSonstige Registerbekanntmachung 12.02.2026 (Eintragungsdatum)\n\nLH Physio GmbH\nGesellschaft mit beschränkter Haftung\nHamburg\n\nAls nicht eingetragen wird bekannt gemacht:  Den Gläubigern der Gesellschaft, deren Forderungen begründet worden sind, bevor die Eintragung der Vertragsbeendigung in das Handelsregister nach § 10 HGB als bekannt gemacht gilt, ist vom anderen Vertragsteil Sicherheit zu leisten, wenn sie sich binnen 6 Monaten nach Bekanntmachung der Eintragung zu diesem Zweck bei ihm melden."
    },
    {
      "date": "2026-02-12",
      "id": "144986",
      "original_text": "Löschungsankündigung\nBerlin Amtsgericht Berlin (Charlottenburg) HRA 55194\nBoateng Dienstleistungen GmbH & Co. KG – Berlin",
      "type": "Löschungsankündigung",
      "state": "Berlin",
      "amtsgericht": "Amtsgericht Berlin (Charlottenburg)",
      "registernummer": "HRA 55194",
      "registerart": "HRA",
      "company_name": "Boateng Dienstleistungen GmbH & Co. KG",
      "company_seat": "Berlin",
      "details": "12.02.2026 (Bekanntmachungsdatum)\n\nBerlin Amtsgericht Berlin (Charlottenburg) HRA 55194\nLöschungsankündigung\n\nBoateng Dienstleistungen GmbH & Co. KG\nKommanditgesellschaft\nBerlin\n\nBei dem nachstehenden Unternehmen / der nachstehenden Gesellschaft wird das Amtslöschungsverfahren gemäß § 31 Abs. 2 HGB eingeleitet. Widerspruchsfrist 1 Monat"
    },
    {
      "date": "2026-02-12",
      "id": "144987",
      "original_text": "Löschungsankündigung\nBerlin Amtsgericht Berlin (Charlottenburg) HRB 91524\nAS Dienstleistungs GmbH – Berlin",
      "type": "Löschungsankündigung",
      "state": "Berlin",
      "amtsgericht": "Amtsgericht Berlin (Charlottenburg)",
      "registernummer": "HRB 91524",
      "registerart": "HRB",
      "company_name": "AS Dienstleistungs GmbH",
      "company_seat": "Berlin",
      "details": "12.02.2026 (Bekanntmachungsdatum)\n\nBerlin Amtsgericht Berlin (Charlottenburg) HRB 91524\nLöschungsankündigung\n\nAS Dienstleistungs GmbH\nGesellschaft mit beschränkter Haftung\nBerlin\n\nBei der nachstehenden Gesellschaft wird das Amtslöschungsverfahren gemäß § 394 FamFG eingeleitet. Widerspruchsfrist 6 Wochen"
    },
    {
      "date": "2026-02-12",
      "id": "144988",
      "original_text": "Löschungsankündigung\nBerlin Amtsgericht Berlin (Charlottenburg) HRB 148524\nFine Taste UG (haftungsbeschränkt) – Berlin",
      "type": "Löschungsankündigung",
      "state": "Berlin",
      "amtsgericht": "Amtsgericht Berlin (Charlottenburg)",
      "registernummer": "HRB 148524",
      "registerart": "HRB",
      "company_name": "Fine Taste UG (haftungsbeschränkt)",
      "company_seat": "Berlin",
      "details": "12.02.2026 (Bekanntmachungsdatum)\n\nBerlin Amtsgericht Berlin (Charlottenburg) HRB 148524\nLöschungsankündigung\n\nFine Taste UG (haftungsbeschränkt)\nGesellschaft mit beschränkter Haftung\nBerlin\n\nBei der nachstehenden Gesellschaft wird das Amtslöschungsverfahren gemäß § 394 FamFG eingeleitet. Widerspruchsfrist 6 Wochen"
    },
    {
      "date": "2026-02-12",
      "id": "144989",
      "original_text": "Löschungsankündigung\nBerlin Amtsgericht Berlin (Charlottenburg) HRB 184528\nNever Alone Games UG (haftungsbeschränkt) – Berlin",
      "type": "Löschungsankündigung",
      "state": "Berlin",
      "amtsgericht": "Amtsgericht Berlin (Charlottenburg)",
      "registernummer": "HRB 184528",
      "registerart": "HRB",
      "company_name": "Never Alone Games UG (haftungsbeschränkt)",
      "company_seat": "Berlin",
      "details": "12.02.2026 (Bekanntmachungsdatum)\n\nBerlin Amtsgericht Berlin (Charlottenburg) HRB 184528\nLöschungsankündigung\n\nNever Alone Games UG (haftungsbeschränkt)\nGesellschaft mit beschränkter Haftung\nBerlin\n\nBei der nachstehenden Gesellschaft wird das Amtslöschungsverfahren gemäß § 394 FamFG eingeleitet. Widerspruchsfrist 6 Wochen"
    },
    {
      "date": "2026-02-12",
      "id": "144990",
      "original_text": "Einreichung neuer Dokumente\nHamburg Amtsgericht Hamburg HRB 79674\nHHLA Container Technik GmbH – Hamburg",
      "type": "Einreichung neuer Dokumente",
      "state": "Hamburg",
      "amtsgericht": "Amtsgericht Hamburg",
      "registernummer": "HRB 79674",
      "registerart": "HRB",
      "company_name": "HHLA Container Technik GmbH",
      "company_seat": "Hamburg",
      "details": "12.02.2026 (Bekanntmachungsdatum)\n\nHamburg Amtsgericht Hamburg HRB 79674\nEinreichung neuer Dokumente\n\nHHLA Container Technik GmbH\nGesellschaft mit beschränkter Haftung\nHamburg\n\nAls nicht eingetragen wird bekannt gemacht: Liste des Aufsichtsrats wurde eingereicht."
    },
    {
      "date": "2026-02-12",
      "id": "144991",
      "original_text": "Löschungsankündigung\nBerlin Amtsgericht Berlin (Charlottenburg) HRB 124831\nSAANTEC Bau GmbH – Berlin",
      "type": "Löschungsankündigung",
      "state": "Berlin",
      "amtsgericht": "Amtsgericht Berlin (Charlottenburg)",
      "registernummer": "HRB 124831",
      "registerart": "HRB",
      "company_name": "SAANTEC Bau GmbH",
      "company_seat": "Berlin",
      "details": "12.02.2026 (Bekanntmachungsdatum)\n\nBerlin Amtsgericht Berlin (Charlottenburg) HRB 124831\nLöschungsankündigung\n\nSAANTEC Bau GmbH\nGesellschaft mit beschränkter Haftung\nBerlin\n\nBei der nachstehenden Gesellschaft wird das Amtslöschungsverfahren gemäß § 394 FamFG eingeleitet. Widerspruchsfrist 6 Wochen"
    },
    {
      "date": "2026-02-12",
      "id": "144992",
      "original_text": "Registerbekanntmachung nach dem Umwandlungsgesetz\nBaden-Württemberg Amtsgericht Ulm HRB 650404\nApollon GmbH – Bad Saulgau",
      "type": "Registerbekanntmachung nach dem Umwandlungsgesetz",
      "state": "Baden-Württemberg",
      "amtsgericht": "Amtsgericht Ulm",
      "registernummer": "HRB 650404",
      "registerart": "HRB",
      "company_name": "Apollon GmbH",
      "company_seat": "Bad Saulgau",
      "details": "12.02.2026 (Bekanntmachungsdatum)\n\nBaden-Württemberg Amtsgericht Ulm HRB 650404\nRegisterbekanntmachung nach dem Umwandlungsgesetz 12.02.2026 (Eintragungsdatum)\n\nApollon GmbH\nGesellschaft mit beschränkter Haftung\nBad Saulgau\n\nAls nicht eingetragen wird bekanntgemacht:\nDen Gläubigern der an der Verschmelzung beteiligten Rechtsträger ist, wenn sie binnen sechs Monaten nach dem Tag, an dem die Eintragung der Verschmelzung in das Register des Sitzes desjenigen Rechtsträgers, dessen Gläubiger sie sind, nach § 19 Abs. 3 UmwG als bekanntgemacht gilt, ihren Anspruch nach Grund und Höhe schriftlich anmelden, Sicherheit zu leisten, soweit sie nicht Befriedigung verlangen können. Dieses Recht steht den Gläubigern jedoch nur zu, wenn sie glaubhaft machen, dass durch die Verschmelzung die Erfüllung ihrer Forderung gefährdet wird."
    },
    {
      "date": "2026-02-12",
      "id": "144993",
      "original_text": "Einreichung neuer Dokumente\nBerlin Amtsgericht Berlin (Charlottenburg) HRB 64838\nALSTOM Transportation Germany GmbH – Berlin",
      "type": "Einreichung neuer Dokumente",
      "state": "Berlin",
      "amtsgericht": "Amtsgericht Berlin (Charlottenburg)",
      "registernummer": "HRB 64838",
      "registerart": "HRB",
      "company_name": "ALSTOM Transportation Germany GmbH",
      "company_seat": "Berlin",
      "details": "12.02.2026 (Bekanntmachungsdatum)\n\nBerlin Amtsgericht Berlin (Charlottenburg) HRB 64838\nEinreichung neuer Dokumente\n\nALSTOM Transportation Germany GmbH\nGesellschaft mit beschränkter Haftung\nBerlin\n\nAls nicht eingetragen wird veröffentlicht:\nEs wurde eine neue Liste der Aufsichtsratsmitglieder eingereicht (§52 GmbHG)."
    },
    {
      "date": "2026-02-12",
      "id": "144994",
      "original_text": "Registerbekanntmachung nach dem Umwandlungsgesetz\nSachsen Amtsgericht Leipzig HRB 45182\nENCLIT GmbH – Rötha",
      "type": "Registerbekanntmachung nach dem Umwandlungsgesetz",
      "state": "Sachsen",
      "amtsgericht": "Amtsgericht Leipzig",
      "registernummer": "HRB 45182",
      "registerart": "HRB",
      "company_name": "ENCLIT GmbH",
      "company_seat": "Rötha",
      "details": "12.02.2026 (Bekanntmachungsdatum)\n\nSachsen Amtsgericht Leipzig HRB 45182\nRegisterbekanntmachung nach dem Umwandlungsgesetz 12.02.2026 (Eintragungsdatum)\n\nENCLIT GmbH\nGesellschaft mit beschränkter Haftung\nRötha\n\nDen Gläubigern der an der Umwandlung beteiligten Rechtsträger ist, wenn sie binnen sechs Monaten nach dem Tag, an dem die Eintragung der Umwandlung in das Register des Sitzes desjenigen Rechtsträgers, dessen Gläubiger sie sind, nach § 19 Abs. 3 UmwG als bekannt gemacht gilt, ihren Anspruch nach Grund und Höhe in Textform anmelden, Sicherheit zu leisten, soweit sie nicht Befriedigung verlangen können. Dieses Recht steht den Gläubigern jedoch nur zu, wenn sie glaubhaft machen, dass durch die Umwandlung die Erfüllung der Forderung gefährdet wird."
    },
    {
      "date": "2026-02-12",
      "id": "144995",
      "original_text": "Registerbekanntmachung nach dem Umwandlungsgesetz\nSachsen Amtsgericht Leipzig HRA 19824\nENCLIT Nährböden OHG – Rötha",
      "type": "Registerbekanntmachung nach dem Umwandlungsgesetz",
      "state": "Sachsen",
      "amtsgericht": "Amtsgericht Leipzig",
      "registernummer": "HRA 19824",
      "registerart": "HRA",
      "company_name": "ENCLIT Nährböden OHG",
      "company_seat": "Rötha",
      "details": "12.02.2026 (Bekanntmachungsdatum)\n\nSachsen Amtsgericht Leipzig HRA 19824\nRegisterbekanntmachung nach dem Umwandlungsgesetz 12.02.2026 (Eintragungsdatum)\n\nENCLIT Nährböden OHG\nOffene Handelsgesellschaft\nRötha\n\nDen Gläubigern der an der Umwandlung beteiligten Rechtsträger ist, wenn sie binnen sechs Monaten nach dem Tag, an dem die Eintragung der Umwandlung in das Register des Sitzes desjenigen Rechtsträgers, dessen Gläubiger sie sind, nach § 19 Abs. 3 UmwG als bekannt gemacht gilt, ihren Anspruch nach Grund und Höhe in Textform anmelden, Sicherheit zu leisten, soweit sie nicht Befriedigung verlangen können. Dieses Recht steht den Gläubigern jedoch nur zu, wenn sie glaubhaft machen, dass durch die Umwandlung die Erfüllung der Forderung gefährdet wird."
    },
    {
      "date": "2026-02-12",
      "id": "144996",
      "original_text": "Registerbekanntmachung nach dem Umwandlungsgesetz\nSachsen Amtsgericht Chemnitz HRB 4156\nSRV Verkehrstechnik GmbH – Limbach-Oberfrohna",
      "type": "Registerbekanntmachung nach dem Umwandlungsgesetz",
      "state": "Sachsen",
      "amtsgericht": "Amtsgericht Chemnitz",
      "registernummer": "HRB 4156",
      "registerart": "HRB",
      "company_name": "SRV Verkehrstechnik GmbH",
      "company_seat": "Limbach-Oberfrohna",
      "details": "12.02.2026 (Bekanntmachungsdatum)\n\nSachsen Amtsgericht Chemnitz HRB 4156\nRegisterbekanntmachung nach dem Umwandlungsgesetz 12.02.2026 (Eintragungsdatum)\n\nSRV Verkehrstechnik GmbH\nGesellschaft mit beschränkter Haftung\nLimbach-Oberfrohna\n\nDen Gläubigern der an der Verschmelzung beteiligten Rechtsträger ist, wenn sie binnen sechs Monaten nach dem Tag, an dem die Eintragung der Verschmelzung in das Register des Sitzes desjenigen Rechtsträgers, dessen Gläubiger sie sind, nach § 19 Abs. 3 UmwG als bekannt gemacht gilt, ihren Anspruch nach Grund und Höhe in Textform anmelden, Sicherheit zu leisten, soweit sie nicht Befriedigung verlangen können. Dieses Recht steht den Gläubigern jedoch nur zu, wenn sie glaubhaft machen, dass durch die Verschmelzung die Erfüllung der Forderung gefährdet wird."
    },
    {
      "date": "2026-02-12",
      "id": "144997",
      "original_text": "Löschungsankündigung\nSachsen Amtsgericht Dresden HRB 26731\nAUTO INNOVATION GmbH – Dresden",
      "type": "Löschungsankündigung",
      "state": "Sachsen",
      "amtsgericht": "Amtsgericht Dresden",
      "registernummer": "HRB 26731",
      "registerart": "HRB",
      "company_name": "AUTO INNOVATION GmbH",
      "company_seat": "Dresden",
      "details": "12.02.2026 (Bekanntmachungsdatum)\n\nSachsen Amtsgericht Dresden HRB 26731\nLöschungsankündigung\n\nAUTO INNOVATION GmbH\nGesellschaft mit beschränkter Haftung\nDresden\n\nDas Registergericht beabsichtigt, die im Handelsregister eingetragene Gesellschaft von Amts wegen nach § 394 FamFG zu löschen. Die Frist zu Erhebung eines Widerspruchs gegen die beabsichtigte Löschung wird auf einen Monat festgesetzt."
    },
    {
      "date": "2026-02-12",
      "id": "144998",
      "original_text": "Löschungsankündigung\nSachsen Amtsgericht Leipzig HRB 42485\nEMA Projektbau Leipzig GmbH – Leipzig",
      "type": "Löschungsankündigung",
      "state": "Sachsen",
      "amtsgericht": "Amtsgericht Leipzig",
      "registernummer": "HRB 42485",
      "registerart": "HRB",
      "company_name": "EMA Projektbau Leipzig GmbH",
      "company_seat": "Leipzig",
      "details": "12.02.2026 (Bekanntmachungsdatum)\n\nSachsen Amtsgericht Leipzig HRB 42485\nLöschungsankündigung\n\nEMA Projektbau Leipzig GmbH\nGesellschaft mit beschränkter Haftung\nLeipzig\n\nDas Registergericht beabsichtigt, den im Handelsregister eingetragenen Geschäftsführer Wiktor Zglinski von Amts wegen nach § 395 Absatz 1 FamFG zu löschen. Die Frist zu Erhebung eines Widerspruchs gegen die beabsichtigte Löschung wird auf einen Monat festgesetzt."
    },
    {
      "date": "2026-02-12",
      "id": "144999",
      "original_text": "Einreichung neuer Dokumente\nSachsen Amtsgericht Leipzig HRB 17227\nDr. Födisch Umweltmesstechnik AG – Markranstädt",
      "type": "Einreichung neuer Dokumente",
      "state": "Sachsen",
      "amtsgericht": "Amtsgericht Leipzig",
      "registernummer": "HRB 17227",
      "registerart": "HRB",
      "company_name": "Dr. Födisch Umweltmesstechnik AG",
      "company_seat": "Markranstädt",
      "details": "12.02.2026 (Bekanntmachungsdatum)\n\nSachsen Amtsgericht Leipzig HRB 17227\nEinreichung neuer Dokumente\n\nDr. Födisch Umweltmesstechnik AG\nAktiengesellschaft\nMarkranstädt\n\nAm 27.01.2026 wurde beim Handelsregister des Amtsgerichts Leipzig die Liste der Mitglieder des Aufsichtsrats gemäß § 106 AktG eingereicht."
    },
    {
      "date": "2026-02-12",
      "id": "145000",
      "original_text": "Registerbekanntmachung nach dem Umwandlungsgesetz\nNiedersachsen Amtsgericht Hannover HRB 228119\nFRANDLY VENTURES UG (haftungsbeschränkt) – Hannover",
      "type": "Registerbekanntmachung nach dem Umwandlungsgesetz",
      "state": "Niedersachsen",
      "amtsgericht": "Amtsgericht Hannover",
      "registernummer": "HRB 228119",
      "registerart": "HRB",
      "company_name": "FRANDLY VENTURES UG (haftungsbeschränkt)",
      "company_seat": "Hannover",
      "details": "12.02.2026 (Bekanntmachungsdatum)\n\nNiedersachsen Amtsgericht Hannover HRB 228119\nRegisterbekanntmachung nach dem Umwandlungsgesetz 12.02.2026 (Eintragungsdatum)\n\nFRANDLY VENTURES UG (haftungsbeschränkt)\nGesellschaft mit beschränkter Haftung\nHannover\n\nDen Gläubigern der an der Verschmelzung beteiligten Rechtsträger ist, wenn sie binnen sechs Monaten nach dem Tag, an dem die Eintragung der Verschmelzung in das Register des Sitzes desjenigen Rechtsträgers, dessen Gläubiger sie sind, nach § 19  Abs.  3 UmwG als bekannt gemacht gilt, ihren Anspruch nach Grund und Höhe schriftlich anmelden, Sicherheit zu leisten, soweit sie nicht Befriedigung verlangen können. Dieses Recht steht den Gläubigern jedoch nur zu, wenn sie glaubhaft machen, dass durch die Verschmelzung die Erfüllung der Forderung gefährdet wird."
    },
    {
      "date": "2026-02-12",
      "id": "145001",
      "original_text": "Löschungsankündigung\nNiedersachsen Amtsgericht Stadthagen HRB 201606\nDK´s Fliesenverlegung UG (haftungsbeschränkt) – Rinteln",
      "type": "Löschungsankündigung",
      "state": "Niedersachsen",
      "amtsgericht": "Amtsgericht Stadthagen",
      "registernummer": "HRB 201606",
      "registerart": "HRB",
      "company_name": "DK´s Fliesenverlegung UG (haftungsbeschränkt)",
      "company_seat": "Rinteln",
      "details": "12.02.2026 (Bekanntmachungsdatum)\n\nNiedersachsen Amtsgericht Stadthagen HRB 201606\nLöschungsankündigung\n\nDK´s Fliesenverlegung UG (haftungsbeschränkt)\nGesellschaft mit beschränkter Haftung\nRinteln\n\nDas Registergericht beabsichtigt, die Gesellschaft von Amts wegen nach § 394 FamFG zu löschen. Die Frist zur Erhebung eines Widerspruchs ist auf 1 Monat ab dieser Registerbekanntmachung festgesetzt."
    },
    {
      "date": "2026-02-12",
      "id": "145002",
      "original_text": "Registerbekanntmachung nach dem Umwandlungsgesetz\nNiedersachsen Amtsgericht Hildesheim HRB 207104\nKlinikum Peine gGmbH – Peine",
      "type": "Registerbekanntmachung nach dem Umwandlungsgesetz",
      "state": "Niedersachsen",
      "amtsgericht": "Amtsgericht Hildesheim",
      "registernummer": "HRB 207104",
      "registerart": "HRB",
      "company_name": "Klinikum Peine gGmbH",
      "company_seat": "Peine",
      "details": "12.02.2026 (Bekanntmachungsdatum)\n\nNiedersachsen Amtsgericht Hildesheim HRB 207104\nRegisterbekanntmachung nach dem Umwandlungsgesetz 12.02.2026 (Eintragungsdatum)\n\nKlinikum Peine gGmbH\nGesellschaft mit beschränkter Haftung\nPeine\n\nDen Gläubigern der an der formwechselnden Umwandlung beteiligten Rechtsträger ist, wenn sie binnen sechs Monaten nach dem Tag, an dem die Eintragung der Umwandlung in das Register des Sitzes desjenigen Rechtsträgers, dessen Gläubiger sie sind, nach § 19 Abs. 3 UmwG als bekannt gemacht gilt, ihren Anspruch nach Grund und Höhe schriftlich anmelden, Sicherheit zu leisten, soweit sie nicht Befriedigung verlangen können. Dieses Recht steht den Gläubigern jedoch nur zu, wenn sie glaubhaft machen, dass durch die formwechselnde Umwandlung die Erfüllung der Forderung gefährdet wird."
    },
    {
      "date": "2026-02-12",
      "id": "145003",
      "original_text": "Registerbekanntmachung nach dem Umwandlungsgesetz\nNiedersachsen Amtsgericht Göttingen HRB 2350\nABG Agrarwirtschaftliche Beratung Göttingen Gesellschaft mit beschränkter Haftung – Landolfshausen",
      "type": "Registerbekanntmachung nach dem Umwandlungsgesetz",
      "state": "Niedersachsen",
      "amtsgericht": "Amtsgericht Göttingen",
      "registernummer": "HRB 2350",
      "registerart": "HRB",
      "company_name": "ABG Agrarwirtschaftliche Beratung Göttingen Gesellschaft mit beschränkter Haftung",
      "company_seat": "Landolfshausen",
      "details": "12.02.2026 (Bekanntmachungsdatum)\n\nNiedersachsen Amtsgericht Göttingen HRB 2350\nRegisterbekanntmachung nach dem Umwandlungsgesetz 12.02.2026 (Eintragungsdatum)\n\nABG Agrarwirtschaftliche Beratung Göttingen Gesellschaft mit beschränkter Haftung\nGesellschaft mit beschränkter Haftung\nLandolfshausen\n\nDen Gläubigern der an der Verschmelzung beteiligten Rechtsträger ist, wenn sie binnen sechs Monaten nach dem Tag, an dem die Eintragung der Verschmelzung in das Register des Sitzes desjenigen Rechtsträgers, dessen Gläubiger sie sind, nach § 19  Abs.  3 UmwG als bekannt gemacht gilt, ihren Anspruch nach Grund und Höhe schriftlich anmelden, Sicherheit zu leisten, soweit sie nicht Befriedigung verlangen können. Dieses Recht steht den Gläubigern jedoch nur zu, wenn sie glaubhaft machen, dass durch die Verschmelzung die Erfüllung der Forderung gefährdet wird."
    },
    {
      "date": "2026-02-12",
      "id": "145004",
      "original_text": "Einreichung neuer Dokumente\nNiedersachsen Amtsgericht Hannover HRB 200153\nevent it AG – Hannover",
      "type": "Einreichung neuer Dokumente",
      "state": "Niedersachsen",
      "amtsgericht": "Amtsgericht Hannover",
      "registernummer": "HRB 200153",
      "registerart": "HRB",
      "company_name": "event it AG",
      "company_seat": "Hannover",
      "details": "12.02.2026 (Bekanntmachungsdatum)\n\nNiedersachsen Amtsgericht Hannover HRB 200153\nEinreichung neuer Dokumente\n\nevent it AG\nAktiengesellschaft\nHannover\n\nDie Liste der Mitglieder des Aufsichtsrats wurde beim Registergericht eingereicht."
    },
    {
      "date": "2026-02-12",
      "id": "145005",
      "original_text": "Löschungsankündigung\nNiedersachsen Amtsgericht Osnabrück HRB 215810\nExact Equipment GmbH – Emsbüren",
      "type": "Löschungsankündigung",
      "state": "Niedersachsen",
      "amtsgericht": "Amtsgericht Osnabrück",
      "registernummer": "HRB 215810",
      "registerart": "HRB",
      "company_name": "Exact Equipment GmbH",
      "company_seat": "Emsbüren",
      "details": "12.02.2026 (Bekanntmachungsdatum)\n\nNiedersachsen Amtsgericht Osnabrück HRB 215810\nLöschungsankündigung\n\nExact Equipment GmbH\nGesellschaft mit beschränkter Haftung\nEmsbüren\n\nDas Registergericht beabsichtigt, die Gesellschaft von Amts wegen nach § 394 FamFG wegen Vermögenslosigkeit zu löschen. Die Frist zur Erhebung eines Widerspruchs ist auf 1 Monat ab dieser Registerbekanntmachung festgesetzt."
    },
    {
      "date": "2026-02-12",
      "id": "145006",
      "original_text": "Registerbekanntmachung nach dem Umwandlungsgesetz\nNiedersachsen Amtsgericht Hildesheim HRA 203250\nKlinikum Peine AöR – Peine",
      "type": "Registerbekanntmachung nach dem Umwandlungsgesetz",
      "state": "Niedersachsen",
      "amtsgericht": "Amtsgericht Hildesheim",
      "registernummer": "HRA 203250",
      "registerart": "HRA",
      "company_name": "Klinikum Peine AöR",
      "company_seat": "Peine",
      "details": "12.02.2026 (Bekanntmachungsdatum)\n\nNiedersachsen Amtsgericht Hildesheim HRA 203250\nRegisterbekanntmachung nach dem Umwandlungsgesetz 12.02.2026 (Eintragungsdatum)\n\nKlinikum Peine AöR\nSonstige juristische Person\nPeine\n\nDen Gläubigern der an der formwechselnden Umwandlung beteiligten Rechtsträger ist, wenn sie binnen sechs Monaten nach dem Tag, an dem die Eintragung der Umwandlung in das Register des Sitzes desjenigen Rechtsträgers, dessen Gläubiger sie sind, nach § 19 Abs. 3 UmwG als bekannt gemacht gilt, ihren Anspruch nach Grund und Höhe schriftlich anmelden, Sicherheit zu leisten, soweit sie nicht Befriedigung verlangen können. Dieses Recht steht den Gläubigern jedoch nur zu, wenn sie glaubhaft machen, dass durch die formwechselnde Umwandlung die Erfüllung der Forderung gefährdet wird."
    },
    {
      "date": "2026-02-12",
      "id": "145007",
      "original_text": "Sonstige Registerbekanntmachung\nNiedersachsen Amtsgericht Hannover HRB 214332\nIPM AG – Hannover",
      "type": "Sonstige Registerbekanntmachung",
      "state": "Niedersachsen",
      "amtsgericht": "Amtsgericht Hannover",
      "registernummer": "HRB 214332",
      "registerart": "HRB",
      "company_name": "IPM AG",
      "company_seat": "Hannover",
      "details": "12.02.2026 (Bekanntmachungsdatum)\n\nNiedersachsen Amtsgericht Hannover HRB 214332\nSonstige Registerbekanntmachung\n\nIPM AG\nAktiengesellschaft\nHannover\n\nDie Liste der Mitglieder des Aufsichtsrats wurde beim Registergericht eingereicht."
    },
    {
      "date": "2026-02-12",
      "id": "145008",
      "original_text": "Einreichung neuer Dokumente\nNiedersachsen Amtsgericht Osnabrück HRB 203732\nDFP Deutsche Finanzpartner AG – Wietmarschen",
      "type": "Einreichung neuer Dokumente",
      "state": "Niedersachsen",
      "amtsgericht": "Amtsgericht Osnabrück",
      "registernummer": "HRB 203732",
      "registerart": "HRB",
      "company_name": "DFP Deutsche Finanzpartner AG",
      "company_seat": "Wietmarschen",
      "details": "12.02.2026 (Bekanntmachungsdatum)\n\nNiedersachsen Amtsgericht Osnabrück HRB 203732\nEinreichung neuer Dokumente\n\nDFP Deutsche Finanzpartner AG\nAktiengesellschaft\nWietmarschen\n\nDie Liste der Mitglieder des Aufsichtsrats wurde beim Registergericht eingereicht."
    },
    {
      "date": "2026-02-12",
      "id": "145009",
      "original_text": "Löschungsankündigung\nNiedersachsen Amtsgericht Aurich HRA 201324\nTransport und Logistik Freiburg GmbH & Co. KG – Leer",
      "type": "Löschungsankündigung",
      "state": "Niedersachsen",
      "amtsgericht": "Amtsgericht Aurich",
      "registernummer": "HRA 201324",
      "registerart": "HRA",
      "company_name": "Transport und Logistik Freiburg GmbH & Co. KG",
      "company_seat": "Leer",
      "details": "12.02.2026 (Bekanntmachungsdatum)\n\nNiedersachsen Amtsgericht Aurich HRA 201324\nLöschungsankündigung\n\nTransport und Logistik Freiburg GmbH & Co. KG\nKommanditgesellschaft\nLeer\n\nDas Registergericht beabsichtigt, die Firma von Amts wegen nach § 394 FamFG zu löschen. Die Frist zur Erhebung eines Widerspruchs ist auf 1 Monat ab dieser Registerbekanntmachung festgesetzt."
    },
    {
      "date": "2026-02-12",
      "id": "145010",
      "original_text": "Löschungsankündigung\nNiedersachsen Amtsgericht Osnabrück HRA 207096\nKW Lux GmbH & Co. KG – Werlte",
      "type": "Löschungsankündigung",
      "state": "Niedersachsen",
      "amtsgericht": "Amtsgericht Osnabrück",
      "registernummer": "HRA 207096",
      "registerart": "HRA",
      "company_name": "KW Lux GmbH & Co. KG",
      "company_seat": "Werlte",
      "details": "12.02.2026 (Bekanntmachungsdatum)\n\nNiedersachsen Amtsgericht Osnabrück HRA 207096\nLöschungsankündigung\n\nKW Lux GmbH & Co. KG\nKommanditgesellschaft\nWerlte\n\nDas Registergericht beabsichtigt, die Firma von Amts wegen nach § 394 FamFG wegen Vermögenslosigkeit zu löschen. Die Frist zur Erhebung eines Widerspruchs ist auf 1 Monat ab dieser Registerbekanntmachung festgesetzt."
    },
    {
      "date": "2026-02-12",
      "id": "145011",
      "original_text": "Löschungsankündigung\nRheinland-Pfalz Amtsgericht Kaiserslautern HRB 31263\nPolygraff GmbH – Kaiserslautern",
      "type": "Löschungsankündigung",
      "state": "Rheinland-Pfalz",
      "amtsgericht": "Amtsgericht Kaiserslautern",
      "registernummer": "HRB 31263",
      "registerart": "HRB",
      "company_name": "Polygraff GmbH",
      "company_seat": "Kaiserslautern",
      "details": "12.02.2026 (Bekanntmachungsdatum)\n\nRheinland-Pfalz Amtsgericht Kaiserslautern HRB 31263\nLöschungsankündigung 12.02.1016 (Eintragungsdatum)\n\nPolygraff GmbH\nGesellschaft mit beschränkter Haftung\nKaiserslautern\n\nDas Registergericht beabsichtigt, die Firma Polygraff GmbH mit Situ in Kaiserslautern  von Amts wegen nach § 394 FamFG zu löschen. Die Frist zur Erhebung eines eventuellen  Widerspruchs ist auf drei Monate festgesetzt."
    },
    {
      "date": "2026-02-12",
      "id": "145012",
      "original_text": "Löschungsankündigung\nBremen Amtsgericht Bremen HRB 38436\nKeystone Invest GmbH – Bremen",
      "type": "Löschungsankündigung",
      "state": "Bremen",
      "amtsgericht": "Amtsgericht Bremen",
      "registernummer": "HRB 38436",
      "registerart": "HRB",
      "company_name": "Keystone Invest GmbH",
      "company_seat": "Bremen",
      "details": "12.02.2026 (Bekanntmachungsdatum)\n\nBremen Amtsgericht Bremen HRB 38436\nLöschungsankündigung\n\nKeystone Invest GmbH\nGesellschaft mit beschränkter Haftung\nBremen\n\nEs ist beabsichtigt die im Handelsregister eingetragene Gesellschaft von Amts wegen gemäß § 394 FamFG zu löschen. Gegen die Löschung kann beim AG Bremen schriftlich oder zu Protokoll der Geschäftsstelle Widerspruch eingelegt werden. Widerspruchsfrist 4 Wochen."
    },
    {
      "date": "2026-02-12",
      "id": "145013",
      "original_text": "Sonstige Registerbekanntmachung\nRheinland-Pfalz Amtsgericht Ludwigshafen a.Rhein (Ludwigshafen) HRB 4410\nSensus Services Deutschland GmbH – Ludwigshafen/Rh.",
      "type": "Sonstige Registerbekanntmachung",
      "state": "Rheinland-Pfalz",
      "amtsgericht": "Amtsgericht Ludwigshafen a.Rhein (Ludwigshafen)",
      "registernummer": "HRB 4410",
      "registerart": "HRB",
      "company_name": "Sensus Services Deutschland GmbH",
      "company_seat": "Ludwigshafen/Rh.",
      "details": "12.02.2026 (Bekanntmachungsdatum)\n\nRheinland-Pfalz Amtsgericht Ludwigshafen a.Rhein (Ludwigshafen) HRB 4410\nSonstige Registerbekanntmachung 10.02.2026 (Eintragungsdatum)\n\nSensus Services Deutschland GmbH\nGesellschaft mit beschränkter Haftung\nLudwigshafen/Rh.\n\nAls nicht eingetragen wird veröffentlicht: Den Gläubigern der Gesellschaft, deren Forderungen begründet worden sind, bevor die Eintragung der Beendigung des Beherrschungs- und Gewinnabführungsvertrages in das Handelsregister nach § 10 des Handelsgesetzbuches als bekanntgemacht gilt, hat der andere Vertragsteil Sicherheit zu leisten, wenn sie sich binnen sechs Monaten nach der Bekanntmachung der Eintragung zu diesem Zweck bei ihm melden."
    },
    {
      "date": "2026-02-12",
      "id": "145014",
      "original_text": "Einreichung neuer Dokumente\nRheinland-Pfalz Amtsgericht Montabaur HRB 6301\naktiencheck.de AG – Bad Marienberg",
      "type": "Einreichung neuer Dokumente",
      "state": "Rheinland-Pfalz",
      "amtsgericht": "Amtsgericht Montabaur",
      "registernummer": "HRB 6301",
      "registerart": "HRB",
      "company_name": "aktiencheck.de AG",
      "company_seat": "Bad Marienberg",
      "details": "12.02.2026 (Bekanntmachungsdatum)\n\nRheinland-Pfalz Amtsgericht Montabaur HRB 6301\nEinreichung neuer Dokumente\n\naktiencheck.de AG\nAktiengesellschaft\nBad Marienberg\n\nDem Registergericht ist eine neue Liste der Mitglieder des Aufsichtsrates eingereicht worden."
    },
    {
      "date": "2026-02-12",
      "id": "145015",
      "original_text": "Löschungsankündigung\nRheinland-Pfalz Amtsgericht Ludwigshafen a.Rhein (Ludwigshafen) HRB 42384\nHac GmbH – Neidenfels",
      "type": "Löschungsankündigung",
      "state": "Rheinland-Pfalz",
      "amtsgericht": "Amtsgericht Ludwigshafen a.Rhein (Ludwigshafen)",
      "registernummer": "HRB 42384",
      "registerart": "HRB",
      "company_name": "Hac GmbH",
      "company_seat": "Neidenfels",
      "details": "12.02.2026 (Bekanntmachungsdatum)\n\nRheinland-Pfalz Amtsgericht Ludwigshafen a.Rhein (Ludwigshafen) HRB 42384\nLöschungsankündigung\n\nHac GmbH\nGesellschaft mit beschränkter Haftung\nNeidenfels\n\nDas Registergericht beabsichtigt die Gesellschaft von Amts wegen nach § 394 FamFG zu löschen. Die Frist zur Erhebung eines Widerspruchs ist auf drei Monate festgesetzt."
    },
    {
      "date": "2026-02-12",
      "id": "145016",
      "original_text": "Löschungsankündigung\nNordrhein-Westfalen Amtsgericht Wuppertal HRB 9739\nALBA Vorschubservice GmbH – Wuppertal",
      "type": "Löschungsankündigung",
      "state": "Nordrhein-Westfalen",
      "amtsgericht": "Amtsgericht Wuppertal",
      "registernummer": "HRB 9739",
      "registerart": "HRB",
      "company_name": "ALBA Vorschubservice GmbH",
      "company_seat": "Wuppertal",
      "details": "12.02.2026 (Bekanntmachungsdatum)\n\nNordrhein-Westfalen Amtsgericht Wuppertal HRB 9739\nLöschungsankündigung 11.02.2026 (Eintragungsdatum)\n\nALBA Vorschubservice GmbH\nGesellschaft mit beschränkter Haftung\nWuppertal\n\nDas Registergericht beabsichtigt die Gesellschaft von Amts wegen nach § 394 FamFG zu löschen. Die Frist zur Erhebung eines Widerspruchs ist auf einen Monat festgesetzt."
    },
    {
      "date": "2026-02-12",
      "id": "145017",
      "original_text": "Registerbekanntmachung nach dem Umwandlungsgesetz\nNordrhein-Westfalen Amtsgericht Recklinghausen HRB 5032\nOrtho Spina GmbH – Datteln",
      "type": "Registerbekanntmachung nach dem Umwandlungsgesetz",
      "state": "Nordrhein-Westfalen",
      "amtsgericht": "Amtsgericht Recklinghausen",
      "registernummer": "HRB 5032",
      "registerart": "HRB",
      "company_name": "Ortho Spina GmbH",
      "company_seat": "Datteln",
      "details": "12.02.2026 (Bekanntmachungsdatum)\n\nNordrhein-Westfalen Amtsgericht Recklinghausen HRB 5032\nRegisterbekanntmachung nach dem Umwandlungsgesetz 12.02.2026 (Eintragungsdatum)\n\nOrtho Spina GmbH\nGesellschaft mit beschränkter Haftung\nDatteln\n\nDen Gläubigern der an der Verschmelzung beteiligten Rechtsträger ist, wenn sie binnen sechs Monaten nach dem Tag, an dem die Eintragung der Verschmelzung in das Register des Sitzes desjenigen Rechtsträgers, dessen Gläubiger sie sind, nach § 19 Absatz 3 UmwG als bekanntgemacht gilt, ihren Anspruch nach Grund und Höhe schriftlich anmelden, Sicherheit zu leisten, soweit sie nicht Befriedigung verlangen können. Dieses Recht steht den Gläubigern jedoch nur zu, wenn sie glaubhaft machen, dass durch die Verschmelzung die Erfüllung ihrer Forderung gefährdet wird."
    },
    {
      "date": "2026-02-12",
      "id": "145018",
      "original_text": "Löschungsankündigung\nNordrhein-Westfalen Amtsgericht Siegburg HRA 6310\nDooZ Media Ltd. & Co. KG – Windeck",
      "type": "Löschungsankündigung",
      "state": "Nordrhein-Westfalen",
      "amtsgericht": "Amtsgericht Siegburg",
      "registernummer": "HRA 6310",
      "registerart": "HRA",
      "company_name": "DooZ Media Ltd. & Co. KG",
      "company_seat": "Windeck",
      "details": "12.02.2026 (Bekanntmachungsdatum)\n\nNordrhein-Westfalen Amtsgericht Siegburg HRA 6310\nLöschungsankündigung\n\nDooZ Media Ltd. & Co. KG\nKommanditgesellschaft\nWindeck\n\nDie Anmeldung des Erlöschens der Firma ist durch die hierzu Verpflichteten nicht auf dem in § 14 HGB bezeichneten Weg herbeizuführen, weil die phG nicht mehr existiert. Sie ist am 16.12.2025 im englischen Register des Companies House gelöscht.\nDie Firma soll daher von Amts wegen gelöscht werden."
    },
    {
      "date": "2026-02-12",
      "id": "145019",
      "original_text": "Registerbekanntmachung nach dem Umwandlungsgesetz\nNordrhein-Westfalen Amtsgericht Hamm HRA 4685\nHeinrich Mandok e.K. – Bergkamen",
      "type": "Registerbekanntmachung nach dem Umwandlungsgesetz",
      "state": "Nordrhein-Westfalen",
      "amtsgericht": "Amtsgericht Hamm",
      "registernummer": "HRA 4685",
      "registerart": "HRA",
      "company_name": "Heinrich Mandok e.K.",
      "company_seat": "Bergkamen",
      "details": "12.02.2026 (Bekanntmachungsdatum)\n\nNordrhein-Westfalen Amtsgericht Hamm HRA 4685\nRegisterbekanntmachung nach dem Umwandlungsgesetz 12.02.2026 (Eintragungsdatum)\n\nHeinrich Mandok e.K.\nEinzelkaufmann / Einzelkauffrau\nBergkamen\n\nDen Gläubigern der an der Ausgliederung beteiligten Rechtsträger ist, wenn sie binnen sechs Monaten nach dem Tag, an dem die Eintragung der Ausgliederung in das Register des Sitzes derjenigen Rechtsträger deren Gläubiger sie sind, nach § 19 Absatz 3 UmwG als bekanntgemacht gilt, ihren Anspruch nach Grund und Höhe schriftlich anmelden, Sicherheit zu leisten, soweit sie nicht Befriedigung verlangen können. Dieses Recht steht den Gläubigern jedoch nur zu, wenn sie glaubhaft machen, dass durch die Ausgliederung die Erfüllung ihrer Forderung gefährdet wird."
    },
    {
      "date": "2026-02-12",
      "id": "145020",
      "original_text": "Registerbekanntmachung nach dem Umwandlungsgesetz\nNordrhein-Westfalen Amtsgericht Hamm HRA 4690\nKfz-Mandok GmbH & Co. KG – Bergkamen",
      "type": "Registerbekanntmachung nach dem Umwandlungsgesetz",
      "state": "Nordrhein-Westfalen",
      "amtsgericht": "Amtsgericht Hamm",
      "registernummer": "HRA 4690",
      "registerart": "HRA",
      "company_name": "Kfz-Mandok GmbH & Co. KG",
      "company_seat": "Bergkamen",
      "details": "12.02.2026 (Bekanntmachungsdatum)\n\nNordrhein-Westfalen Amtsgericht Hamm HRA 4690\nRegisterbekanntmachung nach dem Umwandlungsgesetz 12.02.2026 (Eintragungsdatum)\n\nKfz-Mandok GmbH & Co. KG\nKommanditgesellschaft\nBergkamen\n\nDen Gläubigern der an der Ausgliederung beteiligten Rechtsträger ist, wenn sie binnen sechs Monaten nach dem Tag, an dem die Eintragung der Ausgliederung in das Register des Sitzes derjenigen Rechtsträger deren Gläubiger sie sind, nach § 19 Absatz 3 UmwG als bekanntgemacht gilt, ihren Anspruch nach Grund und Höhe schriftlich anmelden, Sicherheit zu leisten, soweit sie nicht Befriedigung verlangen können. Dieses Recht steht den Gläubigern jedoch nur zu, wenn sie glaubhaft machen, dass durch die Ausgliederung die Erfüllung ihrer Forderung gefährdet wird."
    },
    {
      "date": "2026-02-12",
      "id": "145021",
      "original_text": "Löschungsankündigung\nNordrhein-Westfalen Amtsgericht Krefeld HRB 20901\nBws Fireworks UG (haftungsbeschränkt) – Nettetal",
      "type": "Löschungsankündigung",
      "state": "Nordrhein-Westfalen",
      "amtsgericht": "Amtsgericht Krefeld",
      "registernummer": "HRB 20901",
      "registerart": "HRB",
      "company_name": "Bws Fireworks UG (haftungsbeschränkt)",
      "company_seat": "Nettetal",
      "details": "12.02.2026 (Bekanntmachungsdatum)\n\nNordrhein-Westfalen Amtsgericht Krefeld HRB 20901\nLöschungsankündigung\n\nBws Fireworks UG (haftungsbeschränkt)\nGesellschaft mit beschränkter Haftung\nNettetal\n\nDas Registergericht beabsichtigt die Gesellschaft von Amts wegen nach § 394 FamFG zu löschen. Die Frist zur Erhebung eines Widerspruchs ist auf einen Monat festgesetzt."
    },
    {
      "date": "2026-02-12",
      "id": "145022",
      "original_text": "Registerbekanntmachung nach dem Umwandlungsgesetz\nNordrhein-Westfalen Amtsgericht Köln HRB 62698\nEigen Grundstücksverwaltung GmbH – Leverkusen",
      "type": "Registerbekanntmachung nach dem Umwandlungsgesetz",
      "state": "Nordrhein-Westfalen",
      "amtsgericht": "Amtsgericht Köln",
      "registernummer": "HRB 62698",
      "registerart": "HRB",
      "company_name": "Eigen Grundstücksverwaltung GmbH",
      "company_seat": "Leverkusen",
      "details": "12.02.2026 (Bekanntmachungsdatum)\n\nNordrhein-Westfalen Amtsgericht Köln HRB 62698\nRegisterbekanntmachung nach dem Umwandlungsgesetz 12.02.2026 (Eintragungsdatum)\n\nEigen Grundstücksverwaltung GmbH\nGesellschaft mit beschränkter Haftung\nLeverkusen\n\nDen Gläubigern der an der formwechselnden Umwandlung beteiligten Rechtsträger ist, wenn sie binnen sechs Monaten nach dem Tag, an dem die Eintragung der formwechselnden Umwandlung in das Register des Sitzes derjenigen Rechtsträger deren Gläubiger sie sind, nach § 19 Absatz 3 UmwG als bekanntgemacht gilt, ihren Anspruch nach Grund und Höhe schriftlich anmelden, Sicherheit zu leisten, soweit sie nicht Befriedigung verlangen können. Dieses Recht steht den Gläubigern jedoch nur zu, wenn sie glaubhaft machen, dass durch die formwechselnden Umwandlung die Erfüllung ihrer Forderung gefährdet wird."
    },
    {
      "date": "2026-02-12",
      "id": "145023",
      "original_text": "Registerbekanntmachung nach dem Umwandlungsgesetz\nNordrhein-Westfalen Amtsgericht Köln HRB 125025\nSignature Verkehrssicherung GmbH – Leverkusen",
      "type": "Registerbekanntmachung nach dem Umwandlungsgesetz",
      "state": "Nordrhein-Westfalen",
      "amtsgericht": "Amtsgericht Köln",
      "registernummer": "HRB 125025",
      "registerart": "HRB",
      "company_name": "Signature Verkehrssicherung GmbH",
      "company_seat": "Leverkusen",
      "details": "12.02.2026 (Bekanntmachungsdatum)\n\nNordrhein-Westfalen Amtsgericht Köln HRB 125025\nRegisterbekanntmachung nach dem Umwandlungsgesetz 12.02.2026 (Eintragungsdatum)\n\nSignature Verkehrssicherung GmbH\nGesellschaft mit beschränkter Haftung\nLeverkusen\n\nDen Gläubigern der an der Verschmelzung beteiligten Rechtsträger ist, wenn sie binnen sechs Monaten nach dem Tag, an dem die Eintragung der Verschmelzung in das Register des Sitzes desjenigen Rechtsträgers, dessen Gläubiger sie sind, nach § 19 Absatz 3 UmwG als bekanntgemacht gilt, ihren Anspruch nach Grund und Höhe schriftlich anmelden, Sicherheit zu leisten, soweit sie nicht Befriedigung verlangen können. Dieses Recht steht den Gläubigern jedoch nur zu, wenn sie glaubhaft machen, dass durch die Verschmelzung die Erfüllung ihrer Forderung gefährdet wird."
    },
    {
      "date": "2026-02-12",
      "id": "145024",
      "original_text": "Löschungsankündigung\nNordrhein-Westfalen Amtsgericht Siegen HRB 13543\n57 Security UG (haftungsbeschränkt) – Siegen",
      "type": "Löschungsankündigung",
      "state": "Nordrhein-Westfalen",
      "amtsgericht": "Amtsgericht Siegen",
      "registernummer": "HRB 13543",
      "registerart": "HRB",
      "company_name": "57 Security UG (haftungsbeschränkt)",
      "company_seat": "Siegen",
      "details": "12.02.2026 (Bekanntmachungsdatum)\n\nNordrhein-Westfalen Amtsgericht Siegen HRB 13543\nLöschungsankündigung\n\n57 Security UG (haftungsbeschränkt)\nGesellschaft mit beschränkter Haftung\nSiegen\n\nDas Registergericht beabsichtigt die Gesellschaft von Amts wegen nach § 394 FamFG zu löschen. Die Frist zur Erhebung eines Widerspruchs ist auf drei Monate festgesetzt."
    },
    {
      "date": "2026-02-12",
      "id": "145025",
      "original_text": "Sonstige Registerbekanntmachung\nNordrhein-Westfalen Amtsgericht Gütersloh HRB 2561\nwertkreis Gütersloh, gemeinnützige Gesellschaft mit beschränkter Haftung – Gütersloh",
      "type": "Sonstige Registerbekanntmachung",
      "state": "Nordrhein-Westfalen",
      "amtsgericht": "Amtsgericht Gütersloh",
      "registernummer": "HRB 2561",
      "registerart": "HRB",
      "company_name": "wertkreis Gütersloh, gemeinnützige Gesellschaft mit beschränkter Haftung",
      "company_seat": "Gütersloh",
      "details": "12.02.2026 (Bekanntmachungsdatum)\n\nNordrhein-Westfalen Amtsgericht Gütersloh HRB 2561\nSonstige Registerbekanntmachung\n\nwertkreis Gütersloh, gemeinnützige Gesellschaft mit beschränkter Haftung\nGesellschaft mit beschränkter Haftung\nGütersloh\n\nDem Registergericht ist eine neue Liste der Mitglieder des Aufsichtsrates eingereicht worden."
    },
    {
      "date": "2026-02-12",
      "id": "145026",
      "original_text": "Löschungsankündigung\nNordrhein-Westfalen Amtsgericht Wuppertal HRB 30533\nMATE Handels GmbH – Wuppertal",
      "type": "Löschungsankündigung",
      "state": "Nordrhein-Westfalen",
      "amtsgericht": "Amtsgericht Wuppertal",
      "registernummer": "HRB 30533",
      "registerart": "HRB",
      "company_name": "MATE Handels GmbH",
      "company_seat": "Wuppertal",
      "details": "12.02.2026 (Bekanntmachungsdatum)\n\nNordrhein-Westfalen Amtsgericht Wuppertal HRB 30533\nLöschungsankündigung 11.02.2026 (Eintragungsdatum)\n\nMATE Handels GmbH\nGesellschaft mit beschränkter Haftung\nWuppertal\n\nDas Registergericht beabsichtigt die Gesellschaft von Amts wegen nach § 394 FamFG zu löschen. Die Frist zur Erhebung eines Widerspruchs ist auf einen Monat festgesetzt."
    },
    {
      "date": "2026-02-12",
      "id": "145027",
      "original_text": "Registerbekanntmachung nach dem Umwandlungsgesetz\nNordrhein-Westfalen Amtsgericht Düsseldorf HRB 38973\nDUSSPAR Möbelvertriebsgesellschaft mbH – Düsseldorf",
      "type": "Registerbekanntmachung nach dem Umwandlungsgesetz",
      "state": "Nordrhein-Westfalen",
      "amtsgericht": "Amtsgericht Düsseldorf",
      "registernummer": "HRB 38973",
      "registerart": "HRB",
      "company_name": "DUSSPAR Möbelvertriebsgesellschaft mbH",
      "company_seat": "Düsseldorf",
      "details": "12.02.2026 (Bekanntmachungsdatum)\n\nNordrhein-Westfalen Amtsgericht Düsseldorf HRB 38973\nRegisterbekanntmachung nach dem Umwandlungsgesetz 12.02.2026 (Eintragungsdatum)\n\nDUSSPAR Möbelvertriebsgesellschaft mbH\nGesellschaft mit beschränkter Haftung\nDüsseldorf\n\nDen Gläubigern der an der Verschmelzung beteiligten Rechtsträger ist, wenn sie binnen sechs Monaten nach dem Tag, an dem die Eintragung der Verschmelzung in das Register des Sitzes desjenigen Rechtsträgers, dessen Gläubiger sie sind, nach § 19 Absatz 3 UmwG als bekanntgemacht gilt, ihren Anspruch nach Grund und Höhe schriftlich anmelden, Sicherheit zu leisten, soweit sie nicht Befriedigung verlangen können. Dieses Recht steht den Gläubigern jedoch nur zu, wenn sie glaubhaft machen, dass durch die Verschmelzung die Erfüllung ihrer Forderung gefährdet wird."
    },
    {
      "date": "2026-02-12",
      "id": "145028",
      "original_text": "Löschungsankündigung\nNordrhein-Westfalen Amtsgericht Aachen HRB 26658\nUaNa Handels UG (haftungsbeschränkt) – Aachen",
      "type": "Löschungsankündigung",
      "state": "Nordrhein-Westfalen",
      "amtsgericht": "Amtsgericht Aachen",
      "registernummer": "HRB 26658",
      "registerart": "HRB",
      "company_name": "UaNa Handels UG (haftungsbeschränkt)",
      "company_seat": "Aachen",
      "details": "12.02.2026 (Bekanntmachungsdatum)\n\nNordrhein-Westfalen Amtsgericht Aachen HRB 26658\nLöschungsankündigung\n\nUaNa Handels UG (haftungsbeschränkt)\nGesellschaft mit beschränkter Haftung\nAachen\n\nDas Registergericht beabsichtigt, von Amts wegen die Gesellschaft wegen Vermögenslosigkeit nach § 394 FamFG zu löschen, weil das Finanzamt\nAachen-Stadt mit Schreiben vom 03.02.2026 Umstände mitgeteilt hat, aufgrund\nderer das Gericht davon überzeugt ist, dass die Gesellschaft vollständig\nvermögenslos ist.\n\nZur Geltendmachung des Widerspruchs gegen die beabsichtigte Löschung wird\nhiermit eine Frist von einem Monat ab Veröffentlichung dieser Ankündigung\nbestimmt.\n\nRechtsbehelfsbelehrung:\n\nGegen diese Verfügung kann Widerspruch eingelegt werden. Zum Widerspruch ist jeder berechtigt, der an der Unterlassung der Löschung ein berechtigtes Interesse hat.\n\nDer Widerspruch ist bei dem Amtsgericht Aachen, Adalbertsteinweg 92, 52070\nAachen schriftlich in deutscher Sprache oder zur Niederschrift der Geschäftsstelle einzulegen. Der Widerspruch kann auch zur Niederschrift der Geschäftsstelle eines jeden Amtsgerichtes abgegeben werden.\n\nDer Widerspruch muss spätestens innerhalb der gesetzten Frist nach der\nBekanntgabe der Verfügung bei dem Amtsgericht Aachen eingegangen sein. Dies gilt auch dann, wenn der Widerspruch zur Niederschrift der Geschäftsstelle eines anderen Amtsgerichtes abgegeben wurde. Die Frist beginnt mit der Bekanntgabe der Verfügung durch Veröffentlichung. Fällt das Ende der Frist auf einen Sonntag, einen allgemeinen Feiertag oder Sonnabend, so endet die Frist mit Ablauf des nächsten Werktages.\n\nDer Widerspruch muss die Bezeichnung der angefochtenen Verfügung sowie die Erklärung enthalten, dass Widerspruch gegen diese Verfügung eingelegt wird. Er ist zu unterzeichnen und soll begründet werden.\nDie Einlegung ist auch durch Übertragung eines elektronischen Dokuments an die elektronische Poststelle des Gerichts möglich. Das elektronische Dokument muss für die Bearbeitung durch das Gericht geeignet und mit einer qualifizierten\nelektronischen Signatur der verantwortenden Person versehen sein oder von der verantwortenden Person signiert und auf einem sicheren Übermittlungsweg gemäß § 130 a ZPO nach näherer Maßgabe der Verordnung über die technischen Rahmenbedingungen des elektronischen Rechtsverkehrs und über das besondere elektronische Behördenpostfach (BGBl. I, S. 3803) eingereicht werden. Weitere Informationen erhalten Sie auf der Internetseite www.justiz.de."
    },
    {
      "date": "2026-02-12",
      "id": "145029",
      "original_text": "Löschungsankündigung\nNordrhein-Westfalen Amtsgericht Mönchengladbach HRB 1317\nIV Verwaltung GmbH – Mönchengladbach",
      "type": "Löschungsankündigung",
      "state": "Nordrhein-Westfalen",
      "amtsgericht": "Amtsgericht Mönchengladbach",
      "registernummer": "HRB 1317",
      "registerart": "HRB",
      "company_name": "IV Verwaltung GmbH",
      "company_seat": "Mönchengladbach",
      "details": "12.02.2026 (Bekanntmachungsdatum)\n\nNordrhein-Westfalen Amtsgericht Mönchengladbach HRB 1317\nLöschungsankündigung\n\nIV Verwaltung GmbH\nGesellschaft mit beschränkter Haftung\nMönchengladbach\n\nDas Registergericht beabsichtigt, die im Handelsregister eingetragene Gesellschaft gemäß § 394 Absatz 1 FamFG wegen Vermögenslosigkeit von Amts wegen zu löschen. Gegen diese Verfügung kann Widerspruch eingelegt werden. Die Frist zur Erhebung eines Widerspruchs gegen die beabsichtigte Löschung von Amts wegen ist auf zwei Monate festgesetzt."
    },
    {
      "date": "2026-02-12",
      "id": "145030",
      "original_text": "Löschungsankündigung\nNordrhein-Westfalen Amtsgericht Mönchengladbach HRB 6668\nIBG Monforts Walzentechnik Verwaltungs GmbH – Mönchengladbach",
      "type": "Löschungsankündigung",
      "state": "Nordrhein-Westfalen",
      "amtsgericht": "Amtsgericht Mönchengladbach",
      "registernummer": "HRB 6668",
      "registerart": "HRB",
      "company_name": "IBG Monforts Walzentechnik Verwaltungs GmbH",
      "company_seat": "Mönchengladbach",
      "details": "12.02.2026 (Bekanntmachungsdatum)\n\nNordrhein-Westfalen Amtsgericht Mönchengladbach HRB 6668\nLöschungsankündigung\n\nIBG Monforts Walzentechnik Verwaltungs GmbH\nGesellschaft mit beschränkter Haftung\nMönchengladbach\n\nDas Registergericht beabsichtigt, die im Handelsregister eingetragene Gesellschaft gemäß § 394 Absatz 1 FamFG wegen Vermögenslosigkeit von Amts wegen zu löschen. Gegen diese Verfügung kann Widerspruch eingelegt werden. Die Frist zur Erhebung eines Widerspruchs gegen die beabsichtigte Löschung von Amts wegen ist auf drei Monate festgesetzt."
    },
    {
      "date": "2026-02-12",
      "id": "145031",
      "original_text": "Registerbekanntmachung nach dem Umwandlungsgesetz\nNordrhein-Westfalen Amtsgericht Düsseldorf HRB 101484\nSensFab GmbH – Monheim am Rhein",
      "type": "Registerbekanntmachung nach dem Umwandlungsgesetz",
      "state": "Nordrhein-Westfalen",
      "amtsgericht": "Amtsgericht Düsseldorf",
      "registernummer": "HRB 101484",
      "registerart": "HRB",
      "company_name": "SensFab GmbH",
      "company_seat": "Monheim am Rhein",
      "details": "12.02.2026 (Bekanntmachungsdatum)\n\nNordrhein-Westfalen Amtsgericht Düsseldorf HRB 101484\nRegisterbekanntmachung nach dem Umwandlungsgesetz 12.02.2026 (Eintragungsdatum)\n\nSensFab GmbH\nGesellschaft mit beschränkter Haftung\nMonheim am Rhein\n\nDen Gläubigern der an der Verschmelzung beteiligten Rechtsträger ist, wenn sie binnen sechs Monaten nach dem Tag, an dem die Eintragung der Verschmelzung in das Register des Sitzes desjenigen Rechtsträgers, dessen Gläubiger sie sind, nach § 19 Absatz 3 UmwG als bekanntgemacht gilt, ihren Anspruch nach Grund und Höhe schriftlich anmelden, Sicherheit zu leisten, soweit sie nicht Befriedigung verlangen können. Dieses Recht steht den Gläubigern jedoch nur zu, wenn sie glaubhaft machen, dass durch die Verschmelzung die Erfüllung ihrer Forderung gefährdet wird."
    },
    {
      "date": "2026-02-12",
      "id": "145032",
      "original_text": "Einreichung neuer Dokumente\nNordrhein-Westfalen Amtsgericht Duisburg HRB 6422\nocteo MULTISERVICES GmbH – Duisburg",
      "type": "Einreichung neuer Dokumente",
      "state": "Nordrhein-Westfalen",
      "amtsgericht": "Amtsgericht Duisburg",
      "registernummer": "HRB 6422",
      "registerart": "HRB",
      "company_name": "octeo MULTISERVICES GmbH",
      "company_seat": "Duisburg",
      "details": "12.02.2026 (Bekanntmachungsdatum)\n\nNordrhein-Westfalen Amtsgericht Duisburg HRB 6422\nEinreichung neuer Dokumente\n\nocteo MULTISERVICES GmbH\nGesellschaft mit beschränkter Haftung\nDuisburg\n\nDem Registergericht ist eine neue Liste der Mitglieder des Aufsichtsrates eingereicht worden."
    },
    {
      "date": "2026-02-12",
      "id": "145033",
      "original_text": "Löschungsankündigung\nNordrhein-Westfalen Amtsgericht Wuppertal HRB 29443\nAmanah Personal GmbH – Velbert",
      "type": "Löschungsankündigung",
      "state": "Nordrhein-Westfalen",
      "amtsgericht": "Amtsgericht Wuppertal",
      "registernummer": "HRB 29443",
      "registerart": "HRB",
      "company_name": "Amanah Personal GmbH",
      "company_seat": "Velbert",
      "details": "12.02.2026 (Bekanntmachungsdatum)\n\nNordrhein-Westfalen Amtsgericht Wuppertal HRB 29443\nLöschungsankündigung 11.02.2026 (Eintragungsdatum)\n\nAmanah Personal GmbH\nGesellschaft mit beschränkter Haftung\nVelbert\n\nDas Registergericht beabsichtigt die Gesellschaft von Amts wegen nach § 394 FamFG zu löschen. Die Frist zur Erhebung eines Widerspruchs ist auf einen Monat festgesetzt."
    },
    {
      "date": "2026-02-12",
      "id": "145034",
      "original_text": "Löschungsankündigung\nNordrhein-Westfalen Amtsgericht Krefeld VR 2546\nKrefelder Förderverein für Krebsbetroffene und deren Angehörige e.V. – Krefeld",
      "type": "Löschungsankündigung",
      "state": "Nordrhein-Westfalen",
      "amtsgericht": "Amtsgericht Krefeld",
      "registernummer": "VR 2546",
      "registerart": "VR",
      "company_name": "Krefelder Förderverein für Krebsbetroffene und deren Angehörige e.V.",
      "company_seat": "Krefeld",
      "details": "12.02.2026 (Bekanntmachungsdatum)\n\nNordrhein-Westfalen Amtsgericht Krefeld VR 2546\nLöschungsankündigung\n\nKrefelder Förderverein für Krebsbetroffene und deren Angehörige e.V.\neingetragener Verein\nKrefeld\n\nDas Registergericht beabsichtigt, den im Vereinsregister eingetragenen Verein gemäß wegen Wegfall der Mitglieder von Amts wegen zu löschen.\n\nGegen diese Verfügung kann Widerspruch eingelegt werden. Die Frist zur Erhebung eines Widerspruchs gegen die beabsichtigte Löschung von Amts wegen ist auf 6 Wochen festgesetzt."
    },
    {
      "date": "2026-02-12",
      "id": "145035",
      "original_text": "Registerbekanntmachung nach dem Umwandlungsgesetz\nNordrhein-Westfalen Amtsgericht Köln HRB 124722\nKasch Verkehrssicherungs GmbH – Leverkusen",
      "type": "Registerbekanntmachung nach dem Umwandlungsgesetz",
      "state": "Nordrhein-Westfalen",
      "amtsgericht": "Amtsgericht Köln",
      "registernummer": "HRB 124722",
      "registerart": "HRB",
      "company_name": "Kasch Verkehrssicherungs GmbH",
      "company_seat": "Leverkusen",
      "details": "12.02.2026 (Bekanntmachungsdatum)\n\nNordrhein-Westfalen Amtsgericht Köln HRB 124722\nRegisterbekanntmachung nach dem Umwandlungsgesetz 12.02.2026 (Eintragungsdatum)\n\nKasch Verkehrssicherungs GmbH\nGesellschaft mit beschränkter Haftung\nLeverkusen\n\nDen Gläubigern der an der Verschmelzung beteiligten Rechtsträger ist, wenn sie binnen sechs Monaten nach dem Tag, an dem die Eintragung der Verschmelzung in das Register des Sitzes desjenigen Rechtsträgers, dessen Gläubiger sie sind, nach § 19 Absatz 3 UmwG als bekanntgemacht gilt, ihren Anspruch nach Grund und Höhe schriftlich anmelden, Sicherheit zu leisten, soweit sie nicht Befriedigung verlangen können. Dieses Recht steht den Gläubigern jedoch nur zu, wenn sie glaubhaft machen, dass durch die Verschmelzung die Erfüllung ihrer Forderung gefährdet wird."
    },
    {
      "date": "2026-02-12",
      "id": "145036",
      "original_text": "Registerbekanntmachung nach dem Umwandlungsgesetz\nNordrhein-Westfalen Amtsgericht Köln HRB 46046\nAVS Verkehrssicherung GmbH – Leverkusen",
      "type": "Registerbekanntmachung nach dem Umwandlungsgesetz",
      "state": "Nordrhein-Westfalen",
      "amtsgericht": "Amtsgericht Köln",
      "registernummer": "HRB 46046",
      "registerart": "HRB",
      "company_name": "AVS Verkehrssicherung GmbH",
      "company_seat": "Leverkusen",
      "details": "12.02.2026 (Bekanntmachungsdatum)\n\nNordrhein-Westfalen Amtsgericht Köln HRB 46046\nRegisterbekanntmachung nach dem Umwandlungsgesetz 12.02.2026 (Eintragungsdatum)\n\nAVS Verkehrssicherung GmbH\nGesellschaft mit beschränkter Haftung\nLeverkusen\n\nDen Gläubigern der an der Verschmelzung beteiligten Rechtsträger ist, wenn sie binnen sechs Monaten nach dem Tag, an dem die Eintragung der Verschmelzung in das Register des Sitzes desjenigen Rechtsträgers, dessen Gläubiger sie sind, nach § 19 Absatz 3 UmwG als bekanntgemacht gilt, ihren Anspruch nach Grund und Höhe schriftlich anmelden, Sicherheit zu leisten, soweit sie nicht Befriedigung verlangen können. Dieses Recht steht den Gläubigern jedoch nur zu, wenn sie glaubhaft machen, dass durch die Verschmelzung die Erfüllung ihrer Forderung gefährdet wird."
    },
    {
      "date": "2026-02-12",
      "id": "145037",
      "original_text": "Löschungsankündigung\nNordrhein-Westfalen Amtsgericht Mönchengladbach HRB 23411\nHSP Express GmbH – Mönchengladbach",
      "type": "Löschungsankündigung",
      "state": "Nordrhein-Westfalen",
      "amtsgericht": "Amtsgericht Mönchengladbach",
      "registernummer": "HRB 23411",
      "registerart": "HRB",
      "company_name": "HSP Express GmbH",
      "company_seat": "Mönchengladbach",
      "details": "12.02.2026 (Bekanntmachungsdatum)\n\nNordrhein-Westfalen Amtsgericht Mönchengladbach HRB 23411\nLöschungsankündigung\n\nHSP Express GmbH\nGesellschaft mit beschränkter Haftung\nMönchengladbach\n\nDas Registergericht beabsichtigt, die im Handelsregister eingetragene Gesellschaft gemäß § 394 Absatz 1 FamFG wegen Vermögenslosigkeit von Amts wegen zu löschen. Gegen diese Verfügung kann Widerspruch eingelegt werden. Die Frist zur Erhebung eines Widerspruchs gegen die beabsichtigte Löschung von Amts wegen ist auf zwei Monate festgesetzt."
    },
    {
      "date": "2026-02-12",
      "id": "145038",
      "original_text": "Löschungsankündigung\nNordrhein-Westfalen Amtsgericht Münster HRB 19921\nLPS Verwaltung UG (haftungsbeschränkt) – Beckum",
      "type": "Löschungsankündigung",
      "state": "Nordrhein-Westfalen",
      "amtsgericht": "Amtsgericht Münster",
      "registernummer": "HRB 19921",
      "registerart": "HRB",
      "company_name": "LPS Verwaltung UG (haftungsbeschränkt)",
      "company_seat": "Beckum",
      "details": "12.02.2026 (Bekanntmachungsdatum)\n\nNordrhein-Westfalen Amtsgericht Münster HRB 19921\nLöschungsankündigung 11.02.2026 (Eintragungsdatum)\n\nLPS Verwaltung UG (haftungsbeschränkt)\nGesellschaft mit beschränkter Haftung\nBeckum\n\nDas Registergericht beabsichtigt die Gesellschaft von Amts wegen nach § 394 FamFG zu löschen. Die Frist zur Erhebung eines Widerspruchs ist auf #DV.Fr(Text=\"Bitte wählen Sie die Widerspruchsfrist aus!\",Eingabe=\"einen Monat\",\"zwei Monate\",\"drei Monate\",\"#insert(Text=\"Freitext\")\"|\"freier Text\") festgesetzt."
    },
    {
      "date": "2026-02-12",
      "id": "145039",
      "original_text": "Einreichung neuer Dokumente\nNordrhein-Westfalen Amtsgericht Münster HRB 7223\nGEA Westfalia Separator Group GmbH – Oelde",
      "type": "Einreichung neuer Dokumente",
      "state": "Nordrhein-Westfalen",
      "amtsgericht": "Amtsgericht Münster",
      "registernummer": "HRB 7223",
      "registerart": "HRB",
      "company_name": "GEA Westfalia Separator Group GmbH",
      "company_seat": "Oelde",
      "details": "12.02.2026 (Bekanntmachungsdatum)\n\nNordrhein-Westfalen Amtsgericht Münster HRB 7223\nEinreichung neuer Dokumente\n\nGEA Westfalia Separator Group GmbH\nGesellschaft mit beschränkter Haftung\nOelde\n\nDem Registergericht ist eine neue Liste der Mitglieder des Aufsichtsrates eingereicht worden."
    },
    {
      "date": "2026-02-12",
      "id": "145040",
      "original_text": "Löschungsankündigung\nNordrhein-Westfalen Amtsgericht Wuppertal HRA 25909\nREVENTO Transport GmbH & Co. KG – Erkrath",
      "type": "Löschungsankündigung",
      "state": "Nordrhein-Westfalen",
      "amtsgericht": "Amtsgericht Wuppertal",
      "registernummer": "HRA 25909",
      "registerart": "HRA",
      "company_name": "REVENTO Transport GmbH & Co. KG",
      "company_seat": "Erkrath",
      "details": "12.02.2026 (Bekanntmachungsdatum)\n\nNordrhein-Westfalen Amtsgericht Wuppertal HRA 25909\nLöschungsankündigung\n\nREVENTO Transport GmbH & Co. KG\nKommanditgesellschaft\nErkrath\n\nDas Registergericht beabsichtigt die Firma von Amts wegen nach § 393 FamFG zu löschen. Die Frist zur Erhebung eines Widerspruchs ist auf zwei Monate festgesetzt."
    },
    {
      "date": "2026-02-12",
      "id": "145041",
      "original_text": "Registerbekanntmachung nach dem Umwandlungsgesetz\nNordrhein-Westfalen Amtsgericht Bonn HRB 10053\npersonal-point Personal- und Unternehmensberatung GmbH – Bonn",
      "type": "Registerbekanntmachung nach dem Umwandlungsgesetz",
      "state": "Nordrhein-Westfalen",
      "amtsgericht": "Amtsgericht Bonn",
      "registernummer": "HRB 10053",
      "registerart": "HRB",
      "company_name": "personal-point Personal- und Unternehmensberatung GmbH",
      "company_seat": "Bonn",
      "details": "12.02.2026 (Bekanntmachungsdatum)\n\nNordrhein-Westfalen Amtsgericht Bonn HRB 10053\nRegisterbekanntmachung nach dem Umwandlungsgesetz 12.02.2026 (Eintragungsdatum)\n\npersonal-point Personal- und Unternehmensberatung GmbH\nGesellschaft mit beschränkter Haftung\nBonn\n\nDen Gläubigern der an der Vermögensübertragung beteiligten Rechtsträger ist, wenn sie binnen sechs Monaten nach dem Tag, an dem die Eintragung der Vermögensübertragung in das Register des Sitzes desjenigen Rechtsträgers, dessen Gläubiger sie sind, nach § 19 Absatz 3 UmwG als bekanntgemacht gilt, ihren Anspruch nach Grund und Höhe schriftlich anmelden, Sicherheit zu leisten, soweit sie nicht Befriedigung verlangen können. Dieses Recht steht den Gläubigern jedoch nur zu, wenn sie glaubhaft machen, dass durch die Vermögensübertragung die Erfüllung ihrer Forderung gefährdet wird."
    },
    {
      "date": "2026-02-12",
      "id": "145042",
      "original_text": "Löschungsankündigung\nThüringen Amtsgericht Jena HRB 509341\nCarlos P. Vermietungsgesellschaft mbH – Jena",
      "type": "Löschungsankündigung",
      "state": "Thüringen",
      "amtsgericht": "Amtsgericht Jena",
      "registernummer": "HRB 509341",
      "registerart": "HRB",
      "company_name": "Carlos P. Vermietungsgesellschaft mbH",
      "company_seat": "Jena",
      "details": "12.02.2026 (Bekanntmachungsdatum)\n\nThüringen Amtsgericht Jena HRB 509341\nLöschungsankündigung\n\nCarlos P. Vermietungsgesellschaft mbH\nGesellschaft mit beschränkter Haftung\nJena\n\nDas Registergericht beabsichtigt, die im Handelsregister eingetragene Gesellschaft wegen Vermögenslosigkeit nach § 394 FamFG von Amts wegen zu löschen. Die Frist zur Erhebung eines Widerspruchs gegen die beabsichtigte Löschung wird auf 6 Wochen festgesetzt."
    },
    {
      "date": "2026-02-12",
      "id": "145043",
      "original_text": "Löschungsankündigung\nThüringen Amtsgericht Jena HRB 514191\nEB Kunst GmbH – Altenburg",
      "type": "Löschungsankündigung",
      "state": "Thüringen",
      "amtsgericht": "Amtsgericht Jena",
      "registernummer": "HRB 514191",
      "registerart": "HRB",
      "company_name": "EB Kunst GmbH",
      "company_seat": "Altenburg",
      "details": "12.02.2026 (Bekanntmachungsdatum)\n\nThüringen Amtsgericht Jena HRB 514191\nLöschungsankündigung\n\nEB Kunst GmbH\nGesellschaft mit beschränkter Haftung\nAltenburg\n\nDas Registergericht beabsichtigt, die im Handelsregister eingetragene Gesellschaft wegen Vermögenslosigkeit nach § 394 FamFG von Amts wegen zu löschen. Die Frist zur Erhebung eines Widerspruchs gegen die beabsichtigte Löschung wird auf 6 Wochen festgesetzt."
    },
    {
      "date": "2026-02-12",
      "id": "145044",
      "original_text": "Löschungsankündigung\nThüringen Amtsgericht Jena HRB 514036\njammernhilftnicht UG (haftungsbeschränkt) – Meiningen",
      "type": "Löschungsankündigung",
      "state": "Thüringen",
      "amtsgericht": "Amtsgericht Jena",
      "registernummer": "HRB 514036",
      "registerart": "HRB",
      "company_name": "jammernhilftnicht UG (haftungsbeschränkt)",
      "company_seat": "Meiningen",
      "details": "12.02.2026 (Bekanntmachungsdatum)\n\nThüringen Amtsgericht Jena HRB 514036\nLöschungsankündigung\n\njammernhilftnicht UG (haftungsbeschränkt)\nGesellschaft mit beschränkter Haftung\nMeiningen\n\nDas Registergericht beabsichtigt, die im Handelsregister eingetragene Gesellschaft wegen Vermögenslosigkeit nach § 394 FamFG von Amts wegen zu löschen. Die Frist zur Erhebung eines Widerspruchs gegen die beabsichtigte Löschung wird auf 6 Wochen festgesetzt."
    },
    {
      "date": "2026-02-12",
      "id": "145045",
      "original_text": "Löschungsankündigung\nHessen Amtsgericht Hanau HRB 97182\nVL Projektgesellschaft mbH – Hanau",
      "type": "Löschungsankündigung",
      "state": "Hessen",
      "amtsgericht": "Amtsgericht Hanau",
      "registernummer": "HRB 97182",
      "registerart": "HRB",
      "company_name": "VL Projektgesellschaft mbH",
      "company_seat": "Hanau",
      "details": "12.02.2026 (Bekanntmachungsdatum)\n\nHessen Amtsgericht Hanau HRB 97182\nLöschungsankündigung\n\nVL Projektgesellschaft mbH\nGesellschaft mit beschränkter Haftung\nHanau\n\nDas Registergericht beabsichtigt die im Handelsregister eingetragene Gesellschaft von Amts wegen nach § 394 FamFG zu löschen. Die Frist zur Erhebung eines Widerspruchs gegen die beabsichtigte Löschung wird auf 3 Monate festgesetzt."
    },
    {
      "date": "2026-02-12",
      "id": "145046",
      "original_text": "Einreichung neuer Dokumente\nHessen Amtsgericht Frankfurt am Main HRB 6670\nFrankfurter Aufbau-Aktiengesellschaft – Frankfurt am Main",
      "type": "Einreichung neuer Dokumente",
      "state": "Hessen",
      "amtsgericht": "Amtsgericht Frankfurt am Main",
      "registernummer": "HRB 6670",
      "registerart": "HRB",
      "company_name": "Frankfurter Aufbau-Aktiengesellschaft",
      "company_seat": "Frankfurt am Main",
      "details": "12.02.2026 (Bekanntmachungsdatum)\n\nHessen Amtsgericht Frankfurt am Main HRB 6670\nEinreichung neuer Dokumente\n\nFrankfurter Aufbau-Aktiengesellschaft\nAktiengesellschaft\nFrankfurt am Main\n\nDurch eine Änderung in den Personen der Aufsichtsratsmitglieder ist eine Liste der Mitglieder des Aufsichtsrates zum Handelsregister eingereicht worden."
    },
    {
      "date": "2026-02-12",
      "id": "145047",
      "original_text": "Registerbekanntmachung nach dem Umwandlungsgesetz\nHessen Amtsgericht Hanau VR 31139\nSimplicissimus e.V. – Gelnhausen",
      "type": "Registerbekanntmachung nach dem Umwandlungsgesetz",
      "state": "Hessen",
      "amtsgericht": "Amtsgericht Hanau",
      "registernummer": "VR 31139",
      "registerart": "VR",
      "company_name": "Simplicissimus e.V.",
      "company_seat": "Gelnhausen",
      "details": "12.02.2026 (Bekanntmachungsdatum)\n\nHessen Amtsgericht Hanau VR 31139\nRegisterbekanntmachung nach dem Umwandlungsgesetz 12.02.2026 (Eintragungsdatum)\n\nSimplicissimus e.V.\neingetragener Verein\nGelnhausen\n\nDen Gläubigern der an der Verschmelzung beteiligten Rechtsträger ist, wenn sie binnen sechs Monaten nach dem Tag, an dem die Eintragung der Verschmelzung in das Register des Sitzes desjenigen Rechtsträgers, dessen Gläubiger sie sind, nach § 19 Absatz 3 UmwG bekannt gemacht worden ist, ihren Anspruch nach Grund und Höhe schriftlich anmelden, Sicherheit zu leisten, soweit sie nicht Befriedigung verlangen können. Dieses Recht steht den Gläubigern jedoch nur zu, wenn sie glaubhaft machen, dass durch die Verschmelzung die Erfüllung ihrer Forderung gefährdet wird."
    },
    {
      "date": "2026-02-12",
      "id": "145048",
      "original_text": "Einreichung neuer Dokumente\nHessen Amtsgericht Offenbach am Main HRB 56774\nAxon Public Safety Germany SE – Dietzenbach",
      "type": "Einreichung neuer Dokumente",
      "state": "Hessen",
      "amtsgericht": "Amtsgericht Offenbach am Main",
      "registernummer": "HRB 56774",
      "registerart": "HRB",
      "company_name": "Axon Public Safety Germany SE",
      "company_seat": "Dietzenbach",
      "details": "12.02.2026 (Bekanntmachungsdatum)\n\nHessen Amtsgericht Offenbach am Main HRB 56774\nEinreichung neuer Dokumente\n\nAxon Public Safety Germany SE\nEuropäische Aktiengesellschaft (SE)\nDietzenbach\n\nDurch eine Änderung in den Personen der Verwaltungsratsmitglieder ist eine Liste der Mitglieder desVerwaltungsrates zum Handelsregister eingereicht worden."
    },
    {
      "date": "2026-02-12",
      "id": "145049",
      "original_text": "Registerbekanntmachung nach dem Umwandlungsgesetz\nHessen Amtsgericht Hanau VR 32739\nSimplicissimus- Ehemalige & Freunde des GGG e.V. – Gelnhausen",
      "type": "Registerbekanntmachung nach dem Umwandlungsgesetz",
      "state": "Hessen",
      "amtsgericht": "Amtsgericht Hanau",
      "registernummer": "VR 32739",
      "registerart": "VR",
      "company_name": "Simplicissimus- Ehemalige & Freunde des GGG e.V.",
      "company_seat": "Gelnhausen",
      "details": "12.02.2026 (Bekanntmachungsdatum)\n\nHessen Amtsgericht Hanau VR 32739\nRegisterbekanntmachung nach dem Umwandlungsgesetz 12.02.2026 (Eintragungsdatum)\n\nSimplicissimus- Ehemalige & Freunde des GGG e.V.\neingetragener Verein\nGelnhausen\n\nDen Gläubigern der an der Verschmelzung beteiligten Rechtsträger ist, wenn sie binnen sechs Monaten nach dem Tag, an dem die Eintragung der Verschmelzung in das Register des Sitzes desjenigen Rechtsträgers, dessen Gläubiger sie sind, nach § 19 Absatz 3 UmwG bekannt gemacht worden ist, ihren Anspruch nach Grund und Höhe schriftlich anmelden, Sicherheit zu leisten, soweit sie nicht Befriedigung verlangen können. Dieses Recht steht den Gläubigern jedoch nur zu, wenn sie glaubhaft machen, dass durch die Verschmelzung die Erfüllung ihrer Forderung gefährdet wird."
    },
    {
      "date": "2026-02-12",
      "id": "145050",
      "original_text": "Registerbekanntmachung nach dem Umwandlungsgesetz\nHessen Amtsgericht Frankfurt am Main HRA 54478\nManuel Kopp GmbH & Co. KG – Frankfurt am Main",
      "type": "Registerbekanntmachung nach dem Umwandlungsgesetz",
      "state": "Hessen",
      "amtsgericht": "Amtsgericht Frankfurt am Main",
      "registernummer": "HRA 54478",
      "registerart": "HRA",
      "company_name": "Manuel Kopp GmbH & Co. KG",
      "company_seat": "Frankfurt am Main",
      "details": "12.02.2026 (Bekanntmachungsdatum)\n\nHessen Amtsgericht Frankfurt am Main HRA 54478\nRegisterbekanntmachung nach dem Umwandlungsgesetz 12.02.2026 (Eintragungsdatum)\n\nManuel Kopp GmbH & Co. KG\nKommanditgesellschaft\nFrankfurt am Main\n\nDen Gläubigern der an der Verschmelzung beteiligten Rechtsträger ist, wenn sie binnen sechs Monaten nach dem Tag, an dem die Eintragung der Verschmelzung in das Register des Sitzes desjenigen Rechtsträgers, dessen Gläubiger sie sind, nach § 19 Absatz 3 UmwG bekannt gemacht worden ist, ihren Anspruch nach Grund und Höhe schriftlich anmelden, Sicherheit zu leisten, soweit sie nicht Befriedigung verlangen können. Dieses Recht steht den Gläubigern jedoch nur zu, wenn sie glaubhaft machen, dass durch die Verschmelzung die Erfüllung ihrer Forderung gefährdet wird."
    },
    {
      "date": "2026-02-12",
      "id": "145051",
      "original_text": "Registerbekanntmachung nach dem Umwandlungsgesetz\nHessen Amtsgericht Bad Homburg v.d.H. HRB 16177\nStrateco GmbH – Bad Homburg v. d. Höhe",
      "type": "Registerbekanntmachung nach dem Umwandlungsgesetz",
      "state": "Hessen",
      "amtsgericht": "Amtsgericht Bad Homburg v.d.H.",
      "registernummer": "HRB 16177",
      "registerart": "HRB",
      "company_name": "Strateco GmbH",
      "company_seat": "Bad Homburg v. d. Höhe",
      "details": "12.02.2026 (Bekanntmachungsdatum)\n\nHessen Amtsgericht Bad Homburg v.d.H. HRB 16177\nRegisterbekanntmachung nach dem Umwandlungsgesetz 12.02.2026 (Eintragungsdatum)\n\nStrateco GmbH\nGesellschaft mit beschränkter Haftung\nBad Homburg v. d. Höhe\n\nDen Gläubigern der an der Verschmelzung beteiligten Rechtsträger ist, wenn sie binnen sechs Monaten nach dem Tag, an dem die Eintragung der Verschmelzung in das Register des Sitzes desjenigen Rechtsträgers, dessen Gläubiger sie sind, nach § 19 Absatz 3 UmwG bekannt gemacht worden ist, ihren Anspruch nach Grund und Höhe schriftlich anmelden, Sicherheit zu leisten, soweit sie nicht Befriedigung verlangen können. Dieses Recht steht den Gläubigern jedoch nur zu, wenn sie glaubhaft machen, dass durch die Verschmelzung die Erfüllung ihrer Forderung gefährdet wird."
    },
    {
      "date": "2026-02-12",
      "id": "145052",
      "original_text": "Registerbekanntmachung nach dem Umwandlungsgesetz\nHessen Amtsgericht Hanau VR 3613\nGGG - Ehemalige & Freunde e.V. – Gelnhausen",
      "type": "Registerbekanntmachung nach dem Umwandlungsgesetz",
      "state": "Hessen",
      "amtsgericht": "Amtsgericht Hanau",
      "registernummer": "VR 3613",
      "registerart": "VR",
      "company_name": "GGG - Ehemalige & Freunde e.V.",
      "company_seat": "Gelnhausen",
      "details": "12.02.2026 (Bekanntmachungsdatum)\n\nHessen Amtsgericht Hanau VR 3613\nRegisterbekanntmachung nach dem Umwandlungsgesetz 12.02.2026 (Eintragungsdatum)\n\nGGG - Ehemalige & Freunde e.V.\neingetragener Verein\nGelnhausen\n\nDen Gläubigern der an der Verschmelzung beteiligten Rechtsträger ist, wenn sie binnen sechs Monaten nach dem Tag, an dem die Eintragung der Verschmelzung in das Register des Sitzes desjenigen Rechtsträgers, dessen Gläubiger sie sind, nach § 19 Absatz 3 UmwG bekannt gemacht worden ist, ihren Anspruch nach Grund und Höhe schriftlich anmelden, Sicherheit zu leisten, soweit sie nicht Befriedigung verlangen können. Dieses Recht steht den Gläubigern jedoch nur zu, wenn sie glaubhaft machen, dass durch die Verschmelzung die Erfüllung ihrer Forderung gefährdet wird."
    },
    {
      "date": "2026-02-12",
      "id": "145053",
      "original_text": "Registerbekanntmachung nach dem Umwandlungsgesetz\nHessen Amtsgericht Frankfurt am Main HRB 140990\nManuel Kopp Verwaltungs GmbH – Frankfurt am Main",
      "type": "Registerbekanntmachung nach dem Umwandlungsgesetz",
      "state": "Hessen",
      "amtsgericht": "Amtsgericht Frankfurt am Main",
      "registernummer": "HRB 140990",
      "registerart": "HRB",
      "company_name": "Manuel Kopp Verwaltungs GmbH",
      "company_seat": "Frankfurt am Main",
      "details": "12.02.2026 (Bekanntmachungsdatum)\n\nHessen Amtsgericht Frankfurt am Main HRB 140990\nRegisterbekanntmachung nach dem Umwandlungsgesetz 12.02.2026 (Eintragungsdatum)\n\nManuel Kopp Verwaltungs GmbH\nGesellschaft mit beschränkter Haftung\nFrankfurt am Main\n\nDen Gläubigern der an der Verschmelzung beteiligten Rechtsträger ist, wenn sie binnen sechs Monaten nach dem Tag, an dem die Eintragung der Verschmelzung in das Register des Sitzes desjenigen Rechtsträgers, dessen Gläubiger sie sind, nach § 19 Absatz 3 UmwG bekannt gemacht worden ist, ihren Anspruch nach Grund und Höhe schriftlich anmelden, Sicherheit zu leisten, soweit sie nicht Befriedigung verlangen können. Dieses Recht steht den Gläubigern jedoch nur zu, wenn sie glaubhaft machen, dass durch die Verschmelzung die Erfüllung ihrer Forderung gefährdet wird."
    },
    {
      "date": "2026-02-12",
      "id": "145054",
      "original_text": "Löschungsankündigung\nHessen Amtsgericht Frankfurt am Main HRB 96772\nOPM Beteiligungsgesellschaft mbH – Frankfurt am Main",
      "type": "Löschungsankündigung",
      "state": "Hessen",
      "amtsgericht": "Amtsgericht Frankfurt am Main",
      "registernummer": "HRB 96772",
      "registerart": "HRB",
      "company_name": "OPM Beteiligungsgesellschaft mbH",
      "company_seat": "Frankfurt am Main",
      "details": "12.02.2026 (Bekanntmachungsdatum)\n\nHessen Amtsgericht Frankfurt am Main HRB 96772\nLöschungsankündigung\n\nOPM Beteiligungsgesellschaft mbH\nGesellschaft mit beschränkter Haftung\nFrankfurt am Main\n\nDas Registergericht beabsichtigt die im Handelsregister eingetragene Gesellschaft von Amts wegen nach § 394 FamFG zu löschen. Die Frist zur Erhebung eines Widerspruchs gegen die beabsichtigte Löschung wird auf 1 Monat festgesetzt."
    },
    {
      "date": "2026-02-12",
      "id": "145055",
      "original_text": "Löschungsankündigung\nHessen Amtsgericht Darmstadt HRB 55259\nHOROZ-BAU Bauunternehmung HOCH + TIEF GmbH – Büttelborn",
      "type": "Löschungsankündigung",
      "state": "Hessen",
      "amtsgericht": "Amtsgericht Darmstadt",
      "registernummer": "HRB 55259",
      "registerart": "HRB",
      "company_name": "HOROZ-BAU Bauunternehmung HOCH + TIEF GmbH",
      "company_seat": "Büttelborn",
      "details": "12.02.2026 (Bekanntmachungsdatum)\n\nHessen Amtsgericht Darmstadt HRB 55259\nLöschungsankündigung\n\nHOROZ-BAU Bauunternehmung HOCH + TIEF GmbH\nGesellschaft mit beschränkter Haftung\nBüttelborn\n\nDas Registergericht beabsichtigt die im Handelsregister eingetragene Gesellschaft von Amts wegen nach § 394 FamFG zu löschen. Die Frist zur Erhebung eines Widerspruchs gegen die beabsichtigte Löschung wird auf 3 Monate festgesetzt."
    },
    {
      "date": "2026-02-12",
      "id": "145056",
      "original_text": "Registerbekanntmachung nach dem Umwandlungsgesetz\nHessen Amtsgericht Frankfurt am Main HRB 134985\nFrankfurt Wohnland GmbH – Frankfurt am Main",
      "type": "Registerbekanntmachung nach dem Umwandlungsgesetz",
      "state": "Hessen",
      "amtsgericht": "Amtsgericht Frankfurt am Main",
      "registernummer": "HRB 134985",
      "registerart": "HRB",
      "company_name": "Frankfurt Wohnland GmbH",
      "company_seat": "Frankfurt am Main",
      "details": "12.02.2026 (Bekanntmachungsdatum)\n\nHessen Amtsgericht Frankfurt am Main HRB 134985\nRegisterbekanntmachung nach dem Umwandlungsgesetz 12.02.2026 (Eintragungsdatum)\n\nFrankfurt Wohnland GmbH\nGesellschaft mit beschränkter Haftung\nFrankfurt am Main\n\nDer Entwurf des Formwechselplans mit den Angaben über den grenzüberschreitenden\nFormwechsel der Frankfurt Wohnland GmbH mit Sitz in Frankfurt am Main,\nDeutschland (Amtsgerichts Frankfurt am Main, HRB 134985), zur Platinum PropCo S.à r.l. mit satzungsmäßigem Sitz in 2 Rue Henri M. Schnadt, L-2530 Luxemburg, Großherzogtum Luxemburg, ist beim Handelsregister der Frankfurt Wohnland GmbH eingereicht worden\n\nDie Anteilsinhaber, die Gläubiger sowie die zuständigen Betriebsräte der an dem grenzüberschreitenden Formwechsel beteiligten Gesellschaft oder, soweit es keinen Betriebsrat gibt, die Arbeitnehmer der an dem grenzüberschreitenden Formwechsel beteiligten Gesellschaft, können der Gesellschaft spätestens fünf Arbeitstage vor dem Tag der Gesellschafterversammlung (am\n23. März 2026) Bemerkungen zum Formwechselplan übermitteln.\n\nVollständige Auskünfte über die Modalitäten der Ausübung der Rechte der Anteilsinhaber und Gläubiger der Frankfurt Wohnland GmbH können unter den folgenden Adressen kostenlos angefordert werden. Dies ist zugleich die Zielanschrift für Bemerkungen zum Formwechselplan: Frankfurt Wohnland GmbH, c/o Lübke Kelber Investment Partners GmbH, Taunusstraße 6, 60329 Frankfurt am Main, Deutschland"
    },
    {
      "date": "2026-02-12",
      "id": "145057",
      "original_text": "Löschungsankündigung\nHessen Amtsgericht Hanau HRB 99319\nNandor Autoreinigung UG (haftungsbeschränkt) – Maintal",
      "type": "Löschungsankündigung",
      "state": "Hessen",
      "amtsgericht": "Amtsgericht Hanau",
      "registernummer": "HRB 99319",
      "registerart": "HRB",
      "company_name": "Nandor Autoreinigung UG (haftungsbeschränkt)",
      "company_seat": "Maintal",
      "details": "12.02.2026 (Bekanntmachungsdatum)\n\nHessen Amtsgericht Hanau HRB 99319\nLöschungsankündigung\n\nNandor Autoreinigung UG (haftungsbeschränkt)\nGesellschaft mit beschränkter Haftung\nMaintal\n\nDas Registergericht beabsichtigt die im Handelsregister eingetragene Gesellschaft von Amts wegen nach § 394 FamFG zu löschen. Die Frist zur Erhebung eines Widerspruchs gegen die beabsichtigte Löschung wird auf 3 Monate festgesetzt."
    },
    {
      "date": "2026-02-12",
      "id": "145058",
      "original_text": "Registerbekanntmachung nach dem Umwandlungsgesetz\nHessen Amtsgericht Bad Homburg v.d.H. HRB 11370\nSTRATECO netcom GmbH – Bad Homburg v. d. Höhe",
      "type": "Registerbekanntmachung nach dem Umwandlungsgesetz",
      "state": "Hessen",
      "amtsgericht": "Amtsgericht Bad Homburg v.d.H.",
      "registernummer": "HRB 11370",
      "registerart": "HRB",
      "company_name": "STRATECO netcom GmbH",
      "company_seat": "Bad Homburg v. d. Höhe",
      "details": "12.02.2026 (Bekanntmachungsdatum)\n\nHessen Amtsgericht Bad Homburg v.d.H. HRB 11370\nRegisterbekanntmachung nach dem Umwandlungsgesetz 12.02.2026 (Eintragungsdatum)\n\nSTRATECO netcom GmbH\nGesellschaft mit beschränkter Haftung\nBad Homburg v. d. Höhe\n\nDen Gläubigern der an der Verschmelzung beteiligten Rechtsträger ist, wenn sie binnen sechs Monaten nach dem Tag, an dem die Eintragung der Verschmelzung in das Register des Sitzes desjenigen Rechtsträgers, dessen Gläubiger sie sind, nach § 19 Absatz 3 UmwG bekannt gemacht worden ist, ihren Anspruch nach Grund und Höhe schriftlich anmelden, Sicherheit zu leisten, soweit sie nicht Befriedigung verlangen können. Dieses Recht steht den Gläubigern jedoch nur zu, wenn sie glaubhaft machen, dass durch die Verschmelzung die Erfüllung ihrer Forderung gefährdet wird."
    },
    {
      "date": "2026-02-12",
      "id": "145059",
      "original_text": "Einreichung neuer Dokumente\nHessen Amtsgericht Frankfurt am Main HRB 109880\nMorgan Stanley Europe SE – Frankfurt am Main",
      "type": "Einreichung neuer Dokumente",
      "state": "Hessen",
      "amtsgericht": "Amtsgericht Frankfurt am Main",
      "registernummer": "HRB 109880",
      "registerart": "HRB",
      "company_name": "Morgan Stanley Europe SE",
      "company_seat": "Frankfurt am Main",
      "details": "12.02.2026 (Bekanntmachungsdatum)\n\nHessen Amtsgericht Frankfurt am Main HRB 109880\nEinreichung neuer Dokumente\n\nMorgan Stanley Europe SE\nEuropäische Aktiengesellschaft (SE)\nFrankfurt am Main\n\nDurch eine Änderung in den Personen der Aufsichtsratsmitglieder ist eine Liste der Mitglieder des Aufsichtsrates zum Handelsregister eingereicht worden."
    },
    {
      "date": "2026-02-12",
      "id": "145060",
      "original_text": "Sonstige Registerbekanntmachung\nHessen Amtsgericht Eschwege HRB 2132\nDeutsches Rotes Kreuz Rettungsdienst Werra-Meißner gGmbH – Witzenhausen",
      "type": "Sonstige Registerbekanntmachung",
      "state": "Hessen",
      "amtsgericht": "Amtsgericht Eschwege",
      "registernummer": "HRB 2132",
      "registerart": "HRB",
      "company_name": "Deutsches Rotes Kreuz Rettungsdienst Werra-Meißner gGmbH",
      "company_seat": "Witzenhausen",
      "details": "12.02.2026 (Bekanntmachungsdatum)\n\nHessen Amtsgericht Eschwege HRB 2132\nSonstige Registerbekanntmachung\n\nDeutsches Rotes Kreuz Rettungsdienst Werra-Meißner gGmbH\nGesellschaft mit beschränkter Haftung\nWitzenhausen\n\nDurch eine Änderung in den Personen der Aufsichtsratsmitglieder ist eine Liste der Mitglieder des Aufsichtsrates zum Handelsregister eingereicht worden."
    },
    {
      "date": "2026-02-12",
      "id": "99",
      "original_text": "Sonderregisterbekanntmachung OHNE Bezug zum elektr. Register\nBrandenburg Amtsgericht Neuruppin\nHRB 1964 NP\nVerkehrsgesellschaft Prignitz mbH",
      "type": "Sonderregisterbekanntmachung OHNE Bezug zum elektr. Register",
      "state": "Brandenburg",
      "amtsgericht": "Amtsgericht Neuruppin",
      "company_name": "Verkehrsgesellschaft Prignitz mbH",
      "sonderegister_referenz": "HRB 1964 NP",
      "details": "12.02.2026 (Bekanntmachungsdatum)\n\nBrandenburg Amtsgericht Neuruppin\nHRB 1964 NP\nSonderregisterbekanntmachung OHNE Bezug zum elektr. Register\n\nVerkehrsgesellschaft Prignitz mbH\n\nAls nicht eingetragen wird bekannt gemacht: Eine Liste der Mitglieder des Aufsichtsrates wurde zum Handelsregister eingereicht."
    }
  ]
}