{
  "date": "2026-02-17",
  "date_of_scrape": "2026-02-18T04:43:15.414Z",
  "tool_version": "0.2.0",
  "number_of_announcements": 141,
  "announcements": [
    {
      "date": "2026-02-17",
      "id": "145228",
      "original_text": "Registerbekanntmachung nach dem Umwandlungsgesetz\nBayern Amtsgericht München HRB 183606\nOcchio Store GmbH – München",
      "type": "Registerbekanntmachung nach dem Umwandlungsgesetz",
      "state": "Bayern",
      "amtsgericht": "Amtsgericht München",
      "registernummer": "HRB 183606",
      "registerart": "HRB",
      "company_name": "Occhio Store GmbH",
      "company_seat": "München",
      "details": "17.02.2026 (Bekanntmachungsdatum)\n\nBayern Amtsgericht München HRB 183606\nRegisterbekanntmachung nach dem Umwandlungsgesetz 15.02.2026 (Eintragungsdatum)\n\nOcchio Store GmbH\nGesellschaft mit beschränkter Haftung\nMünchen\n\nDen Gläubigern der an der Verschmelzung beteiligten Rechtsträger ist, wenn sie binnen sechs Monaten nach dem Tag, an dem die Eintragung der Verschmelzung in das Register des Sitzes desjenigen Rechtsträgers, dessen Gläubiger sie sind, nach § 19 Abs. 3 UmwG als bekannt gemacht gilt, ihren Anspruch nach Grund und Höhe in Textform anmelden, Sicherheit zu leisten, soweit sie nicht Befriedigung verlangen können. Dieses Recht steht den Gläubigern jedoch nur zu, wenn sie glaubhaft machen, dass durch die Verschmelzung die Erfüllung ihrer Forderung gefährdet wird."
    },
    {
      "date": "2026-02-17",
      "id": "145229",
      "original_text": "Löschungsankündigung\nBayern Amtsgericht Weiden i. d. OPf. HRB 3747\nJF Industries GmbH – Weiden",
      "type": "Löschungsankündigung",
      "state": "Bayern",
      "amtsgericht": "Amtsgericht Weiden i. d. OPf.",
      "registernummer": "HRB 3747",
      "registerart": "HRB",
      "company_name": "JF Industries GmbH",
      "company_seat": "Weiden",
      "details": "17.02.2026 (Bekanntmachungsdatum)\n\nBayern Amtsgericht Weiden i. d. OPf. HRB 3747\nLöschungsankündigung 11.02.2026 (Eintragungsdatum)\n\nJF Industries GmbH\nGesellschaft mit beschränkter Haftung\nWeiden\n\nDas Registergericht beabsichtigt, die im Handelsregister eingetragene Gesellschaft wegen Vermögenslosigkeit von Amts wegen nach § 394 FamFG zu löschen. Die Frist zur Erhebung eines Widerspruchs ist auf sechs Wochen festgesetzt."
    },
    {
      "date": "2026-02-17",
      "id": "145230",
      "original_text": "Registerbekanntmachung nach dem Umwandlungsgesetz\nBayern Amtsgericht Regensburg HRB 2978\nHollmann Textil GmbH – Cham",
      "type": "Registerbekanntmachung nach dem Umwandlungsgesetz",
      "state": "Bayern",
      "amtsgericht": "Amtsgericht Regensburg",
      "registernummer": "HRB 2978",
      "registerart": "HRB",
      "company_name": "Hollmann Textil GmbH",
      "company_seat": "Cham",
      "details": "17.02.2026 (Bekanntmachungsdatum)\n\nBayern Amtsgericht Regensburg HRB 2978\nRegisterbekanntmachung nach dem Umwandlungsgesetz 16.02.2026 (Eintragungsdatum)\n\nHollmann Textil GmbH\nGesellschaft mit beschränkter Haftung\nCham\n\nDen Gläubigern der an der Verschmelzung beteiligten Rechtsträger ist, wenn sie binnen sechs Monaten nach dem Tag, an dem die Eintragung der Verschmelzung in das Register des Sitzes desjenigen Rechtsträgers, dessen Gläubiger sie sind, nach § 19 Abs. 3 UmwG als bekannt gemacht gilt, ihren Anspruch nach Grund und Höhe in Textform anmelden, Sicherheit zu leisten, soweit sie nicht Befriedigung verlangen können. Dieses Recht steht den Gläubigern jedoch nur zu, wenn sie glaubhaft machen, dass durch die Verschmelzung die Erfüllung ihrer Forderung gefährdet wird."
    },
    {
      "date": "2026-02-17",
      "id": "145231",
      "original_text": "Löschungsankündigung\nBayern Amtsgericht München HRB 257402\nGoodberg GmbH – München",
      "type": "Löschungsankündigung",
      "state": "Bayern",
      "amtsgericht": "Amtsgericht München",
      "registernummer": "HRB 257402",
      "registerart": "HRB",
      "company_name": "Goodberg GmbH",
      "company_seat": "München",
      "details": "17.02.2026 (Bekanntmachungsdatum)\n\nBayern Amtsgericht München HRB 257402\nLöschungsankündigung 16.02.2026 (Eintragungsdatum)\n\nGoodberg GmbH\nGesellschaft mit beschränkter Haftung\nMünchen\n\nDas Registergericht beabsichtigt, die im Handelsregister eingetragene Gesellschaft wegen Vermögenslosigkeit von Amts wegen nach § 394 FamFG zu löschen. Die Frist zur Erhebung eines Widerspruchs ist auf drei Monate festgesetzt."
    },
    {
      "date": "2026-02-17",
      "id": "145232",
      "original_text": "Sonstige Registerbekanntmachung\nBayern Amtsgericht Nürnberg HRB 19681\nAuto-Fiegl GmbH – Schwabach",
      "type": "Sonstige Registerbekanntmachung",
      "state": "Bayern",
      "amtsgericht": "Amtsgericht Nürnberg",
      "registernummer": "HRB 19681",
      "registerart": "HRB",
      "company_name": "Auto-Fiegl GmbH",
      "company_seat": "Schwabach",
      "details": "17.02.2026 (Bekanntmachungsdatum)\n\nBayern Amtsgericht Nürnberg HRB 19681\nSonstige Registerbekanntmachung 16.02.2026 (Eintragungsdatum)\n\nAuto-Fiegl GmbH\nGesellschaft mit beschränkter Haftung\nSchwabach\n\nDen Gläubigern der Gesellschaft, deren Forderungen begründet worden sind, bevor die Eintragung der Beendigung des Beherrschungs- und Gewinnabführungsvertrages in das Handelsregister nach § 10 des Handelsgesetzbuches als bekanntgemacht gilt, hat der andere Vertragsteil Sicherheit zu leisten, wenn sie sich binnen sechs Monaten nach der Bekanntmachung der Eintragung zu diesem Zweck bei ihm melden."
    },
    {
      "date": "2026-02-17",
      "id": "145233",
      "original_text": "Sonstige Registerbekanntmachung\nBayern Amtsgericht München HRB 297859\nRoland Berger Holding GmbH & Co. KGaA – München",
      "type": "Sonstige Registerbekanntmachung",
      "state": "Bayern",
      "amtsgericht": "Amtsgericht München",
      "registernummer": "HRB 297859",
      "registerart": "HRB",
      "company_name": "Roland Berger Holding GmbH & Co. KGaA",
      "company_seat": "München",
      "details": "17.02.2026 (Bekanntmachungsdatum)\n\nBayern Amtsgericht München HRB 297859\nSonstige Registerbekanntmachung\n\nRoland Berger Holding GmbH & Co. KGaA\nKommanditgesellschaft auf Aktien\nMünchen\n\nDem Amtsgericht München -Registergericht- isteine Liste der Mitglieder des Aufsichtsrats eingereicht worden, §§ 278 Abs. 3, 106 AktG."
    },
    {
      "date": "2026-02-17",
      "id": "145234",
      "original_text": "Registerbekanntmachung nach dem Umwandlungsgesetz\nBayern Amtsgericht München HRB 268882\nGenius M11 GmbH – Haar",
      "type": "Registerbekanntmachung nach dem Umwandlungsgesetz",
      "state": "Bayern",
      "amtsgericht": "Amtsgericht München",
      "registernummer": "HRB 268882",
      "registerart": "HRB",
      "company_name": "Genius M11 GmbH",
      "company_seat": "Haar",
      "details": "17.02.2026 (Bekanntmachungsdatum)\n\nBayern Amtsgericht München HRB 268882\nRegisterbekanntmachung nach dem Umwandlungsgesetz 16.02.2026 (Eintragungsdatum)\n\nGenius M11 GmbH\nGesellschaft mit beschränkter Haftung\nHaar\n\nDen Gläubigern der an der Verschmelzung beteiligten Rechtsträger ist, wenn sie binnen sechs Monaten nach dem Tag, an dem die Eintragung der Verschmelzung in das Register des Sitzes desjenigen Rechtsträgers, dessen Gläubiger sie sind, nach § 19 Abs. 3 UmwG als bekannt gemacht gilt, ihren Anspruch nach Grund und Höhe in Textform anmelden, Sicherheit zu leisten, soweit sie nicht Befriedigung verlangen können. Dieses Recht steht den Gläubigern jedoch nur zu, wenn sie glaubhaft machen, dass durch die Verschmelzung die Erfüllung ihrer Forderung gefährdet wird."
    },
    {
      "date": "2026-02-17",
      "id": "145235",
      "original_text": "Löschungsankündigung\nBayern Amtsgericht München HRB 251480\nListrik UG (haftungsbeschränkt) – Dachau",
      "type": "Löschungsankündigung",
      "state": "Bayern",
      "amtsgericht": "Amtsgericht München",
      "registernummer": "HRB 251480",
      "registerart": "HRB",
      "company_name": "Listrik UG (haftungsbeschränkt)",
      "company_seat": "Dachau",
      "details": "17.02.2026 (Bekanntmachungsdatum)\n\nBayern Amtsgericht München HRB 251480\nLöschungsankündigung\n\nListrik UG (haftungsbeschränkt)\nGesellschaft mit beschränkter Haftung\nDachau\n\nDas Registergericht beabsichtigt, die im Handelsregister eingetragene Gesellschaft wegen Vermögenslosigkeit von Amts wegen nach § 394 FamFG zu löschen. Die Frist zur Erhebung eines Widerspruchs ist auf drei Monate festgesetzt."
    },
    {
      "date": "2026-02-17",
      "id": "145236",
      "original_text": "Löschungsankündigung\nBayern Amtsgericht Nürnberg HRB 41329\nASTE Services GmbH – Nürnberg",
      "type": "Löschungsankündigung",
      "state": "Bayern",
      "amtsgericht": "Amtsgericht Nürnberg",
      "registernummer": "HRB 41329",
      "registerart": "HRB",
      "company_name": "ASTE Services GmbH",
      "company_seat": "Nürnberg",
      "details": "17.02.2026 (Bekanntmachungsdatum)\n\nBayern Amtsgericht Nürnberg HRB 41329\nLöschungsankündigung\n\nASTE Services GmbH\nGesellschaft mit beschränkter Haftung\nNürnberg\n\nDas Registergericht beabsichtigt, die im Handelsregister eingetragene Gesellschaft wegen Vermögenslosigkeit von Amts wegen nach § 394 FamFG zu löschen. Die Frist zur Erhebung eines Widerspruchs ist auf einen Monat festgesetzt."
    },
    {
      "date": "2026-02-17",
      "id": "145237",
      "original_text": "Registerbekanntmachung nach dem Umwandlungsgesetz\nBayern Amtsgericht Traunstein HRA 9757\nNetmicro e.K. – Teisendorf",
      "type": "Registerbekanntmachung nach dem Umwandlungsgesetz",
      "state": "Bayern",
      "amtsgericht": "Amtsgericht Traunstein",
      "registernummer": "HRA 9757",
      "registerart": "HRA",
      "company_name": "Netmicro e.K.",
      "company_seat": "Teisendorf",
      "details": "17.02.2026 (Bekanntmachungsdatum)\n\nBayern Amtsgericht Traunstein HRA 9757\nRegisterbekanntmachung nach dem Umwandlungsgesetz 16.02.2026 (Eintragungsdatum)\n\nNetmicro e.K.\nEinzelkaufmann / Einzelkauffrau\nTeisendorf\n\nDen Gläubigern der an der Ausgliederung beteiligten Rechtsträger ist, wenn sie binnen sechs Monaten nach dem Tag, an dem die Eintragung der Ausgliederung in das Register des Sitzes desjenigen Rechtsträgers, dessen Gläubiger sie sind, nach §§ 125, 19 Abs. 3 UmwG als bekannt gemacht gilt, ihren Anspruch nach Grund und Höhe in Textform anmelden, Sicherheit zu leisten, soweit sie nicht Befriedigung verlangen können. Dieses Recht steht den Gläubigern jedoch nur zu, wenn sie glaubhaft machen, dass durch die Ausgliederung die Erfüllung ihrer Forderung gefährdet wird."
    },
    {
      "date": "2026-02-17",
      "id": "145238",
      "original_text": "Löschungsankündigung\nBayern Amtsgericht München HRB 284462\nHOLA B&T UG (haftungsbeschränkt) – München",
      "type": "Löschungsankündigung",
      "state": "Bayern",
      "amtsgericht": "Amtsgericht München",
      "registernummer": "HRB 284462",
      "registerart": "HRB",
      "company_name": "HOLA B&T UG (haftungsbeschränkt)",
      "company_seat": "München",
      "details": "17.02.2026 (Bekanntmachungsdatum)\n\nBayern Amtsgericht München HRB 284462\nLöschungsankündigung\n\nHOLA B&T UG (haftungsbeschränkt)\nGesellschaft mit beschränkter Haftung\nMünchen\n\nDas Registergericht beabsichtigt, die im Handelsregister eingetragene Gesellschaft wegen Vermögenslosigkeit von Amts wegen nach § 394 FamFG zu löschen. Die Frist zur Erhebung eines Widerspruchs ist auf drei Monate festgesetzt."
    },
    {
      "date": "2026-02-17",
      "id": "145239",
      "original_text": "Registerbekanntmachung nach dem Umwandlungsgesetz\nBayern Amtsgericht München HRB 271987\nGenius M13 GmbH – Haar",
      "type": "Registerbekanntmachung nach dem Umwandlungsgesetz",
      "state": "Bayern",
      "amtsgericht": "Amtsgericht München",
      "registernummer": "HRB 271987",
      "registerart": "HRB",
      "company_name": "Genius M13 GmbH",
      "company_seat": "Haar",
      "details": "17.02.2026 (Bekanntmachungsdatum)\n\nBayern Amtsgericht München HRB 271987\nRegisterbekanntmachung nach dem Umwandlungsgesetz 16.02.2026 (Eintragungsdatum)\n\nGenius M13 GmbH\nGesellschaft mit beschränkter Haftung\nHaar\n\nDen Gläubigern der an der Verschmelzung beteiligten Rechtsträger ist, wenn sie binnen sechs Monaten nach dem Tag, an dem die Eintragung der Verschmelzung in das Register des Sitzes desjenigen Rechtsträgers, dessen Gläubiger sie sind, nach § 19 Abs. 3 UmwG als bekannt gemacht gilt, ihren Anspruch nach Grund und Höhe in Textform anmelden, Sicherheit zu leisten, soweit sie nicht Befriedigung verlangen können. Dieses Recht steht den Gläubigern jedoch nur zu, wenn sie glaubhaft machen, dass durch die Verschmelzung die Erfüllung ihrer Forderung gefährdet wird."
    },
    {
      "date": "2026-02-17",
      "id": "145240",
      "original_text": "Löschungsankündigung\nBayern Amtsgericht Nürnberg HRB 39089\nBlack Star motors GmbH – Nürnberg",
      "type": "Löschungsankündigung",
      "state": "Bayern",
      "amtsgericht": "Amtsgericht Nürnberg",
      "registernummer": "HRB 39089",
      "registerart": "HRB",
      "company_name": "Black Star motors GmbH",
      "company_seat": "Nürnberg",
      "details": "17.02.2026 (Bekanntmachungsdatum)\n\nBayern Amtsgericht Nürnberg HRB 39089\nLöschungsankündigung\n\nBlack Star motors GmbH\nGesellschaft mit beschränkter Haftung\nNürnberg\n\nDas Registergericht beabsichtigt, die im Handelsregister eingetragene Gesellschaft wegen Vermögenslosigkeit von Amts wegen nach § 394 FamFG zu löschen. Die Frist zur Erhebung eines Widerspruchs ist auf einen Monat festgesetzt."
    },
    {
      "date": "2026-02-17",
      "id": "145241",
      "original_text": "Registerbekanntmachung nach dem Umwandlungsgesetz\nBayern Amtsgericht Regensburg HRB 7744\nHotex Beteiligungs-GmbH – Cham",
      "type": "Registerbekanntmachung nach dem Umwandlungsgesetz",
      "state": "Bayern",
      "amtsgericht": "Amtsgericht Regensburg",
      "registernummer": "HRB 7744",
      "registerart": "HRB",
      "company_name": "Hotex Beteiligungs-GmbH",
      "company_seat": "Cham",
      "details": "17.02.2026 (Bekanntmachungsdatum)\n\nBayern Amtsgericht Regensburg HRB 7744\nRegisterbekanntmachung nach dem Umwandlungsgesetz 16.02.2026 (Eintragungsdatum)\n\nHotex Beteiligungs-GmbH\nGesellschaft mit beschränkter Haftung\nCham\n\nDen Gläubigern der an der Verschmelzung beteiligten Rechtsträger ist, wenn sie binnen sechs Monaten nach dem Tag, an dem die Eintragung der Verschmelzung in das Register des Sitzes desjenigen Rechtsträgers, dessen Gläubiger sie sind, nach § 19 Abs. 3 UmwG als bekannt gemacht gilt, ihren Anspruch nach Grund und Höhe in Textform anmelden, Sicherheit zu leisten, soweit sie nicht Befriedigung verlangen können. Dieses Recht steht den Gläubigern jedoch nur zu, wenn sie glaubhaft machen, dass durch die Verschmelzung die Erfüllung ihrer Forderung gefährdet wird."
    },
    {
      "date": "2026-02-17",
      "id": "145242",
      "original_text": "Registerbekanntmachung nach dem Umwandlungsgesetz\nBayern Amtsgericht Traunstein HRB 29654\nOfficium Insula GmbH – Bischofswiesen",
      "type": "Registerbekanntmachung nach dem Umwandlungsgesetz",
      "state": "Bayern",
      "amtsgericht": "Amtsgericht Traunstein",
      "registernummer": "HRB 29654",
      "registerart": "HRB",
      "company_name": "Officium Insula GmbH",
      "company_seat": "Bischofswiesen",
      "details": "17.02.2026 (Bekanntmachungsdatum)\n\nBayern Amtsgericht Traunstein HRB 29654\nRegisterbekanntmachung nach dem Umwandlungsgesetz 16.02.2026 (Eintragungsdatum)\n\nOfficium Insula GmbH\nGesellschaft mit beschränkter Haftung\nBischofswiesen\n\nDen Gläubigern der an der Verschmelzung beteiligten Rechtsträger ist, wenn sie binnen sechs Monaten nach dem Tag, an dem die Eintragung der Verschmelzung in das Register des Sitzes desjenigen Rechtsträgers, dessen Gläubiger sie sind, nach § 19 Abs. 3 UmwG als bekannt gemacht gilt, ihren Anspruch nach Grund und Höhe in Textform anmelden, Sicherheit zu leisten, soweit sie nicht Befriedigung verlangen können. Dieses Recht steht den Gläubigern jedoch nur zu, wenn sie glaubhaft machen, dass durch die Verschmelzung die Erfüllung ihrer Forderung gefährdet wird."
    },
    {
      "date": "2026-02-17",
      "id": "145243",
      "original_text": "Registerbekanntmachung nach dem Umwandlungsgesetz\nBayern Amtsgericht Landshut HRB 12483\nSchleich & Haberl Wohnimmobilien Dortmund-Mengede GmbH – Pfarrkirchen",
      "type": "Registerbekanntmachung nach dem Umwandlungsgesetz",
      "state": "Bayern",
      "amtsgericht": "Amtsgericht Landshut",
      "registernummer": "HRB 12483",
      "registerart": "HRB",
      "company_name": "Schleich & Haberl Wohnimmobilien Dortmund-Mengede GmbH",
      "company_seat": "Pfarrkirchen",
      "details": "17.02.2026 (Bekanntmachungsdatum)\n\nBayern Amtsgericht Landshut HRB 12483\nRegisterbekanntmachung nach dem Umwandlungsgesetz 16.02.2026 (Eintragungsdatum)\n\nSchleich & Haberl Wohnimmobilien Dortmund-Mengede GmbH\nGesellschaft mit beschränkter Haftung\nPfarrkirchen\n\nDen Gläubigern des formwechselnden Rechtsträgers ist, wenn sie binnen sechs Monaten nach dem Tag, an dem die Eintragung des Formwechsels nach § 201 UmwG als bekannt gemacht gilt, ihren Anspruch nach Grund und Höhe in Textform anmelden, Sicherheit zu leisten, soweit sie nicht Befriedigung verlangen können. Dieses Recht steht den Gläubigern jedoch nur zu, wenn sie glaubhaft machen, dass durch den Formwechsel die Erfüllung ihrer Forderung gefährdet wird."
    },
    {
      "date": "2026-02-17",
      "id": "145244",
      "original_text": "Einreichung neuer Dokumente\nBayern Amtsgericht Augsburg HRB 759\nOettinger Brauerei GmbH – Oettingen",
      "type": "Einreichung neuer Dokumente",
      "state": "Bayern",
      "amtsgericht": "Amtsgericht Augsburg",
      "registernummer": "HRB 759",
      "registerart": "HRB",
      "company_name": "Oettinger Brauerei GmbH",
      "company_seat": "Oettingen",
      "details": "17.02.2026 (Bekanntmachungsdatum)\n\nBayern Amtsgericht Augsburg HRB 759\nEinreichung neuer Dokumente\n\nOettinger Brauerei GmbH\nGesellschaft mit beschränkter Haftung\nOettingen\n\nDem Amtsgericht Augsburg -Registergericht- ist eine Liste der Mitglieder des Beirates eingereicht worden, § 52 Abs. 3 S. 2 GmbHG."
    },
    {
      "date": "2026-02-17",
      "id": "145245",
      "original_text": "Registerbekanntmachung nach dem Umwandlungsgesetz\nBayern Amtsgericht Traunstein HRB 16183\nJ. Scholz BHS GmbH – Kolbermoor",
      "type": "Registerbekanntmachung nach dem Umwandlungsgesetz",
      "state": "Bayern",
      "amtsgericht": "Amtsgericht Traunstein",
      "registernummer": "HRB 16183",
      "registerart": "HRB",
      "company_name": "J. Scholz BHS GmbH",
      "company_seat": "Kolbermoor",
      "details": "17.02.2026 (Bekanntmachungsdatum)\n\nBayern Amtsgericht Traunstein HRB 16183\nRegisterbekanntmachung nach dem Umwandlungsgesetz 14.02.2026 (Eintragungsdatum)\n\nJ. Scholz BHS GmbH\nGesellschaft mit beschränkter Haftung\nKolbermoor\n\nDen Gläubigern der an der Verschmelzung beteiligten Rechtsträger ist, wenn sie binnen sechs Monaten nach dem Tag, an dem die Eintragung der Verschmelzung in das Register des Sitzes desjenigen Rechtsträgers, dessen Gläubiger sie sind, nach § 19 Abs. 3 UmwG als bekannt gemacht gilt, ihren Anspruch nach Grund und Höhe in Textform anmelden, Sicherheit zu leisten, soweit sie nicht Befriedigung verlangen können. Dieses Recht steht den Gläubigern jedoch nur zu, wenn sie glaubhaft machen, dass durch die Verschmelzung die Erfüllung ihrer Forderung gefährdet wird."
    },
    {
      "date": "2026-02-17",
      "id": "145246",
      "original_text": "Einreichung neuer Dokumente\nBayern Amtsgericht München HRB 62397\nRohde & Schwarz Vertriebs-GmbH – München",
      "type": "Einreichung neuer Dokumente",
      "state": "Bayern",
      "amtsgericht": "Amtsgericht München",
      "registernummer": "HRB 62397",
      "registerart": "HRB",
      "company_name": "Rohde & Schwarz Vertriebs-GmbH",
      "company_seat": "München",
      "details": "17.02.2026 (Bekanntmachungsdatum)\n\nBayern Amtsgericht München HRB 62397\nEinreichung neuer Dokumente\n\nRohde & Schwarz Vertriebs-GmbH\nGesellschaft mit beschränkter Haftung\nMünchen\n\nDem Amtsgericht München -Registergericht- ist eine Liste der Mitglieder des Aufsichtsrats eingereicht worden, § 52 Abs. 3 S. 2 GmbHG."
    },
    {
      "date": "2026-02-17",
      "id": "145247",
      "original_text": "Registerbekanntmachung nach dem Umwandlungsgesetz\nBayern Amtsgericht Fürth HRB 11092\nStadeln Genehmigungshaltergesellschaft mbH – Fürth",
      "type": "Registerbekanntmachung nach dem Umwandlungsgesetz",
      "state": "Bayern",
      "amtsgericht": "Amtsgericht Fürth",
      "registernummer": "HRB 11092",
      "registerart": "HRB",
      "company_name": "Stadeln Genehmigungshaltergesellschaft mbH",
      "company_seat": "Fürth",
      "details": "17.02.2026 (Bekanntmachungsdatum)\n\nBayern Amtsgericht Fürth HRB 11092\nRegisterbekanntmachung nach dem Umwandlungsgesetz 16.02.2026 (Eintragungsdatum)\n\nStadeln Genehmigungshaltergesellschaft mbH\nGesellschaft mit beschränkter Haftung\nFürth\n\nDen Gläubigern der an der Verschmelzung beteiligten Rechtsträger ist, wenn sie binnen sechs Monaten nach dem Tag, an dem die Eintragung der Verschmelzung in das Register des Sitzes desjenigen Rechtsträgers, dessen Gläubiger sie sind, nach § 19 Abs. 3 UmwG als bekannt gemacht gilt, ihren Anspruch nach Grund und Höhe in Textform anmelden, Sicherheit zu leisten, soweit sie nicht Befriedigung verlangen können. Dieses Recht steht den Gläubigern jedoch nur zu, wenn sie glaubhaft machen, dass durch die Verschmelzung die Erfüllung ihrer Forderung gefährdet wird."
    },
    {
      "date": "2026-02-17",
      "id": "145248",
      "original_text": "Registerbekanntmachung nach dem Umwandlungsgesetz\nBayern Amtsgericht München HRA 121480\nDieter Pretzer e.K. – Germering",
      "type": "Registerbekanntmachung nach dem Umwandlungsgesetz",
      "state": "Bayern",
      "amtsgericht": "Amtsgericht München",
      "registernummer": "HRA 121480",
      "registerart": "HRA",
      "company_name": "Dieter Pretzer e.K.",
      "company_seat": "Germering",
      "details": "17.02.2026 (Bekanntmachungsdatum)\n\nBayern Amtsgericht München HRA 121480\nRegisterbekanntmachung nach dem Umwandlungsgesetz 16.02.2026 (Eintragungsdatum)\n\nDieter Pretzer e.K.\nEinzelkaufmann / Einzelkauffrau\nGermering\n\nDen Gläubigern der an der Ausgliederung beteiligten Rechtsträger ist, wenn sie binnen sechs Monaten nach dem Tag, an dem die Eintragung der Ausgliederung in das Register des Sitzes desjenigen Rechtsträgers, dessen Gläubiger sie sind, nach §§ 125, 19 Abs. 3 UmwG als bekannt gemacht gilt, ihren Anspruch nach Grund und Höhe in Textform anmelden, Sicherheit zu leisten, soweit sie nicht Befriedigung verlangen können. Dieses Recht steht den Gläubigern jedoch nur zu, wenn sie glaubhaft machen, dass durch die Ausgliederung die Erfüllung ihrer Forderung gefährdet wird."
    },
    {
      "date": "2026-02-17",
      "id": "145249",
      "original_text": "Einreichung neuer Dokumente\nBayern Amtsgericht München HRB 95098\nBNP Paribas Real Estate Investment Management Germany GmbH – München",
      "type": "Einreichung neuer Dokumente",
      "state": "Bayern",
      "amtsgericht": "Amtsgericht München",
      "registernummer": "HRB 95098",
      "registerart": "HRB",
      "company_name": "BNP Paribas Real Estate Investment Management Germany GmbH",
      "company_seat": "München",
      "details": "17.02.2026 (Bekanntmachungsdatum)\n\nBayern Amtsgericht München HRB 95098\nEinreichung neuer Dokumente\n\nBNP Paribas Real Estate Investment Management Germany GmbH\nGesellschaft mit beschränkter Haftung\nMünchen\n\nDem Amtsgericht München -Registergericht- ist eine Liste der Mitglieder des Aufsichtsrats eingereicht worden, § 52 Abs. 3 S. 2 GmbHG."
    },
    {
      "date": "2026-02-17",
      "id": "145250",
      "original_text": "Registerbekanntmachung nach dem Umwandlungsgesetz\nBayern Amtsgericht Landshut HRA 13012\nSchleich & Haberl Immobilien Dortmund-Mengede GmbH & Co. KG – Pfarrkirchen",
      "type": "Registerbekanntmachung nach dem Umwandlungsgesetz",
      "state": "Bayern",
      "amtsgericht": "Amtsgericht Landshut",
      "registernummer": "HRA 13012",
      "registerart": "HRA",
      "company_name": "Schleich & Haberl Immobilien Dortmund-Mengede GmbH & Co. KG",
      "company_seat": "Pfarrkirchen",
      "details": "17.02.2026 (Bekanntmachungsdatum)\n\nBayern Amtsgericht Landshut HRA 13012\nRegisterbekanntmachung nach dem Umwandlungsgesetz 16.02.2026 (Eintragungsdatum)\n\nSchleich & Haberl Immobilien Dortmund-Mengede GmbH & Co. KG\nKommanditgesellschaft\nPfarrkirchen\n\nDen Gläubigern des formwechselnden Rechtsträgers ist, wenn sie binnen sechs Monaten nach dem Tag, an dem die Eintragung des Formwechsels nach § 201 UmwG als bekannt gemacht gilt, ihren Anspruch nach Grund und Höhe in Textform anmelden, Sicherheit zu leisten, soweit sie nicht Befriedigung verlangen können. Dieses Recht steht den Gläubigern jedoch nur zu, wenn sie glaubhaft machen, dass durch den Formwechsel die Erfüllung ihrer Forderung gefährdet wird."
    },
    {
      "date": "2026-02-17",
      "id": "145251",
      "original_text": "Registerbekanntmachung nach dem Umwandlungsgesetz\nBayern Amtsgericht Fürth HRB 9128\nRWS GmbH – Fürth",
      "type": "Registerbekanntmachung nach dem Umwandlungsgesetz",
      "state": "Bayern",
      "amtsgericht": "Amtsgericht Fürth",
      "registernummer": "HRB 9128",
      "registerart": "HRB",
      "company_name": "RWS GmbH",
      "company_seat": "Fürth",
      "details": "17.02.2026 (Bekanntmachungsdatum)\n\nBayern Amtsgericht Fürth HRB 9128\nRegisterbekanntmachung nach dem Umwandlungsgesetz 16.02.2026 (Eintragungsdatum)\n\nRWS GmbH\nGesellschaft mit beschränkter Haftung\nFürth\n\nDen Gläubigern der an der Verschmelzung beteiligten Rechtsträger ist, wenn sie binnen sechs Monaten nach dem Tag, an dem die Eintragung der Verschmelzung in das Register des Sitzes desjenigen Rechtsträgers, dessen Gläubiger sie sind, nach § 19 Abs. 3 UmwG als bekannt gemacht gilt, ihren Anspruch nach Grund und Höhe in Textform anmelden, Sicherheit zu leisten, soweit sie nicht Befriedigung verlangen können. Dieses Recht steht den Gläubigern jedoch nur zu, wenn sie glaubhaft machen, dass durch die Verschmelzung die Erfüllung ihrer Forderung gefährdet wird."
    },
    {
      "date": "2026-02-17",
      "id": "145252",
      "original_text": "Registerbekanntmachung nach dem Umwandlungsgesetz\nBayern Amtsgericht Traunstein HRB 34724\nNetmicro Solutions GmbH – Teisendorf",
      "type": "Registerbekanntmachung nach dem Umwandlungsgesetz",
      "state": "Bayern",
      "amtsgericht": "Amtsgericht Traunstein",
      "registernummer": "HRB 34724",
      "registerart": "HRB",
      "company_name": "Netmicro Solutions GmbH",
      "company_seat": "Teisendorf",
      "details": "17.02.2026 (Bekanntmachungsdatum)\n\nBayern Amtsgericht Traunstein HRB 34724\nRegisterbekanntmachung nach dem Umwandlungsgesetz 16.02.2026 (Eintragungsdatum)\n\nNetmicro Solutions GmbH\nGesellschaft mit beschränkter Haftung\nTeisendorf\n\nDen Gläubigern der an der Ausgliederung beteiligten Rechtsträger ist, wenn sie binnen sechs Monaten nach dem Tag, an dem die Eintragung der Ausgliederung in das Register des Sitzes desjenigen Rechtsträgers, dessen Gläubiger sie sind, nach §§ 125, 19 Abs. 3 UmwG als bekannt gemacht gilt, ihren Anspruch nach Grund und Höhe in Textform anmelden, Sicherheit zu leisten, soweit sie nicht Befriedigung verlangen können. Dieses Recht steht den Gläubigern jedoch nur zu, wenn sie glaubhaft machen, dass durch die Ausgliederung die Erfüllung ihrer Forderung gefährdet wird."
    },
    {
      "date": "2026-02-17",
      "id": "145253",
      "original_text": "Registerbekanntmachung nach dem Umwandlungsgesetz\nBayern Amtsgericht München HRB 213993\nBayWa r.e. Solar Projects Verwaltungs GmbH – Gräfelfing",
      "type": "Registerbekanntmachung nach dem Umwandlungsgesetz",
      "state": "Bayern",
      "amtsgericht": "Amtsgericht München",
      "registernummer": "HRB 213993",
      "registerart": "HRB",
      "company_name": "BayWa r.e. Solar Projects Verwaltungs GmbH",
      "company_seat": "Gräfelfing",
      "details": "17.02.2026 (Bekanntmachungsdatum)\n\nBayern Amtsgericht München HRB 213993\nRegisterbekanntmachung nach dem Umwandlungsgesetz 16.02.2026 (Eintragungsdatum)\n\nBayWa r.e. Solar Projects Verwaltungs GmbH\nGesellschaft mit beschränkter Haftung\nGräfelfing\n\nDen Gläubigern der an der Verschmelzung beteiligten Rechtsträger ist, wenn sie binnen sechs Monaten nach dem Tag, an dem die Eintragung der Verschmelzung in das Register des Sitzes desjenigen Rechtsträgers, dessen Gläubiger sie sind, nach § 19 Abs. 3 UmwG als bekannt gemacht gilt, ihren Anspruch nach Grund und Höhe in Textform anmelden, Sicherheit zu leisten, soweit sie nicht Befriedigung verlangen können. Dieses Recht steht den Gläubigern jedoch nur zu, wenn sie glaubhaft machen, dass durch die Verschmelzung die Erfüllung ihrer Forderung gefährdet wird."
    },
    {
      "date": "2026-02-17",
      "id": "145254",
      "original_text": "Registerbekanntmachung nach dem Umwandlungsgesetz\nBayern Amtsgericht München HRB 304199\nSCUR-Alpha 1914 GmbH – München",
      "type": "Registerbekanntmachung nach dem Umwandlungsgesetz",
      "state": "Bayern",
      "amtsgericht": "Amtsgericht München",
      "registernummer": "HRB 304199",
      "registerart": "HRB",
      "company_name": "SCUR-Alpha 1914 GmbH",
      "company_seat": "München",
      "details": "17.02.2026 (Bekanntmachungsdatum)\n\nBayern Amtsgericht München HRB 304199\nRegisterbekanntmachung nach dem Umwandlungsgesetz 16.02.2026 (Eintragungsdatum)\n\nSCUR-Alpha 1914 GmbH\nGesellschaft mit beschränkter Haftung\nMünchen\n\nDen Gläubigern der an der Verschmelzung beteiligten Rechtsträger ist, wenn sie binnen sechs Monaten nach dem Tag, an dem die Eintragung der Verschmelzung in das Register des Sitzes desjenigen Rechtsträgers, dessen Gläubiger sie sind, nach § 19 Abs. 3 UmwG als bekannt gemacht gilt, ihren Anspruch nach Grund und Höhe in Textform anmelden, Sicherheit zu leisten, soweit sie nicht Befriedigung verlangen können. Dieses Recht steht den Gläubigern jedoch nur zu, wenn sie glaubhaft machen, dass durch die Verschmelzung die Erfüllung ihrer Forderung gefährdet wird."
    },
    {
      "date": "2026-02-17",
      "id": "145255",
      "original_text": "Registerbekanntmachung nach dem Umwandlungsgesetz\nBayern Amtsgericht München HRB 165533\nTQ-Group GmbH – Seefeld",
      "type": "Registerbekanntmachung nach dem Umwandlungsgesetz",
      "state": "Bayern",
      "amtsgericht": "Amtsgericht München",
      "registernummer": "HRB 165533",
      "registerart": "HRB",
      "company_name": "TQ-Group GmbH",
      "company_seat": "Seefeld",
      "details": "17.02.2026 (Bekanntmachungsdatum)\n\nBayern Amtsgericht München HRB 165533\nRegisterbekanntmachung nach dem Umwandlungsgesetz 16.02.2026 (Eintragungsdatum)\n\nTQ-Group GmbH\nGesellschaft mit beschränkter Haftung\nSeefeld\n\nDen Gläubigern #dv.auswahl(Text=\"Bitte zutreffendes auswählen:\",Eingabe=\n\n\"der an der Verschmelzung beteiligten Rechtsträger ist, wenn sie binnen sechs Monaten nach dem Tag, an dem die Eintragung der Verschmelzung in das Register des Sitzes desjenigen Rechtsträgers, dessen Gläubiger sie sind, nach § 19 Abs. 3 UmwG als bekannt gemacht gilt, ihren Anspruch nach Grund und Höhe in Textform anmelden, Sicherheit zu leisten, soweit sie nicht Befriedigung verlangen können. Dieses Recht steht den Gläubigern jedoch nur zu, wenn sie glaubhaft machen, dass durch die Verschmelzung die Erfüllung ihrer Forderung gefährdet wird.\"|\"Verschmelzung\",\n\n\"der an der Spaltung beteiligten Rechtsträger ist, wenn sie binnen sechs Monaten nach dem Tag, an dem die Eintragung der Spaltung in das Register des Sitzes desjenigen Rechtsträgers, dessen Gläubiger sie sind, nach §§ 125, 19 Abs. 3 UmwG als bekannt gemacht gilt, ihren Anspruch nach Grund und Höhe in Textform anmelden, Sicherheit zu leisten, soweit sie nicht Befriedigung verlangen können. Dieses Recht steht den Gläubigern jedoch nur zu, wenn sie glaubhaft machen, dass durch die Spaltung die Erfüllung ihrer Forderung gefährdet wird.\"|\"Spaltung\",\n\n\"des formwechselnden Rechtsträgers ist, wenn sie binnen sechs Monaten nach dem Tag, an dem die Eintragung des Formwechsels nach § 201 UmwG als bekannt gemacht gilt, ihren Anspruch nach Grund und Höhe in Textform anmelden, Sicherheit zu leisten, soweit sie nicht Befriedigung verlangen können. Dieses Recht steht den Gläubigern jedoch nur zu, wenn sie glaubhaft machen, dass durch den Formwechsel die Erfüllung ihrer Forderung gefährdet wird.\"|\"formwechselnde Umwandlung\",\n\n\"der an der Ausgliederung beteiligten Rechtsträger ist, wenn sie binnen sechs Monaten nach dem Tag, an dem die Eintragung der Ausgliederung in das Register des Sitzes desjenigen Rechtsträgers, dessen Gläubiger sie sind, nach §§ 125, 19 Abs. 3 UmwG als bekannt gemacht gilt, ihren Anspruch nach Grund und Höhe in Textform anmelden, Sicherheit zu leisten, soweit sie nicht Befriedigung verlangen können. Dieses Recht steht den Gläubigern jedoch nur zu, wenn sie glaubhaft machen, dass durch die Ausgliederung die Erfüllung ihrer Forderung gefährdet wird.\"|\"Ausgliederung\")"
    },
    {
      "date": "2026-02-17",
      "id": "145256",
      "original_text": "Registerbekanntmachung nach dem Umwandlungsgesetz\nBerlin Amtsgericht Berlin (Charlottenburg) HRB 60603\nTierpark Hotel GmbH – Berlin",
      "type": "Registerbekanntmachung nach dem Umwandlungsgesetz",
      "state": "Berlin",
      "amtsgericht": "Amtsgericht Berlin (Charlottenburg)",
      "registernummer": "HRB 60603",
      "registerart": "HRB",
      "company_name": "Tierpark Hotel GmbH",
      "company_seat": "Berlin",
      "details": "17.02.2026 (Bekanntmachungsdatum)\n\nBerlin Amtsgericht Berlin (Charlottenburg) HRB 60603\nRegisterbekanntmachung nach dem Umwandlungsgesetz 16.02.2026 (Eintragungsdatum)\n\nTierpark Hotel GmbH\nGesellschaft mit beschränkter Haftung\nBerlin\n\nZu Eintragungsnummer 10 vom 16.02.2026 wird als nicht eingetragen veröffentlicht: Den Gläubigern der an der Spaltung beteiligten Rechtsträger ist, wenn sie binnen sechs Monaten nach dem Tag, an dem die Eintragung der Spaltung in das Register des Sitzes desjenigen Rechtsträgers, dessen Gläubiger sie sind, als bekannt gemacht gilt, ihren Anspruch nach Grund und Höhe schriftlich anmelden, Sicherheit zu leisten, soweit sie nicht Befriedigung verlangen können. Dieses Recht steht den Gläubigern jedoch nur zu, wenn sie glaubhaft machen, dass durch die Spaltung die Erfüllung ihrer Forderung gefährdet wird. Das Recht, Sicherheitsleistung zu verlangen, steht Gläubigern nicht zu, die im Falle der Insolvenz ein Recht auf vorzugsweise Befriedigung aus einer Deckungsmasse haben, die nach gesetzlicher Vorschrift zu ihrem Schutz errichtet und staatlich überwacht ist."
    },
    {
      "date": "2026-02-17",
      "id": "145257",
      "original_text": "Registerbekanntmachung nach dem Umwandlungsgesetz\nBerlin Amtsgericht Berlin (Charlottenburg) HRB 274018\nTierpark Hotel Betriebs GmbH – Berlin",
      "type": "Registerbekanntmachung nach dem Umwandlungsgesetz",
      "state": "Berlin",
      "amtsgericht": "Amtsgericht Berlin (Charlottenburg)",
      "registernummer": "HRB 274018",
      "registerart": "HRB",
      "company_name": "Tierpark Hotel Betriebs GmbH",
      "company_seat": "Berlin",
      "details": "17.02.2026 (Bekanntmachungsdatum)\n\nBerlin Amtsgericht Berlin (Charlottenburg) HRB 274018\nRegisterbekanntmachung nach dem Umwandlungsgesetz 16.02.2026 (Eintragungsdatum)\n\nTierpark Hotel Betriebs GmbH\nGesellschaft mit beschränkter Haftung\nBerlin\n\nZu Eintragungsnummer 3 vom 16.02.2026 wird als nicht eingetragen veröffentlicht: Den Gläubigern der an der Spaltung beteiligten Rechtsträger ist, wenn sie binnen sechs Monaten nach dem Tag, an dem die Eintragung der Spaltung in das Register des Sitzes desjenigen Rechtsträgers, dessen Gläubiger sie sind, als bekannt gemacht gilt, ihren Anspruch nach Grund und Höhe schriftlich anmelden, Sicherheit zu leisten, soweit sie nicht Befriedigung verlangen können. Dieses Recht steht den Gläubigern jedoch nur zu, wenn sie glaubhaft machen, dass durch die Spaltung die Erfüllung ihrer Forderung gefährdet wird. Das Recht, Sicherheitsleistung zu verlangen, steht Gläubigern nicht zu, die im Falle der Insolvenz ein Recht auf vorzugsweise Befriedigung aus einer Deckungsmasse haben, die nach gesetzlicher Vorschrift zu ihrem Schutz errichtet und staatlich überwacht ist."
    },
    {
      "date": "2026-02-17",
      "id": "145258",
      "original_text": "Löschungsankündigung\nBerlin Amtsgericht Berlin (Charlottenburg) HRB 194180\nSamato Real Estate Deutschland GmbH – Berlin",
      "type": "Löschungsankündigung",
      "state": "Berlin",
      "amtsgericht": "Amtsgericht Berlin (Charlottenburg)",
      "registernummer": "HRB 194180",
      "registerart": "HRB",
      "company_name": "Samato Real Estate Deutschland GmbH",
      "company_seat": "Berlin",
      "details": "17.02.2026 (Bekanntmachungsdatum)\n\nBerlin Amtsgericht Berlin (Charlottenburg) HRB 194180\nLöschungsankündigung\n\nSamato Real Estate Deutschland GmbH\nGesellschaft mit beschränkter Haftung\nBerlin\n\nAls nicht eingetragen wird veröffentlicht: Es ist die Löschung des Geschäftsführers Lilic gem. § 395 FamFG beabsichtigt. WIderspruchsfrist: 6 Wochen"
    },
    {
      "date": "2026-02-17",
      "id": "145259",
      "original_text": "Registerbekanntmachung nach dem Umwandlungsgesetz\nBaden-Württemberg Amtsgericht Stuttgart HRA 720191\nKiefer Verwaltungs GmbH & Co. KG – Stuttgart",
      "type": "Registerbekanntmachung nach dem Umwandlungsgesetz",
      "state": "Baden-Württemberg",
      "amtsgericht": "Amtsgericht Stuttgart",
      "registernummer": "HRA 720191",
      "registerart": "HRA",
      "company_name": "Kiefer Verwaltungs GmbH & Co. KG",
      "company_seat": "Stuttgart",
      "details": "17.02.2026 (Bekanntmachungsdatum)\n\nBaden-Württemberg Amtsgericht Stuttgart HRA 720191\nRegisterbekanntmachung nach dem Umwandlungsgesetz 17.02.2026 (Eintragungsdatum)\n\nKiefer Verwaltungs GmbH & Co. KG\nKommanditgesellschaft\nStuttgart\n\nAls nicht eingetragen wird bekanntgemacht:\nDen Gläubigern der an der Ausgliederung beteiligten Rechtsträger ist, wenn sie binnen sechs Monaten nach dem Tag, an dem die Eintragung der Ausgliederung in das Register des Sitzes desjenigen Rechtsträgers, dessen Gläubiger sie sind, nach § 19 Abs. 3 UmwG als bekanntgemacht gilt, ihren Anspruch nach Grund und Höhe schriftlich anmelden, Sicherheit zu leisten, soweit sie nicht Befriedigung verlangen können. Dieses Recht steht den Gläubigern jedoch nur zu, wenn sie glaubhaft machen, dass durch die Ausgliederung die Erfüllung ihrer Forderung gefährdet wird."
    },
    {
      "date": "2026-02-17",
      "id": "145260",
      "original_text": "Einreichung neuer Dokumente\nBaden-Württemberg Amtsgericht Stuttgart HRB 207069\ncasadomus AG – Ludwigsburg",
      "type": "Einreichung neuer Dokumente",
      "state": "Baden-Württemberg",
      "amtsgericht": "Amtsgericht Stuttgart",
      "registernummer": "HRB 207069",
      "registerart": "HRB",
      "company_name": "casadomus AG",
      "company_seat": "Ludwigsburg",
      "details": "17.02.2026 (Bekanntmachungsdatum)\n\nBaden-Württemberg Amtsgericht Stuttgart HRB 207069\nEinreichung neuer Dokumente\n\ncasadomus AG\nAktiengesellschaft\nLudwigsburg\n\nDie Gesellschaft hat am 13.02.2026 die Liste über die Zusammensetzung des Aufsichtsrats zum Handelsregister eingereicht."
    },
    {
      "date": "2026-02-17",
      "id": "145261",
      "original_text": "Einreichung neuer Dokumente\nBaden-Württemberg Amtsgericht Ulm HRB 842\nCarl Walther Gesellschaft mit beschränkter Haftung – Ulm",
      "type": "Einreichung neuer Dokumente",
      "state": "Baden-Württemberg",
      "amtsgericht": "Amtsgericht Ulm",
      "registernummer": "HRB 842",
      "registerart": "HRB",
      "company_name": "Carl Walther Gesellschaft mit beschränkter Haftung",
      "company_seat": "Ulm",
      "details": "17.02.2026 (Bekanntmachungsdatum)\n\nBaden-Württemberg Amtsgericht Ulm HRB 842\nEinreichung neuer Dokumente 17.02.2026 (Eintragungsdatum)\n\nCarl Walther Gesellschaft mit beschränkter Haftung\nGesellschaft mit beschränkter Haftung\nUlm\n\nDie Gesellschaft hat am 16.02.2026 die Liste über die Zusammensetzung des Beirats zum Handelsregister eingereicht."
    },
    {
      "date": "2026-02-17",
      "id": "145262",
      "original_text": "Einreichung neuer Dokumente\nSchleswig-Holstein Amtsgericht Kiel HRB 17777\nSchleswig-Holsteinisches Landestheater und Sinfonieorchester GmbH – Rendsburg",
      "type": "Einreichung neuer Dokumente",
      "state": "Schleswig-Holstein",
      "amtsgericht": "Amtsgericht Kiel",
      "registernummer": "HRB 17777",
      "registerart": "HRB",
      "company_name": "Schleswig-Holsteinisches Landestheater und Sinfonieorchester GmbH",
      "company_seat": "Rendsburg",
      "details": "17.02.2026 (Bekanntmachungsdatum)\n\nSchleswig-Holstein Amtsgericht Kiel HRB 17777\nEinreichung neuer Dokumente\n\nSchleswig-Holsteinisches Landestheater und Sinfonieorchester GmbH\nGesellschaft mit beschränkter Haftung\nRendsburg\n\nAls nicht eingetragen wird veröffentlicht: Eine neue Liste der Aufsichtsratsmitglieder ist eingereicht worden."
    },
    {
      "date": "2026-02-17",
      "id": "145263",
      "original_text": "Löschungsankündigung\nSchleswig-Holstein Amtsgericht Kiel HRB 9703\nGoodwine Nordic GmbH – Schwentinental",
      "type": "Löschungsankündigung",
      "state": "Schleswig-Holstein",
      "amtsgericht": "Amtsgericht Kiel",
      "registernummer": "HRB 9703",
      "registerart": "HRB",
      "company_name": "Goodwine Nordic GmbH",
      "company_seat": "Schwentinental",
      "details": "17.02.2026 (Bekanntmachungsdatum)\n\nSchleswig-Holstein Amtsgericht Kiel HRB 9703\nLöschungsankündigung\n\nGoodwine Nordic GmbH\nGesellschaft mit beschränkter Haftung\nSchwentinental\n\nEs ist die Löschung der nachstehenden Gesellschaft wegen Vermögenslosigkeit gemäß § 394 FamFG beabsichtigt. Widerspruchsfrist: 2 Monate."
    },
    {
      "date": "2026-02-17",
      "id": "145264",
      "original_text": "Löschungsankündigung\nSchleswig-Holstein Amtsgericht Flensburg HRB 13845\nCheckmyNext GmbH – Flensburg",
      "type": "Löschungsankündigung",
      "state": "Schleswig-Holstein",
      "amtsgericht": "Amtsgericht Flensburg",
      "registernummer": "HRB 13845",
      "registerart": "HRB",
      "company_name": "CheckmyNext GmbH",
      "company_seat": "Flensburg",
      "details": "17.02.2026 (Bekanntmachungsdatum)\n\nSchleswig-Holstein Amtsgericht Flensburg HRB 13845\nLöschungsankündigung\n\nCheckmyNext GmbH\nGesellschaft mit beschränkter Haftung\nFlensburg\n\nEs ist die Löschung der nachstehenden Gesellschaft wegen Vermögenslosigkeit gemäß § 394 FamFG beabsichtigt.\nWiderspruchsfrist: 2 Monate"
    },
    {
      "date": "2026-02-17",
      "id": "145265",
      "original_text": "Löschungsankündigung\nBerlin Amtsgericht Berlin (Charlottenburg) HRB 22799\nBellevue Werbeagentur und Vertriebs GmbH – Berlin",
      "type": "Löschungsankündigung",
      "state": "Berlin",
      "amtsgericht": "Amtsgericht Berlin (Charlottenburg)",
      "registernummer": "HRB 22799",
      "registerart": "HRB",
      "company_name": "Bellevue Werbeagentur und Vertriebs GmbH",
      "company_seat": "Berlin",
      "details": "17.02.2026 (Bekanntmachungsdatum)\n\nBerlin Amtsgericht Berlin (Charlottenburg) HRB 22799\nLöschungsankündigung\n\nBellevue Werbeagentur und Vertriebs GmbH\nGesellschaft mit beschränkter Haftung\nBerlin\n\nBei der nachstehenden Gesellschaft wird das Amtslöschungsverfahren gemäß § 394 FamFG eingeleitet. Widerspruchsfrist 6 Wochen"
    },
    {
      "date": "2026-02-17",
      "id": "145266",
      "original_text": "Sonstige Registerbekanntmachung\nBrandenburg Amtsgericht Potsdam HRB 41357\nSafe 008 GmbH – Teltow",
      "type": "Sonstige Registerbekanntmachung",
      "state": "Brandenburg",
      "amtsgericht": "Amtsgericht Potsdam",
      "registernummer": "HRB 41357",
      "registerart": "HRB",
      "company_name": "Safe 008 GmbH",
      "company_seat": "Teltow",
      "details": "17.02.2026 (Bekanntmachungsdatum)\n\nBrandenburg Amtsgericht Potsdam HRB 41357\nSonstige Registerbekanntmachung\n\nSafe 008 GmbH\nGesellschaft mit beschränkter Haftung\nTeltow\n\nAls nicht eingetragen wird veröffentlicht: Die Ankündigung der Amtslöschung gemäß § 394 FamFG vom 27.01.2026 ist durch Beschluss vom 16.02.2026 aufgehoben."
    },
    {
      "date": "2026-02-17",
      "id": "145267",
      "original_text": "Einreichung neuer Dokumente\nBaden-Württemberg Amtsgericht Mannheim HRB 108991\nstellenonline.de Aktiengesellschaft – Karlsruhe",
      "type": "Einreichung neuer Dokumente",
      "state": "Baden-Württemberg",
      "amtsgericht": "Amtsgericht Mannheim",
      "registernummer": "HRB 108991",
      "registerart": "HRB",
      "company_name": "stellenonline.de Aktiengesellschaft",
      "company_seat": "Karlsruhe",
      "details": "17.02.2026 (Bekanntmachungsdatum)\n\nBaden-Württemberg Amtsgericht Mannheim HRB 108991\nEinreichung neuer Dokumente\n\nstellenonline.de Aktiengesellschaft\nAktiengesellschaft\nKarlsruhe\n\nDie Gesellschaft hat am 16.02.2026 die Liste über die Zusammensetzung des Aufsichtsrats zum Handelsregister eingereicht."
    },
    {
      "date": "2026-02-17",
      "id": "145268",
      "original_text": "Registerbekanntmachung nach dem Umwandlungsgesetz\nBaden-Württemberg Amtsgericht Stuttgart HRB 768706\nAtes Holding GmbH – Stuttgart",
      "type": "Registerbekanntmachung nach dem Umwandlungsgesetz",
      "state": "Baden-Württemberg",
      "amtsgericht": "Amtsgericht Stuttgart",
      "registernummer": "HRB 768706",
      "registerart": "HRB",
      "company_name": "Ates Holding GmbH",
      "company_seat": "Stuttgart",
      "details": "17.02.2026 (Bekanntmachungsdatum)\n\nBaden-Württemberg Amtsgericht Stuttgart HRB 768706\nRegisterbekanntmachung nach dem Umwandlungsgesetz 17.02.2026 (Eintragungsdatum)\n\nAtes Holding GmbH\nGesellschaft mit beschränkter Haftung\nStuttgart\n\nAls nicht eingetragen wird bekanntgemacht:\nDen Gläubigern der an der Verschmelzung beteiligten Rechtsträger ist, wenn sie binnen sechs Monaten nach dem Tag, an dem die Eintragung der Verschmelzung in das Register des Sitzes desjenigen Rechtsträgers, dessen Gläubiger sie sind, nach § 19 Abs. 3 UmwG als bekanntgemacht gilt, ihren Anspruch nach Grund und Höhe schriftlich anmelden, Sicherheit zu leisten, soweit sie nicht Befriedigung verlangen können. Dieses Recht steht den Gläubigern jedoch nur zu, wenn sie glaubhaft machen, dass durch die Verschmelzung die Erfüllung ihrer Forderung gefährdet wird."
    },
    {
      "date": "2026-02-17",
      "id": "145269",
      "original_text": "Registerbekanntmachung nach dem Umwandlungsgesetz\nMecklenburg-Vorpommern Amtsgericht Neubrandenburg HRB 21899\nGut Hohenstein GmbH – Friedland",
      "type": "Registerbekanntmachung nach dem Umwandlungsgesetz",
      "state": "Mecklenburg-Vorpommern",
      "amtsgericht": "Amtsgericht Neubrandenburg",
      "registernummer": "HRB 21899",
      "registerart": "HRB",
      "company_name": "Gut Hohenstein GmbH",
      "company_seat": "Friedland",
      "details": "17.02.2026 (Bekanntmachungsdatum)\n\nMecklenburg-Vorpommern Amtsgericht Neubrandenburg HRB 21899\nRegisterbekanntmachung nach dem Umwandlungsgesetz 17.02.2026 (Eintragungsdatum)\n\nGut Hohenstein GmbH\nGesellschaft mit beschränkter Haftung\nFriedland\n\nAls nicht eingetragen wird veröffentlicht: Den Gläubigern der an der Verschmelzung beteiligten Rechtsträger ist, wenn sie binnen sechs Monaten nach dem Tag, an dem die Eintragung der Verschmelzung in das Register des Sitzes desjenigen Rechtsträgers, dessen Gläubiger sie sind, nach § 19 Abs. 3 UmwG als bekannt gemacht gilt,\nihren Anspruch nach Grund und Höhe in Textform anmelden, Sicherheit zu leisten, soweit sie nicht Befriedigung verlangen können. Dieses Recht steht den Gläubigern jedoch nur zu, wenn sie glaubhaft machen, dass durch die Verschmelzung die Erfüllung der Forderung gefährdet wird."
    },
    {
      "date": "2026-02-17",
      "id": "145270",
      "original_text": "Registerbekanntmachung nach dem Umwandlungsgesetz\nBaden-Württemberg Amtsgericht Stuttgart HRB 770278\nPG Verwaltungs GmbH – Calw",
      "type": "Registerbekanntmachung nach dem Umwandlungsgesetz",
      "state": "Baden-Württemberg",
      "amtsgericht": "Amtsgericht Stuttgart",
      "registernummer": "HRB 770278",
      "registerart": "HRB",
      "company_name": "PG Verwaltungs GmbH",
      "company_seat": "Calw",
      "details": "17.02.2026 (Bekanntmachungsdatum)\n\nBaden-Württemberg Amtsgericht Stuttgart HRB 770278\nRegisterbekanntmachung nach dem Umwandlungsgesetz 17.02.2026 (Eintragungsdatum)\n\nPG Verwaltungs GmbH\nGesellschaft mit beschränkter Haftung\nCalw\n\nAls nicht eingetragen wird bekanntgemacht:\nDen Gläubigern der an der Verschmelzung beteiligten Rechtsträger ist, wenn sie binnen sechs Monaten nach dem Tag, an dem die Eintragung der Verschmelzung in das Register des Sitzes desjenigen Rechtsträgers, dessen Gläubiger sie sind, nach § 19 Abs. 3 UmwG als bekanntgemacht gilt, ihren Anspruch nach Grund und Höhe schriftlich anmelden, Sicherheit zu leisten, soweit sie nicht Befriedigung verlangen können. Dieses Recht steht den Gläubigern jedoch nur zu, wenn sie glaubhaft machen, dass durch die Verschmelzung die Erfüllung ihrer Forderung gefährdet wird."
    },
    {
      "date": "2026-02-17",
      "id": "145271",
      "original_text": "Löschungsankündigung\nSachsen-Anhalt Amtsgericht Stendal HRB 28927\nEKSPLO UG (haftungsbeschränkt) – Teutschenthal",
      "type": "Löschungsankündigung",
      "state": "Sachsen-Anhalt",
      "amtsgericht": "Amtsgericht Stendal",
      "registernummer": "HRB 28927",
      "registerart": "HRB",
      "company_name": "EKSPLO UG (haftungsbeschränkt)",
      "company_seat": "Teutschenthal",
      "details": "17.02.2026 (Bekanntmachungsdatum)\n\nSachsen-Anhalt Amtsgericht Stendal HRB 28927\nLöschungsankündigung\n\nEKSPLO UG (haftungsbeschränkt)\nGesellschaft mit beschränkter Haftung\nTeutschenthal\n\nDas Registergericht beabsichtigt, nachfolgende im Handelregister eingetragenen Firmen von Amts wegen nach § 394 FamFG zu löschen. Die Frist zu Erhebung eines Widerspruchs wird auf drei Monate festgesetzt."
    },
    {
      "date": "2026-02-17",
      "id": "145272",
      "original_text": "Sonstige Registerbekanntmachung\nBaden-Württemberg Amtsgericht Ulm HRB 743375\nStrategic Fiber Networks GmbH – Schwäbisch Gmünd",
      "type": "Sonstige Registerbekanntmachung",
      "state": "Baden-Württemberg",
      "amtsgericht": "Amtsgericht Ulm",
      "registernummer": "HRB 743375",
      "registerart": "HRB",
      "company_name": "Strategic Fiber Networks GmbH",
      "company_seat": "Schwäbisch Gmünd",
      "details": "17.02.2026 (Bekanntmachungsdatum)\n\nBaden-Württemberg Amtsgericht Ulm HRB 743375\nSonstige Registerbekanntmachung\n\nStrategic Fiber Networks GmbH\nGesellschaft mit beschränkter Haftung\nSchwäbisch Gmünd\n\nDie Gesellschaft hat am 16.02.2026 die Liste über die Zusammensetzung des Aufsichtsrats/Beirats zum Handelsregister eingereicht."
    },
    {
      "date": "2026-02-17",
      "id": "145273",
      "original_text": "Registerbekanntmachung nach dem Umwandlungsgesetz\nHamburg Amtsgericht Hamburg HRB 157501\nFSW Zweite Verwaltungsgesellschaft mbH – Hamburg",
      "type": "Registerbekanntmachung nach dem Umwandlungsgesetz",
      "state": "Hamburg",
      "amtsgericht": "Amtsgericht Hamburg",
      "registernummer": "HRB 157501",
      "registerart": "HRB",
      "company_name": "FSW Zweite Verwaltungsgesellschaft mbH",
      "company_seat": "Hamburg",
      "details": "17.02.2026 (Bekanntmachungsdatum)\n\nHamburg Amtsgericht Hamburg HRB 157501\nRegisterbekanntmachung nach dem Umwandlungsgesetz 17.02.2026 (Eintragungsdatum)\n\nFSW Zweite Verwaltungsgesellschaft mbH\nGesellschaft mit beschränkter Haftung\nHamburg\n\nAls nicht eingetragen wird bekannt gemacht:\nDen Gläubigern der an der Verschmelzung beteiligten Gesellschaften ist, wenn sie binnen sechs Monaten nach dem Tag, an dem die Eintragung der Verschmelzung in das Register des Sitzes desjenigen Rechtsträgers, dessen Gläubiger sie sind, nach § 19 Absatz 3 UmwG als bekannt gemacht gilt, ihren Anspruch nach Grund und Höhe schriftlich anmelden, Sicherheit zu leisten, soweit sie nicht Befriedigung verlangen können. Dieses Recht steht den Gläubigern jedoch nur zu, wenn sie glaubhaft machen, dass durch die Verschmelzung die Erfüllung ihrer Forderung gefährdet wird."
    },
    {
      "date": "2026-02-17",
      "id": "145274",
      "original_text": "Registerbekanntmachung nach dem Umwandlungsgesetz\nHamburg Amtsgericht Hamburg HRB 166427\nFSW Vierte Verwaltungsgesellschaft mbH – Hamburg",
      "type": "Registerbekanntmachung nach dem Umwandlungsgesetz",
      "state": "Hamburg",
      "amtsgericht": "Amtsgericht Hamburg",
      "registernummer": "HRB 166427",
      "registerart": "HRB",
      "company_name": "FSW Vierte Verwaltungsgesellschaft mbH",
      "company_seat": "Hamburg",
      "details": "17.02.2026 (Bekanntmachungsdatum)\n\nHamburg Amtsgericht Hamburg HRB 166427\nRegisterbekanntmachung nach dem Umwandlungsgesetz 17.02.2026 (Eintragungsdatum)\n\nFSW Vierte Verwaltungsgesellschaft mbH\nGesellschaft mit beschränkter Haftung\nHamburg\n\nAls nicht eingetragen wird bekannt gemacht:\nDen Gläubigern der an der Verschmelzung beteiligten Gesellschaften ist, wenn sie binnen sechs Monaten nach dem Tag, an dem die Eintragung der Verschmelzung in das Register des Sitzes desjenigen Rechtsträgers, dessen Gläubiger sie sind, nach § 19 Absatz 3 UmwG als bekannt gemacht gilt, ihren Anspruch nach Grund und Höhe schriftlich anmelden, Sicherheit zu leisten, soweit sie nicht Befriedigung verlangen können. Dieses Recht steht den Gläubigern jedoch nur zu, wenn sie glaubhaft machen, dass durch die Verschmelzung die Erfüllung ihrer Forderung gefährdet wird."
    },
    {
      "date": "2026-02-17",
      "id": "145275",
      "original_text": "Einreichung neuer Dokumente\nBaden-Württemberg Amtsgericht Freiburg HRB 680291\nDuravit Aktiengesellschaft – Hornberg",
      "type": "Einreichung neuer Dokumente",
      "state": "Baden-Württemberg",
      "amtsgericht": "Amtsgericht Freiburg",
      "registernummer": "HRB 680291",
      "registerart": "HRB",
      "company_name": "Duravit Aktiengesellschaft",
      "company_seat": "Hornberg",
      "details": "17.02.2026 (Bekanntmachungsdatum)\n\nBaden-Württemberg Amtsgericht Freiburg HRB 680291\nEinreichung neuer Dokumente 17.02.2026 (Eintragungsdatum)\n\nDuravit Aktiengesellschaft\nAktiengesellschaft\nHornberg\n\nAls nicht eingetragen wird bekanntgemacht:\nDie Gesellschaft hat am 09.02.2026 die Liste über die Zusammensetzung des Aufsichtsrats zum Handelsregister eingereicht."
    },
    {
      "date": "2026-02-17",
      "id": "145276",
      "original_text": "Löschungsankündigung\nBrandenburg Amtsgericht Potsdam HRB 32311\nDKS Bodenbeschichtung UG (haftungsbeschränkt) – Falkensee",
      "type": "Löschungsankündigung",
      "state": "Brandenburg",
      "amtsgericht": "Amtsgericht Potsdam",
      "registernummer": "HRB 32311",
      "registerart": "HRB",
      "company_name": "DKS Bodenbeschichtung UG (haftungsbeschränkt)",
      "company_seat": "Falkensee",
      "details": "17.02.2026 (Bekanntmachungsdatum)\n\nBrandenburg Amtsgericht Potsdam HRB 32311\nLöschungsankündigung\n\nDKS Bodenbeschichtung UG (haftungsbeschränkt)\nGesellschaft mit beschränkter Haftung\nFalkensee\n\nBei der nachstehenden Gesellschaft wird das Amtslöschungsverfahren gemäß § 394 FamFG eingeleitet. Widerspruchsfrist: 8 Wochen"
    },
    {
      "date": "2026-02-17",
      "id": "145277",
      "original_text": "Registerbekanntmachung nach dem Umwandlungsgesetz\nBaden-Württemberg Amtsgericht Stuttgart HRB 245658\nKolb Grundbesitz GmbH – Stuttgart",
      "type": "Registerbekanntmachung nach dem Umwandlungsgesetz",
      "state": "Baden-Württemberg",
      "amtsgericht": "Amtsgericht Stuttgart",
      "registernummer": "HRB 245658",
      "registerart": "HRB",
      "company_name": "Kolb Grundbesitz GmbH",
      "company_seat": "Stuttgart",
      "details": "17.02.2026 (Bekanntmachungsdatum)\n\nBaden-Württemberg Amtsgericht Stuttgart HRB 245658\nRegisterbekanntmachung nach dem Umwandlungsgesetz 17.02.2026 (Eintragungsdatum)\n\nKolb Grundbesitz GmbH\nGesellschaft mit beschränkter Haftung\nStuttgart\n\nAls nicht eingetragen wird bekanntgemacht:\nDen Gläubigern der an der Verschmelzung beteiligten Rechtsträger ist, wenn sie binnen sechs Monaten nach dem Tag, an dem die Eintragung der Verschmelzung in das Register des Sitzes desjenigen Rechtsträgers, dessen Gläubiger sie sind, nach § 19 Abs. 3 UmwG als bekanntgemacht gilt, ihren Anspruch nach Grund und Höhe schriftlich anmelden, Sicherheit zu leisten, soweit sie nicht Befriedigung verlangen können. Dieses Recht steht den Gläubigern jedoch nur zu, wenn sie glaubhaft machen, dass durch die Verschmelzung die Erfüllung ihrer Forderung gefährdet wird."
    },
    {
      "date": "2026-02-17",
      "id": "145278",
      "original_text": "Löschungsankündigung\nBerlin Amtsgericht Berlin (Charlottenburg) HRB 233837\nBTR Gebäudeservice UG (haftungsbeschränkt) – Berlin",
      "type": "Löschungsankündigung",
      "state": "Berlin",
      "amtsgericht": "Amtsgericht Berlin (Charlottenburg)",
      "registernummer": "HRB 233837",
      "registerart": "HRB",
      "company_name": "BTR Gebäudeservice UG (haftungsbeschränkt)",
      "company_seat": "Berlin",
      "details": "17.02.2026 (Bekanntmachungsdatum)\n\nBerlin Amtsgericht Berlin (Charlottenburg) HRB 233837\nLöschungsankündigung\n\nBTR Gebäudeservice UG (haftungsbeschränkt)\nGesellschaft mit beschränkter Haftung\nBerlin\n\nBei der nachstehenden Gesellschaft wird das Amtslöschungsverfahren gemäß § 394 FamFG eingeleitet. Widerspruchsfrist 6 Wochen"
    },
    {
      "date": "2026-02-17",
      "id": "145279",
      "original_text": "Sonstige Registerbekanntmachung\nHamburg Amtsgericht Hamburg HRB 83272\nCarlsberg Deutschland Logistik GmbH – Hamburg",
      "type": "Sonstige Registerbekanntmachung",
      "state": "Hamburg",
      "amtsgericht": "Amtsgericht Hamburg",
      "registernummer": "HRB 83272",
      "registerart": "HRB",
      "company_name": "Carlsberg Deutschland Logistik GmbH",
      "company_seat": "Hamburg",
      "details": "17.02.2026 (Bekanntmachungsdatum)\n\nHamburg Amtsgericht Hamburg HRB 83272\nSonstige Registerbekanntmachung\n\nCarlsberg Deutschland Logistik GmbH\nGesellschaft mit beschränkter Haftung\nHamburg\n\nAls nicht eingetragen wird bekannt gemacht: Liste des Aufsichtsrats wurde eingereicht."
    },
    {
      "date": "2026-02-17",
      "id": "145280",
      "original_text": "Sonstige Registerbekanntmachung\nHamburg Amtsgericht Hamburg HRB 59378\nCarlsberg Supply Company Deutschland GmbH – Hamburg",
      "type": "Sonstige Registerbekanntmachung",
      "state": "Hamburg",
      "amtsgericht": "Amtsgericht Hamburg",
      "registernummer": "HRB 59378",
      "registerart": "HRB",
      "company_name": "Carlsberg Supply Company Deutschland GmbH",
      "company_seat": "Hamburg",
      "details": "17.02.2026 (Bekanntmachungsdatum)\n\nHamburg Amtsgericht Hamburg HRB 59378\nSonstige Registerbekanntmachung\n\nCarlsberg Supply Company Deutschland GmbH\nGesellschaft mit beschränkter Haftung\nHamburg\n\nAls nicht eingetragen wird bekannt gemacht: Liste des Aufsichtsrats wurde eingereicht."
    },
    {
      "date": "2026-02-17",
      "id": "145281",
      "original_text": "Löschungsankündigung\nBerlin Amtsgericht Berlin (Charlottenburg) HRB 226852\nBlackbull Burger GmbH – Berlin",
      "type": "Löschungsankündigung",
      "state": "Berlin",
      "amtsgericht": "Amtsgericht Berlin (Charlottenburg)",
      "registernummer": "HRB 226852",
      "registerart": "HRB",
      "company_name": "Blackbull Burger GmbH",
      "company_seat": "Berlin",
      "details": "17.02.2026 (Bekanntmachungsdatum)\n\nBerlin Amtsgericht Berlin (Charlottenburg) HRB 226852\nLöschungsankündigung\n\nBlackbull Burger GmbH\nGesellschaft mit beschränkter Haftung\nBerlin\n\nBei der nachstehenden Gesellschaft wird das Amtslöschungsverfahren gemäß § 394 FamFG eingeleitet. Widerspruchsfrist 6 Wochen"
    },
    {
      "date": "2026-02-17",
      "id": "145282",
      "original_text": "Löschungsankündigung\nThüringen Amtsgericht Jena HRB 514826\nReinhard Schößler Verwaltungs- und Beteiligungs UG (haftungsbeschränkt) – Gotha",
      "type": "Löschungsankündigung",
      "state": "Thüringen",
      "amtsgericht": "Amtsgericht Jena",
      "registernummer": "HRB 514826",
      "registerart": "HRB",
      "company_name": "Reinhard Schößler Verwaltungs- und Beteiligungs UG (haftungsbeschränkt)",
      "company_seat": "Gotha",
      "details": "17.02.2026 (Bekanntmachungsdatum)\n\nThüringen Amtsgericht Jena HRB 514826\nLöschungsankündigung\n\nReinhard Schößler Verwaltungs- und Beteiligungs UG (haftungsbeschränkt)\nGesellschaft mit beschränkter Haftung\nGotha\n\nDas Registergericht beabsichtigt, die im Handelsregister eingetragene Gesellschaft wegen Vermögenslosigkeit nach § 394 FamFG von Amts wegen zu löschen. Die Frist zur Erhebung eines Widerspruchs gegen die beabsichtigte Löschung wird auf 6 Wochen festgesetzt."
    },
    {
      "date": "2026-02-17",
      "id": "145283",
      "original_text": "Löschungsankündigung\nBerlin Amtsgericht Berlin (Charlottenburg) HRB 174200\nV.I.P. Bauunternehmen GmbH – Berlin",
      "type": "Löschungsankündigung",
      "state": "Berlin",
      "amtsgericht": "Amtsgericht Berlin (Charlottenburg)",
      "registernummer": "HRB 174200",
      "registerart": "HRB",
      "company_name": "V.I.P. Bauunternehmen GmbH",
      "company_seat": "Berlin",
      "details": "17.02.2026 (Bekanntmachungsdatum)\n\nBerlin Amtsgericht Berlin (Charlottenburg) HRB 174200\nLöschungsankündigung\n\nV.I.P. Bauunternehmen GmbH\nGesellschaft mit beschränkter Haftung\nBerlin\n\nBei der nachstehenden Gesellschaft wird das Amtslöschungsverfahren gemäß § 394 FamFG eingeleitet. Widerspruchsfrist 6 Wochen"
    },
    {
      "date": "2026-02-17",
      "id": "145284",
      "original_text": "Löschungsankündigung\nBerlin Amtsgericht Berlin (Charlottenburg) HRB 174200\nV.I.P. Bauunternehmen GmbH – Berlin",
      "type": "Löschungsankündigung",
      "state": "Berlin",
      "amtsgericht": "Amtsgericht Berlin (Charlottenburg)",
      "registernummer": "HRB 174200",
      "registerart": "HRB",
      "company_name": "V.I.P. Bauunternehmen GmbH",
      "company_seat": "Berlin",
      "details": "17.02.2026 (Bekanntmachungsdatum)\n\nBerlin Amtsgericht Berlin (Charlottenburg) HRB 174200\nLöschungsankündigung\n\nV.I.P. Bauunternehmen GmbH\nGesellschaft mit beschränkter Haftung\nBerlin\n\nBei der nachstehenden Gesellschaft wird das Amtslöschungsverfahren gemäß § 394 FamFG eingeleitet. Widerspruchsfrist 6 Wochen"
    },
    {
      "date": "2026-02-17",
      "id": "145285",
      "original_text": "Löschungsankündigung\nSachsen-Anhalt Amtsgericht Stendal HRB 31949\n2Mb UG (haftungsbeschränkt) – Magdeburg",
      "type": "Löschungsankündigung",
      "state": "Sachsen-Anhalt",
      "amtsgericht": "Amtsgericht Stendal",
      "registernummer": "HRB 31949",
      "registerart": "HRB",
      "company_name": "2Mb UG (haftungsbeschränkt)",
      "company_seat": "Magdeburg",
      "details": "17.02.2026 (Bekanntmachungsdatum)\n\nSachsen-Anhalt Amtsgericht Stendal HRB 31949\nLöschungsankündigung\n\n2Mb UG (haftungsbeschränkt)\nGesellschaft mit beschränkter Haftung\nMagdeburg\n\nDas Registergericht beabsichtigt, nachfolgende Gesellschaften wegen Vermögenslosigkeit von Amts wegen nach § 394 FamFG zu löschen. Die Frist zur Erhebung eines Widerspruchs gegen die beabsichtigte Löschung wird auf drei Monate festgesetzt."
    },
    {
      "date": "2026-02-17",
      "id": "145286",
      "original_text": "Registerbekanntmachung nach dem Umwandlungsgesetz\nSachsen-Anhalt Amtsgericht Stendal HRB 208717\nSchmidt Verwaltungs-GmbH Großkayna – Braunsbedra OT Großkayna",
      "type": "Registerbekanntmachung nach dem Umwandlungsgesetz",
      "state": "Sachsen-Anhalt",
      "amtsgericht": "Amtsgericht Stendal",
      "registernummer": "HRB 208717",
      "registerart": "HRB",
      "company_name": "Schmidt Verwaltungs-GmbH Großkayna",
      "company_seat": "Braunsbedra OT Großkayna",
      "details": "17.02.2026 (Bekanntmachungsdatum)\n\nSachsen-Anhalt Amtsgericht Stendal HRB 208717\nRegisterbekanntmachung nach dem Umwandlungsgesetz 17.02.2026 (Eintragungsdatum)\n\nSchmidt Verwaltungs-GmbH Großkayna\nGesellschaft mit beschränkter Haftung\nBraunsbedra OT Großkayna\n\nDie NEW Schweineproduktion GmbH, Großkayna mit dem Sitz in Braunsbedra (Amtsgericht Stendal HRB 210007) ist auf Grund des Verschmelzungsvertrages vom 11.02.2026 und der Beschlüsse der Gesellschafterversammlungen vom selben Tag mit der Gesellschaft verschmolzen.Nicht eingetragen: Den Gläubigern der an der Verschmelzung beteiligten Rechtsträger ist, wenn sie binnen sechs Monaten nach dem Tag, an dem die Eintragung der Verschmelzung nach § 19 Abs. 3 UmwG als bekanntgemacht gilt, ihren Anspruch nach Grund und Höhe schriftlich anmelden, Sicherheit zu leisten, soweit sie nicht Befriedigung verlangen können. Dieses Recht steht ihnen jedoch nur zu, wenn sie glaubhaft machen, dass durch die Verschmelzung die Erfüllung ihrer Forderung gefährdet wird."
    },
    {
      "date": "2026-02-17",
      "id": "145287",
      "original_text": "Registerbekanntmachung nach dem Umwandlungsgesetz\nSachsen-Anhalt Amtsgericht Stendal HRB 210007\nNEW Schweineproduktion GmbH, Großkayna – Braunsbedra",
      "type": "Registerbekanntmachung nach dem Umwandlungsgesetz",
      "state": "Sachsen-Anhalt",
      "amtsgericht": "Amtsgericht Stendal",
      "registernummer": "HRB 210007",
      "registerart": "HRB",
      "company_name": "NEW Schweineproduktion GmbH, Großkayna",
      "company_seat": "Braunsbedra",
      "details": "17.02.2026 (Bekanntmachungsdatum)\n\nSachsen-Anhalt Amtsgericht Stendal HRB 210007\nRegisterbekanntmachung nach dem Umwandlungsgesetz 17.02.2026 (Eintragungsdatum)\n\nNEW Schweineproduktion GmbH, Großkayna\nGesellschaft mit beschränkter Haftung\nBraunsbedra\n\nDie Gesellschaft ist auf Grund des Verschmelzungsvertrages vom 11.02.2026 sowie der Beschlüsse der Gesellschafterversammlungen vom selben Tag mit der Schmidt Verwaltungs-GmbH Großkayna mit dem Sitz in Braunsbedra (Amtsgericht Stendal HRB 208717) verschmolzen. Die Verschmelzung wurde am 17.02.2026 in das Handelsregister der übernehmenden Gesellschaft eingetragen.Nicht eingetragen:Den Gläubigern der an der Verschmelzung beteiligten Rechtsträger ist, wenn sie binnen sechs Monaten nach dem Tag, an dem die Eintragung der Verschmelzung nach § 19 Abs. 3 UmwG als bekanntgemacht gilt, ihren Anspruch nach Grund und Höhe schriftlich anmelden, Sicherheit zu leisten, soweit sie nicht Befriedigung verlangen können. Dieses Recht steht ihnen jedoch nur zu, wenn sie glaubhaft machen, dass durch die Verschmelzung die Erfüllung ihrer Forderung gefährdet wird."
    },
    {
      "date": "2026-02-17",
      "id": "145288",
      "original_text": "Registerbekanntmachung nach dem Umwandlungsgesetz\nSachsen-Anhalt Amtsgericht Stendal HRB 20988\nMaWaGo UG (haftungsbeschränkt) – Gommern",
      "type": "Registerbekanntmachung nach dem Umwandlungsgesetz",
      "state": "Sachsen-Anhalt",
      "amtsgericht": "Amtsgericht Stendal",
      "registernummer": "HRB 20988",
      "registerart": "HRB",
      "company_name": "MaWaGo UG (haftungsbeschränkt)",
      "company_seat": "Gommern",
      "details": "17.02.2026 (Bekanntmachungsdatum)\n\nSachsen-Anhalt Amtsgericht Stendal HRB 20988\nRegisterbekanntmachung nach dem Umwandlungsgesetz 17.02.2026 (Eintragungsdatum)\n\nMaWaGo UG (haftungsbeschränkt)\nGesellschaft mit beschränkter Haftung\nGommern\n\nDie Gesellschaft ist auf Grund des Verschmelzungsvertrages vom 13.11.2025 sowie der Beschlüsse der Gesellschafterversammlungen vom selben Tag mit der Hager Arbeitsschutz- und Hygieneartikel-Vertriebs GmbH mit dem Sitz in Machern (Amtsgericht Leipzig HRB 11477) verschmolzen. Die Verschmelzung wurde am 17.02.2026 in das Handelsregister der übernehmenden Gesellschaft eingetragen. Nicht eingetragen: Den Gläubigern der an der Verschmelzung beteiligten Rechtsträger ist, wenn sie binnen sechs Monaten nach dem Tag, an dem die Eintragung der Verschmelzung nach § 19 Abs. 3 UmwG als bekanntgemacht gilt, ihren Anspruch nach Grund und Höhe schriftlich anmelden, Sicherheit zu leisten, soweit sie nicht Befriedigung verlangen können. Dieses Recht steht ihnen jedoch nur zu, wenn sie glaubhaft machen, dass durch die Verschmelzung die Erfüllung ihrer Forderung gefährdet wird."
    },
    {
      "date": "2026-02-17",
      "id": "145289",
      "original_text": "Registerbekanntmachung nach dem Umwandlungsgesetz\nNordrhein-Westfalen Amtsgericht Coesfeld GnR 159\nRaiffeisen Maria-Veen- Lette eG – Reken",
      "type": "Registerbekanntmachung nach dem Umwandlungsgesetz",
      "state": "Nordrhein-Westfalen",
      "amtsgericht": "Amtsgericht Coesfeld",
      "registernummer": "GnR 159",
      "registerart": "GnR",
      "company_name": "Raiffeisen Maria-Veen- Lette eG",
      "company_seat": "Reken",
      "details": "17.02.2026 (Bekanntmachungsdatum)\n\nNordrhein-Westfalen Amtsgericht Coesfeld GnR 159\nRegisterbekanntmachung nach dem Umwandlungsgesetz 17.02.2026 (Eintragungsdatum)\n\nRaiffeisen Maria-Veen- Lette eG\neingetragene Genossenschaft\nReken\n\nDen Gläubigern der an der Verschmelzung beteiligten Rechtsträger ist, wenn sie binnen sechs Monaten nach dem Tag, an dem die Eintragung der Verschmelzung in das Register des Sitzes derjenigen Rechtsträger deren Gläubiger sie sind, nach § 19 Absatz 3 UmwG als bekanntgemacht gilt, ihren Anspruch nach Grund und Höhe schriftlich anmelden, Sicherheit zu leisten, soweit sie nicht Befriedigung verlangen können. Dieses Recht steht den Gläubigern jedoch nur zu, wenn sie glaubhaft machen, dass durch die Verschmelzung die Erfüllung ihrer Forderung gefährdet wird. Das Recht, Sicherheitsleistung zu verlangen, steht Gläubigern nicht zu, die im Fall des Insolvenzverfahrens ein Recht auf vorzugsweise Befriedigung aus einer Deckungsmasse haben, die nach gesetzlicher Vorschrift zu ihrem Schutz errichtet und staatlich überwacht ist."
    },
    {
      "date": "2026-02-17",
      "id": "145290",
      "original_text": "Löschungsankündigung\nBrandenburg Amtsgericht Potsdam HRB 19976\nSechste Shamrock Grundstücks GmbH – Kloster Lehnin",
      "type": "Löschungsankündigung",
      "state": "Brandenburg",
      "amtsgericht": "Amtsgericht Potsdam",
      "registernummer": "HRB 19976",
      "registerart": "HRB",
      "company_name": "Sechste Shamrock Grundstücks GmbH",
      "company_seat": "Kloster Lehnin",
      "details": "17.02.2026 (Bekanntmachungsdatum)\n\nBrandenburg Amtsgericht Potsdam HRB 19976\nLöschungsankündigung\n\nSechste Shamrock Grundstücks GmbH\nGesellschaft mit beschränkter Haftung\nKloster Lehnin\n\nBei der nachstehenden Gesellschaft wird das Amtslöschungsverfahren gemäß § 394 FamFG eingeleitet. Widerspruchsfrist: 8 Wochen."
    },
    {
      "date": "2026-02-17",
      "id": "145291",
      "original_text": "Löschungsankündigung\nBerlin Amtsgericht Berlin (Charlottenburg) HRB 213988\nBRIQ GmbH – Berlin",
      "type": "Löschungsankündigung",
      "state": "Berlin",
      "amtsgericht": "Amtsgericht Berlin (Charlottenburg)",
      "registernummer": "HRB 213988",
      "registerart": "HRB",
      "company_name": "BRIQ GmbH",
      "company_seat": "Berlin",
      "details": "17.02.2026 (Bekanntmachungsdatum)\n\nBerlin Amtsgericht Berlin (Charlottenburg) HRB 213988\nLöschungsankündigung\n\nBRIQ GmbH\nGesellschaft mit beschränkter Haftung\nBerlin\n\nBei der nachstehenden Gesellschaft wird das Amtslöschungsverfahren gemäß § 394 FamFG eingeleitet. Widerspruchsfrist 6 Wochen"
    },
    {
      "date": "2026-02-17",
      "id": "145292",
      "original_text": "Löschungsankündigung\nMecklenburg-Vorpommern Amtsgericht Neubrandenburg HRB 20854\nHBW Immobilien Handels- und Baugesellschaft Waren Müritz GmbH – Waren (Müritz)",
      "type": "Löschungsankündigung",
      "state": "Mecklenburg-Vorpommern",
      "amtsgericht": "Amtsgericht Neubrandenburg",
      "registernummer": "HRB 20854",
      "registerart": "HRB",
      "company_name": "HBW Immobilien Handels- und Baugesellschaft Waren Müritz GmbH",
      "company_seat": "Waren (Müritz)",
      "details": "17.02.2026 (Bekanntmachungsdatum)\n\nMecklenburg-Vorpommern Amtsgericht Neubrandenburg HRB 20854\nLöschungsankündigung 17.02.2026 (Eintragungsdatum)\n\nHBW Immobilien Handels- und Baugesellschaft Waren Müritz GmbH\nGesellschaft mit beschränkter Haftung\nWaren (Müritz)\n\nDas Registergericht beabsichtigt, die im Handelsregister eingetragene Gesellschaft von Amts wegen nach § 394 FamFG zu löschen. Die Frist zur Erhebung eines Widerspruchs gegen die beabsichtigte Löschung wird auf drei Monate festgesetzt."
    },
    {
      "date": "2026-02-17",
      "id": "145293",
      "original_text": "Registerbekanntmachung nach dem Umwandlungsgesetz\nBaden-Württemberg Amtsgericht Freiburg HRA 709323\nVoya Hotel e. K. – Freiburg im Breisgau",
      "type": "Registerbekanntmachung nach dem Umwandlungsgesetz",
      "state": "Baden-Württemberg",
      "amtsgericht": "Amtsgericht Freiburg",
      "registernummer": "HRA 709323",
      "registerart": "HRA",
      "company_name": "Voya Hotel e. K.",
      "company_seat": "Freiburg im Breisgau",
      "details": "17.02.2026 (Bekanntmachungsdatum)\n\nBaden-Württemberg Amtsgericht Freiburg HRA 709323\nRegisterbekanntmachung nach dem Umwandlungsgesetz 17.02.2026 (Eintragungsdatum)\n\nVoya Hotel e. K.\nEinzelkaufmann / Einzelkauffrau\nFreiburg im Breisgau\n\nAls nicht eingetragen wird bekanntgemacht:\nDen Gläubigern der an der Ausgliederung beteiligten Rechtsträger ist, wenn sie binnen sechs Monaten nach dem Tag, an dem die Eintragung der Ausgliederung in das Register des Sitzes desjenigen Rechtsträgers, dessen Gläubiger sie sind, nach § 19 Abs. 3 UmwG als bekanntgemacht gilt, ihren Anspruch nach Grund und Höhe schriftlich anmelden, Sicherheit zu leisten, soweit sie nicht Befriedigung verlangen können. Dieses Recht steht den Gläubigern jedoch nur zu, wenn sie glaubhaft machen, dass durch die Ausgliederung die Erfüllung ihrer Forderung gefährdet wird."
    },
    {
      "date": "2026-02-17",
      "id": "145294",
      "original_text": "Registerbekanntmachung nach dem Umwandlungsgesetz\nBaden-Württemberg Amtsgericht Freiburg HRA 4502\nAlte Burse GmbH & Co. KG – Freiburg im Breisgau",
      "type": "Registerbekanntmachung nach dem Umwandlungsgesetz",
      "state": "Baden-Württemberg",
      "amtsgericht": "Amtsgericht Freiburg",
      "registernummer": "HRA 4502",
      "registerart": "HRA",
      "company_name": "Alte Burse GmbH & Co. KG",
      "company_seat": "Freiburg im Breisgau",
      "details": "17.02.2026 (Bekanntmachungsdatum)\n\nBaden-Württemberg Amtsgericht Freiburg HRA 4502\nRegisterbekanntmachung nach dem Umwandlungsgesetz 17.02.2026 (Eintragungsdatum)\n\nAlte Burse GmbH & Co. KG\nKommanditgesellschaft\nFreiburg im Breisgau\n\nAls nicht eingetragen wird bekanntgemacht:\nDen Gläubigern der an der Ausgliederung beteiligten Rechtsträger ist, wenn sie binnen sechs Monaten nach dem Tag, an dem die Eintragung der Ausgliederung in das Register des Sitzes desjenigen Rechtsträgers, dessen Gläubiger sie sind, nach § 19 Abs. 3 UmwG als bekanntgemacht gilt, ihren Anspruch nach Grund und Höhe schriftlich anmelden, Sicherheit zu leisten, soweit sie nicht Befriedigung verlangen können. Dieses Recht steht den Gläubigern jedoch nur zu, wenn sie glaubhaft machen, dass durch die Ausgliederung die Erfüllung ihrer Forderung gefährdet wird."
    },
    {
      "date": "2026-02-17",
      "id": "145295",
      "original_text": "Sonstige Registerbekanntmachung\nBaden-Württemberg Amtsgericht Mannheim HRB 3248\nEssity Operations Mannheim GmbH – Mannheim",
      "type": "Sonstige Registerbekanntmachung",
      "state": "Baden-Württemberg",
      "amtsgericht": "Amtsgericht Mannheim",
      "registernummer": "HRB 3248",
      "registerart": "HRB",
      "company_name": "Essity Operations Mannheim GmbH",
      "company_seat": "Mannheim",
      "details": "17.02.2026 (Bekanntmachungsdatum)\n\nBaden-Württemberg Amtsgericht Mannheim HRB 3248\nSonstige Registerbekanntmachung\n\nEssity Operations Mannheim GmbH\nGesellschaft mit beschränkter Haftung\nMannheim\n\nDie Gesellschaft hat am 16.02.2026 die Liste über die Zusammensetzung des Aufsichtsrats zum Handelsregister eingereicht."
    },
    {
      "date": "2026-02-17",
      "id": "145296",
      "original_text": "Löschungsankündigung\nBerlin Amtsgericht Berlin (Charlottenburg) HRB 164426\nFuture Mobility Ventures Beteiligungsgesellschaft mbH – Berlin",
      "type": "Löschungsankündigung",
      "state": "Berlin",
      "amtsgericht": "Amtsgericht Berlin (Charlottenburg)",
      "registernummer": "HRB 164426",
      "registerart": "HRB",
      "company_name": "Future Mobility Ventures Beteiligungsgesellschaft mbH",
      "company_seat": "Berlin",
      "details": "17.02.2026 (Bekanntmachungsdatum)\n\nBerlin Amtsgericht Berlin (Charlottenburg) HRB 164426\nLöschungsankündigung\n\nFuture Mobility Ventures Beteiligungsgesellschaft mbH\nGesellschaft mit beschränkter Haftung\nBerlin\n\nBei der nachstehenden Gesellschaft wird das Amtslöschungsverfahren gemäß § 394 FamFG eingeleitet. Widerspruchsfrist\n6 Wochen."
    },
    {
      "date": "2026-02-17",
      "id": "145297",
      "original_text": "Einreichung neuer Dokumente\nBerlin Amtsgericht Berlin (Charlottenburg) HRB 121596\nCA Customer Alliance GmbH – Berlin",
      "type": "Einreichung neuer Dokumente",
      "state": "Berlin",
      "amtsgericht": "Amtsgericht Berlin (Charlottenburg)",
      "registernummer": "HRB 121596",
      "registerart": "HRB",
      "company_name": "CA Customer Alliance GmbH",
      "company_seat": "Berlin",
      "details": "17.02.2026 (Bekanntmachungsdatum)\n\nBerlin Amtsgericht Berlin (Charlottenburg) HRB 121596\nEinreichung neuer Dokumente\n\nCA Customer Alliance GmbH\nGesellschaft mit beschränkter Haftung\nBerlin\n\nAls nicht eingetragen wird veröffentlicht: Es wurde eine neue Liste der Beiratsmitglieder eingereicht (§ 106 AktG)."
    },
    {
      "date": "2026-02-17",
      "id": "145298",
      "original_text": "Registerbekanntmachung nach dem Umwandlungsgesetz\nBaden-Württemberg Amtsgericht Ulm HRA 729833\nCityTabak Sigmaringen e.K. - Inh. Petra Buomann – Sigmaringen",
      "type": "Registerbekanntmachung nach dem Umwandlungsgesetz",
      "state": "Baden-Württemberg",
      "amtsgericht": "Amtsgericht Ulm",
      "registernummer": "HRA 729833",
      "registerart": "HRA",
      "company_name": "CityTabak Sigmaringen e.K. - Inh. Petra Buomann",
      "company_seat": "Sigmaringen",
      "details": "17.02.2026 (Bekanntmachungsdatum)\n\nBaden-Württemberg Amtsgericht Ulm HRA 729833\nRegisterbekanntmachung nach dem Umwandlungsgesetz 17.02.2026 (Eintragungsdatum)\n\nCityTabak Sigmaringen e.K. - Inh. Petra Buomann\nEinzelkaufmann / Einzelkauffrau\nSigmaringen\n\nAls nicht eingetragen wird bekanntgemacht:\nDen Gläubigern der an der Ausgliederung beteiligten Rechtsträger ist, wenn sie binnen sechs Monaten nach dem Tag, an dem die Eintragung der Ausgliederung in das Register des Sitzes desjenigen Rechtsträgers, dessen Gläubiger sie sind, nach § 19 Abs. 3 UmwG als bekanntgemacht gilt, ihren Anspruch nach Grund und Höhe schriftlich anmelden, Sicherheit zu leisten, soweit sie nicht Befriedigung verlangen können. Dieses Recht steht den Gläubigern jedoch nur zu, wenn sie glaubhaft machen, dass durch die Ausgliederung die Erfüllung ihrer Forderung gefährdet wird."
    },
    {
      "date": "2026-02-17",
      "id": "145299",
      "original_text": "Löschungsankündigung\nBrandenburg Amtsgericht Frankfurt/Oder HRB 20973\nG.M. Europe Security & Service GmbH – Vierlinden",
      "type": "Löschungsankündigung",
      "state": "Brandenburg",
      "amtsgericht": "Amtsgericht Frankfurt/Oder",
      "registernummer": "HRB 20973",
      "registerart": "HRB",
      "company_name": "G.M. Europe Security & Service GmbH",
      "company_seat": "Vierlinden",
      "details": "17.02.2026 (Bekanntmachungsdatum)\n\nBrandenburg Amtsgericht Frankfurt/Oder HRB 20973\nLöschungsankündigung\n\nG.M. Europe Security & Service GmbH\nGesellschaft mit beschränkter Haftung\nVierlinden\n\nBei der nachstehenden Gesellschaft wird das Amtslöschungsverfahren gemäß § 394 FamFG eingeleitet."
    },
    {
      "date": "2026-02-17",
      "id": "145300",
      "original_text": "Löschungsankündigung\nBaden-Württemberg Amtsgericht Mannheim HRB 502734\nWeber & Brugger Zimmerei GmbH – Straubenhardt",
      "type": "Löschungsankündigung",
      "state": "Baden-Württemberg",
      "amtsgericht": "Amtsgericht Mannheim",
      "registernummer": "HRB 502734",
      "registerart": "HRB",
      "company_name": "Weber & Brugger Zimmerei GmbH",
      "company_seat": "Straubenhardt",
      "details": "17.02.2026 (Bekanntmachungsdatum)\n\nBaden-Württemberg Amtsgericht Mannheim HRB 502734\nLöschungsankündigung\n\nWeber & Brugger Zimmerei GmbH\nGesellschaft mit beschränkter Haftung\nStraubenhardt\n\nDas Gericht beabsichtigt, die Gesellschaft wegen Vermögenslosigkeit im Handelsregister von Amts wegen nach § 394 FamFG zu löschen. Die Frist zur Geltendmachung eines Widerspruchs gegen die beabsichtigte Löschung ist auf einen Monat ab Veröffentlichung bestimmt."
    },
    {
      "date": "2026-02-17",
      "id": "145301",
      "original_text": "Löschungsankündigung\nSachsen Amtsgericht Dresden HRB 7940\nExtra-form Objektausstattung GmbH – Dresden",
      "type": "Löschungsankündigung",
      "state": "Sachsen",
      "amtsgericht": "Amtsgericht Dresden",
      "registernummer": "HRB 7940",
      "registerart": "HRB",
      "company_name": "Extra-form Objektausstattung GmbH",
      "company_seat": "Dresden",
      "details": "17.02.2026 (Bekanntmachungsdatum)\n\nSachsen Amtsgericht Dresden HRB 7940\nLöschungsankündigung\n\nExtra-form Objektausstattung GmbH\nGesellschaft mit beschränkter Haftung\nDresden\n\nDas Registergericht beabsichtigt, die im Handelsregister eingetragene Gesellschaft von Amts wegen nach § 394 FamFG zu löschen. Die Frist zu Erhebung eines Widerspruchs gegen die beabsichtigte Löschung wird auf einen Monat festgesetzt."
    },
    {
      "date": "2026-02-17",
      "id": "145302",
      "original_text": "Registerbekanntmachung nach dem Umwandlungsgesetz\nSachsen Amtsgericht Chemnitz HRB 35985\nITC Immobilien GmbH – Chemnitz",
      "type": "Registerbekanntmachung nach dem Umwandlungsgesetz",
      "state": "Sachsen",
      "amtsgericht": "Amtsgericht Chemnitz",
      "registernummer": "HRB 35985",
      "registerart": "HRB",
      "company_name": "ITC Immobilien GmbH",
      "company_seat": "Chemnitz",
      "details": "17.02.2026 (Bekanntmachungsdatum)\n\nSachsen Amtsgericht Chemnitz HRB 35985\nRegisterbekanntmachung nach dem Umwandlungsgesetz 17.02.2026 (Eintragungsdatum)\n\nITC Immobilien GmbH\nGesellschaft mit beschränkter Haftung\nChemnitz\n\nDen Gläubigern der an der Verschmelzung beteiligten Rechtsträger ist, wenn sie binnen sechs Monaten nach dem Tag, an dem die Eintragung der Verschmelzung in das Register des Sitzes desjenigen Rechtsträgers, dessen Gläubiger sie sind, nach § 19 Abs. 3 UmwG als bekannt gemacht gilt, ihren Anspruch nach Grund und Höhe in Textform anmelden, Sicherheit zu leisten, soweit sie nicht Befriedigung verlangen können. Dieses Recht steht den Gläubigern jedoch nur zu, wenn sie glaubhaft machen, dass durch die Verschmelzung die Erfüllung der Forderung gefährdet wird."
    },
    {
      "date": "2026-02-17",
      "id": "145303",
      "original_text": "Registerbekanntmachung nach dem Umwandlungsgesetz\nSachsen Amtsgericht Dresden HRB 47652\nBauunternehmen Michael Posselt GmbH – Mittelherwigsdorf",
      "type": "Registerbekanntmachung nach dem Umwandlungsgesetz",
      "state": "Sachsen",
      "amtsgericht": "Amtsgericht Dresden",
      "registernummer": "HRB 47652",
      "registerart": "HRB",
      "company_name": "Bauunternehmen Michael Posselt GmbH",
      "company_seat": "Mittelherwigsdorf",
      "details": "17.02.2026 (Bekanntmachungsdatum)\n\nSachsen Amtsgericht Dresden HRB 47652\nRegisterbekanntmachung nach dem Umwandlungsgesetz 17.02.2026 (Eintragungsdatum)\n\nBauunternehmen Michael Posselt GmbH\nGesellschaft mit beschränkter Haftung\nMittelherwigsdorf\n\nDen Gläubigern der an der Ausgliederung beteiligten Rechtsträger ist, wenn sie binnen sechs Monaten nach dem Tag, an dem die Eintragung der Ausgliederung in das Register des Sitzes desjenigen Rechtsträgers, dessen Gläubiger sie sind, nach § 19 Abs. 3 UmwG als bekannt gemacht gilt, ihren Anspruch nach Grund und Höhe in Textform anmelden, Sicherheit zu leisten, soweit sie nicht Befriedigung verlangen können. Dieses Recht steht den Gläubigern jedoch nur zu, wenn sie glaubhaft machen, dass durch die Ausgliederung die Erfüllung der Forderung gefährdet wird."
    },
    {
      "date": "2026-02-17",
      "id": "145304",
      "original_text": "Registerbekanntmachung nach dem Umwandlungsgesetz\nSachsen Amtsgericht Chemnitz HRB 834\nITC Industrie- und Technologiepark HECKERT GmbH Chemnitz – Chemnitz",
      "type": "Registerbekanntmachung nach dem Umwandlungsgesetz",
      "state": "Sachsen",
      "amtsgericht": "Amtsgericht Chemnitz",
      "registernummer": "HRB 834",
      "registerart": "HRB",
      "company_name": "ITC Industrie- und Technologiepark HECKERT GmbH Chemnitz",
      "company_seat": "Chemnitz",
      "details": "17.02.2026 (Bekanntmachungsdatum)\n\nSachsen Amtsgericht Chemnitz HRB 834\nRegisterbekanntmachung nach dem Umwandlungsgesetz 17.02.2026 (Eintragungsdatum)\n\nITC Industrie- und Technologiepark HECKERT GmbH Chemnitz\nGesellschaft mit beschränkter Haftung\nChemnitz\n\nDen Gläubigern der an der Verschmelzung beteiligten Rechtsträger ist, wenn sie binnen sechs Monaten nach dem Tag, an dem die Eintragung der Verschmelzung in das Register des Sitzes desjenigen Rechtsträgers, dessen Gläubiger sie sind, nach § 19 Abs. 3 UmwG als bekannt gemacht gilt, ihren Anspruch nach Grund und Höhe in Textform anmelden, Sicherheit zu leisten, soweit sie nicht Befriedigung verlangen können. Dieses Recht steht den Gläubigern jedoch nur zu, wenn sie glaubhaft machen, dass durch die Verschmelzung die Erfüllung der Forderung gefährdet wird."
    },
    {
      "date": "2026-02-17",
      "id": "145305",
      "original_text": "Registerbekanntmachung nach dem Umwandlungsgesetz\nSachsen Amtsgericht Leipzig HRB 11477\nHager Arbeitsschutz- und Hygieneartikel-Vertriebs GmbH – Machern",
      "type": "Registerbekanntmachung nach dem Umwandlungsgesetz",
      "state": "Sachsen",
      "amtsgericht": "Amtsgericht Leipzig",
      "registernummer": "HRB 11477",
      "registerart": "HRB",
      "company_name": "Hager Arbeitsschutz- und Hygieneartikel-Vertriebs GmbH",
      "company_seat": "Machern",
      "details": "17.02.2026 (Bekanntmachungsdatum)\n\nSachsen Amtsgericht Leipzig HRB 11477\nRegisterbekanntmachung nach dem Umwandlungsgesetz 17.02.2026 (Eintragungsdatum)\n\nHager Arbeitsschutz- und Hygieneartikel-Vertriebs GmbH\nGesellschaft mit beschränkter Haftung\nMachern\n\nDen Gläubigern der an der Verschmelzung beteiligten Rechtsträger ist, wenn sie binnen sechs Monaten nach dem Tag, an dem die Eintragung der Verschmelzung in das Register des Sitzes desjenigen Rechtsträgers, dessen Gläubiger sie sind, nach § 19 Abs. 3 UmwG als bekannt gemacht gilt, ihren Anspruch nach Grund und Höhe in Textform anmelden, Sicherheit zu leisten, soweit sie nicht Befriedigung verlangen können. Dieses Recht steht den Gläubigern jedoch nur zu, wenn sie glaubhaft machen, dass durch die Verschmelzung die Erfüllung der Forderung gefährdet wird."
    },
    {
      "date": "2026-02-17",
      "id": "145306",
      "original_text": "Registerbekanntmachung nach dem Umwandlungsgesetz\nSachsen Amtsgericht Dresden HRA 12454\nBauunternehmen Michael Posselt e.K. – Mittelherwigsdorf",
      "type": "Registerbekanntmachung nach dem Umwandlungsgesetz",
      "state": "Sachsen",
      "amtsgericht": "Amtsgericht Dresden",
      "registernummer": "HRA 12454",
      "registerart": "HRA",
      "company_name": "Bauunternehmen Michael Posselt e.K.",
      "company_seat": "Mittelherwigsdorf",
      "details": "17.02.2026 (Bekanntmachungsdatum)\n\nSachsen Amtsgericht Dresden HRA 12454\nRegisterbekanntmachung nach dem Umwandlungsgesetz 17.02.2026 (Eintragungsdatum)\n\nBauunternehmen Michael Posselt e.K.\nEinzelkaufmann / Einzelkauffrau\nMittelherwigsdorf\n\nDen Gläubigern der an der Ausgliederung beteiligten Rechtsträger ist, wenn sie binnen sechs Monaten nach dem Tag, an dem die Eintragung der Ausgliederung in das Register des Sitzes desjenigen Rechtsträgers, dessen Gläubiger sie sind, nach § 19 Abs. 3 UmwG als bekannt gemacht gilt, ihren Anspruch nach Grund und Höhe in Textform anmelden, Sicherheit zu leisten, soweit sie nicht Befriedigung verlangen können. Dieses Recht steht den Gläubigern jedoch nur zu, wenn sie glaubhaft machen, dass durch die Ausgliederung die Erfüllung der Forderung gefährdet wird."
    },
    {
      "date": "2026-02-17",
      "id": "145307",
      "original_text": "Sonstige Registerbekanntmachung\nSachsen Amtsgericht Leipzig HRB 32276\nDBD Services AG – Leipzig",
      "type": "Sonstige Registerbekanntmachung",
      "state": "Sachsen",
      "amtsgericht": "Amtsgericht Leipzig",
      "registernummer": "HRB 32276",
      "registerart": "HRB",
      "company_name": "DBD Services AG",
      "company_seat": "Leipzig",
      "details": "17.02.2026 (Bekanntmachungsdatum)\n\nSachsen Amtsgericht Leipzig HRB 32276\nSonstige Registerbekanntmachung 17.02.2026 (Eintragungsdatum)\n\nDBD Services AG\nAktiengesellschaft\nLeipzig\n\nAm 17.02.2026 wurde beim Handelsregister des Amtsgerichts Leipzig die Liste der Mitglieder des Aufsichtsrats gemäß § 106 AktG eingereicht."
    },
    {
      "date": "2026-02-17",
      "id": "145308",
      "original_text": "Löschungsankündigung\nSachsen Amtsgericht Dresden HRB 27523\nM.A.R. EIMU Dienstleistungs- und Service GmbH – Großenhain",
      "type": "Löschungsankündigung",
      "state": "Sachsen",
      "amtsgericht": "Amtsgericht Dresden",
      "registernummer": "HRB 27523",
      "registerart": "HRB",
      "company_name": "M.A.R. EIMU Dienstleistungs- und Service GmbH",
      "company_seat": "Großenhain",
      "details": "17.02.2026 (Bekanntmachungsdatum)\n\nSachsen Amtsgericht Dresden HRB 27523\nLöschungsankündigung\n\nM.A.R. EIMU Dienstleistungs- und Service GmbH\nGesellschaft mit beschränkter Haftung\nGroßenhain\n\nDas Registergericht beabsichtigt, die im Handelsregister eingetragene Gesellschaft von Amts wegen nach § 394 FamFG zu löschen. Die Frist zu Erhebung eines Widerspruchs gegen die beabsichtigte Löschung wird auf einen Monat festgesetzt."
    },
    {
      "date": "2026-02-17",
      "id": "145309",
      "original_text": "Löschungsankündigung\nSachsen Amtsgericht Dresden HRB 4230\nAuto Hofmann GmbH – Schöpstal",
      "type": "Löschungsankündigung",
      "state": "Sachsen",
      "amtsgericht": "Amtsgericht Dresden",
      "registernummer": "HRB 4230",
      "registerart": "HRB",
      "company_name": "Auto Hofmann GmbH",
      "company_seat": "Schöpstal",
      "details": "17.02.2026 (Bekanntmachungsdatum)\n\nSachsen Amtsgericht Dresden HRB 4230\nLöschungsankündigung\n\nAuto Hofmann GmbH\nGesellschaft mit beschränkter Haftung\nSchöpstal\n\nDas Registergericht beabsichtigt, die im Handelsregister eingetragene Gesellschaft von Amts wegen nach § 394 FamFG zu löschen. Die Frist zu Erhebung eines Widerspruchs gegen die beabsichtigte Löschung wird auf einen Monat festgesetzt."
    },
    {
      "date": "2026-02-17",
      "id": "145310",
      "original_text": "Registerbekanntmachung nach dem Umwandlungsgesetz\nNiedersachsen Amtsgericht Hannover HRB 217816\nBlue Eyes Innovations GmbH – Hannover",
      "type": "Registerbekanntmachung nach dem Umwandlungsgesetz",
      "state": "Niedersachsen",
      "amtsgericht": "Amtsgericht Hannover",
      "registernummer": "HRB 217816",
      "registerart": "HRB",
      "company_name": "Blue Eyes Innovations GmbH",
      "company_seat": "Hannover",
      "details": "17.02.2026 (Bekanntmachungsdatum)\n\nNiedersachsen Amtsgericht Hannover HRB 217816\nRegisterbekanntmachung nach dem Umwandlungsgesetz 17.02.2026 (Eintragungsdatum)\n\nBlue Eyes Innovations GmbH\nGesellschaft mit beschränkter Haftung\nHannover\n\nDen Gläubigern der an der Verschmelzung beteiligten Rechtsträger ist, wenn sie binnen sechs Monaten nach dem Tag, an dem die Eintragung der Verschmelzung in das Register des Sitzes desjenigen Rechtsträgers, dessen Gläubiger sie sind, nach § 19  Abs.  3 UmwG als bekannt gemacht gilt, ihren Anspruch nach Grund und Höhe schriftlich anmelden, Sicherheit zu leisten, soweit sie nicht Befriedigung verlangen können. Dieses Recht steht den Gläubigern jedoch nur zu, wenn sie glaubhaft machen, dass durch die Verschmelzung die Erfüllung der Forderung gefährdet wird."
    },
    {
      "date": "2026-02-17",
      "id": "145311",
      "original_text": "Registerbekanntmachung nach dem Umwandlungsgesetz\nNiedersachsen Amtsgericht Göttingen HRA 202358\nLUP Kohl e. K. – Göttingen",
      "type": "Registerbekanntmachung nach dem Umwandlungsgesetz",
      "state": "Niedersachsen",
      "amtsgericht": "Amtsgericht Göttingen",
      "registernummer": "HRA 202358",
      "registerart": "HRA",
      "company_name": "LUP Kohl e. K.",
      "company_seat": "Göttingen",
      "details": "17.02.2026 (Bekanntmachungsdatum)\n\nNiedersachsen Amtsgericht Göttingen HRA 202358\nRegisterbekanntmachung nach dem Umwandlungsgesetz 17.02.2026 (Eintragungsdatum)\n\nLUP Kohl e. K.\nEinzelkaufmann / Einzelkauffrau\nGöttingen\n\nDen Gläubigern der an der Ausgliederung beteiligten Rechtsträger ist, wenn sie binnen sechs Monaten nach dem Tag, an dem die Eintragung der Ausgliederung in das Register des Sitzes desjenigen Rechtsträgers, dessen Gläubiger sie sind, nach § 19 Abs. 3 UmwG als bekannt gemacht gilt, ihren Anspruch nach Grund und Höhe schriftlich anmelden, Sicherheit zu leisten, soweit sie nicht Befriedigung verlangen können. Dieses Recht steht den Gläubigern jedoch nur zu, wenn sie glaubhaft machen, dass durch die Ausgliederung die Erfüllung der Forderung gefährdet wird."
    },
    {
      "date": "2026-02-17",
      "id": "145312",
      "original_text": "Registerbekanntmachung nach dem Umwandlungsgesetz\nNiedersachsen Amtsgericht Hannover HRB 120993 früher Amtsgericht Burgwedel\nABC Schuh-Center GmbH – Wedemark",
      "type": "Registerbekanntmachung nach dem Umwandlungsgesetz",
      "state": "Niedersachsen",
      "amtsgericht": "Amtsgericht Hannover",
      "registernummer": "HRB 120993",
      "registerart": "HRB",
      "company_name": "ABC Schuh-Center GmbH",
      "company_seat": "Wedemark",
      "former_amtsgericht": "Burgwedel",
      "details": "17.02.2026 (Bekanntmachungsdatum)\n\nNiedersachsen Amtsgericht Hannover HRB 120993 früher Amtsgericht Burgwedel\nRegisterbekanntmachung nach dem Umwandlungsgesetz 17.02.2026 (Eintragungsdatum)\n\nABC Schuh-Center GmbH\nGesellschaft mit beschränkter Haftung\nWedemark\n\nDen Gläubigern der an der Verschmelzung beteiligten Rechtsträger ist, wenn sie binnen sechs Monaten nach dem Tag, an dem die Eintragung der Verschmelzung in das Register des Sitzes desjenigen Rechtsträgers, dessen Gläubiger sie sind, nach § 19  Abs.  3 UmwG als bekannt gemacht gilt, ihren Anspruch nach Grund und Höhe schriftlich anmelden, Sicherheit zu leisten, soweit sie nicht Befriedigung verlangen können. Dieses Recht steht den Gläubigern jedoch nur zu, wenn sie glaubhaft machen, dass durch die Verschmelzung die Erfüllung der Forderung gefährdet wird."
    },
    {
      "date": "2026-02-17",
      "id": "145313",
      "original_text": "Einreichung neuer Dokumente\nNiedersachsen Amtsgericht Hannover HRB 219317\nEntwicklungsgesellschaft Isernhagen GmbH – Isernhagen",
      "type": "Einreichung neuer Dokumente",
      "state": "Niedersachsen",
      "amtsgericht": "Amtsgericht Hannover",
      "registernummer": "HRB 219317",
      "registerart": "HRB",
      "company_name": "Entwicklungsgesellschaft Isernhagen GmbH",
      "company_seat": "Isernhagen",
      "details": "17.02.2026 (Bekanntmachungsdatum)\n\nNiedersachsen Amtsgericht Hannover HRB 219317\nEinreichung neuer Dokumente\n\nEntwicklungsgesellschaft Isernhagen GmbH\nGesellschaft mit beschränkter Haftung\nIsernhagen\n\nDie Liste der Mitglieder des Aufsichtsrats wurde beim Registergericht eingereicht."
    },
    {
      "date": "2026-02-17",
      "id": "145314",
      "original_text": "Registerbekanntmachung nach dem Umwandlungsgesetz\nNiedersachsen Amtsgericht Göttingen HRB 120145\n\"Stadtwerke Bad Sachsa Gesellschaft mit beschränkter Haftung\" – Bad Sachsa",
      "type": "Registerbekanntmachung nach dem Umwandlungsgesetz",
      "state": "Niedersachsen",
      "amtsgericht": "Amtsgericht Göttingen",
      "registernummer": "HRB 120145",
      "registerart": "HRB",
      "company_name": "\"Stadtwerke Bad Sachsa Gesellschaft mit beschränkter Haftung\"",
      "company_seat": "Bad Sachsa",
      "details": "17.02.2026 (Bekanntmachungsdatum)\n\nNiedersachsen Amtsgericht Göttingen HRB 120145\nRegisterbekanntmachung nach dem Umwandlungsgesetz 17.02.2026 (Eintragungsdatum)\n\n\"Stadtwerke Bad Sachsa Gesellschaft mit beschränkter Haftung\"\nGesellschaft mit beschränkter Haftung\nBad Sachsa\n\nDen Gläubigern der Gesellschaft, deren Forderungen begründet worden sind, bevor die Eintragung der Beendigung des Vertrages in das Handelsregister nach § 10 HGB als bekanntgemacht gilt, ist vom anderen Vertragsteil Sicherheit zu leisten, wenn sie sich binnen sechs Monaten nach der Bekanntmachung zu diesem Zweck bei ihm melden."
    },
    {
      "date": "2026-02-17",
      "id": "145315",
      "original_text": "Löschungsankündigung\nNiedersachsen Amtsgericht Braunschweig HRB 207416\nAprobaTeQ Engineering Products GmbH – Schöppenstedt",
      "type": "Löschungsankündigung",
      "state": "Niedersachsen",
      "amtsgericht": "Amtsgericht Braunschweig",
      "registernummer": "HRB 207416",
      "registerart": "HRB",
      "company_name": "AprobaTeQ Engineering Products GmbH",
      "company_seat": "Schöppenstedt",
      "details": "17.02.2026 (Bekanntmachungsdatum)\n\nNiedersachsen Amtsgericht Braunschweig HRB 207416\nLöschungsankündigung 17.02.2026 (Eintragungsdatum)\n\nAprobaTeQ Engineering Products GmbH\nGesellschaft mit beschränkter Haftung\nSchöppenstedt\n\nDas Registergericht beabsichtigt, die Gesellschaft von Amts wegen nach § 394 FamFG zu löschen. Die Frist zur Erhebung eines Widerspruchs ist auf 1 Monat ab dieser Registerbekanntmachung festgesetzt."
    },
    {
      "date": "2026-02-17",
      "id": "145316",
      "original_text": "Registerbekanntmachung nach dem Umwandlungsgesetz\nNiedersachsen Amtsgericht Göttingen HRA 202388\nLUP Kohl GmbH & Co. KG – Göttingen",
      "type": "Registerbekanntmachung nach dem Umwandlungsgesetz",
      "state": "Niedersachsen",
      "amtsgericht": "Amtsgericht Göttingen",
      "registernummer": "HRA 202388",
      "registerart": "HRA",
      "company_name": "LUP Kohl GmbH & Co. KG",
      "company_seat": "Göttingen",
      "details": "17.02.2026 (Bekanntmachungsdatum)\n\nNiedersachsen Amtsgericht Göttingen HRA 202388\nRegisterbekanntmachung nach dem Umwandlungsgesetz 17.02.2026 (Eintragungsdatum)\n\nLUP Kohl GmbH & Co. KG\nKommanditgesellschaft\nGöttingen\n\nDen Gläubigern der an der Ausgliederung beteiligten Rechtsträger ist, wenn sie binnen sechs Monaten nach dem Tag, an dem die Eintragung der Ausgliederung in das Register des Sitzes desjenigen Rechtsträgers, dessen Gläubiger sie sind, nach § 19 Abs. 3 UmwG als bekannt gemacht gilt, ihren Anspruch nach Grund und Höhe schriftlich anmelden, Sicherheit zu leisten, soweit sie nicht Befriedigung verlangen können. Dieses Recht steht den Gläubigern jedoch nur zu, wenn sie glaubhaft machen, dass durch die Ausgliederung die Erfüllung der Forderung gefährdet wird."
    },
    {
      "date": "2026-02-17",
      "id": "145317",
      "original_text": "Einreichung neuer Dokumente\nNiedersachsen Amtsgericht Göttingen HRB 130504 früher Amtsgericht Northeim\nHermann GmbH – Northeim",
      "type": "Einreichung neuer Dokumente",
      "state": "Niedersachsen",
      "amtsgericht": "Amtsgericht Göttingen",
      "registernummer": "HRB 130504",
      "registerart": "HRB",
      "company_name": "Hermann GmbH",
      "company_seat": "Northeim",
      "former_amtsgericht": "Northeim",
      "details": "17.02.2026 (Bekanntmachungsdatum)\n\nNiedersachsen Amtsgericht Göttingen HRB 130504 früher Amtsgericht Northeim\nEinreichung neuer Dokumente 17.02.2026 (Eintragungsdatum)\n\nHermann GmbH\nGesellschaft mit beschränkter Haftung\nNortheim\n\nDie Liste der Mitglieder des Aufsichtsrats wurde beim Registergericht eingereicht."
    },
    {
      "date": "2026-02-17",
      "id": "145318",
      "original_text": "Einreichung neuer Dokumente\nNiedersachsen Amtsgericht Göttingen HRB 201764\nAWO Göttingen gemeinnützige GmbH – Göttingen",
      "type": "Einreichung neuer Dokumente",
      "state": "Niedersachsen",
      "amtsgericht": "Amtsgericht Göttingen",
      "registernummer": "HRB 201764",
      "registerart": "HRB",
      "company_name": "AWO Göttingen gemeinnützige GmbH",
      "company_seat": "Göttingen",
      "details": "17.02.2026 (Bekanntmachungsdatum)\n\nNiedersachsen Amtsgericht Göttingen HRB 201764\nEinreichung neuer Dokumente\n\nAWO Göttingen gemeinnützige GmbH\nGesellschaft mit beschränkter Haftung\nGöttingen\n\nDie Liste der Mitglieder des Aufsichtsrats wurde beim Registergericht eingereicht."
    },
    {
      "date": "2026-02-17",
      "id": "145319",
      "original_text": "Registerbekanntmachung nach dem Umwandlungsgesetz\nNiedersachsen Amtsgericht Braunschweig HRB 205565\nPrevent Real Estate TGrad GmbH – Wolfsburg",
      "type": "Registerbekanntmachung nach dem Umwandlungsgesetz",
      "state": "Niedersachsen",
      "amtsgericht": "Amtsgericht Braunschweig",
      "registernummer": "HRB 205565",
      "registerart": "HRB",
      "company_name": "Prevent Real Estate TGrad GmbH",
      "company_seat": "Wolfsburg",
      "details": "17.02.2026 (Bekanntmachungsdatum)\n\nNiedersachsen Amtsgericht Braunschweig HRB 205565\nRegisterbekanntmachung nach dem Umwandlungsgesetz 17.02.2026 (Eintragungsdatum)\n\nPrevent Real Estate TGrad GmbH\nGesellschaft mit beschränkter Haftung\nWolfsburg\n\nDen Gläubigern der an der Verschmelzung beteiligten Rechtsträger ist, wenn sie binnen sechs Monaten nach dem Tag, an dem die Eintragung der Verschmelzung in das Register des Sitzes desjenigen Rechtsträgers, dessen Gläubiger sie sind, nach § 19  Abs.  3 UmwG als bekannt gemacht gilt, ihren Anspruch nach Grund und Höhe schriftlich anmelden, Sicherheit zu leisten, soweit sie nicht Befriedigung verlangen können. Dieses Recht steht den Gläubigern jedoch nur zu, wenn sie glaubhaft machen, dass durch die Verschmelzung die Erfüllung der Forderung gefährdet wird."
    },
    {
      "date": "2026-02-17",
      "id": "145320",
      "original_text": "Löschungsankündigung\nNiedersachsen Amtsgericht Hannover HRB 203904\nAktiva-Service GmbH – Hannover",
      "type": "Löschungsankündigung",
      "state": "Niedersachsen",
      "amtsgericht": "Amtsgericht Hannover",
      "registernummer": "HRB 203904",
      "registerart": "HRB",
      "company_name": "Aktiva-Service GmbH",
      "company_seat": "Hannover",
      "details": "17.02.2026 (Bekanntmachungsdatum)\n\nNiedersachsen Amtsgericht Hannover HRB 203904\nLöschungsankündigung 16.02.2026 (Eintragungsdatum)\n\nAktiva-Service GmbH\nGesellschaft mit beschränkter Haftung\nHannover\n\nDas Registergericht beabsichtigt, die Gesellschaft von Amts wegen nach § 394 FamFG zu löschen. Die Frist zur Erhebung eines Widerspruchs ist auf 1 Monat ab dieser Registerbekanntmachung festgesetzt."
    },
    {
      "date": "2026-02-17",
      "id": "145321",
      "original_text": "Einreichung neuer Dokumente\nNiedersachsen Amtsgericht Oldenburg (Oldenburg) HRB 201530\nALTE OLDENBURGER Beteiligungsgesellschaft AG – Vechta",
      "type": "Einreichung neuer Dokumente",
      "state": "Niedersachsen",
      "amtsgericht": "Amtsgericht Oldenburg (Oldenburg)",
      "registernummer": "HRB 201530",
      "registerart": "HRB",
      "company_name": "ALTE OLDENBURGER Beteiligungsgesellschaft AG",
      "company_seat": "Vechta",
      "details": "17.02.2026 (Bekanntmachungsdatum)\n\nNiedersachsen Amtsgericht Oldenburg (Oldenburg) HRB 201530\nEinreichung neuer Dokumente\n\nALTE OLDENBURGER Beteiligungsgesellschaft AG\nAktiengesellschaft\nVechta\n\nDie Liste der Mitglieder des Aufsichtsrats wurde beim Registergericht eingereicht."
    },
    {
      "date": "2026-02-17",
      "id": "145322",
      "original_text": "Registerbekanntmachung nach dem Umwandlungsgesetz\nNiedersachsen Amtsgericht Hannover HRB 201272\nKienast Beteiligungsgesellschaft mbH – Wedemark",
      "type": "Registerbekanntmachung nach dem Umwandlungsgesetz",
      "state": "Niedersachsen",
      "amtsgericht": "Amtsgericht Hannover",
      "registernummer": "HRB 201272",
      "registerart": "HRB",
      "company_name": "Kienast Beteiligungsgesellschaft mbH",
      "company_seat": "Wedemark",
      "details": "17.02.2026 (Bekanntmachungsdatum)\n\nNiedersachsen Amtsgericht Hannover HRB 201272\nRegisterbekanntmachung nach dem Umwandlungsgesetz 17.02.2026 (Eintragungsdatum)\n\nKienast Beteiligungsgesellschaft mbH\nGesellschaft mit beschränkter Haftung\nWedemark\n\nDen Gläubigern der an der Verschmelzung beteiligten Rechtsträger ist, wenn sie binnen sechs Monaten nach dem Tag, an dem die Eintragung der Verschmelzung in das Register des Sitzes desjenigen Rechtsträgers, dessen Gläubiger sie sind, nach § 19  Abs.  3 UmwG als bekannt gemacht gilt, ihren Anspruch nach Grund und Höhe schriftlich anmelden, Sicherheit zu leisten, soweit sie nicht Befriedigung verlangen können. Dieses Recht steht den Gläubigern jedoch nur zu, wenn sie glaubhaft machen, dass durch die Verschmelzung die Erfüllung der Forderung gefährdet wird."
    },
    {
      "date": "2026-02-17",
      "id": "145323",
      "original_text": "Löschungsankündigung\nRheinland-Pfalz Amtsgericht Mainz HRB 49196\nPAM Hoch- und Tiefbau GmbH – Mainz",
      "type": "Löschungsankündigung",
      "state": "Rheinland-Pfalz",
      "amtsgericht": "Amtsgericht Mainz",
      "registernummer": "HRB 49196",
      "registerart": "HRB",
      "company_name": "PAM Hoch- und Tiefbau GmbH",
      "company_seat": "Mainz",
      "details": "17.02.2026 (Bekanntmachungsdatum)\n\nRheinland-Pfalz Amtsgericht Mainz HRB 49196\nLöschungsankündigung\n\nPAM Hoch- und Tiefbau GmbH\nGesellschaft mit beschränkter Haftung\nMainz\n\nDas Registergericht beabsichtigt die Gesellschaft von Amts wegen nach § 394 FamFG zu löschen. Die Frist zur Erhebung eines Widerspruchs ist auf einen Monat festgesetzt."
    },
    {
      "date": "2026-02-17",
      "id": "145324",
      "original_text": "Registerbekanntmachung nach dem Umwandlungsgesetz\nRheinland-Pfalz Amtsgericht Bad Kreuznach GsR 100\nAmbulantes Pflegeteam David Bohn und Susanne Dech-Martin eGbR – Bad Sobernheim",
      "type": "Registerbekanntmachung nach dem Umwandlungsgesetz",
      "state": "Rheinland-Pfalz",
      "amtsgericht": "Amtsgericht Bad Kreuznach",
      "registernummer": "GsR 100",
      "registerart": "GsR",
      "company_name": "Ambulantes Pflegeteam David Bohn und Susanne Dech-Martin eGbR",
      "company_seat": "Bad Sobernheim",
      "details": "17.02.2026 (Bekanntmachungsdatum)\n\nRheinland-Pfalz Amtsgericht Bad Kreuznach GsR 100\nRegisterbekanntmachung nach dem Umwandlungsgesetz 17.02.2026 (Eintragungsdatum)\n\nAmbulantes Pflegeteam David Bohn und Susanne Dech-Martin eGbR\nGesellschaft bürgerlichen Rechts\nBad Sobernheim\n\nAls nicht eingetragen wird veröffentlicht:\nDen Gläubigern des formwechselnden Rechtsträgers ist, wenn sie binnen sechs Monaten nach dem Tag, an dem die Eintragung des Formwechsels nach § 201 UmwG als bekannt gemacht gilt, ihren Anspruch nach Grund und Höhe schriftlich anmelden, Sicherheit zu leisten, soweit sie nicht Befriedigung verlangen können. Dieses Recht steht den Gläubigern jedoch nur zu, wenn sie glaubhaft machen, dass durch den Formwechsel die Erfüllung der Forderung gefährdet wird."
    },
    {
      "date": "2026-02-17",
      "id": "145325",
      "original_text": "Löschungsankündigung\nNordrhein-Westfalen Amtsgericht Dortmund HRB 28315\nRheinische Projektgesellschaft mbH – Dortmund",
      "type": "Löschungsankündigung",
      "state": "Nordrhein-Westfalen",
      "amtsgericht": "Amtsgericht Dortmund",
      "registernummer": "HRB 28315",
      "registerart": "HRB",
      "company_name": "Rheinische Projektgesellschaft mbH",
      "company_seat": "Dortmund",
      "details": "17.02.2026 (Bekanntmachungsdatum)\n\nNordrhein-Westfalen Amtsgericht Dortmund HRB 28315\nLöschungsankündigung\n\nRheinische Projektgesellschaft mbH\nGesellschaft mit beschränkter Haftung\nDortmund\n\nDas Registergericht beabsichtigt die Gesellschaft von Amts wegen nach § 394 FamFG zu löschen. Die Frist zur Erhebung eines Widerspruchs ist auf zwei Monate festgesetzt."
    },
    {
      "date": "2026-02-17",
      "id": "145326",
      "original_text": "Löschungsankündigung\nNordrhein-Westfalen Amtsgericht Aachen HRB 17183\nEishalle-Events GmbH – Aachen",
      "type": "Löschungsankündigung",
      "state": "Nordrhein-Westfalen",
      "amtsgericht": "Amtsgericht Aachen",
      "registernummer": "HRB 17183",
      "registerart": "HRB",
      "company_name": "Eishalle-Events GmbH",
      "company_seat": "Aachen",
      "details": "17.02.2026 (Bekanntmachungsdatum)\n\nNordrhein-Westfalen Amtsgericht Aachen HRB 17183\nLöschungsankündigung\n\nEishalle-Events GmbH\nGesellschaft mit beschränkter Haftung\nAachen\n\nRegistergericht beabsichtigt, von Amts wegen die Gesellschaft wegen\nVermögenslosigkeit nach § 394 FamFG zu löschen, weil das Finanzamt Aachen-Stadt mit Schreiben vom 05.12.2025 und 12.01.2026 Umstände mitgeteilt hat, aufgrund derer das Gericht davon überzeugt ist, dass die\nGesellschaft vollständig vermögenslos ist. Zur Geltendmachung des Widerspruchs gegen die beabsichtigte Löschung wird\nhiermit eine Frist von einem Monat ab Veröffentlichung dieser Ankündigung\nbestimmt.Das Registergericht beabsichtigt, von Amts wegen die Gesellschaft wegen Vermögenslosigkeit nach § 394 FamFG zu löschen.\n\nZur Geltendmachung des Widerspruchs gegen die beabsichtigte Löschung wird hiermit eine Frist von einem Monat ab Veröffentlichung dieser Ankündigung bestimmt.\n\nRechtsbehelfsbelehrung:\n\nGegen diese Verfügung kann Widerspruch eingelegt werden. Zum Widerspruch ist jeder berechtigt, der an der Unterlassung der Löschung ein berechtigtes Interesse hat.\n\nDer Widerspruch ist bei dem Amtsgericht Aachen, Adalbertsteinweg 92, 52070 Aachen schriftlich in deutscher Sprache oder zur Niederschrift der Geschäftsstelle einzulegen. Der Widerspruch kann auch zur Niederschrift der Geschäftsstelle eines jeden Amtsgerichtes abgegeben werden.\n\nDer Widerspruch muss spätestens innerhalb der gesetzten Frist nach der Bekanntgabe der Verfügung bei dem Amtsgericht Aachen eingegangen sein. Dies gilt auch dann, wenn der Widerspruch zur Niederschrift der Geschäftsstelle eines anderen Amtsgerichtes abgegeben wurde. Die Frist beginnt mit der Bekanntgabe der Verfügung durch Veröffentlichung. Fällt das Ende der Frist auf einen Sonntag, einen allgemeinen Feiertag oder Sonnabend, so endet die Frist mit Ablauf des nächsten Werktages.\n\nDer Widerspruch muss die Bezeichnung der angefochtenen Verfügung sowie die Erklärung enthalten, dass Widerspruch gegen diese Verfügung eingelegt wird. Er ist zu unterzeichnen und soll begründet werden.\n\nDie Einlegung ist auch durch Übertragung eines elektronischen Dokuments an die elektronische Poststelle des Gerichts möglich. Das elektronische Dokument muss für die Bearbeitung durch das Gericht geeignet und mit einer qualifizierten elektronischen Signatur der verantwortenden Person versehen sein oder von der verantwortenden Person signiert und auf einem sicheren Übermittlungsweg gemäß § 130 a ZPO nach näherer Maßgabe der Verordnung über die technischen Rahmenbedingungen des elektronischen Rechtsverkehrs und über das besondere elektronische Behördenpostfach (BGBl. I, S. 3803) eingereicht werden. Weitere Informationen erhalten Sie auf der Internetseite www.justiz.de."
    },
    {
      "date": "2026-02-17",
      "id": "145327",
      "original_text": "Löschungsankündigung\nNordrhein-Westfalen Amtsgericht Duisburg HRB 35085\nTasty Hero GmbH – Mülheim an der Ruhr",
      "type": "Löschungsankündigung",
      "state": "Nordrhein-Westfalen",
      "amtsgericht": "Amtsgericht Duisburg",
      "registernummer": "HRB 35085",
      "registerart": "HRB",
      "company_name": "Tasty Hero GmbH",
      "company_seat": "Mülheim an der Ruhr",
      "details": "17.02.2026 (Bekanntmachungsdatum)\n\nNordrhein-Westfalen Amtsgericht Duisburg HRB 35085\nLöschungsankündigung\n\nTasty Hero GmbH\nGesellschaft mit beschränkter Haftung\nMülheim an der Ruhr\n\nDas Registergericht beabsichtigt, die im Handelsregister unter HRB 35085  eingetragene Gesellschaft Tasty Hero GmbH  gemäß § 394 FamFG wegen Vermögenslosigkeit von Amts wegen zu löschen. Gegen diese Verfügung kann Widerspruch eingelegt werden. Die Frist zur Erhebung eines Widerspruchs gegen die beabsichtigte Löschung von Amts wegen ist auf drei Monate festgesetzt. Rechtsbehelfsbelehrung Der Widerspruch ist bei dem Amtsgericht Duisburg, Kardinal-Galen-Str. 124-132, 47058 Duisburg schriftlich in deutscher Sprache oder zur Niederschrift der Geschäftsstelle einzulegen. Der Widerspruch kann auch zur Niederschrift der Geschäftsstelle eines jeden Amtsgerichtes abgegeben werden. Die Einlegung ist auch durch Übertragung eines elektronischen Dokuments an die elektronische Poststelle des Gerichts möglich. Das elektronische Dokument muss für die Bearbeitung durch das Gericht geeignet und mit einer qualifizierten elektronischen Signatur der verantwortenden Person versehen sein oder von der verantwortenden Person signiert und auf einem sicheren Übermittlungsweg gemäß § 130 a ZPO nach näherer Maßgabe der Verordnung über die technischen Rahmenbedingungen des elektronischen Rechtsverkehrs und über das besondere elektronische Behördenpostfach (BGBl. I, S. 3803) eingereicht werden. Weitere Informationen erhalten Sie auf der Internetseite www.justiz.de <http://www.justiz.de>. Der Widerspruch muss spätestens innerhalb der gesetzten Frist bei dem Amtsgericht Duisburg eingegangen sein. Dies gilt auch dann, wenn der Widerspruch zur Niederschrift der Geschäftsstelle eines anderen Amtsgerichtes abgegeben wurde. Die Frist beginnt mit der Veröffentlichung. Fällt das Ende der Frist auf einen Sonntag, einen allgemeinen Feiertag oder Sonnabend, so endet die Frist mit Ablauf des nächsten Werktages. Der Widerspruch muss die Bezeichnung der angefochtenen Verfügung sowie die Erklärung enthalten, dass Widerspruch gegen diese Verfügung eingelegt wird. Er ist zu unterzeichnen und soll begründet werden."
    },
    {
      "date": "2026-02-17",
      "id": "145328",
      "original_text": "Einreichung neuer Dokumente\nNordrhein-Westfalen Amtsgericht Münster HRB 9692\nAGRAVIS RAIFFEISEN AG – Münster",
      "type": "Einreichung neuer Dokumente",
      "state": "Nordrhein-Westfalen",
      "amtsgericht": "Amtsgericht Münster",
      "registernummer": "HRB 9692",
      "registerart": "HRB",
      "company_name": "AGRAVIS RAIFFEISEN AG",
      "company_seat": "Münster",
      "details": "17.02.2026 (Bekanntmachungsdatum)\n\nNordrhein-Westfalen Amtsgericht Münster HRB 9692\nEinreichung neuer Dokumente 10.02.2026 (Eintragungsdatum)\n\nAGRAVIS RAIFFEISEN AG\nAktiengesellschaft\nMünster\n\nDem Registergericht ist eine neue Liste der Mitglieder des Aufsichtsrates eingereicht worden."
    },
    {
      "date": "2026-02-17",
      "id": "145329",
      "original_text": "Löschungsankündigung\nNordrhein-Westfalen Amtsgericht Aachen HRB 26405\nB.P.E. Experten GmbH – Herzogenrath",
      "type": "Löschungsankündigung",
      "state": "Nordrhein-Westfalen",
      "amtsgericht": "Amtsgericht Aachen",
      "registernummer": "HRB 26405",
      "registerart": "HRB",
      "company_name": "B.P.E. Experten GmbH",
      "company_seat": "Herzogenrath",
      "details": "17.02.2026 (Bekanntmachungsdatum)\n\nNordrhein-Westfalen Amtsgericht Aachen HRB 26405\nLöschungsankündigung\n\nB.P.E. Experten GmbH\nGesellschaft mit beschränkter Haftung\nHerzogenrath\n\nDas Registergericht beabsichtigt, von Amts wegen die Gesellschaft wegen Vermögenslosigkeit nach § 394 FamFG zu löschen, weil das Finanzamt\nAachen-Kreis mit Schreiben vom 21.01.2026 Umstände mitgeteilt hat, aufgrund\nderer das Gericht davon überzeugt ist, dass die Gesellschaft vollständig\nvermögenslos ist.\nZur Geltendmachung des Widerspruchs gegen die beabsichtigte Löschung wird\nhiermit eine Frist von einem Monat ab Bekanntgabe dieser Ankündigung bestimmt.\n\nDas Registergericht beabsichtigt, von Amts wegen die Gesellschaft wegen Vermögenslosigkeit nach § 394 FamFG zu löschen.\n\nZur Geltendmachung des Widerspruchs gegen die beabsichtigte Löschung wird hiermit eine Frist von einem Monat ab Veröffentlichung dieser Ankündigung bestimmt.\n\nRechtsbehelfsbelehrung:\n\nGegen diese Verfügung kann Widerspruch eingelegt werden. Zum Widerspruch ist jeder berechtigt, der an der Unterlassung der Löschung ein berechtigtes Interesse hat.\n\nDer Widerspruch ist bei dem Amtsgericht Aachen, Adalbertsteinweg 92, 52070 Aachen schriftlich in deutscher Sprache oder zur Niederschrift der Geschäftsstelle einzulegen. Der Widerspruch kann auch zur Niederschrift der Geschäftsstelle eines jeden Amtsgerichtes abgegeben werden.\n\nDer Widerspruch muss spätestens innerhalb der gesetzten Frist nach der Bekanntgabe der Verfügung bei dem Amtsgericht Aachen eingegangen sein. Dies gilt auch dann, wenn der Widerspruch zur Niederschrift der Geschäftsstelle eines anderen Amtsgerichtes abgegeben wurde. Die Frist beginnt mit der Bekanntgabe der Verfügung durch Veröffentlichung. Fällt das Ende der Frist auf einen Sonntag, einen allgemeinen Feiertag oder Sonnabend, so endet die Frist mit Ablauf des nächsten Werktages.\n\nDer Widerspruch muss die Bezeichnung der angefochtenen Verfügung sowie die Erklärung enthalten, dass Widerspruch gegen diese Verfügung eingelegt wird. Er ist zu unterzeichnen und soll begründet werden.\n\nDie Einlegung ist auch durch Übertragung eines elektronischen Dokuments an die elektronische Poststelle des Gerichts möglich. Das elektronische Dokument muss für die Bearbeitung durch das Gericht geeignet und mit einer qualifizierten elektronischen Signatur der verantwortenden Person versehen sein oder von der verantwortenden Person signiert und auf einem sicheren Übermittlungsweg gemäß § 130 a ZPO nach näherer Maßgabe der Verordnung über die technischen Rahmenbedingungen des elektronischen Rechtsverkehrs und über das besondere elektronische Behördenpostfach (BGBl. I, S. 3803) eingereicht werden. Weitere Informationen erhalten Sie auf der Internetseite www.justiz.de."
    },
    {
      "date": "2026-02-17",
      "id": "145330",
      "original_text": "Registerbekanntmachung nach dem Umwandlungsgesetz\nNordrhein-Westfalen Amtsgericht Bad Oeynhausen HRB 20827\nAutohaus Rehling GmbH – Rahden",
      "type": "Registerbekanntmachung nach dem Umwandlungsgesetz",
      "state": "Nordrhein-Westfalen",
      "amtsgericht": "Amtsgericht Bad Oeynhausen",
      "registernummer": "HRB 20827",
      "registerart": "HRB",
      "company_name": "Autohaus Rehling GmbH",
      "company_seat": "Rahden",
      "details": "17.02.2026 (Bekanntmachungsdatum)\n\nNordrhein-Westfalen Amtsgericht Bad Oeynhausen HRB 20827\nRegisterbekanntmachung nach dem Umwandlungsgesetz 17.02.2026 (Eintragungsdatum)\n\nAutohaus Rehling GmbH\nGesellschaft mit beschränkter Haftung\nRahden\n\nDen Gläubigern der an der formwechselnden Umwandlung beteiligten Rechtsträger ist, wenn sie binnen sechs Monaten nach dem Tag, an dem die Eintragung der formwechselnden Umwandlung in das Register des Sitzes desjenigen Rechtsträgers, dessen Gläubiger sie sind, nach § 19 Absatz 3 UmwG als bekanntgemacht gilt, ihren Anspruch nach Grund und Höhe schriftlich anmelden, Sicherheit zu leisten, soweit sie nicht Befriedigung verlangen können. Dieses Recht steht den Gläubigern jedoch nur zu, wenn sie glaubhaft machen, dass durch die formwechselnden Umwandlung die Erfüllung ihrer Forderung gefährdet wird."
    },
    {
      "date": "2026-02-17",
      "id": "145331",
      "original_text": "Einreichung neuer Dokumente\nNordrhein-Westfalen Amtsgericht Köln HRB 110196\nAGER Lebensversicherung Aktiengesellschaft – Köln",
      "type": "Einreichung neuer Dokumente",
      "state": "Nordrhein-Westfalen",
      "amtsgericht": "Amtsgericht Köln",
      "registernummer": "HRB 110196",
      "registerart": "HRB",
      "company_name": "AGER Lebensversicherung Aktiengesellschaft",
      "company_seat": "Köln",
      "details": "17.02.2026 (Bekanntmachungsdatum)\n\nNordrhein-Westfalen Amtsgericht Köln HRB 110196\nEinreichung neuer Dokumente\n\nAGER Lebensversicherung Aktiengesellschaft\nAktiengesellschaft\nKöln\n\nDem Registergericht ist eine Liste der Mitglieder des Aufsichtsrates eingereicht worden."
    },
    {
      "date": "2026-02-17",
      "id": "145332",
      "original_text": "Einreichung neuer Dokumente\nNordrhein-Westfalen Amtsgericht Köln HRB 1012\nAXA Krankenversicherung Aktiengesellschaft – Köln",
      "type": "Einreichung neuer Dokumente",
      "state": "Nordrhein-Westfalen",
      "amtsgericht": "Amtsgericht Köln",
      "registernummer": "HRB 1012",
      "registerart": "HRB",
      "company_name": "AXA Krankenversicherung Aktiengesellschaft",
      "company_seat": "Köln",
      "details": "17.02.2026 (Bekanntmachungsdatum)\n\nNordrhein-Westfalen Amtsgericht Köln HRB 1012\nEinreichung neuer Dokumente\n\nAXA Krankenversicherung Aktiengesellschaft\nAktiengesellschaft\nKöln\n\nDem Registergericht ist eine neue Liste der Mitglieder des Aufsichtsrates eingereicht worden."
    },
    {
      "date": "2026-02-17",
      "id": "145333",
      "original_text": "Löschungsankündigung\nNordrhein-Westfalen Amtsgericht Wuppertal HRB 23129\nL + L Gastronomie Service GmbH – Wuppertal",
      "type": "Löschungsankündigung",
      "state": "Nordrhein-Westfalen",
      "amtsgericht": "Amtsgericht Wuppertal",
      "registernummer": "HRB 23129",
      "registerart": "HRB",
      "company_name": "L + L Gastronomie Service GmbH",
      "company_seat": "Wuppertal",
      "details": "17.02.2026 (Bekanntmachungsdatum)\n\nNordrhein-Westfalen Amtsgericht Wuppertal HRB 23129\nLöschungsankündigung 16.02.2026 (Eintragungsdatum)\n\nL + L Gastronomie Service GmbH\nGesellschaft mit beschränkter Haftung\nWuppertal\n\nDas Registergericht beabsichtigt die Gesellschaft von Amts wegen nach § 394 FamFG zu löschen. Die Frist zur Erhebung eines Widerspruchs ist auf einen Monat festgesetzt."
    },
    {
      "date": "2026-02-17",
      "id": "145334",
      "original_text": "Registerbekanntmachung nach dem Umwandlungsgesetz\nNordrhein-Westfalen Amtsgericht Düsseldorf HRB 104660\nFeel Great Products GmbH – Monheim am Rhein",
      "type": "Registerbekanntmachung nach dem Umwandlungsgesetz",
      "state": "Nordrhein-Westfalen",
      "amtsgericht": "Amtsgericht Düsseldorf",
      "registernummer": "HRB 104660",
      "registerart": "HRB",
      "company_name": "Feel Great Products GmbH",
      "company_seat": "Monheim am Rhein",
      "details": "17.02.2026 (Bekanntmachungsdatum)\n\nNordrhein-Westfalen Amtsgericht Düsseldorf HRB 104660\nRegisterbekanntmachung nach dem Umwandlungsgesetz 17.02.2026 (Eintragungsdatum)\n\nFeel Great Products GmbH\nGesellschaft mit beschränkter Haftung\nMonheim am Rhein\n\nDen Gläubigern der an der formwechselnden Umwandlung beteiligten Rechtsträger ist, wenn sie binnen sechs Monaten nach dem Tag, an dem die Eintragung der formwechselnden Umwandlung in das Register des Sitzes desjenigen Rechtsträgers, dessen Gläubiger sie sind, nach § 19 Absatz 3 UmwG als bekanntgemacht gilt, ihren Anspruch nach Grund und Höhe schriftlich anmelden, Sicherheit zu leisten, soweit sie nicht Befriedigung verlangen können. Dieses Recht steht den Gläubigern jedoch nur zu, wenn sie glaubhaft machen, dass durch die formwechselnden Umwandlung die Erfüllung ihrer Forderung gefährdet wird."
    },
    {
      "date": "2026-02-17",
      "id": "145335",
      "original_text": "Löschungsankündigung\nNordrhein-Westfalen Amtsgericht Aachen HRB 28743\nMiddle Earth Erendis Verwaltung Unternehmergesellschaft (haftungsbeschränkt) – Aachen",
      "type": "Löschungsankündigung",
      "state": "Nordrhein-Westfalen",
      "amtsgericht": "Amtsgericht Aachen",
      "registernummer": "HRB 28743",
      "registerart": "HRB",
      "company_name": "Middle Earth Erendis Verwaltung Unternehmergesellschaft (haftungsbeschränkt)",
      "company_seat": "Aachen",
      "details": "17.02.2026 (Bekanntmachungsdatum)\n\nNordrhein-Westfalen Amtsgericht Aachen HRB 28743\nLöschungsankündigung\n\nMiddle Earth Erendis Verwaltung Unternehmergesellschaft (haftungsbeschränkt)\nGesellschaft mit beschränkter Haftung\nAachen\n\nDer eingetragene Geschäftsführer Roland Betz durch Beschluss der\nGesellschafterversammlung vom 05.08.2025 abberufen worden.\nGemäß § 395 FamFG kann eine Eintragung im Handelsregister von Amts wegen\ngelöscht werden, wenn sie wegen des Mangels einer wesentlichen Voraussetzung\nunzulässig ist. Dies ist hier der Fall.\nDer Geschäftsführer Roland Betz wurde wirksam abberufen. Es ist daher\nbeabsichtigt, nach Ablauf einer Frist von einem Monat dessen Eintragung im\nHandelsregister von Amts wegen zu löschen.Das Registergericht beabsichtigt, von Amts wegen folgende Eintragung wegen Unzulässigkeit nach § 395 FamFG zu löschen:\n\nZur Geltendmachung des Widerspruchs gegen die beabsichtigte Löschung wird hiermit eine Frist von einem Monat ab Veröffentlichung dieser Ankündigung bestimmt.\n\nRechtsbehelfsbelehrung:\n\nGegen diese Verfügung kann Widerspruch eingelegt werden. Zum Widerspruch ist jeder berechtigt, der an der Unterlassung der Löschung ein berechtigtes Interesse hat.\n\nDer Widerspruch ist bei dem Amtsgericht Aachen, Adalbertsteinweg 92, 52070 Aachen schriftlich in deutscher Sprache oder zur Niederschrift der Geschäftsstelle einzulegen. Der Widerspruch kann auch zur Niederschrift der Geschäftsstelle eines jeden Amtsgerichtes abgegeben werden.\n\nDer Widerspruch muss spätestens innerhalb der gesetzten Frist nach der Bekanntgabe der Verfügung bei dem Amtsgericht Aachen eingegangen sein. Dies gilt auch dann, wenn der Widerspruch zur Niederschrift der Geschäftsstelle eines anderen Amtsgerichtes abgegeben wurde. Die Frist beginnt mit der Bekanntgabe der Verfügung durch Veröffentlichung. Fällt das Ende der Frist auf einen Sonntag, einen allgemeinen Feiertag oder Sonnabend, so endet die Frist mit Ablauf des nächsten Werktages.\n\nDer Widerspruch muss die Bezeichnung der angefochtenen Verfügung sowie die Erklärung enthalten, dass Widerspruch gegen diese Verfügung eingelegt wird. Er ist zu unterzeichnen und soll begründet werden.\n\nDie Einlegung ist auch durch Übertragung eines elektronischen Dokuments an die elektronische Poststelle des Gerichts möglich. Das elektronische Dokument muss für die Bearbeitung durch das Gericht geeignet und mit einer qualifizierten elektronischen Signatur der verantwortenden Person versehen sein oder von der verantwortenden Person signiert und auf einem sicheren Übermittlungsweg gemäß § 130 a ZPO nach näherer Maßgabe der Verordnung über die technischen Rahmenbedingungen des elektronischen Rechtsverkehrs und über das besondere elektronische Behördenpostfach (BGBl. I, S. 3803) eingereicht werden. Weitere Informationen erhalten Sie auf der Internetseite www.justiz.de."
    },
    {
      "date": "2026-02-17",
      "id": "145336",
      "original_text": "Einreichung neuer Dokumente\nNordrhein-Westfalen Amtsgericht Gütersloh HRB 5560\nKHW Kommunale Haus und Wohnen GmbH – Rheda-Wiedenbrück",
      "type": "Einreichung neuer Dokumente",
      "state": "Nordrhein-Westfalen",
      "amtsgericht": "Amtsgericht Gütersloh",
      "registernummer": "HRB 5560",
      "registerart": "HRB",
      "company_name": "KHW Kommunale Haus und Wohnen GmbH",
      "company_seat": "Rheda-Wiedenbrück",
      "details": "17.02.2026 (Bekanntmachungsdatum)\n\nNordrhein-Westfalen Amtsgericht Gütersloh HRB 5560\nEinreichung neuer Dokumente\n\nKHW Kommunale Haus und Wohnen GmbH\nGesellschaft mit beschränkter Haftung\nRheda-Wiedenbrück\n\nDem Registergericht ist eine neue Liste der Mitglieder des Aufsichtsrates eingereicht worden."
    },
    {
      "date": "2026-02-17",
      "id": "145337",
      "original_text": "Löschungsankündigung\nNordrhein-Westfalen Amtsgericht Wuppertal HRB 25037\nJNW Tankanlagenbau Pietroch GmbH – Wuppertal",
      "type": "Löschungsankündigung",
      "state": "Nordrhein-Westfalen",
      "amtsgericht": "Amtsgericht Wuppertal",
      "registernummer": "HRB 25037",
      "registerart": "HRB",
      "company_name": "JNW Tankanlagenbau Pietroch GmbH",
      "company_seat": "Wuppertal",
      "details": "17.02.2026 (Bekanntmachungsdatum)\n\nNordrhein-Westfalen Amtsgericht Wuppertal HRB 25037\nLöschungsankündigung\n\nJNW Tankanlagenbau Pietroch GmbH\nGesellschaft mit beschränkter Haftung\nWuppertal\n\nDas Registergericht beabsichtigt die Gesellschaft von Amts wegen nach § 394 FamFG zu löschen. Die Frist zur Erhebung eines Widerspruchs ist auf einen Monat festgesetzt."
    },
    {
      "date": "2026-02-17",
      "id": "145338",
      "original_text": "Einreichung neuer Dokumente\nNordrhein-Westfalen Amtsgericht Köln HRB 271\nAXA Lebensversicherung Aktiengesellschaft – Köln",
      "type": "Einreichung neuer Dokumente",
      "state": "Nordrhein-Westfalen",
      "amtsgericht": "Amtsgericht Köln",
      "registernummer": "HRB 271",
      "registerart": "HRB",
      "company_name": "AXA Lebensversicherung Aktiengesellschaft",
      "company_seat": "Köln",
      "details": "17.02.2026 (Bekanntmachungsdatum)\n\nNordrhein-Westfalen Amtsgericht Köln HRB 271\nEinreichung neuer Dokumente\n\nAXA Lebensversicherung Aktiengesellschaft\nAktiengesellschaft\nKöln\n\nDem Registergericht ist eine Liste der Mitglieder des Aufsichtsrates eingereicht worden."
    },
    {
      "date": "2026-02-17",
      "id": "145339",
      "original_text": "Löschungsankündigung\nNordrhein-Westfalen Amtsgericht Siegburg HRB 11935\nEK Generalbau UG (haftungsbeschränkt) – Hennef",
      "type": "Löschungsankündigung",
      "state": "Nordrhein-Westfalen",
      "amtsgericht": "Amtsgericht Siegburg",
      "registernummer": "HRB 11935",
      "registerart": "HRB",
      "company_name": "EK Generalbau UG (haftungsbeschränkt)",
      "company_seat": "Hennef",
      "details": "17.02.2026 (Bekanntmachungsdatum)\n\nNordrhein-Westfalen Amtsgericht Siegburg HRB 11935\nLöschungsankündigung\n\nEK Generalbau UG (haftungsbeschränkt)\nGesellschaft mit beschränkter Haftung\nHennef\n\nEinzulegen ist der Widerspruch bei dem Amtsgericht Siegburg, Neue Poststraße 16, 53721 Siegburg, und zwar entweder schriftlich in deutscher Sprache oder mündlich zur Niederschrift der Geschäftsstelle. Der Widerspruch kann auch zur Niederschrift der Geschäftsstelle eines jeden Amtsgerichts abgegeben werden. Der Widerspruch ist binnen der in der Verfügung bestimmten Frist einzulegen. Die Frist ist nur gewahrt, wenn der Widerspruch rechtzeitig bei dem Amtsgericht Siegburg eingeht, auch wenn der Widerspruch zur Niederschrift der mGeschäftsstelle eines anderen Amtsgerichts abgegeben wurde. Die\nFrist beginnt jeweils mit der schriftlichen Bekanntgabe der Verfügung an die Beteiligten. Kann die schriftliche Bekanntgabe an einen Beteiligten nicht bewirkt werden, beginnt die Frist spätestens mit Ablauf von fünf Monaten nach Erlass der Verfügung. Die Bekanntgabe ist entweder durch Zustellung oder am dritten Tage nach Aufgabe zur Post bewirkt.  Sofern die Löschung noch nicht erfolgt ist, kann der Widerspruch auch noch nach Ablauf der Frist eingelegt werden. Fällt das Ende der Frist auf einen Sonnabend, einen Sonntag oder einen allgemeinen Feiertag, endet die Frist mit Ablauf des nächsten Werktages. Der Widerspruch ist zu unterzeichnen. Eine Begründung des Widerspruchs ist nicht vorgeschrieben."
    },
    {
      "date": "2026-02-17",
      "id": "145340",
      "original_text": "Löschungsankündigung\nNordrhein-Westfalen Amtsgericht Düsseldorf HRB 92397\nJLD Consulting und Trading GmbH – Düsseldorf",
      "type": "Löschungsankündigung",
      "state": "Nordrhein-Westfalen",
      "amtsgericht": "Amtsgericht Düsseldorf",
      "registernummer": "HRB 92397",
      "registerart": "HRB",
      "company_name": "JLD Consulting und Trading GmbH",
      "company_seat": "Düsseldorf",
      "details": "17.02.2026 (Bekanntmachungsdatum)\n\nNordrhein-Westfalen Amtsgericht Düsseldorf HRB 92397\nLöschungsankündigung\n\nJLD Consulting und Trading GmbH\nGesellschaft mit beschränkter Haftung\nDüsseldorf\n\nDas Registergericht beabsichtigt die Gesellschaft von Amts wegen nach § 394 FamFG zu löschen. Die Frist zur Erhebung eines Widerspruchs ist auf 3 Wochen festgesetzt.\n\nRechtsbehelfsbelehrung:\nDas Widerspruchsrecht steht jedem zu, der an der Unterlassung der Löschung ein berechtigtes Interesse hat. Der Widerspruch ist bei dem Amtsgericht Düsseldorf -Registergericht-, Werdener Straße 1, 40227 Düsseldorf schriftlich in deutscher Sprache oder zur Niederschrift der Geschäftsstelle einzulegen. Der Widerspruch kann auch zur Niederschrift der Geschäftsstelle eines jeden Amtsgerichtes abgegeben werden. Die Einlegung ist auch durch Übertragung eines elektronischen Dokuments an die elektronische Poststelle des Gerichts möglich. Das elektronische Dokument muss für die Bearbeitung durch das Gericht geeignet und mit einer qualifizierten elektronischen Signatur der verantwortenden Person versehen sein oder von der verantwortenden Person signiert und auf einem sicheren Übermittlungsweg gemäß § 130a ZPO nach näherer Maßgabe der Verordnung über die technischen Rahmenbedingungen des elektronischen Rechtsverkehrs und über das besondere elektronische Behördenpostfach (BGBl. I, S.3803) eingereicht werden. Weitere Informationen erhalten Sie auf der Internetseite www.justiz.de.\nDer Widerspruch muss spätestens innerhalb der gesetzten Frist nach dem Datum der Bekanntmachung der Löschungsankündigung bei dem Amtsgericht - Registergericht - Düsseldorf eingegangen sein.  Dies gilt auch dann, wenn der Widerspruch zur Niederschrift der Geschäftsstelle eines anderen Amtsgerichtes abgegeben wurde. Die Frist beginnt mit dem Tage der Bekanntmachung der Löschungsankündigung in dem für die Bekanntmachung der Eintragungen in das Handelsregister bestimmten elektronischen Informations- und Kommunikationssystem nach § 10 des Handelsgesetzbuches. Fällt das Ende der Frist auf einen Sonntag, einen allgemeinen Feiertag oder Sonnabend, so endet die Frist mit Ablauf des nächsten Werktages.\nDer Widerspruch muss die Bezeichnung der angefochtenen Löschungsankündigung sowie die Erklärung enthalten, dass Widerspruch gegen diese Löschungsankündigung eingelegt wird. Er ist zu unterzeichnen und soll begründet werden."
    },
    {
      "date": "2026-02-17",
      "id": "145341",
      "original_text": "Löschungsankündigung\nNordrhein-Westfalen Amtsgericht Mönchengladbach HRB 3104\nCDS Club Du Sport Bekleidung GmbH – Mönchengladbach",
      "type": "Löschungsankündigung",
      "state": "Nordrhein-Westfalen",
      "amtsgericht": "Amtsgericht Mönchengladbach",
      "registernummer": "HRB 3104",
      "registerart": "HRB",
      "company_name": "CDS Club Du Sport Bekleidung GmbH",
      "company_seat": "Mönchengladbach",
      "details": "17.02.2026 (Bekanntmachungsdatum)\n\nNordrhein-Westfalen Amtsgericht Mönchengladbach HRB 3104\nLöschungsankündigung 17.02.2026 (Eintragungsdatum)\n\nCDS Club Du Sport Bekleidung GmbH\nGesellschaft mit beschränkter Haftung\nMönchengladbach\n\nDas Registergericht beabsichtigt die Gesellschaft von Amts wegen nach § 394 FamFG zu löschen. Die Frist zur Erhebung eines Widerspruchs ist auf drei Monate festgesetzt."
    },
    {
      "date": "2026-02-17",
      "id": "145342",
      "original_text": "Sonstige Registerbekanntmachung\nNordrhein-Westfalen Amtsgericht Köln HRB 28281\nq.beyond AG – Köln",
      "type": "Sonstige Registerbekanntmachung",
      "state": "Nordrhein-Westfalen",
      "amtsgericht": "Amtsgericht Köln",
      "registernummer": "HRB 28281",
      "registerart": "HRB",
      "company_name": "q.beyond AG",
      "company_seat": "Köln",
      "details": "17.02.2026 (Bekanntmachungsdatum)\n\nNordrhein-Westfalen Amtsgericht Köln HRB 28281\nSonstige Registerbekanntmachung 17.02.2026 (Eintragungsdatum)\n\nq.beyond AG\nAktiengesellschaft\nKöln\n\nDie Gesellschaft hat Gläubigern, deren Forderungen vor dieser Bekanntmachung begründet worden sind, Sicherheit zu leisten, soweit sie nicht Befriedigung verlangen können, wenn sie sich binnen sechs Monaten zu diesem Zweck melden."
    },
    {
      "date": "2026-02-17",
      "id": "145343",
      "original_text": "Löschungsankündigung\nNordrhein-Westfalen Amtsgericht Aachen HRB 24393\nGB-proEquip UG (haftungsbeschränkt) – Aachen",
      "type": "Löschungsankündigung",
      "state": "Nordrhein-Westfalen",
      "amtsgericht": "Amtsgericht Aachen",
      "registernummer": "HRB 24393",
      "registerart": "HRB",
      "company_name": "GB-proEquip UG (haftungsbeschränkt)",
      "company_seat": "Aachen",
      "details": "17.02.2026 (Bekanntmachungsdatum)\n\nNordrhein-Westfalen Amtsgericht Aachen HRB 24393\nLöschungsankündigung\n\nGB-proEquip UG (haftungsbeschränkt)\nGesellschaft mit beschränkter Haftung\nAachen\n\nDas Registergericht beabsichtigt, von Amts wegen die Gesellschaft wegen\nVermögenslosigkeit nach § 394 FamFG zu löschen,\nweil das Finanzamt Viersen mit Schreiben vom 11.09.2025 und 28.11.2025\nUmstände mitgeteilt hat, aufgrund derer das Gericht davon überzeugt ist, dass\ndie Gesellschaft vollständig vermögenslos ist.\nZur Geltendmachung des Widerspruchs gegen die beabsichtigte Löschung wird\nhiermit eine Frist von einem Monat ab Veröffentlichung dieser Ankündigung\nbestimmt.Das Registergericht beabsichtigt, von Amts wegen die Gesellschaft wegen Vermögenslosigkeit nach § 394 FamFG zu löschen.\n\nZur Geltendmachung des Widerspruchs gegen die beabsichtigte Löschung wird hiermit eine Frist von einem Monat ab Veröffentlichung dieser Ankündigung bestimmt.\n\nRechtsbehelfsbelehrung:\n\nGegen diese Verfügung kann Widerspruch eingelegt werden. Zum Widerspruch ist jeder berechtigt, der an der Unterlassung der Löschung ein berechtigtes Interesse hat.\n\nDer Widerspruch ist bei dem Amtsgericht Aachen, Adalbertsteinweg 92, 52070 Aachen schriftlich in deutscher Sprache oder zur Niederschrift der Geschäftsstelle einzulegen. Der Widerspruch kann auch zur Niederschrift der Geschäftsstelle eines jeden Amtsgerichtes abgegeben werden.\n\nDer Widerspruch muss spätestens innerhalb der gesetzten Frist nach der Bekanntgabe der Verfügung bei dem Amtsgericht Aachen eingegangen sein. Dies gilt auch dann, wenn der Widerspruch zur Niederschrift der Geschäftsstelle eines anderen Amtsgerichtes abgegeben wurde. Die Frist beginnt mit der Bekanntgabe der Verfügung durch Veröffentlichung. Fällt das Ende der Frist auf einen Sonntag, einen allgemeinen Feiertag oder Sonnabend, so endet die Frist mit Ablauf des nächsten Werktages.\n\nDer Widerspruch muss die Bezeichnung der angefochtenen Verfügung sowie die Erklärung enthalten, dass Widerspruch gegen diese Verfügung eingelegt wird. Er ist zu unterzeichnen und soll begründet werden.\n\nDie Einlegung ist auch durch Übertragung eines elektronischen Dokuments an die elektronische Poststelle des Gerichts möglich. Das elektronische Dokument muss für die Bearbeitung durch das Gericht geeignet und mit einer qualifizierten elektronischen Signatur der verantwortenden Person versehen sein oder von der verantwortenden Person signiert und auf einem sicheren Übermittlungsweg gemäß § 130 a ZPO nach näherer Maßgabe der Verordnung über die technischen Rahmenbedingungen des elektronischen Rechtsverkehrs und über das besondere elektronische Behördenpostfach (BGBl. I, S. 3803) eingereicht werden. Weitere Informationen erhalten Sie auf der Internetseite www.justiz.de."
    },
    {
      "date": "2026-02-17",
      "id": "145344",
      "original_text": "Einreichung neuer Dokumente\nNordrhein-Westfalen Amtsgericht Gütersloh HRB 9350\nStadtwerke Harsewinkel GmbH – Harsewinkel",
      "type": "Einreichung neuer Dokumente",
      "state": "Nordrhein-Westfalen",
      "amtsgericht": "Amtsgericht Gütersloh",
      "registernummer": "HRB 9350",
      "registerart": "HRB",
      "company_name": "Stadtwerke Harsewinkel GmbH",
      "company_seat": "Harsewinkel",
      "details": "17.02.2026 (Bekanntmachungsdatum)\n\nNordrhein-Westfalen Amtsgericht Gütersloh HRB 9350\nEinreichung neuer Dokumente\n\nStadtwerke Harsewinkel GmbH\nGesellschaft mit beschränkter Haftung\nHarsewinkel\n\nDem Registergericht ist eine neue Liste der Mitglieder des Aufsichtsrates eingereicht worden."
    },
    {
      "date": "2026-02-17",
      "id": "145345",
      "original_text": "Löschungsankündigung\nNordrhein-Westfalen Amtsgericht Duisburg HRB 31765\nVitam24 Medical Holding GmbH – Duisburg",
      "type": "Löschungsankündigung",
      "state": "Nordrhein-Westfalen",
      "amtsgericht": "Amtsgericht Duisburg",
      "registernummer": "HRB 31765",
      "registerart": "HRB",
      "company_name": "Vitam24 Medical Holding GmbH",
      "company_seat": "Duisburg",
      "details": "17.02.2026 (Bekanntmachungsdatum)\n\nNordrhein-Westfalen Amtsgericht Duisburg HRB 31765\nLöschungsankündigung\n\nVitam24 Medical Holding GmbH\nGesellschaft mit beschränkter Haftung\nDuisburg\n\nDas Registergericht beabsichtigt, die im Handelsregister unter HRB 31765  eingetragene Gesellschaft Vitam24 Medical Holding GmbH gemäß § 394 FamFG wegen Vermögenslosigkeit von Amts wegen zu löschen. Gegen diese Verfügung kann Widerspruch eingelegt werden. Die Frist zur Erhebung eines Widerspruchs gegen die beabsichtigte Löschung von Amts wegen ist auf drei Monate festgesetzt. Rechtsbehelfsbelehrung Der Widerspruch ist bei dem Amtsgericht Duisburg, Kardinal-Galen-Str. 124-132, 47058 Duisburg schriftlich in deutscher Sprache oder zur Niederschrift der Geschäftsstelle einzulegen. Der Widerspruch kann auch zur Niederschrift der Geschäftsstelle eines jeden Amtsgerichtes abgegeben werden. Die Einlegung ist auch durch Übertragung eines elektronischen Dokuments an die elektronische Poststelle des Gerichts möglich. Das elektronische Dokument muss für die Bearbeitung durch das Gericht geeignet und mit einer qualifizierten elektronischen Signatur der verantwortenden Person versehen sein oder von der verantwortenden Person signiert und auf einem sicheren Übermittlungsweg gemäß § 130 a ZPO nach näherer Maßgabe der Verordnung über die technischen Rahmenbedingungen des elektronischen Rechtsverkehrs und über das besondere elektronische Behördenpostfach (BGBl. I, S. 3803) eingereicht werden. Weitere Informationen erhalten Sie auf der Internetseite www.justiz.de <http://www.justiz.de>. Der Widerspruch muss spätestens innerhalb der gesetzten Frist bei dem Amtsgericht Duisburg eingegangen sein. Dies gilt auch dann, wenn der Widerspruch zur Niederschrift der Geschäftsstelle eines anderen Amtsgerichtes abgegeben wurde. Die Frist beginnt mit der Veröffentlichung. Fällt das Ende der Frist auf einen Sonntag, einen allgemeinen Feiertag oder Sonnabend, so endet die Frist mit Ablauf des nächsten Werktages. Der Widerspruch muss die Bezeichnung der angefochtenen Verfügung sowie die Erklärung enthalten, dass Widerspruch gegen diese Verfügung eingelegt wird. Er ist zu unterzeichnen und soll begründet werden."
    },
    {
      "date": "2026-02-17",
      "id": "145346",
      "original_text": "Einreichung neuer Dokumente\nNordrhein-Westfalen Amtsgericht Düsseldorf HRB 66673\nARAG Holding SE – Düsseldorf",
      "type": "Einreichung neuer Dokumente",
      "state": "Nordrhein-Westfalen",
      "amtsgericht": "Amtsgericht Düsseldorf",
      "registernummer": "HRB 66673",
      "registerart": "HRB",
      "company_name": "ARAG Holding SE",
      "company_seat": "Düsseldorf",
      "details": "17.02.2026 (Bekanntmachungsdatum)\n\nNordrhein-Westfalen Amtsgericht Düsseldorf HRB 66673\nEinreichung neuer Dokumente\n\nARAG Holding SE\nEuropäische Aktiengesellschaft (SE)\nDüsseldorf\n\nDem Registergericht ist eine Liste der Mitglieder des Aufsichtsrates eingereicht worden."
    },
    {
      "date": "2026-02-17",
      "id": "145347",
      "original_text": "Registerbekanntmachung nach dem Umwandlungsgesetz\nNordrhein-Westfalen Amtsgericht Bochum HRA 8121\nDui Sushi Bochum e.K. – Bochum",
      "type": "Registerbekanntmachung nach dem Umwandlungsgesetz",
      "state": "Nordrhein-Westfalen",
      "amtsgericht": "Amtsgericht Bochum",
      "registernummer": "HRA 8121",
      "registerart": "HRA",
      "company_name": "Dui Sushi Bochum e.K.",
      "company_seat": "Bochum",
      "details": "17.02.2026 (Bekanntmachungsdatum)\n\nNordrhein-Westfalen Amtsgericht Bochum HRA 8121\nRegisterbekanntmachung nach dem Umwandlungsgesetz 17.02.2026 (Eintragungsdatum)\n\nDui Sushi Bochum e.K.\nEinzelkaufmann / Einzelkauffrau\nBochum\n\nDen Gläubigern der an der Ausgliederung beteiligten Rechtsträger ist, wenn sie binnen sechs Monaten nach dem Tag, an dem die Eintragung der Ausgliederung in das Register des Sitzes desjenigen Rechtsträgers, dessen Gläubiger sie sind, nach § 19 Absatz 3 UmwG als bekanntgemacht gilt, ihren Anspruch nach Grund und Höhe schriftlich anmelden, Sicherheit zu leisten, soweit sie nicht Befriedigung verlangen können. Dieses Recht steht den Gläubigern jedoch nur zu, wenn sie glaubhaft machen, dass durch die Ausgliederung die Erfüllung ihrer Forderung gefährdet wird."
    },
    {
      "date": "2026-02-17",
      "id": "145348",
      "original_text": "Löschungsankündigung\nNordrhein-Westfalen Amtsgericht Bonn HRB 28858\nHERKULESZ UG (haftungsbeschränkt) – Euskirchen",
      "type": "Löschungsankündigung",
      "state": "Nordrhein-Westfalen",
      "amtsgericht": "Amtsgericht Bonn",
      "registernummer": "HRB 28858",
      "registerart": "HRB",
      "company_name": "HERKULESZ UG (haftungsbeschränkt)",
      "company_seat": "Euskirchen",
      "details": "17.02.2026 (Bekanntmachungsdatum)\n\nNordrhein-Westfalen Amtsgericht Bonn HRB 28858\nLöschungsankündigung\n\nHERKULESZ UG (haftungsbeschränkt)\nGesellschaft mit beschränkter Haftung\nEuskirchen\n\nDas Registergericht beabsichtigt die Gesellschaft von Amts wegen nach § 394 FamFG zu löschen. Die Frist zur Erhebung eines Widerspruchs ist auf einen Monat festgesetzt."
    },
    {
      "date": "2026-02-17",
      "id": "145349",
      "original_text": "Löschungsankündigung\nNordrhein-Westfalen Amtsgericht Kleve HRB 17627\nDNC GmbH – Weeze",
      "type": "Löschungsankündigung",
      "state": "Nordrhein-Westfalen",
      "amtsgericht": "Amtsgericht Kleve",
      "registernummer": "HRB 17627",
      "registerart": "HRB",
      "company_name": "DNC GmbH",
      "company_seat": "Weeze",
      "details": "17.02.2026 (Bekanntmachungsdatum)\n\nNordrhein-Westfalen Amtsgericht Kleve HRB 17627\nLöschungsankündigung\n\nDNC GmbH\nGesellschaft mit beschränkter Haftung\nWeeze\n\nDas Registergericht beabsichtigt die Gesellschaft von Amts wegen nach § 394 FamFG zu löschen. Die Frist zur Erhebung eines Widerspruchs ist auf einen Monat festgesetzt."
    },
    {
      "date": "2026-02-17",
      "id": "145350",
      "original_text": "Löschungsankündigung\nNordrhein-Westfalen Amtsgericht Münster HRB 19953\nLPS Logistik Partner Service GmbH – Beckum",
      "type": "Löschungsankündigung",
      "state": "Nordrhein-Westfalen",
      "amtsgericht": "Amtsgericht Münster",
      "registernummer": "HRB 19953",
      "registerart": "HRB",
      "company_name": "LPS Logistik Partner Service GmbH",
      "company_seat": "Beckum",
      "details": "17.02.2026 (Bekanntmachungsdatum)\n\nNordrhein-Westfalen Amtsgericht Münster HRB 19953\nLöschungsankündigung\n\nLPS Logistik Partner Service GmbH\nGesellschaft mit beschränkter Haftung\nBeckum\n\nDas Registergericht beabsichtigt die Gesellschaft von Amts wegen nach § 394 FamFG zu löschen. Die Frist zur Erhebung eines Widerspruchs ist auf 3 Wochen festgesetzt.\n\nRechtsbehelfsbelehrung:\n\nGegen diese Verfügung können Sie Widerspruch einlegen.\n\nDer Widerspruch ist bei dem Amtsgericht Münster, Gerichtsstraße 2 bis 6, 48149 Münster schriftlich in deutscher Sprache oder zur Niederschrift der Geschäftsstelle eines jeden Amtsgerichtes abgegeben werden.\nDie Einlegung ist auch durch Übertragung eine elektronischen Dokuments an die elektronische Poststelle des Gerichts möglich. Das elektronische Dokument muss für die Bearbeitung durch das Gericht geeignet und mit einer qualifizierten elektronischen Signatur der verantwortenden Person versehen sein oder von der verantwortenden Person signiert und auf einem sicheren Übermittlungsweg gem. §130a ZPO nach nähere Maßgabe der Verordnung über die technischen Rahmenbedingungen des elektronischen Rechtsverkehrs und über das besondere elektronische Behördenpostfach (BGBI. I. S.3808) eingereicht werden. Weitere Informationen erhalten Sie auf der Internetseite www.justiz.de\n\nDer Widerspruch muss spätestens innerhalb der gesetzten Frist nach der schriftlichen Bekanntgabe der Verfügung bei dem Amtsgericht Münster eingegangen sein. Dies gilt auch dann, wenn der Widerspruch zur Niederschrift der Geschäftsstelle eines anderen Amtsgerichtes abgegeben wurde. Die Frist beginnt mit der schriftlichen Bekanntgabe der Verfügung, spätestens mit Ablauf von fünf Monaten nach Erlass der Verfügung. Die Bekanntgabe ist entweder durch Zustellung oder am dritten Tage nach Aufgabe zur Post bewirkt. Fällt das Ende der First auf einen Sonntag, einen allgemeinen Feiertag oder Sonnabend, so endet die Frist mit Ablauf des nächsten Werktages.\n\nDer Widerspruch muss die Bezeichnung der angefochtenen Verfügung sowie die Erklärung enthalten, dass Widerspruch gegen diese Verfügung eingelegt wird. Er ist zu unterzeichnen und soll begründet werden."
    },
    {
      "date": "2026-02-17",
      "id": "145351",
      "original_text": "Registerbekanntmachung nach dem Umwandlungsgesetz\nBaden-Württemberg Amtsgericht Stuttgart HRB 801380\nBossard Deutschland GmbH – Leinfelden-Echterdingen",
      "type": "Registerbekanntmachung nach dem Umwandlungsgesetz",
      "state": "Baden-Württemberg",
      "amtsgericht": "Amtsgericht Stuttgart",
      "registernummer": "HRB 801380",
      "registerart": "HRB",
      "company_name": "Bossard Deutschland GmbH",
      "company_seat": "Leinfelden-Echterdingen",
      "details": "17.02.2026 (Bekanntmachungsdatum)\n\nBaden-Württemberg Amtsgericht Stuttgart HRB 801380\nRegisterbekanntmachung nach dem Umwandlungsgesetz 17.02.2026 (Eintragungsdatum)\n\nBossard Deutschland GmbH\nGesellschaft mit beschränkter Haftung\nLeinfelden-Echterdingen\n\nAls nicht eingetragen wird bekanntgemacht:\nDen Gläubigern der an der Verschmelzung beteiligten Rechtsträger ist, wenn sie binnen sechs Monaten nach dem Tag, an dem die Eintragung der Verschmelzung in das Register des Sitzes desjenigen Rechtsträgers, dessen Gläubiger sie sind, nach § 19 Abs. 3 UmwG als bekanntgemacht gilt, ihren Anspruch nach Grund und Höhe schriftlich anmelden, Sicherheit zu leisten, soweit sie nicht Befriedigung verlangen können. Dieses Recht steht den Gläubigern jedoch nur zu, wenn sie glaubhaft machen, dass durch die Verschmelzung die Erfüllung ihrer Forderung gefährdet wird."
    },
    {
      "date": "2026-02-17",
      "id": "145352",
      "original_text": "Registerbekanntmachung nach dem Umwandlungsgesetz\nThüringen Amtsgericht Jena HRA 506876\nSträßer Göppel OHG – Großschwabhausen",
      "type": "Registerbekanntmachung nach dem Umwandlungsgesetz",
      "state": "Thüringen",
      "amtsgericht": "Amtsgericht Jena",
      "registernummer": "HRA 506876",
      "registerart": "HRA",
      "company_name": "Sträßer Göppel OHG",
      "company_seat": "Großschwabhausen",
      "details": "17.02.2026 (Bekanntmachungsdatum)\n\nThüringen Amtsgericht Jena HRA 506876\nRegisterbekanntmachung nach dem Umwandlungsgesetz 17.02.2026 (Eintragungsdatum)\n\nSträßer Göppel OHG\nOffene Handelsgesellschaft\nGroßschwabhausen\n\nNicht eingetragen: Den Gläubigern der an der Ausgliederung beteiligten Rechtsträger, ist wenn sie binnen sechs Monaten nach dem Tag, an dem die Eintragung der Ausgliederung in das Register des Sitzes desjenigen Rechtsträgers, dessen Gläubiger sie sind, nach §§125, 19 Abs. 3 UmwG als bekanntgemacht gilt, ihren Anspruch nach Grund und Höhe schriftlich anmelden, Sicherheit zu leisten, soweit sie nicht Befriedigung verlangen können. Dieses Recht steht ihnen jedoch nur zu, wenn sie glaubhaft machen, daß durch die Ausgliederung die Erfüllung ihrer Forderung gefährdet wird."
    },
    {
      "date": "2026-02-17",
      "id": "145353",
      "original_text": "Registerbekanntmachung nach dem Umwandlungsgesetz\nThüringen Amtsgericht Jena HRA 506876\nSträßer Göppel OHG – Großschwabhausen",
      "type": "Registerbekanntmachung nach dem Umwandlungsgesetz",
      "state": "Thüringen",
      "amtsgericht": "Amtsgericht Jena",
      "registernummer": "HRA 506876",
      "registerart": "HRA",
      "company_name": "Sträßer Göppel OHG",
      "company_seat": "Großschwabhausen",
      "details": "17.02.2026 (Bekanntmachungsdatum)\n\nThüringen Amtsgericht Jena HRA 506876\nRegisterbekanntmachung nach dem Umwandlungsgesetz 17.02.2026 (Eintragungsdatum)\n\nSträßer Göppel OHG\nOffene Handelsgesellschaft\nGroßschwabhausen\n\nNicht eingetragen: Den Gläubigern der an der Verschmelzung beteiligten Rechtsträger, ist wenn sie binnen sechs Monaten nach dem Tag, an dem die Eintragung der Verschmelzung in das Register des Sitzes desjenigen Rechtsträgers, dessen Gläubiger sie sind,  nach § 19 Abs. 3 UmwG als bekanntgemacht gilt, ihren Anspruch nach Grund und Höhe schriftlich anmelden, Sicherheit zu leisten, soweit sie nicht Befriedigung verlangen können. Dieses Recht steht ihnen jedoch nur zu, wenn sie glaubhaft machen, daß durch die Verschmelzung die Erfüllung ihrer Forderung gefährdet wird."
    },
    {
      "date": "2026-02-17",
      "id": "145354",
      "original_text": "Registerbekanntmachung nach dem Umwandlungsgesetz\nThüringen Amtsgericht Jena HRA 507165\nAllianz Carsten Sträßer e. K. – Jena",
      "type": "Registerbekanntmachung nach dem Umwandlungsgesetz",
      "state": "Thüringen",
      "amtsgericht": "Amtsgericht Jena",
      "registernummer": "HRA 507165",
      "registerart": "HRA",
      "company_name": "Allianz Carsten Sträßer e. K.",
      "company_seat": "Jena",
      "details": "17.02.2026 (Bekanntmachungsdatum)\n\nThüringen Amtsgericht Jena HRA 507165\nRegisterbekanntmachung nach dem Umwandlungsgesetz 17.02.2026 (Eintragungsdatum)\n\nAllianz Carsten Sträßer e. K.\nEinzelkaufmann / Einzelkauffrau\nJena\n\nNicht eingetragen: Den Gläubigern der an der Ausgliederung beteiligten Rechtsträger, ist wenn sie binnen sechs Monaten nach dem Tag, an dem die Eintragung der Ausgliederung in das Register des Sitzes desjenigen Rechtsträgers, dessen Gläubiger sie sind, nach §§125, 19 Abs. 3 UmwG als bekanntgemacht gilt, ihren Anspruch nach Grund und Höhe schriftlich anmelden, Sicherheit zu leisten, soweit sie nicht Befriedigung verlangen können. Dieses Recht steht ihnen jedoch nur zu, wenn sie glaubhaft machen, daß durch die Ausgliederung die Erfüllung ihrer Forderung gefährdet wird."
    },
    {
      "date": "2026-02-17",
      "id": "145355",
      "original_text": "Einreichung neuer Dokumente\nThüringen Amtsgericht Jena HRB 209759\nGRZ Service- und Verwaltungsgesellschaft mbH – Greiz",
      "type": "Einreichung neuer Dokumente",
      "state": "Thüringen",
      "amtsgericht": "Amtsgericht Jena",
      "registernummer": "HRB 209759",
      "registerart": "HRB",
      "company_name": "GRZ Service- und Verwaltungsgesellschaft mbH",
      "company_seat": "Greiz",
      "details": "17.02.2026 (Bekanntmachungsdatum)\n\nThüringen Amtsgericht Jena HRB 209759\nEinreichung neuer Dokumente 17.02.2026 (Eintragungsdatum)\n\nGRZ Service- und Verwaltungsgesellschaft mbH\nGesellschaft mit beschränkter Haftung\nGreiz\n\nBekanntmachung gem. § 52 Abs. 3 Satz 2 GmbHG: Aufgrund einer Veränderung in den Personen der Aufsichtsratsmitglieder ist durch die Geschäftsführer eine neue Liste zum Handelsregister eingereicht worden."
    },
    {
      "date": "2026-02-17",
      "id": "145356",
      "original_text": "Registerbekanntmachung nach dem Umwandlungsgesetz\nThüringen Amtsgericht Jena HRA 505268\nGöppel oHG – Großschwabhausen",
      "type": "Registerbekanntmachung nach dem Umwandlungsgesetz",
      "state": "Thüringen",
      "amtsgericht": "Amtsgericht Jena",
      "registernummer": "HRA 505268",
      "registerart": "HRA",
      "company_name": "Göppel oHG",
      "company_seat": "Großschwabhausen",
      "details": "17.02.2026 (Bekanntmachungsdatum)\n\nThüringen Amtsgericht Jena HRA 505268\nRegisterbekanntmachung nach dem Umwandlungsgesetz 17.02.2026 (Eintragungsdatum)\n\nGöppel oHG\nOffene Handelsgesellschaft\nGroßschwabhausen\n\nNicht eingetragen: Den Gläubigern der an der Verschmelzung beteiligten Rechtsträger, ist wenn sie binnen sechs Monaten nach dem Tag, an dem die Eintragung der Verschmelzung in das Register des Sitzes desjenigen Rechtsträgers, dessen Gläubiger sie sind,  nach § 19 Abs. 3 UmwG als bekanntgemacht gilt, ihren Anspruch nach Grund und Höhe schriftlich anmelden, Sicherheit zu leisten, soweit sie nicht Befriedigung verlangen können. Dieses Recht steht ihnen jedoch nur zu, wenn sie glaubhaft machen, daß durch die Verschmelzung die Erfüllung ihrer Forderung gefährdet wird."
    },
    {
      "date": "2026-02-17",
      "id": "145357",
      "original_text": "Einreichung neuer Dokumente\nHessen Amtsgericht Frankfurt am Main HRB 114198\nVR Payment GmbH – Frankfurt am Main",
      "type": "Einreichung neuer Dokumente",
      "state": "Hessen",
      "amtsgericht": "Amtsgericht Frankfurt am Main",
      "registernummer": "HRB 114198",
      "registerart": "HRB",
      "company_name": "VR Payment GmbH",
      "company_seat": "Frankfurt am Main",
      "details": "17.02.2026 (Bekanntmachungsdatum)\n\nHessen Amtsgericht Frankfurt am Main HRB 114198\nEinreichung neuer Dokumente 17.02.2026 (Eintragungsdatum)\n\nVR Payment GmbH\nGesellschaft mit beschränkter Haftung\nFrankfurt am Main\n\nDurch eine Änderung in den Personen der Aufsichtsratsmitglieder ist eine Liste der Mitglieder des Aufsichtsrates zum Handelsregister eingereicht worden."
    },
    {
      "date": "2026-02-17",
      "id": "145358",
      "original_text": "Registerbekanntmachung nach dem Umwandlungsgesetz\nHessen Amtsgericht Frankfurt am Main HRB 138438\nLunetta GmbH – Frankfurt am Main",
      "type": "Registerbekanntmachung nach dem Umwandlungsgesetz",
      "state": "Hessen",
      "amtsgericht": "Amtsgericht Frankfurt am Main",
      "registernummer": "HRB 138438",
      "registerart": "HRB",
      "company_name": "Lunetta GmbH",
      "company_seat": "Frankfurt am Main",
      "details": "17.02.2026 (Bekanntmachungsdatum)\n\nHessen Amtsgericht Frankfurt am Main HRB 138438\nRegisterbekanntmachung nach dem Umwandlungsgesetz 17.02.2026 (Eintragungsdatum)\n\nLunetta GmbH\nGesellschaft mit beschränkter Haftung\nFrankfurt am Main\n\nDen Gläubigern der an der Verschmelzung beteiligten Rechtsträger ist, wenn sie binnen sechs Monaten nach dem Tag, an dem die Eintragung der Verschmelzung in das Register des Sitzes desjenigen Rechtsträgers, dessen Gläubiger sie sind, nach § 19 Absatz 3 UmwG bekannt gemacht worden ist, ihren Anspruch nach Grund und Höhe schriftlich anmelden, Sicherheit zu leisten, soweit sie nicht Befriedigung verlangen können. Dieses Recht steht den Gläubigern jedoch nur zu, wenn sie glaubhaft machen, dass durch die Verschmelzung die Erfüllung ihrer Forderung gefährdet wird."
    },
    {
      "date": "2026-02-17",
      "id": "145359",
      "original_text": "Registerbekanntmachung nach dem Umwandlungsgesetz\nHessen Amtsgericht Frankfurt am Main HRB 90823\nargos-film & foto GmbH – Frankfurt am Main",
      "type": "Registerbekanntmachung nach dem Umwandlungsgesetz",
      "state": "Hessen",
      "amtsgericht": "Amtsgericht Frankfurt am Main",
      "registernummer": "HRB 90823",
      "registerart": "HRB",
      "company_name": "argos-film & foto GmbH",
      "company_seat": "Frankfurt am Main",
      "details": "17.02.2026 (Bekanntmachungsdatum)\n\nHessen Amtsgericht Frankfurt am Main HRB 90823\nRegisterbekanntmachung nach dem Umwandlungsgesetz 17.02.2026 (Eintragungsdatum)\n\nargos-film & foto GmbH\nGesellschaft mit beschränkter Haftung\nFrankfurt am Main\n\nDen Gläubigern der an der Verschmelzung beteiligten Rechtsträger ist, wenn sie binnen sechs Monaten nach dem Tag, an dem die Eintragung der Verschmelzung in das Register des Sitzes desjenigen Rechtsträgers, dessen Gläubiger sie sind, nach § 19 Absatz 3 UmwG bekannt gemacht worden ist, ihren Anspruch nach Grund und Höhe schriftlich anmelden, Sicherheit zu leisten, soweit sie nicht Befriedigung verlangen können. Dieses Recht steht den Gläubigern jedoch nur zu, wenn sie glaubhaft machen, dass durch die Verschmelzung die Erfüllung ihrer Forderung gefährdet wird."
    },
    {
      "date": "2026-02-17",
      "id": "145360",
      "original_text": "Einreichung neuer Dokumente\nHessen Amtsgericht Offenbach am Main HRB 4593\nEnergieversorgung Offenbach Aktiengesellschaft – Offenbach am Main",
      "type": "Einreichung neuer Dokumente",
      "state": "Hessen",
      "amtsgericht": "Amtsgericht Offenbach am Main",
      "registernummer": "HRB 4593",
      "registerart": "HRB",
      "company_name": "Energieversorgung Offenbach Aktiengesellschaft",
      "company_seat": "Offenbach am Main",
      "details": "17.02.2026 (Bekanntmachungsdatum)\n\nHessen Amtsgericht Offenbach am Main HRB 4593\nEinreichung neuer Dokumente\n\nEnergieversorgung Offenbach Aktiengesellschaft\nAktiengesellschaft\nOffenbach am Main\n\nDurch eine Änderung in den Personen der Aufsichtsratsmitglieder ist eine Liste der Mitglieder des Aufsichtsrates zum Handelsregister eingereicht worden."
    },
    {
      "date": "2026-02-17",
      "id": "145361",
      "original_text": "Sonstige Registerbekanntmachung\nHessen Amtsgericht Wiesbaden HRB 25651\nBilfinger Digital Next GmbH – Aarbergen",
      "type": "Sonstige Registerbekanntmachung",
      "state": "Hessen",
      "amtsgericht": "Amtsgericht Wiesbaden",
      "registernummer": "HRB 25651",
      "registerart": "HRB",
      "company_name": "Bilfinger Digital Next GmbH",
      "company_seat": "Aarbergen",
      "details": "17.02.2026 (Bekanntmachungsdatum)\n\nHessen Amtsgericht Wiesbaden HRB 25651\nSonstige Registerbekanntmachung 17.02.2026 (Eintragungsdatum)\n\nBilfinger Digital Next GmbH\nGesellschaft mit beschränkter Haftung\nAarbergen\n\nDen Gläubigern der Gesellschaft, deren Forderungen begründet worden sind, bevor die Eintragung der Beendigung des Vertrags in das Handelsregister nach § 10 HGB bekannt gemacht worden ist, ist vom anderen Vertragsteil Sicherheit zu leisten, wenn sie sich binnen sechs Monaten nach dieser Bekanntmachung zu diesem Zweck bei ihm melden."
    },
    {
      "date": "2026-02-17",
      "id": "145362",
      "original_text": "Sonstige Registerbekanntmachung\nHessen Amtsgericht Frankfurt am Main HRB 12394\nDeutsche Gesellschaft für Internationale Zusammenarbeit (GIZ) GmbH – Eschborn und Bonn",
      "type": "Sonstige Registerbekanntmachung",
      "state": "Hessen",
      "amtsgericht": "Amtsgericht Frankfurt am Main",
      "registernummer": "HRB 12394",
      "registerart": "HRB",
      "company_name": "Deutsche Gesellschaft für Internationale Zusammenarbeit (GIZ) GmbH",
      "company_seat": "Eschborn und Bonn",
      "details": "17.02.2026 (Bekanntmachungsdatum)\n\nHessen Amtsgericht Frankfurt am Main HRB 12394\nSonstige Registerbekanntmachung\n\nDeutsche Gesellschaft für Internationale Zusammenarbeit (GIZ) GmbH\nGesellschaft mit beschränkter Haftung\nEschborn und Bonn\n\nDurch eine Änderung in den Personen der Aufsichtsratsmitglieder ist eine Liste der Mitglieder des Aufsichtsrates zum Handelsregister eingereicht worden."
    },
    {
      "date": "2026-02-17",
      "id": "145363",
      "original_text": "Einreichung neuer Dokumente\nHessen Amtsgericht Frankfurt am Main HRB 74535\nCoreo AG – Frankfurt am Main",
      "type": "Einreichung neuer Dokumente",
      "state": "Hessen",
      "amtsgericht": "Amtsgericht Frankfurt am Main",
      "registernummer": "HRB 74535",
      "registerart": "HRB",
      "company_name": "Coreo AG",
      "company_seat": "Frankfurt am Main",
      "details": "17.02.2026 (Bekanntmachungsdatum)\n\nHessen Amtsgericht Frankfurt am Main HRB 74535\nEinreichung neuer Dokumente 17.02.2026 (Eintragungsdatum)\n\nCoreo AG\nAktiengesellschaft\nFrankfurt am Main\n\nDurch eine Änderung in den Personen der Aufsichtsratsmitglieder ist eine Liste der Mitglieder des Aufsichtsrates zum Handelsregister eingereicht worden."
    },
    {
      "date": "2026-02-17",
      "id": "145364",
      "original_text": "Registerbekanntmachung nach dem Umwandlungsgesetz\nHessen Amtsgericht Frankfurt am Main HRB 79466\nProventa AG – Frankfurt am Main",
      "type": "Registerbekanntmachung nach dem Umwandlungsgesetz",
      "state": "Hessen",
      "amtsgericht": "Amtsgericht Frankfurt am Main",
      "registernummer": "HRB 79466",
      "registerart": "HRB",
      "company_name": "Proventa AG",
      "company_seat": "Frankfurt am Main",
      "details": "17.02.2026 (Bekanntmachungsdatum)\n\nHessen Amtsgericht Frankfurt am Main HRB 79466\nRegisterbekanntmachung nach dem Umwandlungsgesetz 17.02.2026 (Eintragungsdatum)\n\nProventa AG\nAktiengesellschaft\nFrankfurt am Main\n\nDie Gesellschaft hat den Entwurf des Verschmelzungsvertrages zwischen ihr und der Proventa AcquiCo GmbH, München (Amtsgericht München, HRB 298307) beim Amtsgericht München (Registergericht) zur Einsichtnahme eingereicht."
    },
    {
      "date": "2026-02-17",
      "id": "145365",
      "original_text": "Sonstige Registerbekanntmachung\nHessen Amtsgericht Darmstadt HRB 91126\ncitiworks AG – Darmstadt",
      "type": "Sonstige Registerbekanntmachung",
      "state": "Hessen",
      "amtsgericht": "Amtsgericht Darmstadt",
      "registernummer": "HRB 91126",
      "registerart": "HRB",
      "company_name": "citiworks AG",
      "company_seat": "Darmstadt",
      "details": "17.02.2026 (Bekanntmachungsdatum)\n\nHessen Amtsgericht Darmstadt HRB 91126\nSonstige Registerbekanntmachung 17.02.2026 (Eintragungsdatum)\n\ncitiworks AG\nAktiengesellschaft\nDarmstadt\n\nWegen Änderungen in den Personen der Aufsichtsratsmitglieder ist eine Liste der Mitglieder des Aufsichtsrates zum Handelsregister eingereicht worden."
    },
    {
      "date": "2026-02-17",
      "id": "145366",
      "original_text": "Registerbekanntmachung nach dem Umwandlungsgesetz\nHessen Amtsgericht Frankfurt am Main HRA 54592\nargos-film Medienproduktion & Beratung e.K. – Frankfurt am Main",
      "type": "Registerbekanntmachung nach dem Umwandlungsgesetz",
      "state": "Hessen",
      "amtsgericht": "Amtsgericht Frankfurt am Main",
      "registernummer": "HRA 54592",
      "registerart": "HRA",
      "company_name": "argos-film Medienproduktion & Beratung e.K.",
      "company_seat": "Frankfurt am Main",
      "details": "17.02.2026 (Bekanntmachungsdatum)\n\nHessen Amtsgericht Frankfurt am Main HRA 54592\nRegisterbekanntmachung nach dem Umwandlungsgesetz 17.02.2026 (Eintragungsdatum)\n\nargos-film Medienproduktion & Beratung e.K.\nEinzelkaufmann / Einzelkauffrau\nFrankfurt am Main\n\nDen Gläubigern der an der Verschmelzung beteiligten Rechtsträger ist, wenn sie binnen sechs Monaten nach dem Tag, an dem die Eintragung der Verschmelzung in das Register des Sitzes desjenigen Rechtsträgers, dessen Gläubiger sie sind, nach § 19 Absatz 3 UmwG bekannt gemacht worden ist, ihren Anspruch nach Grund und Höhe schriftlich anmelden, Sicherheit zu leisten, soweit sie nicht Befriedigung verlangen können. Dieses Recht steht den Gläubigern jedoch nur zu, wenn sie glaubhaft machen, dass durch die Verschmelzung die Erfüllung ihrer Forderung gefährdet wird."
    },
    {
      "date": "2026-02-17",
      "id": "145367",
      "original_text": "Registerbekanntmachung nach dem Umwandlungsgesetz\nHessen Amtsgericht Frankfurt am Main HRB 96897\nFrancoforte Verwaltungs GmbH – Frankfurt am Main",
      "type": "Registerbekanntmachung nach dem Umwandlungsgesetz",
      "state": "Hessen",
      "amtsgericht": "Amtsgericht Frankfurt am Main",
      "registernummer": "HRB 96897",
      "registerart": "HRB",
      "company_name": "Francoforte Verwaltungs GmbH",
      "company_seat": "Frankfurt am Main",
      "details": "17.02.2026 (Bekanntmachungsdatum)\n\nHessen Amtsgericht Frankfurt am Main HRB 96897\nRegisterbekanntmachung nach dem Umwandlungsgesetz 17.02.2026 (Eintragungsdatum)\n\nFrancoforte Verwaltungs GmbH\nGesellschaft mit beschränkter Haftung\nFrankfurt am Main\n\nDen Gläubigern der an der Verschmelzung beteiligten Rechtsträger ist, wenn sie binnen sechs Monaten nach dem Tag, an dem die Eintragung der Verschmelzung in das Register des Sitzes desjenigen Rechtsträgers, dessen Gläubiger sie sind, nach § 19 Absatz 3 UmwG bekannt gemacht worden ist, ihren Anspruch nach Grund und Höhe schriftlich anmelden, Sicherheit zu leisten, soweit sie nicht Befriedigung verlangen können. Dieses Recht steht den Gläubigern jedoch nur zu, wenn sie glaubhaft machen, dass durch die Verschmelzung die Erfüllung ihrer Forderung gefährdet wird."
    },
    {
      "date": "2026-02-17",
      "id": "145368",
      "original_text": "Sonstige Registerbekanntmachung\nHessen Amtsgericht Wetzlar VR 436\nWirtschaftliche Vereinigung Wetzlar e.V. – Wetzlar",
      "type": "Sonstige Registerbekanntmachung",
      "state": "Hessen",
      "amtsgericht": "Amtsgericht Wetzlar",
      "registernummer": "VR 436",
      "registerart": "VR",
      "company_name": "Wirtschaftliche Vereinigung Wetzlar e.V.",
      "company_seat": "Wetzlar",
      "details": "17.02.2026 (Bekanntmachungsdatum)\n\nHessen Amtsgericht Wetzlar VR 436\nSonstige Registerbekanntmachung 17.02.2026 (Eintragungsdatum)\n\nWirtschaftliche Vereinigung Wetzlar e.V.\neingetragener Verein\nWetzlar\n\nDer Verein ist aufgelöst."
    }
  ]
}