{
  "date": "2026-02-06",
  "date_of_scrape": "2026-02-07T04:36:07.888Z",
  "tool_version": "0.2.0",
  "number_of_announcements": 106,
  "announcements": [
    {
      "date": "2026-02-06",
      "id": "144482",
      "original_text": "Registerbekanntmachung nach dem Umwandlungsgesetz\nBayern Amtsgericht München HRB 228080\nQualcomm Technologies GmbH – Unterschleißheim",
      "type": "Registerbekanntmachung nach dem Umwandlungsgesetz",
      "state": "Bayern",
      "amtsgericht": "Amtsgericht München",
      "registernummer": "HRB 228080",
      "registerart": "HRB",
      "company_name": "Qualcomm Technologies GmbH",
      "company_seat": "Unterschleißheim",
      "details": "06.02.2026 (Bekanntmachungsdatum)\n\nBayern Amtsgericht München HRB 228080\nRegisterbekanntmachung nach dem Umwandlungsgesetz 05.02.2026 (Eintragungsdatum)\n\nQualcomm Technologies GmbH\nGesellschaft mit beschränkter Haftung\nUnterschleißheim\n\nDen Gläubigern der an der Verschmelzung beteiligten Rechtsträger ist, wenn sie binnen sechs Monaten nach dem Tag, an dem die Eintragung der Verschmelzung in das Register des Sitzes desjenigen Rechtsträgers, dessen Gläubiger sie sind, nach § 19 Abs. 3 UmwG als bekannt gemacht gilt, ihren Anspruch nach Grund und Höhe in Textform anmelden, Sicherheit zu leisten, soweit sie nicht Befriedigung verlangen können. Dieses Recht steht den Gläubigern jedoch nur zu, wenn sie glaubhaft machen, dass durch die Verschmelzung die Erfüllung ihrer Forderung gefährdet wird."
    },
    {
      "date": "2026-02-06",
      "id": "144483",
      "original_text": "Registerbekanntmachung nach dem Umwandlungsgesetz\nBayern Amtsgericht München HRB 277367\nSchubert Holding UG (haftungsbeschränkt) – München",
      "type": "Registerbekanntmachung nach dem Umwandlungsgesetz",
      "state": "Bayern",
      "amtsgericht": "Amtsgericht München",
      "registernummer": "HRB 277367",
      "registerart": "HRB",
      "company_name": "Schubert Holding UG (haftungsbeschränkt)",
      "company_seat": "München",
      "details": "06.02.2026 (Bekanntmachungsdatum)\n\nBayern Amtsgericht München HRB 277367\nRegisterbekanntmachung nach dem Umwandlungsgesetz 05.02.2026 (Eintragungsdatum)\n\nSchubert Holding UG (haftungsbeschränkt)\nGesellschaft mit beschränkter Haftung\nMünchen\n\nDen Gläubigern der an der Verschmelzung beteiligten Rechtsträger ist, wenn sie binnen sechs Monaten nach dem Tag, an dem die Eintragung der Verschmelzung in das Register des Sitzes desjenigen Rechtsträgers, dessen Gläubiger sie sind, nach § 19 Abs. 3 UmwG als bekannt gemacht gilt, ihren Anspruch nach Grund und Höhe in Textform anmelden, Sicherheit zu leisten, soweit sie nicht Befriedigung verlangen können. Dieses Recht steht den Gläubigern jedoch nur zu, wenn sie glaubhaft machen, dass durch die Verschmelzung die Erfüllung ihrer Forderung gefährdet wird."
    },
    {
      "date": "2026-02-06",
      "id": "144484",
      "original_text": "Registerbekanntmachung nach dem Umwandlungsgesetz\nBayern Amtsgericht Traunstein HRB 21550\nReichlmeier Verwaltungs-GmbH – Berchtesgaden",
      "type": "Registerbekanntmachung nach dem Umwandlungsgesetz",
      "state": "Bayern",
      "amtsgericht": "Amtsgericht Traunstein",
      "registernummer": "HRB 21550",
      "registerart": "HRB",
      "company_name": "Reichlmeier Verwaltungs-GmbH",
      "company_seat": "Berchtesgaden",
      "details": "06.02.2026 (Bekanntmachungsdatum)\n\nBayern Amtsgericht Traunstein HRB 21550\nRegisterbekanntmachung nach dem Umwandlungsgesetz 05.02.2026 (Eintragungsdatum)\n\nReichlmeier Verwaltungs-GmbH\nGesellschaft mit beschränkter Haftung\nBerchtesgaden\n\nDen Gläubigern der an der Verschmelzung beteiligten Rechtsträger ist, wenn sie binnen sechs Monaten nach dem Tag, an dem die Eintragung der Verschmelzung in das Register des Sitzes desjenigen Rechtsträgers, dessen Gläubiger sie sind, nach § 19 Abs. 3 UmwG als bekannt gemacht gilt, ihren Anspruch nach Grund und Höhe in Textform anmelden, Sicherheit zu leisten, soweit sie nicht Befriedigung verlangen können. Dieses Recht steht den Gläubigern jedoch nur zu, wenn sie glaubhaft machen, dass durch die Verschmelzung die Erfüllung ihrer Forderung gefährdet wird."
    },
    {
      "date": "2026-02-06",
      "id": "144485",
      "original_text": "Sonstige Registerbekanntmachung\nBayern Amtsgericht Schweinfurt HRB 5203\nPromera Anlagen-Systeme GmbH – Schweinfurt",
      "type": "Sonstige Registerbekanntmachung",
      "state": "Bayern",
      "amtsgericht": "Amtsgericht Schweinfurt",
      "registernummer": "HRB 5203",
      "registerart": "HRB",
      "company_name": "Promera Anlagen-Systeme GmbH",
      "company_seat": "Schweinfurt",
      "details": "06.02.2026 (Bekanntmachungsdatum)\n\nBayern Amtsgericht Schweinfurt HRB 5203\nSonstige Registerbekanntmachung 05.02.2026 (Eintragungsdatum)\n\nPromera Anlagen-Systeme GmbH\nGesellschaft mit beschränkter Haftung\nSchweinfurt\n\nDen Gläubigern der Gesellschaft, deren Forderungen begründet worden sind, bevor die Eintragung der Beendigung des Beherrschungs- und Gewinnabführungsvertrages in das Handelsregister nach § 10 des Handelsgesetzbuches als bekanntgemacht gilt, hat der andere Vertragsteil Sicherheit zu leisten, wenn sie sich binnen sechs Monaten nach der Bekanntmachung der Eintragung zu diesem Zweck bei ihm melden."
    },
    {
      "date": "2026-02-06",
      "id": "144486",
      "original_text": "Löschungsankündigung\nBayern Amtsgericht Kempten (Allgäu) HRB 16958\nHampp Transporte GmbH – Wiggensbach",
      "type": "Löschungsankündigung",
      "state": "Bayern",
      "amtsgericht": "Amtsgericht Kempten (Allgäu)",
      "registernummer": "HRB 16958",
      "registerart": "HRB",
      "company_name": "Hampp Transporte GmbH",
      "company_seat": "Wiggensbach",
      "details": "06.02.2026 (Bekanntmachungsdatum)\n\nBayern Amtsgericht Kempten (Allgäu) HRB 16958\nLöschungsankündigung\n\nHampp Transporte GmbH\nGesellschaft mit beschränkter Haftung\nWiggensbach\n\nDas Registergericht beabsichtigt, die im Handelsregister eingetragene Gesellschaft wegen Vermögenslosigkeit von Amts wegen nach § 394 FamFG zu löschen. Die Frist zur Erhebung eines Widerspruchs ist auf einen Monat festgesetzt."
    },
    {
      "date": "2026-02-06",
      "id": "144487",
      "original_text": "Sonstige Registerbekanntmachung\nBayern Amtsgericht Hof HRB 7136\nMirotec Glas- und Metallbau GmbH – Rehau",
      "type": "Sonstige Registerbekanntmachung",
      "state": "Bayern",
      "amtsgericht": "Amtsgericht Hof",
      "registernummer": "HRB 7136",
      "registerart": "HRB",
      "company_name": "Mirotec Glas- und Metallbau GmbH",
      "company_seat": "Rehau",
      "details": "06.02.2026 (Bekanntmachungsdatum)\n\nBayern Amtsgericht Hof HRB 7136\nSonstige Registerbekanntmachung 05.02.2026 (Eintragungsdatum)\n\nMirotec Glas- und Metallbau GmbH\nGesellschaft mit beschränkter Haftung\nRehau\n\nDen Gläubigern der Gesellschaft, deren Forderungen begründet worden sind, bevor die Eintragung der Beendigung des Ergebnisabführungsvertrags in das Handelsregister nach § 10 des Handelsgesetzbuches als bekanntgemacht gilt, hat der andere Vertragsteil Sicherheit zu leisten, wenn sie sich binnen sechs Monaten nach der Bekanntmachung der Eintragung zu diesem Zweck bei ihm melden."
    },
    {
      "date": "2026-02-06",
      "id": "144488",
      "original_text": "Registerbekanntmachung nach dem Umwandlungsgesetz\nBayern Amtsgericht München HRB 309438\nTRESEC Forensik GmbH – München",
      "type": "Registerbekanntmachung nach dem Umwandlungsgesetz",
      "state": "Bayern",
      "amtsgericht": "Amtsgericht München",
      "registernummer": "HRB 309438",
      "registerart": "HRB",
      "company_name": "TRESEC Forensik GmbH",
      "company_seat": "München",
      "details": "06.02.2026 (Bekanntmachungsdatum)\n\nBayern Amtsgericht München HRB 309438\nRegisterbekanntmachung nach dem Umwandlungsgesetz 05.02.2026 (Eintragungsdatum)\n\nTRESEC Forensik GmbH\nGesellschaft mit beschränkter Haftung\nMünchen\n\nDen Gläubigern des formwechselnden Rechtsträgers ist, wenn sie binnen sechs Monaten nach dem Tag, an dem die Eintragung des Formwechsels nach § 201 UmwG als bekannt gemacht gilt, ihren Anspruch nach Grund und Höhe in Textform anmelden, Sicherheit zu leisten, soweit sie nicht Befriedigung verlangen können. Dieses Recht steht den Gläubigern jedoch nur zu, wenn sie glaubhaft machen, dass durch den Formwechsel die Erfüllung ihrer Forderung gefährdet wird."
    },
    {
      "date": "2026-02-06",
      "id": "144489",
      "original_text": "Registerbekanntmachung nach dem Umwandlungsgesetz\nBayern Amtsgericht München HRB 241080\nUVG Umspannwerk Verwaltungsgesellschaft mbH – Neubiberg",
      "type": "Registerbekanntmachung nach dem Umwandlungsgesetz",
      "state": "Bayern",
      "amtsgericht": "Amtsgericht München",
      "registernummer": "HRB 241080",
      "registerart": "HRB",
      "company_name": "UVG Umspannwerk Verwaltungsgesellschaft mbH",
      "company_seat": "Neubiberg",
      "details": "06.02.2026 (Bekanntmachungsdatum)\n\nBayern Amtsgericht München HRB 241080\nRegisterbekanntmachung nach dem Umwandlungsgesetz 05.02.2026 (Eintragungsdatum)\n\nUVG Umspannwerk Verwaltungsgesellschaft mbH\nGesellschaft mit beschränkter Haftung\nNeubiberg\n\nDen Gläubigern der an der Verschmelzung beteiligten Rechtsträger ist, wenn sie binnen sechs Monaten nach dem Tag, an dem die Eintragung der Verschmelzung in das Register des Sitzes desjenigen Rechtsträgers, dessen Gläubiger sie sind, nach § 19 Abs. 3 UmwG als bekannt gemacht gilt, ihren Anspruch nach Grund und Höhe in Textform anmelden, Sicherheit zu leisten, soweit sie nicht Befriedigung verlangen können. Dieses Recht steht den Gläubigern jedoch nur zu, wenn sie glaubhaft machen, dass durch die Verschmelzung die Erfüllung ihrer Forderung gefährdet wird."
    },
    {
      "date": "2026-02-06",
      "id": "144490",
      "original_text": "Registerbekanntmachung nach dem Umwandlungsgesetz\nBayern Amtsgericht München GsR 3062\nTRESEC Forensik eGbR – München",
      "type": "Registerbekanntmachung nach dem Umwandlungsgesetz",
      "state": "Bayern",
      "amtsgericht": "Amtsgericht München",
      "registernummer": "GsR 3062",
      "registerart": "GsR",
      "company_name": "TRESEC Forensik eGbR",
      "company_seat": "München",
      "details": "06.02.2026 (Bekanntmachungsdatum)\n\nBayern Amtsgericht München GsR 3062\nRegisterbekanntmachung nach dem Umwandlungsgesetz 05.02.2026 (Eintragungsdatum)\n\nTRESEC Forensik eGbR\nGesellschaft bürgerlichen Rechts\nMünchen\n\nDen Gläubigern des formwechselnden Rechtsträgers ist, wenn sie binnen sechs Monaten nach dem Tag, an dem die Eintragung des Formwechsels nach § 201 UmwG als bekannt gemacht gilt, ihren Anspruch nach Grund und Höhe in Textform anmelden, Sicherheit zu leisten, soweit sie nicht Befriedigung verlangen können. Dieses Recht steht den Gläubigern jedoch nur zu, wenn sie glaubhaft machen, dass durch den Formwechsel die Erfüllung ihrer Forderung gefährdet wird."
    },
    {
      "date": "2026-02-06",
      "id": "144491",
      "original_text": "Löschungsankündigung\nBayern Amtsgericht München HRB 168288\nBrkic Bauträger GmbH – Türkenfeld",
      "type": "Löschungsankündigung",
      "state": "Bayern",
      "amtsgericht": "Amtsgericht München",
      "registernummer": "HRB 168288",
      "registerart": "HRB",
      "company_name": "Brkic Bauträger GmbH",
      "company_seat": "Türkenfeld",
      "details": "06.02.2026 (Bekanntmachungsdatum)\n\nBayern Amtsgericht München HRB 168288\nLöschungsankündigung\n\nBrkic Bauträger GmbH\nGesellschaft mit beschränkter Haftung\nTürkenfeld\n\nDas Registergericht beabsichtigt, den im Handelsregister eingetragenen Geschäftsführer Brkic, Aleksandar, geb. 24.10.1977 wegen fehlender Eignung nach § 395 FamFG zu löschen. Die Frist zur Erhebung eines Widerspruchs ist auf drei Monate festgesetzt."
    },
    {
      "date": "2026-02-06",
      "id": "144492",
      "original_text": "Einreichung neuer Dokumente\nBayern Amtsgericht Ingolstadt HRB 101008\nBAUER Spezialtiefbau GmbH – Schrobenhausen",
      "type": "Einreichung neuer Dokumente",
      "state": "Bayern",
      "amtsgericht": "Amtsgericht Ingolstadt",
      "registernummer": "HRB 101008",
      "registerart": "HRB",
      "company_name": "BAUER Spezialtiefbau GmbH",
      "company_seat": "Schrobenhausen",
      "details": "06.02.2026 (Bekanntmachungsdatum)\n\nBayern Amtsgericht Ingolstadt HRB 101008\nEinreichung neuer Dokumente\n\nBAUER Spezialtiefbau GmbH\nGesellschaft mit beschränkter Haftung\nSchrobenhausen\n\nDem Amtsgericht Ingolstadt -Registergericht- ist eine Liste der Mitglieder des Aufsichtsrats eingereicht worden, § 52 Abs. 3 S. 2 GmbHG."
    },
    {
      "date": "2026-02-06",
      "id": "144493",
      "original_text": "Löschungsankündigung\nBayern Amtsgericht München HRB 102985\nGfG TrainerKolleg für mentale Aktivierung GmbH – Ebersberg",
      "type": "Löschungsankündigung",
      "state": "Bayern",
      "amtsgericht": "Amtsgericht München",
      "registernummer": "HRB 102985",
      "registerart": "HRB",
      "company_name": "GfG TrainerKolleg für mentale Aktivierung GmbH",
      "company_seat": "Ebersberg",
      "details": "06.02.2026 (Bekanntmachungsdatum)\n\nBayern Amtsgericht München HRB 102985\nLöschungsankündigung 05.02.2026 (Eintragungsdatum)\n\nGfG TrainerKolleg für mentale Aktivierung GmbH\nGesellschaft mit beschränkter Haftung\nEbersberg\n\nDas Registergericht beabsichtigt, die im Handelsregister eingetragene Gesellschaft wegen Vermögenslosigkeit von Amts wegen nach § 394 FamFG zu löschen. Die Frist zur Erhebung eines Widerspruchs ist auf drei Monate festgesetzt."
    },
    {
      "date": "2026-02-06",
      "id": "144494",
      "original_text": "Registerbekanntmachung nach dem Umwandlungsgesetz\nBayern Amtsgericht München HRB 278087\nIoannidis Holding UG (haftungsbeschränkt) – München",
      "type": "Registerbekanntmachung nach dem Umwandlungsgesetz",
      "state": "Bayern",
      "amtsgericht": "Amtsgericht München",
      "registernummer": "HRB 278087",
      "registerart": "HRB",
      "company_name": "Ioannidis Holding UG (haftungsbeschränkt)",
      "company_seat": "München",
      "details": "06.02.2026 (Bekanntmachungsdatum)\n\nBayern Amtsgericht München HRB 278087\nRegisterbekanntmachung nach dem Umwandlungsgesetz 05.02.2026 (Eintragungsdatum)\n\nIoannidis Holding UG (haftungsbeschränkt)\nGesellschaft mit beschränkter Haftung\nMünchen\n\nDen Gläubigern der an der Verschmelzung beteiligten Rechtsträger ist, wenn sie binnen sechs Monaten nach dem Tag, an dem die Eintragung der Verschmelzung in das Register des Sitzes desjenigen Rechtsträgers, dessen Gläubiger sie sind, nach § 19 Abs. 3 UmwG als bekannt gemacht gilt, ihren Anspruch nach Grund und Höhe in Textform anmelden, Sicherheit zu leisten, soweit sie nicht Befriedigung verlangen können. Dieses Recht steht den Gläubigern jedoch nur zu, wenn sie glaubhaft machen, dass durch die Verschmelzung die Erfüllung ihrer Forderung gefährdet wird."
    },
    {
      "date": "2026-02-06",
      "id": "144495",
      "original_text": "Registerbekanntmachung nach dem Umwandlungsgesetz\nBayern Amtsgericht Traunstein HRB 32768\nSanitätshaus Gebhardt GmbH – Rosenheim",
      "type": "Registerbekanntmachung nach dem Umwandlungsgesetz",
      "state": "Bayern",
      "amtsgericht": "Amtsgericht Traunstein",
      "registernummer": "HRB 32768",
      "registerart": "HRB",
      "company_name": "Sanitätshaus Gebhardt GmbH",
      "company_seat": "Rosenheim",
      "details": "06.02.2026 (Bekanntmachungsdatum)\n\nBayern Amtsgericht Traunstein HRB 32768\nRegisterbekanntmachung nach dem Umwandlungsgesetz 05.02.2026 (Eintragungsdatum)\n\nSanitätshaus Gebhardt GmbH\nGesellschaft mit beschränkter Haftung\nRosenheim\n\nDen Gläubigern der an der Verschmelzung beteiligten Rechtsträger ist, wenn sie binnen sechs Monaten nach dem Tag, an dem die Eintragung der Verschmelzung in das Register des Sitzes desjenigen Rechtsträgers, dessen Gläubiger sie sind, nach § 19 Abs. 3 UmwG als bekannt gemacht gilt, ihren Anspruch nach Grund und Höhe in Textform anmelden, Sicherheit zu leisten, soweit sie nicht Befriedigung verlangen können. Dieses Recht steht den Gläubigern jedoch nur zu, wenn sie glaubhaft machen, dass durch die Verschmelzung die Erfüllung ihrer Forderung gefährdet wird."
    },
    {
      "date": "2026-02-06",
      "id": "144496",
      "original_text": "Registerbekanntmachung nach dem Umwandlungsgesetz\nBaden-Württemberg Amtsgericht Stuttgart HRB 790171\nHWS RMK Verwaltungs-GmbH Steuerberatungsgesellschaft – Korb",
      "type": "Registerbekanntmachung nach dem Umwandlungsgesetz",
      "state": "Baden-Württemberg",
      "amtsgericht": "Amtsgericht Stuttgart",
      "registernummer": "HRB 790171",
      "registerart": "HRB",
      "company_name": "HWS RMK Verwaltungs-GmbH Steuerberatungsgesellschaft",
      "company_seat": "Korb",
      "details": "06.02.2026 (Bekanntmachungsdatum)\n\nBaden-Württemberg Amtsgericht Stuttgart HRB 790171\nRegisterbekanntmachung nach dem Umwandlungsgesetz 06.02.2026 (Eintragungsdatum)\n\nHWS RMK Verwaltungs-GmbH Steuerberatungsgesellschaft\nGesellschaft mit beschränkter Haftung\nKorb\n\nAls nicht eingetragen wird bekanntgemacht:\nDen Gläubigern der an der Verschmelzung beteiligten Rechtsträger ist, wenn sie binnen sechs Monaten nach dem Tag, an dem die Eintragung der Verschmelzung in das Register des Sitzes desjenigen Rechtsträgers, dessen Gläubiger sie sind, nach § 19 Abs. 3 UmwG als bekanntgemacht gilt, ihren Anspruch nach Grund und Höhe schriftlich anmelden, Sicherheit zu leisten, soweit sie nicht Befriedigung verlangen können. Dieses Recht steht den Gläubigern jedoch nur zu, wenn sie glaubhaft machen, dass durch die Verschmelzung die Erfüllung ihrer Forderung gefährdet wird."
    },
    {
      "date": "2026-02-06",
      "id": "144497",
      "original_text": "Löschungsankündigung\nBerlin Amtsgericht Berlin (Charlottenburg) HRB 134434\nGood Morning Backwarenvertrieb Berlin UG (haftungsbeschränkt) – Berlin",
      "type": "Löschungsankündigung",
      "state": "Berlin",
      "amtsgericht": "Amtsgericht Berlin (Charlottenburg)",
      "registernummer": "HRB 134434",
      "registerart": "HRB",
      "company_name": "Good Morning Backwarenvertrieb Berlin UG (haftungsbeschränkt)",
      "company_seat": "Berlin",
      "details": "06.02.2026 (Bekanntmachungsdatum)\n\nBerlin Amtsgericht Berlin (Charlottenburg) HRB 134434\nLöschungsankündigung\n\nGood Morning Backwarenvertrieb Berlin UG (haftungsbeschränkt)\nGesellschaft mit beschränkter Haftung\nBerlin\n\nBei der nachstehenden Gesellschaft wird das Amtslöschungsverfahren gemäß § 394 FamFG eingeleitet. Widerspruchsfrist 6 Wochen"
    },
    {
      "date": "2026-02-06",
      "id": "144498",
      "original_text": "Einreichung neuer Dokumente\nBaden-Württemberg Amtsgericht Freiburg HRB 300584\nHELIOS Kliniken Breisgau- Hochschwarzwald GmbH – Müllheim",
      "type": "Einreichung neuer Dokumente",
      "state": "Baden-Württemberg",
      "amtsgericht": "Amtsgericht Freiburg",
      "registernummer": "HRB 300584",
      "registerart": "HRB",
      "company_name": "HELIOS Kliniken Breisgau- Hochschwarzwald GmbH",
      "company_seat": "Müllheim",
      "details": "06.02.2026 (Bekanntmachungsdatum)\n\nBaden-Württemberg Amtsgericht Freiburg HRB 300584\nEinreichung neuer Dokumente\n\nHELIOS Kliniken Breisgau- Hochschwarzwald GmbH\nGesellschaft mit beschränkter Haftung\nMüllheim\n\nDie Gesellschaft hat am 05.02.2026 die Liste über die Zusammensetzung des Aufsichtsrats zum Handelsregister eingereicht."
    },
    {
      "date": "2026-02-06",
      "id": "144499",
      "original_text": "Löschungsankündigung\nBrandenburg Amtsgericht Potsdam HRB 24210\nBodo Hoffmann GmbH – Werder (Havel)",
      "type": "Löschungsankündigung",
      "state": "Brandenburg",
      "amtsgericht": "Amtsgericht Potsdam",
      "registernummer": "HRB 24210",
      "registerart": "HRB",
      "company_name": "Bodo Hoffmann GmbH",
      "company_seat": "Werder (Havel)",
      "details": "06.02.2026 (Bekanntmachungsdatum)\n\nBrandenburg Amtsgericht Potsdam HRB 24210\nLöschungsankündigung\n\nBodo Hoffmann GmbH\nGesellschaft mit beschränkter Haftung\nWerder (Havel)\n\nBei der nachstehenden Gesellschaft wird das Amtslöschungsverfahren gemäß § 394 FamFG eingeleitet. Widerspruchsfrist: 8 Wochen."
    },
    {
      "date": "2026-02-06",
      "id": "144500",
      "original_text": "Registerbekanntmachung nach dem Umwandlungsgesetz\nHamburg Amtsgericht Hamburg HRB 79505\nZweite Mercator Vermietungsgesellschaft mbH – Hamburg",
      "type": "Registerbekanntmachung nach dem Umwandlungsgesetz",
      "state": "Hamburg",
      "amtsgericht": "Amtsgericht Hamburg",
      "registernummer": "HRB 79505",
      "registerart": "HRB",
      "company_name": "Zweite Mercator Vermietungsgesellschaft mbH",
      "company_seat": "Hamburg",
      "details": "06.02.2026 (Bekanntmachungsdatum)\n\nHamburg Amtsgericht Hamburg HRB 79505\nRegisterbekanntmachung nach dem Umwandlungsgesetz 06.02.2026 (Eintragungsdatum)\n\nZweite Mercator Vermietungsgesellschaft mbH\nGesellschaft mit beschränkter Haftung\nHamburg\n\nAls nicht eingetragen wird bekannt gemacht:\nDen Gläubigern der an der Verschmelzung beteiligten Gesellschaften ist, wenn sie binnen sechs Monaten nach dem Tag, an dem die Eintragung der Verschmelzung in das Register des Sitzes desjenigen Rechtsträgers, dessen Gläubiger sie sind, nach § 19 Absatz 3 UmwG als bekannt gemacht gilt, ihren Anspruch nach Grund und Höhe schriftlich anmelden, Sicherheit zu leisten, soweit sie nicht Befriedigung verlangen können. Dieses Recht steht den Gläubigern jedoch nur zu, wenn sie glaubhaft machen, dass durch die Verschmelzung die Erfüllung ihrer Forderung gefährdet wird."
    },
    {
      "date": "2026-02-06",
      "id": "144501",
      "original_text": "Löschungsankündigung\nSchleswig-Holstein Amtsgericht Flensburg HRA 853 NI\nWein-Fuchs Vertriebsgesellschaft mbH & Co. KG – Sylt-Ost/Tinnum",
      "type": "Löschungsankündigung",
      "state": "Schleswig-Holstein",
      "amtsgericht": "Amtsgericht Flensburg",
      "registernummer": "HRA 853 NI",
      "registerart": "HRA",
      "company_name": "Wein-Fuchs Vertriebsgesellschaft mbH & Co. KG",
      "company_seat": "Sylt-Ost/Tinnum",
      "details": "06.02.2026 (Bekanntmachungsdatum)\n\nSchleswig-Holstein Amtsgericht Flensburg HRA 853 NI\nLöschungsankündigung\n\nWein-Fuchs Vertriebsgesellschaft mbH & Co. KG\nKommanditgesellschaft\nSylt-Ost/Tinnum\n\nEs ist die Löschung der nachstehenden Gesellschaft wegen Vermögenslosigkeit gemäß § 394 FamFG von Amts wegen beabsichtigt.\nWiderspruchsfrist: 2 Monate"
    },
    {
      "date": "2026-02-06",
      "id": "144502",
      "original_text": "Registerbekanntmachung nach dem Umwandlungsgesetz\nBerlin Amtsgericht Berlin (Charlottenburg) HRB 163017\nROBA Transportbeton GmbH – Berlin",
      "type": "Registerbekanntmachung nach dem Umwandlungsgesetz",
      "state": "Berlin",
      "amtsgericht": "Amtsgericht Berlin (Charlottenburg)",
      "registernummer": "HRB 163017",
      "registerart": "HRB",
      "company_name": "ROBA Transportbeton GmbH",
      "company_seat": "Berlin",
      "details": "06.02.2026 (Bekanntmachungsdatum)\n\nBerlin Amtsgericht Berlin (Charlottenburg) HRB 163017\nRegisterbekanntmachung nach dem Umwandlungsgesetz 05.02.2026 (Eintragungsdatum)\n\nROBA Transportbeton GmbH\nGesellschaft mit beschränkter Haftung\nBerlin\n\nZu Eintragungsnummer 7 vom 05.02.2026 wird als nicht eingetragen veröffentlicht: Der andere Vertragsteil hat den Gläubigern dieses Rechtsträgers, deren Forderungen begründet worden sind, bevor die Eintragung der Beendigung dieses Vertrages in das Handelsregister nach § 10 des Handelsgesetzbuches als bekannt gemacht gilt, Sicherheit zu leisten, wenn sie sich binnen sechs Monaten nach der Bekanntmachung der Eintragung zu diesem Zweck bei ihm melden. Dieses Recht steht den Gläubigern nicht zu, die im Fall des Insolvenzverfahrens ein Recht auf vorzugsweise Befriedigung aus der Deckungsmasse haben, die nach gesetzlicher Vorschrift zu ihrem Schutz errichtet und staatlich überwacht ist."
    },
    {
      "date": "2026-02-06",
      "id": "144503",
      "original_text": "Löschungsankündigung\nBerlin Amtsgericht Berlin (Charlottenburg) HRB 182037\nInvalesco UG (haftungsbeschränkt) – Berlin",
      "type": "Löschungsankündigung",
      "state": "Berlin",
      "amtsgericht": "Amtsgericht Berlin (Charlottenburg)",
      "registernummer": "HRB 182037",
      "registerart": "HRB",
      "company_name": "Invalesco UG (haftungsbeschränkt)",
      "company_seat": "Berlin",
      "details": "06.02.2026 (Bekanntmachungsdatum)\n\nBerlin Amtsgericht Berlin (Charlottenburg) HRB 182037\nLöschungsankündigung\n\nInvalesco UG (haftungsbeschränkt)\nGesellschaft mit beschränkter Haftung\nBerlin\n\nBei der nachstehenden Gesellschaft wird das Amtslöschungsverfahren gemäß § 394 FamFG eingeleitet. Widerspruchsfrist 6 Wochen."
    },
    {
      "date": "2026-02-06",
      "id": "144504",
      "original_text": "Löschungsankündigung\nBrandenburg Amtsgericht Potsdam HRB 33687\nGrand Bau UG (haftungsbeschränkt) – Nauen",
      "type": "Löschungsankündigung",
      "state": "Brandenburg",
      "amtsgericht": "Amtsgericht Potsdam",
      "registernummer": "HRB 33687",
      "registerart": "HRB",
      "company_name": "Grand Bau UG (haftungsbeschränkt)",
      "company_seat": "Nauen",
      "details": "06.02.2026 (Bekanntmachungsdatum)\n\nBrandenburg Amtsgericht Potsdam HRB 33687\nLöschungsankündigung\n\nGrand Bau UG (haftungsbeschränkt)\nGesellschaft mit beschränkter Haftung\nNauen\n\nBei der nachstehenden Gesellschaft wird das Amtslöschungsverfahren gemäß § 394 FamFG eingeleitet. Widerspruchsfrist: 8 Wochen."
    },
    {
      "date": "2026-02-06",
      "id": "144505",
      "original_text": "Einreichung neuer Dokumente\nBaden-Württemberg Amtsgericht Stuttgart HRB 750582\nVfB Stuttgart 1893 AG – Stuttgart",
      "type": "Einreichung neuer Dokumente",
      "state": "Baden-Württemberg",
      "amtsgericht": "Amtsgericht Stuttgart",
      "registernummer": "HRB 750582",
      "registerart": "HRB",
      "company_name": "VfB Stuttgart 1893 AG",
      "company_seat": "Stuttgart",
      "details": "06.02.2026 (Bekanntmachungsdatum)\n\nBaden-Württemberg Amtsgericht Stuttgart HRB 750582\nEinreichung neuer Dokumente\n\nVfB Stuttgart 1893 AG\nAktiengesellschaft\nStuttgart\n\nDie Gesellschaft hat am 05.02.2026 die Liste über die Zusammensetzung des Aufsichtsrats zum Handelsregister eingereicht."
    },
    {
      "date": "2026-02-06",
      "id": "144506",
      "original_text": "Registerbekanntmachung nach dem Umwandlungsgesetz\nHamburg Amtsgericht Hamburg HRB 11490\nFORUM Grundstücksgesellschaft m.b.H. – Hamburg",
      "type": "Registerbekanntmachung nach dem Umwandlungsgesetz",
      "state": "Hamburg",
      "amtsgericht": "Amtsgericht Hamburg",
      "registernummer": "HRB 11490",
      "registerart": "HRB",
      "company_name": "FORUM Grundstücksgesellschaft m.b.H.",
      "company_seat": "Hamburg",
      "details": "06.02.2026 (Bekanntmachungsdatum)\n\nHamburg Amtsgericht Hamburg HRB 11490\nRegisterbekanntmachung nach dem Umwandlungsgesetz 06.02.2026 (Eintragungsdatum)\n\nFORUM Grundstücksgesellschaft m.b.H.\nGesellschaft mit beschränkter Haftung\nHamburg\n\nAls nicht eingetragen wird bekannt gemacht:\nDen Gläubigern der an der Verschmelzung beteiligten Gesellschaften ist, wenn sie binnen sechs Monaten nach dem Tag, an dem die Eintragung der Verschmelzung in das Register des Sitzes desjenigen Rechtsträgers, dessen Gläubiger sie sind, nach § 19 Absatz 3 UmwG als bekannt gemacht gilt, ihren Anspruch nach Grund und Höhe schriftlich anmelden, Sicherheit zu leisten, soweit sie nicht Befriedigung verlangen können. Dieses Recht steht den Gläubigern jedoch nur zu, wenn sie glaubhaft machen, dass durch die Verschmelzung die Erfüllung ihrer Forderung gefährdet wird."
    },
    {
      "date": "2026-02-06",
      "id": "144507",
      "original_text": "Löschungsankündigung\nBerlin Amtsgericht Berlin (Charlottenburg) HRB 234019\nSourceRT UG (haftungsbeschränkt) – Berlin",
      "type": "Löschungsankündigung",
      "state": "Berlin",
      "amtsgericht": "Amtsgericht Berlin (Charlottenburg)",
      "registernummer": "HRB 234019",
      "registerart": "HRB",
      "company_name": "SourceRT UG (haftungsbeschränkt)",
      "company_seat": "Berlin",
      "details": "06.02.2026 (Bekanntmachungsdatum)\n\nBerlin Amtsgericht Berlin (Charlottenburg) HRB 234019\nLöschungsankündigung\n\nSourceRT UG (haftungsbeschränkt)\nGesellschaft mit beschränkter Haftung\nBerlin\n\nBei der nachstehenden Gesellschaft wird das Amtslöschungsverfahren gemäß § 394 FamFG eingeleitet. Widerspruchsfrist 6 Wochen"
    },
    {
      "date": "2026-02-06",
      "id": "144508",
      "original_text": "Registerbekanntmachung nach dem Umwandlungsgesetz\nHamburg Amtsgericht Hamburg VR 5976\nSozialkasse der OTTO BETRIEBE e.V. – Hamburg",
      "type": "Registerbekanntmachung nach dem Umwandlungsgesetz",
      "state": "Hamburg",
      "amtsgericht": "Amtsgericht Hamburg",
      "registernummer": "VR 5976",
      "registerart": "VR",
      "company_name": "Sozialkasse der OTTO BETRIEBE e.V.",
      "company_seat": "Hamburg",
      "details": "06.02.2026 (Bekanntmachungsdatum)\n\nHamburg Amtsgericht Hamburg VR 5976\nRegisterbekanntmachung nach dem Umwandlungsgesetz 06.02.2026 (Eintragungsdatum)\n\nSozialkasse der OTTO BETRIEBE e.V.\neingetragener Verein\nHamburg\n\nAls nicht eingetragen wird bekannt gemacht:\nDen Gläubigern der an der Abspaltung beteiligten Gesellschaften ist, wenn sie binnen sechs Monaten nach dem Tag, an dem die Eintragung der Abspaltung in das Register des Sitzes desjenigen Rechtsträgers, dessen Gläubiger sie sind, nach §§ 125, 19 Absatz 3 UmwG als bekannt gemacht gilt, ihren Anspruch nach Grund und Höhe schriftlich anmelden, Sicherheit zu leisten, soweit sie nicht Befriedigung verlangen können. Dieses Recht steht den Gläubigern jedoch nur zu, wenn sie glaubhaft machen, dass durch die Abspaltung die Erfüllung ihrer Forderung gefährdet wird."
    },
    {
      "date": "2026-02-06",
      "id": "144509",
      "original_text": "Registerbekanntmachung nach dem Umwandlungsgesetz\nHamburg Amtsgericht Hamburg HRB 122965\nJan Bechler Ventures UG (haftungsbeschränkt) – Hamburg",
      "type": "Registerbekanntmachung nach dem Umwandlungsgesetz",
      "state": "Hamburg",
      "amtsgericht": "Amtsgericht Hamburg",
      "registernummer": "HRB 122965",
      "registerart": "HRB",
      "company_name": "Jan Bechler Ventures UG (haftungsbeschränkt)",
      "company_seat": "Hamburg",
      "details": "06.02.2026 (Bekanntmachungsdatum)\n\nHamburg Amtsgericht Hamburg HRB 122965\nRegisterbekanntmachung nach dem Umwandlungsgesetz 06.02.2026 (Eintragungsdatum)\n\nJan Bechler Ventures UG (haftungsbeschränkt)\nGesellschaft mit beschränkter Haftung\nHamburg\n\nAls nicht eingetragen wird bekannt gemacht:\nDen Gläubigern der an der Verschmelzung beteiligten Gesellschaften ist, wenn sie binnen sechs Monaten nach dem Tag, an dem die Eintragung der Verschmelzung in das Register des Sitzes desjenigen Rechtsträgers, dessen Gläubiger sie sind, nach § 19 Absatz 3 UmwG als bekannt gemacht gilt, ihren Anspruch nach Grund und Höhe schriftlich anmelden, Sicherheit zu leisten, soweit sie nicht Befriedigung verlangen können. Dieses Recht steht den Gläubigern jedoch nur zu, wenn sie glaubhaft machen, dass durch die Verschmelzung die Erfüllung ihrer Forderung gefährdet wird."
    },
    {
      "date": "2026-02-06",
      "id": "144510",
      "original_text": "Registerbekanntmachung nach dem Umwandlungsgesetz\nHamburg Amtsgericht Hamburg HRB 187648\nSoftcomm UG (haftungsbeschränkt) – Hamburg",
      "type": "Registerbekanntmachung nach dem Umwandlungsgesetz",
      "state": "Hamburg",
      "amtsgericht": "Amtsgericht Hamburg",
      "registernummer": "HRB 187648",
      "registerart": "HRB",
      "company_name": "Softcomm UG (haftungsbeschränkt)",
      "company_seat": "Hamburg",
      "details": "06.02.2026 (Bekanntmachungsdatum)\n\nHamburg Amtsgericht Hamburg HRB 187648\nRegisterbekanntmachung nach dem Umwandlungsgesetz 06.02.2026 (Eintragungsdatum)\n\nSoftcomm UG (haftungsbeschränkt)\nGesellschaft mit beschränkter Haftung\nHamburg\n\nAls nicht eingetragen wird bekannt gemacht:\nDen Gläubigern der an der Verschmelzung beteiligten Gesellschaften ist, wenn sie binnen sechs Monaten nach dem Tag, an dem die Eintragung der Verschmelzung in das Register des Sitzes desjenigen Rechtsträgers, dessen Gläubiger sie sind, nach § 19 Absatz 3 UmwG als bekannt gemacht gilt, ihren Anspruch nach Grund und Höhe schriftlich anmelden, Sicherheit zu leisten, soweit sie nicht Befriedigung verlangen können. Dieses Recht steht den Gläubigern jedoch nur zu, wenn sie glaubhaft machen, dass durch die Verschmelzung die Erfüllung ihrer Forderung gefährdet wird."
    },
    {
      "date": "2026-02-06",
      "id": "144511",
      "original_text": "Registerbekanntmachung nach dem Umwandlungsgesetz\nSaarland Amtsgericht Saarbrücken HRB 15409\nFori Automation GmbH – Saarbrücken",
      "type": "Registerbekanntmachung nach dem Umwandlungsgesetz",
      "state": "Saarland",
      "amtsgericht": "Amtsgericht Saarbrücken",
      "registernummer": "HRB 15409",
      "registerart": "HRB",
      "company_name": "Fori Automation GmbH",
      "company_seat": "Saarbrücken",
      "details": "06.02.2026 (Bekanntmachungsdatum)\n\nSaarland Amtsgericht Saarbrücken HRB 15409\nRegisterbekanntmachung nach dem Umwandlungsgesetz 06.02.2026 (Eintragungsdatum)\n\nFori Automation GmbH\nGesellschaft mit beschränkter Haftung\nSaarbrücken\n\nAls nicht eingetragen wird bekannt gemacht: Den Gläubigern der an der Verschmelzung beteiligten Gesellschaften ist, wenn sie binnen sechs Monaten nach dem Tag, an dem die Eintragung der Verschmelzung in das Register des Sitzes derjenigen Rechtsträger deren Gläubiger sie sind, nach § 19 Absatz 3 UmwG bekannt gemacht worden ist, ihren Anspruch nach Grund und Höhe schriftlich anmelden, Sicherheit zu leisten, soweit sie nicht Befriedigung verlangen können. Dieses Recht steht den Gläubigern jedoch nur zu, wenn sie glaubhaft machen, dass durch die Verschmelzung die Erfüllung ihrer Forderung gefährdet wird."
    },
    {
      "date": "2026-02-06",
      "id": "144512",
      "original_text": "Registerbekanntmachung nach dem Umwandlungsgesetz\nSachsen-Anhalt Amtsgericht Stendal HRA 8396\nDREIZACK Medien, Inh. Christian Figul e.K. – Halle (Saale)",
      "type": "Registerbekanntmachung nach dem Umwandlungsgesetz",
      "state": "Sachsen-Anhalt",
      "amtsgericht": "Amtsgericht Stendal",
      "registernummer": "HRA 8396",
      "registerart": "HRA",
      "company_name": "DREIZACK Medien, Inh. Christian Figul e.K.",
      "company_seat": "Halle (Saale)",
      "details": "06.02.2026 (Bekanntmachungsdatum)\n\nSachsen-Anhalt Amtsgericht Stendal HRA 8396\nRegisterbekanntmachung nach dem Umwandlungsgesetz 06.02.2026 (Eintragungsdatum)\n\nDREIZACK Medien, Inh. Christian Figul e.K.\nEinzelkaufmann / Einzelkauffrau\nHalle (Saale)\n\nNicht eingetragen:\nDen Gläubigern der an der Ausgliederung beteiligten Rechtsträger, ist wenn sie binnen sechs Monaten nach dem Tag, an dem die Eintragung der Ausgliederung nach §§125, 19 Abs. 3 UmwG als bekanntgemacht gilt, ihren Anspruch nach Grund und Höhe schriftlich anmelden, Sicherheit zu leisten, soweit sie nicht Befriedigung verlangen können. Diese Recht steht ihnen jedoch nur zu, wenn sie glaubhaft machen, dass durch die Ausgliederung die Erfüllung ihrer Forderung gefährdet wird."
    },
    {
      "date": "2026-02-06",
      "id": "144513",
      "original_text": "Registerbekanntmachung nach dem Umwandlungsgesetz\nBaden-Württemberg Amtsgericht Stuttgart HRB 746742\nFrank plastic Immobilien GmbH – Waldachtal",
      "type": "Registerbekanntmachung nach dem Umwandlungsgesetz",
      "state": "Baden-Württemberg",
      "amtsgericht": "Amtsgericht Stuttgart",
      "registernummer": "HRB 746742",
      "registerart": "HRB",
      "company_name": "Frank plastic Immobilien GmbH",
      "company_seat": "Waldachtal",
      "details": "06.02.2026 (Bekanntmachungsdatum)\n\nBaden-Württemberg Amtsgericht Stuttgart HRB 746742\nRegisterbekanntmachung nach dem Umwandlungsgesetz 04.02.2026 (Eintragungsdatum)\n\nFrank plastic Immobilien GmbH\nGesellschaft mit beschränkter Haftung\nWaldachtal\n\nAls nicht eingetragen wird bekanntgemacht: Den Gläubigern der an der Verschmelzung beteiligten Rechtsträger ist, wenn sie binnen sechs Monaten nach dem Tag, an dem die Eintragung der Verschmelzung in das Register des Sitzes desjenigen Rechtsträgers, dessen Gläubiger sie sind, nach § 19 Abs. 3 UmwG als bekanntgemacht gilt, ihren Anspruch nach Grund und Höhe schriftlich anmelden, Sicherheit zu leisten, soweit sie nicht Befriedigung verlangen können. Dieses Recht steht den Gläubigern jedoch nur zu, wenn sie glaubhaft machen, dass durch die Verschmelzung die Erfüllung ihrer Forderung gefährdet wird."
    },
    {
      "date": "2026-02-06",
      "id": "144514",
      "original_text": "Löschungsankündigung\nBerlin Amtsgericht Berlin (Charlottenburg) HRB 264389\nAEP Consulting and Retail UG (haftungsbeschränkt) – Berlin",
      "type": "Löschungsankündigung",
      "state": "Berlin",
      "amtsgericht": "Amtsgericht Berlin (Charlottenburg)",
      "registernummer": "HRB 264389",
      "registerart": "HRB",
      "company_name": "AEP Consulting and Retail UG (haftungsbeschränkt)",
      "company_seat": "Berlin",
      "details": "06.02.2026 (Bekanntmachungsdatum)\n\nBerlin Amtsgericht Berlin (Charlottenburg) HRB 264389\nLöschungsankündigung\n\nAEP Consulting and Retail UG (haftungsbeschränkt)\nGesellschaft mit beschränkter Haftung\nBerlin\n\nBei der nachstehenden Gesellschaft wird das Amtslöschungsverfahren gemäß § 394 FamFG eingeleitet. Widerspruchsfrist 6 Wochen"
    },
    {
      "date": "2026-02-06",
      "id": "144515",
      "original_text": "Registerbekanntmachung nach dem Umwandlungsgesetz\nSchleswig-Holstein Amtsgericht Lübeck HRB 27136\nT&M Immo GmbH – Glinde",
      "type": "Registerbekanntmachung nach dem Umwandlungsgesetz",
      "state": "Schleswig-Holstein",
      "amtsgericht": "Amtsgericht Lübeck",
      "registernummer": "HRB 27136",
      "registerart": "HRB",
      "company_name": "T&M Immo GmbH",
      "company_seat": "Glinde",
      "details": "06.02.2026 (Bekanntmachungsdatum)\n\nSchleswig-Holstein Amtsgericht Lübeck HRB 27136\nRegisterbekanntmachung nach dem Umwandlungsgesetz 05.02.2026 (Eintragungsdatum)\n\nT&M Immo GmbH\nGesellschaft mit beschränkter Haftung\nGlinde\n\nZu Eintragungsnummer 1 vom 05.02.2026 wird als nicht eingetragen veröffentlicht:   Den Gläubigern der an der Ausgliederung beteiligten Rechtsträger ist, wenn sie binnen sechs Monaten nach dem Tag, an dem die Eintragung der Ausgliederung in das Register des Sitzes desjenigen Rechtsträgers, dessen Gläubiger sie sind, als bekannt gemacht gilt, ihren Anspruch nach Grund und Höhe schriftlich anmelden, Sicherheit zu leisten, soweit sie nicht Befriedigung verlangen können. Dieses Recht steht den Gläubigern jedoch nur zu, wenn sie glaubhaft machen, dass durch die Ausgliederung die Erfüllung ihrer Forderung gefährdet wird."
    },
    {
      "date": "2026-02-06",
      "id": "144516",
      "original_text": "Registerbekanntmachung nach dem Umwandlungsgesetz\nBaden-Württemberg Amtsgericht Stuttgart HRB 767346\nHWS Würthele Verwaltungs-GmbH Steuerberatungsgesellschaft – Remshalden",
      "type": "Registerbekanntmachung nach dem Umwandlungsgesetz",
      "state": "Baden-Württemberg",
      "amtsgericht": "Amtsgericht Stuttgart",
      "registernummer": "HRB 767346",
      "registerart": "HRB",
      "company_name": "HWS Würthele Verwaltungs-GmbH Steuerberatungsgesellschaft",
      "company_seat": "Remshalden",
      "details": "06.02.2026 (Bekanntmachungsdatum)\n\nBaden-Württemberg Amtsgericht Stuttgart HRB 767346\nRegisterbekanntmachung nach dem Umwandlungsgesetz 06.02.2026 (Eintragungsdatum)\n\nHWS Würthele Verwaltungs-GmbH Steuerberatungsgesellschaft\nGesellschaft mit beschränkter Haftung\nRemshalden\n\nAls nicht eingetragen wird bekanntgemacht:\nDen Gläubigern der an der Verschmelzung beteiligten Rechtsträger ist, wenn sie binnen sechs Monaten nach dem Tag, an dem die Eintragung der Verschmelzung in das Register des Sitzes desjenigen Rechtsträgers, dessen Gläubiger sie sind, nach § 19 Abs. 3 UmwG als bekanntgemacht gilt, ihren Anspruch nach Grund und Höhe schriftlich anmelden, Sicherheit zu leisten, soweit sie nicht Befriedigung verlangen können. Dieses Recht steht den Gläubigern jedoch nur zu, wenn sie glaubhaft machen, dass durch die Verschmelzung die Erfüllung ihrer Forderung gefährdet wird."
    },
    {
      "date": "2026-02-06",
      "id": "144517",
      "original_text": "Registerbekanntmachung nach dem Umwandlungsgesetz\nSchleswig-Holstein Amtsgericht Lübeck HRB 22634\nTobacco & More Franchise GmbH – Glinde",
      "type": "Registerbekanntmachung nach dem Umwandlungsgesetz",
      "state": "Schleswig-Holstein",
      "amtsgericht": "Amtsgericht Lübeck",
      "registernummer": "HRB 22634",
      "registerart": "HRB",
      "company_name": "Tobacco & More Franchise GmbH",
      "company_seat": "Glinde",
      "details": "06.02.2026 (Bekanntmachungsdatum)\n\nSchleswig-Holstein Amtsgericht Lübeck HRB 22634\nRegisterbekanntmachung nach dem Umwandlungsgesetz 05.02.2026 (Eintragungsdatum)\n\nTobacco & More Franchise GmbH\nGesellschaft mit beschränkter Haftung\nGlinde\n\nZu Eintragungsnummer 5 vom 05.02.2026 wird als nicht eingetragen veröffentlicht:  Den Gläubigern der an der Ausgliederung beteiligten Rechtsträger ist, wenn sie binnen sechs Monaten nach dem Tag, an dem die Eintragung der Ausgliederung in das Register des Sitzes desjenigen Rechtsträgers, dessen Gläubiger sie sind, als bekannt gemacht gilt, ihren Anspruch nach Grund und Höhe schriftlich anmelden, Sicherheit zu leisten, soweit sie nicht Befriedigung verlangen können. Dieses Recht steht den Gläubigern jedoch nur zu, wenn sie glaubhaft machen, dass durch die Ausgliederung die Erfüllung ihrer Forderung gefährdet wird."
    },
    {
      "date": "2026-02-06",
      "id": "144518",
      "original_text": "Sonstige Registerbekanntmachung\nHamburg Amtsgericht Hamburg HRB 99368\nLEGOLAND Discovery Centre Deutschland GmbH – Hamburg",
      "type": "Sonstige Registerbekanntmachung",
      "state": "Hamburg",
      "amtsgericht": "Amtsgericht Hamburg",
      "registernummer": "HRB 99368",
      "registerart": "HRB",
      "company_name": "LEGOLAND Discovery Centre Deutschland GmbH",
      "company_seat": "Hamburg",
      "details": "06.02.2026 (Bekanntmachungsdatum)\n\nHamburg Amtsgericht Hamburg HRB 99368\nSonstige Registerbekanntmachung 06.02.2026 (Eintragungsdatum)\n\nLEGOLAND Discovery Centre Deutschland GmbH\nGesellschaft mit beschränkter Haftung\nHamburg\n\nAls nicht eingetragen wird bekannt gemacht:  Den Gläubigern der Gesellschaft, deren Forderungen begründet worden sind, bevor die Eintragung der Vertragsbeendigung in das Handelsregister nach § 10 HGB als bekannt gemacht gilt, ist vom anderen Vertragsteil Sicherheit zu leisten, wenn sie sich binnen 6 Monaten nach Bekanntmachung der Eintragung zu diesem Zweck bei ihm melden."
    },
    {
      "date": "2026-02-06",
      "id": "144519",
      "original_text": "Löschungsankündigung\nSaarland Amtsgericht Saarbrücken HRB 43976\nRM 100 Vermögensverwaltungs GmbH – Illingen",
      "type": "Löschungsankündigung",
      "state": "Saarland",
      "amtsgericht": "Amtsgericht Saarbrücken",
      "registernummer": "HRB 43976",
      "registerart": "HRB",
      "company_name": "RM 100 Vermögensverwaltungs GmbH",
      "company_seat": "Illingen",
      "details": "06.02.2026 (Bekanntmachungsdatum)\n\nSaarland Amtsgericht Saarbrücken HRB 43976\nLöschungsankündigung\n\nRM 100 Vermögensverwaltungs GmbH\nGesellschaft mit beschränkter Haftung\nIllingen\n\nEs ist beabsichtigt, die Gesellschaft von Amts wegen gemäß § 394 FamFG wegen Vermögenslosigkeit zu löschen.\nGegen die Löschung von Amts wegen ist das Rechtsmittel des Widerspruchs statthaft. Der Widerspruch ist binnen einer Frist zwei Monaten beginnend mit dem Tag dieser Veröffentlichung durch Einreichen eines Widerspruchsschreibens -schriftlich oder zur Niederschrift der Geschäftsstelle beim Amtsgericht Saarbrücken, -zentrales Handelsregister-, Mainzerstr.178, 66121 Saarbrücken einzulegen.\nDer Widerspruch muss die Bezeichnung der angefochtenen Löschungsankündigung enthalten sowie die Erklärung, dass Widerspruch eingelegt wird. Er ist vom Widerspruchsführer oder seinem Bevollmächtigten zu unterzeichnen.\nDas Widerspruchsschreiben kann auch in der Form eines elektronischen Dokumentes eingereicht werden, das mit einer qualifizierten elektronischen Signatur nach dem Signaturgesetz versehen sein muss (§§ 14 Abs. 2 FamFG, 130a, 298 ZPO)."
    },
    {
      "date": "2026-02-06",
      "id": "144520",
      "original_text": "Registerbekanntmachung nach dem Umwandlungsgesetz\nBerlin Amtsgericht Berlin (Charlottenburg) HRB 282411\nArtigiani GmbH – Berlin",
      "type": "Registerbekanntmachung nach dem Umwandlungsgesetz",
      "state": "Berlin",
      "amtsgericht": "Amtsgericht Berlin (Charlottenburg)",
      "registernummer": "HRB 282411",
      "registerart": "HRB",
      "company_name": "Artigiani GmbH",
      "company_seat": "Berlin",
      "details": "06.02.2026 (Bekanntmachungsdatum)\n\nBerlin Amtsgericht Berlin (Charlottenburg) HRB 282411\nRegisterbekanntmachung nach dem Umwandlungsgesetz 05.02.2026 (Eintragungsdatum)\n\nArtigiani GmbH\nGesellschaft mit beschränkter Haftung\nBerlin\n\nZu Eintragungsnummer 3 vom 05.02.2026 wird als nicht eingetragen veröffentlicht: Den Gläubigern ist, wenn sie binnen sechs Monaten nach dem Tag, an dem die Eintragung der Umwandlung als bekannt gemacht gilt, ihren Anspruch nach Grund und Höhe schriftlich anmelden, Sicherheit zu leisten, soweit sie nicht Befriedigung verlangen können. Dieses Recht steht den Gläubigern jedoch nur zu, wenn sie glaubhaft machen, dass durch die Umwandlung die Erfüllung ihrer Forderung gefährdet wird. Das Recht, Sicherheitsleistung zu verlangen, steht Gläubigern nicht zu, die im Falle der Insolvenz ein Recht auf vorzugsweise Befriedigung aus einer Deckungsmasse haben, die nach gesetzlicher Vorschrift zu ihrem Schutz errichtet und staatlich überwacht ist (§§ 125, 22 UmwG)."
    },
    {
      "date": "2026-02-06",
      "id": "144521",
      "original_text": "Einreichung neuer Dokumente\nHamburg Amtsgericht Hamburg HRB 128013\nänd Ärztenachrichtendienst Verlags-AG – Hamburg",
      "type": "Einreichung neuer Dokumente",
      "state": "Hamburg",
      "amtsgericht": "Amtsgericht Hamburg",
      "registernummer": "HRB 128013",
      "registerart": "HRB",
      "company_name": "änd Ärztenachrichtendienst Verlags-AG",
      "company_seat": "Hamburg",
      "details": "06.02.2026 (Bekanntmachungsdatum)\n\nHamburg Amtsgericht Hamburg HRB 128013\nEinreichung neuer Dokumente 06.02.2026 (Eintragungsdatum)\n\nänd Ärztenachrichtendienst Verlags-AG\nAktiengesellschaft\nHamburg\n\nAls nicht eingetragen wird bekannt gemacht: Liste des Aufsichtsrats wurde eingereicht."
    },
    {
      "date": "2026-02-06",
      "id": "144522",
      "original_text": "Einreichung neuer Dokumente\nBaden-Württemberg Amtsgericht Mannheim HRB 336630\nRoche mtm laboratories AG – Mannheim",
      "type": "Einreichung neuer Dokumente",
      "state": "Baden-Württemberg",
      "amtsgericht": "Amtsgericht Mannheim",
      "registernummer": "HRB 336630",
      "registerart": "HRB",
      "company_name": "Roche mtm laboratories AG",
      "company_seat": "Mannheim",
      "details": "06.02.2026 (Bekanntmachungsdatum)\n\nBaden-Württemberg Amtsgericht Mannheim HRB 336630\nEinreichung neuer Dokumente\n\nRoche mtm laboratories AG\nAktiengesellschaft\nMannheim\n\nDie Gesellschaft hat am 03.02.2026 die Liste über die Zusammensetzung des Aufsichtsrats zum Handelsregister eingereicht."
    },
    {
      "date": "2026-02-06",
      "id": "144523",
      "original_text": "Registerbekanntmachung nach dem Umwandlungsgesetz\nBerlin Amtsgericht Berlin (Charlottenburg) HRA 64982\nEnrico Piccin e. K. – Berlin",
      "type": "Registerbekanntmachung nach dem Umwandlungsgesetz",
      "state": "Berlin",
      "amtsgericht": "Amtsgericht Berlin (Charlottenburg)",
      "registernummer": "HRA 64982",
      "registerart": "HRA",
      "company_name": "Enrico Piccin e. K.",
      "company_seat": "Berlin",
      "details": "06.02.2026 (Bekanntmachungsdatum)\n\nBerlin Amtsgericht Berlin (Charlottenburg) HRA 64982\nRegisterbekanntmachung nach dem Umwandlungsgesetz 05.02.2026 (Eintragungsdatum)\n\nEnrico Piccin e. K.\nEinzelkaufmann / Einzelkauffrau\nBerlin\n\nZu Eintragungsnummer 2 vom 05.02.2026 wird als nicht eingetragen veröffentlicht: Den Gläubigern der an der Spaltung beteiligten Rechtsträger ist, wenn sie binnen sechs Monaten nach dem Tag, an dem die Eintragung der Spaltung in das Register des Sitzes desjenigen Rechtsträgers, dessen Gläubiger sie sind, als bekannt gemacht gilt, ihren Anspruch nach Grund und Höhe schriftlich anmelden, Sicherheit zu leisten, soweit sie nicht Befriedigung verlangen können. Dieses Recht steht den Gläubigern jedoch nur zu, wenn sie glaubhaft machen, dass durch die Spaltung die Erfüllung ihrer Forderung gefährdet wird. Das Recht, Sicherheitsleistung zu verlangen, steht Gläubigern nicht zu, die im Falle der Insolvenz ein Recht auf vorzugsweise Befriedigung aus einer Deckungsmasse haben, die nach gesetzlicher Vorschrift zu ihrem Schutz errichtet und staatlich überwacht ist."
    },
    {
      "date": "2026-02-06",
      "id": "144524",
      "original_text": "Registerbekanntmachung nach dem Umwandlungsgesetz\nBaden-Württemberg Amtsgericht Ulm HRB 733428\nSalvia NRW GmbH – Eislingen",
      "type": "Registerbekanntmachung nach dem Umwandlungsgesetz",
      "state": "Baden-Württemberg",
      "amtsgericht": "Amtsgericht Ulm",
      "registernummer": "HRB 733428",
      "registerart": "HRB",
      "company_name": "Salvia NRW GmbH",
      "company_seat": "Eislingen",
      "details": "06.02.2026 (Bekanntmachungsdatum)\n\nBaden-Württemberg Amtsgericht Ulm HRB 733428\nRegisterbekanntmachung nach dem Umwandlungsgesetz\n\nSalvia NRW GmbH\nGesellschaft mit beschränkter Haftung\nEislingen\n\nAls nicht eingetragen wird bekanntgemacht:\nDen Gläubigern der an der Verschmelzung beteiligten Rechtsträger ist, wenn sie binnen sechs Monaten nach dem Tag, an dem die Eintragung der Verschmelzung in das Register des Sitzes desjenigen Rechtsträgers, dessen Gläubiger sie sind, nach § 19 Abs. 3 UmwG als bekanntgemacht gilt, ihren Anspruch nach Grund und Höhe schriftlich anmelden, Sicherheit zu leisten, soweit sie nicht Befriedigung verlangen können. Dieses Recht steht den Gläubigern jedoch nur zu, wenn sie glaubhaft machen, dass durch die Verschmelzung die Erfüllung ihrer Forderung gefährdet wird."
    },
    {
      "date": "2026-02-06",
      "id": "144525",
      "original_text": "Registerbekanntmachung nach dem Umwandlungsgesetz\nBerlin Amtsgericht Berlin (Charlottenburg) HRB 270230\nKVLM Holding GmbH – Berlin",
      "type": "Registerbekanntmachung nach dem Umwandlungsgesetz",
      "state": "Berlin",
      "amtsgericht": "Amtsgericht Berlin (Charlottenburg)",
      "registernummer": "HRB 270230",
      "registerart": "HRB",
      "company_name": "KVLM Holding GmbH",
      "company_seat": "Berlin",
      "details": "06.02.2026 (Bekanntmachungsdatum)\n\nBerlin Amtsgericht Berlin (Charlottenburg) HRB 270230\nRegisterbekanntmachung nach dem Umwandlungsgesetz 05.02.2026 (Eintragungsdatum)\n\nKVLM Holding GmbH\nGesellschaft mit beschränkter Haftung\nBerlin\n\nZu Eintragungsnummer 2 vom 05.02.2026 wird als nicht eingetragen veröffentlicht:Den Gläubigern der an der Verschmelzung beteiligten Rechtsträger ist, wenn sie binnen sechs Monaten nach dem Tag, an dem die Eintragung der Verschmelzung in das Register des Sitzes desjenigen Rechtsträgers, dessen Gläubiger sie sind, als bekannt gemacht gilt, ihren Anspruch nach Grund und Höhe schriftlich anmelden, Sicherheit zu leisten, soweit sie nicht Befriedigung verlangen können. Dieses Recht steht den Gläubigern jedoch nur zu, wenn sie glaubhaft machen, dass durch die Verschmelzung die Erfüllung ihrer Forderung gefährdet wird. Das Recht, Sicherheitsleistung zu verlangen, steht Gläubigern nicht zu, die im Falle der Insolvenz ein Recht auf vorzugsweise Befriedigung aus einer Deckungsmasse haben, die nach gesetzlicher Vorschrift zu ihrem Schutz errichtet und staatlich überwacht ist."
    },
    {
      "date": "2026-02-06",
      "id": "144526",
      "original_text": "Registerbekanntmachung nach dem Umwandlungsgesetz\nBrandenburg Amtsgericht Cottbus HRB 4971\nLR Media-Verkaufsgesellschaft mbH – Cottbus",
      "type": "Registerbekanntmachung nach dem Umwandlungsgesetz",
      "state": "Brandenburg",
      "amtsgericht": "Amtsgericht Cottbus",
      "registernummer": "HRB 4971",
      "registerart": "HRB",
      "company_name": "LR Media-Verkaufsgesellschaft mbH",
      "company_seat": "Cottbus",
      "details": "06.02.2026 (Bekanntmachungsdatum)\n\nBrandenburg Amtsgericht Cottbus HRB 4971\nRegisterbekanntmachung nach dem Umwandlungsgesetz 05.02.2026 (Eintragungsdatum)\n\nLR Media-Verkaufsgesellschaft mbH\nGesellschaft mit beschränkter Haftung\nCottbus\n\nZu Eintragungsnummer 26 vom 05.02.2026 wird als nicht eingetragen veröffentlicht:\nGläubigern, deren Forderungen begründet worden sind, bevor die Eintragung des Beschlusses als nach § 10 des Handelsgesetzbuches bekannt gemacht gilt, ist, wenn sie sich binnen sechs Monaten nach der Bekanntmachung zu diesem Zweck melden, Sicherheit zu leisten, soweit sie nicht Befriedigung verlangen können"
    },
    {
      "date": "2026-02-06",
      "id": "144527",
      "original_text": "Registerbekanntmachung nach dem Umwandlungsgesetz\nBaden-Württemberg Amtsgericht Stuttgart HRA 231243\nFischer Weilheim GmbH & Co. KG – Weilheim an der Teck",
      "type": "Registerbekanntmachung nach dem Umwandlungsgesetz",
      "state": "Baden-Württemberg",
      "amtsgericht": "Amtsgericht Stuttgart",
      "registernummer": "HRA 231243",
      "registerart": "HRA",
      "company_name": "Fischer Weilheim GmbH & Co. KG",
      "company_seat": "Weilheim an der Teck",
      "details": "06.02.2026 (Bekanntmachungsdatum)\n\nBaden-Württemberg Amtsgericht Stuttgart HRA 231243\nRegisterbekanntmachung nach dem Umwandlungsgesetz 06.02.2026 (Eintragungsdatum)\n\nFischer Weilheim GmbH & Co. KG\nKommanditgesellschaft\nWeilheim an der Teck\n\nAls nicht eingetragen wird bekanntgemacht:\nDen Gläubigern der an der Verschmelzung beteiligten Rechtsträger ist, wenn sie binnen sechs Monaten nach dem Tag, an dem die Eintragung der Verschmelzung in das Register des Sitzes desjenigen Rechtsträgers, dessen Gläubiger sie sind, nach § 19 Abs. 3 UmwG als bekanntgemacht gilt, ihren Anspruch nach Grund und Höhe schriftlich anmelden, Sicherheit zu leisten, soweit sie nicht Befriedigung verlangen können. Dieses Recht steht den Gläubigern jedoch nur zu, wenn sie glaubhaft machen, dass durch die Verschmelzung die Erfüllung ihrer Forderung gefährdet wird."
    },
    {
      "date": "2026-02-06",
      "id": "144528",
      "original_text": "Löschungsankündigung\nBerlin Amtsgericht Berlin (Charlottenburg) HRB 257076\nWestdeutsche Rohbau-Technik GmbH – Berlin",
      "type": "Löschungsankündigung",
      "state": "Berlin",
      "amtsgericht": "Amtsgericht Berlin (Charlottenburg)",
      "registernummer": "HRB 257076",
      "registerart": "HRB",
      "company_name": "Westdeutsche Rohbau-Technik GmbH",
      "company_seat": "Berlin",
      "details": "06.02.2026 (Bekanntmachungsdatum)\n\nBerlin Amtsgericht Berlin (Charlottenburg) HRB 257076\nLöschungsankündigung\n\nWestdeutsche Rohbau-Technik GmbH\nGesellschaft mit beschränkter Haftung\nBerlin\n\nBei der nachstehenden Gesellschaft wird das Amtslöschungsverfahren gemäß § 394 FamFG eingeleitet. Widerspruchsfrist 6 Wochen"
    },
    {
      "date": "2026-02-06",
      "id": "144529",
      "original_text": "Einreichung neuer Dokumente\nHamburg Amtsgericht Hamburg HRB 155460\nClubhaus Aktiengesellschaft – Hamburg",
      "type": "Einreichung neuer Dokumente",
      "state": "Hamburg",
      "amtsgericht": "Amtsgericht Hamburg",
      "registernummer": "HRB 155460",
      "registerart": "HRB",
      "company_name": "Clubhaus Aktiengesellschaft",
      "company_seat": "Hamburg",
      "details": "06.02.2026 (Bekanntmachungsdatum)\n\nHamburg Amtsgericht Hamburg HRB 155460\nEinreichung neuer Dokumente 06.02.2026 (Eintragungsdatum)\n\nClubhaus Aktiengesellschaft\nAktiengesellschaft\nHamburg\n\nAls nicht eingetragen wird bekannt gemacht: Liste des Aufsichtsrats wurde eingereicht."
    },
    {
      "date": "2026-02-06",
      "id": "144530",
      "original_text": "Registerbekanntmachung nach dem Umwandlungsgesetz\nSachsen Amtsgericht Leipzig GsR 639\nErgotherapie am Park Petzold & Grimm eGbR – Leipzig",
      "type": "Registerbekanntmachung nach dem Umwandlungsgesetz",
      "state": "Sachsen",
      "amtsgericht": "Amtsgericht Leipzig",
      "registernummer": "GsR 639",
      "registerart": "GsR",
      "company_name": "Ergotherapie am Park Petzold & Grimm eGbR",
      "company_seat": "Leipzig",
      "details": "06.02.2026 (Bekanntmachungsdatum)\n\nSachsen Amtsgericht Leipzig GsR 639\nRegisterbekanntmachung nach dem Umwandlungsgesetz 06.02.2026 (Eintragungsdatum)\n\nErgotherapie am Park Petzold & Grimm eGbR\nGesellschaft bürgerlichen Rechts\nLeipzig\n\nDen Gläubigern der an der Verschmelzung beteiligten Rechtsträger ist, wenn sie binnen sechs Monaten nach dem Tag, an dem die Eintragung der Verschmelzung in das Register des Sitzes desjenigen Rechtsträgers, dessen Gläubiger sie sind, nach § 19 Abs. 3 UmwG als bekannt gemacht gilt, ihren Anspruch nach Grund und Höhe in Textform anmelden, Sicherheit zu leisten, soweit sie nicht Befriedigung verlangen können. Dieses Recht steht den Gläubigern jedoch nur zu, wenn sie glaubhaft machen, dass durch die Verschmelzung die Erfüllung der Forderung gefährdet wird."
    },
    {
      "date": "2026-02-06",
      "id": "144531",
      "original_text": "Löschungsankündigung\nSachsen Amtsgericht Dresden HRA 10643\nsense4energysystems-OSS UG (haftungsbeschränkt) & Co. KG – Dresden",
      "type": "Löschungsankündigung",
      "state": "Sachsen",
      "amtsgericht": "Amtsgericht Dresden",
      "registernummer": "HRA 10643",
      "registerart": "HRA",
      "company_name": "sense4energysystems-OSS UG (haftungsbeschränkt) & Co. KG",
      "company_seat": "Dresden",
      "details": "06.02.2026 (Bekanntmachungsdatum)\n\nSachsen Amtsgericht Dresden HRA 10643\nLöschungsankündigung\n\nsense4energysystems-OSS UG (haftungsbeschränkt) & Co. KG\nKommanditgesellschaft\nDresden\n\nDas Registergericht beabsichtigt, die im Handelsregister eingetragene Firma von Amts wegen nach § 31 Abs. 2 HGB, 393 FamFG zu löschen. Die Frist zur Erhebung eines Widerspruchs gegen die beabsichtigte Löschung wird auf einen Monat festgesetzt."
    },
    {
      "date": "2026-02-06",
      "id": "144532",
      "original_text": "Registerbekanntmachung nach dem Umwandlungsgesetz\nSachsen Amtsgericht Leipzig HRB 44623\nErgotherapie am Park GmbH – Leipzig",
      "type": "Registerbekanntmachung nach dem Umwandlungsgesetz",
      "state": "Sachsen",
      "amtsgericht": "Amtsgericht Leipzig",
      "registernummer": "HRB 44623",
      "registerart": "HRB",
      "company_name": "Ergotherapie am Park GmbH",
      "company_seat": "Leipzig",
      "details": "06.02.2026 (Bekanntmachungsdatum)\n\nSachsen Amtsgericht Leipzig HRB 44623\nRegisterbekanntmachung nach dem Umwandlungsgesetz 06.02.2026 (Eintragungsdatum)\n\nErgotherapie am Park GmbH\nGesellschaft mit beschränkter Haftung\nLeipzig\n\nDen Gläubigern der an der Verschmelzung beteiligten Rechtsträger ist, wenn sie binnen sechs Monaten nach dem Tag, an dem die Eintragung der Verschmelzung in das Register des Sitzes desjenigen Rechtsträgers, dessen Gläubiger sie sind, nach § 19 Abs. 3 UmwG als bekannt gemacht gilt, ihren Anspruch nach Grund und Höhe in Textform anmelden, Sicherheit zu leisten, soweit sie nicht Befriedigung verlangen können. Dieses Recht steht den Gläubigern jedoch nur zu, wenn sie glaubhaft machen, dass durch die Verschmelzung die Erfüllung der Forderung gefährdet wird."
    },
    {
      "date": "2026-02-06",
      "id": "144533",
      "original_text": "Sonstige Registerbekanntmachung\nSachsen Amtsgericht Leipzig HRB 34271\nLabor Deutscher Platz Leipzig MVZ GmbH – Leipzig",
      "type": "Sonstige Registerbekanntmachung",
      "state": "Sachsen",
      "amtsgericht": "Amtsgericht Leipzig",
      "registernummer": "HRB 34271",
      "registerart": "HRB",
      "company_name": "Labor Deutscher Platz Leipzig MVZ GmbH",
      "company_seat": "Leipzig",
      "details": "06.02.2026 (Bekanntmachungsdatum)\n\nSachsen Amtsgericht Leipzig HRB 34271\nSonstige Registerbekanntmachung 06.02.2026 (Eintragungsdatum)\n\nLabor Deutscher Platz Leipzig MVZ GmbH\nGesellschaft mit beschränkter Haftung\nLeipzig\n\nDen Gläubigern der Gesellschaft, deren Forderungen begründet worden sind bevor die Eintragung der Beendigung des Gewinnabführungsvertrages in das Handelsregister nach § 10 des Handelsgesetzbuches als bekanntgemacht gilt, hat der andere Vertragsteil Sicherheit zu leisten, wenn sie sich binnen sechs Monaten nach der Bekanntmachung der Eintragung zu diesem Zweck bei ihm melden."
    },
    {
      "date": "2026-02-06",
      "id": "144534",
      "original_text": "Registerbekanntmachung nach dem Umwandlungsgesetz\nNiedersachsen Amtsgericht Tostedt HRB 203726\nVETERATOR Beratungsgesellschaft mbH – Neu Wulmstorf",
      "type": "Registerbekanntmachung nach dem Umwandlungsgesetz",
      "state": "Niedersachsen",
      "amtsgericht": "Amtsgericht Tostedt",
      "registernummer": "HRB 203726",
      "registerart": "HRB",
      "company_name": "VETERATOR Beratungsgesellschaft mbH",
      "company_seat": "Neu Wulmstorf",
      "details": "06.02.2026 (Bekanntmachungsdatum)\n\nNiedersachsen Amtsgericht Tostedt HRB 203726\nRegisterbekanntmachung nach dem Umwandlungsgesetz 06.02.2026 (Eintragungsdatum)\n\nVETERATOR Beratungsgesellschaft mbH\nGesellschaft mit beschränkter Haftung\nNeu Wulmstorf\n\nDen Gläubigern der an der Verschmelzung beteiligten Rechtsträger ist, wenn sie binnen sechs Monaten nach dem Tag, an dem die Eintragung der Verschmelzung in das Register des Sitzes desjenigen Rechtsträgers, dessen Gläubiger sie sind, nach § 19  Abs.  3 UmwG als bekannt gemacht gilt, ihren Anspruch nach Grund und Höhe schriftlich anmelden, Sicherheit zu leisten, soweit sie nicht Befriedigung verlangen können. Dieses Recht steht den Gläubigern jedoch nur zu, wenn sie glaubhaft machen, dass durch die Verschmelzung die Erfüllung der Forderung gefährdet wird."
    },
    {
      "date": "2026-02-06",
      "id": "144535",
      "original_text": "Löschungsankündigung\nNiedersachsen Amtsgericht Lüneburg HRA 201574\nFIBAFA GROUP Media GmbH & Co. KG – Wietzendorf",
      "type": "Löschungsankündigung",
      "state": "Niedersachsen",
      "amtsgericht": "Amtsgericht Lüneburg",
      "registernummer": "HRA 201574",
      "registerart": "HRA",
      "company_name": "FIBAFA GROUP Media GmbH & Co. KG",
      "company_seat": "Wietzendorf",
      "details": "06.02.2026 (Bekanntmachungsdatum)\n\nNiedersachsen Amtsgericht Lüneburg HRA 201574\nLöschungsankündigung\n\nFIBAFA GROUP Media GmbH & Co. KG\nKommanditgesellschaft\nWietzendorf\n\nDas Registergericht beabsichtigt, die Firma von Amts wegen nach § 394 FamFG zu löschen. Die Frist zur Erhebung eines Widerspruchs ist auf 1 Monat ab dieser Registerbekanntmachung festgesetzt."
    },
    {
      "date": "2026-02-06",
      "id": "144536",
      "original_text": "Löschungsankündigung\nNiedersachsen Amtsgericht Lüneburg HRB 209075\nLG Gartengestaltung GmbH – Winsen (Luhe)",
      "type": "Löschungsankündigung",
      "state": "Niedersachsen",
      "amtsgericht": "Amtsgericht Lüneburg",
      "registernummer": "HRB 209075",
      "registerart": "HRB",
      "company_name": "LG Gartengestaltung GmbH",
      "company_seat": "Winsen (Luhe)",
      "details": "06.02.2026 (Bekanntmachungsdatum)\n\nNiedersachsen Amtsgericht Lüneburg HRB 209075\nLöschungsankündigung\n\nLG Gartengestaltung GmbH\nGesellschaft mit beschränkter Haftung\nWinsen (Luhe)\n\nDas Registergericht beabsichtigt, die Gesellschaft von Amts wegen nach § 394 FamFG zu löschen. Die Frist zur Erhebung eines Widerspruchs ist auf 1 Monat ab dieser Registerbekanntmachung festgesetzt."
    },
    {
      "date": "2026-02-06",
      "id": "144537",
      "original_text": "Löschungsankündigung\nNiedersachsen Amtsgericht Braunschweig HRB 206160\nAsse Ingenieurberatung UG (haftungsbeschränkt) – Ohrum",
      "type": "Löschungsankündigung",
      "state": "Niedersachsen",
      "amtsgericht": "Amtsgericht Braunschweig",
      "registernummer": "HRB 206160",
      "registerart": "HRB",
      "company_name": "Asse Ingenieurberatung UG (haftungsbeschränkt)",
      "company_seat": "Ohrum",
      "details": "06.02.2026 (Bekanntmachungsdatum)\n\nNiedersachsen Amtsgericht Braunschweig HRB 206160\nLöschungsankündigung\n\nAsse Ingenieurberatung UG (haftungsbeschränkt)\nGesellschaft mit beschränkter Haftung\nOhrum\n\nDas Registergericht beabsichtigt, die Gesellschaft von Amts wegen nach § 394 FamFG zu löschen. Die Frist zur Erhebung eines Widerspruchs ist auf 1 Monat ab dieser Registerbekanntmachung festgesetzt."
    },
    {
      "date": "2026-02-06",
      "id": "144538",
      "original_text": "Registerbekanntmachung nach dem Umwandlungsgesetz\nNiedersachsen Amtsgericht Hannover VR 110381\nBalance e. V. – Garbsen",
      "type": "Registerbekanntmachung nach dem Umwandlungsgesetz",
      "state": "Niedersachsen",
      "amtsgericht": "Amtsgericht Hannover",
      "registernummer": "VR 110381",
      "registerart": "VR",
      "company_name": "Balance e. V.",
      "company_seat": "Garbsen",
      "details": "06.02.2026 (Bekanntmachungsdatum)\n\nNiedersachsen Amtsgericht Hannover VR 110381\nRegisterbekanntmachung nach dem Umwandlungsgesetz 06.02.2026 (Eintragungsdatum)\n\nBalance e. V.\neingetragener Verein\nGarbsen\n\nDen Gläubigern der an der formwechselnden Umwandlung beteiligten Rechtsträger ist, wenn sie binnen sechs Monaten nach dem Tag, an dem die Eintragung der Umwandlung in das Register des Sitzes desjenigen Rechtsträgers, dessen Gläubiger sie sind, nach § 19 Abs. 3 UmwG als bekannt gemacht gilt, ihren Anspruch nach Grund und Höhe schriftlich anmelden, Sicherheit zu leisten, soweit sie nicht Befriedigung verlangen können. Dieses Recht steht den Gläubigern jedoch nur zu, wenn sie glaubhaft machen, dass durch die formwechselnde Umwandlung die Erfüllung der Forderung gefährdet wird."
    },
    {
      "date": "2026-02-06",
      "id": "144539",
      "original_text": "Sonstige Registerbekanntmachung\nNiedersachsen Amtsgericht Oldenburg (Oldenburg) HRB 140382 früher Amtsgericht Delmenhorst\nHERMA Train Components GmbH – Delmenhorst",
      "type": "Sonstige Registerbekanntmachung",
      "state": "Niedersachsen",
      "amtsgericht": "Amtsgericht Oldenburg (Oldenburg)",
      "registernummer": "HRB 140382",
      "registerart": "HRB",
      "company_name": "HERMA Train Components GmbH",
      "company_seat": "Delmenhorst",
      "former_amtsgericht": "Delmenhorst",
      "details": "06.02.2026 (Bekanntmachungsdatum)\n\nNiedersachsen Amtsgericht Oldenburg (Oldenburg) HRB 140382 früher Amtsgericht Delmenhorst\nSonstige Registerbekanntmachung 06.02.2026 (Eintragungsdatum)\n\nHERMA Train Components GmbH\nGesellschaft mit beschränkter Haftung\nDelmenhorst\n\nDen Gläubigern der Gesellschaft, deren Forderungen begründet worden sind, bevor die Eintragung der Beendigung des Vertrages in das Handelsregister nach § 10 HGB als bekanntgemacht gilt, ist vom anderen Vertragsteil Sicherheit zu leisten, wenn sie sich binnen sechs Monaten nach der Bekanntmachung zu diesem Zweck bei ihm melden."
    },
    {
      "date": "2026-02-06",
      "id": "144540",
      "original_text": "Löschungsankündigung\nNiedersachsen Amtsgericht Aurich HRB 207120\nZarmstorff Holding UG (haftungsbschränkt) – Rhauderfehn",
      "type": "Löschungsankündigung",
      "state": "Niedersachsen",
      "amtsgericht": "Amtsgericht Aurich",
      "registernummer": "HRB 207120",
      "registerart": "HRB",
      "company_name": "Zarmstorff Holding UG (haftungsbschränkt)",
      "company_seat": "Rhauderfehn",
      "details": "06.02.2026 (Bekanntmachungsdatum)\n\nNiedersachsen Amtsgericht Aurich HRB 207120\nLöschungsankündigung\n\nZarmstorff Holding UG (haftungsbschränkt)\nGesellschaft mit beschränkter Haftung\nRhauderfehn\n\nDas Registergericht beabsichtigt, die Gesellschaft von Amts wegen nach § 394 FamFG zu löschen. Die Frist zur Erhebung eines Widerspruchs ist auf 1 Monat ab dieser Registerbekanntmachung festgesetzt."
    },
    {
      "date": "2026-02-06",
      "id": "144541",
      "original_text": "Einreichung neuer Dokumente\nNiedersachsen Amtsgericht Osnabrück HRB 19718\nOsnabrücker KommunalService GmbH (OKS) – Osnabrück",
      "type": "Einreichung neuer Dokumente",
      "state": "Niedersachsen",
      "amtsgericht": "Amtsgericht Osnabrück",
      "registernummer": "HRB 19718",
      "registerart": "HRB",
      "company_name": "Osnabrücker KommunalService GmbH (OKS)",
      "company_seat": "Osnabrück",
      "details": "06.02.2026 (Bekanntmachungsdatum)\n\nNiedersachsen Amtsgericht Osnabrück HRB 19718\nEinreichung neuer Dokumente\n\nOsnabrücker KommunalService GmbH (OKS)\nGesellschaft mit beschränkter Haftung\nOsnabrück\n\nDie Liste der Mitglieder des Aufsichtsrats wurde beim Registergericht eingereicht."
    },
    {
      "date": "2026-02-06",
      "id": "144542",
      "original_text": "Registerbekanntmachung nach dem Umwandlungsgesetz\nNiedersachsen Amtsgericht Braunschweig HRA 203473\nSchirmer Garten, Landschaft und Natur GmbH & Co. KG – Vechelde",
      "type": "Registerbekanntmachung nach dem Umwandlungsgesetz",
      "state": "Niedersachsen",
      "amtsgericht": "Amtsgericht Braunschweig",
      "registernummer": "HRA 203473",
      "registerart": "HRA",
      "company_name": "Schirmer Garten, Landschaft und Natur GmbH & Co. KG",
      "company_seat": "Vechelde",
      "details": "06.02.2026 (Bekanntmachungsdatum)\n\nNiedersachsen Amtsgericht Braunschweig HRA 203473\nRegisterbekanntmachung nach dem Umwandlungsgesetz 06.02.2026 (Eintragungsdatum)\n\nSchirmer Garten, Landschaft und Natur GmbH & Co. KG\nKommanditgesellschaft\nVechelde\n\nDen Gläubigern der an der Ausgliederung beteiligten Rechtsträger ist, wenn sie binnen sechs Monaten nach dem Tag, an dem die Eintragung der Ausgliederung in das Register des Sitzes desjenigen Rechtsträgers, dessen Gläubiger sie sind, nach § 19 Abs. 3 UmwG als bekannt gemacht gilt, ihren Anspruch nach Grund und Höhe schriftlich anmelden, Sicherheit zu leisten, soweit sie nicht Befriedigung verlangen können. Dieses Recht steht den Gläubigern jedoch nur zu, wenn sie glaubhaft machen, dass durch die Ausgliederung die Erfüllung der Forderung gefährdet wird."
    },
    {
      "date": "2026-02-06",
      "id": "144543",
      "original_text": "Registerbekanntmachung nach dem Umwandlungsgesetz\nNiedersachsen Amtsgericht Braunschweig HRA 203354\nSchirmer Gala-Bau Nils-Hendrik Schirmer e.K. – Vechelde",
      "type": "Registerbekanntmachung nach dem Umwandlungsgesetz",
      "state": "Niedersachsen",
      "amtsgericht": "Amtsgericht Braunschweig",
      "registernummer": "HRA 203354",
      "registerart": "HRA",
      "company_name": "Schirmer Gala-Bau Nils-Hendrik Schirmer e.K.",
      "company_seat": "Vechelde",
      "details": "06.02.2026 (Bekanntmachungsdatum)\n\nNiedersachsen Amtsgericht Braunschweig HRA 203354\nRegisterbekanntmachung nach dem Umwandlungsgesetz 06.02.2026 (Eintragungsdatum)\n\nSchirmer Gala-Bau Nils-Hendrik Schirmer e.K.\nEinzelkaufmann / Einzelkauffrau\nVechelde\n\nDen Gläubigern der an der Ausgliederung beteiligten Rechtsträger ist, wenn sie binnen sechs Monaten nach dem Tag, an dem die Eintragung der Ausgliederung in das Register des Sitzes desjenigen Rechtsträgers, dessen Gläubiger sie sind, nach § 19 Abs. 3 UmwG als bekannt gemacht gilt, ihren Anspruch nach Grund und Höhe schriftlich anmelden, Sicherheit zu leisten, soweit sie nicht Befriedigung verlangen können. Dieses Recht steht den Gläubigern jedoch nur zu, wenn sie glaubhaft machen, dass durch die Ausgliederung die Erfüllung der Forderung gefährdet wird."
    },
    {
      "date": "2026-02-06",
      "id": "144544",
      "original_text": "Registerbekanntmachung nach dem Umwandlungsgesetz\nNiedersachsen Amtsgericht Braunschweig HRA 203473\nSchirmer Garten, Landschaft und Natur GmbH & Co. KG – Vechelde",
      "type": "Registerbekanntmachung nach dem Umwandlungsgesetz",
      "state": "Niedersachsen",
      "amtsgericht": "Amtsgericht Braunschweig",
      "registernummer": "HRA 203473",
      "registerart": "HRA",
      "company_name": "Schirmer Garten, Landschaft und Natur GmbH & Co. KG",
      "company_seat": "Vechelde",
      "details": "06.02.2026 (Bekanntmachungsdatum)\n\nNiedersachsen Amtsgericht Braunschweig HRA 203473\nRegisterbekanntmachung nach dem Umwandlungsgesetz 06.02.2026 (Eintragungsdatum)\n\nSchirmer Garten, Landschaft und Natur GmbH & Co. KG\nKommanditgesellschaft\nVechelde\n\nDen Gläubigern der an der Ausgliederung beteiligten Rechtsträger ist, wenn sie binnen sechs Monaten nach dem Tag, an dem die Eintragung der Ausgliederung in das Register des Sitzes desjenigen Rechtsträgers, dessen Gläubiger sie sind, nach § 19 Abs. 3 UmwG als bekannt gemacht gilt, ihren Anspruch nach Grund und Höhe schriftlich anmelden, Sicherheit zu leisten, soweit sie nicht Befriedigung verlangen können. Dieses Recht steht den Gläubigern jedoch nur zu, wenn sie glaubhaft machen, dass durch die Ausgliederung die Erfüllung der Forderung gefährdet wird."
    },
    {
      "date": "2026-02-06",
      "id": "144545",
      "original_text": "Löschungsankündigung\nBremen Amtsgericht Bremen HRB 17267\nGHP Gaststättenbetriebs Gesellschaft mit beschränkter Haftung – Bremen",
      "type": "Löschungsankündigung",
      "state": "Bremen",
      "amtsgericht": "Amtsgericht Bremen",
      "registernummer": "HRB 17267",
      "registerart": "HRB",
      "company_name": "GHP Gaststättenbetriebs Gesellschaft mit beschränkter Haftung",
      "company_seat": "Bremen",
      "details": "06.02.2026 (Bekanntmachungsdatum)\n\nBremen Amtsgericht Bremen HRB 17267\nLöschungsankündigung\n\nGHP Gaststättenbetriebs Gesellschaft mit beschränkter Haftung\nGesellschaft mit beschränkter Haftung\nBremen\n\nEs ist beabsichtigt die im Handelsregister eingetragene Gesellschaft von Amts wegen gemäß § 394 FamFG zu löschen. Gegen die Löschung kann beim AG Bremen schriftlich oder zu Protokoll der Geschäftsstelle Widerspruch eingelegt werden. Widerspruchsfrist 4 Wochen."
    },
    {
      "date": "2026-02-06",
      "id": "144546",
      "original_text": "Registerbekanntmachung nach dem Umwandlungsgesetz\nRheinland-Pfalz Amtsgericht Landau HRA 30822\nMTS MarkenTechnikService GmbH & Co. KG – Rülzheim",
      "type": "Registerbekanntmachung nach dem Umwandlungsgesetz",
      "state": "Rheinland-Pfalz",
      "amtsgericht": "Amtsgericht Landau",
      "registernummer": "HRA 30822",
      "registerart": "HRA",
      "company_name": "MTS MarkenTechnikService GmbH & Co. KG",
      "company_seat": "Rülzheim",
      "details": "06.02.2026 (Bekanntmachungsdatum)\n\nRheinland-Pfalz Amtsgericht Landau HRA 30822\nRegisterbekanntmachung nach dem Umwandlungsgesetz 06.02.2026 (Eintragungsdatum)\n\nMTS MarkenTechnikService GmbH & Co. KG\nKommanditgesellschaft\nRülzheim\n\nAls nicht eingetragen wird veröffentlicht: Den Gläubigern der an der Spaltung beteiligten Rechtsträger ist, wenn sie binnen sechs Monaten nach dem Tag, an dem die Eintragung der Spaltung in das Register des Sitzes desjenigen Rechtsträgers, dessen Gläubiger sie sind, nach § 19 Abs. 3 UmwG als bekanntgemacht gilt, ihren Anspruch nach Grund und Höhe schriftlich anmelden, Sicherheit zu leisten, soweit sie nicht Befriedigung verlangen können. Dieses Recht steht den Gläubigern jedoch nur zu, wenn sie glaubhaft machen, dass durch die Spaltung die Erfüllung der Forderung gefährdet wird."
    },
    {
      "date": "2026-02-06",
      "id": "144547",
      "original_text": "Einreichung neuer Dokumente\nRheinland-Pfalz Amtsgericht Ludwigshafen a.Rhein (Ludwigshafen) HRB 70651\nBASF Beteiligungs SE – Limburgerhof",
      "type": "Einreichung neuer Dokumente",
      "state": "Rheinland-Pfalz",
      "amtsgericht": "Amtsgericht Ludwigshafen a.Rhein (Ludwigshafen)",
      "registernummer": "HRB 70651",
      "registerart": "HRB",
      "company_name": "BASF Beteiligungs SE",
      "company_seat": "Limburgerhof",
      "details": "06.02.2026 (Bekanntmachungsdatum)\n\nRheinland-Pfalz Amtsgericht Ludwigshafen a.Rhein (Ludwigshafen) HRB 70651\nEinreichung neuer Dokumente 06.02.2026 (Eintragungsdatum)\n\nBASF Beteiligungs SE\nEuropäische Aktiengesellschaft (SE)\nLimburgerhof\n\nDem Registergericht ist eine neue Liste der Mitglieder des Aufsichtsrates eingereicht worden."
    },
    {
      "date": "2026-02-06",
      "id": "144548",
      "original_text": "Löschungsankündigung\nRheinland-Pfalz Amtsgericht Montabaur HRB 29921\nConcret Facility Service GmbH – Herdorf",
      "type": "Löschungsankündigung",
      "state": "Rheinland-Pfalz",
      "amtsgericht": "Amtsgericht Montabaur",
      "registernummer": "HRB 29921",
      "registerart": "HRB",
      "company_name": "Concret Facility Service GmbH",
      "company_seat": "Herdorf",
      "details": "06.02.2026 (Bekanntmachungsdatum)\n\nRheinland-Pfalz Amtsgericht Montabaur HRB 29921\nLöschungsankündigung\n\nConcret Facility Service GmbH\nGesellschaft mit beschränkter Haftung\nHerdorf\n\nDas Registergericht beabsichtigt die Gesellschaft von Amts wegen nach § 394 FamFG zu löschen. Die Frist zur Erhebung eines Widerspruchs ist auf einen Monat festgesetzt."
    },
    {
      "date": "2026-02-06",
      "id": "144549",
      "original_text": "Registerbekanntmachung nach dem Umwandlungsgesetz\nRheinland-Pfalz Amtsgericht Landau HRB 31373\nIntertec Beteiligungs-GmbH – Rülzheim",
      "type": "Registerbekanntmachung nach dem Umwandlungsgesetz",
      "state": "Rheinland-Pfalz",
      "amtsgericht": "Amtsgericht Landau",
      "registernummer": "HRB 31373",
      "registerart": "HRB",
      "company_name": "Intertec Beteiligungs-GmbH",
      "company_seat": "Rülzheim",
      "details": "06.02.2026 (Bekanntmachungsdatum)\n\nRheinland-Pfalz Amtsgericht Landau HRB 31373\nRegisterbekanntmachung nach dem Umwandlungsgesetz 06.02.2026 (Eintragungsdatum)\n\nIntertec Beteiligungs-GmbH\nGesellschaft mit beschränkter Haftung\nRülzheim\n\nAls nicht eingetragen wird veröffentlicht: Den Gläubigern der an der Spaltung beteiligten Rechtsträger ist, wenn sie binnen sechs Monaten nach dem Tag, an dem die Eintragung der Spaltung in das Register des Sitzes desjenigen Rechtsträgers, dessen Gläubiger sie sind, nach § 19 Abs. 3 UmwG als bekanntgemacht gilt, ihren Anspruch nach Grund und Höhe schriftlich anmelden, Sicherheit zu leisten, soweit sie nicht Befriedigung verlangen können. Dieses Recht steht den Gläubigern jedoch nur zu, wenn sie glaubhaft machen, dass durch die Spaltung die Erfüllung der Forderung gefährdet wird."
    },
    {
      "date": "2026-02-06",
      "id": "144550",
      "original_text": "Sonstige Registerbekanntmachung\nRheinland-Pfalz Amtsgericht Ludwigshafen a.Rhein (Ludwigshafen) HRB 66055\nALUCOM AG – Ludwigshafen",
      "type": "Sonstige Registerbekanntmachung",
      "state": "Rheinland-Pfalz",
      "amtsgericht": "Amtsgericht Ludwigshafen a.Rhein (Ludwigshafen)",
      "registernummer": "HRB 66055",
      "registerart": "HRB",
      "company_name": "ALUCOM AG",
      "company_seat": "Ludwigshafen",
      "details": "06.02.2026 (Bekanntmachungsdatum)\n\nRheinland-Pfalz Amtsgericht Ludwigshafen a.Rhein (Ludwigshafen) HRB 66055\nSonstige Registerbekanntmachung 06.02.2026 (Eintragungsdatum)\n\nALUCOM AG\nAktiengesellschaft\nLudwigshafen\n\nDie Liste des geänderten Aufsichtsrates vom 27.01.2026 wurde zum Handelsregister eingereicht."
    },
    {
      "date": "2026-02-06",
      "id": "144551",
      "original_text": "Sonstige Registerbekanntmachung\nNordrhein-Westfalen Amtsgericht Wuppertal HRB 17149\nFondium Mettmann GmbH – Mettmann",
      "type": "Sonstige Registerbekanntmachung",
      "state": "Nordrhein-Westfalen",
      "amtsgericht": "Amtsgericht Wuppertal",
      "registernummer": "HRB 17149",
      "registerart": "HRB",
      "company_name": "Fondium Mettmann GmbH",
      "company_seat": "Mettmann",
      "details": "06.02.2026 (Bekanntmachungsdatum)\n\nNordrhein-Westfalen Amtsgericht Wuppertal HRB 17149\nSonstige Registerbekanntmachung\n\nFondium Mettmann GmbH\nGesellschaft mit beschränkter Haftung\nMettmann\n\nDem Registergericht ist eine Liste der Mitglieder des Aufsichtsrates eingereicht worden."
    },
    {
      "date": "2026-02-06",
      "id": "144552",
      "original_text": "Löschungsankündigung\nNordrhein-Westfalen Amtsgericht Düsseldorf HRB 98693\nDZ Transport GmbH – Düsseldorf",
      "type": "Löschungsankündigung",
      "state": "Nordrhein-Westfalen",
      "amtsgericht": "Amtsgericht Düsseldorf",
      "registernummer": "HRB 98693",
      "registerart": "HRB",
      "company_name": "DZ Transport GmbH",
      "company_seat": "Düsseldorf",
      "details": "06.02.2026 (Bekanntmachungsdatum)\n\nNordrhein-Westfalen Amtsgericht Düsseldorf HRB 98693\nLöschungsankündigung\n\nDZ Transport GmbH\nGesellschaft mit beschränkter Haftung\nDüsseldorf\n\nBetr.: DZ Transport GmbH, Beuthstr. 11, 40211 Düsseldorf\n\nDas Registergericht beabsichtigt die Gesellschaft von Amts wegen nach § 394 FamFG zu löschen. Die Frist zur Erhebung eines Widerspruchs ist auf 3 Wochen festgesetzt.\n\nRechtsbehelfsbelehrung:\n\nDas Widerspruchsrecht steht jedem zu, der an der Unterlassung der Löschung ein berechtigtes Interesse hat. Der Widerspruch ist bei dem Amtsgericht Düsseldorf -Registergericht-, Werdener Straße 1, 40227 Düsseldorf schriftlich in deutscher Sprache oder zur Niederschrift der Geschäftsstelle einzulegen. Der Widerspruch kann auch zur Niederschrift der Geschäftsstelle eines jeden Amtsgerichtes abgegeben werden. Die Einlegung ist auch durch Übertragung eines elektronischen Dokuments an die elektronische Poststelle des Gerichts möglich. Das elektronische Dokument muss für die Bearbeitung durch das Gericht geeignet und mit einer qualifizierten elektronischen Signatur der verantwortenden Person versehen sein oder von der verantwortenden Person signiert und auf einem sicheren Übermittlungsweg gemäß § 130a ZPO nach näherer Maßgabe der Verordnung über die technischen Rahmenbedingungen des elektronischen Rechtsverkehrs und über das besondere elektronische Behördenpostfach (BGBl. I, S.3803) eingereicht werden. Weitere Informationen erhalten Sie auf der Internetseite www.justiz.de.\nDer Widerspruch muss spätestens innerhalb der gesetzten Frist nach dem Datum der Bekanntmachung der Löschungsankündigung bei dem Amtsgericht - Registergericht - Düsseldorf eingegangen sein.  Dies gilt auch dann, wenn der Widerspruch zur Niederschrift der Geschäftsstelle eines anderen Amtsgerichtes abgegeben wurde. Die Frist beginnt mit dem Tage der Bekanntmachung der Löschungsankündigung in dem für die Bekanntmachung der Eintragungen in das Handelsregister bestimmten elektronischen Informations- und Kommunikationssystem nach § 10 des Handelsgesetzbuches. Fällt das Ende der Frist auf einen Sonntag, einen allgemeinen Feiertag oder Sonnabend, so endet die Frist mit Ablauf des nächsten Werktages.\nDer Widerspruch muss die Bezeichnung der angefochtenen Löschungsankündigung sowie die Erklärung enthalten, dass Widerspruch gegen diese Löschungsankündigung eingelegt wird. Er ist zu unterzeichnen und soll begründet werden."
    },
    {
      "date": "2026-02-06",
      "id": "144553",
      "original_text": "Löschungsankündigung\nNordrhein-Westfalen Amtsgericht Düsseldorf HRB 98442\nWeyand Verwaltungs GmbH – Düsseldorf",
      "type": "Löschungsankündigung",
      "state": "Nordrhein-Westfalen",
      "amtsgericht": "Amtsgericht Düsseldorf",
      "registernummer": "HRB 98442",
      "registerart": "HRB",
      "company_name": "Weyand Verwaltungs GmbH",
      "company_seat": "Düsseldorf",
      "details": "06.02.2026 (Bekanntmachungsdatum)\n\nNordrhein-Westfalen Amtsgericht Düsseldorf HRB 98442\nLöschungsankündigung\n\nWeyand Verwaltungs GmbH\nGesellschaft mit beschränkter Haftung\nDüsseldorf\n\nBetr.: Weyand Verwaltungs GmbH, Lohbruchweg 4, 40699 Erkrath; Sitz Düsseldorf\n\nDas Registergericht beabsichtigt die Gesellschaft von Amts wegen nach § 394 FamFG zu löschen. Die Frist zur Erhebung eines Widerspruchs ist auf 3 Wochen festgesetzt.\n\nRechtsbehelfsbelehrung:\n\nDas Widerspruchsrecht steht jedem zu, der an der Unterlassung der Löschung ein berechtigtes Interesse hat. Der Widerspruch ist bei dem Amtsgericht Düsseldorf -Registergericht-, Werdener Straße 1, 40227 Düsseldorf schriftlich in deutscher Sprache oder zur Niederschrift der Geschäftsstelle einzulegen. Der Widerspruch kann auch zur Niederschrift der Geschäftsstelle eines jeden Amtsgerichtes abgegeben werden. Die Einlegung ist auch durch Übertragung eines elektronischen Dokuments an die elektronische Poststelle des Gerichts möglich. Das elektronische Dokument muss für die Bearbeitung durch das Gericht geeignet und mit einer qualifizierten elektronischen Signatur der verantwortenden Person versehen sein oder von der verantwortenden Person signiert und auf einem sicheren Übermittlungsweg gemäß § 130a ZPO nach näherer Maßgabe der Verordnung über die technischen Rahmenbedingungen des elektronischen Rechtsverkehrs und über das besondere elektronische Behördenpostfach (BGBl. I, S.3803) eingereicht werden. Weitere Informationen erhalten Sie auf der Internetseite www.justiz.de.\nDer Widerspruch muss spätestens innerhalb der gesetzten Frist nach dem Datum der Bekanntmachung der Löschungsankündigung bei dem Amtsgericht - Registergericht - Düsseldorf eingegangen sein.  Dies gilt auch dann, wenn der Widerspruch zur Niederschrift der Geschäftsstelle eines anderen Amtsgerichtes abgegeben wurde. Die Frist beginnt mit dem Tage der Bekanntmachung der Löschungsankündigung in dem für die Bekanntmachung der Eintragungen in das Handelsregister bestimmten elektronischen Informations- und Kommunikationssystem nach § 10 des Handelsgesetzbuches. Fällt das Ende der Frist auf einen Sonntag, einen allgemeinen Feiertag oder Sonnabend, so endet die Frist mit Ablauf des nächsten Werktages.\nDer Widerspruch muss die Bezeichnung der angefochtenen Löschungsankündigung sowie die Erklärung enthalten, dass Widerspruch gegen diese Löschungsankündigung eingelegt wird. Er ist zu unterzeichnen und soll begründet werden."
    },
    {
      "date": "2026-02-06",
      "id": "144554",
      "original_text": "Registerbekanntmachung nach dem Umwandlungsgesetz\nNordrhein-Westfalen Amtsgericht Köln HRB 87688\nDER Reisebüro Service GmbH – Köln",
      "type": "Registerbekanntmachung nach dem Umwandlungsgesetz",
      "state": "Nordrhein-Westfalen",
      "amtsgericht": "Amtsgericht Köln",
      "registernummer": "HRB 87688",
      "registerart": "HRB",
      "company_name": "DER Reisebüro Service GmbH",
      "company_seat": "Köln",
      "details": "06.02.2026 (Bekanntmachungsdatum)\n\nNordrhein-Westfalen Amtsgericht Köln HRB 87688\nRegisterbekanntmachung nach dem Umwandlungsgesetz 06.02.2026 (Eintragungsdatum)\n\nDER Reisebüro Service GmbH\nGesellschaft mit beschränkter Haftung\nKöln\n\nDen Gläubigern der an der Verschmelzung beteiligten Rechtsträger ist, wenn sie binnen sechs Monaten nach dem Tag, an dem die Eintragung der Verschmelzung in das Register des Sitzes derjenigen Rechtsträger deren Gläubiger sie sind, nach § 19 Absatz 3 UmwG als bekanntgemacht gilt, ihren Anspruch nach Grund und Höhe schriftlich anmelden, Sicherheit zu leisten, soweit sie nicht Befriedigung verlangen können. Dieses Recht steht den Gläubigern jedoch nur zu, wenn sie glaubhaft machen, dass durch die Verschmelzung die Erfüllung ihrer Forderung gefährdet wird."
    },
    {
      "date": "2026-02-06",
      "id": "144555",
      "original_text": "Registerbekanntmachung nach dem Umwandlungsgesetz\nNordrhein-Westfalen Amtsgericht Bonn HRA 10309\nElektro Reuter e.K. – Bonn",
      "type": "Registerbekanntmachung nach dem Umwandlungsgesetz",
      "state": "Nordrhein-Westfalen",
      "amtsgericht": "Amtsgericht Bonn",
      "registernummer": "HRA 10309",
      "registerart": "HRA",
      "company_name": "Elektro Reuter e.K.",
      "company_seat": "Bonn",
      "details": "06.02.2026 (Bekanntmachungsdatum)\n\nNordrhein-Westfalen Amtsgericht Bonn HRA 10309\nRegisterbekanntmachung nach dem Umwandlungsgesetz 06.02.2026 (Eintragungsdatum)\n\nElektro Reuter e.K.\nEinzelkaufmann / Einzelkauffrau\nBonn\n\nDen Gläubigern der an der Ausgliederung beteiligten Rechtsträger ist, wenn sie binnen sechs Monaten nach dem Tag, an dem die Eintragung der Ausgliederung in das Register des Sitzes derjenigen Rechtsträger deren Gläubiger sie sind, nach § 19 Absatz 3 UmwG als bekanntgemacht gilt, ihren Anspruch nach Grund und Höhe schriftlich anmelden, Sicherheit zu leisten, soweit sie nicht Befriedigung verlangen können. Dieses Recht steht den Gläubigern jedoch nur zu, wenn sie glaubhaft machen, dass durch die Ausgliederung die Erfüllung ihrer Forderung gefährdet wird."
    },
    {
      "date": "2026-02-06",
      "id": "144556",
      "original_text": "Registerbekanntmachung nach dem Umwandlungsgesetz\nNordrhein-Westfalen Amtsgericht Paderborn HRB 17584\nDreizack Medien GmbH – Paderborn",
      "type": "Registerbekanntmachung nach dem Umwandlungsgesetz",
      "state": "Nordrhein-Westfalen",
      "amtsgericht": "Amtsgericht Paderborn",
      "registernummer": "HRB 17584",
      "registerart": "HRB",
      "company_name": "Dreizack Medien GmbH",
      "company_seat": "Paderborn",
      "details": "06.02.2026 (Bekanntmachungsdatum)\n\nNordrhein-Westfalen Amtsgericht Paderborn HRB 17584\nRegisterbekanntmachung nach dem Umwandlungsgesetz 06.02.2026 (Eintragungsdatum)\n\nDreizack Medien GmbH\nGesellschaft mit beschränkter Haftung\nPaderborn\n\nDen Gläubigern der an der Ausgliederung beteiligten Rechtsträger ist, wenn sie binnen sechs Monaten nach dem Tag, an dem die Eintragung der Ausgliederung in das Register des Sitzes desjenigen Rechtsträgers, dessen Gläubiger sie sind, nach § 19 Absatz 3 UmwG als bekanntgemacht gilt, ihren Anspruch nach Grund und Höhe schriftlich anmelden, Sicherheit zu leisten, soweit sie nicht Befriedigung verlangen können. Dieses Recht steht den Gläubigern jedoch nur zu, wenn sie glaubhaft machen, dass durch die Ausgliederung die Erfüllung ihrer Forderung gefährdet wird."
    },
    {
      "date": "2026-02-06",
      "id": "144557",
      "original_text": "Löschungsankündigung\nNordrhein-Westfalen Amtsgericht Bochum HRB 21168\nEK Bau GmbH – Bochum",
      "type": "Löschungsankündigung",
      "state": "Nordrhein-Westfalen",
      "amtsgericht": "Amtsgericht Bochum",
      "registernummer": "HRB 21168",
      "registerart": "HRB",
      "company_name": "EK Bau GmbH",
      "company_seat": "Bochum",
      "details": "06.02.2026 (Bekanntmachungsdatum)\n\nNordrhein-Westfalen Amtsgericht Bochum HRB 21168\nLöschungsankündigung\n\nEK Bau GmbH\nGesellschaft mit beschränkter Haftung\nBochum\n\nDas Registergericht beabsichtigt die Gesellschaft von Amts wegen nach § 394 FamFG zu löschen. Die Frist zur Erhebung eines Widerspruchs ist auf drei Monate festgesetzt."
    },
    {
      "date": "2026-02-06",
      "id": "144558",
      "original_text": "Löschungsankündigung\nNordrhein-Westfalen Amtsgericht Dortmund HRB 31298\nTaverne Epsilon UG (haftungsbeschränkt) – Dortmund",
      "type": "Löschungsankündigung",
      "state": "Nordrhein-Westfalen",
      "amtsgericht": "Amtsgericht Dortmund",
      "registernummer": "HRB 31298",
      "registerart": "HRB",
      "company_name": "Taverne Epsilon UG (haftungsbeschränkt)",
      "company_seat": "Dortmund",
      "details": "06.02.2026 (Bekanntmachungsdatum)\n\nNordrhein-Westfalen Amtsgericht Dortmund HRB 31298\nLöschungsankündigung 06.02.2026 (Eintragungsdatum)\n\nTaverne Epsilon UG (haftungsbeschränkt)\nGesellschaft mit beschränkter Haftung\nDortmund\n\nDas Registergericht beabsichtigt die Gesellschaft von Amts wegen nach § 394 FamFG zu löschen. Die Frist zur Erhebung eines Widerspruchs ist auf drei Monate festgesetzt."
    },
    {
      "date": "2026-02-06",
      "id": "144559",
      "original_text": "Einreichung neuer Dokumente\nNordrhein-Westfalen Amtsgericht Iserlohn HRB 8773\nDRK Soziale Dienste MK gGmbH – Iserlohn",
      "type": "Einreichung neuer Dokumente",
      "state": "Nordrhein-Westfalen",
      "amtsgericht": "Amtsgericht Iserlohn",
      "registernummer": "HRB 8773",
      "registerart": "HRB",
      "company_name": "DRK Soziale Dienste MK gGmbH",
      "company_seat": "Iserlohn",
      "details": "06.02.2026 (Bekanntmachungsdatum)\n\nNordrhein-Westfalen Amtsgericht Iserlohn HRB 8773\nEinreichung neuer Dokumente 28.01.2026 (Eintragungsdatum)\n\nDRK Soziale Dienste MK gGmbH\nGesellschaft mit beschränkter Haftung\nIserlohn\n\nDem Registergericht ist eine neue Liste der Mitglieder des Aufsichtsrates eingereicht worden."
    },
    {
      "date": "2026-02-06",
      "id": "144560",
      "original_text": "Registerbekanntmachung nach dem Umwandlungsgesetz\nNordrhein-Westfalen Amtsgericht Bonn HRA 10314\nElektro Reuter Bonn GmbH & Co. KG – Bonn",
      "type": "Registerbekanntmachung nach dem Umwandlungsgesetz",
      "state": "Nordrhein-Westfalen",
      "amtsgericht": "Amtsgericht Bonn",
      "registernummer": "HRA 10314",
      "registerart": "HRA",
      "company_name": "Elektro Reuter Bonn GmbH & Co. KG",
      "company_seat": "Bonn",
      "details": "06.02.2026 (Bekanntmachungsdatum)\n\nNordrhein-Westfalen Amtsgericht Bonn HRA 10314\nRegisterbekanntmachung nach dem Umwandlungsgesetz 06.02.2026 (Eintragungsdatum)\n\nElektro Reuter Bonn GmbH & Co. KG\nKommanditgesellschaft\nBonn\n\nDen Gläubigern der an der Ausgliederung beteiligten Rechtsträger ist, wenn sie binnen sechs Monaten nach dem Tag, an dem die Eintragung der Ausgliederung in das Register des Sitzes derjenigen Rechtsträger deren Gläubiger sie sind, nach § 19 Absatz 3 UmwG als bekanntgemacht gilt, ihren Anspruch nach Grund und Höhe schriftlich anmelden, Sicherheit zu leisten, soweit sie nicht Befriedigung verlangen können. Dieses Recht steht den Gläubigern jedoch nur zu, wenn sie glaubhaft machen, dass durch die Ausgliederung die Erfüllung ihrer Forderung gefährdet wird."
    },
    {
      "date": "2026-02-06",
      "id": "144561",
      "original_text": "Löschungsankündigung\nNordrhein-Westfalen Amtsgericht Köln HRB 116690\nVan Dijk Dienstleistung UG (haftungsbeschränkt) – Hürth",
      "type": "Löschungsankündigung",
      "state": "Nordrhein-Westfalen",
      "amtsgericht": "Amtsgericht Köln",
      "registernummer": "HRB 116690",
      "registerart": "HRB",
      "company_name": "Van Dijk Dienstleistung UG (haftungsbeschränkt)",
      "company_seat": "Hürth",
      "details": "06.02.2026 (Bekanntmachungsdatum)\n\nNordrhein-Westfalen Amtsgericht Köln HRB 116690\nLöschungsankündigung\n\nVan Dijk Dienstleistung UG (haftungsbeschränkt)\nGesellschaft mit beschränkter Haftung\nHürth\n\nDas Registergericht beabsichtigt die Gesellschaft von Amts wegen nach § 394 FamFG zu löschen. Die Frist zur Erhebung eines Widerspruchs ist auf einen Monat festgesetzt."
    },
    {
      "date": "2026-02-06",
      "id": "144562",
      "original_text": "Einreichung neuer Dokumente\nNordrhein-Westfalen Amtsgericht Iserlohn HRB 8800\nDRK Kinder & Jugend im MK gGmbH – Iserlohn",
      "type": "Einreichung neuer Dokumente",
      "state": "Nordrhein-Westfalen",
      "amtsgericht": "Amtsgericht Iserlohn",
      "registernummer": "HRB 8800",
      "registerart": "HRB",
      "company_name": "DRK Kinder & Jugend im MK gGmbH",
      "company_seat": "Iserlohn",
      "details": "06.02.2026 (Bekanntmachungsdatum)\n\nNordrhein-Westfalen Amtsgericht Iserlohn HRB 8800\nEinreichung neuer Dokumente 28.01.2026 (Eintragungsdatum)\n\nDRK Kinder & Jugend im MK gGmbH\nGesellschaft mit beschränkter Haftung\nIserlohn\n\nDem Registergericht ist eine neue Liste der Mitglieder des Aufsichtsrates eingereicht worden."
    },
    {
      "date": "2026-02-06",
      "id": "144563",
      "original_text": "Löschungsankündigung\nNordrhein-Westfalen Amtsgericht Düsseldorf HRB 100606\nNowphene New Energy GmbH – Ratingen",
      "type": "Löschungsankündigung",
      "state": "Nordrhein-Westfalen",
      "amtsgericht": "Amtsgericht Düsseldorf",
      "registernummer": "HRB 100606",
      "registerart": "HRB",
      "company_name": "Nowphene New Energy GmbH",
      "company_seat": "Ratingen",
      "details": "06.02.2026 (Bekanntmachungsdatum)\n\nNordrhein-Westfalen Amtsgericht Düsseldorf HRB 100606\nLöschungsankündigung\n\nNowphene New Energy GmbH\nGesellschaft mit beschränkter Haftung\nRatingen\n\nDas Registergericht beabsichtigt die Gesellschaft von Amts wegen nach § 394 Abs. 1 FamFG zu löschen. Die Frist zur Erhebung eines Widerspruchs ist auf einen Monat festgesetzt.\n\nRechtsbehelfsbelehrung:\nDas Widerspruchsrecht steht jedem zu, der an der Unterlassung der Löschung ein berechtigtes Interesse hat. Der Widerspruch ist bei dem Amtsgericht Düsseldorf -Registergericht-, Werdener Straße 1, 40227 Düsseldorf schriftlich in deutscher Sprache oder zur Niederschrift der Geschäftsstelle einzulegen. Der Widerspruch kann auch zur Niederschrift der Geschäftsstelle eines jeden Amtsgerichtes abgegeben werden. Die Einlegung ist auch durch Übertragung eines elektronischen Dokuments an die elektronische Poststelle des Gerichts möglich. Das elektronische Dokument muss für die Bearbeitung durch das Gericht geeignet und mit einer qualifizierten elektronischen Signatur der verantwortenden Person versehen sein oder von der verantwortenden Person signiert und auf einem sicheren Übermittlungsweg gemäß § 130a ZPO nach näherer Maßgabe der Verordnung über die technischen Rahmenbedingungen des elektronischen Rechtsverkehrs und über das besondere elektronische Behördenpostfach (BGBl. I, S.3803) eingereicht werden. Weitere Informationen erhalten Sie auf der Internetseite www.justiz.de.\nDer Widerspruch muss spätestens innerhalb der gesetzten Frist nach dem Datum der Bekanntmachung der Löschungsankündigung bei dem Amtsgericht - Registergericht - Düsseldorf eingegangen sein.  Dies gilt auch dann, wenn der Widerspruch zur Niederschrift der Geschäftsstelle eines anderen Amtsgerichtes abgegeben wurde. Die Frist beginnt mit dem Tage der Bekanntmachung der Löschungsankündigung in dem für die Bekanntmachung der Eintragungen in das Handelsregister bestimmten elektronischen Informations- und Kommunikationssystem nach § 10 des Handelsgesetzbuches. Fällt das Ende der Frist auf einen Sonntag, einen allgemeinen Feiertag oder Sonnabend, so endet die Frist mit Ablauf des nächsten Werktages.\nDer Widerspruch muss die Bezeichnung der angefochtenen Löschungsankündigung sowie die Erklärung enthalten, dass Widerspruch gegen diese Löschungsankündigung eingelegt wird. Er ist zu unterzeichnen und soll begründet werden."
    },
    {
      "date": "2026-02-06",
      "id": "144564",
      "original_text": "Löschungsankündigung\nNordrhein-Westfalen Amtsgericht Düsseldorf HRB 99328\nRotec Industrie-Montage GmbH – Monheim am Rhein",
      "type": "Löschungsankündigung",
      "state": "Nordrhein-Westfalen",
      "amtsgericht": "Amtsgericht Düsseldorf",
      "registernummer": "HRB 99328",
      "registerart": "HRB",
      "company_name": "Rotec Industrie-Montage GmbH",
      "company_seat": "Monheim am Rhein",
      "details": "06.02.2026 (Bekanntmachungsdatum)\n\nNordrhein-Westfalen Amtsgericht Düsseldorf HRB 99328\nLöschungsankündigung\n\nRotec Industrie-Montage GmbH\nGesellschaft mit beschränkter Haftung\nMonheim am Rhein\n\nDas Registergericht beabsichtigt die Gesellschaft von Amts wegen nach § 394 FamFG zu löschen. Die Frist zur Erhebung eines Widerspruchs ist auf 3 Wochen festgesetzt.\n\nRechtsbehelfsbelehrung:\nDas Widerspruchsrecht steht jedem zu, der an der Unterlassung der Löschung ein berechtigtes Interesse hat. Der Widerspruch ist bei dem Amtsgericht Düsseldorf -Registergericht-, Werdener Straße 1, 40227 Düsseldorf schriftlich in deutscher Sprache oder zur Niederschrift der Geschäftsstelle einzulegen. Der Widerspruch kann auch zur Niederschrift der Geschäftsstelle eines jeden Amtsgerichtes abgegeben werden. Die Einlegung ist auch durch Übertragung eines elektronischen Dokuments an die elektronische Poststelle des Gerichts möglich. Das elektronische Dokument muss für die Bearbeitung durch das Gericht geeignet und mit einer qualifizierten elektronischen Signatur der verantwortenden Person versehen sein oder von der verantwortenden Person signiert und auf einem sicheren Übermittlungsweg gemäß § 130a ZPO nach näherer Maßgabe der Verordnung über die technischen Rahmenbedingungen des elektronischen Rechtsverkehrs und über das besondere elektronische Behördenpostfach (BGBl. I, S.3803) eingereicht werden. Weitere Informationen erhalten Sie auf der Internetseite www.justiz.de.\nDer Widerspruch muss spätestens innerhalb der gesetzten Frist nach dem Datum der Bekanntmachung der Löschungsankündigung bei dem Amtsgericht - Registergericht - Düsseldorf eingegangen sein.  Dies gilt auch dann, wenn der Widerspruch zur Niederschrift der Geschäftsstelle eines anderen Amtsgerichtes abgegeben wurde. Die Frist beginnt mit dem Tage der Bekanntmachung der Löschungsankündigung in dem für die Bekanntmachung der Eintragungen in das Handelsregister bestimmten elektronischen Informations- und Kommunikationssystem nach § 10 des Handelsgesetzbuches. Fällt das Ende der Frist auf einen Sonntag, einen allgemeinen Feiertag oder Sonnabend, so endet die Frist mit Ablauf des nächsten Werktages.\nDer Widerspruch muss die Bezeichnung der angefochtenen Löschungsankündigung sowie die Erklärung enthalten, dass Widerspruch gegen diese Löschungsankündigung eingelegt wird. Er ist zu unterzeichnen und soll begründet werden."
    },
    {
      "date": "2026-02-06",
      "id": "144565",
      "original_text": "Löschungsankündigung\nNordrhein-Westfalen Amtsgericht Bochum HRB 20148\nAK-Bau GmbH – Bochum",
      "type": "Löschungsankündigung",
      "state": "Nordrhein-Westfalen",
      "amtsgericht": "Amtsgericht Bochum",
      "registernummer": "HRB 20148",
      "registerart": "HRB",
      "company_name": "AK-Bau GmbH",
      "company_seat": "Bochum",
      "details": "06.02.2026 (Bekanntmachungsdatum)\n\nNordrhein-Westfalen Amtsgericht Bochum HRB 20148\nLöschungsankündigung\n\nAK-Bau GmbH\nGesellschaft mit beschränkter Haftung\nBochum\n\nDas Registergericht beabsichtigt die Gesellschaft von Amts wegen nach § 394 FamFG zu löschen. Die Frist zur Erhebung eines Widerspruchs ist auf drei Monate festgesetzt."
    },
    {
      "date": "2026-02-06",
      "id": "144566",
      "original_text": "Löschungsankündigung\nNordrhein-Westfalen Amtsgericht Siegburg HRB 12767\nKöhler Holding GmbH – Sankt Augustin",
      "type": "Löschungsankündigung",
      "state": "Nordrhein-Westfalen",
      "amtsgericht": "Amtsgericht Siegburg",
      "registernummer": "HRB 12767",
      "registerart": "HRB",
      "company_name": "Köhler Holding GmbH",
      "company_seat": "Sankt Augustin",
      "details": "06.02.2026 (Bekanntmachungsdatum)\n\nNordrhein-Westfalen Amtsgericht Siegburg HRB 12767\nLöschungsankündigung\n\nKöhler Holding GmbH\nGesellschaft mit beschränkter Haftung\nSankt Augustin\n\nDas Registergericht hat glaubhafte Kenntnis erlangt, dass die Gesellschaft vermögenslos geworden ist.\n\nEs ist daher beabsichtigt, die Gesellschaft nach § 394 FamFG im Handelsregister wegen Vermögenslosigkeit zu löschen.\nEinwände gegen die Löschung sind durch Widerspruch binnen einer Frist von 3 Monaten geltend zu machen, andernfalls die Löschung erfolgen wird.\n\nEinzulegen ist der Widerspruch bei dem Amtsgericht Siegburg, Neue Poststraße 16, 53721 Siegburg, und zwar entweder schriftlich in deutscher Sprache oder mündlich zur Niederschrift der Geschäftsstelle. Der Widerspruch kann auch zur Niederschrift der Geschäftsstelle eines jeden Amtsgerichts abgegeben werden. Der Widerspruch ist binnen der in der Verfügung bestimmten Frist einzulegen. Die Frist ist nur gewahrt, wenn der Widerspruch rechtzeitig bei dem Amtsgericht Siegburg eingeht, auch wenn der Widerspruch zur Niederschrift der Geschäftsstelle eines anderen Amtsgerichts abgegeben wurde. Die Frist beginnt jeweils mit der schriftlichen Bekanntgabe der Verfügung an die Beteiligten. Kann die schriftliche Bekanntgabe an einen Beteiligten nicht bewirkt werden, beginnt die Frist spätestens mit Ablauf von fünf Monaten nach Erlass der Verfügung. Die Bekanntgabe ist entweder durch Zustellung oder am dritten Tage nach Aufgabe zur Post bewirkt. Sofern die Löschung noch nicht erfolgt ist, kann der Widerspruch auch noch nach Ablauf der Frist eingelegt werden. Fällt das Ende der Frist auf einen Sonnabend, einen Sonntag oder einen allgemeinen Feiertag, endet die Frist mit Ablauf des nächsten Werktages. Der Widerspruch ist zu unterzeichnen. Eine Begründung des Widerspruchs ist nicht vorgeschrieben."
    },
    {
      "date": "2026-02-06",
      "id": "144567",
      "original_text": "Einreichung neuer Dokumente\nNordrhein-Westfalen Amtsgericht Duisburg HRB 15907\nschenck.de Aktiengesellschaft – Mülheim an der Ruhr",
      "type": "Einreichung neuer Dokumente",
      "state": "Nordrhein-Westfalen",
      "amtsgericht": "Amtsgericht Duisburg",
      "registernummer": "HRB 15907",
      "registerart": "HRB",
      "company_name": "schenck.de Aktiengesellschaft",
      "company_seat": "Mülheim an der Ruhr",
      "details": "06.02.2026 (Bekanntmachungsdatum)\n\nNordrhein-Westfalen Amtsgericht Duisburg HRB 15907\nEinreichung neuer Dokumente\n\nschenck.de Aktiengesellschaft\nAktiengesellschaft\nMülheim an der Ruhr\n\nDem Registergericht ist eine Liste der Mitglieder des Aufsichtsrates eingereicht worden."
    },
    {
      "date": "2026-02-06",
      "id": "144568",
      "original_text": "Löschungsankündigung\nNordrhein-Westfalen Amtsgericht Duisburg HRB 33551\nImmotex Hopsten Verwaltungs GmbH – Duisburg",
      "type": "Löschungsankündigung",
      "state": "Nordrhein-Westfalen",
      "amtsgericht": "Amtsgericht Duisburg",
      "registernummer": "HRB 33551",
      "registerart": "HRB",
      "company_name": "Immotex Hopsten Verwaltungs GmbH",
      "company_seat": "Duisburg",
      "details": "06.02.2026 (Bekanntmachungsdatum)\n\nNordrhein-Westfalen Amtsgericht Duisburg HRB 33551\nLöschungsankündigung\n\nImmotex Hopsten Verwaltungs GmbH\nGesellschaft mit beschränkter Haftung\nDuisburg\n\nDas Registergericht beabsichtigt, die im Handelsregister unter HRB 33551 eingetragene Gesellschaft Immotex Hopsten Verwaltungs GmbH  gemäß § 394 FamFG wegen Vermögenslosigkeit von Amts wegen zu löschen.\nGegen diese Verfügung kann Widerspruch eingelegt werden. Die Frist zur Erhebung eines Widerspruchs gegen die beabsichtigte Löschung von Amts wegen ist auf drei Monate festgesetzt.\n\nRechtsbehelfsbelehrung\nDer Widerspruch ist bei dem Amtsgericht Duisburg, Kardinal-Galen-Str. 124-132, 47058 Duisburg schriftlich in deutscher Sprache oder zur Niederschrift der Geschäftsstelle einzulegen. Der Widerspruch kann auch zur Niederschrift der Geschäftsstelle eines jeden Amtsgerichtes abgegeben werden.\nDie Einlegung ist auch durch Übertragung eines elektronischen Dokuments an die elektronische Poststelle des Gerichts möglich. Das elektronische Dokument muss für die Bearbeitung durch das Gericht geeignet und mit einer qualifizierten elektronischen Signatur der verantwortenden Person versehen sein oder von der verantwortenden Person signiert und auf einem sicheren Übermittlungsweg gemäß § 130 a ZPO nach näherer Maßgabe der Verordnung über die technischen Rahmenbedingungen des elektronischen Rechtsverkehrs und über das besondere elektronische Behördenpostfach (BGBl. I, S. 3803) eingereicht werden. Weitere Informationen erhalten Sie auf der Internetseite www.justiz.de.\n\nDer Widerspruch muss spätestens innerhalb der gesetzten Frist bei dem Amtsgericht Duisburg eingegangen sein. Dies gilt auch dann, wenn der Widerspruch zur Niederschrift der Geschäftsstelle eines anderen Amtsgerichtes abgegeben wurde. Die Frist beginnt mit der Veröffentlichung. Fällt das Ende der Frist auf einen Sonntag, einen allgemeinen Feiertag oder Sonnabend, so endet die Frist mit Ablauf des nächsten Werktages.\n\nDer Widerspruch muss die Bezeichnung der angefochtenen Verfügung sowie die Erklärung enthalten, dass Widerspruch gegen diese Verfügung eingelegt wird. Er ist zu unterzeichnen und soll begründet werden."
    },
    {
      "date": "2026-02-06",
      "id": "144569",
      "original_text": "Löschungsankündigung\nNordrhein-Westfalen Amtsgericht Düsseldorf HRB 76107\nM & B Bau GmbH – Langenfeld",
      "type": "Löschungsankündigung",
      "state": "Nordrhein-Westfalen",
      "amtsgericht": "Amtsgericht Düsseldorf",
      "registernummer": "HRB 76107",
      "registerart": "HRB",
      "company_name": "M & B Bau GmbH",
      "company_seat": "Langenfeld",
      "details": "06.02.2026 (Bekanntmachungsdatum)\n\nNordrhein-Westfalen Amtsgericht Düsseldorf HRB 76107\nLöschungsankündigung\n\nM & B Bau GmbH\nGesellschaft mit beschränkter Haftung\nLangenfeld\n\nDas Registergericht beabsichtigt die Gesellschaft von Amts wegen nach § 394 FamFG zu löschen. Die Frist zur Erhebung eines Widerspruchs ist auf 3 Wochen festgesetzt.\n\nRechtsbehelfsbelehrung:\nDas Widerspruchsrecht steht jedem zu, der an der Unterlassung der Löschung ein berechtigtes Interesse hat. Der Widerspruch ist bei dem Amtsgericht Düsseldorf -Registergericht-, Werdener Straße 1, 40227 Düsseldorf schriftlich in deutscher Sprache oder zur Niederschrift der Geschäftsstelle einzulegen. Der Widerspruch kann auch zur Niederschrift der Geschäftsstelle eines jeden Amtsgerichtes abgegeben werden. Die Einlegung ist auch durch Übertragung eines elektronischen Dokuments an die elektronische Poststelle des Gerichts möglich. Das elektronische Dokument muss für die Bearbeitung durch das Gericht geeignet und mit einer qualifizierten elektronischen Signatur der verantwortenden Person versehen sein oder von der verantwortenden Person signiert und auf einem sicheren Übermittlungsweg gemäß § 130a ZPO nach näherer Maßgabe der Verordnung über die technischen Rahmenbedingungen des elektronischen Rechtsverkehrs und über das besondere elektronische Behördenpostfach (BGBl. I, S.3803) eingereicht werden. Weitere Informationen erhalten Sie auf der Internetseite www.justiz.de.\nDer Widerspruch muss spätestens innerhalb der gesetzten Frist nach dem Datum der Bekanntmachung der Löschungsankündigung bei dem Amtsgericht - Registergericht - Düsseldorf eingegangen sein.  Dies gilt auch dann, wenn der Widerspruch zur Niederschrift der Geschäftsstelle eines anderen Amtsgerichtes abgegeben wurde. Die Frist beginnt mit dem Tage der Bekanntmachung der Löschungsankündigung in dem für die Bekanntmachung der Eintragungen in das Handelsregister bestimmten elektronischen Informations- und Kommunikationssystem nach § 10 des Handelsgesetzbuches. Fällt das Ende der Frist auf einen Sonntag, einen allgemeinen Feiertag oder Sonnabend, so endet die Frist mit Ablauf des nächsten Werktages.\nDer Widerspruch muss die Bezeichnung der angefochtenen Löschungsankündigung sowie die Erklärung enthalten, dass Widerspruch gegen diese Löschungsankündigung eingelegt wird. Er ist zu unterzeichnen und soll begründet werden."
    },
    {
      "date": "2026-02-06",
      "id": "144570",
      "original_text": "Sonstige Registerbekanntmachung\nNordrhein-Westfalen Amtsgericht Bonn HRB 20077\nComfortcharge GmbH – Bonn",
      "type": "Sonstige Registerbekanntmachung",
      "state": "Nordrhein-Westfalen",
      "amtsgericht": "Amtsgericht Bonn",
      "registernummer": "HRB 20077",
      "registerart": "HRB",
      "company_name": "Comfortcharge GmbH",
      "company_seat": "Bonn",
      "details": "06.02.2026 (Bekanntmachungsdatum)\n\nNordrhein-Westfalen Amtsgericht Bonn HRB 20077\nSonstige Registerbekanntmachung 06.02.2026 (Eintragungsdatum)\n\nComfortcharge GmbH\nGesellschaft mit beschränkter Haftung\nBonn\n\nAls nicht eingetragen wird veröffentlicht: Den Gläubigern der Gesellschaft, deren Forderungen begründet worden sind bevor die Eintragung der Beendigung des Beherrschungs- und Gewinnabführungsvertrages  in das Handelsregister nach § 10 des Handelsgesetzbuches als bekanntgemacht gilt, hat der andere Vertragsteil Sicherheit zu leisten, wenn sie sich binnen sechs Monaten nach der Bekanntmachung der Eintragung zu diesem Zweck bei ihm melden."
    },
    {
      "date": "2026-02-06",
      "id": "144571",
      "original_text": "Löschungsankündigung\nNordrhein-Westfalen Amtsgericht Köln HRB 117834\nprismXevents UG (haftungsbeschränkt) – Köln",
      "type": "Löschungsankündigung",
      "state": "Nordrhein-Westfalen",
      "amtsgericht": "Amtsgericht Köln",
      "registernummer": "HRB 117834",
      "registerart": "HRB",
      "company_name": "prismXevents UG (haftungsbeschränkt)",
      "company_seat": "Köln",
      "details": "06.02.2026 (Bekanntmachungsdatum)\n\nNordrhein-Westfalen Amtsgericht Köln HRB 117834\nLöschungsankündigung\n\nprismXevents UG (haftungsbeschränkt)\nGesellschaft mit beschränkter Haftung\nKöln\n\nDas Registergericht beabsichtigt die Gesellschaft von Amts wegen nach § 394 FamFG zu löschen. Die Frist zur Erhebung eines Widerspruchs ist auf einen Monat festgesetzt."
    },
    {
      "date": "2026-02-06",
      "id": "144572",
      "original_text": "Löschungsankündigung\nNordrhein-Westfalen Amtsgericht Dortmund HRB 35949\nJuggernog UG (haftungsbeschränkt) – Dortmund",
      "type": "Löschungsankündigung",
      "state": "Nordrhein-Westfalen",
      "amtsgericht": "Amtsgericht Dortmund",
      "registernummer": "HRB 35949",
      "registerart": "HRB",
      "company_name": "Juggernog UG (haftungsbeschränkt)",
      "company_seat": "Dortmund",
      "details": "06.02.2026 (Bekanntmachungsdatum)\n\nNordrhein-Westfalen Amtsgericht Dortmund HRB 35949\nLöschungsankündigung 06.02.2026 (Eintragungsdatum)\n\nJuggernog UG (haftungsbeschränkt)\nGesellschaft mit beschränkter Haftung\nDortmund\n\nDas Registergericht beabsichtigt die Gesellschaft von Amts wegen nach § 394 FamFG zu löschen. Die Frist zur Erhebung eines Widerspruchs ist auf zwei Monate festgesetzt."
    },
    {
      "date": "2026-02-06",
      "id": "144573",
      "original_text": "Löschungsankündigung\nNordrhein-Westfalen Amtsgericht Düsseldorf HRB 83945\nSwiss Convene GmbH – Düsseldorf",
      "type": "Löschungsankündigung",
      "state": "Nordrhein-Westfalen",
      "amtsgericht": "Amtsgericht Düsseldorf",
      "registernummer": "HRB 83945",
      "registerart": "HRB",
      "company_name": "Swiss Convene GmbH",
      "company_seat": "Düsseldorf",
      "details": "06.02.2026 (Bekanntmachungsdatum)\n\nNordrhein-Westfalen Amtsgericht Düsseldorf HRB 83945\nLöschungsankündigung\n\nSwiss Convene GmbH\nGesellschaft mit beschränkter Haftung\nDüsseldorf\n\nBetr.: Swiss Convene GmbH, Thurn-und-Taxis-Platz 6, 60313 Frankfurt am Main; Sitz: Düsseldorf\n\nDas Registergericht beabsichtigt die Gesellschaft von Amts wegen nach § 394 FamFG zu löschen. Die Frist zur Erhebung eines Widerspruchs ist auf 3 Wochen festgesetzt.\n\nRechtsbehelfsbelehrung:\n\nDas Widerspruchsrecht steht jedem zu, der an der Unterlassung der Löschung ein berechtigtes Interesse hat. Der Widerspruch ist bei dem Amtsgericht Düsseldorf -Registergericht-, Werdener Straße 1, 40227 Düsseldorf schriftlich in deutscher Sprache oder zur Niederschrift der Geschäftsstelle einzulegen. Der Widerspruch kann auch zur Niederschrift der Geschäftsstelle eines jeden Amtsgerichtes abgegeben werden. Die Einlegung ist auch durch Übertragung eines elektronischen Dokuments an die elektronische Poststelle des Gerichts möglich. Das elektronische Dokument muss für die Bearbeitung durch das Gericht geeignet und mit einer qualifizierten elektronischen Signatur der verantwortenden Person versehen sein oder von der verantwortenden Person signiert und auf einem sicheren Übermittlungsweg gemäß § 130a ZPO nach näherer Maßgabe der Verordnung über die technischen Rahmenbedingungen des elektronischen Rechtsverkehrs und über das besondere elektronische Behördenpostfach (BGBl. I, S.3803) eingereicht werden. Weitere Informationen erhalten Sie auf der Internetseite www.justiz.de.\nDer Widerspruch muss spätestens innerhalb der gesetzten Frist nach dem Datum der Bekanntmachung der Löschungsankündigung bei dem Amtsgericht - Registergericht - Düsseldorf eingegangen sein.  Dies gilt auch dann, wenn der Widerspruch zur Niederschrift der Geschäftsstelle eines anderen Amtsgerichtes abgegeben wurde. Die Frist beginnt mit dem Tage der Bekanntmachung der Löschungsankündigung in dem für die Bekanntmachung der Eintragungen in das Handelsregister bestimmten elektronischen Informations- und Kommunikationssystem nach § 10 des Handelsgesetzbuches. Fällt das Ende der Frist auf einen Sonntag, einen allgemeinen Feiertag oder Sonnabend, so endet die Frist mit Ablauf des nächsten Werktages.\nDer Widerspruch muss die Bezeichnung der angefochtenen Löschungsankündigung sowie die Erklärung enthalten, dass Widerspruch gegen diese Löschungsankündigung eingelegt wird. Er ist zu unterzeichnen und soll begründet werden."
    },
    {
      "date": "2026-02-06",
      "id": "144574",
      "original_text": "Einreichung neuer Dokumente\nHessen Amtsgericht Darmstadt HRB 98367\nMerck Healthcare KGaA – Darmstadt",
      "type": "Einreichung neuer Dokumente",
      "state": "Hessen",
      "amtsgericht": "Amtsgericht Darmstadt",
      "registernummer": "HRB 98367",
      "registerart": "HRB",
      "company_name": "Merck Healthcare KGaA",
      "company_seat": "Darmstadt",
      "details": "06.02.2026 (Bekanntmachungsdatum)\n\nHessen Amtsgericht Darmstadt HRB 98367\nEinreichung neuer Dokumente\n\nMerck Healthcare KGaA\nKommanditgesellschaft auf Aktien\nDarmstadt\n\nWegen Änderungen in den Personen der Aufsichtsratsmitglieder ist eine Liste der Mitglieder des Aufsichtsrates zum Handelsregister eingereicht worden."
    },
    {
      "date": "2026-02-06",
      "id": "144575",
      "original_text": "Löschungsankündigung\nHessen Amtsgericht Hanau HRB 96595\nOtter Markets UG (haftungsbeschränkt) – Schlüchtern",
      "type": "Löschungsankündigung",
      "state": "Hessen",
      "amtsgericht": "Amtsgericht Hanau",
      "registernummer": "HRB 96595",
      "registerart": "HRB",
      "company_name": "Otter Markets UG (haftungsbeschränkt)",
      "company_seat": "Schlüchtern",
      "details": "06.02.2026 (Bekanntmachungsdatum)\n\nHessen Amtsgericht Hanau HRB 96595\nLöschungsankündigung\n\nOtter Markets UG (haftungsbeschränkt)\nGesellschaft mit beschränkter Haftung\nSchlüchtern\n\nDas Registergericht beabsichtigt die im Handelsregister eingetragene Gesellschaft von Amts wegen nach § 394 FamFG zu löschen. Die Frist zur Erhebung eines Widerspruchs gegen die beabsichtigte Löschung wird auf 3 Monate festgesetzt."
    },
    {
      "date": "2026-02-06",
      "id": "144576",
      "original_text": "Einreichung neuer Dokumente\nHessen Amtsgericht Frankfurt am Main HRB 111136\nAdvanced Blockchain AG – Frankfurt am Main",
      "type": "Einreichung neuer Dokumente",
      "state": "Hessen",
      "amtsgericht": "Amtsgericht Frankfurt am Main",
      "registernummer": "HRB 111136",
      "registerart": "HRB",
      "company_name": "Advanced Blockchain AG",
      "company_seat": "Frankfurt am Main",
      "details": "06.02.2026 (Bekanntmachungsdatum)\n\nHessen Amtsgericht Frankfurt am Main HRB 111136\nEinreichung neuer Dokumente 06.02.2026 (Eintragungsdatum)\n\nAdvanced Blockchain AG\nAktiengesellschaft\nFrankfurt am Main\n\nDurch eine Änderung in den Personen der Aufsichtsratsmitglieder ist eine Liste der Mitglieder des Aufsichtsrates zum Handelsregister eingereicht worden."
    },
    {
      "date": "2026-02-06",
      "id": "144577",
      "original_text": "Löschungsankündigung\nHessen Amtsgericht Darmstadt HRB 100183\nGreenEO UG (haftungsbeschränkt) – Darmstadt",
      "type": "Löschungsankündigung",
      "state": "Hessen",
      "amtsgericht": "Amtsgericht Darmstadt",
      "registernummer": "HRB 100183",
      "registerart": "HRB",
      "company_name": "GreenEO UG (haftungsbeschränkt)",
      "company_seat": "Darmstadt",
      "details": "06.02.2026 (Bekanntmachungsdatum)\n\nHessen Amtsgericht Darmstadt HRB 100183\nLöschungsankündigung\n\nGreenEO UG (haftungsbeschränkt)\nGesellschaft mit beschränkter Haftung\nDarmstadt\n\nDas Registergericht beabsichtigt die im Handelsregister eingetragene Gesellschaft von Amts wegen nach § 394 FamFG zu löschen. Die Frist zur Erhebung eines Widerspruchs gegen die beabsichtigte Löschung wird auf 3 Monate festgesetzt."
    },
    {
      "date": "2026-02-06",
      "id": "144578",
      "original_text": "Sonstige Registerbekanntmachung\nHessen Amtsgericht Limburg VR 1527\nWesterwälder Wanderfreunde Niedershausen – Löhnberg-Niedershausen",
      "type": "Sonstige Registerbekanntmachung",
      "state": "Hessen",
      "amtsgericht": "Amtsgericht Limburg",
      "registernummer": "VR 1527",
      "registerart": "VR",
      "company_name": "Westerwälder Wanderfreunde Niedershausen",
      "company_seat": "Löhnberg-Niedershausen",
      "details": "06.02.2026 (Bekanntmachungsdatum)\n\nHessen Amtsgericht Limburg VR 1527\nSonstige Registerbekanntmachung 06.02.2026 (Eintragungsdatum)\n\nWesterwälder Wanderfreunde Niedershausen\neingetragener Verein\nLöhnberg-Niedershausen\n\nDer Verein ist aufgelöst."
    },
    {
      "date": "2026-02-06",
      "id": "144579",
      "original_text": "Löschungsankündigung\nHessen Amtsgericht Hanau HRB 92098\nECOTEM Ecological Technology Management GmbH – Hanau",
      "type": "Löschungsankündigung",
      "state": "Hessen",
      "amtsgericht": "Amtsgericht Hanau",
      "registernummer": "HRB 92098",
      "registerart": "HRB",
      "company_name": "ECOTEM Ecological Technology Management GmbH",
      "company_seat": "Hanau",
      "details": "06.02.2026 (Bekanntmachungsdatum)\n\nHessen Amtsgericht Hanau HRB 92098\nLöschungsankündigung\n\nECOTEM Ecological Technology Management GmbH\nGesellschaft mit beschränkter Haftung\nHanau\n\nDas Registergericht beabsichtigt die im Handelsregister eingetragene Gesellschaft von Amts wegen nach § 394 FamFG zu löschen. Die Frist zur Erhebung eines Widerspruchs gegen die beabsichtigte Löschung wird auf 3 Monate festgesetzt."
    },
    {
      "date": "2026-02-06",
      "id": "144580",
      "original_text": "Löschungsankündigung\nHessen Amtsgericht Frankfurt am Main HRB 115184\nWBI GmbH WESTEND Beauty Invest und Beteiligungsgesellschaft – Frankfurt am Main",
      "type": "Löschungsankündigung",
      "state": "Hessen",
      "amtsgericht": "Amtsgericht Frankfurt am Main",
      "registernummer": "HRB 115184",
      "registerart": "HRB",
      "company_name": "WBI GmbH WESTEND Beauty Invest und Beteiligungsgesellschaft",
      "company_seat": "Frankfurt am Main",
      "details": "06.02.2026 (Bekanntmachungsdatum)\n\nHessen Amtsgericht Frankfurt am Main HRB 115184\nLöschungsankündigung\n\nWBI GmbH WESTEND Beauty Invest und Beteiligungsgesellschaft\nGesellschaft mit beschränkter Haftung\nFrankfurt am Main\n\nEs ist beabsichtigt, die Gesellschaft wegen Vermögenslosigkeit gemäß § 394 FamFG von Amts wegen im Handelsregister zu löschen. Hiergegen kann innerhalb eines Monats nach dieser Veröffentlichung Widerspruch bei dem Amtsgericht Frankfurt am Main eingelegt werden."
    },
    {
      "date": "2026-02-06",
      "id": "144581",
      "original_text": "Registerbekanntmachung nach dem Umwandlungsgesetz\nHessen Amtsgericht Eschwege HRB 1806\nPTG Porous Technical Group GmbH – Sontra",
      "type": "Registerbekanntmachung nach dem Umwandlungsgesetz",
      "state": "Hessen",
      "amtsgericht": "Amtsgericht Eschwege",
      "registernummer": "HRB 1806",
      "registerart": "HRB",
      "company_name": "PTG Porous Technical Group GmbH",
      "company_seat": "Sontra",
      "details": "06.02.2026 (Bekanntmachungsdatum)\n\nHessen Amtsgericht Eschwege HRB 1806\nRegisterbekanntmachung nach dem Umwandlungsgesetz 06.02.2026 (Eintragungsdatum)\n\nPTG Porous Technical Group GmbH\nGesellschaft mit beschränkter Haftung\nSontra\n\nDen Gläubigern der an der Verschmelzung beteiligten Rechtsträger ist, wenn sie binnen sechs Monaten nach dem Tag, an dem die Eintragung der Verschmelzung in das Register des Sitzes desjenigen Rechtsträgers, dessen Gläubiger sie sind, nach § 19 Absatz 3 UmwG bekannt gemacht worden ist, ihren Anspruch nach Grund und Höhe schriftlich anmelden, Sicherheit zu leisten, soweit sie nicht Befriedigung verlangen können. Dieses Recht steht den Gläubigern jedoch nur zu, wenn sie glaubhaft machen, dass durch die Verschmelzung die Erfüllung ihrer Forderung gefährdet wird."
    },
    {
      "date": "2026-02-06",
      "id": "144582",
      "original_text": "Löschungsankündigung\nHessen Amtsgericht Bad Hersfeld HRB 2230\nDens Alba GmbH – Hauneck",
      "type": "Löschungsankündigung",
      "state": "Hessen",
      "amtsgericht": "Amtsgericht Bad Hersfeld",
      "registernummer": "HRB 2230",
      "registerart": "HRB",
      "company_name": "Dens Alba GmbH",
      "company_seat": "Hauneck",
      "details": "06.02.2026 (Bekanntmachungsdatum)\n\nHessen Amtsgericht Bad Hersfeld HRB 2230\nLöschungsankündigung\n\nDens Alba GmbH\nGesellschaft mit beschränkter Haftung\nHauneck\n\nDas Registergericht beabsichtigt die im Handelsregister eingetragene Gesellschaft von Amts wegen nach § 394 FamFG zu löschen. Die Frist zur Erhebung eines Widerspruchs gegen die beabsichtigte Löschung wird auf 6 Wochen festgesetzt."
    },
    {
      "date": "2026-02-06",
      "id": "144583",
      "original_text": "Registerbekanntmachung nach dem Umwandlungsgesetz\nHessen Amtsgericht Eschwege HRB 3371\nBS Automatisierungstechnik GmbH – Sontra",
      "type": "Registerbekanntmachung nach dem Umwandlungsgesetz",
      "state": "Hessen",
      "amtsgericht": "Amtsgericht Eschwege",
      "registernummer": "HRB 3371",
      "registerart": "HRB",
      "company_name": "BS Automatisierungstechnik GmbH",
      "company_seat": "Sontra",
      "details": "06.02.2026 (Bekanntmachungsdatum)\n\nHessen Amtsgericht Eschwege HRB 3371\nRegisterbekanntmachung nach dem Umwandlungsgesetz 06.02.2026 (Eintragungsdatum)\n\nBS Automatisierungstechnik GmbH\nGesellschaft mit beschränkter Haftung\nSontra\n\nDen Gläubigern der an der Verschmelzung beteiligten Rechtsträger ist, wenn sie binnen sechs Monaten nach dem Tag, an dem die Eintragung der Verschmelzung in das Register des Sitzes desjenigen Rechtsträgers, dessen Gläubiger sie sind, nach § 19 Absatz 3 UmwG bekannt gemacht worden ist, ihren Anspruch nach Grund und Höhe schriftlich anmelden, Sicherheit zu leisten, soweit sie nicht Befriedigung verlangen können. Dieses Recht steht den Gläubigern jedoch nur zu, wenn sie glaubhaft machen, dass durch die Verschmelzung die Erfüllung ihrer Forderung gefährdet wird."
    },
    {
      "date": "2026-02-06",
      "id": "144584",
      "original_text": "Einreichung neuer Dokumente\nHessen Amtsgericht Frankfurt am Main HRB 139749\nSapurna SE – Frankfurt am Main",
      "type": "Einreichung neuer Dokumente",
      "state": "Hessen",
      "amtsgericht": "Amtsgericht Frankfurt am Main",
      "registernummer": "HRB 139749",
      "registerart": "HRB",
      "company_name": "Sapurna SE",
      "company_seat": "Frankfurt am Main",
      "details": "06.02.2026 (Bekanntmachungsdatum)\n\nHessen Amtsgericht Frankfurt am Main HRB 139749\nEinreichung neuer Dokumente\n\nSapurna SE\nEuropäische Aktiengesellschaft (SE)\nFrankfurt am Main\n\nDie Gesellschaft hat beim Amtsgericht Frankfurt am Main - Registergericht - einen Verlegungsplan vom 02.02.2026 betreffend die Sitzverlegung der Gesellschaft nach Meneou (Bezirk Larnaca), Republik\nZypern, eingereicht."
    },
    {
      "date": "2026-02-06",
      "id": "144585",
      "original_text": "Einreichung neuer Dokumente\nHessen Amtsgericht Gießen HRB 6384\nUniversitätsklinikum Gießen und Marburg GmbH – Gießen",
      "type": "Einreichung neuer Dokumente",
      "state": "Hessen",
      "amtsgericht": "Amtsgericht Gießen",
      "registernummer": "HRB 6384",
      "registerart": "HRB",
      "company_name": "Universitätsklinikum Gießen und Marburg GmbH",
      "company_seat": "Gießen",
      "details": "06.02.2026 (Bekanntmachungsdatum)\n\nHessen Amtsgericht Gießen HRB 6384\nEinreichung neuer Dokumente 06.02.2026 (Eintragungsdatum)\n\nUniversitätsklinikum Gießen und Marburg GmbH\nGesellschaft mit beschränkter Haftung\nGießen\n\nAufgrund einer Änderung in den Personen der Aufsichtsratsmitglieder ist eine Liste der Mitglieder des Aufsichtsrates zum Handelsregister eingereicht worden."
    },
    {
      "date": "2026-02-06",
      "id": "144586",
      "original_text": "Sonstige Registerbekanntmachung\nHessen Amtsgericht Frankfurt am Main HRB 84672\nconvitis GmbH – Eschborn",
      "type": "Sonstige Registerbekanntmachung",
      "state": "Hessen",
      "amtsgericht": "Amtsgericht Frankfurt am Main",
      "registernummer": "HRB 84672",
      "registerart": "HRB",
      "company_name": "convitis GmbH",
      "company_seat": "Eschborn",
      "details": "06.02.2026 (Bekanntmachungsdatum)\n\nHessen Amtsgericht Frankfurt am Main HRB 84672\nSonstige Registerbekanntmachung 06.02.2026 (Eintragungsdatum)\n\nconvitis GmbH\nGesellschaft mit beschränkter Haftung\nEschborn\n\nDie Gesellschaft hat Gläubigern, deren Forderungen vor dieser Bekanntmachung begründet worden sind, Sicherheit zu leisten, soweit sie nicht Befriedigung verlangen können, wenn sie sich binnen sechs Monaten nach dieser Bekanntmachung zu diesem Zweck melden."
    },
    {
      "date": "2026-02-06",
      "id": "144587",
      "original_text": "Löschungsankündigung\nNiedersachsen Amtsgericht Lüneburg HRB 210116\nSuccessleiter UG (haftungsbeschränkt) – Lüneburg",
      "type": "Löschungsankündigung",
      "state": "Niedersachsen",
      "amtsgericht": "Amtsgericht Lüneburg",
      "registernummer": "HRB 210116",
      "registerart": "HRB",
      "company_name": "Successleiter UG (haftungsbeschränkt)",
      "company_seat": "Lüneburg",
      "details": "06.02.2026 (Bekanntmachungsdatum)\n\nNiedersachsen Amtsgericht Lüneburg HRB 210116\nLöschungsankündigung 06.02.2026 (Eintragungsdatum)\n\nSuccessleiter UG (haftungsbeschränkt)\nGesellschaft mit beschränkter Haftung\nLüneburg\n\nDas Registergericht beabsichtigt, die Gesellschaft von Amts wegen nach § 394 FamFG zu löschen. Die Frist zur Erhebung eines Widerspruchs ist auf 1 Monat ab dieser Registerbekanntmachung festgesetzt."
    }
  ]
}