{
  "date": "2026-02-04",
  "date_of_scrape": "2026-02-05T04:39:22.172Z",
  "tool_version": "0.2.0",
  "number_of_announcements": 112,
  "announcements": [
    {
      "date": "2026-02-04",
      "id": "144245",
      "original_text": "Registerbekanntmachung nach dem Umwandlungsgesetz\nBayern Amtsgericht München HRB 205565\nSCUR24 Holding GmbH – München",
      "type": "Registerbekanntmachung nach dem Umwandlungsgesetz",
      "state": "Bayern",
      "amtsgericht": "Amtsgericht München",
      "registernummer": "HRB 205565",
      "registerart": "HRB",
      "company_name": "SCUR24 Holding GmbH",
      "company_seat": "München",
      "details": "04.02.2026 (Bekanntmachungsdatum)\n\nBayern Amtsgericht München HRB 205565\nRegisterbekanntmachung nach dem Umwandlungsgesetz 03.02.2026 (Eintragungsdatum)\n\nSCUR24 Holding GmbH\nGesellschaft mit beschränkter Haftung\nMünchen\n\nDen Gläubigern der an der Verschmelzung beteiligten Rechtsträger ist, wenn sie binnen sechs Monaten nach dem Tag, an dem die Eintragung der Verschmelzung in das Register des Sitzes desjenigen Rechtsträgers, dessen Gläubiger sie sind, nach § 19 Abs. 3 UmwG als bekannt gemacht gilt, ihren Anspruch nach Grund und Höhe in Textform anmelden, Sicherheit zu leisten, soweit sie nicht Befriedigung verlangen können. Dieses Recht steht den Gläubigern jedoch nur zu, wenn sie glaubhaft machen, dass durch die Verschmelzung die Erfüllung ihrer Forderung gefährdet wird."
    },
    {
      "date": "2026-02-04",
      "id": "144246",
      "original_text": "Löschungsankündigung\nBayern Amtsgericht Nürnberg HRB 36818\nDay facility GmbH – Nürnberg",
      "type": "Löschungsankündigung",
      "state": "Bayern",
      "amtsgericht": "Amtsgericht Nürnberg",
      "registernummer": "HRB 36818",
      "registerart": "HRB",
      "company_name": "Day facility GmbH",
      "company_seat": "Nürnberg",
      "details": "04.02.2026 (Bekanntmachungsdatum)\n\nBayern Amtsgericht Nürnberg HRB 36818\nLöschungsankündigung\n\nDay facility GmbH\nGesellschaft mit beschränkter Haftung\nNürnberg\n\nDas Registergericht beabsichtigt, die im Handelsregister eingetragene Gesellschaft wegen Vermögenslosigkeit von Amts wegen nach § 394 FamFG zu löschen. Die Frist zur Erhebung eines Widerspruchs ist auf einen Monat festgesetzt."
    },
    {
      "date": "2026-02-04",
      "id": "144247",
      "original_text": "Registerbekanntmachung nach dem Umwandlungsgesetz\nBayern Amtsgericht München HRB 226364\nSeniorenwohnanlage Oettingen GmbH – München",
      "type": "Registerbekanntmachung nach dem Umwandlungsgesetz",
      "state": "Bayern",
      "amtsgericht": "Amtsgericht München",
      "registernummer": "HRB 226364",
      "registerart": "HRB",
      "company_name": "Seniorenwohnanlage Oettingen GmbH",
      "company_seat": "München",
      "details": "04.02.2026 (Bekanntmachungsdatum)\n\nBayern Amtsgericht München HRB 226364\nRegisterbekanntmachung nach dem Umwandlungsgesetz 03.02.2026 (Eintragungsdatum)\n\nSeniorenwohnanlage Oettingen GmbH\nGesellschaft mit beschränkter Haftung\nMünchen\n\nDen Gläubigern der an der Verschmelzung beteiligten Rechtsträger ist, wenn sie binnen sechs Monaten nach dem Tag, an dem die Eintragung der Verschmelzung in das Register des Sitzes desjenigen Rechtsträgers, dessen Gläubiger sie sind, nach § 19 Abs. 3 UmwG als bekannt gemacht gilt, ihren Anspruch nach Grund und Höhe in Textform anmelden, Sicherheit zu leisten, soweit sie nicht Befriedigung verlangen können. Dieses Recht steht den Gläubigern jedoch nur zu, wenn sie glaubhaft machen, dass durch die Verschmelzung die Erfüllung ihrer Forderung gefährdet wird."
    },
    {
      "date": "2026-02-04",
      "id": "144248",
      "original_text": "Löschungsankündigung\nBayern Amtsgericht München HRB 227454\nluce 39 GmbH – München",
      "type": "Löschungsankündigung",
      "state": "Bayern",
      "amtsgericht": "Amtsgericht München",
      "registernummer": "HRB 227454",
      "registerart": "HRB",
      "company_name": "luce 39 GmbH",
      "company_seat": "München",
      "details": "04.02.2026 (Bekanntmachungsdatum)\n\nBayern Amtsgericht München HRB 227454\nLöschungsankündigung\n\nluce 39 GmbH\nGesellschaft mit beschränkter Haftung\nMünchen\n\nDas Registergericht beabsichtigt, die im Handelsregister eingetragene Gesellschaft wegen Vermögenslosigkeit von Amts wegen nach § 394 FamFG zu löschen. #insert(Text=\"zztb_V_Widerspruchsfrist\")"
    },
    {
      "date": "2026-02-04",
      "id": "144249",
      "original_text": "Löschungsankündigung\nBayern Amtsgericht Regensburg HRB 18286\nGreen Go GmbH – Neutraubling",
      "type": "Löschungsankündigung",
      "state": "Bayern",
      "amtsgericht": "Amtsgericht Regensburg",
      "registernummer": "HRB 18286",
      "registerart": "HRB",
      "company_name": "Green Go GmbH",
      "company_seat": "Neutraubling",
      "details": "04.02.2026 (Bekanntmachungsdatum)\n\nBayern Amtsgericht Regensburg HRB 18286\nLöschungsankündigung 03.02.2026 (Eintragungsdatum)\n\nGreen Go GmbH\nGesellschaft mit beschränkter Haftung\nNeutraubling\n\nDas Registergericht beabsichtigt, die im Handelsregister eingetragene Gesellschaft wegen Vermögenslosigkeit von Amts wegen nach § 394 FamFG zu löschen. Die Frist zur Erhebung eines Widerspruchs ist auf einen Monat festgesetzt."
    },
    {
      "date": "2026-02-04",
      "id": "144250",
      "original_text": "Einreichung neuer Dokumente\nBayern Amtsgericht München HRB 246068\nTRATON SE – München",
      "type": "Einreichung neuer Dokumente",
      "state": "Bayern",
      "amtsgericht": "Amtsgericht München",
      "registernummer": "HRB 246068",
      "registerart": "HRB",
      "company_name": "TRATON SE",
      "company_seat": "München",
      "details": "04.02.2026 (Bekanntmachungsdatum)\n\nBayern Amtsgericht München HRB 246068\nEinreichung neuer Dokumente\n\nTRATON SE\nEuropäische Aktiengesellschaft (SE)\nMünchen\n\nDem Amtsgericht München -Registergericht- ist eine Liste der Mitglieder des Aufsichtsrats eingereicht worden, Art. 9 Abs. 1 Buchst. c (ii) SE-VO i.V.m. § 106 AktG."
    },
    {
      "date": "2026-02-04",
      "id": "144251",
      "original_text": "Löschungsankündigung\nBayern Amtsgericht München HRB 250574\nMRF UG (haftungsbeschränkt) – München",
      "type": "Löschungsankündigung",
      "state": "Bayern",
      "amtsgericht": "Amtsgericht München",
      "registernummer": "HRB 250574",
      "registerart": "HRB",
      "company_name": "MRF UG (haftungsbeschränkt)",
      "company_seat": "München",
      "details": "04.02.2026 (Bekanntmachungsdatum)\n\nBayern Amtsgericht München HRB 250574\nLöschungsankündigung\n\nMRF UG (haftungsbeschränkt)\nGesellschaft mit beschränkter Haftung\nMünchen\n\nDas Registergericht beabsichtigt, die im Handelsregister eingetragene Gesellschaft wegen Vermögenslosigkeit von Amts wegen nach § 394 FamFG zu löschen. Die Frist zur Erhebung eines Widerspruchs ist auf drei Monate festgesetzt."
    },
    {
      "date": "2026-02-04",
      "id": "144252",
      "original_text": "Registerbekanntmachung nach dem Umwandlungsgesetz\nBayern Amtsgericht München HRB 41074\nTretter Verwaltungsgesellschaft mit beschränkter Haftung – München",
      "type": "Registerbekanntmachung nach dem Umwandlungsgesetz",
      "state": "Bayern",
      "amtsgericht": "Amtsgericht München",
      "registernummer": "HRB 41074",
      "registerart": "HRB",
      "company_name": "Tretter Verwaltungsgesellschaft mit beschränkter Haftung",
      "company_seat": "München",
      "details": "04.02.2026 (Bekanntmachungsdatum)\n\nBayern Amtsgericht München HRB 41074\nRegisterbekanntmachung nach dem Umwandlungsgesetz 03.02.2026 (Eintragungsdatum)\n\nTretter Verwaltungsgesellschaft mit beschränkter Haftung\nGesellschaft mit beschränkter Haftung\nMünchen\n\nDen Gläubigern des formwechselnden Rechtsträgers ist, wenn sie binnen sechs Monaten nach dem Tag, an dem die Eintragung des Formwechsels nach § 201 UmwG als bekannt gemacht gilt, ihren Anspruch nach Grund und Höhe in Textform anmelden, Sicherheit zu leisten, soweit sie nicht Befriedigung verlangen können. Dieses Recht steht den Gläubigern jedoch nur zu, wenn sie glaubhaft machen, dass durch den Formwechsel die Erfüllung ihrer Forderung gefährdet wird."
    },
    {
      "date": "2026-02-04",
      "id": "144253",
      "original_text": "Sonstige Registerbekanntmachung\nBayern Amtsgericht Kempten (Allgäu) HRB 3348\nBRULA GmbH – Durach",
      "type": "Sonstige Registerbekanntmachung",
      "state": "Bayern",
      "amtsgericht": "Amtsgericht Kempten (Allgäu)",
      "registernummer": "HRB 3348",
      "registerart": "HRB",
      "company_name": "BRULA GmbH",
      "company_seat": "Durach",
      "details": "04.02.2026 (Bekanntmachungsdatum)\n\nBayern Amtsgericht Kempten (Allgäu) HRB 3348\nSonstige Registerbekanntmachung 03.02.2026 (Eintragungsdatum)\n\nBRULA GmbH\nGesellschaft mit beschränkter Haftung\nDurach\n\nDen Gläubigern Den Gläubigern der Gesellschaft, deren Forderungen begründet worden sind, bevor die Eintragung der Beendigung des Beherrschungs- und Gewinnabführungsvertrages in das Handelsregister nach § 10 des Handelsgesetzbuches als bekanntgemacht gilt, hat der andere Vertragsteil Sicherheit zu leisten, wenn sie sich binnen sechs Monaten nach der Bekanntmachung der Eintragung zu diesem Zweck bei ihm melden."
    },
    {
      "date": "2026-02-04",
      "id": "144254",
      "original_text": "Registerbekanntmachung nach dem Umwandlungsgesetz\nBayern Amtsgericht München GsR 2979\nGrundbesitzgesellschaft Roggermaier eGbR – Aschheim",
      "type": "Registerbekanntmachung nach dem Umwandlungsgesetz",
      "state": "Bayern",
      "amtsgericht": "Amtsgericht München",
      "registernummer": "GsR 2979",
      "registerart": "GsR",
      "company_name": "Grundbesitzgesellschaft Roggermaier eGbR",
      "company_seat": "Aschheim",
      "details": "04.02.2026 (Bekanntmachungsdatum)\n\nBayern Amtsgericht München GsR 2979\nRegisterbekanntmachung nach dem Umwandlungsgesetz 03.02.2026 (Eintragungsdatum)\n\nGrundbesitzgesellschaft Roggermaier eGbR\nGesellschaft bürgerlichen Rechts\nAschheim\n\nDen Gläubigern des formwechselnden Rechtsträgers ist, wenn sie binnen sechs Monaten nach dem Tag, an dem die Eintragung des Formwechsels nach § 201 UmwG als bekannt gemacht gilt, ihren Anspruch nach Grund und Höhe in Textform anmelden, Sicherheit zu leisten, soweit sie nicht Befriedigung verlangen können. Dieses Recht steht den Gläubigern jedoch nur zu, wenn sie glaubhaft machen, dass durch den Formwechsel die Erfüllung ihrer Forderung gefährdet wird."
    },
    {
      "date": "2026-02-04",
      "id": "144255",
      "original_text": "Löschungsankündigung\nBayern Amtsgericht Straubing HRA 6200\nCampa Süd GmbH & Co. KG – Straubing",
      "type": "Löschungsankündigung",
      "state": "Bayern",
      "amtsgericht": "Amtsgericht Straubing",
      "registernummer": "HRA 6200",
      "registerart": "HRA",
      "company_name": "Campa Süd GmbH & Co. KG",
      "company_seat": "Straubing",
      "details": "04.02.2026 (Bekanntmachungsdatum)\n\nBayern Amtsgericht Straubing HRA 6200\nLöschungsankündigung\n\nCampa Süd GmbH & Co. KG\nKommanditgesellschaft\nStraubing\n\nDas Registergericht beabsichtigt, die im Handelsregister eingetragene Gesellschaft wegen Vermögenslosigkeit von Amts wegen nach § 394 FamFG zu löschen. Die Frist zur Erhebung eines Widerspruchs ist auf drei Monate festgesetzt."
    },
    {
      "date": "2026-02-04",
      "id": "144256",
      "original_text": "Registerbekanntmachung nach dem Umwandlungsgesetz\nBayern Amtsgericht München HRA 103390\nHaustein Immobilien GmbH & Co. KG – München",
      "type": "Registerbekanntmachung nach dem Umwandlungsgesetz",
      "state": "Bayern",
      "amtsgericht": "Amtsgericht München",
      "registernummer": "HRA 103390",
      "registerart": "HRA",
      "company_name": "Haustein Immobilien GmbH & Co. KG",
      "company_seat": "München",
      "details": "04.02.2026 (Bekanntmachungsdatum)\n\nBayern Amtsgericht München HRA 103390\nRegisterbekanntmachung nach dem Umwandlungsgesetz 03.02.2026 (Eintragungsdatum)\n\nHaustein Immobilien GmbH & Co. KG\nKommanditgesellschaft\nMünchen\n\nDen Gläubigern des formwechselnden Rechtsträgers ist, wenn sie binnen sechs Monaten nach dem Tag, an dem die Eintragung des Formwechsels nach § 201 UmwG als bekannt gemacht gilt, ihren Anspruch nach Grund und Höhe in Textform anmelden, Sicherheit zu leisten, soweit sie nicht Befriedigung verlangen können. Dieses Recht steht den Gläubigern jedoch nur zu, wenn sie glaubhaft machen, dass durch den Formwechsel die Erfüllung ihrer Forderung gefährdet wird."
    },
    {
      "date": "2026-02-04",
      "id": "144257",
      "original_text": "Einreichung neuer Dokumente\nBayern Amtsgericht München HRB 105066\nMEAG MUNICH ERGO AssetManagement GmbH – München",
      "type": "Einreichung neuer Dokumente",
      "state": "Bayern",
      "amtsgericht": "Amtsgericht München",
      "registernummer": "HRB 105066",
      "registerart": "HRB",
      "company_name": "MEAG MUNICH ERGO AssetManagement GmbH",
      "company_seat": "München",
      "details": "04.02.2026 (Bekanntmachungsdatum)\n\nBayern Amtsgericht München HRB 105066\nEinreichung neuer Dokumente\n\nMEAG MUNICH ERGO AssetManagement GmbH\nGesellschaft mit beschränkter Haftung\nMünchen\n\nDem Amtsgericht München -Registergericht- ist eine Liste der Mitglieder des Aufsichtsrats eingereicht worden, § 52 Abs. 3 S. 2 GmbHG."
    },
    {
      "date": "2026-02-04",
      "id": "144258",
      "original_text": "Löschungsankündigung\nBayern Amtsgericht Nürnberg HRB 29489\nIFA Medical Care GmbH – Nürnberg",
      "type": "Löschungsankündigung",
      "state": "Bayern",
      "amtsgericht": "Amtsgericht Nürnberg",
      "registernummer": "HRB 29489",
      "registerart": "HRB",
      "company_name": "IFA Medical Care GmbH",
      "company_seat": "Nürnberg",
      "details": "04.02.2026 (Bekanntmachungsdatum)\n\nBayern Amtsgericht Nürnberg HRB 29489\nLöschungsankündigung\n\nIFA Medical Care GmbH\nGesellschaft mit beschränkter Haftung\nNürnberg\n\nDas Registergericht beabsichtigt, die im Handelsregister eingetragene Gesellschaft wegen Vermögenslosigkeit von Amts wegen nach § 394 FamFG zu löschen. Die Frist zur Erhebung eines Widerspruchs ist auf einen Monat festgesetzt."
    },
    {
      "date": "2026-02-04",
      "id": "144259",
      "original_text": "Löschungsankündigung\nBayern Amtsgericht Augsburg HRB 36613\nNelio Solutions UG (haftungsbeschränkt) – Syrgenstein",
      "type": "Löschungsankündigung",
      "state": "Bayern",
      "amtsgericht": "Amtsgericht Augsburg",
      "registernummer": "HRB 36613",
      "registerart": "HRB",
      "company_name": "Nelio Solutions UG (haftungsbeschränkt)",
      "company_seat": "Syrgenstein",
      "details": "04.02.2026 (Bekanntmachungsdatum)\n\nBayern Amtsgericht Augsburg HRB 36613\nLöschungsankündigung\n\nNelio Solutions UG (haftungsbeschränkt)\nGesellschaft mit beschränkter Haftung\nSyrgenstein\n\nDas Registergericht beabsichtigt, die im Handelsregister eingetragene Gesellschaft wegen Vermögenslosigkeit von Amts wegen nach § 394 FamFG zu löschen. Die Frist zur Erhebung eines Widerspruchs ist auf einen Monat festgesetzt."
    },
    {
      "date": "2026-02-04",
      "id": "144260",
      "original_text": "Löschungsankündigung\nBayern Amtsgericht Nürnberg HRB 37473\nFliesen Motiv UG (haftungsbeschränkt) – Schwaig b. Nürnberg",
      "type": "Löschungsankündigung",
      "state": "Bayern",
      "amtsgericht": "Amtsgericht Nürnberg",
      "registernummer": "HRB 37473",
      "registerart": "HRB",
      "company_name": "Fliesen Motiv UG (haftungsbeschränkt)",
      "company_seat": "Schwaig b. Nürnberg",
      "details": "04.02.2026 (Bekanntmachungsdatum)\n\nBayern Amtsgericht Nürnberg HRB 37473\nLöschungsankündigung\n\nFliesen Motiv UG (haftungsbeschränkt)\nGesellschaft mit beschränkter Haftung\nSchwaig b. Nürnberg\n\nDas Registergericht beabsichtigt, die im Handelsregister eingetragene Gesellschaft wegen Vermögenslosigkeit von Amts wegen nach § 394 FamFG zu löschen. Die Frist zur Erhebung eines Widerspruchs ist auf einen Monat festgesetzt."
    },
    {
      "date": "2026-02-04",
      "id": "144261",
      "original_text": "Löschungsankündigung\nBayern Amtsgericht Nürnberg HRB 29023\nGrillküche Trierer Straße UG (haftungsbeschränkt) – Nürnberg",
      "type": "Löschungsankündigung",
      "state": "Bayern",
      "amtsgericht": "Amtsgericht Nürnberg",
      "registernummer": "HRB 29023",
      "registerart": "HRB",
      "company_name": "Grillküche Trierer Straße UG (haftungsbeschränkt)",
      "company_seat": "Nürnberg",
      "details": "04.02.2026 (Bekanntmachungsdatum)\n\nBayern Amtsgericht Nürnberg HRB 29023\nLöschungsankündigung\n\nGrillküche Trierer Straße UG (haftungsbeschränkt)\nGesellschaft mit beschränkter Haftung\nNürnberg\n\nDas Registergericht beabsichtigt, die im Handelsregister eingetragene Gesellschaft wegen Vermögenslosigkeit von Amts wegen nach § 394 FamFG zu löschen. Die Frist zur Erhebung eines Widerspruchs ist auf einen Monat festgesetzt."
    },
    {
      "date": "2026-02-04",
      "id": "144262",
      "original_text": "Sonstige Registerbekanntmachung\nBayern Amtsgericht München HRB 210116\nJK Wohnbau Objekt Karlsfeld 3 GmbH – Grünwald",
      "type": "Sonstige Registerbekanntmachung",
      "state": "Bayern",
      "amtsgericht": "Amtsgericht München",
      "registernummer": "HRB 210116",
      "registerart": "HRB",
      "company_name": "JK Wohnbau Objekt Karlsfeld 3 GmbH",
      "company_seat": "Grünwald",
      "details": "04.02.2026 (Bekanntmachungsdatum)\n\nBayern Amtsgericht München HRB 210116\nSonstige Registerbekanntmachung 03.02.2026 (Eintragungsdatum)\n\nJK Wohnbau Objekt Karlsfeld 3 GmbH\nGesellschaft mit beschränkter Haftung\nGrünwald\n\nDen Gläubigern der Gesellschaft, deren Forderungen begründet worden sind, bevor die Eintragung der Beendigung des Gewinnabführungsvertrages in das Handelsregister nach § 10 des Handelsgesetzbuches als bekanntgemacht gilt, hat der andere Vertragsteil Sicherheit zu leisten, wenn sie sich binnen sechs Monaten nach der Bekanntmachung der Eintragung zu diesem Zweck bei ihm melden."
    },
    {
      "date": "2026-02-04",
      "id": "144263",
      "original_text": "Registerbekanntmachung nach dem Umwandlungsgesetz\nBayern Amtsgericht Augsburg HRA 21120\nStöckle Immobilien KG – Friedberg",
      "type": "Registerbekanntmachung nach dem Umwandlungsgesetz",
      "state": "Bayern",
      "amtsgericht": "Amtsgericht Augsburg",
      "registernummer": "HRA 21120",
      "registerart": "HRA",
      "company_name": "Stöckle Immobilien KG",
      "company_seat": "Friedberg",
      "details": "04.02.2026 (Bekanntmachungsdatum)\n\nBayern Amtsgericht Augsburg HRA 21120\nRegisterbekanntmachung nach dem Umwandlungsgesetz 03.02.2026 (Eintragungsdatum)\n\nStöckle Immobilien KG\nKommanditgesellschaft\nFriedberg\n\nDen Gläubigern der an der Verschmelzung beteiligten Rechtsträger ist, wenn sie binnen sechs Monaten nach dem Tag, an dem die Eintragung der Verschmelzung in das Register des Sitzes desjenigen Rechtsträgers, dessen Gläubiger sie sind, nach § 19 Abs. 3 UmwG als bekannt gemacht gilt, ihren Anspruch nach Grund und Höhe in Textform anmelden, Sicherheit zu leisten, soweit sie nicht Befriedigung verlangen können. Dieses Recht steht den Gläubigern jedoch nur zu, wenn sie glaubhaft machen, dass durch die Verschmelzung die Erfüllung ihrer Forderung gefährdet wird."
    },
    {
      "date": "2026-02-04",
      "id": "144264",
      "original_text": "Löschungsankündigung\nBayern Amtsgericht Nürnberg HRB 23416\nDolzer Nürnberg GmbH – Nürnberg",
      "type": "Löschungsankündigung",
      "state": "Bayern",
      "amtsgericht": "Amtsgericht Nürnberg",
      "registernummer": "HRB 23416",
      "registerart": "HRB",
      "company_name": "Dolzer Nürnberg GmbH",
      "company_seat": "Nürnberg",
      "details": "04.02.2026 (Bekanntmachungsdatum)\n\nBayern Amtsgericht Nürnberg HRB 23416\nLöschungsankündigung\n\nDolzer Nürnberg GmbH\nGesellschaft mit beschränkter Haftung\nNürnberg\n\nDas Registergericht beabsichtigt, die im Handelsregister eingetragene Gesellschaft wegen Vermögenslosigkeit von Amts wegen nach § 394 FamFG zu löschen. Die Frist zur Erhebung eines Widerspruchs ist auf einen Monat festgesetzt."
    },
    {
      "date": "2026-02-04",
      "id": "144265",
      "original_text": "Registerbekanntmachung nach dem Umwandlungsgesetz\nBayern Amtsgericht München HRB 245527\nAURELIUS Development Twelve GmbH – Grünwald",
      "type": "Registerbekanntmachung nach dem Umwandlungsgesetz",
      "state": "Bayern",
      "amtsgericht": "Amtsgericht München",
      "registernummer": "HRB 245527",
      "registerart": "HRB",
      "company_name": "AURELIUS Development Twelve GmbH",
      "company_seat": "Grünwald",
      "details": "04.02.2026 (Bekanntmachungsdatum)\n\nBayern Amtsgericht München HRB 245527\nRegisterbekanntmachung nach dem Umwandlungsgesetz 03.02.2026 (Eintragungsdatum)\n\nAURELIUS Development Twelve GmbH\nGesellschaft mit beschränkter Haftung\nGrünwald\n\nDen Gläubigern des formwechselnden Rechtsträgers ist, wenn sie binnen sechs Monaten nach dem Tag, an dem die Eintragung des Formwechsels nach § 201 UmwG als bekannt gemacht gilt, ihren Anspruch nach Grund und Höhe in Textform anmelden, Sicherheit zu leisten, soweit sie nicht Befriedigung verlangen können. Dieses Recht steht den Gläubigern jedoch nur zu, wenn sie glaubhaft machen, dass durch den Formwechsel die Erfüllung ihrer Forderung gefährdet wird."
    },
    {
      "date": "2026-02-04",
      "id": "144266",
      "original_text": "Registerbekanntmachung nach dem Umwandlungsgesetz\nBayern Amtsgericht München HRA 121740\nToms IT Service e.K. – Germering",
      "type": "Registerbekanntmachung nach dem Umwandlungsgesetz",
      "state": "Bayern",
      "amtsgericht": "Amtsgericht München",
      "registernummer": "HRA 121740",
      "registerart": "HRA",
      "company_name": "Toms IT Service e.K.",
      "company_seat": "Germering",
      "details": "04.02.2026 (Bekanntmachungsdatum)\n\nBayern Amtsgericht München HRA 121740\nRegisterbekanntmachung nach dem Umwandlungsgesetz 03.02.2026 (Eintragungsdatum)\n\nToms IT Service e.K.\nEinzelkaufmann / Einzelkauffrau\nGermering\n\nDen Gläubigern der an der Ausgliederung beteiligten Rechtsträger ist, wenn sie binnen sechs Monaten nach dem Tag, an dem die Eintragung der Ausgliederung in das Register des Sitzes desjenigen Rechtsträgers, dessen Gläubiger sie sind, nach §§ 125, 19 Abs. 3 UmwG als bekannt gemacht gilt, ihren Anspruch nach Grund und Höhe in Textform anmelden, Sicherheit zu leisten, soweit sie nicht Befriedigung verlangen können. Dieses Recht steht den Gläubigern jedoch nur zu, wenn sie glaubhaft machen, dass durch die Ausgliederung die Erfüllung ihrer Forderung gefährdet wird."
    },
    {
      "date": "2026-02-04",
      "id": "144267",
      "original_text": "Sonstige Registerbekanntmachung\nBayern Amtsgericht München HRB 226622\nAlten- Pflegeheim Veitsbronn GmbH – München",
      "type": "Sonstige Registerbekanntmachung",
      "state": "Bayern",
      "amtsgericht": "Amtsgericht München",
      "registernummer": "HRB 226622",
      "registerart": "HRB",
      "company_name": "Alten- Pflegeheim Veitsbronn GmbH",
      "company_seat": "München",
      "details": "04.02.2026 (Bekanntmachungsdatum)\n\nBayern Amtsgericht München HRB 226622\nSonstige Registerbekanntmachung 03.02.2026 (Eintragungsdatum)\n\nAlten- Pflegeheim Veitsbronn GmbH\nGesellschaft mit beschränkter Haftung\nMünchen\n\nDen Gläubigern der Gesellschaft, deren Forderungen begründet worden sind, bevor die Eintragung der Beendigung des Beherrschungs- und Gewinnabführungsvertrages in das Handelsregister nach § 10 des Handelsgesetzbuches als bekanntgemacht gilt, hat der andere Vertragsteil Sicherheit zu leisten, wenn sie sich binnen sechs Monaten nach der Bekanntmachung der Eintragung zu diesem Zweck bei ihm melden."
    },
    {
      "date": "2026-02-04",
      "id": "144268",
      "original_text": "Registerbekanntmachung nach dem Umwandlungsgesetz\nBayern Amtsgericht München HRB 226622\nAlten- Pflegeheim Veitsbronn GmbH – München",
      "type": "Registerbekanntmachung nach dem Umwandlungsgesetz",
      "state": "Bayern",
      "amtsgericht": "Amtsgericht München",
      "registernummer": "HRB 226622",
      "registerart": "HRB",
      "company_name": "Alten- Pflegeheim Veitsbronn GmbH",
      "company_seat": "München",
      "details": "04.02.2026 (Bekanntmachungsdatum)\n\nBayern Amtsgericht München HRB 226622\nRegisterbekanntmachung nach dem Umwandlungsgesetz 03.02.2026 (Eintragungsdatum)\n\nAlten- Pflegeheim Veitsbronn GmbH\nGesellschaft mit beschränkter Haftung\nMünchen\n\nDen Gläubigern der an der Verschmelzung beteiligten Rechtsträger ist, wenn sie binnen sechs Monaten nach dem Tag, an dem die Eintragung der Verschmelzung in das Register des Sitzes desjenigen Rechtsträgers, dessen Gläubiger sie sind, nach § 19 Abs. 3 UmwG als bekannt gemacht gilt, ihren Anspruch nach Grund und Höhe in Textform anmelden, Sicherheit zu leisten, soweit sie nicht Befriedigung verlangen können. Dieses Recht steht den Gläubigern jedoch nur zu, wenn sie glaubhaft machen, dass durch die Verschmelzung die Erfüllung ihrer Forderung gefährdet wird."
    },
    {
      "date": "2026-02-04",
      "id": "144269",
      "original_text": "Einreichung neuer Dokumente\nBayern Amtsgericht Weiden i. d. OPf. HRB 2863\nChristophorus Holding GmbH – Weiden in der Oberpfalz",
      "type": "Einreichung neuer Dokumente",
      "state": "Bayern",
      "amtsgericht": "Amtsgericht Weiden i. d. OPf.",
      "registernummer": "HRB 2863",
      "registerart": "HRB",
      "company_name": "Christophorus Holding GmbH",
      "company_seat": "Weiden in der Oberpfalz",
      "details": "04.02.2026 (Bekanntmachungsdatum)\n\nBayern Amtsgericht Weiden i. d. OPf. HRB 2863\nEinreichung neuer Dokumente 03.02.2026 (Eintragungsdatum)\n\nChristophorus Holding GmbH\nGesellschaft mit beschränkter Haftung\nWeiden in der Oberpfalz\n\nDem Amtsgericht Weiden i.d.OPf. -Registergericht- ist eine Liste der Mitglieder des Aufsichtsrats eingereicht worden, § 52 Abs. 3 S. 2 GmbHG."
    },
    {
      "date": "2026-02-04",
      "id": "144270",
      "original_text": "Registerbekanntmachung nach dem Umwandlungsgesetz\nBayern Amtsgericht München HRA 91789\nIMMOHYP Objekt GmbH & Co. KG – Grünwald",
      "type": "Registerbekanntmachung nach dem Umwandlungsgesetz",
      "state": "Bayern",
      "amtsgericht": "Amtsgericht München",
      "registernummer": "HRA 91789",
      "registerart": "HRA",
      "company_name": "IMMOHYP Objekt GmbH & Co. KG",
      "company_seat": "Grünwald",
      "details": "04.02.2026 (Bekanntmachungsdatum)\n\nBayern Amtsgericht München HRA 91789\nRegisterbekanntmachung nach dem Umwandlungsgesetz 03.02.2026 (Eintragungsdatum)\n\nIMMOHYP Objekt GmbH & Co. KG\nKommanditgesellschaft\nGrünwald\n\nDen Gläubigern des formwechselnden Rechtsträgers ist, wenn sie binnen sechs Monaten nach dem Tag, an dem die Eintragung des Formwechsels nach § 201 UmwG als bekannt gemacht gilt, ihren Anspruch nach Grund und Höhe in Textform anmelden, Sicherheit zu leisten, soweit sie nicht Befriedigung verlangen können. Dieses Recht steht den Gläubigern jedoch nur zu, wenn sie glaubhaft machen, dass durch den Formwechsel die Erfüllung ihrer Forderung gefährdet wird."
    },
    {
      "date": "2026-02-04",
      "id": "144271",
      "original_text": "Löschungsankündigung\nBayern Amtsgericht Nürnberg HRB 25823\nbauconcept Massivhaus und Projektentwicklung GmbH – Nürnberg",
      "type": "Löschungsankündigung",
      "state": "Bayern",
      "amtsgericht": "Amtsgericht Nürnberg",
      "registernummer": "HRB 25823",
      "registerart": "HRB",
      "company_name": "bauconcept Massivhaus und Projektentwicklung GmbH",
      "company_seat": "Nürnberg",
      "details": "04.02.2026 (Bekanntmachungsdatum)\n\nBayern Amtsgericht Nürnberg HRB 25823\nLöschungsankündigung\n\nbauconcept Massivhaus und Projektentwicklung GmbH\nGesellschaft mit beschränkter Haftung\nNürnberg\n\nDas Registergericht beabsichtigt, die im Handelsregister eingetragene Gesellschaft wegen Vermögenslosigkeit von Amts wegen nach § 394 FamFG zu löschen. Die Frist zur Erhebung eines Widerspruchs ist auf einen Monat festgesetzt."
    },
    {
      "date": "2026-02-04",
      "id": "144272",
      "original_text": "Löschungsankündigung\nBayern Amtsgericht München HRB 224504\nSPCplus GmbH – München",
      "type": "Löschungsankündigung",
      "state": "Bayern",
      "amtsgericht": "Amtsgericht München",
      "registernummer": "HRB 224504",
      "registerart": "HRB",
      "company_name": "SPCplus GmbH",
      "company_seat": "München",
      "details": "04.02.2026 (Bekanntmachungsdatum)\n\nBayern Amtsgericht München HRB 224504\nLöschungsankündigung 03.02.2026 (Eintragungsdatum)\n\nSPCplus GmbH\nGesellschaft mit beschränkter Haftung\nMünchen\n\nDas Registergericht beabsichtigt, die im Handelsregister eingetragene Gesellschaft wegen Vermögenslosigkeit von Amts wegen nach § 394 FamFG zu löschen. Die Frist zur Erhebung eines Widerspruchs ist auf drei Monate festgesetzt."
    },
    {
      "date": "2026-02-04",
      "id": "144273",
      "original_text": "Registerbekanntmachung nach dem Umwandlungsgesetz\nBayern Amtsgericht Augsburg HRB 39283\nStöckle Beteiligungs UG (haftungsbeschränkt) – Friedberg",
      "type": "Registerbekanntmachung nach dem Umwandlungsgesetz",
      "state": "Bayern",
      "amtsgericht": "Amtsgericht Augsburg",
      "registernummer": "HRB 39283",
      "registerart": "HRB",
      "company_name": "Stöckle Beteiligungs UG (haftungsbeschränkt)",
      "company_seat": "Friedberg",
      "details": "04.02.2026 (Bekanntmachungsdatum)\n\nBayern Amtsgericht Augsburg HRB 39283\nRegisterbekanntmachung nach dem Umwandlungsgesetz 03.02.2026 (Eintragungsdatum)\n\nStöckle Beteiligungs UG (haftungsbeschränkt)\nGesellschaft mit beschränkter Haftung\nFriedberg\n\nDen Gläubigern der an der Verschmelzung beteiligten Rechtsträger ist, wenn sie binnen sechs Monaten nach dem Tag, an dem die Eintragung der Verschmelzung in das Register des Sitzes desjenigen Rechtsträgers, dessen Gläubiger sie sind, nach § 19 Abs. 3 UmwG als bekannt gemacht gilt, ihren Anspruch nach Grund und Höhe in Textform anmelden, Sicherheit zu leisten, soweit sie nicht Befriedigung verlangen können. Dieses Recht steht den Gläubigern jedoch nur zu, wenn sie glaubhaft machen, dass durch die Verschmelzung die Erfüllung ihrer Forderung gefährdet wird."
    },
    {
      "date": "2026-02-04",
      "id": "144274",
      "original_text": "Registerbekanntmachung nach dem Umwandlungsgesetz\nBayern Amtsgericht München HRA 122131\nIbrahim Kavun Beherbergungsbetrieb e.K. – Garmisch-Partenkirchen",
      "type": "Registerbekanntmachung nach dem Umwandlungsgesetz",
      "state": "Bayern",
      "amtsgericht": "Amtsgericht München",
      "registernummer": "HRA 122131",
      "registerart": "HRA",
      "company_name": "Ibrahim Kavun Beherbergungsbetrieb e.K.",
      "company_seat": "Garmisch-Partenkirchen",
      "details": "04.02.2026 (Bekanntmachungsdatum)\n\nBayern Amtsgericht München HRA 122131\nRegisterbekanntmachung nach dem Umwandlungsgesetz 03.02.2026 (Eintragungsdatum)\n\nIbrahim Kavun Beherbergungsbetrieb e.K.\nEinzelkaufmann / Einzelkauffrau\nGarmisch-Partenkirchen\n\nDen Gläubigern der an der Ausgliederung beteiligten Rechtsträger ist, wenn sie binnen sechs Monaten nach dem Tag, an dem die Eintragung der Ausgliederung in das Register des Sitzes desjenigen Rechtsträgers, dessen Gläubiger sie sind, nach §§ 125, 19 Abs. 3 UmwG als bekannt gemacht gilt, ihren Anspruch nach Grund und Höhe in Textform anmelden, Sicherheit zu leisten, soweit sie nicht Befriedigung verlangen können. Dieses Recht steht den Gläubigern jedoch nur zu, wenn sie glaubhaft machen, dass durch die Ausgliederung die Erfüllung ihrer Forderung gefährdet wird."
    },
    {
      "date": "2026-02-04",
      "id": "144275",
      "original_text": "Registerbekanntmachung nach dem Umwandlungsgesetz\nBayern Amtsgericht Landshut HRB 6002\nB/E Aerospace Fischer GmbH – Landshut",
      "type": "Registerbekanntmachung nach dem Umwandlungsgesetz",
      "state": "Bayern",
      "amtsgericht": "Amtsgericht Landshut",
      "registernummer": "HRB 6002",
      "registerart": "HRB",
      "company_name": "B/E Aerospace Fischer GmbH",
      "company_seat": "Landshut",
      "details": "04.02.2026 (Bekanntmachungsdatum)\n\nBayern Amtsgericht Landshut HRB 6002\nRegisterbekanntmachung nach dem Umwandlungsgesetz 03.02.2026 (Eintragungsdatum)\n\nB/E Aerospace Fischer GmbH\nGesellschaft mit beschränkter Haftung\nLandshut\n\nDen Gläubigern der Gesellschaft, deren Forderungen begründet worden sind, bevor die Eintragung der Beendigung des Beherrschungs- und Gewinnabführungsvertrages in das Handelsregister nach § 10 des Handelsgesetzbuches als bekanntgemacht gilt, hat der andere Vertragsteil Sicherheit zu leisten, wenn sie sich binnen sechs Monaten nach der Bekanntmachung der Eintragung zu diesem Zweck bei ihm melden."
    },
    {
      "date": "2026-02-04",
      "id": "144276",
      "original_text": "Löschungsankündigung\nBerlin Amtsgericht Berlin (Charlottenburg) HRB 166230\nDive Zone Berlin GmbH – Berlin",
      "type": "Löschungsankündigung",
      "state": "Berlin",
      "amtsgericht": "Amtsgericht Berlin (Charlottenburg)",
      "registernummer": "HRB 166230",
      "registerart": "HRB",
      "company_name": "Dive Zone Berlin GmbH",
      "company_seat": "Berlin",
      "details": "04.02.2026 (Bekanntmachungsdatum)\n\nBerlin Amtsgericht Berlin (Charlottenburg) HRB 166230\nLöschungsankündigung\n\nDive Zone Berlin GmbH\nGesellschaft mit beschränkter Haftung\nBerlin\n\nBei der nachstehenden Gesellschaft wird das Amtslöschungsverfahren gemäß § 394 FamFG eingeleitet. Widerspruchsfrist 6 Wochen"
    },
    {
      "date": "2026-02-04",
      "id": "144277",
      "original_text": "Löschungsankündigung\nBaden-Württemberg Amtsgericht Mannheim HRB 706193\nManagement-Audit Gesellschaft für innovative Unternehmensvermittlung mbH – Rheinstetten",
      "type": "Löschungsankündigung",
      "state": "Baden-Württemberg",
      "amtsgericht": "Amtsgericht Mannheim",
      "registernummer": "HRB 706193",
      "registerart": "HRB",
      "company_name": "Management-Audit Gesellschaft für innovative Unternehmensvermittlung mbH",
      "company_seat": "Rheinstetten",
      "details": "04.02.2026 (Bekanntmachungsdatum)\n\nBaden-Württemberg Amtsgericht Mannheim HRB 706193\nLöschungsankündigung\n\nManagement-Audit Gesellschaft für innovative Unternehmensvermittlung mbH\nGesellschaft mit beschränkter Haftung\nRheinstetten\n\nDas Gericht beabsichtigt, die Gesellschaft wegen Vermögenslosigkeit im Handelsregister von Amts wegen nach § 394 FamFG zu löschen. Die Frist zur Geltendmachung eines Widerspruchs gegen die beabsichtigte Löschung ist auf einen Monat ab Veröffentlichung bestimmt."
    },
    {
      "date": "2026-02-04",
      "id": "144278",
      "original_text": "Einreichung neuer Dokumente\nSchleswig-Holstein Amtsgericht Flensburg HRB 1576 NI\nDRK Sozialstation Karrharde/Leck Süderlügum/Neukirchen gGmbH – Ladelund",
      "type": "Einreichung neuer Dokumente",
      "state": "Schleswig-Holstein",
      "amtsgericht": "Amtsgericht Flensburg",
      "registernummer": "HRB 1576 NI",
      "registerart": "HRB",
      "company_name": "DRK Sozialstation Karrharde/Leck Süderlügum/Neukirchen gGmbH",
      "company_seat": "Ladelund",
      "details": "04.02.2026 (Bekanntmachungsdatum)\n\nSchleswig-Holstein Amtsgericht Flensburg HRB 1576 NI\nEinreichung neuer Dokumente\n\nDRK Sozialstation Karrharde/Leck Süderlügum/Neukirchen gGmbH\nGesellschaft mit beschränkter Haftung\nLadelund\n\nNeue Aufsichtsratsliste nach Änderung eingereicht am 03.02.2026."
    },
    {
      "date": "2026-02-04",
      "id": "144279",
      "original_text": "Registerbekanntmachung nach dem Umwandlungsgesetz\nBerlin Amtsgericht Berlin (Charlottenburg) HRB 283513\nECONA GmbH – Berlin",
      "type": "Registerbekanntmachung nach dem Umwandlungsgesetz",
      "state": "Berlin",
      "amtsgericht": "Amtsgericht Berlin (Charlottenburg)",
      "registernummer": "HRB 283513",
      "registerart": "HRB",
      "company_name": "ECONA GmbH",
      "company_seat": "Berlin",
      "details": "04.02.2026 (Bekanntmachungsdatum)\n\nBerlin Amtsgericht Berlin (Charlottenburg) HRB 283513\nRegisterbekanntmachung nach dem Umwandlungsgesetz 02.02.2026 (Eintragungsdatum)\n\nECONA GmbH\nGesellschaft mit beschränkter Haftung\nBerlin\n\nZu Eintragungsnummer 1 vom 02.02.2026 wird als nicht eingetragen veröffentlicht: Den Gläubigern ist, wenn sie binnen sechs Monaten nach dem Tag, an dem die Eintragung der Umwandlung als bekannt gemacht gilt, ihren Anspruch nach Grund und Höhe schriftlich anmelden, Sicherheit zu leisten, soweit sie nicht Befriedigung verlangen können. Dieses Recht steht den Gläubigern jedoch nur zu, wenn sie glaubhaft machen, dass durch die Umwandlung die Erfüllung ihrer Forderung gefährdet wird. Das Recht, Sicherheitsleistung zu verlangen, steht Gläubigern nicht zu, die im Falle der Insolvenz ein Recht auf vorzugsweise Befriedigung aus einer Deckungsmasse haben, die nach gesetzlicher Vorschrift zu ihrem Schutz errichtet und staatlich überwacht ist."
    },
    {
      "date": "2026-02-04",
      "id": "144280",
      "original_text": "Einreichung neuer Dokumente\nBerlin Amtsgericht Berlin (Charlottenburg) HRB 125681\nUniversum Kommunikation und Medien AG – Berlin",
      "type": "Einreichung neuer Dokumente",
      "state": "Berlin",
      "amtsgericht": "Amtsgericht Berlin (Charlottenburg)",
      "registernummer": "HRB 125681",
      "registerart": "HRB",
      "company_name": "Universum Kommunikation und Medien AG",
      "company_seat": "Berlin",
      "details": "04.02.2026 (Bekanntmachungsdatum)\n\nBerlin Amtsgericht Berlin (Charlottenburg) HRB 125681\nEinreichung neuer Dokumente\n\nUniversum Kommunikation und Medien AG\nAktiengesellschaft\nBerlin\n\nAls nicht eingetragen wird veröffentlicht: Es wurde eine neue Liste der Aufsichtsratsmitglieder eingereicht (§ 106 AktG)."
    },
    {
      "date": "2026-02-04",
      "id": "144281",
      "original_text": "Einreichung neuer Dokumente\nBaden-Württemberg Amtsgericht Freiburg HRB 540940\nFondium Singen GmbH – Singen Hohentwiel",
      "type": "Einreichung neuer Dokumente",
      "state": "Baden-Württemberg",
      "amtsgericht": "Amtsgericht Freiburg",
      "registernummer": "HRB 540940",
      "registerart": "HRB",
      "company_name": "Fondium Singen GmbH",
      "company_seat": "Singen Hohentwiel",
      "details": "04.02.2026 (Bekanntmachungsdatum)\n\nBaden-Württemberg Amtsgericht Freiburg HRB 540940\nEinreichung neuer Dokumente 04.02.2026 (Eintragungsdatum)\n\nFondium Singen GmbH\nGesellschaft mit beschränkter Haftung\nSingen Hohentwiel\n\nDie Gesellschaft hat am 08.01.2026 die Liste über die Zusammensetzung des Aufsichtsrats zum Handelsregister eingereicht."
    },
    {
      "date": "2026-02-04",
      "id": "144282",
      "original_text": "Einreichung neuer Dokumente\nBaden-Württemberg Amtsgericht Freiburg HRB 720618\naquatec AG – Donaueschingen",
      "type": "Einreichung neuer Dokumente",
      "state": "Baden-Württemberg",
      "amtsgericht": "Amtsgericht Freiburg",
      "registernummer": "HRB 720618",
      "registerart": "HRB",
      "company_name": "aquatec AG",
      "company_seat": "Donaueschingen",
      "details": "04.02.2026 (Bekanntmachungsdatum)\n\nBaden-Württemberg Amtsgericht Freiburg HRB 720618\nEinreichung neuer Dokumente 04.02.2026 (Eintragungsdatum)\n\naquatec AG\nAktiengesellschaft\nDonaueschingen\n\nAls nicht eingetragen wird bekanntgemacht:\nDie Gesellschaft hat am 29.01.2026 die Liste über die Zusammensetzung des Aufsichtsrats zum Handelsregister eingereicht."
    },
    {
      "date": "2026-02-04",
      "id": "144283",
      "original_text": "Löschungsankündigung\nBerlin Amtsgericht Berlin (Charlottenburg) HRA 17435\nHofmann GmbH. & Co. Dach- und Isolierbau KG – Berlin",
      "type": "Löschungsankündigung",
      "state": "Berlin",
      "amtsgericht": "Amtsgericht Berlin (Charlottenburg)",
      "registernummer": "HRA 17435",
      "registerart": "HRA",
      "company_name": "Hofmann GmbH. & Co. Dach- und Isolierbau KG",
      "company_seat": "Berlin",
      "details": "04.02.2026 (Bekanntmachungsdatum)\n\nBerlin Amtsgericht Berlin (Charlottenburg) HRA 17435\nLöschungsankündigung\n\nHofmann GmbH. & Co. Dach- und Isolierbau KG\nKommanditgesellschaft\nBerlin\n\nBei dem nachstehenden Unternehmen / der nachstehenden Gesellschaft wird das Amtslöschungsverfahren gemäß § 31 Abs. 2 HGB eingeleitet. Widerspruchsfrist 2 Monate"
    },
    {
      "date": "2026-02-04",
      "id": "144284",
      "original_text": "Sonstige Registerbekanntmachung\nBaden-Württemberg Amtsgericht Mannheim HRB 701436\nADG Apotheken-Dienstleistungsgesellschaft mbH – Mannheim",
      "type": "Sonstige Registerbekanntmachung",
      "state": "Baden-Württemberg",
      "amtsgericht": "Amtsgericht Mannheim",
      "registernummer": "HRB 701436",
      "registerart": "HRB",
      "company_name": "ADG Apotheken-Dienstleistungsgesellschaft mbH",
      "company_seat": "Mannheim",
      "details": "04.02.2026 (Bekanntmachungsdatum)\n\nBaden-Württemberg Amtsgericht Mannheim HRB 701436\nSonstige Registerbekanntmachung 04.02.2026 (Eintragungsdatum)\n\nADG Apotheken-Dienstleistungsgesellschaft mbH\nGesellschaft mit beschränkter Haftung\nMannheim\n\nAls nicht eingetragen wird bekanntgemacht:\nDen Gläubigern der Gesellschaft, deren Forderungen begründet worden sind, bevor die Eintragung der Beendigung des Vertrages in das Handelsregister nach § 10 HGB als bekanntgemacht gilt, ist vom anderen Vertragsteil Sicherheit zu leisten, wenn sie sich binnen sechs Monaten nach der Bekanntmachung zu diesem Zweck bei ihm melden."
    },
    {
      "date": "2026-02-04",
      "id": "144285",
      "original_text": "Einreichung neuer Dokumente\nBerlin Amtsgericht Berlin (Charlottenburg) HRB 211155\nDigital Charging Solutions GmbH – Berlin",
      "type": "Einreichung neuer Dokumente",
      "state": "Berlin",
      "amtsgericht": "Amtsgericht Berlin (Charlottenburg)",
      "registernummer": "HRB 211155",
      "registerart": "HRB",
      "company_name": "Digital Charging Solutions GmbH",
      "company_seat": "Berlin",
      "details": "04.02.2026 (Bekanntmachungsdatum)\n\nBerlin Amtsgericht Berlin (Charlottenburg) HRB 211155\nEinreichung neuer Dokumente\n\nDigital Charging Solutions GmbH\nGesellschaft mit beschränkter Haftung\nBerlin\n\nAls nicht eingetragen wird veröffentlicht:\n\nEs wurde eine neue Liste der Aufsichtsratsmitglieder eingereicht (§52 GmbHG)."
    },
    {
      "date": "2026-02-04",
      "id": "144286",
      "original_text": "Löschungsankündigung\nBerlin Amtsgericht Berlin (Charlottenburg) HRB 162913\nHA2 online sales UG (haftungsbeschränkt) – Berlin",
      "type": "Löschungsankündigung",
      "state": "Berlin",
      "amtsgericht": "Amtsgericht Berlin (Charlottenburg)",
      "registernummer": "HRB 162913",
      "registerart": "HRB",
      "company_name": "HA2 online sales UG (haftungsbeschränkt)",
      "company_seat": "Berlin",
      "details": "04.02.2026 (Bekanntmachungsdatum)\n\nBerlin Amtsgericht Berlin (Charlottenburg) HRB 162913\nLöschungsankündigung\n\nHA2 online sales UG (haftungsbeschränkt)\nGesellschaft mit beschränkter Haftung\nBerlin\n\nBei der nachstehenden Gesellschaft wird das Amtslöschungsverfahren gemäß § 394 FamFG eingeleitet. Widerspruchsfrist 3 Wochen"
    },
    {
      "date": "2026-02-04",
      "id": "144287",
      "original_text": "Registerbekanntmachung nach dem Umwandlungsgesetz\nHamburg Amtsgericht Hamburg HRB 115335\nBESTSELLER Stores Germany GmbH – Hamburg",
      "type": "Registerbekanntmachung nach dem Umwandlungsgesetz",
      "state": "Hamburg",
      "amtsgericht": "Amtsgericht Hamburg",
      "registernummer": "HRB 115335",
      "registerart": "HRB",
      "company_name": "BESTSELLER Stores Germany GmbH",
      "company_seat": "Hamburg",
      "details": "04.02.2026 (Bekanntmachungsdatum)\n\nHamburg Amtsgericht Hamburg HRB 115335\nRegisterbekanntmachung nach dem Umwandlungsgesetz 04.02.2026 (Eintragungsdatum)\n\nBESTSELLER Stores Germany GmbH\nGesellschaft mit beschränkter Haftung\nHamburg\n\nAls nicht eingetragen wird bekannt gemacht:\nDen Gläubigern der an der Verschmelzung beteiligten Gesellschaften ist, wenn sie binnen sechs Monaten nach dem Tag, an dem die Eintragung der Verschmelzung in das Register des Sitzes desjenigen Rechtsträgers, dessen Gläubiger sie sind, nach § 19 Absatz 3 UmwG als bekannt gemacht gilt, ihren Anspruch nach Grund und Höhe schriftlich anmelden, Sicherheit zu leisten, soweit sie nicht Befriedigung verlangen können. Dieses Recht steht den Gläubigern jedoch nur zu, wenn sie glaubhaft machen, dass durch die Verschmelzung die Erfüllung ihrer Forderung gefährdet wird."
    },
    {
      "date": "2026-02-04",
      "id": "144288",
      "original_text": "Registerbekanntmachung nach dem Umwandlungsgesetz\nHamburg Amtsgericht Hamburg HRB 110108\nBESTSELLER Stores Germany GmbH – Hamburg",
      "type": "Registerbekanntmachung nach dem Umwandlungsgesetz",
      "state": "Hamburg",
      "amtsgericht": "Amtsgericht Hamburg",
      "registernummer": "HRB 110108",
      "registerart": "HRB",
      "company_name": "BESTSELLER Stores Germany GmbH",
      "company_seat": "Hamburg",
      "details": "04.02.2026 (Bekanntmachungsdatum)\n\nHamburg Amtsgericht Hamburg HRB 110108\nRegisterbekanntmachung nach dem Umwandlungsgesetz 04.02.2026 (Eintragungsdatum)\n\nBESTSELLER Stores Germany GmbH\nGesellschaft mit beschränkter Haftung\nHamburg\n\nAls nicht eingetragen wird bekannt gemacht:\nDen Gläubigern der an der Verschmelzung beteiligten Gesellschaften ist, wenn sie binnen sechs Monaten nach dem Tag, an dem die Eintragung der Verschmelzung in das Register des Sitzes desjenigen Rechtsträgers, dessen Gläubiger sie sind, nach § 19 Absatz 3 UmwG als bekannt gemacht gilt, ihren Anspruch nach Grund und Höhe schriftlich anmelden, Sicherheit zu leisten, soweit sie nicht Befriedigung verlangen können. Dieses Recht steht den Gläubigern jedoch nur zu, wenn sie glaubhaft machen, dass durch die Verschmelzung die Erfüllung ihrer Forderung gefährdet wird."
    },
    {
      "date": "2026-02-04",
      "id": "144289",
      "original_text": "Löschungsankündigung\nSaarland Amtsgericht Saarbrücken HRB 74917\nDruckerei DÖRR GmbH – Püttlingen",
      "type": "Löschungsankündigung",
      "state": "Saarland",
      "amtsgericht": "Amtsgericht Saarbrücken",
      "registernummer": "HRB 74917",
      "registerart": "HRB",
      "company_name": "Druckerei DÖRR GmbH",
      "company_seat": "Püttlingen",
      "details": "04.02.2026 (Bekanntmachungsdatum)\n\nSaarland Amtsgericht Saarbrücken HRB 74917\nLöschungsankündigung 04.02.2026 (Eintragungsdatum)\n\nDruckerei DÖRR GmbH\nGesellschaft mit beschränkter Haftung\nPüttlingen\n\nEs ist beabsichtigt, die Gesellschaft von Amts wegen gemäß § 394 FamFG wegen Vermögenslosigkeit zu löschen. Gegen die Löschung von Amts wegen ist das Rechtsmittel des Widerspruchs statthaft. Der Widerspruch ist binnen einer Frist von 3 Monaten beginnend mit dem Tag dieser Veröffentlichung durch Einreichen eines Widerspruchsschreibens -schriftlich oder zur Niederschrift der Geschäftsstelle- beim Amtsgericht Saarbrücken, -zentrales Handelsregister-, Mainzerstr.178, 66121 Saarbrücken einzulegen. Der Widerspruch muss die Bezeichnung der angefochtenen Löschungsankündigung enthalten sowie die Erklärung, dass Widerspruch eingelegt wird. Er ist vom Widerspruchsführer oder seinem Bevollmächtigten zu unterzeichnen."
    },
    {
      "date": "2026-02-04",
      "id": "144290",
      "original_text": "Löschungsankündigung\nThüringen Amtsgericht Jena HRB 109272\nMF Elektro-Installation und Anlagenbau GmbH – Weimar",
      "type": "Löschungsankündigung",
      "state": "Thüringen",
      "amtsgericht": "Amtsgericht Jena",
      "registernummer": "HRB 109272",
      "registerart": "HRB",
      "company_name": "MF Elektro-Installation und Anlagenbau GmbH",
      "company_seat": "Weimar",
      "details": "04.02.2026 (Bekanntmachungsdatum)\n\nThüringen Amtsgericht Jena HRB 109272\nLöschungsankündigung\n\nMF Elektro-Installation und Anlagenbau GmbH\nGesellschaft mit beschränkter Haftung\nWeimar\n\nDas Registergericht beabsichtigt, die im Handelsregister eingetragene Gesellschaft wegen Vermögenslosigkeit nach § 394 FamFG von Amts wegen zu löschen. Die Frist zur Erhebung eines Widerspruchs gegen die beabsichtigte Löschung wird auf 6 Wochen festgesetzt."
    },
    {
      "date": "2026-02-04",
      "id": "144291",
      "original_text": "Registerbekanntmachung nach dem Umwandlungsgesetz\nBerlin Amtsgericht Berlin (Charlottenburg) HRB 174708\nLa Torche Co-Founding GmbH – Berlin",
      "type": "Registerbekanntmachung nach dem Umwandlungsgesetz",
      "state": "Berlin",
      "amtsgericht": "Amtsgericht Berlin (Charlottenburg)",
      "registernummer": "HRB 174708",
      "registerart": "HRB",
      "company_name": "La Torche Co-Founding GmbH",
      "company_seat": "Berlin",
      "details": "04.02.2026 (Bekanntmachungsdatum)\n\nBerlin Amtsgericht Berlin (Charlottenburg) HRB 174708\nRegisterbekanntmachung nach dem Umwandlungsgesetz 02.02.2026 (Eintragungsdatum)\n\nLa Torche Co-Founding GmbH\nGesellschaft mit beschränkter Haftung\nBerlin\n\nZu Eintragungsnummer 5 vom 02.02.2026 wird als nicht eingetragen veröffentlicht: Den Gläubigern der an der Verschmelzung beteiligten Rechtsträger ist, wenn sie binnen sechs Monaten nach dem Tag, an dem die Eintragung der Verschmelzung in das Register des Sitzes desjenigen Rechtsträgers, dessen Gläubiger sie sind, als bekannt gemacht gilt, ihren Anspruch nach Grund und Höhe schriftlich anmelden, Sicherheit zu leisten, soweit sie nicht Befriedigung verlangen können. Dieses Recht steht den Gläubigern jedoch nur zu, wenn sie glaubhaft machen, dass durch die Verschmelzung die Erfüllung ihrer Forderung gefährdet wird. Das Recht, Sicherheitsleistung zu verlangen, steht Gläubigern nicht zu, die im Falle der Insolvenz ein Recht auf vorzugsweise Befriedigung aus einer Deckungsmasse haben, die nach gesetzlicher Vorschrift zu ihrem Schutz errichtet und staatlich überwacht ist."
    },
    {
      "date": "2026-02-04",
      "id": "144292",
      "original_text": "Registerbekanntmachung nach dem Umwandlungsgesetz\nBerlin Amtsgericht Berlin (Charlottenburg) HRB 135061\nRheingau Founders GmbH – Berlin",
      "type": "Registerbekanntmachung nach dem Umwandlungsgesetz",
      "state": "Berlin",
      "amtsgericht": "Amtsgericht Berlin (Charlottenburg)",
      "registernummer": "HRB 135061",
      "registerart": "HRB",
      "company_name": "Rheingau Founders GmbH",
      "company_seat": "Berlin",
      "details": "04.02.2026 (Bekanntmachungsdatum)\n\nBerlin Amtsgericht Berlin (Charlottenburg) HRB 135061\nRegisterbekanntmachung nach dem Umwandlungsgesetz 02.02.2026 (Eintragungsdatum)\n\nRheingau Founders GmbH\nGesellschaft mit beschränkter Haftung\nBerlin\n\nZu Eintragungsnummer 14 vom 02.02.2026 wird als nicht eingetragen veröffentlicht: Den Gläubigern der an der Verschmelzung beteiligten Rechtsträger ist, wenn sie binnen sechs Monaten nach dem Tag, an dem die Eintragung der Verschmelzung in das Register des Sitzes desjenigen Rechtsträgers, dessen Gläubiger sie sind, als bekannt gemacht gilt, ihren Anspruch nach Grund und Höhe schriftlich anmelden, Sicherheit zu leisten, soweit sie nicht Befriedigung verlangen können. Dieses Recht steht den Gläubigern jedoch nur zu, wenn sie glaubhaft machen, dass durch die Verschmelzung die Erfüllung ihrer Forderung gefährdet wird. Das Recht, Sicherheitsleistung zu verlangen, steht Gläubigern nicht zu, die im Falle der Insolvenz ein Recht auf vorzugsweise Befriedigung aus einer Deckungsmasse haben, die nach gesetzlicher Vorschrift zu ihrem Schutz errichtet und staatlich überwacht ist."
    },
    {
      "date": "2026-02-04",
      "id": "144293",
      "original_text": "Einreichung neuer Dokumente\nBaden-Württemberg Amtsgericht Mannheim HRB 734272\nBK Giulini GmbH – Ladenburg",
      "type": "Einreichung neuer Dokumente",
      "state": "Baden-Württemberg",
      "amtsgericht": "Amtsgericht Mannheim",
      "registernummer": "HRB 734272",
      "registerart": "HRB",
      "company_name": "BK Giulini GmbH",
      "company_seat": "Ladenburg",
      "details": "04.02.2026 (Bekanntmachungsdatum)\n\nBaden-Württemberg Amtsgericht Mannheim HRB 734272\nEinreichung neuer Dokumente\n\nBK Giulini GmbH\nGesellschaft mit beschränkter Haftung\nLadenburg\n\nDie Gesellschaft hat am 23.01.2026 die Liste über die Zusammensetzung des Aufsichtsrats zum Handelsregister eingereicht."
    },
    {
      "date": "2026-02-04",
      "id": "144294",
      "original_text": "Registerbekanntmachung nach dem Umwandlungsgesetz\nBerlin Amtsgericht Berlin (Charlottenburg) HRB 209231\nJan Lange Verwaltungsgesellschaft mit beschränkter Haftung – Berlin",
      "type": "Registerbekanntmachung nach dem Umwandlungsgesetz",
      "state": "Berlin",
      "amtsgericht": "Amtsgericht Berlin (Charlottenburg)",
      "registernummer": "HRB 209231",
      "registerart": "HRB",
      "company_name": "Jan Lange Verwaltungsgesellschaft mit beschränkter Haftung",
      "company_seat": "Berlin",
      "details": "04.02.2026 (Bekanntmachungsdatum)\n\nBerlin Amtsgericht Berlin (Charlottenburg) HRB 209231\nRegisterbekanntmachung nach dem Umwandlungsgesetz 02.02.2026 (Eintragungsdatum)\n\nJan Lange Verwaltungsgesellschaft mit beschränkter Haftung\nGesellschaft mit beschränkter Haftung\nBerlin\n\nZu Eintragungsnummer 3 vom 02.02.2026 wird als nicht eingetragen veröffentlicht:Den Gläubigern der an der Verschmelzung beteiligten Rechtsträger ist, wenn sie binnen sechs Monaten nach dem Tag, an dem die Eintragung der Verschmelzung in das Register des Sitzes desjenigen Rechtsträgers, dessen Gläubiger sie sind, als bekannt gemacht gilt, ihren Anspruch nach Grund und Höhe schriftlich anmelden, Sicherheit zu leisten, soweit sie nicht Befriedigung verlangen können. Dieses Recht steht den Gläubigern jedoch nur zu, wenn sie glaubhaft machen, dass durch die Verschmelzung die Erfüllung ihrer Forderung gefährdet wird. Das Recht, Sicherheitsleistung zu verlangen, steht Gläubigern nicht zu, die im Falle der Insolvenz ein Recht auf vorzugsweise Befriedigung aus einer Deckungsmasse haben, die nach gesetzlicher Vorschrift zu ihrem Schutz errichtet und staatlich überwacht ist."
    },
    {
      "date": "2026-02-04",
      "id": "144295",
      "original_text": "Registerbekanntmachung nach dem Umwandlungsgesetz\nBerlin Amtsgericht Berlin (Charlottenburg) HRB 220744\nDas TherapieNetzwerk DTN GmbH – Berlin",
      "type": "Registerbekanntmachung nach dem Umwandlungsgesetz",
      "state": "Berlin",
      "amtsgericht": "Amtsgericht Berlin (Charlottenburg)",
      "registernummer": "HRB 220744",
      "registerart": "HRB",
      "company_name": "Das TherapieNetzwerk DTN GmbH",
      "company_seat": "Berlin",
      "details": "04.02.2026 (Bekanntmachungsdatum)\n\nBerlin Amtsgericht Berlin (Charlottenburg) HRB 220744\nRegisterbekanntmachung nach dem Umwandlungsgesetz 02.02.2026 (Eintragungsdatum)\n\nDas TherapieNetzwerk DTN GmbH\nGesellschaft mit beschränkter Haftung\nBerlin\n\nZu Eintragungsnummer 3 vom 02.02.2026 wird als nicht eingetragen veröffentlicht:Den Gläubigern der an der Verschmelzung beteiligten Rechtsträger ist, wenn sie binnen sechs Monaten nach dem Tag, an dem die Eintragung der Verschmelzung in das Register des Sitzes desjenigen Rechtsträgers, dessen Gläubiger sie sind, als bekannt gemacht gilt, ihren Anspruch nach Grund und Höhe schriftlich anmelden, Sicherheit zu leisten, soweit sie nicht Befriedigung verlangen können. Dieses Recht steht den Gläubigern jedoch nur zu, wenn sie glaubhaft machen, dass durch die Verschmelzung die Erfüllung ihrer Forderung gefährdet wird. Das Recht, Sicherheitsleistung zu verlangen, steht Gläubigern nicht zu, die im Falle der Insolvenz ein Recht auf vorzugsweise Befriedigung aus einer Deckungsmasse haben, die nach gesetzlicher Vorschrift zu ihrem Schutz errichtet und staatlich überwacht ist."
    },
    {
      "date": "2026-02-04",
      "id": "144296",
      "original_text": "Registerbekanntmachung nach dem Umwandlungsgesetz\nBaden-Württemberg Amtsgericht Ulm PR 720267\nHofmann und Wittlinger PartG mbB Steuerberatungsgesellschaft – Ulm",
      "type": "Registerbekanntmachung nach dem Umwandlungsgesetz",
      "state": "Baden-Württemberg",
      "amtsgericht": "Amtsgericht Ulm",
      "registernummer": "PR 720267",
      "registerart": "PR",
      "company_name": "Hofmann und Wittlinger PartG mbB Steuerberatungsgesellschaft",
      "company_seat": "Ulm",
      "details": "04.02.2026 (Bekanntmachungsdatum)\n\nBaden-Württemberg Amtsgericht Ulm PR 720267\nRegisterbekanntmachung nach dem Umwandlungsgesetz 04.02.2026 (Eintragungsdatum)\n\nHofmann und Wittlinger PartG mbB Steuerberatungsgesellschaft\nPartnerschaftsgesellschaft\nUlm\n\nAls nicht eingetragen wird bekanntgemacht:\nDen Gläubigern der an der Verschmelzung beteiligten Rechtsträger ist, wenn sie binnen sechs Monaten nach dem Tag, an dem die Eintragung der Verschmelzung in das Register des Sitzes desjenigen Rechtsträgers, dessen Gläubiger sie sind, nach § 19 Abs. 3 UmwG als bekanntgemacht gilt, ihren Anspruch nach Grund und Höhe schriftlich anmelden, Sicherheit zu leisten, soweit sie nicht Befriedigung verlangen können. Dieses Recht steht den Gläubigern jedoch nur zu, wenn sie glaubhaft machen, dass durch die Verschmelzung die Erfüllung ihrer Forderung gefährdet wird."
    },
    {
      "date": "2026-02-04",
      "id": "144297",
      "original_text": "Löschungsankündigung\nBaden-Württemberg Amtsgericht Mannheim HRB 732971\nRAI Dienstleistungen GmbH – Linkenheim-Hochstetten",
      "type": "Löschungsankündigung",
      "state": "Baden-Württemberg",
      "amtsgericht": "Amtsgericht Mannheim",
      "registernummer": "HRB 732971",
      "registerart": "HRB",
      "company_name": "RAI Dienstleistungen GmbH",
      "company_seat": "Linkenheim-Hochstetten",
      "details": "04.02.2026 (Bekanntmachungsdatum)\n\nBaden-Württemberg Amtsgericht Mannheim HRB 732971\nLöschungsankündigung\n\nRAI Dienstleistungen GmbH\nGesellschaft mit beschränkter Haftung\nLinkenheim-Hochstetten\n\nAls nicht eingetragen wird bekanntgemacht: Das Gericht beabsichtigt, die Gesellschaft wegen Vermögenslosigkeit im Handelsregister von Amts wegen nach § 394 FamFG zu löschen. Die Frist zur Geltendmachung eines Widerspruchs gegen die beabsichtigte Löschung ist auf einen Monat ab Veröffentlichung bestimmt."
    },
    {
      "date": "2026-02-04",
      "id": "144298",
      "original_text": "Registerbekanntmachung nach dem Umwandlungsgesetz\nBaden-Württemberg Amtsgericht Ulm PR 720268\nHofmann und Wittlinger PartG mbB Laichingen - Steuerberatungsgesellschaft – Laichingen",
      "type": "Registerbekanntmachung nach dem Umwandlungsgesetz",
      "state": "Baden-Württemberg",
      "amtsgericht": "Amtsgericht Ulm",
      "registernummer": "PR 720268",
      "registerart": "PR",
      "company_name": "Hofmann und Wittlinger PartG mbB Laichingen - Steuerberatungsgesellschaft",
      "company_seat": "Laichingen",
      "details": "04.02.2026 (Bekanntmachungsdatum)\n\nBaden-Württemberg Amtsgericht Ulm PR 720268\nRegisterbekanntmachung nach dem Umwandlungsgesetz 04.02.2026 (Eintragungsdatum)\n\nHofmann und Wittlinger PartG mbB Laichingen - Steuerberatungsgesellschaft\nPartnerschaftsgesellschaft\nLaichingen\n\nDen Gläubigern der an der Verschmelzung beteiligten Rechtsträger ist, wenn sie binnen sechs Monaten nach dem Tag, an dem die Eintragung der Verschmelzung in das Register des Sitzes desjenigen Rechtsträgers, dessen Gläubiger sie sind, nach § 19 Abs. 3 UmwG als bekanntgemacht gilt, ihren Anspruch nach Grund und Höhe schriftlich anmelden, Sicherheit zu leisten, soweit sie nicht Befriedigung verlangen können. Dieses Recht steht den Gläubigern jedoch nur zu, wenn sie glaubhaft machen, dass durch die Verschmelzung die Erfüllung ihrer Forderung gefährdet wird."
    },
    {
      "date": "2026-02-04",
      "id": "144299",
      "original_text": "Löschungsankündigung\nBaden-Württemberg Amtsgericht Mannheim HRB 729941\nR.A.I. Transporte GmbH – Linkenheim-Hochstetten",
      "type": "Löschungsankündigung",
      "state": "Baden-Württemberg",
      "amtsgericht": "Amtsgericht Mannheim",
      "registernummer": "HRB 729941",
      "registerart": "HRB",
      "company_name": "R.A.I. Transporte GmbH",
      "company_seat": "Linkenheim-Hochstetten",
      "details": "04.02.2026 (Bekanntmachungsdatum)\n\nBaden-Württemberg Amtsgericht Mannheim HRB 729941\nLöschungsankündigung\n\nR.A.I. Transporte GmbH\nGesellschaft mit beschränkter Haftung\nLinkenheim-Hochstetten\n\nAls nicht eingetragen wird bekanntgemacht: Das Gericht beabsichtigt, die Gesellschaft wegen Vermögenslosigkeit im Handelsregister von Amts wegen nach § 394 FamFG zu löschen. Die Frist zur Geltendmachung eines Widerspruchs gegen die beabsichtigte Löschung ist auf einen Monat ab Veröffentlichung bestimmt."
    },
    {
      "date": "2026-02-04",
      "id": "144300",
      "original_text": "Registerbekanntmachung nach dem Umwandlungsgesetz\nSachsen-Anhalt Amtsgericht Stendal HRB 15300\nDWT-Druckluft-Werkzeug-Technik Berlin GmbH – Köthen (Anhalt)",
      "type": "Registerbekanntmachung nach dem Umwandlungsgesetz",
      "state": "Sachsen-Anhalt",
      "amtsgericht": "Amtsgericht Stendal",
      "registernummer": "HRB 15300",
      "registerart": "HRB",
      "company_name": "DWT-Druckluft-Werkzeug-Technik Berlin GmbH",
      "company_seat": "Köthen (Anhalt)",
      "details": "04.02.2026 (Bekanntmachungsdatum)\n\nSachsen-Anhalt Amtsgericht Stendal HRB 15300\nRegisterbekanntmachung nach dem Umwandlungsgesetz 04.02.2026 (Eintragungsdatum)\n\nDWT-Druckluft-Werkzeug-Technik Berlin GmbH\nGesellschaft mit beschränkter Haftung\nKöthen (Anhalt)\n\nNicht eingetragen:\nDen Gläubigern der an der Verschmelzung beteiligten Rechtsträger ist, wenn sie binnen sechs Monaten nach dem Tag, an dem die Eintragung der Verschmelzung nach § 19 Abs. 3 UmwG als bekanntgemacht gilt, ihren Anspruch nach Grund und Höhe schriftlich anmelden, Sicherheit zu leisten, soweit sie nicht Befriedigung verlangen können. Dieses Recht steht ihnen jedoch nur zu, wenn sie glaubhaft machen, dass durch die Verschmelzung die Erfüllung ihrer Forderung gefährdet wird."
    },
    {
      "date": "2026-02-04",
      "id": "144301",
      "original_text": "Registerbekanntmachung nach dem Umwandlungsgesetz\nBerlin Amtsgericht Berlin (Charlottenburg) HRB 187410\nPink Division Verwaltungs GmbH – Berlin",
      "type": "Registerbekanntmachung nach dem Umwandlungsgesetz",
      "state": "Berlin",
      "amtsgericht": "Amtsgericht Berlin (Charlottenburg)",
      "registernummer": "HRB 187410",
      "registerart": "HRB",
      "company_name": "Pink Division Verwaltungs GmbH",
      "company_seat": "Berlin",
      "details": "04.02.2026 (Bekanntmachungsdatum)\n\nBerlin Amtsgericht Berlin (Charlottenburg) HRB 187410\nRegisterbekanntmachung nach dem Umwandlungsgesetz 03.02.2026 (Eintragungsdatum)\n\nPink Division Verwaltungs GmbH\nGesellschaft mit beschränkter Haftung\nBerlin\n\nZu Eintragungsnummer 3 vom 03.02.2026 wird als nicht eingetragen veröffentlicht: Den Gläubigern der an der Verschmelzung beteiligten Rechtsträger ist, wenn sie binnen sechs Monaten nach dem Tag, an dem die Eintragung der Verschmelzung in das Register des Sitzes desjenigen Rechtsträgers, dessen Gläubiger sie sind, als bekannt gemacht gilt, ihren Anspruch nach Grund und Höhe schriftlich anmelden, Sicherheit zu leisten, soweit sie nicht Befriedigung verlangen können. Dieses Recht steht den Gläubigern jedoch nur zu, wenn sie glaubhaft machen, dass durch die Verschmelzung die Erfüllung ihrer Forderung gefährdet wird. Das Recht, Sicherheitsleistung zu verlangen, steht Gläubigern nicht zu, die im Falle der Insolvenz ein Recht auf vorzugsweise Befriedigung aus einer Deckungsmasse haben, die nach gesetzlicher Vorschrift zu ihrem Schutz errichtet und staatlich überwacht ist."
    },
    {
      "date": "2026-02-04",
      "id": "144302",
      "original_text": "Registerbekanntmachung nach dem Umwandlungsgesetz\nBerlin Amtsgericht Berlin (Charlottenburg) HRB 77087\nStoffel Projekt GmbH – Berlin",
      "type": "Registerbekanntmachung nach dem Umwandlungsgesetz",
      "state": "Berlin",
      "amtsgericht": "Amtsgericht Berlin (Charlottenburg)",
      "registernummer": "HRB 77087",
      "registerart": "HRB",
      "company_name": "Stoffel Projekt GmbH",
      "company_seat": "Berlin",
      "details": "04.02.2026 (Bekanntmachungsdatum)\n\nBerlin Amtsgericht Berlin (Charlottenburg) HRB 77087\nRegisterbekanntmachung nach dem Umwandlungsgesetz 03.02.2026 (Eintragungsdatum)\n\nStoffel Projekt GmbH\nGesellschaft mit beschränkter Haftung\nBerlin\n\nZu Eintragungsnummer 14 vom 03.02.2026 wird als nicht eingetragen veröffentlicht: Den Gläubigern der an der Verschmelzung beteiligten Rechtsträger ist, wenn sie binnen sechs Monaten nach dem Tag, an dem die Eintragung der Verschmelzung in das Register des Sitzes desjenigen Rechtsträgers, dessen Gläubiger sie sind, als bekannt gemacht gilt, ihren Anspruch nach Grund und Höhe schriftlich anmelden, Sicherheit zu leisten, soweit sie nicht Befriedigung verlangen können. Dieses Recht steht den Gläubigern jedoch nur zu, wenn sie glaubhaft machen, dass durch die Verschmelzung die Erfüllung ihrer Forderung gefährdet wird. Das Recht, Sicherheitsleistung zu verlangen, steht Gläubigern nicht zu, die im Falle der Insolvenz ein Recht auf vorzugsweise Befriedigung aus einer Deckungsmasse haben, die nach gesetzlicher Vorschrift zu ihrem Schutz errichtet und staatlich überwacht ist."
    },
    {
      "date": "2026-02-04",
      "id": "144303",
      "original_text": "Löschungsankündigung\nBerlin Amtsgericht Berlin (Charlottenburg) HRB 199625\nFuture L.S.D. UG (haftungsbeschränkt) – Berlin",
      "type": "Löschungsankündigung",
      "state": "Berlin",
      "amtsgericht": "Amtsgericht Berlin (Charlottenburg)",
      "registernummer": "HRB 199625",
      "registerart": "HRB",
      "company_name": "Future L.S.D. UG (haftungsbeschränkt)",
      "company_seat": "Berlin",
      "details": "04.02.2026 (Bekanntmachungsdatum)\n\nBerlin Amtsgericht Berlin (Charlottenburg) HRB 199625\nLöschungsankündigung\n\nFuture L.S.D. UG (haftungsbeschränkt)\nGesellschaft mit beschränkter Haftung\nBerlin\n\nBei der nachstehenden Gesellschaft wird das Amtslöschungsverfahren gemäß § 394 FamFG eingeleitet. Widerspruchsfrist 6 Wochen"
    },
    {
      "date": "2026-02-04",
      "id": "144304",
      "original_text": "Löschungsankündigung\nBerlin Amtsgericht Berlin (Charlottenburg) HRB 250709\nObermann Bau GmbH – Berlin",
      "type": "Löschungsankündigung",
      "state": "Berlin",
      "amtsgericht": "Amtsgericht Berlin (Charlottenburg)",
      "registernummer": "HRB 250709",
      "registerart": "HRB",
      "company_name": "Obermann Bau GmbH",
      "company_seat": "Berlin",
      "details": "04.02.2026 (Bekanntmachungsdatum)\n\nBerlin Amtsgericht Berlin (Charlottenburg) HRB 250709\nLöschungsankündigung\n\nObermann Bau GmbH\nGesellschaft mit beschränkter Haftung\nBerlin\n\nBei der nachstehenden Gesellschaft wird das Amtslöschungsverfahren gemäß § 394 FamFG eingeleitet. Widerspruchsfrist 6 Wochen"
    },
    {
      "date": "2026-02-04",
      "id": "144305",
      "original_text": "Löschungsankündigung\nSchleswig-Holstein Amtsgericht Flensburg HRB 11670\nFrigo-Transport UG (haftungsbeschränkt) – Handewitt",
      "type": "Löschungsankündigung",
      "state": "Schleswig-Holstein",
      "amtsgericht": "Amtsgericht Flensburg",
      "registernummer": "HRB 11670",
      "registerart": "HRB",
      "company_name": "Frigo-Transport UG (haftungsbeschränkt)",
      "company_seat": "Handewitt",
      "details": "04.02.2026 (Bekanntmachungsdatum)\n\nSchleswig-Holstein Amtsgericht Flensburg HRB 11670\nLöschungsankündigung\n\nFrigo-Transport UG (haftungsbeschränkt)\nGesellschaft mit beschränkter Haftung\nHandewitt\n\nEs ist die Löschung der nachstehenden Gesellschaft wegen Vermögenslosigkeit gemäß § 394 FamFG beabsichtigt.\nWiderspruchsfrist: 2 Monate."
    },
    {
      "date": "2026-02-04",
      "id": "144306",
      "original_text": "Einreichung neuer Dokumente\nBerlin Amtsgericht Berlin (Charlottenburg) HRB 33198\nKATHARINENHOF Seniorenwohn- und Pflegeanlage Betriebs-GmbH – Berlin",
      "type": "Einreichung neuer Dokumente",
      "state": "Berlin",
      "amtsgericht": "Amtsgericht Berlin (Charlottenburg)",
      "registernummer": "HRB 33198",
      "registerart": "HRB",
      "company_name": "KATHARINENHOF Seniorenwohn- und Pflegeanlage Betriebs-GmbH",
      "company_seat": "Berlin",
      "details": "04.02.2026 (Bekanntmachungsdatum)\n\nBerlin Amtsgericht Berlin (Charlottenburg) HRB 33198\nEinreichung neuer Dokumente\n\nKATHARINENHOF Seniorenwohn- und Pflegeanlage Betriebs-GmbH\nGesellschaft mit beschränkter Haftung\nBerlin\n\nAls nicht eingetragen wird veröffentlicht:Es wurde eine neue Liste der Aufsichtsratsmitglieder eingereicht (§52 GmbHG)."
    },
    {
      "date": "2026-02-04",
      "id": "144307",
      "original_text": "Löschungsankündigung\nMecklenburg-Vorpommern Amtsgericht Rostock HRB 15570\nIBIS Haus GmbH – Bützow",
      "type": "Löschungsankündigung",
      "state": "Mecklenburg-Vorpommern",
      "amtsgericht": "Amtsgericht Rostock",
      "registernummer": "HRB 15570",
      "registerart": "HRB",
      "company_name": "IBIS Haus GmbH",
      "company_seat": "Bützow",
      "details": "04.02.2026 (Bekanntmachungsdatum)\n\nMecklenburg-Vorpommern Amtsgericht Rostock HRB 15570\nLöschungsankündigung\n\nIBIS Haus GmbH\nGesellschaft mit beschränkter Haftung\nBützow\n\nDas Registergericht beabsichtigt, die im Handelsregister eingetragene Gesellschaft von Amts wegen nach § 394 FamFG zu löschen. Die Frist zur Erhebung eines Widerspruchs gegen die beabsichtigte Löschung wird auf einen Monat festgesetzt."
    },
    {
      "date": "2026-02-04",
      "id": "144308",
      "original_text": "Löschungsankündigung\nBaden-Württemberg Amtsgericht Mannheim HRA 708316\nSessler Oberflächen GmbH & Co. KG – Keltern",
      "type": "Löschungsankündigung",
      "state": "Baden-Württemberg",
      "amtsgericht": "Amtsgericht Mannheim",
      "registernummer": "HRA 708316",
      "registerart": "HRA",
      "company_name": "Sessler Oberflächen GmbH & Co. KG",
      "company_seat": "Keltern",
      "details": "04.02.2026 (Bekanntmachungsdatum)\n\nBaden-Württemberg Amtsgericht Mannheim HRA 708316\nLöschungsankündigung 04.02.2026 (Eintragungsdatum)\n\nSessler Oberflächen GmbH & Co. KG\nKommanditgesellschaft\nKeltern\n\nDas Gericht beabsichtigt, die Gesellschaft wegen Vermögenslosigkeit im Handelsregister von Amts wegen nach § 394 FamFG zu löschen. Die Frist zur Geltendmachung eines Widerspruchs gegen die beabsichtigte Löschung ist auf einen Monat ab Veröffentlichung bestimmt."
    },
    {
      "date": "2026-02-04",
      "id": "144309",
      "original_text": "Einreichung neuer Dokumente\nBaden-Württemberg Amtsgericht Ulm HRB 3390\nMagirus GmbH – Ulm",
      "type": "Einreichung neuer Dokumente",
      "state": "Baden-Württemberg",
      "amtsgericht": "Amtsgericht Ulm",
      "registernummer": "HRB 3390",
      "registerart": "HRB",
      "company_name": "Magirus GmbH",
      "company_seat": "Ulm",
      "details": "04.02.2026 (Bekanntmachungsdatum)\n\nBaden-Württemberg Amtsgericht Ulm HRB 3390\nEinreichung neuer Dokumente\n\nMagirus GmbH\nGesellschaft mit beschränkter Haftung\nUlm\n\nDie Gesellschaft hat am 29.01.2026 die Liste über die Zusammensetzung des Aufsichtsrats zum Handelsregister eingereicht."
    },
    {
      "date": "2026-02-04",
      "id": "144310",
      "original_text": "Löschungsankündigung\nSachsen Amtsgericht Leipzig HRB 24207\nATTA & Co. GmbH – Leipzig",
      "type": "Löschungsankündigung",
      "state": "Sachsen",
      "amtsgericht": "Amtsgericht Leipzig",
      "registernummer": "HRB 24207",
      "registerart": "HRB",
      "company_name": "ATTA & Co. GmbH",
      "company_seat": "Leipzig",
      "details": "04.02.2026 (Bekanntmachungsdatum)\n\nSachsen Amtsgericht Leipzig HRB 24207\nLöschungsankündigung 04.02.2026 (Eintragungsdatum)\n\nATTA & Co. GmbH\nGesellschaft mit beschränkter Haftung\nLeipzig\n\nDas Registergericht beabsichtigt, die im Handelsregister eingetragene Gesellschaft von Amts wegen nach § 394 FamFG zu löschen. Die Frist zu Erhebung eines Widerspruchs gegen die beabsichtigte Löschung wird auf einen Monat festgesetzt."
    },
    {
      "date": "2026-02-04",
      "id": "144311",
      "original_text": "Registerbekanntmachung nach dem Umwandlungsgesetz\nSachsen Amtsgericht Leipzig HRB 30590\nAGAPLESION MITTELDEUTSCHLAND gemeinnützige GmbH – Leipzig",
      "type": "Registerbekanntmachung nach dem Umwandlungsgesetz",
      "state": "Sachsen",
      "amtsgericht": "Amtsgericht Leipzig",
      "registernummer": "HRB 30590",
      "registerart": "HRB",
      "company_name": "AGAPLESION MITTELDEUTSCHLAND gemeinnützige GmbH",
      "company_seat": "Leipzig",
      "details": "04.02.2026 (Bekanntmachungsdatum)\n\nSachsen Amtsgericht Leipzig HRB 30590\nRegisterbekanntmachung nach dem Umwandlungsgesetz 04.02.2026 (Eintragungsdatum)\n\nAGAPLESION MITTELDEUTSCHLAND gemeinnützige GmbH\nGesellschaft mit beschränkter Haftung\nLeipzig\n\nDen Gläubigern der an der Verschmelzung beteiligten Rechtsträger ist, wenn sie binnen sechs Monaten nach dem Tag, an dem die Eintragung der Verschmelzung in das Register des Sitzes desjenigen Rechtsträgers, dessen Gläubiger sie sind, nach § 19 Abs. 3 UmwG als bekannt gemacht gilt, ihren Anspruch nach Grund und Höhe in Textform anmelden, Sicherheit zu leisten, soweit sie nicht Befriedigung verlangen können. Dieses Recht steht den Gläubigern jedoch nur zu, wenn sie glaubhaft machen, dass durch die Verschmelzung die Erfüllung der Forderung gefährdet wird."
    },
    {
      "date": "2026-02-04",
      "id": "144312",
      "original_text": "Einreichung neuer Dokumente\nSachsen Amtsgericht Dresden HRB 1378\nElbe Flugzeugwerke GmbH – Dresden",
      "type": "Einreichung neuer Dokumente",
      "state": "Sachsen",
      "amtsgericht": "Amtsgericht Dresden",
      "registernummer": "HRB 1378",
      "registerart": "HRB",
      "company_name": "Elbe Flugzeugwerke GmbH",
      "company_seat": "Dresden",
      "details": "04.02.2026 (Bekanntmachungsdatum)\n\nSachsen Amtsgericht Dresden HRB 1378\nEinreichung neuer Dokumente 04.02.2026 (Eintragungsdatum)\n\nElbe Flugzeugwerke GmbH\nGesellschaft mit beschränkter Haftung\nDresden\n\nAm 03.02.2026 wurde beim Handelsregister des Amtsgerichts Dresden die Liste der Mitglieder des Aufsichtsrats gemäß § 52 GmbHG eingereicht."
    },
    {
      "date": "2026-02-04",
      "id": "144313",
      "original_text": "Registerbekanntmachung nach dem Umwandlungsgesetz\nSachsen Amtsgericht Dresden HRB 37259\nNewtron GmbH – Dresden",
      "type": "Registerbekanntmachung nach dem Umwandlungsgesetz",
      "state": "Sachsen",
      "amtsgericht": "Amtsgericht Dresden",
      "registernummer": "HRB 37259",
      "registerart": "HRB",
      "company_name": "Newtron GmbH",
      "company_seat": "Dresden",
      "details": "04.02.2026 (Bekanntmachungsdatum)\n\nSachsen Amtsgericht Dresden HRB 37259\nRegisterbekanntmachung nach dem Umwandlungsgesetz 04.02.2026 (Eintragungsdatum)\n\nNewtron GmbH\nGesellschaft mit beschränkter Haftung\nDresden\n\nDen Gläubigern der an der Verschmelzung beteiligten Rechtsträger ist, wenn sie binnen sechs Monaten nach dem Tag, an dem die Eintragung der Verschmelzung in das Register des Sitzes desjenigen Rechtsträgers, dessen Gläubiger sie sind, nach § 19 Abs. 3 UmwG als bekannt gemacht gilt, ihren Anspruch nach Grund und Höhe in Textform anmelden, Sicherheit zu leisten, soweit sie nicht Befriedigung verlangen können. Dieses Recht steht den Gläubigern jedoch nur zu, wenn sie glaubhaft machen, dass durch die Verschmelzung die Erfüllung der Forderung gefährdet wird."
    },
    {
      "date": "2026-02-04",
      "id": "144314",
      "original_text": "Löschungsankündigung\nSachsen Amtsgericht Dresden HRB 38580\nVIA Handelsagentur UG (haftungsbeschränkt) – Dresden",
      "type": "Löschungsankündigung",
      "state": "Sachsen",
      "amtsgericht": "Amtsgericht Dresden",
      "registernummer": "HRB 38580",
      "registerart": "HRB",
      "company_name": "VIA Handelsagentur UG (haftungsbeschränkt)",
      "company_seat": "Dresden",
      "details": "04.02.2026 (Bekanntmachungsdatum)\n\nSachsen Amtsgericht Dresden HRB 38580\nLöschungsankündigung\n\nVIA Handelsagentur UG (haftungsbeschränkt)\nGesellschaft mit beschränkter Haftung\nDresden\n\nDas Registergericht beabsichtigt, die im Handelsregister eingetragene Gesellschaft von Amts wegen nach § 394 FamFG zu löschen. Die Frist zu Erhebung eines Widerspruchs gegen die beabsichtigte Löschung wird auf einen Monat festgesetzt."
    },
    {
      "date": "2026-02-04",
      "id": "144315",
      "original_text": "Löschungsankündigung\nNiedersachsen Amtsgericht Tostedt HRA 205606\nMBSDB-Bauservice e.K. Inh. Dawid Wojciech Borowski – Neu Wulmstorf",
      "type": "Löschungsankündigung",
      "state": "Niedersachsen",
      "amtsgericht": "Amtsgericht Tostedt",
      "registernummer": "HRA 205606",
      "registerart": "HRA",
      "company_name": "MBSDB-Bauservice e.K. Inh. Dawid Wojciech Borowski",
      "company_seat": "Neu Wulmstorf",
      "details": "04.02.2026 (Bekanntmachungsdatum)\n\nNiedersachsen Amtsgericht Tostedt HRA 205606\nLöschungsankündigung\n\nMBSDB-Bauservice e.K. Inh. Dawid Wojciech Borowski\nEinzelkaufmann / Einzelkauffrau\nNeu Wulmstorf\n\nDas Registergericht beabsichtigt, die Firma von Amts wegen nach § 395 FamFG zu löschen. Die Frist zur Erhebung eines Widerspruchs ist auf 1 Monat ab dieser Registerbekanntmachung festgesetzt."
    },
    {
      "date": "2026-02-04",
      "id": "144316",
      "original_text": "Löschungsankündigung\nNiedersachsen Amtsgericht Hannover HRB 220740\nA.S.G Dienstleistungen UG (haftungsbeschränkt) – Langenhagen",
      "type": "Löschungsankündigung",
      "state": "Niedersachsen",
      "amtsgericht": "Amtsgericht Hannover",
      "registernummer": "HRB 220740",
      "registerart": "HRB",
      "company_name": "A.S.G Dienstleistungen UG (haftungsbeschränkt)",
      "company_seat": "Langenhagen",
      "details": "04.02.2026 (Bekanntmachungsdatum)\n\nNiedersachsen Amtsgericht Hannover HRB 220740\nLöschungsankündigung\n\nA.S.G Dienstleistungen UG (haftungsbeschränkt)\nGesellschaft mit beschränkter Haftung\nLangenhagen\n\nDas Registergericht beabsichtigt, die Gesellschaft von Amts wegen nach § 394 FamFG zu löschen. Die Frist zur Erhebung eines Widerspruchs ist auf 1 Monat ab dieser Registerbekanntmachung festgesetzt."
    },
    {
      "date": "2026-02-04",
      "id": "144317",
      "original_text": "Sonstige Registerbekanntmachung\nNiedersachsen Amtsgericht Braunschweig HRA 110596 früher Amtsgericht Goslar\nRats-Apotheke Dr. Wolfgang Albrecht e. K. – Clausthal-Zellerfeld",
      "type": "Sonstige Registerbekanntmachung",
      "state": "Niedersachsen",
      "amtsgericht": "Amtsgericht Braunschweig",
      "registernummer": "HRA 110596",
      "registerart": "HRA",
      "company_name": "Rats-Apotheke Dr. Wolfgang Albrecht e. K.",
      "company_seat": "Clausthal-Zellerfeld",
      "former_amtsgericht": "Goslar",
      "details": "04.02.2026 (Bekanntmachungsdatum)\n\nNiedersachsen Amtsgericht Braunschweig HRA 110596 früher Amtsgericht Goslar\nSonstige Registerbekanntmachung 04.02.2026 (Eintragungsdatum)\n\nRats-Apotheke Dr. Wolfgang Albrecht e. K.\nEinzelkaufmann / Einzelkauffrau\nClausthal-Zellerfeld\n\nDer Übergang der in dem Betriebe des Geschäfts entstandenen Verbindlichkeiten und Forderungen ist beim Erwerb des Geschäfts durch den neuen Inhaber ausgeschlossen."
    },
    {
      "date": "2026-02-04",
      "id": "144318",
      "original_text": "Einreichung neuer Dokumente\nNiedersachsen Amtsgericht Osnabrück HRB 17230\nIHH Industrie-+ Handels-Holding Aktiengesellschaft – Osnabrück",
      "type": "Einreichung neuer Dokumente",
      "state": "Niedersachsen",
      "amtsgericht": "Amtsgericht Osnabrück",
      "registernummer": "HRB 17230",
      "registerart": "HRB",
      "company_name": "IHH Industrie-+ Handels-Holding Aktiengesellschaft",
      "company_seat": "Osnabrück",
      "details": "04.02.2026 (Bekanntmachungsdatum)\n\nNiedersachsen Amtsgericht Osnabrück HRB 17230\nEinreichung neuer Dokumente\n\nIHH Industrie-+ Handels-Holding Aktiengesellschaft\nAktiengesellschaft\nOsnabrück\n\nDie Liste der Mitglieder des Aufsichtsrats wurde beim Registergericht eingereicht."
    },
    {
      "date": "2026-02-04",
      "id": "144319",
      "original_text": "Einreichung neuer Dokumente\nNiedersachsen Amtsgericht Braunschweig HRB 201389\nSAMASCH Aktiengesellschaft – Salzgitter-Bad",
      "type": "Einreichung neuer Dokumente",
      "state": "Niedersachsen",
      "amtsgericht": "Amtsgericht Braunschweig",
      "registernummer": "HRB 201389",
      "registerart": "HRB",
      "company_name": "SAMASCH Aktiengesellschaft",
      "company_seat": "Salzgitter-Bad",
      "details": "04.02.2026 (Bekanntmachungsdatum)\n\nNiedersachsen Amtsgericht Braunschweig HRB 201389\nEinreichung neuer Dokumente 04.02.2026 (Eintragungsdatum)\n\nSAMASCH Aktiengesellschaft\nAktiengesellschaft\nSalzgitter-Bad\n\nDie Liste der Mitglieder des Aufsichtsrats wurde beim Registergericht eingereicht."
    },
    {
      "date": "2026-02-04",
      "id": "144320",
      "original_text": "Einreichung neuer Dokumente\nBremen Amtsgericht Bremen HRB 36910\naffinis AG – Bremen",
      "type": "Einreichung neuer Dokumente",
      "state": "Bremen",
      "amtsgericht": "Amtsgericht Bremen",
      "registernummer": "HRB 36910",
      "registerart": "HRB",
      "company_name": "affinis AG",
      "company_seat": "Bremen",
      "details": "04.02.2026 (Bekanntmachungsdatum)\n\nBremen Amtsgericht Bremen HRB 36910\nEinreichung neuer Dokumente\n\naffinis AG\nAktiengesellschaft\nBremen\n\nAls nicht eingetragen wird veröffentlicht: Liste des Aufsichtsrats wurde eingereicht."
    },
    {
      "date": "2026-02-04",
      "id": "144321",
      "original_text": "Einreichung neuer Dokumente\nNordrhein-Westfalen Amtsgericht Köln HRB 115178\nEY ifb SE – Köln",
      "type": "Einreichung neuer Dokumente",
      "state": "Nordrhein-Westfalen",
      "amtsgericht": "Amtsgericht Köln",
      "registernummer": "HRB 115178",
      "registerart": "HRB",
      "company_name": "EY ifb SE",
      "company_seat": "Köln",
      "details": "04.02.2026 (Bekanntmachungsdatum)\n\nNordrhein-Westfalen Amtsgericht Köln HRB 115178\nEinreichung neuer Dokumente 04.02.2026 (Eintragungsdatum)\n\nEY ifb SE\nEuropäische Aktiengesellschaft (SE)\nKöln\n\nDem Registergericht ist eine neue Liste der Mitglieder des Aufsichtsrates eingereicht worden."
    },
    {
      "date": "2026-02-04",
      "id": "144322",
      "original_text": "Löschungsankündigung\nNordrhein-Westfalen Amtsgericht Krefeld HRB 14820\nElaboro Montagepartner GmbH – Krefeld",
      "type": "Löschungsankündigung",
      "state": "Nordrhein-Westfalen",
      "amtsgericht": "Amtsgericht Krefeld",
      "registernummer": "HRB 14820",
      "registerart": "HRB",
      "company_name": "Elaboro Montagepartner GmbH",
      "company_seat": "Krefeld",
      "details": "04.02.2026 (Bekanntmachungsdatum)\n\nNordrhein-Westfalen Amtsgericht Krefeld HRB 14820\nLöschungsankündigung\n\nElaboro Montagepartner GmbH\nGesellschaft mit beschränkter Haftung\nKrefeld\n\nDas Registergericht beabsichtigt die Gesellschaft von Amts wegen nach § 394 FamFG zu löschen. Die Frist zur Erhebung eines Widerspruchs ist auf einen Monat festgesetzt."
    },
    {
      "date": "2026-02-04",
      "id": "144323",
      "original_text": "Registerbekanntmachung nach dem Umwandlungsgesetz\nNordrhein-Westfalen Amtsgericht Steinfurt HRB 15845\nBolero Gießen GmbH – Emsdetten",
      "type": "Registerbekanntmachung nach dem Umwandlungsgesetz",
      "state": "Nordrhein-Westfalen",
      "amtsgericht": "Amtsgericht Steinfurt",
      "registernummer": "HRB 15845",
      "registerart": "HRB",
      "company_name": "Bolero Gießen GmbH",
      "company_seat": "Emsdetten",
      "details": "04.02.2026 (Bekanntmachungsdatum)\n\nNordrhein-Westfalen Amtsgericht Steinfurt HRB 15845\nRegisterbekanntmachung nach dem Umwandlungsgesetz 04.02.2026 (Eintragungsdatum)\n\nBolero Gießen GmbH\nGesellschaft mit beschränkter Haftung\nEmsdetten\n\nDen Gläubigern der an der Verschmelzung beteiligten Rechtsträger ist, wenn sie binnen sechs Monaten nach dem Tag, an dem die Eintragung der Verschmelzung in das Register des Sitzes derjenigen Rechtsträger deren Gläubiger sie sind, nach § 19 Absatz 3 UmwG als bekanntgemacht gilt, ihren Anspruch nach Grund und Höhe schriftlich anmelden, Sicherheit zu leisten, soweit sie nicht Befriedigung verlangen können. Dieses Recht steht den Gläubigern jedoch nur zu, wenn sie glaubhaft machen, dass durch die Verschmelzung die Erfüllung ihrer Forderung gefährdet wird."
    },
    {
      "date": "2026-02-04",
      "id": "144324",
      "original_text": "Einreichung neuer Dokumente\nNordrhein-Westfalen Amtsgericht Düsseldorf HRB 35978\nERGO Group AG – Düsseldorf",
      "type": "Einreichung neuer Dokumente",
      "state": "Nordrhein-Westfalen",
      "amtsgericht": "Amtsgericht Düsseldorf",
      "registernummer": "HRB 35978",
      "registerart": "HRB",
      "company_name": "ERGO Group AG",
      "company_seat": "Düsseldorf",
      "details": "04.02.2026 (Bekanntmachungsdatum)\n\nNordrhein-Westfalen Amtsgericht Düsseldorf HRB 35978\nEinreichung neuer Dokumente 04.02.2026 (Eintragungsdatum)\n\nERGO Group AG\nAktiengesellschaft\nDüsseldorf\n\nDem Registergericht ist eine neue Liste der Mitglieder des Aufsichtsrates eingereicht worden."
    },
    {
      "date": "2026-02-04",
      "id": "144325",
      "original_text": "Löschungsankündigung\nNordrhein-Westfalen Amtsgericht Aachen HRB 26405\nB.P.E. Experten GmbH – Herzogenrath",
      "type": "Löschungsankündigung",
      "state": "Nordrhein-Westfalen",
      "amtsgericht": "Amtsgericht Aachen",
      "registernummer": "HRB 26405",
      "registerart": "HRB",
      "company_name": "B.P.E. Experten GmbH",
      "company_seat": "Herzogenrath",
      "details": "04.02.2026 (Bekanntmachungsdatum)\n\nNordrhein-Westfalen Amtsgericht Aachen HRB 26405\nLöschungsankündigung\n\nB.P.E. Experten GmbH\nGesellschaft mit beschränkter Haftung\nHerzogenrath\n\nDas Registergericht beabsichtigt, von Amts wegen die Gesellschaft wegen Vermögenslosigkeit nach § 394 FamFG zu löschen.\n\nZur Geltendmachung des Widerspruchs gegen die beabsichtigte Löschung wird hiermit eine Frist von einem Monat ab Veröffentlichung dieser Ankündigung bestimmt.\n\nRechtsbehelfsbelehrung:\n\nGegen diese Verfügung kann Widerspruch eingelegt werden. Zum Widerspruch ist jeder berechtigt, der an der Unterlassung der Löschung ein berechtigtes Interesse hat.\n\nDer Widerspruch ist bei dem Amtsgericht Aachen, Adalbertsteinweg 92, 52070 Aachen schriftlich in deutscher Sprache oder zur Niederschrift der Geschäftsstelle einzulegen. Der Widerspruch kann auch zur Niederschrift der Geschäftsstelle eines jeden Amtsgerichtes abgegeben werden.\n\nDer Widerspruch muss spätestens innerhalb der gesetzten Frist nach der Bekanntgabe der Verfügung bei dem Amtsgericht Aachen eingegangen sein. Dies gilt auch dann, wenn der Widerspruch zur Niederschrift der Geschäftsstelle eines anderen Amtsgerichtes abgegeben wurde. Die Frist beginnt mit der Bekanntgabe der Verfügung durch Veröffentlichung. Fällt das Ende der Frist auf einen Sonntag, einen allgemeinen Feiertag oder Sonnabend, so endet die Frist mit Ablauf des nächsten Werktages.\n\nDer Widerspruch muss die Bezeichnung der angefochtenen Verfügung sowie die Erklärung enthalten, dass Widerspruch gegen diese Verfügung eingelegt wird. Er ist zu unterzeichnen und soll begründet werden.\n\nDie Einlegung ist auch durch Übertragung eines elektronischen Dokuments an die elektronische Poststelle des Gerichts möglich. Das elektronische Dokument muss für die Bearbeitung durch das Gericht geeignet und mit einer qualifizierten elektronischen Signatur der verantwortenden Person versehen sein oder von der verantwortenden Person signiert und auf einem sicheren Übermittlungsweg gemäß § 130 a ZPO nach näherer Maßgabe der Verordnung über die technischen Rahmenbedingungen des elektronischen Rechtsverkehrs und über das besondere elektronische Behördenpostfach (BGBl. I, S. 3803) eingereicht werden. Weitere Informationen erhalten Sie auf der Internetseite www.justiz.de."
    },
    {
      "date": "2026-02-04",
      "id": "144326",
      "original_text": "Registerbekanntmachung nach dem Umwandlungsgesetz\nNordrhein-Westfalen Amtsgericht Köln HRA 38333\nSemaco Financing e. K. – Hürth",
      "type": "Registerbekanntmachung nach dem Umwandlungsgesetz",
      "state": "Nordrhein-Westfalen",
      "amtsgericht": "Amtsgericht Köln",
      "registernummer": "HRA 38333",
      "registerart": "HRA",
      "company_name": "Semaco Financing e. K.",
      "company_seat": "Hürth",
      "details": "04.02.2026 (Bekanntmachungsdatum)\n\nNordrhein-Westfalen Amtsgericht Köln HRA 38333\nRegisterbekanntmachung nach dem Umwandlungsgesetz 04.02.2026 (Eintragungsdatum)\n\nSemaco Financing e. K.\nEinzelkaufmann / Einzelkauffrau\nHürth\n\nDie Gesellschaft hat Gläubigern, deren Forderungen vor dieser Bekanntmachung begründet worden sind, Sicherheit zu leisten, soweit sie nicht Befriedigung verlangen können, wenn sie sich binnen sechs Monaten zu diesem Zweck melden."
    },
    {
      "date": "2026-02-04",
      "id": "144327",
      "original_text": "Löschungsankündigung\nNordrhein-Westfalen Amtsgericht Wuppertal HRB 20387\nTransport-Kühlungen Decker & Gottschalk GmbH – Remscheid",
      "type": "Löschungsankündigung",
      "state": "Nordrhein-Westfalen",
      "amtsgericht": "Amtsgericht Wuppertal",
      "registernummer": "HRB 20387",
      "registerart": "HRB",
      "company_name": "Transport-Kühlungen Decker & Gottschalk GmbH",
      "company_seat": "Remscheid",
      "details": "04.02.2026 (Bekanntmachungsdatum)\n\nNordrhein-Westfalen Amtsgericht Wuppertal HRB 20387\nLöschungsankündigung\n\nTransport-Kühlungen Decker & Gottschalk GmbH\nGesellschaft mit beschränkter Haftung\nRemscheid\n\nDas Registergericht beabsichtigt die Gesellschaft von Amts wegen nach § 394 FamFG zu löschen. Die Frist zur Erhebung eines Widerspruchs ist auf einen Monat festgesetzt."
    },
    {
      "date": "2026-02-04",
      "id": "144328",
      "original_text": "Registerbekanntmachung nach dem Umwandlungsgesetz\nNordrhein-Westfalen Amtsgericht Essen HRB 24420\ncommunicode AG – Essen",
      "type": "Registerbekanntmachung nach dem Umwandlungsgesetz",
      "state": "Nordrhein-Westfalen",
      "amtsgericht": "Amtsgericht Essen",
      "registernummer": "HRB 24420",
      "registerart": "HRB",
      "company_name": "communicode AG",
      "company_seat": "Essen",
      "details": "04.02.2026 (Bekanntmachungsdatum)\n\nNordrhein-Westfalen Amtsgericht Essen HRB 24420\nRegisterbekanntmachung nach dem Umwandlungsgesetz 04.02.2026 (Eintragungsdatum)\n\ncommunicode AG\nAktiengesellschaft\nEssen\n\nDen Gläubigern der an der formwechselnden Umwandlung beteiligten Rechtsträger ist, wenn sie binnen sechs Monaten nach dem Tag, an dem die Eintragung der formwechselnden Umwandlung in das Register des Sitzes desjenigen Rechtsträgers, dessen Gläubiger sie sind, nach § 19 Absatz 3 UmwG als bekanntgemacht gilt, ihren Anspruch nach Grund und Höhe schriftlich anmelden, Sicherheit zu leisten, soweit sie nicht Befriedigung verlangen können. Dieses Recht steht den Gläubigern jedoch nur zu, wenn sie glaubhaft machen, dass durch die formwechselnden Umwandlung die Erfüllung ihrer Forderung gefährdet wird."
    },
    {
      "date": "2026-02-04",
      "id": "144329",
      "original_text": "Registerbekanntmachung nach dem Umwandlungsgesetz\nNordrhein-Westfalen Amtsgericht Köln HRB 126555\nSemaco Financing GmbH – Leverkusen",
      "type": "Registerbekanntmachung nach dem Umwandlungsgesetz",
      "state": "Nordrhein-Westfalen",
      "amtsgericht": "Amtsgericht Köln",
      "registernummer": "HRB 126555",
      "registerart": "HRB",
      "company_name": "Semaco Financing GmbH",
      "company_seat": "Leverkusen",
      "details": "04.02.2026 (Bekanntmachungsdatum)\n\nNordrhein-Westfalen Amtsgericht Köln HRB 126555\nRegisterbekanntmachung nach dem Umwandlungsgesetz 04.02.2026 (Eintragungsdatum)\n\nSemaco Financing GmbH\nGesellschaft mit beschränkter Haftung\nLeverkusen\n\nDen Gläubigern der an der Ausgliederung beteiligten Rechtsträger ist, wenn sie binnen sechs Monaten nach dem Tag, an dem die Eintragung der Ausgliederung in das Register des Sitzes desjenigen Rechtsträgers, dessen Gläubiger sie sind, nach § 19 Absatz 3 UmwG als bekanntgemacht gilt, ihren Anspruch nach Grund und Höhe schriftlich anmelden, Sicherheit zu leisten, soweit sie nicht Befriedigung verlangen können. Dieses Recht steht den Gläubigern jedoch nur zu, wenn sie glaubhaft machen, dass durch die Ausgliederung die Erfüllung ihrer Forderung gefährdet wird."
    },
    {
      "date": "2026-02-04",
      "id": "144330",
      "original_text": "Registerbekanntmachung nach dem Umwandlungsgesetz\nNordrhein-Westfalen Amtsgericht Düsseldorf HRB 46889\nGraul D/S/T GmbH – Hilden",
      "type": "Registerbekanntmachung nach dem Umwandlungsgesetz",
      "state": "Nordrhein-Westfalen",
      "amtsgericht": "Amtsgericht Düsseldorf",
      "registernummer": "HRB 46889",
      "registerart": "HRB",
      "company_name": "Graul D/S/T GmbH",
      "company_seat": "Hilden",
      "details": "04.02.2026 (Bekanntmachungsdatum)\n\nNordrhein-Westfalen Amtsgericht Düsseldorf HRB 46889\nRegisterbekanntmachung nach dem Umwandlungsgesetz 04.02.2026 (Eintragungsdatum)\n\nGraul D/S/T GmbH\nGesellschaft mit beschränkter Haftung\nHilden\n\nDen Gläubigern der an der Verschmelzung beteiligten Rechtsträger ist, wenn sie binnen sechs Monaten nach dem Tag, an dem die Eintragung der Verschmelzung in das Register des Sitzes desjenigen Rechtsträgers, dessen Gläubiger sie sind, nach § 19 Absatz 3 UmwG als bekanntgemacht gilt, ihren Anspruch nach Grund und Höhe schriftlich anmelden, Sicherheit zu leisten, soweit sie nicht Befriedigung verlangen können. Dieses Recht steht den Gläubigern jedoch nur zu, wenn sie glaubhaft machen, dass durch die Verschmelzung die Erfüllung ihrer Forderung gefährdet wird."
    },
    {
      "date": "2026-02-04",
      "id": "144331",
      "original_text": "Registerbekanntmachung nach dem Umwandlungsgesetz\nNordrhein-Westfalen Amtsgericht Siegen HRB 12595\nWayma GmbH – Olpe",
      "type": "Registerbekanntmachung nach dem Umwandlungsgesetz",
      "state": "Nordrhein-Westfalen",
      "amtsgericht": "Amtsgericht Siegen",
      "registernummer": "HRB 12595",
      "registerart": "HRB",
      "company_name": "Wayma GmbH",
      "company_seat": "Olpe",
      "details": "04.02.2026 (Bekanntmachungsdatum)\n\nNordrhein-Westfalen Amtsgericht Siegen HRB 12595\nRegisterbekanntmachung nach dem Umwandlungsgesetz 04.02.2026 (Eintragungsdatum)\n\nWayma GmbH\nGesellschaft mit beschränkter Haftung\nOlpe\n\nDen Gläubigern der an der Verschmelzung beteiligten Rechtsträger ist, wenn sie binnen sechs Monaten nach dem Tag, an dem die Eintragung der Verschmelzung in das Register des Sitzes derjenigen Rechtsträger deren Gläubiger sie sind, nach § 19 Absatz 3 UmwG als bekanntgemacht gilt, ihren Anspruch nach Grund und Höhe schriftlich anmelden, Sicherheit zu leisten, soweit sie nicht Befriedigung verlangen können. Dieses Recht steht den Gläubigern jedoch nur zu, wenn sie glaubhaft machen, dass durch die Verschmelzung die Erfüllung ihrer Forderung gefährdet wird."
    },
    {
      "date": "2026-02-04",
      "id": "144332",
      "original_text": "Löschungsankündigung\nNordrhein-Westfalen Amtsgericht Wuppertal HRB 24077\nSUPERIOR Gastro-Consulting UG (haftungsbeschränkt) – Wuppertal",
      "type": "Löschungsankündigung",
      "state": "Nordrhein-Westfalen",
      "amtsgericht": "Amtsgericht Wuppertal",
      "registernummer": "HRB 24077",
      "registerart": "HRB",
      "company_name": "SUPERIOR Gastro-Consulting UG (haftungsbeschränkt)",
      "company_seat": "Wuppertal",
      "details": "04.02.2026 (Bekanntmachungsdatum)\n\nNordrhein-Westfalen Amtsgericht Wuppertal HRB 24077\nLöschungsankündigung\n\nSUPERIOR Gastro-Consulting UG (haftungsbeschränkt)\nGesellschaft mit beschränkter Haftung\nWuppertal\n\nDas Registergericht beabsichtigt die Gesellschaft von Amts wegen nach § 394 FamFG zu löschen. Die Frist zur Erhebung eines Widerspruchs ist auf einen Monat festgesetzt."
    },
    {
      "date": "2026-02-04",
      "id": "144333",
      "original_text": "Einreichung neuer Dokumente\nNordrhein-Westfalen Amtsgericht Wuppertal HRB 2367\nWSW Energie & Wasser AG – Wuppertal",
      "type": "Einreichung neuer Dokumente",
      "state": "Nordrhein-Westfalen",
      "amtsgericht": "Amtsgericht Wuppertal",
      "registernummer": "HRB 2367",
      "registerart": "HRB",
      "company_name": "WSW Energie & Wasser AG",
      "company_seat": "Wuppertal",
      "details": "04.02.2026 (Bekanntmachungsdatum)\n\nNordrhein-Westfalen Amtsgericht Wuppertal HRB 2367\nEinreichung neuer Dokumente 04.02.2026 (Eintragungsdatum)\n\nWSW Energie & Wasser AG\nAktiengesellschaft\nWuppertal\n\nDem Registergericht ist eine Liste der Mitglieder des Aufsichtsrates eingereicht worden."
    },
    {
      "date": "2026-02-04",
      "id": "144334",
      "original_text": "Löschungsankündigung\nNordrhein-Westfalen Amtsgericht Gelsenkirchen HRB 17614\nKeller GmbH – Bottrop",
      "type": "Löschungsankündigung",
      "state": "Nordrhein-Westfalen",
      "amtsgericht": "Amtsgericht Gelsenkirchen",
      "registernummer": "HRB 17614",
      "registerart": "HRB",
      "company_name": "Keller GmbH",
      "company_seat": "Bottrop",
      "details": "04.02.2026 (Bekanntmachungsdatum)\n\nNordrhein-Westfalen Amtsgericht Gelsenkirchen HRB 17614\nLöschungsankündigung\n\nKeller GmbH\nGesellschaft mit beschränkter Haftung\nBottrop\n\nDas Gericht beabsichtigt, die Gesellschaft Keller GmbH mit Sitz in Bottrop, HRB\n17614 Amtsgericht Gelsenkirchen, wegen Vermögenslosigkeit zu löschen.\nHiermit wird denjenigen, die an der Unterlassung der Löschung ein berechtigtes\nInteresse haben, gem. § 394 Abs. 2 FamFG Gelegenheit gegeben, gegen dieses\nVorhaben binnen eines Monats nach dieser Bekanntmachung Widerspruch\neinzulegen. Der Widerspruch kann schriftlich oder zu Protokoll der\nGeschäftsstelle erhoben werden."
    },
    {
      "date": "2026-02-04",
      "id": "144335",
      "original_text": "Löschungsankündigung\nNordrhein-Westfalen Amtsgericht Siegburg HRB 12167\nNuradini-Bauunternehmung UG (haftungsbeschränkt) – Sankt Augustin",
      "type": "Löschungsankündigung",
      "state": "Nordrhein-Westfalen",
      "amtsgericht": "Amtsgericht Siegburg",
      "registernummer": "HRB 12167",
      "registerart": "HRB",
      "company_name": "Nuradini-Bauunternehmung UG (haftungsbeschränkt)",
      "company_seat": "Sankt Augustin",
      "details": "04.02.2026 (Bekanntmachungsdatum)\n\nNordrhein-Westfalen Amtsgericht Siegburg HRB 12167\nLöschungsankündigung\n\nNuradini-Bauunternehmung UG (haftungsbeschränkt)\nGesellschaft mit beschränkter Haftung\nSankt Augustin\n\nDas Registergericht hat glaubhafte Kenntnis erlangt, dass die Gesellschaft vermögenslos geworden ist, da ein Insolvenzverfahren durchgeführt und nach\n§ 200 InsO aufgehoben wurde.\n\nEs ist daher beabsichtigt, die Gesellschaft nach § 394 FamFG im\nHandelsregister wegen Vermögenslosigkeit zu löschen.\nEinwände gegen die Löschung sind durch Widerspruch binnen einer Frist von\n3 Monaten geltend zu machen, andernfalls die Löschung erfolgen wird.\n\nEinzulegen ist der Widerspruch bei dem Amtsgericht Siegburg, Neue\nPoststraße 16, 53721 Siegburg, und zwar entweder schriftlich in deutscher\nSprache oder mündlich zur Niederschrift der Geschäftsstelle. Der\nWiderspruch kann auch zur Niederschrift der Geschäftsstelle eines jeden\nAmtsgerichts abgegeben werden. Der Widerspruch ist binnen der in der\nVerfügung bestimmten Frist einzulegen. Die Frist ist nur gewahrt, wenn der\nWiderspruch rechtzeitig bei dem Amtsgericht Siegburg eingeht, auch wenn\nder Widerspruch zur Niederschrift der Geschäftsstelle eines anderen\nAmtsgerichts abgegeben wurde. Die Frist beginnt jeweils mit der schriftlichen\nBekanntgabe der Verfügung an die Beteiligten. Kann die schriftliche\nBekanntgabe an einen Beteiligten nicht bewirkt werden, beginnt die Frist\nspätestens mit Ablauf von fünf Monaten nach Erlass der Verfügung. Die\nBekanntgabe ist entweder durch Zustellung oder am dritten Tage nach\nAufgabe zur Post bewirkt. Sofern die Löschung noch nicht erfolgt ist, kann der\nWiderspruch auch noch nach Ablauf der Frist eingelegt werden. Fällt das\nEnde der Frist auf einen Sonnabend, einen Sonntag oder einen allgemeinen\nFeiertag, endet die Frist mit Ablauf des nächsten Werktages. Der\nWiderspruch ist zu unterzeichnen. Eine Begründung des Widerspruchs ist\nnicht vorgeschrieben."
    },
    {
      "date": "2026-02-04",
      "id": "144336",
      "original_text": "Registerbekanntmachung nach dem Umwandlungsgesetz\nNordrhein-Westfalen Amtsgericht Essen HRB 37643\ncommunicode GmbH – Essen",
      "type": "Registerbekanntmachung nach dem Umwandlungsgesetz",
      "state": "Nordrhein-Westfalen",
      "amtsgericht": "Amtsgericht Essen",
      "registernummer": "HRB 37643",
      "registerart": "HRB",
      "company_name": "communicode GmbH",
      "company_seat": "Essen",
      "details": "04.02.2026 (Bekanntmachungsdatum)\n\nNordrhein-Westfalen Amtsgericht Essen HRB 37643\nRegisterbekanntmachung nach dem Umwandlungsgesetz 04.02.2026 (Eintragungsdatum)\n\ncommunicode GmbH\nGesellschaft mit beschränkter Haftung\nEssen\n\nDen Gläubigern der an der formwechselnden Umwandlung beteiligten Rechtsträger ist, wenn sie binnen sechs Monaten nach dem Tag, an dem die Eintragung der formwechselnden Umwandlung in das Register des Sitzes desjenigen Rechtsträgers, dessen Gläubiger sie sind, nach § 19 Absatz 3 UmwG als bekanntgemacht gilt, ihren Anspruch nach Grund und Höhe schriftlich anmelden, Sicherheit zu leisten, soweit sie nicht Befriedigung verlangen können. Dieses Recht steht den Gläubigern jedoch nur zu, wenn sie glaubhaft machen, dass durch die formwechselnden Umwandlung die Erfüllung ihrer Forderung gefährdet wird."
    },
    {
      "date": "2026-02-04",
      "id": "144337",
      "original_text": "Löschungsankündigung\nNordrhein-Westfalen Amtsgericht Mönchengladbach HRB 22283\nAM - Projektmanagement GmbH – Hückelhoven",
      "type": "Löschungsankündigung",
      "state": "Nordrhein-Westfalen",
      "amtsgericht": "Amtsgericht Mönchengladbach",
      "registernummer": "HRB 22283",
      "registerart": "HRB",
      "company_name": "AM - Projektmanagement GmbH",
      "company_seat": "Hückelhoven",
      "details": "04.02.2026 (Bekanntmachungsdatum)\n\nNordrhein-Westfalen Amtsgericht Mönchengladbach HRB 22283\nLöschungsankündigung\n\nAM - Projektmanagement GmbH\nGesellschaft mit beschränkter Haftung\nHückelhoven\n\nDas Registergericht beabsichtigt, die im Handelsregister eingetragene Gesellschaft gemäß § 394 Absatz 1 FamFG wegen Vermögenslosigkeit von Amts wegen zu löschen. Gegen diese Verfügung kann Widerspruch eingelegt werden. Die Frist zur Erhebung eines Widerspruchs gegen die beabsichtigte Löschung von Amts wegen ist auf drei Monate festgesetzt."
    },
    {
      "date": "2026-02-04",
      "id": "144338",
      "original_text": "Löschungsankündigung\nNordrhein-Westfalen Amtsgericht Düsseldorf HRB 38840\nNRP IMMOBILIEN AG – Düsseldorf",
      "type": "Löschungsankündigung",
      "state": "Nordrhein-Westfalen",
      "amtsgericht": "Amtsgericht Düsseldorf",
      "registernummer": "HRB 38840",
      "registerart": "HRB",
      "company_name": "NRP IMMOBILIEN AG",
      "company_seat": "Düsseldorf",
      "details": "04.02.2026 (Bekanntmachungsdatum)\n\nNordrhein-Westfalen Amtsgericht Düsseldorf HRB 38840\nLöschungsankündigung\n\nNRP IMMOBILIEN AG\nAktiengesellschaft\nDüsseldorf\n\nDas Registergericht beabsichtigt die Gesellschaft von Amts wegen nach § 394 Abs. 1 FamFG zu löschen. Die Frist zur Erhebung eines Widerspruchs ist auf 3 Wochen festgesetzt.\n\nRechtsbehelfsbelehrung:\nDas Widerspruchsrecht steht jedem zu, der an der Unterlassung der Löschung ein berechtigtes Interesse hat. Der Widerspruch ist bei dem Amtsgericht Düsseldorf -Registergericht-, Werdener Straße 1, 40227 Düsseldorf schriftlich in deutscher Sprache oder zur Niederschrift der Geschäftsstelle einzulegen. Der Widerspruch kann auch zur Niederschrift der Geschäftsstelle eines jeden Amtsgerichtes abgegeben werden. Die Einlegung ist auch durch Übertragung eines elektronischen Dokuments an die elektronische Poststelle des Gerichts möglich. Das elektronische Dokument muss für die Bearbeitung durch das Gericht geeignet und mit einer qualifizierten elektronischen Signatur der verantwortenden Person versehen sein oder von der verantwortenden Person signiert und auf einem sicheren Übermittlungsweg gemäß § 130a ZPO nach näherer Maßgabe der Verordnung über die technischen Rahmenbedingungen des elektronischen Rechtsverkehrs und über das besondere elektronische Behördenpostfach (BGBl. I, S.3803) eingereicht werden. Weitere Informationen erhalten Sie auf der Internetseite www.justiz.de.\nDer Widerspruch muss spätestens innerhalb der gesetzten Frist nach dem Datum der Bekanntmachung der Löschungsankündigung bei dem Amtsgericht - Registergericht - Düsseldorf eingegangen sein.  Dies gilt auch dann, wenn der Widerspruch zur Niederschrift der Geschäftsstelle eines anderen Amtsgerichtes abgegeben wurde. Die Frist beginnt mit dem Tage der Bekanntmachung der Löschungsankündigung in dem für die Bekanntmachung der Eintragungen in das Handelsregister bestimmten elektronischen Informations- und Kommunikationssystem nach § 10 des Handelsgesetzbuches. Fällt das Ende der Frist auf einen Sonntag, einen allgemeinen Feiertag oder Sonnabend, so endet die Frist mit Ablauf des nächsten Werktages.\nDer Widerspruch muss die Bezeichnung der angefochtenen Löschungsankündigung sowie die Erklärung enthalten, dass Widerspruch gegen diese Löschungsankündigung eingelegt wird. Er ist zu unterzeichnen und soll begründet werden."
    },
    {
      "date": "2026-02-04",
      "id": "144339",
      "original_text": "Löschungsankündigung\nNordrhein-Westfalen Amtsgericht Neuss HRB 21601\nMBD Bau GmbH – Meerbusch",
      "type": "Löschungsankündigung",
      "state": "Nordrhein-Westfalen",
      "amtsgericht": "Amtsgericht Neuss",
      "registernummer": "HRB 21601",
      "registerart": "HRB",
      "company_name": "MBD Bau GmbH",
      "company_seat": "Meerbusch",
      "details": "04.02.2026 (Bekanntmachungsdatum)\n\nNordrhein-Westfalen Amtsgericht Neuss HRB 21601\nLöschungsankündigung 04.02.2026 (Eintragungsdatum)\n\nMBD Bau GmbH\nGesellschaft mit beschränkter Haftung\nMeerbusch\n\nEs ist beabsichtigt, die Gesellschaft wegen Vermögenslosigkeit aufgrund des § 394 Abs. 1 FamFG zu löschen. Frist zur Geltendmachung eines Widerspruchs: 1 Monat.\nRechtsbehelfsbelehrung:\nGegen diese Verfügung können Sie Widerspruch einlegen.\nDer Widerspruch ist bei dem Amtsgericht Neuss - Registergericht -, Breite Str.\n48, 41460 Neuss schriftlich in deutscher Sprache oder zur Niederschrift der\nGeschäftsstelle einzulegen.\nDer Widerspruch kann auch zur Niederschrift der Geschäftsstelle eines jeden\nAmtsgerichtes abgegeben werden.\nDie Einlegung ist auch durch Übertragung eines elektronischen Dokuments an die\nelektronische Poststelle des Gerichts möglich. Das elektronische Dokument muss für\ndie Bearbeitung durch das Gericht geeignet und mit einer qualifizierten\nelektronischen Signatur der verantwortenden Person versehen sein oder von der\nverantwortenden Person signiert und auf einem sicheren Übermittlungsweg gemäß §\n130a ZPO nach näherer Maßgabe der Verordnung über die technischen\nRahmenbedingungen des elektronischen Rechtsverkehrs und über das besondere\nelektronische Behördenpostfach (BGBl. I, S.3803) eingereicht werden. Weitere\nInformationen erhalten Sie auf der Internetseite www.justiz.de.\nDer Widerspruch muss spätestens innerhalb der gesetzten Frist nach der\nschriftlichen Bekanntgabe der Verfügung bei dem Amtsgericht - Registergericht -\nNeuss eingegangen sein. Dies gilt auch dann, wenn der Widerspruch zur\nNiederschrift der Geschäftsstelle eines anderen Amtsgerichtes abgegeben wurde.\nDie Frist beginnt mit der schriftlichen Bekanntgabe der Verfügung. Die Bekanntgabe ist entweder durch Zustellung oder am dritten Tage nach Aufgabe zur Post bewirkt.Fällt das Ende der Frist auf einen Sonntag, einen allgemeinen Feiertag oder Sonnabend, so endet die Frist mit Ablauf des nächsten Werktages.\nDer Widerspruch muss die Bezeichnung der angefochtenen Verfügung sowie die Erklärung enthalten, dass Widerspruch gegen diese Verfügung eingelegt wird. Er ist zu unterzeichnen und soll begründet werden."
    },
    {
      "date": "2026-02-04",
      "id": "144340",
      "original_text": "Löschungsankündigung\nNordrhein-Westfalen Amtsgericht Krefeld HRB 6760\nEMS Medienservice GmbH – Krefeld",
      "type": "Löschungsankündigung",
      "state": "Nordrhein-Westfalen",
      "amtsgericht": "Amtsgericht Krefeld",
      "registernummer": "HRB 6760",
      "registerart": "HRB",
      "company_name": "EMS Medienservice GmbH",
      "company_seat": "Krefeld",
      "details": "04.02.2026 (Bekanntmachungsdatum)\n\nNordrhein-Westfalen Amtsgericht Krefeld HRB 6760\nLöschungsankündigung\n\nEMS Medienservice GmbH\nGesellschaft mit beschränkter Haftung\nKrefeld\n\nDas Registergericht beabsichtigt die Gesellschaft von Amts wegen nach § 394 FamFG zu löschen. Die Frist zur Erhebung eines Widerspruchs ist auf einen Monat festgesetzt."
    },
    {
      "date": "2026-02-04",
      "id": "144341",
      "original_text": "Löschungsankündigung\nNordrhein-Westfalen Amtsgericht Köln HRB 77688\nRV - Rheinische Verpackungs GmbH – Köln",
      "type": "Löschungsankündigung",
      "state": "Nordrhein-Westfalen",
      "amtsgericht": "Amtsgericht Köln",
      "registernummer": "HRB 77688",
      "registerart": "HRB",
      "company_name": "RV - Rheinische Verpackungs GmbH",
      "company_seat": "Köln",
      "details": "04.02.2026 (Bekanntmachungsdatum)\n\nNordrhein-Westfalen Amtsgericht Köln HRB 77688\nLöschungsankündigung\n\nRV - Rheinische Verpackungs GmbH\nGesellschaft mit beschränkter Haftung\nKöln\n\nDas Registergericht beabsichtigt die Gesellschaft von Amts wegen nach § 394 FamFG zu löschen. Die Frist zur Erhebung eines Widerspruchs ist auf einen Monat festgesetzt."
    },
    {
      "date": "2026-02-04",
      "id": "144342",
      "original_text": "Einreichung neuer Dokumente\nNordrhein-Westfalen Amtsgericht Köln HRB 2114\nGEW Köln AG – Köln",
      "type": "Einreichung neuer Dokumente",
      "state": "Nordrhein-Westfalen",
      "amtsgericht": "Amtsgericht Köln",
      "registernummer": "HRB 2114",
      "registerart": "HRB",
      "company_name": "GEW Köln AG",
      "company_seat": "Köln",
      "details": "04.02.2026 (Bekanntmachungsdatum)\n\nNordrhein-Westfalen Amtsgericht Köln HRB 2114\nEinreichung neuer Dokumente 04.02.2026 (Eintragungsdatum)\n\nGEW Köln AG\nAktiengesellschaft\nKöln\n\nDem Registergericht ist eine neue Liste der Mitglieder des Aufsichtsrates eingereicht worden."
    },
    {
      "date": "2026-02-04",
      "id": "144343",
      "original_text": "Registerbekanntmachung nach dem Umwandlungsgesetz\nNordrhein-Westfalen Amtsgericht Hagen HRA 6619\nSanitätsdienste & Brandschutz NRW Michael Maurer e.K., Inh. Michael Maurer – Hagen",
      "type": "Registerbekanntmachung nach dem Umwandlungsgesetz",
      "state": "Nordrhein-Westfalen",
      "amtsgericht": "Amtsgericht Hagen",
      "registernummer": "HRA 6619",
      "registerart": "HRA",
      "company_name": "Sanitätsdienste & Brandschutz NRW Michael Maurer e.K., Inh. Michael Maurer",
      "company_seat": "Hagen",
      "details": "04.02.2026 (Bekanntmachungsdatum)\n\nNordrhein-Westfalen Amtsgericht Hagen HRA 6619\nRegisterbekanntmachung nach dem Umwandlungsgesetz 04.02.2026 (Eintragungsdatum)\n\nSanitätsdienste & Brandschutz NRW Michael Maurer e.K., Inh. Michael Maurer\nEinzelkaufmann / Einzelkauffrau\nHagen\n\nDen Gläubigern der an der Ausgliederung beteiligten Rechtsträger ist, wenn sie binnen sechs Monaten nach dem Tag, an dem die Eintragung der Ausgliederung in das Register des Sitzes desjenigen Rechtsträgers, dessen Gläubiger sie sind, nach § 19 Absatz 3 UmwG als bekanntgemacht gilt, ihren Anspruch nach Grund und Höhe schriftlich anmelden, Sicherheit zu leisten, soweit sie nicht Befriedigung verlangen können. Dieses Recht steht den Gläubigern jedoch nur zu, wenn sie glaubhaft machen, dass durch die Ausgliederung die Erfüllung ihrer Forderung gefährdet wird."
    },
    {
      "date": "2026-02-04",
      "id": "144344",
      "original_text": "Einreichung neuer Dokumente\nNordrhein-Westfalen Amtsgericht Arnsberg HRB 4939\nWSG Menden Wirtschaftsförderungs- und Stadtentwicklungsgesellschaft Menden GmbH – Menden",
      "type": "Einreichung neuer Dokumente",
      "state": "Nordrhein-Westfalen",
      "amtsgericht": "Amtsgericht Arnsberg",
      "registernummer": "HRB 4939",
      "registerart": "HRB",
      "company_name": "WSG Menden Wirtschaftsförderungs- und Stadtentwicklungsgesellschaft Menden GmbH",
      "company_seat": "Menden",
      "details": "04.02.2026 (Bekanntmachungsdatum)\n\nNordrhein-Westfalen Amtsgericht Arnsberg HRB 4939\nEinreichung neuer Dokumente 04.02.2026 (Eintragungsdatum)\n\nWSG Menden Wirtschaftsförderungs- und Stadtentwicklungsgesellschaft Menden GmbH\nGesellschaft mit beschränkter Haftung\nMenden\n\nDem Registergericht ist eine neue Liste der Mitglieder des Aufsichtsrates eingereicht worden."
    },
    {
      "date": "2026-02-04",
      "id": "144345",
      "original_text": "Registerbekanntmachung nach dem Umwandlungsgesetz\nThüringen Amtsgericht Jena HRB 111720\nK & E - Technik GmbH – Kölleda",
      "type": "Registerbekanntmachung nach dem Umwandlungsgesetz",
      "state": "Thüringen",
      "amtsgericht": "Amtsgericht Jena",
      "registernummer": "HRB 111720",
      "registerart": "HRB",
      "company_name": "K & E - Technik GmbH",
      "company_seat": "Kölleda",
      "details": "04.02.2026 (Bekanntmachungsdatum)\n\nThüringen Amtsgericht Jena HRB 111720\nRegisterbekanntmachung nach dem Umwandlungsgesetz 04.02.2026 (Eintragungsdatum)\n\nK & E - Technik GmbH\nGesellschaft mit beschränkter Haftung\nKölleda\n\nNicht eingetragen: Den Gläubigern der an der Verschmelzung beteiligten Rechtsträger, ist wenn sie binnen sechs Monaten nach dem Tag, an dem die Eintragung der Verschmelzung in das Register des Sitzes desjenigen Rechtsträgers, dessen Gläubiger sie sind,  nach § 19 Abs. 3 UmwG als bekanntgemacht gilt, ihren Anspruch nach Grund und Höhe schriftlich anmelden, Sicherheit zu leisten, soweit sie nicht Befriedigung verlangen können. Dieses Recht steht ihnen jedoch nur zu, wenn sie glaubhaft machen, daß durch die Verschmelzung die Erfüllung ihrer Forderung gefährdet wird."
    },
    {
      "date": "2026-02-04",
      "id": "144346",
      "original_text": "Registerbekanntmachung nach dem Umwandlungsgesetz\nThüringen Amtsgericht Jena HRB 520425\nEKS-Kölleda GmbH – Kölleda",
      "type": "Registerbekanntmachung nach dem Umwandlungsgesetz",
      "state": "Thüringen",
      "amtsgericht": "Amtsgericht Jena",
      "registernummer": "HRB 520425",
      "registerart": "HRB",
      "company_name": "EKS-Kölleda GmbH",
      "company_seat": "Kölleda",
      "details": "04.02.2026 (Bekanntmachungsdatum)\n\nThüringen Amtsgericht Jena HRB 520425\nRegisterbekanntmachung nach dem Umwandlungsgesetz 04.02.2026 (Eintragungsdatum)\n\nEKS-Kölleda GmbH\nGesellschaft mit beschränkter Haftung\nKölleda\n\nNicht eingetragen: Den Gläubigern der an der Verschmelzung beteiligten Rechtsträger, ist wenn sie binnen sechs Monaten nach dem Tag, an dem die Eintragung der Verschmelzung in das Register des Sitzes desjenigen Rechtsträgers, dessen Gläubiger sie sind,  nach § 19 Abs. 3 UmwG als bekanntgemacht gilt, ihren Anspruch nach Grund und Höhe schriftlich anmelden, Sicherheit zu leisten, soweit sie nicht Befriedigung verlangen können. Dieses Recht steht ihnen jedoch nur zu, wenn sie glaubhaft machen, daß durch die Verschmelzung die Erfüllung ihrer Forderung gefährdet wird."
    },
    {
      "date": "2026-02-04",
      "id": "144347",
      "original_text": "Registerbekanntmachung nach dem Umwandlungsgesetz\nHessen Amtsgericht Darmstadt HRA 87876\nEB Essentialbag e. K., Inh. Marvin Moik – Ginsheim-Gustavsburg",
      "type": "Registerbekanntmachung nach dem Umwandlungsgesetz",
      "state": "Hessen",
      "amtsgericht": "Amtsgericht Darmstadt",
      "registernummer": "HRA 87876",
      "registerart": "HRA",
      "company_name": "EB Essentialbag e. K., Inh. Marvin Moik",
      "company_seat": "Ginsheim-Gustavsburg",
      "details": "04.02.2026 (Bekanntmachungsdatum)\n\nHessen Amtsgericht Darmstadt HRA 87876\nRegisterbekanntmachung nach dem Umwandlungsgesetz 04.02.2026 (Eintragungsdatum)\n\nEB Essentialbag e. K., Inh. Marvin Moik\nEinzelkaufmann / Einzelkauffrau\nGinsheim-Gustavsburg\n\nDen Gläubigern der an der Ausgliederung beteiligten Rechtsträger ist, wenn sie binnen sechs Monaten nach dem Tag, an dem die Eintragung der Ausgliederung in das Register des Sitzes derjenigen Rechtsträger deren Gläubiger sie sind, nach §§ 125, 19 Absatz 3 UmwG bekannt gemacht worden ist, ihren Anspruch nach Grund und Höhe schriftlich anmelden, Sicherheit zu leisten, soweit sie nicht Befriedigung verlangen können. Dieses Recht steht den Gläubigern jedoch nur zu, wenn sie glaubhaft machen, dass durch die Ausgliederung die Erfüllung ihrer Forderung gefährdet wird."
    },
    {
      "date": "2026-02-04",
      "id": "144348",
      "original_text": "Löschungsankündigung\nHessen Amtsgericht Wiesbaden HRB 24755\nPCS Consulting UG (haftungsbeschränkt) – Wiesbaden",
      "type": "Löschungsankündigung",
      "state": "Hessen",
      "amtsgericht": "Amtsgericht Wiesbaden",
      "registernummer": "HRB 24755",
      "registerart": "HRB",
      "company_name": "PCS Consulting UG (haftungsbeschränkt)",
      "company_seat": "Wiesbaden",
      "details": "04.02.2026 (Bekanntmachungsdatum)\n\nHessen Amtsgericht Wiesbaden HRB 24755\nLöschungsankündigung\n\nPCS Consulting UG (haftungsbeschränkt)\nGesellschaft mit beschränkter Haftung\nWiesbaden\n\nDas Registergericht beabsichtigt die im Handelsregister eingetragene Gesellschaft von Amts wegen nach § 394 FamFG zu löschen. Die Frist zur Erhebung eines Widerspruchs gegen die beabsichtigte Löschung wird auf 3 Monate festgesetzt."
    },
    {
      "date": "2026-02-04",
      "id": "144349",
      "original_text": "Löschungsankündigung\nHessen Amtsgericht Offenbach am Main HRB 47084\nY. A. Bau GmbH – Offenbach am Main",
      "type": "Löschungsankündigung",
      "state": "Hessen",
      "amtsgericht": "Amtsgericht Offenbach am Main",
      "registernummer": "HRB 47084",
      "registerart": "HRB",
      "company_name": "Y. A. Bau GmbH",
      "company_seat": "Offenbach am Main",
      "details": "04.02.2026 (Bekanntmachungsdatum)\n\nHessen Amtsgericht Offenbach am Main HRB 47084\nLöschungsankündigung\n\nY. A. Bau GmbH\nGesellschaft mit beschränkter Haftung\nOffenbach am Main\n\nDas Registergericht beabsichtigt die im Handelsregister eingetragene Gesellschaft von Amts wegen nach § 394 FamFG zu löschen. Die Frist zur Erhebung eines Widerspruchs gegen die beabsichtigte Löschung wird auf 3 Monate festgesetzt."
    },
    {
      "date": "2026-02-04",
      "id": "144350",
      "original_text": "Registerbekanntmachung nach dem Umwandlungsgesetz\nHessen Amtsgericht Offenbach am Main HRB 52902\nHubOne 5. Projekt GmbH – Neu-Isenburg",
      "type": "Registerbekanntmachung nach dem Umwandlungsgesetz",
      "state": "Hessen",
      "amtsgericht": "Amtsgericht Offenbach am Main",
      "registernummer": "HRB 52902",
      "registerart": "HRB",
      "company_name": "HubOne 5. Projekt GmbH",
      "company_seat": "Neu-Isenburg",
      "details": "04.02.2026 (Bekanntmachungsdatum)\n\nHessen Amtsgericht Offenbach am Main HRB 52902\nRegisterbekanntmachung nach dem Umwandlungsgesetz\n\nHubOne 5. Projekt GmbH\nGesellschaft mit beschränkter Haftung\nNeu-Isenburg\n\nDem Registergericht ist der Entwurf eines Verschmelzungsplans über die geplante grenzüberschreitende Verschmelzung der HubOne 5. Projekt GmbH mit Sitz in Neu-Isenburg (Gesellschaft mit beschränkter Haftung, eingetragen beim Amtsgericht Offenbach am Main unter der HRB  52902) als übertragender Rechtsträger mit der HubOne A2 Projekt GmbH mit Sitz in Kitzbühel/Österreich (Gesellschaft mit beschränkter Haftung, eingetragen beim Landesgericht Innsbruck unter FN 577830 a) als übernehmender Rechtsträger eingereicht worden.\nDen Gläubigern der übertragenden Gesellschaft ist Sicherheit zu leisten, wenn sie innerhalb einer Frist von zwei Monaten nach Bekanntmachung des Verschmelzungsplans glaubhaft machen, dass durch die Verschmelzung die Erfüllung ihrer Forderung gefährdet wird. Die Anteilseigner der übertragenden Gesellschaft haben bei grenzüberschreitenden Verschmelzungen einen Anspruch auf angemessene Abfindung, sofern sie der Verschmelzung widersprochen haben; gegebenenfalls steht ihnen auch ein Anspruch auf bare Zuzahlung zu."
    },
    {
      "date": "2026-02-04",
      "id": "144351",
      "original_text": "Sonstige Registerbekanntmachung\nHessen Amtsgericht Fritzlar HRB 8129\nElektrische Licht- und Kraftanlagen Aktiengesellschaft – Borken (Hessen)",
      "type": "Sonstige Registerbekanntmachung",
      "state": "Hessen",
      "amtsgericht": "Amtsgericht Fritzlar",
      "registernummer": "HRB 8129",
      "registerart": "HRB",
      "company_name": "Elektrische Licht- und Kraftanlagen Aktiengesellschaft",
      "company_seat": "Borken (Hessen)",
      "details": "04.02.2026 (Bekanntmachungsdatum)\n\nHessen Amtsgericht Fritzlar HRB 8129\nSonstige Registerbekanntmachung\n\nElektrische Licht- und Kraftanlagen Aktiengesellschaft\nAktiengesellschaft\nBorken (Hessen)\n\nDurch eine Änderung in den Personen der Aufsichtsratsmitglieder ist eine Liste der Mitglieder des Aufsichtsrates zum Handelsregister eingereicht worden."
    },
    {
      "date": "2026-02-04",
      "id": "144352",
      "original_text": "Löschungsankündigung\nHessen Amtsgericht Frankfurt am Main HRA 53760\nGolden Keys GmbH & Co. KG – Frankfurt am Main",
      "type": "Löschungsankündigung",
      "state": "Hessen",
      "amtsgericht": "Amtsgericht Frankfurt am Main",
      "registernummer": "HRA 53760",
      "registerart": "HRA",
      "company_name": "Golden Keys GmbH & Co. KG",
      "company_seat": "Frankfurt am Main",
      "details": "04.02.2026 (Bekanntmachungsdatum)\n\nHessen Amtsgericht Frankfurt am Main HRA 53760\nLöschungsankündigung\n\nGolden Keys GmbH & Co. KG\nKommanditgesellschaft\nFrankfurt am Main\n\nDas Registergericht beabsichtigt die im Handelsregister eingetragene Firma von Amts wegen nach § 394 FamFG zu löschen. Die Frist zur Erhebung eines Widerspruchs gegen die beabsichtigte Löschung wird auf 1 Monat festgesetzt."
    },
    {
      "date": "2026-02-04",
      "id": "144353",
      "original_text": "Registerbekanntmachung nach dem Umwandlungsgesetz\nHessen Amtsgericht Wiesbaden HRB 26330\nSOLIT Management GmbH – Wiesbaden",
      "type": "Registerbekanntmachung nach dem Umwandlungsgesetz",
      "state": "Hessen",
      "amtsgericht": "Amtsgericht Wiesbaden",
      "registernummer": "HRB 26330",
      "registerart": "HRB",
      "company_name": "SOLIT Management GmbH",
      "company_seat": "Wiesbaden",
      "details": "04.02.2026 (Bekanntmachungsdatum)\n\nHessen Amtsgericht Wiesbaden HRB 26330\nRegisterbekanntmachung nach dem Umwandlungsgesetz 04.02.2026 (Eintragungsdatum)\n\nSOLIT Management GmbH\nGesellschaft mit beschränkter Haftung\nWiesbaden\n\nDen Gläubigern der an der Verschmelzung beteiligten Rechtsträger ist, wenn sie binnen sechs Monaten nach dem Tag, an dem die Eintragung der Verschmelzung in das Register des Sitzes derjenigen Rechtsträger deren Gläubiger sie sind, nach § 19 Absatz 3 UmwG bekannt gemacht worden ist, ihren Anspruch nach Grund und Höhe schriftlich anmelden, Sicherheit zu leisten, soweit sie nicht Befriedigung verlangen können. Dieses Recht steht den Gläubigern jedoch nur zu, wenn sie glaubhaft machen, dass durch die Verschmelzung die Erfüllung ihrer Forderung gefährdet wird."
    },
    {
      "date": "2026-02-04",
      "id": "144354",
      "original_text": "Registerbekanntmachung nach dem Umwandlungsgesetz\nHessen Amtsgericht Wiesbaden HRB 26330\nSOLIT Management GmbH – Wiesbaden",
      "type": "Registerbekanntmachung nach dem Umwandlungsgesetz",
      "state": "Hessen",
      "amtsgericht": "Amtsgericht Wiesbaden",
      "registernummer": "HRB 26330",
      "registerart": "HRB",
      "company_name": "SOLIT Management GmbH",
      "company_seat": "Wiesbaden",
      "details": "04.02.2026 (Bekanntmachungsdatum)\n\nHessen Amtsgericht Wiesbaden HRB 26330\nRegisterbekanntmachung nach dem Umwandlungsgesetz 04.02.2026 (Eintragungsdatum)\n\nSOLIT Management GmbH\nGesellschaft mit beschränkter Haftung\nWiesbaden\n\nDen Gläubigern der an der Verschmelzung beteiligten Rechtsträger ist, wenn sie binnen sechs Monaten nach dem Tag, an dem die Eintragung der Verschmelzung in das Register des Sitzes derjenigen Rechtsträger deren Gläubiger sie sind, nach § 19 Absatz 3 UmwG bekannt gemacht worden ist, ihren Anspruch nach Grund und Höhe schriftlich anmelden, Sicherheit zu leisten, soweit sie nicht Befriedigung verlangen können. Dieses Recht steht den Gläubigern jedoch nur zu, wenn sie glaubhaft machen, dass durch die Verschmelzung die Erfüllung ihrer Forderung gefährdet wird."
    },
    {
      "date": "2026-02-04",
      "id": "144355",
      "original_text": "Einreichung neuer Dokumente\nHessen Amtsgericht Frankfurt am Main HRB 125994\nBolzhauser AG – Eschborn",
      "type": "Einreichung neuer Dokumente",
      "state": "Hessen",
      "amtsgericht": "Amtsgericht Frankfurt am Main",
      "registernummer": "HRB 125994",
      "registerart": "HRB",
      "company_name": "Bolzhauser AG",
      "company_seat": "Eschborn",
      "details": "04.02.2026 (Bekanntmachungsdatum)\n\nHessen Amtsgericht Frankfurt am Main HRB 125994\nEinreichung neuer Dokumente\n\nBolzhauser AG\nAktiengesellschaft\nEschborn\n\nDurch eine Änderung in den Personen der Aufsichtsratsmitglieder ist eine Liste der Mitglieder des Aufsichtsrates zum Handelsregister eingereicht worden."
    },
    {
      "date": "2026-02-04",
      "id": "144356",
      "original_text": "Registerbekanntmachung nach dem Umwandlungsgesetz\nHessen Amtsgericht Frankfurt am Main HRB 126420\nBSC München Parkplatz Nord GmbH – Frankfurt am Main",
      "type": "Registerbekanntmachung nach dem Umwandlungsgesetz",
      "state": "Hessen",
      "amtsgericht": "Amtsgericht Frankfurt am Main",
      "registernummer": "HRB 126420",
      "registerart": "HRB",
      "company_name": "BSC München Parkplatz Nord GmbH",
      "company_seat": "Frankfurt am Main",
      "details": "04.02.2026 (Bekanntmachungsdatum)\n\nHessen Amtsgericht Frankfurt am Main HRB 126420\nRegisterbekanntmachung nach dem Umwandlungsgesetz 04.02.2026 (Eintragungsdatum)\n\nBSC München Parkplatz Nord GmbH\nGesellschaft mit beschränkter Haftung\nFrankfurt am Main\n\nDen Gläubigern der an der formwechselnden Umwandlung beteiligten Rechtsträger ist, wenn sie binnen sechs Monaten nach dem Tag, an dem die Eintragung der formwechselnden Umwandlung in das Register des Sitzes desjenigen Rechtsträgers, dessen Gläubiger sie sind, nach §§ 122a Absatz 2, 19 Absatz 3 UmwG bekannt gemacht worden ist, ihren Anspruch nach Grund und Höhe schriftlich anmelden, Sicherheit zu leisten, soweit sie nicht Befriedigung verlangen können. Dieses Recht steht den Gläubigern jedoch nur zu, wenn sie glaubhaft machen, dass durch die formwechselnden Umwandlung die Erfüllung ihrer Forderung gefährdet wird."
    }
  ]
}