{
  "date": "2026-02-03",
  "date_of_scrape": "2026-02-04T04:38:33.866Z",
  "tool_version": "0.2.0",
  "number_of_announcements": 122,
  "announcements": [
    {
      "date": "2026-02-03",
      "id": "144123",
      "original_text": "Löschungsankündigung\nBayern Amtsgericht München HRB 288984\nKANOS Transport GmbH – Germering",
      "type": "Löschungsankündigung",
      "state": "Bayern",
      "amtsgericht": "Amtsgericht München",
      "registernummer": "HRB 288984",
      "registerart": "HRB",
      "company_name": "KANOS Transport GmbH",
      "company_seat": "Germering",
      "details": "03.02.2026 (Bekanntmachungsdatum)\n\nBayern Amtsgericht München HRB 288984\nLöschungsankündigung 02.02.2026 (Eintragungsdatum)\n\nKANOS Transport GmbH\nGesellschaft mit beschränkter Haftung\nGermering\n\nDas Registergericht beabsichtigt, die im Handelsregister eingetragene Gesellschaft wegen Vermögenslosigkeit von Amts wegen nach § 394 FamFG zu löschen. Die Frist zur Erhebung eines Widerspruchs ist auf drei Monate festgesetzt."
    },
    {
      "date": "2026-02-03",
      "id": "144124",
      "original_text": "Löschungsankündigung\nBayern Amtsgericht Würzburg HRB 14139\nB&R Warenhandels GmbH – Würzburg",
      "type": "Löschungsankündigung",
      "state": "Bayern",
      "amtsgericht": "Amtsgericht Würzburg",
      "registernummer": "HRB 14139",
      "registerart": "HRB",
      "company_name": "B&R Warenhandels GmbH",
      "company_seat": "Würzburg",
      "details": "03.02.2026 (Bekanntmachungsdatum)\n\nBayern Amtsgericht Würzburg HRB 14139\nLöschungsankündigung\n\nB&R Warenhandels GmbH\nGesellschaft mit beschränkter Haftung\nWürzburg\n\nDas Registergericht beabsichtigt, die im Handelsregister eingetragene Gesellschaft wegen Vermögenslosigkeit von Amts wegen nach § 394 FamFG zu löschen. Die Frist zur Erhebung eines Widerspruchs ist auf drei Monate festgesetzt."
    },
    {
      "date": "2026-02-03",
      "id": "144125",
      "original_text": "Löschungsankündigung\nBayern Amtsgericht Hof HRB 5362\nAuto-Seidel Verwaltungs GmbH – Hof",
      "type": "Löschungsankündigung",
      "state": "Bayern",
      "amtsgericht": "Amtsgericht Hof",
      "registernummer": "HRB 5362",
      "registerart": "HRB",
      "company_name": "Auto-Seidel Verwaltungs GmbH",
      "company_seat": "Hof",
      "details": "03.02.2026 (Bekanntmachungsdatum)\n\nBayern Amtsgericht Hof HRB 5362\nLöschungsankündigung\n\nAuto-Seidel Verwaltungs GmbH\nGesellschaft mit beschränkter Haftung\nHof\n\nDas Registergericht beabsichtigt, die im Handelsregister eingetragene Gesellschaft wegen Vermögenslosigkeit von Amts wegen nach § 394 FamFG zu löschen. Die Frist zur Erhebung eines Widerspruchs ist auf sechs Wochen festgesetzt."
    },
    {
      "date": "2026-02-03",
      "id": "144126",
      "original_text": "Löschungsankündigung\nBayern Amtsgericht München HRB 170866\nTargenia Rula - Wülfrath GmbH – Ismaning",
      "type": "Löschungsankündigung",
      "state": "Bayern",
      "amtsgericht": "Amtsgericht München",
      "registernummer": "HRB 170866",
      "registerart": "HRB",
      "company_name": "Targenia Rula - Wülfrath GmbH",
      "company_seat": "Ismaning",
      "details": "03.02.2026 (Bekanntmachungsdatum)\n\nBayern Amtsgericht München HRB 170866\nLöschungsankündigung 02.02.2026 (Eintragungsdatum)\n\nTargenia Rula - Wülfrath GmbH\nGesellschaft mit beschränkter Haftung\nIsmaning\n\nDas Registergericht beabsichtigt, die im Handelsregister eingetragene Gesellschaft wegen Vermögenslosigkeit von Amts wegen nach § 394 FamFG zu löschen. Die Frist zur Erhebung eines Widerspruchs ist auf drei Monate festgesetzt."
    },
    {
      "date": "2026-02-03",
      "id": "144127",
      "original_text": "Registerbekanntmachung nach dem Umwandlungsgesetz\nBayern Amtsgericht Amberg HRA 4256\nHorsch Maschinen SE & Co. KG – Schwandorf",
      "type": "Registerbekanntmachung nach dem Umwandlungsgesetz",
      "state": "Bayern",
      "amtsgericht": "Amtsgericht Amberg",
      "registernummer": "HRA 4256",
      "registerart": "HRA",
      "company_name": "Horsch Maschinen SE & Co. KG",
      "company_seat": "Schwandorf",
      "details": "03.02.2026 (Bekanntmachungsdatum)\n\nBayern Amtsgericht Amberg HRA 4256\nRegisterbekanntmachung nach dem Umwandlungsgesetz 02.02.2026 (Eintragungsdatum)\n\nHorsch Maschinen SE & Co. KG\nKommanditgesellschaft\nSchwandorf\n\nDen Gläubigern des formwechselnden Rechtsträgers ist, wenn sie binnen sechs Monaten nach dem Tag, an dem die Eintragung des Formwechsels nach § 201 UmwG als bekannt gemacht gilt, ihren Anspruch nach Grund und Höhe in Textform anmelden, Sicherheit zu leisten, soweit sie nicht Befriedigung verlangen können. Dieses Recht steht den Gläubigern jedoch nur zu, wenn sie glaubhaft machen, dass durch den Formwechsel die Erfüllung ihrer Forderung gefährdet wird."
    },
    {
      "date": "2026-02-03",
      "id": "144128",
      "original_text": "Registerbekanntmachung nach dem Umwandlungsgesetz\nBayern Amtsgericht Traunstein HRA 15322\nGut Heiming Islandpferde GmbH & Co. KG – Schechen",
      "type": "Registerbekanntmachung nach dem Umwandlungsgesetz",
      "state": "Bayern",
      "amtsgericht": "Amtsgericht Traunstein",
      "registernummer": "HRA 15322",
      "registerart": "HRA",
      "company_name": "Gut Heiming Islandpferde GmbH & Co. KG",
      "company_seat": "Schechen",
      "details": "03.02.2026 (Bekanntmachungsdatum)\n\nBayern Amtsgericht Traunstein HRA 15322\nRegisterbekanntmachung nach dem Umwandlungsgesetz 02.02.2026 (Eintragungsdatum)\n\nGut Heiming Islandpferde GmbH & Co. KG\nKommanditgesellschaft\nSchechen\n\nDen Gläubigern des formwechselnden Rechtsträgers ist, wenn sie binnen sechs Monaten nach dem Tag, an dem die Eintragung des Formwechsels nach § 201 UmwG als bekannt gemacht gilt, ihren Anspruch nach Grund und Höhe in Textform anmelden, Sicherheit zu leisten, soweit sie nicht Befriedigung verlangen können. Dieses Recht steht den Gläubigern jedoch nur zu, wenn sie glaubhaft machen, dass durch den Formwechsel die Erfüllung ihrer Forderung gefährdet wird."
    },
    {
      "date": "2026-02-03",
      "id": "144129",
      "original_text": "Löschungsankündigung\nBayern Amtsgericht Hof HRB 5141\nFattigsmühle GmbH – Töpen",
      "type": "Löschungsankündigung",
      "state": "Bayern",
      "amtsgericht": "Amtsgericht Hof",
      "registernummer": "HRB 5141",
      "registerart": "HRB",
      "company_name": "Fattigsmühle GmbH",
      "company_seat": "Töpen",
      "details": "03.02.2026 (Bekanntmachungsdatum)\n\nBayern Amtsgericht Hof HRB 5141\nLöschungsankündigung\n\nFattigsmühle GmbH\nGesellschaft mit beschränkter Haftung\nTöpen\n\nDas Registergericht beabsichtigt, die im Handelsregister eingetragene Gesellschaft wegen Vermögenslosigkeit von Amts wegen nach § 394 FamFG zu löschen. Die Frist zur Erhebung eines Widerspruchs ist auf sechs Wochen festgesetzt."
    },
    {
      "date": "2026-02-03",
      "id": "144130",
      "original_text": "Löschungsankündigung\nBayern Amtsgericht München HRB 141756\nKrauts PR Büro für Public Relations GmbH – München",
      "type": "Löschungsankündigung",
      "state": "Bayern",
      "amtsgericht": "Amtsgericht München",
      "registernummer": "HRB 141756",
      "registerart": "HRB",
      "company_name": "Krauts PR Büro für Public Relations GmbH",
      "company_seat": "München",
      "details": "03.02.2026 (Bekanntmachungsdatum)\n\nBayern Amtsgericht München HRB 141756\nLöschungsankündigung\n\nKrauts PR Büro für Public Relations GmbH\nGesellschaft mit beschränkter Haftung\nMünchen\n\nDas Registergericht beabsichtigt, die im Handelsregister eingetragene Gesellschaft wegen Vermögenslosigkeit von Amts wegen nach § 394 FamFG zu löschen. Die Frist zur Erhebung eines Widerspruchs ist auf drei Monate festgesetzt."
    },
    {
      "date": "2026-02-03",
      "id": "144131",
      "original_text": "Registerbekanntmachung nach dem Umwandlungsgesetz\nBayern Amtsgericht München HRB 243230\nST3 Holding GmbH – Grünwald",
      "type": "Registerbekanntmachung nach dem Umwandlungsgesetz",
      "state": "Bayern",
      "amtsgericht": "Amtsgericht München",
      "registernummer": "HRB 243230",
      "registerart": "HRB",
      "company_name": "ST3 Holding GmbH",
      "company_seat": "Grünwald",
      "details": "03.02.2026 (Bekanntmachungsdatum)\n\nBayern Amtsgericht München HRB 243230\nRegisterbekanntmachung nach dem Umwandlungsgesetz 31.01.2026 (Eintragungsdatum)\n\nST3 Holding GmbH\nGesellschaft mit beschränkter Haftung\nGrünwald\n\nDen Gläubigern der an der Verschmelzung beteiligten Rechtsträger ist, wenn sie binnen sechs Monaten nach dem Tag, an dem die Eintragung der Verschmelzung in das Register des Sitzes desjenigen Rechtsträgers, dessen Gläubiger sie sind, nach § 19 Abs. 3 UmwG als bekannt gemacht gilt, ihren Anspruch nach Grund und Höhe in Textform anmelden, Sicherheit zu leisten, soweit sie nicht Befriedigung verlangen können. Dieses Recht steht den Gläubigern jedoch nur zu, wenn sie glaubhaft machen, dass durch die Verschmelzung die Erfüllung ihrer Forderung gefährdet wird."
    },
    {
      "date": "2026-02-03",
      "id": "144132",
      "original_text": "Löschungsankündigung\nBayern Amtsgericht München HRB 280447\nPlace Control UG (haftungsbeschränkt) – München",
      "type": "Löschungsankündigung",
      "state": "Bayern",
      "amtsgericht": "Amtsgericht München",
      "registernummer": "HRB 280447",
      "registerart": "HRB",
      "company_name": "Place Control UG (haftungsbeschränkt)",
      "company_seat": "München",
      "details": "03.02.2026 (Bekanntmachungsdatum)\n\nBayern Amtsgericht München HRB 280447\nLöschungsankündigung 02.02.2026 (Eintragungsdatum)\n\nPlace Control UG (haftungsbeschränkt)\nGesellschaft mit beschränkter Haftung\nMünchen\n\nDas Registergericht beabsichtigt, die im Handelsregister eingetragene Gesellschaft wegen Vermögenslosigkeit von Amts wegen nach § 394 FamFG zu löschen. Die Frist zur Erhebung eines Widerspruchs ist auf drei Monate festgesetzt."
    },
    {
      "date": "2026-02-03",
      "id": "144133",
      "original_text": "Löschungsankündigung\nBayern Amtsgericht München HRB 261660\nSauvage Monaco UG (haftungsbeschränkt) – München",
      "type": "Löschungsankündigung",
      "state": "Bayern",
      "amtsgericht": "Amtsgericht München",
      "registernummer": "HRB 261660",
      "registerart": "HRB",
      "company_name": "Sauvage Monaco UG (haftungsbeschränkt)",
      "company_seat": "München",
      "details": "03.02.2026 (Bekanntmachungsdatum)\n\nBayern Amtsgericht München HRB 261660\nLöschungsankündigung\n\nSauvage Monaco UG (haftungsbeschränkt)\nGesellschaft mit beschränkter Haftung\nMünchen\n\nDas Registergericht beabsichtigt, die im Handelsregister eingetragene Gesellschaft wegen Vermögenslosigkeit von Amts wegen nach § 394 FamFG zu löschen. #insert(Text=\"zztb_V_Widerspruchsfrist\")"
    },
    {
      "date": "2026-02-03",
      "id": "144134",
      "original_text": "Registerbekanntmachung nach dem Umwandlungsgesetz\nBayern Amtsgericht München HRB 288004\nMSSP AcquiCo GmbH – München",
      "type": "Registerbekanntmachung nach dem Umwandlungsgesetz",
      "state": "Bayern",
      "amtsgericht": "Amtsgericht München",
      "registernummer": "HRB 288004",
      "registerart": "HRB",
      "company_name": "MSSP AcquiCo GmbH",
      "company_seat": "München",
      "details": "03.02.2026 (Bekanntmachungsdatum)\n\nBayern Amtsgericht München HRB 288004\nRegisterbekanntmachung nach dem Umwandlungsgesetz 02.02.2026 (Eintragungsdatum)\n\nMSSP AcquiCo GmbH\nGesellschaft mit beschränkter Haftung\nMünchen\n\nDen Gläubigern der an der Verschmelzung beteiligten Rechtsträger ist, wenn sie binnen sechs Monaten nach dem Tag, an dem die Eintragung der Verschmelzung in das Register des Sitzes desjenigen Rechtsträgers, dessen Gläubiger sie sind, nach § 19 Abs. 3 UmwG als bekannt gemacht gilt, ihren Anspruch nach Grund und Höhe in Textform anmelden, Sicherheit zu leisten, soweit sie nicht Befriedigung verlangen können. Dieses Recht steht den Gläubigern jedoch nur zu, wenn sie glaubhaft machen, dass durch die Verschmelzung die Erfüllung ihrer Forderung gefährdet wird."
    },
    {
      "date": "2026-02-03",
      "id": "144135",
      "original_text": "Registerbekanntmachung nach dem Umwandlungsgesetz\nBayern Amtsgericht Landshut HRB 12044\nHORSCH LEEB Application Systems GmbH – Landau a.d.Isar",
      "type": "Registerbekanntmachung nach dem Umwandlungsgesetz",
      "state": "Bayern",
      "amtsgericht": "Amtsgericht Landshut",
      "registernummer": "HRB 12044",
      "registerart": "HRB",
      "company_name": "HORSCH LEEB Application Systems GmbH",
      "company_seat": "Landau a.d.Isar",
      "details": "03.02.2026 (Bekanntmachungsdatum)\n\nBayern Amtsgericht Landshut HRB 12044\nRegisterbekanntmachung nach dem Umwandlungsgesetz 02.02.2026 (Eintragungsdatum)\n\nHORSCH LEEB Application Systems GmbH\nGesellschaft mit beschränkter Haftung\nLandau a.d.Isar\n\nDen Gläubigern des formwechselnden Rechtsträgers ist, wenn sie binnen sechs Monaten nach dem Tag, an dem die Eintragung des Formwechsels nach § 201 UmwG als bekannt gemacht gilt, ihren Anspruch nach Grund und Höhe in Textform anmelden, Sicherheit zu leisten, soweit sie nicht Befriedigung verlangen können. Dieses Recht steht den Gläubigern jedoch nur zu, wenn sie glaubhaft machen, dass durch den Formwechsel die Erfüllung ihrer Forderung gefährdet wird."
    },
    {
      "date": "2026-02-03",
      "id": "144136",
      "original_text": "Löschungsankündigung\nBayern Amtsgericht Traunstein HRA 12688\nSANAD Innenausbau und Schadensanierung UG (haftungsbeschränkt) & Co.KG – Bad Reichenhall",
      "type": "Löschungsankündigung",
      "state": "Bayern",
      "amtsgericht": "Amtsgericht Traunstein",
      "registernummer": "HRA 12688",
      "registerart": "HRA",
      "company_name": "SANAD Innenausbau und Schadensanierung UG (haftungsbeschränkt) & Co.KG",
      "company_seat": "Bad Reichenhall",
      "details": "03.02.2026 (Bekanntmachungsdatum)\n\nBayern Amtsgericht Traunstein HRA 12688\nLöschungsankündigung\n\nSANAD Innenausbau und Schadensanierung UG (haftungsbeschränkt) & Co.KG\nKommanditgesellschaft\nBad Reichenhall\n\nDas Registergericht beabsichtigt, die im Handelsregister eingetragene Firma von Amts wegen nach § 31 Abs. 2 HGB zu löschen. Die Frist zur Erhebung eines Widerspruchs ist auf 2 Monate festgesetzt."
    },
    {
      "date": "2026-02-03",
      "id": "144137",
      "original_text": "Registerbekanntmachung nach dem Umwandlungsgesetz\nBayern Amtsgericht Traunstein HRB 24055\nBiogena Alimentastic Deutschland GmbH – Freilassing",
      "type": "Registerbekanntmachung nach dem Umwandlungsgesetz",
      "state": "Bayern",
      "amtsgericht": "Amtsgericht Traunstein",
      "registernummer": "HRB 24055",
      "registerart": "HRB",
      "company_name": "Biogena Alimentastic Deutschland GmbH",
      "company_seat": "Freilassing",
      "details": "03.02.2026 (Bekanntmachungsdatum)\n\nBayern Amtsgericht Traunstein HRB 24055\nRegisterbekanntmachung nach dem Umwandlungsgesetz 02.02.2026 (Eintragungsdatum)\n\nBiogena Alimentastic Deutschland GmbH\nGesellschaft mit beschränkter Haftung\nFreilassing\n\nDen Gläubigern der an der Verschmelzung beteiligten Rechtsträger ist, wenn sie binnen sechs Monaten nach dem Tag, an dem die Eintragung der Verschmelzung in das Register des Sitzes desjenigen Rechtsträgers, dessen Gläubiger sie sind, nach § 19 Abs. 3 UmwG als bekannt gemacht gilt, ihren Anspruch nach Grund und Höhe in Textform anmelden, Sicherheit zu leisten, soweit sie nicht Befriedigung verlangen können. Dieses Recht steht den Gläubigern jedoch nur zu, wenn sie glaubhaft machen, dass durch die Verschmelzung die Erfüllung ihrer Forderung gefährdet wird."
    },
    {
      "date": "2026-02-03",
      "id": "144138",
      "original_text": "Registerbekanntmachung nach dem Umwandlungsgesetz\nBayern Amtsgericht München HRA 121429\nHOCH 3 Karin Stier e.K. – München",
      "type": "Registerbekanntmachung nach dem Umwandlungsgesetz",
      "state": "Bayern",
      "amtsgericht": "Amtsgericht München",
      "registernummer": "HRA 121429",
      "registerart": "HRA",
      "company_name": "HOCH 3 Karin Stier e.K.",
      "company_seat": "München",
      "details": "03.02.2026 (Bekanntmachungsdatum)\n\nBayern Amtsgericht München HRA 121429\nRegisterbekanntmachung nach dem Umwandlungsgesetz 02.02.2026 (Eintragungsdatum)\n\nHOCH 3 Karin Stier e.K.\nEinzelkaufmann / Einzelkauffrau\nMünchen\n\nDen Gläubigern der an der Verschmelzung beteiligten Rechtsträger ist, wenn sie binnen sechs Monaten nach dem Tag, an dem die Eintragung der Verschmelzung in das Register des Sitzes desjenigen Rechtsträgers, dessen Gläubiger sie sind, nach § 19 Abs. 3 UmwG als bekannt gemacht gilt, ihren Anspruch nach Grund und Höhe in Textform anmelden, Sicherheit zu leisten, soweit sie nicht Befriedigung verlangen können. Dieses Recht steht den Gläubigern jedoch nur zu, wenn sie glaubhaft machen, dass durch die Verschmelzung die Erfüllung ihrer Forderung gefährdet wird."
    },
    {
      "date": "2026-02-03",
      "id": "144139",
      "original_text": "Registerbekanntmachung nach dem Umwandlungsgesetz\nBayern Amtsgericht Landshut HRA 12995\nHORSCH LEEB Application Systems SE & Co. KG – Landau a.d.Isar",
      "type": "Registerbekanntmachung nach dem Umwandlungsgesetz",
      "state": "Bayern",
      "amtsgericht": "Amtsgericht Landshut",
      "registernummer": "HRA 12995",
      "registerart": "HRA",
      "company_name": "HORSCH LEEB Application Systems SE & Co. KG",
      "company_seat": "Landau a.d.Isar",
      "details": "03.02.2026 (Bekanntmachungsdatum)\n\nBayern Amtsgericht Landshut HRA 12995\nRegisterbekanntmachung nach dem Umwandlungsgesetz 02.02.2026 (Eintragungsdatum)\n\nHORSCH LEEB Application Systems SE & Co. KG\nKommanditgesellschaft\nLandau a.d.Isar\n\nDen Gläubigern des formwechselnden Rechtsträgers ist, wenn sie binnen sechs Monaten nach dem Tag, an dem die Eintragung des Formwechsels nach § 201 UmwG als bekannt gemacht gilt, ihren Anspruch nach Grund und Höhe in Textform anmelden, Sicherheit zu leisten, soweit sie nicht Befriedigung verlangen können. Dieses Recht steht den Gläubigern jedoch nur zu, wenn sie glaubhaft machen, dass durch den Formwechsel die Erfüllung ihrer Forderung gefährdet wird."
    },
    {
      "date": "2026-02-03",
      "id": "144140",
      "original_text": "Registerbekanntmachung nach dem Umwandlungsgesetz\nBayern Amtsgericht Traunstein HRB 23609\nBiogena Stores Deutschland GmbH – Freilassing",
      "type": "Registerbekanntmachung nach dem Umwandlungsgesetz",
      "state": "Bayern",
      "amtsgericht": "Amtsgericht Traunstein",
      "registernummer": "HRB 23609",
      "registerart": "HRB",
      "company_name": "Biogena Stores Deutschland GmbH",
      "company_seat": "Freilassing",
      "details": "03.02.2026 (Bekanntmachungsdatum)\n\nBayern Amtsgericht Traunstein HRB 23609\nRegisterbekanntmachung nach dem Umwandlungsgesetz 02.02.2026 (Eintragungsdatum)\n\nBiogena Stores Deutschland GmbH\nGesellschaft mit beschränkter Haftung\nFreilassing\n\nDen Gläubigern der an der Verschmelzung beteiligten Rechtsträger ist, wenn sie binnen sechs Monaten nach dem Tag, an dem die Eintragung der Verschmelzung in das Register des Sitzes desjenigen Rechtsträgers, dessen Gläubiger sie sind, nach § 19 Abs. 3 UmwG als bekannt gemacht gilt, ihren Anspruch nach Grund und Höhe in Textform anmelden, Sicherheit zu leisten, soweit sie nicht Befriedigung verlangen können. Dieses Recht steht den Gläubigern jedoch nur zu, wenn sie glaubhaft machen, dass durch die Verschmelzung die Erfüllung ihrer Forderung gefährdet wird."
    },
    {
      "date": "2026-02-03",
      "id": "144141",
      "original_text": "Einreichung neuer Dokumente\nBayern Amtsgericht München HRB 162748\nAllianz Investment Management SE – München",
      "type": "Einreichung neuer Dokumente",
      "state": "Bayern",
      "amtsgericht": "Amtsgericht München",
      "registernummer": "HRB 162748",
      "registerart": "HRB",
      "company_name": "Allianz Investment Management SE",
      "company_seat": "München",
      "details": "03.02.2026 (Bekanntmachungsdatum)\n\nBayern Amtsgericht München HRB 162748\nEinreichung neuer Dokumente 02.02.2026 (Eintragungsdatum)\n\nAllianz Investment Management SE\nEuropäische Aktiengesellschaft (SE)\nMünchen\n\nDem Amtsgericht München -Registergericht- ist eine Liste der Mitglieder des Aufsichtsrats eingereicht worden, Art. 9 Abs. 1 Buchst. c (ii) SE-VO i.V.m. § 106 AktG."
    },
    {
      "date": "2026-02-03",
      "id": "144142",
      "original_text": "Registerbekanntmachung nach dem Umwandlungsgesetz\nBayern Amtsgericht Amberg HRB 1648\nHorsch Maschinen GmbH – Schwandorf, Sitzenhof",
      "type": "Registerbekanntmachung nach dem Umwandlungsgesetz",
      "state": "Bayern",
      "amtsgericht": "Amtsgericht Amberg",
      "registernummer": "HRB 1648",
      "registerart": "HRB",
      "company_name": "Horsch Maschinen GmbH",
      "company_seat": "Schwandorf, Sitzenhof",
      "details": "03.02.2026 (Bekanntmachungsdatum)\n\nBayern Amtsgericht Amberg HRB 1648\nRegisterbekanntmachung nach dem Umwandlungsgesetz 02.02.2026 (Eintragungsdatum)\n\nHorsch Maschinen GmbH\nGesellschaft mit beschränkter Haftung\nSchwandorf, Sitzenhof\n\nDen Gläubigern des formwechselnden Rechtsträgers ist, wenn sie binnen sechs Monaten nach dem Tag, an dem die Eintragung des Formwechsels nach § 201 UmwG als bekannt gemacht gilt, ihren Anspruch nach Grund und Höhe in Textform anmelden, Sicherheit zu leisten, soweit sie nicht Befriedigung verlangen können. Dieses Recht steht den Gläubigern jedoch nur zu, wenn sie glaubhaft machen, dass durch den Formwechsel die Erfüllung ihrer Forderung gefährdet wird."
    },
    {
      "date": "2026-02-03",
      "id": "144143",
      "original_text": "Registerbekanntmachung nach dem Umwandlungsgesetz\nBayern Amtsgericht Traunstein HRB 24990\nGut Heiming Betriebsgesellschaft mbH – Schechen",
      "type": "Registerbekanntmachung nach dem Umwandlungsgesetz",
      "state": "Bayern",
      "amtsgericht": "Amtsgericht Traunstein",
      "registernummer": "HRB 24990",
      "registerart": "HRB",
      "company_name": "Gut Heiming Betriebsgesellschaft mbH",
      "company_seat": "Schechen",
      "details": "03.02.2026 (Bekanntmachungsdatum)\n\nBayern Amtsgericht Traunstein HRB 24990\nRegisterbekanntmachung nach dem Umwandlungsgesetz 02.02.2026 (Eintragungsdatum)\n\nGut Heiming Betriebsgesellschaft mbH\nGesellschaft mit beschränkter Haftung\nSchechen\n\nDen Gläubigern des formwechselnden Rechtsträgers ist, wenn sie binnen sechs Monaten nach dem Tag, an dem die Eintragung des Formwechsels nach § 201 UmwG als bekannt gemacht gilt, ihren Anspruch nach Grund und Höhe in Textform anmelden, Sicherheit zu leisten, soweit sie nicht Befriedigung verlangen können. Dieses Recht steht den Gläubigern jedoch nur zu, wenn sie glaubhaft machen, dass durch den Formwechsel die Erfüllung ihrer Forderung gefährdet wird."
    },
    {
      "date": "2026-02-03",
      "id": "144144",
      "original_text": "Sonstige Registerbekanntmachung\nBayern Amtsgericht Regensburg HRB 6484\ntransmed Transport GmbH – Regensburg",
      "type": "Sonstige Registerbekanntmachung",
      "state": "Bayern",
      "amtsgericht": "Amtsgericht Regensburg",
      "registernummer": "HRB 6484",
      "registerart": "HRB",
      "company_name": "transmed Transport GmbH",
      "company_seat": "Regensburg",
      "details": "03.02.2026 (Bekanntmachungsdatum)\n\nBayern Amtsgericht Regensburg HRB 6484\nSonstige Registerbekanntmachung 02.02.2026 (Eintragungsdatum)\n\ntransmed Transport GmbH\nGesellschaft mit beschränkter Haftung\nRegensburg\n\nDen Gläubigern der Gesellschaft, deren Forderungen begründet worden sind, bevor die Eintragung der Beendigung des Gewinnabführungsvertrages in das Handelsregister nach § 10 des Handelsgesetzbuches als bekanntgemacht gilt, hat der andere Vertragsteil Sicherheit zu leisten, wenn sie sich binnen sechs Monaten nach der Bekanntmachung der Eintragung zu diesem Zweck bei ihm melden."
    },
    {
      "date": "2026-02-03",
      "id": "144145",
      "original_text": "Einreichung neuer Dokumente\nBayern Amtsgericht Bayreuth HRB 4923\nTenneT TSO GmbH – Bayreuth",
      "type": "Einreichung neuer Dokumente",
      "state": "Bayern",
      "amtsgericht": "Amtsgericht Bayreuth",
      "registernummer": "HRB 4923",
      "registerart": "HRB",
      "company_name": "TenneT TSO GmbH",
      "company_seat": "Bayreuth",
      "details": "03.02.2026 (Bekanntmachungsdatum)\n\nBayern Amtsgericht Bayreuth HRB 4923\nEinreichung neuer Dokumente\n\nTenneT TSO GmbH\nGesellschaft mit beschränkter Haftung\nBayreuth\n\nDem Amtsgericht Bayreuth -Registergericht- ist eine Liste der Mitglieder des Aufsichtsrats eingereicht worden, § 52 Abs. 3 S. 2 GmbHG."
    },
    {
      "date": "2026-02-03",
      "id": "144146",
      "original_text": "Einreichung neuer Dokumente\nBayern Amtsgericht München HRB 254403\nsdm SE – München",
      "type": "Einreichung neuer Dokumente",
      "state": "Bayern",
      "amtsgericht": "Amtsgericht München",
      "registernummer": "HRB 254403",
      "registerart": "HRB",
      "company_name": "sdm SE",
      "company_seat": "München",
      "details": "03.02.2026 (Bekanntmachungsdatum)\n\nBayern Amtsgericht München HRB 254403\nEinreichung neuer Dokumente 02.02.2026 (Eintragungsdatum)\n\nsdm SE\nEuropäische Aktiengesellschaft (SE)\nMünchen\n\nDem Amtsgericht München -Registergericht- ist eine Liste der Mitglieder des Aufsichtsrats eingereicht worden, Art. 9 Abs. 1 Buchst. c (ii) SE-VO i.V.m. § 106 AktG."
    },
    {
      "date": "2026-02-03",
      "id": "144147",
      "original_text": "Registerbekanntmachung nach dem Umwandlungsgesetz\nBayern Amtsgericht München HRB 295841\nDBL R Invest GmbH – München",
      "type": "Registerbekanntmachung nach dem Umwandlungsgesetz",
      "state": "Bayern",
      "amtsgericht": "Amtsgericht München",
      "registernummer": "HRB 295841",
      "registerart": "HRB",
      "company_name": "DBL R Invest GmbH",
      "company_seat": "München",
      "details": "03.02.2026 (Bekanntmachungsdatum)\n\nBayern Amtsgericht München HRB 295841\nRegisterbekanntmachung nach dem Umwandlungsgesetz 02.02.2026 (Eintragungsdatum)\n\nDBL R Invest GmbH\nGesellschaft mit beschränkter Haftung\nMünchen\n\nDen Gläubigern der an der Verschmelzung beteiligten Rechtsträger ist, wenn sie binnen sechs Monaten nach dem Tag, an dem die Eintragung der Verschmelzung in das Register des Sitzes desjenigen Rechtsträgers, dessen Gläubiger sie sind, nach § 19 Abs. 3 UmwG als bekannt gemacht gilt, ihren Anspruch nach Grund und Höhe in Textform anmelden, Sicherheit zu leisten, soweit sie nicht Befriedigung verlangen können. Dieses Recht steht den Gläubigern jedoch nur zu, wenn sie glaubhaft machen, dass durch die Verschmelzung die Erfüllung ihrer Forderung gefährdet wird."
    },
    {
      "date": "2026-02-03",
      "id": "144148",
      "original_text": "Registerbekanntmachung nach dem Umwandlungsgesetz\nBayern Amtsgericht München HRB 130927\nB & S Private Equity Verwaltung GmbH – München",
      "type": "Registerbekanntmachung nach dem Umwandlungsgesetz",
      "state": "Bayern",
      "amtsgericht": "Amtsgericht München",
      "registernummer": "HRB 130927",
      "registerart": "HRB",
      "company_name": "B & S Private Equity Verwaltung GmbH",
      "company_seat": "München",
      "details": "03.02.2026 (Bekanntmachungsdatum)\n\nBayern Amtsgericht München HRB 130927\nRegisterbekanntmachung nach dem Umwandlungsgesetz 02.02.2026 (Eintragungsdatum)\n\nB & S Private Equity Verwaltung GmbH\nGesellschaft mit beschränkter Haftung\nMünchen\n\nDen Gläubigern der an der Verschmelzung beteiligten Rechtsträger ist, wenn sie binnen sechs Monaten nach dem Tag, an dem die Eintragung der Verschmelzung in das Register des Sitzes desjenigen Rechtsträgers, dessen Gläubiger sie sind, nach § 19 Abs. 3 UmwG als bekannt gemacht gilt, ihren Anspruch nach Grund und Höhe in Textform anmelden, Sicherheit zu leisten, soweit sie nicht Befriedigung verlangen können. Dieses Recht steht den Gläubigern jedoch nur zu, wenn sie glaubhaft machen, dass durch die Verschmelzung die Erfüllung ihrer Forderung gefährdet wird."
    },
    {
      "date": "2026-02-03",
      "id": "144149",
      "original_text": "Löschungsankündigung\nBerlin Amtsgericht Berlin (Charlottenburg) HRB 219367\nBlackLeon Mietwagen GmbH – Berlin",
      "type": "Löschungsankündigung",
      "state": "Berlin",
      "amtsgericht": "Amtsgericht Berlin (Charlottenburg)",
      "registernummer": "HRB 219367",
      "registerart": "HRB",
      "company_name": "BlackLeon Mietwagen GmbH",
      "company_seat": "Berlin",
      "details": "03.02.2026 (Bekanntmachungsdatum)\n\nBerlin Amtsgericht Berlin (Charlottenburg) HRB 219367\nLöschungsankündigung\n\nBlackLeon Mietwagen GmbH\nGesellschaft mit beschränkter Haftung\nBerlin\n\nBei der nachstehenden Gesellschaft wird das Amtslöschungsverfahren gemäß § 394 FamFG eingeleitet. Widerspruchsfrist\n6 Wochen."
    },
    {
      "date": "2026-02-03",
      "id": "144150",
      "original_text": "Löschungsankündigung\nBerlin Amtsgericht Berlin (Charlottenburg) HRB 116508\nOK Objektküchen GmbH – Berlin",
      "type": "Löschungsankündigung",
      "state": "Berlin",
      "amtsgericht": "Amtsgericht Berlin (Charlottenburg)",
      "registernummer": "HRB 116508",
      "registerart": "HRB",
      "company_name": "OK Objektküchen GmbH",
      "company_seat": "Berlin",
      "details": "03.02.2026 (Bekanntmachungsdatum)\n\nBerlin Amtsgericht Berlin (Charlottenburg) HRB 116508\nLöschungsankündigung\n\nOK Objektküchen GmbH\nGesellschaft mit beschränkter Haftung\nBerlin\n\nBei der nachstehenden Gesellschaft wird das Amtslöschungsverfahren gemäß § 394 FamFG eingeleitet. Widerspruchsfrist 6 Wochen"
    },
    {
      "date": "2026-02-03",
      "id": "144151",
      "original_text": "Einreichung neuer Dokumente\nBaden-Württemberg Amtsgericht Stuttgart HRB 310155\nMercedes - AMG Gesellschaft mit beschränkter Haftung – Affalterbach",
      "type": "Einreichung neuer Dokumente",
      "state": "Baden-Württemberg",
      "amtsgericht": "Amtsgericht Stuttgart",
      "registernummer": "HRB 310155",
      "registerart": "HRB",
      "company_name": "Mercedes - AMG Gesellschaft mit beschränkter Haftung",
      "company_seat": "Affalterbach",
      "details": "03.02.2026 (Bekanntmachungsdatum)\n\nBaden-Württemberg Amtsgericht Stuttgart HRB 310155\nEinreichung neuer Dokumente\n\nMercedes - AMG Gesellschaft mit beschränkter Haftung\nGesellschaft mit beschränkter Haftung\nAffalterbach\n\nDie Gesellschaft hat am 30.01.2026 die Liste über die Zusammensetzung des Aufsichtsrats zum Handelsregister eingereicht."
    },
    {
      "date": "2026-02-03",
      "id": "144152",
      "original_text": "Registerbekanntmachung nach dem Umwandlungsgesetz\nBerlin Amtsgericht Berlin (Charlottenburg) HRB 218529\nNoble and Style Media GmbH – Berlin",
      "type": "Registerbekanntmachung nach dem Umwandlungsgesetz",
      "state": "Berlin",
      "amtsgericht": "Amtsgericht Berlin (Charlottenburg)",
      "registernummer": "HRB 218529",
      "registerart": "HRB",
      "company_name": "Noble and Style Media GmbH",
      "company_seat": "Berlin",
      "details": "03.02.2026 (Bekanntmachungsdatum)\n\nBerlin Amtsgericht Berlin (Charlottenburg) HRB 218529\nRegisterbekanntmachung nach dem Umwandlungsgesetz 02.02.2026 (Eintragungsdatum)\n\nNoble and Style Media GmbH\nGesellschaft mit beschränkter Haftung\nBerlin\n\nZu Eintragungsnummer 4 vom 02.02.2026 wird als nicht eingetragen veröffentlicht: Den Gläubigern der an der Verschmelzung beteiligten Rechtsträger ist, wenn sie binnen sechs Monaten nach dem Tag, an dem die Eintragung der Verschmelzung in das Register des Sitzes desjenigen Rechtsträgers, dessen Gläubiger sie sind, als bekannt gemacht gilt, ihren Anspruch nach Grund und Höhe schriftlich anmelden, Sicherheit zu leisten, soweit sie nicht Befriedigung verlangen können. Dieses Recht steht den Gläubigern jedoch nur zu, wenn sie glaubhaft machen, dass durch die Verschmelzung die Erfüllung ihrer Forderung gefährdet wird. Das Recht, Sicherheitsleistung zu verlangen, steht Gläubigern nicht zu, die im Falle der Insolvenz ein Recht auf vorzugsweise Befriedigung aus einer Deckungsmasse haben, die nach gesetzlicher Vorschrift zu ihrem Schutz errichtet und staatlich überwacht ist."
    },
    {
      "date": "2026-02-03",
      "id": "144153",
      "original_text": "Registerbekanntmachung nach dem Umwandlungsgesetz\nBerlin Amtsgericht Berlin (Charlottenburg) HRB 116761\nCLY communication GmbH – Berlin",
      "type": "Registerbekanntmachung nach dem Umwandlungsgesetz",
      "state": "Berlin",
      "amtsgericht": "Amtsgericht Berlin (Charlottenburg)",
      "registernummer": "HRB 116761",
      "registerart": "HRB",
      "company_name": "CLY communication GmbH",
      "company_seat": "Berlin",
      "details": "03.02.2026 (Bekanntmachungsdatum)\n\nBerlin Amtsgericht Berlin (Charlottenburg) HRB 116761\nRegisterbekanntmachung nach dem Umwandlungsgesetz 02.02.2026 (Eintragungsdatum)\n\nCLY communication GmbH\nGesellschaft mit beschränkter Haftung\nBerlin\n\nZu Eintragungsnummer 11 vom 02.02.2026 wird als nicht eingetragen veröffentlicht: Den Gläubigern der an der Verschmelzung beteiligten Rechtsträger ist, wenn sie binnen sechs Monaten nach dem Tag, an dem die Eintragung der Verschmelzung in das Register des Sitzes desjenigen Rechtsträgers, dessen Gläubiger sie sind, als bekannt gemacht gilt, ihren Anspruch nach Grund und Höhe schriftlich anmelden, Sicherheit zu leisten, soweit sie nicht Befriedigung verlangen können. Dieses Recht steht den Gläubigern jedoch nur zu, wenn sie glaubhaft machen, dass durch die Verschmelzung die Erfüllung ihrer Forderung gefährdet wird. Das Recht, Sicherheitsleistung zu verlangen, steht Gläubigern nicht zu, die im Falle der Insolvenz ein Recht auf vorzugsweise Befriedigung aus einer Deckungsmasse haben, die nach gesetzlicher Vorschrift zu ihrem Schutz errichtet und staatlich überwacht ist."
    },
    {
      "date": "2026-02-03",
      "id": "144154",
      "original_text": "Sonstige Registerbekanntmachung\nBaden-Württemberg Amtsgericht Mannheim HRB 232423\nHealth Logistics GmbH – Bruchsal",
      "type": "Sonstige Registerbekanntmachung",
      "state": "Baden-Württemberg",
      "amtsgericht": "Amtsgericht Mannheim",
      "registernummer": "HRB 232423",
      "registerart": "HRB",
      "company_name": "Health Logistics GmbH",
      "company_seat": "Bruchsal",
      "details": "03.02.2026 (Bekanntmachungsdatum)\n\nBaden-Württemberg Amtsgericht Mannheim HRB 232423\nSonstige Registerbekanntmachung 03.02.2026 (Eintragungsdatum)\n\nHealth Logistics GmbH\nGesellschaft mit beschränkter Haftung\nBruchsal\n\nDen Gläubigern der Gesellschaft, deren Forderungen begründet worden sind, bevor die Eintragung der Beendigung des Vertrages in das Handelsregister nach § 10 HGB als bekanntgemacht gilt, ist vom anderen Vertragsteil Sicherheit zu leisten, wenn sie sich binnen sechs Monaten nach der Bekanntmachung zu diesem Zweck bei ihm melden."
    },
    {
      "date": "2026-02-03",
      "id": "144155",
      "original_text": "Löschungsankündigung\nBrandenburg Amtsgericht Potsdam HRB 27860\nIAP Internationale Akademie für Personal-Qualifizierung und Gewinnung GmbH – Potsdam",
      "type": "Löschungsankündigung",
      "state": "Brandenburg",
      "amtsgericht": "Amtsgericht Potsdam",
      "registernummer": "HRB 27860",
      "registerart": "HRB",
      "company_name": "IAP Internationale Akademie für Personal-Qualifizierung und Gewinnung GmbH",
      "company_seat": "Potsdam",
      "details": "03.02.2026 (Bekanntmachungsdatum)\n\nBrandenburg Amtsgericht Potsdam HRB 27860\nLöschungsankündigung\n\nIAP Internationale Akademie für Personal-Qualifizierung und Gewinnung GmbH\nGesellschaft mit beschränkter Haftung\nPotsdam\n\nBei der nachstehenden Gesellschaft wird das Amtslöschungsverfahren gemäß § 394 FamFG eingeleitet. Widerspruchsfrist: 8 Wochen."
    },
    {
      "date": "2026-02-03",
      "id": "144156",
      "original_text": "Registerbekanntmachung nach dem Umwandlungsgesetz\nBaden-Württemberg Amtsgericht Stuttgart HRA 742803\nElektrotechnik Aberle e.K. – Horb am Neckar",
      "type": "Registerbekanntmachung nach dem Umwandlungsgesetz",
      "state": "Baden-Württemberg",
      "amtsgericht": "Amtsgericht Stuttgart",
      "registernummer": "HRA 742803",
      "registerart": "HRA",
      "company_name": "Elektrotechnik Aberle e.K.",
      "company_seat": "Horb am Neckar",
      "details": "03.02.2026 (Bekanntmachungsdatum)\n\nBaden-Württemberg Amtsgericht Stuttgart HRA 742803\nRegisterbekanntmachung nach dem Umwandlungsgesetz 03.02.2026 (Eintragungsdatum)\n\nElektrotechnik Aberle e.K.\nEinzelkaufmann / Einzelkauffrau\nHorb am Neckar\n\nDen Gläubigern der an der Ausgliederung beteiligten Rechtsträger ist, wenn sie binnen sechs Monaten nach dem Tag, an dem die Eintragung der Ausgliederung in das Register des Sitzes desjenigen Rechtsträgers, dessen Gläubiger sie sind, nach § 19 Abs. 3 UmwG als bekanntgemacht gilt, ihren Anspruch nach Grund und Höhe schriftlich anmelden, Sicherheit zu leisten, soweit sie nicht Befriedigung verlangen können. Dieses Recht steht den Gläubigern jedoch nur zu, wenn sie glaubhaft machen, dass durch die Ausgliederung die Erfüllung ihrer Forderung gefährdet wird."
    },
    {
      "date": "2026-02-03",
      "id": "144157",
      "original_text": "Registerbekanntmachung nach dem Umwandlungsgesetz\nBaden-Württemberg Amtsgericht Stuttgart HRB 803739\nElektrotechnik Aberle GmbH – Horb am Neckar",
      "type": "Registerbekanntmachung nach dem Umwandlungsgesetz",
      "state": "Baden-Württemberg",
      "amtsgericht": "Amtsgericht Stuttgart",
      "registernummer": "HRB 803739",
      "registerart": "HRB",
      "company_name": "Elektrotechnik Aberle GmbH",
      "company_seat": "Horb am Neckar",
      "details": "03.02.2026 (Bekanntmachungsdatum)\n\nBaden-Württemberg Amtsgericht Stuttgart HRB 803739\nRegisterbekanntmachung nach dem Umwandlungsgesetz 03.02.2026 (Eintragungsdatum)\n\nElektrotechnik Aberle GmbH\nGesellschaft mit beschränkter Haftung\nHorb am Neckar\n\nAls nicht eingetragen wird bekanntgemacht:\nDen Gläubigern der an der Ausgliederung beteiligten Rechtsträger ist, wenn sie binnen sechs Monaten nach dem Tag, an dem die Eintragung der Ausgliederung in das Register des Sitzes desjenigen Rechtsträgers, dessen Gläubiger sie sind, nach § 19 Abs. 3 UmwG als bekanntgemacht gilt, ihren Anspruch nach Grund und Höhe schriftlich anmelden, Sicherheit zu leisten, soweit sie nicht Befriedigung verlangen können. Dieses Recht steht den Gläubigern jedoch nur zu, wenn sie glaubhaft machen, dass durch die Ausgliederung die Erfüllung ihrer Forderung gefährdet wird."
    },
    {
      "date": "2026-02-03",
      "id": "144158",
      "original_text": "Registerbekanntmachung nach dem Umwandlungsgesetz\nMecklenburg-Vorpommern Amtsgericht Rostock HRA 5583\nMarcus Verch e.K. – Roggentin",
      "type": "Registerbekanntmachung nach dem Umwandlungsgesetz",
      "state": "Mecklenburg-Vorpommern",
      "amtsgericht": "Amtsgericht Rostock",
      "registernummer": "HRA 5583",
      "registerart": "HRA",
      "company_name": "Marcus Verch e.K.",
      "company_seat": "Roggentin",
      "details": "03.02.2026 (Bekanntmachungsdatum)\n\nMecklenburg-Vorpommern Amtsgericht Rostock HRA 5583\nRegisterbekanntmachung nach dem Umwandlungsgesetz 03.02.2026 (Eintragungsdatum)\n\nMarcus Verch e.K.\nEinzelkaufmann / Einzelkauffrau\nRoggentin\n\nAls nicht eingetragen wird veröffentlicht: Den Gläubigern der an der Ausgliederung beteiligten Rechtsträger ist, wenn sie binnen sechs Monaten nach dem Tag, an dem die Eintragung der Ausgliederung in das Register des Sitzes desjenigen Rechtsträgers, dessen Gläubiger sie sind, nach § 19 Abs. 3 UmwG als bekannt gemacht gilt, ihren Anspruch nach Grund und Höhe in Textform anmelden,\nSicherheit zu leisten, soweit sie nicht Befriedigung verlangen können. Dieses Recht steht den Gläubigern jedoch nur zu, wenn sie glaubhaft machen, dass durch die Ausgliederung die Erfüllung der Forderung gefährdet wird."
    },
    {
      "date": "2026-02-03",
      "id": "144159",
      "original_text": "Registerbekanntmachung nach dem Umwandlungsgesetz\nMecklenburg-Vorpommern Amtsgericht Rostock HRA 5601\nV-Team GmbH & Co. KG – Roggentin",
      "type": "Registerbekanntmachung nach dem Umwandlungsgesetz",
      "state": "Mecklenburg-Vorpommern",
      "amtsgericht": "Amtsgericht Rostock",
      "registernummer": "HRA 5601",
      "registerart": "HRA",
      "company_name": "V-Team GmbH & Co. KG",
      "company_seat": "Roggentin",
      "details": "03.02.2026 (Bekanntmachungsdatum)\n\nMecklenburg-Vorpommern Amtsgericht Rostock HRA 5601\nRegisterbekanntmachung nach dem Umwandlungsgesetz 03.02.2026 (Eintragungsdatum)\n\nV-Team GmbH & Co. KG\nKommanditgesellschaft\nRoggentin\n\nAls nicht eingetragen wird veröffentlicht: Den Gläubigern der an der Ausgliederung beteiligten Rechtsträger ist, wenn sie binnen sechs Monaten nach dem Tag, an dem die Eintragung der Ausgliederung in das Register des Sitzes desjenigen Rechtsträgers, dessen Gläubiger sie sind, nach § 19 Abs. 3 UmwG als bekannt gemacht gilt, ihren Anspruch nach Grund und Höhe in Textform anmelden,\nSicherheit zu leisten, soweit sie nicht Befriedigung verlangen können. Dieses Recht steht den Gläubigern jedoch nur zu, wenn sie glaubhaft machen, dass durch die Ausgliederung die Erfüllung der Forderung gefährdet wird."
    },
    {
      "date": "2026-02-03",
      "id": "144160",
      "original_text": "Registerbekanntmachung nach dem Umwandlungsgesetz\nBerlin Amtsgericht Berlin (Charlottenburg) HRB 73056\nECONA AG – Berlin",
      "type": "Registerbekanntmachung nach dem Umwandlungsgesetz",
      "state": "Berlin",
      "amtsgericht": "Amtsgericht Berlin (Charlottenburg)",
      "registernummer": "HRB 73056",
      "registerart": "HRB",
      "company_name": "ECONA AG",
      "company_seat": "Berlin",
      "details": "03.02.2026 (Bekanntmachungsdatum)\n\nBerlin Amtsgericht Berlin (Charlottenburg) HRB 73056\nRegisterbekanntmachung nach dem Umwandlungsgesetz 02.02.2026 (Eintragungsdatum)\n\nECONA  AG\nAktiengesellschaft\nBerlin\n\nDen Gläubigern ist, wenn sie binnen sechs Monaten nach dem Tag, an dem die Eintragung der Umwandlung als bekannt gemacht gilt, ihren Anspruch nach Grund und Höhe schriftlich anmelden, Sicherheit zu leisten, soweit sie nicht Befriedigung verlangen können. Dieses Recht steht den Gläubigern jedoch nur zu, wenn sie glaubhaft machen, dass durch die Umwandlung die Erfüllung ihrer Forderung gefährdet wird. Das Recht, Sicherheitsleistung zu verlangen, steht Gläubigern nicht zu, die im Falle der Insolvenz ein Recht auf vorzugsweise Befriedigung aus einer Deckungsmasse haben, die nach gesetzlicher Vorschrift zu ihrem Schutz errichtet und staatlich überwacht ist.Zu Eintragungsnummer 22 vom 02.02.2026 wird als nicht eingetragen veröffentlicht:"
    },
    {
      "date": "2026-02-03",
      "id": "144161",
      "original_text": "Registerbekanntmachung nach dem Umwandlungsgesetz\nSchleswig-Holstein Amtsgericht Pinneberg HRB 17942\nAsterix HoldCo AG – Elmshorn",
      "type": "Registerbekanntmachung nach dem Umwandlungsgesetz",
      "state": "Schleswig-Holstein",
      "amtsgericht": "Amtsgericht Pinneberg",
      "registernummer": "HRB 17942",
      "registerart": "HRB",
      "company_name": "Asterix HoldCo AG",
      "company_seat": "Elmshorn",
      "details": "03.02.2026 (Bekanntmachungsdatum)\n\nSchleswig-Holstein Amtsgericht Pinneberg HRB 17942\nRegisterbekanntmachung nach dem Umwandlungsgesetz 29.01.2026 (Eintragungsdatum)\n\nAsterix HoldCo AG\nAktiengesellschaft\nElmshorn\n\nZu Eintragungsnummer 5 vom 29.01.2026 wird als nicht eingetragen veröffentlicht: Den Gläubigern der an der Verschmelzung beteiligten Rechtsträger ist, wenn sie binnen sechs Monaten nach dem Tag, an dem die Eintragung der Verschmelzung in das Register des Sitzes desjenigen Rechtsträgers, dessen Gläubiger sie sind, als bekannt gemacht gilt, ihren Anspruch nach Grund und Höhe schriftlich anmelden, Sicherheit zu leisten, soweit sie nicht Befriedigung verlangen können. Dieses Recht steht den Gläubigern jedoch nur zu, wenn sie glaubhaft machen, dass durch die Verschmelzung die Erfüllung ihrer Forderung gefährdet wird. Das Recht, Sicherheitsleistung zu verlangen, steht Gläubigern nicht zu, die im Falle der Insolvenz ein Recht auf vorzugsweise Befriedigung aus einer Deckungsmasse haben, die nach gesetzlicher Vorschrift zu ihrem Schutz errichtet und staatlich überwacht ist."
    },
    {
      "date": "2026-02-03",
      "id": "144162",
      "original_text": "Registerbekanntmachung nach dem Umwandlungsgesetz\nSchleswig-Holstein Amtsgericht Kiel HRB 490 EC\nDruckerei Lohmeier GmbH – Eckernförde",
      "type": "Registerbekanntmachung nach dem Umwandlungsgesetz",
      "state": "Schleswig-Holstein",
      "amtsgericht": "Amtsgericht Kiel",
      "registernummer": "HRB 490 EC",
      "registerart": "HRB",
      "company_name": "Druckerei Lohmeier GmbH",
      "company_seat": "Eckernförde",
      "details": "03.02.2026 (Bekanntmachungsdatum)\n\nSchleswig-Holstein Amtsgericht Kiel HRB 490 EC\nRegisterbekanntmachung nach dem Umwandlungsgesetz 02.02.2026 (Eintragungsdatum)\n\nDruckerei Lohmeier GmbH\nGesellschaft mit beschränkter Haftung\nEckernförde\n\nAls nicht eingetragen wird veröffentlicht: Den Gläubigern der an der Verschmelzung beteiligten Rechtsträger ist, wenn sie binnen sechs Monaten nach dem Tag, an dem die Eintragung der Verschmelzung in das Register des Sitzes desjenigen Rechtsträgers, dessen Gläubiger sie sind, nach § 19 Abs. 3 UmwG bekannt gemacht worden ist, ihren Anspruch nach Grund und Höhe schriftlich anmelden, Sicherheit zu leisten, soweit sie nicht Befriedigung verlangen können. Dieses Recht steht den Gläubigern jedoch nur zu, wenn sie glaubhaft machen, dass durch die Verschmelzung die Erfüllung ihrer Forderung gefährdet wird."
    },
    {
      "date": "2026-02-03",
      "id": "144163",
      "original_text": "Löschungsankündigung\nBaden-Württemberg Amtsgericht Freiburg HRB 715218\nRohan 1 GmbH – Ettenheim",
      "type": "Löschungsankündigung",
      "state": "Baden-Württemberg",
      "amtsgericht": "Amtsgericht Freiburg",
      "registernummer": "HRB 715218",
      "registerart": "HRB",
      "company_name": "Rohan 1 GmbH",
      "company_seat": "Ettenheim",
      "details": "03.02.2026 (Bekanntmachungsdatum)\n\nBaden-Württemberg Amtsgericht Freiburg HRB 715218\nLöschungsankündigung\n\nRohan 1 GmbH\nGesellschaft mit beschränkter Haftung\nEttenheim\n\nAls nicht eingetragen wird bekanntgemacht:\nDas Gericht beabsichtigt, die Gesellschaft wegen Vermögenslosigkeit im Handelsregister von Amts wegen nach § 394 FamFG zu löschen. Die Frist zur Geltendmachung eines Widerspruchs gegen die beabsichtigte Löschung ist auf einen Monat ab Veröffentlichung bestimmt."
    },
    {
      "date": "2026-02-03",
      "id": "144164",
      "original_text": "Löschungsankündigung\nBaden-Württemberg Amtsgericht Freiburg HRB 727217\nAdva Trade UG (haftungsbeschränkt) – Freiburg im Breisgau",
      "type": "Löschungsankündigung",
      "state": "Baden-Württemberg",
      "amtsgericht": "Amtsgericht Freiburg",
      "registernummer": "HRB 727217",
      "registerart": "HRB",
      "company_name": "Adva Trade UG (haftungsbeschränkt)",
      "company_seat": "Freiburg im Breisgau",
      "details": "03.02.2026 (Bekanntmachungsdatum)\n\nBaden-Württemberg Amtsgericht Freiburg HRB 727217\nLöschungsankündigung\n\nAdva Trade UG (haftungsbeschränkt)\nGesellschaft mit beschränkter Haftung\nFreiburg im Breisgau\n\nAls nicht eingetragen wird bekanntgemacht:\nDas Gericht beabsichtigt, die Gesellschaft wegen Vermögenslosigkeit im Handelsregister von Amts wegen nach § 394 FamFG zu löschen. Die Frist zur Geltendmachung eines Widerspruchs gegen die beabsichtigte Löschung ist auf einen Monat ab Veröffentlichung bestimmt."
    },
    {
      "date": "2026-02-03",
      "id": "144165",
      "original_text": "Löschungsankündigung\nSaarland Amtsgericht Saarbrücken HRA 11081\nAD & C Application Design & Consulting GmbH & Co. KG – Saarlouis",
      "type": "Löschungsankündigung",
      "state": "Saarland",
      "amtsgericht": "Amtsgericht Saarbrücken",
      "registernummer": "HRA 11081",
      "registerart": "HRA",
      "company_name": "AD & C Application Design & Consulting GmbH & Co. KG",
      "company_seat": "Saarlouis",
      "details": "03.02.2026 (Bekanntmachungsdatum)\n\nSaarland Amtsgericht Saarbrücken HRA 11081\nLöschungsankündigung 16.01.2024 (Eintragungsdatum)\n\nAD & C Application Design & Consulting GmbH & Co. KG\nKommanditgesellschaft\nSaarlouis\n\nEs ist beabsichtigt, die Gesellschaft von Amts wegen gemäß § 394 FamFG wegen Vermögenslosigkeit zu löschen.\nGegen die Löschung von Amts wegen ist das Rechtsmittel des Widerspruchs statthaft. Der Widerspruch ist binnen einer Frist zwei Monaten beginnend mit dem Tag dieser Veröffentlichung durch Einreichen eines Widerspruchsschreibens -schriftlich oder zur Niederschrift der Geschäftsstelle beim Amtsgericht Saarbrücken, -zentrales Handelsregister-, Mainzerstr.178, 66121 Saarbrücken einzulegen.\nDer Widerspruch muss die Bezeichnung der angefochtenen Löschungsankündigung enthalten sowie die Erklärung, dass Widerspruch eingelegt wird. Er ist vom Widerspruchsführer oder seinem Bevollmächtigten zu unterzeichnen.\nDas Widerspruchsschreiben kann auch in der Form eines elektronischen Dokumentes eingereicht werden, das mit einer qualifizierten elektronischen Signatur nach dem Signaturgesetz versehen sein muss (§§ 14 Abs. 2 FamFG, 130a, 298 ZPO)."
    },
    {
      "date": "2026-02-03",
      "id": "144166",
      "original_text": "Sonstige Registerbekanntmachung\nBerlin Amtsgericht Berlin (Charlottenburg) HRB 216074\nDRK Sozialwerk Berlin gemeinnützige GmbH – Berlin",
      "type": "Sonstige Registerbekanntmachung",
      "state": "Berlin",
      "amtsgericht": "Amtsgericht Berlin (Charlottenburg)",
      "registernummer": "HRB 216074",
      "registerart": "HRB",
      "company_name": "DRK Sozialwerk Berlin gemeinnützige GmbH",
      "company_seat": "Berlin",
      "details": "03.02.2026 (Bekanntmachungsdatum)\n\nBerlin Amtsgericht Berlin (Charlottenburg) HRB 216074\nSonstige Registerbekanntmachung\n\nDRK Sozialwerk Berlin gemeinnützige GmbH\nGesellschaft mit beschränkter Haftung\nBerlin\n\nAls nicht eingetragen wird veröffentlicht:Es wurde eine neue Liste der Aufsichtsratsmitglieder eingereicht (§52 GmbHG)."
    },
    {
      "date": "2026-02-03",
      "id": "144167",
      "original_text": "Sonstige Registerbekanntmachung\nThüringen Amtsgericht Jena HRB 500102\nTierproduktion Alkersleben GmbH – Rippershausen",
      "type": "Sonstige Registerbekanntmachung",
      "state": "Thüringen",
      "amtsgericht": "Amtsgericht Jena",
      "registernummer": "HRB 500102",
      "registerart": "HRB",
      "company_name": "Tierproduktion Alkersleben GmbH",
      "company_seat": "Rippershausen",
      "details": "03.02.2026 (Bekanntmachungsdatum)\n\nThüringen Amtsgericht Jena HRB 500102\nSonstige Registerbekanntmachung 03.02.2026 (Eintragungsdatum)\n\nTierproduktion Alkersleben GmbH\nGesellschaft mit beschränkter Haftung\nRippershausen\n\nNicht eingetragen: Den Gläubigern der Gesellschaft, deren Forderungen begründet worden sind, bevor die Eintragung der Beendigung des Vertrages in das Handelsregister nach § 10 des Handelsgesetzbuches als bekanntgemacht gilt, hat der andere Vertragsteil Sicherheit zu leisten, wenn sie sich binnen sechs Monaten nach der Bekanntmachung der Eintragung zu diesem Zweck bei ihm melden."
    },
    {
      "date": "2026-02-03",
      "id": "144168",
      "original_text": "Einreichung neuer Dokumente\nThüringen Amtsgericht Jena HRB 102507\nOhra Energie GmbH – Hörsel",
      "type": "Einreichung neuer Dokumente",
      "state": "Thüringen",
      "amtsgericht": "Amtsgericht Jena",
      "registernummer": "HRB 102507",
      "registerart": "HRB",
      "company_name": "Ohra Energie GmbH",
      "company_seat": "Hörsel",
      "details": "03.02.2026 (Bekanntmachungsdatum)\n\nThüringen Amtsgericht Jena HRB 102507\nEinreichung neuer Dokumente\n\nOhra Energie GmbH\nGesellschaft mit beschränkter Haftung\nHörsel\n\nBekanntmachung gem. § 52 Abs. 3 Satz 2 GmbHG: Aufgrund einer Veränderung in den Personen der Aufsichtsratsmitglieder ist durch die Geschäftsführer eine neue Liste zum Handelsregister eingereicht worden."
    },
    {
      "date": "2026-02-03",
      "id": "144169",
      "original_text": "Löschungsankündigung\nThüringen Amtsgericht Jena HRB 514372\nBäckerei Heubach UG (haftungsbeschränkt) – Ilmenau",
      "type": "Löschungsankündigung",
      "state": "Thüringen",
      "amtsgericht": "Amtsgericht Jena",
      "registernummer": "HRB 514372",
      "registerart": "HRB",
      "company_name": "Bäckerei Heubach UG (haftungsbeschränkt)",
      "company_seat": "Ilmenau",
      "details": "03.02.2026 (Bekanntmachungsdatum)\n\nThüringen Amtsgericht Jena HRB 514372\nLöschungsankündigung\n\nBäckerei Heubach UG (haftungsbeschränkt)\nGesellschaft mit beschränkter Haftung\nIlmenau\n\nDas Registergericht beabsichtigt, die im Handelsregister eingetragene Gesellschaft wegen Vermögenslosigkeit nach § 394 FamFG von Amts wegen zu löschen. Die Frist zur Erhebung eines Widerspruchs gegen die beabsichtigte Löschung wird auf 6 Wochen festgesetzt."
    },
    {
      "date": "2026-02-03",
      "id": "144170",
      "original_text": "Einreichung neuer Dokumente\nSchleswig-Holstein Amtsgericht Kiel HRB 29028\nStadtbahn Planungs- und Baugesellschaft mbH – Kiel",
      "type": "Einreichung neuer Dokumente",
      "state": "Schleswig-Holstein",
      "amtsgericht": "Amtsgericht Kiel",
      "registernummer": "HRB 29028",
      "registerart": "HRB",
      "company_name": "Stadtbahn Planungs- und Baugesellschaft mbH",
      "company_seat": "Kiel",
      "details": "03.02.2026 (Bekanntmachungsdatum)\n\nSchleswig-Holstein Amtsgericht Kiel HRB 29028\nEinreichung neuer Dokumente\n\nStadtbahn Planungs- und Baugesellschaft mbH\nGesellschaft mit beschränkter Haftung\nKiel\n\nAls nicht eingetragen wird veröffentlicht :Eine neue Liste der Gesellschafter ist eingereicht worden."
    },
    {
      "date": "2026-02-03",
      "id": "144171",
      "original_text": "Registerbekanntmachung nach dem Umwandlungsgesetz\nBaden-Württemberg Amtsgericht Mannheim HRB 752494\nMaison Tom GmbH – Karlsruhe",
      "type": "Registerbekanntmachung nach dem Umwandlungsgesetz",
      "state": "Baden-Württemberg",
      "amtsgericht": "Amtsgericht Mannheim",
      "registernummer": "HRB 752494",
      "registerart": "HRB",
      "company_name": "Maison Tom GmbH",
      "company_seat": "Karlsruhe",
      "details": "03.02.2026 (Bekanntmachungsdatum)\n\nBaden-Württemberg Amtsgericht Mannheim HRB 752494\nRegisterbekanntmachung nach dem Umwandlungsgesetz 03.02.2026 (Eintragungsdatum)\n\nMaison Tom GmbH\nGesellschaft mit beschränkter Haftung\nKarlsruhe\n\nAls nicht eingetragen wird bekanntgemacht:\nDen Gläubigern der an der Ausgliederung beteiligten Rechtsträger ist, wenn sie binnen sechs Monaten nach dem Tag, an dem die Eintragung der Ausgliederung in das Register des Sitzes desjenigen Rechtsträgers, dessen Gläubiger sie sind, nach § 19 Abs. 3 UmwG als bekanntgemacht gilt, ihren Anspruch nach Grund und Höhe schriftlich anmelden, Sicherheit zu leisten, soweit sie nicht Befriedigung verlangen können. Dieses Recht steht den Gläubigern jedoch nur zu, wenn sie glaubhaft machen, dass durch die Ausgliederung die Erfüllung ihrer Forderung gefährdet wird."
    },
    {
      "date": "2026-02-03",
      "id": "144172",
      "original_text": "Löschungsankündigung\nSaarland Amtsgericht Saarbrücken HRB 106245\nPaper Street Food Company GmbH – Spiesen-Elversberg",
      "type": "Löschungsankündigung",
      "state": "Saarland",
      "amtsgericht": "Amtsgericht Saarbrücken",
      "registernummer": "HRB 106245",
      "registerart": "HRB",
      "company_name": "Paper Street Food Company GmbH",
      "company_seat": "Spiesen-Elversberg",
      "details": "03.02.2026 (Bekanntmachungsdatum)\n\nSaarland Amtsgericht Saarbrücken HRB 106245\nLöschungsankündigung\n\nPaper Street Food Company GmbH\nGesellschaft mit beschränkter Haftung\nSpiesen-Elversberg\n\nEs ist beabsichtigt, die Gesellschaft von Amts wegen gemäß § 394 FamFG wegen Vermögenslosigkeit zu löschen.\nGegen die Löschung von Amts wegen ist das Rechtsmittel des Widerspruchs statthaft. Der Widerspruch ist binnen einer Frist zwei Monaten beginnend mit dem Tag dieser Veröffentlichung durch Einreichen eines Widerspruchsschreibens -schriftlich oder zur Niederschrift der Geschäftsstelle beim Amtsgericht Saarbrücken, -zentrales Handelsregister-, Mainzerstr.178, 66121 Saarbrücken einzulegen.\nDer Widerspruch muss die Bezeichnung der angefochtenen Löschungsankündigung enthalten sowie die Erklärung, dass Widerspruch eingelegt wird. Er ist vom Widerspruchsführer oder seinem Bevollmächtigten zu unterzeichnen.\nDas Widerspruchsschreiben kann auch in der Form eines elektronischen Dokumentes eingereicht werden, das mit einer qualifizierten elektronischen Signatur nach dem Signaturgesetz versehen sein muss (§§ 14 Abs. 2 FamFG, 130a, 298 ZPO)."
    },
    {
      "date": "2026-02-03",
      "id": "144173",
      "original_text": "Registerbekanntmachung nach dem Umwandlungsgesetz\nSchleswig-Holstein Amtsgericht Lübeck HRA 11548\nLego Industriemontage e.K. – Glinde",
      "type": "Registerbekanntmachung nach dem Umwandlungsgesetz",
      "state": "Schleswig-Holstein",
      "amtsgericht": "Amtsgericht Lübeck",
      "registernummer": "HRA 11548",
      "registerart": "HRA",
      "company_name": "Lego Industriemontage e.K.",
      "company_seat": "Glinde",
      "details": "03.02.2026 (Bekanntmachungsdatum)\n\nSchleswig-Holstein Amtsgericht Lübeck HRA 11548\nRegisterbekanntmachung nach dem Umwandlungsgesetz 02.02.2026 (Eintragungsdatum)\n\nLego Industriemontage e.K.\nEinzelkaufmann / Einzelkauffrau\nGlinde\n\nZu Eintragungsnummer 2 vom 02.02.2026 wird als nicht eingetragen veröffentlicht:Den Gläubigern der an der Ausgliederung beteiligten Rechtsträger ist, wenn sie binnen sechs Monaten nach dem Tag, an dem die Eintragung der Ausgliederung in das Register des Sitzes desjenigen Rechtsträgers, dessen Gläubiger sie sind, als bekannt gemacht gilt, ihren Anspruch nach Grund und Höhe schriftlich anmelden, Sicherheit zu leisten, soweit sie nicht Befriedigung verlangen können. Dieses Recht steht den Gläubigern jedoch nur zu, wenn sie glaubhaft machen, dass durch die Ausgliederung die Erfüllung ihrer Forderung gefährdet wird."
    },
    {
      "date": "2026-02-03",
      "id": "144174",
      "original_text": "Registerbekanntmachung nach dem Umwandlungsgesetz\nBerlin Amtsgericht Berlin (Charlottenburg) HRB 279728\nVistaprint Deutschland GmbH – Berlin",
      "type": "Registerbekanntmachung nach dem Umwandlungsgesetz",
      "state": "Berlin",
      "amtsgericht": "Amtsgericht Berlin (Charlottenburg)",
      "registernummer": "HRB 279728",
      "registerart": "HRB",
      "company_name": "Vistaprint Deutschland GmbH",
      "company_seat": "Berlin",
      "details": "03.02.2026 (Bekanntmachungsdatum)\n\nBerlin Amtsgericht Berlin (Charlottenburg) HRB 279728\nRegisterbekanntmachung nach dem Umwandlungsgesetz 02.02.2026 (Eintragungsdatum)\n\nVistaprint Deutschland GmbH\nGesellschaft mit beschränkter Haftung\nBerlin\n\nZu Eintragungsnummer 4 vom 02.02.2026 wird als nicht eingetragen veröffentlicht: Den Gläubigern der an der Verschmelzung beteiligten Rechtsträger ist, wenn sie binnen sechs Monaten nach dem Tag, an dem die Eintragung der Verschmelzung in das Register des Sitzes desjenigen Rechtsträgers, dessen Gläubiger sie sind, als bekannt gemacht gilt, ihren Anspruch nach Grund und Höhe schriftlich anmelden, Sicherheit zu leisten, soweit sie nicht Befriedigung verlangen können. Dieses Recht steht den Gläubigern jedoch nur zu, wenn sie glaubhaft machen, dass durch die Verschmelzung die Erfüllung ihrer Forderung gefährdet wird. Das Recht, Sicherheitsleistung zu verlangen, steht Gläubigern nicht zu, die im Falle der Insolvenz ein Recht auf vorzugsweise Befriedigung aus einer Deckungsmasse haben, die nach gesetzlicher Vorschrift zu ihrem Schutz errichtet und staatlich überwacht ist."
    },
    {
      "date": "2026-02-03",
      "id": "144175",
      "original_text": "Registerbekanntmachung nach dem Umwandlungsgesetz\nBerlin Amtsgericht Berlin (Charlottenburg) HRB 115906\nCimpress Deutschland GmbH – Berlin",
      "type": "Registerbekanntmachung nach dem Umwandlungsgesetz",
      "state": "Berlin",
      "amtsgericht": "Amtsgericht Berlin (Charlottenburg)",
      "registernummer": "HRB 115906",
      "registerart": "HRB",
      "company_name": "Cimpress Deutschland GmbH",
      "company_seat": "Berlin",
      "details": "03.02.2026 (Bekanntmachungsdatum)\n\nBerlin Amtsgericht Berlin (Charlottenburg) HRB 115906\nRegisterbekanntmachung nach dem Umwandlungsgesetz 02.02.2026 (Eintragungsdatum)\n\nCimpress Deutschland GmbH\nGesellschaft mit beschränkter Haftung\nBerlin\n\nZu Eintragungsnummer 13 vom 02.02.2026 wird als nicht eingetragen veröffentlicht: Den Gläubigern der an der Verschmelzung beteiligten Rechtsträger ist, wenn sie binnen sechs Monaten nach dem Tag, an dem die Eintragung der Verschmelzung in das Register des Sitzes desjenigen Rechtsträgers, dessen Gläubiger sie sind, als bekannt gemacht gilt, ihren Anspruch nach Grund und Höhe schriftlich anmelden, Sicherheit zu leisten, soweit sie nicht Befriedigung verlangen können. Dieses Recht steht den Gläubigern jedoch nur zu, wenn sie glaubhaft machen, dass durch die Verschmelzung die Erfüllung ihrer Forderung gefährdet wird. Das Recht, Sicherheitsleistung zu verlangen, steht Gläubigern nicht zu, die im Falle der Insolvenz ein Recht auf vorzugsweise Befriedigung aus einer Deckungsmasse haben, die nach gesetzlicher Vorschrift zu ihrem Schutz errichtet und staatlich überwacht ist."
    },
    {
      "date": "2026-02-03",
      "id": "144176",
      "original_text": "Registerbekanntmachung nach dem Umwandlungsgesetz\nSachsen-Anhalt Amtsgericht Stendal HRB 16823\nDiakonissenkrankenhaus Dessau gemeinnützige GmbH – Dessau-Roßlau",
      "type": "Registerbekanntmachung nach dem Umwandlungsgesetz",
      "state": "Sachsen-Anhalt",
      "amtsgericht": "Amtsgericht Stendal",
      "registernummer": "HRB 16823",
      "registerart": "HRB",
      "company_name": "Diakonissenkrankenhaus Dessau gemeinnützige GmbH",
      "company_seat": "Dessau-Roßlau",
      "details": "03.02.2026 (Bekanntmachungsdatum)\n\nSachsen-Anhalt Amtsgericht Stendal HRB 16823\nRegisterbekanntmachung nach dem Umwandlungsgesetz 03.02.2026 (Eintragungsdatum)\n\nDiakonissenkrankenhaus Dessau gemeinnützige GmbH\nGesellschaft mit beschränkter Haftung\nDessau-Roßlau\n\nNicht eingetragen:\nDen Gläubigern der an der Verschmelzung beteiligten Rechtsträger ist, wenn sie binnen sechs Monaten nach dem Tag, an dem die Eintragung der Verschmelzung nach § 19 Abs. 3 UmwG als bekanntgemacht gilt, ihren Anspruch nach Grund und Höhe schriftlich anmelden, Sicherheit zu leisten, soweit sie nicht Befriedigung verlangen können. Dieses Recht steht ihnen jedoch nur zu, wenn sie glaubhaft machen, dass durch die Verschmelzung die Erfüllung ihrer Forderung gefährdet wird."
    },
    {
      "date": "2026-02-03",
      "id": "144177",
      "original_text": "Löschungsankündigung\nBaden-Württemberg Amtsgericht Mannheim HRB 430728\nGrundstückserschließungs- und Grundstücksvertriebs-Gesellschaft mit beschränkter Haftung – Laudenbach",
      "type": "Löschungsankündigung",
      "state": "Baden-Württemberg",
      "amtsgericht": "Amtsgericht Mannheim",
      "registernummer": "HRB 430728",
      "registerart": "HRB",
      "company_name": "Grundstückserschließungs- und Grundstücksvertriebs-Gesellschaft mit beschränkter Haftung",
      "company_seat": "Laudenbach",
      "details": "03.02.2026 (Bekanntmachungsdatum)\n\nBaden-Württemberg Amtsgericht Mannheim HRB 430728\nLöschungsankündigung\n\nGrundstückserschließungs- und Grundstücksvertriebs-Gesellschaft mit beschränkter Haftung\nGesellschaft mit beschränkter Haftung\nLaudenbach\n\nDas Gericht beabsichtigt, die Gesellschaft wegen Vermögenslosigkeit im Handelsregister von Amts wegen nach § 394 FamFG zu löschen. Die Frist zur Geltendmachung eines Widerspruchs gegen die beabsichtigte Löschung ist auf einen Monat ab Veröffentlichung bestimmt."
    },
    {
      "date": "2026-02-03",
      "id": "144178",
      "original_text": "Löschungsankündigung\nBaden-Württemberg Amtsgericht Stuttgart HRB 24733\nWestparadiso GmbH – Stuttgart",
      "type": "Löschungsankündigung",
      "state": "Baden-Württemberg",
      "amtsgericht": "Amtsgericht Stuttgart",
      "registernummer": "HRB 24733",
      "registerart": "HRB",
      "company_name": "Westparadiso GmbH",
      "company_seat": "Stuttgart",
      "details": "03.02.2026 (Bekanntmachungsdatum)\n\nBaden-Württemberg Amtsgericht Stuttgart HRB 24733\nLöschungsankündigung\n\nWestparadiso GmbH\nGesellschaft mit beschränkter Haftung\nStuttgart\n\nAls nicht eingetragen wird bekanntgemacht:\nDas Gericht beabsichtigt, die Gesellschaft wegen Vermögenslosigkeit im Handelsregister von Amts wegen nach § 394 FamFG zu löschen. Die Frist zur Geltendmachung eines Widerspruchs gegen die beabsichtigte Löschung ist auf zwei Monate ab Veröffentlichung bestimmt."
    },
    {
      "date": "2026-02-03",
      "id": "144179",
      "original_text": "Registerbekanntmachung nach dem Umwandlungsgesetz\nSchleswig-Holstein Amtsgericht Pinneberg HRB 17882\nTG Gewerbefinanzierungen GmbH – Barmstedt",
      "type": "Registerbekanntmachung nach dem Umwandlungsgesetz",
      "state": "Schleswig-Holstein",
      "amtsgericht": "Amtsgericht Pinneberg",
      "registernummer": "HRB 17882",
      "registerart": "HRB",
      "company_name": "TG Gewerbefinanzierungen GmbH",
      "company_seat": "Barmstedt",
      "details": "03.02.2026 (Bekanntmachungsdatum)\n\nSchleswig-Holstein Amtsgericht Pinneberg HRB 17882\nRegisterbekanntmachung nach dem Umwandlungsgesetz 02.02.2026 (Eintragungsdatum)\n\nTG Gewerbefinanzierungen GmbH\nGesellschaft mit beschränkter Haftung\nBarmstedt\n\nZu Eintragungsnummer 2 vom 02.02.2026 wird als nicht eingetragen veröffentlicht:  Als nicht eingetragen wird veröffentlicht: Den Gläubigern der an der Verschmelzung beteiligten Rechtsträger ist, wenn sie binnen sechs Monaten nach dem Tag, an dem die Eintragung der Verschmelzung in das Register des Sitzes desjenigen Rechtsträgers, dessen Gläubiger sie sind, als bekannt gemacht gilt, ihren Anspruch nach Grund und Höhe schriftlich anmelden, Sicherheit zu leisten, soweit sie nicht Befriedigung verlangen können. Dieses Recht steht den Gläubigern jedoch nur zu, wenn sie glaubhaft machen, dass durch die Verschmelzung die Erfüllung ihrer Forderung gefährdet wird. Das Recht, Sicherheitsleistung zu verlangen, steht Gläubigern nicht zu, die im Falle der Insolvenz ein Recht auf vorzugsweise Befriedigung aus einer Deckungsmasse haben, die nach gesetzlicher Vorschrift zu ihrem Schutz errichtet und staatlich überwacht ist."
    },
    {
      "date": "2026-02-03",
      "id": "144180",
      "original_text": "Registerbekanntmachung nach dem Umwandlungsgesetz\nBaden-Württemberg Amtsgericht Stuttgart HRB 481093\nMC Shape Schramberg GmbH – Nagold",
      "type": "Registerbekanntmachung nach dem Umwandlungsgesetz",
      "state": "Baden-Württemberg",
      "amtsgericht": "Amtsgericht Stuttgart",
      "registernummer": "HRB 481093",
      "registerart": "HRB",
      "company_name": "MC Shape Schramberg GmbH",
      "company_seat": "Nagold",
      "details": "03.02.2026 (Bekanntmachungsdatum)\n\nBaden-Württemberg Amtsgericht Stuttgart HRB 481093\nRegisterbekanntmachung nach dem Umwandlungsgesetz 03.02.2026 (Eintragungsdatum)\n\nMC Shape Schramberg GmbH\nGesellschaft mit beschränkter Haftung\nNagold\n\nAls nicht eingetragen wird bekanntgemacht:\nDen Gläubigern der an der Verschmelzung beteiligten Rechtsträger ist, wenn sie binnen sechs Monaten nach dem Tag, an dem die Eintragung der Verschmelzung in das Register des Sitzes desjenigen Rechtsträgers, dessen Gläubiger sie sind, nach § 19 Abs. 3 UmwG als bekanntgemacht gilt, ihren Anspruch nach Grund und Höhe schriftlich anmelden, Sicherheit zu leisten, soweit sie nicht Befriedigung verlangen können. Dieses Recht steht den Gläubigern jedoch nur zu, wenn sie glaubhaft machen, dass durch die Verschmelzung die Erfüllung ihrer Forderung gefährdet wird."
    },
    {
      "date": "2026-02-03",
      "id": "144181",
      "original_text": "Einreichung neuer Dokumente\nBerlin Amtsgericht Berlin (Charlottenburg) HRB 106413\nKiwa PI Berlin AG – Berlin",
      "type": "Einreichung neuer Dokumente",
      "state": "Berlin",
      "amtsgericht": "Amtsgericht Berlin (Charlottenburg)",
      "registernummer": "HRB 106413",
      "registerart": "HRB",
      "company_name": "Kiwa PI Berlin AG",
      "company_seat": "Berlin",
      "details": "03.02.2026 (Bekanntmachungsdatum)\n\nBerlin Amtsgericht Berlin (Charlottenburg) HRB 106413\nEinreichung neuer Dokumente\n\nKiwa PI Berlin AG\nAktiengesellschaft\nBerlin\n\nAls nicht eingetragen wird veröffentlicht: Es wurde eine neue Liste der Aufsichtsratsmitglieder eingereicht (§ 106 AktG)."
    },
    {
      "date": "2026-02-03",
      "id": "144182",
      "original_text": "Einreichung neuer Dokumente\nHamburg Amtsgericht Hamburg HRB 91799\nDeutsche EuroShop AG – Hamburg",
      "type": "Einreichung neuer Dokumente",
      "state": "Hamburg",
      "amtsgericht": "Amtsgericht Hamburg",
      "registernummer": "HRB 91799",
      "registerart": "HRB",
      "company_name": "Deutsche EuroShop AG",
      "company_seat": "Hamburg",
      "details": "03.02.2026 (Bekanntmachungsdatum)\n\nHamburg Amtsgericht Hamburg HRB 91799\nEinreichung neuer Dokumente\n\nDeutsche EuroShop AG\nAktiengesellschaft\nHamburg\n\nAls nicht eingetragen wird bekannt gemacht: Liste des Aufsichtsrats wurde eingereicht."
    },
    {
      "date": "2026-02-03",
      "id": "144183",
      "original_text": "Registerbekanntmachung nach dem Umwandlungsgesetz\nSchleswig-Holstein Amtsgericht Lübeck HRB 27117\nLego Industriemontage GmbH – Glinde",
      "type": "Registerbekanntmachung nach dem Umwandlungsgesetz",
      "state": "Schleswig-Holstein",
      "amtsgericht": "Amtsgericht Lübeck",
      "registernummer": "HRB 27117",
      "registerart": "HRB",
      "company_name": "Lego Industriemontage GmbH",
      "company_seat": "Glinde",
      "details": "03.02.2026 (Bekanntmachungsdatum)\n\nSchleswig-Holstein Amtsgericht Lübeck HRB 27117\nRegisterbekanntmachung nach dem Umwandlungsgesetz 02.02.2026 (Eintragungsdatum)\n\nLego Industriemontage GmbH\nGesellschaft mit beschränkter Haftung\nGlinde\n\nZu Eintragungsnummer 1 vom 02.02.2026 wird als nicht eingetragen veröffentlicht: Als nicht eingetragen wird veröffentlicht: Den Gläubigern der an der Ausgliederung beteiligten Rechtsträger ist, wenn sie binnen sechs Monaten nach dem Tag, an dem die Eintragung der Ausgliederung in das Register des Sitzes desjenigen Rechtsträgers, dessen Gläubiger sie sind, als bekannt gemacht gilt, ihren Anspruch nach Grund und Höhe schriftlich anmelden, Sicherheit zu leisten, soweit sie nicht Befriedigung verlangen können. Dieses Recht steht den Gläubigern jedoch nur zu, wenn sie glaubhaft machen, dass durch die Ausgliederung die Erfüllung ihrer Forderung gefährdet wird."
    },
    {
      "date": "2026-02-03",
      "id": "144184",
      "original_text": "Registerbekanntmachung nach dem Umwandlungsgesetz\nBerlin Amtsgericht Berlin (Charlottenburg) HRB 267826\nTS Elements GmbH – Berlin",
      "type": "Registerbekanntmachung nach dem Umwandlungsgesetz",
      "state": "Berlin",
      "amtsgericht": "Amtsgericht Berlin (Charlottenburg)",
      "registernummer": "HRB 267826",
      "registerart": "HRB",
      "company_name": "TS Elements GmbH",
      "company_seat": "Berlin",
      "details": "03.02.2026 (Bekanntmachungsdatum)\n\nBerlin Amtsgericht Berlin (Charlottenburg) HRB 267826\nRegisterbekanntmachung nach dem Umwandlungsgesetz 30.12.2025 (Eintragungsdatum)\n\nTS Elements GmbH\nGesellschaft mit beschränkter Haftung\nBerlin\n\nZu Eintragungsnummer 5 vom 30.12.2025 wird als nicht eingetragen veröffentlicht:\nDen Gläubigern ist, wenn sie binnen sechs Monaten nach dem Tag, an dem die Eintragung der Umwandlung als bekannt gemacht gilt, ihren Anspruch nach Grund und Höhe schriftlich anmelden, Sicherheit zu leisten, soweit sie nicht Befriedigung verlangen können. Dieses Recht steht den Gläubigern jedoch nur zu, wenn sie glaubhaft machen, dass durch die Umwandlung die Erfüllung ihrer Forderung gefährdet wird. Das Recht, Sicherheitsleistung zu verlangen, steht Gläubigern nicht zu, die im Falle der Insolvenz ein Recht auf vorzugsweise Befriedigung aus einer Deckungsmasse haben, die nach gesetzlicher Vorschrift zu ihrem Schutz errichtet und staatlich überwacht ist."
    },
    {
      "date": "2026-02-03",
      "id": "144185",
      "original_text": "Registerbekanntmachung nach dem Umwandlungsgesetz\nSchleswig-Holstein Amtsgericht Pinneberg HRB 19527\nAsterix HoldCo SE – Elmshorn",
      "type": "Registerbekanntmachung nach dem Umwandlungsgesetz",
      "state": "Schleswig-Holstein",
      "amtsgericht": "Amtsgericht Pinneberg",
      "registernummer": "HRB 19527",
      "registerart": "HRB",
      "company_name": "Asterix HoldCo SE",
      "company_seat": "Elmshorn",
      "details": "03.02.2026 (Bekanntmachungsdatum)\n\nSchleswig-Holstein Amtsgericht Pinneberg HRB 19527\nRegisterbekanntmachung nach dem Umwandlungsgesetz 29.01.2026 (Eintragungsdatum)\n\nAsterix HoldCo SE\nEuropäische Aktiengesellschaft (SE)\nElmshorn\n\nZu Eintragungsnummer 1 vom 29.01.2026 wird als nicht eingetragen veröffentlicht: Den Gläubigern der an der Verschmelzung beteiligten Rechtsträger ist, wenn sie binnen sechs Monaten nach dem Tag, an dem die Eintragung der Verschmelzung in das Register des Sitzes desjenigen Rechtsträgers, dessen Gläubiger sie sind, als bekannt gemacht gilt, ihren Anspruch nach Grund und Höhe schriftlich anmelden, Sicherheit zu leisten, soweit sie nicht Befriedigung verlangen können. Dieses Recht steht den Gläubigern jedoch nur zu, wenn sie glaubhaft machen, dass durch die Verschmelzung die Erfüllung ihrer Forderung gefährdet wird. Das Recht, Sicherheitsleistung zu verlangen, steht Gläubigern nicht zu, die im Falle der Insolvenz ein Recht auf vorzugsweise Befriedigung aus einer Deckungsmasse haben, die nach gesetzlicher Vorschrift zu ihrem Schutz errichtet und staatlich überwacht ist."
    },
    {
      "date": "2026-02-03",
      "id": "144186",
      "original_text": "Sonstige Registerbekanntmachung\nBrandenburg Amtsgericht Neuruppin HRB 10892\nLEIPA Georg Leinfelder GmbH – Schwedt/Oder",
      "type": "Sonstige Registerbekanntmachung",
      "state": "Brandenburg",
      "amtsgericht": "Amtsgericht Neuruppin",
      "registernummer": "HRB 10892",
      "registerart": "HRB",
      "company_name": "LEIPA Georg Leinfelder GmbH",
      "company_seat": "Schwedt/Oder",
      "details": "03.02.2026 (Bekanntmachungsdatum)\n\nBrandenburg Amtsgericht Neuruppin HRB 10892\nSonstige Registerbekanntmachung\n\nLEIPA Georg Leinfelder GmbH\nGesellschaft mit beschränkter Haftung\nSchwedt/Oder\n\nAls nicht eingetragen wird bekannt gemacht: Eine Liste der Mitglieder des Aufsichtsrates wurde zum Handelsregister eingereicht."
    },
    {
      "date": "2026-02-03",
      "id": "144187",
      "original_text": "Registerbekanntmachung nach dem Umwandlungsgesetz\nBrandenburg Amtsgericht Potsdam HRB 35516\nPGN Projektgesellschaft Glienicke-Nordbahn GmbH – Zossen",
      "type": "Registerbekanntmachung nach dem Umwandlungsgesetz",
      "state": "Brandenburg",
      "amtsgericht": "Amtsgericht Potsdam",
      "registernummer": "HRB 35516",
      "registerart": "HRB",
      "company_name": "PGN Projektgesellschaft Glienicke-Nordbahn GmbH",
      "company_seat": "Zossen",
      "details": "03.02.2026 (Bekanntmachungsdatum)\n\nBrandenburg Amtsgericht Potsdam HRB 35516\nRegisterbekanntmachung nach dem Umwandlungsgesetz 30.01.2026 (Eintragungsdatum)\n\nPGN Projektgesellschaft Glienicke-Nordbahn GmbH\nGesellschaft mit beschränkter Haftung\nZossen\n\nZu Eintragungsnummer 3 vom 30.01.2026 wird als nicht eingetragen veröffentlicht:\nDen Gläubigern der an der Verschmelzung beteiligten Rechtsträger ist, wenn sie binnen sechs Monaten nach dem Tag, an dem die Eintragung der Verschmelzung in das Register des Sitzes desjenigen Rechtsträgers, dessen Gläubiger sie sind, als bekannt gemacht gilt, ihren Anspruch nach Grund und Höhe schriftlich anmelden, Sicherheit zu leisten, soweit sie nicht Befriedigung verlangen können. Dieses Recht steht den Gläubigern jedoch nur zu, wenn sie glaubhaft machen, dass durch die Verschmelzung die Erfüllung ihrer Forderung gefährdet wird."
    },
    {
      "date": "2026-02-03",
      "id": "144188",
      "original_text": "Registerbekanntmachung nach dem Umwandlungsgesetz\nSachsen Amtsgericht Leipzig HRB 34271\nLabor Deutscher Platz Leipzig MVZ GmbH – Leipzig",
      "type": "Registerbekanntmachung nach dem Umwandlungsgesetz",
      "state": "Sachsen",
      "amtsgericht": "Amtsgericht Leipzig",
      "registernummer": "HRB 34271",
      "registerart": "HRB",
      "company_name": "Labor Deutscher Platz Leipzig MVZ GmbH",
      "company_seat": "Leipzig",
      "details": "03.02.2026 (Bekanntmachungsdatum)\n\nSachsen Amtsgericht Leipzig HRB 34271\nRegisterbekanntmachung nach dem Umwandlungsgesetz 03.02.2026 (Eintragungsdatum)\n\nLabor Deutscher Platz Leipzig MVZ GmbH\nGesellschaft mit beschränkter Haftung\nLeipzig\n\nDen Gläubigern der an der Verschmelzung beteiligten Rechtsträger ist, wenn sie binnen sechs Monaten nach dem Tag, an dem die Eintragung der Verschmelzung in das Register des Sitzes desjenigen Rechtsträgers, dessen Gläubiger sie sind, nach § 19 Abs. 3 UmwG als bekannt gemacht gilt, ihren Anspruch nach Grund und Höhe in Textform anmelden, Sicherheit zu leisten, soweit sie nicht Befriedigung verlangen können. Dieses Recht steht den Gläubigern jedoch nur zu, wenn sie glaubhaft machen, dass durch die Verschmelzung die Erfüllung der Forderung gefährdet wird."
    },
    {
      "date": "2026-02-03",
      "id": "144189",
      "original_text": "Löschungsankündigung\nNiedersachsen Amtsgericht Braunschweig HRB 202013\nNORDWEST - Massivhaus Gesellschaft für zeitloses Bauen mbH – Vechelde",
      "type": "Löschungsankündigung",
      "state": "Niedersachsen",
      "amtsgericht": "Amtsgericht Braunschweig",
      "registernummer": "HRB 202013",
      "registerart": "HRB",
      "company_name": "NORDWEST - Massivhaus Gesellschaft für zeitloses Bauen mbH",
      "company_seat": "Vechelde",
      "details": "03.02.2026 (Bekanntmachungsdatum)\n\nNiedersachsen Amtsgericht Braunschweig HRB 202013\nLöschungsankündigung 03.02.2026 (Eintragungsdatum)\n\nNORDWEST - Massivhaus Gesellschaft für zeitloses Bauen mbH\nGesellschaft mit beschränkter Haftung\nVechelde\n\nDas Registergericht beabsichtigt, die Gesellschaft von Amts wegen nach § 394 FamFG zu löschen. Die Frist zur Erhebung eines Widerspruchs ist auf 1 Monat ab dieser Registerbekanntmachung festgesetzt."
    },
    {
      "date": "2026-02-03",
      "id": "144190",
      "original_text": "Registerbekanntmachung nach dem Umwandlungsgesetz\nNiedersachsen Amtsgericht Braunschweig HRA 203373\nMarvin Hermes Finanzcoaching e.K. – Braunschweig",
      "type": "Registerbekanntmachung nach dem Umwandlungsgesetz",
      "state": "Niedersachsen",
      "amtsgericht": "Amtsgericht Braunschweig",
      "registernummer": "HRA 203373",
      "registerart": "HRA",
      "company_name": "Marvin Hermes Finanzcoaching e.K.",
      "company_seat": "Braunschweig",
      "details": "03.02.2026 (Bekanntmachungsdatum)\n\nNiedersachsen Amtsgericht Braunschweig HRA 203373\nRegisterbekanntmachung nach dem Umwandlungsgesetz 03.02.2026 (Eintragungsdatum)\n\nMarvin Hermes Finanzcoaching e.K.\nEinzelkaufmann / Einzelkauffrau\nBraunschweig\n\nDen Gläubigern der an der Ausgliederung beteiligten Rechtsträger ist, wenn sie binnen sechs Monaten nach dem Tag, an dem die Eintragung der Ausgliederung in das Register des Sitzes desjenigen Rechtsträgers, dessen Gläubiger sie sind, nach § 19 Abs. 3 UmwG als bekannt gemacht gilt, ihren Anspruch nach Grund und Höhe schriftlich anmelden, Sicherheit zu leisten, soweit sie nicht Befriedigung verlangen können. Dieses Recht steht den Gläubigern jedoch nur zu, wenn sie glaubhaft machen, dass durch die Ausgliederung die Erfüllung der Forderung gefährdet wird."
    },
    {
      "date": "2026-02-03",
      "id": "144191",
      "original_text": "Registerbekanntmachung nach dem Umwandlungsgesetz\nNiedersachsen Amtsgericht Oldenburg (Oldenburg) HRB 208482\nJA Holding GmbH – Edewecht",
      "type": "Registerbekanntmachung nach dem Umwandlungsgesetz",
      "state": "Niedersachsen",
      "amtsgericht": "Amtsgericht Oldenburg (Oldenburg)",
      "registernummer": "HRB 208482",
      "registerart": "HRB",
      "company_name": "JA Holding GmbH",
      "company_seat": "Edewecht",
      "details": "03.02.2026 (Bekanntmachungsdatum)\n\nNiedersachsen Amtsgericht Oldenburg (Oldenburg) HRB 208482\nRegisterbekanntmachung nach dem Umwandlungsgesetz 03.02.2026 (Eintragungsdatum)\n\nJA Holding GmbH\nGesellschaft mit beschränkter Haftung\nEdewecht\n\nDen Gläubigern der an der Verschmelzung beteiligten Rechtsträger ist, wenn sie binnen sechs Monaten nach dem Tag, an dem die Eintragung der Verschmelzung in das Register des Sitzes desjenigen Rechtsträgers, dessen Gläubiger sie sind, nach § 19  Abs.  3 UmwG als bekannt gemacht gilt, ihren Anspruch nach Grund und Höhe schriftlich anmelden, Sicherheit zu leisten, soweit sie nicht Befriedigung verlangen können. Dieses Recht steht den Gläubigern jedoch nur zu, wenn sie glaubhaft machen, dass durch die Verschmelzung die Erfüllung der Forderung gefährdet wird."
    },
    {
      "date": "2026-02-03",
      "id": "144192",
      "original_text": "Löschungsankündigung\nNiedersachsen Amtsgericht Oldenburg (Oldenburg) HRB 215283\nSkip Advertising GmbH – Oldenburg",
      "type": "Löschungsankündigung",
      "state": "Niedersachsen",
      "amtsgericht": "Amtsgericht Oldenburg (Oldenburg)",
      "registernummer": "HRB 215283",
      "registerart": "HRB",
      "company_name": "Skip Advertising GmbH",
      "company_seat": "Oldenburg",
      "details": "03.02.2026 (Bekanntmachungsdatum)\n\nNiedersachsen Amtsgericht Oldenburg (Oldenburg) HRB 215283\nLöschungsankündigung 03.02.2026 (Eintragungsdatum)\n\nSkip Advertising GmbH\nGesellschaft mit beschränkter Haftung\nOldenburg\n\nDas Registergericht beabsichtigt, die Gesellschaft von Amts wegen nach § 394 FamFG zu löschen. Die Frist zur Erhebung eines Widerspruchs ist auf 1 Monat ab dieser Registerbekanntmachung festgesetzt."
    },
    {
      "date": "2026-02-03",
      "id": "144193",
      "original_text": "Registerbekanntmachung nach dem Umwandlungsgesetz\nNiedersachsen Amtsgericht Hildesheim HRB 206339\nApoKonzept 24 GmbH – Bockenem",
      "type": "Registerbekanntmachung nach dem Umwandlungsgesetz",
      "state": "Niedersachsen",
      "amtsgericht": "Amtsgericht Hildesheim",
      "registernummer": "HRB 206339",
      "registerart": "HRB",
      "company_name": "ApoKonzept 24 GmbH",
      "company_seat": "Bockenem",
      "details": "03.02.2026 (Bekanntmachungsdatum)\n\nNiedersachsen Amtsgericht Hildesheim HRB 206339\nRegisterbekanntmachung nach dem Umwandlungsgesetz 03.02.2026 (Eintragungsdatum)\n\nApoKonzept 24 GmbH\nGesellschaft mit beschränkter Haftung\nBockenem\n\nDen Gläubigern der an der Verschmelzung beteiligten Rechtsträger ist, wenn sie binnen sechs Monaten nach dem Tag, an dem die Eintragung der Verschmelzung in das Register des Sitzes desjenigen Rechtsträgers, dessen Gläubiger sie sind, nach § 19  Abs.  3 UmwG als bekannt gemacht gilt, ihren Anspruch nach Grund und Höhe schriftlich anmelden, Sicherheit zu leisten, soweit sie nicht Befriedigung verlangen können. Dieses Recht steht den Gläubigern jedoch nur zu, wenn sie glaubhaft machen, dass durch die Verschmelzung die Erfüllung der Forderung gefährdet wird."
    },
    {
      "date": "2026-02-03",
      "id": "144194",
      "original_text": "Löschungsankündigung\nNiedersachsen Amtsgericht Oldenburg (Oldenburg) HRB 3853\nImbiss- und Vergnügungsbetriebe W.P. Schmidt GmbH – Hatten",
      "type": "Löschungsankündigung",
      "state": "Niedersachsen",
      "amtsgericht": "Amtsgericht Oldenburg (Oldenburg)",
      "registernummer": "HRB 3853",
      "registerart": "HRB",
      "company_name": "Imbiss- und Vergnügungsbetriebe W.P. Schmidt GmbH",
      "company_seat": "Hatten",
      "details": "03.02.2026 (Bekanntmachungsdatum)\n\nNiedersachsen Amtsgericht Oldenburg (Oldenburg) HRB 3853\nLöschungsankündigung 03.02.2026 (Eintragungsdatum)\n\nImbiss- und Vergnügungsbetriebe W.P. Schmidt GmbH\nGesellschaft mit beschränkter Haftung\nHatten\n\nDas Registergericht beabsichtigt, die Gesellschaft von Amts wegen nach § 394 FamFG zu löschen. Die Frist zur Erhebung eines Widerspruchs ist auf 1 Monat ab dieser Registerbekanntmachung festgesetzt."
    },
    {
      "date": "2026-02-03",
      "id": "144195",
      "original_text": "Registerbekanntmachung nach dem Umwandlungsgesetz\nNiedersachsen Amtsgericht Hildesheim HRB 209152\nPharmaallianz24 GmbH – Bockenem",
      "type": "Registerbekanntmachung nach dem Umwandlungsgesetz",
      "state": "Niedersachsen",
      "amtsgericht": "Amtsgericht Hildesheim",
      "registernummer": "HRB 209152",
      "registerart": "HRB",
      "company_name": "Pharmaallianz24 GmbH",
      "company_seat": "Bockenem",
      "details": "03.02.2026 (Bekanntmachungsdatum)\n\nNiedersachsen Amtsgericht Hildesheim HRB 209152\nRegisterbekanntmachung nach dem Umwandlungsgesetz 03.02.2026 (Eintragungsdatum)\n\nPharmaallianz24 GmbH\nGesellschaft mit beschränkter Haftung\nBockenem\n\nDen Gläubigern der an der Verschmelzung beteiligten Rechtsträger ist, wenn sie binnen sechs Monaten nach dem Tag, an dem die Eintragung der Verschmelzung in das Register des Sitzes desjenigen Rechtsträgers, dessen Gläubiger sie sind, nach § 19  Abs.  3 UmwG als bekannt gemacht gilt, ihren Anspruch nach Grund und Höhe schriftlich anmelden, Sicherheit zu leisten, soweit sie nicht Befriedigung verlangen können. Dieses Recht steht den Gläubigern jedoch nur zu, wenn sie glaubhaft machen, dass durch die Verschmelzung die Erfüllung der Forderung gefährdet wird."
    },
    {
      "date": "2026-02-03",
      "id": "144196",
      "original_text": "Einreichung neuer Dokumente\nNiedersachsen Amtsgericht Oldenburg (Oldenburg) HRB 5451\nSeaports of Niedersachsen GmbH – Oldenburg",
      "type": "Einreichung neuer Dokumente",
      "state": "Niedersachsen",
      "amtsgericht": "Amtsgericht Oldenburg (Oldenburg)",
      "registernummer": "HRB 5451",
      "registerart": "HRB",
      "company_name": "Seaports of Niedersachsen GmbH",
      "company_seat": "Oldenburg",
      "details": "03.02.2026 (Bekanntmachungsdatum)\n\nNiedersachsen Amtsgericht Oldenburg (Oldenburg) HRB 5451\nEinreichung neuer Dokumente\n\nSeaports of Niedersachsen GmbH\nGesellschaft mit beschränkter Haftung\nOldenburg\n\nDie Liste der Mitglieder des Aufsichtsrats wurde beim Registergericht eingereicht."
    },
    {
      "date": "2026-02-03",
      "id": "144197",
      "original_text": "Löschungsankündigung\nNiedersachsen Amtsgericht Braunschweig HRB 208333\nA20 media GmbH – Wolfsburg",
      "type": "Löschungsankündigung",
      "state": "Niedersachsen",
      "amtsgericht": "Amtsgericht Braunschweig",
      "registernummer": "HRB 208333",
      "registerart": "HRB",
      "company_name": "A20 media GmbH",
      "company_seat": "Wolfsburg",
      "details": "03.02.2026 (Bekanntmachungsdatum)\n\nNiedersachsen Amtsgericht Braunschweig HRB 208333\nLöschungsankündigung 03.02.2026 (Eintragungsdatum)\n\nA20 media GmbH\nGesellschaft mit beschränkter Haftung\nWolfsburg\n\nDas Registergericht beabsichtigt, die Gesellschaft von Amts wegen nach § 394 FamFG zu löschen. Die Frist zur Erhebung eines Widerspruchs ist auf 1 Monat ab dieser Registerbekanntmachung festgesetzt."
    },
    {
      "date": "2026-02-03",
      "id": "144198",
      "original_text": "Löschungsankündigung\nNiedersachsen Amtsgericht Oldenburg (Oldenburg) HRB 202123\nVierte RRS Verwaltungs GmbH – Bad Zwischenahn",
      "type": "Löschungsankündigung",
      "state": "Niedersachsen",
      "amtsgericht": "Amtsgericht Oldenburg (Oldenburg)",
      "registernummer": "HRB 202123",
      "registerart": "HRB",
      "company_name": "Vierte RRS Verwaltungs GmbH",
      "company_seat": "Bad Zwischenahn",
      "details": "03.02.2026 (Bekanntmachungsdatum)\n\nNiedersachsen Amtsgericht Oldenburg (Oldenburg) HRB 202123\nLöschungsankündigung 03.02.2026 (Eintragungsdatum)\n\nVierte RRS Verwaltungs GmbH\nGesellschaft mit beschränkter Haftung\nBad Zwischenahn\n\nDas Registergericht beabsichtigt, die Gesellschaft von Amts wegen nach § 394 FamFG zu löschen. Die Frist zur Erhebung eines Widerspruchs ist auf 1 Monat ab dieser Registerbekanntmachung festgesetzt."
    },
    {
      "date": "2026-02-03",
      "id": "144199",
      "original_text": "Registerbekanntmachung nach dem Umwandlungsgesetz\nNiedersachsen Amtsgericht Oldenburg (Oldenburg) HRB 217861\nJA Trading GmbH – Edewecht",
      "type": "Registerbekanntmachung nach dem Umwandlungsgesetz",
      "state": "Niedersachsen",
      "amtsgericht": "Amtsgericht Oldenburg (Oldenburg)",
      "registernummer": "HRB 217861",
      "registerart": "HRB",
      "company_name": "JA Trading GmbH",
      "company_seat": "Edewecht",
      "details": "03.02.2026 (Bekanntmachungsdatum)\n\nNiedersachsen Amtsgericht Oldenburg (Oldenburg) HRB 217861\nRegisterbekanntmachung nach dem Umwandlungsgesetz 03.02.2026 (Eintragungsdatum)\n\nJA Trading GmbH\nGesellschaft mit beschränkter Haftung\nEdewecht\n\nDen Gläubigern der an der Verschmelzung beteiligten Rechtsträger ist, wenn sie binnen sechs Monaten nach dem Tag, an dem die Eintragung der Verschmelzung in das Register des Sitzes desjenigen Rechtsträgers, dessen Gläubiger sie sind, nach § 19  Abs.  3 UmwG als bekannt gemacht gilt, ihren Anspruch nach Grund und Höhe schriftlich anmelden, Sicherheit zu leisten, soweit sie nicht Befriedigung verlangen können. Dieses Recht steht den Gläubigern jedoch nur zu, wenn sie glaubhaft machen, dass durch die Verschmelzung die Erfüllung der Forderung gefährdet wird."
    },
    {
      "date": "2026-02-03",
      "id": "144200",
      "original_text": "Löschungsankündigung\nBremen Amtsgericht Bremen HRB 28681\nNord-Putz-GmbH – Bremen",
      "type": "Löschungsankündigung",
      "state": "Bremen",
      "amtsgericht": "Amtsgericht Bremen",
      "registernummer": "HRB 28681",
      "registerart": "HRB",
      "company_name": "Nord-Putz-GmbH",
      "company_seat": "Bremen",
      "details": "03.02.2026 (Bekanntmachungsdatum)\n\nBremen Amtsgericht Bremen HRB 28681\nLöschungsankündigung\n\nNord-Putz-GmbH\nGesellschaft mit beschränkter Haftung\nBremen\n\nEs ist beabsichtigt die im Handelsregister eingetragene Gesellschaft von Amts wegen gemäß § 394 FamFG zu löschen. Gegen die Löschung kann beim AG Bremen schriftlich oder zu Protokoll der Geschäftsstelle Widerspruch eingelegt werden. Widerspruchsfrist 4 Wochen."
    },
    {
      "date": "2026-02-03",
      "id": "144201",
      "original_text": "Löschungsankündigung\nBremen Amtsgericht Bremen HRB 36060\n100pct. with love GmbH – Bremen",
      "type": "Löschungsankündigung",
      "state": "Bremen",
      "amtsgericht": "Amtsgericht Bremen",
      "registernummer": "HRB 36060",
      "registerart": "HRB",
      "company_name": "100pct. with love GmbH",
      "company_seat": "Bremen",
      "details": "03.02.2026 (Bekanntmachungsdatum)\n\nBremen Amtsgericht Bremen HRB 36060\nLöschungsankündigung\n\n100pct. with love GmbH\nGesellschaft mit beschränkter Haftung\nBremen\n\nEs ist beabsichtigt die im Handelsregister eingetragene Gesellschaft von Amts wegen gemäß § 394 FamFG zu löschen. Gegen die Löschung kann beim AG Bremen schriftlich oder zu Protokoll der Geschäftsstelle Widerspruch eingelegt werden. Widerspruchsfrist 4 Wochen."
    },
    {
      "date": "2026-02-03",
      "id": "144202",
      "original_text": "Löschungsankündigung\nRheinland-Pfalz Amtsgericht Montabaur HRB 27997\nAzrail Verwaltungs GmbH – Neuwied",
      "type": "Löschungsankündigung",
      "state": "Rheinland-Pfalz",
      "amtsgericht": "Amtsgericht Montabaur",
      "registernummer": "HRB 27997",
      "registerart": "HRB",
      "company_name": "Azrail Verwaltungs GmbH",
      "company_seat": "Neuwied",
      "details": "03.02.2026 (Bekanntmachungsdatum)\n\nRheinland-Pfalz Amtsgericht Montabaur HRB 27997\nLöschungsankündigung\n\nAzrail Verwaltungs GmbH\nGesellschaft mit beschränkter Haftung\nNeuwied\n\nDas Registergericht beabsichtigt die Gesellschaft von Amts wegen nach § 394 FamFG zu löschen. Die Frist zur Erhebung eines Widerspruchs ist auf 1 Monat festgesetzt."
    },
    {
      "date": "2026-02-03",
      "id": "144203",
      "original_text": "Sonstige Registerbekanntmachung\nRheinland-Pfalz Amtsgericht Ludwigshafen a.Rhein (Ludwigshafen) HRB 66663\nBad Dürkheim Isenach GmbH – Speyer",
      "type": "Sonstige Registerbekanntmachung",
      "state": "Rheinland-Pfalz",
      "amtsgericht": "Amtsgericht Ludwigshafen a.Rhein (Ludwigshafen)",
      "registernummer": "HRB 66663",
      "registerart": "HRB",
      "company_name": "Bad Dürkheim Isenach GmbH",
      "company_seat": "Speyer",
      "details": "03.02.2026 (Bekanntmachungsdatum)\n\nRheinland-Pfalz Amtsgericht Ludwigshafen a.Rhein (Ludwigshafen) HRB 66663\nSonstige Registerbekanntmachung 03.02.2026 (Eintragungsdatum)\n\nBad Dürkheim Isenach GmbH\nGesellschaft mit beschränkter Haftung\nSpeyer\n\nAls nicht eingetragen wird veröffentlicht: Den Gläubigern der Gesellschaft, deren Forderungen begründet worden sind, bevor die Eintragung der Beendigung des Gewinnabführungsvertrages in das Handelsregister nach § 10 des Handelsgesetzbuches als bekanntgemacht gilt, hat der andere Vertragsteil Sicherheit zu leisten, wenn sie sich binnen sechs Monaten nach der Bekanntmachung der Eintragung zu diesem Zweck bei ihm melden."
    },
    {
      "date": "2026-02-03",
      "id": "144204",
      "original_text": "Löschungsankündigung\nRheinland-Pfalz Amtsgericht Ludwigshafen a.Rhein (Ludwigshafen) HRB 67174\nFGZ Bau GmbH – Meckenheim",
      "type": "Löschungsankündigung",
      "state": "Rheinland-Pfalz",
      "amtsgericht": "Amtsgericht Ludwigshafen a.Rhein (Ludwigshafen)",
      "registernummer": "HRB 67174",
      "registerart": "HRB",
      "company_name": "FGZ Bau GmbH",
      "company_seat": "Meckenheim",
      "details": "03.02.2026 (Bekanntmachungsdatum)\n\nRheinland-Pfalz Amtsgericht Ludwigshafen a.Rhein (Ludwigshafen) HRB 67174\nLöschungsankündigung\n\nFGZ Bau GmbH\nGesellschaft mit beschränkter Haftung\nMeckenheim\n\nDas Registergericht beabsichtigt die Gesellschaft von Amts wegen nach § 394 FamFG zu löschen. Die Frist zur Erhebung eines Widerspruchs ist auf einen Monat festgesetzt."
    },
    {
      "date": "2026-02-03",
      "id": "144205",
      "original_text": "Löschungsankündigung\nRheinland-Pfalz Amtsgericht Zweibrücken HRB 30914\nM&T Vermiet-GmbH – Zweibrücken",
      "type": "Löschungsankündigung",
      "state": "Rheinland-Pfalz",
      "amtsgericht": "Amtsgericht Zweibrücken",
      "registernummer": "HRB 30914",
      "registerart": "HRB",
      "company_name": "M&T Vermiet-GmbH",
      "company_seat": "Zweibrücken",
      "details": "03.02.2026 (Bekanntmachungsdatum)\n\nRheinland-Pfalz Amtsgericht Zweibrücken HRB 30914\nLöschungsankündigung\n\nM&T Vermiet-GmbH\nGesellschaft mit beschränkter Haftung\nZweibrücken\n\nDas Registergericht beabsichtigt die Gesellschaft von Amts wegen nach § 394 FamFG zu löschen. Die Frist zur Erhebung eines Widerspruchs ist auf einen Monat festgesetzt."
    },
    {
      "date": "2026-02-03",
      "id": "144206",
      "original_text": "Einreichung neuer Dokumente\nNordrhein-Westfalen Amtsgericht Duisburg HRB 16322\nBeteiligungsholding Mülheim an der Ruhr GmbH – Mülheim an der Ruhr",
      "type": "Einreichung neuer Dokumente",
      "state": "Nordrhein-Westfalen",
      "amtsgericht": "Amtsgericht Duisburg",
      "registernummer": "HRB 16322",
      "registerart": "HRB",
      "company_name": "Beteiligungsholding Mülheim an der Ruhr GmbH",
      "company_seat": "Mülheim an der Ruhr",
      "details": "03.02.2026 (Bekanntmachungsdatum)\n\nNordrhein-Westfalen Amtsgericht Duisburg HRB 16322\nEinreichung neuer Dokumente\n\nBeteiligungsholding Mülheim an der Ruhr GmbH\nGesellschaft mit beschränkter Haftung\nMülheim an der Ruhr\n\nDem Registergericht ist eine Liste der Mitglieder des Aufsichtsrates eingereicht worden."
    },
    {
      "date": "2026-02-03",
      "id": "144207",
      "original_text": "Einreichung neuer Dokumente\nNordrhein-Westfalen Amtsgericht Duisburg HRB 20255\nDinslakener Bäder GmbH – Dinslaken",
      "type": "Einreichung neuer Dokumente",
      "state": "Nordrhein-Westfalen",
      "amtsgericht": "Amtsgericht Duisburg",
      "registernummer": "HRB 20255",
      "registerart": "HRB",
      "company_name": "Dinslakener Bäder GmbH",
      "company_seat": "Dinslaken",
      "details": "03.02.2026 (Bekanntmachungsdatum)\n\nNordrhein-Westfalen Amtsgericht Duisburg HRB 20255\nEinreichung neuer Dokumente\n\nDinslakener Bäder GmbH\nGesellschaft mit beschränkter Haftung\nDinslaken\n\nDem Registergericht ist eine neue Liste der Mitglieder des Aufsichtsrates eingereicht worden."
    },
    {
      "date": "2026-02-03",
      "id": "144208",
      "original_text": "Einreichung neuer Dokumente\nNordrhein-Westfalen Amtsgericht Düsseldorf HRB 41756\nDroege Group AG – Düsseldorf",
      "type": "Einreichung neuer Dokumente",
      "state": "Nordrhein-Westfalen",
      "amtsgericht": "Amtsgericht Düsseldorf",
      "registernummer": "HRB 41756",
      "registerart": "HRB",
      "company_name": "Droege Group AG",
      "company_seat": "Düsseldorf",
      "details": "03.02.2026 (Bekanntmachungsdatum)\n\nNordrhein-Westfalen Amtsgericht Düsseldorf HRB 41756\nEinreichung neuer Dokumente\n\nDroege Group AG\nAktiengesellschaft\nDüsseldorf\n\nDem Registergericht ist eine Liste der Mitglieder des Aufsichtsrates vom 23.09.2025 und vom 01.02.2026 eingereicht worden."
    },
    {
      "date": "2026-02-03",
      "id": "144209",
      "original_text": "Einreichung neuer Dokumente\nNordrhein-Westfalen Amtsgericht Wuppertal HRB 20118\nWSW Wuppertaler Stadtwerke GmbH – Wuppertal",
      "type": "Einreichung neuer Dokumente",
      "state": "Nordrhein-Westfalen",
      "amtsgericht": "Amtsgericht Wuppertal",
      "registernummer": "HRB 20118",
      "registerart": "HRB",
      "company_name": "WSW Wuppertaler Stadtwerke GmbH",
      "company_seat": "Wuppertal",
      "details": "03.02.2026 (Bekanntmachungsdatum)\n\nNordrhein-Westfalen Amtsgericht Wuppertal HRB 20118\nEinreichung neuer Dokumente 03.02.2026 (Eintragungsdatum)\n\nWSW Wuppertaler Stadtwerke GmbH\nGesellschaft mit beschränkter Haftung\nWuppertal\n\nDem Registergericht ist eine neue Liste der Mitglieder des Aufsichtsrates eingereicht worden."
    },
    {
      "date": "2026-02-03",
      "id": "144210",
      "original_text": "Einreichung neuer Dokumente\nNordrhein-Westfalen Amtsgericht Köln HRB 29611\nKölnBäder Gesellschaft mit beschränkter Haftung – Köln",
      "type": "Einreichung neuer Dokumente",
      "state": "Nordrhein-Westfalen",
      "amtsgericht": "Amtsgericht Köln",
      "registernummer": "HRB 29611",
      "registerart": "HRB",
      "company_name": "KölnBäder Gesellschaft mit beschränkter Haftung",
      "company_seat": "Köln",
      "details": "03.02.2026 (Bekanntmachungsdatum)\n\nNordrhein-Westfalen Amtsgericht Köln HRB 29611\nEinreichung neuer Dokumente\n\nKölnBäder Gesellschaft mit beschränkter Haftung\nGesellschaft mit beschränkter Haftung\nKöln\n\nDem Registergericht ist eine Liste der Mitglieder des Aufsichtsrates eingereicht worden."
    },
    {
      "date": "2026-02-03",
      "id": "144211",
      "original_text": "Einreichung neuer Dokumente\nNordrhein-Westfalen Amtsgericht Köln HRB 63020\nSINOPSIS Aktiengesellschaft – Köln",
      "type": "Einreichung neuer Dokumente",
      "state": "Nordrhein-Westfalen",
      "amtsgericht": "Amtsgericht Köln",
      "registernummer": "HRB 63020",
      "registerart": "HRB",
      "company_name": "SINOPSIS Aktiengesellschaft",
      "company_seat": "Köln",
      "details": "03.02.2026 (Bekanntmachungsdatum)\n\nNordrhein-Westfalen Amtsgericht Köln HRB 63020\nEinreichung neuer Dokumente 03.02.2026 (Eintragungsdatum)\n\nSINOPSIS Aktiengesellschaft\nAktiengesellschaft\nKöln\n\nDem Registergericht ist eine neue Liste der Mitglieder des Aufsichtsrates eingereicht worden."
    },
    {
      "date": "2026-02-03",
      "id": "144212",
      "original_text": "Registerbekanntmachung nach dem Umwandlungsgesetz\nNordrhein-Westfalen Amtsgericht Hagen HRA 2998\nJörg Vogelsang GmbH & Co. KG – Hagen",
      "type": "Registerbekanntmachung nach dem Umwandlungsgesetz",
      "state": "Nordrhein-Westfalen",
      "amtsgericht": "Amtsgericht Hagen",
      "registernummer": "HRA 2998",
      "registerart": "HRA",
      "company_name": "Jörg Vogelsang GmbH & Co. KG",
      "company_seat": "Hagen",
      "details": "03.02.2026 (Bekanntmachungsdatum)\n\nNordrhein-Westfalen Amtsgericht Hagen HRA 2998\nRegisterbekanntmachung nach dem Umwandlungsgesetz 03.02.2026 (Eintragungsdatum)\n\nJörg Vogelsang GmbH & Co. KG\nKommanditgesellschaft\nHagen\n\nDen Gläubigern der an der Verschmelzung beteiligten Rechtsträger ist, wenn sie binnen sechs Monaten nach dem Tag, an dem die Eintragung der Verschmelzung in das Register des Sitzes desjenigen Rechtsträgers, dessen Gläubiger sie sind, nach § 19 Absatz 3 UmwG als bekanntgemacht gilt, ihren Anspruch nach Grund und Höhe schriftlich anmelden, Sicherheit zu leisten, soweit sie nicht Befriedigung verlangen können. Dieses Recht steht den Gläubigern jedoch nur zu, wenn sie glaubhaft machen, dass durch die Verschmelzung die Erfüllung ihrer Forderung gefährdet wird."
    },
    {
      "date": "2026-02-03",
      "id": "144213",
      "original_text": "Löschungsankündigung\nNordrhein-Westfalen Amtsgericht Mönchengladbach HRB 20639\nRK Logistik & Personalservice GmbH – Mönchengladbach",
      "type": "Löschungsankündigung",
      "state": "Nordrhein-Westfalen",
      "amtsgericht": "Amtsgericht Mönchengladbach",
      "registernummer": "HRB 20639",
      "registerart": "HRB",
      "company_name": "RK Logistik & Personalservice GmbH",
      "company_seat": "Mönchengladbach",
      "details": "03.02.2026 (Bekanntmachungsdatum)\n\nNordrhein-Westfalen Amtsgericht Mönchengladbach HRB 20639\nLöschungsankündigung\n\nRK Logistik & Personalservice GmbH\nGesellschaft mit beschränkter Haftung\nMönchengladbach\n\nDas Registergericht beabsichtigt die Gesellschaft von Amts wegen nach § 394\nFamFG zu löschen. Die Frist zur Erhebung eines Widerspruchs ist auf zwei Monate festgesetzt."
    },
    {
      "date": "2026-02-03",
      "id": "144214",
      "original_text": "Registerbekanntmachung nach dem Umwandlungsgesetz\nNordrhein-Westfalen Amtsgericht Siegburg HRB 15118\nXPaCS GmbH – Troisdorf",
      "type": "Registerbekanntmachung nach dem Umwandlungsgesetz",
      "state": "Nordrhein-Westfalen",
      "amtsgericht": "Amtsgericht Siegburg",
      "registernummer": "HRB 15118",
      "registerart": "HRB",
      "company_name": "XPaCS GmbH",
      "company_seat": "Troisdorf",
      "details": "03.02.2026 (Bekanntmachungsdatum)\n\nNordrhein-Westfalen Amtsgericht Siegburg HRB 15118\nRegisterbekanntmachung nach dem Umwandlungsgesetz 03.02.2026 (Eintragungsdatum)\n\nXPaCS GmbH\nGesellschaft mit beschränkter Haftung\nTroisdorf\n\nDen Gläubigern der an der Verschmelzung beteiligten Rechtsträger ist, wenn sie binnen sechs Monaten nach dem Tag, an dem die Eintragung der Verschmelzung in das Register des Sitzes desjenigen Rechtsträgers, dessen Gläubiger sie sind, nach § 19 Absatz 3 UmwG als bekanntgemacht gilt, ihren Anspruch nach Grund und Höhe schriftlich anmelden, Sicherheit zu leisten, soweit sie nicht Befriedigung verlangen können. Dieses Recht steht den Gläubigern jedoch nur zu, wenn sie glaubhaft machen, dass durch die Verschmelzung die Erfüllung ihrer Forderung gefährdet wird."
    },
    {
      "date": "2026-02-03",
      "id": "144215",
      "original_text": "Einreichung neuer Dokumente\nNordrhein-Westfalen Amtsgericht Arnsberg HRB 4343\nStädtische Bäder- und Beteiligungs-GmbH Werl – Werl",
      "type": "Einreichung neuer Dokumente",
      "state": "Nordrhein-Westfalen",
      "amtsgericht": "Amtsgericht Arnsberg",
      "registernummer": "HRB 4343",
      "registerart": "HRB",
      "company_name": "Städtische Bäder- und Beteiligungs-GmbH Werl",
      "company_seat": "Werl",
      "details": "03.02.2026 (Bekanntmachungsdatum)\n\nNordrhein-Westfalen Amtsgericht Arnsberg HRB 4343\nEinreichung neuer Dokumente 03.02.2026 (Eintragungsdatum)\n\nStädtische Bäder- und Beteiligungs-GmbH Werl\nGesellschaft mit beschränkter Haftung\nWerl\n\nDem Registergericht ist eine neue Liste der Mitglieder des Aufsichtsrates eingereicht worden."
    },
    {
      "date": "2026-02-03",
      "id": "144216",
      "original_text": "Einreichung neuer Dokumente\nNordrhein-Westfalen Amtsgericht Köln HRB 2367\nWohnungsgesellschaft der Stadtwerke Köln mit beschränkter Haftung – Köln",
      "type": "Einreichung neuer Dokumente",
      "state": "Nordrhein-Westfalen",
      "amtsgericht": "Amtsgericht Köln",
      "registernummer": "HRB 2367",
      "registerart": "HRB",
      "company_name": "Wohnungsgesellschaft der Stadtwerke Köln mit beschränkter Haftung",
      "company_seat": "Köln",
      "details": "03.02.2026 (Bekanntmachungsdatum)\n\nNordrhein-Westfalen Amtsgericht Köln HRB 2367\nEinreichung neuer Dokumente\n\nWohnungsgesellschaft der Stadtwerke Köln mit beschränkter Haftung\nGesellschaft mit beschränkter Haftung\nKöln\n\nDem Registergericht ist eine Liste der Mitglieder des Aufsichtsrates eingereicht worden."
    },
    {
      "date": "2026-02-03",
      "id": "144217",
      "original_text": "Löschungsankündigung\nNordrhein-Westfalen Amtsgericht Köln HRB 99589\nEK Verwaltung GmbH – Köln",
      "type": "Löschungsankündigung",
      "state": "Nordrhein-Westfalen",
      "amtsgericht": "Amtsgericht Köln",
      "registernummer": "HRB 99589",
      "registerart": "HRB",
      "company_name": "EK Verwaltung GmbH",
      "company_seat": "Köln",
      "details": "03.02.2026 (Bekanntmachungsdatum)\n\nNordrhein-Westfalen Amtsgericht Köln HRB 99589\nLöschungsankündigung\n\nEK Verwaltung GmbH\nGesellschaft mit beschränkter Haftung\nKöln\n\nDas Registergericht beabsichtigt die Gesellschaft von Amts wegen nach § 394 FamFG zu löschen. Die Frist zur Erhebung eines Widerspruchs ist auf einen Monat festgesetzt."
    },
    {
      "date": "2026-02-03",
      "id": "144218",
      "original_text": "Sonstige Registerbekanntmachung\nNordrhein-Westfalen Amtsgericht Siegen HRB 13346\nUnser BLB-Netz Gesellschaft mit beschränkter Haftung – Bad Berleburg",
      "type": "Sonstige Registerbekanntmachung",
      "state": "Nordrhein-Westfalen",
      "amtsgericht": "Amtsgericht Siegen",
      "registernummer": "HRB 13346",
      "registerart": "HRB",
      "company_name": "Unser BLB-Netz Gesellschaft mit beschränkter Haftung",
      "company_seat": "Bad Berleburg",
      "details": "03.02.2026 (Bekanntmachungsdatum)\n\nNordrhein-Westfalen Amtsgericht Siegen HRB 13346\nSonstige Registerbekanntmachung\n\nUnser BLB-Netz Gesellschaft mit beschränkter Haftung\nGesellschaft mit beschränkter Haftung\nBad Berleburg\n\nDem Registergericht ist eine Liste der Mitglieder des Aufsichtsrates eingereicht worden."
    },
    {
      "date": "2026-02-03",
      "id": "144219",
      "original_text": "Registerbekanntmachung nach dem Umwandlungsgesetz\nNordrhein-Westfalen Amtsgericht Bochum HRB 22920\nLiKu Bau GmbH – Bochum",
      "type": "Registerbekanntmachung nach dem Umwandlungsgesetz",
      "state": "Nordrhein-Westfalen",
      "amtsgericht": "Amtsgericht Bochum",
      "registernummer": "HRB 22920",
      "registerart": "HRB",
      "company_name": "LiKu Bau GmbH",
      "company_seat": "Bochum",
      "details": "03.02.2026 (Bekanntmachungsdatum)\n\nNordrhein-Westfalen Amtsgericht Bochum HRB 22920\nRegisterbekanntmachung nach dem Umwandlungsgesetz 28.01.2026 (Eintragungsdatum)\n\nLiKu Bau GmbH\nGesellschaft mit beschränkter Haftung\nBochum\n\nDen Gläubigern der an der Verschmelzung beteiligten Rechtsträger ist, wenn sie binnen sechs Monaten nach dem Tag, an dem die Eintragung der Verschmelzung in das Register des Sitzes desjenigen Rechtsträgers, dessen Gläubiger sie sind, nach § 19 Absatz 3 UmwG als bekanntgemacht gilt, ihren Anspruch nach Grund und Höhe schriftlich anmelden, Sicherheit zu leisten, soweit sie nicht Befriedigung verlangen können. Dieses Recht steht den Gläubigern jedoch nur zu, wenn sie glaubhaft machen, dass durch die Verschmelzung die Erfüllung ihrer Forderung gefährdet wird."
    },
    {
      "date": "2026-02-03",
      "id": "144220",
      "original_text": "Einreichung neuer Dokumente\nNordrhein-Westfalen Amtsgericht Köln HRB 2115\nStadtwerke Köln Gesellschaft mit beschränkter Haftung – Köln",
      "type": "Einreichung neuer Dokumente",
      "state": "Nordrhein-Westfalen",
      "amtsgericht": "Amtsgericht Köln",
      "registernummer": "HRB 2115",
      "registerart": "HRB",
      "company_name": "Stadtwerke Köln Gesellschaft mit beschränkter Haftung",
      "company_seat": "Köln",
      "details": "03.02.2026 (Bekanntmachungsdatum)\n\nNordrhein-Westfalen Amtsgericht Köln HRB 2115\nEinreichung neuer Dokumente 03.02.2026 (Eintragungsdatum)\n\nStadtwerke Köln Gesellschaft mit beschränkter Haftung\nGesellschaft mit beschränkter Haftung\nKöln\n\nDem Registergericht ist eine neue Liste der Mitglieder des Aufsichtsrates eingereicht worden."
    },
    {
      "date": "2026-02-03",
      "id": "144221",
      "original_text": "Einreichung neuer Dokumente\nNordrhein-Westfalen Amtsgericht Duisburg HRB 33527\nFN Netz GmbH – Dinslaken",
      "type": "Einreichung neuer Dokumente",
      "state": "Nordrhein-Westfalen",
      "amtsgericht": "Amtsgericht Duisburg",
      "registernummer": "HRB 33527",
      "registerart": "HRB",
      "company_name": "FN Netz GmbH",
      "company_seat": "Dinslaken",
      "details": "03.02.2026 (Bekanntmachungsdatum)\n\nNordrhein-Westfalen Amtsgericht Duisburg HRB 33527\nEinreichung neuer Dokumente\n\nFN Netz GmbH\nGesellschaft mit beschränkter Haftung\nDinslaken\n\nDem Registergericht ist eine Liste der Mitglieder des Aufsichtsrates eingereicht worden."
    },
    {
      "date": "2026-02-03",
      "id": "144222",
      "original_text": "Einreichung neuer Dokumente\nNordrhein-Westfalen Amtsgericht Düsseldorf HRB 38062\nVodafone GmbH – Düsseldorf",
      "type": "Einreichung neuer Dokumente",
      "state": "Nordrhein-Westfalen",
      "amtsgericht": "Amtsgericht Düsseldorf",
      "registernummer": "HRB 38062",
      "registerart": "HRB",
      "company_name": "Vodafone GmbH",
      "company_seat": "Düsseldorf",
      "details": "03.02.2026 (Bekanntmachungsdatum)\n\nNordrhein-Westfalen Amtsgericht Düsseldorf HRB 38062\nEinreichung neuer Dokumente\n\nVodafone GmbH\nGesellschaft mit beschränkter Haftung\nDüsseldorf\n\nDem Registergericht ist eine Liste der Mitglieder des Aufsichtsrates eingereicht worden."
    },
    {
      "date": "2026-02-03",
      "id": "144223",
      "original_text": "Löschungsankündigung\nNordrhein-Westfalen Amtsgericht Bonn HRB 21428\nCIGO Transport GmbH – Bonn",
      "type": "Löschungsankündigung",
      "state": "Nordrhein-Westfalen",
      "amtsgericht": "Amtsgericht Bonn",
      "registernummer": "HRB 21428",
      "registerart": "HRB",
      "company_name": "CIGO Transport GmbH",
      "company_seat": "Bonn",
      "details": "03.02.2026 (Bekanntmachungsdatum)\n\nNordrhein-Westfalen Amtsgericht Bonn HRB 21428\nLöschungsankündigung\n\nCIGO Transport GmbH\nGesellschaft mit beschränkter Haftung\nBonn\n\nDas Registergericht beabsichtigt die Gesellschaft von Amts wegen nach § 394 FamFG zu löschen. Die Frist zur Erhebung eines Widerspruchs ist auf einen Monat festgesetzt."
    },
    {
      "date": "2026-02-03",
      "id": "144224",
      "original_text": "Einreichung neuer Dokumente\nNordrhein-Westfalen Amtsgericht Wuppertal HRB 20128\nWSW mobil GmbH – Wuppertal",
      "type": "Einreichung neuer Dokumente",
      "state": "Nordrhein-Westfalen",
      "amtsgericht": "Amtsgericht Wuppertal",
      "registernummer": "HRB 20128",
      "registerart": "HRB",
      "company_name": "WSW mobil GmbH",
      "company_seat": "Wuppertal",
      "details": "03.02.2026 (Bekanntmachungsdatum)\n\nNordrhein-Westfalen Amtsgericht Wuppertal HRB 20128\nEinreichung neuer Dokumente\n\nWSW mobil GmbH\nGesellschaft mit beschränkter Haftung\nWuppertal\n\nDem Registergericht ist eine neue Liste der Mitglieder des Aufsichtsrates eingereicht worden."
    },
    {
      "date": "2026-02-03",
      "id": "144225",
      "original_text": "Einreichung neuer Dokumente\nNordrhein-Westfalen Amtsgericht Paderborn HRB 3507\nWINCOR NIXDORF International GmbH – Paderborn",
      "type": "Einreichung neuer Dokumente",
      "state": "Nordrhein-Westfalen",
      "amtsgericht": "Amtsgericht Paderborn",
      "registernummer": "HRB 3507",
      "registerart": "HRB",
      "company_name": "WINCOR NIXDORF International GmbH",
      "company_seat": "Paderborn",
      "details": "03.02.2026 (Bekanntmachungsdatum)\n\nNordrhein-Westfalen Amtsgericht Paderborn HRB 3507\nEinreichung neuer Dokumente 03.02.2026 (Eintragungsdatum)\n\nWINCOR NIXDORF International GmbH\nGesellschaft mit beschränkter Haftung\nPaderborn\n\nDem Registergericht ist eine neue Liste der Mitglieder des Aufsichtsrates eingereicht worden."
    },
    {
      "date": "2026-02-03",
      "id": "144226",
      "original_text": "Einreichung neuer Dokumente\nNordrhein-Westfalen Amtsgericht Düsseldorf HRB 36405\nERGO Vorsorge Lebensversicherung Aktiengesellschaft – Düsseldorf",
      "type": "Einreichung neuer Dokumente",
      "state": "Nordrhein-Westfalen",
      "amtsgericht": "Amtsgericht Düsseldorf",
      "registernummer": "HRB 36405",
      "registerart": "HRB",
      "company_name": "ERGO Vorsorge Lebensversicherung Aktiengesellschaft",
      "company_seat": "Düsseldorf",
      "details": "03.02.2026 (Bekanntmachungsdatum)\n\nNordrhein-Westfalen Amtsgericht Düsseldorf HRB 36405\nEinreichung neuer Dokumente\n\nERGO Vorsorge Lebensversicherung Aktiengesellschaft\nAktiengesellschaft\nDüsseldorf\n\nDem Registergericht ist eine Liste der Mitglieder des Aufsichtsrates eingereicht worden."
    },
    {
      "date": "2026-02-03",
      "id": "144227",
      "original_text": "Löschungsankündigung\nNordrhein-Westfalen Amtsgericht Köln HRB 101932\nBe Secure Deutschland GmbH – Köln",
      "type": "Löschungsankündigung",
      "state": "Nordrhein-Westfalen",
      "amtsgericht": "Amtsgericht Köln",
      "registernummer": "HRB 101932",
      "registerart": "HRB",
      "company_name": "Be Secure Deutschland GmbH",
      "company_seat": "Köln",
      "details": "03.02.2026 (Bekanntmachungsdatum)\n\nNordrhein-Westfalen Amtsgericht Köln HRB 101932\nLöschungsankündigung\n\nBe Secure Deutschland GmbH\nGesellschaft mit beschränkter Haftung\nKöln\n\nDas Registergericht beabsichtigt die Gesellschaft von Amts wegen nach § 394 FamFG zu löschen. Die Frist zur Erhebung eines Widerspruchs ist auf einen Monat festgesetzt."
    },
    {
      "date": "2026-02-03",
      "id": "144228",
      "original_text": "Einreichung neuer Dokumente\nNordrhein-Westfalen Amtsgericht Köln HRB 37306\nRheinEnergie AG – Köln",
      "type": "Einreichung neuer Dokumente",
      "state": "Nordrhein-Westfalen",
      "amtsgericht": "Amtsgericht Köln",
      "registernummer": "HRB 37306",
      "registerart": "HRB",
      "company_name": "RheinEnergie AG",
      "company_seat": "Köln",
      "details": "03.02.2026 (Bekanntmachungsdatum)\n\nNordrhein-Westfalen Amtsgericht Köln HRB 37306\nEinreichung neuer Dokumente\n\nRheinEnergie AG\nAktiengesellschaft\nKöln\n\nDem Registergericht ist eine Liste der Mitglieder des Aufsichtsrates eingereicht worden."
    },
    {
      "date": "2026-02-03",
      "id": "144229",
      "original_text": "Einreichung neuer Dokumente\nNordrhein-Westfalen Amtsgericht Duisburg HRB 1531\nDuisburger Werkstatt für Menschen mit Behinderung gemeinnnützige GmbH – Duisburg",
      "type": "Einreichung neuer Dokumente",
      "state": "Nordrhein-Westfalen",
      "amtsgericht": "Amtsgericht Duisburg",
      "registernummer": "HRB 1531",
      "registerart": "HRB",
      "company_name": "Duisburger Werkstatt für Menschen mit Behinderung gemeinnnützige GmbH",
      "company_seat": "Duisburg",
      "details": "03.02.2026 (Bekanntmachungsdatum)\n\nNordrhein-Westfalen Amtsgericht Duisburg HRB 1531\nEinreichung neuer Dokumente\n\nDuisburger Werkstatt für Menschen mit Behinderung gemeinnnützige GmbH\nGesellschaft mit beschränkter Haftung\nDuisburg\n\nDem Registergericht ist eine Liste der Mitglieder des Aufsichtsrates eingereicht worden."
    },
    {
      "date": "2026-02-03",
      "id": "144230",
      "original_text": "Einreichung neuer Dokumente\nNordrhein-Westfalen Amtsgericht Münster HRB 53\nWohn + Stadtbau Wohnungsunternehmen der Stadt Münster GmbH – Münster",
      "type": "Einreichung neuer Dokumente",
      "state": "Nordrhein-Westfalen",
      "amtsgericht": "Amtsgericht Münster",
      "registernummer": "HRB 53",
      "registerart": "HRB",
      "company_name": "Wohn + Stadtbau Wohnungsunternehmen der Stadt Münster GmbH",
      "company_seat": "Münster",
      "details": "03.02.2026 (Bekanntmachungsdatum)\n\nNordrhein-Westfalen Amtsgericht Münster HRB 53\nEinreichung neuer Dokumente\n\nWohn + Stadtbau Wohnungsunternehmen der Stadt Münster GmbH\nGesellschaft mit beschränkter Haftung\nMünster\n\nDem Registergericht ist eine neue Liste der Mitglieder des Aufsichtsrates eingereicht worden."
    },
    {
      "date": "2026-02-03",
      "id": "144231",
      "original_text": "Löschungsankündigung\nNordrhein-Westfalen Amtsgericht Düsseldorf HRB 100523\nFast Street Spedition GmbH – Düsseldorf",
      "type": "Löschungsankündigung",
      "state": "Nordrhein-Westfalen",
      "amtsgericht": "Amtsgericht Düsseldorf",
      "registernummer": "HRB 100523",
      "registerart": "HRB",
      "company_name": "Fast Street Spedition GmbH",
      "company_seat": "Düsseldorf",
      "details": "03.02.2026 (Bekanntmachungsdatum)\n\nNordrhein-Westfalen Amtsgericht Düsseldorf HRB 100523\nLöschungsankündigung\n\nFast Street Spedition GmbH\nGesellschaft mit beschränkter Haftung\nDüsseldorf\n\nDas Registergericht beabsichtigt die Gesellschaft von Amts wegen nach § 394 FamFG zu löschen. Die Frist zur Erhebung eines Widerspruchs ist auf 3 Wochen festgesetzt.\n\nRechtsbehelfsbelehrung:\nDas Widerspruchsrecht steht jedem zu, der an der Unterlassung der Löschung ein berechtigtes Interesse hat. Der Widerspruch ist bei dem Amtsgericht Düsseldorf -Registergericht-, Werdener Straße 1, 40227 Düsseldorf schriftlich in deutscher Sprache oder zur Niederschrift der Geschäftsstelle einzulegen. Der Widerspruch kann auch zur Niederschrift der Geschäftsstelle eines jeden Amtsgerichtes abgegeben werden. Die Einlegung ist auch durch Übertragung eines elektronischen Dokuments an die elektronische Poststelle des Gerichts möglich. Das elektronische Dokument muss für die Bearbeitung durch das Gericht geeignet und mit einer qualifizierten elektronischen Signatur der verantwortenden Person versehen sein oder von der verantwortenden Person signiert und auf einem sicheren Übermittlungsweg gemäß § 130a ZPO nach näherer Maßgabe der Verordnung über die technischen Rahmenbedingungen des elektronischen Rechtsverkehrs und über das besondere elektronische Behördenpostfach (BGBl. I, S.3803) eingereicht werden. Weitere Informationen erhalten Sie auf der Internetseite www.justiz.de.\nDer Widerspruch muss spätestens innerhalb der gesetzten Frist nach dem Datum der Bekanntmachung der Löschungsankündigung bei dem Amtsgericht - Registergericht - Düsseldorf eingegangen sein.  Dies gilt auch dann, wenn der Widerspruch zur Niederschrift der Geschäftsstelle eines anderen Amtsgerichtes abgegeben wurde. Die Frist beginnt mit dem Tage der Bekanntmachung der Löschungsankündigung in dem für die Bekanntmachung der Eintragungen in das Handelsregister bestimmten elektronischen Informations- und Kommunikationssystem nach § 10 des Handelsgesetzbuches. Fällt das Ende der Frist auf einen Sonntag, einen allgemeinen Feiertag oder Sonnabend, so endet die Frist mit Ablauf des nächsten Werktages.\nDer Widerspruch muss die Bezeichnung der angefochtenen Löschungsankündigung sowie die Erklärung enthalten, dass Widerspruch gegen diese Löschungsankündigung eingelegt wird. Er ist zu unterzeichnen und soll begründet werden."
    },
    {
      "date": "2026-02-03",
      "id": "144232",
      "original_text": "Einreichung neuer Dokumente\nNordrhein-Westfalen Amtsgericht Neuss HRB 1878\n3M Deutschland GmbH – Neuss",
      "type": "Einreichung neuer Dokumente",
      "state": "Nordrhein-Westfalen",
      "amtsgericht": "Amtsgericht Neuss",
      "registernummer": "HRB 1878",
      "registerart": "HRB",
      "company_name": "3M Deutschland GmbH",
      "company_seat": "Neuss",
      "details": "03.02.2026 (Bekanntmachungsdatum)\n\nNordrhein-Westfalen Amtsgericht Neuss HRB 1878\nEinreichung neuer Dokumente\n\n3M Deutschland GmbH\nGesellschaft mit beschränkter Haftung\nNeuss\n\nDem Registergericht ist eine neue Liste der Mitglieder des Aufsichtsrates eingereicht worden."
    },
    {
      "date": "2026-02-03",
      "id": "144233",
      "original_text": "Registerbekanntmachung nach dem Umwandlungsgesetz\nNordrhein-Westfalen Amtsgericht Paderborn HRB 10282\nBlumen Neumann GmbH – Lippstadt",
      "type": "Registerbekanntmachung nach dem Umwandlungsgesetz",
      "state": "Nordrhein-Westfalen",
      "amtsgericht": "Amtsgericht Paderborn",
      "registernummer": "HRB 10282",
      "registerart": "HRB",
      "company_name": "Blumen Neumann GmbH",
      "company_seat": "Lippstadt",
      "details": "03.02.2026 (Bekanntmachungsdatum)\n\nNordrhein-Westfalen Amtsgericht Paderborn HRB 10282\nRegisterbekanntmachung nach dem Umwandlungsgesetz 03.02.2026 (Eintragungsdatum)\n\nBlumen Neumann GmbH\nGesellschaft mit beschränkter Haftung\nLippstadt\n\nDen Gläubigern der an der Verschmelzung beteiligten Rechtsträger ist, wenn sie binnen sechs Monaten nach dem Tag, an dem die Eintragung der Verschmelzung in das Register des Sitzes desjenigen Rechtsträgers, dessen Gläubiger sie sind, nach § 19 Absatz 3 UmwG als bekanntgemacht gilt, ihren Anspruch nach Grund und Höhe schriftlich anmelden, Sicherheit zu leisten, soweit sie nicht Befriedigung verlangen können. Dieses Recht steht den Gläubigern jedoch nur zu, wenn sie glaubhaft machen, dass durch die Verschmelzung die Erfüllung ihrer Forderung gefährdet wird."
    },
    {
      "date": "2026-02-03",
      "id": "144234",
      "original_text": "Löschungsankündigung\nNordrhein-Westfalen Amtsgericht Köln HRB 65512\nWUB24 Deutschland Limited – Köln",
      "type": "Löschungsankündigung",
      "state": "Nordrhein-Westfalen",
      "amtsgericht": "Amtsgericht Köln",
      "registernummer": "HRB 65512",
      "registerart": "HRB",
      "company_name": "WUB24 Deutschland Limited",
      "company_seat": "Köln",
      "details": "03.02.2026 (Bekanntmachungsdatum)\n\nNordrhein-Westfalen Amtsgericht Köln HRB 65512\nLöschungsankündigung\n\nWUB24 Deutschland Limited\nRechtsform ausländischen Rechts HRB\nKöln\n\nDas Registergericht beabsichtigt die Gesellschaft von Amts wegen nach § 394 FamFG zu löschen. Die Frist zur Erhebung eines Widerspruchs ist auf einen Monat festgesetzt."
    },
    {
      "date": "2026-02-03",
      "id": "144235",
      "original_text": "Löschungsankündigung\nHessen Amtsgericht Frankfurt am Main HRB 107067\nPartnerbau Schmitt GmbH – Frankfurt am Main",
      "type": "Löschungsankündigung",
      "state": "Hessen",
      "amtsgericht": "Amtsgericht Frankfurt am Main",
      "registernummer": "HRB 107067",
      "registerart": "HRB",
      "company_name": "Partnerbau Schmitt GmbH",
      "company_seat": "Frankfurt am Main",
      "details": "03.02.2026 (Bekanntmachungsdatum)\n\nHessen Amtsgericht Frankfurt am Main HRB 107067\nLöschungsankündigung 03.02.2026 (Eintragungsdatum)\n\nPartnerbau Schmitt GmbH\nGesellschaft mit beschränkter Haftung\nFrankfurt am Main\n\nDas Registergericht beabsichtigt die im Handelsregister eingetragene Gesellschaft von Amts wegen nach § 394 FamFG zu löschen. Die Frist zur Erhebung eines Widerspruchs gegen die beabsichtigte Löschung wird auf 1 Monat festgesetzt."
    },
    {
      "date": "2026-02-03",
      "id": "144236",
      "original_text": "Löschungsankündigung\nHessen Amtsgericht Frankfurt am Main HRB 24270\nZigarrenhaus Günther Gesellschaft mit beschränkter Haftung – Frankfurt am Main",
      "type": "Löschungsankündigung",
      "state": "Hessen",
      "amtsgericht": "Amtsgericht Frankfurt am Main",
      "registernummer": "HRB 24270",
      "registerart": "HRB",
      "company_name": "Zigarrenhaus Günther Gesellschaft mit beschränkter Haftung",
      "company_seat": "Frankfurt am Main",
      "details": "03.02.2026 (Bekanntmachungsdatum)\n\nHessen Amtsgericht Frankfurt am Main HRB 24270\nLöschungsankündigung\n\nZigarrenhaus Günther Gesellschaft mit beschränkter Haftung\nGesellschaft mit beschränkter Haftung\nFrankfurt am Main\n\nEs ist beabsichtig, die Gesellschaft wegen Vermögenslosigkeit gemäß § 394 FamFG von Amts wegen im Handelsregister zu löschen. Hiergegen kann innerhalb eines Zeitraums von 1 Monat nach dieser Veröffentlichung Widerspruch bei dem Amtsgericht Frankfurt am Main eingelegt werden."
    },
    {
      "date": "2026-02-03",
      "id": "144237",
      "original_text": "Sonstige Registerbekanntmachung\nHessen Amtsgericht Limburg VR 728\nLandseniorenvereinigung Limburg – Limburg a. d. Lahn",
      "type": "Sonstige Registerbekanntmachung",
      "state": "Hessen",
      "amtsgericht": "Amtsgericht Limburg",
      "registernummer": "VR 728",
      "registerart": "VR",
      "company_name": "Landseniorenvereinigung Limburg",
      "company_seat": "Limburg a. d. Lahn",
      "details": "03.02.2026 (Bekanntmachungsdatum)\n\nHessen Amtsgericht Limburg VR 728\nSonstige Registerbekanntmachung 03.02.2026 (Eintragungsdatum)\n\nLandseniorenvereinigung Limburg\neingetragener Verein\nLimburg a. d. Lahn\n\nDer Verein ist aufgelöst."
    },
    {
      "date": "2026-02-03",
      "id": "144238",
      "original_text": "Löschungsankündigung\nHessen Amtsgericht Darmstadt HRB 104081\nAventicum Plus GmbH – Rüsselsheim",
      "type": "Löschungsankündigung",
      "state": "Hessen",
      "amtsgericht": "Amtsgericht Darmstadt",
      "registernummer": "HRB 104081",
      "registerart": "HRB",
      "company_name": "Aventicum Plus GmbH",
      "company_seat": "Rüsselsheim",
      "details": "03.02.2026 (Bekanntmachungsdatum)\n\nHessen Amtsgericht Darmstadt HRB 104081\nLöschungsankündigung 03.02.2026 (Eintragungsdatum)\n\nAventicum Plus GmbH\nGesellschaft mit beschränkter Haftung\nRüsselsheim\n\nDas Registergericht beabsichtigt die im Handelsregister eingetragene Gesellschaft von Amts wegen nach § 394 FamFG zu löschen. Die Frist zur Erhebung eines Widerspruchs gegen die beabsichtigte Löschung wird auf 3 Monate festgesetzt."
    },
    {
      "date": "2026-02-03",
      "id": "144239",
      "original_text": "Löschungsankündigung\nHessen Amtsgericht Wetzlar HRB 6226\nEquimondi GmbH – Waldsolms",
      "type": "Löschungsankündigung",
      "state": "Hessen",
      "amtsgericht": "Amtsgericht Wetzlar",
      "registernummer": "HRB 6226",
      "registerart": "HRB",
      "company_name": "Equimondi GmbH",
      "company_seat": "Waldsolms",
      "details": "03.02.2026 (Bekanntmachungsdatum)\n\nHessen Amtsgericht Wetzlar HRB 6226\nLöschungsankündigung\n\nEquimondi GmbH\nGesellschaft mit beschränkter Haftung\nWaldsolms\n\nDas Registergericht beabsichtigt die im Handelsregister eingetragene Gesellschaft von Amts wegen nach § 394 FamFG zu löschen. Die Frist zur Erhebung eines Widerspruchs gegen die beabsichtigte Löschung wird auf 1 Monat festgesetzt."
    },
    {
      "date": "2026-02-03",
      "id": "144240",
      "original_text": "Löschungsankündigung\nHessen Amtsgericht Frankfurt am Main HRB 124641\nLK Dienstleistungen GmbH – Frankfurt am Main",
      "type": "Löschungsankündigung",
      "state": "Hessen",
      "amtsgericht": "Amtsgericht Frankfurt am Main",
      "registernummer": "HRB 124641",
      "registerart": "HRB",
      "company_name": "LK Dienstleistungen GmbH",
      "company_seat": "Frankfurt am Main",
      "details": "03.02.2026 (Bekanntmachungsdatum)\n\nHessen Amtsgericht Frankfurt am Main HRB 124641\nLöschungsankündigung 03.02.2026 (Eintragungsdatum)\n\nLK Dienstleistungen GmbH\nGesellschaft mit beschränkter Haftung\nFrankfurt am Main\n\nDas Registergericht beabsichtigt die im Handelsregister eingetragene Gesellschaft von Amts wegen nach § 394 FamFG zu löschen. Die Frist zur Erhebung eines Widerspruchs gegen die beabsichtigte Löschung wird auf 1 Monat festgesetzt."
    },
    {
      "date": "2026-02-03",
      "id": "144241",
      "original_text": "Sonstige Registerbekanntmachung\nHessen Amtsgericht Limburg VR 239\nHausfrauenbund \"Limburg aktiv\" – Limburg a. d. Lahn",
      "type": "Sonstige Registerbekanntmachung",
      "state": "Hessen",
      "amtsgericht": "Amtsgericht Limburg",
      "registernummer": "VR 239",
      "registerart": "VR",
      "company_name": "Hausfrauenbund \"Limburg aktiv\"",
      "company_seat": "Limburg a. d. Lahn",
      "details": "03.02.2026 (Bekanntmachungsdatum)\n\nHessen Amtsgericht Limburg VR 239\nSonstige Registerbekanntmachung 03.02.2026 (Eintragungsdatum)\n\nHausfrauenbund \"Limburg aktiv\"\neingetragener Verein\nLimburg a. d. Lahn\n\nDer Verein ist aufgelöst."
    },
    {
      "date": "2026-02-03",
      "id": "144242",
      "original_text": "Sonstige Registerbekanntmachung\nHessen Amtsgericht Limburg VR 1695\nLandesseniorenvereinigung Oberlahn – Weilburg",
      "type": "Sonstige Registerbekanntmachung",
      "state": "Hessen",
      "amtsgericht": "Amtsgericht Limburg",
      "registernummer": "VR 1695",
      "registerart": "VR",
      "company_name": "Landesseniorenvereinigung Oberlahn",
      "company_seat": "Weilburg",
      "details": "03.02.2026 (Bekanntmachungsdatum)\n\nHessen Amtsgericht Limburg VR 1695\nSonstige Registerbekanntmachung 03.02.2026 (Eintragungsdatum)\n\nLandesseniorenvereinigung Oberlahn\neingetragener Verein\nWeilburg\n\nDer Verein ist aufgelöst."
    },
    {
      "date": "2026-02-03",
      "id": "144243",
      "original_text": "Löschungsankündigung\nHessen Amtsgericht Wiesbaden HRB 28845\nIntegrades Solutions GmbH – Wiesbaden",
      "type": "Löschungsankündigung",
      "state": "Hessen",
      "amtsgericht": "Amtsgericht Wiesbaden",
      "registernummer": "HRB 28845",
      "registerart": "HRB",
      "company_name": "Integrades Solutions GmbH",
      "company_seat": "Wiesbaden",
      "details": "03.02.2026 (Bekanntmachungsdatum)\n\nHessen Amtsgericht Wiesbaden HRB 28845\nLöschungsankündigung\n\nIntegrades Solutions GmbH\nGesellschaft mit beschränkter Haftung\nWiesbaden\n\nDas Registergericht beabsichtigt die im Handelsregister eingetragene Gesellschaft von Amts wegen nach § 394 FamFG zu löschen. Die Frist zur Erhebung eines Widerspruchs gegen die beabsichtigte Löschung wird auf 3 Monate festgesetzt."
    },
    {
      "date": "2026-02-03",
      "id": "144244",
      "original_text": "Einreichung neuer Dokumente\nHessen Amtsgericht Frankfurt am Main HRB 102815\nQnit AG – Eschborn",
      "type": "Einreichung neuer Dokumente",
      "state": "Hessen",
      "amtsgericht": "Amtsgericht Frankfurt am Main",
      "registernummer": "HRB 102815",
      "registerart": "HRB",
      "company_name": "Qnit AG",
      "company_seat": "Eschborn",
      "details": "03.02.2026 (Bekanntmachungsdatum)\n\nHessen Amtsgericht Frankfurt am Main HRB 102815\nEinreichung neuer Dokumente 03.02.2026 (Eintragungsdatum)\n\nQnit AG\nAktiengesellschaft\nEschborn\n\nDurch eine Änderung in den Personen der Aufsichtsratsmitglieder ist eine Liste der Mitglieder des Aufsichtsrates zum Handelsregister eingereicht worden."
    }
  ]
}