{
  "date": "2026-01-06",
  "date_of_scrape": "2026-01-07T04:22:30.850Z",
  "tool_version": "0.2.0",
  "number_of_announcements": 124,
  "announcements": [
    {
      "date": "2026-01-06",
      "id": "141561",
      "original_text": "Registerbekanntmachung nach dem Umwandlungsgesetz\nBayern Amtsgericht München HRB 308425\nNPI GmbH – Gilching",
      "type": "Registerbekanntmachung nach dem Umwandlungsgesetz",
      "state": "Bayern",
      "amtsgericht": "Amtsgericht München",
      "registernummer": "HRB 308425",
      "registerart": "HRB",
      "company_name": "NPI GmbH",
      "company_seat": "Gilching",
      "details": "06.01.2026 (Bekanntmachungsdatum)\n\nBayern Amtsgericht München HRB 308425\nRegisterbekanntmachung nach dem Umwandlungsgesetz 05.01.2026 (Eintragungsdatum)\n\nNPI GmbH\nGesellschaft mit beschränkter Haftung\nGilching\n\nDen Gläubigern des formwechselnden Rechtsträgers ist, wenn sie binnen sechs Monaten nach dem Tag, an dem die Eintragung des Formwechsels nach § 201 UmwG als bekannt gemacht gilt, ihren Anspruch nach Grund und Höhe in Textform anmelden, Sicherheit zu leisten, soweit sie nicht Befriedigung verlangen können. Dieses Recht steht den Gläubigern jedoch nur zu, wenn sie glaubhaft machen, dass durch den Formwechsel die Erfüllung ihrer Forderung gefährdet wird."
    },
    {
      "date": "2026-01-06",
      "id": "141562",
      "original_text": "Sonstige Registerbekanntmachung\nBayern Amtsgericht München HRB 104684\nFIPA GmbH – Ismaning",
      "type": "Sonstige Registerbekanntmachung",
      "state": "Bayern",
      "amtsgericht": "Amtsgericht München",
      "registernummer": "HRB 104684",
      "registerart": "HRB",
      "company_name": "FIPA GmbH",
      "company_seat": "Ismaning",
      "details": "06.01.2026 (Bekanntmachungsdatum)\n\nBayern Amtsgericht München HRB 104684\nSonstige Registerbekanntmachung 05.01.2026 (Eintragungsdatum)\n\nFIPA GmbH\nGesellschaft mit beschränkter Haftung\nIsmaning\n\nDen Gläubigern der Gesellschaft, deren Forderungen begründet worden sind, bevor die Eintragung der Beendigung des Gewinnabführungsvertrages in das Handelsregister nach § 10 des Handelsgesetzbuches als bekanntgemacht gilt, hat der andere Vertragsteil Sicherheit zu leisten, wenn sie sich binnen sechs Monaten nach der Bekanntmachung der Eintragung zu diesem Zweck bei ihm melden."
    },
    {
      "date": "2026-01-06",
      "id": "141563",
      "original_text": "Sonstige Registerbekanntmachung\nBayern Amtsgericht München HRB 247293\nKMLZ Innovative Tax Solutions GmbH – München",
      "type": "Sonstige Registerbekanntmachung",
      "state": "Bayern",
      "amtsgericht": "Amtsgericht München",
      "registernummer": "HRB 247293",
      "registerart": "HRB",
      "company_name": "KMLZ Innovative Tax Solutions GmbH",
      "company_seat": "München",
      "details": "06.01.2026 (Bekanntmachungsdatum)\n\nBayern Amtsgericht München HRB 247293\nSonstige Registerbekanntmachung 05.01.2026 (Eintragungsdatum)\n\nKMLZ Innovative Tax Solutions GmbH\nGesellschaft mit beschränkter Haftung\nMünchen\n\nDen Gläubigern der Gesellschaft, deren Forderungen begründet worden sind, bevor die Eintragung der Beendigung des Gewinnabführungsvertrages in das Handelsregister nach § 10 des Handelsgesetzbuches als bekanntgemacht gilt, hat der andere Vertragsteil Sicherheit zu leisten, wenn sie sich binnen sechs Monaten nach der Bekanntmachung der Eintragung zu diesem Zweck bei ihm melden."
    },
    {
      "date": "2026-01-06",
      "id": "141564",
      "original_text": "Sonstige Registerbekanntmachung\nBayern Amtsgericht München HRB 136982\nIDS GmbH - Analysis and Reporting Services – München",
      "type": "Sonstige Registerbekanntmachung",
      "state": "Bayern",
      "amtsgericht": "Amtsgericht München",
      "registernummer": "HRB 136982",
      "registerart": "HRB",
      "company_name": "IDS GmbH - Analysis and Reporting Services",
      "company_seat": "München",
      "details": "06.01.2026 (Bekanntmachungsdatum)\n\nBayern Amtsgericht München HRB 136982\nSonstige Registerbekanntmachung 05.01.2026 (Eintragungsdatum)\n\nIDS GmbH - Analysis and Reporting Services\nGesellschaft mit beschränkter Haftung\nMünchen\n\nDen Gläubigern der Gesellschaft, deren Forderungen begründet worden sind, bevor die Eintragung der Beendigung des Beherrschungs- und Gewinnabführungsvertrages in das Handelsregister nach § 10 des Handelsgesetzbuches als bekanntgemacht gilt, hat der andere Vertragsteil Sicherheit zu leisten, wenn sie sich binnen sechs Monaten nach der Bekanntmachung der Eintragung zu diesem Zweck bei ihm melden."
    },
    {
      "date": "2026-01-06",
      "id": "141565",
      "original_text": "Sonstige Registerbekanntmachung\nBayern Amtsgericht München HRB 228487\nForum der Industrie für smart applications UG (haftungsbeschränkt) – München",
      "type": "Sonstige Registerbekanntmachung",
      "state": "Bayern",
      "amtsgericht": "Amtsgericht München",
      "registernummer": "HRB 228487",
      "registerart": "HRB",
      "company_name": "Forum der Industrie für smart applications UG (haftungsbeschränkt)",
      "company_seat": "München",
      "details": "06.01.2026 (Bekanntmachungsdatum)\n\nBayern Amtsgericht München HRB 228487\nSonstige Registerbekanntmachung 05.01.2026 (Eintragungsdatum)\n\nForum der Industrie für smart applications UG (haftungsbeschränkt)\nGesellschaft mit beschränkter Haftung\nMünchen\n\nDen Gläubigern der Gesellschaft, deren Forderungen begründet worden sind, bevor die Eintragung der Beendigung des Gewinnabführungsvertrages in das Handelsregister nach § 10 des Handelsgesetzbuches als bekanntgemacht gilt, hat der andere Vertragsteil Sicherheit zu leisten, wenn sie sich binnen sechs Monaten nach der Bekanntmachung der Eintragung zu diesem Zweck bei ihm melden."
    },
    {
      "date": "2026-01-06",
      "id": "141566",
      "original_text": "Registerbekanntmachung nach dem Umwandlungsgesetz\nBayern Amtsgericht München HRB 193878\nCarlyle Investment 3 GmbH – München",
      "type": "Registerbekanntmachung nach dem Umwandlungsgesetz",
      "state": "Bayern",
      "amtsgericht": "Amtsgericht München",
      "registernummer": "HRB 193878",
      "registerart": "HRB",
      "company_name": "Carlyle Investment 3 GmbH",
      "company_seat": "München",
      "details": "06.01.2026 (Bekanntmachungsdatum)\n\nBayern Amtsgericht München HRB 193878\nRegisterbekanntmachung nach dem Umwandlungsgesetz 05.01.2026 (Eintragungsdatum)\n\nCarlyle Investment 3 GmbH\nGesellschaft mit beschränkter Haftung\nMünchen\n\nDen Gläubigern der an der Verschmelzung beteiligten Rechtsträger ist, wenn sie binnen sechs Monaten nach dem Tag, an dem die Eintragung der Verschmelzung in das Register des Sitzes desjenigen Rechtsträgers, dessen Gläubiger sie sind, nach § 19 Abs. 3 UmwG als bekannt gemacht gilt, ihren Anspruch nach Grund und Höhe in Textform anmelden, Sicherheit zu leisten, soweit sie nicht Befriedigung verlangen können. Dieses Recht steht den Gläubigern jedoch nur zu, wenn sie glaubhaft machen, dass durch die Verschmelzung die Erfüllung ihrer Forderung gefährdet wird."
    },
    {
      "date": "2026-01-06",
      "id": "141567",
      "original_text": "Registerbekanntmachung nach dem Umwandlungsgesetz\nBayern Amtsgericht München HRB 301088\nSEBART GmbH – Grafing b.München",
      "type": "Registerbekanntmachung nach dem Umwandlungsgesetz",
      "state": "Bayern",
      "amtsgericht": "Amtsgericht München",
      "registernummer": "HRB 301088",
      "registerart": "HRB",
      "company_name": "SEBART GmbH",
      "company_seat": "Grafing b.München",
      "details": "06.01.2026 (Bekanntmachungsdatum)\n\nBayern Amtsgericht München HRB 301088\nRegisterbekanntmachung nach dem Umwandlungsgesetz 05.01.2026 (Eintragungsdatum)\n\nSEBART GmbH\nGesellschaft mit beschränkter Haftung\nGrafing b.München\n\nDen Gläubigern des formwechselnden Rechtsträgers ist, wenn sie binnen sechs Monaten nach dem Tag, an dem die Eintragung des Formwechsels nach § 201 UmwG als bekannt gemacht gilt, ihren Anspruch nach Grund und Höhe in Textform anmelden, Sicherheit zu leisten, soweit sie nicht Befriedigung verlangen können. Dieses Recht steht den Gläubigern jedoch nur zu, wenn sie glaubhaft machen, dass durch den Formwechsel die Erfüllung ihrer Forderung gefährdet wird."
    },
    {
      "date": "2026-01-06",
      "id": "141568",
      "original_text": "Registerbekanntmachung nach dem Umwandlungsgesetz\nBayern Amtsgericht München HRB 211129\nNEUROTH HÖRCENTER GmbH – München",
      "type": "Registerbekanntmachung nach dem Umwandlungsgesetz",
      "state": "Bayern",
      "amtsgericht": "Amtsgericht München",
      "registernummer": "HRB 211129",
      "registerart": "HRB",
      "company_name": "NEUROTH HÖRCENTER GmbH",
      "company_seat": "München",
      "details": "06.01.2026 (Bekanntmachungsdatum)\n\nBayern Amtsgericht München HRB 211129\nRegisterbekanntmachung nach dem Umwandlungsgesetz 05.01.2026 (Eintragungsdatum)\n\nNEUROTH HÖRCENTER GmbH\nGesellschaft mit beschränkter Haftung\nMünchen\n\nDen Gläubigern der an der Verschmelzung beteiligten Rechtsträger ist, wenn sie binnen sechs Monaten nach dem Tag, an dem die Eintragung der Verschmelzung in das Register des Sitzes desjenigen Rechtsträgers, dessen Gläubiger sie sind, nach § 19 Abs. 3 UmwG als bekannt gemacht gilt, ihren Anspruch nach Grund und Höhe in Textform anmelden, Sicherheit zu leisten, soweit sie nicht Befriedigung verlangen können. Dieses Recht steht den Gläubigern jedoch nur zu, wenn sie glaubhaft machen, dass durch die Verschmelzung die Erfüllung ihrer Forderung gefährdet wird."
    },
    {
      "date": "2026-01-06",
      "id": "141569",
      "original_text": "Sonstige Registerbekanntmachung\nBayern Amtsgericht München HRB 250614\nTagwerk Einzelhandel für Naturkost GmbH – Garching b.München",
      "type": "Sonstige Registerbekanntmachung",
      "state": "Bayern",
      "amtsgericht": "Amtsgericht München",
      "registernummer": "HRB 250614",
      "registerart": "HRB",
      "company_name": "Tagwerk Einzelhandel für Naturkost GmbH",
      "company_seat": "Garching b.München",
      "details": "06.01.2026 (Bekanntmachungsdatum)\n\nBayern Amtsgericht München HRB 250614\nSonstige Registerbekanntmachung 05.01.2026 (Eintragungsdatum)\n\nTagwerk Einzelhandel für Naturkost GmbH\nGesellschaft mit beschränkter Haftung\nGarching b.München\n\nDen Gläubigern der Gesellschaft, deren Forderungen begründet worden sind, bevor die Eintragung der Beendigung des Beherrschungs- und Gewinnabführungsvertrages in das Handelsregister nach § 10 des Handelsgesetzbuches als bekanntgemacht gilt, hat der andere Vertragsteil Sicherheit zu leisten, wenn sie sich binnen sechs Monaten nach der Bekanntmachung der Eintragung zu diesem Zweck bei ihm melden."
    },
    {
      "date": "2026-01-06",
      "id": "141570",
      "original_text": "Sonstige Registerbekanntmachung\nBayern Amtsgericht München HRB 132162\nSana Einkauf & Logistik GmbH – Ismaning",
      "type": "Sonstige Registerbekanntmachung",
      "state": "Bayern",
      "amtsgericht": "Amtsgericht München",
      "registernummer": "HRB 132162",
      "registerart": "HRB",
      "company_name": "Sana Einkauf & Logistik GmbH",
      "company_seat": "Ismaning",
      "details": "06.01.2026 (Bekanntmachungsdatum)\n\nBayern Amtsgericht München HRB 132162\nSonstige Registerbekanntmachung 05.01.2026 (Eintragungsdatum)\n\nSana Einkauf & Logistik GmbH\nGesellschaft mit beschränkter Haftung\nIsmaning\n\nDen Gläubigern der Gesellschaft, deren Forderungen begründet worden sind, bevor die Eintragung der Beendigung des Gewinnabführungsvertrages in das Handelsregister nach § 10 des Handelsgesetzbuches als bekanntgemacht gilt, hat der andere Vertragsteil Sicherheit zu leisten, wenn sie sich binnen sechs Monaten nach der Bekanntmachung der Eintragung zu diesem Zweck bei ihm melden."
    },
    {
      "date": "2026-01-06",
      "id": "141571",
      "original_text": "Sonstige Registerbekanntmachung\nBayern Amtsgericht München HRB 169930\nKordes & Kordes Film Süd GmbH – München",
      "type": "Sonstige Registerbekanntmachung",
      "state": "Bayern",
      "amtsgericht": "Amtsgericht München",
      "registernummer": "HRB 169930",
      "registerart": "HRB",
      "company_name": "Kordes & Kordes Film Süd GmbH",
      "company_seat": "München",
      "details": "06.01.2026 (Bekanntmachungsdatum)\n\nBayern Amtsgericht München HRB 169930\nSonstige Registerbekanntmachung 05.01.2026 (Eintragungsdatum)\n\nKordes & Kordes Film Süd GmbH\nGesellschaft mit beschränkter Haftung\nMünchen\n\nDen Gläubigern der Gesellschaft, deren Forderungen begründet worden sind, bevor die Eintragung der Beendigung des Beherrschungs- und Gewinnabführungsvertrages in das Handelsregister nach § 10 des Handelsgesetzbuches als bekanntgemacht gilt, hat der andere Vertragsteil Sicherheit zu leisten, wenn sie sich binnen sechs Monaten nach der Bekanntmachung der Eintragung zu diesem Zweck bei ihm melden."
    },
    {
      "date": "2026-01-06",
      "id": "141572",
      "original_text": "Registerbekanntmachung nach dem Umwandlungsgesetz\nBayern Amtsgericht München HRB 308396\nDie Energieoptimierer GmbH – Garmisch-Partenkirchen",
      "type": "Registerbekanntmachung nach dem Umwandlungsgesetz",
      "state": "Bayern",
      "amtsgericht": "Amtsgericht München",
      "registernummer": "HRB 308396",
      "registerart": "HRB",
      "company_name": "Die Energieoptimierer GmbH",
      "company_seat": "Garmisch-Partenkirchen",
      "details": "06.01.2026 (Bekanntmachungsdatum)\n\nBayern Amtsgericht München HRB 308396\nRegisterbekanntmachung nach dem Umwandlungsgesetz 05.01.2026 (Eintragungsdatum)\n\nDie Energieoptimierer GmbH\nGesellschaft mit beschränkter Haftung\nGarmisch-Partenkirchen\n\nDen Gläubigern der an der Ausgliederung beteiligten Rechtsträger ist, wenn sie binnen sechs Monaten nach dem Tag, an dem die Eintragung der Ausgliederung in das Register des Sitzes desjenigen Rechtsträgers, dessen Gläubiger sie sind, nach §§ 125, 19 Abs. 3 UmwG als bekannt gemacht gilt, ihren Anspruch nach Grund und Höhe in Textform anmelden, Sicherheit zu leisten, soweit sie nicht Befriedigung verlangen können. Dieses Recht steht den Gläubigern jedoch nur zu, wenn sie glaubhaft machen, dass durch die Ausgliederung die Erfüllung ihrer Forderung gefährdet wird."
    },
    {
      "date": "2026-01-06",
      "id": "141573",
      "original_text": "Einreichung neuer Dokumente\nBayern Amtsgericht Memmingen HRB 11809\nGSI Gebäudeservice und Immobilienverwaltung Neu-Ulm GmbH – Neu-Ulm",
      "type": "Einreichung neuer Dokumente",
      "state": "Bayern",
      "amtsgericht": "Amtsgericht Memmingen",
      "registernummer": "HRB 11809",
      "registerart": "HRB",
      "company_name": "GSI Gebäudeservice und Immobilienverwaltung Neu-Ulm GmbH",
      "company_seat": "Neu-Ulm",
      "details": "06.01.2026 (Bekanntmachungsdatum)\n\nBayern Amtsgericht Memmingen HRB 11809\nEinreichung neuer Dokumente\n\nGSI Gebäudeservice und Immobilienverwaltung Neu-Ulm GmbH\nGesellschaft mit beschränkter Haftung\nNeu-Ulm\n\nDem Amtsgericht Memmingen -Registergericht- ist eine Liste der Mitglieder des Aufsichtsrats eingereicht worden, § 52 Abs. 3 S. 2 GmbHG."
    },
    {
      "date": "2026-01-06",
      "id": "141574",
      "original_text": "Registerbekanntmachung nach dem Umwandlungsgesetz\nBayern Amtsgericht München HRB 177088\nNPI AG – Gilching",
      "type": "Registerbekanntmachung nach dem Umwandlungsgesetz",
      "state": "Bayern",
      "amtsgericht": "Amtsgericht München",
      "registernummer": "HRB 177088",
      "registerart": "HRB",
      "company_name": "NPI AG",
      "company_seat": "Gilching",
      "details": "06.01.2026 (Bekanntmachungsdatum)\n\nBayern Amtsgericht München HRB 177088\nRegisterbekanntmachung nach dem Umwandlungsgesetz 05.01.2026 (Eintragungsdatum)\n\nNPI AG\nAktiengesellschaft\nGilching\n\nDen Gläubigern des formwechselnden Rechtsträgers ist, wenn sie binnen sechs Monaten nach dem Tag, an dem die Eintragung des Formwechsels nach § 201 UmwG als bekannt gemacht gilt, ihren Anspruch nach Grund und Höhe in Textform anmelden, Sicherheit zu leisten, soweit sie nicht Befriedigung verlangen können. Dieses Recht steht den Gläubigern jedoch nur zu, wenn sie glaubhaft machen, dass durch den Formwechsel die Erfüllung ihrer Forderung gefährdet wird."
    },
    {
      "date": "2026-01-06",
      "id": "141575",
      "original_text": "Einreichung neuer Dokumente\nBayern Amtsgericht München HRB 178614\nJoblinge gemeinnützige AG München – München",
      "type": "Einreichung neuer Dokumente",
      "state": "Bayern",
      "amtsgericht": "Amtsgericht München",
      "registernummer": "HRB 178614",
      "registerart": "HRB",
      "company_name": "Joblinge gemeinnützige AG München",
      "company_seat": "München",
      "details": "06.01.2026 (Bekanntmachungsdatum)\n\nBayern Amtsgericht München HRB 178614\nEinreichung neuer Dokumente\n\nJoblinge gemeinnützige AG München\nAktiengesellschaft\nMünchen\n\nDem Amtsgericht München -Registergericht- ist eine Liste der Mitglieder des Aufsichtsrats eingereicht worden, § 106 AktG."
    },
    {
      "date": "2026-01-06",
      "id": "141576",
      "original_text": "Einreichung neuer Dokumente\nBayern Amtsgericht Fürth HRB 393\nArbeitsgemeinschaft Fürther Baugenossenschaften Gesellschaft mit beschränkter Haftung – Fürth",
      "type": "Einreichung neuer Dokumente",
      "state": "Bayern",
      "amtsgericht": "Amtsgericht Fürth",
      "registernummer": "HRB 393",
      "registerart": "HRB",
      "company_name": "Arbeitsgemeinschaft Fürther Baugenossenschaften Gesellschaft mit beschränkter Haftung",
      "company_seat": "Fürth",
      "details": "06.01.2026 (Bekanntmachungsdatum)\n\nBayern Amtsgericht Fürth HRB 393\nEinreichung neuer Dokumente\n\nArbeitsgemeinschaft Fürther Baugenossenschaften Gesellschaft mit beschränkter Haftung\nGesellschaft mit beschränkter Haftung\nFürth\n\nDem Amtsgericht Fürth -Registergericht- ist eine Liste der Mitglieder des Aufsichtsrats eingereicht worden, § 52 Abs. 3 S. 2 GmbHG."
    },
    {
      "date": "2026-01-06",
      "id": "141577",
      "original_text": "Sonstige Registerbekanntmachung\nBayern Amtsgericht München HRB 179593\nRidler Höfe GmbH – München",
      "type": "Sonstige Registerbekanntmachung",
      "state": "Bayern",
      "amtsgericht": "Amtsgericht München",
      "registernummer": "HRB 179593",
      "registerart": "HRB",
      "company_name": "Ridler Höfe GmbH",
      "company_seat": "München",
      "details": "06.01.2026 (Bekanntmachungsdatum)\n\nBayern Amtsgericht München HRB 179593\nSonstige Registerbekanntmachung 05.01.2026 (Eintragungsdatum)\n\nRidler Höfe GmbH\nGesellschaft mit beschränkter Haftung\nMünchen\n\nDen Gläubigern der Gesellschaft, deren Forderungen begründet worden sind, bevor die Eintragung der Beendigung des Gewinnabführungsvertrages in das Handelsregister nach § 10 des Handelsgesetzbuches als bekanntgemacht gilt, hat der andere Vertragsteil Sicherheit zu leisten, wenn sie sich binnen sechs Monaten nach der Bekanntmachung der Eintragung zu diesem Zweck bei ihm melden."
    },
    {
      "date": "2026-01-06",
      "id": "141578",
      "original_text": "Registerbekanntmachung nach dem Umwandlungsgesetz\nBayern Amtsgericht München HRB 226399\nPHÖNIX-Seniorenzentrum Am Muppberg GmbH – München",
      "type": "Registerbekanntmachung nach dem Umwandlungsgesetz",
      "state": "Bayern",
      "amtsgericht": "Amtsgericht München",
      "registernummer": "HRB 226399",
      "registerart": "HRB",
      "company_name": "PHÖNIX-Seniorenzentrum Am Muppberg GmbH",
      "company_seat": "München",
      "details": "06.01.2026 (Bekanntmachungsdatum)\n\nBayern Amtsgericht München HRB 226399\nRegisterbekanntmachung nach dem Umwandlungsgesetz 05.01.2026 (Eintragungsdatum)\n\nPHÖNIX-Seniorenzentrum Am Muppberg GmbH\nGesellschaft mit beschränkter Haftung\nMünchen\n\nDen Gläubigern der an der Verschmelzung beteiligten Rechtsträger ist, wenn sie binnen sechs Monaten nach dem Tag, an dem die Eintragung der Verschmelzung in das Register des Sitzes desjenigen Rechtsträgers, dessen Gläubiger sie sind, nach § 19 Abs. 3 UmwG als bekannt gemacht gilt, ihren Anspruch nach Grund und Höhe in Textform anmelden, Sicherheit zu leisten, soweit sie nicht Befriedigung verlangen können. Dieses Recht steht den Gläubigern jedoch nur zu, wenn sie glaubhaft machen, dass durch die Verschmelzung die Erfüllung ihrer Forderung gefährdet wird."
    },
    {
      "date": "2026-01-06",
      "id": "141579",
      "original_text": "Sonstige Registerbekanntmachung\nBayern Amtsgericht München HRB 163709\nWeißbierbrauerei Hopf GmbH – Miesbach",
      "type": "Sonstige Registerbekanntmachung",
      "state": "Bayern",
      "amtsgericht": "Amtsgericht München",
      "registernummer": "HRB 163709",
      "registerart": "HRB",
      "company_name": "Weißbierbrauerei Hopf GmbH",
      "company_seat": "Miesbach",
      "details": "06.01.2026 (Bekanntmachungsdatum)\n\nBayern Amtsgericht München HRB 163709\nSonstige Registerbekanntmachung 05.01.2026 (Eintragungsdatum)\n\nWeißbierbrauerei Hopf GmbH\nGesellschaft mit beschränkter Haftung\nMiesbach\n\nDen Gläubigern der Gesellschaft, deren Forderungen begründet worden sind, bevor die Eintragung der Beendigung des Beherrschungs- und Gewinnabführungsvertrages in das Handelsregister nach § 10 des Handelsgesetzbuches als bekanntgemacht gilt, hat der andere Vertragsteil Sicherheit zu leisten, wenn sie sich binnen sechs Monaten nach der Bekanntmachung der Eintragung zu diesem Zweck bei ihm melden."
    },
    {
      "date": "2026-01-06",
      "id": "141580",
      "original_text": "Einreichung neuer Dokumente\nBayern Amtsgericht München HRB 279210\nAllgeier Public SE – München",
      "type": "Einreichung neuer Dokumente",
      "state": "Bayern",
      "amtsgericht": "Amtsgericht München",
      "registernummer": "HRB 279210",
      "registerart": "HRB",
      "company_name": "Allgeier Public SE",
      "company_seat": "München",
      "details": "06.01.2026 (Bekanntmachungsdatum)\n\nBayern Amtsgericht München HRB 279210\nEinreichung neuer Dokumente\n\nAllgeier Public SE\nEuropäische Aktiengesellschaft (SE)\nMünchen\n\nDem Amtsgericht München -Registergericht- ist eine Liste der Mitglieder des Aufsichtsrats eingereicht worden, Art. 9 Abs. 1 Buchst. c (ii) SE-VO i.V.m. § 106 AktG."
    },
    {
      "date": "2026-01-06",
      "id": "141581",
      "original_text": "Einreichung neuer Dokumente\nBayern Amtsgericht München HRB 243416\nVVO Haberger AG – München",
      "type": "Einreichung neuer Dokumente",
      "state": "Bayern",
      "amtsgericht": "Amtsgericht München",
      "registernummer": "HRB 243416",
      "registerart": "HRB",
      "company_name": "VVO Haberger AG",
      "company_seat": "München",
      "details": "06.01.2026 (Bekanntmachungsdatum)\n\nBayern Amtsgericht München HRB 243416\nEinreichung neuer Dokumente\n\nVVO Haberger AG\nAktiengesellschaft\nMünchen\n\nDem Amtsgericht München -Registergericht- ist eine Liste der Mitglieder des Aufsichtsrats eingereicht worden, § 106 AktG."
    },
    {
      "date": "2026-01-06",
      "id": "141582",
      "original_text": "Registerbekanntmachung nach dem Umwandlungsgesetz\nBayern Amtsgericht München HRB 263884\nENKRAFT CAPITAL SQUARE GmbH – Unterhaching",
      "type": "Registerbekanntmachung nach dem Umwandlungsgesetz",
      "state": "Bayern",
      "amtsgericht": "Amtsgericht München",
      "registernummer": "HRB 263884",
      "registerart": "HRB",
      "company_name": "ENKRAFT CAPITAL SQUARE GmbH",
      "company_seat": "Unterhaching",
      "details": "06.01.2026 (Bekanntmachungsdatum)\n\nBayern Amtsgericht München HRB 263884\nRegisterbekanntmachung nach dem Umwandlungsgesetz 05.01.2026 (Eintragungsdatum)\n\nENKRAFT CAPITAL SQUARE GmbH\nGesellschaft mit beschränkter Haftung\nUnterhaching\n\nDen Gläubigern der an der Verschmelzung beteiligten Rechtsträger ist, wenn sie binnen sechs Monaten nach dem Tag, an dem die Eintragung der Verschmelzung in das Register des Sitzes desjenigen Rechtsträgers, dessen Gläubiger sie sind, nach § 19 Abs. 3 UmwG als bekannt gemacht gilt, ihren Anspruch nach Grund und Höhe in Textform anmelden, Sicherheit zu leisten, soweit sie nicht Befriedigung verlangen können. Dieses Recht steht den Gläubigern jedoch nur zu, wenn sie glaubhaft machen, dass durch die Verschmelzung die Erfüllung ihrer Forderung gefährdet wird."
    },
    {
      "date": "2026-01-06",
      "id": "141583",
      "original_text": "Registerbekanntmachung nach dem Umwandlungsgesetz\nBayern Amtsgericht Fürth HRB 19061\nTrionity GmbH – Fürth",
      "type": "Registerbekanntmachung nach dem Umwandlungsgesetz",
      "state": "Bayern",
      "amtsgericht": "Amtsgericht Fürth",
      "registernummer": "HRB 19061",
      "registerart": "HRB",
      "company_name": "Trionity GmbH",
      "company_seat": "Fürth",
      "details": "06.01.2026 (Bekanntmachungsdatum)\n\nBayern Amtsgericht Fürth HRB 19061\nRegisterbekanntmachung nach dem Umwandlungsgesetz 05.01.2026 (Eintragungsdatum)\n\nTrionity GmbH\nGesellschaft mit beschränkter Haftung\nFürth\n\nDen Gläubigern der an der Verschmelzung beteiligten Rechtsträger ist, wenn sie binnen sechs Monaten nach dem Tag, an dem die Eintragung der Verschmelzung in das Register des Sitzes desjenigen Rechtsträgers, dessen Gläubiger sie sind, nach § 19 Abs. 3 UmwG als bekannt gemacht gilt, ihren Anspruch nach Grund und Höhe in Textform anmelden, Sicherheit zu leisten, soweit sie nicht Befriedigung verlangen können. Dieses Recht steht den Gläubigern jedoch nur zu, wenn sie glaubhaft machen, dass durch die Verschmelzung die Erfüllung ihrer Forderung gefährdet wird."
    },
    {
      "date": "2026-01-06",
      "id": "141584",
      "original_text": "Löschungsankündigung\nBerlin Amtsgericht Berlin (Charlottenburg) HRB 248309\nEGP Treuenbrietzen GmbH – Berlin",
      "type": "Löschungsankündigung",
      "state": "Berlin",
      "amtsgericht": "Amtsgericht Berlin (Charlottenburg)",
      "registernummer": "HRB 248309",
      "registerart": "HRB",
      "company_name": "EGP Treuenbrietzen GmbH",
      "company_seat": "Berlin",
      "details": "06.01.2026 (Bekanntmachungsdatum)\n\nBerlin Amtsgericht Berlin (Charlottenburg) HRB 248309\nLöschungsankündigung\n\nEGP Treuenbrietzen GmbH\nGesellschaft mit beschränkter Haftung\nBerlin\n\nBei der nachstehenden Gesellschaft wird das Amtslöschungsverfahren gemäß § 394 FamFG eingeleitet. Widerspruchsfrist 6 Wochen"
    },
    {
      "date": "2026-01-06",
      "id": "141585",
      "original_text": "Löschungsankündigung\nBerlin Amtsgericht Berlin (Charlottenburg) HRB 214166\nER-DO Bau GmbH – Berlin",
      "type": "Löschungsankündigung",
      "state": "Berlin",
      "amtsgericht": "Amtsgericht Berlin (Charlottenburg)",
      "registernummer": "HRB 214166",
      "registerart": "HRB",
      "company_name": "ER-DO Bau GmbH",
      "company_seat": "Berlin",
      "details": "06.01.2026 (Bekanntmachungsdatum)\n\nBerlin Amtsgericht Berlin (Charlottenburg) HRB 214166\nLöschungsankündigung\n\nER-DO Bau GmbH\nGesellschaft mit beschränkter Haftung\nBerlin\n\nBei der nachstehenden Gesellschaft wird das Amtslöschungsverfahren gemäß § 394 FamFG eingeleitet. Widerspruchsfrist 6 Wochen"
    },
    {
      "date": "2026-01-06",
      "id": "141586",
      "original_text": "Löschungsankündigung\nSchleswig-Holstein Amtsgericht Flensburg HRB 13481\nCrossCon Pilot GmbH – Flensburg",
      "type": "Löschungsankündigung",
      "state": "Schleswig-Holstein",
      "amtsgericht": "Amtsgericht Flensburg",
      "registernummer": "HRB 13481",
      "registerart": "HRB",
      "company_name": "CrossCon Pilot GmbH",
      "company_seat": "Flensburg",
      "details": "06.01.2026 (Bekanntmachungsdatum)\n\nSchleswig-Holstein Amtsgericht Flensburg HRB 13481\nLöschungsankündigung\n\nCrossCon Pilot GmbH\nGesellschaft mit beschränkter Haftung\nFlensburg\n\nEs ist die Löschung der nachstehenden Gesellschaft wegen Vermögenslosigkeit gemäß § 394 FamFG beabsichtigt.\nWiderspruchsfrist: 2 Monate."
    },
    {
      "date": "2026-01-06",
      "id": "141587",
      "original_text": "Registerbekanntmachung nach dem Umwandlungsgesetz\nHamburg Amtsgericht Hamburg HRB 173404\nCassio I Management GmbH – Hamburg",
      "type": "Registerbekanntmachung nach dem Umwandlungsgesetz",
      "state": "Hamburg",
      "amtsgericht": "Amtsgericht Hamburg",
      "registernummer": "HRB 173404",
      "registerart": "HRB",
      "company_name": "Cassio I Management GmbH",
      "company_seat": "Hamburg",
      "details": "06.01.2026 (Bekanntmachungsdatum)\n\nHamburg Amtsgericht Hamburg HRB 173404\nRegisterbekanntmachung nach dem Umwandlungsgesetz 06.01.2026 (Eintragungsdatum)\n\nCassio I Management GmbH\nGesellschaft mit beschränkter Haftung\nHamburg\n\nAls nicht eingetragen wird bekannt gemacht:\nDen Gläubigern der an der Verschmelzung beteiligten Gesellschaften ist, wenn sie binnen sechs Monaten nach dem Tag, an dem die Eintragung der Verschmelzung in das Register des Sitzes desjenigen Rechtsträgers, dessen Gläubiger sie sind, nach § 19 Absatz 3 UmwG als bekannt gemacht gilt, ihren Anspruch nach Grund und Höhe schriftlich anmelden, Sicherheit zu leisten, soweit sie nicht Befriedigung verlangen können. Dieses Recht steht den Gläubigern jedoch nur zu, wenn sie glaubhaft machen, dass durch die Verschmelzung die Erfüllung ihrer Forderung gefährdet wird."
    },
    {
      "date": "2026-01-06",
      "id": "141588",
      "original_text": "Registerbekanntmachung nach dem Umwandlungsgesetz\nHamburg Amtsgericht Hamburg GnR 1192\nmareverlag eG – Hamburg",
      "type": "Registerbekanntmachung nach dem Umwandlungsgesetz",
      "state": "Hamburg",
      "amtsgericht": "Amtsgericht Hamburg",
      "registernummer": "GnR 1192",
      "registerart": "GnR",
      "company_name": "mareverlag eG",
      "company_seat": "Hamburg",
      "details": "06.01.2026 (Bekanntmachungsdatum)\n\nHamburg Amtsgericht Hamburg GnR 1192\nRegisterbekanntmachung nach dem Umwandlungsgesetz 02.01.2026 (Eintragungsdatum)\n\nmareverlag eG\neingetragene Genossenschaft\nHamburg\n\nAls nicht eingetragen wird bekannt gemacht:\nDen Gläubigern der an der formwechselnden Umwandlung beteiligten Gesellschaften ist, wenn sie binnen sechs Monaten nach dem Tag, an dem die Eintragung der formwechselnden Umwandlung in das Register des Sitzes desjenigen Rechtsträgers, dessen Gläubiger sie sind, nach § 19 Absatz 3 UmwG als bekannt gemacht gilt, ihren Anspruch nach Grund und Höhe schriftlich anmelden, Sicherheit zu leisten, soweit sie nicht Befriedigung verlangen\nkönnen. Dieses Recht steht den Gläubigern jedoch nur zu, wenn sie glaubhaft machen, dass durch die formwechselnde Umwandlung die Erfüllung ihrer Forderung gefährdet wird."
    },
    {
      "date": "2026-01-06",
      "id": "141589",
      "original_text": "Löschungsankündigung\nSchleswig-Holstein Amtsgericht Lübeck HRB 19687\nFlixfilters GmbH – Stapelfeld",
      "type": "Löschungsankündigung",
      "state": "Schleswig-Holstein",
      "amtsgericht": "Amtsgericht Lübeck",
      "registernummer": "HRB 19687",
      "registerart": "HRB",
      "company_name": "Flixfilters GmbH",
      "company_seat": "Stapelfeld",
      "details": "06.01.2026 (Bekanntmachungsdatum)\n\nSchleswig-Holstein Amtsgericht Lübeck HRB 19687\nLöschungsankündigung\n\nFlixfilters GmbH\nGesellschaft mit beschränkter Haftung\nStapelfeld\n\nEs ist die Löschung der nachstehenden Gesellschaft wegen Vermögenslosigkeit gemäß § 394 FamFG beabsichtigt. Widerspruchsfrist: 1 Monat."
    },
    {
      "date": "2026-01-06",
      "id": "141590",
      "original_text": "Registerbekanntmachung nach dem Umwandlungsgesetz\nSchleswig-Holstein Amtsgericht Lübeck HRB 23861\nKauartikel.com GmbH – Göhl",
      "type": "Registerbekanntmachung nach dem Umwandlungsgesetz",
      "state": "Schleswig-Holstein",
      "amtsgericht": "Amtsgericht Lübeck",
      "registernummer": "HRB 23861",
      "registerart": "HRB",
      "company_name": "Kauartikel.com GmbH",
      "company_seat": "Göhl",
      "details": "06.01.2026 (Bekanntmachungsdatum)\n\nSchleswig-Holstein Amtsgericht Lübeck HRB 23861\nRegisterbekanntmachung nach dem Umwandlungsgesetz 05.01.2026 (Eintragungsdatum)\n\nKauartikel.com GmbH\nGesellschaft mit beschränkter Haftung\nGöhl\n\nZu Eintragungsnummer 4 vom 05.01.2026 wird als nicht eingetragen veröffentlicht:  Als nicht eingetragen wird veröffentlicht: Den Gläubigern der an der Verschmelzung beteiligten Rechtsträger ist, wenn sie binnen sechs Monaten nach dem Tag, an dem die Eintragung der Verschmelzung in das Register des Sitzes desjenigen Rechtsträgers, dessen Gläubiger sie sind, als bekannt gemacht gilt, ihren Anspruch nach Grund und Höhe schriftlich anmelden, Sicherheit zu leisten, soweit sie nicht Befriedigung verlangen können. Dieses Recht steht den Gläubigern jedoch nur zu, wenn sie glaubhaft machen, dass durch die Verschmelzung die Erfüllung ihrer Forderung gefährdet wird."
    },
    {
      "date": "2026-01-06",
      "id": "141591",
      "original_text": "Einreichung neuer Dokumente\nBerlin Amtsgericht Berlin (Charlottenburg) HRB 33600\nDB Services GmbH – Berlin",
      "type": "Einreichung neuer Dokumente",
      "state": "Berlin",
      "amtsgericht": "Amtsgericht Berlin (Charlottenburg)",
      "registernummer": "HRB 33600",
      "registerart": "HRB",
      "company_name": "DB Services GmbH",
      "company_seat": "Berlin",
      "details": "06.01.2026 (Bekanntmachungsdatum)\n\nBerlin Amtsgericht Berlin (Charlottenburg) HRB 33600\nEinreichung neuer Dokumente\n\nDB Services GmbH\nGesellschaft mit beschränkter Haftung\nBerlin\n\nAls nicht eingetragen wird veröffentlicht: Es wurde eine neue Liste der Aufsichtsratsmitglieder eingereicht (§52 GmbHG)."
    },
    {
      "date": "2026-01-06",
      "id": "141592",
      "original_text": "Sonstige Registerbekanntmachung\nBrandenburg Amtsgericht Potsdam HRB 23225\nPAM International GmbH – Potsdam",
      "type": "Sonstige Registerbekanntmachung",
      "state": "Brandenburg",
      "amtsgericht": "Amtsgericht Potsdam",
      "registernummer": "HRB 23225",
      "registerart": "HRB",
      "company_name": "PAM International GmbH",
      "company_seat": "Potsdam",
      "details": "06.01.2026 (Bekanntmachungsdatum)\n\nBrandenburg Amtsgericht Potsdam HRB 23225\nSonstige Registerbekanntmachung\n\nPAM International GmbH\nGesellschaft mit beschränkter Haftung\nPotsdam\n\nAls nicht eingetragen wird veröffentlicht: Gläubigern, deren Forderungen begründet worden sind, bevor die Eintragung des Beschlusses als nach § 10 des Handelsgesetzbuches bekannt gemacht gilt, ist, wenn sie sich binnen sechs Monaten nach der Bekanntmachung zu diesem Zweck melden, Sicherheit zu leisten, soweit sie nicht Befriedigung verlangen können."
    },
    {
      "date": "2026-01-06",
      "id": "141593",
      "original_text": "Löschungsankündigung\nBrandenburg Amtsgericht Potsdam HRB 31414\nInnotech Holding GmbH – Zossen",
      "type": "Löschungsankündigung",
      "state": "Brandenburg",
      "amtsgericht": "Amtsgericht Potsdam",
      "registernummer": "HRB 31414",
      "registerart": "HRB",
      "company_name": "Innotech Holding GmbH",
      "company_seat": "Zossen",
      "details": "06.01.2026 (Bekanntmachungsdatum)\n\nBrandenburg Amtsgericht Potsdam HRB 31414\nLöschungsankündigung\n\nInnotech Holding GmbH\nGesellschaft mit beschränkter Haftung\nZossen\n\nBei der nachstehenden Gesellschaft wird das Amtslöschungsverfahren gemäß § 394 FamFG eingeleitet. Widerspruchsfrist 8 Wochen."
    },
    {
      "date": "2026-01-06",
      "id": "141594",
      "original_text": "Sonstige Registerbekanntmachung\nBerlin Amtsgericht Berlin (Charlottenburg) HRB 119482\nSEFE Mobility GmbH – Berlin",
      "type": "Sonstige Registerbekanntmachung",
      "state": "Berlin",
      "amtsgericht": "Amtsgericht Berlin (Charlottenburg)",
      "registernummer": "HRB 119482",
      "registerart": "HRB",
      "company_name": "SEFE Mobility GmbH",
      "company_seat": "Berlin",
      "details": "06.01.2026 (Bekanntmachungsdatum)\n\nBerlin Amtsgericht Berlin (Charlottenburg) HRB 119482\nSonstige Registerbekanntmachung\n\nSEFE Mobility GmbH\nGesellschaft mit beschränkter Haftung\nBerlin\n\nAls nicht eingetragen wird veröffentlicht:Der andere Vertragsteil hat den Gläubigern dieses Rechtsträgers, deren Forderungen begründet worden sind, bevor die Eintragung der Beendigung dieses Vertrages in das Handelsregister nach § 10 des Handelsgesetzbuches als bekannt gemacht gilt, Sicherheit zu leisten, wenn sie sich binnen sechs Monaten nach der Bekanntmachung der Eintragung zu diesem Zweck bei ihm melden. Dieses Recht steht den Gläubigern nicht zu, die im Fall des Insolvenzverfahrens ein Recht auf vorzugsweise Befriedigung aus der Deckungsmasse haben, die nach gesetzlicher Vorschrift zu ihrem Schutz errichtet und staatlich überwacht ist."
    },
    {
      "date": "2026-01-06",
      "id": "141595",
      "original_text": "Sonstige Registerbekanntmachung\nHamburg Amtsgericht Hamburg HRB 87959\nSIGNAL IDUNA Asset Management GmbH – Hamburg",
      "type": "Sonstige Registerbekanntmachung",
      "state": "Hamburg",
      "amtsgericht": "Amtsgericht Hamburg",
      "registernummer": "HRB 87959",
      "registerart": "HRB",
      "company_name": "SIGNAL IDUNA Asset Management GmbH",
      "company_seat": "Hamburg",
      "details": "06.01.2026 (Bekanntmachungsdatum)\n\nHamburg Amtsgericht Hamburg HRB 87959\nSonstige Registerbekanntmachung\n\nSIGNAL IDUNA Asset Management GmbH\nGesellschaft mit beschränkter Haftung\nHamburg\n\nAls nicht eingetragen wird bekannt gemacht: Liste des Aufsichtsrats wurde eingereicht."
    },
    {
      "date": "2026-01-06",
      "id": "141596",
      "original_text": "Löschungsankündigung\nBerlin Amtsgericht Berlin (Charlottenburg) HRB 255765\nKingz Play GmbH – Berlin",
      "type": "Löschungsankündigung",
      "state": "Berlin",
      "amtsgericht": "Amtsgericht Berlin (Charlottenburg)",
      "registernummer": "HRB 255765",
      "registerart": "HRB",
      "company_name": "Kingz Play GmbH",
      "company_seat": "Berlin",
      "details": "06.01.2026 (Bekanntmachungsdatum)\n\nBerlin Amtsgericht Berlin (Charlottenburg) HRB 255765\nLöschungsankündigung\n\nKingz Play GmbH\nGesellschaft mit beschränkter Haftung\nBerlin\n\nBei der nachstehenden Gesellschaft wird das Amtslöschungsverfahren gemäß § 394 FamFG eingeleitet. Widerspruchsfrist 6 Wochen"
    },
    {
      "date": "2026-01-06",
      "id": "141597",
      "original_text": "Sonstige Registerbekanntmachung\nBerlin Amtsgericht Berlin (Charlottenburg) HRB 37586\nCeCon Computer Systems Handelsgesellschaft mbH – Berlin",
      "type": "Sonstige Registerbekanntmachung",
      "state": "Berlin",
      "amtsgericht": "Amtsgericht Berlin (Charlottenburg)",
      "registernummer": "HRB 37586",
      "registerart": "HRB",
      "company_name": "CeCon Computer Systems Handelsgesellschaft mbH",
      "company_seat": "Berlin",
      "details": "06.01.2026 (Bekanntmachungsdatum)\n\nBerlin Amtsgericht Berlin (Charlottenburg) HRB 37586\nSonstige Registerbekanntmachung\n\nCeCon Computer Systems Handelsgesellschaft mbH\nGesellschaft mit beschränkter Haftung\nBerlin\n\nAls nicht eingetragen wird veröffentlicht: Den Gläubigern der an der Spaltung beteiligten Rechtsträger ist, wenn sie binnen sechs Monaten nach dem Tag, an dem die Eintragung der Spaltung in das Register des Sitzes desjenigen Rechtsträgers, dessen Gläubiger sie sind, als bekannt gemacht gilt, ihren Anspruch nach Grund und Höhe schriftlich anmelden, Sicherheit zu leisten, soweit sie nicht Befriedigung verlangen können. Dieses Recht steht den Gläubigern jedoch nur zu, wenn sie glaubhaft machen, dass durch die Spaltung die Erfüllung ihrer Forderung gefährdet wird. Das Recht, Sicherheitsleistung zu verlangen, steht Gläubigern nicht zu, die im Falle der Insolvenz ein Recht auf vorzugsweise Befriedigung aus einer Deckungsmasse haben, die nach gesetzlicher Vorschrift zu ihrem Schutz errichtet und staatlich überwacht ist."
    },
    {
      "date": "2026-01-06",
      "id": "141598",
      "original_text": "Löschungsankündigung\nBerlin Amtsgericht Berlin (Charlottenburg) HRB 199149\nZeh-To UG (haftungsbeschränkt) – Berlin",
      "type": "Löschungsankündigung",
      "state": "Berlin",
      "amtsgericht": "Amtsgericht Berlin (Charlottenburg)",
      "registernummer": "HRB 199149",
      "registerart": "HRB",
      "company_name": "Zeh-To UG (haftungsbeschränkt)",
      "company_seat": "Berlin",
      "details": "06.01.2026 (Bekanntmachungsdatum)\n\nBerlin Amtsgericht Berlin (Charlottenburg) HRB 199149\nLöschungsankündigung\n\nZeh-To UG (haftungsbeschränkt)\nGesellschaft mit beschränkter Haftung\nBerlin\n\nBei der nachstehenden Gesellschaft wird das Amtslöschungsverfahren gemäß § 394 FamFG eingeleitet. Widerspruchsfrist 6 Wochen"
    },
    {
      "date": "2026-01-06",
      "id": "141599",
      "original_text": "Sonstige Registerbekanntmachung\nBerlin Amtsgericht Berlin (Charlottenburg) HRB 282604\nQSR TECH GmbH – Berlin",
      "type": "Sonstige Registerbekanntmachung",
      "state": "Berlin",
      "amtsgericht": "Amtsgericht Berlin (Charlottenburg)",
      "registernummer": "HRB 282604",
      "registerart": "HRB",
      "company_name": "QSR TECH GmbH",
      "company_seat": "Berlin",
      "details": "06.01.2026 (Bekanntmachungsdatum)\n\nBerlin Amtsgericht Berlin (Charlottenburg) HRB 282604\nSonstige Registerbekanntmachung\n\nQSR TECH GmbH\nGesellschaft mit beschränkter Haftung\nBerlin\n\nAls nicht eingetragen wird veröffentlicht: Den Gläubigern der an der Spaltung beteiligten Rechtsträger ist, wenn sie binnen sechs Monaten nach dem Tag, an dem die Eintragung der Spaltung in das Register des Sitzes desjenigen Rechtsträgers, dessen Gläubiger sie sind, als bekannt gemacht gilt, ihren Anspruch nach Grund und Höhe schriftlich anmelden, Sicherheit zu leisten, soweit sie nicht Befriedigung verlangen können. Dieses Recht steht den Gläubigern jedoch nur zu, wenn sie glaubhaft machen, dass durch die Spaltung die Erfüllung ihrer Forderung gefährdet wird. Das Recht, Sicherheitsleistung zu verlangen, steht Gläubigern nicht zu, die im Falle der Insolvenz ein Recht auf vorzugsweise Befriedigung aus einer Deckungsmasse haben, die nach gesetzlicher Vorschrift zu ihrem Schutz errichtet und staatlich überwacht ist."
    },
    {
      "date": "2026-01-06",
      "id": "141600",
      "original_text": "Löschungsankündigung\nBerlin Amtsgericht Berlin (Charlottenburg) HRB 262670\nSchieren Logistik GmbH – Berlin",
      "type": "Löschungsankündigung",
      "state": "Berlin",
      "amtsgericht": "Amtsgericht Berlin (Charlottenburg)",
      "registernummer": "HRB 262670",
      "registerart": "HRB",
      "company_name": "Schieren Logistik GmbH",
      "company_seat": "Berlin",
      "details": "06.01.2026 (Bekanntmachungsdatum)\n\nBerlin Amtsgericht Berlin (Charlottenburg) HRB 262670\nLöschungsankündigung\n\nSchieren Logistik GmbH\nGesellschaft mit beschränkter Haftung\nBerlin\n\nBei der nachstehenden Gesellschaft wird das Amtslöschungsverfahren gemäß § 394 FamFG eingeleitet. Widerspruchsfrist 6 Wochen"
    },
    {
      "date": "2026-01-06",
      "id": "141601",
      "original_text": "Einreichung neuer Dokumente\nBerlin Amtsgericht Berlin (Charlottenburg) HRB 86659\nOSB International Consulting AG – Berlin",
      "type": "Einreichung neuer Dokumente",
      "state": "Berlin",
      "amtsgericht": "Amtsgericht Berlin (Charlottenburg)",
      "registernummer": "HRB 86659",
      "registerart": "HRB",
      "company_name": "OSB International Consulting AG",
      "company_seat": "Berlin",
      "details": "06.01.2026 (Bekanntmachungsdatum)\n\nBerlin Amtsgericht Berlin (Charlottenburg) HRB 86659\nEinreichung neuer Dokumente\n\nOSB International Consulting AG\nAktiengesellschaft\nBerlin\n\nAls nicht eingetragen wird veröffentlicht: Es wurde eine neue Liste der Aufsichtsratsmitglieder eingereicht (§ 106 AktG)."
    },
    {
      "date": "2026-01-06",
      "id": "141602",
      "original_text": "Sonstige Registerbekanntmachung\nSchleswig-Holstein Amtsgericht Lübeck HRB 6589\nKurt Pagel GmbH Elektroanlagen – Oststeinbek",
      "type": "Sonstige Registerbekanntmachung",
      "state": "Schleswig-Holstein",
      "amtsgericht": "Amtsgericht Lübeck",
      "registernummer": "HRB 6589",
      "registerart": "HRB",
      "company_name": "Kurt Pagel GmbH Elektroanlagen",
      "company_seat": "Oststeinbek",
      "details": "06.01.2026 (Bekanntmachungsdatum)\n\nSchleswig-Holstein Amtsgericht Lübeck HRB 6589\nSonstige Registerbekanntmachung 02.01.2026 (Eintragungsdatum)\n\nKurt Pagel GmbH Elektroanlagen\nGesellschaft mit beschränkter Haftung\nOststeinbek\n\nAls nicht eingetragen wird veröffentlicht: Als nicht eingetragen wird veröffentlicht: Gläubigern, deren Forderungen begründet worden sind, bevor die Eintragung des Beschlusses als nach § 10 des Handelsgesetzbuches bekannt gemacht gilt, ist, wenn sie sich binnen sechs Monaten nach der Bekanntmachung zu diesem Zweck melden, Sicherheit zu leisten, soweit sie nicht Befriedigung verlangen können. Dieses Recht steht den Gläubigern nicht zu, die im Fall des Insolvenzverfahrens ein Recht auf vorzugsweise Befriedigung aus der Deckungsmasse haben, die nach gesetzlicher Vorschrift zu ihrem Schutz errichtet und staatlich überwacht ist."
    },
    {
      "date": "2026-01-06",
      "id": "141603",
      "original_text": "Registerbekanntmachung nach dem Umwandlungsgesetz\nHamburg Amtsgericht Hamburg HRB 99245\nGünther Holding Immobilien Management GmbH – Hamburg",
      "type": "Registerbekanntmachung nach dem Umwandlungsgesetz",
      "state": "Hamburg",
      "amtsgericht": "Amtsgericht Hamburg",
      "registernummer": "HRB 99245",
      "registerart": "HRB",
      "company_name": "Günther Holding Immobilien Management GmbH",
      "company_seat": "Hamburg",
      "details": "06.01.2026 (Bekanntmachungsdatum)\n\nHamburg Amtsgericht Hamburg HRB 99245\nRegisterbekanntmachung nach dem Umwandlungsgesetz 06.01.2026 (Eintragungsdatum)\n\nGünther Holding Immobilien Management GmbH\nGesellschaft mit beschränkter Haftung\nHamburg\n\nAls nicht eingetragen wird bekannt gemacht:\nDen Gläubigern der an der Verschmelzung beteiligten Gesellschaften ist, wenn sie binnen sechs Monaten nach dem Tag, an dem die Eintragung der Verschmelzung in das Register des Sitzes desjenigen Rechtsträgers, dessen Gläubiger sie sind, nach § 19 Absatz 3 UmwG als bekannt gemacht gilt, ihren Anspruch nach Grund und Höhe schriftlich anmelden, Sicherheit zu leisten, soweit sie nicht Befriedigung verlangen können. Dieses Recht steht den Gläubigern jedoch nur zu, wenn sie glaubhaft machen, dass durch die Verschmelzung die Erfüllung ihrer Forderung gefährdet wird."
    },
    {
      "date": "2026-01-06",
      "id": "141604",
      "original_text": "Registerbekanntmachung nach dem Umwandlungsgesetz\nHamburg Amtsgericht Hamburg HRB 108883\nOrpheus Capital II Management GmbH – Hamburg",
      "type": "Registerbekanntmachung nach dem Umwandlungsgesetz",
      "state": "Hamburg",
      "amtsgericht": "Amtsgericht Hamburg",
      "registernummer": "HRB 108883",
      "registerart": "HRB",
      "company_name": "Orpheus Capital II Management GmbH",
      "company_seat": "Hamburg",
      "details": "06.01.2026 (Bekanntmachungsdatum)\n\nHamburg Amtsgericht Hamburg HRB 108883\nRegisterbekanntmachung nach dem Umwandlungsgesetz 06.01.2026 (Eintragungsdatum)\n\nOrpheus Capital II Management GmbH\nGesellschaft mit beschränkter Haftung\nHamburg\n\nAls nicht eingetragen wird bekannt gemacht:\nDen Gläubigern der an der Verschmelzung beteiligten Gesellschaften ist, wenn sie binnen sechs Monaten nach dem Tag, an dem die Eintragung der Verschmelzung in das Register des Sitzes derjenigen Rechtsträger deren Gläubiger sie sind, nach § 19 Absatz 3 UmwG als bekannt gemacht gilt, ihren Anspruch nach Grund und Höhe schriftlich anmelden, Sicherheit zu leisten, soweit sie nicht Befriedigung verlangen können. Dieses Recht steht den Gläubigern jedoch nur zu, wenn sie glaubhaft machen, dass durch die Verschmelzung die Erfüllung ihrer Forderung gefährdet wird."
    },
    {
      "date": "2026-01-06",
      "id": "141605",
      "original_text": "Einreichung neuer Dokumente\nBerlin Amtsgericht Berlin (Charlottenburg) HRB 84461\nKWB Kompetenzzentrum Wasser Berlin gemeinnützige GmbH – Berlin",
      "type": "Einreichung neuer Dokumente",
      "state": "Berlin",
      "amtsgericht": "Amtsgericht Berlin (Charlottenburg)",
      "registernummer": "HRB 84461",
      "registerart": "HRB",
      "company_name": "KWB Kompetenzzentrum Wasser Berlin gemeinnützige GmbH",
      "company_seat": "Berlin",
      "details": "06.01.2026 (Bekanntmachungsdatum)\n\nBerlin Amtsgericht Berlin (Charlottenburg) HRB 84461\nEinreichung neuer Dokumente\n\nKWB Kompetenzzentrum Wasser Berlin gemeinnützige GmbH\nGesellschaft mit beschränkter Haftung\nBerlin\n\nAls nicht eingetragen wird veröffentlicht: Es wurde eine neue Liste der Aufsichtsratsmitglieder eingereicht (§52 GmbHG)."
    },
    {
      "date": "2026-01-06",
      "id": "141606",
      "original_text": "Einreichung neuer Dokumente\nHamburg Amtsgericht Hamburg HRB 116851\nSTENNER AG – Hamburg",
      "type": "Einreichung neuer Dokumente",
      "state": "Hamburg",
      "amtsgericht": "Amtsgericht Hamburg",
      "registernummer": "HRB 116851",
      "registerart": "HRB",
      "company_name": "STENNER AG",
      "company_seat": "Hamburg",
      "details": "06.01.2026 (Bekanntmachungsdatum)\n\nHamburg Amtsgericht Hamburg HRB 116851\nEinreichung neuer Dokumente\n\nSTENNER AG\nAktiengesellschaft\nHamburg\n\nAls nicht eingetragen wird bekannt gemacht: Liste des Aufsichtsrats wurde eingereicht."
    },
    {
      "date": "2026-01-06",
      "id": "141607",
      "original_text": "Löschungsankündigung\nBerlin Amtsgericht Berlin (Charlottenburg) HRB 224649\nEffectful Recruitment Verwaltungs GmbH – Berlin",
      "type": "Löschungsankündigung",
      "state": "Berlin",
      "amtsgericht": "Amtsgericht Berlin (Charlottenburg)",
      "registernummer": "HRB 224649",
      "registerart": "HRB",
      "company_name": "Effectful Recruitment Verwaltungs GmbH",
      "company_seat": "Berlin",
      "details": "06.01.2026 (Bekanntmachungsdatum)\n\nBerlin Amtsgericht Berlin (Charlottenburg) HRB 224649\nLöschungsankündigung\n\nEffectful Recruitment Verwaltungs GmbH\nGesellschaft mit beschränkter Haftung\nBerlin\n\nBei der nachstehenden Gesellschaft wird das Amtslöschungsverfahren gemäß § 394 FamFG eingeleitet. Widerspruchsfrist 6 Wochen"
    },
    {
      "date": "2026-01-06",
      "id": "141608",
      "original_text": "Löschungsankündigung\nBerlin Amtsgericht Berlin (Charlottenburg) HRB 167663\nEuropean Business Company Berlin UG (haftungsbeschränkt) – Berlin",
      "type": "Löschungsankündigung",
      "state": "Berlin",
      "amtsgericht": "Amtsgericht Berlin (Charlottenburg)",
      "registernummer": "HRB 167663",
      "registerart": "HRB",
      "company_name": "European Business Company Berlin UG (haftungsbeschränkt)",
      "company_seat": "Berlin",
      "details": "06.01.2026 (Bekanntmachungsdatum)\n\nBerlin Amtsgericht Berlin (Charlottenburg) HRB 167663\nLöschungsankündigung\n\nEuropean Business Company Berlin UG (haftungsbeschränkt)\nGesellschaft mit beschränkter Haftung\nBerlin\n\nBei der nachstehenden Gesellschaft wird das Amtslöschungsverfahren gemäß § 394 FamFG eingeleitet. Widerspruchsfrist 6 Wochen"
    },
    {
      "date": "2026-01-06",
      "id": "141609",
      "original_text": "Einreichung neuer Dokumente\nBrandenburg Amtsgericht Potsdam HRB 36892\nEmperra AG – Potsdam",
      "type": "Einreichung neuer Dokumente",
      "state": "Brandenburg",
      "amtsgericht": "Amtsgericht Potsdam",
      "registernummer": "HRB 36892",
      "registerart": "HRB",
      "company_name": "Emperra AG",
      "company_seat": "Potsdam",
      "details": "06.01.2026 (Bekanntmachungsdatum)\n\nBrandenburg Amtsgericht Potsdam HRB 36892\nEinreichung neuer Dokumente\n\nEmperra AG\nAktiengesellschaft\nPotsdam\n\nAls nicht eingetragen wird veröffentlicht: Eine Liste der Mitglieder des Aufsichtsrates wurde zum Handelsregister eingereicht."
    },
    {
      "date": "2026-01-06",
      "id": "141610",
      "original_text": "Registerbekanntmachung nach dem Umwandlungsgesetz\nSchleswig-Holstein Amtsgericht Pinneberg HRB 13588\nLeo Beteiligungsgesellschaft mbH – Halstenbek",
      "type": "Registerbekanntmachung nach dem Umwandlungsgesetz",
      "state": "Schleswig-Holstein",
      "amtsgericht": "Amtsgericht Pinneberg",
      "registernummer": "HRB 13588",
      "registerart": "HRB",
      "company_name": "Leo Beteiligungsgesellschaft mbH",
      "company_seat": "Halstenbek",
      "details": "06.01.2026 (Bekanntmachungsdatum)\n\nSchleswig-Holstein Amtsgericht Pinneberg HRB 13588\nRegisterbekanntmachung nach dem Umwandlungsgesetz 02.01.2026 (Eintragungsdatum)\n\nLeo Beteiligungsgesellschaft mbH\nGesellschaft mit beschränkter Haftung\nHalstenbek\n\nZu Eintragungsnummer 4 vom 02.01.2026 wird als nicht eingetragen veröffentlicht:  Als nicht eingetragen wird veröffentlicht: Den Gläubigern der an der Verschmelzung beteiligten Rechtsträger ist, wenn sie binnen sechs Monaten nach dem Tag, an dem die Eintragung der Verschmelzung in das Register des Sitzes desjenigen Rechtsträgers, dessen Gläubiger sie sind, als bekannt gemacht gilt, ihren Anspruch nach Grund und Höhe schriftlich anmelden, Sicherheit zu leisten, soweit sie nicht Befriedigung verlangen können. Dieses Recht steht den Gläubigern jedoch nur zu, wenn sie glaubhaft machen, dass durch die Verschmelzung die Erfüllung ihrer Forderung gefährdet wird. Das Recht, Sicherheitsleistung zu verlangen, steht Gläubigern nicht zu, die im Falle der Insolvenz ein Recht auf vorzugsweise Befriedigung aus einer Deckungsmasse haben, die nach gesetzlicher Vorschrift zu ihrem Schutz errichtet und staatlich überwacht ist."
    },
    {
      "date": "2026-01-06",
      "id": "141611",
      "original_text": "Registerbekanntmachung nach dem Umwandlungsgesetz\nBerlin Amtsgericht Berlin (Charlottenburg) HRB 251147\nKaffee Maxim Am PotsdamerPl GmbH – Berlin",
      "type": "Registerbekanntmachung nach dem Umwandlungsgesetz",
      "state": "Berlin",
      "amtsgericht": "Amtsgericht Berlin (Charlottenburg)",
      "registernummer": "HRB 251147",
      "registerart": "HRB",
      "company_name": "Kaffee Maxim Am PotsdamerPl GmbH",
      "company_seat": "Berlin",
      "details": "06.01.2026 (Bekanntmachungsdatum)\n\nBerlin Amtsgericht Berlin (Charlottenburg) HRB 251147\nRegisterbekanntmachung nach dem Umwandlungsgesetz 05.01.2026 (Eintragungsdatum)\n\nKaffee Maxim Am PotsdamerPl GmbH\nGesellschaft mit beschränkter Haftung\nBerlin\n\nZu Eintragungsnummer 4 vom 05.01.2026 wird als nicht eingetragen veröffentlicht: Der andere Vertragsteil hat den Gläubigern dieses Rechtsträgers, deren Forderungen begründet worden sind, bevor die Eintragung der Beendigung dieses Vertrages in das Handelsregister nach § 10 des Handelsgesetzbuches als bekannt gemacht gilt, Sicherheit zu leisten, wenn sie sich binnen sechs Monaten nach der Bekanntmachung der Eintragung zu diesem Zweck bei ihm melden. Dieses Recht steht den Gläubigern nicht zu, die im Fall des Insolvenzverfahrens ein Recht auf vorzugsweise Befriedigung aus der Deckungsmasse haben, die nach gesetzlicher Vorschrift zu ihrem Schutz errichtet und staatlich überwacht ist."
    },
    {
      "date": "2026-01-06",
      "id": "141612",
      "original_text": "Registerbekanntmachung nach dem Umwandlungsgesetz\nHamburg Amtsgericht Hamburg HRB 161163\nNemo12 Verwaltungs GmbH – Hamburg",
      "type": "Registerbekanntmachung nach dem Umwandlungsgesetz",
      "state": "Hamburg",
      "amtsgericht": "Amtsgericht Hamburg",
      "registernummer": "HRB 161163",
      "registerart": "HRB",
      "company_name": "Nemo12 Verwaltungs GmbH",
      "company_seat": "Hamburg",
      "details": "06.01.2026 (Bekanntmachungsdatum)\n\nHamburg Amtsgericht Hamburg HRB 161163\nRegisterbekanntmachung nach dem Umwandlungsgesetz 06.01.2026 (Eintragungsdatum)\n\nNemo12 Verwaltungs GmbH\nGesellschaft mit beschränkter Haftung\nHamburg\n\nAls nicht eingetragen wird bekannt gemacht:\nDen Gläubigern der an der Verschmelzung beteiligten Gesellschaften ist, wenn sie binnen sechs Monaten nach dem Tag, an dem die Eintragung der Verschmelzung in das Register des Sitzes desjenigen Rechtsträgers, dessen Gläubiger sie sind, nach § 19 Absatz 3 UmwG als bekannt gemacht gilt, ihren Anspruch nach Grund und Höhe schriftlich anmelden, Sicherheit zu leisten, soweit sie nicht Befriedigung verlangen können. Dieses Recht steht den Gläubigern jedoch nur zu, wenn sie glaubhaft machen, dass durch die Verschmelzung die Erfüllung ihrer Forderung gefährdet wird."
    },
    {
      "date": "2026-01-06",
      "id": "141613",
      "original_text": "Registerbekanntmachung nach dem Umwandlungsgesetz\nHamburg Amtsgericht Hamburg HRB 177017\nVermögensverwaltungsgesellschaft Nemo 1 GmbH – Hamburg",
      "type": "Registerbekanntmachung nach dem Umwandlungsgesetz",
      "state": "Hamburg",
      "amtsgericht": "Amtsgericht Hamburg",
      "registernummer": "HRB 177017",
      "registerart": "HRB",
      "company_name": "Vermögensverwaltungsgesellschaft Nemo 1 GmbH",
      "company_seat": "Hamburg",
      "details": "06.01.2026 (Bekanntmachungsdatum)\n\nHamburg Amtsgericht Hamburg HRB 177017\nRegisterbekanntmachung nach dem Umwandlungsgesetz 06.01.2026 (Eintragungsdatum)\n\nVermögensverwaltungsgesellschaft Nemo 1 GmbH\nGesellschaft mit beschränkter Haftung\nHamburg\n\nAls nicht eingetragen wird bekannt gemacht:\nDen Gläubigern der an der Verschmelzung beteiligten Gesellschaften ist, wenn sie binnen sechs Monaten nach dem Tag, an dem die Eintragung der Verschmelzung in das Register des Sitzes desjenigen Rechtsträgers, dessen Gläubiger sie sind, nach § 19 Absatz 3 UmwG als bekannt gemacht gilt, ihren Anspruch nach Grund und Höhe schriftlich anmelden, Sicherheit zu leisten, soweit sie nicht Befriedigung verlangen können. Dieses Recht steht den Gläubigern jedoch nur zu, wenn sie glaubhaft machen, dass durch die Verschmelzung die Erfüllung ihrer Forderung gefährdet wird."
    },
    {
      "date": "2026-01-06",
      "id": "141614",
      "original_text": "Löschungsankündigung\nSachsen Amtsgericht Leipzig HRA 15188\nCosi e.K. – Machern",
      "type": "Löschungsankündigung",
      "state": "Sachsen",
      "amtsgericht": "Amtsgericht Leipzig",
      "registernummer": "HRA 15188",
      "registerart": "HRA",
      "company_name": "Cosi e.K.",
      "company_seat": "Machern",
      "details": "06.01.2026 (Bekanntmachungsdatum)\n\nSachsen Amtsgericht Leipzig HRA 15188\nLöschungsankündigung\n\nCosi e.K.\nEinzelkaufmann / Einzelkauffrau\nMachern\n\nDas Registergericht beabsichtigt, die im Handelsregister eingetragene Firma von Amts wegen nach § 31 Abs. 2 HGB, 393 FamFG zu löschen. Die Frist zur Erhebung eines Widerspruchs gegen die beabsichtigte Löschung wird auf einen Monat festgesetzt."
    },
    {
      "date": "2026-01-06",
      "id": "141615",
      "original_text": "Löschungsankündigung\nSachsen Amtsgericht Dresden HRB 30142\nSKM Holding GmbH – Boxberg O.L.",
      "type": "Löschungsankündigung",
      "state": "Sachsen",
      "amtsgericht": "Amtsgericht Dresden",
      "registernummer": "HRB 30142",
      "registerart": "HRB",
      "company_name": "SKM Holding GmbH",
      "company_seat": "Boxberg O.L.",
      "details": "06.01.2026 (Bekanntmachungsdatum)\n\nSachsen Amtsgericht Dresden HRB 30142\nLöschungsankündigung\n\nSKM Holding GmbH\nGesellschaft mit beschränkter Haftung\nBoxberg O.L.\n\nDas Registergericht beabsichtigt, die im Handelsregister eingetragene Gesellschaft von Amts wegen nach § 394 FamFG zu löschen. Die Frist zu Erhebung eines Widerspruchs gegen die beabsichtigte Löschung wird auf einen Monat festgesetzt."
    },
    {
      "date": "2026-01-06",
      "id": "141616",
      "original_text": "Registerbekanntmachung nach dem Umwandlungsgesetz\nSachsen Amtsgericht Leipzig HRB 8420\nGF Casting Solutions Leipzig GmbH – Leipzig",
      "type": "Registerbekanntmachung nach dem Umwandlungsgesetz",
      "state": "Sachsen",
      "amtsgericht": "Amtsgericht Leipzig",
      "registernummer": "HRB 8420",
      "registerart": "HRB",
      "company_name": "GF Casting Solutions Leipzig GmbH",
      "company_seat": "Leipzig",
      "details": "06.01.2026 (Bekanntmachungsdatum)\n\nSachsen Amtsgericht Leipzig HRB 8420\nRegisterbekanntmachung nach dem Umwandlungsgesetz 06.01.2026 (Eintragungsdatum)\n\nGF Casting Solutions Leipzig GmbH\nGesellschaft mit beschränkter Haftung\nLeipzig\n\nDen Gläubigern der Gesellschaft, deren Forderungen begründet worden sind bevor die Eintragung der Beendigung des Beherrschungs- und Gewinnabführungsvertrages in das Handelsregister nach § 10 des Handelsgesetzbuches als bekanntgemacht gilt, hat der andere Vertragsteil Sicherheit zu leisten, wenn sie sich binnen sechs Monaten nach der Bekanntmachung der Eintragung zu diesem Zweck bei ihm melden."
    },
    {
      "date": "2026-01-06",
      "id": "141617",
      "original_text": "Sonstige Registerbekanntmachung\nSachsen Amtsgericht Dresden HRB 4204\nhollomet Gesellschaft mit beschränkter Haftung – Dresden",
      "type": "Sonstige Registerbekanntmachung",
      "state": "Sachsen",
      "amtsgericht": "Amtsgericht Dresden",
      "registernummer": "HRB 4204",
      "registerart": "HRB",
      "company_name": "hollomet Gesellschaft mit beschränkter Haftung",
      "company_seat": "Dresden",
      "details": "06.01.2026 (Bekanntmachungsdatum)\n\nSachsen Amtsgericht Dresden HRB 4204\nSonstige Registerbekanntmachung 06.01.2026 (Eintragungsdatum)\n\nhollomet Gesellschaft mit beschränkter Haftung\nGesellschaft mit beschränkter Haftung\nDresden\n\nDen Gläubigern der Gesellschaft, deren Forderungen begründet worden sind bevor die Eintragung der Beendigung des Beherrschungs- und Gewinnabführungsvertrages in das Handelsregister nach § 10 des Handelsgesetzbuches als bekanntgemacht gilt, hat der andere Vertragsteil Sicherheit zu leisten, wenn sie sich binnen sechs Monaten nach der Bekanntmachung der Eintragung zu diesem Zweck bei ihm melden."
    },
    {
      "date": "2026-01-06",
      "id": "141618",
      "original_text": "Einreichung neuer Dokumente\nSachsen Amtsgericht Dresden HRB 19089\nWVS Wohnverwaltung und Service GmbH Coswig – Coswig",
      "type": "Einreichung neuer Dokumente",
      "state": "Sachsen",
      "amtsgericht": "Amtsgericht Dresden",
      "registernummer": "HRB 19089",
      "registerart": "HRB",
      "company_name": "WVS Wohnverwaltung und Service GmbH Coswig",
      "company_seat": "Coswig",
      "details": "06.01.2026 (Bekanntmachungsdatum)\n\nSachsen Amtsgericht Dresden HRB 19089\nEinreichung neuer Dokumente\n\nWVS Wohnverwaltung und Service GmbH Coswig\nGesellschaft mit beschränkter Haftung\nCoswig\n\nAm 05.01.2026 wurde beim Handelsregister des Amtsgerichts Dresden die Liste der Mitglieder des Aufsichtsrats gemäß § 52 GmbHG eingereicht."
    },
    {
      "date": "2026-01-06",
      "id": "141619",
      "original_text": "Sonstige Registerbekanntmachung\nSachsen Amtsgericht Leipzig HRB 20629\nCareart GmbH – Bad Lausick",
      "type": "Sonstige Registerbekanntmachung",
      "state": "Sachsen",
      "amtsgericht": "Amtsgericht Leipzig",
      "registernummer": "HRB 20629",
      "registerart": "HRB",
      "company_name": "Careart GmbH",
      "company_seat": "Bad Lausick",
      "details": "06.01.2026 (Bekanntmachungsdatum)\n\nSachsen Amtsgericht Leipzig HRB 20629\nSonstige Registerbekanntmachung 06.01.2026 (Eintragungsdatum)\n\nCareart GmbH\nGesellschaft mit beschränkter Haftung\nBad Lausick\n\nDen Gläubigern der Gesellschaft, deren Forderungen begründet worden sind bevor die Eintragung der Beendigung des Beherrschungs- und Gewinnabführungsvertrages in das Handelsregister nach § 10 des Handelsgesetzbuches als bekanntgemacht gilt, hat der andere Vertragsteil Sicherheit zu leisten, wenn sie sich binnen sechs Monaten nach der Bekanntmachung der Eintragung zu diesem Zweck bei ihm melden."
    },
    {
      "date": "2026-01-06",
      "id": "141620",
      "original_text": "Registerbekanntmachung nach dem Umwandlungsgesetz\nSachsen Amtsgericht Chemnitz HRB 19354\nSüGa-Gruppe Versicherungsmakler AG – Chemnitz",
      "type": "Registerbekanntmachung nach dem Umwandlungsgesetz",
      "state": "Sachsen",
      "amtsgericht": "Amtsgericht Chemnitz",
      "registernummer": "HRB 19354",
      "registerart": "HRB",
      "company_name": "SüGa-Gruppe Versicherungsmakler AG",
      "company_seat": "Chemnitz",
      "details": "06.01.2026 (Bekanntmachungsdatum)\n\nSachsen Amtsgericht Chemnitz HRB 19354\nRegisterbekanntmachung nach dem Umwandlungsgesetz 06.01.2026 (Eintragungsdatum)\n\nSüGa-Gruppe Versicherungsmakler AG\nAktiengesellschaft\nChemnitz\n\nDen Gläubigern der an der Verschmelzung beteiligten Rechtsträger ist, wenn sie binnen sechs Monaten nach dem Tag, an dem die Eintragung der Verschmelzung in das Register des Sitzes desjenigen Rechtsträgers, dessen Gläubiger sie sind, nach § 19 Abs. 3 UmwG als bekannt gemacht gilt, ihren Anspruch nach Grund und Höhe in Textform anmelden, Sicherheit zu leisten, soweit sie nicht Befriedigung verlangen können. Dieses Recht steht den Gläubigern jedoch nur zu, wenn sie glaubhaft machen, dass durch die Verschmelzung die Erfüllung der Forderung gefährdet wird."
    },
    {
      "date": "2026-01-06",
      "id": "141621",
      "original_text": "Löschungsankündigung\nSachsen Amtsgericht Dresden HRB 20926\nBLUE FEET MEDIA GmbH – Wilsdruff",
      "type": "Löschungsankündigung",
      "state": "Sachsen",
      "amtsgericht": "Amtsgericht Dresden",
      "registernummer": "HRB 20926",
      "registerart": "HRB",
      "company_name": "BLUE FEET MEDIA GmbH",
      "company_seat": "Wilsdruff",
      "details": "06.01.2026 (Bekanntmachungsdatum)\n\nSachsen Amtsgericht Dresden HRB 20926\nLöschungsankündigung\n\nBLUE FEET MEDIA GmbH\nGesellschaft mit beschränkter Haftung\nWilsdruff\n\nDas Registergericht beabsichtigt, die im Handelsregister eingetragene Gesellschaft von Amts wegen nach § 394 FamFG zu löschen. Die Frist zu Erhebung eines Widerspruchs gegen die beabsichtigte Löschung wird auf einen Monat festgesetzt."
    },
    {
      "date": "2026-01-06",
      "id": "141622",
      "original_text": "Einreichung neuer Dokumente\nSachsen Amtsgericht Dresden HRB 4696\nTechnische Werke Coswig GmbH – Coswig",
      "type": "Einreichung neuer Dokumente",
      "state": "Sachsen",
      "amtsgericht": "Amtsgericht Dresden",
      "registernummer": "HRB 4696",
      "registerart": "HRB",
      "company_name": "Technische Werke Coswig GmbH",
      "company_seat": "Coswig",
      "details": "06.01.2026 (Bekanntmachungsdatum)\n\nSachsen Amtsgericht Dresden HRB 4696\nEinreichung neuer Dokumente\n\nTechnische Werke Coswig GmbH\nGesellschaft mit beschränkter Haftung\nCoswig\n\nAm 05.01.2026 wurde beim Handelsregister des Amtsgerichts Dresden die Liste der Mitglieder des Aufsichtsrats gemäß § 52 GmbHG eingereicht."
    },
    {
      "date": "2026-01-06",
      "id": "141623",
      "original_text": "Einreichung neuer Dokumente\nSachsen Amtsgericht Dresden HRB 10585\nWBV Wohnbau- und Verwaltungs-GmbH Coswig – Coswig",
      "type": "Einreichung neuer Dokumente",
      "state": "Sachsen",
      "amtsgericht": "Amtsgericht Dresden",
      "registernummer": "HRB 10585",
      "registerart": "HRB",
      "company_name": "WBV Wohnbau- und Verwaltungs-GmbH Coswig",
      "company_seat": "Coswig",
      "details": "06.01.2026 (Bekanntmachungsdatum)\n\nSachsen Amtsgericht Dresden HRB 10585\nEinreichung neuer Dokumente\n\nWBV Wohnbau- und Verwaltungs-GmbH Coswig\nGesellschaft mit beschränkter Haftung\nCoswig\n\nAm  05.01.2026 wurde beim Handelsregister des Amtsgerichts Dresden die Liste der Mitglieder des Aufsichtsrats gemäß § 52 GmbHG eingereicht."
    },
    {
      "date": "2026-01-06",
      "id": "141624",
      "original_text": "Registerbekanntmachung nach dem Umwandlungsgesetz\nSachsen Amtsgericht Leipzig HRB 44792\nPhysiotherapie Ina Wolf GmbH – Rackwitz",
      "type": "Registerbekanntmachung nach dem Umwandlungsgesetz",
      "state": "Sachsen",
      "amtsgericht": "Amtsgericht Leipzig",
      "registernummer": "HRB 44792",
      "registerart": "HRB",
      "company_name": "Physiotherapie Ina Wolf GmbH",
      "company_seat": "Rackwitz",
      "details": "06.01.2026 (Bekanntmachungsdatum)\n\nSachsen Amtsgericht Leipzig HRB 44792\nRegisterbekanntmachung nach dem Umwandlungsgesetz 06.01.2026 (Eintragungsdatum)\n\nPhysiotherapie Ina Wolf GmbH\nGesellschaft mit beschränkter Haftung\nRackwitz\n\nDen Gläubigern der an der Ausgliederung beteiligten Rechtsträger ist, wenn sie binnen sechs Monaten nach dem Tag, an dem die Eintragung der Ausgliederung in das Register des Sitzes desjenigen Rechtsträgers, dessen Gläubiger sie sind, nach § 19 Abs. 3 UmwG als bekannt gemacht gilt, ihren Anspruch nach Grund und Höhe in Textform anmelden, Sicherheit zu leisten, soweit sie nicht Befriedigung verlangen können. Dieses Recht steht den Gläubigern jedoch nur zu, wenn sie glaubhaft machen, dass durch die Ausgliederung die Erfüllung der Forderung gefährdet wird."
    },
    {
      "date": "2026-01-06",
      "id": "141625",
      "original_text": "Sonstige Registerbekanntmachung\nSachsen Amtsgericht Dresden HRB 30620\nCompetence Call Center Dresden GmbH – Dresden",
      "type": "Sonstige Registerbekanntmachung",
      "state": "Sachsen",
      "amtsgericht": "Amtsgericht Dresden",
      "registernummer": "HRB 30620",
      "registerart": "HRB",
      "company_name": "Competence Call Center Dresden GmbH",
      "company_seat": "Dresden",
      "details": "06.01.2026 (Bekanntmachungsdatum)\n\nSachsen Amtsgericht Dresden HRB 30620\nSonstige Registerbekanntmachung 06.01.2026 (Eintragungsdatum)\n\nCompetence Call Center Dresden GmbH\nGesellschaft mit beschränkter Haftung\nDresden\n\nDen Gläubigern der Gesellschaft, deren Forderungen begründet worden sind bevor die Eintragung der Beendigung des Beherrschungs- und Gewinnabführungsvertrages in das Handelsregister nach § 10 des Handelsgesetzbuches als bekanntgemacht gilt, hat der andere Vertragsteil Sicherheit zu leisten, wenn sie sich binnen sechs Monaten nach der Bekanntmachung der Eintragung zu diesem Zweck bei ihm melden."
    },
    {
      "date": "2026-01-06",
      "id": "141626",
      "original_text": "Einreichung neuer Dokumente\nNiedersachsen Amtsgericht Osnabrück HRB 18913\nMICHAELTELECOM AG – Bohmte",
      "type": "Einreichung neuer Dokumente",
      "state": "Niedersachsen",
      "amtsgericht": "Amtsgericht Osnabrück",
      "registernummer": "HRB 18913",
      "registerart": "HRB",
      "company_name": "MICHAELTELECOM AG",
      "company_seat": "Bohmte",
      "details": "06.01.2026 (Bekanntmachungsdatum)\n\nNiedersachsen Amtsgericht Osnabrück HRB 18913\nEinreichung neuer Dokumente\n\nMICHAELTELECOM AG\nAktiengesellschaft\nBohmte\n\nDie Liste der Mitglieder des Aufsichtsrats wurde beim Registergericht eingereicht."
    },
    {
      "date": "2026-01-06",
      "id": "141627",
      "original_text": "Registerbekanntmachung nach dem Umwandlungsgesetz\nNiedersachsen Amtsgericht Oldenburg (Oldenburg) HRB 213157\nMVZ Wichernstift gGmbH – Ganderkesee",
      "type": "Registerbekanntmachung nach dem Umwandlungsgesetz",
      "state": "Niedersachsen",
      "amtsgericht": "Amtsgericht Oldenburg (Oldenburg)",
      "registernummer": "HRB 213157",
      "registerart": "HRB",
      "company_name": "MVZ Wichernstift gGmbH",
      "company_seat": "Ganderkesee",
      "details": "06.01.2026 (Bekanntmachungsdatum)\n\nNiedersachsen Amtsgericht Oldenburg (Oldenburg) HRB 213157\nRegisterbekanntmachung nach dem Umwandlungsgesetz 06.01.2026 (Eintragungsdatum)\n\nMVZ Wichernstift gGmbH\nGesellschaft mit beschränkter Haftung\nGanderkesee\n\nDen Gläubigern der an der Verschmelzung beteiligten Rechtsträger ist, wenn sie binnen sechs Monaten nach dem Tag, an dem die Eintragung der Verschmelzung in das Register des Sitzes desjenigen Rechtsträgers, dessen Gläubiger sie sind, nach § 19  Abs.  3 UmwG als bekannt gemacht gilt, ihren Anspruch nach Grund und Höhe schriftlich anmelden, Sicherheit zu leisten, soweit sie nicht Befriedigung verlangen können. Dieses Recht steht den Gläubigern jedoch nur zu, wenn sie glaubhaft machen, dass durch die Verschmelzung die Erfüllung der Forderung gefährdet wird."
    },
    {
      "date": "2026-01-06",
      "id": "141628",
      "original_text": "Löschungsankündigung\nNiedersachsen Amtsgericht Braunschweig HRA 201235\nF.Afonso - Schweißtechnik Inhaber Fernando Alberto Salvador Afonso e. K. – Bad Harzburg",
      "type": "Löschungsankündigung",
      "state": "Niedersachsen",
      "amtsgericht": "Amtsgericht Braunschweig",
      "registernummer": "HRA 201235",
      "registerart": "HRA",
      "company_name": "F.Afonso - Schweißtechnik Inhaber Fernando Alberto Salvador Afonso e. K.",
      "company_seat": "Bad Harzburg",
      "details": "06.01.2026 (Bekanntmachungsdatum)\n\nNiedersachsen Amtsgericht Braunschweig HRA 201235\nLöschungsankündigung 06.01.2026 (Eintragungsdatum)\n\nF.Afonso - Schweißtechnik Inhaber Fernando Alberto Salvador Afonso e. K.\nEinzelkaufmann / Einzelkauffrau\nBad Harzburg\n\nDas Registergericht beabsichtigt, die Firma von Amts wegen nach § 31 Abs. 2 Satz 2 HGB, § 393 FamFG zu löschen. Die Frist zur Erhebung eines Widerspruchs ist auf 1 Monat ab dieser Registerbekanntmachung festgesetzt."
    },
    {
      "date": "2026-01-06",
      "id": "141629",
      "original_text": "Einreichung neuer Dokumente\nNiedersachsen Amtsgericht Hannover HRB 223296\nSchwimmbadbetrieb Isernhagen GmbH – Isernhagen",
      "type": "Einreichung neuer Dokumente",
      "state": "Niedersachsen",
      "amtsgericht": "Amtsgericht Hannover",
      "registernummer": "HRB 223296",
      "registerart": "HRB",
      "company_name": "Schwimmbadbetrieb Isernhagen GmbH",
      "company_seat": "Isernhagen",
      "details": "06.01.2026 (Bekanntmachungsdatum)\n\nNiedersachsen Amtsgericht Hannover HRB 223296\nEinreichung neuer Dokumente\n\nSchwimmbadbetrieb Isernhagen GmbH\nGesellschaft mit beschränkter Haftung\nIsernhagen\n\nDie Liste der Mitglieder des Aufsichtsrats wurde beim Registergericht eingereicht."
    },
    {
      "date": "2026-01-06",
      "id": "141630",
      "original_text": "Löschungsankündigung\nNiedersachsen Amtsgericht Braunschweig HRB 206204\nBKS Kältesysteme UG (haftungsbeschränkt) – Braunschweig",
      "type": "Löschungsankündigung",
      "state": "Niedersachsen",
      "amtsgericht": "Amtsgericht Braunschweig",
      "registernummer": "HRB 206204",
      "registerart": "HRB",
      "company_name": "BKS Kältesysteme UG (haftungsbeschränkt)",
      "company_seat": "Braunschweig",
      "details": "06.01.2026 (Bekanntmachungsdatum)\n\nNiedersachsen Amtsgericht Braunschweig HRB 206204\nLöschungsankündigung\n\nBKS Kältesysteme UG (haftungsbeschränkt)\nGesellschaft mit beschränkter Haftung\nBraunschweig\n\nDas Registergericht beabsichtigt, die Gesellschaft von Amts wegen nach § 394 FamFG zu löschen. Die Frist zur Erhebung eines Widerspruchs ist auf 1 Monat ab dieser Registerbekanntmachung festgesetzt."
    },
    {
      "date": "2026-01-06",
      "id": "141631",
      "original_text": "Registerbekanntmachung nach dem Umwandlungsgesetz\nNiedersachsen Amtsgericht Oldenburg (Oldenburg) HRB 206663\nK & O Steuerberatungsgesellschaft mbH – Hude",
      "type": "Registerbekanntmachung nach dem Umwandlungsgesetz",
      "state": "Niedersachsen",
      "amtsgericht": "Amtsgericht Oldenburg (Oldenburg)",
      "registernummer": "HRB 206663",
      "registerart": "HRB",
      "company_name": "K & O Steuerberatungsgesellschaft mbH",
      "company_seat": "Hude",
      "details": "06.01.2026 (Bekanntmachungsdatum)\n\nNiedersachsen Amtsgericht Oldenburg (Oldenburg) HRB 206663\nRegisterbekanntmachung nach dem Umwandlungsgesetz 06.01.2026 (Eintragungsdatum)\n\nK & O Steuerberatungsgesellschaft mbH\nGesellschaft mit beschränkter Haftung\nHude\n\nDen Gläubigern der an der Verschmelzung beteiligten Rechtsträger ist, wenn sie binnen sechs Monaten nach dem Tag, an dem die Eintragung der Verschmelzung in das Register des Sitzes desjenigen Rechtsträgers, dessen Gläubiger sie sind, nach § 19  Abs.  3 UmwG als bekannt gemacht gilt, ihren Anspruch nach Grund und Höhe schriftlich anmelden, Sicherheit zu leisten, soweit sie nicht Befriedigung verlangen können. Dieses Recht steht den Gläubigern jedoch nur zu, wenn sie glaubhaft machen, dass durch die Verschmelzung die Erfüllung der Forderung gefährdet wird."
    },
    {
      "date": "2026-01-06",
      "id": "141632",
      "original_text": "Registerbekanntmachung nach dem Umwandlungsgesetz\nNiedersachsen Amtsgericht Oldenburg (Oldenburg) HRB 206862\navantax Steuerberatungsgesellschaft mbH – Hude",
      "type": "Registerbekanntmachung nach dem Umwandlungsgesetz",
      "state": "Niedersachsen",
      "amtsgericht": "Amtsgericht Oldenburg (Oldenburg)",
      "registernummer": "HRB 206862",
      "registerart": "HRB",
      "company_name": "avantax Steuerberatungsgesellschaft mbH",
      "company_seat": "Hude",
      "details": "06.01.2026 (Bekanntmachungsdatum)\n\nNiedersachsen Amtsgericht Oldenburg (Oldenburg) HRB 206862\nRegisterbekanntmachung nach dem Umwandlungsgesetz 06.01.2026 (Eintragungsdatum)\n\navantax Steuerberatungsgesellschaft mbH\nGesellschaft mit beschränkter Haftung\nHude\n\nDen Gläubigern der an der Verschmelzung beteiligten Rechtsträger ist, wenn sie binnen sechs Monaten nach dem Tag, an dem die Eintragung der Verschmelzung in das Register des Sitzes desjenigen Rechtsträgers, dessen Gläubiger sie sind, nach § 19  Abs.  3 UmwG als bekannt gemacht gilt, ihren Anspruch nach Grund und Höhe schriftlich anmelden, Sicherheit zu leisten, soweit sie nicht Befriedigung verlangen können. Dieses Recht steht den Gläubigern jedoch nur zu, wenn sie glaubhaft machen, dass durch die Verschmelzung die Erfüllung der Forderung gefährdet wird."
    },
    {
      "date": "2026-01-06",
      "id": "141633",
      "original_text": "Registerbekanntmachung nach dem Umwandlungsgesetz\nNiedersachsen Amtsgericht Oldenburg (Oldenburg) HRB 141447 früher Amtsgericht Delmenhorst\nKlinik für Kinder- und Jugendpsychiatrie Wichernstift gemeinnützige Gesellschaft mit beschränkter Haftung – Ganderkesee",
      "type": "Registerbekanntmachung nach dem Umwandlungsgesetz",
      "state": "Niedersachsen",
      "amtsgericht": "Amtsgericht Oldenburg (Oldenburg)",
      "registernummer": "HRB 141447",
      "registerart": "HRB",
      "company_name": "Klinik für Kinder- und Jugendpsychiatrie Wichernstift gemeinnützige Gesellschaft mit beschränkter Haftung",
      "company_seat": "Ganderkesee",
      "former_amtsgericht": "Delmenhorst",
      "details": "06.01.2026 (Bekanntmachungsdatum)\n\nNiedersachsen Amtsgericht Oldenburg (Oldenburg) HRB 141447 früher Amtsgericht Delmenhorst\nRegisterbekanntmachung nach dem Umwandlungsgesetz 06.01.2026 (Eintragungsdatum)\n\nKlinik für Kinder- und Jugendpsychiatrie Wichernstift gemeinnützige Gesellschaft mit beschränkter Haftung\nGesellschaft mit beschränkter Haftung\nGanderkesee\n\nDen Gläubigern der an der Verschmelzung beteiligten Rechtsträger ist, wenn sie binnen sechs Monaten nach dem Tag, an dem die Eintragung der Verschmelzung in das Register des Sitzes desjenigen Rechtsträgers, dessen Gläubiger sie sind, nach § 19  Abs.  3 UmwG als bekannt gemacht gilt, ihren Anspruch nach Grund und Höhe schriftlich anmelden, Sicherheit zu leisten, soweit sie nicht Befriedigung verlangen können. Dieses Recht steht den Gläubigern jedoch nur zu, wenn sie glaubhaft machen, dass durch die Verschmelzung die Erfüllung der Forderung gefährdet wird."
    },
    {
      "date": "2026-01-06",
      "id": "141634",
      "original_text": "Löschungsankündigung\nNiedersachsen Amtsgericht Stadthagen HRB 201986\nH2-Invest GmbH – Lauenau",
      "type": "Löschungsankündigung",
      "state": "Niedersachsen",
      "amtsgericht": "Amtsgericht Stadthagen",
      "registernummer": "HRB 201986",
      "registerart": "HRB",
      "company_name": "H2-Invest GmbH",
      "company_seat": "Lauenau",
      "details": "06.01.2026 (Bekanntmachungsdatum)\n\nNiedersachsen Amtsgericht Stadthagen HRB 201986\nLöschungsankündigung\n\nH2-Invest GmbH\nGesellschaft mit beschränkter Haftung\nLauenau\n\nDas Registergericht beabsichtigt, die Gesellschaft von Amts wegen nach § 394 FamFG zu löschen. Die Frist zur Erhebung eines Widerspruchs ist auf 1 Monat ab dieser Registerbekanntmachung festgesetzt."
    },
    {
      "date": "2026-01-06",
      "id": "141635",
      "original_text": "Sonstige Registerbekanntmachung\nNiedersachsen Amtsgericht Hannover HRB 52029\nContiTech Vibration Control GmbH – Hannover",
      "type": "Sonstige Registerbekanntmachung",
      "state": "Niedersachsen",
      "amtsgericht": "Amtsgericht Hannover",
      "registernummer": "HRB 52029",
      "registerart": "HRB",
      "company_name": "ContiTech Vibration Control GmbH",
      "company_seat": "Hannover",
      "details": "06.01.2026 (Bekanntmachungsdatum)\n\nNiedersachsen Amtsgericht Hannover HRB 52029\nSonstige Registerbekanntmachung 06.01.2026 (Eintragungsdatum)\n\nContiTech Vibration Control GmbH\nGesellschaft mit beschränkter Haftung\nHannover\n\nDen Gläubigern der Gesellschaft, deren Forderungen begründet worden sind, bevor die Eintragung der Beendigung des Vertrages in das Handelsregister nach § 10 HGB als bekanntgemacht gilt, ist vom anderen Vertragsteil Sicherheit zu leisten, wenn sie sich binnen sechs Monaten nach der Bekanntmachung zu diesem Zweck bei ihm melden."
    },
    {
      "date": "2026-01-06",
      "id": "141636",
      "original_text": "Einreichung neuer Dokumente\nRheinland-Pfalz Amtsgericht Montabaur HRB 6685\nCHAMAELEON - Aktiengesellschaft für innovative Netzlösungen – Montabaur",
      "type": "Einreichung neuer Dokumente",
      "state": "Rheinland-Pfalz",
      "amtsgericht": "Amtsgericht Montabaur",
      "registernummer": "HRB 6685",
      "registerart": "HRB",
      "company_name": "CHAMAELEON - Aktiengesellschaft für innovative Netzlösungen",
      "company_seat": "Montabaur",
      "details": "06.01.2026 (Bekanntmachungsdatum)\n\nRheinland-Pfalz Amtsgericht Montabaur HRB 6685\nEinreichung neuer Dokumente\n\nCHAMAELEON - Aktiengesellschaft für innovative Netzlösungen\nAktiengesellschaft\nMontabaur\n\nDem Registergericht ist eine neue Liste der Mitglieder des Aufsichtsrates eingereicht worden."
    },
    {
      "date": "2026-01-06",
      "id": "141637",
      "original_text": "Sonstige Registerbekanntmachung\nRheinland-Pfalz Amtsgericht Mainz HRB 42725\nIT-Consulting and Technology AG – Mainz",
      "type": "Sonstige Registerbekanntmachung",
      "state": "Rheinland-Pfalz",
      "amtsgericht": "Amtsgericht Mainz",
      "registernummer": "HRB 42725",
      "registerart": "HRB",
      "company_name": "IT-Consulting and Technology AG",
      "company_seat": "Mainz",
      "details": "06.01.2026 (Bekanntmachungsdatum)\n\nRheinland-Pfalz Amtsgericht Mainz HRB 42725\nSonstige Registerbekanntmachung\n\nIT-Consulting and Technology AG\nAktiengesellschaft\nMainz\n\nDem Registergericht ist eine neue Liste der Mitglieder des Aufsichtsrates eingereicht worden."
    },
    {
      "date": "2026-01-06",
      "id": "141638",
      "original_text": "Löschungsankündigung\nRheinland-Pfalz Amtsgericht Koblenz HRB 27868\nA&S Translog GmbH – Lutzerath",
      "type": "Löschungsankündigung",
      "state": "Rheinland-Pfalz",
      "amtsgericht": "Amtsgericht Koblenz",
      "registernummer": "HRB 27868",
      "registerart": "HRB",
      "company_name": "A&S Translog GmbH",
      "company_seat": "Lutzerath",
      "details": "06.01.2026 (Bekanntmachungsdatum)\n\nRheinland-Pfalz Amtsgericht Koblenz HRB 27868\nLöschungsankündigung\n\nA&S Translog GmbH\nGesellschaft mit beschränkter Haftung\nLutzerath\n\nDas Registergericht beabsichtigt die Gesellschaft von Amts wegen nach § 394 FamFG zu löschen. Die Frist zur Erhebung eines Widerspruchs ist auf einen Monat festgesetzt."
    },
    {
      "date": "2026-01-06",
      "id": "141639",
      "original_text": "Sonstige Registerbekanntmachung\nRheinland-Pfalz Amtsgericht Koblenz HRB 15414\nKirchbergklinik GmbH – Andernach",
      "type": "Sonstige Registerbekanntmachung",
      "state": "Rheinland-Pfalz",
      "amtsgericht": "Amtsgericht Koblenz",
      "registernummer": "HRB 15414",
      "registerart": "HRB",
      "company_name": "Kirchbergklinik GmbH",
      "company_seat": "Andernach",
      "details": "06.01.2026 (Bekanntmachungsdatum)\n\nRheinland-Pfalz Amtsgericht Koblenz HRB 15414\nSonstige Registerbekanntmachung 06.01.2026 (Eintragungsdatum)\n\nKirchbergklinik GmbH\nGesellschaft mit beschränkter Haftung\nAndernach\n\nAls nicht eingetragen wird veröffentlicht: Den Gläubigern der Gesellschaft, deren Forderungen begründet worden sind, bevor die Eintragung der Beendigung des Gewinnabführungsvertrages in das Handelsregister nach § 10 des Handelsgesetzbuches als bekanntgemacht gilt, hat der andere Vertragsteil Sicherheit zu leisten, wenn sie sich binnen sechs Monaten nach der Bekanntmachung der Eintragung zu diesem Zweck bei ihm melden."
    },
    {
      "date": "2026-01-06",
      "id": "141640",
      "original_text": "Einreichung neuer Dokumente\nNordrhein-Westfalen Amtsgericht Dortmund HRB 28699\nAmazon Logistik Dortmund GmbH – Dortmund",
      "type": "Einreichung neuer Dokumente",
      "state": "Nordrhein-Westfalen",
      "amtsgericht": "Amtsgericht Dortmund",
      "registernummer": "HRB 28699",
      "registerart": "HRB",
      "company_name": "Amazon Logistik Dortmund GmbH",
      "company_seat": "Dortmund",
      "details": "06.01.2026 (Bekanntmachungsdatum)\n\nNordrhein-Westfalen Amtsgericht Dortmund HRB 28699\nEinreichung neuer Dokumente\n\nAmazon Logistik Dortmund GmbH\nGesellschaft mit beschränkter Haftung\nDortmund\n\nDem Registergericht ist eine neue Liste der Mitglieder des Aufsichtsrates eingereicht worden."
    },
    {
      "date": "2026-01-06",
      "id": "141641",
      "original_text": "Registerbekanntmachung nach dem Umwandlungsgesetz\nNordrhein-Westfalen Amtsgericht Essen HRB 27265\nPH-Treuhand GmbH Steuerberatungsgesellschaft – Essen",
      "type": "Registerbekanntmachung nach dem Umwandlungsgesetz",
      "state": "Nordrhein-Westfalen",
      "amtsgericht": "Amtsgericht Essen",
      "registernummer": "HRB 27265",
      "registerart": "HRB",
      "company_name": "PH-Treuhand GmbH Steuerberatungsgesellschaft",
      "company_seat": "Essen",
      "details": "06.01.2026 (Bekanntmachungsdatum)\n\nNordrhein-Westfalen Amtsgericht Essen HRB 27265\nRegisterbekanntmachung nach dem Umwandlungsgesetz 06.01.2026 (Eintragungsdatum)\n\nPH-Treuhand GmbH Steuerberatungsgesellschaft\nGesellschaft mit beschränkter Haftung\nEssen\n\nDen Gläubigern der an der Verschmelzung beteiligten Rechtsträger ist, wenn sie binnen sechs Monaten nach dem Tag, an dem die Eintragung der Verschmelzung in das Register des Sitzes desjenigen Rechtsträgers, dessen Gläubiger sie sind, nach § 19 Absatz 3 UmwG als bekanntgemacht gilt, ihren Anspruch nach Grund und Höhe schriftlich anmelden, Sicherheit zu leisten, soweit sie nicht Befriedigung verlangen können. Dieses Recht steht den Gläubigern jedoch nur zu, wenn sie glaubhaft machen, dass durch die Verschmelzung die Erfüllung ihrer Forderung gefährdet wird."
    },
    {
      "date": "2026-01-06",
      "id": "141642",
      "original_text": "Sonstige Registerbekanntmachung\nNordrhein-Westfalen Amtsgericht Münster HRB 20689\nWinkelmann Construction Components GmbH – Ahlen",
      "type": "Sonstige Registerbekanntmachung",
      "state": "Nordrhein-Westfalen",
      "amtsgericht": "Amtsgericht Münster",
      "registernummer": "HRB 20689",
      "registerart": "HRB",
      "company_name": "Winkelmann Construction Components GmbH",
      "company_seat": "Ahlen",
      "details": "06.01.2026 (Bekanntmachungsdatum)\n\nNordrhein-Westfalen Amtsgericht Münster HRB 20689\nSonstige Registerbekanntmachung 06.01.2026 (Eintragungsdatum)\n\nWinkelmann Construction Components GmbH\nGesellschaft mit beschränkter Haftung\nAhlen\n\nAls nicht eingetragen wird veröffentlicht: Den Gläubigern der Gesellschaft, deren Forderungen begründet worden sind bevor die Eintragung der Beendigung des Beherrschungs- und Gewinnabführungsvertrages  in das Handelsregister nach § 10 des Handelsgesetzbuches als bekanntgemacht gilt, hat der andere Vertragsteil Sicherheit zu leisten, wenn sie sich binnen sechs Monaten nach der Bekanntmachung der Eintragung zu diesem Zweck bei ihm melden."
    },
    {
      "date": "2026-01-06",
      "id": "141643",
      "original_text": "Registerbekanntmachung nach dem Umwandlungsgesetz\nNordrhein-Westfalen Amtsgericht Düsseldorf HRA 25999\nWattner SunAsset Solarkraftwerk 016 GmbH & Co. KG – Monheim am Rhein",
      "type": "Registerbekanntmachung nach dem Umwandlungsgesetz",
      "state": "Nordrhein-Westfalen",
      "amtsgericht": "Amtsgericht Düsseldorf",
      "registernummer": "HRA 25999",
      "registerart": "HRA",
      "company_name": "Wattner SunAsset Solarkraftwerk 016 GmbH & Co. KG",
      "company_seat": "Monheim am Rhein",
      "details": "06.01.2026 (Bekanntmachungsdatum)\n\nNordrhein-Westfalen Amtsgericht Düsseldorf HRA 25999\nRegisterbekanntmachung nach dem Umwandlungsgesetz 06.01.2026 (Eintragungsdatum)\n\nWattner SunAsset Solarkraftwerk 016 GmbH & Co. KG\nKommanditgesellschaft\nMonheim am Rhein\n\nDen Gläubigern der an der Verschmelzung beteiligten Rechtsträger ist, wenn sie binnen sechs Monaten nach dem Tag, an dem die Eintragung der Verschmelzung in das Register des Sitzes desjenigen Rechtsträgers, dessen Gläubiger sie sind, nach § 19 Absatz 3 UmwG als bekanntgemacht gilt, ihren Anspruch nach Grund und Höhe schriftlich anmelden, Sicherheit zu leisten, soweit sie nicht Befriedigung verlangen können. Dieses Recht steht den Gläubigern jedoch nur zu, wenn sie glaubhaft machen, dass durch die Verschmelzung die Erfüllung ihrer Forderung gefährdet wird."
    },
    {
      "date": "2026-01-06",
      "id": "141644",
      "original_text": "Einreichung neuer Dokumente\nNordrhein-Westfalen Amtsgericht Köln HRB 38025\nA - M - T Management Performance AG – Radevormwald",
      "type": "Einreichung neuer Dokumente",
      "state": "Nordrhein-Westfalen",
      "amtsgericht": "Amtsgericht Köln",
      "registernummer": "HRB 38025",
      "registerart": "HRB",
      "company_name": "A - M - T Management Performance AG",
      "company_seat": "Radevormwald",
      "details": "06.01.2026 (Bekanntmachungsdatum)\n\nNordrhein-Westfalen Amtsgericht Köln HRB 38025\nEinreichung neuer Dokumente 06.01.2026 (Eintragungsdatum)\n\nA - M - T Management Performance AG\nAktiengesellschaft\nRadevormwald\n\nDem Registergericht ist eine neue Liste der Mitglieder des Aufsichtsrates eingereicht worden."
    },
    {
      "date": "2026-01-06",
      "id": "141645",
      "original_text": "Löschungsankündigung\nNordrhein-Westfalen Amtsgericht Siegburg HRB 17525\nImmovest Bau GmbH – Troisdorf",
      "type": "Löschungsankündigung",
      "state": "Nordrhein-Westfalen",
      "amtsgericht": "Amtsgericht Siegburg",
      "registernummer": "HRB 17525",
      "registerart": "HRB",
      "company_name": "Immovest Bau GmbH",
      "company_seat": "Troisdorf",
      "details": "06.01.2026 (Bekanntmachungsdatum)\n\nNordrhein-Westfalen Amtsgericht Siegburg HRB 17525\nLöschungsankündigung\n\nImmovest Bau GmbH\nGesellschaft mit beschränkter Haftung\nTroisdorf\n\nDas Registergericht hat glaubhafte Kenntnis erlangt, dass die Gesellschaft vermögenslos geworden ist, da ein Insolvenzeröffnungsantrag mangels Masse nach § 26 InsO zurückgewiesen wurde. Es ist daher beabsichtigt, die\nGesellschaft nach § 394 FamFG im Handelsregister wegen\nVermögenslosigkeit zu löschen. Einwände gegen die Löschung sind durch Widerspruch binnen einer Frist von 3 Monaten geltend zu machen, andernfalls die Löschung erfolgen wird. Einzulegen ist der Widerspruch bei dem Amtsgericht Siegburg, Neue Poststraße 16, 53721 Siegburg, und zwar entweder schriftlich in deutscher Sprache oder mündlich zur Niederschrift der Geschäftsstelle. Der Widerspruch kann auch zur Niederschrift der Geschäftsstelle eines jeden Amtsgerichts abgegeben werden. Der Widerspruch ist binnen\nder in der Verfügung bestimmten Frist einzulegen. Die Frist ist nur gewahrt, wenn der Widerspruch rechtzeitig bei dem Amtsgericht Siegburg eingeht, auch wenn der Widerspruch zur Niederschrift der Geschäftsstelle eines anderen Amtsgerichts abgegeben wurde. Die Frist beginnt jeweils mit der schriftlichen Bekanntgabe der Verfügung an die Beteiligten. Kann die schriftliche Bekanntgabe an einen Beteiligten nicht bewirkt werden, beginnt die\nFrist spätestens mit Ablauf von fünf Monaten nach Erlass der Verfügung. Die Bekanntgabe ist entweder durch Zustellung oder am dritten Tage nach Aufgabe zur Post bewirkt. Sofern die Löschung noch nicht erfolgt ist, kann der Widerspruch auch noch nach Ablauf der Frist eingelegt werden. Fällt das Ende der Frist auf einen Sonnabend, einen Sonntag oder einen allgemeinen Feiertag, endet die Frist mit Ablauf des nächsten Werktages. Der Widerspruch ist zu unterzeichnen. Eine Begründung des Widerspruchs ist nicht vorgeschrieben."
    },
    {
      "date": "2026-01-06",
      "id": "141646",
      "original_text": "Löschungsankündigung\nNordrhein-Westfalen Amtsgericht Düsseldorf HRB 87098\nLCSC Electronics GmbH – Düsseldorf",
      "type": "Löschungsankündigung",
      "state": "Nordrhein-Westfalen",
      "amtsgericht": "Amtsgericht Düsseldorf",
      "registernummer": "HRB 87098",
      "registerart": "HRB",
      "company_name": "LCSC Electronics GmbH",
      "company_seat": "Düsseldorf",
      "details": "06.01.2026 (Bekanntmachungsdatum)\n\nNordrhein-Westfalen Amtsgericht Düsseldorf HRB 87098\nLöschungsankündigung\n\nLCSC Electronics GmbH\nGesellschaft mit beschränkter Haftung\nDüsseldorf\n\nDas Registergericht beabsichtigt die Gesellschaft von Amts wegen nach § 394 FamFG zu löschen. Die Frist zur Erhebung eines Widerspruchs ist auf 3 Wochen festgesetzt.\n\nRechtsbehelfsbelehrung:\nDas Widerspruchsrecht steht jedem zu, der an der Unterlassung der Löschung ein berechtigtes Interesse hat. Der Widerspruch ist bei dem Amtsgericht Düsseldorf -Registergericht-, Werdener Straße 1, 40227 Düsseldorf schriftlich in deutscher Sprache oder zur Niederschrift der Geschäftsstelle einzulegen. Der Widerspruch kann auch zur Niederschrift der Geschäftsstelle eines jeden Amtsgerichtes abgegeben werden. Die Einlegung ist auch durch Übertragung eines elektronischen Dokuments an die elektronische Poststelle des Gerichts möglich. Das elektronische Dokument muss für die Bearbeitung durch das Gericht geeignet und mit einer qualifizierten elektronischen Signatur der verantwortenden Person versehen sein oder von der verantwortenden Person signiert und auf einem sicheren Übermittlungsweg gemäß § 130a ZPO nach näherer Maßgabe der Verordnung über die technischen Rahmenbedingungen des elektronischen Rechtsverkehrs und über das besondere elektronische Behördenpostfach (BGBl. I, S.3803) eingereicht werden. Weitere Informationen erhalten Sie auf der Internetseite www.justiz.de.\nDer Widerspruch muss spätestens innerhalb der gesetzten Frist nach dem Datum der Bekanntmachung der Löschungsankündigung bei dem Amtsgericht - Registergericht - Düsseldorf eingegangen sein.  Dies gilt auch dann, wenn der Widerspruch zur Niederschrift der Geschäftsstelle eines anderen Amtsgerichtes abgegeben wurde. Die Frist beginnt mit dem Tage der Bekanntmachung der Löschungsankündigung in dem für die Bekanntmachung der Eintragungen in das Handelsregister bestimmten elektronischen Informations- und Kommunikationssystem nach § 10 des Handelsgesetzbuches. Fällt das Ende der Frist auf einen Sonntag, einen allgemeinen Feiertag oder Sonnabend, so endet die Frist mit Ablauf des nächsten Werktages.\nDer Widerspruch muss die Bezeichnung der angefochtenen Löschungsankündigung sowie die Erklärung enthalten, dass Widerspruch gegen diese Löschungsankündigung eingelegt wird. Er ist zu unterzeichnen und soll begründet werden."
    },
    {
      "date": "2026-01-06",
      "id": "141647",
      "original_text": "Registerbekanntmachung nach dem Umwandlungsgesetz\nNordrhein-Westfalen Amtsgericht Hamm HRB 7328\nManss GmbH Frischeservice – Hamm",
      "type": "Registerbekanntmachung nach dem Umwandlungsgesetz",
      "state": "Nordrhein-Westfalen",
      "amtsgericht": "Amtsgericht Hamm",
      "registernummer": "HRB 7328",
      "registerart": "HRB",
      "company_name": "Manss GmbH Frischeservice",
      "company_seat": "Hamm",
      "details": "06.01.2026 (Bekanntmachungsdatum)\n\nNordrhein-Westfalen Amtsgericht Hamm HRB 7328\nRegisterbekanntmachung nach dem Umwandlungsgesetz 06.01.2026 (Eintragungsdatum)\n\nManss GmbH Frischeservice\nGesellschaft mit beschränkter Haftung\nHamm\n\nDen Gläubigern der an der Abspaltung beteiligten Rechtsträger ist, wenn sie binnen sechs Monaten nach dem Tag, an dem die Eintragung der Abspaltung in das Register des Sitzes derjenigen Rechtsträger deren Gläubiger sie sind, nach § 19 Absatz 3 UmwG als bekanntgemacht gilt, ihren Anspruch nach Grund und Höhe schriftlich anmelden, Sicherheit zu leisten, soweit sie nicht Befriedigung verlangen können. Dieses Recht steht den Gläubigern jedoch nur zu, wenn sie glaubhaft machen, dass durch die Abspaltung die Erfüllung ihrer Forderung gefährdet wird."
    },
    {
      "date": "2026-01-06",
      "id": "141648",
      "original_text": "Löschungsankündigung\nNordrhein-Westfalen Amtsgericht Siegen HRB 13107\nSchneider GmbH Stuckateur- und Malerfachbetrieb – Freudenberg",
      "type": "Löschungsankündigung",
      "state": "Nordrhein-Westfalen",
      "amtsgericht": "Amtsgericht Siegen",
      "registernummer": "HRB 13107",
      "registerart": "HRB",
      "company_name": "Schneider GmbH Stuckateur- und Malerfachbetrieb",
      "company_seat": "Freudenberg",
      "details": "06.01.2026 (Bekanntmachungsdatum)\n\nNordrhein-Westfalen Amtsgericht Siegen HRB 13107\nLöschungsankündigung\n\nSchneider GmbH Stuckateur- und Malerfachbetrieb\nGesellschaft mit beschränkter Haftung\nFreudenberg\n\nDas Registergericht beabsichtigt die Gesellschaft von Amts wegen nach § 394 FamFG zu löschen. Die Frist zur Erhebung eines Widerspruchs ist auf drei Monate festgesetzt."
    },
    {
      "date": "2026-01-06",
      "id": "141649",
      "original_text": "Sonstige Registerbekanntmachung\nNordrhein-Westfalen Amtsgericht Lemgo HRB 10142\nExklusiv Wohnbau Ulm GmbH – Detmold",
      "type": "Sonstige Registerbekanntmachung",
      "state": "Nordrhein-Westfalen",
      "amtsgericht": "Amtsgericht Lemgo",
      "registernummer": "HRB 10142",
      "registerart": "HRB",
      "company_name": "Exklusiv Wohnbau Ulm GmbH",
      "company_seat": "Detmold",
      "details": "06.01.2026 (Bekanntmachungsdatum)\n\nNordrhein-Westfalen Amtsgericht Lemgo HRB 10142\nSonstige Registerbekanntmachung 06.01.2026 (Eintragungsdatum)\n\nExklusiv Wohnbau Ulm GmbH\nGesellschaft mit beschränkter Haftung\nDetmold\n\nAls nicht eingetragen wird veröffentlicht: Den Gläubigern der Gesellschaft, deren Forderungen begründet worden sind bevor die Eintragung der Beendigung des Beherrschungs- und Gewinnabführungsvertrages  in das Handelsregister nach § 10 des Handelsgesetzbuches als bekanntgemacht gilt, hat der andere Vertragsteil Sicherheit zu leisten, wenn sie sich binnen sechs Monaten nach der Bekanntmachung der Eintragung zu diesem Zweck bei ihm melden."
    },
    {
      "date": "2026-01-06",
      "id": "141650",
      "original_text": "Registerbekanntmachung nach dem Umwandlungsgesetz\nNordrhein-Westfalen Amtsgericht Hagen HRB 7170\nCL Meci Dent GmbH – Breckerfeld",
      "type": "Registerbekanntmachung nach dem Umwandlungsgesetz",
      "state": "Nordrhein-Westfalen",
      "amtsgericht": "Amtsgericht Hagen",
      "registernummer": "HRB 7170",
      "registerart": "HRB",
      "company_name": "CL Meci Dent GmbH",
      "company_seat": "Breckerfeld",
      "details": "06.01.2026 (Bekanntmachungsdatum)\n\nNordrhein-Westfalen Amtsgericht Hagen HRB 7170\nRegisterbekanntmachung nach dem Umwandlungsgesetz 06.01.2026 (Eintragungsdatum)\n\nCL Meci Dent GmbH\nGesellschaft mit beschränkter Haftung\nBreckerfeld\n\nDen Gläubigern der an der Verschmelzung beteiligten Rechtsträger ist, wenn sie binnen sechs Monaten nach dem Tag, an dem die Eintragung der Verschmelzung in das Register des Sitzes desjenigen Rechtsträgers, dessen Gläubiger sie sind, nach § 19 Absatz 3 UmwG als bekanntgemacht gilt, ihren Anspruch nach Grund und Höhe schriftlich anmelden, Sicherheit zu leisten, soweit sie nicht Befriedigung verlangen können. Dieses Recht steht den Gläubigern jedoch nur zu, wenn sie glaubhaft machen, dass durch die Verschmelzung die Erfüllung ihrer Forderung gefährdet wird."
    },
    {
      "date": "2026-01-06",
      "id": "141651",
      "original_text": "Löschungsankündigung\nNordrhein-Westfalen Amtsgericht Wuppertal HRB 27757\nGaststätte Am Rathaus UG (haftungsbeschränkt) – Remscheid",
      "type": "Löschungsankündigung",
      "state": "Nordrhein-Westfalen",
      "amtsgericht": "Amtsgericht Wuppertal",
      "registernummer": "HRB 27757",
      "registerart": "HRB",
      "company_name": "Gaststätte Am Rathaus UG (haftungsbeschränkt)",
      "company_seat": "Remscheid",
      "details": "06.01.2026 (Bekanntmachungsdatum)\n\nNordrhein-Westfalen Amtsgericht Wuppertal HRB 27757\nLöschungsankündigung\n\nGaststätte Am Rathaus UG (haftungsbeschränkt)\nGesellschaft mit beschränkter Haftung\nRemscheid\n\nDas Registergericht beabsichtigt die Gesellschaft von Amts wegen nach § 394 FamFG zu löschen. Die Frist zur Erhebung eines Widerspruchs ist auf einen Monat festgesetzt."
    },
    {
      "date": "2026-01-06",
      "id": "141652",
      "original_text": "Löschungsankündigung\nNordrhein-Westfalen Amtsgericht Essen HRB 31323\nC&C Accounting and Consulting UG (haftungsbeschränkt) – Essen",
      "type": "Löschungsankündigung",
      "state": "Nordrhein-Westfalen",
      "amtsgericht": "Amtsgericht Essen",
      "registernummer": "HRB 31323",
      "registerart": "HRB",
      "company_name": "C&C Accounting and Consulting UG (haftungsbeschränkt)",
      "company_seat": "Essen",
      "details": "06.01.2026 (Bekanntmachungsdatum)\n\nNordrhein-Westfalen Amtsgericht Essen HRB 31323\nLöschungsankündigung\n\nC&C Accounting and Consulting UG (haftungsbeschränkt)\nGesellschaft mit beschränkter Haftung\nEssen\n\nDas Registergericht beabsichtigt die Gesellschaft von Amts wegen nach § 394 FamFG zu löschen. Die Frist zur Erhebung eines Widerspruchs ist auf einen Monat festgesetzt."
    },
    {
      "date": "2026-01-06",
      "id": "141653",
      "original_text": "Einreichung neuer Dokumente\nNordrhein-Westfalen Amtsgericht Wuppertal HRB 2174\nGemeinnützige Wohnungsbaugesellschaft mbH Wuppertal – Wuppertal",
      "type": "Einreichung neuer Dokumente",
      "state": "Nordrhein-Westfalen",
      "amtsgericht": "Amtsgericht Wuppertal",
      "registernummer": "HRB 2174",
      "registerart": "HRB",
      "company_name": "Gemeinnützige Wohnungsbaugesellschaft mbH Wuppertal",
      "company_seat": "Wuppertal",
      "details": "06.01.2026 (Bekanntmachungsdatum)\n\nNordrhein-Westfalen Amtsgericht Wuppertal HRB 2174\nEinreichung neuer Dokumente 06.01.2025 (Eintragungsdatum)\n\nGemeinnützige Wohnungsbaugesellschaft mbH Wuppertal\nGesellschaft mit beschränkter Haftung\nWuppertal\n\nDem Registergericht ist eine neue Liste der Mitglieder des Aufsichtsrates eingereicht worden."
    },
    {
      "date": "2026-01-06",
      "id": "141654",
      "original_text": "Sonstige Registerbekanntmachung\nNordrhein-Westfalen Amtsgericht Lemgo HRB 10135\nExklusiv Wohnbau Rheinland GmbH – Detmold",
      "type": "Sonstige Registerbekanntmachung",
      "state": "Nordrhein-Westfalen",
      "amtsgericht": "Amtsgericht Lemgo",
      "registernummer": "HRB 10135",
      "registerart": "HRB",
      "company_name": "Exklusiv Wohnbau Rheinland GmbH",
      "company_seat": "Detmold",
      "details": "06.01.2026 (Bekanntmachungsdatum)\n\nNordrhein-Westfalen Amtsgericht Lemgo HRB 10135\nSonstige Registerbekanntmachung 06.01.2026 (Eintragungsdatum)\n\nExklusiv Wohnbau Rheinland GmbH\nGesellschaft mit beschränkter Haftung\nDetmold\n\nAls nicht eingetragen wird veröffentlicht: Den Gläubigern der Gesellschaft, deren Forderungen begründet worden sind bevor die Eintragung der Beendigung des Beherrschungs- und Gewinnabführungsvertrages  in das Handelsregister nach § 10 des Handelsgesetzbuches als bekanntgemacht gilt, hat der andere Vertragsteil Sicherheit zu leisten, wenn sie sich binnen sechs Monaten nach der Bekanntmachung der Eintragung zu diesem Zweck bei ihm melden."
    },
    {
      "date": "2026-01-06",
      "id": "141655",
      "original_text": "Löschungsankündigung\nNordrhein-Westfalen Amtsgericht Dortmund HRB 35211\nMG Personalservice GmbH – Dortmund",
      "type": "Löschungsankündigung",
      "state": "Nordrhein-Westfalen",
      "amtsgericht": "Amtsgericht Dortmund",
      "registernummer": "HRB 35211",
      "registerart": "HRB",
      "company_name": "MG Personalservice GmbH",
      "company_seat": "Dortmund",
      "details": "06.01.2026 (Bekanntmachungsdatum)\n\nNordrhein-Westfalen Amtsgericht Dortmund HRB 35211\nLöschungsankündigung\n\nMG Personalservice GmbH\nGesellschaft mit beschränkter Haftung\nDortmund\n\nDas Registergericht beabsichtigt die Gesellschaft von Amts wegen nach § 394 FamFG zu löschen. Die Frist zur Erhebung eines Widerspruchs ist auf zwei Monate festgesetzt."
    },
    {
      "date": "2026-01-06",
      "id": "141656",
      "original_text": "Löschungsankündigung\nNordrhein-Westfalen Amtsgericht Kleve HRB 18748\nBurberg Verwaltungs GmbH – Moers",
      "type": "Löschungsankündigung",
      "state": "Nordrhein-Westfalen",
      "amtsgericht": "Amtsgericht Kleve",
      "registernummer": "HRB 18748",
      "registerart": "HRB",
      "company_name": "Burberg Verwaltungs GmbH",
      "company_seat": "Moers",
      "details": "06.01.2026 (Bekanntmachungsdatum)\n\nNordrhein-Westfalen Amtsgericht Kleve HRB 18748\nLöschungsankündigung\n\nBurberg Verwaltungs GmbH\nGesellschaft mit beschränkter Haftung\nMoers\n\nDas Registergericht beabsichtigt die Gesellschaft von Amts wegen nach § 394 FamFG zu löschen. Die Frist zur Erhebung eines Widerspruchs ist auf einen Monat festgesetzt."
    },
    {
      "date": "2026-01-06",
      "id": "141657",
      "original_text": "Löschungsankündigung\nNordrhein-Westfalen Amtsgericht Köln HRB 99543\nTime Living Europe GmbH – Köln",
      "type": "Löschungsankündigung",
      "state": "Nordrhein-Westfalen",
      "amtsgericht": "Amtsgericht Köln",
      "registernummer": "HRB 99543",
      "registerart": "HRB",
      "company_name": "Time Living Europe GmbH",
      "company_seat": "Köln",
      "details": "06.01.2026 (Bekanntmachungsdatum)\n\nNordrhein-Westfalen Amtsgericht Köln HRB 99543\nLöschungsankündigung\n\nTime Living Europe GmbH\nGesellschaft mit beschränkter Haftung\nKöln\n\nDas Registergericht beabsichtigt die Gesellschaft von Amts wegen nach § 394 FamFG zu löschen. Die Frist zur Erhebung eines Widerspruchs ist auf einen Monat festgesetzt."
    },
    {
      "date": "2026-01-06",
      "id": "141658",
      "original_text": "Sonstige Registerbekanntmachung\nNordrhein-Westfalen Amtsgericht Köln HRB 23027\nREWE Zentrale - Business Organisation GmbH – Köln",
      "type": "Sonstige Registerbekanntmachung",
      "state": "Nordrhein-Westfalen",
      "amtsgericht": "Amtsgericht Köln",
      "registernummer": "HRB 23027",
      "registerart": "HRB",
      "company_name": "REWE Zentrale - Business Organisation GmbH",
      "company_seat": "Köln",
      "details": "06.01.2026 (Bekanntmachungsdatum)\n\nNordrhein-Westfalen Amtsgericht Köln HRB 23027\nSonstige Registerbekanntmachung 06.01.2026 (Eintragungsdatum)\n\nREWE Zentrale - Business Organisation GmbH\nGesellschaft mit beschränkter Haftung\nKöln\n\nDen Gläubigern der Gesellschaft, deren Forderungen begründet worden sind bevor die Eintragung der Beendigung des Beherrschungs- und Gewinnabführungsvertrages  in das Handelsregister nach § 10 des Handelsgesetzbuches als bekanntgemacht gilt, hat der andere Vertragsteil Sicherheit zu leisten, wenn sie sich binnen sechs Monaten nach der Bekanntmachung der Eintragung zu diesem Zweck bei ihm melden."
    },
    {
      "date": "2026-01-06",
      "id": "141659",
      "original_text": "Registerbekanntmachung nach dem Umwandlungsgesetz\nNordrhein-Westfalen Amtsgericht Köln HRB 126138\nRapunzel Kinderhaus gGmbH – Kerpen",
      "type": "Registerbekanntmachung nach dem Umwandlungsgesetz",
      "state": "Nordrhein-Westfalen",
      "amtsgericht": "Amtsgericht Köln",
      "registernummer": "HRB 126138",
      "registerart": "HRB",
      "company_name": "Rapunzel Kinderhaus gGmbH",
      "company_seat": "Kerpen",
      "details": "06.01.2026 (Bekanntmachungsdatum)\n\nNordrhein-Westfalen Amtsgericht Köln HRB 126138\nRegisterbekanntmachung nach dem Umwandlungsgesetz 06.01.2026 (Eintragungsdatum)\n\nRapunzel Kinderhaus gGmbH\nGesellschaft mit beschränkter Haftung\nKerpen\n\nDen Gläubigern der an der formwechselnden Umwandlung beteiligten Rechtsträger ist, wenn sie binnen sechs Monaten nach dem Tag, an dem die Eintragung der formwechselnden Umwandlung in das Register des Sitzes desjenigen Rechtsträgers, dessen Gläubiger sie sind, nach § 19 Absatz 3 UmwG als bekanntgemacht gilt, ihren Anspruch nach Grund und Höhe schriftlich anmelden, Sicherheit zu leisten, soweit sie nicht Befriedigung verlangen können. Dieses Recht steht den Gläubigern jedoch nur zu, wenn sie glaubhaft machen, dass durch die formwechselnden Umwandlung die Erfüllung ihrer Forderung gefährdet wird."
    },
    {
      "date": "2026-01-06",
      "id": "141660",
      "original_text": "Einreichung neuer Dokumente\nNordrhein-Westfalen Amtsgericht Dortmund HRB 36588\nKlöpper-Therm GmbH – Dortmund",
      "type": "Einreichung neuer Dokumente",
      "state": "Nordrhein-Westfalen",
      "amtsgericht": "Amtsgericht Dortmund",
      "registernummer": "HRB 36588",
      "registerart": "HRB",
      "company_name": "Klöpper-Therm GmbH",
      "company_seat": "Dortmund",
      "details": "06.01.2026 (Bekanntmachungsdatum)\n\nNordrhein-Westfalen Amtsgericht Dortmund HRB 36588\nEinreichung neuer Dokumente\n\nKlöpper-Therm GmbH\nGesellschaft mit beschränkter Haftung\nDortmund\n\nDem Registergericht ist eine Liste der Mitglieder des Aufsichtsrates eingereicht worden."
    },
    {
      "date": "2026-01-06",
      "id": "141661",
      "original_text": "Löschungsankündigung\nNordrhein-Westfalen Amtsgericht Wuppertal HRB 23410\nM & W inside UG (haftungsbeschränkt) – Wülfrath",
      "type": "Löschungsankündigung",
      "state": "Nordrhein-Westfalen",
      "amtsgericht": "Amtsgericht Wuppertal",
      "registernummer": "HRB 23410",
      "registerart": "HRB",
      "company_name": "M & W inside UG (haftungsbeschränkt)",
      "company_seat": "Wülfrath",
      "details": "06.01.2026 (Bekanntmachungsdatum)\n\nNordrhein-Westfalen Amtsgericht Wuppertal HRB 23410\nLöschungsankündigung\n\nM & W inside UG (haftungsbeschränkt)\nGesellschaft mit beschränkter Haftung\nWülfrath\n\nDas Registergericht beabsichtigt die Gesellschaft von Amts wegen nach § 394 FamFG zu löschen. Die Frist zur Erhebung eines Widerspruchs ist auf einen Monat festgesetzt."
    },
    {
      "date": "2026-01-06",
      "id": "141662",
      "original_text": "Einreichung neuer Dokumente\nNordrhein-Westfalen Amtsgericht Köln HRB 88066\nRegionalwert AG Rheinland – Köln",
      "type": "Einreichung neuer Dokumente",
      "state": "Nordrhein-Westfalen",
      "amtsgericht": "Amtsgericht Köln",
      "registernummer": "HRB 88066",
      "registerart": "HRB",
      "company_name": "Regionalwert AG Rheinland",
      "company_seat": "Köln",
      "details": "06.01.2026 (Bekanntmachungsdatum)\n\nNordrhein-Westfalen Amtsgericht Köln HRB 88066\nEinreichung neuer Dokumente\n\nRegionalwert AG Rheinland\nAktiengesellschaft\nKöln\n\nDem Registergericht ist eine Liste der Mitglieder des Aufsichtsrates eingereicht worden."
    },
    {
      "date": "2026-01-06",
      "id": "141663",
      "original_text": "Sonstige Registerbekanntmachung\nNordrhein-Westfalen Amtsgericht Köln HRB 78863\nGP Payments Acquiring International GmbH – Köln",
      "type": "Sonstige Registerbekanntmachung",
      "state": "Nordrhein-Westfalen",
      "amtsgericht": "Amtsgericht Köln",
      "registernummer": "HRB 78863",
      "registerart": "HRB",
      "company_name": "GP Payments Acquiring International GmbH",
      "company_seat": "Köln",
      "details": "06.01.2026 (Bekanntmachungsdatum)\n\nNordrhein-Westfalen Amtsgericht Köln HRB 78863\nSonstige Registerbekanntmachung 06.01.2026 (Eintragungsdatum)\n\nGP Payments Acquiring International GmbH\nGesellschaft mit beschränkter Haftung\nKöln\n\nAls nicht eingetragen wird veröffentlicht: Den Gläubigern der Gesellschaft, deren Forderungen begründet worden sind bevor die Eintragung der Beendigung des Beherrschungs- und Gewinnabführungsvertrages  in das Handelsregister nach § 10 des Handelsgesetzbuches als bekanntgemacht gilt, hat der andere Vertragsteil Sicherheit zu leisten, wenn sie sich binnen sechs Monaten nach der Bekanntmachung der Eintragung zu diesem Zweck bei ihm melden."
    },
    {
      "date": "2026-01-06",
      "id": "141664",
      "original_text": "Löschungsankündigung\nNordrhein-Westfalen Amtsgericht Mönchengladbach HRB 21548\nGaLa EN Dienstleistungs GmbH – Mönchengladbach",
      "type": "Löschungsankündigung",
      "state": "Nordrhein-Westfalen",
      "amtsgericht": "Amtsgericht Mönchengladbach",
      "registernummer": "HRB 21548",
      "registerart": "HRB",
      "company_name": "GaLa EN Dienstleistungs GmbH",
      "company_seat": "Mönchengladbach",
      "details": "06.01.2026 (Bekanntmachungsdatum)\n\nNordrhein-Westfalen Amtsgericht Mönchengladbach HRB 21548\nLöschungsankündigung 06.01.2026 (Eintragungsdatum)\n\nGaLa EN Dienstleistungs GmbH\nGesellschaft mit beschränkter Haftung\nMönchengladbach\n\nDas Registergericht beabsichtigt, die im Handelsregister eingetragene Gesellschaft gemäß § 394 Absatz 1 FamFG wegen Vermögenslosigkeit von Amts wegen zu löschen. Gegen diese Verfügung kann Widerspruch eingelegt werden. Die Frist zur Erhebung eines Widerspruchs gegen die beabsichtigte Löschung von Amts wegen ist auf drei Monate festgesetzt."
    },
    {
      "date": "2026-01-06",
      "id": "141665",
      "original_text": "Löschungsankündigung\nNordrhein-Westfalen Amtsgericht Bochum HRB 20012\nWerner UG (haftungsbeschränkt) – Herne",
      "type": "Löschungsankündigung",
      "state": "Nordrhein-Westfalen",
      "amtsgericht": "Amtsgericht Bochum",
      "registernummer": "HRB 20012",
      "registerart": "HRB",
      "company_name": "Werner UG (haftungsbeschränkt)",
      "company_seat": "Herne",
      "details": "06.01.2026 (Bekanntmachungsdatum)\n\nNordrhein-Westfalen Amtsgericht Bochum HRB 20012\nLöschungsankündigung\n\nWerner UG (haftungsbeschränkt)\nGesellschaft mit beschränkter Haftung\nHerne\n\nDas Registergericht beabsichtigt die Gesellschaft von Amts wegen nach § 394 FamFG zu löschen. Die Frist zur Erhebung eines Widerspruchs ist auf drei Monate festgesetzt."
    },
    {
      "date": "2026-01-06",
      "id": "141666",
      "original_text": "Löschungsankündigung\nNordrhein-Westfalen Amtsgericht Bochum HRB 20012\nWerner UG (haftungsbeschränkt) – Herne",
      "type": "Löschungsankündigung",
      "state": "Nordrhein-Westfalen",
      "amtsgericht": "Amtsgericht Bochum",
      "registernummer": "HRB 20012",
      "registerart": "HRB",
      "company_name": "Werner UG (haftungsbeschränkt)",
      "company_seat": "Herne",
      "details": "06.01.2026 (Bekanntmachungsdatum)\n\nNordrhein-Westfalen Amtsgericht Bochum HRB 20012\nLöschungsankündigung\n\nWerner UG (haftungsbeschränkt)\nGesellschaft mit beschränkter Haftung\nHerne\n\nDas Registergericht beabsichtigt die Gesellschaft von Amts wegen nach § 394 FamFG zu löschen. Die Frist zur Erhebung eines Widerspruchs ist auf drei Monate festgesetzt."
    },
    {
      "date": "2026-01-06",
      "id": "141667",
      "original_text": "Sonstige Registerbekanntmachung\nNordrhein-Westfalen Amtsgericht Lemgo HRB 8341\nExklusiv Immobilien GmbH – Detmold",
      "type": "Sonstige Registerbekanntmachung",
      "state": "Nordrhein-Westfalen",
      "amtsgericht": "Amtsgericht Lemgo",
      "registernummer": "HRB 8341",
      "registerart": "HRB",
      "company_name": "Exklusiv Immobilien GmbH",
      "company_seat": "Detmold",
      "details": "06.01.2026 (Bekanntmachungsdatum)\n\nNordrhein-Westfalen Amtsgericht Lemgo HRB 8341\nSonstige Registerbekanntmachung 06.01.2026 (Eintragungsdatum)\n\nExklusiv Immobilien GmbH\nGesellschaft mit beschränkter Haftung\nDetmold\n\nAls nicht eingetragen wird veröffentlicht: Den Gläubigern der Gesellschaft, deren Forderungen begründet worden sind bevor die Eintragung der Beendigung des Beherrschungs- und Gewinnabführungsvertrages  in das Handelsregister nach § 10 des Handelsgesetzbuches als bekanntgemacht gilt, hat der andere Vertragsteil Sicherheit zu leisten, wenn sie sich binnen sechs Monaten nach der Bekanntmachung der Eintragung zu diesem Zweck bei ihm melden."
    },
    {
      "date": "2026-01-06",
      "id": "141668",
      "original_text": "Löschungsankündigung\nNordrhein-Westfalen Amtsgericht Münster HRB 11597\nTiptopstein GmbH – Münster",
      "type": "Löschungsankündigung",
      "state": "Nordrhein-Westfalen",
      "amtsgericht": "Amtsgericht Münster",
      "registernummer": "HRB 11597",
      "registerart": "HRB",
      "company_name": "Tiptopstein GmbH",
      "company_seat": "Münster",
      "details": "06.01.2026 (Bekanntmachungsdatum)\n\nNordrhein-Westfalen Amtsgericht Münster HRB 11597\nLöschungsankündigung\n\nTiptopstein GmbH\nGesellschaft mit beschränkter Haftung\nMünster\n\nDas Registergericht beabsichtigt die Gesellschaft von Amts wegen nach § 394 FamFG zu löschen. Die Frist zur Erhebung eines Widerspruchs ist auf 3 Wochen festgesetzt.\n\nRechtbehelfsbelehrung:\n\nGegen diese Verfügung können Sie Widerspruch einlegen.\n\nDer Widerspruch ist bei dem Amtsgericht Münster, Gerichtsstraße 2 bis 6, 48149 Münster schriftlich in deutscher Sprache oder zur Niederschrift der Geschäftsstelle eines jeden Amtsgerichtes abgegeben werden.\nDie Einlegung ist auch durch Übertragung eines elektronischen Dokuments an die elektronische Poststelle des Gerichts möglich. Das elektronische Dokument muss für die Bearbeitung durch das Gericht geeignet und mit einer qualifizierten elektronischen Signatur der verantwortenden Person versehen sein oder von der verantwortenden Person signiert und auf einem sicheren Übermittlungsweg gem. § 130a ZPO nach nähere Maßgabe der Verordnung über die technischen Rahmenbedingungen des elektronischen Rechtsverkehrs und über das besondere elektronische Behördenpostfach (BGBI. I. S.3808) eingereicht werden. Weitere Informationen erhalten Sie auf der Internetseite www.justiz.de.\n\nDer Widerspruch muss spätestens innerhalb der gesetzten Frist nach der schriftlichen Bekanntgabe der Verfügung bei dem Amtsgericht Münster eingegangen sein. Dies gilt auch dann, wenn der Widerspruch zur Niederschrift der Geschäftsstelle eines anderen Amtsgerichtes abgegeben wurde. Die Frist beginnt mit der schriftlichen Bekanntgabe der Verfügung, spätestens mit Ablauf von fünf Monaten nach Erlass der Verfügung. Die Bekanntgabe ist entweder durch Zustellung oder am dritten Tage nach Aufgabe zur Post bewirkt. Fällt das Ende der First auf einen Sonntag, einen allgemeinen Feiertag oder Sonnabend, so endet die Frist mit Ablauf des nächsten Werktages.\n\nDer Widerspruch muss die Bezeichnung der angefochtenen Verfügung sowie die Erklärung enthalten, dass Widerspruch gegen diese Verfügung eingelegt wird. Er ist zu unterzeichnen  und soll begründet werden."
    },
    {
      "date": "2026-01-06",
      "id": "141669",
      "original_text": "Löschungsankündigung\nNordrhein-Westfalen Amtsgericht Düsseldorf HRB 53026\nDSB Bank N.V. Niederlassung Deutschland – Düsseldorf",
      "type": "Löschungsankündigung",
      "state": "Nordrhein-Westfalen",
      "amtsgericht": "Amtsgericht Düsseldorf",
      "registernummer": "HRB 53026",
      "registerart": "HRB",
      "company_name": "DSB Bank N.V. Niederlassung Deutschland",
      "company_seat": "Düsseldorf",
      "details": "06.01.2026 (Bekanntmachungsdatum)\n\nNordrhein-Westfalen Amtsgericht Düsseldorf HRB 53026\nLöschungsankündigung\n\nDSB Bank N.V. Niederlassung Deutschland\nRechtsform ausländischen Rechts HRB\nDüsseldorf\n\nEs ist beabsichtigt, die Eintragung der Zweigniederlassung wegen Wegfalls der rechtlichen Existenz der Gesellschaft und damit unzulässig gewordener Eintragung aufgrund des § 395 FamFG zu löschen.\n\nFrist zu Geltendmachung eines etwaigen Widerspruchs: 3 Wochen.\n\nRechtsbehelfsbelehrung:\nDas Widerspruchsrecht steht jedem zu, der an der Unterlassung der Löschung ein berechtigtes Interesse hat. Der Widerspruch ist bei dem Amtsgericht Düsseldorf -Registergericht-, Werdener Straße 1, 40227 Düsseldorf schriftlich in deutscher Sprache oder zur Niederschrift der Geschäftsstelle einzulegen. Der Widerspruch kann auch zur Niederschrift der Geschäftsstelle eines jeden Amtsgerichtes abgegeben werden. Die Einlegung ist auch durch Übertragung eines elektronischen Dokuments an die elektronische Poststelle des Gerichts möglich. Das elektronische Dokument muss für die Bearbeitung durch das Gericht geeignet und mit einer qualifizierten elektronischen Signatur der verantwortenden Person versehen sein oder von der verantwortenden Person signiert und auf einem sicheren Übermittlungsweg gemäß § 130a ZPO nach näherer Maßgabe der Verordnung über die technischen Rahmenbedingungen des elektronischen Rechtsverkehrs und über das besondere elektronische Behördenpostfach (BGBl. I, S.3803) eingereicht werden. Weitere Informationen erhalten Sie auf der Internetseite www.justiz.de.\nDer Widerspruch muss spätestens innerhalb der gesetzten Frist nach dem Datum der Bekanntmachung der Löschungsankündigung bei dem Amtsgericht - Registergericht - Düsseldorf eingegangen sein.  Dies gilt auch dann, wenn der Widerspruch zur Niederschrift der Geschäftsstelle eines anderen Amtsgerichtes abgegeben wurde. Die Frist beginnt mit dem Tage der Bekanntmachung der Löschungsankündigung in dem für die Bekanntmachung der Eintragungen in das Handelsregister bestimmten elektronischen Informations- und Kommunikationssystem nach § 10 des Handelsgesetzbuches. Fällt das Ende der Frist auf einen Sonntag, einen allgemeinen Feiertag oder Sonnabend, so endet die Frist mit Ablauf des nächsten Werktages.\nDer Widerspruch muss die Bezeichnung der angefochtenen Löschungsankündigung sowie die Erklärung enthalten, dass Widerspruch gegen diese Löschungsankündigung eingelegt wird. Er ist zu unterzeichnen und soll begründet werden."
    },
    {
      "date": "2026-01-06",
      "id": "141670",
      "original_text": "Registerbekanntmachung nach dem Umwandlungsgesetz\nHessen Amtsgericht Fulda HRB 7358\nTMB Immo-Verwaltungs-GmbH – Dipperz",
      "type": "Registerbekanntmachung nach dem Umwandlungsgesetz",
      "state": "Hessen",
      "amtsgericht": "Amtsgericht Fulda",
      "registernummer": "HRB 7358",
      "registerart": "HRB",
      "company_name": "TMB Immo-Verwaltungs-GmbH",
      "company_seat": "Dipperz",
      "details": "06.01.2026 (Bekanntmachungsdatum)\n\nHessen Amtsgericht Fulda HRB 7358\nRegisterbekanntmachung nach dem Umwandlungsgesetz 06.01.2026 (Eintragungsdatum)\n\nTMB Immo-Verwaltungs-GmbH\nGesellschaft mit beschränkter Haftung\nDipperz\n\nDen Gläubigern der an der formwechselnden Umwandlung beteiligten Rechtsträger ist, wenn sie binnen sechs Monaten nach dem Tag, an dem die Eintragung der formwechselnden Umwandlung in das Register des Sitzes desjenigen Rechtsträgers, dessen Gläubiger sie sind, nach § 201 UmwG bekannt gemacht worden ist, ihren Anspruch nach Grund und Höhe schriftlich anmelden, Sicherheit zu leisten, soweit sie nicht Befriedigung verlangen können. Dieses Recht steht den Gläubigern jedoch nur zu, wenn sie glaubhaft machen, dass durch die formwechselnden Umwandlung die Erfüllung ihrer Forderung gefährdet wird."
    },
    {
      "date": "2026-01-06",
      "id": "141671",
      "original_text": "Löschungsankündigung\nHessen Amtsgericht Frankfurt am Main HRB 89048\nProjekt Cargo GmbH – Frankfurt am Main",
      "type": "Löschungsankündigung",
      "state": "Hessen",
      "amtsgericht": "Amtsgericht Frankfurt am Main",
      "registernummer": "HRB 89048",
      "registerart": "HRB",
      "company_name": "Projekt Cargo GmbH",
      "company_seat": "Frankfurt am Main",
      "details": "06.01.2026 (Bekanntmachungsdatum)\n\nHessen Amtsgericht Frankfurt am Main HRB 89048\nLöschungsankündigung\n\nProjekt Cargo GmbH\nGesellschaft mit beschränkter Haftung\nFrankfurt am Main\n\nEs ist beabsichtigt die Gesellschaft wegen Vermögenslosigkeit gemäß § 394 FamFG von Amts wegen zu löschen. Hiergegen kann innerhalb eines Monats nach dieser Veröffentlichung Widerspruch bei dem Amtsgericht Frankfurt am Main eingelegt werden."
    },
    {
      "date": "2026-01-06",
      "id": "141672",
      "original_text": "Registerbekanntmachung nach dem Umwandlungsgesetz\nHessen Amtsgericht Frankfurt am Main HRB 110958\nCEVA Warehousing Germany GmbH – Frankfurt am Main",
      "type": "Registerbekanntmachung nach dem Umwandlungsgesetz",
      "state": "Hessen",
      "amtsgericht": "Amtsgericht Frankfurt am Main",
      "registernummer": "HRB 110958",
      "registerart": "HRB",
      "company_name": "CEVA Warehousing Germany GmbH",
      "company_seat": "Frankfurt am Main",
      "details": "06.01.2026 (Bekanntmachungsdatum)\n\nHessen Amtsgericht Frankfurt am Main HRB 110958\nRegisterbekanntmachung nach dem Umwandlungsgesetz 06.01.2026 (Eintragungsdatum)\n\nCEVA Warehousing Germany GmbH\nGesellschaft mit beschränkter Haftung\nFrankfurt am Main\n\nDen Gläubigern der an der Verschmelzung beteiligten Rechtsträger ist, wenn sie binnen sechs Monaten nach dem Tag, an dem die Eintragung der Verschmelzung in das Register des Sitzes desjenigen Rechtsträgers, dessen Gläubiger sie sind, nach § 19 Absatz 3 UmwG bekannt gemacht worden ist, ihren Anspruch nach Grund und Höhe schriftlich anmelden, Sicherheit zu leisten, soweit sie nicht Befriedigung verlangen können. Dieses Recht steht den Gläubigern jedoch nur zu, wenn sie glaubhaft machen, dass durch die Verschmelzung die Erfüllung ihrer Forderung gefährdet wird."
    },
    {
      "date": "2026-01-06",
      "id": "141673",
      "original_text": "Einreichung neuer Dokumente\nHessen Amtsgericht Bad Homburg v.d.H. HRB 9360\nIVC Venture Capital Aktiengesellschaft – Bad Homburg v.d.Höhe",
      "type": "Einreichung neuer Dokumente",
      "state": "Hessen",
      "amtsgericht": "Amtsgericht Bad Homburg v.d.H.",
      "registernummer": "HRB 9360",
      "registerart": "HRB",
      "company_name": "IVC Venture Capital Aktiengesellschaft",
      "company_seat": "Bad Homburg v.d.Höhe",
      "details": "06.01.2026 (Bekanntmachungsdatum)\n\nHessen Amtsgericht Bad Homburg v.d.H. HRB 9360\nEinreichung neuer Dokumente\n\nIVC Venture Capital Aktiengesellschaft\nAktiengesellschaft\nBad Homburg v.d.Höhe\n\nDurch eine Änderung in den Personen der Aufsichtsratsmitglieder ist eine Liste der Mitglieder des Aufsichtsrates zum Handelsregister eingereicht worden."
    },
    {
      "date": "2026-01-06",
      "id": "141674",
      "original_text": "Registerbekanntmachung nach dem Umwandlungsgesetz\nHessen Amtsgericht Frankfurt am Main HRB 37262\nDEGESILVA Grundstücksverwaltungsgesellschaft mbH – Eschborn",
      "type": "Registerbekanntmachung nach dem Umwandlungsgesetz",
      "state": "Hessen",
      "amtsgericht": "Amtsgericht Frankfurt am Main",
      "registernummer": "HRB 37262",
      "registerart": "HRB",
      "company_name": "DEGESILVA Grundstücksverwaltungsgesellschaft mbH",
      "company_seat": "Eschborn",
      "details": "06.01.2026 (Bekanntmachungsdatum)\n\nHessen Amtsgericht Frankfurt am Main HRB 37262\nRegisterbekanntmachung nach dem Umwandlungsgesetz 06.01.2026 (Eintragungsdatum)\n\nDEGESILVA Grundstücksverwaltungsgesellschaft mbH\nGesellschaft mit beschränkter Haftung\nEschborn\n\nDen Gläubigern der an der Verschmelzung beteiligten Rechtsträger ist, wenn sie binnen sechs Monaten nach dem Tag, an dem die Eintragung der Verschmelzung in das Register des Sitzes desjenigen Rechtsträgers, dessen Gläubiger sie sind, nach § 19 Absatz 3 UmwG bekannt gemacht worden ist, ihren Anspruch nach Grund und Höhe schriftlich anmelden, Sicherheit zu leisten, soweit sie nicht Befriedigung verlangen können. Dieses Recht steht den Gläubigern jedoch nur zu, wenn sie glaubhaft machen, dass durch die Verschmelzung die Erfüllung ihrer Forderung gefährdet wird."
    },
    {
      "date": "2026-01-06",
      "id": "141675",
      "original_text": "Sonstige Registerbekanntmachung\nHessen Amtsgericht Wetzlar VR 4757\nLost in Music e. V. – Herborn",
      "type": "Sonstige Registerbekanntmachung",
      "state": "Hessen",
      "amtsgericht": "Amtsgericht Wetzlar",
      "registernummer": "VR 4757",
      "registerart": "VR",
      "company_name": "Lost in Music e. V.",
      "company_seat": "Herborn",
      "details": "06.01.2026 (Bekanntmachungsdatum)\n\nHessen Amtsgericht Wetzlar VR 4757\nSonstige Registerbekanntmachung 06.01.2026 (Eintragungsdatum)\n\nLost in Music e. V.\neingetragener Verein\nHerborn\n\nDer Verein ist aufgelöst."
    },
    {
      "date": "2026-01-06",
      "id": "141676",
      "original_text": "Registerbekanntmachung nach dem Umwandlungsgesetz\nHessen Amtsgericht Fulda GsR 224\nTMB Immo-Verwaltungs-eGbR – Dipperz",
      "type": "Registerbekanntmachung nach dem Umwandlungsgesetz",
      "state": "Hessen",
      "amtsgericht": "Amtsgericht Fulda",
      "registernummer": "GsR 224",
      "registerart": "GsR",
      "company_name": "TMB Immo-Verwaltungs-eGbR",
      "company_seat": "Dipperz",
      "details": "06.01.2026 (Bekanntmachungsdatum)\n\nHessen Amtsgericht Fulda GsR 224\nRegisterbekanntmachung nach dem Umwandlungsgesetz 06.01.2026 (Eintragungsdatum)\n\nTMB Immo-Verwaltungs-eGbR\nGesellschaft bürgerlichen Rechts\nDipperz\n\nDen Gläubigern der an der formwechselnden Umwandlung beteiligten Rechtsträger ist, wenn sie binnen sechs Monaten nach dem Tag, an dem die Eintragung der formwechselnden Umwandlung in das Register des Sitzes desjenigen Rechtsträgers, dessen Gläubiger sie sind, nach § 201 UmwG bekannt gemacht worden ist, ihren Anspruch nach Grund und Höhe schriftlich anmelden, Sicherheit zu leisten, soweit sie nicht Befriedigung verlangen können. Dieses Recht steht den Gläubigern jedoch nur zu, wenn sie glaubhaft machen, dass durch die formwechselnden Umwandlung die Erfüllung ihrer Forderung gefährdet wird."
    },
    {
      "date": "2026-01-06",
      "id": "141677",
      "original_text": "Sonstige Registerbekanntmachung\nHessen Amtsgericht Frankfurt am Main HRB 9724\nSVG Autohof Beratung & Services GmbH – Frankfurt am Main",
      "type": "Sonstige Registerbekanntmachung",
      "state": "Hessen",
      "amtsgericht": "Amtsgericht Frankfurt am Main",
      "registernummer": "HRB 9724",
      "registerart": "HRB",
      "company_name": "SVG Autohof Beratung & Services GmbH",
      "company_seat": "Frankfurt am Main",
      "details": "06.01.2026 (Bekanntmachungsdatum)\n\nHessen Amtsgericht Frankfurt am Main HRB 9724\nSonstige Registerbekanntmachung 06.01.2026 (Eintragungsdatum)\n\nSVG Autohof Beratung & Services GmbH\nGesellschaft mit beschränkter Haftung\nFrankfurt am Main\n\nDie Gesellschaft hat Gläubigern, deren Forderungen vor dieser Bekanntmachung begründet worden sind, Sicherheit zu leisten, soweit sie nicht Befriedigung verlangen können, wenn sie sich binnen sechs Monaten nach dieser Bekanntmachung zu diesem Zweck melden."
    },
    {
      "date": "2026-01-06",
      "id": "141678",
      "original_text": "Sonstige Registerbekanntmachung\nHessen Amtsgericht Wetzlar VR 3331\nSpielgemeinschaft Arborn-Münchhausen – Greifenstein-Arborn",
      "type": "Sonstige Registerbekanntmachung",
      "state": "Hessen",
      "amtsgericht": "Amtsgericht Wetzlar",
      "registernummer": "VR 3331",
      "registerart": "VR",
      "company_name": "Spielgemeinschaft Arborn-Münchhausen",
      "company_seat": "Greifenstein-Arborn",
      "details": "06.01.2026 (Bekanntmachungsdatum)\n\nHessen Amtsgericht Wetzlar VR 3331\nSonstige Registerbekanntmachung 06.01.2026 (Eintragungsdatum)\n\nSpielgemeinschaft Arborn-Münchhausen\neingetragener Verein\nGreifenstein-Arborn\n\nDer Verein ist aufgelöst und erloschen."
    },
    {
      "date": "2026-01-06",
      "id": "141679",
      "original_text": "Löschungsankündigung\nHessen Amtsgericht Hanau HRB 97534\nDMP-Baudrei UG (haftungsbeschränkt) – Linsengericht",
      "type": "Löschungsankündigung",
      "state": "Hessen",
      "amtsgericht": "Amtsgericht Hanau",
      "registernummer": "HRB 97534",
      "registerart": "HRB",
      "company_name": "DMP-Baudrei UG (haftungsbeschränkt)",
      "company_seat": "Linsengericht",
      "details": "06.01.2026 (Bekanntmachungsdatum)\n\nHessen Amtsgericht Hanau HRB 97534\nLöschungsankündigung\n\nDMP-Baudrei UG (haftungsbeschränkt)\nGesellschaft mit beschränkter Haftung\nLinsengericht\n\nDas Registergericht beabsichtigt die im Handelsregister eingetragene Gesellschaft von Amts wegen nach § 394 FamFG zu löschen. Die Frist zur Erhebung eines Widerspruchs gegen die beabsichtigte Löschung wird auf 3 Monate festgesetzt."
    },
    {
      "date": "2026-01-06",
      "id": "141680",
      "original_text": "Registerbekanntmachung nach dem Umwandlungsgesetz\nHessen Amtsgericht Frankfurt am Main HRB 22009\nDURO Grundstücksverwaltungsgesellschaft mbH – Eschborn",
      "type": "Registerbekanntmachung nach dem Umwandlungsgesetz",
      "state": "Hessen",
      "amtsgericht": "Amtsgericht Frankfurt am Main",
      "registernummer": "HRB 22009",
      "registerart": "HRB",
      "company_name": "DURO Grundstücksverwaltungsgesellschaft mbH",
      "company_seat": "Eschborn",
      "details": "06.01.2026 (Bekanntmachungsdatum)\n\nHessen Amtsgericht Frankfurt am Main HRB 22009\nRegisterbekanntmachung nach dem Umwandlungsgesetz 06.01.2026 (Eintragungsdatum)\n\nDURO Grundstücksverwaltungsgesellschaft mbH\nGesellschaft mit beschränkter Haftung\nEschborn\n\nDen Gläubigern der an der Verschmelzung beteiligten Rechtsträger ist, wenn sie binnen sechs Monaten nach dem Tag, an dem die Eintragung der Verschmelzung in das Register des Sitzes desjenigen Rechtsträgers, dessen Gläubiger sie sind, nach § 19 Absatz 3 UmwG bekannt gemacht worden ist, ihren Anspruch nach Grund und Höhe schriftlich anmelden, Sicherheit zu leisten, soweit sie nicht Befriedigung verlangen können. Dieses Recht steht den Gläubigern jedoch nur zu, wenn sie glaubhaft machen, dass durch die Verschmelzung die Erfüllung ihrer Forderung gefährdet wird."
    },
    {
      "date": "2026-01-06",
      "id": "141681",
      "original_text": "Löschungsankündigung\nHessen Amtsgericht Wiesbaden HRB 29578\nClean Karwen GmbH – Wiesbaden",
      "type": "Löschungsankündigung",
      "state": "Hessen",
      "amtsgericht": "Amtsgericht Wiesbaden",
      "registernummer": "HRB 29578",
      "registerart": "HRB",
      "company_name": "Clean Karwen GmbH",
      "company_seat": "Wiesbaden",
      "details": "06.01.2026 (Bekanntmachungsdatum)\n\nHessen Amtsgericht Wiesbaden HRB 29578\nLöschungsankündigung\n\nClean Karwen GmbH\nGesellschaft mit beschränkter Haftung\nWiesbaden\n\nDas Registergericht beabsichtigt die im Handelsregister eingetragene Gesellschaft von Amts wegen nach § 394 FamFG zu löschen. Die Frist zur Erhebung eines Widerspruchs gegen die beabsichtigte Löschung wird auf 3 Monate festgesetzt."
    },
    {
      "date": "2026-01-06",
      "id": "141682",
      "original_text": "Löschungsankündigung\nHessen Amtsgericht Offenbach am Main HRB 53558\nFLIPPER GMBH – Neu-Isenburg",
      "type": "Löschungsankündigung",
      "state": "Hessen",
      "amtsgericht": "Amtsgericht Offenbach am Main",
      "registernummer": "HRB 53558",
      "registerart": "HRB",
      "company_name": "FLIPPER GMBH",
      "company_seat": "Neu-Isenburg",
      "details": "06.01.2026 (Bekanntmachungsdatum)\n\nHessen Amtsgericht Offenbach am Main HRB 53558\nLöschungsankündigung\n\nFLIPPER GMBH\nGesellschaft mit beschränkter Haftung\nNeu-Isenburg\n\nDas Registergericht beabsichtigt die im Handelsregister eingetragene Gesellschaft von Amts wegen nach § 394 FamFG zu löschen. Die Frist zur Erhebung eines Widerspruchs gegen die beabsichtigte Löschung wird auf 3 Monate festgesetzt."
    },
    {
      "date": "2026-01-06",
      "id": "141683",
      "original_text": "Registerbekanntmachung nach dem Umwandlungsgesetz\nHessen Amtsgericht Frankfurt am Main HRB 79325\nCEVA Logistics GmbH – Frankfurt am Main",
      "type": "Registerbekanntmachung nach dem Umwandlungsgesetz",
      "state": "Hessen",
      "amtsgericht": "Amtsgericht Frankfurt am Main",
      "registernummer": "HRB 79325",
      "registerart": "HRB",
      "company_name": "CEVA Logistics GmbH",
      "company_seat": "Frankfurt am Main",
      "details": "06.01.2026 (Bekanntmachungsdatum)\n\nHessen Amtsgericht Frankfurt am Main HRB 79325\nRegisterbekanntmachung nach dem Umwandlungsgesetz 06.01.2026 (Eintragungsdatum)\n\nCEVA Logistics GmbH\nGesellschaft mit beschränkter Haftung\nFrankfurt am Main\n\nDen Gläubigern der an der Verschmelzung beteiligten Rechtsträger ist, wenn sie binnen sechs Monaten nach dem Tag, an dem die Eintragung der Verschmelzung in das Register des Sitzes desjenigen Rechtsträgers, dessen Gläubiger sie sind, nach § 19 Absatz 3 UmwG bekannt gemacht worden ist, ihren Anspruch nach Grund und Höhe schriftlich anmelden, Sicherheit zu leisten, soweit sie nicht Befriedigung verlangen können. Dieses Recht steht den Gläubigern jedoch nur zu, wenn sie glaubhaft machen, dass durch die Verschmelzung die Erfüllung ihrer Forderung gefährdet wird."
    },
    {
      "date": "2026-01-06",
      "id": "141684",
      "original_text": "Sonstige Registerbekanntmachung\nHessen Amtsgericht Frankfurt am Main HRB 84012\nBundesliga International GmbH – Frankfurt am Main",
      "type": "Sonstige Registerbekanntmachung",
      "state": "Hessen",
      "amtsgericht": "Amtsgericht Frankfurt am Main",
      "registernummer": "HRB 84012",
      "registerart": "HRB",
      "company_name": "Bundesliga International GmbH",
      "company_seat": "Frankfurt am Main",
      "details": "06.01.2026 (Bekanntmachungsdatum)\n\nHessen Amtsgericht Frankfurt am Main HRB 84012\nSonstige Registerbekanntmachung\n\nBundesliga International GmbH\nGesellschaft mit beschränkter Haftung\nFrankfurt am Main\n\nDurch eine Änderung in den Personen der Aufsichtsratsmitglieder ist eine Liste der Mitglieder des Aufsichtsrates zum Handelsregister eingereicht worden."
    }
  ]
}