{
  "date": "2026-01-27",
  "date_of_scrape": "2026-01-28T04:25:49.814Z",
  "tool_version": "0.2.0",
  "number_of_announcements": 126,
  "announcements": [
    {
      "date": "2026-01-27",
      "id": "143482",
      "original_text": "Einreichung neuer Dokumente\nBayern Amtsgericht Regensburg HRB 9324\nDEMA Deutsche Versicherungsmakler Aktiengesellschaft – Regensburg",
      "type": "Einreichung neuer Dokumente",
      "state": "Bayern",
      "amtsgericht": "Amtsgericht Regensburg",
      "registernummer": "HRB 9324",
      "registerart": "HRB",
      "company_name": "DEMA Deutsche Versicherungsmakler Aktiengesellschaft",
      "company_seat": "Regensburg",
      "details": "27.01.2026 (Bekanntmachungsdatum)\n\nBayern Amtsgericht Regensburg HRB 9324\nEinreichung neuer Dokumente\n\nDEMA Deutsche Versicherungsmakler Aktiengesellschaft\nAktiengesellschaft\nRegensburg\n\nDem Amtsgericht Regensburg -Registergericht- ist eine Liste der Mitglieder des Aufsichtsrats eingereicht worden, § 106 AktG."
    },
    {
      "date": "2026-01-27",
      "id": "143483",
      "original_text": "Sonstige Registerbekanntmachung\nBayern Amtsgericht München HRB 297819\nTekkMinds AG – München",
      "type": "Sonstige Registerbekanntmachung",
      "state": "Bayern",
      "amtsgericht": "Amtsgericht München",
      "registernummer": "HRB 297819",
      "registerart": "HRB",
      "company_name": "TekkMinds AG",
      "company_seat": "München",
      "details": "27.01.2026 (Bekanntmachungsdatum)\n\nBayern Amtsgericht München HRB 297819\nSonstige Registerbekanntmachung 26.01.2026 (Eintragungsdatum)\n\nTekkMinds AG\nAktiengesellschaft\nMünchen\n\nDem Amtsgericht München -Registergericht- ist eine Liste der Mitglieder des Aufsichtsrats eingereicht worden, § 106 AktG."
    },
    {
      "date": "2026-01-27",
      "id": "143484",
      "original_text": "Löschungsankündigung\nBayern Amtsgericht Augsburg HRB 38583\nEnergietechnik FR GmbH – Friedberg",
      "type": "Löschungsankündigung",
      "state": "Bayern",
      "amtsgericht": "Amtsgericht Augsburg",
      "registernummer": "HRB 38583",
      "registerart": "HRB",
      "company_name": "Energietechnik FR GmbH",
      "company_seat": "Friedberg",
      "details": "27.01.2026 (Bekanntmachungsdatum)\n\nBayern Amtsgericht Augsburg HRB 38583\nLöschungsankündigung 26.01.2026 (Eintragungsdatum)\n\nEnergietechnik FR GmbH\nGesellschaft mit beschränkter Haftung\nFriedberg"
    },
    {
      "date": "2026-01-27",
      "id": "143485",
      "original_text": "Einreichung neuer Dokumente\nBayern Amtsgericht München HRB 187404\nSparkassen-Immobilien-Vermittlungs-GmbH – München",
      "type": "Einreichung neuer Dokumente",
      "state": "Bayern",
      "amtsgericht": "Amtsgericht München",
      "registernummer": "HRB 187404",
      "registerart": "HRB",
      "company_name": "Sparkassen-Immobilien-Vermittlungs-GmbH",
      "company_seat": "München",
      "details": "27.01.2026 (Bekanntmachungsdatum)\n\nBayern Amtsgericht München HRB 187404\nEinreichung neuer Dokumente 26.01.2026 (Eintragungsdatum)\n\nSparkassen-Immobilien-Vermittlungs-GmbH\nGesellschaft mit beschränkter Haftung\nMünchen\n\nDem Amtsgericht München -Registergericht- ist eine Liste der Mitglieder des Aufsichtsrats eingereicht worden, § 52 Abs. 3 S. 2 GmbHG."
    },
    {
      "date": "2026-01-27",
      "id": "143486",
      "original_text": "Löschungsankündigung\nBayern Amtsgericht Augsburg HRB 29111\nITV Media Verwaltungs GmbH – Augsburg",
      "type": "Löschungsankündigung",
      "state": "Bayern",
      "amtsgericht": "Amtsgericht Augsburg",
      "registernummer": "HRB 29111",
      "registerart": "HRB",
      "company_name": "ITV Media Verwaltungs GmbH",
      "company_seat": "Augsburg",
      "details": "27.01.2026 (Bekanntmachungsdatum)\n\nBayern Amtsgericht Augsburg HRB 29111\nLöschungsankündigung\n\nITV Media Verwaltungs GmbH\nGesellschaft mit beschränkter Haftung\nAugsburg\n\nDas Registergericht beabsichtigt, die im Handelsregister eingetragene Gesellschaft wegen Vermögenslosigkeit von Amts wegen nach § 394 FamFG zu löschen. Die Frist zur Erhebung eines Widerspruchs ist auf einen Monat festgesetzt."
    },
    {
      "date": "2026-01-27",
      "id": "143487",
      "original_text": "Sonstige Registerbekanntmachung\nBayern Amtsgericht Augsburg HRB 18635\nSigel GmbH – Mertingen",
      "type": "Sonstige Registerbekanntmachung",
      "state": "Bayern",
      "amtsgericht": "Amtsgericht Augsburg",
      "registernummer": "HRB 18635",
      "registerart": "HRB",
      "company_name": "Sigel GmbH",
      "company_seat": "Mertingen",
      "details": "27.01.2026 (Bekanntmachungsdatum)\n\nBayern Amtsgericht Augsburg HRB 18635\nSonstige Registerbekanntmachung 26.01.2026 (Eintragungsdatum)\n\nSigel GmbH\nGesellschaft mit beschränkter Haftung\nMertingen\n\nDen Gläubigern der Gesellschaft, deren Forderungen begründet worden sind, bevor die Eintragung der Beendigung des Gewinnabführungsvertrages in das Handelsregister nach § 10 des Handelsgesetzbuches als bekanntgemacht gilt, hat der andere Vertragsteil Sicherheit zu leisten, wenn sie sich binnen sechs Monaten nach der Bekanntmachung der Eintragung zu diesem Zweck bei ihm melden."
    },
    {
      "date": "2026-01-27",
      "id": "143488",
      "original_text": "Löschungsankündigung\nBayern Amtsgericht Nürnberg HRB 27341\nKBVR GmbH – Nürnberg",
      "type": "Löschungsankündigung",
      "state": "Bayern",
      "amtsgericht": "Amtsgericht Nürnberg",
      "registernummer": "HRB 27341",
      "registerart": "HRB",
      "company_name": "KBVR GmbH",
      "company_seat": "Nürnberg",
      "details": "27.01.2026 (Bekanntmachungsdatum)\n\nBayern Amtsgericht Nürnberg HRB 27341\nLöschungsankündigung\n\nKBVR GmbH\nGesellschaft mit beschränkter Haftung\nNürnberg\n\nDas Registergericht beabsichtigt, die im Handelsregister eingetragene Gesellschaft wegen Vermögenslosigkeit von Amts wegen nach § 394 FamFG zu löschen. Die Frist zur Erhebung eines Widerspruchs ist auf einen Monat festgesetzt."
    },
    {
      "date": "2026-01-27",
      "id": "143489",
      "original_text": "Löschungsankündigung\nBayern Amtsgericht München HRB 235213\nViral MEDIA GmbH – München",
      "type": "Löschungsankündigung",
      "state": "Bayern",
      "amtsgericht": "Amtsgericht München",
      "registernummer": "HRB 235213",
      "registerart": "HRB",
      "company_name": "Viral MEDIA GmbH",
      "company_seat": "München",
      "details": "27.01.2026 (Bekanntmachungsdatum)\n\nBayern Amtsgericht München HRB 235213\nLöschungsankündigung 26.01.2026 (Eintragungsdatum)\n\nViral MEDIA GmbH\nGesellschaft mit beschränkter Haftung\nMünchen\n\nDas Registergericht beabsichtigt, die im Handelsregister eingetragene Gesellschaft wegen Vermögenslosigkeit von Amts wegen nach § 394 FamFG zu löschen. Die Frist zur Erhebung eines Widerspruchs ist auf drei Monate festgesetzt."
    },
    {
      "date": "2026-01-27",
      "id": "143490",
      "original_text": "Löschungsankündigung\nBayern Amtsgericht München HRA 79134\nstarmedia home entertainment GmbH & Co. KG – München",
      "type": "Löschungsankündigung",
      "state": "Bayern",
      "amtsgericht": "Amtsgericht München",
      "registernummer": "HRA 79134",
      "registerart": "HRA",
      "company_name": "starmedia home entertainment GmbH & Co. KG",
      "company_seat": "München",
      "details": "27.01.2026 (Bekanntmachungsdatum)\n\nBayern Amtsgericht München HRA 79134\nLöschungsankündigung 26.01.2026 (Eintragungsdatum)\n\nstarmedia home entertainment GmbH & Co. KG\nKommanditgesellschaft\nMünchen\n\nDas Registergericht beabsichtigt, die im Handelsregister eingetragene Firma von Amts wegen nach § 31 Abs. 2 HGB zu löschen. Die Frist zur Erhebung eines Widerspruchs ist auf drei Monate festgesetzt."
    },
    {
      "date": "2026-01-27",
      "id": "143491",
      "original_text": "Einreichung neuer Dokumente\nBayern Amtsgericht Regensburg HRB 1611\ndas Stadtwerk Regensburg GmbH – Regensburg",
      "type": "Einreichung neuer Dokumente",
      "state": "Bayern",
      "amtsgericht": "Amtsgericht Regensburg",
      "registernummer": "HRB 1611",
      "registerart": "HRB",
      "company_name": "das Stadtwerk Regensburg GmbH",
      "company_seat": "Regensburg",
      "details": "27.01.2026 (Bekanntmachungsdatum)\n\nBayern Amtsgericht Regensburg HRB 1611\nEinreichung neuer Dokumente 26.01.2026 (Eintragungsdatum)\n\ndas Stadtwerk Regensburg GmbH\nGesellschaft mit beschränkter Haftung\nRegensburg\n\nDem Amtsgericht Regensburg -Registergericht- ist eine Liste der Mitglieder des Aufsichtsrats eingereicht worden, § 52 Abs. 3 S. 2 GmbHG."
    },
    {
      "date": "2026-01-27",
      "id": "143492",
      "original_text": "Löschungsankündigung\nBayern Amtsgericht München HRB 147059\nMarkIT Communication GmbH – München",
      "type": "Löschungsankündigung",
      "state": "Bayern",
      "amtsgericht": "Amtsgericht München",
      "registernummer": "HRB 147059",
      "registerart": "HRB",
      "company_name": "MarkIT Communication GmbH",
      "company_seat": "München",
      "details": "27.01.2026 (Bekanntmachungsdatum)\n\nBayern Amtsgericht München HRB 147059\nLöschungsankündigung\n\nMarkIT Communication GmbH\nGesellschaft mit beschränkter Haftung\nMünchen\n\nDas Registergericht beabsichtigt, die im Handelsregister eingetragene Gesellschaft wegen Vermögenslosigkeit von Amts wegen nach § 394 FamFG zu löschen. Die Frist zur Erhebung eines Widerspruchs ist auf drei Monate festgesetzt."
    },
    {
      "date": "2026-01-27",
      "id": "143493",
      "original_text": "Löschungsankündigung\nBayern Amtsgericht München HRB 264690\nMattenmanufaktur GmbH – München",
      "type": "Löschungsankündigung",
      "state": "Bayern",
      "amtsgericht": "Amtsgericht München",
      "registernummer": "HRB 264690",
      "registerart": "HRB",
      "company_name": "Mattenmanufaktur GmbH",
      "company_seat": "München",
      "details": "27.01.2026 (Bekanntmachungsdatum)\n\nBayern Amtsgericht München HRB 264690\nLöschungsankündigung\n\nMattenmanufaktur GmbH\nGesellschaft mit beschränkter Haftung\nMünchen\n\nDas Registergericht beabsichtigt, die im Handelsregister eingetragene Gesellschaft wegen Vermögenslosigkeit von Amts wegen nach § 394 FamFG zu löschen. Die Frist zur Erhebung eines Widerspruchs ist auf drei Monate festgesetzt."
    },
    {
      "date": "2026-01-27",
      "id": "143494",
      "original_text": "Löschungsankündigung\nBayern Amtsgericht Regensburg HRB 19112\nV und W Bau UG (haftungsbeschränkt) – Neutraubling",
      "type": "Löschungsankündigung",
      "state": "Bayern",
      "amtsgericht": "Amtsgericht Regensburg",
      "registernummer": "HRB 19112",
      "registerart": "HRB",
      "company_name": "V und W Bau UG (haftungsbeschränkt)",
      "company_seat": "Neutraubling",
      "details": "27.01.2026 (Bekanntmachungsdatum)\n\nBayern Amtsgericht Regensburg HRB 19112\nLöschungsankündigung 26.01.2026 (Eintragungsdatum)\n\nV und W Bau UG (haftungsbeschränkt)\nGesellschaft mit beschränkter Haftung\nNeutraubling\n\nDas Registergericht beabsichtigt, die im Handelsregister eingetragene Gesellschaft wegen Vermögenslosigkeit von Amts wegen nach § 394 FamFG zu löschen. Die Frist zur Erhebung eines Widerspruchs ist auf einen Monat festgesetzt."
    },
    {
      "date": "2026-01-27",
      "id": "143495",
      "original_text": "Einreichung neuer Dokumente\nBayern Amtsgericht Bayreuth HRB 2611\nStadtwerke Bayreuth Verkehr und Bäder GmbH – Bayreuth",
      "type": "Einreichung neuer Dokumente",
      "state": "Bayern",
      "amtsgericht": "Amtsgericht Bayreuth",
      "registernummer": "HRB 2611",
      "registerart": "HRB",
      "company_name": "Stadtwerke Bayreuth Verkehr und Bäder GmbH",
      "company_seat": "Bayreuth",
      "details": "27.01.2026 (Bekanntmachungsdatum)\n\nBayern Amtsgericht Bayreuth HRB 2611\nEinreichung neuer Dokumente\n\nStadtwerke Bayreuth Verkehr und Bäder GmbH\nGesellschaft mit beschränkter Haftung\nBayreuth\n\nDem Amtsgericht Bayreuth -Registergericht- ist eine Liste der Mitglieder des Aufsichtsrats eingereicht worden, § 52 Abs. 3 S. 2 GmbHG."
    },
    {
      "date": "2026-01-27",
      "id": "143496",
      "original_text": "Einreichung neuer Dokumente\nBayern Amtsgericht Bayreuth HRB 2610\nStadtwerke Bayreuth Energie und Wasser GmbH – Bayreuth",
      "type": "Einreichung neuer Dokumente",
      "state": "Bayern",
      "amtsgericht": "Amtsgericht Bayreuth",
      "registernummer": "HRB 2610",
      "registerart": "HRB",
      "company_name": "Stadtwerke Bayreuth Energie und Wasser GmbH",
      "company_seat": "Bayreuth",
      "details": "27.01.2026 (Bekanntmachungsdatum)\n\nBayern Amtsgericht Bayreuth HRB 2610\nEinreichung neuer Dokumente\n\nStadtwerke Bayreuth Energie und Wasser GmbH\nGesellschaft mit beschränkter Haftung\nBayreuth\n\nDem Amtsgericht Bayreuth -Registergericht- ist eine Liste der Mitglieder des Aufsichtsrats eingereicht worden, § 52 Abs. 3 S. 2 GmbHG."
    },
    {
      "date": "2026-01-27",
      "id": "143497",
      "original_text": "Einreichung neuer Dokumente\nBayern Amtsgericht Regensburg HRB 14848\nDeutsches Maklerforum Aktiengesellschaft – Regensburg",
      "type": "Einreichung neuer Dokumente",
      "state": "Bayern",
      "amtsgericht": "Amtsgericht Regensburg",
      "registernummer": "HRB 14848",
      "registerart": "HRB",
      "company_name": "Deutsches Maklerforum Aktiengesellschaft",
      "company_seat": "Regensburg",
      "details": "27.01.2026 (Bekanntmachungsdatum)\n\nBayern Amtsgericht Regensburg HRB 14848\nEinreichung neuer Dokumente\n\nDeutsches Maklerforum Aktiengesellschaft\nAktiengesellschaft\nRegensburg\n\nDem Amtsgericht Regensburg -Registergericht- ist eine Liste der Mitglieder des Aufsichtsrats eingereicht worden, § 106 AktG."
    },
    {
      "date": "2026-01-27",
      "id": "143498",
      "original_text": "Löschungsankündigung\nBayern Amtsgericht Nürnberg HRB 26286\nAutomobile Maass Schwabach GmbH – Schwabach",
      "type": "Löschungsankündigung",
      "state": "Bayern",
      "amtsgericht": "Amtsgericht Nürnberg",
      "registernummer": "HRB 26286",
      "registerart": "HRB",
      "company_name": "Automobile Maass Schwabach GmbH",
      "company_seat": "Schwabach",
      "details": "27.01.2026 (Bekanntmachungsdatum)\n\nBayern Amtsgericht Nürnberg HRB 26286\nLöschungsankündigung\n\nAutomobile Maass Schwabach GmbH\nGesellschaft mit beschränkter Haftung\nSchwabach\n\nDas Registergericht beabsichtigt, die im Handelsregister eingetragene Gesellschaft wegen Vermögenslosigkeit von Amts wegen nach § 394 FamFG zu löschen. Die Frist zur Erhebung eines Widerspruchs ist auf einen Monat festgesetzt."
    },
    {
      "date": "2026-01-27",
      "id": "143499",
      "original_text": "Registerbekanntmachung nach dem Umwandlungsgesetz\nBayern Amtsgericht Memmingen HRB 16900\nAURIGA Invest GmbH – Bad Wörishofen",
      "type": "Registerbekanntmachung nach dem Umwandlungsgesetz",
      "state": "Bayern",
      "amtsgericht": "Amtsgericht Memmingen",
      "registernummer": "HRB 16900",
      "registerart": "HRB",
      "company_name": "AURIGA Invest GmbH",
      "company_seat": "Bad Wörishofen",
      "details": "27.01.2026 (Bekanntmachungsdatum)\n\nBayern Amtsgericht Memmingen HRB 16900\nRegisterbekanntmachung nach dem Umwandlungsgesetz 24.01.2026 (Eintragungsdatum)\n\nAURIGA Invest GmbH\nGesellschaft mit beschränkter Haftung\nBad Wörishofen\n\nDen Gläubigern der an der Verschmelzung beteiligten Rechtsträger ist, wenn sie binnen sechs Monaten nach dem Tag, an dem die Eintragung der Verschmelzung in das Register des Sitzes desjenigen Rechtsträgers, dessen Gläubiger sie sind, nach § 19 Abs. 3 UmwG als bekannt gemacht gilt, ihren Anspruch nach Grund und Höhe in Textform anmelden, Sicherheit zu leisten, soweit sie nicht Befriedigung verlangen können. Dieses Recht steht den Gläubigern jedoch nur zu, wenn sie glaubhaft machen, dass durch die Verschmelzung die Erfüllung ihrer Forderung gefährdet wird."
    },
    {
      "date": "2026-01-27",
      "id": "143500",
      "original_text": "Registerbekanntmachung nach dem Umwandlungsgesetz\nBayern Amtsgericht Memmingen HRB 14899\nAURIGA Projekt GmbH – Bad Wörishofen",
      "type": "Registerbekanntmachung nach dem Umwandlungsgesetz",
      "state": "Bayern",
      "amtsgericht": "Amtsgericht Memmingen",
      "registernummer": "HRB 14899",
      "registerart": "HRB",
      "company_name": "AURIGA Projekt GmbH",
      "company_seat": "Bad Wörishofen",
      "details": "27.01.2026 (Bekanntmachungsdatum)\n\nBayern Amtsgericht Memmingen HRB 14899\nRegisterbekanntmachung nach dem Umwandlungsgesetz 24.01.2026 (Eintragungsdatum)\n\nAURIGA Projekt GmbH\nGesellschaft mit beschränkter Haftung\nBad Wörishofen\n\nDen Gläubigern der an der Verschmelzung beteiligten Rechtsträger ist, wenn sie binnen sechs Monaten nach dem Tag, an dem die Eintragung der Verschmelzung in das Register des Sitzes desjenigen Rechtsträgers, dessen Gläubiger sie sind, nach § 19 Abs. 3 UmwG als bekannt gemacht gilt, ihren Anspruch nach Grund und Höhe in Textform anmelden, Sicherheit zu leisten, soweit sie nicht Befriedigung verlangen können. Dieses Recht steht den Gläubigern jedoch nur zu, wenn sie glaubhaft machen, dass durch die Verschmelzung die Erfüllung ihrer Forderung gefährdet wird."
    },
    {
      "date": "2026-01-27",
      "id": "143501",
      "original_text": "Löschungsankündigung\nBayern Amtsgericht Ingolstadt HRB 8741\nDTA ONE-DIGITAL TECHNOLOGIES ASSISTANT AND NEW ENGAGEMENTS UG (haftungsbeschränkt) – Ingolstadt",
      "type": "Löschungsankündigung",
      "state": "Bayern",
      "amtsgericht": "Amtsgericht Ingolstadt",
      "registernummer": "HRB 8741",
      "registerart": "HRB",
      "company_name": "DTA ONE-DIGITAL TECHNOLOGIES ASSISTANT AND NEW ENGAGEMENTS UG (haftungsbeschränkt)",
      "company_seat": "Ingolstadt",
      "details": "27.01.2026 (Bekanntmachungsdatum)\n\nBayern Amtsgericht Ingolstadt HRB 8741\nLöschungsankündigung\n\nDTA ONE-DIGITAL TECHNOLOGIES ASSISTANT AND NEW ENGAGEMENTS UG (haftungsbeschränkt)\nGesellschaft mit beschränkter Haftung\nIngolstadt\n\nDas Registergericht beabsichtigt, die im Handelsregister eingetragene Gesellschaft wegen Vermögenslosigkeit von Amts wegen nach § 394 FamFG zu löschen. Die Frist zur Erhebung eines Widerspruchs ist auf einen Monat festgesetzt."
    },
    {
      "date": "2026-01-27",
      "id": "143502",
      "original_text": "Registerbekanntmachung nach dem Umwandlungsgesetz\nBayern Amtsgericht Amberg HRB 6423\nGerd Denninger Investment UG (haftungsbeschränkt) – Freudenberg",
      "type": "Registerbekanntmachung nach dem Umwandlungsgesetz",
      "state": "Bayern",
      "amtsgericht": "Amtsgericht Amberg",
      "registernummer": "HRB 6423",
      "registerart": "HRB",
      "company_name": "Gerd Denninger Investment UG (haftungsbeschränkt)",
      "company_seat": "Freudenberg",
      "details": "27.01.2026 (Bekanntmachungsdatum)\n\nBayern Amtsgericht Amberg HRB 6423\nRegisterbekanntmachung nach dem Umwandlungsgesetz 26.01.2026 (Eintragungsdatum)\n\nGerd Denninger Investment UG (haftungsbeschränkt)\nGesellschaft mit beschränkter Haftung\nFreudenberg\n\nDen Gläubigern der an der Verschmelzung beteiligten Rechtsträger ist, wenn sie binnen sechs Monaten nach dem Tag, an dem die Eintragung der Verschmelzung in das Register des Sitzes desjenigen Rechtsträgers, dessen Gläubiger sie sind, nach § 19 Abs. 3 UmwG als bekannt gemacht gilt, ihren Anspruch nach Grund und Höhe in Textform anmelden, Sicherheit zu leisten, soweit sie nicht Befriedigung verlangen können. Dieses Recht steht den Gläubigern jedoch nur zu, wenn sie glaubhaft machen, dass durch die Verschmelzung die Erfüllung ihrer Forderung gefährdet wird."
    },
    {
      "date": "2026-01-27",
      "id": "143503",
      "original_text": "Registerbekanntmachung nach dem Umwandlungsgesetz\nBayern Amtsgericht Memmingen HRB 16510\nAURIGA Verwaltungs GmbH – Bad Wörishofen",
      "type": "Registerbekanntmachung nach dem Umwandlungsgesetz",
      "state": "Bayern",
      "amtsgericht": "Amtsgericht Memmingen",
      "registernummer": "HRB 16510",
      "registerart": "HRB",
      "company_name": "AURIGA Verwaltungs GmbH",
      "company_seat": "Bad Wörishofen",
      "details": "27.01.2026 (Bekanntmachungsdatum)\n\nBayern Amtsgericht Memmingen HRB 16510\nRegisterbekanntmachung nach dem Umwandlungsgesetz 24.01.2026 (Eintragungsdatum)\n\nAURIGA Verwaltungs GmbH\nGesellschaft mit beschränkter Haftung\nBad Wörishofen\n\nDen Gläubigern der an der Verschmelzung beteiligten Rechtsträger ist, wenn sie binnen sechs Monaten nach dem Tag, an dem die Eintragung der Verschmelzung in das Register des Sitzes desjenigen Rechtsträgers, dessen Gläubiger sie sind, nach § 19 Abs. 3 UmwG als bekannt gemacht gilt, ihren Anspruch nach Grund und Höhe in Textform anmelden, Sicherheit zu leisten, soweit sie nicht Befriedigung verlangen können. Dieses Recht steht den Gläubigern jedoch nur zu, wenn sie glaubhaft machen, dass durch die Verschmelzung die Erfüllung ihrer Forderung gefährdet wird."
    },
    {
      "date": "2026-01-27",
      "id": "143504",
      "original_text": "Einreichung neuer Dokumente\nBayern Amtsgericht München HRB 273759\nzooplus SE – München",
      "type": "Einreichung neuer Dokumente",
      "state": "Bayern",
      "amtsgericht": "Amtsgericht München",
      "registernummer": "HRB 273759",
      "registerart": "HRB",
      "company_name": "zooplus SE",
      "company_seat": "München",
      "details": "27.01.2026 (Bekanntmachungsdatum)\n\nBayern Amtsgericht München HRB 273759\nEinreichung neuer Dokumente\n\nzooplus SE\nEuropäische Aktiengesellschaft (SE)\nMünchen\n\nDem Amtsgericht München -Registergericht- ist eine Liste der Mitglieder des Aufsichtsrats eingereicht worden, Art. 9 Abs. 1 Buchst. c (ii) SE-VO i.V.m. § 106 AktG."
    },
    {
      "date": "2026-01-27",
      "id": "143505",
      "original_text": "Registerbekanntmachung nach dem Umwandlungsgesetz\nMecklenburg-Vorpommern Amtsgericht Stralsund HRB 23034\nGerwig & Kollegen GmbH Wirtschaftsprüfungsgesellschaft – Ribnitz-Damgarten",
      "type": "Registerbekanntmachung nach dem Umwandlungsgesetz",
      "state": "Mecklenburg-Vorpommern",
      "amtsgericht": "Amtsgericht Stralsund",
      "registernummer": "HRB 23034",
      "registerart": "HRB",
      "company_name": "Gerwig & Kollegen GmbH Wirtschaftsprüfungsgesellschaft",
      "company_seat": "Ribnitz-Damgarten",
      "details": "27.01.2026 (Bekanntmachungsdatum)\n\nMecklenburg-Vorpommern Amtsgericht Stralsund HRB 23034\nRegisterbekanntmachung nach dem Umwandlungsgesetz 26.01.2026 (Eintragungsdatum)\n\nGerwig & Kollegen GmbH Wirtschaftsprüfungsgesellschaft\nGesellschaft mit beschränkter Haftung\nRibnitz-Damgarten\n\nAls nicht eingetragen wird veröffentlicht: Den Gläubigern der an der Verschmelzung beteiligten Rechtsträger ist, wenn sie binnen sechs Monaten nach dem Tag, an dem die Eintragung der Verschmelzung in das Register des Sitzes desjenigen Rechtsträgers, dessen Gläubiger sie sind, nach § 19 Abs. 3 UmwG als bekannt gemacht gilt,\nihren Anspruch nach Grund und Höhe in Textform anmelden, Sicherheit zu leisten, soweit sie nicht Befriedigung verlangen können. Dieses Recht steht den Gläubigern jedoch nur zu, wenn sie glaubhaft machen, dass durch die Verschmelzung die Erfüllung der Forderung gefährdet wird."
    },
    {
      "date": "2026-01-27",
      "id": "143506",
      "original_text": "Einreichung neuer Dokumente\nBerlin Amtsgericht Berlin (Charlottenburg) HRB 116419\nComvest Digital AG – Berlin",
      "type": "Einreichung neuer Dokumente",
      "state": "Berlin",
      "amtsgericht": "Amtsgericht Berlin (Charlottenburg)",
      "registernummer": "HRB 116419",
      "registerart": "HRB",
      "company_name": "Comvest Digital AG",
      "company_seat": "Berlin",
      "details": "27.01.2026 (Bekanntmachungsdatum)\n\nBerlin Amtsgericht Berlin (Charlottenburg) HRB 116419\nEinreichung neuer Dokumente\n\nComvest Digital AG\nAktiengesellschaft\nBerlin\n\nAls nicht eingetragen wird veröffentlicht: Es wurde eine neue Liste der Aufsichtsratsmitglieder eingereicht (§ 106 AktG)."
    },
    {
      "date": "2026-01-27",
      "id": "143507",
      "original_text": "Sonstige Registerbekanntmachung\nBaden-Württemberg Amtsgericht Stuttgart HRB 722725\nHIM Holtzbrinck 22 GmbH – Stuttgart",
      "type": "Sonstige Registerbekanntmachung",
      "state": "Baden-Württemberg",
      "amtsgericht": "Amtsgericht Stuttgart",
      "registernummer": "HRB 722725",
      "registerart": "HRB",
      "company_name": "HIM Holtzbrinck 22 GmbH",
      "company_seat": "Stuttgart",
      "details": "27.01.2026 (Bekanntmachungsdatum)\n\nBaden-Württemberg Amtsgericht Stuttgart HRB 722725\nSonstige Registerbekanntmachung 27.01.2026 (Eintragungsdatum)\n\nHIM Holtzbrinck 22 GmbH\nGesellschaft mit beschränkter Haftung\nStuttgart\n\nAls nicht eingetragen wird bekanntgemacht:\nDen Gläubigern der Gesellschaft, deren Forderungen begründet worden sind, bevor die Eintragung der Beendigung des Vertrages in das Handelsregister nach § 10 HGB als bekanntgemacht gilt, ist vom anderen Vertragsteil Sicherheit zu leisten, wenn sie sich binnen sechs Monaten nach der Bekanntmachung zu diesem Zweck bei ihm melden."
    },
    {
      "date": "2026-01-27",
      "id": "143508",
      "original_text": "Löschungsankündigung\nSaarland Amtsgericht Saarbrücken HRB 101806\nGastro Saarland GmbH – Saarbrücken",
      "type": "Löschungsankündigung",
      "state": "Saarland",
      "amtsgericht": "Amtsgericht Saarbrücken",
      "registernummer": "HRB 101806",
      "registerart": "HRB",
      "company_name": "Gastro Saarland GmbH",
      "company_seat": "Saarbrücken",
      "details": "27.01.2026 (Bekanntmachungsdatum)\n\nSaarland Amtsgericht Saarbrücken HRB 101806\nLöschungsankündigung\n\nGastro Saarland GmbH\nGesellschaft mit beschränkter Haftung\nSaarbrücken\n\nEs ist beabsichtigt, die Gesellschaft von Amts wegen gemäß § 394 FamFG wegen Vermögenslosigkeit zu löschen.\nGegen die Löschung von Amts wegen ist das Rechtsmittel des Widerspruchs statthaft. Der Widerspruch ist binnen einer Frist zwei Monaten beginnend mit dem Tag dieser Veröffentlichung durch Einreichen eines Widerspruchsschreibens -schriftlich oder zur Niederschrift der Geschäftsstelle beim Amtsgericht Saarbrücken, -zentrales Handelsregister-, Mainzerstr.178, 66121 Saarbrücken einzulegen.\nDer Widerspruch muss die Bezeichnung der angefochtenen Löschungsankündigung enthalten sowie die Erklärung, dass Widerspruch eingelegt wird. Er ist vom Widerspruchsführer oder seinem Bevollmächtigten zu unterzeichnen.\nDas Widerspruchsschreiben kann auch in der Form eines elektronischen Dokumentes eingereicht werden, das mit einer qualifizierten elektronischen Signatur nach dem Signaturgesetz versehen sein muss (§§ 14 Abs. 2 FamFG, 130a, 298 ZPO)."
    },
    {
      "date": "2026-01-27",
      "id": "143509",
      "original_text": "Sonstige Registerbekanntmachung\nBaden-Württemberg Amtsgericht Mannheim HRB 101892\nFIZ Karlsruhe - Leibniz-Institut für Informationsinfrastruktur GmbH – Eggenstein-Leopoldshafen",
      "type": "Sonstige Registerbekanntmachung",
      "state": "Baden-Württemberg",
      "amtsgericht": "Amtsgericht Mannheim",
      "registernummer": "HRB 101892",
      "registerart": "HRB",
      "company_name": "FIZ Karlsruhe - Leibniz-Institut für Informationsinfrastruktur GmbH",
      "company_seat": "Eggenstein-Leopoldshafen",
      "details": "27.01.2026 (Bekanntmachungsdatum)\n\nBaden-Württemberg Amtsgericht Mannheim HRB 101892\nSonstige Registerbekanntmachung\n\nFIZ Karlsruhe - Leibniz-Institut für Informationsinfrastruktur GmbH\nGesellschaft mit beschränkter Haftung\nEggenstein-Leopoldshafen\n\nDie Gesellschaft hat am 23.01.2026 die Liste über die Zusammensetzung des Aufsichtsrats zum Handelsregister eingereicht."
    },
    {
      "date": "2026-01-27",
      "id": "143510",
      "original_text": "Löschungsankündigung\nSchleswig-Holstein Amtsgericht Flensburg HRB 9984\nFreizeit Nord Verwaltungs GmbH – Flensburg",
      "type": "Löschungsankündigung",
      "state": "Schleswig-Holstein",
      "amtsgericht": "Amtsgericht Flensburg",
      "registernummer": "HRB 9984",
      "registerart": "HRB",
      "company_name": "Freizeit Nord Verwaltungs GmbH",
      "company_seat": "Flensburg",
      "details": "27.01.2026 (Bekanntmachungsdatum)\n\nSchleswig-Holstein Amtsgericht Flensburg HRB 9984\nLöschungsankündigung\n\nFreizeit Nord Verwaltungs GmbH\nGesellschaft mit beschränkter Haftung\nFlensburg\n\nEs ist die Löschung der nachstehenden Gesellschaft wegen Vermögenslosigkeit gemäß § 394 FamFG beabsichtigt.\nWiderspruchsfrist: 2 Monate."
    },
    {
      "date": "2026-01-27",
      "id": "143511",
      "original_text": "Löschungsankündigung\nBerlin Amtsgericht Berlin (Charlottenburg) HRB 69281\nKarree Bau GmbH – Berlin",
      "type": "Löschungsankündigung",
      "state": "Berlin",
      "amtsgericht": "Amtsgericht Berlin (Charlottenburg)",
      "registernummer": "HRB 69281",
      "registerart": "HRB",
      "company_name": "Karree Bau GmbH",
      "company_seat": "Berlin",
      "details": "27.01.2026 (Bekanntmachungsdatum)\n\nBerlin Amtsgericht Berlin (Charlottenburg) HRB 69281\nLöschungsankündigung\n\nKarree Bau GmbH\nGesellschaft mit beschränkter Haftung\nBerlin\n\nBei der nachstehenden Gesellschaft wird das Amtslöschungsverfahren gemäß § 394 FamFG eingeleitet. Widerspruchsfrist: 6 Wochen."
    },
    {
      "date": "2026-01-27",
      "id": "143512",
      "original_text": "Einreichung neuer Dokumente\nBerlin Amtsgericht Berlin (Charlottenburg) HRB 239329\nClark Holding SE – Berlin",
      "type": "Einreichung neuer Dokumente",
      "state": "Berlin",
      "amtsgericht": "Amtsgericht Berlin (Charlottenburg)",
      "registernummer": "HRB 239329",
      "registerart": "HRB",
      "company_name": "Clark Holding SE",
      "company_seat": "Berlin",
      "details": "27.01.2026 (Bekanntmachungsdatum)\n\nBerlin Amtsgericht Berlin (Charlottenburg) HRB 239329\nEinreichung neuer Dokumente\n\nClark Holding SE\nEuropäische Aktiengesellschaft (SE)\nBerlin\n\nAls nicht eingetragen wird veröffentlicht:Es wurde eine neue Liste der Aufsichtsratsmitglieder eingereicht (§ 106 AktG)."
    },
    {
      "date": "2026-01-27",
      "id": "143513",
      "original_text": "Löschungsankündigung\nBerlin Amtsgericht Berlin (Charlottenburg) HRB 175180\nZaza Logistik GmbH – Berlin",
      "type": "Löschungsankündigung",
      "state": "Berlin",
      "amtsgericht": "Amtsgericht Berlin (Charlottenburg)",
      "registernummer": "HRB 175180",
      "registerart": "HRB",
      "company_name": "Zaza Logistik GmbH",
      "company_seat": "Berlin",
      "details": "27.01.2026 (Bekanntmachungsdatum)\n\nBerlin Amtsgericht Berlin (Charlottenburg) HRB 175180\nLöschungsankündigung\n\nZaza Logistik GmbH\nGesellschaft mit beschränkter Haftung\nBerlin\n\nBei der nachstehenden Gesellschaft wird das Amtslöschungsverfahren gemäß § 394 FamFG eingeleitet. Widerspruchsfrist 6 Wochen"
    },
    {
      "date": "2026-01-27",
      "id": "143514",
      "original_text": "Löschungsankündigung\nSaarland Amtsgericht Saarbrücken HRB 104577\nMM Wohnbau GmbH – Homburg",
      "type": "Löschungsankündigung",
      "state": "Saarland",
      "amtsgericht": "Amtsgericht Saarbrücken",
      "registernummer": "HRB 104577",
      "registerart": "HRB",
      "company_name": "MM Wohnbau GmbH",
      "company_seat": "Homburg",
      "details": "27.01.2026 (Bekanntmachungsdatum)\n\nSaarland Amtsgericht Saarbrücken HRB 104577\nLöschungsankündigung 20.01.2026 (Eintragungsdatum)\n\nMM Wohnbau GmbH\nGesellschaft mit beschränkter Haftung\nHomburg\n\nEs ist beabsichtigt, die Gesellschaft von Amts wegen gemäß § 394 FamFG wegen Vermögenslosigkeit zu löschen.\nGegen die Löschung von Amts wegen ist das Rechtsmittel des Widerspruchs statthaft. Der Widerspruch ist binnen einer Frist zwei Monaten beginnend mit dem Tag dieser Veröffentlichung durch Einreichen eines Widerspruchsschreibens -schriftlich oder zur Niederschrift der Geschäftsstelle beim Amtsgericht Saarbrücken, -zentrales Handelsregister-, Mainzerstr.178, 66121 Saarbrücken einzulegen.\nDer Widerspruch muss die Bezeichnung der angefochtenen Löschungsankündigung enthalten sowie die Erklärung, dass Widerspruch eingelegt wird. Er ist vom Widerspruchsführer oder seinem Bevollmächtigten zu unterzeichnen.\nDas Widerspruchsschreiben kann auch in der Form eines elektronischen Dokumentes eingereicht werden, das mit einer qualifizierten elektronischen Signatur nach dem Signaturgesetz versehen sein muss (§§ 14 Abs. 2 FamFG, 130a, 298 ZPO)."
    },
    {
      "date": "2026-01-27",
      "id": "143515",
      "original_text": "Löschungsankündigung\nBerlin Amtsgericht Berlin (Charlottenburg) HRB 194907\nYildirim Taxi GmbH – Berlin",
      "type": "Löschungsankündigung",
      "state": "Berlin",
      "amtsgericht": "Amtsgericht Berlin (Charlottenburg)",
      "registernummer": "HRB 194907",
      "registerart": "HRB",
      "company_name": "Yildirim Taxi GmbH",
      "company_seat": "Berlin",
      "details": "27.01.2026 (Bekanntmachungsdatum)\n\nBerlin Amtsgericht Berlin (Charlottenburg) HRB 194907\nLöschungsankündigung\n\nYildirim Taxi GmbH\nGesellschaft mit beschränkter Haftung\nBerlin\n\nBei der nachstehenden Gesellschaft wird das Amtslöschungsverfahren gemäß § 394 FamFG eingeleitet. Widerspruchsfrist 6 Wochen"
    },
    {
      "date": "2026-01-27",
      "id": "143516",
      "original_text": "Löschungsankündigung\nBerlin Amtsgericht Berlin (Charlottenburg) HRB 259681\nIntras Personalservice & Logistic GmbH – Berlin",
      "type": "Löschungsankündigung",
      "state": "Berlin",
      "amtsgericht": "Amtsgericht Berlin (Charlottenburg)",
      "registernummer": "HRB 259681",
      "registerart": "HRB",
      "company_name": "Intras Personalservice & Logistic GmbH",
      "company_seat": "Berlin",
      "details": "27.01.2026 (Bekanntmachungsdatum)\n\nBerlin Amtsgericht Berlin (Charlottenburg) HRB 259681\nLöschungsankündigung\n\nIntras Personalservice & Logistic GmbH\nGesellschaft mit beschränkter Haftung\nBerlin\n\nBei der nachstehenden Gesellschaft wird das Amtslöschungsverfahren gemäß § 394 FamFG eingeleitet. Widerspruchsfrist 6 Wochen"
    },
    {
      "date": "2026-01-27",
      "id": "143517",
      "original_text": "Sonstige Registerbekanntmachung\nBaden-Württemberg Amtsgericht Ulm HRB 701186\nGesellschaft im Ostalbkreis für Abfallbewirtschaftung mbh (GOA) – Mögglingen",
      "type": "Sonstige Registerbekanntmachung",
      "state": "Baden-Württemberg",
      "amtsgericht": "Amtsgericht Ulm",
      "registernummer": "HRB 701186",
      "registerart": "HRB",
      "company_name": "Gesellschaft im Ostalbkreis für Abfallbewirtschaftung mbh (GOA)",
      "company_seat": "Mögglingen",
      "details": "27.01.2026 (Bekanntmachungsdatum)\n\nBaden-Württemberg Amtsgericht Ulm HRB 701186\nSonstige Registerbekanntmachung\n\nGesellschaft im Ostalbkreis für Abfallbewirtschaftung mbh (GOA)\nGesellschaft mit beschränkter Haftung\nMögglingen\n\nDie Gesellschaft hat am 12.01.2026 die Liste über die Zusammensetzung des Aufsichtsrats zum Handelsregister eingereicht."
    },
    {
      "date": "2026-01-27",
      "id": "143518",
      "original_text": "Löschungsankündigung\nBerlin Amtsgericht Berlin (Charlottenburg) HRB 26568\n\"Lilija\" Spielhallen GmbH – Berlin",
      "type": "Löschungsankündigung",
      "state": "Berlin",
      "amtsgericht": "Amtsgericht Berlin (Charlottenburg)",
      "registernummer": "HRB 26568",
      "registerart": "HRB",
      "company_name": "\"Lilija\" Spielhallen GmbH",
      "company_seat": "Berlin",
      "details": "27.01.2026 (Bekanntmachungsdatum)\n\nBerlin Amtsgericht Berlin (Charlottenburg) HRB 26568\nLöschungsankündigung\n\n\"Lilija\" Spielhallen GmbH\nGesellschaft mit beschränkter Haftung\nBerlin\n\nBei der nachstehenden Gesellschaft wird das Amtslöschungsverfahren gemäß § 394 FamFG eingeleitet. Widerspruchsfrist 6 Wochen"
    },
    {
      "date": "2026-01-27",
      "id": "143519",
      "original_text": "Einreichung neuer Dokumente\nBaden-Württemberg Amtsgericht Stuttgart HRB 310182\nFermo-Massivhaus Holding Aktiengesellschaft – Murr",
      "type": "Einreichung neuer Dokumente",
      "state": "Baden-Württemberg",
      "amtsgericht": "Amtsgericht Stuttgart",
      "registernummer": "HRB 310182",
      "registerart": "HRB",
      "company_name": "Fermo-Massivhaus Holding Aktiengesellschaft",
      "company_seat": "Murr",
      "details": "27.01.2026 (Bekanntmachungsdatum)\n\nBaden-Württemberg Amtsgericht Stuttgart HRB 310182\nEinreichung neuer Dokumente\n\nFermo-Massivhaus Holding Aktiengesellschaft\nAktiengesellschaft\nMurr\n\nDie Gesellschaft hat am 26.01.2026 die Liste über die Zusammensetzung des Aufsichtsrats zum Handelsregister eingereicht."
    },
    {
      "date": "2026-01-27",
      "id": "143520",
      "original_text": "Sonstige Registerbekanntmachung\nBaden-Württemberg Amtsgericht Mannheim HRB 107723\nGolfplatz Hofgut Scheibenhardt AG – Karlsruhe",
      "type": "Sonstige Registerbekanntmachung",
      "state": "Baden-Württemberg",
      "amtsgericht": "Amtsgericht Mannheim",
      "registernummer": "HRB 107723",
      "registerart": "HRB",
      "company_name": "Golfplatz Hofgut Scheibenhardt AG",
      "company_seat": "Karlsruhe",
      "details": "27.01.2026 (Bekanntmachungsdatum)\n\nBaden-Württemberg Amtsgericht Mannheim HRB 107723\nSonstige Registerbekanntmachung\n\nGolfplatz Hofgut Scheibenhardt AG\nAktiengesellschaft\nKarlsruhe\n\nDie Gesellschaft hat am 22.01.2026 die Liste über die Zusammensetzung des Aufsichtsrats zum Handelsregister eingereicht."
    },
    {
      "date": "2026-01-27",
      "id": "143521",
      "original_text": "Registerbekanntmachung nach dem Umwandlungsgesetz\nBaden-Württemberg Amtsgericht Stuttgart HRB 774576\nAll for One Group SE – Filderstadt",
      "type": "Registerbekanntmachung nach dem Umwandlungsgesetz",
      "state": "Baden-Württemberg",
      "amtsgericht": "Amtsgericht Stuttgart",
      "registernummer": "HRB 774576",
      "registerart": "HRB",
      "company_name": "All for One Group SE",
      "company_seat": "Filderstadt",
      "details": "27.01.2026 (Bekanntmachungsdatum)\n\nBaden-Württemberg Amtsgericht Stuttgart HRB 774576\nRegisterbekanntmachung nach dem Umwandlungsgesetz\n\nAll for One Group SE\nEuropäische Aktiengesellschaft (SE)\nFilderstadt\n\nDie Gesellschaft hat am 26.01.2026 den Spaltungsvertrag vom 26.01.2026 zwischen \"All for One Managed Cloud Services GmbH\", Filderstadt (Amtsgericht Amtsgericht Stuttgart HRB 802630)\nund der hiesigen Gesellschaft (übertragender Rechtsträger) zum Handelsregister eingereicht."
    },
    {
      "date": "2026-01-27",
      "id": "143522",
      "original_text": "Registerbekanntmachung nach dem Umwandlungsgesetz\nBaden-Württemberg Amtsgericht Stuttgart HRA 743101\nFutura Delta 10 & Co. KG – Stuttgart",
      "type": "Registerbekanntmachung nach dem Umwandlungsgesetz",
      "state": "Baden-Württemberg",
      "amtsgericht": "Amtsgericht Stuttgart",
      "registernummer": "HRA 743101",
      "registerart": "HRA",
      "company_name": "Futura Delta 10 & Co. KG",
      "company_seat": "Stuttgart",
      "details": "27.01.2026 (Bekanntmachungsdatum)\n\nBaden-Württemberg Amtsgericht Stuttgart HRA 743101\nRegisterbekanntmachung nach dem Umwandlungsgesetz 27.01.2026 (Eintragungsdatum)\n\nFutura Delta 10 & Co. KG\nKommanditgesellschaft\nStuttgart\n\nAls nicht eingetragen wird bekanntgemacht:\nDen Gläubigern des an dem Formwechsel beteiligten Rechtsträgers ist, wenn sie binnen sechs Monaten nach dem Tag, an dem die Eintragung des Formwechsels in das Register des Sitzes desjenigen Rechtsträgers, dessen Gläubiger sie sind, nach § 19 Abs. 3 UmwG als bekanntgemacht gilt, ihren Anspruch nach Grund und Höhe schriftlich anmelden, Sicherheit zu leisten, soweit sie nicht Befriedigung verlangen können. Dieses Recht steht den Gläubigern jedoch nur zu, wenn sie glaubhaft machen, dass durch den Formwechsel die Erfüllung ihrer Forderung gefährdet wird."
    },
    {
      "date": "2026-01-27",
      "id": "143523",
      "original_text": "Löschungsankündigung\nBaden-Württemberg Amtsgericht Stuttgart HRB 748297\nOnex Fitnessklub Loßburg UG (haftungsbeschränkt) – Loßburg",
      "type": "Löschungsankündigung",
      "state": "Baden-Württemberg",
      "amtsgericht": "Amtsgericht Stuttgart",
      "registernummer": "HRB 748297",
      "registerart": "HRB",
      "company_name": "Onex Fitnessklub Loßburg UG (haftungsbeschränkt)",
      "company_seat": "Loßburg",
      "details": "27.01.2026 (Bekanntmachungsdatum)\n\nBaden-Württemberg Amtsgericht Stuttgart HRB 748297\nLöschungsankündigung\n\nOnex Fitnessklub Loßburg UG (haftungsbeschränkt)\nGesellschaft mit beschränkter Haftung\nLoßburg\n\nAls nicht eingetragen wird bekanntgemacht:\nDas Gericht beabsichtigt, die Gesellschaft wegen Vermögenslosigkeit im Handelsregister von Amts wegen nach § 394 FamFG zu löschen. Die Frist zur Geltendmachung eines Widerspruchs gegen die beabsichtigte Löschung ist auf zwei Monate ab Veröffentlichung bestimmt."
    },
    {
      "date": "2026-01-27",
      "id": "143524",
      "original_text": "Registerbekanntmachung nach dem Umwandlungsgesetz\nBaden-Württemberg Amtsgericht Stuttgart HRB 800991\nVariond Domus 10 GmbH – Stuttgart",
      "type": "Registerbekanntmachung nach dem Umwandlungsgesetz",
      "state": "Baden-Württemberg",
      "amtsgericht": "Amtsgericht Stuttgart",
      "registernummer": "HRB 800991",
      "registerart": "HRB",
      "company_name": "Variond Domus 10 GmbH",
      "company_seat": "Stuttgart",
      "details": "27.01.2026 (Bekanntmachungsdatum)\n\nBaden-Württemberg Amtsgericht Stuttgart HRB 800991\nRegisterbekanntmachung nach dem Umwandlungsgesetz 27.01.2026 (Eintragungsdatum)\n\nVariond Domus 10 GmbH\nGesellschaft mit beschränkter Haftung\nStuttgart\n\nAls nicht eingetragen wird bekanntgemacht:\nDen Gläubigern des an dem Formwechsel beteiligten Rechtsträgers ist, wenn sie binnen sechs Monaten nach dem Tag, an dem die Eintragung des Formwechsels in das Register des Sitzes desjenigen Rechtsträgers, dessen Gläubiger sie sind, nach § 19 Abs. 3 UmwG als bekanntgemacht gilt, ihren Anspruch nach Grund und Höhe schriftlich anmelden, Sicherheit zu leisten, soweit sie nicht Befriedigung verlangen können. Dieses Recht steht den Gläubigern jedoch nur zu, wenn sie glaubhaft machen, dass durch den Formwechsel die Erfüllung ihrer Forderung gefährdet wird."
    },
    {
      "date": "2026-01-27",
      "id": "143525",
      "original_text": "Löschungsankündigung\nBerlin Amtsgericht Berlin (Charlottenburg) HRB 82138\nGeißel Verwaltungs GmbH – Berlin",
      "type": "Löschungsankündigung",
      "state": "Berlin",
      "amtsgericht": "Amtsgericht Berlin (Charlottenburg)",
      "registernummer": "HRB 82138",
      "registerart": "HRB",
      "company_name": "Geißel Verwaltungs GmbH",
      "company_seat": "Berlin",
      "details": "27.01.2026 (Bekanntmachungsdatum)\n\nBerlin Amtsgericht Berlin (Charlottenburg) HRB 82138\nLöschungsankündigung\n\nGeißel Verwaltungs GmbH\nGesellschaft mit beschränkter Haftung\nBerlin\n\nBei der nachstehenden Gesellschaft wird das Amtslöschungsverfahren gemäß § 394 FamFG eingeleitet. Widerspruchsfrist 6 Wochen"
    },
    {
      "date": "2026-01-27",
      "id": "143526",
      "original_text": "Löschungsankündigung\nBerlin Amtsgericht Berlin (Charlottenburg) HRB 140130\nCOS Clean One Service GmbH – Berlin",
      "type": "Löschungsankündigung",
      "state": "Berlin",
      "amtsgericht": "Amtsgericht Berlin (Charlottenburg)",
      "registernummer": "HRB 140130",
      "registerart": "HRB",
      "company_name": "COS Clean One Service GmbH",
      "company_seat": "Berlin",
      "details": "27.01.2026 (Bekanntmachungsdatum)\n\nBerlin Amtsgericht Berlin (Charlottenburg) HRB 140130\nLöschungsankündigung\n\nCOS Clean One Service GmbH\nGesellschaft mit beschränkter Haftung\nBerlin\n\nBei der nachstehenden Gesellschaft wird das Amtslöschungsverfahren gemäß § 394 FamFG eingeleitet. Widerspruchsfrist 6 Wochen"
    },
    {
      "date": "2026-01-27",
      "id": "143527",
      "original_text": "Registerbekanntmachung nach dem Umwandlungsgesetz\nHamburg Amtsgericht Hamburg HRB 90143\nAquila Capital Vermögensverwaltung Schiffsbeteiligungen GmbH – Hamburg",
      "type": "Registerbekanntmachung nach dem Umwandlungsgesetz",
      "state": "Hamburg",
      "amtsgericht": "Amtsgericht Hamburg",
      "registernummer": "HRB 90143",
      "registerart": "HRB",
      "company_name": "Aquila Capital Vermögensverwaltung Schiffsbeteiligungen GmbH",
      "company_seat": "Hamburg",
      "details": "27.01.2026 (Bekanntmachungsdatum)\n\nHamburg Amtsgericht Hamburg HRB 90143\nRegisterbekanntmachung nach dem Umwandlungsgesetz 27.01.2026 (Eintragungsdatum)\n\nAquila Capital Vermögensverwaltung Schiffsbeteiligungen GmbH\nGesellschaft mit beschränkter Haftung\nHamburg\n\nAls nicht eingetragen wird bekannt gemacht:\nDen Gläubigern der an der Verschmelzung beteiligten Gesellschaften ist, wenn sie binnen sechs Monaten nach dem Tag, an dem die Eintragung der Verschmelzung in das Register des Sitzes desjenigen Rechtsträgers, dessen Gläubiger sie sind, nach § 19 Absatz 3 UmwG als bekannt gemacht gilt, ihren Anspruch nach Grund und Höhe schriftlich anmelden, Sicherheit zu leisten, soweit sie nicht Befriedigung verlangen können. Dieses Recht steht den Gläubigern jedoch nur zu, wenn sie glaubhaft machen, dass durch die Verschmelzung die Erfüllung ihrer Forderung gefährdet wird."
    },
    {
      "date": "2026-01-27",
      "id": "143528",
      "original_text": "Registerbekanntmachung nach dem Umwandlungsgesetz\nHamburg Amtsgericht Hamburg HRB 172124\nAquila Capital Growth Holding GmbH – Hamburg",
      "type": "Registerbekanntmachung nach dem Umwandlungsgesetz",
      "state": "Hamburg",
      "amtsgericht": "Amtsgericht Hamburg",
      "registernummer": "HRB 172124",
      "registerart": "HRB",
      "company_name": "Aquila Capital Growth Holding GmbH",
      "company_seat": "Hamburg",
      "details": "27.01.2026 (Bekanntmachungsdatum)\n\nHamburg Amtsgericht Hamburg HRB 172124\nRegisterbekanntmachung nach dem Umwandlungsgesetz 27.01.2026 (Eintragungsdatum)\n\nAquila Capital Growth Holding GmbH\nGesellschaft mit beschränkter Haftung\nHamburg\n\nAls nicht eingetragen wird bekannt gemacht:\nDen Gläubigern der an der Verschmelzung beteiligten Gesellschaften ist, wenn sie binnen sechs Monaten nach dem Tag, an dem die Eintragung der Verschmelzung in das Register des Sitzes desjenigen Rechtsträgers, dessen Gläubiger sie sind, nach § 19 Absatz 3 UmwG als bekannt gemacht gilt, ihren Anspruch nach Grund und Höhe schriftlich anmelden, Sicherheit zu leisten, soweit sie nicht Befriedigung verlangen können. Dieses Recht steht den Gläubigern jedoch nur zu, wenn sie glaubhaft machen, dass durch die Verschmelzung die Erfüllung ihrer Forderung gefährdet wird."
    },
    {
      "date": "2026-01-27",
      "id": "143529",
      "original_text": "Sonstige Registerbekanntmachung\nBerlin Amtsgericht Berlin (Charlottenburg) HRB 165081\nCD Deutsche Eigenheim AG – Berlin",
      "type": "Sonstige Registerbekanntmachung",
      "state": "Berlin",
      "amtsgericht": "Amtsgericht Berlin (Charlottenburg)",
      "registernummer": "HRB 165081",
      "registerart": "HRB",
      "company_name": "CD Deutsche Eigenheim AG",
      "company_seat": "Berlin",
      "details": "27.01.2026 (Bekanntmachungsdatum)\n\nBerlin Amtsgericht Berlin (Charlottenburg) HRB 165081\nSonstige Registerbekanntmachung\n\nCD Deutsche Eigenheim AG\nAktiengesellschaft\nBerlin\n\nAls nicht eingetragen wird veröffentlicht: Es wurde eine neue Liste der Aufsichtsratsmitglieder eingereicht (§ 106 AktG)."
    },
    {
      "date": "2026-01-27",
      "id": "143530",
      "original_text": "Einreichung neuer Dokumente\nBrandenburg Amtsgericht Potsdam HRB 30121\nSK 96 - Wohnungsbaukombinat GmbH – Zossen",
      "type": "Einreichung neuer Dokumente",
      "state": "Brandenburg",
      "amtsgericht": "Amtsgericht Potsdam",
      "registernummer": "HRB 30121",
      "registerart": "HRB",
      "company_name": "SK 96 - Wohnungsbaukombinat GmbH",
      "company_seat": "Zossen",
      "details": "27.01.2026 (Bekanntmachungsdatum)\n\nBrandenburg Amtsgericht Potsdam HRB 30121\nEinreichung neuer Dokumente\n\nSK 96 - Wohnungsbaukombinat GmbH\nGesellschaft mit beschränkter Haftung\nZossen\n\nAls nicht eingetragen wird veröffentlicht: Dem Amtsgericht Potsdam wurde der Entwurf des Formwechselplanes vom 15.12.2025 betreffend den grenzüberschreitenden , identitätswahrenden Formwechsel der Gesellschaft in eine Gesellschaft mit beschränkter Haftung nach dem Recht des Großherzogtums Luxemburg unter Verlegung des Sitzes der Gesellschaft nach Luxemburg eingereicht. Dazu wird Folgendes bekannt gemacht: 1. § 336 UmwG i.V.m. § 308 Abs. 1 S. 2Nr. 1 UmwG:\nDie Gesellschaft hat den Entwurf des Formwechselplans betreffend den grenzüberschreitenden Formwechsel im Wege des Herausformwechsels ohne Abwicklung und Auflösung von einer deutschen GmbH in eine reine Société à responsabilité  limitée (S.à r.l.)luxemburgischen Rechts mit gleichzeitiger Verlegung des Satzungssitzes nach Luxemburg, Großherzogtum Luxemburg, beim Handelsregister des Amtsgerichts Potsdam gemäß § 336 UmwG in Verbindung mit § 308 Abs. 1 Satz 2 Nr. 1 UmwG eingereicht. 2. § 336 UmwG i.V.m. § 308 Abs. 1 S. 2  Nr. 2 UmwG: An dem grenzüberschreitenden Formwechsel ist die SK 96 - Wohnungsbaukombinat GmbH mit Satzungssitz in Zossen, Deutschland, eine nach deutschem Recht  bestehende\nGesellschaft mit beschränkter Haftung, beteiligt. Nach dem grenzüberschreitenden Formwechsel wird die Gesellschaft die Rechtsform einer reinen Société à responsabilité limitée (S.à r.l.), eine Gesellschaft mit beschränkter Haftung nach dem Recht des Großherzogtums Luxemburg, annehmen und als  SK 96 - Wohnungsbaukombinat S.à r.l. mit Satzungssitz in Luxemburg,Großherzogtum Luxemburg firmieren. 3. § 336 UmwG i.V.m. § 308 Abs. 1 S. 2 Nr. 3 UmwG: Die Gesellschaft ist im Handelsregister des Amtsgerichts Potsdam unter der Handelsregisternummer HRB 30121 P eingetragen. Die Gesellschaft ist zudem im Handels- und Gesellschaftsregister von Luxemburg (Registre de commerce et des sociétés Luxembourg) unter der Nummer B228416 eingetragen, welche auch künftig fortbestehen wird. 4. § 336 UmwG i.V.m. § 308 Abs. 1 S. 2 Nr. 4 UmwG:\nDie Gesellschafterversammlung zum Beschluss des grenzüberschreitenden Formwechsels ist für den Tag geplant, der auf den Ablauf von einem Monat nach dem Tag der Registerbekanntmachung des Formwechselplans folgt, oder ggfs. den nächsten Arbeitstag (wobei Samstage, Sonntage und bundesweite Feiertage nicht\nals Arbeitstage zählen). a) Die Anteilsinhaber und die Gläubiger der Gesellschaft erhalten den Hinweis, dass sie spätestens fünf Arbeitstage vor dem Tag der Gesellschafterversammlung der Gesellschaft Bemerkungen zum Formwechselplan übermitteln können. b) Einen Betriebsrat gibt es nicht, die Gesellschaft hat keine Arbeitnehmer. Der guten Ordnung halber erfolgt gleichwohl der Hinweis, dass die zuständigen Betriebsräte der Gesellschaft oder, soweit es keinen Betriebsrat gibt, die\nArbeitnehmer der Gesellschaft, spätestens fünf Arbeitstage vor dem Tag der Gesellschafterversammlung der Gesellschaft Bemerkungen zum Formwechselplan übermitteln können."
    },
    {
      "date": "2026-01-27",
      "id": "143531",
      "original_text": "Löschungsankündigung\nBerlin Amtsgericht Berlin (Charlottenburg) HRB 215338\ncaretastic aesthetic GmbH – Berlin",
      "type": "Löschungsankündigung",
      "state": "Berlin",
      "amtsgericht": "Amtsgericht Berlin (Charlottenburg)",
      "registernummer": "HRB 215338",
      "registerart": "HRB",
      "company_name": "caretastic aesthetic GmbH",
      "company_seat": "Berlin",
      "details": "27.01.2026 (Bekanntmachungsdatum)\n\nBerlin Amtsgericht Berlin (Charlottenburg) HRB 215338\nLöschungsankündigung\n\ncaretastic aesthetic GmbH\nGesellschaft mit beschränkter Haftung\nBerlin\n\nBei der nachstehenden Gesellschaft wird das Amtslöschungsverfahren gemäß § 394 FamFG eingeleitet. Widerspruchsfrist 6 Wochen"
    },
    {
      "date": "2026-01-27",
      "id": "143532",
      "original_text": "Einreichung neuer Dokumente\nBrandenburg Amtsgericht Potsdam HRB 28293\nRavenna Lodging GmbH – Zossen",
      "type": "Einreichung neuer Dokumente",
      "state": "Brandenburg",
      "amtsgericht": "Amtsgericht Potsdam",
      "registernummer": "HRB 28293",
      "registerart": "HRB",
      "company_name": "Ravenna Lodging GmbH",
      "company_seat": "Zossen",
      "details": "27.01.2026 (Bekanntmachungsdatum)\n\nBrandenburg Amtsgericht Potsdam HRB 28293\nEinreichung neuer Dokumente\n\nRavenna Lodging GmbH\nGesellschaft mit beschränkter Haftung\nZossen\n\nAls nicht eingetragen wird veröffentlicht: Dem Amtsgericht Potsdam wurde der Entwurf des Formwechselplanes vom 15.12.2025 betreffend den grenzüberschreitenden , identitätswahrenden Formwechsel der Gesellschaft in eine Gesellschaft mit beschränkter Haftung nach dem Recht des Großherzogtums Luxemburg unter Verlegung des Sitzes der Gesellschaft nach Luxemburg eingereicht. Dazu wird Folgendes bekannt gemacht: 1. § 336 UmwG i.V.m. § 308 Abs. 1 S. 2Nr. 1 UmwG: Die Gesellschaft hat den Entwurf des Formwechselplans betreffend den grenzüberschreitenden Formwechsel im Wege des Herausformwechsels ohne Abwicklung und Auflösung von einer deutschen GmbH in eine reine Société à responsabilité  limitée (S.à r.l.)luxemburgischen Rechts mit gleichzeitiger Verlegung des Satzungssitzes nach Luxemburg, Großherzogtum Luxemburg, beim Handelsregister des Amtsgerichts Potsdam gemäß § 336 UmwG in Verbindung mit § 308 Abs. 1 Satz 2 Nr. 1 UmwG eingereicht. 2. § 336 UmwG i.V.m. § 308 Abs. 1 S. 2  Nr. 2 UmwG: An dem grenzüberschreitenden Formwechsel ist die Ravenna Lodging GmbH mit Satzungssitz in Zossen, Deutschland, eine nach deutschem Recht  bestehende Gesellschaft mit beschränkter Haftung, beteiligt. Nach dem grenzüberschreitenden Formwechsel wird die Gesellschaft die Rechtsform einer\nreinen Société à responsabilité limitée (S.à r.l.), eine Gesellschaft mit beschränkter Haftung nach dem Recht des Großherzogtums Luxemburg, annehmen und als Ravenna Ldging S.à r.l. mit Satzungssitz in Luxemburg,Großherzogtum Luxemburg firmieren. 3. § 336 UmwG i.V.m. § 308 Abs. 1 S. 2 Nr. 3 UmwG: Die Gesellschaft ist im Handelsregister des Amtsgerichts Potsdam unter der Handelsregisternummer HRB 28293 P eingetragen. Die Gesellschaft ist zudem im Handels- und Gesellschaftsregister von Luxemburg (Registre de commerce et des sociétés Luxembourg) unter der Nummer B228411 eingetragen, welche auch künftig fortbestehen wird. 4. § 336 UmwG i.V.m. § 308 Abs. 1 S. 2 Nr. 4 UmwG: Die Gesellschafterversammlung zum Beschluss des grenzüberschreitenden Formwechsels ist für den Tag geplant, der auf den Ablauf von einem Monat nach dem Tag der Registerbekanntmachung des Formwechselplans folgt, oder ggfs. den nächsten Arbeitstag (wobei Samstage, Sonntage und bundesweite Feiertage nicht als Arbeitstage zählen). a) Die Anteilsinhaber und die Gläubiger der Gesellschaft erhalten den Hinweis, dass sie spätestens fünf Arbeitstage vor dem Tag der Gesellschafterversammlung der Gesellschaft Bemerkungen zum Formwechselplan übermitteln können. b) Einen Betriebsrat gibt es nicht, die Gesellschaft hat keine Arbeitnehmer. Der guten Ordnung halber erfolgt gleichwohl der Hinweis, dass die zuständigen Betriebsräte der Gesellschaft oder, soweit es keinen Betriebsrat gibt, die Arbeitnehmer der Gesellschaft, spätestens fünf Arbeitstage vor dem Tag der Gesellschafterversammlung der Gesellschaft Bemerkungen zum\nFormwechselplan übermitteln können."
    },
    {
      "date": "2026-01-27",
      "id": "143533",
      "original_text": "Löschungsankündigung\nBaden-Württemberg Amtsgericht Mannheim HRB 709433\nnemo Abwicklungsgesellschaft Schutterwald GmbH – Ettlingen",
      "type": "Löschungsankündigung",
      "state": "Baden-Württemberg",
      "amtsgericht": "Amtsgericht Mannheim",
      "registernummer": "HRB 709433",
      "registerart": "HRB",
      "company_name": "nemo Abwicklungsgesellschaft Schutterwald GmbH",
      "company_seat": "Ettlingen",
      "details": "27.01.2026 (Bekanntmachungsdatum)\n\nBaden-Württemberg Amtsgericht Mannheim HRB 709433\nLöschungsankündigung\n\nnemo Abwicklungsgesellschaft Schutterwald GmbH\nGesellschaft mit beschränkter Haftung\nEttlingen\n\nAls nicht eingetragen wird bekanntgemacht:\nDas Gericht beabsichtigt, die Gesellschaft wegen Vermögenslosigkeit im Handelsregister von Amts wegen nach § 394 FamFG zu löschen. Die Frist zur Geltendmachung eines Widerspruchs gegen die beabsichtigte Löschung ist auf einen Monat ab Veröffentlichung bestimmt."
    },
    {
      "date": "2026-01-27",
      "id": "143534",
      "original_text": "Sonstige Registerbekanntmachung\nBerlin Amtsgericht Berlin (Charlottenburg) VR 42352\nBGT - Bundesverband grabenlose Technologien e.V. – Berlin",
      "type": "Sonstige Registerbekanntmachung",
      "state": "Berlin",
      "amtsgericht": "Amtsgericht Berlin (Charlottenburg)",
      "registernummer": "VR 42352",
      "registerart": "VR",
      "company_name": "BGT - Bundesverband grabenlose Technologien e.V.",
      "company_seat": "Berlin",
      "details": "27.01.2026 (Bekanntmachungsdatum)\n\nBerlin Amtsgericht Berlin (Charlottenburg) VR 42352\nSonstige Registerbekanntmachung 26.01.2026 (Eintragungsdatum)\n\nBGT - Bundesverband grabenlose Technologien e.V.\neingetragener Verein\nBerlin\n\nZur Eintragungsnummer 1 vom 26.01.2026 wird als nicht eingetragen  veröffentlicht: Den Gläubigern der an der Verschmelzung beteiligten Rechtsträger ist, wenn sie binnen sechs Monaten nach dem Tag, an dem die Eintragung der Verschmelzung in das Register des Sitzes desjenigen Rechtsträgers, dessen Gläubiger sie sind, als bekannt gemacht gilt, ihren Anspruch nach Grund und Höhe schriftlich anmelden, Sicherheit zu leisten, soweit sie nicht Befriedigung verlangen können. Dieses Recht steht den Gläubigern jedoch nur zu, wenn sie glaubhaft machen, dass durch die Verschmelzung die Erfüllung ihrer Forderung gefährdet wird. Das Recht, Sicherheitsleistung zu verlangen, steht Gläubigern nicht zu, die im Falle der Insolvenz ein Recht auf vorzugsweise Befriedigung aus einer Deckungsmasse haben, die nach gesetzlicher Vorschrift zu ihrem Schutz errichtet und staatlich überwacht ist."
    },
    {
      "date": "2026-01-27",
      "id": "143535",
      "original_text": "Einreichung neuer Dokumente\nBaden-Württemberg Amtsgericht Stuttgart HRB 24251\nFERMO-Massivhaus Aktiengesellschaft – Murr",
      "type": "Einreichung neuer Dokumente",
      "state": "Baden-Württemberg",
      "amtsgericht": "Amtsgericht Stuttgart",
      "registernummer": "HRB 24251",
      "registerart": "HRB",
      "company_name": "FERMO-Massivhaus Aktiengesellschaft",
      "company_seat": "Murr",
      "details": "27.01.2026 (Bekanntmachungsdatum)\n\nBaden-Württemberg Amtsgericht Stuttgart HRB 24251\nEinreichung neuer Dokumente\n\nFERMO-Massivhaus Aktiengesellschaft\nAktiengesellschaft\nMurr\n\nDie Gesellschaft hat am 26.01.2026 die Liste über die Zusammensetzung des Aufsichtsrats zum Handelsregister eingereicht."
    },
    {
      "date": "2026-01-27",
      "id": "143536",
      "original_text": "Sonstige Registerbekanntmachung\nBerlin Amtsgericht Berlin (Charlottenburg) VR 26063\nGSTT German Society for Trenchless Technology e.V. – Berlin",
      "type": "Sonstige Registerbekanntmachung",
      "state": "Berlin",
      "amtsgericht": "Amtsgericht Berlin (Charlottenburg)",
      "registernummer": "VR 26063",
      "registerart": "VR",
      "company_name": "GSTT German Society for Trenchless Technology e.V.",
      "company_seat": "Berlin",
      "details": "27.01.2026 (Bekanntmachungsdatum)\n\nBerlin Amtsgericht Berlin (Charlottenburg) VR 26063\nSonstige Registerbekanntmachung 26.01.2026 (Eintragungsdatum)\n\nGSTT German Society for Trenchless Technology e.V.\neingetragener Verein\nBerlin\n\nZu Eintragung Nr. 12 vom 26.01.2025 wird als nicht eingetragen veröffentlicht: Den Gläubigern der an der Verschmelzung beteiligten Rechtsträger ist, wenn sie binnen sechs Monaten nach dem Tag, an dem die Eintragung der Verschmelzung in das Register des Sitzes desjenigen Rechtsträgers, dessen Gläubiger sie sind, als bekannt gemacht gilt, ihren Anspruch nach Grund und Höhe schriftlich anmelden, Sicherheit zu leisten, soweit sie nicht Befriedigung verlangen können. Dieses Recht steht den Gläubigern jedoch nur zu, wenn sie glaubhaft machen, dass durch die Verschmelzung die Erfüllung ihrer Forderung gefährdet wird. Das Recht, Sicherheitsleistung zu verlangen, steht Gläubigern nicht zu, die im Falle der Insolvenz ein Recht auf vorzugsweise Befriedigung aus einer Deckungsmasse haben, die nach gesetzlicher Vorschrift zu ihrem Schutz errichtet und staatlich überwacht ist."
    },
    {
      "date": "2026-01-27",
      "id": "143537",
      "original_text": "Einreichung neuer Dokumente\nSchleswig-Holstein Amtsgericht Pinneberg HRB 4533\nX-Line Service für radiologische Praxen Aktiengesellschaft – Pinneberg",
      "type": "Einreichung neuer Dokumente",
      "state": "Schleswig-Holstein",
      "amtsgericht": "Amtsgericht Pinneberg",
      "registernummer": "HRB 4533",
      "registerart": "HRB",
      "company_name": "X-Line Service für radiologische Praxen Aktiengesellschaft",
      "company_seat": "Pinneberg",
      "details": "27.01.2026 (Bekanntmachungsdatum)\n\nSchleswig-Holstein Amtsgericht Pinneberg HRB 4533\nEinreichung neuer Dokumente\n\nX-Line Service für radiologische Praxen Aktiengesellschaft\nAktiengesellschaft\nPinneberg\n\nAls nicht eingetragen wird veröffentlicht: Es ist eine neue Liste der Aufsichtsratsmitglieder gemäß § 106 AktG zum Handelsregister eingereicht worden."
    },
    {
      "date": "2026-01-27",
      "id": "143538",
      "original_text": "Löschungsankündigung\nBaden-Württemberg Amtsgericht Stuttgart HRB 25227\n33 Event GmbH – Stuttgart",
      "type": "Löschungsankündigung",
      "state": "Baden-Württemberg",
      "amtsgericht": "Amtsgericht Stuttgart",
      "registernummer": "HRB 25227",
      "registerart": "HRB",
      "company_name": "33 Event GmbH",
      "company_seat": "Stuttgart",
      "details": "27.01.2026 (Bekanntmachungsdatum)\n\nBaden-Württemberg Amtsgericht Stuttgart HRB 25227\nLöschungsankündigung\n\n33 Event GmbH\nGesellschaft mit beschränkter Haftung\nStuttgart\n\nDas Gericht beabsichtigt, die Gesellschaft wegen Vermögenslosigkeit im Handelsregister von Amts wegen nach § 394 FamFG zu löschen. Die Frist zur Geltendmachung eines Widerspruchs gegen die beabsichtigte Löschung ist auf zwei Monate ab Veröffentlichung bestimmt."
    },
    {
      "date": "2026-01-27",
      "id": "143539",
      "original_text": "Registerbekanntmachung nach dem Umwandlungsgesetz\nBaden-Württemberg Amtsgericht Stuttgart HRB 755318\nIngenieurbüro Tenschert GmbH – Schwäbisch Hall",
      "type": "Registerbekanntmachung nach dem Umwandlungsgesetz",
      "state": "Baden-Württemberg",
      "amtsgericht": "Amtsgericht Stuttgart",
      "registernummer": "HRB 755318",
      "registerart": "HRB",
      "company_name": "Ingenieurbüro Tenschert GmbH",
      "company_seat": "Schwäbisch Hall",
      "details": "27.01.2026 (Bekanntmachungsdatum)\n\nBaden-Württemberg Amtsgericht Stuttgart HRB 755318\nRegisterbekanntmachung nach dem Umwandlungsgesetz 27.01.2026 (Eintragungsdatum)\n\nIngenieurbüro Tenschert GmbH\nGesellschaft mit beschränkter Haftung\nSchwäbisch Hall\n\nDen Gläubigern des an dem Formwechsel beteiligten Rechtsträgers ist, wenn sie binnen sechs Monaten nach dem Tag, an dem die Eintragung des Formwechsels in das Register des Sitzes desjenigen Rechtsträgers, dessen Gläubiger sie sind, nach § 19 Abs. 3 UmwG als bekanntgemacht gilt, ihren Anspruch nach Grund und Höhe schriftlich anmelden, Sicherheit zu leisten, soweit sie nicht Befriedigung verlangen können. Dieses Recht steht den Gläubigern jedoch nur zu, wenn sie glaubhaft machen, dass durch den Formwechsel die Erfüllung ihrer Forderung gefährdet wird."
    },
    {
      "date": "2026-01-27",
      "id": "143540",
      "original_text": "Sonstige Registerbekanntmachung\nBaden-Württemberg Amtsgericht Stuttgart HRB 753062\nNetze BW Wasser GmbH – Stuttgart",
      "type": "Sonstige Registerbekanntmachung",
      "state": "Baden-Württemberg",
      "amtsgericht": "Amtsgericht Stuttgart",
      "registernummer": "HRB 753062",
      "registerart": "HRB",
      "company_name": "Netze BW Wasser GmbH",
      "company_seat": "Stuttgart",
      "details": "27.01.2026 (Bekanntmachungsdatum)\n\nBaden-Württemberg Amtsgericht Stuttgart HRB 753062\nSonstige Registerbekanntmachung 27.01.2026 (Eintragungsdatum)\n\nNetze BW Wasser GmbH\nGesellschaft mit beschränkter Haftung\nStuttgart\n\nAls nicht eingetragen wird bekanntgemacht:\nDen Gläubigern der Gesellschaft, deren Forderungen begründet worden sind, bevor die Eintragung der Beendigung des Vertrages in das Handelsregister nach § 10 HGB als bekanntgemacht gilt, ist vom anderen Vertragsteil Sicherheit zu leisten, wenn sie sich binnen sechs Monaten nach der Bekanntmachung zu diesem Zweck bei ihm melden."
    },
    {
      "date": "2026-01-27",
      "id": "143541",
      "original_text": "Registerbekanntmachung nach dem Umwandlungsgesetz\nBaden-Württemberg Amtsgericht Stuttgart PR 721294\nTenschert + Holdreich Beratende Ingenieure PartGmbB – Schwäbisch Hall",
      "type": "Registerbekanntmachung nach dem Umwandlungsgesetz",
      "state": "Baden-Württemberg",
      "amtsgericht": "Amtsgericht Stuttgart",
      "registernummer": "PR 721294",
      "registerart": "PR",
      "company_name": "Tenschert + Holdreich Beratende Ingenieure PartGmbB",
      "company_seat": "Schwäbisch Hall",
      "details": "27.01.2026 (Bekanntmachungsdatum)\n\nBaden-Württemberg Amtsgericht Stuttgart PR 721294\nRegisterbekanntmachung nach dem Umwandlungsgesetz 27.01.2026 (Eintragungsdatum)\n\nTenschert + Holdreich Beratende Ingenieure PartGmbB\nPartnerschaftsgesellschaft\nSchwäbisch Hall\n\nDen Gläubigern des an dem Formwechsel beteiligten Rechtsträgers ist, wenn sie binnen sechs Monaten nach dem Tag, an dem die Eintragung des Formwechsels in das Register des Sitzes desjenigen Rechtsträgers, dessen Gläubiger sie sind, nach § 19 Abs. 3 UmwG als bekanntgemacht gilt, ihren Anspruch nach Grund und Höhe schriftlich anmelden, Sicherheit zu leisten, soweit sie nicht Befriedigung verlangen können. Dieses Recht steht den Gläubigern jedoch nur zu, wenn sie glaubhaft machen, dass durch den Formwechsel die Erfüllung ihrer Forderung gefährdet wird."
    },
    {
      "date": "2026-01-27",
      "id": "143542",
      "original_text": "Löschungsankündigung\nBaden-Württemberg Amtsgericht Stuttgart HRB 747666\nsteuer21.de UG (haftungsbeschränkt) – Fellbach",
      "type": "Löschungsankündigung",
      "state": "Baden-Württemberg",
      "amtsgericht": "Amtsgericht Stuttgart",
      "registernummer": "HRB 747666",
      "registerart": "HRB",
      "company_name": "steuer21.de UG (haftungsbeschränkt)",
      "company_seat": "Fellbach",
      "details": "27.01.2026 (Bekanntmachungsdatum)\n\nBaden-Württemberg Amtsgericht Stuttgart HRB 747666\nLöschungsankündigung\n\nsteuer21.de UG (haftungsbeschränkt)\nGesellschaft mit beschränkter Haftung\nFellbach\n\nDas Gericht beabsichtigt, die Gesellschaft wegen Vermögenslosigkeit im Handelsregister von Amts wegen nach § 394 FamFG zu löschen. Die Frist zur Geltendmachung eines Widerspruchs gegen die beabsichtigte Löschung ist auf zwei Monate ab Veröffentlichung bestimmt."
    },
    {
      "date": "2026-01-27",
      "id": "143543",
      "original_text": "Sonstige Registerbekanntmachung\nHamburg Amtsgericht Hamburg HRB 43239\nTREUGARANT Aktiengesellschaft Treuhand- und Beratungsgesellschaft Steuerberatungsgesellschaft – Hamburg",
      "type": "Sonstige Registerbekanntmachung",
      "state": "Hamburg",
      "amtsgericht": "Amtsgericht Hamburg",
      "registernummer": "HRB 43239",
      "registerart": "HRB",
      "company_name": "TREUGARANT Aktiengesellschaft Treuhand- und Beratungsgesellschaft Steuerberatungsgesellschaft",
      "company_seat": "Hamburg",
      "details": "27.01.2026 (Bekanntmachungsdatum)\n\nHamburg Amtsgericht Hamburg HRB 43239\nSonstige Registerbekanntmachung 27.01.2026 (Eintragungsdatum)\n\nTREUGARANT Aktiengesellschaft Treuhand- und Beratungsgesellschaft Steuerberatungsgesellschaft\nAktiengesellschaft\nHamburg\n\nAls nicht eingetragen wird bekannt gemacht:\nDen Gläubigern der Gesellschaft ist, wenn sie binnen sechs Monaten nach dieser Bekanntmachung ihren Anspruch nach Grund und Höhe anmelden, Sicherheit zu leisten, soweit sie nicht Befriedigung verlangen können. Das Recht steht ihnen jedoch nicht zu, wenn sie im Falle eines Insolvenzverfahrens ein Recht auf vorzugsweise Befriedigung aus einer Deckungsmasse haben, die nach gesetzlicher Vorschrift zu ihrem Schutz errichtet und staatlich überwacht ist."
    },
    {
      "date": "2026-01-27",
      "id": "143544",
      "original_text": "Registerbekanntmachung nach dem Umwandlungsgesetz\nMecklenburg-Vorpommern Amtsgericht Rostock HRB 16762\nTN Invest GmbH – Rostock",
      "type": "Registerbekanntmachung nach dem Umwandlungsgesetz",
      "state": "Mecklenburg-Vorpommern",
      "amtsgericht": "Amtsgericht Rostock",
      "registernummer": "HRB 16762",
      "registerart": "HRB",
      "company_name": "TN Invest GmbH",
      "company_seat": "Rostock",
      "details": "27.01.2026 (Bekanntmachungsdatum)\n\nMecklenburg-Vorpommern Amtsgericht Rostock HRB 16762\nRegisterbekanntmachung nach dem Umwandlungsgesetz 27.01.2026 (Eintragungsdatum)\n\nTN Invest GmbH\nGesellschaft mit beschränkter Haftung\nRostock\n\nAls nicht eingetragen wird veröffentlicht: Den Gläubigern der an der Umwandlung beteiligten Rechtsträger ist, wenn sie binnen sechs\nMonaten nach dem Tag, an dem die Eintragung der Umwandlung in das Register des Sitzes desjenigen Rechtsträgers, dessen Gläubiger sie sind, nach § 19 Abs. 3 UmwG als bekannt gemacht gilt, ihren Anspruch nach Grund und Höhe in Textform anmelden, Sicherheit zu leisten, soweit sie nicht Befriedigung verlangen können. Dieses Recht steht den Gläubigern jedoch nur zu, wenn sie glaubhaft machen, dass durch die Umwandlung die Erfüllung der Forderung gefährdet wird."
    },
    {
      "date": "2026-01-27",
      "id": "143545",
      "original_text": "Registerbekanntmachung nach dem Umwandlungsgesetz\nBaden-Württemberg Amtsgericht Stuttgart VR 210998\nRuth Cohn Institut für TZI - Württemberg e.V. Verein für Themenzentrierte Interaktion (TZI) – Esslingen am Neckar",
      "type": "Registerbekanntmachung nach dem Umwandlungsgesetz",
      "state": "Baden-Württemberg",
      "amtsgericht": "Amtsgericht Stuttgart",
      "registernummer": "VR 210998",
      "registerart": "VR",
      "company_name": "Ruth Cohn Institut für TZI - Württemberg e.V. Verein für Themenzentrierte Interaktion (TZI)",
      "company_seat": "Esslingen am Neckar",
      "details": "27.01.2026 (Bekanntmachungsdatum)\n\nBaden-Württemberg Amtsgericht Stuttgart VR 210998\nRegisterbekanntmachung nach dem Umwandlungsgesetz 27.01.2026 (Eintragungsdatum)\n\nRuth Cohn Institut für TZI - Württemberg e.V. Verein für Themenzentrierte Interaktion (TZI)\neingetragener Verein\nEsslingen am Neckar\n\nAls nicht eingetragen wird bekanntgemacht:\nDen Gläubigern der an der Verschmelzung beteiligten Rechtsträger ist, wenn sie binnen sechs Monaten nach dem Tag, an dem die Eintragung der Verschmelzung in das Register des Sitzes desjenigen Rechtsträgers, dessen Gläubiger sie sind, nach § 19 Abs. 3 UmwG als bekanntgemacht gilt, ihren Anspruch nach Grund und Höhe schriftlich anmelden, Sicherheit zu leisten, soweit sie nicht Befriedigung verlangen können. Dieses Recht steht den Gläubigern jedoch nur zu, wenn sie glaubhaft machen, dass durch die Verschmelzung die Erfüllung ihrer Forderung gefährdet wird."
    },
    {
      "date": "2026-01-27",
      "id": "143546",
      "original_text": "Einreichung neuer Dokumente\nBaden-Württemberg Amtsgericht Stuttgart HRB 10814\nHafen Stuttgart Gesellschaft mit beschränkter Haftung – Stuttgart",
      "type": "Einreichung neuer Dokumente",
      "state": "Baden-Württemberg",
      "amtsgericht": "Amtsgericht Stuttgart",
      "registernummer": "HRB 10814",
      "registerart": "HRB",
      "company_name": "Hafen Stuttgart Gesellschaft mit beschränkter Haftung",
      "company_seat": "Stuttgart",
      "details": "27.01.2026 (Bekanntmachungsdatum)\n\nBaden-Württemberg Amtsgericht Stuttgart HRB 10814\nEinreichung neuer Dokumente\n\nHafen Stuttgart Gesellschaft mit beschränkter Haftung\nGesellschaft mit beschränkter Haftung\nStuttgart\n\nDie Gesellschaft hat am 13.01.2026 die Liste über die Zusammensetzung des Aufsichtsrats zum Handelsregister eingereicht."
    },
    {
      "date": "2026-01-27",
      "id": "143547",
      "original_text": "Löschungsankündigung\nBaden-Württemberg Amtsgericht Stuttgart HRB 787080\nCriss-Bau UG (haftungsbeschränkt) – Nürtingen",
      "type": "Löschungsankündigung",
      "state": "Baden-Württemberg",
      "amtsgericht": "Amtsgericht Stuttgart",
      "registernummer": "HRB 787080",
      "registerart": "HRB",
      "company_name": "Criss-Bau UG (haftungsbeschränkt)",
      "company_seat": "Nürtingen",
      "details": "27.01.2026 (Bekanntmachungsdatum)\n\nBaden-Württemberg Amtsgericht Stuttgart HRB 787080\nLöschungsankündigung\n\nCriss-Bau UG (haftungsbeschränkt)\nGesellschaft mit beschränkter Haftung\nNürtingen\n\nAls nicht eingetragen wird bekanntgemacht:\nDas Gericht beabsichtigt, die Gesellschaft wegen Vermögenslosigkeit im Handelsregister von Amts wegen nach § 394 FamFG zu löschen. Die Frist zur Geltendmachung eines Widerspruchs gegen die beabsichtigte Löschung ist auf zwei Monate ab Veröffentlichung bestimmt."
    },
    {
      "date": "2026-01-27",
      "id": "143548",
      "original_text": "Sonstige Registerbekanntmachung\nSachsen-Anhalt Amtsgericht Stendal HRB 111785\nM-O-W Verwaltungsgesellschaft mbH – Osterweddingen",
      "type": "Sonstige Registerbekanntmachung",
      "state": "Sachsen-Anhalt",
      "amtsgericht": "Amtsgericht Stendal",
      "registernummer": "HRB 111785",
      "registerart": "HRB",
      "company_name": "M-O-W Verwaltungsgesellschaft mbH",
      "company_seat": "Osterweddingen",
      "details": "27.01.2026 (Bekanntmachungsdatum)\n\nSachsen-Anhalt Amtsgericht Stendal HRB 111785\nSonstige Registerbekanntmachung\n\nM-O-W Verwaltungsgesellschaft mbH\nGesellschaft mit beschränkter Haftung\nOsterweddingen\n\nHinsichtlich o.g. Gesellschaft ist beabsichtigt, Herrn Prof. Dr. Jörg Rafael Heim LL.M., geb. am 22.10.1966, wohnhaft in Westfeld\nzum Notgeschäftsführer zu bestellen.\nDie Frist zu Einreichung etwaiger Stellungnahmen bzw. Erhebung eines Widerspruchs wird auf 1 Monat festgesetzt."
    },
    {
      "date": "2026-01-27",
      "id": "143549",
      "original_text": "Einreichung neuer Dokumente\nBrandenburg Amtsgericht Neuruppin HRB 12384\nLE.O Gruppe GmbH – Oranienburg",
      "type": "Einreichung neuer Dokumente",
      "state": "Brandenburg",
      "amtsgericht": "Amtsgericht Neuruppin",
      "registernummer": "HRB 12384",
      "registerart": "HRB",
      "company_name": "LE.O Gruppe GmbH",
      "company_seat": "Oranienburg",
      "details": "27.01.2026 (Bekanntmachungsdatum)\n\nBrandenburg Amtsgericht Neuruppin HRB 12384\nEinreichung neuer Dokumente\n\nLE.O Gruppe GmbH\nGesellschaft mit beschränkter Haftung\nOranienburg\n\nAls nicht eingetragen wird veröffentlicht: Eine Liste der Mitglieder des Aufsichtsrates wurde zum Handelsregister eingereicht."
    },
    {
      "date": "2026-01-27",
      "id": "143550",
      "original_text": "Registerbekanntmachung nach dem Umwandlungsgesetz\nBaden-Württemberg Amtsgericht Freiburg HRB 734478\nThe Social Social Club GmbH – Freiburg im Breisgau",
      "type": "Registerbekanntmachung nach dem Umwandlungsgesetz",
      "state": "Baden-Württemberg",
      "amtsgericht": "Amtsgericht Freiburg",
      "registernummer": "HRB 734478",
      "registerart": "HRB",
      "company_name": "The Social Social Club GmbH",
      "company_seat": "Freiburg im Breisgau",
      "details": "27.01.2026 (Bekanntmachungsdatum)\n\nBaden-Württemberg Amtsgericht Freiburg HRB 734478\nRegisterbekanntmachung nach dem Umwandlungsgesetz 27.01.2026 (Eintragungsdatum)\n\nThe Social Social Club GmbH\nGesellschaft mit beschränkter Haftung\nFreiburg im Breisgau\n\nAls nicht eingetragen wird bekanntgemacht:\nDen Gläubigern der an der Abspaltung beteiligten Rechtsträger ist, wenn sie binnen sechs Monaten nach dem Tag, an dem die Eintragung der Abspaltung in das Register des Sitzes desjenigen Rechtsträgers, dessen Gläubiger sie sind, nach § 19 Abs. 3 UmwG als bekanntgemacht gilt, ihren Anspruch nach Grund und Höhe schriftlich anmelden, Sicherheit zu leisten, soweit sie nicht Befriedigung verlangen können. Dieses Recht steht den Gläubigern jedoch nur zu, wenn sie glaubhaft machen, dass durch die Abspaltung die Erfüllung ihrer Forderung gefährdet wird."
    },
    {
      "date": "2026-01-27",
      "id": "143551",
      "original_text": "Registerbekanntmachung nach dem Umwandlungsgesetz\nBaden-Württemberg Amtsgericht Freiburg HRB 727119\nfeykaherr GmbH – Freiburg im Breisgau",
      "type": "Registerbekanntmachung nach dem Umwandlungsgesetz",
      "state": "Baden-Württemberg",
      "amtsgericht": "Amtsgericht Freiburg",
      "registernummer": "HRB 727119",
      "registerart": "HRB",
      "company_name": "feykaherr GmbH",
      "company_seat": "Freiburg im Breisgau",
      "details": "27.01.2026 (Bekanntmachungsdatum)\n\nBaden-Württemberg Amtsgericht Freiburg HRB 727119\nRegisterbekanntmachung nach dem Umwandlungsgesetz 27.01.2026 (Eintragungsdatum)\n\nfeykaherr GmbH\nGesellschaft mit beschränkter Haftung\nFreiburg im Breisgau\n\nAls nicht eingetragen wird bekanntgemacht:\nDen Gläubigern der an der Abspaltung beteiligten Rechtsträger ist, wenn sie binnen sechs Monaten nach dem Tag, an dem die Eintragung der Abspaltung in das Register des Sitzes desjenigen Rechtsträgers, dessen Gläubiger sie sind, nach § 19 Abs. 3 UmwG als bekanntgemacht gilt, ihren Anspruch nach Grund und Höhe schriftlich anmelden, Sicherheit zu leisten, soweit sie nicht Befriedigung verlangen können. Dieses Recht steht den Gläubigern jedoch nur zu, wenn sie glaubhaft machen, dass durch die Abspaltung die Erfüllung ihrer Forderung gefährdet wird."
    },
    {
      "date": "2026-01-27",
      "id": "143552",
      "original_text": "Sonstige Registerbekanntmachung\nSachsen Amtsgericht Leipzig HRB 23991\nDBFZ Deutsches Biomasseforschungszentrum gemeinnützige GmbH – Leipzig",
      "type": "Sonstige Registerbekanntmachung",
      "state": "Sachsen",
      "amtsgericht": "Amtsgericht Leipzig",
      "registernummer": "HRB 23991",
      "registerart": "HRB",
      "company_name": "DBFZ Deutsches Biomasseforschungszentrum gemeinnützige GmbH",
      "company_seat": "Leipzig",
      "details": "27.01.2026 (Bekanntmachungsdatum)\n\nSachsen Amtsgericht Leipzig HRB 23991\nSonstige Registerbekanntmachung\n\nDBFZ Deutsches Biomasseforschungszentrum gemeinnützige GmbH\nGesellschaft mit beschränkter Haftung\nLeipzig\n\nAm 26.01.2026 wurde beim Handelsregister des Amtsgerichts Leipzig die Liste der Mitglieder des Aufsichtsrats gemäß § 52 GmbHG eingereicht."
    },
    {
      "date": "2026-01-27",
      "id": "143553",
      "original_text": "Einreichung neuer Dokumente\nSachsen Amtsgericht Leipzig HRB 22572\nAmazon Distribution GmbH – Leipzig",
      "type": "Einreichung neuer Dokumente",
      "state": "Sachsen",
      "amtsgericht": "Amtsgericht Leipzig",
      "registernummer": "HRB 22572",
      "registerart": "HRB",
      "company_name": "Amazon Distribution GmbH",
      "company_seat": "Leipzig",
      "details": "27.01.2026 (Bekanntmachungsdatum)\n\nSachsen Amtsgericht Leipzig HRB 22572\nEinreichung neuer Dokumente\n\nAmazon Distribution GmbH\nGesellschaft mit beschränkter Haftung\nLeipzig\n\nAm 26.01.2026 wurde beim Handelsregister des Amtsgerichts Leipzig die Liste der Mitglieder des Aufsichtsrats gemäß § 52 GmbHG eingereicht."
    },
    {
      "date": "2026-01-27",
      "id": "143554",
      "original_text": "Sonstige Registerbekanntmachung\nSachsen Amtsgericht Leipzig HRB 8077\nColditzer Wohnungsbaugesellschaft mbH – Colditz",
      "type": "Sonstige Registerbekanntmachung",
      "state": "Sachsen",
      "amtsgericht": "Amtsgericht Leipzig",
      "registernummer": "HRB 8077",
      "registerart": "HRB",
      "company_name": "Colditzer Wohnungsbaugesellschaft mbH",
      "company_seat": "Colditz",
      "details": "27.01.2026 (Bekanntmachungsdatum)\n\nSachsen Amtsgericht Leipzig HRB 8077\nSonstige Registerbekanntmachung\n\nColditzer Wohnungsbaugesellschaft mbH\nGesellschaft mit beschränkter Haftung\nColditz\n\nAm 26.01.2026 wurde beim Handelsregister des Amtsgerichts Leipzig die Liste der Mitglieder des Aufsichtsrats gemäß § 52 GmbHG eingereicht."
    },
    {
      "date": "2026-01-27",
      "id": "143555",
      "original_text": "Löschungsankündigung\nSachsen Amtsgericht Leipzig VR 20795\nSeniorenverein Panitzsch e.V. – Panitzsch",
      "type": "Löschungsankündigung",
      "state": "Sachsen",
      "amtsgericht": "Amtsgericht Leipzig",
      "registernummer": "VR 20795",
      "registerart": "VR",
      "company_name": "Seniorenverein Panitzsch e.V.",
      "company_seat": "Panitzsch",
      "details": "27.01.2026 (Bekanntmachungsdatum)\n\nSachsen Amtsgericht Leipzig VR 20795\nLöschungsankündigung\n\nSeniorenverein Panitzsch e.V.\neingetragener Verein\nPanitzsch\n\nDas Gericht beabsichtigt, gemäß § 4 Absatz 2 Ziffer 1 der Verordnung über das Vereinsregister das Registerblatt  des Vereins zu schließen, da nach Mitteilung eines ehemaligen Mitgliedes sämtliche Mitglieder aus dem Verein ausgeschieden sind. Zur Geltendmachung eines Widerspruchs gegen die beabsichtigte Schließung wird eine Frist von einem Monat nach der Veröffentlichung bestimmt."
    },
    {
      "date": "2026-01-27",
      "id": "143556",
      "original_text": "Sonstige Registerbekanntmachung\nSachsen Amtsgericht Leipzig HRB 16377\nPorsche Leipzig GmbH – Leipzig",
      "type": "Sonstige Registerbekanntmachung",
      "state": "Sachsen",
      "amtsgericht": "Amtsgericht Leipzig",
      "registernummer": "HRB 16377",
      "registerart": "HRB",
      "company_name": "Porsche Leipzig GmbH",
      "company_seat": "Leipzig",
      "details": "27.01.2026 (Bekanntmachungsdatum)\n\nSachsen Amtsgericht Leipzig HRB 16377\nSonstige Registerbekanntmachung\n\nPorsche Leipzig GmbH\nGesellschaft mit beschränkter Haftung\nLeipzig\n\nAm 26.01.2026 wurde beim Handelsregister des Amtsgerichts Leipzig die Liste der Mitglieder des Aufsichtsrats gemäß § 52 GmbHG eingereicht."
    },
    {
      "date": "2026-01-27",
      "id": "143557",
      "original_text": "Einreichung neuer Dokumente\nSachsen Amtsgericht Chemnitz HRB 5735\nStadtwerke Meerane GmbH – Meerane",
      "type": "Einreichung neuer Dokumente",
      "state": "Sachsen",
      "amtsgericht": "Amtsgericht Chemnitz",
      "registernummer": "HRB 5735",
      "registerart": "HRB",
      "company_name": "Stadtwerke Meerane GmbH",
      "company_seat": "Meerane",
      "details": "27.01.2026 (Bekanntmachungsdatum)\n\nSachsen Amtsgericht Chemnitz HRB 5735\nEinreichung neuer Dokumente\n\nStadtwerke Meerane GmbH\nGesellschaft mit beschränkter Haftung\nMeerane\n\nAm 15.01.2025 wurde beim Handelsregister des Amtsgerichts Chemnitz die Liste der Mitglieder des Aufsichtsrats gemäß § 52 GmbHG eingereicht."
    },
    {
      "date": "2026-01-27",
      "id": "143558",
      "original_text": "Registerbekanntmachung nach dem Umwandlungsgesetz\nNiedersachsen Amtsgericht Oldenburg (Oldenburg) HRA 208803\nJens Nordmann Verwaltungs- und Beteiligungs GmbH & Co. KG – Friesoythe",
      "type": "Registerbekanntmachung nach dem Umwandlungsgesetz",
      "state": "Niedersachsen",
      "amtsgericht": "Amtsgericht Oldenburg (Oldenburg)",
      "registernummer": "HRA 208803",
      "registerart": "HRA",
      "company_name": "Jens Nordmann Verwaltungs- und Beteiligungs GmbH & Co. KG",
      "company_seat": "Friesoythe",
      "details": "27.01.2026 (Bekanntmachungsdatum)\n\nNiedersachsen Amtsgericht Oldenburg (Oldenburg) HRA 208803\nRegisterbekanntmachung nach dem Umwandlungsgesetz 27.01.2026 (Eintragungsdatum)\n\nJens Nordmann Verwaltungs- und Beteiligungs GmbH & Co. KG\nKommanditgesellschaft\nFriesoythe\n\nDen Gläubigern der an der Ausgliederung beteiligten Rechtsträger ist, wenn sie binnen sechs Monaten nach dem Tag, an dem die Eintragung der Ausgliederung in das Register des Sitzes desjenigen Rechtsträgers, dessen Gläubiger sie sind, nach § 19 Abs. 3 UmwG als bekannt gemacht gilt, ihren Anspruch nach Grund und Höhe schriftlich anmelden, Sicherheit zu leisten, soweit sie nicht Befriedigung verlangen können. Dieses Recht steht den Gläubigern jedoch nur zu, wenn sie glaubhaft machen, dass durch die Ausgliederung die Erfüllung der Forderung gefährdet wird."
    },
    {
      "date": "2026-01-27",
      "id": "143559",
      "original_text": "Löschungsankündigung\nNiedersachsen Amtsgericht Hildesheim HRA 202063\nLachs 1 Erzeugergesellschaft KG – Gronau (Leine)",
      "type": "Löschungsankündigung",
      "state": "Niedersachsen",
      "amtsgericht": "Amtsgericht Hildesheim",
      "registernummer": "HRA 202063",
      "registerart": "HRA",
      "company_name": "Lachs 1 Erzeugergesellschaft KG",
      "company_seat": "Gronau (Leine)",
      "details": "27.01.2026 (Bekanntmachungsdatum)\n\nNiedersachsen Amtsgericht Hildesheim HRA 202063\nLöschungsankündigung\n\nLachs 1 Erzeugergesellschaft KG\nKommanditgesellschaft\nGronau (Leine)\n\nDas Registergericht beabsichtigt, die Firma von Amts wegen nach § 31 Abs. 2 Satz 2 HGB, § 393 FamFG zu löschen. Die Frist zur Erhebung eines Widerspruchs ist auf 1 Monat ab dieser Registerbekanntmachung festgesetzt."
    },
    {
      "date": "2026-01-27",
      "id": "143560",
      "original_text": "Registerbekanntmachung nach dem Umwandlungsgesetz\nNiedersachsen Amtsgericht Oldenburg (Oldenburg) HRB 211397\nHPG Beteiligungen GmbH & Co. KGaA – Garrel",
      "type": "Registerbekanntmachung nach dem Umwandlungsgesetz",
      "state": "Niedersachsen",
      "amtsgericht": "Amtsgericht Oldenburg (Oldenburg)",
      "registernummer": "HRB 211397",
      "registerart": "HRB",
      "company_name": "HPG Beteiligungen GmbH & Co. KGaA",
      "company_seat": "Garrel",
      "details": "27.01.2026 (Bekanntmachungsdatum)\n\nNiedersachsen Amtsgericht Oldenburg (Oldenburg) HRB 211397\nRegisterbekanntmachung nach dem Umwandlungsgesetz 27.01.2026 (Eintragungsdatum)\n\nHPG Beteiligungen GmbH & Co. KGaA\nKommanditgesellschaft auf Aktien\nGarrel\n\nDen Gläubigern der an der Verschmelzung beteiligten Rechtsträger ist, wenn sie binnen sechs Monaten nach dem Tag, an dem die Eintragung der Verschmelzung in das Register des Sitzes desjenigen Rechtsträgers, dessen Gläubiger sie sind, nach § 19  Abs.  3 UmwG als bekannt gemacht gilt, ihren Anspruch nach Grund und Höhe schriftlich anmelden, Sicherheit zu leisten, soweit sie nicht Befriedigung verlangen können. Dieses Recht steht den Gläubigern jedoch nur zu, wenn sie glaubhaft machen, dass durch die Verschmelzung die Erfüllung der Forderung gefährdet wird."
    },
    {
      "date": "2026-01-27",
      "id": "143561",
      "original_text": "Einreichung neuer Dokumente\nNiedersachsen Amtsgericht Braunschweig HRB 100769 früher Amtsgericht Wolfsburg\nAvacon AG – Helmstedt",
      "type": "Einreichung neuer Dokumente",
      "state": "Niedersachsen",
      "amtsgericht": "Amtsgericht Braunschweig",
      "registernummer": "HRB 100769",
      "registerart": "HRB",
      "company_name": "Avacon AG",
      "company_seat": "Helmstedt",
      "former_amtsgericht": "Wolfsburg",
      "details": "27.01.2026 (Bekanntmachungsdatum)\n\nNiedersachsen Amtsgericht Braunschweig HRB 100769 früher Amtsgericht Wolfsburg\nEinreichung neuer Dokumente 27.01.2026 (Eintragungsdatum)\n\nAvacon AG\nAktiengesellschaft\nHelmstedt\n\nDie Liste der Mitglieder des Aufsichtsrats wurde beim Registergericht eingereicht."
    },
    {
      "date": "2026-01-27",
      "id": "143562",
      "original_text": "Registerbekanntmachung nach dem Umwandlungsgesetz\nNiedersachsen Amtsgericht Oldenburg (Oldenburg) HRA 208420\nVerpachtungsbetrieb Jens Nordmann, Inhaber: Jens Nordmann e.K. – Friesoythe",
      "type": "Registerbekanntmachung nach dem Umwandlungsgesetz",
      "state": "Niedersachsen",
      "amtsgericht": "Amtsgericht Oldenburg (Oldenburg)",
      "registernummer": "HRA 208420",
      "registerart": "HRA",
      "company_name": "Verpachtungsbetrieb Jens Nordmann, Inhaber: Jens Nordmann e.K.",
      "company_seat": "Friesoythe",
      "details": "27.01.2026 (Bekanntmachungsdatum)\n\nNiedersachsen Amtsgericht Oldenburg (Oldenburg) HRA 208420\nRegisterbekanntmachung nach dem Umwandlungsgesetz 27.01.2026 (Eintragungsdatum)\n\nVerpachtungsbetrieb Jens Nordmann, Inhaber: Jens Nordmann e.K.\nEinzelkaufmann / Einzelkauffrau\nFriesoythe\n\nDen Gläubigern der an der Ausgliederung beteiligten Rechtsträger ist, wenn sie binnen sechs Monaten nach dem Tag, an dem die Eintragung der Ausgliederung in das Register des Sitzes desjenigen Rechtsträgers, dessen Gläubiger sie sind, nach § 19 Abs. 3 UmwG als bekannt gemacht gilt, ihren Anspruch nach Grund und Höhe schriftlich anmelden, Sicherheit zu leisten, soweit sie nicht Befriedigung verlangen können. Dieses Recht steht den Gläubigern jedoch nur zu, wenn sie glaubhaft machen, dass durch die Ausgliederung die Erfüllung der Forderung gefährdet wird."
    },
    {
      "date": "2026-01-27",
      "id": "143563",
      "original_text": "Löschungsankündigung\nNiedersachsen Amtsgericht Aurich HRB 203233\nHaus-, Betriebs- u. Hofservice & Dienstleistung Luitjens UG (haftungsbeschränkt) – Schweindorf",
      "type": "Löschungsankündigung",
      "state": "Niedersachsen",
      "amtsgericht": "Amtsgericht Aurich",
      "registernummer": "HRB 203233",
      "registerart": "HRB",
      "company_name": "Haus-, Betriebs- u. Hofservice & Dienstleistung Luitjens UG (haftungsbeschränkt)",
      "company_seat": "Schweindorf",
      "details": "27.01.2026 (Bekanntmachungsdatum)\n\nNiedersachsen Amtsgericht Aurich HRB 203233\nLöschungsankündigung\n\nHaus-, Betriebs- u. Hofservice & Dienstleistung Luitjens UG (haftungsbeschränkt)\nGesellschaft mit beschränkter Haftung\nSchweindorf\n\nDas Registergericht beabsichtigt, die Gesellschaft von Amts wegen nach § 394 FamFG zu löschen. Die Frist zur Erhebung eines Widerspruchs ist auf 1 Monat ab dieser Registerbekanntmachung festgesetzt."
    },
    {
      "date": "2026-01-27",
      "id": "143564",
      "original_text": "Registerbekanntmachung nach dem Umwandlungsgesetz\nNiedersachsen Amtsgericht Stadthagen HRB 201374\nGolnsourcing GmbH – Bad Nenndorf",
      "type": "Registerbekanntmachung nach dem Umwandlungsgesetz",
      "state": "Niedersachsen",
      "amtsgericht": "Amtsgericht Stadthagen",
      "registernummer": "HRB 201374",
      "registerart": "HRB",
      "company_name": "Golnsourcing GmbH",
      "company_seat": "Bad Nenndorf",
      "details": "27.01.2026 (Bekanntmachungsdatum)\n\nNiedersachsen Amtsgericht Stadthagen HRB 201374\nRegisterbekanntmachung nach dem Umwandlungsgesetz 23.01.2026 (Eintragungsdatum)\n\nGolnsourcing GmbH\nGesellschaft mit beschränkter Haftung\nBad Nenndorf\n\nDen Gläubigern der an der Verschmelzung beteiligten Rechtsträger ist, wenn sie binnen sechs Monaten nach dem Tag, an dem die Eintragung der Verschmelzung in das Register des Sitzes desjenigen Rechtsträgers, dessen Gläubiger sie sind, nach § 19  Abs.  3 UmwG als bekannt gemacht gilt, ihren Anspruch nach Grund und Höhe schriftlich anmelden, Sicherheit zu leisten, soweit sie nicht Befriedigung verlangen können. Dieses Recht steht den Gläubigern jedoch nur zu, wenn sie glaubhaft machen, dass durch die Verschmelzung die Erfüllung der Forderung gefährdet wird."
    },
    {
      "date": "2026-01-27",
      "id": "143565",
      "original_text": "Registerbekanntmachung nach dem Umwandlungsgesetz\nNiedersachsen Amtsgericht Oldenburg (Oldenburg) HRA 205116\nWEPA Beteiligungs GmbH & Co. KG – Garrel",
      "type": "Registerbekanntmachung nach dem Umwandlungsgesetz",
      "state": "Niedersachsen",
      "amtsgericht": "Amtsgericht Oldenburg (Oldenburg)",
      "registernummer": "HRA 205116",
      "registerart": "HRA",
      "company_name": "WEPA Beteiligungs GmbH & Co. KG",
      "company_seat": "Garrel",
      "details": "27.01.2026 (Bekanntmachungsdatum)\n\nNiedersachsen Amtsgericht Oldenburg (Oldenburg) HRA 205116\nRegisterbekanntmachung nach dem Umwandlungsgesetz 27.01.2026 (Eintragungsdatum)\n\nWEPA Beteiligungs GmbH & Co. KG\nKommanditgesellschaft\nGarrel\n\nDen Gläubigern der an der Verschmelzung beteiligten Rechtsträger ist, wenn sie binnen sechs Monaten nach dem Tag, an dem die Eintragung der Verschmelzung in das Register des Sitzes desjenigen Rechtsträgers, dessen Gläubiger sie sind, nach § 19  Abs.  3 UmwG als bekannt gemacht gilt, ihren Anspruch nach Grund und Höhe schriftlich anmelden, Sicherheit zu leisten, soweit sie nicht Befriedigung verlangen können. Dieses Recht steht den Gläubigern jedoch nur zu, wenn sie glaubhaft machen, dass durch die Verschmelzung die Erfüllung der Forderung gefährdet wird."
    },
    {
      "date": "2026-01-27",
      "id": "143566",
      "original_text": "Einreichung neuer Dokumente\nRheinland-Pfalz Amtsgericht Wittlich HRB 4387\nGemeinnützige Trägergesellschaft Katholische Kindertageseinrichtungen im Raum Trier mit beschränkter Haftung – Trier",
      "type": "Einreichung neuer Dokumente",
      "state": "Rheinland-Pfalz",
      "amtsgericht": "Amtsgericht Wittlich",
      "registernummer": "HRB 4387",
      "registerart": "HRB",
      "company_name": "Gemeinnützige Trägergesellschaft Katholische Kindertageseinrichtungen im Raum Trier mit beschränkter Haftung",
      "company_seat": "Trier",
      "details": "27.01.2026 (Bekanntmachungsdatum)\n\nRheinland-Pfalz Amtsgericht Wittlich HRB 4387\nEinreichung neuer Dokumente\n\nGemeinnützige Trägergesellschaft Katholische Kindertageseinrichtungen im Raum Trier mit beschränkter Haftung\nGesellschaft mit beschränkter Haftung\nTrier\n\nDem Registergericht ist eine neue Liste der Mitglieder des Aufsichtsrates eingereicht worden."
    },
    {
      "date": "2026-01-27",
      "id": "143567",
      "original_text": "Löschungsankündigung\nBremen Amtsgericht Bremen HRB 37331\nLegga Schmegga UG (haftungsbeschränkt) – Bremen",
      "type": "Löschungsankündigung",
      "state": "Bremen",
      "amtsgericht": "Amtsgericht Bremen",
      "registernummer": "HRB 37331",
      "registerart": "HRB",
      "company_name": "Legga Schmegga UG (haftungsbeschränkt)",
      "company_seat": "Bremen",
      "details": "27.01.2026 (Bekanntmachungsdatum)\n\nBremen Amtsgericht Bremen HRB 37331\nLöschungsankündigung\n\nLegga Schmegga UG (haftungsbeschränkt)\nGesellschaft mit beschränkter Haftung\nBremen\n\nEs ist beabsichtigt die im Handelsregister eingetragene Gesellschaft von Amts wegen gemäß § 394 FamFG zu löschen. Gegen die Löschung kann beim AG Bremen schriftlich oder zu Protokoll der Geschäftsstelle Widerspruch eingelegt werden. Widerspruchsfrist 4 Wochen."
    },
    {
      "date": "2026-01-27",
      "id": "143568",
      "original_text": "Sonstige Registerbekanntmachung\nRheinland-Pfalz Amtsgericht Landau HRB 21778\nFaurecia Innenraum Systeme GmbH – Hagenbach",
      "type": "Sonstige Registerbekanntmachung",
      "state": "Rheinland-Pfalz",
      "amtsgericht": "Amtsgericht Landau",
      "registernummer": "HRB 21778",
      "registerart": "HRB",
      "company_name": "Faurecia Innenraum Systeme GmbH",
      "company_seat": "Hagenbach",
      "details": "27.01.2026 (Bekanntmachungsdatum)\n\nRheinland-Pfalz Amtsgericht Landau HRB 21778\nSonstige Registerbekanntmachung 27.01.2026 (Eintragungsdatum)\n\nFaurecia Innenraum Systeme GmbH\nGesellschaft mit beschränkter Haftung\nHagenbach\n\nAls nicht eingetragen wird veröffentlicht: Den Gläubigern der Gesellschaft, deren Forderungen begründet worden sind, bevor die Eintragung der Beendigung des Ergebnisabführungsvertrages und des Beherrschungsvertrages in das Handelsregister nach § 10 des Handelsgesetzbuches als bekanntgemacht gilt, hat der andere Vertragsteil Sicherheit zu leisten, wenn sie sich binnen sechs Monaten nach der Bekanntmachung der Eintragung zu diesem Zweck bei ihm melden."
    },
    {
      "date": "2026-01-27",
      "id": "143569",
      "original_text": "Sonstige Registerbekanntmachung\nRheinland-Pfalz Amtsgericht Mainz HRB 415\nin.betrieb gGmbH Gesellschaft für Teilhabe und Integration – Mainz",
      "type": "Sonstige Registerbekanntmachung",
      "state": "Rheinland-Pfalz",
      "amtsgericht": "Amtsgericht Mainz",
      "registernummer": "HRB 415",
      "registerart": "HRB",
      "company_name": "in.betrieb gGmbH Gesellschaft für Teilhabe und Integration",
      "company_seat": "Mainz",
      "details": "27.01.2026 (Bekanntmachungsdatum)\n\nRheinland-Pfalz Amtsgericht Mainz HRB 415\nSonstige Registerbekanntmachung\n\nin.betrieb gGmbH Gesellschaft für Teilhabe und Integration\nGesellschaft mit beschränkter Haftung\nMainz\n\nDem Registergericht ist eine Liste der Mitglieder des Aufsichtsrates eingereicht worden."
    },
    {
      "date": "2026-01-27",
      "id": "143570",
      "original_text": "Löschungsankündigung\nRheinland-Pfalz Amtsgericht Zweibrücken HRB 30409\nXentix GmbH – Ramstein-Miesenbach",
      "type": "Löschungsankündigung",
      "state": "Rheinland-Pfalz",
      "amtsgericht": "Amtsgericht Zweibrücken",
      "registernummer": "HRB 30409",
      "registerart": "HRB",
      "company_name": "Xentix GmbH",
      "company_seat": "Ramstein-Miesenbach",
      "details": "27.01.2026 (Bekanntmachungsdatum)\n\nRheinland-Pfalz Amtsgericht Zweibrücken HRB 30409\nLöschungsankündigung\n\nXentix GmbH\nGesellschaft mit beschränkter Haftung\nRamstein-Miesenbach\n\nDas Registergericht beabsichtigt die Gesellschaft von Amts wegen nach § 394 FamFG zu löschen. Die Frist zur Erhebung eines Widerspruchs ist auf einen Monat festgesetzt."
    },
    {
      "date": "2026-01-27",
      "id": "143571",
      "original_text": "Löschungsankündigung\nRheinland-Pfalz Amtsgericht Zweibrücken HRB 30389\nHeinzelmann GmbH – Ramstein-Miesenbach",
      "type": "Löschungsankündigung",
      "state": "Rheinland-Pfalz",
      "amtsgericht": "Amtsgericht Zweibrücken",
      "registernummer": "HRB 30389",
      "registerart": "HRB",
      "company_name": "Heinzelmann GmbH",
      "company_seat": "Ramstein-Miesenbach",
      "details": "27.01.2026 (Bekanntmachungsdatum)\n\nRheinland-Pfalz Amtsgericht Zweibrücken HRB 30389\nLöschungsankündigung\n\nHeinzelmann GmbH\nGesellschaft mit beschränkter Haftung\nRamstein-Miesenbach\n\nDas Registergericht beabsichtigt die Gesellschaft von Amts wegen nach § 394 FamFG zu löschen. Die Frist zur Erhebung eines Widerspruchs ist auf einen Monat festgesetzt."
    },
    {
      "date": "2026-01-27",
      "id": "143572",
      "original_text": "Einreichung neuer Dokumente\nRheinland-Pfalz Amtsgericht Koblenz HRB 10189\nBrohltal-Eisenbahn-Gesellschaft m.b.H. – Niederzissen",
      "type": "Einreichung neuer Dokumente",
      "state": "Rheinland-Pfalz",
      "amtsgericht": "Amtsgericht Koblenz",
      "registernummer": "HRB 10189",
      "registerart": "HRB",
      "company_name": "Brohltal-Eisenbahn-Gesellschaft m.b.H.",
      "company_seat": "Niederzissen",
      "details": "27.01.2026 (Bekanntmachungsdatum)\n\nRheinland-Pfalz Amtsgericht Koblenz HRB 10189\nEinreichung neuer Dokumente\n\nBrohltal-Eisenbahn-Gesellschaft m.b.H.\nGesellschaft mit beschränkter Haftung\nNiederzissen\n\nDem Registergericht ist eine neue Liste der Mitglieder des Aufsichtsrates eingereicht worden."
    },
    {
      "date": "2026-01-27",
      "id": "143573",
      "original_text": "Einreichung neuer Dokumente\nRheinland-Pfalz Amtsgericht Zweibrücken HRB 33333\nWohnungsbaugesellschaft der Verbandsgemeinde Zweibrücken-Land GmbH – Contwig",
      "type": "Einreichung neuer Dokumente",
      "state": "Rheinland-Pfalz",
      "amtsgericht": "Amtsgericht Zweibrücken",
      "registernummer": "HRB 33333",
      "registerart": "HRB",
      "company_name": "Wohnungsbaugesellschaft der Verbandsgemeinde Zweibrücken-Land GmbH",
      "company_seat": "Contwig",
      "details": "27.01.2026 (Bekanntmachungsdatum)\n\nRheinland-Pfalz Amtsgericht Zweibrücken HRB 33333\nEinreichung neuer Dokumente\n\nWohnungsbaugesellschaft der Verbandsgemeinde Zweibrücken-Land GmbH\nGesellschaft mit beschränkter Haftung\nContwig\n\nDem Registergericht ist eine Liste der Mitglieder des Aufsichtsrates eingereicht worden."
    },
    {
      "date": "2026-01-27",
      "id": "143574",
      "original_text": "Einreichung neuer Dokumente\nRheinland-Pfalz Amtsgericht Zweibrücken HRB 23424\nneox Aktiengesellschaft für Informationstechnologie – Pirmasens",
      "type": "Einreichung neuer Dokumente",
      "state": "Rheinland-Pfalz",
      "amtsgericht": "Amtsgericht Zweibrücken",
      "registernummer": "HRB 23424",
      "registerart": "HRB",
      "company_name": "neox Aktiengesellschaft für Informationstechnologie",
      "company_seat": "Pirmasens",
      "details": "27.01.2026 (Bekanntmachungsdatum)\n\nRheinland-Pfalz Amtsgericht Zweibrücken HRB 23424\nEinreichung neuer Dokumente 26.01.2026 (Eintragungsdatum)\n\nneox Aktiengesellschaft für Informationstechnologie\nAktiengesellschaft\nPirmasens\n\nDem Registergericht ist eine Liste der Mitglieder des Aufsichtsrates eingereicht worden."
    },
    {
      "date": "2026-01-27",
      "id": "143575",
      "original_text": "Löschungsankündigung\nNordrhein-Westfalen Amtsgericht Essen HRB 27435\nRS GmbH – Essen",
      "type": "Löschungsankündigung",
      "state": "Nordrhein-Westfalen",
      "amtsgericht": "Amtsgericht Essen",
      "registernummer": "HRB 27435",
      "registerart": "HRB",
      "company_name": "RS GmbH",
      "company_seat": "Essen",
      "details": "27.01.2026 (Bekanntmachungsdatum)\n\nNordrhein-Westfalen Amtsgericht Essen HRB 27435\nLöschungsankündigung\n\nRS GmbH\nGesellschaft mit beschränkter Haftung\nEssen\n\nDas Registergericht beabsichtigt die Gesellschaft von Amts wegen nach § 394 FamFG zu löschen. Die Frist zur Erhebung eines Widerspruchs ist auf einen Monat festgesetzt."
    },
    {
      "date": "2026-01-27",
      "id": "143576",
      "original_text": "Einreichung neuer Dokumente\nNordrhein-Westfalen Amtsgericht Dortmund HRB 19108\nSIGNAL IDUNA Allgemeine Versicherung Aktiengesellschaft – Dortmund",
      "type": "Einreichung neuer Dokumente",
      "state": "Nordrhein-Westfalen",
      "amtsgericht": "Amtsgericht Dortmund",
      "registernummer": "HRB 19108",
      "registerart": "HRB",
      "company_name": "SIGNAL IDUNA Allgemeine Versicherung Aktiengesellschaft",
      "company_seat": "Dortmund",
      "details": "27.01.2026 (Bekanntmachungsdatum)\n\nNordrhein-Westfalen Amtsgericht Dortmund HRB 19108\nEinreichung neuer Dokumente\n\nSIGNAL IDUNA Allgemeine Versicherung Aktiengesellschaft\nAktiengesellschaft\nDortmund\n\nDem Registergericht ist eine neue Liste der Mitglieder des Aufsichtsrates eingereicht worden."
    },
    {
      "date": "2026-01-27",
      "id": "143577",
      "original_text": "Löschungsankündigung\nNordrhein-Westfalen Amtsgericht Neuss HRB 20644\nIxir GmbH – Neuss",
      "type": "Löschungsankündigung",
      "state": "Nordrhein-Westfalen",
      "amtsgericht": "Amtsgericht Neuss",
      "registernummer": "HRB 20644",
      "registerart": "HRB",
      "company_name": "Ixir GmbH",
      "company_seat": "Neuss",
      "details": "27.01.2026 (Bekanntmachungsdatum)\n\nNordrhein-Westfalen Amtsgericht Neuss HRB 20644\nLöschungsankündigung 26.01.2026 (Eintragungsdatum)\n\nIxir GmbH\nGesellschaft mit beschränkter Haftung\nNeuss\n\nDas Registergericht beabsichtigt die Gesellschaft von Amts wegen nach § 394 FamFG zu löschen. Die Frist zur Erhebung eines Widerspruchs ist auf einen Monat festgesetzt. Rechtsbehelfsbelehrung: Gegen diese Verfügung können Sie Widerspruch einlegen. Der Widerspruch ist bei dem Amtsgericht Neuss - Registergericht -, Breite Str. 48, 41460 Neuss schriftlich in deutscher Sprache oder zur Niederschrift der Geschäftsstelle einzulegen. Der Widerspruch kann auch zur Niederschrift der Geschäftsstelle eines jeden Amtsgerichtes abgegeben werden. Die Einlegung ist auch durch Übertragung eines elektronischen Dokuments an die elektronische Poststelle des Gerichts möglich. Das elektronische Dokument muss für die Bearbeitung durch das Gericht geeignet und mit einer qualifizierten elektronischen Signatur der verantwortenden Person versehen sein oder von der verantwortenden Person signiert und auf einem sicheren Übermittlungsweg gemäß § 130a ZPO nach näherer Maßgabe der Verordnung über die technischen Rahmenbedingungen des elektronischen Rechtsverkehrs und über das besondere elektronische Behördenpostfach (BGBl. I, S.3803) eingereicht werden. Weitere Informationen erhalten Sie auf der Internetseite www.justiz.de. Der Widerspruch muss spätestens innerhalb der gesetzten Frist nach der schriftlichen Bekanntgabe der Verfügung bei dem Amtsgericht - Registergericht - Neuss eingegangen sein. Dies gilt auch dann, wenn der Widerspruch zur Niederschrift der Geschäftsstelle eines anderen Amtsgerichtes abgegeben wurde. Die Frist beginnt mit der schriftlichen Bekanntgabe der Verfügung. Die Bekanntgabe ist entweder durch Zustellung oder am dritten Tage nach Aufgabe zur Post bewirkt. Fällt das Ende der Frist auf einen Sonntag, einen allgemeinen Feiertag oder Sonnabend, so endet die Frist mit Ablauf des nächsten Werktages. Der Widerspruch muss die Bezeichnung der angefochtenen Verfügung sowie die Erklärung enthalten, dass Widerspruch gegen diese Verfügung eingelegt wird. Er ist zu unterzeichnen und soll begründet werden."
    },
    {
      "date": "2026-01-27",
      "id": "143578",
      "original_text": "Einreichung neuer Dokumente\nNordrhein-Westfalen Amtsgericht Bochum HRB 9354\nStadtwerke Herne Aktiengesellschaft – Herne",
      "type": "Einreichung neuer Dokumente",
      "state": "Nordrhein-Westfalen",
      "amtsgericht": "Amtsgericht Bochum",
      "registernummer": "HRB 9354",
      "registerart": "HRB",
      "company_name": "Stadtwerke Herne Aktiengesellschaft",
      "company_seat": "Herne",
      "details": "27.01.2026 (Bekanntmachungsdatum)\n\nNordrhein-Westfalen Amtsgericht Bochum HRB 9354\nEinreichung neuer Dokumente 26.01.2026 (Eintragungsdatum)\n\nStadtwerke Herne Aktiengesellschaft\nAktiengesellschaft\nHerne\n\nDem Registergericht ist eine neue Liste der Mitglieder des Aufsichtsrates eingereicht worden."
    },
    {
      "date": "2026-01-27",
      "id": "143579",
      "original_text": "Registerbekanntmachung nach dem Umwandlungsgesetz\nNordrhein-Westfalen Amtsgericht Köln HRB 24863\nHeinzmann Brandschutz GmbH – Köln",
      "type": "Registerbekanntmachung nach dem Umwandlungsgesetz",
      "state": "Nordrhein-Westfalen",
      "amtsgericht": "Amtsgericht Köln",
      "registernummer": "HRB 24863",
      "registerart": "HRB",
      "company_name": "Heinzmann Brandschutz GmbH",
      "company_seat": "Köln",
      "details": "27.01.2026 (Bekanntmachungsdatum)\n\nNordrhein-Westfalen Amtsgericht Köln HRB 24863\nRegisterbekanntmachung nach dem Umwandlungsgesetz 27.01.2026 (Eintragungsdatum)\n\nHeinzmann Brandschutz GmbH\nGesellschaft mit beschränkter Haftung\nKöln\n\nDen Gläubigern der an der Verschmelzung beteiligten Rechtsträger ist, wenn sie binnen sechs Monaten nach dem Tag, an dem die Eintragung der Verschmelzung in das Register des Sitzes desjenigen Rechtsträgers, dessen Gläubiger sie sind, nach § 19 Absatz 3 UmwG als bekanntgemacht gilt, ihren Anspruch nach Grund und Höhe schriftlich anmelden, Sicherheit zu leisten, soweit sie nicht Befriedigung verlangen können. Dieses Recht steht den Gläubigern jedoch nur zu, wenn sie glaubhaft machen, dass durch die Verschmelzung die Erfüllung ihrer Forderung gefährdet wird."
    },
    {
      "date": "2026-01-27",
      "id": "143580",
      "original_text": "Registerbekanntmachung nach dem Umwandlungsgesetz\nNordrhein-Westfalen Amtsgericht Lemgo HRB 3153\nDörentrup Ceramic GmbH – Dörentrup",
      "type": "Registerbekanntmachung nach dem Umwandlungsgesetz",
      "state": "Nordrhein-Westfalen",
      "amtsgericht": "Amtsgericht Lemgo",
      "registernummer": "HRB 3153",
      "registerart": "HRB",
      "company_name": "Dörentrup Ceramic GmbH",
      "company_seat": "Dörentrup",
      "details": "27.01.2026 (Bekanntmachungsdatum)\n\nNordrhein-Westfalen Amtsgericht Lemgo HRB 3153\nRegisterbekanntmachung nach dem Umwandlungsgesetz 27.01.2026 (Eintragungsdatum)\n\nDörentrup Ceramic GmbH\nGesellschaft mit beschränkter Haftung\nDörentrup\n\nDen Gläubigern der an der Verschmelzung beteiligten Rechtsträger ist, wenn sie binnen sechs Monaten nach dem Tag, an dem die Eintragung der Verschmelzung in das Register des Sitzes desjenigen Rechtsträgers, dessen Gläubiger sie sind, nach § 19 Absatz 3 UmwG als bekanntgemacht gilt, ihren Anspruch nach Grund und Höhe schriftlich anmelden, Sicherheit zu leisten, soweit sie nicht Befriedigung verlangen können. Dieses Recht steht den Gläubigern jedoch nur zu, wenn sie glaubhaft machen, dass durch die Verschmelzung die Erfüllung ihrer Forderung gefährdet wird."
    },
    {
      "date": "2026-01-27",
      "id": "143581",
      "original_text": "Einreichung neuer Dokumente\nNordrhein-Westfalen Amtsgericht Wuppertal HRB 13844\nKreisverkehrsgesellschaft Mettmann mbH – Mettmann",
      "type": "Einreichung neuer Dokumente",
      "state": "Nordrhein-Westfalen",
      "amtsgericht": "Amtsgericht Wuppertal",
      "registernummer": "HRB 13844",
      "registerart": "HRB",
      "company_name": "Kreisverkehrsgesellschaft Mettmann mbH",
      "company_seat": "Mettmann",
      "details": "27.01.2026 (Bekanntmachungsdatum)\n\nNordrhein-Westfalen Amtsgericht Wuppertal HRB 13844\nEinreichung neuer Dokumente 27.01.2026 (Eintragungsdatum)\n\nKreisverkehrsgesellschaft Mettmann mbH\nGesellschaft mit beschränkter Haftung\nMettmann\n\nDem Registergericht ist eine Liste der Mitglieder des Aufsichtsrates eingereicht worden."
    },
    {
      "date": "2026-01-27",
      "id": "143582",
      "original_text": "Einreichung neuer Dokumente\nNordrhein-Westfalen Amtsgericht Dortmund HRB 2363\nDortmunder Hafen Aktiengesellschaft – Dortmund",
      "type": "Einreichung neuer Dokumente",
      "state": "Nordrhein-Westfalen",
      "amtsgericht": "Amtsgericht Dortmund",
      "registernummer": "HRB 2363",
      "registerart": "HRB",
      "company_name": "Dortmunder Hafen Aktiengesellschaft",
      "company_seat": "Dortmund",
      "details": "27.01.2026 (Bekanntmachungsdatum)\n\nNordrhein-Westfalen Amtsgericht Dortmund HRB 2363\nEinreichung neuer Dokumente\n\nDortmunder Hafen  Aktiengesellschaft\nAktiengesellschaft\nDortmund\n\nDem Registergericht ist eine neue Liste der Mitglieder des Aufsichtsrates eingereicht worden."
    },
    {
      "date": "2026-01-27",
      "id": "143583",
      "original_text": "Registerbekanntmachung nach dem Umwandlungsgesetz\nNordrhein-Westfalen Amtsgericht Bochum HRB 22820\nDittmar & Stachowiak Autodienst GmbH – Bochum",
      "type": "Registerbekanntmachung nach dem Umwandlungsgesetz",
      "state": "Nordrhein-Westfalen",
      "amtsgericht": "Amtsgericht Bochum",
      "registernummer": "HRB 22820",
      "registerart": "HRB",
      "company_name": "Dittmar & Stachowiak Autodienst GmbH",
      "company_seat": "Bochum",
      "details": "27.01.2026 (Bekanntmachungsdatum)\n\nNordrhein-Westfalen Amtsgericht Bochum HRB 22820\nRegisterbekanntmachung nach dem Umwandlungsgesetz 19.01.2026 (Eintragungsdatum)\n\nDittmar & Stachowiak Autodienst GmbH\nGesellschaft mit beschränkter Haftung\nBochum\n\nDen Gläubigern der an der Ausgliederung beteiligten Rechtsträger ist, wenn sie binnen sechs Monaten nach dem Tag, an dem die Eintragung der Ausgliederung in das Register des Sitzes desjenigen Rechtsträgers, dessen Gläubiger sie sind, nach § 19 Absatz 3 UmwG als bekanntgemacht gilt, ihren Anspruch nach Grund und Höhe schriftlich anmelden, Sicherheit zu leisten, soweit sie nicht Befriedigung verlangen können. Dieses Recht steht den Gläubigern jedoch nur zu, wenn sie glaubhaft machen, dass durch die Ausgliederung die Erfüllung ihrer Forderung gefährdet wird."
    },
    {
      "date": "2026-01-27",
      "id": "143584",
      "original_text": "Einreichung neuer Dokumente\nNordrhein-Westfalen Amtsgericht Dortmund HRB 2220\nSIGNAL IDUNA Unfallversicherung a. G. – Dortmund.",
      "type": "Einreichung neuer Dokumente",
      "state": "Nordrhein-Westfalen",
      "amtsgericht": "Amtsgericht Dortmund",
      "registernummer": "HRB 2220",
      "registerart": "HRB",
      "company_name": "SIGNAL IDUNA Unfallversicherung a. G.",
      "company_seat": "Dortmund.",
      "details": "27.01.2026 (Bekanntmachungsdatum)\n\nNordrhein-Westfalen Amtsgericht Dortmund HRB 2220\nEinreichung neuer Dokumente\n\nSIGNAL IDUNA Unfallversicherung a. G.\nVersicherungsverein auf Gegenseitigkeit\nDortmund.\n\nDem Registergericht ist eine neue Liste der Mitglieder des Aufsichtsrates eingereicht worden."
    },
    {
      "date": "2026-01-27",
      "id": "143585",
      "original_text": "Registerbekanntmachung nach dem Umwandlungsgesetz\nNordrhein-Westfalen Amtsgericht Köln HRB 98677\nBD Service GmbH – Köln",
      "type": "Registerbekanntmachung nach dem Umwandlungsgesetz",
      "state": "Nordrhein-Westfalen",
      "amtsgericht": "Amtsgericht Köln",
      "registernummer": "HRB 98677",
      "registerart": "HRB",
      "company_name": "BD Service GmbH",
      "company_seat": "Köln",
      "details": "27.01.2026 (Bekanntmachungsdatum)\n\nNordrhein-Westfalen Amtsgericht Köln HRB 98677\nRegisterbekanntmachung nach dem Umwandlungsgesetz 27.01.2026 (Eintragungsdatum)\n\nBD Service GmbH\nGesellschaft mit beschränkter Haftung\nKöln\n\nDen Gläubigern der an der Verschmelzung beteiligten Rechtsträger ist, wenn sie binnen sechs Monaten nach dem Tag, an dem die Eintragung der Verschmelzung in das Register des Sitzes desjenigen Rechtsträgers, dessen Gläubiger sie sind, nach § 19 Absatz 3 UmwG als bekanntgemacht gilt, ihren Anspruch nach Grund und Höhe schriftlich anmelden, Sicherheit zu leisten, soweit sie nicht Befriedigung verlangen können. Dieses Recht steht den Gläubigern jedoch nur zu, wenn sie glaubhaft machen, dass durch die Verschmelzung die Erfüllung ihrer Forderung gefährdet wird."
    },
    {
      "date": "2026-01-27",
      "id": "143586",
      "original_text": "Registerbekanntmachung nach dem Umwandlungsgesetz\nNordrhein-Westfalen Amtsgericht Iserlohn HRB 10146\nTechniplas NRW Verwaltungsgesellschaft mbH – Lüdenscheid",
      "type": "Registerbekanntmachung nach dem Umwandlungsgesetz",
      "state": "Nordrhein-Westfalen",
      "amtsgericht": "Amtsgericht Iserlohn",
      "registernummer": "HRB 10146",
      "registerart": "HRB",
      "company_name": "Techniplas NRW Verwaltungsgesellschaft mbH",
      "company_seat": "Lüdenscheid",
      "details": "27.01.2026 (Bekanntmachungsdatum)\n\nNordrhein-Westfalen Amtsgericht Iserlohn HRB 10146\nRegisterbekanntmachung nach dem Umwandlungsgesetz 09.01.2026 (Eintragungsdatum)\n\nTechniplas NRW Verwaltungsgesellschaft mbH\nGesellschaft mit beschränkter Haftung\nLüdenscheid\n\nDen Gläubigern der an der Verschmelzung beteiligten Rechtsträger ist, wenn sie binnen sechs Monaten nach dem Tag, an dem die Eintragung der Verschmelzung in das Register des Sitzes desjenigen Rechtsträgers, dessen Gläubiger sie sind, nach § 19 Absatz 3 UmwG als bekanntgemacht gilt, ihren Anspruch nach Grund und Höhe schriftlich anmelden, Sicherheit zu leisten, soweit sie nicht Befriedigung verlangen können. Dieses Recht steht den Gläubigern jedoch nur zu, wenn sie glaubhaft machen, dass durch die Verschmelzung die Erfüllung ihrer Forderung gefährdet wird."
    },
    {
      "date": "2026-01-27",
      "id": "143587",
      "original_text": "Löschungsankündigung\nNordrhein-Westfalen Amtsgericht Köln HRB 91433\nFS International GmbH – Köln",
      "type": "Löschungsankündigung",
      "state": "Nordrhein-Westfalen",
      "amtsgericht": "Amtsgericht Köln",
      "registernummer": "HRB 91433",
      "registerart": "HRB",
      "company_name": "FS International GmbH",
      "company_seat": "Köln",
      "details": "27.01.2026 (Bekanntmachungsdatum)\n\nNordrhein-Westfalen Amtsgericht Köln HRB 91433\nLöschungsankündigung\n\nFS International GmbH\nGesellschaft mit beschränkter Haftung\nKöln\n\nDas Registergericht beabsichtigt die Gesellschaft von Amts wegen nach § 394 FamFG zu löschen. Die Frist zur Erhebung eines Widerspruchs ist auf einen Monat festgesetzt."
    },
    {
      "date": "2026-01-27",
      "id": "143588",
      "original_text": "Einreichung neuer Dokumente\nNordrhein-Westfalen Amtsgericht Düsseldorf HRB 94946\nDKV MOBILITY GROUP SE – Ratingen",
      "type": "Einreichung neuer Dokumente",
      "state": "Nordrhein-Westfalen",
      "amtsgericht": "Amtsgericht Düsseldorf",
      "registernummer": "HRB 94946",
      "registerart": "HRB",
      "company_name": "DKV MOBILITY GROUP SE",
      "company_seat": "Ratingen",
      "details": "27.01.2026 (Bekanntmachungsdatum)\n\nNordrhein-Westfalen Amtsgericht Düsseldorf HRB 94946\nEinreichung neuer Dokumente 12.01.2026 (Eintragungsdatum)\n\nDKV MOBILITY GROUP SE\nEuropäische Aktiengesellschaft (SE)\nRatingen\n\nDem Registergericht ist eine Liste der Mitglieder des Aufsichtsrates eingereicht worden."
    },
    {
      "date": "2026-01-27",
      "id": "143589",
      "original_text": "Einreichung neuer Dokumente\nNordrhein-Westfalen Amtsgericht Düsseldorf HRB 94946\nDKV MOBILITY GROUP SE – Ratingen",
      "type": "Einreichung neuer Dokumente",
      "state": "Nordrhein-Westfalen",
      "amtsgericht": "Amtsgericht Düsseldorf",
      "registernummer": "HRB 94946",
      "registerart": "HRB",
      "company_name": "DKV MOBILITY GROUP SE",
      "company_seat": "Ratingen",
      "details": "27.01.2026 (Bekanntmachungsdatum)\n\nNordrhein-Westfalen Amtsgericht Düsseldorf HRB 94946\nEinreichung neuer Dokumente\n\nDKV MOBILITY GROUP SE\nEuropäische Aktiengesellschaft (SE)\nRatingen\n\nDem Registergericht ist eine Liste der Mitglieder des Verwaltungsrates eingereicht worden."
    },
    {
      "date": "2026-01-27",
      "id": "143590",
      "original_text": "Löschungsankündigung\nNordrhein-Westfalen Amtsgericht Neuss HRB 23336\nFlexoli GmbH – Neuss",
      "type": "Löschungsankündigung",
      "state": "Nordrhein-Westfalen",
      "amtsgericht": "Amtsgericht Neuss",
      "registernummer": "HRB 23336",
      "registerart": "HRB",
      "company_name": "Flexoli GmbH",
      "company_seat": "Neuss",
      "details": "27.01.2026 (Bekanntmachungsdatum)\n\nNordrhein-Westfalen Amtsgericht Neuss HRB 23336\nLöschungsankündigung 26.01.2026 (Eintragungsdatum)\n\nFlexoli GmbH\nGesellschaft mit beschränkter Haftung\nNeuss\n\nDas Registergericht beabsichtigt die Gesellschaft von Amts wegen nach § 394 FamFG zu löschen. Die Frist zur Erhebung eines Widerspruchs ist auf einen Monat festgesetzt. Rechtsbehelfsbelehrung: Gegen diese Verfügung können Sie Widerspruch einlegen. Der Widerspruch ist bei dem Amtsgericht Neuss - Registergericht -, Breite Str. 48, 41460 Neuss schriftlich in deutscher Sprache oder zur Niederschrift der Geschäftsstelle einzulegen. Der Widerspruch kann auch zur Niederschrift der Geschäftsstelle eines jeden Amtsgerichtes abgegeben werden.Die Einlegung ist auch durch Übertragung eines elektronischen Dokuments an die elektronische Poststelle des Gerichts möglich. Das elektronische Dokument muss für die Bearbeitung durch das Gericht geeignet und mit einer qualifizierten elektronischen Signatur der verantwortenden Person versehen sein oder von der verantwortenden Person signiert und auf einem sicheren Übermittlungsweg gemäß § 130a ZPO nach näherer Maßgabe der Verordnung über die technischen Rahmenbedingungen des elektronischen Rechtsverkehrs und über das besondere elektronische Behördenpostfach (BGBl. I, S.3803) eingereicht werden. Weitere Informationen erhalten Sie auf der Internetseite www.justiz.de. Der Widerspruch muss spätestens innerhalb der gesetzten Frist nach der schriftlichen Bekanntgabe der Verfügung bei dem Amtsgericht - Registergericht - Neuss eingegangen sein. Dies gilt auch dann, wenn der Widerspruch zur Niederschrift der Geschäftsstelle eines anderen Amtsgerichtes abgegeben wurde. Die Frist beginnt mit der schriftlichen Bekanntgabe der Verfügung. Die Bekanntgabe ist entweder durch Zustellung oder am dritten Tage nach Aufgabe zur Post bewirkt. Fällt das Ende der Frist auf einen Sonntag, einen allgemeinen Feiertag oder Sonnabend, so endet die Frist mit Ablauf des nächsten Werktages. Der Widerspruch muss die Bezeichnung der angefochtenen Verfügung sowie die Erklärung enthalten, dass Widerspruch gegen diese Verfügung eingelegt wird. Er ist zu unterzeichnen und soll begründet werden."
    },
    {
      "date": "2026-01-27",
      "id": "143591",
      "original_text": "Einreichung neuer Dokumente\nNordrhein-Westfalen Amtsgericht Mönchengladbach HRB 9808\nNEW mobil und aktiv Viersen GmbH – Viersen",
      "type": "Einreichung neuer Dokumente",
      "state": "Nordrhein-Westfalen",
      "amtsgericht": "Amtsgericht Mönchengladbach",
      "registernummer": "HRB 9808",
      "registerart": "HRB",
      "company_name": "NEW mobil und aktiv Viersen GmbH",
      "company_seat": "Viersen",
      "details": "27.01.2026 (Bekanntmachungsdatum)\n\nNordrhein-Westfalen Amtsgericht Mönchengladbach HRB 9808\nEinreichung neuer Dokumente\n\nNEW mobil und aktiv Viersen GmbH\nGesellschaft mit beschränkter Haftung\nViersen\n\nDem Registergericht ist eine neue Liste der Mitglieder des Aufsichtsrates eingereicht worden."
    },
    {
      "date": "2026-01-27",
      "id": "143592",
      "original_text": "Registerbekanntmachung nach dem Umwandlungsgesetz\nNordrhein-Westfalen Amtsgericht Bad Oeynhausen GsR 457\nAutohaus Rehling eGbR – Rahden",
      "type": "Registerbekanntmachung nach dem Umwandlungsgesetz",
      "state": "Nordrhein-Westfalen",
      "amtsgericht": "Amtsgericht Bad Oeynhausen",
      "registernummer": "GsR 457",
      "registerart": "GsR",
      "company_name": "Autohaus Rehling eGbR",
      "company_seat": "Rahden",
      "details": "27.01.2026 (Bekanntmachungsdatum)\n\nNordrhein-Westfalen Amtsgericht Bad Oeynhausen GsR 457\nRegisterbekanntmachung nach dem Umwandlungsgesetz 27.01.2026 (Eintragungsdatum)\n\nAutohaus Rehling eGbR\nGesellschaft bürgerlichen Rechts\nRahden\n\nDen Gläubigern der an der formwechselnden Umwandlung beteiligten Rechtsträger ist, wenn sie binnen sechs Monaten nach dem Tag, an dem die Eintragung der formwechselnden Umwandlung in das Register des Sitzes desjenigen Rechtsträgers, dessen Gläubiger sie sind, nach § 19 Absatz 3 UmwG als bekanntgemacht gilt, ihren Anspruch nach Grund und Höhe schriftlich anmelden, Sicherheit zu leisten, soweit sie nicht Befriedigung verlangen können. Dieses Recht steht den Gläubigern jedoch nur zu, wenn sie glaubhaft machen, dass durch die formwechselnden Umwandlung die Erfüllung ihrer Forderung gefährdet wird."
    },
    {
      "date": "2026-01-27",
      "id": "143593",
      "original_text": "Registerbekanntmachung nach dem Umwandlungsgesetz\nNordrhein-Westfalen Amtsgericht Lemgo HRB 1013\nDörentruper Sand- und Thonwerke, Gesellschaft mit beschränkter Haftung – Dörentrup",
      "type": "Registerbekanntmachung nach dem Umwandlungsgesetz",
      "state": "Nordrhein-Westfalen",
      "amtsgericht": "Amtsgericht Lemgo",
      "registernummer": "HRB 1013",
      "registerart": "HRB",
      "company_name": "Dörentruper Sand- und Thonwerke, Gesellschaft mit beschränkter Haftung",
      "company_seat": "Dörentrup",
      "details": "27.01.2026 (Bekanntmachungsdatum)\n\nNordrhein-Westfalen Amtsgericht Lemgo HRB 1013\nRegisterbekanntmachung nach dem Umwandlungsgesetz 27.01.2026 (Eintragungsdatum)\n\nDörentruper Sand- und Thonwerke, Gesellschaft mit beschränkter Haftung\nGesellschaft mit beschränkter Haftung\nDörentrup\n\nDen Gläubigern der an der Verschmelzung beteiligten Rechtsträger ist, wenn sie binnen sechs Monaten nach dem Tag, an dem die Eintragung der Verschmelzung in das Register des Sitzes desjenigen Rechtsträgers, dessen Gläubiger sie sind, nach § 19 Absatz 3 UmwG als bekanntgemacht gilt, ihren Anspruch nach Grund und Höhe schriftlich anmelden, Sicherheit zu leisten, soweit sie nicht Befriedigung verlangen können. Dieses Recht steht den Gläubigern jedoch nur zu, wenn sie glaubhaft machen, dass durch die Verschmelzung die Erfüllung ihrer Forderung gefährdet wird."
    },
    {
      "date": "2026-01-27",
      "id": "143594",
      "original_text": "Registerbekanntmachung nach dem Umwandlungsgesetz\nNordrhein-Westfalen Amtsgericht Köln HRB 63402\nGambrinus Verwaltung GmbH – Köln",
      "type": "Registerbekanntmachung nach dem Umwandlungsgesetz",
      "state": "Nordrhein-Westfalen",
      "amtsgericht": "Amtsgericht Köln",
      "registernummer": "HRB 63402",
      "registerart": "HRB",
      "company_name": "Gambrinus Verwaltung GmbH",
      "company_seat": "Köln",
      "details": "27.01.2026 (Bekanntmachungsdatum)\n\nNordrhein-Westfalen Amtsgericht Köln HRB 63402\nRegisterbekanntmachung nach dem Umwandlungsgesetz 27.01.2026 (Eintragungsdatum)\n\nGambrinus Verwaltung GmbH\nGesellschaft mit beschränkter Haftung\nKöln\n\nDen Gläubigern der an der Verschmelzung beteiligten Rechtsträger ist, wenn sie binnen sechs Monaten nach dem Tag, an dem die Eintragung der Verschmelzung in das Register des Sitzes desjenigen Rechtsträgers, dessen Gläubiger sie sind, nach § 19 Absatz 3 UmwG als bekanntgemacht gilt, ihren Anspruch nach Grund und Höhe schriftlich anmelden, Sicherheit zu leisten, soweit sie nicht Befriedigung verlangen können. Dieses Recht steht den Gläubigern jedoch nur zu, wenn sie glaubhaft machen, dass durch die Verschmelzung die Erfüllung ihrer Forderung gefährdet wird."
    },
    {
      "date": "2026-01-27",
      "id": "143595",
      "original_text": "Registerbekanntmachung nach dem Umwandlungsgesetz\nNordrhein-Westfalen Amtsgericht Düsseldorf HRB 90886\nPSC GmbH – Düsseldorf",
      "type": "Registerbekanntmachung nach dem Umwandlungsgesetz",
      "state": "Nordrhein-Westfalen",
      "amtsgericht": "Amtsgericht Düsseldorf",
      "registernummer": "HRB 90886",
      "registerart": "HRB",
      "company_name": "PSC GmbH",
      "company_seat": "Düsseldorf",
      "details": "27.01.2026 (Bekanntmachungsdatum)\n\nNordrhein-Westfalen Amtsgericht Düsseldorf HRB 90886\nRegisterbekanntmachung nach dem Umwandlungsgesetz\n\nPSC GmbH\nGesellschaft mit beschränkter Haftung\nDüsseldorf\n\nDer Formwechselplan vom 15. Januar 2026 ist bei dem Handelsregister eingereicht worden.\n\n1. Angaben gemäß § 308 Abs. 1 Satz 2 Nr. 2 UmwG:\n\nAn dem Formwechsel sind beteiligt:\n\nDie PSC GmbH, eine Gesellschaft mit beschränkter Haftung nach deutschem Recht mit Sitz in Düsseldorf, eingetragen im Handelsregister des Amtsgerichts Düsseldorf unter HRB 90886, als formwechselnde Gesellschaft.\n\nNach Abschluss des Formwechsels soll diese fortbestehen als Miyon AG eine Aktiengesellschaft nach liechtensteinischem Recht, mit dem Sitz in Schaan / Liechtenstein.\n\n2. Angaben gemäß § 308 Abs. 1 Satz 2 Nr. 3 UmwG:\n\nDie in Art. 3 Abs. 2 der RL 68/151/EWG (PubIizitätsrichtIinie) genannten Urkunden sind hinterlegt:\n\nfür die PSC GmbH mit Sitz in Düsseldorf, eingetragen im Handelsregister des Amtsgerichts Düsseldorf unter HRB 90886.\n\n3. Angaben gemäß § 308 Abs. 1 Satz 2 Nr. 4 UmwG:\n\nAnteilsinhaber und Gläubiger der an dem grenzüberschreitenden Formwechsel beteiligten Gesellschaft können bis spätestens fünf Arbeitstage vor dem Tag der Gesellschafterversammlung am 26. Februar 2026 Bemerkungen zu dem Formwechselplan übermitteln. Die Bemerkungen sind zu richten an:\nPSC GmbH\nSpeditionsstraße 15a\n40221 Düsseldorf.\n\nUnter dieser Anschrift können kostenlos erschöpfende Auskünfte über die Modalitäten eingeholt werden.\n\nDie formwechselnde Gesellschaft hat weder selbst Arbeitnehmer noch Tochter- oder Enkelgesellschaften."
    },
    {
      "date": "2026-01-27",
      "id": "143596",
      "original_text": "Registerbekanntmachung nach dem Umwandlungsgesetz\nNordrhein-Westfalen Amtsgericht Köln HRB 41354\nJockel Brandschutztechnik-Service GmbH – Köln",
      "type": "Registerbekanntmachung nach dem Umwandlungsgesetz",
      "state": "Nordrhein-Westfalen",
      "amtsgericht": "Amtsgericht Köln",
      "registernummer": "HRB 41354",
      "registerart": "HRB",
      "company_name": "Jockel Brandschutztechnik-Service GmbH",
      "company_seat": "Köln",
      "details": "27.01.2026 (Bekanntmachungsdatum)\n\nNordrhein-Westfalen Amtsgericht Köln HRB 41354\nRegisterbekanntmachung nach dem Umwandlungsgesetz 27.01.2026 (Eintragungsdatum)\n\nJockel Brandschutztechnik-Service GmbH\nGesellschaft mit beschränkter Haftung\nKöln\n\nDen Gläubigern der an der Verschmelzung beteiligten Rechtsträger ist, wenn sie binnen sechs Monaten nach dem Tag, an dem die Eintragung der Verschmelzung in das Register des Sitzes desjenigen Rechtsträgers, dessen Gläubiger sie sind, nach § 19 Absatz 3 UmwG als bekanntgemacht gilt, ihren Anspruch nach Grund und Höhe schriftlich anmelden, Sicherheit zu leisten, soweit sie nicht Befriedigung verlangen können. Dieses Recht steht den Gläubigern jedoch nur zu, wenn sie glaubhaft machen, dass durch die Verschmelzung die Erfüllung ihrer Forderung gefährdet wird."
    },
    {
      "date": "2026-01-27",
      "id": "143597",
      "original_text": "Registerbekanntmachung nach dem Umwandlungsgesetz\nSchleswig-Holstein Amtsgericht Lübeck HRB 25007\nHansa Brandschutz, Automation, Sicherheit GmbH – Lübeck",
      "type": "Registerbekanntmachung nach dem Umwandlungsgesetz",
      "state": "Schleswig-Holstein",
      "amtsgericht": "Amtsgericht Lübeck",
      "registernummer": "HRB 25007",
      "registerart": "HRB",
      "company_name": "Hansa Brandschutz, Automation, Sicherheit GmbH",
      "company_seat": "Lübeck",
      "details": "27.01.2026 (Bekanntmachungsdatum)\n\nSchleswig-Holstein Amtsgericht Lübeck HRB 25007\nRegisterbekanntmachung nach dem Umwandlungsgesetz 26.01.2026 (Eintragungsdatum)\n\nHansa Brandschutz, Automation, Sicherheit GmbH\nGesellschaft mit beschränkter Haftung\nLübeck\n\nZu Eintragungsnummer 6 vom 26.01.2026 wird als nicht eingetragen veröffentlicht: Den Gläubigern der an der Verschmelzung beteiligten Rechtsträger ist, wenn sie binnen sechs Monaten nach dem Tag, an dem die Eintragung der Verschmelzung in das Register des Sitzes desjenigen Rechtsträgers, dessen Gläubiger sie sind, als bekannt gemacht gilt, ihren Anspruch nach Grund und Höhe schriftlich anmelden, Sicherheit zu leisten, soweit sie nicht Befriedigung verlangen können. Dieses Recht steht den Gläubigern jedoch nur zu, wenn sie glaubhaft machen, dass durch die Verschmelzung die Erfüllung ihrer Forderung gefährdet wird."
    },
    {
      "date": "2026-01-27",
      "id": "143598",
      "original_text": "Sonstige Registerbekanntmachung\nThüringen Amtsgericht Jena HRB 501975\nAvery Dennison Materials Sales Germany GmbH – Gotha",
      "type": "Sonstige Registerbekanntmachung",
      "state": "Thüringen",
      "amtsgericht": "Amtsgericht Jena",
      "registernummer": "HRB 501975",
      "registerart": "HRB",
      "company_name": "Avery Dennison Materials Sales Germany GmbH",
      "company_seat": "Gotha",
      "details": "27.01.2026 (Bekanntmachungsdatum)\n\nThüringen Amtsgericht Jena HRB 501975\nSonstige Registerbekanntmachung 27.01.2026 (Eintragungsdatum)\n\nAvery Dennison Materials Sales Germany GmbH\nGesellschaft mit beschränkter Haftung\nGotha\n\nNicht eingetragen: Den Gläubigern der Gesellschaft, deren Forderungen begründet worden sind, bevor die Eintragung der Beendigung des Vertrages in das Handelsregister nach § 10 des Handelsgesetzbuches als bekanntgemacht gilt, hat der andere Vertragsteil Sicherheit zu leisten, wenn sie sich binnen sechs Monaten nach der Bekanntmachung der Eintragung zu diesem Zweck bei ihm melden."
    },
    {
      "date": "2026-01-27",
      "id": "143599",
      "original_text": "Sonstige Registerbekanntmachung\nThüringen Amtsgericht Jena HRB 201511\nPRG Personen- und Reiseverkehrs GmbH Greiz – Greiz",
      "type": "Sonstige Registerbekanntmachung",
      "state": "Thüringen",
      "amtsgericht": "Amtsgericht Jena",
      "registernummer": "HRB 201511",
      "registerart": "HRB",
      "company_name": "PRG Personen- und Reiseverkehrs GmbH Greiz",
      "company_seat": "Greiz",
      "details": "27.01.2026 (Bekanntmachungsdatum)\n\nThüringen Amtsgericht Jena HRB 201511\nSonstige Registerbekanntmachung\n\nPRG Personen- und Reiseverkehrs GmbH Greiz\nGesellschaft mit beschränkter Haftung\nGreiz\n\nBekanntmachung gem. § 52 Abs. 3 Satz 2 GmbHG: Aufgrund einer Veränderung in den Personen der Aufsichtsratsmitglieder ist durch die Geschäftsführer eine neue Liste zum Handelsregister eingereicht worden."
    },
    {
      "date": "2026-01-27",
      "id": "143600",
      "original_text": "Löschungsankündigung\nHessen Amtsgericht Darmstadt HRB 100635\nDWDZ Vertriebs- & Handels UG (haftungsbeschränkt) – Reichelsheim (Odenwald)",
      "type": "Löschungsankündigung",
      "state": "Hessen",
      "amtsgericht": "Amtsgericht Darmstadt",
      "registernummer": "HRB 100635",
      "registerart": "HRB",
      "company_name": "DWDZ Vertriebs- & Handels UG (haftungsbeschränkt)",
      "company_seat": "Reichelsheim (Odenwald)",
      "details": "27.01.2026 (Bekanntmachungsdatum)\n\nHessen Amtsgericht Darmstadt HRB 100635\nLöschungsankündigung\n\nDWDZ Vertriebs- & Handels UG (haftungsbeschränkt)\nGesellschaft mit beschränkter Haftung\nReichelsheim (Odenwald)\n\nDas Registergericht beabsichtigt die im Handelsregister eingetragene Gesellschaft von Amts wegen nach § 394 FamFG zu löschen. Die Frist zur Erhebung eines Widerspruchs gegen die beabsichtigte Löschung wird auf 3 Monate festgesetzt."
    },
    {
      "date": "2026-01-27",
      "id": "143601",
      "original_text": "Löschungsankündigung\nHessen Amtsgericht Frankfurt am Main HRB 101570\nRBH Service GmbH – Sulzbach",
      "type": "Löschungsankündigung",
      "state": "Hessen",
      "amtsgericht": "Amtsgericht Frankfurt am Main",
      "registernummer": "HRB 101570",
      "registerart": "HRB",
      "company_name": "RBH Service GmbH",
      "company_seat": "Sulzbach",
      "details": "27.01.2026 (Bekanntmachungsdatum)\n\nHessen Amtsgericht Frankfurt am Main HRB 101570\nLöschungsankündigung\n\nRBH Service GmbH\nGesellschaft mit beschränkter Haftung\nSulzbach\n\nDas Registergericht beabsichtigt die im Handelsregister eingetragene Gesellschaft von Amts wegen nach § 394 FamFG zu löschen. Die Frist zur Erhebung eines Widerspruchs gegen die beabsichtigte Löschung wird auf 1 Monat festgesetzt."
    },
    {
      "date": "2026-01-27",
      "id": "143602",
      "original_text": "Registerbekanntmachung nach dem Umwandlungsgesetz\nHessen Amtsgericht Frankfurt am Main HRB 122820\nWalt HoldCo GmbH – Frankfurt am Main",
      "type": "Registerbekanntmachung nach dem Umwandlungsgesetz",
      "state": "Hessen",
      "amtsgericht": "Amtsgericht Frankfurt am Main",
      "registernummer": "HRB 122820",
      "registerart": "HRB",
      "company_name": "Walt HoldCo GmbH",
      "company_seat": "Frankfurt am Main",
      "details": "27.01.2026 (Bekanntmachungsdatum)\n\nHessen Amtsgericht Frankfurt am Main HRB 122820\nRegisterbekanntmachung nach dem Umwandlungsgesetz 27.01.2026 (Eintragungsdatum)\n\nWalt HoldCo GmbH\nGesellschaft mit beschränkter Haftung\nFrankfurt am Main\n\nDen Gläubigern der an der Verschmelzung beteiligten Rechtsträger ist, wenn sie binnen sechs Monaten nach dem Tag, an dem die Eintragung der Verschmelzung in das Register des Sitzes desjenigen Rechtsträgers, dessen Gläubiger sie sind, nach § 19 Absatz 3 UmwG bekannt gemacht worden ist, ihren Anspruch nach Grund und Höhe schriftlich anmelden, Sicherheit zu leisten, soweit sie nicht Befriedigung verlangen können. Dieses Recht steht den Gläubigern jedoch nur zu, wenn sie glaubhaft machen, dass durch die Verschmelzung die Erfüllung ihrer Forderung gefährdet wird."
    },
    {
      "date": "2026-01-27",
      "id": "143603",
      "original_text": "Löschungsankündigung\nHessen Amtsgericht Darmstadt HRB 102459\nFERFI General Trading GmbH – Riedstadt",
      "type": "Löschungsankündigung",
      "state": "Hessen",
      "amtsgericht": "Amtsgericht Darmstadt",
      "registernummer": "HRB 102459",
      "registerart": "HRB",
      "company_name": "FERFI General Trading GmbH",
      "company_seat": "Riedstadt",
      "details": "27.01.2026 (Bekanntmachungsdatum)\n\nHessen Amtsgericht Darmstadt HRB 102459\nLöschungsankündigung\n\nFERFI General Trading GmbH\nGesellschaft mit beschränkter Haftung\nRiedstadt\n\nDas Registergericht beabsichtigt die im Handelsregister eingetragene Gesellschaft von Amts wegen nach § 394 FamFG zu löschen. Die Frist zur Erhebung eines Widerspruchs gegen die beabsichtigte Löschung wird auf 3 Monate festgesetzt."
    },
    {
      "date": "2026-01-27",
      "id": "143604",
      "original_text": "Löschungsankündigung\nHessen Amtsgericht Wetzlar HRB 9290\nPuGna Industrie- und Bauindustrie GmbH – Dillenburg",
      "type": "Löschungsankündigung",
      "state": "Hessen",
      "amtsgericht": "Amtsgericht Wetzlar",
      "registernummer": "HRB 9290",
      "registerart": "HRB",
      "company_name": "PuGna Industrie- und Bauindustrie GmbH",
      "company_seat": "Dillenburg",
      "details": "27.01.2026 (Bekanntmachungsdatum)\n\nHessen Amtsgericht Wetzlar HRB 9290\nLöschungsankündigung\n\nPuGna Industrie- und Bauindustrie GmbH\nGesellschaft mit beschränkter Haftung\nDillenburg\n\nDas Registergericht beabsichtigt die im Handelsregister eingetragene Gesellschaft von Amts wegen nach § 394 FamFG zu löschen. Die Frist zur Erhebung eines Widerspruchs gegen die beabsichtigte Löschung wird auf 3 Monate festgesetzt."
    },
    {
      "date": "2026-01-27",
      "id": "143605",
      "original_text": "Registerbekanntmachung nach dem Umwandlungsgesetz\nHessen Amtsgericht Frankfurt am Main HRB 122787\nWindStar Medical GmbH – Frankfurt am Main",
      "type": "Registerbekanntmachung nach dem Umwandlungsgesetz",
      "state": "Hessen",
      "amtsgericht": "Amtsgericht Frankfurt am Main",
      "registernummer": "HRB 122787",
      "registerart": "HRB",
      "company_name": "WindStar Medical GmbH",
      "company_seat": "Frankfurt am Main",
      "details": "27.01.2026 (Bekanntmachungsdatum)\n\nHessen Amtsgericht Frankfurt am Main HRB 122787\nRegisterbekanntmachung nach dem Umwandlungsgesetz 27.01.2026 (Eintragungsdatum)\n\nWindStar Medical GmbH\nGesellschaft mit beschränkter Haftung\nFrankfurt am Main\n\nDen Gläubigern der an der Verschmelzung beteiligten Rechtsträger ist, wenn sie binnen sechs Monaten nach dem Tag, an dem die Eintragung der Verschmelzung in das Register des Sitzes desjenigen Rechtsträgers, dessen Gläubiger sie sind, nach § 19 Absatz 3 UmwG bekannt gemacht worden ist, ihren Anspruch nach Grund und Höhe schriftlich anmelden, Sicherheit zu leisten, soweit sie nicht Befriedigung verlangen können. Dieses Recht steht den Gläubigern jedoch nur zu, wenn sie glaubhaft machen, dass durch die Verschmelzung die Erfüllung ihrer Forderung gefährdet wird."
    },
    {
      "date": "2026-01-27",
      "id": "143606",
      "original_text": "Einreichung neuer Dokumente\nHessen Amtsgericht Darmstadt HRB 86706\ne-netz Südhessen AG – Darmstadt",
      "type": "Einreichung neuer Dokumente",
      "state": "Hessen",
      "amtsgericht": "Amtsgericht Darmstadt",
      "registernummer": "HRB 86706",
      "registerart": "HRB",
      "company_name": "e-netz Südhessen AG",
      "company_seat": "Darmstadt",
      "details": "27.01.2026 (Bekanntmachungsdatum)\n\nHessen Amtsgericht Darmstadt HRB 86706\nEinreichung neuer Dokumente 27.01.2026 (Eintragungsdatum)\n\ne-netz Südhessen AG\nAktiengesellschaft\nDarmstadt\n\nDurch eine Änderung in den Personen der Aufsichtsratsmitglieder ist eine Liste der Mitglieder des Aufsichtsrates zum Handelsregister eingereicht worden."
    },
    {
      "date": "2026-01-27",
      "id": "143607",
      "original_text": "Löschungsankündigung\nHessen Amtsgericht Darmstadt HRA 85663\nALCON Solar Energy GmbH & Co. KG – Birkenau",
      "type": "Löschungsankündigung",
      "state": "Hessen",
      "amtsgericht": "Amtsgericht Darmstadt",
      "registernummer": "HRA 85663",
      "registerart": "HRA",
      "company_name": "ALCON Solar Energy GmbH & Co. KG",
      "company_seat": "Birkenau",
      "details": "27.01.2026 (Bekanntmachungsdatum)\n\nHessen Amtsgericht Darmstadt HRA 85663\nLöschungsankündigung 30.11.2021 (Eintragungsdatum)\n\nALCON Solar Energy GmbH & Co. KG\nKommanditgesellschaft\nBirkenau\n\nDas Registergericht beabsichtigt die im Handelsregister eingetragene Firma von Amts wegen nach § 394 FamFG zu löschen. Die Frist zur Erhebung eines Widerspruchs gegen die beabsichtigte Löschung wird auf 3 Monate festgesetzt."
    }
  ]
}