{
  "date": "2026-01-23",
  "date_of_scrape": "2026-01-24T04:19:12.664Z",
  "tool_version": "0.2.0",
  "number_of_announcements": 107,
  "announcements": [
    {
      "date": "2026-01-23",
      "id": "143261",
      "original_text": "Registerbekanntmachung nach dem Umwandlungsgesetz\nHessen Amtsgericht Frankfurt am Main HRB 141596\nInterbridge GmbH – Eschborn",
      "type": "Registerbekanntmachung nach dem Umwandlungsgesetz",
      "state": "Hessen",
      "amtsgericht": "Amtsgericht Frankfurt am Main",
      "registernummer": "HRB 141596",
      "registerart": "HRB",
      "company_name": "Interbridge GmbH",
      "company_seat": "Eschborn",
      "details": "23.01.2026 (Bekanntmachungsdatum)\n\nHessen Amtsgericht Frankfurt am Main HRB 141596\nRegisterbekanntmachung nach dem Umwandlungsgesetz 22.01.2026 (Eintragungsdatum)\n\nInterbridge GmbH\nGesellschaft mit beschränkter Haftung\nEschborn\n\nDen Gläubigern der an der formwechselnden Umwandlung beteiligten Rechtsträger ist, wenn sie binnen sechs Monaten nach dem Tag, an dem die Eintragung der formwechselnden Umwandlung in das Register des Sitzes desjenigen Rechtsträgers, dessen Gläubiger sie sind, nach § 201 UmwG bekannt gemacht worden ist, ihren Anspruch nach Grund und Höhe schriftlich anmelden, Sicherheit zu leisten, soweit sie nicht Befriedigung verlangen können. Dieses Recht steht den Gläubigern jedoch nur zu, wenn sie glaubhaft machen, dass durch die formwechselnden Umwandlung die Erfüllung ihrer Forderung gefährdet wird."
    },
    {
      "date": "2026-01-23",
      "id": "143262",
      "original_text": "Registerbekanntmachung nach dem Umwandlungsgesetz\nHessen Amtsgericht Frankfurt am Main HRB 124258\nInterbridge Aktiengesellschaft – Eschborn",
      "type": "Registerbekanntmachung nach dem Umwandlungsgesetz",
      "state": "Hessen",
      "amtsgericht": "Amtsgericht Frankfurt am Main",
      "registernummer": "HRB 124258",
      "registerart": "HRB",
      "company_name": "Interbridge Aktiengesellschaft",
      "company_seat": "Eschborn",
      "details": "23.01.2026 (Bekanntmachungsdatum)\n\nHessen Amtsgericht Frankfurt am Main HRB 124258\nRegisterbekanntmachung nach dem Umwandlungsgesetz 22.01.2026 (Eintragungsdatum)\n\nInterbridge Aktiengesellschaft\nAktiengesellschaft\nEschborn\n\nDen Gläubigern der an der formwechselnden Umwandlung beteiligten Rechtsträger ist, wenn sie binnen sechs Monaten nach dem Tag, an dem die Eintragung der formwechselnden Umwandlung in das Register des Sitzes desjenigen Rechtsträgers, dessen Gläubiger sie sind, nach § 201 UmwG bekannt gemacht worden ist, ihren Anspruch nach Grund und Höhe schriftlich anmelden, Sicherheit zu leisten, soweit sie nicht Befriedigung verlangen können. Dieses Recht steht den Gläubigern jedoch nur zu, wenn sie glaubhaft machen, dass durch die formwechselnden Umwandlung die Erfüllung ihrer Forderung gefährdet wird."
    },
    {
      "date": "2026-01-23",
      "id": "143263",
      "original_text": "Löschungsankündigung\nBayern Amtsgericht München HRB 295818\nDrywall Dynamics UG (haftungsbeschränkt) – München",
      "type": "Löschungsankündigung",
      "state": "Bayern",
      "amtsgericht": "Amtsgericht München",
      "registernummer": "HRB 295818",
      "registerart": "HRB",
      "company_name": "Drywall Dynamics UG (haftungsbeschränkt)",
      "company_seat": "München",
      "details": "23.01.2026 (Bekanntmachungsdatum)\n\nBayern Amtsgericht München HRB 295818\nLöschungsankündigung 22.01.2026 (Eintragungsdatum)\n\nDrywall Dynamics UG (haftungsbeschränkt)\nGesellschaft mit beschränkter Haftung\nMünchen\n\nDas Registergericht beabsichtigt, die im Handelsregister eingetragene Gesellschaft wegen Vermögenslosigkeit von Amts wegen nach § 394 FamFG zu löschen. Die Frist zur Erhebung eines Widerspruchs ist auf drei Monate festgesetzt."
    },
    {
      "date": "2026-01-23",
      "id": "143264",
      "original_text": "Einreichung neuer Dokumente\nBayern Amtsgericht Bamberg HRB 7874\nFM Finanzplanungsmanufaktur AG – Bamberg",
      "type": "Einreichung neuer Dokumente",
      "state": "Bayern",
      "amtsgericht": "Amtsgericht Bamberg",
      "registernummer": "HRB 7874",
      "registerart": "HRB",
      "company_name": "FM Finanzplanungsmanufaktur AG",
      "company_seat": "Bamberg",
      "details": "23.01.2026 (Bekanntmachungsdatum)\n\nBayern Amtsgericht Bamberg HRB 7874\nEinreichung neuer Dokumente 22.01.2026 (Eintragungsdatum)\n\nFM Finanzplanungsmanufaktur AG\nAktiengesellschaft\nBamberg\n\nDem Amtsgericht Bamberg -Registergericht- ist eine Liste der Mitglieder des Aufsichtsrats eingereicht worden, § 106 AktG."
    },
    {
      "date": "2026-01-23",
      "id": "143265",
      "original_text": "Einreichung neuer Dokumente\nBayern Amtsgericht München HRB 4921\nBayWa Aktiengesellschaft – München",
      "type": "Einreichung neuer Dokumente",
      "state": "Bayern",
      "amtsgericht": "Amtsgericht München",
      "registernummer": "HRB 4921",
      "registerart": "HRB",
      "company_name": "BayWa Aktiengesellschaft",
      "company_seat": "München",
      "details": "23.01.2026 (Bekanntmachungsdatum)\n\nBayern Amtsgericht München HRB 4921\nEinreichung neuer Dokumente\n\nBayWa Aktiengesellschaft\nAktiengesellschaft\nMünchen\n\nDem Amtsgericht München -Registergericht- ist eine Liste der Mitglieder des Aufsichtsrats eingereicht worden, § 106 AktG."
    },
    {
      "date": "2026-01-23",
      "id": "143266",
      "original_text": "Einreichung neuer Dokumente\nBayern Amtsgericht Bamberg HRB 5765\nBGS - Bamberg.Gebäude.Service GmbH – Bamberg",
      "type": "Einreichung neuer Dokumente",
      "state": "Bayern",
      "amtsgericht": "Amtsgericht Bamberg",
      "registernummer": "HRB 5765",
      "registerart": "HRB",
      "company_name": "BGS - Bamberg.Gebäude.Service GmbH",
      "company_seat": "Bamberg",
      "details": "23.01.2026 (Bekanntmachungsdatum)\n\nBayern Amtsgericht Bamberg HRB 5765\nEinreichung neuer Dokumente\n\nBGS - Bamberg.Gebäude.Service GmbH\nGesellschaft mit beschränkter Haftung\nBamberg\n\nDem Registergericht Bamberg ist eine Liste der Mitglieder des Aufsichtsrats eingereicht worden, § 52 Abs. 3 S. 2 GmbHG."
    },
    {
      "date": "2026-01-23",
      "id": "143267",
      "original_text": "Registerbekanntmachung nach dem Umwandlungsgesetz\nBayern Amtsgericht München HRB 288178\nHowden Deutschland AG – München",
      "type": "Registerbekanntmachung nach dem Umwandlungsgesetz",
      "state": "Bayern",
      "amtsgericht": "Amtsgericht München",
      "registernummer": "HRB 288178",
      "registerart": "HRB",
      "company_name": "Howden Deutschland AG",
      "company_seat": "München",
      "details": "23.01.2026 (Bekanntmachungsdatum)\n\nBayern Amtsgericht München HRB 288178\nRegisterbekanntmachung nach dem Umwandlungsgesetz 22.01.2026 (Eintragungsdatum)\n\nHowden Deutschland AG\nAktiengesellschaft\nMünchen\n\nDen Gläubigern der an der Verschmelzung beteiligten Rechtsträger ist, wenn sie binnen sechs Monaten nach dem Tag, an dem die Eintragung der Verschmelzung in das Register des Sitzes desjenigen Rechtsträgers, dessen Gläubiger sie sind, nach § 19 Abs. 3 UmwG als bekannt gemacht gilt, ihren Anspruch nach Grund und Höhe in Textform anmelden, Sicherheit zu leisten, soweit sie nicht Befriedigung verlangen können. Dieses Recht steht den Gläubigern jedoch nur zu, wenn sie glaubhaft machen, dass durch die Verschmelzung die Erfüllung ihrer Forderung gefährdet wird."
    },
    {
      "date": "2026-01-23",
      "id": "143268",
      "original_text": "Registerbekanntmachung nach dem Umwandlungsgesetz\nBayern Amtsgericht München HRB 305810\nINNIO Holding GmbH – München",
      "type": "Registerbekanntmachung nach dem Umwandlungsgesetz",
      "state": "Bayern",
      "amtsgericht": "Amtsgericht München",
      "registernummer": "HRB 305810",
      "registerart": "HRB",
      "company_name": "INNIO Holding GmbH",
      "company_seat": "München",
      "details": "23.01.2026 (Bekanntmachungsdatum)\n\nBayern Amtsgericht München HRB 305810\nRegisterbekanntmachung nach dem Umwandlungsgesetz\n\nINNIO Holding GmbH\nGesellschaft mit beschränkter Haftung\nMünchen\n\nINNIO Holding GmbH mit Sitz in München, Amtsgericht München, HRB 305810:\nEs wird darauf hingewiesen, dass ein Formwechselplan oder sein Entwurf über einen grenzüberschreitenden Formwechsel in die INNIO Group Holding B.V. mit Sitz in Amsterdam/Niederlande (Besloten Vennootschap met beperkte aansprakelijkheid, B.V.  - Gesellschaft mit beschränkter Haftung nach niederländischem Recht) beim Handelsregister eingereicht worden ist.\nDie Anteilsinhaber, die Gläubiger sowie die zuständigen Betriebsräte der an dem grenzüberschreitenden Formwechsel beteiligten Gesellschaft oder, soweit es keinen Betriebsrat gibt, die Arbeitnehmer der an dem grenzüberschreitenden Formwechsel beteiligten Gesellschaft, können der Gesellschaft spätestens fünf Arbeitstage vor dem Tag der Gesellschafterversammlung Bemerkungen zum Formwechselplan übermitteln.\n1.Hinweis auf die Einreichung des Formwechselplans (§§ 336, 308 Abs. 1 Satz 2 Nr. 1 UmwG) Der Entwurf des Formwechselplans zum grenzüberschreitenden Formwechsel der INNIO Holding GmbH mit Satzungssitz in München, Deutschland, in die INNIO Group Holding B.V. mit Satzungssitz in Amsterdam, Niederlande, wurde zum Handelsregister eingereicht.\n2. Angaben zu den beteiligten Rechtsträgern (§§ 336, 308 Abs. 1 Satz 2 Nr.2 UmwG) An dem grenzüberschreitenden Formwechsel ist die INNIO Holding GmbH mit Satzungssitz in München, Deutschland, eine Gesellschaft mit beschränkter Haftung nach deutschem Recht, als formwechselnde Gesellschaft beteiligt. Ab dem Wirksamwerden des grenzüberschreitenden Formwechsels wird die Gesellschaft fortbestehen als Gesellschaft mit beschränkter Haftung (besloten vennootschap met beperkte aansprakelijkheid, B.V.) niederländischen Rechts unter der Firma INNIO Group Holding B.V. und mit Satzungssitz (statutaire zetel) in Amsterdam, Niederlande.\n3. Angabe der Registerinformationen (§§ 336, 308 Abs. 1 Satz 2 Nr. 3 UmwG) Die INNIO Holding GmbH ist eingetragen im Handelsregister des Amtsgerichts München, Deutschland, unter der Nummer HRB 305810. Die INNIO Group Holding B.V. wird künftig im niederländischen Handelsregister (Kamer van Koophandel) eingetragen sein.\n4. Hinweis auf Möglichkeit der Stellungnahme (§§ 336, 308 Abs. 1 Satz 2 Nr.4 UmwG) Die Gesellschafterversammlung der INNIO Holding GmbH, in der über die Zustimmung zum Formwechselplan beschlossen werden soll, soll am 26. Februar 2026 stattfinden. Die Anteilsinhaber und Gläubiger der INNIO Holding GmbH sowie - da die INNIO Holding GmbH keinen Betriebsrat hat - die Arbeitnehmer der INNIO Holding GmbH können der INNIO Holding GmbH bis spätestens fünf Arbeitstage vor dem Tag der vorgenannten Gesellschafterversammlung Bemerkungen zu dem Formwechselplan übermitteln (§§ 336, 308 Abs. 1 Satz 2 Nr. 4 UmwG). Sämtliche Bemerkungen sind zu richten an die Adresse der INNIO Holding GmbH, Nymphenburger Straße 5, 80335 München, Deutschland."
    },
    {
      "date": "2026-01-23",
      "id": "143269",
      "original_text": "Einreichung neuer Dokumente\nBayern Amtsgericht München HRB 305810\nINNIO Holding GmbH – München",
      "type": "Einreichung neuer Dokumente",
      "state": "Bayern",
      "amtsgericht": "Amtsgericht München",
      "registernummer": "HRB 305810",
      "registerart": "HRB",
      "company_name": "INNIO Holding GmbH",
      "company_seat": "München",
      "details": "23.01.2026 (Bekanntmachungsdatum)\n\nBayern Amtsgericht München HRB 305810\nEinreichung neuer Dokumente\n\nINNIO Holding GmbH\nGesellschaft mit beschränkter Haftung\nMünchen\n\nINNIO Holding GmbH mit Sitz in München, Amtsgericht München, HRB 305810:\nEs wird darauf hingewiesen, dass ein Formwechselplan oder sein Entwurf über einen grenzüberschreitenden Formwechsel in die INNIO Group Holding B.V. mit Sitz in Amsterdam/Niederlande (Besloten Vennootschap met beperkte aansprakelijkheid, B.V.  - Gesellschaft mit beschränkter Haftung nach niederländischem Recht) beim Handelsregister eingereicht worden ist.\nDie Anteilsinhaber, die Gläubiger sowie die zuständigen Betriebsräte der an dem grenzüberschreitenden Formwechsel beteiligten Gesellschaft oder, soweit es keinen Betriebsrat gibt, die Arbeitnehmer der an dem grenzüberschreitenden Formwechsel beteiligten Gesellschaft, können der Gesellschaft spätestens fünf Arbeitstage vor dem Tag der Gesellschafterversammlung Bemerkungen zum Formwechselplan übermitteln.\n1.Hinweis auf die Einreichung des Formwechselplans (§§ 336, 308 Abs. 1 Satz 2 Nr. 1 UmwG) Der Entwurf des Formwechselplans zum grenzüberschreitenden Formwechsel der INNIO Holding GmbH mit Satzungssitz in München, Deutschland, in die INNIO Group Holding B.V. mit Satzungssitz in Amsterdam, Niederlande, wurde zum Handelsregister eingereicht.\n2. Angaben zu den beteiligten Rechtsträgern (§§ 336, 308 Abs. 1 Satz 2 Nr.2 UmwG) An dem grenzüberschreitenden Formwechsel ist die INNIO Holding GmbH mit Satzungssitz in München, Deutschland, eine Gesellschaft mit beschränkter Haftung nach deutschem Recht, als formwechselnde Gesellschaft beteiligt. Ab dem Wirksamwerden des grenzüberschreitenden Formwechsels wird die Gesellschaft fortbestehen als Gesellschaft mit beschränkter Haftung (besloten vennootschap met beperkte aansprakelijkheid, B.V.) niederländischen Rechts unter der Firma INNIO Group Holding B.V. und mit Satzungssitz (statutaire zetel) in Amsterdam, Niederlande.\n3. Angabe der Registerinformationen (§§ 336, 308 Abs. 1 Satz 2 Nr. 3 UmwG) Die INNIO Holding GmbH ist eingetragen im Handelsregister des Amtsgerichts München, Deutschland, unter der Nummer HRB 305810. Die INNIO Group Holding B.V. wird künftig im niederländischen Handelsregister (Kamer van Koophandel) eingetragen sein.\n4. Hinweis auf Möglichkeit der Stellungnahme (§§ 336, 308 Abs. 1 Satz 2 Nr.4 UmwG) Die Gesellschafterversammlung der INNIO Holding GmbH, in der über die Zustimmung zum Formwechselplan beschlossen werden soll, soll am 26. Februar 2026 stattfinden. Die Anteilsinhaber und Gläubiger der INNIO Holding GmbH sowie - da die INNIO Holding GmbH keinen Betriebsrat hat - die Arbeitnehmer der INNIO Holding GmbH können der INNIO Holding GmbH bis spätestens fünf Arbeitstage vor dem Tag der vorgenannten Gesellschafterversammlung Bemerkungen zu dem Formwechselplan übermitteln (§§ 336, 308 Abs. 1 Satz 2 Nr. 4 UmwG). Sämtliche Bemerkungen sind zu richten an die Adresse der INNIO Holding GmbH, Nymphenburger Straße 5, 80335 München, Deutschland."
    },
    {
      "date": "2026-01-23",
      "id": "143270",
      "original_text": "Einreichung neuer Dokumente\nBayern Amtsgericht Fürth HRB 9089\nMedical Valley Center GmbH – Erlangen",
      "type": "Einreichung neuer Dokumente",
      "state": "Bayern",
      "amtsgericht": "Amtsgericht Fürth",
      "registernummer": "HRB 9089",
      "registerart": "HRB",
      "company_name": "Medical Valley Center GmbH",
      "company_seat": "Erlangen",
      "details": "23.01.2026 (Bekanntmachungsdatum)\n\nBayern Amtsgericht Fürth HRB 9089\nEinreichung neuer Dokumente\n\nMedical Valley Center GmbH\nGesellschaft mit beschränkter Haftung\nErlangen\n\nDem Amtsgericht Fürth -Registergericht- ist eine Liste der Mitglieder des Aufsichtsrats eingereicht worden, § 52 Abs. 3 S. 2 GmbHG."
    },
    {
      "date": "2026-01-23",
      "id": "143271",
      "original_text": "Registerbekanntmachung nach dem Umwandlungsgesetz\nBayern Amtsgericht Kempten (Allgäu) HRB 10802\nSDS Systemtechnik GmbH – Schwangau",
      "type": "Registerbekanntmachung nach dem Umwandlungsgesetz",
      "state": "Bayern",
      "amtsgericht": "Amtsgericht Kempten (Allgäu)",
      "registernummer": "HRB 10802",
      "registerart": "HRB",
      "company_name": "SDS Systemtechnik GmbH",
      "company_seat": "Schwangau",
      "details": "23.01.2026 (Bekanntmachungsdatum)\n\nBayern Amtsgericht Kempten (Allgäu) HRB 10802\nRegisterbekanntmachung nach dem Umwandlungsgesetz 22.01.2026 (Eintragungsdatum)\n\nSDS Systemtechnik GmbH\nGesellschaft mit beschränkter Haftung\nSchwangau\n\nDen Gläubigern der an der Verschmelzung beteiligten Rechtsträger ist, wenn sie binnen sechs Monaten nach dem Tag, an dem die Eintragung der Verschmelzung in das Register des Sitzes desjenigen Rechtsträgers, dessen Gläubiger sie sind, nach § 19 Abs. 3 UmwG als bekannt gemacht gilt, ihren Anspruch nach Grund und Höhe in Textform anmelden, Sicherheit zu leisten, soweit sie nicht Befriedigung verlangen können. Dieses Recht steht den Gläubigern jedoch nur zu, wenn sie glaubhaft machen, dass durch die Verschmelzung die Erfüllung ihrer Forderung gefährdet wird."
    },
    {
      "date": "2026-01-23",
      "id": "143272",
      "original_text": "Einreichung neuer Dokumente\nBayern Amtsgericht München HRB 242349\nfox e-mobility AG – München",
      "type": "Einreichung neuer Dokumente",
      "state": "Bayern",
      "amtsgericht": "Amtsgericht München",
      "registernummer": "HRB 242349",
      "registerart": "HRB",
      "company_name": "fox e-mobility AG",
      "company_seat": "München",
      "details": "23.01.2026 (Bekanntmachungsdatum)\n\nBayern Amtsgericht München HRB 242349\nEinreichung neuer Dokumente 22.01.2026 (Eintragungsdatum)\n\nfox e-mobility AG\nAktiengesellschaft\nMünchen\n\nDem Amtsgericht München -Registergericht- ist eine Liste der Mitglieder des Aufsichtsrats eingereicht worden, § 106 AktG."
    },
    {
      "date": "2026-01-23",
      "id": "143273",
      "original_text": "Sonstige Registerbekanntmachung\nBayern Amtsgericht München HRB 162136\nDF Deutsche Finance Management GmbH – München",
      "type": "Sonstige Registerbekanntmachung",
      "state": "Bayern",
      "amtsgericht": "Amtsgericht München",
      "registernummer": "HRB 162136",
      "registerart": "HRB",
      "company_name": "DF Deutsche Finance Management GmbH",
      "company_seat": "München",
      "details": "23.01.2026 (Bekanntmachungsdatum)\n\nBayern Amtsgericht München HRB 162136\nSonstige Registerbekanntmachung 22.01.2026 (Eintragungsdatum)\n\nDF Deutsche Finance Management GmbH\nGesellschaft mit beschränkter Haftung\nMünchen\n\nDen Gläubigern der Gesellschaft, deren Forderungen begründet worden sind, bevor die Eintragung der Beendigung des Gewinnabführungsvertrages in das Handelsregister nach § 10 des Handelsgesetzbuches als bekanntgemacht gilt, hat der andere Vertragsteil Sicherheit zu leisten, wenn sie sich binnen sechs Monaten nach der Bekanntmachung der Eintragung zu diesem Zweck bei ihm melden."
    },
    {
      "date": "2026-01-23",
      "id": "143274",
      "original_text": "Löschungsankündigung\nBayern Amtsgericht Schweinfurt HRA 10697\nHealth, Care and More GmbH & Co. KG – Bischofsheim i.d.Rhön",
      "type": "Löschungsankündigung",
      "state": "Bayern",
      "amtsgericht": "Amtsgericht Schweinfurt",
      "registernummer": "HRA 10697",
      "registerart": "HRA",
      "company_name": "Health, Care and More GmbH & Co. KG",
      "company_seat": "Bischofsheim i.d.Rhön",
      "details": "23.01.2026 (Bekanntmachungsdatum)\n\nBayern Amtsgericht Schweinfurt HRA 10697\nLöschungsankündigung\n\nHealth, Care and More GmbH & Co. KG\nKommanditgesellschaft\nBischofsheim i.d.Rhön\n\nDas Registergericht beabsichtigt, die im Handelsregister eingetragene Firma von Amts wegen nach § 31 Abs. 2 HGB, § 393 FamFG zu löschen. Die Frist zur Erhebung eines Widerspruchs ist auf einen Monat festgesetzt."
    },
    {
      "date": "2026-01-23",
      "id": "143275",
      "original_text": "Einreichung neuer Dokumente\nBayern Amtsgericht Coburg HRB 6814\nBrose Familien Verwaltung SE – Coburg",
      "type": "Einreichung neuer Dokumente",
      "state": "Bayern",
      "amtsgericht": "Amtsgericht Coburg",
      "registernummer": "HRB 6814",
      "registerart": "HRB",
      "company_name": "Brose Familien Verwaltung SE",
      "company_seat": "Coburg",
      "details": "23.01.2026 (Bekanntmachungsdatum)\n\nBayern Amtsgericht Coburg HRB 6814\nEinreichung neuer Dokumente 20.01.2026 (Eintragungsdatum)\n\nBrose Familien Verwaltung SE\nEuropäische Aktiengesellschaft (SE)\nCoburg\n\nDem Amtsgericht Coburg -Registergericht- ist eine Liste der Mitglieder des Aufsichtsrats eingereicht worden, Art. 9 Abs. 1 Buchst. c (ii) SE-VO i.V.m. § 106 AktG."
    },
    {
      "date": "2026-01-23",
      "id": "143276",
      "original_text": "Einreichung neuer Dokumente\nBayern Amtsgericht München HRB 140658\nMünchner Verkehrsgesellschaft mbH (MVG) – München",
      "type": "Einreichung neuer Dokumente",
      "state": "Bayern",
      "amtsgericht": "Amtsgericht München",
      "registernummer": "HRB 140658",
      "registerart": "HRB",
      "company_name": "Münchner Verkehrsgesellschaft mbH (MVG)",
      "company_seat": "München",
      "details": "23.01.2026 (Bekanntmachungsdatum)\n\nBayern Amtsgericht München HRB 140658\nEinreichung neuer Dokumente\n\nMünchner Verkehrsgesellschaft mbH (MVG)\nGesellschaft mit beschränkter Haftung\nMünchen\n\nDem Amtsgericht München -Registergericht- ist eine Liste der Mitglieder des Aufsichtsrats eingereicht worden, § 52 Abs. 3 S. 2 GmbHG."
    },
    {
      "date": "2026-01-23",
      "id": "143277",
      "original_text": "Löschungsankündigung\nBerlin Amtsgericht Berlin (Charlottenburg) HRB 74640\nLRKA Restaurant GmbH – Berlin",
      "type": "Löschungsankündigung",
      "state": "Berlin",
      "amtsgericht": "Amtsgericht Berlin (Charlottenburg)",
      "registernummer": "HRB 74640",
      "registerart": "HRB",
      "company_name": "LRKA Restaurant GmbH",
      "company_seat": "Berlin",
      "details": "23.01.2026 (Bekanntmachungsdatum)\n\nBerlin Amtsgericht Berlin (Charlottenburg) HRB 74640\nLöschungsankündigung\n\nLRKA Restaurant GmbH\nGesellschaft mit beschränkter Haftung\nBerlin\n\nBei der nachstehenden Gesellschaft wird das Amtslöschungsverfahren gemäß § 394 FamFG eingeleitet. Widerspruchsfrist 6 Wochen"
    },
    {
      "date": "2026-01-23",
      "id": "143278",
      "original_text": "Löschungsankündigung\nBerlin Amtsgericht Berlin (Charlottenburg) HRB 219175\nEMC Team UG (haftungsbeschränkt) – Berlin",
      "type": "Löschungsankündigung",
      "state": "Berlin",
      "amtsgericht": "Amtsgericht Berlin (Charlottenburg)",
      "registernummer": "HRB 219175",
      "registerart": "HRB",
      "company_name": "EMC Team UG (haftungsbeschränkt)",
      "company_seat": "Berlin",
      "details": "23.01.2026 (Bekanntmachungsdatum)\n\nBerlin Amtsgericht Berlin (Charlottenburg) HRB 219175\nLöschungsankündigung\n\nEMC Team UG (haftungsbeschränkt)\nGesellschaft mit beschränkter Haftung\nBerlin\n\nBei der nachstehenden Gesellschaft wird das Amtslöschungsverfahren gemäß § 394 FamFG eingeleitet. Widerspruchsfrist 6 Wochen"
    },
    {
      "date": "2026-01-23",
      "id": "143279",
      "original_text": "Löschungsankündigung\nBaden-Württemberg Amtsgericht Mannheim HRB 741475\nRelasan GmbH – Linkenheim-Hochstetten",
      "type": "Löschungsankündigung",
      "state": "Baden-Württemberg",
      "amtsgericht": "Amtsgericht Mannheim",
      "registernummer": "HRB 741475",
      "registerart": "HRB",
      "company_name": "Relasan GmbH",
      "company_seat": "Linkenheim-Hochstetten",
      "details": "23.01.2026 (Bekanntmachungsdatum)\n\nBaden-Württemberg Amtsgericht Mannheim HRB 741475\nLöschungsankündigung\n\nRelasan GmbH\nGesellschaft mit beschränkter Haftung\nLinkenheim-Hochstetten\n\nDas Gericht beabsichtigt, die Gesellschaft wegen Vermögenslosigkeit im Handelsregister von Amts wegen nach § 394 FamFG zu löschen. Die Frist zur Geltendmachung eines Widerspruchs gegen die beabsichtigte Löschung ist auf einen Monat ab Veröffentlichung bestimmt."
    },
    {
      "date": "2026-01-23",
      "id": "143280",
      "original_text": "Löschungsankündigung\nBerlin Amtsgericht Berlin (Charlottenburg) HRB 104425\nprothos Medizinische und Sport Produkte GmbH – Berlin",
      "type": "Löschungsankündigung",
      "state": "Berlin",
      "amtsgericht": "Amtsgericht Berlin (Charlottenburg)",
      "registernummer": "HRB 104425",
      "registerart": "HRB",
      "company_name": "prothos Medizinische und Sport Produkte GmbH",
      "company_seat": "Berlin",
      "details": "23.01.2026 (Bekanntmachungsdatum)\n\nBerlin Amtsgericht Berlin (Charlottenburg) HRB 104425\nLöschungsankündigung\n\nprothos Medizinische und Sport Produkte GmbH\nGesellschaft mit beschränkter Haftung\nBerlin\n\nBei der nachstehenden Gesellschaft wird das Amtslöschungsverfahren gemäß § 394 FamFG eingeleitet. Widerspruchsfrist\n6 Wochen."
    },
    {
      "date": "2026-01-23",
      "id": "143281",
      "original_text": "Löschungsankündigung\nBaden-Württemberg Amtsgericht Mannheim HRA 330737\nAutovertrieb Haussmann GmbH & Co. KG – Heidelberg",
      "type": "Löschungsankündigung",
      "state": "Baden-Württemberg",
      "amtsgericht": "Amtsgericht Mannheim",
      "registernummer": "HRA 330737",
      "registerart": "HRA",
      "company_name": "Autovertrieb Haussmann GmbH & Co. KG",
      "company_seat": "Heidelberg",
      "details": "23.01.2026 (Bekanntmachungsdatum)\n\nBaden-Württemberg Amtsgericht Mannheim HRA 330737\nLöschungsankündigung\n\nAutovertrieb Haussmann GmbH & Co. KG\nKommanditgesellschaft\nHeidelberg\n\nDas Gericht beabsichtigt, die Gesellschaft wegen Vermögenslosigkeit im Handelsregister von Amts wegen nach § 394 FamFG zu löschen. Die Frist zur Geltendmachung eines Widerspruchs gegen die beabsichtigte Löschung ist auf einen Monat ab Veröffentlichung bestimmt."
    },
    {
      "date": "2026-01-23",
      "id": "143282",
      "original_text": "Einreichung neuer Dokumente\nBaden-Württemberg Amtsgericht Ulm HRB 743579\nV42 Vorratsgesellschaft SE – Ellwangen Jagst",
      "type": "Einreichung neuer Dokumente",
      "state": "Baden-Württemberg",
      "amtsgericht": "Amtsgericht Ulm",
      "registernummer": "HRB 743579",
      "registerart": "HRB",
      "company_name": "V42 Vorratsgesellschaft SE",
      "company_seat": "Ellwangen Jagst",
      "details": "23.01.2026 (Bekanntmachungsdatum)\n\nBaden-Württemberg Amtsgericht Ulm HRB 743579\nEinreichung neuer Dokumente\n\nV42 Vorratsgesellschaft SE\nEuropäische Aktiengesellschaft (SE)\nEllwangen Jagst\n\nDie Gesellschaft hat am 21.01.2026 die Liste über die Zusammensetzung des Aufsichtsrats zum Handelsregister eingereicht."
    },
    {
      "date": "2026-01-23",
      "id": "143283",
      "original_text": "Löschungsankündigung\nBaden-Württemberg Amtsgericht Mannheim HRB 743098\nANO BAU GmbH – Mannheim",
      "type": "Löschungsankündigung",
      "state": "Baden-Württemberg",
      "amtsgericht": "Amtsgericht Mannheim",
      "registernummer": "HRB 743098",
      "registerart": "HRB",
      "company_name": "ANO BAU GmbH",
      "company_seat": "Mannheim",
      "details": "23.01.2026 (Bekanntmachungsdatum)\n\nBaden-Württemberg Amtsgericht Mannheim HRB 743098\nLöschungsankündigung\n\nANO BAU GmbH\nGesellschaft mit beschränkter Haftung\nMannheim\n\nDas Gericht beabsichtigt, die Gesellschaft wegen Vermögenslosigkeit im Handelsregister von Amts wegen nach § 394 FamFG zu löschen. Die Frist zur Geltendmachung eines Widerspruchs gegen die beabsichtigte Löschung ist auf einen Monat ab Veröffentlichung bestimmt."
    },
    {
      "date": "2026-01-23",
      "id": "143284",
      "original_text": "Löschungsankündigung\nSaarland Amtsgericht Saarbrücken HRB 105848\nBusiness Design Conseils Verwaltungs-GmbH – Saarbrücken",
      "type": "Löschungsankündigung",
      "state": "Saarland",
      "amtsgericht": "Amtsgericht Saarbrücken",
      "registernummer": "HRB 105848",
      "registerart": "HRB",
      "company_name": "Business Design Conseils Verwaltungs-GmbH",
      "company_seat": "Saarbrücken",
      "details": "23.01.2026 (Bekanntmachungsdatum)\n\nSaarland Amtsgericht Saarbrücken HRB 105848\nLöschungsankündigung\n\nBusiness Design Conseils Verwaltungs-GmbH\nGesellschaft mit beschränkter Haftung\nSaarbrücken\n\nEs ist beabsichtigt, die Gesellschaft von Amts wegen gemäß § 394 FamFG wegen Vermögenslosigkeit zu löschen.\nGegen die Löschung von Amts wegen ist das Rechtsmittel des Widerspruchs statthaft. Der Widerspruch ist binnen einer Frist zwei Monaten beginnend mit dem Tag dieser Veröffentlichung durch Einreichen eines Widerspruchsschreibens -schriftlich oder zur Niederschrift der Geschäftsstelle beim Amtsgericht Saarbrücken, -zentrales Handelsregister-, Mainzerstr.178, 66121 Saarbrücken einzulegen.\nDer Widerspruch muss die Bezeichnung der angefochtenen Löschungsankündigung enthalten sowie die Erklärung, dass Widerspruch eingelegt wird. Er ist vom Widerspruchsführer oder seinem Bevollmächtigten zu unterzeichnen.\nDas Widerspruchsschreiben kann auch in der Form eines elektronischen Dokumentes eingereicht werden, das mit einer qualifizierten elektronischen Signatur nach dem Signaturgesetz versehen sein muss (§§ 14 Abs. 2 FamFG, 130a, 298 ZPO)."
    },
    {
      "date": "2026-01-23",
      "id": "143285",
      "original_text": "Sonstige Registerbekanntmachung\nBaden-Württemberg Amtsgericht Stuttgart HRB 732601\nHürttle Anstrichtechnik GmbH – Asperg",
      "type": "Sonstige Registerbekanntmachung",
      "state": "Baden-Württemberg",
      "amtsgericht": "Amtsgericht Stuttgart",
      "registernummer": "HRB 732601",
      "registerart": "HRB",
      "company_name": "Hürttle Anstrichtechnik GmbH",
      "company_seat": "Asperg",
      "details": "23.01.2026 (Bekanntmachungsdatum)\n\nBaden-Württemberg Amtsgericht Stuttgart HRB 732601\nSonstige Registerbekanntmachung 23.01.2026 (Eintragungsdatum)\n\nHürttle Anstrichtechnik GmbH\nGesellschaft mit beschränkter Haftung\nAsperg\n\nAls nicht eingetragen wird bekanntgemacht:\nDen Gläubigern der Gesellschaft, deren Forderungen begründet worden sind, bevor die Eintragung der Beendigung des Vertrages in das Handelsregister nach § 10 HGB als bekanntgemacht gilt, ist vom anderen Vertragsteil Sicherheit zu leisten, wenn sie sich binnen sechs Monaten nach der Bekanntmachung zu diesem Zweck bei ihm melden."
    },
    {
      "date": "2026-01-23",
      "id": "143286",
      "original_text": "Löschungsankündigung\nBrandenburg Amtsgericht Frankfurt/Oder HRB 18700\nthreecommerce UG (haftungsbeschränkt) – Hoppegarten",
      "type": "Löschungsankündigung",
      "state": "Brandenburg",
      "amtsgericht": "Amtsgericht Frankfurt/Oder",
      "registernummer": "HRB 18700",
      "registerart": "HRB",
      "company_name": "threecommerce UG (haftungsbeschränkt)",
      "company_seat": "Hoppegarten",
      "details": "23.01.2026 (Bekanntmachungsdatum)\n\nBrandenburg Amtsgericht Frankfurt/Oder HRB 18700\nLöschungsankündigung\n\nthreecommerce UG (haftungsbeschränkt)\nGesellschaft mit beschränkter Haftung\nHoppegarten\n\nBei der nachstehenden Gesellschaft wird das Amtslöschungsverfahren gemäß § 394 FamFG eingeleitet."
    },
    {
      "date": "2026-01-23",
      "id": "143287",
      "original_text": "Löschungsankündigung\nBerlin Amtsgericht Berlin (Charlottenburg) HRB 133200\nHealth Ribbon GmbH – Berlin",
      "type": "Löschungsankündigung",
      "state": "Berlin",
      "amtsgericht": "Amtsgericht Berlin (Charlottenburg)",
      "registernummer": "HRB 133200",
      "registerart": "HRB",
      "company_name": "Health Ribbon GmbH",
      "company_seat": "Berlin",
      "details": "23.01.2026 (Bekanntmachungsdatum)\n\nBerlin Amtsgericht Berlin (Charlottenburg) HRB 133200\nLöschungsankündigung\n\nHealth Ribbon GmbH\nGesellschaft mit beschränkter Haftung\nBerlin\n\nBei der nachstehenden Gesellschaft wird das Amtslöschungsverfahren gemäß § 394 FamFG eingeleitet. Widerspruchsfrist 6 Wochen"
    },
    {
      "date": "2026-01-23",
      "id": "143288",
      "original_text": "Registerbekanntmachung nach dem Umwandlungsgesetz\nSchleswig-Holstein Amtsgericht Lübeck HRA 11597\nAutoglas Expert GmbH & Co. KG – Oststeinbek",
      "type": "Registerbekanntmachung nach dem Umwandlungsgesetz",
      "state": "Schleswig-Holstein",
      "amtsgericht": "Amtsgericht Lübeck",
      "registernummer": "HRA 11597",
      "registerart": "HRA",
      "company_name": "Autoglas Expert GmbH & Co. KG",
      "company_seat": "Oststeinbek",
      "details": "23.01.2026 (Bekanntmachungsdatum)\n\nSchleswig-Holstein Amtsgericht Lübeck HRA 11597\nRegisterbekanntmachung nach dem Umwandlungsgesetz 22.01.2026 (Eintragungsdatum)\n\nAutoglas Expert GmbH & Co. KG\nKommanditgesellschaft\nOststeinbek\n\nZu Eintragungsnummer 2 vom 22.01.2026 wird als nicht eingetragen veröffentlicht: Als nicht eingetragen wird veröffentlicht: Den Gläubigern der an der Spaltung beteiligten Rechtsträger ist, wenn sie binnen sechs Monaten nach dem Tag, an dem die Eintragung der Spaltung in das Register des Sitzes desjenigen Rechtsträgers, dessen Gläubiger sie sind, als bekannt gemacht gilt, ihren Anspruch nach Grund und Höhe schriftlich anmelden, Sicherheit zu leisten, soweit sie nicht Befriedigung verlangen können. Dieses Recht steht den Gläubigern jedoch nur zu, wenn sie glaubhaft machen, dass durch die Spaltung die Erfüllung ihrer Forderung gefährdet wird."
    },
    {
      "date": "2026-01-23",
      "id": "143289",
      "original_text": "Registerbekanntmachung nach dem Umwandlungsgesetz\nSchleswig-Holstein Amtsgericht Lübeck HRA 11599\nAutoglas Expert e.K., Inh. Maciej Klawon – Oststeinbek",
      "type": "Registerbekanntmachung nach dem Umwandlungsgesetz",
      "state": "Schleswig-Holstein",
      "amtsgericht": "Amtsgericht Lübeck",
      "registernummer": "HRA 11599",
      "registerart": "HRA",
      "company_name": "Autoglas Expert e.K., Inh. Maciej Klawon",
      "company_seat": "Oststeinbek",
      "details": "23.01.2026 (Bekanntmachungsdatum)\n\nSchleswig-Holstein Amtsgericht Lübeck HRA 11599\nRegisterbekanntmachung nach dem Umwandlungsgesetz 22.01.2026 (Eintragungsdatum)\n\nAutoglas Expert e.K., Inh. Maciej Klawon\nEinzelkaufmann / Einzelkauffrau\nOststeinbek\n\nZu Eintragungsnummer 4 vom 22.01.2026 wird als nicht eingetragen veröffentlicht: Als nicht eingetragen wird veröffentlicht: Den Gläubigern der an der Spaltung beteiligten Rechtsträger ist, wenn sie binnen sechs Monaten nach dem Tag, an dem die Eintragung der Spaltung in das Register des Sitzes desjenigen Rechtsträgers, dessen Gläubiger sie sind, als bekannt gemacht gilt, ihren Anspruch nach Grund und Höhe schriftlich anmelden, Sicherheit zu leisten, soweit sie nicht Befriedigung verlangen können. Dieses Recht steht den Gläubigern jedoch nur zu, wenn sie glaubhaft machen, dass durch die Spaltung die Erfüllung ihrer Forderung gefährdet wird."
    },
    {
      "date": "2026-01-23",
      "id": "143290",
      "original_text": "Löschungsankündigung\nBerlin Amtsgericht Berlin (Charlottenburg) HRB 175248\nShahnameh Verwaltungs GmbH – Berlin",
      "type": "Löschungsankündigung",
      "state": "Berlin",
      "amtsgericht": "Amtsgericht Berlin (Charlottenburg)",
      "registernummer": "HRB 175248",
      "registerart": "HRB",
      "company_name": "Shahnameh Verwaltungs GmbH",
      "company_seat": "Berlin",
      "details": "23.01.2026 (Bekanntmachungsdatum)\n\nBerlin Amtsgericht Berlin (Charlottenburg) HRB 175248\nLöschungsankündigung\n\nShahnameh Verwaltungs GmbH\nGesellschaft mit beschränkter Haftung\nBerlin\n\nBei der nachstehenden Gesellschaft wird das Amtslöschungsverfahren gemäß § 394 FamFG eingeleitet. Widerspruchsfrist 6 Wochen"
    },
    {
      "date": "2026-01-23",
      "id": "143291",
      "original_text": "Einreichung neuer Dokumente\nSaarland Amtsgericht Saarbrücken HRB 109418\nSaarländische Wasserstoffagentur GmbH – Saarbrücken",
      "type": "Einreichung neuer Dokumente",
      "state": "Saarland",
      "amtsgericht": "Amtsgericht Saarbrücken",
      "registernummer": "HRB 109418",
      "registerart": "HRB",
      "company_name": "Saarländische Wasserstoffagentur GmbH",
      "company_seat": "Saarbrücken",
      "details": "23.01.2026 (Bekanntmachungsdatum)\n\nSaarland Amtsgericht Saarbrücken HRB 109418\nEinreichung neuer Dokumente 23.01.2026 (Eintragungsdatum)\n\nSaarländische Wasserstoffagentur GmbH\nGesellschaft mit beschränkter Haftung\nSaarbrücken\n\nDie Geschäftsführung der Gesellschaft hat eine Liste der Mitglieder des Aufsichtsrats zum Handelsregister eingereicht (§ 52 Abs. 3 Satz 2 GmbHG)."
    },
    {
      "date": "2026-01-23",
      "id": "143292",
      "original_text": "Löschungsankündigung\nSaarland Amtsgericht Saarbrücken HRB 105354\nAuric Enterprises GmbH – Saarbrücken",
      "type": "Löschungsankündigung",
      "state": "Saarland",
      "amtsgericht": "Amtsgericht Saarbrücken",
      "registernummer": "HRB 105354",
      "registerart": "HRB",
      "company_name": "Auric Enterprises GmbH",
      "company_seat": "Saarbrücken",
      "details": "23.01.2026 (Bekanntmachungsdatum)\n\nSaarland Amtsgericht Saarbrücken HRB 105354\nLöschungsankündigung\n\nAuric Enterprises GmbH\nGesellschaft mit beschränkter Haftung\nSaarbrücken\n\nEs ist beabsichtigt, die Gesellschaft von Amts wegen gemäß § 394 FamFG wegen Vermögenslosigkeit zu löschen.\nGegen die Löschung von Amts wegen ist das Rechtsmittel des Widerspruchs statthaft. Der Widerspruch ist binnen einer Frist zwei Monaten beginnend mit dem Tag dieser Veröffentlichung durch Einreichen eines Widerspruchsschreibens -schriftlich oder zur Niederschrift der Geschäftsstelle beim Amtsgericht Saarbrücken, -zentrales Handelsregister-, Mainzerstr.178, 66121 Saarbrücken einzulegen.\nDer Widerspruch muss die Bezeichnung der angefochtenen Löschungsankündigung enthalten sowie die Erklärung, dass Widerspruch eingelegt wird. Er ist vom Widerspruchsführer oder seinem Bevollmächtigten zu unterzeichnen.\nDas Widerspruchsschreiben kann auch in der Form eines elektronischen Dokumentes eingereicht werden, das mit einer qualifizierten elektronischen Signatur nach dem Signaturgesetz versehen sein muss (§§ 14 Abs. 2 FamFG, 130a, 298 ZPO)."
    },
    {
      "date": "2026-01-23",
      "id": "143293",
      "original_text": "Sonstige Registerbekanntmachung\nMecklenburg-Vorpommern Amtsgericht Schwerin HRB 2512\nDiakonie Nord Nord Ost in Mecklenburg gemeinnützige GmbH – Grevesmühlen",
      "type": "Sonstige Registerbekanntmachung",
      "state": "Mecklenburg-Vorpommern",
      "amtsgericht": "Amtsgericht Schwerin",
      "registernummer": "HRB 2512",
      "registerart": "HRB",
      "company_name": "Diakonie Nord Nord Ost in Mecklenburg gemeinnützige GmbH",
      "company_seat": "Grevesmühlen",
      "details": "23.01.2026 (Bekanntmachungsdatum)\n\nMecklenburg-Vorpommern Amtsgericht Schwerin HRB 2512\nSonstige Registerbekanntmachung 23.01.2026 (Eintragungsdatum)\n\nDiakonie Nord Nord Ost in Mecklenburg gemeinnützige GmbH\nGesellschaft mit beschränkter Haftung\nGrevesmühlen\n\nEine Liste der Mitglieder des Aufsichtsrats ist zum Handelsregister eingereicht worden."
    },
    {
      "date": "2026-01-23",
      "id": "143294",
      "original_text": "Einreichung neuer Dokumente\nBaden-Württemberg Amtsgericht Stuttgart HRB 727846\nMARQUARDT Mechatronik GmbH – Rietheim-Weilheim",
      "type": "Einreichung neuer Dokumente",
      "state": "Baden-Württemberg",
      "amtsgericht": "Amtsgericht Stuttgart",
      "registernummer": "HRB 727846",
      "registerart": "HRB",
      "company_name": "MARQUARDT Mechatronik GmbH",
      "company_seat": "Rietheim-Weilheim",
      "details": "23.01.2026 (Bekanntmachungsdatum)\n\nBaden-Württemberg Amtsgericht Stuttgart HRB 727846\nEinreichung neuer Dokumente 23.01.2026 (Eintragungsdatum)\n\nMARQUARDT Mechatronik GmbH\nGesellschaft mit beschränkter Haftung\nRietheim-Weilheim\n\nDie Gesellschaft hat am 21.01.2026 die Liste über die Zusammensetzung des Aufsichtsrats zum Handelsregister eingereicht."
    },
    {
      "date": "2026-01-23",
      "id": "143295",
      "original_text": "Einreichung neuer Dokumente\nSchleswig-Holstein Amtsgericht Flensburg HRB 14440\nteam SE – Flensburg",
      "type": "Einreichung neuer Dokumente",
      "state": "Schleswig-Holstein",
      "amtsgericht": "Amtsgericht Flensburg",
      "registernummer": "HRB 14440",
      "registerart": "HRB",
      "company_name": "team SE",
      "company_seat": "Flensburg",
      "details": "23.01.2026 (Bekanntmachungsdatum)\n\nSchleswig-Holstein Amtsgericht Flensburg HRB 14440\nEinreichung neuer Dokumente\n\nteam SE\nEuropäische Aktiengesellschaft (SE)\nFlensburg\n\nAls nicht eingetragen wird veröffentlicht: Neue Aufsichtsratsliste nach Änderung eingereicht am 22.01.2026."
    },
    {
      "date": "2026-01-23",
      "id": "143296",
      "original_text": "Einreichung neuer Dokumente\nBrandenburg Amtsgericht Potsdam HRB 28270\nWackenida GmbH – Zossen",
      "type": "Einreichung neuer Dokumente",
      "state": "Brandenburg",
      "amtsgericht": "Amtsgericht Potsdam",
      "registernummer": "HRB 28270",
      "registerart": "HRB",
      "company_name": "Wackenida GmbH",
      "company_seat": "Zossen",
      "details": "23.01.2026 (Bekanntmachungsdatum)\n\nBrandenburg Amtsgericht Potsdam HRB 28270\nEinreichung neuer Dokumente\n\nWackenida GmbH\nGesellschaft mit beschränkter Haftung\nZossen\n\nAls nicht eingetragen wird veröffentlicht: Dem Amtsgericht Potsdam wurde der Entwurf des Formwechselplanes vom 15.12.2025 betreffend den grenzüberschreitenden , identitätswahrenden Formwechsel der Gesellschaft in eine Gesellschaft mit beschränkter Haftung nach dem Recht des Großherzogtums Luxemburg unter Verlegung des Sitzes der Gesellschaft nach Luxemburg eingereicht. Dazu wird Folgendes bekannt gemacht:\n1. § 336 UmwG i.V.m. § 308 Abs. 1 S. 2Nr. 1 UmwG: Die Gesellschaft hat den Entwurf des Formwechselplans betreffend den\ngrenzüberschreitenden Formwechsel im Wege des Herausformwechsels ohne Abwicklung und Auflösung von einer deutschen GmbH in eine reine Société à responsabilitè  limitée (S.à r.l.)luxemburgischen Rechts mit gleichzeitiger Verlegung des Satzungssitzes nach Luxemburg, Großherzogtum Luxemburg, beim Handelsregister des Amtsgerichts Potsdam gemäß § 336 UmwG in Verbindung mit § 308 Abs. 1 Satz 2 Nr. 1 UmwG eingereicht.\n2. § 336 UmwG i.V.m. § 308 Abs. 1 S. 2  Nr. 2 UmwG: An dem grenzüberschreitenden Formwechsel ist die Wackenida GmbH\nmit Satzungssitz in Zossen, Deutschland, eine nach deutschem Recht  bestehende Gesellschaft mit beschränkter Haftung, beteiligt. Nach dem grenzüberschreitenden Formwechsel wird die Gesellschaft die Rechtsform einer reinen Société à responsabilité limitée (S.à r.l.), eine Gesellschaft mit beschränkter Haftung nach dem Recht des Großherzogtums Luxemburg, annehmen und als Wackenida S.à r.l. mit Satzungssitz in Luxemburg,Großherzogtum Luxemburg firmieren.\n3. § 336 UmwG i.V.m. § 308 Abs. 1 S. 2 Nr. 3 UmwG: Die Gesellschaft ist im Handelsregister des Amtsgerichts Potsdam unter der Handelsregisternummer HRB 28270 P eingetragen. Die Gesellschaft ist zudem im Handels- und Gesellschaftsregister von Luxemburg (Registre de commerce et des sociétés Luxembourg) unter der Nummer B228469 eingetragen, welche auch\nkünftig fortbestehen wird.\n4. § 336 UmwG i.V.m. § 308 Abs. 1 S. 2 Nr. 4 UmwG: Die Gesellschafterversammlung zum Beschluss des grenzüberschreitenden Formwechsels ist für den Tag geplant, der auf den Ablauf von einem Monat nach dem Tag der Registerbekanntmachung des Formwechselplans folgt, oder ggfs. den nächsten Arbeitstag (wobei Samstage, Sonntage und bundesweite Feiertage nicht als Arbeitstage zählen).\na) Die Anteilsinhaber und die Gläubiger der Gesellschaft erhalten den Hinweis, dass sie spätestens fünf Arbeitstage vor dem Tag der Gesellschafterversammlung der Gesellschaft Bemerkungen zum Formwechselplan übermitteln können.\nb) Einen Betriebsrat gibt es nicht, die Gesellschaft hat keine Arbeitnehmer. Der guten Ordnung halber erfolgt gleichwohl der Hinweis, dass die zuständigen Betriebsräte der Gesellschaft oder, soweit es keinen Betriebsrat gibt, die Arbeitnehmer der Gesellschaft, spätestens fünf Arbeitstage vor dem Tag der Gesellschafterversammlung der Gesellschaft Bemerkungen zum\nFormwechselplan übermitteln können."
    },
    {
      "date": "2026-01-23",
      "id": "143297",
      "original_text": "Einreichung neuer Dokumente\nHamburg Amtsgericht Hamburg HRB 44885\nJungheinrich Aktiengesellschaft – Hamburg",
      "type": "Einreichung neuer Dokumente",
      "state": "Hamburg",
      "amtsgericht": "Amtsgericht Hamburg",
      "registernummer": "HRB 44885",
      "registerart": "HRB",
      "company_name": "Jungheinrich Aktiengesellschaft",
      "company_seat": "Hamburg",
      "details": "23.01.2026 (Bekanntmachungsdatum)\n\nHamburg Amtsgericht Hamburg HRB 44885\nEinreichung neuer Dokumente 23.01.2026 (Eintragungsdatum)\n\nJungheinrich Aktiengesellschaft\nAktiengesellschaft\nHamburg\n\nAls nicht eingetragen wird bekannt gemacht: Liste des Aufsichtsrats wurde eingereicht."
    },
    {
      "date": "2026-01-23",
      "id": "143298",
      "original_text": "Registerbekanntmachung nach dem Umwandlungsgesetz\nBerlin Amtsgericht Berlin (Charlottenburg) HRB 218719\nDFI Deutsche Fondsimmobilien Holding AG – Berlin",
      "type": "Registerbekanntmachung nach dem Umwandlungsgesetz",
      "state": "Berlin",
      "amtsgericht": "Amtsgericht Berlin (Charlottenburg)",
      "registernummer": "HRB 218719",
      "registerart": "HRB",
      "company_name": "DFI Deutsche Fondsimmobilien Holding AG",
      "company_seat": "Berlin",
      "details": "23.01.2026 (Bekanntmachungsdatum)\n\nBerlin Amtsgericht Berlin (Charlottenburg) HRB 218719\nRegisterbekanntmachung nach dem Umwandlungsgesetz 22.01.2026 (Eintragungsdatum)\n\nDFI Deutsche Fondsimmobilien Holding AG\nAktiengesellschaft\nBerlin\n\nZu Eintragungsnummer 11 vom 22.01.2026 wird als nicht eingetragen veröffentlicht: Den Gläubigern ist, wenn sie binnen sechs Monaten nach dem Tag, an dem die Eintragung der Umwandlung als bekannt gemacht gilt, ihren Anspruch nach Grund und Höhe schriftlich anmelden, Sicherheit zu leisten, soweit sie nicht Befriedigung verlangen können. Dieses Recht steht den Gläubigern jedoch nur zu, wenn sie glaubhaft machen, dass durch die Umwandlung die Erfüllung ihrer Forderung gefährdet wird. Das Recht, Sicherheitsleistung zu verlangen, steht Gläubigern nicht zu, die im Falle der Insolvenz ein Recht auf vorzugsweise Befriedigung aus einer Deckungsmasse haben, die nach gesetzlicher Vorschrift zu ihrem Schutz errichtet und staatlich überwacht ist."
    },
    {
      "date": "2026-01-23",
      "id": "143299",
      "original_text": "Registerbekanntmachung nach dem Umwandlungsgesetz\nBerlin Amtsgericht Berlin (Charlottenburg) HRB 283147\nDFI Deutsche Fondsimmobilien Holding GmbH – Berlin",
      "type": "Registerbekanntmachung nach dem Umwandlungsgesetz",
      "state": "Berlin",
      "amtsgericht": "Amtsgericht Berlin (Charlottenburg)",
      "registernummer": "HRB 283147",
      "registerart": "HRB",
      "company_name": "DFI Deutsche Fondsimmobilien Holding GmbH",
      "company_seat": "Berlin",
      "details": "23.01.2026 (Bekanntmachungsdatum)\n\nBerlin Amtsgericht Berlin (Charlottenburg) HRB 283147\nRegisterbekanntmachung nach dem Umwandlungsgesetz 22.01.2026 (Eintragungsdatum)\n\nDFI Deutsche Fondsimmobilien Holding GmbH\nGesellschaft mit beschränkter Haftung\nBerlin\n\nZu Eintragungsnummer 1 vom 22.01.2026 wird als nicht eingetragen veröffentlicht: Den Gläubigern ist, wenn sie binnen sechs Monaten nach dem Tag, an dem die Eintragung der Umwandlung als bekannt gemacht gilt, ihren Anspruch nach Grund und Höhe schriftlich anmelden, Sicherheit zu leisten, soweit sie nicht Befriedigung verlangen können. Dieses Recht steht den Gläubigern jedoch nur zu, wenn sie glaubhaft machen, dass durch die Umwandlung die Erfüllung ihrer Forderung gefährdet wird. Das Recht, Sicherheitsleistung zu verlangen, steht Gläubigern nicht zu, die im Falle der Insolvenz ein Recht auf vorzugsweise Befriedigung aus einer Deckungsmasse haben, die nach gesetzlicher Vorschrift zu ihrem Schutz errichtet und staatlich überwacht ist."
    },
    {
      "date": "2026-01-23",
      "id": "143300",
      "original_text": "Einreichung neuer Dokumente\nBerlin Amtsgericht Berlin (Charlottenburg) HRB 90762\nFeuersozietät Berlin Brandenburg Versicherung Aktiengesellschaft – Berlin",
      "type": "Einreichung neuer Dokumente",
      "state": "Berlin",
      "amtsgericht": "Amtsgericht Berlin (Charlottenburg)",
      "registernummer": "HRB 90762",
      "registerart": "HRB",
      "company_name": "Feuersozietät Berlin Brandenburg Versicherung Aktiengesellschaft",
      "company_seat": "Berlin",
      "details": "23.01.2026 (Bekanntmachungsdatum)\n\nBerlin Amtsgericht Berlin (Charlottenburg) HRB 90762\nEinreichung neuer Dokumente\n\nFeuersozietät Berlin Brandenburg Versicherung Aktiengesellschaft\nAktiengesellschaft\nBerlin\n\nAls nicht eingetragen wird veröffentlicht: Es wurde eine neue Liste der Aufsichtsratsmitglieder eingereicht (§ 106 AktG)."
    },
    {
      "date": "2026-01-23",
      "id": "143301",
      "original_text": "Einreichung neuer Dokumente\nBaden-Württemberg Amtsgericht Stuttgart HRB 803595\nErfolgreich Reiten AG – Massenbachhausen",
      "type": "Einreichung neuer Dokumente",
      "state": "Baden-Württemberg",
      "amtsgericht": "Amtsgericht Stuttgart",
      "registernummer": "HRB 803595",
      "registerart": "HRB",
      "company_name": "Erfolgreich Reiten AG",
      "company_seat": "Massenbachhausen",
      "details": "23.01.2026 (Bekanntmachungsdatum)\n\nBaden-Württemberg Amtsgericht Stuttgart HRB 803595\nEinreichung neuer Dokumente 23.01.2026 (Eintragungsdatum)\n\nErfolgreich Reiten AG\nAktiengesellschaft\nMassenbachhausen\n\nDie Gesellschaft hat am 08.01.2026 die Liste über die Zusammensetzung des Aufsichtsrats zum Handelsregister eingereicht."
    },
    {
      "date": "2026-01-23",
      "id": "143302",
      "original_text": "Einreichung neuer Dokumente\nSaarland Amtsgericht Saarbrücken HRB 104671\nErneuerbare Energien Gesellschaft Dillingen/Saar mbH – Dillingen",
      "type": "Einreichung neuer Dokumente",
      "state": "Saarland",
      "amtsgericht": "Amtsgericht Saarbrücken",
      "registernummer": "HRB 104671",
      "registerart": "HRB",
      "company_name": "Erneuerbare Energien Gesellschaft Dillingen/Saar mbH",
      "company_seat": "Dillingen",
      "details": "23.01.2026 (Bekanntmachungsdatum)\n\nSaarland Amtsgericht Saarbrücken HRB 104671\nEinreichung neuer Dokumente\n\nErneuerbare Energien Gesellschaft Dillingen/Saar mbH\nGesellschaft mit beschränkter Haftung\nDillingen\n\nDie Geschäftsführung der Gesellschaft hat eine Liste der Mitglieder des Aufsichtsrats zum Handelsregister eingereicht (§ 52 Abs. 3 Satz 2 GmbHG)."
    },
    {
      "date": "2026-01-23",
      "id": "143303",
      "original_text": "Sonstige Registerbekanntmachung\nBerlin Amtsgericht Berlin (Charlottenburg) HRB 280053\nNeue Havelwelle AG – Berlin",
      "type": "Sonstige Registerbekanntmachung",
      "state": "Berlin",
      "amtsgericht": "Amtsgericht Berlin (Charlottenburg)",
      "registernummer": "HRB 280053",
      "registerart": "HRB",
      "company_name": "Neue Havelwelle AG",
      "company_seat": "Berlin",
      "details": "23.01.2026 (Bekanntmachungsdatum)\n\nBerlin Amtsgericht Berlin (Charlottenburg) HRB 280053\nSonstige Registerbekanntmachung\n\nNeue Havelwelle AG\nAktiengesellschaft\nBerlin\n\nEs wurde eine neue Liste der Aufsichtsratsmitglieder eingereicht (§ 106 AktG).Als nicht eingetragen wird veröffentlicht:"
    },
    {
      "date": "2026-01-23",
      "id": "143304",
      "original_text": "Einreichung neuer Dokumente\nBaden-Württemberg Amtsgericht Stuttgart HRB 19972\nEUWAX Aktiengesellschaft – Stuttgart",
      "type": "Einreichung neuer Dokumente",
      "state": "Baden-Württemberg",
      "amtsgericht": "Amtsgericht Stuttgart",
      "registernummer": "HRB 19972",
      "registerart": "HRB",
      "company_name": "EUWAX Aktiengesellschaft",
      "company_seat": "Stuttgart",
      "details": "23.01.2026 (Bekanntmachungsdatum)\n\nBaden-Württemberg Amtsgericht Stuttgart HRB 19972\nEinreichung neuer Dokumente 23.01.2026 (Eintragungsdatum)\n\nEUWAX Aktiengesellschaft\nAktiengesellschaft\nStuttgart\n\nDie Gesellschaft hat am 16.01.2026 die Liste über die Zusammensetzung des Aufsichtsrats zum Handelsregister eingereicht."
    },
    {
      "date": "2026-01-23",
      "id": "143305",
      "original_text": "Registerbekanntmachung nach dem Umwandlungsgesetz\nHamburg Amtsgericht Hamburg HRB 108418\nerste liebe filmproduktion GmbH – Hamburg",
      "type": "Registerbekanntmachung nach dem Umwandlungsgesetz",
      "state": "Hamburg",
      "amtsgericht": "Amtsgericht Hamburg",
      "registernummer": "HRB 108418",
      "registerart": "HRB",
      "company_name": "erste liebe filmproduktion GmbH",
      "company_seat": "Hamburg",
      "details": "23.01.2026 (Bekanntmachungsdatum)\n\nHamburg Amtsgericht Hamburg HRB 108418\nRegisterbekanntmachung nach dem Umwandlungsgesetz 23.01.2026 (Eintragungsdatum)\n\nerste liebe filmproduktion GmbH\nGesellschaft mit beschränkter Haftung\nHamburg\n\nAls nicht eingetragen wird bekannt gemacht:\nDen Gläubigern der an der Verschmelzung beteiligten Gesellschaften ist, wenn sie binnen sechs Monaten nach dem Tag, an dem die Eintragung der Verschmelzung in das Register des Sitzes desjenigen Rechtsträgers, dessen Gläubiger sie sind, nach § 19 Absatz 3 UmwG als bekannt gemacht gilt, ihren Anspruch nach Grund und Höhe schriftlich anmelden, Sicherheit zu leisten, soweit sie nicht Befriedigung verlangen können. Dieses Recht steht den Gläubigern jedoch nur zu, wenn sie glaubhaft machen, dass durch die Verschmelzung die Erfüllung ihrer Forderung gefährdet wird."
    },
    {
      "date": "2026-01-23",
      "id": "143306",
      "original_text": "Registerbekanntmachung nach dem Umwandlungsgesetz\nHamburg Amtsgericht Hamburg HRB 63826\n\"ERSTE LIEBE\" FILMPRODUKTION GmbH – Hamburg",
      "type": "Registerbekanntmachung nach dem Umwandlungsgesetz",
      "state": "Hamburg",
      "amtsgericht": "Amtsgericht Hamburg",
      "registernummer": "HRB 63826",
      "registerart": "HRB",
      "company_name": "\"ERSTE LIEBE\" FILMPRODUKTION GmbH",
      "company_seat": "Hamburg",
      "details": "23.01.2026 (Bekanntmachungsdatum)\n\nHamburg Amtsgericht Hamburg HRB 63826\nRegisterbekanntmachung nach dem Umwandlungsgesetz 23.01.2026 (Eintragungsdatum)\n\n\"ERSTE LIEBE\" FILMPRODUKTION GmbH\nGesellschaft mit beschränkter Haftung\nHamburg\n\nAls nicht eingetragen wird bekannt gemacht:\nDen Gläubigern der an der Verschmelzung beteiligten Gesellschaften ist, wenn sie binnen sechs Monaten nach dem Tag, an dem die Eintragung der Verschmelzung in das Register des Sitzes desjenigen Rechtsträgers, dessen Gläubiger sie sind, nach § 19 Absatz 3 UmwG als bekannt gemacht gilt, ihren Anspruch nach Grund und Höhe schriftlich anmelden, Sicherheit zu leisten, soweit sie nicht Befriedigung verlangen können. Dieses Recht steht den Gläubigern jedoch nur zu, wenn sie glaubhaft machen, dass durch die Verschmelzung die Erfüllung ihrer Forderung gefährdet wird."
    },
    {
      "date": "2026-01-23",
      "id": "143307",
      "original_text": "Registerbekanntmachung nach dem Umwandlungsgesetz\nSchleswig-Holstein Amtsgericht Kiel HRB 24828\nH.H.T. Beteiligungsgesellschaft mbH – Strande",
      "type": "Registerbekanntmachung nach dem Umwandlungsgesetz",
      "state": "Schleswig-Holstein",
      "amtsgericht": "Amtsgericht Kiel",
      "registernummer": "HRB 24828",
      "registerart": "HRB",
      "company_name": "H.H.T. Beteiligungsgesellschaft mbH",
      "company_seat": "Strande",
      "details": "23.01.2026 (Bekanntmachungsdatum)\n\nSchleswig-Holstein Amtsgericht Kiel HRB 24828\nRegisterbekanntmachung nach dem Umwandlungsgesetz 22.01.2026 (Eintragungsdatum)\n\nH.H.T. Beteiligungsgesellschaft mbH\nGesellschaft mit beschränkter Haftung\nStrande\n\nZu Eintragungsnummer 2 vom 22.01.2026 wird als nicht eingetragen veröffentlicht: Den Gläubigern der an der Verschmelzung beteiligten Rechtsträger ist, wenn sie binnen sechs Monaten nach dem Tag, an dem die Eintragung der Verschmelzung in das Register des Sitzes desjenigen Rechtsträgers, dessen Gläubiger sie sind, nach § 19 Abs. 3 UmwG bekannt gemacht worden ist, ihren Anspruch nach Grund und Höhe schriftlich anmelden, Sicherheit zu leisten, soweit sie nicht Befriedigung verlangen können. Dieses Recht steht den Gläubigern jedoch nur zu, wenn sie glaubhaft machen, dass durch die Verschmelzung die Erfüllung ihrer Forderung gefährdet wird."
    },
    {
      "date": "2026-01-23",
      "id": "143308",
      "original_text": "Registerbekanntmachung nach dem Umwandlungsgesetz\nSchleswig-Holstein Amtsgericht Lübeck VR 4159\nLuftsportverein Grambeker Heide e.V. – Mölln",
      "type": "Registerbekanntmachung nach dem Umwandlungsgesetz",
      "state": "Schleswig-Holstein",
      "amtsgericht": "Amtsgericht Lübeck",
      "registernummer": "VR 4159",
      "registerart": "VR",
      "company_name": "Luftsportverein Grambeker Heide e.V.",
      "company_seat": "Mölln",
      "details": "23.01.2026 (Bekanntmachungsdatum)\n\nSchleswig-Holstein Amtsgericht Lübeck VR 4159\nRegisterbekanntmachung nach dem Umwandlungsgesetz 22.01.2026 (Eintragungsdatum)\n\nLuftsportverein Grambeker Heide e.V.\neingetragener Verein\nMölln\n\nZu Eintragungsnummer 6 vom 22.01.2026 wird als nicht eingetragen veröffentlicht:  Als nicht eingetragen wird veröffentlicht: Den Gläubigern der an der Verschmelzung beteiligten Rechtsträger ist, wenn sie binnen sechs Monaten nach dem Tag, an dem die Eintragung der Verschmelzung in das Register des Sitzes desjenigen Rechtsträgers, dessen Gläubiger sie sind, als bekannt gemacht gilt, ihren Anspruch nach Grund und Höhe schriftlich anmelden, Sicherheit zu leisten, soweit sie nicht Befriedigung verlangen können. Dieses Recht steht den Gläubigern jedoch nur zu, wenn sie glaubhaft machen, dass durch die Verschmelzung die Erfüllung ihrer Forderung gefährdet wird."
    },
    {
      "date": "2026-01-23",
      "id": "143309",
      "original_text": "Löschungsankündigung\nBerlin Amtsgericht Berlin (Charlottenburg) HRB 163594\nDie Eintragung betreffend die Firma meko factory - Werkstatt für Medienkompetenz gemeinnützige GmbH ist als nichtig gelöscht. – Berlin",
      "type": "Löschungsankündigung",
      "state": "Berlin",
      "amtsgericht": "Amtsgericht Berlin (Charlottenburg)",
      "registernummer": "HRB 163594",
      "registerart": "HRB",
      "company_name": "Die Eintragung betreffend die Firma meko factory - Werkstatt für Medienkompetenz gemeinnützige GmbH ist als nichtig gelöscht.",
      "company_seat": "Berlin",
      "details": "23.01.2026 (Bekanntmachungsdatum)\n\nBerlin Amtsgericht Berlin (Charlottenburg) HRB 163594\nLöschungsankündigung\n\nDie Eintragung betreffend die Firma meko factory - Werkstatt für Medienkompetenz gemeinnützige GmbH ist als nichtig gelöscht.\nGesellschaft mit beschränkter Haftung\nBerlin\n\nBei der nachstehenden Gesellschaft wird das Amtslöschungsverfahren gemäß § 394 FamFG eingeleitet. Widerspruchsfrist 6 Wochen"
    },
    {
      "date": "2026-01-23",
      "id": "143310",
      "original_text": "Registerbekanntmachung nach dem Umwandlungsgesetz\nSchleswig-Holstein Amtsgericht Lübeck VR 1231\nAero-Club von Lübeck – Lübeck",
      "type": "Registerbekanntmachung nach dem Umwandlungsgesetz",
      "state": "Schleswig-Holstein",
      "amtsgericht": "Amtsgericht Lübeck",
      "registernummer": "VR 1231",
      "registerart": "VR",
      "company_name": "Aero-Club von Lübeck",
      "company_seat": "Lübeck",
      "details": "23.01.2026 (Bekanntmachungsdatum)\n\nSchleswig-Holstein Amtsgericht Lübeck VR 1231\nRegisterbekanntmachung nach dem Umwandlungsgesetz 22.01.2026 (Eintragungsdatum)\n\nAero-Club von Lübeck\neingetragener Verein\nLübeck\n\nZu Eintragungsnummer 15 vom 22.01.2026 wird als nicht eingetragen veröffentlicht:  Als nicht eingetragen wird veröffentlicht: Den Gläubigern der an der Verschmelzung beteiligten Rechtsträger ist, wenn sie binnen sechs Monaten nach dem Tag, an dem die Eintragung der Verschmelzung in das Register des Sitzes desjenigen Rechtsträgers, dessen Gläubiger sie sind, als bekannt gemacht gilt, ihren Anspruch nach Grund und Höhe schriftlich anmelden, Sicherheit zu leisten, soweit sie nicht Befriedigung verlangen können. Dieses Recht steht den Gläubigern jedoch nur zu, wenn sie glaubhaft machen, dass durch die Verschmelzung die Erfüllung ihrer Forderung gefährdet wird."
    },
    {
      "date": "2026-01-23",
      "id": "143311",
      "original_text": "Sonstige Registerbekanntmachung\nBerlin Amtsgericht Berlin (Charlottenburg) HRB 200064\nVay Technology GmbH – Berlin",
      "type": "Sonstige Registerbekanntmachung",
      "state": "Berlin",
      "amtsgericht": "Amtsgericht Berlin (Charlottenburg)",
      "registernummer": "HRB 200064",
      "registerart": "HRB",
      "company_name": "Vay Technology GmbH",
      "company_seat": "Berlin",
      "details": "23.01.2026 (Bekanntmachungsdatum)\n\nBerlin Amtsgericht Berlin (Charlottenburg) HRB 200064\nSonstige Registerbekanntmachung\n\nVay Technology GmbH\nGesellschaft mit beschränkter Haftung\nBerlin\n\nAls nicht eingetragen wird veröffentlicht: Es wurde eine neue Liste der Beiratsmitglieder eingereicht (§52 GmbHG)."
    },
    {
      "date": "2026-01-23",
      "id": "143312",
      "original_text": "Registerbekanntmachung nach dem Umwandlungsgesetz\nBaden-Württemberg Amtsgericht Mannheim HRB 717144\nErnst & Young J&M Management Consulting GmbH – Mannheim",
      "type": "Registerbekanntmachung nach dem Umwandlungsgesetz",
      "state": "Baden-Württemberg",
      "amtsgericht": "Amtsgericht Mannheim",
      "registernummer": "HRB 717144",
      "registerart": "HRB",
      "company_name": "Ernst & Young J&M Management Consulting GmbH",
      "company_seat": "Mannheim",
      "details": "23.01.2026 (Bekanntmachungsdatum)\n\nBaden-Württemberg Amtsgericht Mannheim HRB 717144\nRegisterbekanntmachung nach dem Umwandlungsgesetz 23.01.2026 (Eintragungsdatum)\n\nErnst & Young J&M Management Consulting GmbH\nGesellschaft mit beschränkter Haftung\nMannheim\n\nDen Gläubigern der an der Verschmelzung beteiligten Rechtsträger ist, wenn sie binnen sechs Monaten nach dem Tag, an dem die Eintragung der Verschmelzung in das Register des Sitzes desjenigen Rechtsträgers, dessen Gläubiger sie sind, nach § 19 Abs. 3 UmwG als bekanntgemacht gilt, ihren Anspruch nach Grund und Höhe schriftlich anmelden, Sicherheit zu leisten, soweit sie nicht Befriedigung verlangen können. Dieses Recht steht den Gläubigern jedoch nur zu, wenn sie glaubhaft machen, dass durch die Verschmelzung die Erfüllung ihrer Forderung gefährdet wird."
    },
    {
      "date": "2026-01-23",
      "id": "143313",
      "original_text": "Einreichung neuer Dokumente\nBaden-Württemberg Amtsgericht Ulm HRB 500995\nHENSOLDT Optronics GmbH – Oberkochen",
      "type": "Einreichung neuer Dokumente",
      "state": "Baden-Württemberg",
      "amtsgericht": "Amtsgericht Ulm",
      "registernummer": "HRB 500995",
      "registerart": "HRB",
      "company_name": "HENSOLDT Optronics GmbH",
      "company_seat": "Oberkochen",
      "details": "23.01.2026 (Bekanntmachungsdatum)\n\nBaden-Württemberg Amtsgericht Ulm HRB 500995\nEinreichung neuer Dokumente\n\nHENSOLDT Optronics GmbH\nGesellschaft mit beschränkter Haftung\nOberkochen\n\nDie Gesellschaft hat am 20.01.2026 die Liste über die Zusammensetzung des Aufsichtsrats zum Handelsregister eingereicht."
    },
    {
      "date": "2026-01-23",
      "id": "143314",
      "original_text": "Löschungsankündigung\nBerlin Amtsgericht Berlin (Charlottenburg) HRB 188476\nBerlin Chauffeurs GmbH – Berlin",
      "type": "Löschungsankündigung",
      "state": "Berlin",
      "amtsgericht": "Amtsgericht Berlin (Charlottenburg)",
      "registernummer": "HRB 188476",
      "registerart": "HRB",
      "company_name": "Berlin Chauffeurs GmbH",
      "company_seat": "Berlin",
      "details": "23.01.2026 (Bekanntmachungsdatum)\n\nBerlin Amtsgericht Berlin (Charlottenburg) HRB 188476\nLöschungsankündigung\n\nBerlin Chauffeurs GmbH\nGesellschaft mit beschränkter Haftung\nBerlin\n\nBei der nachstehenden Gesellschaft wird das Amtslöschungsverfahren gemäß § 394 FamFG eingeleitet. Widerspruchsfrist 6 Wochen"
    },
    {
      "date": "2026-01-23",
      "id": "143315",
      "original_text": "Einreichung neuer Dokumente\nBaden-Württemberg Amtsgericht Stuttgart HRB 302334\nBütema AG – Bietigheim-Bissingen",
      "type": "Einreichung neuer Dokumente",
      "state": "Baden-Württemberg",
      "amtsgericht": "Amtsgericht Stuttgart",
      "registernummer": "HRB 302334",
      "registerart": "HRB",
      "company_name": "Bütema AG",
      "company_seat": "Bietigheim-Bissingen",
      "details": "23.01.2026 (Bekanntmachungsdatum)\n\nBaden-Württemberg Amtsgericht Stuttgart HRB 302334\nEinreichung neuer Dokumente 23.01.2026 (Eintragungsdatum)\n\nBütema AG\nAktiengesellschaft\nBietigheim-Bissingen\n\nDie Gesellschaft hat am 22.01.2026 die Liste über die Zusammensetzung des Aufsichtsrats zum Handelsregister eingereicht."
    },
    {
      "date": "2026-01-23",
      "id": "143316",
      "original_text": "Löschungsankündigung\nBerlin Amtsgericht Berlin (Charlottenburg) HRB 159294\nDOM Handel & Finanzen GmbH – Berlin",
      "type": "Löschungsankündigung",
      "state": "Berlin",
      "amtsgericht": "Amtsgericht Berlin (Charlottenburg)",
      "registernummer": "HRB 159294",
      "registerart": "HRB",
      "company_name": "DOM Handel & Finanzen GmbH",
      "company_seat": "Berlin",
      "details": "23.01.2026 (Bekanntmachungsdatum)\n\nBerlin Amtsgericht Berlin (Charlottenburg) HRB 159294\nLöschungsankündigung\n\nDOM Handel & Finanzen GmbH\nGesellschaft mit beschränkter Haftung\nBerlin\n\nBei der nachstehenden Gesellschaft wird das Amtslöschungsverfahren gemäß § 394 FamFG eingeleitet. Widerspruchsfrist 6 Wochen"
    },
    {
      "date": "2026-01-23",
      "id": "143317",
      "original_text": "Registerbekanntmachung nach dem Umwandlungsgesetz\nHamburg Amtsgericht Hamburg HRB 108017\nDESUKA TRADE GmbH – Hamburg",
      "type": "Registerbekanntmachung nach dem Umwandlungsgesetz",
      "state": "Hamburg",
      "amtsgericht": "Amtsgericht Hamburg",
      "registernummer": "HRB 108017",
      "registerart": "HRB",
      "company_name": "DESUKA TRADE GmbH",
      "company_seat": "Hamburg",
      "details": "23.01.2026 (Bekanntmachungsdatum)\n\nHamburg Amtsgericht Hamburg HRB 108017\nRegisterbekanntmachung nach dem Umwandlungsgesetz 23.01.2026 (Eintragungsdatum)\n\nDESUKA TRADE GmbH\nGesellschaft mit beschränkter Haftung\nHamburg\n\nAls nicht eingetragen wird bekannt gemacht:\nDen Gläubigern der an der Verschmelzung beteiligten Gesellschaften ist, wenn sie binnen sechs Monaten nach dem Tag, an dem die Eintragung der Verschmelzung in das Register des Sitzes desjenigen Rechtsträgers, dessen Gläubiger sie sind, nach § 19 Absatz 3 UmwG als bekannt gemacht gilt, ihren Anspruch nach Grund und Höhe schriftlich anmelden, Sicherheit zu leisten, soweit sie nicht Befriedigung verlangen können. Dieses Recht steht den Gläubigern jedoch nur zu, wenn sie glaubhaft machen, dass durch die Verschmelzung die Erfüllung ihrer Forderung gefährdet wird."
    },
    {
      "date": "2026-01-23",
      "id": "143318",
      "original_text": "Löschungsankündigung\nBerlin Amtsgericht Berlin (Charlottenburg) HRB 186493\nPENTA Entertainment UG (haftungsbeschränkt) – Berlin",
      "type": "Löschungsankündigung",
      "state": "Berlin",
      "amtsgericht": "Amtsgericht Berlin (Charlottenburg)",
      "registernummer": "HRB 186493",
      "registerart": "HRB",
      "company_name": "PENTA Entertainment UG (haftungsbeschränkt)",
      "company_seat": "Berlin",
      "details": "23.01.2026 (Bekanntmachungsdatum)\n\nBerlin Amtsgericht Berlin (Charlottenburg) HRB 186493\nLöschungsankündigung\n\nPENTA Entertainment UG (haftungsbeschränkt)\nGesellschaft mit beschränkter Haftung\nBerlin\n\nEs ist die Löschung des Geschäftsführers Andreas Schaetzke wegen Mangels einer wesentlichen Voraussetzung nach § 395 FamFG beabsichtigt. Die Widerspruchsfrist beträgt 2 Wochen."
    },
    {
      "date": "2026-01-23",
      "id": "143319",
      "original_text": "Einreichung neuer Dokumente\nBaden-Württemberg Amtsgericht Freiburg HRB 728625\nJobRad Holding SE – Freiburg im Breisgau",
      "type": "Einreichung neuer Dokumente",
      "state": "Baden-Württemberg",
      "amtsgericht": "Amtsgericht Freiburg",
      "registernummer": "HRB 728625",
      "registerart": "HRB",
      "company_name": "JobRad Holding SE",
      "company_seat": "Freiburg im Breisgau",
      "details": "23.01.2026 (Bekanntmachungsdatum)\n\nBaden-Württemberg Amtsgericht Freiburg HRB 728625\nEinreichung neuer Dokumente\n\nJobRad Holding SE\nEuropäische Aktiengesellschaft (SE)\nFreiburg im Breisgau\n\nDie Gesellschaft hat am 21.01.2026 die Liste über die Zusammensetzung des Aufsichtsrats zum Handelsregister eingereicht."
    },
    {
      "date": "2026-01-23",
      "id": "143320",
      "original_text": "Einreichung neuer Dokumente\nBrandenburg Amtsgericht Potsdam HRB 17165\nPRINTANDMORE Potsdam GmbH – Potsdam",
      "type": "Einreichung neuer Dokumente",
      "state": "Brandenburg",
      "amtsgericht": "Amtsgericht Potsdam",
      "registernummer": "HRB 17165",
      "registerart": "HRB",
      "company_name": "PRINTANDMORE Potsdam GmbH",
      "company_seat": "Potsdam",
      "details": "23.01.2026 (Bekanntmachungsdatum)\n\nBrandenburg Amtsgericht Potsdam HRB 17165\nEinreichung neuer Dokumente\n\nPRINTANDMORE Potsdam GmbH\nGesellschaft mit beschränkter Haftung\nPotsdam\n\nAls nicht eingetragen wird veröffentlicht:\nDer mit der Knaup Vermögensverwaltungsgesellschaft mbH mit Sitz in Potsdam, eingetragen beim Amtsgericht Potsdam unter HRB 33382 P, bestehende Beherrschungs- und Gewinnabführungsvertrag vom 02.12.2020 ist durch Kündigung der Knaup Vermögensverwaltungsgesellschaft mbH zum 31.12.2025 beendet."
    },
    {
      "date": "2026-01-23",
      "id": "143321",
      "original_text": "Einreichung neuer Dokumente\nBaden-Württemberg Amtsgericht Stuttgart HRB 726261\nAesculap AG – Tuttlingen",
      "type": "Einreichung neuer Dokumente",
      "state": "Baden-Württemberg",
      "amtsgericht": "Amtsgericht Stuttgart",
      "registernummer": "HRB 726261",
      "registerart": "HRB",
      "company_name": "Aesculap AG",
      "company_seat": "Tuttlingen",
      "details": "23.01.2026 (Bekanntmachungsdatum)\n\nBaden-Württemberg Amtsgericht Stuttgart HRB 726261\nEinreichung neuer Dokumente\n\nAesculap AG\nAktiengesellschaft\nTuttlingen\n\nDie Gesellschaft hat am 21.01.2026 die Liste über die Zusammensetzung des Aufsichtsrats zum Handelsregister eingereicht."
    },
    {
      "date": "2026-01-23",
      "id": "143322",
      "original_text": "Registerbekanntmachung nach dem Umwandlungsgesetz\nSachsen Amtsgericht Chemnitz HRB 15149\nAIP Innenprojekt GmbH – Limbach-Oberfrohna",
      "type": "Registerbekanntmachung nach dem Umwandlungsgesetz",
      "state": "Sachsen",
      "amtsgericht": "Amtsgericht Chemnitz",
      "registernummer": "HRB 15149",
      "registerart": "HRB",
      "company_name": "AIP Innenprojekt GmbH",
      "company_seat": "Limbach-Oberfrohna",
      "details": "23.01.2026 (Bekanntmachungsdatum)\n\nSachsen Amtsgericht Chemnitz HRB 15149\nRegisterbekanntmachung nach dem Umwandlungsgesetz 23.01.2026 (Eintragungsdatum)\n\nAIP Innenprojekt GmbH\nGesellschaft mit beschränkter Haftung\nLimbach-Oberfrohna\n\nDen Gläubigern der an der Verschmelzung beteiligten Rechtsträger ist, wenn sie binnen sechs Monaten nach dem Tag, an dem die Eintragung der Verschmelzung in das Register des Sitzes desjenigen Rechtsträgers, dessen Gläubiger sie sind, nach § 19 Abs. 3 UmwG als bekannt gemacht gilt, ihren Anspruch nach Grund und Höhe in Textform anmelden, Sicherheit zu leisten, soweit sie nicht Befriedigung verlangen können. Dieses Recht steht den Gläubigern jedoch nur zu, wenn sie glaubhaft machen, dass durch die Verschmelzung die Erfüllung der Forderung gefährdet wird."
    },
    {
      "date": "2026-01-23",
      "id": "143323",
      "original_text": "Löschungsankündigung\nSachsen Amtsgericht Dresden HRB 37176\nSüd Safe Betreibergesellschaft mbH – Dresden",
      "type": "Löschungsankündigung",
      "state": "Sachsen",
      "amtsgericht": "Amtsgericht Dresden",
      "registernummer": "HRB 37176",
      "registerart": "HRB",
      "company_name": "Süd Safe Betreibergesellschaft mbH",
      "company_seat": "Dresden",
      "details": "23.01.2026 (Bekanntmachungsdatum)\n\nSachsen Amtsgericht Dresden HRB 37176\nLöschungsankündigung\n\nSüd Safe Betreibergesellschaft mbH\nGesellschaft mit beschränkter Haftung\nDresden\n\nDas Registergericht beabsichtigt, die im Handelsregister eingetragene Gesellschaft von Amts wegen nach § 394 FamFG zu löschen. Die Frist zu Erhebung eines Widerspruchs gegen die beabsichtigte Löschung wird auf einen Monat festgesetzt."
    },
    {
      "date": "2026-01-23",
      "id": "143324",
      "original_text": "Registerbekanntmachung nach dem Umwandlungsgesetz\nNiedersachsen Amtsgericht Stadthagen HRB 201872\nKirchner Engineering Consultants GmbH – Stadthagen",
      "type": "Registerbekanntmachung nach dem Umwandlungsgesetz",
      "state": "Niedersachsen",
      "amtsgericht": "Amtsgericht Stadthagen",
      "registernummer": "HRB 201872",
      "registerart": "HRB",
      "company_name": "Kirchner Engineering Consultants GmbH",
      "company_seat": "Stadthagen",
      "details": "23.01.2026 (Bekanntmachungsdatum)\n\nNiedersachsen Amtsgericht Stadthagen HRB 201872\nRegisterbekanntmachung nach dem Umwandlungsgesetz 23.01.2026 (Eintragungsdatum)\n\nKirchner Engineering Consultants GmbH\nGesellschaft mit beschränkter Haftung\nStadthagen\n\nDen Gläubigern der an der Verschmelzung beteiligten Rechtsträger ist, wenn sie binnen sechs Monaten nach dem Tag, an dem die Eintragung der Verschmelzung in das Register des Sitzes desjenigen Rechtsträgers, dessen Gläubiger sie sind, nach § 19  Abs.  3 UmwG als bekannt gemacht gilt, ihren Anspruch nach Grund und Höhe schriftlich anmelden, Sicherheit zu leisten, soweit sie nicht Befriedigung verlangen können. Dieses Recht steht den Gläubigern jedoch nur zu, wenn sie glaubhaft machen, dass durch die Verschmelzung die Erfüllung der Forderung gefährdet wird."
    },
    {
      "date": "2026-01-23",
      "id": "143325",
      "original_text": "Registerbekanntmachung nach dem Umwandlungsgesetz\nNiedersachsen Amtsgericht Oldenburg (Oldenburg) HRB 222417\nVico Invest GmbH – Goldenstedt-Lutten",
      "type": "Registerbekanntmachung nach dem Umwandlungsgesetz",
      "state": "Niedersachsen",
      "amtsgericht": "Amtsgericht Oldenburg (Oldenburg)",
      "registernummer": "HRB 222417",
      "registerart": "HRB",
      "company_name": "Vico Invest GmbH",
      "company_seat": "Goldenstedt-Lutten",
      "details": "23.01.2026 (Bekanntmachungsdatum)\n\nNiedersachsen Amtsgericht Oldenburg (Oldenburg) HRB 222417\nRegisterbekanntmachung nach dem Umwandlungsgesetz 22.01.2026 (Eintragungsdatum)\n\nVico Invest GmbH\nGesellschaft mit beschränkter Haftung\nGoldenstedt-Lutten\n\nDen Gläubigern der an der Abspaltung beteiligten Rechtsträger ist, wenn sie binnen sechs Monaten nach dem Tag, an dem die Eintragung der Abspaltung in das Register des Sitzes desjenigen Rechtsträgers, dessen Gläubiger sie sind, nach § 19 Abs. 3 UmwG als bekannt gemacht gilt, ihren Anspruch nach Grund und Höhe schriftlich anmelden, Sicherheit zu leisten, soweit sie nicht Befriedigung verlangen können. Dieses Recht steht den Gläubigern jedoch nur zu, wenn sie glaubhaft machen, dass durch die Abspaltung die Erfüllung der Forderung gefährdet wird."
    },
    {
      "date": "2026-01-23",
      "id": "143326",
      "original_text": "Löschungsankündigung\nNiedersachsen Amtsgericht Hannover HRB 57287\nGeneral Expo Consultants Verwaltungs Gesellschaft mit beschränkter Haftung – Hannover",
      "type": "Löschungsankündigung",
      "state": "Niedersachsen",
      "amtsgericht": "Amtsgericht Hannover",
      "registernummer": "HRB 57287",
      "registerart": "HRB",
      "company_name": "General Expo Consultants Verwaltungs Gesellschaft mit beschränkter Haftung",
      "company_seat": "Hannover",
      "details": "23.01.2026 (Bekanntmachungsdatum)\n\nNiedersachsen Amtsgericht Hannover HRB 57287\nLöschungsankündigung 23.01.2026 (Eintragungsdatum)\n\nGeneral Expo Consultants Verwaltungs Gesellschaft mit beschränkter Haftung\nGesellschaft mit beschränkter Haftung\nHannover\n\nDas Registergericht beabsichtigt, die Gesellschaft von Amts wegen nach § 394 FamFG zu löschen. Die Frist zur Erhebung eines Widerspruchs ist auf 1 Monat ab dieser Registerbekanntmachung festgesetzt."
    },
    {
      "date": "2026-01-23",
      "id": "143327",
      "original_text": "Löschungsankündigung\nNiedersachsen Amtsgericht Osnabrück HRB 218549\nStandart-Logistik GmbH – Osnabrück",
      "type": "Löschungsankündigung",
      "state": "Niedersachsen",
      "amtsgericht": "Amtsgericht Osnabrück",
      "registernummer": "HRB 218549",
      "registerart": "HRB",
      "company_name": "Standart-Logistik GmbH",
      "company_seat": "Osnabrück",
      "details": "23.01.2026 (Bekanntmachungsdatum)\n\nNiedersachsen Amtsgericht Osnabrück HRB 218549\nLöschungsankündigung\n\nStandart-Logistik GmbH\nGesellschaft mit beschränkter Haftung\nOsnabrück\n\nDas Registergericht beabsichtigt, die Gesellschaft von Amts wegen nach § 394 FamFG wegen Vermögenslosigkeit zu löschen. Die Frist zur Erhebung eines Widerspruchs ist auf 1 Monat ab dieser Registerbekanntmachung festgesetzt."
    },
    {
      "date": "2026-01-23",
      "id": "143328",
      "original_text": "Sonstige Registerbekanntmachung\nNiedersachsen Amtsgericht Hildesheim HRB 207140\nLiveoCare GmbH – Isenbüttel",
      "type": "Sonstige Registerbekanntmachung",
      "state": "Niedersachsen",
      "amtsgericht": "Amtsgericht Hildesheim",
      "registernummer": "HRB 207140",
      "registerart": "HRB",
      "company_name": "LiveoCare GmbH",
      "company_seat": "Isenbüttel",
      "details": "23.01.2026 (Bekanntmachungsdatum)\n\nNiedersachsen Amtsgericht Hildesheim HRB 207140\nSonstige Registerbekanntmachung 23.01.2026 (Eintragungsdatum)\n\nLiveoCare GmbH\nGesellschaft mit beschränkter Haftung\nIsenbüttel\n\nDen Gläubigern der Gesellschaft, deren Forderungen begründet worden sind, bevor die Eintragung der Beendigung des Vertrages in das Handelsregister nach § 10 HGB als bekanntgemacht gilt, ist vom anderen Vertragsteil Sicherheit zu leisten, wenn sie sich binnen sechs Monaten nach der Bekanntmachung zu diesem Zweck bei ihm melden."
    },
    {
      "date": "2026-01-23",
      "id": "143329",
      "original_text": "Löschungsankündigung\nNiedersachsen Amtsgericht Osnabrück HRB 215285\nCivis Futuri UG (haftungsbeschränkt) – Haren (Ems)",
      "type": "Löschungsankündigung",
      "state": "Niedersachsen",
      "amtsgericht": "Amtsgericht Osnabrück",
      "registernummer": "HRB 215285",
      "registerart": "HRB",
      "company_name": "Civis Futuri UG (haftungsbeschränkt)",
      "company_seat": "Haren (Ems)",
      "details": "23.01.2026 (Bekanntmachungsdatum)\n\nNiedersachsen Amtsgericht Osnabrück HRB 215285\nLöschungsankündigung\n\nCivis Futuri UG (haftungsbeschränkt)\nGesellschaft mit beschränkter Haftung\nHaren (Ems)\n\nDas Registergericht beabsichtigt, die Gesellschaft von Amts wegen nach § 394 FamFG wegen Vermögenslosigkeit zu löschen. Die Frist zur Erhebung eines Widerspruchs ist auf 1 Monat ab dieser Registerbekanntmachung festgesetzt."
    },
    {
      "date": "2026-01-23",
      "id": "143330",
      "original_text": "Löschungsankündigung\nNiedersachsen Amtsgericht Hildesheim HRB 208323\nSammi Bau UG (haftungsbeschränkt) – Peine",
      "type": "Löschungsankündigung",
      "state": "Niedersachsen",
      "amtsgericht": "Amtsgericht Hildesheim",
      "registernummer": "HRB 208323",
      "registerart": "HRB",
      "company_name": "Sammi Bau UG (haftungsbeschränkt)",
      "company_seat": "Peine",
      "details": "23.01.2026 (Bekanntmachungsdatum)\n\nNiedersachsen Amtsgericht Hildesheim HRB 208323\nLöschungsankündigung\n\nSammi Bau UG (haftungsbeschränkt)\nGesellschaft mit beschränkter Haftung\nPeine\n\nDas Registergericht beabsichtigt, die Gesellschaft von Amts wegen nach § 394 FamFG zu löschen. Die Frist zur Erhebung eines Widerspruchs ist auf 1 Monat ab dieser Registerbekanntmachung festgesetzt."
    },
    {
      "date": "2026-01-23",
      "id": "143331",
      "original_text": "Einreichung neuer Dokumente\nNiedersachsen Amtsgericht Hannover HRB 209168\nHAJUS AG – Seelze",
      "type": "Einreichung neuer Dokumente",
      "state": "Niedersachsen",
      "amtsgericht": "Amtsgericht Hannover",
      "registernummer": "HRB 209168",
      "registerart": "HRB",
      "company_name": "HAJUS AG",
      "company_seat": "Seelze",
      "details": "23.01.2026 (Bekanntmachungsdatum)\n\nNiedersachsen Amtsgericht Hannover HRB 209168\nEinreichung neuer Dokumente\n\nHAJUS AG\nAktiengesellschaft\nSeelze\n\nDie Liste der Mitglieder des Aufsichtsrats wurde beim Registergericht eingereicht."
    },
    {
      "date": "2026-01-23",
      "id": "143332",
      "original_text": "Registerbekanntmachung nach dem Umwandlungsgesetz\nNiedersachsen Amtsgericht Stadthagen HRB 202033\nKIRCHNER Infrastrukturplanung GmbH – Stadthagen",
      "type": "Registerbekanntmachung nach dem Umwandlungsgesetz",
      "state": "Niedersachsen",
      "amtsgericht": "Amtsgericht Stadthagen",
      "registernummer": "HRB 202033",
      "registerart": "HRB",
      "company_name": "KIRCHNER Infrastrukturplanung GmbH",
      "company_seat": "Stadthagen",
      "details": "23.01.2026 (Bekanntmachungsdatum)\n\nNiedersachsen Amtsgericht Stadthagen HRB 202033\nRegisterbekanntmachung nach dem Umwandlungsgesetz 23.01.2026 (Eintragungsdatum)\n\nKIRCHNER Infrastrukturplanung GmbH\nGesellschaft mit beschränkter Haftung\nStadthagen\n\nDen Gläubigern der an der Verschmelzung beteiligten Rechtsträger ist, wenn sie binnen sechs Monaten nach dem Tag, an dem die Eintragung der Verschmelzung in das Register des Sitzes desjenigen Rechtsträgers, dessen Gläubiger sie sind, nach § 19  Abs.  3 UmwG als bekannt gemacht gilt, ihren Anspruch nach Grund und Höhe schriftlich anmelden, Sicherheit zu leisten, soweit sie nicht Befriedigung verlangen können. Dieses Recht steht den Gläubigern jedoch nur zu, wenn sie glaubhaft machen, dass durch die Verschmelzung die Erfüllung der Forderung gefährdet wird."
    },
    {
      "date": "2026-01-23",
      "id": "143333",
      "original_text": "Registerbekanntmachung nach dem Umwandlungsgesetz\nNiedersachsen Amtsgericht Oldenburg (Oldenburg) HRB 210985\nTSS Ingenieure GmbH – Lohne",
      "type": "Registerbekanntmachung nach dem Umwandlungsgesetz",
      "state": "Niedersachsen",
      "amtsgericht": "Amtsgericht Oldenburg (Oldenburg)",
      "registernummer": "HRB 210985",
      "registerart": "HRB",
      "company_name": "TSS Ingenieure GmbH",
      "company_seat": "Lohne",
      "details": "23.01.2026 (Bekanntmachungsdatum)\n\nNiedersachsen Amtsgericht Oldenburg (Oldenburg) HRB 210985\nRegisterbekanntmachung nach dem Umwandlungsgesetz 23.01.2026 (Eintragungsdatum)\n\nTSS Ingenieure GmbH\nGesellschaft mit beschränkter Haftung\nLohne\n\nDen Gläubigern der an der formwechselnden Umwandlung beteiligten Rechtsträger ist, wenn sie binnen sechs Monaten nach dem Tag, an dem die Eintragung der Umwandlung in das Register des Sitzes desjenigen Rechtsträgers, dessen Gläubiger sie sind, nach § 19 Abs. 3 UmwG als bekannt gemacht gilt, ihren Anspruch nach Grund und Höhe schriftlich anmelden, Sicherheit zu leisten, soweit sie nicht Befriedigung verlangen können. Dieses Recht steht den Gläubigern jedoch nur zu, wenn sie glaubhaft machen, dass durch die formwechselnde Umwandlung die Erfüllung der Forderung gefährdet wird."
    },
    {
      "date": "2026-01-23",
      "id": "143334",
      "original_text": "Einreichung neuer Dokumente\nHamburg Amtsgericht Hamburg HRB 170792\nJFD Bank AG – Hamburg",
      "type": "Einreichung neuer Dokumente",
      "state": "Hamburg",
      "amtsgericht": "Amtsgericht Hamburg",
      "registernummer": "HRB 170792",
      "registerart": "HRB",
      "company_name": "JFD Bank AG",
      "company_seat": "Hamburg",
      "details": "23.01.2026 (Bekanntmachungsdatum)\n\nHamburg Amtsgericht Hamburg HRB 170792\nEinreichung neuer Dokumente 23.01.2026 (Eintragungsdatum)\n\nJFD Bank AG\nAktiengesellschaft\nHamburg\n\nAls nicht eingetragen wird bekannt gemacht: Liste des Aufsichtsrats wurde eingereicht."
    },
    {
      "date": "2026-01-23",
      "id": "143335",
      "original_text": "Löschungsankündigung\nRheinland-Pfalz Amtsgericht Bad Kreuznach HRB 23171\nI. L. - Transporte UG (haftungsbeschränkt) – Kellenbach",
      "type": "Löschungsankündigung",
      "state": "Rheinland-Pfalz",
      "amtsgericht": "Amtsgericht Bad Kreuznach",
      "registernummer": "HRB 23171",
      "registerart": "HRB",
      "company_name": "I. L. - Transporte UG (haftungsbeschränkt)",
      "company_seat": "Kellenbach",
      "details": "23.01.2026 (Bekanntmachungsdatum)\n\nRheinland-Pfalz Amtsgericht Bad Kreuznach HRB 23171\nLöschungsankündigung\n\nI. L. - Transporte UG (haftungsbeschränkt)\nGesellschaft mit beschränkter Haftung\nKellenbach\n\nDas Registergericht beabsichtigt die Gesellschaft wegen Vermögenslosigkeit im Handelsregister von Amts wegen nach § 394 FamFG zu löschen. Die Frist zur Erhebung eines Widerspruchs gegen die beabsichtigte Löschung ist auf einen Monat ab Veröffentlichung bestimmt."
    },
    {
      "date": "2026-01-23",
      "id": "143336",
      "original_text": "Registerbekanntmachung nach dem Umwandlungsgesetz\nRheinland-Pfalz Amtsgericht Landau HRB 21795\nAugust Berger Metallwarenfabrik GmbH – Berg / Pfalz",
      "type": "Registerbekanntmachung nach dem Umwandlungsgesetz",
      "state": "Rheinland-Pfalz",
      "amtsgericht": "Amtsgericht Landau",
      "registernummer": "HRB 21795",
      "registerart": "HRB",
      "company_name": "August Berger Metallwarenfabrik GmbH",
      "company_seat": "Berg / Pfalz",
      "details": "23.01.2026 (Bekanntmachungsdatum)\n\nRheinland-Pfalz Amtsgericht Landau HRB 21795\nRegisterbekanntmachung nach dem Umwandlungsgesetz 23.01.2026 (Eintragungsdatum)\n\nAugust Berger Metallwarenfabrik GmbH\nGesellschaft mit beschränkter Haftung\nBerg / Pfalz\n\nAls nicht eingetragen wird veröffentlicht: Den Gläubigern der an der Verschmelzung beteiligten Rechtsträger ist, wenn sie binnen sechs Monaten nach dem Tag, an dem die Eintragung der Verschmelzung in das Register des Sitzes desjenigen Rechtsträgers,dessen Gläubiger sie sind, nach § 19 Abs. 3 UmwG als bekannt gemacht gilt, ihren Anspruch nach Grund und Höhe schriftlich anmelden, Sicherheit zu leisten, soweit sie nicht Befriedigung verlangen können. Dieses Recht steht den Gläubigern jedoch nur zu, wenn sie glaubhaft machen, dass durch die Verschmelzung die Erfüllung der Forderung gefährdet wird."
    },
    {
      "date": "2026-01-23",
      "id": "143337",
      "original_text": "Löschungsankündigung\nBremen Amtsgericht Bremen HRB 40734\nMedien und Recht GmbH – Bremen",
      "type": "Löschungsankündigung",
      "state": "Bremen",
      "amtsgericht": "Amtsgericht Bremen",
      "registernummer": "HRB 40734",
      "registerart": "HRB",
      "company_name": "Medien und Recht GmbH",
      "company_seat": "Bremen",
      "details": "23.01.2026 (Bekanntmachungsdatum)\n\nBremen Amtsgericht Bremen HRB 40734\nLöschungsankündigung\n\nMedien und Recht GmbH\nGesellschaft mit beschränkter Haftung\nBremen\n\nEs ist beabsichtigt die im Handelsregister eingetragene Gesellschaft von Amts wegen gemäß § 394 FamFG zu löschen. Gegen die Löschung kann beim AG Bremen schriftlich oder zu Protokoll der Geschäftsstelle Widerspruch eingelegt werden. Widerspruchsfrist 4 Wochen."
    },
    {
      "date": "2026-01-23",
      "id": "143338",
      "original_text": "Löschungsankündigung\nBremen Amtsgericht Bremen HRB 31663\nKWS-Automaten GmbH – Bremen",
      "type": "Löschungsankündigung",
      "state": "Bremen",
      "amtsgericht": "Amtsgericht Bremen",
      "registernummer": "HRB 31663",
      "registerart": "HRB",
      "company_name": "KWS-Automaten GmbH",
      "company_seat": "Bremen",
      "details": "23.01.2026 (Bekanntmachungsdatum)\n\nBremen Amtsgericht Bremen HRB 31663\nLöschungsankündigung\n\nKWS-Automaten GmbH\nGesellschaft mit beschränkter Haftung\nBremen\n\nEs ist beabsichtigt die im Handelsregister eingetragene Gesellschaft von Amts wegen gemäß § 394 FamFG zu löschen. Gegen die Löschung kann beim AG Bremen schriftlich oder zu Protokoll der Geschäftsstelle Widerspruch eingelegt werden. Widerspruchsfrist 4 Wochen."
    },
    {
      "date": "2026-01-23",
      "id": "143339",
      "original_text": "Löschungsankündigung\nBremen Amtsgericht Bremen HRB 25556\nMaxlabo UG (haftungsbeschränkt) – Bremen",
      "type": "Löschungsankündigung",
      "state": "Bremen",
      "amtsgericht": "Amtsgericht Bremen",
      "registernummer": "HRB 25556",
      "registerart": "HRB",
      "company_name": "Maxlabo UG (haftungsbeschränkt)",
      "company_seat": "Bremen",
      "details": "23.01.2026 (Bekanntmachungsdatum)\n\nBremen Amtsgericht Bremen HRB 25556\nLöschungsankündigung\n\nMaxlabo UG (haftungsbeschränkt)\nGesellschaft mit beschränkter Haftung\nBremen\n\nEs ist beabsichtigt die im Handelsregister eingetragene Gesellschaft von Amts wegen gemäß § 394 FamFG zu löschen. Gegen die Löschung kann beim AG Bremen schriftlich oder zu Protokoll der Geschäftsstelle Widerspruch eingelegt werden. Widerspruchsfrist 4 Wochen."
    },
    {
      "date": "2026-01-23",
      "id": "143340",
      "original_text": "Löschungsankündigung\nBremen Amtsgericht Bremen HRB 34768\nMarek Koenen Holding GmbH – Bremerhaven",
      "type": "Löschungsankündigung",
      "state": "Bremen",
      "amtsgericht": "Amtsgericht Bremen",
      "registernummer": "HRB 34768",
      "registerart": "HRB",
      "company_name": "Marek Koenen Holding GmbH",
      "company_seat": "Bremerhaven",
      "details": "23.01.2026 (Bekanntmachungsdatum)\n\nBremen Amtsgericht Bremen HRB 34768\nLöschungsankündigung\n\nMarek Koenen Holding GmbH\nGesellschaft mit beschränkter Haftung\nBremerhaven\n\nEs ist beabsichtigt die im Handelsregister eingetragene Gesellschaft von Amts wegen gemäß § 394 FamFG zu löschen. Gegen die Löschung kann beim AG Bremen schriftlich oder zu Protokoll der Geschäftsstelle Widerspruch eingelegt werden. Widerspruchsfrist 4 Wochen."
    },
    {
      "date": "2026-01-23",
      "id": "143341",
      "original_text": "Löschungsankündigung\nBremen Amtsgericht Bremen HRB 36922\nCuram Bonam GmbH – Bremen",
      "type": "Löschungsankündigung",
      "state": "Bremen",
      "amtsgericht": "Amtsgericht Bremen",
      "registernummer": "HRB 36922",
      "registerart": "HRB",
      "company_name": "Curam Bonam GmbH",
      "company_seat": "Bremen",
      "details": "23.01.2026 (Bekanntmachungsdatum)\n\nBremen Amtsgericht Bremen HRB 36922\nLöschungsankündigung\n\nCuram Bonam GmbH\nGesellschaft mit beschränkter Haftung\nBremen\n\nEs ist beabsichtigt die im Handelsregister eingetragene Gesellschaft von Amts wegen gemäß § 394 FamFG zu löschen. Gegen die Löschung kann beim AG Bremen schriftlich oder zu Protokoll der Geschäftsstelle Widerspruch eingelegt werden. Widerspruchsfrist 4 Wochen."
    },
    {
      "date": "2026-01-23",
      "id": "143342",
      "original_text": "Registerbekanntmachung nach dem Umwandlungsgesetz\nBremen Amtsgericht Bremen HRB 34495\nMüller Ditzen GmbH – Bremerhaven",
      "type": "Registerbekanntmachung nach dem Umwandlungsgesetz",
      "state": "Bremen",
      "amtsgericht": "Amtsgericht Bremen",
      "registernummer": "HRB 34495",
      "registerart": "HRB",
      "company_name": "Müller Ditzen GmbH",
      "company_seat": "Bremerhaven",
      "details": "23.01.2026 (Bekanntmachungsdatum)\n\nBremen Amtsgericht Bremen HRB 34495\nRegisterbekanntmachung nach dem Umwandlungsgesetz 13.01.2026 (Eintragungsdatum)\n\nMüller Ditzen GmbH\nGesellschaft mit beschränkter Haftung\nBremerhaven\n\nZu Eintragungsnummer 10 vom 13.01.2026 wird als nicht eingetragen veröffentlicht: Gläubigern, deren Forderungen begründet worden sind, bevor die Eintragung des Beschlusses als nach § 10 des Handelsgesetzbuches bekannt gemacht gilt, ist, wenn sie sich binnen sechs Monaten nach der Bekanntmachung zu diesem Zweck melden, Sicherheit zu leisten, soweit sie nicht Befriedigung verlangen können. Dieses Recht steht den Gläubigern nicht zu, die im Fall des Insolvenzverfahrens ein Recht auf vorzugsweise Befriedigung aus der Deckungsmasse haben, die nach gesetzlicher Vorschrift zu ihrem Schutz errichtet und staatlich überwacht ist."
    },
    {
      "date": "2026-01-23",
      "id": "143343",
      "original_text": "Einreichung neuer Dokumente\nNordrhein-Westfalen Amtsgericht Duisburg HRB 12863\nWBO Wirtschaftsbetriebe Oberhausen GmbH – Oberhausen",
      "type": "Einreichung neuer Dokumente",
      "state": "Nordrhein-Westfalen",
      "amtsgericht": "Amtsgericht Duisburg",
      "registernummer": "HRB 12863",
      "registerart": "HRB",
      "company_name": "WBO Wirtschaftsbetriebe Oberhausen GmbH",
      "company_seat": "Oberhausen",
      "details": "23.01.2026 (Bekanntmachungsdatum)\n\nNordrhein-Westfalen Amtsgericht Duisburg HRB 12863\nEinreichung neuer Dokumente\n\nWBO Wirtschaftsbetriebe Oberhausen GmbH\nGesellschaft mit beschränkter Haftung\nOberhausen\n\nDem Registergericht ist eine Liste der Mitglieder des Aufsichtsrates eingereicht worden."
    },
    {
      "date": "2026-01-23",
      "id": "143344",
      "original_text": "Registerbekanntmachung nach dem Umwandlungsgesetz\nNordrhein-Westfalen Amtsgericht Bielefeld VR 2383\nMieterbund Ostwestfalen-Lippe und Umgebung e. V. – Bielefeld",
      "type": "Registerbekanntmachung nach dem Umwandlungsgesetz",
      "state": "Nordrhein-Westfalen",
      "amtsgericht": "Amtsgericht Bielefeld",
      "registernummer": "VR 2383",
      "registerart": "VR",
      "company_name": "Mieterbund Ostwestfalen-Lippe und Umgebung e. V.",
      "company_seat": "Bielefeld",
      "details": "23.01.2026 (Bekanntmachungsdatum)\n\nNordrhein-Westfalen Amtsgericht Bielefeld VR 2383\nRegisterbekanntmachung nach dem Umwandlungsgesetz 23.01.2026 (Eintragungsdatum)\n\nMieterbund Ostwestfalen-Lippe und Umgebung e. V.\neingetragener Verein\nBielefeld\n\nDen Gläubigern der an der Verschmelzung beteiligten Rechtsträger ist, wenn sie binnen sechs Monaten nach dem Tag, an dem die Eintragung der Verschmelzung in das Register des Sitzes desjenigen Rechtsträgers, dessen Gläubiger sie sind, nach § 19 Absatz 3 UmwG als bekanntgemacht gilt, ihren Anspruch nach Grund und Höhe schriftlich anmelden, Sicherheit zu leisten, soweit sie nicht Befriedigung verlangen können. Dieses Recht steht den Gläubigern jedoch nur zu, wenn sie glaubhaft machen, dass durch die Verschmelzung die Erfüllung ihrer Forderung gefährdet wird."
    },
    {
      "date": "2026-01-23",
      "id": "143345",
      "original_text": "Löschungsankündigung\nNordrhein-Westfalen Amtsgericht Dortmund HRB 28595\nAktiv-Bodyfood UG haftungsbeschränkt – Dortmund",
      "type": "Löschungsankündigung",
      "state": "Nordrhein-Westfalen",
      "amtsgericht": "Amtsgericht Dortmund",
      "registernummer": "HRB 28595",
      "registerart": "HRB",
      "company_name": "Aktiv-Bodyfood UG haftungsbeschränkt",
      "company_seat": "Dortmund",
      "details": "23.01.2026 (Bekanntmachungsdatum)\n\nNordrhein-Westfalen Amtsgericht Dortmund HRB 28595\nLöschungsankündigung\n\nAktiv-Bodyfood UG haftungsbeschränkt\nGesellschaft mit beschränkter Haftung\nDortmund\n\nDas Registergericht beabsichtigt die Gesellschaft von Amts wegen nach § 394 FamFG zu löschen. Die Frist zur Erhebung eines Widerspruchs ist auf zwei Monate festgesetzt."
    },
    {
      "date": "2026-01-23",
      "id": "143346",
      "original_text": "Löschungsankündigung\nNordrhein-Westfalen Amtsgericht Aachen HRB 24393\nGB-proEquip UG (haftungsbeschränkt) – Aachen",
      "type": "Löschungsankündigung",
      "state": "Nordrhein-Westfalen",
      "amtsgericht": "Amtsgericht Aachen",
      "registernummer": "HRB 24393",
      "registerart": "HRB",
      "company_name": "GB-proEquip UG (haftungsbeschränkt)",
      "company_seat": "Aachen",
      "details": "23.01.2026 (Bekanntmachungsdatum)\n\nNordrhein-Westfalen Amtsgericht Aachen HRB 24393\nLöschungsankündigung\n\nGB-proEquip UG (haftungsbeschränkt)\nGesellschaft mit beschränkter Haftung\nAachen\n\nDas Registergericht beabsichtigt, von Amts wegen die Gesellschaft wegen Vermögenslosigkeit nach § 394 FamFG zu löschen.\n\nZur Geltendmachung des Widerspruchs gegen die beabsichtigte Löschung wird hiermit eine Frist von einem Monat ab Veröffentlichung dieser Ankündigung bestimmt.\n\nRechtsbehelfsbelehrung:\n\nGegen diese Verfügung kann Widerspruch eingelegt werden. Zum Widerspruch ist jeder berechtigt, der an der Unterlassung der Löschung ein berechtigtes Interesse hat.\n\nDer Widerspruch ist bei dem Amtsgericht Aachen, Adalbertsteinweg 92, 52070 Aachen schriftlich in deutscher Sprache oder zur Niederschrift der Geschäftsstelle einzulegen. Der Widerspruch kann auch zur Niederschrift der Geschäftsstelle eines jeden Amtsgerichtes abgegeben werden.\n\nDer Widerspruch muss spätestens innerhalb der gesetzten Frist nach der Bekanntgabe der Verfügung bei dem Amtsgericht Aachen eingegangen sein. Dies gilt auch dann, wenn der Widerspruch zur Niederschrift der Geschäftsstelle eines anderen Amtsgerichtes abgegeben wurde. Die Frist beginnt mit der Bekanntgabe der Verfügung durch Veröffentlichung. Fällt das Ende der Frist auf einen Sonntag, einen allgemeinen Feiertag oder Sonnabend, so endet die Frist mit Ablauf des nächsten Werktages.\n\nDer Widerspruch muss die Bezeichnung der angefochtenen Verfügung sowie die Erklärung enthalten, dass Widerspruch gegen diese Verfügung eingelegt wird. Er ist zu unterzeichnen und soll begründet werden.\n\nDie Einlegung ist auch durch Übertragung eines elektronischen Dokuments an die elektronische Poststelle des Gerichts möglich. Das elektronische Dokument muss für die Bearbeitung durch das Gericht geeignet und mit einer qualifizierten elektronischen Signatur der verantwortenden Person versehen sein oder von der verantwortenden Person signiert und auf einem sicheren Übermittlungsweg gemäß § 130 a ZPO nach näherer Maßgabe der Verordnung über die technischen Rahmenbedingungen des elektronischen Rechtsverkehrs und über das besondere elektronische Behördenpostfach (BGBl. I, S. 3803) eingereicht werden. Weitere Informationen erhalten Sie auf der Internetseite www.justiz.de."
    },
    {
      "date": "2026-01-23",
      "id": "143347",
      "original_text": "Sonstige Registerbekanntmachung\nNordrhein-Westfalen Amtsgericht Siegburg HRB 10061\nStadtwerke Sankt Augustin GmbH – Sankt Augustin",
      "type": "Sonstige Registerbekanntmachung",
      "state": "Nordrhein-Westfalen",
      "amtsgericht": "Amtsgericht Siegburg",
      "registernummer": "HRB 10061",
      "registerart": "HRB",
      "company_name": "Stadtwerke Sankt Augustin GmbH",
      "company_seat": "Sankt Augustin",
      "details": "23.01.2026 (Bekanntmachungsdatum)\n\nNordrhein-Westfalen Amtsgericht Siegburg HRB 10061\nSonstige Registerbekanntmachung 15.12.2025 (Eintragungsdatum)\n\nStadtwerke Sankt Augustin GmbH\nGesellschaft mit beschränkter Haftung\nSankt Augustin\n\nDem Registergericht ist eine Liste der Mitglieder des Aufsichtsrates eingereicht worden."
    },
    {
      "date": "2026-01-23",
      "id": "143348",
      "original_text": "Einreichung neuer Dokumente\nNordrhein-Westfalen Amtsgericht Essen HRB 31538\nWestenergie AG – Essen",
      "type": "Einreichung neuer Dokumente",
      "state": "Nordrhein-Westfalen",
      "amtsgericht": "Amtsgericht Essen",
      "registernummer": "HRB 31538",
      "registerart": "HRB",
      "company_name": "Westenergie AG",
      "company_seat": "Essen",
      "details": "23.01.2026 (Bekanntmachungsdatum)\n\nNordrhein-Westfalen Amtsgericht Essen HRB 31538\nEinreichung neuer Dokumente 23.01.2026 (Eintragungsdatum)\n\nWestenergie AG\nAktiengesellschaft\nEssen\n\nAls nicht eingetragen wird bekannt gegeben:\nDem Registergericht ist eine neue Liste der Mitglieder des Aufsichtsrates eingereicht worden."
    },
    {
      "date": "2026-01-23",
      "id": "143349",
      "original_text": "Einreichung neuer Dokumente\nNordrhein-Westfalen Amtsgericht Bielefeld HRB 7144\nDMG MORI AKTIENGESELLSCHAFT – Bielefeld",
      "type": "Einreichung neuer Dokumente",
      "state": "Nordrhein-Westfalen",
      "amtsgericht": "Amtsgericht Bielefeld",
      "registernummer": "HRB 7144",
      "registerart": "HRB",
      "company_name": "DMG MORI AKTIENGESELLSCHAFT",
      "company_seat": "Bielefeld",
      "details": "23.01.2026 (Bekanntmachungsdatum)\n\nNordrhein-Westfalen Amtsgericht Bielefeld HRB 7144\nEinreichung neuer Dokumente 23.01.2026 (Eintragungsdatum)\n\nDMG MORI AKTIENGESELLSCHAFT\nAktiengesellschaft\nBielefeld\n\nDem Registergericht ist eine neue Liste der Mitglieder des Aufsichtsrates eingereicht worden."
    },
    {
      "date": "2026-01-23",
      "id": "143350",
      "original_text": "Löschungsankündigung\nNordrhein-Westfalen Amtsgericht Hamm HRB 8917\nC.H. City-House Grundstücksentwicklungsgesellschaft mbH – Kamen",
      "type": "Löschungsankündigung",
      "state": "Nordrhein-Westfalen",
      "amtsgericht": "Amtsgericht Hamm",
      "registernummer": "HRB 8917",
      "registerart": "HRB",
      "company_name": "C.H. City-House Grundstücksentwicklungsgesellschaft mbH",
      "company_seat": "Kamen",
      "details": "23.01.2026 (Bekanntmachungsdatum)\n\nNordrhein-Westfalen Amtsgericht Hamm HRB 8917\nLöschungsankündigung\n\nC.H. City-House Grundstücksentwicklungsgesellschaft mbH\nGesellschaft mit beschränkter Haftung\nKamen\n\nDas Registergericht beabsichtigt die Gesellschaft von Amts wegen nach § 394 FamFG zu löschen. Die Frist zur Erhebung eines Widerspruchs ist auf drei Monate festgesetzt."
    },
    {
      "date": "2026-01-23",
      "id": "143351",
      "original_text": "Sonstige Registerbekanntmachung\nNordrhein-Westfalen Amtsgericht Hamm HRB 43\nHammer Gemeinnützige Baugesellschaft mit beschränkter Haftung – Hamm",
      "type": "Sonstige Registerbekanntmachung",
      "state": "Nordrhein-Westfalen",
      "amtsgericht": "Amtsgericht Hamm",
      "registernummer": "HRB 43",
      "registerart": "HRB",
      "company_name": "Hammer Gemeinnützige Baugesellschaft mit beschränkter Haftung",
      "company_seat": "Hamm",
      "details": "23.01.2026 (Bekanntmachungsdatum)\n\nNordrhein-Westfalen Amtsgericht Hamm HRB 43\nSonstige Registerbekanntmachung\n\nHammer Gemeinnützige Baugesellschaft mit beschränkter Haftung\nGesellschaft mit beschränkter Haftung\nHamm\n\nDem Registergericht ist eine neue Liste der Mitglieder des Aufsichtsrates eingereicht worden."
    },
    {
      "date": "2026-01-23",
      "id": "143352",
      "original_text": "Einreichung neuer Dokumente\nNordrhein-Westfalen Amtsgericht Siegburg HRB 13275\nEmitec Technologies GmbH – Lohmar",
      "type": "Einreichung neuer Dokumente",
      "state": "Nordrhein-Westfalen",
      "amtsgericht": "Amtsgericht Siegburg",
      "registernummer": "HRB 13275",
      "registerart": "HRB",
      "company_name": "Emitec Technologies GmbH",
      "company_seat": "Lohmar",
      "details": "23.01.2026 (Bekanntmachungsdatum)\n\nNordrhein-Westfalen Amtsgericht Siegburg HRB 13275\nEinreichung neuer Dokumente\n\nEmitec Technologies GmbH\nGesellschaft mit beschränkter Haftung\nLohmar\n\nDem Registergericht ist eine Liste der Mitglieder des Aufsichtsrates eingereicht worden."
    },
    {
      "date": "2026-01-23",
      "id": "143353",
      "original_text": "Einreichung neuer Dokumente\nNordrhein-Westfalen Amtsgericht Neuss HRB 18496\nYareto GmbH – Neuss",
      "type": "Einreichung neuer Dokumente",
      "state": "Nordrhein-Westfalen",
      "amtsgericht": "Amtsgericht Neuss",
      "registernummer": "HRB 18496",
      "registerart": "HRB",
      "company_name": "Yareto GmbH",
      "company_seat": "Neuss",
      "details": "23.01.2026 (Bekanntmachungsdatum)\n\nNordrhein-Westfalen Amtsgericht Neuss HRB 18496\nEinreichung neuer Dokumente 23.01.2026 (Eintragungsdatum)\n\nYareto GmbH\nGesellschaft mit beschränkter Haftung\nNeuss\n\nDem Registergericht ist eine neue Liste der Mitglieder des Aufsichtsrates eingereicht worden."
    },
    {
      "date": "2026-01-23",
      "id": "143354",
      "original_text": "Löschungsankündigung\nNordrhein-Westfalen Amtsgericht Düren HRB 9309\nEriyadhuhu UG (haftungsbeschränkt) – Düren",
      "type": "Löschungsankündigung",
      "state": "Nordrhein-Westfalen",
      "amtsgericht": "Amtsgericht Düren",
      "registernummer": "HRB 9309",
      "registerart": "HRB",
      "company_name": "Eriyadhuhu UG (haftungsbeschränkt)",
      "company_seat": "Düren",
      "details": "23.01.2026 (Bekanntmachungsdatum)\n\nNordrhein-Westfalen Amtsgericht Düren HRB 9309\nLöschungsankündigung\n\nEriyadhuhu UG (haftungsbeschränkt)\nGesellschaft mit beschränkter Haftung\nDüren\n\nDas Registergericht beabsichtigt die Gesellschaft von Amts wegen nach § 394 FamFG zu löschen. Die Frist zur Erhebung eines Widerspruchs ist auf drei Monate festgesetzt."
    },
    {
      "date": "2026-01-23",
      "id": "143355",
      "original_text": "Registerbekanntmachung nach dem Umwandlungsgesetz\nNordrhein-Westfalen Amtsgericht Wuppertal HRA 26115\nAlfa & Omega Intensivpflege Yvonne Szewczyk e.K. – Wuppertal",
      "type": "Registerbekanntmachung nach dem Umwandlungsgesetz",
      "state": "Nordrhein-Westfalen",
      "amtsgericht": "Amtsgericht Wuppertal",
      "registernummer": "HRA 26115",
      "registerart": "HRA",
      "company_name": "Alfa & Omega Intensivpflege Yvonne Szewczyk e.K.",
      "company_seat": "Wuppertal",
      "details": "23.01.2026 (Bekanntmachungsdatum)\n\nNordrhein-Westfalen Amtsgericht Wuppertal HRA 26115\nRegisterbekanntmachung nach dem Umwandlungsgesetz 23.01.2026 (Eintragungsdatum)\n\nAlfa & Omega Intensivpflege Yvonne Szewczyk e.K.\nEinzelkaufmann / Einzelkauffrau\nWuppertal\n\nDen Gläubigern der an der Ausgliederung beteiligten Rechtsträger ist, wenn sie binnen sechs Monaten nach dem Tag, an dem die Eintragung der Ausgliederung in das Register des Sitzes derjenigen Rechtsträger deren Gläubiger sie sind, nach § 19 Absatz 3 UmwG als bekanntgemacht gilt, ihren Anspruch nach Grund und Höhe schriftlich anmelden, Sicherheit zu leisten, soweit sie nicht Befriedigung verlangen können. Dieses Recht steht den Gläubigern jedoch nur zu, wenn sie glaubhaft machen, dass durch die Ausgliederung die Erfüllung ihrer Forderung gefährdet wird."
    },
    {
      "date": "2026-01-23",
      "id": "143356",
      "original_text": "Löschungsankündigung\nNordrhein-Westfalen Amtsgericht Siegburg HRB 14948\nPleiser Camp GmbH – Königswinter",
      "type": "Löschungsankündigung",
      "state": "Nordrhein-Westfalen",
      "amtsgericht": "Amtsgericht Siegburg",
      "registernummer": "HRB 14948",
      "registerart": "HRB",
      "company_name": "Pleiser Camp GmbH",
      "company_seat": "Königswinter",
      "details": "23.01.2026 (Bekanntmachungsdatum)\n\nNordrhein-Westfalen Amtsgericht Siegburg HRB 14948\nLöschungsankündigung\n\nPleiser Camp GmbH\nGesellschaft mit beschränkter Haftung\nKönigswinter\n\nDas Registergericht hat glaubhafte Kenntnis erlangt, dass die Gesellschaft vermögenslos geworden ist, da\nein Insolvenzverfahren durchgeführt und nach § 200 InsO aufgehoben wurde.\n\nEs ist daher beabsichtigt, die Gesellschaft nach § 394 FamFG im Handelsregister wegen Vermögenslosigkeit zu löschen.\nEinwände gegen die Löschung sind durch Widerspruch binnen einer Frist von 3 Monaten geltend zu machen, andernfalls die Löschung erfolgen wird.\n\nEinzulegen ist der Widerspruch bei dem Amtsgericht Siegburg, Neue Poststraße 16, 53721 Siegburg, und zwar entweder schriftlich in deutscher Sprache oder mündlich zur Niederschrift der Geschäftsstelle. Der Widerspruch kann auch zur Niederschrift der Geschäftsstelle eines jeden Amtsgerichts abgegeben werden. Der Widerspruch ist binnen der in der Verfügung bestimmten Frist einzulegen. Die Frist ist nur gewahrt, wenn der Widerspruch rechtzeitig bei dem Amtsgericht Siegburg eingeht, auch wenn der Widerspruch zur Niederschrift der Geschäftsstelle eines anderen Amtsgerichts abgegeben wurde. Die Frist beginnt jeweils mit der schriftlichen Bekanntgabe der Verfügung an die Beteiligten. Kann die schriftliche Bekanntgabe an einen Beteiligten nicht bewirkt werden, beginnt die Frist spätestens mit Ablauf von fünf Monaten nach Erlass der Verfügung. Die Bekanntgabe ist entweder durch Zustellung oder am dritten Tage nach Aufgabe zur Post bewirkt. Sofern die Löschung noch nicht erfolgt ist, kann der Widerspruch auch noch nach Ablauf der Frist eingelegt werden. Fällt das Ende der Frist auf einen Sonnabend, einen Sonntag oder einen allgemeinen Feiertag, endet die Frist mit Ablauf des nächsten Werktages. Der Widerspruch ist zu unterzeichnen. Eine Begründung des Widerspruchs ist nicht vorgeschrieben."
    },
    {
      "date": "2026-01-23",
      "id": "143357",
      "original_text": "Löschungsankündigung\nNordrhein-Westfalen Amtsgericht Düsseldorf HRB 57710\nBCBG MAX AZRIA GROUP GERMANY GmbH – Düsseldorf",
      "type": "Löschungsankündigung",
      "state": "Nordrhein-Westfalen",
      "amtsgericht": "Amtsgericht Düsseldorf",
      "registernummer": "HRB 57710",
      "registerart": "HRB",
      "company_name": "BCBG MAX AZRIA GROUP GERMANY GmbH",
      "company_seat": "Düsseldorf",
      "details": "23.01.2026 (Bekanntmachungsdatum)\n\nNordrhein-Westfalen Amtsgericht Düsseldorf HRB 57710\nLöschungsankündigung\n\nBCBG MAX AZRIA GROUP GERMANY GmbH\nGesellschaft mit beschränkter Haftung\nDüsseldorf\n\nDas Registergericht beabsichtigt die Gesellschaft von Amts wegen nach § 394 Abs. 1 FamFG zu löschen. Die Frist zur Erhebung eines Widerspruchs ist auf 3 Wochen festgesetzt.\n\nRechtsbehelfsbelehrung:\nDas Widerspruchsrecht steht jedem zu, der an der Unterlassung der Löschung ein berechtigtes Interesse hat. Der Widerspruch ist bei dem Amtsgericht Düsseldorf -Registergericht-, Werdener Straße 1, 40227 Düsseldorf schriftlich in deutscher Sprache oder zur Niederschrift der Geschäftsstelle einzulegen. Der Widerspruch kann auch zur Niederschrift der Geschäftsstelle eines jeden Amtsgerichtes abgegeben werden. Die Einlegung ist auch durch Übertragung eines elektronischen Dokuments an die elektronische Poststelle des Gerichts möglich. Das elektronische Dokument muss für die Bearbeitung durch das Gericht geeignet und mit einer qualifizierten elektronischen Signatur der verantwortenden Person versehen sein oder von der verantwortenden Person signiert und auf einem sicheren Übermittlungsweg gemäß § 130a ZPO nach näherer Maßgabe der Verordnung über die technischen Rahmenbedingungen des elektronischen Rechtsverkehrs und über das besondere elektronische Behördenpostfach (BGBl. I, S.3803) eingereicht werden. Weitere Informationen erhalten Sie auf der Internetseite www.justiz.de.\nDer Widerspruch muss spätestens innerhalb der gesetzten Frist nach dem Datum der Bekanntmachung der Löschungsankündigung bei dem Amtsgericht - Registergericht - Düsseldorf eingegangen sein.  Dies gilt auch dann, wenn der Widerspruch zur Niederschrift der Geschäftsstelle eines anderen Amtsgerichtes abgegeben wurde. Die Frist beginnt mit dem Tage der Bekanntmachung der Löschungsankündigung in dem für die Bekanntmachung der Eintragungen in das Handelsregister bestimmten elektronischen Informations- und Kommunikationssystem nach § 10 des Handelsgesetzbuches. Fällt das Ende der Frist auf einen Sonntag, einen allgemeinen Feiertag oder Sonnabend, so endet die Frist mit Ablauf des nächsten Werktages.\nDer Widerspruch muss die Bezeichnung der angefochtenen Löschungsankündigung sowie die Erklärung enthalten, dass Widerspruch gegen diese Löschungsankündigung eingelegt wird. Er ist zu unterzeichnen und soll begründet werden."
    },
    {
      "date": "2026-01-23",
      "id": "143358",
      "original_text": "Registerbekanntmachung nach dem Umwandlungsgesetz\nNordrhein-Westfalen Amtsgericht Bochum HRB 22920\nLiKu Bau GmbH – Bochum",
      "type": "Registerbekanntmachung nach dem Umwandlungsgesetz",
      "state": "Nordrhein-Westfalen",
      "amtsgericht": "Amtsgericht Bochum",
      "registernummer": "HRB 22920",
      "registerart": "HRB",
      "company_name": "LiKu Bau GmbH",
      "company_seat": "Bochum",
      "details": "23.01.2026 (Bekanntmachungsdatum)\n\nNordrhein-Westfalen Amtsgericht Bochum HRB 22920\nRegisterbekanntmachung nach dem Umwandlungsgesetz 21.01.2026 (Eintragungsdatum)\n\nLiKu Bau GmbH\nGesellschaft mit beschränkter Haftung\nBochum\n\nDen Gläubigern der an der Ausgliederung beteiligten Rechtsträger ist, wenn sie binnen sechs Monaten nach dem Tag, an dem die Eintragung der Ausgliederung in das Register des Sitzes desjenigen Rechtsträgers, dessen Gläubiger sie sind, nach § 19 Absatz 3 UmwG als bekanntgemacht gilt, ihren Anspruch nach Grund und Höhe schriftlich anmelden, Sicherheit zu leisten, soweit sie nicht Befriedigung verlangen können. Dieses Recht steht den Gläubigern jedoch nur zu, wenn sie glaubhaft machen, dass durch die Ausgliederung die Erfüllung ihrer Forderung gefährdet wird."
    },
    {
      "date": "2026-01-23",
      "id": "143359",
      "original_text": "Löschungsankündigung\nThüringen Amtsgericht Jena HRB 400556\nASSMANN GmbH – Eisenach",
      "type": "Löschungsankündigung",
      "state": "Thüringen",
      "amtsgericht": "Amtsgericht Jena",
      "registernummer": "HRB 400556",
      "registerart": "HRB",
      "company_name": "ASSMANN GmbH",
      "company_seat": "Eisenach",
      "details": "23.01.2026 (Bekanntmachungsdatum)\n\nThüringen Amtsgericht Jena HRB 400556\nLöschungsankündigung\n\nASSMANN GmbH\nGesellschaft mit beschränkter Haftung\nEisenach\n\nDas Registergericht beabsichtigt, die im Handelsregister eingetragene Gesellschaft wegen Vermögenslosigkeit nach § 394 FamFG von Amts wegen zu löschen. Die Frist zur Erhebung eines Widerspruchs gegen die beabsichtigte Löschung wird auf 6 Wochen festgesetzt."
    },
    {
      "date": "2026-01-23",
      "id": "143360",
      "original_text": "Löschungsankündigung\nThüringen Amtsgericht Jena HRB 303343\nDRK Rettungsdienst Hildburghausen gemeinnützige Gesellschaft mbH – Hildburghausen",
      "type": "Löschungsankündigung",
      "state": "Thüringen",
      "amtsgericht": "Amtsgericht Jena",
      "registernummer": "HRB 303343",
      "registerart": "HRB",
      "company_name": "DRK Rettungsdienst Hildburghausen gemeinnützige Gesellschaft mbH",
      "company_seat": "Hildburghausen",
      "details": "23.01.2026 (Bekanntmachungsdatum)\n\nThüringen Amtsgericht Jena HRB 303343\nLöschungsankündigung\n\nDRK Rettungsdienst Hildburghausen gemeinnützige Gesellschaft mbH\nGesellschaft mit beschränkter Haftung\nHildburghausen\n\nDas Registergericht beabsichtigt, die im Handelsregister eingetragene Gesellschaft wegen Vermögenslosigkeit nach § 394 FamFG von Amts wegen zu löschen. Die Frist zur Erhebung eines Widerspruchs gegen die beabsichtigte Löschung wird auf 6 Wochen festgesetzt."
    },
    {
      "date": "2026-01-23",
      "id": "143361",
      "original_text": "Sonstige Registerbekanntmachung\nThüringen Amtsgericht Jena HRB 511591\nFunkwerk Systems GmbH – Kölleda",
      "type": "Sonstige Registerbekanntmachung",
      "state": "Thüringen",
      "amtsgericht": "Amtsgericht Jena",
      "registernummer": "HRB 511591",
      "registerart": "HRB",
      "company_name": "Funkwerk Systems GmbH",
      "company_seat": "Kölleda",
      "details": "23.01.2026 (Bekanntmachungsdatum)\n\nThüringen Amtsgericht Jena HRB 511591\nSonstige Registerbekanntmachung 23.01.2026 (Eintragungsdatum)\n\nFunkwerk Systems GmbH\nGesellschaft mit beschränkter Haftung\nKölleda\n\nNicht eingetragen: Den Gläubigern der Gesellschaft, deren Forderungen begründet worden sind, bevor die Eintragung der Beendigung des Vertrages in das Handelsregister nach § 10 des Handelsgesetzbuches als bekanntgemacht gilt, hat der andere Vertragsteil Sicherheit zu leisten, wenn sie sich binnen sechs Monaten nach der Bekanntmachung der Eintragung zu diesem Zweck bei ihm melden."
    },
    {
      "date": "2026-01-23",
      "id": "143362",
      "original_text": "Einreichung neuer Dokumente\nHessen Amtsgericht Wetzlar HRB 2426\nVerkehrsgesellschaft Lahn-Dill-Weil mbH – Wetzlar",
      "type": "Einreichung neuer Dokumente",
      "state": "Hessen",
      "amtsgericht": "Amtsgericht Wetzlar",
      "registernummer": "HRB 2426",
      "registerart": "HRB",
      "company_name": "Verkehrsgesellschaft Lahn-Dill-Weil mbH",
      "company_seat": "Wetzlar",
      "details": "23.01.2026 (Bekanntmachungsdatum)\n\nHessen Amtsgericht Wetzlar HRB 2426\nEinreichung neuer Dokumente\n\nVerkehrsgesellschaft Lahn-Dill-Weil mbH\nGesellschaft mit beschränkter Haftung\nWetzlar\n\nDurch eine Änderung in den Personen der Aufsichtsratsmitglieder ist eine Liste der Mitglieder des Aufsichtsrates zum Handelsregister eingereicht worden."
    },
    {
      "date": "2026-01-23",
      "id": "143363",
      "original_text": "Einreichung neuer Dokumente\nHessen Amtsgericht Frankfurt am Main HRB 102930\nCofinpro AG – Frankfurt am Main",
      "type": "Einreichung neuer Dokumente",
      "state": "Hessen",
      "amtsgericht": "Amtsgericht Frankfurt am Main",
      "registernummer": "HRB 102930",
      "registerart": "HRB",
      "company_name": "Cofinpro AG",
      "company_seat": "Frankfurt am Main",
      "details": "23.01.2026 (Bekanntmachungsdatum)\n\nHessen Amtsgericht Frankfurt am Main HRB 102930\nEinreichung neuer Dokumente 23.01.2026 (Eintragungsdatum)\n\nCofinpro AG\nAktiengesellschaft\nFrankfurt am Main\n\nDurch eine Änderung in den Personen der Aufsichtsratsmitglieder ist eine Liste der Mitglieder des Aufsichtsrates zum Handelsregister eingereicht worden."
    },
    {
      "date": "2026-01-23",
      "id": "143364",
      "original_text": "Löschungsankündigung\nHessen Amtsgericht Offenbach am Main HRB 43956\nOKSolar GmbH – Langen (Hessen)",
      "type": "Löschungsankündigung",
      "state": "Hessen",
      "amtsgericht": "Amtsgericht Offenbach am Main",
      "registernummer": "HRB 43956",
      "registerart": "HRB",
      "company_name": "OKSolar GmbH",
      "company_seat": "Langen (Hessen)",
      "details": "23.01.2026 (Bekanntmachungsdatum)\n\nHessen Amtsgericht Offenbach am Main HRB 43956\nLöschungsankündigung\n\nOKSolar GmbH\nGesellschaft mit beschränkter Haftung\nLangen (Hessen)\n\nDas Registergericht beabsichtigt, den Geschäftsführer Herrn Olaf Killmann nach erfolgter Gewerbeuntersagung nach § 35 Gewerbeordnung durch das Regierungspräsidium Darmstadt gemäß § 395 FamFG von Amts wegen im Handelsregister zu löschen.\nWer an der Unterlassung der Löschung ein berechtigtes Interesse hat, kann innerhalb eines Monats ab Bekanntmachung Widerspruch beim Amtsgericht Offenbach am Main einlegen."
    },
    {
      "date": "2026-01-23",
      "id": "143365",
      "original_text": "Einreichung neuer Dokumente\nHessen Amtsgericht Frankfurt am Main HRB 54406\nB & S Beteiligungs Aktiengesellschaft – Frankfurt am Main",
      "type": "Einreichung neuer Dokumente",
      "state": "Hessen",
      "amtsgericht": "Amtsgericht Frankfurt am Main",
      "registernummer": "HRB 54406",
      "registerart": "HRB",
      "company_name": "B & S Beteiligungs Aktiengesellschaft",
      "company_seat": "Frankfurt am Main",
      "details": "23.01.2026 (Bekanntmachungsdatum)\n\nHessen Amtsgericht Frankfurt am Main HRB 54406\nEinreichung neuer Dokumente 15.01.2026 (Eintragungsdatum)\n\nB & S Beteiligungs Aktiengesellschaft\nAktiengesellschaft\nFrankfurt am Main\n\nDurch eine Änderung in den Personen der Aufsichtsratsmitglieder ist eine Liste der Mitglieder des Aufsichtsrates zum Handelsregister eingereicht worden."
    },
    {
      "date": "2026-01-23",
      "id": "143366",
      "original_text": "Sonstige Registerbekanntmachung\nHessen Amtsgericht Wetzlar VR 4183\nFreie Christliche Gemeinde - Immanuel e.V. – Dillenburg",
      "type": "Sonstige Registerbekanntmachung",
      "state": "Hessen",
      "amtsgericht": "Amtsgericht Wetzlar",
      "registernummer": "VR 4183",
      "registerart": "VR",
      "company_name": "Freie Christliche Gemeinde - Immanuel e.V.",
      "company_seat": "Dillenburg",
      "details": "23.01.2026 (Bekanntmachungsdatum)\n\nHessen Amtsgericht Wetzlar VR 4183\nSonstige Registerbekanntmachung 23.01.2026 (Eintragungsdatum)\n\nFreie Christliche Gemeinde - Immanuel e.V.\neingetragener Verein\nDillenburg\n\nDer Verein ist aufgelöst."
    },
    {
      "date": "2026-01-23",
      "id": "143367",
      "original_text": "Sonstige Registerbekanntmachung\nHessen Amtsgericht Frankfurt am Main HRB 118874\nAltech Advanced Materials AG – Frankfurt am Main",
      "type": "Sonstige Registerbekanntmachung",
      "state": "Hessen",
      "amtsgericht": "Amtsgericht Frankfurt am Main",
      "registernummer": "HRB 118874",
      "registerart": "HRB",
      "company_name": "Altech Advanced Materials AG",
      "company_seat": "Frankfurt am Main",
      "details": "23.01.2026 (Bekanntmachungsdatum)\n\nHessen Amtsgericht Frankfurt am Main HRB 118874\nSonstige Registerbekanntmachung 23.01.2026 (Eintragungsdatum)\n\nAltech Advanced Materials AG\nAktiengesellschaft\nFrankfurt am Main\n\nDie Gesellschaft hat Gläubigern, deren Forderungen vor dieser Bekanntmachung begründet worden sind, Sicherheit zu leisten, soweit sie nicht Befriedigung verlangen können, wenn sie sich binnen sechs Monaten nach dieser Bekanntmachung zu diesem Zweck melden."
    }
  ]
}