{
  "date": "2026-01-31",
  "date_of_scrape": "2026-02-01T04:46:15.990Z",
  "tool_version": "0.2.0",
  "number_of_announcements": 23,
  "announcements": [
    {
      "date": "2026-01-31",
      "id": "144006",
      "original_text": "Registerbekanntmachung nach dem Umwandlungsgesetz\nBayern Amtsgericht München HRA 120941\niQ Energy Sunpower 7 GmbH & Co. KG – München",
      "type": "Registerbekanntmachung nach dem Umwandlungsgesetz",
      "state": "Bayern",
      "amtsgericht": "Amtsgericht München",
      "registernummer": "HRA 120941",
      "registerart": "HRA",
      "company_name": "iQ Energy Sunpower 7 GmbH & Co. KG",
      "company_seat": "München",
      "details": "31.01.2026 (Bekanntmachungsdatum)\n\nBayern Amtsgericht München HRA 120941\nRegisterbekanntmachung nach dem Umwandlungsgesetz 30.01.2026 (Eintragungsdatum)\n\niQ Energy Sunpower 7 GmbH & Co. KG\nKommanditgesellschaft\nMünchen\n\nDen Gläubigern der an der Verschmelzung beteiligten Rechtsträger ist, wenn sie binnen sechs Monaten nach dem Tag, an dem die Eintragung der Verschmelzung in das Register des Sitzes desjenigen Rechtsträgers, dessen Gläubiger sie sind, nach § 19 Abs. 3 UmwG als bekannt gemacht gilt, ihren Anspruch nach Grund und Höhe in Textform anmelden, Sicherheit zu leisten, soweit sie nicht Befriedigung verlangen können. Dieses Recht steht den Gläubigern jedoch nur zu, wenn sie glaubhaft machen, dass durch die Verschmelzung die Erfüllung ihrer Forderung gefährdet wird."
    },
    {
      "date": "2026-01-31",
      "id": "144007",
      "original_text": "Löschungsankündigung\nBayern Amtsgericht München HRB 263297\nair2live UG (haftungsbeschränkt) – München",
      "type": "Löschungsankündigung",
      "state": "Bayern",
      "amtsgericht": "Amtsgericht München",
      "registernummer": "HRB 263297",
      "registerart": "HRB",
      "company_name": "air2live UG (haftungsbeschränkt)",
      "company_seat": "München",
      "details": "31.01.2026 (Bekanntmachungsdatum)\n\nBayern Amtsgericht München HRB 263297\nLöschungsankündigung\n\nair2live UG (haftungsbeschränkt)\nGesellschaft mit beschränkter Haftung\nMünchen\n\nDas Registergericht beabsichtigt, die im Handelsregister eingetragene Gesellschaft wegen Vermögenslosigkeit von Amts wegen nach § 394 FamFG zu löschen. Die Frist zur Erhebung eines Widerspruchs ist auf drei Monate festgesetzt."
    },
    {
      "date": "2026-01-31",
      "id": "144008",
      "original_text": "Registerbekanntmachung nach dem Umwandlungsgesetz\nBayern Amtsgericht München HRB 138118\nPlinthos GmbH – München",
      "type": "Registerbekanntmachung nach dem Umwandlungsgesetz",
      "state": "Bayern",
      "amtsgericht": "Amtsgericht München",
      "registernummer": "HRB 138118",
      "registerart": "HRB",
      "company_name": "Plinthos GmbH",
      "company_seat": "München",
      "details": "31.01.2026 (Bekanntmachungsdatum)\n\nBayern Amtsgericht München HRB 138118\nRegisterbekanntmachung nach dem Umwandlungsgesetz 30.01.2026 (Eintragungsdatum)\n\nPlinthos GmbH\nGesellschaft mit beschränkter Haftung\nMünchen\n\nDen Gläubigern der an der Verschmelzung beteiligten Rechtsträger ist, wenn sie binnen sechs Monaten nach dem Tag, an dem die Eintragung der Verschmelzung in das Register des Sitzes desjenigen Rechtsträgers, dessen Gläubiger sie sind, nach § 19 Abs. 3 UmwG als bekannt gemacht gilt, ihren Anspruch nach Grund und Höhe in Textform anmelden, Sicherheit zu leisten, soweit sie nicht Befriedigung verlangen können. Dieses Recht steht den Gläubigern jedoch nur zu, wenn sie glaubhaft machen, dass durch die Verschmelzung die Erfüllung ihrer Forderung gefährdet wird."
    },
    {
      "date": "2026-01-31",
      "id": "144009",
      "original_text": "Registerbekanntmachung nach dem Umwandlungsgesetz\nBayern Amtsgericht München HRA 120939\niQ Energy Sunpower 8 GmbH & Co. KG – München",
      "type": "Registerbekanntmachung nach dem Umwandlungsgesetz",
      "state": "Bayern",
      "amtsgericht": "Amtsgericht München",
      "registernummer": "HRA 120939",
      "registerart": "HRA",
      "company_name": "iQ Energy Sunpower 8 GmbH & Co. KG",
      "company_seat": "München",
      "details": "31.01.2026 (Bekanntmachungsdatum)\n\nBayern Amtsgericht München HRA 120939\nRegisterbekanntmachung nach dem Umwandlungsgesetz 30.01.2026 (Eintragungsdatum)\n\niQ Energy Sunpower 8 GmbH & Co. KG\nKommanditgesellschaft\nMünchen\n\nDen Gläubigern der an der Verschmelzung beteiligten Rechtsträger ist, wenn sie binnen sechs Monaten nach dem Tag, an dem die Eintragung der Verschmelzung in das Register des Sitzes desjenigen Rechtsträgers, dessen Gläubiger sie sind, nach § 19 Abs. 3 UmwG als bekannt gemacht gilt, ihren Anspruch nach Grund und Höhe in Textform anmelden, Sicherheit zu leisten, soweit sie nicht Befriedigung verlangen können. Dieses Recht steht den Gläubigern jedoch nur zu, wenn sie glaubhaft machen, dass durch die Verschmelzung die Erfüllung ihrer Forderung gefährdet wird."
    },
    {
      "date": "2026-01-31",
      "id": "144010",
      "original_text": "Löschungsankündigung\nBayern Amtsgericht München HRB 265938\nRT Shops and Concept UG (haftungsbeschränkt) – München",
      "type": "Löschungsankündigung",
      "state": "Bayern",
      "amtsgericht": "Amtsgericht München",
      "registernummer": "HRB 265938",
      "registerart": "HRB",
      "company_name": "RT Shops and Concept UG (haftungsbeschränkt)",
      "company_seat": "München",
      "details": "31.01.2026 (Bekanntmachungsdatum)\n\nBayern Amtsgericht München HRB 265938\nLöschungsankündigung 30.01.2026 (Eintragungsdatum)\n\nRT Shops and Concept UG (haftungsbeschränkt)\nGesellschaft mit beschränkter Haftung\nMünchen\n\nDas Registergericht beabsichtigt, die im Handelsregister eingetragene Gesellschaft wegen Vermögenslosigkeit von Amts wegen nach § 394 FamFG zu löschen. Die Frist zur Erhebung eines Widerspruchs ist auf drei Monate festgesetzt."
    },
    {
      "date": "2026-01-31",
      "id": "144011",
      "original_text": "Löschungsankündigung\nBayern Amtsgericht Traunstein HRA 12686\nAQUA Design UG (haftungsbeschränkt) & Co.KG – Freilassing",
      "type": "Löschungsankündigung",
      "state": "Bayern",
      "amtsgericht": "Amtsgericht Traunstein",
      "registernummer": "HRA 12686",
      "registerart": "HRA",
      "company_name": "AQUA Design UG (haftungsbeschränkt) & Co.KG",
      "company_seat": "Freilassing",
      "details": "31.01.2026 (Bekanntmachungsdatum)\n\nBayern Amtsgericht Traunstein HRA 12686\nLöschungsankündigung\n\nAQUA Design UG (haftungsbeschränkt) & Co.KG\nKommanditgesellschaft\nFreilassing\n\nDas Registergericht beabsichtigt, die im Handelsregister eingetragene Gesellschaft wegen Vermögenslosigkeit von Amts wegen nach § 394 FamFG zu löschen. Die Frist zur Erhebung eines Widerspruchs ist auf drei Monate festgesetzt."
    },
    {
      "date": "2026-01-31",
      "id": "144012",
      "original_text": "Löschungsankündigung\nBayern Amtsgericht München HRB 82409\nInMagazin Verlags GmbH – München",
      "type": "Löschungsankündigung",
      "state": "Bayern",
      "amtsgericht": "Amtsgericht München",
      "registernummer": "HRB 82409",
      "registerart": "HRB",
      "company_name": "InMagazin Verlags GmbH",
      "company_seat": "München",
      "details": "31.01.2026 (Bekanntmachungsdatum)\n\nBayern Amtsgericht München HRB 82409\nLöschungsankündigung 30.01.2026 (Eintragungsdatum)\n\nInMagazin Verlags GmbH\nGesellschaft mit beschränkter Haftung\nMünchen\n\nDas Registergericht beabsichtigt, die im Handelsregister eingetragene Gesellschaft wegen Vermögenslosigkeit von Amts wegen nach § 394 FamFG zu löschen. Die Frist zur Erhebung eines Widerspruchs ist auf drei Monate festgesetzt."
    },
    {
      "date": "2026-01-31",
      "id": "144013",
      "original_text": "Registerbekanntmachung nach dem Umwandlungsgesetz\nBayern Amtsgericht Landshut HRB 15083\nSAM Innovate International GmbH – Schalkham",
      "type": "Registerbekanntmachung nach dem Umwandlungsgesetz",
      "state": "Bayern",
      "amtsgericht": "Amtsgericht Landshut",
      "registernummer": "HRB 15083",
      "registerart": "HRB",
      "company_name": "SAM Innovate International GmbH",
      "company_seat": "Schalkham",
      "details": "31.01.2026 (Bekanntmachungsdatum)\n\nBayern Amtsgericht Landshut HRB 15083\nRegisterbekanntmachung nach dem Umwandlungsgesetz 30.01.2026 (Eintragungsdatum)\n\nSAM Innovate International GmbH\nGesellschaft mit beschränkter Haftung\nSchalkham\n\nDen Gläubigern der an der Verschmelzung beteiligten Rechtsträger ist, wenn sie binnen sechs Monaten nach dem Tag, an dem die Eintragung der Verschmelzung in das Register des Sitzes desjenigen Rechtsträgers, dessen Gläubiger sie sind, nach § 19 Abs. 3 UmwG als bekannt gemacht gilt, ihren Anspruch nach Grund und Höhe in Textform anmelden, Sicherheit zu leisten, soweit sie nicht Befriedigung verlangen können. Dieses Recht steht den Gläubigern jedoch nur zu, wenn sie glaubhaft machen, dass durch die Verschmelzung die Erfüllung ihrer Forderung gefährdet wird."
    },
    {
      "date": "2026-01-31",
      "id": "144014",
      "original_text": "Einreichung neuer Dokumente\nBayern Amtsgericht Bayreuth HRB 7387\ndc AG – Kulmbach",
      "type": "Einreichung neuer Dokumente",
      "state": "Bayern",
      "amtsgericht": "Amtsgericht Bayreuth",
      "registernummer": "HRB 7387",
      "registerart": "HRB",
      "company_name": "dc AG",
      "company_seat": "Kulmbach",
      "details": "31.01.2026 (Bekanntmachungsdatum)\n\nBayern Amtsgericht Bayreuth HRB 7387\nEinreichung neuer Dokumente 30.01.2026 (Eintragungsdatum)\n\ndc AG\nAktiengesellschaft\nKulmbach\n\nDem Amtsgericht Bayreuth -Registergericht- ist eine Liste der Mitglieder des Aufsichtsrats eingereicht worden, § 106 AktG."
    },
    {
      "date": "2026-01-31",
      "id": "144015",
      "original_text": "Sonstige Registerbekanntmachung\nBayern Amtsgericht München HRB 188307\nleon-nanodrugs GmbH – München",
      "type": "Sonstige Registerbekanntmachung",
      "state": "Bayern",
      "amtsgericht": "Amtsgericht München",
      "registernummer": "HRB 188307",
      "registerart": "HRB",
      "company_name": "leon-nanodrugs GmbH",
      "company_seat": "München",
      "details": "31.01.2026 (Bekanntmachungsdatum)\n\nBayern Amtsgericht München HRB 188307\nSonstige Registerbekanntmachung\n\nleon-nanodrugs GmbH\nGesellschaft mit beschränkter Haftung\nMünchen\n\nDem Amtsgericht München -Registergericht- ist eine Liste der Mitglieder des Aufsichtsrats eingereicht worden, § 52 Abs. 3 S. 2 GmbHG."
    },
    {
      "date": "2026-01-31",
      "id": "144016",
      "original_text": "Registerbekanntmachung nach dem Umwandlungsgesetz\nBayern Amtsgericht Landshut HRB 14322\nSAM Innovate UG (haftungsbeschränkt) – Vilsbiburg",
      "type": "Registerbekanntmachung nach dem Umwandlungsgesetz",
      "state": "Bayern",
      "amtsgericht": "Amtsgericht Landshut",
      "registernummer": "HRB 14322",
      "registerart": "HRB",
      "company_name": "SAM Innovate UG (haftungsbeschränkt)",
      "company_seat": "Vilsbiburg",
      "details": "31.01.2026 (Bekanntmachungsdatum)\n\nBayern Amtsgericht Landshut HRB 14322\nRegisterbekanntmachung nach dem Umwandlungsgesetz 30.01.2026 (Eintragungsdatum)\n\nSAM Innovate UG (haftungsbeschränkt)\nGesellschaft mit beschränkter Haftung\nVilsbiburg\n\nDen Gläubigern der an der Verschmelzung beteiligten Rechtsträger ist, wenn sie binnen sechs Monaten nach dem Tag, an dem die Eintragung der Verschmelzung in das Register des Sitzes desjenigen Rechtsträgers, dessen Gläubiger sie sind, nach § 19 Abs. 3 UmwG als bekannt gemacht gilt, ihren Anspruch nach Grund und Höhe in Textform anmelden, Sicherheit zu leisten, soweit sie nicht Befriedigung verlangen können. Dieses Recht steht den Gläubigern jedoch nur zu, wenn sie glaubhaft machen, dass durch die Verschmelzung die Erfüllung ihrer Forderung gefährdet wird."
    },
    {
      "date": "2026-01-31",
      "id": "144017",
      "original_text": "Sonstige Registerbekanntmachung\nBayern Amtsgericht München HRB 171682\nF.A.M.E. Artist Recordings GmbH – Pullach",
      "type": "Sonstige Registerbekanntmachung",
      "state": "Bayern",
      "amtsgericht": "Amtsgericht München",
      "registernummer": "HRB 171682",
      "registerart": "HRB",
      "company_name": "F.A.M.E. Artist Recordings GmbH",
      "company_seat": "Pullach",
      "details": "31.01.2026 (Bekanntmachungsdatum)\n\nBayern Amtsgericht München HRB 171682\nSonstige Registerbekanntmachung 30.01.2026 (Eintragungsdatum)\n\nF.A.M.E. Artist Recordings GmbH\nGesellschaft mit beschränkter Haftung\nPullach\n\nDen Gläubigern der Gesellschaft, deren Forderungen begründet worden sind, bevor die Eintragung der Beendigung des Beherrschungs- und Gewinnabführungsvertrages in das Handelsregister nach § 10 des Handelsgesetzbuches als bekanntgemacht gilt, hat der andere Vertragsteil Sicherheit zu leisten, wenn sie sich binnen sechs Monaten nach der Bekanntmachung der Eintragung zu diesem Zweck bei ihm melden."
    },
    {
      "date": "2026-01-31",
      "id": "144018",
      "original_text": "Einreichung neuer Dokumente\nBayern Amtsgericht München HRB 254410\nNagarro SE – München",
      "type": "Einreichung neuer Dokumente",
      "state": "Bayern",
      "amtsgericht": "Amtsgericht München",
      "registernummer": "HRB 254410",
      "registerart": "HRB",
      "company_name": "Nagarro SE",
      "company_seat": "München",
      "details": "31.01.2026 (Bekanntmachungsdatum)\n\nBayern Amtsgericht München HRB 254410\nEinreichung neuer Dokumente\n\nNagarro SE\nEuropäische Aktiengesellschaft (SE)\nMünchen\n\nDem Amtsgericht München -Registergericht- ist eine Liste der Mitglieder des Aufsichtsrats eingereicht worden, Art. 9 Abs. 1 Buchst. c (ii) SE-VO i.V.m. § 106 AktG."
    },
    {
      "date": "2026-01-31",
      "id": "144019",
      "original_text": "Einreichung neuer Dokumente\nBayern Amtsgericht München HRB 223333\nImmunic AG – Planegg",
      "type": "Einreichung neuer Dokumente",
      "state": "Bayern",
      "amtsgericht": "Amtsgericht München",
      "registernummer": "HRB 223333",
      "registerart": "HRB",
      "company_name": "Immunic AG",
      "company_seat": "Planegg",
      "details": "31.01.2026 (Bekanntmachungsdatum)\n\nBayern Amtsgericht München HRB 223333\nEinreichung neuer Dokumente\n\nImmunic AG\nAktiengesellschaft\nPlanegg\n\nDem Amtsgericht München -Registergericht- ist eine Liste der Mitglieder des Aufsichtsrats eingereicht worden, § 106 AktG."
    },
    {
      "date": "2026-01-31",
      "id": "144020",
      "original_text": "Sonstige Registerbekanntmachung\nBayern Amtsgericht Würzburg HRB 8233\nStaub Unternehmensberatung AG – Partenstein",
      "type": "Sonstige Registerbekanntmachung",
      "state": "Bayern",
      "amtsgericht": "Amtsgericht Würzburg",
      "registernummer": "HRB 8233",
      "registerart": "HRB",
      "company_name": "Staub Unternehmensberatung AG",
      "company_seat": "Partenstein",
      "details": "31.01.2026 (Bekanntmachungsdatum)\n\nBayern Amtsgericht Würzburg HRB 8233\nSonstige Registerbekanntmachung 30.01.2026 (Eintragungsdatum)\n\nStaub Unternehmensberatung AG\nAktiengesellschaft\nPartenstein\n\nDen Gläubigern der Gesellschaft, deren Forderungen begründet worden sind, bevor die Eintragung der Beendigung des Teilgewinnabführungsvertrages in das Handelsregister nach § 10 des Handelsgesetzbuches als bekanntgemacht gilt, hat der andere Vertragsteil Sicherheit zu leisten, wenn sie sich binnen sechs Monaten nach der Bekanntmachung der Eintragung zu diesem Zweck bei ihm melden."
    },
    {
      "date": "2026-01-31",
      "id": "144021",
      "original_text": "Sonstige Registerbekanntmachung\nBayern Amtsgericht München HRB 60069\nBavaria Media GmbH – Grünwald",
      "type": "Sonstige Registerbekanntmachung",
      "state": "Bayern",
      "amtsgericht": "Amtsgericht München",
      "registernummer": "HRB 60069",
      "registerart": "HRB",
      "company_name": "Bavaria Media GmbH",
      "company_seat": "Grünwald",
      "details": "31.01.2026 (Bekanntmachungsdatum)\n\nBayern Amtsgericht München HRB 60069\nSonstige Registerbekanntmachung 30.01.2026 (Eintragungsdatum)\n\nBavaria Media GmbH\nGesellschaft mit beschränkter Haftung\nGrünwald\n\nDen Gläubigern der Gesellschaft, deren Forderungen begründet worden sind, bevor die Eintragung der Beendigung des Beherrschungs- und Gewinnabführungsvertrages in das Handelsregister nach § 10 des Handelsgesetzbuches als bekanntgemacht gilt, hat der andere Vertragsteil Sicherheit zu leisten, wenn sie sich binnen sechs Monaten nach der Bekanntmachung der Eintragung zu diesem Zweck bei ihm melden."
    },
    {
      "date": "2026-01-31",
      "id": "144022",
      "original_text": "Sonstige Registerbekanntmachung\nBayern Amtsgericht München HRB 279518\nOppmann Immobilien AG – München",
      "type": "Sonstige Registerbekanntmachung",
      "state": "Bayern",
      "amtsgericht": "Amtsgericht München",
      "registernummer": "HRB 279518",
      "registerart": "HRB",
      "company_name": "Oppmann Immobilien AG",
      "company_seat": "München",
      "details": "31.01.2026 (Bekanntmachungsdatum)\n\nBayern Amtsgericht München HRB 279518\nSonstige Registerbekanntmachung 30.01.2026 (Eintragungsdatum)\n\nOppmann Immobilien AG\nAktiengesellschaft\nMünchen\n\nDem #Re.Name ist eine Liste der Mitglieder des Aufsichtsrats eingereicht worden, § 106 AktG."
    },
    {
      "date": "2026-01-31",
      "id": "144023",
      "original_text": "Registerbekanntmachung nach dem Umwandlungsgesetz\nBayern Amtsgericht Nürnberg HRB 19393\nManu Dextra GmbH Gesellschaft für Engineering & Consulting – Nürnberg",
      "type": "Registerbekanntmachung nach dem Umwandlungsgesetz",
      "state": "Bayern",
      "amtsgericht": "Amtsgericht Nürnberg",
      "registernummer": "HRB 19393",
      "registerart": "HRB",
      "company_name": "Manu Dextra GmbH Gesellschaft für Engineering & Consulting",
      "company_seat": "Nürnberg",
      "details": "31.01.2026 (Bekanntmachungsdatum)\n\nBayern Amtsgericht Nürnberg HRB 19393\nRegisterbekanntmachung nach dem Umwandlungsgesetz 30.01.2026 (Eintragungsdatum)\n\nManu Dextra GmbH Gesellschaft für Engineering & Consulting\nGesellschaft mit beschränkter Haftung\nNürnberg\n\nDen Gläubigern der an der Verschmelzung beteiligten Rechtsträger ist, wenn sie binnen sechs Monaten nach dem Tag, an dem die Eintragung der Verschmelzung in das Register des Sitzes desjenigen Rechtsträgers, dessen Gläubiger sie sind, nach § 19 Abs. 3 UmwG als bekannt gemacht gilt, ihren Anspruch nach Grund und Höhe in Textform anmelden, Sicherheit zu leisten, soweit sie nicht Befriedigung verlangen können. Dieses Recht steht den Gläubigern jedoch nur zu, wenn sie glaubhaft machen, dass durch die Verschmelzung die Erfüllung ihrer Forderung gefährdet wird."
    },
    {
      "date": "2026-01-31",
      "id": "144024",
      "original_text": "Registerbekanntmachung nach dem Umwandlungsgesetz\nBayern Amtsgericht Würzburg HRB 7243\nPeter Lutz GmbH – Volkach",
      "type": "Registerbekanntmachung nach dem Umwandlungsgesetz",
      "state": "Bayern",
      "amtsgericht": "Amtsgericht Würzburg",
      "registernummer": "HRB 7243",
      "registerart": "HRB",
      "company_name": "Peter Lutz GmbH",
      "company_seat": "Volkach",
      "details": "31.01.2026 (Bekanntmachungsdatum)\n\nBayern Amtsgericht Würzburg HRB 7243\nRegisterbekanntmachung nach dem Umwandlungsgesetz 30.01.2026 (Eintragungsdatum)\n\nPeter Lutz GmbH\nGesellschaft mit beschränkter Haftung\nVolkach\n\nDen Gläubigern des formwechselnden Rechtsträgers ist, wenn sie binnen sechs Monaten nach dem Tag, an dem die Eintragung des Formwechsels nach § 201 UmwG als bekannt gemacht gilt, ihren Anspruch nach Grund und Höhe in Textform anmelden, Sicherheit zu leisten, soweit sie nicht Befriedigung verlangen können. Dieses Recht steht den Gläubigern jedoch nur zu, wenn sie glaubhaft machen, dass durch den Formwechsel die Erfüllung ihrer Forderung gefährdet wird."
    },
    {
      "date": "2026-01-31",
      "id": "144025",
      "original_text": "Registerbekanntmachung nach dem Umwandlungsgesetz\nHamburg Amtsgericht Hamburg HRB 90031\nPure Pleasure Music GmbH – Hamburg",
      "type": "Registerbekanntmachung nach dem Umwandlungsgesetz",
      "state": "Hamburg",
      "amtsgericht": "Amtsgericht Hamburg",
      "registernummer": "HRB 90031",
      "registerart": "HRB",
      "company_name": "Pure Pleasure Music GmbH",
      "company_seat": "Hamburg",
      "details": "31.01.2026 (Bekanntmachungsdatum)\n\nHamburg Amtsgericht Hamburg HRB 90031\nRegisterbekanntmachung nach dem Umwandlungsgesetz 31.01.2026 (Eintragungsdatum)\n\nPure Pleasure Music GmbH\nGesellschaft mit beschränkter Haftung\nHamburg\n\nAls nicht eingetragen wird bekannt gemacht:\nDen Gläubigern der an der Verschmelzung beteiligten Gesellschaften ist, wenn sie binnen sechs Monaten nach dem Tag, an dem die Eintragung der Verschmelzung in das Register des Sitzes desjenigen Rechtsträgers, dessen Gläubiger sie sind, nach § 19 Absatz 3 UmwG als bekannt gemacht gilt, ihren Anspruch nach Grund und Höhe schriftlich anmelden, Sicherheit zu leisten, soweit sie nicht Befriedigung verlangen können. Dieses Recht steht den Gläubigern jedoch nur zu, wenn sie glaubhaft machen, dass durch die Verschmelzung die Erfüllung ihrer Forderung gefährdet wird."
    },
    {
      "date": "2026-01-31",
      "id": "144026",
      "original_text": "Registerbekanntmachung nach dem Umwandlungsgesetz\nHamburg Amtsgericht Hamburg HRB 141403\nHerzklopfen Stiftung GmbH – Hamburg",
      "type": "Registerbekanntmachung nach dem Umwandlungsgesetz",
      "state": "Hamburg",
      "amtsgericht": "Amtsgericht Hamburg",
      "registernummer": "HRB 141403",
      "registerart": "HRB",
      "company_name": "Herzklopfen Stiftung GmbH",
      "company_seat": "Hamburg",
      "details": "31.01.2026 (Bekanntmachungsdatum)\n\nHamburg Amtsgericht Hamburg HRB 141403\nRegisterbekanntmachung nach dem Umwandlungsgesetz 31.01.2026 (Eintragungsdatum)\n\nHerzklopfen Stiftung GmbH\nGesellschaft mit beschränkter Haftung\nHamburg\n\nAls nicht eingetragen wird bekannt gemacht:\nDen Gläubigern der an der Verschmelzung beteiligten Gesellschaften ist, wenn sie binnen sechs Monaten nach dem Tag, an dem die Eintragung der Verschmelzung in das Register des Sitzes desjenigen Rechtsträgers, dessen Gläubiger sie sind, nach § 19 Absatz 3 UmwG als bekannt gemacht gilt, ihren Anspruch nach Grund und Höhe schriftlich anmelden, Sicherheit zu leisten, soweit sie nicht Befriedigung verlangen können. Dieses Recht steht den Gläubigern jedoch nur zu, wenn sie glaubhaft machen, dass durch die Verschmelzung die Erfüllung ihrer Forderung gefährdet wird."
    },
    {
      "date": "2026-01-31",
      "id": "144027",
      "original_text": "Registerbekanntmachung nach dem Umwandlungsgesetz\nHamburg Amtsgericht Hamburg HRB 182186\nYagcho GmbH – Hamburg",
      "type": "Registerbekanntmachung nach dem Umwandlungsgesetz",
      "state": "Hamburg",
      "amtsgericht": "Amtsgericht Hamburg",
      "registernummer": "HRB 182186",
      "registerart": "HRB",
      "company_name": "Yagcho GmbH",
      "company_seat": "Hamburg",
      "details": "31.01.2026 (Bekanntmachungsdatum)\n\nHamburg Amtsgericht Hamburg HRB 182186\nRegisterbekanntmachung nach dem Umwandlungsgesetz 31.01.2026 (Eintragungsdatum)\n\nYagcho GmbH\nGesellschaft mit beschränkter Haftung\nHamburg\n\nAls nicht eingetragen wird bekannt gemacht:\nDen Gläubigern der an der Ausgliederung beteiligten Gesellschaften ist, wenn sie binnen sechs Monaten nach dem Tag, an dem die Eintragung der Ausgliederung in das Register des Sitzes desjenigen Rechtsträgers, dessen Gläubiger sie sind, nach § 19 Absatz 3 UmwG als bekannt gemacht gilt, ihren Anspruch nach Grund und Höhe schriftlich anmelden, Sicherheit zu leisten, soweit sie nicht Befriedigung verlangen können. Dieses Recht steht den Gläubigern jedoch nur zu, wenn sie glaubhaft machen, dass durch die Ausgliederung die Erfüllung ihrer Forderung gefährdet wird."
    },
    {
      "date": "2026-01-31",
      "id": "144028",
      "original_text": "Registerbekanntmachung nach dem Umwandlungsgesetz\nHamburg Amtsgericht Hamburg HRA 132495\nYagcho e.K., Inh. Michel Wagner – Hamburg",
      "type": "Registerbekanntmachung nach dem Umwandlungsgesetz",
      "state": "Hamburg",
      "amtsgericht": "Amtsgericht Hamburg",
      "registernummer": "HRA 132495",
      "registerart": "HRA",
      "company_name": "Yagcho e.K., Inh. Michel Wagner",
      "company_seat": "Hamburg",
      "details": "31.01.2026 (Bekanntmachungsdatum)\n\nHamburg Amtsgericht Hamburg HRA 132495\nRegisterbekanntmachung nach dem Umwandlungsgesetz 31.01.2026 (Eintragungsdatum)\n\nYagcho e.K., Inh. Michel Wagner\nEinzelkaufmann\nHamburg\n\nAls nicht eingetragen wird bekannt gemacht:\nDen Gläubigern der an der Ausgliederung beteiligten Gesellschaften ist, wenn sie binnen sechs Monaten nach dem Tag, an dem die Eintragung der Ausgliederung in das Register des Sitzes desjenigen Rechtsträgers, dessen Gläubiger sie sind, nach § 19 Absatz 3 UmwG als bekannt gemacht gilt, ihren Anspruch nach Grund und Höhe schriftlich anmelden, Sicherheit zu leisten, soweit sie nicht Befriedigung verlangen können. Dieses Recht steht den Gläubigern jedoch nur zu, wenn sie glaubhaft machen, dass durch die Ausgliederung die Erfüllung ihrer Forderung gefährdet wird."
    }
  ]
}