{
  "date": "2026-01-12",
  "date_of_scrape": "2026-01-13T04:21:52.741Z",
  "tool_version": "0.2.0",
  "number_of_announcements": 107,
  "announcements": [
    {
      "date": "2026-01-12",
      "id": "142070",
      "original_text": "Löschungsankündigung\nBaden-Württemberg Amtsgericht Stuttgart HRB 782888\nNovomer Trading GmbH – Heilbronn",
      "type": "Löschungsankündigung",
      "state": "Baden-Württemberg",
      "amtsgericht": "Amtsgericht Stuttgart",
      "registernummer": "HRB 782888",
      "registerart": "HRB",
      "company_name": "Novomer Trading GmbH",
      "company_seat": "Heilbronn",
      "details": "12.01.2026 (Bekanntmachungsdatum)\n\nBaden-Württemberg Amtsgericht Stuttgart HRB 782888\nLöschungsankündigung\n\nNovomer Trading GmbH\nGesellschaft mit beschränkter Haftung\nHeilbronn\n\nDas Gericht beabsichtigt, die Gesellschaft wegen Vermögenslosigkeit im Handelsregister von Amts wegen nach § 394 FamFG zu löschen. Die Frist zur Geltendmachung eines Widerspruchs gegen die beabsichtigte Löschung ist auf zwei Monate ab Veröffentlichung bestimmt."
    },
    {
      "date": "2026-01-12",
      "id": "142071",
      "original_text": "Löschungsankündigung\nBaden-Württemberg Amtsgericht Stuttgart HRA 737675\n101 Stuttgart GmbH & Co. KG – Fellbach",
      "type": "Löschungsankündigung",
      "state": "Baden-Württemberg",
      "amtsgericht": "Amtsgericht Stuttgart",
      "registernummer": "HRA 737675",
      "registerart": "HRA",
      "company_name": "101 Stuttgart GmbH & Co. KG",
      "company_seat": "Fellbach",
      "details": "12.01.2026 (Bekanntmachungsdatum)\n\nBaden-Württemberg Amtsgericht Stuttgart HRA 737675\nLöschungsankündigung\n\n101 Stuttgart GmbH & Co. KG\nKommanditgesellschaft\nFellbach\n\nDas Gericht beabsichtigt, die Gesellschaft wegen Vermögenslosigkeit im Handelsregister von Amts wegen nach § 394 FamFG zu löschen. Die Frist zur Geltendmachung eines Widerspruchs gegen die beabsichtigte Löschung ist auf einen Monate ab Veröffentlichung bestimmt."
    },
    {
      "date": "2026-01-12",
      "id": "142072",
      "original_text": "Löschungsankündigung\nBaden-Württemberg Amtsgericht Stuttgart HRB 783863\nzuzz UG (haftungsbeschränkt) – Leinfelden-Echterdingen",
      "type": "Löschungsankündigung",
      "state": "Baden-Württemberg",
      "amtsgericht": "Amtsgericht Stuttgart",
      "registernummer": "HRB 783863",
      "registerart": "HRB",
      "company_name": "zuzz UG (haftungsbeschränkt)",
      "company_seat": "Leinfelden-Echterdingen",
      "details": "12.01.2026 (Bekanntmachungsdatum)\n\nBaden-Württemberg Amtsgericht Stuttgart HRB 783863\nLöschungsankündigung\n\nzuzz UG (haftungsbeschränkt)\nGesellschaft mit beschränkter Haftung\nLeinfelden-Echterdingen\n\nAls nicht eingetragen wird bekanntgemacht:\nDas Gericht beabsichtigt, die Gesellschaft wegen Vermögenslosigkeit im Handelsregister von Amts wegen nach § 394 FamFG zu löschen. Die Frist zur Geltendmachung eines Widerspruchs gegen die beabsichtigte Löschung ist auf zwei Monate ab Veröffentlichung bestimmt."
    },
    {
      "date": "2026-01-12",
      "id": "142073",
      "original_text": "Registerbekanntmachung nach dem Umwandlungsgesetz\nHamburg Amtsgericht Hamburg HRB 169664\nVerwaltung Grundstücksgesellschaft Behringstraße 121 GmbH – Hamburg",
      "type": "Registerbekanntmachung nach dem Umwandlungsgesetz",
      "state": "Hamburg",
      "amtsgericht": "Amtsgericht Hamburg",
      "registernummer": "HRB 169664",
      "registerart": "HRB",
      "company_name": "Verwaltung Grundstücksgesellschaft Behringstraße 121 GmbH",
      "company_seat": "Hamburg",
      "details": "12.01.2026 (Bekanntmachungsdatum)\n\nHamburg Amtsgericht Hamburg HRB 169664\nRegisterbekanntmachung nach dem Umwandlungsgesetz 12.01.2026 (Eintragungsdatum)\n\nVerwaltung Grundstücksgesellschaft Behringstraße 121 GmbH\nGesellschaft mit beschränkter Haftung\nHamburg\n\nAls nicht eingetragen wird bekannt gemacht:\nDen Gläubigern der an der Verschmelzung beteiligten Gesellschaften ist, wenn sie binnen sechs Monaten nach dem Tag, an dem die Eintragung der Verschmelzung in das Register des Sitzes desjenigen Rechtsträgers, dessen Gläubiger sie sind, nach § 19 Absatz 3 UmwG als bekannt gemacht gilt, ihren Anspruch nach Grund und Höhe schriftlich anmelden, Sicherheit zu leisten, soweit sie nicht Befriedigung verlangen können. Dieses Recht steht den Gläubigern jedoch nur zu, wenn sie glaubhaft machen, dass durch die Verschmelzung die Erfüllung ihrer Forderung gefährdet wird."
    },
    {
      "date": "2026-01-12",
      "id": "142074",
      "original_text": "Löschungsankündigung\nBaden-Württemberg Amtsgericht Stuttgart HRB 770125\nDein Heim PH GmbH – Stuttgart",
      "type": "Löschungsankündigung",
      "state": "Baden-Württemberg",
      "amtsgericht": "Amtsgericht Stuttgart",
      "registernummer": "HRB 770125",
      "registerart": "HRB",
      "company_name": "Dein Heim PH GmbH",
      "company_seat": "Stuttgart",
      "details": "12.01.2026 (Bekanntmachungsdatum)\n\nBaden-Württemberg Amtsgericht Stuttgart HRB 770125\nLöschungsankündigung\n\nDein Heim PH GmbH\nGesellschaft mit beschränkter Haftung\nStuttgart\n\nAls nicht eingetragen wird bekanntgemacht:\nDas Gericht beabsichtigt, die Gesellschaft wegen Vermögenslosigkeit im Handelsregister von Amts wegen nach § 394 FamFG zu löschen. Die Frist zur Geltendmachung eines Widerspruchs gegen die beabsichtigte Löschung ist auf zwei Monate ab Veröffentlichung bestimmt."
    },
    {
      "date": "2026-01-12",
      "id": "142075",
      "original_text": "Löschungsankündigung\nBaden-Württemberg Amtsgericht Mannheim HRB 5611\nForschungsgesellschaft für innovative anwenderorientierte Systemtechnologien für die Instandhaltung mbH – Mannheim",
      "type": "Löschungsankündigung",
      "state": "Baden-Württemberg",
      "amtsgericht": "Amtsgericht Mannheim",
      "registernummer": "HRB 5611",
      "registerart": "HRB",
      "company_name": "Forschungsgesellschaft für innovative anwenderorientierte Systemtechnologien für die Instandhaltung mbH",
      "company_seat": "Mannheim",
      "details": "12.01.2026 (Bekanntmachungsdatum)\n\nBaden-Württemberg Amtsgericht Mannheim HRB 5611\nLöschungsankündigung\n\nForschungsgesellschaft für innovative anwenderorientierte Systemtechnologien für die Instandhaltung mbH\nGesellschaft mit beschränkter Haftung\nMannheim\n\nAls nicht eingetragen wird bekanntgemacht:\nDas Gericht beabsichtigt, die Gesellschaft wegen Vermögenslosigkeit im Handelsregister von Amts wegen nach § 394 FamFG zu löschen. Die Frist zur Geltendmachung eines Widerspruchs gegen die beabsichtigte Löschung ist auf einen Monat ab Veröffentlichung bestimmt."
    },
    {
      "date": "2026-01-12",
      "id": "142076",
      "original_text": "Registerbekanntmachung nach dem Umwandlungsgesetz\nHamburg Amtsgericht Hamburg HRA 132920\nRico Oliveira - Synergy Bridge Consulting e.K. – Hamburg",
      "type": "Registerbekanntmachung nach dem Umwandlungsgesetz",
      "state": "Hamburg",
      "amtsgericht": "Amtsgericht Hamburg",
      "registernummer": "HRA 132920",
      "registerart": "HRA",
      "company_name": "Rico Oliveira - Synergy Bridge Consulting e.K.",
      "company_seat": "Hamburg",
      "details": "12.01.2026 (Bekanntmachungsdatum)\n\nHamburg Amtsgericht Hamburg HRA 132920\nRegisterbekanntmachung nach dem Umwandlungsgesetz 12.01.2026 (Eintragungsdatum)\n\nRico Oliveira - Synergy Bridge Consulting e.K.\nEinzelkaufmann\nHamburg\n\nAls nicht eingetragen wird bekannt gemacht:\nDen Gläubigern der an der Ausgliederung beteiligten Rechtsträger ist, wenn sie binnen sechs Monaten nach dem Tag, an dem die Eintragung der Ausgliederung in das Register des Sitzes desjenigen Rechtsträgers, dessen Gläubiger sie sind, nach § 19 Absatz 3 UmwG als bekannt gemacht gilt, ihren Anspruch nach Grund und Höhe schriftlich anmelden, Sicherheit zu leisten, soweit sie nicht Befriedigung verlangen können. Dieses Recht steht den Gläubigern jedoch nur zu, wenn sie glaubhaft machen, dass durch die Ausgliederung die Erfüllung ihrer Forderung gefährdet wird."
    },
    {
      "date": "2026-01-12",
      "id": "142077",
      "original_text": "Löschungsankündigung\nSchleswig-Holstein Amtsgericht Flensburg HRB 12361\nmeergrün GmbH – Harrislee",
      "type": "Löschungsankündigung",
      "state": "Schleswig-Holstein",
      "amtsgericht": "Amtsgericht Flensburg",
      "registernummer": "HRB 12361",
      "registerart": "HRB",
      "company_name": "meergrün GmbH",
      "company_seat": "Harrislee",
      "details": "12.01.2026 (Bekanntmachungsdatum)\n\nSchleswig-Holstein Amtsgericht Flensburg HRB 12361\nLöschungsankündigung\n\nmeergrün GmbH\nGesellschaft mit beschränkter Haftung\nHarrislee\n\nEs ist die Löschung der nachstehenden Gesellschaft wegen Vermögenslosigkeit gemäß § 394 FamFG von Amts wegen beabsichtigt.\nWiderspruchsfrist: 2 Monate"
    },
    {
      "date": "2026-01-12",
      "id": "142078",
      "original_text": "Löschungsankündigung\nBerlin Amtsgericht Berlin (Charlottenburg) HRB 251240\nE & M Dienstleistungs GmbH – Berlin",
      "type": "Löschungsankündigung",
      "state": "Berlin",
      "amtsgericht": "Amtsgericht Berlin (Charlottenburg)",
      "registernummer": "HRB 251240",
      "registerart": "HRB",
      "company_name": "E & M Dienstleistungs GmbH",
      "company_seat": "Berlin",
      "details": "12.01.2026 (Bekanntmachungsdatum)\n\nBerlin Amtsgericht Berlin (Charlottenburg) HRB 251240\nLöschungsankündigung\n\nE & M Dienstleistungs GmbH\nGesellschaft mit beschränkter Haftung\nBerlin\n\nBei der nachstehenden Gesellschaft wird das Amtslöschungsverfahren gemäß § 394 FamFG eingeleitet. Widerspruchsfrist: 6 Wochen."
    },
    {
      "date": "2026-01-12",
      "id": "142079",
      "original_text": "Registerbekanntmachung nach dem Umwandlungsgesetz\nBaden-Württemberg Amtsgericht Stuttgart HRB 803382\nAlfredo Alte Mühle GmbH – Reutlingen",
      "type": "Registerbekanntmachung nach dem Umwandlungsgesetz",
      "state": "Baden-Württemberg",
      "amtsgericht": "Amtsgericht Stuttgart",
      "registernummer": "HRB 803382",
      "registerart": "HRB",
      "company_name": "Alfredo Alte Mühle GmbH",
      "company_seat": "Reutlingen",
      "details": "12.01.2026 (Bekanntmachungsdatum)\n\nBaden-Württemberg Amtsgericht Stuttgart HRB 803382\nRegisterbekanntmachung nach dem Umwandlungsgesetz 12.01.2026 (Eintragungsdatum)\n\nAlfredo Alte Mühle GmbH\nGesellschaft mit beschränkter Haftung\nReutlingen\n\nAls nicht eingetragen wird bekanntgemacht:\nDen Gläubigern der an der Ausgliederung beteiligten Rechtsträger ist, wenn sie binnen sechs Monaten nach dem Tag, an dem die Eintragung der Ausgliederung in das Register des Sitzes desjenigen Rechtsträgers, dessen Gläubiger sie sind, nach § 19 Abs. 3 UmwG als bekanntgemacht gilt, ihren Anspruch nach Grund und Höhe schriftlich anmelden, Sicherheit zu leisten, soweit sie nicht Befriedigung verlangen können. Dieses Recht steht den Gläubigern jedoch nur zu, wenn sie glaubhaft machen, dass durch die Ausgliederung die Erfüllung ihrer Forderung gefährdet wird."
    },
    {
      "date": "2026-01-12",
      "id": "142080",
      "original_text": "Registerbekanntmachung nach dem Umwandlungsgesetz\nHamburg Amtsgericht Hamburg HRB 168891\nA. XI Holding GmbH – Hamburg",
      "type": "Registerbekanntmachung nach dem Umwandlungsgesetz",
      "state": "Hamburg",
      "amtsgericht": "Amtsgericht Hamburg",
      "registernummer": "HRB 168891",
      "registerart": "HRB",
      "company_name": "A. XI Holding GmbH",
      "company_seat": "Hamburg",
      "details": "12.01.2026 (Bekanntmachungsdatum)\n\nHamburg Amtsgericht Hamburg HRB 168891\nRegisterbekanntmachung nach dem Umwandlungsgesetz 12.01.2026 (Eintragungsdatum)\n\nA. XI Holding GmbH\nGesellschaft mit beschränkter Haftung\nHamburg\n\nAls nicht eingetragen wird bekannt gemacht:\nDen Gläubigern der an der Verschmelzung beteiligten Gesellschaften ist, wenn sie binnen sechs Monaten nach dem Tag, an dem die Eintragung der Verschmelzung in das Register des Sitzes desjenigen Rechtsträgers, dessen Gläubiger sie sind, nach § 19 Absatz 3 UmwG als bekannt gemacht gilt, ihren Anspruch nach Grund und Höhe schriftlich anmelden, Sicherheit zu leisten, soweit sie nicht Befriedigung verlangen können. Dieses Recht steht den Gläubigern jedoch nur zu, wenn sie glaubhaft machen, dass durch die Verschmelzung die Erfüllung ihrer Forderung gefährdet wird."
    },
    {
      "date": "2026-01-12",
      "id": "142081",
      "original_text": "Sonstige Registerbekanntmachung\nBaden-Württemberg Amtsgericht Ulm HRB 726246\nGesundheitszentren des Landkreises Göppingen GmbH – Göppingen",
      "type": "Sonstige Registerbekanntmachung",
      "state": "Baden-Württemberg",
      "amtsgericht": "Amtsgericht Ulm",
      "registernummer": "HRB 726246",
      "registerart": "HRB",
      "company_name": "Gesundheitszentren des Landkreises Göppingen GmbH",
      "company_seat": "Göppingen",
      "details": "12.01.2026 (Bekanntmachungsdatum)\n\nBaden-Württemberg Amtsgericht Ulm HRB 726246\nSonstige Registerbekanntmachung\n\nGesundheitszentren des Landkreises Göppingen GmbH\nGesellschaft mit beschränkter Haftung\nGöppingen\n\nDie Gesellschaft hat am 17.12.2025 die Liste über die Zusammensetzung des Aufsichtsrats zum Handelsregister eingereicht."
    },
    {
      "date": "2026-01-12",
      "id": "142082",
      "original_text": "Registerbekanntmachung nach dem Umwandlungsgesetz\nSchleswig-Holstein Amtsgericht Kiel HRA 12940\nMichael Röpcke e.K. – Klein Gladebrügge",
      "type": "Registerbekanntmachung nach dem Umwandlungsgesetz",
      "state": "Schleswig-Holstein",
      "amtsgericht": "Amtsgericht Kiel",
      "registernummer": "HRA 12940",
      "registerart": "HRA",
      "company_name": "Michael Röpcke e.K.",
      "company_seat": "Klein Gladebrügge",
      "details": "12.01.2026 (Bekanntmachungsdatum)\n\nSchleswig-Holstein Amtsgericht Kiel HRA 12940\nRegisterbekanntmachung nach dem Umwandlungsgesetz 09.01.2026 (Eintragungsdatum)\n\nMichael Röpcke e.K.\nEinzelkaufmann / Einzelkauffrau\nKlein Gladebrügge\n\nZu Eintragungsnummer 2 vom 09.01.2026 wird als nicht eingetragen veröffentlicht: Den Gläubigern der an der Spaltung beteiligten Rechtsträger ist, wenn sie binnen sechs Monaten nach dem Tag, an dem die Eintragung der Spaltung in das Register des Sitzes desjenigen Rechtsträgers, dessen Gläubiger sie sind,  bekannt gemacht worden ist, ihren Anspruch nach Grund und Höhe schriftlich anmelden, Sicherheit zu leisten, soweit sie nicht Befriedigung verlangen können. Dieses Recht steht den Gläubigern jedoch nur zu, wenn sie glaubhaft machen, dass durch die Spaltung die Erfüllung ihrer Forderung gefährdet wird."
    },
    {
      "date": "2026-01-12",
      "id": "142083",
      "original_text": "Einreichung neuer Dokumente\nBaden-Württemberg Amtsgericht Stuttgart HRB 748\nDeutscher Sparkassen Verlag GmbH – Stuttgart",
      "type": "Einreichung neuer Dokumente",
      "state": "Baden-Württemberg",
      "amtsgericht": "Amtsgericht Stuttgart",
      "registernummer": "HRB 748",
      "registerart": "HRB",
      "company_name": "Deutscher Sparkassen Verlag GmbH",
      "company_seat": "Stuttgart",
      "details": "12.01.2026 (Bekanntmachungsdatum)\n\nBaden-Württemberg Amtsgericht Stuttgart HRB 748\nEinreichung neuer Dokumente\n\nDeutscher Sparkassen Verlag GmbH\nGesellschaft mit beschränkter Haftung\nStuttgart\n\nDie Gesellschaft hat am 08.01.2026 die Liste über die Zusammensetzung des Aufsichtsrats zum Handelsregister eingereicht."
    },
    {
      "date": "2026-01-12",
      "id": "142084",
      "original_text": "Registerbekanntmachung nach dem Umwandlungsgesetz\nBaden-Württemberg Amtsgericht Stuttgart HRB 803386\nPLB Handels- und Service GmbH – Oberndorf am Neckar",
      "type": "Registerbekanntmachung nach dem Umwandlungsgesetz",
      "state": "Baden-Württemberg",
      "amtsgericht": "Amtsgericht Stuttgart",
      "registernummer": "HRB 803386",
      "registerart": "HRB",
      "company_name": "PLB Handels- und Service GmbH",
      "company_seat": "Oberndorf am Neckar",
      "details": "12.01.2026 (Bekanntmachungsdatum)\n\nBaden-Württemberg Amtsgericht Stuttgart HRB 803386\nRegisterbekanntmachung nach dem Umwandlungsgesetz 12.01.2026 (Eintragungsdatum)\n\nPLB Handels- und Service GmbH\nGesellschaft mit beschränkter Haftung\nOberndorf am Neckar\n\nAls nicht eingetragen wird bekanntgemacht:\nDen Gläubigern der an der Ausgliederung beteiligten Rechtsträger ist, wenn sie binnen sechs Monaten nach dem Tag, an dem die Eintragung der Ausgliederung in das Register des Sitzes desjenigen Rechtsträgers, dessen Gläubiger sie sind, nach § 19 Abs. 3 UmwG als bekanntgemacht gilt, ihren Anspruch nach Grund und Höhe schriftlich anmelden, Sicherheit zu leisten, soweit sie nicht Befriedigung verlangen können. Dieses Recht steht den Gläubigern jedoch nur zu, wenn sie glaubhaft machen, dass durch die Ausgliederung die Erfüllung ihrer Forderung gefährdet wird."
    },
    {
      "date": "2026-01-12",
      "id": "142085",
      "original_text": "Registerbekanntmachung nach dem Umwandlungsgesetz\nBaden-Württemberg Amtsgericht Stuttgart HRB 742450\nBGM Immobilien Service GmbH – Deckenpfronn",
      "type": "Registerbekanntmachung nach dem Umwandlungsgesetz",
      "state": "Baden-Württemberg",
      "amtsgericht": "Amtsgericht Stuttgart",
      "registernummer": "HRB 742450",
      "registerart": "HRB",
      "company_name": "BGM Immobilien Service GmbH",
      "company_seat": "Deckenpfronn",
      "details": "12.01.2026 (Bekanntmachungsdatum)\n\nBaden-Württemberg Amtsgericht Stuttgart HRB 742450\nRegisterbekanntmachung nach dem Umwandlungsgesetz 12.01.2026 (Eintragungsdatum)\n\nBGM Immobilien Service GmbH\nGesellschaft mit beschränkter Haftung\nDeckenpfronn\n\nDen Gläubigern dern an der grenzüberschreitenden Verschmelzung beteiligten übernehmenden Rechtsträger ist, wenn sie binnen sechs Monaten nach dem Tag, an dem die Eintragung der Verschmelzung in das Register des Sitzes desjenigen Rechtsträgers, dessen Gläubiger sie sind, nach § 19 Absatz 3 UmwG als bekanntgemacht gilt, ihren Anspruch nach Grund und Höhe schriftlich anmelden, Sicherheit zu leisten, soweit sie nicht Befriedigung verlangen können. Dieses Recht steht den Gläubigern jedoch nur zu, wenn sie glaubhaft machen, dass durch die Verschmelzung die Erfüllung ihrer Forderung gefährdet wird.  Den Gläubigern der an der Verschmelzung beteiligten Rechtsträger ist, wenn sie binnen sechs Monaten nach dem Tag, an dem die Eintragung der Verschmelzung in das Register des Sitzes desjenigen Rechtsträgers, dessen Gläubiger sie sind, nach § 19 Abs. 3 UmwG als bekanntgemacht gilt, ihren Anspruch nach Grund und Höhe schriftlich anmelden, Sicherheit zu leisten, soweit sie nicht Befriedigung verlangen können. Dieses Recht steht den Gläubigern jedoch nur zu, wenn sie glaubhaft machen, dass durch die Verschmelzung die Erfüllung ihrer Forderung gefährdet wird."
    },
    {
      "date": "2026-01-12",
      "id": "142086",
      "original_text": "Einreichung neuer Dokumente\nSchleswig-Holstein Amtsgericht Kiel HRB 21230\nStadtwerke SH Verwaltungsgesellschaft mbH – Rendsburg",
      "type": "Einreichung neuer Dokumente",
      "state": "Schleswig-Holstein",
      "amtsgericht": "Amtsgericht Kiel",
      "registernummer": "HRB 21230",
      "registerart": "HRB",
      "company_name": "Stadtwerke SH Verwaltungsgesellschaft mbH",
      "company_seat": "Rendsburg",
      "details": "12.01.2026 (Bekanntmachungsdatum)\n\nSchleswig-Holstein Amtsgericht Kiel HRB 21230\nEinreichung neuer Dokumente\n\nStadtwerke SH Verwaltungsgesellschaft mbH\nGesellschaft mit beschränkter Haftung\nRendsburg\n\nEine neue Liste der Aufsichtsratsmitglieder ist eingereicht worden."
    },
    {
      "date": "2026-01-12",
      "id": "142087",
      "original_text": "Registerbekanntmachung nach dem Umwandlungsgesetz\nBaden-Württemberg Amtsgericht Ulm HRB 701841\nBeutel Verwaltungs-GmbH – Schwäbisch Gmünd",
      "type": "Registerbekanntmachung nach dem Umwandlungsgesetz",
      "state": "Baden-Württemberg",
      "amtsgericht": "Amtsgericht Ulm",
      "registernummer": "HRB 701841",
      "registerart": "HRB",
      "company_name": "Beutel Verwaltungs-GmbH",
      "company_seat": "Schwäbisch Gmünd",
      "details": "12.01.2026 (Bekanntmachungsdatum)\n\nBaden-Württemberg Amtsgericht Ulm HRB 701841\nRegisterbekanntmachung nach dem Umwandlungsgesetz 12.01.2026 (Eintragungsdatum)\n\nBeutel Verwaltungs-GmbH\nGesellschaft mit beschränkter Haftung\nSchwäbisch Gmünd\n\nDen Gläubigern der an der Verschmelzung beteiligten Rechtsträger ist, wenn sie binnen sechs Monaten nach dem Tag, an dem die Eintragung der Verschmelzung in das Register des Sitzes desjenigen Rechtsträgers, dessen Gläubiger sie sind, nach § 19 Abs. 3 UmwG als bekanntgemacht gilt, ihren Anspruch nach Grund und Höhe schriftlich anmelden, Sicherheit zu leisten, soweit sie nicht Befriedigung verlangen können. Dieses Recht steht den Gläubigern jedoch nur zu, wenn sie glaubhaft machen, dass durch die Verschmelzung die Erfüllung ihrer Forderung gefährdet wird."
    },
    {
      "date": "2026-01-12",
      "id": "142088",
      "original_text": "Registerbekanntmachung nach dem Umwandlungsgesetz\nSachsen-Anhalt Amtsgericht Stendal HRB 18145\nTAS Contract-Logistics GmbH – Aschersleben",
      "type": "Registerbekanntmachung nach dem Umwandlungsgesetz",
      "state": "Sachsen-Anhalt",
      "amtsgericht": "Amtsgericht Stendal",
      "registernummer": "HRB 18145",
      "registerart": "HRB",
      "company_name": "TAS Contract-Logistics GmbH",
      "company_seat": "Aschersleben",
      "details": "12.01.2026 (Bekanntmachungsdatum)\n\nSachsen-Anhalt Amtsgericht Stendal HRB 18145\nRegisterbekanntmachung nach dem Umwandlungsgesetz 12.01.2026 (Eintragungsdatum)\n\nTAS Contract-Logistics GmbH\nGesellschaft mit beschränkter Haftung\nAschersleben\n\nNicht eingetragen:\nDen Gläubigern der an der Verschmelzung beteiligten Rechtsträger ist, wenn sie binnen sechs Monaten nach dem Tag, an dem die Eintragung der Verschmelzung nach § 19 Abs. 3 UmwG als bekanntgemacht gilt, ihren Anspruch nach Grund und Höhe schriftlich anmelden, Sicherheit zu leisten, soweit sie nicht Befriedigung verlangen können. Dieses Recht steht ihnen jedoch nur zu, wenn sie glaubhaft machen, dass durch die Verschmelzung die Erfüllung ihrer Forderung gefährdet wird."
    },
    {
      "date": "2026-01-12",
      "id": "142089",
      "original_text": "Registerbekanntmachung nach dem Umwandlungsgesetz\nSachsen-Anhalt Amtsgericht Stendal HRB 22294\nTrans - Aschersleben GmbH – Aschersleben",
      "type": "Registerbekanntmachung nach dem Umwandlungsgesetz",
      "state": "Sachsen-Anhalt",
      "amtsgericht": "Amtsgericht Stendal",
      "registernummer": "HRB 22294",
      "registerart": "HRB",
      "company_name": "Trans - Aschersleben GmbH",
      "company_seat": "Aschersleben",
      "details": "12.01.2026 (Bekanntmachungsdatum)\n\nSachsen-Anhalt Amtsgericht Stendal HRB 22294\nRegisterbekanntmachung nach dem Umwandlungsgesetz 12.01.2026 (Eintragungsdatum)\n\nTrans - Aschersleben GmbH\nGesellschaft mit beschränkter Haftung\nAschersleben\n\nNicht eingetragen:\nDen Gläubigern der an der Verschmelzung beteiligten Rechtsträger ist, wenn sie binnen sechs Monaten nach dem Tag, an dem die Eintragung der Verschmelzung nach § 19 Abs. 3 UmwG als bekanntgemacht gilt, ihren Anspruch nach Grund und Höhe schriftlich anmelden, Sicherheit zu leisten, soweit sie nicht Befriedigung verlangen können. Dieses Recht steht ihnen jedoch nur zu, wenn sie glaubhaft machen, dass durch die Verschmelzung die Erfüllung ihrer Forderung gefährdet wird."
    },
    {
      "date": "2026-01-12",
      "id": "142090",
      "original_text": "Einreichung neuer Dokumente\nBaden-Württemberg Amtsgericht Stuttgart HRB 401349\nMey Holding GmbH – Albstadt",
      "type": "Einreichung neuer Dokumente",
      "state": "Baden-Württemberg",
      "amtsgericht": "Amtsgericht Stuttgart",
      "registernummer": "HRB 401349",
      "registerart": "HRB",
      "company_name": "Mey Holding GmbH",
      "company_seat": "Albstadt",
      "details": "12.01.2026 (Bekanntmachungsdatum)\n\nBaden-Württemberg Amtsgericht Stuttgart HRB 401349\nEinreichung neuer Dokumente\n\nMey Holding GmbH\nGesellschaft mit beschränkter Haftung\nAlbstadt\n\nDie Gesellschaft hat am 09.01.2026 die Liste über die Zusammensetzung des Aufsichtsrats zum Handelsregister eingereicht."
    },
    {
      "date": "2026-01-12",
      "id": "142091",
      "original_text": "Löschungsankündigung\nSaarland Amtsgericht Saarbrücken HRB 105864\nMarys-Snaps UG (haftungsbeschränkt) – Saarbrücken",
      "type": "Löschungsankündigung",
      "state": "Saarland",
      "amtsgericht": "Amtsgericht Saarbrücken",
      "registernummer": "HRB 105864",
      "registerart": "HRB",
      "company_name": "Marys-Snaps UG (haftungsbeschränkt)",
      "company_seat": "Saarbrücken",
      "details": "12.01.2026 (Bekanntmachungsdatum)\n\nSaarland Amtsgericht Saarbrücken HRB 105864\nLöschungsankündigung 12.01.2026 (Eintragungsdatum)\n\nMarys-Snaps UG (haftungsbeschränkt)\nGesellschaft mit beschränkter Haftung\nSaarbrücken\n\nEs ist beabsichtigt, die Gesellschaft von Amts wegen gemäß § 394 FamFG wegen Vermögenslosigkeit zu löschen. Gegen die Löschung von Amts wegen ist das Rechtsmittel des Widerspruchs statthaft. Der Widerspruch ist binnen einer Frist von 3 Monaten beginnend mit dem Tag dieser Veröffentlichung durch Einreichen eines Widerspruchsschreibens -schriftlich oder zur Niederschrift der Geschäftsstelle- beim Amtsgericht Saarbrücken, -zentrales Handelsregister-, Mainzerstr.178, 66121 Saarbrücken einzulegen. Der Widerspruch muss die Bezeichnung der angefochtenen Löschungsankündigung enthalten sowie die Erklärung, dass Widerspruch eingelegt wird. Er ist vom Widerspruchsführer oder seinem Bevollmächtigten zu unterzeichnen."
    },
    {
      "date": "2026-01-12",
      "id": "142092",
      "original_text": "Einreichung neuer Dokumente\nBrandenburg Amtsgericht Potsdam HRB 30210\nsegardo AG – Potsdam",
      "type": "Einreichung neuer Dokumente",
      "state": "Brandenburg",
      "amtsgericht": "Amtsgericht Potsdam",
      "registernummer": "HRB 30210",
      "registerart": "HRB",
      "company_name": "segardo AG",
      "company_seat": "Potsdam",
      "details": "12.01.2026 (Bekanntmachungsdatum)\n\nBrandenburg Amtsgericht Potsdam HRB 30210\nEinreichung neuer Dokumente\n\nsegardo AG\nAktiengesellschaft\nPotsdam\n\nAls nicht eingetragen wird veröffentlicht: Eine Liste der Mitglieder des Aufsichtsrates wurde zum Handelsregister eingereicht."
    },
    {
      "date": "2026-01-12",
      "id": "142093",
      "original_text": "Einreichung neuer Dokumente\nSachsen-Anhalt Amtsgericht Stendal HRB 207208\nKME Mansfeld GmbH – Hettstedt",
      "type": "Einreichung neuer Dokumente",
      "state": "Sachsen-Anhalt",
      "amtsgericht": "Amtsgericht Stendal",
      "registernummer": "HRB 207208",
      "registerart": "HRB",
      "company_name": "KME Mansfeld GmbH",
      "company_seat": "Hettstedt",
      "details": "12.01.2026 (Bekanntmachungsdatum)\n\nSachsen-Anhalt Amtsgericht Stendal HRB 207208\nEinreichung neuer Dokumente\n\nKME Mansfeld GmbH\nGesellschaft mit beschränkter Haftung\nHettstedt\n\nEine Liste der Mitglieder des Aufsichtsrates wurde zum Handelsregister eingereicht."
    },
    {
      "date": "2026-01-12",
      "id": "142094",
      "original_text": "Einreichung neuer Dokumente\nBerlin Amtsgericht Berlin (Charlottenburg) HRB 170590\nplanen-bauen 4.0 - Gesellschaft zur Digitalisierung des Planens, Bauens und Betreibens mbH – Berlin",
      "type": "Einreichung neuer Dokumente",
      "state": "Berlin",
      "amtsgericht": "Amtsgericht Berlin (Charlottenburg)",
      "registernummer": "HRB 170590",
      "registerart": "HRB",
      "company_name": "planen-bauen 4.0 - Gesellschaft zur Digitalisierung des Planens, Bauens und Betreibens mbH",
      "company_seat": "Berlin",
      "details": "12.01.2026 (Bekanntmachungsdatum)\n\nBerlin Amtsgericht Berlin (Charlottenburg) HRB 170590\nEinreichung neuer Dokumente\n\nplanen-bauen 4.0 - Gesellschaft zur Digitalisierung des Planens, Bauens und Betreibens mbH\nGesellschaft mit beschränkter Haftung\nBerlin\n\nAls nicht eingetragen wird veröffentlicht: Es wurde eine neue Liste der Aufsichtsratsmitglieder eingereicht (§52 GmbHG)."
    },
    {
      "date": "2026-01-12",
      "id": "142095",
      "original_text": "Einreichung neuer Dokumente\nBerlin Amtsgericht Berlin (Charlottenburg) HRB 117588\nEWN Vermögensanlagen und -beteiligungen Verwaltungsgesellschaft mbH – Berlin",
      "type": "Einreichung neuer Dokumente",
      "state": "Berlin",
      "amtsgericht": "Amtsgericht Berlin (Charlottenburg)",
      "registernummer": "HRB 117588",
      "registerart": "HRB",
      "company_name": "EWN Vermögensanlagen und -beteiligungen Verwaltungsgesellschaft mbH",
      "company_seat": "Berlin",
      "details": "12.01.2026 (Bekanntmachungsdatum)\n\nBerlin Amtsgericht Berlin (Charlottenburg) HRB 117588\nEinreichung neuer Dokumente\n\nEWN Vermögensanlagen und -beteiligungen Verwaltungsgesellschaft mbH\nGesellschaft mit beschränkter Haftung\nBerlin\n\nAls nicht eingetragen wird veröffentlicht: Es wurde eine neue Liste der Aufsichtsratsmitglieder eingereicht (§52 GmbHG)."
    },
    {
      "date": "2026-01-12",
      "id": "142096",
      "original_text": "Einreichung neuer Dokumente\nBaden-Württemberg Amtsgericht Mannheim HRB 570161\nStadtwerke Wertheim GmbH – Wertheim",
      "type": "Einreichung neuer Dokumente",
      "state": "Baden-Württemberg",
      "amtsgericht": "Amtsgericht Mannheim",
      "registernummer": "HRB 570161",
      "registerart": "HRB",
      "company_name": "Stadtwerke Wertheim GmbH",
      "company_seat": "Wertheim",
      "details": "12.01.2026 (Bekanntmachungsdatum)\n\nBaden-Württemberg Amtsgericht Mannheim HRB 570161\nEinreichung neuer Dokumente\n\nStadtwerke Wertheim GmbH\nGesellschaft mit beschränkter Haftung\nWertheim\n\nDie Gesellschaft hat am 12.01.2026 die Liste über die Zusammensetzung des Aufsichtsrats zum Handelsregister eingereicht."
    },
    {
      "date": "2026-01-12",
      "id": "142097",
      "original_text": "Löschungsankündigung\nMecklenburg-Vorpommern Amtsgericht Schwerin HRA 4482\nVIVI Energy GmbH & Co. KG – Bernstorf",
      "type": "Löschungsankündigung",
      "state": "Mecklenburg-Vorpommern",
      "amtsgericht": "Amtsgericht Schwerin",
      "registernummer": "HRA 4482",
      "registerart": "HRA",
      "company_name": "VIVI Energy GmbH & Co. KG",
      "company_seat": "Bernstorf",
      "details": "12.01.2026 (Bekanntmachungsdatum)\n\nMecklenburg-Vorpommern Amtsgericht Schwerin HRA 4482\nLöschungsankündigung\n\nVIVI Energy GmbH & Co. KG\nKommanditgesellschaft\nBernstorf\n\nDas Amtsgericht Schwerin, Handelsregisterabteilung, beabsichtigt, die o.g. Gesellschaft\ngemäß § 394 FamFG zu löschen, wenn nicht binnen zwei Monaten nach dieser\nBekanntmachung hiergegen Widerspruch erhoben wird."
    },
    {
      "date": "2026-01-12",
      "id": "142098",
      "original_text": "Löschungsankündigung\nBerlin Amtsgericht Berlin (Charlottenburg) HRB 203730\nKB Agency GmbH – Berlin",
      "type": "Löschungsankündigung",
      "state": "Berlin",
      "amtsgericht": "Amtsgericht Berlin (Charlottenburg)",
      "registernummer": "HRB 203730",
      "registerart": "HRB",
      "company_name": "KB Agency GmbH",
      "company_seat": "Berlin",
      "details": "12.01.2026 (Bekanntmachungsdatum)\n\nBerlin Amtsgericht Berlin (Charlottenburg) HRB 203730\nLöschungsankündigung\n\nKB Agency GmbH\nGesellschaft mit beschränkter Haftung\nBerlin\n\nBei der nachstehenden Gesellschaft wird das Amtslöschungsverfahren gemäß § 394 FamFG eingeleitet. Widerspruchsfrist 6 Wochen"
    },
    {
      "date": "2026-01-12",
      "id": "142099",
      "original_text": "Sonstige Registerbekanntmachung\nHamburg Amtsgericht Hamburg HRB 148078\nNew Work SE – Hamburg",
      "type": "Sonstige Registerbekanntmachung",
      "state": "Hamburg",
      "amtsgericht": "Amtsgericht Hamburg",
      "registernummer": "HRB 148078",
      "registerart": "HRB",
      "company_name": "New Work SE",
      "company_seat": "Hamburg",
      "details": "12.01.2026 (Bekanntmachungsdatum)\n\nHamburg Amtsgericht Hamburg HRB 148078\nSonstige Registerbekanntmachung\n\nNew Work SE\nEuropäische Aktiengesellschaft (SE)\nHamburg\n\nAls nicht eingetragen wird bekannt gemacht: Liste des Aufsichtsrats wurde eingereicht."
    },
    {
      "date": "2026-01-12",
      "id": "142100",
      "original_text": "Registerbekanntmachung nach dem Umwandlungsgesetz\nSchleswig-Holstein Amtsgericht Kiel HRB 10926\nZenk SystemPartner GmbH – Kaltenkirchen",
      "type": "Registerbekanntmachung nach dem Umwandlungsgesetz",
      "state": "Schleswig-Holstein",
      "amtsgericht": "Amtsgericht Kiel",
      "registernummer": "HRB 10926",
      "registerart": "HRB",
      "company_name": "Zenk SystemPartner GmbH",
      "company_seat": "Kaltenkirchen",
      "details": "12.01.2026 (Bekanntmachungsdatum)\n\nSchleswig-Holstein Amtsgericht Kiel HRB 10926\nRegisterbekanntmachung nach dem Umwandlungsgesetz 09.01.2026 (Eintragungsdatum)\n\nZenk SystemPartner GmbH\nGesellschaft mit beschränkter Haftung\nKaltenkirchen\n\nZu Eintragungsnummer 6 vom 09.01.2026 wird als nicht eingetragen veröffentlicht: Den Gläubigern der an der Verschmelzung beteiligten Rechtsträger ist, wenn sie binnen sechs Monaten nach dem Tag, an dem die Eintragung der Verschmelzung in das Register des Sitzes desjenigen Rechtsträgers, dessen Gläubiger sie sind, nach § 19 Abs. 3 UmwG bekannt gemacht worden ist, ihren Anspruch nach Grund und Höhe schriftlich anmelden, Sicherheit zu leisten, soweit sie nicht Befriedigung verlangen können. Dieses Recht steht den Gläubigern jedoch nur zu, wenn sie glaubhaft machen, dass durch die Verschmelzung die Erfüllung ihrer Forderung gefährdet wird."
    },
    {
      "date": "2026-01-12",
      "id": "142101",
      "original_text": "Löschungsankündigung\nBerlin Amtsgericht Berlin (Charlottenburg) HRB 76386\nTPA Real Estate Brands GmbH – Berlin",
      "type": "Löschungsankündigung",
      "state": "Berlin",
      "amtsgericht": "Amtsgericht Berlin (Charlottenburg)",
      "registernummer": "HRB 76386",
      "registerart": "HRB",
      "company_name": "TPA Real Estate Brands GmbH",
      "company_seat": "Berlin",
      "details": "12.01.2026 (Bekanntmachungsdatum)\n\nBerlin Amtsgericht Berlin (Charlottenburg) HRB 76386\nLöschungsankündigung\n\nTPA Real Estate Brands GmbH\nGesellschaft mit beschränkter Haftung\nBerlin\n\nBei der nachstehenden Gesellschaft wird das Amtslöschungsverfahren gemäß § 394 FamFG eingeleitet. Widerspruchsfrist 6 Wochen"
    },
    {
      "date": "2026-01-12",
      "id": "142102",
      "original_text": "Registerbekanntmachung nach dem Umwandlungsgesetz\nSchleswig-Holstein Amtsgericht Kiel HRB 18986\nTell-Phone Deutschland GmbH – Kaltenkirchen",
      "type": "Registerbekanntmachung nach dem Umwandlungsgesetz",
      "state": "Schleswig-Holstein",
      "amtsgericht": "Amtsgericht Kiel",
      "registernummer": "HRB 18986",
      "registerart": "HRB",
      "company_name": "Tell-Phone Deutschland GmbH",
      "company_seat": "Kaltenkirchen",
      "details": "12.01.2026 (Bekanntmachungsdatum)\n\nSchleswig-Holstein Amtsgericht Kiel HRB 18986\nRegisterbekanntmachung nach dem Umwandlungsgesetz 09.01.2026 (Eintragungsdatum)\n\nTell-Phone Deutschland GmbH\nGesellschaft mit beschränkter Haftung\nKaltenkirchen\n\nZu Eintragungsnummer 6 vom 09.01.2026 wird als nicht eingetragen veröffentlicht: Den Gläubigern der an der Verschmelzung beteiligten Rechtsträger ist, wenn sie binnen sechs Monaten nach dem Tag, an dem die Eintragung der Verschmelzung in das Register des Sitzes desjenigen Rechtsträgers, dessen Gläubiger sie sind, nach § 19 Abs. 3 UmwG bekannt gemacht worden ist, ihren Anspruch nach Grund und Höhe schriftlich anmelden, Sicherheit zu leisten, soweit sie nicht Befriedigung verlangen können. Dieses Recht steht den Gläubigern jedoch nur zu, wenn sie glaubhaft machen, dass durch die Verschmelzung die Erfüllung ihrer Forderung gefährdet wird."
    },
    {
      "date": "2026-01-12",
      "id": "142103",
      "original_text": "Sonstige Registerbekanntmachung\nBaden-Württemberg Amtsgericht Ulm HRB 551289\nWKG Labor GmbH – Ravensburg",
      "type": "Sonstige Registerbekanntmachung",
      "state": "Baden-Württemberg",
      "amtsgericht": "Amtsgericht Ulm",
      "registernummer": "HRB 551289",
      "registerart": "HRB",
      "company_name": "WKG Labor GmbH",
      "company_seat": "Ravensburg",
      "details": "12.01.2026 (Bekanntmachungsdatum)\n\nBaden-Württemberg Amtsgericht Ulm HRB 551289\nSonstige Registerbekanntmachung 12.01.2026 (Eintragungsdatum)\n\nWKG Labor GmbH\nGesellschaft mit beschränkter Haftung\nRavensburg\n\nDen Gläubigern der Gesellschaft, deren Forderungen begründet worden sind, bevor die Eintragung der Beendigung des Vertrages in das Handelsregister nach § 10 HGB als bekanntgemacht gilt, ist vom anderen Vertragsteil Sicherheit zu leisten, wenn sie sich binnen sechs Monaten nach der Bekanntmachung zu diesem Zweck bei ihm melden."
    },
    {
      "date": "2026-01-12",
      "id": "142104",
      "original_text": "Löschungsankündigung\nBerlin Amtsgericht Berlin (Charlottenburg) HRB 262649\nHL Vermögens- und Beteiligungs UG (haftungsbeschränkt) – Berlin",
      "type": "Löschungsankündigung",
      "state": "Berlin",
      "amtsgericht": "Amtsgericht Berlin (Charlottenburg)",
      "registernummer": "HRB 262649",
      "registerart": "HRB",
      "company_name": "HL Vermögens- und Beteiligungs UG (haftungsbeschränkt)",
      "company_seat": "Berlin",
      "details": "12.01.2026 (Bekanntmachungsdatum)\n\nBerlin Amtsgericht Berlin (Charlottenburg) HRB 262649\nLöschungsankündigung\n\nHL Vermögens- und Beteiligungs UG (haftungsbeschränkt)\nGesellschaft mit beschränkter Haftung\nBerlin\n\nBei der nachstehenden Gesellschaft wird das Amtslöschungsverfahren gemäß § 394 FamFG eingeleitet. Widerspruchsfrist 6 Wochen"
    },
    {
      "date": "2026-01-12",
      "id": "142105",
      "original_text": "Registerbekanntmachung nach dem Umwandlungsgesetz\nBaden-Württemberg Amtsgericht Freiburg GsR 1237\nMVZ Urologie Kinzigtal Dr. med. Jochen Stürner Facharzt für Urologie Sandra Susic Fachärztin für Urologie eGbR – Haslach im Kinzigtal",
      "type": "Registerbekanntmachung nach dem Umwandlungsgesetz",
      "state": "Baden-Württemberg",
      "amtsgericht": "Amtsgericht Freiburg",
      "registernummer": "GsR 1237",
      "registerart": "GsR",
      "company_name": "MVZ Urologie Kinzigtal Dr. med. Jochen Stürner Facharzt für Urologie Sandra Susic Fachärztin für Urologie eGbR",
      "company_seat": "Haslach im Kinzigtal",
      "details": "12.01.2026 (Bekanntmachungsdatum)\n\nBaden-Württemberg Amtsgericht Freiburg GsR 1237\nRegisterbekanntmachung nach dem Umwandlungsgesetz 12.01.2026 (Eintragungsdatum)\n\nMVZ Urologie Kinzigtal Dr. med. Jochen Stürner Facharzt für Urologie Sandra Susic Fachärztin für Urologie eGbR\nGesellschaft bürgerlichen Rechts\nHaslach im Kinzigtal\n\nAls nicht eingetragen wird bekanntgemacht:\nDen Gläubigern des an dem Formwechsel beteiligten Rechtsträgers ist, wenn sie binnen sechs Monaten nach dem Tag, an dem die Eintragung des Formwechsels in das Register des Sitzes desjenigen Rechtsträgers, dessen Gläubiger sie sind, nach § 19 Abs. 3 UmwG als bekanntgemacht gilt, ihren Anspruch nach Grund und Höhe schriftlich anmelden, Sicherheit zu leisten, soweit sie nicht Befriedigung verlangen können. Dieses Recht steht den Gläubigern jedoch nur zu, wenn sie glaubhaft machen, dass durch den Formwechsel die Erfüllung ihrer Forderung gefährdet wird."
    },
    {
      "date": "2026-01-12",
      "id": "142106",
      "original_text": "Sonstige Registerbekanntmachung\nBerlin Amtsgericht Berlin (Charlottenburg) HRB 221276\nDAH Photovoltaik 4. GmbH – Berlin",
      "type": "Sonstige Registerbekanntmachung",
      "state": "Berlin",
      "amtsgericht": "Amtsgericht Berlin (Charlottenburg)",
      "registernummer": "HRB 221276",
      "registerart": "HRB",
      "company_name": "DAH Photovoltaik 4. GmbH",
      "company_seat": "Berlin",
      "details": "12.01.2026 (Bekanntmachungsdatum)\n\nBerlin Amtsgericht Berlin (Charlottenburg) HRB 221276\nSonstige Registerbekanntmachung\n\nDAH Photovoltaik 4. GmbH\nGesellschaft mit beschränkter Haftung\nBerlin\n\nAls nicht eingetragen wird veröffentlicht: Der andere Vertragsteil hat den Gläubigern dieses Rechtsträgers, deren Forderungen begründet worden sind, bevor die Eintragung der Beendigung dieses Vertrages in das Handelsregister nach § 10 des Handelsgesetzbuches als bekannt gemacht gilt, Sicherheit zu leisten, wenn sie sich binnen sechs Monaten nach der Bekanntmachung der Eintragung zu diesem Zweck bei ihm melden. Dieses Recht steht den Gläubigern nicht zu, die im Fall des Insolvenzverfahrens ein Recht auf vorzugsweise Befriedigung aus der Deckungsmasse haben, die nach gesetzlicher Vorschrift zu ihrem Schutz errichtet und staatlich überwacht ist."
    },
    {
      "date": "2026-01-12",
      "id": "142107",
      "original_text": "Registerbekanntmachung nach dem Umwandlungsgesetz\nBaden-Württemberg Amtsgericht Stuttgart HRB 803393\nPromicron AG – Kirchheim am Neckar",
      "type": "Registerbekanntmachung nach dem Umwandlungsgesetz",
      "state": "Baden-Württemberg",
      "amtsgericht": "Amtsgericht Stuttgart",
      "registernummer": "HRB 803393",
      "registerart": "HRB",
      "company_name": "Promicron AG",
      "company_seat": "Kirchheim am Neckar",
      "details": "12.01.2026 (Bekanntmachungsdatum)\n\nBaden-Württemberg Amtsgericht Stuttgart HRB 803393\nRegisterbekanntmachung nach dem Umwandlungsgesetz 12.01.2026 (Eintragungsdatum)\n\nPromicron AG\nAktiengesellschaft\nKirchheim am Neckar\n\nDen Gläubigern des an dem Formwechsel beteiligten Rechtsträgers ist, wenn sie binnen sechs Monaten nach dem Tag, an dem die Eintragung des Formwechsels in das Register des Sitzes desjenigen Rechtsträgers, dessen Gläubiger sie sind, nach § 19 Abs. 3 UmwG als bekanntgemacht gilt, ihren Anspruch nach Grund und Höhe schriftlich anmelden, Sicherheit zu leisten, soweit sie nicht Befriedigung verlangen können. Dieses Recht steht den Gläubigern jedoch nur zu, wenn sie glaubhaft machen, dass durch den Formwechsel die Erfüllung ihrer Forderung gefährdet wird."
    },
    {
      "date": "2026-01-12",
      "id": "142108",
      "original_text": "Registerbekanntmachung nach dem Umwandlungsgesetz\nBaden-Württemberg Amtsgericht Stuttgart HRB 302314\nPromicron GmbH – Kirchheim an Neckar",
      "type": "Registerbekanntmachung nach dem Umwandlungsgesetz",
      "state": "Baden-Württemberg",
      "amtsgericht": "Amtsgericht Stuttgart",
      "registernummer": "HRB 302314",
      "registerart": "HRB",
      "company_name": "Promicron GmbH",
      "company_seat": "Kirchheim an Neckar",
      "details": "12.01.2026 (Bekanntmachungsdatum)\n\nBaden-Württemberg Amtsgericht Stuttgart HRB 302314\nRegisterbekanntmachung nach dem Umwandlungsgesetz 12.01.2026 (Eintragungsdatum)\n\nPromicron GmbH\nGesellschaft mit beschränkter Haftung\nKirchheim an Neckar\n\nDen Gläubigern des an dem Formwechsel beteiligten Rechtsträgers ist, wenn sie binnen sechs Monaten nach dem Tag, an dem die Eintragung des Formwechsels in das Register des Sitzes desjenigen Rechtsträgers, dessen Gläubiger sie sind, nach § 19 Abs. 3 UmwG als bekanntgemacht gilt, ihren Anspruch nach Grund und Höhe schriftlich anmelden, Sicherheit zu leisten, soweit sie nicht Befriedigung verlangen können. Dieses Recht steht den Gläubigern jedoch nur zu, wenn sie glaubhaft machen, dass durch den Formwechsel die Erfüllung ihrer Forderung gefährdet wird."
    },
    {
      "date": "2026-01-12",
      "id": "142109",
      "original_text": "Löschungsankündigung\nSaarland Amtsgericht Saarbrücken HRB 109289\nTAVO Kfz GmbH – Homburg",
      "type": "Löschungsankündigung",
      "state": "Saarland",
      "amtsgericht": "Amtsgericht Saarbrücken",
      "registernummer": "HRB 109289",
      "registerart": "HRB",
      "company_name": "TAVO Kfz GmbH",
      "company_seat": "Homburg",
      "details": "12.01.2026 (Bekanntmachungsdatum)\n\nSaarland Amtsgericht Saarbrücken HRB 109289\nLöschungsankündigung\n\nTAVO Kfz GmbH\nGesellschaft mit beschränkter Haftung\nHomburg\n\nEs ist beabsichtigt, die Gesellschaft von Amts wegen gemäß § 394 FamFG wegen Vermögenslosigkeit zu löschen.\nGegen die Löschung von Amts wegen ist das Rechtsmittel des Widerspruchs statthaft. Der Widerspruch ist binnen einer Frist drei Monaten beginnend mit dem Tag dieser Veröffentlichung durch Einreichen eines Widerspruchsschreibens -schriftlich oder zur Niederschrift der Geschäftsstelle beim Amtsgericht Saarbrücken, -zentrales Handelsregister-, Mainzerstr.178, 66121 Saarbrücken einzulegen.\nDer Widerspruch muss die Bezeichnung der angefochtenen Löschungsankündigung enthalten sowie die Erklärung, dass Widerspruch eingelegt wird. Er ist vom Widerspruchsführer oder seinem Bevollmächtigten zu unterzeichnen.\nDas Widerspruchsschreiben kann auch in der Form eines elektronischen Dokumentes eingereicht werden, das mit einer qualifizierten elektronischen Signatur nach dem Signaturgesetz versehen sein muss (§§ 14 Abs. 2 FamFG, 130a, 298 ZPO)."
    },
    {
      "date": "2026-01-12",
      "id": "142110",
      "original_text": "Löschungsankündigung\nBaden-Württemberg Amtsgericht Stuttgart HRB 771212\nRMH Robert Multi Handel GmbH – Heilbronn",
      "type": "Löschungsankündigung",
      "state": "Baden-Württemberg",
      "amtsgericht": "Amtsgericht Stuttgart",
      "registernummer": "HRB 771212",
      "registerart": "HRB",
      "company_name": "RMH Robert Multi Handel GmbH",
      "company_seat": "Heilbronn",
      "details": "12.01.2026 (Bekanntmachungsdatum)\n\nBaden-Württemberg Amtsgericht Stuttgart HRB 771212\nLöschungsankündigung\n\nRMH Robert Multi Handel GmbH\nGesellschaft mit beschränkter Haftung\nHeilbronn\n\nAls nicht eingetragen wird bekanntgemacht:\nDas Gericht beabsichtigt, die Gesellschaft wegen Vermögenslosigkeit im Handelsregister von Amts wegen nach § 394 FamFG zu löschen. Die Frist zur Geltendmachung eines Widerspruchs gegen die beabsichtigte Löschung ist auf zwei Monate ab Veröffentlichung bestimmt."
    },
    {
      "date": "2026-01-12",
      "id": "142111",
      "original_text": "Einreichung neuer Dokumente\nHamburg Amtsgericht Hamburg HRB 184303\nSTERNPARTNER Management SE – Hamburg",
      "type": "Einreichung neuer Dokumente",
      "state": "Hamburg",
      "amtsgericht": "Amtsgericht Hamburg",
      "registernummer": "HRB 184303",
      "registerart": "HRB",
      "company_name": "STERNPARTNER Management SE",
      "company_seat": "Hamburg",
      "details": "12.01.2026 (Bekanntmachungsdatum)\n\nHamburg Amtsgericht Hamburg HRB 184303\nEinreichung neuer Dokumente\n\nSTERNPARTNER Management SE\nEuropäische Aktiengesellschaft (SE)\nHamburg\n\nAls nicht eingetragen wird bekannt gemacht: Liste des Aufsichtsrats wurde eingereicht."
    },
    {
      "date": "2026-01-12",
      "id": "142112",
      "original_text": "Einreichung neuer Dokumente\nHamburg Amtsgericht Hamburg HRB 184196\nSPT Avior Management SE – Hamburg",
      "type": "Einreichung neuer Dokumente",
      "state": "Hamburg",
      "amtsgericht": "Amtsgericht Hamburg",
      "registernummer": "HRB 184196",
      "registerart": "HRB",
      "company_name": "SPT Avior Management SE",
      "company_seat": "Hamburg",
      "details": "12.01.2026 (Bekanntmachungsdatum)\n\nHamburg Amtsgericht Hamburg HRB 184196\nEinreichung neuer Dokumente\n\nSPT Avior Management SE\nEuropäische Aktiengesellschaft (SE)\nHamburg\n\nAls nicht eingetragen wird bekannt gemacht: Liste des Aufsichtsrats wurde eingereicht."
    },
    {
      "date": "2026-01-12",
      "id": "142113",
      "original_text": "Registerbekanntmachung nach dem Umwandlungsgesetz\nBrandenburg Amtsgericht Cottbus HRB 15275\nImmopact Zschortauer 105 GmbH – Schönefeld",
      "type": "Registerbekanntmachung nach dem Umwandlungsgesetz",
      "state": "Brandenburg",
      "amtsgericht": "Amtsgericht Cottbus",
      "registernummer": "HRB 15275",
      "registerart": "HRB",
      "company_name": "Immopact Zschortauer 105 GmbH",
      "company_seat": "Schönefeld",
      "details": "12.01.2026 (Bekanntmachungsdatum)\n\nBrandenburg Amtsgericht Cottbus HRB 15275\nRegisterbekanntmachung nach dem Umwandlungsgesetz 09.01.2026 (Eintragungsdatum)\n\nImmopact Zschortauer 105 GmbH\nGesellschaft mit beschränkter Haftung\nSchönefeld\n\nZu Eintragungsnummer 7 vom 09.01.2026 wird als nicht eingetragen veröffentlicht:\nAls nicht eingetragen wird veröffentlicht:\nDer andere Vertragsteil hat den Gläubigern dieses Rechtsträgers, dessen Forderungen begründet worden sind, bevor die Eintragung der Beendigung dieses Vertrages in das Handelsregister nach § 10 des Handelsgesetzbuches als bekannt gemacht gilt, Sicherheit zu leisten, wenn sie sich binnen sechs Monaten nach der Bekanntmachung der Eintragung zu diesem Zweck bei ihm melden"
    },
    {
      "date": "2026-01-12",
      "id": "142114",
      "original_text": "Registerbekanntmachung nach dem Umwandlungsgesetz\nBaden-Württemberg Amtsgericht Stuttgart HRB 768773\nZEROS GmbH – Nagold",
      "type": "Registerbekanntmachung nach dem Umwandlungsgesetz",
      "state": "Baden-Württemberg",
      "amtsgericht": "Amtsgericht Stuttgart",
      "registernummer": "HRB 768773",
      "registerart": "HRB",
      "company_name": "ZEROS GmbH",
      "company_seat": "Nagold",
      "details": "12.01.2026 (Bekanntmachungsdatum)\n\nBaden-Württemberg Amtsgericht Stuttgart HRB 768773\nRegisterbekanntmachung nach dem Umwandlungsgesetz 12.01.2026 (Eintragungsdatum)\n\nZEROS GmbH\nGesellschaft mit beschränkter Haftung\nNagold\n\nDen Gläubigern der an der Verschmelzung beteiligten Rechtsträger ist, wenn sie binnen sechs Monaten nach dem Tag, an dem die Eintragung der Verschmelzung in das Register des Sitzes desjenigen Rechtsträgers, dessen Gläubiger sie sind, nach § 19 Abs. 3 UmwG als bekanntgemacht gilt, ihren Anspruch nach Grund und Höhe schriftlich anmelden, Sicherheit zu leisten, soweit sie nicht Befriedigung verlangen können. Dieses Recht steht den Gläubigern jedoch nur zu, wenn sie glaubhaft machen, dass durch die Verschmelzung die Erfüllung ihrer Forderung gefährdet wird."
    },
    {
      "date": "2026-01-12",
      "id": "142115",
      "original_text": "Einreichung neuer Dokumente\nBaden-Württemberg Amtsgericht Stuttgart HRB 638\nMAHLE GmbH – Stuttgart",
      "type": "Einreichung neuer Dokumente",
      "state": "Baden-Württemberg",
      "amtsgericht": "Amtsgericht Stuttgart",
      "registernummer": "HRB 638",
      "registerart": "HRB",
      "company_name": "MAHLE GmbH",
      "company_seat": "Stuttgart",
      "details": "12.01.2026 (Bekanntmachungsdatum)\n\nBaden-Württemberg Amtsgericht Stuttgart HRB 638\nEinreichung neuer Dokumente\n\nMAHLE GmbH\nGesellschaft mit beschränkter Haftung\nStuttgart\n\nDie Gesellschaft hat am 09.01.2026 die Liste über die Zusammensetzung des Aufsichtsrats zum Handelsregister eingereicht."
    },
    {
      "date": "2026-01-12",
      "id": "142116",
      "original_text": "Löschungsankündigung\nBerlin Amtsgericht Berlin (Charlottenburg) HRB 220620\nSEA Bau GmbH – Berlin",
      "type": "Löschungsankündigung",
      "state": "Berlin",
      "amtsgericht": "Amtsgericht Berlin (Charlottenburg)",
      "registernummer": "HRB 220620",
      "registerart": "HRB",
      "company_name": "SEA Bau GmbH",
      "company_seat": "Berlin",
      "details": "12.01.2026 (Bekanntmachungsdatum)\n\nBerlin Amtsgericht Berlin (Charlottenburg) HRB 220620\nLöschungsankündigung\n\nSEA Bau GmbH\nGesellschaft mit beschränkter Haftung\nBerlin\n\nBei der nachstehenden Gesellschaft wird das Amtslöschungsverfahren gemäß § 394 FamFG eingeleitet. Widerspruchsfrist 6 Wochen"
    },
    {
      "date": "2026-01-12",
      "id": "142117",
      "original_text": "Sonstige Registerbekanntmachung\nBerlin Amtsgericht Berlin (Charlottenburg) HRB 201037\nMcMakler Ost GmbH – Berlin",
      "type": "Sonstige Registerbekanntmachung",
      "state": "Berlin",
      "amtsgericht": "Amtsgericht Berlin (Charlottenburg)",
      "registernummer": "HRB 201037",
      "registerart": "HRB",
      "company_name": "McMakler Ost GmbH",
      "company_seat": "Berlin",
      "details": "12.01.2026 (Bekanntmachungsdatum)\n\nBerlin Amtsgericht Berlin (Charlottenburg) HRB 201037\nSonstige Registerbekanntmachung\n\nMcMakler Ost GmbH\nGesellschaft mit beschränkter Haftung\nBerlin\n\nDer andere Vertragsteil hat den Gläubigern dieses Rechtsträgers, deren Forderungen begründet worden sind, bevor die Eintragung der Beendigung dieses Vertrages in das Handelsregister nach § 10 des Handelsgesetzbuches als bekannt gemacht gilt, Sicherheit zu leisten, wenn sie sich binnen sechs Monaten nach der Bekanntmachung der Eintragung zu diesem Zweck bei ihm melden. Dieses Recht steht den Gläubigern nicht zu, die im Fall des Insolvenzverfahrens ein Recht auf vorzugsweise Befriedigung aus der Deckungsmasse haben, die nach gesetzlicher Vorschrift zu ihrem Schutz errichtet und staatlich überwacht ist."
    },
    {
      "date": "2026-01-12",
      "id": "142118",
      "original_text": "Registerbekanntmachung nach dem Umwandlungsgesetz\nSchleswig-Holstein Amtsgericht Kiel HRA 12935\nChristiane Uhl - Villa am See e.K. – Bösdorf",
      "type": "Registerbekanntmachung nach dem Umwandlungsgesetz",
      "state": "Schleswig-Holstein",
      "amtsgericht": "Amtsgericht Kiel",
      "registernummer": "HRA 12935",
      "registerart": "HRA",
      "company_name": "Christiane Uhl - Villa am See e.K.",
      "company_seat": "Bösdorf",
      "details": "12.01.2026 (Bekanntmachungsdatum)\n\nSchleswig-Holstein Amtsgericht Kiel HRA 12935\nRegisterbekanntmachung nach dem Umwandlungsgesetz 08.01.2026 (Eintragungsdatum)\n\nChristiane Uhl - Villa am See e.K.\nEinzelkaufmann / Einzelkauffrau\nBösdorf\n\nZu Eintragungsnummer 2 vom 08.01.2026 wird als nicht eingetragen veröffentlicht: Den Gläubigern der an der Spaltung beteiligten Rechtsträger ist, wenn sie binnen sechs Monaten nach dem Tag, an dem die Eintragung der Spaltung in das Register des Sitzes desjenigen Rechtsträgers, dessen Gläubiger sie sind,  bekannt gemacht worden ist, ihren Anspruch nach Grund und Höhe schriftlich anmelden, Sicherheit zu leisten, soweit sie nicht Befriedigung verlangen können. Dieses Recht steht den Gläubigern jedoch nur zu, wenn sie glaubhaft machen, dass durch die Spaltung die Erfüllung ihrer Forderung gefährdet wird."
    },
    {
      "date": "2026-01-12",
      "id": "142119",
      "original_text": "Sonstige Registerbekanntmachung\nSachsen Amtsgericht Leipzig HRB 43590\nELAC Beteiligungs AG – Leipzig",
      "type": "Sonstige Registerbekanntmachung",
      "state": "Sachsen",
      "amtsgericht": "Amtsgericht Leipzig",
      "registernummer": "HRB 43590",
      "registerart": "HRB",
      "company_name": "ELAC Beteiligungs AG",
      "company_seat": "Leipzig",
      "details": "12.01.2026 (Bekanntmachungsdatum)\n\nSachsen Amtsgericht Leipzig HRB 43590\nSonstige Registerbekanntmachung\n\nELAC Beteiligungs AG\nAktiengesellschaft\nLeipzig\n\nAm 08.01.2026 wurde beim Handelsregister des Amtsgerichts Leipzig die Liste der Mitglieder des Aufsichtsrats gemäß § 106 AktG eingereicht."
    },
    {
      "date": "2026-01-12",
      "id": "142120",
      "original_text": "Sonstige Registerbekanntmachung\nSachsen Amtsgericht Chemnitz HRB 10737\nWestermann Druck Zwickau GmbH – Zwickau",
      "type": "Sonstige Registerbekanntmachung",
      "state": "Sachsen",
      "amtsgericht": "Amtsgericht Chemnitz",
      "registernummer": "HRB 10737",
      "registerart": "HRB",
      "company_name": "Westermann Druck Zwickau GmbH",
      "company_seat": "Zwickau",
      "details": "12.01.2026 (Bekanntmachungsdatum)\n\nSachsen Amtsgericht Chemnitz HRB 10737\nSonstige Registerbekanntmachung 12.01.2026 (Eintragungsdatum)\n\nWestermann Druck Zwickau GmbH\nGesellschaft mit beschränkter Haftung\nZwickau\n\nDen Gläubigern der Gesellschaft, deren Forderungen begründet worden sind bevor die Eintragung der Beendigung des Gewinnabführungsvertrages in das Handelsregister nach § 10 des Handelsgesetzbuches als bekanntgemacht gilt, hat der andere Vertragsteil Sicherheit zu leisten, wenn sie sich binnen sechs Monaten nach der Bekanntmachung der Eintragung zu diesem Zweck bei ihm melden."
    },
    {
      "date": "2026-01-12",
      "id": "142121",
      "original_text": "Registerbekanntmachung nach dem Umwandlungsgesetz\nSachsen Amtsgericht Dresden HRA 12297\nM-Logistik e.K., Inhaber Thomas Hegewald – Dresden",
      "type": "Registerbekanntmachung nach dem Umwandlungsgesetz",
      "state": "Sachsen",
      "amtsgericht": "Amtsgericht Dresden",
      "registernummer": "HRA 12297",
      "registerart": "HRA",
      "company_name": "M-Logistik e.K., Inhaber Thomas Hegewald",
      "company_seat": "Dresden",
      "details": "12.01.2026 (Bekanntmachungsdatum)\n\nSachsen Amtsgericht Dresden HRA 12297\nRegisterbekanntmachung nach dem Umwandlungsgesetz 12.01.2026 (Eintragungsdatum)\n\nM-Logistik e.K., Inhaber Thomas Hegewald\nEinzelkaufmann / Einzelkauffrau\nDresden\n\nDen Gläubigern der an der Ausgliederung beteiligten Rechtsträger ist, wenn sie binnen sechs Monaten nach dem Tag, an dem die Eintragung der Ausgliederung in das Register des Sitzes desjenigen Rechtsträgers, dessen Gläubiger sie sind, nach § 19 Abs. 3 UmwG als bekannt gemacht gilt, ihren Anspruch nach Grund und Höhe in Textform anmelden, Sicherheit zu leisten, soweit sie nicht Befriedigung verlangen können. Dieses Recht steht den Gläubigern jedoch nur zu, wenn sie glaubhaft machen, dass durch die Ausgliederung die Erfüllung der Forderung gefährdet wird."
    },
    {
      "date": "2026-01-12",
      "id": "142122",
      "original_text": "Registerbekanntmachung nach dem Umwandlungsgesetz\nSachsen Amtsgericht Dresden HRB 42914\nSMT Spedition Müller-Trans GmbH – Dresden",
      "type": "Registerbekanntmachung nach dem Umwandlungsgesetz",
      "state": "Sachsen",
      "amtsgericht": "Amtsgericht Dresden",
      "registernummer": "HRB 42914",
      "registerart": "HRB",
      "company_name": "SMT Spedition Müller-Trans GmbH",
      "company_seat": "Dresden",
      "details": "12.01.2026 (Bekanntmachungsdatum)\n\nSachsen Amtsgericht Dresden HRB 42914\nRegisterbekanntmachung nach dem Umwandlungsgesetz 12.01.2026 (Eintragungsdatum)\n\nSMT Spedition Müller-Trans GmbH\nGesellschaft mit beschränkter Haftung\nDresden\n\nDen Gläubigern der an der Ausgliederung beteiligten Rechtsträger ist, wenn sie binnen sechs Monaten nach dem Tag, an dem die Eintragung der Ausgliederung in das Register des Sitzes desjenigen Rechtsträgers, dessen Gläubiger sie sind, nach § 19 Abs. 3 UmwG als bekannt gemacht gilt, ihren Anspruch nach Grund und Höhe in Textform anmelden, Sicherheit zu leisten, soweit sie nicht Befriedigung verlangen können. Dieses Recht steht den Gläubigern jedoch nur zu, wenn sie glaubhaft machen, dass durch die Ausgliederung die Erfüllung der Forderung gefährdet wird."
    },
    {
      "date": "2026-01-12",
      "id": "142123",
      "original_text": "Einreichung neuer Dokumente\nSachsen Amtsgericht Dresden HRB 4060\nMeißener Stadtwerke GmbH (MSW) – Meißen",
      "type": "Einreichung neuer Dokumente",
      "state": "Sachsen",
      "amtsgericht": "Amtsgericht Dresden",
      "registernummer": "HRB 4060",
      "registerart": "HRB",
      "company_name": "Meißener Stadtwerke GmbH (MSW)",
      "company_seat": "Meißen",
      "details": "12.01.2026 (Bekanntmachungsdatum)\n\nSachsen Amtsgericht Dresden HRB 4060\nEinreichung neuer Dokumente\n\nMeißener Stadtwerke GmbH (MSW)\nGesellschaft mit beschränkter Haftung\nMeißen\n\nAm 05.01.2026 wurde beim Handelsregister des Amtsgerichts Dresden die Liste der Mitglieder des Aufsichtsrats gemäß § 52 GmbHG eingereicht."
    },
    {
      "date": "2026-01-12",
      "id": "142124",
      "original_text": "Löschungsankündigung\nNiedersachsen Amtsgericht Osnabrück HRB 209995\nPremium Group GmbH – Wilsum",
      "type": "Löschungsankündigung",
      "state": "Niedersachsen",
      "amtsgericht": "Amtsgericht Osnabrück",
      "registernummer": "HRB 209995",
      "registerart": "HRB",
      "company_name": "Premium Group GmbH",
      "company_seat": "Wilsum",
      "details": "12.01.2026 (Bekanntmachungsdatum)\n\nNiedersachsen Amtsgericht Osnabrück HRB 209995\nLöschungsankündigung\n\nPremium Group GmbH\nGesellschaft mit beschränkter Haftung\nWilsum\n\nDas Registergericht beabsichtigt, die Gesellschaft von Amts wegen nach § 394 FamFG wegen Vermögenslosigkeit zu löschen. Die Frist zur Erhebung eines Widerspruchs ist auf 1 Monat ab dieser Registerbekanntmachung festgesetzt."
    },
    {
      "date": "2026-01-12",
      "id": "142125",
      "original_text": "Löschungsankündigung\nNiedersachsen Amtsgericht Hildesheim HRB 200769\nC-H-Immobilien Verwaltungs- und Verwertungs GmbH – Hildesheim",
      "type": "Löschungsankündigung",
      "state": "Niedersachsen",
      "amtsgericht": "Amtsgericht Hildesheim",
      "registernummer": "HRB 200769",
      "registerart": "HRB",
      "company_name": "C-H-Immobilien Verwaltungs- und Verwertungs GmbH",
      "company_seat": "Hildesheim",
      "details": "12.01.2026 (Bekanntmachungsdatum)\n\nNiedersachsen Amtsgericht Hildesheim HRB 200769\nLöschungsankündigung\n\nC-H-Immobilien Verwaltungs- und Verwertungs GmbH\nGesellschaft mit beschränkter Haftung\nHildesheim\n\nDas Registergericht beabsichtigt, die Gesellschaft von Amts wegen nach § 394 FamFG zu löschen. Die Frist zur Erhebung eines Widerspruchs ist auf 1 Monat ab dieser Registerbekanntmachung festgesetzt."
    },
    {
      "date": "2026-01-12",
      "id": "142126",
      "original_text": "Löschungsankündigung\nNiedersachsen Amtsgericht Osnabrück HRA 2389\n\"Ihr Platz\" GmbH + Co. KG – Osnabrück",
      "type": "Löschungsankündigung",
      "state": "Niedersachsen",
      "amtsgericht": "Amtsgericht Osnabrück",
      "registernummer": "HRA 2389",
      "registerart": "HRA",
      "company_name": "\"Ihr Platz\" GmbH + Co. KG",
      "company_seat": "Osnabrück",
      "details": "12.01.2026 (Bekanntmachungsdatum)\n\nNiedersachsen Amtsgericht Osnabrück HRA 2389\nLöschungsankündigung\n\n\"Ihr Platz\" GmbH + Co. KG\nKommanditgesellschaft\nOsnabrück\n\nDas Registergericht beabsichtigt, die Firma von Amts wegen nach § 394 FamFG wegen Vermögenslosigkeit zu löschen. Die Frist zur Erhebung eines Widerspruchs ist auf 1 Monat ab dieser Registerbekanntmachung festgesetzt."
    },
    {
      "date": "2026-01-12",
      "id": "142127",
      "original_text": "Registerbekanntmachung nach dem Umwandlungsgesetz\nNiedersachsen Amtsgericht Tostedt HRB 211915\nEM-Tec Test Systems GmbH – Revenahe",
      "type": "Registerbekanntmachung nach dem Umwandlungsgesetz",
      "state": "Niedersachsen",
      "amtsgericht": "Amtsgericht Tostedt",
      "registernummer": "HRB 211915",
      "registerart": "HRB",
      "company_name": "EM-Tec Test Systems GmbH",
      "company_seat": "Revenahe",
      "details": "12.01.2026 (Bekanntmachungsdatum)\n\nNiedersachsen Amtsgericht Tostedt HRB 211915\nRegisterbekanntmachung nach dem Umwandlungsgesetz 12.01.2026 (Eintragungsdatum)\n\nEM-Tec Test Systems GmbH\nGesellschaft mit beschränkter Haftung\nRevenahe\n\nDen Gläubigern der an der Ausgliederung beteiligten Rechtsträger ist, wenn sie binnen sechs Monaten nach dem Tag, an dem die Eintragung der Ausgliederung in das Register des Sitzes desjenigen Rechtsträgers, dessen Gläubiger sie sind, nach § 19 Abs. 3 UmwG als bekannt gemacht gilt, ihren Anspruch nach Grund und Höhe schriftlich anmelden, Sicherheit zu leisten, soweit sie nicht Befriedigung verlangen können. Dieses Recht steht den Gläubigern jedoch nur zu, wenn sie glaubhaft machen, dass durch die Ausgliederung die Erfüllung der Forderung gefährdet wird."
    },
    {
      "date": "2026-01-12",
      "id": "142128",
      "original_text": "Sonstige Registerbekanntmachung\nNiedersachsen Amtsgericht Hannover HRB 52032\nContiTech Schlauch GmbH – Hannover",
      "type": "Sonstige Registerbekanntmachung",
      "state": "Niedersachsen",
      "amtsgericht": "Amtsgericht Hannover",
      "registernummer": "HRB 52032",
      "registerart": "HRB",
      "company_name": "ContiTech Schlauch GmbH",
      "company_seat": "Hannover",
      "details": "12.01.2026 (Bekanntmachungsdatum)\n\nNiedersachsen Amtsgericht Hannover HRB 52032\nSonstige Registerbekanntmachung 12.01.2026 (Eintragungsdatum)\n\nContiTech Schlauch GmbH\nGesellschaft mit beschränkter Haftung\nHannover\n\nDen Gläubigern der Gesellschaft, deren Forderungen begründet worden sind, bevor die Eintragung der Beendigung des Vertrages in das Handelsregister nach § 10 HGB als bekanntgemacht gilt, ist vom anderen Vertragsteil Sicherheit zu leisten, wenn sie sich binnen sechs Monaten nach der Bekanntmachung zu diesem Zweck bei ihm melden."
    },
    {
      "date": "2026-01-12",
      "id": "142129",
      "original_text": "Registerbekanntmachung nach dem Umwandlungsgesetz\nNiedersachsen Amtsgericht Tostedt HRA 120903 früher Amtsgericht Buxtehude\nEM-Tec Inhaber: Norbert Herrmann e.K. – Revenahe",
      "type": "Registerbekanntmachung nach dem Umwandlungsgesetz",
      "state": "Niedersachsen",
      "amtsgericht": "Amtsgericht Tostedt",
      "registernummer": "HRA 120903",
      "registerart": "HRA",
      "company_name": "EM-Tec Inhaber: Norbert Herrmann e.K.",
      "company_seat": "Revenahe",
      "former_amtsgericht": "Buxtehude",
      "details": "12.01.2026 (Bekanntmachungsdatum)\n\nNiedersachsen Amtsgericht Tostedt HRA 120903 früher Amtsgericht Buxtehude\nRegisterbekanntmachung nach dem Umwandlungsgesetz 12.01.2026 (Eintragungsdatum)\n\nEM-Tec Inhaber: Norbert Herrmann e.K.\nEinzelkaufmann / Einzelkauffrau\nRevenahe\n\nDen Gläubigern der an der Ausgliederung beteiligten Rechtsträger ist, wenn sie binnen sechs Monaten nach dem Tag, an dem die Eintragung der Ausgliederung in das Register des Sitzes desjenigen Rechtsträgers, dessen Gläubiger sie sind, nach § 19 Abs. 3 UmwG als bekannt gemacht gilt, ihren Anspruch nach Grund und Höhe schriftlich anmelden, Sicherheit zu leisten, soweit sie nicht Befriedigung verlangen können. Dieses Recht steht den Gläubigern jedoch nur zu, wenn sie glaubhaft machen, dass durch die Ausgliederung die Erfüllung der Forderung gefährdet wird."
    },
    {
      "date": "2026-01-12",
      "id": "142130",
      "original_text": "Einreichung neuer Dokumente\nNiedersachsen Amtsgericht Aurich HRB 100002 früher Amtsgericht Emden\nFlugplatz Emden GmbH – Emden",
      "type": "Einreichung neuer Dokumente",
      "state": "Niedersachsen",
      "amtsgericht": "Amtsgericht Aurich",
      "registernummer": "HRB 100002",
      "registerart": "HRB",
      "company_name": "Flugplatz Emden GmbH",
      "company_seat": "Emden",
      "former_amtsgericht": "Emden",
      "details": "12.01.2026 (Bekanntmachungsdatum)\n\nNiedersachsen Amtsgericht Aurich HRB 100002 früher Amtsgericht Emden\nEinreichung neuer Dokumente 12.01.2026 (Eintragungsdatum)\n\nFlugplatz Emden GmbH\nGesellschaft mit beschränkter Haftung\nEmden\n\nDie Liste der Mitglieder des Aufsichtsrats wurde beim Registergericht eingereicht."
    },
    {
      "date": "2026-01-12",
      "id": "142131",
      "original_text": "Registerbekanntmachung nach dem Umwandlungsgesetz\nNiedersachsen Amtsgericht Oldenburg (Oldenburg) HRA 3256\nOptiker Schulz GmbH & Co. Kommanditgesellschaft – Oldenburg",
      "type": "Registerbekanntmachung nach dem Umwandlungsgesetz",
      "state": "Niedersachsen",
      "amtsgericht": "Amtsgericht Oldenburg (Oldenburg)",
      "registernummer": "HRA 3256",
      "registerart": "HRA",
      "company_name": "Optiker Schulz GmbH & Co. Kommanditgesellschaft",
      "company_seat": "Oldenburg",
      "details": "12.01.2026 (Bekanntmachungsdatum)\n\nNiedersachsen Amtsgericht Oldenburg (Oldenburg) HRA 3256\nRegisterbekanntmachung nach dem Umwandlungsgesetz 12.01.2026 (Eintragungsdatum)\n\nOptiker Schulz GmbH & Co. Kommanditgesellschaft\nKommanditgesellschaft\nOldenburg\n\nDen Gläubigern der an der Abspaltung beteiligten Rechtsträger ist, wenn sie binnen sechs Monaten nach dem Tag, an dem die Eintragung der Abspaltung in das Register des Sitzes desjenigen Rechtsträgers, dessen Gläubiger sie sind, nach § 19 Abs. 3 UmwG als bekannt gemacht gilt, ihren Anspruch nach Grund und Höhe schriftlich anmelden, Sicherheit zu leisten, soweit sie nicht Befriedigung verlangen können. Dieses Recht steht den Gläubigern jedoch nur zu, wenn sie glaubhaft machen, dass durch die Abspaltung die Erfüllung der Forderung gefährdet wird."
    },
    {
      "date": "2026-01-12",
      "id": "142132",
      "original_text": "Registerbekanntmachung nach dem Umwandlungsgesetz\nNiedersachsen Amtsgericht Tostedt HRB 212004\nIndustriestraße 17 Zeven Grundbesitzgesellschaft mbH – Gyhum",
      "type": "Registerbekanntmachung nach dem Umwandlungsgesetz",
      "state": "Niedersachsen",
      "amtsgericht": "Amtsgericht Tostedt",
      "registernummer": "HRB 212004",
      "registerart": "HRB",
      "company_name": "Industriestraße 17 Zeven Grundbesitzgesellschaft mbH",
      "company_seat": "Gyhum",
      "details": "12.01.2026 (Bekanntmachungsdatum)\n\nNiedersachsen Amtsgericht Tostedt HRB 212004\nRegisterbekanntmachung nach dem Umwandlungsgesetz 12.01.2026 (Eintragungsdatum)\n\nIndustriestraße 17 Zeven Grundbesitzgesellschaft mbH\nGesellschaft mit beschränkter Haftung\nGyhum\n\nDen Gläubigern der an der formwechselnden Umwandlung beteiligten Rechtsträger ist, wenn sie binnen sechs Monaten nach dem Tag, an dem die Eintragung der Umwandlung in das Register des Sitzes desjenigen Rechtsträgers, dessen Gläubiger sie sind, nach § 19 Abs. 3 UmwG als bekannt gemacht gilt, ihren Anspruch nach Grund und Höhe schriftlich anmelden, Sicherheit zu leisten, soweit sie nicht Befriedigung verlangen können. Dieses Recht steht den Gläubigern jedoch nur zu, wenn sie glaubhaft machen, dass durch die formwechselnde Umwandlung die Erfüllung der Forderung gefährdet wird."
    },
    {
      "date": "2026-01-12",
      "id": "142133",
      "original_text": "Löschungsankündigung\nNiedersachsen Amtsgericht Osnabrück VR 201974\nSSV PuBlick e.V. – Bramsche",
      "type": "Löschungsankündigung",
      "state": "Niedersachsen",
      "amtsgericht": "Amtsgericht Osnabrück",
      "registernummer": "VR 201974",
      "registerart": "VR",
      "company_name": "SSV PuBlick e.V.",
      "company_seat": "Bramsche",
      "details": "12.01.2026 (Bekanntmachungsdatum)\n\nNiedersachsen Amtsgericht Osnabrück VR 201974\nLöschungsankündigung 12.01.2026 (Eintragungsdatum)\n\nSSV PuBlick e.V.\neingetragener Verein\nBramsche\n\nDas Registergericht beabsichtigt, den Verein von Amts wegen nach § 395 FamFG auf Grund Wegfalls sämtlicher Mitglieder zu löschen. Die Frist zur Erhebung eines Widerspruchs ist auf 1 Monat ab dieser Registerbekanntmachung festgesetzt."
    },
    {
      "date": "2026-01-12",
      "id": "142134",
      "original_text": "Registerbekanntmachung nach dem Umwandlungsgesetz\nNiedersachsen Amtsgericht Hildesheim HRB 100823 früher Amtsgericht Gifhorn\nWilhelm Stoll Maschinenfabrik GmbH – Lengede/Broistedt",
      "type": "Registerbekanntmachung nach dem Umwandlungsgesetz",
      "state": "Niedersachsen",
      "amtsgericht": "Amtsgericht Hildesheim",
      "registernummer": "HRB 100823",
      "registerart": "HRB",
      "company_name": "Wilhelm Stoll Maschinenfabrik GmbH",
      "company_seat": "Lengede/Broistedt",
      "former_amtsgericht": "Gifhorn",
      "details": "12.01.2026 (Bekanntmachungsdatum)\n\nNiedersachsen Amtsgericht Hildesheim HRB 100823 früher Amtsgericht Gifhorn\nRegisterbekanntmachung nach dem Umwandlungsgesetz 12.01.2026 (Eintragungsdatum)\n\nWilhelm Stoll Maschinenfabrik GmbH\nGesellschaft mit beschränkter Haftung\nLengede/Broistedt\n\nDen Gläubigern der an der Verschmelzung beteiligten Rechtsträger ist, wenn sie binnen sechs Monaten nach dem Tag, an dem die Eintragung der Verschmelzung in das Register des Sitzes desjenigen Rechtsträgers, dessen Gläubiger sie sind, nach § 19  Abs.  3 UmwG als bekannt gemacht gilt, ihren Anspruch nach Grund und Höhe schriftlich anmelden, Sicherheit zu leisten, soweit sie nicht Befriedigung verlangen können. Dieses Recht steht den Gläubigern jedoch nur zu, wenn sie glaubhaft machen, dass durch die Verschmelzung die Erfüllung der Forderung gefährdet wird."
    },
    {
      "date": "2026-01-12",
      "id": "142135",
      "original_text": "Registerbekanntmachung nach dem Umwandlungsgesetz\nNiedersachsen Amtsgericht Hildesheim HRB 101558 früher Amtsgericht Gifhorn\nMETEC METALLBAUTECHNIK GmbH – Lengede/Broistedt",
      "type": "Registerbekanntmachung nach dem Umwandlungsgesetz",
      "state": "Niedersachsen",
      "amtsgericht": "Amtsgericht Hildesheim",
      "registernummer": "HRB 101558",
      "registerart": "HRB",
      "company_name": "METEC METALLBAUTECHNIK GmbH",
      "company_seat": "Lengede/Broistedt",
      "former_amtsgericht": "Gifhorn",
      "details": "12.01.2026 (Bekanntmachungsdatum)\n\nNiedersachsen Amtsgericht Hildesheim HRB 101558 früher Amtsgericht Gifhorn\nRegisterbekanntmachung nach dem Umwandlungsgesetz 12.01.2026 (Eintragungsdatum)\n\nMETEC METALLBAUTECHNIK GmbH\nGesellschaft mit beschränkter Haftung\nLengede/Broistedt\n\nDen Gläubigern der an der Verschmelzung beteiligten Rechtsträger ist, wenn sie binnen sechs Monaten nach dem Tag, an dem die Eintragung der Verschmelzung in das Register des Sitzes desjenigen Rechtsträgers, dessen Gläubiger sie sind, nach § 19  Abs.  3 UmwG als bekannt gemacht gilt, ihren Anspruch nach Grund und Höhe schriftlich anmelden, Sicherheit zu leisten, soweit sie nicht Befriedigung verlangen können. Dieses Recht steht den Gläubigern jedoch nur zu, wenn sie glaubhaft machen, dass durch die Verschmelzung die Erfüllung der Forderung gefährdet wird."
    },
    {
      "date": "2026-01-12",
      "id": "142136",
      "original_text": "Registerbekanntmachung nach dem Umwandlungsgesetz\nNiedersachsen Amtsgericht Tostedt GsR 211\nIndustriestraße 17 Zeven GmbH & Co. eGbR – Gyhum",
      "type": "Registerbekanntmachung nach dem Umwandlungsgesetz",
      "state": "Niedersachsen",
      "amtsgericht": "Amtsgericht Tostedt",
      "registernummer": "GsR 211",
      "registerart": "GsR",
      "company_name": "Industriestraße 17 Zeven GmbH & Co. eGbR",
      "company_seat": "Gyhum",
      "details": "12.01.2026 (Bekanntmachungsdatum)\n\nNiedersachsen Amtsgericht Tostedt GsR 211\nRegisterbekanntmachung nach dem Umwandlungsgesetz 12.01.2026 (Eintragungsdatum)\n\nIndustriestraße 17 Zeven GmbH & Co. eGbR\nGesellschaft bürgerlichen Rechts\nGyhum\n\nDen Gläubigern der an der formwechselnden Umwandlung beteiligten Rechtsträger ist, wenn sie binnen sechs Monaten nach dem Tag, an dem die Eintragung der Umwandlung in das Register des Sitzes desjenigen Rechtsträgers, dessen Gläubiger sie sind, nach § 19 Abs. 3 UmwG als bekannt gemacht gilt, ihren Anspruch nach Grund und Höhe schriftlich anmelden, Sicherheit zu leisten, soweit sie nicht Befriedigung verlangen können. Dieses Recht steht den Gläubigern jedoch nur zu, wenn sie glaubhaft machen, dass durch die formwechselnde Umwandlung die Erfüllung der Forderung gefährdet wird."
    },
    {
      "date": "2026-01-12",
      "id": "142137",
      "original_text": "Einreichung neuer Dokumente\nNiedersachsen Amtsgericht Hannover HRB 50068\nLandvolkdienste GmbH Gesellschaft zur Förderung berufsständischer Interessen – Hannover",
      "type": "Einreichung neuer Dokumente",
      "state": "Niedersachsen",
      "amtsgericht": "Amtsgericht Hannover",
      "registernummer": "HRB 50068",
      "registerart": "HRB",
      "company_name": "Landvolkdienste GmbH Gesellschaft zur Förderung berufsständischer Interessen",
      "company_seat": "Hannover",
      "details": "12.01.2026 (Bekanntmachungsdatum)\n\nNiedersachsen Amtsgericht Hannover HRB 50068\nEinreichung neuer Dokumente\n\nLandvolkdienste GmbH Gesellschaft zur Förderung berufsständischer Interessen\nGesellschaft mit beschränkter Haftung\nHannover\n\nDie Liste der Mitglieder des Aufsichtsrats wurde beim Registergericht eingereicht."
    },
    {
      "date": "2026-01-12",
      "id": "142138",
      "original_text": "Registerbekanntmachung nach dem Umwandlungsgesetz\nNiedersachsen Amtsgericht Oldenburg (Oldenburg) HRA 150765 früher Amtsgericht Cloppenburg\nHörgeräte Schulz GmbH & Co. KG – Friesoythe",
      "type": "Registerbekanntmachung nach dem Umwandlungsgesetz",
      "state": "Niedersachsen",
      "amtsgericht": "Amtsgericht Oldenburg (Oldenburg)",
      "registernummer": "HRA 150765",
      "registerart": "HRA",
      "company_name": "Hörgeräte Schulz GmbH & Co. KG",
      "company_seat": "Friesoythe",
      "former_amtsgericht": "Cloppenburg",
      "details": "12.01.2026 (Bekanntmachungsdatum)\n\nNiedersachsen Amtsgericht Oldenburg (Oldenburg) HRA 150765 früher Amtsgericht Cloppenburg\nRegisterbekanntmachung nach dem Umwandlungsgesetz 12.01.2026 (Eintragungsdatum)\n\nHörgeräte Schulz GmbH & Co. KG\nKommanditgesellschaft\nFriesoythe\n\nDen Gläubigern der an der Abspaltung beteiligten Rechtsträger ist, wenn sie binnen sechs Monaten nach dem Tag, an dem die Eintragung der Abspaltung in das Register des Sitzes desjenigen Rechtsträgers, dessen Gläubiger sie sind, nach § 19 Abs. 3 UmwG als bekannt gemacht gilt, ihren Anspruch nach Grund und Höhe schriftlich anmelden, Sicherheit zu leisten, soweit sie nicht Befriedigung verlangen können. Dieses Recht steht den Gläubigern jedoch nur zu, wenn sie glaubhaft machen, dass durch die Abspaltung die Erfüllung der Forderung gefährdet wird."
    },
    {
      "date": "2026-01-12",
      "id": "142139",
      "original_text": "Einreichung neuer Dokumente\nNordrhein-Westfalen Amtsgericht Kleve HRB 1414\nKKA Kreis-Kleve-Abfallwirtschaftsgesellschaft mbH – Uedem",
      "type": "Einreichung neuer Dokumente",
      "state": "Nordrhein-Westfalen",
      "amtsgericht": "Amtsgericht Kleve",
      "registernummer": "HRB 1414",
      "registerart": "HRB",
      "company_name": "KKA Kreis-Kleve-Abfallwirtschaftsgesellschaft mbH",
      "company_seat": "Uedem",
      "details": "12.01.2026 (Bekanntmachungsdatum)\n\nNordrhein-Westfalen Amtsgericht Kleve HRB 1414\nEinreichung neuer Dokumente\n\nKKA Kreis-Kleve-Abfallwirtschaftsgesellschaft mbH\nGesellschaft mit beschränkter Haftung\nUedem\n\nDem Registergericht ist eine neue Liste der Mitglieder des Aufsichtsrates eingereicht worden."
    },
    {
      "date": "2026-01-12",
      "id": "142140",
      "original_text": "Einreichung neuer Dokumente\nNordrhein-Westfalen Amtsgericht Duisburg HRB 180\nDuisburger Hafen Aktiengesellschaft – Duisburg",
      "type": "Einreichung neuer Dokumente",
      "state": "Nordrhein-Westfalen",
      "amtsgericht": "Amtsgericht Duisburg",
      "registernummer": "HRB 180",
      "registerart": "HRB",
      "company_name": "Duisburger Hafen Aktiengesellschaft",
      "company_seat": "Duisburg",
      "details": "12.01.2026 (Bekanntmachungsdatum)\n\nNordrhein-Westfalen Amtsgericht Duisburg HRB 180\nEinreichung neuer Dokumente\n\nDuisburger Hafen Aktiengesellschaft\nAktiengesellschaft\nDuisburg\n\nDem Registergericht ist eine Liste der Mitglieder des Aufsichtsrates eingereicht worden."
    },
    {
      "date": "2026-01-12",
      "id": "142141",
      "original_text": "Löschungsankündigung\nNordrhein-Westfalen Amtsgericht Köln HRB 51884\nETC Treuhand- und Steuerberatungsgesellschaft mbH – Köln",
      "type": "Löschungsankündigung",
      "state": "Nordrhein-Westfalen",
      "amtsgericht": "Amtsgericht Köln",
      "registernummer": "HRB 51884",
      "registerart": "HRB",
      "company_name": "ETC Treuhand- und Steuerberatungsgesellschaft mbH",
      "company_seat": "Köln",
      "details": "12.01.2026 (Bekanntmachungsdatum)\n\nNordrhein-Westfalen Amtsgericht Köln HRB 51884\nLöschungsankündigung\n\nETC Treuhand- und Steuerberatungsgesellschaft mbH\nGesellschaft mit beschränkter Haftung\nKöln\n\nDas Registergericht beabsichtigt die Gesellschaft von Amts wegen nach § 394 FamFG zu löschen. Die Frist zur Erhebung eines Widerspruchs ist auf einen Monat festgesetzt."
    },
    {
      "date": "2026-01-12",
      "id": "142142",
      "original_text": "Einreichung neuer Dokumente\nNordrhein-Westfalen Amtsgericht Siegburg HRB 1816\nSchönhofer Sales and Engineering GmbH – Siegburg",
      "type": "Einreichung neuer Dokumente",
      "state": "Nordrhein-Westfalen",
      "amtsgericht": "Amtsgericht Siegburg",
      "registernummer": "HRB 1816",
      "registerart": "HRB",
      "company_name": "Schönhofer Sales and Engineering GmbH",
      "company_seat": "Siegburg",
      "details": "12.01.2026 (Bekanntmachungsdatum)\n\nNordrhein-Westfalen Amtsgericht Siegburg HRB 1816\nEinreichung neuer Dokumente\n\nSchönhofer Sales and Engineering GmbH\nGesellschaft mit beschränkter Haftung\nSiegburg\n\nDem Registergericht ist eine Liste der Mitglieder des Aufsichtsrates eingereicht worden."
    },
    {
      "date": "2026-01-12",
      "id": "142143",
      "original_text": "Registerbekanntmachung nach dem Umwandlungsgesetz\nNordrhein-Westfalen Amtsgericht Düsseldorf HRA 26033\nWattner SunAsset Solarkraftwerk 006 GmbH & Co. KG – Monheim am Rhein",
      "type": "Registerbekanntmachung nach dem Umwandlungsgesetz",
      "state": "Nordrhein-Westfalen",
      "amtsgericht": "Amtsgericht Düsseldorf",
      "registernummer": "HRA 26033",
      "registerart": "HRA",
      "company_name": "Wattner SunAsset Solarkraftwerk 006 GmbH & Co. KG",
      "company_seat": "Monheim am Rhein",
      "details": "12.01.2026 (Bekanntmachungsdatum)\n\nNordrhein-Westfalen Amtsgericht Düsseldorf HRA 26033\nRegisterbekanntmachung nach dem Umwandlungsgesetz 12.01.2026 (Eintragungsdatum)\n\nWattner SunAsset Solarkraftwerk 006 GmbH & Co. KG\nKommanditgesellschaft\nMonheim am Rhein\n\nDen Gläubigern der an der Verschmelzung beteiligten Rechtsträger ist, wenn sie binnen sechs Monaten nach dem Tag, an dem die Eintragung der Verschmelzung in das Register des Sitzes desjenigen Rechtsträgers, dessen Gläubiger sie sind, nach § 19 Absatz 3 UmwG als bekanntgemacht gilt, ihren Anspruch nach Grund und Höhe schriftlich anmelden, Sicherheit zu leisten, soweit sie nicht Befriedigung verlangen können. Dieses Recht steht den Gläubigern jedoch nur zu, wenn sie glaubhaft machen, dass durch die Verschmelzung die Erfüllung ihrer Forderung gefährdet wird."
    },
    {
      "date": "2026-01-12",
      "id": "142144",
      "original_text": "Einreichung neuer Dokumente\nNordrhein-Westfalen Amtsgericht Duisburg HRB 15074\nSWB - Dienstleistungs-, Bauträger- und Finanzservicegesellschaft mbH – Mülheim an der Ruhr",
      "type": "Einreichung neuer Dokumente",
      "state": "Nordrhein-Westfalen",
      "amtsgericht": "Amtsgericht Duisburg",
      "registernummer": "HRB 15074",
      "registerart": "HRB",
      "company_name": "SWB - Dienstleistungs-, Bauträger- und Finanzservicegesellschaft mbH",
      "company_seat": "Mülheim an der Ruhr",
      "details": "12.01.2026 (Bekanntmachungsdatum)\n\nNordrhein-Westfalen Amtsgericht Duisburg HRB 15074\nEinreichung neuer Dokumente 12.01.2026 (Eintragungsdatum)\n\nSWB - Dienstleistungs-, Bauträger- und Finanzservicegesellschaft mbH\nGesellschaft mit beschränkter Haftung\nMülheim an der Ruhr\n\nDem Registergericht ist eine neue Liste der Mitglieder des Aufsichtsrates eingereicht worden."
    },
    {
      "date": "2026-01-12",
      "id": "142145",
      "original_text": "Registerbekanntmachung nach dem Umwandlungsgesetz\nNordrhein-Westfalen Amtsgericht Düsseldorf HRB 87138\nCompanion 67 Visuelle Kommunikation GmbH – Düsseldorf",
      "type": "Registerbekanntmachung nach dem Umwandlungsgesetz",
      "state": "Nordrhein-Westfalen",
      "amtsgericht": "Amtsgericht Düsseldorf",
      "registernummer": "HRB 87138",
      "registerart": "HRB",
      "company_name": "Companion 67 Visuelle Kommunikation GmbH",
      "company_seat": "Düsseldorf",
      "details": "12.01.2026 (Bekanntmachungsdatum)\n\nNordrhein-Westfalen Amtsgericht Düsseldorf HRB 87138\nRegisterbekanntmachung nach dem Umwandlungsgesetz 12.01.2026 (Eintragungsdatum)\n\nCompanion 67 Visuelle Kommunikation GmbH\nGesellschaft mit beschränkter Haftung\nDüsseldorf\n\nDen Gläubigern der an der Verschmelzung beteiligten Rechtsträger ist, wenn sie binnen sechs Monaten nach dem Tag, an dem die Eintragung der Verschmelzung in das Register des Sitzes desjenigen Rechtsträgers, dessen Gläubiger sie sind, nach § 19 Absatz 3 UmwG als bekanntgemacht gilt, ihren Anspruch nach Grund und Höhe schriftlich anmelden, Sicherheit zu leisten, soweit sie nicht Befriedigung verlangen können. Dieses Recht steht den Gläubigern jedoch nur zu, wenn sie glaubhaft machen, dass durch die Verschmelzung die Erfüllung ihrer Forderung gefährdet wird."
    },
    {
      "date": "2026-01-12",
      "id": "142146",
      "original_text": "Einreichung neuer Dokumente\nNordrhein-Westfalen Amtsgericht Bonn HRB 15241\nDeutsche Telekom Security GmbH – Bonn",
      "type": "Einreichung neuer Dokumente",
      "state": "Nordrhein-Westfalen",
      "amtsgericht": "Amtsgericht Bonn",
      "registernummer": "HRB 15241",
      "registerart": "HRB",
      "company_name": "Deutsche Telekom Security GmbH",
      "company_seat": "Bonn",
      "details": "12.01.2026 (Bekanntmachungsdatum)\n\nNordrhein-Westfalen Amtsgericht Bonn HRB 15241\nEinreichung neuer Dokumente\n\nDeutsche Telekom Security GmbH\nGesellschaft mit beschränkter Haftung\nBonn\n\nDem Registergericht ist eine neue Liste der Mitglieder des Aufsichtsrates eingereicht worden."
    },
    {
      "date": "2026-01-12",
      "id": "142147",
      "original_text": "Registerbekanntmachung nach dem Umwandlungsgesetz\nNordrhein-Westfalen Amtsgericht Düsseldorf HRB 30508\nJung Produktion GmbH – Düsseldorf",
      "type": "Registerbekanntmachung nach dem Umwandlungsgesetz",
      "state": "Nordrhein-Westfalen",
      "amtsgericht": "Amtsgericht Düsseldorf",
      "registernummer": "HRB 30508",
      "registerart": "HRB",
      "company_name": "Jung Produktion GmbH",
      "company_seat": "Düsseldorf",
      "details": "12.01.2026 (Bekanntmachungsdatum)\n\nNordrhein-Westfalen Amtsgericht Düsseldorf HRB 30508\nRegisterbekanntmachung nach dem Umwandlungsgesetz 12.01.2026 (Eintragungsdatum)\n\nJung Produktion GmbH\nGesellschaft mit beschränkter Haftung\nDüsseldorf\n\nDen Gläubigern der an der Verschmelzung beteiligten Rechtsträger ist, wenn sie binnen sechs Monaten nach dem Tag, an dem die Eintragung der Verschmelzung in das Register des Sitzes desjenigen Rechtsträgers, dessen Gläubiger sie sind, nach § 19 Absatz 3 UmwG als bekanntgemacht gilt, ihren Anspruch nach Grund und Höhe schriftlich anmelden, Sicherheit zu leisten, soweit sie nicht Befriedigung verlangen können. Dieses Recht steht den Gläubigern jedoch nur zu, wenn sie glaubhaft machen, dass durch die Verschmelzung die Erfüllung ihrer Forderung gefährdet wird."
    },
    {
      "date": "2026-01-12",
      "id": "142148",
      "original_text": "Registerbekanntmachung nach dem Umwandlungsgesetz\nNordrhein-Westfalen Amtsgericht Düsseldorf HRB 107601\nYamaha Motor eBike Systems GmbH – Düsseldorf",
      "type": "Registerbekanntmachung nach dem Umwandlungsgesetz",
      "state": "Nordrhein-Westfalen",
      "amtsgericht": "Amtsgericht Düsseldorf",
      "registernummer": "HRB 107601",
      "registerart": "HRB",
      "company_name": "Yamaha Motor eBike Systems GmbH",
      "company_seat": "Düsseldorf",
      "details": "12.01.2026 (Bekanntmachungsdatum)\n\nNordrhein-Westfalen Amtsgericht Düsseldorf HRB 107601\nRegisterbekanntmachung nach dem Umwandlungsgesetz 12.01.2026 (Eintragungsdatum)\n\nYamaha Motor eBike Systems GmbH\nGesellschaft mit beschränkter Haftung\nDüsseldorf\n\nDen Gläubigern der an der Verschmelzung beteiligten Rechtsträger ist, wenn sie binnen sechs Monaten nach dem Tag, an dem die Eintragung der Verschmelzung in das Register des Sitzes desjenigen Rechtsträgers, dessen Gläubiger sie sind, nach § 19 Absatz 3 UmwG als bekanntgemacht gilt, ihren Anspruch nach Grund und Höhe schriftlich anmelden, Sicherheit zu leisten, soweit sie nicht Befriedigung verlangen können. Dieses Recht steht den Gläubigern jedoch nur zu, wenn sie glaubhaft machen, dass durch die Verschmelzung die Erfüllung ihrer Forderung gefährdet wird."
    },
    {
      "date": "2026-01-12",
      "id": "142149",
      "original_text": "Sonstige Registerbekanntmachung\nNordrhein-Westfalen Amtsgericht Düsseldorf HRB 39859\nSCHOLZ & FRIENDS Düsseldorf GmbH – Düsseldorf",
      "type": "Sonstige Registerbekanntmachung",
      "state": "Nordrhein-Westfalen",
      "amtsgericht": "Amtsgericht Düsseldorf",
      "registernummer": "HRB 39859",
      "registerart": "HRB",
      "company_name": "SCHOLZ & FRIENDS Düsseldorf GmbH",
      "company_seat": "Düsseldorf",
      "details": "12.01.2026 (Bekanntmachungsdatum)\n\nNordrhein-Westfalen Amtsgericht Düsseldorf HRB 39859\nSonstige Registerbekanntmachung 12.01.2026 (Eintragungsdatum)\n\nSCHOLZ & FRIENDS Düsseldorf GmbH\nGesellschaft mit beschränkter Haftung\nDüsseldorf\n\nAls nicht eingetragen wird veröffentlicht: Den Gläubigern der Gesellschaft, deren Forderungen begründet worden sind bevor die Eintragung der Beendigung des Gewinnabführungsvertrages  in das Handelsregister nach § 10 des Handelsgesetzbuches als bekanntgemacht gilt, hat der andere Vertragsteil Sicherheit zu leisten, wenn sie sich binnen sechs Monaten nach der Bekanntmachung der Eintragung zu diesem Zweck bei ihm melden."
    },
    {
      "date": "2026-01-12",
      "id": "142150",
      "original_text": "Löschungsankündigung\nNordrhein-Westfalen Amtsgericht Wuppertal HRB 25934\nÖmer Aybak - Meshur Adiyaman Cig Köftecisi GmbH – Solingen",
      "type": "Löschungsankündigung",
      "state": "Nordrhein-Westfalen",
      "amtsgericht": "Amtsgericht Wuppertal",
      "registernummer": "HRB 25934",
      "registerart": "HRB",
      "company_name": "Ömer Aybak - Meshur Adiyaman Cig Köftecisi GmbH",
      "company_seat": "Solingen",
      "details": "12.01.2026 (Bekanntmachungsdatum)\n\nNordrhein-Westfalen Amtsgericht Wuppertal HRB 25934\nLöschungsankündigung\n\nÖmer Aybak - Meshur Adiyaman Cig Köftecisi GmbH\nGesellschaft mit beschränkter Haftung\nSolingen\n\nDas Registergericht beabsichtigt die Gesellschaft von Amts wegen nach § 394 FamFG zu löschen. Die Frist zur Erhebung eines Widerspruchs ist auf einen Monat festgesetzt."
    },
    {
      "date": "2026-01-12",
      "id": "142151",
      "original_text": "Registerbekanntmachung nach dem Umwandlungsgesetz\nNordrhein-Westfalen Amtsgericht Düsseldorf HRB 40316\nThe return of the sun AG – Hilden",
      "type": "Registerbekanntmachung nach dem Umwandlungsgesetz",
      "state": "Nordrhein-Westfalen",
      "amtsgericht": "Amtsgericht Düsseldorf",
      "registernummer": "HRB 40316",
      "registerart": "HRB",
      "company_name": "The return of the sun AG",
      "company_seat": "Hilden",
      "details": "12.01.2026 (Bekanntmachungsdatum)\n\nNordrhein-Westfalen Amtsgericht Düsseldorf HRB 40316\nRegisterbekanntmachung nach dem Umwandlungsgesetz 12.01.2026 (Eintragungsdatum)\n\nThe return of the sun AG\nAktiengesellschaft\nHilden\n\nDen Gläubigern der an der formwechselnden Umwandlung beteiligten Rechtsträger ist, wenn sie binnen sechs Monaten nach dem Tag, an dem die Eintragung der formwechselnden Umwandlung in das Register des Sitzes desjenigen Rechtsträgers, dessen Gläubiger sie sind, nach § 19 Absatz 3 UmwG als bekanntgemacht gilt, ihren Anspruch nach Grund und Höhe schriftlich anmelden, Sicherheit zu leisten, soweit sie nicht Befriedigung verlangen können. Dieses Recht steht den Gläubigern jedoch nur zu, wenn sie glaubhaft machen, dass durch die formwechselnden Umwandlung die Erfüllung ihrer Forderung gefährdet wird."
    },
    {
      "date": "2026-01-12",
      "id": "142152",
      "original_text": "Löschungsankündigung\nNordrhein-Westfalen Amtsgericht Hamm HRB 10071\nAround UG (haftungsbeschränkt) – Bergkamen",
      "type": "Löschungsankündigung",
      "state": "Nordrhein-Westfalen",
      "amtsgericht": "Amtsgericht Hamm",
      "registernummer": "HRB 10071",
      "registerart": "HRB",
      "company_name": "Around UG (haftungsbeschränkt)",
      "company_seat": "Bergkamen",
      "details": "12.01.2026 (Bekanntmachungsdatum)\n\nNordrhein-Westfalen Amtsgericht Hamm HRB 10071\nLöschungsankündigung\n\nAround UG (haftungsbeschränkt)\nGesellschaft mit beschränkter Haftung\nBergkamen\n\nDas Registergericht beabsichtigt die Gesellschaft von Amts wegen nach § 394 FamFG zu löschen. Die Frist zur Erhebung eines Widerspruchs ist auf drei Monate festgesetzt."
    },
    {
      "date": "2026-01-12",
      "id": "142153",
      "original_text": "Einreichung neuer Dokumente\nNordrhein-Westfalen Amtsgericht Köln HRB 72988\nabcbank GmbH – Köln",
      "type": "Einreichung neuer Dokumente",
      "state": "Nordrhein-Westfalen",
      "amtsgericht": "Amtsgericht Köln",
      "registernummer": "HRB 72988",
      "registerart": "HRB",
      "company_name": "abcbank GmbH",
      "company_seat": "Köln",
      "details": "12.01.2026 (Bekanntmachungsdatum)\n\nNordrhein-Westfalen Amtsgericht Köln HRB 72988\nEinreichung neuer Dokumente 12.01.2026 (Eintragungsdatum)\n\nabcbank GmbH\nGesellschaft mit beschränkter Haftung\nKöln\n\nDem Registergericht ist eine neue Liste der Mitglieder des Aufsichtsrates eingereicht worden."
    },
    {
      "date": "2026-01-12",
      "id": "142154",
      "original_text": "Einreichung neuer Dokumente\nNordrhein-Westfalen Amtsgericht Hagen HRB 58\nha.ge.we Hagener Gemeinnützige Wohnungsgesellschaft mbH – Hagen",
      "type": "Einreichung neuer Dokumente",
      "state": "Nordrhein-Westfalen",
      "amtsgericht": "Amtsgericht Hagen",
      "registernummer": "HRB 58",
      "registerart": "HRB",
      "company_name": "ha.ge.we Hagener Gemeinnützige Wohnungsgesellschaft mbH",
      "company_seat": "Hagen",
      "details": "12.01.2026 (Bekanntmachungsdatum)\n\nNordrhein-Westfalen Amtsgericht Hagen HRB 58\nEinreichung neuer Dokumente\n\nha.ge.we Hagener Gemeinnützige Wohnungsgesellschaft mbH\nGesellschaft mit beschränkter Haftung\nHagen\n\nDem Registergericht ist eine Liste der Mitglieder des Aufsichtsrates eingereicht worden."
    },
    {
      "date": "2026-01-12",
      "id": "142155",
      "original_text": "Sonstige Registerbekanntmachung\nNordrhein-Westfalen Amtsgericht Köln HRB 29877\nDr. Clarenz - Dr. Zacharias GmbH Wirtschaftsprüfungsgesellschaft – Köln",
      "type": "Sonstige Registerbekanntmachung",
      "state": "Nordrhein-Westfalen",
      "amtsgericht": "Amtsgericht Köln",
      "registernummer": "HRB 29877",
      "registerart": "HRB",
      "company_name": "Dr. Clarenz - Dr. Zacharias GmbH Wirtschaftsprüfungsgesellschaft",
      "company_seat": "Köln",
      "details": "12.01.2026 (Bekanntmachungsdatum)\n\nNordrhein-Westfalen Amtsgericht Köln HRB 29877\nSonstige Registerbekanntmachung 12.01.2026 (Eintragungsdatum)\n\nDr. Clarenz - Dr. Zacharias GmbH Wirtschaftsprüfungsgesellschaft\nGesellschaft mit beschränkter Haftung\nKöln\n\nAls nicht eingetragen wird veröffentlicht: Den Gläubigern der Gesellschaft, deren Forderungen begründet worden sind bevor die Eintragung der Beendigung des Gewinnabführungsvertrages  in das Handelsregister nach § 10 des Handelsgesetzbuches als bekanntgemacht gilt, hat der andere Vertragsteil Sicherheit zu leisten, wenn sie sich binnen sechs Monaten nach der Bekanntmachung der Eintragung zu diesem Zweck bei ihm melden."
    },
    {
      "date": "2026-01-12",
      "id": "142156",
      "original_text": "Sonstige Registerbekanntmachung\nNordrhein-Westfalen Amtsgericht Köln HRB 58282\nFederal-Mogul Betriebsgrundstücke Burscheid GmbH – Burscheid",
      "type": "Sonstige Registerbekanntmachung",
      "state": "Nordrhein-Westfalen",
      "amtsgericht": "Amtsgericht Köln",
      "registernummer": "HRB 58282",
      "registerart": "HRB",
      "company_name": "Federal-Mogul Betriebsgrundstücke Burscheid GmbH",
      "company_seat": "Burscheid",
      "details": "12.01.2026 (Bekanntmachungsdatum)\n\nNordrhein-Westfalen Amtsgericht Köln HRB 58282\nSonstige Registerbekanntmachung 12.01.2026 (Eintragungsdatum)\n\nFederal-Mogul Betriebsgrundstücke Burscheid GmbH\nGesellschaft mit beschränkter Haftung\nBurscheid\n\nAls nicht eingetragen wird veröffentlicht: Den Gläubigern der Gesellschaft, deren Forderungen begründet worden sind bevor die Eintragung der Beendigung des Beherrschungs- und Gewinnabführungsvertrages  in das Handelsregister nach § 10 des Handelsgesetzbuches als bekanntgemacht gilt, hat der andere Vertragsteil Sicherheit zu leisten, wenn sie sich binnen sechs Monaten nach der Bekanntmachung der Eintragung zu diesem Zweck bei ihm melden."
    },
    {
      "date": "2026-01-12",
      "id": "142157",
      "original_text": "Sonstige Registerbekanntmachung\nNordrhein-Westfalen Amtsgericht Düsseldorf HRB 39138\nHydro-Konzept Pflanzenservice GmbH – Ratingen",
      "type": "Sonstige Registerbekanntmachung",
      "state": "Nordrhein-Westfalen",
      "amtsgericht": "Amtsgericht Düsseldorf",
      "registernummer": "HRB 39138",
      "registerart": "HRB",
      "company_name": "Hydro-Konzept Pflanzenservice GmbH",
      "company_seat": "Ratingen",
      "details": "12.01.2026 (Bekanntmachungsdatum)\n\nNordrhein-Westfalen Amtsgericht Düsseldorf HRB 39138\nSonstige Registerbekanntmachung 12.01.2026 (Eintragungsdatum)\n\nHydro-Konzept Pflanzenservice GmbH\nGesellschaft mit beschränkter Haftung\nRatingen\n\nAls nicht eingetragen wird veröffentlicht: Den Gläubigern der Gesellschaft, deren Forderungen begründet worden sind bevor die Eintragung der Beendigung des Ergebnisabführungsvertrages  in das Handelsregister nach § 10 des Handelsgesetzbuches als bekanntgemacht gilt, hat der andere Vertragsteil Sicherheit zu leisten, wenn sie sich binnen sechs Monaten nach der Bekanntmachung der Eintragung zu diesem Zweck bei ihm melden."
    },
    {
      "date": "2026-01-12",
      "id": "142158",
      "original_text": "Löschungsankündigung\nNordrhein-Westfalen Amtsgericht Düsseldorf HRB 84646\nKWK Bakery Equipment GmbH – Düsseldorf",
      "type": "Löschungsankündigung",
      "state": "Nordrhein-Westfalen",
      "amtsgericht": "Amtsgericht Düsseldorf",
      "registernummer": "HRB 84646",
      "registerart": "HRB",
      "company_name": "KWK Bakery Equipment GmbH",
      "company_seat": "Düsseldorf",
      "details": "12.01.2026 (Bekanntmachungsdatum)\n\nNordrhein-Westfalen Amtsgericht Düsseldorf HRB 84646\nLöschungsankündigung\n\nKWK Bakery Equipment GmbH\nGesellschaft mit beschränkter Haftung\nDüsseldorf\n\nDas Registergericht beabsichtigt die Gesellschaft von Amts wegen nach § 394 Abs. 1 FamFG zu löschen. Die Frist zur Erhebung eines Widerspruchs ist auf einen Monat festgesetzt.\n\nRechtsbehelfsbelehrung:\nDas Widerspruchsrecht steht jedem zu, der an der Unterlassung der Löschung ein berechtigtes Interesse hat. Der Widerspruch ist bei dem Amtsgericht Düsseldorf -Registergericht-, Werdener Straße 1, 40227 Düsseldorf schriftlich in deutscher Sprache oder zur Niederschrift der Geschäftsstelle einzulegen. Der Widerspruch kann auch zur Niederschrift der Geschäftsstelle eines jeden Amtsgerichtes abgegeben werden. Die Einlegung ist auch durch Übertragung eines elektronischen Dokuments an die elektronische Poststelle des Gerichts möglich. Das elektronische Dokument muss für die Bearbeitung durch das Gericht geeignet und mit einer qualifizierten elektronischen Signatur der verantwortenden Person versehen sein oder von der verantwortenden Person signiert und auf einem sicheren Übermittlungsweg gemäß § 130a ZPO nach näherer Maßgabe der Verordnung über die technischen Rahmenbedingungen des elektronischen Rechtsverkehrs und über das besondere elektronische Behördenpostfach (BGBl. I, S.3803) eingereicht werden. Weitere Informationen erhalten Sie auf der Internetseite www.justiz.de.\nDer Widerspruch muss spätestens innerhalb der gesetzten Frist nach dem Datum der Bekanntmachung der Löschungsankündigung bei dem Amtsgericht - Registergericht - Düsseldorf eingegangen sein.  Dies gilt auch dann, wenn der Widerspruch zur Niederschrift der Geschäftsstelle eines anderen Amtsgerichtes abgegeben wurde. Die Frist beginnt mit dem Tage der Bekanntmachung der Löschungsankündigung in dem für die Bekanntmachung der Eintragungen in das Handelsregister bestimmten elektronischen Informations- und Kommunikationssystem nach § 10 des Handelsgesetzbuches. Fällt das Ende der Frist auf einen Sonntag, einen allgemeinen Feiertag oder Sonnabend, so endet die Frist mit Ablauf des nächsten Werktages.\nDer Widerspruch muss die Bezeichnung der angefochtenen Löschungsankündigung sowie die Erklärung enthalten, dass Widerspruch gegen diese Löschungsankündigung eingelegt wird. Er ist zu unterzeichnen und soll begründet werden."
    },
    {
      "date": "2026-01-12",
      "id": "142159",
      "original_text": "Löschungsankündigung\nNordrhein-Westfalen Amtsgericht Aachen HRB 18022\nWeltladen Aachen Fachgeschäft des Fairen Handels UG (haftungsbeschränkt) – Aachen",
      "type": "Löschungsankündigung",
      "state": "Nordrhein-Westfalen",
      "amtsgericht": "Amtsgericht Aachen",
      "registernummer": "HRB 18022",
      "registerart": "HRB",
      "company_name": "Weltladen Aachen Fachgeschäft des Fairen Handels UG (haftungsbeschränkt)",
      "company_seat": "Aachen",
      "details": "12.01.2026 (Bekanntmachungsdatum)\n\nNordrhein-Westfalen Amtsgericht Aachen HRB 18022\nLöschungsankündigung\n\nWeltladen Aachen Fachgeschäft des Fairen Handels UG (haftungsbeschränkt)\nGesellschaft mit beschränkter Haftung\nAachen\n\nDas Registergericht beabsichtigt, von Amts wegen die Gesellschaft wegen Vermögenslosigkeit nach § 394 FamFG zu löschen, weil das Insolvenzverfahren Amtsgericht Aachen (Az.: 92 IN 151/23) beendet und Vermögen der Gesellschaft nicht mehr erkennbar ist.\n\nZur Geltendmachung des Widerspruchs gegen die beabsichtigte Löschung wird hiermit eine Frist von einem Monat ab Veröffentlichung dieser Ankündigung bestimmt.\n\nRechtsbehelfsbelehrung:\n\nGegen diese Verfügung kann Widerspruch eingelegt werden. Zum Widerspruch ist jeder berechtigt, der an der Unterlassung der Löschung ein berechtigtes Interesse hat.\n\nDer Widerspruch ist bei dem Amtsgericht Aachen, Adalbertsteinweg 92, 52070 Aachen schriftlich in deutscher Sprache oder zur Niederschrift der Geschäftsstelle einzulegen. Der Widerspruch kann auch zur Niederschrift der Geschäftsstelle eines jeden Amtsgerichtes abgegeben werden.\n\nDer Widerspruch muss spätestens innerhalb der gesetzten Frist nach der Bekanntgabe der Verfügung bei dem Amtsgericht Aachen eingegangen sein. Dies gilt auch dann, wenn der Widerspruch zur Niederschrift der Geschäftsstelle eines anderen Amtsgerichtes abgegeben wurde. Die Frist beginnt mit der Bekanntgabe der Verfügung durch Veröffentlichung. Fällt das Ende der Frist auf einen Sonntag, einen allgemeinen Feiertag oder Sonnabend, so endet die Frist mit Ablauf des nächsten Werktages.\n\nDer Widerspruch muss die Bezeichnung der angefochtenen Verfügung sowie die Erklärung enthalten, dass Widerspruch gegen diese Verfügung eingelegt wird. Er ist zu unterzeichnen und soll begründet werden.\n\nDie Einlegung ist auch durch Übertragung eines elektronischen Dokuments an die elektronische Poststelle des Gerichts möglich. Das elektronische Dokument muss für die Bearbeitung durch das Gericht geeignet und mit einer qualifizierten elektronischen Signatur der verantwortenden Person versehen sein oder von der verantwortenden Person signiert und auf einem sicheren Übermittlungsweg gemäß § 130 a ZPO nach näherer Maßgabe der Verordnung über die technischen Rahmenbedingungen des elektronischen Rechtsverkehrs und über das besondere elektronische Behördenpostfach (BGBl. I, S. 3803) eingereicht werden. Weitere Informationen erhalten Sie auf der Internetseite www.justiz.de."
    },
    {
      "date": "2026-01-12",
      "id": "142160",
      "original_text": "Sonstige Registerbekanntmachung\nThüringen Amtsgericht Jena HRB 110095\nLASA-Zahnriementechnik GmbH – Gotha",
      "type": "Sonstige Registerbekanntmachung",
      "state": "Thüringen",
      "amtsgericht": "Amtsgericht Jena",
      "registernummer": "HRB 110095",
      "registerart": "HRB",
      "company_name": "LASA-Zahnriementechnik GmbH",
      "company_seat": "Gotha",
      "details": "12.01.2026 (Bekanntmachungsdatum)\n\nThüringen Amtsgericht Jena HRB 110095\nSonstige Registerbekanntmachung 12.01.2026 (Eintragungsdatum)\n\nLASA-Zahnriementechnik GmbH\nGesellschaft mit beschränkter Haftung\nGotha\n\nNicht eingetragen: Den Gläubigern der Gesellschaft ist, wenn sie binnen sechs Monaten nach dieser Bekanntmachung ihren Anspruch nach Grund und Höhe schriftlich anmelden, Sicherheit zu leisten, soweit sie nicht Befriedigung verlangen können. Dieses Recht steht ihnen jedoch nicht zu, wenn sie im Falle des Insolvenzverfahrens ein Recht auf vorzugsweise Befriedigung aus einer Deckungsmasse haben, die nach gesetzlicher Vorschrift zu ihrem Schutz errichtet und staatlich überwacht ist."
    },
    {
      "date": "2026-01-12",
      "id": "142161",
      "original_text": "Registerbekanntmachung nach dem Umwandlungsgesetz\nHessen Amtsgericht Friedberg HRB 10869\nABB Robotics Deutschland GmbH – Friedberg (Hessen)",
      "type": "Registerbekanntmachung nach dem Umwandlungsgesetz",
      "state": "Hessen",
      "amtsgericht": "Amtsgericht Friedberg",
      "registernummer": "HRB 10869",
      "registerart": "HRB",
      "company_name": "ABB Robotics Deutschland GmbH",
      "company_seat": "Friedberg (Hessen)",
      "details": "12.01.2026 (Bekanntmachungsdatum)\n\nHessen Amtsgericht Friedberg HRB 10869\nRegisterbekanntmachung nach dem Umwandlungsgesetz 16.12.2025 (Eintragungsdatum)\n\nABB Robotics Deutschland GmbH\nGesellschaft mit beschränkter Haftung\nFriedberg (Hessen)\n\nDen Gläubigern der an der Abspaltung beteiligten Rechtsträger ist, wenn sie binnen sechs Monaten nach dem Tag, an dem die Eintragung der Abspaltung in das Register des Sitzes desjenigen Rechtsträgers, dessen Gläubiger sie sind, nach §§ 125, 19 Absatz 3 UmwG bekannt gemacht worden ist, ihren Anspruch nach Grund und Höhe schriftlich anmelden, Sicherheit zu leisten, soweit sie nicht Befriedigung verlangen können. Dieses Recht steht den Gläubigern jedoch nur zu, wenn sie glaubhaft machen, dass durch die Abspaltung die Erfüllung ihrer Forderung gefährdet wird."
    },
    {
      "date": "2026-01-12",
      "id": "142162",
      "original_text": "Löschungsankündigung\nHessen Amtsgericht Wiesbaden HRB 28900\nGRINSTONE HOLDING UG (haftungsbeschränkt) – Wiesbaden",
      "type": "Löschungsankündigung",
      "state": "Hessen",
      "amtsgericht": "Amtsgericht Wiesbaden",
      "registernummer": "HRB 28900",
      "registerart": "HRB",
      "company_name": "GRINSTONE HOLDING UG (haftungsbeschränkt)",
      "company_seat": "Wiesbaden",
      "details": "12.01.2026 (Bekanntmachungsdatum)\n\nHessen Amtsgericht Wiesbaden HRB 28900\nLöschungsankündigung\n\nGRINSTONE HOLDING UG (haftungsbeschränkt)\nGesellschaft mit beschränkter Haftung\nWiesbaden\n\nDas Registergericht beabsichtigt die im Handelsregister eingetragene Gesellschaft von Amts wegen nach § 394 FamFG zu löschen. Die Frist zur Erhebung eines Widerspruchs gegen die beabsichtigte Löschung wird auf 3 Monate festgesetzt."
    },
    {
      "date": "2026-01-12",
      "id": "142163",
      "original_text": "Sonstige Registerbekanntmachung\nHessen Amtsgericht Darmstadt HRB 71181\nSeniorenresidenz Am Kurpark GmbH – Bad König",
      "type": "Sonstige Registerbekanntmachung",
      "state": "Hessen",
      "amtsgericht": "Amtsgericht Darmstadt",
      "registernummer": "HRB 71181",
      "registerart": "HRB",
      "company_name": "Seniorenresidenz Am Kurpark GmbH",
      "company_seat": "Bad König",
      "details": "12.01.2026 (Bekanntmachungsdatum)\n\nHessen Amtsgericht Darmstadt HRB 71181\nSonstige Registerbekanntmachung 12.01.2026 (Eintragungsdatum)\n\nSeniorenresidenz Am Kurpark GmbH\nGesellschaft mit beschränkter Haftung\nBad König\n\nDen Gläubigern der Gesellschaft, deren Forderungen begründet worden sind, bevor die Eintragung der Beendigung des Vertrags in das Handelsregister nach § 10 HGB bekannt gemacht worden ist, ist vom anderen Vertragsteil Sicherheit zu leisten, wenn sie sich binnen sechs Monaten nach dieser Bekanntmachung zu diesem Zweck bei ihm melden."
    },
    {
      "date": "2026-01-12",
      "id": "142164",
      "original_text": "Sonstige Registerbekanntmachung\nHessen Amtsgericht Wetzlar VR 1044\nTennisbezirk Mittelhessen e.V. im HTV – Wetzlar",
      "type": "Sonstige Registerbekanntmachung",
      "state": "Hessen",
      "amtsgericht": "Amtsgericht Wetzlar",
      "registernummer": "VR 1044",
      "registerart": "VR",
      "company_name": "Tennisbezirk Mittelhessen e.V. im HTV",
      "company_seat": "Wetzlar",
      "details": "12.01.2026 (Bekanntmachungsdatum)\n\nHessen Amtsgericht Wetzlar VR 1044\nSonstige Registerbekanntmachung 12.01.2026 (Eintragungsdatum)\n\nTennisbezirk Mittelhessen e.V. im HTV\neingetragener Verein\nWetzlar\n\nDer Verein ist aufgelöst."
    },
    {
      "date": "2026-01-12",
      "id": "142165",
      "original_text": "Sonstige Registerbekanntmachung\nHessen Amtsgericht Bad Hersfeld VR 1707\nCretio Schuldnerhilfe e. V. – Bad Hersfeld",
      "type": "Sonstige Registerbekanntmachung",
      "state": "Hessen",
      "amtsgericht": "Amtsgericht Bad Hersfeld",
      "registernummer": "VR 1707",
      "registerart": "VR",
      "company_name": "Cretio Schuldnerhilfe e. V.",
      "company_seat": "Bad Hersfeld",
      "details": "12.01.2026 (Bekanntmachungsdatum)\n\nHessen Amtsgericht Bad Hersfeld VR 1707\nSonstige Registerbekanntmachung 12.01.2026 (Eintragungsdatum)\n\nCretio Schuldnerhilfe e. V.\neingetragener Verein\nBad Hersfeld\n\nDer Verein ist aufgelöst."
    },
    {
      "date": "2026-01-12",
      "id": "142166",
      "original_text": "Registerbekanntmachung nach dem Umwandlungsgesetz\nHessen Amtsgericht Fritzlar HRB 12524\nkAssekura Finanz- und Versicherungsmakler GmbH – Fritzlar",
      "type": "Registerbekanntmachung nach dem Umwandlungsgesetz",
      "state": "Hessen",
      "amtsgericht": "Amtsgericht Fritzlar",
      "registernummer": "HRB 12524",
      "registerart": "HRB",
      "company_name": "kAssekura Finanz- und Versicherungsmakler GmbH",
      "company_seat": "Fritzlar",
      "details": "12.01.2026 (Bekanntmachungsdatum)\n\nHessen Amtsgericht Fritzlar HRB 12524\nRegisterbekanntmachung nach dem Umwandlungsgesetz 12.01.2026 (Eintragungsdatum)\n\nkAssekura Finanz- und Versicherungsmakler GmbH\nGesellschaft mit beschränkter Haftung\nFritzlar\n\nDen Gläubigern der an der Verschmelzung beteiligten Rechtsträger ist, wenn sie binnen sechs Monaten nach dem Tag, an dem die Eintragung der Verschmelzung in das Register des Sitzes desjenigen Rechtsträgers, dessen Gläubiger sie sind, nach § 19 Absatz 3 UmwG bekannt gemacht worden ist, ihren Anspruch nach Grund und Höhe schriftlich anmelden, Sicherheit zu leisten, soweit sie nicht Befriedigung verlangen können. Dieses Recht steht den Gläubigern jedoch nur zu, wenn sie glaubhaft machen, dass durch die Verschmelzung die Erfüllung ihrer Forderung gefährdet wird."
    },
    {
      "date": "2026-01-12",
      "id": "142167",
      "original_text": "Löschungsankündigung\nHessen Amtsgericht Bad Homburg v.d.H. HRA 5893\nNeubau GmbH WICO & Co. Anlagen KG Nr. 1 – Bad Homburg v. d. Höhe",
      "type": "Löschungsankündigung",
      "state": "Hessen",
      "amtsgericht": "Amtsgericht Bad Homburg v.d.H.",
      "registernummer": "HRA 5893",
      "registerart": "HRA",
      "company_name": "Neubau GmbH WICO & Co. Anlagen KG Nr. 1",
      "company_seat": "Bad Homburg v. d. Höhe",
      "details": "12.01.2026 (Bekanntmachungsdatum)\n\nHessen Amtsgericht Bad Homburg v.d.H. HRA 5893\nLöschungsankündigung 10.10.2025 (Eintragungsdatum)\n\nNeubau GmbH WICO & Co. Anlagen KG Nr. 1\nKommanditgesellschaft\nBad Homburg v. d. Höhe\n\nDas Registergericht beabsichtigt die im Handelsregister eingetragene Firma von Amts wegen nach § 394 FamFG zu löschen. Die Frist zur Erhebung eines Widerspruchs gegen die beabsichtigte Löschung wird auf 3 Monate festgesetzt."
    },
    {
      "date": "2026-01-12",
      "id": "142168",
      "original_text": "Sonstige Registerbekanntmachung\nHessen Amtsgericht Offenbach am Main VR 2079\nFreunde Indiens – Neu-Isenburg",
      "type": "Sonstige Registerbekanntmachung",
      "state": "Hessen",
      "amtsgericht": "Amtsgericht Offenbach am Main",
      "registernummer": "VR 2079",
      "registerart": "VR",
      "company_name": "Freunde Indiens",
      "company_seat": "Neu-Isenburg",
      "details": "12.01.2026 (Bekanntmachungsdatum)\n\nHessen Amtsgericht Offenbach am Main VR 2079\nSonstige Registerbekanntmachung 12.01.2026 (Eintragungsdatum)\n\nFreunde Indiens\neingetragener Verein\nNeu-Isenburg\n\nDer Verein ist aufgelöst."
    },
    {
      "date": "2026-01-12",
      "id": "142169",
      "original_text": "Löschungsankündigung\nHessen Amtsgericht Frankfurt am Main HRB 106706\nWIN! PALS & VENTURES GmbH – Frankfurt am Main",
      "type": "Löschungsankündigung",
      "state": "Hessen",
      "amtsgericht": "Amtsgericht Frankfurt am Main",
      "registernummer": "HRB 106706",
      "registerart": "HRB",
      "company_name": "WIN! PALS & VENTURES GmbH",
      "company_seat": "Frankfurt am Main",
      "details": "12.01.2026 (Bekanntmachungsdatum)\n\nHessen Amtsgericht Frankfurt am Main HRB 106706\nLöschungsankündigung 12.01.2025 (Eintragungsdatum)\n\nWIN! PALS & VENTURES GmbH\nGesellschaft mit beschränkter Haftung\nFrankfurt am Main\n\nes ist beabsichtigt, die Gesellschaft wegen Vermögenslosigkeit gemäß § 394 FamFG von Amts wegen im Handelsregister zu löschen.\nHiergegen kann innerhalb eines Monats nach dieser Veröffentlichung  Widerspruch bei dem Amtsgericht Frankfurt am Main eingelegt werden."
    },
    {
      "date": "2026-01-12",
      "id": "142170",
      "original_text": "Sonstige Registerbekanntmachung\nHessen Amtsgericht Frankfurt am Main HRB 57087\nProvadis School of International Management and Technology AG – Frankfurt am Main",
      "type": "Sonstige Registerbekanntmachung",
      "state": "Hessen",
      "amtsgericht": "Amtsgericht Frankfurt am Main",
      "registernummer": "HRB 57087",
      "registerart": "HRB",
      "company_name": "Provadis School of International Management and Technology AG",
      "company_seat": "Frankfurt am Main",
      "details": "12.01.2026 (Bekanntmachungsdatum)\n\nHessen Amtsgericht Frankfurt am Main HRB 57087\nSonstige Registerbekanntmachung 12.01.2026 (Eintragungsdatum)\n\nProvadis School of International Management and Technology AG\nAktiengesellschaft\nFrankfurt am Main\n\nDurch eine Änderung in den Personen der Aufsichtsratsmitglieder ist eine Liste der Mitglieder des Aufsichtsrates zum Handelsregister eingereicht worden."
    },
    {
      "date": "2026-01-12",
      "id": "142171",
      "original_text": "Löschungsankündigung\nHessen Amtsgericht Offenbach am Main HRB 32871\nTecnotree GmbH – Dreieich",
      "type": "Löschungsankündigung",
      "state": "Hessen",
      "amtsgericht": "Amtsgericht Offenbach am Main",
      "registernummer": "HRB 32871",
      "registerart": "HRB",
      "company_name": "Tecnotree GmbH",
      "company_seat": "Dreieich",
      "details": "12.01.2026 (Bekanntmachungsdatum)\n\nHessen Amtsgericht Offenbach am Main HRB 32871\nLöschungsankündigung\n\nTecnotree GmbH\nGesellschaft mit beschränkter Haftung\nDreieich\n\nDas Registergericht beabsichtigt die im Handelsregister eingetragene Gesellschaft von Amts wegen nach § 394 FamFG zu löschen. Die Frist zur Erhebung eines Widerspruchs gegen die beabsichtigte Löschung wird auf 3 Monate festgesetzt."
    },
    {
      "date": "2026-01-12",
      "id": "142172",
      "original_text": "Sonstige Registerbekanntmachung\nHessen Amtsgericht Frankfurt am Main HRB 79744\nKfW IPEX-Bank GmbH – Frankfurt am Main",
      "type": "Sonstige Registerbekanntmachung",
      "state": "Hessen",
      "amtsgericht": "Amtsgericht Frankfurt am Main",
      "registernummer": "HRB 79744",
      "registerart": "HRB",
      "company_name": "KfW IPEX-Bank GmbH",
      "company_seat": "Frankfurt am Main",
      "details": "12.01.2026 (Bekanntmachungsdatum)\n\nHessen Amtsgericht Frankfurt am Main HRB 79744\nSonstige Registerbekanntmachung 10.01.2026 (Eintragungsdatum)\n\nKfW IPEX-Bank GmbH\nGesellschaft mit beschränkter Haftung\nFrankfurt am Main\n\nDen Gläubigern der Gesellschaft, deren Forderungen begründet worden sind, bevor die Eintragung der Beendigung des Vertrags in das Handelsregister nach § 10 HGB bekannt gemacht worden ist, ist vom anderen Vertragsteil Sicherheit zu leisten, wenn sie sich binnen sechs Monaten nach dieser Bekanntmachung zu diesem Zweck bei ihm melden."
    },
    {
      "date": "2026-01-12",
      "id": "142173",
      "original_text": "Registerbekanntmachung nach dem Umwandlungsgesetz\nHessen Amtsgericht Frankfurt am Main PR 2869\nJakob & Sozien Wirtschaftsprüfer | Steuerberater Partnerschaft mbB – Baunatal",
      "type": "Registerbekanntmachung nach dem Umwandlungsgesetz",
      "state": "Hessen",
      "amtsgericht": "Amtsgericht Frankfurt am Main",
      "registernummer": "PR 2869",
      "registerart": "PR",
      "company_name": "Jakob & Sozien Wirtschaftsprüfer | Steuerberater Partnerschaft mbB",
      "company_seat": "Baunatal",
      "details": "12.01.2026 (Bekanntmachungsdatum)\n\nHessen Amtsgericht Frankfurt am Main PR 2869\nRegisterbekanntmachung nach dem Umwandlungsgesetz 12.01.2026 (Eintragungsdatum)\n\nJakob & Sozien Wirtschaftsprüfer | Steuerberater Partnerschaft mbB\nPartnerschaftsgesellschaft\nBaunatal\n\nDen Gläubigern der an der Verschmelzung beteiligten Rechtsträger ist, wenn sie binnen sechs Monaten nach dem Tag, an dem die Eintragung der Verschmelzung in das Register des Sitzes desjenigen Rechtsträgers, dessen Gläubiger sie sind, nach § 19 Absatz 3 UmwG bekannt gemacht worden ist, ihren Anspruch nach Grund und Höhe schriftlich anmelden, Sicherheit zu leisten, soweit sie nicht Befriedigung verlangen können. Dieses Recht steht den Gläubigern jedoch nur zu, wenn sie glaubhaft machen, dass durch die Verschmelzung die Erfüllung ihrer Forderung gefährdet wird."
    },
    {
      "date": "2026-01-12",
      "id": "142174",
      "original_text": "Registerbekanntmachung nach dem Umwandlungsgesetz\nHessen Amtsgericht Friedberg HRB 810\nEXMAR GmbH – Bad Nauheim",
      "type": "Registerbekanntmachung nach dem Umwandlungsgesetz",
      "state": "Hessen",
      "amtsgericht": "Amtsgericht Friedberg",
      "registernummer": "HRB 810",
      "registerart": "HRB",
      "company_name": "EXMAR GmbH",
      "company_seat": "Bad Nauheim",
      "details": "12.01.2026 (Bekanntmachungsdatum)\n\nHessen Amtsgericht Friedberg HRB 810\nRegisterbekanntmachung nach dem Umwandlungsgesetz 12.01.2026 (Eintragungsdatum)\n\nEXMAR GmbH\nGesellschaft mit beschränkter Haftung\nBad Nauheim\n\nDen Gläubigern der an der Verschmelzung beteiligten Rechtsträger ist, wenn sie binnen sechs Monaten nach dem Tag, an dem die Eintragung der Verschmelzung in das Register des Sitzes desjenigen Rechtsträgers, dessen Gläubiger sie sind, nach § 19 Absatz 3 UmwG bekannt gemacht worden ist, ihren Anspruch nach Grund und Höhe schriftlich anmelden, Sicherheit zu leisten, soweit sie nicht Befriedigung verlangen können. Dieses Recht steht den Gläubigern jedoch nur zu, wenn sie glaubhaft machen, dass durch die Verschmelzung die Erfüllung ihrer Forderung gefährdet wird."
    },
    {
      "date": "2026-01-12",
      "id": "142175",
      "original_text": "Löschungsankündigung\nHessen Amtsgericht Bad Hersfeld HRB 2482\nResort Eisenberg GmbH – Kirchheim",
      "type": "Löschungsankündigung",
      "state": "Hessen",
      "amtsgericht": "Amtsgericht Bad Hersfeld",
      "registernummer": "HRB 2482",
      "registerart": "HRB",
      "company_name": "Resort Eisenberg GmbH",
      "company_seat": "Kirchheim",
      "details": "12.01.2026 (Bekanntmachungsdatum)\n\nHessen Amtsgericht Bad Hersfeld HRB 2482\nLöschungsankündigung\n\nResort Eisenberg GmbH\nGesellschaft mit beschränkter Haftung\nKirchheim\n\nDas Registergericht beabsichtigt die im Handelsregister eingetragene Gesellschaft von Amts wegen nach § 394 FamFG zu löschen. Die Frist zur Erhebung eines Widerspruchs gegen die beabsichtigte Löschung wird auf 6 Wochen festgesetzt."
    },
    {
      "date": "2026-01-12",
      "id": "142176",
      "original_text": "Sonstige Registerbekanntmachung\nHessen Amtsgericht Frankfurt am Main HRB 88623\nCEVA Freight (Management) GmbH – Frankfurt am Main",
      "type": "Sonstige Registerbekanntmachung",
      "state": "Hessen",
      "amtsgericht": "Amtsgericht Frankfurt am Main",
      "registernummer": "HRB 88623",
      "registerart": "HRB",
      "company_name": "CEVA Freight (Management) GmbH",
      "company_seat": "Frankfurt am Main",
      "details": "12.01.2026 (Bekanntmachungsdatum)\n\nHessen Amtsgericht Frankfurt am Main HRB 88623\nSonstige Registerbekanntmachung 12.01.2026 (Eintragungsdatum)\n\nCEVA Freight (Management) GmbH\nGesellschaft mit beschränkter Haftung\nFrankfurt am Main\n\nDen Gläubigern der Gesellschaft, deren Forderungen begründet worden sind, bevor die Eintragung der Beendigung des Vertrags in das Handelsregister nach § 10 HGB bekannt gemacht worden ist, ist vom anderen Vertragsteil Sicherheit zu leisten, wenn sie sich binnen sechs Monaten nach dieser Bekanntmachung zu diesem Zweck bei ihm melden."
    }
  ]
}