{
  "date": "2026-01-26",
  "date_of_scrape": "2026-01-27T04:24:39.620Z",
  "tool_version": "0.2.0",
  "number_of_announcements": 90,
  "announcements": [
    {
      "date": "2026-01-26",
      "id": "143392",
      "original_text": "Löschungsankündigung\nBaden-Württemberg Amtsgericht Mannheim HRB 726095\nUnixhelden UG (haftungsbeschränkt) – Mühlacker",
      "type": "Löschungsankündigung",
      "state": "Baden-Württemberg",
      "amtsgericht": "Amtsgericht Mannheim",
      "registernummer": "HRB 726095",
      "registerart": "HRB",
      "company_name": "Unixhelden UG (haftungsbeschränkt)",
      "company_seat": "Mühlacker",
      "details": "26.01.2026 (Bekanntmachungsdatum)\n\nBaden-Württemberg Amtsgericht Mannheim HRB 726095\nLöschungsankündigung\n\nUnixhelden UG (haftungsbeschränkt)\nGesellschaft mit beschränkter Haftung\nMühlacker\n\nAls nicht eingetragen wird bekanntgemacht:\nDas Gericht beabsichtigt, die Gesellschaft wegen Vermögenslosigkeit im Handelsregister von Amts wegen nach § 394 FamFG zu löschen. Die Frist zur Geltendmachung eines Widerspruchs gegen die beabsichtigte Löschung ist auf einen Monat ab Veröffentlichung bestimmt."
    },
    {
      "date": "2026-01-26",
      "id": "143393",
      "original_text": "Löschungsankündigung\nBaden-Württemberg Amtsgericht Mannheim HRB 708345\nENERGON GMBH – Karlsruhe",
      "type": "Löschungsankündigung",
      "state": "Baden-Württemberg",
      "amtsgericht": "Amtsgericht Mannheim",
      "registernummer": "HRB 708345",
      "registerart": "HRB",
      "company_name": "ENERGON GMBH",
      "company_seat": "Karlsruhe",
      "details": "26.01.2026 (Bekanntmachungsdatum)\n\nBaden-Württemberg Amtsgericht Mannheim HRB 708345\nLöschungsankündigung 26.01.2026 (Eintragungsdatum)\n\nENERGON GMBH\nGesellschaft mit beschränkter Haftung\nKarlsruhe\n\nDas Gericht beabsichtigt, die Gesellschaft wegen Vermögenslosigkeit im Handelsregister von Amts wegen nach § 394 FamFG zu löschen. Die Frist zur Geltendmachung eines Widerspruchs gegen die beabsichtigte Löschung ist auf einen Monat ab Veröffentlichung bestimmt."
    },
    {
      "date": "2026-01-26",
      "id": "143394",
      "original_text": "Löschungsankündigung\nBerlin Amtsgericht Berlin (Charlottenburg) HRB 49400\nClasen Grundstücks GmbH – Berlin",
      "type": "Löschungsankündigung",
      "state": "Berlin",
      "amtsgericht": "Amtsgericht Berlin (Charlottenburg)",
      "registernummer": "HRB 49400",
      "registerart": "HRB",
      "company_name": "Clasen Grundstücks GmbH",
      "company_seat": "Berlin",
      "details": "26.01.2026 (Bekanntmachungsdatum)\n\nBerlin Amtsgericht Berlin (Charlottenburg) HRB 49400\nLöschungsankündigung\n\nClasen Grundstücks GmbH\nGesellschaft mit beschränkter Haftung\nBerlin\n\nBei der nachstehenden Gesellschaft wird das Amtslöschungsverfahren gemäß § 394 FamFG eingeleitet. Widerspruchsfrist\n6 Wochen."
    },
    {
      "date": "2026-01-26",
      "id": "143395",
      "original_text": "Sonstige Registerbekanntmachung\nBerlin Amtsgericht Berlin (Charlottenburg) HRB 160415\nwirDesign communication AG – Berlin",
      "type": "Sonstige Registerbekanntmachung",
      "state": "Berlin",
      "amtsgericht": "Amtsgericht Berlin (Charlottenburg)",
      "registernummer": "HRB 160415",
      "registerart": "HRB",
      "company_name": "wirDesign communication AG",
      "company_seat": "Berlin",
      "details": "26.01.2026 (Bekanntmachungsdatum)\n\nBerlin Amtsgericht Berlin (Charlottenburg) HRB 160415\nSonstige Registerbekanntmachung 23.01.2026 (Eintragungsdatum)\n\nwirDesign communication AG\nAktiengesellschaft\nBerlin\n\nAls eingetragen wird veröffentlicht: Der andere Vertragsteil hat den Gläubigern dieses Rechtsträgers, deren Forderungen begründet worden sind, bevor die Eintragung der Beendigung dieses Vertrages in das Handelsregister nach § 10 des Handelsgesetzbuches als bekannt gemacht gilt, Sicherheit zu leisten, wenn sie sich binnen sechs Monaten nach der Bekanntmachung der Eintragung zu diesem Zweck bei ihm melden. Dieses Recht steht den Gläubigern nicht zu, die im Fall des Insolvenzverfahrens ein Recht auf vorzugsweise Befriedigung aus der Deckungsmasse haben, die nach gesetzlicher Vorschrift zu ihrem Schutz errichtet und staatlich überwacht ist."
    },
    {
      "date": "2026-01-26",
      "id": "143396",
      "original_text": "Löschungsankündigung\nHamburg Amtsgericht Hamburg HRA 128769\nPlanB Invest GmbH & Co. KG – Hamburg",
      "type": "Löschungsankündigung",
      "state": "Hamburg",
      "amtsgericht": "Amtsgericht Hamburg",
      "registernummer": "HRA 128769",
      "registerart": "HRA",
      "company_name": "PlanB Invest GmbH & Co. KG",
      "company_seat": "Hamburg",
      "details": "26.01.2026 (Bekanntmachungsdatum)\n\nHamburg Amtsgericht Hamburg HRA 128769\nLöschungsankündigung\n\nPlanB Invest GmbH & Co. KG\nKommanditgesellschaft\nHamburg\n\nDas Registergericht beabsichtigt, die im Handelsregister eingetragene Gesellschaft von Amts wegen nach § 394 Abs. 4 FamFG zu löschen. Die Frist zur Erhebung eines Widerspruchs gegen die beabsichtigte Löschung wird auf 3 Monate festgesetzt."
    },
    {
      "date": "2026-01-26",
      "id": "143397",
      "original_text": "Sonstige Registerbekanntmachung\nBerlin Amtsgericht Berlin (Charlottenburg) HRB 142946\nAIOS Tax AG Steuerberatungsgesellschaft – Berlin",
      "type": "Sonstige Registerbekanntmachung",
      "state": "Berlin",
      "amtsgericht": "Amtsgericht Berlin (Charlottenburg)",
      "registernummer": "HRB 142946",
      "registerart": "HRB",
      "company_name": "AIOS Tax AG Steuerberatungsgesellschaft",
      "company_seat": "Berlin",
      "details": "26.01.2026 (Bekanntmachungsdatum)\n\nBerlin Amtsgericht Berlin (Charlottenburg) HRB 142946\nSonstige Registerbekanntmachung\n\nAIOS Tax AG Steuerberatungsgesellschaft\nAktiengesellschaft\nBerlin\n\nAls nicht eingetragen wird veröffentlicht:\n\nGläubigern, deren Forderungen begründet worden sind, bevor die Eintragung des Beschlusses als nach § 10 des Handelsgesetzbuches bekannt gemacht gilt, ist, wenn sie sich binnen sechs Monaten nach der Bekanntmachung zu diesem Zweck melden, Sicherheit zu leisten, soweit sie nicht Befriedigung verlangen können. Dieses Recht steht den Gläubigern nicht zu, die im Fall des Insolvenzverfahrens ein Recht auf vorzugsweise Befriedigung aus der Deckungsmasse haben, die nach gesetzlicher Vorschrift zu ihrem Schutz errichtet und staatlich überwacht ist."
    },
    {
      "date": "2026-01-26",
      "id": "143398",
      "original_text": "Löschungsankündigung\nBerlin Amtsgericht Berlin (Charlottenburg) HRB 259019\nConfidence Beauty GmbH – Berlin",
      "type": "Löschungsankündigung",
      "state": "Berlin",
      "amtsgericht": "Amtsgericht Berlin (Charlottenburg)",
      "registernummer": "HRB 259019",
      "registerart": "HRB",
      "company_name": "Confidence Beauty GmbH",
      "company_seat": "Berlin",
      "details": "26.01.2026 (Bekanntmachungsdatum)\n\nBerlin Amtsgericht Berlin (Charlottenburg) HRB 259019\nLöschungsankündigung\n\nConfidence Beauty GmbH\nGesellschaft mit beschränkter Haftung\nBerlin\n\nBei der nachstehenden Gesellschaft wird das Amtslöschungsverfahren gemäß § 394 FamFG eingeleitet. Widerspruchsfrist 6 Wochen"
    },
    {
      "date": "2026-01-26",
      "id": "143399",
      "original_text": "Löschungsankündigung\nBrandenburg Amtsgericht Potsdam HRB 37179\nMAB Dienstleistungen GmbH – Potsdam",
      "type": "Löschungsankündigung",
      "state": "Brandenburg",
      "amtsgericht": "Amtsgericht Potsdam",
      "registernummer": "HRB 37179",
      "registerart": "HRB",
      "company_name": "MAB Dienstleistungen GmbH",
      "company_seat": "Potsdam",
      "details": "26.01.2026 (Bekanntmachungsdatum)\n\nBrandenburg Amtsgericht Potsdam HRB 37179\nLöschungsankündigung\n\nMAB Dienstleistungen GmbH\nGesellschaft mit beschränkter Haftung\nPotsdam\n\nBei der nachstehenden Gesellschaft wird das Amtslöschungsverfahren gemäß § 394 FamFG eingeleitet. Widerspruchsfrist 8 Wochen."
    },
    {
      "date": "2026-01-26",
      "id": "143400",
      "original_text": "Löschungsankündigung\nSaarland Amtsgericht Saarbrücken HRB 110093\nETAAH GmbH – Saarbrücken",
      "type": "Löschungsankündigung",
      "state": "Saarland",
      "amtsgericht": "Amtsgericht Saarbrücken",
      "registernummer": "HRB 110093",
      "registerart": "HRB",
      "company_name": "ETAAH GmbH",
      "company_seat": "Saarbrücken",
      "details": "26.01.2026 (Bekanntmachungsdatum)\n\nSaarland Amtsgericht Saarbrücken HRB 110093\nLöschungsankündigung\n\nETAAH GmbH\nGesellschaft mit beschränkter Haftung\nSaarbrücken\n\nEs ist beabsichtigt, die Gesellschaft von Amts wegen gemäß § 394 FamFG wegen Vermögenslosigkeit zu löschen.\nGegen die Löschung von Amts wegen ist das Rechtsmittel des Widerspruchs statthaft. Der Widerspruch ist binnen einer Frist drei Monaten beginnend mit dem Tag dieser Veröffentlichung durch Einreichen eines Widerspruchsschreibens -schriftlich oder zur Niederschrift der Geschäftsstelle beim Amtsgericht Saarbrücken, -zentrales Handelsregister-, Mainzerstr.178, 66121 Saarbrücken einzulegen.\nDer Widerspruch muss die Bezeichnung der angefochtenen Löschungsankündigung enthalten sowie die Erklärung, dass Widerspruch eingelegt wird. Er ist vom Widerspruchsführer oder seinem Bevollmächtigten zu unterzeichnen.\nDas Widerspruchsschreiben kann auch in der Form eines elektronischen Dokumentes eingereicht werden, das mit einer qualifizierten elektronischen Signatur nach dem Signaturgesetz versehen sein muss (§§ 14 Abs. 2 FamFG, 130a, 298 ZPO)."
    },
    {
      "date": "2026-01-26",
      "id": "143401",
      "original_text": "Einreichung neuer Dokumente\nBrandenburg Amtsgericht Potsdam HRB 16071\nInterVista AG – Potsdam",
      "type": "Einreichung neuer Dokumente",
      "state": "Brandenburg",
      "amtsgericht": "Amtsgericht Potsdam",
      "registernummer": "HRB 16071",
      "registerart": "HRB",
      "company_name": "InterVista AG",
      "company_seat": "Potsdam",
      "details": "26.01.2026 (Bekanntmachungsdatum)\n\nBrandenburg Amtsgericht Potsdam HRB 16071\nEinreichung neuer Dokumente\n\nInterVista AG\nAktiengesellschaft\nPotsdam\n\nAls nicht eingetragen wird bekanntgemacht : Eine Liste der Mitglieder des Aufsichtsrates wurde zum Handelsregister eingereicht."
    },
    {
      "date": "2026-01-26",
      "id": "143402",
      "original_text": "Löschungsankündigung\nBaden-Württemberg Amtsgericht Mannheim HRB 710533\nEnnovaenergia Deutschland GmbH – Ettlingen",
      "type": "Löschungsankündigung",
      "state": "Baden-Württemberg",
      "amtsgericht": "Amtsgericht Mannheim",
      "registernummer": "HRB 710533",
      "registerart": "HRB",
      "company_name": "Ennovaenergia Deutschland GmbH",
      "company_seat": "Ettlingen",
      "details": "26.01.2026 (Bekanntmachungsdatum)\n\nBaden-Württemberg Amtsgericht Mannheim HRB 710533\nLöschungsankündigung\n\nEnnovaenergia Deutschland GmbH\nGesellschaft mit beschränkter Haftung\nEttlingen\n\nAls nicht eingetragen wird bekanntgemacht:\nDas Gericht beabsichtigt, die Gesellschaft wegen Vermögenslosigkeit im Handelsregister von Amts wegen nach § 394 FamFG zu löschen. Die Frist zur Geltendmachung eines Widerspruchs gegen die beabsichtigte Löschung ist auf einen Monat ab Veröffentlichung bestimmt."
    },
    {
      "date": "2026-01-26",
      "id": "143403",
      "original_text": "Löschungsankündigung\nBerlin Amtsgericht Berlin (Charlottenburg) HRB 216445\nISTEP UG (haftungsbeschränkt) – Berlin",
      "type": "Löschungsankündigung",
      "state": "Berlin",
      "amtsgericht": "Amtsgericht Berlin (Charlottenburg)",
      "registernummer": "HRB 216445",
      "registerart": "HRB",
      "company_name": "ISTEP UG (haftungsbeschränkt)",
      "company_seat": "Berlin",
      "details": "26.01.2026 (Bekanntmachungsdatum)\n\nBerlin Amtsgericht Berlin (Charlottenburg) HRB 216445\nLöschungsankündigung\n\nISTEP UG (haftungsbeschränkt)\nGesellschaft mit beschränkter Haftung\nBerlin\n\nBei der nachstehenden Gesellschaft wird das Amtslöschungsverfahren gemäß § 394 FamFG eingeleitet. Widerspruchsfrist 6 Wochen"
    },
    {
      "date": "2026-01-26",
      "id": "143404",
      "original_text": "Registerbekanntmachung nach dem Umwandlungsgesetz\nHamburg Amtsgericht Hamburg HRB 196761\nJulius Grube Schiffswerft GmbH – Hamburg",
      "type": "Registerbekanntmachung nach dem Umwandlungsgesetz",
      "state": "Hamburg",
      "amtsgericht": "Amtsgericht Hamburg",
      "registernummer": "HRB 196761",
      "registerart": "HRB",
      "company_name": "Julius Grube Schiffswerft GmbH",
      "company_seat": "Hamburg",
      "details": "26.01.2026 (Bekanntmachungsdatum)\n\nHamburg Amtsgericht Hamburg HRB 196761\nRegisterbekanntmachung nach dem Umwandlungsgesetz 26.01.2026 (Eintragungsdatum)\n\nJulius Grube Schiffswerft GmbH\nGesellschaft mit beschränkter Haftung\nHamburg\n\nDen Gläubigern der an der formwechselnden Umwandlung beteiligten Gesellschaften ist, wenn sie binnen sechs Monaten nach dem Tag, an dem die Eintragung der formwechselnden Umwandlung in das Register des Sitzes desjenigen Rechtsträgers, dessen Gläubiger sie sind, nach § 19 Absatz 3 UmwG als bekannt gemacht gilt, ihren Anspruch nach Grund und Höhe schriftlich anmelden, Sicherheit zu leisten, soweit sie nicht Befriedigung verlangen können. Dieses Recht steht den Gläubigern jedoch nur zu, wenn sie glaubhaft machen, dass durch die formwechselnde Umwandlung die Erfüllung ihrer Forderung gefährdet wird."
    },
    {
      "date": "2026-01-26",
      "id": "143405",
      "original_text": "Registerbekanntmachung nach dem Umwandlungsgesetz\nHamburg Amtsgericht Hamburg HRA 4266\nJulius Grube KG Schiffswerft (G.m.b.H. & Co.) – Hamburg",
      "type": "Registerbekanntmachung nach dem Umwandlungsgesetz",
      "state": "Hamburg",
      "amtsgericht": "Amtsgericht Hamburg",
      "registernummer": "HRA 4266",
      "registerart": "HRA",
      "company_name": "Julius Grube KG Schiffswerft (G.m.b.H. & Co.)",
      "company_seat": "Hamburg",
      "details": "26.01.2026 (Bekanntmachungsdatum)\n\nHamburg Amtsgericht Hamburg HRA 4266\nRegisterbekanntmachung nach dem Umwandlungsgesetz 26.01.2026 (Eintragungsdatum)\n\nJulius Grube KG Schiffswerft (G.m.b.H. & Co.)\nKommanditgesellschaft\nHamburg\n\nAls nicht eingetragen wird bekannt gemacht:\nDen Gläubigern der an der formwechselnden Umwandlung beteiligten Gesellschaften ist, wenn sie binnen sechs Monaten nach dem Tag, an dem die Eintragung der formwechselnden Umwandlung in das Register des Sitzes desjenigen Rechtsträgers, dessen Gläubiger sie sind, nach § 19 Absatz 3 UmwG als bekannt gemacht gilt, ihren Anspruch nach Grund und Höhe schriftlich anmelden, Sicherheit zu leisten, soweit sie nicht Befriedigung verlangen können. Dieses Recht steht den Gläubigern jedoch nur zu, wenn sie glaubhaft machen, dass durch die formwechselnde Umwandlung die Erfüllung ihrer Forderung gefährdet wird."
    },
    {
      "date": "2026-01-26",
      "id": "143406",
      "original_text": "Registerbekanntmachung nach dem Umwandlungsgesetz\nBrandenburg Amtsgericht Potsdam HRB 30777\nWindpark Deichberg Verwaltungs UG (haftungsbeschränkt) – Zossen",
      "type": "Registerbekanntmachung nach dem Umwandlungsgesetz",
      "state": "Brandenburg",
      "amtsgericht": "Amtsgericht Potsdam",
      "registernummer": "HRB 30777",
      "registerart": "HRB",
      "company_name": "Windpark Deichberg Verwaltungs UG (haftungsbeschränkt)",
      "company_seat": "Zossen",
      "details": "26.01.2026 (Bekanntmachungsdatum)\n\nBrandenburg Amtsgericht Potsdam HRB 30777\nRegisterbekanntmachung nach dem Umwandlungsgesetz 24.01.2026 (Eintragungsdatum)\n\nWindpark Deichberg Verwaltungs UG (haftungsbeschränkt)\nGesellschaft mit beschränkter Haftung\nZossen\n\nAls nicht eingetragen wird veröffentlicht: Den Gläubigern der an der Verschmelzung beteiligten Rechtsträger ist, wenn sie binnen sechs Monaten nach dem Tag, an dem die Eintragung der Verschmelzung in das Register des Sitzes desjenigen Rechtsträgers, dessen Gläubiger sie sind, nach § 19 Abs. 3 UmwG als bekannt gemacht gilt, ihren Anspruch nach Grund und Höhe schriftlich anmelden, Sicherheit zu leisten, soweit sie nicht Befriedigung verlangen können. Dieses Recht steht den Gläubigern jedoch nur zu, wenn sie glaubhaft machen, dass durch die Verschmelzung die Erfüllung ihrer Forderung gefährdet wird."
    },
    {
      "date": "2026-01-26",
      "id": "143407",
      "original_text": "Registerbekanntmachung nach dem Umwandlungsgesetz\nBaden-Württemberg Amtsgericht Stuttgart HRA 742830\nECO-Tankstelle Burladingen e.K. - Inh. Petra Buomann – Burladingen",
      "type": "Registerbekanntmachung nach dem Umwandlungsgesetz",
      "state": "Baden-Württemberg",
      "amtsgericht": "Amtsgericht Stuttgart",
      "registernummer": "HRA 742830",
      "registerart": "HRA",
      "company_name": "ECO-Tankstelle Burladingen e.K. - Inh. Petra Buomann",
      "company_seat": "Burladingen",
      "details": "26.01.2026 (Bekanntmachungsdatum)\n\nBaden-Württemberg Amtsgericht Stuttgart HRA 742830\nRegisterbekanntmachung nach dem Umwandlungsgesetz 26.01.2026 (Eintragungsdatum)\n\nECO-Tankstelle Burladingen e.K. - Inh. Petra Buomann\nEinzelkaufmann / Einzelkauffrau\nBurladingen\n\nAls nicht eingetragen wird bekanntgemacht:\nDen Gläubigern der an der Ausgliederung beteiligten Rechtsträger ist, wenn sie binnen sechs Monaten nach dem Tag, an dem die Eintragung der Ausgliederung in das Register des Sitzes desjenigen Rechtsträgers, dessen Gläubiger sie sind, nach § 19 Abs. 3 UmwG als bekanntgemacht gilt, ihren Anspruch nach Grund und Höhe schriftlich anmelden, Sicherheit zu leisten, soweit sie nicht Befriedigung verlangen können. Dieses Recht steht den Gläubigern jedoch nur zu, wenn sie glaubhaft machen, dass durch die Ausgliederung die Erfüllung ihrer Forderung gefährdet wird."
    },
    {
      "date": "2026-01-26",
      "id": "143408",
      "original_text": "Registerbekanntmachung nach dem Umwandlungsgesetz\nBerlin Amtsgericht Berlin (Charlottenburg) HRB 225188\nHotjar Germany GmbH – Berlin",
      "type": "Registerbekanntmachung nach dem Umwandlungsgesetz",
      "state": "Berlin",
      "amtsgericht": "Amtsgericht Berlin (Charlottenburg)",
      "registernummer": "HRB 225188",
      "registerart": "HRB",
      "company_name": "Hotjar Germany GmbH",
      "company_seat": "Berlin",
      "details": "26.01.2026 (Bekanntmachungsdatum)\n\nBerlin Amtsgericht Berlin (Charlottenburg) HRB 225188\nRegisterbekanntmachung nach dem Umwandlungsgesetz 23.01.2026 (Eintragungsdatum)\n\nHotjar Germany GmbH\nGesellschaft mit beschränkter Haftung\nBerlin\n\nZu Eintragungsnummer 9 vom 23.01.2026 wird als nicht eingetragen veröffentlicht:Den Gläubigern der an der Verschmelzung beteiligten Rechtsträger ist, wenn sie binnen sechs Monaten nach dem Tag, an dem die Eintragung der Verschmelzung in das Register des Sitzes desjenigen Rechtsträgers, dessen Gläubiger sie sind, als bekannt gemacht gilt, ihren Anspruch nach Grund und Höhe schriftlich anmelden, Sicherheit zu leisten, soweit sie nicht Befriedigung verlangen können. Dieses Recht steht den Gläubigern jedoch nur zu, wenn sie glaubhaft machen, dass durch die Verschmelzung die Erfüllung ihrer Forderung gefährdet wird. Das Recht, Sicherheitsleistung zu verlangen, steht Gläubigern nicht zu, die im Falle der Insolvenz ein Recht auf vorzugsweise Befriedigung aus einer Deckungsmasse haben, die nach gesetzlicher Vorschrift zu ihrem Schutz errichtet und staatlich überwacht ist."
    },
    {
      "date": "2026-01-26",
      "id": "143409",
      "original_text": "Löschungsankündigung\nBrandenburg Amtsgericht Potsdam HRB 21946\nSroka MVG UG (haftungsbeschränkt) – Kloster Lehnin",
      "type": "Löschungsankündigung",
      "state": "Brandenburg",
      "amtsgericht": "Amtsgericht Potsdam",
      "registernummer": "HRB 21946",
      "registerart": "HRB",
      "company_name": "Sroka MVG UG (haftungsbeschränkt)",
      "company_seat": "Kloster Lehnin",
      "details": "26.01.2026 (Bekanntmachungsdatum)\n\nBrandenburg Amtsgericht Potsdam HRB 21946\nLöschungsankündigung\n\nSroka MVG UG (haftungsbeschränkt)\nGesellschaft mit beschränkter Haftung\nKloster Lehnin\n\nBei der nachstehenden Gesellschaft wird das Amtslöschungsverfahren gemäß § 394 FamFG eingeleitet. Widerspruchsfrist: 8 Wochen."
    },
    {
      "date": "2026-01-26",
      "id": "143410",
      "original_text": "Löschungsankündigung\nThüringen Amtsgericht Jena HRB 501432\nMulti-Electronics GmbH – Saalfeld/Saale",
      "type": "Löschungsankündigung",
      "state": "Thüringen",
      "amtsgericht": "Amtsgericht Jena",
      "registernummer": "HRB 501432",
      "registerart": "HRB",
      "company_name": "Multi-Electronics GmbH",
      "company_seat": "Saalfeld/Saale",
      "details": "26.01.2026 (Bekanntmachungsdatum)\n\nThüringen Amtsgericht Jena HRB 501432\nLöschungsankündigung\n\nMulti-Electronics GmbH\nGesellschaft mit beschränkter Haftung\nSaalfeld/Saale\n\nDas Registergericht beabsichtigt, die im Handelsregister eingetragene Gesellschaft wegen Vermögenslosigkeit nach § 394 FamFG von Amts wegen zu löschen. Die Frist zur Erhebung eines Widerspruchs gegen die beabsichtigte Löschung wird auf 6 Wochen festgesetzt."
    },
    {
      "date": "2026-01-26",
      "id": "143411",
      "original_text": "Einreichung neuer Dokumente\nThüringen Amtsgericht Jena HRB 404087\nBEAG Agrar GmbH Behringen – Hörselberg-Hainich",
      "type": "Einreichung neuer Dokumente",
      "state": "Thüringen",
      "amtsgericht": "Amtsgericht Jena",
      "registernummer": "HRB 404087",
      "registerart": "HRB",
      "company_name": "BEAG Agrar GmbH Behringen",
      "company_seat": "Hörselberg-Hainich",
      "details": "26.01.2026 (Bekanntmachungsdatum)\n\nThüringen Amtsgericht Jena HRB 404087\nEinreichung neuer Dokumente 26.01.2026 (Eintragungsdatum)\n\nBEAG Agrar GmbH Behringen\nGesellschaft mit beschränkter Haftung\nHörselberg-Hainich\n\nBekanntmachung gem. § 52 Abs. 3 Satz 2 GmbHG: Aufgrund einer Veränderung in den Personen der Aufsichtsratsmitglieder ist durch die Geschäftsführer eine neue Liste zum Handelsregister eingereicht worden."
    },
    {
      "date": "2026-01-26",
      "id": "143412",
      "original_text": "Löschungsankündigung\nThüringen Amtsgericht Jena HRB 402682\nGeisledener Fleisch- und Wurstspezialitäten GmbH – Geisleden",
      "type": "Löschungsankündigung",
      "state": "Thüringen",
      "amtsgericht": "Amtsgericht Jena",
      "registernummer": "HRB 402682",
      "registerart": "HRB",
      "company_name": "Geisledener Fleisch- und Wurstspezialitäten GmbH",
      "company_seat": "Geisleden",
      "details": "26.01.2026 (Bekanntmachungsdatum)\n\nThüringen Amtsgericht Jena HRB 402682\nLöschungsankündigung\n\nGeisledener Fleisch- und Wurstspezialitäten GmbH\nGesellschaft mit beschränkter Haftung\nGeisleden\n\nDas Registergericht beabsichtigt, die im Handelsregister eingetragene Gesellschaft wegen Vermögenslosigkeit nach § 394 FamFG von Amts wegen zu löschen. Die Frist zur Erhebung eines Widerspruchs gegen die beabsichtigte Löschung wird auf 6 Wochen festgesetzt."
    },
    {
      "date": "2026-01-26",
      "id": "143413",
      "original_text": "Einreichung neuer Dokumente\nHamburg Amtsgericht Hamburg HRB 158471\nTK Pensionsfonds AG – Hamburg",
      "type": "Einreichung neuer Dokumente",
      "state": "Hamburg",
      "amtsgericht": "Amtsgericht Hamburg",
      "registernummer": "HRB 158471",
      "registerart": "HRB",
      "company_name": "TK Pensionsfonds AG",
      "company_seat": "Hamburg",
      "details": "26.01.2026 (Bekanntmachungsdatum)\n\nHamburg Amtsgericht Hamburg HRB 158471\nEinreichung neuer Dokumente\n\nTK Pensionsfonds AG\nAktiengesellschaft\nHamburg\n\nAls nicht eingetragen wird bekannt gemacht: Liste des Aufsichtsrats wurde eingereicht."
    },
    {
      "date": "2026-01-26",
      "id": "143414",
      "original_text": "Löschungsankündigung\nBrandenburg Amtsgericht Potsdam HRB 21028\nAnton Müsing Grund- & Tiefbau GmbH – Falkensee",
      "type": "Löschungsankündigung",
      "state": "Brandenburg",
      "amtsgericht": "Amtsgericht Potsdam",
      "registernummer": "HRB 21028",
      "registerart": "HRB",
      "company_name": "Anton Müsing Grund- & Tiefbau GmbH",
      "company_seat": "Falkensee",
      "details": "26.01.2026 (Bekanntmachungsdatum)\n\nBrandenburg Amtsgericht Potsdam HRB 21028\nLöschungsankündigung\n\nAnton Müsing Grund- & Tiefbau GmbH\nGesellschaft mit beschränkter Haftung\nFalkensee\n\nBei der nachstehenden Gesellschaft wird das Amtslöschungsverfahren gemäß § 394 FamFG eingeleitet. Widerspruchsfrist: 8 Wochen."
    },
    {
      "date": "2026-01-26",
      "id": "143415",
      "original_text": "Einreichung neuer Dokumente\nSchleswig-Holstein Amtsgericht Kiel HRB 5705\nProvinzial Lebensversicherung Aktiengesellschaft – Kiel",
      "type": "Einreichung neuer Dokumente",
      "state": "Schleswig-Holstein",
      "amtsgericht": "Amtsgericht Kiel",
      "registernummer": "HRB 5705",
      "registerart": "HRB",
      "company_name": "Provinzial Lebensversicherung Aktiengesellschaft",
      "company_seat": "Kiel",
      "details": "26.01.2026 (Bekanntmachungsdatum)\n\nSchleswig-Holstein Amtsgericht Kiel HRB 5705\nEinreichung neuer Dokumente\n\nProvinzial Lebensversicherung Aktiengesellschaft\nAktiengesellschaft\nKiel\n\nAls nicht eingetragen wird veröffentlicht: Eine neue Liste der Aufsichtsratsmitglieder ist eingereicht worden."
    },
    {
      "date": "2026-01-26",
      "id": "143416",
      "original_text": "Einreichung neuer Dokumente\nBerlin Amtsgericht Berlin (Charlottenburg) HRB 80155\nHiSolutions AG – Berlin",
      "type": "Einreichung neuer Dokumente",
      "state": "Berlin",
      "amtsgericht": "Amtsgericht Berlin (Charlottenburg)",
      "registernummer": "HRB 80155",
      "registerart": "HRB",
      "company_name": "HiSolutions AG",
      "company_seat": "Berlin",
      "details": "26.01.2026 (Bekanntmachungsdatum)\n\nBerlin Amtsgericht Berlin (Charlottenburg) HRB 80155\nEinreichung neuer Dokumente\n\nHiSolutions AG\nAktiengesellschaft\nBerlin\n\nAls nicht eingetragen wird veröffentlicht: Es wurde eine neue Liste der Aufsichtsratsmitglieder eingereicht (§ 106 AktG)."
    },
    {
      "date": "2026-01-26",
      "id": "143417",
      "original_text": "Registerbekanntmachung nach dem Umwandlungsgesetz\nBaden-Württemberg Amtsgericht Freiburg HRB 734836\nBIK Holding GmbH – Donaueschingen",
      "type": "Registerbekanntmachung nach dem Umwandlungsgesetz",
      "state": "Baden-Württemberg",
      "amtsgericht": "Amtsgericht Freiburg",
      "registernummer": "HRB 734836",
      "registerart": "HRB",
      "company_name": "BIK Holding GmbH",
      "company_seat": "Donaueschingen",
      "details": "26.01.2026 (Bekanntmachungsdatum)\n\nBaden-Württemberg Amtsgericht Freiburg HRB 734836\nRegisterbekanntmachung nach dem Umwandlungsgesetz 26.01.2026 (Eintragungsdatum)\n\nBIK Holding GmbH\nGesellschaft mit beschränkter Haftung\nDonaueschingen\n\nAls nicht eingetragen wird bekanntgemacht:\nDen Gläubigern der an der Ausgliederung beteiligten Rechtsträger ist, wenn sie binnen sechs Monaten nach dem Tag, an dem die Eintragung der Ausgliederung in das Register des Sitzes desjenigen Rechtsträgers, dessen Gläubiger sie sind, nach § 19 Abs. 3 UmwG als bekanntgemacht gilt, ihren Anspruch nach Grund und Höhe schriftlich anmelden, Sicherheit zu leisten, soweit sie nicht Befriedigung verlangen können. Dieses Recht steht den Gläubigern jedoch nur zu, wenn sie glaubhaft machen, dass durch die Ausgliederung die Erfüllung ihrer Forderung gefährdet wird."
    },
    {
      "date": "2026-01-26",
      "id": "143418",
      "original_text": "Registerbekanntmachung nach dem Umwandlungsgesetz\nBaden-Württemberg Amtsgericht Freiburg HRA 709273\nPlan-B International e.K., Inh. Benno Kuttruff – Hüfingen",
      "type": "Registerbekanntmachung nach dem Umwandlungsgesetz",
      "state": "Baden-Württemberg",
      "amtsgericht": "Amtsgericht Freiburg",
      "registernummer": "HRA 709273",
      "registerart": "HRA",
      "company_name": "Plan-B International e.K., Inh. Benno Kuttruff",
      "company_seat": "Hüfingen",
      "details": "26.01.2026 (Bekanntmachungsdatum)\n\nBaden-Württemberg Amtsgericht Freiburg HRA 709273\nRegisterbekanntmachung nach dem Umwandlungsgesetz 26.01.2026 (Eintragungsdatum)\n\nPlan-B International e.K., Inh. Benno Kuttruff\nEinzelkaufmann / Einzelkauffrau\nHüfingen\n\nAls nicht eingetragen wird bekanntgemacht:\nDen Gläubigern der an der Ausgliederung beteiligten Rechtsträger ist, wenn sie binnen sechs Monaten nach dem Tag, an dem die Eintragung der Ausgliederung in das Register des Sitzes desjenigen Rechtsträgers, dessen Gläubiger sie sind, nach § 19 Abs. 3 UmwG als bekanntgemacht gilt, ihren Anspruch nach Grund und Höhe schriftlich anmelden, Sicherheit zu leisten, soweit sie nicht Befriedigung verlangen können. Dieses Recht steht den Gläubigern jedoch nur zu, wenn sie glaubhaft machen, dass durch die Ausgliederung die Erfüllung ihrer Forderung gefährdet wird."
    },
    {
      "date": "2026-01-26",
      "id": "143419",
      "original_text": "Registerbekanntmachung nach dem Umwandlungsgesetz\nBerlin Amtsgericht Berlin (Charlottenburg) HRB 275332\nKita-Planer KP GmbH – Berlin",
      "type": "Registerbekanntmachung nach dem Umwandlungsgesetz",
      "state": "Berlin",
      "amtsgericht": "Amtsgericht Berlin (Charlottenburg)",
      "registernummer": "HRB 275332",
      "registerart": "HRB",
      "company_name": "Kita-Planer KP GmbH",
      "company_seat": "Berlin",
      "details": "26.01.2026 (Bekanntmachungsdatum)\n\nBerlin Amtsgericht Berlin (Charlottenburg) HRB 275332\nRegisterbekanntmachung nach dem Umwandlungsgesetz 23.01.2026 (Eintragungsdatum)\n\nKita-Planer KP GmbH\nGesellschaft mit beschränkter Haftung\nBerlin\n\nZu Eintragungsnummer 3 vom 23.01.2026 wird als nicht eingetragen veröffentlicht: Den Gläubigern der an der Spaltung beteiligten Rechtsträger ist, wenn sie binnen sechs Monaten nach dem Tag, an dem die Eintragung der Spaltung in das Register des Sitzes desjenigen Rechtsträgers, dessen Gläubiger sie sind, als bekannt gemacht gilt, ihren Anspruch nach Grund und Höhe schriftlich anmelden, Sicherheit zu leisten, soweit sie nicht Befriedigung verlangen können. Dieses Recht steht den Gläubigern jedoch nur zu, wenn sie glaubhaft machen, dass durch die Spaltung die Erfüllung ihrer Forderung gefährdet wird. Das Recht, Sicherheitsleistung zu verlangen, steht Gläubigern nicht zu, die im Falle der Insolvenz ein Recht auf vorzugsweise Befriedigung aus einer Deckungsmasse haben, die nach gesetzlicher Vorschrift zu ihrem Schutz errichtet und staatlich überwacht ist."
    },
    {
      "date": "2026-01-26",
      "id": "143420",
      "original_text": "Registerbekanntmachung nach dem Umwandlungsgesetz\nBerlin Amtsgericht Berlin (Charlottenburg) HRB 243718\nnetgo software GmbH – Berlin",
      "type": "Registerbekanntmachung nach dem Umwandlungsgesetz",
      "state": "Berlin",
      "amtsgericht": "Amtsgericht Berlin (Charlottenburg)",
      "registernummer": "HRB 243718",
      "registerart": "HRB",
      "company_name": "netgo software GmbH",
      "company_seat": "Berlin",
      "details": "26.01.2026 (Bekanntmachungsdatum)\n\nBerlin Amtsgericht Berlin (Charlottenburg) HRB 243718\nRegisterbekanntmachung nach dem Umwandlungsgesetz 23.01.2026 (Eintragungsdatum)\n\nnetgo software GmbH\nGesellschaft mit beschränkter Haftung\nBerlin\n\nZu Eintragungsnummer 16 vom 23.01.2026 wird als nicht eingetragen veröffentlicht: Den Gläubigern der an der Spaltung beteiligten Rechtsträger ist, wenn sie binnen sechs Monaten nach dem Tag, an dem die Eintragung der Spaltung in das Register des Sitzes desjenigen Rechtsträgers, dessen Gläubiger sie sind, als bekannt gemacht gilt, ihren Anspruch nach Grund und Höhe schriftlich anmelden, Sicherheit zu leisten, soweit sie nicht Befriedigung verlangen können. Dieses Recht steht den Gläubigern jedoch nur zu, wenn sie glaubhaft machen, dass durch die Spaltung die Erfüllung ihrer Forderung gefährdet wird. Das Recht, Sicherheitsleistung zu verlangen, steht Gläubigern nicht zu, die im Falle der Insolvenz ein Recht auf vorzugsweise Befriedigung aus einer Deckungsmasse haben, die nach gesetzlicher Vorschrift zu ihrem Schutz errichtet und staatlich überwacht ist."
    },
    {
      "date": "2026-01-26",
      "id": "143421",
      "original_text": "Registerbekanntmachung nach dem Umwandlungsgesetz\nSachsen-Anhalt Amtsgericht Stendal HRB 28693\nDreher & Schulz Kranservice GmbH – Sülzetal",
      "type": "Registerbekanntmachung nach dem Umwandlungsgesetz",
      "state": "Sachsen-Anhalt",
      "amtsgericht": "Amtsgericht Stendal",
      "registernummer": "HRB 28693",
      "registerart": "HRB",
      "company_name": "Dreher & Schulz Kranservice GmbH",
      "company_seat": "Sülzetal",
      "details": "26.01.2026 (Bekanntmachungsdatum)\n\nSachsen-Anhalt Amtsgericht Stendal HRB 28693\nRegisterbekanntmachung nach dem Umwandlungsgesetz 06.10.2025 (Eintragungsdatum)\n\nDreher & Schulz Kranservice GmbH\nGesellschaft mit beschränkter Haftung\nSülzetal\n\nDie Gesellschaft ist auf Grund des Verschmelzungsvertrages vom 19.08.2025 sowie der Beschlüsse der Gesellschafterversammlungen vom selben Tag mit der CS Transportlogistik GmbH mit dem Sitz in Bocholt (Amtsgericht Coesfeld HRB 21392) verschmolzen. Die Verschmelzung ist am 21.01.2026 in das Handelsregister der übernehmenden Gesellschaft eingetragen worden..Nicht eingetragen: Den Gläubigern der an der Verschmelzung beteiligten Rechtsträger ist, wenn sie binnen sechs Monaten nach dem Tag, an dem die Eintragung der Verschmelzung nach § 19 Abs. 3 UmwG als bekanntgemacht gilt, ihren Anspruch nach Grund und Höhe schriftlich anmelden, Sicherheit zu leisten, soweit sie nicht Befriedigung verlangen können. Dieses Recht steht ihnen jedoch nur zu, wenn sie glaubhaft machen, dass durch die Verschmelzung die Erfüllung ihrer Forderung gefährdet wird."
    },
    {
      "date": "2026-01-26",
      "id": "143422",
      "original_text": "Löschungsankündigung\nBaden-Württemberg Amtsgericht Stuttgart HRB 734393\nJ.V. Victuri UG (haftungsbeschränkt) – Stuttgart",
      "type": "Löschungsankündigung",
      "state": "Baden-Württemberg",
      "amtsgericht": "Amtsgericht Stuttgart",
      "registernummer": "HRB 734393",
      "registerart": "HRB",
      "company_name": "J.V. Victuri UG (haftungsbeschränkt)",
      "company_seat": "Stuttgart",
      "details": "26.01.2026 (Bekanntmachungsdatum)\n\nBaden-Württemberg Amtsgericht Stuttgart HRB 734393\nLöschungsankündigung\n\nJ.V. Victuri UG (haftungsbeschränkt)\nGesellschaft mit beschränkter Haftung\nStuttgart\n\nAls nicht eingetragen wird bekanntgemacht:\nDas Gericht beabsichtigt, die Gesellschaft wegen Vermögenslosigkeit im Handelsregister von Amts wegen nach § 394 FamFG zu löschen. Die Frist zur Geltendmachung eines Widerspruchs gegen die beabsichtigte Löschung ist auf zwei Monate ab Veröffentlichung bestimmt."
    },
    {
      "date": "2026-01-26",
      "id": "143423",
      "original_text": "Sonstige Registerbekanntmachung\nHamburg Amtsgericht Hamburg HRB 49369\nRYF Coiffeur GmbH – Hamburg",
      "type": "Sonstige Registerbekanntmachung",
      "state": "Hamburg",
      "amtsgericht": "Amtsgericht Hamburg",
      "registernummer": "HRB 49369",
      "registerart": "HRB",
      "company_name": "RYF Coiffeur GmbH",
      "company_seat": "Hamburg",
      "details": "26.01.2026 (Bekanntmachungsdatum)\n\nHamburg Amtsgericht Hamburg HRB 49369\nSonstige Registerbekanntmachung 26.01.2026 (Eintragungsdatum)\n\nRYF Coiffeur GmbH\nGesellschaft mit beschränkter Haftung\nHamburg\n\nAls nicht eingetragen wird bekannt gemacht:  Den Gläubigern der Gesellschaft, deren Forderungen begründet worden sind, bevor die Eintragung der Vertragsbeendigung in das Handelsregister nach § 10 HGB als bekannt gemacht gilt, ist vom anderen Vertragsteil Sicherheit zu leisten, wenn sie sich binnen 6 Monaten nach Bekanntmachung der Eintragung zu diesem Zweck bei ihm melden."
    },
    {
      "date": "2026-01-26",
      "id": "143424",
      "original_text": "Einreichung neuer Dokumente\nBaden-Württemberg Amtsgericht Stuttgart HRB 450295\nMarquardt GmbH – Rietheim-Weilheim",
      "type": "Einreichung neuer Dokumente",
      "state": "Baden-Württemberg",
      "amtsgericht": "Amtsgericht Stuttgart",
      "registernummer": "HRB 450295",
      "registerart": "HRB",
      "company_name": "Marquardt GmbH",
      "company_seat": "Rietheim-Weilheim",
      "details": "26.01.2026 (Bekanntmachungsdatum)\n\nBaden-Württemberg Amtsgericht Stuttgart HRB 450295\nEinreichung neuer Dokumente 26.01.2026 (Eintragungsdatum)\n\nMarquardt GmbH\nGesellschaft mit beschränkter Haftung\nRietheim-Weilheim\n\nDie Gesellschaft hat am 21.01.2026 die Liste über die Zusammensetzung des Aufsichtsrats zum Handelsregister eingereicht."
    },
    {
      "date": "2026-01-26",
      "id": "143425",
      "original_text": "Löschungsankündigung\nBrandenburg Amtsgericht Potsdam HRB 9085\nScheuschner Installationstechnik GmbH – Rathenow",
      "type": "Löschungsankündigung",
      "state": "Brandenburg",
      "amtsgericht": "Amtsgericht Potsdam",
      "registernummer": "HRB 9085",
      "registerart": "HRB",
      "company_name": "Scheuschner Installationstechnik GmbH",
      "company_seat": "Rathenow",
      "details": "26.01.2026 (Bekanntmachungsdatum)\n\nBrandenburg Amtsgericht Potsdam HRB 9085\nLöschungsankündigung\n\nScheuschner Installationstechnik GmbH\nGesellschaft mit beschränkter Haftung\nRathenow\n\nBei der nachstehenden Gesellschaft wird das Amtslöschungsverfahren gemäß § 394 FamFG eingeleitet."
    },
    {
      "date": "2026-01-26",
      "id": "143426",
      "original_text": "Löschungsankündigung\nBrandenburg Amtsgericht Potsdam HRB 33176\nMRLogisticSolutions UG (haftungsbeschränkt) – Brandenburg an der Havel",
      "type": "Löschungsankündigung",
      "state": "Brandenburg",
      "amtsgericht": "Amtsgericht Potsdam",
      "registernummer": "HRB 33176",
      "registerart": "HRB",
      "company_name": "MRLogisticSolutions UG (haftungsbeschränkt)",
      "company_seat": "Brandenburg an der Havel",
      "details": "26.01.2026 (Bekanntmachungsdatum)\n\nBrandenburg Amtsgericht Potsdam HRB 33176\nLöschungsankündigung\n\nMRLogisticSolutions UG (haftungsbeschränkt)\nGesellschaft mit beschränkter Haftung\nBrandenburg an der Havel\n\nBei der nachstehenden Gesellschaft wird das Amtslöschungsverfahren gemäß § 394 FamFG eingeleitet. Widerspruchsfrist: 8 Wochen."
    },
    {
      "date": "2026-01-26",
      "id": "143427",
      "original_text": "Löschungsankündigung\nSachsen-Anhalt Amtsgericht Stendal HRB 19771\nHelp 2007 Salzland UG (haftungsbeschränkt) – Schönebeck (Elbe)",
      "type": "Löschungsankündigung",
      "state": "Sachsen-Anhalt",
      "amtsgericht": "Amtsgericht Stendal",
      "registernummer": "HRB 19771",
      "registerart": "HRB",
      "company_name": "Help 2007 Salzland UG (haftungsbeschränkt)",
      "company_seat": "Schönebeck (Elbe)",
      "details": "26.01.2026 (Bekanntmachungsdatum)\n\nSachsen-Anhalt Amtsgericht Stendal HRB 19771\nLöschungsankündigung\n\nHelp 2007 Salzland UG (haftungsbeschränkt)\nGesellschaft mit beschränkter Haftung\nSchönebeck (Elbe)\n\nDas Registergericht beabsichtigt, nachfolgende Gesellschaften wegen Vermögenslosigkeit von Amts wegen nach § 394 FamFG zu löschen. Die Frist zur Erhebung eines Widerspruchs gegen die beabsichtigte Löschung wird auf drei Monate festgesetzt."
    },
    {
      "date": "2026-01-26",
      "id": "143428",
      "original_text": "Löschungsankündigung\nBrandenburg Amtsgericht Potsdam HRB 40038\n123haus UG (haftungsbeschränkt) – Brieselang",
      "type": "Löschungsankündigung",
      "state": "Brandenburg",
      "amtsgericht": "Amtsgericht Potsdam",
      "registernummer": "HRB 40038",
      "registerart": "HRB",
      "company_name": "123haus UG (haftungsbeschränkt)",
      "company_seat": "Brieselang",
      "details": "26.01.2026 (Bekanntmachungsdatum)\n\nBrandenburg Amtsgericht Potsdam HRB 40038\nLöschungsankündigung\n\n123haus UG (haftungsbeschränkt)\nGesellschaft mit beschränkter Haftung\nBrieselang\n\nBei der nachstehenden Gesellschaft wird das Amtslöschungsverfahren gemäß § 394 FamFG eingeleitet. Widerspruchsfrist: 8 Wochen."
    },
    {
      "date": "2026-01-26",
      "id": "143429",
      "original_text": "Einreichung neuer Dokumente\nSaarland Amtsgericht Saarbrücken HRB 26445\nGemeinnützige Trägergesellschaft Katholische Kindertageseinrichtungen im Saarland mit beschränkter Haftung – Dillingen",
      "type": "Einreichung neuer Dokumente",
      "state": "Saarland",
      "amtsgericht": "Amtsgericht Saarbrücken",
      "registernummer": "HRB 26445",
      "registerart": "HRB",
      "company_name": "Gemeinnützige Trägergesellschaft Katholische Kindertageseinrichtungen im Saarland mit beschränkter Haftung",
      "company_seat": "Dillingen",
      "details": "26.01.2026 (Bekanntmachungsdatum)\n\nSaarland Amtsgericht Saarbrücken HRB 26445\nEinreichung neuer Dokumente\n\nGemeinnützige Trägergesellschaft Katholische Kindertageseinrichtungen im Saarland mit beschränkter Haftung\nGesellschaft mit beschränkter Haftung\nDillingen\n\nDie Geschäftsführung der Gesellschaft hat eine Liste der Mitglieder des Aufsichtsrats zum Handelsregister eingereicht (§ 52 Abs. 3 Satz 2 GmbHG)."
    },
    {
      "date": "2026-01-26",
      "id": "143430",
      "original_text": "Löschungsankündigung\nBerlin Amtsgericht Berlin (Charlottenburg) HRB 242943\nLeerfahrten 24 GmbH – Berlin",
      "type": "Löschungsankündigung",
      "state": "Berlin",
      "amtsgericht": "Amtsgericht Berlin (Charlottenburg)",
      "registernummer": "HRB 242943",
      "registerart": "HRB",
      "company_name": "Leerfahrten 24 GmbH",
      "company_seat": "Berlin",
      "details": "26.01.2026 (Bekanntmachungsdatum)\n\nBerlin Amtsgericht Berlin (Charlottenburg) HRB 242943\nLöschungsankündigung\n\nLeerfahrten 24 GmbH\nGesellschaft mit beschränkter Haftung\nBerlin\n\nBei der nachstehenden Gesellschaft wird das Amtslöschungsverfahren gemäß § 394 FamFG eingeleitet. Widerspruchsfrist 6 Wochen"
    },
    {
      "date": "2026-01-26",
      "id": "143431",
      "original_text": "Löschungsankündigung\nBaden-Württemberg Amtsgericht Stuttgart HRB 750055\nTante Lissy´s Nahversorgungs GmbH – Stuttgart",
      "type": "Löschungsankündigung",
      "state": "Baden-Württemberg",
      "amtsgericht": "Amtsgericht Stuttgart",
      "registernummer": "HRB 750055",
      "registerart": "HRB",
      "company_name": "Tante Lissy´s Nahversorgungs GmbH",
      "company_seat": "Stuttgart",
      "details": "26.01.2026 (Bekanntmachungsdatum)\n\nBaden-Württemberg Amtsgericht Stuttgart HRB 750055\nLöschungsankündigung\n\nTante Lissy´s Nahversorgungs GmbH\nGesellschaft mit beschränkter Haftung\nStuttgart\n\nAls nicht eingetragen wird bekanntgemacht:\nDas Gericht beabsichtigt, die Gesellschaft wegen Vermögenslosigkeit im Handelsregister von Amts wegen nach § 394 FamFG zu löschen. Die Frist zur Geltendmachung eines Widerspruchs gegen die beabsichtigte Löschung ist auf zwei Monate ab Veröffentlichung bestimmt."
    },
    {
      "date": "2026-01-26",
      "id": "143432",
      "original_text": "Löschungsankündigung\nBrandenburg Amtsgericht Frankfurt/Oder HRB 15313\nKES-Dienstleistungsgesellschaft für Kurier-Eil und Sonderfahrten GmbH – Petershagen/Eggersdorf",
      "type": "Löschungsankündigung",
      "state": "Brandenburg",
      "amtsgericht": "Amtsgericht Frankfurt/Oder",
      "registernummer": "HRB 15313",
      "registerart": "HRB",
      "company_name": "KES-Dienstleistungsgesellschaft für Kurier-Eil und Sonderfahrten GmbH",
      "company_seat": "Petershagen/Eggersdorf",
      "details": "26.01.2026 (Bekanntmachungsdatum)\n\nBrandenburg Amtsgericht Frankfurt/Oder HRB 15313\nLöschungsankündigung\n\nKES-Dienstleistungsgesellschaft für Kurier-Eil und Sonderfahrten GmbH\nGesellschaft mit beschränkter Haftung\nPetershagen/Eggersdorf\n\nBei der nachstehenden Gesellschaft wird das Amtslöschungsverfahren gemäß § 394 FamFG eingeleitet."
    },
    {
      "date": "2026-01-26",
      "id": "143433",
      "original_text": "Löschungsankündigung\nBaden-Württemberg Amtsgericht Stuttgart HRB 740829\nPro Optimum - Handel und Consulting UG (haftungsbeschänkt) – Heilbronn",
      "type": "Löschungsankündigung",
      "state": "Baden-Württemberg",
      "amtsgericht": "Amtsgericht Stuttgart",
      "registernummer": "HRB 740829",
      "registerart": "HRB",
      "company_name": "Pro Optimum - Handel und Consulting UG (haftungsbeschänkt)",
      "company_seat": "Heilbronn",
      "details": "26.01.2026 (Bekanntmachungsdatum)\n\nBaden-Württemberg Amtsgericht Stuttgart HRB 740829\nLöschungsankündigung\n\nPro Optimum - Handel und Consulting UG (haftungsbeschänkt)\nGesellschaft mit beschränkter Haftung\nHeilbronn\n\nDas Gericht beabsichtigt, die Gesellschaft wegen Vermögenslosigkeit im Handelsregister von Amts wegen nach § 394 FamFG zu löschen. Die Frist zur Geltendmachung eines Widerspruchs gegen die beabsichtigte Löschung ist auf zwei Monate ab Veröffentlichung bestimmt."
    },
    {
      "date": "2026-01-26",
      "id": "143434",
      "original_text": "Sonstige Registerbekanntmachung\nHamburg Amtsgericht Hamburg HRB 185204\nLBS Landesbausparkasse NordOst AG – Potsdam und Hamburg",
      "type": "Sonstige Registerbekanntmachung",
      "state": "Hamburg",
      "amtsgericht": "Amtsgericht Hamburg",
      "registernummer": "HRB 185204",
      "registerart": "HRB",
      "company_name": "LBS Landesbausparkasse NordOst AG",
      "company_seat": "Potsdam und Hamburg",
      "details": "26.01.2026 (Bekanntmachungsdatum)\n\nHamburg Amtsgericht Hamburg HRB 185204\nSonstige Registerbekanntmachung 26.01.2026 (Eintragungsdatum)\n\nLBS Landesbausparkasse NordOst AG\nAktiengesellschaft\nPotsdam und Hamburg\n\nAls nicht eingetragen wird bekannt gemacht: Liste des Aufsichtsrats wurde eingereicht."
    },
    {
      "date": "2026-01-26",
      "id": "143435",
      "original_text": "Sonstige Registerbekanntmachung\nHamburg Amtsgericht Hamburg HRB 38053\nGMH Gebäudemanagement Hamburg GmbH – Hamburg",
      "type": "Sonstige Registerbekanntmachung",
      "state": "Hamburg",
      "amtsgericht": "Amtsgericht Hamburg",
      "registernummer": "HRB 38053",
      "registerart": "HRB",
      "company_name": "GMH Gebäudemanagement Hamburg GmbH",
      "company_seat": "Hamburg",
      "details": "26.01.2026 (Bekanntmachungsdatum)\n\nHamburg Amtsgericht Hamburg HRB 38053\nSonstige Registerbekanntmachung\n\nGMH Gebäudemanagement Hamburg GmbH\nGesellschaft mit beschränkter Haftung\nHamburg\n\nAls nicht eingetragen wird bekannt gemacht: Liste des Aufsichtsrats wurde eingereicht."
    },
    {
      "date": "2026-01-26",
      "id": "143436",
      "original_text": "Löschungsankündigung\nBaden-Württemberg Amtsgericht Stuttgart HRB 774155\nPrinters Group GmbH – Sindelfingen",
      "type": "Löschungsankündigung",
      "state": "Baden-Württemberg",
      "amtsgericht": "Amtsgericht Stuttgart",
      "registernummer": "HRB 774155",
      "registerart": "HRB",
      "company_name": "Printers Group GmbH",
      "company_seat": "Sindelfingen",
      "details": "26.01.2026 (Bekanntmachungsdatum)\n\nBaden-Württemberg Amtsgericht Stuttgart HRB 774155\nLöschungsankündigung\n\nPrinters Group GmbH\nGesellschaft mit beschränkter Haftung\nSindelfingen\n\nAls nicht eingetragen wird bekanntgemacht:\nDas Gericht beabsichtigt, die Gesellschaft wegen Vermögenslosigkeit im Handelsregister von Amts wegen nach § 394 FamFG zu löschen. Die Frist zur Geltendmachung eines Widerspruchs gegen die beabsichtigte Löschung ist auf zwei Monate ab Veröffentlichung bestimmt."
    },
    {
      "date": "2026-01-26",
      "id": "143437",
      "original_text": "Sonstige Registerbekanntmachung\nBerlin Amtsgericht Berlin (Charlottenburg) HRB 192425\nKörber Digital GmbH – Berlin",
      "type": "Sonstige Registerbekanntmachung",
      "state": "Berlin",
      "amtsgericht": "Amtsgericht Berlin (Charlottenburg)",
      "registernummer": "HRB 192425",
      "registerart": "HRB",
      "company_name": "Körber Digital GmbH",
      "company_seat": "Berlin",
      "details": "26.01.2026 (Bekanntmachungsdatum)\n\nBerlin Amtsgericht Berlin (Charlottenburg) HRB 192425\nSonstige Registerbekanntmachung 26.01.2026 (Eintragungsdatum)\n\nKörber Digital GmbH\nGesellschaft mit beschränkter Haftung\nBerlin\n\nAls eingetragen wird veröffentlicht: Der andere Vertragsteil hat den Gläubigern dieses Rechtsträgers, deren Forderungen begründet worden sind, bevor die Eintragung der Beendigung dieses Vertrages in das Handelsregister nach § 10 des Handelsgesetzbuches als bekannt gemacht gilt, Sicherheit zu leisten, wenn sie sich binnen sechs Monaten nach der Bekanntmachung der Eintragung zu diesem Zweck bei ihm melden. Dieses Recht steht den Gläubigern nicht zu, die im Fall des Insolvenzverfahrens ein Recht auf vorzugsweise Befriedigung aus der Deckungsmasse haben, die nach gesetzlicher Vorschrift zu ihrem Schutz errichtet und staatlich überwacht ist."
    },
    {
      "date": "2026-01-26",
      "id": "143438",
      "original_text": "Löschungsankündigung\nBerlin Amtsgericht Berlin (Charlottenburg) HRB 126730\nISB-Reha gemeinnützige Unternehmergesellschaft für integrative soziale und berufliche Rehabilitation (haftungsbeschränkt) – Berlin",
      "type": "Löschungsankündigung",
      "state": "Berlin",
      "amtsgericht": "Amtsgericht Berlin (Charlottenburg)",
      "registernummer": "HRB 126730",
      "registerart": "HRB",
      "company_name": "ISB-Reha gemeinnützige Unternehmergesellschaft für integrative soziale und berufliche Rehabilitation (haftungsbeschränkt)",
      "company_seat": "Berlin",
      "details": "26.01.2026 (Bekanntmachungsdatum)\n\nBerlin Amtsgericht Berlin (Charlottenburg) HRB 126730\nLöschungsankündigung\n\nISB-Reha gemeinnützige Unternehmergesellschaft für integrative soziale und berufliche Rehabilitation (haftungsbeschränkt)\nGesellschaft mit beschränkter Haftung\nBerlin\n\nBei der nachstehenden Gesellschaft wird das Amtslöschungsverfahren gemäß § 394 FamFG eingeleitet. Widerspruchsfrist 6 Wochen"
    },
    {
      "date": "2026-01-26",
      "id": "143439",
      "original_text": "Löschungsankündigung\nBaden-Württemberg Amtsgericht Ulm HRB 739118\nHUNG THINH GmbH – Bad Schussenried",
      "type": "Löschungsankündigung",
      "state": "Baden-Württemberg",
      "amtsgericht": "Amtsgericht Ulm",
      "registernummer": "HRB 739118",
      "registerart": "HRB",
      "company_name": "HUNG THINH GmbH",
      "company_seat": "Bad Schussenried",
      "details": "26.01.2026 (Bekanntmachungsdatum)\n\nBaden-Württemberg Amtsgericht Ulm HRB 739118\nLöschungsankündigung\n\nHUNG THINH GmbH\nGesellschaft mit beschränkter Haftung\nBad Schussenried\n\nAls nicht eingetragen wird bekanntgemacht:\nDas Gericht beabsichtigt, die Gesellschaft wegen Vermögenslosigkeit im Handelsregister von Amts wegen nach § 394 FamFG zu löschen. Die Frist zur Geltendmachung eines Widerspruchs gegen die beabsichtigte Löschung ist auf  einen Monat ab Veröffentlichung bestimmt."
    },
    {
      "date": "2026-01-26",
      "id": "143440",
      "original_text": "Sonstige Registerbekanntmachung\nSachsen Amtsgericht Dresden HRB 1517\nSachsengarage GmbH – Dresden",
      "type": "Sonstige Registerbekanntmachung",
      "state": "Sachsen",
      "amtsgericht": "Amtsgericht Dresden",
      "registernummer": "HRB 1517",
      "registerart": "HRB",
      "company_name": "Sachsengarage GmbH",
      "company_seat": "Dresden",
      "details": "26.01.2026 (Bekanntmachungsdatum)\n\nSachsen Amtsgericht Dresden HRB 1517\nSonstige Registerbekanntmachung 26.01.2026 (Eintragungsdatum)\n\nSachsengarage GmbH\nGesellschaft mit beschränkter Haftung\nDresden\n\nDen Gläubigern der Gesellschaft, deren Forderungen begründet worden sind bevor die Eintragung der Beendigung des Beherrschungs- und Gewinnabführungsvertrages in das Handelsregister nach § 10 des Handelsgesetzbuches als bekanntgemacht gilt, hat der andere Vertragsteil Sicherheit zu leisten, wenn sie sich binnen sechs Monaten nach der Bekanntmachung der Eintragung zu diesem Zweck bei ihm melden."
    },
    {
      "date": "2026-01-26",
      "id": "143441",
      "original_text": "Löschungsankündigung\nSachsen Amtsgericht Chemnitz HRB 33298\nISARTENSIV UG (haftungsbeschränkt) – Freiberg",
      "type": "Löschungsankündigung",
      "state": "Sachsen",
      "amtsgericht": "Amtsgericht Chemnitz",
      "registernummer": "HRB 33298",
      "registerart": "HRB",
      "company_name": "ISARTENSIV UG (haftungsbeschränkt)",
      "company_seat": "Freiberg",
      "details": "26.01.2026 (Bekanntmachungsdatum)\n\nSachsen Amtsgericht Chemnitz HRB 33298\nLöschungsankündigung\n\nISARTENSIV UG (haftungsbeschränkt)\nGesellschaft mit beschränkter Haftung\nFreiberg\n\nDas Registergericht beabsichtigt, die im Handelsregister eingetragene Gesellschaft von Amts wegen nach § 394 FamFG zu löschen. Die Frist zu Erhebung eines Widerspruchs gegen die beabsichtigte Löschung wird auf einen Monat festgesetzt."
    },
    {
      "date": "2026-01-26",
      "id": "143442",
      "original_text": "Löschungsankündigung\nSachsen Amtsgericht Leipzig HRB 25614\nExpert Steuerberatungsgesellschaft mbH – Leipzig",
      "type": "Löschungsankündigung",
      "state": "Sachsen",
      "amtsgericht": "Amtsgericht Leipzig",
      "registernummer": "HRB 25614",
      "registerart": "HRB",
      "company_name": "Expert Steuerberatungsgesellschaft mbH",
      "company_seat": "Leipzig",
      "details": "26.01.2026 (Bekanntmachungsdatum)\n\nSachsen Amtsgericht Leipzig HRB 25614\nLöschungsankündigung 26.01.2026 (Eintragungsdatum)\n\nExpert Steuerberatungsgesellschaft mbH\nGesellschaft mit beschränkter Haftung\nLeipzig\n\nDas Registergericht beabsichtigt, die im Handelsregister eingetragene Gesellschaft von Amts wegen nach § 394 FamFG zu löschen. Die Frist zu Erhebung eines Widerspruchs gegen die beabsichtigte Löschung wird auf einen Monat festgesetzt."
    },
    {
      "date": "2026-01-26",
      "id": "143443",
      "original_text": "Einreichung neuer Dokumente\nNiedersachsen Amtsgericht Hannover HRB 215045\nEcolutions GmbH & Co. KGaA – Langenhagen",
      "type": "Einreichung neuer Dokumente",
      "state": "Niedersachsen",
      "amtsgericht": "Amtsgericht Hannover",
      "registernummer": "HRB 215045",
      "registerart": "HRB",
      "company_name": "Ecolutions GmbH & Co. KGaA",
      "company_seat": "Langenhagen",
      "details": "26.01.2026 (Bekanntmachungsdatum)\n\nNiedersachsen Amtsgericht Hannover HRB 215045\nEinreichung neuer Dokumente 26.01.2026 (Eintragungsdatum)\n\nEcolutions GmbH & Co. KGaA\nKommanditgesellschaft auf Aktien\nLangenhagen\n\nDie Liste der Mitglieder des Aufsichtsrats wurde beim Registergericht eingereicht."
    },
    {
      "date": "2026-01-26",
      "id": "143444",
      "original_text": "Löschungsankündigung\nNiedersachsen Amtsgericht Osnabrück HRB 214942\nProjekthochzwei GmbH – Georgsmarienhütte",
      "type": "Löschungsankündigung",
      "state": "Niedersachsen",
      "amtsgericht": "Amtsgericht Osnabrück",
      "registernummer": "HRB 214942",
      "registerart": "HRB",
      "company_name": "Projekthochzwei GmbH",
      "company_seat": "Georgsmarienhütte",
      "details": "26.01.2026 (Bekanntmachungsdatum)\n\nNiedersachsen Amtsgericht Osnabrück HRB 214942\nLöschungsankündigung\n\nProjekthochzwei GmbH\nGesellschaft mit beschränkter Haftung\nGeorgsmarienhütte\n\nDas Registergericht beabsichtigt, die Gesellschaft von Amts wegen nach § 394 FamFG wegen Vermögenslosigkeit zu löschen. Die Frist zur Erhebung eines Widerspruchs ist auf 1 Monat ab dieser Registerbekanntmachung festgesetzt."
    },
    {
      "date": "2026-01-26",
      "id": "143445",
      "original_text": "Löschungsankündigung\nRheinland-Pfalz Amtsgericht Ludwigshafen a.Rhein (Ludwigshafen) HRB 65371\nB. M. T. GmbH – Mutterstadt",
      "type": "Löschungsankündigung",
      "state": "Rheinland-Pfalz",
      "amtsgericht": "Amtsgericht Ludwigshafen a.Rhein (Ludwigshafen)",
      "registernummer": "HRB 65371",
      "registerart": "HRB",
      "company_name": "B. M. T. GmbH",
      "company_seat": "Mutterstadt",
      "details": "26.01.2026 (Bekanntmachungsdatum)\n\nRheinland-Pfalz Amtsgericht Ludwigshafen a.Rhein (Ludwigshafen) HRB 65371\nLöschungsankündigung\n\nB. M. T. GmbH\nGesellschaft mit beschränkter Haftung\nMutterstadt\n\nDas Registergericht beabsichtigt die Gesellschaft von Amts wegen nach § 394 FamFG zu löschen. Die Frist zur Erhebung eines Widerspruchs ist auf einen Monat festgesetzt."
    },
    {
      "date": "2026-01-26",
      "id": "143446",
      "original_text": "Sonstige Registerbekanntmachung\nRheinland-Pfalz Amtsgericht Mainz HRB 48637\nPackex GmbH – Worms",
      "type": "Sonstige Registerbekanntmachung",
      "state": "Rheinland-Pfalz",
      "amtsgericht": "Amtsgericht Mainz",
      "registernummer": "HRB 48637",
      "registerart": "HRB",
      "company_name": "Packex GmbH",
      "company_seat": "Worms",
      "details": "26.01.2026 (Bekanntmachungsdatum)\n\nRheinland-Pfalz Amtsgericht Mainz HRB 48637\nSonstige Registerbekanntmachung 26.01.2026 (Eintragungsdatum)\n\nPackex GmbH\nGesellschaft mit beschränkter Haftung\nWorms\n\nAls nicht eingetragen wird veröffentlicht: Den Gläubigern der Gesellschaft, deren Forderungen begründet worden sind, bevor die Eintragung der Beendigung des Gewinnabführungsvertrages in das Handelsregister nach § 10 des Handelsgesetzbuches als bekanntgemacht gilt, hat der andere Vertragsteil Sicherheit zu leisten, wenn sie sich binnen sechs Monaten nach der Bekanntmachung der Eintragung zu diesem Zweck bei ihm melden."
    },
    {
      "date": "2026-01-26",
      "id": "143447",
      "original_text": "Löschungsankündigung\nBremen Amtsgericht Bremen HRB 29302\nKaseel Safety GmbH – Bremen",
      "type": "Löschungsankündigung",
      "state": "Bremen",
      "amtsgericht": "Amtsgericht Bremen",
      "registernummer": "HRB 29302",
      "registerart": "HRB",
      "company_name": "Kaseel Safety GmbH",
      "company_seat": "Bremen",
      "details": "26.01.2026 (Bekanntmachungsdatum)\n\nBremen Amtsgericht Bremen HRB 29302\nLöschungsankündigung\n\nKaseel Safety GmbH\nGesellschaft mit beschränkter Haftung\nBremen\n\nEs ist beabsichtigt die im Handelsregister eingetragene Gesellschaft von Amts wegen gemäß § 394 FamFG zu löschen. Gegen die Löschung kann beim AG Bremen schriftlich oder zu Protokoll der Geschäftsstelle Widerspruch eingelegt werden. Widerspruchsfrist 4 Wochen."
    },
    {
      "date": "2026-01-26",
      "id": "143448",
      "original_text": "Löschungsankündigung\nBremen Amtsgericht Bremen HRB 39546\nLUX AETERNA GmbH – Bremerhaven",
      "type": "Löschungsankündigung",
      "state": "Bremen",
      "amtsgericht": "Amtsgericht Bremen",
      "registernummer": "HRB 39546",
      "registerart": "HRB",
      "company_name": "LUX AETERNA GmbH",
      "company_seat": "Bremerhaven",
      "details": "26.01.2026 (Bekanntmachungsdatum)\n\nBremen Amtsgericht Bremen HRB 39546\nLöschungsankündigung\n\nLUX AETERNA GmbH\nGesellschaft mit beschränkter Haftung\nBremerhaven\n\nEs ist beabsichtigt die im Handelsregister eingetragene Gesellschaft von Amts wegen gemäß § 394 FamFG zu löschen. Gegen die Löschung kann beim AG Bremen schriftlich oder zu Protokoll der Geschäftsstelle Widerspruch eingelegt werden. Widerspruchsfrist 4 Wochen."
    },
    {
      "date": "2026-01-26",
      "id": "143449",
      "original_text": "Registerbekanntmachung nach dem Umwandlungsgesetz\nNordrhein-Westfalen Amtsgericht Bochum HRB 10512\nBVS Baustellen-Verkehrssicherungs-Service GmbH – Bochum",
      "type": "Registerbekanntmachung nach dem Umwandlungsgesetz",
      "state": "Nordrhein-Westfalen",
      "amtsgericht": "Amtsgericht Bochum",
      "registernummer": "HRB 10512",
      "registerart": "HRB",
      "company_name": "BVS Baustellen-Verkehrssicherungs-Service GmbH",
      "company_seat": "Bochum",
      "details": "26.01.2026 (Bekanntmachungsdatum)\n\nNordrhein-Westfalen Amtsgericht Bochum HRB 10512\nRegisterbekanntmachung nach dem Umwandlungsgesetz 22.01.2026 (Eintragungsdatum)\n\nBVS Baustellen-Verkehrssicherungs-Service GmbH\nGesellschaft mit beschränkter Haftung\nBochum\n\nDen Gläubigern der an der Ausgliederung beteiligten Rechtsträger ist, wenn sie binnen sechs Monaten nach dem Tag, an dem die Eintragung der Ausgliederung in das Register des Sitzes desjenigen Rechtsträgers, dessen Gläubiger sie sind, nach § 19 Absatz 3 UmwG als bekanntgemacht gilt, ihren Anspruch nach Grund und Höhe schriftlich anmelden, Sicherheit zu leisten, soweit sie nicht Befriedigung verlangen können. Dieses Recht steht den Gläubigern jedoch nur zu, wenn sie glaubhaft machen, dass durch die Ausgliederung die Erfüllung ihrer Forderung gefährdet wird."
    },
    {
      "date": "2026-01-26",
      "id": "143450",
      "original_text": "Registerbekanntmachung nach dem Umwandlungsgesetz\nNordrhein-Westfalen Amtsgericht Düsseldorf HRB 54004\nKito Europe GmbH – Düsseldorf",
      "type": "Registerbekanntmachung nach dem Umwandlungsgesetz",
      "state": "Nordrhein-Westfalen",
      "amtsgericht": "Amtsgericht Düsseldorf",
      "registernummer": "HRB 54004",
      "registerart": "HRB",
      "company_name": "Kito Europe GmbH",
      "company_seat": "Düsseldorf",
      "details": "26.01.2026 (Bekanntmachungsdatum)\n\nNordrhein-Westfalen Amtsgericht Düsseldorf HRB 54004\nRegisterbekanntmachung nach dem Umwandlungsgesetz 26.01.2026 (Eintragungsdatum)\n\nKito Europe GmbH\nGesellschaft mit beschränkter Haftung\nDüsseldorf\n\nDen Gläubigern der an der Verschmelzung beteiligten Rechtsträger ist, wenn sie binnen sechs Monaten nach dem Tag, an dem die Eintragung der Verschmelzung in das Register des Sitzes desjenigen Rechtsträgers, dessen Gläubiger sie sind, nach § 19 Absatz 3 UmwG als bekanntgemacht gilt, ihren Anspruch nach Grund und Höhe schriftlich anmelden, Sicherheit zu leisten, soweit sie nicht Befriedigung verlangen können. Dieses Recht steht den Gläubigern jedoch nur zu, wenn sie glaubhaft machen, dass durch die Verschmelzung die Erfüllung ihrer Forderung gefährdet wird."
    },
    {
      "date": "2026-01-26",
      "id": "143451",
      "original_text": "Löschungsankündigung\nNordrhein-Westfalen Amtsgericht Köln HRB 97744\nINTERNATIONAL BRO GmbH – Köln",
      "type": "Löschungsankündigung",
      "state": "Nordrhein-Westfalen",
      "amtsgericht": "Amtsgericht Köln",
      "registernummer": "HRB 97744",
      "registerart": "HRB",
      "company_name": "INTERNATIONAL BRO GmbH",
      "company_seat": "Köln",
      "details": "26.01.2026 (Bekanntmachungsdatum)\n\nNordrhein-Westfalen Amtsgericht Köln HRB 97744\nLöschungsankündigung\n\nINTERNATIONAL BRO GmbH\nGesellschaft mit beschränkter Haftung\nKöln\n\nDas Registergericht beabsichtigt die Gesellschaft von Amts wegen nach § 394 FamFG zu löschen. Die Frist zur Erhebung eines Widerspruchs ist auf einen Monat festgesetzt."
    },
    {
      "date": "2026-01-26",
      "id": "143452",
      "original_text": "Registerbekanntmachung nach dem Umwandlungsgesetz\nNordrhein-Westfalen Amtsgericht Köln HRB 81299\nPE Gleisdreieck Wohnen Verwaltung GmbH – Köln",
      "type": "Registerbekanntmachung nach dem Umwandlungsgesetz",
      "state": "Nordrhein-Westfalen",
      "amtsgericht": "Amtsgericht Köln",
      "registernummer": "HRB 81299",
      "registerart": "HRB",
      "company_name": "PE Gleisdreieck Wohnen Verwaltung GmbH",
      "company_seat": "Köln",
      "details": "26.01.2026 (Bekanntmachungsdatum)\n\nNordrhein-Westfalen Amtsgericht Köln HRB 81299\nRegisterbekanntmachung nach dem Umwandlungsgesetz 26.01.2026 (Eintragungsdatum)\n\nPE Gleisdreieck Wohnen Verwaltung GmbH\nGesellschaft mit beschränkter Haftung\nKöln\n\nDen Gläubigern der an der Verschmelzung beteiligten Rechtsträger ist, wenn sie binnen sechs Monaten nach dem Tag, an dem die Eintragung der Verschmelzung in das Register des Sitzes derjenigen Rechtsträger deren Gläubiger sie sind, nach § 19 Absatz 3 UmwG als bekanntgemacht gilt, ihren Anspruch nach Grund und Höhe schriftlich anmelden, Sicherheit zu leisten, soweit sie nicht Befriedigung verlangen können. Dieses Recht steht den Gläubigern jedoch nur zu, wenn sie glaubhaft machen, dass durch die Verschmelzung die Erfüllung ihrer Forderung gefährdet wird."
    },
    {
      "date": "2026-01-26",
      "id": "143453",
      "original_text": "Registerbekanntmachung nach dem Umwandlungsgesetz\nNordrhein-Westfalen Amtsgericht Köln HRB 48936\nCampagnolo FCE GmbH – Leverkusen",
      "type": "Registerbekanntmachung nach dem Umwandlungsgesetz",
      "state": "Nordrhein-Westfalen",
      "amtsgericht": "Amtsgericht Köln",
      "registernummer": "HRB 48936",
      "registerart": "HRB",
      "company_name": "Campagnolo FCE GmbH",
      "company_seat": "Leverkusen",
      "details": "26.01.2026 (Bekanntmachungsdatum)\n\nNordrhein-Westfalen Amtsgericht Köln HRB 48936\nRegisterbekanntmachung nach dem Umwandlungsgesetz 26.01.2026 (Eintragungsdatum)\n\nCampagnolo FCE GmbH\nGesellschaft mit beschränkter Haftung\nLeverkusen\n\nDen Gläubigern der an der Verschmelzung beteiligten Rechtsträger ist, wenn sie binnen sechs Monaten nach dem Tag, an dem die Eintragung der Verschmelzung in das Register des Sitzes desjenigen Rechtsträgers, dessen Gläubiger sie sind, nach § 19 Absatz 3 UmwG als bekanntgemacht gilt, ihren Anspruch nach Grund und Höhe schriftlich anmelden, Sicherheit zu leisten, soweit sie nicht Befriedigung verlangen können. Dieses Recht steht den Gläubigern jedoch nur zu, wenn sie glaubhaft machen, dass durch die Verschmelzung die Erfüllung ihrer Forderung gefährdet wird."
    },
    {
      "date": "2026-01-26",
      "id": "143454",
      "original_text": "Löschungsankündigung\nNordrhein-Westfalen Amtsgericht Dortmund HRB 14703\nBednara Grundstücksverwaltung, Vermietungs- und Baustoffhandel GmbH – Dortmund",
      "type": "Löschungsankündigung",
      "state": "Nordrhein-Westfalen",
      "amtsgericht": "Amtsgericht Dortmund",
      "registernummer": "HRB 14703",
      "registerart": "HRB",
      "company_name": "Bednara Grundstücksverwaltung, Vermietungs- und Baustoffhandel GmbH",
      "company_seat": "Dortmund",
      "details": "26.01.2026 (Bekanntmachungsdatum)\n\nNordrhein-Westfalen Amtsgericht Dortmund HRB 14703\nLöschungsankündigung\n\nBednara Grundstücksverwaltung, Vermietungs- und Baustoffhandel GmbH\nGesellschaft mit beschränkter Haftung\nDortmund\n\nDas Registergericht beabsichtigt die Gesellschaft von Amts wegen nach § 394 FamFG zu löschen. Die Frist zur Erhebung eines Widerspruchs ist auf #DV.Fr(Text=\"Bitte wählen Sie die Widerspruchsfrist aus!\",Eingabe=\"einen Monat\",\"zwei Monate\",\"drei Monate\",\"#insert(Text=\"Freitext\")\"|\"freier Text\") festgesetzt."
    },
    {
      "date": "2026-01-26",
      "id": "143455",
      "original_text": "Registerbekanntmachung nach dem Umwandlungsgesetz\nNordrhein-Westfalen Amtsgericht Köln HRB 122070\nempact renewables 5 GmbH – Köln",
      "type": "Registerbekanntmachung nach dem Umwandlungsgesetz",
      "state": "Nordrhein-Westfalen",
      "amtsgericht": "Amtsgericht Köln",
      "registernummer": "HRB 122070",
      "registerart": "HRB",
      "company_name": "empact renewables 5 GmbH",
      "company_seat": "Köln",
      "details": "26.01.2026 (Bekanntmachungsdatum)\n\nNordrhein-Westfalen Amtsgericht Köln HRB 122070\nRegisterbekanntmachung nach dem Umwandlungsgesetz 26.01.2026 (Eintragungsdatum)\n\nempact renewables 5 GmbH\nGesellschaft mit beschränkter Haftung\nKöln\n\nDen Gläubigern der an der Verschmelzung beteiligten Rechtsträger ist, wenn sie binnen sechs Monaten nach dem Tag, an dem die Eintragung der Verschmelzung in das Register des Sitzes desjenigen Rechtsträgers, dessen Gläubiger sie sind, nach § 19 Absatz 3 UmwG als bekanntgemacht gilt, ihren Anspruch nach Grund und Höhe schriftlich anmelden, Sicherheit zu leisten, soweit sie nicht Befriedigung verlangen können. Dieses Recht steht den Gläubigern jedoch nur zu, wenn sie glaubhaft machen, dass durch die Verschmelzung die Erfüllung ihrer Forderung gefährdet wird."
    },
    {
      "date": "2026-01-26",
      "id": "143456",
      "original_text": "Registerbekanntmachung nach dem Umwandlungsgesetz\nNordrhein-Westfalen Amtsgericht Köln HRB 98677\nBD Service GmbH – Köln",
      "type": "Registerbekanntmachung nach dem Umwandlungsgesetz",
      "state": "Nordrhein-Westfalen",
      "amtsgericht": "Amtsgericht Köln",
      "registernummer": "HRB 98677",
      "registerart": "HRB",
      "company_name": "BD Service GmbH",
      "company_seat": "Köln",
      "details": "26.01.2026 (Bekanntmachungsdatum)\n\nNordrhein-Westfalen Amtsgericht Köln HRB 98677\nRegisterbekanntmachung nach dem Umwandlungsgesetz 26.01.2026 (Eintragungsdatum)\n\nBD Service GmbH\nGesellschaft mit beschränkter Haftung\nKöln\n\nDen Gläubigern der an der Verschmelzung beteiligten Rechtsträger ist, wenn sie binnen sechs Monaten nach dem Tag, an dem die Eintragung der Verschmelzung in das Register des Sitzes derjenigen Rechtsträger deren Gläubiger sie sind, nach § 19 Absatz 3 UmwG als bekanntgemacht gilt, ihren Anspruch nach Grund und Höhe schriftlich anmelden, Sicherheit zu leisten, soweit sie nicht Befriedigung verlangen können. Dieses Recht steht den Gläubigern jedoch nur zu, wenn sie glaubhaft machen, dass durch die Verschmelzung die Erfüllung ihrer Forderung gefährdet wird."
    },
    {
      "date": "2026-01-26",
      "id": "143457",
      "original_text": "Registerbekanntmachung nach dem Umwandlungsgesetz\nNordrhein-Westfalen Amtsgericht Bochum HRB 22853\nZweite BVS Baustellen-Verkehrssicherungs-Service GmbH – Bochum",
      "type": "Registerbekanntmachung nach dem Umwandlungsgesetz",
      "state": "Nordrhein-Westfalen",
      "amtsgericht": "Amtsgericht Bochum",
      "registernummer": "HRB 22853",
      "registerart": "HRB",
      "company_name": "Zweite BVS Baustellen-Verkehrssicherungs-Service GmbH",
      "company_seat": "Bochum",
      "details": "26.01.2026 (Bekanntmachungsdatum)\n\nNordrhein-Westfalen Amtsgericht Bochum HRB 22853\nRegisterbekanntmachung nach dem Umwandlungsgesetz 22.01.2026 (Eintragungsdatum)\n\nZweite BVS Baustellen-Verkehrssicherungs-Service GmbH\nGesellschaft mit beschränkter Haftung\nBochum\n\nDen Gläubigern der an der Ausgliederung beteiligten Rechtsträger ist, wenn sie binnen sechs Monaten nach dem Tag, an dem die Eintragung der Ausgliederung in das Register des Sitzes desjenigen Rechtsträgers, dessen Gläubiger sie sind, nach § 19 Absatz 3 UmwG als bekanntgemacht gilt, ihren Anspruch nach Grund und Höhe schriftlich anmelden, Sicherheit zu leisten, soweit sie nicht Befriedigung verlangen können. Dieses Recht steht den Gläubigern jedoch nur zu, wenn sie glaubhaft machen, dass durch die Ausgliederung die Erfüllung ihrer Forderung gefährdet wird."
    },
    {
      "date": "2026-01-26",
      "id": "143458",
      "original_text": "Löschungsankündigung\nNordrhein-Westfalen Amtsgericht Duisburg HRB 26714\nENKA Automobile GmbH – Duisburg",
      "type": "Löschungsankündigung",
      "state": "Nordrhein-Westfalen",
      "amtsgericht": "Amtsgericht Duisburg",
      "registernummer": "HRB 26714",
      "registerart": "HRB",
      "company_name": "ENKA Automobile GmbH",
      "company_seat": "Duisburg",
      "details": "26.01.2026 (Bekanntmachungsdatum)\n\nNordrhein-Westfalen Amtsgericht Duisburg HRB 26714\nLöschungsankündigung\n\nENKA Automobile GmbH\nGesellschaft mit beschränkter Haftung\nDuisburg\n\nDas Registergericht beabsichtigt, die im Handelsregister unter HRB 26714 eingetragene Gesellschaft ENKA Automobile GmbH gemäß § 394 FamFG wegen Vermögenslosigkeit von Amts wegen zu löschen.\nGegen diese Verfügung kann Widerspruch eingelegt werden. Die Frist zur Erhebung eines Widerspruchs gegen die beabsichtigte Löschung von Amts wegen ist auf drei Monate festgesetzt.\n\nRechtsbehelfsbelehrung\nDer Widerspruch ist bei dem Amtsgericht Duisburg, Kardinal-Galen-Str. 124-132, 47058 Duisburg schriftlich in deutscher Sprache oder zur Niederschrift der Geschäftsstelle einzulegen. Der Widerspruch kann auch zur Niederschrift der Geschäftsstelle eines jeden Amtsgerichtes abgegeben werden.\nDie Einlegung ist auch durch Übertragung eines elektronischen Dokuments an die elektronische Poststelle des Gerichts möglich. Das elektronische Dokument muss für die Bearbeitung durch das Gericht geeignet und mit einer qualifizierten elektronischen Signatur der verantwortenden Person versehen sein oder von der verantwortenden Person signiert und auf einem sicheren Übermittlungsweg gemäß § 130 a ZPO nach näherer Maßgabe der Verordnung über die technischen Rahmenbedingungen des elektronischen Rechtsverkehrs und über das besondere elektronische Behördenpostfach (BGBl. I, S. 3803) eingereicht werden. Weitere Informationen erhalten Sie auf der Internetseite www.justiz.de <http://www.justiz.de>.\n\nDer Widerspruch muss spätestens innerhalb der gesetzten Frist bei dem Amtsgericht Duisburg eingegangen sein. Dies gilt auch dann, wenn der Widerspruch zur Niederschrift der Geschäftsstelle eines anderen Amtsgerichtes abgegeben wurde. Die Frist beginnt mit der Veröffentlichung. Fällt das Ende der Frist auf einen Sonntag, einen allgemeinen Feiertag oder Sonnabend, so endet die Frist mit Ablauf des nächsten Werktages.\n\nDer Widerspruch muss die Bezeichnung der angefochtenen Verfügung sowie die Erklärung enthalten, dass Widerspruch gegen diese Verfügung eingelegt wird. Er ist zu unterzeichnen und soll begründet werden."
    },
    {
      "date": "2026-01-26",
      "id": "143459",
      "original_text": "Registerbekanntmachung nach dem Umwandlungsgesetz\nNordrhein-Westfalen Amtsgericht Hagen HRB 13257\nbuecher.de internetstores GmbH – Hagen",
      "type": "Registerbekanntmachung nach dem Umwandlungsgesetz",
      "state": "Nordrhein-Westfalen",
      "amtsgericht": "Amtsgericht Hagen",
      "registernummer": "HRB 13257",
      "registerart": "HRB",
      "company_name": "buecher.de internetstores GmbH",
      "company_seat": "Hagen",
      "details": "26.01.2026 (Bekanntmachungsdatum)\n\nNordrhein-Westfalen Amtsgericht Hagen HRB 13257\nRegisterbekanntmachung nach dem Umwandlungsgesetz\n\nbuecher.de internetstores GmbH\nGesellschaft mit beschränkter Haftung\nHagen\n\nDen Gläubigern der an der Verschmelzung beteiligten Rechtsträger ist, wenn sie binnen sechs Monaten nach dem Tag, an dem die Eintragung der Verschmelzung in das Register des Sitzes derjenigen Rechtsträger deren Gläubiger sie sind, nach § 19 Absatz 3 UmwG als bekanntgemacht gilt, ihren Anspruch nach Grund und Höhe schriftlich anmelden, Sicherheit zu leisten, soweit sie nicht Befriedigung verlangen können. Dieses Recht steht den Gläubigern jedoch nur zu, wenn sie glaubhaft machen, dass durch die Verschmelzung die Erfüllung ihrer Forderung gefährdet wird."
    },
    {
      "date": "2026-01-26",
      "id": "143460",
      "original_text": "Löschungsankündigung\nNordrhein-Westfalen Amtsgericht Dortmund HRB 32717\nEURO M.Z. Bau Unternehmergesellschaft (haftungsbeschränkt) – Dortmund",
      "type": "Löschungsankündigung",
      "state": "Nordrhein-Westfalen",
      "amtsgericht": "Amtsgericht Dortmund",
      "registernummer": "HRB 32717",
      "registerart": "HRB",
      "company_name": "EURO M.Z. Bau Unternehmergesellschaft (haftungsbeschränkt)",
      "company_seat": "Dortmund",
      "details": "26.01.2026 (Bekanntmachungsdatum)\n\nNordrhein-Westfalen Amtsgericht Dortmund HRB 32717\nLöschungsankündigung 26.01.2026 (Eintragungsdatum)\n\nEURO M.Z. Bau Unternehmergesellschaft (haftungsbeschränkt)\nGesellschaft mit beschränkter Haftung\nDortmund\n\nDas Registergericht beabsichtigt die Gesellschaft von Amts wegen nach § 394 FamFG zu löschen. Die Frist zur Erhebung eines Widerspruchs ist auf zwei Monate festgesetzt."
    },
    {
      "date": "2026-01-26",
      "id": "143461",
      "original_text": "Registerbekanntmachung nach dem Umwandlungsgesetz\nNordrhein-Westfalen Amtsgericht Köln HRB 103978\nFulcrum Central Europe GmbH – Leverkusen",
      "type": "Registerbekanntmachung nach dem Umwandlungsgesetz",
      "state": "Nordrhein-Westfalen",
      "amtsgericht": "Amtsgericht Köln",
      "registernummer": "HRB 103978",
      "registerart": "HRB",
      "company_name": "Fulcrum Central Europe GmbH",
      "company_seat": "Leverkusen",
      "details": "26.01.2026 (Bekanntmachungsdatum)\n\nNordrhein-Westfalen Amtsgericht Köln HRB 103978\nRegisterbekanntmachung nach dem Umwandlungsgesetz 26.01.2026 (Eintragungsdatum)\n\nFulcrum Central Europe GmbH\nGesellschaft mit beschränkter Haftung\nLeverkusen\n\nDen Gläubigern der an der Verschmelzung beteiligten Rechtsträger ist, wenn sie binnen sechs Monaten nach dem Tag, an dem die Eintragung der Verschmelzung in das Register des Sitzes desjenigen Rechtsträgers, dessen Gläubiger sie sind, nach § 19 Absatz 3 UmwG als bekanntgemacht gilt, ihren Anspruch nach Grund und Höhe schriftlich anmelden, Sicherheit zu leisten, soweit sie nicht Befriedigung verlangen können. Dieses Recht steht den Gläubigern jedoch nur zu, wenn sie glaubhaft machen, dass durch die Verschmelzung die Erfüllung ihrer Forderung gefährdet wird."
    },
    {
      "date": "2026-01-26",
      "id": "143462",
      "original_text": "Löschungsankündigung\nNordrhein-Westfalen Amtsgericht Bochum HRB 22446\nMA-I Immobilien UG (haftungsbeschränkt) – Bochum",
      "type": "Löschungsankündigung",
      "state": "Nordrhein-Westfalen",
      "amtsgericht": "Amtsgericht Bochum",
      "registernummer": "HRB 22446",
      "registerart": "HRB",
      "company_name": "MA-I Immobilien UG (haftungsbeschränkt)",
      "company_seat": "Bochum",
      "details": "26.01.2026 (Bekanntmachungsdatum)\n\nNordrhein-Westfalen Amtsgericht Bochum HRB 22446\nLöschungsankündigung 27.01.2026 (Eintragungsdatum)\n\nMA-I Immobilien UG (haftungsbeschränkt)\nGesellschaft mit beschränkter Haftung\nBochum\n\nDas Registergericht beabsichtigt die Gesellschaft von Amts wegen nach § 394 FamFG zu löschen. Die Frist zur Erhebung eines Widerspruchs ist auf drei Monate festgesetzt."
    },
    {
      "date": "2026-01-26",
      "id": "143463",
      "original_text": "Löschungsankündigung\nNordrhein-Westfalen Amtsgericht Bielefeld HRB 45104\nOne Line Business UG (haftungsbeschränkt) – Bielefeld",
      "type": "Löschungsankündigung",
      "state": "Nordrhein-Westfalen",
      "amtsgericht": "Amtsgericht Bielefeld",
      "registernummer": "HRB 45104",
      "registerart": "HRB",
      "company_name": "One Line Business UG (haftungsbeschränkt)",
      "company_seat": "Bielefeld",
      "details": "26.01.2026 (Bekanntmachungsdatum)\n\nNordrhein-Westfalen Amtsgericht Bielefeld HRB 45104\nLöschungsankündigung\n\nOne Line Business UG (haftungsbeschränkt)\nGesellschaft mit beschränkter Haftung\nBielefeld\n\nDas Registergericht beabsichtigt die Gesellschaft von Amts wegen nach § 394 FamFG zu löschen. Die Frist zur Erhebung eines Widerspruchs ist auf einen Monat festgesetzt."
    },
    {
      "date": "2026-01-26",
      "id": "143464",
      "original_text": "Löschungsankündigung\nNordrhein-Westfalen Amtsgericht Köln HRB 116746\nMT Management Transporter UG (haftungsbeschränkt) – Köln",
      "type": "Löschungsankündigung",
      "state": "Nordrhein-Westfalen",
      "amtsgericht": "Amtsgericht Köln",
      "registernummer": "HRB 116746",
      "registerart": "HRB",
      "company_name": "MT Management Transporter UG (haftungsbeschränkt)",
      "company_seat": "Köln",
      "details": "26.01.2026 (Bekanntmachungsdatum)\n\nNordrhein-Westfalen Amtsgericht Köln HRB 116746\nLöschungsankündigung\n\nMT Management Transporter UG (haftungsbeschränkt)\nGesellschaft mit beschränkter Haftung\nKöln\n\nDas Registergericht beabsichtigt die Gesellschaft von Amts wegen nach § 394 FamFG zu löschen. Die Frist zur Erhebung eines Widerspruchs ist auf einen Monat festgesetzt."
    },
    {
      "date": "2026-01-26",
      "id": "143465",
      "original_text": "Löschungsankündigung\nNordrhein-Westfalen Amtsgericht Gütersloh HRB 11609\nCooper Verwaltungs UG (haftungsbeschränkt) – Gütersloh",
      "type": "Löschungsankündigung",
      "state": "Nordrhein-Westfalen",
      "amtsgericht": "Amtsgericht Gütersloh",
      "registernummer": "HRB 11609",
      "registerart": "HRB",
      "company_name": "Cooper Verwaltungs UG (haftungsbeschränkt)",
      "company_seat": "Gütersloh",
      "details": "26.01.2026 (Bekanntmachungsdatum)\n\nNordrhein-Westfalen Amtsgericht Gütersloh HRB 11609\nLöschungsankündigung\n\nCooper Verwaltungs UG (haftungsbeschränkt)\nGesellschaft mit beschränkter Haftung\nGütersloh\n\nDas Registergericht beabsichtigt die Gesellschaft von Amts wegen nach § 394 FamFG zu löschen. Die Frist zur Erhebung eines Widerspruchs ist auf einen Monat festgesetzt."
    },
    {
      "date": "2026-01-26",
      "id": "143466",
      "original_text": "Löschungsankündigung\nNordrhein-Westfalen Amtsgericht Gütersloh HRB 13228\nGWZ Logistik und Handel GmbH – Rheda-Wiedenbrück",
      "type": "Löschungsankündigung",
      "state": "Nordrhein-Westfalen",
      "amtsgericht": "Amtsgericht Gütersloh",
      "registernummer": "HRB 13228",
      "registerart": "HRB",
      "company_name": "GWZ Logistik und Handel GmbH",
      "company_seat": "Rheda-Wiedenbrück",
      "details": "26.01.2026 (Bekanntmachungsdatum)\n\nNordrhein-Westfalen Amtsgericht Gütersloh HRB 13228\nLöschungsankündigung 26.01.2026 (Eintragungsdatum)\n\nGWZ Logistik und Handel GmbH\nGesellschaft mit beschränkter Haftung\nRheda-Wiedenbrück\n\nDas Registergericht beabsichtigt die Gesellschaft von Amts wegen nach § 394 FamFG zu löschen. Die Frist zur Erhebung eines Widerspruchs ist auf einen Monat festgesetzt."
    },
    {
      "date": "2026-01-26",
      "id": "143467",
      "original_text": "Einreichung neuer Dokumente\nThüringen Amtsgericht Jena HRB 202722\nRVG Regionalverkehr Gera/Land GmbH – Gera",
      "type": "Einreichung neuer Dokumente",
      "state": "Thüringen",
      "amtsgericht": "Amtsgericht Jena",
      "registernummer": "HRB 202722",
      "registerart": "HRB",
      "company_name": "RVG Regionalverkehr Gera/Land GmbH",
      "company_seat": "Gera",
      "details": "26.01.2026 (Bekanntmachungsdatum)\n\nThüringen Amtsgericht Jena HRB 202722\nEinreichung neuer Dokumente\n\nRVG Regionalverkehr Gera/Land GmbH\nGesellschaft mit beschränkter Haftung\nGera\n\nBekanntmachung gem. § 52 Abs. 3 Satz 2 GmbHG: Aufgrund einer Veränderung in den Personen der Aufsichtsratsmitglieder ist durch die Geschäftsführer eine neue Liste zum Handelsregister eingereicht worden."
    },
    {
      "date": "2026-01-26",
      "id": "143468",
      "original_text": "Einreichung neuer Dokumente\nThüringen Amtsgericht Jena HRB 200476\nGrundstücks- und Wohnungsgesellschaft Saale-Orla mbH – Pößneck",
      "type": "Einreichung neuer Dokumente",
      "state": "Thüringen",
      "amtsgericht": "Amtsgericht Jena",
      "registernummer": "HRB 200476",
      "registerart": "HRB",
      "company_name": "Grundstücks- und Wohnungsgesellschaft Saale-Orla mbH",
      "company_seat": "Pößneck",
      "details": "26.01.2026 (Bekanntmachungsdatum)\n\nThüringen Amtsgericht Jena HRB 200476\nEinreichung neuer Dokumente 26.01.2026 (Eintragungsdatum)\n\nGrundstücks- und Wohnungsgesellschaft Saale-Orla mbH\nGesellschaft mit beschränkter Haftung\nPößneck\n\nBekanntmachung gem. § 52 Abs. 3 Satz 2 GmbHG: Aufgrund einer Veränderung in den Personen der Aufsichtsratsmitglieder ist durch die Geschäftsführer eine neue Liste zum Handelsregister eingereicht worden."
    },
    {
      "date": "2026-01-26",
      "id": "143469",
      "original_text": "Löschungsankündigung\nHessen Amtsgericht Frankfurt am Main HRB 133859\nACCA Bauleistungen UG (haftungsbeschränkt) – Frankfurt am Main",
      "type": "Löschungsankündigung",
      "state": "Hessen",
      "amtsgericht": "Amtsgericht Frankfurt am Main",
      "registernummer": "HRB 133859",
      "registerart": "HRB",
      "company_name": "ACCA Bauleistungen UG (haftungsbeschränkt)",
      "company_seat": "Frankfurt am Main",
      "details": "26.01.2026 (Bekanntmachungsdatum)\n\nHessen Amtsgericht Frankfurt am Main HRB 133859\nLöschungsankündigung\n\nACCA Bauleistungen UG (haftungsbeschränkt)\nGesellschaft mit beschränkter Haftung\nFrankfurt am Main\n\nDas Registergericht beabsichtigt die im Handelsregister eingetragene Gesellschaft von Amts wegen nach § 394 FamFG zu löschen. Die Frist zur Erhebung eines Widerspruchs gegen die beabsichtigte Löschung wird auf 1 Monat festgesetzt."
    },
    {
      "date": "2026-01-26",
      "id": "143470",
      "original_text": "Löschungsankündigung\nHessen Amtsgericht Bad Hersfeld HRB 3097\nGoredi Verwaltungs GmbH – Bad Hersfeld",
      "type": "Löschungsankündigung",
      "state": "Hessen",
      "amtsgericht": "Amtsgericht Bad Hersfeld",
      "registernummer": "HRB 3097",
      "registerart": "HRB",
      "company_name": "Goredi Verwaltungs GmbH",
      "company_seat": "Bad Hersfeld",
      "details": "26.01.2026 (Bekanntmachungsdatum)\n\nHessen Amtsgericht Bad Hersfeld HRB 3097\nLöschungsankündigung\n\nGoredi Verwaltungs GmbH\nGesellschaft mit beschränkter Haftung\nBad Hersfeld\n\nDas Registergericht beabsichtigt die im Handelsregister eingetragene Gesellschaft von Amts wegen nach § 394 FamFG zu löschen. Die Frist zur Erhebung eines Widerspruchs gegen die beabsichtigte Löschung wird auf 6 Wochen festgesetzt."
    },
    {
      "date": "2026-01-26",
      "id": "143471",
      "original_text": "Sonstige Registerbekanntmachung\nHessen Amtsgericht Fritzlar VR 2197\nWalddörfer Reit - und Fahrverein – Bad Wildungen - Hundsdorf",
      "type": "Sonstige Registerbekanntmachung",
      "state": "Hessen",
      "amtsgericht": "Amtsgericht Fritzlar",
      "registernummer": "VR 2197",
      "registerart": "VR",
      "company_name": "Walddörfer Reit - und Fahrverein",
      "company_seat": "Bad Wildungen - Hundsdorf",
      "details": "26.01.2026 (Bekanntmachungsdatum)\n\nHessen Amtsgericht Fritzlar VR 2197\nSonstige Registerbekanntmachung 26.01.2026 (Eintragungsdatum)\n\nWalddörfer Reit - und Fahrverein\neingetragener Verein\nBad Wildungen - Hundsdorf\n\nDer Verein ist aufgelöst."
    },
    {
      "date": "2026-01-26",
      "id": "143472",
      "original_text": "Löschungsankündigung\nHessen Amtsgericht Frankfurt am Main HRB 111083\nWohnHofheim Verwaltungs GmbH – Hofheim am Taunus",
      "type": "Löschungsankündigung",
      "state": "Hessen",
      "amtsgericht": "Amtsgericht Frankfurt am Main",
      "registernummer": "HRB 111083",
      "registerart": "HRB",
      "company_name": "WohnHofheim Verwaltungs GmbH",
      "company_seat": "Hofheim am Taunus",
      "details": "26.01.2026 (Bekanntmachungsdatum)\n\nHessen Amtsgericht Frankfurt am Main HRB 111083\nLöschungsankündigung\n\nWohnHofheim Verwaltungs GmbH\nGesellschaft mit beschränkter Haftung\nHofheim am Taunus\n\nEs ist beabsichtigt, die Gesellschaft wegen Vermögenslosigkeit gemäß § 394 FamFG von Amts wegen im Handelsregister zu löschen. Hiergegen kann innerhalb eines Monats nach dieser Veröffentlichung Widerspruch bei dem Amtsgericht Frankfurt am Main eingelegt werden."
    },
    {
      "date": "2026-01-26",
      "id": "143473",
      "original_text": "Sonstige Registerbekanntmachung\nHessen Amtsgericht Fritzlar VR 177\nTurn- und Sportverein Blau-Weiß Hebel – Wabern",
      "type": "Sonstige Registerbekanntmachung",
      "state": "Hessen",
      "amtsgericht": "Amtsgericht Fritzlar",
      "registernummer": "VR 177",
      "registerart": "VR",
      "company_name": "Turn- und Sportverein Blau-Weiß Hebel",
      "company_seat": "Wabern",
      "details": "26.01.2026 (Bekanntmachungsdatum)\n\nHessen Amtsgericht Fritzlar VR 177\nSonstige Registerbekanntmachung 26.01.2026 (Eintragungsdatum)\n\nTurn- und Sportverein Blau-Weiß Hebel\neingetragener Verein\nWabern\n\nDer Verein ist aufgelöst."
    },
    {
      "date": "2026-01-26",
      "id": "143474",
      "original_text": "Einreichung neuer Dokumente\nHessen Amtsgericht Frankfurt am Main HRB 120599\nThe Payments Group Holding GmbH & Co. KGaA – Frankfurt am Main",
      "type": "Einreichung neuer Dokumente",
      "state": "Hessen",
      "amtsgericht": "Amtsgericht Frankfurt am Main",
      "registernummer": "HRB 120599",
      "registerart": "HRB",
      "company_name": "The Payments Group Holding GmbH & Co. KGaA",
      "company_seat": "Frankfurt am Main",
      "details": "26.01.2026 (Bekanntmachungsdatum)\n\nHessen Amtsgericht Frankfurt am Main HRB 120599\nEinreichung neuer Dokumente 26.01.2026 (Eintragungsdatum)\n\nThe Payments Group Holding GmbH & Co. KGaA\nKommanditgesellschaft auf Aktien\nFrankfurt am Main\n\nDurch eine Änderung in den Personen der Aufsichtsratsmitglieder ist eine Liste der Mitglieder des Aufsichtsrates zum Handelsregister eingereicht worden."
    },
    {
      "date": "2026-01-26",
      "id": "143475",
      "original_text": "Sonstige Registerbekanntmachung\nHessen Amtsgericht Kassel HRB 13349\nAWO gemeinnützige Gesellschaft für soziale Einrichtungen und Dienste in Nordhessen mbH – Kassel",
      "type": "Sonstige Registerbekanntmachung",
      "state": "Hessen",
      "amtsgericht": "Amtsgericht Kassel",
      "registernummer": "HRB 13349",
      "registerart": "HRB",
      "company_name": "AWO gemeinnützige Gesellschaft für soziale Einrichtungen und Dienste in Nordhessen mbH",
      "company_seat": "Kassel",
      "details": "26.01.2026 (Bekanntmachungsdatum)\n\nHessen Amtsgericht Kassel HRB 13349\nSonstige Registerbekanntmachung\n\nAWO gemeinnützige Gesellschaft für soziale Einrichtungen und Dienste in Nordhessen mbH\nGesellschaft mit beschränkter Haftung\nKassel\n\nDurch eine Änderung in den Personen der Aufsichtsratsmitglieder ist eine Liste der Mitglieder des Aufsichtsrates zum Handelsregister eingereicht worden."
    },
    {
      "date": "2026-01-26",
      "id": "143476",
      "original_text": "Sonstige Registerbekanntmachung\nHessen Amtsgericht Wetzlar VR 3623\nDorfGeschichte Greifenstein – Greifenstein",
      "type": "Sonstige Registerbekanntmachung",
      "state": "Hessen",
      "amtsgericht": "Amtsgericht Wetzlar",
      "registernummer": "VR 3623",
      "registerart": "VR",
      "company_name": "DorfGeschichte Greifenstein",
      "company_seat": "Greifenstein",
      "details": "26.01.2026 (Bekanntmachungsdatum)\n\nHessen Amtsgericht Wetzlar VR 3623\nSonstige Registerbekanntmachung 26.01.2026 (Eintragungsdatum)\n\nDorfGeschichte Greifenstein\neingetragener Verein\nGreifenstein\n\nDer Verein ist wegen Wegfalls aller Mitglieder und Aufgabe der Vereinstätigkeit erloschen"
    },
    {
      "date": "2026-01-26",
      "id": "143477",
      "original_text": "Sonstige Registerbekanntmachung\nHessen Amtsgericht Wiesbaden HRB 2174\nR+V Pensionsversicherung a.G. – Wiesbaden",
      "type": "Sonstige Registerbekanntmachung",
      "state": "Hessen",
      "amtsgericht": "Amtsgericht Wiesbaden",
      "registernummer": "HRB 2174",
      "registerart": "HRB",
      "company_name": "R+V Pensionsversicherung a.G.",
      "company_seat": "Wiesbaden",
      "details": "26.01.2026 (Bekanntmachungsdatum)\n\nHessen Amtsgericht Wiesbaden HRB 2174\nSonstige Registerbekanntmachung\n\nR+V Pensionsversicherung a.G.\nVersicherungsverein auf Gegenseitigkeit\nWiesbaden\n\nDurch eine Änderung in den Personen der Aufsichtsratsmitglieder ist eine Liste der Mitglieder des Aufsichtsrates zum Handelsregister eingereicht worden."
    },
    {
      "date": "2026-01-26",
      "id": "143478",
      "original_text": "Löschungsankündigung\nHessen Amtsgericht Frankfurt am Main HRB 80038\nparapluie Beteiligungs- und Verwaltungsgesellschaft mbH – Frankfurt am Main",
      "type": "Löschungsankündigung",
      "state": "Hessen",
      "amtsgericht": "Amtsgericht Frankfurt am Main",
      "registernummer": "HRB 80038",
      "registerart": "HRB",
      "company_name": "parapluie Beteiligungs- und Verwaltungsgesellschaft mbH",
      "company_seat": "Frankfurt am Main",
      "details": "26.01.2026 (Bekanntmachungsdatum)\n\nHessen Amtsgericht Frankfurt am Main HRB 80038\nLöschungsankündigung\n\nparapluie Beteiligungs- und Verwaltungsgesellschaft mbH\nGesellschaft mit beschränkter Haftung\nFrankfurt am Main\n\nDas Registergericht beabsichtigt die im Handelsregister eingetragene Gesellschaft von Amts wegen nach § 394 FamFG zu löschen. Die Frist zur Erhebung eines Widerspruchs gegen die beabsichtigte Löschung wird auf 1 Monat festgesetzt."
    },
    {
      "date": "2026-01-26",
      "id": "143479",
      "original_text": "Sonstige Registerbekanntmachung\nHessen Amtsgericht Darmstadt VR 84532\nFörderverein Kita Schatzkiste e.V. – Mühltal",
      "type": "Sonstige Registerbekanntmachung",
      "state": "Hessen",
      "amtsgericht": "Amtsgericht Darmstadt",
      "registernummer": "VR 84532",
      "registerart": "VR",
      "company_name": "Förderverein Kita Schatzkiste e.V.",
      "company_seat": "Mühltal",
      "details": "26.01.2026 (Bekanntmachungsdatum)\n\nHessen Amtsgericht Darmstadt VR 84532\nSonstige Registerbekanntmachung 25.01.2026 (Eintragungsdatum)\n\nFörderverein Kita Schatzkiste e.V.\neingetragener Verein\nMühltal\n\nDer Verein ist aufgelöst."
    },
    {
      "date": "2026-01-26",
      "id": "143480",
      "original_text": "Löschungsankündigung\nHessen Amtsgericht Bad Hersfeld HRA 1913\nGoredi GmbH & Co. KG – Bad Hersfeld",
      "type": "Löschungsankündigung",
      "state": "Hessen",
      "amtsgericht": "Amtsgericht Bad Hersfeld",
      "registernummer": "HRA 1913",
      "registerart": "HRA",
      "company_name": "Goredi GmbH & Co. KG",
      "company_seat": "Bad Hersfeld",
      "details": "26.01.2026 (Bekanntmachungsdatum)\n\nHessen Amtsgericht Bad Hersfeld HRA 1913\nLöschungsankündigung\n\nGoredi GmbH & Co. KG\nKommanditgesellschaft\nBad Hersfeld\n\nDas Registergericht beabsichtigt die im Handelsregister eingetragene Firma von Amts wegen nach § 394 FamFG zu löschen. Die Frist zur Erhebung eines Widerspruchs gegen die beabsichtigte Löschung wird auf 6 Wochen festgesetzt."
    },
    {
      "date": "2026-01-26",
      "id": "143481",
      "original_text": "Sonstige Registerbekanntmachung\nHessen Amtsgericht Frankfurt am Main HRB 14905\nFit Reisen GmbH – Frankfurt am Main",
      "type": "Sonstige Registerbekanntmachung",
      "state": "Hessen",
      "amtsgericht": "Amtsgericht Frankfurt am Main",
      "registernummer": "HRB 14905",
      "registerart": "HRB",
      "company_name": "Fit Reisen GmbH",
      "company_seat": "Frankfurt am Main",
      "details": "26.01.2026 (Bekanntmachungsdatum)\n\nHessen Amtsgericht Frankfurt am Main HRB 14905\nSonstige Registerbekanntmachung 26.01.2026 (Eintragungsdatum)\n\nFit Reisen GmbH\nGesellschaft mit beschränkter Haftung\nFrankfurt am Main\n\nDen Gläubigern der Gesellschaft, deren Forderungen begründet worden sind, bevor die Eintragung der Beendigung des Vertrags in das Handelsregister nach § 10 HGB bekannt gemacht worden ist, ist vom anderen Vertragsteil Sicherheit zu leisten, wenn sie sich binnen sechs Monaten nach dieser Bekanntmachung zu diesem Zweck bei ihm melden."
    }
  ]
}