{
  "date": "2026-01-14",
  "date_of_scrape": "2026-01-15T04:23:35.586Z",
  "tool_version": "0.2.0",
  "number_of_announcements": 119,
  "announcements": [
    {
      "date": "2026-01-14",
      "id": "142324",
      "original_text": "Einreichung neuer Dokumente\nBayern Amtsgericht Nürnberg HRB 66\nNÜRNBERGER Beteiligungs-AG – Nürnberg",
      "type": "Einreichung neuer Dokumente",
      "state": "Bayern",
      "amtsgericht": "Amtsgericht Nürnberg",
      "registernummer": "HRB 66",
      "registerart": "HRB",
      "company_name": "NÜRNBERGER Beteiligungs-AG",
      "company_seat": "Nürnberg",
      "details": "14.01.2026 (Bekanntmachungsdatum)\n\nBayern Amtsgericht Nürnberg HRB 66\nEinreichung neuer Dokumente\n\nNÜRNBERGER Beteiligungs-AG\nAktiengesellschaft\nNürnberg\n\nDem Amtsgericht Nürnberg -Registergericht- ist eine Liste der Mitglieder des Aufsichtsrats eingereicht worden, § 106 AktG."
    },
    {
      "date": "2026-01-14",
      "id": "142325",
      "original_text": "Einreichung neuer Dokumente\nBayern Amtsgericht München HRB 241947\nmsg nexinsure AG – Ismaning",
      "type": "Einreichung neuer Dokumente",
      "state": "Bayern",
      "amtsgericht": "Amtsgericht München",
      "registernummer": "HRB 241947",
      "registerart": "HRB",
      "company_name": "msg nexinsure AG",
      "company_seat": "Ismaning",
      "details": "14.01.2026 (Bekanntmachungsdatum)\n\nBayern Amtsgericht München HRB 241947\nEinreichung neuer Dokumente 13.01.2026 (Eintragungsdatum)\n\nmsg nexinsure AG\nAktiengesellschaft\nIsmaning\n\nDem Amtsgericht München -Registergericht- ist eine Liste der Mitglieder des Aufsichtsrats eingereicht worden, § 106 AktG."
    },
    {
      "date": "2026-01-14",
      "id": "142326",
      "original_text": "Einreichung neuer Dokumente\nBayern Amtsgericht Nürnberg HRB 1072\nVAG Verkehrs- Aktiengesellschaft – Nürnberg",
      "type": "Einreichung neuer Dokumente",
      "state": "Bayern",
      "amtsgericht": "Amtsgericht Nürnberg",
      "registernummer": "HRB 1072",
      "registerart": "HRB",
      "company_name": "VAG Verkehrs- Aktiengesellschaft",
      "company_seat": "Nürnberg",
      "details": "14.01.2026 (Bekanntmachungsdatum)\n\nBayern Amtsgericht Nürnberg HRB 1072\nEinreichung neuer Dokumente\n\nVAG Verkehrs- Aktiengesellschaft\nAktiengesellschaft\nNürnberg\n\nDem Amtsgericht Nürnberg -Registergericht- ist eine Liste der Mitglieder des Aufsichtsrats eingereicht worden, § 106 AktG."
    },
    {
      "date": "2026-01-14",
      "id": "142327",
      "original_text": "Einreichung neuer Dokumente\nBayern Amtsgericht Augsburg HRB 38582\nEisen-Fischer GmbH – Nördlingen",
      "type": "Einreichung neuer Dokumente",
      "state": "Bayern",
      "amtsgericht": "Amtsgericht Augsburg",
      "registernummer": "HRB 38582",
      "registerart": "HRB",
      "company_name": "Eisen-Fischer GmbH",
      "company_seat": "Nördlingen",
      "details": "14.01.2026 (Bekanntmachungsdatum)\n\nBayern Amtsgericht Augsburg HRB 38582\nEinreichung neuer Dokumente\n\nEisen-Fischer GmbH\nGesellschaft mit beschränkter Haftung\nNördlingen\n\nDem Amtsgericht Augsburg -Registergericht- ist eine Liste der Mitglieder des Aufsichtsrats eingereicht worden, § 52 Abs. 3 S. 2 GmbHG."
    },
    {
      "date": "2026-01-14",
      "id": "142328",
      "original_text": "Registerbekanntmachung nach dem Umwandlungsgesetz\nBayern Amtsgericht München HRB 308603\nSchönegger Besitz GmbH – Prem",
      "type": "Registerbekanntmachung nach dem Umwandlungsgesetz",
      "state": "Bayern",
      "amtsgericht": "Amtsgericht München",
      "registernummer": "HRB 308603",
      "registerart": "HRB",
      "company_name": "Schönegger Besitz GmbH",
      "company_seat": "Prem",
      "details": "14.01.2026 (Bekanntmachungsdatum)\n\nBayern Amtsgericht München HRB 308603\nRegisterbekanntmachung nach dem Umwandlungsgesetz 13.01.2026 (Eintragungsdatum)\n\nSchönegger Besitz GmbH\nGesellschaft mit beschränkter Haftung\nPrem\n\nDen Gläubigern der an der Ausgliederung beteiligten Rechtsträger ist, wenn sie binnen sechs Monaten nach dem Tag, an dem die Eintragung der Ausgliederung in das Register des Sitzes desjenigen Rechtsträgers, dessen Gläubiger sie sind, nach §§ 125, 19 Abs. 3 UmwG als bekannt gemacht gilt, ihren Anspruch nach Grund und Höhe in Textform anmelden, Sicherheit zu leisten, soweit sie nicht Befriedigung verlangen können. Dieses Recht steht den Gläubigern jedoch nur zu, wenn sie glaubhaft machen, dass durch die Ausgliederung die Erfüllung ihrer Forderung gefährdet wird."
    },
    {
      "date": "2026-01-14",
      "id": "142329",
      "original_text": "Löschungsankündigung\nBayern Amtsgericht Bayreuth HRB 5133\nWhite Rabbit Media GmbH – Thurnau",
      "type": "Löschungsankündigung",
      "state": "Bayern",
      "amtsgericht": "Amtsgericht Bayreuth",
      "registernummer": "HRB 5133",
      "registerart": "HRB",
      "company_name": "White Rabbit Media GmbH",
      "company_seat": "Thurnau",
      "details": "14.01.2026 (Bekanntmachungsdatum)\n\nBayern Amtsgericht Bayreuth HRB 5133\nLöschungsankündigung\n\nWhite Rabbit Media GmbH\nGesellschaft mit beschränkter Haftung\nThurnau\n\nDas Registergericht beabsichtigt, die im Handelsregister eingetragene Gesellschaft wegen Vermögenslosigkeit von Amts wegen nach § 394 FamFG zu löschen. Die Frist zur Erhebung eines Widerspruchs ist auf einen Monat festgesetzt."
    },
    {
      "date": "2026-01-14",
      "id": "142330",
      "original_text": "Sonstige Registerbekanntmachung\nBayern Amtsgericht München HRB 223259\nGenerali Engagement Solutions GmbH – München",
      "type": "Sonstige Registerbekanntmachung",
      "state": "Bayern",
      "amtsgericht": "Amtsgericht München",
      "registernummer": "HRB 223259",
      "registerart": "HRB",
      "company_name": "Generali Engagement Solutions GmbH",
      "company_seat": "München",
      "details": "14.01.2026 (Bekanntmachungsdatum)\n\nBayern Amtsgericht München HRB 223259\nSonstige Registerbekanntmachung 13.01.2026 (Eintragungsdatum)\n\nGenerali Engagement Solutions GmbH\nGesellschaft mit beschränkter Haftung\nMünchen\n\nDen Gläubigern der Gesellschaft, deren Forderungen begründet worden sind, bevor die Eintragung der Beendigung des Beherrschungsvertrages in das Handelsregister nach § 10 des Handelsgesetzbuches als bekanntgemacht gilt, hat der andere Vertragsteil Sicherheit zu leisten, wenn sie sich binnen sechs Monaten nach der Bekanntmachung der Eintragung zu diesem Zweck bei ihm melden."
    },
    {
      "date": "2026-01-14",
      "id": "142331",
      "original_text": "Einreichung neuer Dokumente\nBayern Amtsgericht München HRB 220561\nMILLENIUM DEVELOPMENT Aktiengesellschaft – Berg",
      "type": "Einreichung neuer Dokumente",
      "state": "Bayern",
      "amtsgericht": "Amtsgericht München",
      "registernummer": "HRB 220561",
      "registerart": "HRB",
      "company_name": "MILLENIUM DEVELOPMENT Aktiengesellschaft",
      "company_seat": "Berg",
      "details": "14.01.2026 (Bekanntmachungsdatum)\n\nBayern Amtsgericht München HRB 220561\nEinreichung neuer Dokumente\n\nMILLENIUM DEVELOPMENT Aktiengesellschaft\nAktiengesellschaft\nBerg\n\nDem Amtsgericht München -Registergericht- ist eine Liste der Mitglieder des Aufsichtsrats eingereicht worden, § 106 AktG."
    },
    {
      "date": "2026-01-14",
      "id": "142332",
      "original_text": "Sonstige Registerbekanntmachung\nBayern Amtsgericht München HRB 275747\nMVZ Pathologie Leipziger Straße GmbH – München",
      "type": "Sonstige Registerbekanntmachung",
      "state": "Bayern",
      "amtsgericht": "Amtsgericht München",
      "registernummer": "HRB 275747",
      "registerart": "HRB",
      "company_name": "MVZ Pathologie Leipziger Straße GmbH",
      "company_seat": "München",
      "details": "14.01.2026 (Bekanntmachungsdatum)\n\nBayern Amtsgericht München HRB 275747\nSonstige Registerbekanntmachung 13.01.2026 (Eintragungsdatum)\n\nMVZ Pathologie Leipziger Straße GmbH\nGesellschaft mit beschränkter Haftung\nMünchen\n\nDen Gläubigern der Gesellschaft, deren Forderungen begründet worden sind, bevor die Eintragung der Beendigung des Gewinnabführungsvertrages in das Handelsregister nach § 10 des Handelsgesetzbuches als bekanntgemacht gilt, hat der andere Vertragsteil Sicherheit zu leisten, wenn sie sich binnen sechs Monaten nach der Bekanntmachung der Eintragung zu diesem Zweck bei ihm melden."
    },
    {
      "date": "2026-01-14",
      "id": "142333",
      "original_text": "Löschungsankündigung\nBayern Amtsgericht Memmingen HRB 15365\nKRM - Bauservice UG (haftungsbeschränkt) – Mindelheim",
      "type": "Löschungsankündigung",
      "state": "Bayern",
      "amtsgericht": "Amtsgericht Memmingen",
      "registernummer": "HRB 15365",
      "registerart": "HRB",
      "company_name": "KRM - Bauservice UG (haftungsbeschränkt)",
      "company_seat": "Mindelheim",
      "details": "14.01.2026 (Bekanntmachungsdatum)\n\nBayern Amtsgericht Memmingen HRB 15365\nLöschungsankündigung 14.01.2026 (Eintragungsdatum)\n\nKRM - Bauservice UG (haftungsbeschränkt)\nGesellschaft mit beschränkter Haftung\nMindelheim\n\nDas Registergericht beabsichtigt, die im Handelsregister eingetragene Gesellschaft wegen Vermögenslosigkeit von Amts wegen nach § 394 FamFG zu löschen. Die Frist zur Erhebung eines Widerspruchs ist auf einen Monat festgesetzt."
    },
    {
      "date": "2026-01-14",
      "id": "142334",
      "original_text": "Registerbekanntmachung nach dem Umwandlungsgesetz\nBayern Amtsgericht Würzburg HRA 4924\nThomas Mog e. K. – Würzburg",
      "type": "Registerbekanntmachung nach dem Umwandlungsgesetz",
      "state": "Bayern",
      "amtsgericht": "Amtsgericht Würzburg",
      "registernummer": "HRA 4924",
      "registerart": "HRA",
      "company_name": "Thomas Mog e. K.",
      "company_seat": "Würzburg",
      "details": "14.01.2026 (Bekanntmachungsdatum)\n\nBayern Amtsgericht Würzburg HRA 4924\nRegisterbekanntmachung nach dem Umwandlungsgesetz 13.01.2026 (Eintragungsdatum)\n\nThomas Mog e. K.\nEinzelkaufmann / Einzelkauffrau\nWürzburg\n\nDen Gläubigern der an der Verschmelzung beteiligten Rechtsträger ist, wenn sie binnen sechs Monaten nach dem Tag, an dem die Eintragung der Verschmelzung in das Register des Sitzes desjenigen Rechtsträgers, dessen Gläubiger sie sind, nach § 19 Abs. 3 UmwG als bekannt gemacht gilt, ihren Anspruch nach Grund und Höhe in Textform anmelden, Sicherheit zu leisten, soweit sie nicht Befriedigung verlangen können. Dieses Recht steht den Gläubigern jedoch nur zu, wenn sie glaubhaft machen, dass durch die Verschmelzung die Erfüllung ihrer Forderung gefährdet wird."
    },
    {
      "date": "2026-01-14",
      "id": "142335",
      "original_text": "Registerbekanntmachung nach dem Umwandlungsgesetz\nBayern Amtsgericht München HRB 129510\nAfinum Management GmbH – München",
      "type": "Registerbekanntmachung nach dem Umwandlungsgesetz",
      "state": "Bayern",
      "amtsgericht": "Amtsgericht München",
      "registernummer": "HRB 129510",
      "registerart": "HRB",
      "company_name": "Afinum Management GmbH",
      "company_seat": "München",
      "details": "14.01.2026 (Bekanntmachungsdatum)\n\nBayern Amtsgericht München HRB 129510\nRegisterbekanntmachung nach dem Umwandlungsgesetz 13.01.2026 (Eintragungsdatum)\n\nAfinum Management GmbH\nGesellschaft mit beschränkter Haftung\nMünchen\n\nDen Gläubigern der an den Verschmelzungen beteiligten Rechtsträger ist, wenn sie binnen sechs Monaten nach dem Tag, an dem die Eintragung der Verschmelzung in das Register des Sitzes desjenigen Rechtsträgers, dessen Gläubiger sie sind, nach § 19 Abs. 3 UmwG als bekannt gemacht gilt, ihren Anspruch nach Grund und Höhe in Textform anmelden, Sicherheit zu leisten, soweit sie nicht Befriedigung verlangen können. Dieses Recht steht den Gläubigern jedoch nur zu, wenn sie glaubhaft machen, dass durch die Verschmelzung die Erfüllung ihrer Forderung gefährdet wird."
    },
    {
      "date": "2026-01-14",
      "id": "142336",
      "original_text": "Registerbekanntmachung nach dem Umwandlungsgesetz\nBayern Amtsgericht München HRA 121564\nYR Gebäudemanagement e.K. – Weilheim i.OB",
      "type": "Registerbekanntmachung nach dem Umwandlungsgesetz",
      "state": "Bayern",
      "amtsgericht": "Amtsgericht München",
      "registernummer": "HRA 121564",
      "registerart": "HRA",
      "company_name": "YR Gebäudemanagement e.K.",
      "company_seat": "Weilheim i.OB",
      "details": "14.01.2026 (Bekanntmachungsdatum)\n\nBayern Amtsgericht München HRA 121564\nRegisterbekanntmachung nach dem Umwandlungsgesetz 13.01.2026 (Eintragungsdatum)\n\nYR Gebäudemanagement e.K.\nEinzelkaufmann / Einzelkauffrau\nWeilheim i.OB\n\nDen Gläubigern der an der Ausgliederung beteiligten Rechtsträger ist, wenn sie binnen sechs Monaten nach dem Tag, an dem die Eintragung der Ausgliederung in das Register des Sitzes desjenigen Rechtsträgers, dessen Gläubiger sie sind, nach §§ 125, 19 Abs. 3 UmwG als bekannt gemacht gilt, ihren Anspruch nach Grund und Höhe in Textform anmelden, Sicherheit zu leisten, soweit sie nicht Befriedigung verlangen können. Dieses Recht steht den Gläubigern jedoch nur zu, wenn sie glaubhaft machen, dass durch die Ausgliederung die Erfüllung ihrer Forderung gefährdet wird."
    },
    {
      "date": "2026-01-14",
      "id": "142337",
      "original_text": "Löschungsankündigung\nBayern Amtsgericht München HRB 214847\nReformtech Heating GmbH – München",
      "type": "Löschungsankündigung",
      "state": "Bayern",
      "amtsgericht": "Amtsgericht München",
      "registernummer": "HRB 214847",
      "registerart": "HRB",
      "company_name": "Reformtech Heating GmbH",
      "company_seat": "München",
      "details": "14.01.2026 (Bekanntmachungsdatum)\n\nBayern Amtsgericht München HRB 214847\nLöschungsankündigung 08.01.2026 (Eintragungsdatum)\n\nReformtech Heating GmbH\nGesellschaft mit beschränkter Haftung\nMünchen\n\nDas Registergericht beabsichtigt, die im Handelsregister eingetragene Gesellschaft wegen Vermögenslosigkeit von Amts wegen nach § 394 FamFG zu löschen. Die Frist zur Erhebung eines Widerspruchs ist auf drei Monate festgesetzt."
    },
    {
      "date": "2026-01-14",
      "id": "142338",
      "original_text": "Löschungsankündigung\nBayern Amtsgericht München HRB 238045\ntabularia GmbH – München",
      "type": "Löschungsankündigung",
      "state": "Bayern",
      "amtsgericht": "Amtsgericht München",
      "registernummer": "HRB 238045",
      "registerart": "HRB",
      "company_name": "tabularia GmbH",
      "company_seat": "München",
      "details": "14.01.2026 (Bekanntmachungsdatum)\n\nBayern Amtsgericht München HRB 238045\nLöschungsankündigung 08.01.2026 (Eintragungsdatum)\n\ntabularia GmbH\nGesellschaft mit beschränkter Haftung\nMünchen\n\nDas Registergericht beabsichtigt, die im Handelsregister eingetragene Gesellschaft wegen Vermögenslosigkeit von Amts wegen nach § 394 FamFG zu löschen. Die Frist zur Erhebung eines Widerspruchs ist auf drei Monate festgesetzt."
    },
    {
      "date": "2026-01-14",
      "id": "142339",
      "original_text": "Einreichung neuer Dokumente\nBayern Amtsgericht München HRB 111279\nBayerische Eisenbahngesellschaft mit beschränkter Haftung – München",
      "type": "Einreichung neuer Dokumente",
      "state": "Bayern",
      "amtsgericht": "Amtsgericht München",
      "registernummer": "HRB 111279",
      "registerart": "HRB",
      "company_name": "Bayerische Eisenbahngesellschaft mit beschränkter Haftung",
      "company_seat": "München",
      "details": "14.01.2026 (Bekanntmachungsdatum)\n\nBayern Amtsgericht München HRB 111279\nEinreichung neuer Dokumente\n\nBayerische Eisenbahngesellschaft mit beschränkter Haftung\nGesellschaft mit beschränkter Haftung\nMünchen\n\nDem #Re.Name ist eine Liste der Mitglieder des Aufsichtsrats eingereicht worden, § 52 Abs. 3 S. 2 GmbHG."
    },
    {
      "date": "2026-01-14",
      "id": "142340",
      "original_text": "Löschungsankündigung\nBayern Amtsgericht Passau HRB 10502\nV.I.M.C. Very important Mountain Consulting GmbH – Passau",
      "type": "Löschungsankündigung",
      "state": "Bayern",
      "amtsgericht": "Amtsgericht Passau",
      "registernummer": "HRB 10502",
      "registerart": "HRB",
      "company_name": "V.I.M.C. Very important Mountain Consulting GmbH",
      "company_seat": "Passau",
      "details": "14.01.2026 (Bekanntmachungsdatum)\n\nBayern Amtsgericht Passau HRB 10502\nLöschungsankündigung\n\nV.I.M.C. Very important Mountain Consulting GmbH\nGesellschaft mit beschränkter Haftung\nPassau\n\nDas Registergericht beabsichtigt, die im Handelsregister eingetragene Gesellschaft wegen Vermögenslosigkeit von Amts wegen nach § 394 FamFG zu löschen. Die Frist zur Erhebung eines Widerspruchs ist auf einen Monat festgesetzt."
    },
    {
      "date": "2026-01-14",
      "id": "142341",
      "original_text": "Registerbekanntmachung nach dem Umwandlungsgesetz\nBayern Amtsgericht München HRB 282603\nPNZ A23 Beteiligungs GmbH – München",
      "type": "Registerbekanntmachung nach dem Umwandlungsgesetz",
      "state": "Bayern",
      "amtsgericht": "Amtsgericht München",
      "registernummer": "HRB 282603",
      "registerart": "HRB",
      "company_name": "PNZ A23 Beteiligungs GmbH",
      "company_seat": "München",
      "details": "14.01.2026 (Bekanntmachungsdatum)\n\nBayern Amtsgericht München HRB 282603\nRegisterbekanntmachung nach dem Umwandlungsgesetz 13.01.2026 (Eintragungsdatum)\n\nPNZ A23 Beteiligungs GmbH\nGesellschaft mit beschränkter Haftung\nMünchen\n\nDen Gläubigern der an der Verschmelzung beteiligten Rechtsträger ist, wenn sie binnen sechs Monaten nach dem Tag, an dem die Eintragung der Verschmelzung in das Register des Sitzes desjenigen Rechtsträgers, dessen Gläubiger sie sind, nach § 19 Abs. 3 UmwG als bekannt gemacht gilt, ihren Anspruch nach Grund und Höhe in Textform anmelden, Sicherheit zu leisten, soweit sie nicht Befriedigung verlangen können. Dieses Recht steht den Gläubigern jedoch nur zu, wenn sie glaubhaft machen, dass durch die Verschmelzung die Erfüllung ihrer Forderung gefährdet wird."
    },
    {
      "date": "2026-01-14",
      "id": "142342",
      "original_text": "Registerbekanntmachung nach dem Umwandlungsgesetz\nBayern Amtsgericht Fürth HRB 17865\nInterherence GmbH – Erlangen",
      "type": "Registerbekanntmachung nach dem Umwandlungsgesetz",
      "state": "Bayern",
      "amtsgericht": "Amtsgericht Fürth",
      "registernummer": "HRB 17865",
      "registerart": "HRB",
      "company_name": "Interherence GmbH",
      "company_seat": "Erlangen",
      "details": "14.01.2026 (Bekanntmachungsdatum)\n\nBayern Amtsgericht Fürth HRB 17865\nRegisterbekanntmachung nach dem Umwandlungsgesetz 13.01.2026 (Eintragungsdatum)\n\nInterherence GmbH\nGesellschaft mit beschränkter Haftung\nErlangen\n\nDen Gläubigern der an der Verschmelzung beteiligten Rechtsträger ist, wenn sie binnen sechs Monaten nach dem Tag, an dem die Eintragung der Verschmelzung in das Register des Sitzes desjenigen Rechtsträgers, dessen Gläubiger sie sind, nach § 19 Abs. 3 UmwG als bekannt gemacht gilt, ihren Anspruch nach Grund und Höhe in Textform anmelden, Sicherheit zu leisten, soweit sie nicht Befriedigung verlangen können. Dieses Recht steht den Gläubigern jedoch nur zu, wenn sie glaubhaft machen, dass durch die Verschmelzung die Erfüllung ihrer Forderung gefährdet wird."
    },
    {
      "date": "2026-01-14",
      "id": "142343",
      "original_text": "Registerbekanntmachung nach dem Umwandlungsgesetz\nBayern Amtsgericht Würzburg HRB 12980\nDelta-Assekuranz GmbH – Würzburg",
      "type": "Registerbekanntmachung nach dem Umwandlungsgesetz",
      "state": "Bayern",
      "amtsgericht": "Amtsgericht Würzburg",
      "registernummer": "HRB 12980",
      "registerart": "HRB",
      "company_name": "Delta-Assekuranz GmbH",
      "company_seat": "Würzburg",
      "details": "14.01.2026 (Bekanntmachungsdatum)\n\nBayern Amtsgericht Würzburg HRB 12980\nRegisterbekanntmachung nach dem Umwandlungsgesetz 13.01.2026 (Eintragungsdatum)\n\nDelta-Assekuranz GmbH\nGesellschaft mit beschränkter Haftung\nWürzburg\n\nDen Gläubigern der an der Verschmelzung beteiligten Rechtsträger ist, wenn sie binnen sechs Monaten nach dem Tag, an dem die Eintragung der Verschmelzung in das Register des Sitzes desjenigen Rechtsträgers, dessen Gläubiger sie sind, nach § 19 Abs. 3 UmwG als bekannt gemacht gilt, ihren Anspruch nach Grund und Höhe in Textform anmelden, Sicherheit zu leisten, soweit sie nicht Befriedigung verlangen können. Dieses Recht steht den Gläubigern jedoch nur zu, wenn sie glaubhaft machen, dass durch die Verschmelzung die Erfüllung ihrer Forderung gefährdet wird."
    },
    {
      "date": "2026-01-14",
      "id": "142344",
      "original_text": "Löschungsankündigung\nBaden-Württemberg Amtsgericht Stuttgart HRB 794824\nLoyalityNation-Marketing UG (haftungsbeschränkt) – Stuttgart",
      "type": "Löschungsankündigung",
      "state": "Baden-Württemberg",
      "amtsgericht": "Amtsgericht Stuttgart",
      "registernummer": "HRB 794824",
      "registerart": "HRB",
      "company_name": "LoyalityNation-Marketing UG (haftungsbeschränkt)",
      "company_seat": "Stuttgart",
      "details": "14.01.2026 (Bekanntmachungsdatum)\n\nBaden-Württemberg Amtsgericht Stuttgart HRB 794824\nLöschungsankündigung\n\nLoyalityNation-Marketing UG (haftungsbeschränkt)\nGesellschaft mit beschränkter Haftung\nStuttgart\n\nAls nicht eingetragen wird bekanntgemacht:\nDas Gericht beabsichtigt, die Gesellschaft wegen Vermögenslosigkeit im Handelsregister von Amts wegen nach § 394 FamFG zu löschen. Die Frist zur Geltendmachung eines Widerspruchs gegen die beabsichtigte Löschung ist auf zwei Monate ab Veröffentlichung bestimmt."
    },
    {
      "date": "2026-01-14",
      "id": "142345",
      "original_text": "Einreichung neuer Dokumente\nBerlin Amtsgericht Berlin (Charlottenburg) HRB 183693\nFeral GmbH – Berlin",
      "type": "Einreichung neuer Dokumente",
      "state": "Berlin",
      "amtsgericht": "Amtsgericht Berlin (Charlottenburg)",
      "registernummer": "HRB 183693",
      "registerart": "HRB",
      "company_name": "Feral GmbH",
      "company_seat": "Berlin",
      "details": "14.01.2026 (Bekanntmachungsdatum)\n\nBerlin Amtsgericht Berlin (Charlottenburg) HRB 183693\nEinreichung neuer Dokumente\n\nFeral GmbH\nGesellschaft mit beschränkter Haftung\nBerlin\n\nAls nicht eingetragen wird veröffentlicht: Es wurde eine neue Liste der Beiratsmitglieder eingereicht (§52 GmbHG)."
    },
    {
      "date": "2026-01-14",
      "id": "142346",
      "original_text": "Löschungsankündigung\nBaden-Württemberg Amtsgericht Freiburg HRB 727987\nLars Schmid GmbH – Schopfheim",
      "type": "Löschungsankündigung",
      "state": "Baden-Württemberg",
      "amtsgericht": "Amtsgericht Freiburg",
      "registernummer": "HRB 727987",
      "registerart": "HRB",
      "company_name": "Lars Schmid GmbH",
      "company_seat": "Schopfheim",
      "details": "14.01.2026 (Bekanntmachungsdatum)\n\nBaden-Württemberg Amtsgericht Freiburg HRB 727987\nLöschungsankündigung 14.01.2026 (Eintragungsdatum)\n\nLars Schmid GmbH\nGesellschaft mit beschränkter Haftung\nSchopfheim\n\nAls nicht eingetragen wird bekanntgemacht:\nDas Gericht beabsichtigt, die Gesellschaft wegen Vermögenslosigkeit im Handelsregister von Amts wegen nach § 394 FamFG zu löschen. Die Frist zur Geltendmachung eines Widerspruchs gegen die beabsichtigte Löschung ist auf einen Monat ab Veröffentlichung bestimmt."
    },
    {
      "date": "2026-01-14",
      "id": "142347",
      "original_text": "Einreichung neuer Dokumente\nBrandenburg Amtsgericht Cottbus HRB 13294\nKrieger Handel SE – Schönefeld",
      "type": "Einreichung neuer Dokumente",
      "state": "Brandenburg",
      "amtsgericht": "Amtsgericht Cottbus",
      "registernummer": "HRB 13294",
      "registerart": "HRB",
      "company_name": "Krieger Handel SE",
      "company_seat": "Schönefeld",
      "details": "14.01.2026 (Bekanntmachungsdatum)\n\nBrandenburg Amtsgericht Cottbus HRB 13294\nEinreichung neuer Dokumente\n\nKrieger Handel SE\nEuropäische Aktiengesellschaft (SE)\nSchönefeld\n\nDer geschäftsführende Direktor hat eine Liste des Verwaltungsrates zum Handelsregister eingereicht."
    },
    {
      "date": "2026-01-14",
      "id": "142348",
      "original_text": "Sonstige Registerbekanntmachung\nSachsen-Anhalt Amtsgericht Stendal GnR 2276\nAgrargenossenschaft ''Allertal\" Eilsleben eG – Eilsleben",
      "type": "Sonstige Registerbekanntmachung",
      "state": "Sachsen-Anhalt",
      "amtsgericht": "Amtsgericht Stendal",
      "registernummer": "GnR 2276",
      "registerart": "GnR",
      "company_name": "Agrargenossenschaft ''Allertal\" Eilsleben eG",
      "company_seat": "Eilsleben",
      "details": "14.01.2026 (Bekanntmachungsdatum)\n\nSachsen-Anhalt Amtsgericht Stendal GnR 2276\nSonstige Registerbekanntmachung 14.01.2026 (Eintragungsdatum)\n\nAgrargenossenschaft ''Allertal\" Eilsleben eG\neingetragene Genossenschaft\nEilsleben\n\nAls nicht eingetragen wird veröffentlicht: § 41 Nachschusspflicht:  Eine Nachschusspflicht der Mitglieder besteht nicht\n\nDen Gläubigern der Genossenschaft ist, wenn sie sich binnen 6 Monaten nach der Bekanntmachung bei der Genossenschaft zu diesem Zweck melden, Sicherheit zu leisten, soweit sie nicht Befriedigung verlangen können (§ 22 Abs. 1 bis 3 GenG)."
    },
    {
      "date": "2026-01-14",
      "id": "142349",
      "original_text": "Einreichung neuer Dokumente\nBaden-Württemberg Amtsgericht Stuttgart HRB 720134\nBlue Ocean Entertainment AG – Stuttgart",
      "type": "Einreichung neuer Dokumente",
      "state": "Baden-Württemberg",
      "amtsgericht": "Amtsgericht Stuttgart",
      "registernummer": "HRB 720134",
      "registerart": "HRB",
      "company_name": "Blue Ocean Entertainment AG",
      "company_seat": "Stuttgart",
      "details": "14.01.2026 (Bekanntmachungsdatum)\n\nBaden-Württemberg Amtsgericht Stuttgart HRB 720134\nEinreichung neuer Dokumente\n\nBlue Ocean Entertainment AG\nAktiengesellschaft\nStuttgart\n\nDie Gesellschaft hat am 13.01.2026 die Liste über die Zusammensetzung des Aufsichtsrats zum Handelsregister eingereicht."
    },
    {
      "date": "2026-01-14",
      "id": "142350",
      "original_text": "Einreichung neuer Dokumente\nHamburg Amtsgericht Hamburg HRB 184136\nLion Sirius Management SE – Hamburg",
      "type": "Einreichung neuer Dokumente",
      "state": "Hamburg",
      "amtsgericht": "Amtsgericht Hamburg",
      "registernummer": "HRB 184136",
      "registerart": "HRB",
      "company_name": "Lion Sirius Management SE",
      "company_seat": "Hamburg",
      "details": "14.01.2026 (Bekanntmachungsdatum)\n\nHamburg Amtsgericht Hamburg HRB 184136\nEinreichung neuer Dokumente 14.01.2026 (Eintragungsdatum)\n\nLion Sirius Management SE\nEuropäische Aktiengesellschaft (SE)\nHamburg\n\nAls nicht eingetragen wird bekannt gemacht: Liste des Aufsichtsrats wurde eingereicht."
    },
    {
      "date": "2026-01-14",
      "id": "142351",
      "original_text": "Löschungsankündigung\nBaden-Württemberg Amtsgericht Mannheim HRB 740805\nSchreinerei Dietrich Verwaltungs GmbH – Baden-Baden",
      "type": "Löschungsankündigung",
      "state": "Baden-Württemberg",
      "amtsgericht": "Amtsgericht Mannheim",
      "registernummer": "HRB 740805",
      "registerart": "HRB",
      "company_name": "Schreinerei Dietrich Verwaltungs GmbH",
      "company_seat": "Baden-Baden",
      "details": "14.01.2026 (Bekanntmachungsdatum)\n\nBaden-Württemberg Amtsgericht Mannheim HRB 740805\nLöschungsankündigung\n\nSchreinerei Dietrich Verwaltungs GmbH\nGesellschaft mit beschränkter Haftung\nBaden-Baden\n\nDas Gericht beabsichtigt, die Gesellschaft wegen Vermögenslosigkeit im Handelsregister von Amts wegen nach § 394 FamFG zu löschen. Die Frist zur Geltendmachung eines Widerspruchs gegen die beabsichtigte Löschung ist auf einen Monat ab Veröffentlichung bestimmt."
    },
    {
      "date": "2026-01-14",
      "id": "142352",
      "original_text": "Sonstige Registerbekanntmachung\nSaarland Amtsgericht Saarbrücken HRB 91894\nAutec Softwareentwicklung & Hardwareplanung GmbH – Spiesen-EIversberg",
      "type": "Sonstige Registerbekanntmachung",
      "state": "Saarland",
      "amtsgericht": "Amtsgericht Saarbrücken",
      "registernummer": "HRB 91894",
      "registerart": "HRB",
      "company_name": "Autec Softwareentwicklung & Hardwareplanung GmbH",
      "company_seat": "Spiesen-EIversberg",
      "details": "14.01.2026 (Bekanntmachungsdatum)\n\nSaarland Amtsgericht Saarbrücken HRB 91894\nSonstige Registerbekanntmachung 14.01.2026 (Eintragungsdatum)\n\nAutec Softwareentwicklung & Hardwareplanung GmbH\nGesellschaft mit beschränkter Haftung\nSpiesen-EIversberg\n\nAls nicht eingetragen wird bekannt gemacht: Den Gläubigern deren Forderungen begründet worden sind, bevor die Beendigung des Vertrages in das Handelsregister nach § 10 des HGB  als bekannt gemacht gilt, hat der andere Vertragsteil Sicherheit zu leisten, wenn sie sich binnen 6 Monaten nach Bekanntmachung der Eintragung zu diesem Zweck bei ihm melden."
    },
    {
      "date": "2026-01-14",
      "id": "142353",
      "original_text": "Löschungsankündigung\nBrandenburg Amtsgericht Potsdam HRB 25027\nWash@go UG (haftungsbeschränkt) – Brandenburg an der Havel",
      "type": "Löschungsankündigung",
      "state": "Brandenburg",
      "amtsgericht": "Amtsgericht Potsdam",
      "registernummer": "HRB 25027",
      "registerart": "HRB",
      "company_name": "Wash@go UG (haftungsbeschränkt)",
      "company_seat": "Brandenburg an der Havel",
      "details": "14.01.2026 (Bekanntmachungsdatum)\n\nBrandenburg Amtsgericht Potsdam HRB 25027\nLöschungsankündigung\n\nWash@go UG (haftungsbeschränkt)\nGesellschaft mit beschränkter Haftung\nBrandenburg an der Havel\n\nBei der nachstehenden Gesellschaft wird das Amtslöschungsverfahren gemäß § 394 FamFG eingeleitet. Widerspruchsfrist: 8 Wochen."
    },
    {
      "date": "2026-01-14",
      "id": "142354",
      "original_text": "Einreichung neuer Dokumente\nBerlin Amtsgericht Berlin (Charlottenburg) HRB 83923\nToll Collect GmbH – Berlin",
      "type": "Einreichung neuer Dokumente",
      "state": "Berlin",
      "amtsgericht": "Amtsgericht Berlin (Charlottenburg)",
      "registernummer": "HRB 83923",
      "registerart": "HRB",
      "company_name": "Toll Collect GmbH",
      "company_seat": "Berlin",
      "details": "14.01.2026 (Bekanntmachungsdatum)\n\nBerlin Amtsgericht Berlin (Charlottenburg) HRB 83923\nEinreichung neuer Dokumente\n\nToll Collect GmbH\nGesellschaft mit beschränkter Haftung\nBerlin\n\nAls nicht eingetragen wird veröffentlicht:\n\nEs wurde eine neue Liste der Aufsichtsratsmitglieder eingereicht (§52 GmbHG)."
    },
    {
      "date": "2026-01-14",
      "id": "142355",
      "original_text": "Sonstige Registerbekanntmachung\nSachsen-Anhalt Amtsgericht Stendal HRB 113499\nGEO-METRIK-IngenieurgeselIschaft mbH Magdeburg – Magdeburg",
      "type": "Sonstige Registerbekanntmachung",
      "state": "Sachsen-Anhalt",
      "amtsgericht": "Amtsgericht Stendal",
      "registernummer": "HRB 113499",
      "registerart": "HRB",
      "company_name": "GEO-METRIK-IngenieurgeselIschaft mbH Magdeburg",
      "company_seat": "Magdeburg",
      "details": "14.01.2026 (Bekanntmachungsdatum)\n\nSachsen-Anhalt Amtsgericht Stendal HRB 113499\nSonstige Registerbekanntmachung 14.01.2026 (Eintragungsdatum)\n\nGEO-METRIK-IngenieurgeselIschaft mbH Magdeburg\nGesellschaft mit beschränkter Haftung\nMagdeburg\n\nNicht eingetragen:\nAls nicht eingetragen wird veröffentlicht: Den Gläubigern der Gesellschaft, deren Forderungen begründet worden sind bevor die Eintragung der Beendigung des Beherrschungs- und Gewinnabführungsvertrages in das Handelsregister nach § 10 des Handelsgesetzbuches als bekanntgemacht gilt, hat der andere Vertragsteil Sicherheit zu leisten, wenn sie sich binnen sechs Monaten nach der Bekanntmachung der Eintragung zu diesem Zweck bei ihm melden."
    },
    {
      "date": "2026-01-14",
      "id": "142356",
      "original_text": "Sonstige Registerbekanntmachung\nSachsen-Anhalt Amtsgericht Stendal HRB 3931\nGEO-METRIK-Ingenieurgesellschaft mbH Stendal – Stendal",
      "type": "Sonstige Registerbekanntmachung",
      "state": "Sachsen-Anhalt",
      "amtsgericht": "Amtsgericht Stendal",
      "registernummer": "HRB 3931",
      "registerart": "HRB",
      "company_name": "GEO-METRIK-Ingenieurgesellschaft mbH Stendal",
      "company_seat": "Stendal",
      "details": "14.01.2026 (Bekanntmachungsdatum)\n\nSachsen-Anhalt Amtsgericht Stendal HRB 3931\nSonstige Registerbekanntmachung 14.01.2026 (Eintragungsdatum)\n\nGEO-METRIK-Ingenieurgesellschaft mbH Stendal\nGesellschaft mit beschränkter Haftung\nStendal\n\nNicht eingetragen:\nAls nicht eingetragen wird veröffentlicht: Den Gläubigern der Gesellschaft, deren Forderungen begründet worden sind bevor die Eintragung der Beendigung des Beherrschungs- und Gewinnabführungsvertrages  in das Handelsregister nach § 10 des Handelsgesetzbuches als bekanntgemacht gilt, hat der andere Vertragsteil Sicherheit zu leisten, wenn sie sich binnen sechs Monaten nach der Bekanntmachung der Eintragung zu diesem Zweck bei ihm melden."
    },
    {
      "date": "2026-01-14",
      "id": "142357",
      "original_text": "Löschungsankündigung\nSchleswig-Holstein Amtsgericht Lübeck HRB 12352\nmedisoul GmbH – Ahrensburg",
      "type": "Löschungsankündigung",
      "state": "Schleswig-Holstein",
      "amtsgericht": "Amtsgericht Lübeck",
      "registernummer": "HRB 12352",
      "registerart": "HRB",
      "company_name": "medisoul GmbH",
      "company_seat": "Ahrensburg",
      "details": "14.01.2026 (Bekanntmachungsdatum)\n\nSchleswig-Holstein Amtsgericht Lübeck HRB 12352\nLöschungsankündigung\n\nmedisoul GmbH\nGesellschaft mit beschränkter Haftung\nAhrensburg\n\nEs ist die Löschung der nachstehenden Gesellschaft wegen Vermögenslosigkeit gemäß § 394 FamFG beabsichtigt. Widerspruchsfrist: 1 Monat."
    },
    {
      "date": "2026-01-14",
      "id": "142358",
      "original_text": "Sonstige Registerbekanntmachung\nHamburg Amtsgericht Hamburg HRB 80691\nHamburger Sparkasse AG – Hamburg",
      "type": "Sonstige Registerbekanntmachung",
      "state": "Hamburg",
      "amtsgericht": "Amtsgericht Hamburg",
      "registernummer": "HRB 80691",
      "registerart": "HRB",
      "company_name": "Hamburger Sparkasse AG",
      "company_seat": "Hamburg",
      "details": "14.01.2026 (Bekanntmachungsdatum)\n\nHamburg Amtsgericht Hamburg HRB 80691\nSonstige Registerbekanntmachung\n\nHamburger Sparkasse AG\nAktiengesellschaft\nHamburg\n\nAls nicht eingetragen wird bekannt gemacht: Liste des Aufsichtsrats wurde eingereicht."
    },
    {
      "date": "2026-01-14",
      "id": "142359",
      "original_text": "Sonstige Registerbekanntmachung\nHamburg Amtsgericht Hamburg HRB 178718\nLiedtke perma-tec Unter-GmbH – Hamburg",
      "type": "Sonstige Registerbekanntmachung",
      "state": "Hamburg",
      "amtsgericht": "Amtsgericht Hamburg",
      "registernummer": "HRB 178718",
      "registerart": "HRB",
      "company_name": "Liedtke perma-tec Unter-GmbH",
      "company_seat": "Hamburg",
      "details": "14.01.2026 (Bekanntmachungsdatum)\n\nHamburg Amtsgericht Hamburg HRB 178718\nSonstige Registerbekanntmachung 14.01.2026 (Eintragungsdatum)\n\nLiedtke perma-tec Unter-GmbH\nGesellschaft mit beschränkter Haftung\nHamburg\n\nAls nicht eingetragen wird bekannt gemacht:  Den Gläubigern der Gesellschaft, deren Forderungen begründet worden sind, bevor die Eintragung der Vertragsbeendigung in das Handelsregister nach § 10 HGB als bekannt gemacht gilt, ist vom anderen Vertragsteil Sicherheit zu leisten, wenn sie sich binnen 6 Monaten nach Bekanntmachung der Eintragung zu diesem Zweck bei ihm melden."
    },
    {
      "date": "2026-01-14",
      "id": "142360",
      "original_text": "Löschungsankündigung\nBerlin Amtsgericht Berlin (Charlottenburg) HRB 207943\nLevant MM GmbH – Berlin",
      "type": "Löschungsankündigung",
      "state": "Berlin",
      "amtsgericht": "Amtsgericht Berlin (Charlottenburg)",
      "registernummer": "HRB 207943",
      "registerart": "HRB",
      "company_name": "Levant MM GmbH",
      "company_seat": "Berlin",
      "details": "14.01.2026 (Bekanntmachungsdatum)\n\nBerlin Amtsgericht Berlin (Charlottenburg) HRB 207943\nLöschungsankündigung\n\nLevant MM GmbH\nGesellschaft mit beschränkter Haftung\nBerlin\n\nBei der nachstehenden Gesellschaft wird das Amtslöschungsverfahren gemäß § 394 FamFG eingeleitet. Widerspruchsfrist 6 Wochen"
    },
    {
      "date": "2026-01-14",
      "id": "142361",
      "original_text": "Löschungsankündigung\nBerlin Amtsgericht Berlin (Charlottenburg) HRB 170848\nAll Great GmbH – Berlin",
      "type": "Löschungsankündigung",
      "state": "Berlin",
      "amtsgericht": "Amtsgericht Berlin (Charlottenburg)",
      "registernummer": "HRB 170848",
      "registerart": "HRB",
      "company_name": "All Great GmbH",
      "company_seat": "Berlin",
      "details": "14.01.2026 (Bekanntmachungsdatum)\n\nBerlin Amtsgericht Berlin (Charlottenburg) HRB 170848\nLöschungsankündigung\n\nAll Great GmbH\nGesellschaft mit beschränkter Haftung\nBerlin\n\nBei der nachstehenden Gesellschaft wird das Amtslöschungsverfahren gemäß § 394 FamFG eingeleitet. Widerspruchsfrist 6 Wochen"
    },
    {
      "date": "2026-01-14",
      "id": "142362",
      "original_text": "Einreichung neuer Dokumente\nSachsen-Anhalt Amtsgericht Stendal HRB 207029\nTechnische Werke Naumburg GmbH – Naumburg (Saale)",
      "type": "Einreichung neuer Dokumente",
      "state": "Sachsen-Anhalt",
      "amtsgericht": "Amtsgericht Stendal",
      "registernummer": "HRB 207029",
      "registerart": "HRB",
      "company_name": "Technische Werke Naumburg GmbH",
      "company_seat": "Naumburg (Saale)",
      "details": "14.01.2026 (Bekanntmachungsdatum)\n\nSachsen-Anhalt Amtsgericht Stendal HRB 207029\nEinreichung neuer Dokumente\n\nTechnische Werke Naumburg GmbH\nGesellschaft mit beschränkter Haftung\nNaumburg (Saale)\n\nEine Liste der Mitglieder des Aufsichtsrates wurde zum Handelsregister eingereicht."
    },
    {
      "date": "2026-01-14",
      "id": "142363",
      "original_text": "Einreichung neuer Dokumente\nBaden-Württemberg Amtsgericht Mannheim HRB 4167\nBGD Bodengesundheitsdienst Gesellschaft mit beschränkter Haftung – Mannheim",
      "type": "Einreichung neuer Dokumente",
      "state": "Baden-Württemberg",
      "amtsgericht": "Amtsgericht Mannheim",
      "registernummer": "HRB 4167",
      "registerart": "HRB",
      "company_name": "BGD Bodengesundheitsdienst Gesellschaft mit beschränkter Haftung",
      "company_seat": "Mannheim",
      "details": "14.01.2026 (Bekanntmachungsdatum)\n\nBaden-Württemberg Amtsgericht Mannheim HRB 4167\nEinreichung neuer Dokumente\n\nBGD Bodengesundheitsdienst Gesellschaft mit beschränkter Haftung\nGesellschaft mit beschränkter Haftung\nMannheim\n\nDie Gesellschaft hat am 13.01.2026 die Liste über die Zusammensetzung des Aufsichtsrats zum Handelsregister eingereicht."
    },
    {
      "date": "2026-01-14",
      "id": "142364",
      "original_text": "Löschungsankündigung\nBerlin Amtsgericht Berlin (Charlottenburg) HRB 128988\nStadtMod Bau Consult Management Unternehmergesellschaft (haftungsbeschränkt) – Berlin",
      "type": "Löschungsankündigung",
      "state": "Berlin",
      "amtsgericht": "Amtsgericht Berlin (Charlottenburg)",
      "registernummer": "HRB 128988",
      "registerart": "HRB",
      "company_name": "StadtMod Bau Consult Management Unternehmergesellschaft (haftungsbeschränkt)",
      "company_seat": "Berlin",
      "details": "14.01.2026 (Bekanntmachungsdatum)\n\nBerlin Amtsgericht Berlin (Charlottenburg) HRB 128988\nLöschungsankündigung\n\nStadtMod Bau Consult Management Unternehmergesellschaft (haftungsbeschränkt)\nGesellschaft mit beschränkter Haftung\nBerlin\n\nBei der nachstehenden Gesellschaft wird das Amtslöschungsverfahren gemäß § 394 FamFG eingeleitet. Widerspruchsfrist 6 Wochen"
    },
    {
      "date": "2026-01-14",
      "id": "142365",
      "original_text": "Löschungsankündigung\nBerlin Amtsgericht Berlin (Charlottenburg) HRB 127987\nStep-Byte-Step UG (haftungsbeschränkt) – Berlin",
      "type": "Löschungsankündigung",
      "state": "Berlin",
      "amtsgericht": "Amtsgericht Berlin (Charlottenburg)",
      "registernummer": "HRB 127987",
      "registerart": "HRB",
      "company_name": "Step-Byte-Step UG (haftungsbeschränkt)",
      "company_seat": "Berlin",
      "details": "14.01.2026 (Bekanntmachungsdatum)\n\nBerlin Amtsgericht Berlin (Charlottenburg) HRB 127987\nLöschungsankündigung\n\nStep-Byte-Step UG (haftungsbeschränkt)\nGesellschaft mit beschränkter Haftung\nBerlin\n\nBei der nachstehenden Gesellschaft wird das Amtslöschungsverfahren gemäß § 394 FamFG eingeleitet. Widerspruchsfrist 6 Wochen"
    },
    {
      "date": "2026-01-14",
      "id": "142366",
      "original_text": "Einreichung neuer Dokumente\nBerlin Amtsgericht Berlin (Charlottenburg) HRB 136902\ncompero AG – Berlin",
      "type": "Einreichung neuer Dokumente",
      "state": "Berlin",
      "amtsgericht": "Amtsgericht Berlin (Charlottenburg)",
      "registernummer": "HRB 136902",
      "registerart": "HRB",
      "company_name": "compero AG",
      "company_seat": "Berlin",
      "details": "14.01.2026 (Bekanntmachungsdatum)\n\nBerlin Amtsgericht Berlin (Charlottenburg) HRB 136902\nEinreichung neuer Dokumente\n\ncompero AG\nAktiengesellschaft\nBerlin\n\nAls nicht eingetragen wird veröffentlicht:\n\nEs wurde eine neue Liste der Aufsichtsratsmitglieder eingereicht (§ 106 AktG)."
    },
    {
      "date": "2026-01-14",
      "id": "142367",
      "original_text": "Einreichung neuer Dokumente\nBaden-Württemberg Amtsgericht Stuttgart HRB 727317\nBITZER SE – Sindelfingen",
      "type": "Einreichung neuer Dokumente",
      "state": "Baden-Württemberg",
      "amtsgericht": "Amtsgericht Stuttgart",
      "registernummer": "HRB 727317",
      "registerart": "HRB",
      "company_name": "BITZER SE",
      "company_seat": "Sindelfingen",
      "details": "14.01.2026 (Bekanntmachungsdatum)\n\nBaden-Württemberg Amtsgericht Stuttgart HRB 727317\nEinreichung neuer Dokumente\n\nBITZER SE\nEuropäische Aktiengesellschaft (SE)\nSindelfingen\n\nDie Gesellschaft hat am 08.01.2026 die Liste über die Zusammensetzung des Aufsichtsrats zum Handelsregister eingereicht."
    },
    {
      "date": "2026-01-14",
      "id": "142368",
      "original_text": "Löschungsankündigung\nSaarland Amtsgericht Saarbrücken HRB 32707\nE. Wesely Maschinenhandelsgesellschaft mit beschränkter Haftung – St. Ingbert",
      "type": "Löschungsankündigung",
      "state": "Saarland",
      "amtsgericht": "Amtsgericht Saarbrücken",
      "registernummer": "HRB 32707",
      "registerart": "HRB",
      "company_name": "E. Wesely Maschinenhandelsgesellschaft mit beschränkter Haftung",
      "company_seat": "St. Ingbert",
      "details": "14.01.2026 (Bekanntmachungsdatum)\n\nSaarland Amtsgericht Saarbrücken HRB 32707\nLöschungsankündigung\n\nE. Wesely Maschinenhandelsgesellschaft mit beschränkter Haftung\nGesellschaft mit beschränkter Haftung\nSt. Ingbert\n\nEs ist beabsichtigt, die Gesellschaft von Amts wegen gemäß § 394 FamFG wegen Vermögenslosigkeit zu löschen.\nGegen die Löschung von Amts wegen ist das Rechtsmittel des Widerspruchs statthaft. Der Widerspruch ist binnen einer Frist einem Monat beginnend mit dem Tag dieser Veröffentlichung durch Einreichen eines Widerspruchsschreibens -schriftlich oder zur Niederschrift der Geschäftsstelle beim Amtsgericht Saarbrücken, -zentrales Handelsregister-, Mainzerstr.178, 66121 Saarbrücken einzulegen.\nDer Widerspruch muss die Bezeichnung der angefochtenen Löschungsankündigung enthalten sowie die Erklärung, dass Widerspruch eingelegt wird. Er ist vom Widerspruchsführer oder seinem Bevollmächtigten zu unterzeichnen.\nDas Widerspruchsschreiben kann auch in der Form eines elektronischen Dokumentes eingereicht werden, das mit einer qualifizierten elektronischen Signatur nach dem Signaturgesetz versehen sein muss (§§ 14 Abs. 2 FamFG, 130a, 298 ZPO)."
    },
    {
      "date": "2026-01-14",
      "id": "142369",
      "original_text": "Löschungsankündigung\nSaarland Amtsgericht Saarbrücken HRB 19074\nWuM Wirtschaft und Mensch UG (haftungsbeschränkt) – Saarbrücken",
      "type": "Löschungsankündigung",
      "state": "Saarland",
      "amtsgericht": "Amtsgericht Saarbrücken",
      "registernummer": "HRB 19074",
      "registerart": "HRB",
      "company_name": "WuM Wirtschaft und Mensch UG (haftungsbeschränkt)",
      "company_seat": "Saarbrücken",
      "details": "14.01.2026 (Bekanntmachungsdatum)\n\nSaarland Amtsgericht Saarbrücken HRB 19074\nLöschungsankündigung\n\nWuM Wirtschaft und Mensch UG (haftungsbeschränkt)\nGesellschaft mit beschränkter Haftung\nSaarbrücken\n\nEs ist beabsichtigt, die Gesellschaft von Amts wegen gemäß § 394 FamFG wegen Vermögenslosigkeit zu löschen.\nGegen die Löschung von Amts wegen ist das Rechtsmittel des Widerspruchs statthaft. Der Widerspruch ist binnen einer Frist drei Monaten beginnend mit dem Tag dieser Veröffentlichung durch Einreichen eines Widerspruchsschreibens -schriftlich oder zur Niederschrift der Geschäftsstelle beim Amtsgericht Saarbrücken, -zentrales Handelsregister-, Mainzerstr.178, 66121 Saarbrücken einzulegen.\nDer Widerspruch muss die Bezeichnung der angefochtenen Löschungsankündigung enthalten sowie die Erklärung, dass Widerspruch eingelegt wird. Er ist vom Widerspruchsführer oder seinem Bevollmächtigten zu unterzeichnen.\nDas Widerspruchsschreiben kann auch in der Form eines elektronischen Dokumentes eingereicht werden, das mit einer qualifizierten elektronischen Signatur nach dem Signaturgesetz versehen sein muss (§§ 14 Abs. 2 FamFG, 130a, 298 ZPO)."
    },
    {
      "date": "2026-01-14",
      "id": "142370",
      "original_text": "Registerbekanntmachung nach dem Umwandlungsgesetz\nBaden-Württemberg Amtsgericht Stuttgart HRB 351959\nMez.Gastro GmbH – Reutlingen",
      "type": "Registerbekanntmachung nach dem Umwandlungsgesetz",
      "state": "Baden-Württemberg",
      "amtsgericht": "Amtsgericht Stuttgart",
      "registernummer": "HRB 351959",
      "registerart": "HRB",
      "company_name": "Mez.Gastro GmbH",
      "company_seat": "Reutlingen",
      "details": "14.01.2026 (Bekanntmachungsdatum)\n\nBaden-Württemberg Amtsgericht Stuttgart HRB 351959\nRegisterbekanntmachung nach dem Umwandlungsgesetz 14.01.2026 (Eintragungsdatum)\n\nMez.Gastro GmbH\nGesellschaft mit beschränkter Haftung\nReutlingen\n\nAls nicht eingetragen wird bekanntgemacht:\nDen Gläubigern der an der Verschmelzung beteiligten Rechtsträger ist, wenn sie binnen sechs Monaten nach dem Tag, an dem die Eintragung der Verschmelzung in das Register des Sitzes desjenigen Rechtsträgers, dessen Gläubiger sie sind, nach § 19 Abs. 3 UmwG als bekanntgemacht gilt, ihren Anspruch nach Grund und Höhe schriftlich anmelden, Sicherheit zu leisten, soweit sie nicht Befriedigung verlangen können. Dieses Recht steht den Gläubigern jedoch nur zu, wenn sie glaubhaft machen, dass durch die Verschmelzung die Erfüllung ihrer Forderung gefährdet wird."
    },
    {
      "date": "2026-01-14",
      "id": "142371",
      "original_text": "Einreichung neuer Dokumente\nBaden-Württemberg Amtsgericht Stuttgart HRB 411197\nTheben AG – Haigerloch",
      "type": "Einreichung neuer Dokumente",
      "state": "Baden-Württemberg",
      "amtsgericht": "Amtsgericht Stuttgart",
      "registernummer": "HRB 411197",
      "registerart": "HRB",
      "company_name": "Theben AG",
      "company_seat": "Haigerloch",
      "details": "14.01.2026 (Bekanntmachungsdatum)\n\nBaden-Württemberg Amtsgericht Stuttgart HRB 411197\nEinreichung neuer Dokumente 14.01.2026 (Eintragungsdatum)\n\nTheben AG\nAktiengesellschaft\nHaigerloch\n\nDie Gesellschaft hat am 30.12.2025 die Liste über die Zusammensetzung des Aufsichtsrats zum Handelsregister eingereicht."
    },
    {
      "date": "2026-01-14",
      "id": "142372",
      "original_text": "Sonstige Registerbekanntmachung\nBaden-Württemberg Amtsgericht Mannheim HRB 111049\nFriedrich Sautter GmbH – Karlsruhe",
      "type": "Sonstige Registerbekanntmachung",
      "state": "Baden-Württemberg",
      "amtsgericht": "Amtsgericht Mannheim",
      "registernummer": "HRB 111049",
      "registerart": "HRB",
      "company_name": "Friedrich Sautter GmbH",
      "company_seat": "Karlsruhe",
      "details": "14.01.2026 (Bekanntmachungsdatum)\n\nBaden-Württemberg Amtsgericht Mannheim HRB 111049\nSonstige Registerbekanntmachung 14.01.2026 (Eintragungsdatum)\n\nFriedrich Sautter GmbH\nGesellschaft mit beschränkter Haftung\nKarlsruhe\n\nDen Gläubigern der Gesellschaft, deren Forderungen begründet worden sind, bevor die Eintragung der Beendigung des Vertrages in das Handelsregister nach § 10 HGB als bekanntgemacht gilt, ist vom anderen Vertragsteil Sicherheit zu leisten, wenn sie sich binnen sechs Monaten nach der Bekanntmachung zu diesem Zweck bei ihm melden."
    },
    {
      "date": "2026-01-14",
      "id": "142373",
      "original_text": "Registerbekanntmachung nach dem Umwandlungsgesetz\nSaarland Amtsgericht Saarbrücken HRB 108367\nCult Appeal UG (haftungsbeschränkt) – Riegelsberg",
      "type": "Registerbekanntmachung nach dem Umwandlungsgesetz",
      "state": "Saarland",
      "amtsgericht": "Amtsgericht Saarbrücken",
      "registernummer": "HRB 108367",
      "registerart": "HRB",
      "company_name": "Cult Appeal UG (haftungsbeschränkt)",
      "company_seat": "Riegelsberg",
      "details": "14.01.2026 (Bekanntmachungsdatum)\n\nSaarland Amtsgericht Saarbrücken HRB 108367\nRegisterbekanntmachung nach dem Umwandlungsgesetz 14.01.2026 (Eintragungsdatum)\n\nCult Appeal UG (haftungsbeschränkt)\nGesellschaft mit beschränkter Haftung\nRiegelsberg\n\nAls nicht eingetragen wird bekannt gemacht: Den Gläubigern der an der Verschmelzung beteiligten Gesellschaften ist, wenn sie binnen sechs Monaten nach dem Tag, an dem die Eintragung der Verschmelzung in das Register des Sitzes desjenigen Rechtsträgers, dessen Gläubiger sie sind, nach § 19 Absatz 3 UmwG bekannt gemacht worden ist, ihren Anspruch nach Grund und Höhe schriftlich anmelden, Sicherheit zu leisten, soweit sie nicht Befriedigung verlangen können. Dieses Recht steht den Gläubigern jedoch nur zu, wenn sie glaubhaft machen, dass durch die Verschmelzung die Erfüllung ihrer Forderung gefährdet wird."
    },
    {
      "date": "2026-01-14",
      "id": "142374",
      "original_text": "Registerbekanntmachung nach dem Umwandlungsgesetz\nSaarland Amtsgericht Saarbrücken HRB 105977\nAlexis Capital GmbH – Riegelsberg",
      "type": "Registerbekanntmachung nach dem Umwandlungsgesetz",
      "state": "Saarland",
      "amtsgericht": "Amtsgericht Saarbrücken",
      "registernummer": "HRB 105977",
      "registerart": "HRB",
      "company_name": "Alexis Capital GmbH",
      "company_seat": "Riegelsberg",
      "details": "14.01.2026 (Bekanntmachungsdatum)\n\nSaarland Amtsgericht Saarbrücken HRB 105977\nRegisterbekanntmachung nach dem Umwandlungsgesetz 14.01.2026 (Eintragungsdatum)\n\nAlexis Capital GmbH\nGesellschaft mit beschränkter Haftung\nRiegelsberg\n\nAls nicht eingetragen wird bekannt gemacht: Den Gläubigern der an der Verschmelzung beteiligten Gesellschaften ist, wenn sie binnen sechs Monaten nach dem Tag, an dem die Eintragung der Verschmelzung in das Register des Sitzes desjenigen Rechtsträgers, dessen Gläubiger sie sind, nach § 19 Absatz 3 UmwG bekannt gemacht worden ist, ihren Anspruch nach Grund und Höhe schriftlich anmelden, Sicherheit zu leisten, soweit sie nicht Befriedigung verlangen können. Dieses Recht steht den Gläubigern jedoch nur zu, wenn sie glaubhaft machen, dass durch die Verschmelzung die Erfüllung ihrer Forderung gefährdet wird."
    },
    {
      "date": "2026-01-14",
      "id": "142375",
      "original_text": "Registerbekanntmachung nach dem Umwandlungsgesetz\nBaden-Württemberg Amtsgericht Stuttgart HRB 765397\ninbuso GmbH – Reutlingen",
      "type": "Registerbekanntmachung nach dem Umwandlungsgesetz",
      "state": "Baden-Württemberg",
      "amtsgericht": "Amtsgericht Stuttgart",
      "registernummer": "HRB 765397",
      "registerart": "HRB",
      "company_name": "inbuso GmbH",
      "company_seat": "Reutlingen",
      "details": "14.01.2026 (Bekanntmachungsdatum)\n\nBaden-Württemberg Amtsgericht Stuttgart HRB 765397\nRegisterbekanntmachung nach dem Umwandlungsgesetz 14.01.2026 (Eintragungsdatum)\n\ninbuso GmbH\nGesellschaft mit beschränkter Haftung\nReutlingen\n\nAls nicht eingetragen wird bekanntgemacht:\nDen Gläubigern der an der Verschmelzung beteiligten Rechtsträger ist, wenn sie binnen sechs Monaten nach dem Tag, an dem die Eintragung der Verschmelzung in das Register des Sitzes desjenigen Rechtsträgers, dessen Gläubiger sie sind, nach § 19 Abs. 3 UmwG als bekanntgemacht gilt, ihren Anspruch nach Grund und Höhe schriftlich anmelden, Sicherheit zu leisten, soweit sie nicht Befriedigung verlangen können. Dieses Recht steht den Gläubigern jedoch nur zu, wenn sie glaubhaft machen, dass durch die Verschmelzung die Erfüllung ihrer Forderung gefährdet wird."
    },
    {
      "date": "2026-01-14",
      "id": "142376",
      "original_text": "Registerbekanntmachung nach dem Umwandlungsgesetz\nMecklenburg-Vorpommern Amtsgericht Rostock HRB 15166\nTruck Center Uhl GmbH Rostock – Rostock",
      "type": "Registerbekanntmachung nach dem Umwandlungsgesetz",
      "state": "Mecklenburg-Vorpommern",
      "amtsgericht": "Amtsgericht Rostock",
      "registernummer": "HRB 15166",
      "registerart": "HRB",
      "company_name": "Truck Center Uhl GmbH Rostock",
      "company_seat": "Rostock",
      "details": "14.01.2026 (Bekanntmachungsdatum)\n\nMecklenburg-Vorpommern Amtsgericht Rostock HRB 15166\nRegisterbekanntmachung nach dem Umwandlungsgesetz 14.01.2026 (Eintragungsdatum)\n\nTruck Center Uhl GmbH Rostock\nGesellschaft mit beschränkter Haftung\nRostock\n\nAls nicht eingetragen wird veröffentlicht: Den Gläubigern der an der Verschmelzung beteiligten Rechtsträger ist, wenn sie binnen sechs Monaten nach dem Tag, an dem die Eintragung der Verschmelzung in das Register des Sitzes desjenigen Rechtsträgers, dessen Gläubiger sie sind, nach § 19 Abs. 3 UmwG als bekannt gemacht gilt,\nihren Anspruch nach Grund und Höhe in Textform anmelden, Sicherheit zu leisten, soweit sie nicht Befriedigung verlangen können. Dieses Recht steht den Gläubigern jedoch nur zu, wenn sie glaubhaft machen, dass durch die Verschmelzung die Erfüllung der Forderung gefährdet wird."
    },
    {
      "date": "2026-01-14",
      "id": "142377",
      "original_text": "Registerbekanntmachung nach dem Umwandlungsgesetz\nMecklenburg-Vorpommern Amtsgericht Rostock HRB 15073\nTruck Center Uhl GmbH – Güstrow",
      "type": "Registerbekanntmachung nach dem Umwandlungsgesetz",
      "state": "Mecklenburg-Vorpommern",
      "amtsgericht": "Amtsgericht Rostock",
      "registernummer": "HRB 15073",
      "registerart": "HRB",
      "company_name": "Truck Center Uhl GmbH",
      "company_seat": "Güstrow",
      "details": "14.01.2026 (Bekanntmachungsdatum)\n\nMecklenburg-Vorpommern Amtsgericht Rostock HRB 15073\nRegisterbekanntmachung nach dem Umwandlungsgesetz 14.01.2026 (Eintragungsdatum)\n\nTruck Center Uhl GmbH\nGesellschaft mit beschränkter Haftung\nGüstrow\n\nAls nicht eingetragen wird veröffentlicht: Den Gläubigern der an der Verschmelzung beteiligten Rechtsträger ist, wenn sie binnen sechs Monaten nach dem Tag, an dem die Eintragung der Verschmelzung in das Register des Sitzes desjenigen Rechtsträgers, dessen Gläubiger sie sind, nach § 19 Abs. 3 UmwG als bekannt gemacht gilt,\nihren Anspruch nach Grund und Höhe in Textform anmelden, Sicherheit zu leisten, soweit sie nicht Befriedigung verlangen können. Dieses Recht steht den Gläubigern jedoch nur zu, wenn sie glaubhaft machen, dass durch die Verschmelzung die Erfüllung der Forderung gefährdet wird."
    },
    {
      "date": "2026-01-14",
      "id": "142378",
      "original_text": "Registerbekanntmachung nach dem Umwandlungsgesetz\nBaden-Württemberg Amtsgericht Mannheim HRB 704547\nBlue Yonder GmbH – Karlsruhe",
      "type": "Registerbekanntmachung nach dem Umwandlungsgesetz",
      "state": "Baden-Württemberg",
      "amtsgericht": "Amtsgericht Mannheim",
      "registernummer": "HRB 704547",
      "registerart": "HRB",
      "company_name": "Blue Yonder GmbH",
      "company_seat": "Karlsruhe",
      "details": "14.01.2026 (Bekanntmachungsdatum)\n\nBaden-Württemberg Amtsgericht Mannheim HRB 704547\nRegisterbekanntmachung nach dem Umwandlungsgesetz 14.01.2026 (Eintragungsdatum)\n\nBlue Yonder GmbH\nGesellschaft mit beschränkter Haftung\nKarlsruhe\n\nDen Gläubigern der an der Verschmelzung beteiligten Rechtsträger ist, wenn sie binnen sechs Monaten nach dem Tag, an dem die Eintragung der Verschmelzung in das Register des Sitzes desjenigen Rechtsträgers, dessen Gläubiger sie sind, nach § 19 Abs. 3 UmwG als bekanntgemacht gilt, ihren Anspruch nach Grund und Höhe schriftlich anmelden, Sicherheit zu leisten, soweit sie nicht Befriedigung verlangen können. Dieses Recht steht den Gläubigern jedoch nur zu, wenn sie glaubhaft machen, dass durch die Verschmelzung die Erfüllung ihrer Forderung gefährdet wird."
    },
    {
      "date": "2026-01-14",
      "id": "142379",
      "original_text": "Löschungsankündigung\nBaden-Württemberg Amtsgericht Freiburg HRB 728235\nHABSBURGER Facility GmbH – Lauchringen",
      "type": "Löschungsankündigung",
      "state": "Baden-Württemberg",
      "amtsgericht": "Amtsgericht Freiburg",
      "registernummer": "HRB 728235",
      "registerart": "HRB",
      "company_name": "HABSBURGER Facility GmbH",
      "company_seat": "Lauchringen",
      "details": "14.01.2026 (Bekanntmachungsdatum)\n\nBaden-Württemberg Amtsgericht Freiburg HRB 728235\nLöschungsankündigung\n\nHABSBURGER Facility GmbH\nGesellschaft mit beschränkter Haftung\nLauchringen\n\nDas Gericht beabsichtigt, die Gesellschaft wegen Vermögenslosigkeit im Handelsregister von Amts wegen nach § 394 FamFG zu löschen. Die Frist zur Geltendmachung eines Widerspruchs gegen die beabsichtigte Löschung ist auf einen Monat ab Veröffentlichung bestimmt."
    },
    {
      "date": "2026-01-14",
      "id": "142380",
      "original_text": "Löschungsankündigung\nSachsen Amtsgericht Dresden HRB 37036\nITUL GmbH – Dresden",
      "type": "Löschungsankündigung",
      "state": "Sachsen",
      "amtsgericht": "Amtsgericht Dresden",
      "registernummer": "HRB 37036",
      "registerart": "HRB",
      "company_name": "ITUL GmbH",
      "company_seat": "Dresden",
      "details": "14.01.2026 (Bekanntmachungsdatum)\n\nSachsen Amtsgericht Dresden HRB 37036\nLöschungsankündigung\n\nITUL GmbH\nGesellschaft mit beschränkter Haftung\nDresden\n\nDas Registergericht beabsichtigt, die im Handelsregister eingetragene Gesellschaft von Amts wegen nach § 394 FamFG zu löschen. Die Frist zu Erhebung eines Widerspruchs gegen die beabsichtigte Löschung wird auf einen Monat festgesetzt."
    },
    {
      "date": "2026-01-14",
      "id": "142381",
      "original_text": "Sonstige Registerbekanntmachung\nSachsen Amtsgericht Dresden HRB 31704\nObjektgesellschaft Wittekindgrund 17, 19, 21 Munster mbH – Dresden",
      "type": "Sonstige Registerbekanntmachung",
      "state": "Sachsen",
      "amtsgericht": "Amtsgericht Dresden",
      "registernummer": "HRB 31704",
      "registerart": "HRB",
      "company_name": "Objektgesellschaft Wittekindgrund 17, 19, 21 Munster mbH",
      "company_seat": "Dresden",
      "details": "14.01.2026 (Bekanntmachungsdatum)\n\nSachsen Amtsgericht Dresden HRB 31704\nSonstige Registerbekanntmachung 14.01.2026 (Eintragungsdatum)\n\nObjektgesellschaft Wittekindgrund 17, 19, 21 Munster mbH\nGesellschaft mit beschränkter Haftung\nDresden\n\nDen Gläubigern der Gesellschaft, deren Forderungen begründet worden sind bevor die Eintragung der Beendigung des Beherrschungs- und Gewinnabführungsvertrages in das Handelsregister nach § 10 des Handelsgesetzbuches als bekanntgemacht gilt, hat der andere Vertragsteil Sicherheit zu leisten, wenn sie sich binnen sechs Monaten nach der Bekanntmachung der Eintragung zu diesem Zweck bei ihm melden."
    },
    {
      "date": "2026-01-14",
      "id": "142382",
      "original_text": "Löschungsankündigung\nSachsen Amtsgericht Leipzig HRB 36888\nN & P Bauunternehmung GmbH – Taucha",
      "type": "Löschungsankündigung",
      "state": "Sachsen",
      "amtsgericht": "Amtsgericht Leipzig",
      "registernummer": "HRB 36888",
      "registerart": "HRB",
      "company_name": "N & P Bauunternehmung GmbH",
      "company_seat": "Taucha",
      "details": "14.01.2026 (Bekanntmachungsdatum)\n\nSachsen Amtsgericht Leipzig HRB 36888\nLöschungsankündigung\n\nN & P Bauunternehmung GmbH\nGesellschaft mit beschränkter Haftung\nTaucha\n\nDas Registergericht beabsichtigt, den im Handelsregister eingetragenen Geschäftsführer Maksim Dimitrov von Amts wegen nach § 395 Absatz 1 FamFG zu löschen. Die Frist zu Erhebung eines Widerspruchs gegen die beabsichtigte Löschung wird auf einen Monat festgesetzt."
    },
    {
      "date": "2026-01-14",
      "id": "142383",
      "original_text": "Einreichung neuer Dokumente\nSachsen Amtsgericht Dresden HRB 5600\nRegionalbus Oberlausitz GmbH – Bautzen",
      "type": "Einreichung neuer Dokumente",
      "state": "Sachsen",
      "amtsgericht": "Amtsgericht Dresden",
      "registernummer": "HRB 5600",
      "registerart": "HRB",
      "company_name": "Regionalbus Oberlausitz GmbH",
      "company_seat": "Bautzen",
      "details": "14.01.2026 (Bekanntmachungsdatum)\n\nSachsen Amtsgericht Dresden HRB 5600\nEinreichung neuer Dokumente\n\nRegionalbus Oberlausitz GmbH\nGesellschaft mit beschränkter Haftung\nBautzen\n\nAm 09.01.2026 wurde beim Handelsregister des Amtsgerichts Dresden die Liste der Mitglieder des Aufsichtsrats gemäß § 52 GmbHG eingereicht."
    },
    {
      "date": "2026-01-14",
      "id": "142384",
      "original_text": "Löschungsankündigung\nSachsen Amtsgericht Dresden GnR 515\nProRegio Sachsen eG – Dresden",
      "type": "Löschungsankündigung",
      "state": "Sachsen",
      "amtsgericht": "Amtsgericht Dresden",
      "registernummer": "GnR 515",
      "registerart": "GnR",
      "company_name": "ProRegio Sachsen eG",
      "company_seat": "Dresden",
      "details": "14.01.2026 (Bekanntmachungsdatum)\n\nSachsen Amtsgericht Dresden GnR 515\nLöschungsankündigung\n\nProRegio Sachsen eG\neingetragene Genossenschaft\nDresden\n\nDas Registergericht beabsichtigt, die im Genossenschaftsregister eingetragene Genossenschaft von Amts wegen nach § 394 FamFG zu löschen. Die Frist zu Erhebung eines Widerspruchs gegen die beabsichtigte Löschung wird auf einen Monat festgesetzt."
    },
    {
      "date": "2026-01-14",
      "id": "142385",
      "original_text": "Einreichung neuer Dokumente\nBaden-Württemberg Amtsgericht Stuttgart HRB 734826\nCeramTec GmbH – Plochingen",
      "type": "Einreichung neuer Dokumente",
      "state": "Baden-Württemberg",
      "amtsgericht": "Amtsgericht Stuttgart",
      "registernummer": "HRB 734826",
      "registerart": "HRB",
      "company_name": "CeramTec GmbH",
      "company_seat": "Plochingen",
      "details": "14.01.2026 (Bekanntmachungsdatum)\n\nBaden-Württemberg Amtsgericht Stuttgart HRB 734826\nEinreichung neuer Dokumente 14.01.2026 (Eintragungsdatum)\n\nCeramTec GmbH\nGesellschaft mit beschränkter Haftung\nPlochingen\n\nDie Gesellschaft hat am 04.01.2026 die Liste über die Zusammensetzung des Aufsichtsrats zum Handelsregister eingereicht."
    },
    {
      "date": "2026-01-14",
      "id": "142386",
      "original_text": "Löschungsankündigung\nNiedersachsen Amtsgericht Hildesheim HRB 207599\nUltimate-Grading GmbH – Sehnde",
      "type": "Löschungsankündigung",
      "state": "Niedersachsen",
      "amtsgericht": "Amtsgericht Hildesheim",
      "registernummer": "HRB 207599",
      "registerart": "HRB",
      "company_name": "Ultimate-Grading GmbH",
      "company_seat": "Sehnde",
      "details": "14.01.2026 (Bekanntmachungsdatum)\n\nNiedersachsen Amtsgericht Hildesheim HRB 207599\nLöschungsankündigung\n\nUltimate-Grading GmbH\nGesellschaft mit beschränkter Haftung\nSehnde\n\nDas Registergericht beabsichtigt, die Gesellschaft von Amts wegen nach § 394 FamFG zu löschen. Die Frist zur Erhebung eines Widerspruchs ist auf 1 Monat ab dieser Registerbekanntmachung festgesetzt.\n\nDas Registergericht beabsichtigt, den Geschäftsführer Nonnenkamp von Amts wegen nach § 395 FamFG zu löschen. Die Frist zur Erhebung eines Widerspruchs ist auf 1 Monat ab dieser Registerbekanntmachung festgesetzt."
    },
    {
      "date": "2026-01-14",
      "id": "142387",
      "original_text": "Sonstige Registerbekanntmachung\nNiedersachsen Amtsgericht Hannover HRB 58100\nGehrke Econ Steuerberatungsgesellschaft mbH – Isernhagen",
      "type": "Sonstige Registerbekanntmachung",
      "state": "Niedersachsen",
      "amtsgericht": "Amtsgericht Hannover",
      "registernummer": "HRB 58100",
      "registerart": "HRB",
      "company_name": "Gehrke Econ Steuerberatungsgesellschaft mbH",
      "company_seat": "Isernhagen",
      "details": "14.01.2026 (Bekanntmachungsdatum)\n\nNiedersachsen Amtsgericht Hannover HRB 58100\nSonstige Registerbekanntmachung 14.01.2026 (Eintragungsdatum)\n\nGehrke Econ Steuerberatungsgesellschaft mbH\nGesellschaft mit beschränkter Haftung\nIsernhagen\n\nDen Gläubigern der Gesellschaft, deren Forderungen begründet worden sind, bevor die Eintragung der Beendigung des Vertrages in das Handelsregister nach § 10 HGB als bekanntgemacht gilt, ist vom anderen Vertragsteil Sicherheit zu leisten, wenn sie sich binnen sechs Monaten nach der Bekanntmachung zu diesem Zweck bei ihm melden."
    },
    {
      "date": "2026-01-14",
      "id": "142388",
      "original_text": "Registerbekanntmachung nach dem Umwandlungsgesetz\nNiedersachsen Amtsgericht Lüneburg HRB 203474\nHansekontor Beteiligungs Verwaltungs GmbH – Lüneburg",
      "type": "Registerbekanntmachung nach dem Umwandlungsgesetz",
      "state": "Niedersachsen",
      "amtsgericht": "Amtsgericht Lüneburg",
      "registernummer": "HRB 203474",
      "registerart": "HRB",
      "company_name": "Hansekontor Beteiligungs Verwaltungs GmbH",
      "company_seat": "Lüneburg",
      "details": "14.01.2026 (Bekanntmachungsdatum)\n\nNiedersachsen Amtsgericht Lüneburg HRB 203474\nRegisterbekanntmachung nach dem Umwandlungsgesetz 14.01.2026 (Eintragungsdatum)\n\nHansekontor Beteiligungs Verwaltungs GmbH\nGesellschaft mit beschränkter Haftung\nLüneburg\n\nDen Gläubigern der an der Verschmelzung beteiligten Rechtsträger ist, wenn sie binnen sechs Monaten nach dem Tag, an dem die Eintragung der Verschmelzung in das Register des Sitzes desjenigen Rechtsträgers, dessen Gläubiger sie sind, nach § 19  Abs.  3 UmwG als bekannt gemacht gilt, ihren Anspruch nach Grund und Höhe schriftlich anmelden, Sicherheit zu leisten, soweit sie nicht Befriedigung verlangen können. Dieses Recht steht den Gläubigern jedoch nur zu, wenn sie glaubhaft machen, dass durch die Verschmelzung die Erfüllung der Forderung gefährdet wird."
    },
    {
      "date": "2026-01-14",
      "id": "142389",
      "original_text": "Registerbekanntmachung nach dem Umwandlungsgesetz\nNiedersachsen Amtsgericht Lüneburg HRA 203540\nSchiffsfreunde Bleckede KG – Bleckede",
      "type": "Registerbekanntmachung nach dem Umwandlungsgesetz",
      "state": "Niedersachsen",
      "amtsgericht": "Amtsgericht Lüneburg",
      "registernummer": "HRA 203540",
      "registerart": "HRA",
      "company_name": "Schiffsfreunde Bleckede KG",
      "company_seat": "Bleckede",
      "details": "14.01.2026 (Bekanntmachungsdatum)\n\nNiedersachsen Amtsgericht Lüneburg HRA 203540\nRegisterbekanntmachung nach dem Umwandlungsgesetz 14.01.2026 (Eintragungsdatum)\n\nSchiffsfreunde Bleckede KG\nKommanditgesellschaft\nBleckede\n\nDen Gläubigern der an der Verschmelzung beteiligten Rechtsträger ist, wenn sie binnen sechs Monaten nach dem Tag, an dem die Eintragung der Verschmelzung in das Register des Sitzes desjenigen Rechtsträgers, dessen Gläubiger sie sind, nach § 19  Abs.  3 UmwG als bekannt gemacht gilt, ihren Anspruch nach Grund und Höhe schriftlich anmelden, Sicherheit zu leisten, soweit sie nicht Befriedigung verlangen können. Dieses Recht steht den Gläubigern jedoch nur zu, wenn sie glaubhaft machen, dass durch die Verschmelzung die Erfüllung der Forderung gefährdet wird."
    },
    {
      "date": "2026-01-14",
      "id": "142390",
      "original_text": "Löschungsankündigung\nNiedersachsen Amtsgericht Osnabrück HRB 203462\nA & V Handels GmbH – Bad Rothenfelde",
      "type": "Löschungsankündigung",
      "state": "Niedersachsen",
      "amtsgericht": "Amtsgericht Osnabrück",
      "registernummer": "HRB 203462",
      "registerart": "HRB",
      "company_name": "A & V Handels GmbH",
      "company_seat": "Bad Rothenfelde",
      "details": "14.01.2026 (Bekanntmachungsdatum)\n\nNiedersachsen Amtsgericht Osnabrück HRB 203462\nLöschungsankündigung\n\nA & V Handels GmbH\nGesellschaft mit beschränkter Haftung\nBad Rothenfelde\n\nDas Registergericht beabsichtigt, die Gesellschaft von Amts wegen nach § 394 FamFG wegen Vermögenslosigkeit zu löschen. Die Frist zur Erhebung eines Widerspruchs ist auf 1 Monat ab dieser Registerbekanntmachung festgesetzt."
    },
    {
      "date": "2026-01-14",
      "id": "142391",
      "original_text": "Löschungsankündigung\nNiedersachsen Amtsgericht Osnabrück HRB 210402\nKaragöz-Immobilien GmbH – Nordhorn",
      "type": "Löschungsankündigung",
      "state": "Niedersachsen",
      "amtsgericht": "Amtsgericht Osnabrück",
      "registernummer": "HRB 210402",
      "registerart": "HRB",
      "company_name": "Karagöz-Immobilien GmbH",
      "company_seat": "Nordhorn",
      "details": "14.01.2026 (Bekanntmachungsdatum)\n\nNiedersachsen Amtsgericht Osnabrück HRB 210402\nLöschungsankündigung\n\nKaragöz-Immobilien GmbH\nGesellschaft mit beschränkter Haftung\nNordhorn\n\nDas Registergericht beabsichtigt, die Gesellschaft von Amts wegen nach § 394 FamFG wegen Vermögenslosigkeit zu löschen. Die Frist zur Erhebung eines Widerspruchs ist auf 1 Monat ab dieser Registerbekanntmachung festgesetzt."
    },
    {
      "date": "2026-01-14",
      "id": "142392",
      "original_text": "Löschungsankündigung\nNiedersachsen Amtsgericht Osnabrück HRB 15967\nStändige Botschaft Gaststätten GmbH – Osnabrück",
      "type": "Löschungsankündigung",
      "state": "Niedersachsen",
      "amtsgericht": "Amtsgericht Osnabrück",
      "registernummer": "HRB 15967",
      "registerart": "HRB",
      "company_name": "Ständige Botschaft Gaststätten GmbH",
      "company_seat": "Osnabrück",
      "details": "14.01.2026 (Bekanntmachungsdatum)\n\nNiedersachsen Amtsgericht Osnabrück HRB 15967\nLöschungsankündigung\n\nStändige Botschaft Gaststätten GmbH\nGesellschaft mit beschränkter Haftung\nOsnabrück\n\nDas Registergericht beabsichtigt, die Gesellschaft von Amts wegen nach § 394 FamFG wegen Vermögenslosigkeit zu löschen. Die Frist zur Erhebung eines Widerspruchs ist auf 1 Monat ab dieser Registerbekanntmachung festgesetzt."
    },
    {
      "date": "2026-01-14",
      "id": "142393",
      "original_text": "Löschungsankündigung\nNiedersachsen Amtsgericht Lüneburg HRB 208917\nSignum Services GmbH – Seevetal",
      "type": "Löschungsankündigung",
      "state": "Niedersachsen",
      "amtsgericht": "Amtsgericht Lüneburg",
      "registernummer": "HRB 208917",
      "registerart": "HRB",
      "company_name": "Signum Services GmbH",
      "company_seat": "Seevetal",
      "details": "14.01.2026 (Bekanntmachungsdatum)\n\nNiedersachsen Amtsgericht Lüneburg HRB 208917\nLöschungsankündigung\n\nSignum Services GmbH\nGesellschaft mit beschränkter Haftung\nSeevetal\n\nDas Registergericht beabsichtigt, die Gesellschaft von Amts wegen nach § 394 FamFG zu löschen. Die Frist zur Erhebung eines Widerspruchs ist auf 1 Monat ab dieser Registerbekanntmachung festgesetzt."
    },
    {
      "date": "2026-01-14",
      "id": "142394",
      "original_text": "Registerbekanntmachung nach dem Umwandlungsgesetz\nRheinland-Pfalz Amtsgericht Kaiserslautern HRB 33507\nfabo GmbH – Kaiserslautern",
      "type": "Registerbekanntmachung nach dem Umwandlungsgesetz",
      "state": "Rheinland-Pfalz",
      "amtsgericht": "Amtsgericht Kaiserslautern",
      "registernummer": "HRB 33507",
      "registerart": "HRB",
      "company_name": "fabo GmbH",
      "company_seat": "Kaiserslautern",
      "details": "14.01.2026 (Bekanntmachungsdatum)\n\nRheinland-Pfalz Amtsgericht Kaiserslautern HRB 33507\nRegisterbekanntmachung nach dem Umwandlungsgesetz 14.01.2026 (Eintragungsdatum)\n\nfabo GmbH\nGesellschaft mit beschränkter Haftung\nKaiserslautern\n\nAls nicht eingetragen wird veröffentlicht: Den Gläubigern der an der Verschmelzung beteiligten Rechtsträger ist, wenn sie binnen sechs Monaten nach dem Tag, an dem die Eintragung der Verschmelzung in das Register des Sitzes desjenigen Rechtsträgers,dessen Gläubiger sie sind, nach § 19 Abs. 3 UmwG als bekannt gemacht gilt, ihren Anspruch nach Grund und Höhe schriftlich anmelden, Sicherheit zu leisten, soweit sie nicht Befriedigung verlangen können. Dieses Recht steht den Gläubigern jedoch nur zu, wenn sie glaubhaft machen, dass durch die Verschmelzung die Erfüllung der Forderung gefährdet wird."
    },
    {
      "date": "2026-01-14",
      "id": "142395",
      "original_text": "Registerbekanntmachung nach dem Umwandlungsgesetz\nNordrhein-Westfalen Amtsgericht Köln HRB 126246\nHEUBECK GmbH – Köln",
      "type": "Registerbekanntmachung nach dem Umwandlungsgesetz",
      "state": "Nordrhein-Westfalen",
      "amtsgericht": "Amtsgericht Köln",
      "registernummer": "HRB 126246",
      "registerart": "HRB",
      "company_name": "HEUBECK GmbH",
      "company_seat": "Köln",
      "details": "14.01.2026 (Bekanntmachungsdatum)\n\nNordrhein-Westfalen Amtsgericht Köln HRB 126246\nRegisterbekanntmachung nach dem Umwandlungsgesetz 14.01.2026 (Eintragungsdatum)\n\nHEUBECK GmbH\nGesellschaft mit beschränkter Haftung\nKöln\n\nDen Gläubigern der an der formwechselnden Umwandlung beteiligten Rechtsträger ist, wenn sie binnen sechs Monaten nach dem Tag, an dem die Eintragung der formwechselnden Umwandlung in das Register des Sitzes desjenigen Rechtsträgers, dessen Gläubiger sie sind, nach § 19 Absatz 3 UmwG als bekanntgemacht gilt, ihren Anspruch nach Grund und Höhe schriftlich anmelden, Sicherheit zu leisten, soweit sie nicht Befriedigung verlangen können. Dieses Recht steht den Gläubigern jedoch nur zu, wenn sie glaubhaft machen, dass durch die formwechselnden Umwandlung die Erfüllung ihrer Forderung gefährdet wird."
    },
    {
      "date": "2026-01-14",
      "id": "142396",
      "original_text": "Löschungsankündigung\nNordrhein-Westfalen Amtsgericht Dortmund HRB 4794\nSANILUX Sanitär-Bedarfs-GmbH – Dortmund",
      "type": "Löschungsankündigung",
      "state": "Nordrhein-Westfalen",
      "amtsgericht": "Amtsgericht Dortmund",
      "registernummer": "HRB 4794",
      "registerart": "HRB",
      "company_name": "SANILUX Sanitär-Bedarfs-GmbH",
      "company_seat": "Dortmund",
      "details": "14.01.2026 (Bekanntmachungsdatum)\n\nNordrhein-Westfalen Amtsgericht Dortmund HRB 4794\nLöschungsankündigung 14.01.2026 (Eintragungsdatum)\n\nSANILUX Sanitär-Bedarfs-GmbH\nGesellschaft mit beschränkter Haftung\nDortmund\n\nDas Registergericht beabsichtigt die Gesellschaft von Amts wegen nach § 394 FamFG zu löschen. Die Frist zur Erhebung eines Widerspruchs ist auf zwei Monate festgesetzt."
    },
    {
      "date": "2026-01-14",
      "id": "142397",
      "original_text": "Löschungsankündigung\nNordrhein-Westfalen Amtsgericht Duisburg HRB 27986\nKAR METALS GmbH – Duisburg",
      "type": "Löschungsankündigung",
      "state": "Nordrhein-Westfalen",
      "amtsgericht": "Amtsgericht Duisburg",
      "registernummer": "HRB 27986",
      "registerart": "HRB",
      "company_name": "KAR METALS GmbH",
      "company_seat": "Duisburg",
      "details": "14.01.2026 (Bekanntmachungsdatum)\n\nNordrhein-Westfalen Amtsgericht Duisburg HRB 27986\nLöschungsankündigung\n\nKAR METALS GmbH\nGesellschaft mit beschränkter Haftung\nDuisburg\n\nDas Registergericht beabsichtigt, die im Handelsregister eingetragene Gesellschaft KAR METALS GmbH gemäß § 394 Absatz 1 FamFG wegen Vermögenslosigkeit von Amts wegen zu löschen. Gegen diese Verfügung kann Widerspruch eingelegt werden. Die Frist zur Erhebung eines Widerspruchs gegen die beabsichtigte Löschung von Amts wegen ist auf drei Monate festgesetzt. Rechtsbehelfsbelehrung Der Widerspruch ist bei dem Amtsgericht Duisburg, Kardinal-Galen-Str. 124-132, 47058 Duisburg schriftlich in deutscher Sprache oder zur Niederschrift der Geschäftsstelle einzulegen. Der Widerspruch kann auch zur Niederschrift der Geschäftsstelle eines jeden Amtsgerichtes abgegeben werden. Die Einlegung ist auch durch Übertragung eines elektronischen Dokuments an die elektronische Poststelle des Gerichts möglich. Das elektronische Dokument muss für die Bearbeitung durch das Gericht geeignet und mit einer qualifizierten elektronischen Signatur der verantwortenden Person versehen sein oder von der verantwortenden Person signiert und auf einem sicheren Übermittlungsweg gemäß § 130 a ZPO nach näherer Maßgabe der Verordnung über die technischen Rahmenbedingungen des elektronischen Rechtsverkehrs und über das besondere elektronische Behördenpostfach (BGBl. I, S. 3803) eingereicht werden. Weitere Informationen erhalten Sie auf der Internetseite www.justiz.de <http://www.justiz.de>. Der Widerspruch muss spätestens innerhalb der gesetzten Frist bei dem Amtsgericht Duisburg eingegangen sein. Dies gilt auch dann, wenn der Widerspruch zur Niederschrift der Geschäftsstelle eines anderen Amtsgerichtes abgegeben wurde. Die Frist beginnt mit der Veröffentlichung. Fällt das Ende der Frist auf einen Sonntag, einen allgemeinen Feiertag oder Sonnabend, so endet die Frist mit Ablauf des nächsten Werktages. Der Widerspruch muss die Bezeichnung der angefochtenen Verfügung sowie die Erklärung enthalten, dass Widerspruch gegen diese Verfügung eingelegt wird. Er ist zu unterzeichnen und soll begründet werden."
    },
    {
      "date": "2026-01-14",
      "id": "142398",
      "original_text": "Löschungsankündigung\nNordrhein-Westfalen Amtsgericht Dortmund HRB 23822\nOntrust-Hausverwaltung UG (haftungsbeschränkt) – Dortmund",
      "type": "Löschungsankündigung",
      "state": "Nordrhein-Westfalen",
      "amtsgericht": "Amtsgericht Dortmund",
      "registernummer": "HRB 23822",
      "registerart": "HRB",
      "company_name": "Ontrust-Hausverwaltung UG (haftungsbeschränkt)",
      "company_seat": "Dortmund",
      "details": "14.01.2026 (Bekanntmachungsdatum)\n\nNordrhein-Westfalen Amtsgericht Dortmund HRB 23822\nLöschungsankündigung 14.01.2026 (Eintragungsdatum)\n\nOntrust-Hausverwaltung UG (haftungsbeschränkt)\nGesellschaft mit beschränkter Haftung\nDortmund\n\nDas Registergericht beabsichtigt die Gesellschaft von Amts wegen nach § 394 FamFG zu löschen. Die Frist zur Erhebung eines Widerspruchs ist auf zwei Monate festgesetzt."
    },
    {
      "date": "2026-01-14",
      "id": "142399",
      "original_text": "Löschungsankündigung\nNordrhein-Westfalen Amtsgericht Neuss HRB 16138\nSATO Import and Export GmbH – Meerbusch",
      "type": "Löschungsankündigung",
      "state": "Nordrhein-Westfalen",
      "amtsgericht": "Amtsgericht Neuss",
      "registernummer": "HRB 16138",
      "registerart": "HRB",
      "company_name": "SATO Import and Export GmbH",
      "company_seat": "Meerbusch",
      "details": "14.01.2026 (Bekanntmachungsdatum)\n\nNordrhein-Westfalen Amtsgericht Neuss HRB 16138\nLöschungsankündigung\n\nSATO Import and Export GmbH\nGesellschaft mit beschränkter Haftung\nMeerbusch\n\nes ist beabsichtigt, die im Handelsregister eingetragene Gesellschaft gemäß § 394 Absatz 1 FamFG wegen Vermögenslosigkeit von Amts wegen zu löschen.\n\nFrist zur Geltendmachung eines Widerspruchs: 1 Monat\n\nRechtsbehelfsbelehrung:\nGegen diese Verfügung können Sie Widerspruch einlegen. Der Widerspruch ist bei dem Amtsgericht Neuss, Breite Straße 48, 41460 Neuss schriftlich in deutscher Sprache oder zur Niederschrift der Geschäftsstelle einzulegen. Der Widerspruch kann auch zur Niederschrift der Geschäftsstelle eines jeden Amtsgerichtes abgegeben werden. Die Einlegung ist auch durch Übertragung eines elektronischen Dokuments an die elektronische Poststelle des Gerichts möglich. Das elektronische Dokument muss für die Bearbeitung durch das Gericht geeignet und mit einer qualifizierten elektronischen Signatur der verantwortenden Person versehen sein oder von der verantwortenden Person signiert und auf einem sicheren Übermittlungsweg gemäß § 130a ZPO nach näherer Maßgabe der Verordnung über die technischen Rahmenbedingungen des elektronischen Rechtsverkehrs und über das besondere elektronische Behördenpostfach (BGBl. I, S.3803) eingereicht werden. Weitere Informationen erhalten Sie auf der Internetseite www.justiz.de.\nDer Widerspruch muss spätestens innerhalb der gesetzten Frist bei dem Amtsgericht Neuss eingegangen sein. Dies gilt auch dann, wenn der Widerspruch zur Niederschrift der Geschäftsstelle eines anderen Amtsgerichtes abgegeben wurde. Die Frist beginnt mit der Veröffentlichung. Fällt das Ende der Frist auf einen Sonntag, einen allgemeinen Feiertag oder Sonnabend, so endet die Frist mit Ablauf des nächsten Werktages. Der Widerspruch muss die Bezeichnung der angefochtenen Verfügung sowie die Erklärung enthalten, dass Widerspruch gegen diese Verfügung eingelegt wird. Er ist zu unterzeichnen und soll begründet werden."
    },
    {
      "date": "2026-01-14",
      "id": "142400",
      "original_text": "Löschungsankündigung\nNordrhein-Westfalen Amtsgericht Siegburg HRB 15350\nRöseler Schuhe GmbH – Hennef",
      "type": "Löschungsankündigung",
      "state": "Nordrhein-Westfalen",
      "amtsgericht": "Amtsgericht Siegburg",
      "registernummer": "HRB 15350",
      "registerart": "HRB",
      "company_name": "Röseler Schuhe GmbH",
      "company_seat": "Hennef",
      "details": "14.01.2026 (Bekanntmachungsdatum)\n\nNordrhein-Westfalen Amtsgericht Siegburg HRB 15350\nLöschungsankündigung\n\nRöseler Schuhe GmbH\nGesellschaft mit beschränkter Haftung\nHennef\n\nDas Registergericht hat glaubhafte Kenntnis erlangt, dass die Gesellschaft vermögenslos geworden ist, da ein Insolvenzverfahren durchgeführt und nach § 200 InsO aufgehoben wurde.\n\nEs ist daher beabsichtigt, die Gesellschaft nach § 394 FamFG im Handelsregister wegen Vermögenslosigkeit zu löschen.\nEinwände gegen die Löschung sind durch Widerspruch binnen einer Frist von 3 Monaten geltend zu machen, andernfalls die Löschung erfolgen wird.\n\nEinzulegen ist der Widerspruch bei dem Amtsgericht Siegburg, Neue Poststraße 16, 53721 Siegburg, und zwar entweder schriftlich in deutscher Sprache oder mündlich zur Niederschrift der Geschäftsstelle. Der Widerspruch kann auch zur Niederschrift der Geschäftsstelle eines jeden Amtsgerichts abgegeben werden. Der Widerspruch ist binnen der in der Verfügung bestimmten Frist einzulegen. Die Frist ist nur gewahrt, wenn der Widerspruch rechtzeitig bei dem Amtsgericht Siegburg eingeht, auch wenn der Widerspruch zur Niederschrift der Geschäftsstelle eines anderen Amtsgerichts abgegeben wurde. Die Frist beginnt jeweils mit der schriftlichen Bekanntgabe der Verfügung an die Beteiligten. Kann die schriftliche Bekanntgabe an einen Beteiligten nicht bewirkt werden, beginnt die Frist spätestens mit Ablauf von fünf Monaten nach Erlass der Verfügung. Die Bekanntgabe ist entweder durch Zustellung oder am dritten Tage nach Aufgabe zur Post bewirkt. Sofern die Löschung noch nicht erfolgt ist, kann der Widerspruch auch noch nach Ablauf der Frist eingelegt werden. Fällt das Ende der Frist auf einen Sonnabend, einen Sonntag oder einen allgemeinen Feiertag, endet die Frist mit Ablauf des nächsten Werktages. Der Widerspruch ist zu unterzeichnen. Eine Begründung des Widerspruchs ist nicht vorgeschrieben."
    },
    {
      "date": "2026-01-14",
      "id": "142401",
      "original_text": "Löschungsankündigung\nNordrhein-Westfalen Amtsgericht Gütersloh HRB 9323\nIT-Systems Strauss GmbH – Gütersloh",
      "type": "Löschungsankündigung",
      "state": "Nordrhein-Westfalen",
      "amtsgericht": "Amtsgericht Gütersloh",
      "registernummer": "HRB 9323",
      "registerart": "HRB",
      "company_name": "IT-Systems Strauss GmbH",
      "company_seat": "Gütersloh",
      "details": "14.01.2026 (Bekanntmachungsdatum)\n\nNordrhein-Westfalen Amtsgericht Gütersloh HRB 9323\nLöschungsankündigung 14.01.2026 (Eintragungsdatum)\n\nIT-Systems Strauss GmbH\nGesellschaft mit beschränkter Haftung\nGütersloh\n\nDas Registergericht beabsichtigt die Gesellschaft von Amts wegen nach § 394 FamFG zu löschen. Die Frist zur Erhebung eines Widerspruchs ist auf einen Monat festgesetzt."
    },
    {
      "date": "2026-01-14",
      "id": "142402",
      "original_text": "Löschungsankündigung\nNordrhein-Westfalen Amtsgericht Siegen HRB 12167\nPommeswiese GmbH – Freudenberg",
      "type": "Löschungsankündigung",
      "state": "Nordrhein-Westfalen",
      "amtsgericht": "Amtsgericht Siegen",
      "registernummer": "HRB 12167",
      "registerart": "HRB",
      "company_name": "Pommeswiese GmbH",
      "company_seat": "Freudenberg",
      "details": "14.01.2026 (Bekanntmachungsdatum)\n\nNordrhein-Westfalen Amtsgericht Siegen HRB 12167\nLöschungsankündigung\n\nPommeswiese GmbH\nGesellschaft mit beschränkter Haftung\nFreudenberg\n\nDas Registergericht beabsichtigt die Gesellschaft von Amts wegen nach § 394 FamFG zu löschen. Die Frist zur Erhebung eines Widerspruchs ist auf drei Monate festgesetzt."
    },
    {
      "date": "2026-01-14",
      "id": "142403",
      "original_text": "Löschungsankündigung\nNordrhein-Westfalen Amtsgericht Kleve HRB 19516\nM. Matzellus Unternehmergesellschaft (haftungsbeschränkt) – Issum",
      "type": "Löschungsankündigung",
      "state": "Nordrhein-Westfalen",
      "amtsgericht": "Amtsgericht Kleve",
      "registernummer": "HRB 19516",
      "registerart": "HRB",
      "company_name": "M. Matzellus Unternehmergesellschaft (haftungsbeschränkt)",
      "company_seat": "Issum",
      "details": "14.01.2026 (Bekanntmachungsdatum)\n\nNordrhein-Westfalen Amtsgericht Kleve HRB 19516\nLöschungsankündigung\n\nM. Matzellus Unternehmergesellschaft (haftungsbeschränkt)\nGesellschaft mit beschränkter Haftung\nIssum\n\nDas Registergericht beabsichtigt die Gesellschaft von Amts wegen nach § 394 FamFG zu löschen. Die Frist zur Erhebung eines Widerspruchs ist auf einen Monat festgesetzt."
    },
    {
      "date": "2026-01-14",
      "id": "142404",
      "original_text": "Löschungsankündigung\nNordrhein-Westfalen Amtsgericht Düsseldorf HRA 22328\nLangenfeld Projektgesellschaft mbH & Co.KG – Langenfeld",
      "type": "Löschungsankündigung",
      "state": "Nordrhein-Westfalen",
      "amtsgericht": "Amtsgericht Düsseldorf",
      "registernummer": "HRA 22328",
      "registerart": "HRA",
      "company_name": "Langenfeld Projektgesellschaft mbH & Co.KG",
      "company_seat": "Langenfeld",
      "details": "14.01.2026 (Bekanntmachungsdatum)\n\nNordrhein-Westfalen Amtsgericht Düsseldorf HRA 22328\nLöschungsankündigung\n\nLangenfeld Projektgesellschaft mbH & Co.KG\nKommanditgesellschaft\nLangenfeld\n\nDas Registergericht beabsichtigt die Firma von Amts wegen nach § 394 FamFG zu löschen. Die Frist zur Erhebung eines Widerspruchs ist auf drei Monate festgesetzt.\n\nRechtsbehelfsbelehrung:\nDas Widerspruchsrecht steht jedem zu, der an der Unterlassung der Löschung ein berechtigtes Interesse hat. Der Widerspruch ist bei dem Amtsgericht Düsseldorf -Registergericht-, Werdener Straße 1, 40227 Düsseldorf schriftlich in deutscher Sprache oder zur Niederschrift der Geschäftsstelle einzulegen. Der Widerspruch kann auch zur Niederschrift der Geschäftsstelle eines jeden Amtsgerichtes abgegeben werden. Die Einlegung ist auch durch Übertragung eines elektronischen Dokuments an die elektronische Poststelle des Gerichts möglich. Das elektronische Dokument muss für die Bearbeitung durch das Gericht geeignet und mit einer qualifizierten elektronischen Signatur der verantwortenden Person versehen sein oder von der verantwortenden Person signiert und auf einem sicheren Übermittlungsweg gemäß § 130a ZPO nach näherer Maßgabe der Verordnung über die technischen Rahmenbedingungen des elektronischen Rechtsverkehrs und über das besondere elektronische Behördenpostfach (BGBl. I, S.3803) eingereicht werden. Weitere Informationen erhalten Sie auf der Internetseite www.justiz.de.\nDer Widerspruch muss spätestens innerhalb der gesetzten Frist nach dem Datum der Bekanntmachung der Löschungsankündigung bei dem Amtsgericht - Registergericht - Düsseldorf eingegangen sein.  Dies gilt auch dann, wenn der Widerspruch zur Niederschrift der Geschäftsstelle eines anderen Amtsgerichtes abgegeben wurde. Die Frist beginnt mit dem Tage der Bekanntmachung der Löschungsankündigung in dem für die Bekanntmachung der Eintragungen in das Handelsregister bestimmten elektronischen Informations- und Kommunikationssystem nach § 10 des Handelsgesetzbuches. Fällt das Ende der Frist auf einen Sonntag, einen allgemeinen Feiertag oder Sonnabend, so endet die Frist mit Ablauf des nächsten Werktages.\nDer Widerspruch muss die Bezeichnung der angefochtenen Löschungsankündigung sowie die Erklärung enthalten, dass Widerspruch gegen diese Löschungsankündigung eingelegt wird. Er ist zu unterzeichnen und soll begründet werden."
    },
    {
      "date": "2026-01-14",
      "id": "142405",
      "original_text": "Einreichung neuer Dokumente\nNordrhein-Westfalen Amtsgericht Köln HRB 35215\nrhenag Rheinische Energie Aktiengesellschaft – Köln",
      "type": "Einreichung neuer Dokumente",
      "state": "Nordrhein-Westfalen",
      "amtsgericht": "Amtsgericht Köln",
      "registernummer": "HRB 35215",
      "registerart": "HRB",
      "company_name": "rhenag Rheinische Energie Aktiengesellschaft",
      "company_seat": "Köln",
      "details": "14.01.2026 (Bekanntmachungsdatum)\n\nNordrhein-Westfalen Amtsgericht Köln HRB 35215\nEinreichung neuer Dokumente 14.01.2026 (Eintragungsdatum)\n\nrhenag Rheinische Energie Aktiengesellschaft\nAktiengesellschaft\nKöln\n\nDem Registergericht ist eine neue Liste der Mitglieder des Aufsichtsrates eingereicht worden."
    },
    {
      "date": "2026-01-14",
      "id": "142406",
      "original_text": "Einreichung neuer Dokumente\nNordrhein-Westfalen Amtsgericht Düsseldorf HRB 8372\nSalzgitter Mannesmann Handel GmbH – Düsseldorf",
      "type": "Einreichung neuer Dokumente",
      "state": "Nordrhein-Westfalen",
      "amtsgericht": "Amtsgericht Düsseldorf",
      "registernummer": "HRB 8372",
      "registerart": "HRB",
      "company_name": "Salzgitter Mannesmann Handel GmbH",
      "company_seat": "Düsseldorf",
      "details": "14.01.2026 (Bekanntmachungsdatum)\n\nNordrhein-Westfalen Amtsgericht Düsseldorf HRB 8372\nEinreichung neuer Dokumente\n\nSalzgitter Mannesmann Handel GmbH\nGesellschaft mit beschränkter Haftung\nDüsseldorf\n\nDem Registergericht ist eine neue Liste der Mitglieder des Aufsichtsrates eingereicht worden."
    },
    {
      "date": "2026-01-14",
      "id": "142407",
      "original_text": "Löschungsankündigung\nNordrhein-Westfalen Amtsgericht Gütersloh HRB 5884\nH & B Holz-Design GmbH – Langenberg",
      "type": "Löschungsankündigung",
      "state": "Nordrhein-Westfalen",
      "amtsgericht": "Amtsgericht Gütersloh",
      "registernummer": "HRB 5884",
      "registerart": "HRB",
      "company_name": "H & B Holz-Design GmbH",
      "company_seat": "Langenberg",
      "details": "14.01.2026 (Bekanntmachungsdatum)\n\nNordrhein-Westfalen Amtsgericht Gütersloh HRB 5884\nLöschungsankündigung\n\nH & B Holz-Design GmbH\nGesellschaft mit beschränkter Haftung\nLangenberg\n\nDas Registergericht beabsichtigt die Gesellschaft von Amts wegen nach § 394 FamFG zu löschen. Die Frist zur Erhebung eines Widerspruchs ist auf einen Monat festgesetzt."
    },
    {
      "date": "2026-01-14",
      "id": "142408",
      "original_text": "Löschungsankündigung\nNordrhein-Westfalen Amtsgericht Düren HRB 9595\nAngsanana UG (haftungsbeschränkt) – Düren",
      "type": "Löschungsankündigung",
      "state": "Nordrhein-Westfalen",
      "amtsgericht": "Amtsgericht Düren",
      "registernummer": "HRB 9595",
      "registerart": "HRB",
      "company_name": "Angsanana UG (haftungsbeschränkt)",
      "company_seat": "Düren",
      "details": "14.01.2026 (Bekanntmachungsdatum)\n\nNordrhein-Westfalen Amtsgericht Düren HRB 9595\nLöschungsankündigung\n\nAngsanana UG (haftungsbeschränkt)\nGesellschaft mit beschränkter Haftung\nDüren\n\nDas Registergericht beabsichtigt die Gesellschaft von Amts wegen nach § 394 FamFG zu löschen. Die Frist zur Erhebung eines Widerspruchs ist auf drei Monate festgesetzt."
    },
    {
      "date": "2026-01-14",
      "id": "142409",
      "original_text": "Löschungsankündigung\nNordrhein-Westfalen Amtsgericht Düsseldorf HRB 97839\nMachiavelli Cars GmbH – Düsseldorf",
      "type": "Löschungsankündigung",
      "state": "Nordrhein-Westfalen",
      "amtsgericht": "Amtsgericht Düsseldorf",
      "registernummer": "HRB 97839",
      "registerart": "HRB",
      "company_name": "Machiavelli Cars GmbH",
      "company_seat": "Düsseldorf",
      "details": "14.01.2026 (Bekanntmachungsdatum)\n\nNordrhein-Westfalen Amtsgericht Düsseldorf HRB 97839\nLöschungsankündigung\n\nMachiavelli Cars GmbH\nGesellschaft mit beschränkter Haftung\nDüsseldorf\n\nDas Registergericht beabsichtigt die Gesellschaft von Amts wegen nach § 394 Abs. 1 FamFG zu löschen. Die Frist zur Erhebung eines Widerspruchs ist auf 3 Wochen festgesetzt.\n\nRechtsbehelfsbelehrung:\nDas Widerspruchsrecht steht jedem zu, der an der Unterlassung der Löschung ein berechtigtes Interesse hat. Der Widerspruch ist bei dem Amtsgericht Düsseldorf -Registergericht-, Werdener Straße 1, 40227 Düsseldorf schriftlich in deutscher Sprache oder zur Niederschrift der Geschäftsstelle einzulegen. Der Widerspruch kann auch zur Niederschrift der Geschäftsstelle eines jeden Amtsgerichtes abgegeben werden. Die Einlegung ist auch durch Übertragung eines elektronischen Dokuments an die elektronische Poststelle des Gerichts möglich. Das elektronische Dokument muss für die Bearbeitung durch das Gericht geeignet und mit einer qualifizierten elektronischen Signatur der verantwortenden Person versehen sein oder von der verantwortenden Person signiert und auf einem sicheren Übermittlungsweg gemäß § 130a ZPO nach näherer Maßgabe der Verordnung über die technischen Rahmenbedingungen des elektronischen Rechtsverkehrs und über das besondere elektronische Behördenpostfach (BGBl. I, S.3803) eingereicht werden. Weitere Informationen erhalten Sie auf der Internetseite www.justiz.de.\nDer Widerspruch muss spätestens innerhalb der gesetzten Frist nach dem Datum der Bekanntmachung der Löschungsankündigung bei dem Amtsgericht - Registergericht - Düsseldorf eingegangen sein.  Dies gilt auch dann, wenn der Widerspruch zur Niederschrift der Geschäftsstelle eines anderen Amtsgerichtes abgegeben wurde. Die Frist beginnt mit dem Tage der Bekanntmachung der Löschungsankündigung in dem für die Bekanntmachung der Eintragungen in das Handelsregister bestimmten elektronischen Informations- und Kommunikationssystem nach § 10 des Handelsgesetzbuches. Fällt das Ende der Frist auf einen Sonntag, einen allgemeinen Feiertag oder Sonnabend, so endet die Frist mit Ablauf des nächsten Werktages.\nDer Widerspruch muss die Bezeichnung der angefochtenen Löschungsankündigung sowie die Erklärung enthalten, dass Widerspruch gegen diese Löschungsankündigung eingelegt wird. Er ist zu unterzeichnen und soll begründet werden."
    },
    {
      "date": "2026-01-14",
      "id": "142410",
      "original_text": "Registerbekanntmachung nach dem Umwandlungsgesetz\nNordrhein-Westfalen Amtsgericht Duisburg HRB 36196\nDr. Rebecca Özdemir Immobilien GmbH – Duisburg",
      "type": "Registerbekanntmachung nach dem Umwandlungsgesetz",
      "state": "Nordrhein-Westfalen",
      "amtsgericht": "Amtsgericht Duisburg",
      "registernummer": "HRB 36196",
      "registerart": "HRB",
      "company_name": "Dr. Rebecca Özdemir Immobilien GmbH",
      "company_seat": "Duisburg",
      "details": "14.01.2026 (Bekanntmachungsdatum)\n\nNordrhein-Westfalen Amtsgericht Duisburg HRB 36196\nRegisterbekanntmachung nach dem Umwandlungsgesetz 14.01.2026 (Eintragungsdatum)\n\nDr. Rebecca Özdemir Immobilien GmbH\nGesellschaft mit beschränkter Haftung\nDuisburg\n\nDie Gesellschaft hat Gläubigern, deren Forderungen vor dieser Bekanntmachung begründet worden sind, Sicherheit zu leisten, soweit sie nicht Befriedigung verlangen können, wenn sie sich binnen sechs Monaten zu diesem Zweck melden."
    },
    {
      "date": "2026-01-14",
      "id": "142411",
      "original_text": "Registerbekanntmachung nach dem Umwandlungsgesetz\nNordrhein-Westfalen Amtsgericht Düsseldorf HRB 95472\nCargill Holding (Germany) GmbH – Düsseldorf",
      "type": "Registerbekanntmachung nach dem Umwandlungsgesetz",
      "state": "Nordrhein-Westfalen",
      "amtsgericht": "Amtsgericht Düsseldorf",
      "registernummer": "HRB 95472",
      "registerart": "HRB",
      "company_name": "Cargill Holding (Germany) GmbH",
      "company_seat": "Düsseldorf",
      "details": "14.01.2026 (Bekanntmachungsdatum)\n\nNordrhein-Westfalen Amtsgericht Düsseldorf HRB 95472\nRegisterbekanntmachung nach dem Umwandlungsgesetz 14.01.2026 (Eintragungsdatum)\n\nCargill Holding (Germany) GmbH\nGesellschaft mit beschränkter Haftung\nDüsseldorf\n\nDen Gläubigern der an der Verschmelzung beteiligten Rechtsträger ist, wenn sie binnen sechs Monaten nach dem Tag, an dem die Eintragung der Verschmelzung in das Register des Sitzes desjenigen Rechtsträgers, dessen Gläubiger sie sind, nach § 19 Absatz 3 UmwG als bekanntgemacht gilt, ihren Anspruch nach Grund und Höhe schriftlich anmelden, Sicherheit zu leisten, soweit sie nicht Befriedigung verlangen können. Dieses Recht steht den Gläubigern jedoch nur zu, wenn sie glaubhaft machen, dass durch die Verschmelzung die Erfüllung ihrer Forderung gefährdet wird."
    },
    {
      "date": "2026-01-14",
      "id": "142412",
      "original_text": "Löschungsankündigung\nNordrhein-Westfalen Amtsgericht Mönchengladbach HRB 19005\nAbbaTec UG (haftungsbeschränkt) – Mönchengladbach",
      "type": "Löschungsankündigung",
      "state": "Nordrhein-Westfalen",
      "amtsgericht": "Amtsgericht Mönchengladbach",
      "registernummer": "HRB 19005",
      "registerart": "HRB",
      "company_name": "AbbaTec UG (haftungsbeschränkt)",
      "company_seat": "Mönchengladbach",
      "details": "14.01.2026 (Bekanntmachungsdatum)\n\nNordrhein-Westfalen Amtsgericht Mönchengladbach HRB 19005\nLöschungsankündigung\n\nAbbaTec UG (haftungsbeschränkt)\nGesellschaft mit beschränkter Haftung\nMönchengladbach\n\nDas Registergericht beabsichtigt, die im Handelsregister eingetragene Gesellschaftgemäß § 394 Absatz 1 FamFG wegen Vermögenslosigkeit von Amts wegen zu\nlöschen. Gegen diese Verfügung kann Widerspruch eingelegt werden. Die Frist zurErhebung eines Widerspruchs gegen die beabsichtigte Löschung von Amts wegen ist auf drei Monate festgesetzt."
    },
    {
      "date": "2026-01-14",
      "id": "142413",
      "original_text": "Löschungsankündigung\nNordrhein-Westfalen Amtsgericht Düsseldorf HRB 92731\nGL GmbH – Düsseldorf",
      "type": "Löschungsankündigung",
      "state": "Nordrhein-Westfalen",
      "amtsgericht": "Amtsgericht Düsseldorf",
      "registernummer": "HRB 92731",
      "registerart": "HRB",
      "company_name": "GL GmbH",
      "company_seat": "Düsseldorf",
      "details": "14.01.2026 (Bekanntmachungsdatum)\n\nNordrhein-Westfalen Amtsgericht Düsseldorf HRB 92731\nLöschungsankündigung\n\nGL GmbH\nGesellschaft mit beschränkter Haftung\nDüsseldorf\n\nDas Registergericht beabsichtigt die Gesellschaft von Amts wegen nach § 394 FamFG zu löschen. Die Frist zur Erhebung eines Widerspruchs ist auf 3 Wochen festgesetzt.\n\nRechtsbehelfsbelehrung:\nDas Widerspruchsrecht steht jedem zu, der an der Unterlassung der Löschung ein berechtigtes Interesse hat. Der Widerspruch ist bei dem Amtsgericht Düsseldorf -Registergericht-, Werdener Straße 1, 40227 Düsseldorf schriftlich in deutscher Sprache oder zur Niederschrift der Geschäftsstelle einzulegen. Der Widerspruch kann auch zur Niederschrift der Geschäftsstelle eines jeden Amtsgerichtes abgegeben werden. Die Einlegung ist auch durch Übertragung eines elektronischen Dokuments an die elektronische Poststelle des Gerichts möglich. Das elektronische Dokument muss für die Bearbeitung durch das Gericht geeignet und mit einer qualifizierten elektronischen Signatur der verantwortenden Person versehen sein oder von der verantwortenden Person signiert und auf einem sicheren Übermittlungsweg gemäß § 130a ZPO nach näherer Maßgabe der Verordnung über die technischen Rahmenbedingungen des elektronischen Rechtsverkehrs und über das besondere elektronische Behördenpostfach (BGBl. I, S.3803) eingereicht werden. Weitere Informationen erhalten Sie auf der Internetseite www.justiz.de.\nDer Widerspruch muss spätestens innerhalb der gesetzten Frist nach dem Datum der Bekanntmachung der Löschungsankündigung bei dem Amtsgericht - Registergericht - Düsseldorf eingegangen sein.  Dies gilt auch dann, wenn der Widerspruch zur Niederschrift der Geschäftsstelle eines anderen Amtsgerichtes abgegeben wurde. Die Frist beginnt mit dem Tage der Bekanntmachung der Löschungsankündigung in dem für die Bekanntmachung der Eintragungen in das Handelsregister bestimmten elektronischen Informations- und Kommunikationssystem nach § 10 des Handelsgesetzbuches. Fällt das Ende der Frist auf einen Sonntag, einen allgemeinen Feiertag oder Sonnabend, so endet die Frist mit Ablauf des nächsten Werktages.\nDer Widerspruch muss die Bezeichnung der angefochtenen Löschungsankündigung sowie die Erklärung enthalten, dass Widerspruch gegen diese Löschungsankündigung eingelegt wird. Er ist zu unterzeichnen und soll begründet werden."
    },
    {
      "date": "2026-01-14",
      "id": "142414",
      "original_text": "Registerbekanntmachung nach dem Umwandlungsgesetz\nNordrhein-Westfalen Amtsgericht Köln HRB 102584\nAconlog Projekt Zwei GmbH – Köln",
      "type": "Registerbekanntmachung nach dem Umwandlungsgesetz",
      "state": "Nordrhein-Westfalen",
      "amtsgericht": "Amtsgericht Köln",
      "registernummer": "HRB 102584",
      "registerart": "HRB",
      "company_name": "Aconlog Projekt Zwei GmbH",
      "company_seat": "Köln",
      "details": "14.01.2026 (Bekanntmachungsdatum)\n\nNordrhein-Westfalen Amtsgericht Köln HRB 102584\nRegisterbekanntmachung nach dem Umwandlungsgesetz 14.01.2026 (Eintragungsdatum)\n\nAconlog Projekt Zwei GmbH\nGesellschaft mit beschränkter Haftung\nKöln\n\nDen Gläubigern der an der Verschmelzung beteiligten Rechtsträger ist, wenn sie binnen sechs Monaten nach dem Tag, an dem die Eintragung der Verschmelzung in das Register des Sitzes desjenigen Rechtsträgers, dessen Gläubiger sie sind, nach § 19 Absatz 3 UmwG als bekanntgemacht gilt, ihren Anspruch nach Grund und Höhe schriftlich anmelden, Sicherheit zu leisten, soweit sie nicht Befriedigung verlangen können. Dieses Recht steht den Gläubigern jedoch nur zu, wenn sie glaubhaft machen, dass durch die Verschmelzung die Erfüllung ihrer Forderung gefährdet wird."
    },
    {
      "date": "2026-01-14",
      "id": "142415",
      "original_text": "Registerbekanntmachung nach dem Umwandlungsgesetz\nNordrhein-Westfalen Amtsgericht Köln HRB 101853\nAconlog Projektentwicklung GmbH – Köln",
      "type": "Registerbekanntmachung nach dem Umwandlungsgesetz",
      "state": "Nordrhein-Westfalen",
      "amtsgericht": "Amtsgericht Köln",
      "registernummer": "HRB 101853",
      "registerart": "HRB",
      "company_name": "Aconlog Projektentwicklung GmbH",
      "company_seat": "Köln",
      "details": "14.01.2026 (Bekanntmachungsdatum)\n\nNordrhein-Westfalen Amtsgericht Köln HRB 101853\nRegisterbekanntmachung nach dem Umwandlungsgesetz 14.01.2026 (Eintragungsdatum)\n\nAconlog Projektentwicklung GmbH\nGesellschaft mit beschränkter Haftung\nKöln\n\nDen Gläubigern der an der Verschmelzung beteiligten Rechtsträger ist, wenn sie binnen sechs Monaten nach dem Tag, an dem die Eintragung der Verschmelzung in das Register des Sitzes desjenigen Rechtsträgers, dessen Gläubiger sie sind, nach § 19 Absatz 3 UmwG als bekanntgemacht gilt, ihren Anspruch nach Grund und Höhe schriftlich anmelden, Sicherheit zu leisten, soweit sie nicht Befriedigung verlangen können. Dieses Recht steht den Gläubigern jedoch nur zu, wenn sie glaubhaft machen, dass durch die Verschmelzung die Erfüllung ihrer Forderung gefährdet wird."
    },
    {
      "date": "2026-01-14",
      "id": "142416",
      "original_text": "Löschungsankündigung\nNordrhein-Westfalen Amtsgericht Siegburg HRB 16294\nEgo Bauunternehmen UG (haftungsbeschränkt) – Waldbröl",
      "type": "Löschungsankündigung",
      "state": "Nordrhein-Westfalen",
      "amtsgericht": "Amtsgericht Siegburg",
      "registernummer": "HRB 16294",
      "registerart": "HRB",
      "company_name": "Ego Bauunternehmen UG (haftungsbeschränkt)",
      "company_seat": "Waldbröl",
      "details": "14.01.2026 (Bekanntmachungsdatum)\n\nNordrhein-Westfalen Amtsgericht Siegburg HRB 16294\nLöschungsankündigung\n\nEgo Bauunternehmen UG (haftungsbeschränkt)\nGesellschaft mit beschränkter Haftung\nWaldbröl\n\nDas Registergericht hat glaubhafte Kenntnis erlangt, dass die Gesellschaft vermögenslos geworden ist.\n\nEs ist daher beabsichtigt, die Gesellschaft nach § 394 FamFG im Handelsregister wegen Vermögenslosigkeit zu löschen.\nEinwände gegen die Löschung sind durch Widerspruch binnen einer Frist von 3 Monaten geltend zu machen, andernfalls die Löschung erfolgen wird.\n\nEinzulegen ist der Widerspruch bei dem Amtsgericht Siegburg, Neue Poststraße 16, 53721 Siegburg, und zwar entweder schriftlich in deutscher Sprache oder mündlich zur Niederschrift der Geschäftsstelle. Der Widerspruch kann auch zur Niederschrift der Geschäftsstelle eines jeden Amtsgerichts abgegeben werden. Der Widerspruch ist binnen der in der Verfügung bestimmten Frist einzulegen. Die Frist ist nur gewahrt, wenn der Widerspruch rechtzeitig bei dem Amtsgericht Siegburg eingeht, auch wenn der Widerspruch zur Niederschrift der Geschäftsstelle eines anderen Amtsgerichts abgegeben wurde. Die Frist beginnt jeweils mit der schriftlichen Bekanntgabe der Verfügung an die Beteiligten. Kann die schriftliche Bekanntgabe an einen Beteiligten nicht bewirkt werden, beginnt die Frist spätestens mit Ablauf von fünf Monaten nach Erlass der Verfügung. Die Bekanntgabe ist entweder durch Zustellung oder am dritten Tage nach Aufgabe zur Post bewirkt. Sofern die Löschung noch nicht erfolgt ist, kann der Widerspruch auch noch nach Ablauf der Frist eingelegt werden. Fällt das Ende der Frist auf einen Sonnabend, einen Sonntag oder einen allgemeinen Feiertag, endet die Frist mit Ablauf des nächsten Werktages. Der Widerspruch ist zu unterzeichnen. Eine Begründung des Widerspruchs ist nicht vorgeschrieben."
    },
    {
      "date": "2026-01-14",
      "id": "142417",
      "original_text": "Löschungsankündigung\nNordrhein-Westfalen Amtsgericht Hamm HRB 10293\nHesse Technik + Bau UG (haftungsbeschränkt) – Hamm",
      "type": "Löschungsankündigung",
      "state": "Nordrhein-Westfalen",
      "amtsgericht": "Amtsgericht Hamm",
      "registernummer": "HRB 10293",
      "registerart": "HRB",
      "company_name": "Hesse Technik + Bau UG (haftungsbeschränkt)",
      "company_seat": "Hamm",
      "details": "14.01.2026 (Bekanntmachungsdatum)\n\nNordrhein-Westfalen Amtsgericht Hamm HRB 10293\nLöschungsankündigung\n\nHesse Technik + Bau UG (haftungsbeschränkt)\nGesellschaft mit beschränkter Haftung\nHamm\n\nDas Registergericht beabsichtigt die Gesellschaft von Amts wegen nach § 394 FamFG zu löschen. Die Frist zur Erhebung eines Widerspruchs ist auf drei Monate festgesetzt."
    },
    {
      "date": "2026-01-14",
      "id": "142418",
      "original_text": "Registerbekanntmachung nach dem Umwandlungsgesetz\nNordrhein-Westfalen Amtsgericht Köln HRB 35652\nHEUBECK AG – Köln",
      "type": "Registerbekanntmachung nach dem Umwandlungsgesetz",
      "state": "Nordrhein-Westfalen",
      "amtsgericht": "Amtsgericht Köln",
      "registernummer": "HRB 35652",
      "registerart": "HRB",
      "company_name": "HEUBECK AG",
      "company_seat": "Köln",
      "details": "14.01.2026 (Bekanntmachungsdatum)\n\nNordrhein-Westfalen Amtsgericht Köln HRB 35652\nRegisterbekanntmachung nach dem Umwandlungsgesetz 14.01.2026 (Eintragungsdatum)\n\nHEUBECK AG\nAktiengesellschaft\nKöln\n\nDen Gläubigern der an der formwechselnden Umwandlung beteiligten Rechtsträger ist, wenn sie binnen sechs Monaten nach dem Tag, an dem die Eintragung der formwechselnden Umwandlung in das Register des Sitzes desjenigen Rechtsträgers, dessen Gläubiger sie sind, nach § 19 Absatz 3 UmwG als bekanntgemacht gilt, ihren Anspruch nach Grund und Höhe schriftlich anmelden, Sicherheit zu leisten, soweit sie nicht Befriedigung verlangen können. Dieses Recht steht den Gläubigern jedoch nur zu, wenn sie glaubhaft machen, dass durch die formwechselnden Umwandlung die Erfüllung ihrer Forderung gefährdet wird."
    },
    {
      "date": "2026-01-14",
      "id": "142419",
      "original_text": "Löschungsankündigung\nNordrhein-Westfalen Amtsgericht Hamm HRB 6597\nALSINO Verwaltungs GmbH – Fröndenberg",
      "type": "Löschungsankündigung",
      "state": "Nordrhein-Westfalen",
      "amtsgericht": "Amtsgericht Hamm",
      "registernummer": "HRB 6597",
      "registerart": "HRB",
      "company_name": "ALSINO Verwaltungs GmbH",
      "company_seat": "Fröndenberg",
      "details": "14.01.2026 (Bekanntmachungsdatum)\n\nNordrhein-Westfalen Amtsgericht Hamm HRB 6597\nLöschungsankündigung\n\nALSINO Verwaltungs GmbH\nGesellschaft mit beschränkter Haftung\nFröndenberg\n\nDas Registergericht beabsichtigt die Gesellschaft von Amts wegen nach § 394 FamFG zu löschen. Die Frist zur Erhebung eines Widerspruchs ist auf drei Monate festgesetzt."
    },
    {
      "date": "2026-01-14",
      "id": "142420",
      "original_text": "Registerbekanntmachung nach dem Umwandlungsgesetz\nNordrhein-Westfalen Amtsgericht Aachen HRB 25151\nD63 GmbH – Aachen",
      "type": "Registerbekanntmachung nach dem Umwandlungsgesetz",
      "state": "Nordrhein-Westfalen",
      "amtsgericht": "Amtsgericht Aachen",
      "registernummer": "HRB 25151",
      "registerart": "HRB",
      "company_name": "D63 GmbH",
      "company_seat": "Aachen",
      "details": "14.01.2026 (Bekanntmachungsdatum)\n\nNordrhein-Westfalen Amtsgericht Aachen HRB 25151\nRegisterbekanntmachung nach dem Umwandlungsgesetz 14.01.2026 (Eintragungsdatum)\n\nD63 GmbH\nGesellschaft mit beschränkter Haftung\nAachen\n\nDen Gläubigern der an der formwechselnden Umwandlung beteiligten Rechtsträger ist, wenn sie binnen sechs Monaten nach dem Tag, an dem die Eintragung der formwechselnden Umwandlung in das Register des Sitzes desjenigen Rechtsträgers, dessen Gläubiger sie sind, nach § 19 Absatz 3 UmwG als bekanntgemacht gilt, ihren Anspruch nach Grund und Höhe schriftlich anmelden, Sicherheit zu leisten, soweit sie nicht Befriedigung verlangen können. Dieses Recht steht den Gläubigern jedoch nur zu, wenn sie glaubhaft machen, dass durch die formwechselnden Umwandlung die Erfüllung ihrer Forderung gefährdet wird."
    },
    {
      "date": "2026-01-14",
      "id": "142421",
      "original_text": "Registerbekanntmachung nach dem Umwandlungsgesetz\nNordrhein-Westfalen Amtsgericht Steinfurt HRB 13901\n73. Ibbenbürener Immobilien Vermietungs- und Verpachtungsgesellschaft mbH – Ibbenbüren",
      "type": "Registerbekanntmachung nach dem Umwandlungsgesetz",
      "state": "Nordrhein-Westfalen",
      "amtsgericht": "Amtsgericht Steinfurt",
      "registernummer": "HRB 13901",
      "registerart": "HRB",
      "company_name": "73. Ibbenbürener Immobilien Vermietungs- und Verpachtungsgesellschaft mbH",
      "company_seat": "Ibbenbüren",
      "details": "14.01.2026 (Bekanntmachungsdatum)\n\nNordrhein-Westfalen Amtsgericht Steinfurt HRB 13901\nRegisterbekanntmachung nach dem Umwandlungsgesetz 14.01.2026 (Eintragungsdatum)\n\n73. Ibbenbürener Immobilien Vermietungs- und Verpachtungsgesellschaft mbH\nGesellschaft mit beschränkter Haftung\nIbbenbüren\n\nDen Gläubigern der an der formwechselnden Umwandlung beteiligten Rechtsträger ist, wenn sie binnen sechs Monaten nach dem Tag, an dem die Eintragung der formwechselnden Umwandlung in das Register des Sitzes desjenigen Rechtsträgers, dessen Gläubiger sie sind, nach § 19 Absatz 3 UmwG als bekanntgemacht gilt, ihren Anspruch nach Grund und Höhe schriftlich anmelden, Sicherheit zu leisten, soweit sie nicht Befriedigung verlangen können. Dieses Recht steht den Gläubigern jedoch nur zu, wenn sie glaubhaft machen, dass durch die formwechselnden Umwandlung die Erfüllung ihrer Forderung gefährdet wird."
    },
    {
      "date": "2026-01-14",
      "id": "142422",
      "original_text": "Registerbekanntmachung nach dem Umwandlungsgesetz\nNordrhein-Westfalen Amtsgericht Paderborn HRA 9085\nRedingerhof GmbH & Co. KG – Paderborn",
      "type": "Registerbekanntmachung nach dem Umwandlungsgesetz",
      "state": "Nordrhein-Westfalen",
      "amtsgericht": "Amtsgericht Paderborn",
      "registernummer": "HRA 9085",
      "registerart": "HRA",
      "company_name": "Redingerhof GmbH & Co. KG",
      "company_seat": "Paderborn",
      "details": "14.01.2026 (Bekanntmachungsdatum)\n\nNordrhein-Westfalen Amtsgericht Paderborn HRA 9085\nRegisterbekanntmachung nach dem Umwandlungsgesetz 14.01.2026 (Eintragungsdatum)\n\nRedingerhof GmbH & Co. KG\nKommanditgesellschaft\nPaderborn\n\nDen Gläubigern der an der formwechselnden Umwandlung beteiligten Rechtsträger ist, wenn sie binnen sechs Monaten nach dem Tag, an dem die Eintragung der formwechselnden Umwandlung in das Register des Sitzes desjenigen Rechtsträgers, dessen Gläubiger sie sind, nach § 19 Absatz 3 UmwG als bekanntgemacht gilt, ihren Anspruch nach Grund und Höhe schriftlich anmelden, Sicherheit zu leisten, soweit sie nicht Befriedigung verlangen können. Dieses Recht steht den Gläubigern jedoch nur zu, wenn sie glaubhaft machen, dass durch die formwechselnden Umwandlung die Erfüllung ihrer Forderung gefährdet wird."
    },
    {
      "date": "2026-01-14",
      "id": "142423",
      "original_text": "Löschungsankündigung\nNordrhein-Westfalen Amtsgericht Siegburg HRB 3838\nLöwe GmbH – Neunkirchen-Seelscheid",
      "type": "Löschungsankündigung",
      "state": "Nordrhein-Westfalen",
      "amtsgericht": "Amtsgericht Siegburg",
      "registernummer": "HRB 3838",
      "registerart": "HRB",
      "company_name": "Löwe GmbH",
      "company_seat": "Neunkirchen-Seelscheid",
      "details": "14.01.2026 (Bekanntmachungsdatum)\n\nNordrhein-Westfalen Amtsgericht Siegburg HRB 3838\nLöschungsankündigung\n\nLöwe GmbH\nGesellschaft mit beschränkter Haftung\nNeunkirchen-Seelscheid\n\nDas Registergericht hat glaubhafte Kenntnis erlangt, dass die Gesellschaft vermögenslos geworden ist, da\nein Insolvenzeröffnungsantrag mangels Masse nach § 26 InsO zurückgewiesen wurde.\n\nEs ist daher beabsichtigt, die Gesellschaft nach § 394 FamFG im Handelsregister wegen Vermögenslosigkeit zu löschen.\nEinwände gegen die Löschung sind durch Widerspruch binnen einer Frist von 3 Monaten geltend zu machen, andernfalls die Löschung erfolgen wird.\n\nEinzulegen ist der Widerspruch bei dem Amtsgericht Siegburg, Neue Poststraße 16, 53721 Siegburg, und zwar entweder schriftlich in deutscher Sprache oder mündlich zur Niederschrift der Geschäftsstelle. Der Widerspruch kann auch zur Niederschrift der Geschäftsstelle eines jeden Amtsgerichts abgegeben werden. Der Widerspruch ist binnen der in der Verfügung bestimmten Frist einzulegen. Die Frist ist nur gewahrt, wenn der Widerspruch rechtzeitig bei dem Amtsgericht Siegburg eingeht, auch wenn der Widerspruch zur Niederschrift der Geschäftsstelle eines anderen Amtsgerichts abgegeben wurde. Die Frist beginnt jeweils mit der schriftlichen Bekanntgabe der Verfügung an die Beteiligten. Kann die schriftliche Bekanntgabe an einen Beteiligten nicht bewirkt werden, beginnt die Frist spätestens mit Ablauf von fünf Monaten nach Erlass der Verfügung. Die Bekanntgabe ist entweder durch Zustellung oder am dritten Tage nach Aufgabe zur Post bewirkt. Sofern die Löschung noch nicht erfolgt ist, kann der Widerspruch auch noch nach Ablauf der Frist eingelegt werden. Fällt das Ende der Frist auf einen Sonnabend, einen Sonntag oder einen allgemeinen Feiertag, endet die Frist mit Ablauf des nächsten Werktages. Der Widerspruch ist zu unterzeichnen. Eine Begründung des Widerspruchs ist nicht vorgeschrieben."
    },
    {
      "date": "2026-01-14",
      "id": "142424",
      "original_text": "Einreichung neuer Dokumente\nBaden-Württemberg Amtsgericht Stuttgart HRB 722892\nNHF Netzgesellschaft Heilbronn-Franken mbH – Heilbronn",
      "type": "Einreichung neuer Dokumente",
      "state": "Baden-Württemberg",
      "amtsgericht": "Amtsgericht Stuttgart",
      "registernummer": "HRB 722892",
      "registerart": "HRB",
      "company_name": "NHF Netzgesellschaft Heilbronn-Franken mbH",
      "company_seat": "Heilbronn",
      "details": "14.01.2026 (Bekanntmachungsdatum)\n\nBaden-Württemberg Amtsgericht Stuttgart HRB 722892\nEinreichung neuer Dokumente\n\nNHF Netzgesellschaft Heilbronn-Franken mbH\nGesellschaft mit beschränkter Haftung\nHeilbronn\n\nDie Gesellschaft hat am 12.01.2026 die Liste über die Zusammensetzung des Aufsichtsrats zum Handelsregister eingereicht."
    },
    {
      "date": "2026-01-14",
      "id": "142425",
      "original_text": "Sonstige Registerbekanntmachung\nThüringen Amtsgericht Jena HRB 206837\nTOGAZ Thüringer Obst- und Gemüseabsatzzentrale GmbH – Alperstedt",
      "type": "Sonstige Registerbekanntmachung",
      "state": "Thüringen",
      "amtsgericht": "Amtsgericht Jena",
      "registernummer": "HRB 206837",
      "registerart": "HRB",
      "company_name": "TOGAZ Thüringer Obst- und Gemüseabsatzzentrale GmbH",
      "company_seat": "Alperstedt",
      "details": "14.01.2026 (Bekanntmachungsdatum)\n\nThüringen Amtsgericht Jena HRB 206837\nSonstige Registerbekanntmachung 14.01.2026 (Eintragungsdatum)\n\nTOGAZ Thüringer Obst- und Gemüseabsatzzentrale GmbH\nGesellschaft mit beschränkter Haftung\nAlperstedt\n\nNicht eingetragen: Den Gläubigern der Gesellschaft, deren Forderungen begründet worden sind, bevor die Eintragung der Beendigung des Vertrages in das Handelsregister nach § 10 des Handelsgesetzbuches als bekanntgemacht gilt, hat der andere Vertragsteil Sicherheit zu leisten, wenn sie sich binnen sechs Monaten nach der Bekanntmachung der Eintragung zu diesem Zweck bei ihm melden."
    },
    {
      "date": "2026-01-14",
      "id": "142426",
      "original_text": "Sonstige Registerbekanntmachung\nThüringen Amtsgericht Jena HRB 511292\nMED ON Service GmbH – Erfurt",
      "type": "Sonstige Registerbekanntmachung",
      "state": "Thüringen",
      "amtsgericht": "Amtsgericht Jena",
      "registernummer": "HRB 511292",
      "registerart": "HRB",
      "company_name": "MED ON Service GmbH",
      "company_seat": "Erfurt",
      "details": "14.01.2026 (Bekanntmachungsdatum)\n\nThüringen Amtsgericht Jena HRB 511292\nSonstige Registerbekanntmachung 14.01.2026 (Eintragungsdatum)\n\nMED ON Service GmbH\nGesellschaft mit beschränkter Haftung\nErfurt\n\nNicht eingetragen: Den Gläubigern der Gesellschaft, deren Forderungen begründet worden sind, bevor die Eintragung der Beendigung des Vertrages in das Handelsregister nach § 10 des Handelsgesetzbuches als bekanntgemacht gilt, hat der andere Vertragsteil Sicherheit zu leisten, wenn sie sich binnen sechs Monaten nach der Bekanntmachung der Eintragung zu diesem Zweck bei ihm melden."
    },
    {
      "date": "2026-01-14",
      "id": "142427",
      "original_text": "Registerbekanntmachung nach dem Umwandlungsgesetz\nHessen Amtsgericht Frankfurt am Main HRB 95164\nDIC High Street Balance GmbH – Frankfurt am Main",
      "type": "Registerbekanntmachung nach dem Umwandlungsgesetz",
      "state": "Hessen",
      "amtsgericht": "Amtsgericht Frankfurt am Main",
      "registernummer": "HRB 95164",
      "registerart": "HRB",
      "company_name": "DIC High Street Balance GmbH",
      "company_seat": "Frankfurt am Main",
      "details": "14.01.2026 (Bekanntmachungsdatum)\n\nHessen Amtsgericht Frankfurt am Main HRB 95164\nRegisterbekanntmachung nach dem Umwandlungsgesetz 14.01.2026 (Eintragungsdatum)\n\nDIC High Street Balance GmbH\nGesellschaft mit beschränkter Haftung\nFrankfurt am Main\n\nDen Gläubigern der an der Verschmelzung beteiligten Rechtsträger ist, wenn sie binnen sechs Monaten nach dem Tag, an dem die Eintragung der Verschmelzung in das Register des Sitzes desjenigen Rechtsträgers, dessen Gläubiger sie sind, nach § 19 Absatz 3 UmwG bekannt gemacht worden ist, ihren Anspruch nach Grund und Höhe schriftlich anmelden, Sicherheit zu leisten, soweit sie nicht Befriedigung verlangen können. Dieses Recht steht den Gläubigern jedoch nur zu, wenn sie glaubhaft machen, dass durch die Verschmelzung die Erfüllung ihrer Forderung gefährdet wird."
    },
    {
      "date": "2026-01-14",
      "id": "142428",
      "original_text": "Sonstige Registerbekanntmachung\nHessen Amtsgericht Frankfurt am Main HRB 117029\nParkView Partners GmbH – Frankfurt am Main",
      "type": "Sonstige Registerbekanntmachung",
      "state": "Hessen",
      "amtsgericht": "Amtsgericht Frankfurt am Main",
      "registernummer": "HRB 117029",
      "registerart": "HRB",
      "company_name": "ParkView Partners GmbH",
      "company_seat": "Frankfurt am Main",
      "details": "14.01.2026 (Bekanntmachungsdatum)\n\nHessen Amtsgericht Frankfurt am Main HRB 117029\nSonstige Registerbekanntmachung 14.01.2026 (Eintragungsdatum)\n\nParkView Partners GmbH\nGesellschaft mit beschränkter Haftung\nFrankfurt am Main\n\nDen Gläubigern der Gesellschaft, deren Forderungen begründet worden sind, bevor die Eintragung der Beendigung des Vertrages in das Handelsregister nach § 10 des Handelsgesetzbuches als bekanntgemacht gilt, hat der andere Vertragsteil Sicherheit zu leisten, wenn sie sich binnen sechs Monaten nach der Bekanntmachung der Eintragung zu diesem Zweck bei ihm melden."
    },
    {
      "date": "2026-01-14",
      "id": "142429",
      "original_text": "Registerbekanntmachung nach dem Umwandlungsgesetz\nHessen Amtsgericht Bad Homburg v.d.H. HRB 14639\nFirst Data Holding GmbH – Bad Homburg v. d. Höhe",
      "type": "Registerbekanntmachung nach dem Umwandlungsgesetz",
      "state": "Hessen",
      "amtsgericht": "Amtsgericht Bad Homburg v.d.H.",
      "registernummer": "HRB 14639",
      "registerart": "HRB",
      "company_name": "First Data Holding GmbH",
      "company_seat": "Bad Homburg v. d. Höhe",
      "details": "14.01.2026 (Bekanntmachungsdatum)\n\nHessen Amtsgericht Bad Homburg v.d.H. HRB 14639\nRegisterbekanntmachung nach dem Umwandlungsgesetz 14.01.2026 (Eintragungsdatum)\n\nFirst Data Holding GmbH\nGesellschaft mit beschränkter Haftung\nBad Homburg v. d. Höhe\n\nDen Gläubigern der an der Verschmelzung beteiligten Rechtsträger ist, wenn sie binnen sechs Monaten nach dem Tag, an dem die Eintragung der Verschmelzung in das Register des Sitzes desjenigen Rechtsträgers, dessen Gläubiger sie sind, nach § 19 Absatz 3 UmwG bekannt gemacht worden ist, ihren Anspruch nach Grund und Höhe schriftlich anmelden, Sicherheit zu leisten, soweit sie nicht Befriedigung verlangen können. Dieses Recht steht den Gläubigern jedoch nur zu, wenn sie glaubhaft machen, dass durch die Verschmelzung die Erfüllung ihrer Forderung gefährdet wird."
    },
    {
      "date": "2026-01-14",
      "id": "142430",
      "original_text": "Registerbekanntmachung nach dem Umwandlungsgesetz\nHessen Amtsgericht Kassel HRB 20327\nPflegedienst Christina Kördel GmbH – Lohfelden",
      "type": "Registerbekanntmachung nach dem Umwandlungsgesetz",
      "state": "Hessen",
      "amtsgericht": "Amtsgericht Kassel",
      "registernummer": "HRB 20327",
      "registerart": "HRB",
      "company_name": "Pflegedienst Christina Kördel GmbH",
      "company_seat": "Lohfelden",
      "details": "14.01.2026 (Bekanntmachungsdatum)\n\nHessen Amtsgericht Kassel HRB 20327\nRegisterbekanntmachung nach dem Umwandlungsgesetz 14.01.2026 (Eintragungsdatum)\n\nPflegedienst Christina Kördel GmbH\nGesellschaft mit beschränkter Haftung\nLohfelden\n\nDen Gläubigern der an der Ausgliederung beteiligten Rechtsträger ist, wenn sie binnen sechs Monaten nach dem Tag, an dem die Eintragung der Ausgliederung in das Register des Sitzes desjenigen Rechtsträgers, dessen Gläubiger sie sind, nach §§ 125, 19 Absatz 3 UmwG bekannt gemacht worden ist, ihren Anspruch nach Grund und Höhe schriftlich anmelden, Sicherheit zu leisten, soweit sie nicht Befriedigung verlangen können. Dieses Recht steht den Gläubigern jedoch nur zu, wenn sie glaubhaft machen, dass durch die Ausgliederung die Erfüllung ihrer Forderung gefährdet wird."
    },
    {
      "date": "2026-01-14",
      "id": "142431",
      "original_text": "Einreichung neuer Dokumente\nHessen Amtsgericht Frankfurt am Main HRB 50879\nDB InfraGO Aktiengesellschaft – Frankfurt am Main",
      "type": "Einreichung neuer Dokumente",
      "state": "Hessen",
      "amtsgericht": "Amtsgericht Frankfurt am Main",
      "registernummer": "HRB 50879",
      "registerart": "HRB",
      "company_name": "DB InfraGO Aktiengesellschaft",
      "company_seat": "Frankfurt am Main",
      "details": "14.01.2026 (Bekanntmachungsdatum)\n\nHessen Amtsgericht Frankfurt am Main HRB 50879\nEinreichung neuer Dokumente\n\nDB InfraGO Aktiengesellschaft\nAktiengesellschaft\nFrankfurt am Main\n\nDurch eine Änderung in den Personen der Aufsichtsratsmitglieder ist eine Liste der Mitglieder des Aufsichtsrates zum Handelsregister eingereicht worden."
    },
    {
      "date": "2026-01-14",
      "id": "142432",
      "original_text": "Löschungsankündigung\nHessen Amtsgericht Frankfurt am Main HRB 85962\nSeide AVS Holding GmbH – Frankfurt am Main",
      "type": "Löschungsankündigung",
      "state": "Hessen",
      "amtsgericht": "Amtsgericht Frankfurt am Main",
      "registernummer": "HRB 85962",
      "registerart": "HRB",
      "company_name": "Seide AVS Holding GmbH",
      "company_seat": "Frankfurt am Main",
      "details": "14.01.2026 (Bekanntmachungsdatum)\n\nHessen Amtsgericht Frankfurt am Main HRB 85962\nLöschungsankündigung\n\nSeide AVS Holding GmbH\nGesellschaft mit beschränkter Haftung\nFrankfurt am Main\n\nDas Registergericht beabsichtigt die im Handelsregister eingetragene Gesellschaft von Amts wegen nach § 394 FamFG zu löschen. Die Frist zur Erhebung eines Widerspruchs gegen die beabsichtigte Löschung wird auf 1 Monate festgesetzt."
    },
    {
      "date": "2026-01-14",
      "id": "142433",
      "original_text": "Sonstige Registerbekanntmachung\nHessen Amtsgericht Wetzlar VR 4292\nDorfladenverein Erdbach e.V. – Breitscheid",
      "type": "Sonstige Registerbekanntmachung",
      "state": "Hessen",
      "amtsgericht": "Amtsgericht Wetzlar",
      "registernummer": "VR 4292",
      "registerart": "VR",
      "company_name": "Dorfladenverein Erdbach e.V.",
      "company_seat": "Breitscheid",
      "details": "14.01.2026 (Bekanntmachungsdatum)\n\nHessen Amtsgericht Wetzlar VR 4292\nSonstige Registerbekanntmachung 14.01.2026 (Eintragungsdatum)\n\nDorfladenverein Erdbach e.V.\neingetragener Verein\nBreitscheid\n\nDer Verein ist aufgelöst."
    },
    {
      "date": "2026-01-14",
      "id": "142434",
      "original_text": "Sonstige Registerbekanntmachung\nHessen Amtsgericht Wetzlar VR 3582\nImkerverein Eisemroth und Umgegend – Siegbach-Eisemroth",
      "type": "Sonstige Registerbekanntmachung",
      "state": "Hessen",
      "amtsgericht": "Amtsgericht Wetzlar",
      "registernummer": "VR 3582",
      "registerart": "VR",
      "company_name": "Imkerverein Eisemroth und Umgegend",
      "company_seat": "Siegbach-Eisemroth",
      "details": "14.01.2026 (Bekanntmachungsdatum)\n\nHessen Amtsgericht Wetzlar VR 3582\nSonstige Registerbekanntmachung 14.01.2026 (Eintragungsdatum)\n\nImkerverein Eisemroth und Umgegend\neingetragener Verein\nSiegbach-Eisemroth\n\nDer Verein ist aufgelöst."
    },
    {
      "date": "2026-01-14",
      "id": "142435",
      "original_text": "Sonstige Registerbekanntmachung\nHessen Amtsgericht Frankfurt am Main HRB 92990\nProCredit Bank AG – Frankfurt am Main",
      "type": "Sonstige Registerbekanntmachung",
      "state": "Hessen",
      "amtsgericht": "Amtsgericht Frankfurt am Main",
      "registernummer": "HRB 92990",
      "registerart": "HRB",
      "company_name": "ProCredit Bank AG",
      "company_seat": "Frankfurt am Main",
      "details": "14.01.2026 (Bekanntmachungsdatum)\n\nHessen Amtsgericht Frankfurt am Main HRB 92990\nSonstige Registerbekanntmachung\n\nProCredit Bank AG\nAktiengesellschaft\nFrankfurt am Main\n\nDer Vorstand der Gesellschaft wurde zur Ausgabe von Genussrechten ermächtigt. Die Einzelheiten der Ermächtigung ergeben sich aus dem Beschluss zu Tagesordnungspunkt III der außerordentlichen Hauptversammlung der Gesellschaft vom 5.12.2025."
    },
    {
      "date": "2026-01-14",
      "id": "142436",
      "original_text": "Sonstige Registerbekanntmachung\nHessen Amtsgericht Marburg HRB 4344\nKonvekta Aktiengesellschaft – Schwalmstadt",
      "type": "Sonstige Registerbekanntmachung",
      "state": "Hessen",
      "amtsgericht": "Amtsgericht Marburg",
      "registernummer": "HRB 4344",
      "registerart": "HRB",
      "company_name": "Konvekta Aktiengesellschaft",
      "company_seat": "Schwalmstadt",
      "details": "14.01.2026 (Bekanntmachungsdatum)\n\nHessen Amtsgericht Marburg HRB 4344\nSonstige Registerbekanntmachung\n\nKonvekta Aktiengesellschaft\nAktiengesellschaft\nSchwalmstadt\n\nDurch eine Änderung in den Personen der Aufsichtsratsmitglieder ist eine Liste der Mitglieder des Aufsichtsrates zum Handelsregister eingereicht worden."
    },
    {
      "date": "2026-01-14",
      "id": "142437",
      "original_text": "Löschungsankündigung\nHessen Amtsgericht Offenbach am Main HRB 48921\nRiMen Transport GmbH – Dreieich",
      "type": "Löschungsankündigung",
      "state": "Hessen",
      "amtsgericht": "Amtsgericht Offenbach am Main",
      "registernummer": "HRB 48921",
      "registerart": "HRB",
      "company_name": "RiMen Transport GmbH",
      "company_seat": "Dreieich",
      "details": "14.01.2026 (Bekanntmachungsdatum)\n\nHessen Amtsgericht Offenbach am Main HRB 48921\nLöschungsankündigung\n\nRiMen Transport GmbH\nGesellschaft mit beschränkter Haftung\nDreieich\n\nDas Registergericht beabsichtigt die im Handelsregister eingetragene Gesellschaft von Amts wegen nach § 394 FamFG zu löschen. Die Frist zur Erhebung eines Widerspruchs gegen die beabsichtigte Löschung wird auf 3 Monate festgesetzt."
    },
    {
      "date": "2026-01-14",
      "id": "142438",
      "original_text": "Löschungsankündigung\nHessen Amtsgericht Offenbach am Main HRB 46771\nItalia Mode GmbH – Dreieich",
      "type": "Löschungsankündigung",
      "state": "Hessen",
      "amtsgericht": "Amtsgericht Offenbach am Main",
      "registernummer": "HRB 46771",
      "registerart": "HRB",
      "company_name": "Italia Mode GmbH",
      "company_seat": "Dreieich",
      "details": "14.01.2026 (Bekanntmachungsdatum)\n\nHessen Amtsgericht Offenbach am Main HRB 46771\nLöschungsankündigung\n\nItalia Mode GmbH\nGesellschaft mit beschränkter Haftung\nDreieich\n\nDas Registergericht beabsichtigt die im Handelsregister eingetragene Gesellschaft von Amts wegen nach § 394 FamFG zu löschen. Die Frist zur Erhebung eines Widerspruchs gegen die beabsichtigte Löschung wird auf 3 Monate festgesetzt."
    },
    {
      "date": "2026-01-14",
      "id": "142439",
      "original_text": "Löschungsankündigung\nHessen Amtsgericht Hanau HRB 98367\nSE-BAU GmbH – Maintal",
      "type": "Löschungsankündigung",
      "state": "Hessen",
      "amtsgericht": "Amtsgericht Hanau",
      "registernummer": "HRB 98367",
      "registerart": "HRB",
      "company_name": "SE-BAU GmbH",
      "company_seat": "Maintal",
      "details": "14.01.2026 (Bekanntmachungsdatum)\n\nHessen Amtsgericht Hanau HRB 98367\nLöschungsankündigung\n\nSE-BAU GmbH\nGesellschaft mit beschränkter Haftung\nMaintal\n\nDas Registergericht beabsichtigt die im Handelsregister eingetragene Gesellschaft von Amts wegen nach § 394 FamFG zu löschen. Die Frist zur Erhebung eines Widerspruchs gegen die beabsichtigte Löschung wird auf 3 Monate festgesetzt."
    },
    {
      "date": "2026-01-14",
      "id": "142440",
      "original_text": "Registerbekanntmachung nach dem Umwandlungsgesetz\nHessen Amtsgericht Kassel HRA 18443\nChristina Kördel e.K. – Lohfelden",
      "type": "Registerbekanntmachung nach dem Umwandlungsgesetz",
      "state": "Hessen",
      "amtsgericht": "Amtsgericht Kassel",
      "registernummer": "HRA 18443",
      "registerart": "HRA",
      "company_name": "Christina Kördel e.K.",
      "company_seat": "Lohfelden",
      "details": "14.01.2026 (Bekanntmachungsdatum)\n\nHessen Amtsgericht Kassel HRA 18443\nRegisterbekanntmachung nach dem Umwandlungsgesetz 14.01.2026 (Eintragungsdatum)\n\nChristina Kördel e.K.\nEinzelkaufmann / Einzelkauffrau\nLohfelden\n\nDen Gläubigern der an der Ausgliederung beteiligten Rechtsträger ist, wenn sie binnen sechs Monaten nach dem Tag, an dem die Eintragung der Ausgliederung in das Register des Sitzes desjenigen Rechtsträgers, dessen Gläubiger sie sind, nach §§ 125, 19 Absatz 3 UmwG bekannt gemacht worden ist, ihren Anspruch nach Grund und Höhe schriftlich anmelden, Sicherheit zu leisten, soweit sie nicht Befriedigung verlangen können. Dieses Recht steht den Gläubigern jedoch nur zu, wenn sie glaubhaft machen, dass durch die Ausgliederung die Erfüllung ihrer Forderung gefährdet wird."
    },
    {
      "date": "2026-01-14",
      "id": "142441",
      "original_text": "Sonstige Registerbekanntmachung\nHessen Amtsgericht Hanau HRB 4689\nHoneywell Regelsysteme GmbH – Maintal",
      "type": "Sonstige Registerbekanntmachung",
      "state": "Hessen",
      "amtsgericht": "Amtsgericht Hanau",
      "registernummer": "HRB 4689",
      "registerart": "HRB",
      "company_name": "Honeywell Regelsysteme GmbH",
      "company_seat": "Maintal",
      "details": "14.01.2026 (Bekanntmachungsdatum)\n\nHessen Amtsgericht Hanau HRB 4689\nSonstige Registerbekanntmachung 14.01.2026 (Eintragungsdatum)\n\nHoneywell Regelsysteme GmbH\nGesellschaft mit beschränkter Haftung\nMaintal\n\nDen Gläubigern der Gesellschaft, deren Forderungen begründet worden sind, bevor die Eintragung der Beendigung des Vertrags in das Handelsregister nach § 10 HGB bekannt gemacht worden ist, ist vom anderen Vertragsteil Sicherheit zu leisten, wenn sie sich binnen sechs Monaten nach dieser Bekanntmachung zu diesem Zweck bei ihm melden."
    },
    {
      "date": "2026-01-14",
      "id": "142442",
      "original_text": "Registerbekanntmachung nach dem Umwandlungsgesetz\nHessen Amtsgericht Offenbach am Main HRB 8119\nAirPlus International GmbH – Neu-Isenburg",
      "type": "Registerbekanntmachung nach dem Umwandlungsgesetz",
      "state": "Hessen",
      "amtsgericht": "Amtsgericht Offenbach am Main",
      "registernummer": "HRB 8119",
      "registerart": "HRB",
      "company_name": "AirPlus International GmbH",
      "company_seat": "Neu-Isenburg",
      "details": "14.01.2026 (Bekanntmachungsdatum)\n\nHessen Amtsgericht Offenbach am Main HRB 8119\nRegisterbekanntmachung nach dem Umwandlungsgesetz 14.01.2026 (Eintragungsdatum)\n\nAirPlus International GmbH\nGesellschaft mit beschränkter Haftung\nNeu-Isenburg\n\nDen Gläubigern der an der Verschmelzung beteiligten Rechtsträger ist, wenn sie binnen sechs Monaten nach dem Tag, an dem die Eintragung der Verschmelzung in das Register des Sitzes desjenigen Rechtsträgers, dessen Gläubiger sie sind, nach §§ 305 Absatz 2, 19 Absatz 3 UmwG bekannt gemacht worden ist, ihren Anspruch nach Grund und Höhe schriftlich anmelden, Sicherheit zu leisten, soweit sie nicht Befriedigung verlangen können. Dieses Recht steht den Gläubigern jedoch nur zu, wenn sie glaubhaft machen, dass durch die Verschmelzung die Erfüllung ihrer Forderung gefährdet wird."
    }
  ]
}