{
  "date": "2026-01-09",
  "date_of_scrape": "2026-01-10T04:17:18.198Z",
  "tool_version": "0.2.0",
  "number_of_announcements": 124,
  "announcements": [
    {
      "date": "2026-01-09",
      "id": "141917",
      "original_text": "Registerbekanntmachung nach dem Umwandlungsgesetz\nBayern Amtsgericht Nürnberg HRA 20428\nPRIMUS Fremdsprachen GmbH & Co. KG – Nürnberg",
      "type": "Registerbekanntmachung nach dem Umwandlungsgesetz",
      "state": "Bayern",
      "amtsgericht": "Amtsgericht Nürnberg",
      "registernummer": "HRA 20428",
      "registerart": "HRA",
      "company_name": "PRIMUS Fremdsprachen GmbH & Co. KG",
      "company_seat": "Nürnberg",
      "details": "09.01.2026 (Bekanntmachungsdatum)\n\nBayern Amtsgericht Nürnberg HRA 20428\nRegisterbekanntmachung nach dem Umwandlungsgesetz 08.01.2026 (Eintragungsdatum)\n\nPRIMUS Fremdsprachen GmbH & Co. KG\nKommanditgesellschaft\nNürnberg\n\nDen Gläubigern der an der Ausgliederung beteiligten Rechtsträger ist, wenn sie binnen sechs Monaten nach dem Tag, an dem die Eintragung der Ausgliederung in das Register des Sitzes desjenigen Rechtsträgers, dessen Gläubiger sie sind, nach §§ 125, 19 Abs. 3 UmwG als bekannt gemacht gilt, ihren Anspruch nach Grund und Höhe in Textform anmelden, Sicherheit zu leisten, soweit sie nicht Befriedigung verlangen können. Dieses Recht steht den Gläubigern jedoch nur zu, wenn sie glaubhaft machen, dass durch die Ausgliederung die Erfüllung ihrer Forderung gefährdet wird."
    },
    {
      "date": "2026-01-09",
      "id": "141918",
      "original_text": "Sonstige Registerbekanntmachung\nBayern Amtsgericht München HRB 245683\nQUISS Qualitäts-Inspektionssysteme und Service GmbH – Puchheim",
      "type": "Sonstige Registerbekanntmachung",
      "state": "Bayern",
      "amtsgericht": "Amtsgericht München",
      "registernummer": "HRB 245683",
      "registerart": "HRB",
      "company_name": "QUISS Qualitäts-Inspektionssysteme und Service GmbH",
      "company_seat": "Puchheim",
      "details": "09.01.2026 (Bekanntmachungsdatum)\n\nBayern Amtsgericht München HRB 245683\nSonstige Registerbekanntmachung 08.01.2026 (Eintragungsdatum)\n\nQUISS Qualitäts-Inspektionssysteme und Service GmbH\nGesellschaft mit beschränkter Haftung\nPuchheim\n\nDen Gläubigern der Gesellschaft, deren Forderungen begründet worden sind, bevor die Eintragung der Beendigung des Gewinnabführungsvertrages in das Handelsregister nach § 10 des Handelsgesetzbuches als bekanntgemacht gilt, hat der andere Vertragsteil Sicherheit zu leisten, wenn sie sich binnen sechs Monaten nach der Bekanntmachung der Eintragung zu diesem Zweck bei ihm melden."
    },
    {
      "date": "2026-01-09",
      "id": "141919",
      "original_text": "Registerbekanntmachung nach dem Umwandlungsgesetz\nBayern Amtsgericht Landshut HRA 12985\nStadtwerke Eggenfelden Anstalt des öffentlichen Rechts der Stadt Eggenfelden – Eggenfelden",
      "type": "Registerbekanntmachung nach dem Umwandlungsgesetz",
      "state": "Bayern",
      "amtsgericht": "Amtsgericht Landshut",
      "registernummer": "HRA 12985",
      "registerart": "HRA",
      "company_name": "Stadtwerke Eggenfelden Anstalt des öffentlichen Rechts der Stadt Eggenfelden",
      "company_seat": "Eggenfelden",
      "details": "09.01.2026 (Bekanntmachungsdatum)\n\nBayern Amtsgericht Landshut HRA 12985\nRegisterbekanntmachung nach dem Umwandlungsgesetz 08.01.2026 (Eintragungsdatum)\n\nStadtwerke Eggenfelden Anstalt des öffentlichen Rechts der Stadt Eggenfelden\nSonstige juristische Person\nEggenfelden\n\nDen Gläubigern des formwechselnden Rechtsträgers ist, wenn sie binnen sechs Monaten nach dem Tag, an dem die Eintragung des Formwechsels nach § 201 UmwG als bekannt gemacht gilt, ihren Anspruch nach Grund und Höhe in Textform anmelden, Sicherheit zu leisten, soweit sie nicht Befriedigung verlangen können. Dieses Recht steht den Gläubigern jedoch nur zu, wenn sie glaubhaft machen, dass durch den Formwechsel die Erfüllung ihrer Forderung gefährdet wird."
    },
    {
      "date": "2026-01-09",
      "id": "141920",
      "original_text": "Registerbekanntmachung nach dem Umwandlungsgesetz\nBayern Amtsgericht München HRB 181332\nFMK Beteiligungs GmbH – Grünwald",
      "type": "Registerbekanntmachung nach dem Umwandlungsgesetz",
      "state": "Bayern",
      "amtsgericht": "Amtsgericht München",
      "registernummer": "HRB 181332",
      "registerart": "HRB",
      "company_name": "FMK Beteiligungs GmbH",
      "company_seat": "Grünwald",
      "details": "09.01.2026 (Bekanntmachungsdatum)\n\nBayern Amtsgericht München HRB 181332\nRegisterbekanntmachung nach dem Umwandlungsgesetz 08.01.2026 (Eintragungsdatum)\n\nFMK Beteiligungs GmbH\nGesellschaft mit beschränkter Haftung\nGrünwald\n\nDen Gläubigern der an der Spaltung beteiligten Rechtsträger ist, wenn sie binnen sechs Monaten nach dem Tag, an dem die Eintragung der Spaltung in das Register des Sitzes desjenigen Rechtsträgers, dessen Gläubiger sie sind, nach §§ 125, 19 Abs. 3 UmwG als bekannt gemacht gilt, ihren Anspruch nach Grund und Höhe in Textform anmelden, Sicherheit zu leisten, soweit sie nicht Befriedigung verlangen können. Dieses Recht steht den Gläubigern jedoch nur zu, wenn sie glaubhaft machen, dass durch die Spaltung die Erfüllung ihrer Forderung gefährdet wird."
    },
    {
      "date": "2026-01-09",
      "id": "141921",
      "original_text": "Löschungsankündigung\nBayern Amtsgericht Nürnberg HRB 17589\nSchweigert AMV GmbH – Pilsach, Ortsteil Laaber",
      "type": "Löschungsankündigung",
      "state": "Bayern",
      "amtsgericht": "Amtsgericht Nürnberg",
      "registernummer": "HRB 17589",
      "registerart": "HRB",
      "company_name": "Schweigert AMV GmbH",
      "company_seat": "Pilsach, Ortsteil Laaber",
      "details": "09.01.2026 (Bekanntmachungsdatum)\n\nBayern Amtsgericht Nürnberg HRB 17589\nLöschungsankündigung\n\nSchweigert AMV GmbH\nGesellschaft mit beschränkter Haftung\nPilsach, Ortsteil Laaber\n\nDas Registergericht beabsichtigt, die im Handelsregister eingetragene Gesellschaft wegen Vermögenslosigkeit von Amts wegen nach § 394 FamFG zu löschen. Die Frist zur Erhebung eines Widerspruchs ist auf einen Monat festgesetzt."
    },
    {
      "date": "2026-01-09",
      "id": "141922",
      "original_text": "Registerbekanntmachung nach dem Umwandlungsgesetz\nBayern Amtsgericht München HRA 112755\nWN Immobilien GmbH & Co. KG – München",
      "type": "Registerbekanntmachung nach dem Umwandlungsgesetz",
      "state": "Bayern",
      "amtsgericht": "Amtsgericht München",
      "registernummer": "HRA 112755",
      "registerart": "HRA",
      "company_name": "WN Immobilien GmbH & Co. KG",
      "company_seat": "München",
      "details": "09.01.2026 (Bekanntmachungsdatum)\n\nBayern Amtsgericht München HRA 112755\nRegisterbekanntmachung nach dem Umwandlungsgesetz 07.01.2026 (Eintragungsdatum)\n\nWN Immobilien GmbH & Co. KG\nKommanditgesellschaft\nMünchen\n\nDen Gläubigern des formwechselnden Rechtsträgers ist, wenn sie binnen sechs Monaten nach dem Tag, an dem die Eintragung des Formwechsels nach § 201 UmwG als bekannt gemacht gilt, ihren Anspruch nach Grund und Höhe in Textform anmelden, Sicherheit zu leisten, soweit sie nicht Befriedigung verlangen können. Dieses Recht steht den Gläubigern jedoch nur zu, wenn sie glaubhaft machen, dass durch den Formwechsel die Erfüllung ihrer Forderung gefährdet wird."
    },
    {
      "date": "2026-01-09",
      "id": "141923",
      "original_text": "Registerbekanntmachung nach dem Umwandlungsgesetz\nBayern Amtsgericht Traunstein HRB 20619\nHörzentro GmbH – Rosenheim",
      "type": "Registerbekanntmachung nach dem Umwandlungsgesetz",
      "state": "Bayern",
      "amtsgericht": "Amtsgericht Traunstein",
      "registernummer": "HRB 20619",
      "registerart": "HRB",
      "company_name": "Hörzentro GmbH",
      "company_seat": "Rosenheim",
      "details": "09.01.2026 (Bekanntmachungsdatum)\n\nBayern Amtsgericht Traunstein HRB 20619\nRegisterbekanntmachung nach dem Umwandlungsgesetz 08.01.2026 (Eintragungsdatum)\n\nHörzentro GmbH\nGesellschaft mit beschränkter Haftung\nRosenheim\n\nDen Gläubigern der an der Verschmelzung beteiligten Rechtsträger ist, wenn sie binnen sechs Monaten nach dem Tag, an dem die Eintragung der Verschmelzung in das Register des Sitzes desjenigen Rechtsträgers, dessen Gläubiger sie sind, nach § 19 Abs. 3 UmwG als bekannt gemacht gilt, ihren Anspruch nach Grund und Höhe in Textform anmelden, Sicherheit zu leisten, soweit sie nicht Befriedigung verlangen können. Dieses Recht steht den Gläubigern jedoch nur zu, wenn sie glaubhaft machen, dass durch die Verschmelzung die Erfüllung ihrer Forderung gefährdet wird."
    },
    {
      "date": "2026-01-09",
      "id": "141924",
      "original_text": "Sonstige Registerbekanntmachung\nBayern Amtsgericht München HRB 192735\nTÜV SÜD Advimo GmbH – München",
      "type": "Sonstige Registerbekanntmachung",
      "state": "Bayern",
      "amtsgericht": "Amtsgericht München",
      "registernummer": "HRB 192735",
      "registerart": "HRB",
      "company_name": "TÜV SÜD Advimo GmbH",
      "company_seat": "München",
      "details": "09.01.2026 (Bekanntmachungsdatum)\n\nBayern Amtsgericht München HRB 192735\nSonstige Registerbekanntmachung 08.01.2026 (Eintragungsdatum)\n\nTÜV SÜD Advimo GmbH\nGesellschaft mit beschränkter Haftung\nMünchen\n\nDen Gläubigern der Gesellschaft, deren Forderungen begründet worden sind, bevor die Eintragung der Beendigung des Beherrschungs- und Gewinnabführungsvertrages in das Handelsregister nach § 10 des Handelsgesetzbuches als bekanntgemacht gilt, hat der andere Vertragsteil Sicherheit zu leisten, wenn sie sich binnen sechs Monaten nach der Bekanntmachung der Eintragung zu diesem Zweck bei ihm melden."
    },
    {
      "date": "2026-01-09",
      "id": "141925",
      "original_text": "Sonstige Registerbekanntmachung\nBayern Amtsgericht Bayreuth HRB 583\nErich Ziegler GmbH – Aufseß",
      "type": "Sonstige Registerbekanntmachung",
      "state": "Bayern",
      "amtsgericht": "Amtsgericht Bayreuth",
      "registernummer": "HRB 583",
      "registerart": "HRB",
      "company_name": "Erich Ziegler GmbH",
      "company_seat": "Aufseß",
      "details": "09.01.2026 (Bekanntmachungsdatum)\n\nBayern Amtsgericht Bayreuth HRB 583\nSonstige Registerbekanntmachung 08.01.2026 (Eintragungsdatum)\n\nErich Ziegler GmbH\nGesellschaft mit beschränkter Haftung\nAufseß\n\nDen Gläubigern der Gesellschaft, deren Forderungen begründet worden sind, bevor die Eintragung der Beendigung des Beherrschungs- und Gewinnabführungsvertrages in das Handelsregister nach § 10 des Handelsgesetzbuches als bekanntgemacht gilt, hat der andere Vertragsteil Sicherheit zu leisten, wenn sie sich binnen sechs Monaten nach der Bekanntmachung der Eintragung zu diesem Zweck bei ihm melden."
    },
    {
      "date": "2026-01-09",
      "id": "141926",
      "original_text": "Registerbekanntmachung nach dem Umwandlungsgesetz\nBayern Amtsgericht Landshut HRB 5133\nStadtwerke Eggenfelden GmbH – Eggenfelden",
      "type": "Registerbekanntmachung nach dem Umwandlungsgesetz",
      "state": "Bayern",
      "amtsgericht": "Amtsgericht Landshut",
      "registernummer": "HRB 5133",
      "registerart": "HRB",
      "company_name": "Stadtwerke Eggenfelden GmbH",
      "company_seat": "Eggenfelden",
      "details": "09.01.2026 (Bekanntmachungsdatum)\n\nBayern Amtsgericht Landshut HRB 5133\nRegisterbekanntmachung nach dem Umwandlungsgesetz 08.01.2026 (Eintragungsdatum)\n\nStadtwerke Eggenfelden GmbH\nGesellschaft mit beschränkter Haftung\nEggenfelden\n\nDen Gläubigern des formwechselnden Rechtsträgers ist, wenn sie binnen sechs Monaten nach dem Tag, an dem die Eintragung des Formwechsels nach § 201 UmwG als bekannt gemacht gilt, ihren Anspruch nach Grund und Höhe in Textform anmelden, Sicherheit zu leisten, soweit sie nicht Befriedigung verlangen können. Dieses Recht steht den Gläubigern jedoch nur zu, wenn sie glaubhaft machen, dass durch den Formwechsel die Erfüllung ihrer Forderung gefährdet wird."
    },
    {
      "date": "2026-01-09",
      "id": "141927",
      "original_text": "Einreichung neuer Dokumente\nBayern Amtsgericht Würzburg HRB 75\nWürzburger Straßenbahn Gesellschaft mit beschränkter Haftung – Würzburg",
      "type": "Einreichung neuer Dokumente",
      "state": "Bayern",
      "amtsgericht": "Amtsgericht Würzburg",
      "registernummer": "HRB 75",
      "registerart": "HRB",
      "company_name": "Würzburger Straßenbahn Gesellschaft mit beschränkter Haftung",
      "company_seat": "Würzburg",
      "details": "09.01.2026 (Bekanntmachungsdatum)\n\nBayern Amtsgericht Würzburg HRB 75\nEinreichung neuer Dokumente\n\nWürzburger Straßenbahn Gesellschaft mit beschränkter Haftung\nGesellschaft mit beschränkter Haftung\nWürzburg\n\nDem Amtsgericht Würzburg -Registergericht- ist eine Liste der Mitglieder des Aufsichtsrats eingereicht worden, § 52 Abs. 3 S. 2 GmbHG."
    },
    {
      "date": "2026-01-09",
      "id": "141928",
      "original_text": "Registerbekanntmachung nach dem Umwandlungsgesetz\nBayern Amtsgericht München HRA 120920\nSchreinerei Bettina Reichenberger e.K. – Aying",
      "type": "Registerbekanntmachung nach dem Umwandlungsgesetz",
      "state": "Bayern",
      "amtsgericht": "Amtsgericht München",
      "registernummer": "HRA 120920",
      "registerart": "HRA",
      "company_name": "Schreinerei Bettina Reichenberger e.K.",
      "company_seat": "Aying",
      "details": "09.01.2026 (Bekanntmachungsdatum)\n\nBayern Amtsgericht München HRA 120920\nRegisterbekanntmachung nach dem Umwandlungsgesetz 08.01.2026 (Eintragungsdatum)\n\nSchreinerei Bettina Reichenberger e.K.\nEinzelkaufmann / Einzelkauffrau\nAying\n\nDen Gläubigern der an der Ausgliederung beteiligten Rechtsträger ist, wenn sie binnen sechs Monaten nach dem Tag, an dem die Eintragung der Ausgliederung in das Register des Sitzes desjenigen Rechtsträgers, dessen Gläubiger sie sind, nach §§ 125, 19 Abs. 3 UmwG als bekannt gemacht gilt, ihren Anspruch nach Grund und Höhe in Textform anmelden, Sicherheit zu leisten, soweit sie nicht Befriedigung verlangen können. Dieses Recht steht den Gläubigern jedoch nur zu, wenn sie glaubhaft machen, dass durch die Ausgliederung die Erfüllung ihrer Forderung gefährdet wird."
    },
    {
      "date": "2026-01-09",
      "id": "141929",
      "original_text": "Sonstige Registerbekanntmachung\nBayern Amtsgericht München HRB 145766\nAB Cube Germany GmbH – München",
      "type": "Sonstige Registerbekanntmachung",
      "state": "Bayern",
      "amtsgericht": "Amtsgericht München",
      "registernummer": "HRB 145766",
      "registerart": "HRB",
      "company_name": "AB Cube Germany GmbH",
      "company_seat": "München",
      "details": "09.01.2026 (Bekanntmachungsdatum)\n\nBayern Amtsgericht München HRB 145766\nSonstige Registerbekanntmachung 08.01.2026 (Eintragungsdatum)\n\nAB Cube Germany GmbH\nGesellschaft mit beschränkter Haftung\nMünchen\n\nDen Gläubigern der Gesellschaft, deren Forderungen begründet worden sind, bevor die Eintragung der Beendigung des Beherrschungs- und Gewinnabführungsvertrages in das Handelsregister nach § 10 des Handelsgesetzbuches als bekanntgemacht gilt, hat der andere Vertragsteil Sicherheit zu leisten, wenn sie sich binnen sechs Monaten nach der Bekanntmachung der Eintragung zu diesem Zweck bei ihm melden."
    },
    {
      "date": "2026-01-09",
      "id": "141930",
      "original_text": "Sonstige Registerbekanntmachung\nBayern Amtsgericht Schweinfurt HRB 8344\nDemez Trade GmbH – Donnersdorf",
      "type": "Sonstige Registerbekanntmachung",
      "state": "Bayern",
      "amtsgericht": "Amtsgericht Schweinfurt",
      "registernummer": "HRB 8344",
      "registerart": "HRB",
      "company_name": "Demez Trade GmbH",
      "company_seat": "Donnersdorf",
      "details": "09.01.2026 (Bekanntmachungsdatum)\n\nBayern Amtsgericht Schweinfurt HRB 8344\nSonstige Registerbekanntmachung 08.01.2026 (Eintragungsdatum)\n\nDemez Trade GmbH\nGesellschaft mit beschränkter Haftung\nDonnersdorf\n\nDen Gläubigern der Gesellschaft, deren Forderungen begründet worden sind, bevor die Eintragung der Beendigung des Beherrschungs- und Gewinnabführungsvertrages in das Handelsregister nach § 10 des Handelsgesetzbuches als bekanntgemacht gilt, hat der andere Vertragsteil Sicherheit zu leisten, wenn sie sich binnen sechs Monaten nach der Bekanntmachung der Eintragung zu diesem Zweck bei ihm melden."
    },
    {
      "date": "2026-01-09",
      "id": "141931",
      "original_text": "Registerbekanntmachung nach dem Umwandlungsgesetz\nBayern Amtsgericht Nürnberg HRB 29274\nComplete Aircraft Services GmbH by Siegbert Rauch – Schnaittach",
      "type": "Registerbekanntmachung nach dem Umwandlungsgesetz",
      "state": "Bayern",
      "amtsgericht": "Amtsgericht Nürnberg",
      "registernummer": "HRB 29274",
      "registerart": "HRB",
      "company_name": "Complete Aircraft Services GmbH by Siegbert Rauch",
      "company_seat": "Schnaittach",
      "details": "09.01.2026 (Bekanntmachungsdatum)\n\nBayern Amtsgericht Nürnberg HRB 29274\nRegisterbekanntmachung nach dem Umwandlungsgesetz 08.01.2026 (Eintragungsdatum)\n\nComplete Aircraft Services GmbH by Siegbert Rauch\nGesellschaft mit beschränkter Haftung\nSchnaittach\n\nDen Gläubigern der an der Verschmelzung beteiligten Rechtsträger ist, wenn sie binnen sechs Monaten nach dem Tag, an dem die Eintragung der Verschmelzung in das Register des Sitzes desjenigen Rechtsträgers, dessen Gläubiger sie sind, nach § 19 Abs. 3 UmwG als bekannt gemacht gilt, ihren Anspruch nach Grund und Höhe in Textform anmelden, Sicherheit zu leisten, soweit sie nicht Befriedigung verlangen können. Dieses Recht steht den Gläubigern jedoch nur zu, wenn sie glaubhaft machen, dass durch die Verschmelzung die Erfüllung ihrer Forderung gefährdet wird."
    },
    {
      "date": "2026-01-09",
      "id": "141932",
      "original_text": "Einreichung neuer Dokumente\nBayern Amtsgericht Fürth HRB 9089\nMedical Valley Center GmbH – Erlangen",
      "type": "Einreichung neuer Dokumente",
      "state": "Bayern",
      "amtsgericht": "Amtsgericht Fürth",
      "registernummer": "HRB 9089",
      "registerart": "HRB",
      "company_name": "Medical Valley Center GmbH",
      "company_seat": "Erlangen",
      "details": "09.01.2026 (Bekanntmachungsdatum)\n\nBayern Amtsgericht Fürth HRB 9089\nEinreichung neuer Dokumente\n\nMedical Valley Center GmbH\nGesellschaft mit beschränkter Haftung\nErlangen\n\nDem Amtsgericht Fürth -Registergericht- ist eine Liste der Mitglieder des Aufsichtsrats eingereicht worden, § 52 Abs. 3 S. 2 GmbHG."
    },
    {
      "date": "2026-01-09",
      "id": "141933",
      "original_text": "Registerbekanntmachung nach dem Umwandlungsgesetz\nBayern Amtsgericht Nürnberg HRA 13984\nPRIMUS Fremdsprachen e. K. – Nürnberg",
      "type": "Registerbekanntmachung nach dem Umwandlungsgesetz",
      "state": "Bayern",
      "amtsgericht": "Amtsgericht Nürnberg",
      "registernummer": "HRA 13984",
      "registerart": "HRA",
      "company_name": "PRIMUS Fremdsprachen e. K.",
      "company_seat": "Nürnberg",
      "details": "09.01.2026 (Bekanntmachungsdatum)\n\nBayern Amtsgericht Nürnberg HRA 13984\nRegisterbekanntmachung nach dem Umwandlungsgesetz 08.01.2026 (Eintragungsdatum)\n\nPRIMUS Fremdsprachen e. K.\nEinzelkaufmann / Einzelkauffrau\nNürnberg\n\nDen Gläubigern der an der Ausgliederung beteiligten Rechtsträger ist, wenn sie binnen sechs Monaten nach dem Tag, an dem die Eintragung der Ausgliederung in das Register des Sitzes desjenigen Rechtsträgers, dessen Gläubiger sie sind, nach §§ 125, 19 Abs. 3 UmwG als bekannt gemacht gilt, ihren Anspruch nach Grund und Höhe in Textform anmelden, Sicherheit zu leisten, soweit sie nicht Befriedigung verlangen können. Dieses Recht steht den Gläubigern jedoch nur zu, wenn sie glaubhaft machen, dass durch die Ausgliederung die Erfüllung ihrer Forderung gefährdet wird."
    },
    {
      "date": "2026-01-09",
      "id": "141934",
      "original_text": "Registerbekanntmachung nach dem Umwandlungsgesetz\nBayern Amtsgericht München HRA 120694\nSchreinerei Reichenberger GmbH & Co. KG – Aying",
      "type": "Registerbekanntmachung nach dem Umwandlungsgesetz",
      "state": "Bayern",
      "amtsgericht": "Amtsgericht München",
      "registernummer": "HRA 120694",
      "registerart": "HRA",
      "company_name": "Schreinerei Reichenberger GmbH & Co. KG",
      "company_seat": "Aying",
      "details": "09.01.2026 (Bekanntmachungsdatum)\n\nBayern Amtsgericht München HRA 120694\nRegisterbekanntmachung nach dem Umwandlungsgesetz 08.01.2026 (Eintragungsdatum)\n\nSchreinerei Reichenberger GmbH & Co. KG\nKommanditgesellschaft\nAying\n\nDen Gläubigern der an der Ausgliederung beteiligten Rechtsträger ist, wenn sie binnen sechs Monaten nach dem Tag, an dem die Eintragung der Ausgliederung in das Register des Sitzes desjenigen Rechtsträgers, dessen Gläubiger sie sind, nach §§ 125, 19 Abs. 3 UmwG als bekannt gemacht gilt, ihren Anspruch nach Grund und Höhe in Textform anmelden, Sicherheit zu leisten, soweit sie nicht Befriedigung verlangen können. Dieses Recht steht den Gläubigern jedoch nur zu, wenn sie glaubhaft machen, dass durch die Ausgliederung die Erfüllung ihrer Forderung gefährdet wird."
    },
    {
      "date": "2026-01-09",
      "id": "141935",
      "original_text": "Sonstige Registerbekanntmachung\nBayern Amtsgericht Bayreuth HRB 376\nsuprima GmbH – Bad Berneck",
      "type": "Sonstige Registerbekanntmachung",
      "state": "Bayern",
      "amtsgericht": "Amtsgericht Bayreuth",
      "registernummer": "HRB 376",
      "registerart": "HRB",
      "company_name": "suprima GmbH",
      "company_seat": "Bad Berneck",
      "details": "09.01.2026 (Bekanntmachungsdatum)\n\nBayern Amtsgericht Bayreuth HRB 376\nSonstige Registerbekanntmachung 08.01.2026 (Eintragungsdatum)\n\nsuprima GmbH\nGesellschaft mit beschränkter Haftung\nBad Berneck\n\nDen Gläubigern der Gesellschaft, deren Forderungen begründet worden sind, bevor die Eintragung der Beendigung des Beherrschungs- und Ergebnisabführungsvertrages in das Handelsregister nach § 10 des Handelsgesetzbuches als bekanntgemacht gilt, hat der andere Vertragsteil Sicherheit zu leisten, wenn sie sich binnen sechs Monaten nach der Bekanntmachung der Eintragung zu diesem Zweck bei ihm melden."
    },
    {
      "date": "2026-01-09",
      "id": "141936",
      "original_text": "Registerbekanntmachung nach dem Umwandlungsgesetz\nBayern Amtsgericht München HRB 276385\nZenKenKan UG (haftungsbeschränkt) – München",
      "type": "Registerbekanntmachung nach dem Umwandlungsgesetz",
      "state": "Bayern",
      "amtsgericht": "Amtsgericht München",
      "registernummer": "HRB 276385",
      "registerart": "HRB",
      "company_name": "ZenKenKan UG (haftungsbeschränkt)",
      "company_seat": "München",
      "details": "09.01.2026 (Bekanntmachungsdatum)\n\nBayern Amtsgericht München HRB 276385\nRegisterbekanntmachung nach dem Umwandlungsgesetz 08.01.2026 (Eintragungsdatum)\n\nZenKenKan UG (haftungsbeschränkt)\nGesellschaft mit beschränkter Haftung\nMünchen\n\nDen Gläubigern der an der Verschmelzung beteiligten Rechtsträger ist, wenn sie binnen sechs Monaten nach dem Tag, an dem die Eintragung der Verschmelzung in das Register des Sitzes desjenigen Rechtsträgers, dessen Gläubiger sie sind, nach § 19 Abs. 3 UmwG als bekannt gemacht gilt, ihren Anspruch nach Grund und Höhe in Textform anmelden, Sicherheit zu leisten, soweit sie nicht Befriedigung verlangen können. Dieses Recht steht den Gläubigern jedoch nur zu, wenn sie glaubhaft machen, dass durch die Verschmelzung die Erfüllung ihrer Forderung gefährdet wird."
    },
    {
      "date": "2026-01-09",
      "id": "141937",
      "original_text": "Sonstige Registerbekanntmachung\nBayern Amtsgericht Augsburg HRB 13377\nGremco GmbH – Augsburg",
      "type": "Sonstige Registerbekanntmachung",
      "state": "Bayern",
      "amtsgericht": "Amtsgericht Augsburg",
      "registernummer": "HRB 13377",
      "registerart": "HRB",
      "company_name": "Gremco GmbH",
      "company_seat": "Augsburg",
      "details": "09.01.2026 (Bekanntmachungsdatum)\n\nBayern Amtsgericht Augsburg HRB 13377\nSonstige Registerbekanntmachung 08.01.2026 (Eintragungsdatum)\n\nGremco GmbH\nGesellschaft mit beschränkter Haftung\nAugsburg\n\nDen Gläubigern der Gesellschaft, deren Forderungen begründet worden sind, bevor die Eintragung der Beendigung des Gewinnabführungsvertrages in das Handelsregister nach § 10 des Handelsgesetzbuches als bekanntgemacht gilt, hat der andere Vertragsteil Sicherheit zu leisten, wenn sie sich binnen sechs Monaten nach der Bekanntmachung der Eintragung zu diesem Zweck bei ihm melden."
    },
    {
      "date": "2026-01-09",
      "id": "141938",
      "original_text": "Löschungsankündigung\nBayern Amtsgericht München HRB 239568\nMimmo e Co. Bar Giornaliero GmbH – München",
      "type": "Löschungsankündigung",
      "state": "Bayern",
      "amtsgericht": "Amtsgericht München",
      "registernummer": "HRB 239568",
      "registerart": "HRB",
      "company_name": "Mimmo e Co. Bar Giornaliero GmbH",
      "company_seat": "München",
      "details": "09.01.2026 (Bekanntmachungsdatum)\n\nBayern Amtsgericht München HRB 239568\nLöschungsankündigung\n\nMimmo e Co. Bar Giornaliero GmbH\nGesellschaft mit beschränkter Haftung\nMünchen\n\nDas Registergericht beabsichtigt, die im Handelsregister eingetragene Gesellschaft wegen Vermögenslosigkeit von Amts wegen nach § 394 FamFG zu löschen. Die Frist zur Erhebung eines Widerspruchs ist auf drei Monate festgesetzt."
    },
    {
      "date": "2026-01-09",
      "id": "141939",
      "original_text": "Löschungsankündigung\nBayern Amtsgericht Traunstein HRB 29758\nWerkHouse GmbH – Stephanskirchen",
      "type": "Löschungsankündigung",
      "state": "Bayern",
      "amtsgericht": "Amtsgericht Traunstein",
      "registernummer": "HRB 29758",
      "registerart": "HRB",
      "company_name": "WerkHouse GmbH",
      "company_seat": "Stephanskirchen",
      "details": "09.01.2026 (Bekanntmachungsdatum)\n\nBayern Amtsgericht Traunstein HRB 29758\nLöschungsankündigung\n\nWerkHouse GmbH\nGesellschaft mit beschränkter Haftung\nStephanskirchen\n\nDas Registergericht beabsichtigt, die im Handelsregister eingetragene Gesellschaft wegen Vermögenslosigkeit von Amts wegen nach § 394 FamFG zu löschen. Die Frist zur Erhebung eines Widerspruchs ist auf einen Monat festgesetzt."
    },
    {
      "date": "2026-01-09",
      "id": "141940",
      "original_text": "Registerbekanntmachung nach dem Umwandlungsgesetz\nBayern Amtsgericht Nürnberg HRB 45437\nBoutique Madame Maison GmbH – Nürnberg",
      "type": "Registerbekanntmachung nach dem Umwandlungsgesetz",
      "state": "Bayern",
      "amtsgericht": "Amtsgericht Nürnberg",
      "registernummer": "HRB 45437",
      "registerart": "HRB",
      "company_name": "Boutique Madame Maison GmbH",
      "company_seat": "Nürnberg",
      "details": "09.01.2026 (Bekanntmachungsdatum)\n\nBayern Amtsgericht Nürnberg HRB 45437\nRegisterbekanntmachung nach dem Umwandlungsgesetz 08.01.2026 (Eintragungsdatum)\n\nBoutique Madame Maison GmbH\nGesellschaft mit beschränkter Haftung\nNürnberg\n\nDen Gläubigern des formwechselnden Rechtsträgers ist, wenn sie binnen sechs Monaten nach dem Tag, an dem die Eintragung des Formwechsels nach § 201 UmwG als bekannt gemacht gilt, ihren Anspruch nach Grund und Höhe in Textform anmelden, Sicherheit zu leisten, soweit sie nicht Befriedigung verlangen können. Dieses Recht steht den Gläubigern jedoch nur zu, wenn sie glaubhaft machen, dass durch den Formwechsel die Erfüllung ihrer Forderung gefährdet wird."
    },
    {
      "date": "2026-01-09",
      "id": "141941",
      "original_text": "Registerbekanntmachung nach dem Umwandlungsgesetz\nBayern Amtsgericht Nürnberg HRA 5838\nBoutique Madame GmbH & Co. Maison KG – Nürnberg",
      "type": "Registerbekanntmachung nach dem Umwandlungsgesetz",
      "state": "Bayern",
      "amtsgericht": "Amtsgericht Nürnberg",
      "registernummer": "HRA 5838",
      "registerart": "HRA",
      "company_name": "Boutique Madame GmbH & Co. Maison KG",
      "company_seat": "Nürnberg",
      "details": "09.01.2026 (Bekanntmachungsdatum)\n\nBayern Amtsgericht Nürnberg HRA 5838\nRegisterbekanntmachung nach dem Umwandlungsgesetz 08.01.2026 (Eintragungsdatum)\n\nBoutique Madame GmbH & Co. Maison KG\nKommanditgesellschaft\nNürnberg\n\nDen Gläubigern des formwechselnden Rechtsträgers ist, wenn sie binnen sechs Monaten nach dem Tag, an dem die Eintragung des Formwechsels nach § 201 UmwG als bekannt gemacht gilt, ihren Anspruch nach Grund und Höhe in Textform anmelden, Sicherheit zu leisten, soweit sie nicht Befriedigung verlangen können. Dieses Recht steht den Gläubigern jedoch nur zu, wenn sie glaubhaft machen, dass durch den Formwechsel die Erfüllung ihrer Forderung gefährdet wird."
    },
    {
      "date": "2026-01-09",
      "id": "141942",
      "original_text": "Registerbekanntmachung nach dem Umwandlungsgesetz\nBayern Amtsgericht München HRB 219024\nBlockalarm Service UG (haftungsbeschränkt) – Dachau",
      "type": "Registerbekanntmachung nach dem Umwandlungsgesetz",
      "state": "Bayern",
      "amtsgericht": "Amtsgericht München",
      "registernummer": "HRB 219024",
      "registerart": "HRB",
      "company_name": "Blockalarm Service UG (haftungsbeschränkt)",
      "company_seat": "Dachau",
      "details": "09.01.2026 (Bekanntmachungsdatum)\n\nBayern Amtsgericht München HRB 219024\nRegisterbekanntmachung nach dem Umwandlungsgesetz 08.01.2026 (Eintragungsdatum)\n\nBlockalarm Service UG (haftungsbeschränkt)\nGesellschaft mit beschränkter Haftung\nDachau\n\nDen Gläubigern der an der Verschmelzung beteiligten Rechtsträger ist, wenn sie binnen sechs Monaten nach dem Tag, an dem die Eintragung der Verschmelzung in das Register des Sitzes desjenigen Rechtsträgers, dessen Gläubiger sie sind, nach § 19 Abs. 3 UmwG als bekannt gemacht gilt, ihren Anspruch nach Grund und Höhe in Textform anmelden, Sicherheit zu leisten, soweit sie nicht Befriedigung verlangen können. Dieses Recht steht den Gläubigern jedoch nur zu, wenn sie glaubhaft machen, dass durch die Verschmelzung die Erfüllung ihrer Forderung gefährdet wird."
    },
    {
      "date": "2026-01-09",
      "id": "141943",
      "original_text": "Sonstige Registerbekanntmachung\nBayern Amtsgericht München HRB 307240\nStudio Alba Productions GmbH – München",
      "type": "Sonstige Registerbekanntmachung",
      "state": "Bayern",
      "amtsgericht": "Amtsgericht München",
      "registernummer": "HRB 307240",
      "registerart": "HRB",
      "company_name": "Studio Alba Productions GmbH",
      "company_seat": "München",
      "details": "09.01.2026 (Bekanntmachungsdatum)\n\nBayern Amtsgericht München HRB 307240\nSonstige Registerbekanntmachung 08.01.2026 (Eintragungsdatum)\n\nStudio Alba Productions GmbH\nGesellschaft mit beschränkter Haftung\nMünchen\n\nDen Gläubigern der Gesellschaft, deren Forderungen begründet worden sind, bevor die Eintragung der Beendigung des Beherrschungs- und Gewinnabführungsvertrages in das Handelsregister nach § 10 des Handelsgesetzbuches als bekanntgemacht gilt, hat der andere Vertragsteil Sicherheit zu leisten, wenn sie sich binnen sechs Monaten nach der Bekanntmachung der Eintragung zu diesem Zweck bei ihm melden."
    },
    {
      "date": "2026-01-09",
      "id": "141944",
      "original_text": "Sonstige Registerbekanntmachung\nBaden-Württemberg Amtsgericht Stuttgart HRB 17156\nEnBW Kraftwerk Lippendorf Beteiligungsgesellschaft mbH – Stuttgart",
      "type": "Sonstige Registerbekanntmachung",
      "state": "Baden-Württemberg",
      "amtsgericht": "Amtsgericht Stuttgart",
      "registernummer": "HRB 17156",
      "registerart": "HRB",
      "company_name": "EnBW Kraftwerk Lippendorf Beteiligungsgesellschaft mbH",
      "company_seat": "Stuttgart",
      "details": "09.01.2026 (Bekanntmachungsdatum)\n\nBaden-Württemberg Amtsgericht Stuttgart HRB 17156\nSonstige Registerbekanntmachung 09.01.2026 (Eintragungsdatum)\n\nEnBW Kraftwerk Lippendorf Beteiligungsgesellschaft mbH\nGesellschaft mit beschränkter Haftung\nStuttgart\n\nDen Gläubigern der Gesellschaft, deren Forderungen begründet worden sind, bevor die Eintragung der Beendigung des Vertrages in das Handelsregister nach § 10 HGB als bekanntgemacht gilt, ist vom anderen Vertragsteil Sicherheit zu leisten, wenn sie sich binnen sechs Monaten nach der Bekanntmachung zu diesem Zweck bei ihm melden."
    },
    {
      "date": "2026-01-09",
      "id": "141945",
      "original_text": "Sonstige Registerbekanntmachung\nHamburg Amtsgericht Hamburg HRB 178041\nGCE Europe GmbH – Hamburg",
      "type": "Sonstige Registerbekanntmachung",
      "state": "Hamburg",
      "amtsgericht": "Amtsgericht Hamburg",
      "registernummer": "HRB 178041",
      "registerart": "HRB",
      "company_name": "GCE Europe GmbH",
      "company_seat": "Hamburg",
      "details": "09.01.2026 (Bekanntmachungsdatum)\n\nHamburg Amtsgericht Hamburg HRB 178041\nSonstige Registerbekanntmachung 09.01.2026 (Eintragungsdatum)\n\nGCE Europe GmbH\nGesellschaft mit beschränkter Haftung\nHamburg\n\nAls nicht eingetragen wird bekannt gemacht:  Den Gläubigern der Gesellschaft, deren Forderungen begründet worden sind, bevor die Eintragung der Vertragsbeendigung in das Handelsregister nach § 10 HGB als bekannt gemacht gilt, ist vom anderen Vertragsteil Sicherheit zu leisten, wenn sie sich binnen 6 Monaten nach Bekanntmachung der Eintragung zu diesem Zweck bei ihm melden."
    },
    {
      "date": "2026-01-09",
      "id": "141946",
      "original_text": "Sonstige Registerbekanntmachung\nBerlin Amtsgericht Berlin (Charlottenburg) HRB 221348\nDAH Photovoltaik 3. GmbH – Berlin",
      "type": "Sonstige Registerbekanntmachung",
      "state": "Berlin",
      "amtsgericht": "Amtsgericht Berlin (Charlottenburg)",
      "registernummer": "HRB 221348",
      "registerart": "HRB",
      "company_name": "DAH Photovoltaik 3. GmbH",
      "company_seat": "Berlin",
      "details": "09.01.2026 (Bekanntmachungsdatum)\n\nBerlin Amtsgericht Berlin (Charlottenburg) HRB 221348\nSonstige Registerbekanntmachung\n\nDAH Photovoltaik 3. GmbH\nGesellschaft mit beschränkter Haftung\nBerlin\n\nAls nicht eingetragen wird veröffentlicht: Der mit der IIP Neon GmbH als Rechtsnachfolgerin der auf diese verschmolzenen DAH Service GmbH mit Sitz in Oranienburg (Amtsgericht Neuruppin, HRB 14584 NP) bestehende Gewinnabführungsvertrag vom 28.11.2024 ist durch Aufhebungsvertrag vom 05.12.2025 mit Wirkung zum Ablauf des 31.12.2025 beendet."
    },
    {
      "date": "2026-01-09",
      "id": "141947",
      "original_text": "Sonstige Registerbekanntmachung\nHamburg Amtsgericht Hamburg HRB 154072\nENERPARC Solar Invest 141 GmbH – Hamburg",
      "type": "Sonstige Registerbekanntmachung",
      "state": "Hamburg",
      "amtsgericht": "Amtsgericht Hamburg",
      "registernummer": "HRB 154072",
      "registerart": "HRB",
      "company_name": "ENERPARC Solar Invest 141 GmbH",
      "company_seat": "Hamburg",
      "details": "09.01.2026 (Bekanntmachungsdatum)\n\nHamburg Amtsgericht Hamburg HRB 154072\nSonstige Registerbekanntmachung 09.01.2026 (Eintragungsdatum)\n\nENERPARC Solar Invest 141 GmbH\nGesellschaft mit beschränkter Haftung\nHamburg\n\nAls nicht eingetragen wird bekannt gemacht:  Den Gläubigern der Gesellschaft, deren Forderungen begründet worden sind, bevor die Eintragung der Vertragsbeendigung in das Handelsregister nach § 10 HGB als bekannt gemacht gilt, ist vom anderen Vertragsteil Sicherheit zu leisten, wenn sie sich binnen 6 Monaten nach Bekanntmachung der Eintragung zu diesem Zweck bei ihm melden."
    },
    {
      "date": "2026-01-09",
      "id": "141948",
      "original_text": "Löschungsankündigung\nBaden-Württemberg Amtsgericht Freiburg HRB 731872\nOK Tours GmbH – Freiburg im Breisgau",
      "type": "Löschungsankündigung",
      "state": "Baden-Württemberg",
      "amtsgericht": "Amtsgericht Freiburg",
      "registernummer": "HRB 731872",
      "registerart": "HRB",
      "company_name": "OK Tours GmbH",
      "company_seat": "Freiburg im Breisgau",
      "details": "09.01.2026 (Bekanntmachungsdatum)\n\nBaden-Württemberg Amtsgericht Freiburg HRB 731872\nLöschungsankündigung\n\nOK Tours GmbH\nGesellschaft mit beschränkter Haftung\nFreiburg im Breisgau\n\nAls nicht eingetragen wird bekanntgemacht:\nDas Gericht beabsichtigt, die Gesellschaft wegen Vermögenslosigkeit im Handelsregister von Amts wegen nach § 394 FamFG zu löschen. Die Frist zur Geltendmachung eines Widerspruchs gegen die beabsichtigte Löschung ist auf einen Monat ab Veröffentlichung bestimmt."
    },
    {
      "date": "2026-01-09",
      "id": "141949",
      "original_text": "Sonstige Registerbekanntmachung\nHamburg Amtsgericht Hamburg HRB 130470\nENERPARC Solar Invest 93 GmbH – Hamburg",
      "type": "Sonstige Registerbekanntmachung",
      "state": "Hamburg",
      "amtsgericht": "Amtsgericht Hamburg",
      "registernummer": "HRB 130470",
      "registerart": "HRB",
      "company_name": "ENERPARC Solar Invest 93 GmbH",
      "company_seat": "Hamburg",
      "details": "09.01.2026 (Bekanntmachungsdatum)\n\nHamburg Amtsgericht Hamburg HRB 130470\nSonstige Registerbekanntmachung 09.01.2026 (Eintragungsdatum)\n\nENERPARC Solar Invest 93 GmbH\nGesellschaft mit beschränkter Haftung\nHamburg\n\nAls nicht eingetragen wird bekannt gemacht:  Den Gläubigern der Gesellschaft, deren Forderungen begründet worden sind, bevor die Eintragung der Vertragsbeendigung in das Handelsregister nach § 10 HGB als bekannt gemacht gilt, ist vom anderen Vertragsteil Sicherheit zu leisten, wenn sie sich binnen 6 Monaten nach Bekanntmachung der Eintragung zu diesem Zweck bei ihm melden."
    },
    {
      "date": "2026-01-09",
      "id": "141950",
      "original_text": "Sonstige Registerbekanntmachung\nHamburg Amtsgericht Hamburg HRB 149173\nENERPARC Solar Invest 134 GmbH – Hamburg",
      "type": "Sonstige Registerbekanntmachung",
      "state": "Hamburg",
      "amtsgericht": "Amtsgericht Hamburg",
      "registernummer": "HRB 149173",
      "registerart": "HRB",
      "company_name": "ENERPARC Solar Invest 134 GmbH",
      "company_seat": "Hamburg",
      "details": "09.01.2026 (Bekanntmachungsdatum)\n\nHamburg Amtsgericht Hamburg HRB 149173\nSonstige Registerbekanntmachung 09.01.2026 (Eintragungsdatum)\n\nENERPARC Solar Invest 134 GmbH\nGesellschaft mit beschränkter Haftung\nHamburg\n\nAls nicht eingetragen wird bekannt gemacht:  Den Gläubigern der Gesellschaft, deren Forderungen begründet worden sind, bevor die Eintragung der Vertragsbeendigung in das Handelsregister nach § 10 HGB als bekannt gemacht gilt, ist vom anderen Vertragsteil Sicherheit zu leisten, wenn sie sich binnen 6 Monaten nach Bekanntmachung der Eintragung zu diesem Zweck bei ihm melden."
    },
    {
      "date": "2026-01-09",
      "id": "141951",
      "original_text": "Sonstige Registerbekanntmachung\nHamburg Amtsgericht Hamburg HRB 154060\nENERPARC Solar Invest 142 GmbH – Hamburg",
      "type": "Sonstige Registerbekanntmachung",
      "state": "Hamburg",
      "amtsgericht": "Amtsgericht Hamburg",
      "registernummer": "HRB 154060",
      "registerart": "HRB",
      "company_name": "ENERPARC Solar Invest 142 GmbH",
      "company_seat": "Hamburg",
      "details": "09.01.2026 (Bekanntmachungsdatum)\n\nHamburg Amtsgericht Hamburg HRB 154060\nSonstige Registerbekanntmachung 09.01.2026 (Eintragungsdatum)\n\nENERPARC Solar Invest 142 GmbH\nGesellschaft mit beschränkter Haftung\nHamburg\n\nAls nicht eingetragen wird bekannt gemacht:  Den Gläubigern der Gesellschaft, deren Forderungen begründet worden sind, bevor die Eintragung der Vertragsbeendigung in das Handelsregister nach § 10 HGB als bekannt gemacht gilt, ist vom anderen Vertragsteil Sicherheit zu leisten, wenn sie sich binnen 6 Monaten nach Bekanntmachung der Eintragung zu diesem Zweck bei ihm melden."
    },
    {
      "date": "2026-01-09",
      "id": "141952",
      "original_text": "Sonstige Registerbekanntmachung\nHamburg Amtsgericht Hamburg HRB 154014\nENERPARC Solar Invest 157 GmbH – Hamburg",
      "type": "Sonstige Registerbekanntmachung",
      "state": "Hamburg",
      "amtsgericht": "Amtsgericht Hamburg",
      "registernummer": "HRB 154014",
      "registerart": "HRB",
      "company_name": "ENERPARC Solar Invest 157 GmbH",
      "company_seat": "Hamburg",
      "details": "09.01.2026 (Bekanntmachungsdatum)\n\nHamburg Amtsgericht Hamburg HRB 154014\nSonstige Registerbekanntmachung 09.01.2026 (Eintragungsdatum)\n\nENERPARC Solar Invest 157 GmbH\nGesellschaft mit beschränkter Haftung\nHamburg\n\nAls nicht eingetragen wird bekannt gemacht:  Den Gläubigern der Gesellschaft, deren Forderungen begründet worden sind, bevor die Eintragung der Vertragsbeendigung in das Handelsregister nach § 10 HGB als bekannt gemacht gilt, ist vom anderen Vertragsteil Sicherheit zu leisten, wenn sie sich binnen 6 Monaten nach Bekanntmachung der Eintragung zu diesem Zweck bei ihm melden."
    },
    {
      "date": "2026-01-09",
      "id": "141953",
      "original_text": "Registerbekanntmachung nach dem Umwandlungsgesetz\nBaden-Württemberg Amtsgericht Stuttgart HRB 803364\nparowi Holding GmbH – Fellbach",
      "type": "Registerbekanntmachung nach dem Umwandlungsgesetz",
      "state": "Baden-Württemberg",
      "amtsgericht": "Amtsgericht Stuttgart",
      "registernummer": "HRB 803364",
      "registerart": "HRB",
      "company_name": "parowi Holding GmbH",
      "company_seat": "Fellbach",
      "details": "09.01.2026 (Bekanntmachungsdatum)\n\nBaden-Württemberg Amtsgericht Stuttgart HRB 803364\nRegisterbekanntmachung nach dem Umwandlungsgesetz 09.01.2026 (Eintragungsdatum)\n\nparowi Holding GmbH\nGesellschaft mit beschränkter Haftung\nFellbach\n\nAls nicht eingetragen wird bekanntgemacht:\nDen Gläubigern der an der Ausgliederung beteiligten Rechtsträger ist, wenn sie binnen sechs Monaten nach dem Tag, an dem die Eintragung der Ausgliederung in das Register des Sitzes desjenigen Rechtsträgers, dessen Gläubiger sie sind, nach § 19 Abs. 3 UmwG als bekanntgemacht gilt, ihren Anspruch nach Grund und Höhe schriftlich anmelden, Sicherheit zu leisten, soweit sie nicht Befriedigung verlangen können. Dieses Recht steht den Gläubigern jedoch nur zu, wenn sie glaubhaft machen, dass durch die Ausgliederung die Erfüllung ihrer Forderung gefährdet wird."
    },
    {
      "date": "2026-01-09",
      "id": "141954",
      "original_text": "Sonstige Registerbekanntmachung\nSchleswig-Holstein Amtsgericht Lübeck HRB 12291\nSenger Automobile GmbH – Lübeck",
      "type": "Sonstige Registerbekanntmachung",
      "state": "Schleswig-Holstein",
      "amtsgericht": "Amtsgericht Lübeck",
      "registernummer": "HRB 12291",
      "registerart": "HRB",
      "company_name": "Senger Automobile GmbH",
      "company_seat": "Lübeck",
      "details": "09.01.2026 (Bekanntmachungsdatum)\n\nSchleswig-Holstein Amtsgericht Lübeck HRB 12291\nSonstige Registerbekanntmachung 08.01.2026 (Eintragungsdatum)\n\nSenger Automobile GmbH\nGesellschaft mit beschränkter Haftung\nLübeck\n\nAls nicht eingetragen wird veröffentlicht: Der andere Vertragsteil hat den Gläubigern dieses Rechtsträgers, dessen Forderungen begründet worden sind, bevor die Eintragung der Beendigung dieses Vertrages in das Handelsregister nach § 10 des Handelsgesetzbuches als bekannt gemacht gilt, Sicherheit zu leisten, wenn sie sich binnen sechs Monaten nach der Bekanntmachung der Eintragung zu diesem Zweck bei ihm melden. Dieses Recht steht den Gläubigern nicht zu, die im Fall des Insolvenzverfahrens ein Recht auf vorzugsweise Befriedigung aus der Deckungsmasse haben, die nach gesetzlicher Vorschrift zu ihrem Schutz errichtet und staatlich überwacht ist."
    },
    {
      "date": "2026-01-09",
      "id": "141955",
      "original_text": "Löschungsankündigung\nBerlin Amtsgericht Berlin (Charlottenburg) HRB 172736\nFO-MAX GmbH – Berlin",
      "type": "Löschungsankündigung",
      "state": "Berlin",
      "amtsgericht": "Amtsgericht Berlin (Charlottenburg)",
      "registernummer": "HRB 172736",
      "registerart": "HRB",
      "company_name": "FO-MAX GmbH",
      "company_seat": "Berlin",
      "details": "09.01.2026 (Bekanntmachungsdatum)\n\nBerlin Amtsgericht Berlin (Charlottenburg) HRB 172736\nLöschungsankündigung\n\nFO-MAX GmbH\nGesellschaft mit beschränkter Haftung\nBerlin\n\nBei der nachstehenden Gesellschaft wird das Amtslöschungsverfahren gemäß § 394 FamFG eingeleitet. Widerspruchsfrist 6 Wochen"
    },
    {
      "date": "2026-01-09",
      "id": "141956",
      "original_text": "Einreichung neuer Dokumente\nBerlin Amtsgericht Berlin (Charlottenburg) HRB 74180\nEduard Winter Immobilien Verwaltungs-GmbH – Berlin",
      "type": "Einreichung neuer Dokumente",
      "state": "Berlin",
      "amtsgericht": "Amtsgericht Berlin (Charlottenburg)",
      "registernummer": "HRB 74180",
      "registerart": "HRB",
      "company_name": "Eduard Winter Immobilien Verwaltungs-GmbH",
      "company_seat": "Berlin",
      "details": "09.01.2026 (Bekanntmachungsdatum)\n\nBerlin Amtsgericht Berlin (Charlottenburg) HRB 74180\nEinreichung neuer Dokumente\n\nEduard Winter Immobilien Verwaltungs-GmbH\nGesellschaft mit beschränkter Haftung\nBerlin\n\nAls nicht eingetragen wird veröffentlicht: Es wurde eine neue Liste der Beiratsmitglieder eingereicht (§ 52 GmbHG)."
    },
    {
      "date": "2026-01-09",
      "id": "141957",
      "original_text": "Registerbekanntmachung nach dem Umwandlungsgesetz\nBaden-Württemberg Amtsgericht Freiburg HRB 391440\nHeitzmann Verwaltungs- GmbH – Lahr",
      "type": "Registerbekanntmachung nach dem Umwandlungsgesetz",
      "state": "Baden-Württemberg",
      "amtsgericht": "Amtsgericht Freiburg",
      "registernummer": "HRB 391440",
      "registerart": "HRB",
      "company_name": "Heitzmann Verwaltungs- GmbH",
      "company_seat": "Lahr",
      "details": "09.01.2026 (Bekanntmachungsdatum)\n\nBaden-Württemberg Amtsgericht Freiburg HRB 391440\nRegisterbekanntmachung nach dem Umwandlungsgesetz 09.01.2026 (Eintragungsdatum)\n\nHeitzmann Verwaltungs- GmbH\nGesellschaft mit beschränkter Haftung\nLahr\n\nAls nicht eingetragen wird bekanntgemacht:\nDen Gläubigern der an der Verschmelzung beteiligten Rechtsträger ist, wenn sie binnen sechs Monaten nach dem Tag, an dem die Eintragung der Verschmelzung in das Register des Sitzes desjenigen Rechtsträgers, dessen Gläubiger sie sind, nach § 19 Abs. 3 UmwG als bekanntgemacht gilt, ihren Anspruch nach Grund und Höhe schriftlich anmelden, Sicherheit zu leisten, soweit sie nicht Befriedigung verlangen können. Dieses Recht steht den Gläubigern jedoch nur zu, wenn sie glaubhaft machen, dass durch die Verschmelzung die Erfüllung ihrer Forderung gefährdet wird."
    },
    {
      "date": "2026-01-09",
      "id": "141958",
      "original_text": "Registerbekanntmachung nach dem Umwandlungsgesetz\nBaden-Württemberg Amtsgericht Freiburg HRB 3035\nAllgaier Verwaltungs GmbH – Freiburg im Breisgau",
      "type": "Registerbekanntmachung nach dem Umwandlungsgesetz",
      "state": "Baden-Württemberg",
      "amtsgericht": "Amtsgericht Freiburg",
      "registernummer": "HRB 3035",
      "registerart": "HRB",
      "company_name": "Allgaier Verwaltungs GmbH",
      "company_seat": "Freiburg im Breisgau",
      "details": "09.01.2026 (Bekanntmachungsdatum)\n\nBaden-Württemberg Amtsgericht Freiburg HRB 3035\nRegisterbekanntmachung nach dem Umwandlungsgesetz 09.01.2026 (Eintragungsdatum)\n\nAllgaier Verwaltungs GmbH\nGesellschaft mit beschränkter Haftung\nFreiburg im Breisgau\n\nAls nicht eingetragen wird bekanntgemacht:\nDen Gläubigern der an der Verschmelzung beteiligten Rechtsträger ist, wenn sie binnen sechs Monaten nach dem Tag, an dem die Eintragung der Verschmelzung in das Register des Sitzes desjenigen Rechtsträgers, dessen Gläubiger sie sind, nach § 19 Abs. 3 UmwG als bekanntgemacht gilt, ihren Anspruch nach Grund und Höhe schriftlich anmelden, Sicherheit zu leisten, soweit sie nicht Befriedigung verlangen können. Dieses Recht steht den Gläubigern jedoch nur zu, wenn sie glaubhaft machen, dass durch die Verschmelzung die Erfüllung ihrer Forderung gefährdet wird."
    },
    {
      "date": "2026-01-09",
      "id": "141959",
      "original_text": "Registerbekanntmachung nach dem Umwandlungsgesetz\nBaden-Württemberg Amtsgericht Freiburg HRB 731457\nOmega Verwaltungs GmbH – Freiburg im Breisgau",
      "type": "Registerbekanntmachung nach dem Umwandlungsgesetz",
      "state": "Baden-Württemberg",
      "amtsgericht": "Amtsgericht Freiburg",
      "registernummer": "HRB 731457",
      "registerart": "HRB",
      "company_name": "Omega Verwaltungs GmbH",
      "company_seat": "Freiburg im Breisgau",
      "details": "09.01.2026 (Bekanntmachungsdatum)\n\nBaden-Württemberg Amtsgericht Freiburg HRB 731457\nRegisterbekanntmachung nach dem Umwandlungsgesetz 09.01.2026 (Eintragungsdatum)\n\nOmega Verwaltungs GmbH\nGesellschaft mit beschränkter Haftung\nFreiburg im Breisgau\n\nDie \"Allgaier Verwaltungs GmbH\" (Amtsgericht FReiburg, HRB 3035) ist auf diese Gesellschaft zur Aufnahme verschmolzen. Den Gläubigern der an der Verschmelzung beteiligten Rechtsträger ist, wenn sie binnen sechs Monaten nach dem Tag, an dem die Eintragung der Verschmelzung in das Register des Sitzes desjenigen Rechtsträgers, dessen Gläubiger sie sind, nach § 19 Abs. 3 UmwG als bekanntgemacht gilt, ihren Anspruch nach Grund und Höhe schriftlich anmelden, Sicherheit zu leisten, soweit sie nicht Befriedigung verlangen können. Dieses Recht steht den Gläubigern jedoch nur zu, wenn sie glaubhaft machen, dass durch die Verschmelzung die Erfüllung ihrer Forderung gefährdet wird."
    },
    {
      "date": "2026-01-09",
      "id": "141960",
      "original_text": "Registerbekanntmachung nach dem Umwandlungsgesetz\nBaden-Württemberg Amtsgericht Freiburg HRB 708363\nHeitzmann Besitzverwaltungs UG (haftungsbeschränkt) – Lahr",
      "type": "Registerbekanntmachung nach dem Umwandlungsgesetz",
      "state": "Baden-Württemberg",
      "amtsgericht": "Amtsgericht Freiburg",
      "registernummer": "HRB 708363",
      "registerart": "HRB",
      "company_name": "Heitzmann Besitzverwaltungs UG (haftungsbeschränkt)",
      "company_seat": "Lahr",
      "details": "09.01.2026 (Bekanntmachungsdatum)\n\nBaden-Württemberg Amtsgericht Freiburg HRB 708363\nRegisterbekanntmachung nach dem Umwandlungsgesetz 09.01.2026 (Eintragungsdatum)\n\nHeitzmann Besitzverwaltungs UG (haftungsbeschränkt)\nGesellschaft mit beschränkter Haftung\nLahr\n\nAls nicht eingetragen wird bekanntgemacht:\nDen Gläubigern der an der Verschmelzung beteiligten Rechtsträger ist, wenn sie binnen sechs Monaten nach dem Tag, an dem die Eintragung der Verschmelzung in das Register des Sitzes desjenigen Rechtsträgers, dessen Gläubiger sie sind, nach § 19 Abs. 3 UmwG als bekanntgemacht gilt, ihren Anspruch nach Grund und Höhe schriftlich anmelden, Sicherheit zu leisten, soweit sie nicht Befriedigung verlangen können. Dieses Recht steht den Gläubigern jedoch nur zu, wenn sie glaubhaft machen, dass durch die Verschmelzung die Erfüllung ihrer Forderung gefährdet wird."
    },
    {
      "date": "2026-01-09",
      "id": "141961",
      "original_text": "Sonstige Registerbekanntmachung\nSchleswig-Holstein Amtsgericht Flensburg HRB 8482\nHanse Handel GmbH – Flensburg",
      "type": "Sonstige Registerbekanntmachung",
      "state": "Schleswig-Holstein",
      "amtsgericht": "Amtsgericht Flensburg",
      "registernummer": "HRB 8482",
      "registerart": "HRB",
      "company_name": "Hanse Handel GmbH",
      "company_seat": "Flensburg",
      "details": "09.01.2026 (Bekanntmachungsdatum)\n\nSchleswig-Holstein Amtsgericht Flensburg HRB 8482\nSonstige Registerbekanntmachung 09.01.2026 (Eintragungsdatum)\n\nHanse Handel GmbH\nGesellschaft mit beschränkter Haftung\nFlensburg\n\nAls nicht eingetragen wird veröffentlicht: Der andere Vertragsteil hat den Gläubigern dieses Rechtsträgers, dessen Forderungen begründet worden sind, bevor die Eintragung der Beendigung dieses Vertrages in das Handelsregister nach § 10 des Handelsgesetzbuches als bekannt gemacht gilt, Sicherheit zu leisten, wenn sie sich binnen sechs Monaten nach der Bekanntmachung der Eintragung zu diesem Zweck bei ihm melden."
    },
    {
      "date": "2026-01-09",
      "id": "141962",
      "original_text": "Sonstige Registerbekanntmachung\nBaden-Württemberg Amtsgericht Ulm HRB 738238\nParallax IT GmbH – Ulm",
      "type": "Sonstige Registerbekanntmachung",
      "state": "Baden-Württemberg",
      "amtsgericht": "Amtsgericht Ulm",
      "registernummer": "HRB 738238",
      "registerart": "HRB",
      "company_name": "Parallax IT GmbH",
      "company_seat": "Ulm",
      "details": "09.01.2026 (Bekanntmachungsdatum)\n\nBaden-Württemberg Amtsgericht Ulm HRB 738238\nSonstige Registerbekanntmachung 09.01.2026 (Eintragungsdatum)\n\nParallax IT GmbH\nGesellschaft mit beschränkter Haftung\nUlm\n\nAls nicht eingetragen wird bekanntgemacht:\nDen Gläubigern der Gesellschaft, deren Forderungen begründet worden sind, bevor die Eintragung der Beendigung des Vertrages in das Handelsregister nach § 10 HGB als bekanntgemacht gilt, ist vom anderen Vertragsteil Sicherheit zu leisten, wenn sie sich binnen sechs Monaten nach der Bekanntmachung zu diesem Zweck bei ihm melden."
    },
    {
      "date": "2026-01-09",
      "id": "141963",
      "original_text": "Registerbekanntmachung nach dem Umwandlungsgesetz\nBaden-Württemberg Amtsgericht Mannheim HRB 432008\nMenz Fertigungs-Service GmbH – Laudenbach",
      "type": "Registerbekanntmachung nach dem Umwandlungsgesetz",
      "state": "Baden-Württemberg",
      "amtsgericht": "Amtsgericht Mannheim",
      "registernummer": "HRB 432008",
      "registerart": "HRB",
      "company_name": "Menz Fertigungs-Service GmbH",
      "company_seat": "Laudenbach",
      "details": "09.01.2026 (Bekanntmachungsdatum)\n\nBaden-Württemberg Amtsgericht Mannheim HRB 432008\nRegisterbekanntmachung nach dem Umwandlungsgesetz 09.01.2026 (Eintragungsdatum)\n\nMenz Fertigungs-Service GmbH\nGesellschaft mit beschränkter Haftung\nLaudenbach\n\nDen Gläubigern der an der Verschmelzung beteiligten Rechtsträger ist, wenn sie binnen sechs Monaten nach dem Tag, an dem die Eintragung der Verschmelzung in das Register des Sitzes desjenigen Rechtsträgers, dessen Gläubiger sie sind, nach § 19 Abs. 3 UmwG als bekanntgemacht gilt, ihren Anspruch nach Grund und Höhe schriftlich anmelden, Sicherheit zu leisten, soweit sie nicht Befriedigung verlangen können. Dieses Recht steht den Gläubigern jedoch nur zu, wenn sie glaubhaft machen, dass durch die Verschmelzung die Erfüllung ihrer Forderung gefährdet wird."
    },
    {
      "date": "2026-01-09",
      "id": "141964",
      "original_text": "Löschungsankündigung\nBrandenburg Amtsgericht Potsdam HRB 31696\nSANYBOY UG (haftungsbeschränkt) – Blankenfelde-Mahlow",
      "type": "Löschungsankündigung",
      "state": "Brandenburg",
      "amtsgericht": "Amtsgericht Potsdam",
      "registernummer": "HRB 31696",
      "registerart": "HRB",
      "company_name": "SANYBOY UG (haftungsbeschränkt)",
      "company_seat": "Blankenfelde-Mahlow",
      "details": "09.01.2026 (Bekanntmachungsdatum)\n\nBrandenburg Amtsgericht Potsdam HRB 31696\nLöschungsankündigung\n\nSANYBOY UG (haftungsbeschränkt)\nGesellschaft mit beschränkter Haftung\nBlankenfelde-Mahlow\n\nBei der nachstehenden Gesellschaft wird das Amtslöschungsverfahren gemäß § 394 FamFG eingeleitet. Widerspruchsfrist: 8 Wochen"
    },
    {
      "date": "2026-01-09",
      "id": "141965",
      "original_text": "Einreichung neuer Dokumente\nBaden-Württemberg Amtsgericht Stuttgart HRB 725082\nAllianz Esa GmbH – Bad Friedrichshall",
      "type": "Einreichung neuer Dokumente",
      "state": "Baden-Württemberg",
      "amtsgericht": "Amtsgericht Stuttgart",
      "registernummer": "HRB 725082",
      "registerart": "HRB",
      "company_name": "Allianz Esa GmbH",
      "company_seat": "Bad Friedrichshall",
      "details": "09.01.2026 (Bekanntmachungsdatum)\n\nBaden-Württemberg Amtsgericht Stuttgart HRB 725082\nEinreichung neuer Dokumente 09.01.2026 (Eintragungsdatum)\n\nAllianz Esa GmbH\nGesellschaft mit beschränkter Haftung\nBad Friedrichshall\n\nDie Gesellschaft hat am 09.01.2026 die Liste über die Zusammensetzung des Aufsichtsrats zum Handelsregister eingereicht."
    },
    {
      "date": "2026-01-09",
      "id": "141966",
      "original_text": "Löschungsankündigung\nSaarland Amtsgericht Saarbrücken HRB 52781\nAuto Klein Geschäftsführungs GmbH – Saarwellingen",
      "type": "Löschungsankündigung",
      "state": "Saarland",
      "amtsgericht": "Amtsgericht Saarbrücken",
      "registernummer": "HRB 52781",
      "registerart": "HRB",
      "company_name": "Auto Klein Geschäftsführungs GmbH",
      "company_seat": "Saarwellingen",
      "details": "09.01.2026 (Bekanntmachungsdatum)\n\nSaarland Amtsgericht Saarbrücken HRB 52781\nLöschungsankündigung\n\nAuto Klein Geschäftsführungs GmbH\nGesellschaft mit beschränkter Haftung\nSaarwellingen\n\nEs ist beabsichtigt, die Gesellschaft von Amts wegen gemäß § 394 FamFG wegen Vermögenslosigkeit zu löschen.\nGegen die Löschung von Amts wegen ist das Rechtsmittel des Widerspruchs statthaft. Der Widerspruch ist binnen einer Frist zwei Monaten beginnend mit dem Tag dieser Veröffentlichung durch Einreichen eines Widerspruchsschreibens -schriftlich oder zur Niederschrift der Geschäftsstelle beim Amtsgericht Saarbrücken, -zentrales Handelsregister-, Mainzerstr.178, 66121 Saarbrücken einzulegen.\nDer Widerspruch muss die Bezeichnung der angefochtenen Löschungsankündigung enthalten sowie die Erklärung, dass Widerspruch eingelegt wird. Er ist vom Widerspruchsführer oder seinem Bevollmächtigten zu unterzeichnen.\nDas Widerspruchsschreiben kann auch in der Form eines elektronischen Dokumentes eingereicht werden, das mit einer qualifizierten elektronischen Signatur nach dem Signaturgesetz versehen sein muss (§§ 14 Abs. 2 FamFG, 130a, 298 ZPO)."
    },
    {
      "date": "2026-01-09",
      "id": "141967",
      "original_text": "Registerbekanntmachung nach dem Umwandlungsgesetz\nBaden-Württemberg Amtsgericht Mannheim HRA 712448\nSL Elektrotechnik e.K. – Weinheim",
      "type": "Registerbekanntmachung nach dem Umwandlungsgesetz",
      "state": "Baden-Württemberg",
      "amtsgericht": "Amtsgericht Mannheim",
      "registernummer": "HRA 712448",
      "registerart": "HRA",
      "company_name": "SL Elektrotechnik e.K.",
      "company_seat": "Weinheim",
      "details": "09.01.2026 (Bekanntmachungsdatum)\n\nBaden-Württemberg Amtsgericht Mannheim HRA 712448\nRegisterbekanntmachung nach dem Umwandlungsgesetz 09.01.2026 (Eintragungsdatum)\n\nSL Elektrotechnik e.K.\nEinzelkaufmann / Einzelkauffrau\nWeinheim\n\nDen Gläubigern der an der Ausgliederung beteiligten Rechtsträger ist, wenn sie binnen sechs Monaten nach dem Tag, an dem die Eintragung der Ausgliederung in das Register des Sitzes desjenigen Rechtsträgers, dessen Gläubiger sie sind, nach § 19 Abs. 3 UmwG als bekanntgemacht gilt, ihren Anspruch nach Grund und Höhe schriftlich anmelden, Sicherheit zu leisten, soweit sie nicht Befriedigung verlangen können. Dieses Recht steht den Gläubigern jedoch nur zu, wenn sie glaubhaft machen, dass durch die Ausgliederung die Erfüllung ihrer Forderung gefährdet wird."
    },
    {
      "date": "2026-01-09",
      "id": "141968",
      "original_text": "Löschungsankündigung\nBerlin Amtsgericht Berlin (Charlottenburg) HRB 143429\nmammut concepts GmbH – Berlin",
      "type": "Löschungsankündigung",
      "state": "Berlin",
      "amtsgericht": "Amtsgericht Berlin (Charlottenburg)",
      "registernummer": "HRB 143429",
      "registerart": "HRB",
      "company_name": "mammut concepts GmbH",
      "company_seat": "Berlin",
      "details": "09.01.2026 (Bekanntmachungsdatum)\n\nBerlin Amtsgericht Berlin (Charlottenburg) HRB 143429\nLöschungsankündigung\n\nmammut concepts GmbH\nGesellschaft mit beschränkter Haftung\nBerlin\n\nBei der nachstehenden Gesellschaft wird das Amtslöschungsverfahren gemäß § 394 FamFG eingeleitet. Widerspruchsfrist 6 Wochen"
    },
    {
      "date": "2026-01-09",
      "id": "141969",
      "original_text": "Einreichung neuer Dokumente\nBerlin Amtsgericht Berlin (Charlottenburg) HRB 118165\nGeschäftshaus Franklinstraße 25 Verwaltungsgesellschaft mbH – Berlin",
      "type": "Einreichung neuer Dokumente",
      "state": "Berlin",
      "amtsgericht": "Amtsgericht Berlin (Charlottenburg)",
      "registernummer": "HRB 118165",
      "registerart": "HRB",
      "company_name": "Geschäftshaus Franklinstraße 25 Verwaltungsgesellschaft mbH",
      "company_seat": "Berlin",
      "details": "09.01.2026 (Bekanntmachungsdatum)\n\nBerlin Amtsgericht Berlin (Charlottenburg) HRB 118165\nEinreichung neuer Dokumente\n\nGeschäftshaus Franklinstraße 25 Verwaltungsgesellschaft mbH\nGesellschaft mit beschränkter Haftung\nBerlin\n\nAls nicht eingetragen wird veröffentlicht: Es wurde eine neue Liste der Beiratsmitglieder eingereicht (§52 GmbHG)."
    },
    {
      "date": "2026-01-09",
      "id": "141970",
      "original_text": "Löschungsankündigung\nBerlin Amtsgericht Berlin (Charlottenburg) HRB 200436\nDesigner Market GmbH – Berlin",
      "type": "Löschungsankündigung",
      "state": "Berlin",
      "amtsgericht": "Amtsgericht Berlin (Charlottenburg)",
      "registernummer": "HRB 200436",
      "registerart": "HRB",
      "company_name": "Designer Market GmbH",
      "company_seat": "Berlin",
      "details": "09.01.2026 (Bekanntmachungsdatum)\n\nBerlin Amtsgericht Berlin (Charlottenburg) HRB 200436\nLöschungsankündigung\n\nDesigner Market GmbH\nGesellschaft mit beschränkter Haftung\nBerlin\n\nBei der nachstehenden Gesellschaft wird das Amtslöschungsverfahren gemäß § 394 FamFG eingeleitet. Widerspruchsfrist 6 Wochen"
    },
    {
      "date": "2026-01-09",
      "id": "141971",
      "original_text": "Sonstige Registerbekanntmachung\nBaden-Württemberg Amtsgericht Ulm HRB 520346\nADK Modulraum GmbH – Neresheim",
      "type": "Sonstige Registerbekanntmachung",
      "state": "Baden-Württemberg",
      "amtsgericht": "Amtsgericht Ulm",
      "registernummer": "HRB 520346",
      "registerart": "HRB",
      "company_name": "ADK Modulraum GmbH",
      "company_seat": "Neresheim",
      "details": "09.01.2026 (Bekanntmachungsdatum)\n\nBaden-Württemberg Amtsgericht Ulm HRB 520346\nSonstige Registerbekanntmachung\n\nADK Modulraum GmbH\nGesellschaft mit beschränkter Haftung\nNeresheim\n\nDie Gesellschaft hat am 08.01.2026 die Liste über die Zusammensetzung des faktultativen Beirats zum Handelsregister eingereicht."
    },
    {
      "date": "2026-01-09",
      "id": "141972",
      "original_text": "Löschungsankündigung\nBrandenburg Amtsgericht Frankfurt/Oder HRB 19813\nWose GmbH – Eisenhüttenstadt",
      "type": "Löschungsankündigung",
      "state": "Brandenburg",
      "amtsgericht": "Amtsgericht Frankfurt/Oder",
      "registernummer": "HRB 19813",
      "registerart": "HRB",
      "company_name": "Wose GmbH",
      "company_seat": "Eisenhüttenstadt",
      "details": "09.01.2026 (Bekanntmachungsdatum)\n\nBrandenburg Amtsgericht Frankfurt/Oder HRB 19813\nLöschungsankündigung\n\nWose GmbH\nGesellschaft mit beschränkter Haftung\nEisenhüttenstadt\n\nBei der nachstehenden Gesellschaft wird das Amtslöschungsverfahren gemäß § 394 FamFG eingeleitet."
    },
    {
      "date": "2026-01-09",
      "id": "141973",
      "original_text": "Einreichung neuer Dokumente\nBerlin Amtsgericht Berlin (Charlottenburg) HRB 1387\nEisenbahn-Siedlungs-Gesellschaft Berlin mit beschränkter Haftung – Berlin",
      "type": "Einreichung neuer Dokumente",
      "state": "Berlin",
      "amtsgericht": "Amtsgericht Berlin (Charlottenburg)",
      "registernummer": "HRB 1387",
      "registerart": "HRB",
      "company_name": "Eisenbahn-Siedlungs-Gesellschaft Berlin mit beschränkter Haftung",
      "company_seat": "Berlin",
      "details": "09.01.2026 (Bekanntmachungsdatum)\n\nBerlin Amtsgericht Berlin (Charlottenburg) HRB 1387\nEinreichung neuer Dokumente\n\nEisenbahn-Siedlungs-Gesellschaft Berlin mit beschränkter Haftung\nGesellschaft mit beschränkter Haftung\nBerlin\n\nAls nicht eingetragen wird veröffentlicht: Es wurde eine neue Liste der Aufsichtsratsmitglieder eingereicht (§52 GmbHG)."
    },
    {
      "date": "2026-01-09",
      "id": "141974",
      "original_text": "Löschungsankündigung\nBerlin Amtsgericht Berlin (Charlottenburg) HRB 246991\nFast-TAXI und Limousinen Service GmbH – Berlin",
      "type": "Löschungsankündigung",
      "state": "Berlin",
      "amtsgericht": "Amtsgericht Berlin (Charlottenburg)",
      "registernummer": "HRB 246991",
      "registerart": "HRB",
      "company_name": "Fast-TAXI und Limousinen Service GmbH",
      "company_seat": "Berlin",
      "details": "09.01.2026 (Bekanntmachungsdatum)\n\nBerlin Amtsgericht Berlin (Charlottenburg) HRB 246991\nLöschungsankündigung\n\nFast-TAXI und Limousinen Service GmbH\nGesellschaft mit beschränkter Haftung\nBerlin\n\nBei der nachstehenden Gesellschaft wird das Amtslöschungsverfahren gemäß § 394 FamFG eingeleitet. Widerspruchsfrist 6 Wochen"
    },
    {
      "date": "2026-01-09",
      "id": "141975",
      "original_text": "Löschungsankündigung\nBrandenburg Amtsgericht Frankfurt/Oder HRB 12883\nDennEx Logistik GmbH – Schöneiche bei Berlin",
      "type": "Löschungsankündigung",
      "state": "Brandenburg",
      "amtsgericht": "Amtsgericht Frankfurt/Oder",
      "registernummer": "HRB 12883",
      "registerart": "HRB",
      "company_name": "DennEx Logistik GmbH",
      "company_seat": "Schöneiche bei Berlin",
      "details": "09.01.2026 (Bekanntmachungsdatum)\n\nBrandenburg Amtsgericht Frankfurt/Oder HRB 12883\nLöschungsankündigung\n\nDennEx Logistik GmbH\nGesellschaft mit beschränkter Haftung\nSchöneiche bei Berlin\n\nBei der nachstehenden Gesellschaft wird das Amtslöschungsverfahren gemäß § 394 FamFG eingeleitet."
    },
    {
      "date": "2026-01-09",
      "id": "141976",
      "original_text": "Löschungsankündigung\nNordrhein-Westfalen Amtsgericht Coesfeld HRB 22636\nDRH Cleaning GmbH – Bocholt",
      "type": "Löschungsankündigung",
      "state": "Nordrhein-Westfalen",
      "amtsgericht": "Amtsgericht Coesfeld",
      "registernummer": "HRB 22636",
      "registerart": "HRB",
      "company_name": "DRH Cleaning GmbH",
      "company_seat": "Bocholt",
      "details": "09.01.2026 (Bekanntmachungsdatum)\n\nNordrhein-Westfalen Amtsgericht Coesfeld HRB 22636\nLöschungsankündigung\n\nDRH Cleaning GmbH\nGesellschaft mit beschränkter Haftung\nBocholt\n\nDas Registergericht beabsichtigt, den Rechtsträger wegen Vermögenslosigkeit gemäß § 394 FamFG von Amts wegen zu löschen.\n\nGegen diese Verfügung kann Widerspruch eingelegt werden. Die Frist zur Erhebung eines Widerspruchs gegen die beabsichtigte Löschung ist auf zwei Monate ab Veröffentlichung festgesetzt."
    },
    {
      "date": "2026-01-09",
      "id": "141977",
      "original_text": "Einreichung neuer Dokumente\nBrandenburg Amtsgericht Potsdam HRB 3064\nLBS Landesbausparkasse NordOst AG – Potsdam und Hamburg",
      "type": "Einreichung neuer Dokumente",
      "state": "Brandenburg",
      "amtsgericht": "Amtsgericht Potsdam",
      "registernummer": "HRB 3064",
      "registerart": "HRB",
      "company_name": "LBS Landesbausparkasse NordOst AG",
      "company_seat": "Potsdam und Hamburg",
      "details": "09.01.2026 (Bekanntmachungsdatum)\n\nBrandenburg Amtsgericht Potsdam HRB 3064\nEinreichung neuer Dokumente\n\nLBS Landesbausparkasse NordOst AG\nAktiengesellschaft\nPotsdam und Hamburg\n\nAls nicht eingetragen wird veröffentlicht: Eine Liste der Mitglieder des Aufsichtsrates wurde zum Handelsregister eingereicht."
    },
    {
      "date": "2026-01-09",
      "id": "141978",
      "original_text": "Registerbekanntmachung nach dem Umwandlungsgesetz\nHamburg Amtsgericht Hamburg HRB 95242\nKRAUTHAMMER INTERNATIONAL GmbH – Hamburg",
      "type": "Registerbekanntmachung nach dem Umwandlungsgesetz",
      "state": "Hamburg",
      "amtsgericht": "Amtsgericht Hamburg",
      "registernummer": "HRB 95242",
      "registerart": "HRB",
      "company_name": "KRAUTHAMMER INTERNATIONAL GmbH",
      "company_seat": "Hamburg",
      "details": "09.01.2026 (Bekanntmachungsdatum)\n\nHamburg Amtsgericht Hamburg HRB 95242\nRegisterbekanntmachung nach dem Umwandlungsgesetz 09.01.2026 (Eintragungsdatum)\n\nKRAUTHAMMER INTERNATIONAL GmbH\nGesellschaft mit beschränkter Haftung\nHamburg\n\nAls nicht eingetragen wird bekannt gemacht:\nDen Gläubigern der an der Verschmelzung beteiligten Gesellschaften ist, wenn sie binnen sechs Monaten nach dem Tag, an dem die Eintragung der Verschmelzung in das Register des Sitzes desjenigen Rechtsträgers, dessen Gläubiger sie sind, nach § 19 Absatz 3 UmwG als bekannt gemacht gilt, ihren Anspruch nach Grund und Höhe schriftlich anmelden, Sicherheit zu leisten, soweit sie nicht Befriedigung verlangen können. Dieses Recht steht den Gläubigern jedoch nur zu, wenn sie glaubhaft machen, dass durch die Verschmelzung die Erfüllung ihrer Forderung gefährdet wird."
    },
    {
      "date": "2026-01-09",
      "id": "141979",
      "original_text": "Registerbekanntmachung nach dem Umwandlungsgesetz\nBaden-Württemberg Amtsgericht Freiburg PR 700157\nGemeinschaftspraxis für Radiologie Partnerschaft Dres. med. S. Dannenmaier/S. Lehnhardt – Freiburg im Breisgau",
      "type": "Registerbekanntmachung nach dem Umwandlungsgesetz",
      "state": "Baden-Württemberg",
      "amtsgericht": "Amtsgericht Freiburg",
      "registernummer": "PR 700157",
      "registerart": "PR",
      "company_name": "Gemeinschaftspraxis für Radiologie Partnerschaft Dres. med. S. Dannenmaier/S. Lehnhardt",
      "company_seat": "Freiburg im Breisgau",
      "details": "09.01.2026 (Bekanntmachungsdatum)\n\nBaden-Württemberg Amtsgericht Freiburg PR 700157\nRegisterbekanntmachung nach dem Umwandlungsgesetz 09.01.2026 (Eintragungsdatum)\n\nGemeinschaftspraxis für Radiologie Partnerschaft Dres. med. S. Dannenmaier/S. Lehnhardt\nPartnerschaftsgesellschaft\nFreiburg im Breisgau\n\nDie Gesellschaft wurde gemäß Beschluss vom 17.12.2025 formwechselnd umgewandelt in die MVZ Radiologie Freiburg GmbH (Amtsgericht Freiburg, HRB 734725). Den Gläubigern des an dem Formwechsel beteiligten Rechtsträgers ist, wenn sie binnen sechs Monaten nach dem Tag, an dem die Eintragung des Formwechsels in das Register des Sitzes desjenigen Rechtsträgers, dessen Gläubiger sie sind, nach § 19 Abs. 3 UmwG als bekanntgemacht gilt, ihren Anspruch nach Grund und Höhe schriftlich anmelden, Sicherheit zu leisten, soweit sie nicht Befriedigung verlangen können. Dieses Recht steht den Gläubigern jedoch nur zu, wenn sie glaubhaft machen, dass durch den Formwechsel die Erfüllung ihrer Forderung gefährdet wird."
    },
    {
      "date": "2026-01-09",
      "id": "141980",
      "original_text": "Sonstige Registerbekanntmachung\nBerlin Amtsgericht Berlin (Charlottenburg) HRB 197490\nNeustadt-Dosse PV GmbH – Berlin",
      "type": "Sonstige Registerbekanntmachung",
      "state": "Berlin",
      "amtsgericht": "Amtsgericht Berlin (Charlottenburg)",
      "registernummer": "HRB 197490",
      "registerart": "HRB",
      "company_name": "Neustadt-Dosse PV GmbH",
      "company_seat": "Berlin",
      "details": "09.01.2026 (Bekanntmachungsdatum)\n\nBerlin Amtsgericht Berlin (Charlottenburg) HRB 197490\nSonstige Registerbekanntmachung\n\nNeustadt-Dosse PV GmbH\nGesellschaft mit beschränkter Haftung\nBerlin\n\nAls nicht eingetragen wird veröffentlicht: Der andere Vertragsteil hat den Gläubigern dieses Rechtsträgers, deren Forderungen begründet worden sind, bevor die Eintragung der Beendigung dieses Vertrages in das Handelsregister nach § 10 des Handelsgesetzbuches als bekannt gemacht gilt, Sicherheit zu leisten, wenn sie sich binnen sechs Monaten nach der Bekanntmachung der Eintragung zu diesem Zweck bei ihm melden. Dieses Recht steht den Gläubigern nicht zu, die im Fall des Insolvenzverfahrens ein Recht auf vorzugsweise Befriedigung aus der Deckungsmasse haben, die nach gesetzlicher Vorschrift zu ihrem Schutz errichtet und staatlich überwacht ist."
    },
    {
      "date": "2026-01-09",
      "id": "141981",
      "original_text": "Registerbekanntmachung nach dem Umwandlungsgesetz\nBaden-Württemberg Amtsgericht Mannheim HRA 712502\nSL Hornstein Elektrotechnik GmbH & Co. KG – Wilhelmsfeld",
      "type": "Registerbekanntmachung nach dem Umwandlungsgesetz",
      "state": "Baden-Württemberg",
      "amtsgericht": "Amtsgericht Mannheim",
      "registernummer": "HRA 712502",
      "registerart": "HRA",
      "company_name": "SL Hornstein Elektrotechnik GmbH & Co. KG",
      "company_seat": "Wilhelmsfeld",
      "details": "09.01.2026 (Bekanntmachungsdatum)\n\nBaden-Württemberg Amtsgericht Mannheim HRA 712502\nRegisterbekanntmachung nach dem Umwandlungsgesetz 09.01.2026 (Eintragungsdatum)\n\nSL Hornstein Elektrotechnik GmbH & Co. KG\nKommanditgesellschaft\nWilhelmsfeld\n\nDen Gläubigern der an der Ausgliederung beteiligten Rechtsträger ist, wenn sie binnen sechs Monaten nach dem Tag, an dem die Eintragung der Ausgliederung in das Register des Sitzes desjenigen Rechtsträgers, dessen Gläubiger sie sind, nach § 19 Abs. 3 UmwG als bekanntgemacht gilt, ihren Anspruch nach Grund und Höhe schriftlich anmelden, Sicherheit zu leisten, soweit sie nicht Befriedigung verlangen können. Dieses Recht steht den Gläubigern jedoch nur zu, wenn sie glaubhaft machen, dass durch die Ausgliederung die Erfüllung ihrer Forderung gefährdet wird."
    },
    {
      "date": "2026-01-09",
      "id": "141982",
      "original_text": "Sonstige Registerbekanntmachung\nHamburg Amtsgericht Hamburg HRB 125441\nGerd Henning Malereibetrieb GmbH – Hamburg",
      "type": "Sonstige Registerbekanntmachung",
      "state": "Hamburg",
      "amtsgericht": "Amtsgericht Hamburg",
      "registernummer": "HRB 125441",
      "registerart": "HRB",
      "company_name": "Gerd Henning Malereibetrieb GmbH",
      "company_seat": "Hamburg",
      "details": "09.01.2026 (Bekanntmachungsdatum)\n\nHamburg Amtsgericht Hamburg HRB 125441\nSonstige Registerbekanntmachung 09.01.2026 (Eintragungsdatum)\n\nGerd Henning Malereibetrieb GmbH\nGesellschaft mit beschränkter Haftung\nHamburg\n\nAls nicht eingetragen wird bekannt gemacht:  Den Gläubigern der Gesellschaft, deren Forderungen begründet worden sind, bevor die Eintragung der Vertragsbeendigung in das Handelsregister nach § 10 HGB als bekannt gemacht gilt, ist vom anderen Vertragsteil Sicherheit zu leisten, wenn sie sich binnen 6 Monaten nach Bekanntmachung der Eintragung zu diesem Zweck bei ihm melden."
    },
    {
      "date": "2026-01-09",
      "id": "141983",
      "original_text": "Registerbekanntmachung nach dem Umwandlungsgesetz\nBerlin Amtsgericht Berlin (Charlottenburg) HRB 172856\nJKT Immobilien Holding GmbH – Berlin",
      "type": "Registerbekanntmachung nach dem Umwandlungsgesetz",
      "state": "Berlin",
      "amtsgericht": "Amtsgericht Berlin (Charlottenburg)",
      "registernummer": "HRB 172856",
      "registerart": "HRB",
      "company_name": "JKT Immobilien Holding GmbH",
      "company_seat": "Berlin",
      "details": "09.01.2026 (Bekanntmachungsdatum)\n\nBerlin Amtsgericht Berlin (Charlottenburg) HRB 172856\nRegisterbekanntmachung nach dem Umwandlungsgesetz 09.01.2026 (Eintragungsdatum)\n\nJKT Immobilien Holding GmbH\nGesellschaft mit beschränkter Haftung\nBerlin\n\nZu Eintragungsnummer 3 vom 09.01.2026 wird als nicht eingetragen veröffentlicht: Den Gläubigern der an der Spaltung beteiligten Rechtsträger ist, wenn sie binnen sechs Monaten nach dem Tag, an dem die Eintragung der Spaltung in das Register des Sitzes desjenigen Rechtsträgers, dessen Gläubiger sie sind, als bekannt gemacht gilt, ihren Anspruch nach Grund und Höhe schriftlich anmelden, Sicherheit zu leisten, soweit sie nicht Befriedigung verlangen können. Dieses Recht steht den Gläubigern jedoch nur zu, wenn sie glaubhaft machen, dass durch die Spaltung die Erfüllung ihrer Forderung gefährdet wird. Das Recht, Sicherheitsleistung zu verlangen, steht Gläubigern nicht zu, die im Falle der Insolvenz ein Recht auf vorzugsweise Befriedigung aus einer Deckungsmasse haben, die nach gesetzlicher Vorschrift zu ihrem Schutz errichtet und staatlich überwacht ist."
    },
    {
      "date": "2026-01-09",
      "id": "141984",
      "original_text": "Registerbekanntmachung nach dem Umwandlungsgesetz\nBerlin Amtsgericht Berlin (Charlottenburg) HRB 281545\nJKT Unternehmensverwaltung GmbH – Berlin",
      "type": "Registerbekanntmachung nach dem Umwandlungsgesetz",
      "state": "Berlin",
      "amtsgericht": "Amtsgericht Berlin (Charlottenburg)",
      "registernummer": "HRB 281545",
      "registerart": "HRB",
      "company_name": "JKT Unternehmensverwaltung GmbH",
      "company_seat": "Berlin",
      "details": "09.01.2026 (Bekanntmachungsdatum)\n\nBerlin Amtsgericht Berlin (Charlottenburg) HRB 281545\nRegisterbekanntmachung nach dem Umwandlungsgesetz 09.01.2026 (Eintragungsdatum)\n\nJKT Unternehmensverwaltung GmbH\nGesellschaft mit beschränkter Haftung\nBerlin\n\nZu Eintragungsnummer 2 vom 09.01.2026 wird als nicht eingetragen veröffentlicht: Den Gläubigern der an der Spaltung beteiligten Rechtsträger ist, wenn sie binnen sechs Monaten nach dem Tag, an dem die Eintragung der Spaltung in das Register des Sitzes desjenigen Rechtsträgers, dessen Gläubiger sie sind, als bekannt gemacht gilt, ihren Anspruch nach Grund und Höhe schriftlich anmelden, Sicherheit zu leisten, soweit sie nicht Befriedigung verlangen können. Dieses Recht steht den Gläubigern jedoch nur zu, wenn sie glaubhaft machen, dass durch die Spaltung die Erfüllung ihrer Forderung gefährdet wird. Das Recht, Sicherheitsleistung zu verlangen, steht Gläubigern nicht zu, die im Falle der Insolvenz ein Recht auf vorzugsweise Befriedigung aus einer Deckungsmasse haben, die nach gesetzlicher Vorschrift zu ihrem Schutz errichtet und staatlich überwacht ist."
    },
    {
      "date": "2026-01-09",
      "id": "141985",
      "original_text": "Einreichung neuer Dokumente\nBaden-Württemberg Amtsgericht Freiburg HRB 310897\nglobal-woods AG – Münstertal",
      "type": "Einreichung neuer Dokumente",
      "state": "Baden-Württemberg",
      "amtsgericht": "Amtsgericht Freiburg",
      "registernummer": "HRB 310897",
      "registerart": "HRB",
      "company_name": "global-woods AG",
      "company_seat": "Münstertal",
      "details": "09.01.2026 (Bekanntmachungsdatum)\n\nBaden-Württemberg Amtsgericht Freiburg HRB 310897\nEinreichung neuer Dokumente\n\nglobal-woods AG\nAktiengesellschaft\nMünstertal\n\nDie Gesellschaft hat am 09.01.2026 die Liste über die Zusammensetzung des Aufsichtsrats zum Handelsregister eingereicht."
    },
    {
      "date": "2026-01-09",
      "id": "141986",
      "original_text": "Löschungsankündigung\nBrandenburg Amtsgericht Neuruppin HRA 2992\nHSB Hausservice GmbH & Co. KG – Oberkrämer OT Marwitz",
      "type": "Löschungsankündigung",
      "state": "Brandenburg",
      "amtsgericht": "Amtsgericht Neuruppin",
      "registernummer": "HRA 2992",
      "registerart": "HRA",
      "company_name": "HSB Hausservice GmbH & Co. KG",
      "company_seat": "Oberkrämer OT Marwitz",
      "details": "09.01.2026 (Bekanntmachungsdatum)\n\nBrandenburg Amtsgericht Neuruppin HRA 2992\nLöschungsankündigung\n\nHSB Hausservice GmbH & Co. KG\nKommanditgesellschaft\nOberkrämer OT Marwitz\n\nBei der nachstehenden Gesellschaft wird das Amtslöschungsverfahren gemäß § 31 Abs. 2 HGB eingeleitet.\nWiderspruchsfrist: 1 Monat"
    },
    {
      "date": "2026-01-09",
      "id": "141987",
      "original_text": "Sonstige Registerbekanntmachung\nHamburg Amtsgericht Hamburg HRB 177207\nZillmer Messe- und Elektrotechnik GmbH services and event technology – Hamburg",
      "type": "Sonstige Registerbekanntmachung",
      "state": "Hamburg",
      "amtsgericht": "Amtsgericht Hamburg",
      "registernummer": "HRB 177207",
      "registerart": "HRB",
      "company_name": "Zillmer Messe- und Elektrotechnik GmbH services and event technology",
      "company_seat": "Hamburg",
      "details": "09.01.2026 (Bekanntmachungsdatum)\n\nHamburg Amtsgericht Hamburg HRB 177207\nSonstige Registerbekanntmachung 09.01.2026 (Eintragungsdatum)\n\nZillmer Messe- und Elektrotechnik GmbH services and event technology\nGesellschaft mit beschränkter Haftung\nHamburg\n\nAls nicht eingetragen wird bekannt gemacht:  Den Gläubigern der Gesellschaft, deren Forderungen begründet worden sind, bevor die Eintragung der Vertragsbeendigung in das Handelsregister nach § 10 HGB als bekannt gemacht gilt, ist vom anderen Vertragsteil Sicherheit zu leisten, wenn sie sich binnen 6 Monaten nach Bekanntmachung der Eintragung zu diesem Zweck bei ihm melden."
    },
    {
      "date": "2026-01-09",
      "id": "141988",
      "original_text": "Registerbekanntmachung nach dem Umwandlungsgesetz\nBaden-Württemberg Amtsgericht Stuttgart HRB 770645\nM.A.I. Ambulante Pflege GmbH – Stuttgart",
      "type": "Registerbekanntmachung nach dem Umwandlungsgesetz",
      "state": "Baden-Württemberg",
      "amtsgericht": "Amtsgericht Stuttgart",
      "registernummer": "HRB 770645",
      "registerart": "HRB",
      "company_name": "M.A.I. Ambulante Pflege GmbH",
      "company_seat": "Stuttgart",
      "details": "09.01.2026 (Bekanntmachungsdatum)\n\nBaden-Württemberg Amtsgericht Stuttgart HRB 770645\nRegisterbekanntmachung nach dem Umwandlungsgesetz 09.01.2026 (Eintragungsdatum)\n\nM.A.I. Ambulante Pflege GmbH\nGesellschaft mit beschränkter Haftung\nStuttgart\n\nAls nicht eingetragen wird bekanntgemacht:\nDen Gläubigern der an der Ausgliederung beteiligten Rechtsträger ist, wenn sie binnen sechs Monaten nach dem Tag, an dem die Eintragung der Ausgliederung in das Register des Sitzes desjenigen Rechtsträgers, dessen Gläubiger sie sind, nach § 19 Abs. 3 UmwG als bekanntgemacht gilt, ihren Anspruch nach Grund und Höhe schriftlich anmelden, Sicherheit zu leisten, soweit sie nicht Befriedigung verlangen können. Dieses Recht steht den Gläubigern jedoch nur zu, wenn sie glaubhaft machen, dass durch die Ausgliederung die Erfüllung ihrer Forderung gefährdet wird."
    },
    {
      "date": "2026-01-09",
      "id": "141989",
      "original_text": "Sonstige Registerbekanntmachung\nBaden-Württemberg Amtsgericht Stuttgart HRB 311145\nITsoft GmbH – Erdmannhausen",
      "type": "Sonstige Registerbekanntmachung",
      "state": "Baden-Württemberg",
      "amtsgericht": "Amtsgericht Stuttgart",
      "registernummer": "HRB 311145",
      "registerart": "HRB",
      "company_name": "ITsoft GmbH",
      "company_seat": "Erdmannhausen",
      "details": "09.01.2026 (Bekanntmachungsdatum)\n\nBaden-Württemberg Amtsgericht Stuttgart HRB 311145\nSonstige Registerbekanntmachung 09.01.2026 (Eintragungsdatum)\n\nITsoft GmbH\nGesellschaft mit beschränkter Haftung\nErdmannhausen\n\nAls nicht eingetragen wird bekanntgemacht:\nDen Gläubigern der Gesellschaft, deren Forderungen begründet worden sind, bevor die Eintragung der Beendigung des Vertrages in das Handelsregister nach § 10 HGB als bekanntgemacht gilt, ist vom anderen Vertragsteil Sicherheit zu leisten, wenn sie sich binnen sechs Monaten nach der Bekanntmachung zu diesem Zweck bei ihm melden."
    },
    {
      "date": "2026-01-09",
      "id": "141990",
      "original_text": "Registerbekanntmachung nach dem Umwandlungsgesetz\nHamburg Amtsgericht Hamburg HRB 144405\nBÖAG Projekt Aktiengesellschaft – Hamburg",
      "type": "Registerbekanntmachung nach dem Umwandlungsgesetz",
      "state": "Hamburg",
      "amtsgericht": "Amtsgericht Hamburg",
      "registernummer": "HRB 144405",
      "registerart": "HRB",
      "company_name": "BÖAG Projekt Aktiengesellschaft",
      "company_seat": "Hamburg",
      "details": "09.01.2026 (Bekanntmachungsdatum)\n\nHamburg Amtsgericht Hamburg HRB 144405\nRegisterbekanntmachung nach dem Umwandlungsgesetz 09.01.2026 (Eintragungsdatum)\n\nBÖAG Projekt Aktiengesellschaft\nAktiengesellschaft\nHamburg\n\nAls nicht eingetragen wird bekannt gemacht:\nDen Gläubigern der an der formwechselnden Umwandlung beteiligten Gesellschaften ist, wenn sie binnen sechs Monaten nach dem Tag, an dem die Eintragung der formwechselnden Umwandlung in das Register des Sitzes desjenigen Rechtsträgers, dessen Gläubiger sie sind, nach § 19 Absatz 3 UmwG als bekannt gemacht gilt, ihren Anspruch nach Grund und Höhe schriftlich anmelden, Sicherheit zu leisten, soweit sie nicht Befriedigung verlangen können. Dieses Recht steht den Gläubigern jedoch nur zu, wenn sie glaubhaft machen, dass durch die formwechselnde Umwandlung die Erfüllung ihrer Forderung gefährdet wird."
    },
    {
      "date": "2026-01-09",
      "id": "141991",
      "original_text": "Registerbekanntmachung nach dem Umwandlungsgesetz\nHamburg Amtsgericht Hamburg HRB 196427\nBÖAG Projekt GmbH – Hamburg",
      "type": "Registerbekanntmachung nach dem Umwandlungsgesetz",
      "state": "Hamburg",
      "amtsgericht": "Amtsgericht Hamburg",
      "registernummer": "HRB 196427",
      "registerart": "HRB",
      "company_name": "BÖAG Projekt GmbH",
      "company_seat": "Hamburg",
      "details": "09.01.2026 (Bekanntmachungsdatum)\n\nHamburg Amtsgericht Hamburg HRB 196427\nRegisterbekanntmachung nach dem Umwandlungsgesetz 09.01.2026 (Eintragungsdatum)\n\nBÖAG Projekt GmbH\nGesellschaft mit beschränkter Haftung\nHamburg\n\nAls nicht eingetragen wird bekannt gemacht: Den Gläubigern der an der formwechselnden Umwandlung beteiligten Gesellschaften ist, wenn sie binnen sechs Monaten nach dem Tag, an dem die Eintragung der formwechselnden Umwandlung in das Register des Sitzes desjenigen Rechtsträgers, dessen Gläubiger sie sind, nach § 19 Absatz 3 UmwG als bekannt gemacht gilt, ihren Anspruch nach Grund und Höhe schriftlich anmelden, Sicherheit zu leisten, soweit sie nicht Befriedigung verlangen können. Dieses Recht steht den Gläubigern jedoch nur zu, wenn sie glaubhaft machen, dass durch die formwechselnde Umwandlung die Erfüllung ihrer Forderung gefährdet wird."
    },
    {
      "date": "2026-01-09",
      "id": "141992",
      "original_text": "Sonstige Registerbekanntmachung\nSachsen Amtsgericht Leipzig HRB 36096\nTalkpool Deutschland AG – Leipzig",
      "type": "Sonstige Registerbekanntmachung",
      "state": "Sachsen",
      "amtsgericht": "Amtsgericht Leipzig",
      "registernummer": "HRB 36096",
      "registerart": "HRB",
      "company_name": "Talkpool Deutschland AG",
      "company_seat": "Leipzig",
      "details": "09.01.2026 (Bekanntmachungsdatum)\n\nSachsen Amtsgericht Leipzig HRB 36096\nSonstige Registerbekanntmachung\n\nTalkpool Deutschland AG\nAktiengesellschaft\nLeipzig\n\nAm 06.01.2026 wurde beim Handelsregister des Amtsgerichts Leipzig die Liste der Mitglieder des Aufsichtsrats gemäß § 106 AktG eingereicht."
    },
    {
      "date": "2026-01-09",
      "id": "141993",
      "original_text": "Registerbekanntmachung nach dem Umwandlungsgesetz\nSachsen Amtsgericht Chemnitz HRB 37987\nGEMAG GmbH – Gelenau/Erzgeb.",
      "type": "Registerbekanntmachung nach dem Umwandlungsgesetz",
      "state": "Sachsen",
      "amtsgericht": "Amtsgericht Chemnitz",
      "registernummer": "HRB 37987",
      "registerart": "HRB",
      "company_name": "GEMAG GmbH",
      "company_seat": "Gelenau/Erzgeb.",
      "details": "09.01.2026 (Bekanntmachungsdatum)\n\nSachsen Amtsgericht Chemnitz HRB 37987\nRegisterbekanntmachung nach dem Umwandlungsgesetz 09.01.2026 (Eintragungsdatum)\n\nGEMAG GmbH\nGesellschaft mit beschränkter Haftung\nGelenau/Erzgeb.\n\nDen Gläubigern der an der Umwandlung beteiligten Rechtsträger ist, wenn sie binnen sechs Monaten nach dem Tag, an dem die Eintragung der Umwandlung in das Register des Sitzes desjenigen Rechtsträgers, dessen Gläubiger sie sind, nach § 19 Abs. 3 UmwG als bekannt gemacht gilt, ihren Anspruch nach Grund und Höhe in Textform anmelden, Sicherheit zu leisten, soweit sie nicht Befriedigung verlangen können. Dieses Recht steht den Gläubigern jedoch nur zu, wenn sie glaubhaft machen, dass durch die Umwandlung die Erfüllung der Forderung gefährdet wird."
    },
    {
      "date": "2026-01-09",
      "id": "141994",
      "original_text": "Registerbekanntmachung nach dem Umwandlungsgesetz\nSachsen Amtsgericht Chemnitz HRB 2910\nGEMAG Gelenauer Maschinenbau Aktiengesellschaft – Gelenau",
      "type": "Registerbekanntmachung nach dem Umwandlungsgesetz",
      "state": "Sachsen",
      "amtsgericht": "Amtsgericht Chemnitz",
      "registernummer": "HRB 2910",
      "registerart": "HRB",
      "company_name": "GEMAG Gelenauer Maschinenbau Aktiengesellschaft",
      "company_seat": "Gelenau",
      "details": "09.01.2026 (Bekanntmachungsdatum)\n\nSachsen Amtsgericht Chemnitz HRB 2910\nRegisterbekanntmachung nach dem Umwandlungsgesetz 09.01.2026 (Eintragungsdatum)\n\nGEMAG Gelenauer Maschinenbau Aktiengesellschaft\nAktiengesellschaft\nGelenau\n\nDen Gläubigern der an der Umwandlung beteiligten Rechtsträger ist, wenn sie binnen sechs Monaten nach dem Tag, an dem die Eintragung der Umwandlung in das Register des Sitzes desjenigen Rechtsträgers, dessen Gläubiger sie sind, nach § 19 Abs. 3 UmwG als bekannt gemacht gilt, ihren Anspruch nach Grund und Höhe in Textform anmelden, Sicherheit zu leisten, soweit sie nicht Befriedigung verlangen können. Dieses Recht steht den Gläubigern jedoch nur zu, wenn sie glaubhaft machen, dass durch die Umwandlung die Erfüllung der Forderung gefährdet wird."
    },
    {
      "date": "2026-01-09",
      "id": "141995",
      "original_text": "Registerbekanntmachung nach dem Umwandlungsgesetz\nSachsen Amtsgericht Chemnitz HRB 30440\nOMEGA Blechbearbeitung Limbach-Oberfrohna AG – Limbach-Oberfrohna",
      "type": "Registerbekanntmachung nach dem Umwandlungsgesetz",
      "state": "Sachsen",
      "amtsgericht": "Amtsgericht Chemnitz",
      "registernummer": "HRB 30440",
      "registerart": "HRB",
      "company_name": "OMEGA Blechbearbeitung Limbach-Oberfrohna AG",
      "company_seat": "Limbach-Oberfrohna",
      "details": "09.01.2026 (Bekanntmachungsdatum)\n\nSachsen Amtsgericht Chemnitz HRB 30440\nRegisterbekanntmachung nach dem Umwandlungsgesetz 09.01.2026 (Eintragungsdatum)\n\nOMEGA Blechbearbeitung Limbach-Oberfrohna AG\nAktiengesellschaft\nLimbach-Oberfrohna\n\nDen Gläubigern der an der Umwandlung beteiligten Rechtsträger ist, wenn sie binnen sechs Monaten nach dem Tag, an dem die Eintragung der Umwandlung in das Register des Sitzes desjenigen Rechtsträgers, dessen Gläubiger sie sind, nach § 19 Abs. 3 UmwG als bekannt gemacht gilt, ihren Anspruch nach Grund und Höhe in Textform anmelden, Sicherheit zu leisten, soweit sie nicht Befriedigung verlangen können. Dieses Recht steht den Gläubigern jedoch nur zu, wenn sie glaubhaft machen, dass durch die Umwandlung die Erfüllung der Forderung gefährdet wird."
    },
    {
      "date": "2026-01-09",
      "id": "141996",
      "original_text": "Löschungsankündigung\nSachsen Amtsgericht Chemnitz HRB 26841\nintacto Hausgeräte + Küchen GmbH – Meerane",
      "type": "Löschungsankündigung",
      "state": "Sachsen",
      "amtsgericht": "Amtsgericht Chemnitz",
      "registernummer": "HRB 26841",
      "registerart": "HRB",
      "company_name": "intacto Hausgeräte + Küchen GmbH",
      "company_seat": "Meerane",
      "details": "09.01.2026 (Bekanntmachungsdatum)\n\nSachsen Amtsgericht Chemnitz HRB 26841\nLöschungsankündigung 09.01.2026 (Eintragungsdatum)\n\nintacto Hausgeräte + Küchen GmbH\nGesellschaft mit beschränkter Haftung\nMeerane\n\nDas Registergericht beabsichtigt, die im Handelsregister eingetragene Gesellschaft von Amts wegen nach § 394 FamFG zu löschen. Die Frist zu Erhebung eines Widerspruchs gegen die beabsichtigte Löschung wird auf einen Monat festgesetzt."
    },
    {
      "date": "2026-01-09",
      "id": "141997",
      "original_text": "Registerbekanntmachung nach dem Umwandlungsgesetz\nSachsen Amtsgericht Chemnitz HRB 37988\nOMEGA GmbH – Limbach-Oberfrohna",
      "type": "Registerbekanntmachung nach dem Umwandlungsgesetz",
      "state": "Sachsen",
      "amtsgericht": "Amtsgericht Chemnitz",
      "registernummer": "HRB 37988",
      "registerart": "HRB",
      "company_name": "OMEGA GmbH",
      "company_seat": "Limbach-Oberfrohna",
      "details": "09.01.2026 (Bekanntmachungsdatum)\n\nSachsen Amtsgericht Chemnitz HRB 37988\nRegisterbekanntmachung nach dem Umwandlungsgesetz 09.01.2026 (Eintragungsdatum)\n\nOMEGA GmbH\nGesellschaft mit beschränkter Haftung\nLimbach-Oberfrohna\n\nDen Gläubigern der an der Umwandlung beteiligten Rechtsträger ist, wenn sie binnen sechs Monaten nach dem Tag, an dem die Eintragung der Umwandlung in das Register des Sitzes desjenigen Rechtsträgers, dessen Gläubiger sie sind, nach § 19 Abs. 3 UmwG als bekannt gemacht gilt, ihren Anspruch nach Grund und Höhe in Textform anmelden, Sicherheit zu leisten, soweit sie nicht Befriedigung verlangen können. Dieses Recht steht den Gläubigern jedoch nur zu, wenn sie glaubhaft machen, dass durch die Umwandlung die Erfüllung der Forderung gefährdet wird."
    },
    {
      "date": "2026-01-09",
      "id": "141998",
      "original_text": "Löschungsankündigung\nSachsen Amtsgericht Leipzig HRB 41208\nFMC Beteiligungen UG (haftungsbeschränkt) – Leipzig",
      "type": "Löschungsankündigung",
      "state": "Sachsen",
      "amtsgericht": "Amtsgericht Leipzig",
      "registernummer": "HRB 41208",
      "registerart": "HRB",
      "company_name": "FMC Beteiligungen UG (haftungsbeschränkt)",
      "company_seat": "Leipzig",
      "details": "09.01.2026 (Bekanntmachungsdatum)\n\nSachsen Amtsgericht Leipzig HRB 41208\nLöschungsankündigung 09.01.2026 (Eintragungsdatum)\n\nFMC Beteiligungen UG (haftungsbeschränkt)\nGesellschaft mit beschränkter Haftung\nLeipzig\n\nDas Registergericht beabsichtigt, den im Handelsregister eingetragenen Geschäftsführer Sven Frommelt von Amts wegen nach § 395 Absatz 1 FamFG zu löschen. Die Frist zu Erhebung eines Widerspruchs gegen die beabsichtigte Löschung wird auf einen Monat festgesetzt."
    },
    {
      "date": "2026-01-09",
      "id": "141999",
      "original_text": "Sonstige Registerbekanntmachung\nSachsen Amtsgericht Chemnitz HRB 23782\nMIM Steel Processing GmbH – Treuen",
      "type": "Sonstige Registerbekanntmachung",
      "state": "Sachsen",
      "amtsgericht": "Amtsgericht Chemnitz",
      "registernummer": "HRB 23782",
      "registerart": "HRB",
      "company_name": "MIM Steel Processing GmbH",
      "company_seat": "Treuen",
      "details": "09.01.2026 (Bekanntmachungsdatum)\n\nSachsen Amtsgericht Chemnitz HRB 23782\nSonstige Registerbekanntmachung 09.01.2026 (Eintragungsdatum)\n\nMIM Steel Processing GmbH\nGesellschaft mit beschränkter Haftung\nTreuen\n\nDen Gläubigern der Gesellschaft, deren Forderungen begründet worden sind bevor die Eintragung der Beendigung des Gewinnabführungsvertrages in das Handelsregister nach § 10 des Handelsgesetzbuches als bekanntgemacht gilt, hat der andere Vertragsteil Sicherheit zu leisten, wenn sie sich binnen sechs Monaten nach der Bekanntmachung der Eintragung zu diesem Zweck bei ihm melden."
    },
    {
      "date": "2026-01-09",
      "id": "142000",
      "original_text": "Löschungsankündigung\nSachsen Amtsgericht Dresden HRB 40027\nAcantio GmbH – Dresden",
      "type": "Löschungsankündigung",
      "state": "Sachsen",
      "amtsgericht": "Amtsgericht Dresden",
      "registernummer": "HRB 40027",
      "registerart": "HRB",
      "company_name": "Acantio GmbH",
      "company_seat": "Dresden",
      "details": "09.01.2026 (Bekanntmachungsdatum)\n\nSachsen Amtsgericht Dresden HRB 40027\nLöschungsankündigung\n\nAcantio GmbH\nGesellschaft mit beschränkter Haftung\nDresden\n\nDas Registergericht beabsichtigt, die im Handelsregister eingetragene Gesellschaft von Amts wegen nach § 394 FamFG zu löschen. Die Frist zu Erhebung eines Widerspruchs gegen die beabsichtigte Löschung wird auf einen Monat festgesetzt."
    },
    {
      "date": "2026-01-09",
      "id": "142001",
      "original_text": "Sonstige Registerbekanntmachung\nSachsen Amtsgericht Leipzig HRB 31465\nVNG Innovation GmbH – Leipzig",
      "type": "Sonstige Registerbekanntmachung",
      "state": "Sachsen",
      "amtsgericht": "Amtsgericht Leipzig",
      "registernummer": "HRB 31465",
      "registerart": "HRB",
      "company_name": "VNG Innovation GmbH",
      "company_seat": "Leipzig",
      "details": "09.01.2026 (Bekanntmachungsdatum)\n\nSachsen Amtsgericht Leipzig HRB 31465\nSonstige Registerbekanntmachung 09.01.2026 (Eintragungsdatum)\n\nVNG Innovation GmbH\nGesellschaft mit beschränkter Haftung\nLeipzig\n\nDen Gläubigern der Gesellschaft, deren Forderungen begründet worden sind bevor die Eintragung der Beendigung des Beherrschungs- und Gewinnabführungsvertrages in das Handelsregister nach § 10 des Handelsgesetzbuches als bekanntgemacht gilt, hat der andere Vertragsteil Sicherheit zu leisten, wenn sie sich binnen sechs Monaten nach der Bekanntmachung der Eintragung zu diesem Zweck bei ihm melden."
    },
    {
      "date": "2026-01-09",
      "id": "142002",
      "original_text": "Registerbekanntmachung nach dem Umwandlungsgesetz\nNiedersachsen Amtsgericht Tostedt HRB 212003\nKolibri Grundbesitz GmbH – Heeslingen",
      "type": "Registerbekanntmachung nach dem Umwandlungsgesetz",
      "state": "Niedersachsen",
      "amtsgericht": "Amtsgericht Tostedt",
      "registernummer": "HRB 212003",
      "registerart": "HRB",
      "company_name": "Kolibri Grundbesitz GmbH",
      "company_seat": "Heeslingen",
      "details": "09.01.2026 (Bekanntmachungsdatum)\n\nNiedersachsen Amtsgericht Tostedt HRB 212003\nRegisterbekanntmachung nach dem Umwandlungsgesetz 09.01.2026 (Eintragungsdatum)\n\nKolibri Grundbesitz GmbH\nGesellschaft mit beschränkter Haftung\nHeeslingen\n\nDen Gläubigern der an der formwechselnden Umwandlung beteiligten Rechtsträger ist, wenn sie binnen sechs Monaten nach dem Tag, an dem die Eintragung der Umwandlung in das Register des Sitzes desjenigen Rechtsträgers, dessen Gläubiger sie sind, nach § 19 Abs. 3 UmwG als bekannt gemacht gilt, ihren Anspruch nach Grund und Höhe schriftlich anmelden, Sicherheit zu leisten, soweit sie nicht Befriedigung verlangen können. Dieses Recht steht den Gläubigern jedoch nur zu, wenn sie glaubhaft machen, dass durch die formwechselnde Umwandlung die Erfüllung der Forderung gefährdet wird."
    },
    {
      "date": "2026-01-09",
      "id": "142003",
      "original_text": "Löschungsankündigung\nNiedersachsen Amtsgericht Osnabrück HRB 207310\nPapenburger Druck GmbH – Papenburg",
      "type": "Löschungsankündigung",
      "state": "Niedersachsen",
      "amtsgericht": "Amtsgericht Osnabrück",
      "registernummer": "HRB 207310",
      "registerart": "HRB",
      "company_name": "Papenburger Druck GmbH",
      "company_seat": "Papenburg",
      "details": "09.01.2026 (Bekanntmachungsdatum)\n\nNiedersachsen Amtsgericht Osnabrück HRB 207310\nLöschungsankündigung\n\nPapenburger Druck GmbH\nGesellschaft mit beschränkter Haftung\nPapenburg\n\nDas Registergericht beabsichtigt, die Gesellschaft von Amts wegen nach § 394 FamFG wegen Vermögenslosigkeit zu löschen. Die Frist zur Erhebung eines Widerspruchs ist auf 1 Monat ab dieser Registerbekanntmachung festgesetzt."
    },
    {
      "date": "2026-01-09",
      "id": "142004",
      "original_text": "Löschungsankündigung\nNiedersachsen Amtsgericht Lüneburg HRB 210069\nBauservice Kraasz UG (haftungsbeschränkt) Holz und Bautenschutz – Eldingen",
      "type": "Löschungsankündigung",
      "state": "Niedersachsen",
      "amtsgericht": "Amtsgericht Lüneburg",
      "registernummer": "HRB 210069",
      "registerart": "HRB",
      "company_name": "Bauservice Kraasz UG (haftungsbeschränkt) Holz und Bautenschutz",
      "company_seat": "Eldingen",
      "details": "09.01.2026 (Bekanntmachungsdatum)\n\nNiedersachsen Amtsgericht Lüneburg HRB 210069\nLöschungsankündigung\n\nBauservice Kraasz UG (haftungsbeschränkt) Holz und Bautenschutz\nGesellschaft mit beschränkter Haftung\nEldingen\n\nDas Registergericht beabsichtigt, die Gesellschaft von Amts wegen nach § 394 FamFG zu löschen. Die Frist zur Erhebung eines Widerspruchs ist auf 1 Monat ab dieser Registerbekanntmachung festgesetzt."
    },
    {
      "date": "2026-01-09",
      "id": "142005",
      "original_text": "Registerbekanntmachung nach dem Umwandlungsgesetz\nBrandenburg Amtsgericht Frankfurt/Oder HRB 8652\nSpree-Fisch GmbH – Bad Saarow",
      "type": "Registerbekanntmachung nach dem Umwandlungsgesetz",
      "state": "Brandenburg",
      "amtsgericht": "Amtsgericht Frankfurt/Oder",
      "registernummer": "HRB 8652",
      "registerart": "HRB",
      "company_name": "Spree-Fisch GmbH",
      "company_seat": "Bad Saarow",
      "details": "09.01.2026 (Bekanntmachungsdatum)\n\nBrandenburg Amtsgericht Frankfurt/Oder HRB 8652\nRegisterbekanntmachung nach dem Umwandlungsgesetz 02.01.2026 (Eintragungsdatum)\n\nSpree-Fisch GmbH\nGesellschaft mit beschränkter Haftung\nBad Saarow\n\nZu Eintragungsnummer 7 vom 02.01.2026 wird als nicht eingetragen veröffentlicht:\nDen Gläubigern der an der Verschmelzung beteiligten Rechtsträger ist, wenn sie binnen sechs Monaten nach dem Tag, an dem die Eintragung der Verschmelzung in das Register des Sitzes desjenigen Rechtsträgers, dessen Gläubiger sie sind, als bekannt gemacht gilt, ihren Anspruch nach Grund und Höhe schriftlich anmelden, Sicherheit zu leisten, soweit sie nicht Befriedigung verlangen können. Dieses Recht steht den Gläubigern jedoch nur zu, wenn sie glaubhaft machen, dass durch die Verschmelzung die Erfüllung ihrer Forderung gefährdet wird"
    },
    {
      "date": "2026-01-09",
      "id": "142006",
      "original_text": "Registerbekanntmachung nach dem Umwandlungsgesetz\nBremen Amtsgericht Bremen HRB 20622\nMeVis BreastCare Verwaltungsgesellschaft mbH – Bremen",
      "type": "Registerbekanntmachung nach dem Umwandlungsgesetz",
      "state": "Bremen",
      "amtsgericht": "Amtsgericht Bremen",
      "registernummer": "HRB 20622",
      "registerart": "HRB",
      "company_name": "MeVis BreastCare Verwaltungsgesellschaft mbH",
      "company_seat": "Bremen",
      "details": "09.01.2026 (Bekanntmachungsdatum)\n\nBremen Amtsgericht Bremen HRB 20622\nRegisterbekanntmachung nach dem Umwandlungsgesetz 08.12.2023 (Eintragungsdatum)\n\nMeVis BreastCare Verwaltungsgesellschaft mbH\nGesellschaft mit beschränkter Haftung\nBremen\n\nAls nicht eingetragen wird bekannt gemacht: Der Entwurf eines Verschmelzungsvertrages wurde eingereicht."
    },
    {
      "date": "2026-01-09",
      "id": "142007",
      "original_text": "Registerbekanntmachung nach dem Umwandlungsgesetz\nBremen Amtsgericht Bremen HRB 23791\nMeVis Medical Solutions AG – Bremen",
      "type": "Registerbekanntmachung nach dem Umwandlungsgesetz",
      "state": "Bremen",
      "amtsgericht": "Amtsgericht Bremen",
      "registernummer": "HRB 23791",
      "registerart": "HRB",
      "company_name": "MeVis Medical Solutions AG",
      "company_seat": "Bremen",
      "details": "09.01.2026 (Bekanntmachungsdatum)\n\nBremen Amtsgericht Bremen HRB 23791\nRegisterbekanntmachung nach dem Umwandlungsgesetz 17.04.2025 (Eintragungsdatum)\n\nMeVis Medical Solutions AG\nAktiengesellschaft\nBremen\n\nAls nicht eingetragen wird bekannt gemacht: Der Entwurf eines Verschmelzungsvertrages wurde eingereicht."
    },
    {
      "date": "2026-01-09",
      "id": "142008",
      "original_text": "Registerbekanntmachung nach dem Umwandlungsgesetz\nBremen Amtsgericht Bremen HRB 42230\nDeutsche Schiffahrts-Treuhand GmbH – Bremen",
      "type": "Registerbekanntmachung nach dem Umwandlungsgesetz",
      "state": "Bremen",
      "amtsgericht": "Amtsgericht Bremen",
      "registernummer": "HRB 42230",
      "registerart": "HRB",
      "company_name": "Deutsche Schiffahrts-Treuhand GmbH",
      "company_seat": "Bremen",
      "details": "09.01.2026 (Bekanntmachungsdatum)\n\nBremen Amtsgericht Bremen HRB 42230\nRegisterbekanntmachung nach dem Umwandlungsgesetz 05.01.2026 (Eintragungsdatum)\n\nDeutsche Schiffahrts-Treuhand GmbH\nGesellschaft mit beschränkter Haftung\nBremen\n\nZu Eintragungsnummer 1 vom 05.01.2026 wird als nicht eingetragen veröffentlicht: Den Gläubigern ist, wenn sie binnen sechs Monaten nach dem Tag, an dem die Eintragung der Umwandlung als bekannt gemacht gilt, ihren Anspruch nach Grund und Höhe schriftlich anmelden, Sicherheit zu leisten, soweit sie nicht Befriedigung verlangen können. Dieses Recht steht den Gläubigern jedoch nur zu, wenn sie glaubhaft machen, dass durch die Umwandlung die Erfüllung ihrer Forderung gefährdet wird. Das Recht, Sicherheitsleistung zu verlangen, steht Gläubigern nicht zu, die im Falle der Insolvenz ein Recht auf vorzugsweise Befriedigung aus einer Deckungsmasse haben, die nach gesetzlicher Vorschrift zu ihrem Schutz errichtet und staatlich überwacht ist."
    },
    {
      "date": "2026-01-09",
      "id": "142009",
      "original_text": "Registerbekanntmachung nach dem Umwandlungsgesetz\nBremen Amtsgericht Bremen HRB 41829\nDeutsche Schiffahrts-Treuhand Aktiengesellschaft – Bremen",
      "type": "Registerbekanntmachung nach dem Umwandlungsgesetz",
      "state": "Bremen",
      "amtsgericht": "Amtsgericht Bremen",
      "registernummer": "HRB 41829",
      "registerart": "HRB",
      "company_name": "Deutsche Schiffahrts-Treuhand Aktiengesellschaft",
      "company_seat": "Bremen",
      "details": "09.01.2026 (Bekanntmachungsdatum)\n\nBremen Amtsgericht Bremen HRB 41829\nRegisterbekanntmachung nach dem Umwandlungsgesetz 05.01.2026 (Eintragungsdatum)\n\nDeutsche Schiffahrts-Treuhand Aktiengesellschaft\nAktiengesellschaft\nBremen\n\nZu Eintragungsnummer 2 vom 05.01.2026 wird als nicht eingetragen veröffentlicht: Den Gläubigern ist, wenn sie binnen sechs Monaten nach dem Tag, an dem die Eintragung der Umwandlung als bekannt gemacht gilt, ihren Anspruch nach Grund und Höhe schriftlich anmelden, Sicherheit zu leisten, soweit sie nicht Befriedigung verlangen können. Dieses Recht steht den Gläubigern jedoch nur zu, wenn sie glaubhaft machen, dass durch die Umwandlung die Erfüllung ihrer Forderung gefährdet wird. Das Recht, Sicherheitsleistung zu verlangen, steht Gläubigern nicht zu, die im Falle der Insolvenz ein Recht auf vorzugsweise Befriedigung aus einer Deckungsmasse haben, die nach gesetzlicher Vorschrift zu ihrem Schutz errichtet und staatlich überwacht ist."
    },
    {
      "date": "2026-01-09",
      "id": "142010",
      "original_text": "Einreichung neuer Dokumente\nRheinland-Pfalz Amtsgericht Mainz HRB 23260\nBoehringer Ingelheim Deutschland GmbH – Ingelheim am Rhein",
      "type": "Einreichung neuer Dokumente",
      "state": "Rheinland-Pfalz",
      "amtsgericht": "Amtsgericht Mainz",
      "registernummer": "HRB 23260",
      "registerart": "HRB",
      "company_name": "Boehringer Ingelheim Deutschland GmbH",
      "company_seat": "Ingelheim am Rhein",
      "details": "09.01.2026 (Bekanntmachungsdatum)\n\nRheinland-Pfalz Amtsgericht Mainz HRB 23260\nEinreichung neuer Dokumente\n\nBoehringer Ingelheim Deutschland GmbH\nGesellschaft mit beschränkter Haftung\nIngelheim am Rhein\n\nDem Registergericht ist eine Liste der Mitglieder des Aufsichtsrates eingereicht worden."
    },
    {
      "date": "2026-01-09",
      "id": "142011",
      "original_text": "Löschungsankündigung\nNordrhein-Westfalen Amtsgericht Köln HRA 33653\nQue Sera GmbH & Co.KG – Köln",
      "type": "Löschungsankündigung",
      "state": "Nordrhein-Westfalen",
      "amtsgericht": "Amtsgericht Köln",
      "registernummer": "HRA 33653",
      "registerart": "HRA",
      "company_name": "Que Sera GmbH & Co.KG",
      "company_seat": "Köln",
      "details": "09.01.2026 (Bekanntmachungsdatum)\n\nNordrhein-Westfalen Amtsgericht Köln HRA 33653\nLöschungsankündigung\n\nQue Sera GmbH & Co.KG\nKommanditgesellschaft\nKöln\n\nDas Registergericht beabsichtigt die Firma von Amts wegen nach § 394 FamFG zu löschen. Die Frist zur Erhebung eines Widerspruchs ist auf zwei Monate festgesetzt."
    },
    {
      "date": "2026-01-09",
      "id": "142012",
      "original_text": "Löschungsankündigung\nNordrhein-Westfalen Amtsgericht Düsseldorf HRA 21285\nOffice Teltow Oderstraße GmbH & Co. KG – Düsseldorf",
      "type": "Löschungsankündigung",
      "state": "Nordrhein-Westfalen",
      "amtsgericht": "Amtsgericht Düsseldorf",
      "registernummer": "HRA 21285",
      "registerart": "HRA",
      "company_name": "Office Teltow Oderstraße GmbH & Co. KG",
      "company_seat": "Düsseldorf",
      "details": "09.01.2026 (Bekanntmachungsdatum)\n\nNordrhein-Westfalen Amtsgericht Düsseldorf HRA 21285\nLöschungsankündigung 08.01.2026 (Eintragungsdatum)\n\nOffice Teltow Oderstraße GmbH & Co. KG\nKommanditgesellschaft\nDüsseldorf\n\nDas Registergericht beabsichtigt die Firma von Amts wegen nach § 394 FamFG zu löschen. Die Frist zur Erhebung eines Widerspruchs ist auf einen Monat festgesetzt.\n\nRechtsbehelfsbelehrung:\nDas Widerspruchsrecht steht jedem zu, der an der Unterlassung der Löschung ein berechtigtes Interesse hat. Der Widerspruch ist bei dem Amtsgericht Düsseldorf -Registergericht-, Werdener Straße 1, 40227 Düsseldorf schriftlich in deutscher Sprache oder zur Niederschrift der Geschäftsstelle einzulegen. Der Widerspruch kann auch zur Niederschrift der Geschäftsstelle eines jeden Amtsgerichtes abgegeben werden. Die Einlegung ist auch durch Übertragung eines elektronischen Dokuments an die elektronische Poststelle des Gerichts möglich. Das elektronische Dokument muss für die Bearbeitung durch das Gericht geeignet und mit einer qualifizierten elektronischen Signatur der verantwortenden Person versehen sein oder von der verantwortenden Person signiert und auf einem sicheren Übermittlungsweg gemäß § 130a ZPO nach näherer Maßgabe der Verordnung über die technischen Rahmenbedingungen des elektronischen Rechtsverkehrs und über das besondere elektronische Behördenpostfach (BGBl. I, S.3803) eingereicht werden. Weitere Informationen erhalten Sie auf der Internetseite www.justiz.de.\nDer Widerspruch muss spätestens innerhalb der gesetzten Frist nach dem Datum der Bekanntmachung der Löschungsankündigung bei dem Amtsgericht - Registergericht - Düsseldorf eingegangen sein.  Dies gilt auch dann, wenn der Widerspruch zur Niederschrift der Geschäftsstelle eines anderen Amtsgerichtes abgegeben wurde. Die Frist beginnt mit dem Tage der Bekanntmachung der Löschungsankündigung in dem für die Bekanntmachung der Eintragungen in das Handelsregister bestimmten elektronischen Informations- und Kommunikationssystem nach § 10 des Handelsgesetzbuches. Fällt das Ende der Frist auf einen Sonntag, einen allgemeinen Feiertag oder Sonnabend, so endet die Frist mit Ablauf des nächsten Werktages.\nDer Widerspruch muss die Bezeichnung der angefochtenen Löschungsankündigung sowie die Erklärung enthalten, dass Widerspruch gegen diese Löschungsankündigung eingelegt wird. Er ist zu unterzeichnen und soll begründet werden."
    },
    {
      "date": "2026-01-09",
      "id": "142013",
      "original_text": "Löschungsankündigung\nNordrhein-Westfalen Amtsgericht Mönchengladbach HRB 19752\nMein Kontor UG (haftungsbeschränkt) – Mönchengladbach",
      "type": "Löschungsankündigung",
      "state": "Nordrhein-Westfalen",
      "amtsgericht": "Amtsgericht Mönchengladbach",
      "registernummer": "HRB 19752",
      "registerart": "HRB",
      "company_name": "Mein Kontor UG (haftungsbeschränkt)",
      "company_seat": "Mönchengladbach",
      "details": "09.01.2026 (Bekanntmachungsdatum)\n\nNordrhein-Westfalen Amtsgericht Mönchengladbach HRB 19752\nLöschungsankündigung\n\nMein Kontor UG (haftungsbeschränkt)\nGesellschaft mit beschränkter Haftung\nMönchengladbach\n\nDas Registergericht beabsichtigt die Gesellschaft von Amts wegen nach § 394 FamFG zu löschen. Die Frist zur Erhebung eines Widerspruchs ist auf zwei Monate festgesetzt."
    },
    {
      "date": "2026-01-09",
      "id": "142014",
      "original_text": "Einreichung neuer Dokumente\nNordrhein-Westfalen Amtsgericht Köln HRB 84559\nBäderbetriebsgesellschaft Bergisch Gladbach mbH – Bergisch Gladbach",
      "type": "Einreichung neuer Dokumente",
      "state": "Nordrhein-Westfalen",
      "amtsgericht": "Amtsgericht Köln",
      "registernummer": "HRB 84559",
      "registerart": "HRB",
      "company_name": "Bäderbetriebsgesellschaft Bergisch Gladbach mbH",
      "company_seat": "Bergisch Gladbach",
      "details": "09.01.2026 (Bekanntmachungsdatum)\n\nNordrhein-Westfalen Amtsgericht Köln HRB 84559\nEinreichung neuer Dokumente\n\nBäderbetriebsgesellschaft Bergisch Gladbach mbH\nGesellschaft mit beschränkter Haftung\nBergisch Gladbach\n\nDem Registergericht ist eine neue Liste der Mitglieder des Aufsichtsrates eingereicht worden."
    },
    {
      "date": "2026-01-09",
      "id": "142015",
      "original_text": "Registerbekanntmachung nach dem Umwandlungsgesetz\nNordrhein-Westfalen Amtsgericht Arnsberg HRB 2643\nIndoor-Kartbahn in Winterberg Betriebsgesellschaft mbH – Winterberg",
      "type": "Registerbekanntmachung nach dem Umwandlungsgesetz",
      "state": "Nordrhein-Westfalen",
      "amtsgericht": "Amtsgericht Arnsberg",
      "registernummer": "HRB 2643",
      "registerart": "HRB",
      "company_name": "Indoor-Kartbahn in Winterberg Betriebsgesellschaft mbH",
      "company_seat": "Winterberg",
      "details": "09.01.2026 (Bekanntmachungsdatum)\n\nNordrhein-Westfalen Amtsgericht Arnsberg HRB 2643\nRegisterbekanntmachung nach dem Umwandlungsgesetz 09.01.2026 (Eintragungsdatum)\n\nIndoor-Kartbahn in Winterberg Betriebsgesellschaft mbH\nGesellschaft mit beschränkter Haftung\nWinterberg\n\nDen Gläubigern der an der Verschmelzung beteiligten Rechtsträger ist, wenn sie binnen sechs Monaten nach dem Tag, an dem die Eintragung der Verschmelzung in das Register des Sitzes desjenigen Rechtsträgers, dessen Gläubiger sie sind, nach § 19 Absatz 3 UmwG als bekanntgemacht gilt, ihren Anspruch nach Grund und Höhe schriftlich anmelden, Sicherheit zu leisten, soweit sie nicht Befriedigung verlangen können. Dieses Recht steht den Gläubigern jedoch nur zu, wenn sie glaubhaft machen, dass durch die Verschmelzung die Erfüllung ihrer Forderung gefährdet wird."
    },
    {
      "date": "2026-01-09",
      "id": "142016",
      "original_text": "Sonstige Registerbekanntmachung\nNordrhein-Westfalen Amtsgericht Lemgo HRB 3420\nStadtwerke Detmold GmbH – Detmold",
      "type": "Sonstige Registerbekanntmachung",
      "state": "Nordrhein-Westfalen",
      "amtsgericht": "Amtsgericht Lemgo",
      "registernummer": "HRB 3420",
      "registerart": "HRB",
      "company_name": "Stadtwerke Detmold GmbH",
      "company_seat": "Detmold",
      "details": "09.01.2026 (Bekanntmachungsdatum)\n\nNordrhein-Westfalen Amtsgericht Lemgo HRB 3420\nSonstige Registerbekanntmachung\n\nStadtwerke Detmold GmbH\nGesellschaft mit beschränkter Haftung\nDetmold\n\nDem Registergericht ist eine Liste der Mitglieder des Aufsichtsrates eingereicht worden."
    },
    {
      "date": "2026-01-09",
      "id": "142017",
      "original_text": "Löschungsankündigung\nNordrhein-Westfalen Amtsgericht Düsseldorf HRB 65367\neda.c Verwaltungs GmbH – Düsseldorf",
      "type": "Löschungsankündigung",
      "state": "Nordrhein-Westfalen",
      "amtsgericht": "Amtsgericht Düsseldorf",
      "registernummer": "HRB 65367",
      "registerart": "HRB",
      "company_name": "eda.c Verwaltungs GmbH",
      "company_seat": "Düsseldorf",
      "details": "09.01.2026 (Bekanntmachungsdatum)\n\nNordrhein-Westfalen Amtsgericht Düsseldorf HRB 65367\nLöschungsankündigung\n\neda.c Verwaltungs GmbH\nGesellschaft mit beschränkter Haftung\nDüsseldorf\n\nDas Registergericht beabsichtigt die Gesellschaft von Amts wegen nach § 394 FamFG zu löschen. Die Frist zur Erhebung eines Widerspruchs ist auf 3 Wochen festgesetzt.\n\nRechtsbehelfsbelehrung:\nDas Widerspruchsrecht steht jedem zu, der an der Unterlassung der Löschung ein berechtigtes Interesse hat. Der Widerspruch ist bei dem Amtsgericht Düsseldorf -Registergericht-, Werdener Straße 1, 40227 Düsseldorf schriftlich in deutscher Sprache oder zur Niederschrift der Geschäftsstelle einzulegen. Der Widerspruch kann auch zur Niederschrift der Geschäftsstelle eines jeden Amtsgerichtes abgegeben werden. Die Einlegung ist auch durch Übertragung eines elektronischen Dokuments an die elektronische Poststelle des Gerichts möglich. Das elektronische Dokument muss für die Bearbeitung durch das Gericht geeignet und mit einer qualifizierten elektronischen Signatur der verantwortenden Person versehen sein oder von der verantwortenden Person signiert und auf einem sicheren Übermittlungsweg gemäß § 130a ZPO nach näherer Maßgabe der Verordnung über die technischen Rahmenbedingungen des elektronischen Rechtsverkehrs und über das besondere elektronische Behördenpostfach (BGBl. I, S.3803) eingereicht werden. Weitere Informationen erhalten Sie auf der Internetseite www.justiz.de.\nDer Widerspruch muss spätestens innerhalb der gesetzten Frist nach dem Datum der Bekanntmachung der Löschungsankündigung bei dem Amtsgericht - Registergericht - Düsseldorf eingegangen sein.  Dies gilt auch dann, wenn der Widerspruch zur Niederschrift der Geschäftsstelle eines anderen Amtsgerichtes abgegeben wurde. Die Frist beginnt mit dem Tage der Bekanntmachung der Löschungsankündigung in dem für die Bekanntmachung der Eintragungen in das Handelsregister bestimmten elektronischen Informations- und Kommunikationssystem nach § 10 des Handelsgesetzbuches. Fällt das Ende der Frist auf einen Sonntag, einen allgemeinen Feiertag oder Sonnabend, so endet die Frist mit Ablauf des nächsten Werktages.\nDer Widerspruch muss die Bezeichnung der angefochtenen Löschungsankündigung sowie die Erklärung enthalten, dass Widerspruch gegen diese Löschungsankündigung eingelegt wird. Er ist zu unterzeichnen und soll begründet werden."
    },
    {
      "date": "2026-01-09",
      "id": "142018",
      "original_text": "Registerbekanntmachung nach dem Umwandlungsgesetz\nNordrhein-Westfalen Amtsgericht Bad Oeynhausen HRB 14358\nLeonardo Ristorante Pizzeria UG (haftungsbechränkt) – Rahden",
      "type": "Registerbekanntmachung nach dem Umwandlungsgesetz",
      "state": "Nordrhein-Westfalen",
      "amtsgericht": "Amtsgericht Bad Oeynhausen",
      "registernummer": "HRB 14358",
      "registerart": "HRB",
      "company_name": "Leonardo Ristorante Pizzeria UG (haftungsbechränkt)",
      "company_seat": "Rahden",
      "details": "09.01.2026 (Bekanntmachungsdatum)\n\nNordrhein-Westfalen Amtsgericht Bad Oeynhausen HRB 14358\nRegisterbekanntmachung nach dem Umwandlungsgesetz 06.01.2026 (Eintragungsdatum)\n\nLeonardo Ristorante Pizzeria UG (haftungsbechränkt)\nGesellschaft mit beschränkter Haftung\nRahden\n\nDen Gläubigern der an der Verschmelzung beteiligten Rechtsträger ist, wenn sie binnen sechs Monaten nach dem Tag, an dem die Eintragung der Verschmelzung in das Register des Sitzes desjenigen Rechtsträgers, dessen Gläubiger sie sind, nach § 19 Absatz 3 UmwG als bekanntgemacht gilt, ihren Anspruch nach Grund und Höhe schriftlich anmelden, Sicherheit zu leisten, soweit sie nicht Befriedigung verlangen können. Dieses Recht steht den Gläubigern jedoch nur zu, wenn sie glaubhaft machen, dass durch die Verschmelzung die Erfüllung ihrer Forderung gefährdet wird."
    },
    {
      "date": "2026-01-09",
      "id": "142019",
      "original_text": "Löschungsankündigung\nNordrhein-Westfalen Amtsgericht Düsseldorf HRB 97628\nIDC 3Sonz GmbH – Ratingen",
      "type": "Löschungsankündigung",
      "state": "Nordrhein-Westfalen",
      "amtsgericht": "Amtsgericht Düsseldorf",
      "registernummer": "HRB 97628",
      "registerart": "HRB",
      "company_name": "IDC 3Sonz GmbH",
      "company_seat": "Ratingen",
      "details": "09.01.2026 (Bekanntmachungsdatum)\n\nNordrhein-Westfalen Amtsgericht Düsseldorf HRB 97628\nLöschungsankündigung\n\nIDC 3Sonz GmbH\nGesellschaft mit beschränkter Haftung\nRatingen\n\nDas Registergericht beabsichtigt die Gesellschaft von Amts wegen nach § 394 FamFG zu löschen. Die Frist zur Erhebung eines Widerspruchs ist auf 3 Wochen festgesetzt.\n\nRechtsbehelfsbelehrung:\nDas Widerspruchsrecht steht jedem zu, der an der Unterlassung der Löschung ein berechtigtes Interesse hat. Der Widerspruch ist bei dem Amtsgericht Düsseldorf -Registergericht-, Werdener Straße 1, 40227 Düsseldorf schriftlich in deutscher Sprache oder zur Niederschrift der Geschäftsstelle einzulegen. Der Widerspruch kann auch zur Niederschrift der Geschäftsstelle eines jeden Amtsgerichtes abgegeben werden. Die Einlegung ist auch durch Übertragung eines elektronischen Dokuments an die elektronische Poststelle des Gerichts möglich. Das elektronische Dokument muss für die Bearbeitung durch das Gericht geeignet und mit einer qualifizierten elektronischen Signatur der verantwortenden Person versehen sein oder von der verantwortenden Person signiert und auf einem sicheren Übermittlungsweg gemäß § 130a ZPO nach näherer Maßgabe der Verordnung über die technischen Rahmenbedingungen des elektronischen Rechtsverkehrs und über das besondere elektronische Behördenpostfach (BGBl. I, S.3803) eingereicht werden. Weitere Informationen erhalten Sie auf der Internetseite www.justiz.de.\nDer Widerspruch muss spätestens innerhalb der gesetzten Frist nach dem Datum der Bekanntmachung der Löschungsankündigung bei dem Amtsgericht - Registergericht - Düsseldorf eingegangen sein.  Dies gilt auch dann, wenn der Widerspruch zur Niederschrift der Geschäftsstelle eines anderen Amtsgerichtes abgegeben wurde. Die Frist beginnt mit dem Tage der Bekanntmachung der Löschungsankündigung in dem für die Bekanntmachung der Eintragungen in das Handelsregister bestimmten elektronischen Informations- und Kommunikationssystem nach § 10 des Handelsgesetzbuches. Fällt das Ende der Frist auf einen Sonntag, einen allgemeinen Feiertag oder Sonnabend, so endet die Frist mit Ablauf des nächsten Werktages.\nDer Widerspruch muss die Bezeichnung der angefochtenen Löschungsankündigung sowie die Erklärung enthalten, dass Widerspruch gegen diese Löschungsankündigung eingelegt wird. Er ist zu unterzeichnen und soll begründet werden."
    },
    {
      "date": "2026-01-09",
      "id": "142020",
      "original_text": "Löschungsankündigung\nNordrhein-Westfalen Amtsgericht Siegburg HRB 12593\nMEDIANT Unternehmensberatung Limited Niederlassung Deutschland – Eitorf",
      "type": "Löschungsankündigung",
      "state": "Nordrhein-Westfalen",
      "amtsgericht": "Amtsgericht Siegburg",
      "registernummer": "HRB 12593",
      "registerart": "HRB",
      "company_name": "MEDIANT Unternehmensberatung Limited Niederlassung Deutschland",
      "company_seat": "Eitorf",
      "details": "09.01.2026 (Bekanntmachungsdatum)\n\nNordrhein-Westfalen Amtsgericht Siegburg HRB 12593\nLöschungsankündigung\n\nMEDIANT Unternehmensberatung Limited Niederlassung Deutschland\nRechtsform ausländischen Rechts HRB\nEitorf\n\nDas Registergericht hat glaubhafte Kenntnis erlangt, dass die\nHauptniederlassung im ausländischen Heimatregister nicht mehr eingetragen\nist. Mangels eigenständiger Rechtspersönlichkeit ist die Zweigniederlassung\neiner nicht mehr existenten Hauptniederlassung zu löschen.\nEs ist daher beabsichtigt, die Gesellschaft nach § 394 FamFG im\nHandelsregister zu löschen.\n\nEinwände gegen die Löschung sind durch Widerspruch binnen einer Frist von\n3 Monaten geltend zu machen, andernfalls die Löschung erfolgen wird.\nEinzulegen ist der Widerspruch bei dem Amtsgericht Siegburg, Neue\nPoststraße 16, 53721 Siegburg, und zwar entweder schriftlich in deutscher\nSprache oder mündlich zur Niederschrift der Geschäftsstelle. Der\nWiderspruch kann auch zur Niederschrift der Geschäftsstelle eines jeden\nAmtsgerichts abgegeben werden. Der Widerspruch ist binnen der in der\nVerfügung bestimmten Frist einzulegen. Die Frist ist nur gewahrt, wenn der\nWiderspruch rechtzeitig bei dem Amtsgericht Siegburg eingeht, auch wenn\nder Widerspruch zur Niederschrift der Geschäftsstelle eines anderen\nAmtsgerichts abgegeben wurde. Die Frist beginnt jeweils mit der schriftlichen\nBekanntgabe der Verfügung an die Beteiligten. Kann die schriftliche\nBekanntgabe an einen Beteiligten nicht bewirkt werden, beginnt die Frist\nspätestens mit Ablauf von fünf Monaten nach Erlass der Verfügung. Die\nBekanntgabe ist entweder durch Zustellung oder am dritten Tage nach\nAufgabe zur Post bewirkt. Sofern die Löschung noch nicht erfolgt ist, kann der\nWiderspruch auch noch nach Ablauf der Frist eingelegt werden. Fällt das\nEnde der Frist auf einen Sonnabend, einen Sonntag oder einen allgemeinen\nFeiertag, endet die Frist mit Ablauf des nächsten Werktages. Der\nWiderspruch ist zu unterzeichnen. Eine Begründung des Widerspruchs ist\nnicht vorgeschrieben."
    },
    {
      "date": "2026-01-09",
      "id": "142021",
      "original_text": "Löschungsankündigung\nNordrhein-Westfalen Amtsgericht Arnsberg HRB 10323\nSelecta Arnsberg GmbH – Arnsberg",
      "type": "Löschungsankündigung",
      "state": "Nordrhein-Westfalen",
      "amtsgericht": "Amtsgericht Arnsberg",
      "registernummer": "HRB 10323",
      "registerart": "HRB",
      "company_name": "Selecta Arnsberg GmbH",
      "company_seat": "Arnsberg",
      "details": "09.01.2026 (Bekanntmachungsdatum)\n\nNordrhein-Westfalen Amtsgericht Arnsberg HRB 10323\nLöschungsankündigung\n\nSelecta Arnsberg GmbH\nGesellschaft mit beschränkter Haftung\nArnsberg\n\nDas Registergericht beabsichtigt, die im Handelsregister eingetragene Gesellschaft gemäß § 394 Absatz 1 FamFG wegen Vermögenslosigkeit von Amts wegen zu löschen.Gegen diese Verfügung kann Widerspruch eingelegt werden. Die Frist zur Erhebung eines Widerspruchs gegen die beabsichtigte Löschung von Amts wegen ist auf einen Monat festgesetzt.\n\nRechtsbehelfsbelehrung:\nGegen diese Verfügung können Sie Widerspruch einlegen. Der Widerspruch ist bei dem Amtsgericht Arnsberg, Eichholzstraße 4, 59821 Arnsberg schriftlich in deutscher Sprache oder zur Niederschrift der Geschäftsstelle einzulegen. Der Widerspruch kann auch zur Niederschrift der Geschäftsstelle eines jeden Amtsgerichtes abgegeben werden. Die Einlegung ist auch durch Übertragung eines elektronischen Dokuments an die elektronische Poststelle des Gerichts möglich. Das elektronische Dokument muss für die Bearbeitung durch das Gericht geeignet und mit einer qualifizierten elektronischen Signatur der verantwortenden Person versehen sein oder von der verantwortenden Person signiert und auf einem sicheren Übermittlungsweg gemäß § 130a ZPO nach näherer Maßgabe der Verordnung über die technischen Rahmenbedingungen des elektronischen Rechtsverkehrs und über das besondere elektronische Behördenpostfach (BGBl. I, S.3803) eingereicht werden.\nWeitere Informationen erhalten Sie auf der Internetseite www.justiz.de.Der Widerspruch muss spätestens innerhalb der gesetzten Frist bei dem Amtsgericht Arnsberg eingegangen sein. Dies gilt auch dann, wenn der Widerspruch zur Niederschrift der Geschäftsstelle eines anderen Amtsgerichtes abgegeben wurde. Die Frist beginnt mit der Veröffentlichung. Fällt das Ende der Frist auf einen Sonntag, einen allgemeinen Feiertag oder Sonnabend, so endet die Frist mit Ablauf des nächsten Werktages. Der Widerspruch muss die Bezeichnung der angefochtenen Verfügung sowie die Erklärung enthalten, dass Widerspruch gegen diese Verfügung eingelegt wird. Er ist zu unterzeichnen und soll begründet werden."
    },
    {
      "date": "2026-01-09",
      "id": "142022",
      "original_text": "Registerbekanntmachung nach dem Umwandlungsgesetz\nNordrhein-Westfalen Amtsgericht Köln HRB 126190\nCinesupply GmbH – Köln",
      "type": "Registerbekanntmachung nach dem Umwandlungsgesetz",
      "state": "Nordrhein-Westfalen",
      "amtsgericht": "Amtsgericht Köln",
      "registernummer": "HRB 126190",
      "registerart": "HRB",
      "company_name": "Cinesupply GmbH",
      "company_seat": "Köln",
      "details": "09.01.2026 (Bekanntmachungsdatum)\n\nNordrhein-Westfalen Amtsgericht Köln HRB 126190\nRegisterbekanntmachung nach dem Umwandlungsgesetz 09.01.2026 (Eintragungsdatum)\n\nCinesupply GmbH\nGesellschaft mit beschränkter Haftung\nKöln\n\nDen Gläubigern der an der formwechselnden Umwandlung beteiligten Rechtsträger ist, wenn sie binnen sechs Monaten nach dem Tag, an dem die Eintragung der formwechselnden Umwandlung in das Register des Sitzes desjenigen Rechtsträgers, dessen Gläubiger sie sind, nach § 19 Absatz 3 UmwG als bekanntgemacht gilt, ihren Anspruch nach Grund und Höhe schriftlich anmelden, Sicherheit zu leisten, soweit sie nicht Befriedigung verlangen können. Dieses Recht steht den Gläubigern jedoch nur zu, wenn sie glaubhaft machen, dass durch die formwechselnden Umwandlung die Erfüllung ihrer Forderung gefährdet wird."
    },
    {
      "date": "2026-01-09",
      "id": "142023",
      "original_text": "Löschungsankündigung\nNordrhein-Westfalen Amtsgericht Siegburg HRB 11382\nSchmidt Freizeit GmbH – Bad Honnef",
      "type": "Löschungsankündigung",
      "state": "Nordrhein-Westfalen",
      "amtsgericht": "Amtsgericht Siegburg",
      "registernummer": "HRB 11382",
      "registerart": "HRB",
      "company_name": "Schmidt Freizeit GmbH",
      "company_seat": "Bad Honnef",
      "details": "09.01.2026 (Bekanntmachungsdatum)\n\nNordrhein-Westfalen Amtsgericht Siegburg HRB 11382\nLöschungsankündigung\n\nSchmidt Freizeit GmbH\nGesellschaft mit beschränkter Haftung\nBad Honnef\n\nDas Registergericht hat glaubhafte Kenntnis erlangt, dass die Gesellschaft vermögenslos geworden ist, da ein Insolvenzeröffnungsantrag mangels Masse nach § 26 InsO zurückgewiesen wurde.\n\nEs ist daher beabsichtigt, die Gesellschaft nach § 394 FamFG im Handelsregister wegen Vermögenslosigkeit zu löschen. Einwände gegen die Löschung sind durch Widerspruch binnen einer Frist von 3 Monaten geltend zu machen, andernfalls die Löschung erfolgen wird.\n\nEinzulegen ist der Widerspruch bei dem Amtsgericht Siegburg, Neue Poststraße 16, 53721 Siegburg, und zwar entweder schriftlich in deutscher Sprache oder mündlich zur Niederschrift der Geschäftsstelle. Der Widerspruch kann auch zur Niederschrift der Geschäftsstelle eines jeden Amtsgerichts abgegeben werden. Der Widerspruch ist binnen der in der Verfügung bestimmten Frist einzulegen. Die Frist ist nur gewahrt, wenn der Widerspruch rechtzeitig bei dem Amtsgericht Siegburg eingeht, auch wenn der Widerspruch zur Niederschrift der Geschäftsstelle eines anderen Amtsgerichts abgegeben wurde. Die\nFrist beginnt jeweils mit der schriftlichen Bekanntgabe der Verfügung an die Beteiligten. Kann die schriftliche Bekanntgabe an einen Beteiligten nicht bewirkt werden, beginnt die Frist spätestens mit Ablauf von fünf Monaten nach Erlass der Verfügung. Die Bekanntgabe ist entweder durch Zustellung oder am dritten Tage nach Aufgabe zur Post bewirkt. Sofern die Löschung noch nicht erfolgt ist, kann der Widerspruch auch noch nach Ablauf der Frist eingelegt werden. Fällt das Ende der Frist auf einen Sonnabend, einen Sonntag oder einen allgemeinen Feiertag, endet die Frist mit Ablauf des nächsten Werktages. Der Widerspruch ist zu unterzeichnen. Eine Begründung des Widerspruchs ist nicht vorgeschrieben."
    },
    {
      "date": "2026-01-09",
      "id": "142024",
      "original_text": "Registerbekanntmachung nach dem Umwandlungsgesetz\nNordrhein-Westfalen Amtsgericht Hagen HRB 7374\nZL Microdent-Attachment Verwaltungs GmbH – Breckerfeld",
      "type": "Registerbekanntmachung nach dem Umwandlungsgesetz",
      "state": "Nordrhein-Westfalen",
      "amtsgericht": "Amtsgericht Hagen",
      "registernummer": "HRB 7374",
      "registerart": "HRB",
      "company_name": "ZL Microdent-Attachment Verwaltungs GmbH",
      "company_seat": "Breckerfeld",
      "details": "09.01.2026 (Bekanntmachungsdatum)\n\nNordrhein-Westfalen Amtsgericht Hagen HRB 7374\nRegisterbekanntmachung nach dem Umwandlungsgesetz 08.01.2026 (Eintragungsdatum)\n\nZL Microdent-Attachment Verwaltungs GmbH\nGesellschaft mit beschränkter Haftung\nBreckerfeld\n\n„Den Gläubigern der an der Verschmelzung beteiligten Rechtsträger ist, wenn sie binnen sechs Monaten nach dem Tag, an dem die Eintragung der Verschmelzung in das Register des Sitzes desjenigen Rechtsträgers, dessen Gläubiger sie sind, nach § 19 Abs. 3 UmwG als bekannt gemacht gilt, ihren Anspruch nach Grund und Höhe schriftlich anmelden, Sicherheit zu leisten, soweit sie nicht Befriedigung verlangen können. Dieses Recht steht ihnen jedoch nur zu, wenn sie glaubhaft machen, dass durch die Verschmelzung die Erfüllung ihrer Forderung gefährdet wird.“"
    },
    {
      "date": "2026-01-09",
      "id": "142025",
      "original_text": "Registerbekanntmachung nach dem Umwandlungsgesetz\nNordrhein-Westfalen Amtsgericht Arnsberg HRA 9049\nFerienpark Neuastenberg GmbH & Co. Kommanditgesellschaft – Winterberg",
      "type": "Registerbekanntmachung nach dem Umwandlungsgesetz",
      "state": "Nordrhein-Westfalen",
      "amtsgericht": "Amtsgericht Arnsberg",
      "registernummer": "HRA 9049",
      "registerart": "HRA",
      "company_name": "Ferienpark Neuastenberg GmbH & Co. Kommanditgesellschaft",
      "company_seat": "Winterberg",
      "details": "09.01.2026 (Bekanntmachungsdatum)\n\nNordrhein-Westfalen Amtsgericht Arnsberg HRA 9049\nRegisterbekanntmachung nach dem Umwandlungsgesetz 09.01.2026 (Eintragungsdatum)\n\nFerienpark Neuastenberg GmbH & Co. Kommanditgesellschaft\nKommanditgesellschaft\nWinterberg\n\nDen Gläubigern der an der Verschmelzung beteiligten Rechtsträger ist, wenn sie binnen sechs Monaten nach dem Tag, an dem die Eintragung der Verschmelzung in das Register des Sitzes derjenigen Rechtsträger deren Gläubiger sie sind, nach § 19 Absatz 3 UmwG als bekanntgemacht gilt, ihren Anspruch nach Grund und Höhe schriftlich anmelden, Sicherheit zu leisten, soweit sie nicht Befriedigung verlangen können. Dieses Recht steht den Gläubigern jedoch nur zu, wenn sie glaubhaft machen, dass durch die Verschmelzung die Erfüllung ihrer Forderung gefährdet wird."
    },
    {
      "date": "2026-01-09",
      "id": "142026",
      "original_text": "Löschungsankündigung\nNordrhein-Westfalen Amtsgericht Bochum HRB 10558\nPME Institute for Education in Pharmaceutical Medicine GmbH – Witten",
      "type": "Löschungsankündigung",
      "state": "Nordrhein-Westfalen",
      "amtsgericht": "Amtsgericht Bochum",
      "registernummer": "HRB 10558",
      "registerart": "HRB",
      "company_name": "PME Institute for Education in Pharmaceutical Medicine GmbH",
      "company_seat": "Witten",
      "details": "09.01.2026 (Bekanntmachungsdatum)\n\nNordrhein-Westfalen Amtsgericht Bochum HRB 10558\nLöschungsankündigung 09.01.2026 (Eintragungsdatum)\n\nPME Institute for Education in Pharmaceutical Medicine GmbH\nGesellschaft mit beschränkter Haftung\nWitten\n\nDie Gesellschaft hat Gläubigern, deren Forderungen vor dieser Bekanntmachung begründet worden sind, Sicherheit zu leisten, soweit sie nicht Befriedigung verlangen können, wenn sie sich binnen sechs Monaten zu diesem Zweck melden."
    },
    {
      "date": "2026-01-09",
      "id": "142027",
      "original_text": "Löschungsankündigung\nNordrhein-Westfalen Amtsgericht Mönchengladbach HRB 20904\nLudwig GmbH – Jüchen",
      "type": "Löschungsankündigung",
      "state": "Nordrhein-Westfalen",
      "amtsgericht": "Amtsgericht Mönchengladbach",
      "registernummer": "HRB 20904",
      "registerart": "HRB",
      "company_name": "Ludwig GmbH",
      "company_seat": "Jüchen",
      "details": "09.01.2026 (Bekanntmachungsdatum)\n\nNordrhein-Westfalen Amtsgericht Mönchengladbach HRB 20904\nLöschungsankündigung\n\nLudwig GmbH\nGesellschaft mit beschränkter Haftung\nJüchen\n\nDas Registergericht beabsichtigt die Gesellschaft von Amts wegen nach § 394 FamFG zu löschen. Die Frist zur Erhebung eines Widerspruchs ist auf zwei Monate festgesetzt."
    },
    {
      "date": "2026-01-09",
      "id": "142028",
      "original_text": "Löschungsankündigung\nNordrhein-Westfalen Amtsgericht Bad Oeynhausen HRB 11955\nLeitEnergie - Gesellschaft für erneuerbare Energien mbH – Minden",
      "type": "Löschungsankündigung",
      "state": "Nordrhein-Westfalen",
      "amtsgericht": "Amtsgericht Bad Oeynhausen",
      "registernummer": "HRB 11955",
      "registerart": "HRB",
      "company_name": "LeitEnergie - Gesellschaft für erneuerbare Energien mbH",
      "company_seat": "Minden",
      "details": "09.01.2026 (Bekanntmachungsdatum)\n\nNordrhein-Westfalen Amtsgericht Bad Oeynhausen HRB 11955\nLöschungsankündigung 09.01.2026 (Eintragungsdatum)\n\nLeitEnergie - Gesellschaft für erneuerbare Energien mbH\nGesellschaft mit beschränkter Haftung\nMinden\n\nDas Registergericht beabsichtigt die Gesellschaft von Amts wegen nach § 394 FamFG zu löschen. Die Frist zur Erhebung eines Widerspruchs ist auf zwei Monate festgesetzt."
    },
    {
      "date": "2026-01-09",
      "id": "142029",
      "original_text": "Sonstige Registerbekanntmachung\nNordrhein-Westfalen Amtsgericht Düsseldorf HRB 39086\n[m]STUDIO GmbH – Düsseldorf",
      "type": "Sonstige Registerbekanntmachung",
      "state": "Nordrhein-Westfalen",
      "amtsgericht": "Amtsgericht Düsseldorf",
      "registernummer": "HRB 39086",
      "registerart": "HRB",
      "company_name": "[m]STUDIO GmbH",
      "company_seat": "Düsseldorf",
      "details": "09.01.2026 (Bekanntmachungsdatum)\n\nNordrhein-Westfalen Amtsgericht Düsseldorf HRB 39086\nSonstige Registerbekanntmachung 09.01.2026 (Eintragungsdatum)\n\n[m]STUDIO GmbH\nGesellschaft mit beschränkter Haftung\nDüsseldorf\n\nDie Gesellschaft hat Gläubigern, deren Forderungen vor dieser Bekanntmachung begründet worden sind, Sicherheit zu leisten, soweit sie nicht Befriedigung verlangen können, wenn sie sich binnen sechs Monaten zu diesem Zweck melden.Als nicht eingetragen wird veröffentlicht: Den Gläubigern der Gesellschaft, deren Forderungen begründet worden sind bevor die Eintragung der Beendigung des Beherrschungs- und Gewinnabführungsvertrages  in das Handelsregister nach § 10 des Handelsgesetzbuches als bekanntgemacht gilt, hat der andere Vertragsteil Sicherheit zu leisten, wenn sie sich binnen sechs Monaten nach der Bekanntmachung der Eintragung zu diesem Zweck bei ihm melden."
    },
    {
      "date": "2026-01-09",
      "id": "142030",
      "original_text": "Einreichung neuer Dokumente\nNordrhein-Westfalen Amtsgericht Gütersloh HRB 3842\nStadtwerke Gütersloh GmbH – Gütersloh",
      "type": "Einreichung neuer Dokumente",
      "state": "Nordrhein-Westfalen",
      "amtsgericht": "Amtsgericht Gütersloh",
      "registernummer": "HRB 3842",
      "registerart": "HRB",
      "company_name": "Stadtwerke Gütersloh GmbH",
      "company_seat": "Gütersloh",
      "details": "09.01.2026 (Bekanntmachungsdatum)\n\nNordrhein-Westfalen Amtsgericht Gütersloh HRB 3842\nEinreichung neuer Dokumente\n\nStadtwerke Gütersloh GmbH\nGesellschaft mit beschränkter Haftung\nGütersloh\n\nDem Registergericht ist eine neue Liste der Mitglieder des Aufsichtsrates eingereicht worden."
    },
    {
      "date": "2026-01-09",
      "id": "142031",
      "original_text": "Sonstige Registerbekanntmachung\nNordrhein-Westfalen Amtsgericht Duisburg HRB 23642\nMedizinisches Versorgungszentrum Duisburg Süd GmbH – Duisburg",
      "type": "Sonstige Registerbekanntmachung",
      "state": "Nordrhein-Westfalen",
      "amtsgericht": "Amtsgericht Duisburg",
      "registernummer": "HRB 23642",
      "registerart": "HRB",
      "company_name": "Medizinisches Versorgungszentrum Duisburg Süd GmbH",
      "company_seat": "Duisburg",
      "details": "09.01.2026 (Bekanntmachungsdatum)\n\nNordrhein-Westfalen Amtsgericht Duisburg HRB 23642\nSonstige Registerbekanntmachung 09.01.2026 (Eintragungsdatum)\n\nMedizinisches Versorgungszentrum Duisburg Süd GmbH\nGesellschaft mit beschränkter Haftung\nDuisburg\n\nDie Gesellschaft hat Gläubigern, deren Forderungen vor dieser Bekanntmachung begründet worden sind, Sicherheit zu leisten, soweit sie nicht Befriedigung verlangen können, wenn sie sich binnen sechs Monaten zu diesem Zweck melden."
    },
    {
      "date": "2026-01-09",
      "id": "142032",
      "original_text": "Löschungsankündigung\nNordrhein-Westfalen Amtsgericht Arnsberg HRB 2055\nShopping und Mehr Beteiligungs- und Geschäftsführungsgesellschaft mbH – Marsberg",
      "type": "Löschungsankündigung",
      "state": "Nordrhein-Westfalen",
      "amtsgericht": "Amtsgericht Arnsberg",
      "registernummer": "HRB 2055",
      "registerart": "HRB",
      "company_name": "Shopping und Mehr Beteiligungs- und Geschäftsführungsgesellschaft mbH",
      "company_seat": "Marsberg",
      "details": "09.01.2026 (Bekanntmachungsdatum)\n\nNordrhein-Westfalen Amtsgericht Arnsberg HRB 2055\nLöschungsankündigung 09.01.2026 (Eintragungsdatum)\n\nShopping und Mehr Beteiligungs- und Geschäftsführungsgesellschaft mbH\nGesellschaft mit beschränkter Haftung\nMarsberg\n\nDas Registergericht beabsichtigt, die im Handelsregister eingetragene Gesellschaft gemäß § 394 Absatz 1 FamFG wegen Vermögenslosigkeit von Amts wegen zu löschen.Gegen diese Verfügung kann Widerspruch eingelegt werden. Die Frist zur Erhebung eines Widerspruchs gegen die beabsichtigte Löschung von Amts wegen ist auf einen Monat festgesetzt.\n\nRechtsbehelfsbelehrung: Gegen diese Verfügung können Sie Widerspruch einlegen. Der Widerspruch ist bei dem Amtsgericht Arnsberg, Eichholzstraße 4, 59821 Arnsberg schriftlich in deutscher Sprache oder zur Niederschrift der Geschäftsstelle einzulegen. Der Widerspruch kann auch zur Niederschrift der Geschäftsstelle eines jeden Amtsgerichtes abgegeben werden. Die Einlegung ist auch durch Übertragung eines elektronischen Dokuments an die elektronische Poststelle des Gerichts möglich. Das elektronische Dokument muss für die Bearbeitung durch das Gericht geeignet und mit einer qualifizierten elektronischen Signatur der verantwortenden Person versehen sein oder von der verantwortenden Person signiert und auf einem sicheren Übermittlungsweg gemäß § 130a ZPO nach näherer Maßgabe der Verordnung über die technischen Rahmenbedingungen des elektronischen Rechtsverkehrs und über das besondere elektronische Behördenpostfach (BGBl. I, S.3803) eingereicht werden. Weitere Informationen erhalten Sie auf der Internetseite www.justiz.de.Der Widerspruch muss spätestens innerhalb der gesetzten Frist bei dem Amtsgericht Arnsberg eingegangen sein. Dies gilt auch dann, wenn der Widerspruch zur Niederschrift der Geschäftsstelle eines anderen Amtsgerichtes abgegeben wurde. Die Frist beginnt mit der Veröffentlichung. Fällt das Ende der Frist auf einen Sonntag, einen allgemeinen Feiertag oder Sonnabend, so endet die Frist mit Ablauf des nächsten Werktages.Der Widerspruch muss die Bezeichnung der angefochtenen Verfügung sowie die Erklärung enthalten, dass Widerspruch gegen diese Verfügung eingelegt wird. Er ist zu unterzeichnen und soll begründet werden."
    },
    {
      "date": "2026-01-09",
      "id": "142033",
      "original_text": "Registerbekanntmachung nach dem Umwandlungsgesetz\nNordrhein-Westfalen Amtsgericht Bad Oeynhausen HRA 10608\nRistorante Pizzeria Möhle-Wriedt e.K. – Rahden",
      "type": "Registerbekanntmachung nach dem Umwandlungsgesetz",
      "state": "Nordrhein-Westfalen",
      "amtsgericht": "Amtsgericht Bad Oeynhausen",
      "registernummer": "HRA 10608",
      "registerart": "HRA",
      "company_name": "Ristorante Pizzeria Möhle-Wriedt e.K.",
      "company_seat": "Rahden",
      "details": "09.01.2026 (Bekanntmachungsdatum)\n\nNordrhein-Westfalen Amtsgericht Bad Oeynhausen HRA 10608\nRegisterbekanntmachung nach dem Umwandlungsgesetz 09.01.2026 (Eintragungsdatum)\n\nRistorante Pizzeria Möhle-Wriedt e.K.\nEinzelkaufmann / Einzelkauffrau\nRahden\n\nDen Gläubigern der an der Verschmelzung beteiligten Rechtsträger ist, wenn sie binnen sechs Monaten nach dem Tag, an dem die Eintragung der Verschmelzung in das Register des Sitzes desjenigen Rechtsträgers, dessen Gläubiger sie sind, nach § 19 Absatz 3 UmwG als bekanntgemacht gilt, ihren Anspruch nach Grund und Höhe schriftlich anmelden, Sicherheit zu leisten, soweit sie nicht Befriedigung verlangen können. Dieses Recht steht den Gläubigern jedoch nur zu, wenn sie glaubhaft machen, dass durch die Verschmelzung die Erfüllung ihrer Forderung gefährdet wird."
    },
    {
      "date": "2026-01-09",
      "id": "142034",
      "original_text": "Löschungsankündigung\nNordrhein-Westfalen Amtsgericht Hamm HRB 9753\nAgora Sicherheit UG (haftungsbeschränkt) – Kamen",
      "type": "Löschungsankündigung",
      "state": "Nordrhein-Westfalen",
      "amtsgericht": "Amtsgericht Hamm",
      "registernummer": "HRB 9753",
      "registerart": "HRB",
      "company_name": "Agora Sicherheit UG (haftungsbeschränkt)",
      "company_seat": "Kamen",
      "details": "09.01.2026 (Bekanntmachungsdatum)\n\nNordrhein-Westfalen Amtsgericht Hamm HRB 9753\nLöschungsankündigung\n\nAgora Sicherheit UG (haftungsbeschränkt)\nGesellschaft mit beschränkter Haftung\nKamen\n\nDas Registergericht beabsichtigt die Gesellschaft von Amts wegen nach § 394 FamFG zu löschen. Die Frist zur Erhebung eines Widerspruchs ist auf drei Monate festgesetzt."
    },
    {
      "date": "2026-01-09",
      "id": "142035",
      "original_text": "Registerbekanntmachung nach dem Umwandlungsgesetz\nNordrhein-Westfalen Amtsgericht Paderborn HRB 13360\nfeine räder Paderborn GmbH – Paderborn",
      "type": "Registerbekanntmachung nach dem Umwandlungsgesetz",
      "state": "Nordrhein-Westfalen",
      "amtsgericht": "Amtsgericht Paderborn",
      "registernummer": "HRB 13360",
      "registerart": "HRB",
      "company_name": "feine räder Paderborn GmbH",
      "company_seat": "Paderborn",
      "details": "09.01.2026 (Bekanntmachungsdatum)\n\nNordrhein-Westfalen Amtsgericht Paderborn HRB 13360\nRegisterbekanntmachung nach dem Umwandlungsgesetz 09.01.2026 (Eintragungsdatum)\n\nfeine räder Paderborn GmbH\nGesellschaft mit beschränkter Haftung\nPaderborn\n\nDen Gläubigern der an der Verschmelzung beteiligten Rechtsträger ist, wenn sie binnen sechs Monaten nach dem Tag, an dem die Eintragung der Verschmelzung in das Register des Sitzes desjenigen Rechtsträgers, dessen Gläubiger sie sind, nach § 19 Absatz 3 UmwG als bekanntgemacht gilt, ihren Anspruch nach Grund und Höhe schriftlich anmelden, Sicherheit zu leisten, soweit sie nicht Befriedigung verlangen können. Dieses Recht steht den Gläubigern jedoch nur zu, wenn sie glaubhaft machen, dass durch die Verschmelzung die Erfüllung ihrer Forderung gefährdet wird."
    },
    {
      "date": "2026-01-09",
      "id": "142036",
      "original_text": "Löschungsankündigung\nNordrhein-Westfalen Amtsgericht Gelsenkirchen HRB 17891\nCleaner A&O GmbH – Dorsten",
      "type": "Löschungsankündigung",
      "state": "Nordrhein-Westfalen",
      "amtsgericht": "Amtsgericht Gelsenkirchen",
      "registernummer": "HRB 17891",
      "registerart": "HRB",
      "company_name": "Cleaner A&O GmbH",
      "company_seat": "Dorsten",
      "details": "09.01.2026 (Bekanntmachungsdatum)\n\nNordrhein-Westfalen Amtsgericht Gelsenkirchen HRB 17891\nLöschungsankündigung\n\nCleaner A&O GmbH\nGesellschaft mit beschränkter Haftung\nDorsten\n\nDas Gericht beabsichtigt, die Gesellschaft Cleaner A&O GmbH mit Sitz in Dorsten,\nHRB 17891 Amtsgericht Gelsenkirchen, wegen Vermögenslosigkeit zu löschen.\nHiermit wird denjenigen, die an der Unterlassung der Löschung ein berechtigtes\nInteresse haben, gem. § 394 Abs. 2 FamFG Gelegenheit gegeben, gegen dieses\nVorhaben binnen eines Monats nach dieser Bekanntmachung Widerspruch\neinzulegen. Der Widerspruch kann schriftlich oder zu Protokoll der Geschäftsstelle\nerhoben werden."
    },
    {
      "date": "2026-01-09",
      "id": "142037",
      "original_text": "Einreichung neuer Dokumente\nHessen Amtsgericht Hanau HRB 100835\nClauss Capital AG – Nidderau",
      "type": "Einreichung neuer Dokumente",
      "state": "Hessen",
      "amtsgericht": "Amtsgericht Hanau",
      "registernummer": "HRB 100835",
      "registerart": "HRB",
      "company_name": "Clauss Capital AG",
      "company_seat": "Nidderau",
      "details": "09.01.2026 (Bekanntmachungsdatum)\n\nHessen Amtsgericht Hanau HRB 100835\nEinreichung neuer Dokumente\n\nClauss Capital AG\nAktiengesellschaft\nNidderau\n\nDurch eine Änderung in den Personen der Aufsichtsratsmitglieder ist eine Liste der Mitglieder des Aufsichtsrates zum Handelsregister eingereicht worden."
    },
    {
      "date": "2026-01-09",
      "id": "142038",
      "original_text": "Löschungsankündigung\nHessen Amtsgericht Frankfurt am Main HRA 16135\nDruckerei und Verlag Otto Lembeck GmbH & Co. KG – Frankfurt am Main",
      "type": "Löschungsankündigung",
      "state": "Hessen",
      "amtsgericht": "Amtsgericht Frankfurt am Main",
      "registernummer": "HRA 16135",
      "registerart": "HRA",
      "company_name": "Druckerei und Verlag Otto Lembeck GmbH & Co. KG",
      "company_seat": "Frankfurt am Main",
      "details": "09.01.2026 (Bekanntmachungsdatum)\n\nHessen Amtsgericht Frankfurt am Main HRA 16135\nLöschungsankündigung\n\nDruckerei und Verlag Otto Lembeck GmbH & Co. KG\nKommanditgesellschaft\nFrankfurt am Main\n\nDas Registergericht beabsichtigt die im Handelsregister eingetragene Firma von Amts wegen nach § 394 FamFG zu löschen. Die Frist zur Erhebung eines Widerspruchs gegen die beabsichtigte Löschung wird auf 1 Monat festgesetzt."
    },
    {
      "date": "2026-01-09",
      "id": "142039",
      "original_text": "Sonstige Registerbekanntmachung\nHessen Amtsgericht Hanau HRB 12630\nSDS Sicherheitsdienste Gesellschaft mit beschränkter Haftung – Linsengericht",
      "type": "Sonstige Registerbekanntmachung",
      "state": "Hessen",
      "amtsgericht": "Amtsgericht Hanau",
      "registernummer": "HRB 12630",
      "registerart": "HRB",
      "company_name": "SDS Sicherheitsdienste Gesellschaft mit beschränkter Haftung",
      "company_seat": "Linsengericht",
      "details": "09.01.2026 (Bekanntmachungsdatum)\n\nHessen Amtsgericht Hanau HRB 12630\nSonstige Registerbekanntmachung 09.01.2026 (Eintragungsdatum)\n\nSDS Sicherheitsdienste Gesellschaft mit beschränkter Haftung\nGesellschaft mit beschränkter Haftung\nLinsengericht\n\nDen Gläubigern der Gesellschaft, deren Forderungen begründet worden sind, bevor die Eintragung der Beendigung des Vertrags in das Handelsregister nach § 10 HGB bekannt gemacht worden ist, ist vom anderen Vertragsteil Sicherheit zu leisten, wenn sie sich binnen sechs Monaten nach dieser Bekanntmachung zu diesem Zweck bei ihm melden."
    },
    {
      "date": "2026-01-09",
      "id": "142040",
      "original_text": "Sonstige Registerbekanntmachung\nHessen Amtsgericht Wetzlar HRB 21\nVRM Wetzlar GmbH – Wetzlar",
      "type": "Sonstige Registerbekanntmachung",
      "state": "Hessen",
      "amtsgericht": "Amtsgericht Wetzlar",
      "registernummer": "HRB 21",
      "registerart": "HRB",
      "company_name": "VRM Wetzlar GmbH",
      "company_seat": "Wetzlar",
      "details": "09.01.2026 (Bekanntmachungsdatum)\n\nHessen Amtsgericht Wetzlar HRB 21\nSonstige Registerbekanntmachung 09.01.2026 (Eintragungsdatum)\n\nVRM Wetzlar GmbH\nGesellschaft mit beschränkter Haftung\nWetzlar\n\nDen Gläubigern der Gesellschaft, deren Forderungen begründet worden sind, bevor die Eintragung der Beendigung des Vertrags in das Handelsregister nach § 10 HGB bekannt gemacht worden ist, ist vom anderen Vertragsteil Sicherheit zu leisten, wenn sie sich binnen sechs Monaten nach dieser Bekanntmachung zu diesem Zweck bei ihm melden."
    }
  ]
}