{
  "date": "2026-01-15",
  "date_of_scrape": "2026-01-16T04:23:32.978Z",
  "tool_version": "0.2.0",
  "number_of_announcements": 128,
  "announcements": [
    {
      "date": "2026-01-15",
      "id": "142443",
      "original_text": "Löschungsankündigung\nBayern Amtsgericht München HRB 236383\nEYMA Optimum Clean GmbH – München",
      "type": "Löschungsankündigung",
      "state": "Bayern",
      "amtsgericht": "Amtsgericht München",
      "registernummer": "HRB 236383",
      "registerart": "HRB",
      "company_name": "EYMA Optimum Clean GmbH",
      "company_seat": "München",
      "details": "15.01.2026 (Bekanntmachungsdatum)\n\nBayern Amtsgericht München HRB 236383\nLöschungsankündigung 14.01.2026 (Eintragungsdatum)\n\nEYMA Optimum Clean GmbH\nGesellschaft mit beschränkter Haftung\nMünchen\n\nDas Registergericht beabsichtigt, die im Handelsregister eingetragene Gesellschaft wegen Vermögenslosigkeit von Amts wegen nach § 394 FamFG zu löschen. Die Frist zur Erhebung eines Widerspruchs ist auf drei Monate festgesetzt."
    },
    {
      "date": "2026-01-15",
      "id": "142444",
      "original_text": "Registerbekanntmachung nach dem Umwandlungsgesetz\nBayern Amtsgericht München HRB 299060\nNatural Service Gebäudereinigung GmbH – München",
      "type": "Registerbekanntmachung nach dem Umwandlungsgesetz",
      "state": "Bayern",
      "amtsgericht": "Amtsgericht München",
      "registernummer": "HRB 299060",
      "registerart": "HRB",
      "company_name": "Natural Service Gebäudereinigung GmbH",
      "company_seat": "München",
      "details": "15.01.2026 (Bekanntmachungsdatum)\n\nBayern Amtsgericht München HRB 299060\nRegisterbekanntmachung nach dem Umwandlungsgesetz 14.01.2026 (Eintragungsdatum)\n\nNatural Service Gebäudereinigung GmbH\nGesellschaft mit beschränkter Haftung\nMünchen\n\nDen Gläubigern der an der Ausgliederung beteiligten Rechtsträger ist, wenn sie binnen sechs Monaten nach dem Tag, an dem die Eintragung der Ausgliederung in das Register des Sitzes desjenigen Rechtsträgers, dessen Gläubiger sie sind, nach §§ 125, 19 Abs. 3 UmwG als bekannt gemacht gilt, ihren Anspruch nach Grund und Höhe in Textform anmelden, Sicherheit zu leisten, soweit sie nicht Befriedigung verlangen können. Dieses Recht steht den Gläubigern jedoch nur zu, wenn sie glaubhaft machen, dass durch die Ausgliederung die Erfüllung ihrer Forderung gefährdet wird."
    },
    {
      "date": "2026-01-15",
      "id": "142445",
      "original_text": "Löschungsankündigung\nBayern Amtsgericht München HRB 237933\nDeko Parkett Reichert GmbH – München",
      "type": "Löschungsankündigung",
      "state": "Bayern",
      "amtsgericht": "Amtsgericht München",
      "registernummer": "HRB 237933",
      "registerart": "HRB",
      "company_name": "Deko Parkett Reichert GmbH",
      "company_seat": "München",
      "details": "15.01.2026 (Bekanntmachungsdatum)\n\nBayern Amtsgericht München HRB 237933\nLöschungsankündigung 14.01.2026 (Eintragungsdatum)\n\nDeko Parkett Reichert GmbH\nGesellschaft mit beschränkter Haftung\nMünchen\n\nDas Registergericht beabsichtigt, die im Handelsregister eingetragene Gesellschaft wegen Vermögenslosigkeit von Amts wegen nach § 394 FamFG zu löschen. Die Frist zur Erhebung eines Widerspruchs ist auf drei Monate festgesetzt."
    },
    {
      "date": "2026-01-15",
      "id": "142446",
      "original_text": "Registerbekanntmachung nach dem Umwandlungsgesetz\nBayern Amtsgericht Aschaffenburg HRB 10882\nDigital Innovation AG – Aschaffenburg",
      "type": "Registerbekanntmachung nach dem Umwandlungsgesetz",
      "state": "Bayern",
      "amtsgericht": "Amtsgericht Aschaffenburg",
      "registernummer": "HRB 10882",
      "registerart": "HRB",
      "company_name": "Digital Innovation AG",
      "company_seat": "Aschaffenburg",
      "details": "15.01.2026 (Bekanntmachungsdatum)\n\nBayern Amtsgericht Aschaffenburg HRB 10882\nRegisterbekanntmachung nach dem Umwandlungsgesetz 14.01.2026 (Eintragungsdatum)\n\nDigital Innovation AG\nAktiengesellschaft\nAschaffenburg\n\nDen Gläubigern des formwechselnden Rechtsträgers ist, wenn sie binnen sechs Monaten nach dem Tag, an dem die Eintragung des Formwechsels nach § 201 UmwG als bekannt gemacht gilt, ihren Anspruch nach Grund und Höhe in Textform anmelden, Sicherheit zu leisten, soweit sie nicht Befriedigung verlangen können. Dieses Recht steht den Gläubigern jedoch nur zu, wenn sie glaubhaft machen, dass durch den Formwechsel die Erfüllung ihrer Forderung gefährdet wird."
    },
    {
      "date": "2026-01-15",
      "id": "142447",
      "original_text": "Registerbekanntmachung nach dem Umwandlungsgesetz\nBayern Amtsgericht Augsburg HRB 19149\nAPPLICATED CONSULTING GmbH für angewandte EDV-Beratung – Eresing",
      "type": "Registerbekanntmachung nach dem Umwandlungsgesetz",
      "state": "Bayern",
      "amtsgericht": "Amtsgericht Augsburg",
      "registernummer": "HRB 19149",
      "registerart": "HRB",
      "company_name": "APPLICATED CONSULTING GmbH für angewandte EDV-Beratung",
      "company_seat": "Eresing",
      "details": "15.01.2026 (Bekanntmachungsdatum)\n\nBayern Amtsgericht Augsburg HRB 19149\nRegisterbekanntmachung nach dem Umwandlungsgesetz 14.01.2026 (Eintragungsdatum)\n\nAPPLICATED CONSULTING GmbH für angewandte EDV-Beratung\nGesellschaft mit beschränkter Haftung\nEresing\n\nDen Gläubigern der an der Verschmelzung beteiligten Rechtsträger ist, wenn sie binnen sechs Monaten nach dem Tag, an dem die Eintragung der Verschmelzung in das Register des Sitzes desjenigen Rechtsträgers, dessen Gläubiger sie sind, nach § 19 Abs. 3 UmwG als bekannt gemacht gilt, ihren Anspruch nach Grund und Höhe in Textform anmelden, Sicherheit zu leisten, soweit sie nicht Befriedigung verlangen können. Dieses Recht steht den Gläubigern jedoch nur zu, wenn sie glaubhaft machen, dass durch die Verschmelzung die Erfüllung ihrer Forderung gefährdet wird."
    },
    {
      "date": "2026-01-15",
      "id": "142448",
      "original_text": "Einreichung neuer Dokumente\nBayern Amtsgericht Augsburg HRB 6164\nLechwerke AG – Augsburg",
      "type": "Einreichung neuer Dokumente",
      "state": "Bayern",
      "amtsgericht": "Amtsgericht Augsburg",
      "registernummer": "HRB 6164",
      "registerart": "HRB",
      "company_name": "Lechwerke AG",
      "company_seat": "Augsburg",
      "details": "15.01.2026 (Bekanntmachungsdatum)\n\nBayern Amtsgericht Augsburg HRB 6164\nEinreichung neuer Dokumente\n\nLechwerke AG\nAktiengesellschaft\nAugsburg\n\nDem Amtsgericht Augsburg -Registergericht- ist eine Liste der Mitglieder des Aufsichtsrats eingereicht worden, § 106 AktG."
    },
    {
      "date": "2026-01-15",
      "id": "142449",
      "original_text": "Löschungsankündigung\nBayern Amtsgericht Coburg HRB 4553\nGroßpietsch Verwaltungs-GmbH – Redwitz",
      "type": "Löschungsankündigung",
      "state": "Bayern",
      "amtsgericht": "Amtsgericht Coburg",
      "registernummer": "HRB 4553",
      "registerart": "HRB",
      "company_name": "Großpietsch Verwaltungs-GmbH",
      "company_seat": "Redwitz",
      "details": "15.01.2026 (Bekanntmachungsdatum)\n\nBayern Amtsgericht Coburg HRB 4553\nLöschungsankündigung 13.01.2026 (Eintragungsdatum)\n\nGroßpietsch Verwaltungs-GmbH\nGesellschaft mit beschränkter Haftung\nRedwitz\n\nDas Registergericht beabsichtigt, die im Handelsregister eingetragene Gesellschaft wegen Vermögenslosigkeit von Amts wegen nach § 394 FamFG zu löschen. Die Frist zur Erhebung eines Widerspruchs ist auf sechs Wochen festgesetzt."
    },
    {
      "date": "2026-01-15",
      "id": "142450",
      "original_text": "Löschungsankündigung\nBayern Amtsgericht Fürth HRB 4081\nM. Heyer GmbH Applikator- Systeme – Markt Erlbach",
      "type": "Löschungsankündigung",
      "state": "Bayern",
      "amtsgericht": "Amtsgericht Fürth",
      "registernummer": "HRB 4081",
      "registerart": "HRB",
      "company_name": "M. Heyer GmbH Applikator- Systeme",
      "company_seat": "Markt Erlbach",
      "details": "15.01.2026 (Bekanntmachungsdatum)\n\nBayern Amtsgericht Fürth HRB 4081\nLöschungsankündigung 14.01.2026 (Eintragungsdatum)\n\nM. Heyer GmbH Applikator- Systeme\nGesellschaft mit beschränkter Haftung\nMarkt Erlbach\n\nDas Registergericht beabsichtigt, die im Handelsregister eingetragene Gesellschaft wegen Vermögenslosigkeit von Amts wegen nach § 394 FamFG zu löschen. Die Frist zur Erhebung eines Widerspruchs ist auf drei Monate festgesetzt."
    },
    {
      "date": "2026-01-15",
      "id": "142451",
      "original_text": "Einreichung neuer Dokumente\nBayern Amtsgericht Augsburg HRB 41839\nKUKA SE & Co. KGaA – Augsburg",
      "type": "Einreichung neuer Dokumente",
      "state": "Bayern",
      "amtsgericht": "Amtsgericht Augsburg",
      "registernummer": "HRB 41839",
      "registerart": "HRB",
      "company_name": "KUKA SE & Co. KGaA",
      "company_seat": "Augsburg",
      "details": "15.01.2026 (Bekanntmachungsdatum)\n\nBayern Amtsgericht Augsburg HRB 41839\nEinreichung neuer Dokumente\n\nKUKA SE & Co. KGaA\nKommanditgesellschaft auf Aktien\nAugsburg\n\nDem Amtsgericht Augsburg -Registergericht- isteine Liste der Mitglieder des Aufsichtsrats eingereicht worden, §§ 278 Abs. 3, 106 AktG."
    },
    {
      "date": "2026-01-15",
      "id": "142452",
      "original_text": "Sonstige Registerbekanntmachung\nBayern Amtsgericht Memmingen HRB 8257\nMETZELER SCHAUM Gesellschaft mit beschränkter Haftung – Memmingen",
      "type": "Sonstige Registerbekanntmachung",
      "state": "Bayern",
      "amtsgericht": "Amtsgericht Memmingen",
      "registernummer": "HRB 8257",
      "registerart": "HRB",
      "company_name": "METZELER SCHAUM Gesellschaft mit beschränkter Haftung",
      "company_seat": "Memmingen",
      "details": "15.01.2026 (Bekanntmachungsdatum)\n\nBayern Amtsgericht Memmingen HRB 8257\nSonstige Registerbekanntmachung 14.01.2026 (Eintragungsdatum)\n\nMETZELER SCHAUM Gesellschaft mit beschränkter Haftung\nGesellschaft mit beschränkter Haftung\nMemmingen\n\nDen Gläubigern der Gesellschaft, deren Forderungen begründet worden sind, bevor die Eintragung der Beendigung des Beherrschungs- und Gewinnabführungsvertrages in das Handelsregister nach § 10 des Handelsgesetzbuches als bekanntgemacht gilt, hat der andere Vertragsteil Sicherheit zu leisten, wenn sie sich binnen sechs Monaten nach der Bekanntmachung der Eintragung zu diesem Zweck bei ihm melden."
    },
    {
      "date": "2026-01-15",
      "id": "142453",
      "original_text": "Registerbekanntmachung nach dem Umwandlungsgesetz\nBayern Amtsgericht Augsburg HRB 33563\nCubilla GmbH – Fischach",
      "type": "Registerbekanntmachung nach dem Umwandlungsgesetz",
      "state": "Bayern",
      "amtsgericht": "Amtsgericht Augsburg",
      "registernummer": "HRB 33563",
      "registerart": "HRB",
      "company_name": "Cubilla GmbH",
      "company_seat": "Fischach",
      "details": "15.01.2026 (Bekanntmachungsdatum)\n\nBayern Amtsgericht Augsburg HRB 33563\nRegisterbekanntmachung nach dem Umwandlungsgesetz 14.01.2026 (Eintragungsdatum)\n\nCubilla GmbH\nGesellschaft mit beschränkter Haftung\nFischach\n\nDen Gläubigern der an der Verschmelzung beteiligten Rechtsträger ist, wenn sie binnen sechs Monaten nach dem Tag, an dem die Eintragung der Verschmelzung in das Register des Sitzes desjenigen Rechtsträgers, dessen Gläubiger sie sind, nach § 19 Abs. 3 UmwG als bekannt gemacht gilt, ihren Anspruch nach Grund und Höhe in Textform anmelden, Sicherheit zu leisten, soweit sie nicht Befriedigung verlangen können. Dieses Recht steht den Gläubigern jedoch nur zu, wenn sie glaubhaft machen, dass durch die Verschmelzung die Erfüllung ihrer Forderung gefährdet wird."
    },
    {
      "date": "2026-01-15",
      "id": "142454",
      "original_text": "Registerbekanntmachung nach dem Umwandlungsgesetz\nBayern Amtsgericht München HRB 226522\nPHÖNIX-Seniorenzentrum Fronmüllerstraße GmbH – München",
      "type": "Registerbekanntmachung nach dem Umwandlungsgesetz",
      "state": "Bayern",
      "amtsgericht": "Amtsgericht München",
      "registernummer": "HRB 226522",
      "registerart": "HRB",
      "company_name": "PHÖNIX-Seniorenzentrum Fronmüllerstraße GmbH",
      "company_seat": "München",
      "details": "15.01.2026 (Bekanntmachungsdatum)\n\nBayern Amtsgericht München HRB 226522\nRegisterbekanntmachung nach dem Umwandlungsgesetz 14.01.2026 (Eintragungsdatum)\n\nPHÖNIX-Seniorenzentrum Fronmüllerstraße GmbH\nGesellschaft mit beschränkter Haftung\nMünchen\n\nDen Gläubigern der an der Verschmelzung beteiligten Rechtsträger ist, wenn sie binnen sechs Monaten nach dem Tag, an dem die Eintragung der Verschmelzung in das Register des Sitzes desjenigen Rechtsträgers, dessen Gläubiger sie sind, nach § 19 Abs. 3 UmwG als bekannt gemacht gilt, ihren Anspruch nach Grund und Höhe in Textform anmelden, Sicherheit zu leisten, soweit sie nicht Befriedigung verlangen können. Dieses Recht steht den Gläubigern jedoch nur zu, wenn sie glaubhaft machen, dass durch die Verschmelzung die Erfüllung ihrer Forderung gefährdet wird."
    },
    {
      "date": "2026-01-15",
      "id": "142455",
      "original_text": "Registerbekanntmachung nach dem Umwandlungsgesetz\nBayern Amtsgericht München HRB 274630\nMasters of Digital GmbH – München",
      "type": "Registerbekanntmachung nach dem Umwandlungsgesetz",
      "state": "Bayern",
      "amtsgericht": "Amtsgericht München",
      "registernummer": "HRB 274630",
      "registerart": "HRB",
      "company_name": "Masters of Digital GmbH",
      "company_seat": "München",
      "details": "15.01.2026 (Bekanntmachungsdatum)\n\nBayern Amtsgericht München HRB 274630\nRegisterbekanntmachung nach dem Umwandlungsgesetz 14.01.2026 (Eintragungsdatum)\n\nMasters of Digital GmbH\nGesellschaft mit beschränkter Haftung\nMünchen\n\nDen Gläubigern der an der Verschmelzung beteiligten Rechtsträger ist, wenn sie binnen sechs Monaten nach dem Tag, an dem die Eintragung der Verschmelzung in das Register des Sitzes desjenigen Rechtsträgers, dessen Gläubiger sie sind, nach § 19 Abs. 3 UmwG als bekannt gemacht gilt, ihren Anspruch nach Grund und Höhe in Textform anmelden, Sicherheit zu leisten, soweit sie nicht Befriedigung verlangen können. Dieses Recht steht den Gläubigern jedoch nur zu, wenn sie glaubhaft machen, dass durch die Verschmelzung die Erfüllung ihrer Forderung gefährdet wird."
    },
    {
      "date": "2026-01-15",
      "id": "142456",
      "original_text": "Registerbekanntmachung nach dem Umwandlungsgesetz\nBayern Amtsgericht Augsburg HRB 20514\nLARS Project GmbH – Augsburg",
      "type": "Registerbekanntmachung nach dem Umwandlungsgesetz",
      "state": "Bayern",
      "amtsgericht": "Amtsgericht Augsburg",
      "registernummer": "HRB 20514",
      "registerart": "HRB",
      "company_name": "LARS Project GmbH",
      "company_seat": "Augsburg",
      "details": "15.01.2026 (Bekanntmachungsdatum)\n\nBayern Amtsgericht Augsburg HRB 20514\nRegisterbekanntmachung nach dem Umwandlungsgesetz 14.01.2026 (Eintragungsdatum)\n\nLARS Project GmbH\nGesellschaft mit beschränkter Haftung\nAugsburg\n\nDen Gläubigern der an der Verschmelzung beteiligten Rechtsträger ist, wenn sie binnen sechs Monaten nach dem Tag, an dem die Eintragung der Verschmelzung in das Register des Sitzes desjenigen Rechtsträgers, dessen Gläubiger sie sind, nach § 19 Abs. 3 UmwG als bekannt gemacht gilt, ihren Anspruch nach Grund und Höhe in Textform anmelden, Sicherheit zu leisten, soweit sie nicht Befriedigung verlangen können. Dieses Recht steht den Gläubigern jedoch nur zu, wenn sie glaubhaft machen, dass durch die Verschmelzung die Erfüllung ihrer Forderung gefährdet wird."
    },
    {
      "date": "2026-01-15",
      "id": "142457",
      "original_text": "Löschungsankündigung\nBayern Amtsgericht Nürnberg HRB 28147\nAP Aqua Power Nürnberg GmbH – Röthenbach a.d.Pegnitz",
      "type": "Löschungsankündigung",
      "state": "Bayern",
      "amtsgericht": "Amtsgericht Nürnberg",
      "registernummer": "HRB 28147",
      "registerart": "HRB",
      "company_name": "AP Aqua Power Nürnberg GmbH",
      "company_seat": "Röthenbach a.d.Pegnitz",
      "details": "15.01.2026 (Bekanntmachungsdatum)\n\nBayern Amtsgericht Nürnberg HRB 28147\nLöschungsankündigung\n\nAP Aqua Power Nürnberg GmbH\nGesellschaft mit beschränkter Haftung\nRöthenbach a.d.Pegnitz\n\nDas Registergericht beabsichtigt, die im Handelsregister eingetragene Gesellschaft wegen Vermögenslosigkeit von Amts wegen nach § 394 FamFG zu löschen. Die Frist zur Erhebung eines Widerspruchs ist auf einen Monat festgesetzt."
    },
    {
      "date": "2026-01-15",
      "id": "142458",
      "original_text": "Einreichung neuer Dokumente\nBayern Amtsgericht Ingolstadt HRB 2585\nINIT Consulting AG – Ingolstadt",
      "type": "Einreichung neuer Dokumente",
      "state": "Bayern",
      "amtsgericht": "Amtsgericht Ingolstadt",
      "registernummer": "HRB 2585",
      "registerart": "HRB",
      "company_name": "INIT Consulting AG",
      "company_seat": "Ingolstadt",
      "details": "15.01.2026 (Bekanntmachungsdatum)\n\nBayern Amtsgericht Ingolstadt HRB 2585\nEinreichung neuer Dokumente\n\nINIT Consulting AG\nAktiengesellschaft\nIngolstadt\n\nDem Amtsgericht Ingolstadt -Registergericht- ist eine Liste der Mitglieder des Aufsichtsrats eingereicht worden, § 106 AktG."
    },
    {
      "date": "2026-01-15",
      "id": "142459",
      "original_text": "Einreichung neuer Dokumente\nBayern Amtsgericht München HRB 175987\nWackler Holding SE – München",
      "type": "Einreichung neuer Dokumente",
      "state": "Bayern",
      "amtsgericht": "Amtsgericht München",
      "registernummer": "HRB 175987",
      "registerart": "HRB",
      "company_name": "Wackler Holding SE",
      "company_seat": "München",
      "details": "15.01.2026 (Bekanntmachungsdatum)\n\nBayern Amtsgericht München HRB 175987\nEinreichung neuer Dokumente 14.01.2026 (Eintragungsdatum)\n\nWackler Holding SE\nEuropäische Aktiengesellschaft (SE)\nMünchen\n\nDem Amtsgericht München -Registergericht- ist eine Liste der Mitglieder des Aufsichtsrats eingereicht worden, Art. 9 Abs. 1 Buchst. c (ii) SE-VO i.V.m. § 106 AktG."
    },
    {
      "date": "2026-01-15",
      "id": "142460",
      "original_text": "Sonstige Registerbekanntmachung\nBayern Amtsgericht Fürth HRB 9128\nRWS GmbH – Fürth",
      "type": "Sonstige Registerbekanntmachung",
      "state": "Bayern",
      "amtsgericht": "Amtsgericht Fürth",
      "registernummer": "HRB 9128",
      "registerart": "HRB",
      "company_name": "RWS GmbH",
      "company_seat": "Fürth",
      "details": "15.01.2026 (Bekanntmachungsdatum)\n\nBayern Amtsgericht Fürth HRB 9128\nSonstige Registerbekanntmachung 14.01.2026 (Eintragungsdatum)\n\nRWS GmbH\nGesellschaft mit beschränkter Haftung\nFürth\n\nDen Gläubigern der Gesellschaft, deren Forderungen begründet worden sind, bevor die Eintragung der Beendigung des Gewinnabführungsvertrages in das Handelsregister nach § 10 des Handelsgesetzbuches als bekanntgemacht gilt, hat der andere Vertragsteil Sicherheit zu leisten, wenn sie sich binnen sechs Monaten nach der Bekanntmachung der Eintragung zu diesem Zweck bei ihm melden."
    },
    {
      "date": "2026-01-15",
      "id": "142461",
      "original_text": "Löschungsankündigung\nBayern Amtsgericht München HRB 281132\nbodegary UG (haftungsbeschränkt) – München",
      "type": "Löschungsankündigung",
      "state": "Bayern",
      "amtsgericht": "Amtsgericht München",
      "registernummer": "HRB 281132",
      "registerart": "HRB",
      "company_name": "bodegary UG (haftungsbeschränkt)",
      "company_seat": "München",
      "details": "15.01.2026 (Bekanntmachungsdatum)\n\nBayern Amtsgericht München HRB 281132\nLöschungsankündigung 14.01.2026 (Eintragungsdatum)\n\nbodegary UG (haftungsbeschränkt)\nGesellschaft mit beschränkter Haftung\nMünchen\n\nDas Registergericht beabsichtigt, die im Handelsregister eingetragene Gesellschaft wegen Vermögenslosigkeit von Amts wegen nach § 394 FamFG zu löschen. Die Frist zur Erhebung eines Widerspruchs ist auf drei Monate festgesetzt."
    },
    {
      "date": "2026-01-15",
      "id": "142462",
      "original_text": "Registerbekanntmachung nach dem Umwandlungsgesetz\nBayern Amtsgericht Augsburg HRB 31111\nLars Real Estate Holding GmbH – Augsburg",
      "type": "Registerbekanntmachung nach dem Umwandlungsgesetz",
      "state": "Bayern",
      "amtsgericht": "Amtsgericht Augsburg",
      "registernummer": "HRB 31111",
      "registerart": "HRB",
      "company_name": "Lars Real Estate Holding GmbH",
      "company_seat": "Augsburg",
      "details": "15.01.2026 (Bekanntmachungsdatum)\n\nBayern Amtsgericht Augsburg HRB 31111\nRegisterbekanntmachung nach dem Umwandlungsgesetz 14.01.2026 (Eintragungsdatum)\n\nLars Real Estate Holding GmbH\nGesellschaft mit beschränkter Haftung\nAugsburg\n\nDen Gläubigern der an der Verschmelzung beteiligten Rechtsträger ist, wenn sie binnen sechs Monaten nach dem Tag, an dem die Eintragung der Verschmelzung in das Register des Sitzes desjenigen Rechtsträgers, dessen Gläubiger sie sind, nach § 19 Abs. 3 UmwG als bekannt gemacht gilt, ihren Anspruch nach Grund und Höhe in Textform anmelden, Sicherheit zu leisten, soweit sie nicht Befriedigung verlangen können. Dieses Recht steht den Gläubigern jedoch nur zu, wenn sie glaubhaft machen, dass durch die Verschmelzung die Erfüllung ihrer Forderung gefährdet wird."
    },
    {
      "date": "2026-01-15",
      "id": "142463",
      "original_text": "Einreichung neuer Dokumente\nBaden-Württemberg Amtsgericht Stuttgart HRB 265171\nPMTsolutions Aktiengesellschaft – Stuttgart",
      "type": "Einreichung neuer Dokumente",
      "state": "Baden-Württemberg",
      "amtsgericht": "Amtsgericht Stuttgart",
      "registernummer": "HRB 265171",
      "registerart": "HRB",
      "company_name": "PMTsolutions Aktiengesellschaft",
      "company_seat": "Stuttgart",
      "details": "15.01.2026 (Bekanntmachungsdatum)\n\nBaden-Württemberg Amtsgericht Stuttgart HRB 265171\nEinreichung neuer Dokumente\n\nPMTsolutions Aktiengesellschaft\nAktiengesellschaft\nStuttgart\n\nDie Gesellschaft hat am 14.01.2026 die Liste über die Zusammensetzung des Aufsichtsrats zum Handelsregister eingereicht."
    },
    {
      "date": "2026-01-15",
      "id": "142464",
      "original_text": "Löschungsankündigung\nSaarland Amtsgericht Saarbrücken HRB 17651\nSilesia Investment GmbH – Völklingen",
      "type": "Löschungsankündigung",
      "state": "Saarland",
      "amtsgericht": "Amtsgericht Saarbrücken",
      "registernummer": "HRB 17651",
      "registerart": "HRB",
      "company_name": "Silesia Investment GmbH",
      "company_seat": "Völklingen",
      "details": "15.01.2026 (Bekanntmachungsdatum)\n\nSaarland Amtsgericht Saarbrücken HRB 17651\nLöschungsankündigung\n\nSilesia Investment GmbH\nGesellschaft mit beschränkter Haftung\nVölklingen\n\nEs ist beabsichtigt, die Gesellschaft von Amts wegen gemäß § 394 FamFG wegen Vermögenslosigkeit zu löschen.\nGegen die Löschung von Amts wegen ist das Rechtsmittel des Widerspruchs statthaft. Der Widerspruch ist binnen einer Frist zwei Monaten beginnend mit dem Tag dieser Veröffentlichung durch Einreichen eines Widerspruchsschreibens -schriftlich oder zur Niederschrift der Geschäftsstelle beim Amtsgericht Saarbrücken, -zentrales Handelsregister-, Mainzerstr.178, 66121 Saarbrücken einzulegen.\nDer Widerspruch muss die Bezeichnung der angefochtenen Löschungsankündigung enthalten sowie die Erklärung, dass Widerspruch eingelegt wird. Er ist vom Widerspruchsführer oder seinem Bevollmächtigten zu unterzeichnen.\nDas Widerspruchsschreiben kann auch in der Form eines elektronischen Dokumentes eingereicht werden, das mit einer qualifizierten elektronischen Signatur nach dem Signaturgesetz versehen sein muss (§§ 14 Abs. 2 FamFG, 130a, 298 ZPO)."
    },
    {
      "date": "2026-01-15",
      "id": "142465",
      "original_text": "Löschungsankündigung\nSaarland Amtsgericht Saarbrücken HRB 104240\nTLFM UG (haftungsbeschränkt) – Völklingen",
      "type": "Löschungsankündigung",
      "state": "Saarland",
      "amtsgericht": "Amtsgericht Saarbrücken",
      "registernummer": "HRB 104240",
      "registerart": "HRB",
      "company_name": "TLFM UG (haftungsbeschränkt)",
      "company_seat": "Völklingen",
      "details": "15.01.2026 (Bekanntmachungsdatum)\n\nSaarland Amtsgericht Saarbrücken HRB 104240\nLöschungsankündigung\n\nTLFM UG (haftungsbeschränkt)\nGesellschaft mit beschränkter Haftung\nVölklingen\n\nEs ist beabsichtigt, die Gesellschaft von Amts wegen gemäß § 394 FamFG wegen Vermögenslosigkeit zu löschen.\nGegen die Löschung von Amts wegen ist das Rechtsmittel des Widerspruchs statthaft. Der Widerspruch ist binnen einer Frist zwei Monaten beginnend mit dem Tag dieser Veröffentlichung durch Einreichen eines Widerspruchsschreibens -schriftlich oder zur Niederschrift der Geschäftsstelle beim Amtsgericht Saarbrücken, -zentrales Handelsregister-, Mainzerstr.178, 66121 Saarbrücken einzulegen.\nDer Widerspruch muss die Bezeichnung der angefochtenen Löschungsankündigung enthalten sowie die Erklärung, dass Widerspruch eingelegt wird. Er ist vom Widerspruchsführer oder seinem Bevollmächtigten zu unterzeichnen.\nDas Widerspruchsschreiben kann auch in der Form eines elektronischen Dokumentes eingereicht werden, das mit einer qualifizierten elektronischen Signatur nach dem Signaturgesetz versehen sein muss (§§ 14 Abs. 2 FamFG, 130a, 298 ZPO)."
    },
    {
      "date": "2026-01-15",
      "id": "142466",
      "original_text": "Registerbekanntmachung nach dem Umwandlungsgesetz\nHamburg Amtsgericht Hamburg HRB 171336\nNotch GmbH – Hamburg",
      "type": "Registerbekanntmachung nach dem Umwandlungsgesetz",
      "state": "Hamburg",
      "amtsgericht": "Amtsgericht Hamburg",
      "registernummer": "HRB 171336",
      "registerart": "HRB",
      "company_name": "Notch GmbH",
      "company_seat": "Hamburg",
      "details": "15.01.2026 (Bekanntmachungsdatum)\n\nHamburg Amtsgericht Hamburg HRB 171336\nRegisterbekanntmachung nach dem Umwandlungsgesetz 15.01.2026 (Eintragungsdatum)\n\nNotch GmbH\nGesellschaft mit beschränkter Haftung\nHamburg\n\nAls nicht eingetragen wird bekannt gemacht:\nDen Gläubigern der an der Verschmelzung beteiligten Gesellschaften ist, wenn sie binnen sechs Monaten nach dem Tag, an dem die Eintragung der Verschmelzung in das Register des Sitzes desjenigen Rechtsträgers, dessen Gläubiger sie sind, nach § 19 Absatz 3 UmwG als bekannt gemacht gilt, ihren Anspruch nach Grund und Höhe schriftlich anmelden, Sicherheit zu leisten, soweit sie nicht Befriedigung verlangen können. Dieses Recht steht den Gläubigern jedoch nur zu, wenn sie glaubhaft machen, dass durch die Verschmelzung die Erfüllung ihrer Forderung gefährdet wird."
    },
    {
      "date": "2026-01-15",
      "id": "142467",
      "original_text": "Löschungsankündigung\nSaarland Amtsgericht Saarbrücken HRB 104818\nVal'oeuf UG (haftungsbeschränkt) – Weiskirchen",
      "type": "Löschungsankündigung",
      "state": "Saarland",
      "amtsgericht": "Amtsgericht Saarbrücken",
      "registernummer": "HRB 104818",
      "registerart": "HRB",
      "company_name": "Val'oeuf UG (haftungsbeschränkt)",
      "company_seat": "Weiskirchen",
      "details": "15.01.2026 (Bekanntmachungsdatum)\n\nSaarland Amtsgericht Saarbrücken HRB 104818\nLöschungsankündigung\n\nVal'oeuf UG (haftungsbeschränkt)\nGesellschaft mit beschränkter Haftung\nWeiskirchen\n\nEs ist beabsichtigt, die Gesellschaft von Amts wegen gemäß § 394 FamFG wegen Vermögenslosigkeit zu löschen.\nGegen die Löschung von Amts wegen ist das Rechtsmittel des Widerspruchs statthaft. Der Widerspruch ist binnen einer Frist zwei Monaten beginnend mit dem Tag dieser Veröffentlichung durch Einreichen eines Widerspruchsschreibens -schriftlich oder zur Niederschrift der Geschäftsstelle beim Amtsgericht Saarbrücken, -zentrales Handelsregister-, Mainzerstr.178, 66121 Saarbrücken einzulegen.\nDer Widerspruch muss die Bezeichnung der angefochtenen Löschungsankündigung enthalten sowie die Erklärung, dass Widerspruch eingelegt wird. Er ist vom Widerspruchsführer oder seinem Bevollmächtigten zu unterzeichnen.\nDas Widerspruchsschreiben kann auch in der Form eines elektronischen Dokumentes eingereicht werden, das mit einer qualifizierten elektronischen Signatur nach dem Signaturgesetz versehen sein muss (§§ 14 Abs. 2 FamFG, 130a, 298 ZPO)."
    },
    {
      "date": "2026-01-15",
      "id": "142468",
      "original_text": "Löschungsankündigung\nBaden-Württemberg Amtsgericht Stuttgart HRB 760775\nappologic Verwaltungsgesellschaft mbH – Bad Wimpfen",
      "type": "Löschungsankündigung",
      "state": "Baden-Württemberg",
      "amtsgericht": "Amtsgericht Stuttgart",
      "registernummer": "HRB 760775",
      "registerart": "HRB",
      "company_name": "appologic Verwaltungsgesellschaft mbH",
      "company_seat": "Bad Wimpfen",
      "details": "15.01.2026 (Bekanntmachungsdatum)\n\nBaden-Württemberg Amtsgericht Stuttgart HRB 760775\nLöschungsankündigung\n\nappologic Verwaltungsgesellschaft mbH\nGesellschaft mit beschränkter Haftung\nBad Wimpfen\n\nDas Gericht beabsichtigt, die Gesellschaft wegen Vermögenslosigkeit im Handelsregister von Amts wegen nach § 394 FamFG zu löschen. Die Frist zur Geltendmachung eines Widerspruchs gegen die beabsichtigte Löschung ist auf zwei Monate ab Veröffentlichung bestimmt."
    },
    {
      "date": "2026-01-15",
      "id": "142469",
      "original_text": "Einreichung neuer Dokumente\nBaden-Württemberg Amtsgericht Freiburg HRB 714535\nIMS Gear Management SE – Donaueschingen",
      "type": "Einreichung neuer Dokumente",
      "state": "Baden-Württemberg",
      "amtsgericht": "Amtsgericht Freiburg",
      "registernummer": "HRB 714535",
      "registerart": "HRB",
      "company_name": "IMS Gear Management SE",
      "company_seat": "Donaueschingen",
      "details": "15.01.2026 (Bekanntmachungsdatum)\n\nBaden-Württemberg Amtsgericht Freiburg HRB 714535\nEinreichung neuer Dokumente\n\nIMS Gear Management SE\nEuropäische Aktiengesellschaft (SE)\nDonaueschingen\n\nDie Gesellschaft hat am 14.01.2026 die Liste über die Zusammensetzung des Aufsichtsrats zum Handelsregister eingereicht."
    },
    {
      "date": "2026-01-15",
      "id": "142470",
      "original_text": "Registerbekanntmachung nach dem Umwandlungsgesetz\nBrandenburg Amtsgericht Potsdam HRB 28039\nGMS-Montage GmbH – Kloster Lehnin",
      "type": "Registerbekanntmachung nach dem Umwandlungsgesetz",
      "state": "Brandenburg",
      "amtsgericht": "Amtsgericht Potsdam",
      "registernummer": "HRB 28039",
      "registerart": "HRB",
      "company_name": "GMS-Montage GmbH",
      "company_seat": "Kloster Lehnin",
      "details": "15.01.2026 (Bekanntmachungsdatum)\n\nBrandenburg Amtsgericht Potsdam HRB 28039\nRegisterbekanntmachung nach dem Umwandlungsgesetz 12.01.2026 (Eintragungsdatum)\n\nGMS-Montage GmbH\nGesellschaft mit beschränkter Haftung\nKloster Lehnin\n\nZu Eintragungsnummer 4 vom 12.01.2026 wird als nicht eingetragen veröffentlicht:\nDen Gläubigern der an der Verschmelzung beteiligten Rechtsträger ist, wenn sie binnen sechs Monaten nach dem Tag, an dem die Eintragung der Verschmelzung in das Register des Sitzes desjenigen Rechtsträgers, dessen Gläubiger sie sind, als bekannt gemacht gilt, ihren Anspruch nach Grund und Höhe schriftlich anmelden, Sicherheit zu leisten, soweit sie nicht Befriedigung verlangen können. Dieses Recht steht den Gläubigern jedoch nur zu, wenn sie glaubhaft machen, dass durch die Verschmelzung die Erfüllung ihrer Forderung gefährdet wird"
    },
    {
      "date": "2026-01-15",
      "id": "142471",
      "original_text": "Registerbekanntmachung nach dem Umwandlungsgesetz\nBaden-Württemberg Amtsgericht Mannheim HRB 756944\nBertsche Holding GmbH – Karlsruhe",
      "type": "Registerbekanntmachung nach dem Umwandlungsgesetz",
      "state": "Baden-Württemberg",
      "amtsgericht": "Amtsgericht Mannheim",
      "registernummer": "HRB 756944",
      "registerart": "HRB",
      "company_name": "Bertsche Holding GmbH",
      "company_seat": "Karlsruhe",
      "details": "15.01.2026 (Bekanntmachungsdatum)\n\nBaden-Württemberg Amtsgericht Mannheim HRB 756944\nRegisterbekanntmachung nach dem Umwandlungsgesetz 15.01.2026 (Eintragungsdatum)\n\nBertsche Holding GmbH\nGesellschaft mit beschränkter Haftung\nKarlsruhe\n\nAls nicht eingetragen wird bekanntgemacht:\nDen Gläubigern der an der Ausgliederung beteiligten Rechtsträger ist, wenn sie binnen sechs Monaten nach dem Tag, an dem die Eintragung der Ausgliederung in das Register des Sitzes desjenigen Rechtsträgers, dessen Gläubiger sie sind, nach § 19 Abs. 3 UmwG als bekanntgemacht gilt, ihren Anspruch nach Grund und Höhe schriftlich anmelden, Sicherheit zu leisten, soweit sie nicht Befriedigung verlangen können. Dieses Recht steht den Gläubigern jedoch nur zu, wenn sie glaubhaft machen, dass durch die Ausgliederung die Erfüllung ihrer Forderung gefährdet wird."
    },
    {
      "date": "2026-01-15",
      "id": "142472",
      "original_text": "Löschungsankündigung\nSaarland Amtsgericht Saarbrücken HRB 108159\nAqua Bloom GmbH – Saarbrücken",
      "type": "Löschungsankündigung",
      "state": "Saarland",
      "amtsgericht": "Amtsgericht Saarbrücken",
      "registernummer": "HRB 108159",
      "registerart": "HRB",
      "company_name": "Aqua Bloom GmbH",
      "company_seat": "Saarbrücken",
      "details": "15.01.2026 (Bekanntmachungsdatum)\n\nSaarland Amtsgericht Saarbrücken HRB 108159\nLöschungsankündigung\n\nAqua Bloom GmbH\nGesellschaft mit beschränkter Haftung\nSaarbrücken\n\nDas Gericht beabsichtigt die Eintragung des Geschäftsführers von Amts wegen gemäß § 395 FamFG i.V.m. § 6 Abs. 2 Satz 2 Nr. 2 und 3 und Satz 3 GmbHG als nachträglich rechtlich unzulässig zu löschen.Gemäß § 6 Abs. 2 Satz 2 Nr. 2 und 3 und Satz 3 GmbHG kann Geschäftsführer nicht sein, wer aufgrund eines gerichtlichen Urteils oder einer vollziehbaren Entscheidung einer Verwaltungsbehörde einen Beruf, einen Berufszweig, ein Gewerbe oder einen Gewerbezweig nicht ausüben darf, sofern der Unternehmensgegenstand ganz oder teilweise mit dem Gegenstand des Verbots übereinstimmt.\nFerner kann nicht Geschäftsführer sein, wer wegen einer oder mehrerer vorsätzlich begangener Straftaten a) des Unterlassens der Stellung des Antrags auf Eröffnung des Insolvenzverfahrens (Insolvenzverschleppung),b)nach den § 283 bis 283d des Strafgesetzbuchs (Insolvenzstraftaten),\nc) der falschen Angaben nach § 82 GmbHG oder § 399 des Aktiengesetzes, d)der unrichtigen Darstellung nach § 400 des Aktiengesetzes, § 331 des Handelsgesetzbuchs, § 313 des Umwandlungsgesetzes oder § 17 des Publizitätsgesetzes oder e) nach den §§ 263 bis 264a oder den §§ 265 b bis 266a des Strafgesetzbuchs zu einer Freiheitsstrafe von mindestens einem Jahr verurteilt worden ist; dieser Ausschluss gilt für die Dauer von fünf Jahren seit der Rechtskraft des Urteils, wobei die Zeit nicht eingerechnet wird, in welcher der Täter auf behördliche Anordnung in einer Anstalt verwahrt worden ist.\nDies gilt entsprechend bei einer Verurteilung im Ausland wegen einer Tat, die mit den oben aufgeführten Straftaten vergleichbar ist.\nDurch Bescheid der Landeshauptstadt Saarbrücken AZ: GB 1 TT-SvK-1391286 vom 22.07.2025 wurde die Ausübung eines Gewerbes untersagt.\nDie Entscheidung ist am 28.11.2025 in Rechtskraft erwachsen.\nSeit diesem Zeitpunkt ist das Amt als Geschäftsführer kraft Gesetzes erloschen.\nZum Schutz des Rechtsverkehrs ist daher die Löschung Ihrer Eintragung als Geschäftsführer vorzunehmen\nRechtsbehelfsbelehrung\nGegen die Löschung von Amts wegen ist das Rechtsmittel des Widerspruchs statthaft. Der Widerspruch ist binnen einer Frist von 2 Monaten beginnend mit der Veröffentlichung durch Einreichen eines Widerspruchsschreibens - schriftlich oder zur Niederschrift der Geschäftsstelle - beim Amtsgericht Saarbrücken, - Zentrales Handelsregister -, Mainzer Straße 178, 66121 Saarbrücken einzulegen.\nDer Widerspruch muss die Bezeichnung der angefochtenen Löschungsankündigung enthalten sowie die Erklärung, dass Widerspruch eingelegt wird. Er ist vom Widerspruchsführer oder seinem Bevollmächtigten zu unterzeichnen.\nDas Widerspruchsschreiben kann auch in der Form eines elektronischen Dokumentes eingereicht werden, das mit einer qualifizierten elektronischen Signatur nach dem Signaturgesetz versehen sein muss (§§ 14 Abs. 2 Fam FG, 130 a Abs. 1 und 3, 298 ZPO)."
    },
    {
      "date": "2026-01-15",
      "id": "142473",
      "original_text": "Löschungsankündigung\nBaden-Württemberg Amtsgericht Stuttgart HRA 734989\nKlima Diamant e.K. – Herrenberg",
      "type": "Löschungsankündigung",
      "state": "Baden-Württemberg",
      "amtsgericht": "Amtsgericht Stuttgart",
      "registernummer": "HRA 734989",
      "registerart": "HRA",
      "company_name": "Klima Diamant e.K.",
      "company_seat": "Herrenberg",
      "details": "15.01.2026 (Bekanntmachungsdatum)\n\nBaden-Württemberg Amtsgericht Stuttgart HRA 734989\nLöschungsankündigung\n\nKlima Diamant e.K.\nEinzelkaufmann / Einzelkauffrau\nHerrenberg\n\nAls nicht eingetragen wird bekanntgemacht:\nDas Registergericht beabsichtigt, die Firma im Handelsregister von Amts wegen nach § 31 Abs. 2 HGB zu löschen. Die Frist zur Geltendmachung eines Widerspruchs gegen die beabsichtigte Löschung ist auf einen Monat ab Veröffentlichung bestimmt."
    },
    {
      "date": "2026-01-15",
      "id": "142474",
      "original_text": "Registerbekanntmachung nach dem Umwandlungsgesetz\nBaden-Württemberg Amtsgericht Mannheim HRA 712712\nPlan B Immobilien Jochen Bertsche e.K. – Karlsruhe",
      "type": "Registerbekanntmachung nach dem Umwandlungsgesetz",
      "state": "Baden-Württemberg",
      "amtsgericht": "Amtsgericht Mannheim",
      "registernummer": "HRA 712712",
      "registerart": "HRA",
      "company_name": "Plan B Immobilien Jochen Bertsche e.K.",
      "company_seat": "Karlsruhe",
      "details": "15.01.2026 (Bekanntmachungsdatum)\n\nBaden-Württemberg Amtsgericht Mannheim HRA 712712\nRegisterbekanntmachung nach dem Umwandlungsgesetz 15.01.2026 (Eintragungsdatum)\n\nPlan B Immobilien Jochen Bertsche e.K.\nEinzelkaufmann / Einzelkauffrau\nKarlsruhe\n\nDen Gläubigern der an der Ausgliederung beteiligten Rechtsträger ist, wenn sie binnen sechs Monaten nach dem Tag, an dem die Eintragung der Ausgliederung in das Register des Sitzes desjenigen Rechtsträgers, dessen Gläubiger sie sind, nach § 19 Abs. 3 UmwG als bekanntgemacht gilt, ihren Anspruch nach Grund und Höhe schriftlich anmelden, Sicherheit zu leisten, soweit sie nicht Befriedigung verlangen können. Dieses Recht steht den Gläubigern jedoch nur zu, wenn sie glaubhaft machen, dass durch die Ausgliederung die Erfüllung ihrer Forderung gefährdet wird."
    },
    {
      "date": "2026-01-15",
      "id": "142475",
      "original_text": "Einreichung neuer Dokumente\nBaden-Württemberg Amtsgericht Stuttgart HRB 796011\nTüParken GmbH – Tübingen",
      "type": "Einreichung neuer Dokumente",
      "state": "Baden-Württemberg",
      "amtsgericht": "Amtsgericht Stuttgart",
      "registernummer": "HRB 796011",
      "registerart": "HRB",
      "company_name": "TüParken GmbH",
      "company_seat": "Tübingen",
      "details": "15.01.2026 (Bekanntmachungsdatum)\n\nBaden-Württemberg Amtsgericht Stuttgart HRB 796011\nEinreichung neuer Dokumente\n\nTüParken GmbH\nGesellschaft mit beschränkter Haftung\nTübingen\n\nDie Gesellschaft hat am 14.01.2026 die Liste über die Zusammensetzung des Aufsichtsrats zum Handelsregister eingereicht."
    },
    {
      "date": "2026-01-15",
      "id": "142476",
      "original_text": "Sonstige Registerbekanntmachung\nBaden-Württemberg Amtsgericht Freiburg HRB 721379\nAlbert Weber GmbH – Markdorf",
      "type": "Sonstige Registerbekanntmachung",
      "state": "Baden-Württemberg",
      "amtsgericht": "Amtsgericht Freiburg",
      "registernummer": "HRB 721379",
      "registerart": "HRB",
      "company_name": "Albert Weber GmbH",
      "company_seat": "Markdorf",
      "details": "15.01.2026 (Bekanntmachungsdatum)\n\nBaden-Württemberg Amtsgericht Freiburg HRB 721379\nSonstige Registerbekanntmachung 15.01.2026 (Eintragungsdatum)\n\nAlbert Weber GmbH\nGesellschaft mit beschränkter Haftung\nMarkdorf\n\nAls nicht eingetragen wird bekanntgemacht:\nDen Gläubigern der Gesellschaft, deren Forderungen begründet worden sind, bevor die Eintragung der Beendigung des Vertrages in das Handelsregister nach § 10 HGB als bekanntgemacht gilt, ist vom anderen Vertragsteil Sicherheit zu leisten, wenn sie sich binnen sechs Monaten nach der Bekanntmachung zu diesem Zweck bei ihm melden."
    },
    {
      "date": "2026-01-15",
      "id": "142477",
      "original_text": "Registerbekanntmachung nach dem Umwandlungsgesetz\nBaden-Württemberg Amtsgericht Stuttgart HRB 773556\nGastwerk-Event GmbH – Reutlingen",
      "type": "Registerbekanntmachung nach dem Umwandlungsgesetz",
      "state": "Baden-Württemberg",
      "amtsgericht": "Amtsgericht Stuttgart",
      "registernummer": "HRB 773556",
      "registerart": "HRB",
      "company_name": "Gastwerk-Event GmbH",
      "company_seat": "Reutlingen",
      "details": "15.01.2026 (Bekanntmachungsdatum)\n\nBaden-Württemberg Amtsgericht Stuttgart HRB 773556\nRegisterbekanntmachung nach dem Umwandlungsgesetz 15.01.2026 (Eintragungsdatum)\n\nGastwerk-Event GmbH\nGesellschaft mit beschränkter Haftung\nReutlingen\n\nDen Gläubigern der an der Verschmelzung beteiligten Rechtsträger ist, wenn sie binnen sechs Monaten nach dem Tag, an dem die Eintragung der Verschmelzung in das Register des Sitzes desjenigen Rechtsträgers, dessen Gläubiger sie sind, nach § 19 Abs. 3 UmwG als bekanntgemacht gilt, ihren Anspruch nach Grund und Höhe schriftlich anmelden, Sicherheit zu leisten, soweit sie nicht Befriedigung verlangen können. Dieses Recht steht den Gläubigern jedoch nur zu, wenn sie glaubhaft machen, dass durch die Verschmelzung die Erfüllung ihrer Forderung gefährdet wird."
    },
    {
      "date": "2026-01-15",
      "id": "142478",
      "original_text": "Sonstige Registerbekanntmachung\nMecklenburg-Vorpommern Amtsgericht Rostock HRB 3792\nWohnungsgesellschaft Güstrow (WGG) Gesellschaft mit beschränkter Haftung – Güstrow",
      "type": "Sonstige Registerbekanntmachung",
      "state": "Mecklenburg-Vorpommern",
      "amtsgericht": "Amtsgericht Rostock",
      "registernummer": "HRB 3792",
      "registerart": "HRB",
      "company_name": "Wohnungsgesellschaft Güstrow (WGG) Gesellschaft mit beschränkter Haftung",
      "company_seat": "Güstrow",
      "details": "15.01.2026 (Bekanntmachungsdatum)\n\nMecklenburg-Vorpommern Amtsgericht Rostock HRB 3792\nSonstige Registerbekanntmachung 07.01.2026 (Eintragungsdatum)\n\nWohnungsgesellschaft Güstrow (WGG) Gesellschaft mit beschränkter Haftung\nGesellschaft mit beschränkter Haftung\nGüstrow\n\nEine Liste der Mitglieder des Aufsichtsrats ist zum Handelsregister eingereicht worden."
    },
    {
      "date": "2026-01-15",
      "id": "142479",
      "original_text": "Einreichung neuer Dokumente\nBerlin Amtsgericht Berlin (Charlottenburg) HRB 260878\nSKD SE – Berlin",
      "type": "Einreichung neuer Dokumente",
      "state": "Berlin",
      "amtsgericht": "Amtsgericht Berlin (Charlottenburg)",
      "registernummer": "HRB 260878",
      "registerart": "HRB",
      "company_name": "SKD SE",
      "company_seat": "Berlin",
      "details": "15.01.2026 (Bekanntmachungsdatum)\n\nBerlin Amtsgericht Berlin (Charlottenburg) HRB 260878\nEinreichung neuer Dokumente\n\nSKD SE\nEuropäische Aktiengesellschaft (SE)\nBerlin\n\nAls nicht eingetragen wird veröffentlicht: Es wurde eine neue Liste der Aufsichtsratsmitglieder eingereicht (§ 106 AktG)."
    },
    {
      "date": "2026-01-15",
      "id": "142480",
      "original_text": "Registerbekanntmachung nach dem Umwandlungsgesetz\nHamburg Amtsgericht Hamburg HRB 91571\nVerwaltung Dreiundsechzigste IFH geschlossener Immobilienfonds für Holland GmbH – Hamburg",
      "type": "Registerbekanntmachung nach dem Umwandlungsgesetz",
      "state": "Hamburg",
      "amtsgericht": "Amtsgericht Hamburg",
      "registernummer": "HRB 91571",
      "registerart": "HRB",
      "company_name": "Verwaltung Dreiundsechzigste IFH geschlossener Immobilienfonds für Holland GmbH",
      "company_seat": "Hamburg",
      "details": "15.01.2026 (Bekanntmachungsdatum)\n\nHamburg Amtsgericht Hamburg HRB 91571\nRegisterbekanntmachung nach dem Umwandlungsgesetz 15.01.2026 (Eintragungsdatum)\n\nVerwaltung Dreiundsechzigste IFH geschlossener Immobilienfonds für Holland GmbH\nGesellschaft mit beschränkter Haftung\nHamburg\n\nAls nicht eingetragen wird bekannt gemacht:\nDen Gläubigern der an der Verschmelzung beteiligten Gesellschaften ist, wenn sie binnen sechs Monaten nach dem Tag, an dem die Eintragung der Verschmelzung in das Register des Sitzes derjenigen Rechtsträger deren Gläubiger sie sind, nach § 19 Absatz 3 UmwG als bekannt gemacht gilt, ihren Anspruch nach Grund und Höhe schriftlich anmelden, Sicherheit zu leisten, soweit sie nicht Befriedigung verlangen können. Dieses Recht steht den Gläubigern jedoch nur zu, wenn sie glaubhaft machen, dass durch die Verschmelzung die Erfüllung ihrer Forderung gefährdet wird."
    },
    {
      "date": "2026-01-15",
      "id": "142481",
      "original_text": "Registerbekanntmachung nach dem Umwandlungsgesetz\nHamburg Amtsgericht Hamburg HRB 91570\nVerwaltung Zweiundsechzigste IFH geschlossener Immobilienfonds für Holland GmbH – Hamburg",
      "type": "Registerbekanntmachung nach dem Umwandlungsgesetz",
      "state": "Hamburg",
      "amtsgericht": "Amtsgericht Hamburg",
      "registernummer": "HRB 91570",
      "registerart": "HRB",
      "company_name": "Verwaltung Zweiundsechzigste IFH geschlossener Immobilienfonds für Holland GmbH",
      "company_seat": "Hamburg",
      "details": "15.01.2026 (Bekanntmachungsdatum)\n\nHamburg Amtsgericht Hamburg HRB 91570\nRegisterbekanntmachung nach dem Umwandlungsgesetz 15.01.2026 (Eintragungsdatum)\n\nVerwaltung Zweiundsechzigste IFH geschlossener Immobilienfonds für Holland GmbH\nGesellschaft mit beschränkter Haftung\nHamburg\n\nAls nicht eingetragen wird bekannt gemacht:\nDen Gläubigern der an der Verschmelzung beteiligten Gesellschaften ist, wenn sie binnen sechs Monaten nach dem Tag, an dem die Eintragung der Verschmelzung in das Register des Sitzes derjenigen Rechtsträger deren Gläubiger sie sind, nach § 19 Absatz 3 UmwG als bekannt gemacht gilt, ihren Anspruch nach Grund und Höhe schriftlich anmelden, Sicherheit zu leisten, soweit sie nicht Befriedigung verlangen können. Dieses Recht steht den Gläubigern jedoch nur zu, wenn sie glaubhaft machen, dass durch die Verschmelzung die Erfüllung ihrer Forderung gefährdet wird."
    },
    {
      "date": "2026-01-15",
      "id": "142482",
      "original_text": "Registerbekanntmachung nach dem Umwandlungsgesetz\nHamburg Amtsgericht Hamburg HRB 88346\nVerwaltung IFÖ Dritte Immobilienfonds für Österreich GmbH – Hamburg",
      "type": "Registerbekanntmachung nach dem Umwandlungsgesetz",
      "state": "Hamburg",
      "amtsgericht": "Amtsgericht Hamburg",
      "registernummer": "HRB 88346",
      "registerart": "HRB",
      "company_name": "Verwaltung IFÖ Dritte Immobilienfonds für Österreich GmbH",
      "company_seat": "Hamburg",
      "details": "15.01.2026 (Bekanntmachungsdatum)\n\nHamburg Amtsgericht Hamburg HRB 88346\nRegisterbekanntmachung nach dem Umwandlungsgesetz 15.01.2026 (Eintragungsdatum)\n\nVerwaltung IFÖ Dritte Immobilienfonds für Österreich GmbH\nGesellschaft mit beschränkter Haftung\nHamburg\n\nAls nicht eingetragen wird bekannt gemacht:\nDen Gläubigern der an der Verschmelzung beteiligten Gesellschaften ist, wenn sie binnen sechs Monaten nach dem Tag, an dem die Eintragung der Verschmelzung in das Register des Sitzes desjenigen Rechtsträgers, dessen Gläubiger sie sind, nach § 19 Absatz 3 UmwG als bekannt gemacht gilt, ihren Anspruch nach Grund und Höhe schriftlich anmelden, Sicherheit zu leisten, soweit sie nicht Befriedigung verlangen können. Dieses Recht steht den Gläubigern jedoch nur zu, wenn sie glaubhaft machen, dass durch die Verschmelzung die Erfüllung ihrer Forderung gefährdet wird."
    },
    {
      "date": "2026-01-15",
      "id": "142483",
      "original_text": "Löschungsankündigung\nBerlin Amtsgericht Berlin (Charlottenburg) HRB 170386\nESTP Europäische Schule für Tattoo & Piercing UG (haftungsbeschränkt) – Berlin",
      "type": "Löschungsankündigung",
      "state": "Berlin",
      "amtsgericht": "Amtsgericht Berlin (Charlottenburg)",
      "registernummer": "HRB 170386",
      "registerart": "HRB",
      "company_name": "ESTP Europäische Schule für Tattoo & Piercing UG (haftungsbeschränkt)",
      "company_seat": "Berlin",
      "details": "15.01.2026 (Bekanntmachungsdatum)\n\nBerlin Amtsgericht Berlin (Charlottenburg) HRB 170386\nLöschungsankündigung\n\nESTP Europäische Schule für Tattoo & Piercing UG (haftungsbeschränkt)\nGesellschaft mit beschränkter Haftung\nBerlin\n\nBei der nachstehenden Gesellschaft wird das Amtslöschungsverfahren gemäß § 394 FamFG eingeleitet. Widerspruchsfrist 6 Wochen"
    },
    {
      "date": "2026-01-15",
      "id": "142484",
      "original_text": "Löschungsankündigung\nBaden-Württemberg Amtsgericht Mannheim HRB 722131\nCHS Concept-Handel-Shop-Online UG (haftungsbeschränkt) – Bühl",
      "type": "Löschungsankündigung",
      "state": "Baden-Württemberg",
      "amtsgericht": "Amtsgericht Mannheim",
      "registernummer": "HRB 722131",
      "registerart": "HRB",
      "company_name": "CHS Concept-Handel-Shop-Online UG (haftungsbeschränkt)",
      "company_seat": "Bühl",
      "details": "15.01.2026 (Bekanntmachungsdatum)\n\nBaden-Württemberg Amtsgericht Mannheim HRB 722131\nLöschungsankündigung\n\nCHS Concept-Handel-Shop-Online UG (haftungsbeschränkt)\nGesellschaft mit beschränkter Haftung\nBühl\n\nDas Gericht beabsichtigt, die Gesellschaft wegen Vermögenslosigkeit im Handelsregister von Amts wegen nach § 394 FamFG zu löschen. Die Frist zur Geltendmachung eines Widerspruchs gegen die beabsichtigte Löschung ist auf einen Monat ab Veröffentlichung bestimmt."
    },
    {
      "date": "2026-01-15",
      "id": "142485",
      "original_text": "Einreichung neuer Dokumente\nBerlin Amtsgericht Berlin (Charlottenburg) HRB 133814\nBEOS AG – Berlin",
      "type": "Einreichung neuer Dokumente",
      "state": "Berlin",
      "amtsgericht": "Amtsgericht Berlin (Charlottenburg)",
      "registernummer": "HRB 133814",
      "registerart": "HRB",
      "company_name": "BEOS AG",
      "company_seat": "Berlin",
      "details": "15.01.2026 (Bekanntmachungsdatum)\n\nBerlin Amtsgericht Berlin (Charlottenburg) HRB 133814\nEinreichung neuer Dokumente\n\nBEOS AG\nAktiengesellschaft\nBerlin\n\nAls nicht eingetragen wird veröffentlicht: Es wurde eine neue Liste der Aufsichtsratsmitglieder eingereicht (§ 106 AktG)."
    },
    {
      "date": "2026-01-15",
      "id": "142486",
      "original_text": "Sonstige Registerbekanntmachung\nHamburg Amtsgericht Hamburg HRB 74560\nPhilips GmbH – Hamburg",
      "type": "Sonstige Registerbekanntmachung",
      "state": "Hamburg",
      "amtsgericht": "Amtsgericht Hamburg",
      "registernummer": "HRB 74560",
      "registerart": "HRB",
      "company_name": "Philips GmbH",
      "company_seat": "Hamburg",
      "details": "15.01.2026 (Bekanntmachungsdatum)\n\nHamburg Amtsgericht Hamburg HRB 74560\nSonstige Registerbekanntmachung\n\nPhilips GmbH\nGesellschaft mit beschränkter Haftung\nHamburg\n\nAls nicht eingetragen wird bekannt gemacht: Liste des Aufsichtsrats wurde eingereicht."
    },
    {
      "date": "2026-01-15",
      "id": "142487",
      "original_text": "Sonstige Registerbekanntmachung\nBaden-Württemberg Amtsgericht Stuttgart HRB 252524\nAkkodis Germany Concept GmbH – Rutesheim",
      "type": "Sonstige Registerbekanntmachung",
      "state": "Baden-Württemberg",
      "amtsgericht": "Amtsgericht Stuttgart",
      "registernummer": "HRB 252524",
      "registerart": "HRB",
      "company_name": "Akkodis Germany Concept GmbH",
      "company_seat": "Rutesheim",
      "details": "15.01.2026 (Bekanntmachungsdatum)\n\nBaden-Württemberg Amtsgericht Stuttgart HRB 252524\nSonstige Registerbekanntmachung 15.01.2026 (Eintragungsdatum)\n\nAkkodis Germany Concept GmbH\nGesellschaft mit beschränkter Haftung\nRutesheim\n\nAls nicht eingetragen wird bekanntgemacht:\nDen Gläubigern der Gesellschaft, deren Forderungen begründet worden sind, bevor die Eintragung der Beendigung des Vertrages in das Handelsregister nach § 10 HGB als bekanntgemacht gilt, ist vom anderen Vertragsteil Sicherheit zu leisten, wenn sie sich binnen sechs Monaten nach der Bekanntmachung zu diesem Zweck bei ihm melden."
    },
    {
      "date": "2026-01-15",
      "id": "142488",
      "original_text": "Sonstige Registerbekanntmachung\nBaden-Württemberg Amtsgericht Mannheim HRB 361913\noptimed medizinische Instrumente GmbH – Ettlingen",
      "type": "Sonstige Registerbekanntmachung",
      "state": "Baden-Württemberg",
      "amtsgericht": "Amtsgericht Mannheim",
      "registernummer": "HRB 361913",
      "registerart": "HRB",
      "company_name": "optimed medizinische Instrumente GmbH",
      "company_seat": "Ettlingen",
      "details": "15.01.2026 (Bekanntmachungsdatum)\n\nBaden-Württemberg Amtsgericht Mannheim HRB 361913\nSonstige Registerbekanntmachung 15.01.2026 (Eintragungsdatum)\n\noptimed medizinische Instrumente GmbH\nGesellschaft mit beschränkter Haftung\nEttlingen\n\nAls nicht eingetragen wird bekanntgemacht:\nDen Gläubigern der Gesellschaft, deren Forderungen begründet worden sind, bevor die Eintragung der Beendigung des Vertrages in das Handelsregister nach § 10 HGB als bekanntgemacht gilt, ist vom anderen Vertragsteil Sicherheit zu leisten, wenn sie sich binnen sechs Monaten nach der Bekanntmachung zu diesem Zweck bei ihm melden."
    },
    {
      "date": "2026-01-15",
      "id": "142489",
      "original_text": "Sonstige Registerbekanntmachung\nBrandenburg Amtsgericht Potsdam HRB 33041\nPferdeklinik Seeburg GmbH – Dallgow-Döberitz",
      "type": "Sonstige Registerbekanntmachung",
      "state": "Brandenburg",
      "amtsgericht": "Amtsgericht Potsdam",
      "registernummer": "HRB 33041",
      "registerart": "HRB",
      "company_name": "Pferdeklinik Seeburg GmbH",
      "company_seat": "Dallgow-Döberitz",
      "details": "15.01.2026 (Bekanntmachungsdatum)\n\nBrandenburg Amtsgericht Potsdam HRB 33041\nSonstige Registerbekanntmachung\n\nPferdeklinik Seeburg GmbH\nGesellschaft mit beschränkter Haftung\nDallgow-Döberitz\n\nAls nicht eingetragen wird veröffentlicht: Der andere Vertragsteil hat den Gläubigern dieses Rechtsträgers, dessen Forderungen begründet worden sind, bevor die Eintragung der Beendigung dieses Vertrages in das Handelsregister nach § 10 des Handelsgesetzbuches als bekannt gemacht gilt, Sicherheit zu leisten, wenn sie sich binnen sechs Monaten nach der Bekanntmachung der Eintragung zu diesem Zweck bei ihm melden."
    },
    {
      "date": "2026-01-15",
      "id": "142490",
      "original_text": "Löschungsankündigung\nBaden-Württemberg Amtsgericht Ulm HRB 748057\nVioSol Vertrieb GmbH – Aalen",
      "type": "Löschungsankündigung",
      "state": "Baden-Württemberg",
      "amtsgericht": "Amtsgericht Ulm",
      "registernummer": "HRB 748057",
      "registerart": "HRB",
      "company_name": "VioSol Vertrieb GmbH",
      "company_seat": "Aalen",
      "details": "15.01.2026 (Bekanntmachungsdatum)\n\nBaden-Württemberg Amtsgericht Ulm HRB 748057\nLöschungsankündigung\n\nVioSol Vertrieb GmbH\nGesellschaft mit beschränkter Haftung\nAalen\n\nAls nicht eingetragen wird bekanntgemacht:\nDas Gericht beabsichtigt, die Gesellschaft wegen Vermögenslosigkeit im Handelsregister von Amts wegen nach § 394 FamFG zu löschen. Die Frist zur Geltendmachung eines Widerspruchs gegen die beabsichtigte Löschung ist auf  einen Monat ab Veröffentlichung bestimmt."
    },
    {
      "date": "2026-01-15",
      "id": "142491",
      "original_text": "Einreichung neuer Dokumente\nBerlin Amtsgericht Berlin (Charlottenburg) HRB 96555\nStromnetz Berlin GmbH – Berlin",
      "type": "Einreichung neuer Dokumente",
      "state": "Berlin",
      "amtsgericht": "Amtsgericht Berlin (Charlottenburg)",
      "registernummer": "HRB 96555",
      "registerart": "HRB",
      "company_name": "Stromnetz Berlin GmbH",
      "company_seat": "Berlin",
      "details": "15.01.2026 (Bekanntmachungsdatum)\n\nBerlin Amtsgericht Berlin (Charlottenburg) HRB 96555\nEinreichung neuer Dokumente\n\nStromnetz Berlin GmbH\nGesellschaft mit beschränkter Haftung\nBerlin\n\nAls nicht eingetragen wird veröffentlicht: Es wurde eine neue Liste der Aufsichtsratsmitglieder eingereicht (§52 GmbHG)."
    },
    {
      "date": "2026-01-15",
      "id": "142492",
      "original_text": "Registerbekanntmachung nach dem Umwandlungsgesetz\nBaden-Württemberg Amtsgericht Freiburg HRB 713028\nFreiburger Glaswerkstatt GmbH – Freiburg im Breisgau",
      "type": "Registerbekanntmachung nach dem Umwandlungsgesetz",
      "state": "Baden-Württemberg",
      "amtsgericht": "Amtsgericht Freiburg",
      "registernummer": "HRB 713028",
      "registerart": "HRB",
      "company_name": "Freiburger Glaswerkstatt GmbH",
      "company_seat": "Freiburg im Breisgau",
      "details": "15.01.2026 (Bekanntmachungsdatum)\n\nBaden-Württemberg Amtsgericht Freiburg HRB 713028\nRegisterbekanntmachung nach dem Umwandlungsgesetz 15.01.2026 (Eintragungsdatum)\n\nFreiburger Glaswerkstatt GmbH\nGesellschaft mit beschränkter Haftung\nFreiburg im Breisgau\n\nAls nicht eingetragen wird bekanntgemacht:\nDen Gläubigern der an der Verschmelzung beteiligten Rechtsträger ist, wenn sie binnen sechs Monaten nach dem Tag, an dem die Eintragung der Verschmelzung in das Register des Sitzes desjenigen Rechtsträgers, dessen Gläubiger sie sind, nach § 19 Abs. 3 UmwG als bekanntgemacht gilt, ihren Anspruch nach Grund und Höhe schriftlich anmelden, Sicherheit zu leisten, soweit sie nicht Befriedigung verlangen können. Dieses Recht steht den Gläubigern jedoch nur zu, wenn sie glaubhaft machen, dass durch die Verschmelzung die Erfüllung ihrer Forderung gefährdet wird."
    },
    {
      "date": "2026-01-15",
      "id": "142493",
      "original_text": "Registerbekanntmachung nach dem Umwandlungsgesetz\nBaden-Württemberg Amtsgericht Ulm HRB 751195\nMohnenfluh GmbH – Aalen",
      "type": "Registerbekanntmachung nach dem Umwandlungsgesetz",
      "state": "Baden-Württemberg",
      "amtsgericht": "Amtsgericht Ulm",
      "registernummer": "HRB 751195",
      "registerart": "HRB",
      "company_name": "Mohnenfluh GmbH",
      "company_seat": "Aalen",
      "details": "15.01.2026 (Bekanntmachungsdatum)\n\nBaden-Württemberg Amtsgericht Ulm HRB 751195\nRegisterbekanntmachung nach dem Umwandlungsgesetz 15.01.2026 (Eintragungsdatum)\n\nMohnenfluh GmbH\nGesellschaft mit beschränkter Haftung\nAalen\n\nDen Gläubigern der an der Abspaltung beteiligten Rechtsträger ist, wenn sie binnen sechs Monaten nach dem Tag, an dem die Eintragung der Abspaltung in das Register des Sitzes desjenigen Rechtsträgers, dessen Gläubiger sie sind, nach § 19 Abs. 3 UmwG als bekanntgemacht gilt, ihren Anspruch nach Grund und Höhe schriftlich anmelden, Sicherheit zu leisten, soweit sie nicht Befriedigung verlangen können. Dieses Recht steht den Gläubigern jedoch nur zu, wenn sie glaubhaft machen, dass durch die Abspaltung die Erfüllung ihrer Forderung gefährdet wird."
    },
    {
      "date": "2026-01-15",
      "id": "142494",
      "original_text": "Registerbekanntmachung nach dem Umwandlungsgesetz\nBaden-Württemberg Amtsgericht Ulm HRB 501455\nPalm Industrie Beteiligungs-GmbH – Aalen",
      "type": "Registerbekanntmachung nach dem Umwandlungsgesetz",
      "state": "Baden-Württemberg",
      "amtsgericht": "Amtsgericht Ulm",
      "registernummer": "HRB 501455",
      "registerart": "HRB",
      "company_name": "Palm Industrie Beteiligungs-GmbH",
      "company_seat": "Aalen",
      "details": "15.01.2026 (Bekanntmachungsdatum)\n\nBaden-Württemberg Amtsgericht Ulm HRB 501455\nRegisterbekanntmachung nach dem Umwandlungsgesetz 15.01.2026 (Eintragungsdatum)\n\nPalm Industrie Beteiligungs-GmbH\nGesellschaft mit beschränkter Haftung\nAalen\n\nAls nicht eingetragen wird bekanntgemacht:\nDen Gläubigern der an der Abspaltung beteiligten Rechtsträger ist, wenn sie binnen sechs Monaten nach dem Tag, an dem die Eintragung der Abspaltung in das Register des Sitzes desjenigen Rechtsträgers, dessen Gläubiger sie sind, nach § 19 Abs. 3 UmwG als bekanntgemacht gilt, ihren Anspruch nach Grund und Höhe schriftlich anmelden, Sicherheit zu leisten, soweit sie nicht Befriedigung verlangen können. Dieses Recht steht den Gläubigern jedoch nur zu, wenn sie glaubhaft machen, dass durch die Abspaltung die Erfüllung ihrer Forderung gefährdet wird."
    },
    {
      "date": "2026-01-15",
      "id": "142495",
      "original_text": "Löschungsankündigung\nBerlin Amtsgericht Berlin (Charlottenburg) HRB 140637\nMAGOR Systembau GmbH – Berlin",
      "type": "Löschungsankündigung",
      "state": "Berlin",
      "amtsgericht": "Amtsgericht Berlin (Charlottenburg)",
      "registernummer": "HRB 140637",
      "registerart": "HRB",
      "company_name": "MAGOR Systembau GmbH",
      "company_seat": "Berlin",
      "details": "15.01.2026 (Bekanntmachungsdatum)\n\nBerlin Amtsgericht Berlin (Charlottenburg) HRB 140637\nLöschungsankündigung\n\nMAGOR Systembau GmbH\nGesellschaft mit beschränkter Haftung\nBerlin\n\nBei der nachstehenden Gesellschaft wird das Amtslöschungsverfahren gemäß § 394 FamFG eingeleitet. Widerspruchsfrist 6 Wochen"
    },
    {
      "date": "2026-01-15",
      "id": "142496",
      "original_text": "Registerbekanntmachung nach dem Umwandlungsgesetz\nBerlin Amtsgericht Berlin (Charlottenburg) HRB 275850\nUmbra Technologies UG (haftungsbeschränkt) – Berlin",
      "type": "Registerbekanntmachung nach dem Umwandlungsgesetz",
      "state": "Berlin",
      "amtsgericht": "Amtsgericht Berlin (Charlottenburg)",
      "registernummer": "HRB 275850",
      "registerart": "HRB",
      "company_name": "Umbra Technologies UG (haftungsbeschränkt)",
      "company_seat": "Berlin",
      "details": "15.01.2026 (Bekanntmachungsdatum)\n\nBerlin Amtsgericht Berlin (Charlottenburg) HRB 275850\nRegisterbekanntmachung nach dem Umwandlungsgesetz 15.01.2026 (Eintragungsdatum)\n\nUmbra Technologies UG (haftungsbeschränkt)\nGesellschaft mit beschränkter Haftung\nBerlin\n\nZu Eintragungsnummer 2 vom 15.01.2026 wird als nicht eingetragen veröffentlicht: Den Gläubigern der an der Verschmelzung beteiligten Rechtsträger ist, wenn sie binnen sechs Monaten nach dem Tag, an dem die Eintragung der Verschmelzung in das Register des Sitzes desjenigen Rechtsträgers, dessen Gläubiger sie sind, als bekannt gemacht gilt, ihren Anspruch nach Grund und Höhe schriftlich anmelden, Sicherheit zu leisten, soweit sie nicht Befriedigung verlangen können. Dieses Recht steht den Gläubigern jedoch nur zu, wenn sie glaubhaft machen, dass durch die Verschmelzung die Erfüllung ihrer Forderung gefährdet wird. Das Recht, Sicherheitsleistung zu verlangen, steht Gläubigern nicht zu, die im Falle der Insolvenz ein Recht auf vorzugsweise Befriedigung aus einer Deckungsmasse haben, die nach gesetzlicher Vorschrift zu ihrem Schutz errichtet und staatlich überwacht ist."
    },
    {
      "date": "2026-01-15",
      "id": "142497",
      "original_text": "Löschungsankündigung\nBerlin Amtsgericht Berlin (Charlottenburg) HRB 246675\nMDS Vermögensverwaltung und Handels-GmbH – Berlin",
      "type": "Löschungsankündigung",
      "state": "Berlin",
      "amtsgericht": "Amtsgericht Berlin (Charlottenburg)",
      "registernummer": "HRB 246675",
      "registerart": "HRB",
      "company_name": "MDS Vermögensverwaltung und Handels-GmbH",
      "company_seat": "Berlin",
      "details": "15.01.2026 (Bekanntmachungsdatum)\n\nBerlin Amtsgericht Berlin (Charlottenburg) HRB 246675\nLöschungsankündigung\n\nMDS Vermögensverwaltung und Handels-GmbH\nGesellschaft mit beschränkter Haftung\nBerlin\n\nBei der nachstehenden Gesellschaft wird das Amtslöschungsverfahren gemäß § 394 FamFG eingeleitet. Widerspruchsfrist 6 Wochen"
    },
    {
      "date": "2026-01-15",
      "id": "142498",
      "original_text": "Löschungsankündigung\nBrandenburg Amtsgericht Potsdam HRB 27092\nDelia Summer UG (haftungsbeschränkt) – Kleinmachnow",
      "type": "Löschungsankündigung",
      "state": "Brandenburg",
      "amtsgericht": "Amtsgericht Potsdam",
      "registernummer": "HRB 27092",
      "registerart": "HRB",
      "company_name": "Delia Summer UG (haftungsbeschränkt)",
      "company_seat": "Kleinmachnow",
      "details": "15.01.2026 (Bekanntmachungsdatum)\n\nBrandenburg Amtsgericht Potsdam HRB 27092\nLöschungsankündigung\n\nDelia Summer UG (haftungsbeschränkt)\nGesellschaft mit beschränkter Haftung\nKleinmachnow\n\nBei der nachstehenden Gesellschaft wird das Amtslöschungsverfahren gemäß § 394 FamFG eingeleitet. Widerspruchsfrist: 8 Wochen"
    },
    {
      "date": "2026-01-15",
      "id": "142499",
      "original_text": "Löschungsankündigung\nSchleswig-Holstein Amtsgericht Kiel HRB 25224\nEnekom Tiefbau und Straßenbau UG (haftungsbeschränkt) – Norderstedt",
      "type": "Löschungsankündigung",
      "state": "Schleswig-Holstein",
      "amtsgericht": "Amtsgericht Kiel",
      "registernummer": "HRB 25224",
      "registerart": "HRB",
      "company_name": "Enekom Tiefbau und Straßenbau UG (haftungsbeschränkt)",
      "company_seat": "Norderstedt",
      "details": "15.01.2026 (Bekanntmachungsdatum)\n\nSchleswig-Holstein Amtsgericht Kiel HRB 25224\nLöschungsankündigung\n\nEnekom Tiefbau und Straßenbau UG (haftungsbeschränkt)\nGesellschaft mit beschränkter Haftung\nNorderstedt\n\nEs ist die Löschung der nachstehenden Gesellschaft wegen Vermögenslosigkeit gemäß § 394 FamFG beabsichtigt. Widerspruchsfrist: 2 Monate."
    },
    {
      "date": "2026-01-15",
      "id": "142500",
      "original_text": "Löschungsankündigung\nBerlin Amtsgericht Berlin (Charlottenburg) HRB 263629\nInvestlease GmbH – Berlin",
      "type": "Löschungsankündigung",
      "state": "Berlin",
      "amtsgericht": "Amtsgericht Berlin (Charlottenburg)",
      "registernummer": "HRB 263629",
      "registerart": "HRB",
      "company_name": "Investlease GmbH",
      "company_seat": "Berlin",
      "details": "15.01.2026 (Bekanntmachungsdatum)\n\nBerlin Amtsgericht Berlin (Charlottenburg) HRB 263629\nLöschungsankündigung\n\nInvestlease GmbH\nGesellschaft mit beschränkter Haftung\nBerlin\n\nBei der nachstehenden Gesellschaft wird das Amtslöschungsverfahren gemäß § 394 FamFG eingeleitet. Widerspruchsfrist 6 Wochen"
    },
    {
      "date": "2026-01-15",
      "id": "142501",
      "original_text": "Sonstige Registerbekanntmachung\nMecklenburg-Vorpommern Amtsgericht Stralsund HRB 8801\nSightseeing Trains Rügen GmbH – Binz",
      "type": "Sonstige Registerbekanntmachung",
      "state": "Mecklenburg-Vorpommern",
      "amtsgericht": "Amtsgericht Stralsund",
      "registernummer": "HRB 8801",
      "registerart": "HRB",
      "company_name": "Sightseeing Trains Rügen GmbH",
      "company_seat": "Binz",
      "details": "15.01.2026 (Bekanntmachungsdatum)\n\nMecklenburg-Vorpommern Amtsgericht Stralsund HRB 8801\nSonstige Registerbekanntmachung 15.01.2026 (Eintragungsdatum)\n\nSightseeing Trains Rügen GmbH\nGesellschaft mit beschränkter Haftung\nBinz\n\nAls nicht eingetragen wird veröffentlicht: Den Gläubigern der Gesellschaft, deren Forderungen begründet worden sind bevor die Eintragung der Beendigung des Gewinnabführungsvertrages in das Handelsregister nach § 10 des Handelsgesetzbuches als bekanntgemacht gilt, hat der andere Vertragsteil Sicherheit zu leisten, wenn sie sich binnen sechs Monaten nach der Bekanntmachung der Eintragung zu diesem Zweck bei ihm melden."
    },
    {
      "date": "2026-01-15",
      "id": "142502",
      "original_text": "Registerbekanntmachung nach dem Umwandlungsgesetz\nNordrhein-Westfalen Amtsgericht Coesfeld HRB 3629\n2G Energietechnik GmbH – Heek",
      "type": "Registerbekanntmachung nach dem Umwandlungsgesetz",
      "state": "Nordrhein-Westfalen",
      "amtsgericht": "Amtsgericht Coesfeld",
      "registernummer": "HRB 3629",
      "registerart": "HRB",
      "company_name": "2G Energietechnik GmbH",
      "company_seat": "Heek",
      "details": "15.01.2026 (Bekanntmachungsdatum)\n\nNordrhein-Westfalen Amtsgericht Coesfeld HRB 3629\nRegisterbekanntmachung nach dem Umwandlungsgesetz 15.01.2026 (Eintragungsdatum)\n\n2G Energietechnik GmbH\nGesellschaft mit beschränkter Haftung\nHeek\n\nDen Gläubigern der an der Abspaltung beteiligten Rechtsträger ist, wenn sie binnen sechs Monaten nach dem Tag, an dem die Eintragung der Abspaltung in das Register des Sitzes desjenigen Rechtsträgers, dessen Gläubiger sie sind, nach § 19 Absatz 3 UmwG als bekanntgemacht gilt, ihren Anspruch nach Grund und Höhe schriftlich anmelden, Sicherheit zu leisten, soweit sie nicht Befriedigung verlangen können. Dieses Recht steht den Gläubigern jedoch nur zu, wenn sie glaubhaft machen, dass durch die Abspaltung die Erfüllung ihrer Forderung gefährdet wird."
    },
    {
      "date": "2026-01-15",
      "id": "142503",
      "original_text": "Löschungsankündigung\nBaden-Württemberg Amtsgericht Ulm HRB 740382\nDIMAG UG (haftungsbeschränkt) – Göppingen",
      "type": "Löschungsankündigung",
      "state": "Baden-Württemberg",
      "amtsgericht": "Amtsgericht Ulm",
      "registernummer": "HRB 740382",
      "registerart": "HRB",
      "company_name": "DIMAG UG (haftungsbeschränkt)",
      "company_seat": "Göppingen",
      "details": "15.01.2026 (Bekanntmachungsdatum)\n\nBaden-Württemberg Amtsgericht Ulm HRB 740382\nLöschungsankündigung\n\nDIMAG UG (haftungsbeschränkt)\nGesellschaft mit beschränkter Haftung\nGöppingen\n\nDas Gericht beabsichtigt, die Gesellschaft wegen Vermögenslosigkeit im Handelsregister von Amts wegen nach § 394 FamFG zu löschen. Die Frist zur Geltendmachung eines Widerspruchs gegen die beabsichtigte Löschung ist auf  einen Monat ab Veröffentlichung bestimmt."
    },
    {
      "date": "2026-01-15",
      "id": "142504",
      "original_text": "Registerbekanntmachung nach dem Umwandlungsgesetz\nBaden-Württemberg Amtsgericht Stuttgart HRB 13550\nEXAMION GmbH – Fellbach",
      "type": "Registerbekanntmachung nach dem Umwandlungsgesetz",
      "state": "Baden-Württemberg",
      "amtsgericht": "Amtsgericht Stuttgart",
      "registernummer": "HRB 13550",
      "registerart": "HRB",
      "company_name": "EXAMION GmbH",
      "company_seat": "Fellbach",
      "details": "15.01.2026 (Bekanntmachungsdatum)\n\nBaden-Württemberg Amtsgericht Stuttgart HRB 13550\nRegisterbekanntmachung nach dem Umwandlungsgesetz 15.01.2026 (Eintragungsdatum)\n\nEXAMION GmbH\nGesellschaft mit beschränkter Haftung\nFellbach\n\nDen Gläubigern dern an der grenzüberschreitenden Verschmelzung beteiligten übernehmenden Rechtsträger ist, wenn sie binnen sechs Monaten nach dem Tag, an dem die Eintragung der Verschmelzung in das Register des Sitzes desjenigen Rechtsträgers, dessen Gläubiger sie sind, nach § 19 Absatz 3 UmwG als bekanntgemacht gilt, ihren Anspruch nach Grund und Höhe schriftlich anmelden, Sicherheit zu leisten, soweit sie nicht Befriedigung verlangen können. Dieses Recht steht den Gläubigern jedoch nur zu, wenn sie glaubhaft machen, dass durch die Verschmelzung die Erfüllung ihrer Forderung gefährdet wird."
    },
    {
      "date": "2026-01-15",
      "id": "142505",
      "original_text": "Einreichung neuer Dokumente\nHamburg Amtsgericht Hamburg HRB 77668\nH L S Hamburger Logistik Service GmbH – Hamburg",
      "type": "Einreichung neuer Dokumente",
      "state": "Hamburg",
      "amtsgericht": "Amtsgericht Hamburg",
      "registernummer": "HRB 77668",
      "registerart": "HRB",
      "company_name": "H L S Hamburger Logistik Service GmbH",
      "company_seat": "Hamburg",
      "details": "15.01.2026 (Bekanntmachungsdatum)\n\nHamburg Amtsgericht Hamburg HRB 77668\nEinreichung neuer Dokumente\n\nH L S Hamburger Logistik Service GmbH\nGesellschaft mit beschränkter Haftung\nHamburg\n\nAls nicht eingetragen wird bekannt gemacht: Liste des Aufsichtsrats wurde eingereicht."
    },
    {
      "date": "2026-01-15",
      "id": "142506",
      "original_text": "Löschungsankündigung\nBrandenburg Amtsgericht Potsdam HRB 23292\nFIDARE Liegenschaftsverwaltung GmbH – Potsdam",
      "type": "Löschungsankündigung",
      "state": "Brandenburg",
      "amtsgericht": "Amtsgericht Potsdam",
      "registernummer": "HRB 23292",
      "registerart": "HRB",
      "company_name": "FIDARE Liegenschaftsverwaltung GmbH",
      "company_seat": "Potsdam",
      "details": "15.01.2026 (Bekanntmachungsdatum)\n\nBrandenburg Amtsgericht Potsdam HRB 23292\nLöschungsankündigung\n\nFIDARE Liegenschaftsverwaltung GmbH\nGesellschaft mit beschränkter Haftung\nPotsdam\n\nBei der nachstehenden Gesellschaft wird das Amtslöschungsverfahren gemäß § 394 FamFG eingeleitet. Widerspruchsfrist 8 Wochen."
    },
    {
      "date": "2026-01-15",
      "id": "142507",
      "original_text": "Löschungsankündigung\nBerlin Amtsgericht Berlin (Charlottenburg) HRB 194262\nLempac GmbH – Berlin",
      "type": "Löschungsankündigung",
      "state": "Berlin",
      "amtsgericht": "Amtsgericht Berlin (Charlottenburg)",
      "registernummer": "HRB 194262",
      "registerart": "HRB",
      "company_name": "Lempac GmbH",
      "company_seat": "Berlin",
      "details": "15.01.2026 (Bekanntmachungsdatum)\n\nBerlin Amtsgericht Berlin (Charlottenburg) HRB 194262\nLöschungsankündigung\n\nLempac GmbH\nGesellschaft mit beschränkter Haftung\nBerlin\n\nBei der nachstehenden Gesellschaft wird das Amtslöschungsverfahren gemäß § 394 FamFG eingeleitet. Widerspruchsfrist: 6 Wochen."
    },
    {
      "date": "2026-01-15",
      "id": "142508",
      "original_text": "Registerbekanntmachung nach dem Umwandlungsgesetz\nBaden-Württemberg Amtsgericht Ulm HRB 751198\nWamser & Diemer GmbH Steuerberatungsgesellschaft – Westhausen",
      "type": "Registerbekanntmachung nach dem Umwandlungsgesetz",
      "state": "Baden-Württemberg",
      "amtsgericht": "Amtsgericht Ulm",
      "registernummer": "HRB 751198",
      "registerart": "HRB",
      "company_name": "Wamser & Diemer GmbH Steuerberatungsgesellschaft",
      "company_seat": "Westhausen",
      "details": "15.01.2026 (Bekanntmachungsdatum)\n\nBaden-Württemberg Amtsgericht Ulm HRB 751198\nRegisterbekanntmachung nach dem Umwandlungsgesetz 15.01.2026 (Eintragungsdatum)\n\nWamser & Diemer GmbH Steuerberatungsgesellschaft\nGesellschaft mit beschränkter Haftung\nWesthausen\n\nDen Gläubigern des an dem Formwechsel beteiligten Rechtsträgers ist, wenn sie binnen sechs Monaten nach dem Tag, an dem die Eintragung des Formwechsels in das Register des Sitzes desjenigen Rechtsträgers, dessen Gläubiger sie sind, nach § 19 Abs. 3 UmwG als bekanntgemacht gilt, ihren Anspruch nach Grund und Höhe schriftlich anmelden, Sicherheit zu leisten, soweit sie nicht Befriedigung verlangen können. Dieses Recht steht den Gläubigern jedoch nur zu, wenn sie glaubhaft machen, dass durch den Formwechsel die Erfüllung ihrer Forderung gefährdet wird."
    },
    {
      "date": "2026-01-15",
      "id": "142509",
      "original_text": "Einreichung neuer Dokumente\nBaden-Württemberg Amtsgericht Stuttgart HRB 1319\nGWG Gesellschaft für Wohnungs- und Gewerbebau Baden-Württemberg Aktiengesellschaft – Stuttgart",
      "type": "Einreichung neuer Dokumente",
      "state": "Baden-Württemberg",
      "amtsgericht": "Amtsgericht Stuttgart",
      "registernummer": "HRB 1319",
      "registerart": "HRB",
      "company_name": "GWG Gesellschaft für Wohnungs- und Gewerbebau Baden-Württemberg Aktiengesellschaft",
      "company_seat": "Stuttgart",
      "details": "15.01.2026 (Bekanntmachungsdatum)\n\nBaden-Württemberg Amtsgericht Stuttgart HRB 1319\nEinreichung neuer Dokumente\n\nGWG Gesellschaft für Wohnungs- und Gewerbebau Baden-Württemberg Aktiengesellschaft\nAktiengesellschaft\nStuttgart\n\nDie Gesellschaft hat am 14.01.2026 die Liste über die Zusammensetzung des Aufsichtsrats zum Handelsregister eingereicht."
    },
    {
      "date": "2026-01-15",
      "id": "142510",
      "original_text": "Löschungsankündigung\nBrandenburg Amtsgericht Potsdam HRB 38242\nBASTA MediaService GmbH – Nuthe-Urstromtal",
      "type": "Löschungsankündigung",
      "state": "Brandenburg",
      "amtsgericht": "Amtsgericht Potsdam",
      "registernummer": "HRB 38242",
      "registerart": "HRB",
      "company_name": "BASTA MediaService GmbH",
      "company_seat": "Nuthe-Urstromtal",
      "details": "15.01.2026 (Bekanntmachungsdatum)\n\nBrandenburg Amtsgericht Potsdam HRB 38242\nLöschungsankündigung\n\nBASTA MediaService GmbH\nGesellschaft mit beschränkter Haftung\nNuthe-Urstromtal\n\nBei der nachstehenden Gesellschaft wird das Amtslöschungsverfahren gemäß § 394 FamFG eingeleitet. Widerspruchsfrist: 8 Wochen"
    },
    {
      "date": "2026-01-15",
      "id": "142511",
      "original_text": "Löschungsankündigung\nSachsen Amtsgericht Dresden HRB 36484\nGoldwig UG (haftungsbeschränkt) – Görlitz",
      "type": "Löschungsankündigung",
      "state": "Sachsen",
      "amtsgericht": "Amtsgericht Dresden",
      "registernummer": "HRB 36484",
      "registerart": "HRB",
      "company_name": "Goldwig UG (haftungsbeschränkt)",
      "company_seat": "Görlitz",
      "details": "15.01.2026 (Bekanntmachungsdatum)\n\nSachsen Amtsgericht Dresden HRB 36484\nLöschungsankündigung\n\nGoldwig UG (haftungsbeschränkt)\nGesellschaft mit beschränkter Haftung\nGörlitz\n\nDas Registergericht beabsichtigt, die im Handelsregister eingetragene Gesellschaft von Amts wegen nach § 394 FamFG zu löschen. Die Frist zu Erhebung eines Widerspruchs gegen die beabsichtigte Löschung wird auf einen Monat festgesetzt."
    },
    {
      "date": "2026-01-15",
      "id": "142512",
      "original_text": "Löschungsankündigung\nSachsen Amtsgericht Dresden HRB 39220\nJosell UG (haftungsbeschränkt) – Görlitz",
      "type": "Löschungsankündigung",
      "state": "Sachsen",
      "amtsgericht": "Amtsgericht Dresden",
      "registernummer": "HRB 39220",
      "registerart": "HRB",
      "company_name": "Josell UG (haftungsbeschränkt)",
      "company_seat": "Görlitz",
      "details": "15.01.2026 (Bekanntmachungsdatum)\n\nSachsen Amtsgericht Dresden HRB 39220\nLöschungsankündigung\n\nJosell UG (haftungsbeschränkt)\nGesellschaft mit beschränkter Haftung\nGörlitz\n\nDas Registergericht beabsichtigt, die im Handelsregister eingetragene Gesellschaft von Amts wegen nach § 394 FamFG zu löschen. Die Frist zu Erhebung eines Widerspruchs gegen die beabsichtigte Löschung wird auf einen Monat festgesetzt."
    },
    {
      "date": "2026-01-15",
      "id": "142513",
      "original_text": "Löschungsankündigung\nSachsen Amtsgericht Dresden HRB 36984\nDGfH Innovations- und Service GmbH – Königsbrück",
      "type": "Löschungsankündigung",
      "state": "Sachsen",
      "amtsgericht": "Amtsgericht Dresden",
      "registernummer": "HRB 36984",
      "registerart": "HRB",
      "company_name": "DGfH Innovations- und Service GmbH",
      "company_seat": "Königsbrück",
      "details": "15.01.2026 (Bekanntmachungsdatum)\n\nSachsen Amtsgericht Dresden HRB 36984\nLöschungsankündigung\n\nDGfH Innovations- und Service GmbH\nGesellschaft mit beschränkter Haftung\nKönigsbrück\n\nDas Registergericht beabsichtigt, die im Handelsregister eingetragene Gesellschaft von Amts wegen nach § 394 FamFG zu löschen. Die Frist zu Erhebung eines Widerspruchs gegen die beabsichtigte Löschung wird auf einen Monat festgesetzt."
    },
    {
      "date": "2026-01-15",
      "id": "142514",
      "original_text": "Löschungsankündigung\nSachsen Amtsgericht Leipzig VR 10604\nGeithainer Ulanen 1867 - 2000 e. V. – Geithain",
      "type": "Löschungsankündigung",
      "state": "Sachsen",
      "amtsgericht": "Amtsgericht Leipzig",
      "registernummer": "VR 10604",
      "registerart": "VR",
      "company_name": "Geithainer Ulanen 1867 - 2000 e. V.",
      "company_seat": "Geithain",
      "details": "15.01.2026 (Bekanntmachungsdatum)\n\nSachsen Amtsgericht Leipzig VR 10604\nLöschungsankündigung\n\nGeithainer Ulanen 1867 - 2000 e. V.\neingetragener Verein\nGeithain\n\nDas Gericht beabsichtigt, gemäß § 4 Absatz 2 Ziffer 1 der Verordnung über das Vereinsregister das Registerblatt  des Vereins zu schließen, da nach den Ermittlungen des Gerichts sämtliche Mitglieder aus dem Verein ausgeschieden sind. Zur Geltendmachung eines Widerspruchs gegen die beabsichtigte Schließung wird eine Frist von einem Monat nach der Veröffentlichung bestimmt."
    },
    {
      "date": "2026-01-15",
      "id": "142515",
      "original_text": "Löschungsankündigung\nSachsen Amtsgericht Chemnitz HRB 30103\nNikola Tesla Club UG (haftungsbeschränkt) – Chemnitz",
      "type": "Löschungsankündigung",
      "state": "Sachsen",
      "amtsgericht": "Amtsgericht Chemnitz",
      "registernummer": "HRB 30103",
      "registerart": "HRB",
      "company_name": "Nikola Tesla Club UG (haftungsbeschränkt)",
      "company_seat": "Chemnitz",
      "details": "15.01.2026 (Bekanntmachungsdatum)\n\nSachsen Amtsgericht Chemnitz HRB 30103\nLöschungsankündigung 15.01.2026 (Eintragungsdatum)\n\nNikola Tesla Club UG (haftungsbeschränkt)\nGesellschaft mit beschränkter Haftung\nChemnitz\n\nDas Registergericht beabsichtigt, die im Handelsregister eingetragene Gesellschaft von Amts wegen nach § 394 FamFG zu löschen. Die Frist zu Erhebung eines Widerspruchs gegen die beabsichtigte Löschung wird auf einen Monat festgesetzt."
    },
    {
      "date": "2026-01-15",
      "id": "142516",
      "original_text": "Registerbekanntmachung nach dem Umwandlungsgesetz\nNiedersachsen Amtsgericht Oldenburg (Oldenburg) HRA 208804\nBörner GmbH & Co. KG – Bad Zwischenahn",
      "type": "Registerbekanntmachung nach dem Umwandlungsgesetz",
      "state": "Niedersachsen",
      "amtsgericht": "Amtsgericht Oldenburg (Oldenburg)",
      "registernummer": "HRA 208804",
      "registerart": "HRA",
      "company_name": "Börner GmbH & Co. KG",
      "company_seat": "Bad Zwischenahn",
      "details": "15.01.2026 (Bekanntmachungsdatum)\n\nNiedersachsen Amtsgericht Oldenburg (Oldenburg) HRA 208804\nRegisterbekanntmachung nach dem Umwandlungsgesetz 15.01.2026 (Eintragungsdatum)\n\nBörner GmbH & Co. KG\nKommanditgesellschaft\nBad Zwischenahn\n\nDen Gläubigern der an der Ausgliederung beteiligten Rechtsträger ist, wenn sie binnen sechs Monaten nach dem Tag, an dem die Eintragung der Ausgliederung in das Register des Sitzes desjenigen Rechtsträgers, dessen Gläubiger sie sind, nach § 19 Abs. 3 UmwG als bekannt gemacht gilt, ihren Anspruch nach Grund und Höhe schriftlich anmelden, Sicherheit zu leisten, soweit sie nicht Befriedigung verlangen können. Dieses Recht steht den Gläubigern jedoch nur zu, wenn sie glaubhaft machen, dass durch die Ausgliederung die Erfüllung der Forderung gefährdet wird."
    },
    {
      "date": "2026-01-15",
      "id": "142517",
      "original_text": "Registerbekanntmachung nach dem Umwandlungsgesetz\nNiedersachsen Amtsgericht Oldenburg (Oldenburg) HRA 208517\nPeter Börner Fahrzeuglackiererei e. K. – Bad Zwischenahn",
      "type": "Registerbekanntmachung nach dem Umwandlungsgesetz",
      "state": "Niedersachsen",
      "amtsgericht": "Amtsgericht Oldenburg (Oldenburg)",
      "registernummer": "HRA 208517",
      "registerart": "HRA",
      "company_name": "Peter Börner Fahrzeuglackiererei e. K.",
      "company_seat": "Bad Zwischenahn",
      "details": "15.01.2026 (Bekanntmachungsdatum)\n\nNiedersachsen Amtsgericht Oldenburg (Oldenburg) HRA 208517\nRegisterbekanntmachung nach dem Umwandlungsgesetz 15.01.2026 (Eintragungsdatum)\n\nPeter Börner Fahrzeuglackiererei e. K.\nEinzelkaufmann / Einzelkauffrau\nBad Zwischenahn\n\nDen Gläubigern der an der Ausgliederung beteiligten Rechtsträger ist, wenn sie binnen sechs Monaten nach dem Tag, an dem die Eintragung der Ausgliederung in das Register des Sitzes desjenigen Rechtsträgers, dessen Gläubiger sie sind, nach § 19 Abs. 3 UmwG als bekannt gemacht gilt, ihren Anspruch nach Grund und Höhe schriftlich anmelden, Sicherheit zu leisten, soweit sie nicht Befriedigung verlangen können. Dieses Recht steht den Gläubigern jedoch nur zu, wenn sie glaubhaft machen, dass durch die Ausgliederung die Erfüllung der Forderung gefährdet wird."
    },
    {
      "date": "2026-01-15",
      "id": "142518",
      "original_text": "Löschungsankündigung\nNiedersachsen Amtsgericht Aurich HRB 203515\nBESTWORK UG (haftungsbeschränkt) – Leer-Loga",
      "type": "Löschungsankündigung",
      "state": "Niedersachsen",
      "amtsgericht": "Amtsgericht Aurich",
      "registernummer": "HRB 203515",
      "registerart": "HRB",
      "company_name": "BESTWORK UG (haftungsbeschränkt)",
      "company_seat": "Leer-Loga",
      "details": "15.01.2026 (Bekanntmachungsdatum)\n\nNiedersachsen Amtsgericht Aurich HRB 203515\nLöschungsankündigung 15.01.2026 (Eintragungsdatum)\n\nBESTWORK UG (haftungsbeschränkt)\nGesellschaft mit beschränkter Haftung\nLeer-Loga\n\nDas Registergericht beabsichtigt, die Gesellschaft von Amts wegen nach § 394 FamFG zu löschen. Die Frist zur Erhebung eines Widerspruchs ist auf 1 Monat ab dieser Registerbekanntmachung festgesetzt."
    },
    {
      "date": "2026-01-15",
      "id": "142519",
      "original_text": "Sonstige Registerbekanntmachung\nNiedersachsen Amtsgericht Hannover HRB 227301\nEfficon Hannover GmbH – Hannover",
      "type": "Sonstige Registerbekanntmachung",
      "state": "Niedersachsen",
      "amtsgericht": "Amtsgericht Hannover",
      "registernummer": "HRB 227301",
      "registerart": "HRB",
      "company_name": "Efficon Hannover GmbH",
      "company_seat": "Hannover",
      "details": "15.01.2026 (Bekanntmachungsdatum)\n\nNiedersachsen Amtsgericht Hannover HRB 227301\nSonstige Registerbekanntmachung 15.01.2026 (Eintragungsdatum)\n\nEfficon Hannover GmbH\nGesellschaft mit beschränkter Haftung\nHannover\n\nDen Gläubigern der Gesellschaft, deren Forderungen begründet worden sind, bevor die Eintragung der Beendigung des Vertrages in das Handelsregister nach § 10 HGB als bekanntgemacht gilt, ist vom anderen Vertragsteil Sicherheit zu leisten, wenn sie sich binnen sechs Monaten nach der Bekanntmachung zu diesem Zweck bei ihm melden."
    },
    {
      "date": "2026-01-15",
      "id": "142520",
      "original_text": "Registerbekanntmachung nach dem Umwandlungsgesetz\nNiedersachsen Amtsgericht Oldenburg (Oldenburg) HRB 202527\nBögershausen Bau GmbH – Goldenstedt",
      "type": "Registerbekanntmachung nach dem Umwandlungsgesetz",
      "state": "Niedersachsen",
      "amtsgericht": "Amtsgericht Oldenburg (Oldenburg)",
      "registernummer": "HRB 202527",
      "registerart": "HRB",
      "company_name": "Bögershausen Bau GmbH",
      "company_seat": "Goldenstedt",
      "details": "15.01.2026 (Bekanntmachungsdatum)\n\nNiedersachsen Amtsgericht Oldenburg (Oldenburg) HRB 202527\nRegisterbekanntmachung nach dem Umwandlungsgesetz 15.01.2026 (Eintragungsdatum)\n\nBögershausen Bau GmbH\nGesellschaft mit beschränkter Haftung\nGoldenstedt\n\nDen Gläubigern der an der Verschmelzung beteiligten Rechtsträger ist, wenn sie binnen sechs Monaten nach dem Tag, an dem die Eintragung der Verschmelzung in das Register des Sitzes desjenigen Rechtsträgers, dessen Gläubiger sie sind, nach § 19  Abs.  3 UmwG als bekannt gemacht gilt, ihren Anspruch nach Grund und Höhe schriftlich anmelden, Sicherheit zu leisten, soweit sie nicht Befriedigung verlangen können. Dieses Recht steht den Gläubigern jedoch nur zu, wenn sie glaubhaft machen, dass durch die Verschmelzung die Erfüllung der Forderung gefährdet wird."
    },
    {
      "date": "2026-01-15",
      "id": "142521",
      "original_text": "Registerbekanntmachung nach dem Umwandlungsgesetz\nNiedersachsen Amtsgericht Göttingen HRB 205722\nKWS SAAT SE & Co. KGaA – Einbeck",
      "type": "Registerbekanntmachung nach dem Umwandlungsgesetz",
      "state": "Niedersachsen",
      "amtsgericht": "Amtsgericht Göttingen",
      "registernummer": "HRB 205722",
      "registerart": "HRB",
      "company_name": "KWS SAAT SE & Co. KGaA",
      "company_seat": "Einbeck",
      "details": "15.01.2026 (Bekanntmachungsdatum)\n\nNiedersachsen Amtsgericht Göttingen HRB 205722\nRegisterbekanntmachung nach dem Umwandlungsgesetz\n\nKWS SAAT SE & Co. KGaA\nKommanditgesellschaft auf Aktien\nEinbeck\n\nAls nicht eingetragen wird bekannt gemacht: Der Entwurf eines Verschmelzungsvertrages wurde eingereicht."
    },
    {
      "date": "2026-01-15",
      "id": "142522",
      "original_text": "Löschungsankündigung\nNiedersachsen Amtsgericht Braunschweig HRB 206629\nTAK San. UG (haftungsbeschränkt) – Salzgitter",
      "type": "Löschungsankündigung",
      "state": "Niedersachsen",
      "amtsgericht": "Amtsgericht Braunschweig",
      "registernummer": "HRB 206629",
      "registerart": "HRB",
      "company_name": "TAK San. UG (haftungsbeschränkt)",
      "company_seat": "Salzgitter",
      "details": "15.01.2026 (Bekanntmachungsdatum)\n\nNiedersachsen Amtsgericht Braunschweig HRB 206629\nLöschungsankündigung 15.01.2026 (Eintragungsdatum)\n\nTAK San. UG (haftungsbeschränkt)\nGesellschaft mit beschränkter Haftung\nSalzgitter\n\nDas Registergericht beabsichtigt, die Gesellschaft von Amts wegen nach § 394 FamFG zu löschen. Die Frist zur Erhebung eines Widerspruchs ist auf 1 Monat ab dieser Registerbekanntmachung festgesetzt."
    },
    {
      "date": "2026-01-15",
      "id": "142523",
      "original_text": "Einreichung neuer Dokumente\nBaden-Württemberg Amtsgericht Stuttgart HRB 789324\nSCHUNK Beteiligungs SE – Lauffen am Neckar",
      "type": "Einreichung neuer Dokumente",
      "state": "Baden-Württemberg",
      "amtsgericht": "Amtsgericht Stuttgart",
      "registernummer": "HRB 789324",
      "registerart": "HRB",
      "company_name": "SCHUNK Beteiligungs SE",
      "company_seat": "Lauffen am Neckar",
      "details": "15.01.2026 (Bekanntmachungsdatum)\n\nBaden-Württemberg Amtsgericht Stuttgart HRB 789324\nEinreichung neuer Dokumente 15.01.2026 (Eintragungsdatum)\n\nSCHUNK Beteiligungs SE\nEuropäische Aktiengesellschaft (SE)\nLauffen am Neckar\n\nDie Gesellschaft hat am 13.01.2026 die Liste über die Zusammensetzung des Aufsichtsrats zum Handelsregister eingereicht."
    },
    {
      "date": "2026-01-15",
      "id": "142524",
      "original_text": "Löschungsankündigung\nRheinland-Pfalz Amtsgericht Montabaur HRB 29616\nSmails System Group UG (haftungsbeschränkt) – Neuwied",
      "type": "Löschungsankündigung",
      "state": "Rheinland-Pfalz",
      "amtsgericht": "Amtsgericht Montabaur",
      "registernummer": "HRB 29616",
      "registerart": "HRB",
      "company_name": "Smails System Group UG (haftungsbeschränkt)",
      "company_seat": "Neuwied",
      "details": "15.01.2026 (Bekanntmachungsdatum)\n\nRheinland-Pfalz Amtsgericht Montabaur HRB 29616\nLöschungsankündigung\n\nSmails System Group UG (haftungsbeschränkt)\nGesellschaft mit beschränkter Haftung\nNeuwied\n\nDas Registergericht beabsichtigt nachfolgende Firma von Amts wegen nach § 394 FamFG zu löschen. Die Frist zur Erhebung eines Widerspruchs ist auf 1 Monat festgesetzt."
    },
    {
      "date": "2026-01-15",
      "id": "142525",
      "original_text": "Registerbekanntmachung nach dem Umwandlungsgesetz\nBremen Amtsgericht Bremen HRB 23705\nKYOCERA Fastening Solutions Germany GmbH – Bremen",
      "type": "Registerbekanntmachung nach dem Umwandlungsgesetz",
      "state": "Bremen",
      "amtsgericht": "Amtsgericht Bremen",
      "registernummer": "HRB 23705",
      "registerart": "HRB",
      "company_name": "KYOCERA Fastening Solutions Germany GmbH",
      "company_seat": "Bremen",
      "details": "15.01.2026 (Bekanntmachungsdatum)\n\nBremen Amtsgericht Bremen HRB 23705\nRegisterbekanntmachung nach dem Umwandlungsgesetz 12.01.2026 (Eintragungsdatum)\n\nKYOCERA Fastening Solutions Germany GmbH\nGesellschaft mit beschränkter Haftung\nBremen\n\nZu Eintragungsnummer 12 vom 12.01.2026 wird als nicht eingetragen veröffentlicht: Den Gläubigern der an der Verschmelzung beteiligten Rechtsträger ist, wenn sie binnen sechs Monaten nach dem Tag, an dem die Eintragung der Verschmelzung in das Register des Sitzes desjenigen Rechtsträgers, dessen Gläubiger sie sind, als bekannt gemacht gilt, ihren Anspruch nach Grund und Höhe schriftlich anmelden, Sicherheit zu leisten, soweit sie nicht Befriedigung verlangen können. Dieses Recht steht den Gläubigern jedoch nur zu, wenn sie glaubhaft machen, dass durch die Verschmelzung die Erfüllung ihrer Forderung gefährdet wird. Das Recht, Sicherheitsleistung zu verlangen, steht Gläubigern nicht zu, die im Falle der Insolvenz ein Recht auf vorzugsweise Befriedigung aus einer Deckungsmasse haben, die nach gesetzlicher Vorschrift zu ihrem Schutz errichtet und staatlich überwacht ist."
    },
    {
      "date": "2026-01-15",
      "id": "142526",
      "original_text": "Sonstige Registerbekanntmachung\nBremen Amtsgericht Bremen HRB 20780\nCSM Deutschland GmbH – Bremen",
      "type": "Sonstige Registerbekanntmachung",
      "state": "Bremen",
      "amtsgericht": "Amtsgericht Bremen",
      "registernummer": "HRB 20780",
      "registerart": "HRB",
      "company_name": "CSM Deutschland GmbH",
      "company_seat": "Bremen",
      "details": "15.01.2026 (Bekanntmachungsdatum)\n\nBremen Amtsgericht Bremen HRB 20780\nSonstige Registerbekanntmachung\n\nCSM Deutschland GmbH\nGesellschaft mit beschränkter Haftung\nBremen\n\nAls nicht eingetragen wird bekannt gemacht: Liste des Aufsichtsrats wurde eingereicht."
    },
    {
      "date": "2026-01-15",
      "id": "142527",
      "original_text": "Löschungsankündigung\nBremen Amtsgericht Bremen HRB 38006\nDISTRICT28 UG (haftungsbeschränkt) – Bremen",
      "type": "Löschungsankündigung",
      "state": "Bremen",
      "amtsgericht": "Amtsgericht Bremen",
      "registernummer": "HRB 38006",
      "registerart": "HRB",
      "company_name": "DISTRICT28 UG (haftungsbeschränkt)",
      "company_seat": "Bremen",
      "details": "15.01.2026 (Bekanntmachungsdatum)\n\nBremen Amtsgericht Bremen HRB 38006\nLöschungsankündigung\n\nDISTRICT28 UG (haftungsbeschränkt)\nGesellschaft mit beschränkter Haftung\nBremen\n\nEs ist beabsichtigt die im Handelsregister eingetragene Gesellschaft von Amts wegen gemäß § 394 FamFG zu löschen. Gegen die Löschung kann beim AG Bremen schriftlich oder zu Protokoll der Geschäftsstelle Widerspruch eingelegt werden. Widerspruchsfrist 4 Wochen."
    },
    {
      "date": "2026-01-15",
      "id": "142528",
      "original_text": "Sonstige Registerbekanntmachung\nRheinland-Pfalz Amtsgericht Koblenz HRB 13636\nVREM Verkehrsbetrieb Rhein Eifel Mosel GmbH – Polch",
      "type": "Sonstige Registerbekanntmachung",
      "state": "Rheinland-Pfalz",
      "amtsgericht": "Amtsgericht Koblenz",
      "registernummer": "HRB 13636",
      "registerart": "HRB",
      "company_name": "VREM Verkehrsbetrieb Rhein Eifel Mosel GmbH",
      "company_seat": "Polch",
      "details": "15.01.2026 (Bekanntmachungsdatum)\n\nRheinland-Pfalz Amtsgericht Koblenz HRB 13636\nSonstige Registerbekanntmachung 15.01.2026 (Eintragungsdatum)\n\nVREM Verkehrsbetrieb Rhein Eifel Mosel GmbH\nGesellschaft mit beschränkter Haftung\nPolch\n\nAls nicht eingetragen wird veröffentlicht: Den Gläubigern der Gesellschaft, deren Forderungen begründet worden sind, bevor die Eintragung der Beendigung des Beherrschungs- undGewinnabführungsvertrages in das Handelsregister nach § 10 des Handelsgesetzbuches als bekanntgemacht gilt, hat der andere Vertragsteil Sicherheit zu leisten, wenn sie sich binnen sechs Monaten nach der Bekanntmachung der Eintragung zu diesem Zweck bei ihm melden."
    },
    {
      "date": "2026-01-15",
      "id": "142529",
      "original_text": "Einreichung neuer Dokumente\nNordrhein-Westfalen Amtsgericht Duisburg HRB 14225\nSWB - Service - Wohnungsvermietungs- und -baugesellschaft mbH – Mülheim an der Ruhr",
      "type": "Einreichung neuer Dokumente",
      "state": "Nordrhein-Westfalen",
      "amtsgericht": "Amtsgericht Duisburg",
      "registernummer": "HRB 14225",
      "registerart": "HRB",
      "company_name": "SWB - Service - Wohnungsvermietungs- und -baugesellschaft mbH",
      "company_seat": "Mülheim an der Ruhr",
      "details": "15.01.2026 (Bekanntmachungsdatum)\n\nNordrhein-Westfalen Amtsgericht Duisburg HRB 14225\nEinreichung neuer Dokumente 15.01.2026 (Eintragungsdatum)\n\nSWB - Service - Wohnungsvermietungs- und -baugesellschaft mbH\nGesellschaft mit beschränkter Haftung\nMülheim an der Ruhr\n\nDem Registergericht ist eine Liste der Mitglieder des Aufsichtsrates eingereicht worden."
    },
    {
      "date": "2026-01-15",
      "id": "142530",
      "original_text": "Registerbekanntmachung nach dem Umwandlungsgesetz\nNordrhein-Westfalen Amtsgericht Lemgo GsR 299\nMartens & Hannig eGbR – Detmold",
      "type": "Registerbekanntmachung nach dem Umwandlungsgesetz",
      "state": "Nordrhein-Westfalen",
      "amtsgericht": "Amtsgericht Lemgo",
      "registernummer": "GsR 299",
      "registerart": "GsR",
      "company_name": "Martens & Hannig eGbR",
      "company_seat": "Detmold",
      "details": "15.01.2026 (Bekanntmachungsdatum)\n\nNordrhein-Westfalen Amtsgericht Lemgo GsR 299\nRegisterbekanntmachung nach dem Umwandlungsgesetz 15.01.2026 (Eintragungsdatum)\n\nMartens & Hannig eGbR\nGesellschaft bürgerlichen Rechts\nDetmold\n\nDen Gläubigern der an der formwechselnden Umwandlung beteiligten Rechtsträger ist, wenn sie binnen sechs Monaten nach dem Tag, an dem die Eintragung der formwechselnden Umwandlung in das Register des Sitzes desjenigen Rechtsträgers, dessen Gläubiger sie sind, nach § 19 Absatz 3 UmwG als bekanntgemacht gilt, ihren Anspruch nach Grund und Höhe schriftlich anmelden, Sicherheit zu leisten, soweit sie nicht Befriedigung verlangen können. Dieses Recht steht den Gläubigern jedoch nur zu, wenn sie glaubhaft machen, dass durch die formwechselnden Umwandlung die Erfüllung ihrer Forderung gefährdet wird."
    },
    {
      "date": "2026-01-15",
      "id": "142531",
      "original_text": "Registerbekanntmachung nach dem Umwandlungsgesetz\nNordrhein-Westfalen Amtsgericht Köln HRB 101954\nThe Hub Gastro GmbH – Köln",
      "type": "Registerbekanntmachung nach dem Umwandlungsgesetz",
      "state": "Nordrhein-Westfalen",
      "amtsgericht": "Amtsgericht Köln",
      "registernummer": "HRB 101954",
      "registerart": "HRB",
      "company_name": "The Hub Gastro GmbH",
      "company_seat": "Köln",
      "details": "15.01.2026 (Bekanntmachungsdatum)\n\nNordrhein-Westfalen Amtsgericht Köln HRB 101954\nRegisterbekanntmachung nach dem Umwandlungsgesetz 15.01.2026 (Eintragungsdatum)\n\nThe Hub Gastro GmbH\nGesellschaft mit beschränkter Haftung\nKöln\n\nDen Gläubigern der an der Verschmelzung beteiligten Rechtsträger ist, wenn sie binnen sechs Monaten nach dem Tag, an dem die Eintragung der Verschmelzung in das Register des Sitzes desjenigen Rechtsträgers, dessen Gläubiger sie sind, nach § 19 Absatz 3 UmwG als bekanntgemacht gilt, ihren Anspruch nach Grund und Höhe schriftlich anmelden, Sicherheit zu leisten, soweit sie nicht Befriedigung verlangen können. Dieses Recht steht den Gläubigern jedoch nur zu, wenn sie glaubhaft machen, dass durch die Verschmelzung die Erfüllung ihrer Forderung gefährdet wird."
    },
    {
      "date": "2026-01-15",
      "id": "142532",
      "original_text": "Löschungsankündigung\nNordrhein-Westfalen Amtsgericht Köln HRB 113439\nB.R. Daheim UG (haftungsbeschränkt) – Köln",
      "type": "Löschungsankündigung",
      "state": "Nordrhein-Westfalen",
      "amtsgericht": "Amtsgericht Köln",
      "registernummer": "HRB 113439",
      "registerart": "HRB",
      "company_name": "B.R. Daheim UG (haftungsbeschränkt)",
      "company_seat": "Köln",
      "details": "15.01.2026 (Bekanntmachungsdatum)\n\nNordrhein-Westfalen Amtsgericht Köln HRB 113439\nLöschungsankündigung\n\nB.R. Daheim UG (haftungsbeschränkt)\nGesellschaft mit beschränkter Haftung\nKöln\n\nDas Registergericht beabsichtigt die Gesellschaft von Amts wegen nach § 394 FamFG zu löschen. Die Frist zur Erhebung eines Widerspruchs ist auf einen Monat festgesetzt."
    },
    {
      "date": "2026-01-15",
      "id": "142533",
      "original_text": "Löschungsankündigung\nNordrhein-Westfalen Amtsgericht Neuss HRB 23965\nNOX Services GmbH – Neuss",
      "type": "Löschungsankündigung",
      "state": "Nordrhein-Westfalen",
      "amtsgericht": "Amtsgericht Neuss",
      "registernummer": "HRB 23965",
      "registerart": "HRB",
      "company_name": "NOX Services GmbH",
      "company_seat": "Neuss",
      "details": "15.01.2026 (Bekanntmachungsdatum)\n\nNordrhein-Westfalen Amtsgericht Neuss HRB 23965\nLöschungsankündigung 16.01.2026 (Eintragungsdatum)\n\nNOX Services GmbH\nGesellschaft mit beschränkter Haftung\nNeuss\n\nDas Registergericht beabsichtigt die Gesellschaft von Amts wegen nach § 394 FamFG zu löschen. Die Frist zur Erhebung eines Widerspruchs ist auf einen Monat festgesetzt. Rechtsbehelfsbelehrung: Gegen diese Verfügung können Sie Widerspruch einlegen. Der Widerspruch ist bei dem Amtsgericht Neuss - Registergericht -, Breite Str. 48, 41460 Neuss schriftlich in deutscher Sprache oder zur Niederschrift der Geschäftsstelle einzulegen.Der Widerspruch kann auch zur Niederschrift der Geschäftsstelle eines jeden Amtsgerichtes abgegeben werden. Die Einlegung ist auch durch Übertragung eines elektronischen Dokuments an die elektronische Poststelle des Gerichts möglich. Das elektronische Dokument muss für die Bearbeitung durch das Gericht geeignet und mit einer qualifizierten elektronischen Signatur der verantwortenden Person versehen sein oder von der verantwortenden\nPerson signiert und auf einem sicheren Übermittlungsweg gemäß § 130a ZPO nach näherer Maßgabe der Verordnung über die technischen Rahmenbedingungen des elektronischen Rechtsverkehrs und über das besondere elektronische Behördenpostfach (BGBl. I, S.3803) eingereicht werden. Weitere Informationen erhalten Sie auf der Internetseite www.justiz.de.\nDer Widerspruch muss spätestens innerhalb der gesetzten Frist nach der schriftlichen Bekanntgabe der Verfügung bei dem Amtsgericht - Registergericht - Neuss eingegangen sein. Dies gilt auch dann, wenn der Widerspruch zur Niederschrift der Geschäftsstelle eines anderen Amtsgerichtes abgegeben wurde. Die Frist beginnt mit der schriftlichen Bekanntgabe der Verfügung. Die Bekanntgabe ist entweder durch Zustellung oder am dritten Tage nach Aufgabe zur Post bewirkt. Fällt das Ende der Frist auf einen Sonntag, einen allgemeinen Feiertag oder Sonnabend, so endet die Frist mit Ablauf des nächsten Werktages.Der Widerspruch muss die Bezeichnung der angefochtenen Verfügung sowie die Erklärung enthalten, dass Widerspruch gegen diese Verfügung eingelegt wird. Er ist zu unterzeichnen und soll begründet werden."
    },
    {
      "date": "2026-01-15",
      "id": "142534",
      "original_text": "Löschungsankündigung\nNordrhein-Westfalen Amtsgericht Düsseldorf HRB 85653\nSartoriali Deutschland GmbH – Düsseldorf",
      "type": "Löschungsankündigung",
      "state": "Nordrhein-Westfalen",
      "amtsgericht": "Amtsgericht Düsseldorf",
      "registernummer": "HRB 85653",
      "registerart": "HRB",
      "company_name": "Sartoriali Deutschland GmbH",
      "company_seat": "Düsseldorf",
      "details": "15.01.2026 (Bekanntmachungsdatum)\n\nNordrhein-Westfalen Amtsgericht Düsseldorf HRB 85653\nLöschungsankündigung\n\nSartoriali Deutschland GmbH\nGesellschaft mit beschränkter Haftung\nDüsseldorf\n\nDas Registergericht beabsichtigt die Gesellschaft von Amts wegen nach § 394 FamFG zu löschen. Die Frist zur Erhebung eines Widerspruchs ist auf 3 Wochen festgesetzt.\n\nRechtsbehelfsbelehrung:\nDas Widerspruchsrecht steht jedem zu, der an der Unterlassung der Löschung ein berechtigtes Interesse hat. Der Widerspruch ist bei dem Amtsgericht Düsseldorf -Registergericht-, Werdener Straße 1, 40227 Düsseldorf schriftlich in deutscher Sprache oder zur Niederschrift der Geschäftsstelle einzulegen. Der Widerspruch kann auch zur Niederschrift der Geschäftsstelle eines jeden Amtsgerichtes abgegeben werden. Die Einlegung ist auch durch Übertragung eines elektronischen Dokuments an die elektronische Poststelle des Gerichts möglich. Das elektronische Dokument muss für die Bearbeitung durch das Gericht geeignet und mit einer qualifizierten elektronischen Signatur der verantwortenden Person versehen sein oder von der verantwortenden Person signiert und auf einem sicheren Übermittlungsweg gemäß § 130a ZPO nach näherer Maßgabe der Verordnung über die technischen Rahmenbedingungen des elektronischen Rechtsverkehrs und über das besondere elektronische Behördenpostfach (BGBl. I, S.3803) eingereicht werden. Weitere Informationen erhalten Sie auf der Internetseite www.justiz.de.\nDer Widerspruch muss spätestens innerhalb der gesetzten Frist nach dem Datum der Bekanntmachung der Löschungsankündigung bei dem Amtsgericht - Registergericht - Düsseldorf eingegangen sein.  Dies gilt auch dann, wenn der Widerspruch zur Niederschrift der Geschäftsstelle eines anderen Amtsgerichtes abgegeben wurde. Die Frist beginnt mit dem Tage der Bekanntmachung der Löschungsankündigung in dem für die Bekanntmachung der Eintragungen in das Handelsregister bestimmten elektronischen Informations- und Kommunikationssystem nach § 10 des Handelsgesetzbuches. Fällt das Ende der Frist auf einen Sonntag, einen allgemeinen Feiertag oder Sonnabend, so endet die Frist mit Ablauf des nächsten Werktages.\nDer Widerspruch muss die Bezeichnung der angefochtenen Löschungsankündigung sowie die Erklärung enthalten, dass Widerspruch gegen diese Löschungsankündigung eingelegt wird. Er ist zu unterzeichnen und soll begründet werden."
    },
    {
      "date": "2026-01-15",
      "id": "142535",
      "original_text": "Löschungsankündigung\nNordrhein-Westfalen Amtsgericht Neuss HRB 19725\nWee GmbH – Neuss",
      "type": "Löschungsankündigung",
      "state": "Nordrhein-Westfalen",
      "amtsgericht": "Amtsgericht Neuss",
      "registernummer": "HRB 19725",
      "registerart": "HRB",
      "company_name": "Wee GmbH",
      "company_seat": "Neuss",
      "details": "15.01.2026 (Bekanntmachungsdatum)\n\nNordrhein-Westfalen Amtsgericht Neuss HRB 19725\nLöschungsankündigung 15.01.2026 (Eintragungsdatum)\n\nWee GmbH\nGesellschaft mit beschränkter Haftung\nNeuss\n\nDas Registergericht beabsichtigt die Gesellschaft von Amts wegen nach § 394 FamFG zu löschen. Die Frist zur Erhebung eines Widerspruchs ist auf einen Monat festgesetzt. Rechtsbehelfsbelehrung: Gegen diese Verfügung können Sie Widerspruch einlegen. Der Widerspruch ist bei dem Amtsgericht Neuss - Registergericht -, Breite Str. 48, 41460 Neuss schriftlich in deutscher Sprache oder zur Niederschrift der Geschäftsstelle einzulegen.Der Widerspruch kann auch zur Niederschrift der Geschäftsstelle eines jeden Amtsgerichtes abgegeben werden. Die Einlegung ist auch durch Übertragung eines elektronischen Dokuments an die elektronische Poststelle des Gerichts möglich. Das elektronische Dokument muss für die Bearbeitung durch das Gericht geeignet und mit einer qualifizierten elektronischen Signatur der verantwortenden Person versehen sein oder von der verantwortenden Person signiert und auf einem sicheren Übermittlungsweg gemäß § 130a ZPO nach näherer Maßgabe der Verordnung über die technischen Rahmenbedingungen des elektronischen Rechtsverkehrs und über das besondere elektronische Behördenpostfach (BGBl. I, S.3803) eingereicht werden. Weitere Informationen erhalten Sie auf der Internetseite www.justiz.de. Der Widerspruch muss spätestens innerhalb der gesetzten Frist nach der schriftlichen Bekanntgabe der Verfügung bei dem Amtsgericht - Registergericht - Neuss eingegangen sein. Dies gilt auch dann, wenn der Widerspruch zur Niederschrift der Geschäftsstelle eines anderen Amtsgerichtes abgegeben wurde. Die Frist beginnt mit der schriftlichen Bekanntgabe der Verfügung. Die Bekanntgabe ist entweder durch Zustellung oder am dritten Tage nach Aufgabe zur Post bewirkt. Fällt das Ende der Frist auf einen Sonntag, einen allgemeinen Feiertag oder Sonnabend, so endet die Frist mit Ablauf des nächsten Werktages. Der Widerspruch muss die Bezeichnung der angefochtenen Verfügung sowie die Erklärung enthalten, dass Widerspruch gegen diese Verfügung eingelegt wird. Er ist zu unterzeichnen und soll begründet werden."
    },
    {
      "date": "2026-01-15",
      "id": "142536",
      "original_text": "Registerbekanntmachung nach dem Umwandlungsgesetz\nNordrhein-Westfalen Amtsgericht Siegen HRB 10632\nProfi. S Gesellschaft für logistische Softwareentwicklung und Operations Research mbH – Wenden",
      "type": "Registerbekanntmachung nach dem Umwandlungsgesetz",
      "state": "Nordrhein-Westfalen",
      "amtsgericht": "Amtsgericht Siegen",
      "registernummer": "HRB 10632",
      "registerart": "HRB",
      "company_name": "Profi. S Gesellschaft für logistische Softwareentwicklung und Operations Research mbH",
      "company_seat": "Wenden",
      "details": "15.01.2026 (Bekanntmachungsdatum)\n\nNordrhein-Westfalen Amtsgericht Siegen HRB 10632\nRegisterbekanntmachung nach dem Umwandlungsgesetz 15.01.2026 (Eintragungsdatum)\n\nProfi. S Gesellschaft für logistische Softwareentwicklung und Operations Research mbH\nGesellschaft mit beschränkter Haftung\nWenden\n\nDen Gläubigern der an der Verschmelzung beteiligten Rechtsträger ist, wenn sie binnen sechs Monaten nach dem Tag, an dem die Eintragung der Verschmelzung in das Register des Sitzes desjenigen Rechtsträgers, dessen Gläubiger sie sind, nach § 19 Absatz 3 UmwG als bekanntgemacht gilt, ihren Anspruch nach Grund und Höhe schriftlich anmelden, Sicherheit zu leisten, soweit sie nicht Befriedigung verlangen können. Dieses Recht steht den Gläubigern jedoch nur zu, wenn sie glaubhaft machen, dass durch die Verschmelzung die Erfüllung ihrer Forderung gefährdet wird."
    },
    {
      "date": "2026-01-15",
      "id": "142537",
      "original_text": "Registerbekanntmachung nach dem Umwandlungsgesetz\nNordrhein-Westfalen Amtsgericht Aachen HRB 13990\nHemoteq AG – Würselen",
      "type": "Registerbekanntmachung nach dem Umwandlungsgesetz",
      "state": "Nordrhein-Westfalen",
      "amtsgericht": "Amtsgericht Aachen",
      "registernummer": "HRB 13990",
      "registerart": "HRB",
      "company_name": "Hemoteq AG",
      "company_seat": "Würselen",
      "details": "15.01.2026 (Bekanntmachungsdatum)\n\nNordrhein-Westfalen Amtsgericht Aachen HRB 13990\nRegisterbekanntmachung nach dem Umwandlungsgesetz 15.01.2026 (Eintragungsdatum)\n\nHemoteq AG\nAktiengesellschaft\nWürselen\n\nDen Gläubigern der an der formwechselnden Umwandlung beteiligten Rechtsträger ist, wenn sie binnen sechs Monaten nach dem Tag, an dem die Eintragung der formwechselnden Umwandlung in das Register des Sitzes desjenigen Rechtsträgers, dessen Gläubiger sie sind, nach § 19 Absatz 3 UmwG als bekanntgemacht gilt, ihren Anspruch nach Grund und Höhe schriftlich anmelden, Sicherheit zu leisten, soweit sie nicht Befriedigung verlangen können. Dieses Recht steht den Gläubigern jedoch nur zu, wenn sie glaubhaft machen, dass durch die formwechselnden Umwandlung die Erfüllung ihrer Forderung gefährdet wird."
    },
    {
      "date": "2026-01-15",
      "id": "142538",
      "original_text": "Löschungsankündigung\nNordrhein-Westfalen Amtsgericht Wuppertal HRB 4274\nErich Drevermann GmbH – Wuppertal",
      "type": "Löschungsankündigung",
      "state": "Nordrhein-Westfalen",
      "amtsgericht": "Amtsgericht Wuppertal",
      "registernummer": "HRB 4274",
      "registerart": "HRB",
      "company_name": "Erich Drevermann GmbH",
      "company_seat": "Wuppertal",
      "details": "15.01.2026 (Bekanntmachungsdatum)\n\nNordrhein-Westfalen Amtsgericht Wuppertal HRB 4274\nLöschungsankündigung\n\nErich Drevermann GmbH\nGesellschaft mit beschränkter Haftung\nWuppertal\n\nDas Registergericht beabsichtigt die Gesellschaft von Amts wegen nach § 394 FamFG zu löschen. Die Frist zur Erhebung eines Widerspruchs ist auf einen Monat festgesetzt."
    },
    {
      "date": "2026-01-15",
      "id": "142539",
      "original_text": "Registerbekanntmachung nach dem Umwandlungsgesetz\nNordrhein-Westfalen Amtsgericht Lemgo HRB 11869\nBadkomfort-Lippe GmbH – Detmold",
      "type": "Registerbekanntmachung nach dem Umwandlungsgesetz",
      "state": "Nordrhein-Westfalen",
      "amtsgericht": "Amtsgericht Lemgo",
      "registernummer": "HRB 11869",
      "registerart": "HRB",
      "company_name": "Badkomfort-Lippe GmbH",
      "company_seat": "Detmold",
      "details": "15.01.2026 (Bekanntmachungsdatum)\n\nNordrhein-Westfalen Amtsgericht Lemgo HRB 11869\nRegisterbekanntmachung nach dem Umwandlungsgesetz 15.01.2026 (Eintragungsdatum)\n\nBadkomfort-Lippe GmbH\nGesellschaft mit beschränkter Haftung\nDetmold\n\nDen Gläubigern der an der formwechselnden Umwandlung beteiligten Rechtsträger ist, wenn sie binnen sechs Monaten nach dem Tag, an dem die Eintragung der formwechselnden Umwandlung in das Register des Sitzes desjenigen Rechtsträgers, dessen Gläubiger sie sind, nach § 19 Absatz 3 UmwG als bekanntgemacht gilt, ihren Anspruch nach Grund und Höhe schriftlich anmelden, Sicherheit zu leisten, soweit sie nicht Befriedigung verlangen können. Dieses Recht steht den Gläubigern jedoch nur zu, wenn sie glaubhaft machen, dass durch die formwechselnden Umwandlung die Erfüllung ihrer Forderung gefährdet wird."
    },
    {
      "date": "2026-01-15",
      "id": "142540",
      "original_text": "Registerbekanntmachung nach dem Umwandlungsgesetz\nNordrhein-Westfalen Amtsgericht Steinfurt HRB 11619\nW & M Serviceleistungen UG (haftungsbeschränkt) – Greven",
      "type": "Registerbekanntmachung nach dem Umwandlungsgesetz",
      "state": "Nordrhein-Westfalen",
      "amtsgericht": "Amtsgericht Steinfurt",
      "registernummer": "HRB 11619",
      "registerart": "HRB",
      "company_name": "W & M Serviceleistungen UG (haftungsbeschränkt)",
      "company_seat": "Greven",
      "details": "15.01.2026 (Bekanntmachungsdatum)\n\nNordrhein-Westfalen Amtsgericht Steinfurt HRB 11619\nRegisterbekanntmachung nach dem Umwandlungsgesetz 15.12.2025 (Eintragungsdatum)\n\nW & M Serviceleistungen UG (haftungsbeschränkt)\nGesellschaft mit beschränkter Haftung\nGreven\n\nDen Gläubigern der an der Verschmelzung beteiligten Rechtsträger ist, wenn sie binnen sechs Monaten nach dem Tag, an dem die Eintragung der Verschmelzung in das Register des Sitzes derjenigen Rechtsträger deren Gläubiger sie sind, nach § 19 Absatz 3 UmwG als bekanntgemacht gilt, ihren Anspruch nach Grund und Höhe schriftlich anmelden, Sicherheit zu leisten, soweit sie nicht Befriedigung verlangen können. Dieses Recht steht den Gläubigern jedoch nur zu, wenn sie glaubhaft machen, dass durch die Verschmelzung die Erfüllung ihrer Forderung gefährdet wird."
    },
    {
      "date": "2026-01-15",
      "id": "142541",
      "original_text": "Registerbekanntmachung nach dem Umwandlungsgesetz\nNordrhein-Westfalen Amtsgericht Dortmund HRB 37966\nGreenkeeping-Perfekt-GmbH – Dortmund",
      "type": "Registerbekanntmachung nach dem Umwandlungsgesetz",
      "state": "Nordrhein-Westfalen",
      "amtsgericht": "Amtsgericht Dortmund",
      "registernummer": "HRB 37966",
      "registerart": "HRB",
      "company_name": "Greenkeeping-Perfekt-GmbH",
      "company_seat": "Dortmund",
      "details": "15.01.2026 (Bekanntmachungsdatum)\n\nNordrhein-Westfalen Amtsgericht Dortmund HRB 37966\nRegisterbekanntmachung nach dem Umwandlungsgesetz 15.01.2026 (Eintragungsdatum)\n\nGreenkeeping-Perfekt-GmbH\nGesellschaft mit beschränkter Haftung\nDortmund\n\nDen Gläubigern der an der formwechselnden Umwandlung beteiligten Rechtsträger ist, wenn sie binnen sechs Monaten nach dem Tag, an dem die Eintragung der formwechselnden Umwandlung in das Register des Sitzes desjenigen Rechtsträgers, dessen Gläubiger sie sind, nach § 19 Absatz 3 UmwG als bekanntgemacht gilt, ihren Anspruch nach Grund und Höhe schriftlich anmelden, Sicherheit zu leisten, soweit sie nicht Befriedigung verlangen können. Dieses Recht steht den Gläubigern jedoch nur zu, wenn sie glaubhaft machen, dass durch die formwechselnden Umwandlung die Erfüllung ihrer Forderung gefährdet wird."
    },
    {
      "date": "2026-01-15",
      "id": "142542",
      "original_text": "Einreichung neuer Dokumente\nNordrhein-Westfalen Amtsgericht Bonn HRB 13651\nHIL Heeresinstandsetzungslogistik GmbH – Bonn",
      "type": "Einreichung neuer Dokumente",
      "state": "Nordrhein-Westfalen",
      "amtsgericht": "Amtsgericht Bonn",
      "registernummer": "HRB 13651",
      "registerart": "HRB",
      "company_name": "HIL Heeresinstandsetzungslogistik GmbH",
      "company_seat": "Bonn",
      "details": "15.01.2026 (Bekanntmachungsdatum)\n\nNordrhein-Westfalen Amtsgericht Bonn HRB 13651\nEinreichung neuer Dokumente\n\nHIL Heeresinstandsetzungslogistik GmbH\nGesellschaft mit beschränkter Haftung\nBonn\n\nDem Registergericht ist eine neue Liste der Mitglieder des Aufsichtsrates eingereicht worden."
    },
    {
      "date": "2026-01-15",
      "id": "142543",
      "original_text": "Sonstige Registerbekanntmachung\nNordrhein-Westfalen Amtsgericht Bielefeld HRB 46419\nTKH Airport Solutions GmbH – Bielefeld",
      "type": "Sonstige Registerbekanntmachung",
      "state": "Nordrhein-Westfalen",
      "amtsgericht": "Amtsgericht Bielefeld",
      "registernummer": "HRB 46419",
      "registerart": "HRB",
      "company_name": "TKH Airport Solutions GmbH",
      "company_seat": "Bielefeld",
      "details": "15.01.2026 (Bekanntmachungsdatum)\n\nNordrhein-Westfalen Amtsgericht Bielefeld HRB 46419\nSonstige Registerbekanntmachung 08.01.2026 (Eintragungsdatum)\n\nTKH Airport Solutions GmbH\nGesellschaft mit beschränkter Haftung\nBielefeld\n\nAls nicht eingetragen wird veröffentlicht: Den Gläubigern der Gesellschaft, deren Forderungen begründet worden sind bevor die Eintragung der Beendigung des Gewinnabführungsvertrages  in das Handelsregister nach § 10 des Handelsgesetzbuches als bekanntgemacht gilt, hat der andere Vertragsteil Sicherheit zu leisten, wenn sie sich binnen sechs Monaten nach der Bekanntmachung der Eintragung zu diesem Zweck bei ihm melden."
    },
    {
      "date": "2026-01-15",
      "id": "142544",
      "original_text": "Registerbekanntmachung nach dem Umwandlungsgesetz\nNordrhein-Westfalen Amtsgericht Köln HRB 93163\nKapten & Son GmbH – Köln",
      "type": "Registerbekanntmachung nach dem Umwandlungsgesetz",
      "state": "Nordrhein-Westfalen",
      "amtsgericht": "Amtsgericht Köln",
      "registernummer": "HRB 93163",
      "registerart": "HRB",
      "company_name": "Kapten & Son GmbH",
      "company_seat": "Köln",
      "details": "15.01.2026 (Bekanntmachungsdatum)\n\nNordrhein-Westfalen Amtsgericht Köln HRB 93163\nRegisterbekanntmachung nach dem Umwandlungsgesetz 15.01.2026 (Eintragungsdatum)\n\nKapten & Son GmbH\nGesellschaft mit beschränkter Haftung\nKöln\n\nDen Gläubigern der an der Verschmelzung beteiligten Rechtsträger ist, wenn sie binnen sechs Monaten nach dem Tag, an dem die Eintragung der Verschmelzung in das Register des Sitzes desjenigen Rechtsträgers, dessen Gläubiger sie sind, nach § 19 Absatz 3 UmwG als bekanntgemacht gilt, ihren Anspruch nach Grund und Höhe schriftlich anmelden, Sicherheit zu leisten, soweit sie nicht Befriedigung verlangen können. Dieses Recht steht den Gläubigern jedoch nur zu, wenn sie glaubhaft machen, dass durch die Verschmelzung die Erfüllung ihrer Forderung gefährdet wird."
    },
    {
      "date": "2026-01-15",
      "id": "142545",
      "original_text": "Löschungsankündigung\nNordrhein-Westfalen Amtsgericht Dortmund HRB 33524\nAmiri Bau GmbH – Lünen",
      "type": "Löschungsankündigung",
      "state": "Nordrhein-Westfalen",
      "amtsgericht": "Amtsgericht Dortmund",
      "registernummer": "HRB 33524",
      "registerart": "HRB",
      "company_name": "Amiri Bau GmbH",
      "company_seat": "Lünen",
      "details": "15.01.2026 (Bekanntmachungsdatum)\n\nNordrhein-Westfalen Amtsgericht Dortmund HRB 33524\nLöschungsankündigung 15.01.2026 (Eintragungsdatum)\n\nAmiri Bau GmbH\nGesellschaft mit beschränkter Haftung\nLünen\n\nDas Registergericht beabsichtigt die Gesellschaft von Amts wegen nach § 394 FamFG zu löschen. Die Frist zur Erhebung eines Widerspruchs ist auf zwei Monate festgesetzt."
    },
    {
      "date": "2026-01-15",
      "id": "142546",
      "original_text": "Einreichung neuer Dokumente\nNordrhein-Westfalen Amtsgericht Düsseldorf HRB 39664\nApo Asset Management GmbH – Düsseldorf",
      "type": "Einreichung neuer Dokumente",
      "state": "Nordrhein-Westfalen",
      "amtsgericht": "Amtsgericht Düsseldorf",
      "registernummer": "HRB 39664",
      "registerart": "HRB",
      "company_name": "Apo Asset Management GmbH",
      "company_seat": "Düsseldorf",
      "details": "15.01.2026 (Bekanntmachungsdatum)\n\nNordrhein-Westfalen Amtsgericht Düsseldorf HRB 39664\nEinreichung neuer Dokumente 15.01.2026 (Eintragungsdatum)\n\nApo Asset Management GmbH\nGesellschaft mit beschränkter Haftung\nDüsseldorf\n\nDem Registergericht ist eine neue Liste der Mitglieder des Aufsichtsrates eingereicht worden."
    },
    {
      "date": "2026-01-15",
      "id": "142547",
      "original_text": "Löschungsankündigung\nNordrhein-Westfalen Amtsgericht Hagen HRB 11301\nProtofox GmbH – Schwerte",
      "type": "Löschungsankündigung",
      "state": "Nordrhein-Westfalen",
      "amtsgericht": "Amtsgericht Hagen",
      "registernummer": "HRB 11301",
      "registerart": "HRB",
      "company_name": "Protofox GmbH",
      "company_seat": "Schwerte",
      "details": "15.01.2026 (Bekanntmachungsdatum)\n\nNordrhein-Westfalen Amtsgericht Hagen HRB 11301\nLöschungsankündigung\n\nProtofox GmbH\nGesellschaft mit beschränkter Haftung\nSchwerte\n\nDas Registergericht beabsichtigt, die im Handelsregister eingetragene\nGesellschaft gemäß § 394 I FamFG wegen Vermögenslosigkeit von\nAmts wegen zu löschen. Gegen diese Verfügung kann Widerspruch\neingelegt werden. Die Frist zur Erhebung eines Widerspruchs gegen die\nbeabsichtigte Löschung von Amts wegen ist auf drei Monate festgesetzt.\nRechtsbehelfsbelehrung:\nGegen diese Verfügung können Sie Widerspruch einlegen.\nDer Widerspruch ist bei dem Amtsgericht Hagen, Heinitzstraße 42,\n58097 Hagen schriftlich in deutscher Sprache oder zur Niederschrift der\nGeschäftsstelle einzulegen. Der Widerspruch kann auch zur\nNiederschrift der Geschäftsstelle eines jeden Amtsgerichts abgegeben\nwerden.\nDer Widerspruch muss spätestens innerhalb der gesetzten Frist bei dem\nAmtsgericht Hagen eingegangen sein. Dies gilt auch dann, wenn der\nWiderspruch zur Geschäftsstelle eines anderen Amtsgerichtes\nabgegeben wurde. Die Frist beginnt mit der Veröffentlichung. Fällt das\nEnde der Frist auf einen Sonntag, einen allgemeinen Feiertag oder\nSonnabend, so endet die Frist mit Ablauf des nächsten Werktages.\nDer Widerspruch muss die Bezeichnung der angefochtenen Verfügung\nsowie die Erklärung erhalten, dass Widerspruch gegen diese Verfügung\neingelegt wird. Er ist zu unterzeichnen und soll begründet werden."
    },
    {
      "date": "2026-01-15",
      "id": "142548",
      "original_text": "Löschungsankündigung\nNordrhein-Westfalen Amtsgericht Gütersloh HRB 12175\nDelicatius UG (haftungsbeschränkt) – Werther",
      "type": "Löschungsankündigung",
      "state": "Nordrhein-Westfalen",
      "amtsgericht": "Amtsgericht Gütersloh",
      "registernummer": "HRB 12175",
      "registerart": "HRB",
      "company_name": "Delicatius UG (haftungsbeschränkt)",
      "company_seat": "Werther",
      "details": "15.01.2026 (Bekanntmachungsdatum)\n\nNordrhein-Westfalen Amtsgericht Gütersloh HRB 12175\nLöschungsankündigung 15.01.2026 (Eintragungsdatum)\n\nDelicatius UG (haftungsbeschränkt)\nGesellschaft mit beschränkter Haftung\nWerther\n\nDas Registergericht beabsichtigt die Gesellschaft von Amts wegen nach § 394 FamFG zu löschen. Die Frist zur Erhebung eines Widerspruchs ist auf einen Monat festgesetzt."
    },
    {
      "date": "2026-01-15",
      "id": "142549",
      "original_text": "Löschungsankündigung\nNordrhein-Westfalen Amtsgericht Aachen HRB 25589\nHNK Gastronomie GmbH – Aachen",
      "type": "Löschungsankündigung",
      "state": "Nordrhein-Westfalen",
      "amtsgericht": "Amtsgericht Aachen",
      "registernummer": "HRB 25589",
      "registerart": "HRB",
      "company_name": "HNK Gastronomie GmbH",
      "company_seat": "Aachen",
      "details": "15.01.2026 (Bekanntmachungsdatum)\n\nNordrhein-Westfalen Amtsgericht Aachen HRB 25589\nLöschungsankündigung\n\nHNK Gastronomie GmbH\nGesellschaft mit beschränkter Haftung\nAachen\n\nDas Registergericht beabsichtigt, von Amts wegen die Gesellschaft wegen Vermögenslosigkeit nach § 394 FamFG zu löschen, weil das Finanzamt\nAachen-Stadt mit Schreiben vom 19.12.2025 Umstände mitgeteilt hat, aufgrund\nderer das Gericht davon überzeugt ist, dass die Gesellschaft vollständig\nvermögenslos ist.\n\nZur Geltendmachung des Widerspruchs gegen die beabsichtigte Löschung wird\nhiermit eine Frist von einem Monat ab Veröffentlichung dieser Ankündigung\nbestimmt.\n\nRechtsbehelfsbelehrung:\n\nGegen diese Verfügung kann Widerspruch eingelegt werden. Zum Widerspruch ist jeder berechtigt, der an der Unterlassung der Löschung ein berechtigtes Interesse hat.\n\nDer Widerspruch ist bei dem Amtsgericht Aachen, Adalbertsteinweg 92, 52070\nAachen schriftlich in deutscher Sprache oder zur Niederschrift der Geschäftsstelle einzulegen. Der Widerspruch kann auch zur Niederschrift der Geschäftsstelle eines jeden Amtsgerichtes abgegeben werden.\n\nDer Widerspruch muss spätestens innerhalb der gesetzten Frist nach der\nBekanntgabe der Verfügung bei dem Amtsgericht Aachen eingegangen sein. Dies gilt auch dann, wenn der Widerspruch zur Niederschrift der Geschäftsstelle eines anderen Amtsgerichtes abgegeben wurde. Die Frist beginnt mit der Bekanntgabe der Verfügung durch Veröffentlichung. Fällt das Ende der Frist auf einen Sonntag, einen allgemeinen Feiertag oder Sonnabend, so endet die Frist mit Ablauf des nächsten Werktages.\n\nDer Widerspruch muss die Bezeichnung der angefochtenen Verfügung sowie die Erklärung enthalten, dass Widerspruch gegen diese Verfügung eingelegt wird. Er ist zu unterzeichnen und soll begründet werden.\n\nDie Einlegung ist auch durch Übertragung eines elektronischen Dokuments an die elektronische Poststelle des Gerichts möglich. Das elektronische Dokument muss für die Bearbeitung durch das Gericht geeignet und mit einer qualifizierten\nelektronischen Signatur der verantwortenden Person versehen sein oder von der verantwortenden Person signiert und auf einem sicheren Übermittlungsweg gemäß § 130 a ZPO nach näherer Maßgabe der Verordnung über die technischen Rahmenbedingungen des elektronischen Rechtsverkehrs und über das besondere elektronische Behördenpostfach (BGBl. I, S. 3803) eingereicht werden. Weitere Informationen erhalten Sie auf der Internetseite www.justiz.de."
    },
    {
      "date": "2026-01-15",
      "id": "142550",
      "original_text": "Registerbekanntmachung nach dem Umwandlungsgesetz\nNordrhein-Westfalen Amtsgericht Essen HRB 37570\nrent-a-byte GmbH – Essen",
      "type": "Registerbekanntmachung nach dem Umwandlungsgesetz",
      "state": "Nordrhein-Westfalen",
      "amtsgericht": "Amtsgericht Essen",
      "registernummer": "HRB 37570",
      "registerart": "HRB",
      "company_name": "rent-a-byte GmbH",
      "company_seat": "Essen",
      "details": "15.01.2026 (Bekanntmachungsdatum)\n\nNordrhein-Westfalen Amtsgericht Essen HRB 37570\nRegisterbekanntmachung nach dem Umwandlungsgesetz 15.01.2026 (Eintragungsdatum)\n\nrent-a-byte GmbH\nGesellschaft mit beschränkter Haftung\nEssen\n\nDen Gläubigern der an der formwechselnden Umwandlung beteiligten Rechtsträger ist, wenn sie binnen sechs Monaten nach dem Tag, an dem die Eintragung der formwechselnden Umwandlung in das Register des Sitzes desjenigen Rechtsträgers, dessen Gläubiger sie sind, nach § 19 Absatz 3 UmwG als bekanntgemacht gilt, ihren Anspruch nach Grund und Höhe schriftlich anmelden, Sicherheit zu leisten, soweit sie nicht Befriedigung verlangen können. Dieses Recht steht den Gläubigern jedoch nur zu, wenn sie glaubhaft machen, dass durch die formwechselnden Umwandlung die Erfüllung ihrer Forderung gefährdet wird."
    },
    {
      "date": "2026-01-15",
      "id": "142551",
      "original_text": "Löschungsankündigung\nNordrhein-Westfalen Amtsgericht Dortmund HRB 30924\nBRANDEDsound & Stage Heroes UG (haftungsbeschränkt) – Castrop-Rauxel",
      "type": "Löschungsankündigung",
      "state": "Nordrhein-Westfalen",
      "amtsgericht": "Amtsgericht Dortmund",
      "registernummer": "HRB 30924",
      "registerart": "HRB",
      "company_name": "BRANDEDsound & Stage Heroes UG (haftungsbeschränkt)",
      "company_seat": "Castrop-Rauxel",
      "details": "15.01.2026 (Bekanntmachungsdatum)\n\nNordrhein-Westfalen Amtsgericht Dortmund HRB 30924\nLöschungsankündigung 15.01.2026 (Eintragungsdatum)\n\nBRANDEDsound & Stage Heroes UG (haftungsbeschränkt)\nGesellschaft mit beschränkter Haftung\nCastrop-Rauxel\n\nDas Registergericht beabsichtigt die Gesellschaft von Amts wegen nach § 394 FamFG zu löschen. Die Frist zur Erhebung eines Widerspruchs ist auf zwei Monate festgesetzt."
    },
    {
      "date": "2026-01-15",
      "id": "142552",
      "original_text": "Löschungsankündigung\nNordrhein-Westfalen Amtsgericht Düsseldorf HRB 82796\nBaMü GmbH – Monheim",
      "type": "Löschungsankündigung",
      "state": "Nordrhein-Westfalen",
      "amtsgericht": "Amtsgericht Düsseldorf",
      "registernummer": "HRB 82796",
      "registerart": "HRB",
      "company_name": "BaMü GmbH",
      "company_seat": "Monheim",
      "details": "15.01.2026 (Bekanntmachungsdatum)\n\nNordrhein-Westfalen Amtsgericht Düsseldorf HRB 82796\nLöschungsankündigung\n\nBaMü GmbH\nGesellschaft mit beschränkter Haftung\nMonheim\n\nDas Registergericht beabsichtigt die Gesellschaft von Amts wegen nach § 394 FamFG zu löschen. Die Frist zur Erhebung eines Widerspruchs ist auf 3 Wochen festgesetzt.\n\nRechtsbehelfsbelehrung:\nDas Widerspruchsrecht steht jedem zu, der an der Unterlassung der Löschung ein berechtigtes Interesse hat. Der Widerspruch ist bei dem Amtsgericht Düsseldorf -Registergericht-, Werdener Straße 1, 40227 Düsseldorf schriftlich in deutscher Sprache oder zur Niederschrift der Geschäftsstelle einzulegen. Der Widerspruch kann auch zur Niederschrift der Geschäftsstelle eines jeden Amtsgerichtes abgegeben werden. Die Einlegung ist auch durch Übertragung eines elektronischen Dokuments an die elektronische Poststelle des Gerichts möglich. Das elektronische Dokument muss für die Bearbeitung durch das Gericht geeignet und mit einer qualifizierten elektronischen Signatur der verantwortenden Person versehen sein oder von der verantwortenden Person signiert und auf einem sicheren Übermittlungsweg gemäß § 130a ZPO nach näherer Maßgabe der Verordnung über die technischen Rahmenbedingungen des elektronischen Rechtsverkehrs und über das besondere elektronische Behördenpostfach (BGBl. I, S.3803) eingereicht werden. Weitere Informationen erhalten Sie auf der Internetseite www.justiz.de.\nDer Widerspruch muss spätestens innerhalb der gesetzten Frist nach dem Datum der Bekanntmachung der Löschungsankündigung bei dem Amtsgericht - Registergericht - Düsseldorf eingegangen sein.  Dies gilt auch dann, wenn der Widerspruch zur Niederschrift der Geschäftsstelle eines anderen Amtsgerichtes abgegeben wurde. Die Frist beginnt mit dem Tage der Bekanntmachung der Löschungsankündigung in dem für die Bekanntmachung der Eintragungen in das Handelsregister bestimmten elektronischen Informations- und Kommunikationssystem nach § 10 des Handelsgesetzbuches. Fällt das Ende der Frist auf einen Sonntag, einen allgemeinen Feiertag oder Sonnabend, so endet die Frist mit Ablauf des nächsten Werktages.\nDer Widerspruch muss die Bezeichnung der angefochtenen Löschungsankündigung sowie die Erklärung enthalten, dass Widerspruch gegen diese Löschungsankündigung eingelegt wird. Er ist zu unterzeichnen und soll begründet werden."
    },
    {
      "date": "2026-01-15",
      "id": "142553",
      "original_text": "Registerbekanntmachung nach dem Umwandlungsgesetz\nNordrhein-Westfalen Amtsgericht Essen HRB 17806\nrent-a-byte ag – Essen",
      "type": "Registerbekanntmachung nach dem Umwandlungsgesetz",
      "state": "Nordrhein-Westfalen",
      "amtsgericht": "Amtsgericht Essen",
      "registernummer": "HRB 17806",
      "registerart": "HRB",
      "company_name": "rent-a-byte ag",
      "company_seat": "Essen",
      "details": "15.01.2026 (Bekanntmachungsdatum)\n\nNordrhein-Westfalen Amtsgericht Essen HRB 17806\nRegisterbekanntmachung nach dem Umwandlungsgesetz 15.01.2026 (Eintragungsdatum)\n\nrent-a-byte ag\nAktiengesellschaft\nEssen\n\nDen Gläubigern der an der formwechselnden Umwandlung beteiligten Rechtsträger ist, wenn sie binnen sechs Monaten nach dem Tag, an dem die Eintragung der formwechselnden Umwandlung in das Register des Sitzes desjenigen Rechtsträgers, dessen Gläubiger sie sind, nach § 19 Absatz 3 UmwG als bekanntgemacht gilt, ihren Anspruch nach Grund und Höhe schriftlich anmelden, Sicherheit zu leisten, soweit sie nicht Befriedigung verlangen können. Dieses Recht steht den Gläubigern jedoch nur zu, wenn sie glaubhaft machen, dass durch die formwechselnden Umwandlung die Erfüllung ihrer Forderung gefährdet wird."
    },
    {
      "date": "2026-01-15",
      "id": "142554",
      "original_text": "Registerbekanntmachung nach dem Umwandlungsgesetz\nNordrhein-Westfalen Amtsgericht Dortmund HRB 31542\nGreenkeeping-Perfekt AG – Dortmund",
      "type": "Registerbekanntmachung nach dem Umwandlungsgesetz",
      "state": "Nordrhein-Westfalen",
      "amtsgericht": "Amtsgericht Dortmund",
      "registernummer": "HRB 31542",
      "registerart": "HRB",
      "company_name": "Greenkeeping-Perfekt AG",
      "company_seat": "Dortmund",
      "details": "15.01.2026 (Bekanntmachungsdatum)\n\nNordrhein-Westfalen Amtsgericht Dortmund HRB 31542\nRegisterbekanntmachung nach dem Umwandlungsgesetz 15.01.2026 (Eintragungsdatum)\n\nGreenkeeping-Perfekt AG\nAktiengesellschaft\nDortmund\n\nDen Gläubigern der an der formwechselnden Umwandlung beteiligten Rechtsträger ist, wenn sie binnen sechs Monaten nach dem Tag, an dem die Eintragung der formwechselnden Umwandlung in das Register des Sitzes desjenigen Rechtsträgers, dessen Gläubiger sie sind, nach § 19 Absatz 3 UmwG als bekanntgemacht gilt, ihren Anspruch nach Grund und Höhe schriftlich anmelden, Sicherheit zu leisten, soweit sie nicht Befriedigung verlangen können. Dieses Recht steht den Gläubigern jedoch nur zu, wenn sie glaubhaft machen, dass durch die formwechselnden Umwandlung die Erfüllung ihrer Forderung gefährdet wird."
    },
    {
      "date": "2026-01-15",
      "id": "142555",
      "original_text": "Sonstige Registerbekanntmachung\nNordrhein-Westfalen Amtsgericht Aachen HRB 14109\nCadocare GmbH – Übach-Palenberg",
      "type": "Sonstige Registerbekanntmachung",
      "state": "Nordrhein-Westfalen",
      "amtsgericht": "Amtsgericht Aachen",
      "registernummer": "HRB 14109",
      "registerart": "HRB",
      "company_name": "Cadocare GmbH",
      "company_seat": "Übach-Palenberg",
      "details": "15.01.2026 (Bekanntmachungsdatum)\n\nNordrhein-Westfalen Amtsgericht Aachen HRB 14109\nSonstige Registerbekanntmachung 15.01.2026 (Eintragungsdatum)\n\nCadocare GmbH\nGesellschaft mit beschränkter Haftung\nÜbach-Palenberg\n\nAls nicht eingetragen wird veröffentlicht: Den Gläubigern der Gesellschaft, deren Forderungen begründet worden sind bevor die Eintragung der Beendigung des Beherrschungs- und Gewinnabführungsvertrages  in das Handelsregister nach § 10 des Handelsgesetzbuches als bekanntgemacht gilt, hat der andere Vertragsteil Sicherheit zu leisten, wenn sie sich binnen sechs Monaten nach der Bekanntmachung der Eintragung zu diesem Zweck bei ihm melden."
    },
    {
      "date": "2026-01-15",
      "id": "142556",
      "original_text": "Löschungsankündigung\nNordrhein-Westfalen Amtsgericht Gütersloh HRB 6753\nKowalschik Verwaltungs-GmbH – Rietberg",
      "type": "Löschungsankündigung",
      "state": "Nordrhein-Westfalen",
      "amtsgericht": "Amtsgericht Gütersloh",
      "registernummer": "HRB 6753",
      "registerart": "HRB",
      "company_name": "Kowalschik Verwaltungs-GmbH",
      "company_seat": "Rietberg",
      "details": "15.01.2026 (Bekanntmachungsdatum)\n\nNordrhein-Westfalen Amtsgericht Gütersloh HRB 6753\nLöschungsankündigung 15.01.2026 (Eintragungsdatum)\n\nKowalschik Verwaltungs-GmbH\nGesellschaft mit beschränkter Haftung\nRietberg\n\nDas Registergericht beabsichtigt die Gesellschaft von Amts wegen nach § 394 FamFG zu löschen. Die Frist zur Erhebung eines Widerspruchs ist auf einen Monat festgesetzt."
    },
    {
      "date": "2026-01-15",
      "id": "142557",
      "original_text": "Einreichung neuer Dokumente\nBaden-Württemberg Amtsgericht Stuttgart HRB 762524\nKarl Storz Verwaltungs SE – Tuttlingen",
      "type": "Einreichung neuer Dokumente",
      "state": "Baden-Württemberg",
      "amtsgericht": "Amtsgericht Stuttgart",
      "registernummer": "HRB 762524",
      "registerart": "HRB",
      "company_name": "Karl Storz Verwaltungs SE",
      "company_seat": "Tuttlingen",
      "details": "15.01.2026 (Bekanntmachungsdatum)\n\nBaden-Württemberg Amtsgericht Stuttgart HRB 762524\nEinreichung neuer Dokumente\n\nKarl Storz Verwaltungs SE\nEuropäische Aktiengesellschaft (SE)\nTuttlingen\n\nDie Gesellschaft hat am 12.01.2026 die Liste über die Zusammensetzung des Verwaltungsrats zum Handelsregister eingereicht."
    },
    {
      "date": "2026-01-15",
      "id": "142558",
      "original_text": "Registerbekanntmachung nach dem Umwandlungsgesetz\nThüringen Amtsgericht Jena GnR 400046\nAgrargenossenschaft Gerstungen eG – Gerstungen",
      "type": "Registerbekanntmachung nach dem Umwandlungsgesetz",
      "state": "Thüringen",
      "amtsgericht": "Amtsgericht Jena",
      "registernummer": "GnR 400046",
      "registerart": "GnR",
      "company_name": "Agrargenossenschaft Gerstungen eG",
      "company_seat": "Gerstungen",
      "details": "15.01.2026 (Bekanntmachungsdatum)\n\nThüringen Amtsgericht Jena GnR 400046\nRegisterbekanntmachung nach dem Umwandlungsgesetz 15.01.2026 (Eintragungsdatum)\n\nAgrargenossenschaft Gerstungen eG\neingetragene Genossenschaft\nGerstungen\n\nNicht eingetragen: Den Gläubigern des formwechselnden  Rechtsträgers, ist wenn sie binnen sechs Monaten nach dem Tag, an dem die Eintragung des Formwechsels nach § 201 UmwG als bekanntgemacht gilt, ihren Anspruch nach Grund und Höhe schriftlich anmelden, Sicherheit zu leisten, soweit sie nicht Befriedigung verlangen können. Dieses Recht steht ihnen jedoch nur zu, wenn sie glaubhaft machen, daß durch den Formwechsel die Erfüllung ihrer Forderung gefährdet wird."
    },
    {
      "date": "2026-01-15",
      "id": "142559",
      "original_text": "Registerbekanntmachung nach dem Umwandlungsgesetz\nHessen Amtsgericht Fulda HRA 6710\nMET Epe Speicher GmbH & Co. KG – Eiterfeld",
      "type": "Registerbekanntmachung nach dem Umwandlungsgesetz",
      "state": "Hessen",
      "amtsgericht": "Amtsgericht Fulda",
      "registernummer": "HRA 6710",
      "registerart": "HRA",
      "company_name": "MET Epe Speicher GmbH & Co. KG",
      "company_seat": "Eiterfeld",
      "details": "15.01.2026 (Bekanntmachungsdatum)\n\nHessen Amtsgericht Fulda HRA 6710\nRegisterbekanntmachung nach dem Umwandlungsgesetz 15.01.2026 (Eintragungsdatum)\n\nMET Epe Speicher GmbH & Co. KG\nKommanditgesellschaft\nEiterfeld\n\nDen Gläubigern der an der formwechselnden Umwandlung beteiligten Rechtsträger ist, wenn sie binnen sechs Monaten nach dem Tag, an dem die Eintragung der formwechselnden Umwandlung in das Register des Sitzes desjenigen Rechtsträgers, dessen Gläubiger sie sind, nach § 201 UmwG bekannt gemacht worden ist, ihren Anspruch nach Grund und Höhe schriftlich anmelden, Sicherheit zu leisten, soweit sie nicht Befriedigung verlangen können. Dieses Recht steht den Gläubigern jedoch nur zu, wenn sie glaubhaft machen, dass durch die formwechselnden Umwandlung die Erfüllung ihrer Forderung gefährdet wird."
    },
    {
      "date": "2026-01-15",
      "id": "142560",
      "original_text": "Sonstige Registerbekanntmachung\nHessen Amtsgericht Wetzlar HRB 5187\nLeica Microsystems GmbH – Wetzlar",
      "type": "Sonstige Registerbekanntmachung",
      "state": "Hessen",
      "amtsgericht": "Amtsgericht Wetzlar",
      "registernummer": "HRB 5187",
      "registerart": "HRB",
      "company_name": "Leica Microsystems GmbH",
      "company_seat": "Wetzlar",
      "details": "15.01.2026 (Bekanntmachungsdatum)\n\nHessen Amtsgericht Wetzlar HRB 5187\nSonstige Registerbekanntmachung 15.01.2026 (Eintragungsdatum)\n\nLeica Microsystems GmbH\nGesellschaft mit beschränkter Haftung\nWetzlar\n\nDen Gläubigern der Gesellschaft, deren Forderungen begründet worden sind, bevor die Eintragung der Beendigung des Vertrags in das Handelsregister nach § 10 HGB bekannt gemacht worden ist, ist vom anderen Vertragsteil Sicherheit zu leisten, wenn sie sich binnen sechs Monaten nach dieser Bekanntmachung zu diesem Zweck bei ihm melden."
    },
    {
      "date": "2026-01-15",
      "id": "142561",
      "original_text": "Löschungsankündigung\nHessen Amtsgericht Frankfurt am Main HRB 96172\nMilla Vanilla Restaurants GmbH – Frankfurt am Main",
      "type": "Löschungsankündigung",
      "state": "Hessen",
      "amtsgericht": "Amtsgericht Frankfurt am Main",
      "registernummer": "HRB 96172",
      "registerart": "HRB",
      "company_name": "Milla Vanilla Restaurants GmbH",
      "company_seat": "Frankfurt am Main",
      "details": "15.01.2026 (Bekanntmachungsdatum)\n\nHessen Amtsgericht Frankfurt am Main HRB 96172\nLöschungsankündigung\n\nMilla Vanilla Restaurants GmbH\nGesellschaft mit beschränkter Haftung\nFrankfurt am Main\n\nEs ist beabsichtig, die Gesellschaft wegen Vermögenslosigkeit gemäß § 394 FamFG von Amts wegen im Handelsregister zu löschen. Hiergegen kann innerhalb eines Zeitraums von 1 Monat nach dieser Veröffentlichung Widerspruch bei dem Amtsgericht Frankfurt am Main eingelegt werden."
    },
    {
      "date": "2026-01-15",
      "id": "142562",
      "original_text": "Einreichung neuer Dokumente\nHessen Amtsgericht Frankfurt am Main HRB 44003\nDWS Alternatives GmbH – Frankfurt am Main",
      "type": "Einreichung neuer Dokumente",
      "state": "Hessen",
      "amtsgericht": "Amtsgericht Frankfurt am Main",
      "registernummer": "HRB 44003",
      "registerart": "HRB",
      "company_name": "DWS Alternatives GmbH",
      "company_seat": "Frankfurt am Main",
      "details": "15.01.2026 (Bekanntmachungsdatum)\n\nHessen Amtsgericht Frankfurt am Main HRB 44003\nEinreichung neuer Dokumente 15.01.2026 (Eintragungsdatum)\n\nDWS Alternatives GmbH\nGesellschaft mit beschränkter Haftung\nFrankfurt am Main\n\nDurch eine Änderung in den Personen der Aufsichtsratsmitglieder ist eine Liste der Mitglieder des Aufsichtsrates zum Handelsregister eingereicht worden."
    },
    {
      "date": "2026-01-15",
      "id": "142563",
      "original_text": "Registerbekanntmachung nach dem Umwandlungsgesetz\nHessen Amtsgericht Frankfurt am Main HRB 129520\nSchiffer Campus gGmbH – Frankfurt am Main",
      "type": "Registerbekanntmachung nach dem Umwandlungsgesetz",
      "state": "Hessen",
      "amtsgericht": "Amtsgericht Frankfurt am Main",
      "registernummer": "HRB 129520",
      "registerart": "HRB",
      "company_name": "Schiffer Campus gGmbH",
      "company_seat": "Frankfurt am Main",
      "details": "15.01.2026 (Bekanntmachungsdatum)\n\nHessen Amtsgericht Frankfurt am Main HRB 129520\nRegisterbekanntmachung nach dem Umwandlungsgesetz 15.01.2026 (Eintragungsdatum)\n\nSchiffer Campus gGmbH\nGesellschaft mit beschränkter Haftung\nFrankfurt am Main\n\nDen Gläubigern der an der formwechselnden Umwandlung beteiligten Rechtsträger ist, wenn sie binnen sechs Monaten nach dem Tag, an dem die Eintragung der formwechselnden Umwandlung in das Register des Sitzes desjenigen Rechtsträgers, dessen Gläubiger sie sind, nach § 201 UmwG  bekannt gemacht worden ist, ihren Anspruch nach Grund und Höhe schriftlich anmelden, Sicherheit zu leisten, soweit sie nicht Befriedigung verlangen können. Dieses Recht steht den Gläubigern jedoch nur zu, wenn sie glaubhaft machen, dass durch die formwechselnde Umwandlung die Erfüllung ihrer Forderung gefährdet wird."
    },
    {
      "date": "2026-01-15",
      "id": "142564",
      "original_text": "Löschungsankündigung\nHessen Amtsgericht Darmstadt HRB 88389\nSchneewind Living GmbH – Gernsheim",
      "type": "Löschungsankündigung",
      "state": "Hessen",
      "amtsgericht": "Amtsgericht Darmstadt",
      "registernummer": "HRB 88389",
      "registerart": "HRB",
      "company_name": "Schneewind Living GmbH",
      "company_seat": "Gernsheim",
      "details": "15.01.2026 (Bekanntmachungsdatum)\n\nHessen Amtsgericht Darmstadt HRB 88389\nLöschungsankündigung\n\nSchneewind Living GmbH\nGesellschaft mit beschränkter Haftung\nGernsheim\n\nDas Registergericht beabsichtigt die im Handelsregister eingetragene Gesellschaft von Amts wegen nach § 394 FamFG zu löschen. Die Frist zur Erhebung eines Widerspruchs gegen die beabsichtigte Löschung wird auf 3 Monate festgesetzt."
    },
    {
      "date": "2026-01-15",
      "id": "142565",
      "original_text": "Sonstige Registerbekanntmachung\nHessen Amtsgericht Gießen HRB 2611\nMeilbeck Kälte- und Klimatechnik GmbH – Grünberg",
      "type": "Sonstige Registerbekanntmachung",
      "state": "Hessen",
      "amtsgericht": "Amtsgericht Gießen",
      "registernummer": "HRB 2611",
      "registerart": "HRB",
      "company_name": "Meilbeck Kälte- und Klimatechnik GmbH",
      "company_seat": "Grünberg",
      "details": "15.01.2026 (Bekanntmachungsdatum)\n\nHessen Amtsgericht Gießen HRB 2611\nSonstige Registerbekanntmachung 15.01.2026 (Eintragungsdatum)\n\nMeilbeck Kälte- und Klimatechnik GmbH\nGesellschaft mit beschränkter Haftung\nGrünberg\n\nDen Gläubigern der Gesellschaft, deren Forderungen begründet worden sind, bevor die Eintragung der Beendigung des Vertrags in das Handelsregister nach § 10 HGB bekannt gemacht worden ist, ist vom anderen Vertragsteil Sicherheit zu leisten, wenn sie sich binnen sechs Monaten nach dieser Bekanntmachung zu diesem Zweck bei ihm melden."
    },
    {
      "date": "2026-01-15",
      "id": "142566",
      "original_text": "Sonstige Registerbekanntmachung\nHessen Amtsgericht Darmstadt VR 82415\nLampertheimer Karneval Verein 2008 e.V. – Lampertheim",
      "type": "Sonstige Registerbekanntmachung",
      "state": "Hessen",
      "amtsgericht": "Amtsgericht Darmstadt",
      "registernummer": "VR 82415",
      "registerart": "VR",
      "company_name": "Lampertheimer Karneval Verein 2008 e.V.",
      "company_seat": "Lampertheim",
      "details": "15.01.2026 (Bekanntmachungsdatum)\n\nHessen Amtsgericht Darmstadt VR 82415\nSonstige Registerbekanntmachung 15.01.2026 (Eintragungsdatum)\n\nLampertheimer Karneval Verein 2008 e.V.\neingetragener Verein\nLampertheim\n\nDurch rechtskräftigen Beschluss des Amtsgerichts Darmstadt vom 21.02.2025 ist dem Verein gemäß § 73 BGB die Rechtsfähigkeit entzogen worden."
    },
    {
      "date": "2026-01-15",
      "id": "142567",
      "original_text": "Registerbekanntmachung nach dem Umwandlungsgesetz\nHessen Amtsgericht Frankfurt am Main HRA 54538\nSchiffer Campus GmbH & Co. KG – Frankfurt am Main",
      "type": "Registerbekanntmachung nach dem Umwandlungsgesetz",
      "state": "Hessen",
      "amtsgericht": "Amtsgericht Frankfurt am Main",
      "registernummer": "HRA 54538",
      "registerart": "HRA",
      "company_name": "Schiffer Campus GmbH & Co. KG",
      "company_seat": "Frankfurt am Main",
      "details": "15.01.2026 (Bekanntmachungsdatum)\n\nHessen Amtsgericht Frankfurt am Main HRA 54538\nRegisterbekanntmachung nach dem Umwandlungsgesetz 15.01.2026 (Eintragungsdatum)\n\nSchiffer Campus GmbH & Co. KG\nKommanditgesellschaft\nFrankfurt am Main\n\nDen Gläubigern der an der formwechselnden Umwandlung beteiligten Rechtsträger ist, wenn sie binnen sechs Monaten nach dem Tag, an dem die Eintragung der formwechselnden Umwandlung in das Register des Sitzes desjenigen Rechtsträgers, dessen Gläubiger sie sind, nach § 201 UmwG  bekannt gemacht worden ist, ihren Anspruch nach Grund und Höhe schriftlich anmelden, Sicherheit zu leisten, soweit sie nicht Befriedigung verlangen können. Dieses Recht steht den Gläubigern jedoch nur zu, wenn sie glaubhaft machen, dass durch die formwechselnde Umwandlung die Erfüllung ihrer Forderung gefährdet wird."
    },
    {
      "date": "2026-01-15",
      "id": "142568",
      "original_text": "Einreichung neuer Dokumente\nHessen Amtsgericht Frankfurt am Main HRB 54072\nMerz Pharma GmbH & Co. KGaA – Frankfurt am Main",
      "type": "Einreichung neuer Dokumente",
      "state": "Hessen",
      "amtsgericht": "Amtsgericht Frankfurt am Main",
      "registernummer": "HRB 54072",
      "registerart": "HRB",
      "company_name": "Merz Pharma GmbH & Co. KGaA",
      "company_seat": "Frankfurt am Main",
      "details": "15.01.2026 (Bekanntmachungsdatum)\n\nHessen Amtsgericht Frankfurt am Main HRB 54072\nEinreichung neuer Dokumente\n\nMerz Pharma GmbH & Co. KGaA\nKommanditgesellschaft auf Aktien\nFrankfurt am Main\n\nDurch eine Änderung in den Personen der Aufsichtsratsmitglieder ist eine Liste der Mitglieder des Aufsichtsrates zum Handelsregister eingereicht worden."
    },
    {
      "date": "2026-01-15",
      "id": "142569",
      "original_text": "Einreichung neuer Dokumente\nHessen Amtsgericht Hanau HRB 1461\nNORMA Germany GmbH – Maintal",
      "type": "Einreichung neuer Dokumente",
      "state": "Hessen",
      "amtsgericht": "Amtsgericht Hanau",
      "registernummer": "HRB 1461",
      "registerart": "HRB",
      "company_name": "NORMA Germany GmbH",
      "company_seat": "Maintal",
      "details": "15.01.2026 (Bekanntmachungsdatum)\n\nHessen Amtsgericht Hanau HRB 1461\nEinreichung neuer Dokumente\n\nNORMA Germany GmbH\nGesellschaft mit beschränkter Haftung\nMaintal\n\nDurch eine Änderung in den Personen der Aufsichtsratsmitglieder ist eine Liste der Mitglieder des Aufsichtsrates zum Handelsregister eingereicht worden."
    },
    {
      "date": "2026-01-15",
      "id": "96",
      "original_text": "Sonderregisterbekanntmachung OHNE Bezug zum elektr. Register\nBrandenburg Amtsgericht Potsdam\nHRB 28270 P\nWackenida GmbH",
      "type": "Sonderregisterbekanntmachung OHNE Bezug zum elektr. Register",
      "state": "Brandenburg",
      "amtsgericht": "Amtsgericht Potsdam",
      "company_name": "Wackenida GmbH",
      "sonderegister_referenz": "HRB 28270 P",
      "details": "15.01.2026 (Bekanntmachungsdatum)\n\nBrandenburg Amtsgericht Potsdam\nHRB 28270 P\nSonderregisterbekanntmachung OHNE Bezug zum elektr. Register\n\nWackenida GmbH\n\nAls nicht eingetragen wird veröffentlicht: Dem Amtsgericht Potsdam wurde der Entwurf des Formwechselplanes vom 15.12.2025 betreffend den grenzüberschreitenden , identitätswahrenden Formwechsel der Gesellschaft in eine Gesellschaft mit beschränkter Haftung nach dem Recht des Großherzogtums Luxemburg unter Verlegung des Sitzes der Gesellschaft nach Luxemburg eingereicht.\nDazu wird Folgendes bekannt gemacht:\n1. § 336 UmwG i.V.m. § 308 Abs. 1 S. 2Nr. 1 UmwG: Die Gesellschaft hat den Entwurf des Formwechselplans betreffend den grenzüberschreitenden Formwechsel im Wege des Herausformwechsels ohne Abwicklung und Auflösung von einer deutschen GmbH in eine reine Société à responsabilitè  limitée (S.à.r.l.) luxemburgischen Rechts mit gleichzeitiger Verlegung des Satzungssitzes nach Luxemburg, Großherzogtum Luxemburg, beim Handelsregister des Amtsgerichts Potsdam gemäß § 336 UmwG in Verbindung mit § 308 Abs. 1 Satz 2 Nr. 1 UmwG eingereicht.\n2. § 336 UmwG i.V.m. § 308 Abs. 1 S. 2  Nr. 2 UmwG: An dem grenzüberschreitenden Formwechsel ist die Wackenida GmbH mit Satzungssitz in Zossen, Deutschland, eine nach deutschem Recht  bestehende Gesellschaft mit beschränkter Haftung, beteiligt. Nach dem grenzüberschreitenden Formwechsel wird die Gesellschaft die Rechtsform einer reinen Société à responsabilité limitée (S.à r.l.), eine Gesellschaft mit beschränkter Haftung nach dem Recht des Großherzogtums Luxemburg, annehmen und als Wackenida S.à r.l. mit Satzungssitz in Luxemburg,Großherzogtum Luxemburg firmieren.\n3. § 336 UmwG i.V.m. § 308 Abs. 1 S. 2 Nr. 3 UmwG: Die Gesellschaft ist im Handelsregister des Amtsgerichts Potsdam unter der Handelsregisternummer HRB 28270 P eingetragen. Die Gesellschaft ist zudem im Handels- und Gesellschaftsregister von Luxemburg (Registre de commerce et des sociétés Luxembourg) unter der Nummer B228469 eingetragen, welche auch künftig fortbestehen wird.\n4. § 336 UmwG i.V.m. § 308 Abs. 1 S. 2 Nr. 4 UmwG: Die Gesellschafterversammlung zum Beschluss des grenzüberschreitenden Formwechsels ist für den Tag geplant, der auf den Ablauf von einem Monat nach dem Tag der Registerbekanntmachung des Formwechselplans folgt, oder ggfs. den nächsten Arbeitstag (wobei Samstage, Sonntage und bundesweite Feiertage nicht als Arbeitstage zählen).\na) Die Anteilsinhaber und die Gläubiger der Gesellschaft erhalten den Hinweis, dass sie spätestens fünf Arbeitstage vor dem Tag der Gesellschafterversammlung der Gesellschaft Bemerkungen zum Formwechselplan übermitteln können.\nb) Einen Betriebsrat gibt es nicht, die Gesellschaft hat keine Arbeitnehmer. Der guten Ordnung halber erfolgt gleichwohl der Hinweis, dass die zuständigen\nBetriebsräte der Gesellschaft oder, soweit es keinen Betriebsrat gibt, die Arbeitnehmer der Gesellschaft, spätestens fünf Arbeitstage vor dem Tag der\nGesellschafterversammlung der Gesellschaft Bemerkungen zum Formwechselplan übermitteln können."
    }
  ]
}