{
  "date": "2026-01-22",
  "date_of_scrape": "2026-01-23T04:24:33.536Z",
  "tool_version": "0.2.0",
  "number_of_announcements": 129,
  "announcements": [
    {
      "date": "2026-01-22",
      "id": "143132",
      "original_text": "Registerbekanntmachung nach dem Umwandlungsgesetz\nBayern Amtsgericht Traunstein HRB 33447\nAmbulanter Pflegedienst Trostberg GmbH – Trostberg",
      "type": "Registerbekanntmachung nach dem Umwandlungsgesetz",
      "state": "Bayern",
      "amtsgericht": "Amtsgericht Traunstein",
      "registernummer": "HRB 33447",
      "registerart": "HRB",
      "company_name": "Ambulanter Pflegedienst Trostberg GmbH",
      "company_seat": "Trostberg",
      "details": "22.01.2026 (Bekanntmachungsdatum)\n\nBayern Amtsgericht Traunstein HRB 33447\nRegisterbekanntmachung nach dem Umwandlungsgesetz 21.01.2026 (Eintragungsdatum)\n\nAmbulanter Pflegedienst Trostberg GmbH\nGesellschaft mit beschränkter Haftung\nTrostberg\n\nDen Gläubigern der an der Ausgliederung beteiligten Rechtsträger ist, wenn sie binnen sechs Monaten nach dem Tag, an dem die Eintragung der Ausgliederung in das Register des Sitzes desjenigen Rechtsträgers, dessen Gläubiger sie sind, nach §§ 125, 19 Abs. 3 UmwG als bekannt gemacht gilt, ihren Anspruch nach Grund und Höhe in Textform anmelden, Sicherheit zu leisten, soweit sie nicht Befriedigung verlangen können. Dieses Recht steht den Gläubigern jedoch nur zu, wenn sie glaubhaft machen, dass durch die Ausgliederung die Erfüllung ihrer Forderung gefährdet wird."
    },
    {
      "date": "2026-01-22",
      "id": "143133",
      "original_text": "Sonstige Registerbekanntmachung\nBayern Amtsgericht München HRB 226522\nPHÖNIX-Seniorenzentrum Fronmüllerstraße GmbH – München",
      "type": "Sonstige Registerbekanntmachung",
      "state": "Bayern",
      "amtsgericht": "Amtsgericht München",
      "registernummer": "HRB 226522",
      "registerart": "HRB",
      "company_name": "PHÖNIX-Seniorenzentrum Fronmüllerstraße GmbH",
      "company_seat": "München",
      "details": "22.01.2026 (Bekanntmachungsdatum)\n\nBayern Amtsgericht München HRB 226522\nSonstige Registerbekanntmachung 21.01.2026 (Eintragungsdatum)\n\nPHÖNIX-Seniorenzentrum Fronmüllerstraße GmbH\nGesellschaft mit beschränkter Haftung\nMünchen\n\nDen Gläubigern der Gesellschaft, deren Forderungen begründet worden sind, bevor die Eintragung der Beendigung des Beherrschungs- und Gewinnabführungsvertrages in das Handelsregister nach § 10 des Handelsgesetzbuches als bekanntgemacht gilt, hat der andere Vertragsteil Sicherheit zu leisten, wenn sie sich binnen sechs Monaten nach der Bekanntmachung der Eintragung zu diesem Zweck bei ihm melden."
    },
    {
      "date": "2026-01-22",
      "id": "143134",
      "original_text": "Registerbekanntmachung nach dem Umwandlungsgesetz\nBayern Amtsgericht München HRB 226522\nPHÖNIX-Seniorenzentrum Fronmüllerstraße GmbH – München",
      "type": "Registerbekanntmachung nach dem Umwandlungsgesetz",
      "state": "Bayern",
      "amtsgericht": "Amtsgericht München",
      "registernummer": "HRB 226522",
      "registerart": "HRB",
      "company_name": "PHÖNIX-Seniorenzentrum Fronmüllerstraße GmbH",
      "company_seat": "München",
      "details": "22.01.2026 (Bekanntmachungsdatum)\n\nBayern Amtsgericht München HRB 226522\nRegisterbekanntmachung nach dem Umwandlungsgesetz 21.01.2026 (Eintragungsdatum)\n\nPHÖNIX-Seniorenzentrum Fronmüllerstraße GmbH\nGesellschaft mit beschränkter Haftung\nMünchen\n\nDen Gläubigern der an der Verschmelzung beteiligten Rechtsträger ist, wenn sie binnen sechs Monaten nach dem Tag, an dem die Eintragung der Verschmelzung in das Register des Sitzes desjenigen Rechtsträgers, dessen Gläubiger sie sind, nach § 19 Abs. 3 UmwG als bekannt gemacht gilt, ihren Anspruch nach Grund und Höhe in Textform anmelden, Sicherheit zu leisten, soweit sie nicht Befriedigung verlangen können. Dieses Recht steht den Gläubigern jedoch nur zu, wenn sie glaubhaft machen, dass durch die Verschmelzung die Erfüllung ihrer Forderung gefährdet wird."
    },
    {
      "date": "2026-01-22",
      "id": "143135",
      "original_text": "Registerbekanntmachung nach dem Umwandlungsgesetz\nBayern Amtsgericht München HRA 121923\nEnergieoptimierer Johannes Ostler e.K. – Garmisch-Partenkirchen",
      "type": "Registerbekanntmachung nach dem Umwandlungsgesetz",
      "state": "Bayern",
      "amtsgericht": "Amtsgericht München",
      "registernummer": "HRA 121923",
      "registerart": "HRA",
      "company_name": "Energieoptimierer Johannes Ostler e.K.",
      "company_seat": "Garmisch-Partenkirchen",
      "details": "22.01.2026 (Bekanntmachungsdatum)\n\nBayern Amtsgericht München HRA 121923\nRegisterbekanntmachung nach dem Umwandlungsgesetz 21.01.2026 (Eintragungsdatum)\n\nEnergieoptimierer Johannes Ostler e.K.\nEinzelkaufmann / Einzelkauffrau\nGarmisch-Partenkirchen\n\nDen Gläubigern der an der Ausgliederung beteiligten Rechtsträger ist, wenn sie binnen sechs Monaten nach dem Tag, an dem die Eintragung der Ausgliederung in das Register des Sitzes desjenigen Rechtsträgers, dessen Gläubiger sie sind, nach §§ 125, 19 Abs. 3 UmwG als bekannt gemacht gilt, ihren Anspruch nach Grund und Höhe in Textform anmelden, Sicherheit zu leisten, soweit sie nicht Befriedigung verlangen können. Dieses Recht steht den Gläubigern jedoch nur zu, wenn sie glaubhaft machen, dass durch die Ausgliederung die Erfüllung ihrer Forderung gefährdet wird."
    },
    {
      "date": "2026-01-22",
      "id": "143136",
      "original_text": "Einreichung neuer Dokumente\nBayern Amtsgericht München HRB 173995\nPartnerFonds AG – Planegg",
      "type": "Einreichung neuer Dokumente",
      "state": "Bayern",
      "amtsgericht": "Amtsgericht München",
      "registernummer": "HRB 173995",
      "registerart": "HRB",
      "company_name": "PartnerFonds AG",
      "company_seat": "Planegg",
      "details": "22.01.2026 (Bekanntmachungsdatum)\n\nBayern Amtsgericht München HRB 173995\nEinreichung neuer Dokumente\n\nPartnerFonds AG\nAktiengesellschaft\nPlanegg\n\nDem Amtsgericht München -Registergericht- ist eine Liste der Mitglieder des Aufsichtsrats eingereicht worden, § 106 AktG."
    },
    {
      "date": "2026-01-22",
      "id": "143137",
      "original_text": "Registerbekanntmachung nach dem Umwandlungsgesetz\nBayern Amtsgericht Traunstein HRA 15280\nAmbulanter Pflegedienst Toballa e.K. – Trostberg",
      "type": "Registerbekanntmachung nach dem Umwandlungsgesetz",
      "state": "Bayern",
      "amtsgericht": "Amtsgericht Traunstein",
      "registernummer": "HRA 15280",
      "registerart": "HRA",
      "company_name": "Ambulanter Pflegedienst Toballa e.K.",
      "company_seat": "Trostberg",
      "details": "22.01.2026 (Bekanntmachungsdatum)\n\nBayern Amtsgericht Traunstein HRA 15280\nRegisterbekanntmachung nach dem Umwandlungsgesetz 21.01.2026 (Eintragungsdatum)\n\nAmbulanter Pflegedienst Toballa e.K.\nEinzelkaufmann / Einzelkauffrau\nTrostberg\n\nDen Gläubigern der an der Ausgliederung beteiligten Rechtsträger ist, wenn sie binnen sechs Monaten nach dem Tag, an dem die Eintragung der Ausgliederung in das Register des Sitzes desjenigen Rechtsträgers, dessen Gläubiger sie sind, nach §§ 125, 19 Abs. 3 UmwG als bekannt gemacht gilt, ihren Anspruch nach Grund und Höhe in Textform anmelden, Sicherheit zu leisten, soweit sie nicht Befriedigung verlangen können. Dieses Recht steht den Gläubigern jedoch nur zu, wenn sie glaubhaft machen, dass durch die Ausgliederung die Erfüllung ihrer Forderung gefährdet wird."
    },
    {
      "date": "2026-01-22",
      "id": "143138",
      "original_text": "Registerbekanntmachung nach dem Umwandlungsgesetz\nBayern Amtsgericht Augsburg HRB 38787\nu. m. e. b. i. Verwaltungs GmbH – Augsburg",
      "type": "Registerbekanntmachung nach dem Umwandlungsgesetz",
      "state": "Bayern",
      "amtsgericht": "Amtsgericht Augsburg",
      "registernummer": "HRB 38787",
      "registerart": "HRB",
      "company_name": "u. m. e. b. i. Verwaltungs GmbH",
      "company_seat": "Augsburg",
      "details": "22.01.2026 (Bekanntmachungsdatum)\n\nBayern Amtsgericht Augsburg HRB 38787\nRegisterbekanntmachung nach dem Umwandlungsgesetz 21.01.2026 (Eintragungsdatum)\n\nu. m. e. b. i. Verwaltungs GmbH\nGesellschaft mit beschränkter Haftung\nAugsburg\n\nDen Gläubigern der an der Verschmelzung beteiligten Rechtsträger ist, wenn sie binnen sechs Monaten nach dem Tag, an dem die Eintragung der Verschmelzung in das Register des Sitzes desjenigen Rechtsträgers, dessen Gläubiger sie sind, nach § 19 Abs. 3 UmwG als bekannt gemacht gilt, ihren Anspruch nach Grund und Höhe in Textform anmelden, Sicherheit zu leisten, soweit sie nicht Befriedigung verlangen können. Dieses Recht steht den Gläubigern jedoch nur zu, wenn sie glaubhaft machen, dass durch die Verschmelzung die Erfüllung ihrer Forderung gefährdet wird."
    },
    {
      "date": "2026-01-22",
      "id": "143139",
      "original_text": "Registerbekanntmachung nach dem Umwandlungsgesetz\nBayern Amtsgericht München HRB 226330\nPHÖNIX - Haus Roggenberg - Pflegeheim GmbH – München",
      "type": "Registerbekanntmachung nach dem Umwandlungsgesetz",
      "state": "Bayern",
      "amtsgericht": "Amtsgericht München",
      "registernummer": "HRB 226330",
      "registerart": "HRB",
      "company_name": "PHÖNIX - Haus Roggenberg - Pflegeheim GmbH",
      "company_seat": "München",
      "details": "22.01.2026 (Bekanntmachungsdatum)\n\nBayern Amtsgericht München HRB 226330\nRegisterbekanntmachung nach dem Umwandlungsgesetz 21.01.2026 (Eintragungsdatum)\n\nPHÖNIX - Haus Roggenberg - Pflegeheim GmbH\nGesellschaft mit beschränkter Haftung\nMünchen\n\nDen Gläubigern der an der Verschmelzung beteiligten Rechtsträger ist, wenn sie binnen sechs Monaten nach dem Tag, an dem die Eintragung der Verschmelzung in das Register des Sitzes desjenigen Rechtsträgers, dessen Gläubiger sie sind, nach § 19 Abs. 3 UmwG als bekannt gemacht gilt, ihren Anspruch nach Grund und Höhe in Textform anmelden, Sicherheit zu leisten, soweit sie nicht Befriedigung verlangen können. Dieses Recht steht den Gläubigern jedoch nur zu, wenn sie glaubhaft machen, dass durch die Verschmelzung die Erfüllung ihrer Forderung gefährdet wird."
    },
    {
      "date": "2026-01-22",
      "id": "143140",
      "original_text": "Löschungsankündigung\nBayern Amtsgericht Traunstein HRB 31041\nEuropaBooking GmbH – Bernau a.Chiemsee",
      "type": "Löschungsankündigung",
      "state": "Bayern",
      "amtsgericht": "Amtsgericht Traunstein",
      "registernummer": "HRB 31041",
      "registerart": "HRB",
      "company_name": "EuropaBooking GmbH",
      "company_seat": "Bernau a.Chiemsee",
      "details": "22.01.2026 (Bekanntmachungsdatum)\n\nBayern Amtsgericht Traunstein HRB 31041\nLöschungsankündigung 21.01.2026 (Eintragungsdatum)\n\nEuropaBooking GmbH\nGesellschaft mit beschränkter Haftung\nBernau a.Chiemsee\n\nDas Registergericht beabsichtigt, die im Handelsregister eingetragene Gesellschaft wegen Vermögenslosigkeit von Amts wegen nach § 394 FamFG zu löschen. Die Frist zur Erhebung eines Widerspruchs ist auf einen Monat festgesetzt."
    },
    {
      "date": "2026-01-22",
      "id": "143141",
      "original_text": "Sonstige Registerbekanntmachung\nBayern Amtsgericht Würzburg HRB 15494\ncf Fitness Metzingen GmbH – Waldbrunn",
      "type": "Sonstige Registerbekanntmachung",
      "state": "Bayern",
      "amtsgericht": "Amtsgericht Würzburg",
      "registernummer": "HRB 15494",
      "registerart": "HRB",
      "company_name": "cf Fitness Metzingen GmbH",
      "company_seat": "Waldbrunn",
      "details": "22.01.2026 (Bekanntmachungsdatum)\n\nBayern Amtsgericht Würzburg HRB 15494\nSonstige Registerbekanntmachung 21.01.2026 (Eintragungsdatum)\n\ncf Fitness Metzingen GmbH\nGesellschaft mit beschränkter Haftung\nWaldbrunn\n\nDen Gläubigern der Gesellschaft, deren Forderungen begründet worden sind, bevor die Eintragung der Beendigung des Beherrschungs- und Gewinnabführungsvertrages in das Handelsregister nach § 10 des Handelsgesetzbuches als bekanntgemacht gilt, hat der andere Vertragsteil Sicherheit zu leisten, wenn sie sich binnen sechs Monaten nach der Bekanntmachung der Eintragung zu diesem Zweck bei ihm melden."
    },
    {
      "date": "2026-01-22",
      "id": "143142",
      "original_text": "Löschungsankündigung\nBayern Amtsgericht Augsburg HRB 856\nKaspar Kommunikationsanlagen Vertriebs GmbH – Monheim",
      "type": "Löschungsankündigung",
      "state": "Bayern",
      "amtsgericht": "Amtsgericht Augsburg",
      "registernummer": "HRB 856",
      "registerart": "HRB",
      "company_name": "Kaspar Kommunikationsanlagen Vertriebs GmbH",
      "company_seat": "Monheim",
      "details": "22.01.2026 (Bekanntmachungsdatum)\n\nBayern Amtsgericht Augsburg HRB 856\nLöschungsankündigung\n\nKaspar Kommunikationsanlagen Vertriebs GmbH\nGesellschaft mit beschränkter Haftung\nMonheim\n\nDas Registergericht beabsichtigt, die im Handelsregister eingetragene Gesellschaft wegen Vermögenslosigkeit von Amts wegen nach § 394 FamFG zu löschen. Die Frist zur Erhebung eines Widerspruchs ist auf einen Monat festgesetzt."
    },
    {
      "date": "2026-01-22",
      "id": "143143",
      "original_text": "Einreichung neuer Dokumente\nBayern Amtsgericht Nürnberg HRB 23037\nEXASOL AG – Nürnberg",
      "type": "Einreichung neuer Dokumente",
      "state": "Bayern",
      "amtsgericht": "Amtsgericht Nürnberg",
      "registernummer": "HRB 23037",
      "registerart": "HRB",
      "company_name": "EXASOL AG",
      "company_seat": "Nürnberg",
      "details": "22.01.2026 (Bekanntmachungsdatum)\n\nBayern Amtsgericht Nürnberg HRB 23037\nEinreichung neuer Dokumente\n\nEXASOL AG\nAktiengesellschaft\nNürnberg\n\nDem Amtsgericht Nürnberg -Registergericht- ist eine Liste der Mitglieder des Aufsichtsrats eingereicht worden, § 106 AktG."
    },
    {
      "date": "2026-01-22",
      "id": "143144",
      "original_text": "Sonstige Registerbekanntmachung\nBayern Amtsgericht Bayreuth HRB 5958\nArtus Holding GmbH – Bayreuth",
      "type": "Sonstige Registerbekanntmachung",
      "state": "Bayern",
      "amtsgericht": "Amtsgericht Bayreuth",
      "registernummer": "HRB 5958",
      "registerart": "HRB",
      "company_name": "Artus Holding GmbH",
      "company_seat": "Bayreuth",
      "details": "22.01.2026 (Bekanntmachungsdatum)\n\nBayern Amtsgericht Bayreuth HRB 5958\nSonstige Registerbekanntmachung 21.01.2026 (Eintragungsdatum)\n\nArtus Holding GmbH\nGesellschaft mit beschränkter Haftung\nBayreuth\n\nDen Gläubigern des formwechselnden Rechtsträgers ist, wenn sie binnen sechs Monaten nach dem Tag, an dem die Eintragung des Formwechsels nach § 201 UmwG als bekannt gemacht gilt, ihren Anspruch nach Grund und Höhe in Textform anmelden, Sicherheit zu leisten, soweit sie nicht Befriedigung verlangen können. Dieses Recht steht den Gläubigern jedoch nur zu, wenn sie glaubhaft machen, dass durch den Formwechsel die Erfüllung ihrer Forderung gefährdet wird."
    },
    {
      "date": "2026-01-22",
      "id": "143145",
      "original_text": "Registerbekanntmachung nach dem Umwandlungsgesetz\nBayern Amtsgericht München HRB 273959\nLEPAYA GERMANY GmbH – München",
      "type": "Registerbekanntmachung nach dem Umwandlungsgesetz",
      "state": "Bayern",
      "amtsgericht": "Amtsgericht München",
      "registernummer": "HRB 273959",
      "registerart": "HRB",
      "company_name": "LEPAYA GERMANY GmbH",
      "company_seat": "München",
      "details": "22.01.2026 (Bekanntmachungsdatum)\n\nBayern Amtsgericht München HRB 273959\nRegisterbekanntmachung nach dem Umwandlungsgesetz 21.01.2026 (Eintragungsdatum)\n\nLEPAYA GERMANY GmbH\nGesellschaft mit beschränkter Haftung\nMünchen\n\nDen Gläubigern der an der Verschmelzung beteiligten Rechtsträger ist, wenn sie binnen sechs Monaten nach dem Tag, an dem die Eintragung der Verschmelzung in das Register des Sitzes desjenigen Rechtsträgers, dessen Gläubiger sie sind, nach § 19 Abs. 3 UmwG als bekannt gemacht gilt, ihren Anspruch nach Grund und Höhe in Textform anmelden, Sicherheit zu leisten, soweit sie nicht Befriedigung verlangen können. Dieses Recht steht den Gläubigern jedoch nur zu, wenn sie glaubhaft machen, dass durch die Verschmelzung die Erfüllung ihrer Forderung gefährdet wird."
    },
    {
      "date": "2026-01-22",
      "id": "143146",
      "original_text": "Registerbekanntmachung nach dem Umwandlungsgesetz\nBayern Amtsgericht Traunstein HRB 22231\nTB Polling UG (haftungsbeschränkt) – Polling",
      "type": "Registerbekanntmachung nach dem Umwandlungsgesetz",
      "state": "Bayern",
      "amtsgericht": "Amtsgericht Traunstein",
      "registernummer": "HRB 22231",
      "registerart": "HRB",
      "company_name": "TB Polling UG (haftungsbeschränkt)",
      "company_seat": "Polling",
      "details": "22.01.2026 (Bekanntmachungsdatum)\n\nBayern Amtsgericht Traunstein HRB 22231\nRegisterbekanntmachung nach dem Umwandlungsgesetz 21.01.2026 (Eintragungsdatum)\n\nTB Polling UG (haftungsbeschränkt)\nGesellschaft mit beschränkter Haftung\nPolling\n\nDen Gläubigern der an der Verschmelzung beteiligten Rechtsträger ist, wenn sie binnen sechs Monaten nach dem Tag, an dem die Eintragung der Verschmelzung in das Register des Sitzes desjenigen Rechtsträgers, dessen Gläubiger sie sind, nach § 19 Abs. 3 UmwG als bekannt gemacht gilt, ihren Anspruch nach Grund und Höhe in Textform anmelden, Sicherheit zu leisten, soweit sie nicht Befriedigung verlangen können. Dieses Recht steht den Gläubigern jedoch nur zu, wenn sie glaubhaft machen, dass durch die Verschmelzung die Erfüllung ihrer Forderung gefährdet wird."
    },
    {
      "date": "2026-01-22",
      "id": "143147",
      "original_text": "Sonstige Registerbekanntmachung\nBayern Amtsgericht Würzburg HRB 16043\nMyo GmbH – Waldbrunn",
      "type": "Sonstige Registerbekanntmachung",
      "state": "Bayern",
      "amtsgericht": "Amtsgericht Würzburg",
      "registernummer": "HRB 16043",
      "registerart": "HRB",
      "company_name": "Myo GmbH",
      "company_seat": "Waldbrunn",
      "details": "22.01.2026 (Bekanntmachungsdatum)\n\nBayern Amtsgericht Würzburg HRB 16043\nSonstige Registerbekanntmachung 21.01.2026 (Eintragungsdatum)\n\nMyo GmbH\nGesellschaft mit beschränkter Haftung\nWaldbrunn\n\nDen Gläubigern der Gesellschaft, deren Forderungen begründet worden sind, bevor die Eintragung der Beendigung des Beherrschungs- und Gewinnabführungsvertrages in das Handelsregister nach § 10 des Handelsgesetzbuches als bekanntgemacht gilt, hat der andere Vertragsteil Sicherheit zu leisten, wenn sie sich binnen sechs Monaten nach der Bekanntmachung der Eintragung zu diesem Zweck bei ihm melden."
    },
    {
      "date": "2026-01-22",
      "id": "143148",
      "original_text": "Registerbekanntmachung nach dem Umwandlungsgesetz\nBayern Amtsgericht Nürnberg HRB 12093\nHans Eichinger Verwaltungs GmbH – Berching",
      "type": "Registerbekanntmachung nach dem Umwandlungsgesetz",
      "state": "Bayern",
      "amtsgericht": "Amtsgericht Nürnberg",
      "registernummer": "HRB 12093",
      "registerart": "HRB",
      "company_name": "Hans Eichinger Verwaltungs GmbH",
      "company_seat": "Berching",
      "details": "22.01.2026 (Bekanntmachungsdatum)\n\nBayern Amtsgericht Nürnberg HRB 12093\nRegisterbekanntmachung nach dem Umwandlungsgesetz 21.01.2026 (Eintragungsdatum)\n\nHans Eichinger Verwaltungs GmbH\nGesellschaft mit beschränkter Haftung\nBerching\n\nDen Gläubigern der an der Spaltung beteiligten Rechtsträger ist, wenn sie binnen sechs Monaten nach dem Tag, an dem die Eintragung der Spaltung in das Register des Sitzes desjenigen Rechtsträgers, dessen Gläubiger sie sind, nach §§ 125, 19 Abs. 3 UmwG als bekannt gemacht gilt, ihren Anspruch nach Grund und Höhe in Textform anmelden, Sicherheit zu leisten, soweit sie nicht Befriedigung verlangen können. Dieses Recht steht den Gläubigern jedoch nur zu, wenn sie glaubhaft machen, dass durch die Spaltung die Erfüllung ihrer Forderung gefährdet wird."
    },
    {
      "date": "2026-01-22",
      "id": "143149",
      "original_text": "Registerbekanntmachung nach dem Umwandlungsgesetz\nBayern Amtsgericht Traunstein HRB 34777\nMane's GmbH – Polling",
      "type": "Registerbekanntmachung nach dem Umwandlungsgesetz",
      "state": "Bayern",
      "amtsgericht": "Amtsgericht Traunstein",
      "registernummer": "HRB 34777",
      "registerart": "HRB",
      "company_name": "Mane's GmbH",
      "company_seat": "Polling",
      "details": "22.01.2026 (Bekanntmachungsdatum)\n\nBayern Amtsgericht Traunstein HRB 34777\nRegisterbekanntmachung nach dem Umwandlungsgesetz 21.01.2026 (Eintragungsdatum)\n\nMane's GmbH\nGesellschaft mit beschränkter Haftung\nPolling\n\nDen Gläubigern der an der Verschmelzung beteiligten Rechtsträger ist, wenn sie binnen sechs Monaten nach dem Tag, an dem die Eintragung der Verschmelzung in das Register des Sitzes desjenigen Rechtsträgers, dessen Gläubiger sie sind, nach § 19 Abs. 3 UmwG als bekannt gemacht gilt, ihren Anspruch nach Grund und Höhe in Textform anmelden, Sicherheit zu leisten, soweit sie nicht Befriedigung verlangen können. Dieses Recht steht den Gläubigern jedoch nur zu, wenn sie glaubhaft machen, dass durch die Verschmelzung die Erfüllung ihrer Forderung gefährdet wird."
    },
    {
      "date": "2026-01-22",
      "id": "143150",
      "original_text": "Einreichung neuer Dokumente\nBayern Amtsgericht Augsburg HRB 24461\nEnergy Life AG – Augsburg",
      "type": "Einreichung neuer Dokumente",
      "state": "Bayern",
      "amtsgericht": "Amtsgericht Augsburg",
      "registernummer": "HRB 24461",
      "registerart": "HRB",
      "company_name": "Energy Life AG",
      "company_seat": "Augsburg",
      "details": "22.01.2026 (Bekanntmachungsdatum)\n\nBayern Amtsgericht Augsburg HRB 24461\nEinreichung neuer Dokumente\n\nEnergy Life AG\nAktiengesellschaft\nAugsburg\n\nDem Amtsgericht Augsburg -Registergericht- ist eine Liste der Mitglieder des Aufsichtsrats eingereicht worden, § 106 AktG."
    },
    {
      "date": "2026-01-22",
      "id": "143151",
      "original_text": "Registerbekanntmachung nach dem Umwandlungsgesetz\nBayern Amtsgericht München HRB 178502\nB&S 2008 Private Equity GmbH – München",
      "type": "Registerbekanntmachung nach dem Umwandlungsgesetz",
      "state": "Bayern",
      "amtsgericht": "Amtsgericht München",
      "registernummer": "HRB 178502",
      "registerart": "HRB",
      "company_name": "B&S 2008 Private Equity GmbH",
      "company_seat": "München",
      "details": "22.01.2026 (Bekanntmachungsdatum)\n\nBayern Amtsgericht München HRB 178502\nRegisterbekanntmachung nach dem Umwandlungsgesetz 21.01.2026 (Eintragungsdatum)\n\nB&S 2008 Private Equity GmbH\nGesellschaft mit beschränkter Haftung\nMünchen\n\nDen Gläubigern der an der Verschmelzung beteiligten Rechtsträger ist, wenn sie binnen sechs Monaten nach dem Tag, an dem die Eintragung der Verschmelzung in das Register des Sitzes desjenigen Rechtsträgers, dessen Gläubiger sie sind, nach § 19 Abs. 3 UmwG als bekannt gemacht gilt, ihren Anspruch nach Grund und Höhe in Textform anmelden, Sicherheit zu leisten, soweit sie nicht Befriedigung verlangen können. Dieses Recht steht den Gläubigern jedoch nur zu, wenn sie glaubhaft machen, dass durch die Verschmelzung die Erfüllung ihrer Forderung gefährdet wird."
    },
    {
      "date": "2026-01-22",
      "id": "143152",
      "original_text": "Registerbekanntmachung nach dem Umwandlungsgesetz\nBayern Amtsgericht München HRB 267399\nindevis IT-Security Holding GmbH – München",
      "type": "Registerbekanntmachung nach dem Umwandlungsgesetz",
      "state": "Bayern",
      "amtsgericht": "Amtsgericht München",
      "registernummer": "HRB 267399",
      "registerart": "HRB",
      "company_name": "indevis IT-Security Holding GmbH",
      "company_seat": "München",
      "details": "22.01.2026 (Bekanntmachungsdatum)\n\nBayern Amtsgericht München HRB 267399\nRegisterbekanntmachung nach dem Umwandlungsgesetz 21.01.2026 (Eintragungsdatum)\n\nindevis IT-Security Holding GmbH\nGesellschaft mit beschränkter Haftung\nMünchen\n\nDen Gläubigern der an der Verschmelzung beteiligten Rechtsträger ist, wenn sie binnen sechs Monaten nach dem Tag, an dem die Eintragung der Verschmelzung in das Register des Sitzes desjenigen Rechtsträgers, dessen Gläubiger sie sind, nach § 19 Abs. 3 UmwG als bekannt gemacht gilt, ihren Anspruch nach Grund und Höhe in Textform anmelden, Sicherheit zu leisten, soweit sie nicht Befriedigung verlangen können. Dieses Recht steht den Gläubigern jedoch nur zu, wenn sie glaubhaft machen, dass durch die Verschmelzung die Erfüllung ihrer Forderung gefährdet wird."
    },
    {
      "date": "2026-01-22",
      "id": "143153",
      "original_text": "Registerbekanntmachung nach dem Umwandlungsgesetz\nBayern Amtsgericht Nürnberg HRB 33439\nLände FE GmbH – Mühlhausen",
      "type": "Registerbekanntmachung nach dem Umwandlungsgesetz",
      "state": "Bayern",
      "amtsgericht": "Amtsgericht Nürnberg",
      "registernummer": "HRB 33439",
      "registerart": "HRB",
      "company_name": "Lände FE GmbH",
      "company_seat": "Mühlhausen",
      "details": "22.01.2026 (Bekanntmachungsdatum)\n\nBayern Amtsgericht Nürnberg HRB 33439\nRegisterbekanntmachung nach dem Umwandlungsgesetz 21.01.2026 (Eintragungsdatum)\n\nLände FE GmbH\nGesellschaft mit beschränkter Haftung\nMühlhausen\n\nDen Gläubigern der an der Spaltung beteiligten Rechtsträger ist, wenn sie binnen sechs Monaten nach dem Tag, an dem die Eintragung der Spaltung in das Register des Sitzes desjenigen Rechtsträgers, dessen Gläubiger sie sind, nach §§ 125, 19 Abs. 3 UmwG als bekannt gemacht gilt, ihren Anspruch nach Grund und Höhe in Textform anmelden, Sicherheit zu leisten, soweit sie nicht Befriedigung verlangen können. Dieses Recht steht den Gläubigern jedoch nur zu, wenn sie glaubhaft machen, dass durch die Spaltung die Erfüllung ihrer Forderung gefährdet wird."
    },
    {
      "date": "2026-01-22",
      "id": "143154",
      "original_text": "Einreichung neuer Dokumente\nBayern Amtsgericht Augsburg HRB 22056\nEverllence SE – Augsburg",
      "type": "Einreichung neuer Dokumente",
      "state": "Bayern",
      "amtsgericht": "Amtsgericht Augsburg",
      "registernummer": "HRB 22056",
      "registerart": "HRB",
      "company_name": "Everllence SE",
      "company_seat": "Augsburg",
      "details": "22.01.2026 (Bekanntmachungsdatum)\n\nBayern Amtsgericht Augsburg HRB 22056\nEinreichung neuer Dokumente\n\nEverllence SE\nEuropäische Aktiengesellschaft (SE)\nAugsburg\n\nDem Amtsgericht Augsburg -Registergericht- ist eine Liste der Mitglieder des Aufsichtsrats eingereicht worden, Art. 9 Abs. 1 Buchst. c (ii) SE-VO i.V.m. § 106 AktG."
    },
    {
      "date": "2026-01-22",
      "id": "143155",
      "original_text": "Löschungsankündigung\nBayern Amtsgericht Coburg HRA 5279\nNECO Bau GmbH & Co. KG – Marktzeuln",
      "type": "Löschungsankündigung",
      "state": "Bayern",
      "amtsgericht": "Amtsgericht Coburg",
      "registernummer": "HRA 5279",
      "registerart": "HRA",
      "company_name": "NECO Bau GmbH & Co. KG",
      "company_seat": "Marktzeuln",
      "details": "22.01.2026 (Bekanntmachungsdatum)\n\nBayern Amtsgericht Coburg HRA 5279\nLöschungsankündigung 21.01.2026 (Eintragungsdatum)\n\nNECO Bau GmbH & Co. KG\nKommanditgesellschaft\nMarktzeuln\n\nDas Registergericht beabsichtigt, die im Handelsregister eingetragene Firma wegen Vermögenslosigkeit von Amts wegen nach § 394 FamFG zu löschen. Die Frist zur Erhebung eines Widerspruchs ist auf sechs Wochen festgesetzt."
    },
    {
      "date": "2026-01-22",
      "id": "143156",
      "original_text": "Löschungsankündigung\nBayern Amtsgericht Coburg HRA 5280\nNECO BauWi GmbH & Co. KG – Marktzeuln",
      "type": "Löschungsankündigung",
      "state": "Bayern",
      "amtsgericht": "Amtsgericht Coburg",
      "registernummer": "HRA 5280",
      "registerart": "HRA",
      "company_name": "NECO BauWi GmbH & Co. KG",
      "company_seat": "Marktzeuln",
      "details": "22.01.2026 (Bekanntmachungsdatum)\n\nBayern Amtsgericht Coburg HRA 5280\nLöschungsankündigung 21.01.2026 (Eintragungsdatum)\n\nNECO BauWi GmbH & Co. KG\nKommanditgesellschaft\nMarktzeuln\n\nDas Registergericht beabsichtigt, die im Handelsregister eingetragene Firma wegen Vermögenslosigkeit von Amts wegen nach § 394 FamFG zu löschen. Die Frist zur Erhebung eines Widerspruchs ist auf sechs Wochen festgesetzt."
    },
    {
      "date": "2026-01-22",
      "id": "143157",
      "original_text": "Registerbekanntmachung nach dem Umwandlungsgesetz\nMecklenburg-Vorpommern Amtsgericht Neubrandenburg HRB 22361\nWG Klein Vielen Betreuungsgesellschaft mbH – Penzlin",
      "type": "Registerbekanntmachung nach dem Umwandlungsgesetz",
      "state": "Mecklenburg-Vorpommern",
      "amtsgericht": "Amtsgericht Neubrandenburg",
      "registernummer": "HRB 22361",
      "registerart": "HRB",
      "company_name": "WG Klein Vielen Betreuungsgesellschaft mbH",
      "company_seat": "Penzlin",
      "details": "22.01.2026 (Bekanntmachungsdatum)\n\nMecklenburg-Vorpommern Amtsgericht Neubrandenburg HRB 22361\nRegisterbekanntmachung nach dem Umwandlungsgesetz 22.01.2026 (Eintragungsdatum)\n\nWG Klein Vielen Betreuungsgesellschaft mbH\nGesellschaft mit beschränkter Haftung\nPenzlin\n\nAls nicht eingetragen wird veröffentlicht: Den Gläubigern der an der Ausgliederung beteiligten Rechtsträger ist, wenn sie binnen sechs Monaten nach dem Tag, an dem die Eintragung der Ausgliederung in das Register des Sitzes desjenigen Rechtsträgers, dessen Gläubiger sie sind, nach § 19 Abs. 3 UmwG als bekannt gemacht gilt, ihren Anspruch nach Grund und Höhe in Textform anmelden,\nSicherheit zu leisten, soweit sie nicht Befriedigung verlangen können. Dieses Recht steht den Gläubigern jedoch nur zu, wenn sie glaubhaft machen, dass durch die Ausgliederung die Erfüllung der Forderung gefährdet wird."
    },
    {
      "date": "2026-01-22",
      "id": "143158",
      "original_text": "Löschungsankündigung\nBerlin Amtsgericht Berlin (Charlottenburg) HRB 118002\nFrau Schneider GmbH – Berlin",
      "type": "Löschungsankündigung",
      "state": "Berlin",
      "amtsgericht": "Amtsgericht Berlin (Charlottenburg)",
      "registernummer": "HRB 118002",
      "registerart": "HRB",
      "company_name": "Frau Schneider GmbH",
      "company_seat": "Berlin",
      "details": "22.01.2026 (Bekanntmachungsdatum)\n\nBerlin Amtsgericht Berlin (Charlottenburg) HRB 118002\nLöschungsankündigung\n\nFrau Schneider GmbH\nGesellschaft mit beschränkter Haftung\nBerlin\n\nBei der nachstehenden Gesellschaft wird das Amtslöschungsverfahren gemäß § 394 FamFG eingeleitet. Widerspruchsfrist 6 Wochen"
    },
    {
      "date": "2026-01-22",
      "id": "143159",
      "original_text": "Löschungsankündigung\nSaarland Amtsgericht Saarbrücken HRA 12309\nTorsten Zimmer e.K. – Saarbrücken",
      "type": "Löschungsankündigung",
      "state": "Saarland",
      "amtsgericht": "Amtsgericht Saarbrücken",
      "registernummer": "HRA 12309",
      "registerart": "HRA",
      "company_name": "Torsten Zimmer e.K.",
      "company_seat": "Saarbrücken",
      "details": "22.01.2026 (Bekanntmachungsdatum)\n\nSaarland Amtsgericht Saarbrücken HRA 12309\nLöschungsankündigung\n\nTorsten Zimmer e.K.\nEinzelkaufmann / Einzelkauffrau\nSaarbrücken\n\nEs ist beabsichtigt die Firma von Amts wegen gemäß § 31 Abs 2 HGB zu löschen. Frist für den Widerspruch: 2 Monate."
    },
    {
      "date": "2026-01-22",
      "id": "143160",
      "original_text": "Sonstige Registerbekanntmachung\nBerlin Amtsgericht Berlin (Charlottenburg) HRB 219252\nHanfgeflüster GmbH – Berlin",
      "type": "Sonstige Registerbekanntmachung",
      "state": "Berlin",
      "amtsgericht": "Amtsgericht Berlin (Charlottenburg)",
      "registernummer": "HRB 219252",
      "registerart": "HRB",
      "company_name": "Hanfgeflüster GmbH",
      "company_seat": "Berlin",
      "details": "22.01.2026 (Bekanntmachungsdatum)\n\nBerlin Amtsgericht Berlin (Charlottenburg) HRB 219252\nSonstige Registerbekanntmachung\n\nHanfgeflüster GmbH\nGesellschaft mit beschränkter Haftung\nBerlin\n\nAls nicht eingetragen wird veröffentlicht: Der andere Vertragsteil hat den Gläubigern dieses Rechtsträgers, deren Forderungen begründet worden sind, bevor die Eintragung der Beendigung dieses Vertrages in das Handelsregister nach § 10 des Handelsgesetzbuches als bekannt gemacht gilt, Sicherheit zu leisten, wenn sie sich binnen sechs Monaten nach der Bekanntmachung der Eintragung zu diesem Zweck bei ihm melden. Dieses Recht steht den Gläubigern nicht zu, die im Fall des Insolvenzverfahrens ein Recht auf vorzugsweise Befriedigung aus der Deckungsmasse haben, die nach gesetzlicher Vorschrift zu ihrem Schutz errichtet und staatlich überwacht ist."
    },
    {
      "date": "2026-01-22",
      "id": "143161",
      "original_text": "Löschungsankündigung\nBerlin Amtsgericht Berlin (Charlottenburg) HRB 221491\nFAGA Drive GmbH – Berlin",
      "type": "Löschungsankündigung",
      "state": "Berlin",
      "amtsgericht": "Amtsgericht Berlin (Charlottenburg)",
      "registernummer": "HRB 221491",
      "registerart": "HRB",
      "company_name": "FAGA Drive GmbH",
      "company_seat": "Berlin",
      "details": "22.01.2026 (Bekanntmachungsdatum)\n\nBerlin Amtsgericht Berlin (Charlottenburg) HRB 221491\nLöschungsankündigung\n\nFAGA Drive GmbH\nGesellschaft mit beschränkter Haftung\nBerlin\n\nBei der nachstehenden Gesellschaft wird das Amtslöschungsverfahren gemäß § 394 FamFG eingeleitet. Widerspruchsfrist 6 Wochen"
    },
    {
      "date": "2026-01-22",
      "id": "143162",
      "original_text": "Löschungsankündigung\nBerlin Amtsgericht Berlin (Charlottenburg) HRB 118158\nPROSECUS Sicherheit GmbH – Berlin",
      "type": "Löschungsankündigung",
      "state": "Berlin",
      "amtsgericht": "Amtsgericht Berlin (Charlottenburg)",
      "registernummer": "HRB 118158",
      "registerart": "HRB",
      "company_name": "PROSECUS Sicherheit GmbH",
      "company_seat": "Berlin",
      "details": "22.01.2026 (Bekanntmachungsdatum)\n\nBerlin Amtsgericht Berlin (Charlottenburg) HRB 118158\nLöschungsankündigung\n\nPROSECUS Sicherheit GmbH\nGesellschaft mit beschränkter Haftung\nBerlin\n\nBei der nachstehenden Gesellschaft wird das Amtslöschungsverfahren gemäß § 394 FamFG eingeleitet. Widerspruchsfrist 6 Wochen"
    },
    {
      "date": "2026-01-22",
      "id": "143163",
      "original_text": "Sonstige Registerbekanntmachung\nHamburg Amtsgericht Hamburg HRB 120708\nCF Coffee Friends GmbH – Hamburg",
      "type": "Sonstige Registerbekanntmachung",
      "state": "Hamburg",
      "amtsgericht": "Amtsgericht Hamburg",
      "registernummer": "HRB 120708",
      "registerart": "HRB",
      "company_name": "CF Coffee Friends GmbH",
      "company_seat": "Hamburg",
      "details": "22.01.2026 (Bekanntmachungsdatum)\n\nHamburg Amtsgericht Hamburg HRB 120708\nSonstige Registerbekanntmachung 22.01.2026 (Eintragungsdatum)\n\nCF Coffee Friends GmbH\nGesellschaft mit beschränkter Haftung\nHamburg\n\nAls nicht eingetragen wird bekannt gemacht:  Den Gläubigern der Gesellschaft, deren Forderungen begründet worden sind, bevor die Eintragung der Vertragsbeendigung in das Handelsregister nach § 10 HGB als bekannt gemacht gilt, ist vom anderen Vertragsteil Sicherheit zu leisten, wenn sie sich binnen 6 Monaten nach Bekanntmachung der Eintragung zu diesem Zweck bei ihm melden."
    },
    {
      "date": "2026-01-22",
      "id": "143164",
      "original_text": "Löschungsankündigung\nBaden-Württemberg Amtsgericht Stuttgart HRB 780694\nMIXULAD-CONSTRUCT UG (haftungsbeschränkt) – Nürtingen",
      "type": "Löschungsankündigung",
      "state": "Baden-Württemberg",
      "amtsgericht": "Amtsgericht Stuttgart",
      "registernummer": "HRB 780694",
      "registerart": "HRB",
      "company_name": "MIXULAD-CONSTRUCT UG (haftungsbeschränkt)",
      "company_seat": "Nürtingen",
      "details": "22.01.2026 (Bekanntmachungsdatum)\n\nBaden-Württemberg Amtsgericht Stuttgart HRB 780694\nLöschungsankündigung\n\nMIXULAD-CONSTRUCT UG (haftungsbeschränkt)\nGesellschaft mit beschränkter Haftung\nNürtingen\n\nAls nicht eingetragen wird bekanntgemacht:\nDas Gericht beabsichtigt, die Gesellschaft wegen Vermögenslosigkeit im Handelsregister von Amts wegen nach § 394 FamFG zu löschen. Die Frist zur Geltendmachung eines Widerspruchs gegen die beabsichtigte Löschung ist auf zwei Monate ab Veröffentlichung bestimmt."
    },
    {
      "date": "2026-01-22",
      "id": "143165",
      "original_text": "Sonstige Registerbekanntmachung\nSaarland Amtsgericht Saarbrücken HRB 26053\nStahlwerk Bous GmbH – Bous",
      "type": "Sonstige Registerbekanntmachung",
      "state": "Saarland",
      "amtsgericht": "Amtsgericht Saarbrücken",
      "registernummer": "HRB 26053",
      "registerart": "HRB",
      "company_name": "Stahlwerk Bous GmbH",
      "company_seat": "Bous",
      "details": "22.01.2026 (Bekanntmachungsdatum)\n\nSaarland Amtsgericht Saarbrücken HRB 26053\nSonstige Registerbekanntmachung 22.01.2026 (Eintragungsdatum)\n\nStahlwerk Bous GmbH\nGesellschaft mit beschränkter Haftung\nBous\n\nDer mit der GMH Gruppe SE & Co. KG mit Sitz in Georgsmarienhütte (Amtsgericht Osnabrück HRA 209802) am 29.10.2009 abgeschlossene und am 03.12.2014 geänderte Gewinnabführungsvertrag ist durch Kündigung zum 31.12. 2025 beendet. Den Gläubigern der Gesellschaft, deren Forderungen begründet worden sind, bevor die Eintragung der Beendigung des Vertrages in das Handelsregister nach § 10 des Handelsgesetzbuches als bekanntgemacht gilt, hat der andere Vertragsteil Sicherheit zu leisten, wenn sie sich binnen sechs Monaten nach der Bekanntmachung der Eintragung zu diesem Zweck bei ihm melden."
    },
    {
      "date": "2026-01-22",
      "id": "143166",
      "original_text": "Löschungsankündigung\nBerlin Amtsgericht Berlin (Charlottenburg) HRB 258176\nTopi Taxi GmbH – Berlin",
      "type": "Löschungsankündigung",
      "state": "Berlin",
      "amtsgericht": "Amtsgericht Berlin (Charlottenburg)",
      "registernummer": "HRB 258176",
      "registerart": "HRB",
      "company_name": "Topi Taxi GmbH",
      "company_seat": "Berlin",
      "details": "22.01.2026 (Bekanntmachungsdatum)\n\nBerlin Amtsgericht Berlin (Charlottenburg) HRB 258176\nLöschungsankündigung\n\nTopi Taxi GmbH\nGesellschaft mit beschränkter Haftung\nBerlin\n\nBei der nachstehenden Gesellschaft wird das Amtslöschungsverfahren gemäß § 394 FamFG eingeleitet. Widerspruchsfrist 6 Wochen"
    },
    {
      "date": "2026-01-22",
      "id": "143167",
      "original_text": "Sonstige Registerbekanntmachung\nMecklenburg-Vorpommern Amtsgericht Rostock HRB 3817\nBützower Wohnungsgesellschaft mbH – Bützow",
      "type": "Sonstige Registerbekanntmachung",
      "state": "Mecklenburg-Vorpommern",
      "amtsgericht": "Amtsgericht Rostock",
      "registernummer": "HRB 3817",
      "registerart": "HRB",
      "company_name": "Bützower Wohnungsgesellschaft mbH",
      "company_seat": "Bützow",
      "details": "22.01.2026 (Bekanntmachungsdatum)\n\nMecklenburg-Vorpommern Amtsgericht Rostock HRB 3817\nSonstige Registerbekanntmachung 22.01.2026 (Eintragungsdatum)\n\nBützower Wohnungsgesellschaft mbH\nGesellschaft mit beschränkter Haftung\nBützow\n\nEine Liste der Mitglieder des Aufsichtsrats ist zum Handelsregister eingereicht worden."
    },
    {
      "date": "2026-01-22",
      "id": "143168",
      "original_text": "Einreichung neuer Dokumente\nBaden-Württemberg Amtsgericht Stuttgart GnR 720012\nEnergiegemeinschaft Weissacher Tal eG – Weissach im Tal",
      "type": "Einreichung neuer Dokumente",
      "state": "Baden-Württemberg",
      "amtsgericht": "Amtsgericht Stuttgart",
      "registernummer": "GnR 720012",
      "registerart": "GnR",
      "company_name": "Energiegemeinschaft Weissacher Tal eG",
      "company_seat": "Weissach im Tal",
      "details": "22.01.2026 (Bekanntmachungsdatum)\n\nBaden-Württemberg Amtsgericht Stuttgart GnR 720012\nEinreichung neuer Dokumente 22.01.2026 (Eintragungsdatum)\n\nEnergiegemeinschaft Weissacher Tal eG\neingetragene Genossenschaft\nWeissach im Tal\n\nDie Gesellschaft hat am 21.01.2026 die Liste über die Zusammensetzung des Aufsichtsrats zum Handelsregister eingereicht."
    },
    {
      "date": "2026-01-22",
      "id": "143169",
      "original_text": "Registerbekanntmachung nach dem Umwandlungsgesetz\nBaden-Württemberg Amtsgericht Ulm HRB 751240\nVSClub GmbH – Erbach",
      "type": "Registerbekanntmachung nach dem Umwandlungsgesetz",
      "state": "Baden-Württemberg",
      "amtsgericht": "Amtsgericht Ulm",
      "registernummer": "HRB 751240",
      "registerart": "HRB",
      "company_name": "VSClub GmbH",
      "company_seat": "Erbach",
      "details": "22.01.2026 (Bekanntmachungsdatum)\n\nBaden-Württemberg Amtsgericht Ulm HRB 751240\nRegisterbekanntmachung nach dem Umwandlungsgesetz 22.01.2026 (Eintragungsdatum)\n\nVSClub GmbH\nGesellschaft mit beschränkter Haftung\nErbach\n\nAls nicht eingetragen wird bekanntgemacht:\nDen Gläubigern der an der Ausgliederung beteiligten Rechtsträger ist, wenn sie binnen sechs Monaten nach dem Tag, an dem die Eintragung der Ausgliederung in das Register des Sitzes desjenigen Rechtsträgers, dessen Gläubiger sie sind, nach § 19 Abs. 3 UmwG als bekanntgemacht gilt, ihren Anspruch nach Grund und Höhe schriftlich anmelden, Sicherheit zu leisten, soweit sie nicht Befriedigung verlangen können. Dieses Recht steht den Gläubigern jedoch nur zu, wenn sie glaubhaft machen, dass durch die Ausgliederung die Erfüllung ihrer Forderung gefährdet wird."
    },
    {
      "date": "2026-01-22",
      "id": "143170",
      "original_text": "Einreichung neuer Dokumente\nBerlin Amtsgericht Berlin (Charlottenburg) HRB 1265\nDeutsche Film- und Fernsehakademie Berlin Gesellschaft mit beschränkter Haftung – Berlin",
      "type": "Einreichung neuer Dokumente",
      "state": "Berlin",
      "amtsgericht": "Amtsgericht Berlin (Charlottenburg)",
      "registernummer": "HRB 1265",
      "registerart": "HRB",
      "company_name": "Deutsche Film- und Fernsehakademie Berlin Gesellschaft mit beschränkter Haftung",
      "company_seat": "Berlin",
      "details": "22.01.2026 (Bekanntmachungsdatum)\n\nBerlin Amtsgericht Berlin (Charlottenburg) HRB 1265\nEinreichung neuer Dokumente\n\nDeutsche Film- und Fernsehakademie Berlin Gesellschaft mit beschränkter Haftung\nGesellschaft mit beschränkter Haftung\nBerlin\n\nAls nicht eingetragen wird veröffentlicht:Es wurde eine neue Liste der Kuratoriumsmitglieder eingereicht (§52 GmbHG)."
    },
    {
      "date": "2026-01-22",
      "id": "143171",
      "original_text": "Löschungsankündigung\nBerlin Amtsgericht Berlin (Charlottenburg) HRB 147084\nBBV-Tours-Fahrdienst für Personen mit Behinderung GmbH – Berlin",
      "type": "Löschungsankündigung",
      "state": "Berlin",
      "amtsgericht": "Amtsgericht Berlin (Charlottenburg)",
      "registernummer": "HRB 147084",
      "registerart": "HRB",
      "company_name": "BBV-Tours-Fahrdienst für Personen mit Behinderung GmbH",
      "company_seat": "Berlin",
      "details": "22.01.2026 (Bekanntmachungsdatum)\n\nBerlin Amtsgericht Berlin (Charlottenburg) HRB 147084\nLöschungsankündigung\n\nBBV-Tours-Fahrdienst für Personen mit Behinderung GmbH\nGesellschaft mit beschränkter Haftung\nBerlin\n\nBei der nachstehenden Gesellschaft wird das Amtslöschungsverfahren gemäß § 394 FamFG eingeleitet. Widerspruchsfrist 6 Wochen"
    },
    {
      "date": "2026-01-22",
      "id": "143172",
      "original_text": "Registerbekanntmachung nach dem Umwandlungsgesetz\nBaden-Württemberg Amtsgericht Ulm HRA 729646\nAykut Celikan e.K. – Erbach",
      "type": "Registerbekanntmachung nach dem Umwandlungsgesetz",
      "state": "Baden-Württemberg",
      "amtsgericht": "Amtsgericht Ulm",
      "registernummer": "HRA 729646",
      "registerart": "HRA",
      "company_name": "Aykut Celikan e.K.",
      "company_seat": "Erbach",
      "details": "22.01.2026 (Bekanntmachungsdatum)\n\nBaden-Württemberg Amtsgericht Ulm HRA 729646\nRegisterbekanntmachung nach dem Umwandlungsgesetz 22.01.2026 (Eintragungsdatum)\n\nAykut Celikan e.K.\nEinzelkaufmann / Einzelkauffrau\nErbach\n\nAls nicht eingetragen wird bekanntgemacht:\nDen Gläubigern der an der Ausgliederung beteiligten Rechtsträger ist, wenn sie binnen sechs Monaten nach dem Tag, an dem die Eintragung der Ausgliederung in das Register des Sitzes desjenigen Rechtsträgers, dessen Gläubiger sie sind, nach § 19 Abs. 3 UmwG als bekanntgemacht gilt, ihren Anspruch nach Grund und Höhe schriftlich anmelden, Sicherheit zu leisten, soweit sie nicht Befriedigung verlangen können. Dieses Recht steht den Gläubigern jedoch nur zu, wenn sie glaubhaft machen, dass durch die Ausgliederung die Erfüllung ihrer Forderung gefährdet wird."
    },
    {
      "date": "2026-01-22",
      "id": "143173",
      "original_text": "Löschungsankündigung\nBaden-Württemberg Amtsgericht Stuttgart HRB 790547\nEros202 UG (haftungsbeschränkt) – Backnang",
      "type": "Löschungsankündigung",
      "state": "Baden-Württemberg",
      "amtsgericht": "Amtsgericht Stuttgart",
      "registernummer": "HRB 790547",
      "registerart": "HRB",
      "company_name": "Eros202 UG (haftungsbeschränkt)",
      "company_seat": "Backnang",
      "details": "22.01.2026 (Bekanntmachungsdatum)\n\nBaden-Württemberg Amtsgericht Stuttgart HRB 790547\nLöschungsankündigung\n\nEros202 UG (haftungsbeschränkt)\nGesellschaft mit beschränkter Haftung\nBacknang\n\nAls nicht eingetragen wird bekanntgemacht:\nDas Gericht beabsichtigt, die Gesellschaft wegen Vermögenslosigkeit im Handelsregister von Amts wegen nach § 394 FamFG zu löschen. Die Frist zur Geltendmachung eines Widerspruchs gegen die beabsichtigte Löschung ist auf zwei Monate ab Veröffentlichung bestimmt."
    },
    {
      "date": "2026-01-22",
      "id": "143174",
      "original_text": "Löschungsankündigung\nBaden-Württemberg Amtsgericht Stuttgart HRB 231693\nwear + fashion Produktionsgesellschaft mit beschränkter Haftung – Bissingen an der Teck",
      "type": "Löschungsankündigung",
      "state": "Baden-Württemberg",
      "amtsgericht": "Amtsgericht Stuttgart",
      "registernummer": "HRB 231693",
      "registerart": "HRB",
      "company_name": "wear + fashion Produktionsgesellschaft mit beschränkter Haftung",
      "company_seat": "Bissingen an der Teck",
      "details": "22.01.2026 (Bekanntmachungsdatum)\n\nBaden-Württemberg Amtsgericht Stuttgart HRB 231693\nLöschungsankündigung\n\nwear + fashion Produktionsgesellschaft mit beschränkter Haftung\nGesellschaft mit beschränkter Haftung\nBissingen an der Teck\n\nAls nicht eingetragen wird bekanntgemacht:\nDas Gericht beabsichtigt, die Gesellschaft wegen Vermögenslosigkeit im Handelsregister von Amts wegen nach § 394 FamFG zu löschen. Die Frist zur Geltendmachung eines Widerspruchs gegen die beabsichtigte Löschung ist auf zwei Monate ab Veröffentlichung bestimmt."
    },
    {
      "date": "2026-01-22",
      "id": "143175",
      "original_text": "Sonstige Registerbekanntmachung\nHamburg Amtsgericht Hamburg HRB 22610\nHenri-Nannen-Schule Gruner+Jahr/DIE ZEIT GmbH – Hamburg",
      "type": "Sonstige Registerbekanntmachung",
      "state": "Hamburg",
      "amtsgericht": "Amtsgericht Hamburg",
      "registernummer": "HRB 22610",
      "registerart": "HRB",
      "company_name": "Henri-Nannen-Schule Gruner+Jahr/DIE ZEIT GmbH",
      "company_seat": "Hamburg",
      "details": "22.01.2026 (Bekanntmachungsdatum)\n\nHamburg Amtsgericht Hamburg HRB 22610\nSonstige Registerbekanntmachung 22.01.2026 (Eintragungsdatum)\n\nHenri-Nannen-Schule Gruner+Jahr/DIE ZEIT GmbH\nGesellschaft mit beschränkter Haftung\nHamburg\n\nAls nicht eingetragen wird bekannt gemacht:  Den Gläubigern der Gesellschaft, deren Forderungen begründet worden sind, bevor die Eintragung der Vertragsbeendigung in das Handelsregister nach § 10 HGB als bekannt gemacht gilt, ist vom anderen Vertragsteil Sicherheit zu leisten, wenn sie sich binnen 6 Monaten nach Bekanntmachung der Eintragung zu diesem Zweck bei ihm melden."
    },
    {
      "date": "2026-01-22",
      "id": "143176",
      "original_text": "Einreichung neuer Dokumente\nHamburg Amtsgericht Hamburg HRB 183630\nVISKA SE – Hamburg",
      "type": "Einreichung neuer Dokumente",
      "state": "Hamburg",
      "amtsgericht": "Amtsgericht Hamburg",
      "registernummer": "HRB 183630",
      "registerart": "HRB",
      "company_name": "VISKA SE",
      "company_seat": "Hamburg",
      "details": "22.01.2026 (Bekanntmachungsdatum)\n\nHamburg Amtsgericht Hamburg HRB 183630\nEinreichung neuer Dokumente\n\nVISKA SE\nEuropäische Aktiengesellschaft (SE)\nHamburg\n\nAls nicht eingetragen wird bekannt gemacht: Liste des Aufsichtsrats wurde eingereicht."
    },
    {
      "date": "2026-01-22",
      "id": "143177",
      "original_text": "Registerbekanntmachung nach dem Umwandlungsgesetz\nBaden-Württemberg Amtsgericht Stuttgart HRB 737215\nBauer Gear Motor Europe GmbH – Esslingen am Neckar",
      "type": "Registerbekanntmachung nach dem Umwandlungsgesetz",
      "state": "Baden-Württemberg",
      "amtsgericht": "Amtsgericht Stuttgart",
      "registernummer": "HRB 737215",
      "registerart": "HRB",
      "company_name": "Bauer Gear Motor Europe GmbH",
      "company_seat": "Esslingen am Neckar",
      "details": "22.01.2026 (Bekanntmachungsdatum)\n\nBaden-Württemberg Amtsgericht Stuttgart HRB 737215\nRegisterbekanntmachung nach dem Umwandlungsgesetz 22.01.2026 (Eintragungsdatum)\n\nBauer Gear Motor Europe GmbH\nGesellschaft mit beschränkter Haftung\nEsslingen am Neckar\n\nDen Gläubigern der an der Verschmelzung beteiligten Rechtsträger ist, wenn sie binnen sechs Monaten nach dem Tag, an dem die Eintragung der Verschmelzung in das Register des Sitzes desjenigen Rechtsträgers, dessen Gläubiger sie sind, nach § 19 Abs. 3 UmwG als bekanntgemacht gilt, ihren Anspruch nach Grund und Höhe schriftlich anmelden, Sicherheit zu leisten, soweit sie nicht Befriedigung verlangen können. Dieses Recht steht den Gläubigern jedoch nur zu, wenn sie glaubhaft machen, dass durch die Verschmelzung die Erfüllung ihrer Forderung gefährdet wird."
    },
    {
      "date": "2026-01-22",
      "id": "143178",
      "original_text": "Löschungsankündigung\nBaden-Württemberg Amtsgericht Mannheim HRB 739814\nFAW Elektrofachbetrieb GmbH – Illingen",
      "type": "Löschungsankündigung",
      "state": "Baden-Württemberg",
      "amtsgericht": "Amtsgericht Mannheim",
      "registernummer": "HRB 739814",
      "registerart": "HRB",
      "company_name": "FAW Elektrofachbetrieb GmbH",
      "company_seat": "Illingen",
      "details": "22.01.2026 (Bekanntmachungsdatum)\n\nBaden-Württemberg Amtsgericht Mannheim HRB 739814\nLöschungsankündigung\n\nFAW Elektrofachbetrieb GmbH\nGesellschaft mit beschränkter Haftung\nIllingen\n\nDas Gericht beabsichtigt, die Gesellschaft wegen Vermögenslosigkeit im Handelsregister von Amts wegen nach § 394 FamFG zu löschen. Die Frist zur Geltendmachung eines Widerspruchs gegen die beabsichtigte Löschung ist auf einen Monat ab Veröffentlichung bestimmt."
    },
    {
      "date": "2026-01-22",
      "id": "143179",
      "original_text": "Einreichung neuer Dokumente\nBaden-Württemberg Amtsgericht Freiburg HRB 412761\nRoche Deutschland Holding GmbH – Grenzach-Wyhlen",
      "type": "Einreichung neuer Dokumente",
      "state": "Baden-Württemberg",
      "amtsgericht": "Amtsgericht Freiburg",
      "registernummer": "HRB 412761",
      "registerart": "HRB",
      "company_name": "Roche Deutschland Holding GmbH",
      "company_seat": "Grenzach-Wyhlen",
      "details": "22.01.2026 (Bekanntmachungsdatum)\n\nBaden-Württemberg Amtsgericht Freiburg HRB 412761\nEinreichung neuer Dokumente\n\nRoche Deutschland Holding GmbH\nGesellschaft mit beschränkter Haftung\nGrenzach-Wyhlen\n\nDie Gesellschaft hat am 25.11.2025 die Liste über die Zusammensetzung des Aufsichtsrats zum Handelsregister eingereicht."
    },
    {
      "date": "2026-01-22",
      "id": "143180",
      "original_text": "Registerbekanntmachung nach dem Umwandlungsgesetz\nHamburg Amtsgericht Hamburg HRB 89594\nVerwaltung Neunundfünfzigste IFH geschlossener Immobilienfonds für Holland GmbH – Hamburg",
      "type": "Registerbekanntmachung nach dem Umwandlungsgesetz",
      "state": "Hamburg",
      "amtsgericht": "Amtsgericht Hamburg",
      "registernummer": "HRB 89594",
      "registerart": "HRB",
      "company_name": "Verwaltung Neunundfünfzigste IFH geschlossener Immobilienfonds für Holland GmbH",
      "company_seat": "Hamburg",
      "details": "22.01.2026 (Bekanntmachungsdatum)\n\nHamburg Amtsgericht Hamburg HRB 89594\nRegisterbekanntmachung nach dem Umwandlungsgesetz 21.01.2026 (Eintragungsdatum)\n\nVerwaltung Neunundfünfzigste IFH geschlossener Immobilienfonds für Holland GmbH\nGesellschaft mit beschränkter Haftung\nHamburg\n\nAls nicht eingetragen wird bekannt gemacht:\nDen Gläubigern der an der Verschmelzung beteiligten Gesellschaften ist, wenn sie binnen sechs Monaten nach dem Tag, an dem die Eintragung der Verschmelzung in das Register des Sitzes desjenigen Rechtsträgers, dessen Gläubiger sie sind, nach § 19 Absatz 3 UmwG als bekannt gemacht gilt, ihren Anspruch nach Grund und Höhe schriftlich anmelden, Sicherheit zu leisten, soweit sie nicht Befriedigung verlangen können. Dieses Recht steht den Gläubigern jedoch nur zu, wenn sie glaubhaft machen, dass durch die Verschmelzung die Erfüllung ihrer Forderung gefährdet wird."
    },
    {
      "date": "2026-01-22",
      "id": "143181",
      "original_text": "Einreichung neuer Dokumente\nSachsen-Anhalt Amtsgericht Stendal HRB 33088\nMIDEWA Dienstleistungsgesellschaft mbH – Köthen (Anhalt)",
      "type": "Einreichung neuer Dokumente",
      "state": "Sachsen-Anhalt",
      "amtsgericht": "Amtsgericht Stendal",
      "registernummer": "HRB 33088",
      "registerart": "HRB",
      "company_name": "MIDEWA Dienstleistungsgesellschaft mbH",
      "company_seat": "Köthen (Anhalt)",
      "details": "22.01.2026 (Bekanntmachungsdatum)\n\nSachsen-Anhalt Amtsgericht Stendal HRB 33088\nEinreichung neuer Dokumente\n\nMIDEWA Dienstleistungsgesellschaft mbH\nGesellschaft mit beschränkter Haftung\nKöthen (Anhalt)\n\nEine Liste der Mitglieder des Aufsichtsrates wurde zum Handelsregister eingereicht."
    },
    {
      "date": "2026-01-22",
      "id": "143182",
      "original_text": "Löschungsankündigung\nBrandenburg Amtsgericht Frankfurt/Oder HRB 17969\nECKI-Bau GmbH – Panketal",
      "type": "Löschungsankündigung",
      "state": "Brandenburg",
      "amtsgericht": "Amtsgericht Frankfurt/Oder",
      "registernummer": "HRB 17969",
      "registerart": "HRB",
      "company_name": "ECKI-Bau GmbH",
      "company_seat": "Panketal",
      "details": "22.01.2026 (Bekanntmachungsdatum)\n\nBrandenburg Amtsgericht Frankfurt/Oder HRB 17969\nLöschungsankündigung\n\nECKI-Bau GmbH\nGesellschaft mit beschränkter Haftung\nPanketal\n\nBei der nachstehenden Gesellschaft wird das Amtslöschungsverfahren gemäß § 394 FamFG eingeleitet."
    },
    {
      "date": "2026-01-22",
      "id": "143183",
      "original_text": "Sonstige Registerbekanntmachung\nBrandenburg Amtsgericht Neuruppin GnR 247\nCasekower Grundstücksverwaltungsgenossenschaft eG – Casekow",
      "type": "Sonstige Registerbekanntmachung",
      "state": "Brandenburg",
      "amtsgericht": "Amtsgericht Neuruppin",
      "registernummer": "GnR 247",
      "registerart": "GnR",
      "company_name": "Casekower Grundstücksverwaltungsgenossenschaft eG",
      "company_seat": "Casekow",
      "details": "22.01.2026 (Bekanntmachungsdatum)\n\nBrandenburg Amtsgericht Neuruppin GnR 247\nSonstige Registerbekanntmachung\n\nCasekower Grundstücksverwaltungsgenossenschaft eG\neingetragene Genossenschaft\nCasekow\n\nAls nicht eingetragen wird veröffentlicht: Durch Beschluss der Generalversammlung vom 20.11.2025 ist § 2 (Geschäftsanteil, Zahlungen, Rücklagen, Nachschüsse, Haftung, Rückvergütung, Verjährung, Mindestkapital) geändert und die Höhe des Geschäftsanteils herabgesetzt. Den Gläubigern der Genossenschaft ist, wenn sie sich binnen sechs Monaten nach der Bekanntmachung bei der Genosssenschaft zu diesem Zweck melden, Sicherheit zu leisten, soweit sie nicht Befriedigung verlangen können. Das Recht, Sicherheitsleistung zu verlangen, steht Gläubigern nicht zu, die im Fall der Insolvenz ein Recht auf vorzugsweise Befriedigung aus einer Deckungsmasse haben, die nach gesetzlicher Vorschrift zu ihrem Schutz errichtet und staatlich überwacht ist."
    },
    {
      "date": "2026-01-22",
      "id": "143184",
      "original_text": "Löschungsankündigung\nSaarland Amtsgericht Saarbrücken HRA 12386\nPARDON CLOTHING Deutschland GmbH & Co. KG – Neunkirchen",
      "type": "Löschungsankündigung",
      "state": "Saarland",
      "amtsgericht": "Amtsgericht Saarbrücken",
      "registernummer": "HRA 12386",
      "registerart": "HRA",
      "company_name": "PARDON CLOTHING Deutschland GmbH & Co. KG",
      "company_seat": "Neunkirchen",
      "details": "22.01.2026 (Bekanntmachungsdatum)\n\nSaarland Amtsgericht Saarbrücken HRA 12386\nLöschungsankündigung\n\nPARDON CLOTHING Deutschland GmbH & Co. KG\nKommanditgesellschaft\nNeunkirchen\n\nEs ist beabsichtigt, die Gesellschaft von Amts wegen gemäß § 394 FamFG wegen Vermögenslosigkeit zu löschen.\nGegen die Löschung von Amts wegen ist das Rechtsmittel des Widerspruchs statthaft. Der Widerspruch ist binnen einer Frist zwei Monaten beginnend mit dem Tag dieser Veröffentlichung durch Einreichen eines Widerspruchsschreibens -schriftlich oder zur Niederschrift der Geschäftsstelle beim Amtsgericht Saarbrücken, -zentrales Handelsregister-, Mainzerstr.178, 66121 Saarbrücken einzulegen.\nDer Widerspruch muss die Bezeichnung der angefochtenen Löschungsankündigung enthalten sowie die Erklärung, dass Widerspruch eingelegt wird. Er ist vom Widerspruchsführer oder seinem Bevollmächtigten zu unterzeichnen.\nDas Widerspruchsschreiben kann auch in der Form eines elektronischen Dokumentes eingereicht werden, das mit einer qualifizierten elektronischen Signatur nach dem Signaturgesetz versehen sein muss (§§ 14 Abs. 2 FamFG, 130a, 298 ZPO)."
    },
    {
      "date": "2026-01-22",
      "id": "143185",
      "original_text": "Einreichung neuer Dokumente\nBaden-Württemberg Amtsgericht Stuttgart HRB 782421\nFesto Management SE – Esslingen am Neckar",
      "type": "Einreichung neuer Dokumente",
      "state": "Baden-Württemberg",
      "amtsgericht": "Amtsgericht Stuttgart",
      "registernummer": "HRB 782421",
      "registerart": "HRB",
      "company_name": "Festo Management SE",
      "company_seat": "Esslingen am Neckar",
      "details": "22.01.2026 (Bekanntmachungsdatum)\n\nBaden-Württemberg Amtsgericht Stuttgart HRB 782421\nEinreichung neuer Dokumente\n\nFesto Management SE\nEuropäische Aktiengesellschaft (SE)\nEsslingen am Neckar\n\nDie Gesellschaft hat am 20.01.2026 die Liste über die Zusammensetzung des Aufsichtsrats zum Handelsregister eingereicht."
    },
    {
      "date": "2026-01-22",
      "id": "143186",
      "original_text": "Registerbekanntmachung nach dem Umwandlungsgesetz\nBerlin Amtsgericht Berlin (Charlottenburg) HRB 96473\nAkzent Personaldienstleistungen Mitte GmbH – Berlin",
      "type": "Registerbekanntmachung nach dem Umwandlungsgesetz",
      "state": "Berlin",
      "amtsgericht": "Amtsgericht Berlin (Charlottenburg)",
      "registernummer": "HRB 96473",
      "registerart": "HRB",
      "company_name": "Akzent Personaldienstleistungen Mitte GmbH",
      "company_seat": "Berlin",
      "details": "22.01.2026 (Bekanntmachungsdatum)\n\nBerlin Amtsgericht Berlin (Charlottenburg) HRB 96473\nRegisterbekanntmachung nach dem Umwandlungsgesetz 21.01.2026 (Eintragungsdatum)\n\nAkzent Personaldienstleistungen  Mitte GmbH\nGesellschaft mit beschränkter Haftung\nBerlin\n\nZu Eintragungsnummer 11 vom 21.01.2026 wird als nicht eingetragen veröffentlicht: Der andere Vertragsteil hat den Gläubigern dieses Rechtsträgers, deren Forderungen begründet worden sind, bevor die Eintragung der Beendigung dieses Vertrages in das Handelsregister nach § 10 des Handelsgesetzbuches als bekannt gemacht gilt, Sicherheit zu leisten, wenn sie sich binnen sechs Monaten nach der Bekanntmachung der Eintragung zu diesem Zweck bei ihm melden. Dieses Recht steht den Gläubigern nicht zu, die im Fall des Insolvenzverfahrens ein Recht auf vorzugsweise Befriedigung aus der Deckungsmasse haben, die nach gesetzlicher Vorschrift zu ihrem Schutz errichtet und staatlich überwacht ist."
    },
    {
      "date": "2026-01-22",
      "id": "143187",
      "original_text": "Registerbekanntmachung nach dem Umwandlungsgesetz\nSchleswig-Holstein Amtsgericht Pinneberg HRA 8592\nTOP-HausSicherheit GmbH & Co. KG – Heide",
      "type": "Registerbekanntmachung nach dem Umwandlungsgesetz",
      "state": "Schleswig-Holstein",
      "amtsgericht": "Amtsgericht Pinneberg",
      "registernummer": "HRA 8592",
      "registerart": "HRA",
      "company_name": "TOP-HausSicherheit GmbH & Co. KG",
      "company_seat": "Heide",
      "details": "22.01.2026 (Bekanntmachungsdatum)\n\nSchleswig-Holstein Amtsgericht Pinneberg HRA 8592\nRegisterbekanntmachung nach dem Umwandlungsgesetz 19.01.2026 (Eintragungsdatum)\n\nTOP-HausSicherheit GmbH & Co. KG\nKommanditgesellschaft\nHeide\n\nZu Eintragungsnummer 2 vom 19.01.2026 wird als nicht eingetragen veröffentlicht:  Als nicht eingetragen wird veröffentlicht: Den Gläubigern der an der Verschmelzung beteiligten Rechtsträger ist, wenn sie binnen sechs Monaten nach dem Tag, an dem die Eintragung der Verschmelzung in das Register des Sitzes desjenigen Rechtsträgers, dessen Gläubiger sie sind, als bekannt gemacht gilt, ihren Anspruch nach Grund und Höhe schriftlich anmelden, Sicherheit zu leisten, soweit sie nicht Befriedigung verlangen können. Dieses Recht steht den Gläubigern jedoch nur zu, wenn sie glaubhaft machen, dass durch die Verschmelzung die Erfüllung ihrer Forderung gefährdet wird. Das Recht, Sicherheitsleistung zu verlangen, steht Gläubigern nicht zu, die im Falle der Insolvenz ein Recht auf vorzugsweise Befriedigung aus einer Deckungsmasse haben, die nach gesetzlicher Vorschrift zu ihrem Schutz errichtet und staatlich überwacht ist."
    },
    {
      "date": "2026-01-22",
      "id": "143188",
      "original_text": "Einreichung neuer Dokumente\nHamburg Amtsgericht Hamburg HRB 83826\nElbkinder KITA Hamburg Servicegesellschaft gemeinnützige GmbH – Hamburg",
      "type": "Einreichung neuer Dokumente",
      "state": "Hamburg",
      "amtsgericht": "Amtsgericht Hamburg",
      "registernummer": "HRB 83826",
      "registerart": "HRB",
      "company_name": "Elbkinder KITA Hamburg Servicegesellschaft gemeinnützige GmbH",
      "company_seat": "Hamburg",
      "details": "22.01.2026 (Bekanntmachungsdatum)\n\nHamburg Amtsgericht Hamburg HRB 83826\nEinreichung neuer Dokumente\n\nElbkinder KITA Hamburg Servicegesellschaft gemeinnützige GmbH\nGesellschaft mit beschränkter Haftung\nHamburg\n\nAls nicht eingetragen wird bekannt gemacht: Liste des Aufsichtsrats wurde eingereicht."
    },
    {
      "date": "2026-01-22",
      "id": "143189",
      "original_text": "Einreichung neuer Dokumente\nHamburg Amtsgericht Hamburg HRB 89795\nElbkinder Vereinigung Hamburger Kitas gGmbH – Hamburg",
      "type": "Einreichung neuer Dokumente",
      "state": "Hamburg",
      "amtsgericht": "Amtsgericht Hamburg",
      "registernummer": "HRB 89795",
      "registerart": "HRB",
      "company_name": "Elbkinder Vereinigung Hamburger Kitas gGmbH",
      "company_seat": "Hamburg",
      "details": "22.01.2026 (Bekanntmachungsdatum)\n\nHamburg Amtsgericht Hamburg HRB 89795\nEinreichung neuer Dokumente\n\nElbkinder Vereinigung Hamburger Kitas gGmbH\nGesellschaft mit beschränkter Haftung\nHamburg\n\nAls nicht eingetragen wird bekannt gemacht: Liste des Aufsichtsrats wurde eingereicht."
    },
    {
      "date": "2026-01-22",
      "id": "143190",
      "original_text": "Registerbekanntmachung nach dem Umwandlungsgesetz\nBaden-Württemberg Amtsgericht Stuttgart HRB 796509\nAUDERE Holding GmbH – Fellbach",
      "type": "Registerbekanntmachung nach dem Umwandlungsgesetz",
      "state": "Baden-Württemberg",
      "amtsgericht": "Amtsgericht Stuttgart",
      "registernummer": "HRB 796509",
      "registerart": "HRB",
      "company_name": "AUDERE Holding GmbH",
      "company_seat": "Fellbach",
      "details": "22.01.2026 (Bekanntmachungsdatum)\n\nBaden-Württemberg Amtsgericht Stuttgart HRB 796509\nRegisterbekanntmachung nach dem Umwandlungsgesetz 22.01.2026 (Eintragungsdatum)\n\nAUDERE Holding GmbH\nGesellschaft mit beschränkter Haftung\nFellbach\n\nDen Gläubigern der an der Verschmelzung beteiligten Rechtsträger ist, wenn sie binnen sechs Monaten nach dem Tag, an dem die Eintragung der Verschmelzung in das Register des Sitzes desjenigen Rechtsträgers, dessen Gläubiger sie sind, nach § 19 Abs. 3 UmwG als bekanntgemacht gilt, ihren Anspruch nach Grund und Höhe schriftlich anmelden, Sicherheit zu leisten, soweit sie nicht Befriedigung verlangen können. Dieses Recht steht den Gläubigern jedoch nur zu, wenn sie glaubhaft machen, dass durch die Verschmelzung die Erfüllung ihrer Forderung gefährdet wird."
    },
    {
      "date": "2026-01-22",
      "id": "143191",
      "original_text": "Löschungsankündigung\nNordrhein-Westfalen Amtsgericht Coesfeld HRB 21834\nNOVOTRANS UG (haftungsbeschränkt) – Coesfeld",
      "type": "Löschungsankündigung",
      "state": "Nordrhein-Westfalen",
      "amtsgericht": "Amtsgericht Coesfeld",
      "registernummer": "HRB 21834",
      "registerart": "HRB",
      "company_name": "NOVOTRANS UG (haftungsbeschränkt)",
      "company_seat": "Coesfeld",
      "details": "22.01.2026 (Bekanntmachungsdatum)\n\nNordrhein-Westfalen Amtsgericht Coesfeld HRB 21834\nLöschungsankündigung\n\nNOVOTRANS UG (haftungsbeschränkt)\nGesellschaft mit beschränkter Haftung\nCoesfeld\n\nDas Registergericht beabsichtigt, den Rechtsträger wegen Vermögenslosigkeit gemäß § 394 FamFG von Amts wegen zu löschen.\n\nGegen diese Verfügung kann Widerspruch eingelegt werden. Die Frist zur Erhebung eines Widerspruchs gegen die beabsichtigte Löschung ist auf zwei Monate ab Veröffentlichung festgesetzt."
    },
    {
      "date": "2026-01-22",
      "id": "143192",
      "original_text": "Einreichung neuer Dokumente\nSchleswig-Holstein Amtsgericht Kiel HRB 4216 NO\n\"wilhelm.tel GmbH\" – Norderstedt",
      "type": "Einreichung neuer Dokumente",
      "state": "Schleswig-Holstein",
      "amtsgericht": "Amtsgericht Kiel",
      "registernummer": "HRB 4216 NO",
      "registerart": "HRB",
      "company_name": "\"wilhelm.tel GmbH\"",
      "company_seat": "Norderstedt",
      "details": "22.01.2026 (Bekanntmachungsdatum)\n\nSchleswig-Holstein Amtsgericht Kiel HRB 4216 NO\nEinreichung neuer Dokumente\n\n\"wilhelm.tel GmbH\"\nGesellschaft mit beschränkter Haftung\nNorderstedt\n\nAls nicht eingetragen wird veröffentlicht: Eine neue Liste der Aufsichtsratsmitglieder ist eingereicht worden."
    },
    {
      "date": "2026-01-22",
      "id": "143193",
      "original_text": "Sonstige Registerbekanntmachung\nBrandenburg Amtsgericht Neuruppin GnR 248\nKausch & Schütze Wohnungsverwaltungsgenossenschaft eG – Casekow",
      "type": "Sonstige Registerbekanntmachung",
      "state": "Brandenburg",
      "amtsgericht": "Amtsgericht Neuruppin",
      "registernummer": "GnR 248",
      "registerart": "GnR",
      "company_name": "Kausch & Schütze Wohnungsverwaltungsgenossenschaft eG",
      "company_seat": "Casekow",
      "details": "22.01.2026 (Bekanntmachungsdatum)\n\nBrandenburg Amtsgericht Neuruppin GnR 248\nSonstige Registerbekanntmachung\n\nKausch & Schütze Wohnungsverwaltungsgenossenschaft eG\neingetragene Genossenschaft\nCasekow\n\nAls nicht eingetragen wird veröffentlicht: Durch Beschluss der Generalversammlung vom 20.11.2025 ist die Satzung in § 2 (Geschäftsanteil, Zahlungen, Rücklagen, Nachschüsse, Haftung, Rückvergütung, Verjährung, Mindestkapital) geändert und die Höhe des Geschäftsanteils herabgesetzt. Den Gläubigern der Genossenschaft ist, wenn sie sich binnen sechs Monaten nach der Bekanntmachung bei der Genossenschaft zu diesem Zweck melden, Sicherheit zu leisten, soweit sie nicht Befriedigung verlangen können. Das Recht, Sicherheitsleistung zu verlangen, steht Gläubigern nicht zu, die im Fall der Insolvenz ein Recht auf vorzugsweise Befriedigung aus einer Deckungsmasse haben, die nach gesetzlicher Vorschrift zu ihrem Schutz errichtet und staatlich überwacht ist."
    },
    {
      "date": "2026-01-22",
      "id": "143194",
      "original_text": "Einreichung neuer Dokumente\nHamburg Amtsgericht Hamburg HRB 143197\nMAGNA Asset Management AG – Hamburg",
      "type": "Einreichung neuer Dokumente",
      "state": "Hamburg",
      "amtsgericht": "Amtsgericht Hamburg",
      "registernummer": "HRB 143197",
      "registerart": "HRB",
      "company_name": "MAGNA Asset Management AG",
      "company_seat": "Hamburg",
      "details": "22.01.2026 (Bekanntmachungsdatum)\n\nHamburg Amtsgericht Hamburg HRB 143197\nEinreichung neuer Dokumente\n\nMAGNA Asset Management AG\nAktiengesellschaft\nHamburg\n\nAls nicht eingetragen wird bekannt gemacht: Listen des Aufsichtsrats wurden eingereicht."
    },
    {
      "date": "2026-01-22",
      "id": "143195",
      "original_text": "Einreichung neuer Dokumente\nSchleswig-Holstein Amtsgericht Pinneberg HRB 10897\nArconda Systems AG – Tangstedt",
      "type": "Einreichung neuer Dokumente",
      "state": "Schleswig-Holstein",
      "amtsgericht": "Amtsgericht Pinneberg",
      "registernummer": "HRB 10897",
      "registerart": "HRB",
      "company_name": "Arconda Systems AG",
      "company_seat": "Tangstedt",
      "details": "22.01.2026 (Bekanntmachungsdatum)\n\nSchleswig-Holstein Amtsgericht Pinneberg HRB 10897\nEinreichung neuer Dokumente\n\nArconda Systems AG\nAktiengesellschaft\nTangstedt\n\nAls nicht eingetragen wird veröffentlicht: Gemäß § 10 HGB wurde eine neue Aufsichtsratsliste zum Handelsregister eingereicht."
    },
    {
      "date": "2026-01-22",
      "id": "143196",
      "original_text": "Einreichung neuer Dokumente\nBerlin Amtsgericht Berlin (Charlottenburg) HRB 97288\nHumboldt-Innovation GmbH – Berlin",
      "type": "Einreichung neuer Dokumente",
      "state": "Berlin",
      "amtsgericht": "Amtsgericht Berlin (Charlottenburg)",
      "registernummer": "HRB 97288",
      "registerart": "HRB",
      "company_name": "Humboldt-Innovation GmbH",
      "company_seat": "Berlin",
      "details": "22.01.2026 (Bekanntmachungsdatum)\n\nBerlin Amtsgericht Berlin (Charlottenburg) HRB 97288\nEinreichung neuer Dokumente\n\nHumboldt-Innovation GmbH\nGesellschaft mit beschränkter Haftung\nBerlin\n\nAls nicht eingetragen wird veröffentlicht: Es wurde eine neue Liste der Aufsichtsratsmitglieder eingereicht (§52 GmbHG)."
    },
    {
      "date": "2026-01-22",
      "id": "143197",
      "original_text": "Löschungsankündigung\nBerlin Amtsgericht Berlin (Charlottenburg) HRB 139854\nFEK IT Entwicklungs UG (haftungsbeschränkt) – Berlin",
      "type": "Löschungsankündigung",
      "state": "Berlin",
      "amtsgericht": "Amtsgericht Berlin (Charlottenburg)",
      "registernummer": "HRB 139854",
      "registerart": "HRB",
      "company_name": "FEK IT Entwicklungs UG (haftungsbeschränkt)",
      "company_seat": "Berlin",
      "details": "22.01.2026 (Bekanntmachungsdatum)\n\nBerlin Amtsgericht Berlin (Charlottenburg) HRB 139854\nLöschungsankündigung\n\nFEK IT Entwicklungs UG (haftungsbeschränkt)\nGesellschaft mit beschränkter Haftung\nBerlin\n\nBei der nachstehenden Gesellschaft wird das Amtslöschungsverfahren gemäß § 394 FamFG eingeleitet. Widerspruchsfrist 6 Wochen"
    },
    {
      "date": "2026-01-22",
      "id": "143198",
      "original_text": "Löschungsankündigung\nBerlin Amtsgericht Berlin (Charlottenburg) HRB 271270\nBestNow UG (haftungsbeschränkt) – Berlin",
      "type": "Löschungsankündigung",
      "state": "Berlin",
      "amtsgericht": "Amtsgericht Berlin (Charlottenburg)",
      "registernummer": "HRB 271270",
      "registerart": "HRB",
      "company_name": "BestNow UG (haftungsbeschränkt)",
      "company_seat": "Berlin",
      "details": "22.01.2026 (Bekanntmachungsdatum)\n\nBerlin Amtsgericht Berlin (Charlottenburg) HRB 271270\nLöschungsankündigung\n\nBestNow UG (haftungsbeschränkt)\nGesellschaft mit beschränkter Haftung\nBerlin\n\nBei der nachstehenden Gesellschaft wird das Amtslöschungsverfahren gemäß § 394 FamFG eingeleitet. Widerspruchsfrist: 6 Wochen."
    },
    {
      "date": "2026-01-22",
      "id": "143199",
      "original_text": "Löschungsankündigung\nSachsen Amtsgericht Leipzig HRA 13059\nDICKENBROK BAU GMBH & CO.KG – Taucha",
      "type": "Löschungsankündigung",
      "state": "Sachsen",
      "amtsgericht": "Amtsgericht Leipzig",
      "registernummer": "HRA 13059",
      "registerart": "HRA",
      "company_name": "DICKENBROK BAU GMBH & CO.KG",
      "company_seat": "Taucha",
      "details": "22.01.2026 (Bekanntmachungsdatum)\n\nSachsen Amtsgericht Leipzig HRA 13059\nLöschungsankündigung\n\nDICKENBROK BAU GMBH & CO.KG\nKommanditgesellschaft\nTaucha\n\nDas Registergericht beabsichtigt, die im Handelsregister eingetragene Gesellschaft von Amts wegen nach § 394 FamFG zu löschen. Die Frist zu Erhebung eines Widerspruchs gegen die beabsichtigte Löschung wird auf einen Monat festgesetzt."
    },
    {
      "date": "2026-01-22",
      "id": "143200",
      "original_text": "Registerbekanntmachung nach dem Umwandlungsgesetz\nSachsen Amtsgericht Dresden HRA 12411\nBenjamin Gellert e.K. – Schleife",
      "type": "Registerbekanntmachung nach dem Umwandlungsgesetz",
      "state": "Sachsen",
      "amtsgericht": "Amtsgericht Dresden",
      "registernummer": "HRA 12411",
      "registerart": "HRA",
      "company_name": "Benjamin Gellert e.K.",
      "company_seat": "Schleife",
      "details": "22.01.2026 (Bekanntmachungsdatum)\n\nSachsen Amtsgericht Dresden HRA 12411\nRegisterbekanntmachung nach dem Umwandlungsgesetz 22.01.2026 (Eintragungsdatum)\n\nBenjamin Gellert e.K.\nEinzelkaufmann / Einzelkauffrau\nSchleife\n\nDen Gläubigern der an der Ausgliederung beteiligten Rechtsträger ist, wenn sie binnen sechs Monaten nach dem Tag, an dem die Eintragung der Ausgliederung in das Register des Sitzes desjenigen Rechtsträgers, dessen Gläubiger sie sind, nach § 19 Abs. 3 UmwG als bekannt gemacht gilt, ihren Anspruch nach Grund und Höhe in Textform anmelden, Sicherheit zu leisten, soweit sie nicht Befriedigung verlangen können. Dieses Recht steht den Gläubigern jedoch nur zu, wenn sie glaubhaft machen, dass durch die Ausgliederung die Erfüllung der Forderung gefährdet wird."
    },
    {
      "date": "2026-01-22",
      "id": "143201",
      "original_text": "Löschungsankündigung\nSachsen Amtsgericht Dresden HRB 37917\nCasa Bau GmbH – Dresden",
      "type": "Löschungsankündigung",
      "state": "Sachsen",
      "amtsgericht": "Amtsgericht Dresden",
      "registernummer": "HRB 37917",
      "registerart": "HRB",
      "company_name": "Casa Bau GmbH",
      "company_seat": "Dresden",
      "details": "22.01.2026 (Bekanntmachungsdatum)\n\nSachsen Amtsgericht Dresden HRB 37917\nLöschungsankündigung\n\nCasa Bau GmbH\nGesellschaft mit beschränkter Haftung\nDresden\n\nDas Registergericht beabsichtigt, die im Handelsregister eingetragene Gesellschaft von Amts wegen nach § 394 FamFG zu löschen. Die Frist zu Erhebung eines Widerspruchs gegen die beabsichtigte Löschung wird auf einen Monat festgesetzt."
    },
    {
      "date": "2026-01-22",
      "id": "143202",
      "original_text": "Registerbekanntmachung nach dem Umwandlungsgesetz\nSachsen Amtsgericht Dresden HRB 47514\nGellert Growth GmbH – Schleife",
      "type": "Registerbekanntmachung nach dem Umwandlungsgesetz",
      "state": "Sachsen",
      "amtsgericht": "Amtsgericht Dresden",
      "registernummer": "HRB 47514",
      "registerart": "HRB",
      "company_name": "Gellert Growth GmbH",
      "company_seat": "Schleife",
      "details": "22.01.2026 (Bekanntmachungsdatum)\n\nSachsen Amtsgericht Dresden HRB 47514\nRegisterbekanntmachung nach dem Umwandlungsgesetz 22.01.2026 (Eintragungsdatum)\n\nGellert Growth GmbH\nGesellschaft mit beschränkter Haftung\nSchleife\n\nDen Gläubigern der an der Ausgliederung beteiligten Rechtsträger ist, wenn sie binnen sechs Monaten nach dem Tag, an dem die Eintragung der Ausgliederung in das Register des Sitzes desjenigen Rechtsträgers, dessen Gläubiger sie sind, nach § 19 Abs. 3 UmwG als bekannt gemacht gilt, ihren Anspruch nach Grund und Höhe in Textform anmelden, Sicherheit zu leisten, soweit sie nicht Befriedigung verlangen können. Dieses Recht steht den Gläubigern jedoch nur zu, wenn sie glaubhaft machen, dass durch die Ausgliederung die Erfüllung der Forderung gefährdet wird."
    },
    {
      "date": "2026-01-22",
      "id": "143203",
      "original_text": "Löschungsankündigung\nSachsen Amtsgericht Leipzig HRA 15757\nWGS Projektgesellschaft mbH & Co. KG – Leipzig",
      "type": "Löschungsankündigung",
      "state": "Sachsen",
      "amtsgericht": "Amtsgericht Leipzig",
      "registernummer": "HRA 15757",
      "registerart": "HRA",
      "company_name": "WGS Projektgesellschaft mbH & Co. KG",
      "company_seat": "Leipzig",
      "details": "22.01.2026 (Bekanntmachungsdatum)\n\nSachsen Amtsgericht Leipzig HRA 15757\nLöschungsankündigung\n\nWGS Projektgesellschaft mbH & Co. KG\nKommanditgesellschaft\nLeipzig\n\nDas Registergericht beabsichtigt, die im Handelsregister eingetragene Gesellschaft von Amts wegen nach § 394 FamFG zu löschen. Die Frist zu Erhebung eines Widerspruchs gegen die beabsichtigte Löschung wird auf einen Monat festgesetzt."
    },
    {
      "date": "2026-01-22",
      "id": "143204",
      "original_text": "Löschungsankündigung\nSachsen Amtsgericht Dresden HRB 17150\nPEP KREATIVBAU GmbH – Kamenz",
      "type": "Löschungsankündigung",
      "state": "Sachsen",
      "amtsgericht": "Amtsgericht Dresden",
      "registernummer": "HRB 17150",
      "registerart": "HRB",
      "company_name": "PEP KREATIVBAU GmbH",
      "company_seat": "Kamenz",
      "details": "22.01.2026 (Bekanntmachungsdatum)\n\nSachsen Amtsgericht Dresden HRB 17150\nLöschungsankündigung\n\nPEP KREATIVBAU GmbH\nGesellschaft mit beschränkter Haftung\nKamenz\n\nDas Registergericht beabsichtigt, die im Handelsregister eingetragene Gesellschaft von Amts wegen nach § 394 FamFG zu löschen. Die Frist zu Erhebung eines Widerspruchs gegen die beabsichtigte Löschung wird auf einen Monat festgesetzt."
    },
    {
      "date": "2026-01-22",
      "id": "143205",
      "original_text": "Löschungsankündigung\nNiedersachsen Amtsgericht Hildesheim HRB 207639\nDachdeckerbetrieb DaPro UG (haftungsbeschränkt) – Bad Salzdetfurth",
      "type": "Löschungsankündigung",
      "state": "Niedersachsen",
      "amtsgericht": "Amtsgericht Hildesheim",
      "registernummer": "HRB 207639",
      "registerart": "HRB",
      "company_name": "Dachdeckerbetrieb DaPro UG (haftungsbeschränkt)",
      "company_seat": "Bad Salzdetfurth",
      "details": "22.01.2026 (Bekanntmachungsdatum)\n\nNiedersachsen Amtsgericht Hildesheim HRB 207639\nLöschungsankündigung\n\nDachdeckerbetrieb DaPro UG (haftungsbeschränkt)\nGesellschaft mit beschränkter Haftung\nBad Salzdetfurth\n\nDas Registergericht beabsichtigt, die Gesellschaft von Amts wegen nach § 394 FamFG zu löschen. Die Frist zur Erhebung eines Widerspruchs ist auf 1 Monat ab dieser Registerbekanntmachung festgesetzt."
    },
    {
      "date": "2026-01-22",
      "id": "143206",
      "original_text": "Registerbekanntmachung nach dem Umwandlungsgesetz\nNiedersachsen Amtsgericht Osnabrück HRB 208135\nsteute-online-Schaltgeräte Verwaltungs GmbH – Melle",
      "type": "Registerbekanntmachung nach dem Umwandlungsgesetz",
      "state": "Niedersachsen",
      "amtsgericht": "Amtsgericht Osnabrück",
      "registernummer": "HRB 208135",
      "registerart": "HRB",
      "company_name": "steute-online-Schaltgeräte Verwaltungs GmbH",
      "company_seat": "Melle",
      "details": "22.01.2026 (Bekanntmachungsdatum)\n\nNiedersachsen Amtsgericht Osnabrück HRB 208135\nRegisterbekanntmachung nach dem Umwandlungsgesetz 22.01.2026 (Eintragungsdatum)\n\nsteute-online-Schaltgeräte Verwaltungs GmbH\nGesellschaft mit beschränkter Haftung\nMelle\n\nDen Gläubigern der an der Verschmelzung beteiligten Rechtsträger ist, wenn sie binnen sechs Monaten nach dem Tag, an dem die Eintragung der Verschmelzung in das Register des Sitzes desjenigen Rechtsträgers, dessen Gläubiger sie sind, nach § 19  Abs.  3 UmwG als bekannt gemacht gilt, ihren Anspruch nach Grund und Höhe schriftlich anmelden, Sicherheit zu leisten, soweit sie nicht Befriedigung verlangen können. Dieses Recht steht den Gläubigern jedoch nur zu, wenn sie glaubhaft machen, dass durch die Verschmelzung die Erfüllung der Forderung gefährdet wird."
    },
    {
      "date": "2026-01-22",
      "id": "143207",
      "original_text": "Einreichung neuer Dokumente\nNiedersachsen Amtsgericht Osnabrück HRB 203550\nArtland Bäderbetriebsgesellschaft mbH – Quakenbrück",
      "type": "Einreichung neuer Dokumente",
      "state": "Niedersachsen",
      "amtsgericht": "Amtsgericht Osnabrück",
      "registernummer": "HRB 203550",
      "registerart": "HRB",
      "company_name": "Artland Bäderbetriebsgesellschaft mbH",
      "company_seat": "Quakenbrück",
      "details": "22.01.2026 (Bekanntmachungsdatum)\n\nNiedersachsen Amtsgericht Osnabrück HRB 203550\nEinreichung neuer Dokumente 22.01.2026 (Eintragungsdatum)\n\nArtland Bäderbetriebsgesellschaft mbH\nGesellschaft mit beschränkter Haftung\nQuakenbrück\n\nDie Liste der Mitglieder des Aufsichtsrats wurde beim Registergericht eingereicht."
    },
    {
      "date": "2026-01-22",
      "id": "143208",
      "original_text": "Löschungsankündigung\nNiedersachsen Amtsgericht Oldenburg (Oldenburg) HRB 211780\nAndrej Fuchs Bauunternehmen GmbH – Westerstede",
      "type": "Löschungsankündigung",
      "state": "Niedersachsen",
      "amtsgericht": "Amtsgericht Oldenburg (Oldenburg)",
      "registernummer": "HRB 211780",
      "registerart": "HRB",
      "company_name": "Andrej Fuchs Bauunternehmen GmbH",
      "company_seat": "Westerstede",
      "details": "22.01.2026 (Bekanntmachungsdatum)\n\nNiedersachsen Amtsgericht Oldenburg (Oldenburg) HRB 211780\nLöschungsankündigung\n\nAndrej Fuchs Bauunternehmen GmbH\nGesellschaft mit beschränkter Haftung\nWesterstede\n\nDas Registergericht beabsichtigt, die Gesellschaft von Amts wegen nach § 394 FamFG zu löschen. Die Frist zur Erhebung eines Widerspruchs ist auf 1 Monat ab dieser Registerbekanntmachung festgesetzt."
    },
    {
      "date": "2026-01-22",
      "id": "143209",
      "original_text": "Einreichung neuer Dokumente\nNiedersachsen Amtsgericht Oldenburg (Oldenburg) GnR 534\nRaiffeisen - Wohnungsbaugenossenschaft eG – Oldenburg",
      "type": "Einreichung neuer Dokumente",
      "state": "Niedersachsen",
      "amtsgericht": "Amtsgericht Oldenburg (Oldenburg)",
      "registernummer": "GnR 534",
      "registerart": "GnR",
      "company_name": "Raiffeisen - Wohnungsbaugenossenschaft eG",
      "company_seat": "Oldenburg",
      "details": "22.01.2026 (Bekanntmachungsdatum)\n\nNiedersachsen Amtsgericht Oldenburg (Oldenburg) GnR 534\nEinreichung neuer Dokumente 22.01.2026 (Eintragungsdatum)\n\nRaiffeisen - Wohnungsbaugenossenschaft eG\neingetragene Genossenschaft\nOldenburg\n\nDie Liste der Mitglieder des Aufsichtsrats wurde beim Registergericht eingereicht."
    },
    {
      "date": "2026-01-22",
      "id": "143210",
      "original_text": "Registerbekanntmachung nach dem Umwandlungsgesetz\nNiedersachsen Amtsgericht Osnabrück HRA 209558\nMaik Vor der Wöste Elektroinstallationen e. K. – Bramsche",
      "type": "Registerbekanntmachung nach dem Umwandlungsgesetz",
      "state": "Niedersachsen",
      "amtsgericht": "Amtsgericht Osnabrück",
      "registernummer": "HRA 209558",
      "registerart": "HRA",
      "company_name": "Maik Vor der Wöste Elektroinstallationen e. K.",
      "company_seat": "Bramsche",
      "details": "22.01.2026 (Bekanntmachungsdatum)\n\nNiedersachsen Amtsgericht Osnabrück HRA 209558\nRegisterbekanntmachung nach dem Umwandlungsgesetz 22.01.2026 (Eintragungsdatum)\n\nMaik Vor der Wöste Elektroinstallationen e. K.\nEinzelkaufmann / Einzelkauffrau\nBramsche\n\nDen Gläubigern der an der Ausgliederung beteiligten Rechtsträger ist, wenn sie binnen sechs Monaten nach dem Tag, an dem die Eintragung der Ausgliederung in das Register des Sitzes desjenigen Rechtsträgers, dessen Gläubiger sie sind, nach § 19 Abs. 3 UmwG als bekannt gemacht gilt, ihren Anspruch nach Grund und Höhe schriftlich anmelden, Sicherheit zu leisten, soweit sie nicht Befriedigung verlangen können. Dieses Recht steht den Gläubigern jedoch nur zu, wenn sie glaubhaft machen, dass durch die Ausgliederung die Erfüllung der Forderung gefährdet wird."
    },
    {
      "date": "2026-01-22",
      "id": "143211",
      "original_text": "Sonstige Registerbekanntmachung\nNiedersachsen Amtsgericht Hannover HRB 211924\nHDI Global Specialty SE – Hannover",
      "type": "Sonstige Registerbekanntmachung",
      "state": "Niedersachsen",
      "amtsgericht": "Amtsgericht Hannover",
      "registernummer": "HRB 211924",
      "registerart": "HRB",
      "company_name": "HDI Global Specialty SE",
      "company_seat": "Hannover",
      "details": "22.01.2026 (Bekanntmachungsdatum)\n\nNiedersachsen Amtsgericht Hannover HRB 211924\nSonstige Registerbekanntmachung\n\nHDI Global Specialty SE\nEuropäische Aktiengesellschaft (SE)\nHannover\n\nDie Liste der Mitglieder des Aufsichtsrats wurde beim Registergericht eingereicht."
    },
    {
      "date": "2026-01-22",
      "id": "143212",
      "original_text": "Registerbekanntmachung nach dem Umwandlungsgesetz\nNiedersachsen Amtsgericht Oldenburg (Oldenburg) HRB 210818\nCartesio Immobilien UG (haftungsbeschränkt) – Bad Zwischenahn",
      "type": "Registerbekanntmachung nach dem Umwandlungsgesetz",
      "state": "Niedersachsen",
      "amtsgericht": "Amtsgericht Oldenburg (Oldenburg)",
      "registernummer": "HRB 210818",
      "registerart": "HRB",
      "company_name": "Cartesio Immobilien UG (haftungsbeschränkt)",
      "company_seat": "Bad Zwischenahn",
      "details": "22.01.2026 (Bekanntmachungsdatum)\n\nNiedersachsen Amtsgericht Oldenburg (Oldenburg) HRB 210818\nRegisterbekanntmachung nach dem Umwandlungsgesetz 22.01.2026 (Eintragungsdatum)\n\nCartesio Immobilien UG (haftungsbeschränkt)\nGesellschaft mit beschränkter Haftung\nBad Zwischenahn\n\nDen Gläubigern der an der Verschmelzung beteiligten Rechtsträger ist, wenn sie binnen sechs Monaten nach dem Tag, an dem die Eintragung der Verschmelzung in das Register des Sitzes desjenigen Rechtsträgers, dessen Gläubiger sie sind, nach § 19  Abs.  3 UmwG als bekannt gemacht gilt, ihren Anspruch nach Grund und Höhe schriftlich anmelden, Sicherheit zu leisten, soweit sie nicht Befriedigung verlangen können. Dieses Recht steht den Gläubigern jedoch nur zu, wenn sie glaubhaft machen, dass durch die Verschmelzung die Erfüllung der Forderung gefährdet wird."
    },
    {
      "date": "2026-01-22",
      "id": "143213",
      "original_text": "Registerbekanntmachung nach dem Umwandlungsgesetz\nNiedersachsen Amtsgericht Oldenburg (Oldenburg) HRB 211532\nCartesio GmbH – Bad Zwischenahn",
      "type": "Registerbekanntmachung nach dem Umwandlungsgesetz",
      "state": "Niedersachsen",
      "amtsgericht": "Amtsgericht Oldenburg (Oldenburg)",
      "registernummer": "HRB 211532",
      "registerart": "HRB",
      "company_name": "Cartesio GmbH",
      "company_seat": "Bad Zwischenahn",
      "details": "22.01.2026 (Bekanntmachungsdatum)\n\nNiedersachsen Amtsgericht Oldenburg (Oldenburg) HRB 211532\nRegisterbekanntmachung nach dem Umwandlungsgesetz 22.01.2026 (Eintragungsdatum)\n\nCartesio GmbH\nGesellschaft mit beschränkter Haftung\nBad Zwischenahn\n\nDen Gläubigern der an der Verschmelzung beteiligten Rechtsträger ist, wenn sie binnen sechs Monaten nach dem Tag, an dem die Eintragung der Verschmelzung in das Register des Sitzes desjenigen Rechtsträgers, dessen Gläubiger sie sind, nach § 19  Abs.  3 UmwG als bekannt gemacht gilt, ihren Anspruch nach Grund und Höhe schriftlich anmelden, Sicherheit zu leisten, soweit sie nicht Befriedigung verlangen können. Dieses Recht steht den Gläubigern jedoch nur zu, wenn sie glaubhaft machen, dass durch die Verschmelzung die Erfüllung der Forderung gefährdet wird."
    },
    {
      "date": "2026-01-22",
      "id": "143214",
      "original_text": "Einreichung neuer Dokumente\nNiedersachsen Amtsgericht Hannover HRB 60320\nHDI Global SE – Hannover",
      "type": "Einreichung neuer Dokumente",
      "state": "Niedersachsen",
      "amtsgericht": "Amtsgericht Hannover",
      "registernummer": "HRB 60320",
      "registerart": "HRB",
      "company_name": "HDI Global SE",
      "company_seat": "Hannover",
      "details": "22.01.2026 (Bekanntmachungsdatum)\n\nNiedersachsen Amtsgericht Hannover HRB 60320\nEinreichung neuer Dokumente\n\nHDI Global SE\nEuropäische Aktiengesellschaft (SE)\nHannover\n\nDie Liste der Mitglieder des Aufsichtsrats wurde beim Registergericht eingereicht."
    },
    {
      "date": "2026-01-22",
      "id": "143215",
      "original_text": "Registerbekanntmachung nach dem Umwandlungsgesetz\nNiedersachsen Amtsgericht Aurich HRB 202090\nRE Interior GmbH – Aurich",
      "type": "Registerbekanntmachung nach dem Umwandlungsgesetz",
      "state": "Niedersachsen",
      "amtsgericht": "Amtsgericht Aurich",
      "registernummer": "HRB 202090",
      "registerart": "HRB",
      "company_name": "RE Interior GmbH",
      "company_seat": "Aurich",
      "details": "22.01.2026 (Bekanntmachungsdatum)\n\nNiedersachsen Amtsgericht Aurich HRB 202090\nRegisterbekanntmachung nach dem Umwandlungsgesetz 22.01.2026 (Eintragungsdatum)\n\nRE Interior GmbH\nGesellschaft mit beschränkter Haftung\nAurich\n\nDen Gläubigern der an der Verschmelzung beteiligten Rechtsträger ist, wenn sie binnen sechs Monaten nach dem Tag, an dem die Eintragung der Verschmelzung in das Register des Sitzes desjenigen Rechtsträgers, dessen Gläubiger sie sind, nach § 19  Abs.  3 UmwG als bekannt gemacht gilt, ihren Anspruch nach Grund und Höhe schriftlich anmelden, Sicherheit zu leisten, soweit sie nicht Befriedigung verlangen können. Dieses Recht steht den Gläubigern jedoch nur zu, wenn sie glaubhaft machen, dass durch die Verschmelzung die Erfüllung der Forderung gefährdet wird."
    },
    {
      "date": "2026-01-22",
      "id": "143216",
      "original_text": "Löschungsankündigung\nRheinland-Pfalz Amtsgericht Kaiserslautern HRB 30893\nWK innovatives Bauen GmbH – Kaiserslautern",
      "type": "Löschungsankündigung",
      "state": "Rheinland-Pfalz",
      "amtsgericht": "Amtsgericht Kaiserslautern",
      "registernummer": "HRB 30893",
      "registerart": "HRB",
      "company_name": "WK innovatives Bauen GmbH",
      "company_seat": "Kaiserslautern",
      "details": "22.01.2026 (Bekanntmachungsdatum)\n\nRheinland-Pfalz Amtsgericht Kaiserslautern HRB 30893\nLöschungsankündigung 22.01.2026 (Eintragungsdatum)\n\nWK innovatives Bauen GmbH\nGesellschaft mit beschränkter Haftung\nKaiserslautern\n\nDas Registergericht beabsichtigt die Gesellschaft von Amts wegen nach § 394 FamFG wegen Vermögenslosigkeit zu löschen. Die Frist zur Erhebung eines Widerspruchs ist auf drei Monate festgesetzt."
    },
    {
      "date": "2026-01-22",
      "id": "143217",
      "original_text": "Einreichung neuer Dokumente\nRheinland-Pfalz Amtsgericht Zweibrücken HRB 23025\nWirtschaftsförderungsgesellschaft Südwestpfalz mbH – Pirmasens",
      "type": "Einreichung neuer Dokumente",
      "state": "Rheinland-Pfalz",
      "amtsgericht": "Amtsgericht Zweibrücken",
      "registernummer": "HRB 23025",
      "registerart": "HRB",
      "company_name": "Wirtschaftsförderungsgesellschaft Südwestpfalz mbH",
      "company_seat": "Pirmasens",
      "details": "22.01.2026 (Bekanntmachungsdatum)\n\nRheinland-Pfalz Amtsgericht Zweibrücken HRB 23025\nEinreichung neuer Dokumente\n\nWirtschaftsförderungsgesellschaft Südwestpfalz mbH\nGesellschaft mit beschränkter Haftung\nPirmasens\n\nDem Registergericht ist eine Liste der Mitglieder des Aufsichtsrates eingereicht worden."
    },
    {
      "date": "2026-01-22",
      "id": "143218",
      "original_text": "Einreichung neuer Dokumente\nNordrhein-Westfalen Amtsgericht Essen HRB 22921\nVivawest Wohnen GmbH – Essen",
      "type": "Einreichung neuer Dokumente",
      "state": "Nordrhein-Westfalen",
      "amtsgericht": "Amtsgericht Essen",
      "registernummer": "HRB 22921",
      "registerart": "HRB",
      "company_name": "Vivawest Wohnen GmbH",
      "company_seat": "Essen",
      "details": "22.01.2026 (Bekanntmachungsdatum)\n\nNordrhein-Westfalen Amtsgericht Essen HRB 22921\nEinreichung neuer Dokumente\n\nVivawest Wohnen GmbH\nGesellschaft mit beschränkter Haftung\nEssen\n\nDem Registergericht ist eine neue Liste der Mitglieder des Aufsichtsrates eingereicht worden."
    },
    {
      "date": "2026-01-22",
      "id": "143219",
      "original_text": "Sonstige Registerbekanntmachung\nNordrhein-Westfalen Amtsgericht Recklinghausen HRB 8637\nStadtwerke Recklinghausen GmbH – Recklinghausen",
      "type": "Sonstige Registerbekanntmachung",
      "state": "Nordrhein-Westfalen",
      "amtsgericht": "Amtsgericht Recklinghausen",
      "registernummer": "HRB 8637",
      "registerart": "HRB",
      "company_name": "Stadtwerke Recklinghausen GmbH",
      "company_seat": "Recklinghausen",
      "details": "22.01.2026 (Bekanntmachungsdatum)\n\nNordrhein-Westfalen Amtsgericht Recklinghausen HRB 8637\nSonstige Registerbekanntmachung\n\nStadtwerke Recklinghausen GmbH\nGesellschaft mit beschränkter Haftung\nRecklinghausen\n\nDem Registergericht ist eine neue Liste der Mitglieder des Aufsichtsrates eingereicht worden."
    },
    {
      "date": "2026-01-22",
      "id": "143220",
      "original_text": "Sonstige Registerbekanntmachung\nNordrhein-Westfalen Amtsgericht Düsseldorf HRB 96664\nLEG Baltic GmbH – Düsseldorf",
      "type": "Sonstige Registerbekanntmachung",
      "state": "Nordrhein-Westfalen",
      "amtsgericht": "Amtsgericht Düsseldorf",
      "registernummer": "HRB 96664",
      "registerart": "HRB",
      "company_name": "LEG Baltic GmbH",
      "company_seat": "Düsseldorf",
      "details": "22.01.2026 (Bekanntmachungsdatum)\n\nNordrhein-Westfalen Amtsgericht Düsseldorf HRB 96664\nSonstige Registerbekanntmachung 22.01.2026 (Eintragungsdatum)\n\nLEG Baltic GmbH\nGesellschaft mit beschränkter Haftung\nDüsseldorf\n\nAls nicht eingetragen wird veröffentlicht: Den Gläubigern der Gesellschaft, deren Forderungen begründet worden sind bevor die Eintragung der Beendigung des Gewinnabführungsvertrages  in das Handelsregister nach § 10 des Handelsgesetzbuches als bekanntgemacht gilt, hat der andere Vertragsteil Sicherheit zu leisten, wenn sie sich binnen sechs Monaten nach der Bekanntmachung der Eintragung zu diesem Zweck bei ihm melden."
    },
    {
      "date": "2026-01-22",
      "id": "143221",
      "original_text": "Einreichung neuer Dokumente\nNordrhein-Westfalen Amtsgericht Essen HRB 19621\nVivawest GmbH – Essen",
      "type": "Einreichung neuer Dokumente",
      "state": "Nordrhein-Westfalen",
      "amtsgericht": "Amtsgericht Essen",
      "registernummer": "HRB 19621",
      "registerart": "HRB",
      "company_name": "Vivawest GmbH",
      "company_seat": "Essen",
      "details": "22.01.2026 (Bekanntmachungsdatum)\n\nNordrhein-Westfalen Amtsgericht Essen HRB 19621\nEinreichung neuer Dokumente\n\nVivawest GmbH\nGesellschaft mit beschränkter Haftung\nEssen\n\nDem Registergericht ist eine neue Liste der Mitglieder des Aufsichtsrates eingereicht worden."
    },
    {
      "date": "2026-01-22",
      "id": "143222",
      "original_text": "Löschungsankündigung\nNordrhein-Westfalen Amtsgericht Wuppertal HRB 24149\nMB Beheer GmbH – Wülfrath",
      "type": "Löschungsankündigung",
      "state": "Nordrhein-Westfalen",
      "amtsgericht": "Amtsgericht Wuppertal",
      "registernummer": "HRB 24149",
      "registerart": "HRB",
      "company_name": "MB Beheer GmbH",
      "company_seat": "Wülfrath",
      "details": "22.01.2026 (Bekanntmachungsdatum)\n\nNordrhein-Westfalen Amtsgericht Wuppertal HRB 24149\nLöschungsankündigung\n\nMB Beheer GmbH\nGesellschaft mit beschränkter Haftung\nWülfrath\n\nDas Registergericht beabsichtigt die Gesellschaft von Amts wegen nach § 394 FamFG zu löschen. Die Frist zur Erhebung eines Widerspruchs ist auf einen Monat festgesetzt."
    },
    {
      "date": "2026-01-22",
      "id": "143223",
      "original_text": "Registerbekanntmachung nach dem Umwandlungsgesetz\nNordrhein-Westfalen Amtsgericht Köln HRB 122046\nempact renewables 3 GmbH – Köln",
      "type": "Registerbekanntmachung nach dem Umwandlungsgesetz",
      "state": "Nordrhein-Westfalen",
      "amtsgericht": "Amtsgericht Köln",
      "registernummer": "HRB 122046",
      "registerart": "HRB",
      "company_name": "empact renewables 3 GmbH",
      "company_seat": "Köln",
      "details": "22.01.2026 (Bekanntmachungsdatum)\n\nNordrhein-Westfalen Amtsgericht Köln HRB 122046\nRegisterbekanntmachung nach dem Umwandlungsgesetz 22.01.2026 (Eintragungsdatum)\n\nempact renewables 3 GmbH\nGesellschaft mit beschränkter Haftung\nKöln\n\nDen Gläubigern der an der Verschmelzung beteiligten Rechtsträger ist, wenn sie binnen sechs Monaten nach dem Tag, an dem die Eintragung der Verschmelzung in das Register des Sitzes desjenigen Rechtsträgers, dessen Gläubiger sie sind, nach § 19 Absatz 3 UmwG als bekanntgemacht gilt, ihren Anspruch nach Grund und Höhe schriftlich anmelden, Sicherheit zu leisten, soweit sie nicht Befriedigung verlangen können. Dieses Recht steht den Gläubigern jedoch nur zu, wenn sie glaubhaft machen, dass durch die Verschmelzung die Erfüllung ihrer Forderung gefährdet wird."
    },
    {
      "date": "2026-01-22",
      "id": "143224",
      "original_text": "Einreichung neuer Dokumente\nNordrhein-Westfalen Amtsgericht Bonn HRB 18841\nDHL Home Delivery GmbH – Bonn",
      "type": "Einreichung neuer Dokumente",
      "state": "Nordrhein-Westfalen",
      "amtsgericht": "Amtsgericht Bonn",
      "registernummer": "HRB 18841",
      "registerart": "HRB",
      "company_name": "DHL Home Delivery GmbH",
      "company_seat": "Bonn",
      "details": "22.01.2026 (Bekanntmachungsdatum)\n\nNordrhein-Westfalen Amtsgericht Bonn HRB 18841\nEinreichung neuer Dokumente\n\nDHL Home Delivery GmbH\nGesellschaft mit beschränkter Haftung\nBonn\n\nDem Registergericht ist eine neue Liste der Mitglieder des Aufsichtsrates eingereicht worden."
    },
    {
      "date": "2026-01-22",
      "id": "143225",
      "original_text": "Einreichung neuer Dokumente\nNordrhein-Westfalen Amtsgericht Düsseldorf HRB 11971\nODDO BHF Asset Management GmbH – Düsseldorf",
      "type": "Einreichung neuer Dokumente",
      "state": "Nordrhein-Westfalen",
      "amtsgericht": "Amtsgericht Düsseldorf",
      "registernummer": "HRB 11971",
      "registerart": "HRB",
      "company_name": "ODDO BHF Asset Management GmbH",
      "company_seat": "Düsseldorf",
      "details": "22.01.2026 (Bekanntmachungsdatum)\n\nNordrhein-Westfalen Amtsgericht Düsseldorf HRB 11971\nEinreichung neuer Dokumente\n\nODDO BHF Asset Management GmbH\nGesellschaft mit beschränkter Haftung\nDüsseldorf\n\nDem Registergericht ist eine neue Liste der Mitglieder des Aufsichtsrates eingereicht worden."
    },
    {
      "date": "2026-01-22",
      "id": "143226",
      "original_text": "Registerbekanntmachung nach dem Umwandlungsgesetz\nNordrhein-Westfalen Amtsgericht Köln HRB 108226\nempact GmbH – Köln",
      "type": "Registerbekanntmachung nach dem Umwandlungsgesetz",
      "state": "Nordrhein-Westfalen",
      "amtsgericht": "Amtsgericht Köln",
      "registernummer": "HRB 108226",
      "registerart": "HRB",
      "company_name": "empact GmbH",
      "company_seat": "Köln",
      "details": "22.01.2026 (Bekanntmachungsdatum)\n\nNordrhein-Westfalen Amtsgericht Köln HRB 108226\nRegisterbekanntmachung nach dem Umwandlungsgesetz 22.01.2026 (Eintragungsdatum)\n\nempact GmbH\nGesellschaft mit beschränkter Haftung\nKöln\n\nDen Gläubigern der an der Verschmelzung beteiligten Rechtsträger ist, wenn sie binnen sechs Monaten nach dem Tag, an dem die Eintragung der Verschmelzung in das Register des Sitzes desjenigen Rechtsträgers, dessen Gläubiger sie sind, nach § 19 Absatz 3 UmwG als bekanntgemacht gilt, ihren Anspruch nach Grund und Höhe schriftlich anmelden, Sicherheit zu leisten, soweit sie nicht Befriedigung verlangen können. Dieses Recht steht den Gläubigern jedoch nur zu, wenn sie glaubhaft machen, dass durch die Verschmelzung die Erfüllung ihrer Forderung gefährdet wird."
    },
    {
      "date": "2026-01-22",
      "id": "143227",
      "original_text": "Löschungsankündigung\nNordrhein-Westfalen Amtsgericht Siegen HRB 9741\nPauls Berge- und Abschleppdienst UG (haftungsbeschränkt) – Siegen",
      "type": "Löschungsankündigung",
      "state": "Nordrhein-Westfalen",
      "amtsgericht": "Amtsgericht Siegen",
      "registernummer": "HRB 9741",
      "registerart": "HRB",
      "company_name": "Pauls Berge- und Abschleppdienst UG (haftungsbeschränkt)",
      "company_seat": "Siegen",
      "details": "22.01.2026 (Bekanntmachungsdatum)\n\nNordrhein-Westfalen Amtsgericht Siegen HRB 9741\nLöschungsankündigung\n\nPauls Berge- und Abschleppdienst UG (haftungsbeschränkt)\nGesellschaft mit beschränkter Haftung\nSiegen\n\nDas Registergericht beabsichtigt die Gesellschaft von Amts wegen nach § 394 FamFG zu löschen. Die Frist zur Erhebung eines Widerspruchs ist auf drei Monate festgesetzt."
    },
    {
      "date": "2026-01-22",
      "id": "143228",
      "original_text": "Löschungsankündigung\nNordrhein-Westfalen Amtsgericht Düsseldorf HRB 101777\nDelta A.V.B. Solutions GmbH – Düsseldorf",
      "type": "Löschungsankündigung",
      "state": "Nordrhein-Westfalen",
      "amtsgericht": "Amtsgericht Düsseldorf",
      "registernummer": "HRB 101777",
      "registerart": "HRB",
      "company_name": "Delta A.V.B. Solutions GmbH",
      "company_seat": "Düsseldorf",
      "details": "22.01.2026 (Bekanntmachungsdatum)\n\nNordrhein-Westfalen Amtsgericht Düsseldorf HRB 101777\nLöschungsankündigung\n\nDelta A.V.B. Solutions GmbH\nGesellschaft mit beschränkter Haftung\nDüsseldorf\n\nDas Registergericht beabsichtigt die Gesellschaft von Amts wegen nach § 394 FamFG zu löschen. Die Frist zur Erhebung eines Widerspruchs ist auf 3 Wochen festgesetzt.\n\nRechtsbehelfsbelehrung:\nDas Widerspruchsrecht steht jedem zu, der an der Unterlassung der Löschung ein berechtigtes Interesse hat. Der Widerspruch ist bei dem Amtsgericht Düsseldorf -Registergericht-, Werdener Straße 1, 40227 Düsseldorf schriftlich in deutscher Sprache oder zur Niederschrift der Geschäftsstelle einzulegen. Der Widerspruch kann auch zur Niederschrift der Geschäftsstelle eines jeden Amtsgerichtes abgegeben werden. Die Einlegung ist auch durch Übertragung eines elektronischen Dokuments an die elektronische Poststelle des Gerichts möglich. Das elektronische Dokument muss für die Bearbeitung durch das Gericht geeignet und mit einer qualifizierten elektronischen Signatur der verantwortenden Person versehen sein oder von der verantwortenden Person signiert und auf einem sicheren Übermittlungsweg gemäß § 130a ZPO nach näherer Maßgabe der Verordnung über die technischen Rahmenbedingungen des elektronischen Rechtsverkehrs und über das besondere elektronische Behördenpostfach (BGBl. I, S.3803) eingereicht werden. Weitere Informationen erhalten Sie auf der Internetseite www.justiz.de.\nDer Widerspruch muss spätestens innerhalb der gesetzten Frist nach dem Datum der Bekanntmachung der Löschungsankündigung bei dem Amtsgericht - Registergericht - Düsseldorf eingegangen sein.  Dies gilt auch dann, wenn der Widerspruch zur Niederschrift der Geschäftsstelle eines anderen Amtsgerichtes abgegeben wurde. Die Frist beginnt mit dem Tage der Bekanntmachung der Löschungsankündigung in dem für die Bekanntmachung der Eintragungen in das Handelsregister bestimmten elektronischen Informations- und Kommunikationssystem nach § 10 des Handelsgesetzbuches. Fällt das Ende der Frist auf einen Sonntag, einen allgemeinen Feiertag oder Sonnabend, so endet die Frist mit Ablauf des nächsten Werktages.\nDer Widerspruch muss die Bezeichnung der angefochtenen Löschungsankündigung sowie die Erklärung enthalten, dass Widerspruch gegen diese Löschungsankündigung eingelegt wird. Er ist zu unterzeichnen und soll begründet werden."
    },
    {
      "date": "2026-01-22",
      "id": "143229",
      "original_text": "Löschungsankündigung\nNordrhein-Westfalen Amtsgericht Münster HRB 16836\nMS Eventmanagement UG (haftungsbeschränkt) – Münster",
      "type": "Löschungsankündigung",
      "state": "Nordrhein-Westfalen",
      "amtsgericht": "Amtsgericht Münster",
      "registernummer": "HRB 16836",
      "registerart": "HRB",
      "company_name": "MS Eventmanagement UG (haftungsbeschränkt)",
      "company_seat": "Münster",
      "details": "22.01.2026 (Bekanntmachungsdatum)\n\nNordrhein-Westfalen Amtsgericht Münster HRB 16836\nLöschungsankündigung\n\nMS Eventmanagement UG (haftungsbeschränkt)\nGesellschaft mit beschränkter Haftung\nMünster\n\nDas Registergericht beabsichtigt die Gesellschaft von Amts wegen nach § 394 FamFG zu löschen. Die Frist zur Erhebung eines Widerspruchs ist auf 3 Wochen festgesetzt."
    },
    {
      "date": "2026-01-22",
      "id": "143230",
      "original_text": "Registerbekanntmachung nach dem Umwandlungsgesetz\nNordrhein-Westfalen Amtsgericht Köln HRB 122012\nempact renewables 4 GmbH – Köln",
      "type": "Registerbekanntmachung nach dem Umwandlungsgesetz",
      "state": "Nordrhein-Westfalen",
      "amtsgericht": "Amtsgericht Köln",
      "registernummer": "HRB 122012",
      "registerart": "HRB",
      "company_name": "empact renewables 4 GmbH",
      "company_seat": "Köln",
      "details": "22.01.2026 (Bekanntmachungsdatum)\n\nNordrhein-Westfalen Amtsgericht Köln HRB 122012\nRegisterbekanntmachung nach dem Umwandlungsgesetz 22.01.2026 (Eintragungsdatum)\n\nempact renewables 4 GmbH\nGesellschaft mit beschränkter Haftung\nKöln\n\nDen Gläubigern der an der Verschmelzung beteiligten Rechtsträger ist, wenn sie binnen sechs Monaten nach dem Tag, an dem die Eintragung der Verschmelzung in das Register des Sitzes desjenigen Rechtsträgers, dessen Gläubiger sie sind, nach § 19 Absatz 3 UmwG als bekanntgemacht gilt, ihren Anspruch nach Grund und Höhe schriftlich anmelden, Sicherheit zu leisten, soweit sie nicht Befriedigung verlangen können. Dieses Recht steht den Gläubigern jedoch nur zu, wenn sie glaubhaft machen, dass durch die Verschmelzung die Erfüllung ihrer Forderung gefährdet wird."
    },
    {
      "date": "2026-01-22",
      "id": "143231",
      "original_text": "Registerbekanntmachung nach dem Umwandlungsgesetz\nNordrhein-Westfalen Amtsgericht Düsseldorf HRB 36884\nMETRO Advertising GmbH – Düsseldorf",
      "type": "Registerbekanntmachung nach dem Umwandlungsgesetz",
      "state": "Nordrhein-Westfalen",
      "amtsgericht": "Amtsgericht Düsseldorf",
      "registernummer": "HRB 36884",
      "registerart": "HRB",
      "company_name": "METRO Advertising GmbH",
      "company_seat": "Düsseldorf",
      "details": "22.01.2026 (Bekanntmachungsdatum)\n\nNordrhein-Westfalen Amtsgericht Düsseldorf HRB 36884\nRegisterbekanntmachung nach dem Umwandlungsgesetz 22.01.2026 (Eintragungsdatum)\n\nMETRO Advertising GmbH\nGesellschaft mit beschränkter Haftung\nDüsseldorf\n\nDen Gläubigern der an der Verschmelzung beteiligten Rechtsträger ist, wenn sie binnen sechs Monaten nach dem Tag, an dem die Eintragung der Verschmelzung in das Register des Sitzes desjenigen Rechtsträgers, dessen Gläubiger sie sind, nach § 19 Absatz 3 UmwG als bekanntgemacht gilt, ihren Anspruch nach Grund und Höhe schriftlich anmelden, Sicherheit zu leisten, soweit sie nicht Befriedigung verlangen können. Dieses Recht steht den Gläubigern jedoch nur zu, wenn sie glaubhaft machen, dass durch die Verschmelzung die Erfüllung ihrer Forderung gefährdet wird."
    },
    {
      "date": "2026-01-22",
      "id": "143232",
      "original_text": "Registerbekanntmachung nach dem Umwandlungsgesetz\nNordrhein-Westfalen Amtsgericht Lemgo HRB 7602\nWeBiCon UG (haftungsbeschränkt) – Lage",
      "type": "Registerbekanntmachung nach dem Umwandlungsgesetz",
      "state": "Nordrhein-Westfalen",
      "amtsgericht": "Amtsgericht Lemgo",
      "registernummer": "HRB 7602",
      "registerart": "HRB",
      "company_name": "WeBiCon UG (haftungsbeschränkt)",
      "company_seat": "Lage",
      "details": "22.01.2026 (Bekanntmachungsdatum)\n\nNordrhein-Westfalen Amtsgericht Lemgo HRB 7602\nRegisterbekanntmachung nach dem Umwandlungsgesetz 22.01.2026 (Eintragungsdatum)\n\nWeBiCon UG (haftungsbeschränkt)\nGesellschaft mit beschränkter Haftung\nLage\n\nDen Gläubigern der an der Verschmelzung beteiligten Rechtsträger ist, wenn sie binnen sechs Monaten nach dem Tag, an dem die Eintragung der Verschmelzung in das Register des Sitzes desjenigen Rechtsträgers, dessen Gläubiger sie sind, nach § 19 Absatz 3 UmwG als bekanntgemacht gilt, ihren Anspruch nach Grund und Höhe schriftlich anmelden, Sicherheit zu leisten, soweit sie nicht Befriedigung verlangen können. Dieses Recht steht den Gläubigern jedoch nur zu, wenn sie glaubhaft machen, dass durch die Verschmelzung die Erfüllung ihrer Forderung gefährdet wird."
    },
    {
      "date": "2026-01-22",
      "id": "143233",
      "original_text": "Einreichung neuer Dokumente\nNordrhein-Westfalen Amtsgericht Bonn HRB 10811\nVerbandswasserwerk Gesellschaft mit beschränkter Haftung – Euskirchen",
      "type": "Einreichung neuer Dokumente",
      "state": "Nordrhein-Westfalen",
      "amtsgericht": "Amtsgericht Bonn",
      "registernummer": "HRB 10811",
      "registerart": "HRB",
      "company_name": "Verbandswasserwerk Gesellschaft mit beschränkter Haftung",
      "company_seat": "Euskirchen",
      "details": "22.01.2026 (Bekanntmachungsdatum)\n\nNordrhein-Westfalen Amtsgericht Bonn HRB 10811\nEinreichung neuer Dokumente\n\nVerbandswasserwerk Gesellschaft mit beschränkter Haftung\nGesellschaft mit beschränkter Haftung\nEuskirchen\n\nDem Registergericht ist eine neue Liste der Mitglieder des Aufsichtsrates eingereicht worden."
    },
    {
      "date": "2026-01-22",
      "id": "143234",
      "original_text": "Löschungsankündigung\nNordrhein-Westfalen Amtsgericht Neuss HRB 22474\nGaranzia Facility Services UG (haftungsbeschränkt) – Meerbusch",
      "type": "Löschungsankündigung",
      "state": "Nordrhein-Westfalen",
      "amtsgericht": "Amtsgericht Neuss",
      "registernummer": "HRB 22474",
      "registerart": "HRB",
      "company_name": "Garanzia Facility Services UG (haftungsbeschränkt)",
      "company_seat": "Meerbusch",
      "details": "22.01.2026 (Bekanntmachungsdatum)\n\nNordrhein-Westfalen Amtsgericht Neuss HRB 22474\nLöschungsankündigung 20.01.2026 (Eintragungsdatum)\n\nGaranzia Facility Services UG (haftungsbeschränkt)\nGesellschaft mit beschränkter Haftung\nMeerbusch\n\nDas Registergericht beabsichtigt die Gesellschaft von Amts wegen nach § 394 FamFG zu löschen. Die Frist zur Erhebung eines Widerspruchs ist auf einen Monat festgesetzt. Rechtsbehelfsbelehrung: Gegen diese Verfügung können Sie Widerspruch einlegen. Der Widerspruch ist bei dem Amtsgericht Neuss - Registergericht -, Breite Str. 48, 41460 Neuss schriftlich in deutscher Sprache oder zur Niederschrift der Geschäftsstelle einzulegen. Der Widerspruch kann auch zur Niederschrift der Geschäftsstelle eines jeden Amtsgerichtes abgegeben werden. Die Einlegung ist auch durch Übertragung eines elektronischen Dokuments an die elektronische Poststelle des Gerichts möglich. Das elektronische Dokument muss für die Bearbeitung durch das Gericht geeignet und mit einer qualifizierten elektronischen Signatur der verantwortenden Person versehen sein oder von der verantwortenden Person signiert und auf einem sicheren Übermittlungsweg gemäß § 130a ZPO nach näherer Maßgabe der Verordnung über die technischen Rahmenbedingungen des elektronischen Rechtsverkehrs und über das besondere elektronische Behördenpostfach (BGBl. I, S.3803) eingereicht werden. Weitere Informationen erhalten Sie auf der Internetseite www.justiz.de. Der Widerspruch muss spätestens innerhalb der gesetzten Frist nach der schriftlichen Bekanntgabe der Verfügung bei dem Amtsgericht - Registergericht - Neuss eingegangen sein. Dies gilt auch dann, wenn der Widerspruch zur Niederschrift der Geschäftsstelle eines anderen Amtsgerichtes abgegeben wurde. Die Frist beginnt mit der schriftlichen Bekanntgabe der Verfügung. Die Bekanntgabe ist entweder durch Zustellung oder am dritten Tage nach Aufgabe zur Post bewirkt. Fällt das Ende der Frist auf einen Sonntag, einen allgemeinen Feiertag oder Sonnabend, so endet die Frist mit Ablauf des nächsten Werktages. Der Widerspruch muss die Bezeichnung der angefochtenen Verfügung sowie die Erklärung enthalten, dass Widerspruch gegen diese Verfügung eingelegt wird. Er ist zu unterzeichnen und soll begründet werden."
    },
    {
      "date": "2026-01-22",
      "id": "143235",
      "original_text": "Löschungsankündigung\nNordrhein-Westfalen Amtsgericht Köln HRB 86225\nFC Breezy Biking GmbH – Köln",
      "type": "Löschungsankündigung",
      "state": "Nordrhein-Westfalen",
      "amtsgericht": "Amtsgericht Köln",
      "registernummer": "HRB 86225",
      "registerart": "HRB",
      "company_name": "FC Breezy Biking GmbH",
      "company_seat": "Köln",
      "details": "22.01.2026 (Bekanntmachungsdatum)\n\nNordrhein-Westfalen Amtsgericht Köln HRB 86225\nLöschungsankündigung\n\nFC Breezy Biking GmbH\nGesellschaft mit beschränkter Haftung\nKöln\n\nDas Registergericht beabsichtigt die Gesellschaft von Amts wegen nach § 394 FamFG zu löschen. Die Frist zur Erhebung eines Widerspruchs ist auf einen Monat festgesetzt."
    },
    {
      "date": "2026-01-22",
      "id": "143236",
      "original_text": "Einreichung neuer Dokumente\nNordrhein-Westfalen Amtsgericht Köln HRB 64783\nMalteser Rettungsdienst gemeinnützige GmbH – Köln",
      "type": "Einreichung neuer Dokumente",
      "state": "Nordrhein-Westfalen",
      "amtsgericht": "Amtsgericht Köln",
      "registernummer": "HRB 64783",
      "registerart": "HRB",
      "company_name": "Malteser Rettungsdienst gemeinnützige GmbH",
      "company_seat": "Köln",
      "details": "22.01.2026 (Bekanntmachungsdatum)\n\nNordrhein-Westfalen Amtsgericht Köln HRB 64783\nEinreichung neuer Dokumente\n\nMalteser Rettungsdienst gemeinnützige GmbH\nGesellschaft mit beschränkter Haftung\nKöln\n\nDem Registergericht ist eine neue Liste der Mitglieder des Aufsichtsrates eingereicht worden."
    },
    {
      "date": "2026-01-22",
      "id": "143237",
      "original_text": "Löschungsankündigung\nNordrhein-Westfalen Amtsgericht Gütersloh HRB 10943\nKarakaya Dienstleistung GmbH – Rheda-Wiedenbrück",
      "type": "Löschungsankündigung",
      "state": "Nordrhein-Westfalen",
      "amtsgericht": "Amtsgericht Gütersloh",
      "registernummer": "HRB 10943",
      "registerart": "HRB",
      "company_name": "Karakaya Dienstleistung GmbH",
      "company_seat": "Rheda-Wiedenbrück",
      "details": "22.01.2026 (Bekanntmachungsdatum)\n\nNordrhein-Westfalen Amtsgericht Gütersloh HRB 10943\nLöschungsankündigung 22.01.2026 (Eintragungsdatum)\n\nKarakaya Dienstleistung GmbH\nGesellschaft mit beschränkter Haftung\nRheda-Wiedenbrück\n\nDas Registergericht beabsichtigt die Gesellschaft von Amts wegen nach § 394 FamFG zu löschen. Die Frist zur Erhebung eines Widerspruchs ist auf einen Monat festgesetzt."
    },
    {
      "date": "2026-01-22",
      "id": "143238",
      "original_text": "Löschungsankündigung\nNordrhein-Westfalen Amtsgericht Mönchengladbach HRB 13704\nTopper Sun Energy Deutschland GmbH – Mönchengladbach",
      "type": "Löschungsankündigung",
      "state": "Nordrhein-Westfalen",
      "amtsgericht": "Amtsgericht Mönchengladbach",
      "registernummer": "HRB 13704",
      "registerart": "HRB",
      "company_name": "Topper Sun Energy Deutschland GmbH",
      "company_seat": "Mönchengladbach",
      "details": "22.01.2026 (Bekanntmachungsdatum)\n\nNordrhein-Westfalen Amtsgericht Mönchengladbach HRB 13704\nLöschungsankündigung 22.01.2026 (Eintragungsdatum)\n\nTopper Sun Energy Deutschland GmbH\nGesellschaft mit beschränkter Haftung\nMönchengladbach\n\nDas Registergericht beabsichtigt die Gesellschaft von Amts wegen nach § 394 FamFG zu löschen. Die Frist zur Erhebung eines Widerspruchs ist auf #DV.Fr(Text=\"Bitte wählen Sie die Widerspruchsfrist aus!\",Eingabe=\"einen Monat\",\"zwei Monate\",\"drei Monate\",\"#insert(Text=\"Freitext\")\"|\"freier Text\") festgesetzt."
    },
    {
      "date": "2026-01-22",
      "id": "143239",
      "original_text": "Einreichung neuer Dokumente\nNordrhein-Westfalen Amtsgericht Köln HRB 26997\nMalteser Hilfsdienst gemeinnützige GmbH – Köln",
      "type": "Einreichung neuer Dokumente",
      "state": "Nordrhein-Westfalen",
      "amtsgericht": "Amtsgericht Köln",
      "registernummer": "HRB 26997",
      "registerart": "HRB",
      "company_name": "Malteser Hilfsdienst gemeinnützige GmbH",
      "company_seat": "Köln",
      "details": "22.01.2026 (Bekanntmachungsdatum)\n\nNordrhein-Westfalen Amtsgericht Köln HRB 26997\nEinreichung neuer Dokumente\n\nMalteser Hilfsdienst gemeinnützige GmbH\nGesellschaft mit beschränkter Haftung\nKöln\n\nDem Registergericht ist eine Liste der Mitglieder des Aufsichtsrates eingereicht worden."
    },
    {
      "date": "2026-01-22",
      "id": "143240",
      "original_text": "Registerbekanntmachung nach dem Umwandlungsgesetz\nNordrhein-Westfalen Amtsgericht Essen PR 5654\nHDT Düvelmeyer Kuhlmann Moormann Partnerschaftsgesellschaft mbB Steuerberatungsgesellschaft – Stemwede-Levern",
      "type": "Registerbekanntmachung nach dem Umwandlungsgesetz",
      "state": "Nordrhein-Westfalen",
      "amtsgericht": "Amtsgericht Essen",
      "registernummer": "PR 5654",
      "registerart": "PR",
      "company_name": "HDT Düvelmeyer Kuhlmann Moormann Partnerschaftsgesellschaft mbB Steuerberatungsgesellschaft",
      "company_seat": "Stemwede-Levern",
      "details": "22.01.2026 (Bekanntmachungsdatum)\n\nNordrhein-Westfalen Amtsgericht Essen PR 5654\nRegisterbekanntmachung nach dem Umwandlungsgesetz 22.01.2026 (Eintragungsdatum)\n\nHDT Düvelmeyer Kuhlmann Moormann Partnerschaftsgesellschaft mbB Steuerberatungsgesellschaft\nPartnerschaftsgesellschaft\nStemwede-Levern\n\nDen Gläubigern der an der Abspaltung beteiligten Rechtsträger ist, wenn sie binnen sechs Monaten nach dem Tag, an dem die Eintragung der Abspaltung in das Register des Sitzes desjenigen Rechtsträgers, dessen Gläubiger sie sind, nach § 19 Absatz 3 UmwG als bekanntgemacht gilt, ihren Anspruch nach Grund und Höhe schriftlich anmelden, Sicherheit zu leisten, soweit sie nicht Befriedigung verlangen können. Dieses Recht steht den Gläubigern jedoch nur zu, wenn sie glaubhaft machen, dass durch die Abspaltung die Erfüllung ihrer Forderung gefährdet wird."
    },
    {
      "date": "2026-01-22",
      "id": "143241",
      "original_text": "Einreichung neuer Dokumente\nNordrhein-Westfalen Amtsgericht Köln HRB 26997\nMalteser Hilfsdienst gemeinnützige GmbH – Köln",
      "type": "Einreichung neuer Dokumente",
      "state": "Nordrhein-Westfalen",
      "amtsgericht": "Amtsgericht Köln",
      "registernummer": "HRB 26997",
      "registerart": "HRB",
      "company_name": "Malteser Hilfsdienst gemeinnützige GmbH",
      "company_seat": "Köln",
      "details": "22.01.2026 (Bekanntmachungsdatum)\n\nNordrhein-Westfalen Amtsgericht Köln HRB 26997\nEinreichung neuer Dokumente\n\nMalteser Hilfsdienst gemeinnützige GmbH\nGesellschaft mit beschränkter Haftung\nKöln\n\nDem Registergericht ist eine Liste der Mitglieder des Aufsichtsrates eingereicht worden."
    },
    {
      "date": "2026-01-22",
      "id": "143242",
      "original_text": "Registerbekanntmachung nach dem Umwandlungsgesetz\nNordrhein-Westfalen Amtsgericht Neuss HRB 14110\nSolufix GmbH – Meerbusch",
      "type": "Registerbekanntmachung nach dem Umwandlungsgesetz",
      "state": "Nordrhein-Westfalen",
      "amtsgericht": "Amtsgericht Neuss",
      "registernummer": "HRB 14110",
      "registerart": "HRB",
      "company_name": "Solufix GmbH",
      "company_seat": "Meerbusch",
      "details": "22.01.2026 (Bekanntmachungsdatum)\n\nNordrhein-Westfalen Amtsgericht Neuss HRB 14110\nRegisterbekanntmachung nach dem Umwandlungsgesetz 22.01.2026 (Eintragungsdatum)\n\nSolufix GmbH\nGesellschaft mit beschränkter Haftung\nMeerbusch\n\nDen Gläubigern der an der Verschmelzung beteiligten Rechtsträger ist, wenn sie binnen sechs Monaten nach dem Tag, an dem die Eintragung der Verschmelzung in das Register des Sitzes desjenigen Rechtsträgers, dessen Gläubiger sie sind, nach § 19 Absatz 3 UmwG als bekanntgemacht gilt, ihren Anspruch nach Grund und Höhe schriftlich anmelden, Sicherheit zu leisten, soweit sie nicht Befriedigung verlangen können. Dieses Recht steht den Gläubigern jedoch nur zu, wenn sie glaubhaft machen, dass durch die Verschmelzung die Erfüllung ihrer Forderung gefährdet wird."
    },
    {
      "date": "2026-01-22",
      "id": "143243",
      "original_text": "Einreichung neuer Dokumente\nNordrhein-Westfalen Amtsgericht Bochum HRB 9353 früher Amtsgericht Herne\nTGG Tagungsstätten- und Gastronomiegesellschaft Herne mbH – Herne",
      "type": "Einreichung neuer Dokumente",
      "state": "Nordrhein-Westfalen",
      "amtsgericht": "Amtsgericht Bochum",
      "registernummer": "HRB 9353",
      "registerart": "HRB",
      "company_name": "TGG Tagungsstätten- und Gastronomiegesellschaft Herne mbH",
      "company_seat": "Herne",
      "former_amtsgericht": "Herne",
      "details": "22.01.2026 (Bekanntmachungsdatum)\n\nNordrhein-Westfalen Amtsgericht Bochum HRB 9353 früher Amtsgericht Herne\nEinreichung neuer Dokumente 22.01.2026 (Eintragungsdatum)\n\nTGG Tagungsstätten- und Gastronomiegesellschaft Herne mbH\nGesellschaft mit beschränkter Haftung\nHerne\n\nDem Registergericht ist eine neue Liste der Mitglieder des Aufsichtsrates eingereicht worden."
    },
    {
      "date": "2026-01-22",
      "id": "143244",
      "original_text": "Einreichung neuer Dokumente\nNordrhein-Westfalen Amtsgericht Köln HRB 31597\nMalteser Deutschland gemeinnützige GmbH – Köln",
      "type": "Einreichung neuer Dokumente",
      "state": "Nordrhein-Westfalen",
      "amtsgericht": "Amtsgericht Köln",
      "registernummer": "HRB 31597",
      "registerart": "HRB",
      "company_name": "Malteser Deutschland gemeinnützige GmbH",
      "company_seat": "Köln",
      "details": "22.01.2026 (Bekanntmachungsdatum)\n\nNordrhein-Westfalen Amtsgericht Köln HRB 31597\nEinreichung neuer Dokumente\n\nMalteser Deutschland gemeinnützige GmbH\nGesellschaft mit beschränkter Haftung\nKöln\n\nDem Registergericht ist eine Liste der Mitglieder des Aufsichtsrates eingereicht worden."
    },
    {
      "date": "2026-01-22",
      "id": "143245",
      "original_text": "Registerbekanntmachung nach dem Umwandlungsgesetz\nNordrhein-Westfalen Amtsgericht Neuss HRB 12218\nSolufix GmbH – Meerbusch",
      "type": "Registerbekanntmachung nach dem Umwandlungsgesetz",
      "state": "Nordrhein-Westfalen",
      "amtsgericht": "Amtsgericht Neuss",
      "registernummer": "HRB 12218",
      "registerart": "HRB",
      "company_name": "Solufix GmbH",
      "company_seat": "Meerbusch",
      "details": "22.01.2026 (Bekanntmachungsdatum)\n\nNordrhein-Westfalen Amtsgericht Neuss HRB 12218\nRegisterbekanntmachung nach dem Umwandlungsgesetz 22.01.2026 (Eintragungsdatum)\n\nSolufix GmbH\nGesellschaft mit beschränkter Haftung\nMeerbusch\n\nDen Gläubigern der an der Verschmelzung beteiligten Rechtsträger ist, wenn sie binnen sechs Monaten nach dem Tag, an dem die Eintragung der Verschmelzung in das Register des Sitzes desjenigen Rechtsträgers, dessen Gläubiger sie sind, nach § 19 Absatz 3 UmwG als bekanntgemacht gilt, ihren Anspruch nach Grund und Höhe schriftlich anmelden, Sicherheit zu leisten, soweit sie nicht Befriedigung verlangen können. Dieses Recht steht den Gläubigern jedoch nur zu, wenn sie glaubhaft machen, dass durch die Verschmelzung die Erfüllung ihrer Forderung gefährdet wird."
    },
    {
      "date": "2026-01-22",
      "id": "143246",
      "original_text": "Löschungsankündigung\nThüringen Amtsgericht Jena HRB 514438\nIhr Fahrdienst UG (haftungsbeschränkt) – Zella-Mehlis",
      "type": "Löschungsankündigung",
      "state": "Thüringen",
      "amtsgericht": "Amtsgericht Jena",
      "registernummer": "HRB 514438",
      "registerart": "HRB",
      "company_name": "Ihr Fahrdienst UG (haftungsbeschränkt)",
      "company_seat": "Zella-Mehlis",
      "details": "22.01.2026 (Bekanntmachungsdatum)\n\nThüringen Amtsgericht Jena HRB 514438\nLöschungsankündigung\n\nIhr Fahrdienst UG (haftungsbeschränkt)\nGesellschaft mit beschränkter Haftung\nZella-Mehlis\n\nDas Registergericht beabsichtigt, die im Handelsregister eingetragene Gesellschaft wegen Vermögenslosigkeit nach § 394 FamFG von Amts wegen zu löschen. Die Frist zur Erhebung eines Widerspruchs gegen die beabsichtigte Löschung wird auf 6 Wochen festgesetzt."
    },
    {
      "date": "2026-01-22",
      "id": "143247",
      "original_text": "Sonstige Registerbekanntmachung\nThüringen Amtsgericht Jena HRB 514884\nIlmenauer Mechatronik GmbH – Ilmenau",
      "type": "Sonstige Registerbekanntmachung",
      "state": "Thüringen",
      "amtsgericht": "Amtsgericht Jena",
      "registernummer": "HRB 514884",
      "registerart": "HRB",
      "company_name": "Ilmenauer Mechatronik GmbH",
      "company_seat": "Ilmenau",
      "details": "22.01.2026 (Bekanntmachungsdatum)\n\nThüringen Amtsgericht Jena HRB 514884\nSonstige Registerbekanntmachung 22.01.2026 (Eintragungsdatum)\n\nIlmenauer Mechatronik GmbH\nGesellschaft mit beschränkter Haftung\nIlmenau\n\nNicht eingetragen: Den Gläubigern der Gesellschaft, deren Forderungen begründet worden sind, bevor die Eintragung der Beendigung des Vertrages in das Handelsregister nach § 10 des Handelsgesetzbuches als bekanntgemacht gilt, hat der andere Vertragsteil Sicherheit zu leisten, wenn sie sich binnen sechs Monaten nach der Bekanntmachung der Eintragung zu diesem Zweck bei ihm melden."
    },
    {
      "date": "2026-01-22",
      "id": "143248",
      "original_text": "Löschungsankündigung\nHessen Amtsgericht Darmstadt HRB 70785\nGunPort GmbH – Bad König",
      "type": "Löschungsankündigung",
      "state": "Hessen",
      "amtsgericht": "Amtsgericht Darmstadt",
      "registernummer": "HRB 70785",
      "registerart": "HRB",
      "company_name": "GunPort GmbH",
      "company_seat": "Bad König",
      "details": "22.01.2026 (Bekanntmachungsdatum)\n\nHessen Amtsgericht Darmstadt HRB 70785\nLöschungsankündigung\n\nGunPort GmbH\nGesellschaft mit beschränkter Haftung\nBad König\n\nDas Registergericht beabsichtigt die im Handelsregister eingetragene Gesellschaft von Amts wegen nach § 394 FamFG zu löschen. Die Frist zur Erhebung eines Widerspruchs gegen die beabsichtigte Löschung wird auf 3 Monate festgesetzt."
    },
    {
      "date": "2026-01-22",
      "id": "143249",
      "original_text": "Sonstige Registerbekanntmachung\nHessen Amtsgericht Frankfurt am Main HRB 117112\nMaxi Digital GmbH – Frankfurt am Main",
      "type": "Sonstige Registerbekanntmachung",
      "state": "Hessen",
      "amtsgericht": "Amtsgericht Frankfurt am Main",
      "registernummer": "HRB 117112",
      "registerart": "HRB",
      "company_name": "Maxi Digital GmbH",
      "company_seat": "Frankfurt am Main",
      "details": "22.01.2026 (Bekanntmachungsdatum)\n\nHessen Amtsgericht Frankfurt am Main HRB 117112\nSonstige Registerbekanntmachung 22.01.2026 (Eintragungsdatum)\n\nMaxi Digital GmbH\nGesellschaft mit beschränkter Haftung\nFrankfurt am Main\n\nDurch eine Änderung in den Personen der Aufsichtsratsmitglieder ist eine Liste der Mitglieder des Aufsichtsrates zum Handelsregister eingereicht worden."
    },
    {
      "date": "2026-01-22",
      "id": "143250",
      "original_text": "Einreichung neuer Dokumente\nHessen Amtsgericht Frankfurt am Main HRB 110880\nEMA European Medical Academy AG – Frankfurt am Main",
      "type": "Einreichung neuer Dokumente",
      "state": "Hessen",
      "amtsgericht": "Amtsgericht Frankfurt am Main",
      "registernummer": "HRB 110880",
      "registerart": "HRB",
      "company_name": "EMA European Medical Academy AG",
      "company_seat": "Frankfurt am Main",
      "details": "22.01.2026 (Bekanntmachungsdatum)\n\nHessen Amtsgericht Frankfurt am Main HRB 110880\nEinreichung neuer Dokumente 22.01.2026 (Eintragungsdatum)\n\nEMA European Medical Academy AG\nAktiengesellschaft\nFrankfurt am Main\n\nDurch eine Änderung in den Personen der Aufsichtsratsmitglieder ist eine Liste der Mitglieder des Aufsichtsrates zum Handelsregister eingereicht worden."
    },
    {
      "date": "2026-01-22",
      "id": "143251",
      "original_text": "Sonstige Registerbekanntmachung\nHessen Amtsgericht Frankfurt am Main HRB 141211\nBlitz 17-665 SE – Frankfurt am Main",
      "type": "Sonstige Registerbekanntmachung",
      "state": "Hessen",
      "amtsgericht": "Amtsgericht Frankfurt am Main",
      "registernummer": "HRB 141211",
      "registerart": "HRB",
      "company_name": "Blitz 17-665 SE",
      "company_seat": "Frankfurt am Main",
      "details": "22.01.2026 (Bekanntmachungsdatum)\n\nHessen Amtsgericht Frankfurt am Main HRB 141211\nSonstige Registerbekanntmachung 22.01.2026 (Eintragungsdatum)\n\nBlitz 17-665 SE\nEuropäische Aktiengesellschaft (SE)\nFrankfurt am Main\n\nDen Gläubigern der Gesellschaft, deren Forderungen begründet worden sind, bevor die Eintragung der Beendigung des Vertrags in das Handelsregister nach § 10 HGB bekannt gemacht worden ist, ist vom anderen Vertragsteil Sicherheit zu leisten, wenn sie sich binnen sechs Monaten nach dieser Bekanntmachung zu diesem Zweck bei ihm melden."
    },
    {
      "date": "2026-01-22",
      "id": "143252",
      "original_text": "Einreichung neuer Dokumente\nHessen Amtsgericht Frankfurt am Main HRB 85925\nUniversal-Investmentaktiengesellschaft mit Teilgesellschaftsvermögen – Frankfurt am Main",
      "type": "Einreichung neuer Dokumente",
      "state": "Hessen",
      "amtsgericht": "Amtsgericht Frankfurt am Main",
      "registernummer": "HRB 85925",
      "registerart": "HRB",
      "company_name": "Universal-Investmentaktiengesellschaft mit Teilgesellschaftsvermögen",
      "company_seat": "Frankfurt am Main",
      "details": "22.01.2026 (Bekanntmachungsdatum)\n\nHessen Amtsgericht Frankfurt am Main HRB 85925\nEinreichung neuer Dokumente 22.01.2026 (Eintragungsdatum)\n\nUniversal-Investmentaktiengesellschaft mit Teilgesellschaftsvermögen\nAktiengesellschaft\nFrankfurt am Main\n\nDurch eine Änderung in den Personen der Aufsichtsratsmitglieder ist eine Liste der Mitglieder des Aufsichtsrates zum Handelsregister eingereicht worden."
    },
    {
      "date": "2026-01-22",
      "id": "143253",
      "original_text": "Einreichung neuer Dokumente\nHessen Amtsgericht Kassel HRB 2084\nRaiffeisen Waren GmbH – Kassel",
      "type": "Einreichung neuer Dokumente",
      "state": "Hessen",
      "amtsgericht": "Amtsgericht Kassel",
      "registernummer": "HRB 2084",
      "registerart": "HRB",
      "company_name": "Raiffeisen Waren GmbH",
      "company_seat": "Kassel",
      "details": "22.01.2026 (Bekanntmachungsdatum)\n\nHessen Amtsgericht Kassel HRB 2084\nEinreichung neuer Dokumente\n\nRaiffeisen Waren GmbH\nGesellschaft mit beschränkter Haftung\nKassel\n\nDurch eine Änderung in den Personen der Aufsichtsratsmitglieder ist eine Liste der Mitglieder des Aufsichtsrates zum Handelsregister eingereicht worden."
    },
    {
      "date": "2026-01-22",
      "id": "143254",
      "original_text": "Registerbekanntmachung nach dem Umwandlungsgesetz\nHessen Amtsgericht Frankfurt am Main HRB 124633\nfintus GmbH – Frankfurt am Main",
      "type": "Registerbekanntmachung nach dem Umwandlungsgesetz",
      "state": "Hessen",
      "amtsgericht": "Amtsgericht Frankfurt am Main",
      "registernummer": "HRB 124633",
      "registerart": "HRB",
      "company_name": "fintus GmbH",
      "company_seat": "Frankfurt am Main",
      "details": "22.01.2026 (Bekanntmachungsdatum)\n\nHessen Amtsgericht Frankfurt am Main HRB 124633\nRegisterbekanntmachung nach dem Umwandlungsgesetz 22.01.2026 (Eintragungsdatum)\n\nfintus GmbH\nGesellschaft mit beschränkter Haftung\nFrankfurt am Main\n\nDen Gläubigern der an der Verschmelzung beteiligten Rechtsträger ist, wenn sie binnen sechs Monaten nach dem Tag, an dem die Eintragung der Verschmelzung in das Register des Sitzes desjenigen Rechtsträgers, dessen Gläubiger sie sind, nach § 19 Absatz 3 UmwG bekannt gemacht worden ist, ihren Anspruch nach Grund und Höhe schriftlich anmelden, Sicherheit zu leisten, soweit sie nicht Befriedigung verlangen können. Dieses Recht steht den Gläubigern jedoch nur zu, wenn sie glaubhaft machen, dass durch die Verschmelzung die Erfüllung ihrer Forderung gefährdet wird."
    },
    {
      "date": "2026-01-22",
      "id": "143255",
      "original_text": "Löschungsankündigung\nHessen Amtsgericht Frankfurt am Main VR 9673\nKleintierzuchtverein 1909 Hofheim – Hofheim am Taunus",
      "type": "Löschungsankündigung",
      "state": "Hessen",
      "amtsgericht": "Amtsgericht Frankfurt am Main",
      "registernummer": "VR 9673",
      "registerart": "VR",
      "company_name": "Kleintierzuchtverein 1909 Hofheim",
      "company_seat": "Hofheim am Taunus",
      "details": "22.01.2026 (Bekanntmachungsdatum)\n\nHessen Amtsgericht Frankfurt am Main VR 9673\nLöschungsankündigung\n\nKleintierzuchtverein 1909 Hofheim\neingetragener Verein\nHofheim am Taunus\n\nEs ist beabsichtigt, den Verein gemäß § 395 FamFG von Amts wegen im\nVereinsregister zu löschen. Gemäß § 395 FamFG kann eine Eintragung welche\nmangels einer wesentlichen Voraussetzung unzulässig ist, gelöscht werden.\nHiergegen kann innerhalb eines Monats nach dieser Veröffentlichung\nWiderspruch bei dem Amtsgericht Frankfurt am Main eingelegt werden."
    },
    {
      "date": "2026-01-22",
      "id": "143256",
      "original_text": "Löschungsankündigung\nHessen Amtsgericht Darmstadt HRB 96877\nPrestige XSL 383 EU GmbH – Darmstadt",
      "type": "Löschungsankündigung",
      "state": "Hessen",
      "amtsgericht": "Amtsgericht Darmstadt",
      "registernummer": "HRB 96877",
      "registerart": "HRB",
      "company_name": "Prestige XSL 383 EU GmbH",
      "company_seat": "Darmstadt",
      "details": "22.01.2026 (Bekanntmachungsdatum)\n\nHessen Amtsgericht Darmstadt HRB 96877\nLöschungsankündigung\n\nPrestige XSL 383 EU GmbH\nGesellschaft mit beschränkter Haftung\nDarmstadt\n\nDas Registergericht beabsichtigt die im Handelsregister eingetragene Gesellschaft von Amts wegen nach § 394 FamFG zu löschen. Die Frist zur Erhebung eines Widerspruchs gegen die beabsichtigte Löschung wird auf 3 Monate festgesetzt."
    },
    {
      "date": "2026-01-22",
      "id": "143257",
      "original_text": "Löschungsankündigung\nHessen Amtsgericht Frankfurt am Main HRB 134427\nBaus Baudienstleistung GmbH – Frankfurt am Main",
      "type": "Löschungsankündigung",
      "state": "Hessen",
      "amtsgericht": "Amtsgericht Frankfurt am Main",
      "registernummer": "HRB 134427",
      "registerart": "HRB",
      "company_name": "Baus Baudienstleistung GmbH",
      "company_seat": "Frankfurt am Main",
      "details": "22.01.2026 (Bekanntmachungsdatum)\n\nHessen Amtsgericht Frankfurt am Main HRB 134427\nLöschungsankündigung\n\nBaus Baudienstleistung GmbH\nGesellschaft mit beschränkter Haftung\nFrankfurt am Main\n\nEs ist beabsichtig, die Gesellschaft wegen Vermögenslosigkeit gemäß § 394 FamFG von Amts wegen im Handelsregister zu löschen. Hiergegen kann innerhalb eines Zeitraums von 1 Monat nach dieser Veröffentlichung Widerspruch bei dem Amtsgericht Frankfurt am Main eingelegt werden."
    },
    {
      "date": "2026-01-22",
      "id": "143258",
      "original_text": "Einreichung neuer Dokumente\nHessen Amtsgericht Bad Homburg v.d.H. HRB 9783\nKAERA Aktiengesellschaft – Oberursel (Taunus)",
      "type": "Einreichung neuer Dokumente",
      "state": "Hessen",
      "amtsgericht": "Amtsgericht Bad Homburg v.d.H.",
      "registernummer": "HRB 9783",
      "registerart": "HRB",
      "company_name": "KAERA Aktiengesellschaft",
      "company_seat": "Oberursel (Taunus)",
      "details": "22.01.2026 (Bekanntmachungsdatum)\n\nHessen Amtsgericht Bad Homburg v.d.H. HRB 9783\nEinreichung neuer Dokumente 22.01.2026 (Eintragungsdatum)\n\nKAERA Aktiengesellschaft\nAktiengesellschaft\nOberursel (Taunus)\n\nDurch eine Änderung in den Personen der Aufsichtsratsmitglieder ist eine Liste der Mitglieder des Aufsichtsrates zum Handelsregister eingereicht worden."
    },
    {
      "date": "2026-01-22",
      "id": "143259",
      "original_text": "Sonstige Registerbekanntmachung\nHessen Amtsgericht Frankfurt am Main HRB 52912\nHelvetia Leben Maklerservice GmbH – Frankfurt am Main",
      "type": "Sonstige Registerbekanntmachung",
      "state": "Hessen",
      "amtsgericht": "Amtsgericht Frankfurt am Main",
      "registernummer": "HRB 52912",
      "registerart": "HRB",
      "company_name": "Helvetia Leben Maklerservice GmbH",
      "company_seat": "Frankfurt am Main",
      "details": "22.01.2026 (Bekanntmachungsdatum)\n\nHessen Amtsgericht Frankfurt am Main HRB 52912\nSonstige Registerbekanntmachung\n\nHelvetia Leben Maklerservice GmbH\nGesellschaft mit beschränkter Haftung\nFrankfurt am Main\n\nDurch eine Änderung in den Personen der Aufsichtsratsmitglieder ist eine Liste der Mitglieder des Aufsichtsrates zum Handelsregister eingereicht worden."
    },
    {
      "date": "2026-01-22",
      "id": "143260",
      "original_text": "Registerbekanntmachung nach dem Umwandlungsgesetz\nHessen Amtsgericht Frankfurt am Main HRB 124626\nfinone Holding GmbH – Frankfurt am Main",
      "type": "Registerbekanntmachung nach dem Umwandlungsgesetz",
      "state": "Hessen",
      "amtsgericht": "Amtsgericht Frankfurt am Main",
      "registernummer": "HRB 124626",
      "registerart": "HRB",
      "company_name": "finone Holding GmbH",
      "company_seat": "Frankfurt am Main",
      "details": "22.01.2026 (Bekanntmachungsdatum)\n\nHessen Amtsgericht Frankfurt am Main HRB 124626\nRegisterbekanntmachung nach dem Umwandlungsgesetz 22.01.2026 (Eintragungsdatum)\n\nfinone Holding GmbH\nGesellschaft mit beschränkter Haftung\nFrankfurt am Main\n\nDen Gläubigern der an der Verschmelzung beteiligten Rechtsträger ist, wenn sie binnen sechs Monaten nach dem Tag, an dem die Eintragung der Verschmelzung in das Register des Sitzes desjenigen Rechtsträgers, dessen Gläubiger sie sind, nach § 19 Absatz 3 UmwG bekannt gemacht worden ist, ihren Anspruch nach Grund und Höhe schriftlich anmelden, Sicherheit zu leisten, soweit sie nicht Befriedigung verlangen können. Dieses Recht steht den Gläubigern jedoch nur zu, wenn sie glaubhaft machen, dass durch die Verschmelzung die Erfüllung ihrer Forderung gefährdet wird."
    }
  ]
}