{
  "date": "2026-01-16",
  "date_of_scrape": "2026-01-17T04:16:37.986Z",
  "tool_version": "0.2.0",
  "number_of_announcements": 119,
  "announcements": [
    {
      "date": "2026-01-16",
      "id": "142570",
      "original_text": "Sonstige Registerbekanntmachung\nBayern Amtsgericht Würzburg HRB 587\nKreutz & Mock Metallwaren- und Maschinen-Fabrik Gesellschaft mit beschränkter Haftung – Neuendorf am Main",
      "type": "Sonstige Registerbekanntmachung",
      "state": "Bayern",
      "amtsgericht": "Amtsgericht Würzburg",
      "registernummer": "HRB 587",
      "registerart": "HRB",
      "company_name": "Kreutz & Mock Metallwaren- und Maschinen-Fabrik Gesellschaft mit beschränkter Haftung",
      "company_seat": "Neuendorf am Main",
      "details": "16.01.2026 (Bekanntmachungsdatum)\n\nBayern Amtsgericht Würzburg HRB 587\nSonstige Registerbekanntmachung 15.01.2026 (Eintragungsdatum)\n\nKreutz & Mock Metallwaren- und Maschinen-Fabrik Gesellschaft mit beschränkter Haftung\nGesellschaft mit beschränkter Haftung\nNeuendorf am Main\n\nDen Gläubigern der Gesellschaft, deren Forderungen begründet worden sind, bevor die Eintragung der Beendigung des Beherrschungs- und Gewinnabführungsvertrages in das Handelsregister nach § 10 des Handelsgesetzbuches als bekanntgemacht gilt, hat der andere Vertragsteil Sicherheit zu leisten, wenn sie sich binnen sechs Monaten nach der Bekanntmachung der Eintragung zu diesem Zweck bei ihm melden."
    },
    {
      "date": "2026-01-16",
      "id": "142571",
      "original_text": "Löschungsankündigung\nBayern Amtsgericht Passau HRB 3798\nGreindl GmbH – Untergriesbach",
      "type": "Löschungsankündigung",
      "state": "Bayern",
      "amtsgericht": "Amtsgericht Passau",
      "registernummer": "HRB 3798",
      "registerart": "HRB",
      "company_name": "Greindl GmbH",
      "company_seat": "Untergriesbach",
      "details": "16.01.2026 (Bekanntmachungsdatum)\n\nBayern Amtsgericht Passau HRB 3798\nLöschungsankündigung\n\nGreindl GmbH\nGesellschaft mit beschränkter Haftung\nUntergriesbach\n\nDas Registergericht beabsichtigt, die im Handelsregister eingetragene Gesellschaft wegen Vermögenslosigkeit von Amts wegen nach § 394 FamFG zu löschen. Die Frist zur Erhebung eines Widerspruchs ist auf einen Monat festgesetzt."
    },
    {
      "date": "2026-01-16",
      "id": "142572",
      "original_text": "Löschungsankündigung\nBayern Amtsgericht München HRB 286621\nDOHMS vermögensverwaltende UG (haftungsbeschränkt) – München",
      "type": "Löschungsankündigung",
      "state": "Bayern",
      "amtsgericht": "Amtsgericht München",
      "registernummer": "HRB 286621",
      "registerart": "HRB",
      "company_name": "DOHMS vermögensverwaltende UG (haftungsbeschränkt)",
      "company_seat": "München",
      "details": "16.01.2026 (Bekanntmachungsdatum)\n\nBayern Amtsgericht München HRB 286621\nLöschungsankündigung 15.01.2026 (Eintragungsdatum)\n\nDOHMS vermögensverwaltende UG (haftungsbeschränkt)\nGesellschaft mit beschränkter Haftung\nMünchen\n\nDas Registergericht beabsichtigt, die im Handelsregister eingetragene Gesellschaft wegen Vermögenslosigkeit von Amts wegen nach § 394 FamFG zu löschen. Die Frist zur Erhebung eines Widerspruchs ist auf drei Monate festgesetzt."
    },
    {
      "date": "2026-01-16",
      "id": "142573",
      "original_text": "Löschungsankündigung\nBayern Amtsgericht München HRB 280621\nSixrooms GmbH – Grünwald",
      "type": "Löschungsankündigung",
      "state": "Bayern",
      "amtsgericht": "Amtsgericht München",
      "registernummer": "HRB 280621",
      "registerart": "HRB",
      "company_name": "Sixrooms GmbH",
      "company_seat": "Grünwald",
      "details": "16.01.2026 (Bekanntmachungsdatum)\n\nBayern Amtsgericht München HRB 280621\nLöschungsankündigung 15.01.2026 (Eintragungsdatum)\n\nSixrooms GmbH\nGesellschaft mit beschränkter Haftung\nGrünwald\n\nDas Registergericht beabsichtigt, die im Handelsregister eingetragene Gesellschaft wegen Vermögenslosigkeit von Amts wegen nach § 394 FamFG zu löschen. Die Frist zur Erhebung eines Widerspruchs ist auf drei Monate festgesetzt."
    },
    {
      "date": "2026-01-16",
      "id": "142574",
      "original_text": "Registerbekanntmachung nach dem Umwandlungsgesetz\nBayern Amtsgericht München HRB 226329\nPHÖNIX-Seniorenzentrum Gartenstadt GmbH – München",
      "type": "Registerbekanntmachung nach dem Umwandlungsgesetz",
      "state": "Bayern",
      "amtsgericht": "Amtsgericht München",
      "registernummer": "HRB 226329",
      "registerart": "HRB",
      "company_name": "PHÖNIX-Seniorenzentrum Gartenstadt GmbH",
      "company_seat": "München",
      "details": "16.01.2026 (Bekanntmachungsdatum)\n\nBayern Amtsgericht München HRB 226329\nRegisterbekanntmachung nach dem Umwandlungsgesetz 15.01.2026 (Eintragungsdatum)\n\nPHÖNIX-Seniorenzentrum Gartenstadt GmbH\nGesellschaft mit beschränkter Haftung\nMünchen\n\nDen Gläubigern der an der Verschmelzung beteiligten Rechtsträger ist, wenn sie binnen sechs Monaten nach dem Tag, an dem die Eintragung der Verschmelzung in das Register des Sitzes desjenigen Rechtsträgers, dessen Gläubiger sie sind, nach § 19 Abs. 3 UmwG als bekannt gemacht gilt, ihren Anspruch nach Grund und Höhe in Textform anmelden, Sicherheit zu leisten, soweit sie nicht Befriedigung verlangen können. Dieses Recht steht den Gläubigern jedoch nur zu, wenn sie glaubhaft machen, dass durch die Verschmelzung die Erfüllung ihrer Forderung gefährdet wird."
    },
    {
      "date": "2026-01-16",
      "id": "142575",
      "original_text": "Löschungsankündigung\nBayern Amtsgericht München HRB 224277\nMKR München GmbH – Garching b.München",
      "type": "Löschungsankündigung",
      "state": "Bayern",
      "amtsgericht": "Amtsgericht München",
      "registernummer": "HRB 224277",
      "registerart": "HRB",
      "company_name": "MKR München GmbH",
      "company_seat": "Garching b.München",
      "details": "16.01.2026 (Bekanntmachungsdatum)\n\nBayern Amtsgericht München HRB 224277\nLöschungsankündigung\n\nMKR München GmbH\nGesellschaft mit beschränkter Haftung\nGarching b.München\n\nDas Registergericht beabsichtigt, die im Handelsregister eingetragene Gesellschaft wegen Vermögenslosigkeit von Amts wegen nach § 394 FamFG zu löschen. Die Frist zur Erhebung eines Widerspruchs ist auf drei Monate festgesetzt."
    },
    {
      "date": "2026-01-16",
      "id": "142576",
      "original_text": "Registerbekanntmachung nach dem Umwandlungsgesetz\nBayern Amtsgericht Augsburg HRB 38931\nRough Parts GmbH – Augsburg",
      "type": "Registerbekanntmachung nach dem Umwandlungsgesetz",
      "state": "Bayern",
      "amtsgericht": "Amtsgericht Augsburg",
      "registernummer": "HRB 38931",
      "registerart": "HRB",
      "company_name": "Rough Parts GmbH",
      "company_seat": "Augsburg",
      "details": "16.01.2026 (Bekanntmachungsdatum)\n\nBayern Amtsgericht Augsburg HRB 38931\nRegisterbekanntmachung nach dem Umwandlungsgesetz 15.01.2026 (Eintragungsdatum)\n\nRough Parts GmbH\nGesellschaft mit beschränkter Haftung\nAugsburg\n\nDen Gläubigern #dv.auswahl(Text=\"Bitte zutreffendes auswählen:\",Eingabe=\n\n\"der an der Verschmelzung beteiligten Rechtsträger ist, wenn sie binnen sechs Monaten nach dem Tag, an dem die Eintragung der Verschmelzung in das Register des Sitzes desjenigen Rechtsträgers, dessen Gläubiger sie sind, nach § 19 Abs. 3 UmwG als bekannt gemacht gilt, ihren Anspruch nach Grund und Höhe in Textform anmelden, Sicherheit zu leisten, soweit sie nicht Befriedigung verlangen können. Dieses Recht steht den Gläubigern jedoch nur zu, wenn sie glaubhaft machen, dass durch die Verschmelzung die Erfüllung ihrer Forderung gefährdet wird.\"|\"Verschmelzung\",\n\n\"der an der Spaltung beteiligten Rechtsträger ist, wenn sie binnen sechs Monaten nach dem Tag, an dem die Eintragung der Spaltung in das Register des Sitzes desjenigen Rechtsträgers, dessen Gläubiger sie sind, nach §§ 125, 19 Abs. 3 UmwG als bekannt gemacht gilt, ihren Anspruch nach Grund und Höhe in Textform anmelden, Sicherheit zu leisten, soweit sie nicht Befriedigung verlangen können. Dieses Recht steht den Gläubigern jedoch nur zu, wenn sie glaubhaft machen, dass durch die Spaltung die Erfüllung ihrer Forderung gefährdet wird.\"|\"Spaltung\",\n\n\"des formwechselnden Rechtsträgers ist, wenn sie binnen sechs Monaten nach dem Tag, an dem die Eintragung des Formwechsels nach § 201 UmwG als bekannt gemacht gilt, ihren Anspruch nach Grund und Höhe in Textform anmelden, Sicherheit zu leisten, soweit sie nicht Befriedigung verlangen können. Dieses Recht steht den Gläubigern jedoch nur zu, wenn sie glaubhaft machen, dass durch den Formwechsel die Erfüllung ihrer Forderung gefährdet wird.\"|\"formwechselnde Umwandlung\",\n\n\"der an der Ausgliederung beteiligten Rechtsträger ist, wenn sie binnen sechs Monaten nach dem Tag, an dem die Eintragung der Ausgliederung in das Register des Sitzes desjenigen Rechtsträgers, dessen Gläubiger sie sind, nach §§ 125, 19 Abs. 3 UmwG als bekannt gemacht gilt, ihren Anspruch nach Grund und Höhe in Textform anmelden, Sicherheit zu leisten, soweit sie nicht Befriedigung verlangen können. Dieses Recht steht den Gläubigern jedoch nur zu, wenn sie glaubhaft machen, dass durch die Ausgliederung die Erfüllung ihrer Forderung gefährdet wird.\"|\"Ausgliederung\")"
    },
    {
      "date": "2026-01-16",
      "id": "142577",
      "original_text": "Löschungsankündigung\nBayern Amtsgericht München HRB 294318\nFRUTTY - Interworld GmbH – München",
      "type": "Löschungsankündigung",
      "state": "Bayern",
      "amtsgericht": "Amtsgericht München",
      "registernummer": "HRB 294318",
      "registerart": "HRB",
      "company_name": "FRUTTY - Interworld GmbH",
      "company_seat": "München",
      "details": "16.01.2026 (Bekanntmachungsdatum)\n\nBayern Amtsgericht München HRB 294318\nLöschungsankündigung 15.01.2026 (Eintragungsdatum)\n\nFRUTTY - Interworld GmbH\nGesellschaft mit beschränkter Haftung\nMünchen\n\nDas Registergericht beabsichtigt, die im Handelsregister eingetragene Gesellschaft wegen Vermögenslosigkeit von Amts wegen nach § 394 FamFG zu löschen. Die Frist zur Erhebung eines Widerspruchs ist auf drei Monate festgesetzt."
    },
    {
      "date": "2026-01-16",
      "id": "142578",
      "original_text": "Löschungsankündigung\nBayern Amtsgericht München HRB 218619\nAutonomic Technologies Europe GmbH – München",
      "type": "Löschungsankündigung",
      "state": "Bayern",
      "amtsgericht": "Amtsgericht München",
      "registernummer": "HRB 218619",
      "registerart": "HRB",
      "company_name": "Autonomic Technologies Europe GmbH",
      "company_seat": "München",
      "details": "16.01.2026 (Bekanntmachungsdatum)\n\nBayern Amtsgericht München HRB 218619\nLöschungsankündigung 15.01.2026 (Eintragungsdatum)\n\nAutonomic Technologies Europe GmbH\nGesellschaft mit beschränkter Haftung\nMünchen\n\nDas Registergericht beabsichtigt, die im Handelsregister eingetragene Gesellschaft wegen Vermögenslosigkeit von Amts wegen nach § 394 FamFG zu löschen. Die Frist zur Erhebung eines Widerspruchs ist auf drei Monate festgesetzt."
    },
    {
      "date": "2026-01-16",
      "id": "142579",
      "original_text": "Registerbekanntmachung nach dem Umwandlungsgesetz\nBayern Amtsgericht Ingolstadt HRB 8557\nFlemming Dental Süd GmbH – Ingolstadt",
      "type": "Registerbekanntmachung nach dem Umwandlungsgesetz",
      "state": "Bayern",
      "amtsgericht": "Amtsgericht Ingolstadt",
      "registernummer": "HRB 8557",
      "registerart": "HRB",
      "company_name": "Flemming Dental Süd GmbH",
      "company_seat": "Ingolstadt",
      "details": "16.01.2026 (Bekanntmachungsdatum)\n\nBayern Amtsgericht Ingolstadt HRB 8557\nRegisterbekanntmachung nach dem Umwandlungsgesetz 15.01.2026 (Eintragungsdatum)\n\nFlemming Dental Süd GmbH\nGesellschaft mit beschränkter Haftung\nIngolstadt\n\nDen Gläubigern der an der Verschmelzung beteiligten Rechtsträger ist, wenn sie binnen sechs Monaten nach dem Tag, an dem die Eintragung der Verschmelzung in das Register des Sitzes desjenigen Rechtsträgers, dessen Gläubiger sie sind, nach § 19 Abs. 3 UmwG als bekannt gemacht gilt, ihren Anspruch nach Grund und Höhe in Textform anmelden, Sicherheit zu leisten, soweit sie nicht Befriedigung verlangen können. Dieses Recht steht den Gläubigern jedoch nur zu, wenn sie glaubhaft machen, dass durch die Verschmelzung die Erfüllung ihrer Forderung gefährdet wird."
    },
    {
      "date": "2026-01-16",
      "id": "142580",
      "original_text": "Registerbekanntmachung nach dem Umwandlungsgesetz\nBayern Amtsgericht Ingolstadt HRB 7539\nIN-Dent GmbH Labor für dentale Präzisionstechnik – Ingolstadt",
      "type": "Registerbekanntmachung nach dem Umwandlungsgesetz",
      "state": "Bayern",
      "amtsgericht": "Amtsgericht Ingolstadt",
      "registernummer": "HRB 7539",
      "registerart": "HRB",
      "company_name": "IN-Dent GmbH Labor für dentale Präzisionstechnik",
      "company_seat": "Ingolstadt",
      "details": "16.01.2026 (Bekanntmachungsdatum)\n\nBayern Amtsgericht Ingolstadt HRB 7539\nRegisterbekanntmachung nach dem Umwandlungsgesetz 15.01.2026 (Eintragungsdatum)\n\nIN-Dent GmbH Labor für dentale Präzisionstechnik\nGesellschaft mit beschränkter Haftung\nIngolstadt\n\nDen Gläubigern der an der Verschmelzung beteiligten Rechtsträger ist, wenn sie binnen sechs Monaten nach dem Tag, an dem die Eintragung der Verschmelzung in das Register des Sitzes desjenigen Rechtsträgers, dessen Gläubiger sie sind, nach § 19 Abs. 3 UmwG als bekannt gemacht gilt, ihren Anspruch nach Grund und Höhe in Textform anmelden, Sicherheit zu leisten, soweit sie nicht Befriedigung verlangen können. Dieses Recht steht den Gläubigern jedoch nur zu, wenn sie glaubhaft machen, dass durch die Verschmelzung die Erfüllung ihrer Forderung gefährdet wird."
    },
    {
      "date": "2026-01-16",
      "id": "142581",
      "original_text": "Registerbekanntmachung nach dem Umwandlungsgesetz\nBayern Amtsgericht München HRA 122175\nZenKenKan e.K. – München",
      "type": "Registerbekanntmachung nach dem Umwandlungsgesetz",
      "state": "Bayern",
      "amtsgericht": "Amtsgericht München",
      "registernummer": "HRA 122175",
      "registerart": "HRA",
      "company_name": "ZenKenKan e.K.",
      "company_seat": "München",
      "details": "16.01.2026 (Bekanntmachungsdatum)\n\nBayern Amtsgericht München HRA 122175\nRegisterbekanntmachung nach dem Umwandlungsgesetz 15.01.2026 (Eintragungsdatum)\n\nZenKenKan e.K.\nEinzelkaufmann / Einzelkauffrau\nMünchen\n\nDen Gläubigern der an der Verschmelzung beteiligten Rechtsträger ist, wenn sie binnen sechs Monaten nach dem Tag, an dem die Eintragung der Verschmelzung in das Register des Sitzes desjenigen Rechtsträgers, dessen Gläubiger sie sind, nach § 19 Abs. 3 UmwG als bekannt gemacht gilt, ihren Anspruch nach Grund und Höhe in Textform anmelden, Sicherheit zu leisten, soweit sie nicht Befriedigung verlangen können. Dieses Recht steht den Gläubigern jedoch nur zu, wenn sie glaubhaft machen, dass durch die Verschmelzung die Erfüllung ihrer Forderung gefährdet wird."
    },
    {
      "date": "2026-01-16",
      "id": "142582",
      "original_text": "Sonstige Registerbekanntmachung\nBayern Amtsgericht Landshut HRB 1181\nF. X. Solcher GmbH – Pfarrkirchen",
      "type": "Sonstige Registerbekanntmachung",
      "state": "Bayern",
      "amtsgericht": "Amtsgericht Landshut",
      "registernummer": "HRB 1181",
      "registerart": "HRB",
      "company_name": "F. X. Solcher GmbH",
      "company_seat": "Pfarrkirchen",
      "details": "16.01.2026 (Bekanntmachungsdatum)\n\nBayern Amtsgericht Landshut HRB 1181\nSonstige Registerbekanntmachung 15.01.2026 (Eintragungsdatum)\n\nF. X. Solcher GmbH\nGesellschaft mit beschränkter Haftung\nPfarrkirchen\n\nDen Gläubigern der Gesellschaft, deren Forderungen begründet worden sind, bevor die Eintragung der Beendigung des Gewinnabführungsvertrages in das Handelsregister nach § 10 des Handelsgesetzbuches als bekanntgemacht gilt, hat der andere Vertragsteil Sicherheit zu leisten, wenn sie sich binnen sechs Monaten nach der Bekanntmachung der Eintragung zu diesem Zweck bei ihm melden."
    },
    {
      "date": "2026-01-16",
      "id": "142583",
      "original_text": "Registerbekanntmachung nach dem Umwandlungsgesetz\nBayern Amtsgericht München HRB 204855\nVTC Immobilien GmbH – Grünwald",
      "type": "Registerbekanntmachung nach dem Umwandlungsgesetz",
      "state": "Bayern",
      "amtsgericht": "Amtsgericht München",
      "registernummer": "HRB 204855",
      "registerart": "HRB",
      "company_name": "VTC Immobilien GmbH",
      "company_seat": "Grünwald",
      "details": "16.01.2026 (Bekanntmachungsdatum)\n\nBayern Amtsgericht München HRB 204855\nRegisterbekanntmachung nach dem Umwandlungsgesetz 15.01.2026 (Eintragungsdatum)\n\nVTC Immobilien GmbH\nGesellschaft mit beschränkter Haftung\nGrünwald\n\nDen Gläubigern der an der Verschmelzung beteiligten Rechtsträger ist, wenn sie binnen sechs Monaten nach dem Tag, an dem die Eintragung der Verschmelzung in das Register des Sitzes desjenigen Rechtsträgers, dessen Gläubiger sie sind, nach § 19 Abs. 3 UmwG als bekannt gemacht gilt, ihren Anspruch nach Grund und Höhe in Textform anmelden, Sicherheit zu leisten, soweit sie nicht Befriedigung verlangen können. Dieses Recht steht den Gläubigern jedoch nur zu, wenn sie glaubhaft machen, dass durch die Verschmelzung die Erfüllung ihrer Forderung gefährdet wird."
    },
    {
      "date": "2026-01-16",
      "id": "142584",
      "original_text": "Registerbekanntmachung nach dem Umwandlungsgesetz\nBayern Amtsgericht Augsburg HRB 38932\nRough Concrete GmbH – Augsburg",
      "type": "Registerbekanntmachung nach dem Umwandlungsgesetz",
      "state": "Bayern",
      "amtsgericht": "Amtsgericht Augsburg",
      "registernummer": "HRB 38932",
      "registerart": "HRB",
      "company_name": "Rough Concrete GmbH",
      "company_seat": "Augsburg",
      "details": "16.01.2026 (Bekanntmachungsdatum)\n\nBayern Amtsgericht Augsburg HRB 38932\nRegisterbekanntmachung nach dem Umwandlungsgesetz 15.01.2026 (Eintragungsdatum)\n\nRough Concrete GmbH\nGesellschaft mit beschränkter Haftung\nAugsburg\n\nDen Gläubigern der an der Verschmelzung beteiligten Rechtsträger ist, wenn sie binnen sechs Monaten nach dem Tag, an dem die Eintragung der Verschmelzung in das Register des Sitzes desjenigen Rechtsträgers, dessen Gläubiger sie sind, nach § 19 Abs. 3 UmwG als bekannt gemacht gilt, ihren Anspruch nach Grund und Höhe in Textform anmelden, Sicherheit zu leisten, soweit sie nicht Befriedigung verlangen können. Dieses Recht steht den Gläubigern jedoch nur zu, wenn sie glaubhaft machen, dass durch die Verschmelzung die Erfüllung ihrer Forderung gefährdet wird."
    },
    {
      "date": "2026-01-16",
      "id": "142585",
      "original_text": "Sonstige Registerbekanntmachung\nBayern Amtsgericht München HRB 303109\nExcelitas Deutschland GmbH – Feldkirchen",
      "type": "Sonstige Registerbekanntmachung",
      "state": "Bayern",
      "amtsgericht": "Amtsgericht München",
      "registernummer": "HRB 303109",
      "registerart": "HRB",
      "company_name": "Excelitas Deutschland GmbH",
      "company_seat": "Feldkirchen",
      "details": "16.01.2026 (Bekanntmachungsdatum)\n\nBayern Amtsgericht München HRB 303109\nSonstige Registerbekanntmachung 15.01.2026 (Eintragungsdatum)\n\nExcelitas Deutschland GmbH\nGesellschaft mit beschränkter Haftung\nFeldkirchen\n\nDen Gläubigern der Gesellschaft, deren Forderungen begründet worden sind, bevor die Eintragung der Beendigung des Gewinnabführungsvertrages in das Handelsregister nach § 10 des Handelsgesetzbuches als bekanntgemacht gilt, hat der andere Vertragsteil Sicherheit zu leisten, wenn sie sich binnen sechs Monaten nach der Bekanntmachung der Eintragung zu diesem Zweck bei ihm melden."
    },
    {
      "date": "2026-01-16",
      "id": "142586",
      "original_text": "Löschungsankündigung\nBayern Amtsgericht München HRB 244475\nD&C Montage Bau GmbH – München",
      "type": "Löschungsankündigung",
      "state": "Bayern",
      "amtsgericht": "Amtsgericht München",
      "registernummer": "HRB 244475",
      "registerart": "HRB",
      "company_name": "D&C Montage Bau GmbH",
      "company_seat": "München",
      "details": "16.01.2026 (Bekanntmachungsdatum)\n\nBayern Amtsgericht München HRB 244475\nLöschungsankündigung\n\nD&C Montage Bau GmbH\nGesellschaft mit beschränkter Haftung\nMünchen\n\nDas Registergericht beabsichtigt, die im Handelsregister eingetragene Gesellschaft wegen Vermögenslosigkeit von Amts wegen nach § 394 FamFG zu löschen. Die Frist zur Erhebung eines Widerspruchs ist auf drei Monate festgesetzt."
    },
    {
      "date": "2026-01-16",
      "id": "142587",
      "original_text": "Registerbekanntmachung nach dem Umwandlungsgesetz\nBayern Amtsgericht Augsburg HRB 38849\nRough Holding GmbH – Augsburg",
      "type": "Registerbekanntmachung nach dem Umwandlungsgesetz",
      "state": "Bayern",
      "amtsgericht": "Amtsgericht Augsburg",
      "registernummer": "HRB 38849",
      "registerart": "HRB",
      "company_name": "Rough Holding GmbH",
      "company_seat": "Augsburg",
      "details": "16.01.2026 (Bekanntmachungsdatum)\n\nBayern Amtsgericht Augsburg HRB 38849\nRegisterbekanntmachung nach dem Umwandlungsgesetz 15.01.2026 (Eintragungsdatum)\n\nRough Holding GmbH\nGesellschaft mit beschränkter Haftung\nAugsburg\n\nDen Gläubigern #dv.auswahl(Text=\"Bitte zutreffendes auswählen:\",Eingabe=\n\n\"der an der Verschmelzung beteiligten Rechtsträger ist, wenn sie binnen sechs Monaten nach dem Tag, an dem die Eintragung der Verschmelzung in das Register des Sitzes desjenigen Rechtsträgers, dessen Gläubiger sie sind, nach § 19 Abs. 3 UmwG als bekannt gemacht gilt, ihren Anspruch nach Grund und Höhe in Textform anmelden, Sicherheit zu leisten, soweit sie nicht Befriedigung verlangen können. Dieses Recht steht den Gläubigern jedoch nur zu, wenn sie glaubhaft machen, dass durch die Verschmelzung die Erfüllung ihrer Forderung gefährdet wird.\"|\"Verschmelzung\",\n\n\"der an der Spaltung beteiligten Rechtsträger ist, wenn sie binnen sechs Monaten nach dem Tag, an dem die Eintragung der Spaltung in das Register des Sitzes desjenigen Rechtsträgers, dessen Gläubiger sie sind, nach §§ 125, 19 Abs. 3 UmwG als bekannt gemacht gilt, ihren Anspruch nach Grund und Höhe in Textform anmelden, Sicherheit zu leisten, soweit sie nicht Befriedigung verlangen können. Dieses Recht steht den Gläubigern jedoch nur zu, wenn sie glaubhaft machen, dass durch die Spaltung die Erfüllung ihrer Forderung gefährdet wird.\"|\"Spaltung\",\n\n\"des formwechselnden Rechtsträgers ist, wenn sie binnen sechs Monaten nach dem Tag, an dem die Eintragung des Formwechsels nach § 201 UmwG als bekannt gemacht gilt, ihren Anspruch nach Grund und Höhe in Textform anmelden, Sicherheit zu leisten, soweit sie nicht Befriedigung verlangen können. Dieses Recht steht den Gläubigern jedoch nur zu, wenn sie glaubhaft machen, dass durch den Formwechsel die Erfüllung ihrer Forderung gefährdet wird.\"|\"formwechselnde Umwandlung\",\n\n\"der an der Ausgliederung beteiligten Rechtsträger ist, wenn sie binnen sechs Monaten nach dem Tag, an dem die Eintragung der Ausgliederung in das Register des Sitzes desjenigen Rechtsträgers, dessen Gläubiger sie sind, nach §§ 125, 19 Abs. 3 UmwG als bekannt gemacht gilt, ihren Anspruch nach Grund und Höhe in Textform anmelden, Sicherheit zu leisten, soweit sie nicht Befriedigung verlangen können. Dieses Recht steht den Gläubigern jedoch nur zu, wenn sie glaubhaft machen, dass durch die Ausgliederung die Erfüllung ihrer Forderung gefährdet wird.\"|\"Ausgliederung\")"
    },
    {
      "date": "2026-01-16",
      "id": "142588",
      "original_text": "Registerbekanntmachung nach dem Umwandlungsgesetz\nBayern Amtsgericht München HRB 243230\nST3 Holding GmbH – Grünwald",
      "type": "Registerbekanntmachung nach dem Umwandlungsgesetz",
      "state": "Bayern",
      "amtsgericht": "Amtsgericht München",
      "registernummer": "HRB 243230",
      "registerart": "HRB",
      "company_name": "ST3 Holding GmbH",
      "company_seat": "Grünwald",
      "details": "16.01.2026 (Bekanntmachungsdatum)\n\nBayern Amtsgericht München HRB 243230\nRegisterbekanntmachung nach dem Umwandlungsgesetz 15.01.2026 (Eintragungsdatum)\n\nST3 Holding GmbH\nGesellschaft mit beschränkter Haftung\nGrünwald\n\nDen Gläubigern der an der Verschmelzung beteiligten Rechtsträger ist, wenn sie binnen sechs Monaten nach dem Tag, an dem die Eintragung der Verschmelzung in das Register des Sitzes desjenigen Rechtsträgers, dessen Gläubiger sie sind, nach § 19 Abs. 3 UmwG als bekannt gemacht gilt, ihren Anspruch nach Grund und Höhe in Textform anmelden, Sicherheit zu leisten, soweit sie nicht Befriedigung verlangen können. Dieses Recht steht den Gläubigern jedoch nur zu, wenn sie glaubhaft machen, dass durch die Verschmelzung die Erfüllung ihrer Forderung gefährdet wird."
    },
    {
      "date": "2026-01-16",
      "id": "142589",
      "original_text": "Registerbekanntmachung nach dem Umwandlungsgesetz\nBayern Amtsgericht Augsburg HRB 38849\nRough Holding GmbH – Augsburg",
      "type": "Registerbekanntmachung nach dem Umwandlungsgesetz",
      "state": "Bayern",
      "amtsgericht": "Amtsgericht Augsburg",
      "registernummer": "HRB 38849",
      "registerart": "HRB",
      "company_name": "Rough Holding GmbH",
      "company_seat": "Augsburg",
      "details": "16.01.2026 (Bekanntmachungsdatum)\n\nBayern Amtsgericht Augsburg HRB 38849\nRegisterbekanntmachung nach dem Umwandlungsgesetz 15.01.2026 (Eintragungsdatum)\n\nRough Holding GmbH\nGesellschaft mit beschränkter Haftung\nAugsburg\n\nDen Gläubigern der an der Verschmelzung beteiligten Rechtsträger ist, wenn sie binnen sechs Monaten nach dem Tag, an dem die Eintragung der Verschmelzung in das Register des Sitzes desjenigen Rechtsträgers, dessen Gläubiger sie sind, nach § 19 Abs. 3 UmwG als bekannt gemacht gilt, ihren Anspruch nach Grund und Höhe in Textform anmelden, Sicherheit zu leisten, soweit sie nicht Befriedigung verlangen können. Dieses Recht steht den Gläubigern jedoch nur zu, wenn sie glaubhaft machen, dass durch die Verschmelzung die Erfüllung ihrer Forderung gefährdet wird."
    },
    {
      "date": "2026-01-16",
      "id": "142590",
      "original_text": "Einreichung neuer Dokumente\nBerlin Amtsgericht Berlin (Charlottenburg) HRB 112925\nDFW Dental Fräswerk AG – Berlin",
      "type": "Einreichung neuer Dokumente",
      "state": "Berlin",
      "amtsgericht": "Amtsgericht Berlin (Charlottenburg)",
      "registernummer": "HRB 112925",
      "registerart": "HRB",
      "company_name": "DFW Dental Fräswerk AG",
      "company_seat": "Berlin",
      "details": "16.01.2026 (Bekanntmachungsdatum)\n\nBerlin Amtsgericht Berlin (Charlottenburg) HRB 112925\nEinreichung neuer Dokumente\n\nDFW Dental Fräswerk AG\nAktiengesellschaft\nBerlin\n\nAls nicht eingetragen wird veröffentlicht:\n\nEs wurde eine neue Liste der Aufsichtsratsmitglieder eingereicht (§ 106 AktG)."
    },
    {
      "date": "2026-01-16",
      "id": "142591",
      "original_text": "Registerbekanntmachung nach dem Umwandlungsgesetz\nBerlin Amtsgericht Berlin (Charlottenburg) HRB 224871\nCCP Domus GmbH – Berlin",
      "type": "Registerbekanntmachung nach dem Umwandlungsgesetz",
      "state": "Berlin",
      "amtsgericht": "Amtsgericht Berlin (Charlottenburg)",
      "registernummer": "HRB 224871",
      "registerart": "HRB",
      "company_name": "CCP Domus GmbH",
      "company_seat": "Berlin",
      "details": "16.01.2026 (Bekanntmachungsdatum)\n\nBerlin Amtsgericht Berlin (Charlottenburg) HRB 224871\nRegisterbekanntmachung nach dem Umwandlungsgesetz 15.01.2026 (Eintragungsdatum)\n\nCCP Domus GmbH\nGesellschaft mit beschränkter Haftung\nBerlin\n\nZu Eintragungsnummer 3 vom 15.01.2026 wird als nicht eingetragen veröffentlicht:Den Gläubigern der an der Verschmelzung beteiligten Rechtsträger ist, wenn sie binnen sechs Monaten nach dem Tag, an dem die Eintragung der Verschmelzung in das Register des Sitzes desjenigen Rechtsträgers, dessen Gläubiger sie sind, als bekannt gemacht gilt, ihren Anspruch nach Grund und Höhe schriftlich anmelden, Sicherheit zu leisten, soweit sie nicht Befriedigung verlangen können. Dieses Recht steht den Gläubigern jedoch nur zu, wenn sie glaubhaft machen, dass durch die Verschmelzung die Erfüllung ihrer Forderung gefährdet wird. Das Recht, Sicherheitsleistung zu verlangen, steht Gläubigern nicht zu, die im Falle der Insolvenz ein Recht auf vorzugsweise Befriedigung aus einer Deckungsmasse haben, die nach gesetzlicher Vorschrift zu ihrem Schutz errichtet und staatlich überwacht ist."
    },
    {
      "date": "2026-01-16",
      "id": "142592",
      "original_text": "Einreichung neuer Dokumente\nBaden-Württemberg Amtsgericht Mannheim HRB 710296\nBilfinger SE – Mannheim",
      "type": "Einreichung neuer Dokumente",
      "state": "Baden-Württemberg",
      "amtsgericht": "Amtsgericht Mannheim",
      "registernummer": "HRB 710296",
      "registerart": "HRB",
      "company_name": "Bilfinger SE",
      "company_seat": "Mannheim",
      "details": "16.01.2026 (Bekanntmachungsdatum)\n\nBaden-Württemberg Amtsgericht Mannheim HRB 710296\nEinreichung neuer Dokumente\n\nBilfinger SE\nEuropäische Aktiengesellschaft (SE)\nMannheim\n\nDie Gesellschaft hat am 15.01.2026 die Liste über die Zusammensetzung des Aufsichtsrats zum Handelsregister eingereicht."
    },
    {
      "date": "2026-01-16",
      "id": "142593",
      "original_text": "Registerbekanntmachung nach dem Umwandlungsgesetz\nBaden-Württemberg Amtsgericht Mannheim GnR 700190\npro Mechanik eG – Straubenhardt",
      "type": "Registerbekanntmachung nach dem Umwandlungsgesetz",
      "state": "Baden-Württemberg",
      "amtsgericht": "Amtsgericht Mannheim",
      "registernummer": "GnR 700190",
      "registerart": "GnR",
      "company_name": "pro Mechanik eG",
      "company_seat": "Straubenhardt",
      "details": "16.01.2026 (Bekanntmachungsdatum)\n\nBaden-Württemberg Amtsgericht Mannheim GnR 700190\nRegisterbekanntmachung nach dem Umwandlungsgesetz 16.01.2026 (Eintragungsdatum)\n\npro Mechanik eG\neingetragene Genossenschaft\nStraubenhardt\n\nAls nicht eingetragen wird bekanntgemacht:\nDen Gläubigern der an der Aufspaltung beteiligten Rechtsträger ist, wenn sie binnen sechs Monaten nach dem Tag, an dem die Eintragung der Aufspaltung in das Register des Sitzes desjenigen Rechtsträgers, dessen Gläubiger sie sind, nach § 19 Abs. 3 UmwG als bekanntgemacht gilt, ihren Anspruch nach Grund und Höhe schriftlich anmelden, Sicherheit zu leisten, soweit sie nicht Befriedigung verlangen können. Dieses Recht steht den Gläubigern jedoch nur zu, wenn sie glaubhaft machen, dass durch die Aufspaltung die Erfüllung ihrer Forderung gefährdet wird."
    },
    {
      "date": "2026-01-16",
      "id": "142594",
      "original_text": "Registerbekanntmachung nach dem Umwandlungsgesetz\nBaden-Württemberg Amtsgericht Mannheim GnR 700195\npro Immo eG – Straubenhardt",
      "type": "Registerbekanntmachung nach dem Umwandlungsgesetz",
      "state": "Baden-Württemberg",
      "amtsgericht": "Amtsgericht Mannheim",
      "registernummer": "GnR 700195",
      "registerart": "GnR",
      "company_name": "pro Immo eG",
      "company_seat": "Straubenhardt",
      "details": "16.01.2026 (Bekanntmachungsdatum)\n\nBaden-Württemberg Amtsgericht Mannheim GnR 700195\nRegisterbekanntmachung nach dem Umwandlungsgesetz 16.01.2026 (Eintragungsdatum)\n\npro Immo eG\neingetragene Genossenschaft\nStraubenhardt\n\nAls nicht eingetragen wird bekanntgemacht:\nDen Gläubigern der an der Aufspaltung beteiligten Rechtsträger ist, wenn sie binnen sechs Monaten nach dem Tag, an dem die Eintragung der Aufspaltung in das Register des Sitzes desjenigen Rechtsträgers, dessen Gläubiger sie sind, nach § 19 Abs. 3 UmwG als bekanntgemacht gilt, ihren Anspruch nach Grund und Höhe schriftlich anmelden, Sicherheit zu leisten, soweit sie nicht Befriedigung verlangen können. Dieses Recht steht den Gläubigern jedoch nur zu, wenn sie glaubhaft machen, dass durch die Aufspaltung die Erfüllung ihrer Forderung gefährdet wird."
    },
    {
      "date": "2026-01-16",
      "id": "142595",
      "original_text": "Registerbekanntmachung nach dem Umwandlungsgesetz\nBaden-Württemberg Amtsgericht Mannheim HRB 707320\nWankmüller Verwaltungs - GmbH – Straubenhardt",
      "type": "Registerbekanntmachung nach dem Umwandlungsgesetz",
      "state": "Baden-Württemberg",
      "amtsgericht": "Amtsgericht Mannheim",
      "registernummer": "HRB 707320",
      "registerart": "HRB",
      "company_name": "Wankmüller Verwaltungs - GmbH",
      "company_seat": "Straubenhardt",
      "details": "16.01.2026 (Bekanntmachungsdatum)\n\nBaden-Württemberg Amtsgericht Mannheim HRB 707320\nRegisterbekanntmachung nach dem Umwandlungsgesetz 16.01.2026 (Eintragungsdatum)\n\nWankmüller Verwaltungs - GmbH\nGesellschaft mit beschränkter Haftung\nStraubenhardt\n\nDen Gläubigern der an der Abspaltung beteiligten Rechtsträger ist, wenn sie binnen sechs Monaten nach dem Tag, an dem die Eintragung der Abspaltung in das Register des Sitzes desjenigen Rechtsträgers, dessen Gläubiger sie sind, nach § 19 Abs. 3 UmwG als bekanntgemacht gilt, ihren Anspruch nach Grund und Höhe schriftlich anmelden, Sicherheit zu leisten, soweit sie nicht Befriedigung verlangen können. Dieses Recht steht den Gläubigern jedoch nur zu, wenn sie glaubhaft machen, dass durch die Abspaltung die Erfüllung ihrer Forderung gefährdet wird."
    },
    {
      "date": "2026-01-16",
      "id": "142596",
      "original_text": "Registerbekanntmachung nach dem Umwandlungsgesetz\nBaden-Württemberg Amtsgericht Mannheim HRB 707320\nWankmüller Verwaltungs - GmbH – Straubenhardt",
      "type": "Registerbekanntmachung nach dem Umwandlungsgesetz",
      "state": "Baden-Württemberg",
      "amtsgericht": "Amtsgericht Mannheim",
      "registernummer": "HRB 707320",
      "registerart": "HRB",
      "company_name": "Wankmüller Verwaltungs - GmbH",
      "company_seat": "Straubenhardt",
      "details": "16.01.2026 (Bekanntmachungsdatum)\n\nBaden-Württemberg Amtsgericht Mannheim HRB 707320\nRegisterbekanntmachung nach dem Umwandlungsgesetz 16.01.2026 (Eintragungsdatum)\n\nWankmüller Verwaltungs - GmbH\nGesellschaft mit beschränkter Haftung\nStraubenhardt\n\nDen Gläubigern der an der Aufspaltung beteiligten Rechtsträger ist, wenn sie binnen sechs Monaten nach dem Tag, an dem die Eintragung der Aufspaltung in das Register des Sitzes desjenigen Rechtsträgers, dessen Gläubiger sie sind, nach § 19 Abs. 3 UmwG als bekanntgemacht gilt, ihren Anspruch nach Grund und Höhe schriftlich anmelden, Sicherheit zu leisten, soweit sie nicht Befriedigung verlangen können. Dieses Recht steht den Gläubigern jedoch nur zu, wenn sie glaubhaft machen, dass durch die Aufspaltung die Erfüllung ihrer Forderung gefährdet wird."
    },
    {
      "date": "2026-01-16",
      "id": "142597",
      "original_text": "Registerbekanntmachung nach dem Umwandlungsgesetz\nBaden-Württemberg Amtsgericht Stuttgart HRB 780736\nGG Gastronomie GmbH – Reutlingen",
      "type": "Registerbekanntmachung nach dem Umwandlungsgesetz",
      "state": "Baden-Württemberg",
      "amtsgericht": "Amtsgericht Stuttgart",
      "registernummer": "HRB 780736",
      "registerart": "HRB",
      "company_name": "GG Gastronomie GmbH",
      "company_seat": "Reutlingen",
      "details": "16.01.2026 (Bekanntmachungsdatum)\n\nBaden-Württemberg Amtsgericht Stuttgart HRB 780736\nRegisterbekanntmachung nach dem Umwandlungsgesetz 16.01.2026 (Eintragungsdatum)\n\nGG Gastronomie GmbH\nGesellschaft mit beschränkter Haftung\nReutlingen\n\nAls nicht eingetragen wird bekanntgemacht:\nDen Gläubigern der an der Verschmelzung beteiligten Rechtsträger ist, wenn sie binnen sechs Monaten nach dem Tag, an dem die Eintragung der Verschmelzung in das Register des Sitzes desjenigen Rechtsträgers, dessen Gläubiger sie sind, nach § 19 Abs. 3 UmwG als bekanntgemacht gilt, ihren Anspruch nach Grund und Höhe schriftlich anmelden, Sicherheit zu leisten, soweit sie nicht Befriedigung verlangen können. Dieses Recht steht den Gläubigern jedoch nur zu, wenn sie glaubhaft machen, dass durch die Verschmelzung die Erfüllung ihrer Forderung gefährdet wird."
    },
    {
      "date": "2026-01-16",
      "id": "142598",
      "original_text": "Sonstige Registerbekanntmachung\nBaden-Württemberg Amtsgericht Stuttgart HRB 744136\nMediRent Kranken- und Rettungswagenvermietung GmbH – Lehrensteinsfeld",
      "type": "Sonstige Registerbekanntmachung",
      "state": "Baden-Württemberg",
      "amtsgericht": "Amtsgericht Stuttgart",
      "registernummer": "HRB 744136",
      "registerart": "HRB",
      "company_name": "MediRent Kranken- und Rettungswagenvermietung GmbH",
      "company_seat": "Lehrensteinsfeld",
      "details": "16.01.2026 (Bekanntmachungsdatum)\n\nBaden-Württemberg Amtsgericht Stuttgart HRB 744136\nSonstige Registerbekanntmachung 16.01.2026 (Eintragungsdatum)\n\nMediRent Kranken- und Rettungswagenvermietung GmbH\nGesellschaft mit beschränkter Haftung\nLehrensteinsfeld\n\nAls nicht eingetragen wird bekanntgemacht:\nDen Gläubigern der Gesellschaft, deren Forderungen begründet worden sind, bevor die Eintragung der Beendigung des Vertrages in das Handelsregister nach § 10 HGB als bekanntgemacht gilt, ist vom anderen Vertragsteil Sicherheit zu leisten, wenn sie sich binnen sechs Monaten nach der Bekanntmachung zu diesem Zweck bei ihm melden."
    },
    {
      "date": "2026-01-16",
      "id": "142599",
      "original_text": "Löschungsankündigung\nBaden-Württemberg Amtsgericht Freiburg HRB 704506\nMustis Gastro GmbH – Lörrach",
      "type": "Löschungsankündigung",
      "state": "Baden-Württemberg",
      "amtsgericht": "Amtsgericht Freiburg",
      "registernummer": "HRB 704506",
      "registerart": "HRB",
      "company_name": "Mustis Gastro GmbH",
      "company_seat": "Lörrach",
      "details": "16.01.2026 (Bekanntmachungsdatum)\n\nBaden-Württemberg Amtsgericht Freiburg HRB 704506\nLöschungsankündigung\n\nMustis Gastro GmbH\nGesellschaft mit beschränkter Haftung\nLörrach\n\nAls nicht eingetragen wird bekanntgemacht:\nDas Gericht beabsichtigt, die Gesellschaft wegen Vermögenslosigkeit im Handelsregister von Amts wegen nach § 394 FamFG zu löschen. Die Frist zur Geltendmachung eines Widerspruchs gegen die beabsichtigte Löschung ist auf einen Monat ab Veröffentlichung bestimmt."
    },
    {
      "date": "2026-01-16",
      "id": "142600",
      "original_text": "Sonstige Registerbekanntmachung\nHamburg Amtsgericht Hamburg HRB 75292\nZEIT Online GmbH – Hamburg",
      "type": "Sonstige Registerbekanntmachung",
      "state": "Hamburg",
      "amtsgericht": "Amtsgericht Hamburg",
      "registernummer": "HRB 75292",
      "registerart": "HRB",
      "company_name": "ZEIT Online GmbH",
      "company_seat": "Hamburg",
      "details": "16.01.2026 (Bekanntmachungsdatum)\n\nHamburg Amtsgericht Hamburg HRB 75292\nSonstige Registerbekanntmachung 16.01.2026 (Eintragungsdatum)\n\nZEIT Online GmbH\nGesellschaft mit beschränkter Haftung\nHamburg\n\nAls nicht eingetragen wird bekannt gemacht:  Den Gläubigern der Gesellschaft, deren Forderungen begründet worden sind, bevor die Eintragung der Vertragsbeendigung in das Handelsregister nach § 10 HGB als bekannt gemacht gilt, ist vom anderen Vertragsteil Sicherheit zu leisten, wenn sie sich binnen 6 Monaten nach Bekanntmachung der Eintragung zu diesem Zweck bei ihm melden."
    },
    {
      "date": "2026-01-16",
      "id": "142601",
      "original_text": "Löschungsankündigung\nBaden-Württemberg Amtsgericht Ulm HRB 744127\nWOHNTRAUM Meisterbetrieb GmbH – Uhingen",
      "type": "Löschungsankündigung",
      "state": "Baden-Württemberg",
      "amtsgericht": "Amtsgericht Ulm",
      "registernummer": "HRB 744127",
      "registerart": "HRB",
      "company_name": "WOHNTRAUM Meisterbetrieb GmbH",
      "company_seat": "Uhingen",
      "details": "16.01.2026 (Bekanntmachungsdatum)\n\nBaden-Württemberg Amtsgericht Ulm HRB 744127\nLöschungsankündigung\n\nWOHNTRAUM Meisterbetrieb GmbH\nGesellschaft mit beschränkter Haftung\nUhingen\n\nAls nicht eingetragen wird bekanntgemacht:\nDas Gericht beabsichtigt, die Gesellschaft wegen Vermögenslosigkeit im Handelsregister von Amts wegen nach § 394 FamFG zu löschen. Die Frist zur Geltendmachung eines Widerspruchs gegen die beabsichtigte Löschung ist auf  einen Monat ab Veröffentlichung bestimmt."
    },
    {
      "date": "2026-01-16",
      "id": "142602",
      "original_text": "Sonstige Registerbekanntmachung\nBaden-Württemberg Amtsgericht Mannheim HRB 727982\nWeber Ultrasonics AG – Karlsbad",
      "type": "Sonstige Registerbekanntmachung",
      "state": "Baden-Württemberg",
      "amtsgericht": "Amtsgericht Mannheim",
      "registernummer": "HRB 727982",
      "registerart": "HRB",
      "company_name": "Weber Ultrasonics AG",
      "company_seat": "Karlsbad",
      "details": "16.01.2026 (Bekanntmachungsdatum)\n\nBaden-Württemberg Amtsgericht Mannheim HRB 727982\nSonstige Registerbekanntmachung\n\nWeber Ultrasonics AG\nAktiengesellschaft\nKarlsbad\n\nDie Gesellschaft hat am 14.01.2026 die Liste über die Zusammensetzung des Aufsichtsrats zum Handelsregister eingereicht."
    },
    {
      "date": "2026-01-16",
      "id": "142603",
      "original_text": "Löschungsankündigung\nBrandenburg Amtsgericht Frankfurt/Oder HRB 19741\nJAN Trade & Service GmbH – Frankfurt (Oder)",
      "type": "Löschungsankündigung",
      "state": "Brandenburg",
      "amtsgericht": "Amtsgericht Frankfurt/Oder",
      "registernummer": "HRB 19741",
      "registerart": "HRB",
      "company_name": "JAN Trade & Service GmbH",
      "company_seat": "Frankfurt (Oder)",
      "details": "16.01.2026 (Bekanntmachungsdatum)\n\nBrandenburg Amtsgericht Frankfurt/Oder HRB 19741\nLöschungsankündigung\n\nJAN Trade & Service GmbH\nGesellschaft mit beschränkter Haftung\nFrankfurt (Oder)\n\nBei der nachstehenden Gesellschaft wird das Amtslöschungsverfahren gemäß § 394 FamFG eingeleitet."
    },
    {
      "date": "2026-01-16",
      "id": "142604",
      "original_text": "Löschungsankündigung\nBerlin Amtsgericht Berlin (Charlottenburg) HRB 214959\nElagumed OÜ – Berlin",
      "type": "Löschungsankündigung",
      "state": "Berlin",
      "amtsgericht": "Amtsgericht Berlin (Charlottenburg)",
      "registernummer": "HRB 214959",
      "registerart": "HRB",
      "company_name": "Elagumed OÜ",
      "company_seat": "Berlin",
      "details": "16.01.2026 (Bekanntmachungsdatum)\n\nBerlin Amtsgericht Berlin (Charlottenburg) HRB 214959\nLöschungsankündigung\n\nElagumed OÜ\nRechtsform ausländischen Rechts HRB\nBerlin\n\nEs ist beabsichtigt, die Eintragung wegen Mangels einer wesentlichen Voraussetzung gemäß § 395 FamFG von Amts wegen zu löschen. Widerspruchsfrist 6 Wochen"
    },
    {
      "date": "2026-01-16",
      "id": "142605",
      "original_text": "Einreichung neuer Dokumente\nBrandenburg Amtsgericht Neuruppin HRB 1926\nRinderzucht Lanz - Lenzen AG – Lenzen",
      "type": "Einreichung neuer Dokumente",
      "state": "Brandenburg",
      "amtsgericht": "Amtsgericht Neuruppin",
      "registernummer": "HRB 1926",
      "registerart": "HRB",
      "company_name": "Rinderzucht Lanz - Lenzen AG",
      "company_seat": "Lenzen",
      "details": "16.01.2026 (Bekanntmachungsdatum)\n\nBrandenburg Amtsgericht Neuruppin HRB 1926\nEinreichung neuer Dokumente\n\nRinderzucht Lanz - Lenzen AG\nAktiengesellschaft\nLenzen\n\nAls nicht eingetragen wird veröffentlicht: Eine Liste der Mitglieder des Aufsichtsrates wurde zum Handelsregister eingereicht."
    },
    {
      "date": "2026-01-16",
      "id": "142606",
      "original_text": "Löschungsankündigung\nBrandenburg Amtsgericht Frankfurt/Oder HRB 18649\nPickShop GmbH – Küstriner Vorland",
      "type": "Löschungsankündigung",
      "state": "Brandenburg",
      "amtsgericht": "Amtsgericht Frankfurt/Oder",
      "registernummer": "HRB 18649",
      "registerart": "HRB",
      "company_name": "PickShop GmbH",
      "company_seat": "Küstriner Vorland",
      "details": "16.01.2026 (Bekanntmachungsdatum)\n\nBrandenburg Amtsgericht Frankfurt/Oder HRB 18649\nLöschungsankündigung\n\nPickShop GmbH\nGesellschaft mit beschränkter Haftung\nKüstriner Vorland\n\nBei der nachstehenden Gesellschaft wird das Amtslöschungsverfahren gemäß § 394 FamFG eingeleitet."
    },
    {
      "date": "2026-01-16",
      "id": "142607",
      "original_text": "Registerbekanntmachung nach dem Umwandlungsgesetz\nBaden-Württemberg Amtsgericht Stuttgart HRB 735470\nGG Event GmbH Grauer – Reutlingen",
      "type": "Registerbekanntmachung nach dem Umwandlungsgesetz",
      "state": "Baden-Württemberg",
      "amtsgericht": "Amtsgericht Stuttgart",
      "registernummer": "HRB 735470",
      "registerart": "HRB",
      "company_name": "GG Event GmbH Grauer",
      "company_seat": "Reutlingen",
      "details": "16.01.2026 (Bekanntmachungsdatum)\n\nBaden-Württemberg Amtsgericht Stuttgart HRB 735470\nRegisterbekanntmachung nach dem Umwandlungsgesetz 16.01.2026 (Eintragungsdatum)\n\nGG Event GmbH Grauer\nGesellschaft mit beschränkter Haftung\nReutlingen\n\nAls nicht eingetragen wird bekanntgemacht:\nDen Gläubigern der an der Verschmelzung beteiligten Rechtsträger ist, wenn sie binnen sechs Monaten nach dem Tag, an dem die Eintragung der Verschmelzung in das Register des Sitzes desjenigen Rechtsträgers, dessen Gläubiger sie sind, nach § 19 Abs. 3 UmwG als bekanntgemacht gilt, ihren Anspruch nach Grund und Höhe schriftlich anmelden, Sicherheit zu leisten, soweit sie nicht Befriedigung verlangen können. Dieses Recht steht den Gläubigern jedoch nur zu, wenn sie glaubhaft machen, dass durch die Verschmelzung die Erfüllung ihrer Forderung gefährdet wird."
    },
    {
      "date": "2026-01-16",
      "id": "142608",
      "original_text": "Löschungsankündigung\nBrandenburg Amtsgericht Frankfurt/Oder HRB 16879\nYD Express GmbH – Gosen-Neu Zittau",
      "type": "Löschungsankündigung",
      "state": "Brandenburg",
      "amtsgericht": "Amtsgericht Frankfurt/Oder",
      "registernummer": "HRB 16879",
      "registerart": "HRB",
      "company_name": "YD Express GmbH",
      "company_seat": "Gosen-Neu Zittau",
      "details": "16.01.2026 (Bekanntmachungsdatum)\n\nBrandenburg Amtsgericht Frankfurt/Oder HRB 16879\nLöschungsankündigung\n\nYD Express GmbH\nGesellschaft mit beschränkter Haftung\nGosen-Neu Zittau\n\nBei der nachstehenden Gesellschaft wird das Amtslöschungsverfahren gemäß § 394 FamFG eingeleitet."
    },
    {
      "date": "2026-01-16",
      "id": "142609",
      "original_text": "Löschungsankündigung\nBerlin Amtsgericht Berlin (Charlottenburg) HRB 200249\nGewinner Verlag UG Unternehmergesellschaft (haftungsbeschränkt) – Berlin",
      "type": "Löschungsankündigung",
      "state": "Berlin",
      "amtsgericht": "Amtsgericht Berlin (Charlottenburg)",
      "registernummer": "HRB 200249",
      "registerart": "HRB",
      "company_name": "Gewinner Verlag UG Unternehmergesellschaft (haftungsbeschränkt)",
      "company_seat": "Berlin",
      "details": "16.01.2026 (Bekanntmachungsdatum)\n\nBerlin Amtsgericht Berlin (Charlottenburg) HRB 200249\nLöschungsankündigung\n\nGewinner Verlag UG Unternehmergesellschaft (haftungsbeschränkt)\nGesellschaft mit beschränkter Haftung\nBerlin\n\nBei der nachstehenden Gesellschaft wird das Amtslöschungsverfahren gemäß § 394 FamFG eingeleitet. Widerspruchsfrist 6 Wochen"
    },
    {
      "date": "2026-01-16",
      "id": "142610",
      "original_text": "Registerbekanntmachung nach dem Umwandlungsgesetz\nBaden-Württemberg Amtsgericht Freiburg HRB 731281\nPirum Tax GmbH – March",
      "type": "Registerbekanntmachung nach dem Umwandlungsgesetz",
      "state": "Baden-Württemberg",
      "amtsgericht": "Amtsgericht Freiburg",
      "registernummer": "HRB 731281",
      "registerart": "HRB",
      "company_name": "Pirum Tax GmbH",
      "company_seat": "March",
      "details": "16.01.2026 (Bekanntmachungsdatum)\n\nBaden-Württemberg Amtsgericht Freiburg HRB 731281\nRegisterbekanntmachung nach dem Umwandlungsgesetz\n\nPirum Tax GmbH\nGesellschaft mit beschränkter Haftung\nMarch\n\nDen Gläubigern der an der Verschmelzung beteiligten Rechtsträger ist, wenn sie binnen sechs Monaten nach dem Tag, an dem die Eintragung der Verschmelzung in das Register des Sitzes desjenigen Rechtsträgers, dessen Gläubiger sie sind, nach § 19 Abs. 3 UmwG als bekanntgemacht gilt, ihren Anspruch nach Grund und Höhe schriftlich anmelden, Sicherheit zu leisten, soweit sie nicht Befriedigung verlangen können. Dieses Recht steht den Gläubigern jedoch nur zu, wenn sie glaubhaft machen, dass durch die Verschmelzung die Erfüllung ihrer Forderung gefährdet wird."
    },
    {
      "date": "2026-01-16",
      "id": "142611",
      "original_text": "Löschungsankündigung\nBerlin Amtsgericht Berlin (Charlottenburg) HRB 235978\nzazax UG (haftungsbeschränkt) – Berlin",
      "type": "Löschungsankündigung",
      "state": "Berlin",
      "amtsgericht": "Amtsgericht Berlin (Charlottenburg)",
      "registernummer": "HRB 235978",
      "registerart": "HRB",
      "company_name": "zazax UG (haftungsbeschränkt)",
      "company_seat": "Berlin",
      "details": "16.01.2026 (Bekanntmachungsdatum)\n\nBerlin Amtsgericht Berlin (Charlottenburg) HRB 235978\nLöschungsankündigung\n\nzazax UG (haftungsbeschränkt)\nGesellschaft mit beschränkter Haftung\nBerlin\n\nBei der nachstehenden Gesellschaft wird das Amtslöschungsverfahren gemäß § 394 FamFG eingeleitet. Widerspruchsfrist 6 Wochen"
    },
    {
      "date": "2026-01-16",
      "id": "142612",
      "original_text": "Einreichung neuer Dokumente\nThüringen Amtsgericht Jena HRB 201296\nCarl Zeiss Jena GmbH – Jena",
      "type": "Einreichung neuer Dokumente",
      "state": "Thüringen",
      "amtsgericht": "Amtsgericht Jena",
      "registernummer": "HRB 201296",
      "registerart": "HRB",
      "company_name": "Carl Zeiss Jena GmbH",
      "company_seat": "Jena",
      "details": "16.01.2026 (Bekanntmachungsdatum)\n\nThüringen Amtsgericht Jena HRB 201296\nEinreichung neuer Dokumente\n\nCarl Zeiss Jena GmbH\nGesellschaft mit beschränkter Haftung\nJena\n\nBekanntmachung gem. § 52 Abs. 3 Satz 2 GmbHG: Aufgrund einer Veränderung in den Personen der Aufsichtsratsmitglieder ist durch die Geschäftsführer eine neue Liste zum Handelsregister eingereicht worden."
    },
    {
      "date": "2026-01-16",
      "id": "142613",
      "original_text": "Sonstige Registerbekanntmachung\nThüringen Amtsgericht Gotha VR 141705\nVC Thüringer Wald e. V. – Bad Tabarz",
      "type": "Sonstige Registerbekanntmachung",
      "state": "Thüringen",
      "amtsgericht": "Amtsgericht Gotha",
      "registernummer": "VR 141705",
      "registerart": "VR",
      "company_name": "VC Thüringer Wald e. V.",
      "company_seat": "Bad Tabarz",
      "details": "16.01.2026 (Bekanntmachungsdatum)\n\nThüringen Amtsgericht Gotha VR 141705\nSonstige Registerbekanntmachung 16.01.2026 (Eintragungsdatum)\n\nVC Thüringer Wald e. V.\neingetragener Verein\nBad Tabarz"
    },
    {
      "date": "2026-01-16",
      "id": "142614",
      "original_text": "Sonstige Registerbekanntmachung\nSchleswig-Holstein Amtsgericht Lübeck HRB 17163\nKeeeb Europe GmbH – Lübeck",
      "type": "Sonstige Registerbekanntmachung",
      "state": "Schleswig-Holstein",
      "amtsgericht": "Amtsgericht Lübeck",
      "registernummer": "HRB 17163",
      "registerart": "HRB",
      "company_name": "Keeeb Europe GmbH",
      "company_seat": "Lübeck",
      "details": "16.01.2026 (Bekanntmachungsdatum)\n\nSchleswig-Holstein Amtsgericht Lübeck HRB 17163\nSonstige Registerbekanntmachung\n\nKeeeb Europe GmbH\nGesellschaft mit beschränkter Haftung\nLübeck\n\nAls nicht eingetragen wird veröffentlicht:\n\nAmtsgericht Lübeck, Am Burgfeld 7, 23568 Lübeck\n\nKeeeb Europe GmbH\nBeckergrube 29-33 / Fünfhausen 1\n23552 Lübeck\n\nUnser Zeichen: HRB 17163 HL\nDatum: 15.01.2026\n\nSehr geehrte Damen und Herren,\n\nin der Handelsregistersache der\n\nKeeeb Europe GmbH\n\nergeben sich aus den mir vorliegenden Unterlagen Anhaltspunkte dafür, dass die Gesellschaft vermögenslos ist:\n\nBeschluss des Amtsgerichts Lübeck vom 08.12.2025 über die Einstellung des Insolvenzverfahrens wegen Masseunzulänglichkeit, § 211 InsO.\n\nIch beabsichtige daher, die Gesellschaft wegen Vermögenslosigkeit gemäß § 394 FamFG zu löschen.\n\nIch bestimme eine Frist von einem Monat zur Geltendmachung eines Widerspruchs gegen die Löschung, § 394 Abs. 2 S. 1 FamFG.\n\nWeiter bitte ich Sie, mir binnen derselben Frist mitzuteilen, ob die genannte Gesellschaft noch Vermögen hat, ggf. welche Vermögensgegenstände sie besitzt, ob die Gesellschaft noch Partei eines noch nicht rechtskräftig abgeschlossenen Rechtsstreits ist oder ob sonst noch eine Abwicklung stattfindet.\n\nNach Fristablauf ohne Widerspruch von Ihnen oder anderer Seite wird die Gesellschaft gelöscht.\n\nMit freundlichen Grüßen\n\nOstermann\nDipl.-Rechtspflegerin (FH)"
    },
    {
      "date": "2026-01-16",
      "id": "142615",
      "original_text": "Löschungsankündigung\nSaarland Amtsgericht Saarbrücken HRB 19210\nAchten GmbH – Beckingen",
      "type": "Löschungsankündigung",
      "state": "Saarland",
      "amtsgericht": "Amtsgericht Saarbrücken",
      "registernummer": "HRB 19210",
      "registerart": "HRB",
      "company_name": "Achten GmbH",
      "company_seat": "Beckingen",
      "details": "16.01.2026 (Bekanntmachungsdatum)\n\nSaarland Amtsgericht Saarbrücken HRB 19210\nLöschungsankündigung\n\nAchten GmbH\nGesellschaft mit beschränkter Haftung\nBeckingen\n\nEs ist beabsichtigt, die Gesellschaft von Amts wegen gemäß § 394 FamFG wegen Vermögenslosigkeit zu löschen.\nGegen die Löschung von Amts wegen ist das Rechtsmittel des Widerspruchs statthaft. Der Widerspruch ist binnen einer Frist zwei Monaten beginnend mit dem Tag dieser Veröffentlichung durch Einreichen eines Widerspruchsschreibens -schriftlich oder zur Niederschrift der Geschäftsstelle beim Amtsgericht Saarbrücken, -zentrales Handelsregister-, Mainzer Str.178, 66121 Saarbrücken einzulegen.\nDer Widerspruch muss die Bezeichnung der angefochtenen Löschungsankündigung enthalten sowie die Erklärung, dass Widerspruch eingelegt wird. Er ist vom Widerspruchsführer oder seinem Bevollmächtigten zu unterzeichnen.\nDas Widerspruchsschreiben kann auch in der Form eines elektronischen Dokumentes eingereicht werden, das mit einer qualifizierten elektronischen Signatur nach dem Signaturgesetz versehen sein muss (§§ 14 Abs. 2 FamFG, 130a, 298 ZPO)."
    },
    {
      "date": "2026-01-16",
      "id": "142616",
      "original_text": "Löschungsankündigung\nSchleswig-Holstein Amtsgericht Lübeck HRB 17163\nKeeeb Europe GmbH – Lübeck",
      "type": "Löschungsankündigung",
      "state": "Schleswig-Holstein",
      "amtsgericht": "Amtsgericht Lübeck",
      "registernummer": "HRB 17163",
      "registerart": "HRB",
      "company_name": "Keeeb Europe GmbH",
      "company_seat": "Lübeck",
      "details": "16.01.2026 (Bekanntmachungsdatum)\n\nSchleswig-Holstein Amtsgericht Lübeck HRB 17163\nLöschungsankündigung\n\nKeeeb Europe GmbH\nGesellschaft mit beschränkter Haftung\nLübeck\n\nEs ist die Löschung der nachstehenden Gesellschaft wegen Vermögenslosigkeit gemäß § 394 FamFG beabsichtigt. Widerspruchsfrist: 1 Monat"
    },
    {
      "date": "2026-01-16",
      "id": "142617",
      "original_text": "Registerbekanntmachung nach dem Umwandlungsgesetz\nHamburg Amtsgericht Hamburg HRB 91571\nVerwaltung Dreiundsechzigste IFH geschlossener Immobilienfonds für Holland GmbH – Hamburg",
      "type": "Registerbekanntmachung nach dem Umwandlungsgesetz",
      "state": "Hamburg",
      "amtsgericht": "Amtsgericht Hamburg",
      "registernummer": "HRB 91571",
      "registerart": "HRB",
      "company_name": "Verwaltung Dreiundsechzigste IFH geschlossener Immobilienfonds für Holland GmbH",
      "company_seat": "Hamburg",
      "details": "16.01.2026 (Bekanntmachungsdatum)\n\nHamburg Amtsgericht Hamburg HRB 91571\nRegisterbekanntmachung nach dem Umwandlungsgesetz 15.01.2026 (Eintragungsdatum)\n\nVerwaltung Dreiundsechzigste IFH geschlossener Immobilienfonds für Holland GmbH\nGesellschaft mit beschränkter Haftung\nHamburg\n\nAls nicht eingetragen wird bekannt gemacht:\nDen Gläubigern der an der Verschmelzung beteiligten Gesellschaften ist, wenn sie binnen sechs Monaten nach dem Tag, an dem die Eintragung der Verschmelzung in das Register des Sitzes desjenigen Rechtsträgers, dessen Gläubiger sie sind, nach § 19 Absatz 3 UmwG als bekannt gemacht gilt, ihren Anspruch nach Grund und Höhe schriftlich anmelden, Sicherheit zu leisten, soweit sie nicht Befriedigung verlangen können. Dieses Recht steht den Gläubigern jedoch nur zu, wenn sie glaubhaft machen, dass durch die Verschmelzung die Erfüllung ihrer Forderung gefährdet wird."
    },
    {
      "date": "2026-01-16",
      "id": "142618",
      "original_text": "Registerbekanntmachung nach dem Umwandlungsgesetz\nHamburg Amtsgericht Hamburg HRB 91570\nVerwaltung Zweiundsechzigste IFH geschlossener Immobilienfonds für Holland GmbH – Hamburg",
      "type": "Registerbekanntmachung nach dem Umwandlungsgesetz",
      "state": "Hamburg",
      "amtsgericht": "Amtsgericht Hamburg",
      "registernummer": "HRB 91570",
      "registerart": "HRB",
      "company_name": "Verwaltung Zweiundsechzigste IFH geschlossener Immobilienfonds für Holland GmbH",
      "company_seat": "Hamburg",
      "details": "16.01.2026 (Bekanntmachungsdatum)\n\nHamburg Amtsgericht Hamburg HRB 91570\nRegisterbekanntmachung nach dem Umwandlungsgesetz 15.01.2026 (Eintragungsdatum)\n\nVerwaltung Zweiundsechzigste IFH geschlossener Immobilienfonds für Holland GmbH\nGesellschaft mit beschränkter Haftung\nHamburg\n\nAls nicht eingetragen wird bekannt gemacht:\nDen Gläubigern der an der Verschmelzung beteiligten Gesellschaften ist, wenn sie binnen sechs Monaten nach dem Tag, an dem die Eintragung der Verschmelzung in das Register des Sitzes desjenigen Rechtsträgers, dessen Gläubiger sie sind, nach § 19 Absatz 3 UmwG als bekannt gemacht gilt, ihren Anspruch nach Grund und Höhe schriftlich anmelden, Sicherheit zu leisten, soweit sie nicht Befriedigung verlangen können. Dieses Recht steht den Gläubigern jedoch nur zu, wenn sie glaubhaft machen, dass durch die Verschmelzung die Erfüllung ihrer Forderung gefährdet wird."
    },
    {
      "date": "2026-01-16",
      "id": "142619",
      "original_text": "Löschungsankündigung\nHamburg Amtsgericht Hamburg HRB 153926\nWaernbergs, eine Zweigniederlassung der Krutrök Media AB – Hamburg",
      "type": "Löschungsankündigung",
      "state": "Hamburg",
      "amtsgericht": "Amtsgericht Hamburg",
      "registernummer": "HRB 153926",
      "registerart": "HRB",
      "company_name": "Waernbergs, eine Zweigniederlassung der Krutrök Media AB",
      "company_seat": "Hamburg",
      "details": "16.01.2026 (Bekanntmachungsdatum)\n\nHamburg Amtsgericht Hamburg HRB 153926\nLöschungsankündigung\n\nWaernbergs, eine Zweigniederlassung der Krutrök Media AB\nRechtsform ausländischen Rechts HRB\nHamburg\n\nBei dem hiesigen Handelsregister ist eine Nachricht über das Europäisches System der\nRegistervernetzung eingegangen, aus der sich ergeben soll, dass die Krutrök Media AB mit\neiner anderen, ebenfalls schwedischen Gesellschaft verschmolzen sein soll. Eine Recherche\nin dem schwedischen Handelsregister hat nun ergeben, dass unter der Nummer\n556783-9195 eine \"Sista versen 86030 AB\" registriert war, die durch Verschmelzung am\n25.03.2025 aufgelöst worden ist. Der übernehmende Rechtsträger soll die Slutklämmen\nTMMAR253 AB, 559494-6583 sein. Die Registereintrag wäre damit unrichtig.\nIst die schwedische Hauptgesellschaft erloschen, ist der Eintragung der hiesigen\nZweiniederlassung die Grundlage entzogen. Sie teilt das rechtliche Schicksal der\nHauptniederlassung und ist deshalb ebenfalls erloschen. Die Eintragung der\nZweigniederlassung ist damit wegen des Mangels einer wesentlichen Voraussetzung\nunzulässig geworden. Das Registergericht beabsichtigt daher, die Eintragung der\nZweigniederlassung gemäß § 395 des Gesetzes über das Verfahren in Familiensachen und\nin Angelegenheiten der freiwilligen Gerichtsbarkeit (FamFG) von Amts wegen zu löschen.\nGegen die beabsichtigte Löschung kann innerhalb eines Monats seit dieser\nBekanntmachung Widerspruch beim\nAmtsgericht Hamburg - Registergericht -, Caffamacherreihe 20, 20355 Hamburg,\nschriftlich oder zur Niederschrift der Geschäftsstelle oder des Rechtspflegers eingelegt\nwerden. Der Widerspruch kann auch zu Protokoll der Geschäftsstelle eines anderen\nAmtsgerichtes erfolgen. In diesem Falle ist die Frist nur dann gewahrt, wenn das den\nWiderspruch enthaltende Protokoll innerhalb der Frist bei dem Registergericht eingeht.\nSofern binnen der genannten Frist kein Widerspruch eingeht, wird das Gericht die\ngenannten Eintragungen von Amts wegen löschen."
    },
    {
      "date": "2026-01-16",
      "id": "142620",
      "original_text": "Löschungsankündigung\nBerlin Amtsgericht Berlin (Charlottenburg) HRB 141658\nDEM Jooobs Personalservice GmbH – Berlin",
      "type": "Löschungsankündigung",
      "state": "Berlin",
      "amtsgericht": "Amtsgericht Berlin (Charlottenburg)",
      "registernummer": "HRB 141658",
      "registerart": "HRB",
      "company_name": "DEM Jooobs Personalservice GmbH",
      "company_seat": "Berlin",
      "details": "16.01.2026 (Bekanntmachungsdatum)\n\nBerlin Amtsgericht Berlin (Charlottenburg) HRB 141658\nLöschungsankündigung\n\nDEM Jooobs Personalservice GmbH\nGesellschaft mit beschränkter Haftung\nBerlin\n\nBei der nachstehenden Gesellschaft wird das Amtslöschungsverfahren gemäß § 394 FamFG eingeleitet. Widerspruchsfrist 6 Wochen"
    },
    {
      "date": "2026-01-16",
      "id": "142621",
      "original_text": "Einreichung neuer Dokumente\nBaden-Württemberg Amtsgericht Stuttgart HRB 23192\nBosch Rexroth Aktiengesellschaft – Stuttgart",
      "type": "Einreichung neuer Dokumente",
      "state": "Baden-Württemberg",
      "amtsgericht": "Amtsgericht Stuttgart",
      "registernummer": "HRB 23192",
      "registerart": "HRB",
      "company_name": "Bosch Rexroth Aktiengesellschaft",
      "company_seat": "Stuttgart",
      "details": "16.01.2026 (Bekanntmachungsdatum)\n\nBaden-Württemberg Amtsgericht Stuttgart HRB 23192\nEinreichung neuer Dokumente\n\nBosch Rexroth Aktiengesellschaft\nAktiengesellschaft\nStuttgart\n\nDie Gesellschaft hat am 15.01.2026 die Liste über die Zusammensetzung des Aufsichtsrats zum Handelsregister eingereicht."
    },
    {
      "date": "2026-01-16",
      "id": "142622",
      "original_text": "Einreichung neuer Dokumente\nSaarland Amtsgericht Saarbrücken HRB 2964\nStadtwerke Homburg GmbH – Homburg",
      "type": "Einreichung neuer Dokumente",
      "state": "Saarland",
      "amtsgericht": "Amtsgericht Saarbrücken",
      "registernummer": "HRB 2964",
      "registerart": "HRB",
      "company_name": "Stadtwerke Homburg GmbH",
      "company_seat": "Homburg",
      "details": "16.01.2026 (Bekanntmachungsdatum)\n\nSaarland Amtsgericht Saarbrücken HRB 2964\nEinreichung neuer Dokumente 16.01.2026 (Eintragungsdatum)\n\nStadtwerke Homburg GmbH\nGesellschaft mit beschränkter Haftung\nHomburg\n\nDie Geschäftsführung der Gesellschaft hat eine Liste der Mitglieder des Aufsichtsrats zum Handelsregister eingereicht (§ 52 Abs. 3 Satz 2 GmbHG)."
    },
    {
      "date": "2026-01-16",
      "id": "142623",
      "original_text": "Sonstige Registerbekanntmachung\nHamburg Amtsgericht Hamburg HRB 87366\nHamburg Commercial Bank AG – Hamburg",
      "type": "Sonstige Registerbekanntmachung",
      "state": "Hamburg",
      "amtsgericht": "Amtsgericht Hamburg",
      "registernummer": "HRB 87366",
      "registerart": "HRB",
      "company_name": "Hamburg Commercial Bank AG",
      "company_seat": "Hamburg",
      "details": "16.01.2026 (Bekanntmachungsdatum)\n\nHamburg Amtsgericht Hamburg HRB 87366\nSonstige Registerbekanntmachung\n\nHamburg Commercial Bank AG\nAktiengesellschaft\nHamburg\n\nAls nicht eingetragen wird bekannt gemacht: Liste des Aufsichtsrats wurde eingereicht."
    },
    {
      "date": "2026-01-16",
      "id": "142624",
      "original_text": "Sonstige Registerbekanntmachung\nSachsen Amtsgericht Leipzig HRB 19227\nGEO-METRIK-Ingenieurgesellschaft mbH Leipzig – Leipzig",
      "type": "Sonstige Registerbekanntmachung",
      "state": "Sachsen",
      "amtsgericht": "Amtsgericht Leipzig",
      "registernummer": "HRB 19227",
      "registerart": "HRB",
      "company_name": "GEO-METRIK-Ingenieurgesellschaft mbH Leipzig",
      "company_seat": "Leipzig",
      "details": "16.01.2026 (Bekanntmachungsdatum)\n\nSachsen Amtsgericht Leipzig HRB 19227\nSonstige Registerbekanntmachung 16.01.2026 (Eintragungsdatum)\n\nGEO-METRIK-Ingenieurgesellschaft mbH Leipzig\nGesellschaft mit beschränkter Haftung\nLeipzig\n\nDen Gläubigern der Gesellschaft, deren Forderungen begründet worden sind bevor die Eintragung der Beendigung des Beherrschungs- und Gewinnabführungsvertrages in das Handelsregister nach § 10 des Handelsgesetzbuches als bekanntgemacht gilt, hat der andere Vertragsteil Sicherheit zu leisten, wenn sie sich binnen sechs Monaten nach der Bekanntmachung der Eintragung zu diesem Zweck bei ihm melden."
    },
    {
      "date": "2026-01-16",
      "id": "142625",
      "original_text": "Löschungsankündigung\nSachsen Amtsgericht Leipzig HRA 13298\nRPM GmbH & Co. KG - Projekt Brandis – Markkleeberg",
      "type": "Löschungsankündigung",
      "state": "Sachsen",
      "amtsgericht": "Amtsgericht Leipzig",
      "registernummer": "HRA 13298",
      "registerart": "HRA",
      "company_name": "RPM GmbH & Co. KG - Projekt Brandis",
      "company_seat": "Markkleeberg",
      "details": "16.01.2026 (Bekanntmachungsdatum)\n\nSachsen Amtsgericht Leipzig HRA 13298\nLöschungsankündigung\n\nRPM GmbH & Co. KG - Projekt Brandis\nKommanditgesellschaft\nMarkkleeberg\n\nDas Registergericht beabsichtigt, den im Handelsregister eingetragenen Das Registergericht beabsichtigt, die im Handelsregister eingetragene Firma von Amts wegen nach § 31 Abs. 2 HGB, 393 FamFG zu löschen. Die Frist zur Erhebung eines Widerspruchs gegen die beabsichtigte Löschung wird auf einen Monat festgesetzt."
    },
    {
      "date": "2026-01-16",
      "id": "142626",
      "original_text": "Einreichung neuer Dokumente\nSachsen Amtsgericht Leipzig HRB 35062\nQUARTERBACK Immobilien AG – Leipzig",
      "type": "Einreichung neuer Dokumente",
      "state": "Sachsen",
      "amtsgericht": "Amtsgericht Leipzig",
      "registernummer": "HRB 35062",
      "registerart": "HRB",
      "company_name": "QUARTERBACK Immobilien AG",
      "company_seat": "Leipzig",
      "details": "16.01.2026 (Bekanntmachungsdatum)\n\nSachsen Amtsgericht Leipzig HRB 35062\nEinreichung neuer Dokumente\n\nQUARTERBACK Immobilien AG\nAktiengesellschaft\nLeipzig\n\nAm 14.01.2026 wurde beim Handelsregister des Amtsgerichts Leipzig die Liste der Mitglieder des Aufsichtsrats gemäß § 106 AktG eingereicht."
    },
    {
      "date": "2026-01-16",
      "id": "142627",
      "original_text": "Sonstige Registerbekanntmachung\nSachsen Amtsgericht Leipzig HRB 13936\nVeolia Wasser Deutschland GmbH – Leipzig",
      "type": "Sonstige Registerbekanntmachung",
      "state": "Sachsen",
      "amtsgericht": "Amtsgericht Leipzig",
      "registernummer": "HRB 13936",
      "registerart": "HRB",
      "company_name": "Veolia Wasser Deutschland GmbH",
      "company_seat": "Leipzig",
      "details": "16.01.2026 (Bekanntmachungsdatum)\n\nSachsen Amtsgericht Leipzig HRB 13936\nSonstige Registerbekanntmachung 16.01.2026 (Eintragungsdatum)\n\nVeolia Wasser Deutschland GmbH\nGesellschaft mit beschränkter Haftung\nLeipzig\n\nDen Gläubigern der Gesellschaft, deren Forderungen begründet worden sind bevor die Eintragung der Beendigung des Beherrschungs- und Gewinnabführungsvertrages in das Handelsregister nach § 10 des Handelsgesetzbuches als bekanntgemacht gilt, hat der andere Vertragsteil Sicherheit zu leisten, wenn sie sich binnen sechs Monaten nach der Bekanntmachung der Eintragung zu diesem Zweck bei ihm melden."
    },
    {
      "date": "2026-01-16",
      "id": "142628",
      "original_text": "Registerbekanntmachung nach dem Umwandlungsgesetz\nNiedersachsen Amtsgericht Oldenburg (Oldenburg) HRB 202297\nFleuren Beteiligungs-GmbH – Friesoythe/OT Markhausen",
      "type": "Registerbekanntmachung nach dem Umwandlungsgesetz",
      "state": "Niedersachsen",
      "amtsgericht": "Amtsgericht Oldenburg (Oldenburg)",
      "registernummer": "HRB 202297",
      "registerart": "HRB",
      "company_name": "Fleuren Beteiligungs-GmbH",
      "company_seat": "Friesoythe/OT Markhausen",
      "details": "16.01.2026 (Bekanntmachungsdatum)\n\nNiedersachsen Amtsgericht Oldenburg (Oldenburg) HRB 202297\nRegisterbekanntmachung nach dem Umwandlungsgesetz 16.01.2026 (Eintragungsdatum)\n\nFleuren Beteiligungs-GmbH\nGesellschaft mit beschränkter Haftung\nFriesoythe/OT Markhausen\n\nDen Gläubigern der an der Verschmelzung beteiligten Rechtsträger ist, wenn sie binnen sechs Monaten nach dem Tag, an dem die Eintragung der Verschmelzung in das Register des Sitzes desjenigen Rechtsträgers, dessen Gläubiger sie sind, nach § 19  Abs.  3 UmwG als bekannt gemacht gilt, ihren Anspruch nach Grund und Höhe schriftlich anmelden, Sicherheit zu leisten, soweit sie nicht Befriedigung verlangen können. Dieses Recht steht den Gläubigern jedoch nur zu, wenn sie glaubhaft machen, dass durch die Verschmelzung die Erfüllung der Forderung gefährdet wird."
    },
    {
      "date": "2026-01-16",
      "id": "142629",
      "original_text": "Löschungsankündigung\nNiedersachsen Amtsgericht Göttingen HRB 205414\nPrime-Ideal GmbH – Duderstadt",
      "type": "Löschungsankündigung",
      "state": "Niedersachsen",
      "amtsgericht": "Amtsgericht Göttingen",
      "registernummer": "HRB 205414",
      "registerart": "HRB",
      "company_name": "Prime-Ideal GmbH",
      "company_seat": "Duderstadt",
      "details": "16.01.2026 (Bekanntmachungsdatum)\n\nNiedersachsen Amtsgericht Göttingen HRB 205414\nLöschungsankündigung\n\nPrime-Ideal GmbH\nGesellschaft mit beschränkter Haftung\nDuderstadt\n\nDas Registergericht beabsichtigt, die Gesellschaft von Amts wegen nach § 394 FamFG zu löschen. Die Frist zur Erhebung eines Widerspruchs ist auf 1 Monat ab dieser Registerbekanntmachung festgesetzt."
    },
    {
      "date": "2026-01-16",
      "id": "142630",
      "original_text": "Registerbekanntmachung nach dem Umwandlungsgesetz\nNiedersachsen Amtsgericht Hannover HRB 51921\nNordland Investment GmbH – Langenhagen",
      "type": "Registerbekanntmachung nach dem Umwandlungsgesetz",
      "state": "Niedersachsen",
      "amtsgericht": "Amtsgericht Hannover",
      "registernummer": "HRB 51921",
      "registerart": "HRB",
      "company_name": "Nordland Investment GmbH",
      "company_seat": "Langenhagen",
      "details": "16.01.2026 (Bekanntmachungsdatum)\n\nNiedersachsen Amtsgericht Hannover HRB 51921\nRegisterbekanntmachung nach dem Umwandlungsgesetz 16.01.2026 (Eintragungsdatum)\n\nNordland Investment GmbH\nGesellschaft mit beschränkter Haftung\nLangenhagen\n\nDen Gläubigern der an der Verschmelzung beteiligten Rechtsträger ist, wenn sie binnen sechs Monaten nach dem Tag, an dem die Eintragung der Verschmelzung in das Register des Sitzes desjenigen Rechtsträgers, dessen Gläubiger sie sind, nach § 19  Abs.  3 UmwG als bekannt gemacht gilt, ihren Anspruch nach Grund und Höhe schriftlich anmelden, Sicherheit zu leisten, soweit sie nicht Befriedigung verlangen können. Dieses Recht steht den Gläubigern jedoch nur zu, wenn sie glaubhaft machen, dass durch die Verschmelzung die Erfüllung der Forderung gefährdet wird."
    },
    {
      "date": "2026-01-16",
      "id": "142631",
      "original_text": "Registerbekanntmachung nach dem Umwandlungsgesetz\nNiedersachsen Amtsgericht Braunschweig HRB 209180\nHelms Vermögensverwaltung GmbH – Wolfenbüttel",
      "type": "Registerbekanntmachung nach dem Umwandlungsgesetz",
      "state": "Niedersachsen",
      "amtsgericht": "Amtsgericht Braunschweig",
      "registernummer": "HRB 209180",
      "registerart": "HRB",
      "company_name": "Helms Vermögensverwaltung GmbH",
      "company_seat": "Wolfenbüttel",
      "details": "16.01.2026 (Bekanntmachungsdatum)\n\nNiedersachsen Amtsgericht Braunschweig HRB 209180\nRegisterbekanntmachung nach dem Umwandlungsgesetz 16.01.2026 (Eintragungsdatum)\n\nHelms Vermögensverwaltung GmbH\nGesellschaft mit beschränkter Haftung\nWolfenbüttel\n\nDen Gläubigern der an der Verschmelzung beteiligten Rechtsträger ist, wenn sie binnen sechs Monaten nach dem Tag, an dem die Eintragung der Verschmelzung in das Register des Sitzes desjenigen Rechtsträgers, dessen Gläubiger sie sind, nach § 19  Abs.  3 UmwG als bekannt gemacht gilt, ihren Anspruch nach Grund und Höhe schriftlich anmelden, Sicherheit zu leisten, soweit sie nicht Befriedigung verlangen können. Dieses Recht steht den Gläubigern jedoch nur zu, wenn sie glaubhaft machen, dass durch die Verschmelzung die Erfüllung der Forderung gefährdet wird."
    },
    {
      "date": "2026-01-16",
      "id": "142632",
      "original_text": "Einreichung neuer Dokumente\nNiedersachsen Amtsgericht Aurich HRB 100001 früher Amtsgericht Emden\nStadtwerke Emden GmbH – Emden",
      "type": "Einreichung neuer Dokumente",
      "state": "Niedersachsen",
      "amtsgericht": "Amtsgericht Aurich",
      "registernummer": "HRB 100001",
      "registerart": "HRB",
      "company_name": "Stadtwerke Emden GmbH",
      "company_seat": "Emden",
      "former_amtsgericht": "Emden",
      "details": "16.01.2026 (Bekanntmachungsdatum)\n\nNiedersachsen Amtsgericht Aurich HRB 100001 früher Amtsgericht Emden\nEinreichung neuer Dokumente\n\nStadtwerke Emden GmbH\nGesellschaft mit beschränkter Haftung\nEmden\n\nDie neue Liste der Mitglieder des Aufsichtsrats wurde beim Registergericht eingereicht."
    },
    {
      "date": "2026-01-16",
      "id": "142633",
      "original_text": "Registerbekanntmachung nach dem Umwandlungsgesetz\nNiedersachsen Amtsgericht Oldenburg (Oldenburg) HRB 150096 früher Amtsgericht Cloppenburg\nBeton- und Kunststoffe Fleuren GmbH – Friesoythe",
      "type": "Registerbekanntmachung nach dem Umwandlungsgesetz",
      "state": "Niedersachsen",
      "amtsgericht": "Amtsgericht Oldenburg (Oldenburg)",
      "registernummer": "HRB 150096",
      "registerart": "HRB",
      "company_name": "Beton- und Kunststoffe Fleuren GmbH",
      "company_seat": "Friesoythe",
      "former_amtsgericht": "Cloppenburg",
      "details": "16.01.2026 (Bekanntmachungsdatum)\n\nNiedersachsen Amtsgericht Oldenburg (Oldenburg) HRB 150096 früher Amtsgericht Cloppenburg\nRegisterbekanntmachung nach dem Umwandlungsgesetz 16.01.2026 (Eintragungsdatum)\n\nBeton- und Kunststoffe Fleuren GmbH\nGesellschaft mit beschränkter Haftung\nFriesoythe\n\nDen Gläubigern der an der Verschmelzung beteiligten Rechtsträger ist, wenn sie binnen sechs Monaten nach dem Tag, an dem die Eintragung der Verschmelzung in das Register des Sitzes desjenigen Rechtsträgers, dessen Gläubiger sie sind, nach § 19  Abs.  3 UmwG als bekannt gemacht gilt, ihren Anspruch nach Grund und Höhe schriftlich anmelden, Sicherheit zu leisten, soweit sie nicht Befriedigung verlangen können. Dieses Recht steht den Gläubigern jedoch nur zu, wenn sie glaubhaft machen, dass durch die Verschmelzung die Erfüllung der Forderung gefährdet wird."
    },
    {
      "date": "2026-01-16",
      "id": "142634",
      "original_text": "Registerbekanntmachung nach dem Umwandlungsgesetz\nNiedersachsen Amtsgericht Oldenburg (Oldenburg) HRB 203695\nH. W. Martens Verpachtungsgesellschaft mbH – Rastede",
      "type": "Registerbekanntmachung nach dem Umwandlungsgesetz",
      "state": "Niedersachsen",
      "amtsgericht": "Amtsgericht Oldenburg (Oldenburg)",
      "registernummer": "HRB 203695",
      "registerart": "HRB",
      "company_name": "H. W. Martens Verpachtungsgesellschaft mbH",
      "company_seat": "Rastede",
      "details": "16.01.2026 (Bekanntmachungsdatum)\n\nNiedersachsen Amtsgericht Oldenburg (Oldenburg) HRB 203695\nRegisterbekanntmachung nach dem Umwandlungsgesetz 16.01.2026 (Eintragungsdatum)\n\nH. W. Martens Verpachtungsgesellschaft mbH\nGesellschaft mit beschränkter Haftung\nRastede\n\nDen Gläubigern der an der Verschmelzung beteiligten Rechtsträger ist, wenn sie binnen sechs Monaten nach dem Tag, an dem die Eintragung der Verschmelzung in das Register des Sitzes desjenigen Rechtsträgers, dessen Gläubiger sie sind, nach § 19  Abs.  3 UmwG als bekannt gemacht gilt, ihren Anspruch nach Grund und Höhe schriftlich anmelden, Sicherheit zu leisten, soweit sie nicht Befriedigung verlangen können. Dieses Recht steht den Gläubigern jedoch nur zu, wenn sie glaubhaft machen, dass durch die Verschmelzung die Erfüllung der Forderung gefährdet wird."
    },
    {
      "date": "2026-01-16",
      "id": "142635",
      "original_text": "Löschungsankündigung\nNiedersachsen Amtsgericht Göttingen HRA 202126\nCosmopolitan Trading KG – Uslar",
      "type": "Löschungsankündigung",
      "state": "Niedersachsen",
      "amtsgericht": "Amtsgericht Göttingen",
      "registernummer": "HRA 202126",
      "registerart": "HRA",
      "company_name": "Cosmopolitan Trading KG",
      "company_seat": "Uslar",
      "details": "16.01.2026 (Bekanntmachungsdatum)\n\nNiedersachsen Amtsgericht Göttingen HRA 202126\nLöschungsankündigung\n\nCosmopolitan Trading KG\nKommanditgesellschaft\nUslar\n\nDas Registergericht beabsichtigt, die Firma von Amts wegen nach § 394 FamFG zu löschen. Die Frist zur Erhebung eines Widerspruchs ist auf 1 Monat ab dieser Registerbekanntmachung festgesetzt."
    },
    {
      "date": "2026-01-16",
      "id": "142636",
      "original_text": "Registerbekanntmachung nach dem Umwandlungsgesetz\nNiedersachsen Amtsgericht Hannover HRB 208937\nG.B. Verwaltungs GmbH – Langenhagen",
      "type": "Registerbekanntmachung nach dem Umwandlungsgesetz",
      "state": "Niedersachsen",
      "amtsgericht": "Amtsgericht Hannover",
      "registernummer": "HRB 208937",
      "registerart": "HRB",
      "company_name": "G.B. Verwaltungs GmbH",
      "company_seat": "Langenhagen",
      "details": "16.01.2026 (Bekanntmachungsdatum)\n\nNiedersachsen Amtsgericht Hannover HRB 208937\nRegisterbekanntmachung nach dem Umwandlungsgesetz 16.01.2026 (Eintragungsdatum)\n\nG.B. Verwaltungs GmbH\nGesellschaft mit beschränkter Haftung\nLangenhagen\n\nDen Gläubigern der an der Verschmelzung beteiligten Rechtsträger ist, wenn sie binnen sechs Monaten nach dem Tag, an dem die Eintragung der Verschmelzung in das Register des Sitzes desjenigen Rechtsträgers, dessen Gläubiger sie sind, nach § 19  Abs.  3 UmwG als bekannt gemacht gilt, ihren Anspruch nach Grund und Höhe schriftlich anmelden, Sicherheit zu leisten, soweit sie nicht Befriedigung verlangen können. Dieses Recht steht den Gläubigern jedoch nur zu, wenn sie glaubhaft machen, dass durch die Verschmelzung die Erfüllung der Forderung gefährdet wird."
    },
    {
      "date": "2026-01-16",
      "id": "142637",
      "original_text": "Löschungsankündigung\nNiedersachsen Amtsgericht Walsrode HRB 211473\nM.A.T. Hookah Tobacco GmbH – Liebenau",
      "type": "Löschungsankündigung",
      "state": "Niedersachsen",
      "amtsgericht": "Amtsgericht Walsrode",
      "registernummer": "HRB 211473",
      "registerart": "HRB",
      "company_name": "M.A.T. Hookah Tobacco GmbH",
      "company_seat": "Liebenau",
      "details": "16.01.2026 (Bekanntmachungsdatum)\n\nNiedersachsen Amtsgericht Walsrode HRB 211473\nLöschungsankündigung\n\nM.A.T. Hookah Tobacco GmbH\nGesellschaft mit beschränkter Haftung\nLiebenau\n\nDas Registergericht beabsichtigt, die Gesellschaft von Amts wegen nach § 393 FamFG, § 31 Abs. 2 HGB zu löschen. Die Frist zur Erhebung eines Widerspruchs ist auf 1 Monat ab dieser Registerbekanntmachung festgesetzt."
    },
    {
      "date": "2026-01-16",
      "id": "142638",
      "original_text": "Registerbekanntmachung nach dem Umwandlungsgesetz\nBaden-Württemberg Amtsgericht Stuttgart GsR 4023\nRAZO Energie eGbR – Bietigheim-Bissingen",
      "type": "Registerbekanntmachung nach dem Umwandlungsgesetz",
      "state": "Baden-Württemberg",
      "amtsgericht": "Amtsgericht Stuttgart",
      "registernummer": "GsR 4023",
      "registerart": "GsR",
      "company_name": "RAZO Energie eGbR",
      "company_seat": "Bietigheim-Bissingen",
      "details": "16.01.2026 (Bekanntmachungsdatum)\n\nBaden-Württemberg Amtsgericht Stuttgart GsR 4023\nRegisterbekanntmachung nach dem Umwandlungsgesetz 16.01.2026 (Eintragungsdatum)\n\nRAZO Energie eGbR\nGesellschaft bürgerlichen Rechts\nBietigheim-Bissingen\n\nAls nicht eingetragen wird bekanntgemacht:\nDen Gläubigern des an dem Formwechsel beteiligten Rechtsträgers ist, wenn sie binnen sechs Monaten nach dem Tag, an dem die Eintragung des Formwechsels in das Register des Sitzes desjenigen Rechtsträgers, dessen Gläubiger sie sind, nach § 19 Abs. 3 UmwG als bekanntgemacht gilt, ihren Anspruch nach Grund und Höhe schriftlich anmelden, Sicherheit zu leisten, soweit sie nicht Befriedigung verlangen können. Dieses Recht steht den Gläubigern jedoch nur zu, wenn sie glaubhaft machen, dass durch den Formwechsel die Erfüllung ihrer Forderung gefährdet wird."
    },
    {
      "date": "2026-01-16",
      "id": "142639",
      "original_text": "Registerbekanntmachung nach dem Umwandlungsgesetz\nRheinland-Pfalz Amtsgericht Zweibrücken HRB 1204\nSCHLIESSMEYER GmbH – Zweibrücken",
      "type": "Registerbekanntmachung nach dem Umwandlungsgesetz",
      "state": "Rheinland-Pfalz",
      "amtsgericht": "Amtsgericht Zweibrücken",
      "registernummer": "HRB 1204",
      "registerart": "HRB",
      "company_name": "SCHLIESSMEYER GmbH",
      "company_seat": "Zweibrücken",
      "details": "16.01.2026 (Bekanntmachungsdatum)\n\nRheinland-Pfalz Amtsgericht Zweibrücken HRB 1204\nRegisterbekanntmachung nach dem Umwandlungsgesetz 16.01.2026 (Eintragungsdatum)\n\nSCHLIESSMEYER GmbH\nGesellschaft mit beschränkter Haftung\nZweibrücken\n\nAls nicht eingetragen wird veröffentlicht: Den Gläubigern der an der Verschmelzung beteiligten Rechtsträger ist, wenn sie binnen sechs Monaten nach dem Tag, an dem die Eintragung der Verschmelzung in das Register des Sitzes desjenigen Rechtsträgers,dessen Gläubiger sie sind, nach § 19 Abs. 3 UmwG als bekannt gemacht gilt, ihren Anspruch nach Grund und Höhe schriftlich anmelden, Sicherheit zu leisten, soweit sie nicht Befriedigung verlangen können. Dieses Recht steht den Gläubigern jedoch nur zu, wenn sie glaubhaft machen, dass durch die Verschmelzung die Erfüllung der Forderung gefährdet wird."
    },
    {
      "date": "2026-01-16",
      "id": "142640",
      "original_text": "Registerbekanntmachung nach dem Umwandlungsgesetz\nRheinland-Pfalz Amtsgericht Landau HRB 31422\nBEGRA Bahnsicherungs- und Bewachungs GmbH – Landau in der Pfalz",
      "type": "Registerbekanntmachung nach dem Umwandlungsgesetz",
      "state": "Rheinland-Pfalz",
      "amtsgericht": "Amtsgericht Landau",
      "registernummer": "HRB 31422",
      "registerart": "HRB",
      "company_name": "BEGRA Bahnsicherungs- und Bewachungs GmbH",
      "company_seat": "Landau in der Pfalz",
      "details": "16.01.2026 (Bekanntmachungsdatum)\n\nRheinland-Pfalz Amtsgericht Landau HRB 31422\nRegisterbekanntmachung nach dem Umwandlungsgesetz 16.01.2026 (Eintragungsdatum)\n\nBEGRA Bahnsicherungs- und Bewachungs GmbH\nGesellschaft mit beschränkter Haftung\nLandau in der Pfalz\n\nAls nicht eingetragen wird veröffentlicht: Den Gläubigern der an der Verschmelzung beteiligten Rechtsträger ist, wenn sie binnen sechs Monaten nach dem Tag, an dem die Eintragung der Verschmelzung in das Register des Sitzes desjenigen Rechtsträgers, dessen Gläubiger sie sind, nach § 19 Abs. 3 UmwG als bekannt gemacht gilt, ihren Anspruch nach Grund und Höhe schriftlich anmelden, Sicherheit zu leisten, soweit sie nicht Befriedigung verlangen können. Dieses Recht steht den Gläubigern jedoch nur zu, wenn sie glaubhaft machen, dass durch die Verschmelzung die Erfüllung der Forderung gefährdet wird."
    },
    {
      "date": "2026-01-16",
      "id": "142641",
      "original_text": "Einreichung neuer Dokumente\nRheinland-Pfalz Amtsgericht Landau HRB 11715\nGeRo Real Estate Aktiengesellschaft für Projektentwicklung und Consulting – Bellheim",
      "type": "Einreichung neuer Dokumente",
      "state": "Rheinland-Pfalz",
      "amtsgericht": "Amtsgericht Landau",
      "registernummer": "HRB 11715",
      "registerart": "HRB",
      "company_name": "GeRo Real Estate Aktiengesellschaft für Projektentwicklung und Consulting",
      "company_seat": "Bellheim",
      "details": "16.01.2026 (Bekanntmachungsdatum)\n\nRheinland-Pfalz Amtsgericht Landau HRB 11715\nEinreichung neuer Dokumente 16.01.2026 (Eintragungsdatum)\n\nGeRo Real Estate Aktiengesellschaft für Projektentwicklung und Consulting\nAktiengesellschaft\nBellheim\n\nDem Registergericht ist eine neue Liste der Mitglieder des Aufsichtsrates eingereicht worden."
    },
    {
      "date": "2026-01-16",
      "id": "142642",
      "original_text": "Registerbekanntmachung nach dem Umwandlungsgesetz\nRheinland-Pfalz Amtsgericht Landau HRB 34447\nREVIVAT GmbH – Annweiler am Trifels",
      "type": "Registerbekanntmachung nach dem Umwandlungsgesetz",
      "state": "Rheinland-Pfalz",
      "amtsgericht": "Amtsgericht Landau",
      "registernummer": "HRB 34447",
      "registerart": "HRB",
      "company_name": "REVIVAT GmbH",
      "company_seat": "Annweiler am Trifels",
      "details": "16.01.2026 (Bekanntmachungsdatum)\n\nRheinland-Pfalz Amtsgericht Landau HRB 34447\nRegisterbekanntmachung nach dem Umwandlungsgesetz 16.01.2026 (Eintragungsdatum)\n\nREVIVAT GmbH\nGesellschaft mit beschränkter Haftung\nAnnweiler am Trifels\n\nAls nicht eingetragen wird veröffentlicht:\nDen Gläubigern des formwechselnden Rechtsträgers ist, wenn sie binnen sechs Monaten nach dem Tag, an dem die Eintragung des Formwechsels nach § 201 UmwG als bekannt gemacht gilt, ihren Anspruch nach Grund und Höhe schriftlich anmelden, Sicherheit zu leisten, soweit sie nicht Befriedigung verlangen können. Dieses Recht steht den Gläubigern jedoch nur zu, wenn sie glaubhaft machen, dass durch den Formwechsel die Erfüllung der Forderung gefährdet wird."
    },
    {
      "date": "2026-01-16",
      "id": "142643",
      "original_text": "Registerbekanntmachung nach dem Umwandlungsgesetz\nRheinland-Pfalz Amtsgericht Landau HRB 32117\nREVIVAT Aktiengesellschaft – Annweiler",
      "type": "Registerbekanntmachung nach dem Umwandlungsgesetz",
      "state": "Rheinland-Pfalz",
      "amtsgericht": "Amtsgericht Landau",
      "registernummer": "HRB 32117",
      "registerart": "HRB",
      "company_name": "REVIVAT Aktiengesellschaft",
      "company_seat": "Annweiler",
      "details": "16.01.2026 (Bekanntmachungsdatum)\n\nRheinland-Pfalz Amtsgericht Landau HRB 32117\nRegisterbekanntmachung nach dem Umwandlungsgesetz 16.01.2026 (Eintragungsdatum)\n\nREVIVAT Aktiengesellschaft\nAktiengesellschaft\nAnnweiler\n\nAls nicht eingetragen wird veröffentlicht:\nDen Gläubigern des formwechselnden Rechtsträgers ist, wenn sie binnen sechs Monaten nach dem Tag, an dem die Eintragung des Formwechsels nach § 201 UmwG als bekannt gemacht gilt, ihren Anspruch nach Grund und Höhe schriftlich anmelden, Sicherheit zu leisten, soweit sie nicht Befriedigung verlangen können. Dieses Recht steht den Gläubigern jedoch nur zu, wenn sie glaubhaft machen, dass durch den Formwechsel die Erfüllung der Forderung gefährdet wird."
    },
    {
      "date": "2026-01-16",
      "id": "142644",
      "original_text": "Löschungsankündigung\nRheinland-Pfalz Amtsgericht Montabaur HRB 22120\nCHISU Warenhandel GmbH – Ransbach-Baumbach",
      "type": "Löschungsankündigung",
      "state": "Rheinland-Pfalz",
      "amtsgericht": "Amtsgericht Montabaur",
      "registernummer": "HRB 22120",
      "registerart": "HRB",
      "company_name": "CHISU Warenhandel GmbH",
      "company_seat": "Ransbach-Baumbach",
      "details": "16.01.2026 (Bekanntmachungsdatum)\n\nRheinland-Pfalz Amtsgericht Montabaur HRB 22120\nLöschungsankündigung\n\nCHISU Warenhandel GmbH\nGesellschaft mit beschränkter Haftung\nRansbach-Baumbach\n\nDas Registergericht beabsichtigt die Gesellschaft von Amts wegen nach § 394 FamFG zu löschen. Die Frist zur Erhebung eines Widerspruchs ist auf einen Monat festgesetzt."
    },
    {
      "date": "2026-01-16",
      "id": "142645",
      "original_text": "Einreichung neuer Dokumente\nBremen Amtsgericht Bremen HRB 3579 BHV\nNORDSEE Holding GmbH – Bremerhaven",
      "type": "Einreichung neuer Dokumente",
      "state": "Bremen",
      "amtsgericht": "Amtsgericht Bremen",
      "registernummer": "HRB 3579 BHV",
      "registerart": "HRB",
      "company_name": "NORDSEE Holding GmbH",
      "company_seat": "Bremerhaven",
      "details": "16.01.2026 (Bekanntmachungsdatum)\n\nBremen Amtsgericht Bremen HRB 3579 BHV\nEinreichung neuer Dokumente\n\nNORDSEE Holding GmbH\nGesellschaft mit beschränkter Haftung\nBremerhaven\n\nAls nicht eingetragen wird bekannt gemacht: Liste des Aufsichtsrats wurde eingereicht."
    },
    {
      "date": "2026-01-16",
      "id": "142646",
      "original_text": "Registerbekanntmachung nach dem Umwandlungsgesetz\nBremen Amtsgericht Bremen HRB 30952\nSeven Seas Ship Supply GmbH – Bremerhaven",
      "type": "Registerbekanntmachung nach dem Umwandlungsgesetz",
      "state": "Bremen",
      "amtsgericht": "Amtsgericht Bremen",
      "registernummer": "HRB 30952",
      "registerart": "HRB",
      "company_name": "Seven Seas Ship Supply GmbH",
      "company_seat": "Bremerhaven",
      "details": "16.01.2026 (Bekanntmachungsdatum)\n\nBremen Amtsgericht Bremen HRB 30952\nRegisterbekanntmachung nach dem Umwandlungsgesetz 12.01.2026 (Eintragungsdatum)\n\nSeven Seas Ship Supply GmbH\nGesellschaft mit beschränkter Haftung\nBremerhaven\n\nZu Eintragungsnummer 2 vom 12.01.2026 wird als nicht eingetragen veröffentlicht:  Den Gläubigern der an der Verschmelzung beteiligten Rechtsträger ist, wenn sie binnen sechs Monaten nach dem Tag, an dem die Eintragung der Verschmelzung in das Register des Sitzes desjenigen Rechtsträgers, dessen Gläubiger sie sind, als bekannt gemacht gilt, ihren Anspruch nach Grund und Höhe schriftlich anmelden, Sicherheit zu leisten, soweit sie nicht Befriedigung verlangen können. Dieses Recht steht den Gläubigern jedoch nur zu, wenn sie glaubhaft machen, dass durch die Verschmelzung die Erfüllung ihrer Forderung gefährdet wird. Das Recht, Sicherheitsleistung zu verlangen, steht Gläubigern nicht zu, die im Falle der Insolvenz ein Recht auf vorzugsweise Befriedigung aus einer Deckungsmasse haben, die nach gesetzlicher Vorschrift zu ihrem Schutz errichtet und staatlich überwacht ist."
    },
    {
      "date": "2026-01-16",
      "id": "142647",
      "original_text": "Registerbekanntmachung nach dem Umwandlungsgesetz\nBremen Amtsgericht Bremen HRB 2194 BHV\nWeser Shipstores GmbH – Bremerhaven",
      "type": "Registerbekanntmachung nach dem Umwandlungsgesetz",
      "state": "Bremen",
      "amtsgericht": "Amtsgericht Bremen",
      "registernummer": "HRB 2194 BHV",
      "registerart": "HRB",
      "company_name": "Weser Shipstores GmbH",
      "company_seat": "Bremerhaven",
      "details": "16.01.2026 (Bekanntmachungsdatum)\n\nBremen Amtsgericht Bremen HRB 2194 BHV\nRegisterbekanntmachung nach dem Umwandlungsgesetz 12.01.2026 (Eintragungsdatum)\n\nWeser Shipstores GmbH\nGesellschaft mit beschränkter Haftung\nBremerhaven\n\nZu Eintragungsnummer 5 vom 12.01.2026 wird als nicht eingetragen veröffentlicht: Den Gläubigern der an der Verschmelzung beteiligten Rechtsträger ist, wenn sie binnen sechs Monaten nach dem Tag, an dem die Eintragung der Verschmelzung in das Register des Sitzes desjenigen Rechtsträgers, dessen Gläubiger sie sind, als bekannt gemacht gilt, ihren Anspruch nach Grund und Höhe schriftlich anmelden, Sicherheit zu leisten, soweit sie nicht Befriedigung verlangen können. Dieses Recht steht den Gläubigern jedoch nur zu, wenn sie glaubhaft machen, dass durch die Verschmelzung die Erfüllung ihrer Forderung gefährdet wird. Das Recht, Sicherheitsleistung zu verlangen, steht Gläubigern nicht zu, die im Falle der Insolvenz ein Recht auf vorzugsweise Befriedigung aus einer Deckungsmasse haben, die nach gesetzlicher Vorschrift zu ihrem Schutz errichtet und staatlich überwacht ist."
    },
    {
      "date": "2026-01-16",
      "id": "142648",
      "original_text": "Löschungsankündigung\nBremen Amtsgericht Bremen HRB 38087\nSEMINARIS24 UG (haftungsbeschränkt) – Bremerhaven",
      "type": "Löschungsankündigung",
      "state": "Bremen",
      "amtsgericht": "Amtsgericht Bremen",
      "registernummer": "HRB 38087",
      "registerart": "HRB",
      "company_name": "SEMINARIS24 UG (haftungsbeschränkt)",
      "company_seat": "Bremerhaven",
      "details": "16.01.2026 (Bekanntmachungsdatum)\n\nBremen Amtsgericht Bremen HRB 38087\nLöschungsankündigung\n\nSEMINARIS24 UG (haftungsbeschränkt)\nGesellschaft mit beschränkter Haftung\nBremerhaven\n\nEs ist beabsichtigt die im Handelsregister eingetragene Gesellschaft von Amts wegen gemäß § 394 FamFG zu löschen. Gegen die Löschung kann beim AG Bremen schriftlich oder zu Protokoll der Geschäftsstelle Widerspruch eingelegt werden. Widerspruchsfrist 4 Wochen."
    },
    {
      "date": "2026-01-16",
      "id": "142649",
      "original_text": "Löschungsankündigung\nNordrhein-Westfalen Amtsgericht Mönchengladbach HRB 20187\nH.M. Automatenaufstellung UG (haftungsbeschränkt) – Viersen",
      "type": "Löschungsankündigung",
      "state": "Nordrhein-Westfalen",
      "amtsgericht": "Amtsgericht Mönchengladbach",
      "registernummer": "HRB 20187",
      "registerart": "HRB",
      "company_name": "H.M. Automatenaufstellung UG (haftungsbeschränkt)",
      "company_seat": "Viersen",
      "details": "16.01.2026 (Bekanntmachungsdatum)\n\nNordrhein-Westfalen Amtsgericht Mönchengladbach HRB 20187\nLöschungsankündigung\n\nH.M. Automatenaufstellung UG (haftungsbeschränkt)\nGesellschaft mit beschränkter Haftung\nViersen\n\nDas Registergericht beabsichtigt, die im Handelsregister eingetragene Gesellschaft gemäß § 394 Absatz 1 FamFG wegen Vermögenslosigkeit von Amts wegen zu löschen. Gegen diese Verfügung kann Widerspruch eingelegt werden. Die Frist zur Erhebung eines Widerspruchs gegen die beabsichtigte Löschung von Amts wegen ist auf drei Monate festgesetzt."
    },
    {
      "date": "2026-01-16",
      "id": "142650",
      "original_text": "Einreichung neuer Dokumente\nNordrhein-Westfalen Amtsgericht Mönchengladbach HRB 2170\nGemeinnützige Kreisbau Aktiengesellschaft – Mönchengladbach",
      "type": "Einreichung neuer Dokumente",
      "state": "Nordrhein-Westfalen",
      "amtsgericht": "Amtsgericht Mönchengladbach",
      "registernummer": "HRB 2170",
      "registerart": "HRB",
      "company_name": "Gemeinnützige Kreisbau Aktiengesellschaft",
      "company_seat": "Mönchengladbach",
      "details": "16.01.2026 (Bekanntmachungsdatum)\n\nNordrhein-Westfalen Amtsgericht Mönchengladbach HRB 2170\nEinreichung neuer Dokumente 14.01.2026 (Eintragungsdatum)\n\nGemeinnützige Kreisbau Aktiengesellschaft\nAktiengesellschaft\nMönchengladbach\n\nDem Registergericht ist eine neue Liste der Mitglieder des Aufsichtsrates eingereicht worden."
    },
    {
      "date": "2026-01-16",
      "id": "142651",
      "original_text": "Löschungsankündigung\nNordrhein-Westfalen Amtsgericht Köln HRB 118617\nGreen Ventures Friends GVF GmbH – Köln",
      "type": "Löschungsankündigung",
      "state": "Nordrhein-Westfalen",
      "amtsgericht": "Amtsgericht Köln",
      "registernummer": "HRB 118617",
      "registerart": "HRB",
      "company_name": "Green Ventures Friends GVF GmbH",
      "company_seat": "Köln",
      "details": "16.01.2026 (Bekanntmachungsdatum)\n\nNordrhein-Westfalen Amtsgericht Köln HRB 118617\nLöschungsankündigung\n\nGreen Ventures Friends GVF GmbH\nGesellschaft mit beschränkter Haftung\nKöln\n\nDas Registergericht beabsichtigt die Gesellschaft von Amts wegen nach § 394 FamFG zu löschen. Die Frist zur Erhebung eines Widerspruchs ist auf einen Monat festgesetzt."
    },
    {
      "date": "2026-01-16",
      "id": "142652",
      "original_text": "Löschungsankündigung\nNordrhein-Westfalen Amtsgericht Düsseldorf HRB 74945\nBOS GmbH Real Estate – Düsseldorf",
      "type": "Löschungsankündigung",
      "state": "Nordrhein-Westfalen",
      "amtsgericht": "Amtsgericht Düsseldorf",
      "registernummer": "HRB 74945",
      "registerart": "HRB",
      "company_name": "BOS GmbH Real Estate",
      "company_seat": "Düsseldorf",
      "details": "16.01.2026 (Bekanntmachungsdatum)\n\nNordrhein-Westfalen Amtsgericht Düsseldorf HRB 74945\nLöschungsankündigung\n\nBOS GmbH Real Estate\nGesellschaft mit beschränkter Haftung\nDüsseldorf\n\nBetr.: BOS GmbH Real Estate, c/o Dega, Dorfstr. 6-8, 40667 Meerbusch\n(Sitz: Düsseldorf)\n\nDas Registergericht beabsichtigt die Gesellschaft von Amts wegen nach § 394 FamFG zu löschen. Die Frist zur Erhebung eines Widerspruchs ist auf 3 Wochen festgesetzt.\n\nRechtsbehelfsbelehrung:\n\nDas Widerspruchsrecht steht jedem zu, der an der Unterlassung der Löschung ein berechtigtes Interesse hat. Der Widerspruch ist bei dem Amtsgericht Düsseldorf -Registergericht-, Werdener Straße 1, 40227 Düsseldorf schriftlich in deutscher Sprache oder zur Niederschrift der Geschäftsstelle einzulegen. Der Widerspruch kann auch zur Niederschrift der Geschäftsstelle eines jeden Amtsgerichtes abgegeben werden. Die Einlegung ist auch durch Übertragung eines elektronischen Dokuments an die elektronische Poststelle des Gerichts möglich. Das elektronische Dokument muss für die Bearbeitung durch das Gericht geeignet und mit einer qualifizierten elektronischen Signatur der verantwortenden Person versehen sein oder von der verantwortenden Person signiert und auf einem sicheren Übermittlungsweg gemäß § 130a ZPO nach näherer Maßgabe der Verordnung über die technischen Rahmenbedingungen des elektronischen Rechtsverkehrs und über das besondere elektronische Behördenpostfach (BGBl. I, S.3803) eingereicht werden. Weitere Informationen erhalten Sie auf der Internetseite www.justiz.de.\nDer Widerspruch muss spätestens innerhalb der gesetzten Frist nach dem Datum der Bekanntmachung der Löschungsankündigung bei dem Amtsgericht - Registergericht - Düsseldorf eingegangen sein.  Dies gilt auch dann, wenn der Widerspruch zur Niederschrift der Geschäftsstelle eines anderen Amtsgerichtes abgegeben wurde. Die Frist beginnt mit dem Tage der Bekanntmachung der Löschungsankündigung in dem für die Bekanntmachung der Eintragungen in das Handelsregister bestimmten elektronischen Informations- und Kommunikationssystem nach § 10 des Handelsgesetzbuches. Fällt das Ende der Frist auf einen Sonntag, einen allgemeinen Feiertag oder Sonnabend, so endet die Frist mit Ablauf des nächsten Werktages.\nDer Widerspruch muss die Bezeichnung der angefochtenen Löschungsankündigung sowie die Erklärung enthalten, dass Widerspruch gegen diese Löschungsankündigung eingelegt wird. Er ist zu unterzeichnen und soll begründet werden."
    },
    {
      "date": "2026-01-16",
      "id": "142653",
      "original_text": "Einreichung neuer Dokumente\nNordrhein-Westfalen Amtsgericht Köln HRB 901\nGAG Immobilien AG – Köln",
      "type": "Einreichung neuer Dokumente",
      "state": "Nordrhein-Westfalen",
      "amtsgericht": "Amtsgericht Köln",
      "registernummer": "HRB 901",
      "registerart": "HRB",
      "company_name": "GAG Immobilien AG",
      "company_seat": "Köln",
      "details": "16.01.2026 (Bekanntmachungsdatum)\n\nNordrhein-Westfalen Amtsgericht Köln HRB 901\nEinreichung neuer Dokumente\n\nGAG Immobilien AG\nAktiengesellschaft\nKöln\n\nDem Registergericht ist eine Liste der Mitglieder des Aufsichtsrates eingereicht worden."
    },
    {
      "date": "2026-01-16",
      "id": "142654",
      "original_text": "Einreichung neuer Dokumente\nNordrhein-Westfalen Amtsgericht Köln HRB 56274\nfilmpool entertainment GmbH – Hürth",
      "type": "Einreichung neuer Dokumente",
      "state": "Nordrhein-Westfalen",
      "amtsgericht": "Amtsgericht Köln",
      "registernummer": "HRB 56274",
      "registerart": "HRB",
      "company_name": "filmpool entertainment GmbH",
      "company_seat": "Hürth",
      "details": "16.01.2026 (Bekanntmachungsdatum)\n\nNordrhein-Westfalen Amtsgericht Köln HRB 56274\nEinreichung neuer Dokumente\n\nfilmpool entertainment GmbH\nGesellschaft mit beschränkter Haftung\nHürth\n\nDem Registergericht ist eine neue Liste der Mitglieder des Beirates eingereicht worden."
    },
    {
      "date": "2026-01-16",
      "id": "142655",
      "original_text": "Löschungsankündigung\nNordrhein-Westfalen Amtsgericht Düsseldorf HRB 98100\nDexton Handel GmbH – Düsseldorf",
      "type": "Löschungsankündigung",
      "state": "Nordrhein-Westfalen",
      "amtsgericht": "Amtsgericht Düsseldorf",
      "registernummer": "HRB 98100",
      "registerart": "HRB",
      "company_name": "Dexton Handel GmbH",
      "company_seat": "Düsseldorf",
      "details": "16.01.2026 (Bekanntmachungsdatum)\n\nNordrhein-Westfalen Amtsgericht Düsseldorf HRB 98100\nLöschungsankündigung\n\nDexton Handel GmbH\nGesellschaft mit beschränkter Haftung\nDüsseldorf\n\nDas Registergericht beabsichtigt die Gesellschaft von Amts wegen nach § 394 Abs. 1 FamFG zu löschen. Die Frist zur Erhebung eines Widerspruchs ist auf 3 Wochen festgesetzt.\n\nRechtsbehelfsbelehrung:\nDas Widerspruchsrecht steht jedem zu, der an der Unterlassung der Löschung ein berechtigtes Interesse hat. Der Widerspruch ist bei dem Amtsgericht Düsseldorf -Registergericht-, Werdener Straße 1, 40227 Düsseldorf schriftlich in deutscher Sprache oder zur Niederschrift der Geschäftsstelle einzulegen. Der Widerspruch kann auch zur Niederschrift der Geschäftsstelle eines jeden Amtsgerichtes abgegeben werden. Die Einlegung ist auch durch Übertragung eines elektronischen Dokuments an die elektronische Poststelle des Gerichts möglich. Das elektronische Dokument muss für die Bearbeitung durch das Gericht geeignet und mit einer qualifizierten elektronischen Signatur der verantwortenden Person versehen sein oder von der verantwortenden Person signiert und auf einem sicheren Übermittlungsweg gemäß § 130a ZPO nach näherer Maßgabe der Verordnung über die technischen Rahmenbedingungen des elektronischen Rechtsverkehrs und über das besondere elektronische Behördenpostfach (BGBl. I, S.3803) eingereicht werden. Weitere Informationen erhalten Sie auf der Internetseite www.justiz.de.\nDer Widerspruch muss spätestens innerhalb der gesetzten Frist nach dem Datum der Bekanntmachung der Löschungsankündigung bei dem Amtsgericht - Registergericht - Düsseldorf eingegangen sein.  Dies gilt auch dann, wenn der Widerspruch zur Niederschrift der Geschäftsstelle eines anderen Amtsgerichtes abgegeben wurde. Die Frist beginnt mit dem Tage der Bekanntmachung der Löschungsankündigung in dem für die Bekanntmachung der Eintragungen in das Handelsregister bestimmten elektronischen Informations- und Kommunikationssystem nach § 10 des Handelsgesetzbuches. Fällt das Ende der Frist auf einen Sonntag, einen allgemeinen Feiertag oder Sonnabend, so endet die Frist mit Ablauf des nächsten Werktages.\nDer Widerspruch muss die Bezeichnung der angefochtenen Löschungsankündigung sowie die Erklärung enthalten, dass Widerspruch gegen diese Löschungsankündigung eingelegt wird. Er ist zu unterzeichnen und soll begründet werden."
    },
    {
      "date": "2026-01-16",
      "id": "142656",
      "original_text": "Löschungsankündigung\nNordrhein-Westfalen Amtsgericht Bonn HRB 21847\nELK Euskirchener Lamm- und Kalbschlachterei GmbH – Euskirchen",
      "type": "Löschungsankündigung",
      "state": "Nordrhein-Westfalen",
      "amtsgericht": "Amtsgericht Bonn",
      "registernummer": "HRB 21847",
      "registerart": "HRB",
      "company_name": "ELK Euskirchener Lamm- und Kalbschlachterei GmbH",
      "company_seat": "Euskirchen",
      "details": "16.01.2026 (Bekanntmachungsdatum)\n\nNordrhein-Westfalen Amtsgericht Bonn HRB 21847\nLöschungsankündigung\n\nELK Euskirchener Lamm- und Kalbschlachterei GmbH\nGesellschaft mit beschränkter Haftung\nEuskirchen\n\nDas Registergericht beabsichtigt die Gesellschaft von Amts wegen nach § 394 FamFG zu löschen. Die Frist zur Erhebung eines Widerspruchs ist auf einen Monat festgesetzt."
    },
    {
      "date": "2026-01-16",
      "id": "142657",
      "original_text": "Löschungsankündigung\nNordrhein-Westfalen Amtsgericht Köln HRB 96647\nFlamingo Bau GmbH – Köln",
      "type": "Löschungsankündigung",
      "state": "Nordrhein-Westfalen",
      "amtsgericht": "Amtsgericht Köln",
      "registernummer": "HRB 96647",
      "registerart": "HRB",
      "company_name": "Flamingo Bau GmbH",
      "company_seat": "Köln",
      "details": "16.01.2026 (Bekanntmachungsdatum)\n\nNordrhein-Westfalen Amtsgericht Köln HRB 96647\nLöschungsankündigung\n\nFlamingo Bau GmbH\nGesellschaft mit beschränkter Haftung\nKöln\n\nDas Registergericht beabsichtigt, die im Handelsregister eingetragene Gesellschaft gemäß § 394 Absatz 1 FamFG wegen Vermögenslosigkeit von Amts wegen zu löschen. Gegen diese Verfügung kann Widerspruch eingelegt werden. Die Frist zur Erhebung eines Widerspruchs gegen die beabsichtigte Löschung von Amts wegen ist auf einen Monat festgesetzt. Rechtsbehelfsbelehrung: Gegen diese Verfügung können Sie Widerspruch einlegen. Der Widerspruch ist bei dem Amtsgericht Köln, Reichenspergerplatz 1, 50670 Köln schriftlich in deutscher Sprache oder zur Niederschrift der Geschäftsstelle einzulegen. Der Widerspruch kann auch zur Niederschrift der Geschäftsstelle eines jeden Amtsgerichtes abgegeben werden. Die Einlegung ist auch durch Übertragung eines elektronischen Dokuments an die elektronische Poststelle des Gerichts möglich. Das elektronische Dokument muss für die Bearbeitung durch das Gericht geeignet und mit einer qualifizierten elektronischen Signatur der verantwortenden Person versehen sein oder von der verantwortenden Person signiert und auf einem sicheren Übermittlungsweg gemäß § 130a ZPO nach näherer Maßgabe der Verordnung über die technischen Rahmenbedingungen des elektronischen Rechtsverkehrs und über das besondere elektronische Behördenpostfach (BGBl. I, S.3803) eingereicht werden. Weitere Informationen erhalten Sie auf der Internetseite www.justiz.de.Der Widerspruch muss spätestens innerhalb der gesetzten Frist bei dem Amtsgericht Köln eingegangen sein. Dies gilt auch dann, wenn der Widerspruch zur Niederschrift der Geschäftsstelle eines anderen Amtsgerichtes abgegeben wurde. Die Frist beginnt mit der Veröffentlichung. Fällt das Ende der Frist auf einen Sonntag, einen allgemeinen Feiertag oder Sonnabend, so endet die Frist mit Ablauf des nächsten Werktages.\n\nDer Widerspruch muss die Bezeichnung der angefochtenen Verfügung sowie die Erklärung enthalten, dass Widerspruch gegen diese Verfügung eingelegt wird. Er ist zu unterzeichnen und soll begründet werden."
    },
    {
      "date": "2026-01-16",
      "id": "142658",
      "original_text": "Löschungsankündigung\nNordrhein-Westfalen Amtsgericht Bochum HRB 18942\nWilhelmus Food & Trade GmbH – Herne",
      "type": "Löschungsankündigung",
      "state": "Nordrhein-Westfalen",
      "amtsgericht": "Amtsgericht Bochum",
      "registernummer": "HRB 18942",
      "registerart": "HRB",
      "company_name": "Wilhelmus Food & Trade GmbH",
      "company_seat": "Herne",
      "details": "16.01.2026 (Bekanntmachungsdatum)\n\nNordrhein-Westfalen Amtsgericht Bochum HRB 18942\nLöschungsankündigung\n\nWilhelmus Food & Trade GmbH\nGesellschaft mit beschränkter Haftung\nHerne\n\nDas Registergericht beabsichtigt die Gesellschaft von Amts wegen nach § 394 FamFG zu löschen. Die Frist zur Erhebung eines Widerspruchs ist auf drei Monate festgesetzt."
    },
    {
      "date": "2026-01-16",
      "id": "142659",
      "original_text": "Sonstige Registerbekanntmachung\nNordrhein-Westfalen Amtsgericht Köln HRB 85134\nFIEGE Air Cargo Logistics Köln-Bonn GmbH – Köln",
      "type": "Sonstige Registerbekanntmachung",
      "state": "Nordrhein-Westfalen",
      "amtsgericht": "Amtsgericht Köln",
      "registernummer": "HRB 85134",
      "registerart": "HRB",
      "company_name": "FIEGE Air Cargo Logistics Köln-Bonn GmbH",
      "company_seat": "Köln",
      "details": "16.01.2026 (Bekanntmachungsdatum)\n\nNordrhein-Westfalen Amtsgericht Köln HRB 85134\nSonstige Registerbekanntmachung 16.01.2026 (Eintragungsdatum)\n\nFIEGE Air Cargo Logistics Köln-Bonn GmbH\nGesellschaft mit beschränkter Haftung\nKöln\n\nAls nicht eingetragen wird veröffentlicht: Den Gläubigern der Gesellschaft, deren Forderungen begründet worden sind bevor die Eintragung der Beendigung des Gewinnabführungsvertrages  in das Handelsregister nach § 10 des Handelsgesetzbuches als bekanntgemacht gilt, hat der andere Vertragsteil Sicherheit zu leisten, wenn sie sich binnen sechs Monaten nach der Bekanntmachung der Eintragung zu diesem Zweck bei ihm melden."
    },
    {
      "date": "2026-01-16",
      "id": "142660",
      "original_text": "Einreichung neuer Dokumente\nNordrhein-Westfalen Amtsgericht Bonn HRB 14178\nDeutsche Telekom Service GmbH – Bonn",
      "type": "Einreichung neuer Dokumente",
      "state": "Nordrhein-Westfalen",
      "amtsgericht": "Amtsgericht Bonn",
      "registernummer": "HRB 14178",
      "registerart": "HRB",
      "company_name": "Deutsche Telekom Service GmbH",
      "company_seat": "Bonn",
      "details": "16.01.2026 (Bekanntmachungsdatum)\n\nNordrhein-Westfalen Amtsgericht Bonn HRB 14178\nEinreichung neuer Dokumente\n\nDeutsche Telekom Service GmbH\nGesellschaft mit beschränkter Haftung\nBonn\n\nDem Registergericht ist eine neue Liste der Mitglieder des Aufsichtsrates eingereicht worden."
    },
    {
      "date": "2026-01-16",
      "id": "142661",
      "original_text": "Löschungsankündigung\nNordrhein-Westfalen Amtsgericht Düsseldorf HRB 86640\nD:Cab GmbH – Düsseldorf",
      "type": "Löschungsankündigung",
      "state": "Nordrhein-Westfalen",
      "amtsgericht": "Amtsgericht Düsseldorf",
      "registernummer": "HRB 86640",
      "registerart": "HRB",
      "company_name": "D:Cab GmbH",
      "company_seat": "Düsseldorf",
      "details": "16.01.2026 (Bekanntmachungsdatum)\n\nNordrhein-Westfalen Amtsgericht Düsseldorf HRB 86640\nLöschungsankündigung\n\nD:Cab GmbH\nGesellschaft mit beschränkter Haftung\nDüsseldorf\n\nDas Registergericht beabsichtigt die Gesellschaft von Amts wegen nach § 394 Abs. 1 FamFG zu löschen. Die Frist zur Erhebung eines Widerspruchs ist auf 3 Wochen festgesetzt.\n\nRechtsbehelfsbelehrung:\nDas Widerspruchsrecht steht jedem zu, der an der Unterlassung der Löschung ein berechtigtes Interesse hat. Der Widerspruch ist bei dem Amtsgericht Düsseldorf -Registergericht-, Werdener Straße 1, 40227 Düsseldorf schriftlich in deutscher Sprache oder zur Niederschrift der Geschäftsstelle einzulegen. Der Widerspruch kann auch zur Niederschrift der Geschäftsstelle eines jeden Amtsgerichtes abgegeben werden. Die Einlegung ist auch durch Übertragung eines elektronischen Dokuments an die elektronische Poststelle des Gerichts möglich. Das elektronische Dokument muss für die Bearbeitung durch das Gericht geeignet und mit einer qualifizierten elektronischen Signatur der verantwortenden Person versehen sein oder von der verantwortenden Person signiert und auf einem sicheren Übermittlungsweg gemäß § 130a ZPO nach näherer Maßgabe der Verordnung über die technischen Rahmenbedingungen des elektronischen Rechtsverkehrs und über das besondere elektronische Behördenpostfach (BGBl. I, S.3803) eingereicht werden. Weitere Informationen erhalten Sie auf der Internetseite www.justiz.de.\nDer Widerspruch muss spätestens innerhalb der gesetzten Frist nach dem Datum der Bekanntmachung der Löschungsankündigung bei dem Amtsgericht - Registergericht - Düsseldorf eingegangen sein.  Dies gilt auch dann, wenn der Widerspruch zur Niederschrift der Geschäftsstelle eines anderen Amtsgerichtes abgegeben wurde. Die Frist beginnt mit dem Tage der Bekanntmachung der Löschungsankündigung in dem für die Bekanntmachung der Eintragungen in das Handelsregister bestimmten elektronischen Informations- und Kommunikationssystem nach § 10 des Handelsgesetzbuches. Fällt das Ende der Frist auf einen Sonntag, einen allgemeinen Feiertag oder Sonnabend, so endet die Frist mit Ablauf des nächsten Werktages.\nDer Widerspruch muss die Bezeichnung der angefochtenen Löschungsankündigung sowie die Erklärung enthalten, dass Widerspruch gegen diese Löschungsankündigung eingelegt wird. Er ist zu unterzeichnen und soll begründet werden."
    },
    {
      "date": "2026-01-16",
      "id": "142662",
      "original_text": "Einreichung neuer Dokumente\nNordrhein-Westfalen Amtsgericht Duisburg HRB 12196\nGMVA Gemeinschafts-Müll-Verbrennungsanlage Niederrhein Gesellschaft mit beschränkter Haftung – Oberhausen",
      "type": "Einreichung neuer Dokumente",
      "state": "Nordrhein-Westfalen",
      "amtsgericht": "Amtsgericht Duisburg",
      "registernummer": "HRB 12196",
      "registerart": "HRB",
      "company_name": "GMVA Gemeinschafts-Müll-Verbrennungsanlage Niederrhein Gesellschaft mit beschränkter Haftung",
      "company_seat": "Oberhausen",
      "details": "16.01.2026 (Bekanntmachungsdatum)\n\nNordrhein-Westfalen Amtsgericht Duisburg HRB 12196\nEinreichung neuer Dokumente\n\nGMVA Gemeinschafts-Müll-Verbrennungsanlage Niederrhein Gesellschaft mit beschränkter Haftung\nGesellschaft mit beschränkter Haftung\nOberhausen\n\nDem Registergericht ist eine neue Liste der Mitglieder des Aufsichtsrates eingereicht worden."
    },
    {
      "date": "2026-01-16",
      "id": "142663",
      "original_text": "Einreichung neuer Dokumente\nNordrhein-Westfalen Amtsgericht Bonn HRB 22159\nMES Germany Beteiligungs GmbH – Bonn",
      "type": "Einreichung neuer Dokumente",
      "state": "Nordrhein-Westfalen",
      "amtsgericht": "Amtsgericht Bonn",
      "registernummer": "HRB 22159",
      "registerart": "HRB",
      "company_name": "MES Germany Beteiligungs GmbH",
      "company_seat": "Bonn",
      "details": "16.01.2026 (Bekanntmachungsdatum)\n\nNordrhein-Westfalen Amtsgericht Bonn HRB 22159\nEinreichung neuer Dokumente\n\nMES Germany Beteiligungs GmbH\nGesellschaft mit beschränkter Haftung\nBonn\n\nDem Registergericht ist eine Liste der Mitglieder des Aufsichtsrates eingereicht worden."
    },
    {
      "date": "2026-01-16",
      "id": "142664",
      "original_text": "Einreichung neuer Dokumente\nNordrhein-Westfalen Amtsgericht Arnsberg HRB 7209\nHochsauerlandwasser GmbH – Meschede",
      "type": "Einreichung neuer Dokumente",
      "state": "Nordrhein-Westfalen",
      "amtsgericht": "Amtsgericht Arnsberg",
      "registernummer": "HRB 7209",
      "registerart": "HRB",
      "company_name": "Hochsauerlandwasser GmbH",
      "company_seat": "Meschede",
      "details": "16.01.2026 (Bekanntmachungsdatum)\n\nNordrhein-Westfalen Amtsgericht Arnsberg HRB 7209\nEinreichung neuer Dokumente 16.01.2026 (Eintragungsdatum)\n\nHochsauerlandwasser GmbH\nGesellschaft mit beschränkter Haftung\nMeschede\n\nDem Registergericht ist eine neue Liste der Mitglieder des Aufsichtsrates eingereicht worden."
    },
    {
      "date": "2026-01-16",
      "id": "142665",
      "original_text": "Einreichung neuer Dokumente\nNordrhein-Westfalen Amtsgericht Köln HRB 60471\nCsecure Aktiengesellschaft – Köln",
      "type": "Einreichung neuer Dokumente",
      "state": "Nordrhein-Westfalen",
      "amtsgericht": "Amtsgericht Köln",
      "registernummer": "HRB 60471",
      "registerart": "HRB",
      "company_name": "Csecure Aktiengesellschaft",
      "company_seat": "Köln",
      "details": "16.01.2026 (Bekanntmachungsdatum)\n\nNordrhein-Westfalen Amtsgericht Köln HRB 60471\nEinreichung neuer Dokumente\n\nCsecure Aktiengesellschaft\nAktiengesellschaft\nKöln\n\nDem Registergericht ist eine Liste der Mitglieder des Aufsichtsrates eingereicht worden."
    },
    {
      "date": "2026-01-16",
      "id": "142666",
      "original_text": "Einreichung neuer Dokumente\nNordrhein-Westfalen Amtsgericht Essen HRB 28361\nRuhrbahn GmbH – Essen",
      "type": "Einreichung neuer Dokumente",
      "state": "Nordrhein-Westfalen",
      "amtsgericht": "Amtsgericht Essen",
      "registernummer": "HRB 28361",
      "registerart": "HRB",
      "company_name": "Ruhrbahn GmbH",
      "company_seat": "Essen",
      "details": "16.01.2026 (Bekanntmachungsdatum)\n\nNordrhein-Westfalen Amtsgericht Essen HRB 28361\nEinreichung neuer Dokumente\n\nRuhrbahn GmbH\nGesellschaft mit beschränkter Haftung\nEssen\n\nDem Registergericht ist eine neue Liste der Mitglieder des Aufsichtsrates eingereicht worden."
    },
    {
      "date": "2026-01-16",
      "id": "142667",
      "original_text": "Löschungsankündigung\nNordrhein-Westfalen Amtsgericht Siegburg HRB 16257\nDaLokal Unternehmergesellschaft (haftungsbeschränkt) – Siegburg",
      "type": "Löschungsankündigung",
      "state": "Nordrhein-Westfalen",
      "amtsgericht": "Amtsgericht Siegburg",
      "registernummer": "HRB 16257",
      "registerart": "HRB",
      "company_name": "DaLokal Unternehmergesellschaft (haftungsbeschränkt)",
      "company_seat": "Siegburg",
      "details": "16.01.2026 (Bekanntmachungsdatum)\n\nNordrhein-Westfalen Amtsgericht Siegburg HRB 16257\nLöschungsankündigung\n\nDaLokal Unternehmergesellschaft (haftungsbeschränkt)\nGesellschaft mit beschränkter Haftung\nSiegburg\n\nDas Registergericht hat glaubhafte Kenntnis erlangt, dass die Gesellschaft\nvermögenslos geworden ist.\n\nEs ist daher beabsichtigt, die Gesellschaft nach § 394 FamFG im Handelsregister wegen Vermögenslosigkeit zu löschen. Einwände gegen die Löschung sind durch Widerspruch binnen einer Frist von 3 Monaten geltend zu machen, andernfalls die Löschung erfolgen wird.\n\nEinzulegen ist der Widerspruch bei dem Amtsgericht Siegburg, Neue Poststraße 16, 53721 Siegburg, und zwar entweder schriftlich in deutscher Sprache oder mündlich zur Niederschrift der Geschäftsstelle. Der Widerspruch kann auch zur Niederschrift der Geschäftsstelle eines jeden Amtsgerichts abgegeben werden. Der Widerspruch ist binnen der in der Verfügung bestimmten Frist einzulegen. Die Frist ist nur gewahrt, wenn der Widerspruch rechtzeitig bei dem Amtsgericht Siegburg eingeht, auch wenn der Widerspruch zur Niederschrift der Geschäftsstelle eines anderen Amtsgerichts abgegeben wurde. Die\nFrist beginnt jeweils mit der schriftlichen Bekanntgabe der Verfügung an die Beteiligten. Kann die schriftliche Bekanntgabe an einen Beteiligten nicht bewirkt werden, beginnt die Frist spätestens mit Ablauf von fünf Monaten nach Erlass der Verfügung. Die Bekanntgabe ist entweder durch Zustellung oder am dritten Tage nach Aufgabe zur Post bewirkt. Sofern die Löschung noch nicht erfolgt ist, kann der Widerspruch auch noch nach Ablauf der Frist eingelegt werden. Fällt das Ende der Frist auf einen Sonnabend, einen Sonntag oder einen allgemeinen Feiertag, endet die Frist mit Ablauf des nächsten Werktages. Der Widerspruch\nist zu unterzeichnen. Eine Begründung des Widerspruchs ist nicht vorgeschrieben."
    },
    {
      "date": "2026-01-16",
      "id": "142668",
      "original_text": "Registerbekanntmachung nach dem Umwandlungsgesetz\nNordrhein-Westfalen Amtsgericht Köln HRB 32176\nkommIT Gesellschaft für Informationstechnik mit beschränkter Haftung – Köln",
      "type": "Registerbekanntmachung nach dem Umwandlungsgesetz",
      "state": "Nordrhein-Westfalen",
      "amtsgericht": "Amtsgericht Köln",
      "registernummer": "HRB 32176",
      "registerart": "HRB",
      "company_name": "kommIT Gesellschaft für Informationstechnik mit beschränkter Haftung",
      "company_seat": "Köln",
      "details": "16.01.2026 (Bekanntmachungsdatum)\n\nNordrhein-Westfalen Amtsgericht Köln HRB 32176\nRegisterbekanntmachung nach dem Umwandlungsgesetz 16.01.2026 (Eintragungsdatum)\n\nkommIT Gesellschaft für Informationstechnik mit beschränkter Haftung\nGesellschaft mit beschränkter Haftung\nKöln\n\nDen Gläubigern der an der formwechselnden Umwandlung beteiligten Rechtsträger ist, wenn sie binnen sechs Monaten nach dem Tag, an dem die Eintragung der formwechselnden Umwandlung in das Register des Sitzes desjenigen Rechtsträgers, dessen Gläubiger sie sind, nach § 19 Absatz 3 UmwG als bekanntgemacht gilt, ihren Anspruch nach Grund und Höhe schriftlich anmelden, Sicherheit zu leisten, soweit sie nicht Befriedigung verlangen können. Dieses Recht steht den Gläubigern jedoch nur zu, wenn sie glaubhaft machen, dass durch die formwechselnden Umwandlung die Erfüllung ihrer Forderung gefährdet wird."
    },
    {
      "date": "2026-01-16",
      "id": "142669",
      "original_text": "Sonstige Registerbekanntmachung\nNordrhein-Westfalen Amtsgericht Düsseldorf HRB 50365\nSOLTRX Transaction Services GmbH – Düsseldorf",
      "type": "Sonstige Registerbekanntmachung",
      "state": "Nordrhein-Westfalen",
      "amtsgericht": "Amtsgericht Düsseldorf",
      "registernummer": "HRB 50365",
      "registerart": "HRB",
      "company_name": "SOLTRX Transaction Services GmbH",
      "company_seat": "Düsseldorf",
      "details": "16.01.2026 (Bekanntmachungsdatum)\n\nNordrhein-Westfalen Amtsgericht Düsseldorf HRB 50365\nSonstige Registerbekanntmachung 16.01.2026 (Eintragungsdatum)\n\nSOLTRX Transaction Services GmbH\nGesellschaft mit beschränkter Haftung\nDüsseldorf\n\nAls nicht eingetragen wird veröffentlicht: Den Gläubigern der Gesellschaft, deren Forderungen begründet worden sind bevor die Eintragung der Beendigung des Gewinnabführungsvertrages  in das Handelsregister nach § 10 des Handelsgesetzbuches als bekanntgemacht gilt, hat der andere Vertragsteil Sicherheit zu leisten, wenn sie sich binnen sechs Monaten nach der Bekanntmachung der Eintragung zu diesem Zweck bei ihm melden."
    },
    {
      "date": "2026-01-16",
      "id": "142670",
      "original_text": "Löschungsankündigung\nNordrhein-Westfalen Amtsgericht Duisburg HRB 32722\nDeocoram GmbH – Duisburg",
      "type": "Löschungsankündigung",
      "state": "Nordrhein-Westfalen",
      "amtsgericht": "Amtsgericht Duisburg",
      "registernummer": "HRB 32722",
      "registerart": "HRB",
      "company_name": "Deocoram GmbH",
      "company_seat": "Duisburg",
      "details": "16.01.2026 (Bekanntmachungsdatum)\n\nNordrhein-Westfalen Amtsgericht Duisburg HRB 32722\nLöschungsankündigung\n\nDeocoram GmbH\nGesellschaft mit beschränkter Haftung\nDuisburg\n\nDas Registergericht beabsichtigt, die im Handelsregister unter HRB 32722 eingetragene Gesellschaft Deocoram GmbH  gemäß § 394 FamFG wegen Vermögenslosigkeit von Amts wegen zu löschen. Gegen diese Verfügung kann Widerspruch eingelegt werden. Die Frist zur Erhebung eines Widerspruchs gegen die beabsichtigte Löschung von Amts wegen ist auf drei Monate festgesetzt. Rechtsbehelfsbelehrung Der Widerspruch ist bei dem Amtsgericht Duisburg, Kardinal-Galen-Str. 124-132, 47058 Duisburg schriftlich in deutscher Sprache oder zur Niederschrift der Geschäftsstelle einzulegen. Der Widerspruch kann auch zur Niederschrift der Geschäftsstelle eines jeden Amtsgerichtes abgegeben werden. Die Einlegung ist auch durch Übertragung eines elektronischen Dokuments an die elektronische Poststelle des Gerichts möglich. Das elektronische Dokument muss für die Bearbeitung durch das Gericht geeignet und mit einer qualifizierten elektronischen Signatur der verantwortenden Person versehen sein oder von der verantwortenden Person signiert und auf einem sicheren Übermittlungsweg gemäß § 130 a ZPO nach näherer Maßgabe der Verordnung über die technischen Rahmenbedingungen des elektronischen Rechtsverkehrs und über das besondere elektronische Behördenpostfach (BGBl. I, S. 3803) eingereicht werden. Weitere Informationen erhalten Sie auf der Internetseite www.justiz.de <http://www.justiz.de>. Der Widerspruch muss spätestens innerhalb der gesetzten Frist bei dem Amtsgericht Duisburg eingegangen sein. Dies gilt auch dann, wenn der Widerspruch zur Niederschrift der Geschäftsstelle eines anderen Amtsgerichtes abgegeben wurde. Die Frist beginnt mit der Veröffentlichung. Fällt das Ende der Frist auf einen Sonntag, einen allgemeinen Feiertag oder Sonnabend, so endet die Frist mit Ablauf des nächsten Werktages. Der Widerspruch muss die Bezeichnung der angefochtenen Verfügung sowie die Erklärung enthalten, dass Widerspruch gegen diese Verfügung eingelegt wird. Er ist zu unterzeichnen und soll begründet werden"
    },
    {
      "date": "2026-01-16",
      "id": "142671",
      "original_text": "Löschungsankündigung\nNordrhein-Westfalen Amtsgericht Hamm HRB 8592\nShark-Automaten-Betriebs GmbH – Hamm",
      "type": "Löschungsankündigung",
      "state": "Nordrhein-Westfalen",
      "amtsgericht": "Amtsgericht Hamm",
      "registernummer": "HRB 8592",
      "registerart": "HRB",
      "company_name": "Shark-Automaten-Betriebs GmbH",
      "company_seat": "Hamm",
      "details": "16.01.2026 (Bekanntmachungsdatum)\n\nNordrhein-Westfalen Amtsgericht Hamm HRB 8592\nLöschungsankündigung\n\nShark-Automaten-Betriebs GmbH\nGesellschaft mit beschränkter Haftung\nHamm\n\nDas Registergericht beabsichtigt die Gesellschaft von Amts wegen nach § 394 FamFG zu löschen. Die Frist zur Erhebung eines Widerspruchs ist auf drei Monate festgesetzt."
    },
    {
      "date": "2026-01-16",
      "id": "142672",
      "original_text": "Löschungsankündigung\nThüringen Amtsgericht Jena HRB 517118\nsmokepope UG (haftungsbeschränkt) – Erfurt",
      "type": "Löschungsankündigung",
      "state": "Thüringen",
      "amtsgericht": "Amtsgericht Jena",
      "registernummer": "HRB 517118",
      "registerart": "HRB",
      "company_name": "smokepope UG (haftungsbeschränkt)",
      "company_seat": "Erfurt",
      "details": "16.01.2026 (Bekanntmachungsdatum)\n\nThüringen Amtsgericht Jena HRB 517118\nLöschungsankündigung\n\nsmokepope UG (haftungsbeschränkt)\nGesellschaft mit beschränkter Haftung\nErfurt\n\nDas Registergericht beabsichtigt, die im Handelsregister eingetragene Gesellschaft wegen Vermögenslosigkeit nach § 394 FamFG von Amts wegen zu löschen. Die Frist zur Erhebung eines Widerspruchs gegen die beabsichtigte Löschung wird auf 6 Wochen festgesetzt."
    },
    {
      "date": "2026-01-16",
      "id": "142673",
      "original_text": "Sonstige Registerbekanntmachung\nHessen Amtsgericht Marburg VR 5644\nRadKu – Marburg",
      "type": "Sonstige Registerbekanntmachung",
      "state": "Hessen",
      "amtsgericht": "Amtsgericht Marburg",
      "registernummer": "VR 5644",
      "registerart": "VR",
      "company_name": "RadKu",
      "company_seat": "Marburg",
      "details": "16.01.2026 (Bekanntmachungsdatum)\n\nHessen Amtsgericht Marburg VR 5644\nSonstige Registerbekanntmachung 16.01.2026 (Eintragungsdatum)\n\nRadKu\neingetragener Verein\nMarburg\n\nDer Verein ist aufgelöst."
    },
    {
      "date": "2026-01-16",
      "id": "142674",
      "original_text": "Löschungsankündigung\nHessen Amtsgericht Frankfurt am Main HRB 127407\nEintracht Gebäudetechnik GmbH – Frankfurt am Main",
      "type": "Löschungsankündigung",
      "state": "Hessen",
      "amtsgericht": "Amtsgericht Frankfurt am Main",
      "registernummer": "HRB 127407",
      "registerart": "HRB",
      "company_name": "Eintracht Gebäudetechnik GmbH",
      "company_seat": "Frankfurt am Main",
      "details": "16.01.2026 (Bekanntmachungsdatum)\n\nHessen Amtsgericht Frankfurt am Main HRB 127407\nLöschungsankündigung 16.01.2026 (Eintragungsdatum)\n\nEintracht Gebäudetechnik GmbH\nGesellschaft mit beschränkter Haftung\nFrankfurt am Main\n\nEs ist beabsichtigt, die Gesellschaft wegen Vermögenslosigkeit gemäß § 394 FamFG von Amts wegen im Handelsregister zu löschen.\nHiergegen kann innerhalb eines Monats nach dieser Veröffentlichung\nWiderspruch bei dem Amtsgericht Frankfurt am Main eingelegt werden."
    },
    {
      "date": "2026-01-16",
      "id": "142675",
      "original_text": "Löschungsankündigung\nHessen Amtsgericht Frankfurt am Main HRB 126690\nCloudEatery F1 UG (haftungsbeschränkt) – Frankfurt am Main",
      "type": "Löschungsankündigung",
      "state": "Hessen",
      "amtsgericht": "Amtsgericht Frankfurt am Main",
      "registernummer": "HRB 126690",
      "registerart": "HRB",
      "company_name": "CloudEatery F1 UG (haftungsbeschränkt)",
      "company_seat": "Frankfurt am Main",
      "details": "16.01.2026 (Bekanntmachungsdatum)\n\nHessen Amtsgericht Frankfurt am Main HRB 126690\nLöschungsankündigung\n\nCloudEatery F1 UG (haftungsbeschränkt)\nGesellschaft mit beschränkter Haftung\nFrankfurt am Main\n\nDas Registergericht beabsichtigt die im Handelsregister eingetragene Gesellschaft von Amts wegen nach § 394 FamFG zu löschen. Die Frist zur Erhebung eines Widerspruchs gegen die beabsichtigte Löschung wird auf 1 Monat festgesetzt."
    },
    {
      "date": "2026-01-16",
      "id": "142676",
      "original_text": "Löschungsankündigung\nHessen Amtsgericht Darmstadt HRB 99993\nBB Global GmbH – Kelsterbach",
      "type": "Löschungsankündigung",
      "state": "Hessen",
      "amtsgericht": "Amtsgericht Darmstadt",
      "registernummer": "HRB 99993",
      "registerart": "HRB",
      "company_name": "BB Global GmbH",
      "company_seat": "Kelsterbach",
      "details": "16.01.2026 (Bekanntmachungsdatum)\n\nHessen Amtsgericht Darmstadt HRB 99993\nLöschungsankündigung\n\nBB Global GmbH\nGesellschaft mit beschränkter Haftung\nKelsterbach\n\nDas Registergericht beabsichtigt die im Handelsregister eingetragene Gesellschaft von Amts wegen nach § 394 FamFG zu löschen. Die Frist zur Erhebung eines Widerspruchs gegen die beabsichtigte Löschung wird auf 3 Monate festgesetzt."
    },
    {
      "date": "2026-01-16",
      "id": "142677",
      "original_text": "Registerbekanntmachung nach dem Umwandlungsgesetz\nHessen Amtsgericht Frankfurt am Main HRB 7313\nSVG Autohof Hessen Gesellschaft mit beschränkter Haftung – Frankfurt am Main",
      "type": "Registerbekanntmachung nach dem Umwandlungsgesetz",
      "state": "Hessen",
      "amtsgericht": "Amtsgericht Frankfurt am Main",
      "registernummer": "HRB 7313",
      "registerart": "HRB",
      "company_name": "SVG Autohof Hessen Gesellschaft mit beschränkter Haftung",
      "company_seat": "Frankfurt am Main",
      "details": "16.01.2026 (Bekanntmachungsdatum)\n\nHessen Amtsgericht Frankfurt am Main HRB 7313\nRegisterbekanntmachung nach dem Umwandlungsgesetz 16.01.2026 (Eintragungsdatum)\n\nSVG Autohof Hessen Gesellschaft mit beschränkter Haftung\nGesellschaft mit beschränkter Haftung\nFrankfurt am Main\n\nDen Gläubigern der an der Verschmelzung beteiligten Rechtsträger ist, wenn sie binnen sechs Monaten nach dem Tag, an dem die Eintragung der Verschmelzung in das Register des Sitzes desjenigen Rechtsträgers, dessen Gläubiger sie sind, nach § 19 Absatz 3 UmwG bekannt gemacht worden ist, ihren Anspruch nach Grund und Höhe schriftlich anmelden, Sicherheit zu leisten, soweit sie nicht Befriedigung verlangen können. Dieses Recht steht den Gläubigern jedoch nur zu, wenn sie glaubhaft machen, dass durch die Verschmelzung die Erfüllung ihrer Forderung gefährdet wird."
    },
    {
      "date": "2026-01-16",
      "id": "142678",
      "original_text": "Löschungsankündigung\nHessen Amtsgericht Bad Homburg v.d.H. HRB 14611\nIN Service GmbH – Bad Homburg v. d. Höhe",
      "type": "Löschungsankündigung",
      "state": "Hessen",
      "amtsgericht": "Amtsgericht Bad Homburg v.d.H.",
      "registernummer": "HRB 14611",
      "registerart": "HRB",
      "company_name": "IN Service GmbH",
      "company_seat": "Bad Homburg v. d. Höhe",
      "details": "16.01.2026 (Bekanntmachungsdatum)\n\nHessen Amtsgericht Bad Homburg v.d.H. HRB 14611\nLöschungsankündigung\n\nIN Service GmbH\nGesellschaft mit beschränkter Haftung\nBad Homburg v. d. Höhe\n\nDas Registergericht beabsichtigt die im Handelsregister eingetragene Gesellschaft von Amts wegen nach § 394 FamFG zu löschen. Die Frist zur Erhebung eines Widerspruchs gegen die beabsichtigte Löschung wird auf 3 Monate festgesetzt."
    },
    {
      "date": "2026-01-16",
      "id": "142679",
      "original_text": "Registerbekanntmachung nach dem Umwandlungsgesetz\nHessen Amtsgericht Bad Homburg v.d.H. HRB 12552\nJAR GmbH – Oberursel (Taunus)",
      "type": "Registerbekanntmachung nach dem Umwandlungsgesetz",
      "state": "Hessen",
      "amtsgericht": "Amtsgericht Bad Homburg v.d.H.",
      "registernummer": "HRB 12552",
      "registerart": "HRB",
      "company_name": "JAR GmbH",
      "company_seat": "Oberursel (Taunus)",
      "details": "16.01.2026 (Bekanntmachungsdatum)\n\nHessen Amtsgericht Bad Homburg v.d.H. HRB 12552\nRegisterbekanntmachung nach dem Umwandlungsgesetz 16.01.2026 (Eintragungsdatum)\n\nJAR GmbH\nGesellschaft mit beschränkter Haftung\nOberursel (Taunus)\n\nDen Gläubigern der an der Verschmelzung beteiligten Rechtsträger ist, wenn sie binnen sechs Monaten nach dem Tag, an dem die Eintragung der Verschmelzung in das Register des Sitzes desjenigen Rechtsträgers, dessen Gläubiger sie sind, nach § 19 Absatz 3 UmwG bekannt gemacht worden ist, ihren Anspruch nach Grund und Höhe schriftlich anmelden, Sicherheit zu leisten, soweit sie nicht Befriedigung verlangen können. Dieses Recht steht den Gläubigern jedoch nur zu, wenn sie glaubhaft machen, dass durch die Verschmelzung die Erfüllung ihrer Forderung gefährdet wird."
    },
    {
      "date": "2026-01-16",
      "id": "142680",
      "original_text": "Einreichung neuer Dokumente\nHessen Amtsgericht Frankfurt am Main HRB 129665\nAI Quality & Testing Hub GmbH – Frankfurt am Main",
      "type": "Einreichung neuer Dokumente",
      "state": "Hessen",
      "amtsgericht": "Amtsgericht Frankfurt am Main",
      "registernummer": "HRB 129665",
      "registerart": "HRB",
      "company_name": "AI Quality & Testing Hub GmbH",
      "company_seat": "Frankfurt am Main",
      "details": "16.01.2026 (Bekanntmachungsdatum)\n\nHessen Amtsgericht Frankfurt am Main HRB 129665\nEinreichung neuer Dokumente 16.01.2026 (Eintragungsdatum)\n\nAI Quality & Testing Hub GmbH\nGesellschaft mit beschränkter Haftung\nFrankfurt am Main\n\nDurch eine Änderung in den Personen der Aufsichtsratsmitglieder ist eine Liste der Mitglieder des Aufsichtsrates zum Handelsregister eingereicht worden."
    },
    {
      "date": "2026-01-16",
      "id": "142681",
      "original_text": "Einreichung neuer Dokumente\nHessen Amtsgericht Frankfurt am Main HRB 7500\nClearstream Europe AG – Frankfurt am Main",
      "type": "Einreichung neuer Dokumente",
      "state": "Hessen",
      "amtsgericht": "Amtsgericht Frankfurt am Main",
      "registernummer": "HRB 7500",
      "registerart": "HRB",
      "company_name": "Clearstream Europe AG",
      "company_seat": "Frankfurt am Main",
      "details": "16.01.2026 (Bekanntmachungsdatum)\n\nHessen Amtsgericht Frankfurt am Main HRB 7500\nEinreichung neuer Dokumente\n\nClearstream Europe AG\nAktiengesellschaft\nFrankfurt am Main\n\nDurch eine Änderung in den Personen der Aufsichtsratsmitglieder ist eine Liste der Mitglieder des Aufsichtsrates zum Handelsregister eingereicht worden."
    },
    {
      "date": "2026-01-16",
      "id": "142682",
      "original_text": "Registerbekanntmachung nach dem Umwandlungsgesetz\nHessen Amtsgericht Frankfurt am Main HRB 126516\nBlitz F22-13 GmbH – Frankfurt am Main",
      "type": "Registerbekanntmachung nach dem Umwandlungsgesetz",
      "state": "Hessen",
      "amtsgericht": "Amtsgericht Frankfurt am Main",
      "registernummer": "HRB 126516",
      "registerart": "HRB",
      "company_name": "Blitz F22-13 GmbH",
      "company_seat": "Frankfurt am Main",
      "details": "16.01.2026 (Bekanntmachungsdatum)\n\nHessen Amtsgericht Frankfurt am Main HRB 126516\nRegisterbekanntmachung nach dem Umwandlungsgesetz 02.01.2026 (Eintragungsdatum)\n\nBlitz F22-13 GmbH\nGesellschaft mit beschränkter Haftung\nFrankfurt am Main\n\nDen Gläubigern der an der formwechselnden Umwandlung beteiligten Rechtsträger ist, wenn sie binnen sechs Monaten nach dem Tag, an dem die Eintragung der formwechselnden Umwandlung in das Register des Sitzes desjenigen Rechtsträgers, dessen Gläubiger sie sind, nach § 201 UmwG bekannt gemacht worden ist, ihren Anspruch nach Grund und Höhe schriftlich anmelden, Sicherheit zu leisten, soweit sie nicht Befriedigung verlangen können. Dieses Recht steht den Gläubigern jedoch nur zu, wenn sie glaubhaft machen, dass durch die formwechselnden Umwandlung die Erfüllung ihrer Forderung gefährdet wird."
    },
    {
      "date": "2026-01-16",
      "id": "142683",
      "original_text": "Löschungsankündigung\nHessen Amtsgericht Offenbach am Main HRB 47090\nZahir Facility Management GmbH – Neu-Isenburg",
      "type": "Löschungsankündigung",
      "state": "Hessen",
      "amtsgericht": "Amtsgericht Offenbach am Main",
      "registernummer": "HRB 47090",
      "registerart": "HRB",
      "company_name": "Zahir Facility Management GmbH",
      "company_seat": "Neu-Isenburg",
      "details": "16.01.2026 (Bekanntmachungsdatum)\n\nHessen Amtsgericht Offenbach am Main HRB 47090\nLöschungsankündigung\n\nZahir Facility Management GmbH\nGesellschaft mit beschränkter Haftung\nNeu-Isenburg\n\nDas Registergericht beabsichtigt die im Handelsregister eingetragene Gesellschaft von Amts wegen nach § 394 FamFG zu löschen. Die Frist zur Erhebung eines Widerspruchs gegen die beabsichtigte Löschung wird auf 3 Monate festgesetzt."
    },
    {
      "date": "2026-01-16",
      "id": "142684",
      "original_text": "Löschungsankündigung\nHessen Amtsgericht Frankfurt am Main HRB 126685\nICE lnternational Cargo Express GmbH – Frankfurt am Main",
      "type": "Löschungsankündigung",
      "state": "Hessen",
      "amtsgericht": "Amtsgericht Frankfurt am Main",
      "registernummer": "HRB 126685",
      "registerart": "HRB",
      "company_name": "ICE lnternational Cargo Express GmbH",
      "company_seat": "Frankfurt am Main",
      "details": "16.01.2026 (Bekanntmachungsdatum)\n\nHessen Amtsgericht Frankfurt am Main HRB 126685\nLöschungsankündigung\n\nICE lnternational Cargo Express GmbH\nGesellschaft mit beschränkter Haftung\nFrankfurt am Main\n\nEs ist beabsichtigt, den/die Geschäftsführer/in gemäß § 395 FamFG von Amts wegen im Handelsregister zu löschen."
    },
    {
      "date": "2026-01-16",
      "id": "142685",
      "original_text": "Registerbekanntmachung nach dem Umwandlungsgesetz\nHessen Amtsgericht Korbach HRB 1724\nHaus am Nordwall gemeinnützige GmbH – Korbach",
      "type": "Registerbekanntmachung nach dem Umwandlungsgesetz",
      "state": "Hessen",
      "amtsgericht": "Amtsgericht Korbach",
      "registernummer": "HRB 1724",
      "registerart": "HRB",
      "company_name": "Haus am Nordwall gemeinnützige GmbH",
      "company_seat": "Korbach",
      "details": "16.01.2026 (Bekanntmachungsdatum)\n\nHessen Amtsgericht Korbach HRB 1724\nRegisterbekanntmachung nach dem Umwandlungsgesetz 16.01.2026 (Eintragungsdatum)\n\nHaus am Nordwall gemeinnützige GmbH\nGesellschaft mit beschränkter Haftung\nKorbach\n\nDen Gläubigern der an der Verschmelzung beteiligten Rechtsträger ist, wenn sie binnen sechs Monaten nach dem Tag, an dem die Eintragung der Verschmelzung in das Register des Sitzes derjenigen Rechtsträger deren Gläubiger sie sind, nach § 19 Absatz 3 UmwG bekannt gemacht worden ist, ihren Anspruch nach Grund und Höhe schriftlich anmelden, Sicherheit zu leisten, soweit sie nicht Befriedigung verlangen können. Dieses Recht steht den Gläubigern jedoch nur zu, wenn sie glaubhaft machen, dass durch die Verschmelzung die Erfüllung ihrer Forderung gefährdet wird."
    },
    {
      "date": "2026-01-16",
      "id": "142686",
      "original_text": "Sonstige Registerbekanntmachung\nHessen Amtsgericht Wetzlar HRB 8681\nKVHG2 GmbH – Wetzlar",
      "type": "Sonstige Registerbekanntmachung",
      "state": "Hessen",
      "amtsgericht": "Amtsgericht Wetzlar",
      "registernummer": "HRB 8681",
      "registerart": "HRB",
      "company_name": "KVHG2 GmbH",
      "company_seat": "Wetzlar",
      "details": "16.01.2026 (Bekanntmachungsdatum)\n\nHessen Amtsgericht Wetzlar HRB 8681\nSonstige Registerbekanntmachung 16.01.2026 (Eintragungsdatum)\n\nKVHG2 GmbH\nGesellschaft mit beschränkter Haftung\nWetzlar\n\nDen Gläubigern der Gesellschaft, deren Forderungen begründet worden sind, bevor die Eintragung der Beendigung des Vertrags in das Handelsregister nach § 10 HGB bekannt gemacht worden ist, ist vom anderen Vertragsteil Sicherheit zu leisten, wenn sie sich binnen sechs Monaten nach dieser Bekanntmachung zu diesem Zweck bei ihm melden."
    },
    {
      "date": "2026-01-16",
      "id": "142687",
      "original_text": "Registerbekanntmachung nach dem Umwandlungsgesetz\nHessen Amtsgericht Korbach HRB 1527\nStadtkrankenhaus Korbach Privatklinik GmbH – Korbach",
      "type": "Registerbekanntmachung nach dem Umwandlungsgesetz",
      "state": "Hessen",
      "amtsgericht": "Amtsgericht Korbach",
      "registernummer": "HRB 1527",
      "registerart": "HRB",
      "company_name": "Stadtkrankenhaus Korbach Privatklinik GmbH",
      "company_seat": "Korbach",
      "details": "16.01.2026 (Bekanntmachungsdatum)\n\nHessen Amtsgericht Korbach HRB 1527\nRegisterbekanntmachung nach dem Umwandlungsgesetz 16.01.2026 (Eintragungsdatum)\n\nStadtkrankenhaus Korbach Privatklinik GmbH\nGesellschaft mit beschränkter Haftung\nKorbach\n\nDen Gläubigern der an der Verschmelzung beteiligten Rechtsträger ist, wenn sie binnen sechs Monaten nach dem Tag, an dem die Eintragung der Verschmelzung in das Register des Sitzes derjenigen Rechtsträger deren Gläubiger sie sind, nach § 19 Absatz 3 UmwG bekannt gemacht worden ist, ihren Anspruch nach Grund und Höhe schriftlich anmelden, Sicherheit zu leisten, soweit sie nicht Befriedigung verlangen können. Dieses Recht steht den Gläubigern jedoch nur zu, wenn sie glaubhaft machen, dass durch die Verschmelzung die Erfüllung ihrer Forderung gefährdet wird."
    },
    {
      "date": "2026-01-16",
      "id": "142688",
      "original_text": "Registerbekanntmachung nach dem Umwandlungsgesetz\nHessen Amtsgericht Frankfurt am Main HRB 46276\nSVG Autohof Niederelsungen GmbH – Frankfurt am Main",
      "type": "Registerbekanntmachung nach dem Umwandlungsgesetz",
      "state": "Hessen",
      "amtsgericht": "Amtsgericht Frankfurt am Main",
      "registernummer": "HRB 46276",
      "registerart": "HRB",
      "company_name": "SVG Autohof Niederelsungen GmbH",
      "company_seat": "Frankfurt am Main",
      "details": "16.01.2026 (Bekanntmachungsdatum)\n\nHessen Amtsgericht Frankfurt am Main HRB 46276\nRegisterbekanntmachung nach dem Umwandlungsgesetz 16.01.2026 (Eintragungsdatum)\n\nSVG Autohof Niederelsungen GmbH\nGesellschaft mit beschränkter Haftung\nFrankfurt am Main\n\nDen Gläubigern der an der Verschmelzung beteiligten Rechtsträger ist, wenn sie binnen sechs Monaten nach dem Tag, an dem die Eintragung der Verschmelzung in das Register des Sitzes desjenigen Rechtsträgers, dessen Gläubiger sie sind, nach § 19 Absatz 3 UmwG bekannt gemacht worden ist, ihren Anspruch nach Grund und Höhe schriftlich anmelden, Sicherheit zu leisten, soweit sie nicht Befriedigung verlangen können. Dieses Recht steht den Gläubigern jedoch nur zu, wenn sie glaubhaft machen, dass durch die Verschmelzung die Erfüllung ihrer Forderung gefährdet wird."
    }
  ]
}