{
  "date": "2026-01-29",
  "date_of_scrape": "2026-01-30T04:38:16.855Z",
  "tool_version": "0.2.0",
  "number_of_announcements": 141,
  "announcements": [
    {
      "date": "2026-01-29",
      "id": "143759",
      "original_text": "Einreichung neuer Dokumente\nBayern Amtsgericht Kempten (Allgäu) HRB 12407\nDACHSER SE – Kempten (Allgäu)",
      "type": "Einreichung neuer Dokumente",
      "state": "Bayern",
      "amtsgericht": "Amtsgericht Kempten (Allgäu)",
      "registernummer": "HRB 12407",
      "registerart": "HRB",
      "company_name": "DACHSER SE",
      "company_seat": "Kempten (Allgäu)",
      "details": "29.01.2026 (Bekanntmachungsdatum)\n\nBayern Amtsgericht Kempten (Allgäu) HRB 12407\nEinreichung neuer Dokumente\n\nDACHSER SE\nEuropäische Aktiengesellschaft (SE)\nKempten (Allgäu)\n\nDem Amtsgericht Kempten (Allgäu) -Registergericht- ist eine Liste der Mitglieder des Aufsichtsrats eingereicht worden, Art. 9 Abs. 1 Buchst. c (ii) SE-VO i.V.m. § 106 AktG."
    },
    {
      "date": "2026-01-29",
      "id": "143760",
      "original_text": "Einreichung neuer Dokumente\nBayern Amtsgericht Coburg HRB 5389\nHAGELEXPERT AG – Bad Staffelstein",
      "type": "Einreichung neuer Dokumente",
      "state": "Bayern",
      "amtsgericht": "Amtsgericht Coburg",
      "registernummer": "HRB 5389",
      "registerart": "HRB",
      "company_name": "HAGELEXPERT AG",
      "company_seat": "Bad Staffelstein",
      "details": "29.01.2026 (Bekanntmachungsdatum)\n\nBayern Amtsgericht Coburg HRB 5389\nEinreichung neuer Dokumente 27.01.2026 (Eintragungsdatum)\n\nHAGELEXPERT AG\nAktiengesellschaft\nBad Staffelstein\n\nDem Amtsgericht Coburg -Registergericht- ist eine Liste der Mitglieder des Aufsichtsrats eingereicht worden, § 106 AktG."
    },
    {
      "date": "2026-01-29",
      "id": "143761",
      "original_text": "Löschungsankündigung\nBayern Amtsgericht München HRB 196209\nKayser Forum for Sustainability gemeinnützige GmbH – München",
      "type": "Löschungsankündigung",
      "state": "Bayern",
      "amtsgericht": "Amtsgericht München",
      "registernummer": "HRB 196209",
      "registerart": "HRB",
      "company_name": "Kayser Forum for Sustainability gemeinnützige GmbH",
      "company_seat": "München",
      "details": "29.01.2026 (Bekanntmachungsdatum)\n\nBayern Amtsgericht München HRB 196209\nLöschungsankündigung 28.01.2026 (Eintragungsdatum)\n\nKayser Forum for Sustainability gemeinnützige GmbH\nGesellschaft mit beschränkter Haftung\nMünchen\n\nDas Registergericht beabsichtigt, die im Handelsregister eingetragene Gesellschaft wegen Vermögenslosigkeit von Amts wegen nach § 394 FamFG zu löschen. Die Frist zur Erhebung eines Widerspruchs ist auf drei Monate festgesetzt."
    },
    {
      "date": "2026-01-29",
      "id": "143762",
      "original_text": "Löschungsankündigung\nBayern Amtsgericht Würzburg HRB 10127\nIdea GmbH – Würzburg",
      "type": "Löschungsankündigung",
      "state": "Bayern",
      "amtsgericht": "Amtsgericht Würzburg",
      "registernummer": "HRB 10127",
      "registerart": "HRB",
      "company_name": "Idea GmbH",
      "company_seat": "Würzburg",
      "details": "29.01.2026 (Bekanntmachungsdatum)\n\nBayern Amtsgericht Würzburg HRB 10127\nLöschungsankündigung\n\nIdea GmbH\nGesellschaft mit beschränkter Haftung\nWürzburg\n\nDas Registergericht beabsichtigt, die im Handelsregister eingetragene Gesellschaft wegen Vermögenslosigkeit von Amts wegen nach § 394 FamFG zu löschen. Die Frist zur Erhebung eines Widerspruchs ist auf drei Monate festgesetzt."
    },
    {
      "date": "2026-01-29",
      "id": "143763",
      "original_text": "Einreichung neuer Dokumente\nBayern Amtsgericht Nürnberg HRB 32322\nEnergie-Projektagentur Nürnberger Land GmbH – Lauf a.d.Pegnitz",
      "type": "Einreichung neuer Dokumente",
      "state": "Bayern",
      "amtsgericht": "Amtsgericht Nürnberg",
      "registernummer": "HRB 32322",
      "registerart": "HRB",
      "company_name": "Energie-Projektagentur Nürnberger Land GmbH",
      "company_seat": "Lauf a.d.Pegnitz",
      "details": "29.01.2026 (Bekanntmachungsdatum)\n\nBayern Amtsgericht Nürnberg HRB 32322\nEinreichung neuer Dokumente\n\nEnergie-Projektagentur Nürnberger Land GmbH\nGesellschaft mit beschränkter Haftung\nLauf a.d.Pegnitz\n\nDem Amtsgericht Nürnberg -Registergericht- ist eine Liste der Mitglieder des Aufsichtsrats eingereicht worden, § 52 Abs. 3 S. 2 GmbHG."
    },
    {
      "date": "2026-01-29",
      "id": "143764",
      "original_text": "Registerbekanntmachung nach dem Umwandlungsgesetz\nBayern Amtsgericht München HRB 158370\nInfineon Technologies Delta GmbH – Neubiberg",
      "type": "Registerbekanntmachung nach dem Umwandlungsgesetz",
      "state": "Bayern",
      "amtsgericht": "Amtsgericht München",
      "registernummer": "HRB 158370",
      "registerart": "HRB",
      "company_name": "Infineon Technologies Delta GmbH",
      "company_seat": "Neubiberg",
      "details": "29.01.2026 (Bekanntmachungsdatum)\n\nBayern Amtsgericht München HRB 158370\nRegisterbekanntmachung nach dem Umwandlungsgesetz 28.01.2026 (Eintragungsdatum)\n\nInfineon Technologies Delta GmbH\nGesellschaft mit beschränkter Haftung\nNeubiberg\n\nDen Gläubigern der an der Verschmelzung beteiligten Rechtsträger ist, wenn sie binnen sechs Monaten nach dem Tag, an dem die Eintragung der Verschmelzung in das Register des Sitzes desjenigen Rechtsträgers, dessen Gläubiger sie sind, nach § 19 Abs. 3 UmwG als bekannt gemacht gilt, ihren Anspruch nach Grund und Höhe in Textform anmelden, Sicherheit zu leisten, soweit sie nicht Befriedigung verlangen können. Dieses Recht steht den Gläubigern jedoch nur zu, wenn sie glaubhaft machen, dass durch die Verschmelzung die Erfüllung ihrer Forderung gefährdet wird."
    },
    {
      "date": "2026-01-29",
      "id": "143765",
      "original_text": "Registerbekanntmachung nach dem Umwandlungsgesetz\nBayern Amtsgericht München HRB 306748\nPlail IT GmbH – Germering",
      "type": "Registerbekanntmachung nach dem Umwandlungsgesetz",
      "state": "Bayern",
      "amtsgericht": "Amtsgericht München",
      "registernummer": "HRB 306748",
      "registerart": "HRB",
      "company_name": "Plail IT GmbH",
      "company_seat": "Germering",
      "details": "29.01.2026 (Bekanntmachungsdatum)\n\nBayern Amtsgericht München HRB 306748\nRegisterbekanntmachung nach dem Umwandlungsgesetz 28.01.2026 (Eintragungsdatum)\n\nPlail IT GmbH\nGesellschaft mit beschränkter Haftung\nGermering\n\nDen Gläubigern der an der Ausgliederung beteiligten Rechtsträger ist, wenn sie binnen sechs Monaten nach dem Tag, an dem die Eintragung der Ausgliederung in das Register des Sitzes desjenigen Rechtsträgers, dessen Gläubiger sie sind, nach §§ 125, 19 Abs. 3 UmwG als bekannt gemacht gilt, ihren Anspruch nach Grund und Höhe in Textform anmelden, Sicherheit zu leisten, soweit sie nicht Befriedigung verlangen können. Dieses Recht steht den Gläubigern jedoch nur zu, wenn sie glaubhaft machen, dass durch die Ausgliederung die Erfüllung ihrer Forderung gefährdet wird."
    },
    {
      "date": "2026-01-29",
      "id": "143766",
      "original_text": "Löschungsankündigung\nBayern Amtsgericht Schweinfurt GnR 220\nSalinenblick eG – Bad Kissingen",
      "type": "Löschungsankündigung",
      "state": "Bayern",
      "amtsgericht": "Amtsgericht Schweinfurt",
      "registernummer": "GnR 220",
      "registerart": "GnR",
      "company_name": "Salinenblick eG",
      "company_seat": "Bad Kissingen",
      "details": "29.01.2026 (Bekanntmachungsdatum)\n\nBayern Amtsgericht Schweinfurt GnR 220\nLöschungsankündigung\n\nSalinenblick eG\neingetragene Genossenschaft\nBad Kissingen\n\nDas Registergericht beabsichtigt, die im Genossenschaftsregister eingetragene Genossenschaft wegen Vermögenslosigkeit von Amts wegen nach § 394 FamFG zu löschen. Die Frist zur Erhebung eines Widerspruchs ist auf einen Monat festgesetzt."
    },
    {
      "date": "2026-01-29",
      "id": "143767",
      "original_text": "Registerbekanntmachung nach dem Umwandlungsgesetz\nBayern Amtsgericht München HRB 309162\nS-Partner Kapital GmbH – München",
      "type": "Registerbekanntmachung nach dem Umwandlungsgesetz",
      "state": "Bayern",
      "amtsgericht": "Amtsgericht München",
      "registernummer": "HRB 309162",
      "registerart": "HRB",
      "company_name": "S-Partner Kapital GmbH",
      "company_seat": "München",
      "details": "29.01.2026 (Bekanntmachungsdatum)\n\nBayern Amtsgericht München HRB 309162\nRegisterbekanntmachung nach dem Umwandlungsgesetz 28.01.2026 (Eintragungsdatum)\n\nS-Partner Kapital GmbH\nGesellschaft mit beschränkter Haftung\nMünchen\n\nDen Gläubigern des formwechselnden Rechtsträgers ist, wenn sie binnen sechs Monaten nach dem Tag, an dem die Eintragung des Formwechsels nach § 201 UmwG als bekannt gemacht gilt, ihren Anspruch nach Grund und Höhe in Textform anmelden, Sicherheit zu leisten, soweit sie nicht Befriedigung verlangen können. Dieses Recht steht den Gläubigern jedoch nur zu, wenn sie glaubhaft machen, dass durch den Formwechsel die Erfüllung ihrer Forderung gefährdet wird."
    },
    {
      "date": "2026-01-29",
      "id": "143768",
      "original_text": "Einreichung neuer Dokumente\nBayern Amtsgericht Ingolstadt HRB 10454\nAUMOVIO Autonomous Mobility Germany GmbH – Ingolstadt",
      "type": "Einreichung neuer Dokumente",
      "state": "Bayern",
      "amtsgericht": "Amtsgericht Ingolstadt",
      "registernummer": "HRB 10454",
      "registerart": "HRB",
      "company_name": "AUMOVIO Autonomous Mobility Germany GmbH",
      "company_seat": "Ingolstadt",
      "details": "29.01.2026 (Bekanntmachungsdatum)\n\nBayern Amtsgericht Ingolstadt HRB 10454\nEinreichung neuer Dokumente\n\nAUMOVIO Autonomous Mobility Germany GmbH\nGesellschaft mit beschränkter Haftung\nIngolstadt\n\nDem Amtsgericht Ingolstadt -Registergericht- ist eine Liste der Mitglieder des Aufsichtsrats eingereicht worden, § 52 Abs. 3 S. 2 GmbHG."
    },
    {
      "date": "2026-01-29",
      "id": "143769",
      "original_text": "Einreichung neuer Dokumente\nBayern Amtsgericht München HRB 295086\nJunker AG – Taufkirchen",
      "type": "Einreichung neuer Dokumente",
      "state": "Bayern",
      "amtsgericht": "Amtsgericht München",
      "registernummer": "HRB 295086",
      "registerart": "HRB",
      "company_name": "Junker AG",
      "company_seat": "Taufkirchen",
      "details": "29.01.2026 (Bekanntmachungsdatum)\n\nBayern Amtsgericht München HRB 295086\nEinreichung neuer Dokumente\n\nJunker AG\nAktiengesellschaft\nTaufkirchen\n\nDem Amtsgericht München -Registergericht- ist eine Liste der Mitglieder des Aufsichtsrats eingereicht worden, § 106 AktG."
    },
    {
      "date": "2026-01-29",
      "id": "143770",
      "original_text": "Registerbekanntmachung nach dem Umwandlungsgesetz\nBayern Amtsgericht München HRB 226364\nSeniorenwohnanlage Oettingen GmbH – München",
      "type": "Registerbekanntmachung nach dem Umwandlungsgesetz",
      "state": "Bayern",
      "amtsgericht": "Amtsgericht München",
      "registernummer": "HRB 226364",
      "registerart": "HRB",
      "company_name": "Seniorenwohnanlage Oettingen GmbH",
      "company_seat": "München",
      "details": "29.01.2026 (Bekanntmachungsdatum)\n\nBayern Amtsgericht München HRB 226364\nRegisterbekanntmachung nach dem Umwandlungsgesetz 28.01.2026 (Eintragungsdatum)\n\nSeniorenwohnanlage Oettingen GmbH\nGesellschaft mit beschränkter Haftung\nMünchen\n\nDen Gläubigern der an der Verschmelzung beteiligten Rechtsträger ist, wenn sie binnen sechs Monaten nach dem Tag, an dem die Eintragung der Verschmelzung in das Register des Sitzes desjenigen Rechtsträgers, dessen Gläubiger sie sind, nach § 19 Abs. 3 UmwG als bekannt gemacht gilt, ihren Anspruch nach Grund und Höhe in Textform anmelden, Sicherheit zu leisten, soweit sie nicht Befriedigung verlangen können. Dieses Recht steht den Gläubigern jedoch nur zu, wenn sie glaubhaft machen, dass durch die Verschmelzung die Erfüllung ihrer Forderung gefährdet wird."
    },
    {
      "date": "2026-01-29",
      "id": "143771",
      "original_text": "Registerbekanntmachung nach dem Umwandlungsgesetz\nBayern Amtsgericht München HRB 130355\nHoch 3 Gesellschaft für grafische Gestaltung, Konzeption und Kommunikation mbH – München",
      "type": "Registerbekanntmachung nach dem Umwandlungsgesetz",
      "state": "Bayern",
      "amtsgericht": "Amtsgericht München",
      "registernummer": "HRB 130355",
      "registerart": "HRB",
      "company_name": "Hoch 3 Gesellschaft für grafische Gestaltung, Konzeption und Kommunikation mbH",
      "company_seat": "München",
      "details": "29.01.2026 (Bekanntmachungsdatum)\n\nBayern Amtsgericht München HRB 130355\nRegisterbekanntmachung nach dem Umwandlungsgesetz 28.01.2026 (Eintragungsdatum)\n\nHoch 3 Gesellschaft für grafische Gestaltung, Konzeption und Kommunikation mbH\nGesellschaft mit beschränkter Haftung\nMünchen\n\nDen Gläubigern der an der Verschmelzung beteiligten Rechtsträger ist, wenn sie binnen sechs Monaten nach dem Tag, an dem die Eintragung der Verschmelzung in das Register des Sitzes desjenigen Rechtsträgers, dessen Gläubiger sie sind, nach § 19 Abs. 3 UmwG als bekannt gemacht gilt, ihren Anspruch nach Grund und Höhe in Textform anmelden, Sicherheit zu leisten, soweit sie nicht Befriedigung verlangen können. Dieses Recht steht den Gläubigern jedoch nur zu, wenn sie glaubhaft machen, dass durch die Verschmelzung die Erfüllung ihrer Forderung gefährdet wird."
    },
    {
      "date": "2026-01-29",
      "id": "143772",
      "original_text": "Registerbekanntmachung nach dem Umwandlungsgesetz\nBayern Amtsgericht München HRB 138097\nS-Partner Kapital AG – München",
      "type": "Registerbekanntmachung nach dem Umwandlungsgesetz",
      "state": "Bayern",
      "amtsgericht": "Amtsgericht München",
      "registernummer": "HRB 138097",
      "registerart": "HRB",
      "company_name": "S-Partner Kapital AG",
      "company_seat": "München",
      "details": "29.01.2026 (Bekanntmachungsdatum)\n\nBayern Amtsgericht München HRB 138097\nRegisterbekanntmachung nach dem Umwandlungsgesetz 28.01.2026 (Eintragungsdatum)\n\nS-Partner Kapital AG\nAktiengesellschaft\nMünchen\n\nDen Gläubigern des formwechselnden Rechtsträgers ist, wenn sie binnen sechs Monaten nach dem Tag, an dem die Eintragung des Formwechsels nach § 201 UmwG als bekannt gemacht gilt, ihren Anspruch nach Grund und Höhe in Textform anmelden, Sicherheit zu leisten, soweit sie nicht Befriedigung verlangen können. Dieses Recht steht den Gläubigern jedoch nur zu, wenn sie glaubhaft machen, dass durch den Formwechsel die Erfüllung ihrer Forderung gefährdet wird."
    },
    {
      "date": "2026-01-29",
      "id": "143773",
      "original_text": "Löschungsankündigung\nBayern Amtsgericht Nürnberg HRB 39782\nBatelion Holding GmbH – Nürnberg",
      "type": "Löschungsankündigung",
      "state": "Bayern",
      "amtsgericht": "Amtsgericht Nürnberg",
      "registernummer": "HRB 39782",
      "registerart": "HRB",
      "company_name": "Batelion Holding GmbH",
      "company_seat": "Nürnberg",
      "details": "29.01.2026 (Bekanntmachungsdatum)\n\nBayern Amtsgericht Nürnberg HRB 39782\nLöschungsankündigung\n\nBatelion Holding GmbH\nGesellschaft mit beschränkter Haftung\nNürnberg\n\nDas Registergericht beabsichtigt, die im Handelsregister eingetragene Gesellschaft wegen Vermögenslosigkeit von Amts wegen nach § 394 FamFG zu löschen. Die Frist zur Erhebung eines Widerspruchs ist auf einen Monat festgesetzt."
    },
    {
      "date": "2026-01-29",
      "id": "143774",
      "original_text": "Registerbekanntmachung nach dem Umwandlungsgesetz\nBayern Amtsgericht München HRB 181142\nSMK Beteiligungs GmbH – Grünwald",
      "type": "Registerbekanntmachung nach dem Umwandlungsgesetz",
      "state": "Bayern",
      "amtsgericht": "Amtsgericht München",
      "registernummer": "HRB 181142",
      "registerart": "HRB",
      "company_name": "SMK Beteiligungs GmbH",
      "company_seat": "Grünwald",
      "details": "29.01.2026 (Bekanntmachungsdatum)\n\nBayern Amtsgericht München HRB 181142\nRegisterbekanntmachung nach dem Umwandlungsgesetz 28.01.2026 (Eintragungsdatum)\n\nSMK Beteiligungs GmbH\nGesellschaft mit beschränkter Haftung\nGrünwald\n\nDen Gläubigern der an der Spaltung beteiligten Rechtsträger ist, wenn sie binnen sechs Monaten nach dem Tag, an dem die Eintragung der Spaltung in das Register des Sitzes desjenigen Rechtsträgers, dessen Gläubiger sie sind, nach §§ 125, 19 Abs. 3 UmwG als bekannt gemacht gilt, ihren Anspruch nach Grund und Höhe in Textform anmelden, Sicherheit zu leisten, soweit sie nicht Befriedigung verlangen können. Dieses Recht steht den Gläubigern jedoch nur zu, wenn sie glaubhaft machen, dass durch die Spaltung die Erfüllung ihrer Forderung gefährdet wird."
    },
    {
      "date": "2026-01-29",
      "id": "143775",
      "original_text": "Löschungsankündigung\nBayern Amtsgericht München HRB 267226\nPotenta GmbH – München",
      "type": "Löschungsankündigung",
      "state": "Bayern",
      "amtsgericht": "Amtsgericht München",
      "registernummer": "HRB 267226",
      "registerart": "HRB",
      "company_name": "Potenta GmbH",
      "company_seat": "München",
      "details": "29.01.2026 (Bekanntmachungsdatum)\n\nBayern Amtsgericht München HRB 267226\nLöschungsankündigung 28.01.2026 (Eintragungsdatum)\n\nPotenta GmbH\nGesellschaft mit beschränkter Haftung\nMünchen\n\nDas Registergericht beabsichtigt, die im Handelsregister eingetragene Gesellschaft wegen Vermögenslosigkeit von Amts wegen nach § 394 FamFG zu löschen. Die Frist zur Erhebung eines Widerspruchs ist auf drei Monate festgesetzt."
    },
    {
      "date": "2026-01-29",
      "id": "143776",
      "original_text": "Löschungsankündigung\nBayern Amtsgericht Nürnberg HRB 26846\nPSS Personnel-Security-Services GmbH – Parsberg",
      "type": "Löschungsankündigung",
      "state": "Bayern",
      "amtsgericht": "Amtsgericht Nürnberg",
      "registernummer": "HRB 26846",
      "registerart": "HRB",
      "company_name": "PSS Personnel-Security-Services GmbH",
      "company_seat": "Parsberg",
      "details": "29.01.2026 (Bekanntmachungsdatum)\n\nBayern Amtsgericht Nürnberg HRB 26846\nLöschungsankündigung\n\nPSS Personnel-Security-Services GmbH\nGesellschaft mit beschränkter Haftung\nParsberg\n\nDas Registergericht beabsichtigt, die im Handelsregister eingetragene Gesellschaft wegen Vermögenslosigkeit von Amts wegen nach § 394 FamFG zu löschen. Die Frist zur Erhebung eines Widerspruchs ist auf einen Monat festgesetzt."
    },
    {
      "date": "2026-01-29",
      "id": "143777",
      "original_text": "Löschungsankündigung\nBayern Amtsgericht Würzburg HRB 15089\nVitability UG (haftungsbeschränkt) – Höchberg",
      "type": "Löschungsankündigung",
      "state": "Bayern",
      "amtsgericht": "Amtsgericht Würzburg",
      "registernummer": "HRB 15089",
      "registerart": "HRB",
      "company_name": "Vitability UG (haftungsbeschränkt)",
      "company_seat": "Höchberg",
      "details": "29.01.2026 (Bekanntmachungsdatum)\n\nBayern Amtsgericht Würzburg HRB 15089\nLöschungsankündigung\n\nVitability UG (haftungsbeschränkt)\nGesellschaft mit beschränkter Haftung\nHöchberg\n\nDas Registergericht beabsichtigt, die im Handelsregister eingetragene Gesellschaft wegen Vermögenslosigkeit von Amts wegen nach § 394 FamFG zu löschen. Die Frist zur Erhebung eines Widerspruchs ist auf drei Monate festgesetzt."
    },
    {
      "date": "2026-01-29",
      "id": "143778",
      "original_text": "Löschungsankündigung\nBayern Amtsgericht Würzburg HRB 12008\nLurz Projektentwicklung GmbH – Rieneck",
      "type": "Löschungsankündigung",
      "state": "Bayern",
      "amtsgericht": "Amtsgericht Würzburg",
      "registernummer": "HRB 12008",
      "registerart": "HRB",
      "company_name": "Lurz Projektentwicklung GmbH",
      "company_seat": "Rieneck",
      "details": "29.01.2026 (Bekanntmachungsdatum)\n\nBayern Amtsgericht Würzburg HRB 12008\nLöschungsankündigung\n\nLurz Projektentwicklung GmbH\nGesellschaft mit beschränkter Haftung\nRieneck\n\nDas Registergericht beabsichtigt, die im Handelsregister eingetragene Gesellschaft wegen Vermögenslosigkeit von Amts wegen nach § 394 FamFG zu löschen. Die Frist zur Erhebung eines Widerspruchs ist auf drei Monate festgesetzt."
    },
    {
      "date": "2026-01-29",
      "id": "143779",
      "original_text": "Registerbekanntmachung nach dem Umwandlungsgesetz\nBaden-Württemberg Amtsgericht Mannheim GsR 2357\nDevRiseUp eGbR – Bühl",
      "type": "Registerbekanntmachung nach dem Umwandlungsgesetz",
      "state": "Baden-Württemberg",
      "amtsgericht": "Amtsgericht Mannheim",
      "registernummer": "GsR 2357",
      "registerart": "GsR",
      "company_name": "DevRiseUp eGbR",
      "company_seat": "Bühl",
      "details": "29.01.2026 (Bekanntmachungsdatum)\n\nBaden-Württemberg Amtsgericht Mannheim GsR 2357\nRegisterbekanntmachung nach dem Umwandlungsgesetz 29.01.2026 (Eintragungsdatum)\n\nDevRiseUp eGbR\nGesellschaft bürgerlichen Rechts\nBühl\n\nDen Gläubigern des an dem Formwechsel beteiligten Rechtsträgers ist, wenn sie binnen sechs Monaten nach dem Tag, an dem die Eintragung des Formwechsels in das Register des Sitzes desjenigen Rechtsträgers, dessen Gläubiger sie sind, nach § 19 Abs. 3 UmwG als bekanntgemacht gilt, ihren Anspruch nach Grund und Höhe schriftlich anmelden, Sicherheit zu leisten, soweit sie nicht Befriedigung verlangen können. Dieses Recht steht den Gläubigern jedoch nur zu, wenn sie glaubhaft machen, dass durch den Formwechsel die Erfüllung ihrer Forderung gefährdet wird."
    },
    {
      "date": "2026-01-29",
      "id": "143780",
      "original_text": "Registerbekanntmachung nach dem Umwandlungsgesetz\nBaden-Württemberg Amtsgericht Mannheim HRB 750888\nDevRiseUp UG (haftungsbeschränkt) – Bühl",
      "type": "Registerbekanntmachung nach dem Umwandlungsgesetz",
      "state": "Baden-Württemberg",
      "amtsgericht": "Amtsgericht Mannheim",
      "registernummer": "HRB 750888",
      "registerart": "HRB",
      "company_name": "DevRiseUp UG (haftungsbeschränkt)",
      "company_seat": "Bühl",
      "details": "29.01.2026 (Bekanntmachungsdatum)\n\nBaden-Württemberg Amtsgericht Mannheim HRB 750888\nRegisterbekanntmachung nach dem Umwandlungsgesetz 29.01.2026 (Eintragungsdatum)\n\nDevRiseUp UG (haftungsbeschränkt)\nGesellschaft mit beschränkter Haftung\nBühl\n\nDen Gläubigern des an dem Formwechsel beteiligten Rechtsträgers ist, wenn sie binnen sechs Monaten nach dem Tag, an dem die Eintragung des Formwechsels in das Register des Sitzes desjenigen Rechtsträgers, dessen Gläubiger sie sind, nach § 19 Abs. 3 UmwG als bekanntgemacht gilt, ihren Anspruch nach Grund und Höhe schriftlich anmelden, Sicherheit zu leisten, soweit sie nicht Befriedigung verlangen können. Dieses Recht steht den Gläubigern jedoch nur zu, wenn sie glaubhaft machen, dass durch den Formwechsel die Erfüllung ihrer Forderung gefährdet wird."
    },
    {
      "date": "2026-01-29",
      "id": "143781",
      "original_text": "Löschungsankündigung\nSaarland Amtsgericht Saarbrücken HRB 17909\nFERmedia Verlags GmbH – Saarbrücken",
      "type": "Löschungsankündigung",
      "state": "Saarland",
      "amtsgericht": "Amtsgericht Saarbrücken",
      "registernummer": "HRB 17909",
      "registerart": "HRB",
      "company_name": "FERmedia Verlags GmbH",
      "company_seat": "Saarbrücken",
      "details": "29.01.2026 (Bekanntmachungsdatum)\n\nSaarland Amtsgericht Saarbrücken HRB 17909\nLöschungsankündigung 06.01.2026 (Eintragungsdatum)\n\nFERmedia Verlags GmbH\nGesellschaft mit beschränkter Haftung\nSaarbrücken\n\nEs ist beabsichtigt, die Gesellschaft von Amts wegen gemäß § 394 FamFG wegen Vermögenslosigkeit zu löschen.\nGegen die Löschung von Amts wegen ist das Rechtsmittel des Widerspruchs statthaft. Der Widerspruch ist binnen einer Frist zwei Monaten beginnend mit dem Tag dieser Veröffentlichung durch Einreichen eines Widerspruchsschreibens -schriftlich oder zur Niederschrift der Geschäftsstelle beim Amtsgericht Saarbrücken, -zentrales Handelsregister-, Mainzerstr.178, 66121 Saarbrücken einzulegen.\nDer Widerspruch muss die Bezeichnung der angefochtenen Löschungsankündigung enthalten sowie die Erklärung, dass Widerspruch eingelegt wird. Er ist vom Widerspruchsführer oder seinem Bevollmächtigten zu unterzeichnen.\nDas Widerspruchsschreiben kann auch in der Form eines elektronischen Dokumentes eingereicht werden, das mit einer qualifizierten elektronischen Signatur nach dem Signaturgesetz versehen sein muss (§§ 14 Abs. 2 FamFG, 130a, 298 ZPO)."
    },
    {
      "date": "2026-01-29",
      "id": "143782",
      "original_text": "Löschungsankündigung\nBaden-Württemberg Amtsgericht Mannheim HRB 733219\nBarsch Bau UG (haftungsbeschränkt) – Karlsdorf-Neuthard",
      "type": "Löschungsankündigung",
      "state": "Baden-Württemberg",
      "amtsgericht": "Amtsgericht Mannheim",
      "registernummer": "HRB 733219",
      "registerart": "HRB",
      "company_name": "Barsch Bau UG (haftungsbeschränkt)",
      "company_seat": "Karlsdorf-Neuthard",
      "details": "29.01.2026 (Bekanntmachungsdatum)\n\nBaden-Württemberg Amtsgericht Mannheim HRB 733219\nLöschungsankündigung\n\nBarsch Bau UG (haftungsbeschränkt)\nGesellschaft mit beschränkter Haftung\nKarlsdorf-Neuthard\n\nDas Gericht beabsichtigt, die Gesellschaft wegen Vermögenslosigkeit im Handelsregister von Amts wegen nach § 394 FamFG zu löschen. Die Frist zur Geltendmachung eines Widerspruchs gegen die beabsichtigte Löschung ist auf einen Monat ab Veröffentlichung bestimmt."
    },
    {
      "date": "2026-01-29",
      "id": "143783",
      "original_text": "Registerbekanntmachung nach dem Umwandlungsgesetz\nBaden-Württemberg Amtsgericht Mannheim HRA 713028\nSÖM Kanzlei für Steuern - Ökonomie - Mediation Steuerberatungsgesellschaft mbH & Co. KG – Mannheim",
      "type": "Registerbekanntmachung nach dem Umwandlungsgesetz",
      "state": "Baden-Württemberg",
      "amtsgericht": "Amtsgericht Mannheim",
      "registernummer": "HRA 713028",
      "registerart": "HRA",
      "company_name": "SÖM Kanzlei für Steuern - Ökonomie - Mediation Steuerberatungsgesellschaft mbH & Co. KG",
      "company_seat": "Mannheim",
      "details": "29.01.2026 (Bekanntmachungsdatum)\n\nBaden-Württemberg Amtsgericht Mannheim HRA 713028\nRegisterbekanntmachung nach dem Umwandlungsgesetz 29.01.2026 (Eintragungsdatum)\n\nSÖM Kanzlei für Steuern - Ökonomie - Mediation Steuerberatungsgesellschaft mbH & Co. KG\nKommanditgesellschaft\nMannheim\n\nAls nicht eingetragen wird bekanntgemacht: Den Gläubigern des an dem Formwechsel beteiligten Rechtsträgers ist, wenn sie binnen sechs Monaten nach dem Tag, an dem die Eintragung des Formwechsels in das Register des Sitzes desjenigen Rechtsträgers, dessen Gläubiger sie sind, nach § 19 Abs. 3 UmwG als bekanntgemacht gilt, ihren Anspruch nach Grund und Höhe schriftlich anmelden, Sicherheit zu leisten, soweit sie nicht Befriedigung verlangen können. Dieses Recht steht den Gläubigern jedoch nur zu, wenn sie glaubhaft machen, dass durch den Formwechsel die Erfüllung ihrer Forderung gefährdet wird."
    },
    {
      "date": "2026-01-29",
      "id": "143784",
      "original_text": "Registerbekanntmachung nach dem Umwandlungsgesetz\nBaden-Württemberg Amtsgericht Mannheim HRB 753298\nSchneider PSI Tank- und Industrieservice GmbH – Hambrücken",
      "type": "Registerbekanntmachung nach dem Umwandlungsgesetz",
      "state": "Baden-Württemberg",
      "amtsgericht": "Amtsgericht Mannheim",
      "registernummer": "HRB 753298",
      "registerart": "HRB",
      "company_name": "Schneider PSI Tank- und Industrieservice GmbH",
      "company_seat": "Hambrücken",
      "details": "29.01.2026 (Bekanntmachungsdatum)\n\nBaden-Württemberg Amtsgericht Mannheim HRB 753298\nRegisterbekanntmachung nach dem Umwandlungsgesetz 29.01.2026 (Eintragungsdatum)\n\nSchneider PSI Tank- und Industrieservice GmbH\nGesellschaft mit beschränkter Haftung\nHambrücken\n\nDen Gläubigern der an der Verschmelzung beteiligten Rechtsträger ist, wenn sie binnen sechs Monaten nach dem Tag, an dem die Eintragung der Verschmelzung in das Register des Sitzes desjenigen Rechtsträgers, dessen Gläubiger sie sind, nach § 19 Abs. 3 UmwG als bekanntgemacht gilt, ihren Anspruch nach Grund und Höhe schriftlich anmelden, Sicherheit zu leisten, soweit sie nicht Befriedigung verlangen können. Dieses Recht steht den Gläubigern jedoch nur zu, wenn sie glaubhaft machen, dass durch die Verschmelzung die Erfüllung ihrer Forderung gefährdet wird."
    },
    {
      "date": "2026-01-29",
      "id": "143785",
      "original_text": "Registerbekanntmachung nach dem Umwandlungsgesetz\nBaden-Württemberg Amtsgericht Mannheim GsR 1188\nSchneider Industrieservice eGbR – Hambrücken",
      "type": "Registerbekanntmachung nach dem Umwandlungsgesetz",
      "state": "Baden-Württemberg",
      "amtsgericht": "Amtsgericht Mannheim",
      "registernummer": "GsR 1188",
      "registerart": "GsR",
      "company_name": "Schneider Industrieservice eGbR",
      "company_seat": "Hambrücken",
      "details": "29.01.2026 (Bekanntmachungsdatum)\n\nBaden-Württemberg Amtsgericht Mannheim GsR 1188\nRegisterbekanntmachung nach dem Umwandlungsgesetz 29.01.2026 (Eintragungsdatum)\n\nSchneider Industrieservice eGbR\nGesellschaft bürgerlichen Rechts\nHambrücken\n\nDen Gläubigern der an der Verschmelzung beteiligten Rechtsträger ist, wenn sie binnen sechs Monaten nach dem Tag, an dem die Eintragung der Verschmelzung in das Register des Sitzes desjenigen Rechtsträgers, dessen Gläubiger sie sind, nach § 19 Abs. 3 UmwG als bekanntgemacht gilt, ihren Anspruch nach Grund und Höhe schriftlich anmelden, Sicherheit zu leisten, soweit sie nicht Befriedigung verlangen können. Dieses Recht steht den Gläubigern jedoch nur zu, wenn sie glaubhaft machen, dass durch die Verschmelzung die Erfüllung ihrer Forderung gefährdet wird."
    },
    {
      "date": "2026-01-29",
      "id": "143786",
      "original_text": "Registerbekanntmachung nach dem Umwandlungsgesetz\nBaden-Württemberg Amtsgericht Mannheim HRB 712568\nSÖM Kanzlei für Steuern - Ökonomie - Mediation Steuerberatungsgesellschaft mbH – Mannheim",
      "type": "Registerbekanntmachung nach dem Umwandlungsgesetz",
      "state": "Baden-Württemberg",
      "amtsgericht": "Amtsgericht Mannheim",
      "registernummer": "HRB 712568",
      "registerart": "HRB",
      "company_name": "SÖM Kanzlei für Steuern - Ökonomie - Mediation Steuerberatungsgesellschaft mbH",
      "company_seat": "Mannheim",
      "details": "29.01.2026 (Bekanntmachungsdatum)\n\nBaden-Württemberg Amtsgericht Mannheim HRB 712568\nRegisterbekanntmachung nach dem Umwandlungsgesetz 29.01.2026 (Eintragungsdatum)\n\nSÖM Kanzlei für Steuern - Ökonomie - Mediation Steuerberatungsgesellschaft mbH\nGesellschaft mit beschränkter Haftung\nMannheim\n\nAls nicht eingetragen wird bekanntgemacht: Den Gläubigern des an dem Formwechsel beteiligten Rechtsträgers ist, wenn sie binnen sechs Monaten nach dem Tag, an dem die Eintragung des Formwechsels in das Register des Sitzes desjenigen Rechtsträgers, dessen Gläubiger sie sind, nach § 19 Abs. 3 UmwG als bekanntgemacht gilt, ihren Anspruch nach Grund und Höhe schriftlich anmelden, Sicherheit zu leisten, soweit sie nicht Befriedigung verlangen können. Dieses Recht steht den Gläubigern jedoch nur zu, wenn sie glaubhaft machen, dass durch den Formwechsel die Erfüllung ihrer Forderung gefährdet wird."
    },
    {
      "date": "2026-01-29",
      "id": "143787",
      "original_text": "Löschungsankündigung\nBaden-Württemberg Amtsgericht Mannheim HRB 731368\nCwM-Management UG (haftungsbeschränkt) – Sinzheim",
      "type": "Löschungsankündigung",
      "state": "Baden-Württemberg",
      "amtsgericht": "Amtsgericht Mannheim",
      "registernummer": "HRB 731368",
      "registerart": "HRB",
      "company_name": "CwM-Management UG (haftungsbeschränkt)",
      "company_seat": "Sinzheim",
      "details": "29.01.2026 (Bekanntmachungsdatum)\n\nBaden-Württemberg Amtsgericht Mannheim HRB 731368\nLöschungsankündigung\n\nCwM-Management UG (haftungsbeschränkt)\nGesellschaft mit beschränkter Haftung\nSinzheim\n\nAls nicht eingetragen wird bekanntgemacht: Das Gericht beabsichtigt, die Gesellschaft wegen Vermögenslosigkeit im Handelsregister von Amts wegen nach § 394 FamFG zu löschen. Die Frist zur Geltendmachung eines Widerspruchs gegen die beabsichtigte Löschung ist auf einen Monat ab Veröffentlichung bestimmt."
    },
    {
      "date": "2026-01-29",
      "id": "143788",
      "original_text": "Löschungsankündigung\nBerlin Amtsgericht Berlin (Charlottenburg) HRB 131233\nHKI Immobilien GmbH – Berlin",
      "type": "Löschungsankündigung",
      "state": "Berlin",
      "amtsgericht": "Amtsgericht Berlin (Charlottenburg)",
      "registernummer": "HRB 131233",
      "registerart": "HRB",
      "company_name": "HKI Immobilien GmbH",
      "company_seat": "Berlin",
      "details": "29.01.2026 (Bekanntmachungsdatum)\n\nBerlin Amtsgericht Berlin (Charlottenburg) HRB 131233\nLöschungsankündigung\n\nHKI Immobilien GmbH\nGesellschaft mit beschränkter Haftung\nBerlin\n\nBei der nachstehenden Gesellschaft wird das Amtslöschungsverfahren gemäß § 394 FamFG eingeleitet. Widerspruchsfrist 6 Wochen"
    },
    {
      "date": "2026-01-29",
      "id": "143789",
      "original_text": "Registerbekanntmachung nach dem Umwandlungsgesetz\nBerlin Amtsgericht Berlin (Charlottenburg) HRB 121481\nBorgfelder-Str. Hamburg Hotel GmbH – Berlin",
      "type": "Registerbekanntmachung nach dem Umwandlungsgesetz",
      "state": "Berlin",
      "amtsgericht": "Amtsgericht Berlin (Charlottenburg)",
      "registernummer": "HRB 121481",
      "registerart": "HRB",
      "company_name": "Borgfelder-Str. Hamburg Hotel GmbH",
      "company_seat": "Berlin",
      "details": "29.01.2026 (Bekanntmachungsdatum)\n\nBerlin Amtsgericht Berlin (Charlottenburg) HRB 121481\nRegisterbekanntmachung nach dem Umwandlungsgesetz 27.01.2026 (Eintragungsdatum)\n\nBorgfelder-Str. Hamburg Hotel GmbH\nGesellschaft mit beschränkter Haftung\nBerlin\n\nZu Eintragungsnummer 9 vom 27.01.2026 wird als nicht eingetragen veröffentlicht: Den Gläubigern der an der Verschmelzung beteiligten Rechtsträger ist, wenn sie binnen sechs Monaten nach dem Tag, an dem die Eintragung der Verschmelzung in das Register des Sitzes desjenigen Rechtsträgers, dessen Gläubiger sie sind, als bekannt gemacht gilt, ihren Anspruch nach Grund und Höhe schriftlich anmelden, Sicherheit zu leisten, soweit sie nicht Befriedigung verlangen können. Dieses Recht steht den Gläubigern jedoch nur zu, wenn sie glaubhaft machen, dass durch die Verschmelzung die Erfüllung ihrer Forderung gefährdet wird. Das Recht, Sicherheitsleistung zu verlangen, steht Gläubigern nicht zu, die im Falle der Insolvenz ein Recht auf vorzugsweise Befriedigung aus einer Deckungsmasse haben, die nach gesetzlicher Vorschrift zu ihrem Schutz errichtet und staatlich überwacht ist."
    },
    {
      "date": "2026-01-29",
      "id": "143790",
      "original_text": "Registerbekanntmachung nach dem Umwandlungsgesetz\nHamburg Amtsgericht Hamburg HRB 56871\nLeneweit Gebäude & IndustrieService GmbH – Hamburg",
      "type": "Registerbekanntmachung nach dem Umwandlungsgesetz",
      "state": "Hamburg",
      "amtsgericht": "Amtsgericht Hamburg",
      "registernummer": "HRB 56871",
      "registerart": "HRB",
      "company_name": "Leneweit Gebäude & IndustrieService GmbH",
      "company_seat": "Hamburg",
      "details": "29.01.2026 (Bekanntmachungsdatum)\n\nHamburg Amtsgericht Hamburg HRB 56871\nRegisterbekanntmachung nach dem Umwandlungsgesetz 29.01.2026 (Eintragungsdatum)\n\nLeneweit Gebäude & IndustrieService GmbH\nGesellschaft mit beschränkter Haftung\nHamburg\n\nAls nicht eingetragen wird bekannt gemacht:\nDen Gläubigern der an der Verschmelzung beteiligten Gesellschaften ist, wenn sie binnen sechs Monaten nach dem Tag, an dem die Eintragung der Verschmelzung in das Register des Sitzes desjenigen Rechtsträgers, dessen Gläubiger sie sind, nach § 19 Absatz 3 UmwG als bekannt gemacht gilt, ihren Anspruch nach Grund und Höhe schriftlich anmelden, Sicherheit zu leisten, soweit sie nicht Befriedigung verlangen können. Dieses Recht steht den Gläubigern jedoch nur zu, wenn sie glaubhaft machen, dass durch die Verschmelzung die Erfüllung ihrer Forderung gefährdet wird."
    },
    {
      "date": "2026-01-29",
      "id": "143791",
      "original_text": "Registerbekanntmachung nach dem Umwandlungsgesetz\nHamburg Amtsgericht Hamburg HRB 67753\nLeneweit Services GmbH – Hamburg",
      "type": "Registerbekanntmachung nach dem Umwandlungsgesetz",
      "state": "Hamburg",
      "amtsgericht": "Amtsgericht Hamburg",
      "registernummer": "HRB 67753",
      "registerart": "HRB",
      "company_name": "Leneweit Services GmbH",
      "company_seat": "Hamburg",
      "details": "29.01.2026 (Bekanntmachungsdatum)\n\nHamburg Amtsgericht Hamburg HRB 67753\nRegisterbekanntmachung nach dem Umwandlungsgesetz 29.01.2026 (Eintragungsdatum)\n\nLeneweit Services GmbH\nGesellschaft mit beschränkter Haftung\nHamburg\n\nAls nicht eingetragen wird bekannt gemacht:\nDen Gläubigern der an der Verschmelzung beteiligten Gesellschaften ist, wenn sie binnen sechs Monaten nach dem Tag, an dem die Eintragung der Verschmelzung in das Register des Sitzes desjenigen Rechtsträgers, dessen Gläubiger sie sind, nach § 19 Absatz 3 UmwG als bekannt gemacht gilt, ihren Anspruch nach Grund und Höhe schriftlich anmelden, Sicherheit zu leisten, soweit sie nicht Befriedigung verlangen können. Dieses Recht steht den Gläubigern jedoch nur zu, wenn sie glaubhaft machen, dass durch die Verschmelzung die Erfüllung ihrer Forderung gefährdet wird."
    },
    {
      "date": "2026-01-29",
      "id": "143792",
      "original_text": "Löschungsankündigung\nBaden-Württemberg Amtsgericht Stuttgart HRB 739608\nHotelverwaltungsgesellschaft Bad Herrenalb Alte Dobler Straße mbH – Bad Herrenalb",
      "type": "Löschungsankündigung",
      "state": "Baden-Württemberg",
      "amtsgericht": "Amtsgericht Stuttgart",
      "registernummer": "HRB 739608",
      "registerart": "HRB",
      "company_name": "Hotelverwaltungsgesellschaft Bad Herrenalb Alte Dobler Straße mbH",
      "company_seat": "Bad Herrenalb",
      "details": "29.01.2026 (Bekanntmachungsdatum)\n\nBaden-Württemberg Amtsgericht Stuttgart HRB 739608\nLöschungsankündigung\n\nHotelverwaltungsgesellschaft Bad Herrenalb Alte Dobler Straße mbH\nGesellschaft mit beschränkter Haftung\nBad Herrenalb\n\nDas Gericht beabsichtigt, die Gesellschaft wegen Vermögenslosigkeit im Handelsregister von Amts wegen nach § 394 FamFG zu löschen. Die Frist zur Geltendmachung eines Widerspruchs gegen die beabsichtigte Löschung ist auf zwei Monate ab Veröffentlichung bestimmt."
    },
    {
      "date": "2026-01-29",
      "id": "143793",
      "original_text": "Löschungsankündigung\nBerlin Amtsgericht Berlin (Charlottenburg) HRB 250387\nT.S.T. GmbH Berlin – Berlin",
      "type": "Löschungsankündigung",
      "state": "Berlin",
      "amtsgericht": "Amtsgericht Berlin (Charlottenburg)",
      "registernummer": "HRB 250387",
      "registerart": "HRB",
      "company_name": "T.S.T. GmbH Berlin",
      "company_seat": "Berlin",
      "details": "29.01.2026 (Bekanntmachungsdatum)\n\nBerlin Amtsgericht Berlin (Charlottenburg) HRB 250387\nLöschungsankündigung\n\nT.S.T. GmbH Berlin\nGesellschaft mit beschränkter Haftung\nBerlin\n\nBei der nachstehenden Gesellschaft wird das Amtslöschungsverfahren gemäß § 394 FamFG eingeleitet. Widerspruchsfrist 6 Wochen"
    },
    {
      "date": "2026-01-29",
      "id": "143794",
      "original_text": "Löschungsankündigung\nSchleswig-Holstein Amtsgericht Lübeck HRB 21365\nmoinsystems GmbH – Lübeck",
      "type": "Löschungsankündigung",
      "state": "Schleswig-Holstein",
      "amtsgericht": "Amtsgericht Lübeck",
      "registernummer": "HRB 21365",
      "registerart": "HRB",
      "company_name": "moinsystems GmbH",
      "company_seat": "Lübeck",
      "details": "29.01.2026 (Bekanntmachungsdatum)\n\nSchleswig-Holstein Amtsgericht Lübeck HRB 21365\nLöschungsankündigung\n\nmoinsystems GmbH\nGesellschaft mit beschränkter Haftung\nLübeck\n\nEs ist die Löschung der nachstehenden Gesellschaft wegen Vermögenslosigkeit gemäß § 394 FamFG beabsichtigt. Widerspruchsfrist: 1 Monat."
    },
    {
      "date": "2026-01-29",
      "id": "143795",
      "original_text": "Löschungsankündigung\nSaarland Amtsgericht Saarbrücken HRB 15530\nFriseur Pur GmbH – Saarbrücken",
      "type": "Löschungsankündigung",
      "state": "Saarland",
      "amtsgericht": "Amtsgericht Saarbrücken",
      "registernummer": "HRB 15530",
      "registerart": "HRB",
      "company_name": "Friseur Pur GmbH",
      "company_seat": "Saarbrücken",
      "details": "29.01.2026 (Bekanntmachungsdatum)\n\nSaarland Amtsgericht Saarbrücken HRB 15530\nLöschungsankündigung 29.01.2026 (Eintragungsdatum)\n\nFriseur Pur GmbH\nGesellschaft mit beschränkter Haftung\nSaarbrücken\n\nEs ist beabsichtigt, die Gesellschaft von Amts wegen gemäß § 394 FamFG wegen Vermögenslosigkeit zu löschen.\nGegen die Löschung von Amts wegen ist das Rechtsmittel des Widerspruchs statthaft. Der Widerspruch ist binnen einer Frist von zwei Monaten beginnend mit dem Tag dieser Veröffentlichung durch Einreichen eines Widerspruchsschreibens -schriftlich oder zur Niederschrift der Geschäftsstelle beim Amtsgericht Saarbrücken, -zentrales Handelsregister-, Mainzerstr.178, 66121 Saarbrücken einzulegen.\nDer Widerspruch muss die Bezeichnung der angefochtenen Löschungsankündigung enthalten sowie die Erklärung, dass Widerspruch eingelegt wird. Er ist vom Widerspruchsführer oder seinem Bevollmächtigten zu unterzeichnen.\nDas Widerspruchsschreiben kann auch in der Form eines elektronischen Dokumentes eingereicht werden, das mit einer qualifizierten elektronischen Signatur nach dem Signaturgesetz versehen sein muss (§§ 14 Abs. 2 FamFG, 130a, 298 ZPO)."
    },
    {
      "date": "2026-01-29",
      "id": "143796",
      "original_text": "Registerbekanntmachung nach dem Umwandlungsgesetz\nBerlin Amtsgericht Berlin (Charlottenburg) HRB 213493\nDI FRA1 GmbH – Berlin",
      "type": "Registerbekanntmachung nach dem Umwandlungsgesetz",
      "state": "Berlin",
      "amtsgericht": "Amtsgericht Berlin (Charlottenburg)",
      "registernummer": "HRB 213493",
      "registerart": "HRB",
      "company_name": "DI FRA1 GmbH",
      "company_seat": "Berlin",
      "details": "29.01.2026 (Bekanntmachungsdatum)\n\nBerlin Amtsgericht Berlin (Charlottenburg) HRB 213493\nRegisterbekanntmachung nach dem Umwandlungsgesetz 27.01.2026 (Eintragungsdatum)\n\nDI FRA1 GmbH\nGesellschaft mit beschränkter Haftung\nBerlin\n\nZu Eintragungsnummer 8 vom 27.01.2026 wird als nicht eingetragen veröffentlicht: Den Gläubigern der an der Verschmelzung beteiligten Rechtsträger ist, wenn sie binnen sechs Monaten nach dem Tag, an dem die Eintragung der Verschmelzung in das Register des Sitzes desjenigen Rechtsträgers, dessen Gläubiger sie sind, als bekannt gemacht gilt, ihren Anspruch nach Grund und Höhe schriftlich anmelden, Sicherheit zu leisten, soweit sie nicht Befriedigung verlangen können. Dieses Recht steht den Gläubigern jedoch nur zu, wenn sie glaubhaft machen, dass durch die Verschmelzung die Erfüllung ihrer Forderung gefährdet wird. Das Recht, Sicherheitsleistung zu verlangen, steht Gläubigern nicht zu, die im Falle der Insolvenz ein Recht auf vorzugsweise Befriedigung aus einer Deckungsmasse haben, die nach gesetzlicher Vorschrift zu ihrem Schutz errichtet und staatlich überwacht ist."
    },
    {
      "date": "2026-01-29",
      "id": "143797",
      "original_text": "Löschungsankündigung\nBaden-Württemberg Amtsgericht Mannheim HRB 745663\nMJCM GmbH – Linkenheim-Hochstetten",
      "type": "Löschungsankündigung",
      "state": "Baden-Württemberg",
      "amtsgericht": "Amtsgericht Mannheim",
      "registernummer": "HRB 745663",
      "registerart": "HRB",
      "company_name": "MJCM GmbH",
      "company_seat": "Linkenheim-Hochstetten",
      "details": "29.01.2026 (Bekanntmachungsdatum)\n\nBaden-Württemberg Amtsgericht Mannheim HRB 745663\nLöschungsankündigung\n\nMJCM GmbH\nGesellschaft mit beschränkter Haftung\nLinkenheim-Hochstetten\n\nAls nicht eingetragen wird bekanntgemacht:\nDas Gericht beabsichtigt, die Gesellschaft wegen Vermögenslosigkeit im Handelsregister von Amts wegen nach § 394 FamFG zu löschen. Die Frist zur Geltendmachung eines Widerspruchs gegen die beabsichtigte Löschung ist auf einen Monat ab Veröffentlichung bestimmt."
    },
    {
      "date": "2026-01-29",
      "id": "143798",
      "original_text": "Sonstige Registerbekanntmachung\nBaden-Württemberg Amtsgericht Freiburg HRB 371591\nKRONEN GmbH – Kehl",
      "type": "Sonstige Registerbekanntmachung",
      "state": "Baden-Württemberg",
      "amtsgericht": "Amtsgericht Freiburg",
      "registernummer": "HRB 371591",
      "registerart": "HRB",
      "company_name": "KRONEN GmbH",
      "company_seat": "Kehl",
      "details": "29.01.2026 (Bekanntmachungsdatum)\n\nBaden-Württemberg Amtsgericht Freiburg HRB 371591\nSonstige Registerbekanntmachung 29.01.2026 (Eintragungsdatum)\n\nKRONEN GmbH\nGesellschaft mit beschränkter Haftung\nKehl\n\nAls nicht eingetragen wird bekanntgemacht:\nDen Gläubigern der Gesellschaft, deren Forderungen begründet worden sind, bevor die Eintragung der Beendigung des Vertrages in das Handelsregister nach § 10 HGB als bekanntgemacht gilt, ist vom anderen Vertragsteil Sicherheit zu leisten, wenn sie sich binnen sechs Monaten nach der Bekanntmachung zu diesem Zweck bei ihm melden."
    },
    {
      "date": "2026-01-29",
      "id": "143799",
      "original_text": "Löschungsankündigung\nBerlin Amtsgericht Berlin (Charlottenburg) HRB 230340\nNahdri GmbH – Berlin",
      "type": "Löschungsankündigung",
      "state": "Berlin",
      "amtsgericht": "Amtsgericht Berlin (Charlottenburg)",
      "registernummer": "HRB 230340",
      "registerart": "HRB",
      "company_name": "Nahdri GmbH",
      "company_seat": "Berlin",
      "details": "29.01.2026 (Bekanntmachungsdatum)\n\nBerlin Amtsgericht Berlin (Charlottenburg) HRB 230340\nLöschungsankündigung\n\nNahdri GmbH\nGesellschaft mit beschränkter Haftung\nBerlin\n\nBei der nachstehenden Gesellschaft wird das Amtslöschungsverfahren gemäß § 394 FamFG eingeleitet. Widerspruchsfrist 6 Wochen"
    },
    {
      "date": "2026-01-29",
      "id": "143800",
      "original_text": "Löschungsankündigung\nSaarland Amtsgericht Saarbrücken HRB 107778\nB Entertainment UG (haftungsbeschränkt) – Saarbrücken",
      "type": "Löschungsankündigung",
      "state": "Saarland",
      "amtsgericht": "Amtsgericht Saarbrücken",
      "registernummer": "HRB 107778",
      "registerart": "HRB",
      "company_name": "B Entertainment UG (haftungsbeschränkt)",
      "company_seat": "Saarbrücken",
      "details": "29.01.2026 (Bekanntmachungsdatum)\n\nSaarland Amtsgericht Saarbrücken HRB 107778\nLöschungsankündigung 26.01.2026 (Eintragungsdatum)\n\nB Entertainment UG (haftungsbeschränkt)\nGesellschaft mit beschränkter Haftung\nSaarbrücken\n\nEs ist beabsichtigt, die Gesellschaft von Amts wegen gemäß § 394 FamFG wegen Vermögenslosigkeit zu löschen.\nGegen die Löschung von Amts wegen ist das Rechtsmittel des Widerspruchs statthaft. Der Widerspruch ist binnen einer Frist zwei Monaten beginnend mit dem Tag dieser Veröffentlichung durch Einreichen eines Widerspruchsschreibens -schriftlich oder zur Niederschrift der Geschäftsstelle beim Amtsgericht Saarbrücken, -zentrales Handelsregister-, Mainzerstr.178, 66121 Saarbrücken einzulegen.\nDer Widerspruch muss die Bezeichnung der angefochtenen Löschungsankündigung enthalten sowie die Erklärung, dass Widerspruch eingelegt wird. Er ist vom Widerspruchsführer oder seinem Bevollmächtigten zu unterzeichnen.\nDas Widerspruchsschreiben kann auch in der Form eines elektronischen Dokumentes eingereicht werden, das mit einer qualifizierten elektronischen Signatur nach dem Signaturgesetz versehen sein muss (§§ 14 Abs. 2 FamFG, 130a, 298 ZPO)."
    },
    {
      "date": "2026-01-29",
      "id": "143801",
      "original_text": "Löschungsankündigung\nBerlin Amtsgericht Berlin (Charlottenburg) HRA 42104\nReMass GmbH & Co. KG – Berlin",
      "type": "Löschungsankündigung",
      "state": "Berlin",
      "amtsgericht": "Amtsgericht Berlin (Charlottenburg)",
      "registernummer": "HRA 42104",
      "registerart": "HRA",
      "company_name": "ReMass GmbH & Co. KG",
      "company_seat": "Berlin",
      "details": "29.01.2026 (Bekanntmachungsdatum)\n\nBerlin Amtsgericht Berlin (Charlottenburg) HRA 42104\nLöschungsankündigung\n\nReMass GmbH & Co. KG\nKommanditgesellschaft\nBerlin\n\nBei dem nachstehenden Unternehmen / der nachstehenden Gesellschaft wird das Amtslöschungsverfahren gemäß § 31 Abs. 2 HGB eingeleitet. Widerspruchsfrist 1 Monat"
    },
    {
      "date": "2026-01-29",
      "id": "143802",
      "original_text": "Löschungsankündigung\nBerlin Amtsgericht Berlin (Charlottenburg) HRB 222892\nB2 CAPITAL GmbH – Berlin",
      "type": "Löschungsankündigung",
      "state": "Berlin",
      "amtsgericht": "Amtsgericht Berlin (Charlottenburg)",
      "registernummer": "HRB 222892",
      "registerart": "HRB",
      "company_name": "B2 CAPITAL GmbH",
      "company_seat": "Berlin",
      "details": "29.01.2026 (Bekanntmachungsdatum)\n\nBerlin Amtsgericht Berlin (Charlottenburg) HRB 222892\nLöschungsankündigung\n\nB2 CAPITAL GmbH\nGesellschaft mit beschränkter Haftung\nBerlin\n\nBei der nachstehenden Gesellschaft wird das Amtslöschungsverfahren gemäß § 394 FamFG eingeleitet. Widerspruchsfrist 6 Wochen"
    },
    {
      "date": "2026-01-29",
      "id": "143803",
      "original_text": "Löschungsankündigung\nBerlin Amtsgericht Berlin (Charlottenburg) HRB 253458\nPaka Bauservice GmbH – Berlin",
      "type": "Löschungsankündigung",
      "state": "Berlin",
      "amtsgericht": "Amtsgericht Berlin (Charlottenburg)",
      "registernummer": "HRB 253458",
      "registerart": "HRB",
      "company_name": "Paka Bauservice GmbH",
      "company_seat": "Berlin",
      "details": "29.01.2026 (Bekanntmachungsdatum)\n\nBerlin Amtsgericht Berlin (Charlottenburg) HRB 253458\nLöschungsankündigung\n\nPaka Bauservice GmbH\nGesellschaft mit beschränkter Haftung\nBerlin\n\nBei der nachstehenden Gesellschaft wird das Amtslöschungsverfahren gemäß § 394 FamFG eingeleitet. Widerspruchsfrist 6 Wochen"
    },
    {
      "date": "2026-01-29",
      "id": "143804",
      "original_text": "Löschungsankündigung\nBerlin Amtsgericht Berlin (Charlottenburg) HRB 167186\nCafébetriebsgesellschaft Tietz & Cie. UG (haftungsbeschränkt) – Berlin",
      "type": "Löschungsankündigung",
      "state": "Berlin",
      "amtsgericht": "Amtsgericht Berlin (Charlottenburg)",
      "registernummer": "HRB 167186",
      "registerart": "HRB",
      "company_name": "Cafébetriebsgesellschaft Tietz & Cie. UG (haftungsbeschränkt)",
      "company_seat": "Berlin",
      "details": "29.01.2026 (Bekanntmachungsdatum)\n\nBerlin Amtsgericht Berlin (Charlottenburg) HRB 167186\nLöschungsankündigung\n\nCafébetriebsgesellschaft Tietz & Cie. UG (haftungsbeschränkt)\nGesellschaft mit beschränkter Haftung\nBerlin\n\nBei der nachstehenden Gesellschaft wird das Amtslöschungsverfahren gemäß § 394 FamFG eingeleitet. Widerspruchsfrist 6 Wochen"
    },
    {
      "date": "2026-01-29",
      "id": "143805",
      "original_text": "Einreichung neuer Dokumente\nHamburg Amtsgericht Hamburg HRB 68920\nDaniels, Gritzka, Kraft & Co. Vermögensverwaltung AG – Hamburg",
      "type": "Einreichung neuer Dokumente",
      "state": "Hamburg",
      "amtsgericht": "Amtsgericht Hamburg",
      "registernummer": "HRB 68920",
      "registerart": "HRB",
      "company_name": "Daniels, Gritzka, Kraft & Co. Vermögensverwaltung AG",
      "company_seat": "Hamburg",
      "details": "29.01.2026 (Bekanntmachungsdatum)\n\nHamburg Amtsgericht Hamburg HRB 68920\nEinreichung neuer Dokumente 29.01.2026 (Eintragungsdatum)\n\nDaniels, Gritzka, Kraft & Co. Vermögensverwaltung AG\nAktiengesellschaft\nHamburg\n\nAls nicht eingetragen wird bekannt gemacht: Liste des Aufsichtsrats wurde eingereicht."
    },
    {
      "date": "2026-01-29",
      "id": "143806",
      "original_text": "Löschungsankündigung\nBrandenburg Amtsgericht Neuruppin HRB 9442\nBildungszentrum Herrenhaus Putlitz AG – Putlitz",
      "type": "Löschungsankündigung",
      "state": "Brandenburg",
      "amtsgericht": "Amtsgericht Neuruppin",
      "registernummer": "HRB 9442",
      "registerart": "HRB",
      "company_name": "Bildungszentrum Herrenhaus Putlitz AG",
      "company_seat": "Putlitz",
      "details": "29.01.2026 (Bekanntmachungsdatum)\n\nBrandenburg Amtsgericht Neuruppin HRB 9442\nLöschungsankündigung\n\nBildungszentrum Herrenhaus Putlitz AG\nAktiengesellschaft\nPutlitz\n\nBei der nachstehenden Gesellschaft wird das Amtslöschungsverfahren gemäß § 394 FamFG eingeleitet.\n\nWiderspruchsfrist: 1 Monat."
    },
    {
      "date": "2026-01-29",
      "id": "143807",
      "original_text": "Löschungsankündigung\nBerlin Amtsgericht Berlin (Charlottenburg) HRB 129064\nDigiluX AG – Berlin",
      "type": "Löschungsankündigung",
      "state": "Berlin",
      "amtsgericht": "Amtsgericht Berlin (Charlottenburg)",
      "registernummer": "HRB 129064",
      "registerart": "HRB",
      "company_name": "DigiluX AG",
      "company_seat": "Berlin",
      "details": "29.01.2026 (Bekanntmachungsdatum)\n\nBerlin Amtsgericht Berlin (Charlottenburg) HRB 129064\nLöschungsankündigung\n\nDigiluX AG\nAktiengesellschaft\nBerlin\n\nBei der nachstehenden Gesellschaft wird das Amtslöschungsverfahren gemäß § 394 FamFG eingeleitet. Widerspruchsfrist 6 Wochen"
    },
    {
      "date": "2026-01-29",
      "id": "143808",
      "original_text": "Einreichung neuer Dokumente\nBerlin Amtsgericht Berlin (Charlottenburg) HRB 185593\nPPV AG – Berlin",
      "type": "Einreichung neuer Dokumente",
      "state": "Berlin",
      "amtsgericht": "Amtsgericht Berlin (Charlottenburg)",
      "registernummer": "HRB 185593",
      "registerart": "HRB",
      "company_name": "PPV AG",
      "company_seat": "Berlin",
      "details": "29.01.2026 (Bekanntmachungsdatum)\n\nBerlin Amtsgericht Berlin (Charlottenburg) HRB 185593\nEinreichung neuer Dokumente\n\nPPV AG\nAktiengesellschaft\nBerlin\n\nAls nicht eingetragen wird veröffentlicht: Es wurde eine neue Liste der Aufsichtsratsmitglieder eingereicht (§ 106 AktG)."
    },
    {
      "date": "2026-01-29",
      "id": "143809",
      "original_text": "Löschungsankündigung\nBerlin Amtsgericht Berlin (Charlottenburg) HRB 257919\nNoun Elfte Asset UG (haftungsbeschränkt) – Berlin",
      "type": "Löschungsankündigung",
      "state": "Berlin",
      "amtsgericht": "Amtsgericht Berlin (Charlottenburg)",
      "registernummer": "HRB 257919",
      "registerart": "HRB",
      "company_name": "Noun Elfte Asset UG (haftungsbeschränkt)",
      "company_seat": "Berlin",
      "details": "29.01.2026 (Bekanntmachungsdatum)\n\nBerlin Amtsgericht Berlin (Charlottenburg) HRB 257919\nLöschungsankündigung\n\nNoun Elfte Asset UG (haftungsbeschränkt)\nGesellschaft mit beschränkter Haftung\nBerlin\n\nBei der nachstehenden Gesellschaft wird das Amtslöschungsverfahren gemäß § 394 FamFG eingeleitet. Widerspruchsfrist 6 Wochen"
    },
    {
      "date": "2026-01-29",
      "id": "143810",
      "original_text": "Einreichung neuer Dokumente\nBrandenburg Amtsgericht Cottbus HRB 4022\nGubener Sozialwerke gGmbH – Guben",
      "type": "Einreichung neuer Dokumente",
      "state": "Brandenburg",
      "amtsgericht": "Amtsgericht Cottbus",
      "registernummer": "HRB 4022",
      "registerart": "HRB",
      "company_name": "Gubener Sozialwerke gGmbH",
      "company_seat": "Guben",
      "details": "29.01.2026 (Bekanntmachungsdatum)\n\nBrandenburg Amtsgericht Cottbus HRB 4022\nEinreichung neuer Dokumente\n\nGubener Sozialwerke gGmbH\nGesellschaft mit beschränkter Haftung\nGuben\n\nAls nicht eingetragen wird veröffentlicht:\nDie aktuelle Liste der Aufsichtsratsmitglieder wurde zum Handelsregister gem. § 52 Abs. 3 GmbHG eingereicht."
    },
    {
      "date": "2026-01-29",
      "id": "143811",
      "original_text": "Einreichung neuer Dokumente\nBrandenburg Amtsgericht Cottbus HRB 3595\nIngenieurgesellschaft für Bauwesen und Grundstücksverwaltung Bad Liebenwerda mbH – Bad Liebenwerda",
      "type": "Einreichung neuer Dokumente",
      "state": "Brandenburg",
      "amtsgericht": "Amtsgericht Cottbus",
      "registernummer": "HRB 3595",
      "registerart": "HRB",
      "company_name": "Ingenieurgesellschaft für Bauwesen und Grundstücksverwaltung Bad Liebenwerda mbH",
      "company_seat": "Bad Liebenwerda",
      "details": "29.01.2026 (Bekanntmachungsdatum)\n\nBrandenburg Amtsgericht Cottbus HRB 3595\nEinreichung neuer Dokumente\n\nIngenieurgesellschaft für Bauwesen und Grundstücksverwaltung Bad Liebenwerda mbH\nGesellschaft mit beschränkter Haftung\nBad Liebenwerda\n\nAls nicht eingetragen wird veröffentlicht:\nDie aktuelle Liste der Aufsichtsratsmitglieder wurde zum Handelsregister gem. § 52 Abs. 3 GmbHG eingereicht."
    },
    {
      "date": "2026-01-29",
      "id": "143812",
      "original_text": "Löschungsankündigung\nBerlin Amtsgericht Berlin (Charlottenburg) HRB 212886\nKaffee Karamell Voigtstr. GmbH – Berlin",
      "type": "Löschungsankündigung",
      "state": "Berlin",
      "amtsgericht": "Amtsgericht Berlin (Charlottenburg)",
      "registernummer": "HRB 212886",
      "registerart": "HRB",
      "company_name": "Kaffee Karamell Voigtstr. GmbH",
      "company_seat": "Berlin",
      "details": "29.01.2026 (Bekanntmachungsdatum)\n\nBerlin Amtsgericht Berlin (Charlottenburg) HRB 212886\nLöschungsankündigung\n\nKaffee Karamell Voigtstr. GmbH\nGesellschaft mit beschränkter Haftung\nBerlin\n\nBei der nachstehenden Gesellschaft wird das Amtslöschungsverfahren gemäß § 394 FamFG eingeleitet. Widerspruchsfrist 6 Wochen"
    },
    {
      "date": "2026-01-29",
      "id": "143813",
      "original_text": "Löschungsankündigung\nBerlin Amtsgericht Berlin (Charlottenburg) HRB 211546\nGDI GmbH – Berlin",
      "type": "Löschungsankündigung",
      "state": "Berlin",
      "amtsgericht": "Amtsgericht Berlin (Charlottenburg)",
      "registernummer": "HRB 211546",
      "registerart": "HRB",
      "company_name": "GDI GmbH",
      "company_seat": "Berlin",
      "details": "29.01.2026 (Bekanntmachungsdatum)\n\nBerlin Amtsgericht Berlin (Charlottenburg) HRB 211546\nLöschungsankündigung\n\nGDI GmbH\nGesellschaft mit beschränkter Haftung\nBerlin\n\nBei der nachstehenden Gesellschaft wird das Amtslöschungsverfahren gemäß § 394 FamFG eingeleitet. Widerspruchsfrist 6 Wochen"
    },
    {
      "date": "2026-01-29",
      "id": "143814",
      "original_text": "Sonstige Registerbekanntmachung\nHamburg Amtsgericht Hamburg HRB 124584\nVeolia Industrial Solutions Deutschland GmbH – Hamburg",
      "type": "Sonstige Registerbekanntmachung",
      "state": "Hamburg",
      "amtsgericht": "Amtsgericht Hamburg",
      "registernummer": "HRB 124584",
      "registerart": "HRB",
      "company_name": "Veolia Industrial Solutions Deutschland GmbH",
      "company_seat": "Hamburg",
      "details": "29.01.2026 (Bekanntmachungsdatum)\n\nHamburg Amtsgericht Hamburg HRB 124584\nSonstige Registerbekanntmachung 29.01.2026 (Eintragungsdatum)\n\nVeolia Industrial Solutions Deutschland GmbH\nGesellschaft mit beschränkter Haftung\nHamburg\n\nAls nicht eingetragen wird bekannt gemacht:  Den Gläubigern der Gesellschaft, deren Forderungen begründet worden sind, bevor die Eintragung der Vertragsbeendigung in das Handelsregister nach § 10 HGB als bekannt gemacht gilt, ist vom anderen Vertragsteil Sicherheit zu leisten, wenn sie sich binnen 6 Monaten nach Bekanntmachung der Eintragung zu diesem Zweck bei ihm melden."
    },
    {
      "date": "2026-01-29",
      "id": "143815",
      "original_text": "Registerbekanntmachung nach dem Umwandlungsgesetz\nBaden-Württemberg Amtsgericht Stuttgart HRB 264715\nOpenSoft+ Cloud & IT-Service GmbH – Ellhofen",
      "type": "Registerbekanntmachung nach dem Umwandlungsgesetz",
      "state": "Baden-Württemberg",
      "amtsgericht": "Amtsgericht Stuttgart",
      "registernummer": "HRB 264715",
      "registerart": "HRB",
      "company_name": "OpenSoft+ Cloud & IT-Service GmbH",
      "company_seat": "Ellhofen",
      "details": "29.01.2026 (Bekanntmachungsdatum)\n\nBaden-Württemberg Amtsgericht Stuttgart HRB 264715\nRegisterbekanntmachung nach dem Umwandlungsgesetz 29.01.2026 (Eintragungsdatum)\n\nOpenSoft+ Cloud & IT-Service GmbH\nGesellschaft mit beschränkter Haftung\nEllhofen\n\nDen Gläubigern der an der Verschmelzung beteiligten Rechtsträger ist, wenn sie binnen sechs Monaten nach dem Tag, an dem die Eintragung der Verschmelzung in das Register des Sitzes desjenigen Rechtsträgers, dessen Gläubiger sie sind, nach § 19 Abs. 3 UmwG als bekanntgemacht gilt, ihren Anspruch nach Grund und Höhe schriftlich anmelden, Sicherheit zu leisten, soweit sie nicht Befriedigung verlangen können. Dieses Recht steht den Gläubigern jedoch nur zu, wenn sie glaubhaft machen, dass durch die Verschmelzung die Erfüllung ihrer Forderung gefährdet wird."
    },
    {
      "date": "2026-01-29",
      "id": "143816",
      "original_text": "Löschungsankündigung\nBaden-Württemberg Amtsgericht Mannheim HRB 715444\nHaLog Beteiligungs GmbH – Baden-Baden",
      "type": "Löschungsankündigung",
      "state": "Baden-Württemberg",
      "amtsgericht": "Amtsgericht Mannheim",
      "registernummer": "HRB 715444",
      "registerart": "HRB",
      "company_name": "HaLog Beteiligungs GmbH",
      "company_seat": "Baden-Baden",
      "details": "29.01.2026 (Bekanntmachungsdatum)\n\nBaden-Württemberg Amtsgericht Mannheim HRB 715444\nLöschungsankündigung\n\nHaLog Beteiligungs GmbH\nGesellschaft mit beschränkter Haftung\nBaden-Baden\n\nDas Gericht beabsichtigt, die Gesellschaft wegen Vermögenslosigkeit im Handelsregister von Amts wegen nach § 394 FamFG zu löschen. Die Frist zur Geltendmachung eines Widerspruchs gegen die beabsichtigte Löschung ist auf einen Monat ab Veröffentlichung bestimmt."
    },
    {
      "date": "2026-01-29",
      "id": "143817",
      "original_text": "Löschungsankündigung\nSchleswig-Holstein Amtsgericht Lübeck HRB 10399\nMBM Möllner Bau Management UG (haftungsbeschränkt) – Mölln",
      "type": "Löschungsankündigung",
      "state": "Schleswig-Holstein",
      "amtsgericht": "Amtsgericht Lübeck",
      "registernummer": "HRB 10399",
      "registerart": "HRB",
      "company_name": "MBM Möllner Bau Management UG (haftungsbeschränkt)",
      "company_seat": "Mölln",
      "details": "29.01.2026 (Bekanntmachungsdatum)\n\nSchleswig-Holstein Amtsgericht Lübeck HRB 10399\nLöschungsankündigung\n\nMBM Möllner Bau Management UG (haftungsbeschränkt)\nGesellschaft mit beschränkter Haftung\nMölln\n\nEs ist die Löschung der nachstehenden Gesellschaft wegen Vermögenslosigkeit gemäß § 394 FamFG beabsichtigt."
    },
    {
      "date": "2026-01-29",
      "id": "143818",
      "original_text": "Löschungsankündigung\nSaarland Amtsgericht Saarbrücken HRB 110228\nBB Qualität GmbH – Homburg",
      "type": "Löschungsankündigung",
      "state": "Saarland",
      "amtsgericht": "Amtsgericht Saarbrücken",
      "registernummer": "HRB 110228",
      "registerart": "HRB",
      "company_name": "BB Qualität GmbH",
      "company_seat": "Homburg",
      "details": "29.01.2026 (Bekanntmachungsdatum)\n\nSaarland Amtsgericht Saarbrücken HRB 110228\nLöschungsankündigung 18.04.2024 (Eintragungsdatum)\n\nBB Qualität GmbH\nGesellschaft mit beschränkter Haftung\nHomburg\n\nEs ist beabsichtigt, die Gesellschaft von Amts wegen gemäß § 394 FamFG wegen Vermögenslosigkeit zu löschen.\nGegen die Löschung von Amts wegen ist das Rechtsmittel des Widerspruchs statthaft. Der Widerspruch ist binnen einer Frist von zwei Monaten beginnend mit dem Tag dieser Veröffentlichung durch Einreichen eines Widerspruchsschreibens -schriftlich oder zur Niederschrift der Geschäftsstelle beim Amtsgericht Saarbrücken, -zentrales Handelsregister-, Mainzerstr.178, 66121 Saarbrücken einzulegen.\nDer Widerspruch muss die Bezeichnung der angefochtenen Löschungsankündigung enthalten sowie die Erklärung, dass Widerspruch eingelegt wird. Er ist vom Widerspruchsführer oder seinem Bevollmächtigten zu unterzeichnen.\nDas Widerspruchsschreiben kann auch in der Form eines elektronischen Dokumentes eingereicht werden, das mit einer qualifizierten elektronischen Signatur nach dem Signaturgesetz versehen sein muss (§§ 14 Abs. 2 FamFG, 130a, 298 ZPO)."
    },
    {
      "date": "2026-01-29",
      "id": "143819",
      "original_text": "Einreichung neuer Dokumente\nBaden-Württemberg Amtsgericht Stuttgart HRB 22147\nIBM Central Holding GmbH – Ehningen",
      "type": "Einreichung neuer Dokumente",
      "state": "Baden-Württemberg",
      "amtsgericht": "Amtsgericht Stuttgart",
      "registernummer": "HRB 22147",
      "registerart": "HRB",
      "company_name": "IBM Central Holding GmbH",
      "company_seat": "Ehningen",
      "details": "29.01.2026 (Bekanntmachungsdatum)\n\nBaden-Württemberg Amtsgericht Stuttgart HRB 22147\nEinreichung neuer Dokumente\n\nIBM Central Holding GmbH\nGesellschaft mit beschränkter Haftung\nEhningen\n\nDie Gesellschaft hat am 28.01.2026 die Liste über die Zusammensetzung des Aufsichtsrats zum Handelsregister eingereicht."
    },
    {
      "date": "2026-01-29",
      "id": "143820",
      "original_text": "Registerbekanntmachung nach dem Umwandlungsgesetz\nBaden-Württemberg Amtsgericht Stuttgart HRB 753468\nOMax Solutions GmbH – Nagold",
      "type": "Registerbekanntmachung nach dem Umwandlungsgesetz",
      "state": "Baden-Württemberg",
      "amtsgericht": "Amtsgericht Stuttgart",
      "registernummer": "HRB 753468",
      "registerart": "HRB",
      "company_name": "OMax Solutions GmbH",
      "company_seat": "Nagold",
      "details": "29.01.2026 (Bekanntmachungsdatum)\n\nBaden-Württemberg Amtsgericht Stuttgart HRB 753468\nRegisterbekanntmachung nach dem Umwandlungsgesetz 29.01.2026 (Eintragungsdatum)\n\nOMax Solutions GmbH\nGesellschaft mit beschränkter Haftung\nNagold\n\nDen Gläubigern der an der Verschmelzung beteiligten Rechtsträger ist, wenn sie binnen sechs Monaten nach dem Tag, an dem die Eintragung der Verschmelzung in das Register des Sitzes desjenigen Rechtsträgers, dessen Gläubiger sie sind, nach § 19 Abs. 3 UmwG als bekanntgemacht gilt, ihren Anspruch nach Grund und Höhe schriftlich anmelden, Sicherheit zu leisten, soweit sie nicht Befriedigung verlangen können. Dieses Recht steht den Gläubigern jedoch nur zu, wenn sie glaubhaft machen, dass durch die Verschmelzung die Erfüllung ihrer Forderung gefährdet wird."
    },
    {
      "date": "2026-01-29",
      "id": "143821",
      "original_text": "Löschungsankündigung\nSchleswig-Holstein Amtsgericht Lübeck HRB 17699\nPEW GmbH – Geesthacht",
      "type": "Löschungsankündigung",
      "state": "Schleswig-Holstein",
      "amtsgericht": "Amtsgericht Lübeck",
      "registernummer": "HRB 17699",
      "registerart": "HRB",
      "company_name": "PEW GmbH",
      "company_seat": "Geesthacht",
      "details": "29.01.2026 (Bekanntmachungsdatum)\n\nSchleswig-Holstein Amtsgericht Lübeck HRB 17699\nLöschungsankündigung\n\nPEW GmbH\nGesellschaft mit beschränkter Haftung\nGeesthacht\n\nEs ist die Löschung der nachstehenden Gesellschaft wegen Vermögenslosigkeit gemäß § 394 FamFG beabsichtigt."
    },
    {
      "date": "2026-01-29",
      "id": "143822",
      "original_text": "Löschungsankündigung\nBaden-Württemberg Amtsgericht Mannheim HRB 730980\nMWH Gaststättenbetriebsgesellschaft mbH – Karlsruhe",
      "type": "Löschungsankündigung",
      "state": "Baden-Württemberg",
      "amtsgericht": "Amtsgericht Mannheim",
      "registernummer": "HRB 730980",
      "registerart": "HRB",
      "company_name": "MWH Gaststättenbetriebsgesellschaft mbH",
      "company_seat": "Karlsruhe",
      "details": "29.01.2026 (Bekanntmachungsdatum)\n\nBaden-Württemberg Amtsgericht Mannheim HRB 730980\nLöschungsankündigung\n\nMWH Gaststättenbetriebsgesellschaft mbH\nGesellschaft mit beschränkter Haftung\nKarlsruhe\n\nDas Gericht beabsichtigt, die Gesellschaft wegen Vermögenslosigkeit im Handelsregister von Amts wegen nach § 394 FamFG zu löschen. Die Frist zur Geltendmachung eines Widerspruchs gegen die beabsichtigte Löschung ist auf einen Monat ab Veröffentlichung bestimmt."
    },
    {
      "date": "2026-01-29",
      "id": "143823",
      "original_text": "Sonstige Registerbekanntmachung\nHamburg Amtsgericht Hamburg HRB 95890\nHLM Hamburg Lines Men GmbH – Hamburg",
      "type": "Sonstige Registerbekanntmachung",
      "state": "Hamburg",
      "amtsgericht": "Amtsgericht Hamburg",
      "registernummer": "HRB 95890",
      "registerart": "HRB",
      "company_name": "HLM Hamburg Lines Men GmbH",
      "company_seat": "Hamburg",
      "details": "29.01.2026 (Bekanntmachungsdatum)\n\nHamburg Amtsgericht Hamburg HRB 95890\nSonstige Registerbekanntmachung 29.01.2026 (Eintragungsdatum)\n\nHLM Hamburg Lines Men GmbH\nGesellschaft mit beschränkter Haftung\nHamburg\n\nAls nicht eingetragen wird bekannt gemacht:  Den Gläubigern der Gesellschaft, deren Forderungen begründet worden sind, bevor die Eintragung der Vertragsbeendigung in das Handelsregister nach § 10 HGB als bekannt gemacht gilt, ist vom anderen Vertragsteil Sicherheit zu leisten, wenn sie sich binnen 6 Monaten nach Bekanntmachung der Eintragung zu diesem Zweck bei ihm melden."
    },
    {
      "date": "2026-01-29",
      "id": "143824",
      "original_text": "Registerbekanntmachung nach dem Umwandlungsgesetz\nBaden-Württemberg Amtsgericht Stuttgart HRB 590253\nRosenberg Ventilatoren GmbH – Künzelsau",
      "type": "Registerbekanntmachung nach dem Umwandlungsgesetz",
      "state": "Baden-Württemberg",
      "amtsgericht": "Amtsgericht Stuttgart",
      "registernummer": "HRB 590253",
      "registerart": "HRB",
      "company_name": "Rosenberg Ventilatoren GmbH",
      "company_seat": "Künzelsau",
      "details": "29.01.2026 (Bekanntmachungsdatum)\n\nBaden-Württemberg Amtsgericht Stuttgart HRB 590253\nRegisterbekanntmachung nach dem Umwandlungsgesetz 29.01.2026 (Eintragungsdatum)\n\nRosenberg Ventilatoren GmbH\nGesellschaft mit beschränkter Haftung\nKünzelsau\n\nDen Gläubigern dern an der grenzüberschreitenden Verschmelzung beteiligten übernehmenden Rechtsträger ist, wenn sie binnen sechs Monaten nach dem Tag, an dem die Eintragung der Verschmelzung in das Register des Sitzes desjenigen Rechtsträgers, dessen Gläubiger sie sind, nach § 19 Absatz 3 UmwG als bekanntgemacht gilt, ihren Anspruch nach Grund und Höhe schriftlich anmelden, Sicherheit zu leisten, soweit sie nicht Befriedigung verlangen können. Dieses Recht steht den Gläubigern jedoch nur zu, wenn sie glaubhaft machen, dass durch die Verschmelzung die Erfüllung ihrer Forderung gefährdet wird."
    },
    {
      "date": "2026-01-29",
      "id": "143825",
      "original_text": "Registerbekanntmachung nach dem Umwandlungsgesetz\nBaden-Württemberg Amtsgericht Freiburg HRB 734865\nAvant-garde Applied Sciences Holding GmbH – Merzhausen",
      "type": "Registerbekanntmachung nach dem Umwandlungsgesetz",
      "state": "Baden-Württemberg",
      "amtsgericht": "Amtsgericht Freiburg",
      "registernummer": "HRB 734865",
      "registerart": "HRB",
      "company_name": "Avant-garde Applied Sciences Holding GmbH",
      "company_seat": "Merzhausen",
      "details": "29.01.2026 (Bekanntmachungsdatum)\n\nBaden-Württemberg Amtsgericht Freiburg HRB 734865\nRegisterbekanntmachung nach dem Umwandlungsgesetz 29.01.2026 (Eintragungsdatum)\n\nAvant-garde Applied Sciences Holding GmbH\nGesellschaft mit beschränkter Haftung\nMerzhausen\n\nAls nicht eingetragen wird bekanntgemacht:\nDen Gläubigern des an dem Formwechsel beteiligten Rechtsträgers ist, wenn sie binnen sechs Monaten nach dem Tag, an dem die Eintragung des Formwechsels in das Register des Sitzes desjenigen Rechtsträgers, dessen Gläubiger sie sind, nach § 19 Abs. 3 UmwG als bekanntgemacht gilt, ihren Anspruch nach Grund und Höhe schriftlich anmelden, Sicherheit zu leisten, soweit sie nicht Befriedigung verlangen können. Dieses Recht steht den Gläubigern jedoch nur zu, wenn sie glaubhaft machen, dass durch den Formwechsel die Erfüllung ihrer Forderung gefährdet wird."
    },
    {
      "date": "2026-01-29",
      "id": "143826",
      "original_text": "Sonstige Registerbekanntmachung\nHamburg Amtsgericht Hamburg HRB 151739\nNovum Hospitality GmbH – Hamburg",
      "type": "Sonstige Registerbekanntmachung",
      "state": "Hamburg",
      "amtsgericht": "Amtsgericht Hamburg",
      "registernummer": "HRB 151739",
      "registerart": "HRB",
      "company_name": "Novum Hospitality GmbH",
      "company_seat": "Hamburg",
      "details": "29.01.2026 (Bekanntmachungsdatum)\n\nHamburg Amtsgericht Hamburg HRB 151739\nSonstige Registerbekanntmachung\n\nNovum Hospitality GmbH\nGesellschaft mit beschränkter Haftung\nHamburg\n\nAls nicht eingetragen wird bekannt gemacht: Liste des Aufsichtsrats wurde eingereicht."
    },
    {
      "date": "2026-01-29",
      "id": "143827",
      "original_text": "Einreichung neuer Dokumente\nBaden-Württemberg Amtsgericht Ulm HRB 728272\nALB FILS KLINIKUM SERVICE GmbH – Göppingen",
      "type": "Einreichung neuer Dokumente",
      "state": "Baden-Württemberg",
      "amtsgericht": "Amtsgericht Ulm",
      "registernummer": "HRB 728272",
      "registerart": "HRB",
      "company_name": "ALB FILS KLINIKUM SERVICE GmbH",
      "company_seat": "Göppingen",
      "details": "29.01.2026 (Bekanntmachungsdatum)\n\nBaden-Württemberg Amtsgericht Ulm HRB 728272\nEinreichung neuer Dokumente\n\nALB FILS KLINIKUM SERVICE GmbH\nGesellschaft mit beschränkter Haftung\nGöppingen\n\nDie Gesellschaft hat am 29.01.2026 die Liste über die Zusammensetzung des Aufsichtsrats zum Handelsregister eingereicht."
    },
    {
      "date": "2026-01-29",
      "id": "143828",
      "original_text": "Registerbekanntmachung nach dem Umwandlungsgesetz\nBaden-Württemberg Amtsgericht Ulm HRA 729958\nVerwall GmbH & Co. KG – Aalen",
      "type": "Registerbekanntmachung nach dem Umwandlungsgesetz",
      "state": "Baden-Württemberg",
      "amtsgericht": "Amtsgericht Ulm",
      "registernummer": "HRA 729958",
      "registerart": "HRA",
      "company_name": "Verwall GmbH & Co. KG",
      "company_seat": "Aalen",
      "details": "29.01.2026 (Bekanntmachungsdatum)\n\nBaden-Württemberg Amtsgericht Ulm HRA 729958\nRegisterbekanntmachung nach dem Umwandlungsgesetz 29.01.2026 (Eintragungsdatum)\n\nVerwall GmbH & Co. KG\nKommanditgesellschaft\nAalen\n\nDen Gläubigern der an der Abspaltung beteiligten Rechtsträger ist, wenn sie binnen sechs Monaten nach dem Tag, an dem die Eintragung der Abspaltung in das Register des Sitzes desjenigen Rechtsträgers, dessen Gläubiger sie sind, nach § 19 Abs. 3 UmwG als bekanntgemacht gilt, ihren Anspruch nach Grund und Höhe schriftlich anmelden, Sicherheit zu leisten, soweit sie nicht Befriedigung verlangen können. Dieses Recht steht den Gläubigern jedoch nur zu, wenn sie glaubhaft machen, dass durch die Abspaltung die Erfüllung ihrer Forderung gefährdet wird."
    },
    {
      "date": "2026-01-29",
      "id": "143829",
      "original_text": "Registerbekanntmachung nach dem Umwandlungsgesetz\nBaden-Württemberg Amtsgericht Ulm HRA 500154\nPalm Papier GmbH & Co. KG – Aalen",
      "type": "Registerbekanntmachung nach dem Umwandlungsgesetz",
      "state": "Baden-Württemberg",
      "amtsgericht": "Amtsgericht Ulm",
      "registernummer": "HRA 500154",
      "registerart": "HRA",
      "company_name": "Palm Papier GmbH & Co. KG",
      "company_seat": "Aalen",
      "details": "29.01.2026 (Bekanntmachungsdatum)\n\nBaden-Württemberg Amtsgericht Ulm HRA 500154\nRegisterbekanntmachung nach dem Umwandlungsgesetz 29.01.2026 (Eintragungsdatum)\n\nPalm Papier GmbH & Co. KG\nKommanditgesellschaft\nAalen\n\nAls nicht eingetragen wird bekanntgemacht:\nDen Gläubigern der an der Abspaltung beteiligten Rechtsträger ist, wenn sie binnen sechs Monaten nach dem Tag, an dem die Eintragung der Abspaltung in das Register des Sitzes desjenigen Rechtsträgers, dessen Gläubiger sie sind, nach § 19 Abs. 3 UmwG als bekanntgemacht gilt, ihren Anspruch nach Grund und Höhe schriftlich anmelden, Sicherheit zu leisten, soweit sie nicht Befriedigung verlangen können. Dieses Recht steht den Gläubigern jedoch nur zu, wenn sie glaubhaft machen, dass durch die Abspaltung die Erfüllung ihrer Forderung gefährdet wird."
    },
    {
      "date": "2026-01-29",
      "id": "143830",
      "original_text": "Löschungsankündigung\nBaden-Württemberg Amtsgericht Freiburg HRB 708697\nKabouter Management GmbH – Waldshut-Tiengen",
      "type": "Löschungsankündigung",
      "state": "Baden-Württemberg",
      "amtsgericht": "Amtsgericht Freiburg",
      "registernummer": "HRB 708697",
      "registerart": "HRB",
      "company_name": "Kabouter Management GmbH",
      "company_seat": "Waldshut-Tiengen",
      "details": "29.01.2026 (Bekanntmachungsdatum)\n\nBaden-Württemberg Amtsgericht Freiburg HRB 708697\nLöschungsankündigung\n\nKabouter Management GmbH\nGesellschaft mit beschränkter Haftung\nWaldshut-Tiengen\n\nAls nicht eingetragen wird bekanntgemacht:\nDas Gericht beabsichtigt, die Gesellschaft wegen Vermögenslosigkeit im Handelsregister von Amts wegen nach § 394 FamFG zu löschen. Die Frist zur Geltendmachung eines Widerspruchs gegen die beabsichtigte Löschung ist auf einen Monat ab Veröffentlichung bestimmt."
    },
    {
      "date": "2026-01-29",
      "id": "143831",
      "original_text": "Einreichung neuer Dokumente\nBaden-Württemberg Amtsgericht Freiburg HRB 6903\nMORISON Riedlinger AG Wirtschaftsprüfungsgesellschaft – Freiburg im Breisgau",
      "type": "Einreichung neuer Dokumente",
      "state": "Baden-Württemberg",
      "amtsgericht": "Amtsgericht Freiburg",
      "registernummer": "HRB 6903",
      "registerart": "HRB",
      "company_name": "MORISON Riedlinger AG Wirtschaftsprüfungsgesellschaft",
      "company_seat": "Freiburg im Breisgau",
      "details": "29.01.2026 (Bekanntmachungsdatum)\n\nBaden-Württemberg Amtsgericht Freiburg HRB 6903\nEinreichung neuer Dokumente\n\nMORISON Riedlinger AG Wirtschaftsprüfungsgesellschaft\nAktiengesellschaft\nFreiburg im Breisgau\n\nDie Gesellschaft hat am 15.01.2026 die Liste über die Zusammensetzung des Aufsichtsrats zum Handelsregister eingereicht."
    },
    {
      "date": "2026-01-29",
      "id": "143832",
      "original_text": "Löschungsankündigung\nBaden-Württemberg Amtsgericht Mannheim HRB 6353\nNichols Computer Consultancy GmbH – Mannheim",
      "type": "Löschungsankündigung",
      "state": "Baden-Württemberg",
      "amtsgericht": "Amtsgericht Mannheim",
      "registernummer": "HRB 6353",
      "registerart": "HRB",
      "company_name": "Nichols Computer Consultancy GmbH",
      "company_seat": "Mannheim",
      "details": "29.01.2026 (Bekanntmachungsdatum)\n\nBaden-Württemberg Amtsgericht Mannheim HRB 6353\nLöschungsankündigung 29.01.2026 (Eintragungsdatum)\n\nNichols Computer Consultancy GmbH\nGesellschaft mit beschränkter Haftung\nMannheim\n\nDas Gericht beabsichtigt, die Gesellschaft wegen Vermögenslosigkeit im Handelsregister von Amts wegen nach § 394 FamFG zu löschen. Die Frist zur Geltendmachung eines Widerspruchs gegen die beabsichtigte Löschung ist auf einen Monat ab Veröffentlichung bestimmt."
    },
    {
      "date": "2026-01-29",
      "id": "143833",
      "original_text": "Einreichung neuer Dokumente\nBaden-Württemberg Amtsgericht Stuttgart HRB 14562\nIBM Deutschland GmbH – Ehningen",
      "type": "Einreichung neuer Dokumente",
      "state": "Baden-Württemberg",
      "amtsgericht": "Amtsgericht Stuttgart",
      "registernummer": "HRB 14562",
      "registerart": "HRB",
      "company_name": "IBM Deutschland GmbH",
      "company_seat": "Ehningen",
      "details": "29.01.2026 (Bekanntmachungsdatum)\n\nBaden-Württemberg Amtsgericht Stuttgart HRB 14562\nEinreichung neuer Dokumente\n\nIBM Deutschland GmbH\nGesellschaft mit beschränkter Haftung\nEhningen\n\nDie Gesellschaft hat am 28.01.2026 die Liste über die Zusammensetzung des Aufsichtsrats zum Handelsregister eingereicht."
    },
    {
      "date": "2026-01-29",
      "id": "143834",
      "original_text": "Registerbekanntmachung nach dem Umwandlungsgesetz\nSachsen Amtsgericht Dresden HRB 35438\nsecucard GmbH – Dresden",
      "type": "Registerbekanntmachung nach dem Umwandlungsgesetz",
      "state": "Sachsen",
      "amtsgericht": "Amtsgericht Dresden",
      "registernummer": "HRB 35438",
      "registerart": "HRB",
      "company_name": "secucard GmbH",
      "company_seat": "Dresden",
      "details": "29.01.2026 (Bekanntmachungsdatum)\n\nSachsen Amtsgericht Dresden HRB 35438\nRegisterbekanntmachung nach dem Umwandlungsgesetz 29.01.2026 (Eintragungsdatum)\n\nsecucard GmbH\nGesellschaft mit beschränkter Haftung\nDresden\n\nDen Gläubigern der an der Verschmelzung beteiligten Rechtsträger ist, wenn sie binnen sechs Monaten nach dem Tag, an dem die Eintragung der Verschmelzung in das Register des Sitzes desjenigen Rechtsträgers, dessen Gläubiger sie sind, nach § 19 Abs. 3 UmwG als bekannt gemacht gilt, ihren Anspruch nach Grund und Höhe in Textform anmelden, Sicherheit zu leisten, soweit sie nicht Befriedigung verlangen können. Dieses Recht steht den Gläubigern jedoch nur zu, wenn sie glaubhaft machen, dass durch die Verschmelzung die Erfüllung der Forderung gefährdet wird."
    },
    {
      "date": "2026-01-29",
      "id": "143835",
      "original_text": "Sonstige Registerbekanntmachung\nSachsen Amtsgericht Leipzig HRB 4703\nHelmholtz-Zentrum für Umweltforschung GmbH - UFZ – Leipzig",
      "type": "Sonstige Registerbekanntmachung",
      "state": "Sachsen",
      "amtsgericht": "Amtsgericht Leipzig",
      "registernummer": "HRB 4703",
      "registerart": "HRB",
      "company_name": "Helmholtz-Zentrum für Umweltforschung GmbH - UFZ",
      "company_seat": "Leipzig",
      "details": "29.01.2026 (Bekanntmachungsdatum)\n\nSachsen Amtsgericht Leipzig HRB 4703\nSonstige Registerbekanntmachung\n\nHelmholtz-Zentrum für Umweltforschung GmbH - UFZ\nGesellschaft mit beschränkter Haftung\nLeipzig\n\nAm 26.01.2026 wurde beim Handelsregister des Amtsgerichts Leipzig die Liste der Mitglieder des Aufsichtsrats gemäß § 52 GmbHG eingereicht."
    },
    {
      "date": "2026-01-29",
      "id": "143836",
      "original_text": "Registerbekanntmachung nach dem Umwandlungsgesetz\nSachsen Amtsgericht Chemnitz HRB 32264\nROQAPPS Software GmbH – Neukirchen/Erzgeb.",
      "type": "Registerbekanntmachung nach dem Umwandlungsgesetz",
      "state": "Sachsen",
      "amtsgericht": "Amtsgericht Chemnitz",
      "registernummer": "HRB 32264",
      "registerart": "HRB",
      "company_name": "ROQAPPS Software GmbH",
      "company_seat": "Neukirchen/Erzgeb.",
      "details": "29.01.2026 (Bekanntmachungsdatum)\n\nSachsen Amtsgericht Chemnitz HRB 32264\nRegisterbekanntmachung nach dem Umwandlungsgesetz 29.01.2026 (Eintragungsdatum)\n\nROQAPPS Software GmbH\nGesellschaft mit beschränkter Haftung\nNeukirchen/Erzgeb.\n\nDen Gläubigern der an der Verschmelzung beteiligten Rechtsträger ist, wenn sie binnen sechs Monaten nach dem Tag, an dem die Eintragung der Verschmelzung in das Register des Sitzes desjenigen Rechtsträgers, dessen Gläubiger sie sind, nach § 19 Abs. 3 UmwG als bekannt gemacht gilt, ihren Anspruch nach Grund und Höhe in Textform anmelden, Sicherheit zu leisten, soweit sie nicht Befriedigung verlangen können. Dieses Recht steht den Gläubigern jedoch nur zu, wenn sie glaubhaft machen, dass durch die Verschmelzung die Erfüllung der Forderung gefährdet wird."
    },
    {
      "date": "2026-01-29",
      "id": "143837",
      "original_text": "Löschungsankündigung\nSachsen Amtsgericht Leipzig HRB 21495\nGesellschaft für Grundstücksverwertung mit beschränkter Haftung – Leipzig",
      "type": "Löschungsankündigung",
      "state": "Sachsen",
      "amtsgericht": "Amtsgericht Leipzig",
      "registernummer": "HRB 21495",
      "registerart": "HRB",
      "company_name": "Gesellschaft für Grundstücksverwertung mit beschränkter Haftung",
      "company_seat": "Leipzig",
      "details": "29.01.2026 (Bekanntmachungsdatum)\n\nSachsen Amtsgericht Leipzig HRB 21495\nLöschungsankündigung\n\nGesellschaft für Grundstücksverwertung mit beschränkter Haftung\nGesellschaft mit beschränkter Haftung\nLeipzig\n\nDas Registergericht beabsichtigt, die im Handelsregister eingetragene Gesellschaft von Amts wegen nach § 394 FamFG zu löschen. Die Frist zu Erhebung eines Widerspruchs gegen die beabsichtigte Löschung wird auf einen Monat festgesetzt."
    },
    {
      "date": "2026-01-29",
      "id": "143838",
      "original_text": "Registerbekanntmachung nach dem Umwandlungsgesetz\nSachsen Amtsgericht Dresden HRB 27612\nSECUPAY AG – Pulsnitz",
      "type": "Registerbekanntmachung nach dem Umwandlungsgesetz",
      "state": "Sachsen",
      "amtsgericht": "Amtsgericht Dresden",
      "registernummer": "HRB 27612",
      "registerart": "HRB",
      "company_name": "SECUPAY AG",
      "company_seat": "Pulsnitz",
      "details": "29.01.2026 (Bekanntmachungsdatum)\n\nSachsen Amtsgericht Dresden HRB 27612\nRegisterbekanntmachung nach dem Umwandlungsgesetz 29.01.2026 (Eintragungsdatum)\n\nSECUPAY AG\nAktiengesellschaft\nPulsnitz\n\nDen Gläubigern der an der Verschmelzung beteiligten Rechtsträger ist, wenn sie binnen sechs Monaten nach dem Tag, an dem die Eintragung der Verschmelzung in das Register des Sitzes desjenigen Rechtsträgers, dessen Gläubiger sie sind, nach § 19 Abs. 3 UmwG als bekannt gemacht gilt, ihren Anspruch nach Grund und Höhe in Textform anmelden, Sicherheit zu leisten, soweit sie nicht Befriedigung verlangen können. Dieses Recht steht den Gläubigern jedoch nur zu, wenn sie glaubhaft machen, dass durch die Verschmelzung die Erfüllung der Forderung gefährdet wird."
    },
    {
      "date": "2026-01-29",
      "id": "143839",
      "original_text": "Einreichung neuer Dokumente\nNiedersachsen Amtsgericht Braunschweig HRB 3790\nVolkswagen Financial Services Overseas AG – Braunschweig",
      "type": "Einreichung neuer Dokumente",
      "state": "Niedersachsen",
      "amtsgericht": "Amtsgericht Braunschweig",
      "registernummer": "HRB 3790",
      "registerart": "HRB",
      "company_name": "Volkswagen Financial Services Overseas AG",
      "company_seat": "Braunschweig",
      "details": "29.01.2026 (Bekanntmachungsdatum)\n\nNiedersachsen Amtsgericht Braunschweig HRB 3790\nEinreichung neuer Dokumente\n\nVolkswagen Financial Services Overseas AG\nAktiengesellschaft\nBraunschweig\n\nDie Liste der Mitglieder des Aufsichtsrats wurde beim Registergericht eingereicht."
    },
    {
      "date": "2026-01-29",
      "id": "143840",
      "original_text": "Sonstige Registerbekanntmachung\nNiedersachsen Amtsgericht Hannover HRB 110009 früher Amtsgericht Neustadt a. Rbge. (Neustadt)\nMarley Deutschland GmbH – Wunstorf",
      "type": "Sonstige Registerbekanntmachung",
      "state": "Niedersachsen",
      "amtsgericht": "Amtsgericht Hannover",
      "registernummer": "HRB 110009",
      "registerart": "HRB",
      "company_name": "Marley Deutschland GmbH",
      "company_seat": "Wunstorf",
      "former_amtsgericht": "Neustadt a. Rbge. (Neustadt)",
      "details": "29.01.2026 (Bekanntmachungsdatum)\n\nNiedersachsen Amtsgericht Hannover HRB 110009 früher Amtsgericht Neustadt a. Rbge. (Neustadt)\nSonstige Registerbekanntmachung 29.01.2026 (Eintragungsdatum)\n\nMarley Deutschland GmbH\nGesellschaft mit beschränkter Haftung\nWunstorf\n\nDen Gläubigern der Gesellschaft, deren Forderungen begründet worden sind, bevor die Eintragung der Beendigung des Vertrages in das Handelsregister nach § 10 HGB als bekanntgemacht gilt, ist vom anderen Vertragsteil Sicherheit zu leisten, wenn sie sich binnen sechs Monaten nach der Bekanntmachung zu diesem Zweck bei ihm melden."
    },
    {
      "date": "2026-01-29",
      "id": "143841",
      "original_text": "Einreichung neuer Dokumente\nNiedersachsen Amtsgericht Hannover HRB 60705\nAVS SystemLift Aktiengesellschaft – Isernhagen",
      "type": "Einreichung neuer Dokumente",
      "state": "Niedersachsen",
      "amtsgericht": "Amtsgericht Hannover",
      "registernummer": "HRB 60705",
      "registerart": "HRB",
      "company_name": "AVS SystemLift Aktiengesellschaft",
      "company_seat": "Isernhagen",
      "details": "29.01.2026 (Bekanntmachungsdatum)\n\nNiedersachsen Amtsgericht Hannover HRB 60705\nEinreichung neuer Dokumente\n\nAVS SystemLift Aktiengesellschaft\nAktiengesellschaft\nIsernhagen\n\nDie Liste der Mitglieder des Aufsichtsrats wurde beim Registergericht eingereicht"
    },
    {
      "date": "2026-01-29",
      "id": "143842",
      "original_text": "Löschungsankündigung\nNiedersachsen Amtsgericht Oldenburg (Oldenburg) HRA 130435 früher Amtsgericht Wilhelmshaven\nINZ Grundstücksverwaltungs- und Kapitalanlagen Vermittlungsgesellschaft mbH & Co. \"Im Alten Bahnhof Zetel\" KG – Zetel",
      "type": "Löschungsankündigung",
      "state": "Niedersachsen",
      "amtsgericht": "Amtsgericht Oldenburg (Oldenburg)",
      "registernummer": "HRA 130435",
      "registerart": "HRA",
      "company_name": "INZ Grundstücksverwaltungs- und Kapitalanlagen Vermittlungsgesellschaft mbH & Co. \"Im Alten Bahnhof Zetel\" KG",
      "company_seat": "Zetel",
      "former_amtsgericht": "Wilhelmshaven",
      "details": "29.01.2026 (Bekanntmachungsdatum)\n\nNiedersachsen Amtsgericht Oldenburg (Oldenburg) HRA 130435 früher Amtsgericht Wilhelmshaven\nLöschungsankündigung\n\nINZ Grundstücksverwaltungs- und Kapitalanlagen Vermittlungsgesellschaft mbH & Co. \"Im Alten Bahnhof Zetel\" KG\nKommanditgesellschaft\nZetel\n\nDas Registergericht beabsichtigt, die Firma von Amts wegen nach § 31 Abs. 2 Satz 2 HGB, § 393 FamFG zu löschen. Die Frist zur Erhebung eines Widerspruchs ist auf 1 Monat ab dieser Registerbekanntmachung festgesetzt."
    },
    {
      "date": "2026-01-29",
      "id": "143843",
      "original_text": "Registerbekanntmachung nach dem Umwandlungsgesetz\nNiedersachsen Amtsgericht Tostedt HRA 205647\nRadoslaw Lukomski e. K. – Buchholz in der Nordheide",
      "type": "Registerbekanntmachung nach dem Umwandlungsgesetz",
      "state": "Niedersachsen",
      "amtsgericht": "Amtsgericht Tostedt",
      "registernummer": "HRA 205647",
      "registerart": "HRA",
      "company_name": "Radoslaw Lukomski e. K.",
      "company_seat": "Buchholz in der Nordheide",
      "details": "29.01.2026 (Bekanntmachungsdatum)\n\nNiedersachsen Amtsgericht Tostedt HRA 205647\nRegisterbekanntmachung nach dem Umwandlungsgesetz 29.01.2026 (Eintragungsdatum)\n\nRadoslaw Lukomski e. K.\nEinzelkaufmann / Einzelkauffrau\nBuchholz in der Nordheide\n\nDen Gläubigern der an der Ausgliederung beteiligten Rechtsträger ist, wenn sie binnen sechs Monaten nach dem Tag, an dem die Eintragung der Ausgliederung in das Register des Sitzes desjenigen Rechtsträgers, dessen Gläubiger sie sind, nach § 19 Abs. 3 UmwG als bekannt gemacht gilt, ihren Anspruch nach Grund und Höhe schriftlich anmelden, Sicherheit zu leisten, soweit sie nicht Befriedigung verlangen können. Dieses Recht steht den Gläubigern jedoch nur zu, wenn sie glaubhaft machen, dass durch die Ausgliederung die Erfüllung der Forderung gefährdet wird."
    },
    {
      "date": "2026-01-29",
      "id": "143844",
      "original_text": "Registerbekanntmachung nach dem Umwandlungsgesetz\nNiedersachsen Amtsgericht Oldenburg (Oldenburg) HRB 219055\nBlack Pepper Solutions GmbH – Friesoythe",
      "type": "Registerbekanntmachung nach dem Umwandlungsgesetz",
      "state": "Niedersachsen",
      "amtsgericht": "Amtsgericht Oldenburg (Oldenburg)",
      "registernummer": "HRB 219055",
      "registerart": "HRB",
      "company_name": "Black Pepper Solutions GmbH",
      "company_seat": "Friesoythe",
      "details": "29.01.2026 (Bekanntmachungsdatum)\n\nNiedersachsen Amtsgericht Oldenburg (Oldenburg) HRB 219055\nRegisterbekanntmachung nach dem Umwandlungsgesetz 29.01.2026 (Eintragungsdatum)\n\nBlack Pepper Solutions GmbH\nGesellschaft mit beschränkter Haftung\nFriesoythe\n\nDen Gläubigern der an der Verschmelzung beteiligten Rechtsträger ist, wenn sie binnen sechs Monaten nach dem Tag, an dem die Eintragung der Verschmelzung in das Register des Sitzes desjenigen Rechtsträgers, dessen Gläubiger sie sind, nach § 19  Abs.  3 UmwG als bekannt gemacht gilt, ihren Anspruch nach Grund und Höhe schriftlich anmelden, Sicherheit zu leisten, soweit sie nicht Befriedigung verlangen können. Dieses Recht steht den Gläubigern jedoch nur zu, wenn sie glaubhaft machen, dass durch die Verschmelzung die Erfüllung der Forderung gefährdet wird."
    },
    {
      "date": "2026-01-29",
      "id": "143845",
      "original_text": "Registerbekanntmachung nach dem Umwandlungsgesetz\nNiedersachsen Amtsgericht Oldenburg (Oldenburg) HRB 222106\nGrimme Holding AG – Damme",
      "type": "Registerbekanntmachung nach dem Umwandlungsgesetz",
      "state": "Niedersachsen",
      "amtsgericht": "Amtsgericht Oldenburg (Oldenburg)",
      "registernummer": "HRB 222106",
      "registerart": "HRB",
      "company_name": "Grimme Holding AG",
      "company_seat": "Damme",
      "details": "29.01.2026 (Bekanntmachungsdatum)\n\nNiedersachsen Amtsgericht Oldenburg (Oldenburg) HRB 222106\nRegisterbekanntmachung nach dem Umwandlungsgesetz\n\nGrimme Holding AG\nAktiengesellschaft\nDamme\n\nDen Gläubigern der an der formwechselnden Umwandlung beteiligten Rechtsträger ist, wenn sie binnen sechs Monaten nach dem Tag, an dem die Eintragung der Umwandlung in das Register des Sitzes desjenigen Rechtsträgers, dessen Gläubiger sie sind, nach § 19 Abs. 3 UmwG als bekannt gemacht gilt, ihren Anspruch nach Grund und Höhe schriftlich anmelden, Sicherheit zu leisten, soweit sie nicht Befriedigung verlangen können. Dieses Recht steht den Gläubigern jedoch nur zu, wenn sie glaubhaft machen, dass durch die formwechselnde Umwandlung die Erfüllung der Forderung gefährdet wird."
    },
    {
      "date": "2026-01-29",
      "id": "143846",
      "original_text": "Registerbekanntmachung nach dem Umwandlungsgesetz\nNiedersachsen Amtsgericht Oldenburg (Oldenburg) HRB 218526\nJT Global Food GmbH – Friesoythe",
      "type": "Registerbekanntmachung nach dem Umwandlungsgesetz",
      "state": "Niedersachsen",
      "amtsgericht": "Amtsgericht Oldenburg (Oldenburg)",
      "registernummer": "HRB 218526",
      "registerart": "HRB",
      "company_name": "JT Global Food GmbH",
      "company_seat": "Friesoythe",
      "details": "29.01.2026 (Bekanntmachungsdatum)\n\nNiedersachsen Amtsgericht Oldenburg (Oldenburg) HRB 218526\nRegisterbekanntmachung nach dem Umwandlungsgesetz 29.01.2026 (Eintragungsdatum)\n\nJT Global Food GmbH\nGesellschaft mit beschränkter Haftung\nFriesoythe\n\nDen Gläubigern der an der Verschmelzung beteiligten Rechtsträger ist, wenn sie binnen sechs Monaten nach dem Tag, an dem die Eintragung der Verschmelzung in das Register des Sitzes desjenigen Rechtsträgers, dessen Gläubiger sie sind, nach § 19  Abs.  3 UmwG als bekannt gemacht gilt, ihren Anspruch nach Grund und Höhe schriftlich anmelden, Sicherheit zu leisten, soweit sie nicht Befriedigung verlangen können. Dieses Recht steht den Gläubigern jedoch nur zu, wenn sie glaubhaft machen, dass durch die Verschmelzung die Erfüllung der Forderung gefährdet wird."
    },
    {
      "date": "2026-01-29",
      "id": "143847",
      "original_text": "Registerbekanntmachung nach dem Umwandlungsgesetz\nBremen Amtsgericht Bremen HRB 28654\nWP Service Solutions GmbH – Bremen",
      "type": "Registerbekanntmachung nach dem Umwandlungsgesetz",
      "state": "Bremen",
      "amtsgericht": "Amtsgericht Bremen",
      "registernummer": "HRB 28654",
      "registerart": "HRB",
      "company_name": "WP Service Solutions GmbH",
      "company_seat": "Bremen",
      "details": "29.01.2026 (Bekanntmachungsdatum)\n\nBremen Amtsgericht Bremen HRB 28654\nRegisterbekanntmachung nach dem Umwandlungsgesetz 26.01.2026 (Eintragungsdatum)\n\nWP Service Solutions GmbH\nGesellschaft mit beschränkter Haftung\nBremen\n\nZu Eintragungsnummer 11 vom 26.01.2026 wird als nicht eingetragen veröffentlicht: Den Gläubigern der an der Verschmelzung beteiligten Rechtsträger ist, wenn sie binnen sechs Monaten nach dem Tag, an dem die Eintragung der Verschmelzung in das Register des Sitzes desjenigen Rechtsträgers, dessen Gläubiger sie sind, als bekannt gemacht gilt, ihren Anspruch nach Grund und Höhe schriftlich anmelden, Sicherheit zu leisten, soweit sie nicht Befriedigung verlangen können. Dieses Recht steht den Gläubigern jedoch nur zu, wenn sie glaubhaft machen, dass durch die Verschmelzung die Erfüllung ihrer Forderung gefährdet wird. Das Recht, Sicherheitsleistung zu verlangen, steht Gläubigern nicht zu, die im Falle der Insolvenz ein Recht auf vorzugsweise Befriedigung aus einer Deckungsmasse haben, die nach gesetzlicher Vorschrift zu ihrem Schutz errichtet und staatlich überwacht ist."
    },
    {
      "date": "2026-01-29",
      "id": "143848",
      "original_text": "Löschungsankündigung\nBremen Amtsgericht Bremen HRB 41519\nEXPERT BAU UND VERKEHRS LOGISTIK GMBH – Bremen",
      "type": "Löschungsankündigung",
      "state": "Bremen",
      "amtsgericht": "Amtsgericht Bremen",
      "registernummer": "HRB 41519",
      "registerart": "HRB",
      "company_name": "EXPERT BAU UND VERKEHRS LOGISTIK GMBH",
      "company_seat": "Bremen",
      "details": "29.01.2026 (Bekanntmachungsdatum)\n\nBremen Amtsgericht Bremen HRB 41519\nLöschungsankündigung\n\nEXPERT BAU UND VERKEHRS LOGISTIK GMBH\nGesellschaft mit beschränkter Haftung\nBremen\n\nEs ist beabsichtigt die im Handelsregister eingetragene Gesellschaft von Amts wegen gemäß § 394 FamFG zu löschen. Gegen die Löschung kann beim AG Bremen schriftlich oder zu Protokoll der Geschäftsstelle Widerspruch eingelegt werden. Widerspruchsfrist 4 Wochen."
    },
    {
      "date": "2026-01-29",
      "id": "143849",
      "original_text": "Einreichung neuer Dokumente\nBremen Amtsgericht Bremen HRB 19116\nePhilos Aktiengesellschaft – Bremen",
      "type": "Einreichung neuer Dokumente",
      "state": "Bremen",
      "amtsgericht": "Amtsgericht Bremen",
      "registernummer": "HRB 19116",
      "registerart": "HRB",
      "company_name": "ePhilos Aktiengesellschaft",
      "company_seat": "Bremen",
      "details": "29.01.2026 (Bekanntmachungsdatum)\n\nBremen Amtsgericht Bremen HRB 19116\nEinreichung neuer Dokumente\n\nePhilos Aktiengesellschaft\nAktiengesellschaft\nBremen\n\nAls nicht eingetragen wird bekannt gemacht: Liste des Aufsichtsrats wurde eingereicht."
    },
    {
      "date": "2026-01-29",
      "id": "143850",
      "original_text": "Registerbekanntmachung nach dem Umwandlungsgesetz\nBremen Amtsgericht Bremen HRB 26102\nTrust-IT GmbH – Bremen",
      "type": "Registerbekanntmachung nach dem Umwandlungsgesetz",
      "state": "Bremen",
      "amtsgericht": "Amtsgericht Bremen",
      "registernummer": "HRB 26102",
      "registerart": "HRB",
      "company_name": "Trust-IT GmbH",
      "company_seat": "Bremen",
      "details": "29.01.2026 (Bekanntmachungsdatum)\n\nBremen Amtsgericht Bremen HRB 26102\nRegisterbekanntmachung nach dem Umwandlungsgesetz 26.01.2026 (Eintragungsdatum)\n\nTrust-IT GmbH\nGesellschaft mit beschränkter Haftung\nBremen\n\nZu Eintragungsnummer 8 vom 26.01.2026 wird als nicht eingetragen veröffentlicht: Den Gläubigern der an der Verschmelzung beteiligten Rechtsträger ist, wenn sie binnen sechs Monaten nach dem Tag, an dem die Eintragung der Verschmelzung in das Register des Sitzes desjenigen Rechtsträgers, dessen Gläubiger sie sind, als bekannt gemacht gilt, ihren Anspruch nach Grund und Höhe schriftlich anmelden, Sicherheit zu leisten, soweit sie nicht Befriedigung verlangen können. Dieses Recht steht den Gläubigern jedoch nur zu, wenn sie glaubhaft machen, dass durch die Verschmelzung die Erfüllung ihrer Forderung gefährdet wird. Das Recht, Sicherheitsleistung zu verlangen, steht Gläubigern nicht zu, die im Falle der Insolvenz ein Recht auf vorzugsweise Befriedigung aus einer Deckungsmasse haben, die nach gesetzlicher Vorschrift zu ihrem Schutz errichtet und staatlich überwacht ist."
    },
    {
      "date": "2026-01-29",
      "id": "143851",
      "original_text": "Registerbekanntmachung nach dem Umwandlungsgesetz\nBremen Amtsgericht Bremen HRB 12175\nbrevido GmbH – Bremen",
      "type": "Registerbekanntmachung nach dem Umwandlungsgesetz",
      "state": "Bremen",
      "amtsgericht": "Amtsgericht Bremen",
      "registernummer": "HRB 12175",
      "registerart": "HRB",
      "company_name": "brevido GmbH",
      "company_seat": "Bremen",
      "details": "29.01.2026 (Bekanntmachungsdatum)\n\nBremen Amtsgericht Bremen HRB 12175\nRegisterbekanntmachung nach dem Umwandlungsgesetz 26.01.2026 (Eintragungsdatum)\n\nbrevido GmbH\nGesellschaft mit beschränkter Haftung\nBremen\n\nZu Eintragungsnummer 10 vom 26.01.2026 wird als nicht eingetragen veröffentlicht: Den Gläubigern der an der Verschmelzung beteiligten Rechtsträger ist, wenn sie binnen sechs Monaten nach dem Tag, an dem die Eintragung der Verschmelzung in das Register des Sitzes desjenigen Rechtsträgers, dessen Gläubiger sie sind, als bekannt gemacht gilt, ihren Anspruch nach Grund und Höhe schriftlich anmelden, Sicherheit zu leisten, soweit sie nicht Befriedigung verlangen können. Dieses Recht steht den Gläubigern jedoch nur zu, wenn sie glaubhaft machen, dass durch die Verschmelzung die Erfüllung ihrer Forderung gefährdet wird. Das Recht, Sicherheitsleistung zu verlangen, steht Gläubigern nicht zu, die im Falle der Insolvenz ein Recht auf vorzugsweise Befriedigung aus einer Deckungsmasse haben, die nach gesetzlicher Vorschrift zu ihrem Schutz errichtet und staatlich überwacht ist."
    },
    {
      "date": "2026-01-29",
      "id": "143852",
      "original_text": "Löschungsankündigung\nRheinland-Pfalz Amtsgericht Ludwigshafen a.Rhein (Ludwigshafen) HRB 69418\nF.Y.K. Personalservice UG (haftungsbeschränkt) – Ludwigshafen am Rhein",
      "type": "Löschungsankündigung",
      "state": "Rheinland-Pfalz",
      "amtsgericht": "Amtsgericht Ludwigshafen a.Rhein (Ludwigshafen)",
      "registernummer": "HRB 69418",
      "registerart": "HRB",
      "company_name": "F.Y.K. Personalservice UG (haftungsbeschränkt)",
      "company_seat": "Ludwigshafen am Rhein",
      "details": "29.01.2026 (Bekanntmachungsdatum)\n\nRheinland-Pfalz Amtsgericht Ludwigshafen a.Rhein (Ludwigshafen) HRB 69418\nLöschungsankündigung 29.01.2026 (Eintragungsdatum)\n\nF.Y.K. Personalservice UG (haftungsbeschränkt)\nGesellschaft mit beschränkter Haftung\nLudwigshafen am Rhein\n\nDas Registergericht beabsichtigt die Gesellschaft von Amts wegen nach § 394 FamFG zu löschen. Die Frist zur Erhebung eines Widerspruchs ist auf einen Monat festgesetzt."
    },
    {
      "date": "2026-01-29",
      "id": "143853",
      "original_text": "Löschungsankündigung\nRheinland-Pfalz Amtsgericht Ludwigshafen a.Rhein (Ludwigshafen) HRB 64519\nMega-tronic UG (haftungsbeschränkt) – Ludwigshafen am Rhein",
      "type": "Löschungsankündigung",
      "state": "Rheinland-Pfalz",
      "amtsgericht": "Amtsgericht Ludwigshafen a.Rhein (Ludwigshafen)",
      "registernummer": "HRB 64519",
      "registerart": "HRB",
      "company_name": "Mega-tronic UG (haftungsbeschränkt)",
      "company_seat": "Ludwigshafen am Rhein",
      "details": "29.01.2026 (Bekanntmachungsdatum)\n\nRheinland-Pfalz Amtsgericht Ludwigshafen a.Rhein (Ludwigshafen) HRB 64519\nLöschungsankündigung 29.01.2026 (Eintragungsdatum)\n\nMega-tronic UG (haftungsbeschränkt)\nGesellschaft mit beschränkter Haftung\nLudwigshafen am Rhein\n\nDas Registergericht beabsichtigt die Gesellschaft von Amts wegen nach § 394 FamFG zu löschen. Die Frist zur Erhebung eines Widerspruchs ist auf einen Monat festgesetzt."
    },
    {
      "date": "2026-01-29",
      "id": "143854",
      "original_text": "Registerbekanntmachung nach dem Umwandlungsgesetz\nRheinland-Pfalz Amtsgericht Mainz HRA 44824\nManuela Böhm-Schlegl Betriebsaufspaltung Gonsenheim e. K. – Mainz",
      "type": "Registerbekanntmachung nach dem Umwandlungsgesetz",
      "state": "Rheinland-Pfalz",
      "amtsgericht": "Amtsgericht Mainz",
      "registernummer": "HRA 44824",
      "registerart": "HRA",
      "company_name": "Manuela Böhm-Schlegl Betriebsaufspaltung Gonsenheim e. K.",
      "company_seat": "Mainz",
      "details": "29.01.2026 (Bekanntmachungsdatum)\n\nRheinland-Pfalz Amtsgericht Mainz HRA 44824\nRegisterbekanntmachung nach dem Umwandlungsgesetz 29.01.2026 (Eintragungsdatum)\n\nManuela Böhm-Schlegl Betriebsaufspaltung Gonsenheim e. K.\nEinzelkaufmann / Einzelkauffrau\nMainz\n\nAls nicht eingetragen wird veröffentlicht: Den Gläubigern der an der Ausgliederung beteiligten Rechtsträger ist, wenn sie binnen sechs Monaten nach dem Tag, an dem die Eintragung der Ausgliederung in das Register des Sitzes desjenigen Rechtsträgers, dessen Gläubiger sie sind, nach § 19 Abs. 3 UmwG als bekannt gemacht gilt, ihren Anspruch nach Grund und Höhe schriftlich anmelden, Sicherheit zu leisten, soweit sie nicht Befriedigung verlangen können. Dieses Recht steht den Gläubigern jedoch nur zu, wenn sie glaubhaft machen, dass durch die Ausgliederung die Erfüllung der Forderung gefährdet wird."
    },
    {
      "date": "2026-01-29",
      "id": "143855",
      "original_text": "Sonstige Registerbekanntmachung\nRheinland-Pfalz Amtsgericht Mainz HRB 51356\nJUWI GmbH – Wörrstadt",
      "type": "Sonstige Registerbekanntmachung",
      "state": "Rheinland-Pfalz",
      "amtsgericht": "Amtsgericht Mainz",
      "registernummer": "HRB 51356",
      "registerart": "HRB",
      "company_name": "JUWI GmbH",
      "company_seat": "Wörrstadt",
      "details": "29.01.2026 (Bekanntmachungsdatum)\n\nRheinland-Pfalz Amtsgericht Mainz HRB 51356\nSonstige Registerbekanntmachung\n\nJUWI GmbH\nGesellschaft mit beschränkter Haftung\nWörrstadt\n\nDem Registergericht ist eine neue Liste der Mitglieder des Aufsichtsrates eingereicht worden."
    },
    {
      "date": "2026-01-29",
      "id": "143856",
      "original_text": "Registerbekanntmachung nach dem Umwandlungsgesetz\nRheinland-Pfalz Amtsgericht Mainz HRA 44921\nManuela Böhm-Schlegl Gonsenheim UG (haftungsbeschränkt) & Co. KG – Mainz",
      "type": "Registerbekanntmachung nach dem Umwandlungsgesetz",
      "state": "Rheinland-Pfalz",
      "amtsgericht": "Amtsgericht Mainz",
      "registernummer": "HRA 44921",
      "registerart": "HRA",
      "company_name": "Manuela Böhm-Schlegl Gonsenheim UG (haftungsbeschränkt) & Co. KG",
      "company_seat": "Mainz",
      "details": "29.01.2026 (Bekanntmachungsdatum)\n\nRheinland-Pfalz Amtsgericht Mainz HRA 44921\nRegisterbekanntmachung nach dem Umwandlungsgesetz 29.01.2026 (Eintragungsdatum)\n\nManuela Böhm-Schlegl Gonsenheim UG (haftungsbeschränkt) & Co. KG\nKommanditgesellschaft\nMainz\n\nAls nicht eingetragen wird veröffentlicht: Den Gläubigern der an der Ausgliederung beteiligten Rechtsträger ist, wenn sie binnen sechs Monaten nach dem Tag, an dem die Eintragung der Ausgliederung in das Register des Sitzes desjenigen Rechtsträgers, dessen Gläubiger sie sind, nach § 19 Abs. 3 UmwG als bekannt gemacht gilt, ihren Anspruch nach Grund und Höhe schriftlich anmelden, Sicherheit zu leisten, soweit sie nicht Befriedigung verlangen können. Dieses Recht steht den Gläubigern jedoch nur zu, wenn sie glaubhaft machen, dass durch die Ausgliederung die Erfüllung der Forderung gefährdet wird."
    },
    {
      "date": "2026-01-29",
      "id": "143857",
      "original_text": "Einreichung neuer Dokumente\nRheinland-Pfalz Amtsgericht Ludwigshafen a.Rhein (Ludwigshafen) HRB 64198\nSuperior Industries Europe AG – Bad Dürkheim",
      "type": "Einreichung neuer Dokumente",
      "state": "Rheinland-Pfalz",
      "amtsgericht": "Amtsgericht Ludwigshafen a.Rhein (Ludwigshafen)",
      "registernummer": "HRB 64198",
      "registerart": "HRB",
      "company_name": "Superior Industries Europe AG",
      "company_seat": "Bad Dürkheim",
      "details": "29.01.2026 (Bekanntmachungsdatum)\n\nRheinland-Pfalz Amtsgericht Ludwigshafen a.Rhein (Ludwigshafen) HRB 64198\nEinreichung neuer Dokumente\n\nSuperior Industries Europe AG\nAktiengesellschaft\nBad Dürkheim\n\nDem Registergericht ist eine neue Liste der Mitglieder des Aufsichtsrates eingereicht worden."
    },
    {
      "date": "2026-01-29",
      "id": "143858",
      "original_text": "Löschungsankündigung\nRheinland-Pfalz Amtsgericht Mainz HRB 5405\nTREUKAPITAL Treuhandverwaltung Gesellschaft mit beschränkter Haftung – Klein-Winternheim",
      "type": "Löschungsankündigung",
      "state": "Rheinland-Pfalz",
      "amtsgericht": "Amtsgericht Mainz",
      "registernummer": "HRB 5405",
      "registerart": "HRB",
      "company_name": "TREUKAPITAL Treuhandverwaltung Gesellschaft mit beschränkter Haftung",
      "company_seat": "Klein-Winternheim",
      "details": "29.01.2026 (Bekanntmachungsdatum)\n\nRheinland-Pfalz Amtsgericht Mainz HRB 5405\nLöschungsankündigung\n\nTREUKAPITAL Treuhandverwaltung Gesellschaft mit beschränkter Haftung\nGesellschaft mit beschränkter Haftung\nKlein-Winternheim\n\nDas Registergericht beabsichtigt die Gesellschaft von Amts wegen nach § 394 FamFG zu löschen. Die Frist zur Erhebung eines Widerspruchs ist auf einen Monat festgesetzt."
    },
    {
      "date": "2026-01-29",
      "id": "143859",
      "original_text": "Registerbekanntmachung nach dem Umwandlungsgesetz\nNordrhein-Westfalen Amtsgericht Paderborn HRB 15901\nINTILION Aktiengesellschaft – Paderborn",
      "type": "Registerbekanntmachung nach dem Umwandlungsgesetz",
      "state": "Nordrhein-Westfalen",
      "amtsgericht": "Amtsgericht Paderborn",
      "registernummer": "HRB 15901",
      "registerart": "HRB",
      "company_name": "INTILION Aktiengesellschaft",
      "company_seat": "Paderborn",
      "details": "29.01.2026 (Bekanntmachungsdatum)\n\nNordrhein-Westfalen Amtsgericht Paderborn HRB 15901\nRegisterbekanntmachung nach dem Umwandlungsgesetz 29.01.2026 (Eintragungsdatum)\n\nINTILION Aktiengesellschaft\nAktiengesellschaft\nPaderborn\n\nDie Gesellschaft hat Gläubigern, deren Forderungen vor dieser Bekanntmachung begründet worden sind, Sicherheit zu leisten, soweit sie nicht Befriedigung verlangen können, wenn sie sich binnen sechs Monaten zu diesem Zweck melden."
    },
    {
      "date": "2026-01-29",
      "id": "143860",
      "original_text": "Einreichung neuer Dokumente\nNordrhein-Westfalen Amtsgericht Düsseldorf HRB 57104\nUniper Kraftwerke GmbH – Düsseldorf",
      "type": "Einreichung neuer Dokumente",
      "state": "Nordrhein-Westfalen",
      "amtsgericht": "Amtsgericht Düsseldorf",
      "registernummer": "HRB 57104",
      "registerart": "HRB",
      "company_name": "Uniper Kraftwerke GmbH",
      "company_seat": "Düsseldorf",
      "details": "29.01.2026 (Bekanntmachungsdatum)\n\nNordrhein-Westfalen Amtsgericht Düsseldorf HRB 57104\nEinreichung neuer Dokumente 29.01.2026 (Eintragungsdatum)\n\nUniper Kraftwerke GmbH\nGesellschaft mit beschränkter Haftung\nDüsseldorf\n\nDem Registergericht ist eine neue Liste der Mitglieder des Aufsichtsrates eingereicht worden."
    },
    {
      "date": "2026-01-29",
      "id": "143861",
      "original_text": "Registerbekanntmachung nach dem Umwandlungsgesetz\nNordrhein-Westfalen Amtsgericht Duisburg HRB 35964\nTransdev Verkehr GmbH – Duisburg",
      "type": "Registerbekanntmachung nach dem Umwandlungsgesetz",
      "state": "Nordrhein-Westfalen",
      "amtsgericht": "Amtsgericht Duisburg",
      "registernummer": "HRB 35964",
      "registerart": "HRB",
      "company_name": "Transdev Verkehr GmbH",
      "company_seat": "Duisburg",
      "details": "29.01.2026 (Bekanntmachungsdatum)\n\nNordrhein-Westfalen Amtsgericht Duisburg HRB 35964\nRegisterbekanntmachung nach dem Umwandlungsgesetz 29.01.2026 (Eintragungsdatum)\n\nTransdev Verkehr GmbH\nGesellschaft mit beschränkter Haftung\nDuisburg\n\nDie Gesellschaft hat Gläubigern, deren Forderungen vor dieser Bekanntmachung begründet worden sind, Sicherheit zu leisten, soweit sie nicht Befriedigung verlangen können, wenn sie sich binnen sechs Monaten zu diesem Zweck melden."
    },
    {
      "date": "2026-01-29",
      "id": "143862",
      "original_text": "Löschungsankündigung\nNordrhein-Westfalen Amtsgericht Gütersloh HRB 5556\nGerhard Wonnemann, Holzwerk, Gesellschaft mit beschränkter Haftung – Rheda-Wiedenbrück",
      "type": "Löschungsankündigung",
      "state": "Nordrhein-Westfalen",
      "amtsgericht": "Amtsgericht Gütersloh",
      "registernummer": "HRB 5556",
      "registerart": "HRB",
      "company_name": "Gerhard Wonnemann, Holzwerk, Gesellschaft mit beschränkter Haftung",
      "company_seat": "Rheda-Wiedenbrück",
      "details": "29.01.2026 (Bekanntmachungsdatum)\n\nNordrhein-Westfalen Amtsgericht Gütersloh HRB 5556\nLöschungsankündigung 29.01.2026 (Eintragungsdatum)\n\nGerhard Wonnemann, Holzwerk, Gesellschaft mit beschränkter Haftung\nGesellschaft mit beschränkter Haftung\nRheda-Wiedenbrück\n\nDas Registergericht beabsichtigt die Gesellschaft von Amts wegen nach § 394 FamFG zu löschen. Die Frist zur Erhebung eines Widerspruchs ist auf einen Monat festgesetzt."
    },
    {
      "date": "2026-01-29",
      "id": "143863",
      "original_text": "Registerbekanntmachung nach dem Umwandlungsgesetz\nNordrhein-Westfalen Amtsgericht Gelsenkirchen HRB 19550\nDegener Service GmbH – Bottrop",
      "type": "Registerbekanntmachung nach dem Umwandlungsgesetz",
      "state": "Nordrhein-Westfalen",
      "amtsgericht": "Amtsgericht Gelsenkirchen",
      "registernummer": "HRB 19550",
      "registerart": "HRB",
      "company_name": "Degener Service GmbH",
      "company_seat": "Bottrop",
      "details": "29.01.2026 (Bekanntmachungsdatum)\n\nNordrhein-Westfalen Amtsgericht Gelsenkirchen HRB 19550\nRegisterbekanntmachung nach dem Umwandlungsgesetz 29.01.2026 (Eintragungsdatum)\n\nDegener Service GmbH\nGesellschaft mit beschränkter Haftung\nBottrop\n\nDen Gläubigern der an der Ausgliederung beteiligten Rechtsträger ist, wenn sie binnen sechs Monaten nach dem Tag, an dem die Eintragung der Ausgliederung in das Register des Sitzes desjenigen Rechtsträgers, dessen Gläubiger sie sind, nach § 19 Absatz 3 UmwG als bekanntgemacht gilt, ihren Anspruch nach Grund und Höhe schriftlich anmelden, Sicherheit zu leisten, soweit sie nicht Befriedigung verlangen können. Dieses Recht steht den Gläubigern jedoch nur zu, wenn sie glaubhaft machen, dass durch die Ausgliederung die Erfüllung ihrer Forderung gefährdet wird."
    },
    {
      "date": "2026-01-29",
      "id": "143864",
      "original_text": "Registerbekanntmachung nach dem Umwandlungsgesetz\nNordrhein-Westfalen Amtsgericht Hagen HRA 490\nWilhelm Hedtmann GmbH & Co. KG – Hagen",
      "type": "Registerbekanntmachung nach dem Umwandlungsgesetz",
      "state": "Nordrhein-Westfalen",
      "amtsgericht": "Amtsgericht Hagen",
      "registernummer": "HRA 490",
      "registerart": "HRA",
      "company_name": "Wilhelm Hedtmann GmbH & Co. KG",
      "company_seat": "Hagen",
      "details": "29.01.2026 (Bekanntmachungsdatum)\n\nNordrhein-Westfalen Amtsgericht Hagen HRA 490\nRegisterbekanntmachung nach dem Umwandlungsgesetz 29.01.2026 (Eintragungsdatum)\n\nWilhelm Hedtmann GmbH & Co. KG\nKommanditgesellschaft\nHagen\n\nDen Gläubigern der an der Verschmelzung beteiligten Rechtsträger ist, wenn sie binnen sechs Monaten nach dem Tag, an dem die Eintragung der Verschmelzung in das Register des Sitzes derjenigen Rechtsträger deren Gläubiger sie sind, nach § 19 Absatz 3 UmwG als bekanntgemacht gilt, ihren Anspruch nach Grund und Höhe schriftlich anmelden, Sicherheit zu leisten, soweit sie nicht Befriedigung verlangen können. Dieses Recht steht den Gläubigern jedoch nur zu, wenn sie glaubhaft machen, dass durch die Verschmelzung die Erfüllung ihrer Forderung gefährdet wird."
    },
    {
      "date": "2026-01-29",
      "id": "143865",
      "original_text": "Löschungsankündigung\nNordrhein-Westfalen Amtsgericht Duisburg HRB 35332\n4 Brüder GmbH – Duisburg",
      "type": "Löschungsankündigung",
      "state": "Nordrhein-Westfalen",
      "amtsgericht": "Amtsgericht Duisburg",
      "registernummer": "HRB 35332",
      "registerart": "HRB",
      "company_name": "4 Brüder GmbH",
      "company_seat": "Duisburg",
      "details": "29.01.2026 (Bekanntmachungsdatum)\n\nNordrhein-Westfalen Amtsgericht Duisburg HRB 35332\nLöschungsankündigung\n\n4 Brüder GmbH\nGesellschaft mit beschränkter Haftung\nDuisburg\n\nDas Registergericht beabsichtigt, die im Handelsregister unter HRB 35332  eingetragene Gesellschaft 4 Brüder GmbH  gemäß § 394 FamFG wegen Vermögenslosigkeit von Amts wegen zu löschen. Gegen diese Verfügung kann Widerspruch eingelegt werden. Die Frist zur Erhebung eines Widerspruchs gegen die beabsichtigte Löschung von Amts wegen ist auf drei Monate festgesetzt. Rechtsbehelfsbelehrung Der Widerspruch ist bei dem Amtsgericht Duisburg, Kardinal-Galen-Str. 124-132, 47058 Duisburg schriftlich in deutscher Sprache oder zur Niederschrift der Geschäftsstelle einzulegen. Der Widerspruch kann auch zur Niederschrift der Geschäftsstelle eines jeden Amtsgerichtes abgegeben werden. Die Einlegung ist auch durch Übertragung eines elektronischen Dokuments an die elektronische Poststelle des Gerichts möglich. Das elektronische Dokument muss für die Bearbeitung durch das Gericht geeignet und mit einer qualifizierten elektronischen Signatur der verantwortenden Person versehen sein oder von der verantwortenden Person signiert und auf einem sicheren Übermittlungsweg gemäß § 130 a ZPO nach näherer Maßgabe der Verordnung über die technischen Rahmenbedingungen des elektronischen Rechtsverkehrs und über das besondere elektronische Behördenpostfach (BGBl. I, S. 3803) eingereicht werden. Weitere Informationen erhalten Sie auf der Internetseite www.justiz.de <http://www.justiz.de>. Der Widerspruch muss spätestens innerhalb der gesetzten Frist bei dem Amtsgericht Duisburg eingegangen sein. Dies gilt auch dann, wenn der Widerspruch zur Niederschrift der Geschäftsstelle eines anderen Amtsgerichtes abgegeben wurde. Die Frist beginnt mit der Veröffentlichung. Fällt das Ende der Frist auf einen Sonntag, einen allgemeinen Feiertag oder Sonnabend, so endet die Frist mit Ablauf des nächsten Werktages. Der Widerspruch muss die Bezeichnung der angefochtenen Verfügung sowie die Erklärung enthalten, dass Widerspruch gegen diese Verfügung eingelegt wird. Er ist zu unterzeichnen und soll begründet werden."
    },
    {
      "date": "2026-01-29",
      "id": "143866",
      "original_text": "Löschungsankündigung\nNordrhein-Westfalen Amtsgericht Siegen HRB 6163\nMTK GmbH Metalltechnik Kirchveischede – Lennestadt",
      "type": "Löschungsankündigung",
      "state": "Nordrhein-Westfalen",
      "amtsgericht": "Amtsgericht Siegen",
      "registernummer": "HRB 6163",
      "registerart": "HRB",
      "company_name": "MTK GmbH Metalltechnik Kirchveischede",
      "company_seat": "Lennestadt",
      "details": "29.01.2026 (Bekanntmachungsdatum)\n\nNordrhein-Westfalen Amtsgericht Siegen HRB 6163\nLöschungsankündigung\n\nMTK GmbH Metalltechnik Kirchveischede\nGesellschaft mit beschränkter Haftung\nLennestadt\n\nDas Registergericht beabsichtigt die Gesellschaft von Amts wegen nach § 394 FamFG zu löschen. Die Frist zur Erhebung eines Widerspruchs ist auf drei Monate festgesetzt."
    },
    {
      "date": "2026-01-29",
      "id": "143867",
      "original_text": "Einreichung neuer Dokumente\nNordrhein-Westfalen Amtsgericht Düsseldorf HRB 77425\nUniper SE – Düsseldorf",
      "type": "Einreichung neuer Dokumente",
      "state": "Nordrhein-Westfalen",
      "amtsgericht": "Amtsgericht Düsseldorf",
      "registernummer": "HRB 77425",
      "registerart": "HRB",
      "company_name": "Uniper SE",
      "company_seat": "Düsseldorf",
      "details": "29.01.2026 (Bekanntmachungsdatum)\n\nNordrhein-Westfalen Amtsgericht Düsseldorf HRB 77425\nEinreichung neuer Dokumente\n\nUniper SE\nEuropäische Aktiengesellschaft (SE)\nDüsseldorf\n\nDem Registergericht ist eine Liste der Mitglieder des Aufsichtsrates eingereicht worden."
    },
    {
      "date": "2026-01-29",
      "id": "143868",
      "original_text": "Löschungsankündigung\nNordrhein-Westfalen Amtsgericht Siegen HRB 8943\nKüchen-Designstudio Siegerland GmbH – Siegen",
      "type": "Löschungsankündigung",
      "state": "Nordrhein-Westfalen",
      "amtsgericht": "Amtsgericht Siegen",
      "registernummer": "HRB 8943",
      "registerart": "HRB",
      "company_name": "Küchen-Designstudio Siegerland GmbH",
      "company_seat": "Siegen",
      "details": "29.01.2026 (Bekanntmachungsdatum)\n\nNordrhein-Westfalen Amtsgericht Siegen HRB 8943\nLöschungsankündigung\n\nKüchen-Designstudio Siegerland GmbH\nGesellschaft mit beschränkter Haftung\nSiegen\n\nDas Registergericht beabsichtigt die Gesellschaft von Amts wegen nach § 394 FamFG zu löschen. Die Frist zur Erhebung eines Widerspruchs ist auf drei Monate festgesetzt."
    },
    {
      "date": "2026-01-29",
      "id": "143869",
      "original_text": "Sonstige Registerbekanntmachung\nNordrhein-Westfalen Amtsgericht Mönchengladbach HRB 5912\nNEW AG – Mönchengladbach",
      "type": "Sonstige Registerbekanntmachung",
      "state": "Nordrhein-Westfalen",
      "amtsgericht": "Amtsgericht Mönchengladbach",
      "registernummer": "HRB 5912",
      "registerart": "HRB",
      "company_name": "NEW AG",
      "company_seat": "Mönchengladbach",
      "details": "29.01.2026 (Bekanntmachungsdatum)\n\nNordrhein-Westfalen Amtsgericht Mönchengladbach HRB 5912\nSonstige Registerbekanntmachung 29.01.2026 (Eintragungsdatum)\n\nNEW AG\nAktiengesellschaft\nMönchengladbach\n\n106 AktG\nDem Registergericht ist eine Liste der Mitglieder des Aufsichtsrates eingereicht worden."
    },
    {
      "date": "2026-01-29",
      "id": "143870",
      "original_text": "Registerbekanntmachung nach dem Umwandlungsgesetz\nNordrhein-Westfalen Amtsgericht Duisburg HRB 36227\nRegionalbus West GmbH – Duisburg",
      "type": "Registerbekanntmachung nach dem Umwandlungsgesetz",
      "state": "Nordrhein-Westfalen",
      "amtsgericht": "Amtsgericht Duisburg",
      "registernummer": "HRB 36227",
      "registerart": "HRB",
      "company_name": "Regionalbus West GmbH",
      "company_seat": "Duisburg",
      "details": "29.01.2026 (Bekanntmachungsdatum)\n\nNordrhein-Westfalen Amtsgericht Duisburg HRB 36227\nRegisterbekanntmachung nach dem Umwandlungsgesetz 29.01.2026 (Eintragungsdatum)\n\nRegionalbus West GmbH\nGesellschaft mit beschränkter Haftung\nDuisburg\n\nDie Gesellschaft hat Gläubigern, deren Forderungen vor dieser Bekanntmachung begründet worden sind, Sicherheit zu leisten, soweit sie nicht Befriedigung verlangen können, wenn sie sich binnen sechs Monaten zu diesem Zweck melden."
    },
    {
      "date": "2026-01-29",
      "id": "143871",
      "original_text": "Registerbekanntmachung nach dem Umwandlungsgesetz\nNordrhein-Westfalen Amtsgericht Gütersloh HRB 1573\nPannhorst GmbH – Gütersloh",
      "type": "Registerbekanntmachung nach dem Umwandlungsgesetz",
      "state": "Nordrhein-Westfalen",
      "amtsgericht": "Amtsgericht Gütersloh",
      "registernummer": "HRB 1573",
      "registerart": "HRB",
      "company_name": "Pannhorst GmbH",
      "company_seat": "Gütersloh",
      "details": "29.01.2026 (Bekanntmachungsdatum)\n\nNordrhein-Westfalen Amtsgericht Gütersloh HRB 1573\nRegisterbekanntmachung nach dem Umwandlungsgesetz 29.01.2026 (Eintragungsdatum)\n\nPannhorst GmbH\nGesellschaft mit beschränkter Haftung\nGütersloh\n\nDen Gläubigern der an der Verschmelzung beteiligten Rechtsträger ist, wenn sie binnen sechs Monaten nach dem Tag, an dem die Eintragung der Verschmelzung in das Register des Sitzes desjenigen Rechtsträgers, dessen Gläubiger sie sind, nach § 19 Absatz 3 UmwG als bekanntgemacht gilt, ihren Anspruch nach Grund und Höhe schriftlich anmelden, Sicherheit zu leisten, soweit sie nicht Befriedigung verlangen können. Dieses Recht steht den Gläubigern jedoch nur zu, wenn sie glaubhaft machen, dass durch die Verschmelzung die Erfüllung ihrer Forderung gefährdet wird."
    },
    {
      "date": "2026-01-29",
      "id": "143872",
      "original_text": "Registerbekanntmachung nach dem Umwandlungsgesetz\nNordrhein-Westfalen Amtsgericht Gelsenkirchen HRA 6235\nDegener Service e.K. – Bottrop",
      "type": "Registerbekanntmachung nach dem Umwandlungsgesetz",
      "state": "Nordrhein-Westfalen",
      "amtsgericht": "Amtsgericht Gelsenkirchen",
      "registernummer": "HRA 6235",
      "registerart": "HRA",
      "company_name": "Degener Service e.K.",
      "company_seat": "Bottrop",
      "details": "29.01.2026 (Bekanntmachungsdatum)\n\nNordrhein-Westfalen Amtsgericht Gelsenkirchen HRA 6235\nRegisterbekanntmachung nach dem Umwandlungsgesetz 29.01.2026 (Eintragungsdatum)\n\nDegener Service e.K.\nEinzelkaufmann / Einzelkauffrau\nBottrop\n\nDen Gläubigern der an der Ausgliederung beteiligten Rechtsträger ist, wenn sie binnen sechs Monaten nach dem Tag, an dem die Eintragung der Ausgliederung in das Register des Sitzes desjenigen Rechtsträgers, dessen Gläubiger sie sind, nach § 19 Absatz 3 UmwG als bekanntgemacht gilt, ihren Anspruch nach Grund und Höhe schriftlich anmelden, Sicherheit zu leisten, soweit sie nicht Befriedigung verlangen können. Dieses Recht steht den Gläubigern jedoch nur zu, wenn sie glaubhaft machen, dass durch die Ausgliederung die Erfüllung ihrer Forderung gefährdet wird."
    },
    {
      "date": "2026-01-29",
      "id": "143873",
      "original_text": "Löschungsankündigung\nNordrhein-Westfalen Amtsgericht Düsseldorf HRA 25980\nHerkules Intelligent Technology GmbH & Co. KG – Düsseldorf",
      "type": "Löschungsankündigung",
      "state": "Nordrhein-Westfalen",
      "amtsgericht": "Amtsgericht Düsseldorf",
      "registernummer": "HRA 25980",
      "registerart": "HRA",
      "company_name": "Herkules Intelligent Technology GmbH & Co. KG",
      "company_seat": "Düsseldorf",
      "details": "29.01.2026 (Bekanntmachungsdatum)\n\nNordrhein-Westfalen Amtsgericht Düsseldorf HRA 25980\nLöschungsankündigung\n\nHerkules Intelligent Technology GmbH & Co. KG\nKommanditgesellschaft\nDüsseldorf\n\nBetr.: Herkules Intelligent Technology GmbH & Co. KG, c/o Kieffer Stübben & Partner, Rather Str. 111a, 40476 Düsseldorf\n\nDas Registergericht beabsichtigt die Firma von Amts wegen nach § 394 Abs. 4 FamFG zu löschen, da offenbar keine Vermögenswerte mehr vorhanden sind und bereits die persönlich haftende Gesellschafterin wegen Vermögenslosigkeit gelöscht worden ist.\nDie Frist zur Erhebung eines Widerspruchs ist auf einen Monat festgesetzt.\n\nRechtsbehelfsbelehrung:\n\nDas Widerspruchsrecht steht jedem zu, der an der Unterlassung der Löschung ein berechtigtes Interesse hat. Der Widerspruch ist bei dem Amtsgericht Düsseldorf -Registergericht-, Werdener Straße 1, 40227 Düsseldorf schriftlich in deutscher Sprache oder zur Niederschrift der Geschäftsstelle einzulegen. Der Widerspruch kann auch zur Niederschrift der Geschäftsstelle eines jeden Amtsgerichtes abgegeben werden. Die Einlegung ist auch durch Übertragung eines elektronischen Dokuments an die elektronische Poststelle des Gerichts möglich. Das elektronische Dokument muss für die Bearbeitung durch das Gericht geeignet und mit einer qualifizierten elektronischen Signatur der verantwortenden Person versehen sein oder von der verantwortenden Person signiert und auf einem sicheren Übermittlungsweg gemäß § 130a ZPO nach näherer Maßgabe der Verordnung über die technischen Rahmenbedingungen des elektronischen Rechtsverkehrs und über das besondere elektronische Behördenpostfach (BGBl. I, S.3803) eingereicht werden. Weitere Informationen erhalten Sie auf der Internetseite www.justiz.de.\nDer Widerspruch muss spätestens innerhalb der gesetzten Frist nach dem Datum der Bekanntmachung der Löschungsankündigung bei dem Amtsgericht - Registergericht - Düsseldorf eingegangen sein.  Dies gilt auch dann, wenn der Widerspruch zur Niederschrift der Geschäftsstelle eines anderen Amtsgerichtes abgegeben wurde. Die Frist beginnt mit dem Tage der Bekanntmachung der Löschungsankündigung in dem für die Bekanntmachung der Eintragungen in das Handelsregister bestimmten elektronischen Informations- und Kommunikationssystem nach § 10 des Handelsgesetzbuches. Fällt das Ende der Frist auf einen Sonntag, einen allgemeinen Feiertag oder Sonnabend, so endet die Frist mit Ablauf des nächsten Werktages.\nDer Widerspruch muss die Bezeichnung der angefochtenen Löschungsankündigung sowie die Erklärung enthalten, dass Widerspruch gegen diese Löschungsankündigung eingelegt wird. Er ist zu unterzeichnen und soll begründet werden."
    },
    {
      "date": "2026-01-29",
      "id": "143874",
      "original_text": "Löschungsankündigung\nNordrhein-Westfalen Amtsgericht Duisburg HRB 36699\nRogen Trading GmbH – Duisburg",
      "type": "Löschungsankündigung",
      "state": "Nordrhein-Westfalen",
      "amtsgericht": "Amtsgericht Duisburg",
      "registernummer": "HRB 36699",
      "registerart": "HRB",
      "company_name": "Rogen Trading GmbH",
      "company_seat": "Duisburg",
      "details": "29.01.2026 (Bekanntmachungsdatum)\n\nNordrhein-Westfalen Amtsgericht Duisburg HRB 36699\nLöschungsankündigung 29.01.2026 (Eintragungsdatum)\n\nRogen Trading GmbH\nGesellschaft mit beschränkter Haftung\nDuisburg\n\nHRB 36699:\nRogen Trading GmbH, Duisburg\nGoeckingkstraße 29, 47139 Duisburg.\nDas Registergericht beabsichtigt, die im Handelsregister eingetragene Gesellschaft gemäß § 394 FamFG wegen Vermögenslosigkeit von Amts wegen zu löschen. Gegen diese Verfügung kann Widerspruch eingelegt werden. Die Frist zur Erhebung eines Widerspruchs gegen die beabsichtigte Löschung von Amts wegen ist auf drei Monate festgesetzt.\nRechtsbehelfsbelehrung Der Widerspruch ist bei dem Amtsgericht Duisburg, Kardinal-Galen-Str. 124-132, 47058 Duisburg schriftlich in deutscher Sprache oder zur Niederschrift der Geschäftsstelle einzulegen. Der Widerspruch kann auch zur Niederschrift der Geschäftsstelle eines jeden Amtsgerichtes abgegeben werden. Die Einlegung ist auch durch Übertragung eines elektronischen Dokuments an die elektronische Poststelle des Gerichts möglich. Das elektronische Dokument muss für die Bearbeitung durch das Gericht geeignet und mit einer qualifizierten elektronischen Signatur der verantwortenden Person versehen sein oder von der verantwortenden Person signiert und auf einem sicheren Übermittlungsweg gemäß § 130 a ZPO nach näherer Maßgabe der Verordnung über die technischen Rahmenbedingungen des elektronischen Rechtsverkehrs und über das besondere elektronische Behördenpostfach (BGBl. I, S. 3803) eingereicht werden. Weitere Informationen erhalten Sie auf der Internetseite www.justiz.de. Der Widerspruch muss spätestens innerhalb der gesetzten Frist bei dem Amtsgericht Duisburg eingegangen sein. Dies gilt auch dann, wenn der Widerspruch zur Niederschrift der Geschäftsstelle eines anderen Amtsgerichtes abgegeben wurde. Die Frist beginnt mit der Veröffentlichung. Fällt das Ende der Frist auf einen Sonntag, einen allgemeinen Feiertag oder Sonnabend, so endet die Frist mit Ablauf des nächsten Werktages. Der Widerspruch muss die Bezeichnung der angefochtenen Verfügung sowie die Erklärung enthalten, dass Widerspruch gegen diese Verfügung eingelegt wird. Er ist zu unterzeichnen und soll begründet werden."
    },
    {
      "date": "2026-01-29",
      "id": "143875",
      "original_text": "Löschungsankündigung\nNordrhein-Westfalen Amtsgericht Krefeld VR 2952\nKretanque 88 e.V. – Krefeld",
      "type": "Löschungsankündigung",
      "state": "Nordrhein-Westfalen",
      "amtsgericht": "Amtsgericht Krefeld",
      "registernummer": "VR 2952",
      "registerart": "VR",
      "company_name": "Kretanque 88 e.V.",
      "company_seat": "Krefeld",
      "details": "29.01.2026 (Bekanntmachungsdatum)\n\nNordrhein-Westfalen Amtsgericht Krefeld VR 2952\nLöschungsankündigung\n\nKretanque 88 e.V.\neingetragener Verein\nKrefeld\n\nDas Registergericht beabsichtigt, den im Vereinsregister eingetragenen Verein wegen Wegfalls aller Mitglieder von Amts wegen zu löschen.\n\nGegen diese Verfügung kann Widerspruch eingelegt werden. Die Frist zur Erhebung eines Widerspruchs gegen die beabsichtigte Löschung von Amts wegen ist auf 6 Wochen festgesetzt."
    },
    {
      "date": "2026-01-29",
      "id": "143876",
      "original_text": "Löschungsankündigung\nNordrhein-Westfalen Amtsgericht Krefeld HRB 18729\nSevenmotion GmbH – Krefeld",
      "type": "Löschungsankündigung",
      "state": "Nordrhein-Westfalen",
      "amtsgericht": "Amtsgericht Krefeld",
      "registernummer": "HRB 18729",
      "registerart": "HRB",
      "company_name": "Sevenmotion GmbH",
      "company_seat": "Krefeld",
      "details": "29.01.2026 (Bekanntmachungsdatum)\n\nNordrhein-Westfalen Amtsgericht Krefeld HRB 18729\nLöschungsankündigung\n\nSevenmotion GmbH\nGesellschaft mit beschränkter Haftung\nKrefeld\n\nDas Registergericht beabsichtigt die Gesellschaft von Amts wegen nach § 394 FamFG zu löschen. Die Frist zur Erhebung eines Widerspruchs ist auf einen Monat festgesetzt."
    },
    {
      "date": "2026-01-29",
      "id": "143877",
      "original_text": "Registerbekanntmachung nach dem Umwandlungsgesetz\nNordrhein-Westfalen Amtsgericht Gütersloh HRB 2748\nSIW Andreas Kulig GmbH – Gütersloh",
      "type": "Registerbekanntmachung nach dem Umwandlungsgesetz",
      "state": "Nordrhein-Westfalen",
      "amtsgericht": "Amtsgericht Gütersloh",
      "registernummer": "HRB 2748",
      "registerart": "HRB",
      "company_name": "SIW Andreas Kulig GmbH",
      "company_seat": "Gütersloh",
      "details": "29.01.2026 (Bekanntmachungsdatum)\n\nNordrhein-Westfalen Amtsgericht Gütersloh HRB 2748\nRegisterbekanntmachung nach dem Umwandlungsgesetz 29.01.2026 (Eintragungsdatum)\n\nSIW Andreas Kulig GmbH\nGesellschaft mit beschränkter Haftung\nGütersloh\n\nDen Gläubigern der an der Verschmelzung beteiligten Rechtsträger ist, wenn sie binnen sechs Monaten nach dem Tag, an dem die Eintragung der Verschmelzung in das Register des Sitzes desjenigen Rechtsträgers, dessen Gläubiger sie sind, nach § 19 Absatz 3 UmwG als bekanntgemacht gilt, ihren Anspruch nach Grund und Höhe schriftlich anmelden, Sicherheit zu leisten, soweit sie nicht Befriedigung verlangen können. Dieses Recht steht den Gläubigern jedoch nur zu, wenn sie glaubhaft machen, dass durch die Verschmelzung die Erfüllung ihrer Forderung gefährdet wird."
    },
    {
      "date": "2026-01-29",
      "id": "143878",
      "original_text": "Sonstige Registerbekanntmachung\nNordrhein-Westfalen Amtsgericht Düsseldorf HRB 5516\nAIA AG – Düsseldorf",
      "type": "Sonstige Registerbekanntmachung",
      "state": "Nordrhein-Westfalen",
      "amtsgericht": "Amtsgericht Düsseldorf",
      "registernummer": "HRB 5516",
      "registerart": "HRB",
      "company_name": "AIA AG",
      "company_seat": "Düsseldorf",
      "details": "29.01.2026 (Bekanntmachungsdatum)\n\nNordrhein-Westfalen Amtsgericht Düsseldorf HRB 5516\nSonstige Registerbekanntmachung 26.01.2026 (Eintragungsdatum)\n\nAIA AG\nAktiengesellschaft\nDüsseldorf\n\nDem Registergericht ist eine Liste der Mitglieder des Aufsichtsrates eingereicht worden."
    },
    {
      "date": "2026-01-29",
      "id": "143879",
      "original_text": "Löschungsankündigung\nNordrhein-Westfalen Amtsgericht Krefeld HRA 5692\nCommand-Shift-4 GmbH & Co. KG – Krefeld",
      "type": "Löschungsankündigung",
      "state": "Nordrhein-Westfalen",
      "amtsgericht": "Amtsgericht Krefeld",
      "registernummer": "HRA 5692",
      "registerart": "HRA",
      "company_name": "Command-Shift-4 GmbH & Co. KG",
      "company_seat": "Krefeld",
      "details": "29.01.2026 (Bekanntmachungsdatum)\n\nNordrhein-Westfalen Amtsgericht Krefeld HRA 5692\nLöschungsankündigung\n\nCommand-Shift-4 GmbH & Co. KG\nKommanditgesellschaft\nKrefeld\n\nDas Registergericht beabsichtigt die Firma von Amts wegen nach § 394 FamFG zu löschen. Die Frist zur Erhebung eines Widerspruchs ist auf 6 Wochen festgesetzt."
    },
    {
      "date": "2026-01-29",
      "id": "143880",
      "original_text": "Löschungsankündigung\nNordrhein-Westfalen Amtsgericht Krefeld VR 1872\nRENO Rheinland Verein der Rechtsanwalts- und Notarangestellten e.V. – Krefeld",
      "type": "Löschungsankündigung",
      "state": "Nordrhein-Westfalen",
      "amtsgericht": "Amtsgericht Krefeld",
      "registernummer": "VR 1872",
      "registerart": "VR",
      "company_name": "RENO Rheinland Verein der Rechtsanwalts- und Notarangestellten e.V.",
      "company_seat": "Krefeld",
      "details": "29.01.2026 (Bekanntmachungsdatum)\n\nNordrhein-Westfalen Amtsgericht Krefeld VR 1872\nLöschungsankündigung\n\nRENO Rheinland Verein der Rechtsanwalts- und Notarangestellten e.V.\neingetragener Verein\nKrefeld\n\nDas Registergericht beabsichtigt, den im Vereinsregister eingetragenen Verein gemäß wegen Wegfalls aller Mitglieder von Amts wegen zu löschen.\n\nGegen diese Verfügung kann Widerspruch eingelegt werden. Die Frist zur Erhebung eines Widerspruchs gegen die beabsichtigte Löschung von Amts wegen ist auf 6 Wochen festgesetzt."
    },
    {
      "date": "2026-01-29",
      "id": "143881",
      "original_text": "Registerbekanntmachung nach dem Umwandlungsgesetz\nNordrhein-Westfalen Amtsgericht Köln HRA 4078\nFranz Skowronek KG – Köln",
      "type": "Registerbekanntmachung nach dem Umwandlungsgesetz",
      "state": "Nordrhein-Westfalen",
      "amtsgericht": "Amtsgericht Köln",
      "registernummer": "HRA 4078",
      "registerart": "HRA",
      "company_name": "Franz Skowronek KG",
      "company_seat": "Köln",
      "details": "29.01.2026 (Bekanntmachungsdatum)\n\nNordrhein-Westfalen Amtsgericht Köln HRA 4078\nRegisterbekanntmachung nach dem Umwandlungsgesetz 29.01.2026 (Eintragungsdatum)\n\nFranz Skowronek KG\nKommanditgesellschaft\nKöln\n\nDen Gläubigern der an der formwechselnden Umwandlung beteiligten Rechtsträger ist, wenn sie binnen sechs Monaten nach dem Tag, an dem die Eintragung der formwechselnden Umwandlung in das Register des Sitzes desjenigen Rechtsträgers, dessen Gläubiger sie sind, nach § 19 Absatz 3 UmwG als bekanntgemacht gilt, ihren Anspruch nach Grund und Höhe schriftlich anmelden, Sicherheit zu leisten, soweit sie nicht Befriedigung verlangen können. Dieses Recht steht den Gläubigern jedoch nur zu, wenn sie glaubhaft machen, dass durch die formwechselnden Umwandlung die Erfüllung ihrer Forderung gefährdet wird."
    },
    {
      "date": "2026-01-29",
      "id": "143882",
      "original_text": "Löschungsankündigung\nNordrhein-Westfalen Amtsgericht Wuppertal HRB 26547\nE & H Gebäudeservice UG (haftungsbeschränkt) – Wuppertal",
      "type": "Löschungsankündigung",
      "state": "Nordrhein-Westfalen",
      "amtsgericht": "Amtsgericht Wuppertal",
      "registernummer": "HRB 26547",
      "registerart": "HRB",
      "company_name": "E & H Gebäudeservice UG (haftungsbeschränkt)",
      "company_seat": "Wuppertal",
      "details": "29.01.2026 (Bekanntmachungsdatum)\n\nNordrhein-Westfalen Amtsgericht Wuppertal HRB 26547\nLöschungsankündigung\n\nE & H Gebäudeservice UG (haftungsbeschränkt)\nGesellschaft mit beschränkter Haftung\nWuppertal\n\nDas Registergericht beabsichtigt die Gesellschaft von Amts wegen nach § 394 FamFG zu löschen. Die Frist zur Erhebung eines Widerspruchs ist auf einen Monat festgesetzt."
    },
    {
      "date": "2026-01-29",
      "id": "143883",
      "original_text": "Registerbekanntmachung nach dem Umwandlungsgesetz\nNordrhein-Westfalen Amtsgericht Paderborn HRA 8536\nNeumann Grundbesitz GmbH & Co. KG – Lippstadt",
      "type": "Registerbekanntmachung nach dem Umwandlungsgesetz",
      "state": "Nordrhein-Westfalen",
      "amtsgericht": "Amtsgericht Paderborn",
      "registernummer": "HRA 8536",
      "registerart": "HRA",
      "company_name": "Neumann Grundbesitz GmbH & Co. KG",
      "company_seat": "Lippstadt",
      "details": "29.01.2026 (Bekanntmachungsdatum)\n\nNordrhein-Westfalen Amtsgericht Paderborn HRA 8536\nRegisterbekanntmachung nach dem Umwandlungsgesetz 29.01.2026 (Eintragungsdatum)\n\nNeumann Grundbesitz GmbH & Co. KG\nKommanditgesellschaft\nLippstadt\n\nDen Gläubigern der an der Verschmelzung beteiligten Rechtsträger ist, wenn sie binnen sechs Monaten nach dem Tag, an dem die Eintragung der Verschmelzung in das Register des Sitzes desjenigen Rechtsträgers, dessen Gläubiger sie sind, nach § 19 Absatz 3 UmwG als bekanntgemacht gilt, ihren Anspruch nach Grund und Höhe schriftlich anmelden, Sicherheit zu leisten, soweit sie nicht Befriedigung verlangen können. Dieses Recht steht den Gläubigern jedoch nur zu, wenn sie glaubhaft machen, dass durch die Verschmelzung die Erfüllung ihrer Forderung gefährdet wird."
    },
    {
      "date": "2026-01-29",
      "id": "143884",
      "original_text": "Löschungsankündigung\nNordrhein-Westfalen Amtsgericht Krefeld VR 4832\nTreff Aktiv Reha Sport e.V. – Krefeld",
      "type": "Löschungsankündigung",
      "state": "Nordrhein-Westfalen",
      "amtsgericht": "Amtsgericht Krefeld",
      "registernummer": "VR 4832",
      "registerart": "VR",
      "company_name": "Treff Aktiv Reha Sport e.V.",
      "company_seat": "Krefeld",
      "details": "29.01.2026 (Bekanntmachungsdatum)\n\nNordrhein-Westfalen Amtsgericht Krefeld VR 4832\nLöschungsankündigung\n\nTreff Aktiv Reha Sport e.V.\neingetragener Verein\nKrefeld\n\nDas Registergericht beabsichtigt, den im Vereinsregister eingetragenen Verein gemäß Wegfalls aller Mitglieder von Amts wegen zu löschen.\n\nGegen diese Verfügung kann Widerspruch eingelegt werden. Die Frist zur Erhebung eines Widerspruchs gegen die beabsichtigte Löschung von Amts wegen ist auf 6 Wochen festgesetzt."
    },
    {
      "date": "2026-01-29",
      "id": "143885",
      "original_text": "Löschungsankündigung\nThüringen Amtsgericht Jena HRB 400548\nHeinrich Rudewig Bauunternehmungsgesellschaft mbH – Greußen",
      "type": "Löschungsankündigung",
      "state": "Thüringen",
      "amtsgericht": "Amtsgericht Jena",
      "registernummer": "HRB 400548",
      "registerart": "HRB",
      "company_name": "Heinrich Rudewig Bauunternehmungsgesellschaft mbH",
      "company_seat": "Greußen",
      "details": "29.01.2026 (Bekanntmachungsdatum)\n\nThüringen Amtsgericht Jena HRB 400548\nLöschungsankündigung\n\nHeinrich Rudewig Bauunternehmungsgesellschaft mbH\nGesellschaft mit beschränkter Haftung\nGreußen\n\nDas Registergericht beabsichtigt, die im Handelsregister eingetragene Gesellschaft wegen Vermögenslosigkeit nach § 394 FamFG von Amts wegen zu löschen. Die Frist zur Erhebung eines Widerspruchs gegen die beabsichtigte Löschung wird auf 6 Wochen festgesetzt."
    },
    {
      "date": "2026-01-29",
      "id": "143886",
      "original_text": "Einreichung neuer Dokumente\nNiedersachsen Amtsgericht Lüneburg HRB 207112\nKommunale Wohnungsbaugesellschaft für den Landkreis Harburg mbH – Winsen (Luhe)",
      "type": "Einreichung neuer Dokumente",
      "state": "Niedersachsen",
      "amtsgericht": "Amtsgericht Lüneburg",
      "registernummer": "HRB 207112",
      "registerart": "HRB",
      "company_name": "Kommunale Wohnungsbaugesellschaft für den Landkreis Harburg mbH",
      "company_seat": "Winsen (Luhe)",
      "details": "29.01.2026 (Bekanntmachungsdatum)\n\nNiedersachsen Amtsgericht Lüneburg HRB 207112\nEinreichung neuer Dokumente\n\nKommunale Wohnungsbaugesellschaft für den Landkreis Harburg mbH\nGesellschaft mit beschränkter Haftung\nWinsen (Luhe)\n\nDie Liste der Mitglieder des Aufsichtsrats wurde beim Registergericht eingereicht."
    },
    {
      "date": "2026-01-29",
      "id": "143887",
      "original_text": "Löschungsankündigung\nHessen Amtsgericht Frankfurt am Main HRB 114143\nHappyDrinksDelivery UG (haftungsbeschränkt) – Frankfurt am Main",
      "type": "Löschungsankündigung",
      "state": "Hessen",
      "amtsgericht": "Amtsgericht Frankfurt am Main",
      "registernummer": "HRB 114143",
      "registerart": "HRB",
      "company_name": "HappyDrinksDelivery UG (haftungsbeschränkt)",
      "company_seat": "Frankfurt am Main",
      "details": "29.01.2026 (Bekanntmachungsdatum)\n\nHessen Amtsgericht Frankfurt am Main HRB 114143\nLöschungsankündigung\n\nHappyDrinksDelivery UG (haftungsbeschränkt)\nGesellschaft mit beschränkter Haftung\nFrankfurt am Main\n\nDas Registergericht beabsichtigt die im Handelsregister eingetragene Gesellschaft von Amts wegen nach § 394 FamFG zu löschen. Die Frist zur Erhebung eines Widerspruchs gegen die beabsichtigte Löschung wird auf 1 Monat festgesetzt."
    },
    {
      "date": "2026-01-29",
      "id": "143888",
      "original_text": "Löschungsankündigung\nHessen Amtsgericht Frankfurt am Main HRB 55944\nPlanquadrat 4 GmbH – Frankfurt am Main",
      "type": "Löschungsankündigung",
      "state": "Hessen",
      "amtsgericht": "Amtsgericht Frankfurt am Main",
      "registernummer": "HRB 55944",
      "registerart": "HRB",
      "company_name": "Planquadrat 4 GmbH",
      "company_seat": "Frankfurt am Main",
      "details": "29.01.2026 (Bekanntmachungsdatum)\n\nHessen Amtsgericht Frankfurt am Main HRB 55944\nLöschungsankündigung\n\nPlanquadrat 4 GmbH\nGesellschaft mit beschränkter Haftung\nFrankfurt am Main\n\nDas Registergericht beabsichtigt die im Handelsregister eingetragene Gesellschaft von Amts wegen nach § 394 FamFG zu löschen. Die Frist zur Erhebung eines Widerspruchs gegen die beabsichtigte Löschung wird auf 1 Monat festgesetzt."
    },
    {
      "date": "2026-01-29",
      "id": "143889",
      "original_text": "Sonstige Registerbekanntmachung\nHessen Amtsgericht Kassel HRB 16253\nEAM Verwaltungs-GmbH – Kassel",
      "type": "Sonstige Registerbekanntmachung",
      "state": "Hessen",
      "amtsgericht": "Amtsgericht Kassel",
      "registernummer": "HRB 16253",
      "registerart": "HRB",
      "company_name": "EAM Verwaltungs-GmbH",
      "company_seat": "Kassel",
      "details": "29.01.2026 (Bekanntmachungsdatum)\n\nHessen Amtsgericht Kassel HRB 16253\nSonstige Registerbekanntmachung 29.01.2026 (Eintragungsdatum)\n\nEAM Verwaltungs-GmbH\nGesellschaft mit beschränkter Haftung\nKassel\n\nDurch eine Änderung in den Personen der Aufsichtsratsmitglieder ist eine Liste der Mitglieder des Aufsichtsrates zum Handelsregister eingereicht worden."
    },
    {
      "date": "2026-01-29",
      "id": "143890",
      "original_text": "Registerbekanntmachung nach dem Umwandlungsgesetz\nHessen Amtsgericht Darmstadt HRB 100904\nPfungstädter Brauerei GmbH – Seeheim-Jugenheim",
      "type": "Registerbekanntmachung nach dem Umwandlungsgesetz",
      "state": "Hessen",
      "amtsgericht": "Amtsgericht Darmstadt",
      "registernummer": "HRB 100904",
      "registerart": "HRB",
      "company_name": "Pfungstädter Brauerei GmbH",
      "company_seat": "Seeheim-Jugenheim",
      "details": "29.01.2026 (Bekanntmachungsdatum)\n\nHessen Amtsgericht Darmstadt HRB 100904\nRegisterbekanntmachung nach dem Umwandlungsgesetz 29.01.2026 (Eintragungsdatum)\n\nPfungstädter Brauerei GmbH\nGesellschaft mit beschränkter Haftung\nSeeheim-Jugenheim\n\nDen Gläubigern der an der Verschmelzung beteiligten Rechtsträger ist, wenn sie binnen sechs Monaten nach dem Tag, an dem die Eintragung der Verschmelzung in das Register des Sitzes desjenigen Rechtsträgers, dessen Gläubiger sie sind, nach § 19 Absatz 3 UmwG bekannt gemacht worden ist, ihren Anspruch nach Grund und Höhe schriftlich anmelden, Sicherheit zu leisten, soweit sie nicht Befriedigung verlangen können. Dieses Recht steht den Gläubigern jedoch nur zu, wenn sie glaubhaft machen, dass durch die Verschmelzung die Erfüllung ihrer Forderung gefährdet wird."
    },
    {
      "date": "2026-01-29",
      "id": "143891",
      "original_text": "Löschungsankündigung\nHessen Amtsgericht Frankfurt am Main HRB 125895\nEat & Live UG (haftungsbeschränkt) – Frankfurt am Main",
      "type": "Löschungsankündigung",
      "state": "Hessen",
      "amtsgericht": "Amtsgericht Frankfurt am Main",
      "registernummer": "HRB 125895",
      "registerart": "HRB",
      "company_name": "Eat & Live UG (haftungsbeschränkt)",
      "company_seat": "Frankfurt am Main",
      "details": "29.01.2026 (Bekanntmachungsdatum)\n\nHessen Amtsgericht Frankfurt am Main HRB 125895\nLöschungsankündigung\n\nEat & Live UG (haftungsbeschränkt)\nGesellschaft mit beschränkter Haftung\nFrankfurt am Main\n\nDas Registergericht beabsichtigt die im Handelsregister eingetragene Gesellschaft von Amts wegen nach § 394 FamFG zu löschen. Die Frist zur Erhebung eines Widerspruchs gegen die beabsichtigte Löschung wird auf 1 Monat festgesetzt."
    },
    {
      "date": "2026-01-29",
      "id": "143892",
      "original_text": "Einreichung neuer Dokumente\nHessen Amtsgericht Darmstadt HRB 105592\nAGORA SE – Ober-Ramstadt",
      "type": "Einreichung neuer Dokumente",
      "state": "Hessen",
      "amtsgericht": "Amtsgericht Darmstadt",
      "registernummer": "HRB 105592",
      "registerart": "HRB",
      "company_name": "AGORA SE",
      "company_seat": "Ober-Ramstadt",
      "details": "29.01.2026 (Bekanntmachungsdatum)\n\nHessen Amtsgericht Darmstadt HRB 105592\nEinreichung neuer Dokumente 29.01.2026 (Eintragungsdatum)\n\nAGORA SE\nEuropäische Aktiengesellschaft (SE)\nOber-Ramstadt\n\nDurch eine Änderung in den Personen der Aufsichtsratsmitglieder ist eine Liste der Mitglieder des Aufsichtsrates zum Handelsregister eingereicht worden."
    },
    {
      "date": "2026-01-29",
      "id": "143893",
      "original_text": "Einreichung neuer Dokumente\nHessen Amtsgericht Frankfurt am Main HRB 104321\nAcademy of Labour gGmbH – Frankfurt am Main",
      "type": "Einreichung neuer Dokumente",
      "state": "Hessen",
      "amtsgericht": "Amtsgericht Frankfurt am Main",
      "registernummer": "HRB 104321",
      "registerart": "HRB",
      "company_name": "Academy of Labour gGmbH",
      "company_seat": "Frankfurt am Main",
      "details": "29.01.2026 (Bekanntmachungsdatum)\n\nHessen Amtsgericht Frankfurt am Main HRB 104321\nEinreichung neuer Dokumente\n\nAcademy of Labour gGmbH\nGesellschaft mit beschränkter Haftung\nFrankfurt am Main\n\nDurch eine Änderung in den Personen der Aufsichtsratsmitglieder ist eine Liste der Mitglieder des Aufsichtsrates zum Handelsregister eingereicht worden."
    },
    {
      "date": "2026-01-29",
      "id": "143894",
      "original_text": "Löschungsankündigung\nHessen Amtsgericht Frankfurt am Main HRB 94171\nTJ Germany GmbH – Frankfurt am Main",
      "type": "Löschungsankündigung",
      "state": "Hessen",
      "amtsgericht": "Amtsgericht Frankfurt am Main",
      "registernummer": "HRB 94171",
      "registerart": "HRB",
      "company_name": "TJ Germany GmbH",
      "company_seat": "Frankfurt am Main",
      "details": "29.01.2026 (Bekanntmachungsdatum)\n\nHessen Amtsgericht Frankfurt am Main HRB 94171\nLöschungsankündigung\n\nTJ Germany GmbH\nGesellschaft mit beschränkter Haftung\nFrankfurt am Main\n\nDas Registergericht beabsichtigt die im Handelsregister eingetragene Gesellschaft von Amts wegen nach § 394 FamFG zu löschen. Die Frist zur Erhebung eines Widerspruchs gegen die beabsichtigte Löschung wird auf 1 Monat festgesetzt."
    },
    {
      "date": "2026-01-29",
      "id": "143895",
      "original_text": "Einreichung neuer Dokumente\nHessen Amtsgericht Bad Homburg v.d.H. HRB 7361\nGOPA - Gesellschaft für Organisation, Planung und Ausbildung mbH – Bad Homburg v. d. Höhe",
      "type": "Einreichung neuer Dokumente",
      "state": "Hessen",
      "amtsgericht": "Amtsgericht Bad Homburg v.d.H.",
      "registernummer": "HRB 7361",
      "registerart": "HRB",
      "company_name": "GOPA - Gesellschaft für Organisation, Planung und Ausbildung mbH",
      "company_seat": "Bad Homburg v. d. Höhe",
      "details": "29.01.2026 (Bekanntmachungsdatum)\n\nHessen Amtsgericht Bad Homburg v.d.H. HRB 7361\nEinreichung neuer Dokumente\n\nGOPA - Gesellschaft für Organisation, Planung und Ausbildung mbH\nGesellschaft mit beschränkter Haftung\nBad Homburg v. d. Höhe\n\nDurch eine Änderung in den Personen der Aufsichtsratsmitglieder ist eine Liste der Mitglieder des Aufsichtsrates zum Handelsregister eingereicht worden."
    },
    {
      "date": "2026-01-29",
      "id": "143896",
      "original_text": "Löschungsankündigung\nHessen Amtsgericht Wiesbaden HRB 12453\nHaltbar GmbH – Wiesbaden",
      "type": "Löschungsankündigung",
      "state": "Hessen",
      "amtsgericht": "Amtsgericht Wiesbaden",
      "registernummer": "HRB 12453",
      "registerart": "HRB",
      "company_name": "Haltbar GmbH",
      "company_seat": "Wiesbaden",
      "details": "29.01.2026 (Bekanntmachungsdatum)\n\nHessen Amtsgericht Wiesbaden HRB 12453\nLöschungsankündigung\n\nHaltbar GmbH\nGesellschaft mit beschränkter Haftung\nWiesbaden\n\nDas Registergericht beabsichtigt die im Handelsregister eingetragene Gesellschaft von Amts wegen nach § 394 FamFG zu löschen. Die Frist zur Erhebung eines Widerspruchs gegen die beabsichtigte Löschung wird auf 3 Monate festgesetzt."
    },
    {
      "date": "2026-01-29",
      "id": "143897",
      "original_text": "Registerbekanntmachung nach dem Umwandlungsgesetz\nHessen Amtsgericht Frankfurt am Main HRB 105899\nErnst & Young cqc corporate quality consulting GmbH – Eschborn",
      "type": "Registerbekanntmachung nach dem Umwandlungsgesetz",
      "state": "Hessen",
      "amtsgericht": "Amtsgericht Frankfurt am Main",
      "registernummer": "HRB 105899",
      "registerart": "HRB",
      "company_name": "Ernst & Young cqc corporate quality consulting GmbH",
      "company_seat": "Eschborn",
      "details": "29.01.2026 (Bekanntmachungsdatum)\n\nHessen Amtsgericht Frankfurt am Main HRB 105899\nRegisterbekanntmachung nach dem Umwandlungsgesetz 29.01.2026 (Eintragungsdatum)\n\nErnst & Young cqc corporate quality consulting GmbH\nGesellschaft mit beschränkter Haftung\nEschborn\n\nDen Gläubigern der an der Verschmelzung beteiligten Rechtsträger ist, wenn sie binnen sechs Monaten nach dem Tag, an dem die Eintragung der Verschmelzung in das Register des Sitzes desjenigen Rechtsträgers, dessen Gläubiger sie sind, nach § 19 Absatz 3 UmwG bekannt gemacht worden ist, ihren Anspruch nach Grund und Höhe schriftlich anmelden, Sicherheit zu leisten, soweit sie nicht Befriedigung verlangen können. Dieses Recht steht den Gläubigern jedoch nur zu, wenn sie glaubhaft machen, dass durch die Verschmelzung die Erfüllung ihrer Forderung gefährdet wird."
    },
    {
      "date": "2026-01-29",
      "id": "143898",
      "original_text": "Einreichung neuer Dokumente\nHessen Amtsgericht Wiesbaden HRB 21704\nINKA 116. Vermögensverwaltungs AG – Wiesbaden",
      "type": "Einreichung neuer Dokumente",
      "state": "Hessen",
      "amtsgericht": "Amtsgericht Wiesbaden",
      "registernummer": "HRB 21704",
      "registerart": "HRB",
      "company_name": "INKA 116. Vermögensverwaltungs AG",
      "company_seat": "Wiesbaden",
      "details": "29.01.2026 (Bekanntmachungsdatum)\n\nHessen Amtsgericht Wiesbaden HRB 21704\nEinreichung neuer Dokumente\n\nINKA 116. Vermögensverwaltungs AG\nAktiengesellschaft\nWiesbaden\n\nDurch eine Änderung in den Personen der Aufsichtsratsmitglieder ist eine Liste der Mitglieder des Aufsichtsrates zum Handelsregister eingereicht worden."
    },
    {
      "date": "2026-01-29",
      "id": "143899",
      "original_text": "Registerbekanntmachung nach dem Umwandlungsgesetz\nHessen Amtsgericht Darmstadt HRB 3364\nPBH Hildebrand Verwaltungs-GmbH – Seeheim-Jugenheim",
      "type": "Registerbekanntmachung nach dem Umwandlungsgesetz",
      "state": "Hessen",
      "amtsgericht": "Amtsgericht Darmstadt",
      "registernummer": "HRB 3364",
      "registerart": "HRB",
      "company_name": "PBH Hildebrand Verwaltungs-GmbH",
      "company_seat": "Seeheim-Jugenheim",
      "details": "29.01.2026 (Bekanntmachungsdatum)\n\nHessen Amtsgericht Darmstadt HRB 3364\nRegisterbekanntmachung nach dem Umwandlungsgesetz 29.01.2026 (Eintragungsdatum)\n\nPBH Hildebrand Verwaltungs-GmbH\nGesellschaft mit beschränkter Haftung\nSeeheim-Jugenheim\n\nDen Gläubigern der an der grenzüberschreitenden Verschmelzung beteiligten übernehmenden Rechtsträger ist, wenn sie binnen sechs Monaten nach dem Tag, an dem die Eintragung der Verschmelzung in das Register des Sitzes desjenigen Rechtsträgers, dessen Gläubiger sie sind, nach § 19 Absatz 3 UmwG als bekanntgemacht gilt, ihren Anspruch nach Grund und Höhe schriftlich anmelden, Sicherheit zu leisten, soweit sie nicht Befriedigung verlangen können.\n\nDieses Recht steht den Gläubigern jedoch nur zu, wenn sie glaubhaft machen, dass durch die Verschmelzung die Erfüllung ihrer Forderung gefährdet wird."
    }
  ]
}