{
  "date": "2026-01-10",
  "date_of_scrape": "2026-01-11T04:23:52.455Z",
  "tool_version": "0.2.0",
  "number_of_announcements": 28,
  "announcements": [
    {
      "date": "2026-01-10",
      "id": "142041",
      "original_text": "Registerbekanntmachung nach dem Umwandlungsgesetz\nBayern Amtsgericht Würzburg HRB 12225\nVK BODYFIT GmbH – Waldbrunn",
      "type": "Registerbekanntmachung nach dem Umwandlungsgesetz",
      "state": "Bayern",
      "amtsgericht": "Amtsgericht Würzburg",
      "registernummer": "HRB 12225",
      "registerart": "HRB",
      "company_name": "VK BODYFIT GmbH",
      "company_seat": "Waldbrunn",
      "details": "10.01.2026 (Bekanntmachungsdatum)\n\nBayern Amtsgericht Würzburg HRB 12225\nRegisterbekanntmachung nach dem Umwandlungsgesetz 09.01.2026 (Eintragungsdatum)\n\nVK BODYFIT GmbH\nGesellschaft mit beschränkter Haftung\nWaldbrunn\n\nDen Gläubigern der Gesellschaft, deren Forderungen begründet worden sind, bevor die Eintragung der Beendigung des Beherrschungs- und Gewinnabführungsvertrages in das Handelsregister nach § 10 des Handelsgesetzbuches als bekanntgemacht gilt, hat der andere Vertragsteil Sicherheit zu leisten, wenn sie sich binnen sechs Monaten nach der Bekanntmachung der Eintragung zu diesem Zweck bei ihm melden."
    },
    {
      "date": "2026-01-10",
      "id": "142042",
      "original_text": "Registerbekanntmachung nach dem Umwandlungsgesetz\nBayern Amtsgericht Ansbach HRB 6233\nGALA GROUP GmbH – Ansbach",
      "type": "Registerbekanntmachung nach dem Umwandlungsgesetz",
      "state": "Bayern",
      "amtsgericht": "Amtsgericht Ansbach",
      "registernummer": "HRB 6233",
      "registerart": "HRB",
      "company_name": "GALA GROUP GmbH",
      "company_seat": "Ansbach",
      "details": "10.01.2026 (Bekanntmachungsdatum)\n\nBayern Amtsgericht Ansbach HRB 6233\nRegisterbekanntmachung nach dem Umwandlungsgesetz 09.01.2026 (Eintragungsdatum)\n\nGALA GROUP GmbH\nGesellschaft mit beschränkter Haftung\nAnsbach\n\nDen Gläubigern der an der Verschmelzung beteiligten Rechtsträger ist, wenn sie binnen sechs Monaten nach dem Tag, an dem die Eintragung der Verschmelzung in das Register des Sitzes desjenigen Rechtsträgers, dessen Gläubiger sie sind, nach § 19 Abs. 3 UmwG als bekannt gemacht gilt, ihren Anspruch nach Grund und Höhe in Textform anmelden, Sicherheit zu leisten, soweit sie nicht Befriedigung verlangen können. Dieses Recht steht den Gläubigern jedoch nur zu, wenn sie glaubhaft machen, dass durch die Verschmelzung die Erfüllung ihrer Forderung gefährdet wird."
    },
    {
      "date": "2026-01-10",
      "id": "142043",
      "original_text": "Registerbekanntmachung nach dem Umwandlungsgesetz\nBayern Amtsgericht München HRB 308518\nWN Immobilien GmbH – München",
      "type": "Registerbekanntmachung nach dem Umwandlungsgesetz",
      "state": "Bayern",
      "amtsgericht": "Amtsgericht München",
      "registernummer": "HRB 308518",
      "registerart": "HRB",
      "company_name": "WN Immobilien GmbH",
      "company_seat": "München",
      "details": "10.01.2026 (Bekanntmachungsdatum)\n\nBayern Amtsgericht München HRB 308518\nRegisterbekanntmachung nach dem Umwandlungsgesetz 09.01.2026 (Eintragungsdatum)\n\nWN Immobilien GmbH\nGesellschaft mit beschränkter Haftung\nMünchen\n\nDen Gläubigern des formwechselnden Rechtsträgers ist, wenn sie binnen sechs Monaten nach dem Tag, an dem die Eintragung des Formwechsels nach § 201 UmwG als bekannt gemacht gilt, ihren Anspruch nach Grund und Höhe in Textform anmelden, Sicherheit zu leisten, soweit sie nicht Befriedigung verlangen können. Dieses Recht steht den Gläubigern jedoch nur zu, wenn sie glaubhaft machen, dass durch den Formwechsel die Erfüllung ihrer Forderung gefährdet wird."
    },
    {
      "date": "2026-01-10",
      "id": "142044",
      "original_text": "Sonstige Registerbekanntmachung\nBayern Amtsgericht München HRB 185207\nBayWa Energie Dienstleistungs GmbH – München",
      "type": "Sonstige Registerbekanntmachung",
      "state": "Bayern",
      "amtsgericht": "Amtsgericht München",
      "registernummer": "HRB 185207",
      "registerart": "HRB",
      "company_name": "BayWa Energie Dienstleistungs GmbH",
      "company_seat": "München",
      "details": "10.01.2026 (Bekanntmachungsdatum)\n\nBayern Amtsgericht München HRB 185207\nSonstige Registerbekanntmachung 09.01.2026 (Eintragungsdatum)\n\nBayWa Energie Dienstleistungs GmbH\nGesellschaft mit beschränkter Haftung\nMünchen\n\nDen Gläubigern der Gesellschaft, deren Forderungen begründet worden sind, bevor die Eintragung der Beendigung des Gewinnabführungsvertrages in das Handelsregister nach § 10 des Handelsgesetzbuches als bekanntgemacht gilt, hat der andere Vertragsteil Sicherheit zu leisten, wenn sie sich binnen sechs Monaten nach der Bekanntmachung der Eintragung zu diesem Zweck bei ihm melden."
    },
    {
      "date": "2026-01-10",
      "id": "142045",
      "original_text": "Registerbekanntmachung nach dem Umwandlungsgesetz\nBayern Amtsgericht München HRB 272885\nHuber Beteiligungs GmbH – Oberding",
      "type": "Registerbekanntmachung nach dem Umwandlungsgesetz",
      "state": "Bayern",
      "amtsgericht": "Amtsgericht München",
      "registernummer": "HRB 272885",
      "registerart": "HRB",
      "company_name": "Huber Beteiligungs GmbH",
      "company_seat": "Oberding",
      "details": "10.01.2026 (Bekanntmachungsdatum)\n\nBayern Amtsgericht München HRB 272885\nRegisterbekanntmachung nach dem Umwandlungsgesetz 09.01.2026 (Eintragungsdatum)\n\nHuber Beteiligungs GmbH\nGesellschaft mit beschränkter Haftung\nOberding\n\nDen Gläubigern #dv.auswahl(Text=\"Bitte zutreffendes auswählen:\",Eingabe=\n\n\"der an der Verschmelzung beteiligten Rechtsträger ist, wenn sie binnen sechs Monaten nach dem Tag, an dem die Eintragung der Verschmelzung in das Register des Sitzes desjenigen Rechtsträgers, dessen Gläubiger sie sind, nach § 19 Abs. 3 UmwG als bekannt gemacht gilt, ihren Anspruch nach Grund und Höhe in Textform anmelden, Sicherheit zu leisten, soweit sie nicht Befriedigung verlangen können. Dieses Recht steht den Gläubigern jedoch nur zu, wenn sie glaubhaft machen, dass durch die Verschmelzung die Erfüllung ihrer Forderung gefährdet wird.\"|\"Verschmelzung\",\n\n\"der an der Spaltung beteiligten Rechtsträger ist, wenn sie binnen sechs Monaten nach dem Tag, an dem die Eintragung der Spaltung in das Register des Sitzes desjenigen Rechtsträgers, dessen Gläubiger sie sind, nach §§ 125, 19 Abs. 3 UmwG als bekannt gemacht gilt, ihren Anspruch nach Grund und Höhe in Textform anmelden, Sicherheit zu leisten, soweit sie nicht Befriedigung verlangen können. Dieses Recht steht den Gläubigern jedoch nur zu, wenn sie glaubhaft machen, dass durch die Spaltung die Erfüllung ihrer Forderung gefährdet wird.\"|\"Spaltung\",\n\n\"des formwechselnden Rechtsträgers ist, wenn sie binnen sechs Monaten nach dem Tag, an dem die Eintragung des Formwechsels nach § 201 UmwG als bekannt gemacht gilt, ihren Anspruch nach Grund und Höhe in Textform anmelden, Sicherheit zu leisten, soweit sie nicht Befriedigung verlangen können. Dieses Recht steht den Gläubigern jedoch nur zu, wenn sie glaubhaft machen, dass durch den Formwechsel die Erfüllung ihrer Forderung gefährdet wird.\"|\"formwechselnde Umwandlung\",\n\n\"der an der Ausgliederung beteiligten Rechtsträger ist, wenn sie binnen sechs Monaten nach dem Tag, an dem die Eintragung der Ausgliederung in das Register des Sitzes desjenigen Rechtsträgers, dessen Gläubiger sie sind, nach §§ 125, 19 Abs. 3 UmwG als bekannt gemacht gilt, ihren Anspruch nach Grund und Höhe in Textform anmelden, Sicherheit zu leisten, soweit sie nicht Befriedigung verlangen können. Dieses Recht steht den Gläubigern jedoch nur zu, wenn sie glaubhaft machen, dass durch die Ausgliederung die Erfüllung ihrer Forderung gefährdet wird.\"|\"Ausgliederung\")"
    },
    {
      "date": "2026-01-10",
      "id": "142046",
      "original_text": "Registerbekanntmachung nach dem Umwandlungsgesetz\nBayern Amtsgericht München HRB 256369\nMEDDANE AG – München",
      "type": "Registerbekanntmachung nach dem Umwandlungsgesetz",
      "state": "Bayern",
      "amtsgericht": "Amtsgericht München",
      "registernummer": "HRB 256369",
      "registerart": "HRB",
      "company_name": "MEDDANE AG",
      "company_seat": "München",
      "details": "10.01.2026 (Bekanntmachungsdatum)\n\nBayern Amtsgericht München HRB 256369\nRegisterbekanntmachung nach dem Umwandlungsgesetz\n\nMEDDANE AG\nAktiengesellschaft\nMünchen\n\nDem Amtsgericht München -Registergericht- ist ein Verschmelzungsvertrag zwischen der VALMED Capital GmbH, Gräfelfing (Amtsgericht München  HRB 234984) und der Gesellschaft als übertragendem Rechtsträger zur Einsichtnahme eingereicht worden."
    },
    {
      "date": "2026-01-10",
      "id": "142047",
      "original_text": "Einreichung neuer Dokumente\nBayern Amtsgericht München HRB 295452\nHTS NA AG – München",
      "type": "Einreichung neuer Dokumente",
      "state": "Bayern",
      "amtsgericht": "Amtsgericht München",
      "registernummer": "HRB 295452",
      "registerart": "HRB",
      "company_name": "HTS NA AG",
      "company_seat": "München",
      "details": "10.01.2026 (Bekanntmachungsdatum)\n\nBayern Amtsgericht München HRB 295452\nEinreichung neuer Dokumente 09.01.2026 (Eintragungsdatum)\n\nHTS NA AG\nAktiengesellschaft\nMünchen\n\nDem Amtsgericht München -Registergericht- ist eine Liste der Mitglieder des Aufsichtsrats eingereicht worden, § 106 AktG."
    },
    {
      "date": "2026-01-10",
      "id": "142048",
      "original_text": "Sonstige Registerbekanntmachung\nBayern Amtsgericht München HRB 219466\nDie Malermeister Raatz GmbH – München",
      "type": "Sonstige Registerbekanntmachung",
      "state": "Bayern",
      "amtsgericht": "Amtsgericht München",
      "registernummer": "HRB 219466",
      "registerart": "HRB",
      "company_name": "Die Malermeister Raatz GmbH",
      "company_seat": "München",
      "details": "10.01.2026 (Bekanntmachungsdatum)\n\nBayern Amtsgericht München HRB 219466\nSonstige Registerbekanntmachung 09.01.2026 (Eintragungsdatum)\n\nDie Malermeister Raatz GmbH\nGesellschaft mit beschränkter Haftung\nMünchen\n\nDen Gläubigern der Gesellschaft, deren Forderungen begründet worden sind, bevor die Eintragung der Beendigung des Gewinnabführungsvertrages in das Handelsregister nach § 10 des Handelsgesetzbuches als bekanntgemacht gilt, hat der andere Vertragsteil Sicherheit zu leisten, wenn sie sich binnen sechs Monaten nach der Bekanntmachung der Eintragung zu diesem Zweck bei ihm melden."
    },
    {
      "date": "2026-01-10",
      "id": "142049",
      "original_text": "Registerbekanntmachung nach dem Umwandlungsgesetz\nBayern Amtsgericht München HRA 117501\nSebastian Konetzko e.K. – Grasbrunn",
      "type": "Registerbekanntmachung nach dem Umwandlungsgesetz",
      "state": "Bayern",
      "amtsgericht": "Amtsgericht München",
      "registernummer": "HRA 117501",
      "registerart": "HRA",
      "company_name": "Sebastian Konetzko e.K.",
      "company_seat": "Grasbrunn",
      "details": "10.01.2026 (Bekanntmachungsdatum)\n\nBayern Amtsgericht München HRA 117501\nRegisterbekanntmachung nach dem Umwandlungsgesetz 09.01.2026 (Eintragungsdatum)\n\nSebastian Konetzko e.K.\nEinzelkaufmann / Einzelkauffrau\nGrasbrunn\n\nDen Gläubigern der an der Ausgliederung beteiligten Rechtsträger ist, wenn sie binnen sechs Monaten nach dem Tag, an dem die Eintragung der Ausgliederung in das Register des Sitzes desjenigen Rechtsträgers, dessen Gläubiger sie sind, nach §§ 125, 19 Abs. 3 UmwG als bekannt gemacht gilt, ihren Anspruch nach Grund und Höhe in Textform anmelden, Sicherheit zu leisten, soweit sie nicht Befriedigung verlangen können. Dieses Recht steht den Gläubigern jedoch nur zu, wenn sie glaubhaft machen, dass durch die Ausgliederung die Erfüllung ihrer Forderung gefährdet wird."
    },
    {
      "date": "2026-01-10",
      "id": "142050",
      "original_text": "Löschungsankündigung\nBayern Amtsgericht Nürnberg HRB 29676\nEA - MARO UG (haftungsbeschränkt) – Nürnberg",
      "type": "Löschungsankündigung",
      "state": "Bayern",
      "amtsgericht": "Amtsgericht Nürnberg",
      "registernummer": "HRB 29676",
      "registerart": "HRB",
      "company_name": "EA - MARO UG (haftungsbeschränkt)",
      "company_seat": "Nürnberg",
      "details": "10.01.2026 (Bekanntmachungsdatum)\n\nBayern Amtsgericht Nürnberg HRB 29676\nLöschungsankündigung\n\nEA - MARO UG (haftungsbeschränkt)\nGesellschaft mit beschränkter Haftung\nNürnberg\n\nDas Registergericht beabsichtigt, die im Handelsregister eingetragene Gesellschaft wegen Vermögenslosigkeit von Amts wegen nach § 394 FamFG zu löschen. Die Frist zur Erhebung eines Widerspruchs ist auf einen Monat festgesetzt."
    },
    {
      "date": "2026-01-10",
      "id": "142051",
      "original_text": "Löschungsankündigung\nBayern Amtsgericht Ingolstadt HRB 7317\nALS-System s.r.o. – Rohrbach",
      "type": "Löschungsankündigung",
      "state": "Bayern",
      "amtsgericht": "Amtsgericht Ingolstadt",
      "registernummer": "HRB 7317",
      "registerart": "HRB",
      "company_name": "ALS-System s.r.o.",
      "company_seat": "Rohrbach",
      "details": "10.01.2026 (Bekanntmachungsdatum)\n\nBayern Amtsgericht Ingolstadt HRB 7317\nLöschungsankündigung\n\nALS-System s.r.o.\nRechtsform ausländischen Rechts HRB\nRohrbach\n\nDas Registergericht beabsichtigt, die im Handelsregister eingetragene Gesellschaft wegen Vermögenslosigkeit von Amts wegen nach § 394 FamFG zu löschen. Die Frist zur Erhebung eines Widerspruchs ist auf einen Monat festgesetzt."
    },
    {
      "date": "2026-01-10",
      "id": "142052",
      "original_text": "Löschungsankündigung\nBayern Amtsgericht Nürnberg HRB 35286\nAV Montagen GmbH – Nürnberg",
      "type": "Löschungsankündigung",
      "state": "Bayern",
      "amtsgericht": "Amtsgericht Nürnberg",
      "registernummer": "HRB 35286",
      "registerart": "HRB",
      "company_name": "AV Montagen GmbH",
      "company_seat": "Nürnberg",
      "details": "10.01.2026 (Bekanntmachungsdatum)\n\nBayern Amtsgericht Nürnberg HRB 35286\nLöschungsankündigung\n\nAV Montagen GmbH\nGesellschaft mit beschränkter Haftung\nNürnberg\n\nDas Registergericht beabsichtigt, die im Handelsregister eingetragene Gesellschaft wegen Vermögenslosigkeit von Amts wegen nach § 394 FamFG zu löschen. Die Frist zur Erhebung eines Widerspruchs ist auf einen Monat festgesetzt."
    },
    {
      "date": "2026-01-10",
      "id": "142053",
      "original_text": "Löschungsankündigung\nBayern Amtsgericht Nürnberg HRB 39131\nBS Roth GmbH – Roth",
      "type": "Löschungsankündigung",
      "state": "Bayern",
      "amtsgericht": "Amtsgericht Nürnberg",
      "registernummer": "HRB 39131",
      "registerart": "HRB",
      "company_name": "BS Roth GmbH",
      "company_seat": "Roth",
      "details": "10.01.2026 (Bekanntmachungsdatum)\n\nBayern Amtsgericht Nürnberg HRB 39131\nLöschungsankündigung\n\nBS Roth GmbH\nGesellschaft mit beschränkter Haftung\nRoth\n\nDas Registergericht beabsichtigt, den im Handelsregister eingetragenen Geschäftsführer wegen fehlender Eignung nach § 395 FamFG zu löschen. Die Frist zur Erhebung eines Widerspruchs ist auf einen Monat festgesetzt."
    },
    {
      "date": "2026-01-10",
      "id": "142054",
      "original_text": "Sonstige Registerbekanntmachung\nBayern Amtsgericht Ingolstadt HRB 46\nAutohaus Hofmann GmbH – Ingolstadt",
      "type": "Sonstige Registerbekanntmachung",
      "state": "Bayern",
      "amtsgericht": "Amtsgericht Ingolstadt",
      "registernummer": "HRB 46",
      "registerart": "HRB",
      "company_name": "Autohaus Hofmann GmbH",
      "company_seat": "Ingolstadt",
      "details": "10.01.2026 (Bekanntmachungsdatum)\n\nBayern Amtsgericht Ingolstadt HRB 46\nSonstige Registerbekanntmachung 09.01.2026 (Eintragungsdatum)\n\nAutohaus Hofmann GmbH\nGesellschaft mit beschränkter Haftung\nIngolstadt\n\nDen Gläubigern der Gesellschaft, deren Forderungen begründet worden sind, bevor die Eintragung der Beendigung des Beherrschungs- und Gewinnabführungsvertrages in das Handelsregister nach § 10 des Handelsgesetzbuches als bekanntgemacht gilt, hat der andere Vertragsteil Sicherheit zu leisten, wenn sie sich binnen sechs Monaten nach der Bekanntmachung der Eintragung zu diesem Zweck bei ihm melden."
    },
    {
      "date": "2026-01-10",
      "id": "142055",
      "original_text": "Löschungsankündigung\nBayern Amtsgericht München HRB 265308\nNHW Nature Hardwood UG (haftungsbeschränkt) – München",
      "type": "Löschungsankündigung",
      "state": "Bayern",
      "amtsgericht": "Amtsgericht München",
      "registernummer": "HRB 265308",
      "registerart": "HRB",
      "company_name": "NHW Nature Hardwood UG (haftungsbeschränkt)",
      "company_seat": "München",
      "details": "10.01.2026 (Bekanntmachungsdatum)\n\nBayern Amtsgericht München HRB 265308\nLöschungsankündigung 09.01.2026 (Eintragungsdatum)\n\nNHW Nature Hardwood UG (haftungsbeschränkt)\nGesellschaft mit beschränkter Haftung\nMünchen\n\nDas Registergericht beabsichtigt, die im Handelsregister eingetragene Gesellschaft wegen Vermögenslosigkeit von Amts wegen nach § 394 FamFG zu löschen. Die Frist zur Erhebung eines Widerspruchs ist auf drei Monate festgesetzt."
    },
    {
      "date": "2026-01-10",
      "id": "142056",
      "original_text": "Sonstige Registerbekanntmachung\nBayern Amtsgericht München HRB 172904\nSilver Atena GmbH – München",
      "type": "Sonstige Registerbekanntmachung",
      "state": "Bayern",
      "amtsgericht": "Amtsgericht München",
      "registernummer": "HRB 172904",
      "registerart": "HRB",
      "company_name": "Silver Atena GmbH",
      "company_seat": "München",
      "details": "10.01.2026 (Bekanntmachungsdatum)\n\nBayern Amtsgericht München HRB 172904\nSonstige Registerbekanntmachung 09.01.2026 (Eintragungsdatum)\n\nSilver Atena GmbH\nGesellschaft mit beschränkter Haftung\nMünchen\n\nDen Gläubigern der Gesellschaft, deren Forderungen begründet worden sind, bevor die Eintragung der Beendigung des Gewinnabführungsvertrages in das Handelsregister nach § 10 des Handelsgesetzbuches als bekanntgemacht gilt, hat der andere Vertragsteil Sicherheit zu leisten, wenn sie sich binnen sechs Monaten nach der Bekanntmachung der Eintragung zu diesem Zweck bei ihm melden."
    },
    {
      "date": "2026-01-10",
      "id": "142057",
      "original_text": "Einreichung neuer Dokumente\nBayern Amtsgericht München HRB 121987\nBayern Digital Radio GmbH – München",
      "type": "Einreichung neuer Dokumente",
      "state": "Bayern",
      "amtsgericht": "Amtsgericht München",
      "registernummer": "HRB 121987",
      "registerart": "HRB",
      "company_name": "Bayern Digital Radio GmbH",
      "company_seat": "München",
      "details": "10.01.2026 (Bekanntmachungsdatum)\n\nBayern Amtsgericht München HRB 121987\nEinreichung neuer Dokumente\n\nBayern Digital Radio GmbH\nGesellschaft mit beschränkter Haftung\nMünchen\n\nDem Amtsgericht München -Registergericht- ist eine Liste der Mitglieder des Aufsichtsrats eingereicht worden, § 52 Abs. 3 S. 2 GmbHG."
    },
    {
      "date": "2026-01-10",
      "id": "142058",
      "original_text": "Registerbekanntmachung nach dem Umwandlungsgesetz\nBayern Amtsgericht Nürnberg HRB 1133\nBoutique Madame Gesellschaft mit beschränkter Haftung – Nürnberg",
      "type": "Registerbekanntmachung nach dem Umwandlungsgesetz",
      "state": "Bayern",
      "amtsgericht": "Amtsgericht Nürnberg",
      "registernummer": "HRB 1133",
      "registerart": "HRB",
      "company_name": "Boutique Madame Gesellschaft mit beschränkter Haftung",
      "company_seat": "Nürnberg",
      "details": "10.01.2026 (Bekanntmachungsdatum)\n\nBayern Amtsgericht Nürnberg HRB 1133\nRegisterbekanntmachung nach dem Umwandlungsgesetz 09.01.2026 (Eintragungsdatum)\n\nBoutique Madame Gesellschaft mit beschränkter Haftung\nGesellschaft mit beschränkter Haftung\nNürnberg\n\nDen Gläubigern der an der Verschmelzung beteiligten Rechtsträger ist, wenn sie binnen sechs Monaten nach dem Tag, an dem die Eintragung der Verschmelzung in das Register des Sitzes desjenigen Rechtsträgers, dessen Gläubiger sie sind, nach § 19 Abs. 3 UmwG als bekannt gemacht gilt, ihren Anspruch nach Grund und Höhe in Textform anmelden, Sicherheit zu leisten, soweit sie nicht Befriedigung verlangen können. Dieses Recht steht den Gläubigern jedoch nur zu, wenn sie glaubhaft machen, dass durch die Verschmelzung die Erfüllung ihrer Forderung gefährdet wird."
    },
    {
      "date": "2026-01-10",
      "id": "142059",
      "original_text": "Einreichung neuer Dokumente\nBayern Amtsgericht München HRB 189776\nPROXIA Software AG – Ebersberg",
      "type": "Einreichung neuer Dokumente",
      "state": "Bayern",
      "amtsgericht": "Amtsgericht München",
      "registernummer": "HRB 189776",
      "registerart": "HRB",
      "company_name": "PROXIA Software AG",
      "company_seat": "Ebersberg",
      "details": "10.01.2026 (Bekanntmachungsdatum)\n\nBayern Amtsgericht München HRB 189776\nEinreichung neuer Dokumente\n\nPROXIA Software AG\nAktiengesellschaft\nEbersberg\n\nDem Amtsgericht München -Registergericht- ist eine Liste der Mitglieder des Aufsichtsrats eingereicht worden, § 106 AktG."
    },
    {
      "date": "2026-01-10",
      "id": "142060",
      "original_text": "Registerbekanntmachung nach dem Umwandlungsgesetz\nBayern Amtsgericht Würzburg HRB 17885\nVogel Corporate Solutions GmbH – Würzburg",
      "type": "Registerbekanntmachung nach dem Umwandlungsgesetz",
      "state": "Bayern",
      "amtsgericht": "Amtsgericht Würzburg",
      "registernummer": "HRB 17885",
      "registerart": "HRB",
      "company_name": "Vogel Corporate Solutions GmbH",
      "company_seat": "Würzburg",
      "details": "10.01.2026 (Bekanntmachungsdatum)\n\nBayern Amtsgericht Würzburg HRB 17885\nRegisterbekanntmachung nach dem Umwandlungsgesetz 09.01.2026 (Eintragungsdatum)\n\nVogel Corporate Solutions GmbH\nGesellschaft mit beschränkter Haftung\nWürzburg\n\nDen Gläubigern der Gesellschaft, deren Forderungen begründet worden sind, bevor die Eintragung der Beendigung des Beherrschungs- und Gewinnabführungsvertrages in das Handelsregister nach § 10 des Handelsgesetzbuches als bekanntgemacht gilt, hat der andere Vertragsteil Sicherheit zu leisten, wenn sie sich binnen sechs Monaten nach der Bekanntmachung der Eintragung zu diesem Zweck bei ihm melden."
    },
    {
      "date": "2026-01-10",
      "id": "142061",
      "original_text": "Registerbekanntmachung nach dem Umwandlungsgesetz\nBayern Amtsgericht München HRB 226313\nKorian Tannenpark GmbH – München",
      "type": "Registerbekanntmachung nach dem Umwandlungsgesetz",
      "state": "Bayern",
      "amtsgericht": "Amtsgericht München",
      "registernummer": "HRB 226313",
      "registerart": "HRB",
      "company_name": "Korian Tannenpark GmbH",
      "company_seat": "München",
      "details": "10.01.2026 (Bekanntmachungsdatum)\n\nBayern Amtsgericht München HRB 226313\nRegisterbekanntmachung nach dem Umwandlungsgesetz 09.01.2026 (Eintragungsdatum)\n\nKorian Tannenpark GmbH\nGesellschaft mit beschränkter Haftung\nMünchen\n\nDen Gläubigern der an der Verschmelzung beteiligten Rechtsträger ist, wenn sie binnen sechs Monaten nach dem Tag, an dem die Eintragung der Verschmelzung in das Register des Sitzes desjenigen Rechtsträgers, dessen Gläubiger sie sind, nach § 19 Abs. 3 UmwG als bekannt gemacht gilt, ihren Anspruch nach Grund und Höhe in Textform anmelden, Sicherheit zu leisten, soweit sie nicht Befriedigung verlangen können. Dieses Recht steht den Gläubigern jedoch nur zu, wenn sie glaubhaft machen, dass durch die Verschmelzung die Erfüllung ihrer Forderung gefährdet wird."
    },
    {
      "date": "2026-01-10",
      "id": "142062",
      "original_text": "Registerbekanntmachung nach dem Umwandlungsgesetz\nBayern Amtsgericht Nürnberg HRB 45437\nBoutique Madame Maison GmbH – Nürnberg",
      "type": "Registerbekanntmachung nach dem Umwandlungsgesetz",
      "state": "Bayern",
      "amtsgericht": "Amtsgericht Nürnberg",
      "registernummer": "HRB 45437",
      "registerart": "HRB",
      "company_name": "Boutique Madame Maison GmbH",
      "company_seat": "Nürnberg",
      "details": "10.01.2026 (Bekanntmachungsdatum)\n\nBayern Amtsgericht Nürnberg HRB 45437\nRegisterbekanntmachung nach dem Umwandlungsgesetz 09.01.2026 (Eintragungsdatum)\n\nBoutique Madame Maison GmbH\nGesellschaft mit beschränkter Haftung\nNürnberg\n\nDen Gläubigern der an der Verschmelzung beteiligten Rechtsträger ist, wenn sie binnen sechs Monaten nach dem Tag, an dem die Eintragung der Verschmelzung in das Register des Sitzes desjenigen Rechtsträgers, dessen Gläubiger sie sind, nach § 19 Abs. 3 UmwG als bekannt gemacht gilt, ihren Anspruch nach Grund und Höhe in Textform anmelden, Sicherheit zu leisten, soweit sie nicht Befriedigung verlangen können. Dieses Recht steht den Gläubigern jedoch nur zu, wenn sie glaubhaft machen, dass durch die Verschmelzung die Erfüllung ihrer Forderung gefährdet wird."
    },
    {
      "date": "2026-01-10",
      "id": "142063",
      "original_text": "Registerbekanntmachung nach dem Umwandlungsgesetz\nBayern Amtsgericht München HRB 246003\nENKRAFT CAPITAL GmbH – Unterhaching",
      "type": "Registerbekanntmachung nach dem Umwandlungsgesetz",
      "state": "Bayern",
      "amtsgericht": "Amtsgericht München",
      "registernummer": "HRB 246003",
      "registerart": "HRB",
      "company_name": "ENKRAFT CAPITAL GmbH",
      "company_seat": "Unterhaching",
      "details": "10.01.2026 (Bekanntmachungsdatum)\n\nBayern Amtsgericht München HRB 246003\nRegisterbekanntmachung nach dem Umwandlungsgesetz 09.01.2026 (Eintragungsdatum)\n\nENKRAFT CAPITAL GmbH\nGesellschaft mit beschränkter Haftung\nUnterhaching\n\nDen Gläubigern der an der Verschmelzung beteiligten Rechtsträger ist, wenn sie binnen sechs Monaten nach dem Tag, an dem die Eintragung der Verschmelzung in das Register des Sitzes desjenigen Rechtsträgers, dessen Gläubiger sie sind, nach § 19 Abs. 3 UmwG als bekannt gemacht gilt, ihren Anspruch nach Grund und Höhe in Textform anmelden, Sicherheit zu leisten, soweit sie nicht Befriedigung verlangen können. Dieses Recht steht den Gläubigern jedoch nur zu, wenn sie glaubhaft machen, dass durch die Verschmelzung die Erfüllung ihrer Forderung gefährdet wird."
    },
    {
      "date": "2026-01-10",
      "id": "142064",
      "original_text": "Registerbekanntmachung nach dem Umwandlungsgesetz\nBayern Amtsgericht Nürnberg HRA 5838\nBoutique Madame GmbH & Co. Maison KG – Nürnberg",
      "type": "Registerbekanntmachung nach dem Umwandlungsgesetz",
      "state": "Bayern",
      "amtsgericht": "Amtsgericht Nürnberg",
      "registernummer": "HRA 5838",
      "registerart": "HRA",
      "company_name": "Boutique Madame GmbH & Co. Maison KG",
      "company_seat": "Nürnberg",
      "details": "10.01.2026 (Bekanntmachungsdatum)\n\nBayern Amtsgericht Nürnberg HRA 5838\nRegisterbekanntmachung nach dem Umwandlungsgesetz 09.01.2026 (Eintragungsdatum)\n\nBoutique Madame GmbH & Co. Maison KG\nKommanditgesellschaft\nNürnberg\n\nDen Gläubigern des formwechselnden Rechtsträgers ist, wenn sie binnen sechs Monaten nach dem Tag, an dem die Eintragung des Formwechsels nach § 201 UmwG als bekannt gemacht gilt, ihren Anspruch nach Grund und Höhe in Textform anmelden, Sicherheit zu leisten, soweit sie nicht Befriedigung verlangen können. Dieses Recht steht den Gläubigern jedoch nur zu, wenn sie glaubhaft machen, dass durch den Formwechsel die Erfüllung ihrer Forderung gefährdet wird."
    },
    {
      "date": "2026-01-10",
      "id": "142065",
      "original_text": "Einreichung neuer Dokumente\nBayern Amtsgericht München HRB 143966\nZusatzversorgungskasse der Steine- und Erden-Industrie und des Betonsteinhandwerks VVaG Die Bayerische Pensionskasse – München",
      "type": "Einreichung neuer Dokumente",
      "state": "Bayern",
      "amtsgericht": "Amtsgericht München",
      "registernummer": "HRB 143966",
      "registerart": "HRB",
      "company_name": "Zusatzversorgungskasse der Steine- und Erden-Industrie und des Betonsteinhandwerks VVaG Die Bayerische Pensionskasse",
      "company_seat": "München",
      "details": "10.01.2026 (Bekanntmachungsdatum)\n\nBayern Amtsgericht München HRB 143966\nEinreichung neuer Dokumente 09.01.2026 (Eintragungsdatum)\n\nZusatzversorgungskasse der Steine- und Erden-Industrie und des Betonsteinhandwerks VVaG Die Bayerische Pensionskasse\nVersicherungsverein auf Gegenseitigkeit\nMünchen\n\nDem Amtsgericht München -Registergericht- ist eine Liste der Mitglieder des Aufsichtsrats eingereicht worden, §§ 189 Abs. 3 Satz 1 VAG, 106 AktG."
    },
    {
      "date": "2026-01-10",
      "id": "142066",
      "original_text": "Registerbekanntmachung nach dem Umwandlungsgesetz\nBayern Amtsgericht München HRB 280467\nSophora sX Beteiligungs GmbH – München",
      "type": "Registerbekanntmachung nach dem Umwandlungsgesetz",
      "state": "Bayern",
      "amtsgericht": "Amtsgericht München",
      "registernummer": "HRB 280467",
      "registerart": "HRB",
      "company_name": "Sophora sX Beteiligungs GmbH",
      "company_seat": "München",
      "details": "10.01.2026 (Bekanntmachungsdatum)\n\nBayern Amtsgericht München HRB 280467\nRegisterbekanntmachung nach dem Umwandlungsgesetz\n\nSophora sX Beteiligungs GmbH\nGesellschaft mit beschränkter Haftung\nMünchen\n\nDem Amtsgericht München -Registergericht- ist am 15.12.2025 der Entwurf eines Verschmelzungsvertrages und -plans über die geplante Verschmelzung der Gesellschaft mit beschränkter Haftung unter Firma PlutusX BidCo GmbH mit Sitz in Graz/Österreich (Landesgericht für Zivilrechtssachen Graz FN 622722 v) mit der Gesellschaft als übertragendem Rechtsträger eingereicht worden.  Die Anteilsinhaber, die Gläubiger sowie die zuständigen Betriebsräte der an der grenzüberschreitenden Verschmelzung beteiligten Gesellschaften oder, soweit es keinen Betriebsrat gibt, die Arbeitnehmer der an der grenzüberschreitenden Verschmelzung beteiligten Gesellschaften, können der jeweiligen Gesellschaft spätestens fünf Arbeitstage vor dem Tag der Gesellschafterversammlung Bemerkungen zum Verschmelzungsplan übermitteln."
    },
    {
      "date": "2026-01-10",
      "id": "142067",
      "original_text": "Sonstige Registerbekanntmachung\nBayern Amtsgericht München HRB 104035\nA-Switch GmbH Elektronik-Vertrieb – Erding",
      "type": "Sonstige Registerbekanntmachung",
      "state": "Bayern",
      "amtsgericht": "Amtsgericht München",
      "registernummer": "HRB 104035",
      "registerart": "HRB",
      "company_name": "A-Switch GmbH Elektronik-Vertrieb",
      "company_seat": "Erding",
      "details": "10.01.2026 (Bekanntmachungsdatum)\n\nBayern Amtsgericht München HRB 104035\nSonstige Registerbekanntmachung 09.01.2026 (Eintragungsdatum)\n\nA-Switch GmbH Elektronik-Vertrieb\nGesellschaft mit beschränkter Haftung\nErding\n\nDen Gläubigern der Gesellschaft, deren Forderungen begründet worden sind, bevor die Eintragung der Beendigung des Gewinnabführungsvertrages in das Handelsregister nach § 10 des Handelsgesetzbuches als bekanntgemacht gilt, hat der andere Vertragsteil Sicherheit zu leisten, wenn sie sich binnen sechs Monaten nach der Bekanntmachung der Eintragung zu diesem Zweck bei ihm melden."
    },
    {
      "date": "2026-01-10",
      "id": "142068",
      "original_text": "Registerbekanntmachung nach dem Umwandlungsgesetz\nNiedersachsen Amtsgericht Osnabrück HRB 215135\nMomentum by Tea Time GmbH – Lingen (Ems)",
      "type": "Registerbekanntmachung nach dem Umwandlungsgesetz",
      "state": "Niedersachsen",
      "amtsgericht": "Amtsgericht Osnabrück",
      "registernummer": "HRB 215135",
      "registerart": "HRB",
      "company_name": "Momentum by Tea Time GmbH",
      "company_seat": "Lingen (Ems)",
      "details": "10.01.2026 (Bekanntmachungsdatum)\n\nNiedersachsen Amtsgericht Osnabrück HRB 215135\nRegisterbekanntmachung nach dem Umwandlungsgesetz 10.01.2026 (Eintragungsdatum)\n\nMomentum by Tea Time GmbH\nGesellschaft mit beschränkter Haftung\nLingen (Ems)\n\nDen Gläubigern der an der Verschmelzung beteiligten Rechtsträger ist, wenn sie binnen sechs Monaten nach dem Tag, an dem die Eintragung der Verschmelzung in das Register des Sitzes desjenigen Rechtsträgers, dessen Gläubiger sie sind, nach § 19  Abs.  3 UmwG als bekannt gemacht gilt, ihren Anspruch nach Grund und Höhe schriftlich anmelden, Sicherheit zu leisten, soweit sie nicht Befriedigung verlangen können. Dieses Recht steht den Gläubigern jedoch nur zu, wenn sie glaubhaft machen, dass durch die Verschmelzung die Erfüllung der Forderung gefährdet wird."
    }
  ]
}