{
  "date": "2026-01-19",
  "date_of_scrape": "2026-01-20T04:25:49.433Z",
  "tool_version": "0.2.0",
  "number_of_announcements": 133,
  "announcements": [
    {
      "date": "2026-01-19",
      "id": "142711",
      "original_text": "Einreichung neuer Dokumente\nBaden-Württemberg Amtsgericht Mannheim HRB 728188\nArtus AG – Baden-Baden",
      "type": "Einreichung neuer Dokumente",
      "state": "Baden-Württemberg",
      "amtsgericht": "Amtsgericht Mannheim",
      "registernummer": "HRB 728188",
      "registerart": "HRB",
      "company_name": "Artus AG",
      "company_seat": "Baden-Baden",
      "details": "19.01.2026 (Bekanntmachungsdatum)\n\nBaden-Württemberg Amtsgericht Mannheim HRB 728188\nEinreichung neuer Dokumente\n\nArtus AG\nAktiengesellschaft\nBaden-Baden\n\nDie Gesellschaft hat am 18.12.2025 die Liste über die Zusammensetzung des Aufsichtsrats zum Handelsregister eingereicht."
    },
    {
      "date": "2026-01-19",
      "id": "142712",
      "original_text": "Einreichung neuer Dokumente\nBerlin Amtsgericht Berlin (Charlottenburg) HRB 1164\nSchindler Aufzüge und Fahrtreppen GmbH – Berlin",
      "type": "Einreichung neuer Dokumente",
      "state": "Berlin",
      "amtsgericht": "Amtsgericht Berlin (Charlottenburg)",
      "registernummer": "HRB 1164",
      "registerart": "HRB",
      "company_name": "Schindler Aufzüge und Fahrtreppen GmbH",
      "company_seat": "Berlin",
      "details": "19.01.2026 (Bekanntmachungsdatum)\n\nBerlin Amtsgericht Berlin (Charlottenburg) HRB 1164\nEinreichung neuer Dokumente\n\nSchindler Aufzüge und Fahrtreppen GmbH\nGesellschaft mit beschränkter Haftung\nBerlin\n\nAls nicht eingetragen wird veröffentlicht: Es wurde eine neue Liste der Aufsichtsratsmitglieder eingereicht (§52 GmbHG)."
    },
    {
      "date": "2026-01-19",
      "id": "142713",
      "original_text": "Sonstige Registerbekanntmachung\nBaden-Württemberg Amtsgericht Stuttgart HRB 780601\nRobert Bosch Robotics GmbH – Gerlingen",
      "type": "Sonstige Registerbekanntmachung",
      "state": "Baden-Württemberg",
      "amtsgericht": "Amtsgericht Stuttgart",
      "registernummer": "HRB 780601",
      "registerart": "HRB",
      "company_name": "Robert Bosch Robotics GmbH",
      "company_seat": "Gerlingen",
      "details": "19.01.2026 (Bekanntmachungsdatum)\n\nBaden-Württemberg Amtsgericht Stuttgart HRB 780601\nSonstige Registerbekanntmachung 19.01.2026 (Eintragungsdatum)\n\nRobert Bosch Robotics GmbH\nGesellschaft mit beschränkter Haftung\nGerlingen\n\nDen Gläubigern der Gesellschaft, deren Forderungen begründet worden sind, bevor die Eintragung der Beendigung des Vertrages in das Handelsregister nach § 10 HGB als bekanntgemacht gilt, ist vom anderen Vertragsteil Sicherheit zu leisten, wenn sie sich binnen sechs Monaten nach der Bekanntmachung zu diesem Zweck bei ihm melden."
    },
    {
      "date": "2026-01-19",
      "id": "142714",
      "original_text": "Löschungsankündigung\nBerlin Amtsgericht Berlin (Charlottenburg) HRB 16799\nLemb und Zimpfer, Malereibetrieb, Gesellschaft mit beschränkter Haftung – Berlin",
      "type": "Löschungsankündigung",
      "state": "Berlin",
      "amtsgericht": "Amtsgericht Berlin (Charlottenburg)",
      "registernummer": "HRB 16799",
      "registerart": "HRB",
      "company_name": "Lemb und Zimpfer, Malereibetrieb, Gesellschaft mit beschränkter Haftung",
      "company_seat": "Berlin",
      "details": "19.01.2026 (Bekanntmachungsdatum)\n\nBerlin Amtsgericht Berlin (Charlottenburg) HRB 16799\nLöschungsankündigung\n\nLemb und Zimpfer, Malereibetrieb, Gesellschaft mit beschränkter Haftung\nGesellschaft mit beschränkter Haftung\nBerlin\n\nBei der nachstehenden Gesellschaft wird das Amtslöschungsverfahren gemäß § 394 FamFG eingeleitet. Widerspruchsfrist 6 Wochen"
    },
    {
      "date": "2026-01-19",
      "id": "142715",
      "original_text": "Sonstige Registerbekanntmachung\nBrandenburg Amtsgericht Cottbus HRB 8343\nMadMax Media UG (haftungsbeschränkt) – Senftenberg",
      "type": "Sonstige Registerbekanntmachung",
      "state": "Brandenburg",
      "amtsgericht": "Amtsgericht Cottbus",
      "registernummer": "HRB 8343",
      "registerart": "HRB",
      "company_name": "MadMax Media UG (haftungsbeschränkt)",
      "company_seat": "Senftenberg",
      "details": "19.01.2026 (Bekanntmachungsdatum)\n\nBrandenburg Amtsgericht Cottbus HRB 8343\nSonstige Registerbekanntmachung\n\nMadMax Media UG (haftungsbeschränkt)\nGesellschaft mit beschränkter Haftung\nSenftenberg\n\nDie Gesellschaft ist durch Abweisung des Antrages auf Eröffnung des Insolvenzverfahrens mangels Masse aufgelöst."
    },
    {
      "date": "2026-01-19",
      "id": "142716",
      "original_text": "Einreichung neuer Dokumente\nBaden-Württemberg Amtsgericht Stuttgart HRB 763512\nBaden-Württemberg-Tarif GmbH – Stuttgart",
      "type": "Einreichung neuer Dokumente",
      "state": "Baden-Württemberg",
      "amtsgericht": "Amtsgericht Stuttgart",
      "registernummer": "HRB 763512",
      "registerart": "HRB",
      "company_name": "Baden-Württemberg-Tarif GmbH",
      "company_seat": "Stuttgart",
      "details": "19.01.2026 (Bekanntmachungsdatum)\n\nBaden-Württemberg Amtsgericht Stuttgart HRB 763512\nEinreichung neuer Dokumente\n\nBaden-Württemberg-Tarif GmbH\nGesellschaft mit beschränkter Haftung\nStuttgart\n\nDie Gesellschaft hat am 16.01.2026 die Liste über die Zusammensetzung des Aufsichtsrats zum Handelsregister eingereicht."
    },
    {
      "date": "2026-01-19",
      "id": "142717",
      "original_text": "Registerbekanntmachung nach dem Umwandlungsgesetz\nBaden-Württemberg Amtsgericht Freiburg HRB 710128\nSchlossbergring GmbH – Freiburg im Breisgau",
      "type": "Registerbekanntmachung nach dem Umwandlungsgesetz",
      "state": "Baden-Württemberg",
      "amtsgericht": "Amtsgericht Freiburg",
      "registernummer": "HRB 710128",
      "registerart": "HRB",
      "company_name": "Schlossbergring GmbH",
      "company_seat": "Freiburg im Breisgau",
      "details": "19.01.2026 (Bekanntmachungsdatum)\n\nBaden-Württemberg Amtsgericht Freiburg HRB 710128\nRegisterbekanntmachung nach dem Umwandlungsgesetz 19.01.2026 (Eintragungsdatum)\n\nSchlossbergring GmbH\nGesellschaft mit beschränkter Haftung\nFreiburg im Breisgau\n\nAls nicht eingetragen wird bekanntgemacht:\nDen Gläubigern der an der Verschmelzung beteiligten Rechtsträger ist, wenn sie binnen sechs Monaten nach dem Tag, an dem die Eintragung der Verschmelzung in das Register des Sitzes desjenigen Rechtsträgers, dessen Gläubiger sie sind, nach § 19 Abs. 3 UmwG als bekanntgemacht gilt, ihren Anspruch nach Grund und Höhe schriftlich anmelden, Sicherheit zu leisten, soweit sie nicht Befriedigung verlangen können. Dieses Recht steht den Gläubigern jedoch nur zu, wenn sie glaubhaft machen, dass durch die Verschmelzung die Erfüllung ihrer Forderung gefährdet wird."
    },
    {
      "date": "2026-01-19",
      "id": "142718",
      "original_text": "Löschungsankündigung\nHamburg Amtsgericht Hamburg HRB 177379\n3FMTechnologie UG (haftungsbeschränkt) – Hamburg",
      "type": "Löschungsankündigung",
      "state": "Hamburg",
      "amtsgericht": "Amtsgericht Hamburg",
      "registernummer": "HRB 177379",
      "registerart": "HRB",
      "company_name": "3FMTechnologie UG (haftungsbeschränkt)",
      "company_seat": "Hamburg",
      "details": "19.01.2026 (Bekanntmachungsdatum)\n\nHamburg Amtsgericht Hamburg HRB 177379\nLöschungsankündigung\n\n3FMTechnologie UG (haftungsbeschränkt)\nGesellschaft mit beschränkter Haftung\nHamburg\n\nDas Registergericht beabsichtigt, die im Handelsregister eingetragene Gesellschaft von Amts wegen nach § 394 FamFG zu löschen. Die Frist zur Erhebung eines Widerspruchs gegen die beabsichtigte Löschung wird auf 3 Monate festgesetzt."
    },
    {
      "date": "2026-01-19",
      "id": "142719",
      "original_text": "Löschungsankündigung\nHamburg Amtsgericht Hamburg HRB 109723\nBonus-HH GmbH – Hamburg",
      "type": "Löschungsankündigung",
      "state": "Hamburg",
      "amtsgericht": "Amtsgericht Hamburg",
      "registernummer": "HRB 109723",
      "registerart": "HRB",
      "company_name": "Bonus-HH GmbH",
      "company_seat": "Hamburg",
      "details": "19.01.2026 (Bekanntmachungsdatum)\n\nHamburg Amtsgericht Hamburg HRB 109723\nLöschungsankündigung\n\nBonus-HH GmbH\nGesellschaft mit beschränkter Haftung\nHamburg\n\nDas Registergericht beabsichtigt, die im Handelsregister eingetragene Gesellschaft von Amts wegen nach § 394 FamFG zu löschen. Die Frist zur Erhebung eines Widerspruchs gegen die beabsichtigte Löschung wird auf 3 Monate festgesetzt."
    },
    {
      "date": "2026-01-19",
      "id": "142720",
      "original_text": "Löschungsankündigung\nHamburg Amtsgericht Hamburg HRB 153961\nHPA - Hamburger Personaldienstleistungs Agentur GmbH – Hamburg",
      "type": "Löschungsankündigung",
      "state": "Hamburg",
      "amtsgericht": "Amtsgericht Hamburg",
      "registernummer": "HRB 153961",
      "registerart": "HRB",
      "company_name": "HPA - Hamburger Personaldienstleistungs Agentur GmbH",
      "company_seat": "Hamburg",
      "details": "19.01.2026 (Bekanntmachungsdatum)\n\nHamburg Amtsgericht Hamburg HRB 153961\nLöschungsankündigung\n\nHPA - Hamburger Personaldienstleistungs Agentur GmbH\nGesellschaft mit beschränkter Haftung\nHamburg\n\nDas Registergericht beabsichtigt, die im Handelsregister eingetragene Gesellschaft von Amts wegen nach § 394 FamFG zu löschen. Die Frist zur Erhebung eines Widerspruchs gegen die beabsichtigte Löschung wird auf 3 Monate festgesetzt."
    },
    {
      "date": "2026-01-19",
      "id": "142721",
      "original_text": "Löschungsankündigung\nHamburg Amtsgericht Hamburg HRB 157844\nMZ Kurier-Transporte GmbH – Hamburg",
      "type": "Löschungsankündigung",
      "state": "Hamburg",
      "amtsgericht": "Amtsgericht Hamburg",
      "registernummer": "HRB 157844",
      "registerart": "HRB",
      "company_name": "MZ Kurier-Transporte GmbH",
      "company_seat": "Hamburg",
      "details": "19.01.2026 (Bekanntmachungsdatum)\n\nHamburg Amtsgericht Hamburg HRB 157844\nLöschungsankündigung\n\nMZ Kurier-Transporte GmbH\nGesellschaft mit beschränkter Haftung\nHamburg\n\nDas Registergericht beabsichtigt, die im Handelsregister eingetragene Gesellschaft von Amts wegen nach § 394 FamFG zu löschen. Die Frist zur Erhebung eines Widerspruchs gegen die beabsichtigte Löschung wird auf 3 Monate festgesetzt."
    },
    {
      "date": "2026-01-19",
      "id": "142722",
      "original_text": "Löschungsankündigung\nHamburg Amtsgericht Hamburg HRB 166329\nDécence GmbH – Hamburg",
      "type": "Löschungsankündigung",
      "state": "Hamburg",
      "amtsgericht": "Amtsgericht Hamburg",
      "registernummer": "HRB 166329",
      "registerart": "HRB",
      "company_name": "Décence GmbH",
      "company_seat": "Hamburg",
      "details": "19.01.2026 (Bekanntmachungsdatum)\n\nHamburg Amtsgericht Hamburg HRB 166329\nLöschungsankündigung\n\nDécence GmbH\nGesellschaft mit beschränkter Haftung\nHamburg\n\nDas Registergericht beabsichtigt, die im Handelsregister eingetragene Gesellschaft von Amts wegen nach § 394 FamFG zu löschen. Die Frist zur Erhebung eines Widerspruchs gegen die beabsichtigte Löschung wird auf 3 Monate festgesetzt."
    },
    {
      "date": "2026-01-19",
      "id": "142723",
      "original_text": "Löschungsankündigung\nHamburg Amtsgericht Hamburg HRB 99461\nWCG Konzept GmbH – Hamburg",
      "type": "Löschungsankündigung",
      "state": "Hamburg",
      "amtsgericht": "Amtsgericht Hamburg",
      "registernummer": "HRB 99461",
      "registerart": "HRB",
      "company_name": "WCG Konzept GmbH",
      "company_seat": "Hamburg",
      "details": "19.01.2026 (Bekanntmachungsdatum)\n\nHamburg Amtsgericht Hamburg HRB 99461\nLöschungsankündigung\n\nWCG Konzept GmbH\nGesellschaft mit beschränkter Haftung\nHamburg\n\nDas Registergericht beabsichtigt, die im Handelsregister eingetragene Gesellschaft von Amts wegen nach § 394 FamFG zu löschen. Die Frist zur Erhebung eines Widerspruchs gegen die beabsichtigte Löschung wird auf 3 Monate festgesetzt."
    },
    {
      "date": "2026-01-19",
      "id": "142724",
      "original_text": "Löschungsankündigung\nHamburg Amtsgericht Hamburg HRB 134836\nNILEAPI GmbH – Hamburg",
      "type": "Löschungsankündigung",
      "state": "Hamburg",
      "amtsgericht": "Amtsgericht Hamburg",
      "registernummer": "HRB 134836",
      "registerart": "HRB",
      "company_name": "NILEAPI GmbH",
      "company_seat": "Hamburg",
      "details": "19.01.2026 (Bekanntmachungsdatum)\n\nHamburg Amtsgericht Hamburg HRB 134836\nLöschungsankündigung\n\nNILEAPI GmbH\nGesellschaft mit beschränkter Haftung\nHamburg\n\nNach Mitteilung des Bezirksamtes Hamburg-Mitte wurde dem Geschäftsführer Ayman Gaber Ahmed Allam durch Bescheid vom 09.10.2025, bestandskräftig seit dem 18.11.2025, (Gesch.Nr.: M/VS1112/736.00-05/57/25) der Betrieb eines Gewerbes \"Der Handel von Chemikalien für Reinigungsmitteln, Chemikalien, Labor-, diagnostische und medizinische Versorgung, Labor- und pharmazeutische Rohstoffe, Rohstoffe von landwirtschaftlichen Pestiziden, Insektiziden und Handel von landwirtschaftlichen Düngemitteln und Pestiziden, und Herstellung von anderen Fabriken; Handel von Kosmetik und Nahrungsergänzungsmitteln und Herstellung in anderen Fabriken; Handel von Futter und Futtermittelzusatzstoffe und Körner; Handel und Vertrieb von Lebensmitteln und Lebensmittelzusatzstoffe, Handel und Vertrieb von Reifen und Autobatterien, LKW und Ersatzteilen, Pkw und Ersatzteilen, schweren Baugeräten, elektrischen Generatoren und Bäckereigeräten. Weiterer Gegenstand ist der Import und Export der vorgenannten Güter\" sowie jeden Gewerbes, für das § 35 Gewerbeordnung (GewO) gilt, sowie ihm auch die Tätigkeit als mit der Leitung eines Gewerbebetriebes und als Vertretungsberechtigter eines Gewerbetreibenden untersagt.\n\nGemäß § 6 Abs. 2 S. 2 Nr. 2 des Gesetzes betreffend die Gesellschaften mit beschränkter Haftung (GmbHG) kann dieser infolgedessen kein Geschäftsführer der NILEAPI GmbH mehr sein.\n\nSeine Eintragung als Geschäftsführer ist damit wegen des Mangels einer wesentlichen Voraussetzung unzulässig geworden.\n\nDas Registergericht beabsichtigt daher, die Eintragung des Ayman Gaber Ahmed Allam als Geschäftsführer gemäß § 395 des Gesetzes über das Verfahren in Familiensachen und in Angelegenheiten der freiwilligen Gerichtsbarkeit (FamFG) von Amts wegen aus dem Handelsregister zu löschen.\n\nHiermit erfolgt die Benachrichtigung von der beabsichtigten Löschung.\n\nGegen die beabsichtigte Löschung kann innerhalb eines Monats seit dieser Bekanntmachung Widerspruch beim\n\nAmtsgericht Hamburg - Registergericht -, Caffamacherreihe 20, 20355 Hamburg,\n\nschriftlich oder zur Niederschrift der Geschäftsstelle oder des Rechtspflegers eingelegt werden. Der Widerspruch kann auch zu Protokoll der Geschäftsstelle eines anderen Amtsgerichtes erfolgen. In diesem Falle ist die Frist nur dann gewahrt, wenn das den Widerspruch enthaltende Protokoll innerhalb der Frist bei dem Registergericht eingeht.\n\nSofern hier binnen der genannten Frist kein Widerspruch eingeht, wird das Gericht die genannte Eintragung von Amts wegen löschen."
    },
    {
      "date": "2026-01-19",
      "id": "142725",
      "original_text": "Löschungsankündigung\nHamburg Amtsgericht Hamburg HRB 154904\nRainbow Line GmbH – Hamburg",
      "type": "Löschungsankündigung",
      "state": "Hamburg",
      "amtsgericht": "Amtsgericht Hamburg",
      "registernummer": "HRB 154904",
      "registerart": "HRB",
      "company_name": "Rainbow Line GmbH",
      "company_seat": "Hamburg",
      "details": "19.01.2026 (Bekanntmachungsdatum)\n\nHamburg Amtsgericht Hamburg HRB 154904\nLöschungsankündigung\n\nRainbow Line GmbH\nGesellschaft mit beschränkter Haftung\nHamburg\n\nDas Registergericht beabsichtigt, die im Handelsregister eingetragene Gesellschaft von Amts wegen nach § 394 FamFG zu löschen. Die Frist zur Erhebung eines Widerspruchs gegen die beabsichtigte Löschung wird auf 3 Monate festgesetzt."
    },
    {
      "date": "2026-01-19",
      "id": "142726",
      "original_text": "Löschungsankündigung\nHamburg Amtsgericht Hamburg HRB 167802\nNordlicht Bauunternehmung GmbH – Hamburg",
      "type": "Löschungsankündigung",
      "state": "Hamburg",
      "amtsgericht": "Amtsgericht Hamburg",
      "registernummer": "HRB 167802",
      "registerart": "HRB",
      "company_name": "Nordlicht Bauunternehmung GmbH",
      "company_seat": "Hamburg",
      "details": "19.01.2026 (Bekanntmachungsdatum)\n\nHamburg Amtsgericht Hamburg HRB 167802\nLöschungsankündigung\n\nNordlicht Bauunternehmung GmbH\nGesellschaft mit beschränkter Haftung\nHamburg\n\nDas Registergericht beabsichtigt, die im Handelsregister eingetragene Gesellschaft von Amts wegen nach § 394 FamFG zu löschen. Die Frist zur Erhebung eines Widerspruchs gegen die beabsichtigte Löschung wird auf 3 Monate festgesetzt."
    },
    {
      "date": "2026-01-19",
      "id": "142727",
      "original_text": "Löschungsankündigung\nHamburg Amtsgericht Hamburg HRB 169912\nappFactory GmbH – Hamburg",
      "type": "Löschungsankündigung",
      "state": "Hamburg",
      "amtsgericht": "Amtsgericht Hamburg",
      "registernummer": "HRB 169912",
      "registerart": "HRB",
      "company_name": "appFactory GmbH",
      "company_seat": "Hamburg",
      "details": "19.01.2026 (Bekanntmachungsdatum)\n\nHamburg Amtsgericht Hamburg HRB 169912\nLöschungsankündigung\n\nappFactory GmbH\nGesellschaft mit beschränkter Haftung\nHamburg\n\nDas Registergericht beabsichtigt, die im Handelsregister eingetragene Gesellschaft von Amts wegen nach § 394 FamFG zu löschen. Die Frist zur Erhebung eines Widerspruchs gegen die beabsichtigte Löschung wird auf 3 Monate festgesetzt."
    },
    {
      "date": "2026-01-19",
      "id": "142728",
      "original_text": "Löschungsankündigung\nHamburg Amtsgericht Hamburg HRB 174687\nClean Port Gebäudeservice GmbH – Hamburg",
      "type": "Löschungsankündigung",
      "state": "Hamburg",
      "amtsgericht": "Amtsgericht Hamburg",
      "registernummer": "HRB 174687",
      "registerart": "HRB",
      "company_name": "Clean Port Gebäudeservice GmbH",
      "company_seat": "Hamburg",
      "details": "19.01.2026 (Bekanntmachungsdatum)\n\nHamburg Amtsgericht Hamburg HRB 174687\nLöschungsankündigung\n\nClean Port Gebäudeservice GmbH\nGesellschaft mit beschränkter Haftung\nHamburg\n\nDas Registergericht beabsichtigt, die im Handelsregister eingetragene Gesellschaft von Amts wegen nach § 394 FamFG zu löschen. Die Frist zur Erhebung eines Widerspruchs gegen die beabsichtigte Löschung wird auf 3 Monate festgesetzt."
    },
    {
      "date": "2026-01-19",
      "id": "142729",
      "original_text": "Löschungsankündigung\nHamburg Amtsgericht Hamburg HRB 177021\nO&N Hamburg GmbH – Hamburg",
      "type": "Löschungsankündigung",
      "state": "Hamburg",
      "amtsgericht": "Amtsgericht Hamburg",
      "registernummer": "HRB 177021",
      "registerart": "HRB",
      "company_name": "O&N Hamburg GmbH",
      "company_seat": "Hamburg",
      "details": "19.01.2026 (Bekanntmachungsdatum)\n\nHamburg Amtsgericht Hamburg HRB 177021\nLöschungsankündigung\n\nO&N Hamburg GmbH\nGesellschaft mit beschränkter Haftung\nHamburg\n\nDas Registergericht beabsichtigt, die im Handelsregister eingetragene Gesellschaft von Amts wegen nach § 394 FamFG zu löschen. Die Frist zur Erhebung eines Widerspruchs gegen die beabsichtigte Löschung wird auf 3 Monate festgesetzt."
    },
    {
      "date": "2026-01-19",
      "id": "142730",
      "original_text": "Löschungsankündigung\nHamburg Amtsgericht Hamburg HRB 178636\nES-BEN UG (haftungsbeschränkt) – Hamburg",
      "type": "Löschungsankündigung",
      "state": "Hamburg",
      "amtsgericht": "Amtsgericht Hamburg",
      "registernummer": "HRB 178636",
      "registerart": "HRB",
      "company_name": "ES-BEN UG (haftungsbeschränkt)",
      "company_seat": "Hamburg",
      "details": "19.01.2026 (Bekanntmachungsdatum)\n\nHamburg Amtsgericht Hamburg HRB 178636\nLöschungsankündigung\n\nES-BEN UG (haftungsbeschränkt)\nGesellschaft mit beschränkter Haftung\nHamburg\n\nDas Registergericht beabsichtigt, die im Handelsregister eingetragene Gesellschaft von Amts wegen nach § 394 FamFG zu löschen. Die Frist zur Erhebung eines Widerspruchs gegen die beabsichtigte Löschung wird auf 3 Monate festgesetzt."
    },
    {
      "date": "2026-01-19",
      "id": "142731",
      "original_text": "Löschungsankündigung\nHamburg Amtsgericht Hamburg HRB 178926\nSTARTDIEGO Gerüstbau UG (haftungsbeschränkt) – Hamburg",
      "type": "Löschungsankündigung",
      "state": "Hamburg",
      "amtsgericht": "Amtsgericht Hamburg",
      "registernummer": "HRB 178926",
      "registerart": "HRB",
      "company_name": "STARTDIEGO Gerüstbau UG (haftungsbeschränkt)",
      "company_seat": "Hamburg",
      "details": "19.01.2026 (Bekanntmachungsdatum)\n\nHamburg Amtsgericht Hamburg HRB 178926\nLöschungsankündigung\n\nSTARTDIEGO Gerüstbau UG (haftungsbeschränkt)\nGesellschaft mit beschränkter Haftung\nHamburg\n\nDas Registergericht beabsichtigt, die im Handelsregister eingetragene Gesellschaft von Amts wegen nach § 394 FamFG zu löschen. Die Frist zur Erhebung eines Widerspruchs gegen die beabsichtigte Löschung wird auf 3 Monate festgesetzt."
    },
    {
      "date": "2026-01-19",
      "id": "142732",
      "original_text": "Löschungsankündigung\nHamburg Amtsgericht Hamburg HRB 180780\nOskar Construction GmbH – Hamburg",
      "type": "Löschungsankündigung",
      "state": "Hamburg",
      "amtsgericht": "Amtsgericht Hamburg",
      "registernummer": "HRB 180780",
      "registerart": "HRB",
      "company_name": "Oskar Construction GmbH",
      "company_seat": "Hamburg",
      "details": "19.01.2026 (Bekanntmachungsdatum)\n\nHamburg Amtsgericht Hamburg HRB 180780\nLöschungsankündigung\n\nOskar Construction GmbH\nGesellschaft mit beschränkter Haftung\nHamburg\n\nDas Registergericht beabsichtigt, die im Handelsregister eingetragene Gesellschaft von Amts wegen nach § 394 FamFG zu löschen. Die Frist zur Erhebung eines Widerspruchs gegen die beabsichtigte Löschung wird auf 3 Monate festgesetzt."
    },
    {
      "date": "2026-01-19",
      "id": "142733",
      "original_text": "Löschungsankündigung\nHamburg Amtsgericht Hamburg HRB 185543\nThe Handle Bar GmbH – Hamburg",
      "type": "Löschungsankündigung",
      "state": "Hamburg",
      "amtsgericht": "Amtsgericht Hamburg",
      "registernummer": "HRB 185543",
      "registerart": "HRB",
      "company_name": "The Handle Bar GmbH",
      "company_seat": "Hamburg",
      "details": "19.01.2026 (Bekanntmachungsdatum)\n\nHamburg Amtsgericht Hamburg HRB 185543\nLöschungsankündigung\n\nThe Handle Bar GmbH\nGesellschaft mit beschränkter Haftung\nHamburg\n\nDas Registergericht beabsichtigt, die im Handelsregister eingetragene Gesellschaft von Amts wegen nach § 394 FamFG zu löschen. Die Frist zur Erhebung eines Widerspruchs gegen die beabsichtigte Löschung wird auf 3 Monate festgesetzt."
    },
    {
      "date": "2026-01-19",
      "id": "142734",
      "original_text": "Löschungsankündigung\nHamburg Amtsgericht Hamburg HRB 189359\nZebra TV UG (haftungsbeschränkt) – Hamburg",
      "type": "Löschungsankündigung",
      "state": "Hamburg",
      "amtsgericht": "Amtsgericht Hamburg",
      "registernummer": "HRB 189359",
      "registerart": "HRB",
      "company_name": "Zebra TV UG (haftungsbeschränkt)",
      "company_seat": "Hamburg",
      "details": "19.01.2026 (Bekanntmachungsdatum)\n\nHamburg Amtsgericht Hamburg HRB 189359\nLöschungsankündigung\n\nZebra TV UG (haftungsbeschränkt)\nGesellschaft mit beschränkter Haftung\nHamburg\n\nDas Registergericht beabsichtigt, die im Handelsregister eingetragene Gesellschaft von Amts wegen nach § 394 FamFG zu löschen. Die Frist zur Erhebung eines Widerspruchs gegen die beabsichtigte Löschung wird auf 3 Monate festgesetzt."
    },
    {
      "date": "2026-01-19",
      "id": "142735",
      "original_text": "Löschungsankündigung\nHamburg Amtsgericht Hamburg HRA 108125\nVG Asien Technologiefonds GmbH & Co. KG – Hamburg",
      "type": "Löschungsankündigung",
      "state": "Hamburg",
      "amtsgericht": "Amtsgericht Hamburg",
      "registernummer": "HRA 108125",
      "registerart": "HRA",
      "company_name": "VG Asien Technologiefonds GmbH & Co. KG",
      "company_seat": "Hamburg",
      "details": "19.01.2026 (Bekanntmachungsdatum)\n\nHamburg Amtsgericht Hamburg HRA 108125\nLöschungsankündigung\n\nVG Asien Technologiefonds GmbH & Co. KG\nKommanditgesellschaft\nHamburg\n\nDas Registergericht beabsichtigt, die im Handelsregister eingetragene Firma von Amts wegen nach § 31 Abs. 2 HBG zu löschen. Die Frist zur Erhebung eines Widerspruchs gegen die beabsichtigte Löschung wird auf 3 Monate festgesetzt."
    },
    {
      "date": "2026-01-19",
      "id": "142736",
      "original_text": "Löschungsankündigung\nHamburg Amtsgericht Hamburg HRA 122764\nB.W.H. Unternehmensberatung für Handel und Gewerbe KG – Hamburg",
      "type": "Löschungsankündigung",
      "state": "Hamburg",
      "amtsgericht": "Amtsgericht Hamburg",
      "registernummer": "HRA 122764",
      "registerart": "HRA",
      "company_name": "B.W.H. Unternehmensberatung für Handel und Gewerbe KG",
      "company_seat": "Hamburg",
      "details": "19.01.2026 (Bekanntmachungsdatum)\n\nHamburg Amtsgericht Hamburg HRA 122764\nLöschungsankündigung\n\nB.W.H. Unternehmensberatung für Handel und Gewerbe KG\nKommanditgesellschaft\nHamburg\n\nDas Registergericht beabsichtigt, die im Handelsregister eingetragene Firma von Amts wegen nach § 31 Abs. 2 HBG zu löschen. Die Frist zur Erhebung eines Widerspruchs gegen die beabsichtigte Löschung wird auf 3 Monate festgesetzt."
    },
    {
      "date": "2026-01-19",
      "id": "142737",
      "original_text": "Löschungsankündigung\nHamburg Amtsgericht Hamburg HRB 191613\nTroveMine GmbH – Hamburg",
      "type": "Löschungsankündigung",
      "state": "Hamburg",
      "amtsgericht": "Amtsgericht Hamburg",
      "registernummer": "HRB 191613",
      "registerart": "HRB",
      "company_name": "TroveMine GmbH",
      "company_seat": "Hamburg",
      "details": "19.01.2026 (Bekanntmachungsdatum)\n\nHamburg Amtsgericht Hamburg HRB 191613\nLöschungsankündigung\n\nTroveMine GmbH\nGesellschaft mit beschränkter Haftung\nHamburg\n\nDas Registergericht beabsichtigt, die im Handelsregister eingetragene Gesellschaft von Amts wegen nach § 394 FamFG zu löschen. Die Frist zur Erhebung eines Widerspruchs gegen die beabsichtigte Löschung wird auf 3 Monate festgesetzt."
    },
    {
      "date": "2026-01-19",
      "id": "142738",
      "original_text": "Löschungsankündigung\nHamburg Amtsgericht Hamburg HRA 120358\nImmobilienkontor Solingen GmbH & Co. KG – Hamburg",
      "type": "Löschungsankündigung",
      "state": "Hamburg",
      "amtsgericht": "Amtsgericht Hamburg",
      "registernummer": "HRA 120358",
      "registerart": "HRA",
      "company_name": "Immobilienkontor Solingen GmbH & Co. KG",
      "company_seat": "Hamburg",
      "details": "19.01.2026 (Bekanntmachungsdatum)\n\nHamburg Amtsgericht Hamburg HRA 120358\nLöschungsankündigung\n\nImmobilienkontor Solingen GmbH & Co. KG\nKommanditgesellschaft\nHamburg\n\nDas Registergericht beabsichtigt, die im Handelsregister eingetragene Gesellschaft von Amts wegen nach § 394 FamFG zu löschen. Die Frist zur Erhebung eines Widerspruchs gegen die beabsichtigte Löschung wird auf 3 Monate festgesetzt."
    },
    {
      "date": "2026-01-19",
      "id": "142739",
      "original_text": "Löschungsankündigung\nHamburg Amtsgericht Hamburg HRA 124266\nJürgensallee 107 Hamburg GmbH & Co. KG – Hamburg",
      "type": "Löschungsankündigung",
      "state": "Hamburg",
      "amtsgericht": "Amtsgericht Hamburg",
      "registernummer": "HRA 124266",
      "registerart": "HRA",
      "company_name": "Jürgensallee 107 Hamburg GmbH & Co. KG",
      "company_seat": "Hamburg",
      "details": "19.01.2026 (Bekanntmachungsdatum)\n\nHamburg Amtsgericht Hamburg HRA 124266\nLöschungsankündigung\n\nJürgensallee 107 Hamburg GmbH & Co. KG\nKommanditgesellschaft\nHamburg\n\nDas Registergericht beabsichtigt, die im Handelsregister eingetragene Gesellschaft von Amts wegen nach § 394 FamFG zu löschen. Die Frist zur Erhebung eines Widerspruchs gegen die beabsichtigte Löschung wird auf 3 Monate festgesetzt."
    },
    {
      "date": "2026-01-19",
      "id": "142740",
      "original_text": "Registerbekanntmachung nach dem Umwandlungsgesetz\nBaden-Württemberg Amtsgericht Stuttgart HRB 773556\nGastwerk-Event GmbH – Reutlingen",
      "type": "Registerbekanntmachung nach dem Umwandlungsgesetz",
      "state": "Baden-Württemberg",
      "amtsgericht": "Amtsgericht Stuttgart",
      "registernummer": "HRB 773556",
      "registerart": "HRB",
      "company_name": "Gastwerk-Event GmbH",
      "company_seat": "Reutlingen",
      "details": "19.01.2026 (Bekanntmachungsdatum)\n\nBaden-Württemberg Amtsgericht Stuttgart HRB 773556\nRegisterbekanntmachung nach dem Umwandlungsgesetz 19.01.2026 (Eintragungsdatum)\n\nGastwerk-Event GmbH\nGesellschaft mit beschränkter Haftung\nReutlingen\n\nDen Gläubigern der an der Verschmelzung beteiligten Rechtsträger ist, wenn sie binnen sechs Monaten nach dem Tag, an dem die Eintragung der Verschmelzung in das Register des Sitzes desjenigen Rechtsträgers, dessen Gläubiger sie sind, nach § 19 Abs. 3 UmwG als bekanntgemacht gilt, ihren Anspruch nach Grund und Höhe schriftlich anmelden, Sicherheit zu leisten, soweit sie nicht Befriedigung verlangen können. Dieses Recht steht den Gläubigern jedoch nur zu, wenn sie glaubhaft machen, dass durch die Verschmelzung die Erfüllung ihrer Forderung gefährdet wird."
    },
    {
      "date": "2026-01-19",
      "id": "142741",
      "original_text": "Einreichung neuer Dokumente\nBerlin Amtsgericht Berlin (Charlottenburg) HRB 163211\nJobnet.AG – Berlin",
      "type": "Einreichung neuer Dokumente",
      "state": "Berlin",
      "amtsgericht": "Amtsgericht Berlin (Charlottenburg)",
      "registernummer": "HRB 163211",
      "registerart": "HRB",
      "company_name": "Jobnet.AG",
      "company_seat": "Berlin",
      "details": "19.01.2026 (Bekanntmachungsdatum)\n\nBerlin Amtsgericht Berlin (Charlottenburg) HRB 163211\nEinreichung neuer Dokumente\n\nJobnet.AG\nAktiengesellschaft\nBerlin\n\nAls nicht eingetragen wird veröffentlicht:Es wurde eine neue Liste der Aufsichtsratsmitglieder eingereicht (§ 106 AktG)."
    },
    {
      "date": "2026-01-19",
      "id": "142742",
      "original_text": "Löschungsankündigung\nBaden-Württemberg Amtsgericht Freiburg HRB 713632\nDarent Invest Consulting GmbH – Freiburg im Breisgau",
      "type": "Löschungsankündigung",
      "state": "Baden-Württemberg",
      "amtsgericht": "Amtsgericht Freiburg",
      "registernummer": "HRB 713632",
      "registerart": "HRB",
      "company_name": "Darent Invest Consulting GmbH",
      "company_seat": "Freiburg im Breisgau",
      "details": "19.01.2026 (Bekanntmachungsdatum)\n\nBaden-Württemberg Amtsgericht Freiburg HRB 713632\nLöschungsankündigung\n\nDarent Invest Consulting GmbH\nGesellschaft mit beschränkter Haftung\nFreiburg im Breisgau\n\nAls nicht eingetragen wird bekanntgemacht:\nDas Gericht beabsichtigt, die Gesellschaft wegen Vermögenslosigkeit im Handelsregister von Amts wegen nach § 394 FamFG zu löschen. Die Frist zur Geltendmachung eines Widerspruchs gegen die beabsichtigte Löschung ist auf einen Monat ab Veröffentlichung bestimmt."
    },
    {
      "date": "2026-01-19",
      "id": "142743",
      "original_text": "Löschungsankündigung\nBaden-Württemberg Amtsgericht Mannheim HRB 744613\nMister Fix UG (haftungsbeschränkt) – Baden-Baden",
      "type": "Löschungsankündigung",
      "state": "Baden-Württemberg",
      "amtsgericht": "Amtsgericht Mannheim",
      "registernummer": "HRB 744613",
      "registerart": "HRB",
      "company_name": "Mister Fix UG (haftungsbeschränkt)",
      "company_seat": "Baden-Baden",
      "details": "19.01.2026 (Bekanntmachungsdatum)\n\nBaden-Württemberg Amtsgericht Mannheim HRB 744613\nLöschungsankündigung 19.01.2026 (Eintragungsdatum)\n\nMister Fix UG (haftungsbeschränkt)\nGesellschaft mit beschränkter Haftung\nBaden-Baden\n\nAls nicht eingetragen wird bekanntgemacht:\nDas Gericht beabsichtigt, die Gesellschaft wegen Vermögenslosigkeit im Handelsregister von Amts wegen nach § 394 FamFG zu löschen. Die Frist zur Geltendmachung eines Widerspruchs gegen die beabsichtigte Löschung ist auf einen Monat ab Veröffentlichung bestimmt."
    },
    {
      "date": "2026-01-19",
      "id": "142744",
      "original_text": "Registerbekanntmachung nach dem Umwandlungsgesetz\nBaden-Württemberg Amtsgericht Mannheim HRB 710296\nBilfinger SE – Mannheim",
      "type": "Registerbekanntmachung nach dem Umwandlungsgesetz",
      "state": "Baden-Württemberg",
      "amtsgericht": "Amtsgericht Mannheim",
      "registernummer": "HRB 710296",
      "registerart": "HRB",
      "company_name": "Bilfinger SE",
      "company_seat": "Mannheim",
      "details": "19.01.2026 (Bekanntmachungsdatum)\n\nBaden-Württemberg Amtsgericht Mannheim HRB 710296\nRegisterbekanntmachung nach dem Umwandlungsgesetz\n\nBilfinger SE\nEuropäische Aktiengesellschaft (SE)\nMannheim\n\nDie Gesellschaft hat am 16.01.2026 den Entwurf des Verschmelzungsvertrages zwischen \"Bilfinger Global IT GmbH\", Mannheim (Amtsgericht Mannheim HRB 720296)  und der hiesigen Gesellschaft (übernehmender Rechtsträger) zum Handelsregister eingereicht."
    },
    {
      "date": "2026-01-19",
      "id": "142745",
      "original_text": "Registerbekanntmachung nach dem Umwandlungsgesetz\nBaden-Württemberg Amtsgericht Stuttgart HRA 742570\nGilbert Nielsen e.K. – Stuttgart",
      "type": "Registerbekanntmachung nach dem Umwandlungsgesetz",
      "state": "Baden-Württemberg",
      "amtsgericht": "Amtsgericht Stuttgart",
      "registernummer": "HRA 742570",
      "registerart": "HRA",
      "company_name": "Gilbert Nielsen e.K.",
      "company_seat": "Stuttgart",
      "details": "19.01.2026 (Bekanntmachungsdatum)\n\nBaden-Württemberg Amtsgericht Stuttgart HRA 742570\nRegisterbekanntmachung nach dem Umwandlungsgesetz 19.01.2026 (Eintragungsdatum)\n\nGilbert Nielsen e.K.\nEinzelkaufmann / Einzelkauffrau\nStuttgart\n\nAls nicht eingetragen wird bekanntgemacht:\nDen Gläubigern der an der Ausgliederung beteiligten Rechtsträger ist, wenn sie binnen sechs Monaten nach dem Tag, an dem die Eintragung der Ausgliederung in das Register des Sitzes desjenigen Rechtsträgers, dessen Gläubiger sie sind, nach § 19 Abs. 3 UmwG als bekanntgemacht gilt, ihren Anspruch nach Grund und Höhe schriftlich anmelden, Sicherheit zu leisten, soweit sie nicht Befriedigung verlangen können. Dieses Recht steht den Gläubigern jedoch nur zu, wenn sie glaubhaft machen, dass durch die Ausgliederung die Erfüllung ihrer Forderung gefährdet wird."
    },
    {
      "date": "2026-01-19",
      "id": "142746",
      "original_text": "Löschungsankündigung\nBerlin Amtsgericht Berlin (Charlottenburg) HRB 101504\nFirst Sealand Real Estate GmbH – Berlin",
      "type": "Löschungsankündigung",
      "state": "Berlin",
      "amtsgericht": "Amtsgericht Berlin (Charlottenburg)",
      "registernummer": "HRB 101504",
      "registerart": "HRB",
      "company_name": "First Sealand Real Estate GmbH",
      "company_seat": "Berlin",
      "details": "19.01.2026 (Bekanntmachungsdatum)\n\nBerlin Amtsgericht Berlin (Charlottenburg) HRB 101504\nLöschungsankündigung\n\nFirst Sealand Real Estate GmbH\nGesellschaft mit beschränkter Haftung\nBerlin\n\nBei der nachstehenden Gesellschaft wird das Amtslöschungsverfahren gemäß § 394 FamFG eingeleitet. Widerspruchsfrist 6 Wochen"
    },
    {
      "date": "2026-01-19",
      "id": "142747",
      "original_text": "Löschungsankündigung\nBerlin Amtsgericht Berlin (Charlottenburg) HRB 274192\nGaGe Lüneburg GmbH – Berlin",
      "type": "Löschungsankündigung",
      "state": "Berlin",
      "amtsgericht": "Amtsgericht Berlin (Charlottenburg)",
      "registernummer": "HRB 274192",
      "registerart": "HRB",
      "company_name": "GaGe Lüneburg GmbH",
      "company_seat": "Berlin",
      "details": "19.01.2026 (Bekanntmachungsdatum)\n\nBerlin Amtsgericht Berlin (Charlottenburg) HRB 274192\nLöschungsankündigung\n\nGaGe Lüneburg GmbH\nGesellschaft mit beschränkter Haftung\nBerlin\n\nBei der nachstehenden Gesellschaft wird das Amtslöschungsverfahren gemäß § 394 FamFG eingeleitet. Widerspruchsfrist 6 Wochen"
    },
    {
      "date": "2026-01-19",
      "id": "142748",
      "original_text": "Einreichung neuer Dokumente\nBaden-Württemberg Amtsgericht Stuttgart HRB 211282\nSanierungs- und Entwicklungsgesellschaft Ostfildern mit beschränkter Haftung (SEG Ostfildern) – Ostfildern",
      "type": "Einreichung neuer Dokumente",
      "state": "Baden-Württemberg",
      "amtsgericht": "Amtsgericht Stuttgart",
      "registernummer": "HRB 211282",
      "registerart": "HRB",
      "company_name": "Sanierungs- und Entwicklungsgesellschaft Ostfildern mit beschränkter Haftung (SEG Ostfildern)",
      "company_seat": "Ostfildern",
      "details": "19.01.2026 (Bekanntmachungsdatum)\n\nBaden-Württemberg Amtsgericht Stuttgart HRB 211282\nEinreichung neuer Dokumente 19.01.2026 (Eintragungsdatum)\n\nSanierungs- und Entwicklungsgesellschaft Ostfildern mit beschränkter Haftung (SEG Ostfildern)\nGesellschaft mit beschränkter Haftung\nOstfildern\n\nDie Gesellschaft hat am 16.12.2025 die Liste über die Zusammensetzung des Aufsichtsrats zum Handelsregister eingereicht."
    },
    {
      "date": "2026-01-19",
      "id": "142749",
      "original_text": "Sonstige Registerbekanntmachung\nBaden-Württemberg Amtsgericht Stuttgart HRB 221661\nBirk Holding I GmbH – Nürtingen",
      "type": "Sonstige Registerbekanntmachung",
      "state": "Baden-Württemberg",
      "amtsgericht": "Amtsgericht Stuttgart",
      "registernummer": "HRB 221661",
      "registerart": "HRB",
      "company_name": "Birk Holding I GmbH",
      "company_seat": "Nürtingen",
      "details": "19.01.2026 (Bekanntmachungsdatum)\n\nBaden-Württemberg Amtsgericht Stuttgart HRB 221661\nSonstige Registerbekanntmachung 19.01.2026 (Eintragungsdatum)\n\nBirk Holding I GmbH\nGesellschaft mit beschränkter Haftung\nNürtingen\n\nAls nicht eingetragen wird bekanntgemacht:\nDen Gläubigern der Gesellschaft, deren Forderungen begründet worden sind, bevor die Eintragung der Beendigung des Vertrages in das Handelsregister nach § 10 HGB als bekanntgemacht gilt, ist vom anderen Vertragsteil Sicherheit zu leisten, wenn sie sich binnen sechs Monaten nach der Bekanntmachung zu diesem Zweck bei ihm melden."
    },
    {
      "date": "2026-01-19",
      "id": "142750",
      "original_text": "Registerbekanntmachung nach dem Umwandlungsgesetz\nBaden-Württemberg Amtsgericht Stuttgart HRB 351959\nMez.Gastro GmbH – Reutlingen",
      "type": "Registerbekanntmachung nach dem Umwandlungsgesetz",
      "state": "Baden-Württemberg",
      "amtsgericht": "Amtsgericht Stuttgart",
      "registernummer": "HRB 351959",
      "registerart": "HRB",
      "company_name": "Mez.Gastro GmbH",
      "company_seat": "Reutlingen",
      "details": "19.01.2026 (Bekanntmachungsdatum)\n\nBaden-Württemberg Amtsgericht Stuttgart HRB 351959\nRegisterbekanntmachung nach dem Umwandlungsgesetz 19.01.2026 (Eintragungsdatum)\n\nMez.Gastro GmbH\nGesellschaft mit beschränkter Haftung\nReutlingen\n\nDen Gläubigern der an der Verschmelzung beteiligten Rechtsträger ist, wenn sie binnen sechs Monaten nach dem Tag, an dem die Eintragung der Verschmelzung in das Register des Sitzes desjenigen Rechtsträgers, dessen Gläubiger sie sind, nach § 19 Abs. 3 UmwG als bekanntgemacht gilt, ihren Anspruch nach Grund und Höhe schriftlich anmelden, Sicherheit zu leisten, soweit sie nicht Befriedigung verlangen können. Dieses Recht steht den Gläubigern jedoch nur zu, wenn sie glaubhaft machen, dass durch die Verschmelzung die Erfüllung ihrer Forderung gefährdet wird."
    },
    {
      "date": "2026-01-19",
      "id": "142751",
      "original_text": "Registerbekanntmachung nach dem Umwandlungsgesetz\nBaden-Württemberg Amtsgericht Freiburg HRB 734786\nHovenbitzer Architekten GmbH – Lörrach",
      "type": "Registerbekanntmachung nach dem Umwandlungsgesetz",
      "state": "Baden-Württemberg",
      "amtsgericht": "Amtsgericht Freiburg",
      "registernummer": "HRB 734786",
      "registerart": "HRB",
      "company_name": "Hovenbitzer Architekten GmbH",
      "company_seat": "Lörrach",
      "details": "19.01.2026 (Bekanntmachungsdatum)\n\nBaden-Württemberg Amtsgericht Freiburg HRB 734786\nRegisterbekanntmachung nach dem Umwandlungsgesetz 19.01.2026 (Eintragungsdatum)\n\nHovenbitzer Architekten GmbH\nGesellschaft mit beschränkter Haftung\nLörrach\n\nAls nicht eingetragen wird bekanntgemacht:\nDen Gläubigern des an dem Formwechsel beteiligten Rechtsträgers ist, wenn sie binnen sechs Monaten nach dem Tag, an dem die Eintragung des Formwechsels in das Register des Sitzes desjenigen Rechtsträgers, dessen Gläubiger sie sind, nach § 19 Abs. 3 UmwG als bekanntgemacht gilt, ihren Anspruch nach Grund und Höhe schriftlich anmelden, Sicherheit zu leisten, soweit sie nicht Befriedigung verlangen können. Dieses Recht steht den Gläubigern jedoch nur zu, wenn sie glaubhaft machen, dass durch den Formwechsel die Erfüllung ihrer Forderung gefährdet wird."
    },
    {
      "date": "2026-01-19",
      "id": "142752",
      "original_text": "Registerbekanntmachung nach dem Umwandlungsgesetz\nBaden-Württemberg Amtsgericht Freiburg PR 410008\nWilhelm und Hovenbitzer Freie Architekten PartGmbB – Lörrach",
      "type": "Registerbekanntmachung nach dem Umwandlungsgesetz",
      "state": "Baden-Württemberg",
      "amtsgericht": "Amtsgericht Freiburg",
      "registernummer": "PR 410008",
      "registerart": "PR",
      "company_name": "Wilhelm und Hovenbitzer Freie Architekten PartGmbB",
      "company_seat": "Lörrach",
      "details": "19.01.2026 (Bekanntmachungsdatum)\n\nBaden-Württemberg Amtsgericht Freiburg PR 410008\nRegisterbekanntmachung nach dem Umwandlungsgesetz 19.01.2026 (Eintragungsdatum)\n\nWilhelm und Hovenbitzer Freie Architekten PartGmbB\nPartnerschaftsgesellschaft\nLörrach\n\nAls nicht eingetragen wird bekanntgemacht:\nDen Gläubigern des an dem Formwechsel beteiligten Rechtsträgers ist, wenn sie binnen sechs Monaten nach dem Tag, an dem die Eintragung des Formwechsels in das Register des Sitzes desjenigen Rechtsträgers, dessen Gläubiger sie sind, nach § 19 Abs. 3 UmwG als bekanntgemacht gilt, ihren Anspruch nach Grund und Höhe schriftlich anmelden, Sicherheit zu leisten, soweit sie nicht Befriedigung verlangen können. Dieses Recht steht den Gläubigern jedoch nur zu, wenn sie glaubhaft machen, dass durch den Formwechsel die Erfüllung ihrer Forderung gefährdet wird."
    },
    {
      "date": "2026-01-19",
      "id": "142753",
      "original_text": "Löschungsankündigung\nBerlin Amtsgericht Berlin (Charlottenburg) HRB 218654\nBerow UG (haftungsbeschränkt) – Berlin",
      "type": "Löschungsankündigung",
      "state": "Berlin",
      "amtsgericht": "Amtsgericht Berlin (Charlottenburg)",
      "registernummer": "HRB 218654",
      "registerart": "HRB",
      "company_name": "Berow UG (haftungsbeschränkt)",
      "company_seat": "Berlin",
      "details": "19.01.2026 (Bekanntmachungsdatum)\n\nBerlin Amtsgericht Berlin (Charlottenburg) HRB 218654\nLöschungsankündigung\n\nBerow UG (haftungsbeschränkt)\nGesellschaft mit beschränkter Haftung\nBerlin\n\nBei der nachstehenden Gesellschaft wird das Amtslöschungsverfahren gemäß § 394 FamFG eingeleitet. Widerspruchsfrist 6 Wochen"
    },
    {
      "date": "2026-01-19",
      "id": "142754",
      "original_text": "Löschungsankündigung\nBaden-Württemberg Amtsgericht Mannheim HRB 733222\nFotostudio klassisch-modern UG (haftungsbeschränkt) – Mannheim",
      "type": "Löschungsankündigung",
      "state": "Baden-Württemberg",
      "amtsgericht": "Amtsgericht Mannheim",
      "registernummer": "HRB 733222",
      "registerart": "HRB",
      "company_name": "Fotostudio klassisch-modern UG (haftungsbeschränkt)",
      "company_seat": "Mannheim",
      "details": "19.01.2026 (Bekanntmachungsdatum)\n\nBaden-Württemberg Amtsgericht Mannheim HRB 733222\nLöschungsankündigung 19.01.2026 (Eintragungsdatum)\n\nFotostudio klassisch-modern UG (haftungsbeschränkt)\nGesellschaft mit beschränkter Haftung\nMannheim\n\nDas Gericht beabsichtigt, die Gesellschaft wegen Vermögenslosigkeit im Handelsregister von Amts wegen nach § 394 FamFG zu löschen. Die Frist zur Geltendmachung eines Widerspruchs gegen die beabsichtigte Löschung ist auf einen Monat ab Veröffentlichung bestimmt."
    },
    {
      "date": "2026-01-19",
      "id": "142755",
      "original_text": "Einreichung neuer Dokumente\nSchleswig-Holstein Amtsgericht Kiel HRB 1171 NM\nDRK-Fachklinik Hahnknüll gemeinnützige Gesellschaft mit beschränkter Haftung – Neumünster",
      "type": "Einreichung neuer Dokumente",
      "state": "Schleswig-Holstein",
      "amtsgericht": "Amtsgericht Kiel",
      "registernummer": "HRB 1171 NM",
      "registerart": "HRB",
      "company_name": "DRK-Fachklinik Hahnknüll gemeinnützige Gesellschaft mit beschränkter Haftung",
      "company_seat": "Neumünster",
      "details": "19.01.2026 (Bekanntmachungsdatum)\n\nSchleswig-Holstein Amtsgericht Kiel HRB 1171 NM\nEinreichung neuer Dokumente\n\nDRK-Fachklinik Hahnknüll gemeinnützige Gesellschaft mit beschränkter Haftung\nGesellschaft mit beschränkter Haftung\nNeumünster\n\nAls nicht eingetragen wird veröffentlicht: Eine neue Liste der Aufsichtsratsmitglieder ist eingereicht worden."
    },
    {
      "date": "2026-01-19",
      "id": "142756",
      "original_text": "Löschungsankündigung\nBaden-Württemberg Amtsgericht Mannheim HRB 726540\nProV UG (haftungsbeschränkt) – Neuenbürg",
      "type": "Löschungsankündigung",
      "state": "Baden-Württemberg",
      "amtsgericht": "Amtsgericht Mannheim",
      "registernummer": "HRB 726540",
      "registerart": "HRB",
      "company_name": "ProV UG (haftungsbeschränkt)",
      "company_seat": "Neuenbürg",
      "details": "19.01.2026 (Bekanntmachungsdatum)\n\nBaden-Württemberg Amtsgericht Mannheim HRB 726540\nLöschungsankündigung 19.01.2026 (Eintragungsdatum)\n\nProV UG (haftungsbeschränkt)\nGesellschaft mit beschränkter Haftung\nNeuenbürg\n\nDas Gericht beabsichtigt, die Gesellschaft wegen Vermögenslosigkeit im Handelsregister von Amts wegen nach § 394 FamFG zu löschen. Die Frist zur Geltendmachung eines Widerspruchs gegen die beabsichtigte Löschung ist auf einen Monat ab Veröffentlichung bestimmt."
    },
    {
      "date": "2026-01-19",
      "id": "142757",
      "original_text": "Registerbekanntmachung nach dem Umwandlungsgesetz\nHamburg Amtsgericht Hamburg HRB 127236\nBrigitta Wurnig Coaching GmbH – Hamburg",
      "type": "Registerbekanntmachung nach dem Umwandlungsgesetz",
      "state": "Hamburg",
      "amtsgericht": "Amtsgericht Hamburg",
      "registernummer": "HRB 127236",
      "registerart": "HRB",
      "company_name": "Brigitta Wurnig Coaching GmbH",
      "company_seat": "Hamburg",
      "details": "19.01.2026 (Bekanntmachungsdatum)\n\nHamburg Amtsgericht Hamburg HRB 127236\nRegisterbekanntmachung nach dem Umwandlungsgesetz 19.01.2026 (Eintragungsdatum)\n\nBrigitta Wurnig Coaching GmbH\nGesellschaft mit beschränkter Haftung\nHamburg\n\nAls nicht eingetragen wird bekannt gemacht:\nDen Gläubigern der an der Verschmelzung beteiligten Gesellschaften ist, wenn sie binnen sechs Monaten nach dem Tag, an dem die Eintragung der Verschmelzung in das Register des Sitzes desjenigen Rechtsträgers, dessen Gläubiger sie sind, nach § 19 Absatz 3 UmwG als bekannt gemacht gilt, ihren Anspruch nach Grund und Höhe schriftlich anmelden, Sicherheit zu leisten, soweit sie nicht Befriedigung verlangen können. Dieses Recht steht den Gläubigern jedoch nur zu, wenn sie glaubhaft machen, dass durch die Verschmelzung die Erfüllung ihrer Forderung gefährdet wird."
    },
    {
      "date": "2026-01-19",
      "id": "142758",
      "original_text": "Einreichung neuer Dokumente\nBaden-Württemberg Amtsgericht Mannheim HRB 700810\nHeslon AG – Mannheim",
      "type": "Einreichung neuer Dokumente",
      "state": "Baden-Württemberg",
      "amtsgericht": "Amtsgericht Mannheim",
      "registernummer": "HRB 700810",
      "registerart": "HRB",
      "company_name": "Heslon AG",
      "company_seat": "Mannheim",
      "details": "19.01.2026 (Bekanntmachungsdatum)\n\nBaden-Württemberg Amtsgericht Mannheim HRB 700810\nEinreichung neuer Dokumente 19.01.2026 (Eintragungsdatum)\n\nHeslon AG\nAktiengesellschaft\nMannheim\n\nDie Gesellschaft hat am 16.01.2026 die Liste über die Zusammensetzung des Aufsichtsrats zum Handelsregister eingereicht."
    },
    {
      "date": "2026-01-19",
      "id": "142759",
      "original_text": "Löschungsankündigung\nBaden-Württemberg Amtsgericht Mannheim HRB 721715\nmbs manufacturing GmbH – Kappelrodeck",
      "type": "Löschungsankündigung",
      "state": "Baden-Württemberg",
      "amtsgericht": "Amtsgericht Mannheim",
      "registernummer": "HRB 721715",
      "registerart": "HRB",
      "company_name": "mbs manufacturing GmbH",
      "company_seat": "Kappelrodeck",
      "details": "19.01.2026 (Bekanntmachungsdatum)\n\nBaden-Württemberg Amtsgericht Mannheim HRB 721715\nLöschungsankündigung\n\nmbs manufacturing GmbH\nGesellschaft mit beschränkter Haftung\nKappelrodeck\n\nAls nicht eingetragen wird bekanntgemacht:\nDas Gericht beabsichtigt, die Gesellschaft wegen Vermögenslosigkeit im Handelsregister von Amts wegen nach § 394 FamFG zu löschen. Die Frist zur Geltendmachung eines Widerspruchs gegen die beabsichtigte Löschung ist auf einen Monat ab Veröffentlichung bestimmt."
    },
    {
      "date": "2026-01-19",
      "id": "142760",
      "original_text": "Einreichung neuer Dokumente\nHamburg Amtsgericht Hamburg HRB 58961\nKörber AG – Hamburg",
      "type": "Einreichung neuer Dokumente",
      "state": "Hamburg",
      "amtsgericht": "Amtsgericht Hamburg",
      "registernummer": "HRB 58961",
      "registerart": "HRB",
      "company_name": "Körber AG",
      "company_seat": "Hamburg",
      "details": "19.01.2026 (Bekanntmachungsdatum)\n\nHamburg Amtsgericht Hamburg HRB 58961\nEinreichung neuer Dokumente 19.01.2026 (Eintragungsdatum)\n\nKörber AG\nAktiengesellschaft\nHamburg\n\nAls nicht eingetragen wird bekannt gemacht: Liste des Aufsichtsrats wurde eingereicht."
    },
    {
      "date": "2026-01-19",
      "id": "142761",
      "original_text": "Löschungsankündigung\nBaden-Württemberg Amtsgericht Ulm HRB 721037\nPauler & Heinisch GmbH – Göppingen",
      "type": "Löschungsankündigung",
      "state": "Baden-Württemberg",
      "amtsgericht": "Amtsgericht Ulm",
      "registernummer": "HRB 721037",
      "registerart": "HRB",
      "company_name": "Pauler & Heinisch GmbH",
      "company_seat": "Göppingen",
      "details": "19.01.2026 (Bekanntmachungsdatum)\n\nBaden-Württemberg Amtsgericht Ulm HRB 721037\nLöschungsankündigung\n\nPauler & Heinisch GmbH\nGesellschaft mit beschränkter Haftung\nGöppingen\n\nAls nicht eingetragen wird bekanntgemacht:\nDas Gericht beabsichtigt, die Gesellschaft wegen Vermögenslosigkeit im Handelsregister von Amts wegen nach § 394 FamFG zu löschen. Die Frist zur Geltendmachung eines Widerspruchs gegen die beabsichtigte Löschung ist auf  einen Monat ab Veröffentlichung bestimmt."
    },
    {
      "date": "2026-01-19",
      "id": "142762",
      "original_text": "Einreichung neuer Dokumente\nSachsen-Anhalt Amtsgericht Stendal HRB 7331\nFibertex Personal Care AG – Ilsenburg (Harz)",
      "type": "Einreichung neuer Dokumente",
      "state": "Sachsen-Anhalt",
      "amtsgericht": "Amtsgericht Stendal",
      "registernummer": "HRB 7331",
      "registerart": "HRB",
      "company_name": "Fibertex Personal Care AG",
      "company_seat": "Ilsenburg (Harz)",
      "details": "19.01.2026 (Bekanntmachungsdatum)\n\nSachsen-Anhalt Amtsgericht Stendal HRB 7331\nEinreichung neuer Dokumente 19.01.2026 (Eintragungsdatum)\n\nFibertex Personal Care AG\nAktiengesellschaft\nIlsenburg (Harz)\n\nEine Liste der Mitglieder des Aufsichtsrates wurde zum Handelsregister eingereicht."
    },
    {
      "date": "2026-01-19",
      "id": "142763",
      "original_text": "Löschungsankündigung\nBerlin Amtsgericht Berlin (Charlottenburg) HRB 221009\nLogic Swiss Production GmbH – Berlin",
      "type": "Löschungsankündigung",
      "state": "Berlin",
      "amtsgericht": "Amtsgericht Berlin (Charlottenburg)",
      "registernummer": "HRB 221009",
      "registerart": "HRB",
      "company_name": "Logic Swiss Production GmbH",
      "company_seat": "Berlin",
      "details": "19.01.2026 (Bekanntmachungsdatum)\n\nBerlin Amtsgericht Berlin (Charlottenburg) HRB 221009\nLöschungsankündigung\n\nLogic Swiss Production GmbH\nGesellschaft mit beschränkter Haftung\nBerlin\n\nBei der nachstehenden Gesellschaft wird das Amtslöschungsverfahren gemäß § 394 FamFG eingeleitet. Widerspruchsfrist 6 Wochen"
    },
    {
      "date": "2026-01-19",
      "id": "142764",
      "original_text": "Löschungsankündigung\nBaden-Württemberg Amtsgericht Freiburg HRB 705702\nGolf Caddy Abwicklungsgesellschaft mbH – Villingen-Schwenningen",
      "type": "Löschungsankündigung",
      "state": "Baden-Württemberg",
      "amtsgericht": "Amtsgericht Freiburg",
      "registernummer": "HRB 705702",
      "registerart": "HRB",
      "company_name": "Golf Caddy Abwicklungsgesellschaft mbH",
      "company_seat": "Villingen-Schwenningen",
      "details": "19.01.2026 (Bekanntmachungsdatum)\n\nBaden-Württemberg Amtsgericht Freiburg HRB 705702\nLöschungsankündigung\n\nGolf Caddy Abwicklungsgesellschaft mbH\nGesellschaft mit beschränkter Haftung\nVillingen-Schwenningen\n\nAls nicht eingetragen wird bekanntgemacht:\nDas Gericht beabsichtigt, die Gesellschaft wegen Vermögenslosigkeit im Handelsregister von Amts wegen nach § 394 FamFG zu löschen. Die Frist zur Geltendmachung eines Widerspruchs gegen die beabsichtigte Löschung ist auf einen Monat ab Veröffentlichung bestimmt."
    },
    {
      "date": "2026-01-19",
      "id": "142765",
      "original_text": "Sonstige Registerbekanntmachung\nHamburg Amtsgericht Hamburg HRB 104754\nCLU KALO Beteiligungs GmbH – Hamburg",
      "type": "Sonstige Registerbekanntmachung",
      "state": "Hamburg",
      "amtsgericht": "Amtsgericht Hamburg",
      "registernummer": "HRB 104754",
      "registerart": "HRB",
      "company_name": "CLU KALO Beteiligungs GmbH",
      "company_seat": "Hamburg",
      "details": "19.01.2026 (Bekanntmachungsdatum)\n\nHamburg Amtsgericht Hamburg HRB 104754\nSonstige Registerbekanntmachung 14.01.2026 (Eintragungsdatum)\n\nCLU KALO Beteiligungs GmbH\nGesellschaft mit beschränkter Haftung\nHamburg\n\nAls nicht eingetragen wird bekannt gemacht:  Den Gläubigern der Gesellschaft, deren Forderungen begründet worden sind, bevor die Eintragung der Vertragsbeendigung in das Handelsregister nach § 10 HGB als bekannt gemacht gilt, ist vom anderen Vertragsteil Sicherheit zu leisten, wenn sie sich binnen 6 Monaten nach Bekanntmachung der Eintragung zu diesem Zweck bei ihm melden."
    },
    {
      "date": "2026-01-19",
      "id": "142766",
      "original_text": "Löschungsankündigung\nBaden-Württemberg Amtsgericht Stuttgart HRB 775514\nDuconserv GmbH – Stuttgart",
      "type": "Löschungsankündigung",
      "state": "Baden-Württemberg",
      "amtsgericht": "Amtsgericht Stuttgart",
      "registernummer": "HRB 775514",
      "registerart": "HRB",
      "company_name": "Duconserv GmbH",
      "company_seat": "Stuttgart",
      "details": "19.01.2026 (Bekanntmachungsdatum)\n\nBaden-Württemberg Amtsgericht Stuttgart HRB 775514\nLöschungsankündigung\n\nDuconserv GmbH\nGesellschaft mit beschränkter Haftung\nStuttgart\n\nDas Gericht beabsichtigt, die Gesellschaft wegen Vermögenslosigkeit im Handelsregister von Amts wegen nach § 394 FamFG zu löschen. Die Frist zur Geltendmachung eines Widerspruchs gegen die beabsichtigte Löschung ist auf zwei Monate ab Veröffentlichung bestimmt."
    },
    {
      "date": "2026-01-19",
      "id": "142767",
      "original_text": "Sonstige Registerbekanntmachung\nHamburg Amtsgericht Hamburg HRB 118554\nCLVV Automotive Beteiligungsgesellschaft mbH – Hamburg",
      "type": "Sonstige Registerbekanntmachung",
      "state": "Hamburg",
      "amtsgericht": "Amtsgericht Hamburg",
      "registernummer": "HRB 118554",
      "registerart": "HRB",
      "company_name": "CLVV Automotive Beteiligungsgesellschaft mbH",
      "company_seat": "Hamburg",
      "details": "19.01.2026 (Bekanntmachungsdatum)\n\nHamburg Amtsgericht Hamburg HRB 118554\nSonstige Registerbekanntmachung 14.01.2026 (Eintragungsdatum)\n\nCLVV Automotive Beteiligungsgesellschaft mbH\nGesellschaft mit beschränkter Haftung\nHamburg\n\nAls nicht eingetragen wird bekannt gemacht:  Den Gläubigern der Gesellschaft, deren Forderungen begründet worden sind, bevor die Eintragung der Vertragsbeendigung in das Handelsregister nach § 10 HGB als bekannt gemacht gilt, ist vom anderen Vertragsteil Sicherheit zu leisten, wenn sie sich binnen 6 Monaten nach Bekanntmachung der Eintragung zu diesem Zweck bei ihm melden."
    },
    {
      "date": "2026-01-19",
      "id": "142768",
      "original_text": "Löschungsankündigung\nBaden-Württemberg Amtsgericht Ulm HRB 736807\nBlue Sky Marketing UG (haftungsbeschränkt) – Warthausen",
      "type": "Löschungsankündigung",
      "state": "Baden-Württemberg",
      "amtsgericht": "Amtsgericht Ulm",
      "registernummer": "HRB 736807",
      "registerart": "HRB",
      "company_name": "Blue Sky Marketing UG (haftungsbeschränkt)",
      "company_seat": "Warthausen",
      "details": "19.01.2026 (Bekanntmachungsdatum)\n\nBaden-Württemberg Amtsgericht Ulm HRB 736807\nLöschungsankündigung\n\nBlue Sky Marketing UG (haftungsbeschränkt)\nGesellschaft mit beschränkter Haftung\nWarthausen\n\nAls nicht eingetragen wird bekanntgemacht:\nDas Gericht beabsichtigt, die Gesellschaft wegen Vermögenslosigkeit im Handelsregister von Amts wegen nach § 394 FamFG zu löschen. Die Frist zur Geltendmachung eines Widerspruchs gegen die beabsichtigte Löschung ist auf  einen Monat ab Veröffentlichung bestimmt."
    },
    {
      "date": "2026-01-19",
      "id": "142769",
      "original_text": "Löschungsankündigung\nBerlin Amtsgericht Berlin (Charlottenburg) HRA 40202\nInfraTrust Fünf GmbH & Co. KG – Berlin",
      "type": "Löschungsankündigung",
      "state": "Berlin",
      "amtsgericht": "Amtsgericht Berlin (Charlottenburg)",
      "registernummer": "HRA 40202",
      "registerart": "HRA",
      "company_name": "InfraTrust Fünf GmbH & Co. KG",
      "company_seat": "Berlin",
      "details": "19.01.2026 (Bekanntmachungsdatum)\n\nBerlin Amtsgericht Berlin (Charlottenburg) HRA 40202\nLöschungsankündigung\n\nInfraTrust Fünf GmbH & Co. KG\nKommanditgesellschaft\nBerlin\n\nBei der nachstehenden Gesellschaft wird das Amtslöschungsverfahren gemäß § 394 FamFG eingeleitet. Widerspruchsfrist 6 Wochen"
    },
    {
      "date": "2026-01-19",
      "id": "142770",
      "original_text": "Einreichung neuer Dokumente\nHamburg Amtsgericht Hamburg HRB 68431\ndpa Deutsche Presse-Agentur GmbH – Hamburg",
      "type": "Einreichung neuer Dokumente",
      "state": "Hamburg",
      "amtsgericht": "Amtsgericht Hamburg",
      "registernummer": "HRB 68431",
      "registerart": "HRB",
      "company_name": "dpa Deutsche Presse-Agentur GmbH",
      "company_seat": "Hamburg",
      "details": "19.01.2026 (Bekanntmachungsdatum)\n\nHamburg Amtsgericht Hamburg HRB 68431\nEinreichung neuer Dokumente\n\ndpa Deutsche Presse-Agentur GmbH\nGesellschaft mit beschränkter Haftung\nHamburg\n\nAls nicht eingetragen wird bekannt gemacht: Eine neue Liste der Mitglieder des Aufsichtsrats wurde eingereicht."
    },
    {
      "date": "2026-01-19",
      "id": "142771",
      "original_text": "Registerbekanntmachung nach dem Umwandlungsgesetz\nSachsen Amtsgericht Chemnitz HRB 968\nElektrowerkzeuge GmbH Eibenstock – Eibenstock",
      "type": "Registerbekanntmachung nach dem Umwandlungsgesetz",
      "state": "Sachsen",
      "amtsgericht": "Amtsgericht Chemnitz",
      "registernummer": "HRB 968",
      "registerart": "HRB",
      "company_name": "Elektrowerkzeuge GmbH Eibenstock",
      "company_seat": "Eibenstock",
      "details": "19.01.2026 (Bekanntmachungsdatum)\n\nSachsen Amtsgericht Chemnitz HRB 968\nRegisterbekanntmachung nach dem Umwandlungsgesetz 19.01.2026 (Eintragungsdatum)\n\nElektrowerkzeuge GmbH Eibenstock\nGesellschaft mit beschränkter Haftung\nEibenstock\n\nDen Gläubigern der an der Verschmelzung beteiligten Rechtsträger ist, wenn sie binnen sechs Monaten nach dem Tag, an dem die Eintragung der Verschmelzung in das Register des Sitzes desjenigen Rechtsträgers, dessen Gläubiger sie sind, nach § 19 Abs. 3 UmwG als bekannt gemacht gilt, ihren Anspruch nach Grund und Höhe in Textform anmelden, Sicherheit zu leisten, soweit sie nicht Befriedigung verlangen können. Dieses Recht steht den Gläubigern jedoch nur zu, wenn sie glaubhaft machen, dass durch die Verschmelzung die Erfüllung der Forderung gefährdet wird."
    },
    {
      "date": "2026-01-19",
      "id": "142772",
      "original_text": "Löschungsankündigung\nSachsen Amtsgericht Dresden HRB 36692\nWorkExpress UG (haftungsbeschränkt) – Görlitz",
      "type": "Löschungsankündigung",
      "state": "Sachsen",
      "amtsgericht": "Amtsgericht Dresden",
      "registernummer": "HRB 36692",
      "registerart": "HRB",
      "company_name": "WorkExpress UG (haftungsbeschränkt)",
      "company_seat": "Görlitz",
      "details": "19.01.2026 (Bekanntmachungsdatum)\n\nSachsen Amtsgericht Dresden HRB 36692\nLöschungsankündigung\n\nWorkExpress UG (haftungsbeschränkt)\nGesellschaft mit beschränkter Haftung\nGörlitz\n\nDas Registergericht beabsichtigt, die im Handelsregister eingetragene Gesellschaft von Amts wegen nach § 394 FamFG zu löschen. Die Frist zu Erhebung eines Widerspruchs gegen die beabsichtigte Löschung wird auf einen Monat festgesetzt."
    },
    {
      "date": "2026-01-19",
      "id": "142773",
      "original_text": "Registerbekanntmachung nach dem Umwandlungsgesetz\nSachsen Amtsgericht Leipzig HRB 20339\nFamiCord AG – Leipzig",
      "type": "Registerbekanntmachung nach dem Umwandlungsgesetz",
      "state": "Sachsen",
      "amtsgericht": "Amtsgericht Leipzig",
      "registernummer": "HRB 20339",
      "registerart": "HRB",
      "company_name": "FamiCord AG",
      "company_seat": "Leipzig",
      "details": "19.01.2026 (Bekanntmachungsdatum)\n\nSachsen Amtsgericht Leipzig HRB 20339\nRegisterbekanntmachung nach dem Umwandlungsgesetz\n\nFamiCord AG\nAktiengesellschaft\nLeipzig\n\nDie Gesellschaft hat am 16.01.2026 gemäß §§ 62 Abs. 3 Satz 2, 61 Satz 2 UmwG den Entwurf des Verschmelzungsvertrags zwischen der eticur GmbH mit dem Sitz in München (Amtsgericht München, HRB 154910) als übertragende Gesellschaft und der FamiCord AG als übernehmende Gesellschaft zum Handelsregister eingereicht."
    },
    {
      "date": "2026-01-19",
      "id": "142774",
      "original_text": "Einreichung neuer Dokumente\nSachsen Amtsgericht Dresden HRB 6606\nBeteiligungsgesellschaft der Stadt Radebeul mbH – Radebeul",
      "type": "Einreichung neuer Dokumente",
      "state": "Sachsen",
      "amtsgericht": "Amtsgericht Dresden",
      "registernummer": "HRB 6606",
      "registerart": "HRB",
      "company_name": "Beteiligungsgesellschaft der Stadt Radebeul mbH",
      "company_seat": "Radebeul",
      "details": "19.01.2026 (Bekanntmachungsdatum)\n\nSachsen Amtsgericht Dresden HRB 6606\nEinreichung neuer Dokumente 19.01.2026 (Eintragungsdatum)\n\nBeteiligungsgesellschaft der Stadt Radebeul mbH\nGesellschaft mit beschränkter Haftung\nRadebeul\n\nAm 15.01.2026 wurde beim Handelsregister des Amtsgerichts Dresden die Liste der Mitglieder des Aufsichtsrats gemäß § 52 GmbHG eingereicht."
    },
    {
      "date": "2026-01-19",
      "id": "142775",
      "original_text": "Löschungsankündigung\nSachsen Amtsgericht Dresden HRB 41773\nSchuetzland GmbH – Dresden",
      "type": "Löschungsankündigung",
      "state": "Sachsen",
      "amtsgericht": "Amtsgericht Dresden",
      "registernummer": "HRB 41773",
      "registerart": "HRB",
      "company_name": "Schuetzland GmbH",
      "company_seat": "Dresden",
      "details": "19.01.2026 (Bekanntmachungsdatum)\n\nSachsen Amtsgericht Dresden HRB 41773\nLöschungsankündigung\n\nSchuetzland GmbH\nGesellschaft mit beschränkter Haftung\nDresden\n\nDas Registergericht beabsichtigt, die im Handelsregister eingetragene Gesellschaft von Amts wegen nach § 394 FamFG zu löschen. Die Frist zu Erhebung eines Widerspruchs gegen die beabsichtigte Löschung wird auf einen Monat festgesetzt."
    },
    {
      "date": "2026-01-19",
      "id": "142776",
      "original_text": "Sonstige Registerbekanntmachung\nSachsen Amtsgericht Leipzig HRB 22412\nPCW GmbH – Eilenburg",
      "type": "Sonstige Registerbekanntmachung",
      "state": "Sachsen",
      "amtsgericht": "Amtsgericht Leipzig",
      "registernummer": "HRB 22412",
      "registerart": "HRB",
      "company_name": "PCW GmbH",
      "company_seat": "Eilenburg",
      "details": "19.01.2026 (Bekanntmachungsdatum)\n\nSachsen Amtsgericht Leipzig HRB 22412\nSonstige Registerbekanntmachung 19.01.2026 (Eintragungsdatum)\n\nPCW GmbH\nGesellschaft mit beschränkter Haftung\nEilenburg\n\nDen Gläubigern der Gesellschaft, deren Forderungen begründet worden sind bevor die Eintragung der Beendigung des Beherrschungs- und Gewinnabführungsvertrages in das Handelsregister nach § 10 des Handelsgesetzbuches als bekanntgemacht gilt, hat der andere Vertragsteil Sicherheit zu leisten, wenn sie sich binnen sechs Monaten nach der Bekanntmachung der Eintragung zu diesem Zweck bei ihm melden."
    },
    {
      "date": "2026-01-19",
      "id": "142777",
      "original_text": "Sonstige Registerbekanntmachung\nSachsen Amtsgericht Leipzig HRB 32281\nCWI Immobilien AG – Leipzig",
      "type": "Sonstige Registerbekanntmachung",
      "state": "Sachsen",
      "amtsgericht": "Amtsgericht Leipzig",
      "registernummer": "HRB 32281",
      "registerart": "HRB",
      "company_name": "CWI Immobilien AG",
      "company_seat": "Leipzig",
      "details": "19.01.2026 (Bekanntmachungsdatum)\n\nSachsen Amtsgericht Leipzig HRB 32281\nSonstige Registerbekanntmachung\n\nCWI Immobilien AG\nAktiengesellschaft\nLeipzig\n\nAm 16.01.2026 wurde beim Handelsregister des Amtsgerichts Leipzig die Liste der Mitglieder des Aufsichtsrats gemäß § 106 AktG eingereicht."
    },
    {
      "date": "2026-01-19",
      "id": "142778",
      "original_text": "Löschungsankündigung\nSachsen Amtsgericht Dresden HRB 12212\nEuropahof-Aktiengesellschaft – Dresden",
      "type": "Löschungsankündigung",
      "state": "Sachsen",
      "amtsgericht": "Amtsgericht Dresden",
      "registernummer": "HRB 12212",
      "registerart": "HRB",
      "company_name": "Europahof-Aktiengesellschaft",
      "company_seat": "Dresden",
      "details": "19.01.2026 (Bekanntmachungsdatum)\n\nSachsen Amtsgericht Dresden HRB 12212\nLöschungsankündigung\n\nEuropahof-Aktiengesellschaft\nAktiengesellschaft\nDresden\n\nDas Registergericht beabsichtigt, die im Handelsregister eingetragene Gesellschaft von Amts wegen nach § 394 FamFG zu löschen. Die Frist zu Erhebung eines Widerspruchs gegen die beabsichtigte Löschung wird auf einen Monat festgesetzt."
    },
    {
      "date": "2026-01-19",
      "id": "142779",
      "original_text": "Registerbekanntmachung nach dem Umwandlungsgesetz\nSachsen Amtsgericht Chemnitz HRB 31936\nPulsotronic GmbH – Niederdorf",
      "type": "Registerbekanntmachung nach dem Umwandlungsgesetz",
      "state": "Sachsen",
      "amtsgericht": "Amtsgericht Chemnitz",
      "registernummer": "HRB 31936",
      "registerart": "HRB",
      "company_name": "Pulsotronic GmbH",
      "company_seat": "Niederdorf",
      "details": "19.01.2026 (Bekanntmachungsdatum)\n\nSachsen Amtsgericht Chemnitz HRB 31936\nRegisterbekanntmachung nach dem Umwandlungsgesetz 19.01.2026 (Eintragungsdatum)\n\nPulsotronic GmbH\nGesellschaft mit beschränkter Haftung\nNiederdorf\n\nDen Gläubigern der an der Verschmelzung beteiligten Rechtsträger ist, wenn sie binnen sechs Monaten nach dem Tag, an dem die Eintragung der Verschmelzung in das Register des Sitzes desjenigen Rechtsträgers, dessen Gläubiger sie sind, nach § 19 Abs. 3 UmwG als bekannt gemacht gilt, ihren Anspruch nach Grund und Höhe in Textform anmelden, Sicherheit zu leisten, soweit sie nicht Befriedigung verlangen können. Dieses Recht steht den Gläubigern jedoch nur zu, wenn sie glaubhaft machen, dass durch die Verschmelzung die Erfüllung der Forderung gefährdet wird."
    },
    {
      "date": "2026-01-19",
      "id": "142780",
      "original_text": "Einreichung neuer Dokumente\nSachsen Amtsgericht Dresden HRB 12833\nKBO Kommunale Beteiligungsgesellschaft mbH an der Energie Sachsen Ost – Sebnitz",
      "type": "Einreichung neuer Dokumente",
      "state": "Sachsen",
      "amtsgericht": "Amtsgericht Dresden",
      "registernummer": "HRB 12833",
      "registerart": "HRB",
      "company_name": "KBO Kommunale Beteiligungsgesellschaft mbH an der Energie Sachsen Ost",
      "company_seat": "Sebnitz",
      "details": "19.01.2026 (Bekanntmachungsdatum)\n\nSachsen Amtsgericht Dresden HRB 12833\nEinreichung neuer Dokumente\n\nKBO Kommunale Beteiligungsgesellschaft mbH an der Energie Sachsen Ost\nGesellschaft mit beschränkter Haftung\nSebnitz\n\nAm 14.01.2026 wurde beim Handelsregister des Amtsgerichts Dresden die Liste der Mitglieder des Aufsichtsrats gemäß § 52 GmbHG eingereicht."
    },
    {
      "date": "2026-01-19",
      "id": "142781",
      "original_text": "Registerbekanntmachung nach dem Umwandlungsgesetz\nSachsen Amtsgericht Chemnitz HRB 15817\nSKS Kontakttechnik GmbH – Niederdorf",
      "type": "Registerbekanntmachung nach dem Umwandlungsgesetz",
      "state": "Sachsen",
      "amtsgericht": "Amtsgericht Chemnitz",
      "registernummer": "HRB 15817",
      "registerart": "HRB",
      "company_name": "SKS Kontakttechnik GmbH",
      "company_seat": "Niederdorf",
      "details": "19.01.2026 (Bekanntmachungsdatum)\n\nSachsen Amtsgericht Chemnitz HRB 15817\nRegisterbekanntmachung nach dem Umwandlungsgesetz 19.01.2026 (Eintragungsdatum)\n\nSKS Kontakttechnik GmbH\nGesellschaft mit beschränkter Haftung\nNiederdorf\n\nDen Gläubigern der an der Verschmelzung beteiligten Rechtsträger ist, wenn sie binnen sechs Monaten nach dem Tag, an dem die Eintragung der Verschmelzung in das Register des Sitzes desjenigen Rechtsträgers, dessen Gläubiger sie sind, nach § 19 Abs. 3 UmwG als bekannt gemacht gilt, ihren Anspruch nach Grund und Höhe in Textform anmelden, Sicherheit zu leisten, soweit sie nicht Befriedigung verlangen können. Dieses Recht steht den Gläubigern jedoch nur zu, wenn sie glaubhaft machen, dass durch die Verschmelzung die Erfüllung der Forderung gefährdet wird."
    },
    {
      "date": "2026-01-19",
      "id": "142782",
      "original_text": "Registerbekanntmachung nach dem Umwandlungsgesetz\nSachsen Amtsgericht Chemnitz HRB 18936\nVakuum Technik GmbH Eibenstock – Eibenstock",
      "type": "Registerbekanntmachung nach dem Umwandlungsgesetz",
      "state": "Sachsen",
      "amtsgericht": "Amtsgericht Chemnitz",
      "registernummer": "HRB 18936",
      "registerart": "HRB",
      "company_name": "Vakuum Technik GmbH Eibenstock",
      "company_seat": "Eibenstock",
      "details": "19.01.2026 (Bekanntmachungsdatum)\n\nSachsen Amtsgericht Chemnitz HRB 18936\nRegisterbekanntmachung nach dem Umwandlungsgesetz 19.01.2026 (Eintragungsdatum)\n\nVakuum Technik GmbH Eibenstock\nGesellschaft mit beschränkter Haftung\nEibenstock\n\nDen Gläubigern der an der Verschmelzung beteiligten Rechtsträger ist, wenn sie binnen sechs Monaten nach dem Tag, an dem die Eintragung der Verschmelzung in das Register des Sitzes desjenigen Rechtsträgers, dessen Gläubiger sie sind, nach § 19 Abs. 3 UmwG als bekannt gemacht gilt, ihren Anspruch nach Grund und Höhe in Textform anmelden, Sicherheit zu leisten, soweit sie nicht Befriedigung verlangen können. Dieses Recht steht den Gläubigern jedoch nur zu, wenn sie glaubhaft machen, dass durch die Verschmelzung die Erfüllung der Forderung gefährdet wird."
    },
    {
      "date": "2026-01-19",
      "id": "142783",
      "original_text": "Löschungsankündigung\nNiedersachsen Amtsgericht Hildesheim HRB 100167 früher Amtsgericht Gifhorn\nEisen-Kutzner Verwaltungsgesellschaft mit beschränkter Haftung – Gifhorn",
      "type": "Löschungsankündigung",
      "state": "Niedersachsen",
      "amtsgericht": "Amtsgericht Hildesheim",
      "registernummer": "HRB 100167",
      "registerart": "HRB",
      "company_name": "Eisen-Kutzner Verwaltungsgesellschaft mit beschränkter Haftung",
      "company_seat": "Gifhorn",
      "former_amtsgericht": "Gifhorn",
      "details": "19.01.2026 (Bekanntmachungsdatum)\n\nNiedersachsen Amtsgericht Hildesheim HRB 100167 früher Amtsgericht Gifhorn\nLöschungsankündigung\n\nEisen-Kutzner Verwaltungsgesellschaft mit beschränkter Haftung\nGesellschaft mit beschränkter Haftung\nGifhorn\n\nDas Registergericht beabsichtigt, die Gesellschaft von Amts wegen nach § 394 FamFG zu löschen. Die Frist zur Erhebung eines Widerspruchs ist auf 1 Monat ab dieser Registerbekanntmachung festgesetzt."
    },
    {
      "date": "2026-01-19",
      "id": "142784",
      "original_text": "Löschungsankündigung\nNiedersachsen Amtsgericht Aurich HRA 111479 früher Amtsgericht Leer (Ostfriesland) (Leer)\nAtlas Trampship Reederei GmbH & Co. MS \"FLENSBURG\" KG – Leer",
      "type": "Löschungsankündigung",
      "state": "Niedersachsen",
      "amtsgericht": "Amtsgericht Aurich",
      "registernummer": "HRA 111479",
      "registerart": "HRA",
      "company_name": "Atlas Trampship Reederei GmbH & Co. MS \"FLENSBURG\" KG",
      "company_seat": "Leer",
      "former_amtsgericht": "Leer (Ostfriesland) (Leer)",
      "details": "19.01.2026 (Bekanntmachungsdatum)\n\nNiedersachsen Amtsgericht Aurich HRA 111479 früher Amtsgericht Leer (Ostfriesland) (Leer)\nLöschungsankündigung\n\nAtlas Trampship Reederei GmbH & Co. MS \"FLENSBURG\" KG\nKommanditgesellschaft\nLeer\n\nDas Registergericht beabsichtigt, die Firma von Amts wegen nach § 394 FamFG zu löschen. Die Frist zur Erhebung eines Widerspruchs ist auf 1 Monat ab dieser Registerbekanntmachung festgesetzt."
    },
    {
      "date": "2026-01-19",
      "id": "142785",
      "original_text": "Löschungsankündigung\nNiedersachsen Amtsgericht Osnabrück HRB 215956\nIGS Europe GmbH – Bad Bentheim",
      "type": "Löschungsankündigung",
      "state": "Niedersachsen",
      "amtsgericht": "Amtsgericht Osnabrück",
      "registernummer": "HRB 215956",
      "registerart": "HRB",
      "company_name": "IGS Europe GmbH",
      "company_seat": "Bad Bentheim",
      "details": "19.01.2026 (Bekanntmachungsdatum)\n\nNiedersachsen Amtsgericht Osnabrück HRB 215956\nLöschungsankündigung 19.01.2026 (Eintragungsdatum)\n\nIGS Europe GmbH\nGesellschaft mit beschränkter Haftung\nBad Bentheim\n\nDas Registergericht beabsichtigt, die Gesellschaft von Amts wegen nach § 394 FamFG wegen Vermögenslosigkeit zu löschen. Die Frist zur Erhebung eines Widerspruchs ist auf 1 Monat ab dieser Registerbekanntmachung festgesetzt."
    },
    {
      "date": "2026-01-19",
      "id": "142786",
      "original_text": "Löschungsankündigung\nNiedersachsen Amtsgericht Osnabrück HRB 218429\nseti GmbH – Osnabrück",
      "type": "Löschungsankündigung",
      "state": "Niedersachsen",
      "amtsgericht": "Amtsgericht Osnabrück",
      "registernummer": "HRB 218429",
      "registerart": "HRB",
      "company_name": "seti GmbH",
      "company_seat": "Osnabrück",
      "details": "19.01.2026 (Bekanntmachungsdatum)\n\nNiedersachsen Amtsgericht Osnabrück HRB 218429\nLöschungsankündigung\n\nseti GmbH\nGesellschaft mit beschränkter Haftung\nOsnabrück\n\nDas Registergericht beabsichtigt, die Gesellschaft von Amts wegen nach § 394 FamFG wegen Vermögenslosigkeit zu löschen. Die Frist zur Erhebung eines Widerspruchs ist auf 1 Monat ab dieser Registerbekanntmachung festgesetzt."
    },
    {
      "date": "2026-01-19",
      "id": "142787",
      "original_text": "Registerbekanntmachung nach dem Umwandlungsgesetz\nNiedersachsen Amtsgericht Osnabrück HRB 204703\nsteute Schmersal GmbH – Melle",
      "type": "Registerbekanntmachung nach dem Umwandlungsgesetz",
      "state": "Niedersachsen",
      "amtsgericht": "Amtsgericht Osnabrück",
      "registernummer": "HRB 204703",
      "registerart": "HRB",
      "company_name": "steute Schmersal GmbH",
      "company_seat": "Melle",
      "details": "19.01.2026 (Bekanntmachungsdatum)\n\nNiedersachsen Amtsgericht Osnabrück HRB 204703\nRegisterbekanntmachung nach dem Umwandlungsgesetz 19.01.2026 (Eintragungsdatum)\n\nsteute Schmersal GmbH\nGesellschaft mit beschränkter Haftung\nMelle\n\nDen Gläubigern der an der Verschmelzung beteiligten Rechtsträger ist, wenn sie binnen sechs Monaten nach dem Tag, an dem die Eintragung der Verschmelzung in das Register des Sitzes desjenigen Rechtsträgers, dessen Gläubiger sie sind, nach § 19  Abs.  3 UmwG als bekannt gemacht gilt, ihren Anspruch nach Grund und Höhe schriftlich anmelden, Sicherheit zu leisten, soweit sie nicht Befriedigung verlangen können. Dieses Recht steht den Gläubigern jedoch nur zu, wenn sie glaubhaft machen, dass durch die Verschmelzung die Erfüllung der Forderung gefährdet wird."
    },
    {
      "date": "2026-01-19",
      "id": "142788",
      "original_text": "Löschungsankündigung\nNiedersachsen Amtsgericht Osnabrück HRB 218467\nRio Grande-Bei NiDo UG (haftungsbeschränkt) – Lingen (Ems)",
      "type": "Löschungsankündigung",
      "state": "Niedersachsen",
      "amtsgericht": "Amtsgericht Osnabrück",
      "registernummer": "HRB 218467",
      "registerart": "HRB",
      "company_name": "Rio Grande-Bei NiDo UG (haftungsbeschränkt)",
      "company_seat": "Lingen (Ems)",
      "details": "19.01.2026 (Bekanntmachungsdatum)\n\nNiedersachsen Amtsgericht Osnabrück HRB 218467\nLöschungsankündigung\n\nRio Grande-Bei NiDo UG (haftungsbeschränkt)\nGesellschaft mit beschränkter Haftung\nLingen (Ems)\n\nDas Registergericht beabsichtigt, die Gesellschaft von Amts wegen nach § 394 FamFG wegen Vermögenslosigkeit zu löschen. Die Frist zur Erhebung eines Widerspruchs ist auf 1 Monat ab dieser Registerbekanntmachung festgesetzt."
    },
    {
      "date": "2026-01-19",
      "id": "142789",
      "original_text": "Sonstige Registerbekanntmachung\nNiedersachsen Amtsgericht Aurich HRB 204752\nKlauenpflege Altona GmbH – Friedeburg",
      "type": "Sonstige Registerbekanntmachung",
      "state": "Niedersachsen",
      "amtsgericht": "Amtsgericht Aurich",
      "registernummer": "HRB 204752",
      "registerart": "HRB",
      "company_name": "Klauenpflege Altona GmbH",
      "company_seat": "Friedeburg",
      "details": "19.01.2026 (Bekanntmachungsdatum)\n\nNiedersachsen Amtsgericht Aurich HRB 204752\nSonstige Registerbekanntmachung 19.01.2026 (Eintragungsdatum)\n\nKlauenpflege Altona GmbH\nGesellschaft mit beschränkter Haftung\nFriedeburg\n\nDen Gläubigern der Gesellschaft, deren Forderungen begründet worden sind, bevor die Eintragung der Beendigung des Vertrages in das Handelsregister nach § 10 HGB als bekannt gemacht gilt, hat der andere Vertragsteil Sicherheit zu leisten, wenn sie sich binnen sechs Monaten nach der Bekanntmachung der Eintragung zu diesem Zweck bei ihm melden."
    },
    {
      "date": "2026-01-19",
      "id": "142790",
      "original_text": "Einreichung neuer Dokumente\nNiedersachsen Amtsgericht Braunschweig HRB 210040\nTrivium Packaging Germany GmbH – Seesen",
      "type": "Einreichung neuer Dokumente",
      "state": "Niedersachsen",
      "amtsgericht": "Amtsgericht Braunschweig",
      "registernummer": "HRB 210040",
      "registerart": "HRB",
      "company_name": "Trivium Packaging Germany GmbH",
      "company_seat": "Seesen",
      "details": "19.01.2026 (Bekanntmachungsdatum)\n\nNiedersachsen Amtsgericht Braunschweig HRB 210040\nEinreichung neuer Dokumente\n\nTrivium Packaging Germany GmbH\nGesellschaft mit beschränkter Haftung\nSeesen\n\nEine neue Liste der Mitglieder des Aufsichtsrats wurde beim Registergericht eingereicht."
    },
    {
      "date": "2026-01-19",
      "id": "142791",
      "original_text": "Löschungsankündigung\nNiedersachsen Amtsgericht Hildesheim HRB 208288\nHaus Am Mühlenbrink UG (haftungsbeschränkt) – Delligsen",
      "type": "Löschungsankündigung",
      "state": "Niedersachsen",
      "amtsgericht": "Amtsgericht Hildesheim",
      "registernummer": "HRB 208288",
      "registerart": "HRB",
      "company_name": "Haus Am Mühlenbrink UG (haftungsbeschränkt)",
      "company_seat": "Delligsen",
      "details": "19.01.2026 (Bekanntmachungsdatum)\n\nNiedersachsen Amtsgericht Hildesheim HRB 208288\nLöschungsankündigung\n\nHaus Am Mühlenbrink UG (haftungsbeschränkt)\nGesellschaft mit beschränkter Haftung\nDelligsen\n\nDas Registergericht beabsichtigt, die Gesellschaft von Amts wegen nach § 394 FamFG zu löschen. Die Frist zur Erhebung eines Widerspruchs ist auf 1 Monat ab dieser Registerbekanntmachung festgesetzt."
    },
    {
      "date": "2026-01-19",
      "id": "142792",
      "original_text": "Löschungsankündigung\nNiedersachsen Amtsgericht Hildesheim HRA 100064 früher Amtsgericht Gifhorn\nEisen-Kutzner GmbH & Co KG – Gifhorn",
      "type": "Löschungsankündigung",
      "state": "Niedersachsen",
      "amtsgericht": "Amtsgericht Hildesheim",
      "registernummer": "HRA 100064",
      "registerart": "HRA",
      "company_name": "Eisen-Kutzner GmbH & Co KG",
      "company_seat": "Gifhorn",
      "former_amtsgericht": "Gifhorn",
      "details": "19.01.2026 (Bekanntmachungsdatum)\n\nNiedersachsen Amtsgericht Hildesheim HRA 100064 früher Amtsgericht Gifhorn\nLöschungsankündigung\n\nEisen-Kutzner GmbH & Co KG\nKommanditgesellschaft\nGifhorn\n\nDas Registergericht beabsichtigt, die Firma von Amts wegen nach § 394 FamFG zu löschen. Die Frist zur Erhebung eines Widerspruchs ist auf 1 Monat ab dieser Registerbekanntmachung festgesetzt."
    },
    {
      "date": "2026-01-19",
      "id": "142793",
      "original_text": "Löschungsankündigung\nRheinland-Pfalz Amtsgericht Wittlich HRB 32062\nKFZ Teile-Handel Hermann GmbH – Bitburg",
      "type": "Löschungsankündigung",
      "state": "Rheinland-Pfalz",
      "amtsgericht": "Amtsgericht Wittlich",
      "registernummer": "HRB 32062",
      "registerart": "HRB",
      "company_name": "KFZ Teile-Handel Hermann GmbH",
      "company_seat": "Bitburg",
      "details": "19.01.2026 (Bekanntmachungsdatum)\n\nRheinland-Pfalz Amtsgericht Wittlich HRB 32062\nLöschungsankündigung\n\nKFZ Teile-Handel Hermann GmbH\nGesellschaft mit beschränkter Haftung\nBitburg\n\nDas Registergericht beabsichtigt die Gesellschaft von Amts wegen nach § 394 FamFG zu löschen. Die Frist zur Erhebung eines Widerspruchs ist auf einen Monat festgesetzt."
    },
    {
      "date": "2026-01-19",
      "id": "142794",
      "original_text": "Löschungsankündigung\nRheinland-Pfalz Amtsgericht Wittlich HRB 45055\nXphone GmbH – Trier",
      "type": "Löschungsankündigung",
      "state": "Rheinland-Pfalz",
      "amtsgericht": "Amtsgericht Wittlich",
      "registernummer": "HRB 45055",
      "registerart": "HRB",
      "company_name": "Xphone GmbH",
      "company_seat": "Trier",
      "details": "19.01.2026 (Bekanntmachungsdatum)\n\nRheinland-Pfalz Amtsgericht Wittlich HRB 45055\nLöschungsankündigung\n\nXphone GmbH\nGesellschaft mit beschränkter Haftung\nTrier\n\nDas Registergericht beabsichtigt die Gesellschaft von Amts wegen nach § 394 FamFG zu löschen. Die Frist zur Erhebung eines Widerspruchs ist auf einen Monat festgesetzt."
    },
    {
      "date": "2026-01-19",
      "id": "142795",
      "original_text": "Löschungsankündigung\nRheinland-Pfalz Amtsgericht Wittlich HRB 12748\nKONZEPT Bau GmbH – Üxheim",
      "type": "Löschungsankündigung",
      "state": "Rheinland-Pfalz",
      "amtsgericht": "Amtsgericht Wittlich",
      "registernummer": "HRB 12748",
      "registerart": "HRB",
      "company_name": "KONZEPT Bau GmbH",
      "company_seat": "Üxheim",
      "details": "19.01.2026 (Bekanntmachungsdatum)\n\nRheinland-Pfalz Amtsgericht Wittlich HRB 12748\nLöschungsankündigung\n\nKONZEPT Bau GmbH\nGesellschaft mit beschränkter Haftung\nÜxheim\n\nDas Registergericht beabsichtigt die Gesellschaft von Amts wegen nach § 394 FamFG zu löschen. Die Frist zur Erhebung eines Widerspruchs ist auf einen Monat festgesetzt."
    },
    {
      "date": "2026-01-19",
      "id": "142796",
      "original_text": "Sonstige Registerbekanntmachung\nNordrhein-Westfalen Amtsgericht Aachen HRB 560\nSTAWAG - Stadt- und Städteregionswerke Aachen AG – Aachen",
      "type": "Sonstige Registerbekanntmachung",
      "state": "Nordrhein-Westfalen",
      "amtsgericht": "Amtsgericht Aachen",
      "registernummer": "HRB 560",
      "registerart": "HRB",
      "company_name": "STAWAG - Stadt- und Städteregionswerke Aachen AG",
      "company_seat": "Aachen",
      "details": "19.01.2026 (Bekanntmachungsdatum)\n\nNordrhein-Westfalen Amtsgericht Aachen HRB 560\nSonstige Registerbekanntmachung 19.01.2026 (Eintragungsdatum)\n\nSTAWAG - Stadt- und Städteregionswerke Aachen AG\nAktiengesellschaft\nAachen\n\nDem Registergericht ist eine Liste der Mitglieder des Aufsichtsrates eingereicht worden."
    },
    {
      "date": "2026-01-19",
      "id": "142797",
      "original_text": "Einreichung neuer Dokumente\nNordrhein-Westfalen Amtsgericht Wuppertal HRB 21088\nEUROPA SERVICE Mobility Partners Aktiengesellschaft – Solingen",
      "type": "Einreichung neuer Dokumente",
      "state": "Nordrhein-Westfalen",
      "amtsgericht": "Amtsgericht Wuppertal",
      "registernummer": "HRB 21088",
      "registerart": "HRB",
      "company_name": "EUROPA SERVICE Mobility Partners Aktiengesellschaft",
      "company_seat": "Solingen",
      "details": "19.01.2026 (Bekanntmachungsdatum)\n\nNordrhein-Westfalen Amtsgericht Wuppertal HRB 21088\nEinreichung neuer Dokumente 19.01.2026 (Eintragungsdatum)\n\nEUROPA SERVICE Mobility Partners Aktiengesellschaft\nAktiengesellschaft\nSolingen\n\nDem Registergericht ist eine neue Liste der Mitglieder des Aufsichtsrates eingereicht worden."
    },
    {
      "date": "2026-01-19",
      "id": "142798",
      "original_text": "Registerbekanntmachung nach dem Umwandlungsgesetz\nNordrhein-Westfalen Amtsgericht Hagen HRB 13257\nbuecher.de internetstores GmbH – Hagen",
      "type": "Registerbekanntmachung nach dem Umwandlungsgesetz",
      "state": "Nordrhein-Westfalen",
      "amtsgericht": "Amtsgericht Hagen",
      "registernummer": "HRB 13257",
      "registerart": "HRB",
      "company_name": "buecher.de internetstores GmbH",
      "company_seat": "Hagen",
      "details": "19.01.2026 (Bekanntmachungsdatum)\n\nNordrhein-Westfalen Amtsgericht Hagen HRB 13257\nRegisterbekanntmachung nach dem Umwandlungsgesetz 16.01.2026 (Eintragungsdatum)\n\nbuecher.de internetstores GmbH\nGesellschaft mit beschränkter Haftung\nHagen\n\nDen Gläubigern der an der Verschmelzung beteiligten Rechtsträger ist, wenn sie\nbinnen sechs Monaten nach dem Tag, an dem die Eintragung der Verschmelzung in das Register des Sitzes desjenigen Rechtsträgers, dessen Gläubiger sie sind, nach § 19 Abs. 3 UmwG als bekannt gemacht gilt, ihren Anspruch nach Grund und Höhe schriftlich anzumelden, Sicherheit zu leisten, soweit sie nicht Befriedigung verlangen können. Dieses Recht steht ihnen jedoch nur zu, wenn sie glaubhaft machen, dass durch die Verschmelzung die Erfüllung ihrer Forderung gefährdet wird."
    },
    {
      "date": "2026-01-19",
      "id": "142799",
      "original_text": "Löschungsankündigung\nNordrhein-Westfalen Amtsgericht Aachen HRB 20084\nLoemax GmbH – Herzogenrath",
      "type": "Löschungsankündigung",
      "state": "Nordrhein-Westfalen",
      "amtsgericht": "Amtsgericht Aachen",
      "registernummer": "HRB 20084",
      "registerart": "HRB",
      "company_name": "Loemax GmbH",
      "company_seat": "Herzogenrath",
      "details": "19.01.2026 (Bekanntmachungsdatum)\n\nNordrhein-Westfalen Amtsgericht Aachen HRB 20084\nLöschungsankündigung\n\nLoemax GmbH\nGesellschaft mit beschränkter Haftung\nHerzogenrath\n\nDas Registergericht beabsichtigt, von Amts wegen die Gesellschaft wegen Vermögenslosigkeit nach § 394 FamFG zu löschen, weil das Insolvenzverfahren Amtsgericht Aachen (Az.: 91 IN 312/19) beendet und Vermögen der Gesellschaft nicht mehr erkennbar ist.\n\nZur Geltendmachung des Widerspruchs gegen die beabsichtigte Löschung wird hiermit eine Frist von einem Monat ab Veröffentlichung dieser Ankündigung bestimmt.\n\nRechtsbehelfsbelehrung:\n\nGegen diese Verfügung kann Widerspruch eingelegt werden. Zum Widerspruch ist\njeder berechtigt, der an der Unterlassung der Löschung ein berechtigtes Interesse hat.\n\nDer Widerspruch ist bei dem Amtsgericht Aachen, Adalbertsteinweg 92, 52070 Aachen schriftlich in deutscher Sprache oder zur Niederschrift der Geschäftsstelle einzulegen. Der Widerspruch kann auch zur Niederschrift der Geschäftsstelle eines jeden Amtsgerichtes abgegeben werden.\n\nDer Widerspruch muss spätestens innerhalb der gesetzten Frist nach der Bekanntgabe der Verfügung bei dem Amtsgericht Aachen eingegangen sein. Dies gilt auch dann, wenn der Widerspruch zur Niederschrift der Geschäftsstelle eines anderen Amtsgerichtes abgegeben wurde. Die Frist beginnt mit der Bekanntgabe der Verfügung durch Veröffentlichung. Fällt das Ende der Frist auf einen Sonntag, einen allgemeinen Feiertag oder Sonnabend, so endet die Frist mit Ablauf des nächsten Werktages.\n\nDer Widerspruch muss die Bezeichnung der angefochtenen Verfügung sowie die Erklärung enthalten, dass Widerspruch gegen diese Verfügung eingelegt wird. Er ist zu unterzeichnen und soll begründet werden.\n\nDie Einlegung ist auch durch Übertragung eines elektronischen Dokuments an die elektronische Poststelle des Gerichts möglich. Das elektronische Dokument muss für die Bearbeitung durch das Gericht geeignet und mit einer qualifizierten elektronischen Signatur der verantwortenden Person versehen sein oder von der verantwortenden Person signiert und auf einem sicheren Übermittlungsweg gemäß § 130 a ZPO nach näherer Maßgabe der Verordnung über die technischen Rahmenbedingungen des elektronischen Rechtsverkehrs und über das besondere elektronische Behördenpostfach (BGBl. I, S. 3803) eingereicht werden. Weitere Informationen erhalten Sie auf der Internetseite www.justiz.de."
    },
    {
      "date": "2026-01-19",
      "id": "142800",
      "original_text": "Sonstige Registerbekanntmachung\nNordrhein-Westfalen Amtsgericht Lemgo HRB 1127\nStadtwerke Lemgo GmbH – Lemgo",
      "type": "Sonstige Registerbekanntmachung",
      "state": "Nordrhein-Westfalen",
      "amtsgericht": "Amtsgericht Lemgo",
      "registernummer": "HRB 1127",
      "registerart": "HRB",
      "company_name": "Stadtwerke Lemgo GmbH",
      "company_seat": "Lemgo",
      "details": "19.01.2026 (Bekanntmachungsdatum)\n\nNordrhein-Westfalen Amtsgericht Lemgo HRB 1127\nSonstige Registerbekanntmachung\n\nStadtwerke Lemgo GmbH\nGesellschaft mit beschränkter Haftung\nLemgo\n\nDem Registergericht ist eine Liste der Mitglieder des Aufsichtsrates eingereicht worden."
    },
    {
      "date": "2026-01-19",
      "id": "142801",
      "original_text": "Löschungsankündigung\nNordrhein-Westfalen Amtsgericht Düsseldorf HRB 92626\nRaaymakers GmbH – Hilden",
      "type": "Löschungsankündigung",
      "state": "Nordrhein-Westfalen",
      "amtsgericht": "Amtsgericht Düsseldorf",
      "registernummer": "HRB 92626",
      "registerart": "HRB",
      "company_name": "Raaymakers GmbH",
      "company_seat": "Hilden",
      "details": "19.01.2026 (Bekanntmachungsdatum)\n\nNordrhein-Westfalen Amtsgericht Düsseldorf HRB 92626\nLöschungsankündigung\n\nRaaymakers GmbH\nGesellschaft mit beschränkter Haftung\nHilden\n\nDas Registergericht beabsichtigt die Gesellschaft von Amts wegen nach § 394 Abs. 1 FamFG zu löschen. Die Frist zur Erhebung eines Widerspruchs ist auf einen Monat festgesetzt.\n\nRechtsbehelfsbelehrung:\nDas Widerspruchsrecht steht jedem zu, der an der Unterlassung der Löschung ein berechtigtes Interesse hat. Der Widerspruch ist bei dem Amtsgericht Düsseldorf -Registergericht-, Werdener Straße 1, 40227 Düsseldorf schriftlich in deutscher Sprache oder zur Niederschrift der Geschäftsstelle einzulegen. Der Widerspruch kann auch zur Niederschrift der Geschäftsstelle eines jeden Amtsgerichtes abgegeben werden. Die Einlegung ist auch durch Übertragung eines elektronischen Dokuments an die elektronische Poststelle des Gerichts möglich. Das elektronische Dokument muss für die Bearbeitung durch das Gericht geeignet und mit einer qualifizierten elektronischen Signatur der verantwortenden Person versehen sein oder von der verantwortenden Person signiert und auf einem sicheren Übermittlungsweg gemäß § 130a ZPO nach näherer Maßgabe der Verordnung über die technischen Rahmenbedingungen des elektronischen Rechtsverkehrs und über das besondere elektronische Behördenpostfach (BGBl. I, S.3803) eingereicht werden. Weitere Informationen erhalten Sie auf der Internetseite www.justiz.de.\nDer Widerspruch muss spätestens innerhalb der gesetzten Frist nach dem Datum der Bekanntmachung der Löschungsankündigung bei dem Amtsgericht - Registergericht - Düsseldorf eingegangen sein.  Dies gilt auch dann, wenn der Widerspruch zur Niederschrift der Geschäftsstelle eines anderen Amtsgerichtes abgegeben wurde. Die Frist beginnt mit dem Tage der Bekanntmachung der Löschungsankündigung in dem für die Bekanntmachung der Eintragungen in das Handelsregister bestimmten elektronischen Informations- und Kommunikationssystem nach § 10 des Handelsgesetzbuches. Fällt das Ende der Frist auf einen Sonntag, einen allgemeinen Feiertag oder Sonnabend, so endet die Frist mit Ablauf des nächsten Werktages.\nDer Widerspruch muss die Bezeichnung der angefochtenen Löschungsankündigung sowie die Erklärung enthalten, dass Widerspruch gegen diese Löschungsankündigung eingelegt wird. Er ist zu unterzeichnen und soll begründet werden."
    },
    {
      "date": "2026-01-19",
      "id": "142802",
      "original_text": "Sonstige Registerbekanntmachung\nNordrhein-Westfalen Amtsgericht Düsseldorf HRB 106122\nLERROS Moden GmbH – Düsseldorf",
      "type": "Sonstige Registerbekanntmachung",
      "state": "Nordrhein-Westfalen",
      "amtsgericht": "Amtsgericht Düsseldorf",
      "registernummer": "HRB 106122",
      "registerart": "HRB",
      "company_name": "LERROS Moden GmbH",
      "company_seat": "Düsseldorf",
      "details": "19.01.2026 (Bekanntmachungsdatum)\n\nNordrhein-Westfalen Amtsgericht Düsseldorf HRB 106122\nSonstige Registerbekanntmachung\n\nLERROS Moden GmbH\nGesellschaft mit beschränkter Haftung\nDüsseldorf\n\nDem Registergericht ist eine Liste der Mitglieder des Aufsichtsrates eingereicht worden."
    },
    {
      "date": "2026-01-19",
      "id": "142803",
      "original_text": "Löschungsankündigung\nNordrhein-Westfalen Amtsgericht Köln HRB 106482\nV.S.C.S. Consulting GmbH – Köln",
      "type": "Löschungsankündigung",
      "state": "Nordrhein-Westfalen",
      "amtsgericht": "Amtsgericht Köln",
      "registernummer": "HRB 106482",
      "registerart": "HRB",
      "company_name": "V.S.C.S. Consulting GmbH",
      "company_seat": "Köln",
      "details": "19.01.2026 (Bekanntmachungsdatum)\n\nNordrhein-Westfalen Amtsgericht Köln HRB 106482\nLöschungsankündigung\n\nV.S.C.S. Consulting GmbH\nGesellschaft mit beschränkter Haftung\nKöln\n\nDas Registergericht beabsichtigt die Gesellschaft von Amts wegen nach § 394 FamFG zu löschen. Die Frist zur Erhebung eines Widerspruchs ist auf einen Monat festgesetzt."
    },
    {
      "date": "2026-01-19",
      "id": "142804",
      "original_text": "Löschungsankündigung\nNordrhein-Westfalen Amtsgericht Aachen HRB 20365\nDREI G UG (haftungsbeschränkt) – Aachen",
      "type": "Löschungsankündigung",
      "state": "Nordrhein-Westfalen",
      "amtsgericht": "Amtsgericht Aachen",
      "registernummer": "HRB 20365",
      "registerart": "HRB",
      "company_name": "DREI G UG (haftungsbeschränkt)",
      "company_seat": "Aachen",
      "details": "19.01.2026 (Bekanntmachungsdatum)\n\nNordrhein-Westfalen Amtsgericht Aachen HRB 20365\nLöschungsankündigung\n\nDREI G UG (haftungsbeschränkt)\nGesellschaft mit beschränkter Haftung\nAachen\n\nDas Registergericht beabsichtigt, von Amts wegen die Gesellschaft wegen Vermögenslosigkeit nach § 394 FamFG zu löschen.\n\nZur Geltendmachung des Widerspruchs gegen die beabsichtigte Löschung wird hiermit eine Frist von einem Monat ab Veröffentlichung dieser Ankündigung bestimmt.\n\nRechtsbehelfsbelehrung:\n\nGegen diese Verfügung kann Widerspruch eingelegt werden. Zum Widerspruch ist jeder berechtigt, der an der Unterlassung der Löschung ein berechtigtes Interesse hat.\n\nDer Widerspruch ist bei dem Amtsgericht Aachen, Adalbertsteinweg 92, 52070 Aachen schriftlich in deutscher Sprache oder zur Niederschrift der Geschäftsstelle einzulegen. Der Widerspruch kann auch zur Niederschrift der Geschäftsstelle eines jeden Amtsgerichtes abgegeben werden.\n\nDer Widerspruch muss spätestens innerhalb der gesetzten Frist nach der Bekanntgabe der Verfügung bei dem Amtsgericht Aachen eingegangen sein. Dies gilt auch dann, wenn der Widerspruch zur Niederschrift der Geschäftsstelle eines anderen Amtsgerichtes abgegeben wurde. Die Frist beginnt mit der Bekanntgabe der Verfügung durch Veröffentlichung. Fällt das Ende der Frist auf einen Sonntag, einen allgemeinen Feiertag oder Sonnabend, so endet die Frist mit Ablauf des nächsten Werktages.\n\nDer Widerspruch muss die Bezeichnung der angefochtenen Verfügung sowie die Erklärung enthalten, dass Widerspruch gegen diese Verfügung eingelegt wird. Er ist zu unterzeichnen und soll begründet werden.\n\nDie Einlegung ist auch durch Übertragung eines elektronischen Dokuments an die elektronische Poststelle des Gerichts möglich. Das elektronische Dokument muss für die Bearbeitung durch das Gericht geeignet und mit einer qualifizierten elektronischen Signatur der verantwortenden Person versehen sein oder von der verantwortenden Person signiert und auf einem sicheren Übermittlungsweg gemäß § 130 a ZPO nach näherer Maßgabe der Verordnung über die technischen Rahmenbedingungen des elektronischen Rechtsverkehrs und über das besondere elektronische Behördenpostfach (BGBl. I, S. 3803) eingereicht werden. Weitere Informationen erhalten Sie auf der Internetseite www.justiz.de."
    },
    {
      "date": "2026-01-19",
      "id": "142805",
      "original_text": "Einreichung neuer Dokumente\nNordrhein-Westfalen Amtsgericht Düsseldorf HRB 3466\nStadtwerke Düsseldorf AG – Düsseldorf",
      "type": "Einreichung neuer Dokumente",
      "state": "Nordrhein-Westfalen",
      "amtsgericht": "Amtsgericht Düsseldorf",
      "registernummer": "HRB 3466",
      "registerart": "HRB",
      "company_name": "Stadtwerke Düsseldorf AG",
      "company_seat": "Düsseldorf",
      "details": "19.01.2026 (Bekanntmachungsdatum)\n\nNordrhein-Westfalen Amtsgericht Düsseldorf HRB 3466\nEinreichung neuer Dokumente 16.01.2026 (Eintragungsdatum)\n\nStadtwerke Düsseldorf AG\nAktiengesellschaft\nDüsseldorf\n\nDem Registergericht ist eine Liste der Mitglieder des Aufsichtsrates eingereicht worden."
    },
    {
      "date": "2026-01-19",
      "id": "142806",
      "original_text": "Sonstige Registerbekanntmachung\nNordrhein-Westfalen Amtsgericht Siegburg HRB 17724\nSARSTEDT Sterilization Services GmbH – Nümbrecht",
      "type": "Sonstige Registerbekanntmachung",
      "state": "Nordrhein-Westfalen",
      "amtsgericht": "Amtsgericht Siegburg",
      "registernummer": "HRB 17724",
      "registerart": "HRB",
      "company_name": "SARSTEDT Sterilization Services GmbH",
      "company_seat": "Nümbrecht",
      "details": "19.01.2026 (Bekanntmachungsdatum)\n\nNordrhein-Westfalen Amtsgericht Siegburg HRB 17724\nSonstige Registerbekanntmachung 19.01.2026 (Eintragungsdatum)\n\nSARSTEDT Sterilization Services GmbH\nGesellschaft mit beschränkter Haftung\nNümbrecht\n\nAls nicht eingetragen wird veröffentlicht: Den Gläubigern der Gesellschaft, deren Forderungen begründet worden sind bevor die Eintragung der Beendigung des Beherrschungs- und Gewinnabführungsvertrages  in das Handelsregister nach § 10 des Handelsgesetzbuches als bekanntgemacht gilt, hat der andere Vertragsteil Sicherheit zu leisten, wenn sie sich binnen sechs Monaten nach der Bekanntmachung der Eintragung zu diesem Zweck bei ihm melden."
    },
    {
      "date": "2026-01-19",
      "id": "142807",
      "original_text": "Einreichung neuer Dokumente\nNordrhein-Westfalen Amtsgericht Düsseldorf HRB 72979\nE.ON Energie AG – Düsseldorf",
      "type": "Einreichung neuer Dokumente",
      "state": "Nordrhein-Westfalen",
      "amtsgericht": "Amtsgericht Düsseldorf",
      "registernummer": "HRB 72979",
      "registerart": "HRB",
      "company_name": "E.ON Energie AG",
      "company_seat": "Düsseldorf",
      "details": "19.01.2026 (Bekanntmachungsdatum)\n\nNordrhein-Westfalen Amtsgericht Düsseldorf HRB 72979\nEinreichung neuer Dokumente\n\nE.ON Energie AG\nAktiengesellschaft\nDüsseldorf\n\nDem Registergericht ist eine Liste der Mitglieder des Aufsichtsrates eingereicht worden."
    },
    {
      "date": "2026-01-19",
      "id": "142808",
      "original_text": "Löschungsankündigung\nNordrhein-Westfalen Amtsgericht Gütersloh HRB 1354\nMETALLBAU-JORDAN Gesellschaft mit beschränkter Haftung – Harsewinkel",
      "type": "Löschungsankündigung",
      "state": "Nordrhein-Westfalen",
      "amtsgericht": "Amtsgericht Gütersloh",
      "registernummer": "HRB 1354",
      "registerart": "HRB",
      "company_name": "METALLBAU-JORDAN Gesellschaft mit beschränkter Haftung",
      "company_seat": "Harsewinkel",
      "details": "19.01.2026 (Bekanntmachungsdatum)\n\nNordrhein-Westfalen Amtsgericht Gütersloh HRB 1354\nLöschungsankündigung\n\nMETALLBAU-JORDAN Gesellschaft mit beschränkter Haftung\nGesellschaft mit beschränkter Haftung\nHarsewinkel\n\nDas Registergericht beabsichtigt die Gesellschaft von Amts wegen nach § 394 FamFG zu löschen. Die Frist zur Erhebung eines Widerspruchs ist auf einen Monat festgesetzt."
    },
    {
      "date": "2026-01-19",
      "id": "142809",
      "original_text": "Löschungsankündigung\nNordrhein-Westfalen Amtsgericht Düsseldorf HRB 89683\nI-smart world GmbH – Düsseldorf",
      "type": "Löschungsankündigung",
      "state": "Nordrhein-Westfalen",
      "amtsgericht": "Amtsgericht Düsseldorf",
      "registernummer": "HRB 89683",
      "registerart": "HRB",
      "company_name": "I-smart world GmbH",
      "company_seat": "Düsseldorf",
      "details": "19.01.2026 (Bekanntmachungsdatum)\n\nNordrhein-Westfalen Amtsgericht Düsseldorf HRB 89683\nLöschungsankündigung\n\nI-smart world GmbH\nGesellschaft mit beschränkter Haftung\nDüsseldorf\n\nDas Registergericht beabsichtigt die Gesellschaft von Amts wegen nach § 394 Abs. 1 FamFG zu löschen. Die Frist zur Erhebung eines Widerspruchs ist auf 3 Wochen festgesetzt.\n\nRechtsbehelfsbelehrung:\nDas Widerspruchsrecht steht jedem zu, der an der Unterlassung der Löschung ein berechtigtes Interesse hat. Der Widerspruch ist bei dem Amtsgericht Düsseldorf -Registergericht-, Werdener Straße 1, 40227 Düsseldorf schriftlich in deutscher Sprache oder zur Niederschrift der Geschäftsstelle einzulegen. Der Widerspruch kann auch zur Niederschrift der Geschäftsstelle eines jeden Amtsgerichtes abgegeben werden. Die Einlegung ist auch durch Übertragung eines elektronischen Dokuments an die elektronische Poststelle des Gerichts möglich. Das elektronische Dokument muss für die Bearbeitung durch das Gericht geeignet und mit einer qualifizierten elektronischen Signatur der verantwortenden Person versehen sein oder von der verantwortenden Person signiert und auf einem sicheren Übermittlungsweg gemäß § 130a ZPO nach näherer Maßgabe der Verordnung über die technischen Rahmenbedingungen des elektronischen Rechtsverkehrs und über das besondere elektronische Behördenpostfach (BGBl. I, S.3803) eingereicht werden. Weitere Informationen erhalten Sie auf der Internetseite www.justiz.de.\nDer Widerspruch muss spätestens innerhalb der gesetzten Frist nach dem Datum der Bekanntmachung der Löschungsankündigung bei dem Amtsgericht - Registergericht - Düsseldorf eingegangen sein.  Dies gilt auch dann, wenn der Widerspruch zur Niederschrift der Geschäftsstelle eines anderen Amtsgerichtes abgegeben wurde. Die Frist beginnt mit dem Tage der Bekanntmachung der Löschungsankündigung in dem für die Bekanntmachung der Eintragungen in das Handelsregister bestimmten elektronischen Informations- und Kommunikationssystem nach § 10 des Handelsgesetzbuches. Fällt das Ende der Frist auf einen Sonntag, einen allgemeinen Feiertag oder Sonnabend, so endet die Frist mit Ablauf des nächsten Werktages.\nDer Widerspruch muss die Bezeichnung der angefochtenen Löschungsankündigung sowie die Erklärung enthalten, dass Widerspruch gegen diese Löschungsankündigung eingelegt wird. Er ist zu unterzeichnen und soll begründet werden."
    },
    {
      "date": "2026-01-19",
      "id": "142810",
      "original_text": "Registerbekanntmachung nach dem Umwandlungsgesetz\nNordrhein-Westfalen Amtsgericht Essen HRA 11906\nSabrina Dudziak GmbH & Co. KG – Essen",
      "type": "Registerbekanntmachung nach dem Umwandlungsgesetz",
      "state": "Nordrhein-Westfalen",
      "amtsgericht": "Amtsgericht Essen",
      "registernummer": "HRA 11906",
      "registerart": "HRA",
      "company_name": "Sabrina Dudziak GmbH & Co. KG",
      "company_seat": "Essen",
      "details": "19.01.2026 (Bekanntmachungsdatum)\n\nNordrhein-Westfalen Amtsgericht Essen HRA 11906\nRegisterbekanntmachung nach dem Umwandlungsgesetz 19.01.2026 (Eintragungsdatum)\n\nSabrina Dudziak GmbH & Co. KG\nKommanditgesellschaft\nEssen\n\nDen Gläubigern der an der Ausgliederung beteiligten Rechtsträger ist, wenn sie binnen sechs Monaten nach dem Tag, an dem die Eintragung der Ausgliederung in das Register des Sitzes desjenigen Rechtsträgers, dessen Gläubiger sie sind, nach § 19 Absatz 3 UmwG als bekanntgemacht gilt, ihren Anspruch nach Grund und Höhe schriftlich anmelden, Sicherheit zu leisten, soweit sie nicht Befriedigung verlangen können. Dieses Recht steht den Gläubigern jedoch nur zu, wenn sie glaubhaft machen, dass durch die Ausgliederung die Erfüllung ihrer Forderung gefährdet wird."
    },
    {
      "date": "2026-01-19",
      "id": "142811",
      "original_text": "Einreichung neuer Dokumente\nNordrhein-Westfalen Amtsgericht Köln HRB 9048\nROLAND Schutzbrief-Versicherung AG – Leverkusen",
      "type": "Einreichung neuer Dokumente",
      "state": "Nordrhein-Westfalen",
      "amtsgericht": "Amtsgericht Köln",
      "registernummer": "HRB 9048",
      "registerart": "HRB",
      "company_name": "ROLAND Schutzbrief-Versicherung AG",
      "company_seat": "Leverkusen",
      "details": "19.01.2026 (Bekanntmachungsdatum)\n\nNordrhein-Westfalen Amtsgericht Köln HRB 9048\nEinreichung neuer Dokumente 19.01.2026 (Eintragungsdatum)\n\nROLAND Schutzbrief-Versicherung AG\nAktiengesellschaft\nLeverkusen\n\nDem Registergericht ist eine neue Liste der Mitglieder des Aufsichtsrates eingereicht worden."
    },
    {
      "date": "2026-01-19",
      "id": "142812",
      "original_text": "Registerbekanntmachung nach dem Umwandlungsgesetz\nNordrhein-Westfalen Amtsgericht Essen HRA 11506\nBezirksdirektion TEAM DUDZIAK e.K. – Essen",
      "type": "Registerbekanntmachung nach dem Umwandlungsgesetz",
      "state": "Nordrhein-Westfalen",
      "amtsgericht": "Amtsgericht Essen",
      "registernummer": "HRA 11506",
      "registerart": "HRA",
      "company_name": "Bezirksdirektion TEAM DUDZIAK e.K.",
      "company_seat": "Essen",
      "details": "19.01.2026 (Bekanntmachungsdatum)\n\nNordrhein-Westfalen Amtsgericht Essen HRA 11506\nRegisterbekanntmachung nach dem Umwandlungsgesetz 19.01.2026 (Eintragungsdatum)\n\nBezirksdirektion TEAM DUDZIAK e.K.\nEinzelkaufmann / Einzelkauffrau\nEssen\n\nDen Gläubigern der an der Ausgliederung beteiligten Rechtsträger ist, wenn sie binnen sechs Monaten nach dem Tag, an dem die Eintragung der Ausgliederung in das Register des Sitzes desjenigen Rechtsträgers, dessen Gläubiger sie sind, nach § 19 Absatz 3 UmwG als bekanntgemacht gilt, ihren Anspruch nach Grund und Höhe schriftlich anmelden, Sicherheit zu leisten, soweit sie nicht Befriedigung verlangen können. Dieses Recht steht den Gläubigern jedoch nur zu, wenn sie glaubhaft machen, dass durch die Ausgliederung die Erfüllung ihrer Forderung gefährdet wird."
    },
    {
      "date": "2026-01-19",
      "id": "142813",
      "original_text": "Registerbekanntmachung nach dem Umwandlungsgesetz\nNordrhein-Westfalen Amtsgericht Bielefeld HRB 45456\nOP Media Services UG (haftungsbeschränkt) – Bielefeld",
      "type": "Registerbekanntmachung nach dem Umwandlungsgesetz",
      "state": "Nordrhein-Westfalen",
      "amtsgericht": "Amtsgericht Bielefeld",
      "registernummer": "HRB 45456",
      "registerart": "HRB",
      "company_name": "OP Media Services UG (haftungsbeschränkt)",
      "company_seat": "Bielefeld",
      "details": "19.01.2026 (Bekanntmachungsdatum)\n\nNordrhein-Westfalen Amtsgericht Bielefeld HRB 45456\nRegisterbekanntmachung nach dem Umwandlungsgesetz 19.01.2026 (Eintragungsdatum)\n\nOP Media Services UG (haftungsbeschränkt)\nGesellschaft mit beschränkter Haftung\nBielefeld\n\nDen Gläubigern der an der Verschmelzung beteiligten Rechtsträger ist, wenn sie binnen sechs Monaten nach dem Tag, an dem die Eintragung der Verschmelzung in das Register des Sitzes desjenigen Rechtsträgers, dessen Gläubiger sie sind, nach § 19 Absatz 3 UmwG als bekanntgemacht gilt, ihren Anspruch nach Grund und Höhe schriftlich anmelden, Sicherheit zu leisten, soweit sie nicht Befriedigung verlangen können. Dieses Recht steht den Gläubigern jedoch nur zu, wenn sie glaubhaft machen, dass durch die Verschmelzung die Erfüllung ihrer Forderung gefährdet wird."
    },
    {
      "date": "2026-01-19",
      "id": "142814",
      "original_text": "Löschungsankündigung\nNordrhein-Westfalen Amtsgericht Düsseldorf HRB 74160\nRhein Medical Solutions UG (haftungsbeschränkt) – Düsseldorf",
      "type": "Löschungsankündigung",
      "state": "Nordrhein-Westfalen",
      "amtsgericht": "Amtsgericht Düsseldorf",
      "registernummer": "HRB 74160",
      "registerart": "HRB",
      "company_name": "Rhein Medical Solutions UG (haftungsbeschränkt)",
      "company_seat": "Düsseldorf",
      "details": "19.01.2026 (Bekanntmachungsdatum)\n\nNordrhein-Westfalen Amtsgericht Düsseldorf HRB 74160\nLöschungsankündigung\n\nRhein Medical Solutions UG (haftungsbeschränkt)\nGesellschaft mit beschränkter Haftung\nDüsseldorf\n\nDas Registergericht beabsichtigt die Gesellschaft von Amts wegen nach § 394 Abs. 1 FamFG zu löschen. Die Frist zur Erhebung eines Widerspruchs ist auf 3 Wochen festgesetzt.\n\nRechtsbehelfsbelehrung:\nDas Widerspruchsrecht steht jedem zu, der an der Unterlassung der Löschung ein berechtigtes Interesse hat. Der Widerspruch ist bei dem Amtsgericht Düsseldorf -Registergericht-, Werdener Straße 1, 40227 Düsseldorf schriftlich in deutscher Sprache oder zur Niederschrift der Geschäftsstelle einzulegen. Der Widerspruch kann auch zur Niederschrift der Geschäftsstelle eines jeden Amtsgerichtes abgegeben werden. Die Einlegung ist auch durch Übertragung eines elektronischen Dokuments an die elektronische Poststelle des Gerichts möglich. Das elektronische Dokument muss für die Bearbeitung durch das Gericht geeignet und mit einer qualifizierten elektronischen Signatur der verantwortenden Person versehen sein oder von der verantwortenden Person signiert und auf einem sicheren Übermittlungsweg gemäß § 130a ZPO nach näherer Maßgabe der Verordnung über die technischen Rahmenbedingungen des elektronischen Rechtsverkehrs und über das besondere elektronische Behördenpostfach (BGBl. I, S.3803) eingereicht werden. Weitere Informationen erhalten Sie auf der Internetseite www.justiz.de.\nDer Widerspruch muss spätestens innerhalb der gesetzten Frist nach dem Datum der Bekanntmachung der Löschungsankündigung bei dem Amtsgericht - Registergericht - Düsseldorf eingegangen sein.  Dies gilt auch dann, wenn der Widerspruch zur Niederschrift der Geschäftsstelle eines anderen Amtsgerichtes abgegeben wurde. Die Frist beginnt mit dem Tage der Bekanntmachung der Löschungsankündigung in dem für die Bekanntmachung der Eintragungen in das Handelsregister bestimmten elektronischen Informations- und Kommunikationssystem nach § 10 des Handelsgesetzbuches. Fällt das Ende der Frist auf einen Sonntag, einen allgemeinen Feiertag oder Sonnabend, so endet die Frist mit Ablauf des nächsten Werktages.\nDer Widerspruch muss die Bezeichnung der angefochtenen Löschungsankündigung sowie die Erklärung enthalten, dass Widerspruch gegen diese Löschungsankündigung eingelegt wird. Er ist zu unterzeichnen und soll begründet werden."
    },
    {
      "date": "2026-01-19",
      "id": "142815",
      "original_text": "Löschungsankündigung\nNordrhein-Westfalen Amtsgericht Düsseldorf HRB 74624\nIBB International Beauty Brands UG (haftungsbeschränkt) – Düsseldorf",
      "type": "Löschungsankündigung",
      "state": "Nordrhein-Westfalen",
      "amtsgericht": "Amtsgericht Düsseldorf",
      "registernummer": "HRB 74624",
      "registerart": "HRB",
      "company_name": "IBB International Beauty Brands UG (haftungsbeschränkt)",
      "company_seat": "Düsseldorf",
      "details": "19.01.2026 (Bekanntmachungsdatum)\n\nNordrhein-Westfalen Amtsgericht Düsseldorf HRB 74624\nLöschungsankündigung\n\nIBB International Beauty Brands UG (haftungsbeschränkt)\nGesellschaft mit beschränkter Haftung\nDüsseldorf\n\nDas Registergericht beabsichtigt die Gesellschaft von Amts wegen nach § 394 Abs. 1 FamFG zu löschen. Die Frist zur Erhebung eines Widerspruchs ist auf 3 Wochen festgesetzt.\n\nRechtsbehelfsbelehrung:\nDas Widerspruchsrecht steht jedem zu, der an der Unterlassung der Löschung ein berechtigtes Interesse hat. Der Widerspruch ist bei dem Amtsgericht Düsseldorf -Registergericht-, Werdener Straße 1, 40227 Düsseldorf schriftlich in deutscher Sprache oder zur Niederschrift der Geschäftsstelle einzulegen. Der Widerspruch kann auch zur Niederschrift der Geschäftsstelle eines jeden Amtsgerichtes abgegeben werden. Die Einlegung ist auch durch Übertragung eines elektronischen Dokuments an die elektronische Poststelle des Gerichts möglich. Das elektronische Dokument muss für die Bearbeitung durch das Gericht geeignet und mit einer qualifizierten elektronischen Signatur der verantwortenden Person versehen sein oder von der verantwortenden Person signiert und auf einem sicheren Übermittlungsweg gemäß § 130a ZPO nach näherer Maßgabe der Verordnung über die technischen Rahmenbedingungen des elektronischen Rechtsverkehrs und über das besondere elektronische Behördenpostfach (BGBl. I, S.3803) eingereicht werden. Weitere Informationen erhalten Sie auf der Internetseite www.justiz.de.\nDer Widerspruch muss spätestens innerhalb der gesetzten Frist nach dem Datum der Bekanntmachung der Löschungsankündigung bei dem Amtsgericht - Registergericht - Düsseldorf eingegangen sein.  Dies gilt auch dann, wenn der Widerspruch zur Niederschrift der Geschäftsstelle eines anderen Amtsgerichtes abgegeben wurde. Die Frist beginnt mit dem Tage der Bekanntmachung der Löschungsankündigung in dem für die Bekanntmachung der Eintragungen in das Handelsregister bestimmten elektronischen Informations- und Kommunikationssystem nach § 10 des Handelsgesetzbuches. Fällt das Ende der Frist auf einen Sonntag, einen allgemeinen Feiertag oder Sonnabend, so endet die Frist mit Ablauf des nächsten Werktages.\nDer Widerspruch muss die Bezeichnung der angefochtenen Löschungsankündigung sowie die Erklärung enthalten, dass Widerspruch gegen diese Löschungsankündigung eingelegt wird. Er ist zu unterzeichnen und soll begründet werden."
    },
    {
      "date": "2026-01-19",
      "id": "142816",
      "original_text": "Löschungsankündigung\nNordrhein-Westfalen Amtsgericht Mönchengladbach HRB 15852\nSTC-Management GmbH – Mönchengladbach",
      "type": "Löschungsankündigung",
      "state": "Nordrhein-Westfalen",
      "amtsgericht": "Amtsgericht Mönchengladbach",
      "registernummer": "HRB 15852",
      "registerart": "HRB",
      "company_name": "STC-Management GmbH",
      "company_seat": "Mönchengladbach",
      "details": "19.01.2026 (Bekanntmachungsdatum)\n\nNordrhein-Westfalen Amtsgericht Mönchengladbach HRB 15852\nLöschungsankündigung 19.01.2026 (Eintragungsdatum)\n\nSTC-Management GmbH\nGesellschaft mit beschränkter Haftung\nMönchengladbach\n\nDas Registergericht beabsichtigt die Gesellschaft von Amts wegen nach § 394 FamFG zu löschen. Die Frist zur Erhebung eines Widerspruchs ist auf #DV.Fr(Text=\"Bitte wählen Sie die Widerspruchsfrist aus!\",Eingabe=\"einen Monat\",\"zwei Monate\",\"drei Monate\",\"#insert(Text=\"Freitext\")\"|\"freier Text\") festgesetzt."
    },
    {
      "date": "2026-01-19",
      "id": "142817",
      "original_text": "Löschungsankündigung\nNordrhein-Westfalen Amtsgericht Köln HRB 94762\nCocotama Germany GmbH – Köln",
      "type": "Löschungsankündigung",
      "state": "Nordrhein-Westfalen",
      "amtsgericht": "Amtsgericht Köln",
      "registernummer": "HRB 94762",
      "registerart": "HRB",
      "company_name": "Cocotama Germany GmbH",
      "company_seat": "Köln",
      "details": "19.01.2026 (Bekanntmachungsdatum)\n\nNordrhein-Westfalen Amtsgericht Köln HRB 94762\nLöschungsankündigung\n\nCocotama Germany GmbH\nGesellschaft mit beschränkter Haftung\nKöln\n\nDas Registergericht beabsichtigt die Gesellschaft von Amts wegen nach § 394 FamFG zu löschen. Die Frist zur Erhebung eines Widerspruchs ist auf einen Monat festgesetzt."
    },
    {
      "date": "2026-01-19",
      "id": "142818",
      "original_text": "Registerbekanntmachung nach dem Umwandlungsgesetz\nNordrhein-Westfalen Amtsgericht Paderborn HRA 9087\ndSPACE Beta SE & Co. KG – Paderborn",
      "type": "Registerbekanntmachung nach dem Umwandlungsgesetz",
      "state": "Nordrhein-Westfalen",
      "amtsgericht": "Amtsgericht Paderborn",
      "registernummer": "HRA 9087",
      "registerart": "HRA",
      "company_name": "dSPACE Beta SE & Co. KG",
      "company_seat": "Paderborn",
      "details": "19.01.2026 (Bekanntmachungsdatum)\n\nNordrhein-Westfalen Amtsgericht Paderborn HRA 9087\nRegisterbekanntmachung nach dem Umwandlungsgesetz 19.01.2026 (Eintragungsdatum)\n\ndSPACE Beta SE & Co. KG\nKommanditgesellschaft\nPaderborn\n\nDen Gläubigern der an der formwechselnden Umwandlung beteiligten Rechtsträger ist, wenn sie binnen sechs Monaten nach dem Tag, an dem die Eintragung der formwechselnden Umwandlung in das Register des Sitzes desjenigen Rechtsträgers, dessen Gläubiger sie sind, nach § 19 Absatz 3 UmwG als bekanntgemacht gilt, ihren Anspruch nach Grund und Höhe schriftlich anmelden, Sicherheit zu leisten, soweit sie nicht Befriedigung verlangen können. Dieses Recht steht den Gläubigern jedoch nur zu, wenn sie glaubhaft machen, dass durch die formwechselnden Umwandlung die Erfüllung ihrer Forderung gefährdet wird."
    },
    {
      "date": "2026-01-19",
      "id": "142819",
      "original_text": "Sonstige Registerbekanntmachung\nNordrhein-Westfalen Amtsgericht Mönchengladbach HRB 17332\nAmazon Logistik Moenchengladbach GmbH – Mönchengladbach",
      "type": "Sonstige Registerbekanntmachung",
      "state": "Nordrhein-Westfalen",
      "amtsgericht": "Amtsgericht Mönchengladbach",
      "registernummer": "HRB 17332",
      "registerart": "HRB",
      "company_name": "Amazon Logistik Moenchengladbach GmbH",
      "company_seat": "Mönchengladbach",
      "details": "19.01.2026 (Bekanntmachungsdatum)\n\nNordrhein-Westfalen Amtsgericht Mönchengladbach HRB 17332\nSonstige Registerbekanntmachung 19.01.2026 (Eintragungsdatum)\n\nAmazon Logistik Moenchengladbach GmbH\nGesellschaft mit beschränkter Haftung\nMönchengladbach\n\nDem Registergericht ist eine Liste der Mitglieder des Aufsichtsrates eingereicht worden."
    },
    {
      "date": "2026-01-19",
      "id": "142820",
      "original_text": "Löschungsankündigung\nNordrhein-Westfalen Amtsgericht Düsseldorf HRB 86856\nSHV GmbH – Düsseldorf",
      "type": "Löschungsankündigung",
      "state": "Nordrhein-Westfalen",
      "amtsgericht": "Amtsgericht Düsseldorf",
      "registernummer": "HRB 86856",
      "registerart": "HRB",
      "company_name": "SHV GmbH",
      "company_seat": "Düsseldorf",
      "details": "19.01.2026 (Bekanntmachungsdatum)\n\nNordrhein-Westfalen Amtsgericht Düsseldorf HRB 86856\nLöschungsankündigung\n\nSHV GmbH\nGesellschaft mit beschränkter Haftung\nDüsseldorf\n\nDas Registergericht beabsichtigt die Gesellschaft von Amts wegen nach § 394 Abs. 1 FamFG zu löschen. Die Frist zur Erhebung eines Widerspruchs ist auf einen Monat festgesetzt.\n\nRechtsbehelfsbelehrung:\nDas Widerspruchsrecht steht jedem zu, der an der Unterlassung der Löschung ein berechtigtes Interesse hat. Der Widerspruch ist bei dem Amtsgericht Düsseldorf -Registergericht-, Werdener Straße 1, 40227 Düsseldorf schriftlich in deutscher Sprache oder zur Niederschrift der Geschäftsstelle einzulegen. Der Widerspruch kann auch zur Niederschrift der Geschäftsstelle eines jeden Amtsgerichtes abgegeben werden. Die Einlegung ist auch durch Übertragung eines elektronischen Dokuments an die elektronische Poststelle des Gerichts möglich. Das elektronische Dokument muss für die Bearbeitung durch das Gericht geeignet und mit einer qualifizierten elektronischen Signatur der verantwortenden Person versehen sein oder von der verantwortenden Person signiert und auf einem sicheren Übermittlungsweg gemäß § 130a ZPO nach näherer Maßgabe der Verordnung über die technischen Rahmenbedingungen des elektronischen Rechtsverkehrs und über das besondere elektronische Behördenpostfach (BGBl. I, S.3803) eingereicht werden. Weitere Informationen erhalten Sie auf der Internetseite www.justiz.de.\nDer Widerspruch muss spätestens innerhalb der gesetzten Frist nach dem Datum der Bekanntmachung der Löschungsankündigung bei dem Amtsgericht - Registergericht - Düsseldorf eingegangen sein.  Dies gilt auch dann, wenn der Widerspruch zur Niederschrift der Geschäftsstelle eines anderen Amtsgerichtes abgegeben wurde. Die Frist beginnt mit dem Tage der Bekanntmachung der Löschungsankündigung in dem für die Bekanntmachung der Eintragungen in das Handelsregister bestimmten elektronischen Informations- und Kommunikationssystem nach § 10 des Handelsgesetzbuches. Fällt das Ende der Frist auf einen Sonntag, einen allgemeinen Feiertag oder Sonnabend, so endet die Frist mit Ablauf des nächsten Werktages.\nDer Widerspruch muss die Bezeichnung der angefochtenen Löschungsankündigung sowie die Erklärung enthalten, dass Widerspruch gegen diese Löschungsankündigung eingelegt wird. Er ist zu unterzeichnen und soll begründet werden."
    },
    {
      "date": "2026-01-19",
      "id": "142821",
      "original_text": "Löschungsankündigung\nThüringen Amtsgericht Jena HRB 513896\nSPI Stabil Pflege Immobilienges. mbH. – Artern",
      "type": "Löschungsankündigung",
      "state": "Thüringen",
      "amtsgericht": "Amtsgericht Jena",
      "registernummer": "HRB 513896",
      "registerart": "HRB",
      "company_name": "SPI Stabil Pflege Immobilienges. mbH.",
      "company_seat": "Artern",
      "details": "19.01.2026 (Bekanntmachungsdatum)\n\nThüringen Amtsgericht Jena HRB 513896\nLöschungsankündigung\n\nSPI Stabil Pflege Immobilienges. mbH.\nGesellschaft mit beschränkter Haftung\nArtern\n\nDas Registergericht beabsichtigt, die im Handelsregister eingetragene Gesellschaft wegen Vermögenslosigkeit nach § 394 FamFG von Amts wegen zu löschen. Die Frist zur Erhebung eines Widerspruchs gegen die beabsichtigte Löschung wird auf 6 Wochen festgesetzt."
    },
    {
      "date": "2026-01-19",
      "id": "142822",
      "original_text": "Löschungsankündigung\nHessen Amtsgericht Wiesbaden HRB 31022\nModcon GmbH – Wiesbaden",
      "type": "Löschungsankündigung",
      "state": "Hessen",
      "amtsgericht": "Amtsgericht Wiesbaden",
      "registernummer": "HRB 31022",
      "registerart": "HRB",
      "company_name": "Modcon GmbH",
      "company_seat": "Wiesbaden",
      "details": "19.01.2026 (Bekanntmachungsdatum)\n\nHessen Amtsgericht Wiesbaden HRB 31022\nLöschungsankündigung\n\nModcon GmbH\nGesellschaft mit beschränkter Haftung\nWiesbaden\n\nDas Registergericht beabsichtigt die im Handelsregister eingetragene Gesellschaft von Amts wegen nach § 394 FamFG zu löschen. Die Frist zur Erhebung eines Widerspruchs gegen die beabsichtigte Löschung wird auf 3 Monate festgesetzt."
    },
    {
      "date": "2026-01-19",
      "id": "142823",
      "original_text": "Löschungsankündigung\nHessen Amtsgericht Fulda HRB 8157\nSMG Royal Holding GmbH – Fulda",
      "type": "Löschungsankündigung",
      "state": "Hessen",
      "amtsgericht": "Amtsgericht Fulda",
      "registernummer": "HRB 8157",
      "registerart": "HRB",
      "company_name": "SMG Royal Holding GmbH",
      "company_seat": "Fulda",
      "details": "19.01.2026 (Bekanntmachungsdatum)\n\nHessen Amtsgericht Fulda HRB 8157\nLöschungsankündigung\n\nSMG Royal Holding GmbH\nGesellschaft mit beschränkter Haftung\nFulda\n\nDas Registergericht beabsichtigt die im Handelsregister eingetragene Gesellschaft von Amts wegen nach § 394 FamFG zu löschen. Die Frist zur Erhebung eines Widerspruchs gegen die beabsichtigte Löschung wird auf 3 Monate festgesetzt."
    },
    {
      "date": "2026-01-19",
      "id": "142824",
      "original_text": "Registerbekanntmachung nach dem Umwandlungsgesetz\nHessen Amtsgericht Frankfurt am Main HRB 102031\nPolly Anton GmbH – Frankfurt am Main",
      "type": "Registerbekanntmachung nach dem Umwandlungsgesetz",
      "state": "Hessen",
      "amtsgericht": "Amtsgericht Frankfurt am Main",
      "registernummer": "HRB 102031",
      "registerart": "HRB",
      "company_name": "Polly Anton GmbH",
      "company_seat": "Frankfurt am Main",
      "details": "19.01.2026 (Bekanntmachungsdatum)\n\nHessen Amtsgericht Frankfurt am Main HRB 102031\nRegisterbekanntmachung nach dem Umwandlungsgesetz 19.01.2026 (Eintragungsdatum)\n\nPolly Anton GmbH\nGesellschaft mit beschränkter Haftung\nFrankfurt am Main\n\nDen Gläubigern der an der grenzüberschreitenden Verschmelzung beteiligten übernehmenden Rechtsträger ist, wenn sie binnen sechs Monaten nach dem Tag, an dem die Eintragung der Verschmelzung in das Register des Sitzes desjenigen Rechtsträgers, dessen Gläubiger sie sind, nach § 19 Absatz 3 UmwG als bekanntgemacht gilt, ihren Anspruch nach Grund und Höhe schriftlich anmelden, Sicherheit zu leisten, soweit sie nicht Befriedigung verlangen können.\n\nDieses Recht steht den Gläubigern jedoch nur zu, wenn sie glaubhaft machen, dass durch die Verschmelzung die Erfüllung ihrer Forderung gefährdet wird."
    },
    {
      "date": "2026-01-19",
      "id": "142825",
      "original_text": "Registerbekanntmachung nach dem Umwandlungsgesetz\nHessen Amtsgericht Wiesbaden HRB 36381\nConcept Sanierung Maurer GmbH – Walluf",
      "type": "Registerbekanntmachung nach dem Umwandlungsgesetz",
      "state": "Hessen",
      "amtsgericht": "Amtsgericht Wiesbaden",
      "registernummer": "HRB 36381",
      "registerart": "HRB",
      "company_name": "Concept Sanierung Maurer GmbH",
      "company_seat": "Walluf",
      "details": "19.01.2026 (Bekanntmachungsdatum)\n\nHessen Amtsgericht Wiesbaden HRB 36381\nRegisterbekanntmachung nach dem Umwandlungsgesetz 19.01.2026 (Eintragungsdatum)\n\nConcept Sanierung Maurer GmbH\nGesellschaft mit beschränkter Haftung\nWalluf\n\nDen Gläubigern der an der Ausgliederung beteiligten Rechtsträger ist, wenn sie binnen sechs Monaten nach dem Tag, an dem die Eintragung der Ausgliederung in das Register des Sitzes derjenigen Rechtsträger deren Gläubiger sie sind, nach §§ 125, 19 Absatz 3 UmwG bekannt gemacht worden ist, ihren Anspruch nach Grund und Höhe schriftlich anmelden, Sicherheit zu leisten, soweit sie nicht Befriedigung verlangen können. Dieses Recht steht den Gläubigern jedoch nur zu, wenn sie glaubhaft machen, dass durch die Ausgliederung die Erfüllung ihrer Forderung gefährdet wird."
    },
    {
      "date": "2026-01-19",
      "id": "142826",
      "original_text": "Löschungsankündigung\nHessen Amtsgericht Wiesbaden HRB 29558\nSunhill Cosmetics GmbH – Wiesbaden",
      "type": "Löschungsankündigung",
      "state": "Hessen",
      "amtsgericht": "Amtsgericht Wiesbaden",
      "registernummer": "HRB 29558",
      "registerart": "HRB",
      "company_name": "Sunhill Cosmetics GmbH",
      "company_seat": "Wiesbaden",
      "details": "19.01.2026 (Bekanntmachungsdatum)\n\nHessen Amtsgericht Wiesbaden HRB 29558\nLöschungsankündigung\n\nSunhill Cosmetics GmbH\nGesellschaft mit beschränkter Haftung\nWiesbaden\n\nDas Registergericht beabsichtigt die im Handelsregister eingetragene Gesellschaft von Amts wegen nach § 394 FamFG zu löschen. Die Frist zur Erhebung eines Widerspruchs gegen die beabsichtigte Löschung wird auf 3 Monate festgesetzt."
    },
    {
      "date": "2026-01-19",
      "id": "142827",
      "original_text": "Sonstige Registerbekanntmachung\nHessen Amtsgericht Offenbach am Main HRB 43585\nDuPont de Nemours (Deutschland) GmbH – Neu-Isenburg",
      "type": "Sonstige Registerbekanntmachung",
      "state": "Hessen",
      "amtsgericht": "Amtsgericht Offenbach am Main",
      "registernummer": "HRB 43585",
      "registerart": "HRB",
      "company_name": "DuPont de Nemours (Deutschland) GmbH",
      "company_seat": "Neu-Isenburg",
      "details": "19.01.2026 (Bekanntmachungsdatum)\n\nHessen Amtsgericht Offenbach am Main HRB 43585\nSonstige Registerbekanntmachung 19.01.2026 (Eintragungsdatum)\n\nDuPont de Nemours (Deutschland) GmbH\nGesellschaft mit beschränkter Haftung\nNeu-Isenburg\n\nDer Aufsichtsrat ist gemäß § 52 Abs. 3 Satz 2 GmbHG entfallen, da die gesetzlichen Voraussetzungen für seine Bildung nicht mehr vorliegen."
    },
    {
      "date": "2026-01-19",
      "id": "142828",
      "original_text": "Registerbekanntmachung nach dem Umwandlungsgesetz\nHessen Amtsgericht Königstein HRB 11757\nTurkovic Bau GmbH – Kelkheim (Taunus)",
      "type": "Registerbekanntmachung nach dem Umwandlungsgesetz",
      "state": "Hessen",
      "amtsgericht": "Amtsgericht Königstein",
      "registernummer": "HRB 11757",
      "registerart": "HRB",
      "company_name": "Turkovic Bau GmbH",
      "company_seat": "Kelkheim (Taunus)",
      "details": "19.01.2026 (Bekanntmachungsdatum)\n\nHessen Amtsgericht Königstein HRB 11757\nRegisterbekanntmachung nach dem Umwandlungsgesetz 19.01.2026 (Eintragungsdatum)\n\nTurkovic Bau GmbH\nGesellschaft mit beschränkter Haftung\nKelkheim (Taunus)\n\nDen Gläubigern der an der Ausgliederung beteiligten Rechtsträger ist, wenn sie binnen sechs Monaten nach dem Tag, an dem die Eintragung der Ausgliederung in das Register des Sitzes desjenigen Rechtsträgers, dessen Gläubiger sie sind, nach §§ 125, 19 Absatz 3 UmwG bekannt gemacht worden ist, ihren Anspruch nach Grund und Höhe schriftlich anmelden, Sicherheit zu leisten, soweit sie nicht Befriedigung verlangen können. Dieses Recht steht den Gläubigern jedoch nur zu, wenn sie glaubhaft machen, dass durch die Ausgliederung die Erfüllung ihrer Forderung gefährdet wird."
    },
    {
      "date": "2026-01-19",
      "id": "142829",
      "original_text": "Löschungsankündigung\nHessen Amtsgericht Frankfurt am Main HRB 134091\nHabsburgring 24 1. Vermögensverwaltungsgesellschaft mbH – Frankfurt am Main",
      "type": "Löschungsankündigung",
      "state": "Hessen",
      "amtsgericht": "Amtsgericht Frankfurt am Main",
      "registernummer": "HRB 134091",
      "registerart": "HRB",
      "company_name": "Habsburgring 24 1. Vermögensverwaltungsgesellschaft mbH",
      "company_seat": "Frankfurt am Main",
      "details": "19.01.2026 (Bekanntmachungsdatum)\n\nHessen Amtsgericht Frankfurt am Main HRB 134091\nLöschungsankündigung 19.01.2026 (Eintragungsdatum)\n\nHabsburgring 24 1. Vermögensverwaltungsgesellschaft mbH\nGesellschaft mit beschränkter Haftung\nFrankfurt am Main\n\nEs ist beabsichtigt, die Gesellschaft wegen Vermögenslosigkeit gemäß § 394 FamFG von Amts wegen im Handelsregister zu löschen.\n\nHiergegen kann binnen 1 Monats Widerspruch beim Amtsgericht Frankfurt am Main eingelegt werden."
    },
    {
      "date": "2026-01-19",
      "id": "142830",
      "original_text": "Löschungsankündigung\nHessen Amtsgericht Fulda HRB 7094\nHOWA Management GmbH – Gersfeld (Rhön)",
      "type": "Löschungsankündigung",
      "state": "Hessen",
      "amtsgericht": "Amtsgericht Fulda",
      "registernummer": "HRB 7094",
      "registerart": "HRB",
      "company_name": "HOWA Management GmbH",
      "company_seat": "Gersfeld (Rhön)",
      "details": "19.01.2026 (Bekanntmachungsdatum)\n\nHessen Amtsgericht Fulda HRB 7094\nLöschungsankündigung\n\nHOWA Management GmbH\nGesellschaft mit beschränkter Haftung\nGersfeld (Rhön)\n\nDas Registergericht beabsichtigt die im Handelsregister eingetragene Gesellschaft von Amts wegen nach § 394 FamFG zu löschen. Die Frist zur Erhebung eines Widerspruchs gegen die beabsichtigte Löschung wird auf 2 Monate festgesetzt."
    },
    {
      "date": "2026-01-19",
      "id": "142831",
      "original_text": "Löschungsankündigung\nHessen Amtsgericht Darmstadt HRA 86874\nKornmühle Tim Zimdahl e.K. – Darmstadt",
      "type": "Löschungsankündigung",
      "state": "Hessen",
      "amtsgericht": "Amtsgericht Darmstadt",
      "registernummer": "HRA 86874",
      "registerart": "HRA",
      "company_name": "Kornmühle Tim Zimdahl e.K.",
      "company_seat": "Darmstadt",
      "details": "19.01.2026 (Bekanntmachungsdatum)\n\nHessen Amtsgericht Darmstadt HRA 86874\nLöschungsankündigung 19.01.2026 (Eintragungsdatum)\n\nKornmühle Tim Zimdahl e.K.\nEinzelkaufmann / Einzelkauffrau\nDarmstadt\n\n#insert(Text=\"Löschungsankündigung_HRA\")#insert(Text=\"Hinweis_EA_VoE\")#insert(Text=\"Hinweis_EA_VoE\")"
    },
    {
      "date": "2026-01-19",
      "id": "142832",
      "original_text": "Löschungsankündigung\nHessen Amtsgericht Darmstadt HRA 86874\nKornmühle Tim Zimdahl e.K. – Darmstadt",
      "type": "Löschungsankündigung",
      "state": "Hessen",
      "amtsgericht": "Amtsgericht Darmstadt",
      "registernummer": "HRA 86874",
      "registerart": "HRA",
      "company_name": "Kornmühle Tim Zimdahl e.K.",
      "company_seat": "Darmstadt",
      "details": "19.01.2026 (Bekanntmachungsdatum)\n\nHessen Amtsgericht Darmstadt HRA 86874\nLöschungsankündigung 19.01.2026 (Eintragungsdatum)\n\nKornmühle Tim Zimdahl e.K.\nEinzelkaufmann / Einzelkauffrau\nDarmstadt\n\nHRA 86874:\nKornmühle Tim Zimdahl e.K.,\nDarmstadt\n,\nHeidelberger Landstraße 186 b\n,\n64297 Darmstadt. Die Firma ist erloschen."
    },
    {
      "date": "2026-01-19",
      "id": "142833",
      "original_text": "Registerbekanntmachung nach dem Umwandlungsgesetz\nHessen Amtsgericht Königstein HRA 4217\nSuad Turkovic e.K. – Kelkheim (Taunus)",
      "type": "Registerbekanntmachung nach dem Umwandlungsgesetz",
      "state": "Hessen",
      "amtsgericht": "Amtsgericht Königstein",
      "registernummer": "HRA 4217",
      "registerart": "HRA",
      "company_name": "Suad Turkovic e.K.",
      "company_seat": "Kelkheim (Taunus)",
      "details": "19.01.2026 (Bekanntmachungsdatum)\n\nHessen Amtsgericht Königstein HRA 4217\nRegisterbekanntmachung nach dem Umwandlungsgesetz 19.01.2026 (Eintragungsdatum)\n\nSuad Turkovic e.K.\nEinzelkaufmann / Einzelkauffrau\nKelkheim (Taunus)\n\nDen Gläubigern der an der Ausgliederung beteiligten Rechtsträger ist, wenn sie binnen sechs Monaten nach dem Tag, an dem die Eintragung der Ausgliederung in das Register des Sitzes desjenigen Rechtsträgers, dessen Gläubiger sie sind, nach §§ 125, 19 Absatz 3 UmwG bekannt gemacht worden ist, ihren Anspruch nach Grund und Höhe schriftlich anmelden, Sicherheit zu leisten, soweit sie nicht Befriedigung verlangen können. Dieses Recht steht den Gläubigern jedoch nur zu, wenn sie glaubhaft machen, dass durch die Ausgliederung die Erfüllung ihrer Forderung gefährdet wird."
    },
    {
      "date": "2026-01-19",
      "id": "142834",
      "original_text": "Einreichung neuer Dokumente\nHessen Amtsgericht Frankfurt am Main HRB 25668\nDWS Grundbesitz GmbH – Frankfurt am Main",
      "type": "Einreichung neuer Dokumente",
      "state": "Hessen",
      "amtsgericht": "Amtsgericht Frankfurt am Main",
      "registernummer": "HRB 25668",
      "registerart": "HRB",
      "company_name": "DWS Grundbesitz GmbH",
      "company_seat": "Frankfurt am Main",
      "details": "19.01.2026 (Bekanntmachungsdatum)\n\nHessen Amtsgericht Frankfurt am Main HRB 25668\nEinreichung neuer Dokumente\n\nDWS Grundbesitz GmbH\nGesellschaft mit beschränkter Haftung\nFrankfurt am Main\n\nDurch eine Änderung in den Personen der Aufsichtsratsmitglieder ist eine Liste der Mitglieder des Aufsichtsrates zum Handelsregister eingereicht worden."
    },
    {
      "date": "2026-01-19",
      "id": "142835",
      "original_text": "Löschungsankündigung\nHessen Amtsgericht Wiesbaden HRB 31081\nverify-u GmbH – Wiesbaden",
      "type": "Löschungsankündigung",
      "state": "Hessen",
      "amtsgericht": "Amtsgericht Wiesbaden",
      "registernummer": "HRB 31081",
      "registerart": "HRB",
      "company_name": "verify-u GmbH",
      "company_seat": "Wiesbaden",
      "details": "19.01.2026 (Bekanntmachungsdatum)\n\nHessen Amtsgericht Wiesbaden HRB 31081\nLöschungsankündigung\n\nverify-u GmbH\nGesellschaft mit beschränkter Haftung\nWiesbaden\n\nDas Registergericht beabsichtigt die im Handelsregister eingetragene Gesellschaft von Amts wegen nach § 394 FamFG zu löschen. Die Frist zur Erhebung eines Widerspruchs gegen die beabsichtigte Löschung wird auf 3 Monate festgesetzt."
    },
    {
      "date": "2026-01-19",
      "id": "142836",
      "original_text": "Löschungsankündigung\nHessen Amtsgericht Darmstadt HRA 85584\nfahrenheit e. K. – Erbach",
      "type": "Löschungsankündigung",
      "state": "Hessen",
      "amtsgericht": "Amtsgericht Darmstadt",
      "registernummer": "HRA 85584",
      "registerart": "HRA",
      "company_name": "fahrenheit e. K.",
      "company_seat": "Erbach",
      "details": "19.01.2026 (Bekanntmachungsdatum)\n\nHessen Amtsgericht Darmstadt HRA 85584\nLöschungsankündigung 19.01.2026 (Eintragungsdatum)\n\nfahrenheit e. K.\nEinzelkaufmann / Einzelkauffrau\nErbach\n\nHRA 85584:\nfahrenheit e.K.,\nErbach\n,\nIn den Steingärten 28,\n\n64711 Erbach.\n\nDie Firma ist erloschen."
    },
    {
      "date": "2026-01-19",
      "id": "142837",
      "original_text": "Löschungsankündigung\nHessen Amtsgericht Wiesbaden HRB 24879\nTALER PROJEKT MANAGEMENT Limited – Wiesbaden",
      "type": "Löschungsankündigung",
      "state": "Hessen",
      "amtsgericht": "Amtsgericht Wiesbaden",
      "registernummer": "HRB 24879",
      "registerart": "HRB",
      "company_name": "TALER PROJEKT MANAGEMENT Limited",
      "company_seat": "Wiesbaden",
      "details": "19.01.2026 (Bekanntmachungsdatum)\n\nHessen Amtsgericht Wiesbaden HRB 24879\nLöschungsankündigung\n\nTALER PROJEKT MANAGEMENT Limited\nRechtsform ausländischen Rechts HRB\nWiesbaden\n\nDas Registergericht beabsichtigt die im Handelsregister eingetragene Gesellschaft von Amts wegen nach § 394 FamFG zu löschen. Die Frist zur Erhebung eines Widerspruchs gegen die beabsichtigte Löschung wird auf 3 Monate festgesetzt."
    },
    {
      "date": "2026-01-19",
      "id": "142838",
      "original_text": "Löschungsankündigung\nHessen Amtsgericht Frankfurt am Main HRB 107768\nNsafe GmbH – Eschborn",
      "type": "Löschungsankündigung",
      "state": "Hessen",
      "amtsgericht": "Amtsgericht Frankfurt am Main",
      "registernummer": "HRB 107768",
      "registerart": "HRB",
      "company_name": "Nsafe GmbH",
      "company_seat": "Eschborn",
      "details": "19.01.2026 (Bekanntmachungsdatum)\n\nHessen Amtsgericht Frankfurt am Main HRB 107768\nLöschungsankündigung\n\nNsafe GmbH\nGesellschaft mit beschränkter Haftung\nEschborn\n\nDas Registergericht beabsichtigt die im Handelsregister eingetragene Gesellschaft von Amts wegen nach § 394 FamFG zu löschen. Die Frist zur Erhebung eines Widerspruchs gegen die beabsichtigte Löschung wird auf 1 Monate festgesetzt."
    },
    {
      "date": "2026-01-19",
      "id": "142839",
      "original_text": "Sonstige Registerbekanntmachung\nHessen Amtsgericht Hanau HRB 94916\nVirion medizinische und pharmazeutische Handelsgesellschaft mbH – Hanau",
      "type": "Sonstige Registerbekanntmachung",
      "state": "Hessen",
      "amtsgericht": "Amtsgericht Hanau",
      "registernummer": "HRB 94916",
      "registerart": "HRB",
      "company_name": "Virion medizinische und pharmazeutische Handelsgesellschaft mbH",
      "company_seat": "Hanau",
      "details": "19.01.2026 (Bekanntmachungsdatum)\n\nHessen Amtsgericht Hanau HRB 94916\nSonstige Registerbekanntmachung 19.01.2026 (Eintragungsdatum)\n\nVirion medizinische und pharmazeutische Handelsgesellschaft mbH\nGesellschaft mit beschränkter Haftung\nHanau\n\nDen Gläubigern der Gesellschaft, deren Forderungen begründet worden sind, bevor die Eintragung der Beendigung des Vertrags in das Handelsregister nach § 10 HGB bekannt gemacht worden ist, ist vom anderen Vertragsteil Sicherheit zu leisten, wenn sie sich binnen sechs Monaten nach dieser Bekanntmachung zu diesem Zweck bei ihm melden."
    },
    {
      "date": "2026-01-19",
      "id": "142840",
      "original_text": "Registerbekanntmachung nach dem Umwandlungsgesetz\nHessen Amtsgericht Wiesbaden HRB 36307\nConcept Sanierung BWS GmbH – Walluf",
      "type": "Registerbekanntmachung nach dem Umwandlungsgesetz",
      "state": "Hessen",
      "amtsgericht": "Amtsgericht Wiesbaden",
      "registernummer": "HRB 36307",
      "registerart": "HRB",
      "company_name": "Concept Sanierung BWS GmbH",
      "company_seat": "Walluf",
      "details": "19.01.2026 (Bekanntmachungsdatum)\n\nHessen Amtsgericht Wiesbaden HRB 36307\nRegisterbekanntmachung nach dem Umwandlungsgesetz 19.01.2026 (Eintragungsdatum)\n\nConcept Sanierung BWS GmbH\nGesellschaft mit beschränkter Haftung\nWalluf\n\nDen Gläubigern der an der Ausgliederung beteiligten Rechtsträger ist, wenn sie binnen sechs Monaten nach dem Tag, an dem die Eintragung der Ausgliederung in das Register des Sitzes derjenigen Rechtsträger deren Gläubiger sie sind, nach §§ 125, 19 Absatz 3 UmwG bekannt gemacht worden ist, ihren Anspruch nach Grund und Höhe schriftlich anmelden, Sicherheit zu leisten, soweit sie nicht Befriedigung verlangen können. Dieses Recht steht den Gläubigern jedoch nur zu, wenn sie glaubhaft machen, dass durch die Ausgliederung die Erfüllung ihrer Forderung gefährdet wird."
    },
    {
      "date": "2026-01-19",
      "id": "142841",
      "original_text": "Einreichung neuer Dokumente\nHessen Amtsgericht Frankfurt am Main HRB 104067\nAeronics Neura System Aktiengesellschaft – Frankfurt am Main",
      "type": "Einreichung neuer Dokumente",
      "state": "Hessen",
      "amtsgericht": "Amtsgericht Frankfurt am Main",
      "registernummer": "HRB 104067",
      "registerart": "HRB",
      "company_name": "Aeronics Neura System Aktiengesellschaft",
      "company_seat": "Frankfurt am Main",
      "details": "19.01.2026 (Bekanntmachungsdatum)\n\nHessen Amtsgericht Frankfurt am Main HRB 104067\nEinreichung neuer Dokumente 19.01.2026 (Eintragungsdatum)\n\nAeronics Neura System Aktiengesellschaft\nAktiengesellschaft\nFrankfurt am Main\n\nDurch eine Änderung in den Personen der Aufsichtsratsmitglieder ist eine Liste der Mitglieder des Aufsichtsrates zum Handelsregister eingereicht worden."
    },
    {
      "date": "2026-01-19",
      "id": "142842",
      "original_text": "Einreichung neuer Dokumente\nHessen Amtsgericht Frankfurt am Main HRB 7173\nMainova Aktiengesellschaft – Frankfurt am Main",
      "type": "Einreichung neuer Dokumente",
      "state": "Hessen",
      "amtsgericht": "Amtsgericht Frankfurt am Main",
      "registernummer": "HRB 7173",
      "registerart": "HRB",
      "company_name": "Mainova Aktiengesellschaft",
      "company_seat": "Frankfurt am Main",
      "details": "19.01.2026 (Bekanntmachungsdatum)\n\nHessen Amtsgericht Frankfurt am Main HRB 7173\nEinreichung neuer Dokumente\n\nMainova Aktiengesellschaft\nAktiengesellschaft\nFrankfurt am Main\n\nDurch eine Änderung in den Personen der Aufsichtsratsmitglieder ist eine Liste der Mitglieder des Aufsichtsrates zum Handelsregister eingereicht worden."
    },
    {
      "date": "2026-01-19",
      "id": "142843",
      "original_text": "Löschungsankündigung\nHessen Amtsgericht Darmstadt HRB 96431\nBlanc Noir UG (haftungsbeschränkt) – Darmstadt",
      "type": "Löschungsankündigung",
      "state": "Hessen",
      "amtsgericht": "Amtsgericht Darmstadt",
      "registernummer": "HRB 96431",
      "registerart": "HRB",
      "company_name": "Blanc Noir UG (haftungsbeschränkt)",
      "company_seat": "Darmstadt",
      "details": "19.01.2026 (Bekanntmachungsdatum)\n\nHessen Amtsgericht Darmstadt HRB 96431\nLöschungsankündigung\n\nBlanc Noir UG (haftungsbeschränkt)\nGesellschaft mit beschränkter Haftung\nDarmstadt\n\nDas Registergericht beabsichtigt die im Handelsregister eingetragene Gesellschaft von Amts wegen nach § 394 FamFG zu löschen. Die Frist zur Erhebung eines Widerspruchs gegen die beabsichtigte Löschung wird auf 3 Monate festgesetzt."
    }
  ]
}