{
  "date": "2026-01-07",
  "date_of_scrape": "2026-01-08T04:22:19.204Z",
  "tool_version": "0.2.0",
  "number_of_announcements": 99,
  "announcements": [
    {
      "date": "2026-01-07",
      "id": "141685",
      "original_text": "Registerbekanntmachung nach dem Umwandlungsgesetz\nBayern Amtsgericht München HRB 299804\nBlitz 25-903 GmbH – München",
      "type": "Registerbekanntmachung nach dem Umwandlungsgesetz",
      "state": "Bayern",
      "amtsgericht": "Amtsgericht München",
      "registernummer": "HRB 299804",
      "registerart": "HRB",
      "company_name": "Blitz 25-903 GmbH",
      "company_seat": "München",
      "details": "07.01.2026 (Bekanntmachungsdatum)\n\nBayern Amtsgericht München HRB 299804\nRegisterbekanntmachung nach dem Umwandlungsgesetz 06.01.2026 (Eintragungsdatum)\n\nBlitz 25-903 GmbH\nGesellschaft mit beschränkter Haftung\nMünchen\n\nDen Gläubigern der an der Verschmelzung beteiligten Rechtsträger ist, wenn sie binnen sechs Monaten nach dem Tag, an dem die Eintragung der Verschmelzung in das Register des Sitzes desjenigen Rechtsträgers, dessen Gläubiger sie sind, nach § 19 Abs. 3 UmwG als bekannt gemacht gilt, ihren Anspruch nach Grund und Höhe in Textform anmelden, Sicherheit zu leisten, soweit sie nicht Befriedigung verlangen können. Dieses Recht steht den Gläubigern jedoch nur zu, wenn sie glaubhaft machen, dass durch die Verschmelzung die Erfüllung ihrer Forderung gefährdet wird."
    },
    {
      "date": "2026-01-07",
      "id": "141686",
      "original_text": "Registerbekanntmachung nach dem Umwandlungsgesetz\nBerlin Amtsgericht Berlin (Charlottenburg) HRB 279965\nSpotmyEnergy Anlagen GmbH – Berlin",
      "type": "Registerbekanntmachung nach dem Umwandlungsgesetz",
      "state": "Berlin",
      "amtsgericht": "Amtsgericht Berlin (Charlottenburg)",
      "registernummer": "HRB 279965",
      "registerart": "HRB",
      "company_name": "SpotmyEnergy Anlagen GmbH",
      "company_seat": "Berlin",
      "details": "07.01.2026 (Bekanntmachungsdatum)\n\nBerlin Amtsgericht Berlin (Charlottenburg) HRB 279965\nRegisterbekanntmachung nach dem Umwandlungsgesetz 06.01.2026 (Eintragungsdatum)\n\nSpotmyEnergy Anlagen GmbH\nGesellschaft mit beschränkter Haftung\nBerlin\n\nZu Eintragungsnummer 3 vom 06.01.2026 wird als nicht eingetragen veröffentlicht:\n\nDen Gläubigern der an der Spaltung beteiligten Rechtsträger ist, wenn sie binnen sechs Monaten nach dem Tag, an dem die Eintragung der Spaltung in das Register des Sitzes desjenigen Rechtsträgers, dessen Gläubiger sie sind, als bekannt gemacht gilt, ihren Anspruch nach Grund und Höhe schriftlich anmelden, Sicherheit zu leisten, soweit sie nicht Befriedigung verlangen können. Dieses Recht steht den Gläubigern jedoch nur zu, wenn sie glaubhaft machen, dass durch die Spaltung die Erfüllung ihrer Forderung gefährdet wird. Das Recht, Sicherheitsleistung zu verlangen, steht Gläubigern nicht zu, die im Falle der Insolvenz ein Recht auf vorzugsweise Befriedigung aus einer Deckungsmasse haben, die nach gesetzlicher Vorschrift zu ihrem Schutz errichtet und staatlich überwacht ist."
    },
    {
      "date": "2026-01-07",
      "id": "141687",
      "original_text": "Registerbekanntmachung nach dem Umwandlungsgesetz\nBaden-Württemberg Amtsgericht Stuttgart HRB 737788\nMercedes-Benz Mobility AG – Stuttgart",
      "type": "Registerbekanntmachung nach dem Umwandlungsgesetz",
      "state": "Baden-Württemberg",
      "amtsgericht": "Amtsgericht Stuttgart",
      "registernummer": "HRB 737788",
      "registerart": "HRB",
      "company_name": "Mercedes-Benz Mobility AG",
      "company_seat": "Stuttgart",
      "details": "07.01.2026 (Bekanntmachungsdatum)\n\nBaden-Württemberg Amtsgericht Stuttgart HRB 737788\nRegisterbekanntmachung nach dem Umwandlungsgesetz 07.01.2026 (Eintragungsdatum)\n\nMercedes-Benz Mobility AG\nAktiengesellschaft\nStuttgart\n\nAls nicht eingetragen wird bekanntgemacht:\nDen Gläubigern der an der Verschmelzung beteiligten Rechtsträger ist, wenn sie binnen sechs Monaten nach dem Tag, an dem die Eintragung der Verschmelzung in das Register des Sitzes desjenigen Rechtsträgers, dessen Gläubiger sie sind, nach § 19 Abs. 3 UmwG als bekanntgemacht gilt, ihren Anspruch nach Grund und Höhe schriftlich anmelden, Sicherheit zu leisten, soweit sie nicht Befriedigung verlangen können. Dieses Recht steht den Gläubigern jedoch nur zu, wenn sie glaubhaft machen, dass durch die Verschmelzung die Erfüllung ihrer Forderung gefährdet wird."
    },
    {
      "date": "2026-01-07",
      "id": "141688",
      "original_text": "Registerbekanntmachung nach dem Umwandlungsgesetz\nBrandenburg Amtsgericht Cottbus HRA 4457\nGaLa Nicole Schötz e.K. – Märkisch Buchholz",
      "type": "Registerbekanntmachung nach dem Umwandlungsgesetz",
      "state": "Brandenburg",
      "amtsgericht": "Amtsgericht Cottbus",
      "registernummer": "HRA 4457",
      "registerart": "HRA",
      "company_name": "GaLa Nicole Schötz e.K.",
      "company_seat": "Märkisch Buchholz",
      "details": "07.01.2026 (Bekanntmachungsdatum)\n\nBrandenburg Amtsgericht Cottbus HRA 4457\nRegisterbekanntmachung nach dem Umwandlungsgesetz 06.01.2026 (Eintragungsdatum)\n\nGaLa Nicole Schötz e.K.\nEinzelkaufmann / Einzelkauffrau\nMärkisch Buchholz\n\nAls nicht eingetragen wird veröffentlicht:\nDen Gläubigern der an der Ausgliederung beteiligten Rechtsträger ist, wenn sie binnen sechs Monaten nach dem Tag, an dem die Eintragung der Ausgliederung in das Register des Sitzes desjenigen Rechtsträgers, dessen Gläubiger sie sind, als bekannt gemacht gilt, ihren Anspruch nach Grund und Höhe schriftlich anmelden, Sicherheit zu leisten, soweit sie nicht Befriedigung verlangen können. Dieses Recht steht den Gläubigern jedoch nur zu, wenn sie glaubhaft machen, dass durch die Ausgliederung die Erfüllung ihrer Forderung gefährdet wird"
    },
    {
      "date": "2026-01-07",
      "id": "141689",
      "original_text": "Sonstige Registerbekanntmachung\nBaden-Württemberg Amtsgericht Stuttgart HRB 22127\nGvH Vermögensverwaltungsgesellschaft X mbH – Stuttgart",
      "type": "Sonstige Registerbekanntmachung",
      "state": "Baden-Württemberg",
      "amtsgericht": "Amtsgericht Stuttgart",
      "registernummer": "HRB 22127",
      "registerart": "HRB",
      "company_name": "GvH Vermögensverwaltungsgesellschaft X mbH",
      "company_seat": "Stuttgart",
      "details": "07.01.2026 (Bekanntmachungsdatum)\n\nBaden-Württemberg Amtsgericht Stuttgart HRB 22127\nSonstige Registerbekanntmachung 07.01.2026 (Eintragungsdatum)\n\nGvH Vermögensverwaltungsgesellschaft X mbH\nGesellschaft mit beschränkter Haftung\nStuttgart\n\nDen Gläubigern der Gesellschaft, deren Forderungen begründet worden sind, bevor die Eintragung der Beendigung des Vertrages in das Handelsregister nach § 10 HGB als bekanntgemacht gilt, ist vom anderen Vertragsteil Sicherheit zu leisten, wenn sie sich binnen sechs Monaten nach der Bekanntmachung zu diesem Zweck bei ihm melden."
    },
    {
      "date": "2026-01-07",
      "id": "141690",
      "original_text": "Sonstige Registerbekanntmachung\nBrandenburg Amtsgericht Potsdam HRB 17751\nFMP Forderungsmanagement Potsdam GmbH – Potsdam",
      "type": "Sonstige Registerbekanntmachung",
      "state": "Brandenburg",
      "amtsgericht": "Amtsgericht Potsdam",
      "registernummer": "HRB 17751",
      "registerart": "HRB",
      "company_name": "FMP Forderungsmanagement Potsdam GmbH",
      "company_seat": "Potsdam",
      "details": "07.01.2026 (Bekanntmachungsdatum)\n\nBrandenburg Amtsgericht Potsdam HRB 17751\nSonstige Registerbekanntmachung\n\nFMP Forderungsmanagement Potsdam GmbH\nGesellschaft mit beschränkter Haftung\nPotsdam\n\nAls nicht eingetragen wird veröffentlicht: Der andere Vertragsteil hat den Gläubigern dieses Rechtsträgers, dessen Forderungen begründet worden sind, bevor die Eintragung der Beendigung dieses Vertrages in das Handelsregister nach § 10 des Handelsgesetzbuches als bekannt gemacht gilt, Sicherheit zu leisten, wenn sie sich binnen sechs Monaten nach der Bekanntmachung der Eintragung zu diesem Zweck bei ihm melden"
    },
    {
      "date": "2026-01-07",
      "id": "141691",
      "original_text": "Löschungsankündigung\nBaden-Württemberg Amtsgericht Stuttgart HRB 762348\nBuildship UG (haftungsbeschränkt) – Wendlingen am Neckar",
      "type": "Löschungsankündigung",
      "state": "Baden-Württemberg",
      "amtsgericht": "Amtsgericht Stuttgart",
      "registernummer": "HRB 762348",
      "registerart": "HRB",
      "company_name": "Buildship UG (haftungsbeschränkt)",
      "company_seat": "Wendlingen am Neckar",
      "details": "07.01.2026 (Bekanntmachungsdatum)\n\nBaden-Württemberg Amtsgericht Stuttgart HRB 762348\nLöschungsankündigung\n\nBuildship UG (haftungsbeschränkt)\nGesellschaft mit beschränkter Haftung\nWendlingen am Neckar\n\nDas Gericht beabsichtigt, die Gesellschaft wegen Vermögenslosigkeit im Handelsregister von Amts wegen nach § 394 FamFG zu löschen. Die Frist zur Geltendmachung eines Widerspruchs gegen die beabsichtigte Löschung ist auf zwei Monate ab Veröffentlichung bestimmt."
    },
    {
      "date": "2026-01-07",
      "id": "141692",
      "original_text": "Löschungsankündigung\nBerlin Amtsgericht Berlin (Charlottenburg) HRB 261680\nFerenco GmbH – Berlin",
      "type": "Löschungsankündigung",
      "state": "Berlin",
      "amtsgericht": "Amtsgericht Berlin (Charlottenburg)",
      "registernummer": "HRB 261680",
      "registerart": "HRB",
      "company_name": "Ferenco GmbH",
      "company_seat": "Berlin",
      "details": "07.01.2026 (Bekanntmachungsdatum)\n\nBerlin Amtsgericht Berlin (Charlottenburg) HRB 261680\nLöschungsankündigung\n\nFerenco GmbH\nGesellschaft mit beschränkter Haftung\nBerlin\n\nBei der nachstehenden Gesellschaft wird das Amtslöschungsverfahren gemäß § 394 FamFG eingeleitet. Widerspruchsfrist 6 Wochen"
    },
    {
      "date": "2026-01-07",
      "id": "141693",
      "original_text": "Registerbekanntmachung nach dem Umwandlungsgesetz\nBrandenburg Amtsgericht Cottbus HRB 16873\nNiNAG GmbH – Märkisch Buchholz",
      "type": "Registerbekanntmachung nach dem Umwandlungsgesetz",
      "state": "Brandenburg",
      "amtsgericht": "Amtsgericht Cottbus",
      "registernummer": "HRB 16873",
      "registerart": "HRB",
      "company_name": "NiNAG GmbH",
      "company_seat": "Märkisch Buchholz",
      "details": "07.01.2026 (Bekanntmachungsdatum)\n\nBrandenburg Amtsgericht Cottbus HRB 16873\nRegisterbekanntmachung nach dem Umwandlungsgesetz 06.01.2026 (Eintragungsdatum)\n\nNiNAG GmbH\nGesellschaft mit beschränkter Haftung\nMärkisch Buchholz\n\nDen Gläubigern der an der Spaltung beteiligten Rechtsträger ist, wenn sie binnen sechs Monaten nach dem Tag, an dem die Eintragung der Spaltung in das Register des Sitzes desjenigen Rechtsträgers, dessen Gläubiger sie sind, als bekannt gemacht gilt, ihren Anspruch nach Grund und Höhe schriftlich anmelden, Sicherheit zu leisten, soweit sie nicht Befriedigung verlangen können. Dieses Recht steht den Gläubigern jedoch nur zu, wenn sie glaubhaft machen, dass durch die Spaltung die Erfüllung ihrer Forderung gefährdet wird"
    },
    {
      "date": "2026-01-07",
      "id": "141694",
      "original_text": "Sonstige Registerbekanntmachung\nBaden-Württemberg Amtsgericht Ulm HRB 737500\nCasino Deluxe Beteiligungsgesellschaft mbH I – Pfullendorf",
      "type": "Sonstige Registerbekanntmachung",
      "state": "Baden-Württemberg",
      "amtsgericht": "Amtsgericht Ulm",
      "registernummer": "HRB 737500",
      "registerart": "HRB",
      "company_name": "Casino Deluxe Beteiligungsgesellschaft mbH I",
      "company_seat": "Pfullendorf",
      "details": "07.01.2026 (Bekanntmachungsdatum)\n\nBaden-Württemberg Amtsgericht Ulm HRB 737500\nSonstige Registerbekanntmachung 07.01.2026 (Eintragungsdatum)\n\nCasino Deluxe Beteiligungsgesellschaft mbH I\nGesellschaft mit beschränkter Haftung\nPfullendorf\n\nDen Gläubigern der Gesellschaft, deren Forderungen begründet worden sind, bevor die Eintragung der Beendigung des Vertrages in das Handelsregister nach § 10 HGB als bekanntgemacht gilt, ist vom anderen Vertragsteil Sicherheit zu leisten, wenn sie sich binnen sechs Monaten nach der Bekanntmachung zu diesem Zweck bei ihm melden."
    },
    {
      "date": "2026-01-07",
      "id": "141695",
      "original_text": "Löschungsankündigung\nBrandenburg Amtsgericht Potsdam HRB 25488\nLIBELLA-EFFIZIENZ HAUS GMBH – Ziesar",
      "type": "Löschungsankündigung",
      "state": "Brandenburg",
      "amtsgericht": "Amtsgericht Potsdam",
      "registernummer": "HRB 25488",
      "registerart": "HRB",
      "company_name": "LIBELLA-EFFIZIENZ HAUS GMBH",
      "company_seat": "Ziesar",
      "details": "07.01.2026 (Bekanntmachungsdatum)\n\nBrandenburg Amtsgericht Potsdam HRB 25488\nLöschungsankündigung\n\nLIBELLA-EFFIZIENZ HAUS GMBH\nGesellschaft mit beschränkter Haftung\nZiesar\n\nBei der nachstehenden Gesellschaft wird das Amtslöschungsverfahren gemäß § 394 FamFG eingeleitet. Widerspruchsfrist: 8 Wochen"
    },
    {
      "date": "2026-01-07",
      "id": "141696",
      "original_text": "Löschungsankündigung\nBerlin Amtsgericht Berlin (Charlottenburg) HRB 166247\nRaMu Personal- und Unternehmensservice GmbH – Berlin",
      "type": "Löschungsankündigung",
      "state": "Berlin",
      "amtsgericht": "Amtsgericht Berlin (Charlottenburg)",
      "registernummer": "HRB 166247",
      "registerart": "HRB",
      "company_name": "RaMu Personal- und Unternehmensservice GmbH",
      "company_seat": "Berlin",
      "details": "07.01.2026 (Bekanntmachungsdatum)\n\nBerlin Amtsgericht Berlin (Charlottenburg) HRB 166247\nLöschungsankündigung\n\nRaMu Personal- und Unternehmensservice GmbH\nGesellschaft mit beschränkter Haftung\nBerlin\n\nBei der nachstehenden Gesellschaft wird das Amtslöschungsverfahren gemäß § 394 FamFG eingeleitet. Widerspruchsfrist 6 Wochen"
    },
    {
      "date": "2026-01-07",
      "id": "141697",
      "original_text": "Löschungsankündigung\nBaden-Württemberg Amtsgericht Stuttgart HRB 761253\nPro Delight Food GmbH – Münsingen",
      "type": "Löschungsankündigung",
      "state": "Baden-Württemberg",
      "amtsgericht": "Amtsgericht Stuttgart",
      "registernummer": "HRB 761253",
      "registerart": "HRB",
      "company_name": "Pro Delight Food GmbH",
      "company_seat": "Münsingen",
      "details": "07.01.2026 (Bekanntmachungsdatum)\n\nBaden-Württemberg Amtsgericht Stuttgart HRB 761253\nLöschungsankündigung\n\nPro Delight Food GmbH\nGesellschaft mit beschränkter Haftung\nMünsingen\n\nDas Gericht beabsichtigt, die Gesellschaft wegen Vermögenslosigkeit im Handelsregister von Amts wegen nach § 394 FamFG zu löschen. Die Frist zur Geltendmachung eines Widerspruchs gegen die beabsichtigte Löschung ist auf zwei Monate ab Veröffentlichung bestimmt."
    },
    {
      "date": "2026-01-07",
      "id": "141698",
      "original_text": "Sonstige Registerbekanntmachung\nBaden-Württemberg Amtsgericht Ulm HRB 737568\nCasino Deluxe Beteiligungsgesellschaft mbH IV – Pfullendorf",
      "type": "Sonstige Registerbekanntmachung",
      "state": "Baden-Württemberg",
      "amtsgericht": "Amtsgericht Ulm",
      "registernummer": "HRB 737568",
      "registerart": "HRB",
      "company_name": "Casino Deluxe Beteiligungsgesellschaft mbH IV",
      "company_seat": "Pfullendorf",
      "details": "07.01.2026 (Bekanntmachungsdatum)\n\nBaden-Württemberg Amtsgericht Ulm HRB 737568\nSonstige Registerbekanntmachung 07.01.2026 (Eintragungsdatum)\n\nCasino Deluxe Beteiligungsgesellschaft mbH IV\nGesellschaft mit beschränkter Haftung\nPfullendorf\n\nDen Gläubigern der Gesellschaft, deren Forderungen begründet worden sind, bevor die Eintragung der Beendigung des Vertrages in das Handelsregister nach § 10 HGB als bekanntgemacht gilt, ist vom anderen Vertragsteil Sicherheit zu leisten, wenn sie sich binnen sechs Monaten nach der Bekanntmachung zu diesem Zweck bei ihm melden."
    },
    {
      "date": "2026-01-07",
      "id": "141699",
      "original_text": "Löschungsankündigung\nBaden-Württemberg Amtsgericht Stuttgart HRB 766560\nKonzept Bauunternehmung GmbH – Balingen",
      "type": "Löschungsankündigung",
      "state": "Baden-Württemberg",
      "amtsgericht": "Amtsgericht Stuttgart",
      "registernummer": "HRB 766560",
      "registerart": "HRB",
      "company_name": "Konzept Bauunternehmung GmbH",
      "company_seat": "Balingen",
      "details": "07.01.2026 (Bekanntmachungsdatum)\n\nBaden-Württemberg Amtsgericht Stuttgart HRB 766560\nLöschungsankündigung\n\nKonzept Bauunternehmung GmbH\nGesellschaft mit beschränkter Haftung\nBalingen\n\nAls nicht eingetragen wird bekanntgemacht:\nDas Gericht beabsichtigt, die Gesellschaft wegen Vermögenslosigkeit im Handelsregister von Amts wegen nach § 394 FamFG zu löschen. Die Frist zur Geltendmachung eines Widerspruchs gegen die beabsichtigte Löschung ist auf zwei Monate ab Veröffentlichung bestimmt."
    },
    {
      "date": "2026-01-07",
      "id": "141700",
      "original_text": "Sonstige Registerbekanntmachung\nSchleswig-Holstein Amtsgericht Flensburg HRB 7603\nSemcoglas GmbH – Kropp",
      "type": "Sonstige Registerbekanntmachung",
      "state": "Schleswig-Holstein",
      "amtsgericht": "Amtsgericht Flensburg",
      "registernummer": "HRB 7603",
      "registerart": "HRB",
      "company_name": "Semcoglas GmbH",
      "company_seat": "Kropp",
      "details": "07.01.2026 (Bekanntmachungsdatum)\n\nSchleswig-Holstein Amtsgericht Flensburg HRB 7603\nSonstige Registerbekanntmachung 05.01.2026 (Eintragungsdatum)\n\nSemcoglas GmbH\nGesellschaft mit beschränkter Haftung\nKropp\n\nAls nicht eingetragen wird veröffentlicht:\nDer andere Vertragsteil hat den Gläubigern dieses Rechtsträgers, dessen Forderungen begründet worden sind, bevor die Eintragung der Beendigung dieses Vertrages in das Handelsregister nach § 10 des Handelsgesetzbuches als bekannt gemacht gilt, Sicherheit zu leisten, wenn sie sich binnen sechs Monaten nach der Bekanntmachung der Eintragung zu diesem Zweck bei ihm melden. Dieses Recht steht den Gläubigern nicht zu, die im Fall des Insolvenzverfahrens ein Recht auf vorzugsweise Befriedigung aus der Deckungsmasse haben, die nach gesetzlicher Vorschrift zu ihrem Schutz errichtet und staatlich überwacht ist."
    },
    {
      "date": "2026-01-07",
      "id": "141701",
      "original_text": "Sonstige Registerbekanntmachung\nSaarland Amtsgericht Saarbrücken HRB 105617\npe-control GmbH – Eppelborn",
      "type": "Sonstige Registerbekanntmachung",
      "state": "Saarland",
      "amtsgericht": "Amtsgericht Saarbrücken",
      "registernummer": "HRB 105617",
      "registerart": "HRB",
      "company_name": "pe-control GmbH",
      "company_seat": "Eppelborn",
      "details": "07.01.2026 (Bekanntmachungsdatum)\n\nSaarland Amtsgericht Saarbrücken HRB 105617\nSonstige Registerbekanntmachung 07.01.2026 (Eintragungsdatum)\n\npe-control GmbH\nGesellschaft mit beschränkter Haftung\nEppelborn\n\nDer Beherrschungs- und Gewinnabführungsvertrag vom 04.12.2025 mit der „peko GmbH“ in Eppelborn ist durch Kündigung zum 31.12.2025 beendet."
    },
    {
      "date": "2026-01-07",
      "id": "141702",
      "original_text": "Registerbekanntmachung nach dem Umwandlungsgesetz\nBaden-Württemberg Amtsgericht Freiburg HRA 706939\nKumuk Transporte GmbH & Co. KG – Neuenburg am Rhein",
      "type": "Registerbekanntmachung nach dem Umwandlungsgesetz",
      "state": "Baden-Württemberg",
      "amtsgericht": "Amtsgericht Freiburg",
      "registernummer": "HRA 706939",
      "registerart": "HRA",
      "company_name": "Kumuk Transporte GmbH & Co. KG",
      "company_seat": "Neuenburg am Rhein",
      "details": "07.01.2026 (Bekanntmachungsdatum)\n\nBaden-Württemberg Amtsgericht Freiburg HRA 706939\nRegisterbekanntmachung nach dem Umwandlungsgesetz 07.01.2026 (Eintragungsdatum)\n\nKumuk Transporte GmbH & Co. KG\nKommanditgesellschaft\nNeuenburg am Rhein\n\nAls nicht eingetragen wird bekanntgemacht:\nDen Gläubigern der an der Verschmelzung beteiligten Rechtsträger ist, wenn sie binnen sechs Monaten nach dem Tag, an dem die Eintragung der Verschmelzung in das Register des Sitzes desjenigen Rechtsträgers, dessen Gläubiger sie sind, nach § 19 Abs. 3 UmwG als bekanntgemacht gilt, ihren Anspruch nach Grund und Höhe schriftlich anmelden, Sicherheit zu leisten, soweit sie nicht Befriedigung verlangen können. Dieses Recht steht den Gläubigern jedoch nur zu, wenn sie glaubhaft machen, dass durch die Verschmelzung die Erfüllung ihrer Forderung gefährdet wird."
    },
    {
      "date": "2026-01-07",
      "id": "141703",
      "original_text": "Einreichung neuer Dokumente\nBerlin Amtsgericht Berlin (Charlottenburg) HRB 200224\nBEN Berlin Energie und Netzholding GmbH – Berlin",
      "type": "Einreichung neuer Dokumente",
      "state": "Berlin",
      "amtsgericht": "Amtsgericht Berlin (Charlottenburg)",
      "registernummer": "HRB 200224",
      "registerart": "HRB",
      "company_name": "BEN Berlin Energie und Netzholding GmbH",
      "company_seat": "Berlin",
      "details": "07.01.2026 (Bekanntmachungsdatum)\n\nBerlin Amtsgericht Berlin (Charlottenburg) HRB 200224\nEinreichung neuer Dokumente\n\nBEN Berlin Energie und Netzholding GmbH\nGesellschaft mit beschränkter Haftung\nBerlin\n\nAls nicht eingetragen wird veröffentlicht:Es wurde eine neue Liste der Aufsichtsratsmitglieder eingereicht (§52 GmbHG)."
    },
    {
      "date": "2026-01-07",
      "id": "141704",
      "original_text": "Löschungsankündigung\nBerlin Amtsgericht Berlin (Charlottenburg) HRB 197413\nBro's Apartments Management GmbH – Berlin",
      "type": "Löschungsankündigung",
      "state": "Berlin",
      "amtsgericht": "Amtsgericht Berlin (Charlottenburg)",
      "registernummer": "HRB 197413",
      "registerart": "HRB",
      "company_name": "Bro's Apartments Management GmbH",
      "company_seat": "Berlin",
      "details": "07.01.2026 (Bekanntmachungsdatum)\n\nBerlin Amtsgericht Berlin (Charlottenburg) HRB 197413\nLöschungsankündigung\n\nBro's Apartments Management GmbH\nGesellschaft mit beschränkter Haftung\nBerlin\n\nBei der nachstehenden Gesellschaft wird das Amtslöschungsverfahren gemäß § 394 FamFG eingeleitet. Widerspruchsfrist 6 Wochen"
    },
    {
      "date": "2026-01-07",
      "id": "141705",
      "original_text": "Löschungsankündigung\nBerlin Amtsgericht Berlin (Charlottenburg) HRB 213415\nReidon GmbH – Berlin",
      "type": "Löschungsankündigung",
      "state": "Berlin",
      "amtsgericht": "Amtsgericht Berlin (Charlottenburg)",
      "registernummer": "HRB 213415",
      "registerart": "HRB",
      "company_name": "Reidon GmbH",
      "company_seat": "Berlin",
      "details": "07.01.2026 (Bekanntmachungsdatum)\n\nBerlin Amtsgericht Berlin (Charlottenburg) HRB 213415\nLöschungsankündigung\n\nReidon GmbH\nGesellschaft mit beschränkter Haftung\nBerlin\n\nBei der nachstehenden Gesellschaft wird das Amtslöschungsverfahren gemäß § 394 FamFG eingeleitet. Widerspruchsfrist 6 Wochen"
    },
    {
      "date": "2026-01-07",
      "id": "141706",
      "original_text": "Einreichung neuer Dokumente\nBaden-Württemberg Amtsgericht Stuttgart HRB 24542\nSV SparkassenVersicherung Lebensversicherung Aktiengesellschaft – Stuttgart",
      "type": "Einreichung neuer Dokumente",
      "state": "Baden-Württemberg",
      "amtsgericht": "Amtsgericht Stuttgart",
      "registernummer": "HRB 24542",
      "registerart": "HRB",
      "company_name": "SV SparkassenVersicherung Lebensversicherung Aktiengesellschaft",
      "company_seat": "Stuttgart",
      "details": "07.01.2026 (Bekanntmachungsdatum)\n\nBaden-Württemberg Amtsgericht Stuttgart HRB 24542\nEinreichung neuer Dokumente\n\nSV SparkassenVersicherung Lebensversicherung Aktiengesellschaft\nAktiengesellschaft\nStuttgart\n\nDie Gesellschaft hat am 29.12.2025 die Liste über die Zusammensetzung des Aufsichtsrats zum Handelsregister eingereicht."
    },
    {
      "date": "2026-01-07",
      "id": "141707",
      "original_text": "Löschungsankündigung\nBaden-Württemberg Amtsgericht Mannheim HRB 713044\nKFZ-Service M & S GmbH – Mannheim",
      "type": "Löschungsankündigung",
      "state": "Baden-Württemberg",
      "amtsgericht": "Amtsgericht Mannheim",
      "registernummer": "HRB 713044",
      "registerart": "HRB",
      "company_name": "KFZ-Service M & S GmbH",
      "company_seat": "Mannheim",
      "details": "07.01.2026 (Bekanntmachungsdatum)\n\nBaden-Württemberg Amtsgericht Mannheim HRB 713044\nLöschungsankündigung\n\nKFZ-Service M & S GmbH\nGesellschaft mit beschränkter Haftung\nMannheim\n\nDas Gericht beabsichtigt, die Gesellschaft wegen Vermögenslosigkeit im Handelsregister von Amts wegen nach § 394 FamFG zu löschen. Die Frist zur Geltendmachung eines Widerspruchs gegen die beabsichtigte Löschung ist auf einen Monat ab Veröffentlichung bestimmt."
    },
    {
      "date": "2026-01-07",
      "id": "141708",
      "original_text": "Sonstige Registerbekanntmachung\nBaden-Württemberg Amtsgericht Mannheim HRB 714747\nVerivox Finanzvergleich GmbH – Heidelberg",
      "type": "Sonstige Registerbekanntmachung",
      "state": "Baden-Württemberg",
      "amtsgericht": "Amtsgericht Mannheim",
      "registernummer": "HRB 714747",
      "registerart": "HRB",
      "company_name": "Verivox Finanzvergleich GmbH",
      "company_seat": "Heidelberg",
      "details": "07.01.2026 (Bekanntmachungsdatum)\n\nBaden-Württemberg Amtsgericht Mannheim HRB 714747\nSonstige Registerbekanntmachung 07.01.2026 (Eintragungsdatum)\n\nVerivox Finanzvergleich GmbH\nGesellschaft mit beschränkter Haftung\nHeidelberg\n\nAls nicht eingetragen wird bekanntgemacht:\nDen Gläubigern der Gesellschaft, deren Forderungen begründet worden sind, bevor die Eintragung der Beendigung des Vertrages in das Handelsregister nach § 10 HGB als bekanntgemacht gilt, ist vom anderen Vertragsteil Sicherheit zu leisten, wenn sie sich binnen sechs Monaten nach der Bekanntmachung zu diesem Zweck bei ihm melden."
    },
    {
      "date": "2026-01-07",
      "id": "141709",
      "original_text": "Registerbekanntmachung nach dem Umwandlungsgesetz\nBaden-Württemberg Amtsgericht Freiburg HRB 724926\nKumuk Transporte Verwaltungs GmbH – Neuenburg am Rhein",
      "type": "Registerbekanntmachung nach dem Umwandlungsgesetz",
      "state": "Baden-Württemberg",
      "amtsgericht": "Amtsgericht Freiburg",
      "registernummer": "HRB 724926",
      "registerart": "HRB",
      "company_name": "Kumuk Transporte Verwaltungs GmbH",
      "company_seat": "Neuenburg am Rhein",
      "details": "07.01.2026 (Bekanntmachungsdatum)\n\nBaden-Württemberg Amtsgericht Freiburg HRB 724926\nRegisterbekanntmachung nach dem Umwandlungsgesetz 07.01.2026 (Eintragungsdatum)\n\nKumuk Transporte Verwaltungs GmbH\nGesellschaft mit beschränkter Haftung\nNeuenburg am Rhein\n\nAls nicht eingetragen wird bekanntgemacht:\nDen Gläubigern der an der Verschmelzung beteiligten Rechtsträger ist, wenn sie binnen sechs Monaten nach dem Tag, an dem die Eintragung der Verschmelzung in das Register des Sitzes desjenigen Rechtsträgers, dessen Gläubiger sie sind, nach § 19 Abs. 3 UmwG als bekanntgemacht gilt, ihren Anspruch nach Grund und Höhe schriftlich anmelden, Sicherheit zu leisten, soweit sie nicht Befriedigung verlangen können. Dieses Recht steht den Gläubigern jedoch nur zu, wenn sie glaubhaft machen, dass durch die Verschmelzung die Erfüllung ihrer Forderung gefährdet wird."
    },
    {
      "date": "2026-01-07",
      "id": "141710",
      "original_text": "Löschungsankündigung\nBerlin Amtsgericht Berlin (Charlottenburg) HRB 158848\nMaxBet Sport Wetten GmbH – Berlin",
      "type": "Löschungsankündigung",
      "state": "Berlin",
      "amtsgericht": "Amtsgericht Berlin (Charlottenburg)",
      "registernummer": "HRB 158848",
      "registerart": "HRB",
      "company_name": "MaxBet Sport Wetten GmbH",
      "company_seat": "Berlin",
      "details": "07.01.2026 (Bekanntmachungsdatum)\n\nBerlin Amtsgericht Berlin (Charlottenburg) HRB 158848\nLöschungsankündigung\n\nMaxBet Sport Wetten GmbH\nGesellschaft mit beschränkter Haftung\nBerlin\n\nBei der nachstehenden Gesellschaft wird das Amtslöschungsverfahren gemäß § 394 FamFG eingeleitet. Widerspruchsfrist 6 Wochen"
    },
    {
      "date": "2026-01-07",
      "id": "141711",
      "original_text": "Löschungsankündigung\nBaden-Württemberg Amtsgericht Mannheim HRB 107274\nEINS - Entwicklung Interaktiver Software GmbH – Karlsruhe",
      "type": "Löschungsankündigung",
      "state": "Baden-Württemberg",
      "amtsgericht": "Amtsgericht Mannheim",
      "registernummer": "HRB 107274",
      "registerart": "HRB",
      "company_name": "EINS - Entwicklung Interaktiver Software GmbH",
      "company_seat": "Karlsruhe",
      "details": "07.01.2026 (Bekanntmachungsdatum)\n\nBaden-Württemberg Amtsgericht Mannheim HRB 107274\nLöschungsankündigung\n\nEINS - Entwicklung Interaktiver Software GmbH\nGesellschaft mit beschränkter Haftung\nKarlsruhe\n\nDas Gericht beabsichtigt, die Gesellschaft wegen Vermögenslosigkeit im Handelsregister von Amts wegen nach § 394 FamFG zu löschen. Die Frist zur Geltendmachung eines Widerspruchs gegen die beabsichtigte Löschung ist auf einen Monat ab Veröffentlichung bestimmt."
    },
    {
      "date": "2026-01-07",
      "id": "141712",
      "original_text": "Registerbekanntmachung nach dem Umwandlungsgesetz\nSachsen-Anhalt Amtsgericht Stendal HRB 5974\nFlash Telemarketing GmbH – Gommern",
      "type": "Registerbekanntmachung nach dem Umwandlungsgesetz",
      "state": "Sachsen-Anhalt",
      "amtsgericht": "Amtsgericht Stendal",
      "registernummer": "HRB 5974",
      "registerart": "HRB",
      "company_name": "Flash Telemarketing GmbH",
      "company_seat": "Gommern",
      "details": "07.01.2026 (Bekanntmachungsdatum)\n\nSachsen-Anhalt Amtsgericht Stendal HRB 5974\nRegisterbekanntmachung nach dem Umwandlungsgesetz 07.01.2026 (Eintragungsdatum)\n\nFlash Telemarketing GmbH\nGesellschaft mit beschränkter Haftung\nGommern\n\nNicht eingetragen:\nDen Gläubigern der an der Verschmelzung beteiligten Rechtsträger ist, wenn sie binnen sechs Monaten nach dem Tag, an dem die Eintragung der Verschmelzung nach § 19 Abs. 3 UmwG als bekanntgemacht gilt, ihren Anspruch nach Grund und Höhe schriftlich anmelden, Sicherheit zu leisten, soweit sie nicht Befriedigung verlangen können. Dieses Recht steht ihnen jedoch nur zu, wenn sie glaubhaft machen, dass durch die Verschmelzung die Erfüllung ihrer Forderung gefährdet wird."
    },
    {
      "date": "2026-01-07",
      "id": "141713",
      "original_text": "Registerbekanntmachung nach dem Umwandlungsgesetz\nSachsen-Anhalt Amtsgericht Stendal HRB 7785\nSky Telemarketing GmbH – Köthen",
      "type": "Registerbekanntmachung nach dem Umwandlungsgesetz",
      "state": "Sachsen-Anhalt",
      "amtsgericht": "Amtsgericht Stendal",
      "registernummer": "HRB 7785",
      "registerart": "HRB",
      "company_name": "Sky Telemarketing GmbH",
      "company_seat": "Köthen",
      "details": "07.01.2026 (Bekanntmachungsdatum)\n\nSachsen-Anhalt Amtsgericht Stendal HRB 7785\nRegisterbekanntmachung nach dem Umwandlungsgesetz 07.01.2026 (Eintragungsdatum)\n\nSky Telemarketing GmbH\nGesellschaft mit beschränkter Haftung\nKöthen\n\nNicht eingetragen:\nDen Gläubigern der an der Verschmelzung beteiligten Rechtsträger ist, wenn sie binnen sechs Monaten nach dem Tag, an dem die Eintragung der Verschmelzung nach § 19 Abs. 3 UmwG als bekanntgemacht gilt, ihren Anspruch nach Grund und Höhe schriftlich anmelden, Sicherheit zu leisten, soweit sie nicht Befriedigung verlangen können. Dieses Recht steht ihnen jedoch nur zu, wenn sie glaubhaft machen, dass durch die Verschmelzung die Erfüllung ihrer Forderung gefährdet wird."
    },
    {
      "date": "2026-01-07",
      "id": "141714",
      "original_text": "Löschungsankündigung\nThüringen Amtsgericht Jena HRB 512229\nFGR Global Fruit UG (haftungsbeschränkt) – Nesse-Apfelstädt",
      "type": "Löschungsankündigung",
      "state": "Thüringen",
      "amtsgericht": "Amtsgericht Jena",
      "registernummer": "HRB 512229",
      "registerart": "HRB",
      "company_name": "FGR Global Fruit UG (haftungsbeschränkt)",
      "company_seat": "Nesse-Apfelstädt",
      "details": "07.01.2026 (Bekanntmachungsdatum)\n\nThüringen Amtsgericht Jena HRB 512229\nLöschungsankündigung\n\nFGR Global Fruit UG (haftungsbeschränkt)\nGesellschaft mit beschränkter Haftung\nNesse-Apfelstädt\n\nDas Registergericht beabsichtigt, die im Handelsregister eingetragene Gesellschaft wegen Vermögenslosigkeit nach § 394 FamFG von Amts wegen zu löschen. Die Frist zur Erhebung eines Widerspruchs gegen die beabsichtigte Löschung wird auf 6 Wochen festgesetzt."
    },
    {
      "date": "2026-01-07",
      "id": "141715",
      "original_text": "Löschungsankündigung\nSaarland Amtsgericht Saarbrücken HRB 108294\nSchiliro Holding GmbH – St. Ingbert",
      "type": "Löschungsankündigung",
      "state": "Saarland",
      "amtsgericht": "Amtsgericht Saarbrücken",
      "registernummer": "HRB 108294",
      "registerart": "HRB",
      "company_name": "Schiliro Holding GmbH",
      "company_seat": "St. Ingbert",
      "details": "07.01.2026 (Bekanntmachungsdatum)\n\nSaarland Amtsgericht Saarbrücken HRB 108294\nLöschungsankündigung\n\nSchiliro Holding GmbH\nGesellschaft mit beschränkter Haftung\nSt. Ingbert\n\nEs ist beabsichtigt, die Gesellschaft von Amts wegen gemäß § 394 FamFG wegen Vermögenslosigkeit zu löschen.\nGegen die Löschung von Amts wegen ist das Rechtsmittel des Widerspruchs statthaft. Der Widerspruch ist binnen einer Frist drei Monaten beginnend mit dem Tag dieser Veröffentlichung durch Einreichen eines Widerspruchsschreibens -schriftlich oder zur Niederschrift der Geschäftsstelle beim Amtsgericht Saarbrücken, -zentrales Handelsregister-, Mainzerstr.178, 66121 Saarbrücken einzulegen.\nDer Widerspruch muss die Bezeichnung der angefochtenen Löschungsankündigung enthalten sowie die Erklärung, dass Widerspruch eingelegt wird. Er ist vom Widerspruchsführer oder seinem Bevollmächtigten zu unterzeichnen.\nDas Widerspruchsschreiben kann auch in der Form eines elektronischen Dokumentes eingereicht werden, das mit einer qualifizierten elektronischen Signatur nach dem Signaturgesetz versehen sein muss (§§ 14 Abs. 2 FamFG, 130a, 298 ZPO).."
    },
    {
      "date": "2026-01-07",
      "id": "141716",
      "original_text": "Sonstige Registerbekanntmachung\nBerlin Amtsgericht Berlin (Charlottenburg) HRB 259309\nDammereez PV GmbH – Berlin",
      "type": "Sonstige Registerbekanntmachung",
      "state": "Berlin",
      "amtsgericht": "Amtsgericht Berlin (Charlottenburg)",
      "registernummer": "HRB 259309",
      "registerart": "HRB",
      "company_name": "Dammereez PV GmbH",
      "company_seat": "Berlin",
      "details": "07.01.2026 (Bekanntmachungsdatum)\n\nBerlin Amtsgericht Berlin (Charlottenburg) HRB 259309\nSonstige Registerbekanntmachung\n\nDammereez PV GmbH\nGesellschaft mit beschränkter Haftung\nBerlin\n\nAls nicht eingetragen wird veröffentlicht: Der andere Vertragsteil hat den Gläubigern dieses Rechtsträgers, deren Forderungen begründet worden sind, bevor die Eintragung der Beendigung dieses Vertrages in das Handelsregister nach § 10 des Handelsgesetzbuches als bekannt gemacht gilt, Sicherheit zu leisten, wenn sie sich binnen sechs Monaten nach der Bekanntmachung der Eintragung zu diesem Zweck bei ihm melden. Dieses Recht steht den Gläubigern nicht zu, die im Fall des Insolvenzverfahrens ein Recht auf vorzugsweise Befriedigung aus der Deckungsmasse haben, die nach gesetzlicher Vorschrift zu ihrem Schutz errichtet und staatlich überwacht ist."
    },
    {
      "date": "2026-01-07",
      "id": "141717",
      "original_text": "Registerbekanntmachung nach dem Umwandlungsgesetz\nHamburg Amtsgericht Hamburg HRB 186429\nauxalia WESTCAM Holding GmbH – Hamburg",
      "type": "Registerbekanntmachung nach dem Umwandlungsgesetz",
      "state": "Hamburg",
      "amtsgericht": "Amtsgericht Hamburg",
      "registernummer": "HRB 186429",
      "registerart": "HRB",
      "company_name": "auxalia WESTCAM Holding GmbH",
      "company_seat": "Hamburg",
      "details": "07.01.2026 (Bekanntmachungsdatum)\n\nHamburg Amtsgericht Hamburg HRB 186429\nRegisterbekanntmachung nach dem Umwandlungsgesetz\n\nauxalia WESTCAM Holding GmbH\nGesellschaft mit beschränkter Haftung\nHamburg\n\nAls nicht eingetragen wird bekanntgemacht:\nEs wird darauf hingewiesen, dass ein Verschmelzungsplan oder sein Entwurf über eine grenzüberschreitende Verschmelzung zur Aufnahme mit der WEMI Beteiligungs GmbH mit Sitz in Mils/Österreich (Österreichisches Firmenbuch 501121v) (Gesellschaft mit beschränkter Haftung nach österreichischem Recht) beim Handelsregister eingereicht worden ist.\nDie Anteilsinhaber, die Gläubiger sowie die zuständigen Betriebsräte der an der grenzüberschreitenden Verschmelzung beteiligten Gesellschaften oder, soweit es keinen Betriebsrat gibt, die Arbeitnehmer der an der grenzüberschreitenden Verschmelzung beteiligten Gesellschaften, können der jeweiligen Gesellschaft spätestens fünf Arbeitstage vor dem Tag der Gesellschafterversammlung am 23.01.2026 Bemerkungen zum Verschmelzungsplan übermitteln.\nBemerkungen sind unmittelbar gegenüber der Gesellschaft unter folgender Geschäftsanschrift zu übermitteln:\nauxalia WESTCAM Holding GmbH, Schellerdamm 16, 21079 Hamburg, Deutschland"
    },
    {
      "date": "2026-01-07",
      "id": "141718",
      "original_text": "Registerbekanntmachung nach dem Umwandlungsgesetz\nHamburg Amtsgericht Hamburg HRB 128013\nänd Ärztenachrichtendienst Verlags-AG – Hamburg",
      "type": "Registerbekanntmachung nach dem Umwandlungsgesetz",
      "state": "Hamburg",
      "amtsgericht": "Amtsgericht Hamburg",
      "registernummer": "HRB 128013",
      "registerart": "HRB",
      "company_name": "änd Ärztenachrichtendienst Verlags-AG",
      "company_seat": "Hamburg",
      "details": "07.01.2026 (Bekanntmachungsdatum)\n\nHamburg Amtsgericht Hamburg HRB 128013\nRegisterbekanntmachung nach dem Umwandlungsgesetz 07.01.2026 (Eintragungsdatum)\n\nänd Ärztenachrichtendienst Verlags-AG\nAktiengesellschaft\nHamburg\n\nAls nicht eingetragen wird bekannt gemacht:\nDen Gläubigern der an der Verschmelzung beteiligten Gesellschaften ist, wenn sie binnen sechs Monaten nach dem Tag, an dem die Eintragung der Verschmelzung in das Register des Sitzes desjenigen Rechtsträgers, dessen Gläubiger sie sind, nach § 19 Absatz 3 UmwG als bekannt gemacht gilt, ihren Anspruch nach Grund und Höhe schriftlich anmelden, Sicherheit zu leisten, soweit sie nicht Befriedigung verlangen können. Dieses Recht steht den Gläubigern jedoch nur zu, wenn sie glaubhaft machen, dass durch die Verschmelzung die Erfüllung ihrer Forderung gefährdet wird."
    },
    {
      "date": "2026-01-07",
      "id": "141719",
      "original_text": "Registerbekanntmachung nach dem Umwandlungsgesetz\nBaden-Württemberg Amtsgericht Stuttgart HRB 245460\nx - mas Weihnachtskarten GmbH – Mötzingen",
      "type": "Registerbekanntmachung nach dem Umwandlungsgesetz",
      "state": "Baden-Württemberg",
      "amtsgericht": "Amtsgericht Stuttgart",
      "registernummer": "HRB 245460",
      "registerart": "HRB",
      "company_name": "x - mas Weihnachtskarten GmbH",
      "company_seat": "Mötzingen",
      "details": "07.01.2026 (Bekanntmachungsdatum)\n\nBaden-Württemberg Amtsgericht Stuttgart HRB 245460\nRegisterbekanntmachung nach dem Umwandlungsgesetz 07.01.2026 (Eintragungsdatum)\n\nx - mas Weihnachtskarten GmbH\nGesellschaft mit beschränkter Haftung\nMötzingen\n\nAls nicht eingetragen wird bekanntgemacht:\nDen Gläubigern der an der Verschmelzung beteiligten Rechtsträger ist, wenn sie binnen sechs Monaten nach dem Tag, an dem die Eintragung der Verschmelzung in das Register des Sitzes desjenigen Rechtsträgers, dessen Gläubiger sie sind, nach § 19 Abs. 3 UmwG als bekanntgemacht gilt, ihren Anspruch nach Grund und Höhe schriftlich anmelden, Sicherheit zu leisten, soweit sie nicht Befriedigung verlangen können. Dieses Recht steht den Gläubigern jedoch nur zu, wenn sie glaubhaft machen, dass durch die Verschmelzung die Erfüllung ihrer Forderung gefährdet wird."
    },
    {
      "date": "2026-01-07",
      "id": "141720",
      "original_text": "Löschungsankündigung\nBaden-Württemberg Amtsgericht Stuttgart HRB 741621\nAschenputtel GmbH – Kornwestheim",
      "type": "Löschungsankündigung",
      "state": "Baden-Württemberg",
      "amtsgericht": "Amtsgericht Stuttgart",
      "registernummer": "HRB 741621",
      "registerart": "HRB",
      "company_name": "Aschenputtel GmbH",
      "company_seat": "Kornwestheim",
      "details": "07.01.2026 (Bekanntmachungsdatum)\n\nBaden-Württemberg Amtsgericht Stuttgart HRB 741621\nLöschungsankündigung\n\nAschenputtel GmbH\nGesellschaft mit beschränkter Haftung\nKornwestheim\n\nAls nicht eingetragen wird bekanntgemacht:\nDas Gericht beabsichtigt, die Gesellschaft wegen Vermögenslosigkeit im Handelsregister von Amts wegen nach § 394 FamFG zu löschen. Die Frist zur Geltendmachung eines Widerspruchs gegen die beabsichtigte Löschung ist auf zwei Monate ab Veröffentlichung bestimmt."
    },
    {
      "date": "2026-01-07",
      "id": "141721",
      "original_text": "Registerbekanntmachung nach dem Umwandlungsgesetz\nHamburg Amtsgericht Hamburg HRB 106907\nSIT Solution for IT-Payment GmbH – Hamburg",
      "type": "Registerbekanntmachung nach dem Umwandlungsgesetz",
      "state": "Hamburg",
      "amtsgericht": "Amtsgericht Hamburg",
      "registernummer": "HRB 106907",
      "registerart": "HRB",
      "company_name": "SIT Solution for IT-Payment GmbH",
      "company_seat": "Hamburg",
      "details": "07.01.2026 (Bekanntmachungsdatum)\n\nHamburg Amtsgericht Hamburg HRB 106907\nRegisterbekanntmachung nach dem Umwandlungsgesetz 07.01.2026 (Eintragungsdatum)\n\nSIT Solution for IT-Payment GmbH\nGesellschaft mit beschränkter Haftung\nHamburg\n\nAls nicht eingetragen wird bekannt gemacht:\nDen Gläubigern der an der Verschmelzung beteiligten Gesellschaften ist, wenn sie binnen sechs Monaten nach dem Tag, an dem die Eintragung der Verschmelzung in das Register des Sitzes desjenigen Rechtsträgers, dessen Gläubiger sie sind, nach § 19 Absatz 3 UmwG als bekannt gemacht gilt, ihren Anspruch nach Grund und Höhe schriftlich anmelden, Sicherheit zu leisten, soweit sie nicht Befriedigung verlangen können. Dieses Recht steht den Gläubigern jedoch nur zu, wenn sie glaubhaft machen, dass durch die Verschmelzung die Erfüllung ihrer Forderung gefährdet wird."
    },
    {
      "date": "2026-01-07",
      "id": "141722",
      "original_text": "Sonstige Registerbekanntmachung\nHamburg Amtsgericht Hamburg HRB 3072\nHamburger Hochbahn Aktiengesellschaft – Hamburg",
      "type": "Sonstige Registerbekanntmachung",
      "state": "Hamburg",
      "amtsgericht": "Amtsgericht Hamburg",
      "registernummer": "HRB 3072",
      "registerart": "HRB",
      "company_name": "Hamburger Hochbahn Aktiengesellschaft",
      "company_seat": "Hamburg",
      "details": "07.01.2026 (Bekanntmachungsdatum)\n\nHamburg Amtsgericht Hamburg HRB 3072\nSonstige Registerbekanntmachung\n\nHamburger Hochbahn Aktiengesellschaft\nAktiengesellschaft\nHamburg\n\nAls nicht eingetragen wird bekannt gemacht: Liste des Aufsichtsrats wurde eingereicht."
    },
    {
      "date": "2026-01-07",
      "id": "141723",
      "original_text": "Löschungsankündigung\nMecklenburg-Vorpommern Amtsgericht Neubrandenburg HRB 20937\nIBI Immobilien GmbH – Ferdinandshof",
      "type": "Löschungsankündigung",
      "state": "Mecklenburg-Vorpommern",
      "amtsgericht": "Amtsgericht Neubrandenburg",
      "registernummer": "HRB 20937",
      "registerart": "HRB",
      "company_name": "IBI Immobilien GmbH",
      "company_seat": "Ferdinandshof",
      "details": "07.01.2026 (Bekanntmachungsdatum)\n\nMecklenburg-Vorpommern Amtsgericht Neubrandenburg HRB 20937\nLöschungsankündigung 07.01.2026 (Eintragungsdatum)\n\nIBI Immobilien GmbH\nGesellschaft mit beschränkter Haftung\nFerdinandshof\n\nDas Registergericht beabsichtigt, die im Handelsregister eingetragene Gesellschaft von Amts wegen nach § 394 FamFG zu löschen. Die Frist zur Erhebung eines Widerspruchs gegen die beabsichtigte Löschung wird auf drei Monate festgesetzt."
    },
    {
      "date": "2026-01-07",
      "id": "141724",
      "original_text": "Löschungsankündigung\nBerlin Amtsgericht Berlin (Charlottenburg) HRB 218654\nBerow UG (haftungsbeschränkt) – Berlin",
      "type": "Löschungsankündigung",
      "state": "Berlin",
      "amtsgericht": "Amtsgericht Berlin (Charlottenburg)",
      "registernummer": "HRB 218654",
      "registerart": "HRB",
      "company_name": "Berow UG (haftungsbeschränkt)",
      "company_seat": "Berlin",
      "details": "07.01.2026 (Bekanntmachungsdatum)\n\nBerlin Amtsgericht Berlin (Charlottenburg) HRB 218654\nLöschungsankündigung\n\nBerow UG (haftungsbeschränkt)\nGesellschaft mit beschränkter Haftung\nBerlin\n\nBei der nachstehenden Gesellschaft wird das Amtslöschungsverfahren gemäß § 394 FamFG eingeleitet. Widerspruchsfrist 6 Wochen"
    },
    {
      "date": "2026-01-07",
      "id": "141725",
      "original_text": "Löschungsankündigung\nBaden-Württemberg Amtsgericht Mannheim HRB 705502\nMK Drehtechnik GmbH – Ötisheim",
      "type": "Löschungsankündigung",
      "state": "Baden-Württemberg",
      "amtsgericht": "Amtsgericht Mannheim",
      "registernummer": "HRB 705502",
      "registerart": "HRB",
      "company_name": "MK Drehtechnik GmbH",
      "company_seat": "Ötisheim",
      "details": "07.01.2026 (Bekanntmachungsdatum)\n\nBaden-Württemberg Amtsgericht Mannheim HRB 705502\nLöschungsankündigung\n\nMK Drehtechnik GmbH\nGesellschaft mit beschränkter Haftung\nÖtisheim\n\nDas Gericht beabsichtigt, die Gesellschaft wegen Vermögenslosigkeit im Handelsregister von Amts wegen nach § 394 FamFG zu löschen. Die Frist zur Geltendmachung eines Widerspruchs gegen die beabsichtigte Löschung ist auf einen Monat ab Veröffentlichung bestimmt."
    },
    {
      "date": "2026-01-07",
      "id": "141726",
      "original_text": "Löschungsankündigung\nBaden-Württemberg Amtsgericht Mannheim HRB 739385\nLucas Hertweck Verwaltungs GmbH – Karlsruhe",
      "type": "Löschungsankündigung",
      "state": "Baden-Württemberg",
      "amtsgericht": "Amtsgericht Mannheim",
      "registernummer": "HRB 739385",
      "registerart": "HRB",
      "company_name": "Lucas Hertweck Verwaltungs GmbH",
      "company_seat": "Karlsruhe",
      "details": "07.01.2026 (Bekanntmachungsdatum)\n\nBaden-Württemberg Amtsgericht Mannheim HRB 739385\nLöschungsankündigung\n\nLucas Hertweck Verwaltungs GmbH\nGesellschaft mit beschränkter Haftung\nKarlsruhe\n\nDas Gericht beabsichtigt, die Gesellschaft wegen Vermögenslosigkeit im Handelsregister von Amts wegen nach § 394 FamFG zu löschen. Die Frist zur Geltendmachung eines Widerspruchs gegen die beabsichtigte Löschung ist auf einen Monat ab Veröffentlichung bestimmt."
    },
    {
      "date": "2026-01-07",
      "id": "141727",
      "original_text": "Registerbekanntmachung nach dem Umwandlungsgesetz\nSchleswig-Holstein Amtsgericht Lübeck HRB 248 GE\nGeesthachter Reisedienst Zerbin GmbH – Geesthacht",
      "type": "Registerbekanntmachung nach dem Umwandlungsgesetz",
      "state": "Schleswig-Holstein",
      "amtsgericht": "Amtsgericht Lübeck",
      "registernummer": "HRB 248 GE",
      "registerart": "HRB",
      "company_name": "Geesthachter Reisedienst Zerbin GmbH",
      "company_seat": "Geesthacht",
      "details": "07.01.2026 (Bekanntmachungsdatum)\n\nSchleswig-Holstein Amtsgericht Lübeck HRB 248 GE\nRegisterbekanntmachung nach dem Umwandlungsgesetz 06.01.2026 (Eintragungsdatum)\n\nGeesthachter Reisedienst Zerbin GmbH\nGesellschaft mit beschränkter Haftung\nGeesthacht\n\nZu Eintragungsnummer 11 vom 06.01.2026 wird als nicht eingetragen veröffentlicht: Den Gläubigern der an der Verschmelzung beteiligten Rechtsträger ist, wenn sie binnen sechs Monaten nach dem Tag, an dem die Eintragung der Verschmelzung in das Register des Sitzes desjenigen Rechtsträgers, dessen Gläubiger sie sind, als bekannt gemacht gilt, ihren Anspruch nach Grund und Höhe schriftlich anmelden, Sicherheit zu leisten, soweit sie nicht Befriedigung verlangen können. Dieses Recht steht den Gläubigern jedoch nur zu, wenn sie glaubhaft machen, dass durch die Verschmelzung die Erfüllung ihrer Forderung gefährdet wird."
    },
    {
      "date": "2026-01-07",
      "id": "141728",
      "original_text": "Sonstige Registerbekanntmachung\nBaden-Württemberg Amtsgericht Freiburg HRB 391562\nZehnder Group Deutschland GmbH – Lahr",
      "type": "Sonstige Registerbekanntmachung",
      "state": "Baden-Württemberg",
      "amtsgericht": "Amtsgericht Freiburg",
      "registernummer": "HRB 391562",
      "registerart": "HRB",
      "company_name": "Zehnder Group Deutschland GmbH",
      "company_seat": "Lahr",
      "details": "07.01.2026 (Bekanntmachungsdatum)\n\nBaden-Württemberg Amtsgericht Freiburg HRB 391562\nSonstige Registerbekanntmachung 07.01.2026 (Eintragungsdatum)\n\nZehnder Group Deutschland GmbH\nGesellschaft mit beschränkter Haftung\nLahr\n\nAls nicht eingetragen wird bekanntgemacht:\nDen Gläubigern der Gesellschaft, deren Forderungen begründet worden sind, bevor die Eintragung der Beendigung des Vertrages in das Handelsregister nach § 10 HGB als bekanntgemacht gilt, ist vom anderen Vertragsteil Sicherheit zu leisten, wenn sie sich binnen sechs Monaten nach der Bekanntmachung zu diesem Zweck bei ihm melden."
    },
    {
      "date": "2026-01-07",
      "id": "141729",
      "original_text": "Löschungsankündigung\nBerlin Amtsgericht Berlin (Charlottenburg) HRB 207272\nSIRABON Treuhand- und Verwaltungs GmbH – Berlin",
      "type": "Löschungsankündigung",
      "state": "Berlin",
      "amtsgericht": "Amtsgericht Berlin (Charlottenburg)",
      "registernummer": "HRB 207272",
      "registerart": "HRB",
      "company_name": "SIRABON Treuhand- und Verwaltungs GmbH",
      "company_seat": "Berlin",
      "details": "07.01.2026 (Bekanntmachungsdatum)\n\nBerlin Amtsgericht Berlin (Charlottenburg) HRB 207272\nLöschungsankündigung\n\nSIRABON Treuhand- und Verwaltungs GmbH\nGesellschaft mit beschränkter Haftung\nBerlin\n\nBei der nachstehenden Gesellschaft wird das Amtslöschungsverfahren gemäß § 394 FamFG eingeleitet. Widerspruchsfrist: 6 Wochen."
    },
    {
      "date": "2026-01-07",
      "id": "141730",
      "original_text": "Löschungsankündigung\nBerlin Amtsgericht Berlin (Charlottenburg) HRB 256050\nLIFE SCIENCE PEOPLE GmbH – Berlin",
      "type": "Löschungsankündigung",
      "state": "Berlin",
      "amtsgericht": "Amtsgericht Berlin (Charlottenburg)",
      "registernummer": "HRB 256050",
      "registerart": "HRB",
      "company_name": "LIFE SCIENCE PEOPLE GmbH",
      "company_seat": "Berlin",
      "details": "07.01.2026 (Bekanntmachungsdatum)\n\nBerlin Amtsgericht Berlin (Charlottenburg) HRB 256050\nLöschungsankündigung\n\nLIFE SCIENCE PEOPLE GmbH\nGesellschaft mit beschränkter Haftung\nBerlin\n\nBei der nachstehenden Gesellschaft wird das Amtslöschungsverfahren gemäß § 394 FamFG eingeleitet. Widerspruchsfrist 6 Wochen"
    },
    {
      "date": "2026-01-07",
      "id": "141731",
      "original_text": "Einreichung neuer Dokumente\nSchleswig-Holstein Amtsgericht Pinneberg HRB 1670 EL\nGesellschaft für Abfallwirtschaft und Abfallbehandlung mbH - GAB - – Tornesch/Ahrenlohe",
      "type": "Einreichung neuer Dokumente",
      "state": "Schleswig-Holstein",
      "amtsgericht": "Amtsgericht Pinneberg",
      "registernummer": "HRB 1670 EL",
      "registerart": "HRB",
      "company_name": "Gesellschaft für Abfallwirtschaft und Abfallbehandlung mbH - GAB -",
      "company_seat": "Tornesch/Ahrenlohe",
      "details": "07.01.2026 (Bekanntmachungsdatum)\n\nSchleswig-Holstein Amtsgericht Pinneberg HRB 1670 EL\nEinreichung neuer Dokumente\n\nGesellschaft für Abfallwirtschaft und Abfallbehandlung mbH - GAB -\nGesellschaft mit beschränkter Haftung\nTornesch/Ahrenlohe\n\nAls nicht eingetragen wird veröffentlicht: Es ist eine neue Liste der Aufsichtsratsmitglieder gemäß § 52 Abs. 3 2 Hs. GmbHG i.V.m. § 10 HGB zum Handelsregister eingereicht worden."
    },
    {
      "date": "2026-01-07",
      "id": "141732",
      "original_text": "Registerbekanntmachung nach dem Umwandlungsgesetz\nBaden-Württemberg Amtsgericht Stuttgart HRB 302328\nValeo Auto-Electric GmbH – Bietigheim-Bissingen",
      "type": "Registerbekanntmachung nach dem Umwandlungsgesetz",
      "state": "Baden-Württemberg",
      "amtsgericht": "Amtsgericht Stuttgart",
      "registernummer": "HRB 302328",
      "registerart": "HRB",
      "company_name": "Valeo Auto-Electric GmbH",
      "company_seat": "Bietigheim-Bissingen",
      "details": "07.01.2026 (Bekanntmachungsdatum)\n\nBaden-Württemberg Amtsgericht Stuttgart HRB 302328\nRegisterbekanntmachung nach dem Umwandlungsgesetz 07.01.2026 (Eintragungsdatum)\n\nValeo Auto-Electric GmbH\nGesellschaft mit beschränkter Haftung\nBietigheim-Bissingen\n\nDen Gläubigern der an der Ausgliederung beteiligten Rechtsträger ist, wenn sie binnen sechs Monaten nach dem Tag, an dem die Eintragung der Ausgliederung in das Register des Sitzes desjenigen Rechtsträgers, dessen Gläubiger sie sind, nach § 19 Abs. 3 UmwG als bekanntgemacht gilt, ihren Anspruch nach Grund und Höhe schriftlich anmelden, Sicherheit zu leisten, soweit sie nicht Befriedigung verlangen können. Dieses Recht steht den Gläubigern jedoch nur zu, wenn sie glaubhaft machen, dass durch die Ausgliederung die Erfüllung ihrer Forderung gefährdet wird."
    },
    {
      "date": "2026-01-07",
      "id": "141733",
      "original_text": "Löschungsankündigung\nSachsen Amtsgericht Dresden HRB 10956\nPetersen Immobilien GmbH – Dresden",
      "type": "Löschungsankündigung",
      "state": "Sachsen",
      "amtsgericht": "Amtsgericht Dresden",
      "registernummer": "HRB 10956",
      "registerart": "HRB",
      "company_name": "Petersen Immobilien GmbH",
      "company_seat": "Dresden",
      "details": "07.01.2026 (Bekanntmachungsdatum)\n\nSachsen Amtsgericht Dresden HRB 10956\nLöschungsankündigung\n\nPetersen Immobilien GmbH\nGesellschaft mit beschränkter Haftung\nDresden\n\nDas Registergericht beabsichtigt, die im Handelsregister eingetragene Gesellschaft von Amts wegen nach § 394 FamFG zu löschen. Die Frist zu Erhebung eines Widerspruchs gegen die beabsichtigte Löschung wird auf einen Monat festgesetzt."
    },
    {
      "date": "2026-01-07",
      "id": "141734",
      "original_text": "Sonstige Registerbekanntmachung\nSachsen Amtsgericht Dresden HRB 17704\nJuCo Soziale Arbeit gemeinnützige Gesellschaft mit beschränkter Haftung – Coswig",
      "type": "Sonstige Registerbekanntmachung",
      "state": "Sachsen",
      "amtsgericht": "Amtsgericht Dresden",
      "registernummer": "HRB 17704",
      "registerart": "HRB",
      "company_name": "JuCo Soziale Arbeit gemeinnützige Gesellschaft mit beschränkter Haftung",
      "company_seat": "Coswig",
      "details": "07.01.2026 (Bekanntmachungsdatum)\n\nSachsen Amtsgericht Dresden HRB 17704\nSonstige Registerbekanntmachung\n\nJuCo Soziale Arbeit gemeinnützige Gesellschaft mit beschränkter Haftung\nGesellschaft mit beschränkter Haftung\nCoswig\n\nAm 05.01.2026 wurde beim Handelsregister des Amtsgerichts Dresden die Liste der Mitglieder des Aufsichtsrats gemäß § 52 GmbHG eingereicht."
    },
    {
      "date": "2026-01-07",
      "id": "141735",
      "original_text": "Sonstige Registerbekanntmachung\nSachsen Amtsgericht Dresden HRB 4473\nKAT Kamenzer Agro Trans GmbH – Kamenz",
      "type": "Sonstige Registerbekanntmachung",
      "state": "Sachsen",
      "amtsgericht": "Amtsgericht Dresden",
      "registernummer": "HRB 4473",
      "registerart": "HRB",
      "company_name": "KAT Kamenzer Agro Trans GmbH",
      "company_seat": "Kamenz",
      "details": "07.01.2026 (Bekanntmachungsdatum)\n\nSachsen Amtsgericht Dresden HRB 4473\nSonstige Registerbekanntmachung 07.01.2026 (Eintragungsdatum)\n\nKAT Kamenzer Agro Trans GmbH\nGesellschaft mit beschränkter Haftung\nKamenz\n\nDen Gläubigern der Gesellschaft, deren Forderungen begründet worden sind bevor die Eintragung der Beendigung des Beherrschungs- und Gewinnabführungsvertrages in das Handelsregister nach § 10 des Handelsgesetzbuches als bekanntgemacht gilt, hat der andere Vertragsteil Sicherheit zu leisten, wenn sie sich binnen sechs Monaten nach der Bekanntmachung der Eintragung zu diesem Zweck bei ihm melden."
    },
    {
      "date": "2026-01-07",
      "id": "141736",
      "original_text": "Einreichung neuer Dokumente\nSachsen Amtsgericht Leipzig HRB 21820\nSchaubühne Lindenfels Aktiengesellschaft – Leipzig",
      "type": "Einreichung neuer Dokumente",
      "state": "Sachsen",
      "amtsgericht": "Amtsgericht Leipzig",
      "registernummer": "HRB 21820",
      "registerart": "HRB",
      "company_name": "Schaubühne Lindenfels Aktiengesellschaft",
      "company_seat": "Leipzig",
      "details": "07.01.2026 (Bekanntmachungsdatum)\n\nSachsen Amtsgericht Leipzig HRB 21820\nEinreichung neuer Dokumente\n\nSchaubühne Lindenfels Aktiengesellschaft\nAktiengesellschaft\nLeipzig\n\nAm 28.10.2025 wurde beim Handelsregister des Amtsgerichts Leipzig die Liste der Mitglieder des Aufsichtsrats gemäß § 106 AktG eingereicht."
    },
    {
      "date": "2026-01-07",
      "id": "141737",
      "original_text": "Löschungsankündigung\nSachsen Amtsgericht Dresden HRB 33009\nSSTS UG (haftungsbeschränkt) – Klipphausen",
      "type": "Löschungsankündigung",
      "state": "Sachsen",
      "amtsgericht": "Amtsgericht Dresden",
      "registernummer": "HRB 33009",
      "registerart": "HRB",
      "company_name": "SSTS UG (haftungsbeschränkt)",
      "company_seat": "Klipphausen",
      "details": "07.01.2026 (Bekanntmachungsdatum)\n\nSachsen Amtsgericht Dresden HRB 33009\nLöschungsankündigung\n\nSSTS UG (haftungsbeschränkt)\nGesellschaft mit beschränkter Haftung\nKlipphausen\n\nDas Registergericht beabsichtigt, die im Handelsregister eingetragene Gesellschaft von Amts wegen nach § 394 FamFG zu löschen. Die Frist zu Erhebung eines Widerspruchs gegen die beabsichtigte Löschung wird auf einen Monat festgesetzt."
    },
    {
      "date": "2026-01-07",
      "id": "141738",
      "original_text": "Löschungsankündigung\nSachsen Amtsgericht Dresden HRB 13560\nIMU Bau GmbH – Gröbern",
      "type": "Löschungsankündigung",
      "state": "Sachsen",
      "amtsgericht": "Amtsgericht Dresden",
      "registernummer": "HRB 13560",
      "registerart": "HRB",
      "company_name": "IMU Bau GmbH",
      "company_seat": "Gröbern",
      "details": "07.01.2026 (Bekanntmachungsdatum)\n\nSachsen Amtsgericht Dresden HRB 13560\nLöschungsankündigung\n\nIMU Bau GmbH\nGesellschaft mit beschränkter Haftung\nGröbern\n\nDas Registergericht beabsichtigt, die im Handelsregister eingetragene Gesellschaft von Amts wegen nach § 394 FamFG zu löschen. Die Frist zu Erhebung eines Widerspruchs gegen die beabsichtigte Löschung wird auf einen Monat festgesetzt."
    },
    {
      "date": "2026-01-07",
      "id": "141739",
      "original_text": "Löschungsankündigung\nSachsen Amtsgericht Dresden HRB 44169\nBuD UG (haftungsbeschränkt) – Dresden",
      "type": "Löschungsankündigung",
      "state": "Sachsen",
      "amtsgericht": "Amtsgericht Dresden",
      "registernummer": "HRB 44169",
      "registerart": "HRB",
      "company_name": "BuD UG (haftungsbeschränkt)",
      "company_seat": "Dresden",
      "details": "07.01.2026 (Bekanntmachungsdatum)\n\nSachsen Amtsgericht Dresden HRB 44169\nLöschungsankündigung\n\nBuD UG (haftungsbeschränkt)\nGesellschaft mit beschränkter Haftung\nDresden\n\nDas Registergericht beabsichtigt, die im Handelsregister eingetragene Gesellschaft von Amts wegen nach § 394 FamFG zu löschen. Die Frist zu Erhebung eines Widerspruchs gegen die beabsichtigte Löschung wird auf einen Monat festgesetzt."
    },
    {
      "date": "2026-01-07",
      "id": "141740",
      "original_text": "Sonstige Registerbekanntmachung\nSachsen Amtsgericht Dresden HRB 17360\nI T L Eisenbahngesellschaft mbH – Dresden",
      "type": "Sonstige Registerbekanntmachung",
      "state": "Sachsen",
      "amtsgericht": "Amtsgericht Dresden",
      "registernummer": "HRB 17360",
      "registerart": "HRB",
      "company_name": "I T L Eisenbahngesellschaft mbH",
      "company_seat": "Dresden",
      "details": "07.01.2026 (Bekanntmachungsdatum)\n\nSachsen Amtsgericht Dresden HRB 17360\nSonstige Registerbekanntmachung 07.01.2026 (Eintragungsdatum)\n\nI T L Eisenbahngesellschaft mbH\nGesellschaft mit beschränkter Haftung\nDresden\n\nDen Gläubigern der Gesellschaft, deren Forderungen begründet worden sind bevor die Eintragung der Beendigung des Gewinnabführungsvertrages in das Handelsregister nach § 10 des Handelsgesetzbuches als bekanntgemacht gilt, hat der andere Vertragsteil Sicherheit zu leisten, wenn sie sich binnen sechs Monaten nach der Bekanntmachung der Eintragung zu diesem Zweck bei ihm melden."
    },
    {
      "date": "2026-01-07",
      "id": "141741",
      "original_text": "Einreichung neuer Dokumente\nSachsen Amtsgericht Dresden HRB 46129\nMeißener Stadtwerke Holding GmbH – Meißen",
      "type": "Einreichung neuer Dokumente",
      "state": "Sachsen",
      "amtsgericht": "Amtsgericht Dresden",
      "registernummer": "HRB 46129",
      "registerart": "HRB",
      "company_name": "Meißener Stadtwerke Holding GmbH",
      "company_seat": "Meißen",
      "details": "07.01.2026 (Bekanntmachungsdatum)\n\nSachsen Amtsgericht Dresden HRB 46129\nEinreichung neuer Dokumente\n\nMeißener Stadtwerke Holding GmbH\nGesellschaft mit beschränkter Haftung\nMeißen\n\nAm 05.01.2026 wurde beim Handelsregister des Amtsgerichts Dresden die Liste der Mitglieder des Aufsichtsrats gemäß § 52 GmbHG eingereicht."
    },
    {
      "date": "2026-01-07",
      "id": "141742",
      "original_text": "Löschungsankündigung\nNiedersachsen Amtsgericht Stadthagen HRB 202275\nINDOO Deutschland UG (haftungsbeschränkt) – Obernkirchen",
      "type": "Löschungsankündigung",
      "state": "Niedersachsen",
      "amtsgericht": "Amtsgericht Stadthagen",
      "registernummer": "HRB 202275",
      "registerart": "HRB",
      "company_name": "INDOO Deutschland UG (haftungsbeschränkt)",
      "company_seat": "Obernkirchen",
      "details": "07.01.2026 (Bekanntmachungsdatum)\n\nNiedersachsen Amtsgericht Stadthagen HRB 202275\nLöschungsankündigung\n\nINDOO Deutschland UG (haftungsbeschränkt)\nGesellschaft mit beschränkter Haftung\nObernkirchen\n\nDas Registergericht beabsichtigt, die Gesellschaft von Amts wegen nach § 394 FamFG zu löschen. Die Frist zur Erhebung eines Widerspruchs ist auf 1 Monat ab dieser Registerbekanntmachung festgesetzt."
    },
    {
      "date": "2026-01-07",
      "id": "141743",
      "original_text": "Registerbekanntmachung nach dem Umwandlungsgesetz\nNiedersachsen Amtsgericht Tostedt HRB 211407\nKolibri Immobilien GmbH – Heeslingen",
      "type": "Registerbekanntmachung nach dem Umwandlungsgesetz",
      "state": "Niedersachsen",
      "amtsgericht": "Amtsgericht Tostedt",
      "registernummer": "HRB 211407",
      "registerart": "HRB",
      "company_name": "Kolibri Immobilien GmbH",
      "company_seat": "Heeslingen",
      "details": "07.01.2026 (Bekanntmachungsdatum)\n\nNiedersachsen Amtsgericht Tostedt HRB 211407\nRegisterbekanntmachung nach dem Umwandlungsgesetz 07.01.2026 (Eintragungsdatum)\n\nKolibri Immobilien GmbH\nGesellschaft mit beschränkter Haftung\nHeeslingen\n\nDen Gläubigern der an der Verschmelzung beteiligten Rechtsträger ist, wenn sie binnen sechs Monaten nach dem Tag, an dem die Eintragung der Verschmelzung in das Register des Sitzes desjenigen Rechtsträgers, dessen Gläubiger sie sind, nach § 19  Abs.  3 UmwG als bekannt gemacht gilt, ihren Anspruch nach Grund und Höhe schriftlich anmelden, Sicherheit zu leisten, soweit sie nicht Befriedigung verlangen können. Dieses Recht steht den Gläubigern jedoch nur zu, wenn sie glaubhaft machen, dass durch die Verschmelzung die Erfüllung der Forderung gefährdet wird."
    },
    {
      "date": "2026-01-07",
      "id": "141744",
      "original_text": "Registerbekanntmachung nach dem Umwandlungsgesetz\nNiedersachsen Amtsgericht Osnabrück HRB 221860\nKRAVOX UG (haftungsbeschränkt) – Belm",
      "type": "Registerbekanntmachung nach dem Umwandlungsgesetz",
      "state": "Niedersachsen",
      "amtsgericht": "Amtsgericht Osnabrück",
      "registernummer": "HRB 221860",
      "registerart": "HRB",
      "company_name": "KRAVOX UG (haftungsbeschränkt)",
      "company_seat": "Belm",
      "details": "07.01.2026 (Bekanntmachungsdatum)\n\nNiedersachsen Amtsgericht Osnabrück HRB 221860\nRegisterbekanntmachung nach dem Umwandlungsgesetz 07.01.2026 (Eintragungsdatum)\n\nKRAVOX UG (haftungsbeschränkt)\nGesellschaft mit beschränkter Haftung\nBelm\n\nDen Gläubigern der an der Verschmelzung beteiligten Rechtsträger ist, wenn sie binnen sechs Monaten nach dem Tag, an dem die Eintragung der Verschmelzung in das Register des Sitzes desjenigen Rechtsträgers, dessen Gläubiger sie sind, nach § 19  Abs.  3 UmwG als bekannt gemacht gilt, ihren Anspruch nach Grund und Höhe schriftlich anmelden, Sicherheit zu leisten, soweit sie nicht Befriedigung verlangen können. Dieses Recht steht den Gläubigern jedoch nur zu, wenn sie glaubhaft machen, dass durch die Verschmelzung die Erfüllung der Forderung gefährdet wird."
    },
    {
      "date": "2026-01-07",
      "id": "141745",
      "original_text": "Löschungsankündigung\nNiedersachsen Amtsgericht Osnabrück HRB 213854\nGP Cars International GmbH – Nordhorn",
      "type": "Löschungsankündigung",
      "state": "Niedersachsen",
      "amtsgericht": "Amtsgericht Osnabrück",
      "registernummer": "HRB 213854",
      "registerart": "HRB",
      "company_name": "GP Cars International GmbH",
      "company_seat": "Nordhorn",
      "details": "07.01.2026 (Bekanntmachungsdatum)\n\nNiedersachsen Amtsgericht Osnabrück HRB 213854\nLöschungsankündigung 07.01.2025 (Eintragungsdatum)\n\nGP Cars International GmbH\nGesellschaft mit beschränkter Haftung\nNordhorn\n\nDas Registergericht beabsichtigt, die Gesellschaft von Amts wegen nach § 394 FamFG wegen Vermögenslosigkeit zu löschen. Die Frist zur Erhebung eines Widerspruchs ist auf 1 Monat ab dieser Registerbekanntmachung festgesetzt."
    },
    {
      "date": "2026-01-07",
      "id": "141746",
      "original_text": "Einreichung neuer Dokumente\nRheinland-Pfalz Amtsgericht Zweibrücken HRB 23383\nStadtwerke Pirmasens Versorgungs GmbH – Pirmasens",
      "type": "Einreichung neuer Dokumente",
      "state": "Rheinland-Pfalz",
      "amtsgericht": "Amtsgericht Zweibrücken",
      "registernummer": "HRB 23383",
      "registerart": "HRB",
      "company_name": "Stadtwerke Pirmasens Versorgungs GmbH",
      "company_seat": "Pirmasens",
      "details": "07.01.2026 (Bekanntmachungsdatum)\n\nRheinland-Pfalz Amtsgericht Zweibrücken HRB 23383\nEinreichung neuer Dokumente\n\nStadtwerke Pirmasens Versorgungs GmbH\nGesellschaft mit beschränkter Haftung\nPirmasens\n\nDem Registergericht ist eine neue Liste der Mitglieder des Aufsichtsrates eingereicht worden."
    },
    {
      "date": "2026-01-07",
      "id": "141747",
      "original_text": "Sonstige Registerbekanntmachung\nRheinland-Pfalz Amtsgericht Koblenz HRB 27132\ndocmetric GmbH – Koblenz",
      "type": "Sonstige Registerbekanntmachung",
      "state": "Rheinland-Pfalz",
      "amtsgericht": "Amtsgericht Koblenz",
      "registernummer": "HRB 27132",
      "registerart": "HRB",
      "company_name": "docmetric GmbH",
      "company_seat": "Koblenz",
      "details": "07.01.2026 (Bekanntmachungsdatum)\n\nRheinland-Pfalz Amtsgericht Koblenz HRB 27132\nSonstige Registerbekanntmachung 07.01.2026 (Eintragungsdatum)\n\ndocmetric GmbH\nGesellschaft mit beschränkter Haftung\nKoblenz\n\nDen Gläubigern der Gesellschaft, deren Forderungen begründet worden sind, bevor die Eintragung der Beendigung des Vertrages in das Handelsregister nach § 10 des Handelsgesetzbuches als bekanntgemacht gilt, hat der andere Vertragsteil Sicherheit zu leisten, wenn sie sich binnen sechs Monaten nach der Bekanntmachung der Eintragung zu diesem Zweck bei ihm melden."
    },
    {
      "date": "2026-01-07",
      "id": "141748",
      "original_text": "Löschungsankündigung\nNordrhein-Westfalen Amtsgericht Siegen HRB 11263\nTector Stuck und Putz GmbH – Siegen",
      "type": "Löschungsankündigung",
      "state": "Nordrhein-Westfalen",
      "amtsgericht": "Amtsgericht Siegen",
      "registernummer": "HRB 11263",
      "registerart": "HRB",
      "company_name": "Tector Stuck und Putz GmbH",
      "company_seat": "Siegen",
      "details": "07.01.2026 (Bekanntmachungsdatum)\n\nNordrhein-Westfalen Amtsgericht Siegen HRB 11263\nLöschungsankündigung\n\nTector Stuck und Putz GmbH\nGesellschaft mit beschränkter Haftung\nSiegen\n\nDas Registergericht beabsichtigt die Gesellschaft von Amts wegen nach § 394 FamFG zu löschen. Die Frist zur Erhebung eines Widerspruchs ist auf drei Monate festgesetzt."
    },
    {
      "date": "2026-01-07",
      "id": "141749",
      "original_text": "Einreichung neuer Dokumente\nNordrhein-Westfalen Amtsgericht Köln HRB 56235\nScherzer & Co. Aktiengesellschaft – Köln",
      "type": "Einreichung neuer Dokumente",
      "state": "Nordrhein-Westfalen",
      "amtsgericht": "Amtsgericht Köln",
      "registernummer": "HRB 56235",
      "registerart": "HRB",
      "company_name": "Scherzer & Co. Aktiengesellschaft",
      "company_seat": "Köln",
      "details": "07.01.2026 (Bekanntmachungsdatum)\n\nNordrhein-Westfalen Amtsgericht Köln HRB 56235\nEinreichung neuer Dokumente 07.01.2026 (Eintragungsdatum)\n\nScherzer & Co. Aktiengesellschaft\nAktiengesellschaft\nKöln\n\nDem Registergericht ist eine neue Liste der Mitglieder des Aufsichtsrates eingereicht worden."
    },
    {
      "date": "2026-01-07",
      "id": "141750",
      "original_text": "Registerbekanntmachung nach dem Umwandlungsgesetz\nBremen Amtsgericht Bremen HRB 29706\nDRETTMANN International GmbH – Bremen",
      "type": "Registerbekanntmachung nach dem Umwandlungsgesetz",
      "state": "Bremen",
      "amtsgericht": "Amtsgericht Bremen",
      "registernummer": "HRB 29706",
      "registerart": "HRB",
      "company_name": "DRETTMANN International GmbH",
      "company_seat": "Bremen",
      "details": "07.01.2026 (Bekanntmachungsdatum)\n\nBremen Amtsgericht Bremen HRB 29706\nRegisterbekanntmachung nach dem Umwandlungsgesetz 23.12.2025 (Eintragungsdatum)\n\nDRETTMANN International GmbH\nGesellschaft mit beschränkter Haftung\nBremen\n\nZu Eintragungsnummer 3 vom 23.12.2025 wird als nicht eingetragen veröffentlicht: Den Gläubigern der an der Verschmelzung beteiligten Rechtsträger ist, wenn sie binnen sechs Monaten nach dem Tag, an dem die Eintragung der Verschmelzung in das Register des Sitzes desjenigen Rechtsträgers, dessen Gläubiger sie sind, als bekannt gemacht gilt, ihren Anspruch nach Grund und Höhe schriftlich anmelden, Sicherheit zu leisten, soweit sie nicht Befriedigung verlangen können. Dieses Recht steht den Gläubigern jedoch nur zu, wenn sie glaubhaft machen, dass durch die Verschmelzung die Erfüllung ihrer Forderung gefährdet wird. Das Recht, Sicherheitsleistung zu verlangen, steht Gläubigern nicht zu, die im Falle der Insolvenz ein Recht auf vorzugsweise Befriedigung aus einer Deckungsmasse haben, die nach gesetzlicher Vorschrift zu ihrem Schutz errichtet und staatlich überwacht ist."
    },
    {
      "date": "2026-01-07",
      "id": "141751",
      "original_text": "Registerbekanntmachung nach dem Umwandlungsgesetz\nBremen Amtsgericht Bremen HRB 28899\nDrettmann Yachts GmbH – Bremen",
      "type": "Registerbekanntmachung nach dem Umwandlungsgesetz",
      "state": "Bremen",
      "amtsgericht": "Amtsgericht Bremen",
      "registernummer": "HRB 28899",
      "registerart": "HRB",
      "company_name": "Drettmann Yachts GmbH",
      "company_seat": "Bremen",
      "details": "07.01.2026 (Bekanntmachungsdatum)\n\nBremen Amtsgericht Bremen HRB 28899\nRegisterbekanntmachung nach dem Umwandlungsgesetz 23.12.2025 (Eintragungsdatum)\n\nDrettmann Yachts GmbH\nGesellschaft mit beschränkter Haftung\nBremen\n\nZu Eintragungsnummer 2 vom 23.12.2025 wird als nicht eingetragen veröffentlicht: Den Gläubigern der an der Verschmelzung beteiligten Rechtsträger ist, wenn sie binnen sechs Monaten nach dem Tag, an dem die Eintragung der Verschmelzung in das Register des Sitzes desjenigen Rechtsträgers, dessen Gläubiger sie sind, als bekannt gemacht gilt, ihren Anspruch nach Grund und Höhe schriftlich anmelden, Sicherheit zu leisten, soweit sie nicht Befriedigung verlangen können. Dieses Recht steht den Gläubigern jedoch nur zu, wenn sie glaubhaft machen, dass durch die Verschmelzung die Erfüllung ihrer Forderung gefährdet wird. Das Recht, Sicherheitsleistung zu verlangen, steht Gläubigern nicht zu, die im Falle der Insolvenz ein Recht auf vorzugsweise Befriedigung aus einer Deckungsmasse haben, die nach gesetzlicher Vorschrift zu ihrem Schutz errichtet und staatlich überwacht ist."
    },
    {
      "date": "2026-01-07",
      "id": "141752",
      "original_text": "Löschungsankündigung\nNordrhein-Westfalen Amtsgericht Kleve HRB 19694\nKonstruktivBau-Management UG (haftungsbeschränkt) – Moers",
      "type": "Löschungsankündigung",
      "state": "Nordrhein-Westfalen",
      "amtsgericht": "Amtsgericht Kleve",
      "registernummer": "HRB 19694",
      "registerart": "HRB",
      "company_name": "KonstruktivBau-Management UG (haftungsbeschränkt)",
      "company_seat": "Moers",
      "details": "07.01.2026 (Bekanntmachungsdatum)\n\nNordrhein-Westfalen Amtsgericht Kleve HRB 19694\nLöschungsankündigung\n\nKonstruktivBau-Management UG (haftungsbeschränkt)\nGesellschaft mit beschränkter Haftung\nMoers\n\nDas Registergericht beabsichtigt die Gesellschaft von Amts wegen nach § 394 FamFG zu löschen. Die Frist zur Erhebung eines Widerspruchs ist auf einen Monat festgesetzt."
    },
    {
      "date": "2026-01-07",
      "id": "141753",
      "original_text": "Sonstige Registerbekanntmachung\nNordrhein-Westfalen Amtsgericht Düsseldorf HRB 109328\nWohnträume leben GmbH – Düsseldorf",
      "type": "Sonstige Registerbekanntmachung",
      "state": "Nordrhein-Westfalen",
      "amtsgericht": "Amtsgericht Düsseldorf",
      "registernummer": "HRB 109328",
      "registerart": "HRB",
      "company_name": "Wohnträume leben GmbH",
      "company_seat": "Düsseldorf",
      "details": "07.01.2026 (Bekanntmachungsdatum)\n\nNordrhein-Westfalen Amtsgericht Düsseldorf HRB 109328\nSonstige Registerbekanntmachung 07.01.2026 (Eintragungsdatum)\n\nWohnträume leben GmbH\nGesellschaft mit beschränkter Haftung\nDüsseldorf\n\nAls nicht eingetragen wird veröffentlicht: Den Gläubigern der Gesellschaft, deren Forderungen begründet worden sind bevor die Eintragung der Beendigung des Beherrschungs- und Gewinnabführungsvertrages  in das Handelsregister nach § 10 des Handelsgesetzbuches als bekanntgemacht gilt, hat der andere Vertragsteil Sicherheit zu leisten, wenn sie sich binnen sechs Monaten nach der Bekanntmachung der Eintragung zu diesem Zweck bei ihm melden."
    },
    {
      "date": "2026-01-07",
      "id": "141754",
      "original_text": "Löschungsankündigung\nNordrhein-Westfalen Amtsgericht Düsseldorf HRB 59610\nClass A Design GmbH – Düsseldorf",
      "type": "Löschungsankündigung",
      "state": "Nordrhein-Westfalen",
      "amtsgericht": "Amtsgericht Düsseldorf",
      "registernummer": "HRB 59610",
      "registerart": "HRB",
      "company_name": "Class A Design GmbH",
      "company_seat": "Düsseldorf",
      "details": "07.01.2026 (Bekanntmachungsdatum)\n\nNordrhein-Westfalen Amtsgericht Düsseldorf HRB 59610\nLöschungsankündigung\n\nClass A Design GmbH\nGesellschaft mit beschränkter Haftung\nDüsseldorf\n\nDas Registergericht beabsichtigt die Gesellschaft von Amts wegen nach § 394 FamFG zu löschen. Die Frist zur Erhebung eines Widerspruchs ist auf 3 Wochen festgesetzt.\n\nRechtsbehelfsbelehrung:\nDas Widerspruchsrecht steht jedem zu, der an der Unterlassung der Löschung ein berechtigtes Interesse hat. Der Widerspruch ist bei dem Amtsgericht Düsseldorf -Registergericht-, Werdener Straße 1, 40227 Düsseldorf schriftlich in deutscher Sprache oder zur Niederschrift der Geschäftsstelle einzulegen. Der Widerspruch kann auch zur Niederschrift der Geschäftsstelle eines jeden Amtsgerichtes abgegeben werden. Die Einlegung ist auch durch Übertragung eines elektronischen Dokuments an die elektronische Poststelle des Gerichts möglich. Das elektronische Dokument muss für die Bearbeitung durch das Gericht geeignet und mit einer qualifizierten elektronischen Signatur der verantwortenden Person versehen sein oder von der verantwortenden Person signiert und auf einem sicheren Übermittlungsweg gemäß § 130a ZPO nach näherer Maßgabe der Verordnung über die technischen Rahmenbedingungen des elektronischen Rechtsverkehrs und über das besondere elektronische Behördenpostfach (BGBl. I, S.3803) eingereicht werden. Weitere Informationen erhalten Sie auf der Internetseite www.justiz.de.\nDer Widerspruch muss spätestens innerhalb der gesetzten Frist nach dem Datum der Bekanntmachung der Löschungsankündigung bei dem Amtsgericht - Registergericht - Düsseldorf eingegangen sein.  Dies gilt auch dann, wenn der Widerspruch zur Niederschrift der Geschäftsstelle eines anderen Amtsgerichtes abgegeben wurde. Die Frist beginnt mit dem Tage der Bekanntmachung der Löschungsankündigung in dem für die Bekanntmachung der Eintragungen in das Handelsregister bestimmten elektronischen Informations- und Kommunikationssystem nach § 10 des Handelsgesetzbuches. Fällt das Ende der Frist auf einen Sonntag, einen allgemeinen Feiertag oder Sonnabend, so endet die Frist mit Ablauf des nächsten Werktages.\nDer Widerspruch muss die Bezeichnung der angefochtenen Löschungsankündigung sowie die Erklärung enthalten, dass Widerspruch gegen diese Löschungsankündigung eingelegt wird. Er ist zu unterzeichnen und soll begründet werden."
    },
    {
      "date": "2026-01-07",
      "id": "141755",
      "original_text": "Registerbekanntmachung nach dem Umwandlungsgesetz\nNordrhein-Westfalen Amtsgericht Steinfurt HRA 4197\nKreissparkasse Steinfurt – Ibbenbüren",
      "type": "Registerbekanntmachung nach dem Umwandlungsgesetz",
      "state": "Nordrhein-Westfalen",
      "amtsgericht": "Amtsgericht Steinfurt",
      "registernummer": "HRA 4197",
      "registerart": "HRA",
      "company_name": "Kreissparkasse Steinfurt",
      "company_seat": "Ibbenbüren",
      "details": "07.01.2026 (Bekanntmachungsdatum)\n\nNordrhein-Westfalen Amtsgericht Steinfurt HRA 4197\nRegisterbekanntmachung nach dem Umwandlungsgesetz 07.01.2026 (Eintragungsdatum)\n\nKreissparkasse Steinfurt\nSonstige juristische Person\nIbbenbüren\n\nDen Gläubigern der an der Vermögensübertragung beteiligten Rechtsträger ist, wenn sie binnen sechs Monaten nach dem Tag, an dem die Eintragung der Vermögensübertragung in das Register des Sitzes desjenigen Rechtsträgers, dessen Gläubiger sie sind, nach § 19 Absatz 3 UmwG als bekanntgemacht gilt, ihren Anspruch nach Grund und Höhe schriftlich anmelden, Sicherheit zu leisten, soweit sie nicht Befriedigung verlangen können. Dieses Recht steht den Gläubigern jedoch nur zu, wenn sie glaubhaft machen, dass durch die Vermögensübertragung die Erfüllung ihrer Forderung gefährdet wird."
    },
    {
      "date": "2026-01-07",
      "id": "141756",
      "original_text": "Löschungsankündigung\nNordrhein-Westfalen Amtsgericht Krefeld HRB 17139\nGebäudeservice-Altstadt GmbH – Krefeld",
      "type": "Löschungsankündigung",
      "state": "Nordrhein-Westfalen",
      "amtsgericht": "Amtsgericht Krefeld",
      "registernummer": "HRB 17139",
      "registerart": "HRB",
      "company_name": "Gebäudeservice-Altstadt GmbH",
      "company_seat": "Krefeld",
      "details": "07.01.2026 (Bekanntmachungsdatum)\n\nNordrhein-Westfalen Amtsgericht Krefeld HRB 17139\nLöschungsankündigung\n\nGebäudeservice-Altstadt GmbH\nGesellschaft mit beschränkter Haftung\nKrefeld\n\nDas Registergericht beabsichtigt die Gesellschaft von Amts wegen nach § 394 FamFG zu löschen. Die Frist zur Erhebung eines Widerspruchs ist auf einen Monat festgesetzt."
    },
    {
      "date": "2026-01-07",
      "id": "141757",
      "original_text": "Löschungsankündigung\nNordrhein-Westfalen Amtsgericht Essen HRB 24580\nDenge Market Essen GmbH – Essen",
      "type": "Löschungsankündigung",
      "state": "Nordrhein-Westfalen",
      "amtsgericht": "Amtsgericht Essen",
      "registernummer": "HRB 24580",
      "registerart": "HRB",
      "company_name": "Denge Market Essen GmbH",
      "company_seat": "Essen",
      "details": "07.01.2026 (Bekanntmachungsdatum)\n\nNordrhein-Westfalen Amtsgericht Essen HRB 24580\nLöschungsankündigung\n\nDenge Market Essen GmbH\nGesellschaft mit beschränkter Haftung\nEssen\n\nDas Registergericht beabsichtigt die Gesellschaft von Amts wegen nach § 394 FamFG zu löschen. Die Frist zur Erhebung eines Widerspruchs ist auf zwei Monate festgesetzt."
    },
    {
      "date": "2026-01-07",
      "id": "141758",
      "original_text": "Löschungsankündigung\nNordrhein-Westfalen Amtsgericht Essen HRB 33529\nISOBAU UG (haftungsbeschränkt) – Essen",
      "type": "Löschungsankündigung",
      "state": "Nordrhein-Westfalen",
      "amtsgericht": "Amtsgericht Essen",
      "registernummer": "HRB 33529",
      "registerart": "HRB",
      "company_name": "ISOBAU UG (haftungsbeschränkt)",
      "company_seat": "Essen",
      "details": "07.01.2026 (Bekanntmachungsdatum)\n\nNordrhein-Westfalen Amtsgericht Essen HRB 33529\nLöschungsankündigung 07.01.2026 (Eintragungsdatum)\n\nISOBAU UG (haftungsbeschränkt)\nGesellschaft mit beschränkter Haftung\nEssen\n\nDas Registergericht beabsichtigt die Gesellschaft von Amts wegen nach § 394 FamFG zu löschen. Die Frist zur Erhebung eines Widerspruchs ist auf einen Monat festgesetzt."
    },
    {
      "date": "2026-01-07",
      "id": "141759",
      "original_text": "Einreichung neuer Dokumente\nNordrhein-Westfalen Amtsgericht Duisburg HRB 13652\nASO Alteneinrichtungen der Stadt Oberhausen gGmbH – Oberhausen",
      "type": "Einreichung neuer Dokumente",
      "state": "Nordrhein-Westfalen",
      "amtsgericht": "Amtsgericht Duisburg",
      "registernummer": "HRB 13652",
      "registerart": "HRB",
      "company_name": "ASO Alteneinrichtungen der Stadt Oberhausen gGmbH",
      "company_seat": "Oberhausen",
      "details": "07.01.2026 (Bekanntmachungsdatum)\n\nNordrhein-Westfalen Amtsgericht Duisburg HRB 13652\nEinreichung neuer Dokumente\n\nASO Alteneinrichtungen der Stadt Oberhausen gGmbH\nGesellschaft mit beschränkter Haftung\nOberhausen\n\nDem Registergericht ist eine Liste der Mitglieder des Aufsichtsrates eingereicht worden."
    },
    {
      "date": "2026-01-07",
      "id": "141760",
      "original_text": "Registerbekanntmachung nach dem Umwandlungsgesetz\nNordrhein-Westfalen Amtsgericht Siegburg HRB 12632\nKS-ProCon Projekt Consulting UG (haftungsbeschränkt) – Königswinter",
      "type": "Registerbekanntmachung nach dem Umwandlungsgesetz",
      "state": "Nordrhein-Westfalen",
      "amtsgericht": "Amtsgericht Siegburg",
      "registernummer": "HRB 12632",
      "registerart": "HRB",
      "company_name": "KS-ProCon Projekt Consulting UG (haftungsbeschränkt)",
      "company_seat": "Königswinter",
      "details": "07.01.2026 (Bekanntmachungsdatum)\n\nNordrhein-Westfalen Amtsgericht Siegburg HRB 12632\nRegisterbekanntmachung nach dem Umwandlungsgesetz 07.01.2026 (Eintragungsdatum)\n\nKS-ProCon Projekt Consulting UG (haftungsbeschränkt)\nGesellschaft mit beschränkter Haftung\nKönigswinter\n\nDen Gläubigern der an der Verschmelzung beteiligten Rechtsträger ist, wenn sie binnen sechs Monaten nach dem Tag, an dem die Eintragung der Verschmelzung in das Register des Sitzes desjenigen Rechtsträgers, dessen Gläubiger sie sind, nach § 19 Absatz 3 UmwG als bekanntgemacht gilt, ihren Anspruch nach Grund und Höhe schriftlich anmelden, Sicherheit zu leisten, soweit sie nicht Befriedigung verlangen können. Dieses Recht steht den Gläubigern jedoch nur zu, wenn sie glaubhaft machen, dass durch die Verschmelzung die Erfüllung ihrer Forderung gefährdet wird."
    },
    {
      "date": "2026-01-07",
      "id": "141761",
      "original_text": "Registerbekanntmachung nach dem Umwandlungsgesetz\nNordrhein-Westfalen Amtsgericht Siegen HRB 1086\nRunkel Treubau GmbH – Siegen",
      "type": "Registerbekanntmachung nach dem Umwandlungsgesetz",
      "state": "Nordrhein-Westfalen",
      "amtsgericht": "Amtsgericht Siegen",
      "registernummer": "HRB 1086",
      "registerart": "HRB",
      "company_name": "Runkel Treubau GmbH",
      "company_seat": "Siegen",
      "details": "07.01.2026 (Bekanntmachungsdatum)\n\nNordrhein-Westfalen Amtsgericht Siegen HRB 1086\nRegisterbekanntmachung nach dem Umwandlungsgesetz 07.01.2026 (Eintragungsdatum)\n\nRunkel Treubau GmbH\nGesellschaft mit beschränkter Haftung\nSiegen\n\nDen Gläubigern der an der Verschmelzung beteiligten Rechtsträger ist, wenn sie binnen sechs Monaten nach dem Tag, an dem die Eintragung der Verschmelzung in das Register des Sitzes derjenigen Rechtsträger deren Gläubiger sie sind, nach § 19 Absatz 3 UmwG als bekanntgemacht gilt, ihren Anspruch nach Grund und Höhe schriftlich anmelden, Sicherheit zu leisten, soweit sie nicht Befriedigung verlangen können. Dieses Recht steht den Gläubigern jedoch nur zu, wenn sie glaubhaft machen, dass durch die Verschmelzung die Erfüllung ihrer Forderung gefährdet wird."
    },
    {
      "date": "2026-01-07",
      "id": "141762",
      "original_text": "Löschungsankündigung\nNordrhein-Westfalen Amtsgericht Wuppertal HRA 24228\nPROMA+ GmbH & Co. KG – Wuppertal",
      "type": "Löschungsankündigung",
      "state": "Nordrhein-Westfalen",
      "amtsgericht": "Amtsgericht Wuppertal",
      "registernummer": "HRA 24228",
      "registerart": "HRA",
      "company_name": "PROMA+ GmbH & Co. KG",
      "company_seat": "Wuppertal",
      "details": "07.01.2026 (Bekanntmachungsdatum)\n\nNordrhein-Westfalen Amtsgericht Wuppertal HRA 24228\nLöschungsankündigung\n\nPROMA+ GmbH & Co. KG\nKommanditgesellschaft\nWuppertal\n\nDas Registergericht beabsichtigt die Firma von Amts wegen nach § 394 FamFG zu löschen. Die Frist zur Erhebung eines Widerspruchs ist auf drei Monate festgesetzt."
    },
    {
      "date": "2026-01-07",
      "id": "141763",
      "original_text": "Registerbekanntmachung nach dem Umwandlungsgesetz\nNordrhein-Westfalen Amtsgericht Siegburg HRB 12452\nKSF Immobilienverwaltung GmbH – Königswinter",
      "type": "Registerbekanntmachung nach dem Umwandlungsgesetz",
      "state": "Nordrhein-Westfalen",
      "amtsgericht": "Amtsgericht Siegburg",
      "registernummer": "HRB 12452",
      "registerart": "HRB",
      "company_name": "KSF Immobilienverwaltung GmbH",
      "company_seat": "Königswinter",
      "details": "07.01.2026 (Bekanntmachungsdatum)\n\nNordrhein-Westfalen Amtsgericht Siegburg HRB 12452\nRegisterbekanntmachung nach dem Umwandlungsgesetz 07.01.2026 (Eintragungsdatum)\n\nKSF Immobilienverwaltung GmbH\nGesellschaft mit beschränkter Haftung\nKönigswinter\n\nDen Gläubigern der an der Verschmelzung beteiligten Rechtsträger ist, wenn sie binnen sechs Monaten nach dem Tag, an dem die Eintragung der Verschmelzung in das Register des Sitzes desjenigen Rechtsträgers, dessen Gläubiger sie sind, nach § 19 Absatz 3 UmwG als bekanntgemacht gilt, ihren Anspruch nach Grund und Höhe schriftlich anmelden, Sicherheit zu leisten, soweit sie nicht Befriedigung verlangen können. Dieses Recht steht den Gläubigern jedoch nur zu, wenn sie glaubhaft machen, dass durch die Verschmelzung die Erfüllung ihrer Forderung gefährdet wird."
    },
    {
      "date": "2026-01-07",
      "id": "141764",
      "original_text": "Registerbekanntmachung nach dem Umwandlungsgesetz\nNordrhein-Westfalen Amtsgericht Siegen HRB 2042\nRunkel Hochbau GmbH – Siegen",
      "type": "Registerbekanntmachung nach dem Umwandlungsgesetz",
      "state": "Nordrhein-Westfalen",
      "amtsgericht": "Amtsgericht Siegen",
      "registernummer": "HRB 2042",
      "registerart": "HRB",
      "company_name": "Runkel Hochbau GmbH",
      "company_seat": "Siegen",
      "details": "07.01.2026 (Bekanntmachungsdatum)\n\nNordrhein-Westfalen Amtsgericht Siegen HRB 2042\nRegisterbekanntmachung nach dem Umwandlungsgesetz 07.01.2026 (Eintragungsdatum)\n\nRunkel Hochbau GmbH\nGesellschaft mit beschränkter Haftung\nSiegen\n\nDen Gläubigern der an der Verschmelzung beteiligten Rechtsträger ist, wenn sie binnen sechs Monaten nach dem Tag, an dem die Eintragung der Verschmelzung in das Register des Sitzes derjenigen Rechtsträger deren Gläubiger sie sind, nach § 19 Absatz 3 UmwG als bekanntgemacht gilt, ihren Anspruch nach Grund und Höhe schriftlich anmelden, Sicherheit zu leisten, soweit sie nicht Befriedigung verlangen können. Dieses Recht steht den Gläubigern jedoch nur zu, wenn sie glaubhaft machen, dass durch die Verschmelzung die Erfüllung ihrer Forderung gefährdet wird."
    },
    {
      "date": "2026-01-07",
      "id": "141765",
      "original_text": "Löschungsankündigung\nNordrhein-Westfalen Amtsgericht Düsseldorf HRB 87464\nRE Consulting & Property GmbH – Düsseldorf",
      "type": "Löschungsankündigung",
      "state": "Nordrhein-Westfalen",
      "amtsgericht": "Amtsgericht Düsseldorf",
      "registernummer": "HRB 87464",
      "registerart": "HRB",
      "company_name": "RE Consulting & Property GmbH",
      "company_seat": "Düsseldorf",
      "details": "07.01.2026 (Bekanntmachungsdatum)\n\nNordrhein-Westfalen Amtsgericht Düsseldorf HRB 87464\nLöschungsankündigung\n\nRE Consulting & Property GmbH\nGesellschaft mit beschränkter Haftung\nDüsseldorf\n\nDas Registergericht beabsichtigt die Gesellschaft von Amts wegen nach § 394 FamFG zu löschen. Die Frist zur Erhebung eines Widerspruchs ist auf 3 Wochen festgesetzt.\n\nRechtsbehelfsbelehrung:\nDas Widerspruchsrecht steht jedem zu, der an der Unterlassung der Löschung ein berechtigtes Interesse hat. Der Widerspruch ist bei dem Amtsgericht Düsseldorf -Registergericht-, Werdener Straße 1, 40227 Düsseldorf schriftlich in deutscher Sprache oder zur Niederschrift der Geschäftsstelle einzulegen. Der Widerspruch kann auch zur Niederschrift der Geschäftsstelle eines jeden Amtsgerichtes abgegeben werden. Die Einlegung ist auch durch Übertragung eines elektronischen Dokuments an die elektronische Poststelle des Gerichts möglich. Das elektronische Dokument muss für die Bearbeitung durch das Gericht geeignet und mit einer qualifizierten elektronischen Signatur der verantwortenden Person versehen sein oder von der verantwortenden Person signiert und auf einem sicheren Übermittlungsweg gemäß § 130a ZPO nach näherer Maßgabe der Verordnung über die technischen Rahmenbedingungen des elektronischen Rechtsverkehrs und über das besondere elektronische Behördenpostfach (BGBl. I, S.3803) eingereicht werden. Weitere Informationen erhalten Sie auf der Internetseite www.justiz.de.\nDer Widerspruch muss spätestens innerhalb der gesetzten Frist nach dem Datum der Bekanntmachung der Löschungsankündigung bei dem Amtsgericht - Registergericht - Düsseldorf eingegangen sein.  Dies gilt auch dann, wenn der Widerspruch zur Niederschrift der Geschäftsstelle eines anderen Amtsgerichtes abgegeben wurde. Die Frist beginnt mit dem Tage der Bekanntmachung der Löschungsankündigung in dem für die Bekanntmachung der Eintragungen in das Handelsregister bestimmten elektronischen Informations- und Kommunikationssystem nach § 10 des Handelsgesetzbuches. Fällt das Ende der Frist auf einen Sonntag, einen allgemeinen Feiertag oder Sonnabend, so endet die Frist mit Ablauf des nächsten Werktages.\nDer Widerspruch muss die Bezeichnung der angefochtenen Löschungsankündigung sowie die Erklärung enthalten, dass Widerspruch gegen diese Löschungsankündigung eingelegt wird. Er ist zu unterzeichnen und soll begründet werden."
    },
    {
      "date": "2026-01-07",
      "id": "141766",
      "original_text": "Einreichung neuer Dokumente\nNordrhein-Westfalen Amtsgericht Kleve HRB 21\nGeWoGe Wohnungsgesellschaft mbH für den Kreis Kleve in Kleve – Kleve",
      "type": "Einreichung neuer Dokumente",
      "state": "Nordrhein-Westfalen",
      "amtsgericht": "Amtsgericht Kleve",
      "registernummer": "HRB 21",
      "registerart": "HRB",
      "company_name": "GeWoGe Wohnungsgesellschaft mbH für den Kreis Kleve in Kleve",
      "company_seat": "Kleve",
      "details": "07.01.2026 (Bekanntmachungsdatum)\n\nNordrhein-Westfalen Amtsgericht Kleve HRB 21\nEinreichung neuer Dokumente 07.01.2026 (Eintragungsdatum)\n\nGeWoGe Wohnungsgesellschaft mbH für den Kreis Kleve in Kleve\nGesellschaft mit beschränkter Haftung\nKleve"
    },
    {
      "date": "2026-01-07",
      "id": "141767",
      "original_text": "Registerbekanntmachung nach dem Umwandlungsgesetz\nNordrhein-Westfalen Amtsgericht Steinfurt HRA 4766\nStadtsparkasse Lengerich (Westfalen) – Lengerich",
      "type": "Registerbekanntmachung nach dem Umwandlungsgesetz",
      "state": "Nordrhein-Westfalen",
      "amtsgericht": "Amtsgericht Steinfurt",
      "registernummer": "HRA 4766",
      "registerart": "HRA",
      "company_name": "Stadtsparkasse Lengerich (Westfalen)",
      "company_seat": "Lengerich",
      "details": "07.01.2026 (Bekanntmachungsdatum)\n\nNordrhein-Westfalen Amtsgericht Steinfurt HRA 4766\nRegisterbekanntmachung nach dem Umwandlungsgesetz 07.01.2026 (Eintragungsdatum)\n\nStadtsparkasse Lengerich (Westfalen)\nSonstige juristische Person\nLengerich\n\nDen Gläubigern der an der Vermögensübertragung beteiligten Rechtsträger ist, wenn sie binnen sechs Monaten nach dem Tag, an dem die Eintragung der Vermögensübertragung in das Register des Sitzes desjenigen Rechtsträgers, dessen Gläubiger sie sind, nach § 19 Absatz 3 UmwG als bekanntgemacht gilt, ihren Anspruch nach Grund und Höhe schriftlich anmelden, Sicherheit zu leisten, soweit sie nicht Befriedigung verlangen können. Dieses Recht steht den Gläubigern jedoch nur zu, wenn sie glaubhaft machen, dass durch die Vermögensübertragung die Erfüllung ihrer Forderung gefährdet wird."
    },
    {
      "date": "2026-01-07",
      "id": "141768",
      "original_text": "Sonstige Registerbekanntmachung\nNordrhein-Westfalen Amtsgericht Essen HRB 34174\nHagedorn Hotel München GmbH – Essen",
      "type": "Sonstige Registerbekanntmachung",
      "state": "Nordrhein-Westfalen",
      "amtsgericht": "Amtsgericht Essen",
      "registernummer": "HRB 34174",
      "registerart": "HRB",
      "company_name": "Hagedorn Hotel München GmbH",
      "company_seat": "Essen",
      "details": "07.01.2026 (Bekanntmachungsdatum)\n\nNordrhein-Westfalen Amtsgericht Essen HRB 34174\nSonstige Registerbekanntmachung 07.01.2026 (Eintragungsdatum)\n\nHagedorn Hotel München GmbH\nGesellschaft mit beschränkter Haftung\nEssen\n\nAls nicht eingetragen wird veröffentlicht: Den Gläubigern der Gesellschaft, deren Forderungen begründet worden sind bevor die Eintragung der Beendigung des Beherrschungs- und Gewinnabführungsvertrages  in das Handelsregister nach § 10 des Handelsgesetzbuches als bekanntgemacht gilt, hat der andere Vertragsteil Sicherheit zu leisten, wenn sie sich binnen sechs Monaten nach der Bekanntmachung der Eintragung zu diesem Zweck bei ihm melden."
    },
    {
      "date": "2026-01-07",
      "id": "141769",
      "original_text": "Löschungsankündigung\nNordrhein-Westfalen Amtsgericht Gelsenkirchen VR 20979 früher Amtsgericht Gelsenkirchen-Buer (Gelsenkirchen)\nSportverein Tiger & Dragon Gelsenkirchen e. V. – Gelsenkirchen",
      "type": "Löschungsankündigung",
      "state": "Nordrhein-Westfalen",
      "amtsgericht": "Amtsgericht Gelsenkirchen",
      "registernummer": "VR 20979",
      "registerart": "VR",
      "company_name": "Sportverein Tiger & Dragon Gelsenkirchen e. V.",
      "company_seat": "Gelsenkirchen",
      "former_amtsgericht": "Gelsenkirchen-Buer (Gelsenkirchen)",
      "details": "07.01.2026 (Bekanntmachungsdatum)\n\nNordrhein-Westfalen Amtsgericht Gelsenkirchen VR 20979 früher Amtsgericht Gelsenkirchen-Buer (Gelsenkirchen)\nLöschungsankündigung\n\nSportverein Tiger & Dragon Gelsenkirchen e. V.\neingetragener Verein\nGelsenkirchen\n\nDas Amtsgericht Gelsenkirchen als Registergericht beabsichtigt, den in seinem Vereinsregister unter der Nr. VR 20979 eingetragenen Sportverein Tiger & Dragon Gelsenkírchen e.V. gemäß § 395 FamFG wegen Wegfalls sämtlicher Mitglieder von Amts wegen zu löschen.\n\nEs wird denen, die ein berechtigtes Interesse an der Unterlassung der Löschung haben, zur etwaigen Geltendmachung eines Widerspruchs eine Frist von 1 Monat gesetzt."
    },
    {
      "date": "2026-01-07",
      "id": "141770",
      "original_text": "Löschungsankündigung\nNordrhein-Westfalen Amtsgericht Düsseldorf HRB 80625\nNamo Trading GmbH – Düsseldorf",
      "type": "Löschungsankündigung",
      "state": "Nordrhein-Westfalen",
      "amtsgericht": "Amtsgericht Düsseldorf",
      "registernummer": "HRB 80625",
      "registerart": "HRB",
      "company_name": "Namo Trading GmbH",
      "company_seat": "Düsseldorf",
      "details": "07.01.2026 (Bekanntmachungsdatum)\n\nNordrhein-Westfalen Amtsgericht Düsseldorf HRB 80625\nLöschungsankündigung\n\nNamo Trading GmbH\nGesellschaft mit beschränkter Haftung\nDüsseldorf\n\nBetr.: Namo Trading GmbH, Wiesenstr. 21, 40549 Düsseldorf\n\nDas Registergericht beabsichtigt die Gesellschaft von Amts wegen nach § 394 FamFG zu löschen. Die Frist zur Erhebung eines Widerspruchs ist auf 3 Wochen festgesetzt.\n\nRechtsbehelfsbelehrung:\n\nDas Widerspruchsrecht steht jedem zu, der an der Unterlassung der Löschung ein berechtigtes Interesse hat. Der Widerspruch ist bei dem Amtsgericht Düsseldorf -Registergericht-, Werdener Straße 1, 40227 Düsseldorf schriftlich in deutscher Sprache oder zur Niederschrift der Geschäftsstelle einzulegen. Der Widerspruch kann auch zur Niederschrift der Geschäftsstelle eines jeden Amtsgerichtes abgegeben werden. Die Einlegung ist auch durch Übertragung eines elektronischen Dokuments an die elektronische Poststelle des Gerichts möglich. Das elektronische Dokument muss für die Bearbeitung durch das Gericht geeignet und mit einer qualifizierten elektronischen Signatur der verantwortenden Person versehen sein oder von der verantwortenden Person signiert und auf einem sicheren Übermittlungsweg gemäß § 130a ZPO nach näherer Maßgabe der Verordnung über die technischen Rahmenbedingungen des elektronischen Rechtsverkehrs und über das besondere elektronische Behördenpostfach (BGBl. I, S.3803) eingereicht werden. Weitere Informationen erhalten Sie auf der Internetseite www.justiz.de.\nDer Widerspruch muss spätestens innerhalb der gesetzten Frist nach dem Datum der Bekanntmachung der Löschungsankündigung bei dem Amtsgericht - Registergericht - Düsseldorf eingegangen sein.  Dies gilt auch dann, wenn der Widerspruch zur Niederschrift der Geschäftsstelle eines anderen Amtsgerichtes abgegeben wurde. Die Frist beginnt mit dem Tage der Bekanntmachung der Löschungsankündigung in dem für die Bekanntmachung der Eintragungen in das Handelsregister bestimmten elektronischen Informations- und Kommunikationssystem nach § 10 des Handelsgesetzbuches. Fällt das Ende der Frist auf einen Sonntag, einen allgemeinen Feiertag oder Sonnabend, so endet die Frist mit Ablauf des nächsten Werktages.\nDer Widerspruch muss die Bezeichnung der angefochtenen Löschungsankündigung sowie die Erklärung enthalten, dass Widerspruch gegen diese Löschungsankündigung eingelegt wird. Er ist zu unterzeichnen und soll begründet werden."
    },
    {
      "date": "2026-01-07",
      "id": "141771",
      "original_text": "Löschungsankündigung\nNordrhein-Westfalen Amtsgericht Düsseldorf HRB 110155\nAMN Dienstleistung GmbH – Düsseldorf",
      "type": "Löschungsankündigung",
      "state": "Nordrhein-Westfalen",
      "amtsgericht": "Amtsgericht Düsseldorf",
      "registernummer": "HRB 110155",
      "registerart": "HRB",
      "company_name": "AMN Dienstleistung GmbH",
      "company_seat": "Düsseldorf",
      "details": "07.01.2026 (Bekanntmachungsdatum)\n\nNordrhein-Westfalen Amtsgericht Düsseldorf HRB 110155\nLöschungsankündigung\n\nAMN Dienstleistung GmbH\nGesellschaft mit beschränkter Haftung\nDüsseldorf\n\nBetr.: AMN Dienstleistung GmbH, Glashüttenstr. 59, 40627 Düsseldorf\n\nDas Registergericht beabsichtigt die Gesellschaft von Amts wegen nach § 394 FamFG zu löschen. Die Frist zur Erhebung eines Widerspruchs ist auf 3 Wochen festgesetzt.\n\nRechtsbehelfsbelehrung:\n\nDas Widerspruchsrecht steht jedem zu, der an der Unterlassung der Löschung ein berechtigtes Interesse hat. Der Widerspruch ist bei dem Amtsgericht Düsseldorf -Registergericht-, Werdener Straße 1, 40227 Düsseldorf schriftlich in deutscher Sprache oder zur Niederschrift der Geschäftsstelle einzulegen. Der Widerspruch kann auch zur Niederschrift der Geschäftsstelle eines jeden Amtsgerichtes abgegeben werden. Die Einlegung ist auch durch Übertragung eines elektronischen Dokuments an die elektronische Poststelle des Gerichts möglich. Das elektronische Dokument muss für die Bearbeitung durch das Gericht geeignet und mit einer qualifizierten elektronischen Signatur der verantwortenden Person versehen sein oder von der verantwortenden Person signiert und auf einem sicheren Übermittlungsweg gemäß § 130a ZPO nach näherer Maßgabe der Verordnung über die technischen Rahmenbedingungen des elektronischen Rechtsverkehrs und über das besondere elektronische Behördenpostfach (BGBl. I, S.3803) eingereicht werden. Weitere Informationen erhalten Sie auf der Internetseite www.justiz.de.\nDer Widerspruch muss spätestens innerhalb der gesetzten Frist nach dem Datum der Bekanntmachung der Löschungsankündigung bei dem Amtsgericht - Registergericht - Düsseldorf eingegangen sein.  Dies gilt auch dann, wenn der Widerspruch zur Niederschrift der Geschäftsstelle eines anderen Amtsgerichtes abgegeben wurde. Die Frist beginnt mit dem Tage der Bekanntmachung der Löschungsankündigung in dem für die Bekanntmachung der Eintragungen in das Handelsregister bestimmten elektronischen Informations- und Kommunikationssystem nach § 10 des Handelsgesetzbuches. Fällt das Ende der Frist auf einen Sonntag, einen allgemeinen Feiertag oder Sonnabend, so endet die Frist mit Ablauf des nächsten Werktages.\nDer Widerspruch muss die Bezeichnung der angefochtenen Löschungsankündigung sowie die Erklärung enthalten, dass Widerspruch gegen diese Löschungsankündigung eingelegt wird. Er ist zu unterzeichnen und soll begründet werden."
    },
    {
      "date": "2026-01-07",
      "id": "141772",
      "original_text": "Löschungsankündigung\nNordrhein-Westfalen Amtsgericht Düsseldorf HRB 50915\nTape Center GmbH – Düsseldorf",
      "type": "Löschungsankündigung",
      "state": "Nordrhein-Westfalen",
      "amtsgericht": "Amtsgericht Düsseldorf",
      "registernummer": "HRB 50915",
      "registerart": "HRB",
      "company_name": "Tape Center GmbH",
      "company_seat": "Düsseldorf",
      "details": "07.01.2026 (Bekanntmachungsdatum)\n\nNordrhein-Westfalen Amtsgericht Düsseldorf HRB 50915\nLöschungsankündigung\n\nTape Center GmbH\nGesellschaft mit beschränkter Haftung\nDüsseldorf\n\nBetr.: Tape Center GmbH, Benediktusstr. 9, 40549 Düsseldorf\n\nDas Registergericht beabsichtigt die Gesellschaft von Amts wegen nach § 394 FamFG zu löschen. Die Frist zur Erhebung eines Widerspruchs ist auf 3 Wochen festgesetzt.\n\nRechtsbehelfsbelehrung:\n\nDas Widerspruchsrecht steht jedem zu, der an der Unterlassung der Löschung ein berechtigtes Interesse hat. Der Widerspruch ist bei dem Amtsgericht Düsseldorf -Registergericht-, Werdener Straße 1, 40227 Düsseldorf schriftlich in deutscher Sprache oder zur Niederschrift der Geschäftsstelle einzulegen. Der Widerspruch kann auch zur Niederschrift der Geschäftsstelle eines jeden Amtsgerichtes abgegeben werden. Die Einlegung ist auch durch Übertragung eines elektronischen Dokuments an die elektronische Poststelle des Gerichts möglich. Das elektronische Dokument muss für die Bearbeitung durch das Gericht geeignet und mit einer qualifizierten elektronischen Signatur der verantwortenden Person versehen sein oder von der verantwortenden Person signiert und auf einem sicheren Übermittlungsweg gemäß § 130a ZPO nach näherer Maßgabe der Verordnung über die technischen Rahmenbedingungen des elektronischen Rechtsverkehrs und über das besondere elektronische Behördenpostfach (BGBl. I, S.3803) eingereicht werden. Weitere Informationen erhalten Sie auf der Internetseite www.justiz.de.\nDer Widerspruch muss spätestens innerhalb der gesetzten Frist nach dem Datum der Bekanntmachung der Löschungsankündigung bei dem Amtsgericht - Registergericht - Düsseldorf eingegangen sein.  Dies gilt auch dann, wenn der Widerspruch zur Niederschrift der Geschäftsstelle eines anderen Amtsgerichtes abgegeben wurde. Die Frist beginnt mit dem Tage der Bekanntmachung der Löschungsankündigung in dem für die Bekanntmachung der Eintragungen in das Handelsregister bestimmten elektronischen Informations- und Kommunikationssystem nach § 10 des Handelsgesetzbuches. Fällt das Ende der Frist auf einen Sonntag, einen allgemeinen Feiertag oder Sonnabend, so endet die Frist mit Ablauf des nächsten Werktages.\nDer Widerspruch muss die Bezeichnung der angefochtenen Löschungsankündigung sowie die Erklärung enthalten, dass Widerspruch gegen diese Löschungsankündigung eingelegt wird. Er ist zu unterzeichnen und soll begründet werden."
    },
    {
      "date": "2026-01-07",
      "id": "141773",
      "original_text": "Löschungsankündigung\nThüringen Amtsgericht Jena HRB 504911\nSolar Valley GmbH – Erfurt",
      "type": "Löschungsankündigung",
      "state": "Thüringen",
      "amtsgericht": "Amtsgericht Jena",
      "registernummer": "HRB 504911",
      "registerart": "HRB",
      "company_name": "Solar Valley GmbH",
      "company_seat": "Erfurt",
      "details": "07.01.2026 (Bekanntmachungsdatum)\n\nThüringen Amtsgericht Jena HRB 504911\nLöschungsankündigung\n\nSolar Valley GmbH\nGesellschaft mit beschränkter Haftung\nErfurt\n\nDas Registergericht beabsichtigt, die im Handelsregister eingetragene Gesellschaft wegen Vermögenslosigkeit nach § 394 FamFG von Amts wegen zu löschen. Die Frist zur Erhebung eines Widerspruchs gegen die beabsichtigte Löschung wird auf 6 Wochen festgesetzt."
    },
    {
      "date": "2026-01-07",
      "id": "141774",
      "original_text": "Löschungsankündigung\nThüringen Amtsgericht Jena HRB 111480\nMandler Fleischerei Technik GmbH Spezialbau von Lebensmittelbetrieben – Erfurt",
      "type": "Löschungsankündigung",
      "state": "Thüringen",
      "amtsgericht": "Amtsgericht Jena",
      "registernummer": "HRB 111480",
      "registerart": "HRB",
      "company_name": "Mandler Fleischerei Technik GmbH Spezialbau von Lebensmittelbetrieben",
      "company_seat": "Erfurt",
      "details": "07.01.2026 (Bekanntmachungsdatum)\n\nThüringen Amtsgericht Jena HRB 111480\nLöschungsankündigung\n\nMandler Fleischerei Technik GmbH Spezialbau von Lebensmittelbetrieben\nGesellschaft mit beschränkter Haftung\nErfurt\n\nDas Registergericht beabsichtigt, den im Handelsregister eingetragenen Geschäftsführer wegen unzulässiger Eintragung nach § 395 FamFG von Amts wegen zu löschen. Die Frist zur Erhebung eines Widerspruchs gegen die beabsichtigte Löschung wird auf einen Monat festgesetzt."
    },
    {
      "date": "2026-01-07",
      "id": "141775",
      "original_text": "Löschungsankündigung\nNordrhein-Westfalen Amtsgericht Köln HRB 103344\nEdemas GmbH – Köln",
      "type": "Löschungsankündigung",
      "state": "Nordrhein-Westfalen",
      "amtsgericht": "Amtsgericht Köln",
      "registernummer": "HRB 103344",
      "registerart": "HRB",
      "company_name": "Edemas GmbH",
      "company_seat": "Köln",
      "details": "07.01.2026 (Bekanntmachungsdatum)\n\nNordrhein-Westfalen Amtsgericht Köln HRB 103344\nLöschungsankündigung\n\nEdemas GmbH\nGesellschaft mit beschränkter Haftung\nKöln\n\nDas Registergericht beabsichtigt die Gesellschaft von Amts wegen nach § 394 FamFG zu löschen. Die Frist zur Erhebung eines Widerspruchs ist auf einen Monat festgesetzt."
    },
    {
      "date": "2026-01-07",
      "id": "141776",
      "original_text": "Registerbekanntmachung nach dem Umwandlungsgesetz\nHessen Amtsgericht Limburg HRB 1706\nAventus Versicherungsmakler Limburg GmbH – Limburg",
      "type": "Registerbekanntmachung nach dem Umwandlungsgesetz",
      "state": "Hessen",
      "amtsgericht": "Amtsgericht Limburg",
      "registernummer": "HRB 1706",
      "registerart": "HRB",
      "company_name": "Aventus Versicherungsmakler Limburg GmbH",
      "company_seat": "Limburg",
      "details": "07.01.2026 (Bekanntmachungsdatum)\n\nHessen Amtsgericht Limburg HRB 1706\nRegisterbekanntmachung nach dem Umwandlungsgesetz 07.01.2026 (Eintragungsdatum)\n\nAventus Versicherungsmakler Limburg GmbH\nGesellschaft mit beschränkter Haftung\nLimburg\n\nDen Gläubigern der an der formwechselnden Umwandlung beteiligten Rechtsträger ist, wenn sie binnen sechs Monaten nach dem Tag, an dem die Eintragung der formwechselnden Umwandlung in das Register des Sitzes desjenigen Rechtsträgers, dessen Gläubiger sie sind, nach § 201 UmwG bekannt gemacht worden ist, ihren Anspruch nach Grund und Höhe schriftlich anmelden, Sicherheit zu leisten, soweit sie nicht Befriedigung verlangen können. Dieses Recht steht den Gläubigern jedoch nur zu, wenn sie glaubhaft machen, dass durch die formwechselnden Umwandlung die Erfüllung ihrer Forderung gefährdet wird."
    },
    {
      "date": "2026-01-07",
      "id": "141777",
      "original_text": "Löschungsankündigung\nHessen Amtsgericht Marburg HRB 6306\nCaretaker group UG (haftungsbeschränkt) – Münchhausen",
      "type": "Löschungsankündigung",
      "state": "Hessen",
      "amtsgericht": "Amtsgericht Marburg",
      "registernummer": "HRB 6306",
      "registerart": "HRB",
      "company_name": "Caretaker group UG (haftungsbeschränkt)",
      "company_seat": "Münchhausen",
      "details": "07.01.2026 (Bekanntmachungsdatum)\n\nHessen Amtsgericht Marburg HRB 6306\nLöschungsankündigung\n\nCaretaker group UG (haftungsbeschränkt)\nGesellschaft mit beschränkter Haftung\nMünchhausen\n\nDas Registergericht beabsichtigt die im Handelsregister eingetragene Gesellschaft von Amts wegen nach § 394 FamFG wegen Vermögenslosigkeit zu löschen. Die Frist zur Erhebung eines Widerspruchs gegen die beabsichtigte Löschung wird auf 3 Monate festgesetzt."
    },
    {
      "date": "2026-01-07",
      "id": "141778",
      "original_text": "Einreichung neuer Dokumente\nHessen Amtsgericht Frankfurt am Main HRB 40446\nASG Airport Service Gesellschaft mbH – Frankfurt am Main",
      "type": "Einreichung neuer Dokumente",
      "state": "Hessen",
      "amtsgericht": "Amtsgericht Frankfurt am Main",
      "registernummer": "HRB 40446",
      "registerart": "HRB",
      "company_name": "ASG Airport Service Gesellschaft mbH",
      "company_seat": "Frankfurt am Main",
      "details": "07.01.2026 (Bekanntmachungsdatum)\n\nHessen Amtsgericht Frankfurt am Main HRB 40446\nEinreichung neuer Dokumente\n\nASG Airport Service Gesellschaft mbH\nGesellschaft mit beschränkter Haftung\nFrankfurt am Main\n\nDurch eine Änderung in den Personen der Aufsichtsratsmitglieder ist eine Liste der Mitglieder des Aufsichtsrates zum Handelsregister eingereicht worden."
    },
    {
      "date": "2026-01-07",
      "id": "141779",
      "original_text": "Sonstige Registerbekanntmachung\nHessen Amtsgericht Wetzlar VR 4805\nLaKo Lahn-Dill 2025 e. V. – Dillenburg",
      "type": "Sonstige Registerbekanntmachung",
      "state": "Hessen",
      "amtsgericht": "Amtsgericht Wetzlar",
      "registernummer": "VR 4805",
      "registerart": "VR",
      "company_name": "LaKo Lahn-Dill 2025 e. V.",
      "company_seat": "Dillenburg",
      "details": "07.01.2026 (Bekanntmachungsdatum)\n\nHessen Amtsgericht Wetzlar VR 4805\nSonstige Registerbekanntmachung 07.01.2026 (Eintragungsdatum)\n\nLaKo Lahn-Dill 2025 e. V.\neingetragener Verein\nDillenburg\n\nDer Verein ist aufgelöst."
    },
    {
      "date": "2026-01-07",
      "id": "141780",
      "original_text": "Löschungsankündigung\nHessen Amtsgericht Hanau HRB 96743\nAkduman Holding GmbH – Bruchköbel",
      "type": "Löschungsankündigung",
      "state": "Hessen",
      "amtsgericht": "Amtsgericht Hanau",
      "registernummer": "HRB 96743",
      "registerart": "HRB",
      "company_name": "Akduman Holding GmbH",
      "company_seat": "Bruchköbel",
      "details": "07.01.2026 (Bekanntmachungsdatum)\n\nHessen Amtsgericht Hanau HRB 96743\nLöschungsankündigung\n\nAkduman Holding GmbH\nGesellschaft mit beschränkter Haftung\nBruchköbel\n\nDas Registergericht beabsichtigt die im Handelsregister eingetragene Gesellschaft von Amts wegen nach § 394 FamFG zu löschen. Die Frist zur Erhebung eines Widerspruchs gegen die beabsichtigte Löschung wird auf 3 Monate festgesetzt."
    },
    {
      "date": "2026-01-07",
      "id": "141781",
      "original_text": "Einreichung neuer Dokumente\nHessen Amtsgericht Darmstadt HRB 9338\nRJC Vermögensverwaltungs AG – Darmstadt",
      "type": "Einreichung neuer Dokumente",
      "state": "Hessen",
      "amtsgericht": "Amtsgericht Darmstadt",
      "registernummer": "HRB 9338",
      "registerart": "HRB",
      "company_name": "RJC Vermögensverwaltungs AG",
      "company_seat": "Darmstadt",
      "details": "07.01.2026 (Bekanntmachungsdatum)\n\nHessen Amtsgericht Darmstadt HRB 9338\nEinreichung neuer Dokumente 07.01.2026 (Eintragungsdatum)\n\nRJC Vermögensverwaltungs AG\nAktiengesellschaft\nDarmstadt\n\nWegen Änderungen in den Personen der Aufsichtsratsmitglieder ist eine Liste der Mitglieder des Aufsichtsrates zum Handelsregister eingereicht worden."
    },
    {
      "date": "2026-01-07",
      "id": "141782",
      "original_text": "Löschungsankündigung\nHessen Amtsgericht Friedberg HRB 8580\nFZ GmbH – Büdingen",
      "type": "Löschungsankündigung",
      "state": "Hessen",
      "amtsgericht": "Amtsgericht Friedberg",
      "registernummer": "HRB 8580",
      "registerart": "HRB",
      "company_name": "FZ GmbH",
      "company_seat": "Büdingen",
      "details": "07.01.2026 (Bekanntmachungsdatum)\n\nHessen Amtsgericht Friedberg HRB 8580\nLöschungsankündigung 07.01.2026 (Eintragungsdatum)\n\nFZ GmbH\nGesellschaft mit beschränkter Haftung\nBüdingen\n\nDas Registergericht beabsichtigt die im Handelsregister eingetragene Gesellschaft von Amts wegen nach § 394 FamFG zu löschen. Die Frist zur Erhebung eines Widerspruchs gegen die beabsichtigte Löschung wird auf 3 Monate festgesetzt."
    },
    {
      "date": "2026-01-07",
      "id": "141783",
      "original_text": "Sonstige Registerbekanntmachung\nHessen Amtsgericht Wiesbaden VR 5053\nVereinigung der Selbständigen in Niedernhausen/Ts. e.V. – Niedernhausen",
      "type": "Sonstige Registerbekanntmachung",
      "state": "Hessen",
      "amtsgericht": "Amtsgericht Wiesbaden",
      "registernummer": "VR 5053",
      "registerart": "VR",
      "company_name": "Vereinigung der Selbständigen in Niedernhausen/Ts. e.V.",
      "company_seat": "Niedernhausen",
      "details": "07.01.2026 (Bekanntmachungsdatum)\n\nHessen Amtsgericht Wiesbaden VR 5053\nSonstige Registerbekanntmachung 07.01.2026 (Eintragungsdatum)\n\nVereinigung der Selbständigen in Niedernhausen/Ts. e.V.\neingetragener Verein\nNiedernhausen\n\nDer Verein ist aufgelöst."
    }
  ]
}