{
  "date": "2026-01-20",
  "date_of_scrape": "2026-01-21T04:26:08.859Z",
  "tool_version": "0.2.0",
  "number_of_announcements": 153,
  "announcements": [
    {
      "date": "2026-01-20",
      "id": "142844",
      "original_text": "Registerbekanntmachung nach dem Umwandlungsgesetz\nBayern Amtsgericht Traunstein HRB 3781\nLOTEC GmbH Kurt Lotterschmid Automobiltechnik – Kolbermoor",
      "type": "Registerbekanntmachung nach dem Umwandlungsgesetz",
      "state": "Bayern",
      "amtsgericht": "Amtsgericht Traunstein",
      "registernummer": "HRB 3781",
      "registerart": "HRB",
      "company_name": "LOTEC GmbH Kurt Lotterschmid Automobiltechnik",
      "company_seat": "Kolbermoor",
      "details": "20.01.2026 (Bekanntmachungsdatum)\n\nBayern Amtsgericht Traunstein HRB 3781\nRegisterbekanntmachung nach dem Umwandlungsgesetz 17.01.2026 (Eintragungsdatum)\n\nLOTEC GmbH Kurt Lotterschmid Automobiltechnik\nGesellschaft mit beschränkter Haftung\nKolbermoor\n\nDen Gläubigern der an der Spaltung beteiligten Rechtsträger ist, wenn sie binnen sechs Monaten nach dem Tag, an dem die Eintragung der Spaltung in das Register des Sitzes desjenigen Rechtsträgers, dessen Gläubiger sie sind, nach §§ 125, 19 Abs. 3 UmwG als bekannt gemacht gilt, ihren Anspruch nach Grund und Höhe in Textform anmelden, Sicherheit zu leisten, soweit sie nicht Befriedigung verlangen können. Dieses Recht steht den Gläubigern jedoch nur zu, wenn sie glaubhaft machen, dass durch die Spaltung die Erfüllung ihrer Forderung gefährdet wird."
    },
    {
      "date": "2026-01-20",
      "id": "142845",
      "original_text": "Registerbekanntmachung nach dem Umwandlungsgesetz\nBayern Amtsgericht Nürnberg HRB 44561\nAS Steuerberatungsgesellschaft UG (haftungsbeschränkt) – Neumarkt i.d.OPf.",
      "type": "Registerbekanntmachung nach dem Umwandlungsgesetz",
      "state": "Bayern",
      "amtsgericht": "Amtsgericht Nürnberg",
      "registernummer": "HRB 44561",
      "registerart": "HRB",
      "company_name": "AS Steuerberatungsgesellschaft UG (haftungsbeschränkt)",
      "company_seat": "Neumarkt i.d.OPf.",
      "details": "20.01.2026 (Bekanntmachungsdatum)\n\nBayern Amtsgericht Nürnberg HRB 44561\nRegisterbekanntmachung nach dem Umwandlungsgesetz 19.01.2026 (Eintragungsdatum)\n\nAS Steuerberatungsgesellschaft UG (haftungsbeschränkt)\nGesellschaft mit beschränkter Haftung\nNeumarkt i.d.OPf.\n\nDen Gläubigern der an der Verschmelzung beteiligten Rechtsträger ist, wenn sie binnen sechs Monaten nach dem Tag, an dem die Eintragung der Verschmelzung in das Register des Sitzes desjenigen Rechtsträgers, dessen Gläubiger sie sind, nach § 19 Abs. 3 UmwG als bekannt gemacht gilt, ihren Anspruch nach Grund und Höhe in Textform anmelden, Sicherheit zu leisten, soweit sie nicht Befriedigung verlangen können. Dieses Recht steht den Gläubigern jedoch nur zu, wenn sie glaubhaft machen, dass durch die Verschmelzung die Erfüllung ihrer Forderung gefährdet wird."
    },
    {
      "date": "2026-01-20",
      "id": "142846",
      "original_text": "Einreichung neuer Dokumente\nBayern Amtsgericht München HRB 201055\nTelefónica Deutschland Holding AG – München",
      "type": "Einreichung neuer Dokumente",
      "state": "Bayern",
      "amtsgericht": "Amtsgericht München",
      "registernummer": "HRB 201055",
      "registerart": "HRB",
      "company_name": "Telefónica Deutschland Holding AG",
      "company_seat": "München",
      "details": "20.01.2026 (Bekanntmachungsdatum)\n\nBayern Amtsgericht München HRB 201055\nEinreichung neuer Dokumente\n\nTelefónica Deutschland Holding AG\nAktiengesellschaft\nMünchen\n\nDem Amtsgericht München -Registergericht- ist eine Liste der Mitglieder des Aufsichtsrats eingereicht worden, § 106 AktG."
    },
    {
      "date": "2026-01-20",
      "id": "142847",
      "original_text": "Registerbekanntmachung nach dem Umwandlungsgesetz\nBayern Amtsgericht München HRB 112764\nGFI Gesellschaft für Intelligente Finanzkonzepte mbH – Unterföhring",
      "type": "Registerbekanntmachung nach dem Umwandlungsgesetz",
      "state": "Bayern",
      "amtsgericht": "Amtsgericht München",
      "registernummer": "HRB 112764",
      "registerart": "HRB",
      "company_name": "GFI Gesellschaft für Intelligente Finanzkonzepte mbH",
      "company_seat": "Unterföhring",
      "details": "20.01.2026 (Bekanntmachungsdatum)\n\nBayern Amtsgericht München HRB 112764\nRegisterbekanntmachung nach dem Umwandlungsgesetz 19.01.2026 (Eintragungsdatum)\n\nGFI Gesellschaft für Intelligente Finanzkonzepte mbH\nGesellschaft mit beschränkter Haftung\nUnterföhring\n\nDen Gläubigern der an der Verschmelzung beteiligten Rechtsträger ist, wenn sie binnen sechs Monaten nach dem Tag, an dem die Eintragung der Verschmelzung in das Register des Sitzes desjenigen Rechtsträgers, dessen Gläubiger sie sind, nach § 19 Abs. 3 UmwG als bekannt gemacht gilt, ihren Anspruch nach Grund und Höhe in Textform anmelden, Sicherheit zu leisten, soweit sie nicht Befriedigung verlangen können. Dieses Recht steht den Gläubigern jedoch nur zu, wenn sie glaubhaft machen, dass durch die Verschmelzung die Erfüllung ihrer Forderung gefährdet wird."
    },
    {
      "date": "2026-01-20",
      "id": "142848",
      "original_text": "Registerbekanntmachung nach dem Umwandlungsgesetz\nBayern Amtsgericht Ansbach HRB 4847\nSpectrum GmbH Kunststofftechnik – Lichtenau",
      "type": "Registerbekanntmachung nach dem Umwandlungsgesetz",
      "state": "Bayern",
      "amtsgericht": "Amtsgericht Ansbach",
      "registernummer": "HRB 4847",
      "registerart": "HRB",
      "company_name": "Spectrum GmbH Kunststofftechnik",
      "company_seat": "Lichtenau",
      "details": "20.01.2026 (Bekanntmachungsdatum)\n\nBayern Amtsgericht Ansbach HRB 4847\nRegisterbekanntmachung nach dem Umwandlungsgesetz 19.01.2026 (Eintragungsdatum)\n\nSpectrum GmbH Kunststofftechnik\nGesellschaft mit beschränkter Haftung\nLichtenau\n\nDen Gläubigern der an der Verschmelzung beteiligten Rechtsträger ist, wenn sie binnen sechs Monaten nach dem Tag, an dem die Eintragung der Verschmelzung in das Register des Sitzes desjenigen Rechtsträgers, dessen Gläubiger sie sind, nach § 19 Abs. 3 UmwG als bekannt gemacht gilt, ihren Anspruch nach Grund und Höhe in Textform anmelden, Sicherheit zu leisten, soweit sie nicht Befriedigung verlangen können. Dieses Recht steht den Gläubigern jedoch nur zu, wenn sie glaubhaft machen, dass durch die Verschmelzung die Erfüllung ihrer Forderung gefährdet wird."
    },
    {
      "date": "2026-01-20",
      "id": "142849",
      "original_text": "Sonstige Registerbekanntmachung\nBayern Amtsgericht Augsburg HRB 14288\nPegasus Anlagen- und Assekuranzmakler GmbH – Harburg",
      "type": "Sonstige Registerbekanntmachung",
      "state": "Bayern",
      "amtsgericht": "Amtsgericht Augsburg",
      "registernummer": "HRB 14288",
      "registerart": "HRB",
      "company_name": "Pegasus Anlagen- und Assekuranzmakler GmbH",
      "company_seat": "Harburg",
      "details": "20.01.2026 (Bekanntmachungsdatum)\n\nBayern Amtsgericht Augsburg HRB 14288\nSonstige Registerbekanntmachung 19.01.2026 (Eintragungsdatum)\n\nPegasus Anlagen- und Assekuranzmakler GmbH\nGesellschaft mit beschränkter Haftung\nHarburg\n\nDen Gläubigern der Gesellschaft, deren Forderungen begründet worden sind, bevor die Eintragung der Beendigung des\n\"Beherrschungs- und Gewinnabführungsvertrages\",\nin das Handelsregister nach § 10 des Handelsgesetzbuches als bekanntgemacht gilt, hat der andere Vertragsteil Sicherheit zu leisten, wenn sie sich binnen sechs Monaten nach der Bekanntmachung der Eintragung zu diesem Zweck bei ihm melden."
    },
    {
      "date": "2026-01-20",
      "id": "142850",
      "original_text": "Sonstige Registerbekanntmachung\nBayern Amtsgericht Nürnberg HRB 40638\nSolutions 30 Field Services GmbH – Nürnberg",
      "type": "Sonstige Registerbekanntmachung",
      "state": "Bayern",
      "amtsgericht": "Amtsgericht Nürnberg",
      "registernummer": "HRB 40638",
      "registerart": "HRB",
      "company_name": "Solutions 30 Field Services GmbH",
      "company_seat": "Nürnberg",
      "details": "20.01.2026 (Bekanntmachungsdatum)\n\nBayern Amtsgericht Nürnberg HRB 40638\nSonstige Registerbekanntmachung 19.01.2026 (Eintragungsdatum)\n\nSolutions 30 Field Services GmbH\nGesellschaft mit beschränkter Haftung\nNürnberg\n\nDen Gläubigern der Gesellschaft, deren Forderungen begründet worden sind, bevor die Eintragung der Beendigung des Beherrschungs- und Gewinnabführungsvertrages in das Handelsregister nach § 10 des Handelsgesetzbuches als bekanntgemacht gilt, hat der andere Vertragsteil Sicherheit zu leisten, wenn sie sich binnen sechs Monaten nach der Bekanntmachung der Eintragung zu diesem Zweck bei ihm melden."
    },
    {
      "date": "2026-01-20",
      "id": "142851",
      "original_text": "Registerbekanntmachung nach dem Umwandlungsgesetz\nBayern Amtsgericht München HRB 306266\nFinancial Management Group FMG GmbH – München",
      "type": "Registerbekanntmachung nach dem Umwandlungsgesetz",
      "state": "Bayern",
      "amtsgericht": "Amtsgericht München",
      "registernummer": "HRB 306266",
      "registerart": "HRB",
      "company_name": "Financial Management Group FMG GmbH",
      "company_seat": "München",
      "details": "20.01.2026 (Bekanntmachungsdatum)\n\nBayern Amtsgericht München HRB 306266\nRegisterbekanntmachung nach dem Umwandlungsgesetz 19.01.2026 (Eintragungsdatum)\n\nFinancial Management Group FMG GmbH\nGesellschaft mit beschränkter Haftung\nMünchen\n\nDen Gläubigern der an der Verschmelzung beteiligten Rechtsträger ist, wenn sie binnen sechs Monaten nach dem Tag, an dem die Eintragung der Verschmelzung in das Register des Sitzes desjenigen Rechtsträgers, dessen Gläubiger sie sind, nach § 19 Abs. 3 UmwG als bekannt gemacht gilt, ihren Anspruch nach Grund und Höhe in Textform anmelden, Sicherheit zu leisten, soweit sie nicht Befriedigung verlangen können. Dieses Recht steht den Gläubigern jedoch nur zu, wenn sie glaubhaft machen, dass durch die Verschmelzung die Erfüllung ihrer Forderung gefährdet wird."
    },
    {
      "date": "2026-01-20",
      "id": "142852",
      "original_text": "Löschungsankündigung\nBayern Amtsgericht München HRB 256744\nRKS Concept GmbH – Gräfelfing",
      "type": "Löschungsankündigung",
      "state": "Bayern",
      "amtsgericht": "Amtsgericht München",
      "registernummer": "HRB 256744",
      "registerart": "HRB",
      "company_name": "RKS Concept GmbH",
      "company_seat": "Gräfelfing",
      "details": "20.01.2026 (Bekanntmachungsdatum)\n\nBayern Amtsgericht München HRB 256744\nLöschungsankündigung 19.01.2026 (Eintragungsdatum)\n\nRKS Concept GmbH\nGesellschaft mit beschränkter Haftung\nGräfelfing\n\nDas Registergericht beabsichtigt, die im Handelsregister eingetragene Gesellschaft wegen Vermögenslosigkeit von Amts wegen nach § 394 FamFG zu löschen. Die Frist zur Erhebung eines Widerspruchs ist auf drei Monate festgesetzt."
    },
    {
      "date": "2026-01-20",
      "id": "142853",
      "original_text": "Löschungsankündigung\nBayern Amtsgericht Nürnberg HRB 37838\naytim solutions GmbH – Nürnberg",
      "type": "Löschungsankündigung",
      "state": "Bayern",
      "amtsgericht": "Amtsgericht Nürnberg",
      "registernummer": "HRB 37838",
      "registerart": "HRB",
      "company_name": "aytim solutions GmbH",
      "company_seat": "Nürnberg",
      "details": "20.01.2026 (Bekanntmachungsdatum)\n\nBayern Amtsgericht Nürnberg HRB 37838\nLöschungsankündigung\n\naytim solutions GmbH\nGesellschaft mit beschränkter Haftung\nNürnberg\n\nDas Registergericht beabsichtigt, die im Handelsregister eingetragene Gesellschaft wegen Vermögenslosigkeit von Amts wegen nach § 394 FamFG zu löschen. Die Frist zur Erhebung eines Widerspruchs ist auf einen Monat festgesetzt."
    },
    {
      "date": "2026-01-20",
      "id": "142854",
      "original_text": "Registerbekanntmachung nach dem Umwandlungsgesetz\nBayern Amtsgericht München HRB 226414\nKorian Buchenpark GmbH – München",
      "type": "Registerbekanntmachung nach dem Umwandlungsgesetz",
      "state": "Bayern",
      "amtsgericht": "Amtsgericht München",
      "registernummer": "HRB 226414",
      "registerart": "HRB",
      "company_name": "Korian Buchenpark GmbH",
      "company_seat": "München",
      "details": "20.01.2026 (Bekanntmachungsdatum)\n\nBayern Amtsgericht München HRB 226414\nRegisterbekanntmachung nach dem Umwandlungsgesetz 19.01.2026 (Eintragungsdatum)\n\nKorian Buchenpark GmbH\nGesellschaft mit beschränkter Haftung\nMünchen\n\nDen Gläubigern der an der Verschmelzung beteiligten Rechtsträger ist, wenn sie binnen sechs Monaten nach dem Tag, an dem die Eintragung der Verschmelzung in das Register des Sitzes desjenigen Rechtsträgers, dessen Gläubiger sie sind, nach § 19 Abs. 3 UmwG als bekannt gemacht gilt, ihren Anspruch nach Grund und Höhe in Textform anmelden, Sicherheit zu leisten, soweit sie nicht Befriedigung verlangen können. Dieses Recht steht den Gläubigern jedoch nur zu, wenn sie glaubhaft machen, dass durch die Verschmelzung die Erfüllung ihrer Forderung gefährdet wird."
    },
    {
      "date": "2026-01-20",
      "id": "142855",
      "original_text": "Einreichung neuer Dokumente\nBayern Amtsgericht München HRB 132989\nMEAG MUNICH ERGO Kapitalanlagegesellschaft mbH – München",
      "type": "Einreichung neuer Dokumente",
      "state": "Bayern",
      "amtsgericht": "Amtsgericht München",
      "registernummer": "HRB 132989",
      "registerart": "HRB",
      "company_name": "MEAG MUNICH ERGO Kapitalanlagegesellschaft mbH",
      "company_seat": "München",
      "details": "20.01.2026 (Bekanntmachungsdatum)\n\nBayern Amtsgericht München HRB 132989\nEinreichung neuer Dokumente\n\nMEAG MUNICH ERGO Kapitalanlagegesellschaft mbH\nGesellschaft mit beschränkter Haftung\nMünchen\n\nDem #Re.Name ist eine Liste der Mitglieder des Aufsichtsrats eingereicht worden, § 52 Abs. 3 S. 2 GmbHG."
    },
    {
      "date": "2026-01-20",
      "id": "142856",
      "original_text": "Registerbekanntmachung nach dem Umwandlungsgesetz\nBayern Amtsgericht Traunstein HRB 34686\nLotterschmid Pensionsverwaltung GmbH – Kolbermoor",
      "type": "Registerbekanntmachung nach dem Umwandlungsgesetz",
      "state": "Bayern",
      "amtsgericht": "Amtsgericht Traunstein",
      "registernummer": "HRB 34686",
      "registerart": "HRB",
      "company_name": "Lotterschmid Pensionsverwaltung GmbH",
      "company_seat": "Kolbermoor",
      "details": "20.01.2026 (Bekanntmachungsdatum)\n\nBayern Amtsgericht Traunstein HRB 34686\nRegisterbekanntmachung nach dem Umwandlungsgesetz 17.01.2026 (Eintragungsdatum)\n\nLotterschmid Pensionsverwaltung GmbH\nGesellschaft mit beschränkter Haftung\nKolbermoor\n\nDen Gläubigern der an der Spaltung beteiligten Rechtsträger ist, wenn sie binnen sechs Monaten nach dem Tag, an dem die Eintragung der Spaltung in das Register des Sitzes desjenigen Rechtsträgers, dessen Gläubiger sie sind, nach §§ 125, 19 Abs. 3 UmwG als bekannt gemacht gilt, ihren Anspruch nach Grund und Höhe in Textform anmelden, Sicherheit zu leisten, soweit sie nicht Befriedigung verlangen können. Dieses Recht steht den Gläubigern jedoch nur zu, wenn sie glaubhaft machen, dass durch die Spaltung die Erfüllung ihrer Forderung gefährdet wird."
    },
    {
      "date": "2026-01-20",
      "id": "142857",
      "original_text": "Registerbekanntmachung nach dem Umwandlungsgesetz\nBayern Amtsgericht Fürth HRB 21750\nMaximilian Bauer Holding GmbH – Röttenbach",
      "type": "Registerbekanntmachung nach dem Umwandlungsgesetz",
      "state": "Bayern",
      "amtsgericht": "Amtsgericht Fürth",
      "registernummer": "HRB 21750",
      "registerart": "HRB",
      "company_name": "Maximilian Bauer Holding GmbH",
      "company_seat": "Röttenbach",
      "details": "20.01.2026 (Bekanntmachungsdatum)\n\nBayern Amtsgericht Fürth HRB 21750\nRegisterbekanntmachung nach dem Umwandlungsgesetz 19.01.2026 (Eintragungsdatum)\n\nMaximilian Bauer Holding GmbH\nGesellschaft mit beschränkter Haftung\nRöttenbach\n\nDen Gläubigern der an der Verschmelzung beteiligten Rechtsträger ist, wenn sie binnen sechs Monaten nach dem Tag, an dem die Eintragung der Verschmelzung in das Register des Sitzes desjenigen Rechtsträgers, dessen Gläubiger sie sind, nach § 19 Abs. 3 UmwG als bekannt gemacht gilt, ihren Anspruch nach Grund und Höhe in Textform anmelden, Sicherheit zu leisten, soweit sie nicht Befriedigung verlangen können. Dieses Recht steht den Gläubigern jedoch nur zu, wenn sie glaubhaft machen, dass durch die Verschmelzung die Erfüllung ihrer Forderung gefährdet wird."
    },
    {
      "date": "2026-01-20",
      "id": "142858",
      "original_text": "Löschungsankündigung\nBayern Amtsgericht Coburg HRB 4846\nISB Packaging GmbH – Sonnefeld",
      "type": "Löschungsankündigung",
      "state": "Bayern",
      "amtsgericht": "Amtsgericht Coburg",
      "registernummer": "HRB 4846",
      "registerart": "HRB",
      "company_name": "ISB Packaging GmbH",
      "company_seat": "Sonnefeld",
      "details": "20.01.2026 (Bekanntmachungsdatum)\n\nBayern Amtsgericht Coburg HRB 4846\nLöschungsankündigung\n\nISB Packaging GmbH\nGesellschaft mit beschränkter Haftung\nSonnefeld\n\nDas Registergericht beabsichtigt, die im Handelsregister eingetragene Gesellschaft wegen Vermögenslosigkeit von Amts wegen nach § 394 FamFG zu löschen. Die Frist zur Erhebung eines Widerspruchs ist auf sechs Wochen festgesetzt."
    },
    {
      "date": "2026-01-20",
      "id": "142859",
      "original_text": "Registerbekanntmachung nach dem Umwandlungsgesetz\nBayern Amtsgericht München HRB 279648\nCS CLEAN SOLUTIONS GmbH – Ismaning",
      "type": "Registerbekanntmachung nach dem Umwandlungsgesetz",
      "state": "Bayern",
      "amtsgericht": "Amtsgericht München",
      "registernummer": "HRB 279648",
      "registerart": "HRB",
      "company_name": "CS CLEAN SOLUTIONS GmbH",
      "company_seat": "Ismaning",
      "details": "20.01.2026 (Bekanntmachungsdatum)\n\nBayern Amtsgericht München HRB 279648\nRegisterbekanntmachung nach dem Umwandlungsgesetz 19.01.2026 (Eintragungsdatum)\n\nCS CLEAN SOLUTIONS GmbH\nGesellschaft mit beschränkter Haftung\nIsmaning\n\nDen Gläubigern der an der Verschmelzung beteiligten Rechtsträger ist, wenn sie binnen sechs Monaten nach dem Tag, an dem die Eintragung der Verschmelzung in das Register des Sitzes desjenigen Rechtsträgers, dessen Gläubiger sie sind, nach § 19 Abs. 3 UmwG als bekannt gemacht gilt, ihren Anspruch nach Grund und Höhe in Textform anmelden, Sicherheit zu leisten, soweit sie nicht Befriedigung verlangen können. Dieses Recht steht den Gläubigern jedoch nur zu, wenn sie glaubhaft machen, dass durch die Verschmelzung die Erfüllung ihrer Forderung gefährdet wird."
    },
    {
      "date": "2026-01-20",
      "id": "142860",
      "original_text": "Löschungsankündigung\nBayern Amtsgericht Nürnberg HRB 17989\nZweirad Union Fahrzeugtechnik GmbH – Nürnberg",
      "type": "Löschungsankündigung",
      "state": "Bayern",
      "amtsgericht": "Amtsgericht Nürnberg",
      "registernummer": "HRB 17989",
      "registerart": "HRB",
      "company_name": "Zweirad Union Fahrzeugtechnik GmbH",
      "company_seat": "Nürnberg",
      "details": "20.01.2026 (Bekanntmachungsdatum)\n\nBayern Amtsgericht Nürnberg HRB 17989\nLöschungsankündigung\n\nZweirad Union Fahrzeugtechnik GmbH\nGesellschaft mit beschränkter Haftung\nNürnberg\n\nDas Registergericht beabsichtigt, die im Handelsregister eingetragene Gesellschaft wegen Vermögenslosigkeit von Amts wegen nach § 394 FamFG zu löschen. Die Frist zur Erhebung eines Widerspruchs ist auf einen Monat festgesetzt."
    },
    {
      "date": "2026-01-20",
      "id": "142861",
      "original_text": "Registerbekanntmachung nach dem Umwandlungsgesetz\nBayern Amtsgericht Fürth HRB 21759\nPascal Wallstab Holding GmbH – Röttenbach",
      "type": "Registerbekanntmachung nach dem Umwandlungsgesetz",
      "state": "Bayern",
      "amtsgericht": "Amtsgericht Fürth",
      "registernummer": "HRB 21759",
      "registerart": "HRB",
      "company_name": "Pascal Wallstab Holding GmbH",
      "company_seat": "Röttenbach",
      "details": "20.01.2026 (Bekanntmachungsdatum)\n\nBayern Amtsgericht Fürth HRB 21759\nRegisterbekanntmachung nach dem Umwandlungsgesetz 19.01.2026 (Eintragungsdatum)\n\nPascal Wallstab Holding GmbH\nGesellschaft mit beschränkter Haftung\nRöttenbach\n\nDen Gläubigern der an der Verschmelzung beteiligten Rechtsträger ist, wenn sie binnen sechs Monaten nach dem Tag, an dem die Eintragung der Verschmelzung in das Register des Sitzes desjenigen Rechtsträgers, dessen Gläubiger sie sind, nach § 19 Abs. 3 UmwG als bekannt gemacht gilt, ihren Anspruch nach Grund und Höhe in Textform anmelden, Sicherheit zu leisten, soweit sie nicht Befriedigung verlangen können. Dieses Recht steht den Gläubigern jedoch nur zu, wenn sie glaubhaft machen, dass durch die Verschmelzung die Erfüllung ihrer Forderung gefährdet wird."
    },
    {
      "date": "2026-01-20",
      "id": "142862",
      "original_text": "Löschungsankündigung\nBayern Amtsgericht München HRB 272847\nHiltscher Wohnungsbau GmbH – München",
      "type": "Löschungsankündigung",
      "state": "Bayern",
      "amtsgericht": "Amtsgericht München",
      "registernummer": "HRB 272847",
      "registerart": "HRB",
      "company_name": "Hiltscher Wohnungsbau GmbH",
      "company_seat": "München",
      "details": "20.01.2026 (Bekanntmachungsdatum)\n\nBayern Amtsgericht München HRB 272847\nLöschungsankündigung 19.01.2026 (Eintragungsdatum)\n\nHiltscher Wohnungsbau GmbH\nGesellschaft mit beschränkter Haftung\nMünchen\n\nDas Registergericht beabsichtigt, die im Handelsregister eingetragene Gesellschaft wegen Vermögenslosigkeit von Amts wegen nach § 394 FamFG zu löschen. Die Frist zur Erhebung eines Widerspruchs ist auf drei Monate festgesetzt."
    },
    {
      "date": "2026-01-20",
      "id": "142863",
      "original_text": "Registerbekanntmachung nach dem Umwandlungsgesetz\nBayern Amtsgericht München HRB 52513\nTarga Musikverlag GmbH – München",
      "type": "Registerbekanntmachung nach dem Umwandlungsgesetz",
      "state": "Bayern",
      "amtsgericht": "Amtsgericht München",
      "registernummer": "HRB 52513",
      "registerart": "HRB",
      "company_name": "Targa Musikverlag GmbH",
      "company_seat": "München",
      "details": "20.01.2026 (Bekanntmachungsdatum)\n\nBayern Amtsgericht München HRB 52513\nRegisterbekanntmachung nach dem Umwandlungsgesetz 19.01.2026 (Eintragungsdatum)\n\nTarga Musikverlag GmbH\nGesellschaft mit beschränkter Haftung\nMünchen\n\nDen Gläubigern der an der Verschmelzung beteiligten Rechtsträger ist, wenn sie binnen sechs Monaten nach dem Tag, an dem die Eintragung der Verschmelzung in das Register des Sitzes desjenigen Rechtsträgers, dessen Gläubiger sie sind, nach § 19 Abs. 3 UmwG als bekannt gemacht gilt, ihren Anspruch nach Grund und Höhe in Textform anmelden, Sicherheit zu leisten, soweit sie nicht Befriedigung verlangen können. Dieses Recht steht den Gläubigern jedoch nur zu, wenn sie glaubhaft machen, dass durch die Verschmelzung die Erfüllung ihrer Forderung gefährdet wird."
    },
    {
      "date": "2026-01-20",
      "id": "142864",
      "original_text": "Sonstige Registerbekanntmachung\nBayern Amtsgericht München HRB 189823\ninnosabi GmbH – München",
      "type": "Sonstige Registerbekanntmachung",
      "state": "Bayern",
      "amtsgericht": "Amtsgericht München",
      "registernummer": "HRB 189823",
      "registerart": "HRB",
      "company_name": "innosabi GmbH",
      "company_seat": "München",
      "details": "20.01.2026 (Bekanntmachungsdatum)\n\nBayern Amtsgericht München HRB 189823\nSonstige Registerbekanntmachung 19.01.2026 (Eintragungsdatum)\n\ninnosabi GmbH\nGesellschaft mit beschränkter Haftung\nMünchen\n\nDen Gläubigern der Gesellschaft, deren Forderungen begründet worden sind, bevor die Eintragung der Beendigung des Gewinnabführungsvertrages in das Handelsregister nach § 10 des Handelsgesetzbuches als bekanntgemacht gilt, hat der andere Vertragsteil Sicherheit zu leisten, wenn sie sich binnen sechs Monaten nach der Bekanntmachung der Eintragung zu diesem Zweck bei ihm melden."
    },
    {
      "date": "2026-01-20",
      "id": "142865",
      "original_text": "Registerbekanntmachung nach dem Umwandlungsgesetz\nBayern Amtsgericht Traunstein HRB 11501\nSTEIGENBERGER HOTELFACHSCHULE GMBH – Bad Reichenhall",
      "type": "Registerbekanntmachung nach dem Umwandlungsgesetz",
      "state": "Bayern",
      "amtsgericht": "Amtsgericht Traunstein",
      "registernummer": "HRB 11501",
      "registerart": "HRB",
      "company_name": "STEIGENBERGER HOTELFACHSCHULE GMBH",
      "company_seat": "Bad Reichenhall",
      "details": "20.01.2026 (Bekanntmachungsdatum)\n\nBayern Amtsgericht Traunstein HRB 11501\nRegisterbekanntmachung nach dem Umwandlungsgesetz 19.01.2026 (Eintragungsdatum)\n\nSTEIGENBERGER HOTELFACHSCHULE GMBH\nGesellschaft mit beschränkter Haftung\nBad Reichenhall\n\nDen Gläubigern der an der Verschmelzung beteiligten Rechtsträger ist, wenn sie binnen sechs Monaten nach dem Tag, an dem die Eintragung der Verschmelzung in das Register des Sitzes desjenigen Rechtsträgers, dessen Gläubiger sie sind, nach § 19 Abs. 3 UmwG als bekannt gemacht gilt, ihren Anspruch nach Grund und Höhe in Textform anmelden, Sicherheit zu leisten, soweit sie nicht Befriedigung verlangen können. Dieses Recht steht den Gläubigern jedoch nur zu, wenn sie glaubhaft machen, dass durch die Verschmelzung die Erfüllung ihrer Forderung gefährdet wird."
    },
    {
      "date": "2026-01-20",
      "id": "142866",
      "original_text": "Sonstige Registerbekanntmachung\nBayern Amtsgericht Bayreuth HRB 1300\nMRH Trowe Pegnitz GmbH – Pegnitz",
      "type": "Sonstige Registerbekanntmachung",
      "state": "Bayern",
      "amtsgericht": "Amtsgericht Bayreuth",
      "registernummer": "HRB 1300",
      "registerart": "HRB",
      "company_name": "MRH Trowe Pegnitz GmbH",
      "company_seat": "Pegnitz",
      "details": "20.01.2026 (Bekanntmachungsdatum)\n\nBayern Amtsgericht Bayreuth HRB 1300\nSonstige Registerbekanntmachung 19.01.2026 (Eintragungsdatum)\n\nMRH Trowe Pegnitz GmbH\nGesellschaft mit beschränkter Haftung\nPegnitz\n\nDen Gläubigern der Gesellschaft, deren Forderungen begründet worden sind, bevor die Eintragung der Beendigung des Beherrschungs- und Ergebnisabführungsvertrages in das Handelsregister nach § 10 des Handelsgesetzbuches als bekanntgemacht gilt, hat der andere Vertragsteil Sicherheit zu leisten, wenn sie sich binnen sechs Monaten nach der Bekanntmachung der Eintragung zu diesem Zweck bei ihm melden."
    },
    {
      "date": "2026-01-20",
      "id": "142867",
      "original_text": "Löschungsankündigung\nBayern Amtsgericht Fürth HRB 17371\nTyren Trade UG (haftungsbeschränkt) – Eckental",
      "type": "Löschungsankündigung",
      "state": "Bayern",
      "amtsgericht": "Amtsgericht Fürth",
      "registernummer": "HRB 17371",
      "registerart": "HRB",
      "company_name": "Tyren Trade UG (haftungsbeschränkt)",
      "company_seat": "Eckental",
      "details": "20.01.2026 (Bekanntmachungsdatum)\n\nBayern Amtsgericht Fürth HRB 17371\nLöschungsankündigung\n\nTyren Trade UG (haftungsbeschränkt)\nGesellschaft mit beschränkter Haftung\nEckental\n\nDas Registergericht beabsichtigt, die im Handelsregister eingetragene Gesellschaft wegen Vermögenslosigkeit von Amts wegen nach § 394 FamFG zu löschen. Die Frist zur Erhebung eines Widerspruchs ist auf drei Monate festgesetzt."
    },
    {
      "date": "2026-01-20",
      "id": "142868",
      "original_text": "Registerbekanntmachung nach dem Umwandlungsgesetz\nBayern Amtsgericht Fürth HRB 21801\nBAUER & WALLSTAB Wohnbau Projekt I GmbH – Röttenbach",
      "type": "Registerbekanntmachung nach dem Umwandlungsgesetz",
      "state": "Bayern",
      "amtsgericht": "Amtsgericht Fürth",
      "registernummer": "HRB 21801",
      "registerart": "HRB",
      "company_name": "BAUER & WALLSTAB Wohnbau Projekt I GmbH",
      "company_seat": "Röttenbach",
      "details": "20.01.2026 (Bekanntmachungsdatum)\n\nBayern Amtsgericht Fürth HRB 21801\nRegisterbekanntmachung nach dem Umwandlungsgesetz 19.01.2026 (Eintragungsdatum)\n\nBAUER & WALLSTAB Wohnbau Projekt I GmbH\nGesellschaft mit beschränkter Haftung\nRöttenbach\n\nDen Gläubigern der an der Verschmelzung beteiligten Rechtsträger ist, wenn sie binnen sechs Monaten nach dem Tag, an dem die Eintragung der Verschmelzung in das Register des Sitzes desjenigen Rechtsträgers, dessen Gläubiger sie sind, nach § 19 Abs. 3 UmwG als bekannt gemacht gilt, ihren Anspruch nach Grund und Höhe in Textform anmelden, Sicherheit zu leisten, soweit sie nicht Befriedigung verlangen können. Dieses Recht steht den Gläubigern jedoch nur zu, wenn sie glaubhaft machen, dass durch die Verschmelzung die Erfüllung ihrer Forderung gefährdet wird."
    },
    {
      "date": "2026-01-20",
      "id": "142869",
      "original_text": "Löschungsankündigung\nBayern Amtsgericht München HRB 204076\nSchaffer Trucks GmbH – Vaterstetten",
      "type": "Löschungsankündigung",
      "state": "Bayern",
      "amtsgericht": "Amtsgericht München",
      "registernummer": "HRB 204076",
      "registerart": "HRB",
      "company_name": "Schaffer Trucks GmbH",
      "company_seat": "Vaterstetten",
      "details": "20.01.2026 (Bekanntmachungsdatum)\n\nBayern Amtsgericht München HRB 204076\nLöschungsankündigung\n\nSchaffer Trucks GmbH\nGesellschaft mit beschränkter Haftung\nVaterstetten\n\nDas Registergericht beabsichtigt, die im Handelsregister eingetragene Gesellschaft wegen Vermögenslosigkeit von Amts wegen nach § 394 FamFG zu löschen. Die Frist zur Erhebung eines Widerspruchs ist auf drei Monate festgesetzt."
    },
    {
      "date": "2026-01-20",
      "id": "142870",
      "original_text": "Einreichung neuer Dokumente\nBayern Amtsgericht München HRB 163554\nACTRON AG – Parsdorf",
      "type": "Einreichung neuer Dokumente",
      "state": "Bayern",
      "amtsgericht": "Amtsgericht München",
      "registernummer": "HRB 163554",
      "registerart": "HRB",
      "company_name": "ACTRON AG",
      "company_seat": "Parsdorf",
      "details": "20.01.2026 (Bekanntmachungsdatum)\n\nBayern Amtsgericht München HRB 163554\nEinreichung neuer Dokumente 19.01.2026 (Eintragungsdatum)\n\nACTRON AG\nAktiengesellschaft\nParsdorf\n\nDem Amtsgericht München -Registergericht- ist eine Liste der Mitglieder des Aufsichtsrats eingereicht worden, § 106 AktG."
    },
    {
      "date": "2026-01-20",
      "id": "142871",
      "original_text": "Löschungsankündigung\nBayern Amtsgericht Regensburg HRB 14305\nfriends4media GmbH – Regensburg",
      "type": "Löschungsankündigung",
      "state": "Bayern",
      "amtsgericht": "Amtsgericht Regensburg",
      "registernummer": "HRB 14305",
      "registerart": "HRB",
      "company_name": "friends4media GmbH",
      "company_seat": "Regensburg",
      "details": "20.01.2026 (Bekanntmachungsdatum)\n\nBayern Amtsgericht Regensburg HRB 14305\nLöschungsankündigung 19.01.2026 (Eintragungsdatum)\n\nfriends4media GmbH\nGesellschaft mit beschränkter Haftung\nRegensburg\n\nDas Registergericht beabsichtigt, die im Handelsregister eingetragene Gesellschaft wegen Vermögenslosigkeit von Amts wegen nach § 394 FamFG zu löschen. Die Frist zur Erhebung eines Widerspruchs ist auf einen Monat festgesetzt."
    },
    {
      "date": "2026-01-20",
      "id": "142872",
      "original_text": "Sonstige Registerbekanntmachung\nBayern Amtsgericht München HRB 201924\nKraussMaffei Technologies GmbH – Vaterstetten, OT Parsdorf",
      "type": "Sonstige Registerbekanntmachung",
      "state": "Bayern",
      "amtsgericht": "Amtsgericht München",
      "registernummer": "HRB 201924",
      "registerart": "HRB",
      "company_name": "KraussMaffei Technologies GmbH",
      "company_seat": "Vaterstetten, OT Parsdorf",
      "details": "20.01.2026 (Bekanntmachungsdatum)\n\nBayern Amtsgericht München HRB 201924\nSonstige Registerbekanntmachung 18.12.2025 (Eintragungsdatum)\n\nKraussMaffei Technologies GmbH\nGesellschaft mit beschränkter Haftung\nVaterstetten, OT Parsdorf\n\nDem Amtsgericht München -Registergericht- ist eine Liste der Mitglieder des Aufsichtsrats eingereicht worden, § 52 Abs. 3 S. 2 GmbHG."
    },
    {
      "date": "2026-01-20",
      "id": "142873",
      "original_text": "Sonstige Registerbekanntmachung\nBayern Amtsgericht Nürnberg HRB 25498\nWeatherdock AG – Nürnberg",
      "type": "Sonstige Registerbekanntmachung",
      "state": "Bayern",
      "amtsgericht": "Amtsgericht Nürnberg",
      "registernummer": "HRB 25498",
      "registerart": "HRB",
      "company_name": "Weatherdock AG",
      "company_seat": "Nürnberg",
      "details": "20.01.2026 (Bekanntmachungsdatum)\n\nBayern Amtsgericht Nürnberg HRB 25498\nSonstige Registerbekanntmachung\n\nWeatherdock AG\nAktiengesellschaft\nNürnberg\n\nDem Amtsgericht Nürnberg -Registergericht- ist eine Liste der Mitglieder des Aufsichtsrats eingereicht worden, § 106 AktG."
    },
    {
      "date": "2026-01-20",
      "id": "142874",
      "original_text": "Löschungsankündigung\nBayern Amtsgericht München HRB 278737\nKamba Laxo UG (haftungsbeschränkt) – Poing",
      "type": "Löschungsankündigung",
      "state": "Bayern",
      "amtsgericht": "Amtsgericht München",
      "registernummer": "HRB 278737",
      "registerart": "HRB",
      "company_name": "Kamba Laxo UG (haftungsbeschränkt)",
      "company_seat": "Poing",
      "details": "20.01.2026 (Bekanntmachungsdatum)\n\nBayern Amtsgericht München HRB 278737\nLöschungsankündigung 15.01.2026 (Eintragungsdatum)\n\nKamba Laxo UG (haftungsbeschränkt)\nGesellschaft mit beschränkter Haftung\nPoing\n\nDas Registergericht beabsichtigt, die im Handelsregister eingetragene Gesellschaft wegen Vermögenslosigkeit von Amts wegen nach § 394 FamFG zu löschen. Die Frist zur Erhebung eines Widerspruchs ist auf drei Monate festgesetzt."
    },
    {
      "date": "2026-01-20",
      "id": "142875",
      "original_text": "Sonstige Registerbekanntmachung\nBayern Amtsgericht Kempten (Allgäu) HRB 8208\nKunststofftechnik Bernt GmbH – Kaufbeuren",
      "type": "Sonstige Registerbekanntmachung",
      "state": "Bayern",
      "amtsgericht": "Amtsgericht Kempten (Allgäu)",
      "registernummer": "HRB 8208",
      "registerart": "HRB",
      "company_name": "Kunststofftechnik Bernt GmbH",
      "company_seat": "Kaufbeuren",
      "details": "20.01.2026 (Bekanntmachungsdatum)\n\nBayern Amtsgericht Kempten (Allgäu) HRB 8208\nSonstige Registerbekanntmachung 19.01.2026 (Eintragungsdatum)\n\nKunststofftechnik Bernt GmbH\nGesellschaft mit beschränkter Haftung\nKaufbeuren\n\nDen Gläubigern der Gesellschaft, deren Forderungen begründet worden sind, bevor die Eintragung der Beendigung des Beherrschungs- und Gewinnabführungsvertrages in das Handelsregister nach § 10 des Handelsgesetzbuches als bekanntgemacht gilt, hat der andere Vertragsteil Sicherheit zu leisten, wenn sie sich binnen sechs Monaten nach der Bekanntmachung der Eintragung zu diesem Zweck bei ihm melden."
    },
    {
      "date": "2026-01-20",
      "id": "142876",
      "original_text": "Löschungsankündigung\nBayern Amtsgericht Regensburg HRB 5432\nRötzer Automobile GmbH – Rötz, Ortsteil Hillstett",
      "type": "Löschungsankündigung",
      "state": "Bayern",
      "amtsgericht": "Amtsgericht Regensburg",
      "registernummer": "HRB 5432",
      "registerart": "HRB",
      "company_name": "Rötzer Automobile GmbH",
      "company_seat": "Rötz, Ortsteil Hillstett",
      "details": "20.01.2026 (Bekanntmachungsdatum)\n\nBayern Amtsgericht Regensburg HRB 5432\nLöschungsankündigung 19.01.2026 (Eintragungsdatum)\n\nRötzer Automobile GmbH\nGesellschaft mit beschränkter Haftung\nRötz, Ortsteil Hillstett\n\nDas Registergericht beabsichtigt, die im Handelsregister eingetragene Gesellschaft wegen Vermögenslosigkeit von Amts wegen nach § 394 FamFG zu löschen. Die Frist zur Erhebung eines Widerspruchs ist auf einen Monat festgesetzt."
    },
    {
      "date": "2026-01-20",
      "id": "142877",
      "original_text": "Registerbekanntmachung nach dem Umwandlungsgesetz\nBayern Amtsgericht München HRA 120732\nÖzüak Mustafa e.K. – München",
      "type": "Registerbekanntmachung nach dem Umwandlungsgesetz",
      "state": "Bayern",
      "amtsgericht": "Amtsgericht München",
      "registernummer": "HRA 120732",
      "registerart": "HRA",
      "company_name": "Özüak Mustafa e.K.",
      "company_seat": "München",
      "details": "20.01.2026 (Bekanntmachungsdatum)\n\nBayern Amtsgericht München HRA 120732\nRegisterbekanntmachung nach dem Umwandlungsgesetz 19.01.2026 (Eintragungsdatum)\n\nÖzüak Mustafa e.K.\nEinzelkaufmann / Einzelkauffrau\nMünchen\n\nDen Gläubigern der an der Ausgliederung beteiligten Rechtsträger ist, wenn sie binnen sechs Monaten nach dem Tag, an dem die Eintragung der Ausgliederung in das Register des Sitzes desjenigen Rechtsträgers, dessen Gläubiger sie sind, nach §§ 125, 19 Abs. 3 UmwG als bekannt gemacht gilt, ihren Anspruch nach Grund und Höhe in Textform anmelden, Sicherheit zu leisten, soweit sie nicht Befriedigung verlangen können. Dieses Recht steht den Gläubigern jedoch nur zu, wenn sie glaubhaft machen, dass durch die Ausgliederung die Erfüllung ihrer Forderung gefährdet wird."
    },
    {
      "date": "2026-01-20",
      "id": "142878",
      "original_text": "Einreichung neuer Dokumente\nBayern Amtsgericht Schweinfurt HRB 3374\nwm meyer Fahrzeugbau Aktiengesellschaft – Werneck",
      "type": "Einreichung neuer Dokumente",
      "state": "Bayern",
      "amtsgericht": "Amtsgericht Schweinfurt",
      "registernummer": "HRB 3374",
      "registerart": "HRB",
      "company_name": "wm meyer Fahrzeugbau Aktiengesellschaft",
      "company_seat": "Werneck",
      "details": "20.01.2026 (Bekanntmachungsdatum)\n\nBayern Amtsgericht Schweinfurt HRB 3374\nEinreichung neuer Dokumente 19.01.2026 (Eintragungsdatum)\n\nwm meyer Fahrzeugbau Aktiengesellschaft\nAktiengesellschaft\nWerneck\n\nDem Amtsgericht Schweinfurt -Registergericht- ist eine Liste der Mitglieder des Aufsichtsrats eingereicht worden, § 106 AktG."
    },
    {
      "date": "2026-01-20",
      "id": "142879",
      "original_text": "Registerbekanntmachung nach dem Umwandlungsgesetz\nBayern Amtsgericht München HRB 226622\nAlten- Pflegeheim Veitsbronn GmbH – München",
      "type": "Registerbekanntmachung nach dem Umwandlungsgesetz",
      "state": "Bayern",
      "amtsgericht": "Amtsgericht München",
      "registernummer": "HRB 226622",
      "registerart": "HRB",
      "company_name": "Alten- Pflegeheim Veitsbronn GmbH",
      "company_seat": "München",
      "details": "20.01.2026 (Bekanntmachungsdatum)\n\nBayern Amtsgericht München HRB 226622\nRegisterbekanntmachung nach dem Umwandlungsgesetz 19.01.2026 (Eintragungsdatum)\n\nAlten- Pflegeheim Veitsbronn GmbH\nGesellschaft mit beschränkter Haftung\nMünchen\n\nDen Gläubigern der an der Verschmelzung beteiligten Rechtsträger ist, wenn sie binnen sechs Monaten nach dem Tag, an dem die Eintragung der Verschmelzung in das Register des Sitzes desjenigen Rechtsträgers, dessen Gläubiger sie sind, nach § 19 Abs. 3 UmwG als bekannt gemacht gilt, ihren Anspruch nach Grund und Höhe in Textform anmelden, Sicherheit zu leisten, soweit sie nicht Befriedigung verlangen können. Dieses Recht steht den Gläubigern jedoch nur zu, wenn sie glaubhaft machen, dass durch die Verschmelzung die Erfüllung ihrer Forderung gefährdet wird."
    },
    {
      "date": "2026-01-20",
      "id": "142880",
      "original_text": "Löschungsankündigung\nBaden-Württemberg Amtsgericht Freiburg HRB 718472\nLaurent UG (haftungsbeschränkt) – Stockach",
      "type": "Löschungsankündigung",
      "state": "Baden-Württemberg",
      "amtsgericht": "Amtsgericht Freiburg",
      "registernummer": "HRB 718472",
      "registerart": "HRB",
      "company_name": "Laurent UG (haftungsbeschränkt)",
      "company_seat": "Stockach",
      "details": "20.01.2026 (Bekanntmachungsdatum)\n\nBaden-Württemberg Amtsgericht Freiburg HRB 718472\nLöschungsankündigung\n\nLaurent UG (haftungsbeschränkt)\nGesellschaft mit beschränkter Haftung\nStockach\n\nAls nicht eingetragen wird bekanntgemacht:\nDas Gericht beabsichtigt, die Gesellschaft wegen Vermögenslosigkeit im Handelsregister von Amts wegen nach § 394 FamFG zu löschen. Die Frist zur Geltendmachung eines Widerspruchs gegen die beabsichtigte Löschung ist auf einen Monat ab Veröffentlichung bestimmt."
    },
    {
      "date": "2026-01-20",
      "id": "142881",
      "original_text": "Löschungsankündigung\nBaden-Württemberg Amtsgericht Stuttgart HRB 765471\nExclusive Jordan GmbH – Bad Herrenalb",
      "type": "Löschungsankündigung",
      "state": "Baden-Württemberg",
      "amtsgericht": "Amtsgericht Stuttgart",
      "registernummer": "HRB 765471",
      "registerart": "HRB",
      "company_name": "Exclusive Jordan GmbH",
      "company_seat": "Bad Herrenalb",
      "details": "20.01.2026 (Bekanntmachungsdatum)\n\nBaden-Württemberg Amtsgericht Stuttgart HRB 765471\nLöschungsankündigung\n\nExclusive Jordan GmbH\nGesellschaft mit beschränkter Haftung\nBad Herrenalb\n\nAls nicht eingetragen wird bekanntgemacht:\nDas Gericht beabsichtigt, die Gesellschaft wegen Vermögenslosigkeit im Handelsregister von Amts wegen nach § 394 FamFG zu löschen. Die Frist zur Geltendmachung eines Widerspruchs gegen die beabsichtigte Löschung ist auf zwei Monate ab Veröffentlichung bestimmt."
    },
    {
      "date": "2026-01-20",
      "id": "142882",
      "original_text": "Einreichung neuer Dokumente\nBrandenburg Amtsgericht Neuruppin HRB 1121\nStadtwerke Hennigsdorf GmbH – Hennigsdorf",
      "type": "Einreichung neuer Dokumente",
      "state": "Brandenburg",
      "amtsgericht": "Amtsgericht Neuruppin",
      "registernummer": "HRB 1121",
      "registerart": "HRB",
      "company_name": "Stadtwerke Hennigsdorf GmbH",
      "company_seat": "Hennigsdorf",
      "details": "20.01.2026 (Bekanntmachungsdatum)\n\nBrandenburg Amtsgericht Neuruppin HRB 1121\nEinreichung neuer Dokumente\n\nStadtwerke Hennigsdorf GmbH\nGesellschaft mit beschränkter Haftung\nHennigsdorf\n\nAls nicht eingetragen wird veröffentlicht: Eine Liste der Mitglieder des Aufsichtsrates wurde zum Handelsregister eingereicht."
    },
    {
      "date": "2026-01-20",
      "id": "142883",
      "original_text": "Einreichung neuer Dokumente\nSachsen-Anhalt Amtsgericht Stendal HRB 200629\nHMB Hallesche Mitteldeutsche Bau-Aktiengesellschaft – Halle (Saale)",
      "type": "Einreichung neuer Dokumente",
      "state": "Sachsen-Anhalt",
      "amtsgericht": "Amtsgericht Stendal",
      "registernummer": "HRB 200629",
      "registerart": "HRB",
      "company_name": "HMB Hallesche Mitteldeutsche Bau-Aktiengesellschaft",
      "company_seat": "Halle (Saale)",
      "details": "20.01.2026 (Bekanntmachungsdatum)\n\nSachsen-Anhalt Amtsgericht Stendal HRB 200629\nEinreichung neuer Dokumente 20.01.2026 (Eintragungsdatum)\n\nHMB Hallesche Mitteldeutsche Bau-Aktiengesellschaft\nAktiengesellschaft\nHalle (Saale)\n\nEine Liste der Mitglieder des Aufsichtsrates wurde zum Handelsregister eingereicht."
    },
    {
      "date": "2026-01-20",
      "id": "142884",
      "original_text": "Löschungsankündigung\nBrandenburg Amtsgericht Potsdam HRB 28607\nglobio UG (haftungsbeschränkt) – Potsdam",
      "type": "Löschungsankündigung",
      "state": "Brandenburg",
      "amtsgericht": "Amtsgericht Potsdam",
      "registernummer": "HRB 28607",
      "registerart": "HRB",
      "company_name": "globio UG (haftungsbeschränkt)",
      "company_seat": "Potsdam",
      "details": "20.01.2026 (Bekanntmachungsdatum)\n\nBrandenburg Amtsgericht Potsdam HRB 28607\nLöschungsankündigung\n\nglobio UG (haftungsbeschränkt)\nGesellschaft mit beschränkter Haftung\nPotsdam\n\nBei der nachstehenden Gesellschaft wird das Amtslöschungsverfahren gemäß § 394 FamFG eingeleitet. Widerspruchsfrist: 8 Wochen."
    },
    {
      "date": "2026-01-20",
      "id": "142885",
      "original_text": "Löschungsankündigung\nBrandenburg Amtsgericht Potsdam HRB 33917\nSolvingPartners GmbH – Potsdam",
      "type": "Löschungsankündigung",
      "state": "Brandenburg",
      "amtsgericht": "Amtsgericht Potsdam",
      "registernummer": "HRB 33917",
      "registerart": "HRB",
      "company_name": "SolvingPartners GmbH",
      "company_seat": "Potsdam",
      "details": "20.01.2026 (Bekanntmachungsdatum)\n\nBrandenburg Amtsgericht Potsdam HRB 33917\nLöschungsankündigung\n\nSolvingPartners GmbH\nGesellschaft mit beschränkter Haftung\nPotsdam\n\nBei der nachstehenden Gesellschaft wird das Amtslöschungsverfahren gemäß § 394 FamFG eingeleitet. Widerspruchsfrist: 8 Wochen."
    },
    {
      "date": "2026-01-20",
      "id": "142886",
      "original_text": "Registerbekanntmachung nach dem Umwandlungsgesetz\nBrandenburg Amtsgericht Potsdam HRA 8831\nRonny Hansen - BB Treppenlifte e.K. – Wustermark",
      "type": "Registerbekanntmachung nach dem Umwandlungsgesetz",
      "state": "Brandenburg",
      "amtsgericht": "Amtsgericht Potsdam",
      "registernummer": "HRA 8831",
      "registerart": "HRA",
      "company_name": "Ronny Hansen - BB Treppenlifte e.K.",
      "company_seat": "Wustermark",
      "details": "20.01.2026 (Bekanntmachungsdatum)\n\nBrandenburg Amtsgericht Potsdam HRA 8831\nRegisterbekanntmachung nach dem Umwandlungsgesetz 19.01.2026 (Eintragungsdatum)\n\nRonny Hansen - BB Treppenlifte e.K.\nEinzelkaufmann / Einzelkauffrau\nWustermark\n\nZu Eintragungsnummer 2 vom 19.01.2026 wird als nicht eingetragen veröffentlicht:\nDen Gläubigern der an der Ausgliederung beteiligten Rechtsträger ist, wenn sie binnen sechs Monaten nach dem Tag, an dem die Eintragung der Ausgliederung in das Register des Sitzes desjenigen Rechtsträgers, dessen Gläubiger sie sind, nach den §§ 125, 19 Abs. 3 UmwG als bekannt gemacht gilt, ihren Anspruch nach Grund und Höhe schriftlich anmelden, Sicherheit zu leisten, soweit sie nicht Befriedigung verlangen können. Dieses Recht steht den Gläubigern jedoch nur zu, wenn sie glaubhaft machen, dass durch die Ausgliederung die Erfüllung ihrer Forderung gefährdet wird."
    },
    {
      "date": "2026-01-20",
      "id": "142887",
      "original_text": "Registerbekanntmachung nach dem Umwandlungsgesetz\nBerlin Amtsgericht Berlin (Charlottenburg) GsR 1567\nBergemann & Höhne eGbR – Berlin",
      "type": "Registerbekanntmachung nach dem Umwandlungsgesetz",
      "state": "Berlin",
      "amtsgericht": "Amtsgericht Berlin (Charlottenburg)",
      "registernummer": "GsR 1567",
      "registerart": "GsR",
      "company_name": "Bergemann & Höhne eGbR",
      "company_seat": "Berlin",
      "details": "20.01.2026 (Bekanntmachungsdatum)\n\nBerlin Amtsgericht Berlin (Charlottenburg) GsR 1567\nRegisterbekanntmachung nach dem Umwandlungsgesetz 19.01.2026 (Eintragungsdatum)\n\nBergemann & Höhne eGbR\nGesellschaft bürgerlichen Rechts\nBerlin\n\nZu Eintragungsnummer 3 vom 19.01.2026 wird als nicht eingetragen veröffentlicht: Den Gläubigern ist, wenn sie binnen sechs Monaten nach dem Tag, an dem die Eintragung der Umwandlung als bekannt gemacht gilt, ihren Anspruch nach Grund und Höhe schriftlich anmelden, Sicherheit zu leisten, soweit sie nicht Befriedigung verlangen können. Dieses Recht steht den Gläubigern jedoch nur zu, wenn sie glaubhaft machen, dass durch die Umwandlung die Erfüllung ihrer Forderung gefährdet wird. Das Recht, Sicherheitsleistung zu verlangen, steht Gläubigern nicht zu, die im Falle der Insolvenz ein Recht auf vorzugsweise Befriedigung aus einer Deckungsmasse haben, die nach gesetzlicher Vorschrift zu ihrem Schutz errichtet und staatlich überwacht ist."
    },
    {
      "date": "2026-01-20",
      "id": "142888",
      "original_text": "Löschungsankündigung\nBaden-Württemberg Amtsgericht Stuttgart HRB 794865\nKVS Mobility UG (haftungsbeschränkt) – Bönnigheim",
      "type": "Löschungsankündigung",
      "state": "Baden-Württemberg",
      "amtsgericht": "Amtsgericht Stuttgart",
      "registernummer": "HRB 794865",
      "registerart": "HRB",
      "company_name": "KVS Mobility UG (haftungsbeschränkt)",
      "company_seat": "Bönnigheim",
      "details": "20.01.2026 (Bekanntmachungsdatum)\n\nBaden-Württemberg Amtsgericht Stuttgart HRB 794865\nLöschungsankündigung\n\nKVS Mobility UG (haftungsbeschränkt)\nGesellschaft mit beschränkter Haftung\nBönnigheim\n\nDas Gericht beabsichtigt, die Gesellschaft wegen Vermögenslosigkeit im Handelsregister von Amts wegen nach § 394 FamFG zu löschen. Die Frist zur Geltendmachung eines Widerspruchs gegen die beabsichtigte Löschung ist auf zwei Monate ab Veröffentlichung bestimmt."
    },
    {
      "date": "2026-01-20",
      "id": "142889",
      "original_text": "Einreichung neuer Dokumente\nBerlin Amtsgericht Berlin (Charlottenburg) HRB 255180\nSilberpappel Group AG – Berlin",
      "type": "Einreichung neuer Dokumente",
      "state": "Berlin",
      "amtsgericht": "Amtsgericht Berlin (Charlottenburg)",
      "registernummer": "HRB 255180",
      "registerart": "HRB",
      "company_name": "Silberpappel Group AG",
      "company_seat": "Berlin",
      "details": "20.01.2026 (Bekanntmachungsdatum)\n\nBerlin Amtsgericht Berlin (Charlottenburg) HRB 255180\nEinreichung neuer Dokumente\n\nSilberpappel Group AG\nAktiengesellschaft\nBerlin\n\nAls nicht eingetragen wird veröffentlicht: Es wurde eine neue Liste der Aufsichtsratsmitglieder eingereicht (§ 106 AktG)."
    },
    {
      "date": "2026-01-20",
      "id": "142890",
      "original_text": "Registerbekanntmachung nach dem Umwandlungsgesetz\nBaden-Württemberg Amtsgericht Stuttgart HRA 460699\nMode-Messner GmbH & Co. KG – Trossingen",
      "type": "Registerbekanntmachung nach dem Umwandlungsgesetz",
      "state": "Baden-Württemberg",
      "amtsgericht": "Amtsgericht Stuttgart",
      "registernummer": "HRA 460699",
      "registerart": "HRA",
      "company_name": "Mode-Messner GmbH & Co. KG",
      "company_seat": "Trossingen",
      "details": "20.01.2026 (Bekanntmachungsdatum)\n\nBaden-Württemberg Amtsgericht Stuttgart HRA 460699\nRegisterbekanntmachung nach dem Umwandlungsgesetz 20.01.2026 (Eintragungsdatum)\n\nMode-Messner GmbH & Co. KG\nKommanditgesellschaft\nTrossingen\n\nDen Gläubigern der an der Verschmelzung beteiligten Rechtsträger ist, wenn sie binnen sechs Monaten nach dem Tag, an dem die Eintragung der Verschmelzung in das Register des Sitzes desjenigen Rechtsträgers, dessen Gläubiger sie sind, nach § 19 Abs. 3 UmwG als bekanntgemacht gilt, ihren Anspruch nach Grund und Höhe schriftlich anmelden, Sicherheit zu leisten, soweit sie nicht Befriedigung verlangen können. Dieses Recht steht den Gläubigern jedoch nur zu, wenn sie glaubhaft machen, dass durch die Verschmelzung die Erfüllung ihrer Forderung gefährdet wird."
    },
    {
      "date": "2026-01-20",
      "id": "142891",
      "original_text": "Registerbekanntmachung nach dem Umwandlungsgesetz\nBaden-Württemberg Amtsgericht Freiburg HRB 715074\nProjektgesellschaft XII mbH – Freiburg im Breisgau",
      "type": "Registerbekanntmachung nach dem Umwandlungsgesetz",
      "state": "Baden-Württemberg",
      "amtsgericht": "Amtsgericht Freiburg",
      "registernummer": "HRB 715074",
      "registerart": "HRB",
      "company_name": "Projektgesellschaft XII mbH",
      "company_seat": "Freiburg im Breisgau",
      "details": "20.01.2026 (Bekanntmachungsdatum)\n\nBaden-Württemberg Amtsgericht Freiburg HRB 715074\nRegisterbekanntmachung nach dem Umwandlungsgesetz 20.01.2026 (Eintragungsdatum)\n\nProjektgesellschaft XII mbH\nGesellschaft mit beschränkter Haftung\nFreiburg im Breisgau\n\nAls nicht eingetragen wird bekanntgemacht:\nDen Gläubigern der an der Verschmelzung beteiligten Rechtsträger ist, wenn sie binnen sechs Monaten nach dem Tag, an dem die Eintragung der Verschmelzung in das Register des Sitzes desjenigen Rechtsträgers, dessen Gläubiger sie sind, nach § 19 Abs. 3 UmwG als bekanntgemacht gilt, ihren Anspruch nach Grund und Höhe schriftlich anmelden, Sicherheit zu leisten, soweit sie nicht Befriedigung verlangen können. Dieses Recht steht den Gläubigern jedoch nur zu, wenn sie glaubhaft machen, dass durch die Verschmelzung die Erfüllung ihrer Forderung gefährdet wird."
    },
    {
      "date": "2026-01-20",
      "id": "142892",
      "original_text": "Registerbekanntmachung nach dem Umwandlungsgesetz\nBaden-Württemberg Amtsgericht Freiburg HRB 718545\nProjektgesellschaft XVII mbH – Freiburg im Breisgau",
      "type": "Registerbekanntmachung nach dem Umwandlungsgesetz",
      "state": "Baden-Württemberg",
      "amtsgericht": "Amtsgericht Freiburg",
      "registernummer": "HRB 718545",
      "registerart": "HRB",
      "company_name": "Projektgesellschaft XVII mbH",
      "company_seat": "Freiburg im Breisgau",
      "details": "20.01.2026 (Bekanntmachungsdatum)\n\nBaden-Württemberg Amtsgericht Freiburg HRB 718545\nRegisterbekanntmachung nach dem Umwandlungsgesetz 20.01.2026 (Eintragungsdatum)\n\nProjektgesellschaft XVII mbH\nGesellschaft mit beschränkter Haftung\nFreiburg im Breisgau\n\nAls nicht eingetragen wird bekanntgemacht:\nDen Gläubigern der an der Verschmelzung beteiligten Rechtsträger ist, wenn sie binnen sechs Monaten nach dem Tag, an dem die Eintragung der Verschmelzung in das Register des Sitzes desjenigen Rechtsträgers, dessen Gläubiger sie sind, nach § 19 Abs. 3 UmwG als bekanntgemacht gilt, ihren Anspruch nach Grund und Höhe schriftlich anmelden, Sicherheit zu leisten, soweit sie nicht Befriedigung verlangen können. Dieses Recht steht den Gläubigern jedoch nur zu, wenn sie glaubhaft machen, dass durch die Verschmelzung die Erfüllung ihrer Forderung gefährdet wird."
    },
    {
      "date": "2026-01-20",
      "id": "142893",
      "original_text": "Sonstige Registerbekanntmachung\nHamburg Amtsgericht Hamburg HRB 93686\nRetail Operating Company Deutschland GmbH – Hamburg",
      "type": "Sonstige Registerbekanntmachung",
      "state": "Hamburg",
      "amtsgericht": "Amtsgericht Hamburg",
      "registernummer": "HRB 93686",
      "registerart": "HRB",
      "company_name": "Retail Operating Company Deutschland GmbH",
      "company_seat": "Hamburg",
      "details": "20.01.2026 (Bekanntmachungsdatum)\n\nHamburg Amtsgericht Hamburg HRB 93686\nSonstige Registerbekanntmachung\n\nRetail Operating Company Deutschland GmbH\nGesellschaft mit beschränkter Haftung\nHamburg\n\nAls nicht eingetragen wird bekannt gemacht: Liste des Aufsichtsrats wurde eingereicht."
    },
    {
      "date": "2026-01-20",
      "id": "142894",
      "original_text": "Registerbekanntmachung nach dem Umwandlungsgesetz\nBaden-Württemberg Amtsgericht Freiburg HRB 715075\nProjektgesellschaft XIV mbH – Freiburg im Breisgau",
      "type": "Registerbekanntmachung nach dem Umwandlungsgesetz",
      "state": "Baden-Württemberg",
      "amtsgericht": "Amtsgericht Freiburg",
      "registernummer": "HRB 715075",
      "registerart": "HRB",
      "company_name": "Projektgesellschaft XIV mbH",
      "company_seat": "Freiburg im Breisgau",
      "details": "20.01.2026 (Bekanntmachungsdatum)\n\nBaden-Württemberg Amtsgericht Freiburg HRB 715075\nRegisterbekanntmachung nach dem Umwandlungsgesetz 20.01.2026 (Eintragungsdatum)\n\nProjektgesellschaft XIV mbH\nGesellschaft mit beschränkter Haftung\nFreiburg im Breisgau\n\nAls nicht eingetragen wird bekanntgemacht:\nDen Gläubigern der an der Verschmelzung beteiligten Rechtsträger ist, wenn sie binnen sechs Monaten nach dem Tag, an dem die Eintragung der Verschmelzung in das Register des Sitzes desjenigen Rechtsträgers, dessen Gläubiger sie sind, nach § 19 Abs. 3 UmwG als bekanntgemacht gilt, ihren Anspruch nach Grund und Höhe schriftlich anmelden, Sicherheit zu leisten, soweit sie nicht Befriedigung verlangen können. Dieses Recht steht den Gläubigern jedoch nur zu, wenn sie glaubhaft machen, dass durch die Verschmelzung die Erfüllung ihrer Forderung gefährdet wird."
    },
    {
      "date": "2026-01-20",
      "id": "142895",
      "original_text": "Löschungsankündigung\nBerlin Amtsgericht Berlin (Charlottenburg) HRB 181313\nPARAGON Marketing GmbH – Berlin",
      "type": "Löschungsankündigung",
      "state": "Berlin",
      "amtsgericht": "Amtsgericht Berlin (Charlottenburg)",
      "registernummer": "HRB 181313",
      "registerart": "HRB",
      "company_name": "PARAGON Marketing GmbH",
      "company_seat": "Berlin",
      "details": "20.01.2026 (Bekanntmachungsdatum)\n\nBerlin Amtsgericht Berlin (Charlottenburg) HRB 181313\nLöschungsankündigung\n\nPARAGON Marketing GmbH\nGesellschaft mit beschränkter Haftung\nBerlin\n\nBei der nachstehenden Gesellschaft wird das Amtslöschungsverfahren gemäß § 394 FamFG eingeleitet. Widerspruchsfrist 6 Wochen"
    },
    {
      "date": "2026-01-20",
      "id": "142896",
      "original_text": "Löschungsankündigung\nBaden-Württemberg Amtsgericht Stuttgart HRB 15168\nHAUS & GRUND Vertriebsgesellschaft mbH – Stuttgart",
      "type": "Löschungsankündigung",
      "state": "Baden-Württemberg",
      "amtsgericht": "Amtsgericht Stuttgart",
      "registernummer": "HRB 15168",
      "registerart": "HRB",
      "company_name": "HAUS & GRUND Vertriebsgesellschaft mbH",
      "company_seat": "Stuttgart",
      "details": "20.01.2026 (Bekanntmachungsdatum)\n\nBaden-Württemberg Amtsgericht Stuttgart HRB 15168\nLöschungsankündigung\n\nHAUS & GRUND Vertriebsgesellschaft mbH\nGesellschaft mit beschränkter Haftung\nStuttgart\n\nDas Gericht beabsichtigt, die Gesellschaft wegen Vermögenslosigkeit im Handelsregister von Amts wegen nach § 394 FamFG zu löschen. Die Frist zur Geltendmachung eines Widerspruchs gegen die beabsichtigte Löschung ist auf zwei Monate ab Veröffentlichung bestimmt."
    },
    {
      "date": "2026-01-20",
      "id": "142897",
      "original_text": "Löschungsankündigung\nBerlin Amtsgericht Berlin (Charlottenburg) HRB 220596\npaysec UG (haftungsbeschänkt) – Berlin",
      "type": "Löschungsankündigung",
      "state": "Berlin",
      "amtsgericht": "Amtsgericht Berlin (Charlottenburg)",
      "registernummer": "HRB 220596",
      "registerart": "HRB",
      "company_name": "paysec UG (haftungsbeschänkt)",
      "company_seat": "Berlin",
      "details": "20.01.2026 (Bekanntmachungsdatum)\n\nBerlin Amtsgericht Berlin (Charlottenburg) HRB 220596\nLöschungsankündigung\n\npaysec UG (haftungsbeschänkt)\nGesellschaft mit beschränkter Haftung\nBerlin\n\nBei der nachstehenden Gesellschaft wird das Amtslöschungsverfahren gemäß § 394 FamFG eingeleitet. Widerspruchsfrist 6 Wochen"
    },
    {
      "date": "2026-01-20",
      "id": "142898",
      "original_text": "Löschungsankündigung\nBerlin Amtsgericht Berlin (Charlottenburg) HRB 184600\nBT Project GmbH – Berlin",
      "type": "Löschungsankündigung",
      "state": "Berlin",
      "amtsgericht": "Amtsgericht Berlin (Charlottenburg)",
      "registernummer": "HRB 184600",
      "registerart": "HRB",
      "company_name": "BT Project GmbH",
      "company_seat": "Berlin",
      "details": "20.01.2026 (Bekanntmachungsdatum)\n\nBerlin Amtsgericht Berlin (Charlottenburg) HRB 184600\nLöschungsankündigung\n\nBT Project GmbH\nGesellschaft mit beschränkter Haftung\nBerlin\n\nBei der nachstehenden Gesellschaft wird das Amtslöschungsverfahren gemäß § 394 FamFG eingeleitet. Widerspruchsfrist 6 Wochen"
    },
    {
      "date": "2026-01-20",
      "id": "142899",
      "original_text": "Einreichung neuer Dokumente\nBaden-Württemberg Amtsgericht Stuttgart HRB 354274\nKreiskliniken Reutlingen gGmbH – Reutlingen",
      "type": "Einreichung neuer Dokumente",
      "state": "Baden-Württemberg",
      "amtsgericht": "Amtsgericht Stuttgart",
      "registernummer": "HRB 354274",
      "registerart": "HRB",
      "company_name": "Kreiskliniken Reutlingen gGmbH",
      "company_seat": "Reutlingen",
      "details": "20.01.2026 (Bekanntmachungsdatum)\n\nBaden-Württemberg Amtsgericht Stuttgart HRB 354274\nEinreichung neuer Dokumente\n\nKreiskliniken Reutlingen gGmbH\nGesellschaft mit beschränkter Haftung\nReutlingen\n\nDie Gesellschaft hat am 02.01.2026 die Liste über die Zusammensetzung des Aufsichtsrats zum Handelsregister eingereicht."
    },
    {
      "date": "2026-01-20",
      "id": "142900",
      "original_text": "Einreichung neuer Dokumente\nSchleswig-Holstein Amtsgericht Lübeck HRB 19410\nBlockchain Investor AG – Lübeck",
      "type": "Einreichung neuer Dokumente",
      "state": "Schleswig-Holstein",
      "amtsgericht": "Amtsgericht Lübeck",
      "registernummer": "HRB 19410",
      "registerart": "HRB",
      "company_name": "Blockchain Investor AG",
      "company_seat": "Lübeck",
      "details": "20.01.2026 (Bekanntmachungsdatum)\n\nSchleswig-Holstein Amtsgericht Lübeck HRB 19410\nEinreichung neuer Dokumente\n\nBlockchain Investor AG\nAktiengesellschaft\nLübeck\n\nAls nicht eingetragen wird veröffentlicht: Es wurde eine neue Liste der Aufsichtsratsmitglieder zum Handelsregister eingereicht."
    },
    {
      "date": "2026-01-20",
      "id": "142901",
      "original_text": "Einreichung neuer Dokumente\nThüringen Amtsgericht Jena HRB 209457\nAsklepios Fachklinikum Stadtroda GmbH – Stadtroda",
      "type": "Einreichung neuer Dokumente",
      "state": "Thüringen",
      "amtsgericht": "Amtsgericht Jena",
      "registernummer": "HRB 209457",
      "registerart": "HRB",
      "company_name": "Asklepios Fachklinikum Stadtroda GmbH",
      "company_seat": "Stadtroda",
      "details": "20.01.2026 (Bekanntmachungsdatum)\n\nThüringen Amtsgericht Jena HRB 209457\nEinreichung neuer Dokumente\n\nAsklepios Fachklinikum Stadtroda GmbH\nGesellschaft mit beschränkter Haftung\nStadtroda\n\nBekanntmachung gem. § 52 Abs. 3 Satz 2 GmbHG: Aufgrund einer Veränderung in den Personen der Aufsichtsratsmitglieder ist durch die Geschäftsführer eine neue Liste zum Handelsregister eingereicht worden."
    },
    {
      "date": "2026-01-20",
      "id": "142902",
      "original_text": "Registerbekanntmachung nach dem Umwandlungsgesetz\nThüringen Amtsgericht Jena HRA 507236\nHolger Michel e.K. – Mühlhausen/Thüringen",
      "type": "Registerbekanntmachung nach dem Umwandlungsgesetz",
      "state": "Thüringen",
      "amtsgericht": "Amtsgericht Jena",
      "registernummer": "HRA 507236",
      "registerart": "HRA",
      "company_name": "Holger Michel e.K.",
      "company_seat": "Mühlhausen/Thüringen",
      "details": "20.01.2026 (Bekanntmachungsdatum)\n\nThüringen Amtsgericht Jena HRA 507236\nRegisterbekanntmachung nach dem Umwandlungsgesetz 20.01.2026 (Eintragungsdatum)\n\nHolger Michel e.K.\nEinzelkaufmann / Einzelkauffrau\nMühlhausen/Thüringen\n\nNicht eingetragen: Den Gläubigern der an der Ausgliederung beteiligten Rechtsträger, ist wenn sie binnen sechs Monaten nach dem Tag, an dem die Eintragung der Ausgliederung in das Register des Sitzes desjenigen Rechtsträgers, dessen Gläubiger sie sind, nach §§125, 19 Abs. 3 UmwG als bekanntgemacht gilt, ihren Anspruch nach Grund und Höhe schriftlich anmelden, Sicherheit zu leisten, soweit sie nicht Befriedigung verlangen können. Dieses Recht steht ihnen jedoch nur zu, wenn sie glaubhaft machen, daß durch die Ausgliederung die Erfüllung ihrer Forderung gefährdet wird."
    },
    {
      "date": "2026-01-20",
      "id": "142903",
      "original_text": "Löschungsankündigung\nBrandenburg Amtsgericht Frankfurt/Oder HRB 16332\nCGS-Flex GmbH – Altlandsberg",
      "type": "Löschungsankündigung",
      "state": "Brandenburg",
      "amtsgericht": "Amtsgericht Frankfurt/Oder",
      "registernummer": "HRB 16332",
      "registerart": "HRB",
      "company_name": "CGS-Flex GmbH",
      "company_seat": "Altlandsberg",
      "details": "20.01.2026 (Bekanntmachungsdatum)\n\nBrandenburg Amtsgericht Frankfurt/Oder HRB 16332\nLöschungsankündigung\n\nCGS-Flex GmbH\nGesellschaft mit beschränkter Haftung\nAltlandsberg\n\nBei der nachstehenden Gesellschaft wird das Amtslöschungsverfahren gemäß § 394 FamFG eingeleitet."
    },
    {
      "date": "2026-01-20",
      "id": "142904",
      "original_text": "Löschungsankündigung\nBerlin Amtsgericht Berlin (Charlottenburg) HRB 246847\nILOVESTRESS Coaching-Consulting-Health GmbH – Berlin",
      "type": "Löschungsankündigung",
      "state": "Berlin",
      "amtsgericht": "Amtsgericht Berlin (Charlottenburg)",
      "registernummer": "HRB 246847",
      "registerart": "HRB",
      "company_name": "ILOVESTRESS Coaching-Consulting-Health GmbH",
      "company_seat": "Berlin",
      "details": "20.01.2026 (Bekanntmachungsdatum)\n\nBerlin Amtsgericht Berlin (Charlottenburg) HRB 246847\nLöschungsankündigung\n\nILOVESTRESS Coaching-Consulting-Health GmbH\nGesellschaft mit beschränkter Haftung\nBerlin\n\nBei der nachstehenden Gesellschaft wird das Amtslöschungsverfahren gemäß § 394 FamFG eingeleitet. Widerspruchsfrist 6 Wochen"
    },
    {
      "date": "2026-01-20",
      "id": "142905",
      "original_text": "Löschungsankündigung\nBaden-Württemberg Amtsgericht Stuttgart HRB 764340\nBätzner Immobilienservice & Gartenbau UG (haftungsbeschränkt) – Markgröningen",
      "type": "Löschungsankündigung",
      "state": "Baden-Württemberg",
      "amtsgericht": "Amtsgericht Stuttgart",
      "registernummer": "HRB 764340",
      "registerart": "HRB",
      "company_name": "Bätzner Immobilienservice & Gartenbau UG (haftungsbeschränkt)",
      "company_seat": "Markgröningen",
      "details": "20.01.2026 (Bekanntmachungsdatum)\n\nBaden-Württemberg Amtsgericht Stuttgart HRB 764340\nLöschungsankündigung\n\nBätzner Immobilienservice & Gartenbau UG (haftungsbeschränkt)\nGesellschaft mit beschränkter Haftung\nMarkgröningen\n\nDas Gericht beabsichtigt, die Gesellschaft wegen Vermögenslosigkeit im Handelsregister von Amts wegen nach § 394 FamFG zu löschen. Die Frist zur Geltendmachung eines Widerspruchs gegen die beabsichtigte Löschung ist auf zwei Monate ab Veröffentlichung bestimmt."
    },
    {
      "date": "2026-01-20",
      "id": "142906",
      "original_text": "Löschungsankündigung\nBerlin Amtsgericht Berlin (Charlottenburg) HRB 222346\nARSE Service GmbH – Berlin",
      "type": "Löschungsankündigung",
      "state": "Berlin",
      "amtsgericht": "Amtsgericht Berlin (Charlottenburg)",
      "registernummer": "HRB 222346",
      "registerart": "HRB",
      "company_name": "ARSE Service GmbH",
      "company_seat": "Berlin",
      "details": "20.01.2026 (Bekanntmachungsdatum)\n\nBerlin Amtsgericht Berlin (Charlottenburg) HRB 222346\nLöschungsankündigung\n\nARSE Service GmbH\nGesellschaft mit beschränkter Haftung\nBerlin\n\nBei der nachstehenden Gesellschaft wird das Amtslöschungsverfahren gemäß § 394 FamFG eingeleitet. Widerspruchsfrist 6 Wochen"
    },
    {
      "date": "2026-01-20",
      "id": "142907",
      "original_text": "Einreichung neuer Dokumente\nBaden-Württemberg Amtsgericht Freiburg HRB 715262\nCandulor Dental GmbH – Rielasingen-Worblingen",
      "type": "Einreichung neuer Dokumente",
      "state": "Baden-Württemberg",
      "amtsgericht": "Amtsgericht Freiburg",
      "registernummer": "HRB 715262",
      "registerart": "HRB",
      "company_name": "Candulor Dental GmbH",
      "company_seat": "Rielasingen-Worblingen",
      "details": "20.01.2026 (Bekanntmachungsdatum)\n\nBaden-Württemberg Amtsgericht Freiburg HRB 715262\nEinreichung neuer Dokumente\n\nCandulor Dental GmbH\nGesellschaft mit beschränkter Haftung\nRielasingen-Worblingen\n\nDie Gesellschaft hat am 16.01.2026 die Liste über die Zusammensetzung des Aufsichtsrats zum Handelsregister eingereicht."
    },
    {
      "date": "2026-01-20",
      "id": "142908",
      "original_text": "Löschungsankündigung\nBerlin Amtsgericht Berlin (Charlottenburg) HRB 170337\nCHIPOSA GmbH – Berlin",
      "type": "Löschungsankündigung",
      "state": "Berlin",
      "amtsgericht": "Amtsgericht Berlin (Charlottenburg)",
      "registernummer": "HRB 170337",
      "registerart": "HRB",
      "company_name": "CHIPOSA GmbH",
      "company_seat": "Berlin",
      "details": "20.01.2026 (Bekanntmachungsdatum)\n\nBerlin Amtsgericht Berlin (Charlottenburg) HRB 170337\nLöschungsankündigung\n\nCHIPOSA GmbH\nGesellschaft mit beschränkter Haftung\nBerlin\n\nBei der nachstehenden Gesellschaft wird das Amtslöschungsverfahren gemäß § 394 FamFG eingeleitet. Widerspruchsfrist 6 Wochen"
    },
    {
      "date": "2026-01-20",
      "id": "142909",
      "original_text": "Registerbekanntmachung nach dem Umwandlungsgesetz\nSachsen-Anhalt Amtsgericht Stendal HRA 8302\nPhysiotherapie Klaus Radestock e.K. – Eckartsberga",
      "type": "Registerbekanntmachung nach dem Umwandlungsgesetz",
      "state": "Sachsen-Anhalt",
      "amtsgericht": "Amtsgericht Stendal",
      "registernummer": "HRA 8302",
      "registerart": "HRA",
      "company_name": "Physiotherapie Klaus Radestock e.K.",
      "company_seat": "Eckartsberga",
      "details": "20.01.2026 (Bekanntmachungsdatum)\n\nSachsen-Anhalt Amtsgericht Stendal HRA 8302\nRegisterbekanntmachung nach dem Umwandlungsgesetz\n\nPhysiotherapie Klaus Radestock e.K.\nEinzelkaufmann / Einzelkauffrau\nEckartsberga\n\nNicht eingetragen:\nDen Gläubigern der an der Ausgliederung beteiligten Rechtsträger, ist wenn sie binnen sechs Monaten nach dem Tag, an dem die Eintragung der Ausgliederung nach §§125, 19 Abs. 3 UmwG als bekanntgemacht gilt, ihren Anspruch nach Grund und Höhe schriftlich anmelden, Sicherheit zu leisten, soweit sie nicht Befriedigung verlangen können. Diese Recht steht ihnen jedoch nur zu, wenn sie glaubhaft machen, dass durch die Ausgliederung die Erfüllung ihrer Forderung gefährdet wird."
    },
    {
      "date": "2026-01-20",
      "id": "142910",
      "original_text": "Sonstige Registerbekanntmachung\nBaden-Württemberg Amtsgericht Ulm HRB 711216\nESCAD Engineering GmbH – Pfullendorf",
      "type": "Sonstige Registerbekanntmachung",
      "state": "Baden-Württemberg",
      "amtsgericht": "Amtsgericht Ulm",
      "registernummer": "HRB 711216",
      "registerart": "HRB",
      "company_name": "ESCAD Engineering GmbH",
      "company_seat": "Pfullendorf",
      "details": "20.01.2026 (Bekanntmachungsdatum)\n\nBaden-Württemberg Amtsgericht Ulm HRB 711216\nSonstige Registerbekanntmachung 20.01.2026 (Eintragungsdatum)\n\nESCAD Engineering GmbH\nGesellschaft mit beschränkter Haftung\nPfullendorf\n\nAls nicht eingetragen wird bekanntgemacht:\nDen Gläubigern der Gesellschaft, deren Forderungen begründet worden sind, bevor die Eintragung der Beendigung des Vertrages in das Handelsregister nach § 10 HGB als bekanntgemacht gilt, ist vom anderen Vertragsteil Sicherheit zu leisten, wenn sie sich binnen sechs Monaten nach der Bekanntmachung zu diesem Zweck bei ihm melden."
    },
    {
      "date": "2026-01-20",
      "id": "142911",
      "original_text": "Einreichung neuer Dokumente\nBerlin Amtsgericht Berlin (Charlottenburg) HRB 200488\nPariser Platz ZwischenHoldCo GmbH – Berlin",
      "type": "Einreichung neuer Dokumente",
      "state": "Berlin",
      "amtsgericht": "Amtsgericht Berlin (Charlottenburg)",
      "registernummer": "HRB 200488",
      "registerart": "HRB",
      "company_name": "Pariser Platz ZwischenHoldCo GmbH",
      "company_seat": "Berlin",
      "details": "20.01.2026 (Bekanntmachungsdatum)\n\nBerlin Amtsgericht Berlin (Charlottenburg) HRB 200488\nEinreichung neuer Dokumente\n\nPariser Platz ZwischenHoldCo GmbH\nGesellschaft mit beschränkter Haftung\nBerlin\n\nAls nicht eingetragen wird veröffentlicht:\nDie Bekanntmachung vom 13.01.2026 wird wie folgt berichtigt:\n\nDie Gesellschaft hat den Entwurf eines Formwechselplans vom 06.01.2026 betreffend die grenzüberschreitende Verlegung des Satzungssitzes der Gesellschaft nach Luxemburg gemäß §§ 333 ff. UmwG zum Handelsregister des Amtsgerichts Charlottenburg eingereicht. § 336 UmwG i.V.m. § 308 Abs. 1 S. 2 Nr. 2 UmwG: An dem grenzüberschreitenden Formwechsel ist die Pariser Platz ZwischenHoldCo GmbH mit Satzungssitz in Berlin, Deutschland, eine nach deutschem Recht bestehende Gesellschaft mit beschränkter Haftung, beteiligt. Nach dem grenzüberschreitenden Formwechsel wird die Gesellschaft die Rechtsform einer reinen Societe a responsabilith limithe (S.a r.l.), eine Gesellschaft mit beschränkter Haftung nach dem Recht des Großherzogtums Luxemburg, annehmen und als Pariser Platz ZwischenHoldCo S.a r.l mit Satzungssitz in Luxemburg, Großherzogtum Luxemburg firmieren. 3. § 336 UmwG i.V.m. § 308 Abs. 1 S. 2 Nr. 3 UmwG: Die Gesellschaft ist im Handelsregister des Amtsgerichts Berlin (Charlottenburg) unter der HRB 200488 B eingetragen. Handelsregisternummer Die Gesellschaft ist zudem im Handels- und Gesellschaftsregister von Luxemburg (Registre de commerce et des societes Luxembourg) unter der Nummer B 228609 eingetragen, welche auch künftig fortbestehen wird. 4. § 336 UmwG i.V.m. § 308 Abs. 1 S. 2 Nr. 4 UmwG: Die Gesellschafterversammlung zum Beschluss des grenzüberschreitenden Formwechsels ist für den Tag geplant, der auf den Ablauf von einem Monat nach dem Tag der Registerbekanntmachung des Formwechselplans folgt, oder ggfs. den nächsten Arbeitstag (wobei Samstage, Sonntage und bundesweite Feiertage nicht als Arbeitstage zählen)."
    },
    {
      "date": "2026-01-20",
      "id": "142912",
      "original_text": "Sonstige Registerbekanntmachung\nBerlin Amtsgericht Berlin (Charlottenburg) HRB 225092\nNYALA Digital Asset AG – Berlin",
      "type": "Sonstige Registerbekanntmachung",
      "state": "Berlin",
      "amtsgericht": "Amtsgericht Berlin (Charlottenburg)",
      "registernummer": "HRB 225092",
      "registerart": "HRB",
      "company_name": "NYALA Digital Asset AG",
      "company_seat": "Berlin",
      "details": "20.01.2026 (Bekanntmachungsdatum)\n\nBerlin Amtsgericht Berlin (Charlottenburg) HRB 225092\nSonstige Registerbekanntmachung\n\nNYALA Digital Asset AG\nAktiengesellschaft\nBerlin\n\nAls nicht eingetragen wird veröffentlicht: Es wurde eine neue Liste der Aufsichtsratsmitglieder eingereicht (§ 106 AktG)."
    },
    {
      "date": "2026-01-20",
      "id": "142913",
      "original_text": "Löschungsankündigung\nBerlin Amtsgericht Berlin (Charlottenburg) HRB 265635\nThe House Love Döner GmbH – Berlin",
      "type": "Löschungsankündigung",
      "state": "Berlin",
      "amtsgericht": "Amtsgericht Berlin (Charlottenburg)",
      "registernummer": "HRB 265635",
      "registerart": "HRB",
      "company_name": "The House Love Döner GmbH",
      "company_seat": "Berlin",
      "details": "20.01.2026 (Bekanntmachungsdatum)\n\nBerlin Amtsgericht Berlin (Charlottenburg) HRB 265635\nLöschungsankündigung\n\nThe House Love Döner GmbH\nGesellschaft mit beschränkter Haftung\nBerlin\n\nBei der nachstehenden Gesellschaft wird das Amtslöschungsverfahren gemäß § 394 FamFG eingeleitet. Widerspruchsfrist 6 Wochen"
    },
    {
      "date": "2026-01-20",
      "id": "142914",
      "original_text": "Sonstige Registerbekanntmachung\nBaden-Württemberg Amtsgericht Ulm HRB 236\nB + R Autohaus GmbH Alfred Maier – Ulm",
      "type": "Sonstige Registerbekanntmachung",
      "state": "Baden-Württemberg",
      "amtsgericht": "Amtsgericht Ulm",
      "registernummer": "HRB 236",
      "registerart": "HRB",
      "company_name": "B + R Autohaus GmbH Alfred Maier",
      "company_seat": "Ulm",
      "details": "20.01.2026 (Bekanntmachungsdatum)\n\nBaden-Württemberg Amtsgericht Ulm HRB 236\nSonstige Registerbekanntmachung 20.01.2026 (Eintragungsdatum)\n\nB + R Autohaus GmbH Alfred Maier\nGesellschaft mit beschränkter Haftung\nUlm\n\nAls nicht eingetragen wird bekanntgemacht:\nDen Gläubigern der Gesellschaft, deren Forderungen begründet worden sind, bevor die Eintragung der Beendigung des Vertrages in das Handelsregister nach § 10 HGB als bekanntgemacht gilt, ist vom anderen Vertragsteil Sicherheit zu leisten, wenn sie sich binnen sechs Monaten nach der Bekanntmachung zu diesem Zweck bei ihm melden."
    },
    {
      "date": "2026-01-20",
      "id": "142915",
      "original_text": "Einreichung neuer Dokumente\nBerlin Amtsgericht Berlin (Charlottenburg) HRB 271733\nRaisin SE – Berlin",
      "type": "Einreichung neuer Dokumente",
      "state": "Berlin",
      "amtsgericht": "Amtsgericht Berlin (Charlottenburg)",
      "registernummer": "HRB 271733",
      "registerart": "HRB",
      "company_name": "Raisin SE",
      "company_seat": "Berlin",
      "details": "20.01.2026 (Bekanntmachungsdatum)\n\nBerlin Amtsgericht Berlin (Charlottenburg) HRB 271733\nEinreichung neuer Dokumente\n\nRaisin SE\nEuropäische Aktiengesellschaft (SE)\nBerlin\n\nAls nicht eingetragen wird veröffentlicht: Es wurde eine neue Liste der Aufsichtsratsmitglieder eingereicht (§ 106 AktG)."
    },
    {
      "date": "2026-01-20",
      "id": "142916",
      "original_text": "Sonstige Registerbekanntmachung\nBaden-Württemberg Amtsgericht Mannheim HRB 734800\nKarlsruher Sport-Club Mühlburg-Phönix GmbH & Co. KGaA – Karlsruhe",
      "type": "Sonstige Registerbekanntmachung",
      "state": "Baden-Württemberg",
      "amtsgericht": "Amtsgericht Mannheim",
      "registernummer": "HRB 734800",
      "registerart": "HRB",
      "company_name": "Karlsruher Sport-Club Mühlburg-Phönix GmbH & Co. KGaA",
      "company_seat": "Karlsruhe",
      "details": "20.01.2026 (Bekanntmachungsdatum)\n\nBaden-Württemberg Amtsgericht Mannheim HRB 734800\nSonstige Registerbekanntmachung\n\nKarlsruher Sport-Club Mühlburg-Phönix GmbH & Co. KGaA\nKommanditgesellschaft auf Aktien\nKarlsruhe\n\nDie Gesellschaft hat am 19.01.2026 die Liste über die Zusammensetzung des Aufsichtsrats zum Handelsregister eingereicht."
    },
    {
      "date": "2026-01-20",
      "id": "142917",
      "original_text": "Registerbekanntmachung nach dem Umwandlungsgesetz\nBaden-Württemberg Amtsgericht Ulm HRB 750378\nWalter Holding GmbH – Igersheim",
      "type": "Registerbekanntmachung nach dem Umwandlungsgesetz",
      "state": "Baden-Württemberg",
      "amtsgericht": "Amtsgericht Ulm",
      "registernummer": "HRB 750378",
      "registerart": "HRB",
      "company_name": "Walter Holding GmbH",
      "company_seat": "Igersheim",
      "details": "20.01.2026 (Bekanntmachungsdatum)\n\nBaden-Württemberg Amtsgericht Ulm HRB 750378\nRegisterbekanntmachung nach dem Umwandlungsgesetz 20.01.2026 (Eintragungsdatum)\n\nWalter Holding GmbH\nGesellschaft mit beschränkter Haftung\nIgersheim\n\nDen Gläubigern der an der grenzüberschreitenden Ausgliederung beteiligten übernehmenden Rechtsträger ist, wenn sie binnen sechs Monaten nach dem Tag, an dem die Eintragung der Spaltung in das Register des Sitzes desjenigen Rechtsträgers, dessen Gläubiger sie sind, nach § 19 Absatz 3 UmwG als bekanntgemacht gilt, ihren Anspruch nach Grund und Höhe schriftlich anmelden, Sicherheit zu leisten, soweit sie nicht Befriedigung verlangen können.\nDieses Recht steht den Gläubigern jedoch nur zu, wenn sie glaubhaft machen, dass durch die Spaltung die Erfüllung ihrer Forderung gefährdet wird."
    },
    {
      "date": "2026-01-20",
      "id": "142918",
      "original_text": "Registerbekanntmachung nach dem Umwandlungsgesetz\nBaden-Württemberg Amtsgericht Stuttgart VR 330412\nAikido-Club-Calw e.V. – Calw",
      "type": "Registerbekanntmachung nach dem Umwandlungsgesetz",
      "state": "Baden-Württemberg",
      "amtsgericht": "Amtsgericht Stuttgart",
      "registernummer": "VR 330412",
      "registerart": "VR",
      "company_name": "Aikido-Club-Calw e.V.",
      "company_seat": "Calw",
      "details": "20.01.2026 (Bekanntmachungsdatum)\n\nBaden-Württemberg Amtsgericht Stuttgart VR 330412\nRegisterbekanntmachung nach dem Umwandlungsgesetz 20.01.2026 (Eintragungsdatum)\n\nAikido-Club-Calw e.V.\neingetragener Verein\nCalw\n\nAls nicht eingetragen wird bekanntgemacht:\nDen Gläubigern der an der Verschmelzung beteiligten Rechtsträger ist, wenn sie binnen sechs Monaten nach dem Tag, an dem die Eintragung der Verschmelzung in das Register des Sitzes desjenigen Rechtsträgers, dessen Gläubiger sie sind, nach § 19 Abs. 3 UmwG als bekanntgemacht gilt, ihren Anspruch nach Grund und Höhe schriftlich anmelden, Sicherheit zu leisten, soweit sie nicht Befriedigung verlangen können. Dieses Recht steht den Gläubigern jedoch nur zu, wenn sie glaubhaft machen, dass durch die Verschmelzung die Erfüllung ihrer Forderung gefährdet wird."
    },
    {
      "date": "2026-01-20",
      "id": "142919",
      "original_text": "Löschungsankündigung\nBaden-Württemberg Amtsgericht Freiburg HRB 3585\nHBV Immobilienbeteiligungs- und Treuhandgesellschaft mbH – Freiburg im Breisgau",
      "type": "Löschungsankündigung",
      "state": "Baden-Württemberg",
      "amtsgericht": "Amtsgericht Freiburg",
      "registernummer": "HRB 3585",
      "registerart": "HRB",
      "company_name": "HBV Immobilienbeteiligungs- und Treuhandgesellschaft mbH",
      "company_seat": "Freiburg im Breisgau",
      "details": "20.01.2026 (Bekanntmachungsdatum)\n\nBaden-Württemberg Amtsgericht Freiburg HRB 3585\nLöschungsankündigung\n\nHBV Immobilienbeteiligungs- und Treuhandgesellschaft mbH\nGesellschaft mit beschränkter Haftung\nFreiburg im Breisgau\n\nAls nicht eingetragen wird bekanntgemacht:\nDas Gericht beabsichtigt, die Gesellschaft wegen Vermögenslosigkeit im Handelsregister von Amts wegen nach § 394 FamFG zu löschen. Die Frist zur Geltendmachung eines Widerspruchs gegen die beabsichtigte Löschung ist auf einen Monat ab Veröffentlichung bestimmt."
    },
    {
      "date": "2026-01-20",
      "id": "142920",
      "original_text": "Registerbekanntmachung nach dem Umwandlungsgesetz\nBaden-Württemberg Amtsgericht Stuttgart VR 330006\nTurn- u. Sportverein Calw von 1846 e.V. – Calw",
      "type": "Registerbekanntmachung nach dem Umwandlungsgesetz",
      "state": "Baden-Württemberg",
      "amtsgericht": "Amtsgericht Stuttgart",
      "registernummer": "VR 330006",
      "registerart": "VR",
      "company_name": "Turn- u. Sportverein Calw von 1846 e.V.",
      "company_seat": "Calw",
      "details": "20.01.2026 (Bekanntmachungsdatum)\n\nBaden-Württemberg Amtsgericht Stuttgart VR 330006\nRegisterbekanntmachung nach dem Umwandlungsgesetz 20.01.2026 (Eintragungsdatum)\n\nTurn- u. Sportverein Calw von 1846 e.V.\neingetragener Verein\nCalw\n\nAls nicht eingetragen wird bekanntgemacht:\nDen Gläubigern der an der Verschmelzung beteiligten Rechtsträger ist, wenn sie binnen sechs Monaten nach dem Tag, an dem die Eintragung der Verschmelzung in das Register des Sitzes desjenigen Rechtsträgers, dessen Gläubiger sie sind, nach § 19 Abs. 3 UmwG als bekanntgemacht gilt, ihren Anspruch nach Grund und Höhe schriftlich anmelden, Sicherheit zu leisten, soweit sie nicht Befriedigung verlangen können. Dieses Recht steht den Gläubigern jedoch nur zu, wenn sie glaubhaft machen, dass durch die Verschmelzung die Erfüllung ihrer Forderung gefährdet wird."
    },
    {
      "date": "2026-01-20",
      "id": "142921",
      "original_text": "Einreichung neuer Dokumente\nBerlin Amtsgericht Berlin (Charlottenburg) HRB 191543\nHotelFriend AG – Berlin",
      "type": "Einreichung neuer Dokumente",
      "state": "Berlin",
      "amtsgericht": "Amtsgericht Berlin (Charlottenburg)",
      "registernummer": "HRB 191543",
      "registerart": "HRB",
      "company_name": "HotelFriend AG",
      "company_seat": "Berlin",
      "details": "20.01.2026 (Bekanntmachungsdatum)\n\nBerlin Amtsgericht Berlin (Charlottenburg) HRB 191543\nEinreichung neuer Dokumente\n\nHotelFriend AG\nAktiengesellschaft\nBerlin\n\nAls nicht eingetragen wird veröffentlicht: Es wurde eine neue Liste der Aufsichtsratsmitglieder eingereicht (§ 106 AktG)."
    },
    {
      "date": "2026-01-20",
      "id": "142922",
      "original_text": "Registerbekanntmachung nach dem Umwandlungsgesetz\nBaden-Württemberg Amtsgericht Stuttgart HRB 803519\nWalter GmbH – Remseck am Neckar",
      "type": "Registerbekanntmachung nach dem Umwandlungsgesetz",
      "state": "Baden-Württemberg",
      "amtsgericht": "Amtsgericht Stuttgart",
      "registernummer": "HRB 803519",
      "registerart": "HRB",
      "company_name": "Walter GmbH",
      "company_seat": "Remseck am Neckar",
      "details": "20.01.2026 (Bekanntmachungsdatum)\n\nBaden-Württemberg Amtsgericht Stuttgart HRB 803519\nRegisterbekanntmachung nach dem Umwandlungsgesetz 20.01.2026 (Eintragungsdatum)\n\nWalter GmbH\nGesellschaft mit beschränkter Haftung\nRemseck am Neckar\n\nAls nicht eingetragen wird bekanntgemacht:\nDen Gläubigern des an dem Formwechsel beteiligten Rechtsträgers ist, wenn sie binnen sechs Monaten nach dem Tag, an dem die Eintragung des Formwechsels in das Register des Sitzes desjenigen Rechtsträgers, dessen Gläubiger sie sind, nach § 19 Abs. 3 UmwG als bekanntgemacht gilt, ihren Anspruch nach Grund und Höhe schriftlich anmelden, Sicherheit zu leisten, soweit sie nicht Befriedigung verlangen können. Dieses Recht steht den Gläubigern jedoch nur zu, wenn sie glaubhaft machen, dass durch den Formwechsel die Erfüllung ihrer Forderung gefährdet wird."
    },
    {
      "date": "2026-01-20",
      "id": "142923",
      "original_text": "Löschungsankündigung\nBaden-Württemberg Amtsgericht Mannheim HRB 731434\nM&S Komplettbau GmbH – Karlsruhe",
      "type": "Löschungsankündigung",
      "state": "Baden-Württemberg",
      "amtsgericht": "Amtsgericht Mannheim",
      "registernummer": "HRB 731434",
      "registerart": "HRB",
      "company_name": "M&S Komplettbau GmbH",
      "company_seat": "Karlsruhe",
      "details": "20.01.2026 (Bekanntmachungsdatum)\n\nBaden-Württemberg Amtsgericht Mannheim HRB 731434\nLöschungsankündigung\n\nM&S Komplettbau GmbH\nGesellschaft mit beschränkter Haftung\nKarlsruhe\n\nDas Gericht beabsichtigt, die Gesellschaft wegen Vermögenslosigkeit im Handelsregister von Amts wegen nach § 394 FamFG zu löschen. Die Frist zur Geltendmachung eines Widerspruchs gegen die beabsichtigte Löschung ist auf einen Monat ab Veröffentlichung bestimmt."
    },
    {
      "date": "2026-01-20",
      "id": "142924",
      "original_text": "Einreichung neuer Dokumente\nHamburg Amtsgericht Hamburg HRB 43371\nEDEKABANK Aktiengesellschaft – Hamburg",
      "type": "Einreichung neuer Dokumente",
      "state": "Hamburg",
      "amtsgericht": "Amtsgericht Hamburg",
      "registernummer": "HRB 43371",
      "registerart": "HRB",
      "company_name": "EDEKABANK Aktiengesellschaft",
      "company_seat": "Hamburg",
      "details": "20.01.2026 (Bekanntmachungsdatum)\n\nHamburg Amtsgericht Hamburg HRB 43371\nEinreichung neuer Dokumente\n\nEDEKABANK Aktiengesellschaft\nAktiengesellschaft\nHamburg\n\nAls nicht eingetragen wird bekannt gemacht: Liste des Aufsichtsrats wurde eingereicht."
    },
    {
      "date": "2026-01-20",
      "id": "142925",
      "original_text": "Löschungsankündigung\nBaden-Württemberg Amtsgericht Ulm HRB 742052\nPlutos GmbH – Wangen im Allgäu",
      "type": "Löschungsankündigung",
      "state": "Baden-Württemberg",
      "amtsgericht": "Amtsgericht Ulm",
      "registernummer": "HRB 742052",
      "registerart": "HRB",
      "company_name": "Plutos GmbH",
      "company_seat": "Wangen im Allgäu",
      "details": "20.01.2026 (Bekanntmachungsdatum)\n\nBaden-Württemberg Amtsgericht Ulm HRB 742052\nLöschungsankündigung\n\nPlutos GmbH\nGesellschaft mit beschränkter Haftung\nWangen im Allgäu\n\nDas Gericht beabsichtigt, die Gesellschaft wegen Vermögenslosigkeit im Handelsregister von Amts wegen nach § 394 FamFG zu löschen. Die Frist zur Geltendmachung eines Widerspruchs gegen die beabsichtigte Löschung ist auf  einen Monat ab Veröffentlichung bestimmt."
    },
    {
      "date": "2026-01-20",
      "id": "142926",
      "original_text": "Registerbekanntmachung nach dem Umwandlungsgesetz\nBaden-Württemberg Amtsgericht Stuttgart HRA 738517\nWalter GmbH & Co. KG – Remseck am Neckar",
      "type": "Registerbekanntmachung nach dem Umwandlungsgesetz",
      "state": "Baden-Württemberg",
      "amtsgericht": "Amtsgericht Stuttgart",
      "registernummer": "HRA 738517",
      "registerart": "HRA",
      "company_name": "Walter GmbH & Co. KG",
      "company_seat": "Remseck am Neckar",
      "details": "20.01.2026 (Bekanntmachungsdatum)\n\nBaden-Württemberg Amtsgericht Stuttgart HRA 738517\nRegisterbekanntmachung nach dem Umwandlungsgesetz 20.01.2026 (Eintragungsdatum)\n\nWalter GmbH & Co. KG\nKommanditgesellschaft\nRemseck am Neckar\n\nAls nicht eingetragen wird bekanntgemacht:\nDen Gläubigern des an dem Formwechsel beteiligten Rechtsträgers ist, wenn sie binnen sechs Monaten nach dem Tag, an dem die Eintragung des Formwechsels in das Register des Sitzes desjenigen Rechtsträgers, dessen Gläubiger sie sind, nach § 19 Abs. 3 UmwG als bekanntgemacht gilt, ihren Anspruch nach Grund und Höhe schriftlich anmelden, Sicherheit zu leisten, soweit sie nicht Befriedigung verlangen können. Dieses Recht steht den Gläubigern jedoch nur zu, wenn sie glaubhaft machen, dass durch den Formwechsel die Erfüllung ihrer Forderung gefährdet wird."
    },
    {
      "date": "2026-01-20",
      "id": "142927",
      "original_text": "Registerbekanntmachung nach dem Umwandlungsgesetz\nBaden-Württemberg Amtsgericht Stuttgart HRB 764743\nBinderholz Oberrot | Baruth GmbH – Oberrot",
      "type": "Registerbekanntmachung nach dem Umwandlungsgesetz",
      "state": "Baden-Württemberg",
      "amtsgericht": "Amtsgericht Stuttgart",
      "registernummer": "HRB 764743",
      "registerart": "HRB",
      "company_name": "Binderholz Oberrot | Baruth GmbH",
      "company_seat": "Oberrot",
      "details": "20.01.2026 (Bekanntmachungsdatum)\n\nBaden-Württemberg Amtsgericht Stuttgart HRB 764743\nRegisterbekanntmachung nach dem Umwandlungsgesetz 20.01.2026 (Eintragungsdatum)\n\nBinderholz Oberrot | Baruth GmbH\nGesellschaft mit beschränkter Haftung\nOberrot\n\nAls nicht eingetragen wird bekanntgemacht:\nDen Gläubigern der an der Verschmelzung beteiligten Rechtsträger ist, wenn sie binnen sechs Monaten nach dem Tag, an dem die Eintragung der Verschmelzung in das Register des Sitzes desjenigen Rechtsträgers, dessen Gläubiger sie sind, nach § 19 Abs. 3 UmwG als bekanntgemacht gilt, ihren Anspruch nach Grund und Höhe schriftlich anmelden, Sicherheit zu leisten, soweit sie nicht Befriedigung verlangen können. Dieses Recht steht den Gläubigern jedoch nur zu, wenn sie glaubhaft machen, dass durch die Verschmelzung die Erfüllung ihrer Forderung gefährdet wird."
    },
    {
      "date": "2026-01-20",
      "id": "142928",
      "original_text": "Einreichung neuer Dokumente\nBaden-Württemberg Amtsgericht Mannheim HRB 738608\nRKW SE – Mannheim",
      "type": "Einreichung neuer Dokumente",
      "state": "Baden-Württemberg",
      "amtsgericht": "Amtsgericht Mannheim",
      "registernummer": "HRB 738608",
      "registerart": "HRB",
      "company_name": "RKW SE",
      "company_seat": "Mannheim",
      "details": "20.01.2026 (Bekanntmachungsdatum)\n\nBaden-Württemberg Amtsgericht Mannheim HRB 738608\nEinreichung neuer Dokumente\n\nRKW SE\nEuropäische Aktiengesellschaft (SE)\nMannheim\n\nDie Gesellschaft hat am 20.01.2026 die Liste über die Zusammensetzung des Aufsichtsrats zum Handelsregister eingereicht."
    },
    {
      "date": "2026-01-20",
      "id": "142929",
      "original_text": "Löschungsankündigung\nBaden-Württemberg Amtsgericht Stuttgart HRB 214591\nAS Steuerberatungsgesellschaft mbH – Esslingen am Neckar",
      "type": "Löschungsankündigung",
      "state": "Baden-Württemberg",
      "amtsgericht": "Amtsgericht Stuttgart",
      "registernummer": "HRB 214591",
      "registerart": "HRB",
      "company_name": "AS Steuerberatungsgesellschaft mbH",
      "company_seat": "Esslingen am Neckar",
      "details": "20.01.2026 (Bekanntmachungsdatum)\n\nBaden-Württemberg Amtsgericht Stuttgart HRB 214591\nLöschungsankündigung\n\nAS Steuerberatungsgesellschaft mbH\nGesellschaft mit beschränkter Haftung\nEsslingen am Neckar\n\nAls nicht eingetragen wird bekanntgemacht:\nDas Gericht beabsichtigt, die Gesellschaft wegen Vermögenslosigkeit im Handelsregister von Amts wegen nach § 394 FamFG zu löschen. Die Frist zur Geltendmachung eines Widerspruchs gegen die beabsichtigte Löschung ist auf zwei Monate ab Veröffentlichung bestimmt."
    },
    {
      "date": "2026-01-20",
      "id": "142930",
      "original_text": "Löschungsankündigung\nSachsen Amtsgericht Dresden HRB 1338\nAuto Schneider Radebeul GmbH – Radebeul",
      "type": "Löschungsankündigung",
      "state": "Sachsen",
      "amtsgericht": "Amtsgericht Dresden",
      "registernummer": "HRB 1338",
      "registerart": "HRB",
      "company_name": "Auto Schneider Radebeul GmbH",
      "company_seat": "Radebeul",
      "details": "20.01.2026 (Bekanntmachungsdatum)\n\nSachsen Amtsgericht Dresden HRB 1338\nLöschungsankündigung\n\nAuto Schneider Radebeul GmbH\nGesellschaft mit beschränkter Haftung\nRadebeul\n\nDas Registergericht beabsichtigt, die im Handelsregister eingetragene Gesellschaft von Amts wegen nach § 394 FamFG zu löschen. Die Frist zu Erhebung eines Widerspruchs gegen die beabsichtigte Löschung wird auf einen Monat festgesetzt."
    },
    {
      "date": "2026-01-20",
      "id": "142931",
      "original_text": "Löschungsankündigung\nSachsen Amtsgericht Dresden HRB 31691\nNAM Industrieservice GmbH – Radeburg",
      "type": "Löschungsankündigung",
      "state": "Sachsen",
      "amtsgericht": "Amtsgericht Dresden",
      "registernummer": "HRB 31691",
      "registerart": "HRB",
      "company_name": "NAM Industrieservice GmbH",
      "company_seat": "Radeburg",
      "details": "20.01.2026 (Bekanntmachungsdatum)\n\nSachsen Amtsgericht Dresden HRB 31691\nLöschungsankündigung\n\nNAM Industrieservice GmbH\nGesellschaft mit beschränkter Haftung\nRadeburg\n\nDas Registergericht beabsichtigt, die im Handelsregister eingetragene Gesellschaft von Amts wegen nach § 394 FamFG zu löschen. Die Frist zu Erhebung eines Widerspruchs gegen die beabsichtigte Löschung wird auf einen Monat festgesetzt."
    },
    {
      "date": "2026-01-20",
      "id": "142932",
      "original_text": "Registerbekanntmachung nach dem Umwandlungsgesetz\nSachsen Amtsgericht Dresden HRA 12402\nFamilie Saiger PUW GmbH & Co. KG – Schleife",
      "type": "Registerbekanntmachung nach dem Umwandlungsgesetz",
      "state": "Sachsen",
      "amtsgericht": "Amtsgericht Dresden",
      "registernummer": "HRA 12402",
      "registerart": "HRA",
      "company_name": "Familie Saiger PUW GmbH & Co. KG",
      "company_seat": "Schleife",
      "details": "20.01.2026 (Bekanntmachungsdatum)\n\nSachsen Amtsgericht Dresden HRA 12402\nRegisterbekanntmachung nach dem Umwandlungsgesetz 20.01.2026 (Eintragungsdatum)\n\nFamilie Saiger PUW GmbH & Co. KG\nKommanditgesellschaft\nSchleife\n\nDen Gläubigern der an der Ausgliederung beteiligten Rechtsträger ist, wenn sie binnen sechs Monaten nach dem Tag, an dem die Eintragung der Ausgliederung in das Register des Sitzes desjenigen Rechtsträgers, dessen Gläubiger sie sind, nach § 19 Abs. 3 UmwG als bekannt gemacht gilt, ihren Anspruch nach Grund und Höhe in Textform anmelden, Sicherheit zu leisten, soweit sie nicht Befriedigung verlangen können. Dieses Recht steht den Gläubigern jedoch nur zu, wenn sie glaubhaft machen, dass durch die Ausgliederung die Erfüllung der Forderung gefährdet wird."
    },
    {
      "date": "2026-01-20",
      "id": "142933",
      "original_text": "Löschungsankündigung\nSachsen Amtsgericht Dresden HRB 18368\nArteum Dresden GmbH – Dresden",
      "type": "Löschungsankündigung",
      "state": "Sachsen",
      "amtsgericht": "Amtsgericht Dresden",
      "registernummer": "HRB 18368",
      "registerart": "HRB",
      "company_name": "Arteum Dresden GmbH",
      "company_seat": "Dresden",
      "details": "20.01.2026 (Bekanntmachungsdatum)\n\nSachsen Amtsgericht Dresden HRB 18368\nLöschungsankündigung\n\nArteum Dresden GmbH\nGesellschaft mit beschränkter Haftung\nDresden\n\nDas Registergericht beabsichtigt, die im Handelsregister eingetragene Gesellschaft von Amts wegen nach § 394 FamFG zu löschen. Die Frist zu Erhebung eines Widerspruchs gegen die beabsichtigte Löschung wird auf einen Monat festgesetzt."
    },
    {
      "date": "2026-01-20",
      "id": "142934",
      "original_text": "Löschungsankündigung\nSachsen Amtsgericht Dresden HRB 37757\nElbflorenz-Logistik GmbH – Dresden",
      "type": "Löschungsankündigung",
      "state": "Sachsen",
      "amtsgericht": "Amtsgericht Dresden",
      "registernummer": "HRB 37757",
      "registerart": "HRB",
      "company_name": "Elbflorenz-Logistik GmbH",
      "company_seat": "Dresden",
      "details": "20.01.2026 (Bekanntmachungsdatum)\n\nSachsen Amtsgericht Dresden HRB 37757\nLöschungsankündigung\n\nElbflorenz-Logistik GmbH\nGesellschaft mit beschränkter Haftung\nDresden\n\nDas Registergericht beabsichtigt, die im Handelsregister eingetragene Gesellschaft von Amts wegen nach § 394 FamFG zu löschen. Die Frist zu Erhebung eines Widerspruchs gegen die beabsichtigte Löschung wird auf einen Monat festgesetzt."
    },
    {
      "date": "2026-01-20",
      "id": "142935",
      "original_text": "Registerbekanntmachung nach dem Umwandlungsgesetz\nSachsen Amtsgericht Dresden HRA 12413\nForstbetrieb Dr. Lothar Saiger e.K. – Schleife",
      "type": "Registerbekanntmachung nach dem Umwandlungsgesetz",
      "state": "Sachsen",
      "amtsgericht": "Amtsgericht Dresden",
      "registernummer": "HRA 12413",
      "registerart": "HRA",
      "company_name": "Forstbetrieb Dr. Lothar Saiger e.K.",
      "company_seat": "Schleife",
      "details": "20.01.2026 (Bekanntmachungsdatum)\n\nSachsen Amtsgericht Dresden HRA 12413\nRegisterbekanntmachung nach dem Umwandlungsgesetz 20.01.2026 (Eintragungsdatum)\n\nForstbetrieb Dr. Lothar Saiger e.K.\nEinzelkaufmann / Einzelkauffrau\nSchleife\n\nDen Gläubigern der an der Ausgliederung beteiligten Rechtsträger ist, wenn sie binnen sechs Monaten nach dem Tag, an dem die Eintragung der Ausgliederung in das Register des Sitzes desjenigen Rechtsträgers, dessen Gläubiger sie sind, nach § 19 Abs. 3 UmwG als bekannt gemacht gilt, ihren Anspruch nach Grund und Höhe in Textform anmelden, Sicherheit zu leisten, soweit sie nicht Befriedigung verlangen können. Dieses Recht steht den Gläubigern jedoch nur zu, wenn sie glaubhaft machen, dass durch die Ausgliederung die Erfüllung der Forderung gefährdet wird."
    },
    {
      "date": "2026-01-20",
      "id": "142936",
      "original_text": "Registerbekanntmachung nach dem Umwandlungsgesetz\nNiedersachsen Amtsgericht Göttingen HRB 206531\nHartmut Otto Holding GmbH – Göttingen",
      "type": "Registerbekanntmachung nach dem Umwandlungsgesetz",
      "state": "Niedersachsen",
      "amtsgericht": "Amtsgericht Göttingen",
      "registernummer": "HRB 206531",
      "registerart": "HRB",
      "company_name": "Hartmut Otto Holding GmbH",
      "company_seat": "Göttingen",
      "details": "20.01.2026 (Bekanntmachungsdatum)\n\nNiedersachsen Amtsgericht Göttingen HRB 206531\nRegisterbekanntmachung nach dem Umwandlungsgesetz 20.01.2026 (Eintragungsdatum)\n\nHartmut Otto Holding GmbH\nGesellschaft mit beschränkter Haftung\nGöttingen\n\nDen Gläubigern der an der Verschmelzung beteiligten Rechtsträger ist, wenn sie binnen sechs Monaten nach dem Tag, an dem die Eintragung der Verschmelzung in das Register des Sitzes desjenigen Rechtsträgers, dessen Gläubiger sie sind, nach § 19  Abs.  3 UmwG als bekannt gemacht gilt, ihren Anspruch nach Grund und Höhe schriftlich anmelden, Sicherheit zu leisten, soweit sie nicht Befriedigung verlangen können. Dieses Recht steht den Gläubigern jedoch nur zu, wenn sie glaubhaft machen, dass durch die Verschmelzung die Erfüllung der Forderung gefährdet wird."
    },
    {
      "date": "2026-01-20",
      "id": "142937",
      "original_text": "Löschungsankündigung\nNiedersachsen Amtsgericht Hannover HRB 222564\nNew Amaranth 6 GmbH – Hannover",
      "type": "Löschungsankündigung",
      "state": "Niedersachsen",
      "amtsgericht": "Amtsgericht Hannover",
      "registernummer": "HRB 222564",
      "registerart": "HRB",
      "company_name": "New Amaranth 6 GmbH",
      "company_seat": "Hannover",
      "details": "20.01.2026 (Bekanntmachungsdatum)\n\nNiedersachsen Amtsgericht Hannover HRB 222564\nLöschungsankündigung\n\nNew Amaranth 6 GmbH\nGesellschaft mit beschränkter Haftung\nHannover\n\nDas Registergericht beabsichtigt, die Gesellschaft von Amts wegen nach § 394 FamFG zu löschen. Die Frist zur Erhebung eines Widerspruchs ist auf 1 Monat ab dieser Registerbekanntmachung festgesetzt."
    },
    {
      "date": "2026-01-20",
      "id": "142938",
      "original_text": "Registerbekanntmachung nach dem Umwandlungsgesetz\nNiedersachsen Amtsgericht Braunschweig HRB 208411\nKASS Immobilien GmbH – Braunschweig",
      "type": "Registerbekanntmachung nach dem Umwandlungsgesetz",
      "state": "Niedersachsen",
      "amtsgericht": "Amtsgericht Braunschweig",
      "registernummer": "HRB 208411",
      "registerart": "HRB",
      "company_name": "KASS Immobilien GmbH",
      "company_seat": "Braunschweig",
      "details": "20.01.2026 (Bekanntmachungsdatum)\n\nNiedersachsen Amtsgericht Braunschweig HRB 208411\nRegisterbekanntmachung nach dem Umwandlungsgesetz 20.01.2026 (Eintragungsdatum)\n\nKASS Immobilien GmbH\nGesellschaft mit beschränkter Haftung\nBraunschweig\n\nDen Gläubigern der an der formwechselnden Umwandlung beteiligten Rechtsträger ist, wenn sie binnen sechs Monaten nach dem Tag, an dem die Eintragung der Umwandlung in das Register des Sitzes desjenigen Rechtsträgers, dessen Gläubiger sie sind, nach § 19 Abs. 3 UmwG als bekannt gemacht gilt, ihren Anspruch nach Grund und Höhe schriftlich anmelden, Sicherheit zu leisten, soweit sie nicht Befriedigung verlangen können. Dieses Recht steht den Gläubigern jedoch nur zu, wenn sie glaubhaft machen, dass durch die formwechselnde Umwandlung die Erfüllung der Forderung gefährdet wird."
    },
    {
      "date": "2026-01-20",
      "id": "142939",
      "original_text": "Sonstige Registerbekanntmachung\nNiedersachsen Amtsgericht Osnabrück HRB 20332\nSemcoglas Bramsche GmbH – Bramsche",
      "type": "Sonstige Registerbekanntmachung",
      "state": "Niedersachsen",
      "amtsgericht": "Amtsgericht Osnabrück",
      "registernummer": "HRB 20332",
      "registerart": "HRB",
      "company_name": "Semcoglas Bramsche GmbH",
      "company_seat": "Bramsche",
      "details": "20.01.2026 (Bekanntmachungsdatum)\n\nNiedersachsen Amtsgericht Osnabrück HRB 20332\nSonstige Registerbekanntmachung 20.01.2026 (Eintragungsdatum)\n\nSemcoglas Bramsche GmbH\nGesellschaft mit beschränkter Haftung\nBramsche\n\nDen Gläubigern der Gesellschaft, deren Forderungen begründet worden sind, bevor die Eintragung der Beendigung des Vertrages in das Handelsregister nach § 10 HGB als bekanntgemacht gilt, ist vom anderen Vertragsteil Sicherheit zu leisten, wenn sie sich binnen sechs Monaten nach der Bekanntmachung zu diesem Zweck bei ihm melden."
    },
    {
      "date": "2026-01-20",
      "id": "142940",
      "original_text": "Einreichung neuer Dokumente\nSachsen Amtsgericht Chemnitz HRB 19751\nenvia Mitteldeutsche Energie AG – Chemnitz",
      "type": "Einreichung neuer Dokumente",
      "state": "Sachsen",
      "amtsgericht": "Amtsgericht Chemnitz",
      "registernummer": "HRB 19751",
      "registerart": "HRB",
      "company_name": "envia Mitteldeutsche Energie AG",
      "company_seat": "Chemnitz",
      "details": "20.01.2026 (Bekanntmachungsdatum)\n\nSachsen Amtsgericht Chemnitz HRB 19751\nEinreichung neuer Dokumente\n\nenvia Mitteldeutsche Energie AG\nAktiengesellschaft\nChemnitz\n\nAm 14.01.2026 wurde beim Handelsregister des Amtsgerichts Chemnitz die Liste der Mitglieder des Aufsichtsrats gemäß § 106 AktG eingereicht."
    },
    {
      "date": "2026-01-20",
      "id": "142941",
      "original_text": "Einreichung neuer Dokumente\nBremen Amtsgericht Bremen HRB 6751\nBLB Immobilien GmbH – Bremen",
      "type": "Einreichung neuer Dokumente",
      "state": "Bremen",
      "amtsgericht": "Amtsgericht Bremen",
      "registernummer": "HRB 6751",
      "registerart": "HRB",
      "company_name": "BLB Immobilien GmbH",
      "company_seat": "Bremen",
      "details": "20.01.2026 (Bekanntmachungsdatum)\n\nBremen Amtsgericht Bremen HRB 6751\nEinreichung neuer Dokumente\n\nBLB Immobilien GmbH\nGesellschaft mit beschränkter Haftung\nBremen\n\nAls nicht eingetragen wird bekannt gemacht: Liste des Aufsichtsrats wurde eingereicht."
    },
    {
      "date": "2026-01-20",
      "id": "142942",
      "original_text": "Löschungsankündigung\nBremen Amtsgericht Bremen HRB 39729\nFR und Söhne Bauunternehmer GmbH – Bremerhaven",
      "type": "Löschungsankündigung",
      "state": "Bremen",
      "amtsgericht": "Amtsgericht Bremen",
      "registernummer": "HRB 39729",
      "registerart": "HRB",
      "company_name": "FR und Söhne Bauunternehmer GmbH",
      "company_seat": "Bremerhaven",
      "details": "20.01.2026 (Bekanntmachungsdatum)\n\nBremen Amtsgericht Bremen HRB 39729\nLöschungsankündigung\n\nFR und Söhne Bauunternehmer GmbH\nGesellschaft mit beschränkter Haftung\nBremerhaven\n\nEs ist beabsichtigt die im Handelsregister eingetragene Gesellschaft von Amts wegen gemäß § 394 FamFG zu löschen. Gegen die Löschung kann beim AG Bremen schriftlich oder zu Protokoll der Geschäftsstelle Widerspruch eingelegt werden. Widerspruchsfrist 4 Wochen."
    },
    {
      "date": "2026-01-20",
      "id": "142943",
      "original_text": "Löschungsankündigung\nRheinland-Pfalz Amtsgericht Koblenz HRB 25206\nV. O. Konstante Handelslogistik GmbH – Müllenbach",
      "type": "Löschungsankündigung",
      "state": "Rheinland-Pfalz",
      "amtsgericht": "Amtsgericht Koblenz",
      "registernummer": "HRB 25206",
      "registerart": "HRB",
      "company_name": "V. O. Konstante Handelslogistik GmbH",
      "company_seat": "Müllenbach",
      "details": "20.01.2026 (Bekanntmachungsdatum)\n\nRheinland-Pfalz Amtsgericht Koblenz HRB 25206\nLöschungsankündigung 20.01.2026 (Eintragungsdatum)\n\nV. O. Konstante Handelslogistik GmbH\nGesellschaft mit beschränkter Haftung\nMüllenbach\n\nDas Registergericht beabsichtigt die Gesellschaft von Amts wegen nach § 394 FamFG zu löschen. Die Frist zur Erhebung eines Widerspruchs ist auf zwei Monate festgesetzt."
    },
    {
      "date": "2026-01-20",
      "id": "142944",
      "original_text": "Löschungsankündigung\nRheinland-Pfalz Amtsgericht Kaiserslautern HRB 33629\nZ. B. WDVS Bauunternehmung GmbH – Mehlingen",
      "type": "Löschungsankündigung",
      "state": "Rheinland-Pfalz",
      "amtsgericht": "Amtsgericht Kaiserslautern",
      "registernummer": "HRB 33629",
      "registerart": "HRB",
      "company_name": "Z. B. WDVS Bauunternehmung GmbH",
      "company_seat": "Mehlingen",
      "details": "20.01.2026 (Bekanntmachungsdatum)\n\nRheinland-Pfalz Amtsgericht Kaiserslautern HRB 33629\nLöschungsankündigung\n\nZ. B. WDVS Bauunternehmung GmbH\nGesellschaft mit beschränkter Haftung\nMehlingen\n\nDas Registergericht beabsichtigt die vorgenannte Firma gemäß § 394 FamFG wegen Vermögenslosigkeit zu löschen. Widerspruch gegen die Löschung kann nur binnen 3 Monaten ab Veröffentlichung dieser Verfügung eingelegt werden."
    },
    {
      "date": "2026-01-20",
      "id": "142945",
      "original_text": "Einreichung neuer Dokumente\nRheinland-Pfalz Amtsgericht Zweibrücken HRB 11761\nNardini Klinikum GmbH – Zweibrücken",
      "type": "Einreichung neuer Dokumente",
      "state": "Rheinland-Pfalz",
      "amtsgericht": "Amtsgericht Zweibrücken",
      "registernummer": "HRB 11761",
      "registerart": "HRB",
      "company_name": "Nardini Klinikum GmbH",
      "company_seat": "Zweibrücken",
      "details": "20.01.2026 (Bekanntmachungsdatum)\n\nRheinland-Pfalz Amtsgericht Zweibrücken HRB 11761\nEinreichung neuer Dokumente\n\nNardini Klinikum GmbH\nGesellschaft mit beschränkter Haftung\nZweibrücken\n\nDem Registergericht ist eine Liste der Mitglieder des Aufsichtsrates eingereicht worden."
    },
    {
      "date": "2026-01-20",
      "id": "142946",
      "original_text": "Löschungsankündigung\nNordrhein-Westfalen Amtsgericht Köln HRB 95779\nG&B GmbH – Wesseling",
      "type": "Löschungsankündigung",
      "state": "Nordrhein-Westfalen",
      "amtsgericht": "Amtsgericht Köln",
      "registernummer": "HRB 95779",
      "registerart": "HRB",
      "company_name": "G&B GmbH",
      "company_seat": "Wesseling",
      "details": "20.01.2026 (Bekanntmachungsdatum)\n\nNordrhein-Westfalen Amtsgericht Köln HRB 95779\nLöschungsankündigung\n\nG&B GmbH\nGesellschaft mit beschränkter Haftung\nWesseling\n\nDas Registergericht beabsichtigt die Gesellschaft von Amts wegen nach § 394 FamFG zu löschen. Die Frist zur Erhebung eines Widerspruchs ist auf einen Monat festgesetzt."
    },
    {
      "date": "2026-01-20",
      "id": "142947",
      "original_text": "Registerbekanntmachung nach dem Umwandlungsgesetz\nNordrhein-Westfalen Amtsgericht Hagen HRB 9698\nThalia Bücher GmbH – Hagen",
      "type": "Registerbekanntmachung nach dem Umwandlungsgesetz",
      "state": "Nordrhein-Westfalen",
      "amtsgericht": "Amtsgericht Hagen",
      "registernummer": "HRB 9698",
      "registerart": "HRB",
      "company_name": "Thalia Bücher GmbH",
      "company_seat": "Hagen",
      "details": "20.01.2026 (Bekanntmachungsdatum)\n\nNordrhein-Westfalen Amtsgericht Hagen HRB 9698\nRegisterbekanntmachung nach dem Umwandlungsgesetz 19.01.2026 (Eintragungsdatum)\n\nThalia Bücher GmbH\nGesellschaft mit beschränkter Haftung\nHagen\n\nDen Gläubigern der an der Verschmelzung beteiligten Rechtsträger ist, wenn sie binnen sechs Monaten nach dem Tag, an dem die Eintragung der Verschmelzung in das Register des Sitzes desjenigen Rechtsträgers, dessen Gläubiger sie sind, nach § 19 Absatz 3 UmwG als bekanntgemacht gilt, ihren Anspruch nach Grund und Höhe schriftlich anmelden, Sicherheit zu leisten, soweit sie nicht Befriedigung verlangen können. Dieses Recht steht den Gläubigern jedoch nur zu, wenn sie glaubhaft machen, dass durch die Verschmelzung die Erfüllung ihrer Forderung gefährdet wird."
    },
    {
      "date": "2026-01-20",
      "id": "142948",
      "original_text": "Sonstige Registerbekanntmachung\nNordrhein-Westfalen Amtsgericht Bochum HRB 18446\nRuhr Liegenschaften Verwaltungs GmbH – Bochum",
      "type": "Sonstige Registerbekanntmachung",
      "state": "Nordrhein-Westfalen",
      "amtsgericht": "Amtsgericht Bochum",
      "registernummer": "HRB 18446",
      "registerart": "HRB",
      "company_name": "Ruhr Liegenschaften Verwaltungs GmbH",
      "company_seat": "Bochum",
      "details": "20.01.2026 (Bekanntmachungsdatum)\n\nNordrhein-Westfalen Amtsgericht Bochum HRB 18446\nSonstige Registerbekanntmachung 13.01.2026 (Eintragungsdatum)\n\nRuhr Liegenschaften Verwaltungs GmbH\nGesellschaft mit beschränkter Haftung\nBochum\n\nAls nicht eingetragen wird veröffentlicht: Den Gläubigern der Gesellschaft, deren Forderungen begründet worden sind bevor die Eintragung der Beendigung des Ergebnisabführungsvertrages  in das Handelsregister nach § 10 des Handelsgesetzbuches als bekanntgemacht gilt, hat der andere Vertragsteil Sicherheit zu leisten, wenn sie sich binnen sechs Monaten nach der Bekanntmachung der Eintragung zu diesem Zweck bei ihm melden."
    },
    {
      "date": "2026-01-20",
      "id": "142949",
      "original_text": "Löschungsankündigung\nNordrhein-Westfalen Amtsgericht Bonn HRB 27822\nLEI Verwaltungs GmbH – Euskirchen",
      "type": "Löschungsankündigung",
      "state": "Nordrhein-Westfalen",
      "amtsgericht": "Amtsgericht Bonn",
      "registernummer": "HRB 27822",
      "registerart": "HRB",
      "company_name": "LEI Verwaltungs GmbH",
      "company_seat": "Euskirchen",
      "details": "20.01.2026 (Bekanntmachungsdatum)\n\nNordrhein-Westfalen Amtsgericht Bonn HRB 27822\nLöschungsankündigung\n\nLEI Verwaltungs GmbH\nGesellschaft mit beschränkter Haftung\nEuskirchen\n\nDas Registergericht beabsichtigt die Gesellschaft von Amts wegen nach § 394 FamFG zu löschen. Die Frist zur Erhebung eines Widerspruchs ist auf einen Monat festgesetzt."
    },
    {
      "date": "2026-01-20",
      "id": "142950",
      "original_text": "Einreichung neuer Dokumente\nNordrhein-Westfalen Amtsgericht Münster HRB 7673\nWasserversorgung Beckum GmbH – Beckum",
      "type": "Einreichung neuer Dokumente",
      "state": "Nordrhein-Westfalen",
      "amtsgericht": "Amtsgericht Münster",
      "registernummer": "HRB 7673",
      "registerart": "HRB",
      "company_name": "Wasserversorgung Beckum GmbH",
      "company_seat": "Beckum",
      "details": "20.01.2026 (Bekanntmachungsdatum)\n\nNordrhein-Westfalen Amtsgericht Münster HRB 7673\nEinreichung neuer Dokumente\n\nWasserversorgung Beckum GmbH\nGesellschaft mit beschränkter Haftung\nBeckum\n\nDem Registergericht ist eine neue Liste der Mitglieder des Aufsichtsrates eingereicht worden."
    },
    {
      "date": "2026-01-20",
      "id": "142951",
      "original_text": "Einreichung neuer Dokumente\nNordrhein-Westfalen Amtsgericht Köln HRB 63919\nMerten GmbH – Wiehl",
      "type": "Einreichung neuer Dokumente",
      "state": "Nordrhein-Westfalen",
      "amtsgericht": "Amtsgericht Köln",
      "registernummer": "HRB 63919",
      "registerart": "HRB",
      "company_name": "Merten GmbH",
      "company_seat": "Wiehl",
      "details": "20.01.2026 (Bekanntmachungsdatum)\n\nNordrhein-Westfalen Amtsgericht Köln HRB 63919\nEinreichung neuer Dokumente\n\nMerten GmbH\nGesellschaft mit beschränkter Haftung\nWiehl\n\nDem Registergericht ist eine neue Liste der Mitglieder des Aufsichtsrates eingereicht worden."
    },
    {
      "date": "2026-01-20",
      "id": "142952",
      "original_text": "Einreichung neuer Dokumente\nNordrhein-Westfalen Amtsgericht Wuppertal HRB 18485\nHELIOS Klinikum Niederberg GmbH – Velbert",
      "type": "Einreichung neuer Dokumente",
      "state": "Nordrhein-Westfalen",
      "amtsgericht": "Amtsgericht Wuppertal",
      "registernummer": "HRB 18485",
      "registerart": "HRB",
      "company_name": "HELIOS Klinikum Niederberg GmbH",
      "company_seat": "Velbert",
      "details": "20.01.2026 (Bekanntmachungsdatum)\n\nNordrhein-Westfalen Amtsgericht Wuppertal HRB 18485\nEinreichung neuer Dokumente 20.01.2026 (Eintragungsdatum)\n\nHELIOS Klinikum Niederberg GmbH\nGesellschaft mit beschränkter Haftung\nVelbert\n\nDem Registergericht ist eine neue Liste der Mitglieder des Aufsichtsrates eingereicht worden."
    },
    {
      "date": "2026-01-20",
      "id": "142953",
      "original_text": "Löschungsankündigung\nNordrhein-Westfalen Amtsgericht Wuppertal HRB 25459\nMeisterstück UG (haftungsbeschränkt) – Wuppertal",
      "type": "Löschungsankündigung",
      "state": "Nordrhein-Westfalen",
      "amtsgericht": "Amtsgericht Wuppertal",
      "registernummer": "HRB 25459",
      "registerart": "HRB",
      "company_name": "Meisterstück UG (haftungsbeschränkt)",
      "company_seat": "Wuppertal",
      "details": "20.01.2026 (Bekanntmachungsdatum)\n\nNordrhein-Westfalen Amtsgericht Wuppertal HRB 25459\nLöschungsankündigung\n\nMeisterstück UG (haftungsbeschränkt)\nGesellschaft mit beschränkter Haftung\nWuppertal\n\nDas Registergericht beabsichtigt die Gesellschaft von Amts wegen nach § 394 FamFG zu löschen. Die Frist zur Erhebung eines Widerspruchs ist auf einen Monat festgesetzt."
    },
    {
      "date": "2026-01-20",
      "id": "142954",
      "original_text": "Sonstige Registerbekanntmachung\nNordrhein-Westfalen Amtsgericht Aachen HRB 25211\nbc GmbH – Würselen",
      "type": "Sonstige Registerbekanntmachung",
      "state": "Nordrhein-Westfalen",
      "amtsgericht": "Amtsgericht Aachen",
      "registernummer": "HRB 25211",
      "registerart": "HRB",
      "company_name": "bc GmbH",
      "company_seat": "Würselen",
      "details": "20.01.2026 (Bekanntmachungsdatum)\n\nNordrhein-Westfalen Amtsgericht Aachen HRB 25211\nSonstige Registerbekanntmachung 20.01.2026 (Eintragungsdatum)\n\nbc GmbH\nGesellschaft mit beschränkter Haftung\nWürselen\n\nAls nicht eingetragen wird veröffentlicht: Den Gläubigern der Gesellschaft, deren Forderungen begründet worden sind bevor die Eintragung der Beendigung des Gewinnabführungsvertrages  in das Handelsregister nach § 10 des Handelsgesetzbuches als bekanntgemacht gilt, hat der andere Vertragsteil Sicherheit zu leisten, wenn sie sich binnen sechs Monaten nach der Bekanntmachung der Eintragung zu diesem Zweck bei ihm melden."
    },
    {
      "date": "2026-01-20",
      "id": "142955",
      "original_text": "Registerbekanntmachung nach dem Umwandlungsgesetz\nNordrhein-Westfalen Amtsgericht Bochum HRB 7786\nDittmar u. Stachowiak GmbH – Bochum",
      "type": "Registerbekanntmachung nach dem Umwandlungsgesetz",
      "state": "Nordrhein-Westfalen",
      "amtsgericht": "Amtsgericht Bochum",
      "registernummer": "HRB 7786",
      "registerart": "HRB",
      "company_name": "Dittmar u. Stachowiak GmbH",
      "company_seat": "Bochum",
      "details": "20.01.2026 (Bekanntmachungsdatum)\n\nNordrhein-Westfalen Amtsgericht Bochum HRB 7786\nRegisterbekanntmachung nach dem Umwandlungsgesetz 19.01.2026 (Eintragungsdatum)\n\nDittmar u. Stachowiak GmbH\nGesellschaft mit beschränkter Haftung\nBochum\n\nDen Gläubigern der an der Ausgliederung beteiligten Rechtsträger ist, wenn sie binnen sechs Monaten nach dem Tag, an dem die Eintragung der Ausgliederung in das Register des Sitzes derjenigen Rechtsträger deren Gläubiger sie sind, nach § 19 Absatz 3 UmwG als bekanntgemacht gilt, ihren Anspruch nach Grund und Höhe schriftlich anmelden, Sicherheit zu leisten, soweit sie nicht Befriedigung verlangen können. Dieses Recht steht den Gläubigern jedoch nur zu, wenn sie glaubhaft machen, dass durch die Ausgliederung die Erfüllung ihrer Forderung gefährdet wird."
    },
    {
      "date": "2026-01-20",
      "id": "142956",
      "original_text": "Einreichung neuer Dokumente\nNordrhein-Westfalen Amtsgericht Bonn HRB 6792\nDeutsche Post AG – Bonn",
      "type": "Einreichung neuer Dokumente",
      "state": "Nordrhein-Westfalen",
      "amtsgericht": "Amtsgericht Bonn",
      "registernummer": "HRB 6792",
      "registerart": "HRB",
      "company_name": "Deutsche Post AG",
      "company_seat": "Bonn",
      "details": "20.01.2026 (Bekanntmachungsdatum)\n\nNordrhein-Westfalen Amtsgericht Bonn HRB 6792\nEinreichung neuer Dokumente\n\nDeutsche Post AG\nAktiengesellschaft\nBonn\n\nDem Registergericht ist eine neue Liste der Mitglieder des Aufsichtsrates eingereicht worden."
    },
    {
      "date": "2026-01-20",
      "id": "142957",
      "original_text": "Löschungsankündigung\nNordrhein-Westfalen Amtsgericht Aachen HRB 22755\nZTSS GmbH – Aachen",
      "type": "Löschungsankündigung",
      "state": "Nordrhein-Westfalen",
      "amtsgericht": "Amtsgericht Aachen",
      "registernummer": "HRB 22755",
      "registerart": "HRB",
      "company_name": "ZTSS GmbH",
      "company_seat": "Aachen",
      "details": "20.01.2026 (Bekanntmachungsdatum)\n\nNordrhein-Westfalen Amtsgericht Aachen HRB 22755\nLöschungsankündigung\n\nZTSS GmbH\nGesellschaft mit beschränkter Haftung\nAachen\n\nDas Registergericht beabsichtigt, von Amts wegen die Gesellschaft wegen Vermögenslosigkeit nach § 394 FamFG zu löschen, weil das Finanzamt Aachen-Stadt mit Schreiben vom 14.01.2026 Umstände mitgeteilt hat, aufgrund derer das Gericht davon überzeugt ist, dass die Gesellschaft vollständig vermögenslos ist.\n\nZur Geltendmachung des Widerspruchs gegen die beabsichtigte Löschung wird hiermit eine Frist von einem Monat ab Veröffentlichung dieser Ankündigung bestimmt.\n\nRechtsbehelfsbelehrung:\n\nGegen diese Verfügung kann Widerspruch eingelegt werden. Zum Widerspruch ist jeder berechtigt, der an der Unterlassung der Löschung ein berechtigtes Interesse hat.\n\nDer Widerspruch ist bei dem Amtsgericht Aachen, Adalbertsteinweg 92, 52070 Aachen schriftlich in deutscher Sprache oder zur Niederschrift der Geschäftsstelle einzulegen. Der Widerspruch kann auch zur Niederschrift der Geschäftsstelle eines jeden Amtsgerichtes abgegeben werden.\n\nDer Widerspruch muss spätestens innerhalb der gesetzten Frist nach der Bekanntgabe der Verfügung bei dem Amtsgericht Aachen eingegangen sein. Dies gilt auch dann, wenn der Widerspruch zur Niederschrift der Geschäftsstelle eines anderen Amtsgerichtes abgegeben wurde. Die Frist beginnt mit der Bekanntgabe der Verfügung durch Veröffentlichung. Fällt das Ende der Frist auf einen Sonntag, einen allgemeinen Feiertag oder Sonnabend, so endet die Frist mit Ablauf des nächsten Werktages.\n\nDer Widerspruch muss die Bezeichnung der angefochtenen Verfügung sowie die Erklärung enthalten, dass Widerspruch gegen diese Verfügung eingelegt wird. Er ist zu unterzeichnen und soll begründet werden.\n\nDie Einlegung ist auch durch Übertragung eines elektronischen Dokuments an die elektronische Poststelle des Gerichts möglich. Das elektronische Dokument muss für die Bearbeitung durch das Gericht geeignet und mit einer qualifizierten elektronischen Signatur der verantwortenden Person versehen sein oder von der verantwortenden Person signiert und auf einem sicheren Übermittlungsweg gemäß § 130 a ZPO nach näherer Maßgabe der Verordnung über die technischen Rahmenbedingungen des elektronischen Rechtsverkehrs und über das besondere elektronische Behördenpostfach (BGBl. I, S. 3803) eingereicht werden. Weitere Informationen erhalten Sie auf der Internetseite www.justiz.de."
    },
    {
      "date": "2026-01-20",
      "id": "142958",
      "original_text": "Löschungsankündigung\nNordrhein-Westfalen Amtsgericht Recklinghausen HRB 9373\nDitas UG (haftungsbeschränkt) – Herten",
      "type": "Löschungsankündigung",
      "state": "Nordrhein-Westfalen",
      "amtsgericht": "Amtsgericht Recklinghausen",
      "registernummer": "HRB 9373",
      "registerart": "HRB",
      "company_name": "Ditas UG (haftungsbeschränkt)",
      "company_seat": "Herten",
      "details": "20.01.2026 (Bekanntmachungsdatum)\n\nNordrhein-Westfalen Amtsgericht Recklinghausen HRB 9373\nLöschungsankündigung\n\nDitas UG (haftungsbeschränkt)\nGesellschaft mit beschränkter Haftung\nHerten\n\nDas Registergericht beabsichtigt die Gesellschaft von Amts wegen nach § 394 FamFG zu löschen. Die Frist zur Erhebung eines Widerspruchs ist auf drei Monate festgesetzt."
    },
    {
      "date": "2026-01-20",
      "id": "142959",
      "original_text": "Registerbekanntmachung nach dem Umwandlungsgesetz\nNordrhein-Westfalen Amtsgericht Düsseldorf HRA 25976\nWattner SunAsset Solarkraftwerk 048 GmbH & Co. KG – Monheim am Rhein",
      "type": "Registerbekanntmachung nach dem Umwandlungsgesetz",
      "state": "Nordrhein-Westfalen",
      "amtsgericht": "Amtsgericht Düsseldorf",
      "registernummer": "HRA 25976",
      "registerart": "HRA",
      "company_name": "Wattner SunAsset Solarkraftwerk 048 GmbH & Co. KG",
      "company_seat": "Monheim am Rhein",
      "details": "20.01.2026 (Bekanntmachungsdatum)\n\nNordrhein-Westfalen Amtsgericht Düsseldorf HRA 25976\nRegisterbekanntmachung nach dem Umwandlungsgesetz 20.01.2026 (Eintragungsdatum)\n\nWattner SunAsset Solarkraftwerk 048 GmbH & Co. KG\nKommanditgesellschaft\nMonheim am Rhein\n\nDen Gläubigern der an der Verschmelzung beteiligten Rechtsträger ist, wenn sie binnen sechs Monaten nach dem Tag, an dem die Eintragung der Verschmelzung in das Register des Sitzes derjenigen Rechtsträger deren Gläubiger sie sind, nach § 19 Absatz 3 UmwG als bekanntgemacht gilt, ihren Anspruch nach Grund und Höhe schriftlich anmelden, Sicherheit zu leisten, soweit sie nicht Befriedigung verlangen können. Dieses Recht steht den Gläubigern jedoch nur zu, wenn sie glaubhaft machen, dass durch die Verschmelzung die Erfüllung ihrer Forderung gefährdet wird."
    },
    {
      "date": "2026-01-20",
      "id": "142960",
      "original_text": "Einreichung neuer Dokumente\nNordrhein-Westfalen Amtsgericht Essen HRB 29323\nJaguar Land Rover Classic Deutschland GmbH – Essen",
      "type": "Einreichung neuer Dokumente",
      "state": "Nordrhein-Westfalen",
      "amtsgericht": "Amtsgericht Essen",
      "registernummer": "HRB 29323",
      "registerart": "HRB",
      "company_name": "Jaguar Land Rover Classic Deutschland GmbH",
      "company_seat": "Essen",
      "details": "20.01.2026 (Bekanntmachungsdatum)\n\nNordrhein-Westfalen Amtsgericht Essen HRB 29323\nEinreichung neuer Dokumente\n\nJaguar Land Rover Classic Deutschland GmbH\nGesellschaft mit beschränkter Haftung\nEssen\n\nDem Registergericht ist eine Liste der Mitglieder des Aufsichtsrates eingereicht worden."
    },
    {
      "date": "2026-01-20",
      "id": "142961",
      "original_text": "Einreichung neuer Dokumente\nNordrhein-Westfalen Amtsgericht Münster HRB 22125\nProvinzial Next Aktiengesellschaft – Münster",
      "type": "Einreichung neuer Dokumente",
      "state": "Nordrhein-Westfalen",
      "amtsgericht": "Amtsgericht Münster",
      "registernummer": "HRB 22125",
      "registerart": "HRB",
      "company_name": "Provinzial Next Aktiengesellschaft",
      "company_seat": "Münster",
      "details": "20.01.2026 (Bekanntmachungsdatum)\n\nNordrhein-Westfalen Amtsgericht Münster HRB 22125\nEinreichung neuer Dokumente\n\nProvinzial Next Aktiengesellschaft\nAktiengesellschaft\nMünster\n\nDem Registergericht ist eine neue Liste der Mitglieder des Aufsichtsrates eingereicht worden."
    },
    {
      "date": "2026-01-20",
      "id": "142962",
      "original_text": "Einreichung neuer Dokumente\nNordrhein-Westfalen Amtsgericht Wuppertal HRB 8419\nHELIOS Klinikum Wuppertal GmbH – Wuppertal",
      "type": "Einreichung neuer Dokumente",
      "state": "Nordrhein-Westfalen",
      "amtsgericht": "Amtsgericht Wuppertal",
      "registernummer": "HRB 8419",
      "registerart": "HRB",
      "company_name": "HELIOS Klinikum Wuppertal GmbH",
      "company_seat": "Wuppertal",
      "details": "20.01.2026 (Bekanntmachungsdatum)\n\nNordrhein-Westfalen Amtsgericht Wuppertal HRB 8419\nEinreichung neuer Dokumente\n\nHELIOS Klinikum Wuppertal GmbH\nGesellschaft mit beschränkter Haftung\nWuppertal\n\nDem Registergericht ist eine Liste der Mitglieder des Aufsichtsrates eingereicht worden."
    },
    {
      "date": "2026-01-20",
      "id": "142963",
      "original_text": "Einreichung neuer Dokumente\nNordrhein-Westfalen Amtsgericht Köln HRB 1005\nDEG - Deutsche Investitions- und Entwicklungsgesellschaft mbH – Köln",
      "type": "Einreichung neuer Dokumente",
      "state": "Nordrhein-Westfalen",
      "amtsgericht": "Amtsgericht Köln",
      "registernummer": "HRB 1005",
      "registerart": "HRB",
      "company_name": "DEG - Deutsche Investitions- und Entwicklungsgesellschaft mbH",
      "company_seat": "Köln",
      "details": "20.01.2026 (Bekanntmachungsdatum)\n\nNordrhein-Westfalen Amtsgericht Köln HRB 1005\nEinreichung neuer Dokumente 20.01.2026 (Eintragungsdatum)\n\nDEG - Deutsche Investitions- und Entwicklungsgesellschaft mbH\nGesellschaft mit beschränkter Haftung\nKöln\n\nDem Registergericht ist eine neue Liste der Mitglieder des Aufsichtsrates eingereicht worden."
    },
    {
      "date": "2026-01-20",
      "id": "142964",
      "original_text": "Löschungsankündigung\nNordrhein-Westfalen Amtsgericht Wuppertal HRB 16990\nAdam Donner GmbH – Wuppertal",
      "type": "Löschungsankündigung",
      "state": "Nordrhein-Westfalen",
      "amtsgericht": "Amtsgericht Wuppertal",
      "registernummer": "HRB 16990",
      "registerart": "HRB",
      "company_name": "Adam Donner GmbH",
      "company_seat": "Wuppertal",
      "details": "20.01.2026 (Bekanntmachungsdatum)\n\nNordrhein-Westfalen Amtsgericht Wuppertal HRB 16990\nLöschungsankündigung\n\nAdam Donner GmbH\nGesellschaft mit beschränkter Haftung\nWuppertal\n\nDas Registergericht beabsichtigt die Gesellschaft von Amts wegen nach § 394 FamFG zu löschen. Die Frist zur Erhebung eines Widerspruchs ist auf einen Monat festgesetzt."
    },
    {
      "date": "2026-01-20",
      "id": "142965",
      "original_text": "Einreichung neuer Dokumente\nNordrhein-Westfalen Amtsgericht Gütersloh HRB 5565\nWestag AG – Rheda-Wiedenbrück",
      "type": "Einreichung neuer Dokumente",
      "state": "Nordrhein-Westfalen",
      "amtsgericht": "Amtsgericht Gütersloh",
      "registernummer": "HRB 5565",
      "registerart": "HRB",
      "company_name": "Westag AG",
      "company_seat": "Rheda-Wiedenbrück",
      "details": "20.01.2026 (Bekanntmachungsdatum)\n\nNordrhein-Westfalen Amtsgericht Gütersloh HRB 5565\nEinreichung neuer Dokumente 16.01.2026 (Eintragungsdatum)\n\nWestag AG\nAktiengesellschaft\nRheda-Wiedenbrück\n\nDem Registergericht ist eine neue Liste der Mitglieder des Aufsichtsrates eingereicht worden."
    },
    {
      "date": "2026-01-20",
      "id": "142966",
      "original_text": "Einreichung neuer Dokumente\nNordrhein-Westfalen Amtsgericht Köln HRB 90226\nDiok One AG – Köln",
      "type": "Einreichung neuer Dokumente",
      "state": "Nordrhein-Westfalen",
      "amtsgericht": "Amtsgericht Köln",
      "registernummer": "HRB 90226",
      "registerart": "HRB",
      "company_name": "Diok One AG",
      "company_seat": "Köln",
      "details": "20.01.2026 (Bekanntmachungsdatum)\n\nNordrhein-Westfalen Amtsgericht Köln HRB 90226\nEinreichung neuer Dokumente\n\nDiok One AG\nAktiengesellschaft\nKöln\n\nDem Registergericht ist eine Liste der Mitglieder des Aufsichtsrates eingereicht worden."
    },
    {
      "date": "2026-01-20",
      "id": "142967",
      "original_text": "Registerbekanntmachung nach dem Umwandlungsgesetz\nNordrhein-Westfalen Amtsgericht Paderborn HRB 10282\nBlumen Neumann GmbH – Lippstadt",
      "type": "Registerbekanntmachung nach dem Umwandlungsgesetz",
      "state": "Nordrhein-Westfalen",
      "amtsgericht": "Amtsgericht Paderborn",
      "registernummer": "HRB 10282",
      "registerart": "HRB",
      "company_name": "Blumen Neumann GmbH",
      "company_seat": "Lippstadt",
      "details": "20.01.2026 (Bekanntmachungsdatum)\n\nNordrhein-Westfalen Amtsgericht Paderborn HRB 10282\nRegisterbekanntmachung nach dem Umwandlungsgesetz 20.01.2026 (Eintragungsdatum)\n\nBlumen Neumann GmbH\nGesellschaft mit beschränkter Haftung\nLippstadt\n\nDen Gläubigern der an der Verschmelzung beteiligten Rechtsträger ist, wenn sie binnen sechs Monaten nach dem Tag, an dem die Eintragung der Verschmelzung in das Register des Sitzes desjenigen Rechtsträgers, dessen Gläubiger sie sind, nach § 19 Absatz 3 UmwG als bekanntgemacht gilt, ihren Anspruch nach Grund und Höhe schriftlich anmelden, Sicherheit zu leisten, soweit sie nicht Befriedigung verlangen können. Dieses Recht steht den Gläubigern jedoch nur zu, wenn sie glaubhaft machen, dass durch die Verschmelzung die Erfüllung ihrer Forderung gefährdet wird."
    },
    {
      "date": "2026-01-20",
      "id": "142968",
      "original_text": "Registerbekanntmachung nach dem Umwandlungsgesetz\nNordrhein-Westfalen Amtsgericht Münster HRB 20337\nLymphatica Verwaltungs GmbH – Münster",
      "type": "Registerbekanntmachung nach dem Umwandlungsgesetz",
      "state": "Nordrhein-Westfalen",
      "amtsgericht": "Amtsgericht Münster",
      "registernummer": "HRB 20337",
      "registerart": "HRB",
      "company_name": "Lymphatica Verwaltungs GmbH",
      "company_seat": "Münster",
      "details": "20.01.2026 (Bekanntmachungsdatum)\n\nNordrhein-Westfalen Amtsgericht Münster HRB 20337\nRegisterbekanntmachung nach dem Umwandlungsgesetz 20.01.2026 (Eintragungsdatum)\n\nLymphatica Verwaltungs GmbH\nGesellschaft mit beschränkter Haftung\nMünster\n\nDen Gläubigern der an der Verschmelzung beteiligten Rechtsträger ist, wenn sie binnen sechs Monaten nach dem Tag, an dem die Eintragung der Verschmelzung in das Register des Sitzes desjenigen Rechtsträgers, dessen Gläubiger sie sind, nach § 19 Absatz 3 UmwG als bekanntgemacht gilt, ihren Anspruch nach Grund und Höhe schriftlich anmelden, Sicherheit zu leisten, soweit sie nicht Befriedigung verlangen können. Dieses Recht steht den Gläubigern jedoch nur zu, wenn sie glaubhaft machen, dass durch die Verschmelzung die Erfüllung ihrer Forderung gefährdet wird."
    },
    {
      "date": "2026-01-20",
      "id": "142969",
      "original_text": "Registerbekanntmachung nach dem Umwandlungsgesetz\nNordrhein-Westfalen Amtsgericht Münster HRB 18714\nMUUV GmbH – Münster",
      "type": "Registerbekanntmachung nach dem Umwandlungsgesetz",
      "state": "Nordrhein-Westfalen",
      "amtsgericht": "Amtsgericht Münster",
      "registernummer": "HRB 18714",
      "registerart": "HRB",
      "company_name": "MUUV GmbH",
      "company_seat": "Münster",
      "details": "20.01.2026 (Bekanntmachungsdatum)\n\nNordrhein-Westfalen Amtsgericht Münster HRB 18714\nRegisterbekanntmachung nach dem Umwandlungsgesetz 20.01.2026 (Eintragungsdatum)\n\nMUUV GmbH\nGesellschaft mit beschränkter Haftung\nMünster\n\nDen Gläubigern der an der Verschmelzung beteiligten Rechtsträger ist, wenn sie binnen sechs Monaten nach dem Tag, an dem die Eintragung der Verschmelzung in das Register des Sitzes desjenigen Rechtsträgers, dessen Gläubiger sie sind, nach § 19 Absatz 3 UmwG als bekanntgemacht gilt, ihren Anspruch nach Grund und Höhe schriftlich anmelden, Sicherheit zu leisten, soweit sie nicht Befriedigung verlangen können. Dieses Recht steht den Gläubigern jedoch nur zu, wenn sie glaubhaft machen, dass durch die Verschmelzung die Erfüllung ihrer Forderung gefährdet wird."
    },
    {
      "date": "2026-01-20",
      "id": "142970",
      "original_text": "Löschungsankündigung\nNordrhein-Westfalen Amtsgericht Recklinghausen HRB 8631\nS.A.P. Construction GmbH – Recklinghausen",
      "type": "Löschungsankündigung",
      "state": "Nordrhein-Westfalen",
      "amtsgericht": "Amtsgericht Recklinghausen",
      "registernummer": "HRB 8631",
      "registerart": "HRB",
      "company_name": "S.A.P. Construction GmbH",
      "company_seat": "Recklinghausen",
      "details": "20.01.2026 (Bekanntmachungsdatum)\n\nNordrhein-Westfalen Amtsgericht Recklinghausen HRB 8631\nLöschungsankündigung\n\nS.A.P. Construction GmbH\nGesellschaft mit beschränkter Haftung\nRecklinghausen\n\nDas Registergericht beabsichtigt die Gesellschaft von Amts wegen nach § 394 FamFG zu löschen. Die Frist zur Erhebung eines Widerspruchs ist auf #DV.Fr(Text=\"Bitte wählen Sie die Widerspruchsfrist aus!\",Eingabe=\"einen Monat\",\"zwei Monate\",\"drei Monate\",\"#insert(Text=\"Freitext\")\"|\"freier Text\") festgesetzt."
    },
    {
      "date": "2026-01-20",
      "id": "142971",
      "original_text": "Löschungsankündigung\nNordrhein-Westfalen Amtsgericht Recklinghausen HRB 8631\nS.A.P. Construction GmbH – Recklinghausen",
      "type": "Löschungsankündigung",
      "state": "Nordrhein-Westfalen",
      "amtsgericht": "Amtsgericht Recklinghausen",
      "registernummer": "HRB 8631",
      "registerart": "HRB",
      "company_name": "S.A.P. Construction GmbH",
      "company_seat": "Recklinghausen",
      "details": "20.01.2026 (Bekanntmachungsdatum)\n\nNordrhein-Westfalen Amtsgericht Recklinghausen HRB 8631\nLöschungsankündigung\n\nS.A.P. Construction GmbH\nGesellschaft mit beschränkter Haftung\nRecklinghausen\n\nDas Registergericht beabsichtigt die Gesellschaft von Amts wegen nach § 394 FamFG zu löschen. Die Frist zur Erhebung eines Widerspruchs ist auf drei Monate festgesetzt."
    },
    {
      "date": "2026-01-20",
      "id": "142972",
      "original_text": "Löschungsankündigung\nNordrhein-Westfalen Amtsgericht Köln HRB 69319\nFPB Holdings GmbH – Köln",
      "type": "Löschungsankündigung",
      "state": "Nordrhein-Westfalen",
      "amtsgericht": "Amtsgericht Köln",
      "registernummer": "HRB 69319",
      "registerart": "HRB",
      "company_name": "FPB Holdings GmbH",
      "company_seat": "Köln",
      "details": "20.01.2026 (Bekanntmachungsdatum)\n\nNordrhein-Westfalen Amtsgericht Köln HRB 69319\nLöschungsankündigung\n\nFPB Holdings GmbH\nGesellschaft mit beschränkter Haftung\nKöln\n\nDas Registergericht beabsichtigt die Gesellschaft von Amts wegen nach § 394 FamFG zu löschen. Die Frist zur Erhebung eines Widerspruchs ist auf einen Monat festgesetzt."
    },
    {
      "date": "2026-01-20",
      "id": "142973",
      "original_text": "Registerbekanntmachung nach dem Umwandlungsgesetz\nNordrhein-Westfalen Amtsgericht Essen HRB 29664\nWestville 2 GmbH – Essen",
      "type": "Registerbekanntmachung nach dem Umwandlungsgesetz",
      "state": "Nordrhein-Westfalen",
      "amtsgericht": "Amtsgericht Essen",
      "registernummer": "HRB 29664",
      "registerart": "HRB",
      "company_name": "Westville 2 GmbH",
      "company_seat": "Essen",
      "details": "20.01.2026 (Bekanntmachungsdatum)\n\nNordrhein-Westfalen Amtsgericht Essen HRB 29664\nRegisterbekanntmachung nach dem Umwandlungsgesetz 20.01.2026 (Eintragungsdatum)\n\nWestville 2 GmbH\nGesellschaft mit beschränkter Haftung\nEssen\n\nDen Gläubigern der an der formwechselnden Umwandlung beteiligten Rechtsträger ist, wenn sie binnen sechs Monaten nach dem Tag, an dem die Eintragung der formwechselnden Umwandlung in das Register des Sitzes desjenigen Rechtsträgers, dessen Gläubiger sie sind, nach § 19 Absatz 3 UmwG als bekanntgemacht gilt, ihren Anspruch nach Grund und Höhe schriftlich anmelden, Sicherheit zu leisten, soweit sie nicht Befriedigung verlangen können. Dieses Recht steht den Gläubigern jedoch nur zu, wenn sie glaubhaft machen, dass durch die formwechselnden Umwandlung die Erfüllung ihrer Forderung gefährdet wird."
    },
    {
      "date": "2026-01-20",
      "id": "142974",
      "original_text": "Löschungsankündigung\nNordrhein-Westfalen Amtsgericht Köln HRB 84746\nBAU KAR GmbH – Köln",
      "type": "Löschungsankündigung",
      "state": "Nordrhein-Westfalen",
      "amtsgericht": "Amtsgericht Köln",
      "registernummer": "HRB 84746",
      "registerart": "HRB",
      "company_name": "BAU KAR GmbH",
      "company_seat": "Köln",
      "details": "20.01.2026 (Bekanntmachungsdatum)\n\nNordrhein-Westfalen Amtsgericht Köln HRB 84746\nLöschungsankündigung\n\nBAU KAR GmbH\nGesellschaft mit beschränkter Haftung\nKöln\n\nDas Registergericht beabsichtigt die Gesellschaft von Amts wegen nach § 394 FamFG zu löschen. Die Frist zur Erhebung eines Widerspruchs ist auf einen Monat festgesetzt."
    },
    {
      "date": "2026-01-20",
      "id": "142975",
      "original_text": "Löschungsankündigung\nNordrhein-Westfalen Amtsgericht Mönchengladbach HRB 21681\nANWARI GmbH – Niederkrüchten",
      "type": "Löschungsankündigung",
      "state": "Nordrhein-Westfalen",
      "amtsgericht": "Amtsgericht Mönchengladbach",
      "registernummer": "HRB 21681",
      "registerart": "HRB",
      "company_name": "ANWARI GmbH",
      "company_seat": "Niederkrüchten",
      "details": "20.01.2026 (Bekanntmachungsdatum)\n\nNordrhein-Westfalen Amtsgericht Mönchengladbach HRB 21681\nLöschungsankündigung\n\nANWARI GmbH\nGesellschaft mit beschränkter Haftung\nNiederkrüchten\n\nDas Registergericht beabsichtigt, die im Handelsregister eingetragene Gesellschaft\ngemäß § 394 Absatz 1 FamFG wegen Vermögenslosigkeit von Amts wegen zu löschen.\nGegen diese Verfügung kann Widerspruch eingelegt werden. Die Frist zur Erhebung\neines Widerspruchs gegen die beabsichtigte Löschung von Amts wegen ist auf zwei\nMonate festgesetzt"
    },
    {
      "date": "2026-01-20",
      "id": "142976",
      "original_text": "Registerbekanntmachung nach dem Umwandlungsgesetz\nNordrhein-Westfalen Amtsgericht Essen HRA 12053\nfranky PropCo 3 GmbH & Co. KG – Essen",
      "type": "Registerbekanntmachung nach dem Umwandlungsgesetz",
      "state": "Nordrhein-Westfalen",
      "amtsgericht": "Amtsgericht Essen",
      "registernummer": "HRA 12053",
      "registerart": "HRA",
      "company_name": "franky PropCo 3 GmbH & Co. KG",
      "company_seat": "Essen",
      "details": "20.01.2026 (Bekanntmachungsdatum)\n\nNordrhein-Westfalen Amtsgericht Essen HRA 12053\nRegisterbekanntmachung nach dem Umwandlungsgesetz 20.01.2026 (Eintragungsdatum)\n\nfranky PropCo 3 GmbH & Co. KG\nKommanditgesellschaft\nEssen\n\nDen Gläubigern der an der formwechselnden Umwandlung beteiligten Rechtsträger ist, wenn sie binnen sechs Monaten nach dem Tag, an dem die Eintragung der formwechselnden Umwandlung in das Register des Sitzes desjenigen Rechtsträgers, dessen Gläubiger sie sind, nach § 19 Absatz 3 UmwG als bekanntgemacht gilt, ihren Anspruch nach Grund und Höhe schriftlich anmelden, Sicherheit zu leisten, soweit sie nicht Befriedigung verlangen können. Dieses Recht steht den Gläubigern jedoch nur zu, wenn sie glaubhaft machen, dass durch die formwechselnden Umwandlung die Erfüllung ihrer Forderung gefährdet wird."
    },
    {
      "date": "2026-01-20",
      "id": "142977",
      "original_text": "Registerbekanntmachung nach dem Umwandlungsgesetz\nNordrhein-Westfalen Amtsgericht Hamm HRB 4718\nJohn Installations- und Heizungsbaugesellschaft mit beschränkter Haftung – Kamen",
      "type": "Registerbekanntmachung nach dem Umwandlungsgesetz",
      "state": "Nordrhein-Westfalen",
      "amtsgericht": "Amtsgericht Hamm",
      "registernummer": "HRB 4718",
      "registerart": "HRB",
      "company_name": "John Installations- und Heizungsbaugesellschaft mit beschränkter Haftung",
      "company_seat": "Kamen",
      "details": "20.01.2026 (Bekanntmachungsdatum)\n\nNordrhein-Westfalen Amtsgericht Hamm HRB 4718\nRegisterbekanntmachung nach dem Umwandlungsgesetz 20.01.2026 (Eintragungsdatum)\n\nJohn Installations- und Heizungsbaugesellschaft mit beschränkter Haftung\nGesellschaft mit beschränkter Haftung\nKamen\n\nDen Gläubigern der an der Verschmelzung beteiligten Rechtsträger ist, wenn sie binnen sechs Monaten nach dem Tag, an dem die Eintragung der Verschmelzung in das Register des Sitzes derjenigen Rechtsträger deren Gläubiger sie sind, nach § 19 Absatz 3 UmwG als bekanntgemacht gilt, ihren Anspruch nach Grund und Höhe schriftlich anmelden, Sicherheit zu leisten, soweit sie nicht Befriedigung verlangen können. Dieses Recht steht den Gläubigern jedoch nur zu, wenn sie glaubhaft machen, dass durch die Verschmelzung die Erfüllung ihrer Forderung gefährdet wird."
    },
    {
      "date": "2026-01-20",
      "id": "142978",
      "original_text": "Sonstige Registerbekanntmachung\nNordrhein-Westfalen Amtsgericht Aachen HRB 14113\nTZA am Europaplatz GmbH – Aachen",
      "type": "Sonstige Registerbekanntmachung",
      "state": "Nordrhein-Westfalen",
      "amtsgericht": "Amtsgericht Aachen",
      "registernummer": "HRB 14113",
      "registerart": "HRB",
      "company_name": "TZA am Europaplatz GmbH",
      "company_seat": "Aachen",
      "details": "20.01.2026 (Bekanntmachungsdatum)\n\nNordrhein-Westfalen Amtsgericht Aachen HRB 14113\nSonstige Registerbekanntmachung 20.01.2026 (Eintragungsdatum)\n\nTZA am Europaplatz GmbH\nGesellschaft mit beschränkter Haftung\nAachen\n\nAls nicht eingetragen wird veröffentlicht: Den Gläubigern der Gesellschaft, deren Forderungen begründet worden sind bevor die Eintragung der Beendigung des Beherrschungs- und Gewinnabführungsvertrages  in das Handelsregister nach § 10 des Handelsgesetzbuches als bekanntgemacht gilt, hat der andere Vertragsteil Sicherheit zu leisten, wenn sie sich binnen sechs Monaten nach der Bekanntmachung der Eintragung zu diesem Zweck bei ihm melden."
    },
    {
      "date": "2026-01-20",
      "id": "142979",
      "original_text": "Löschungsankündigung\nNordrhein-Westfalen Amtsgericht Siegburg HRB 17786\nAutotechnik Hennef GmbH – Hennef",
      "type": "Löschungsankündigung",
      "state": "Nordrhein-Westfalen",
      "amtsgericht": "Amtsgericht Siegburg",
      "registernummer": "HRB 17786",
      "registerart": "HRB",
      "company_name": "Autotechnik Hennef GmbH",
      "company_seat": "Hennef",
      "details": "20.01.2026 (Bekanntmachungsdatum)\n\nNordrhein-Westfalen Amtsgericht Siegburg HRB 17786\nLöschungsankündigung\n\nAutotechnik Hennef GmbH\nGesellschaft mit beschränkter Haftung\nHennef\n\nDas Registergericht hat glaubhafte Kenntnis erlangt, dass die Gesellschaft vermögenslos geworden ist. Es ist daher beabsichtigt, die Gesellschaft nach § 394 FamFG im Handelsregister wegen Vermögenslosigkeit zu löschen. Einwände gegen die Löschung sind durch Widerspruch binnen einer Frist von 3 Monaten geltend zu machen, andernfalls die Löschung erfolgen wird. Einzulegen ist der Widerspruch bei dem Amtsgericht Siegburg, Neue Poststraße 16, 53721 Siegburg, und zwar entweder schriftlich in deutscher Sprache oder mündlich zur Niederschrift der Geschäftsstelle. Der Widerspruch kann auch zur Niederschrift der Geschäftsstelle eines jeden Amtsgerichts abgegeben werden. Der Widerspruch ist binnen der in der Verfügung bestimmten Frist einzulegen. Die Frist ist nur gewahrt, wenn der Widerspruch rechtzeitig bei dem Amtsgericht Siegburg eingeht, auch wenn der Widerspruch zur Niederschrift der Geschäftsstelle eines anderen Amtsgerichts abgegeben wurde. Die Frist beginnt jeweils mit der schriftlichen Bekanntgabe der Verfügung an die Beteiligten.\nKann die schriftliche Bekanntgabe an einen Beteiligten nicht bewirkt werden, beginnt die Frist spätestens mit Ablauf von fünf Monaten nach Erlass der Verfügung. Die Bekanntgabe ist entweder durch Zustellung oder am dritten Tage nach Aufgabe zur Post bewirkt. Sofern die Löschung noch nicht erfolgt ist, kann der Widerspruch auch noch nach Ablauf der Frist eingelegt werden. Fällt das Ende der Frist auf einen Sonnabend, einen Sonntag oder einen allgemeinen Feiertag, endet die Frist mit Ablauf des nächsten Werktages. Der Widerspruch ist zu unterzeichnen. Eine Begründung des Widerspruchs ist nicht vorgeschrieben."
    },
    {
      "date": "2026-01-20",
      "id": "142980",
      "original_text": "Löschungsankündigung\nNordrhein-Westfalen Amtsgericht Siegburg HRB 15261\nITLK GmbH – Troisdorf",
      "type": "Löschungsankündigung",
      "state": "Nordrhein-Westfalen",
      "amtsgericht": "Amtsgericht Siegburg",
      "registernummer": "HRB 15261",
      "registerart": "HRB",
      "company_name": "ITLK GmbH",
      "company_seat": "Troisdorf",
      "details": "20.01.2026 (Bekanntmachungsdatum)\n\nNordrhein-Westfalen Amtsgericht Siegburg HRB 15261\nLöschungsankündigung\n\nITLK GmbH\nGesellschaft mit beschränkter Haftung\nTroisdorf\n\nDas Registergericht hat glaubhafte Kenntnis erlangt, dass die Gesellschaft vermögenslos geworden ist, da ein Insolvenzeröffnungsantrag mangels Masse nach § 26 InsO zurückgewiesen wurde. Es ist daher beabsichtigt, die Gesellschaft nach § 394 FamFG im Handelsregister wegen Vermögenslosigkeit zu löschen. Einwände gegen die Löschung sind durch Widerspruch binnen einer Frist von 3 Monaten geltend zu machen, andernfalls die Löschung erfolgen wird. Einzulegen ist der Widerspruch bei dem Amtsgericht Siegburg, Neue Poststraße 16, 53721 Siegburg, und zwar entweder schriftlich in deutscher Sprache oder mündlich zur Niederschrift der Geschäftsstelle. Der Widerspruch kann auch zur Niederschrift der Geschäftsstelle eines jeden Amtsgerichts abgegeben werden. Der Widerspruch ist binnen der in der Verfügung bestimmten Frist einzulegen. Die Frist ist nur gewahrt, wenn der Widerspruch rechtzeitig bei dem Amtsgericht Siegburg eingeht, auch wenn der Widerspruch zur Niederschrift der Geschäftsstelle eines anderen Amtsgerichts abgegeben wurde. Die Frist beginnt jeweils mit der schriftlichen Bekanntgabe der Verfügung an die Beteiligten.\nKann die schriftliche Bekanntgabe an einen Beteiligten nicht bewirkt werden, beginnt die Frist spätestens mit Ablauf von fünf Monaten nach Erlass der Verfügung. Die Bekanntgabe ist entweder durch Zustellung oder am dritten Tage nach Aufgabe zur Post bewirkt. Sofern die Löschung noch nicht erfolgt ist, kann der Widerspruch auch noch nach Ablauf der Frist eingelegt werden. Fällt das Ende der Frist auf einen Sonnabend, einen Sonntag oder einen allgemeinen Feiertag, endet die Frist mit Ablauf des nächsten Werktages. Der Widerspruch ist zu unterzeichnen. Eine Begründung des Widerspruchs ist nicht vorgeschrieben."
    },
    {
      "date": "2026-01-20",
      "id": "142981",
      "original_text": "Löschungsankündigung\nHessen Amtsgericht Frankfurt am Main HRB 56084\nBONUS - Bau und Bauorganisation GmbH – Frankfurt am Main",
      "type": "Löschungsankündigung",
      "state": "Hessen",
      "amtsgericht": "Amtsgericht Frankfurt am Main",
      "registernummer": "HRB 56084",
      "registerart": "HRB",
      "company_name": "BONUS - Bau und Bauorganisation GmbH",
      "company_seat": "Frankfurt am Main",
      "details": "20.01.2026 (Bekanntmachungsdatum)\n\nHessen Amtsgericht Frankfurt am Main HRB 56084\nLöschungsankündigung\n\nBONUS - Bau und Bauorganisation GmbH\nGesellschaft mit beschränkter Haftung\nFrankfurt am Main\n\nEs ist beabsichtigt, die Gesellschaft wegen Vermögenslosigkeit gemäß § 394 FamFG von Amts wegen im Handelsregister zu löschen. Hiergegen kann innerhalb eines Monats nach dieser Veröffentlichung Widerspruch bei dem Amtsgericht Frankfurt am Main eingelegt werden."
    },
    {
      "date": "2026-01-20",
      "id": "142982",
      "original_text": "Sonstige Registerbekanntmachung\nHessen Amtsgericht Fritzlar VR 3221\nNaturschutzbund Unteres Edertal, Mitglied im Naturschutzbund Deutschland, Kreisverband Schwalm-Eder e. V. – Felsberg",
      "type": "Sonstige Registerbekanntmachung",
      "state": "Hessen",
      "amtsgericht": "Amtsgericht Fritzlar",
      "registernummer": "VR 3221",
      "registerart": "VR",
      "company_name": "Naturschutzbund Unteres Edertal, Mitglied im Naturschutzbund Deutschland, Kreisverband Schwalm-Eder e. V.",
      "company_seat": "Felsberg",
      "details": "20.01.2026 (Bekanntmachungsdatum)\n\nHessen Amtsgericht Fritzlar VR 3221\nSonstige Registerbekanntmachung 20.01.2026 (Eintragungsdatum)\n\nNaturschutzbund Unteres Edertal, Mitglied im Naturschutzbund Deutschland, Kreisverband Schwalm-Eder e. V.\neingetragener Verein\nFelsberg\n\nDer Verein ist aufgelöst."
    },
    {
      "date": "2026-01-20",
      "id": "142983",
      "original_text": "Einreichung neuer Dokumente\nHessen Amtsgericht Frankfurt am Main HRB 94514\nNATIXIS Pfandbriefbank AG – Frankfurt am Main",
      "type": "Einreichung neuer Dokumente",
      "state": "Hessen",
      "amtsgericht": "Amtsgericht Frankfurt am Main",
      "registernummer": "HRB 94514",
      "registerart": "HRB",
      "company_name": "NATIXIS Pfandbriefbank AG",
      "company_seat": "Frankfurt am Main",
      "details": "20.01.2026 (Bekanntmachungsdatum)\n\nHessen Amtsgericht Frankfurt am Main HRB 94514\nEinreichung neuer Dokumente\n\nNATIXIS Pfandbriefbank AG\nAktiengesellschaft\nFrankfurt am Main\n\nDurch eine Änderung in den Personen der Aufsichtsratsmitglieder ist eine Liste der Mitglieder des Aufsichtsrates zum Handelsregister eingereicht worden."
    },
    {
      "date": "2026-01-20",
      "id": "142984",
      "original_text": "Registerbekanntmachung nach dem Umwandlungsgesetz\nHessen Amtsgericht Frankfurt am Main HRB 124626\nfinone Holding GmbH – Frankfurt am Main",
      "type": "Registerbekanntmachung nach dem Umwandlungsgesetz",
      "state": "Hessen",
      "amtsgericht": "Amtsgericht Frankfurt am Main",
      "registernummer": "HRB 124626",
      "registerart": "HRB",
      "company_name": "finone Holding GmbH",
      "company_seat": "Frankfurt am Main",
      "details": "20.01.2026 (Bekanntmachungsdatum)\n\nHessen Amtsgericht Frankfurt am Main HRB 124626\nRegisterbekanntmachung nach dem Umwandlungsgesetz 20.01.2026 (Eintragungsdatum)\n\nfinone Holding GmbH\nGesellschaft mit beschränkter Haftung\nFrankfurt am Main\n\nDen Gläubigern der an der Verschmelzung beteiligten Rechtsträger ist, wenn sie binnen sechs Monaten nach dem Tag, an dem die Eintragung der Verschmelzung in das Register des Sitzes derjenigen Rechtsträger deren Gläubiger sie sind, nach § 19 Absatz 3 UmwG bekannt gemacht worden ist, ihren Anspruch nach Grund und Höhe schriftlich anmelden, Sicherheit zu leisten, soweit sie nicht Befriedigung verlangen können. Dieses Recht steht den Gläubigern jedoch nur zu, wenn sie glaubhaft machen, dass durch die Verschmelzung die Erfüllung ihrer Forderung gefährdet wird."
    },
    {
      "date": "2026-01-20",
      "id": "142985",
      "original_text": "Registerbekanntmachung nach dem Umwandlungsgesetz\nHessen Amtsgericht Frankfurt am Main HRB 114037\nfinone GmbH – Frankfurt am Main",
      "type": "Registerbekanntmachung nach dem Umwandlungsgesetz",
      "state": "Hessen",
      "amtsgericht": "Amtsgericht Frankfurt am Main",
      "registernummer": "HRB 114037",
      "registerart": "HRB",
      "company_name": "finone GmbH",
      "company_seat": "Frankfurt am Main",
      "details": "20.01.2026 (Bekanntmachungsdatum)\n\nHessen Amtsgericht Frankfurt am Main HRB 114037\nRegisterbekanntmachung nach dem Umwandlungsgesetz 20.01.2026 (Eintragungsdatum)\n\nfinone GmbH\nGesellschaft mit beschränkter Haftung\nFrankfurt am Main\n\nDen Gläubigern der an der Verschmelzung beteiligten Rechtsträger ist, wenn sie binnen sechs Monaten nach dem Tag, an dem die Eintragung der Verschmelzung in das Register des Sitzes derjenigen Rechtsträger deren Gläubiger sie sind, nach § 19 Absatz 3 UmwG bekannt gemacht worden ist, ihren Anspruch nach Grund und Höhe schriftlich anmelden, Sicherheit zu leisten, soweit sie nicht Befriedigung verlangen können. Dieses Recht steht den Gläubigern jedoch nur zu, wenn sie glaubhaft machen, dass durch die Verschmelzung die Erfüllung ihrer Forderung gefährdet wird."
    },
    {
      "date": "2026-01-20",
      "id": "142986",
      "original_text": "Löschungsankündigung\nHessen Amtsgericht Wiesbaden HRA 6980\nKlaus und Manfred Moos Spedition – Waldems",
      "type": "Löschungsankündigung",
      "state": "Hessen",
      "amtsgericht": "Amtsgericht Wiesbaden",
      "registernummer": "HRA 6980",
      "registerart": "HRA",
      "company_name": "Klaus und Manfred Moos Spedition",
      "company_seat": "Waldems",
      "details": "20.01.2026 (Bekanntmachungsdatum)\n\nHessen Amtsgericht Wiesbaden HRA 6980\nLöschungsankündigung\n\nKlaus und Manfred Moos Spedition\nOffene Handelsgesellschaft\nWaldems\n\nDas Registergericht beabsichtigt die im Handelsregister eingetragene Firma von Amts wegen nach §6 und 31 Abs. 2 HGB zu löschen. Die Frist zur Erhebung eines Widerspruchs gegen die beabsichtigte Löschung wird auf 2 Monate festgesetzt."
    },
    {
      "date": "2026-01-20",
      "id": "142987",
      "original_text": "Löschungsankündigung\nHessen Amtsgericht Frankfurt am Main HRB 128029\nUname GVE GmbH – Frankfurt am Main",
      "type": "Löschungsankündigung",
      "state": "Hessen",
      "amtsgericht": "Amtsgericht Frankfurt am Main",
      "registernummer": "HRB 128029",
      "registerart": "HRB",
      "company_name": "Uname GVE GmbH",
      "company_seat": "Frankfurt am Main",
      "details": "20.01.2026 (Bekanntmachungsdatum)\n\nHessen Amtsgericht Frankfurt am Main HRB 128029\nLöschungsankündigung\n\nUname GVE GmbH\nGesellschaft mit beschränkter Haftung\nFrankfurt am Main\n\nEs ist beabsichtigt die Gesellschaft wegen Vermögenslosigkeit gemäß § 394 FamFG von Amts wegen zu löschen. Hiergegen kann innerhalb eines Monats nach dieser Veröffentlichung Widerspruch bei dem Amtsgericht Frankfurt am Main eingelegt werden."
    },
    {
      "date": "2026-01-20",
      "id": "142988",
      "original_text": "Registerbekanntmachung nach dem Umwandlungsgesetz\nHessen Amtsgericht Gießen VR 1825\nFörderverein Musikzug der Freiwilligen Feuerwehr der Stadt Staufenberg e.V. – Staufenberg",
      "type": "Registerbekanntmachung nach dem Umwandlungsgesetz",
      "state": "Hessen",
      "amtsgericht": "Amtsgericht Gießen",
      "registernummer": "VR 1825",
      "registerart": "VR",
      "company_name": "Förderverein Musikzug der Freiwilligen Feuerwehr der Stadt Staufenberg e.V.",
      "company_seat": "Staufenberg",
      "details": "20.01.2026 (Bekanntmachungsdatum)\n\nHessen Amtsgericht Gießen VR 1825\nRegisterbekanntmachung nach dem Umwandlungsgesetz 20.01.2026 (Eintragungsdatum)\n\nFörderverein Musikzug der Freiwilligen Feuerwehr der Stadt Staufenberg e.V.\neingetragener Verein\nStaufenberg\n\nDen Gläubigern der an der Verschmelzung beteiligten Rechtsträger ist, wenn sie binnen sechs Monaten nach dem Tag, an dem die Eintragung der Verschmelzung in das Register des Sitzes desjenigen Rechtsträgers, dessen Gläubiger sie sind, nach § 19 Absatz 3 UmwG bekannt gemacht worden ist, ihren Anspruch nach Grund und Höhe schriftlich anmelden, Sicherheit zu leisten, soweit sie nicht Befriedigung verlangen können. Dieses Recht steht den Gläubigern jedoch nur zu, wenn sie glaubhaft machen, dass durch die Verschmelzung die Erfüllung ihrer Forderung gefährdet wird."
    },
    {
      "date": "2026-01-20",
      "id": "142989",
      "original_text": "Registerbekanntmachung nach dem Umwandlungsgesetz\nHessen Amtsgericht Frankfurt am Main HRB 93646\nRL Intellectual Ventures GmbH – Frankfurt am Main",
      "type": "Registerbekanntmachung nach dem Umwandlungsgesetz",
      "state": "Hessen",
      "amtsgericht": "Amtsgericht Frankfurt am Main",
      "registernummer": "HRB 93646",
      "registerart": "HRB",
      "company_name": "RL Intellectual Ventures GmbH",
      "company_seat": "Frankfurt am Main",
      "details": "20.01.2026 (Bekanntmachungsdatum)\n\nHessen Amtsgericht Frankfurt am Main HRB 93646\nRegisterbekanntmachung nach dem Umwandlungsgesetz 20.01.2026 (Eintragungsdatum)\n\nRL Intellectual Ventures GmbH\nGesellschaft mit beschränkter Haftung\nFrankfurt am Main\n\nDen Gläubigern der an der Verschmelzung beteiligten Rechtsträger ist, wenn sie binnen sechs Monaten nach dem Tag, an dem die Eintragung der Verschmelzung in das Register des Sitzes derjenigen Rechtsträger deren Gläubiger sie sind, nach § 19 Absatz 3 UmwG bekannt gemacht worden ist, ihren Anspruch nach Grund und Höhe schriftlich anmelden, Sicherheit zu leisten, soweit sie nicht Befriedigung verlangen können. Dieses Recht steht den Gläubigern jedoch nur zu, wenn sie glaubhaft machen, dass durch die Verschmelzung die Erfüllung ihrer Forderung gefährdet wird."
    },
    {
      "date": "2026-01-20",
      "id": "142990",
      "original_text": "Registerbekanntmachung nach dem Umwandlungsgesetz\nHessen Amtsgericht Frankfurt am Main HRB 138050\nTripleX HoldCo GmbH – Frankfurt am Main",
      "type": "Registerbekanntmachung nach dem Umwandlungsgesetz",
      "state": "Hessen",
      "amtsgericht": "Amtsgericht Frankfurt am Main",
      "registernummer": "HRB 138050",
      "registerart": "HRB",
      "company_name": "TripleX HoldCo GmbH",
      "company_seat": "Frankfurt am Main",
      "details": "20.01.2026 (Bekanntmachungsdatum)\n\nHessen Amtsgericht Frankfurt am Main HRB 138050\nRegisterbekanntmachung nach dem Umwandlungsgesetz 20.01.2026 (Eintragungsdatum)\n\nTripleX HoldCo GmbH\nGesellschaft mit beschränkter Haftung\nFrankfurt am Main\n\nDen Gläubigern der an der Verschmelzung beteiligten Rechtsträger ist, wenn sie binnen sechs Monaten nach dem Tag, an dem die Eintragung der Verschmelzung in das Register des Sitzes derjenigen Rechtsträger deren Gläubiger sie sind, nach § 19 Absatz 3 UmwG bekannt gemacht worden ist, ihren Anspruch nach Grund und Höhe schriftlich anmelden, Sicherheit zu leisten, soweit sie nicht Befriedigung verlangen können. Dieses Recht steht den Gläubigern jedoch nur zu, wenn sie glaubhaft machen, dass durch die Verschmelzung die Erfüllung ihrer Forderung gefährdet wird."
    },
    {
      "date": "2026-01-20",
      "id": "142991",
      "original_text": "Registerbekanntmachung nach dem Umwandlungsgesetz\nHessen Amtsgericht Frankfurt am Main HRB 106195\nNL Kinderklub Westend GmbH – Frankfurt am Main",
      "type": "Registerbekanntmachung nach dem Umwandlungsgesetz",
      "state": "Hessen",
      "amtsgericht": "Amtsgericht Frankfurt am Main",
      "registernummer": "HRB 106195",
      "registerart": "HRB",
      "company_name": "NL Kinderklub Westend GmbH",
      "company_seat": "Frankfurt am Main",
      "details": "20.01.2026 (Bekanntmachungsdatum)\n\nHessen Amtsgericht Frankfurt am Main HRB 106195\nRegisterbekanntmachung nach dem Umwandlungsgesetz 20.01.2026 (Eintragungsdatum)\n\nNL Kinderklub Westend GmbH\nGesellschaft mit beschränkter Haftung\nFrankfurt am Main\n\nDen Gläubigern der an der Verschmelzung beteiligten Rechtsträger ist, wenn sie binnen sechs Monaten nach dem Tag, an dem die Eintragung der Verschmelzung in das Register des Sitzes derjenigen Rechtsträger deren Gläubiger sie sind, nach § 19 Absatz 3 UmwG bekannt gemacht worden ist, ihren Anspruch nach Grund und Höhe schriftlich anmelden, Sicherheit zu leisten, soweit sie nicht Befriedigung verlangen können. Dieses Recht steht den Gläubigern jedoch nur zu, wenn sie glaubhaft machen, dass durch die Verschmelzung die Erfüllung ihrer Forderung gefährdet wird."
    },
    {
      "date": "2026-01-20",
      "id": "142992",
      "original_text": "Sonstige Registerbekanntmachung\nHessen Amtsgericht Eschwege VR 1242\nLiedertafel 1834 – Witzenhausen",
      "type": "Sonstige Registerbekanntmachung",
      "state": "Hessen",
      "amtsgericht": "Amtsgericht Eschwege",
      "registernummer": "VR 1242",
      "registerart": "VR",
      "company_name": "Liedertafel 1834",
      "company_seat": "Witzenhausen",
      "details": "20.01.2026 (Bekanntmachungsdatum)\n\nHessen Amtsgericht Eschwege VR 1242\nSonstige Registerbekanntmachung 20.01.2026 (Eintragungsdatum)\n\nLiedertafel 1834\neingetragener Verein\nWitzenhausen\n\nDer Verein ist aufgelöst."
    },
    {
      "date": "2026-01-20",
      "id": "142993",
      "original_text": "Registerbekanntmachung nach dem Umwandlungsgesetz\nHessen Amtsgericht Gießen VR 1776\nFörderverein des Jugendblasorchesters der Freiwilligen Feuerwehr Lollar e.V. – Lollar",
      "type": "Registerbekanntmachung nach dem Umwandlungsgesetz",
      "state": "Hessen",
      "amtsgericht": "Amtsgericht Gießen",
      "registernummer": "VR 1776",
      "registerart": "VR",
      "company_name": "Förderverein des Jugendblasorchesters der Freiwilligen Feuerwehr Lollar e.V.",
      "company_seat": "Lollar",
      "details": "20.01.2026 (Bekanntmachungsdatum)\n\nHessen Amtsgericht Gießen VR 1776\nRegisterbekanntmachung nach dem Umwandlungsgesetz 20.01.2026 (Eintragungsdatum)\n\nFörderverein des Jugendblasorchesters der Freiwilligen Feuerwehr Lollar e.V.\neingetragener Verein\nLollar\n\nDen Gläubigern der an der Verschmelzung beteiligten Rechtsträger ist, wenn sie binnen sechs Monaten nach dem Tag, an dem die Eintragung der Verschmelzung in das Register des Sitzes desjenigen Rechtsträgers, dessen Gläubiger sie sind, nach § 19 Absatz 3 UmwG bekannt gemacht worden ist, ihren Anspruch nach Grund und Höhe schriftlich anmelden, Sicherheit zu leisten, soweit sie nicht Befriedigung verlangen können. Dieses Recht steht den Gläubigern jedoch nur zu, wenn sie glaubhaft machen, dass durch die Verschmelzung die Erfüllung ihrer Forderung gefährdet wird."
    },
    {
      "date": "2026-01-20",
      "id": "142994",
      "original_text": "Einreichung neuer Dokumente\nHessen Amtsgericht Frankfurt am Main HRB 40464\nStadtwerke Frankfurt am Main Holding GmbH – Frankfurt am Main",
      "type": "Einreichung neuer Dokumente",
      "state": "Hessen",
      "amtsgericht": "Amtsgericht Frankfurt am Main",
      "registernummer": "HRB 40464",
      "registerart": "HRB",
      "company_name": "Stadtwerke Frankfurt am Main Holding GmbH",
      "company_seat": "Frankfurt am Main",
      "details": "20.01.2026 (Bekanntmachungsdatum)\n\nHessen Amtsgericht Frankfurt am Main HRB 40464\nEinreichung neuer Dokumente 20.01.2026 (Eintragungsdatum)\n\nStadtwerke Frankfurt am Main Holding GmbH\nGesellschaft mit beschränkter Haftung\nFrankfurt am Main\n\nDurch eine Änderung in den Personen der Aufsichtsratsmitglieder ist eine Liste der Mitglieder des Aufsichtsrates zum Handelsregister eingereicht worden."
    },
    {
      "date": "2026-01-20",
      "id": "142995",
      "original_text": "Einreichung neuer Dokumente\nHessen Amtsgericht Offenbach am Main HRB 50793\nRigaku Europe SE – Neu-Isenburg",
      "type": "Einreichung neuer Dokumente",
      "state": "Hessen",
      "amtsgericht": "Amtsgericht Offenbach am Main",
      "registernummer": "HRB 50793",
      "registerart": "HRB",
      "company_name": "Rigaku Europe SE",
      "company_seat": "Neu-Isenburg",
      "details": "20.01.2026 (Bekanntmachungsdatum)\n\nHessen Amtsgericht Offenbach am Main HRB 50793\nEinreichung neuer Dokumente\n\nRigaku Europe SE\nEuropäische Aktiengesellschaft (SE)\nNeu-Isenburg\n\nDurch eine Änderung in den Personen der Aufsichtsratsmitglieder ist eine Liste der Mitglieder des Aufsichtsrates zum Handelsregister eingereicht worden."
    },
    {
      "date": "2026-01-20",
      "id": "142996",
      "original_text": "Sonstige Registerbekanntmachung\nHessen Amtsgericht Darmstadt VR 83803\nASYL Alsbach-Hähnlein e.V. – Alsbach-Hähnlein",
      "type": "Sonstige Registerbekanntmachung",
      "state": "Hessen",
      "amtsgericht": "Amtsgericht Darmstadt",
      "registernummer": "VR 83803",
      "registerart": "VR",
      "company_name": "ASYL Alsbach-Hähnlein e.V.",
      "company_seat": "Alsbach-Hähnlein",
      "details": "20.01.2026 (Bekanntmachungsdatum)\n\nHessen Amtsgericht Darmstadt VR 83803\nSonstige Registerbekanntmachung 20.01.2026 (Eintragungsdatum)\n\nASYL Alsbach-Hähnlein e.V.\neingetragener Verein\nAlsbach-Hähnlein\n\nDer Verein ist aufgelöst."
    }
  ]
}