{
  "date": "2026-01-03",
  "date_of_scrape": "2026-01-04T04:24:10.931Z",
  "tool_version": "0.2.0",
  "number_of_announcements": 12,
  "announcements": [
    {
      "date": "2026-01-03",
      "id": "141419",
      "original_text": "Registerbekanntmachung nach dem Umwandlungsgesetz\nBayern Amtsgericht München HRB 307161\nSMK Invest GmbH – München",
      "type": "Registerbekanntmachung nach dem Umwandlungsgesetz",
      "state": "Bayern",
      "amtsgericht": "Amtsgericht München",
      "registernummer": "HRB 307161",
      "registerart": "HRB",
      "company_name": "SMK Invest GmbH",
      "company_seat": "München",
      "details": "03.01.2026 (Bekanntmachungsdatum)\n\nBayern Amtsgericht München HRB 307161\nRegisterbekanntmachung nach dem Umwandlungsgesetz 02.01.2026 (Eintragungsdatum)\n\nSMK Invest GmbH\nGesellschaft mit beschränkter Haftung\nMünchen\n\nDen Gläubigern der an der Spaltung beteiligten Rechtsträger ist, wenn sie binnen sechs Monaten nach dem Tag, an dem die Eintragung der Spaltung in das Register des Sitzes desjenigen Rechtsträgers, dessen Gläubiger sie sind, nach §§ 125, 19 Abs. 3 UmwG als bekannt gemacht gilt, ihren Anspruch nach Grund und Höhe in Textform anmelden, Sicherheit zu leisten, soweit sie nicht Befriedigung verlangen können. Dieses Recht steht den Gläubigern jedoch nur zu, wenn sie glaubhaft machen, dass durch die Spaltung die Erfüllung ihrer Forderung gefährdet wird."
    },
    {
      "date": "2026-01-03",
      "id": "141420",
      "original_text": "Sonstige Registerbekanntmachung\nBayern Amtsgericht München HRB 237594\nCyoss GmbH – München",
      "type": "Sonstige Registerbekanntmachung",
      "state": "Bayern",
      "amtsgericht": "Amtsgericht München",
      "registernummer": "HRB 237594",
      "registerart": "HRB",
      "company_name": "Cyoss GmbH",
      "company_seat": "München",
      "details": "03.01.2026 (Bekanntmachungsdatum)\n\nBayern Amtsgericht München HRB 237594\nSonstige Registerbekanntmachung 02.01.2026 (Eintragungsdatum)\n\nCyoss GmbH\nGesellschaft mit beschränkter Haftung\nMünchen\n\nDen Gläubigern der Gesellschaft, deren Forderungen begründet worden sind, bevor die Eintragung der Beendigung des Gewinnabführungsvertrages in das Handelsregister nach § 10 des Handelsgesetzbuches als bekanntgemacht gilt, hat der andere Vertragsteil Sicherheit zu leisten, wenn sie sich binnen sechs Monaten nach der Bekanntmachung der Eintragung zu diesem Zweck bei ihm melden."
    },
    {
      "date": "2026-01-03",
      "id": "141421",
      "original_text": "Registerbekanntmachung nach dem Umwandlungsgesetz\nBayern Amtsgericht München HRB 220210\nHalbherr Ayurveda UG (haftungsbeschränkt) – München",
      "type": "Registerbekanntmachung nach dem Umwandlungsgesetz",
      "state": "Bayern",
      "amtsgericht": "Amtsgericht München",
      "registernummer": "HRB 220210",
      "registerart": "HRB",
      "company_name": "Halbherr Ayurveda UG (haftungsbeschränkt)",
      "company_seat": "München",
      "details": "03.01.2026 (Bekanntmachungsdatum)\n\nBayern Amtsgericht München HRB 220210\nRegisterbekanntmachung nach dem Umwandlungsgesetz 02.01.2026 (Eintragungsdatum)\n\nHalbherr Ayurveda UG (haftungsbeschränkt)\nGesellschaft mit beschränkter Haftung\nMünchen\n\nDen Gläubigern der an der Verschmelzung beteiligten Rechtsträger ist, wenn sie binnen sechs Monaten nach dem Tag, an dem die Eintragung der Verschmelzung in das Register des Sitzes desjenigen Rechtsträgers, dessen Gläubiger sie sind, nach § 19 Abs. 3 UmwG als bekannt gemacht gilt, ihren Anspruch nach Grund und Höhe in Textform anmelden, Sicherheit zu leisten, soweit sie nicht Befriedigung verlangen können. Dieses Recht steht den Gläubigern jedoch nur zu, wenn sie glaubhaft machen, dass durch die Verschmelzung die Erfüllung ihrer Forderung gefährdet wird."
    },
    {
      "date": "2026-01-03",
      "id": "141422",
      "original_text": "Registerbekanntmachung nach dem Umwandlungsgesetz\nBayern Amtsgericht Würzburg HRB 13088\nTeewicht AG – Veitshöchheim",
      "type": "Registerbekanntmachung nach dem Umwandlungsgesetz",
      "state": "Bayern",
      "amtsgericht": "Amtsgericht Würzburg",
      "registernummer": "HRB 13088",
      "registerart": "HRB",
      "company_name": "Teewicht AG",
      "company_seat": "Veitshöchheim",
      "details": "03.01.2026 (Bekanntmachungsdatum)\n\nBayern Amtsgericht Würzburg HRB 13088\nRegisterbekanntmachung nach dem Umwandlungsgesetz 02.01.2026 (Eintragungsdatum)\n\nTeewicht AG\nAktiengesellschaft\nVeitshöchheim\n\nDen Gläubigern des formwechselnden Rechtsträgers ist, wenn sie binnen sechs Monaten nach dem Tag, an dem die Eintragung des Formwechsels nach § 201 UmwG als bekannt gemacht gilt, ihren Anspruch nach Grund und Höhe in Textform anmelden, Sicherheit zu leisten, soweit sie nicht Befriedigung verlangen können. Dieses Recht steht den Gläubigern jedoch nur zu, wenn sie glaubhaft machen, dass durch den Formwechsel die Erfüllung ihrer Forderung gefährdet wird."
    },
    {
      "date": "2026-01-03",
      "id": "141423",
      "original_text": "Einreichung neuer Dokumente\nBayern Amtsgericht Ingolstadt HRB 80\nSolenhofer Aktien-Verein – Altendorf",
      "type": "Einreichung neuer Dokumente",
      "state": "Bayern",
      "amtsgericht": "Amtsgericht Ingolstadt",
      "registernummer": "HRB 80",
      "registerart": "HRB",
      "company_name": "Solenhofer Aktien-Verein",
      "company_seat": "Altendorf",
      "details": "03.01.2026 (Bekanntmachungsdatum)\n\nBayern Amtsgericht Ingolstadt HRB 80\nEinreichung neuer Dokumente\n\nSolenhofer Aktien-Verein\nAktiengesellschaft\nAltendorf\n\nDem Amtsgericht Ingolstadt -Registergericht- ist eine Liste der Mitglieder des Aufsichtsrats eingereicht worden, § 106 AktG."
    },
    {
      "date": "2026-01-03",
      "id": "141424",
      "original_text": "Registerbekanntmachung nach dem Umwandlungsgesetz\nBayern Amtsgericht München HRB 282343\nCeleko GmbH – Grasbrunn",
      "type": "Registerbekanntmachung nach dem Umwandlungsgesetz",
      "state": "Bayern",
      "amtsgericht": "Amtsgericht München",
      "registernummer": "HRB 282343",
      "registerart": "HRB",
      "company_name": "Celeko GmbH",
      "company_seat": "Grasbrunn",
      "details": "03.01.2026 (Bekanntmachungsdatum)\n\nBayern Amtsgericht München HRB 282343\nRegisterbekanntmachung nach dem Umwandlungsgesetz 02.01.2026 (Eintragungsdatum)\n\nCeleko GmbH\nGesellschaft mit beschränkter Haftung\nGrasbrunn\n\nDen Gläubigern der an der Ausgliederung beteiligten Rechtsträger ist, wenn sie binnen sechs Monaten nach dem Tag, an dem die Eintragung der Ausgliederung in das Register des Sitzes desjenigen Rechtsträgers, dessen Gläubiger sie sind, nach §§ 125, 19 Abs. 3 UmwG als bekannt gemacht gilt, ihren Anspruch nach Grund und Höhe in Textform anmelden, Sicherheit zu leisten, soweit sie nicht Befriedigung verlangen können. Dieses Recht steht den Gläubigern jedoch nur zu, wenn sie glaubhaft machen, dass durch die Ausgliederung die Erfüllung ihrer Forderung gefährdet wird."
    },
    {
      "date": "2026-01-03",
      "id": "141425",
      "original_text": "Einreichung neuer Dokumente\nBayern Amtsgericht Ingolstadt HRB 3231\nStadtwerke Ingolstadt Beteiligungen GmbH – Ingolstadt",
      "type": "Einreichung neuer Dokumente",
      "state": "Bayern",
      "amtsgericht": "Amtsgericht Ingolstadt",
      "registernummer": "HRB 3231",
      "registerart": "HRB",
      "company_name": "Stadtwerke Ingolstadt Beteiligungen GmbH",
      "company_seat": "Ingolstadt",
      "details": "03.01.2026 (Bekanntmachungsdatum)\n\nBayern Amtsgericht Ingolstadt HRB 3231\nEinreichung neuer Dokumente\n\nStadtwerke Ingolstadt Beteiligungen GmbH\nGesellschaft mit beschränkter Haftung\nIngolstadt\n\nDem Amtsgericht Ingolstadt -Registergericht- ist eine Liste der Mitglieder des Aufsichtsrats eingereicht worden, § 52 Abs. 3 S. 2 GmbHG."
    },
    {
      "date": "2026-01-03",
      "id": "141426",
      "original_text": "Sonstige Registerbekanntmachung\nBayern Amtsgericht Landshut HRB 5289\nWohanka, Obermaier & Kollegen GmbH – Ergolding",
      "type": "Sonstige Registerbekanntmachung",
      "state": "Bayern",
      "amtsgericht": "Amtsgericht Landshut",
      "registernummer": "HRB 5289",
      "registerart": "HRB",
      "company_name": "Wohanka, Obermaier & Kollegen GmbH",
      "company_seat": "Ergolding",
      "details": "03.01.2026 (Bekanntmachungsdatum)\n\nBayern Amtsgericht Landshut HRB 5289\nSonstige Registerbekanntmachung 02.01.2026 (Eintragungsdatum)\n\nWohanka, Obermaier & Kollegen GmbH\nGesellschaft mit beschränkter Haftung\nErgolding\n\nDen Gläubigern der Gesellschaft, deren Forderungen begründet worden sind, bevor die Eintragung der Beendigung des Gewinnabführungsvertrages in das Handelsregister nach § 10 des Handelsgesetzbuches als bekanntgemacht gilt, hat der andere Vertragsteil Sicherheit zu leisten, wenn sie sich binnen sechs Monaten nach der Bekanntmachung der Eintragung zu diesem Zweck bei ihm melden."
    },
    {
      "date": "2026-01-03",
      "id": "141427",
      "original_text": "Löschungsankündigung\nBayern Amtsgericht München HRB 247189\nSpitzbogen Bau GmbH – München",
      "type": "Löschungsankündigung",
      "state": "Bayern",
      "amtsgericht": "Amtsgericht München",
      "registernummer": "HRB 247189",
      "registerart": "HRB",
      "company_name": "Spitzbogen Bau GmbH",
      "company_seat": "München",
      "details": "03.01.2026 (Bekanntmachungsdatum)\n\nBayern Amtsgericht München HRB 247189\nLöschungsankündigung\n\nSpitzbogen Bau GmbH\nGesellschaft mit beschränkter Haftung\nMünchen\n\nDas Registergericht beabsichtigt, die im Handelsregister eingetragene Gesellschaft wegen Vermögenslosigkeit von Amts wegen nach § 394 FamFG zu löschen. Die Frist zur Erhebung eines Widerspruchs ist auf drei Monate festgesetzt."
    },
    {
      "date": "2026-01-03",
      "id": "141428",
      "original_text": "Löschungsankündigung\nBayern Amtsgericht München HRB 195587\nFoto Wilhelm GmbH – München",
      "type": "Löschungsankündigung",
      "state": "Bayern",
      "amtsgericht": "Amtsgericht München",
      "registernummer": "HRB 195587",
      "registerart": "HRB",
      "company_name": "Foto Wilhelm GmbH",
      "company_seat": "München",
      "details": "03.01.2026 (Bekanntmachungsdatum)\n\nBayern Amtsgericht München HRB 195587\nLöschungsankündigung 02.01.2026 (Eintragungsdatum)\n\nFoto Wilhelm GmbH\nGesellschaft mit beschränkter Haftung\nMünchen\n\nDas Registergericht beabsichtigt, die im Handelsregister eingetragene Gesellschaft wegen Vermögenslosigkeit von Amts wegen nach § 394 FamFG zu löschen. Die Frist zur Erhebung eines Widerspruchs ist auf drei Monate festgesetzt."
    },
    {
      "date": "2026-01-03",
      "id": "141429",
      "original_text": "Löschungsankündigung\nBayern Amtsgericht Ingolstadt HRB 10658\nMC Chilli Pizza Service UG (haftungsbeschränkt) – Rennertshofen",
      "type": "Löschungsankündigung",
      "state": "Bayern",
      "amtsgericht": "Amtsgericht Ingolstadt",
      "registernummer": "HRB 10658",
      "registerart": "HRB",
      "company_name": "MC Chilli Pizza Service UG (haftungsbeschränkt)",
      "company_seat": "Rennertshofen",
      "details": "03.01.2026 (Bekanntmachungsdatum)\n\nBayern Amtsgericht Ingolstadt HRB 10658\nLöschungsankündigung\n\nMC Chilli Pizza Service UG (haftungsbeschränkt)\nGesellschaft mit beschränkter Haftung\nRennertshofen\n\nDas Registergericht beabsichtigt, die im Handelsregister eingetragene Gesellschaft wegen Vermögenslosigkeit von Amts wegen nach § 394 FamFG zu löschen. Die Frist zur Erhebung eines Widerspruchs ist auf einen Monat festgesetzt."
    },
    {
      "date": "2026-01-03",
      "id": "141430",
      "original_text": "Einreichung neuer Dokumente\nBrandenburg Amtsgericht Potsdam HRB 29305\nZF Getriebe Brandenburg GmbH – Brandenburg an der Havel",
      "type": "Einreichung neuer Dokumente",
      "state": "Brandenburg",
      "amtsgericht": "Amtsgericht Potsdam",
      "registernummer": "HRB 29305",
      "registerart": "HRB",
      "company_name": "ZF Getriebe Brandenburg GmbH",
      "company_seat": "Brandenburg an der Havel",
      "details": "03.01.2026 (Bekanntmachungsdatum)\n\nBrandenburg Amtsgericht Potsdam HRB 29305\nEinreichung neuer Dokumente\n\nZF Getriebe Brandenburg GmbH\nGesellschaft mit beschränkter Haftung\nBrandenburg an der Havel\n\nAls nicht eingetragen wird veröffentlicht:\nEine Liste der Mitglieder des Aufsichtsrates wurde zum Handelsregister eingereicht."
    }
  ]
}