{
  "date": "2026-01-13",
  "date_of_scrape": "2026-01-14T04:27:55.390Z",
  "tool_version": "0.2.0",
  "number_of_announcements": 147,
  "announcements": [
    {
      "date": "2026-01-13",
      "id": "142177",
      "original_text": "Sonstige Registerbekanntmachung\nBayern Amtsgericht München HRB 274630\nMasters of Digital GmbH – München",
      "type": "Sonstige Registerbekanntmachung",
      "state": "Bayern",
      "amtsgericht": "Amtsgericht München",
      "registernummer": "HRB 274630",
      "registerart": "HRB",
      "company_name": "Masters of Digital GmbH",
      "company_seat": "München",
      "details": "13.01.2026 (Bekanntmachungsdatum)\n\nBayern Amtsgericht München HRB 274630\nSonstige Registerbekanntmachung 11.01.2026 (Eintragungsdatum)\n\nMasters of Digital GmbH\nGesellschaft mit beschränkter Haftung\nMünchen\n\nDen Gläubigern der Gesellschaft, deren Forderungen begründet worden sind, bevor die Eintragung der Beendigung des Beherrschungsvertrages in das Handelsregister nach § 10 des Handelsgesetzbuches als bekanntgemacht gilt, hat der andere Vertragsteil Sicherheit zu leisten, wenn sie sich binnen sechs Monaten nach der Bekanntmachung der Eintragung zu diesem Zweck bei ihm melden."
    },
    {
      "date": "2026-01-13",
      "id": "142178",
      "original_text": "Registerbekanntmachung nach dem Umwandlungsgesetz\nBayern Amtsgericht München HRB 245527\nAURELIUS Development Twelve GmbH – Grünwald",
      "type": "Registerbekanntmachung nach dem Umwandlungsgesetz",
      "state": "Bayern",
      "amtsgericht": "Amtsgericht München",
      "registernummer": "HRB 245527",
      "registerart": "HRB",
      "company_name": "AURELIUS Development Twelve GmbH",
      "company_seat": "Grünwald",
      "details": "13.01.2026 (Bekanntmachungsdatum)\n\nBayern Amtsgericht München HRB 245527\nRegisterbekanntmachung nach dem Umwandlungsgesetz 11.01.2026 (Eintragungsdatum)\n\nAURELIUS Development Twelve GmbH\nGesellschaft mit beschränkter Haftung\nGrünwald\n\nDen Gläubigern des formwechselnden Rechtsträgers ist, wenn sie binnen sechs Monaten nach dem Tag, an dem die Eintragung des Formwechsels nach § 201 UmwG als bekannt gemacht gilt, ihren Anspruch nach Grund und Höhe in Textform anmelden, Sicherheit zu leisten, soweit sie nicht Befriedigung verlangen können. Dieses Recht steht den Gläubigern jedoch nur zu, wenn sie glaubhaft machen, dass durch den Formwechsel die Erfüllung ihrer Forderung gefährdet wird."
    },
    {
      "date": "2026-01-13",
      "id": "142179",
      "original_text": "Einreichung neuer Dokumente\nBayern Amtsgericht Hof HRB 6257\nRausch & Pausch SE – Selb",
      "type": "Einreichung neuer Dokumente",
      "state": "Bayern",
      "amtsgericht": "Amtsgericht Hof",
      "registernummer": "HRB 6257",
      "registerart": "HRB",
      "company_name": "Rausch & Pausch SE",
      "company_seat": "Selb",
      "details": "13.01.2026 (Bekanntmachungsdatum)\n\nBayern Amtsgericht Hof HRB 6257\nEinreichung neuer Dokumente 12.01.2026 (Eintragungsdatum)\n\nRausch & Pausch SE\nEuropäische Aktiengesellschaft (SE)\nSelb\n\nDem #Re.Name ist eine Liste der Mitglieder des Aufsichtsrats eingereicht worden, Art. 9 Abs. 1 Buchst. c (ii) SE-VO i.V.m. § 106 AktG."
    },
    {
      "date": "2026-01-13",
      "id": "142180",
      "original_text": "Registerbekanntmachung nach dem Umwandlungsgesetz\nBayern Amtsgericht München HRB 308547\nKavun Patton GmbH – Garmisch-Partenkirchen",
      "type": "Registerbekanntmachung nach dem Umwandlungsgesetz",
      "state": "Bayern",
      "amtsgericht": "Amtsgericht München",
      "registernummer": "HRB 308547",
      "registerart": "HRB",
      "company_name": "Kavun Patton GmbH",
      "company_seat": "Garmisch-Partenkirchen",
      "details": "13.01.2026 (Bekanntmachungsdatum)\n\nBayern Amtsgericht München HRB 308547\nRegisterbekanntmachung nach dem Umwandlungsgesetz 12.01.2026 (Eintragungsdatum)\n\nKavun Patton GmbH\nGesellschaft mit beschränkter Haftung\nGarmisch-Partenkirchen\n\nDen Gläubigern der an der Ausgliederung beteiligten Rechtsträger ist, wenn sie binnen sechs Monaten nach dem Tag, an dem die Eintragung der Ausgliederung in das Register des Sitzes desjenigen Rechtsträgers, dessen Gläubiger sie sind, nach §§ 125, 19 Abs. 3 UmwG als bekannt gemacht gilt, ihren Anspruch nach Grund und Höhe in Textform anmelden, Sicherheit zu leisten, soweit sie nicht Befriedigung verlangen können. Dieses Recht steht den Gläubigern jedoch nur zu, wenn sie glaubhaft machen, dass durch die Ausgliederung die Erfüllung ihrer Forderung gefährdet wird."
    },
    {
      "date": "2026-01-13",
      "id": "142181",
      "original_text": "Registerbekanntmachung nach dem Umwandlungsgesetz\nBayern Amtsgericht München HRB 226414\nKorian Buchenpark GmbH – München",
      "type": "Registerbekanntmachung nach dem Umwandlungsgesetz",
      "state": "Bayern",
      "amtsgericht": "Amtsgericht München",
      "registernummer": "HRB 226414",
      "registerart": "HRB",
      "company_name": "Korian Buchenpark GmbH",
      "company_seat": "München",
      "details": "13.01.2026 (Bekanntmachungsdatum)\n\nBayern Amtsgericht München HRB 226414\nRegisterbekanntmachung nach dem Umwandlungsgesetz 12.01.2026 (Eintragungsdatum)\n\nKorian Buchenpark GmbH\nGesellschaft mit beschränkter Haftung\nMünchen\n\nDen Gläubigern der an der Verschmelzung beteiligten Rechtsträger ist, wenn sie binnen sechs Monaten nach dem Tag, an dem die Eintragung der Verschmelzung in das Register des Sitzes desjenigen Rechtsträgers, dessen Gläubiger sie sind, nach § 19 Abs. 3 UmwG als bekannt gemacht gilt, ihren Anspruch nach Grund und Höhe in Textform anmelden, Sicherheit zu leisten, soweit sie nicht Befriedigung verlangen können. Dieses Recht steht den Gläubigern jedoch nur zu, wenn sie glaubhaft machen, dass durch die Verschmelzung die Erfüllung ihrer Forderung gefährdet wird."
    },
    {
      "date": "2026-01-13",
      "id": "142182",
      "original_text": "Registerbekanntmachung nach dem Umwandlungsgesetz\nBayern Amtsgericht München HRB 303009\nCNC - Fabian Hainzinger GmbH – Pfaffenhofen a.d.Glonn",
      "type": "Registerbekanntmachung nach dem Umwandlungsgesetz",
      "state": "Bayern",
      "amtsgericht": "Amtsgericht München",
      "registernummer": "HRB 303009",
      "registerart": "HRB",
      "company_name": "CNC - Fabian Hainzinger GmbH",
      "company_seat": "Pfaffenhofen a.d.Glonn",
      "details": "13.01.2026 (Bekanntmachungsdatum)\n\nBayern Amtsgericht München HRB 303009\nRegisterbekanntmachung nach dem Umwandlungsgesetz 12.01.2026 (Eintragungsdatum)\n\nCNC - Fabian Hainzinger GmbH\nGesellschaft mit beschränkter Haftung\nPfaffenhofen a.d.Glonn\n\nDen Gläubigern der an der Ausgliederung beteiligten Rechtsträger ist, wenn sie binnen sechs Monaten nach dem Tag, an dem die Eintragung der Ausgliederung in das Register des Sitzes desjenigen Rechtsträgers, dessen Gläubiger sie sind, nach §§ 125, 19 Abs. 3 UmwG als bekannt gemacht gilt, ihren Anspruch nach Grund und Höhe in Textform anmelden, Sicherheit zu leisten, soweit sie nicht Befriedigung verlangen können. Dieses Recht steht den Gläubigern jedoch nur zu, wenn sie glaubhaft machen, dass durch die Ausgliederung die Erfüllung ihrer Forderung gefährdet wird."
    },
    {
      "date": "2026-01-13",
      "id": "142183",
      "original_text": "Löschungsankündigung\nBayern Amtsgericht Landshut HRB 13108\nA & A UG (haftungsbeschränkt) – Buch a.Erlbach",
      "type": "Löschungsankündigung",
      "state": "Bayern",
      "amtsgericht": "Amtsgericht Landshut",
      "registernummer": "HRB 13108",
      "registerart": "HRB",
      "company_name": "A & A UG (haftungsbeschränkt)",
      "company_seat": "Buch a.Erlbach",
      "details": "13.01.2026 (Bekanntmachungsdatum)\n\nBayern Amtsgericht Landshut HRB 13108\nLöschungsankündigung\n\nA & A UG (haftungsbeschränkt)\nGesellschaft mit beschränkter Haftung\nBuch a.Erlbach\n\nDas Registergericht beabsichtigt, die im Handelsregister eingetragene Gesellschaft wegen Vermögenslosigkeit von Amts wegen nach § 394 FamFG zu löschen. Die Frist zur Erhebung eines Widerspruchs ist auf einen Monat festgesetzt."
    },
    {
      "date": "2026-01-13",
      "id": "142184",
      "original_text": "Löschungsankündigung\nBayern Amtsgericht München HRA 112510\nM2 Projekt GmbH & Co. KG – Gräfelfing",
      "type": "Löschungsankündigung",
      "state": "Bayern",
      "amtsgericht": "Amtsgericht München",
      "registernummer": "HRA 112510",
      "registerart": "HRA",
      "company_name": "M2 Projekt GmbH & Co. KG",
      "company_seat": "Gräfelfing",
      "details": "13.01.2026 (Bekanntmachungsdatum)\n\nBayern Amtsgericht München HRA 112510\nLöschungsankündigung 12.01.2026 (Eintragungsdatum)\n\nM2 Projekt GmbH & Co. KG\nKommanditgesellschaft\nGräfelfing\n\nDas Registergericht beabsichtigt, die im Handelsregister eingetragene Firma von Amts wegen nach § 31 Abs. 2 HGB zu löschen. Die Frist zur Erhebung eines Widerspruchs ist auf drei Monate festgesetzt."
    },
    {
      "date": "2026-01-13",
      "id": "142185",
      "original_text": "Registerbekanntmachung nach dem Umwandlungsgesetz\nBayern Amtsgericht Traunstein HRB 20525\nFuchsbau UG (haftungsbeschränkt) – Teisendorf",
      "type": "Registerbekanntmachung nach dem Umwandlungsgesetz",
      "state": "Bayern",
      "amtsgericht": "Amtsgericht Traunstein",
      "registernummer": "HRB 20525",
      "registerart": "HRB",
      "company_name": "Fuchsbau UG (haftungsbeschränkt)",
      "company_seat": "Teisendorf",
      "details": "13.01.2026 (Bekanntmachungsdatum)\n\nBayern Amtsgericht Traunstein HRB 20525\nRegisterbekanntmachung nach dem Umwandlungsgesetz 12.01.2026 (Eintragungsdatum)\n\nFuchsbau UG (haftungsbeschränkt)\nGesellschaft mit beschränkter Haftung\nTeisendorf\n\nDen Gläubigern der an der Verschmelzung beteiligten Rechtsträger ist, wenn sie binnen sechs Monaten nach dem Tag, an dem die Eintragung der Verschmelzung in das Register des Sitzes desjenigen Rechtsträgers, dessen Gläubiger sie sind, nach § 19 Abs. 3 UmwG als bekannt gemacht gilt, ihren Anspruch nach Grund und Höhe in Textform anmelden, Sicherheit zu leisten, soweit sie nicht Befriedigung verlangen können. Dieses Recht steht den Gläubigern jedoch nur zu, wenn sie glaubhaft machen, dass durch die Verschmelzung die Erfüllung ihrer Forderung gefährdet wird."
    },
    {
      "date": "2026-01-13",
      "id": "142186",
      "original_text": "Registerbekanntmachung nach dem Umwandlungsgesetz\nBayern Amtsgericht Würzburg HRA 9036\nGW7 Vertriebs GmbH & Co. KG – Waldbüttelbrunn",
      "type": "Registerbekanntmachung nach dem Umwandlungsgesetz",
      "state": "Bayern",
      "amtsgericht": "Amtsgericht Würzburg",
      "registernummer": "HRA 9036",
      "registerart": "HRA",
      "company_name": "GW7 Vertriebs GmbH & Co. KG",
      "company_seat": "Waldbüttelbrunn",
      "details": "13.01.2026 (Bekanntmachungsdatum)\n\nBayern Amtsgericht Würzburg HRA 9036\nRegisterbekanntmachung nach dem Umwandlungsgesetz 12.01.2026 (Eintragungsdatum)\n\nGW7 Vertriebs GmbH & Co. KG\nKommanditgesellschaft\nWaldbüttelbrunn\n\nDen Gläubigern der an der Ausgliederung beteiligten Rechtsträger ist, wenn sie binnen sechs Monaten nach dem Tag, an dem die Eintragung der Ausgliederung in das Register des Sitzes desjenigen Rechtsträgers, dessen Gläubiger sie sind, nach §§ 125, 19 Abs. 3 UmwG als bekannt gemacht gilt, ihren Anspruch nach Grund und Höhe in Textform anmelden, Sicherheit zu leisten, soweit sie nicht Befriedigung verlangen können. Dieses Recht steht den Gläubigern jedoch nur zu, wenn sie glaubhaft machen, dass durch die Ausgliederung die Erfüllung ihrer Forderung gefährdet wird."
    },
    {
      "date": "2026-01-13",
      "id": "142187",
      "original_text": "Einreichung neuer Dokumente\nBayern Amtsgericht Augsburg HRB 41839\nKUKA SE & Co. KGaA – Augsburg",
      "type": "Einreichung neuer Dokumente",
      "state": "Bayern",
      "amtsgericht": "Amtsgericht Augsburg",
      "registernummer": "HRB 41839",
      "registerart": "HRB",
      "company_name": "KUKA SE & Co. KGaA",
      "company_seat": "Augsburg",
      "details": "13.01.2026 (Bekanntmachungsdatum)\n\nBayern Amtsgericht Augsburg HRB 41839\nEinreichung neuer Dokumente\n\nKUKA SE & Co. KGaA\nKommanditgesellschaft auf Aktien\nAugsburg\n\nDem Amtsgericht Augsburg -Registergericht- isteine Liste der Mitglieder des Aufsichtsrats eingereicht worden, §§ 278 Abs. 3, 106 AktG."
    },
    {
      "date": "2026-01-13",
      "id": "142188",
      "original_text": "Registerbekanntmachung nach dem Umwandlungsgesetz\nBayern Amtsgericht München HRB 226395\nPHÖNIX-Seniorenzentrum Zwei Linden GmbH – München",
      "type": "Registerbekanntmachung nach dem Umwandlungsgesetz",
      "state": "Bayern",
      "amtsgericht": "Amtsgericht München",
      "registernummer": "HRB 226395",
      "registerart": "HRB",
      "company_name": "PHÖNIX-Seniorenzentrum Zwei Linden GmbH",
      "company_seat": "München",
      "details": "13.01.2026 (Bekanntmachungsdatum)\n\nBayern Amtsgericht München HRB 226395\nRegisterbekanntmachung nach dem Umwandlungsgesetz 12.01.2026 (Eintragungsdatum)\n\nPHÖNIX-Seniorenzentrum Zwei Linden GmbH\nGesellschaft mit beschränkter Haftung\nMünchen\n\nDen Gläubigern der an der Verschmelzung beteiligten Rechtsträger ist, wenn sie binnen sechs Monaten nach dem Tag, an dem die Eintragung der Verschmelzung in das Register des Sitzes desjenigen Rechtsträgers, dessen Gläubiger sie sind, nach § 19 Abs. 3 UmwG als bekannt gemacht gilt, ihren Anspruch nach Grund und Höhe in Textform anmelden, Sicherheit zu leisten, soweit sie nicht Befriedigung verlangen können. Dieses Recht steht den Gläubigern jedoch nur zu, wenn sie glaubhaft machen, dass durch die Verschmelzung die Erfüllung ihrer Forderung gefährdet wird."
    },
    {
      "date": "2026-01-13",
      "id": "142189",
      "original_text": "Sonstige Registerbekanntmachung\nBayern Amtsgericht Traunstein HRB 27770\nVitalis Unterammergau GmbH – Feldkirchen-Westerham",
      "type": "Sonstige Registerbekanntmachung",
      "state": "Bayern",
      "amtsgericht": "Amtsgericht Traunstein",
      "registernummer": "HRB 27770",
      "registerart": "HRB",
      "company_name": "Vitalis Unterammergau GmbH",
      "company_seat": "Feldkirchen-Westerham",
      "details": "13.01.2026 (Bekanntmachungsdatum)\n\nBayern Amtsgericht Traunstein HRB 27770\nSonstige Registerbekanntmachung 12.01.2026 (Eintragungsdatum)\n\nVitalis Unterammergau GmbH\nGesellschaft mit beschränkter Haftung\nFeldkirchen-Westerham\n\nDen Gläubigern der Gesellschaft, deren Forderungen begründet worden sind, bevor die Eintragung der Beendigung des Ergebnisabführungsvertrages in das Handelsregister nach § 10 des Handelsgesetzbuches als bekanntgemacht gilt, hat der andere Vertragsteil Sicherheit zu leisten, wenn sie sich binnen sechs Monaten nach der Bekanntmachung der Eintragung zu diesem Zweck bei ihm melden."
    },
    {
      "date": "2026-01-13",
      "id": "142190",
      "original_text": "Löschungsankündigung\nBayern Amtsgericht München HRA 91864\nS7 Abwicklungs GmbH & Co. KG – München",
      "type": "Löschungsankündigung",
      "state": "Bayern",
      "amtsgericht": "Amtsgericht München",
      "registernummer": "HRA 91864",
      "registerart": "HRA",
      "company_name": "S7 Abwicklungs GmbH & Co. KG",
      "company_seat": "München",
      "details": "13.01.2026 (Bekanntmachungsdatum)\n\nBayern Amtsgericht München HRA 91864\nLöschungsankündigung\n\nS7 Abwicklungs GmbH & Co. KG\nKommanditgesellschaft\nMünchen\n\nDas Registergericht beabsichtigt, die im Handelsregister eingetragene Firma von Amts wegen nach § 31 Abs. 2 HGB zu löschen. #insert(Text=\"zztb_V_Widerspruchsfrist\")"
    },
    {
      "date": "2026-01-13",
      "id": "142191",
      "original_text": "Registerbekanntmachung nach dem Umwandlungsgesetz\nBayern Amtsgericht Traunstein HRA 15141\nPascal Mittermeier e.K. – Burghausen",
      "type": "Registerbekanntmachung nach dem Umwandlungsgesetz",
      "state": "Bayern",
      "amtsgericht": "Amtsgericht Traunstein",
      "registernummer": "HRA 15141",
      "registerart": "HRA",
      "company_name": "Pascal Mittermeier e.K.",
      "company_seat": "Burghausen",
      "details": "13.01.2026 (Bekanntmachungsdatum)\n\nBayern Amtsgericht Traunstein HRA 15141\nRegisterbekanntmachung nach dem Umwandlungsgesetz 12.01.2026 (Eintragungsdatum)\n\nPascal Mittermeier e.K.\nEinzelkaufmann / Einzelkauffrau\nBurghausen\n\nDen Gläubigern der an der Ausgliederung beteiligten Rechtsträger ist, wenn sie binnen sechs Monaten nach dem Tag, an dem die Eintragung der Ausgliederung in das Register des Sitzes desjenigen Rechtsträgers, dessen Gläubiger sie sind, nach §§ 125, 19 Abs. 3 UmwG als bekannt gemacht gilt, ihren Anspruch nach Grund und Höhe in Textform anmelden, Sicherheit zu leisten, soweit sie nicht Befriedigung verlangen können. Dieses Recht steht den Gläubigern jedoch nur zu, wenn sie glaubhaft machen, dass durch die Ausgliederung die Erfüllung ihrer Forderung gefährdet wird."
    },
    {
      "date": "2026-01-13",
      "id": "142192",
      "original_text": "Einreichung neuer Dokumente\nBayern Amtsgericht Hof HRB 6212\nBHS tabletop Aktiengesellschaft – Selb",
      "type": "Einreichung neuer Dokumente",
      "state": "Bayern",
      "amtsgericht": "Amtsgericht Hof",
      "registernummer": "HRB 6212",
      "registerart": "HRB",
      "company_name": "BHS tabletop Aktiengesellschaft",
      "company_seat": "Selb",
      "details": "13.01.2026 (Bekanntmachungsdatum)\n\nBayern Amtsgericht Hof HRB 6212\nEinreichung neuer Dokumente\n\nBHS tabletop Aktiengesellschaft\nAktiengesellschaft\nSelb\n\nDem #Re.Name ist eine Liste der Mitglieder des Aufsichtsrats eingereicht worden, § 106 AktG."
    },
    {
      "date": "2026-01-13",
      "id": "142193",
      "original_text": "Registerbekanntmachung nach dem Umwandlungsgesetz\nBayern Amtsgericht Traunstein HRB 973\nFuchs Druck GmbH – Laufen",
      "type": "Registerbekanntmachung nach dem Umwandlungsgesetz",
      "state": "Bayern",
      "amtsgericht": "Amtsgericht Traunstein",
      "registernummer": "HRB 973",
      "registerart": "HRB",
      "company_name": "Fuchs Druck GmbH",
      "company_seat": "Laufen",
      "details": "13.01.2026 (Bekanntmachungsdatum)\n\nBayern Amtsgericht Traunstein HRB 973\nRegisterbekanntmachung nach dem Umwandlungsgesetz 12.01.2026 (Eintragungsdatum)\n\nFuchs Druck GmbH\nGesellschaft mit beschränkter Haftung\nLaufen\n\nDen Gläubigern der an der Verschmelzung beteiligten Rechtsträger ist, wenn sie binnen sechs Monaten nach dem Tag, an dem die Eintragung der Verschmelzung in das Register des Sitzes desjenigen Rechtsträgers, dessen Gläubiger sie sind, nach § 19 Abs. 3 UmwG als bekannt gemacht gilt, ihren Anspruch nach Grund und Höhe in Textform anmelden, Sicherheit zu leisten, soweit sie nicht Befriedigung verlangen können. Dieses Recht steht den Gläubigern jedoch nur zu, wenn sie glaubhaft machen, dass durch die Verschmelzung die Erfüllung ihrer Forderung gefährdet wird."
    },
    {
      "date": "2026-01-13",
      "id": "142194",
      "original_text": "Registerbekanntmachung nach dem Umwandlungsgesetz\nBayern Amtsgericht Würzburg HRA 2513\nGötz - Brot GmbH & Co. KG – Waldbüttelbrunn",
      "type": "Registerbekanntmachung nach dem Umwandlungsgesetz",
      "state": "Bayern",
      "amtsgericht": "Amtsgericht Würzburg",
      "registernummer": "HRA 2513",
      "registerart": "HRA",
      "company_name": "Götz - Brot GmbH & Co. KG",
      "company_seat": "Waldbüttelbrunn",
      "details": "13.01.2026 (Bekanntmachungsdatum)\n\nBayern Amtsgericht Würzburg HRA 2513\nRegisterbekanntmachung nach dem Umwandlungsgesetz 12.01.2026 (Eintragungsdatum)\n\nGötz - Brot GmbH & Co. KG\nKommanditgesellschaft\nWaldbüttelbrunn\n\nDen Gläubigern der an der Ausgliederung beteiligten Rechtsträger ist, wenn sie binnen sechs Monaten nach dem Tag, an dem die Eintragung der Ausgliederung in das Register des Sitzes desjenigen Rechtsträgers, dessen Gläubiger sie sind, nach §§ 125, 19 Abs. 3 UmwG als bekannt gemacht gilt, ihren Anspruch nach Grund und Höhe in Textform anmelden, Sicherheit zu leisten, soweit sie nicht Befriedigung verlangen können. Dieses Recht steht den Gläubigern jedoch nur zu, wenn sie glaubhaft machen, dass durch die Ausgliederung die Erfüllung ihrer Forderung gefährdet wird."
    },
    {
      "date": "2026-01-13",
      "id": "142195",
      "original_text": "Löschungsankündigung\nBayern Amtsgericht München HRB 240966\nAlchemist GmbH – München",
      "type": "Löschungsankündigung",
      "state": "Bayern",
      "amtsgericht": "Amtsgericht München",
      "registernummer": "HRB 240966",
      "registerart": "HRB",
      "company_name": "Alchemist GmbH",
      "company_seat": "München",
      "details": "13.01.2026 (Bekanntmachungsdatum)\n\nBayern Amtsgericht München HRB 240966\nLöschungsankündigung 12.01.2026 (Eintragungsdatum)\n\nAlchemist GmbH\nGesellschaft mit beschränkter Haftung\nMünchen\n\nDas Registergericht beabsichtigt, die im Handelsregister eingetragene Gesellschaft wegen Vermögenslosigkeit von Amts wegen nach § 394 FamFG zu löschen. Die Frist zur Erhebung eines Widerspruchs ist auf drei Monate festgesetzt."
    },
    {
      "date": "2026-01-13",
      "id": "142196",
      "original_text": "Löschungsankündigung\nBayern Amtsgericht München HRB 248271\nBacTrace BioTec AG – München",
      "type": "Löschungsankündigung",
      "state": "Bayern",
      "amtsgericht": "Amtsgericht München",
      "registernummer": "HRB 248271",
      "registerart": "HRB",
      "company_name": "BacTrace BioTec AG",
      "company_seat": "München",
      "details": "13.01.2026 (Bekanntmachungsdatum)\n\nBayern Amtsgericht München HRB 248271\nLöschungsankündigung\n\nBacTrace BioTec AG\nAktiengesellschaft\nMünchen\n\nDas Registergericht beabsichtigt, den im Handelsregister eingetragenen\n\nVorstand, Walter Maria Miedl, geb:27.5.1954"
    },
    {
      "date": "2026-01-13",
      "id": "142197",
      "original_text": "Registerbekanntmachung nach dem Umwandlungsgesetz\nBayern Amtsgericht München HRB 253429\nKSW 05 GmbH – Starnberg",
      "type": "Registerbekanntmachung nach dem Umwandlungsgesetz",
      "state": "Bayern",
      "amtsgericht": "Amtsgericht München",
      "registernummer": "HRB 253429",
      "registerart": "HRB",
      "company_name": "KSW 05 GmbH",
      "company_seat": "Starnberg",
      "details": "13.01.2026 (Bekanntmachungsdatum)\n\nBayern Amtsgericht München HRB 253429\nRegisterbekanntmachung nach dem Umwandlungsgesetz 12.01.2026 (Eintragungsdatum)\n\nKSW 05 GmbH\nGesellschaft mit beschränkter Haftung\nStarnberg\n\nDen Gläubigern der an der Verschmelzung beteiligten Rechtsträger ist, wenn sie binnen sechs Monaten nach dem Tag, an dem die Eintragung der Verschmelzung in das Register des Sitzes desjenigen Rechtsträgers, dessen Gläubiger sie sind, nach § 19 Abs. 3 UmwG als bekannt gemacht gilt, ihren Anspruch nach Grund und Höhe in Textform anmelden, Sicherheit zu leisten, soweit sie nicht Befriedigung verlangen können. Dieses Recht steht den Gläubigern jedoch nur zu, wenn sie glaubhaft machen, dass durch die Verschmelzung die Erfüllung ihrer Forderung gefährdet wird."
    },
    {
      "date": "2026-01-13",
      "id": "142198",
      "original_text": "Registerbekanntmachung nach dem Umwandlungsgesetz\nBayern Amtsgericht Traunstein HRB 31986\nPMT Holding GmbH – Burghausen",
      "type": "Registerbekanntmachung nach dem Umwandlungsgesetz",
      "state": "Bayern",
      "amtsgericht": "Amtsgericht Traunstein",
      "registernummer": "HRB 31986",
      "registerart": "HRB",
      "company_name": "PMT Holding GmbH",
      "company_seat": "Burghausen",
      "details": "13.01.2026 (Bekanntmachungsdatum)\n\nBayern Amtsgericht Traunstein HRB 31986\nRegisterbekanntmachung nach dem Umwandlungsgesetz 12.01.2026 (Eintragungsdatum)\n\nPMT Holding GmbH\nGesellschaft mit beschränkter Haftung\nBurghausen\n\nDen Gläubigern der an der Ausgliederung beteiligten Rechtsträger ist, wenn sie binnen sechs Monaten nach dem Tag, an dem die Eintragung der Ausgliederung in das Register des Sitzes desjenigen Rechtsträgers, dessen Gläubiger sie sind, nach §§ 125, 19 Abs. 3 UmwG als bekannt gemacht gilt, ihren Anspruch nach Grund und Höhe in Textform anmelden, Sicherheit zu leisten, soweit sie nicht Befriedigung verlangen können. Dieses Recht steht den Gläubigern jedoch nur zu, wenn sie glaubhaft machen, dass durch die Ausgliederung die Erfüllung ihrer Forderung gefährdet wird."
    },
    {
      "date": "2026-01-13",
      "id": "142199",
      "original_text": "Registerbekanntmachung nach dem Umwandlungsgesetz\nBayern Amtsgericht Augsburg HRB 35769\nAerovisto GmbH – Pürgen",
      "type": "Registerbekanntmachung nach dem Umwandlungsgesetz",
      "state": "Bayern",
      "amtsgericht": "Amtsgericht Augsburg",
      "registernummer": "HRB 35769",
      "registerart": "HRB",
      "company_name": "Aerovisto GmbH",
      "company_seat": "Pürgen",
      "details": "13.01.2026 (Bekanntmachungsdatum)\n\nBayern Amtsgericht Augsburg HRB 35769\nRegisterbekanntmachung nach dem Umwandlungsgesetz 12.01.2026 (Eintragungsdatum)\n\nAerovisto GmbH\nGesellschaft mit beschränkter Haftung\nPürgen\n\nDen Gläubigern der an der Verschmelzung beteiligten Rechtsträger ist, wenn sie binnen sechs Monaten nach dem Tag, an dem die Eintragung der Verschmelzung in das Register des Sitzes desjenigen Rechtsträgers, dessen Gläubiger sie sind, nach § 19 Abs. 3 UmwG als bekannt gemacht gilt, ihren Anspruch nach Grund und Höhe in Textform anmelden, Sicherheit zu leisten, soweit sie nicht Befriedigung verlangen können. Dieses Recht steht den Gläubigern jedoch nur zu, wenn sie glaubhaft machen, dass durch die Verschmelzung die Erfüllung ihrer Forderung gefährdet wird."
    },
    {
      "date": "2026-01-13",
      "id": "142200",
      "original_text": "Sonstige Registerbekanntmachung\nBayern Amtsgericht Traunstein HRB 15976\nNeenah Gessner GmbH – Bruckmühl",
      "type": "Sonstige Registerbekanntmachung",
      "state": "Bayern",
      "amtsgericht": "Amtsgericht Traunstein",
      "registernummer": "HRB 15976",
      "registerart": "HRB",
      "company_name": "Neenah Gessner GmbH",
      "company_seat": "Bruckmühl",
      "details": "13.01.2026 (Bekanntmachungsdatum)\n\nBayern Amtsgericht Traunstein HRB 15976\nSonstige Registerbekanntmachung 12.01.2026 (Eintragungsdatum)\n\nNeenah Gessner GmbH\nGesellschaft mit beschränkter Haftung\nBruckmühl\n\nDen Gläubigern der Gesellschaft, deren Forderungen begründet worden sind, bevor die Eintragung der Beendigung des Gewinnabführungsvertrages und des Beherrschungsvertrages in das Handelsregister nach § 10 des Handelsgesetzbuches als bekanntgemacht gilt, hat der andere Vertragsteil Sicherheit zu leisten, wenn sie sich binnen sechs Monaten nach der Bekanntmachung der Eintragung zu diesem Zweck bei ihm melden."
    },
    {
      "date": "2026-01-13",
      "id": "142201",
      "original_text": "Registerbekanntmachung nach dem Umwandlungsgesetz\nBayern Amtsgericht München HRA 121583\nDr. Hans-Peter Kleebinder e.K. – Grasbrunn",
      "type": "Registerbekanntmachung nach dem Umwandlungsgesetz",
      "state": "Bayern",
      "amtsgericht": "Amtsgericht München",
      "registernummer": "HRA 121583",
      "registerart": "HRA",
      "company_name": "Dr. Hans-Peter Kleebinder e.K.",
      "company_seat": "Grasbrunn",
      "details": "13.01.2026 (Bekanntmachungsdatum)\n\nBayern Amtsgericht München HRA 121583\nRegisterbekanntmachung nach dem Umwandlungsgesetz 12.01.2026 (Eintragungsdatum)\n\nDr. Hans-Peter Kleebinder e.K.\nEinzelkaufmann / Einzelkauffrau\nGrasbrunn\n\nDen Gläubigern der an der Ausgliederung beteiligten Rechtsträger ist, wenn sie binnen sechs Monaten nach dem Tag, an dem die Eintragung der Ausgliederung in das Register des Sitzes desjenigen Rechtsträgers, dessen Gläubiger sie sind, nach §§ 125, 19 Abs. 3 UmwG als bekannt gemacht gilt, ihren Anspruch nach Grund und Höhe in Textform anmelden, Sicherheit zu leisten, soweit sie nicht Befriedigung verlangen können. Dieses Recht steht den Gläubigern jedoch nur zu, wenn sie glaubhaft machen, dass durch die Ausgliederung die Erfüllung ihrer Forderung gefährdet wird."
    },
    {
      "date": "2026-01-13",
      "id": "142202",
      "original_text": "Registerbekanntmachung nach dem Umwandlungsgesetz\nBayern Amtsgericht München HRA 108747\nChristian Auer Grundbesitz II GmbH & Co. KG – München",
      "type": "Registerbekanntmachung nach dem Umwandlungsgesetz",
      "state": "Bayern",
      "amtsgericht": "Amtsgericht München",
      "registernummer": "HRA 108747",
      "registerart": "HRA",
      "company_name": "Christian Auer Grundbesitz II GmbH & Co. KG",
      "company_seat": "München",
      "details": "13.01.2026 (Bekanntmachungsdatum)\n\nBayern Amtsgericht München HRA 108747\nRegisterbekanntmachung nach dem Umwandlungsgesetz 12.01.2026 (Eintragungsdatum)\n\nChristian Auer Grundbesitz II GmbH & Co. KG\nKommanditgesellschaft\nMünchen\n\nDen Gläubigern der an der Spaltung beteiligten Rechtsträger ist, wenn sie binnen sechs Monaten nach dem Tag, an dem die Eintragung der Spaltung in das Register des Sitzes desjenigen Rechtsträgers, dessen Gläubiger sie sind, nach §§ 125, 19 Abs. 3 UmwG als bekannt gemacht gilt, ihren Anspruch nach Grund und Höhe in Textform anmelden, Sicherheit zu leisten, soweit sie nicht Befriedigung verlangen können. Dieses Recht steht den Gläubigern jedoch nur zu, wenn sie glaubhaft machen, dass durch die Spaltung die Erfüllung ihrer Forderung gefährdet wird."
    },
    {
      "date": "2026-01-13",
      "id": "142203",
      "original_text": "Löschungsankündigung\nBayern Amtsgericht Ansbach HRB 7146\nHäberlein Verwaltungs GmbH – Feuchtwangen",
      "type": "Löschungsankündigung",
      "state": "Bayern",
      "amtsgericht": "Amtsgericht Ansbach",
      "registernummer": "HRB 7146",
      "registerart": "HRB",
      "company_name": "Häberlein Verwaltungs GmbH",
      "company_seat": "Feuchtwangen",
      "details": "13.01.2026 (Bekanntmachungsdatum)\n\nBayern Amtsgericht Ansbach HRB 7146\nLöschungsankündigung\n\nHäberlein Verwaltungs GmbH\nGesellschaft mit beschränkter Haftung\nFeuchtwangen\n\nDas Registergericht beabsichtigt, die im Handelsregister eingetragene Gesellschaft wegen Vermögenslosigkeit von Amts wegen nach § 394 FamFG zu löschen. Die Frist zur Erhebung eines Widerspruchs ist auf sechs Wochen festgesetzt."
    },
    {
      "date": "2026-01-13",
      "id": "142204",
      "original_text": "Sonstige Registerbekanntmachung\nBaden-Württemberg Amtsgericht Mannheim HRB 337190\nFalk & Co Revisions- und Treuhand-Aktiengesellschaft Wirtschaftsprüfungsgesellschaft Steuerberatungsgesellschaft – Heidelberg",
      "type": "Sonstige Registerbekanntmachung",
      "state": "Baden-Württemberg",
      "amtsgericht": "Amtsgericht Mannheim",
      "registernummer": "HRB 337190",
      "registerart": "HRB",
      "company_name": "Falk & Co Revisions- und Treuhand-Aktiengesellschaft Wirtschaftsprüfungsgesellschaft Steuerberatungsgesellschaft",
      "company_seat": "Heidelberg",
      "details": "13.01.2026 (Bekanntmachungsdatum)\n\nBaden-Württemberg Amtsgericht Mannheim HRB 337190\nSonstige Registerbekanntmachung\n\nFalk & Co Revisions- und Treuhand-Aktiengesellschaft Wirtschaftsprüfungsgesellschaft Steuerberatungsgesellschaft\nAktiengesellschaft\nHeidelberg\n\nDie Gesellschaft hat am 08.01.2026 die Liste über die Zusammensetzung des Aufsichtsrats zum Handelsregister eingereicht."
    },
    {
      "date": "2026-01-13",
      "id": "142205",
      "original_text": "Einreichung neuer Dokumente\nBerlin Amtsgericht Berlin (Charlottenburg) HRB 241967\nTPWD AG – Berlin",
      "type": "Einreichung neuer Dokumente",
      "state": "Berlin",
      "amtsgericht": "Amtsgericht Berlin (Charlottenburg)",
      "registernummer": "HRB 241967",
      "registerart": "HRB",
      "company_name": "TPWD AG",
      "company_seat": "Berlin",
      "details": "13.01.2026 (Bekanntmachungsdatum)\n\nBerlin Amtsgericht Berlin (Charlottenburg) HRB 241967\nEinreichung neuer Dokumente\n\nTPWD AG\nAktiengesellschaft\nBerlin\n\nAls nicht eingetragen wird veröffentlicht:\n\nEs wurde eine neue Liste der Aufsichtsratsmitglieder eingereicht (§ 106 AktG)."
    },
    {
      "date": "2026-01-13",
      "id": "142206",
      "original_text": "Löschungsankündigung\nSchleswig-Holstein Amtsgericht Flensburg HRB 15154\nCP Freight Verwaltungs-GmbH – Kropp",
      "type": "Löschungsankündigung",
      "state": "Schleswig-Holstein",
      "amtsgericht": "Amtsgericht Flensburg",
      "registernummer": "HRB 15154",
      "registerart": "HRB",
      "company_name": "CP Freight Verwaltungs-GmbH",
      "company_seat": "Kropp",
      "details": "13.01.2026 (Bekanntmachungsdatum)\n\nSchleswig-Holstein Amtsgericht Flensburg HRB 15154\nLöschungsankündigung\n\nCP Freight Verwaltungs-GmbH\nGesellschaft mit beschränkter Haftung\nKropp\n\nEs ist die Löschung der nachstehenden Gesellschaft wegen Vermögenslosigkeit gemäß § 394 FamFG von Amts wegen beabsichtigt.\nWiderspruchsfrist: 2 Monate"
    },
    {
      "date": "2026-01-13",
      "id": "142207",
      "original_text": "Registerbekanntmachung nach dem Umwandlungsgesetz\nBerlin Amtsgericht Berlin (Charlottenburg) HRB 99457\nFreund & Partner GmbH Steuerberatungsgesellschaft – Berlin",
      "type": "Registerbekanntmachung nach dem Umwandlungsgesetz",
      "state": "Berlin",
      "amtsgericht": "Amtsgericht Berlin (Charlottenburg)",
      "registernummer": "HRB 99457",
      "registerart": "HRB",
      "company_name": "Freund & Partner GmbH Steuerberatungsgesellschaft",
      "company_seat": "Berlin",
      "details": "13.01.2026 (Bekanntmachungsdatum)\n\nBerlin Amtsgericht Berlin (Charlottenburg) HRB 99457\nRegisterbekanntmachung nach dem Umwandlungsgesetz 12.01.2026 (Eintragungsdatum)\n\nFreund & Partner GmbH Steuerberatungsgesellschaft\nGesellschaft mit beschränkter Haftung\nBerlin\n\nZu Eintragungsnummer 42 vom 12.01.2026 wird als nicht eingetragen veröffentlicht: Den Gläubigern der an der Verschmelzung beteiligten Rechtsträger ist, wenn sie binnen sechs Monaten nach dem Tag, an dem die Eintragung der Verschmelzung in das Register des Sitzes desjenigen Rechtsträgers, dessen Gläubiger sie sind, als bekannt gemacht gilt, ihren Anspruch nach Grund und Höhe schriftlich anmelden, Sicherheit zu leisten, soweit sie nicht Befriedigung verlangen können. Dieses Recht steht den Gläubigern jedoch nur zu, wenn sie glaubhaft machen, dass durch die Verschmelzung die Erfüllung ihrer Forderung gefährdet wird. Das Recht, Sicherheitsleistung zu verlangen, steht Gläubigern nicht zu, die im Falle der Insolvenz ein Recht auf vorzugsweise Befriedigung aus einer Deckungsmasse haben, die nach gesetzlicher Vorschrift zu ihrem Schutz errichtet und staatlich überwacht ist."
    },
    {
      "date": "2026-01-13",
      "id": "142208",
      "original_text": "Registerbekanntmachung nach dem Umwandlungsgesetz\nBerlin Amtsgericht Berlin (Charlottenburg) HRB 99457\nFreund & Partner GmbH Steuerberatungsgesellschaft – Berlin",
      "type": "Registerbekanntmachung nach dem Umwandlungsgesetz",
      "state": "Berlin",
      "amtsgericht": "Amtsgericht Berlin (Charlottenburg)",
      "registernummer": "HRB 99457",
      "registerart": "HRB",
      "company_name": "Freund & Partner GmbH Steuerberatungsgesellschaft",
      "company_seat": "Berlin",
      "details": "13.01.2026 (Bekanntmachungsdatum)\n\nBerlin Amtsgericht Berlin (Charlottenburg) HRB 99457\nRegisterbekanntmachung nach dem Umwandlungsgesetz 12.01.2026 (Eintragungsdatum)\n\nFreund & Partner GmbH Steuerberatungsgesellschaft\nGesellschaft mit beschränkter Haftung\nBerlin\n\nZu Eintragungsnummer 41 vom 12.01.2026 wird als nicht eingetragen veröffentlicht: Den Gläubigern der an der Verschmelzung beteiligten Rechtsträger ist, wenn sie binnen sechs Monaten nach dem Tag, an dem die Eintragung der Verschmelzung in das Register des Sitzes desjenigen Rechtsträgers, dessen Gläubiger sie sind, als bekannt gemacht gilt, ihren Anspruch nach Grund und Höhe schriftlich anmelden, Sicherheit zu leisten, soweit sie nicht Befriedigung verlangen können. Dieses Recht steht den Gläubigern jedoch nur zu, wenn sie glaubhaft machen, dass durch die Verschmelzung die Erfüllung ihrer Forderung gefährdet wird. Das Recht, Sicherheitsleistung zu verlangen, steht Gläubigern nicht zu, die im Falle der Insolvenz ein Recht auf vorzugsweise Befriedigung aus einer Deckungsmasse haben, die nach gesetzlicher Vorschrift zu ihrem Schutz errichtet und staatlich überwacht ist."
    },
    {
      "date": "2026-01-13",
      "id": "142209",
      "original_text": "Löschungsankündigung\nBaden-Württemberg Amtsgericht Mannheim HRB 111027\nmsales GmbH – Karlsruhe",
      "type": "Löschungsankündigung",
      "state": "Baden-Württemberg",
      "amtsgericht": "Amtsgericht Mannheim",
      "registernummer": "HRB 111027",
      "registerart": "HRB",
      "company_name": "msales GmbH",
      "company_seat": "Karlsruhe",
      "details": "13.01.2026 (Bekanntmachungsdatum)\n\nBaden-Württemberg Amtsgericht Mannheim HRB 111027\nLöschungsankündigung\n\nmsales GmbH\nGesellschaft mit beschränkter Haftung\nKarlsruhe\n\nDas Gericht beabsichtigt, die Gesellschaft wegen Vermögenslosigkeit im Handelsregister von Amts wegen nach § 394 FamFG zu löschen. Die Frist zur Geltendmachung eines Widerspruchs gegen die beabsichtigte Löschung ist auf einen Monat ab Veröffentlichung bestimmt."
    },
    {
      "date": "2026-01-13",
      "id": "142210",
      "original_text": "Löschungsankündigung\nSaarland Amtsgericht Saarbrücken HRB 108320\nAlabnous Trading GmbH – Saarbrücken",
      "type": "Löschungsankündigung",
      "state": "Saarland",
      "amtsgericht": "Amtsgericht Saarbrücken",
      "registernummer": "HRB 108320",
      "registerart": "HRB",
      "company_name": "Alabnous Trading GmbH",
      "company_seat": "Saarbrücken",
      "details": "13.01.2026 (Bekanntmachungsdatum)\n\nSaarland Amtsgericht Saarbrücken HRB 108320\nLöschungsankündigung\n\nAlabnous Trading GmbH\nGesellschaft mit beschränkter Haftung\nSaarbrücken\n\nEs ist beabsichtigt, die Gesellschaft von Amts wegen gemäß § 394 FamFG wegen Vermögenslosigkeit zu löschen.\nGegen die Löschung von Amts wegen ist das Rechtsmittel des Widerspruchs statthaft. Der Widerspruch ist binnen einer Frist einem Monat beginnend mit dem Tag dieser Veröffentlichung durch Einreichen eines Widerspruchsschreibens -schriftlich oder zur Niederschrift der Geschäftsstelle beim Amtsgericht Saarbrücken, -zentrales Handelsregister-, Mainzerstr.178, 66121 Saarbrücken einzulegen.\nDer Widerspruch muss die Bezeichnung der angefochtenen Löschungsankündigung enthalten sowie die Erklärung, dass Widerspruch eingelegt wird. Er ist vom Widerspruchsführer oder seinem Bevollmächtigten zu unterzeichnen.\nDas Widerspruchsschreiben kann auch in der Form eines elektronischen Dokumentes eingereicht werden, das mit einer qualifizierten elektronischen Signatur nach dem Signaturgesetz versehen sein muss (§§ 14 Abs. 2 FamFG, 130a, 298 ZPO)."
    },
    {
      "date": "2026-01-13",
      "id": "142211",
      "original_text": "Löschungsankündigung\nBerlin Amtsgericht Berlin (Charlottenburg) HRB 257362\nSMI Bauträgergesellschaft mbH – Berlin",
      "type": "Löschungsankündigung",
      "state": "Berlin",
      "amtsgericht": "Amtsgericht Berlin (Charlottenburg)",
      "registernummer": "HRB 257362",
      "registerart": "HRB",
      "company_name": "SMI Bauträgergesellschaft mbH",
      "company_seat": "Berlin",
      "details": "13.01.2026 (Bekanntmachungsdatum)\n\nBerlin Amtsgericht Berlin (Charlottenburg) HRB 257362\nLöschungsankündigung\n\nSMI Bauträgergesellschaft mbH\nGesellschaft mit beschränkter Haftung\nBerlin\n\nBei der nachstehenden Gesellschaft wird das Amtslöschungsverfahren gemäß § 394 FamFG eingeleitet. Widerspruchsfrist 6 Wochen"
    },
    {
      "date": "2026-01-13",
      "id": "142212",
      "original_text": "Löschungsankündigung\nBerlin Amtsgericht Berlin (Charlottenburg) HRB 174426\nLatte Macchiato Gastro UG (haftungsbeschränkt) – Berlin",
      "type": "Löschungsankündigung",
      "state": "Berlin",
      "amtsgericht": "Amtsgericht Berlin (Charlottenburg)",
      "registernummer": "HRB 174426",
      "registerart": "HRB",
      "company_name": "Latte Macchiato Gastro UG (haftungsbeschränkt)",
      "company_seat": "Berlin",
      "details": "13.01.2026 (Bekanntmachungsdatum)\n\nBerlin Amtsgericht Berlin (Charlottenburg) HRB 174426\nLöschungsankündigung\n\nLatte Macchiato Gastro UG (haftungsbeschränkt)\nGesellschaft mit beschränkter Haftung\nBerlin\n\nBei der nachstehenden Gesellschaft wird das Amtslöschungsverfahren gemäß § 394 FamFG eingeleitet. Widerspruchsfrist\n6 Wochen."
    },
    {
      "date": "2026-01-13",
      "id": "142213",
      "original_text": "Einreichung neuer Dokumente\nSchleswig-Holstein Amtsgericht Kiel HRB 21490\nHAC VermögensManagement AG – Neumünster",
      "type": "Einreichung neuer Dokumente",
      "state": "Schleswig-Holstein",
      "amtsgericht": "Amtsgericht Kiel",
      "registernummer": "HRB 21490",
      "registerart": "HRB",
      "company_name": "HAC VermögensManagement AG",
      "company_seat": "Neumünster",
      "details": "13.01.2026 (Bekanntmachungsdatum)\n\nSchleswig-Holstein Amtsgericht Kiel HRB 21490\nEinreichung neuer Dokumente\n\nHAC VermögensManagement AG\nAktiengesellschaft\nNeumünster\n\nAls nicht eingetragen wird veröffentlicht: Eine neue Liste der Aufsichtsratsmitglieder ist eingereicht worden."
    },
    {
      "date": "2026-01-13",
      "id": "142214",
      "original_text": "Sonstige Registerbekanntmachung\nBerlin Amtsgericht Berlin (Charlottenburg) HRB 187942\nSolid Real Invest GmbH – Berlin",
      "type": "Sonstige Registerbekanntmachung",
      "state": "Berlin",
      "amtsgericht": "Amtsgericht Berlin (Charlottenburg)",
      "registernummer": "HRB 187942",
      "registerart": "HRB",
      "company_name": "Solid Real Invest GmbH",
      "company_seat": "Berlin",
      "details": "13.01.2026 (Bekanntmachungsdatum)\n\nBerlin Amtsgericht Berlin (Charlottenburg) HRB 187942\nSonstige Registerbekanntmachung\n\nSolid Real Invest GmbH\nGesellschaft mit beschränkter Haftung\nBerlin\n\nAls nicht eingetragen wird veröffentlicht:\n\nDer andere Vertragsteil hat den Gläubigern dieses Rechtsträgers, deren Forderungen begründet worden sind, bevor die Eintragung der Beendigung dieses Vertrages in das Handelsregister nach § 10 des Handelsgesetzbuches als bekannt gemacht gilt, Sicherheit zu leisten, wenn sie sich binnen sechs Monaten nach der Bekanntmachung der Eintragung zu diesem Zweck bei ihm melden. Dieses Recht steht den Gläubigern nicht zu, die im Fall des Insolvenzverfahrens ein Recht auf vorzugsweise Befriedigung aus der Deckungsmasse haben, die nach gesetzlicher Vorschrift zu ihrem Schutz errichtet und staatlich überwacht ist."
    },
    {
      "date": "2026-01-13",
      "id": "142215",
      "original_text": "Registerbekanntmachung nach dem Umwandlungsgesetz\nBaden-Württemberg Amtsgericht Stuttgart HRB 799434\nJohanna 416 Vermögensverwaltungs GmbH – Oberrot",
      "type": "Registerbekanntmachung nach dem Umwandlungsgesetz",
      "state": "Baden-Württemberg",
      "amtsgericht": "Amtsgericht Stuttgart",
      "registernummer": "HRB 799434",
      "registerart": "HRB",
      "company_name": "Johanna 416 Vermögensverwaltungs GmbH",
      "company_seat": "Oberrot",
      "details": "13.01.2026 (Bekanntmachungsdatum)\n\nBaden-Württemberg Amtsgericht Stuttgart HRB 799434\nRegisterbekanntmachung nach dem Umwandlungsgesetz 13.01.2026 (Eintragungsdatum)\n\nJohanna 416 Vermögensverwaltungs GmbH\nGesellschaft mit beschränkter Haftung\nOberrot\n\nAls nicht eingetragen wird bekanntgemacht:\nDen Gläubigern der an der Verschmelzung beteiligten Rechtsträger ist, wenn sie binnen sechs Monaten nach dem Tag, an dem die Eintragung der Verschmelzung in das Register des Sitzes desjenigen Rechtsträgers, dessen Gläubiger sie sind, nach § 19 Abs. 3 UmwG als bekanntgemacht gilt, ihren Anspruch nach Grund und Höhe schriftlich anmelden, Sicherheit zu leisten, soweit sie nicht Befriedigung verlangen können. Dieses Recht steht den Gläubigern jedoch nur zu, wenn sie glaubhaft machen, dass durch die Verschmelzung die Erfüllung ihrer Forderung gefährdet wird."
    },
    {
      "date": "2026-01-13",
      "id": "142216",
      "original_text": "Löschungsankündigung\nSchleswig-Holstein Amtsgericht Flensburg HRB 15457\nLiebert Beteiligungs UG (haftungsbeschränkt) – Sylt/Westerland",
      "type": "Löschungsankündigung",
      "state": "Schleswig-Holstein",
      "amtsgericht": "Amtsgericht Flensburg",
      "registernummer": "HRB 15457",
      "registerart": "HRB",
      "company_name": "Liebert Beteiligungs UG (haftungsbeschränkt)",
      "company_seat": "Sylt/Westerland",
      "details": "13.01.2026 (Bekanntmachungsdatum)\n\nSchleswig-Holstein Amtsgericht Flensburg HRB 15457\nLöschungsankündigung\n\nLiebert Beteiligungs UG (haftungsbeschränkt)\nGesellschaft mit beschränkter Haftung\nSylt/Westerland\n\nEs ist die Löschung der nachstehenden Gesellschaft wegen Vermögenslosigkeit gemäß § 394 FamFG von Amts wegen beabsichtigt.\nWiderspruchsfrist: 2 Monate"
    },
    {
      "date": "2026-01-13",
      "id": "142217",
      "original_text": "Registerbekanntmachung nach dem Umwandlungsgesetz\nSachsen-Anhalt Amtsgericht Stendal HRB 26320\nHORIBA FuelCon GmbH – Barleben",
      "type": "Registerbekanntmachung nach dem Umwandlungsgesetz",
      "state": "Sachsen-Anhalt",
      "amtsgericht": "Amtsgericht Stendal",
      "registernummer": "HRB 26320",
      "registerart": "HRB",
      "company_name": "HORIBA FuelCon GmbH",
      "company_seat": "Barleben",
      "details": "13.01.2026 (Bekanntmachungsdatum)\n\nSachsen-Anhalt Amtsgericht Stendal HRB 26320\nRegisterbekanntmachung nach dem Umwandlungsgesetz 13.01.2026 (Eintragungsdatum)\n\nHORIBA FuelCon GmbH\nGesellschaft mit beschränkter Haftung\nBarleben\n\nNicht eingetragen:\nAls nicht eingetragen wird veröffentlicht: Den Gläubigern der Gesellschaft, deren Forderungen begründet worden sind bevor die Eintragung der Beendigung des Ergebnisabführungsvertrages in das Handelsregister nach § 10 des Handelsgesetzbuches als bekanntgemacht gilt, hat der andere Vertragsteil Sicherheit zu leisten, wenn sie sich binnen sechs Monaten nach der Bekanntmachung der Eintragung zu diesem Zweck bei ihm melden."
    },
    {
      "date": "2026-01-13",
      "id": "142218",
      "original_text": "Registerbekanntmachung nach dem Umwandlungsgesetz\nMecklenburg-Vorpommern Amtsgericht Rostock HRB 12440\nSonnländer Holding GmbH – Rostock",
      "type": "Registerbekanntmachung nach dem Umwandlungsgesetz",
      "state": "Mecklenburg-Vorpommern",
      "amtsgericht": "Amtsgericht Rostock",
      "registernummer": "HRB 12440",
      "registerart": "HRB",
      "company_name": "Sonnländer Holding GmbH",
      "company_seat": "Rostock",
      "details": "13.01.2026 (Bekanntmachungsdatum)\n\nMecklenburg-Vorpommern Amtsgericht Rostock HRB 12440\nRegisterbekanntmachung nach dem Umwandlungsgesetz 08.01.2026 (Eintragungsdatum)\n\nSonnländer Holding GmbH\nGesellschaft mit beschränkter Haftung\nRostock\n\nAls nicht eingetragen wird veröffentlicht: Den Gläubigern der Gesellschaft, deren Forderungen begründet worden sind, bevor die Eintragung der Beendigung des Vertrages in das Handelsregister nach § 10 des Handelsgesetzbuches als bekanntgemacht gilt, hat der andere Vertragsteil Sicherheit zu leisten, wenn sie sich binnen sechs Monaten nach der Bekanntmachung der Eintragung zu diesem Zweck bei ihm melden."
    },
    {
      "date": "2026-01-13",
      "id": "142219",
      "original_text": "Registerbekanntmachung nach dem Umwandlungsgesetz\nBaden-Württemberg Amtsgericht Stuttgart HRB 206897\nSIS Industrieservice GmbH Büro- /Industriereinigung – Ditzingen",
      "type": "Registerbekanntmachung nach dem Umwandlungsgesetz",
      "state": "Baden-Württemberg",
      "amtsgericht": "Amtsgericht Stuttgart",
      "registernummer": "HRB 206897",
      "registerart": "HRB",
      "company_name": "SIS Industrieservice GmbH Büro- /Industriereinigung",
      "company_seat": "Ditzingen",
      "details": "13.01.2026 (Bekanntmachungsdatum)\n\nBaden-Württemberg Amtsgericht Stuttgart HRB 206897\nRegisterbekanntmachung nach dem Umwandlungsgesetz\n\nSIS Industrieservice GmbH Büro- /Industriereinigung\nGesellschaft mit beschränkter Haftung\nDitzingen\n\nDas Gericht beabsichtigt, die Gesellschaft wegen Vermögenslosigkeit im Handelsregister von Amts wegen nach § 394 FamFG zu löschen. Die Frist zur Geltendmachung eines Widerspruchs gegen die beabsichtigte Löschung ist auf zwei Monate ab Veröffentlichung bestimmt."
    },
    {
      "date": "2026-01-13",
      "id": "142220",
      "original_text": "Löschungsankündigung\nBerlin Amtsgericht Berlin (Charlottenburg) HRB 162377\nASHRAFI MEDICAL TRAVEL & WELLNESS SERVICE UG (haftungsbeschränkt) – Berlin",
      "type": "Löschungsankündigung",
      "state": "Berlin",
      "amtsgericht": "Amtsgericht Berlin (Charlottenburg)",
      "registernummer": "HRB 162377",
      "registerart": "HRB",
      "company_name": "ASHRAFI MEDICAL TRAVEL & WELLNESS SERVICE UG (haftungsbeschränkt)",
      "company_seat": "Berlin",
      "details": "13.01.2026 (Bekanntmachungsdatum)\n\nBerlin Amtsgericht Berlin (Charlottenburg) HRB 162377\nLöschungsankündigung\n\nASHRAFI MEDICAL TRAVEL & WELLNESS SERVICE UG (haftungsbeschränkt)\nGesellschaft mit beschränkter Haftung\nBerlin\n\nBei der nachstehenden Gesellschaft wird das Amtslöschungsverfahren gemäß § 394 FamFG eingeleitet. Widerspruchsfrist 6 Wochen"
    },
    {
      "date": "2026-01-13",
      "id": "142221",
      "original_text": "Löschungsankündigung\nBaden-Württemberg Amtsgericht Mannheim HRB 724914\nHealth Air Technology GmbH – Pforzheim",
      "type": "Löschungsankündigung",
      "state": "Baden-Württemberg",
      "amtsgericht": "Amtsgericht Mannheim",
      "registernummer": "HRB 724914",
      "registerart": "HRB",
      "company_name": "Health Air Technology GmbH",
      "company_seat": "Pforzheim",
      "details": "13.01.2026 (Bekanntmachungsdatum)\n\nBaden-Württemberg Amtsgericht Mannheim HRB 724914\nLöschungsankündigung\n\nHealth Air Technology GmbH\nGesellschaft mit beschränkter Haftung\nPforzheim\n\nDas Gericht beabsichtigt, die Gesellschaft wegen Vermögenslosigkeit im Handelsregister von Amts wegen nach § 394 FamFG zu löschen. Die Frist zur Geltendmachung eines Widerspruchs gegen die beabsichtigte Löschung ist auf einen Monat ab Veröffentlichung bestimmt."
    },
    {
      "date": "2026-01-13",
      "id": "142222",
      "original_text": "Löschungsankündigung\nSachsen-Anhalt Amtsgericht Stendal HRB 20610\nSchreier GmbH – Halberstadt",
      "type": "Löschungsankündigung",
      "state": "Sachsen-Anhalt",
      "amtsgericht": "Amtsgericht Stendal",
      "registernummer": "HRB 20610",
      "registerart": "HRB",
      "company_name": "Schreier GmbH",
      "company_seat": "Halberstadt",
      "details": "13.01.2026 (Bekanntmachungsdatum)\n\nSachsen-Anhalt Amtsgericht Stendal HRB 20610\nLöschungsankündigung\n\nSchreier GmbH\nGesellschaft mit beschränkter Haftung\nHalberstadt\n\nDas Registergericht beabsichtigt, nachfolgende Gesellschaften wegen Vermögenslosigkeit von Amts wegen nach § 394 FamFG zu löschen. Die Frist zur Erhebung eines Widerspruchs gegen die beabsichtigte Löschung wird auf drei Monate festgesetzt."
    },
    {
      "date": "2026-01-13",
      "id": "142223",
      "original_text": "Einreichung neuer Dokumente\nBerlin Amtsgericht Berlin (Charlottenburg) HRB 219813\nPLANETHIC GROUP AG – Berlin",
      "type": "Einreichung neuer Dokumente",
      "state": "Berlin",
      "amtsgericht": "Amtsgericht Berlin (Charlottenburg)",
      "registernummer": "HRB 219813",
      "registerart": "HRB",
      "company_name": "PLANETHIC GROUP AG",
      "company_seat": "Berlin",
      "details": "13.01.2026 (Bekanntmachungsdatum)\n\nBerlin Amtsgericht Berlin (Charlottenburg) HRB 219813\nEinreichung neuer Dokumente\n\nPLANETHIC GROUP AG\nAktiengesellschaft\nBerlin\n\nAls nicht eingetragen wird veröffentlicht: Es wurde eine neue Liste der Aufsichtsratsmitglieder eingereicht (§ 106 AktG)."
    },
    {
      "date": "2026-01-13",
      "id": "142224",
      "original_text": "Registerbekanntmachung nach dem Umwandlungsgesetz\nBerlin Amtsgericht Berlin (Charlottenburg) HRB 201110\nRAW Value 2 GmbH – Berlin",
      "type": "Registerbekanntmachung nach dem Umwandlungsgesetz",
      "state": "Berlin",
      "amtsgericht": "Amtsgericht Berlin (Charlottenburg)",
      "registernummer": "HRB 201110",
      "registerart": "HRB",
      "company_name": "RAW Value 2 GmbH",
      "company_seat": "Berlin",
      "details": "13.01.2026 (Bekanntmachungsdatum)\n\nBerlin Amtsgericht Berlin (Charlottenburg) HRB 201110\nRegisterbekanntmachung nach dem Umwandlungsgesetz 08.01.2026 (Eintragungsdatum)\n\nRAW Value 2 GmbH\nGesellschaft mit beschränkter Haftung\nBerlin\n\nZu Eintragungsnummer 12 vom 08.01.2026 wird als nicht eingetragen veröffentlicht: Den Gläubigern der an der Verschmelzung beteiligten Rechtsträger ist, wenn sie binnen sechs Monaten nach dem Tag, an dem die Eintragung der Verschmelzung in das Register des Sitzes desjenigen Rechtsträgers, dessen Gläubiger sie sind, als bekannt gemacht gilt, ihren Anspruch nach Grund und Höhe schriftlich anmelden, Sicherheit zu leisten, soweit sie nicht Befriedigung verlangen können. Dieses Recht steht den Gläubigern jedoch nur zu, wenn sie glaubhaft machen, dass durch die Verschmelzung die Erfüllung ihrer Forderung gefährdet wird. Das Recht, Sicherheitsleistung zu verlangen, steht Gläubigern nicht zu, die im Falle der Insolvenz ein Recht auf vorzugsweise Befriedigung aus einer Deckungsmasse haben, die nach gesetzlicher Vorschrift zu ihrem Schutz errichtet und staatlich überwacht ist."
    },
    {
      "date": "2026-01-13",
      "id": "142225",
      "original_text": "Registerbekanntmachung nach dem Umwandlungsgesetz\nBerlin Amtsgericht Berlin (Charlottenburg) HRB 176359\nKleinostheim Verwaltungs GmbH – Berlin",
      "type": "Registerbekanntmachung nach dem Umwandlungsgesetz",
      "state": "Berlin",
      "amtsgericht": "Amtsgericht Berlin (Charlottenburg)",
      "registernummer": "HRB 176359",
      "registerart": "HRB",
      "company_name": "Kleinostheim Verwaltungs GmbH",
      "company_seat": "Berlin",
      "details": "13.01.2026 (Bekanntmachungsdatum)\n\nBerlin Amtsgericht Berlin (Charlottenburg) HRB 176359\nRegisterbekanntmachung nach dem Umwandlungsgesetz 08.01.2026 (Eintragungsdatum)\n\nKleinostheim Verwaltungs GmbH\nGesellschaft mit beschränkter Haftung\nBerlin\n\nZu Eintragungsnummer 10 vom 08.01.2026 wird als nicht eingetragen veröffentlicht: Den Gläubigern der an der Verschmelzung beteiligten Rechtsträger ist, wenn sie binnen sechs Monaten nach dem Tag, an dem die Eintragung der Verschmelzung in das Register des Sitzes desjenigen Rechtsträgers, dessen Gläubiger sie sind, als bekannt gemacht gilt, ihren Anspruch nach Grund und Höhe schriftlich anmelden, Sicherheit zu leisten, soweit sie nicht Befriedigung verlangen können. Dieses Recht steht den Gläubigern jedoch nur zu, wenn sie glaubhaft machen, dass durch die Verschmelzung die Erfüllung ihrer Forderung gefährdet wird. Das Recht, Sicherheitsleistung zu verlangen, steht Gläubigern nicht zu, die im Falle der Insolvenz ein Recht auf vorzugsweise Befriedigung aus einer Deckungsmasse haben, die nach gesetzlicher Vorschrift zu ihrem Schutz errichtet und staatlich überwacht ist."
    },
    {
      "date": "2026-01-13",
      "id": "142226",
      "original_text": "Löschungsankündigung\nBrandenburg Amtsgericht Potsdam HRB 28211\nScala Haus GmbH – Brandenburg an der Havel",
      "type": "Löschungsankündigung",
      "state": "Brandenburg",
      "amtsgericht": "Amtsgericht Potsdam",
      "registernummer": "HRB 28211",
      "registerart": "HRB",
      "company_name": "Scala Haus GmbH",
      "company_seat": "Brandenburg an der Havel",
      "details": "13.01.2026 (Bekanntmachungsdatum)\n\nBrandenburg Amtsgericht Potsdam HRB 28211\nLöschungsankündigung\n\nScala Haus GmbH\nGesellschaft mit beschränkter Haftung\nBrandenburg an der Havel\n\nBei der nachstehenden Gesellschaft wird das Amtslöschungsverfahren gemäß § 394 FamFG eingeleitet. Widerspruchsfrist: 8 Wochen"
    },
    {
      "date": "2026-01-13",
      "id": "142227",
      "original_text": "Registerbekanntmachung nach dem Umwandlungsgesetz\nBrandenburg Amtsgericht Frankfurt/Oder HRA 4414\nTaverne Kreta Inh. Aris Chopsonidis e. K. – Bernau bei Berlin",
      "type": "Registerbekanntmachung nach dem Umwandlungsgesetz",
      "state": "Brandenburg",
      "amtsgericht": "Amtsgericht Frankfurt/Oder",
      "registernummer": "HRA 4414",
      "registerart": "HRA",
      "company_name": "Taverne Kreta Inh. Aris Chopsonidis e. K.",
      "company_seat": "Bernau bei Berlin",
      "details": "13.01.2026 (Bekanntmachungsdatum)\n\nBrandenburg Amtsgericht Frankfurt/Oder HRA 4414\nRegisterbekanntmachung nach dem Umwandlungsgesetz 12.01.2026 (Eintragungsdatum)\n\nTaverne Kreta Inh. Aris Chopsonidis e. K.\nEinzelkaufmann / Einzelkauffrau\nBernau bei Berlin\n\nZu Eintragungsnummer 2 vom 12.01.2026 wird als nicht eingetragen veröffentlicht: Als nicht eingetragen wird veröffentlicht:\nDen Gläubigern der an der Umwandlung beteiligten Rechtsträger ist, wenn sie binnen sechs Monaten nach dem Tag, an dem die Eintragung der Umwandlung in das Register des Sitzes desjenigen Rechtsträgers, dessen Gläubiger sie sind, als bekannt gemacht gilt, ihren Anspruch nach Grund und Höhe schriftlich anmelden, Sicherheit zu leisten, soweit sie nicht Befriedigung verlangen können. Dieses Recht steht den Gläubigern jedoch nur zu, wenn sie glaubhaft machen, dass durch die Umwandlung die Erfüllung ihrer Forderung gefährdet wird"
    },
    {
      "date": "2026-01-13",
      "id": "142228",
      "original_text": "Sonstige Registerbekanntmachung\nHamburg Amtsgericht Hamburg HRB 39236\nLETTERBOX FILMPRODUKTION GMBH – Hamburg",
      "type": "Sonstige Registerbekanntmachung",
      "state": "Hamburg",
      "amtsgericht": "Amtsgericht Hamburg",
      "registernummer": "HRB 39236",
      "registerart": "HRB",
      "company_name": "LETTERBOX FILMPRODUKTION GMBH",
      "company_seat": "Hamburg",
      "details": "13.01.2026 (Bekanntmachungsdatum)\n\nHamburg Amtsgericht Hamburg HRB 39236\nSonstige Registerbekanntmachung 12.01.2026 (Eintragungsdatum)\n\nLETTERBOX FILMPRODUKTION GMBH\nGesellschaft mit beschränkter Haftung\nHamburg\n\nAls nicht eingetragen wird bekannt gemacht:  Den Gläubigern der Gesellschaft, deren Forderungen begründet worden sind, bevor die Eintragung der Vertragsbeendigung in das Handelsregister nach § 10 HGB als bekannt gemacht gilt, ist vom anderen Vertragsteil Sicherheit zu leisten, wenn sie sich binnen 6 Monaten nach Bekanntmachung der Eintragung zu diesem Zweck bei ihm melden."
    },
    {
      "date": "2026-01-13",
      "id": "142229",
      "original_text": "Löschungsankündigung\nBerlin Amtsgericht Berlin (Charlottenburg) HRA 63065\nMuHa 24 KG – Berlin",
      "type": "Löschungsankündigung",
      "state": "Berlin",
      "amtsgericht": "Amtsgericht Berlin (Charlottenburg)",
      "registernummer": "HRA 63065",
      "registerart": "HRA",
      "company_name": "MuHa 24 KG",
      "company_seat": "Berlin",
      "details": "13.01.2026 (Bekanntmachungsdatum)\n\nBerlin Amtsgericht Berlin (Charlottenburg) HRA 63065\nLöschungsankündigung\n\nMuHa 24 KG\nKommanditgesellschaft\nBerlin\n\nBei dem nachstehenden Unternehmen / der nachstehenden Gesellschaft wird das Amtslöschungsverfahren gemäß § 31 Abs. 2 HGB eingeleitet. Widerspruchsfrist 1 Monat"
    },
    {
      "date": "2026-01-13",
      "id": "142230",
      "original_text": "Löschungsankündigung\nBerlin Amtsgericht Berlin (Charlottenburg) HRB 211233\nPeganov Entertainment GmbH – Berlin",
      "type": "Löschungsankündigung",
      "state": "Berlin",
      "amtsgericht": "Amtsgericht Berlin (Charlottenburg)",
      "registernummer": "HRB 211233",
      "registerart": "HRB",
      "company_name": "Peganov Entertainment GmbH",
      "company_seat": "Berlin",
      "details": "13.01.2026 (Bekanntmachungsdatum)\n\nBerlin Amtsgericht Berlin (Charlottenburg) HRB 211233\nLöschungsankündigung\n\nPeganov Entertainment GmbH\nGesellschaft mit beschränkter Haftung\nBerlin\n\nBei der nachstehenden Gesellschaft wird das Amtslöschungsverfahren gemäß § 394 FamFG eingeleitet. Widerspruchsfrist 6 Wochen"
    },
    {
      "date": "2026-01-13",
      "id": "142231",
      "original_text": "Löschungsankündigung\nSchleswig-Holstein Amtsgericht Lübeck HRB 11602\nPflegeheim Ratzeburg Betriebsgesellschaft mbH – Ratzeburg",
      "type": "Löschungsankündigung",
      "state": "Schleswig-Holstein",
      "amtsgericht": "Amtsgericht Lübeck",
      "registernummer": "HRB 11602",
      "registerart": "HRB",
      "company_name": "Pflegeheim Ratzeburg Betriebsgesellschaft mbH",
      "company_seat": "Ratzeburg",
      "details": "13.01.2026 (Bekanntmachungsdatum)\n\nSchleswig-Holstein Amtsgericht Lübeck HRB 11602\nLöschungsankündigung\n\nPflegeheim Ratzeburg Betriebsgesellschaft mbH\nGesellschaft mit beschränkter Haftung\nRatzeburg\n\nEs ist die Löschung der nachstehenden Gesellschaft wegen Vermögenslosigkeit gemäß § 394 FamFG beabsichtigt."
    },
    {
      "date": "2026-01-13",
      "id": "142232",
      "original_text": "Registerbekanntmachung nach dem Umwandlungsgesetz\nHamburg Amtsgericht Hamburg VR 24145\nRSV - Rohrleitungssanierungsverband e.V. – Hamburg",
      "type": "Registerbekanntmachung nach dem Umwandlungsgesetz",
      "state": "Hamburg",
      "amtsgericht": "Amtsgericht Hamburg",
      "registernummer": "VR 24145",
      "registerart": "VR",
      "company_name": "RSV - Rohrleitungssanierungsverband e.V.",
      "company_seat": "Hamburg",
      "details": "13.01.2026 (Bekanntmachungsdatum)\n\nHamburg Amtsgericht Hamburg VR 24145\nRegisterbekanntmachung nach dem Umwandlungsgesetz 13.01.2026 (Eintragungsdatum)\n\nRSV - Rohrleitungssanierungsverband e.V.\neingetragener Verein\nHamburg\n\nAls nicht eingetragen wird bekannt gemacht:\nDen Gläubigern der an der Verschmelzung beteiligten Gesellschaften ist, wenn sie binnen sechs Monaten nach dem Tag, an dem die Eintragung der Verschmelzung in das Register des Sitzes derjenigen Rechtsträger deren Gläubiger sie sind, nach § 19 Absatz 3 UmwG als bekannt gemacht gilt, ihren Anspruch nach Grund und Höhe schriftlich anmelden, Sicherheit zu leisten, soweit sie nicht Befriedigung verlangen können. Dieses Recht steht den Gläubigern jedoch nur zu, wenn sie glaubhaft machen, dass durch die Verschmelzung die Erfüllung ihrer Forderung gefährdet wird."
    },
    {
      "date": "2026-01-13",
      "id": "142233",
      "original_text": "Einreichung neuer Dokumente\nSaarland Amtsgericht Saarbrücken HRB 111883\nHYDAC SE – Sulzbach/Saar",
      "type": "Einreichung neuer Dokumente",
      "state": "Saarland",
      "amtsgericht": "Amtsgericht Saarbrücken",
      "registernummer": "HRB 111883",
      "registerart": "HRB",
      "company_name": "HYDAC SE",
      "company_seat": "Sulzbach/Saar",
      "details": "13.01.2026 (Bekanntmachungsdatum)\n\nSaarland Amtsgericht Saarbrücken HRB 111883\nEinreichung neuer Dokumente 13.01.2026 (Eintragungsdatum)\n\nHYDAC SE\nEuropäische Aktiengesellschaft (SE)\nSulzbach/Saar\n\nMit der Neufassung der Satzung wurde mit Beschluss außerdem ein neuer Aufsichtsrat beschlossen."
    },
    {
      "date": "2026-01-13",
      "id": "142234",
      "original_text": "Löschungsankündigung\nBerlin Amtsgericht Berlin (Charlottenburg) HRB 240125\nMonsta Repair & Go GmbH – Berlin",
      "type": "Löschungsankündigung",
      "state": "Berlin",
      "amtsgericht": "Amtsgericht Berlin (Charlottenburg)",
      "registernummer": "HRB 240125",
      "registerart": "HRB",
      "company_name": "Monsta Repair & Go GmbH",
      "company_seat": "Berlin",
      "details": "13.01.2026 (Bekanntmachungsdatum)\n\nBerlin Amtsgericht Berlin (Charlottenburg) HRB 240125\nLöschungsankündigung\n\nMonsta Repair & Go GmbH\nGesellschaft mit beschränkter Haftung\nBerlin\n\nBei der nachstehenden Gesellschaft wird das Amtslöschungsverfahren gemäß § 394 FamFG eingeleitet. Widerspruchsfrist 6 Wochen"
    },
    {
      "date": "2026-01-13",
      "id": "142235",
      "original_text": "Registerbekanntmachung nach dem Umwandlungsgesetz\nBerlin Amtsgericht Berlin (Charlottenburg) HRB 172933\nGT Consulting GmbH – Berlin",
      "type": "Registerbekanntmachung nach dem Umwandlungsgesetz",
      "state": "Berlin",
      "amtsgericht": "Amtsgericht Berlin (Charlottenburg)",
      "registernummer": "HRB 172933",
      "registerart": "HRB",
      "company_name": "GT Consulting GmbH",
      "company_seat": "Berlin",
      "details": "13.01.2026 (Bekanntmachungsdatum)\n\nBerlin Amtsgericht Berlin (Charlottenburg) HRB 172933\nRegisterbekanntmachung nach dem Umwandlungsgesetz 12.01.2026 (Eintragungsdatum)\n\nGT Consulting GmbH\nGesellschaft mit beschränkter Haftung\nBerlin\n\nZu Eintragungsnummer 7 vom 12.01.2026 wird als nicht eingetragen veröffentlicht:\n\nDen Gläubigern der an der Verschmelzung beteiligten Rechtsträger ist, wenn sie binnen sechs Monaten nach dem Tag, an dem die Eintragung der Verschmelzung in das Register des Sitzes desjenigen Rechtsträgers, dessen Gläubiger sie sind, als bekannt gemacht gilt, ihren Anspruch nach Grund und Höhe schriftlich anmelden, Sicherheit zu leisten, soweit sie nicht Befriedigung verlangen können. Dieses Recht steht den Gläubigern jedoch nur zu, wenn sie glaubhaft machen, dass durch die Verschmelzung die Erfüllung ihrer Forderung gefährdet wird. Das Recht, Sicherheitsleistung zu verlangen, steht Gläubigern nicht zu, die im Falle der Insolvenz ein Recht auf vorzugsweise Befriedigung aus einer Deckungsmasse haben, die nach gesetzlicher Vorschrift zu ihrem Schutz errichtet und staatlich überwacht ist."
    },
    {
      "date": "2026-01-13",
      "id": "142236",
      "original_text": "Einreichung neuer Dokumente\nThüringen Amtsgericht Jena HRB 104134\nErfurter Garten- und Ausstellungs gemeinnützige GmbH (ega) – Erfurt",
      "type": "Einreichung neuer Dokumente",
      "state": "Thüringen",
      "amtsgericht": "Amtsgericht Jena",
      "registernummer": "HRB 104134",
      "registerart": "HRB",
      "company_name": "Erfurter Garten- und Ausstellungs gemeinnützige GmbH (ega)",
      "company_seat": "Erfurt",
      "details": "13.01.2026 (Bekanntmachungsdatum)\n\nThüringen Amtsgericht Jena HRB 104134\nEinreichung neuer Dokumente 13.01.2026 (Eintragungsdatum)\n\nErfurter Garten- und Ausstellungs gemeinnützige GmbH (ega)\nGesellschaft mit beschränkter Haftung\nErfurt\n\nBekanntmachung gem. § 52 Abs. 3 Satz 2 GmbHG: Aufgrund einer Veränderung in den Personen der Aufsichtsratsmitglieder ist durch die Geschäftsführer eine neue Liste zum Handelsregister eingereicht worden."
    },
    {
      "date": "2026-01-13",
      "id": "142237",
      "original_text": "Löschungsankündigung\nThüringen Amtsgericht Jena HRB 507989\nelmi Holding GmbH – Erfurt",
      "type": "Löschungsankündigung",
      "state": "Thüringen",
      "amtsgericht": "Amtsgericht Jena",
      "registernummer": "HRB 507989",
      "registerart": "HRB",
      "company_name": "elmi Holding GmbH",
      "company_seat": "Erfurt",
      "details": "13.01.2026 (Bekanntmachungsdatum)\n\nThüringen Amtsgericht Jena HRB 507989\nLöschungsankündigung\n\nelmi Holding GmbH\nGesellschaft mit beschränkter Haftung\nErfurt\n\nDas Registergericht beabsichtigt, die im Handelsregister eingetragene Gesellschaft wegen Vermögenslosigkeit nach § 394 FamFG von Amts wegen zu löschen. Die Frist zur Erhebung eines Widerspruchs gegen die beabsichtigte Löschung wird auf 6 Wochen festgesetzt."
    },
    {
      "date": "2026-01-13",
      "id": "142238",
      "original_text": "Löschungsankündigung\nHamburg Amtsgericht Hamburg HRB 175502\nMKO Bau- und Handelsgesellschaft mbH – Hamburg",
      "type": "Löschungsankündigung",
      "state": "Hamburg",
      "amtsgericht": "Amtsgericht Hamburg",
      "registernummer": "HRB 175502",
      "registerart": "HRB",
      "company_name": "MKO Bau- und Handelsgesellschaft mbH",
      "company_seat": "Hamburg",
      "details": "13.01.2026 (Bekanntmachungsdatum)\n\nHamburg Amtsgericht Hamburg HRB 175502\nLöschungsankündigung\n\nMKO Bau- und Handelsgesellschaft mbH\nGesellschaft mit beschränkter Haftung\nHamburg\n\nDie beabsichtigte Löschung wird nicht mehr weiter verfolgt. Das Löschungsverfahren ist eingestellt worden."
    },
    {
      "date": "2026-01-13",
      "id": "142239",
      "original_text": "Registerbekanntmachung nach dem Umwandlungsgesetz\nSchleswig-Holstein Amtsgericht Kiel HRA 12864\nMaklergesellschaft Röpcke & Partner mbH & Co. KG – Klein Gladebrügge",
      "type": "Registerbekanntmachung nach dem Umwandlungsgesetz",
      "state": "Schleswig-Holstein",
      "amtsgericht": "Amtsgericht Kiel",
      "registernummer": "HRA 12864",
      "registerart": "HRA",
      "company_name": "Maklergesellschaft Röpcke & Partner mbH & Co. KG",
      "company_seat": "Klein Gladebrügge",
      "details": "13.01.2026 (Bekanntmachungsdatum)\n\nSchleswig-Holstein Amtsgericht Kiel HRA 12864\nRegisterbekanntmachung nach dem Umwandlungsgesetz 09.01.2026 (Eintragungsdatum)\n\nMaklergesellschaft Röpcke & Partner mbH & Co. KG\nKommanditgesellschaft\nKlein Gladebrügge\n\nZu Eintragungsnummer 2 vom 09.01.2026 wird als nicht eingetragen veröffentlicht: Den Gläubigern der an der Spaltung beteiligten Rechtsträger ist, wenn sie binnen sechs Monaten nach dem Tag, an dem die Eintragung der Spaltung in das Register des Sitzes desjenigen Rechtsträgers, dessen Gläubiger sie sind,  bekannt gemacht worden ist, ihren Anspruch nach Grund und Höhe schriftlich anmelden, Sicherheit zu leisten, soweit sie nicht Befriedigung verlangen können. Dieses Recht steht den Gläubigern jedoch nur zu, wenn sie glaubhaft machen, dass durch die Spaltung die Erfüllung ihrer Forderung gefährdet wird."
    },
    {
      "date": "2026-01-13",
      "id": "142240",
      "original_text": "Registerbekanntmachung nach dem Umwandlungsgesetz\nBaden-Württemberg Amtsgericht Freiburg HRB 708587\nVusionGroup Deutschland GmbH – Ettenheim",
      "type": "Registerbekanntmachung nach dem Umwandlungsgesetz",
      "state": "Baden-Württemberg",
      "amtsgericht": "Amtsgericht Freiburg",
      "registernummer": "HRB 708587",
      "registerart": "HRB",
      "company_name": "VusionGroup Deutschland GmbH",
      "company_seat": "Ettenheim",
      "details": "13.01.2026 (Bekanntmachungsdatum)\n\nBaden-Württemberg Amtsgericht Freiburg HRB 708587\nRegisterbekanntmachung nach dem Umwandlungsgesetz\n\nVusionGroup Deutschland GmbH\nGesellschaft mit beschränkter Haftung\nEttenheim\n\nEs wird darauf hingewiesen, dass ein Verschmelzungsplan oder sein Entwurf über eine grenzüberschreitende Verschmelzung zur Aufnahme mit folgenden Rechtsträgern beim Handelsregister eingereicht worden ist:\nVusionGroup S.A. mit Sitz in Nanterre/Frankreich (Registre du Commerce et des Sociétés de Nanterre Nr. 479 345 464)\n\nDie Anteilsinhaber, die Gläubiger sowie die zuständigen Betriebsräte der an der grenzüberschreitenden Verschmelzung beteiligten Gesellschaften oder, soweit es keinen Betriebsrat gibt, die Arbeitnehmer der an der grenzüberschreitenden Verschmelzung beteiligten Gesellschaften, können der jeweiligen Gesellschaft spätestens fünf Arbeitstage vor dem Tag der Gesellschafterversammlung Bemerkungen zum Verschmelzungsplan übermitteln."
    },
    {
      "date": "2026-01-13",
      "id": "142241",
      "original_text": "Einreichung neuer Dokumente\nBerlin Amtsgericht Berlin (Charlottenburg) HRB 99726\nBSK 1818 AG – Berlin",
      "type": "Einreichung neuer Dokumente",
      "state": "Berlin",
      "amtsgericht": "Amtsgericht Berlin (Charlottenburg)",
      "registernummer": "HRB 99726",
      "registerart": "HRB",
      "company_name": "BSK 1818 AG",
      "company_seat": "Berlin",
      "details": "13.01.2026 (Bekanntmachungsdatum)\n\nBerlin Amtsgericht Berlin (Charlottenburg) HRB 99726\nEinreichung neuer Dokumente\n\nBSK 1818 AG\nAktiengesellschaft\nBerlin\n\nAls nicht eingetragen wird veröffentlicht: Es wurde eine neue Liste der Aufsichtsratsmitglieder eingereicht (§ 106 AktG)."
    },
    {
      "date": "2026-01-13",
      "id": "142242",
      "original_text": "Registerbekanntmachung nach dem Umwandlungsgesetz\nBaden-Württemberg Amtsgericht Stuttgart HRA 742872\nAlfio Leocata e.K. – Reutlingen",
      "type": "Registerbekanntmachung nach dem Umwandlungsgesetz",
      "state": "Baden-Württemberg",
      "amtsgericht": "Amtsgericht Stuttgart",
      "registernummer": "HRA 742872",
      "registerart": "HRA",
      "company_name": "Alfio Leocata e.K.",
      "company_seat": "Reutlingen",
      "details": "13.01.2026 (Bekanntmachungsdatum)\n\nBaden-Württemberg Amtsgericht Stuttgart HRA 742872\nRegisterbekanntmachung nach dem Umwandlungsgesetz 13.01.2026 (Eintragungsdatum)\n\nAlfio Leocata e.K.\nEinzelkaufmann / Einzelkauffrau\nReutlingen\n\nAls nicht eingetragen wird bekanntgemacht:\nDen Gläubigern der an der Ausgliederung beteiligten Rechtsträger ist, wenn sie binnen sechs Monaten nach dem Tag, an dem die Eintragung der Ausgliederung in das Register des Sitzes desjenigen Rechtsträgers, dessen Gläubiger sie sind, nach § 19 Abs. 3 UmwG als bekanntgemacht gilt, ihren Anspruch nach Grund und Höhe schriftlich anmelden, Sicherheit zu leisten, soweit sie nicht Befriedigung verlangen können. Dieses Recht steht den Gläubigern jedoch nur zu, wenn sie glaubhaft machen, dass durch die Ausgliederung die Erfüllung ihrer Forderung gefährdet wird."
    },
    {
      "date": "2026-01-13",
      "id": "142243",
      "original_text": "Sonstige Registerbekanntmachung\nBaden-Württemberg Amtsgericht Mannheim HRB 7887\nCONTEX MITTELSTANDSBETEILIGUNGEN AKTIENGESELLSCHAFT – Mannheim",
      "type": "Sonstige Registerbekanntmachung",
      "state": "Baden-Württemberg",
      "amtsgericht": "Amtsgericht Mannheim",
      "registernummer": "HRB 7887",
      "registerart": "HRB",
      "company_name": "CONTEX MITTELSTANDSBETEILIGUNGEN AKTIENGESELLSCHAFT",
      "company_seat": "Mannheim",
      "details": "13.01.2026 (Bekanntmachungsdatum)\n\nBaden-Württemberg Amtsgericht Mannheim HRB 7887\nSonstige Registerbekanntmachung\n\nCONTEX MITTELSTANDSBETEILIGUNGEN AKTIENGESELLSCHAFT\nAktiengesellschaft\nMannheim\n\nDie Gesellschaft hat am 05.01.2026 die Liste über die Zusammensetzung des Aufsichtsrats zum Handelsregister eingereicht."
    },
    {
      "date": "2026-01-13",
      "id": "142244",
      "original_text": "Löschungsankündigung\nBaden-Württemberg Amtsgericht Freiburg HRB 719036\nSWISS DESIGNHAUS GmbH – Donaueschingen",
      "type": "Löschungsankündigung",
      "state": "Baden-Württemberg",
      "amtsgericht": "Amtsgericht Freiburg",
      "registernummer": "HRB 719036",
      "registerart": "HRB",
      "company_name": "SWISS DESIGNHAUS GmbH",
      "company_seat": "Donaueschingen",
      "details": "13.01.2026 (Bekanntmachungsdatum)\n\nBaden-Württemberg Amtsgericht Freiburg HRB 719036\nLöschungsankündigung\n\nSWISS DESIGNHAUS GmbH\nGesellschaft mit beschränkter Haftung\nDonaueschingen\n\nAls nicht eingetragen wird bekanntgemacht:\nDas Gericht beabsichtigt, die Gesellschaft wegen Vermögenslosigkeit im Handelsregister von Amts wegen nach § 394 FamFG zu löschen. Die Frist zur Geltendmachung eines Widerspruchs gegen die beabsichtigte Löschung ist auf einen Monat ab Veröffentlichung bestimmt."
    },
    {
      "date": "2026-01-13",
      "id": "142245",
      "original_text": "Registerbekanntmachung nach dem Umwandlungsgesetz\nBerlin Amtsgericht Berlin (Charlottenburg) HRB 109706\nFattal Leonardo Royal München GmbH – Berlin",
      "type": "Registerbekanntmachung nach dem Umwandlungsgesetz",
      "state": "Berlin",
      "amtsgericht": "Amtsgericht Berlin (Charlottenburg)",
      "registernummer": "HRB 109706",
      "registerart": "HRB",
      "company_name": "Fattal Leonardo Royal München GmbH",
      "company_seat": "Berlin",
      "details": "13.01.2026 (Bekanntmachungsdatum)\n\nBerlin Amtsgericht Berlin (Charlottenburg) HRB 109706\nRegisterbekanntmachung nach dem Umwandlungsgesetz 12.01.2026 (Eintragungsdatum)\n\nFattal Leonardo Royal München GmbH\nGesellschaft mit beschränkter Haftung\nBerlin\n\nZu Eintragungsnummer 8 vom 12.01.2026 wird als nicht eingetragen veröffentlicht: Den Gläubigern der an der Verschmelzung beteiligten Rechtsträger ist, wenn sie binnen sechs Monaten nach dem Tag, an dem die Eintragung der Verschmelzung in das Register des Sitzes desjenigen Rechtsträgers, dessen Gläubiger sie sind, als bekannt gemacht gilt, ihren Anspruch nach Grund und Höhe schriftlich anmelden, Sicherheit zu leisten, soweit sie nicht Befriedigung verlangen können. Dieses Recht steht den Gläubigern jedoch nur zu, wenn sie glaubhaft machen, dass durch die Verschmelzung die Erfüllung ihrer Forderung gefährdet wird. Das Recht, Sicherheitsleistung zu verlangen, steht Gläubigern nicht zu, die im Falle der Insolvenz ein Recht auf vorzugsweise Befriedigung aus einer Deckungsmasse haben, die nach gesetzlicher Vorschrift zu ihrem Schutz errichtet und staatlich überwacht ist."
    },
    {
      "date": "2026-01-13",
      "id": "142246",
      "original_text": "Einreichung neuer Dokumente\nBerlin Amtsgericht Berlin (Charlottenburg) HRB 243307\nVGL Publishing AG – Berlin",
      "type": "Einreichung neuer Dokumente",
      "state": "Berlin",
      "amtsgericht": "Amtsgericht Berlin (Charlottenburg)",
      "registernummer": "HRB 243307",
      "registerart": "HRB",
      "company_name": "VGL Publishing AG",
      "company_seat": "Berlin",
      "details": "13.01.2026 (Bekanntmachungsdatum)\n\nBerlin Amtsgericht Berlin (Charlottenburg) HRB 243307\nEinreichung neuer Dokumente\n\nVGL Publishing AG\nAktiengesellschaft\nBerlin\n\nAls nicht eingetragen wird veröffentlicht: Es wurde eine neue Liste der Aufsichtsratsmitglieder eingereicht (§ 106 AktG)."
    },
    {
      "date": "2026-01-13",
      "id": "142247",
      "original_text": "Registerbekanntmachung nach dem Umwandlungsgesetz\nBerlin Amtsgericht Berlin (Charlottenburg) HRB 133924\nMS Verwaltungs GmbH Objekt Moosacher Straße – Berlin",
      "type": "Registerbekanntmachung nach dem Umwandlungsgesetz",
      "state": "Berlin",
      "amtsgericht": "Amtsgericht Berlin (Charlottenburg)",
      "registernummer": "HRB 133924",
      "registerart": "HRB",
      "company_name": "MS Verwaltungs GmbH Objekt Moosacher Straße",
      "company_seat": "Berlin",
      "details": "13.01.2026 (Bekanntmachungsdatum)\n\nBerlin Amtsgericht Berlin (Charlottenburg) HRB 133924\nRegisterbekanntmachung nach dem Umwandlungsgesetz 12.01.2026 (Eintragungsdatum)\n\nMS Verwaltungs GmbH Objekt Moosacher Straße\nGesellschaft mit beschränkter Haftung\nBerlin\n\nZu Eintragungsnummer 5 vom 12.01.2026 wird als nicht eingetragen veröffentlicht: Den Gläubigern der an der Verschmelzung beteiligten Rechtsträger ist, wenn sie binnen sechs Monaten nach dem Tag, an dem die Eintragung der Verschmelzung in das Register des Sitzes desjenigen Rechtsträgers, dessen Gläubiger sie sind, als bekannt gemacht gilt, ihren Anspruch nach Grund und Höhe schriftlich anmelden, Sicherheit zu leisten, soweit sie nicht Befriedigung verlangen können. Dieses Recht steht den Gläubigern jedoch nur zu, wenn sie glaubhaft machen, dass durch die Verschmelzung die Erfüllung ihrer Forderung gefährdet wird. Das Recht, Sicherheitsleistung zu verlangen, steht Gläubigern nicht zu, die im Falle der Insolvenz ein Recht auf vorzugsweise Befriedigung aus einer Deckungsmasse haben, die nach gesetzlicher Vorschrift zu ihrem Schutz errichtet und staatlich überwacht ist."
    },
    {
      "date": "2026-01-13",
      "id": "142248",
      "original_text": "Einreichung neuer Dokumente\nBaden-Württemberg Amtsgericht Freiburg HRB 731434\nCE INVEST Kapitalverwaltungsgesellschaft mbH – Büsingen am Hochrhein",
      "type": "Einreichung neuer Dokumente",
      "state": "Baden-Württemberg",
      "amtsgericht": "Amtsgericht Freiburg",
      "registernummer": "HRB 731434",
      "registerart": "HRB",
      "company_name": "CE INVEST Kapitalverwaltungsgesellschaft mbH",
      "company_seat": "Büsingen am Hochrhein",
      "details": "13.01.2026 (Bekanntmachungsdatum)\n\nBaden-Württemberg Amtsgericht Freiburg HRB 731434\nEinreichung neuer Dokumente\n\nCE INVEST Kapitalverwaltungsgesellschaft mbH\nGesellschaft mit beschränkter Haftung\nBüsingen am Hochrhein\n\nDie Gesellschaft hat am 09.01.2026 die Liste über die Zusammensetzung des Aufsichtsrats zum Handelsregister eingereicht."
    },
    {
      "date": "2026-01-13",
      "id": "142249",
      "original_text": "Registerbekanntmachung nach dem Umwandlungsgesetz\nBaden-Württemberg Amtsgericht Stuttgart HRA 742217\nMillane Friesen e.K. – Trossingen",
      "type": "Registerbekanntmachung nach dem Umwandlungsgesetz",
      "state": "Baden-Württemberg",
      "amtsgericht": "Amtsgericht Stuttgart",
      "registernummer": "HRA 742217",
      "registerart": "HRA",
      "company_name": "Millane Friesen e.K.",
      "company_seat": "Trossingen",
      "details": "13.01.2026 (Bekanntmachungsdatum)\n\nBaden-Württemberg Amtsgericht Stuttgart HRA 742217\nRegisterbekanntmachung nach dem Umwandlungsgesetz 13.01.2026 (Eintragungsdatum)\n\nMillane Friesen e.K.\nEinzelkaufmann / Einzelkauffrau\nTrossingen\n\nDen Gläubigern der an der Ausgliederung beteiligten Rechtsträger ist, wenn sie binnen sechs Monaten nach dem Tag, an dem die Eintragung der Ausgliederung in das Register des Sitzes desjenigen Rechtsträgers, dessen Gläubiger sie sind, nach § 19 Abs. 3 UmwG als bekanntgemacht gilt, ihren Anspruch nach Grund und Höhe schriftlich anmelden, Sicherheit zu leisten, soweit sie nicht Befriedigung verlangen können. Dieses Recht steht den Gläubigern jedoch nur zu, wenn sie glaubhaft machen, dass durch die Ausgliederung die Erfüllung ihrer Forderung gefährdet wird."
    },
    {
      "date": "2026-01-13",
      "id": "142250",
      "original_text": "Löschungsankündigung\nSachsen-Anhalt Amtsgericht Stendal HRA 30736\n\"moderne Haarpflege\" Merseburg Verwaltungs GmbH & Co. Besitz KG – Merseburg",
      "type": "Löschungsankündigung",
      "state": "Sachsen-Anhalt",
      "amtsgericht": "Amtsgericht Stendal",
      "registernummer": "HRA 30736",
      "registerart": "HRA",
      "company_name": "\"moderne Haarpflege\" Merseburg Verwaltungs GmbH & Co. Besitz KG",
      "company_seat": "Merseburg",
      "details": "13.01.2026 (Bekanntmachungsdatum)\n\nSachsen-Anhalt Amtsgericht Stendal HRA 30736\nLöschungsankündigung 23.05.2007 (Eintragungsdatum)\n\n\"moderne Haarpflege\" Merseburg Verwaltungs GmbH & Co. Besitz KG\nKommanditgesellschaft\nMerseburg\n\nDas Registergericht beabsichtigt, vorstehende im Handelsregister eingetragene Gesellschaft von Amts wegen nach § 394 FamFG zu löschen. Die Frist zu Erhebung eines Widerspruchs wird auf zwei Monate festgesetzt."
    },
    {
      "date": "2026-01-13",
      "id": "142251",
      "original_text": "Registerbekanntmachung nach dem Umwandlungsgesetz\nHamburg Amtsgericht Hamburg HRA 56411\nKonrad Zippel Spediteur GmbH & Co. KG – Hamburg",
      "type": "Registerbekanntmachung nach dem Umwandlungsgesetz",
      "state": "Hamburg",
      "amtsgericht": "Amtsgericht Hamburg",
      "registernummer": "HRA 56411",
      "registerart": "HRA",
      "company_name": "Konrad Zippel Spediteur GmbH & Co. KG",
      "company_seat": "Hamburg",
      "details": "13.01.2026 (Bekanntmachungsdatum)\n\nHamburg Amtsgericht Hamburg HRA 56411\nRegisterbekanntmachung nach dem Umwandlungsgesetz 13.01.2026 (Eintragungsdatum)\n\nKonrad Zippel Spediteur GmbH & Co. KG\nKommanditgesellschaft\nHamburg\n\nAls nicht eingetragen wird bekannt gemacht:\nDen Gläubigern der an der formwechselnden Umwandlung beteiligten Gesellschaften ist, wenn sie binnen sechs Monaten nach dem Tag, an dem die Eintragung der formwechselnden Umwandlung in das Register des Sitzes desjenigen Rechtsträgers, dessen Gläubiger sie sind, nach § 19 Absatz 3 UmwG als bekannt gemacht gilt, ihren Anspruch nach Grund und Höhe schriftlich anmelden, Sicherheit zu leisten, soweit sie nicht Befriedigung verlangen können. Dieses Recht steht den Gläubigern jedoch nur zu, wenn sie glaubhaft machen, dass durch die formwechselnde Umwandlung die Erfüllung ihrer Forderung gefährdet wird."
    },
    {
      "date": "2026-01-13",
      "id": "142252",
      "original_text": "Löschungsankündigung\nSaarland Amtsgericht Saarbrücken HRB 104683\nCCS UG (haftungsbeschränkt) – Marpingen",
      "type": "Löschungsankündigung",
      "state": "Saarland",
      "amtsgericht": "Amtsgericht Saarbrücken",
      "registernummer": "HRB 104683",
      "registerart": "HRB",
      "company_name": "CCS UG (haftungsbeschränkt)",
      "company_seat": "Marpingen",
      "details": "13.01.2026 (Bekanntmachungsdatum)\n\nSaarland Amtsgericht Saarbrücken HRB 104683\nLöschungsankündigung\n\nCCS UG (haftungsbeschränkt)\nGesellschaft mit beschränkter Haftung\nMarpingen\n\nEs ist beabsichtigt, die Gesellschaft von Amts wegen gemäß § 394 FamFG wegen Vermögenslosigkeit zu löschen.\nGegen die Löschung von Amts wegen ist das Rechtsmittel des Widerspruchs statthaft. Der Widerspruch ist binnen einer Frist zwei Monaten beginnend mit dem Tag dieser Veröffentlichung durch Einreichen eines Widerspruchsschreibens -schriftlich oder zur Niederschrift der Geschäftsstelle beim Amtsgericht Saarbrücken, -zentrales Handelsregister-, Mainzerstr.178, 66121 Saarbrücken einzulegen.\nDer Widerspruch muss die Bezeichnung der angefochtenen Löschungsankündigung enthalten sowie die Erklärung, dass Widerspruch eingelegt wird. Er ist vom Widerspruchsführer oder seinem Bevollmächtigten zu unterzeichnen.\nDas Widerspruchsschreiben kann auch in der Form eines elektronischen Dokumentes eingereicht werden, das mit einer qualifizierten elektronischen Signatur nach dem Signaturgesetz versehen sein muss (§§ 14 Abs. 2 FamFG, 130a, 298 ZPO)."
    },
    {
      "date": "2026-01-13",
      "id": "142253",
      "original_text": "Löschungsankündigung\nSaarland Amtsgericht Saarbrücken HRB 100967\nBlickfang Marken- und Designagentur GmbH – Saarbrücken",
      "type": "Löschungsankündigung",
      "state": "Saarland",
      "amtsgericht": "Amtsgericht Saarbrücken",
      "registernummer": "HRB 100967",
      "registerart": "HRB",
      "company_name": "Blickfang Marken- und Designagentur GmbH",
      "company_seat": "Saarbrücken",
      "details": "13.01.2026 (Bekanntmachungsdatum)\n\nSaarland Amtsgericht Saarbrücken HRB 100967\nLöschungsankündigung\n\nBlickfang Marken- und Designagentur GmbH\nGesellschaft mit beschränkter Haftung\nSaarbrücken\n\nEs ist beabsichtigt, die Gesellschaft von Amts wegen gemäß § 394 FamFG wegen Vermögenslosigkeit zu löschen.\nGegen die Löschung von Amts wegen ist das Rechtsmittel des Widerspruchs statthaft. Der Widerspruch ist binnen einer Frist drei Monaten beginnend mit dem Tag dieser Veröffentlichung durch Einreichen eines Widerspruchsschreibens -schriftlich oder zur Niederschrift der Geschäftsstelle beim Amtsgericht Saarbrücken, -zentrales Handelsregister-, Mainzerstr.178, 66121 Saarbrücken einzulegen.\nDer Widerspruch muss die Bezeichnung der angefochtenen Löschungsankündigung enthalten sowie die Erklärung, dass Widerspruch eingelegt wird. Er ist vom Widerspruchsführer oder seinem Bevollmächtigten zu unterzeichnen.\nDas Widerspruchsschreiben kann auch in der Form eines elektronischen Dokumentes eingereicht werden, das mit einer qualifizierten elektronischen Signatur nach dem Signaturgesetz versehen sein muss (§§ 14 Abs. 2 FamFG, 130a, 298 ZPO)."
    },
    {
      "date": "2026-01-13",
      "id": "142254",
      "original_text": "Sonstige Registerbekanntmachung\nHamburg Amtsgericht Hamburg HRB 82059\nHASPA Projektentwicklungs- und Beteiligungsgesellschaft mbH – Hamburg",
      "type": "Sonstige Registerbekanntmachung",
      "state": "Hamburg",
      "amtsgericht": "Amtsgericht Hamburg",
      "registernummer": "HRB 82059",
      "registerart": "HRB",
      "company_name": "HASPA Projektentwicklungs- und Beteiligungsgesellschaft mbH",
      "company_seat": "Hamburg",
      "details": "13.01.2026 (Bekanntmachungsdatum)\n\nHamburg Amtsgericht Hamburg HRB 82059\nSonstige Registerbekanntmachung\n\nHASPA Projektentwicklungs- und Beteiligungsgesellschaft mbH\nGesellschaft mit beschränkter Haftung\nHamburg\n\nAls nicht eingetragen wird bekannt gemacht: Liste des Aufsichtsrats wurde eingereicht."
    },
    {
      "date": "2026-01-13",
      "id": "142255",
      "original_text": "Löschungsankündigung\nBaden-Württemberg Amtsgericht Mannheim HRB 700276\nBrainchild GmbH – Schwetzingen",
      "type": "Löschungsankündigung",
      "state": "Baden-Württemberg",
      "amtsgericht": "Amtsgericht Mannheim",
      "registernummer": "HRB 700276",
      "registerart": "HRB",
      "company_name": "Brainchild GmbH",
      "company_seat": "Schwetzingen",
      "details": "13.01.2026 (Bekanntmachungsdatum)\n\nBaden-Württemberg Amtsgericht Mannheim HRB 700276\nLöschungsankündigung\n\nBrainchild GmbH\nGesellschaft mit beschränkter Haftung\nSchwetzingen\n\nDas Gericht beabsichtigt, die Gesellschaft wegen Vermögenslosigkeit im Handelsregister von Amts wegen nach § 394 FamFG zu löschen. Die Frist zur Geltendmachung eines Widerspruchs gegen die beabsichtigte Löschung ist auf einen Monat ab Veröffentlichung bestimmt."
    },
    {
      "date": "2026-01-13",
      "id": "142256",
      "original_text": "Löschungsankündigung\nBerlin Amtsgericht Berlin (Charlottenburg) HRB 249646\nSCL Konzept GmbH – Berlin",
      "type": "Löschungsankündigung",
      "state": "Berlin",
      "amtsgericht": "Amtsgericht Berlin (Charlottenburg)",
      "registernummer": "HRB 249646",
      "registerart": "HRB",
      "company_name": "SCL Konzept GmbH",
      "company_seat": "Berlin",
      "details": "13.01.2026 (Bekanntmachungsdatum)\n\nBerlin Amtsgericht Berlin (Charlottenburg) HRB 249646\nLöschungsankündigung\n\nSCL Konzept GmbH\nGesellschaft mit beschränkter Haftung\nBerlin\n\nBei der nachstehenden Gesellschaft wird das Amtslöschungsverfahren gemäß § 394 FamFG eingeleitet. Widerspruchsfrist 6 Wochen"
    },
    {
      "date": "2026-01-13",
      "id": "142257",
      "original_text": "Registerbekanntmachung nach dem Umwandlungsgesetz\nSchleswig-Holstein Amtsgericht Pinneberg HRB 12110\nKuchel Verwaltungs GmbH – Heide",
      "type": "Registerbekanntmachung nach dem Umwandlungsgesetz",
      "state": "Schleswig-Holstein",
      "amtsgericht": "Amtsgericht Pinneberg",
      "registernummer": "HRB 12110",
      "registerart": "HRB",
      "company_name": "Kuchel Verwaltungs GmbH",
      "company_seat": "Heide",
      "details": "13.01.2026 (Bekanntmachungsdatum)\n\nSchleswig-Holstein Amtsgericht Pinneberg HRB 12110\nRegisterbekanntmachung nach dem Umwandlungsgesetz 08.01.2026 (Eintragungsdatum)\n\nKuchel Verwaltungs GmbH\nGesellschaft mit beschränkter Haftung\nHeide\n\nZu Eintragungsnummer 3 vom 08.01.2026 wird als nicht eingetragen veröffentlicht: Den Gläubigern der an der Verschmelzung beteiligten Rechtsträger ist, wenn sie binnen sechs Monaten nach dem Tag, an dem die Eintragung der Verschmelzung in das Register des Sitzes desjenigen Rechtsträgers, dessen Gläubiger sie sind, als bekannt gemacht gilt, ihren Anspruch nach Grund und Höhe schriftlich anmelden, Sicherheit zu leisten, soweit sie nicht Befriedigung verlangen können. Dieses Recht steht den Gläubigern jedoch nur zu, wenn sie glaubhaft machen, dass durch die Verschmelzung die Erfüllung ihrer Forderung gefährdet wird. Das Recht, Sicherheitsleistung zu verlangen, steht Gläubigern nicht zu, die im Falle der Insolvenz ein Recht auf vorzugsweise Befriedigung aus einer Deckungsmasse haben, die nach gesetzlicher Vorschrift zu ihrem Schutz errichtet und staatlich überwacht ist."
    },
    {
      "date": "2026-01-13",
      "id": "142258",
      "original_text": "Registerbekanntmachung nach dem Umwandlungsgesetz\nBerlin Amtsgericht Berlin (Charlottenburg) HRB 200488\nPariser Platz ZwischenHoldCo GmbH – Berlin",
      "type": "Registerbekanntmachung nach dem Umwandlungsgesetz",
      "state": "Berlin",
      "amtsgericht": "Amtsgericht Berlin (Charlottenburg)",
      "registernummer": "HRB 200488",
      "registerart": "HRB",
      "company_name": "Pariser Platz ZwischenHoldCo GmbH",
      "company_seat": "Berlin",
      "details": "13.01.2026 (Bekanntmachungsdatum)\n\nBerlin Amtsgericht Berlin (Charlottenburg) HRB 200488\nRegisterbekanntmachung nach dem Umwandlungsgesetz 25.09.2025 (Eintragungsdatum)\n\nPariser Platz ZwischenHoldCo GmbH\nGesellschaft mit beschränkter Haftung\nBerlin\n\nZu Eintragungsnummer 5 vom 25.09.2025 wird als nicht eingetragen veröffentlicht: Die Gesellschaft hat den Entwurf eines Formwechselplans vom 06.01.2026 betreffend die grenzüberschreitende Verlegung des Satzungssitzes der Gesellschaft nach Luxemburg gemäß §§ 333 ff. UmwG zum Handelsregister des Amtsgerichts Charlottenburg eingereicht.\n\n§ 336 UmwG i.V.m. § 308 Abs. 1 S. 2 Nr. 2 UmwG:\nAn dem grenzüberschreitenden Formwechsel ist die Pariser Platz ZwischenHoldCo GmbH mit Satzungssitz in Berlin, Deutschland, eine nach deutschem Recht bestehende Gesellschaft mit beschrankter Haftung, beteiligt. Nach dem grenziiberschreitenden Formwechsel wird die Gesellschaft die Rechtsform einer reinen Societe a responsabilith limithe (S.a r.l.), eine Gesellschaft mit beschrankter Haftung nach dem Recht des Graherzogtums Luxemburg, annehmen und als Pariser Platz ZwischenHoldCo S.a r.l mit Satzungssitz in Luxemburg, Grollherzogtum Luxemburg flu mieren.\n3. § 336 UmwG i.V.m. § 308 Abs. 1 S. 2 Nr. 3 UmwG:\nDie Gesellschaft ist im Handelsregister des Amtsgerichts Berlin (Charlottenburg) unter der HRB 200488 B eingetragen.\nHandelsregisternummer Die Gesellschaft ist zudem im Handels- und Gesellschaftsregister von Luxemburg (Registre de commerce et des societes Luxembourg) unter der Nummer B228609 eingetragen, welche auch\nkünftig fortbestehen wird.\n4. § 336 UmwG i.V.m. § 308 Abs. 1 S. 2 Nr. 4 UmwG:\nDie Gesellschafterversammlung zum Beschluss des grenzüberschreitenden Formwechsels ist für den Tag geplant, der auf den Ablauf von einem Monat nach dem Tag der Registerbekanntmachung des Formwechselplans folgt, oder ggfs. den nächsten Arbeitstag (wobei Samstage, Sonntage und bundesweite Feiertage nicht als Arbeitstage zählen)."
    },
    {
      "date": "2026-01-13",
      "id": "142259",
      "original_text": "Löschungsankündigung\nSachsen-Anhalt Amtsgericht Stendal HRB 32571\nAW-Bau GmbH – Magdeburg",
      "type": "Löschungsankündigung",
      "state": "Sachsen-Anhalt",
      "amtsgericht": "Amtsgericht Stendal",
      "registernummer": "HRB 32571",
      "registerart": "HRB",
      "company_name": "AW-Bau GmbH",
      "company_seat": "Magdeburg",
      "details": "13.01.2026 (Bekanntmachungsdatum)\n\nSachsen-Anhalt Amtsgericht Stendal HRB 32571\nLöschungsankündigung\n\nAW-Bau GmbH\nGesellschaft mit beschränkter Haftung\nMagdeburg\n\nDas Registergericht beabsichtigt, nachfolgende Gesellschaften wegen Vermögenslosigkeit von Amts wegen nach § 394 FamFG zu löschen. Die Frist zur Erhebung eines Widerspruchs gegen die beabsichtigte Löschung wird auf drei Monate festgesetzt."
    },
    {
      "date": "2026-01-13",
      "id": "142260",
      "original_text": "Einreichung neuer Dokumente\nBaden-Württemberg Amtsgericht Stuttgart HRB 733711\nEnergie Horb am Neckar GmbH – Horb am Neckar",
      "type": "Einreichung neuer Dokumente",
      "state": "Baden-Württemberg",
      "amtsgericht": "Amtsgericht Stuttgart",
      "registernummer": "HRB 733711",
      "registerart": "HRB",
      "company_name": "Energie Horb am Neckar GmbH",
      "company_seat": "Horb am Neckar",
      "details": "13.01.2026 (Bekanntmachungsdatum)\n\nBaden-Württemberg Amtsgericht Stuttgart HRB 733711\nEinreichung neuer Dokumente\n\nEnergie Horb am Neckar GmbH\nGesellschaft mit beschränkter Haftung\nHorb am Neckar\n\nDie Gesellschaft hat am 08.01.2026 die Liste über die Zusammensetzung des Aufsichtsrats zum Handelsregister eingereicht."
    },
    {
      "date": "2026-01-13",
      "id": "142261",
      "original_text": "Sonstige Registerbekanntmachung\nBaden-Württemberg Amtsgericht Stuttgart HRB 2728\nRBS wave GmbH – Stuttgart",
      "type": "Sonstige Registerbekanntmachung",
      "state": "Baden-Württemberg",
      "amtsgericht": "Amtsgericht Stuttgart",
      "registernummer": "HRB 2728",
      "registerart": "HRB",
      "company_name": "RBS wave GmbH",
      "company_seat": "Stuttgart",
      "details": "13.01.2026 (Bekanntmachungsdatum)\n\nBaden-Württemberg Amtsgericht Stuttgart HRB 2728\nSonstige Registerbekanntmachung\n\nRBS wave GmbH\nGesellschaft mit beschränkter Haftung\nStuttgart\n\nDen Gläubigern der Gesellschaft, deren Forderungen begründet worden sind, bevor die Eintragung der Beendigung des Vertrages in das Handelsregister nach § 10 HGB als bekanntgemacht gilt, ist vom anderen Vertragsteil Sicherheit zu leisten, wenn sie sich binnen sechs Monaten nach der Bekanntmachung zu diesem Zweck bei ihm melden."
    },
    {
      "date": "2026-01-13",
      "id": "142262",
      "original_text": "Registerbekanntmachung nach dem Umwandlungsgesetz\nNordrhein-Westfalen Amtsgericht Coesfeld HRA 10218\nSchreinerei Oendorf e.K. – Dülmen",
      "type": "Registerbekanntmachung nach dem Umwandlungsgesetz",
      "state": "Nordrhein-Westfalen",
      "amtsgericht": "Amtsgericht Coesfeld",
      "registernummer": "HRA 10218",
      "registerart": "HRA",
      "company_name": "Schreinerei Oendorf e.K.",
      "company_seat": "Dülmen",
      "details": "13.01.2026 (Bekanntmachungsdatum)\n\nNordrhein-Westfalen Amtsgericht Coesfeld HRA 10218\nRegisterbekanntmachung nach dem Umwandlungsgesetz 13.01.2026 (Eintragungsdatum)\n\nSchreinerei Oendorf e.K.\nEinzelkaufmann\nDülmen\n\nDen Gläubigern der an der Ausgliederung beteiligten Rechtsträger ist, wenn sie binnen sechs Monaten nach dem Tag, an dem die Eintragung der Ausgliederung in das Register des Sitzes desjenigen Rechtsträgers, dessen Gläubiger sie sind, nach § 19 Absatz 3 UmwG als bekanntgemacht gilt, ihren Anspruch nach Grund und Höhe schriftlich anmelden, Sicherheit zu leisten, soweit sie nicht Befriedigung verlangen können. Dieses Recht steht den Gläubigern jedoch nur zu, wenn sie glaubhaft machen, dass durch die Ausgliederung die Erfüllung ihrer Forderung gefährdet wird."
    },
    {
      "date": "2026-01-13",
      "id": "142263",
      "original_text": "Löschungsankündigung\nSchleswig-Holstein Amtsgericht Lübeck HRB 1236 BS\nKlebe + Dichtungstechnik Steffen Ladiges Gesellschaft mit beschränkter Haftung – Stockelsdorf",
      "type": "Löschungsankündigung",
      "state": "Schleswig-Holstein",
      "amtsgericht": "Amtsgericht Lübeck",
      "registernummer": "HRB 1236 BS",
      "registerart": "HRB",
      "company_name": "Klebe + Dichtungstechnik Steffen Ladiges Gesellschaft mit beschränkter Haftung",
      "company_seat": "Stockelsdorf",
      "details": "13.01.2026 (Bekanntmachungsdatum)\n\nSchleswig-Holstein Amtsgericht Lübeck HRB 1236 BS\nLöschungsankündigung\n\nKlebe + Dichtungstechnik Steffen Ladiges Gesellschaft mit beschränkter Haftung\nGesellschaft mit beschränkter Haftung\nStockelsdorf\n\nIn der Handelsregistersache der\n\nKlebe + Dichtungstechnik Steffen Ladiges Gesellschaft mit beschränkter Haftung\n\nist Herr Peter Ladiges laut Mitteilung des Nachlassgerichts Lübeck nach Aktenlage Erbe nach der verstorbenen Mitgesellschafterin Bärbel Gertrud Ladiges.\nDer noch eingetragene Geschäftsführer und Mitgesellschafter Steffen Ladiges ist mit unbekanntem Aufenthalt verzogen.\n\nEs ergeben sich aus den mir vorliegenden Unterlagen Anhaltspunkte dafür, dass die Gesellschaft vermögenslos ist:\n\n- Schreiben der Berufsgenossenschaft Handel und Warenlogistik vom 21.07.2025\n- Schreiben der IHK zu Lübeck vom 01.12.2025\n\nIch beabsichtige daher, die Gesellschaft wegen Vermögenslosigkeit gemäß § 394 FamFG zu löschen.\n\nIch bestimme eine Frist von einem Monat zur Geltendmachung eines Widerspruchs gegen die Löschung, § 394 Abs. 2 S. 1 FamFG.\n\nGgf. bitte ich, mir binnen derselben Frist mitzuteilen, ob die genannte Gesellschaft noch Vermögen hat, welche Vermögensgegenstände sie besitzt, ob die Gesellschaft noch Partei eines noch nicht rechtskräftig abgeschlossenen Rechtsstreits ist, ob noch Rückforderungen der Gesellschaft gegenüber dem Finanzamt bestehen, ob die Gesellschaft noch an einer anderen Gesellschaft beteiligt ist, ob Grundbucheintragungen der Gesellschaft bestehen oder ob sonst noch eine Abwicklung stattfindet.\n\nNach Fristablauf ohne Widerspruch wird die Gesellschaft gelöscht.\n\nMit freundlichen Grüßen\n\nDammann\nDipl.-Rechtspflegerin (FH)"
    },
    {
      "date": "2026-01-13",
      "id": "142264",
      "original_text": "Löschungsankündigung\nSchleswig-Holstein Amtsgericht Lübeck HRB 24404\nSBO Restaurants Lübeck GmbH – Lübeck",
      "type": "Löschungsankündigung",
      "state": "Schleswig-Holstein",
      "amtsgericht": "Amtsgericht Lübeck",
      "registernummer": "HRB 24404",
      "registerart": "HRB",
      "company_name": "SBO Restaurants Lübeck GmbH",
      "company_seat": "Lübeck",
      "details": "13.01.2026 (Bekanntmachungsdatum)\n\nSchleswig-Holstein Amtsgericht Lübeck HRB 24404\nLöschungsankündigung\n\nSBO Restaurants Lübeck GmbH\nGesellschaft mit beschränkter Haftung\nLübeck\n\nEs ist die Löschung der nachstehenden Gesellschaft wegen Vermögenslosigkeit gemäß § 394 FamFG beabsichtigt."
    },
    {
      "date": "2026-01-13",
      "id": "142265",
      "original_text": "Registerbekanntmachung nach dem Umwandlungsgesetz\nNordrhein-Westfalen Amtsgericht Coesfeld HRA 10230\nOendorf Konzepte GmbH & Co. KG – Dülmen",
      "type": "Registerbekanntmachung nach dem Umwandlungsgesetz",
      "state": "Nordrhein-Westfalen",
      "amtsgericht": "Amtsgericht Coesfeld",
      "registernummer": "HRA 10230",
      "registerart": "HRA",
      "company_name": "Oendorf Konzepte GmbH & Co. KG",
      "company_seat": "Dülmen",
      "details": "13.01.2026 (Bekanntmachungsdatum)\n\nNordrhein-Westfalen Amtsgericht Coesfeld HRA 10230\nRegisterbekanntmachung nach dem Umwandlungsgesetz 13.01.2026 (Eintragungsdatum)\n\nOendorf Konzepte GmbH & Co. KG\nKommanditgesellschaft\nDülmen\n\nDen Gläubigern der an der Ausgliederung beteiligten Rechtsträger ist, wenn sie binnen sechs Monaten nach dem Tag, an dem die Eintragung der Ausgliederung in das Register des Sitzes desjenigen Rechtsträgers, dessen Gläubiger sie sind, nach § 19 Absatz 3 UmwG als bekanntgemacht gilt, ihren Anspruch nach Grund und Höhe schriftlich anmelden, Sicherheit zu leisten, soweit sie nicht Befriedigung verlangen können. Dieses Recht steht den Gläubigern jedoch nur zu, wenn sie glaubhaft machen, dass durch die Ausgliederung die Erfüllung ihrer Forderung gefährdet wird."
    },
    {
      "date": "2026-01-13",
      "id": "142266",
      "original_text": "Löschungsankündigung\nSachsen Amtsgericht Dresden HRB 33069\nPassionly Curious gemeinnützige UG (haftungsbeschränkt) – Dresden",
      "type": "Löschungsankündigung",
      "state": "Sachsen",
      "amtsgericht": "Amtsgericht Dresden",
      "registernummer": "HRB 33069",
      "registerart": "HRB",
      "company_name": "Passionly Curious gemeinnützige UG (haftungsbeschränkt)",
      "company_seat": "Dresden",
      "details": "13.01.2026 (Bekanntmachungsdatum)\n\nSachsen Amtsgericht Dresden HRB 33069\nLöschungsankündigung\n\nPassionly Curious gemeinnützige UG (haftungsbeschränkt)\nGesellschaft mit beschränkter Haftung\nDresden\n\nDas Registergericht beabsichtigt, die im Handelsregister eingetragene Gesellschaft von Amts wegen nach § 394 FamFG zu löschen. Die Frist zu Erhebung eines Widerspruchs gegen die beabsichtigte Löschung wird auf einen Monat festgesetzt."
    },
    {
      "date": "2026-01-13",
      "id": "142267",
      "original_text": "Einreichung neuer Dokumente\nSachsen Amtsgericht Chemnitz HRB 36610\nMinerals and Metals Corporation - MMC AG – Halsbrücke",
      "type": "Einreichung neuer Dokumente",
      "state": "Sachsen",
      "amtsgericht": "Amtsgericht Chemnitz",
      "registernummer": "HRB 36610",
      "registerart": "HRB",
      "company_name": "Minerals and Metals Corporation - MMC AG",
      "company_seat": "Halsbrücke",
      "details": "13.01.2026 (Bekanntmachungsdatum)\n\nSachsen Amtsgericht Chemnitz HRB 36610\nEinreichung neuer Dokumente\n\nMinerals and Metals Corporation - MMC AG\nAktiengesellschaft\nHalsbrücke\n\nAm 15.12.2025 wurde beim Handelsregister des Amtsgerichts Chemnitz die Liste der Mitglieder des Aufsichtsrats gemäß § 106 AktG eingereicht."
    },
    {
      "date": "2026-01-13",
      "id": "142268",
      "original_text": "Löschungsankündigung\nSachsen Amtsgericht Dresden HRB 38513\nDomagalaPlanta UG (haftungsbeschränkt) – Weißwasser",
      "type": "Löschungsankündigung",
      "state": "Sachsen",
      "amtsgericht": "Amtsgericht Dresden",
      "registernummer": "HRB 38513",
      "registerart": "HRB",
      "company_name": "DomagalaPlanta UG (haftungsbeschränkt)",
      "company_seat": "Weißwasser",
      "details": "13.01.2026 (Bekanntmachungsdatum)\n\nSachsen Amtsgericht Dresden HRB 38513\nLöschungsankündigung\n\nDomagalaPlanta UG (haftungsbeschränkt)\nGesellschaft mit beschränkter Haftung\nWeißwasser\n\nDas Registergericht beabsichtigt, die im Handelsregister eingetragene Gesellschaft von Amts wegen nach § 394 FamFG zu löschen. Die Frist zu Erhebung eines Widerspruchs gegen die beabsichtigte Löschung wird auf einen Monat festgesetzt."
    },
    {
      "date": "2026-01-13",
      "id": "142269",
      "original_text": "Löschungsankündigung\nSachsen Amtsgericht Dresden HRB 38018\nTRUE.Organic GmbH – Dresden",
      "type": "Löschungsankündigung",
      "state": "Sachsen",
      "amtsgericht": "Amtsgericht Dresden",
      "registernummer": "HRB 38018",
      "registerart": "HRB",
      "company_name": "TRUE.Organic GmbH",
      "company_seat": "Dresden",
      "details": "13.01.2026 (Bekanntmachungsdatum)\n\nSachsen Amtsgericht Dresden HRB 38018\nLöschungsankündigung\n\nTRUE.Organic GmbH\nGesellschaft mit beschränkter Haftung\nDresden\n\nDas Registergericht beabsichtigt, die im Handelsregister eingetragene Gesellschaft von Amts wegen nach § 394 FamFG zu löschen. Die Frist zu Erhebung eines Widerspruchs gegen die beabsichtigte Löschung wird auf einen Monat festgesetzt."
    },
    {
      "date": "2026-01-13",
      "id": "142270",
      "original_text": "Löschungsankündigung\nSachsen Amtsgericht Dresden HRB 30545\nTransport- und Abschleppdienst Weißwasser GmbH – Weißwasser",
      "type": "Löschungsankündigung",
      "state": "Sachsen",
      "amtsgericht": "Amtsgericht Dresden",
      "registernummer": "HRB 30545",
      "registerart": "HRB",
      "company_name": "Transport- und Abschleppdienst Weißwasser GmbH",
      "company_seat": "Weißwasser",
      "details": "13.01.2026 (Bekanntmachungsdatum)\n\nSachsen Amtsgericht Dresden HRB 30545\nLöschungsankündigung\n\nTransport- und Abschleppdienst Weißwasser GmbH\nGesellschaft mit beschränkter Haftung\nWeißwasser\n\nDas Registergericht beabsichtigt, die im Handelsregister eingetragene Gesellschaft von Amts wegen nach § 394 FamFG zu löschen. Die Frist zu Erhebung eines Widerspruchs gegen die beabsichtigte Löschung wird auf einen Monat festgesetzt."
    },
    {
      "date": "2026-01-13",
      "id": "142271",
      "original_text": "Einreichung neuer Dokumente\nBaden-Württemberg Amtsgericht Stuttgart HRB 723491\nVMS Holding AG – Stuttgart",
      "type": "Einreichung neuer Dokumente",
      "state": "Baden-Württemberg",
      "amtsgericht": "Amtsgericht Stuttgart",
      "registernummer": "HRB 723491",
      "registerart": "HRB",
      "company_name": "VMS Holding AG",
      "company_seat": "Stuttgart",
      "details": "13.01.2026 (Bekanntmachungsdatum)\n\nBaden-Württemberg Amtsgericht Stuttgart HRB 723491\nEinreichung neuer Dokumente\n\nVMS Holding AG\nAktiengesellschaft\nStuttgart\n\nAls nicht eingetragen wird bekanntgemacht:\nDie Gesellschaft hat am 02.01.2026 die Liste über die Zusammensetzung des Aufsichtsrats zum Handelsregister eingereicht."
    },
    {
      "date": "2026-01-13",
      "id": "142272",
      "original_text": "Einreichung neuer Dokumente\nBaden-Württemberg Amtsgericht Ulm HRB 610052\nMILEI Gesellschaft mit beschränkter Haftung – Leutkirch im Allgäu",
      "type": "Einreichung neuer Dokumente",
      "state": "Baden-Württemberg",
      "amtsgericht": "Amtsgericht Ulm",
      "registernummer": "HRB 610052",
      "registerart": "HRB",
      "company_name": "MILEI Gesellschaft mit beschränkter Haftung",
      "company_seat": "Leutkirch im Allgäu",
      "details": "13.01.2026 (Bekanntmachungsdatum)\n\nBaden-Württemberg Amtsgericht Ulm HRB 610052\nEinreichung neuer Dokumente\n\nMILEI Gesellschaft mit beschränkter Haftung\nGesellschaft mit beschränkter Haftung\nLeutkirch im Allgäu\n\nDie Gesellschaft hat am 23.12.2025 die Liste über die Zusammensetzung des Aufsichtsrats zum Handelsregister eingereicht.\nAls nicht eingetragen wird bekanntgemacht:"
    },
    {
      "date": "2026-01-13",
      "id": "142273",
      "original_text": "Registerbekanntmachung nach dem Umwandlungsgesetz\nNiedersachsen Amtsgericht Walsrode HRB 213291\nWinkelmann Automatenservice GmbH – Lilienthal",
      "type": "Registerbekanntmachung nach dem Umwandlungsgesetz",
      "state": "Niedersachsen",
      "amtsgericht": "Amtsgericht Walsrode",
      "registernummer": "HRB 213291",
      "registerart": "HRB",
      "company_name": "Winkelmann Automatenservice GmbH",
      "company_seat": "Lilienthal",
      "details": "13.01.2026 (Bekanntmachungsdatum)\n\nNiedersachsen Amtsgericht Walsrode HRB 213291\nRegisterbekanntmachung nach dem Umwandlungsgesetz 13.01.2026 (Eintragungsdatum)\n\nWinkelmann Automatenservice GmbH\nGesellschaft mit beschränkter Haftung\nLilienthal\n\nDen Gläubigern der an der Ausgliederung beteiligten Rechtsträger ist, wenn sie binnen sechs Monaten nach dem Tag, an dem die Eintragung der Ausgliederung in das Register des Sitzes desjenigen Rechtsträgers, dessen Gläubiger sie sind, nach § 19 Abs. 3 UmwG als bekannt gemacht gilt, ihren Anspruch nach Grund und Höhe schriftlich anmelden, Sicherheit zu leisten, soweit sie nicht Befriedigung verlangen können. Dieses Recht steht den Gläubigern jedoch nur zu, wenn sie glaubhaft machen, dass durch die Ausgliederung die Erfüllung der Forderung gefährdet wird."
    },
    {
      "date": "2026-01-13",
      "id": "142274",
      "original_text": "Registerbekanntmachung nach dem Umwandlungsgesetz\nNiedersachsen Amtsgericht Walsrode HRA 205089\nWinkelmann Automatenservice e.K. – Lilienthal",
      "type": "Registerbekanntmachung nach dem Umwandlungsgesetz",
      "state": "Niedersachsen",
      "amtsgericht": "Amtsgericht Walsrode",
      "registernummer": "HRA 205089",
      "registerart": "HRA",
      "company_name": "Winkelmann Automatenservice e.K.",
      "company_seat": "Lilienthal",
      "details": "13.01.2026 (Bekanntmachungsdatum)\n\nNiedersachsen Amtsgericht Walsrode HRA 205089\nRegisterbekanntmachung nach dem Umwandlungsgesetz 13.01.2026 (Eintragungsdatum)\n\nWinkelmann Automatenservice e.K.\nEinzelkaufmann / Einzelkauffrau\nLilienthal\n\nDen Gläubigern der an der Ausgliederung beteiligten Rechtsträger ist, wenn sie binnen sechs Monaten nach dem Tag, an dem die Eintragung der Ausgliederung in das Register des Sitzes desjenigen Rechtsträgers, dessen Gläubiger sie sind, nach § 19 Abs. 3 UmwG als bekannt gemacht gilt, ihren Anspruch nach Grund und Höhe schriftlich anmelden, Sicherheit zu leisten, soweit sie nicht Befriedigung verlangen können. Dieses Recht steht den Gläubigern jedoch nur zu, wenn sie glaubhaft machen, dass durch die Ausgliederung die Erfüllung der Forderung gefährdet wird."
    },
    {
      "date": "2026-01-13",
      "id": "142275",
      "original_text": "Löschungsankündigung\nNiedersachsen Amtsgericht Osnabrück HRB 216583\nMedican Campus Germany GmbH – Lingen (Ems)",
      "type": "Löschungsankündigung",
      "state": "Niedersachsen",
      "amtsgericht": "Amtsgericht Osnabrück",
      "registernummer": "HRB 216583",
      "registerart": "HRB",
      "company_name": "Medican Campus Germany GmbH",
      "company_seat": "Lingen (Ems)",
      "details": "13.01.2026 (Bekanntmachungsdatum)\n\nNiedersachsen Amtsgericht Osnabrück HRB 216583\nLöschungsankündigung\n\nMedican Campus Germany GmbH\nGesellschaft mit beschränkter Haftung\nLingen (Ems)\n\nDas Registergericht beabsichtigt, die Gesellschaft von Amts wegen nach § 394 FamFG wegen Vermögenslosigkeit zu löschen. Die Frist zur Erhebung eines Widerspruchs ist auf 1 Monat ab dieser Registerbekanntmachung festgesetzt."
    },
    {
      "date": "2026-01-13",
      "id": "142276",
      "original_text": "Registerbekanntmachung nach dem Umwandlungsgesetz\nNiedersachsen Amtsgericht Osnabrück HRB 18211\nMUUUH! Consulting GmbH – Osnabrück",
      "type": "Registerbekanntmachung nach dem Umwandlungsgesetz",
      "state": "Niedersachsen",
      "amtsgericht": "Amtsgericht Osnabrück",
      "registernummer": "HRB 18211",
      "registerart": "HRB",
      "company_name": "MUUUH! Consulting GmbH",
      "company_seat": "Osnabrück",
      "details": "13.01.2026 (Bekanntmachungsdatum)\n\nNiedersachsen Amtsgericht Osnabrück HRB 18211\nRegisterbekanntmachung nach dem Umwandlungsgesetz 13.01.2026 (Eintragungsdatum)\n\nMUUUH! Consulting GmbH\nGesellschaft mit beschränkter Haftung\nOsnabrück\n\nDen Gläubigern der an der Verschmelzung beteiligten Rechtsträger ist, wenn sie binnen sechs Monaten nach dem Tag, an dem die Eintragung der Verschmelzung in das Register des Sitzes desjenigen Rechtsträgers, dessen Gläubiger sie sind, nach § 19  Abs.  3 UmwG als bekannt gemacht gilt, ihren Anspruch nach Grund und Höhe schriftlich anmelden, Sicherheit zu leisten, soweit sie nicht Befriedigung verlangen können. Dieses Recht steht den Gläubigern jedoch nur zu, wenn sie glaubhaft machen, dass durch die Verschmelzung die Erfüllung der Forderung gefährdet wird."
    },
    {
      "date": "2026-01-13",
      "id": "142277",
      "original_text": "Löschungsankündigung\nNiedersachsen Amtsgericht Stadthagen HRB 201410\nGEM, Gesellschaft für Energiegewinnung und Materialrecycling mbH – Rinteln",
      "type": "Löschungsankündigung",
      "state": "Niedersachsen",
      "amtsgericht": "Amtsgericht Stadthagen",
      "registernummer": "HRB 201410",
      "registerart": "HRB",
      "company_name": "GEM, Gesellschaft für Energiegewinnung und Materialrecycling mbH",
      "company_seat": "Rinteln",
      "details": "13.01.2026 (Bekanntmachungsdatum)\n\nNiedersachsen Amtsgericht Stadthagen HRB 201410\nLöschungsankündigung\n\nGEM, Gesellschaft für Energiegewinnung und Materialrecycling mbH\nGesellschaft mit beschränkter Haftung\nRinteln\n\nDas Registergericht beabsichtigt, die Gesellschaft von Amts wegen nach § 394 FamFG zu löschen. Die Frist zur Erhebung eines Widerspruchs ist auf 1 Monat ab dieser Registerbekanntmachung festgesetzt."
    },
    {
      "date": "2026-01-13",
      "id": "142278",
      "original_text": "Einreichung neuer Dokumente\nNiedersachsen Amtsgericht Lüneburg HRB 101182 früher Amtsgericht Celle\nWintershall Aktiengesellschaft – Celle",
      "type": "Einreichung neuer Dokumente",
      "state": "Niedersachsen",
      "amtsgericht": "Amtsgericht Lüneburg",
      "registernummer": "HRB 101182",
      "registerart": "HRB",
      "company_name": "Wintershall Aktiengesellschaft",
      "company_seat": "Celle",
      "former_amtsgericht": "Celle",
      "details": "13.01.2026 (Bekanntmachungsdatum)\n\nNiedersachsen Amtsgericht Lüneburg HRB 101182 früher Amtsgericht Celle\nEinreichung neuer Dokumente 13.01.2026 (Eintragungsdatum)\n\nWintershall Aktiengesellschaft\nAktiengesellschaft\nCelle\n\nDie Liste der Mitglieder des Aufsichtsrats wurde beim Registergericht eingereicht."
    },
    {
      "date": "2026-01-13",
      "id": "142279",
      "original_text": "Löschungsankündigung\nNiedersachsen Amtsgericht Osnabrück HRB 130476 früher Amtsgericht Nordhorn\nBASTO Wasser- und Luftreinigungssysteme GmbH – Schüttorf",
      "type": "Löschungsankündigung",
      "state": "Niedersachsen",
      "amtsgericht": "Amtsgericht Osnabrück",
      "registernummer": "HRB 130476",
      "registerart": "HRB",
      "company_name": "BASTO Wasser- und Luftreinigungssysteme GmbH",
      "company_seat": "Schüttorf",
      "former_amtsgericht": "Nordhorn",
      "details": "13.01.2026 (Bekanntmachungsdatum)\n\nNiedersachsen Amtsgericht Osnabrück HRB 130476 früher Amtsgericht Nordhorn\nLöschungsankündigung\n\nBASTO Wasser- und Luftreinigungssysteme GmbH\nGesellschaft mit beschränkter Haftung\nSchüttorf\n\nDas Registergericht beabsichtigt, die Gesellschaft von Amts wegen nach § 394 FamFG wegen Vermögenslosigkeit zu löschen. Die Frist zur Erhebung eines Widerspruchs ist auf 1 Monat ab dieser Registerbekanntmachung festgesetzt."
    },
    {
      "date": "2026-01-13",
      "id": "142280",
      "original_text": "Sonstige Registerbekanntmachung\nNiedersachsen Amtsgericht Hildesheim HRB 200413\nVan der Valk Hotel Hildesheim GmbH – Hildesheim",
      "type": "Sonstige Registerbekanntmachung",
      "state": "Niedersachsen",
      "amtsgericht": "Amtsgericht Hildesheim",
      "registernummer": "HRB 200413",
      "registerart": "HRB",
      "company_name": "Van der Valk Hotel Hildesheim GmbH",
      "company_seat": "Hildesheim",
      "details": "13.01.2026 (Bekanntmachungsdatum)\n\nNiedersachsen Amtsgericht Hildesheim HRB 200413\nSonstige Registerbekanntmachung 13.01.2026 (Eintragungsdatum)\n\nVan der Valk Hotel Hildesheim GmbH\nGesellschaft mit beschränkter Haftung\nHildesheim\n\nDen Gläubigern der Gesellschaft, deren Forderungen begründet worden sind, bevor die Eintragung der Beendigung des Vertrages in das Handelsregister nach § 10 HGB als bekanntgemacht gilt, ist vom anderen Vertragsteil Sicherheit zu leisten, wenn sie sich binnen sechs Monaten nach der Bekanntmachung zu diesem Zweck bei ihm melden."
    },
    {
      "date": "2026-01-13",
      "id": "142281",
      "original_text": "Registerbekanntmachung nach dem Umwandlungsgesetz\nNiedersachsen Amtsgericht Osnabrück HRB 221887\nSchmitz Verwaltung GmbH – Osnabrück",
      "type": "Registerbekanntmachung nach dem Umwandlungsgesetz",
      "state": "Niedersachsen",
      "amtsgericht": "Amtsgericht Osnabrück",
      "registernummer": "HRB 221887",
      "registerart": "HRB",
      "company_name": "Schmitz Verwaltung GmbH",
      "company_seat": "Osnabrück",
      "details": "13.01.2026 (Bekanntmachungsdatum)\n\nNiedersachsen Amtsgericht Osnabrück HRB 221887\nRegisterbekanntmachung nach dem Umwandlungsgesetz 13.01.2026 (Eintragungsdatum)\n\nSchmitz Verwaltung GmbH\nGesellschaft mit beschränkter Haftung\nOsnabrück\n\nDen Gläubigern der an der Verschmelzung beteiligten Rechtsträger ist, wenn sie binnen sechs Monaten nach dem Tag, an dem die Eintragung der Verschmelzung in das Register des Sitzes desjenigen Rechtsträgers, dessen Gläubiger sie sind, nach § 19  Abs.  3 UmwG als bekannt gemacht gilt, ihren Anspruch nach Grund und Höhe schriftlich anmelden, Sicherheit zu leisten, soweit sie nicht Befriedigung verlangen können. Dieses Recht steht den Gläubigern jedoch nur zu, wenn sie glaubhaft machen, dass durch die Verschmelzung die Erfüllung der Forderung gefährdet wird."
    },
    {
      "date": "2026-01-13",
      "id": "142282",
      "original_text": "Registerbekanntmachung nach dem Umwandlungsgesetz\nNiedersachsen Amtsgericht Walsrode HRB 207180\nBerg Group Holding GmbH – Diepholz",
      "type": "Registerbekanntmachung nach dem Umwandlungsgesetz",
      "state": "Niedersachsen",
      "amtsgericht": "Amtsgericht Walsrode",
      "registernummer": "HRB 207180",
      "registerart": "HRB",
      "company_name": "Berg Group Holding GmbH",
      "company_seat": "Diepholz",
      "details": "13.01.2026 (Bekanntmachungsdatum)\n\nNiedersachsen Amtsgericht Walsrode HRB 207180\nRegisterbekanntmachung nach dem Umwandlungsgesetz 13.01.2026 (Eintragungsdatum)\n\nBerg Group Holding GmbH\nGesellschaft mit beschränkter Haftung\nDiepholz\n\nDen Gläubigern der an der Verschmelzung beteiligten Rechtsträger ist, wenn sie binnen sechs Monaten nach dem Tag, an dem die Eintragung der Verschmelzung in das Register des Sitzes desjenigen Rechtsträgers, dessen Gläubiger sie sind, nach § 19  Abs.  3 UmwG als bekannt gemacht gilt, ihren Anspruch nach Grund und Höhe schriftlich anmelden, Sicherheit zu leisten, soweit sie nicht Befriedigung verlangen können. Dieses Recht steht den Gläubigern jedoch nur zu, wenn sie glaubhaft machen, dass durch die Verschmelzung die Erfüllung der Forderung gefährdet wird."
    },
    {
      "date": "2026-01-13",
      "id": "142283",
      "original_text": "Sonstige Registerbekanntmachung\nNiedersachsen Amtsgericht Göttingen HRB 112017\nContiTech MGW GmbH – Hann. Münden",
      "type": "Sonstige Registerbekanntmachung",
      "state": "Niedersachsen",
      "amtsgericht": "Amtsgericht Göttingen",
      "registernummer": "HRB 112017",
      "registerart": "HRB",
      "company_name": "ContiTech MGW GmbH",
      "company_seat": "Hann. Münden",
      "details": "13.01.2026 (Bekanntmachungsdatum)\n\nNiedersachsen Amtsgericht Göttingen HRB 112017\nSonstige Registerbekanntmachung 13.01.2026 (Eintragungsdatum)\n\nContiTech MGW GmbH\nGesellschaft mit beschränkter Haftung\nHann. Münden\n\nDen Gläubigern der Gesellschaft, deren Forderungen begründet worden sind, bevor die Eintragung der Beendigung des Vertrages in das Handelsregister nach § 10 HGB als bekanntgemacht gilt, ist vom anderen Vertragsteil Sicherheit zu leisten, wenn sie sich binnen sechs Monaten nach der Bekanntmachung zu diesem Zweck bei ihm melden."
    },
    {
      "date": "2026-01-13",
      "id": "142284",
      "original_text": "Registerbekanntmachung nach dem Umwandlungsgesetz\nNiedersachsen Amtsgericht Osnabrück HRB 222379\nHerpers Verwaltungs GmbH – Osnabrück",
      "type": "Registerbekanntmachung nach dem Umwandlungsgesetz",
      "state": "Niedersachsen",
      "amtsgericht": "Amtsgericht Osnabrück",
      "registernummer": "HRB 222379",
      "registerart": "HRB",
      "company_name": "Herpers Verwaltungs GmbH",
      "company_seat": "Osnabrück",
      "details": "13.01.2026 (Bekanntmachungsdatum)\n\nNiedersachsen Amtsgericht Osnabrück HRB 222379\nRegisterbekanntmachung nach dem Umwandlungsgesetz 13.01.2026 (Eintragungsdatum)\n\nHerpers Verwaltungs GmbH\nGesellschaft mit beschränkter Haftung\nOsnabrück\n\nDen Gläubigern der an der Verschmelzung beteiligten Rechtsträger ist, wenn sie binnen sechs Monaten nach dem Tag, an dem die Eintragung der Verschmelzung in das Register des Sitzes desjenigen Rechtsträgers, dessen Gläubiger sie sind, nach § 19  Abs.  3 UmwG als bekannt gemacht gilt, ihren Anspruch nach Grund und Höhe schriftlich anmelden, Sicherheit zu leisten, soweit sie nicht Befriedigung verlangen können. Dieses Recht steht den Gläubigern jedoch nur zu, wenn sie glaubhaft machen, dass durch die Verschmelzung die Erfüllung der Forderung gefährdet wird."
    },
    {
      "date": "2026-01-13",
      "id": "142285",
      "original_text": "Löschungsankündigung\nBremen Amtsgericht Bremen HRA 11378\nMargot Häfker GmbH & Co. KG – Bremen",
      "type": "Löschungsankündigung",
      "state": "Bremen",
      "amtsgericht": "Amtsgericht Bremen",
      "registernummer": "HRA 11378",
      "registerart": "HRA",
      "company_name": "Margot Häfker GmbH & Co. KG",
      "company_seat": "Bremen",
      "details": "13.01.2026 (Bekanntmachungsdatum)\n\nBremen Amtsgericht Bremen HRA 11378\nLöschungsankündigung\n\nMargot Häfker GmbH & Co. KG\nKommanditgesellschaft\nBremen\n\nEs ist beabsichtigt die im Handelsregister eingetragene Firma von Amts wegen gemäß § 31 Abs.2 HGB zu löschen. Gegen die Löschung kann beim AG Bremen schriftlich oder zu Protokoll der Geschäftsstelle Widerspruch eingelegt werden. Widerspruchsfrist 4 Wochen."
    },
    {
      "date": "2026-01-13",
      "id": "142286",
      "original_text": "Löschungsankündigung\nRheinland-Pfalz Amtsgericht Ludwigshafen a.Rhein (Ludwigshafen) HRB 66165\nWeinstraßen Druck & Medienhaus UG (haftungsbeschränkt) – Neustadt an der Weinstraße",
      "type": "Löschungsankündigung",
      "state": "Rheinland-Pfalz",
      "amtsgericht": "Amtsgericht Ludwigshafen a.Rhein (Ludwigshafen)",
      "registernummer": "HRB 66165",
      "registerart": "HRB",
      "company_name": "Weinstraßen Druck & Medienhaus UG (haftungsbeschränkt)",
      "company_seat": "Neustadt an der Weinstraße",
      "details": "13.01.2026 (Bekanntmachungsdatum)\n\nRheinland-Pfalz Amtsgericht Ludwigshafen a.Rhein (Ludwigshafen) HRB 66165\nLöschungsankündigung 13.01.2026 (Eintragungsdatum)\n\nWeinstraßen Druck & Medienhaus UG (haftungsbeschränkt)\nGesellschaft mit beschränkter Haftung\nNeustadt an der Weinstraße\n\nDas Registergericht beabsichtigt die Gesellschaft von Amts wegen nach § 394 FamFG zu löschen. Die Frist zur Erhebung eines Widerspruchs ist auf drei Monate festgesetzt."
    },
    {
      "date": "2026-01-13",
      "id": "142287",
      "original_text": "Löschungsankündigung\nRheinland-Pfalz Amtsgericht Koblenz HRB 15091\nFine Stairs GmbH – Plaidt",
      "type": "Löschungsankündigung",
      "state": "Rheinland-Pfalz",
      "amtsgericht": "Amtsgericht Koblenz",
      "registernummer": "HRB 15091",
      "registerart": "HRB",
      "company_name": "Fine Stairs GmbH",
      "company_seat": "Plaidt",
      "details": "13.01.2026 (Bekanntmachungsdatum)\n\nRheinland-Pfalz Amtsgericht Koblenz HRB 15091\nLöschungsankündigung 13.01.2026 (Eintragungsdatum)\n\nFine Stairs GmbH\nGesellschaft mit beschränkter Haftung\nPlaidt\n\nDas Registergericht beabsichtigt die Gesellschaft von Amts wegen nach § 394 FamFG zu löschen. Die Frist zur Erhebung eines Widerspruchs ist auf #DV.Fr(Text=\"Bitte wählen Sie die Widerspruchsfristaus!\",Eingabe=\"einen Monat\",\"zwei Monate\",\"drei Monate\",\"#insert(Text=\"Freitext\")\"|\"freier Text\") festgesetzt."
    },
    {
      "date": "2026-01-13",
      "id": "142288",
      "original_text": "Löschungsankündigung\nRheinland-Pfalz Amtsgericht Koblenz HRB 15091\nFine Stairs GmbH – Plaidt",
      "type": "Löschungsankündigung",
      "state": "Rheinland-Pfalz",
      "amtsgericht": "Amtsgericht Koblenz",
      "registernummer": "HRB 15091",
      "registerart": "HRB",
      "company_name": "Fine Stairs GmbH",
      "company_seat": "Plaidt",
      "details": "13.01.2026 (Bekanntmachungsdatum)\n\nRheinland-Pfalz Amtsgericht Koblenz HRB 15091\nLöschungsankündigung 13.01.2026 (Eintragungsdatum)\n\nFine Stairs GmbH\nGesellschaft mit beschränkter Haftung\nPlaidt\n\nDas Registergericht beabsichtigt die Gesellschaft von Amts wegen nach § 394 FamFG zu löschen. Die Frist zur Erhebung eines Widerspruchs ist auf zwei Monate festgesetzt."
    },
    {
      "date": "2026-01-13",
      "id": "142289",
      "original_text": "Löschungsankündigung\nNordrhein-Westfalen Amtsgericht Mönchengladbach HRB 11611\nDERMO GmbH – Mönchengladbach",
      "type": "Löschungsankündigung",
      "state": "Nordrhein-Westfalen",
      "amtsgericht": "Amtsgericht Mönchengladbach",
      "registernummer": "HRB 11611",
      "registerart": "HRB",
      "company_name": "DERMO GmbH",
      "company_seat": "Mönchengladbach",
      "details": "13.01.2026 (Bekanntmachungsdatum)\n\nNordrhein-Westfalen Amtsgericht Mönchengladbach HRB 11611\nLöschungsankündigung\n\nDERMO GmbH\nGesellschaft mit beschränkter Haftung\nMönchengladbach\n\nDas Registergericht beabsichtigt, die im Handelsregister eingetragene Gesellschaft gemäß § 394 Absatz 1 FamFG wegen Vermögenslosigkeit von Amts wegen zu löschen. Gegen diese Verfügung kann Widerspruch eingelegt werden. Die Frist zur Erhebung eines Widerspruchs gegen die beabsichtigte Löschung von Amts wegen ist auf drei Monate festgesetzt."
    },
    {
      "date": "2026-01-13",
      "id": "142290",
      "original_text": "Löschungsankündigung\nNordrhein-Westfalen Amtsgericht Aachen HRB 26814\nHalal Gourmet UG (haftungsbeschränkt) – Aachen",
      "type": "Löschungsankündigung",
      "state": "Nordrhein-Westfalen",
      "amtsgericht": "Amtsgericht Aachen",
      "registernummer": "HRB 26814",
      "registerart": "HRB",
      "company_name": "Halal Gourmet UG (haftungsbeschränkt)",
      "company_seat": "Aachen",
      "details": "13.01.2026 (Bekanntmachungsdatum)\n\nNordrhein-Westfalen Amtsgericht Aachen HRB 26814\nLöschungsankündigung\n\nHalal Gourmet UG (haftungsbeschränkt)\nGesellschaft mit beschränkter Haftung\nAachen\n\nDas Registergericht beabsichtigt, von Amts wegen die Gesellschaft wegen Vermögenslosigkeit nach § 394 FamFG zu löschen, weil das Finanzamt Aachen-Stadt mit Schreiben vom 17.12.2025 Umstände mitgeteilt hat, aufgrund derer das Gericht davon überzeugt ist, dass die Gesellschaft vollständig vermögenslos ist.\n\nZur Geltendmachung des Widerspruchs gegen die beabsichtigte Löschung wird hiermit eine Frist von einem Monat ab Veröffentlichung dieser Ankündigung bestimmt.\n\nRechtsbehelfsbelehrung:\n\nGegen diese Verfügung kann Widerspruch eingelegt werden. Zum Widerspruch ist jeder berechtigt, der an der Unterlassung der Löschung ein berechtigtes Interesse hat.\n\nDer Widerspruch ist bei dem Amtsgericht Aachen, Adalbertsteinweg 92, 52070 Aachen schriftlich in deutscher Sprache oder zur Niederschrift der Geschäftsstelle einzulegen. Der Widerspruch kann auch zur Niederschrift der Geschäftsstelle eines jeden Amtsgerichtes abgegeben werden.\n\nDer Widerspruch muss spätestens innerhalb der gesetzten Frist nach der Bekanntgabe der Verfügung bei dem Amtsgericht Aachen eingegangen sein. Dies gilt auch dann, wenn der Widerspruch zur Niederschrift der Geschäftsstelle eines anderen Amtsgerichtes abgegeben wurde. Die Frist beginnt mit der Bekanntgabe der Verfügung durch Veröffentlichung. Fällt das Ende der Frist auf einen Sonntag, einen allgemeinen Feiertag oder Sonnabend, so endet die Frist mit Ablauf des nächsten Werktages.\n\nDer Widerspruch muss die Bezeichnung der angefochtenen Verfügung sowie die Erklärung enthalten, dass Widerspruch gegen diese Verfügung eingelegt wird. Er ist zu unterzeichnen und soll begründet werden.\n\nDie Einlegung ist auch durch Übertragung eines elektronischen Dokuments an die elektronische Poststelle des Gerichts möglich. Das elektronische Dokument muss für die Bearbeitung durch das Gericht geeignet und mit einer qualifizierten elektronischen Signatur der verantwortenden Person versehen sein oder von der verantwortenden Person signiert und auf einem sicheren Übermittlungsweg gemäß § 130 a ZPO nach näherer Maßgabe der Verordnung über die technischen Rahmenbedingungen des elektronischen Rechtsverkehrs und über das besondere elektronische Behördenpostfach (BGBl. I, S. 3803) eingereicht werden. Weitere Informationen erhalten Sie auf der Internetseite www.justiz.de."
    },
    {
      "date": "2026-01-13",
      "id": "142291",
      "original_text": "Einreichung neuer Dokumente\nNordrhein-Westfalen Amtsgericht Duisburg HRB 7451\nHelios Rhein-Ruhr Kliniken GmbH – Duisburg",
      "type": "Einreichung neuer Dokumente",
      "state": "Nordrhein-Westfalen",
      "amtsgericht": "Amtsgericht Duisburg",
      "registernummer": "HRB 7451",
      "registerart": "HRB",
      "company_name": "Helios Rhein-Ruhr Kliniken GmbH",
      "company_seat": "Duisburg",
      "details": "13.01.2026 (Bekanntmachungsdatum)\n\nNordrhein-Westfalen Amtsgericht Duisburg HRB 7451\nEinreichung neuer Dokumente\n\nHelios Rhein-Ruhr Kliniken GmbH\nGesellschaft mit beschränkter Haftung\nDuisburg\n\nDem Registergericht ist eine Liste der Mitglieder des Aufsichtsrates eingereicht worden."
    },
    {
      "date": "2026-01-13",
      "id": "142292",
      "original_text": "Löschungsankündigung\nNordrhein-Westfalen Amtsgericht Essen HRB 28229\ndomum 1 GmbH – Essen",
      "type": "Löschungsankündigung",
      "state": "Nordrhein-Westfalen",
      "amtsgericht": "Amtsgericht Essen",
      "registernummer": "HRB 28229",
      "registerart": "HRB",
      "company_name": "domum 1 GmbH",
      "company_seat": "Essen",
      "details": "13.01.2026 (Bekanntmachungsdatum)\n\nNordrhein-Westfalen Amtsgericht Essen HRB 28229\nLöschungsankündigung 13.01.2026 (Eintragungsdatum)\n\ndomum 1 GmbH\nGesellschaft mit beschränkter Haftung\nEssen\n\nDas Registergericht beabsichtigt die Gesellschaft von Amts wegen nach § 394 FamFG zu löschen. Die Frist zur Erhebung eines Widerspruchs ist auf einen Monat festgesetzt."
    },
    {
      "date": "2026-01-13",
      "id": "142293",
      "original_text": "Registerbekanntmachung nach dem Umwandlungsgesetz\nNordrhein-Westfalen Amtsgericht Münster HRB 23225\nEudemonia GmbH – Münster",
      "type": "Registerbekanntmachung nach dem Umwandlungsgesetz",
      "state": "Nordrhein-Westfalen",
      "amtsgericht": "Amtsgericht Münster",
      "registernummer": "HRB 23225",
      "registerart": "HRB",
      "company_name": "Eudemonia GmbH",
      "company_seat": "Münster",
      "details": "13.01.2026 (Bekanntmachungsdatum)\n\nNordrhein-Westfalen Amtsgericht Münster HRB 23225\nRegisterbekanntmachung nach dem Umwandlungsgesetz 13.01.2026 (Eintragungsdatum)\n\nEudemonia GmbH\nGesellschaft mit beschränkter Haftung\nMünster\n\nDen Gläubigern der an der formwechselnden Umwandlung beteiligten Rechtsträger ist, wenn sie binnen sechs Monaten nach dem Tag, an dem die Eintragung der formwechselnden Umwandlung in das Register des Sitzes desjenigen Rechtsträgers, dessen Gläubiger sie sind, nach § 19 Absatz 3 UmwG als bekanntgemacht gilt, ihren Anspruch nach Grund und Höhe schriftlich anmelden, Sicherheit zu leisten, soweit sie nicht Befriedigung verlangen können. Dieses Recht steht den Gläubigern jedoch nur zu, wenn sie glaubhaft machen, dass durch die formwechselnden Umwandlung die Erfüllung ihrer Forderung gefährdet wird."
    },
    {
      "date": "2026-01-13",
      "id": "142294",
      "original_text": "Sonstige Registerbekanntmachung\nNordrhein-Westfalen Amtsgericht Bielefeld HRB 36919\nAER Kooperation AG – Bielefeld",
      "type": "Sonstige Registerbekanntmachung",
      "state": "Nordrhein-Westfalen",
      "amtsgericht": "Amtsgericht Bielefeld",
      "registernummer": "HRB 36919",
      "registerart": "HRB",
      "company_name": "AER Kooperation AG",
      "company_seat": "Bielefeld",
      "details": "13.01.2026 (Bekanntmachungsdatum)\n\nNordrhein-Westfalen Amtsgericht Bielefeld HRB 36919\nSonstige Registerbekanntmachung 13.01.2026 (Eintragungsdatum)\n\nAER Kooperation AG\nAktiengesellschaft\nBielefeld\n\nDem Registergericht ist eine neue Liste der Mitglieder des Aufsichtsrates eingereicht worden."
    },
    {
      "date": "2026-01-13",
      "id": "142295",
      "original_text": "Löschungsankündigung\nNordrhein-Westfalen Amtsgericht Köln HRB 108098\nDANIZ-LUX GmbH – Köln",
      "type": "Löschungsankündigung",
      "state": "Nordrhein-Westfalen",
      "amtsgericht": "Amtsgericht Köln",
      "registernummer": "HRB 108098",
      "registerart": "HRB",
      "company_name": "DANIZ-LUX GmbH",
      "company_seat": "Köln",
      "details": "13.01.2026 (Bekanntmachungsdatum)\n\nNordrhein-Westfalen Amtsgericht Köln HRB 108098\nLöschungsankündigung\n\nDANIZ-LUX GmbH\nGesellschaft mit beschränkter Haftung\nKöln\n\nDas Registergericht beabsichtigt die Gesellschaft von Amts wegen nach § 394 FamFG zu löschen. Die Frist zur Erhebung eines Widerspruchs ist auf einen Monat festgesetzt."
    },
    {
      "date": "2026-01-13",
      "id": "142296",
      "original_text": "Löschungsankündigung\nNordrhein-Westfalen Amtsgericht Siegburg HRB 12760\nThale GmbH – Siegburg",
      "type": "Löschungsankündigung",
      "state": "Nordrhein-Westfalen",
      "amtsgericht": "Amtsgericht Siegburg",
      "registernummer": "HRB 12760",
      "registerart": "HRB",
      "company_name": "Thale GmbH",
      "company_seat": "Siegburg",
      "details": "13.01.2026 (Bekanntmachungsdatum)\n\nNordrhein-Westfalen Amtsgericht Siegburg HRB 12760\nLöschungsankündigung\n\nThale GmbH\nGesellschaft mit beschränkter Haftung\nSiegburg\n\nDas Registergericht hat glaubhafte Kenntnis erlangt, dass die Gesellschaft vermögenslos geworden ist, da ein Insolvenzverfahren durchgeführt und nach § 200 InsO aufgehoben wurde.\n\nEs ist daher beabsichtigt, die Gesellschaft nach § 394 FamFG im Handelsregister wegen Vermögenslosigkeit zu löschen.\nEinwände gegen die Löschung sind durch Widerspruch binnen einer Frist von 3 Monaten geltend zu machen, andernfalls die Löschung erfolgen wird.\n\nEinzulegen ist der Widerspruch bei dem Amtsgericht Siegburg, Neue Poststraße 16, 53721 Siegburg, und zwar entweder schriftlich in deutscher Sprache oder mündlich zur Niederschrift der Geschäftsstelle. Der Widerspruch kann auch zur Niederschrift der Geschäftsstelle eines jeden Amtsgerichts abgegeben werden. Der Widerspruch ist binnen der in der Verfügung bestimmten Frist einzulegen. Die Frist ist nur gewahrt, wenn der Widerspruch rechtzeitig bei dem Amtsgericht Siegburg eingeht, auch wenn der Widerspruch zur Niederschrift der Geschäftsstelle eines anderen Amtsgerichts abgegeben wurde. Die Frist beginnt jeweils mit der schriftlichen Bekanntgabe der Verfügung an die Beteiligten. Kann die schriftliche Bekanntgabe an einen Beteiligten nicht bewirkt werden, beginnt die Frist spätestens mit Ablauf von fünf Monaten nach Erlass der Verfügung. Die Bekanntgabe ist entweder durch Zustellung oder am dritten Tage nach Aufgabe zur Post bewirkt. Sofern die Löschung noch nicht erfolgt ist, kann der Widerspruch auch noch nach Ablauf der Frist eingelegt werden. Fällt das Ende der Frist auf einen Sonnabend, einen Sonntag oder einen allgemeinen Feiertag, endet die Frist mit Ablauf des nächsten Werktages. Der Widerspruch ist zu unterzeichnen. Eine Begründung des Widerspruchs ist nicht vorgeschrieben."
    },
    {
      "date": "2026-01-13",
      "id": "142297",
      "original_text": "Löschungsankündigung\nNordrhein-Westfalen Amtsgericht Düsseldorf HRB 65694\nOFFPREIS GmbH – Ratingen",
      "type": "Löschungsankündigung",
      "state": "Nordrhein-Westfalen",
      "amtsgericht": "Amtsgericht Düsseldorf",
      "registernummer": "HRB 65694",
      "registerart": "HRB",
      "company_name": "OFFPREIS GmbH",
      "company_seat": "Ratingen",
      "details": "13.01.2026 (Bekanntmachungsdatum)\n\nNordrhein-Westfalen Amtsgericht Düsseldorf HRB 65694\nLöschungsankündigung\n\nOFFPREIS GmbH\nGesellschaft mit beschränkter Haftung\nRatingen\n\nDas Registergericht beabsichtigt die Gesellschaft von Amts wegen nach § 394 FamFG zu löschen. Die Frist zur Erhebung eines Widerspruchs ist auf 3 Wochen festgesetzt.\n\nRechtsbehelfsbelehrung:\nDas Widerspruchsrecht steht jedem zu, der an der Unterlassung der Löschung ein berechtigtes Interesse hat. Der Widerspruch ist bei dem Amtsgericht Düsseldorf -Registergericht-, Werdener Straße 1, 40227 Düsseldorf schriftlich in deutscher Sprache oder zur Niederschrift der Geschäftsstelle einzulegen. Der Widerspruch kann auch zur Niederschrift der Geschäftsstelle eines jeden Amtsgerichtes abgegeben werden. Die Einlegung ist auch durch Übertragung eines elektronischen Dokuments an die elektronische Poststelle des Gerichts möglich. Das elektronische Dokument muss für die Bearbeitung durch das Gericht geeignet und mit einer qualifizierten elektronischen Signatur der verantwortenden Person versehen sein oder von der verantwortenden Person signiert und auf einem sicheren Übermittlungsweg gemäß § 130a ZPO nach näherer Maßgabe der Verordnung über die technischen Rahmenbedingungen des elektronischen Rechtsverkehrs und über das besondere elektronische Behördenpostfach (BGBl. I, S.3803) eingereicht werden. Weitere Informationen erhalten Sie auf der Internetseite www.justiz.de.\nDer Widerspruch muss spätestens innerhalb der gesetzten Frist nach dem Datum der Bekanntmachung der Löschungsankündigung bei dem Amtsgericht - Registergericht - Düsseldorf eingegangen sein.  Dies gilt auch dann, wenn der Widerspruch zur Niederschrift der Geschäftsstelle eines anderen Amtsgerichtes abgegeben wurde. Die Frist beginnt mit dem Tage der Bekanntmachung der Löschungsankündigung in dem für die Bekanntmachung der Eintragungen in das Handelsregister bestimmten elektronischen Informations- und Kommunikationssystem nach § 10 des Handelsgesetzbuches. Fällt das Ende der Frist auf einen Sonntag, einen allgemeinen Feiertag oder Sonnabend, so endet die Frist mit Ablauf des nächsten Werktages.\nDer Widerspruch muss die Bezeichnung der angefochtenen Löschungsankündigung sowie die Erklärung enthalten, dass Widerspruch gegen diese Löschungsankündigung eingelegt wird. Er ist zu unterzeichnen und soll begründet werden."
    },
    {
      "date": "2026-01-13",
      "id": "142298",
      "original_text": "Löschungsankündigung\nNordrhein-Westfalen Amtsgericht Gütersloh HRB 11516\nM2 Transporte UG (haftungsbeschränkt) – Halle",
      "type": "Löschungsankündigung",
      "state": "Nordrhein-Westfalen",
      "amtsgericht": "Amtsgericht Gütersloh",
      "registernummer": "HRB 11516",
      "registerart": "HRB",
      "company_name": "M2 Transporte UG (haftungsbeschränkt)",
      "company_seat": "Halle",
      "details": "13.01.2026 (Bekanntmachungsdatum)\n\nNordrhein-Westfalen Amtsgericht Gütersloh HRB 11516\nLöschungsankündigung\n\nM2 Transporte UG (haftungsbeschränkt)\nGesellschaft mit beschränkter Haftung\nHalle\n\nDas Registergericht beabsichtigt die Gesellschaft von Amts wegen nach § 394 FamFG zu löschen. Die Frist zur Erhebung eines Widerspruchs ist auf einen Monat festgesetzt."
    },
    {
      "date": "2026-01-13",
      "id": "142299",
      "original_text": "Löschungsankündigung\nNordrhein-Westfalen Amtsgericht Duisburg HRB 33790\nKS Service UG (haftungsbeschränkt) – Duisburg",
      "type": "Löschungsankündigung",
      "state": "Nordrhein-Westfalen",
      "amtsgericht": "Amtsgericht Duisburg",
      "registernummer": "HRB 33790",
      "registerart": "HRB",
      "company_name": "KS Service UG (haftungsbeschränkt)",
      "company_seat": "Duisburg",
      "details": "13.01.2026 (Bekanntmachungsdatum)\n\nNordrhein-Westfalen Amtsgericht Duisburg HRB 33790\nLöschungsankündigung\n\nKS Service UG (haftungsbeschränkt)\nGesellschaft mit beschränkter Haftung\nDuisburg\n\nHRB 33790:\nKS Service UG (haftungsbeschränkt),\nDuisburg, Johannesmarkt 8, 47169 Duisburg\nDas Registergericht beabsichtigt, die im Handelsregister eingetragene Gesellschaft gemäß § 394 Absatz 1 FamFG wegen Vermögenslosigkeit von Amts wegen zu löschen. Gegen diese Verfügung kann Widerspruch eingelegt werden. Die Frist zur Erhebung eines Widerspruchs gegen die beabsichtigte Löschung von Amts wegen ist auf drei Monate festgesetzt. Rechtsbehelfsbelehrung Der Widerspruch ist bei dem Amtsgericht Duisburg, Kardinal-Galen-Str. 124-132, 47058 Duisburg schriftlich in deutscher Sprache oder zur Niederschrift der Geschäftsstelle einzulegen. Der Widerspruch kann auch zur Niederschrift der Geschäftsstelle eines jeden Amtsgerichtes abgegeben werden. Die Einlegung ist auch durch Übertragung eines elektronischen Dokuments an die elektronische Poststelle des Gerichts möglich. Das elektronische Dokument muss für die Bearbeitung durch das Gericht geeignet und mit einer qualifizierten elektronischen Signatur der verantwortenden Person versehen sein oder von der verantwortenden Person signiert und auf einem sicheren Übermittlungsweg gemäß § 130 a ZPO nach näherer Maßgabe der Verordnung über die technischen Rahmenbedingungen des elektronischen Rechtsverkehrs und über das besondere elektronische Behördenpostfach (BGBl. I, S. 3803) eingereicht werden. Weitere Informationen erhalten Sie auf der Internetseite www.justiz.de <http://www.justiz.de>. Der Widerspruch muss spätestens innerhalb der gesetzten Frist bei dem Amtsgericht Duisburg eingegangen sein. Dies gilt auch dann, wenn der Widerspruch zur Niederschrift der Geschäftsstelle eines anderen Amtsgerichtes abgegeben wurde. Die Frist beginnt mit der Veröffentlichung. Fällt das Ende der Frist auf einen Sonntag, einen allgemeinen Feiertag oder Sonnabend, so endet die Frist mit Ablauf des nächsten Werktages. Der Widerspruch muss die Bezeichnung der angefochtenen Verfügung sowie die Erklärung enthalten, dass Widerspruch gegen diese Verfügung eingelegt wird. Er ist zu unterzeichnen und soll begründet werden."
    },
    {
      "date": "2026-01-13",
      "id": "142300",
      "original_text": "Registerbekanntmachung nach dem Umwandlungsgesetz\nNordrhein-Westfalen Amtsgericht Siegburg HRB 16507\nEBAERMANN INDUSTRIEBETEILIGUNGEN AG – Neunkirchen-Seelscheid",
      "type": "Registerbekanntmachung nach dem Umwandlungsgesetz",
      "state": "Nordrhein-Westfalen",
      "amtsgericht": "Amtsgericht Siegburg",
      "registernummer": "HRB 16507",
      "registerart": "HRB",
      "company_name": "EBAERMANN INDUSTRIEBETEILIGUNGEN AG",
      "company_seat": "Neunkirchen-Seelscheid",
      "details": "13.01.2026 (Bekanntmachungsdatum)\n\nNordrhein-Westfalen Amtsgericht Siegburg HRB 16507\nRegisterbekanntmachung nach dem Umwandlungsgesetz 13.01.2026 (Eintragungsdatum)\n\nEBAERMANN INDUSTRIEBETEILIGUNGEN AG\nAktiengesellschaft\nNeunkirchen-Seelscheid\n\nDen Gläubigern der an der formwechselnden Umwandlung beteiligten Rechtsträger ist, wenn sie binnen sechs Monaten nach dem Tag, an dem die Eintragung der formwechselnden Umwandlung in das Register des Sitzes desjenigen Rechtsträgers, dessen Gläubiger sie sind, nach § 19 Absatz 3 UmwG als bekanntgemacht gilt, ihren Anspruch nach Grund und Höhe schriftlich anmelden, Sicherheit zu leisten, soweit sie nicht Befriedigung verlangen können. Dieses Recht steht den Gläubigern jedoch nur zu, wenn sie glaubhaft machen, dass durch die formwechselnden Umwandlung die Erfüllung ihrer Forderung gefährdet wird."
    },
    {
      "date": "2026-01-13",
      "id": "142301",
      "original_text": "Löschungsankündigung\nNordrhein-Westfalen Amtsgericht Köln HRB 101069\nMorci Handels GmbH – Gummersbach",
      "type": "Löschungsankündigung",
      "state": "Nordrhein-Westfalen",
      "amtsgericht": "Amtsgericht Köln",
      "registernummer": "HRB 101069",
      "registerart": "HRB",
      "company_name": "Morci Handels GmbH",
      "company_seat": "Gummersbach",
      "details": "13.01.2026 (Bekanntmachungsdatum)\n\nNordrhein-Westfalen Amtsgericht Köln HRB 101069\nLöschungsankündigung\n\nMorci Handels GmbH\nGesellschaft mit beschränkter Haftung\nGummersbach\n\nDas Registergericht beabsichtigt die Gesellschaft von Amts wegen nach § 394 FamFG zu löschen. Die Frist zur Erhebung eines Widerspruchs ist auf einen Monat festgesetzt."
    },
    {
      "date": "2026-01-13",
      "id": "142302",
      "original_text": "Löschungsankündigung\nNordrhein-Westfalen Amtsgericht Kleve HRB 18470\nK & J Service-Trade GmbH – Moers",
      "type": "Löschungsankündigung",
      "state": "Nordrhein-Westfalen",
      "amtsgericht": "Amtsgericht Kleve",
      "registernummer": "HRB 18470",
      "registerart": "HRB",
      "company_name": "K & J Service-Trade GmbH",
      "company_seat": "Moers",
      "details": "13.01.2026 (Bekanntmachungsdatum)\n\nNordrhein-Westfalen Amtsgericht Kleve HRB 18470\nLöschungsankündigung\n\nK & J Service-Trade GmbH\nGesellschaft mit beschränkter Haftung\nMoers\n\nDas Registergericht beabsichtigt die Gesellschaft von Amts wegen nach § 394 FamFG zu löschen. Die Frist zur Erhebung eines Widerspruchs ist auf einen Monat festgesetzt."
    },
    {
      "date": "2026-01-13",
      "id": "142303",
      "original_text": "Sonstige Registerbekanntmachung\nNordrhein-Westfalen Amtsgericht Krefeld HRB 4505\nRadiometer GmbH – Krefeld",
      "type": "Sonstige Registerbekanntmachung",
      "state": "Nordrhein-Westfalen",
      "amtsgericht": "Amtsgericht Krefeld",
      "registernummer": "HRB 4505",
      "registerart": "HRB",
      "company_name": "Radiometer GmbH",
      "company_seat": "Krefeld",
      "details": "13.01.2026 (Bekanntmachungsdatum)\n\nNordrhein-Westfalen Amtsgericht Krefeld HRB 4505\nSonstige Registerbekanntmachung 13.01.2026 (Eintragungsdatum)\n\nRadiometer GmbH\nGesellschaft mit beschränkter Haftung\nKrefeld\n\nAls nicht eingetragen wird veröffentlicht: Den Gläubigern der Gesellschaft, deren Forderungen begründet worden sind bevor die Eintragung der Beendigung des Gewinnabführungsvertrages  in das Handelsregister nach § 10 des Handelsgesetzbuches als bekanntgemacht gilt, hat der andere Vertragsteil Sicherheit zu leisten, wenn sie sich binnen sechs Monaten nach der Bekanntmachung der Eintragung zu diesem Zweck bei ihm melden."
    },
    {
      "date": "2026-01-13",
      "id": "142304",
      "original_text": "Registerbekanntmachung nach dem Umwandlungsgesetz\nNordrhein-Westfalen Amtsgericht Siegburg HRB 18995\nStiefelhagen IT GmbH – Troisdorf",
      "type": "Registerbekanntmachung nach dem Umwandlungsgesetz",
      "state": "Nordrhein-Westfalen",
      "amtsgericht": "Amtsgericht Siegburg",
      "registernummer": "HRB 18995",
      "registerart": "HRB",
      "company_name": "Stiefelhagen IT GmbH",
      "company_seat": "Troisdorf",
      "details": "13.01.2026 (Bekanntmachungsdatum)\n\nNordrhein-Westfalen Amtsgericht Siegburg HRB 18995\nRegisterbekanntmachung nach dem Umwandlungsgesetz 13.01.2026 (Eintragungsdatum)\n\nStiefelhagen IT GmbH\nGesellschaft mit beschränkter Haftung\nTroisdorf\n\nDen Gläubigern der an der Ausgliederung beteiligten Rechtsträger ist, wenn sie binnen sechs Monaten nach dem Tag, an dem die Eintragung der Ausgliederung in das Register des Sitzes desjenigen Rechtsträgers, dessen Gläubiger sie sind, nach § 19 Absatz 3 UmwG als bekanntgemacht gilt, ihren Anspruch nach Grund und Höhe schriftlich anmelden, Sicherheit zu leisten, soweit sie nicht Befriedigung verlangen können. Dieses Recht steht den Gläubigern jedoch nur zu, wenn sie glaubhaft machen, dass durch die Ausgliederung die Erfüllung ihrer Forderung gefährdet wird."
    },
    {
      "date": "2026-01-13",
      "id": "142305",
      "original_text": "Löschungsankündigung\nNordrhein-Westfalen Amtsgericht Köln HRB 107256\nOrangeNXT GmbH – Köln",
      "type": "Löschungsankündigung",
      "state": "Nordrhein-Westfalen",
      "amtsgericht": "Amtsgericht Köln",
      "registernummer": "HRB 107256",
      "registerart": "HRB",
      "company_name": "OrangeNXT GmbH",
      "company_seat": "Köln",
      "details": "13.01.2026 (Bekanntmachungsdatum)\n\nNordrhein-Westfalen Amtsgericht Köln HRB 107256\nLöschungsankündigung\n\nOrangeNXT GmbH\nGesellschaft mit beschränkter Haftung\nKöln\n\nDas Registergericht beabsichtigt, die im Handelsregister eingetragene Gesellschaft gemäß § 394 Absatz 1 FamFG wegen Vermögenslosigkeit von Amts wegen zu löschen. Gegen diese Verfügung kann Widerspruch eingelegt werden. Die Frist zur Erhebung eines Widerspruchs gegen die beabsichtigte Löschung von Amts wegen ist auf einen Monat festgesetzt. Rechtsbehelfsbelehrung: Gegen diese Verfügung können Sie Widerspruch einlegen. Der Widerspruch ist bei dem Amtsgericht Köln, Reichenspergerplatz 1, 50670 Köln schriftlich in deutscher Sprache oder zur Niederschrift der Geschäftsstelle einzulegen. Der Widerspruch kann auch zur Niederschrift der Geschäftsstelle eines jeden Amtsgerichtes abgegeben werden. Die Einlegung ist auch durch Übertragung eines elektronischen Dokuments an die elektronische Poststelle des Gerichts möglich. Das elektronische Dokument muss für die Bearbeitung durch das Gericht geeignet und mit einer qualifizierten elektronischen Signatur der verantwortenden Person versehen sein oder von der verantwortenden Person signiert und auf einem sicheren Übermittlungsweg gemäß § 130a ZPO nach näherer Maßgabe der Verordnung über die technischen Rahmenbedingungen des elektronischen Rechtsverkehrs und über das besondere elektronische Behördenpostfach (BGBl. I, S.3803) eingereicht werden. Weitere Informationen erhalten Sie auf der Internetseite www.justiz.de.Der Widerspruch muss spätestens innerhalb der gesetzten Frist bei dem Amtsgericht Köln eingegangen sein. Dies gilt auch dann, wenn der Widerspruch zur Niederschrift der Geschäftsstelle eines anderen Amtsgerichtes abgegeben wurde. Die Frist beginnt mit der Veröffentlichung. Fällt das Ende der Frist auf einen Sonntag, einen allgemeinen Feiertag oder Sonnabend, so endet die Frist mit Ablauf des nächsten Werktages.\n\nDer Widerspruch muss die Bezeichnung der angefochtenen Verfügung sowie die Erklärung enthalten, dass Widerspruch gegen diese Verfügung eingelegt wird. Er ist zu unterzeichnen und soll begründet werden."
    },
    {
      "date": "2026-01-13",
      "id": "142306",
      "original_text": "Sonstige Registerbekanntmachung\nNordrhein-Westfalen Amtsgericht Köln HRB 114656\nAI MXY Hotel Operations GmbH – Köln",
      "type": "Sonstige Registerbekanntmachung",
      "state": "Nordrhein-Westfalen",
      "amtsgericht": "Amtsgericht Köln",
      "registernummer": "HRB 114656",
      "registerart": "HRB",
      "company_name": "AI MXY Hotel Operations GmbH",
      "company_seat": "Köln",
      "details": "13.01.2026 (Bekanntmachungsdatum)\n\nNordrhein-Westfalen Amtsgericht Köln HRB 114656\nSonstige Registerbekanntmachung 13.01.2026 (Eintragungsdatum)\n\nAI MXY Hotel Operations GmbH\nGesellschaft mit beschränkter Haftung\nKöln\n\nAls nicht eingetragen wird veröffentlicht: Den Gläubigern der Gesellschaft, deren Forderungen begründet worden sind bevor die Eintragung der Beendigung des Beherrschungsvertrages  in das Handelsregister nach § 10 des Handelsgesetzbuches als bekanntgemacht gilt, hat der andere Vertragsteil Sicherheit zu leisten, wenn sie sich binnen sechs Monaten nach der Bekanntmachung der Eintragung zu diesem Zweck bei ihm melden."
    },
    {
      "date": "2026-01-13",
      "id": "142307",
      "original_text": "Löschungsankündigung\nNordrhein-Westfalen Amtsgericht Arnsberg HRA 2915\nShopping und Mehr GmbH & Co. KG – Marsberg",
      "type": "Löschungsankündigung",
      "state": "Nordrhein-Westfalen",
      "amtsgericht": "Amtsgericht Arnsberg",
      "registernummer": "HRA 2915",
      "registerart": "HRA",
      "company_name": "Shopping und Mehr GmbH & Co. KG",
      "company_seat": "Marsberg",
      "details": "13.01.2026 (Bekanntmachungsdatum)\n\nNordrhein-Westfalen Amtsgericht Arnsberg HRA 2915\nLöschungsankündigung 13.01.2026 (Eintragungsdatum)\n\nShopping und Mehr GmbH & Co. KG\nKommanditgesellschaft\nMarsberg\n\nDas Registergericht beabsichtigt die Firma von Amts wegen nach § 394 Abs. 1 FamFG zu löschen. Die Frist zur Erhebung eines Widerspruchs ist auf einen Monat festgesetzt.\nRechtsbehelfsbelehrung: Gegen diese Verfügung können Sie Widerspruch einlegen. Der Widerspruch ist bei dem Amtsgericht Arnsberg, Eichholzstraße 4, 59821 Arnsberg schriftlich in deutscher Sprache oder zur Niederschrift der Geschäftsstelle einzulegen. Der Widerspruch kann auch zur Niederschrift der Geschäftsstelle eines jeden Amtsgerichtes abgegeben werden. Die Einlegung ist auch durch Übertragung eines elektronischen Dokuments an die elektronische Poststelle des Gerichts möglich. Das elektronische Dokument muss für die Bearbeitung durch das Gericht geeignet und mit einer qualifizierten elektronischen Signatur der verantwortenden Person versehen sein oder von der verantwortenden Person signiert und auf einem sicheren Übermittlungsweg gemäß § 130a ZPO nach näherer Maßgabe der Verordnung über die technischen Rahmenbedingungen des elektronischen Rechtsverkehrs und über das besondere elektronische Behördenpostfach (BGBl. I, S.3803) eingereicht werden.\nWeitere Informationen erhalten Sie auf der Internetseite www.justiz.de.Der Widerspruch muss spätestens innerhalb der gesetzten Frist bei dem Amtsgericht Arnsberg eingegangen sein. Dies gilt auch dann, wenn der Widerspruch zur Niederschrift der Geschäftsstelle eines anderen Amtsgerichtes abgegeben wurde. Die Frist beginnt mit der Veröffentlichung. Fällt das Ende der Frist auf einen Sonntag, einen allgemeinen Feiertag oder Sonnabend, so endet die Frist mit Ablauf des nächsten Werktages. Der Widerspruch muss die Bezeichnung der angefochtenen Verfügung sowie die Erklärung enthalten, dass Widerspruch gegen diese Verfügung eingelegt wird. Er ist zu unterzeichnen und soll begründet werden."
    },
    {
      "date": "2026-01-13",
      "id": "142308",
      "original_text": "Registerbekanntmachung nach dem Umwandlungsgesetz\nNordrhein-Westfalen Amtsgericht Köln HRA 38571\nTerra RTZ Olpe GmbH & Co. KG – Köln",
      "type": "Registerbekanntmachung nach dem Umwandlungsgesetz",
      "state": "Nordrhein-Westfalen",
      "amtsgericht": "Amtsgericht Köln",
      "registernummer": "HRA 38571",
      "registerart": "HRA",
      "company_name": "Terra RTZ Olpe GmbH & Co. KG",
      "company_seat": "Köln",
      "details": "13.01.2026 (Bekanntmachungsdatum)\n\nNordrhein-Westfalen Amtsgericht Köln HRA 38571\nRegisterbekanntmachung nach dem Umwandlungsgesetz 13.01.2026 (Eintragungsdatum)\n\nTerra RTZ Olpe GmbH & Co. KG\nKommanditgesellschaft\nKöln\n\nDen Gläubigern der an der formwechselnden Umwandlung beteiligten Rechtsträger ist, wenn sie binnen sechs Monaten nach dem Tag, an dem die Eintragung der formwechselnden Umwandlung in das Register des Sitzes desjenigen Rechtsträgers, dessen Gläubiger sie sind, nach § 19 Absatz 3 UmwG als bekanntgemacht gilt, ihren Anspruch nach Grund und Höhe schriftlich anmelden, Sicherheit zu leisten, soweit sie nicht Befriedigung verlangen können. Dieses Recht steht den Gläubigern jedoch nur zu, wenn sie glaubhaft machen, dass durch die formwechselnden Umwandlung die Erfüllung ihrer Forderung gefährdet wird."
    },
    {
      "date": "2026-01-13",
      "id": "142309",
      "original_text": "Einreichung neuer Dokumente\nNordrhein-Westfalen Amtsgericht Bonn HRB 23407\nVÖB-ZVD Processing GmbH – Bonn",
      "type": "Einreichung neuer Dokumente",
      "state": "Nordrhein-Westfalen",
      "amtsgericht": "Amtsgericht Bonn",
      "registernummer": "HRB 23407",
      "registerart": "HRB",
      "company_name": "VÖB-ZVD Processing GmbH",
      "company_seat": "Bonn",
      "details": "13.01.2026 (Bekanntmachungsdatum)\n\nNordrhein-Westfalen Amtsgericht Bonn HRB 23407\nEinreichung neuer Dokumente 13.01.2026 (Eintragungsdatum)\n\nVÖB-ZVD Processing GmbH\nGesellschaft mit beschränkter Haftung\nBonn\n\nDem Registergericht ist eine neue Liste der Mitglieder des Aufsichtsrates eingereicht worden."
    },
    {
      "date": "2026-01-13",
      "id": "142310",
      "original_text": "Löschungsankündigung\nNordrhein-Westfalen Amtsgericht Bonn HRB 24153\nLM Dienstleistungs GmbH – Swisttal",
      "type": "Löschungsankündigung",
      "state": "Nordrhein-Westfalen",
      "amtsgericht": "Amtsgericht Bonn",
      "registernummer": "HRB 24153",
      "registerart": "HRB",
      "company_name": "LM Dienstleistungs GmbH",
      "company_seat": "Swisttal",
      "details": "13.01.2026 (Bekanntmachungsdatum)\n\nNordrhein-Westfalen Amtsgericht Bonn HRB 24153\nLöschungsankündigung\n\nLM Dienstleistungs GmbH\nGesellschaft mit beschränkter Haftung\nSwisttal\n\nDas Registergericht beabsichtigt die Gesellschaft von Amts wegen nach § 394 FamFG zu löschen. Die Frist zur Erhebung eines Widerspruchs ist auf einen Monat festgesetzt."
    },
    {
      "date": "2026-01-13",
      "id": "142311",
      "original_text": "Sonstige Registerbekanntmachung\nNordrhein-Westfalen Amtsgericht Köln HRB 80779\nREWE Märkte 7 GmbH – Köln",
      "type": "Sonstige Registerbekanntmachung",
      "state": "Nordrhein-Westfalen",
      "amtsgericht": "Amtsgericht Köln",
      "registernummer": "HRB 80779",
      "registerart": "HRB",
      "company_name": "REWE Märkte 7 GmbH",
      "company_seat": "Köln",
      "details": "13.01.2026 (Bekanntmachungsdatum)\n\nNordrhein-Westfalen Amtsgericht Köln HRB 80779\nSonstige Registerbekanntmachung\n\nREWE Märkte 7 GmbH\nGesellschaft mit beschränkter Haftung\nKöln\n\nAls nicht eingetragen wird veröffentlicht: Den Gläubigern der Gesellschaft, deren Forderungen begründet worden sind bevor die Eintragung der Beendigung des Beherrschungs- und Gewinnabführungsvertrages  in das Handelsregister nach § 10 des Handelsgesetzbuches als bekanntgemacht gilt, hat der andere Vertragsteil Sicherheit zu leisten, wenn sie sich binnen sechs Monaten nach der Bekanntmachung der Eintragung zu diesem Zweck bei ihm melden."
    },
    {
      "date": "2026-01-13",
      "id": "142312",
      "original_text": "Sonstige Registerbekanntmachung\nNordrhein-Westfalen Amtsgericht Essen HRB 14582\nMinegas GmbH – Essen",
      "type": "Sonstige Registerbekanntmachung",
      "state": "Nordrhein-Westfalen",
      "amtsgericht": "Amtsgericht Essen",
      "registernummer": "HRB 14582",
      "registerart": "HRB",
      "company_name": "Minegas GmbH",
      "company_seat": "Essen",
      "details": "13.01.2026 (Bekanntmachungsdatum)\n\nNordrhein-Westfalen Amtsgericht Essen HRB 14582\nSonstige Registerbekanntmachung 13.01.2026 (Eintragungsdatum)\n\nMinegas GmbH\nGesellschaft mit beschränkter Haftung\nEssen\n\nAls nicht eingetragen wird veröffentlicht: Den Gläubigern der Gesellschaft, deren Forderungen begründet worden sind bevor die Eintragung der Beendigung des Gewinnabführungsvertrages  in das Handelsregister nach § 10 des Handelsgesetzbuches als bekanntgemacht gilt, hat der andere Vertragsteil Sicherheit zu leisten, wenn sie sich binnen sechs Monaten nach der Bekanntmachung der Eintragung zu diesem Zweck bei ihm melden."
    },
    {
      "date": "2026-01-13",
      "id": "142313",
      "original_text": "Registerbekanntmachung nach dem Umwandlungsgesetz\nNordrhein-Westfalen Amtsgericht Münster HRB 5886\nEudemonia AG – Münster",
      "type": "Registerbekanntmachung nach dem Umwandlungsgesetz",
      "state": "Nordrhein-Westfalen",
      "amtsgericht": "Amtsgericht Münster",
      "registernummer": "HRB 5886",
      "registerart": "HRB",
      "company_name": "Eudemonia AG",
      "company_seat": "Münster",
      "details": "13.01.2026 (Bekanntmachungsdatum)\n\nNordrhein-Westfalen Amtsgericht Münster HRB 5886\nRegisterbekanntmachung nach dem Umwandlungsgesetz 13.01.2026 (Eintragungsdatum)\n\nEudemonia AG\nAktiengesellschaft\nMünster\n\nDen Gläubigern der an der formwechselnden Umwandlung beteiligten Rechtsträger ist, wenn sie binnen sechs Monaten nach dem Tag, an dem die Eintragung der formwechselnden Umwandlung in das Register des Sitzes desjenigen Rechtsträgers, dessen Gläubiger sie sind, nach § 19 Absatz 3 UmwG als bekanntgemacht gilt, ihren Anspruch nach Grund und Höhe schriftlich anmelden, Sicherheit zu leisten, soweit sie nicht Befriedigung verlangen können. Dieses Recht steht den Gläubigern jedoch nur zu, wenn sie glaubhaft machen, dass durch die formwechselnden Umwandlung die Erfüllung ihrer Forderung gefährdet wird."
    },
    {
      "date": "2026-01-13",
      "id": "142314",
      "original_text": "Löschungsankündigung\nNordrhein-Westfalen Amtsgericht Krefeld HRB 16079\nKANBI GmbH – Krefeld",
      "type": "Löschungsankündigung",
      "state": "Nordrhein-Westfalen",
      "amtsgericht": "Amtsgericht Krefeld",
      "registernummer": "HRB 16079",
      "registerart": "HRB",
      "company_name": "KANBI GmbH",
      "company_seat": "Krefeld",
      "details": "13.01.2026 (Bekanntmachungsdatum)\n\nNordrhein-Westfalen Amtsgericht Krefeld HRB 16079\nLöschungsankündigung\n\nKANBI GmbH\nGesellschaft mit beschränkter Haftung\nKrefeld\n\nDas Registergericht beabsichtigt die Gesellschaft von Amts wegen nach § 394 FamFG zu löschen. Die Frist zur Erhebung eines Widerspruchs ist auf einen Monat festgesetzt."
    },
    {
      "date": "2026-01-13",
      "id": "142315",
      "original_text": "Löschungsankündigung\nNordrhein-Westfalen Amtsgericht Kleve HRB 5478\nT E K A GmbH, Kaschierbetrieb – Neukirchen-Vluyn",
      "type": "Löschungsankündigung",
      "state": "Nordrhein-Westfalen",
      "amtsgericht": "Amtsgericht Kleve",
      "registernummer": "HRB 5478",
      "registerart": "HRB",
      "company_name": "T E K A GmbH, Kaschierbetrieb",
      "company_seat": "Neukirchen-Vluyn",
      "details": "13.01.2026 (Bekanntmachungsdatum)\n\nNordrhein-Westfalen Amtsgericht Kleve HRB 5478\nLöschungsankündigung\n\nT E K A GmbH, Kaschierbetrieb\nGesellschaft mit beschränkter Haftung\nNeukirchen-Vluyn\n\nDas Registergericht beabsichtigt die Gesellschaft von Amts wegen nach § 394 FamFG zu löschen. Die Frist zur Erhebung eines Widerspruchs ist auf einen Monat festgesetzt."
    },
    {
      "date": "2026-01-13",
      "id": "142316",
      "original_text": "Löschungsankündigung\nNordrhein-Westfalen Amtsgericht Mönchengladbach HRB 21694\nUygun Akademie GmbH – Mönchengladbach",
      "type": "Löschungsankündigung",
      "state": "Nordrhein-Westfalen",
      "amtsgericht": "Amtsgericht Mönchengladbach",
      "registernummer": "HRB 21694",
      "registerart": "HRB",
      "company_name": "Uygun Akademie GmbH",
      "company_seat": "Mönchengladbach",
      "details": "13.01.2026 (Bekanntmachungsdatum)\n\nNordrhein-Westfalen Amtsgericht Mönchengladbach HRB 21694\nLöschungsankündigung\n\nUygun Akademie GmbH\nGesellschaft mit beschränkter Haftung\nMönchengladbach\n\nDas Registergericht beabsichtigt die Gesellschaft von Amts wegen nach § 394 FamFG zu löschen. Die Frist zur Erhebung eines Widerspruchs ist auf zwei Monate festgesetzt."
    },
    {
      "date": "2026-01-13",
      "id": "142317",
      "original_text": "Registerbekanntmachung nach dem Umwandlungsgesetz\nHessen Amtsgericht Marburg HRB 6559\nVILA VITA Marburg GmbH – Marburg",
      "type": "Registerbekanntmachung nach dem Umwandlungsgesetz",
      "state": "Hessen",
      "amtsgericht": "Amtsgericht Marburg",
      "registernummer": "HRB 6559",
      "registerart": "HRB",
      "company_name": "VILA VITA Marburg GmbH",
      "company_seat": "Marburg",
      "details": "13.01.2026 (Bekanntmachungsdatum)\n\nHessen Amtsgericht Marburg HRB 6559\nRegisterbekanntmachung nach dem Umwandlungsgesetz 13.01.2026 (Eintragungsdatum)\n\nVILA VITA Marburg GmbH\nGesellschaft mit beschränkter Haftung\nMarburg\n\nDen Gläubigern der an der Verschmelzung beteiligten Rechtsträger ist, wenn sie binnen sechs Monaten nach dem Tag, an dem die Eintragung der Verschmelzung in das Register des Sitzes desjenigen Rechtsträgers, dessen Gläubiger sie sind, nach § 19 Absatz 3 UmwG bekannt gemacht worden ist, ihren Anspruch nach Grund und Höhe schriftlich anmelden, Sicherheit zu leisten, soweit sie nicht Befriedigung verlangen können. Dieses Recht steht den Gläubigern jedoch nur zu, wenn sie glaubhaft machen, dass durch die Verschmelzung die Erfüllung ihrer Forderung gefährdet wird."
    },
    {
      "date": "2026-01-13",
      "id": "142318",
      "original_text": "Registerbekanntmachung nach dem Umwandlungsgesetz\nHessen Amtsgericht Marburg HRB 8724\nVILA VITA Marburg SE – Marburg",
      "type": "Registerbekanntmachung nach dem Umwandlungsgesetz",
      "state": "Hessen",
      "amtsgericht": "Amtsgericht Marburg",
      "registernummer": "HRB 8724",
      "registerart": "HRB",
      "company_name": "VILA VITA Marburg SE",
      "company_seat": "Marburg",
      "details": "13.01.2026 (Bekanntmachungsdatum)\n\nHessen Amtsgericht Marburg HRB 8724\nRegisterbekanntmachung nach dem Umwandlungsgesetz 13.01.2026 (Eintragungsdatum)\n\nVILA VITA Marburg SE\nEuropäische Aktiengesellschaft (SE)\nMarburg\n\nDen Gläubigern der an der Verschmelzung beteiligten Rechtsträger ist, wenn sie binnen sechs Monaten nach dem Tag, an dem die Eintragung der Verschmelzung in das Register des Sitzes desjenigen Rechtsträgers, dessen Gläubiger sie sind, nach § 19 Absatz 3 UmwG bekannt gemacht worden ist, ihren Anspruch nach Grund und Höhe schriftlich anmelden, Sicherheit zu leisten, soweit sie nicht Befriedigung verlangen können. Dieses Recht steht den Gläubigern jedoch nur zu, wenn sie glaubhaft machen, dass durch die Verschmelzung die Erfüllung ihrer Forderung gefährdet wird."
    },
    {
      "date": "2026-01-13",
      "id": "142319",
      "original_text": "Löschungsankündigung\nHessen Amtsgericht Bad Hersfeld HRB 3238\nKoch Holding UG (haftungsbeschränkt) – Niederaula",
      "type": "Löschungsankündigung",
      "state": "Hessen",
      "amtsgericht": "Amtsgericht Bad Hersfeld",
      "registernummer": "HRB 3238",
      "registerart": "HRB",
      "company_name": "Koch Holding UG (haftungsbeschränkt)",
      "company_seat": "Niederaula",
      "details": "13.01.2026 (Bekanntmachungsdatum)\n\nHessen Amtsgericht Bad Hersfeld HRB 3238\nLöschungsankündigung 13.01.2026 (Eintragungsdatum)\n\nKoch Holding UG (haftungsbeschränkt)\nGesellschaft mit beschränkter Haftung\nNiederaula\n\nDas Registergericht beabsichtigt die im Handelsregister eingetragene Gesellschaft von Amts wegen nach § 394 FamFG zu löschen. Die Frist zur Erhebung eines Widerspruchs gegen die beabsichtigte Löschung wird auf 3 Monate festgesetzt."
    },
    {
      "date": "2026-01-13",
      "id": "142320",
      "original_text": "Löschungsankündigung\nHessen Amtsgericht Frankfurt am Main HRB 116035\nFFFactory Vertriebsgesellschaft mit beschränkter Haftung – Frankfurt am Main",
      "type": "Löschungsankündigung",
      "state": "Hessen",
      "amtsgericht": "Amtsgericht Frankfurt am Main",
      "registernummer": "HRB 116035",
      "registerart": "HRB",
      "company_name": "FFFactory Vertriebsgesellschaft mit beschränkter Haftung",
      "company_seat": "Frankfurt am Main",
      "details": "13.01.2026 (Bekanntmachungsdatum)\n\nHessen Amtsgericht Frankfurt am Main HRB 116035\nLöschungsankündigung\n\nFFFactory Vertriebsgesellschaft mit beschränkter Haftung\nGesellschaft mit beschränkter Haftung\nFrankfurt am Main\n\nDas Registergericht beabsichtigt die im Handelsregister eingetragene Gesellschaft von Amts wegen nach § 394 FamFG zu löschen. Die Frist zur Erhebung eines Widerspruchs gegen die beabsichtigte Löschung wird auf 1 Monat festgesetzt."
    },
    {
      "date": "2026-01-13",
      "id": "142321",
      "original_text": "Löschungsankündigung\nHessen Amtsgericht Darmstadt HRB 103559\nF.A.B.L Import Export GmbH – Pfungstadt",
      "type": "Löschungsankündigung",
      "state": "Hessen",
      "amtsgericht": "Amtsgericht Darmstadt",
      "registernummer": "HRB 103559",
      "registerart": "HRB",
      "company_name": "F.A.B.L Import Export GmbH",
      "company_seat": "Pfungstadt",
      "details": "13.01.2026 (Bekanntmachungsdatum)\n\nHessen Amtsgericht Darmstadt HRB 103559\nLöschungsankündigung\n\nF.A.B.L Import Export GmbH\nGesellschaft mit beschränkter Haftung\nPfungstadt\n\nDas Registergericht beabsichtigt die im Handelsregister eingetragene Gesellschaft von Amts wegen nach § 394 FamFG zu löschen. Die Frist zur Erhebung eines Widerspruchs gegen die beabsichtigte Löschung wird auf 3 Monate festgesetzt."
    },
    {
      "date": "2026-01-13",
      "id": "142322",
      "original_text": "Löschungsankündigung\nHessen Amtsgericht Offenbach am Main HRB 50147\nAlpha Service GmbH – Offenbach am Main",
      "type": "Löschungsankündigung",
      "state": "Hessen",
      "amtsgericht": "Amtsgericht Offenbach am Main",
      "registernummer": "HRB 50147",
      "registerart": "HRB",
      "company_name": "Alpha Service GmbH",
      "company_seat": "Offenbach am Main",
      "details": "13.01.2026 (Bekanntmachungsdatum)\n\nHessen Amtsgericht Offenbach am Main HRB 50147\nLöschungsankündigung\n\nAlpha Service GmbH\nGesellschaft mit beschränkter Haftung\nOffenbach am Main\n\nDas Registergericht beabsichtigt die im Handelsregister eingetragene Gesellschaft von Amts wegen nach § 394 FamFG zu löschen. Die Frist zur Erhebung eines Widerspruchs gegen die beabsichtigte Löschung wird auf 3 Monate festgesetzt."
    },
    {
      "date": "2026-01-13",
      "id": "142323",
      "original_text": "Registerbekanntmachung nach dem Umwandlungsgesetz\nHessen Amtsgericht Frankfurt am Main HRB 129723\nHE Deutschland Holdings GmbH – Karben",
      "type": "Registerbekanntmachung nach dem Umwandlungsgesetz",
      "state": "Hessen",
      "amtsgericht": "Amtsgericht Frankfurt am Main",
      "registernummer": "HRB 129723",
      "registerart": "HRB",
      "company_name": "HE Deutschland Holdings GmbH",
      "company_seat": "Karben",
      "details": "13.01.2026 (Bekanntmachungsdatum)\n\nHessen Amtsgericht Frankfurt am Main HRB 129723\nRegisterbekanntmachung nach dem Umwandlungsgesetz 13.01.2026 (Eintragungsdatum)\n\nHE Deutschland Holdings GmbH\nGesellschaft mit beschränkter Haftung\nKarben\n\nDen Gläubigern der an der Verschmelzung beteiligten Rechtsträger ist, wenn sie binnen sechs Monaten nach dem Tag, an dem die Eintragung der Verschmelzung in das Register des Sitzes desjenigen Rechtsträgers, dessen Gläubiger sie sind, nach § 19 Absatz 3 UmwG bekannt gemacht worden ist, ihren Anspruch nach Grund und Höhe schriftlich anmelden, Sicherheit zu leisten, soweit sie nicht Befriedigung verlangen können. Dieses Recht steht den Gläubigern jedoch nur zu, wenn sie glaubhaft machen, dass durch die Verschmelzung die Erfüllung ihrer Forderung gefährdet wird."
    }
  ]
}