{
  "date": "2026-01-17",
  "date_of_scrape": "2026-01-18T04:20:41.664Z",
  "tool_version": "0.2.0",
  "number_of_announcements": 21,
  "announcements": [
    {
      "date": "2026-01-17",
      "id": "142689",
      "original_text": "Sonstige Registerbekanntmachung\nBayern Amtsgericht Landshut HRB 14969\nTierarztpraxis Vilsbiburg GmbH – Vilsbiburg",
      "type": "Sonstige Registerbekanntmachung",
      "state": "Bayern",
      "amtsgericht": "Amtsgericht Landshut",
      "registernummer": "HRB 14969",
      "registerart": "HRB",
      "company_name": "Tierarztpraxis Vilsbiburg GmbH",
      "company_seat": "Vilsbiburg",
      "details": "17.01.2026 (Bekanntmachungsdatum)\n\nBayern Amtsgericht Landshut HRB 14969\nSonstige Registerbekanntmachung 16.01.2026 (Eintragungsdatum)\n\nTierarztpraxis Vilsbiburg GmbH\nGesellschaft mit beschränkter Haftung\nVilsbiburg\n\nDen Gläubigern der Gesellschaft, deren Forderungen begründet worden sind, bevor die Eintragung der Beendigung des Gewinnabführungsvertrages in das Handelsregister nach § 10 des Handelsgesetzbuches als bekanntgemacht gilt, hat der andere Vertragsteil Sicherheit zu leisten, wenn sie sich binnen sechs Monaten nach der Bekanntmachung der Eintragung zu diesem Zweck bei ihm melden."
    },
    {
      "date": "2026-01-17",
      "id": "142690",
      "original_text": "Registerbekanntmachung nach dem Umwandlungsgesetz\nBayern Amtsgericht München HRB 178537\nB&S 2008 BO General GmbH – München",
      "type": "Registerbekanntmachung nach dem Umwandlungsgesetz",
      "state": "Bayern",
      "amtsgericht": "Amtsgericht München",
      "registernummer": "HRB 178537",
      "registerart": "HRB",
      "company_name": "B&S 2008 BO General GmbH",
      "company_seat": "München",
      "details": "17.01.2026 (Bekanntmachungsdatum)\n\nBayern Amtsgericht München HRB 178537\nRegisterbekanntmachung nach dem Umwandlungsgesetz 16.01.2026 (Eintragungsdatum)\n\nB&S 2008 BO General GmbH\nGesellschaft mit beschränkter Haftung\nMünchen\n\nDen Gläubigern der an der Verschmelzung beteiligten Rechtsträger ist, wenn sie binnen sechs Monaten nach dem Tag, an dem die Eintragung der Verschmelzung in das Register des Sitzes desjenigen Rechtsträgers, dessen Gläubiger sie sind, nach § 19 Abs. 3 UmwG als bekannt gemacht gilt, ihren Anspruch nach Grund und Höhe in Textform anmelden, Sicherheit zu leisten, soweit sie nicht Befriedigung verlangen können. Dieses Recht steht den Gläubigern jedoch nur zu, wenn sie glaubhaft machen, dass durch die Verschmelzung die Erfüllung ihrer Forderung gefährdet wird."
    },
    {
      "date": "2026-01-17",
      "id": "142691",
      "original_text": "Registerbekanntmachung nach dem Umwandlungsgesetz\nBayern Amtsgericht München HRB 227707\nSBS seebauer business solutions GmbH – Weyarn",
      "type": "Registerbekanntmachung nach dem Umwandlungsgesetz",
      "state": "Bayern",
      "amtsgericht": "Amtsgericht München",
      "registernummer": "HRB 227707",
      "registerart": "HRB",
      "company_name": "SBS seebauer business solutions GmbH",
      "company_seat": "Weyarn",
      "details": "17.01.2026 (Bekanntmachungsdatum)\n\nBayern Amtsgericht München HRB 227707\nRegisterbekanntmachung nach dem Umwandlungsgesetz 16.01.2026 (Eintragungsdatum)\n\nSBS seebauer business solutions GmbH\nGesellschaft mit beschränkter Haftung\nWeyarn\n\nDen Gläubigern der an der Verschmelzung beteiligten Rechtsträger ist, wenn sie binnen sechs Monaten nach dem Tag, an dem die Eintragung der Verschmelzung in das Register des Sitzes desjenigen Rechtsträgers, dessen Gläubiger sie sind, nach § 19 Abs. 3 UmwG als bekannt gemacht gilt, ihren Anspruch nach Grund und Höhe in Textform anmelden, Sicherheit zu leisten, soweit sie nicht Befriedigung verlangen können. Dieses Recht steht den Gläubigern jedoch nur zu, wenn sie glaubhaft machen, dass durch die Verschmelzung die Erfüllung ihrer Forderung gefährdet wird."
    },
    {
      "date": "2026-01-17",
      "id": "142692",
      "original_text": "Einreichung neuer Dokumente\nBayern Amtsgericht Fürth HRB 9768\nBU HOLDING AG – Fürth",
      "type": "Einreichung neuer Dokumente",
      "state": "Bayern",
      "amtsgericht": "Amtsgericht Fürth",
      "registernummer": "HRB 9768",
      "registerart": "HRB",
      "company_name": "BU HOLDING AG",
      "company_seat": "Fürth",
      "details": "17.01.2026 (Bekanntmachungsdatum)\n\nBayern Amtsgericht Fürth HRB 9768\nEinreichung neuer Dokumente\n\nBU HOLDING AG\nAktiengesellschaft\nFürth\n\nDem Amtsgericht Fürth -Registergericht- ist eine Liste der Mitglieder des Aufsichtsrats eingereicht worden, § 106 AktG."
    },
    {
      "date": "2026-01-17",
      "id": "142693",
      "original_text": "Registerbekanntmachung nach dem Umwandlungsgesetz\nBayern Amtsgericht München HRB 256369\nMEDDANE AG – München",
      "type": "Registerbekanntmachung nach dem Umwandlungsgesetz",
      "state": "Bayern",
      "amtsgericht": "Amtsgericht München",
      "registernummer": "HRB 256369",
      "registerart": "HRB",
      "company_name": "MEDDANE AG",
      "company_seat": "München",
      "details": "17.01.2026 (Bekanntmachungsdatum)\n\nBayern Amtsgericht München HRB 256369\nRegisterbekanntmachung nach dem Umwandlungsgesetz 16.01.2026 (Eintragungsdatum)\n\nMEDDANE AG\nAktiengesellschaft\nMünchen\n\nDen Gläubigern der an der Verschmelzung beteiligten Rechtsträger ist, wenn sie binnen sechs Monaten nach dem Tag, an dem die Eintragung der Verschmelzung in das Register des Sitzes desjenigen Rechtsträgers, dessen Gläubiger sie sind, nach § 19 Abs. 3 UmwG als bekannt gemacht gilt, ihren Anspruch nach Grund und Höhe in Textform anmelden, Sicherheit zu leisten, soweit sie nicht Befriedigung verlangen können. Dieses Recht steht den Gläubigern jedoch nur zu, wenn sie glaubhaft machen, dass durch die Verschmelzung die Erfüllung ihrer Forderung gefährdet wird."
    },
    {
      "date": "2026-01-17",
      "id": "142694",
      "original_text": "Registerbekanntmachung nach dem Umwandlungsgesetz\nBayern Amtsgericht Nürnberg HRB 45463\nMS Finanz GmbH – Feucht",
      "type": "Registerbekanntmachung nach dem Umwandlungsgesetz",
      "state": "Bayern",
      "amtsgericht": "Amtsgericht Nürnberg",
      "registernummer": "HRB 45463",
      "registerart": "HRB",
      "company_name": "MS Finanz GmbH",
      "company_seat": "Feucht",
      "details": "17.01.2026 (Bekanntmachungsdatum)\n\nBayern Amtsgericht Nürnberg HRB 45463\nRegisterbekanntmachung nach dem Umwandlungsgesetz 16.01.2026 (Eintragungsdatum)\n\nMS Finanz GmbH\nGesellschaft mit beschränkter Haftung\nFeucht\n\nDen Gläubigern der an der Spaltung beteiligten Rechtsträger ist, wenn sie binnen sechs Monaten nach dem Tag, an dem die Eintragung der Spaltung in das Register des Sitzes desjenigen Rechtsträgers, dessen Gläubiger sie sind, nach §§ 125, 19 Abs. 3 UmwG als bekannt gemacht gilt, ihren Anspruch nach Grund und Höhe in Textform anmelden, Sicherheit zu leisten, soweit sie nicht Befriedigung verlangen können. Dieses Recht steht den Gläubigern jedoch nur zu, wenn sie glaubhaft machen, dass durch die Spaltung die Erfüllung ihrer Forderung gefährdet wird."
    },
    {
      "date": "2026-01-17",
      "id": "142695",
      "original_text": "Registerbekanntmachung nach dem Umwandlungsgesetz\nBayern Amtsgericht Nürnberg HRB 19389\nMS Leasing GmbH – Feucht",
      "type": "Registerbekanntmachung nach dem Umwandlungsgesetz",
      "state": "Bayern",
      "amtsgericht": "Amtsgericht Nürnberg",
      "registernummer": "HRB 19389",
      "registerart": "HRB",
      "company_name": "MS Leasing GmbH",
      "company_seat": "Feucht",
      "details": "17.01.2026 (Bekanntmachungsdatum)\n\nBayern Amtsgericht Nürnberg HRB 19389\nRegisterbekanntmachung nach dem Umwandlungsgesetz 16.01.2026 (Eintragungsdatum)\n\nMS Leasing GmbH\nGesellschaft mit beschränkter Haftung\nFeucht\n\nDen Gläubigern der an der Spaltung beteiligten Rechtsträger ist, wenn sie binnen sechs Monaten nach dem Tag, an dem die Eintragung der Spaltung in das Register des Sitzes desjenigen Rechtsträgers, dessen Gläubiger sie sind, nach §§ 125, 19 Abs. 3 UmwG als bekannt gemacht gilt, ihren Anspruch nach Grund und Höhe in Textform anmelden, Sicherheit zu leisten, soweit sie nicht Befriedigung verlangen können. Dieses Recht steht den Gläubigern jedoch nur zu, wenn sie glaubhaft machen, dass durch die Spaltung die Erfüllung ihrer Forderung gefährdet wird."
    },
    {
      "date": "2026-01-17",
      "id": "142696",
      "original_text": "Löschungsankündigung\nBayern Amtsgericht München HRB 228669\nRNDS-Auto GmbH – München",
      "type": "Löschungsankündigung",
      "state": "Bayern",
      "amtsgericht": "Amtsgericht München",
      "registernummer": "HRB 228669",
      "registerart": "HRB",
      "company_name": "RNDS-Auto GmbH",
      "company_seat": "München",
      "details": "17.01.2026 (Bekanntmachungsdatum)\n\nBayern Amtsgericht München HRB 228669\nLöschungsankündigung\n\nRNDS-Auto GmbH\nGesellschaft mit beschränkter Haftung\nMünchen\n\nDas Registergericht beabsichtigt, die im Handelsregister eingetragene Gesellschaft wegen Vermögenslosigkeit von Amts wegen nach § 394 FamFG zu löschen. #insert(Text=\"zztb_V_Widerspruchsfrist\")"
    },
    {
      "date": "2026-01-17",
      "id": "142697",
      "original_text": "Löschungsankündigung\nBayern Amtsgericht Nürnberg HRB 31243\nLomondo Verzeichnis UG (haftungsbeschränkt) – Nürnberg",
      "type": "Löschungsankündigung",
      "state": "Bayern",
      "amtsgericht": "Amtsgericht Nürnberg",
      "registernummer": "HRB 31243",
      "registerart": "HRB",
      "company_name": "Lomondo Verzeichnis UG (haftungsbeschränkt)",
      "company_seat": "Nürnberg",
      "details": "17.01.2026 (Bekanntmachungsdatum)\n\nBayern Amtsgericht Nürnberg HRB 31243\nLöschungsankündigung\n\nLomondo Verzeichnis UG (haftungsbeschränkt)\nGesellschaft mit beschränkter Haftung\nNürnberg\n\nDas Registergericht beabsichtigt, die im Handelsregister eingetragene Gesellschaft wegen Vermögenslosigkeit von Amts wegen nach § 394 FamFG zu löschen. Die Frist zur Erhebung eines Widerspruchs ist auf einen Monat festgesetzt."
    },
    {
      "date": "2026-01-17",
      "id": "142698",
      "original_text": "Löschungsankündigung\nBayern Amtsgericht München HRB 242769\nEURO-TRUST24 GmbH – Wolfratshausen",
      "type": "Löschungsankündigung",
      "state": "Bayern",
      "amtsgericht": "Amtsgericht München",
      "registernummer": "HRB 242769",
      "registerart": "HRB",
      "company_name": "EURO-TRUST24 GmbH",
      "company_seat": "Wolfratshausen",
      "details": "17.01.2026 (Bekanntmachungsdatum)\n\nBayern Amtsgericht München HRB 242769\nLöschungsankündigung\n\nEURO-TRUST24 GmbH\nGesellschaft mit beschränkter Haftung\nWolfratshausen\n\nDas Registergericht beabsichtigt, die im Handelsregister eingetragene Gesellschaft wegen Vermögenslosigkeit von Amts wegen nach § 394 FamFG zu löschen. Die Frist zur Erhebung eines Widerspruchs ist auf drei Monate festgesetzt."
    },
    {
      "date": "2026-01-17",
      "id": "142699",
      "original_text": "Löschungsankündigung\nBayern Amtsgericht Nürnberg HRB 15949\nConradty Carbon Aktiengesellschaft – Röthenbach/Pegnitz",
      "type": "Löschungsankündigung",
      "state": "Bayern",
      "amtsgericht": "Amtsgericht Nürnberg",
      "registernummer": "HRB 15949",
      "registerart": "HRB",
      "company_name": "Conradty Carbon Aktiengesellschaft",
      "company_seat": "Röthenbach/Pegnitz",
      "details": "17.01.2026 (Bekanntmachungsdatum)\n\nBayern Amtsgericht Nürnberg HRB 15949\nLöschungsankündigung\n\nConradty Carbon Aktiengesellschaft\nAktiengesellschaft\nRöthenbach/Pegnitz\n\nDas Registergericht beabsichtigt, die im Handelsregister eingetragene Gesellschaft wegen Vermögenslosigkeit von Amts wegen nach § 394 FamFG zu löschen. Die Frist zur Erhebung eines Widerspruchs ist auf einen Monat festgesetzt."
    },
    {
      "date": "2026-01-17",
      "id": "142700",
      "original_text": "Sonstige Registerbekanntmachung\nBayern Amtsgericht München HRB 234023\nFlixTrain GmbH – München",
      "type": "Sonstige Registerbekanntmachung",
      "state": "Bayern",
      "amtsgericht": "Amtsgericht München",
      "registernummer": "HRB 234023",
      "registerart": "HRB",
      "company_name": "FlixTrain GmbH",
      "company_seat": "München",
      "details": "17.01.2026 (Bekanntmachungsdatum)\n\nBayern Amtsgericht München HRB 234023\nSonstige Registerbekanntmachung 16.01.2026 (Eintragungsdatum)\n\nFlixTrain GmbH\nGesellschaft mit beschränkter Haftung\nMünchen\n\nDen Gläubigern der Gesellschaft, deren Forderungen begründet worden sind, bevor die Eintragung der Beendigung des Gewinnabführungsvertrages in das Handelsregister nach § 10 des Handelsgesetzbuches als bekanntgemacht gilt, hat der andere Vertragsteil Sicherheit zu leisten, wenn sie sich binnen sechs Monaten nach der Bekanntmachung der Eintragung zu diesem Zweck bei ihm melden."
    },
    {
      "date": "2026-01-17",
      "id": "142701",
      "original_text": "Sonstige Registerbekanntmachung\nBayern Amtsgericht München HRB 111412\nNetlution München GmbH – München",
      "type": "Sonstige Registerbekanntmachung",
      "state": "Bayern",
      "amtsgericht": "Amtsgericht München",
      "registernummer": "HRB 111412",
      "registerart": "HRB",
      "company_name": "Netlution München GmbH",
      "company_seat": "München",
      "details": "17.01.2026 (Bekanntmachungsdatum)\n\nBayern Amtsgericht München HRB 111412\nSonstige Registerbekanntmachung 16.01.2026 (Eintragungsdatum)\n\nNetlution München GmbH\nGesellschaft mit beschränkter Haftung\nMünchen\n\nDen Gläubigern der Gesellschaft, deren Forderungen begründet worden sind, bevor die Eintragung der Beendigung des Gewinnabführungsvertrages in das Handelsregister nach § 10 des Handelsgesetzbuches als bekanntgemacht gilt, hat der andere Vertragsteil Sicherheit zu leisten, wenn sie sich binnen sechs Monaten nach der Bekanntmachung der Eintragung zu diesem Zweck bei ihm melden."
    },
    {
      "date": "2026-01-17",
      "id": "142702",
      "original_text": "Einreichung neuer Dokumente\nBayern Amtsgericht München HRB 162978\nAQUAMONDI AG – München",
      "type": "Einreichung neuer Dokumente",
      "state": "Bayern",
      "amtsgericht": "Amtsgericht München",
      "registernummer": "HRB 162978",
      "registerart": "HRB",
      "company_name": "AQUAMONDI AG",
      "company_seat": "München",
      "details": "17.01.2026 (Bekanntmachungsdatum)\n\nBayern Amtsgericht München HRB 162978\nEinreichung neuer Dokumente 16.01.2026 (Eintragungsdatum)\n\nAQUAMONDI AG\nAktiengesellschaft\nMünchen\n\nDem Amtsgericht München -Registergericht- ist eine Liste der Mitglieder des Aufsichtsrats eingereicht worden, § 106 AktG."
    },
    {
      "date": "2026-01-17",
      "id": "142703",
      "original_text": "Sonstige Registerbekanntmachung\nBayern Amtsgericht München HRB 121064\ngps Service GmbH – München",
      "type": "Sonstige Registerbekanntmachung",
      "state": "Bayern",
      "amtsgericht": "Amtsgericht München",
      "registernummer": "HRB 121064",
      "registerart": "HRB",
      "company_name": "gps Service GmbH",
      "company_seat": "München",
      "details": "17.01.2026 (Bekanntmachungsdatum)\n\nBayern Amtsgericht München HRB 121064\nSonstige Registerbekanntmachung 16.01.2026 (Eintragungsdatum)\n\ngps Service GmbH\nGesellschaft mit beschränkter Haftung\nMünchen\n\nDen Gläubigern der Gesellschaft, deren Forderungen begründet worden sind, bevor die Eintragung der Beendigung des Beherrschungs- und Gewinnabführungsvertrages in das Handelsregister nach § 10 des Handelsgesetzbuches als bekanntgemacht gilt, hat der andere Vertragsteil Sicherheit zu leisten, wenn sie sich binnen sechs Monaten nach der Bekanntmachung der Eintragung zu diesem Zweck bei ihm melden."
    },
    {
      "date": "2026-01-17",
      "id": "142704",
      "original_text": "Löschungsankündigung\nBayern Amtsgericht München HRB 188157\nGroben Ingenieure GmbH – Ottobrunn",
      "type": "Löschungsankündigung",
      "state": "Bayern",
      "amtsgericht": "Amtsgericht München",
      "registernummer": "HRB 188157",
      "registerart": "HRB",
      "company_name": "Groben Ingenieure GmbH",
      "company_seat": "Ottobrunn",
      "details": "17.01.2026 (Bekanntmachungsdatum)\n\nBayern Amtsgericht München HRB 188157\nLöschungsankündigung\n\nGroben Ingenieure GmbH\nGesellschaft mit beschränkter Haftung\nOttobrunn\n\nDas Registergericht beabsichtigt, den im Handelsregister eingetragenen Geschäftsführer Groben, Markus Elmar, geb. 14.05.1963 wegen fehlender Eignung von Amts wegen nach §395 FamFG zu löschen. Die Frist zur Erhebung eines Widerspruchs ist auf drei Monate festgesetzt."
    },
    {
      "date": "2026-01-17",
      "id": "142705",
      "original_text": "Registerbekanntmachung nach dem Umwandlungsgesetz\nBayern Amtsgericht Fürth HRB 22355\nFirstclass Event Hotel & Spa GmbH – Fürth",
      "type": "Registerbekanntmachung nach dem Umwandlungsgesetz",
      "state": "Bayern",
      "amtsgericht": "Amtsgericht Fürth",
      "registernummer": "HRB 22355",
      "registerart": "HRB",
      "company_name": "Firstclass Event Hotel & Spa GmbH",
      "company_seat": "Fürth",
      "details": "17.01.2026 (Bekanntmachungsdatum)\n\nBayern Amtsgericht Fürth HRB 22355\nRegisterbekanntmachung nach dem Umwandlungsgesetz 16.01.2026 (Eintragungsdatum)\n\nFirstclass Event Hotel & Spa GmbH\nGesellschaft mit beschränkter Haftung\nFürth\n\nDen Gläubigern der an der Ausgliederung beteiligten Rechtsträger ist, wenn sie binnen sechs Monaten nach dem Tag, an dem die Eintragung der Ausgliederung in das Register des Sitzes desjenigen Rechtsträgers, dessen Gläubiger sie sind, nach §§ 125, 19 Abs. 3 UmwG als bekannt gemacht gilt, ihren Anspruch nach Grund und Höhe in Textform anmelden, Sicherheit zu leisten, soweit sie nicht Befriedigung verlangen können. Dieses Recht steht den Gläubigern jedoch nur zu, wenn sie glaubhaft machen, dass durch die Ausgliederung die Erfüllung ihrer Forderung gefährdet wird."
    },
    {
      "date": "2026-01-17",
      "id": "142706",
      "original_text": "Einreichung neuer Dokumente\nBayern Amtsgericht Nürnberg HRB 10668\nNÜRNBERGER Krankenversicherung AG – Nürnberg",
      "type": "Einreichung neuer Dokumente",
      "state": "Bayern",
      "amtsgericht": "Amtsgericht Nürnberg",
      "registernummer": "HRB 10668",
      "registerart": "HRB",
      "company_name": "NÜRNBERGER Krankenversicherung AG",
      "company_seat": "Nürnberg",
      "details": "17.01.2026 (Bekanntmachungsdatum)\n\nBayern Amtsgericht Nürnberg HRB 10668\nEinreichung neuer Dokumente\n\nNÜRNBERGER Krankenversicherung AG\nAktiengesellschaft\nNürnberg\n\nDem Amtsgericht Nürnberg -Registergericht- ist eine Liste der Mitglieder des Aufsichtsrats eingereicht worden, § 106 AktG."
    },
    {
      "date": "2026-01-17",
      "id": "142707",
      "original_text": "Registerbekanntmachung nach dem Umwandlungsgesetz\nBayern Amtsgericht München HRB 285002\nKWP III Gischberg UG (haftungsbeschränkt) – München",
      "type": "Registerbekanntmachung nach dem Umwandlungsgesetz",
      "state": "Bayern",
      "amtsgericht": "Amtsgericht München",
      "registernummer": "HRB 285002",
      "registerart": "HRB",
      "company_name": "KWP III Gischberg UG (haftungsbeschränkt)",
      "company_seat": "München",
      "details": "17.01.2026 (Bekanntmachungsdatum)\n\nBayern Amtsgericht München HRB 285002\nRegisterbekanntmachung nach dem Umwandlungsgesetz 16.01.2026 (Eintragungsdatum)\n\nKWP III Gischberg UG (haftungsbeschränkt)\nGesellschaft mit beschränkter Haftung\nMünchen\n\nDen Gläubigern der an der Verschmelzung beteiligten Rechtsträger ist, wenn sie binnen sechs Monaten nach dem Tag, an dem die Eintragung der Verschmelzung in das Register des Sitzes desjenigen Rechtsträgers, dessen Gläubiger sie sind, nach § 19 Abs. 3 UmwG als bekannt gemacht gilt, ihren Anspruch nach Grund und Höhe in Textform anmelden, Sicherheit zu leisten, soweit sie nicht Befriedigung verlangen können. Dieses Recht steht den Gläubigern jedoch nur zu, wenn sie glaubhaft machen, dass durch die Verschmelzung die Erfüllung ihrer Forderung gefährdet wird."
    },
    {
      "date": "2026-01-17",
      "id": "142708",
      "original_text": "Registerbekanntmachung nach dem Umwandlungsgesetz\nBayern Amtsgericht Fürth HRA 12647\nFirstclass Event & Hotel e.K. – Fürth",
      "type": "Registerbekanntmachung nach dem Umwandlungsgesetz",
      "state": "Bayern",
      "amtsgericht": "Amtsgericht Fürth",
      "registernummer": "HRA 12647",
      "registerart": "HRA",
      "company_name": "Firstclass Event & Hotel e.K.",
      "company_seat": "Fürth",
      "details": "17.01.2026 (Bekanntmachungsdatum)\n\nBayern Amtsgericht Fürth HRA 12647\nRegisterbekanntmachung nach dem Umwandlungsgesetz 16.01.2026 (Eintragungsdatum)\n\nFirstclass Event & Hotel e.K.\nEinzelkaufmann / Einzelkauffrau\nFürth\n\nDen Gläubigern der an der Ausgliederung beteiligten Rechtsträger ist, wenn sie binnen sechs Monaten nach dem Tag, an dem die Eintragung der Ausgliederung in das Register des Sitzes desjenigen Rechtsträgers, dessen Gläubiger sie sind, nach §§ 125, 19 Abs. 3 UmwG als bekannt gemacht gilt, ihren Anspruch nach Grund und Höhe in Textform anmelden, Sicherheit zu leisten, soweit sie nicht Befriedigung verlangen können. Dieses Recht steht den Gläubigern jedoch nur zu, wenn sie glaubhaft machen, dass durch die Ausgliederung die Erfüllung ihrer Forderung gefährdet wird."
    },
    {
      "date": "2026-01-17",
      "id": "142709",
      "original_text": "Sonstige Registerbekanntmachung\nBayern Amtsgericht München HRB 298672\nAKB Dodenhoff Ambulanter Pflegedienst GmbH – München",
      "type": "Sonstige Registerbekanntmachung",
      "state": "Bayern",
      "amtsgericht": "Amtsgericht München",
      "registernummer": "HRB 298672",
      "registerart": "HRB",
      "company_name": "AKB Dodenhoff Ambulanter Pflegedienst GmbH",
      "company_seat": "München",
      "details": "17.01.2026 (Bekanntmachungsdatum)\n\nBayern Amtsgericht München HRB 298672\nSonstige Registerbekanntmachung 16.01.2026 (Eintragungsdatum)\n\nAKB Dodenhoff Ambulanter Pflegedienst GmbH\nGesellschaft mit beschränkter Haftung\nMünchen\n\nDen Gläubigern der Gesellschaft, deren Forderungen begründet worden sind, bevor die Eintragung der Beendigung des Gewinnabführungsvertrages in das Handelsregister nach § 10 des Handelsgesetzbuches als bekanntgemacht gilt, hat der andere Vertragsteil Sicherheit zu leisten, wenn sie sich binnen sechs Monaten nach der Bekanntmachung der Eintragung zu diesem Zweck bei ihm melden."
    }
  ]
}