{
  "date": "2026-01-24",
  "date_of_scrape": "2026-01-25T04:26:51.069Z",
  "tool_version": "0.2.0",
  "number_of_announcements": 23,
  "announcements": [
    {
      "date": "2026-01-24",
      "id": "143368",
      "original_text": "Registerbekanntmachung nach dem Umwandlungsgesetz\nBayern Amtsgericht Fürth HRB 6463\nDr. Christoph Hornstein GmbH – Erlangen",
      "type": "Registerbekanntmachung nach dem Umwandlungsgesetz",
      "state": "Bayern",
      "amtsgericht": "Amtsgericht Fürth",
      "registernummer": "HRB 6463",
      "registerart": "HRB",
      "company_name": "Dr. Christoph Hornstein GmbH",
      "company_seat": "Erlangen",
      "details": "24.01.2026 (Bekanntmachungsdatum)\n\nBayern Amtsgericht Fürth HRB 6463\nRegisterbekanntmachung nach dem Umwandlungsgesetz 23.01.2026 (Eintragungsdatum)\n\nDr. Christoph Hornstein GmbH\nGesellschaft mit beschränkter Haftung\nErlangen\n\nDen Gläubigern der an der Verschmelzung beteiligten Rechtsträger ist, wenn sie binnen sechs Monaten nach dem Tag, an dem die Eintragung der Verschmelzung in das Register des Sitzes desjenigen Rechtsträgers, dessen Gläubiger sie sind, nach § 19 Abs. 3 UmwG als bekannt gemacht gilt, ihren Anspruch nach Grund und Höhe in Textform anmelden, Sicherheit zu leisten, soweit sie nicht Befriedigung verlangen können. Dieses Recht steht den Gläubigern jedoch nur zu, wenn sie glaubhaft machen, dass durch die Verschmelzung die Erfüllung ihrer Forderung gefährdet wird."
    },
    {
      "date": "2026-01-24",
      "id": "143369",
      "original_text": "Einreichung neuer Dokumente\nBayern Amtsgericht Bayreuth HRB 2758\nBTB Bayreuther Thermalbad GmbH – Bayreuth",
      "type": "Einreichung neuer Dokumente",
      "state": "Bayern",
      "amtsgericht": "Amtsgericht Bayreuth",
      "registernummer": "HRB 2758",
      "registerart": "HRB",
      "company_name": "BTB Bayreuther Thermalbad GmbH",
      "company_seat": "Bayreuth",
      "details": "24.01.2026 (Bekanntmachungsdatum)\n\nBayern Amtsgericht Bayreuth HRB 2758\nEinreichung neuer Dokumente\n\nBTB Bayreuther Thermalbad GmbH\nGesellschaft mit beschränkter Haftung\nBayreuth\n\nDem Amtsgericht Bayreuth -Registergericht- ist eine Liste der Mitglieder des Aufsichtsrats eingereicht worden, § 52 Abs. 3 S. 2 GmbHG."
    },
    {
      "date": "2026-01-24",
      "id": "143370",
      "original_text": "Einreichung neuer Dokumente\nBayern Amtsgericht Aschaffenburg HRB 779\nEnergieversorgung Main-Spessart GmbH – Aschaffenburg",
      "type": "Einreichung neuer Dokumente",
      "state": "Bayern",
      "amtsgericht": "Amtsgericht Aschaffenburg",
      "registernummer": "HRB 779",
      "registerart": "HRB",
      "company_name": "Energieversorgung Main-Spessart GmbH",
      "company_seat": "Aschaffenburg",
      "details": "24.01.2026 (Bekanntmachungsdatum)\n\nBayern Amtsgericht Aschaffenburg HRB 779\nEinreichung neuer Dokumente\n\nEnergieversorgung Main-Spessart GmbH\nGesellschaft mit beschränkter Haftung\nAschaffenburg\n\nDem Amtsgericht Aschaffenburg -Registergericht- ist eine Liste der Mitglieder des Aufsichtsrats eingereicht worden, § 52 Abs. 3 S. 2 GmbHG."
    },
    {
      "date": "2026-01-24",
      "id": "143371",
      "original_text": "Sonstige Registerbekanntmachung\nBayern Amtsgericht München HRB 288004\nMSSP AcquiCo GmbH – München",
      "type": "Sonstige Registerbekanntmachung",
      "state": "Bayern",
      "amtsgericht": "Amtsgericht München",
      "registernummer": "HRB 288004",
      "registerart": "HRB",
      "company_name": "MSSP AcquiCo GmbH",
      "company_seat": "München",
      "details": "24.01.2026 (Bekanntmachungsdatum)\n\nBayern Amtsgericht München HRB 288004\nSonstige Registerbekanntmachung 23.01.2026 (Eintragungsdatum)\n\nMSSP AcquiCo GmbH\nGesellschaft mit beschränkter Haftung\nMünchen\n\nDen Gläubigern der an der Verschmelzung beteiligten Rechtsträger ist, wenn sie binnen sechs Monaten nach dem Tag, an dem die Eintragung der Verschmelzung in das Register des Sitzes desjenigen Rechtsträgers, dessen Gläubiger sie sind, nach § 19 Abs. 3 UmwG als bekannt gemacht gilt, ihren Anspruch nach Grund und Höhe in Textform anmelden, Sicherheit zu leisten, soweit sie nicht Befriedigung verlangen können. Dieses Recht steht den Gläubigern jedoch nur zu, wenn sie glaubhaft machen, dass durch die Verschmelzung die Erfüllung ihrer Forderung gefährdet wird."
    },
    {
      "date": "2026-01-24",
      "id": "143372",
      "original_text": "Registerbekanntmachung nach dem Umwandlungsgesetz\nBayern Amtsgericht Hof HRB 7271\nDr. Johannes R. Gerstner Beratungsgesellschaft mbH – Hof",
      "type": "Registerbekanntmachung nach dem Umwandlungsgesetz",
      "state": "Bayern",
      "amtsgericht": "Amtsgericht Hof",
      "registernummer": "HRB 7271",
      "registerart": "HRB",
      "company_name": "Dr. Johannes R. Gerstner Beratungsgesellschaft mbH",
      "company_seat": "Hof",
      "details": "24.01.2026 (Bekanntmachungsdatum)\n\nBayern Amtsgericht Hof HRB 7271\nRegisterbekanntmachung nach dem Umwandlungsgesetz 23.01.2026 (Eintragungsdatum)\n\nDr. Johannes R. Gerstner Beratungsgesellschaft mbH\nGesellschaft mit beschränkter Haftung\nHof\n\nDen Gläubigern der an der Ausgliederung beteiligten Rechtsträger ist, wenn sie binnen sechs Monaten nach dem Tag, an dem die Eintragung der Ausgliederung in das Register des Sitzes desjenigen Rechtsträgers, dessen Gläubiger sie sind, nach §§ 125, 19 Abs. 3 UmwG als bekannt gemacht gilt, ihren Anspruch nach Grund und Höhe in Textform anmelden, Sicherheit zu leisten, soweit sie nicht Befriedigung verlangen können. Dieses Recht steht den Gläubigern jedoch nur zu, wenn sie glaubhaft machen, dass durch die Ausgliederung die Erfüllung ihrer Forderung gefährdet wird."
    },
    {
      "date": "2026-01-24",
      "id": "143373",
      "original_text": "Registerbekanntmachung nach dem Umwandlungsgesetz\nBayern Amtsgericht Hof HRA 4979\nDr. Johannes Gerstner Beratung e.K. – Hof",
      "type": "Registerbekanntmachung nach dem Umwandlungsgesetz",
      "state": "Bayern",
      "amtsgericht": "Amtsgericht Hof",
      "registernummer": "HRA 4979",
      "registerart": "HRA",
      "company_name": "Dr. Johannes Gerstner Beratung e.K.",
      "company_seat": "Hof",
      "details": "24.01.2026 (Bekanntmachungsdatum)\n\nBayern Amtsgericht Hof HRA 4979\nRegisterbekanntmachung nach dem Umwandlungsgesetz 23.01.2026 (Eintragungsdatum)\n\nDr. Johannes Gerstner Beratung e.K.\nEinzelkaufmann / Einzelkauffrau\nHof\n\nDen Gläubigern der an der Ausgliederung beteiligten Rechtsträger ist, wenn sie binnen sechs Monaten nach dem Tag, an dem die Eintragung der Ausgliederung in das Register des Sitzes desjenigen Rechtsträgers, dessen Gläubiger sie sind, nach §§ 125, 19 Abs. 3 UmwG als bekannt gemacht gilt, ihren Anspruch nach Grund und Höhe in Textform anmelden, Sicherheit zu leisten, soweit sie nicht Befriedigung verlangen können. Dieses Recht steht den Gläubigern jedoch nur zu, wenn sie glaubhaft machen, dass durch die Ausgliederung die Erfüllung ihrer Forderung gefährdet wird."
    },
    {
      "date": "2026-01-24",
      "id": "143374",
      "original_text": "Einreichung neuer Dokumente\nBayern Amtsgericht München HRB 199587\nWebasto SE – Gauting",
      "type": "Einreichung neuer Dokumente",
      "state": "Bayern",
      "amtsgericht": "Amtsgericht München",
      "registernummer": "HRB 199587",
      "registerart": "HRB",
      "company_name": "Webasto SE",
      "company_seat": "Gauting",
      "details": "24.01.2026 (Bekanntmachungsdatum)\n\nBayern Amtsgericht München HRB 199587\nEinreichung neuer Dokumente\n\nWebasto SE\nEuropäische Aktiengesellschaft (SE)\nGauting\n\nDem Amtsgericht München -Registergericht- sind mehrere Listen der Mitglieder des Aufsichtsrats eingereicht worden, Art. 9 Abs. 1 Buchst. c (ii) SE-VO i.V.m. § 106 AktG."
    },
    {
      "date": "2026-01-24",
      "id": "143375",
      "original_text": "Einreichung neuer Dokumente\nBayern Amtsgericht München HRB 234787\nLinde Holding GmbH – Pullach i.Isartal",
      "type": "Einreichung neuer Dokumente",
      "state": "Bayern",
      "amtsgericht": "Amtsgericht München",
      "registernummer": "HRB 234787",
      "registerart": "HRB",
      "company_name": "Linde Holding GmbH",
      "company_seat": "Pullach i.Isartal",
      "details": "24.01.2026 (Bekanntmachungsdatum)\n\nBayern Amtsgericht München HRB 234787\nEinreichung neuer Dokumente\n\nLinde Holding GmbH\nGesellschaft mit beschränkter Haftung\nPullach i.Isartal\n\nDem Amtsgericht München -Registergericht- ist eine Liste der Mitglieder des Aufsichtsrats eingereicht worden, § 52 Abs. 3 S. 2 GmbHG."
    },
    {
      "date": "2026-01-24",
      "id": "143376",
      "original_text": "Sonstige Registerbekanntmachung\nBayern Amtsgericht München HRB 226329\nPHÖNIX-Seniorenzentrum Gartenstadt GmbH – München",
      "type": "Sonstige Registerbekanntmachung",
      "state": "Bayern",
      "amtsgericht": "Amtsgericht München",
      "registernummer": "HRB 226329",
      "registerart": "HRB",
      "company_name": "PHÖNIX-Seniorenzentrum Gartenstadt GmbH",
      "company_seat": "München",
      "details": "24.01.2026 (Bekanntmachungsdatum)\n\nBayern Amtsgericht München HRB 226329\nSonstige Registerbekanntmachung 23.01.2026 (Eintragungsdatum)\n\nPHÖNIX-Seniorenzentrum Gartenstadt GmbH\nGesellschaft mit beschränkter Haftung\nMünchen\n\nDen Gläubigern der Gesellschaft, deren Forderungen begründet worden sind, bevor die Eintragung der Beendigung des Gewinnabführungsvertrages in das Handelsregister nach § 10 des Handelsgesetzbuches als bekanntgemacht gilt, hat der andere Vertragsteil Sicherheit zu leisten, wenn sie sich binnen sechs Monaten nach der Bekanntmachung der Eintragung zu diesem Zweck bei ihm melden."
    },
    {
      "date": "2026-01-24",
      "id": "143377",
      "original_text": "Registerbekanntmachung nach dem Umwandlungsgesetz\nBayern Amtsgericht München HRB 226329\nPHÖNIX-Seniorenzentrum Gartenstadt GmbH – München",
      "type": "Registerbekanntmachung nach dem Umwandlungsgesetz",
      "state": "Bayern",
      "amtsgericht": "Amtsgericht München",
      "registernummer": "HRB 226329",
      "registerart": "HRB",
      "company_name": "PHÖNIX-Seniorenzentrum Gartenstadt GmbH",
      "company_seat": "München",
      "details": "24.01.2026 (Bekanntmachungsdatum)\n\nBayern Amtsgericht München HRB 226329\nRegisterbekanntmachung nach dem Umwandlungsgesetz 23.01.2026 (Eintragungsdatum)\n\nPHÖNIX-Seniorenzentrum Gartenstadt GmbH\nGesellschaft mit beschränkter Haftung\nMünchen\n\nDen Gläubigern der an der Verschmelzung beteiligten Rechtsträger ist, wenn sie binnen sechs Monaten nach dem Tag, an dem die Eintragung der Verschmelzung in das Register des Sitzes desjenigen Rechtsträgers, dessen Gläubiger sie sind, nach § 19 Abs. 3 UmwG als bekannt gemacht gilt, ihren Anspruch nach Grund und Höhe in Textform anmelden, Sicherheit zu leisten, soweit sie nicht Befriedigung verlangen können. Dieses Recht steht den Gläubigern jedoch nur zu, wenn sie glaubhaft machen, dass durch die Verschmelzung die Erfüllung ihrer Forderung gefährdet wird."
    },
    {
      "date": "2026-01-24",
      "id": "143378",
      "original_text": "Einreichung neuer Dokumente\nBayern Amtsgericht Landshut HRB 401\nERLUS Aktiengesellschaft – Neufahrn/Ndb.",
      "type": "Einreichung neuer Dokumente",
      "state": "Bayern",
      "amtsgericht": "Amtsgericht Landshut",
      "registernummer": "HRB 401",
      "registerart": "HRB",
      "company_name": "ERLUS Aktiengesellschaft",
      "company_seat": "Neufahrn/Ndb.",
      "details": "24.01.2026 (Bekanntmachungsdatum)\n\nBayern Amtsgericht Landshut HRB 401\nEinreichung neuer Dokumente 23.01.2026 (Eintragungsdatum)\n\nERLUS Aktiengesellschaft\nAktiengesellschaft\nNeufahrn/Ndb.\n\nDem Amtsgericht Landshut -Registergericht- ist eine Liste der Mitglieder des Aufsichtsrats eingereicht worden, § 106 AktG."
    },
    {
      "date": "2026-01-24",
      "id": "143379",
      "original_text": "Löschungsankündigung\nBayern Amtsgericht Schweinfurt HRB 9452\nMeisterbetrieb Yildirim & Söhne GmbH – Bad Königshofen im Grabfeld",
      "type": "Löschungsankündigung",
      "state": "Bayern",
      "amtsgericht": "Amtsgericht Schweinfurt",
      "registernummer": "HRB 9452",
      "registerart": "HRB",
      "company_name": "Meisterbetrieb Yildirim & Söhne GmbH",
      "company_seat": "Bad Königshofen im Grabfeld",
      "details": "24.01.2026 (Bekanntmachungsdatum)\n\nBayern Amtsgericht Schweinfurt HRB 9452\nLöschungsankündigung 23.01.2026 (Eintragungsdatum)\n\nMeisterbetrieb Yildirim & Söhne GmbH\nGesellschaft mit beschränkter Haftung\nBad Königshofen im Grabfeld\n\nDas Registergericht beabsichtigt, die im Handelsregister eingetragene Gesellschaft wegen Vermögenslosigkeit von Amts wegen nach § 394 FamFG zu löschen. Die Frist zur Erhebung eines Widerspruchs ist auf einen Monat festgesetzt."
    },
    {
      "date": "2026-01-24",
      "id": "143380",
      "original_text": "Einreichung neuer Dokumente\nBayern Amtsgericht Regensburg HRB 8362\nTELIS Unternehmensgruppe Aktiengesellschaft – Regensburg",
      "type": "Einreichung neuer Dokumente",
      "state": "Bayern",
      "amtsgericht": "Amtsgericht Regensburg",
      "registernummer": "HRB 8362",
      "registerart": "HRB",
      "company_name": "TELIS Unternehmensgruppe Aktiengesellschaft",
      "company_seat": "Regensburg",
      "details": "24.01.2026 (Bekanntmachungsdatum)\n\nBayern Amtsgericht Regensburg HRB 8362\nEinreichung neuer Dokumente\n\nTELIS Unternehmensgruppe Aktiengesellschaft\nAktiengesellschaft\nRegensburg\n\nDem Amtsgericht Regensburg -Registergericht- ist eine Liste der Mitglieder des Aufsichtsrats eingereicht worden, § 106 AktG."
    },
    {
      "date": "2026-01-24",
      "id": "143381",
      "original_text": "Registerbekanntmachung nach dem Umwandlungsgesetz\nBayern Amtsgericht Straubing HRA 7284\nChristian Hafner e.K. – Mitterfels",
      "type": "Registerbekanntmachung nach dem Umwandlungsgesetz",
      "state": "Bayern",
      "amtsgericht": "Amtsgericht Straubing",
      "registernummer": "HRA 7284",
      "registerart": "HRA",
      "company_name": "Christian Hafner e.K.",
      "company_seat": "Mitterfels",
      "details": "24.01.2026 (Bekanntmachungsdatum)\n\nBayern Amtsgericht Straubing HRA 7284\nRegisterbekanntmachung nach dem Umwandlungsgesetz 23.01.2026 (Eintragungsdatum)\n\nChristian Hafner e.K.\nEinzelkaufmann / Einzelkauffrau\nMitterfels\n\nDen Gläubigern der an der Ausgliederung beteiligten Rechtsträger ist, wenn sie binnen sechs Monaten nach dem Tag, an dem die Eintragung der Ausgliederung in das Register des Sitzes desjenigen Rechtsträgers, dessen Gläubiger sie sind, nach §§ 125, 19 Abs. 3 UmwG als bekannt gemacht gilt, ihren Anspruch nach Grund und Höhe in Textform anmelden, Sicherheit zu leisten, soweit sie nicht Befriedigung verlangen können. Dieses Recht steht den Gläubigern jedoch nur zu, wenn sie glaubhaft machen, dass durch die Ausgliederung die Erfüllung ihrer Forderung gefährdet wird."
    },
    {
      "date": "2026-01-24",
      "id": "143382",
      "original_text": "Registerbekanntmachung nach dem Umwandlungsgesetz\nBayern Amtsgericht Würzburg HRB 3368\nWULFENIA-Engineering Gesellschaft für Industrieanlagenbau mbH – Estenfeld",
      "type": "Registerbekanntmachung nach dem Umwandlungsgesetz",
      "state": "Bayern",
      "amtsgericht": "Amtsgericht Würzburg",
      "registernummer": "HRB 3368",
      "registerart": "HRB",
      "company_name": "WULFENIA-Engineering Gesellschaft für Industrieanlagenbau mbH",
      "company_seat": "Estenfeld",
      "details": "24.01.2026 (Bekanntmachungsdatum)\n\nBayern Amtsgericht Würzburg HRB 3368\nRegisterbekanntmachung nach dem Umwandlungsgesetz 23.01.2026 (Eintragungsdatum)\n\nWULFENIA-Engineering Gesellschaft für Industrieanlagenbau mbH\nGesellschaft mit beschränkter Haftung\nEstenfeld\n\nDen Gläubigern der an der Spaltung beteiligten Rechtsträger ist, wenn sie binnen sechs Monaten nach dem Tag, an dem die Eintragung der Spaltung in das Register des Sitzes desjenigen Rechtsträgers, dessen Gläubiger sie sind, nach §§ 125, 19 Abs. 3 UmwG als bekannt gemacht gilt, ihren Anspruch nach Grund und Höhe in Textform anmelden, Sicherheit zu leisten, soweit sie nicht Befriedigung verlangen können. Dieses Recht steht den Gläubigern jedoch nur zu, wenn sie glaubhaft machen, dass durch die Spaltung die Erfüllung ihrer Forderung gefährdet wird."
    },
    {
      "date": "2026-01-24",
      "id": "143383",
      "original_text": "Registerbekanntmachung nach dem Umwandlungsgesetz\nBayern Amtsgericht Nürnberg HRB 18841\nMaringer Verwaltungs GmbH – Schwabach",
      "type": "Registerbekanntmachung nach dem Umwandlungsgesetz",
      "state": "Bayern",
      "amtsgericht": "Amtsgericht Nürnberg",
      "registernummer": "HRB 18841",
      "registerart": "HRB",
      "company_name": "Maringer Verwaltungs GmbH",
      "company_seat": "Schwabach",
      "details": "24.01.2026 (Bekanntmachungsdatum)\n\nBayern Amtsgericht Nürnberg HRB 18841\nRegisterbekanntmachung nach dem Umwandlungsgesetz 23.01.2026 (Eintragungsdatum)\n\nMaringer Verwaltungs GmbH\nGesellschaft mit beschränkter Haftung\nSchwabach\n\nDen Gläubigern der an der Verschmelzung beteiligten Rechtsträger ist, wenn sie binnen sechs Monaten nach dem Tag, an dem die Eintragung der Verschmelzung in das Register des Sitzes desjenigen Rechtsträgers, dessen Gläubiger sie sind, nach § 19 Abs. 3 UmwG als bekannt gemacht gilt, ihren Anspruch nach Grund und Höhe in Textform anmelden, Sicherheit zu leisten, soweit sie nicht Befriedigung verlangen können. Dieses Recht steht den Gläubigern jedoch nur zu, wenn sie glaubhaft machen, dass durch die Verschmelzung die Erfüllung ihrer Forderung gefährdet wird."
    },
    {
      "date": "2026-01-24",
      "id": "143384",
      "original_text": "Registerbekanntmachung nach dem Umwandlungsgesetz\nBayern Amtsgericht Nürnberg HRB 23663\nGilch Verwaltungs GmbH – Abenberg",
      "type": "Registerbekanntmachung nach dem Umwandlungsgesetz",
      "state": "Bayern",
      "amtsgericht": "Amtsgericht Nürnberg",
      "registernummer": "HRB 23663",
      "registerart": "HRB",
      "company_name": "Gilch Verwaltungs GmbH",
      "company_seat": "Abenberg",
      "details": "24.01.2026 (Bekanntmachungsdatum)\n\nBayern Amtsgericht Nürnberg HRB 23663\nRegisterbekanntmachung nach dem Umwandlungsgesetz 23.01.2026 (Eintragungsdatum)\n\nGilch Verwaltungs GmbH\nGesellschaft mit beschränkter Haftung\nAbenberg\n\nDen Gläubigern der an der Verschmelzung beteiligten Rechtsträger ist, wenn sie binnen sechs Monaten nach dem Tag, an dem die Eintragung der Verschmelzung in das Register des Sitzes desjenigen Rechtsträgers, dessen Gläubiger sie sind, nach § 19 Abs. 3 UmwG als bekannt gemacht gilt, ihren Anspruch nach Grund und Höhe in Textform anmelden, Sicherheit zu leisten, soweit sie nicht Befriedigung verlangen können. Dieses Recht steht den Gläubigern jedoch nur zu, wenn sie glaubhaft machen, dass durch die Verschmelzung die Erfüllung ihrer Forderung gefährdet wird."
    },
    {
      "date": "2026-01-24",
      "id": "143385",
      "original_text": "Sonstige Registerbekanntmachung\nBayern Amtsgericht Landshut HRB 10990\nMossandl Umwelt-Service GmbH – Dingolfing",
      "type": "Sonstige Registerbekanntmachung",
      "state": "Bayern",
      "amtsgericht": "Amtsgericht Landshut",
      "registernummer": "HRB 10990",
      "registerart": "HRB",
      "company_name": "Mossandl Umwelt-Service GmbH",
      "company_seat": "Dingolfing",
      "details": "24.01.2026 (Bekanntmachungsdatum)\n\nBayern Amtsgericht Landshut HRB 10990\nSonstige Registerbekanntmachung 23.01.2026 (Eintragungsdatum)\n\nMossandl Umwelt-Service GmbH\nGesellschaft mit beschränkter Haftung\nDingolfing\n\nDen Gläubigern der Gesellschaft, deren Forderungen begründet worden sind, bevor die Eintragung der Beendigung des Gewinnabführungsvertrages in das Handelsregister nach § 10 des Handelsgesetzbuches als bekanntgemacht gilt, hat der andere Vertragsteil Sicherheit zu leisten, wenn sie sich binnen sechs Monaten nach der Bekanntmachung der Eintragung zu diesem Zweck bei ihm melden."
    },
    {
      "date": "2026-01-24",
      "id": "143386",
      "original_text": "Registerbekanntmachung nach dem Umwandlungsgesetz\nBayern Amtsgericht Nürnberg HRB 34027\nInnovative solutions 4 health & education GmbH – Röthenbach a.d.Pegnitz",
      "type": "Registerbekanntmachung nach dem Umwandlungsgesetz",
      "state": "Bayern",
      "amtsgericht": "Amtsgericht Nürnberg",
      "registernummer": "HRB 34027",
      "registerart": "HRB",
      "company_name": "Innovative solutions 4 health & education GmbH",
      "company_seat": "Röthenbach a.d.Pegnitz",
      "details": "24.01.2026 (Bekanntmachungsdatum)\n\nBayern Amtsgericht Nürnberg HRB 34027\nRegisterbekanntmachung nach dem Umwandlungsgesetz 23.01.2026 (Eintragungsdatum)\n\nInnovative solutions 4 health & education GmbH\nGesellschaft mit beschränkter Haftung\nRöthenbach a.d.Pegnitz\n\nDen Gläubigern der an der Verschmelzung beteiligten Rechtsträger ist, wenn sie binnen sechs Monaten nach dem Tag, an dem die Eintragung der Verschmelzung in das Register des Sitzes desjenigen Rechtsträgers, dessen Gläubiger sie sind, nach § 19 Abs. 3 UmwG als bekannt gemacht gilt, ihren Anspruch nach Grund und Höhe in Textform anmelden, Sicherheit zu leisten, soweit sie nicht Befriedigung verlangen können. Dieses Recht steht den Gläubigern jedoch nur zu, wenn sie glaubhaft machen, dass durch die Verschmelzung die Erfüllung ihrer Forderung gefährdet wird."
    },
    {
      "date": "2026-01-24",
      "id": "143387",
      "original_text": "Löschungsankündigung\nBayern Amtsgericht Fürth HRB 19325\nAlbu GmbH – Zirndorf",
      "type": "Löschungsankündigung",
      "state": "Bayern",
      "amtsgericht": "Amtsgericht Fürth",
      "registernummer": "HRB 19325",
      "registerart": "HRB",
      "company_name": "Albu GmbH",
      "company_seat": "Zirndorf",
      "details": "24.01.2026 (Bekanntmachungsdatum)\n\nBayern Amtsgericht Fürth HRB 19325\nLöschungsankündigung 23.01.2026 (Eintragungsdatum)\n\nAlbu GmbH\nGesellschaft mit beschränkter Haftung\nZirndorf\n\nDas Registergericht beabsichtigt, die im Handelsregister eingetragene Gesellschaft wegen Vermögenslosigkeit von Amts wegen nach § 394 FamFG zu löschen. Die Frist zur Erhebung eines Widerspruchs ist auf drei Monate festgesetzt."
    },
    {
      "date": "2026-01-24",
      "id": "143388",
      "original_text": "Registerbekanntmachung nach dem Umwandlungsgesetz\nBayern Amtsgericht Würzburg HRB 15112\nSFM Property GmbH – Estenfeld",
      "type": "Registerbekanntmachung nach dem Umwandlungsgesetz",
      "state": "Bayern",
      "amtsgericht": "Amtsgericht Würzburg",
      "registernummer": "HRB 15112",
      "registerart": "HRB",
      "company_name": "SFM Property GmbH",
      "company_seat": "Estenfeld",
      "details": "24.01.2026 (Bekanntmachungsdatum)\n\nBayern Amtsgericht Würzburg HRB 15112\nRegisterbekanntmachung nach dem Umwandlungsgesetz 23.01.2026 (Eintragungsdatum)\n\nSFM Property GmbH\nGesellschaft mit beschränkter Haftung\nEstenfeld\n\nDen Gläubigern der an der Spaltung beteiligten Rechtsträger ist, wenn sie binnen sechs Monaten nach dem Tag, an dem die Eintragung der Spaltung in das Register des Sitzes desjenigen Rechtsträgers, dessen Gläubiger sie sind, nach §§ 125, 19 Abs. 3 UmwG als bekannt gemacht gilt, ihren Anspruch nach Grund und Höhe in Textform anmelden, Sicherheit zu leisten, soweit sie nicht Befriedigung verlangen können. Dieses Recht steht den Gläubigern jedoch nur zu, wenn sie glaubhaft machen, dass durch die Spaltung die Erfüllung ihrer Forderung gefährdet wird.Den Gläubigern der an der Spaltung beteiligten Rechtsträger ist, wenn sie binnen sechs Monaten nach dem Tag, an dem die Eintragung der Spaltung in das Register des Sitzes desjenigen Rechtsträgers, dessen Gläubiger sie sind, nach §§ 125, 19 Abs. 3 UmwG als bekannt gemacht gilt, ihren Anspruch nach Grund und Höhe in Textform anmelden, Sicherheit zu leisten, soweit sie nicht Befriedigung verlangen können. Dieses Recht steht den Gläubigern jedoch nur zu, wenn sie glaubhaft machen, dass durch die Spaltung die Erfüllung ihrer Forderung gefährdet wird."
    },
    {
      "date": "2026-01-24",
      "id": "143389",
      "original_text": "Löschungsankündigung\nBayern Amtsgericht Schweinfurt HRB 7863\nBad Mergentheimer Diskotheken Verwaltungsgesellschaft mbH – Bad Neustadt a.d. Saale",
      "type": "Löschungsankündigung",
      "state": "Bayern",
      "amtsgericht": "Amtsgericht Schweinfurt",
      "registernummer": "HRB 7863",
      "registerart": "HRB",
      "company_name": "Bad Mergentheimer Diskotheken Verwaltungsgesellschaft mbH",
      "company_seat": "Bad Neustadt a.d. Saale",
      "details": "24.01.2026 (Bekanntmachungsdatum)\n\nBayern Amtsgericht Schweinfurt HRB 7863\nLöschungsankündigung 23.01.2026 (Eintragungsdatum)\n\nBad Mergentheimer Diskotheken Verwaltungsgesellschaft mbH\nGesellschaft mit beschränkter Haftung\nBad Neustadt a.d. Saale\n\nDas Registergericht beabsichtigt, die im Handelsregister eingetragene Gesellschaft wegen Vermögenslosigkeit von Amts wegen nach § 394 FamFG zu löschen. Die Frist zur Erhebung eines Widerspruchs ist auf einen Monat festgesetzt."
    },
    {
      "date": "2026-01-24",
      "id": "143390",
      "original_text": "Löschungsankündigung\nRheinland-Pfalz Amtsgericht Kaiserslautern HRA 30612\nIV & WE Limited & Co. KG – Altenglan",
      "type": "Löschungsankündigung",
      "state": "Rheinland-Pfalz",
      "amtsgericht": "Amtsgericht Kaiserslautern",
      "registernummer": "HRA 30612",
      "registerart": "HRA",
      "company_name": "IV & WE Limited & Co. KG",
      "company_seat": "Altenglan",
      "details": "24.01.2026 (Bekanntmachungsdatum)\n\nRheinland-Pfalz Amtsgericht Kaiserslautern HRA 30612\nLöschungsankündigung 24.01.2026 (Eintragungsdatum)\n\nIV & WE Limited & Co. KG\nKommanditgesellschaft\nAltenglan\n\nDas Registergericht beabsichtigt, die vorgenannte Firma gemäß § 393 FamFG FamFG in Verbindung mit § 31 Absatz 2 HGB wegen Aufgabe des Geschäftsbetriebs aus dem Handelsregister zu löschen. Widerspruch gegen die Löschung kann nur binnen 3 Monaten ab Veröffentlichung dieser Verfügung eingelegt werden"
    }
  ]
}