{
  "date": "2026-01-08",
  "date_of_scrape": "2026-01-09T04:23:17.830Z",
  "tool_version": "0.2.0",
  "number_of_announcements": 133,
  "announcements": [
    {
      "date": "2026-01-08",
      "id": "141784",
      "original_text": "Einreichung neuer Dokumente\nBayern Amtsgericht München HRB 266452\nECOMMERCE ONE HoldCo GmbH – München",
      "type": "Einreichung neuer Dokumente",
      "state": "Bayern",
      "amtsgericht": "Amtsgericht München",
      "registernummer": "HRB 266452",
      "registerart": "HRB",
      "company_name": "ECOMMERCE ONE HoldCo GmbH",
      "company_seat": "München",
      "details": "08.01.2026 (Bekanntmachungsdatum)\n\nBayern Amtsgericht München HRB 266452\nEinreichung neuer Dokumente 07.01.2026 (Eintragungsdatum)\n\nECOMMERCE ONE HoldCo GmbH\nGesellschaft mit beschränkter Haftung\nMünchen\n\nDem Amtsgericht München -Registergericht- ist eine Liste der Mitglieder des Aufsichtsrats eingereicht worden, § 52 Abs. 3 S. 2 GmbHG."
    },
    {
      "date": "2026-01-08",
      "id": "141785",
      "original_text": "Registerbekanntmachung nach dem Umwandlungsgesetz\nBayern Amtsgericht München HRB 231578\nDr. Mathias Müller Beteiligungs UG (haftungsbeschränkt) – Gröbenzell",
      "type": "Registerbekanntmachung nach dem Umwandlungsgesetz",
      "state": "Bayern",
      "amtsgericht": "Amtsgericht München",
      "registernummer": "HRB 231578",
      "registerart": "HRB",
      "company_name": "Dr. Mathias Müller Beteiligungs UG (haftungsbeschränkt)",
      "company_seat": "Gröbenzell",
      "details": "08.01.2026 (Bekanntmachungsdatum)\n\nBayern Amtsgericht München HRB 231578\nRegisterbekanntmachung nach dem Umwandlungsgesetz 07.01.2026 (Eintragungsdatum)\n\nDr. Mathias Müller Beteiligungs UG (haftungsbeschränkt)\nGesellschaft mit beschränkter Haftung\nGröbenzell\n\nDen Gläubigern der an der Verschmelzung beteiligten Rechtsträger ist, wenn sie binnen sechs Monaten nach dem Tag, an dem die Eintragung der Verschmelzung in das Register des Sitzes desjenigen Rechtsträgers, dessen Gläubiger sie sind, nach § 19 Abs. 3 UmwG als bekannt gemacht gilt, ihren Anspruch nach Grund und Höhe in Textform anmelden, Sicherheit zu leisten, soweit sie nicht Befriedigung verlangen können. Dieses Recht steht den Gläubigern jedoch nur zu, wenn sie glaubhaft machen, dass durch die Verschmelzung die Erfüllung ihrer Forderung gefährdet wird."
    },
    {
      "date": "2026-01-08",
      "id": "141786",
      "original_text": "Registerbekanntmachung nach dem Umwandlungsgesetz\nBayern Amtsgericht München HRB 263976\nAfinum Verwaltungs GmbH – München",
      "type": "Registerbekanntmachung nach dem Umwandlungsgesetz",
      "state": "Bayern",
      "amtsgericht": "Amtsgericht München",
      "registernummer": "HRB 263976",
      "registerart": "HRB",
      "company_name": "Afinum Verwaltungs GmbH",
      "company_seat": "München",
      "details": "08.01.2026 (Bekanntmachungsdatum)\n\nBayern Amtsgericht München HRB 263976\nRegisterbekanntmachung nach dem Umwandlungsgesetz 07.01.2026 (Eintragungsdatum)\n\nAfinum Verwaltungs GmbH\nGesellschaft mit beschränkter Haftung\nMünchen\n\nDen Gläubigern der an der Verschmelzung beteiligten Rechtsträger ist, wenn sie binnen sechs Monaten nach dem Tag, an dem die Eintragung der Verschmelzung in das Register des Sitzes desjenigen Rechtsträgers, dessen Gläubiger sie sind, nach § 19 Abs. 3 UmwG als bekannt gemacht gilt, ihren Anspruch nach Grund und Höhe in Textform anmelden, Sicherheit zu leisten, soweit sie nicht Befriedigung verlangen können. Dieses Recht steht den Gläubigern jedoch nur zu, wenn sie glaubhaft machen, dass durch die Verschmelzung die Erfüllung ihrer Forderung gefährdet wird."
    },
    {
      "date": "2026-01-08",
      "id": "141787",
      "original_text": "Registerbekanntmachung nach dem Umwandlungsgesetz\nBayern Amtsgericht München HRB 218686\nAMEET Verlag GmbH – München",
      "type": "Registerbekanntmachung nach dem Umwandlungsgesetz",
      "state": "Bayern",
      "amtsgericht": "Amtsgericht München",
      "registernummer": "HRB 218686",
      "registerart": "HRB",
      "company_name": "AMEET Verlag GmbH",
      "company_seat": "München",
      "details": "08.01.2026 (Bekanntmachungsdatum)\n\nBayern Amtsgericht München HRB 218686\nRegisterbekanntmachung nach dem Umwandlungsgesetz 07.01.2026 (Eintragungsdatum)\n\nAMEET Verlag GmbH\nGesellschaft mit beschränkter Haftung\nMünchen\n\nDen Gläubigern der an der Verschmelzung beteiligten Rechtsträger ist, wenn sie binnen sechs Monaten nach dem Tag, an dem die Eintragung der Verschmelzung in das Register des Sitzes desjenigen Rechtsträgers, dessen Gläubiger sie sind, nach § 19 Abs. 3 UmwG als bekannt gemacht gilt, ihren Anspruch nach Grund und Höhe in Textform anmelden, Sicherheit zu leisten, soweit sie nicht Befriedigung verlangen können. Dieses Recht steht den Gläubigern jedoch nur zu, wenn sie glaubhaft machen, dass durch die Verschmelzung die Erfüllung ihrer Forderung gefährdet wird."
    },
    {
      "date": "2026-01-08",
      "id": "141788",
      "original_text": "Einreichung neuer Dokumente\nBayern Amtsgericht Memmingen HRB 14962\nFairPreis Bestattungsbedarf AG – Waltenhausen",
      "type": "Einreichung neuer Dokumente",
      "state": "Bayern",
      "amtsgericht": "Amtsgericht Memmingen",
      "registernummer": "HRB 14962",
      "registerart": "HRB",
      "company_name": "FairPreis Bestattungsbedarf AG",
      "company_seat": "Waltenhausen",
      "details": "08.01.2026 (Bekanntmachungsdatum)\n\nBayern Amtsgericht Memmingen HRB 14962\nEinreichung neuer Dokumente\n\nFairPreis Bestattungsbedarf AG\nAktiengesellschaft\nWaltenhausen\n\nDem Amtsgericht Memmingen -Registergericht- ist eine Liste der Mitglieder des Aufsichtsrats eingereicht worden, § 106 AktG."
    },
    {
      "date": "2026-01-08",
      "id": "141789",
      "original_text": "Sonstige Registerbekanntmachung\nBayern Amtsgericht München HRB 180869\nDF Deutsche Finance Managing GmbH – München",
      "type": "Sonstige Registerbekanntmachung",
      "state": "Bayern",
      "amtsgericht": "Amtsgericht München",
      "registernummer": "HRB 180869",
      "registerart": "HRB",
      "company_name": "DF Deutsche Finance Managing GmbH",
      "company_seat": "München",
      "details": "08.01.2026 (Bekanntmachungsdatum)\n\nBayern Amtsgericht München HRB 180869\nSonstige Registerbekanntmachung 07.01.2026 (Eintragungsdatum)\n\nDF Deutsche Finance Managing GmbH\nGesellschaft mit beschränkter Haftung\nMünchen\n\nDen Gläubigern der Gesellschaft, deren Forderungen begründet worden sind, bevor die Eintragung der Beendigung des Gewinnabführungsvertrages in das Handelsregister nach § 10 des Handelsgesetzbuches als bekanntgemacht gilt, hat der andere Vertragsteil Sicherheit zu leisten, wenn sie sich binnen sechs Monaten nach der Bekanntmachung der Eintragung zu diesem Zweck bei ihm melden."
    },
    {
      "date": "2026-01-08",
      "id": "141790",
      "original_text": "Sonstige Registerbekanntmachung\nBayern Amtsgericht München HRB 287562\nRemote Solutions Germany GmbH – München",
      "type": "Sonstige Registerbekanntmachung",
      "state": "Bayern",
      "amtsgericht": "Amtsgericht München",
      "registernummer": "HRB 287562",
      "registerart": "HRB",
      "company_name": "Remote Solutions Germany GmbH",
      "company_seat": "München",
      "details": "08.01.2026 (Bekanntmachungsdatum)\n\nBayern Amtsgericht München HRB 287562\nSonstige Registerbekanntmachung 07.01.2026 (Eintragungsdatum)\n\nRemote Solutions Germany GmbH\nGesellschaft mit beschränkter Haftung\nMünchen\n\nDen Gläubigern der Gesellschaft, deren Forderungen begründet worden sind, bevor die Eintragung der Beendigung des Gewinnabführungsvertrages in das Handelsregister nach § 10 des Handelsgesetzbuches als bekanntgemacht gilt, hat der andere Vertragsteil Sicherheit zu leisten, wenn sie sich binnen sechs Monaten nach der Bekanntmachung der Eintragung zu diesem Zweck bei ihm melden."
    },
    {
      "date": "2026-01-08",
      "id": "141791",
      "original_text": "Registerbekanntmachung nach dem Umwandlungsgesetz\nBayern Amtsgericht Kempten (Allgäu) HRB 11245\ntimotio AG – Oberstdorf",
      "type": "Registerbekanntmachung nach dem Umwandlungsgesetz",
      "state": "Bayern",
      "amtsgericht": "Amtsgericht Kempten (Allgäu)",
      "registernummer": "HRB 11245",
      "registerart": "HRB",
      "company_name": "timotio AG",
      "company_seat": "Oberstdorf",
      "details": "08.01.2026 (Bekanntmachungsdatum)\n\nBayern Amtsgericht Kempten (Allgäu) HRB 11245\nRegisterbekanntmachung nach dem Umwandlungsgesetz 07.01.2025 (Eintragungsdatum)\n\ntimotio AG\nAktiengesellschaft\nOberstdorf\n\nDem Amtsgericht Kempten (Allgäu) -Registergericht- ist der Entwurf eines  Verschmelzungsvertrages zwischen der Gesellschaft als übertragendem Rechtsträger und dem alleinigen Aktionär Dr. Timo Eifert, Oberstdorf, als Übernehmer zur Einsichtnahme eingereicht worden."
    },
    {
      "date": "2026-01-08",
      "id": "141792",
      "original_text": "Sonstige Registerbekanntmachung\nBayern Amtsgericht München HRB 78528\nTÜV SÜD Akademie GmbH – München",
      "type": "Sonstige Registerbekanntmachung",
      "state": "Bayern",
      "amtsgericht": "Amtsgericht München",
      "registernummer": "HRB 78528",
      "registerart": "HRB",
      "company_name": "TÜV SÜD Akademie GmbH",
      "company_seat": "München",
      "details": "08.01.2026 (Bekanntmachungsdatum)\n\nBayern Amtsgericht München HRB 78528\nSonstige Registerbekanntmachung 07.01.2026 (Eintragungsdatum)\n\nTÜV SÜD Akademie GmbH\nGesellschaft mit beschränkter Haftung\nMünchen\n\nDen Gläubigern der Gesellschaft, deren Forderungen begründet worden sind, bevor die Eintragung der Beendigung des Beherrschungs- und Gewinnabführungsvertrages in das Handelsregister nach § 10 des Handelsgesetzbuches als bekanntgemacht gilt, hat der andere Vertragsteil Sicherheit zu leisten, wenn sie sich binnen sechs Monaten nach der Bekanntmachung der Eintragung zu diesem Zweck bei ihm melden."
    },
    {
      "date": "2026-01-08",
      "id": "141793",
      "original_text": "Registerbekanntmachung nach dem Umwandlungsgesetz\nBayern Amtsgericht München HRA 122133\nHalbherr Ayurveda e.K. – München",
      "type": "Registerbekanntmachung nach dem Umwandlungsgesetz",
      "state": "Bayern",
      "amtsgericht": "Amtsgericht München",
      "registernummer": "HRA 122133",
      "registerart": "HRA",
      "company_name": "Halbherr Ayurveda e.K.",
      "company_seat": "München",
      "details": "08.01.2026 (Bekanntmachungsdatum)\n\nBayern Amtsgericht München HRA 122133\nRegisterbekanntmachung nach dem Umwandlungsgesetz 07.01.2026 (Eintragungsdatum)\n\nHalbherr Ayurveda e.K.\nEinzelkaufmann / Einzelkauffrau\nMünchen\n\nDen Gläubigern der an der Verschmelzung beteiligten Rechtsträger ist, wenn sie binnen sechs Monaten nach dem Tag, an dem die Eintragung der Verschmelzung in das Register des Sitzes desjenigen Rechtsträgers, dessen Gläubiger sie sind, nach § 19 Abs. 3 UmwG als bekannt gemacht gilt, ihren Anspruch nach Grund und Höhe in Textform anmelden, Sicherheit zu leisten, soweit sie nicht Befriedigung verlangen können. Dieses Recht steht den Gläubigern jedoch nur zu, wenn sie glaubhaft machen, dass durch die Verschmelzung die Erfüllung ihrer Forderung gefährdet wird."
    },
    {
      "date": "2026-01-08",
      "id": "141794",
      "original_text": "Registerbekanntmachung nach dem Umwandlungsgesetz\nBayern Amtsgericht München HRB 307156\nFMK Invest GmbH – München",
      "type": "Registerbekanntmachung nach dem Umwandlungsgesetz",
      "state": "Bayern",
      "amtsgericht": "Amtsgericht München",
      "registernummer": "HRB 307156",
      "registerart": "HRB",
      "company_name": "FMK Invest GmbH",
      "company_seat": "München",
      "details": "08.01.2026 (Bekanntmachungsdatum)\n\nBayern Amtsgericht München HRB 307156\nRegisterbekanntmachung nach dem Umwandlungsgesetz 07.01.2026 (Eintragungsdatum)\n\nFMK Invest GmbH\nGesellschaft mit beschränkter Haftung\nMünchen\n\nDen Gläubigern der an der Spaltung beteiligten Rechtsträger ist, wenn sie binnen sechs Monaten nach dem Tag, an dem die Eintragung der Spaltung in das Register des Sitzes desjenigen Rechtsträgers, dessen Gläubiger sie sind, nach §§ 125, 19 Abs. 3 UmwG als bekannt gemacht gilt, ihren Anspruch nach Grund und Höhe in Textform anmelden, Sicherheit zu leisten, soweit sie nicht Befriedigung verlangen können. Dieses Recht steht den Gläubigern jedoch nur zu, wenn sie glaubhaft machen, dass durch die Spaltung die Erfüllung ihrer Forderung gefährdet wird."
    },
    {
      "date": "2026-01-08",
      "id": "141795",
      "original_text": "Sonstige Registerbekanntmachung\nBayern Amtsgericht München HRB 290187\nTierärztliche Praxis Fohlenweide GmbH – Königsdorf",
      "type": "Sonstige Registerbekanntmachung",
      "state": "Bayern",
      "amtsgericht": "Amtsgericht München",
      "registernummer": "HRB 290187",
      "registerart": "HRB",
      "company_name": "Tierärztliche Praxis Fohlenweide GmbH",
      "company_seat": "Königsdorf",
      "details": "08.01.2026 (Bekanntmachungsdatum)\n\nBayern Amtsgericht München HRB 290187\nSonstige Registerbekanntmachung 07.01.2026 (Eintragungsdatum)\n\nTierärztliche Praxis Fohlenweide GmbH\nGesellschaft mit beschränkter Haftung\nKönigsdorf\n\nDen Gläubigern der Gesellschaft, deren Forderungen begründet worden sind, bevor die Eintragung der Beendigung des Gewinnabführungsvertrages in das Handelsregister nach § 10 des Handelsgesetzbuches als bekanntgemacht gilt, hat der andere Vertragsteil Sicherheit zu leisten, wenn sie sich binnen sechs Monaten nach der Bekanntmachung der Eintragung zu diesem Zweck bei ihm melden."
    },
    {
      "date": "2026-01-08",
      "id": "141796",
      "original_text": "Registerbekanntmachung nach dem Umwandlungsgesetz\nBayern Amtsgericht München HRB 299068\nCATG Trust GmbH – München",
      "type": "Registerbekanntmachung nach dem Umwandlungsgesetz",
      "state": "Bayern",
      "amtsgericht": "Amtsgericht München",
      "registernummer": "HRB 299068",
      "registerart": "HRB",
      "company_name": "CATG Trust GmbH",
      "company_seat": "München",
      "details": "08.01.2026 (Bekanntmachungsdatum)\n\nBayern Amtsgericht München HRB 299068\nRegisterbekanntmachung nach dem Umwandlungsgesetz 07.01.2026 (Eintragungsdatum)\n\nCATG Trust GmbH\nGesellschaft mit beschränkter Haftung\nMünchen\n\nDen Gläubigern der an der Verschmelzung beteiligten Rechtsträger ist, wenn sie binnen sechs Monaten nach dem Tag, an dem die Eintragung der Verschmelzung in das Register des Sitzes desjenigen Rechtsträgers, dessen Gläubiger sie sind, nach § 19 Abs. 3 UmwG als bekannt gemacht gilt, ihren Anspruch nach Grund und Höhe in Textform anmelden, Sicherheit zu leisten, soweit sie nicht Befriedigung verlangen können. Dieses Recht steht den Gläubigern jedoch nur zu, wenn sie glaubhaft machen, dass durch die Verschmelzung die Erfüllung ihrer Forderung gefährdet wird."
    },
    {
      "date": "2026-01-08",
      "id": "141797",
      "original_text": "Registerbekanntmachung nach dem Umwandlungsgesetz\nBayern Amtsgericht Augsburg HRB 41062\nVeteo GmbH – Augsburg",
      "type": "Registerbekanntmachung nach dem Umwandlungsgesetz",
      "state": "Bayern",
      "amtsgericht": "Amtsgericht Augsburg",
      "registernummer": "HRB 41062",
      "registerart": "HRB",
      "company_name": "Veteo GmbH",
      "company_seat": "Augsburg",
      "details": "08.01.2026 (Bekanntmachungsdatum)\n\nBayern Amtsgericht Augsburg HRB 41062\nRegisterbekanntmachung nach dem Umwandlungsgesetz 07.01.2026 (Eintragungsdatum)\n\nVeteo GmbH\nGesellschaft mit beschränkter Haftung\nAugsburg\n\nDen Gläubigern der an der Verschmelzung beteiligten Rechtsträger ist, wenn sie binnen sechs Monaten nach dem Tag, an dem die Eintragung der Verschmelzung in das Register des Sitzes desjenigen Rechtsträgers, dessen Gläubiger sie sind, nach § 19 Abs. 3 UmwG als bekannt gemacht gilt, ihren Anspruch nach Grund und Höhe in Textform anmelden, Sicherheit zu leisten, soweit sie nicht Befriedigung verlangen können. Dieses Recht steht den Gläubigern jedoch nur zu, wenn sie glaubhaft machen, dass durch die Verschmelzung die Erfüllung ihrer Forderung gefährdet wird."
    },
    {
      "date": "2026-01-08",
      "id": "141798",
      "original_text": "Einreichung neuer Dokumente\nBayern Amtsgericht München HRB 143897\nCNC - Communications and Network Consulting AG – München",
      "type": "Einreichung neuer Dokumente",
      "state": "Bayern",
      "amtsgericht": "Amtsgericht München",
      "registernummer": "HRB 143897",
      "registerart": "HRB",
      "company_name": "CNC - Communications and Network Consulting AG",
      "company_seat": "München",
      "details": "08.01.2026 (Bekanntmachungsdatum)\n\nBayern Amtsgericht München HRB 143897\nEinreichung neuer Dokumente\n\nCNC - Communications and Network Consulting AG\nAktiengesellschaft\nMünchen\n\nDem Amtsgericht München -Registergericht- ist eine Liste der Mitglieder des Aufsichtsrats eingereicht worden, § 106 AktG."
    },
    {
      "date": "2026-01-08",
      "id": "141799",
      "original_text": "Registerbekanntmachung nach dem Umwandlungsgesetz\nBayern Amtsgericht Traunstein HRB 20432\nBüro auf Rädern GmbH – Raubling",
      "type": "Registerbekanntmachung nach dem Umwandlungsgesetz",
      "state": "Bayern",
      "amtsgericht": "Amtsgericht Traunstein",
      "registernummer": "HRB 20432",
      "registerart": "HRB",
      "company_name": "Büro auf Rädern GmbH",
      "company_seat": "Raubling",
      "details": "08.01.2026 (Bekanntmachungsdatum)\n\nBayern Amtsgericht Traunstein HRB 20432\nRegisterbekanntmachung nach dem Umwandlungsgesetz 07.01.2026 (Eintragungsdatum)\n\nBüro auf Rädern GmbH\nGesellschaft mit beschränkter Haftung\nRaubling\n\nDen Gläubigern der an der Verschmelzung beteiligten Rechtsträger ist, wenn sie binnen sechs Monaten nach dem Tag, an dem die Eintragung der Verschmelzung in das Register des Sitzes desjenigen Rechtsträgers, dessen Gläubiger sie sind, nach § 19 Abs. 3 UmwG als bekannt gemacht gilt, ihren Anspruch nach Grund und Höhe in Textform anmelden, Sicherheit zu leisten, soweit sie nicht Befriedigung verlangen können. Dieses Recht steht den Gläubigern jedoch nur zu, wenn sie glaubhaft machen, dass durch die Verschmelzung die Erfüllung ihrer Forderung gefährdet wird."
    },
    {
      "date": "2026-01-08",
      "id": "141800",
      "original_text": "Löschungsankündigung\nBayern Amtsgericht Traunstein HRB 32293\nMabia UG (haftungsbeschränkt) – Freilassing",
      "type": "Löschungsankündigung",
      "state": "Bayern",
      "amtsgericht": "Amtsgericht Traunstein",
      "registernummer": "HRB 32293",
      "registerart": "HRB",
      "company_name": "Mabia UG (haftungsbeschränkt)",
      "company_seat": "Freilassing",
      "details": "08.01.2026 (Bekanntmachungsdatum)\n\nBayern Amtsgericht Traunstein HRB 32293\nLöschungsankündigung 07.01.2025 (Eintragungsdatum)\n\nMabia UG (haftungsbeschränkt)\nGesellschaft mit beschränkter Haftung\nFreilassing\n\nDas Registergericht beabsichtigt, die im Handelsregister eingetragene Gesellschaft wegen Vermögenslosigkeit von Amts wegen nach § 394 FamFG zu löschen. Die Frist zur Erhebung eines Widerspruchs ist auf einen Monat festgesetzt."
    },
    {
      "date": "2026-01-08",
      "id": "141801",
      "original_text": "Registerbekanntmachung nach dem Umwandlungsgesetz\nBayern Amtsgericht Passau HRB 6240\nB/O Shop Vertriebs GmbH – Ruderting",
      "type": "Registerbekanntmachung nach dem Umwandlungsgesetz",
      "state": "Bayern",
      "amtsgericht": "Amtsgericht Passau",
      "registernummer": "HRB 6240",
      "registerart": "HRB",
      "company_name": "B/O Shop Vertriebs GmbH",
      "company_seat": "Ruderting",
      "details": "08.01.2026 (Bekanntmachungsdatum)\n\nBayern Amtsgericht Passau HRB 6240\nRegisterbekanntmachung nach dem Umwandlungsgesetz 07.01.2026 (Eintragungsdatum)\n\nB/O Shop Vertriebs GmbH\nGesellschaft mit beschränkter Haftung\nRuderting\n\nDen Gläubigern der an der Verschmelzung beteiligten Rechtsträger ist, wenn sie binnen sechs Monaten nach dem Tag, an dem die Eintragung der Verschmelzung in das Register des Sitzes desjenigen Rechtsträgers, dessen Gläubiger sie sind, nach § 19 Abs. 3 UmwG als bekannt gemacht gilt, ihren Anspruch nach Grund und Höhe in Textform anmelden, Sicherheit zu leisten, soweit sie nicht Befriedigung verlangen können. Dieses Recht steht den Gläubigern jedoch nur zu, wenn sie glaubhaft machen, dass durch die Verschmelzung die Erfüllung ihrer Forderung gefährdet wird."
    },
    {
      "date": "2026-01-08",
      "id": "141802",
      "original_text": "Einreichung neuer Dokumente\nBayern Amtsgericht Nürnberg HRB 19335\nRogator AG – Nürnberg",
      "type": "Einreichung neuer Dokumente",
      "state": "Bayern",
      "amtsgericht": "Amtsgericht Nürnberg",
      "registernummer": "HRB 19335",
      "registerart": "HRB",
      "company_name": "Rogator AG",
      "company_seat": "Nürnberg",
      "details": "08.01.2026 (Bekanntmachungsdatum)\n\nBayern Amtsgericht Nürnberg HRB 19335\nEinreichung neuer Dokumente\n\nRogator AG\nAktiengesellschaft\nNürnberg\n\nDem Amtsgericht Nürnberg -Registergericht- ist eine Liste der Mitglieder des Aufsichtsrats eingereicht worden, § 106 AktG."
    },
    {
      "date": "2026-01-08",
      "id": "141803",
      "original_text": "Sonstige Registerbekanntmachung\nBayern Amtsgericht Nürnberg HRB 920\nFränkische Energie-Gesellschaft mit beschränkter Haftung – Nürnberg",
      "type": "Sonstige Registerbekanntmachung",
      "state": "Bayern",
      "amtsgericht": "Amtsgericht Nürnberg",
      "registernummer": "HRB 920",
      "registerart": "HRB",
      "company_name": "Fränkische Energie-Gesellschaft mit beschränkter Haftung",
      "company_seat": "Nürnberg",
      "details": "08.01.2026 (Bekanntmachungsdatum)\n\nBayern Amtsgericht Nürnberg HRB 920\nSonstige Registerbekanntmachung 07.01.2026 (Eintragungsdatum)\n\nFränkische Energie-Gesellschaft mit beschränkter Haftung\nGesellschaft mit beschränkter Haftung\nNürnberg\n\nDen Gläubigern der Gesellschaft, deren Forderungen begründet worden sind, bevor die Eintragung der Beendigung des Gewinnabführungsvertrages in das Handelsregister nach § 10 des Handelsgesetzbuches als bekanntgemacht gilt, hat der andere Vertragsteil Sicherheit zu leisten, wenn sie sich binnen sechs Monaten nach der Bekanntmachung der Eintragung zu diesem Zweck bei ihm melden."
    },
    {
      "date": "2026-01-08",
      "id": "141804",
      "original_text": "Registerbekanntmachung nach dem Umwandlungsgesetz\nBayern Amtsgericht München HRA 67108\nIKEA Deutschland GmbH & Co. KG – München",
      "type": "Registerbekanntmachung nach dem Umwandlungsgesetz",
      "state": "Bayern",
      "amtsgericht": "Amtsgericht München",
      "registernummer": "HRA 67108",
      "registerart": "HRA",
      "company_name": "IKEA Deutschland GmbH & Co. KG",
      "company_seat": "München",
      "details": "08.01.2026 (Bekanntmachungsdatum)\n\nBayern Amtsgericht München HRA 67108\nRegisterbekanntmachung nach dem Umwandlungsgesetz 07.01.2026 (Eintragungsdatum)\n\nIKEA Deutschland GmbH & Co. KG\nKommanditgesellschaft\nMünchen\n\nZur Verschmelzung der IKEA Customer Support Center GmbH mit Sitz in München (Amtsgericht München HRB 230554) auf die IKEA Deutschland GmbH & Co. KG mit Sitz in München (Amtsgericht München HRA 67108):\nDen Gläubigern der an der Verschmelzung beteiligten Rechtsträger ist, wenn sie binnen sechs Monaten nach dem Tag, an dem die Eintragung der Verschmelzung in das Register des Sitzes desjenigen Rechtsträgers, dessen Gläubiger sie sind, nach § 19 Abs. 3 UmwG als bekannt gemacht gilt, ihren Anspruch nach Grund und Höhe in Textform anmelden, Sicherheit zu leisten, soweit sie nicht Befriedigung verlangen können. Dieses Recht steht den Gläubigern jedoch nur zu, wenn sie glaubhaft machen, dass durch die Verschmelzung die Erfüllung ihrer Forderung gefährdet wird."
    },
    {
      "date": "2026-01-08",
      "id": "141805",
      "original_text": "Sonstige Registerbekanntmachung\nBayern Amtsgericht München HRB 271120\nVintura GmbH – München",
      "type": "Sonstige Registerbekanntmachung",
      "state": "Bayern",
      "amtsgericht": "Amtsgericht München",
      "registernummer": "HRB 271120",
      "registerart": "HRB",
      "company_name": "Vintura GmbH",
      "company_seat": "München",
      "details": "08.01.2026 (Bekanntmachungsdatum)\n\nBayern Amtsgericht München HRB 271120\nSonstige Registerbekanntmachung 07.01.2026 (Eintragungsdatum)\n\nVintura GmbH\nGesellschaft mit beschränkter Haftung\nMünchen\n\nDen Gläubigern der Gesellschaft, deren Forderungen begründet worden sind, bevor die Eintragung der Beendigung des Gewinnabführungsvertrages in das Handelsregister nach § 10 des Handelsgesetzbuches als bekanntgemacht gilt, hat der andere Vertragsteil Sicherheit zu leisten, wenn sie sich binnen sechs Monaten nach der Bekanntmachung der Eintragung zu diesem Zweck bei ihm melden."
    },
    {
      "date": "2026-01-08",
      "id": "141806",
      "original_text": "Registerbekanntmachung nach dem Umwandlungsgesetz\nBayern Amtsgericht München HRB 201168\nAFINUM Siebte Verwaltungs GmbH – München",
      "type": "Registerbekanntmachung nach dem Umwandlungsgesetz",
      "state": "Bayern",
      "amtsgericht": "Amtsgericht München",
      "registernummer": "HRB 201168",
      "registerart": "HRB",
      "company_name": "AFINUM Siebte Verwaltungs GmbH",
      "company_seat": "München",
      "details": "08.01.2026 (Bekanntmachungsdatum)\n\nBayern Amtsgericht München HRB 201168\nRegisterbekanntmachung nach dem Umwandlungsgesetz 07.01.2026 (Eintragungsdatum)\n\nAFINUM Siebte Verwaltungs GmbH\nGesellschaft mit beschränkter Haftung\nMünchen\n\nDen Gläubigern der an der Verschmelzung beteiligten Rechtsträger ist, wenn sie binnen sechs Monaten nach dem Tag, an dem die Eintragung der Verschmelzung in das Register des Sitzes desjenigen Rechtsträgers, dessen Gläubiger sie sind, nach § 19 Abs. 3 UmwG als bekannt gemacht gilt, ihren Anspruch nach Grund und Höhe in Textform anmelden, Sicherheit zu leisten, soweit sie nicht Befriedigung verlangen können. Dieses Recht steht den Gläubigern jedoch nur zu, wenn sie glaubhaft machen, dass durch die Verschmelzung die Erfüllung ihrer Forderung gefährdet wird."
    },
    {
      "date": "2026-01-08",
      "id": "141807",
      "original_text": "Löschungsankündigung\nBaden-Württemberg Amtsgericht Stuttgart HRB 793359\nA&S Transport UG (haftungsbeschränkt) – Heilbronn",
      "type": "Löschungsankündigung",
      "state": "Baden-Württemberg",
      "amtsgericht": "Amtsgericht Stuttgart",
      "registernummer": "HRB 793359",
      "registerart": "HRB",
      "company_name": "A&S Transport UG (haftungsbeschränkt)",
      "company_seat": "Heilbronn",
      "details": "08.01.2026 (Bekanntmachungsdatum)\n\nBaden-Württemberg Amtsgericht Stuttgart HRB 793359\nLöschungsankündigung\n\nA&S Transport UG (haftungsbeschränkt)\nGesellschaft mit beschränkter Haftung\nHeilbronn\n\nAls nicht eingetragen wird bekanntgemacht:\nDas Gericht beabsichtigt, die Gesellschaft wegen Vermögenslosigkeit im Handelsregister von Amts wegen nach § 394 FamFG zu löschen. Die Frist zur Geltendmachung eines Widerspruchs gegen die beabsichtigte Löschung ist auf zwei Monate ab Veröffentlichung bestimmt."
    },
    {
      "date": "2026-01-08",
      "id": "141808",
      "original_text": "Löschungsankündigung\nSchleswig-Holstein Amtsgericht Lübeck HRB 12438\nZyklopen GmbH – Eutin",
      "type": "Löschungsankündigung",
      "state": "Schleswig-Holstein",
      "amtsgericht": "Amtsgericht Lübeck",
      "registernummer": "HRB 12438",
      "registerart": "HRB",
      "company_name": "Zyklopen GmbH",
      "company_seat": "Eutin",
      "details": "08.01.2026 (Bekanntmachungsdatum)\n\nSchleswig-Holstein Amtsgericht Lübeck HRB 12438\nLöschungsankündigung\n\nZyklopen GmbH\nGesellschaft mit beschränkter Haftung\nEutin\n\nEs ist die Löschung der nachstehenden Gesellschaft wegen Vermögenslosigkeit gemäß § 394 FamFG beabsichtigt."
    },
    {
      "date": "2026-01-08",
      "id": "141809",
      "original_text": "Löschungsankündigung\nBerlin Amtsgericht Berlin (Charlottenburg) HRB 213943\nMHATEN Bau GmbH – Berlin",
      "type": "Löschungsankündigung",
      "state": "Berlin",
      "amtsgericht": "Amtsgericht Berlin (Charlottenburg)",
      "registernummer": "HRB 213943",
      "registerart": "HRB",
      "company_name": "MHATEN Bau GmbH",
      "company_seat": "Berlin",
      "details": "08.01.2026 (Bekanntmachungsdatum)\n\nBerlin Amtsgericht Berlin (Charlottenburg) HRB 213943\nLöschungsankündigung\n\nMHATEN Bau GmbH\nGesellschaft mit beschränkter Haftung\nBerlin\n\nBei der nachstehenden Gesellschaft wird das Amtslöschungsverfahren gemäß § 394 FamFG eingeleitet. Widerspruchsfrist 6 Wochen"
    },
    {
      "date": "2026-01-08",
      "id": "141810",
      "original_text": "Löschungsankündigung\nBerlin Amtsgericht Berlin (Charlottenburg) HRB 186969\nJukebox Entertainment UG (haftungsbeschränkt) – Berlin",
      "type": "Löschungsankündigung",
      "state": "Berlin",
      "amtsgericht": "Amtsgericht Berlin (Charlottenburg)",
      "registernummer": "HRB 186969",
      "registerart": "HRB",
      "company_name": "Jukebox Entertainment UG (haftungsbeschränkt)",
      "company_seat": "Berlin",
      "details": "08.01.2026 (Bekanntmachungsdatum)\n\nBerlin Amtsgericht Berlin (Charlottenburg) HRB 186969\nLöschungsankündigung\n\nJukebox Entertainment UG (haftungsbeschränkt)\nGesellschaft mit beschränkter Haftung\nBerlin\n\nBei der nachstehenden Gesellschaft wird das Amtslöschungsverfahren gemäß § 394 FamFG eingeleitet. Widerspruchsfrist 6 Wochen"
    },
    {
      "date": "2026-01-08",
      "id": "141811",
      "original_text": "Löschungsankündigung\nBerlin Amtsgericht Berlin (Charlottenburg) HRB 207967\nKeePath UG (haftungsbeschränkt) – Berlin",
      "type": "Löschungsankündigung",
      "state": "Berlin",
      "amtsgericht": "Amtsgericht Berlin (Charlottenburg)",
      "registernummer": "HRB 207967",
      "registerart": "HRB",
      "company_name": "KeePath UG (haftungsbeschränkt)",
      "company_seat": "Berlin",
      "details": "08.01.2026 (Bekanntmachungsdatum)\n\nBerlin Amtsgericht Berlin (Charlottenburg) HRB 207967\nLöschungsankündigung\n\nKeePath UG (haftungsbeschränkt)\nGesellschaft mit beschränkter Haftung\nBerlin\n\nBei der nachstehenden Gesellschaft wird das Amtslöschungsverfahren gemäß § 394 FamFG eingeleitet. Widerspruchsfrist 6 Wochen"
    },
    {
      "date": "2026-01-08",
      "id": "141812",
      "original_text": "Löschungsankündigung\nBerlin Amtsgericht Berlin (Charlottenburg) HRB 195958\nAlpha Schutz & Sicherheit GmbH – Berlin",
      "type": "Löschungsankündigung",
      "state": "Berlin",
      "amtsgericht": "Amtsgericht Berlin (Charlottenburg)",
      "registernummer": "HRB 195958",
      "registerart": "HRB",
      "company_name": "Alpha Schutz & Sicherheit GmbH",
      "company_seat": "Berlin",
      "details": "08.01.2026 (Bekanntmachungsdatum)\n\nBerlin Amtsgericht Berlin (Charlottenburg) HRB 195958\nLöschungsankündigung\n\nAlpha Schutz & Sicherheit GmbH\nGesellschaft mit beschränkter Haftung\nBerlin\n\nBei der nachstehenden Gesellschaft wird das Amtslöschungsverfahren gemäß § 394 FamFG eingeleitet. Widerspruchsfrist 6 Wochen"
    },
    {
      "date": "2026-01-08",
      "id": "141813",
      "original_text": "Sonstige Registerbekanntmachung\nBaden-Württemberg Amtsgericht Ulm HRB 490609\nEtimex Technical Components GmbH – Rottenacker",
      "type": "Sonstige Registerbekanntmachung",
      "state": "Baden-Württemberg",
      "amtsgericht": "Amtsgericht Ulm",
      "registernummer": "HRB 490609",
      "registerart": "HRB",
      "company_name": "Etimex Technical Components GmbH",
      "company_seat": "Rottenacker",
      "details": "08.01.2026 (Bekanntmachungsdatum)\n\nBaden-Württemberg Amtsgericht Ulm HRB 490609\nSonstige Registerbekanntmachung 08.01.2026 (Eintragungsdatum)\n\nEtimex Technical Components GmbH\nGesellschaft mit beschränkter Haftung\nRottenacker\n\nAls nicht eingetragen wird bekanntgemacht:\nDen Gläubigern der Gesellschaft, deren Forderungen begründet worden sind, bevor die Eintragung der Beendigung des Vertrages in das Handelsregister nach § 10 HGB als bekanntgemacht gilt, ist vom anderen Vertragsteil Sicherheit zu leisten, wenn sie sich binnen sechs Monaten nach der Bekanntmachung zu diesem Zweck bei ihm melden."
    },
    {
      "date": "2026-01-08",
      "id": "141814",
      "original_text": "Löschungsankündigung\nBrandenburg Amtsgericht Potsdam HRB 29249\npincard.net Ltd. Zweigniederlassung Deutschland – Potsdam",
      "type": "Löschungsankündigung",
      "state": "Brandenburg",
      "amtsgericht": "Amtsgericht Potsdam",
      "registernummer": "HRB 29249",
      "registerart": "HRB",
      "company_name": "pincard.net Ltd. Zweigniederlassung Deutschland",
      "company_seat": "Potsdam",
      "details": "08.01.2026 (Bekanntmachungsdatum)\n\nBrandenburg Amtsgericht Potsdam HRB 29249\nLöschungsankündigung\n\npincard.net Ltd. Zweigniederlassung Deutschland\nRechtsform ausländischen Rechts HRB\nPotsdam\n\nBei der nachstehenden Gesellschaft/dem nachstehenden Verein wird das Amtslöschungsverfahren gemäß § 395 FamFG eingeleitet. Widerspruchsfrist 4 Wochen."
    },
    {
      "date": "2026-01-08",
      "id": "141815",
      "original_text": "Sonstige Registerbekanntmachung\nBaden-Württemberg Amtsgericht Freiburg HRB 413163\nVitra Design Museum GmbH – Weil am Rhein",
      "type": "Sonstige Registerbekanntmachung",
      "state": "Baden-Württemberg",
      "amtsgericht": "Amtsgericht Freiburg",
      "registernummer": "HRB 413163",
      "registerart": "HRB",
      "company_name": "Vitra Design Museum GmbH",
      "company_seat": "Weil am Rhein",
      "details": "08.01.2026 (Bekanntmachungsdatum)\n\nBaden-Württemberg Amtsgericht Freiburg HRB 413163\nSonstige Registerbekanntmachung 08.01.2026 (Eintragungsdatum)\n\nVitra Design Museum GmbH\nGesellschaft mit beschränkter Haftung\nWeil am Rhein\n\nAls nicht eingetragen wird bekanntgemacht:\nDen Gläubigern der Gesellschaft, deren Forderungen begründet worden sind, bevor die Eintragung der Beendigung des Vertrages in das Handelsregister nach § 10 HGB als bekanntgemacht gilt, ist vom anderen Vertragsteil Sicherheit zu leisten, wenn sie sich binnen sechs Monaten nach der Bekanntmachung zu diesem Zweck bei ihm melden."
    },
    {
      "date": "2026-01-08",
      "id": "141816",
      "original_text": "Löschungsankündigung\nBaden-Württemberg Amtsgericht Mannheim HRB 720322\nFastline Transport GmbH – Bühl",
      "type": "Löschungsankündigung",
      "state": "Baden-Württemberg",
      "amtsgericht": "Amtsgericht Mannheim",
      "registernummer": "HRB 720322",
      "registerart": "HRB",
      "company_name": "Fastline Transport GmbH",
      "company_seat": "Bühl",
      "details": "08.01.2026 (Bekanntmachungsdatum)\n\nBaden-Württemberg Amtsgericht Mannheim HRB 720322\nLöschungsankündigung 08.01.2026 (Eintragungsdatum)\n\nFastline Transport GmbH\nGesellschaft mit beschränkter Haftung\nBühl\n\nDas Gericht beabsichtigt, die Gesellschaft wegen Vermögenslosigkeit im Handelsregister von Amts wegen nach § 394 FamFG zu löschen. Die Frist zur Geltendmachung eines Widerspruchs gegen die beabsichtigte Löschung ist auf einen Monat ab Veröffentlichung bestimmt."
    },
    {
      "date": "2026-01-08",
      "id": "141817",
      "original_text": "Registerbekanntmachung nach dem Umwandlungsgesetz\nHamburg Amtsgericht Hamburg HRB 106367\nOthello Drei Beteiligungs-Management GmbH – Hamburg",
      "type": "Registerbekanntmachung nach dem Umwandlungsgesetz",
      "state": "Hamburg",
      "amtsgericht": "Amtsgericht Hamburg",
      "registernummer": "HRB 106367",
      "registerart": "HRB",
      "company_name": "Othello Drei Beteiligungs-Management GmbH",
      "company_seat": "Hamburg",
      "details": "08.01.2026 (Bekanntmachungsdatum)\n\nHamburg Amtsgericht Hamburg HRB 106367\nRegisterbekanntmachung nach dem Umwandlungsgesetz 06.01.2026 (Eintragungsdatum)\n\nOthello Drei Beteiligungs-Management GmbH\nGesellschaft mit beschränkter Haftung\nHamburg\n\nAls nicht eingetragen wird bekannt gemacht:\nDen Gläubigern der an der Verschmelzung beteiligten Gesellschaften ist, wenn sie binnen sechs Monaten nach dem Tag, an dem die Eintragung der Verschmelzung in das Register des Sitzes desjenigen Rechtsträgers, dessen Gläubiger sie sind, nach § 19 Absatz 3 UmwG als bekannt gemacht gilt, ihren Anspruch nach Grund und Höhe schriftlich anmelden, Sicherheit zu leisten, soweit sie nicht Befriedigung verlangen können. Dieses Recht steht den Gläubigern jedoch nur zu, wenn sie glaubhaft machen, dass durch die Verschmelzung die Erfüllung ihrer Forderung gefährdet wird."
    },
    {
      "date": "2026-01-08",
      "id": "141818",
      "original_text": "Einreichung neuer Dokumente\nBaden-Württemberg Amtsgericht Stuttgart HRB 800307\nY1 Digital AG – Stuttgart",
      "type": "Einreichung neuer Dokumente",
      "state": "Baden-Württemberg",
      "amtsgericht": "Amtsgericht Stuttgart",
      "registernummer": "HRB 800307",
      "registerart": "HRB",
      "company_name": "Y1 Digital AG",
      "company_seat": "Stuttgart",
      "details": "08.01.2026 (Bekanntmachungsdatum)\n\nBaden-Württemberg Amtsgericht Stuttgart HRB 800307\nEinreichung neuer Dokumente 08.01.2026 (Eintragungsdatum)\n\nY1 Digital AG\nAktiengesellschaft\nStuttgart\n\nDie Gesellschaft hat am 19.12.2025 die Liste über die Zusammensetzung des Aufsichtsrats zum Handelsregister eingereicht."
    },
    {
      "date": "2026-01-08",
      "id": "141819",
      "original_text": "Sonstige Registerbekanntmachung\nBaden-Württemberg Amtsgericht Stuttgart HRB 780601\nRobert Bosch Robotics GmbH – Gerlingen",
      "type": "Sonstige Registerbekanntmachung",
      "state": "Baden-Württemberg",
      "amtsgericht": "Amtsgericht Stuttgart",
      "registernummer": "HRB 780601",
      "registerart": "HRB",
      "company_name": "Robert Bosch Robotics GmbH",
      "company_seat": "Gerlingen",
      "details": "08.01.2026 (Bekanntmachungsdatum)\n\nBaden-Württemberg Amtsgericht Stuttgart HRB 780601\nSonstige Registerbekanntmachung 08.01.2026 (Eintragungsdatum)\n\nRobert Bosch Robotics GmbH\nGesellschaft mit beschränkter Haftung\nGerlingen\n\nDen Gläubigern der Gesellschaft, deren Forderungen begründet worden sind, bevor die Eintragung der Beendigung des Vertrages in das Handelsregister nach § 10 HGB als bekanntgemacht gilt, ist vom anderen Vertragsteil Sicherheit zu leisten, wenn sie sich binnen sechs Monaten nach der Bekanntmachung zu diesem Zweck bei ihm melden."
    },
    {
      "date": "2026-01-08",
      "id": "141820",
      "original_text": "Einreichung neuer Dokumente\nBaden-Württemberg Amtsgericht Stuttgart HRB 210007\nEsslinger Wohnungsbau GmbH – Esslingen am Neckar",
      "type": "Einreichung neuer Dokumente",
      "state": "Baden-Württemberg",
      "amtsgericht": "Amtsgericht Stuttgart",
      "registernummer": "HRB 210007",
      "registerart": "HRB",
      "company_name": "Esslinger Wohnungsbau GmbH",
      "company_seat": "Esslingen am Neckar",
      "details": "08.01.2026 (Bekanntmachungsdatum)\n\nBaden-Württemberg Amtsgericht Stuttgart HRB 210007\nEinreichung neuer Dokumente\n\nEsslinger Wohnungsbau GmbH\nGesellschaft mit beschränkter Haftung\nEsslingen am Neckar\n\nDie Gesellschaft hat am 05.01.2026 die Liste über die Zusammensetzung des Aufsichtsrats zum Handelsregister eingereicht."
    },
    {
      "date": "2026-01-08",
      "id": "141821",
      "original_text": "Registerbekanntmachung nach dem Umwandlungsgesetz\nMecklenburg-Vorpommern Amtsgericht Rostock HRA 5484\nCpare Versicherungsmakler e.K. – Rostock",
      "type": "Registerbekanntmachung nach dem Umwandlungsgesetz",
      "state": "Mecklenburg-Vorpommern",
      "amtsgericht": "Amtsgericht Rostock",
      "registernummer": "HRA 5484",
      "registerart": "HRA",
      "company_name": "Cpare Versicherungsmakler e.K.",
      "company_seat": "Rostock",
      "details": "08.01.2026 (Bekanntmachungsdatum)\n\nMecklenburg-Vorpommern Amtsgericht Rostock HRA 5484\nRegisterbekanntmachung nach dem Umwandlungsgesetz 28.11.2025 (Eintragungsdatum)\n\nCpare Versicherungsmakler e.K.\nEinzelkaufmann / Einzelkauffrau\nRostock\n\nAls nicht eingetragen wird veröffentlicht: Den Gläubigern der an der Ausgliederung beteiligten Rechtsträger ist, wenn sie binnen sechs Monaten nach dem Tag, an dem die Eintragung der Ausgliederung in das Register des Sitzes desjenigen Rechtsträgers, dessen Gläubiger sie sind, nach § 19 Abs. 3 UmwG als bekannt gemacht gilt,\nihren Anspruch nach Grund und Höhe in Textform anmelden, Sicherheit zu leisten, soweit sie nicht Befriedigung verlangen können. Dieses Recht steht den Gläubigern jedoch nur zu, wenn sie glaubhaft machen, dass durch die Ausgliederung die Erfüllung der Forderung gefährdet wird."
    },
    {
      "date": "2026-01-08",
      "id": "141822",
      "original_text": "Löschungsankündigung\nBerlin Amtsgericht Berlin (Charlottenburg) HRB 199211\nQuizHero GmbH – Berlin",
      "type": "Löschungsankündigung",
      "state": "Berlin",
      "amtsgericht": "Amtsgericht Berlin (Charlottenburg)",
      "registernummer": "HRB 199211",
      "registerart": "HRB",
      "company_name": "QuizHero GmbH",
      "company_seat": "Berlin",
      "details": "08.01.2026 (Bekanntmachungsdatum)\n\nBerlin Amtsgericht Berlin (Charlottenburg) HRB 199211\nLöschungsankündigung\n\nQuizHero GmbH\nGesellschaft mit beschränkter Haftung\nBerlin\n\nBei der nachstehenden Gesellschaft wird das Amtslöschungsverfahren gemäß § 394 FamFG eingeleitet. Widerspruchsfrist 6 Wochen"
    },
    {
      "date": "2026-01-08",
      "id": "141823",
      "original_text": "Sonstige Registerbekanntmachung\nSchleswig-Holstein Amtsgericht Kiel GnR 206 SE\nWasserversorgungsgenossenschaft eG – Groß Niendorf",
      "type": "Sonstige Registerbekanntmachung",
      "state": "Schleswig-Holstein",
      "amtsgericht": "Amtsgericht Kiel",
      "registernummer": "GnR 206 SE",
      "registerart": "GnR",
      "company_name": "Wasserversorgungsgenossenschaft eG",
      "company_seat": "Groß Niendorf",
      "details": "08.01.2026 (Bekanntmachungsdatum)\n\nSchleswig-Holstein Amtsgericht Kiel GnR 206 SE\nSonstige Registerbekanntmachung\n\nWasserversorgungsgenossenschaft eG\neingetragene Genossenschaft\nGroß Niendorf\n\nAls nicht eingetragen wird veröffentlicht: Den Gläubigern der Genossenschaft ist, wenn sie binnen sechs Monaten  nach dem Tag an dem die Eintragung des Verzichts auf die Nachschusspflicht und die Herabsetzung des Geschäftsanteils in das Register der Genossenschaft, dessen Gläubiger sie sind, nach § 22 und 22a GenG bekannt gemacht worden ist, ihren Anspruch nach Grund und Höhe schriftlich anmelden, Sicherheit zu leisten, soweit sie nicht Befriedigung erlangen können."
    },
    {
      "date": "2026-01-08",
      "id": "141824",
      "original_text": "Sonstige Registerbekanntmachung\nSchleswig-Holstein Amtsgericht Lübeck HRB 12295\nSenger Nutzfahrzeuge GmbH – Lübeck",
      "type": "Sonstige Registerbekanntmachung",
      "state": "Schleswig-Holstein",
      "amtsgericht": "Amtsgericht Lübeck",
      "registernummer": "HRB 12295",
      "registerart": "HRB",
      "company_name": "Senger Nutzfahrzeuge GmbH",
      "company_seat": "Lübeck",
      "details": "08.01.2026 (Bekanntmachungsdatum)\n\nSchleswig-Holstein Amtsgericht Lübeck HRB 12295\nSonstige Registerbekanntmachung 07.01.2026 (Eintragungsdatum)\n\nSenger Nutzfahrzeuge GmbH\nGesellschaft mit beschränkter Haftung\nLübeck\n\nAls nicht eingetragen wird veröffentlicht:  Der andere Vertragsteil hat den Gläubigern dieses Rechtsträgers, dessen Forderungen begründet worden sind, bevor die Eintragung der Beendigung dieses Vertrages in das Handelsregister nach § 10 des Handelsgesetzbuches als bekannt gemacht gilt, Sicherheit zu leisten, wenn sie sich binnen sechs Monaten nach der Bekanntmachung der Eintragung zu diesem Zweck bei ihm melden. Dieses Recht steht den Gläubigern nicht zu, die im Fall des Insolvenzverfahrens ein Recht auf vorzugsweise Befriedigung aus der Deckungsmasse haben, die nach gesetzlicher Vorschrift zu ihrem Schutz errichtet und staatlich überwacht ist."
    },
    {
      "date": "2026-01-08",
      "id": "141825",
      "original_text": "Sonstige Registerbekanntmachung\nBaden-Württemberg Amtsgericht Ulm HRB 4661\nKSU Kunden-Service-Center Ulm GmbH – Ulm",
      "type": "Sonstige Registerbekanntmachung",
      "state": "Baden-Württemberg",
      "amtsgericht": "Amtsgericht Ulm",
      "registernummer": "HRB 4661",
      "registerart": "HRB",
      "company_name": "KSU Kunden-Service-Center Ulm GmbH",
      "company_seat": "Ulm",
      "details": "08.01.2026 (Bekanntmachungsdatum)\n\nBaden-Württemberg Amtsgericht Ulm HRB 4661\nSonstige Registerbekanntmachung 08.01.2026 (Eintragungsdatum)\n\nKSU Kunden-Service-Center Ulm GmbH\nGesellschaft mit beschränkter Haftung\nUlm\n\nDen Gläubigern der Gesellschaft, deren Forderungen begründet worden sind, bevor die Eintragung der Beendigung des Vertrages in das Handelsregister nach § 10 HGB als bekanntgemacht gilt, ist vom anderen Vertragsteil Sicherheit zu leisten, wenn sie sich binnen sechs Monaten nach der Bekanntmachung zu diesem Zweck bei ihm melden."
    },
    {
      "date": "2026-01-08",
      "id": "141826",
      "original_text": "Registerbekanntmachung nach dem Umwandlungsgesetz\nSchleswig-Holstein Amtsgericht Lübeck HRB 27000\nNJORD Seafood GmbH – Neustadt",
      "type": "Registerbekanntmachung nach dem Umwandlungsgesetz",
      "state": "Schleswig-Holstein",
      "amtsgericht": "Amtsgericht Lübeck",
      "registernummer": "HRB 27000",
      "registerart": "HRB",
      "company_name": "NJORD Seafood GmbH",
      "company_seat": "Neustadt",
      "details": "08.01.2026 (Bekanntmachungsdatum)\n\nSchleswig-Holstein Amtsgericht Lübeck HRB 27000\nRegisterbekanntmachung nach dem Umwandlungsgesetz 07.01.2026 (Eintragungsdatum)\n\nNJORD Seafood GmbH\nGesellschaft mit beschränkter Haftung\nNeustadt\n\nZu Eintragungsnummer 1 vom 07.01.2026 wird als nicht eingetragen veröffentlicht:  Als nicht eingetragen wird veröffentlicht: Den Gläubigern der an der Ausgliederung beteiligten Rechtsträger ist, wenn sie binnen sechs Monaten nach dem Tag, an dem die Eintragung der Ausgliederung in das Register des Sitzes desjenigen Rechtsträgers, dessen Gläubiger sie sind, als bekannt gemacht gilt, ihren Anspruch nach Grund und Höhe schriftlich anmelden, Sicherheit zu leisten, soweit sie nicht Befriedigung verlangen können. Dieses Recht steht den Gläubigern jedoch nur zu, wenn sie glaubhaft machen, dass durch die Ausgliederung die Erfüllung ihrer Forderung gefährdet wird."
    },
    {
      "date": "2026-01-08",
      "id": "141827",
      "original_text": "Einreichung neuer Dokumente\nBaden-Württemberg Amtsgericht Stuttgart HRB 764171\nFalkenberg AG – Stuttgart",
      "type": "Einreichung neuer Dokumente",
      "state": "Baden-Württemberg",
      "amtsgericht": "Amtsgericht Stuttgart",
      "registernummer": "HRB 764171",
      "registerart": "HRB",
      "company_name": "Falkenberg AG",
      "company_seat": "Stuttgart",
      "details": "08.01.2026 (Bekanntmachungsdatum)\n\nBaden-Württemberg Amtsgericht Stuttgart HRB 764171\nEinreichung neuer Dokumente 08.01.2026 (Eintragungsdatum)\n\nFalkenberg AG\nAktiengesellschaft\nStuttgart\n\nDie Gesellschaft hat am 07.01.2026 die Liste über die Zusammensetzung des Aufsichtsrats zum Handelsregister eingereicht."
    },
    {
      "date": "2026-01-08",
      "id": "141828",
      "original_text": "Registerbekanntmachung nach dem Umwandlungsgesetz\nBaden-Württemberg Amtsgericht Freiburg HRB 716184\nSMR 5 Verwaltungs GmbH – Gottmadingen",
      "type": "Registerbekanntmachung nach dem Umwandlungsgesetz",
      "state": "Baden-Württemberg",
      "amtsgericht": "Amtsgericht Freiburg",
      "registernummer": "HRB 716184",
      "registerart": "HRB",
      "company_name": "SMR 5 Verwaltungs GmbH",
      "company_seat": "Gottmadingen",
      "details": "08.01.2026 (Bekanntmachungsdatum)\n\nBaden-Württemberg Amtsgericht Freiburg HRB 716184\nRegisterbekanntmachung nach dem Umwandlungsgesetz 08.01.2026 (Eintragungsdatum)\n\nSMR 5 Verwaltungs GmbH\nGesellschaft mit beschränkter Haftung\nGottmadingen\n\nDen Gläubigern der an der Verschmelzung beteiligten Rechtsträger ist, wenn sie binnen sechs Monaten nach dem Tag, an dem die Eintragung der Verschmelzung in das Register des Sitzes desjenigen Rechtsträgers, dessen Gläubiger sie sind, nach § 19 Abs. 3 UmwG als bekanntgemacht gilt, ihren Anspruch nach Grund und Höhe schriftlich anmelden, Sicherheit zu leisten, soweit sie nicht Befriedigung verlangen können. Dieses Recht steht den Gläubigern jedoch nur zu, wenn sie glaubhaft machen, dass durch die Verschmelzung die Erfüllung ihrer Forderung gefährdet wird."
    },
    {
      "date": "2026-01-08",
      "id": "141829",
      "original_text": "Registerbekanntmachung nach dem Umwandlungsgesetz\nBaden-Württemberg Amtsgericht Freiburg HRB 710426\nIkama GmbH – Konstanz",
      "type": "Registerbekanntmachung nach dem Umwandlungsgesetz",
      "state": "Baden-Württemberg",
      "amtsgericht": "Amtsgericht Freiburg",
      "registernummer": "HRB 710426",
      "registerart": "HRB",
      "company_name": "Ikama GmbH",
      "company_seat": "Konstanz",
      "details": "08.01.2026 (Bekanntmachungsdatum)\n\nBaden-Württemberg Amtsgericht Freiburg HRB 710426\nRegisterbekanntmachung nach dem Umwandlungsgesetz 08.01.2026 (Eintragungsdatum)\n\nIkama GmbH\nGesellschaft mit beschränkter Haftung\nKonstanz\n\nAls nicht eingetragen wird bekanntgemacht:\nDen Gläubigern der an der Verschmelzung beteiligten Rechtsträger ist, wenn sie binnen sechs Monaten nach dem Tag, an dem die Eintragung der Verschmelzung in das Register des Sitzes desjenigen Rechtsträgers, dessen Gläubiger sie sind, nach § 19 Abs. 3 UmwG als bekanntgemacht gilt, ihren Anspruch nach Grund und Höhe schriftlich anmelden, Sicherheit zu leisten, soweit sie nicht Befriedigung verlangen können. Dieses Recht steht den Gläubigern jedoch nur zu, wenn sie glaubhaft machen, dass durch die Verschmelzung die Erfüllung ihrer Forderung gefährdet wird."
    },
    {
      "date": "2026-01-08",
      "id": "141830",
      "original_text": "Löschungsankündigung\nBaden-Württemberg Amtsgericht Mannheim HRA 350779\nAlfred Gramlich e.K. – Wiesloch",
      "type": "Löschungsankündigung",
      "state": "Baden-Württemberg",
      "amtsgericht": "Amtsgericht Mannheim",
      "registernummer": "HRA 350779",
      "registerart": "HRA",
      "company_name": "Alfred Gramlich e.K.",
      "company_seat": "Wiesloch",
      "details": "08.01.2026 (Bekanntmachungsdatum)\n\nBaden-Württemberg Amtsgericht Mannheim HRA 350779\nLöschungsankündigung\n\nAlfred Gramlich e.K.\nEinzelkaufmann / Einzelkauffrau\nWiesloch\n\nAls nicht eingetragen wird bekanntgemacht:\nDas Registergericht beabsichtigt, die Firma im Handelsregister von Amts wegen nach § 31 Abs. 2 HGB zu löschen. Die Frist zur Geltendmachung eines Widerspruchs gegen die beabsichtigte Löschung ist auf einen Monat ab Veröffentlichung bestimmt."
    },
    {
      "date": "2026-01-08",
      "id": "141831",
      "original_text": "Registerbekanntmachung nach dem Umwandlungsgesetz\nBerlin Amtsgericht Berlin (Charlottenburg) HRB 64242\nEXKOSA Unternehmensberatung AG – Berlin",
      "type": "Registerbekanntmachung nach dem Umwandlungsgesetz",
      "state": "Berlin",
      "amtsgericht": "Amtsgericht Berlin (Charlottenburg)",
      "registernummer": "HRB 64242",
      "registerart": "HRB",
      "company_name": "EXKOSA Unternehmensberatung AG",
      "company_seat": "Berlin",
      "details": "08.01.2026 (Bekanntmachungsdatum)\n\nBerlin Amtsgericht Berlin (Charlottenburg) HRB 64242\nRegisterbekanntmachung nach dem Umwandlungsgesetz 07.01.2026 (Eintragungsdatum)\n\nEXKOSA Unternehmensberatung AG\nAktiengesellschaft\nBerlin\n\nZu Eintragungsnummer 7 vom 07.01.2026 wird als nicht eingetragen veröffentlicht:Den Gläubigern der an der Verschmelzung beteiligten Rechtsträger ist, wenn sie binnen sechs Monaten nach dem Tag, an dem die Eintragung der Verschmelzung in das Register des Sitzes desjenigen Rechtsträgers, dessen Gläubiger sie sind, als bekannt gemacht gilt, ihren Anspruch nach Grund und Höhe schriftlich anmelden, Sicherheit zu leisten, soweit sie nicht Befriedigung verlangen können. Dieses Recht steht den Gläubigern jedoch nur zu, wenn sie glaubhaft machen, dass durch die Verschmelzung die Erfüllung ihrer Forderung gefährdet wird. Das Recht, Sicherheitsleistung zu verlangen, steht Gläubigern nicht zu, die im Falle der Insolvenz ein Recht auf vorzugsweise Befriedigung aus einer Deckungsmasse haben, die nach gesetzlicher Vorschrift zu ihrem Schutz errichtet und staatlich überwacht ist."
    },
    {
      "date": "2026-01-08",
      "id": "141832",
      "original_text": "Registerbekanntmachung nach dem Umwandlungsgesetz\nBerlin Amtsgericht Berlin (Charlottenburg) HRB 272498\nNWE Consulting GmbH – Berlin",
      "type": "Registerbekanntmachung nach dem Umwandlungsgesetz",
      "state": "Berlin",
      "amtsgericht": "Amtsgericht Berlin (Charlottenburg)",
      "registernummer": "HRB 272498",
      "registerart": "HRB",
      "company_name": "NWE Consulting GmbH",
      "company_seat": "Berlin",
      "details": "08.01.2026 (Bekanntmachungsdatum)\n\nBerlin Amtsgericht Berlin (Charlottenburg) HRB 272498\nRegisterbekanntmachung nach dem Umwandlungsgesetz 06.01.2026 (Eintragungsdatum)\n\nNWE Consulting GmbH\nGesellschaft mit beschränkter Haftung\nBerlin\n\nZu Eintragungsnummer 2 vom 06.01.2026 wird als nicht eingetragen veröffentlicht: Den Gläubigern der an der Verschmelzung beteiligten Rechtsträger ist, wenn sie binnen sechs Monaten nach dem Tag, an dem die Eintragung der Verschmelzung in das Register des Sitzes desjenigen Rechtsträgers, dessen Gläubiger sie sind, als bekannt gemacht gilt, ihren Anspruch nach Grund und Höhe schriftlich anmelden, Sicherheit zu leisten, soweit sie nicht Befriedigung verlangen können. Dieses Recht steht den Gläubigern jedoch nur zu, wenn sie glaubhaft machen, dass durch die Verschmelzung die Erfüllung ihrer Forderung gefährdet wird. Das Recht, Sicherheitsleistung zu verlangen, steht Gläubigern nicht zu, die im Falle der Insolvenz ein Recht auf vorzugsweise Befriedigung aus einer Deckungsmasse haben, die nach gesetzlicher Vorschrift zu ihrem Schutz errichtet und staatlich überwacht ist."
    },
    {
      "date": "2026-01-08",
      "id": "141833",
      "original_text": "Sonstige Registerbekanntmachung\nSchleswig-Holstein Amtsgericht Lübeck HRB 3689 RE\nTimm Technology GmbH – Reinbek",
      "type": "Sonstige Registerbekanntmachung",
      "state": "Schleswig-Holstein",
      "amtsgericht": "Amtsgericht Lübeck",
      "registernummer": "HRB 3689 RE",
      "registerart": "HRB",
      "company_name": "Timm Technology GmbH",
      "company_seat": "Reinbek",
      "details": "08.01.2026 (Bekanntmachungsdatum)\n\nSchleswig-Holstein Amtsgericht Lübeck HRB 3689 RE\nSonstige Registerbekanntmachung 07.01.2026 (Eintragungsdatum)\n\nTimm Technology GmbH\nGesellschaft mit beschränkter Haftung\nReinbek\n\nAls nicht eingetragen wird veröffentlicht:  Der andere Vertragsteil hat den Gläubigern dieses Rechtsträgers, dessen Forderungen begründet worden sind, bevor die Eintragung der Beendigung dieses Vertrages in das Handelsregister nach § 10 des Handelsgesetzbuches als bekannt gemacht gilt, Sicherheit zu leisten, wenn sie sich binnen sechs Monaten nach der Bekanntmachung der Eintragung zu diesem Zweck bei ihm melden. Dieses Recht steht den Gläubigern nicht zu, die im Fall des Insolvenzverfahrens ein Recht auf vorzugsweise Befriedigung aus der Deckungsmasse haben, die nach gesetzlicher Vorschrift zu ihrem Schutz errichtet und staatlich überwacht ist."
    },
    {
      "date": "2026-01-08",
      "id": "141834",
      "original_text": "Löschungsankündigung\nSchleswig-Holstein Amtsgericht Flensburg HRA 10739\nvon der Tann Baumanagement OHG – Kropp",
      "type": "Löschungsankündigung",
      "state": "Schleswig-Holstein",
      "amtsgericht": "Amtsgericht Flensburg",
      "registernummer": "HRA 10739",
      "registerart": "HRA",
      "company_name": "von der Tann Baumanagement OHG",
      "company_seat": "Kropp",
      "details": "08.01.2026 (Bekanntmachungsdatum)\n\nSchleswig-Holstein Amtsgericht Flensburg HRA 10739\nLöschungsankündigung\n\nvon der Tann Baumanagement OHG\nOffene Handelsgesellschaft\nKropp\n\nEs ist beabsichtigt, die Firma gemäß § 31 Abs. 2 HGB von Amts wegen zu löschen.\nWiderspruchsfrist: 3 Monate"
    },
    {
      "date": "2026-01-08",
      "id": "141835",
      "original_text": "Registerbekanntmachung nach dem Umwandlungsgesetz\nSachsen-Anhalt Amtsgericht Stendal HRB 16968\nEMCO MAGDEBURG GMBH – Magdeburg",
      "type": "Registerbekanntmachung nach dem Umwandlungsgesetz",
      "state": "Sachsen-Anhalt",
      "amtsgericht": "Amtsgericht Stendal",
      "registernummer": "HRB 16968",
      "registerart": "HRB",
      "company_name": "EMCO MAGDEBURG GMBH",
      "company_seat": "Magdeburg",
      "details": "08.01.2026 (Bekanntmachungsdatum)\n\nSachsen-Anhalt Amtsgericht Stendal HRB 16968\nRegisterbekanntmachung nach dem Umwandlungsgesetz 17.12.2025 (Eintragungsdatum)\n\nEMCO MAGDEBURG GMBH\nGesellschaft mit beschränkter Haftung\nMagdeburg\n\nDie Gesellschaft ist auf Grund des Verschmelzungsvertrages vom 26.11.2025 sowie der Beschlüsse der Gesellschafterversammlungen vom selben Tag mit der EMCO Deutschland GmbH mit dem Sitz in Traunstein (Amtsgericht Traunstein HRB 23424) verschmolzen. Die Verschmelzung wurde am 19.12.2025 in das Handelsregister der übernehmenden Gesellschaft eingetragen. Nicht eingetragen: Den Gläubigern der an der Verschmelzung beteiligten Rechtsträger ist, wenn sie binnen sechs Monaten nach dem Tag, an dem die Eintragung der Verschmelzung nach § 19 Abs. 3 UmwG als bekanntgemacht gilt, ihren Anspruch nach Grund und Höhe schriftlich anmelden, Sicherheit zu leisten, soweit sie nicht Befriedigung verlangen können. Dieses Recht steht ihnen jedoch nur zu, wenn sie glaubhaft machen, dass durch die Verschmelzung die Erfüllung ihrer Forderung gefährdet wird."
    },
    {
      "date": "2026-01-08",
      "id": "141836",
      "original_text": "Sonstige Registerbekanntmachung\nHamburg Amtsgericht Hamburg HRB 118552\nALCO Automotive Beteiligungsgesellschaft mbH – Hamburg",
      "type": "Sonstige Registerbekanntmachung",
      "state": "Hamburg",
      "amtsgericht": "Amtsgericht Hamburg",
      "registernummer": "HRB 118552",
      "registerart": "HRB",
      "company_name": "ALCO Automotive Beteiligungsgesellschaft mbH",
      "company_seat": "Hamburg",
      "details": "08.01.2026 (Bekanntmachungsdatum)\n\nHamburg Amtsgericht Hamburg HRB 118552\nSonstige Registerbekanntmachung 08.01.2026 (Eintragungsdatum)\n\nALCO Automotive Beteiligungsgesellschaft mbH\nGesellschaft mit beschränkter Haftung\nHamburg\n\nAls nicht eingetragen wird bekannt gemacht:  Den Gläubigern der Gesellschaft, deren Forderungen begründet worden sind, bevor die Eintragung der Vertragsbeendigung in das Handelsregister nach § 10 HGB als bekannt gemacht gilt, ist vom anderen Vertragsteil Sicherheit zu leisten, wenn sie sich binnen 6 Monaten nach Bekanntmachung der Eintragung zu diesem Zweck bei ihm melden."
    },
    {
      "date": "2026-01-08",
      "id": "141837",
      "original_text": "Registerbekanntmachung nach dem Umwandlungsgesetz\nBaden-Württemberg Amtsgericht Stuttgart HRA 742644\nPflegeteam M.A.I. e.K. – Stuttgart",
      "type": "Registerbekanntmachung nach dem Umwandlungsgesetz",
      "state": "Baden-Württemberg",
      "amtsgericht": "Amtsgericht Stuttgart",
      "registernummer": "HRA 742644",
      "registerart": "HRA",
      "company_name": "Pflegeteam M.A.I. e.K.",
      "company_seat": "Stuttgart",
      "details": "08.01.2026 (Bekanntmachungsdatum)\n\nBaden-Württemberg Amtsgericht Stuttgart HRA 742644\nRegisterbekanntmachung nach dem Umwandlungsgesetz 08.01.2026 (Eintragungsdatum)\n\nPflegeteam M.A.I. e.K.\nEinzelkaufmann / Einzelkauffrau\nStuttgart\n\nDen Gläubigern der an der Ausgliederung beteiligten Rechtsträger ist, wenn sie binnen sechs Monaten nach dem Tag, an dem die Eintragung der Ausgliederung in das Register des Sitzes desjenigen Rechtsträgers, dessen Gläubiger sie sind, nach § 19 Abs. 3 UmwG als bekanntgemacht gilt, ihren Anspruch nach Grund und Höhe schriftlich anmelden, Sicherheit zu leisten, soweit sie nicht Befriedigung verlangen können. Dieses Recht steht den Gläubigern jedoch nur zu, wenn sie glaubhaft machen, dass durch die Ausgliederung die Erfüllung ihrer Forderung gefährdet wird."
    },
    {
      "date": "2026-01-08",
      "id": "141838",
      "original_text": "Einreichung neuer Dokumente\nBaden-Württemberg Amtsgericht Stuttgart HRB 774906\nWärmegesellschaft Heilbronn mbH – Heilbronn",
      "type": "Einreichung neuer Dokumente",
      "state": "Baden-Württemberg",
      "amtsgericht": "Amtsgericht Stuttgart",
      "registernummer": "HRB 774906",
      "registerart": "HRB",
      "company_name": "Wärmegesellschaft Heilbronn mbH",
      "company_seat": "Heilbronn",
      "details": "08.01.2026 (Bekanntmachungsdatum)\n\nBaden-Württemberg Amtsgericht Stuttgart HRB 774906\nEinreichung neuer Dokumente\n\nWärmegesellschaft Heilbronn mbH\nGesellschaft mit beschränkter Haftung\nHeilbronn\n\nDie Gesellschaft hat am 22.12.2025 die Liste über die Zusammensetzung des Aufsichtsrats zum Handelsregister eingereicht."
    },
    {
      "date": "2026-01-08",
      "id": "141839",
      "original_text": "Löschungsankündigung\nBaden-Württemberg Amtsgericht Mannheim HRB 725832\nELIS Aufzüge GmbH – Bretten",
      "type": "Löschungsankündigung",
      "state": "Baden-Württemberg",
      "amtsgericht": "Amtsgericht Mannheim",
      "registernummer": "HRB 725832",
      "registerart": "HRB",
      "company_name": "ELIS Aufzüge GmbH",
      "company_seat": "Bretten",
      "details": "08.01.2026 (Bekanntmachungsdatum)\n\nBaden-Württemberg Amtsgericht Mannheim HRB 725832\nLöschungsankündigung\n\nELIS Aufzüge GmbH\nGesellschaft mit beschränkter Haftung\nBretten\n\nAls nicht eingetragen wird bekanntgemacht:\nDas Gericht beabsichtigt, die Gesellschaft wegen Vermögenslosigkeit im Handelsregister von Amts wegen nach § 394 FamFG zu löschen. Die Frist zur Geltendmachung eines Widerspruchs gegen die beabsichtigte Löschung ist auf einen Monat ab Veröffentlichung bestimmt."
    },
    {
      "date": "2026-01-08",
      "id": "141840",
      "original_text": "Registerbekanntmachung nach dem Umwandlungsgesetz\nBaden-Württemberg Amtsgericht Freiburg HRB 715662\nWindenergiepark Höhlerberg GmbH – Oberkirch",
      "type": "Registerbekanntmachung nach dem Umwandlungsgesetz",
      "state": "Baden-Württemberg",
      "amtsgericht": "Amtsgericht Freiburg",
      "registernummer": "HRB 715662",
      "registerart": "HRB",
      "company_name": "Windenergiepark Höhlerberg GmbH",
      "company_seat": "Oberkirch",
      "details": "08.01.2026 (Bekanntmachungsdatum)\n\nBaden-Württemberg Amtsgericht Freiburg HRB 715662\nRegisterbekanntmachung nach dem Umwandlungsgesetz 08.01.2026 (Eintragungsdatum)\n\nWindenergiepark Höhlerberg GmbH\nGesellschaft mit beschränkter Haftung\nOberkirch\n\nAls nicht eingetragen wird bekanntgemacht:\nDen Gläubigern des an dem Formwechsel beteiligten Rechtsträgers ist, wenn sie binnen sechs Monaten nach dem Tag, an dem die Eintragung des Formwechsels in das Register des Sitzes desjenigen Rechtsträgers, dessen Gläubiger sie sind, nach § 19 Abs. 3 UmwG als bekanntgemacht gilt, ihren Anspruch nach Grund und Höhe schriftlich anmelden, Sicherheit zu leisten, soweit sie nicht Befriedigung verlangen können. Dieses Recht steht den Gläubigern jedoch nur zu, wenn sie glaubhaft machen, dass durch den Formwechsel die Erfüllung ihrer Forderung gefährdet wird."
    },
    {
      "date": "2026-01-08",
      "id": "141841",
      "original_text": "Sonstige Registerbekanntmachung\nBerlin Amtsgericht Berlin (Charlottenburg) HRB 4391\nEduard Winter Verwaltungsgesellschaft mbH – Berlin",
      "type": "Sonstige Registerbekanntmachung",
      "state": "Berlin",
      "amtsgericht": "Amtsgericht Berlin (Charlottenburg)",
      "registernummer": "HRB 4391",
      "registerart": "HRB",
      "company_name": "Eduard Winter Verwaltungsgesellschaft mbH",
      "company_seat": "Berlin",
      "details": "08.01.2026 (Bekanntmachungsdatum)\n\nBerlin Amtsgericht Berlin (Charlottenburg) HRB 4391\nSonstige Registerbekanntmachung\n\nEduard Winter Verwaltungsgesellschaft mbH\nGesellschaft mit beschränkter Haftung\nBerlin\n\nAls nicht eingetragen wird veröffentlicht: Es wurde eine neue Liste der Beiratsmitglieder eingereicht (§52 GmbHG)."
    },
    {
      "date": "2026-01-08",
      "id": "141842",
      "original_text": "Sonstige Registerbekanntmachung\nBerlin Amtsgericht Berlin (Charlottenburg) HRB 124396\nEduard Winter Dienstleistungsgesellschaft mbH – Berlin",
      "type": "Sonstige Registerbekanntmachung",
      "state": "Berlin",
      "amtsgericht": "Amtsgericht Berlin (Charlottenburg)",
      "registernummer": "HRB 124396",
      "registerart": "HRB",
      "company_name": "Eduard Winter Dienstleistungsgesellschaft mbH",
      "company_seat": "Berlin",
      "details": "08.01.2026 (Bekanntmachungsdatum)\n\nBerlin Amtsgericht Berlin (Charlottenburg) HRB 124396\nSonstige Registerbekanntmachung\n\nEduard Winter Dienstleistungsgesellschaft mbH\nGesellschaft mit beschränkter Haftung\nBerlin\n\nAls nicht eingetragen wird veröffentlicht: Es wurde eine neue Liste der Beiratsratsmitglieder eingereicht (§52 GmbHG)."
    },
    {
      "date": "2026-01-08",
      "id": "141843",
      "original_text": "Löschungsankündigung\nBerlin Amtsgericht Berlin (Charlottenburg) HRB 183293\nAspring Dienstleistungen GmbH – Berlin",
      "type": "Löschungsankündigung",
      "state": "Berlin",
      "amtsgericht": "Amtsgericht Berlin (Charlottenburg)",
      "registernummer": "HRB 183293",
      "registerart": "HRB",
      "company_name": "Aspring Dienstleistungen GmbH",
      "company_seat": "Berlin",
      "details": "08.01.2026 (Bekanntmachungsdatum)\n\nBerlin Amtsgericht Berlin (Charlottenburg) HRB 183293\nLöschungsankündigung\n\nAspring Dienstleistungen GmbH\nGesellschaft mit beschränkter Haftung\nBerlin\n\nBei der nachstehenden Gesellschaft wird das Amtslöschungsverfahren gemäß § 394 FamFG eingeleitet. Widerspruchsfrist 6 Wochen"
    },
    {
      "date": "2026-01-08",
      "id": "141844",
      "original_text": "Sonstige Registerbekanntmachung\nHamburg Amtsgericht Hamburg HRB 89606\nArkwright Consulting AG – Hamburg",
      "type": "Sonstige Registerbekanntmachung",
      "state": "Hamburg",
      "amtsgericht": "Amtsgericht Hamburg",
      "registernummer": "HRB 89606",
      "registerart": "HRB",
      "company_name": "Arkwright Consulting AG",
      "company_seat": "Hamburg",
      "details": "08.01.2026 (Bekanntmachungsdatum)\n\nHamburg Amtsgericht Hamburg HRB 89606\nSonstige Registerbekanntmachung\n\nArkwright Consulting AG\nAktiengesellschaft\nHamburg\n\nAls nicht eingetragen wird bekannt gemacht: Liste des Aufsichtsrats wurde eingereicht."
    },
    {
      "date": "2026-01-08",
      "id": "141845",
      "original_text": "Registerbekanntmachung nach dem Umwandlungsgesetz\nBerlin Amtsgericht Berlin (Charlottenburg) HRB 258122\nterralayr batteries GmbH – Berlin",
      "type": "Registerbekanntmachung nach dem Umwandlungsgesetz",
      "state": "Berlin",
      "amtsgericht": "Amtsgericht Berlin (Charlottenburg)",
      "registernummer": "HRB 258122",
      "registerart": "HRB",
      "company_name": "terralayr batteries GmbH",
      "company_seat": "Berlin",
      "details": "08.01.2026 (Bekanntmachungsdatum)\n\nBerlin Amtsgericht Berlin (Charlottenburg) HRB 258122\nRegisterbekanntmachung nach dem Umwandlungsgesetz 07.01.2026 (Eintragungsdatum)\n\nterralayr batteries GmbH\nGesellschaft mit beschränkter Haftung\nBerlin\n\nZu Eintragungsnummer 3 vom 07.01.2026 wird als nicht eingetragen veröffentlicht: Den Gläubigern der an der Spaltung beteiligten Rechtsträger ist, wenn sie binnen sechs Monaten nach dem Tag, an dem die Eintragung der Spaltung in das Register des Sitzes desjenigen Rechtsträgers, dessen Gläubiger sie sind, als bekannt gemacht gilt, ihren Anspruch nach Grund und Höhe schriftlich anmelden, Sicherheit zu leisten, soweit sie nicht Befriedigung verlangen können. Dieses Recht steht den Gläubigern jedoch nur zu, wenn sie glaubhaft machen, dass durch die Spaltung die Erfüllung ihrer Forderung gefährdet wird. Das Recht, Sicherheitsleistung zu verlangen, steht Gläubigern nicht zu, die im Falle der Insolvenz ein Recht auf vorzugsweise Befriedigung aus einer Deckungsmasse haben, die nach gesetzlicher Vorschrift zu ihrem Schutz errichtet und staatlich überwacht ist."
    },
    {
      "date": "2026-01-08",
      "id": "141846",
      "original_text": "Registerbekanntmachung nach dem Umwandlungsgesetz\nBerlin Amtsgericht Berlin (Charlottenburg) HRB 273628\nterralayr batteries Ten Holdco GmbH – Berlin",
      "type": "Registerbekanntmachung nach dem Umwandlungsgesetz",
      "state": "Berlin",
      "amtsgericht": "Amtsgericht Berlin (Charlottenburg)",
      "registernummer": "HRB 273628",
      "registerart": "HRB",
      "company_name": "terralayr batteries Ten Holdco GmbH",
      "company_seat": "Berlin",
      "details": "08.01.2026 (Bekanntmachungsdatum)\n\nBerlin Amtsgericht Berlin (Charlottenburg) HRB 273628\nRegisterbekanntmachung nach dem Umwandlungsgesetz 07.01.2026 (Eintragungsdatum)\n\nterralayr batteries Ten Holdco GmbH\nGesellschaft mit beschränkter Haftung\nBerlin\n\nZu Eintragungsnummer 3 vom 07.01.2026 wird als nicht eingetragen veröffentlicht: Den Gläubigern der an der Spaltung beteiligten Rechtsträger ist, wenn sie binnen sechs Monaten nach dem Tag, an dem die Eintragung der Spaltung in das Register des Sitzes desjenigen Rechtsträgers, dessen Gläubiger sie sind, als bekannt gemacht gilt, ihren Anspruch nach Grund und Höhe schriftlich anmelden, Sicherheit zu leisten, soweit sie nicht Befriedigung verlangen können. Dieses Recht steht den Gläubigern jedoch nur zu, wenn sie glaubhaft machen, dass durch die Spaltung die Erfüllung ihrer Forderung gefährdet wird. Das Recht, Sicherheitsleistung zu verlangen, steht Gläubigern nicht zu, die im Falle der Insolvenz ein Recht auf vorzugsweise Befriedigung aus einer Deckungsmasse haben, die nach gesetzlicher Vorschrift zu ihrem Schutz errichtet und staatlich überwacht ist."
    },
    {
      "date": "2026-01-08",
      "id": "141847",
      "original_text": "Registerbekanntmachung nach dem Umwandlungsgesetz\nMecklenburg-Vorpommern Amtsgericht Stralsund HRB 22243\nOmega Management und Consulting UG (haftungsbeschränkt) – Schaprode",
      "type": "Registerbekanntmachung nach dem Umwandlungsgesetz",
      "state": "Mecklenburg-Vorpommern",
      "amtsgericht": "Amtsgericht Stralsund",
      "registernummer": "HRB 22243",
      "registerart": "HRB",
      "company_name": "Omega Management und Consulting UG (haftungsbeschränkt)",
      "company_seat": "Schaprode",
      "details": "08.01.2026 (Bekanntmachungsdatum)\n\nMecklenburg-Vorpommern Amtsgericht Stralsund HRB 22243\nRegisterbekanntmachung nach dem Umwandlungsgesetz 08.01.2026 (Eintragungsdatum)\n\nOmega Management und Consulting UG (haftungsbeschränkt)\nGesellschaft mit beschränkter Haftung\nSchaprode\n\nAls nicht eingetragen wird veröffentlicht: Den Gläubigern der an der Verschmelzung beteiligten Rechtsträger ist, wenn sie binnen sechs Monaten nach dem Tag, an dem die Eintragung der Verschmelzung in das Register des Sitzes desjenigen Rechtsträgers, dessen Gläubiger sie sind, nach § 19 Abs. 3 UmwG als bekannt gemacht gilt,\nihren Anspruch nach Grund und Höhe in Textform anmelden, Sicherheit zu leisten, soweit sie nicht Befriedigung verlangen können. Dieses Recht steht den Gläubigern jedoch nur zu, wenn sie glaubhaft machen, dass durch die Verschmelzung die Erfüllung der Forderung gefährdet wird."
    },
    {
      "date": "2026-01-08",
      "id": "141848",
      "original_text": "Sonstige Registerbekanntmachung\nBerlin Amtsgericht Berlin (Charlottenburg) HRB 100259\nMUCOS Emulsionsgesellschaft mbH Chemisch-pharmazeutische Betriebe – Berlin",
      "type": "Sonstige Registerbekanntmachung",
      "state": "Berlin",
      "amtsgericht": "Amtsgericht Berlin (Charlottenburg)",
      "registernummer": "HRB 100259",
      "registerart": "HRB",
      "company_name": "MUCOS Emulsionsgesellschaft mbH Chemisch-pharmazeutische Betriebe",
      "company_seat": "Berlin",
      "details": "08.01.2026 (Bekanntmachungsdatum)\n\nBerlin Amtsgericht Berlin (Charlottenburg) HRB 100259\nSonstige Registerbekanntmachung\n\nMUCOS Emulsionsgesellschaft mbH Chemisch-pharmazeutische Betriebe\nGesellschaft mit beschränkter Haftung\nBerlin\n\nAls nicht eingetragen wird veröffentlicht: Der andere Vertragsteil hat den Gläubigern dieses Rechtsträgers, deren Forderungen begründet worden sind, bevor die Eintragung der Beendigung dieses Vertrages in das Handelsregister nach § 10 des Handelsgesetzbuches als bekannt gemacht gilt, Sicherheit zu leisten, wenn sie sich binnen sechs Monaten nach der Bekanntmachung der Eintragung zu diesem Zweck bei ihm melden. Dieses Recht steht den Gläubigern nicht zu, die im Fall des Insolvenzverfahrens ein Recht auf vorzugsweise Befriedigung aus der Deckungsmasse haben, die nach gesetzlicher Vorschrift zu ihrem Schutz errichtet und staatlich überwacht ist."
    },
    {
      "date": "2026-01-08",
      "id": "141849",
      "original_text": "Registerbekanntmachung nach dem Umwandlungsgesetz\nHamburg Amtsgericht Hamburg HRB 108883\nOrpheus Capital II Management GmbH – Hamburg",
      "type": "Registerbekanntmachung nach dem Umwandlungsgesetz",
      "state": "Hamburg",
      "amtsgericht": "Amtsgericht Hamburg",
      "registernummer": "HRB 108883",
      "registerart": "HRB",
      "company_name": "Orpheus Capital II Management GmbH",
      "company_seat": "Hamburg",
      "details": "08.01.2026 (Bekanntmachungsdatum)\n\nHamburg Amtsgericht Hamburg HRB 108883\nRegisterbekanntmachung nach dem Umwandlungsgesetz 08.01.2026 (Eintragungsdatum)\n\nOrpheus Capital II Management GmbH\nGesellschaft mit beschränkter Haftung\nHamburg\n\nAls nicht eingetragen wird bekannt gemacht:\nDen Gläubigern der an der Verschmelzung beteiligten Gesellschaften ist, wenn sie binnen sechs Monaten nach dem Tag, an dem die Eintragung der Verschmelzung in das Register des Sitzes desjenigen Rechtsträgers, dessen Gläubiger sie sind, nach § 19 Absatz 3 UmwG als bekannt gemacht gilt, ihren Anspruch nach Grund und Höhe schriftlich anmelden, Sicherheit zu leisten, soweit sie nicht Befriedigung verlangen können. Dieses Recht steht den Gläubigern jedoch nur zu, wenn sie glaubhaft machen, dass durch die Verschmelzung die Erfüllung ihrer Forderung gefährdet wird."
    },
    {
      "date": "2026-01-08",
      "id": "141850",
      "original_text": "Registerbekanntmachung nach dem Umwandlungsgesetz\nSchleswig-Holstein Amtsgericht Kiel HRB 28914\nWohngruppe Villa am See GmbH – Bösdorf",
      "type": "Registerbekanntmachung nach dem Umwandlungsgesetz",
      "state": "Schleswig-Holstein",
      "amtsgericht": "Amtsgericht Kiel",
      "registernummer": "HRB 28914",
      "registerart": "HRB",
      "company_name": "Wohngruppe Villa am See GmbH",
      "company_seat": "Bösdorf",
      "details": "08.01.2026 (Bekanntmachungsdatum)\n\nSchleswig-Holstein Amtsgericht Kiel HRB 28914\nRegisterbekanntmachung nach dem Umwandlungsgesetz 08.01.2026 (Eintragungsdatum)\n\nWohngruppe Villa am See GmbH\nGesellschaft mit beschränkter Haftung\nBösdorf\n\nZu Eintragungsnummer 1 vom 08.01.2026 wird als nicht eingetragen veröffentlicht: Den Gläubigern der an der Spaltung beteiligten Rechtsträger ist, wenn sie binnen sechs Monaten nach dem Tag, an dem die Eintragung der Spaltung in das Register des Sitzes desjenigen Rechtsträgers, dessen Gläubiger sie sind,  bekannt gemacht worden ist, ihren Anspruch nach Grund und Höhe schriftlich anmelden, Sicherheit zu leisten, soweit sie nicht Befriedigung verlangen können. Dieses Recht steht den Gläubigern jedoch nur zu, wenn sie glaubhaft machen, dass durch die Spaltung die Erfüllung ihrer Forderung gefährdet wird."
    },
    {
      "date": "2026-01-08",
      "id": "141851",
      "original_text": "Sonstige Registerbekanntmachung\nHamburg Amtsgericht Hamburg HRB 18994\nService Center Burchardkai GmbH – Hamburg",
      "type": "Sonstige Registerbekanntmachung",
      "state": "Hamburg",
      "amtsgericht": "Amtsgericht Hamburg",
      "registernummer": "HRB 18994",
      "registerart": "HRB",
      "company_name": "Service Center Burchardkai GmbH",
      "company_seat": "Hamburg",
      "details": "08.01.2026 (Bekanntmachungsdatum)\n\nHamburg Amtsgericht Hamburg HRB 18994\nSonstige Registerbekanntmachung 08.01.2026 (Eintragungsdatum)\n\nService Center Burchardkai GmbH\nGesellschaft mit beschränkter Haftung\nHamburg\n\nAls nicht eingetragen wird bekannt gemacht: Den Gläubigern der Gesellschaft, deren Forderungen begründet worden sind, bevor die Eintragung der Vertragsbeendigung in das Handelsregister nach § 10 HGB als bekannt gemacht gilt, ist vom anderen Vertragsteil Sicherheit zu leisten, wenn sie sich binnen 6 Monaten nach Bekanntmachung der Eintragung zu diesem Zweck bei ihm melden."
    },
    {
      "date": "2026-01-08",
      "id": "141852",
      "original_text": "Sonstige Registerbekanntmachung\nSachsen Amtsgericht Dresden HRA 12427\nElbinsel Apartments GmbH & Co. KG – Dresden",
      "type": "Sonstige Registerbekanntmachung",
      "state": "Sachsen",
      "amtsgericht": "Amtsgericht Dresden",
      "registernummer": "HRA 12427",
      "registerart": "HRA",
      "company_name": "Elbinsel Apartments GmbH & Co. KG",
      "company_seat": "Dresden",
      "details": "08.01.2026 (Bekanntmachungsdatum)\n\nSachsen Amtsgericht Dresden HRA 12427\nSonstige Registerbekanntmachung 08.01.2026 (Eintragungsdatum)\n\nElbinsel Apartments GmbH & Co. KG\nKommanditgesellschaft\nDresden\n\nDen Gläubigern der an der Umwandlung beteiligten Rechtsträger ist, wenn sie binnen sechs Monaten nach dem Tag, an dem die Eintragung der Umwandlung in das Register des Sitzes desjenigen Rechtsträgers, dessen Gläubiger sie sind, nach § 19 Abs. 3 UmwG als bekannt gemacht gilt, ihren Anspruch nach Grund und Höhe in Textform anmelden, Sicherheit zu leisten, soweit sie nicht Befriedigung verlangen können. Dieses Recht steht den Gläubigern jedoch nur zu, wenn sie glaubhaft machen, dass durch die Umwandlung die Erfüllung der Forderung gefährdet wird."
    },
    {
      "date": "2026-01-08",
      "id": "141853",
      "original_text": "Sonstige Registerbekanntmachung\nSachsen Amtsgericht Dresden HRB 16531\nMagnet Riesa GmbH Freizeit & Tourismus – Riesa",
      "type": "Sonstige Registerbekanntmachung",
      "state": "Sachsen",
      "amtsgericht": "Amtsgericht Dresden",
      "registernummer": "HRB 16531",
      "registerart": "HRB",
      "company_name": "Magnet Riesa GmbH Freizeit & Tourismus",
      "company_seat": "Riesa",
      "details": "08.01.2026 (Bekanntmachungsdatum)\n\nSachsen Amtsgericht Dresden HRB 16531\nSonstige Registerbekanntmachung 08.01.2026 (Eintragungsdatum)\n\nMagnet Riesa GmbH Freizeit & Tourismus\nGesellschaft mit beschränkter Haftung\nRiesa"
    },
    {
      "date": "2026-01-08",
      "id": "141854",
      "original_text": "Löschungsankündigung\nSachsen Amtsgericht Chemnitz HRB 13586\nSWING Vermietungs- und Verpachtungs-GmbH – Olbernhau",
      "type": "Löschungsankündigung",
      "state": "Sachsen",
      "amtsgericht": "Amtsgericht Chemnitz",
      "registernummer": "HRB 13586",
      "registerart": "HRB",
      "company_name": "SWING Vermietungs- und Verpachtungs-GmbH",
      "company_seat": "Olbernhau",
      "details": "08.01.2026 (Bekanntmachungsdatum)\n\nSachsen Amtsgericht Chemnitz HRB 13586\nLöschungsankündigung\n\nSWING Vermietungs- und Verpachtungs-GmbH\nGesellschaft mit beschränkter Haftung\nOlbernhau\n\nDas Registergericht beabsichtigt, die im Handelsregister eingetragene Gesellschaft von Amts wegen nach § 394 FamFG zu löschen. Die Frist zu Erhebung eines Widerspruchs gegen die beabsichtigte Löschung wird auf einen Monat festgesetzt."
    },
    {
      "date": "2026-01-08",
      "id": "141855",
      "original_text": "Sonstige Registerbekanntmachung\nSachsen Amtsgericht Dresden HRB 5683\nKraftverkehrsgesellschaft Dreiländereck mbH – Löbau",
      "type": "Sonstige Registerbekanntmachung",
      "state": "Sachsen",
      "amtsgericht": "Amtsgericht Dresden",
      "registernummer": "HRB 5683",
      "registerart": "HRB",
      "company_name": "Kraftverkehrsgesellschaft Dreiländereck mbH",
      "company_seat": "Löbau",
      "details": "08.01.2026 (Bekanntmachungsdatum)\n\nSachsen Amtsgericht Dresden HRB 5683\nSonstige Registerbekanntmachung 08.01.2026 (Eintragungsdatum)\n\nKraftverkehrsgesellschaft Dreiländereck mbH\nGesellschaft mit beschränkter Haftung\nLöbau"
    },
    {
      "date": "2026-01-08",
      "id": "141856",
      "original_text": "Einreichung neuer Dokumente\nSachsen Amtsgericht Dresden HRB 6951\nWVH Wohnungsbau- und Wohnungsverwaltungsgesellschaft Heidenau mbH – Heidenau",
      "type": "Einreichung neuer Dokumente",
      "state": "Sachsen",
      "amtsgericht": "Amtsgericht Dresden",
      "registernummer": "HRB 6951",
      "registerart": "HRB",
      "company_name": "WVH Wohnungsbau- und Wohnungsverwaltungsgesellschaft Heidenau mbH",
      "company_seat": "Heidenau",
      "details": "08.01.2026 (Bekanntmachungsdatum)\n\nSachsen Amtsgericht Dresden HRB 6951\nEinreichung neuer Dokumente\n\nWVH Wohnungsbau- und Wohnungsverwaltungsgesellschaft Heidenau mbH\nGesellschaft mit beschränkter Haftung\nHeidenau\n\nAm 06.01.2026 wurde beim Handelsregister des Amtsgerichts Dresden die Liste der Mitglieder des Aufsichtsrats gemäß § 52 GmbHG eingereicht."
    },
    {
      "date": "2026-01-08",
      "id": "141857",
      "original_text": "Registerbekanntmachung nach dem Umwandlungsgesetz\nSachsen Amtsgericht Dresden HRB 39240\nDesPro Systems GmbH – Dresden",
      "type": "Registerbekanntmachung nach dem Umwandlungsgesetz",
      "state": "Sachsen",
      "amtsgericht": "Amtsgericht Dresden",
      "registernummer": "HRB 39240",
      "registerart": "HRB",
      "company_name": "DesPro Systems GmbH",
      "company_seat": "Dresden",
      "details": "08.01.2026 (Bekanntmachungsdatum)\n\nSachsen Amtsgericht Dresden HRB 39240\nRegisterbekanntmachung nach dem Umwandlungsgesetz 08.01.2026 (Eintragungsdatum)\n\nDesPro Systems GmbH\nGesellschaft mit beschränkter Haftung\nDresden\n\nDen Gläubigern der an der Umwandlung beteiligten Rechtsträger ist, wenn sie binnen sechs Monaten nach dem Tag, an dem die Eintragung der Umwandlung in das Register des Sitzes desjenigen Rechtsträgers, dessen Gläubiger sie sind, nach § 19 Abs. 3 UmwG als bekannt gemacht gilt, ihren Anspruch nach Grund und Höhe in Textform anmelden, Sicherheit zu leisten, soweit sie nicht Befriedigung verlangen können. Dieses Recht steht den Gläubigern jedoch nur zu, wenn sie glaubhaft machen, dass durch die Umwandlung die Erfüllung der Forderung gefährdet wird."
    },
    {
      "date": "2026-01-08",
      "id": "141858",
      "original_text": "Löschungsankündigung\nSachsen Amtsgericht Dresden HRB 17946\nMühl Product & Service Holzvertrieb Dresden GmbH – Dresden",
      "type": "Löschungsankündigung",
      "state": "Sachsen",
      "amtsgericht": "Amtsgericht Dresden",
      "registernummer": "HRB 17946",
      "registerart": "HRB",
      "company_name": "Mühl Product & Service Holzvertrieb Dresden GmbH",
      "company_seat": "Dresden",
      "details": "08.01.2026 (Bekanntmachungsdatum)\n\nSachsen Amtsgericht Dresden HRB 17946\nLöschungsankündigung\n\nMühl Product & Service Holzvertrieb Dresden GmbH\nGesellschaft mit beschränkter Haftung\nDresden\n\nDas Registergericht beabsichtigt, die im Handelsregister eingetragene Gesellschaft von Amts wegen nach § 394 FamFG zu löschen. Die Frist zu Erhebung eines Widerspruchs gegen die beabsichtigte Löschung wird auf einen Monat festgesetzt."
    },
    {
      "date": "2026-01-08",
      "id": "141859",
      "original_text": "Löschungsankündigung\nSachsen Amtsgericht Chemnitz HRB 32337\nZendeli Bau und Service UG (haftungsbeschränkt) – Oberlungwitz",
      "type": "Löschungsankündigung",
      "state": "Sachsen",
      "amtsgericht": "Amtsgericht Chemnitz",
      "registernummer": "HRB 32337",
      "registerart": "HRB",
      "company_name": "Zendeli Bau und Service UG (haftungsbeschränkt)",
      "company_seat": "Oberlungwitz",
      "details": "08.01.2026 (Bekanntmachungsdatum)\n\nSachsen Amtsgericht Chemnitz HRB 32337\nLöschungsankündigung 08.01.2026 (Eintragungsdatum)\n\nZendeli Bau und Service UG (haftungsbeschränkt)\nGesellschaft mit beschränkter Haftung\nOberlungwitz\n\nDas Registergericht beabsichtigt, die im Handelsregister eingetragene Gesellschaft von Amts wegen nach § 394 FamFG zu löschen. Die Frist zu Erhebung eines Widerspruchs gegen die beabsichtigte Löschung wird auf einen Monat festgesetzt."
    },
    {
      "date": "2026-01-08",
      "id": "141860",
      "original_text": "Registerbekanntmachung nach dem Umwandlungsgesetz\nNiedersachsen Amtsgericht Oldenburg (Oldenburg) HRB 112389\nEnviTec Biogas Italia GmbH – Lohne",
      "type": "Registerbekanntmachung nach dem Umwandlungsgesetz",
      "state": "Niedersachsen",
      "amtsgericht": "Amtsgericht Oldenburg (Oldenburg)",
      "registernummer": "HRB 112389",
      "registerart": "HRB",
      "company_name": "EnviTec Biogas Italia GmbH",
      "company_seat": "Lohne",
      "details": "08.01.2026 (Bekanntmachungsdatum)\n\nNiedersachsen Amtsgericht Oldenburg (Oldenburg) HRB 112389\nRegisterbekanntmachung nach dem Umwandlungsgesetz 08.01.2026 (Eintragungsdatum)\n\nEnviTec Biogas Italia GmbH\nGesellschaft mit beschränkter Haftung\nLohne\n\nDen Gläubigern der an der Verschmelzung beteiligten Rechtsträger ist, wenn sie binnen sechs Monaten nach dem Tag, an dem die Eintragung der Verschmelzung in das Register des Sitzes desjenigen Rechtsträgers, dessen Gläubiger sie sind, nach § 19  Abs.  3 UmwG als bekannt gemacht gilt, ihren Anspruch nach Grund und Höhe schriftlich anmelden, Sicherheit zu leisten, soweit sie nicht Befriedigung verlangen können. Dieses Recht steht den Gläubigern jedoch nur zu, wenn sie glaubhaft machen, dass durch die Verschmelzung die Erfüllung der Forderung gefährdet wird."
    },
    {
      "date": "2026-01-08",
      "id": "141861",
      "original_text": "Löschungsankündigung\nNiedersachsen Amtsgericht Stadthagen HRA 200733\n\"Hotel zur goldenen Sonne\" Hotelbetriebs GmbH und Co. KG – Bad Eilsen",
      "type": "Löschungsankündigung",
      "state": "Niedersachsen",
      "amtsgericht": "Amtsgericht Stadthagen",
      "registernummer": "HRA 200733",
      "registerart": "HRA",
      "company_name": "\"Hotel zur goldenen Sonne\" Hotelbetriebs GmbH und Co. KG",
      "company_seat": "Bad Eilsen",
      "details": "08.01.2026 (Bekanntmachungsdatum)\n\nNiedersachsen Amtsgericht Stadthagen HRA 200733\nLöschungsankündigung\n\n\"Hotel zur goldenen Sonne\" Hotelbetriebs GmbH und Co. KG\nKommanditgesellschaft\nBad Eilsen\n\nDas Registergericht beabsichtigt, die Firma von Amts wegen nach § 394 FamFG zu löschen. Die Frist zur Erhebung eines Widerspruchs ist auf 1 Monat ab dieser Registerbekanntmachung festgesetzt."
    },
    {
      "date": "2026-01-08",
      "id": "141862",
      "original_text": "Registerbekanntmachung nach dem Umwandlungsgesetz\nNiedersachsen Amtsgericht Oldenburg (Oldenburg) HRB 215754\nMMF MaxFlow Membran Filtration GmbH – Lohne",
      "type": "Registerbekanntmachung nach dem Umwandlungsgesetz",
      "state": "Niedersachsen",
      "amtsgericht": "Amtsgericht Oldenburg (Oldenburg)",
      "registernummer": "HRB 215754",
      "registerart": "HRB",
      "company_name": "MMF MaxFlow Membran Filtration GmbH",
      "company_seat": "Lohne",
      "details": "08.01.2026 (Bekanntmachungsdatum)\n\nNiedersachsen Amtsgericht Oldenburg (Oldenburg) HRB 215754\nRegisterbekanntmachung nach dem Umwandlungsgesetz 08.01.2026 (Eintragungsdatum)\n\nMMF MaxFlow Membran Filtration GmbH\nGesellschaft mit beschränkter Haftung\nLohne\n\nDen Gläubigern der an der Verschmelzung beteiligten Rechtsträger ist, wenn sie binnen sechs Monaten nach dem Tag, an dem die Eintragung der Verschmelzung in das Register des Sitzes desjenigen Rechtsträgers, dessen Gläubiger sie sind, nach § 19  Abs.  3 UmwG als bekannt gemacht gilt, ihren Anspruch nach Grund und Höhe schriftlich anmelden, Sicherheit zu leisten, soweit sie nicht Befriedigung verlangen können. Dieses Recht steht den Gläubigern jedoch nur zu, wenn sie glaubhaft machen, dass durch die Verschmelzung die Erfüllung der Forderung gefährdet wird."
    },
    {
      "date": "2026-01-08",
      "id": "141863",
      "original_text": "Registerbekanntmachung nach dem Umwandlungsgesetz\nNiedersachsen Amtsgericht Oldenburg (Oldenburg) HRB 219701\nBioenergie Rietschen GmbH – Lohne",
      "type": "Registerbekanntmachung nach dem Umwandlungsgesetz",
      "state": "Niedersachsen",
      "amtsgericht": "Amtsgericht Oldenburg (Oldenburg)",
      "registernummer": "HRB 219701",
      "registerart": "HRB",
      "company_name": "Bioenergie Rietschen GmbH",
      "company_seat": "Lohne",
      "details": "08.01.2026 (Bekanntmachungsdatum)\n\nNiedersachsen Amtsgericht Oldenburg (Oldenburg) HRB 219701\nRegisterbekanntmachung nach dem Umwandlungsgesetz 08.01.2026 (Eintragungsdatum)\n\nBioenergie Rietschen GmbH\nGesellschaft mit beschränkter Haftung\nLohne\n\nDen Gläubigern der an der Verschmelzung beteiligten Rechtsträger ist, wenn sie binnen sechs Monaten nach dem Tag, an dem die Eintragung der Verschmelzung in das Register des Sitzes desjenigen Rechtsträgers, dessen Gläubiger sie sind, nach § 19  Abs.  3 UmwG als bekannt gemacht gilt, ihren Anspruch nach Grund und Höhe schriftlich anmelden, Sicherheit zu leisten, soweit sie nicht Befriedigung verlangen können. Dieses Recht steht den Gläubigern jedoch nur zu, wenn sie glaubhaft machen, dass durch die Verschmelzung die Erfüllung der Forderung gefährdet wird."
    },
    {
      "date": "2026-01-08",
      "id": "141864",
      "original_text": "Registerbekanntmachung nach dem Umwandlungsgesetz\nNiedersachsen Amtsgericht Osnabrück HRB 221647\nElektro Vor der Wöste GmbH – Bramsche",
      "type": "Registerbekanntmachung nach dem Umwandlungsgesetz",
      "state": "Niedersachsen",
      "amtsgericht": "Amtsgericht Osnabrück",
      "registernummer": "HRB 221647",
      "registerart": "HRB",
      "company_name": "Elektro Vor der Wöste GmbH",
      "company_seat": "Bramsche",
      "details": "08.01.2026 (Bekanntmachungsdatum)\n\nNiedersachsen Amtsgericht Osnabrück HRB 221647\nRegisterbekanntmachung nach dem Umwandlungsgesetz 08.01.2026 (Eintragungsdatum)\n\nElektro Vor der Wöste GmbH\nGesellschaft mit beschränkter Haftung\nBramsche\n\nDen Gläubigern der an der Ausgliederung beteiligten Rechtsträger ist, wenn sie binnen sechs Monaten nach dem Tag, an dem die Eintragung der Ausgliederung in das Register des Sitzes desjenigen Rechtsträgers, dessen Gläubiger sie sind, nach § 19 Abs. 3 UmwG als bekannt gemacht gilt, ihren Anspruch nach Grund und Höhe schriftlich anmelden, Sicherheit zu leisten, soweit sie nicht Befriedigung verlangen können. Dieses Recht steht den Gläubigern jedoch nur zu, wenn sie glaubhaft machen, dass durch die Ausgliederung die Erfüllung der Forderung gefährdet wird."
    },
    {
      "date": "2026-01-08",
      "id": "141865",
      "original_text": "Registerbekanntmachung nach dem Umwandlungsgesetz\nNiedersachsen Amtsgericht Tostedt HRA 2553\nMIVALIED Rohstoffhandel e.K. – Buchholz",
      "type": "Registerbekanntmachung nach dem Umwandlungsgesetz",
      "state": "Niedersachsen",
      "amtsgericht": "Amtsgericht Tostedt",
      "registernummer": "HRA 2553",
      "registerart": "HRA",
      "company_name": "MIVALIED Rohstoffhandel e.K.",
      "company_seat": "Buchholz",
      "details": "08.01.2026 (Bekanntmachungsdatum)\n\nNiedersachsen Amtsgericht Tostedt HRA 2553\nRegisterbekanntmachung nach dem Umwandlungsgesetz 08.01.2026 (Eintragungsdatum)\n\nMIVALIED Rohstoffhandel e.K.\nEinzelkaufmann / Einzelkauffrau\nBuchholz\n\nDen Gläubigern der an der Ausgliederung beteiligten Rechtsträger ist, wenn sie binnen sechs Monaten nach dem Tag, an dem die Eintragung der Ausgliederung in das Register des Sitzes desjenigen Rechtsträgers, dessen Gläubiger sie sind, nach § 19 Abs. 3 UmwG als bekannt gemacht gilt, ihren Anspruch nach Grund und Höhe schriftlich anmelden, Sicherheit zu leisten, soweit sie nicht Befriedigung verlangen können. Dieses Recht steht den Gläubigern jedoch nur zu, wenn sie glaubhaft machen, dass durch die Ausgliederung die Erfüllung der Forderung gefährdet wird."
    },
    {
      "date": "2026-01-08",
      "id": "141866",
      "original_text": "Registerbekanntmachung nach dem Umwandlungsgesetz\nNiedersachsen Amtsgericht Lüneburg HRB 210193\nÄND CME GmbH – Lüneburg",
      "type": "Registerbekanntmachung nach dem Umwandlungsgesetz",
      "state": "Niedersachsen",
      "amtsgericht": "Amtsgericht Lüneburg",
      "registernummer": "HRB 210193",
      "registerart": "HRB",
      "company_name": "ÄND CME GmbH",
      "company_seat": "Lüneburg",
      "details": "08.01.2026 (Bekanntmachungsdatum)\n\nNiedersachsen Amtsgericht Lüneburg HRB 210193\nRegisterbekanntmachung nach dem Umwandlungsgesetz 15.12.2025 (Eintragungsdatum)\n\nÄND CME GmbH\nGesellschaft mit beschränkter Haftung\nLüneburg\n\nDen Gläubigern der an der Verschmelzung beteiligten Rechtsträger ist, wenn sie binnen sechs Monaten nach dem Tag, an dem die Eintragung der Verschmelzung in das Register des Sitzes desjenigen Rechtsträgers, dessen Gläubiger sie sind, nach § 19  Abs.  3 UmwG als bekannt gemacht gilt, ihren Anspruch nach Grund und Höhe schriftlich anmelden, Sicherheit zu leisten, soweit sie nicht Befriedigung verlangen können. Dieses Recht steht den Gläubigern jedoch nur zu, wenn sie glaubhaft machen, dass durch die Verschmelzung die Erfüllung der Forderung gefährdet wird."
    },
    {
      "date": "2026-01-08",
      "id": "141867",
      "original_text": "Registerbekanntmachung nach dem Umwandlungsgesetz\nNiedersachsen Amtsgericht Oldenburg (Oldenburg) HRB 215754\nMMF MaxFlow Membran Filtration GmbH – Lohne",
      "type": "Registerbekanntmachung nach dem Umwandlungsgesetz",
      "state": "Niedersachsen",
      "amtsgericht": "Amtsgericht Oldenburg (Oldenburg)",
      "registernummer": "HRB 215754",
      "registerart": "HRB",
      "company_name": "MMF MaxFlow Membran Filtration GmbH",
      "company_seat": "Lohne",
      "details": "08.01.2026 (Bekanntmachungsdatum)\n\nNiedersachsen Amtsgericht Oldenburg (Oldenburg) HRB 215754\nRegisterbekanntmachung nach dem Umwandlungsgesetz 08.01.2026 (Eintragungsdatum)\n\nMMF MaxFlow Membran Filtration GmbH\nGesellschaft mit beschränkter Haftung\nLohne\n\nDen Gläubigern der an der Verschmelzung beteiligten Rechtsträger ist, wenn sie binnen sechs Monaten nach dem Tag, an dem die Eintragung der Verschmelzung in das Register des Sitzes desjenigen Rechtsträgers, dessen Gläubiger sie sind, nach § 19  Abs.  3 UmwG als bekannt gemacht gilt, ihren Anspruch nach Grund und Höhe schriftlich anmelden, Sicherheit zu leisten, soweit sie nicht Befriedigung verlangen können. Dieses Recht steht den Gläubigern jedoch nur zu, wenn sie glaubhaft machen, dass durch die Verschmelzung die Erfüllung der Forderung gefährdet wird."
    },
    {
      "date": "2026-01-08",
      "id": "141868",
      "original_text": "Registerbekanntmachung nach dem Umwandlungsgesetz\nNiedersachsen Amtsgericht Lüneburg HRB 209769\nBKI GmbH – Lüneburg",
      "type": "Registerbekanntmachung nach dem Umwandlungsgesetz",
      "state": "Niedersachsen",
      "amtsgericht": "Amtsgericht Lüneburg",
      "registernummer": "HRB 209769",
      "registerart": "HRB",
      "company_name": "BKI GmbH",
      "company_seat": "Lüneburg",
      "details": "08.01.2026 (Bekanntmachungsdatum)\n\nNiedersachsen Amtsgericht Lüneburg HRB 209769\nRegisterbekanntmachung nach dem Umwandlungsgesetz 08.01.2026 (Eintragungsdatum)\n\nBKI GmbH\nGesellschaft mit beschränkter Haftung\nLüneburg\n\nDen Gläubigern der an der formwechselnden Umwandlung beteiligten Rechtsträger ist, wenn sie binnen sechs Monaten nach dem Tag, an dem die Eintragung der Umwandlung in das Register des Sitzes desjenigen Rechtsträgers, dessen Gläubiger sie sind, nach § 19 Abs. 3 UmwG als bekannt gemacht gilt, ihren Anspruch nach Grund und Höhe schriftlich anmelden, Sicherheit zu leisten, soweit sie nicht Befriedigung verlangen können. Dieses Recht steht den Gläubigern jedoch nur zu, wenn sie glaubhaft machen, dass durch die formwechselnde Umwandlung die Erfüllung der Forderung gefährdet wird."
    },
    {
      "date": "2026-01-08",
      "id": "141869",
      "original_text": "Registerbekanntmachung nach dem Umwandlungsgesetz\nNiedersachsen Amtsgericht Lüneburg HRA 100392 früher Amtsgericht Celle\nMICON Mining and Construction Products GmbH & Co KG – Nienhagen",
      "type": "Registerbekanntmachung nach dem Umwandlungsgesetz",
      "state": "Niedersachsen",
      "amtsgericht": "Amtsgericht Lüneburg",
      "registernummer": "HRA 100392",
      "registerart": "HRA",
      "company_name": "MICON Mining and Construction Products GmbH & Co KG",
      "company_seat": "Nienhagen",
      "former_amtsgericht": "Celle",
      "details": "08.01.2026 (Bekanntmachungsdatum)\n\nNiedersachsen Amtsgericht Lüneburg HRA 100392 früher Amtsgericht Celle\nRegisterbekanntmachung nach dem Umwandlungsgesetz 08.01.2026 (Eintragungsdatum)\n\nMICON Mining and Construction Products GmbH & Co KG\nKommanditgesellschaft\nNienhagen\n\nDen Gläubigern der an der Verschmelzung beteiligten Rechtsträger ist, wenn sie binnen sechs Monaten nach dem Tag, an dem die Eintragung der Verschmelzung in das Register des Sitzes desjenigen Rechtsträgers, dessen Gläubiger sie sind, nach § 19  Abs.  3 UmwG als bekannt gemacht gilt, ihren Anspruch nach Grund und Höhe schriftlich anmelden, Sicherheit zu leisten, soweit sie nicht Befriedigung verlangen können. Dieses Recht steht den Gläubigern jedoch nur zu, wenn sie glaubhaft machen, dass durch die Verschmelzung die Erfüllung der Forderung gefährdet wird."
    },
    {
      "date": "2026-01-08",
      "id": "141870",
      "original_text": "Registerbekanntmachung nach dem Umwandlungsgesetz\nNiedersachsen Amtsgericht Hildesheim HRB 204732\nC & P Holding GmbH – Sarstedt",
      "type": "Registerbekanntmachung nach dem Umwandlungsgesetz",
      "state": "Niedersachsen",
      "amtsgericht": "Amtsgericht Hildesheim",
      "registernummer": "HRB 204732",
      "registerart": "HRB",
      "company_name": "C & P Holding GmbH",
      "company_seat": "Sarstedt",
      "details": "08.01.2026 (Bekanntmachungsdatum)\n\nNiedersachsen Amtsgericht Hildesheim HRB 204732\nRegisterbekanntmachung nach dem Umwandlungsgesetz\n\nC & P Holding GmbH\nGesellschaft mit beschränkter Haftung\nSarstedt\n\nEs wird darauf hingewiesen, dass ein Formwechselplan oder sein Entwurf über einen grenzüberschreitenden Formwechsel in die Predator Holding, S.L. mit Sitz in Palma de Mallorca/Spanien(sociedad de responsabilidad limitada - S.L.) beim Handelsregister eingereicht worden ist.\n\nDie Anteilsinhaber, die Gläubiger sowie die zuständigen Betriebsräte der an dem grenzüberschreitenden Formwechsel beteiligten Gesellschaft oder, soweit es keinen Betriebsrat gibt, die Arbeitnehmer der an dem grenzüberschreitenden Formwechsel beteiligten Gesellschaft, können der Gesellschaft spätestens fünf Arbeitstage vor dem Tag der Gesellschafterversammlung Bemerkungen zum Formwechselplan übermitteln."
    },
    {
      "date": "2026-01-08",
      "id": "141871",
      "original_text": "Löschungsankündigung\nNiedersachsen Amtsgericht Braunschweig HRB 208376\nScheunengut GmbH – Braunschweig",
      "type": "Löschungsankündigung",
      "state": "Niedersachsen",
      "amtsgericht": "Amtsgericht Braunschweig",
      "registernummer": "HRB 208376",
      "registerart": "HRB",
      "company_name": "Scheunengut GmbH",
      "company_seat": "Braunschweig",
      "details": "08.01.2026 (Bekanntmachungsdatum)\n\nNiedersachsen Amtsgericht Braunschweig HRB 208376\nLöschungsankündigung\n\nScheunengut GmbH\nGesellschaft mit beschränkter Haftung\nBraunschweig\n\nDas Registergericht beabsichtigt, die Gesellschaft von Amts wegen nach § 394 FamFG zu löschen. Die Frist zur Erhebung eines Widerspruchs ist auf 1 Monat ab dieser Registerbekanntmachung festgesetzt."
    },
    {
      "date": "2026-01-08",
      "id": "141872",
      "original_text": "Registerbekanntmachung nach dem Umwandlungsgesetz\nNiedersachsen Amtsgericht Oldenburg (Oldenburg) HRB 217324\nGreen LNG GmbH – Lohne",
      "type": "Registerbekanntmachung nach dem Umwandlungsgesetz",
      "state": "Niedersachsen",
      "amtsgericht": "Amtsgericht Oldenburg (Oldenburg)",
      "registernummer": "HRB 217324",
      "registerart": "HRB",
      "company_name": "Green LNG GmbH",
      "company_seat": "Lohne",
      "details": "08.01.2026 (Bekanntmachungsdatum)\n\nNiedersachsen Amtsgericht Oldenburg (Oldenburg) HRB 217324\nRegisterbekanntmachung nach dem Umwandlungsgesetz 08.01.2026 (Eintragungsdatum)\n\nGreen LNG GmbH\nGesellschaft mit beschränkter Haftung\nLohne\n\nDen Gläubigern der an der Verschmelzung beteiligten Rechtsträger ist, wenn sie binnen sechs Monaten nach dem Tag, an dem die Eintragung der Verschmelzung in das Register des Sitzes desjenigen Rechtsträgers, dessen Gläubiger sie sind, nach § 19  Abs.  3 UmwG als bekannt gemacht gilt, ihren Anspruch nach Grund und Höhe schriftlich anmelden, Sicherheit zu leisten, soweit sie nicht Befriedigung verlangen können. Dieses Recht steht den Gläubigern jedoch nur zu, wenn sie glaubhaft machen, dass durch die Verschmelzung die Erfüllung der Forderung gefährdet wird."
    },
    {
      "date": "2026-01-08",
      "id": "141873",
      "original_text": "Registerbekanntmachung nach dem Umwandlungsgesetz\nNiedersachsen Amtsgericht Tostedt HRA 205621\nMIVALIED GmbH & Co. KG – Buchholz i.d.N.",
      "type": "Registerbekanntmachung nach dem Umwandlungsgesetz",
      "state": "Niedersachsen",
      "amtsgericht": "Amtsgericht Tostedt",
      "registernummer": "HRA 205621",
      "registerart": "HRA",
      "company_name": "MIVALIED GmbH & Co. KG",
      "company_seat": "Buchholz i.d.N.",
      "details": "08.01.2026 (Bekanntmachungsdatum)\n\nNiedersachsen Amtsgericht Tostedt HRA 205621\nRegisterbekanntmachung nach dem Umwandlungsgesetz 08.01.2026 (Eintragungsdatum)\n\nMIVALIED GmbH & Co. KG\nKommanditgesellschaft\nBuchholz i.d.N.\n\nDen Gläubigern der an der Ausgliederung beteiligten Rechtsträger ist, wenn sie binnen sechs Monaten nach dem Tag, an dem die Eintragung der Ausgliederung in das Register des Sitzes desjenigen Rechtsträgers, dessen Gläubiger sie sind, nach § 19 Abs. 3 UmwG als bekannt gemacht gilt, ihren Anspruch nach Grund und Höhe schriftlich anmelden, Sicherheit zu leisten, soweit sie nicht Befriedigung verlangen können. Dieses Recht steht den Gläubigern jedoch nur zu, wenn sie glaubhaft machen, dass durch die Ausgliederung die Erfüllung der Forderung gefährdet wird."
    },
    {
      "date": "2026-01-08",
      "id": "141874",
      "original_text": "Registerbekanntmachung nach dem Umwandlungsgesetz\nNiedersachsen Amtsgericht Oldenburg (Oldenburg) HRB 215754\nMMF MaxFlow Membran Filtration GmbH – Lohne",
      "type": "Registerbekanntmachung nach dem Umwandlungsgesetz",
      "state": "Niedersachsen",
      "amtsgericht": "Amtsgericht Oldenburg (Oldenburg)",
      "registernummer": "HRB 215754",
      "registerart": "HRB",
      "company_name": "MMF MaxFlow Membran Filtration GmbH",
      "company_seat": "Lohne",
      "details": "08.01.2026 (Bekanntmachungsdatum)\n\nNiedersachsen Amtsgericht Oldenburg (Oldenburg) HRB 215754\nRegisterbekanntmachung nach dem Umwandlungsgesetz 08.01.2026 (Eintragungsdatum)\n\nMMF MaxFlow Membran Filtration GmbH\nGesellschaft mit beschränkter Haftung\nLohne\n\nDen Gläubigern der an der Verschmelzung beteiligten Rechtsträger ist, wenn sie binnen sechs Monaten nach dem Tag, an dem die Eintragung der Verschmelzung in das Register des Sitzes desjenigen Rechtsträgers, dessen Gläubiger sie sind, nach § 19  Abs.  3 UmwG als bekannt gemacht gilt, ihren Anspruch nach Grund und Höhe schriftlich anmelden, Sicherheit zu leisten, soweit sie nicht Befriedigung verlangen können. Dieses Recht steht den Gläubigern jedoch nur zu, wenn sie glaubhaft machen, dass durch die Verschmelzung die Erfüllung der Forderung gefährdet wird."
    },
    {
      "date": "2026-01-08",
      "id": "141875",
      "original_text": "Registerbekanntmachung nach dem Umwandlungsgesetz\nNiedersachsen Amtsgericht Lüneburg HRB 100333 früher Amtsgericht Celle\nEastman Whipstock GmbH – Nienhagen",
      "type": "Registerbekanntmachung nach dem Umwandlungsgesetz",
      "state": "Niedersachsen",
      "amtsgericht": "Amtsgericht Lüneburg",
      "registernummer": "HRB 100333",
      "registerart": "HRB",
      "company_name": "Eastman Whipstock GmbH",
      "company_seat": "Nienhagen",
      "former_amtsgericht": "Celle",
      "details": "08.01.2026 (Bekanntmachungsdatum)\n\nNiedersachsen Amtsgericht Lüneburg HRB 100333 früher Amtsgericht Celle\nRegisterbekanntmachung nach dem Umwandlungsgesetz 08.01.2026 (Eintragungsdatum)\n\nEastman Whipstock GmbH\nGesellschaft mit beschränkter Haftung\nNienhagen\n\nDen Gläubigern der an der Verschmelzung beteiligten Rechtsträger ist, wenn sie binnen sechs Monaten nach dem Tag, an dem die Eintragung der Verschmelzung in das Register des Sitzes desjenigen Rechtsträgers, dessen Gläubiger sie sind, nach § 19  Abs.  3 UmwG als bekannt gemacht gilt, ihren Anspruch nach Grund und Höhe schriftlich anmelden, Sicherheit zu leisten, soweit sie nicht Befriedigung verlangen können. Dieses Recht steht den Gläubigern jedoch nur zu, wenn sie glaubhaft machen, dass durch die Verschmelzung die Erfüllung der Forderung gefährdet wird."
    },
    {
      "date": "2026-01-08",
      "id": "141876",
      "original_text": "Sonstige Registerbekanntmachung\nBaden-Württemberg Amtsgericht Stuttgart HRB 18324\nAndretta Fruchtimport GmbH – Stuttgart",
      "type": "Sonstige Registerbekanntmachung",
      "state": "Baden-Württemberg",
      "amtsgericht": "Amtsgericht Stuttgart",
      "registernummer": "HRB 18324",
      "registerart": "HRB",
      "company_name": "Andretta Fruchtimport GmbH",
      "company_seat": "Stuttgart",
      "details": "08.01.2026 (Bekanntmachungsdatum)\n\nBaden-Württemberg Amtsgericht Stuttgart HRB 18324\nSonstige Registerbekanntmachung 08.01.2026 (Eintragungsdatum)\n\nAndretta Fruchtimport GmbH\nGesellschaft mit beschränkter Haftung\nStuttgart\n\nAls nicht eingetragen wird bekanntgemacht:\nDen Gläubigern der Gesellschaft, deren Forderungen begründet worden sind, bevor die Eintragung der Beendigung des Vertrages in das Handelsregister nach § 10 HGB als bekanntgemacht gilt, ist vom anderen Vertragsteil Sicherheit zu leisten, wenn sie sich binnen sechs Monaten nach der Bekanntmachung zu diesem Zweck bei ihm melden."
    },
    {
      "date": "2026-01-08",
      "id": "141877",
      "original_text": "Registerbekanntmachung nach dem Umwandlungsgesetz\nRheinland-Pfalz Amtsgericht Koblenz HRA 12303\nGriesson - de Beukelaer GmbH & Co. KG – Polch",
      "type": "Registerbekanntmachung nach dem Umwandlungsgesetz",
      "state": "Rheinland-Pfalz",
      "amtsgericht": "Amtsgericht Koblenz",
      "registernummer": "HRA 12303",
      "registerart": "HRA",
      "company_name": "Griesson - de Beukelaer GmbH & Co. KG",
      "company_seat": "Polch",
      "details": "08.01.2026 (Bekanntmachungsdatum)\n\nRheinland-Pfalz Amtsgericht Koblenz HRA 12303\nRegisterbekanntmachung nach dem Umwandlungsgesetz 08.01.2026 (Eintragungsdatum)\n\nGriesson - de Beukelaer GmbH & Co. KG\nKommanditgesellschaft\nPolch\n\nGläubigern der an der Verschmelzung beteiligten Rechtsträger ist unter den Voraussetzungen des § 22 UmwG Sicherheit zu leisten.Als nicht eingetragen wird veröffentlicht: Den Gläubigern der an der Verschmelzung beteiligten Rechtsträger ist, wenn sie binnen sechs Monaten nach dem Tag, an dem die Eintragung der Verschmelzung in das Register des Sitzes desjenigen Rechtsträgers,dessen Gläubiger sie sind, nach § 19 Abs. 3 UmwG als bekannt gemacht gilt, ihren Anspruch nach Grund und Höhe schriftlich anmelden, Sicherheit zu leisten, soweit sie nicht Befriedigung verlangen können. Dieses Recht steht den Gläubigern jedoch nur zu, wenn sie glaubhaft machen, dass durch die Verschmelzung die Erfüllung der Forderung gefährdet wird."
    },
    {
      "date": "2026-01-08",
      "id": "141878",
      "original_text": "Registerbekanntmachung nach dem Umwandlungsgesetz\nRheinland-Pfalz Amtsgericht Koblenz HRB 23790\nTM Holding Verwaltungs GmbH – Polch",
      "type": "Registerbekanntmachung nach dem Umwandlungsgesetz",
      "state": "Rheinland-Pfalz",
      "amtsgericht": "Amtsgericht Koblenz",
      "registernummer": "HRB 23790",
      "registerart": "HRB",
      "company_name": "TM Holding Verwaltungs GmbH",
      "company_seat": "Polch",
      "details": "08.01.2026 (Bekanntmachungsdatum)\n\nRheinland-Pfalz Amtsgericht Koblenz HRB 23790\nRegisterbekanntmachung nach dem Umwandlungsgesetz 08.01.2026 (Eintragungsdatum)\n\nTM Holding Verwaltungs GmbH\nGesellschaft mit beschränkter Haftung\nPolch\n\nDen Gläubigern der an der Verschmelzung beteiligten Rechtsträger ist, wenn sie binnen sechs Monaten nach dem Tag, an dem die Eintragung der Verschmelzung in das Register des Sitzes desjenigen Rechtsträgers,dessen Gläubiger sie sind, nach § 19 Abs. 3 UmwG als bekannt gemacht gilt, ihren Anspruch nach Grund und Höhe schriftlich anmelden, Sicherheit zu leisten, soweit sie nicht Befriedigung verlangen können. Dieses Recht steht den Gläubigern jedoch nur zu, wenn sie glaubhaft machen, dass durch die Verschmelzung die Erfüllung der Forderung gefährdet wird."
    },
    {
      "date": "2026-01-08",
      "id": "141879",
      "original_text": "Registerbekanntmachung nach dem Umwandlungsgesetz\nNordrhein-Westfalen Amtsgericht Arnsberg HRB 2666\nANFOTEC Immobilien GmbH – Medebach",
      "type": "Registerbekanntmachung nach dem Umwandlungsgesetz",
      "state": "Nordrhein-Westfalen",
      "amtsgericht": "Amtsgericht Arnsberg",
      "registernummer": "HRB 2666",
      "registerart": "HRB",
      "company_name": "ANFOTEC Immobilien GmbH",
      "company_seat": "Medebach",
      "details": "08.01.2026 (Bekanntmachungsdatum)\n\nNordrhein-Westfalen Amtsgericht Arnsberg HRB 2666\nRegisterbekanntmachung nach dem Umwandlungsgesetz 08.01.2026 (Eintragungsdatum)\n\nANFOTEC Immobilien GmbH\nGesellschaft mit beschränkter Haftung\nMedebach\n\nDen Gläubigern der an der Abspaltung beteiligten Rechtsträger ist, wenn sie binnen sechs Monaten nach dem Tag, an dem die Eintragung der Abspaltung in das Register des Sitzes desjenigen Rechtsträgers, dessen Gläubiger sie sind, nach § 19 Absatz 3 UmwG als bekanntgemacht gilt, ihren Anspruch nach Grund und Höhe schriftlich anmelden, Sicherheit zu leisten, soweit sie nicht Befriedigung verlangen können. Dieses Recht steht den Gläubigern jedoch nur zu, wenn sie glaubhaft machen, dass durch die Abspaltung die Erfüllung ihrer Forderung gefährdet wird."
    },
    {
      "date": "2026-01-08",
      "id": "141880",
      "original_text": "Registerbekanntmachung nach dem Umwandlungsgesetz\nNordrhein-Westfalen Amtsgericht Arnsberg HRA 9350\nREACTIVE EXPERTS e. K. – Bad Sassendorf",
      "type": "Registerbekanntmachung nach dem Umwandlungsgesetz",
      "state": "Nordrhein-Westfalen",
      "amtsgericht": "Amtsgericht Arnsberg",
      "registernummer": "HRA 9350",
      "registerart": "HRA",
      "company_name": "REACTIVE EXPERTS e. K.",
      "company_seat": "Bad Sassendorf",
      "details": "08.01.2026 (Bekanntmachungsdatum)\n\nNordrhein-Westfalen Amtsgericht Arnsberg HRA 9350\nRegisterbekanntmachung nach dem Umwandlungsgesetz 08.01.2026 (Eintragungsdatum)\n\nREACTIVE EXPERTS e. K.\nEinzelkaufmann / Einzelkauffrau\nBad Sassendorf\n\nDen Gläubigern der an der Ausgliederung beteiligten Rechtsträger ist, wenn sie binnen sechs Monaten nach dem Tag, an dem die Eintragung der Ausgliederung in das Register des Sitzes desjenigen Rechtsträgers, dessen Gläubiger sie sind, nach § 19 Absatz 3 UmwG als bekanntgemacht gilt, ihren Anspruch nach Grund und Höhe schriftlich anmelden, Sicherheit zu leisten, soweit sie nicht Befriedigung verlangen können. Dieses Recht steht den Gläubigern jedoch nur zu, wenn sie glaubhaft machen, dass durch die Ausgliederung die Erfüllung ihrer Forderung gefährdet wird."
    },
    {
      "date": "2026-01-08",
      "id": "141881",
      "original_text": "Registerbekanntmachung nach dem Umwandlungsgesetz\nNordrhein-Westfalen Amtsgericht Bonn HRA 10420\nBranka Ahlbach e.K. – Bad Münstereifel",
      "type": "Registerbekanntmachung nach dem Umwandlungsgesetz",
      "state": "Nordrhein-Westfalen",
      "amtsgericht": "Amtsgericht Bonn",
      "registernummer": "HRA 10420",
      "registerart": "HRA",
      "company_name": "Branka Ahlbach e.K.",
      "company_seat": "Bad Münstereifel",
      "details": "08.01.2026 (Bekanntmachungsdatum)\n\nNordrhein-Westfalen Amtsgericht Bonn HRA 10420\nRegisterbekanntmachung nach dem Umwandlungsgesetz 08.01.2026 (Eintragungsdatum)\n\nBranka Ahlbach e.K.\nEinzelkaufmann / Einzelkauffrau\nBad Münstereifel\n\nDen Gläubigern der an der Ausgliederung beteiligten Rechtsträger ist, wenn sie binnen sechs Monaten nach dem Tag, an dem die Eintragung der Ausgliederung in das Register des Sitzes desjenigen Rechtsträgers, dessen Gläubiger sie sind, nach § 19 Absatz 3 UmwG als bekanntgemacht gilt, ihren Anspruch nach Grund und Höhe schriftlich anmelden, Sicherheit zu leisten, soweit sie nicht Befriedigung verlangen können. Dieses Recht steht den Gläubigern jedoch nur zu, wenn sie glaubhaft machen, dass durch die Ausgliederung die Erfüllung ihrer Forderung gefährdet wird."
    },
    {
      "date": "2026-01-08",
      "id": "141882",
      "original_text": "Registerbekanntmachung nach dem Umwandlungsgesetz\nNordrhein-Westfalen Amtsgericht Hagen HRB 7374\nZL Microdent-Attachment Verwaltungs GmbH – Breckerfeld",
      "type": "Registerbekanntmachung nach dem Umwandlungsgesetz",
      "state": "Nordrhein-Westfalen",
      "amtsgericht": "Amtsgericht Hagen",
      "registernummer": "HRB 7374",
      "registerart": "HRB",
      "company_name": "ZL Microdent-Attachment Verwaltungs GmbH",
      "company_seat": "Breckerfeld",
      "details": "08.01.2026 (Bekanntmachungsdatum)\n\nNordrhein-Westfalen Amtsgericht Hagen HRB 7374\nRegisterbekanntmachung nach dem Umwandlungsgesetz 08.01.2026 (Eintragungsdatum)\n\nZL Microdent-Attachment Verwaltungs GmbH\nGesellschaft mit beschränkter Haftung\nBreckerfeld\n\nDie Gesellschaft hat Gläubigern, deren Forderungen vor dieser Bekanntmachung begründet worden sind, Sicherheit zu leisten, soweit sie nicht Befriedigung verlangen können, wenn sie sich binnen sechs Monaten zu diesem Zweck melden."
    },
    {
      "date": "2026-01-08",
      "id": "141883",
      "original_text": "Registerbekanntmachung nach dem Umwandlungsgesetz\nNordrhein-Westfalen Amtsgericht Neuss HRB 10138\nHP Steuerberatungsgesellschaft mbH – Meerbusch",
      "type": "Registerbekanntmachung nach dem Umwandlungsgesetz",
      "state": "Nordrhein-Westfalen",
      "amtsgericht": "Amtsgericht Neuss",
      "registernummer": "HRB 10138",
      "registerart": "HRB",
      "company_name": "HP Steuerberatungsgesellschaft mbH",
      "company_seat": "Meerbusch",
      "details": "08.01.2026 (Bekanntmachungsdatum)\n\nNordrhein-Westfalen Amtsgericht Neuss HRB 10138\nRegisterbekanntmachung nach dem Umwandlungsgesetz 08.01.2026 (Eintragungsdatum)\n\nHP Steuerberatungsgesellschaft mbH\nGesellschaft mit beschränkter Haftung\nMeerbusch\n\nDen Gläubigern der an der Verschmelzung beteiligten Rechtsträger ist, wenn sie binnen sechs Monaten nach dem Tag, an dem die Eintragung der Verschmelzung in das Register des Sitzes desjenigen Rechtsträgers, dessen Gläubiger sie sind, nach § 19 Absatz 3 UmwG als bekanntgemacht gilt, ihren Anspruch nach Grund und Höhe schriftlich anmelden, Sicherheit zu leisten, soweit sie nicht Befriedigung verlangen können. Dieses Recht steht den Gläubigern jedoch nur zu, wenn sie glaubhaft machen, dass durch die Verschmelzung die Erfüllung ihrer Forderung gefährdet wird."
    },
    {
      "date": "2026-01-08",
      "id": "141884",
      "original_text": "Einreichung neuer Dokumente\nNordrhein-Westfalen Amtsgericht Köln HRB 85281\nCovestro AG – Leverkusen",
      "type": "Einreichung neuer Dokumente",
      "state": "Nordrhein-Westfalen",
      "amtsgericht": "Amtsgericht Köln",
      "registernummer": "HRB 85281",
      "registerart": "HRB",
      "company_name": "Covestro AG",
      "company_seat": "Leverkusen",
      "details": "08.01.2026 (Bekanntmachungsdatum)\n\nNordrhein-Westfalen Amtsgericht Köln HRB 85281\nEinreichung neuer Dokumente\n\nCovestro AG\nAktiengesellschaft\nLeverkusen\n\nDem Registergericht ist eine Liste der Mitglieder des Aufsichtsrates eingereicht worden."
    },
    {
      "date": "2026-01-08",
      "id": "141885",
      "original_text": "Sonstige Registerbekanntmachung\nNordrhein-Westfalen Amtsgericht Essen HRB 18787\nKonsul Inkasso GmbH – Essen",
      "type": "Sonstige Registerbekanntmachung",
      "state": "Nordrhein-Westfalen",
      "amtsgericht": "Amtsgericht Essen",
      "registernummer": "HRB 18787",
      "registerart": "HRB",
      "company_name": "Konsul Inkasso GmbH",
      "company_seat": "Essen",
      "details": "08.01.2026 (Bekanntmachungsdatum)\n\nNordrhein-Westfalen Amtsgericht Essen HRB 18787\nSonstige Registerbekanntmachung 08.01.2026 (Eintragungsdatum)\n\nKonsul Inkasso GmbH\nGesellschaft mit beschränkter Haftung\nEssen\n\nAls nicht eingetragen wird veröffentlicht: Den Gläubigern der Gesellschaft, deren Forderungen begründet worden sind bevor die Eintragung der Beendigung des Beherrschungs- und Gewinnabführungsvertrages  in das Handelsregister nach § 10 des Handelsgesetzbuches als bekanntgemacht gilt, hat der andere Vertragsteil Sicherheit zu leisten, wenn sie sich binnen sechs Monaten nach der Bekanntmachung der Eintragung zu diesem Zweck bei ihm melden."
    },
    {
      "date": "2026-01-08",
      "id": "141886",
      "original_text": "Löschungsankündigung\nNordrhein-Westfalen Amtsgericht Neuss HRB 13336\nUMECOM GmbH – Neuss",
      "type": "Löschungsankündigung",
      "state": "Nordrhein-Westfalen",
      "amtsgericht": "Amtsgericht Neuss",
      "registernummer": "HRB 13336",
      "registerart": "HRB",
      "company_name": "UMECOM GmbH",
      "company_seat": "Neuss",
      "details": "08.01.2026 (Bekanntmachungsdatum)\n\nNordrhein-Westfalen Amtsgericht Neuss HRB 13336\nLöschungsankündigung 06.01.2026 (Eintragungsdatum)\n\nUMECOM GmbH\nGesellschaft mit beschränkter Haftung\nNeuss\n\nDas Registergericht beabsichtigt die Gesellschaft von Amts wegen nach § 394 FamFG zu löschen. Die Frist zur Erhebung eines Widerspruchs ist auf einen Monat festgesetzt. Rechtsbehelfsbelehrung: Gegen diese Verfügung können Sie Widerspruch einlegen. Der Widerspruch ist bei dem Amtsgericht Neuss - Registergericht -, Breite Str. 48, 41460 Neuss schriftlich in deutscher Sprache oder zur Niederschrift der Geschäftsstelle einzulegen. Der Widerspruch kann auch zur Niederschrift der Geschäftsstelle eines jeden Amtsgerichtes abgegeben werden. Die Einlegung ist auch durch Übertragung eines elektronischen Dokuments an die elektronische Poststelle des Gerichts möglich. Das elektronische Dokument muss für die Bearbeitung durch das Gericht geeignet und mit einer qualifizierten elektronischen Signatur der verantwortenden Person versehen sein oder von der verantwortenden Person signiert und auf einem sicheren Übermittlungsweg gemäß § 130a ZPO nach näherer Maßgabe der Verordnung über die technischen Rahmenbedingungen des elektronischen Rechtsverkehrs und über das besondere elektronische Behördenpostfach (BGBl. I, S.3803) eingereicht werden. Weitere Informationen erhalten Sie auf der Internetseite www.justiz.de. Der Widerspruch muss spätestens innerhalb der gesetzten Frist nach der schriftlichen Bekanntgabe der Verfügung bei dem Amtsgericht - Registergericht - Neuss eingegangen sein. Dies gilt auch dann, wenn der Widerspruch zur Niederschrift der Geschäftsstelle eines anderen Amtsgerichtes abgegeben wurde. Die Frist beginnt mit der schriftlichen Bekanntgabe der Verfügung. Die Bekanntgabe ist entweder durch Zustellung oder am dritten Tage nach Aufgabe zur Post bewirkt. Fällt das Ende der Frist auf einen Sonntag, einen allgemeinen Feiertag oder Sonnabend, so endet die Frist mit Ablauf des nächsten Werktages. Der Widerspruch muss die Bezeichnung der angefochtenen Verfügung sowie die Erklärung enthalten, dass Widerspruch gegen diese Verfügung eingelegt wird. Er ist zu unterzeichnen und soll begründet werden."
    },
    {
      "date": "2026-01-08",
      "id": "141887",
      "original_text": "Einreichung neuer Dokumente\nNordrhein-Westfalen Amtsgericht Köln HRB 43262\nGWG Wohnungsgesellschaft mit beschränkter Haftung Rhein-Erft – Hürth",
      "type": "Einreichung neuer Dokumente",
      "state": "Nordrhein-Westfalen",
      "amtsgericht": "Amtsgericht Köln",
      "registernummer": "HRB 43262",
      "registerart": "HRB",
      "company_name": "GWG Wohnungsgesellschaft mit beschränkter Haftung Rhein-Erft",
      "company_seat": "Hürth",
      "details": "08.01.2026 (Bekanntmachungsdatum)\n\nNordrhein-Westfalen Amtsgericht Köln HRB 43262\nEinreichung neuer Dokumente\n\nGWG Wohnungsgesellschaft mit beschränkter Haftung Rhein-Erft\nGesellschaft mit beschränkter Haftung\nHürth\n\nDem Registergericht ist eine neue Liste der Mitglieder des Aufsichtsrates eingereicht worden."
    },
    {
      "date": "2026-01-08",
      "id": "141888",
      "original_text": "Registerbekanntmachung nach dem Umwandlungsgesetz\nNordrhein-Westfalen Amtsgericht Arnsberg HRB 15974\nANFOTEC Antriebstechnologie GmbH – Medebach",
      "type": "Registerbekanntmachung nach dem Umwandlungsgesetz",
      "state": "Nordrhein-Westfalen",
      "amtsgericht": "Amtsgericht Arnsberg",
      "registernummer": "HRB 15974",
      "registerart": "HRB",
      "company_name": "ANFOTEC Antriebstechnologie GmbH",
      "company_seat": "Medebach",
      "details": "08.01.2026 (Bekanntmachungsdatum)\n\nNordrhein-Westfalen Amtsgericht Arnsberg HRB 15974\nRegisterbekanntmachung nach dem Umwandlungsgesetz 08.01.2026 (Eintragungsdatum)\n\nANFOTEC Antriebstechnologie GmbH\nGesellschaft mit beschränkter Haftung\nMedebach\n\nDen Gläubigern der an der Abspaltung beteiligten Rechtsträger ist, wenn sie binnen sechs Monaten nach dem Tag, an dem die Eintragung der Abspaltung in das Register des Sitzes desjenigen Rechtsträgers, dessen Gläubiger sie sind, nach § 19 Absatz 3 UmwG als bekanntgemacht gilt, ihren Anspruch nach Grund und Höhe schriftlich anmelden, Sicherheit zu leisten, soweit sie nicht Befriedigung verlangen können. Dieses Recht steht den Gläubigern jedoch nur zu, wenn sie glaubhaft machen, dass durch die Abspaltung die Erfüllung ihrer Forderung gefährdet wird."
    },
    {
      "date": "2026-01-08",
      "id": "141889",
      "original_text": "Löschungsankündigung\nNordrhein-Westfalen Amtsgericht Krefeld HRB 16429\nsamu UG (haftungsbeschränkt) – Krefeld",
      "type": "Löschungsankündigung",
      "state": "Nordrhein-Westfalen",
      "amtsgericht": "Amtsgericht Krefeld",
      "registernummer": "HRB 16429",
      "registerart": "HRB",
      "company_name": "samu UG (haftungsbeschränkt)",
      "company_seat": "Krefeld",
      "details": "08.01.2026 (Bekanntmachungsdatum)\n\nNordrhein-Westfalen Amtsgericht Krefeld HRB 16429\nLöschungsankündigung\n\nsamu UG (haftungsbeschränkt)\nGesellschaft mit beschränkter Haftung\nKrefeld\n\nDas Registergericht beabsichtigt die Gesellschaft von Amts wegen nach § 394 FamFG zu löschen. Die Frist zur Erhebung eines Widerspruchs ist auf einen Monat festgesetzt."
    },
    {
      "date": "2026-01-08",
      "id": "141890",
      "original_text": "Sonstige Registerbekanntmachung\nNordrhein-Westfalen Amtsgericht Duisburg HRB 32494\nSTS Service & Rent GmbH – Duisburg",
      "type": "Sonstige Registerbekanntmachung",
      "state": "Nordrhein-Westfalen",
      "amtsgericht": "Amtsgericht Duisburg",
      "registernummer": "HRB 32494",
      "registerart": "HRB",
      "company_name": "STS Service & Rent GmbH",
      "company_seat": "Duisburg",
      "details": "08.01.2026 (Bekanntmachungsdatum)\n\nNordrhein-Westfalen Amtsgericht Duisburg HRB 32494\nSonstige Registerbekanntmachung 08.01.2026 (Eintragungsdatum)\n\nSTS Service & Rent GmbH\nGesellschaft mit beschränkter Haftung\nDuisburg\n\nDie Gesellschaft hat Gläubigern, deren Forderungen vor dieser Bekanntmachung begründet worden sind, Sicherheit zu leisten, soweit sie nicht Befriedigung verlangen können, wenn sie sich binnen sechs Monaten zu diesem Zweck melden."
    },
    {
      "date": "2026-01-08",
      "id": "141891",
      "original_text": "Einreichung neuer Dokumente\nNordrhein-Westfalen Amtsgericht Köln HRB 46868\nBädergesellschaft der Stadt Bergisch Gladbach mbH – Bergisch Gladbach",
      "type": "Einreichung neuer Dokumente",
      "state": "Nordrhein-Westfalen",
      "amtsgericht": "Amtsgericht Köln",
      "registernummer": "HRB 46868",
      "registerart": "HRB",
      "company_name": "Bädergesellschaft der Stadt Bergisch Gladbach mbH",
      "company_seat": "Bergisch Gladbach",
      "details": "08.01.2026 (Bekanntmachungsdatum)\n\nNordrhein-Westfalen Amtsgericht Köln HRB 46868\nEinreichung neuer Dokumente 08.01.2026 (Eintragungsdatum)\n\nBädergesellschaft der Stadt Bergisch Gladbach mbH\nGesellschaft mit beschränkter Haftung\nBergisch Gladbach\n\nDem Registergericht ist eine neue Liste der Mitglieder des Aufsichtsrates eingereicht worden."
    },
    {
      "date": "2026-01-08",
      "id": "141892",
      "original_text": "Registerbekanntmachung nach dem Umwandlungsgesetz\nNordrhein-Westfalen Amtsgericht Essen HRB 27082\nfmk Fuhr Meyer & Kollegen GmbH Steuerberatungsgesellschaft – Essen",
      "type": "Registerbekanntmachung nach dem Umwandlungsgesetz",
      "state": "Nordrhein-Westfalen",
      "amtsgericht": "Amtsgericht Essen",
      "registernummer": "HRB 27082",
      "registerart": "HRB",
      "company_name": "fmk Fuhr Meyer & Kollegen GmbH Steuerberatungsgesellschaft",
      "company_seat": "Essen",
      "details": "08.01.2026 (Bekanntmachungsdatum)\n\nNordrhein-Westfalen Amtsgericht Essen HRB 27082\nRegisterbekanntmachung nach dem Umwandlungsgesetz 08.01.2026 (Eintragungsdatum)\n\nfmk Fuhr Meyer & Kollegen GmbH Steuerberatungsgesellschaft\nGesellschaft mit beschränkter Haftung\nEssen\n\nDen Gläubigern der an der Verschmelzung beteiligten Rechtsträger ist, wenn sie binnen sechs Monaten nach dem Tag, an dem die Eintragung der Verschmelzung in das Register des Sitzes desjenigen Rechtsträgers, dessen Gläubiger sie sind, nach § 19 Absatz 3 UmwG als bekanntgemacht gilt, ihren Anspruch nach Grund und Höhe schriftlich anmelden, Sicherheit zu leisten, soweit sie nicht Befriedigung verlangen können. Dieses Recht steht den Gläubigern jedoch nur zu, wenn sie glaubhaft machen, dass durch die Verschmelzung die Erfüllung ihrer Forderung gefährdet wird."
    },
    {
      "date": "2026-01-08",
      "id": "141893",
      "original_text": "Einreichung neuer Dokumente\nNordrhein-Westfalen Amtsgericht Duisburg HRB 15195\nMEG Mülheimer Entsorgungsgesellschaft mbH – Mülheim an der Ruhr",
      "type": "Einreichung neuer Dokumente",
      "state": "Nordrhein-Westfalen",
      "amtsgericht": "Amtsgericht Duisburg",
      "registernummer": "HRB 15195",
      "registerart": "HRB",
      "company_name": "MEG Mülheimer Entsorgungsgesellschaft mbH",
      "company_seat": "Mülheim an der Ruhr",
      "details": "08.01.2026 (Bekanntmachungsdatum)\n\nNordrhein-Westfalen Amtsgericht Duisburg HRB 15195\nEinreichung neuer Dokumente\n\nMEG Mülheimer Entsorgungsgesellschaft mbH\nGesellschaft mit beschränkter Haftung\nMülheim an der Ruhr\n\nDem Registergericht ist eine neue Liste der Mitglieder des Aufsichtsrates eingereicht worden."
    },
    {
      "date": "2026-01-08",
      "id": "141894",
      "original_text": "Löschungsankündigung\nNordrhein-Westfalen Amtsgericht Köln HRB 69820\nCONOPERA Verwaltungs-GmbH – Köln",
      "type": "Löschungsankündigung",
      "state": "Nordrhein-Westfalen",
      "amtsgericht": "Amtsgericht Köln",
      "registernummer": "HRB 69820",
      "registerart": "HRB",
      "company_name": "CONOPERA Verwaltungs-GmbH",
      "company_seat": "Köln",
      "details": "08.01.2026 (Bekanntmachungsdatum)\n\nNordrhein-Westfalen Amtsgericht Köln HRB 69820\nLöschungsankündigung\n\nCONOPERA Verwaltungs-GmbH\nGesellschaft mit beschränkter Haftung\nKöln\n\nDas Registergericht beabsichtigt die Gesellschaft von Amts wegen nach § 394 FamFG zu löschen. Die Frist zur Erhebung eines Widerspruchs ist auf einen Monat festgesetzt."
    },
    {
      "date": "2026-01-08",
      "id": "141895",
      "original_text": "Löschungsankündigung\nNordrhein-Westfalen Amtsgericht Aachen HRB 15541\nKDvK Kreatives Druckwerk & visuelle Kommunikation GmbH – Aachen",
      "type": "Löschungsankündigung",
      "state": "Nordrhein-Westfalen",
      "amtsgericht": "Amtsgericht Aachen",
      "registernummer": "HRB 15541",
      "registerart": "HRB",
      "company_name": "KDvK Kreatives Druckwerk & visuelle Kommunikation GmbH",
      "company_seat": "Aachen",
      "details": "08.01.2026 (Bekanntmachungsdatum)\n\nNordrhein-Westfalen Amtsgericht Aachen HRB 15541\nLöschungsankündigung\n\nKDvK Kreatives Druckwerk & visuelle Kommunikation GmbH\nGesellschaft mit beschränkter Haftung\nAachen\n\nDas Registergericht beabsichtigt, von Amts wegen die Gesellschaft wegen\nVermögenslosigkeit nach § 394 FamFG zu löschen,\nnachdem der Geschäftsführer mit Schreiben vom 14.12.2025 und 30.12.2025\nmitgeteilt hat, dass die Gesellschaft vollständig vermögenslos ist.\n\nZur Geltendmachung des Widerspruchs gegen die beabsichtigte Löschung wird hiermit eine Frist von einem Monat ab Veröffentlichung dieser Ankündigung bestimmt.\n\nRechtsbehelfsbelehrung:\n\nGegen diese Verfügung kann Widerspruch eingelegt werden. Zum Widerspruch ist jeder berechtigt, der an der Unterlassung der Löschung ein berechtigtes Interesse hat.\n\nDer Widerspruch ist bei dem Amtsgericht Aachen, Adalbertsteinweg 92, 52070 Aachen schriftlich in deutscher Sprache oder zur Niederschrift der Geschäftsstelle einzulegen. Der Widerspruch kann auch zur Niederschrift der Geschäftsstelle eines jeden Amtsgerichtes abgegeben werden.\n\nDer Widerspruch muss spätestens innerhalb der gesetzten Frist nach der Bekanntgabe der Verfügung bei dem Amtsgericht Aachen eingegangen sein. Dies gilt auch dann, wenn der Widerspruch zur Niederschrift der Geschäftsstelle eines anderen Amtsgerichtes abgegeben wurde. Die Frist beginnt mit der Bekanntgabe der Verfügung durch Veröffentlichung. Fällt das Ende der Frist auf einen Sonntag, einen allgemeinen Feiertag oder Sonnabend, so endet die Frist mit Ablauf des nächsten Werktages.\n\nDer Widerspruch muss die Bezeichnung der angefochtenen Verfügung sowie die Erklärung enthalten, dass Widerspruch gegen diese Verfügung eingelegt wird. Er ist zu unterzeichnen und soll begründet werden.\n\nDie Einlegung ist auch durch Übertragung eines elektronischen Dokuments an die elektronische Poststelle des Gerichts möglich. Das elektronische Dokument muss für die Bearbeitung durch das Gericht geeignet und mit einer qualifizierten elektronischen Signatur der verantwortenden Person versehen sein oder von der verantwortenden Person signiert und auf einem sicheren Übermittlungsweg gemäß § 130 a ZPO nach näherer Maßgabe der Verordnung über die technischen Rahmenbedingungen des elektronischen Rechtsverkehrs und über das besondere elektronische Behördenpostfach (BGBl. I, S. 3803) eingereicht werden. Weitere Informationen erhalten Sie auf der Internetseite www.justiz.de."
    },
    {
      "date": "2026-01-08",
      "id": "141896",
      "original_text": "Löschungsankündigung\nNordrhein-Westfalen Amtsgericht Neuss HRB 14396\nDreamstar GmbH – Neuss",
      "type": "Löschungsankündigung",
      "state": "Nordrhein-Westfalen",
      "amtsgericht": "Amtsgericht Neuss",
      "registernummer": "HRB 14396",
      "registerart": "HRB",
      "company_name": "Dreamstar GmbH",
      "company_seat": "Neuss",
      "details": "08.01.2026 (Bekanntmachungsdatum)\n\nNordrhein-Westfalen Amtsgericht Neuss HRB 14396\nLöschungsankündigung 06.01.2026 (Eintragungsdatum)\n\nDreamstar GmbH\nGesellschaft mit beschränkter Haftung\nNeuss\n\nDas Registergericht beabsichtigt die Gesellschaft von Amts wegen nach § 394 FamFG zu löschen. Die Frist zur Erhebung eines Widerspruchs ist auf einen Monat festgesetzt. Rechtsbehelfsbelehrung: Gegen diese Verfügung können Sie Widerspruch einlegen. Der Widerspruch ist bei dem Amtsgericht Neuss - Registergericht -, Breite Str. 48, 41460 Neuss schriftlich in deutscher Sprache oder zur Niederschrift der Geschäftsstelle einzulegen. Der Widerspruch kann auch zur Niederschrift der Geschäftsstelle eines jeden Amtsgerichtes abgegeben werden. Die Einlegung ist auch durch Übertragung eines elektronischen Dokuments an die elektronische Poststelle des Gerichts möglich. Das elektronische Dokument muss für die Bearbeitung durch das Gericht geeignet und mit einer qualifizierten elektronischen Signatur der verantwortenden Person versehen sein oder von der verantwortenden Person signiert und auf einem sicheren Übermittlungsweg gemäß § 130a ZPO nach näherer Maßgabe der Verordnung über die technischen Rahmenbedingungen des elektronischen Rechtsverkehrs und über das besondere elektronische Behördenpostfach (BGBl. I, S.3803) eingereicht werden. Weitere Informationen erhalten Sie auf der Internetseite www.justiz.de. Der Widerspruch muss spätestens innerhalb der gesetzten Frist nach der schriftlichen Bekanntgabe der Verfügung bei dem Amtsgericht - Registergericht - Neuss eingegangen sein. Dies gilt auch dann, wenn der Widerspruch zur Niederschrift der Geschäftsstelle eines anderen Amtsgerichtes abgegeben wurde. Die Frist beginnt mit der schriftlichen Bekanntgabe der Verfügung. Die Bekanntgabe ist entweder durch Zustellung oder am dritten Tage nach Aufgabe zur Post bewirkt. Fällt das Ende der Frist auf einen Sonntag, einen allgemeinen Feiertag oder Sonnabend, so endet die Frist mit Ablauf des nächsten Werktages. Der Widerspruch muss die Bezeichnung der angefochtenen Verfügung sowie die Erklärung enthalten, dass Widerspruch gegen diese Verfügung eingelegt wird. Er ist zu unterzeichnen und soll begründet werden."
    },
    {
      "date": "2026-01-08",
      "id": "141897",
      "original_text": "Registerbekanntmachung nach dem Umwandlungsgesetz\nNordrhein-Westfalen Amtsgericht Köln HRB 115744\nSpotmyEnergy GmbH – Köln",
      "type": "Registerbekanntmachung nach dem Umwandlungsgesetz",
      "state": "Nordrhein-Westfalen",
      "amtsgericht": "Amtsgericht Köln",
      "registernummer": "HRB 115744",
      "registerart": "HRB",
      "company_name": "SpotmyEnergy GmbH",
      "company_seat": "Köln",
      "details": "08.01.2026 (Bekanntmachungsdatum)\n\nNordrhein-Westfalen Amtsgericht Köln HRB 115744\nRegisterbekanntmachung nach dem Umwandlungsgesetz 08.01.2026 (Eintragungsdatum)\n\nSpotmyEnergy GmbH\nGesellschaft mit beschränkter Haftung\nKöln\n\nDen Gläubigern der an der Ausgliederung beteiligten Rechtsträger ist, wenn sie binnen sechs Monaten nach dem Tag, an dem die Eintragung der Ausgliederung in das Register des Sitzes desjenigen Rechtsträgers, dessen Gläubiger sie sind, nach § 19 Absatz 3 UmwG als bekanntgemacht gilt, ihren Anspruch nach Grund und Höhe schriftlich anmelden, Sicherheit zu leisten, soweit sie nicht Befriedigung verlangen können. Dieses Recht steht den Gläubigern jedoch nur zu, wenn sie glaubhaft machen, dass durch die Ausgliederung die Erfüllung ihrer Forderung gefährdet wird."
    },
    {
      "date": "2026-01-08",
      "id": "141898",
      "original_text": "Löschungsankündigung\nNordrhein-Westfalen Amtsgericht Dortmund HRB 32015\nNRGSync Vertriebs GmbH – Dortmund",
      "type": "Löschungsankündigung",
      "state": "Nordrhein-Westfalen",
      "amtsgericht": "Amtsgericht Dortmund",
      "registernummer": "HRB 32015",
      "registerart": "HRB",
      "company_name": "NRGSync Vertriebs GmbH",
      "company_seat": "Dortmund",
      "details": "08.01.2026 (Bekanntmachungsdatum)\n\nNordrhein-Westfalen Amtsgericht Dortmund HRB 32015\nLöschungsankündigung\n\nNRGSync Vertriebs GmbH\nGesellschaft mit beschränkter Haftung\nDortmund\n\nDas Registergericht beabsichtigt die Gesellschaft von Amts wegen nach § 394 FamFG zu löschen. Die Frist zur Erhebung eines Widerspruchs ist auf zwei Monate festgesetzt."
    },
    {
      "date": "2026-01-08",
      "id": "141899",
      "original_text": "Sonstige Registerbekanntmachung\nSchleswig-Holstein Amtsgericht Lübeck HRB 12307\nSenger Holstein GmbH – Lübeck",
      "type": "Sonstige Registerbekanntmachung",
      "state": "Schleswig-Holstein",
      "amtsgericht": "Amtsgericht Lübeck",
      "registernummer": "HRB 12307",
      "registerart": "HRB",
      "company_name": "Senger Holstein GmbH",
      "company_seat": "Lübeck",
      "details": "08.01.2026 (Bekanntmachungsdatum)\n\nSchleswig-Holstein Amtsgericht Lübeck HRB 12307\nSonstige Registerbekanntmachung\n\nSenger Holstein GmbH\nGesellschaft mit beschränkter Haftung\nLübeck\n\nAls nicht eingetragen wird veröffentlicht: Der andere Vertragsteil hat den Gläubigern dieses Rechtsträgers, dessen Forderungen begründet worden sind, bevor die Eintragung der Beendigung dieses Vertrages in das Handelsregister nach § 10 des Handelsgesetzbuches als bekannt gemacht gilt, Sicherheit zu leisten, wenn sie sich binnen sechs Monaten nach der Bekanntmachung der Eintragung zu diesem Zweck bei ihm melden. Dieses Recht steht den Gläubigern nicht zu, die im Fall des Insolvenzverfahrens ein Recht auf vorzugsweise Befriedigung aus der Deckungsmasse haben, die nach gesetzlicher Vorschrift zu ihrem Schutz errichtet und staatlich überwacht ist."
    },
    {
      "date": "2026-01-08",
      "id": "141900",
      "original_text": "Registerbekanntmachung nach dem Umwandlungsgesetz\nSchleswig-Holstein Amtsgericht Lübeck HRA 6975\nFischereibetrieb Robert Ahnfeld e.K. – Neustadt",
      "type": "Registerbekanntmachung nach dem Umwandlungsgesetz",
      "state": "Schleswig-Holstein",
      "amtsgericht": "Amtsgericht Lübeck",
      "registernummer": "HRA 6975",
      "registerart": "HRA",
      "company_name": "Fischereibetrieb Robert Ahnfeld e.K.",
      "company_seat": "Neustadt",
      "details": "08.01.2026 (Bekanntmachungsdatum)\n\nSchleswig-Holstein Amtsgericht Lübeck HRA 6975\nRegisterbekanntmachung nach dem Umwandlungsgesetz 07.01.2026 (Eintragungsdatum)\n\nFischereibetrieb Robert Ahnfeld e.K.\nEinzelkaufmann / Einzelkauffrau\nNeustadt\n\nZu Eintragungsnummer 3 vom 07.01.2026 wird als nicht eingetragen veröffentlicht: Den Gläubigern der an der Ausgliederung beteiligten Rechtsträger ist, wenn sie binnen sechs Monaten nach dem Tag, an dem die Eintragung der Ausgliederung in das Register des Sitzes desjenigen Rechtsträgers, dessen Gläubiger sie sind, als bekannt gemacht gilt, ihren Anspruch nach Grund und Höhe schriftlich anmelden, Sicherheit zu leisten, soweit sie nicht Befriedigung verlangen können. Dieses Recht steht den Gläubigern jedoch nur zu, wenn sie glaubhaft machen, dass durch die Ausgliederung die Erfüllung ihrer Forderung gefährdet wird."
    },
    {
      "date": "2026-01-08",
      "id": "141901",
      "original_text": "Löschungsankündigung\nHessen Amtsgericht Frankfurt am Main HRB 96284\nBickel Projektentwicklungs-GmbH – Frankfurt am Main",
      "type": "Löschungsankündigung",
      "state": "Hessen",
      "amtsgericht": "Amtsgericht Frankfurt am Main",
      "registernummer": "HRB 96284",
      "registerart": "HRB",
      "company_name": "Bickel Projektentwicklungs-GmbH",
      "company_seat": "Frankfurt am Main",
      "details": "08.01.2026 (Bekanntmachungsdatum)\n\nHessen Amtsgericht Frankfurt am Main HRB 96284\nLöschungsankündigung\n\nBickel Projektentwicklungs-GmbH\nGesellschaft mit beschränkter Haftung\nFrankfurt am Main\n\nEs ist beabsichtigt, die Gesellschaft wegen Vermögenslosigkeit gemäß § 394 FamFG von Amts wegen im Handelsregister zu löschen. Hiergegen kann innerhalb eines Monats nach dieser Veröffentlichung Widerspruch bei dem Amtsgericht Frankfurt am Main eingelegt werden."
    },
    {
      "date": "2026-01-08",
      "id": "141902",
      "original_text": "Löschungsankündigung\nHessen Amtsgericht Friedberg HRB 9069\nMPS GmbH – Nidda",
      "type": "Löschungsankündigung",
      "state": "Hessen",
      "amtsgericht": "Amtsgericht Friedberg",
      "registernummer": "HRB 9069",
      "registerart": "HRB",
      "company_name": "MPS GmbH",
      "company_seat": "Nidda",
      "details": "08.01.2026 (Bekanntmachungsdatum)\n\nHessen Amtsgericht Friedberg HRB 9069\nLöschungsankündigung 08.01.2026 (Eintragungsdatum)\n\nMPS GmbH\nGesellschaft mit beschränkter Haftung\nNidda\n\nDas Registergericht beabsichtigt die im Handelsregister eingetragene Gesellschaft von Amts wegen nach § 394 FamFG zu löschen. Die Frist zur Erhebung eines Widerspruchs gegen die beabsichtigte Löschung wird auf 3 Monate festgesetzt."
    },
    {
      "date": "2026-01-08",
      "id": "141903",
      "original_text": "Sonstige Registerbekanntmachung\nHessen Amtsgericht Frankfurt am Main HRB 84285\nPEARL GOLD AG – Frankfurt am Main",
      "type": "Sonstige Registerbekanntmachung",
      "state": "Hessen",
      "amtsgericht": "Amtsgericht Frankfurt am Main",
      "registernummer": "HRB 84285",
      "registerart": "HRB",
      "company_name": "PEARL GOLD AG",
      "company_seat": "Frankfurt am Main",
      "details": "08.01.2026 (Bekanntmachungsdatum)\n\nHessen Amtsgericht Frankfurt am Main HRB 84285\nSonstige Registerbekanntmachung 08.01.2026 (Eintragungsdatum)\n\nPEARL GOLD AG\nAktiengesellschaft\nFrankfurt am Main\n\nDurch eine Änderung in den Personen der Aufsichtsratsmitglieder ist eine Liste der Mitglieder des Aufsichtsrates zum Handelsregister eingereicht worden."
    },
    {
      "date": "2026-01-08",
      "id": "141904",
      "original_text": "Löschungsankündigung\nHessen Amtsgericht Wiesbaden HRB 32058\nSENA GmbH – Flörsheim am Main",
      "type": "Löschungsankündigung",
      "state": "Hessen",
      "amtsgericht": "Amtsgericht Wiesbaden",
      "registernummer": "HRB 32058",
      "registerart": "HRB",
      "company_name": "SENA GmbH",
      "company_seat": "Flörsheim am Main",
      "details": "08.01.2026 (Bekanntmachungsdatum)\n\nHessen Amtsgericht Wiesbaden HRB 32058\nLöschungsankündigung\n\nSENA GmbH\nGesellschaft mit beschränkter Haftung\nFlörsheim am Main\n\nDas Registergericht beabsichtigt die im Handelsregister eingetragene Gesellschaft von Amts wegen nach § 394 FamFG zu löschen. Die Frist zur Erhebung eines Widerspruchs gegen die beabsichtigte Löschung wird auf 3 Monate festgesetzt."
    },
    {
      "date": "2026-01-08",
      "id": "141905",
      "original_text": "Löschungsankündigung\nHessen Amtsgericht Offenbach am Main HRB 45818\nVS-Management GmbH – Offenbach am Main",
      "type": "Löschungsankündigung",
      "state": "Hessen",
      "amtsgericht": "Amtsgericht Offenbach am Main",
      "registernummer": "HRB 45818",
      "registerart": "HRB",
      "company_name": "VS-Management GmbH",
      "company_seat": "Offenbach am Main",
      "details": "08.01.2026 (Bekanntmachungsdatum)\n\nHessen Amtsgericht Offenbach am Main HRB 45818\nLöschungsankündigung\n\nVS-Management GmbH\nGesellschaft mit beschränkter Haftung\nOffenbach am Main\n\nDas Registergericht beabsichtigt die im Handelsregister eingetragene Gesellschaft von Amts wegen nach § 394 FamFG zu löschen. Die Frist zur Erhebung eines Widerspruchs gegen die beabsichtigte Löschung wird auf 3 Monate festgesetzt."
    },
    {
      "date": "2026-01-08",
      "id": "141906",
      "original_text": "Löschungsankündigung\nHessen Amtsgericht Frankfurt am Main HRB 80931\narago da vinci GmbH – Frankfurt am Main",
      "type": "Löschungsankündigung",
      "state": "Hessen",
      "amtsgericht": "Amtsgericht Frankfurt am Main",
      "registernummer": "HRB 80931",
      "registerart": "HRB",
      "company_name": "arago da vinci GmbH",
      "company_seat": "Frankfurt am Main",
      "details": "08.01.2026 (Bekanntmachungsdatum)\n\nHessen Amtsgericht Frankfurt am Main HRB 80931\nLöschungsankündigung\n\narago da vinci GmbH\nGesellschaft mit beschränkter Haftung\nFrankfurt am Main\n\nDas Registergericht beabsichtigt die im Handelsregister eingetragene Gesellschaft von Amts wegen nach § 394 FamFG zu löschen. Die Frist zur Erhebung eines Widerspruchs gegen die beabsichtigte Löschung wird auf 1 Monat festgesetzt."
    },
    {
      "date": "2026-01-08",
      "id": "141907",
      "original_text": "Löschungsankündigung\nHessen Amtsgericht Darmstadt HRB 83955\nBAIKSAN OPC GmbH – Raunheim",
      "type": "Löschungsankündigung",
      "state": "Hessen",
      "amtsgericht": "Amtsgericht Darmstadt",
      "registernummer": "HRB 83955",
      "registerart": "HRB",
      "company_name": "BAIKSAN OPC GmbH",
      "company_seat": "Raunheim",
      "details": "08.01.2026 (Bekanntmachungsdatum)\n\nHessen Amtsgericht Darmstadt HRB 83955\nLöschungsankündigung\n\nBAIKSAN OPC GmbH\nGesellschaft mit beschränkter Haftung\nRaunheim\n\nDas Registergericht beabsichtigt die im Handelsregister eingetragene Gesellschaft von Amts wegen nach § 394 FamFG zu löschen. Die Frist zur Erhebung eines Widerspruchs gegen die beabsichtigte Löschung wird auf 3 Monate festgesetzt."
    },
    {
      "date": "2026-01-08",
      "id": "141908",
      "original_text": "Registerbekanntmachung nach dem Umwandlungsgesetz\nHessen Amtsgericht Wiesbaden HRB 35922\nMerbag Wiesbaden GmbH – Wiesbaden",
      "type": "Registerbekanntmachung nach dem Umwandlungsgesetz",
      "state": "Hessen",
      "amtsgericht": "Amtsgericht Wiesbaden",
      "registernummer": "HRB 35922",
      "registerart": "HRB",
      "company_name": "Merbag Wiesbaden GmbH",
      "company_seat": "Wiesbaden",
      "details": "08.01.2026 (Bekanntmachungsdatum)\n\nHessen Amtsgericht Wiesbaden HRB 35922\nRegisterbekanntmachung nach dem Umwandlungsgesetz 08.01.2026 (Eintragungsdatum)\n\nMerbag Wiesbaden GmbH\nGesellschaft mit beschränkter Haftung\nWiesbaden\n\nDen Gläubigern der an der Verschmelzung beteiligten Rechtsträger ist, wenn sie binnen sechs Monaten nach dem Tag, an dem die Eintragung der Verschmelzung in das Register des Sitzes derjenigen Rechtsträger deren Gläubiger sie sind, nach § 19 Absatz 3 UmwG bekannt gemacht worden ist, ihren Anspruch nach Grund und Höhe schriftlich anmelden, Sicherheit zu leisten, soweit sie nicht Befriedigung verlangen können. Dieses Recht steht den Gläubigern jedoch nur zu, wenn sie glaubhaft machen, dass durch die Verschmelzung die Erfüllung ihrer Forderung gefährdet wird."
    },
    {
      "date": "2026-01-08",
      "id": "141909",
      "original_text": "Registerbekanntmachung nach dem Umwandlungsgesetz\nHessen Amtsgericht Wetzlar HRB 6789\nSchweitzer Immobilien GmbH – Leun",
      "type": "Registerbekanntmachung nach dem Umwandlungsgesetz",
      "state": "Hessen",
      "amtsgericht": "Amtsgericht Wetzlar",
      "registernummer": "HRB 6789",
      "registerart": "HRB",
      "company_name": "Schweitzer Immobilien GmbH",
      "company_seat": "Leun",
      "details": "08.01.2026 (Bekanntmachungsdatum)\n\nHessen Amtsgericht Wetzlar HRB 6789\nRegisterbekanntmachung nach dem Umwandlungsgesetz 08.01.2026 (Eintragungsdatum)\n\nSchweitzer Immobilien GmbH\nGesellschaft mit beschränkter Haftung\nLeun\n\nDen Gläubigern der an der Verschmelzung beteiligten Rechtsträger ist, wenn sie binnen sechs Monaten nach dem Tag, an dem die Eintragung der Verschmelzung in das Register des Sitzes derjenigen Rechtsträger deren Gläubiger sie sind, nach § 19 Absatz 3 UmwG bekannt gemacht worden ist, ihren Anspruch nach Grund und Höhe schriftlich anmelden, Sicherheit zu leisten, soweit sie nicht Befriedigung verlangen können. Dieses Recht steht den Gläubigern jedoch nur zu, wenn sie glaubhaft machen, dass durch die Verschmelzung die Erfüllung ihrer Forderung gefährdet wird."
    },
    {
      "date": "2026-01-08",
      "id": "141910",
      "original_text": "Löschungsankündigung\nHessen Amtsgericht Offenbach am Main HRB 52545\nRMN Kernbohrtechnik GmbH – Offenbach am Main",
      "type": "Löschungsankündigung",
      "state": "Hessen",
      "amtsgericht": "Amtsgericht Offenbach am Main",
      "registernummer": "HRB 52545",
      "registerart": "HRB",
      "company_name": "RMN Kernbohrtechnik GmbH",
      "company_seat": "Offenbach am Main",
      "details": "08.01.2026 (Bekanntmachungsdatum)\n\nHessen Amtsgericht Offenbach am Main HRB 52545\nLöschungsankündigung\n\nRMN Kernbohrtechnik GmbH\nGesellschaft mit beschränkter Haftung\nOffenbach am Main\n\nDas Registergericht beabsichtigt die im Handelsregister eingetragene Gesellschaft von Amts wegen nach § 394 FamFG zu löschen. Die Frist zur Erhebung eines Widerspruchs gegen die beabsichtigte Löschung wird auf 3 Monate festgesetzt."
    },
    {
      "date": "2026-01-08",
      "id": "141911",
      "original_text": "Löschungsankündigung\nHessen Amtsgericht Offenbach am Main HRB 54528\nGANA GmbH – Dietzenbach",
      "type": "Löschungsankündigung",
      "state": "Hessen",
      "amtsgericht": "Amtsgericht Offenbach am Main",
      "registernummer": "HRB 54528",
      "registerart": "HRB",
      "company_name": "GANA GmbH",
      "company_seat": "Dietzenbach",
      "details": "08.01.2026 (Bekanntmachungsdatum)\n\nHessen Amtsgericht Offenbach am Main HRB 54528\nLöschungsankündigung\n\nGANA GmbH\nGesellschaft mit beschränkter Haftung\nDietzenbach\n\nDas Registergericht beabsichtigt die im Handelsregister eingetragene Gesellschaft von Amts wegen nach § 394 FamFG zu löschen. Die Frist zur Erhebung eines Widerspruchs gegen die beabsichtigte Löschung wird auf 3 Monate festgesetzt."
    },
    {
      "date": "2026-01-08",
      "id": "141912",
      "original_text": "Sonstige Registerbekanntmachung\nBrandenburg Amtsgericht Potsdam HRA 6675\nMJ Immobilienmanagement e.K. – Beetzsee",
      "type": "Sonstige Registerbekanntmachung",
      "state": "Brandenburg",
      "amtsgericht": "Amtsgericht Potsdam",
      "registernummer": "HRA 6675",
      "registerart": "HRA",
      "company_name": "MJ Immobilienmanagement e.K.",
      "company_seat": "Beetzsee",
      "details": "08.01.2026 (Bekanntmachungsdatum)\n\nBrandenburg Amtsgericht Potsdam HRA 6675\nSonstige Registerbekanntmachung\n\nMJ Immobilienmanagement e.K.\nEinzelkaufmann / Einzelkauffrau\nBeetzsee\n\nAls nicht eingetragen wird veröffentlicht:\nDen Gläubigern der an der Ausgliederung beteiligten Rechtsträger ist, wenn sie binnen sechs Monaten nach dem Tag, an dem die Eintragung der Ausgliederung in das Register des Sitzes desjenigen Rechtsträgers, dessen Gläubiger sie sind, als bekannt gemacht gilt, ihren Anspruch nach Grund und Höhe schriftlich anmelden, Sicherheit zu leisten, soweit sie nicht Befriedigung verlangen können. Dieses Recht steht den Gläubigern jedoch nur zu, wenn sie glaubhaft machen, dass durch die Spaltung die Erfüllung ihrer Forderung gefährdet wird."
    },
    {
      "date": "2026-01-08",
      "id": "141913",
      "original_text": "Sonstige Registerbekanntmachung\nHessen Amtsgericht Wiesbaden VR 4728\nL´Opera Piccola Bad Schwalbach e. V. – Bad Schwalbach",
      "type": "Sonstige Registerbekanntmachung",
      "state": "Hessen",
      "amtsgericht": "Amtsgericht Wiesbaden",
      "registernummer": "VR 4728",
      "registerart": "VR",
      "company_name": "L´Opera Piccola Bad Schwalbach e. V.",
      "company_seat": "Bad Schwalbach",
      "details": "08.01.2026 (Bekanntmachungsdatum)\n\nHessen Amtsgericht Wiesbaden VR 4728\nSonstige Registerbekanntmachung 08.01.2026 (Eintragungsdatum)\n\nL´Opera Piccola Bad Schwalbach e. V.\neingetragener Verein\nBad Schwalbach\n\nDer Verein ist aufgelöst."
    },
    {
      "date": "2026-01-08",
      "id": "141914",
      "original_text": "Sonstige Registerbekanntmachung\nHessen Amtsgericht Frankfurt am Main HRB 112491\nioki GmbH – Frankfurt am Main",
      "type": "Sonstige Registerbekanntmachung",
      "state": "Hessen",
      "amtsgericht": "Amtsgericht Frankfurt am Main",
      "registernummer": "HRB 112491",
      "registerart": "HRB",
      "company_name": "ioki GmbH",
      "company_seat": "Frankfurt am Main",
      "details": "08.01.2026 (Bekanntmachungsdatum)\n\nHessen Amtsgericht Frankfurt am Main HRB 112491\nSonstige Registerbekanntmachung 08.01.2026 (Eintragungsdatum)\n\nioki GmbH\nGesellschaft mit beschränkter Haftung\nFrankfurt am Main\n\nDie Gesellschaft hat Gläubigern, deren Forderungen vor der Eintragugn der Beendigung des Vertrages begründet worden sind, Sicherheit zu leisten, soweit sie nicht Befriedigung verlangen können, wenn sie sich binnen sechs Monaten nach dieser Bekanntmachung zu diesem Zweck melden."
    },
    {
      "date": "2026-01-08",
      "id": "141915",
      "original_text": "Löschungsankündigung\nHessen Amtsgericht Darmstadt HRB 94197\nukowapi UG (haftungsbeschränkt) – Darmstadt",
      "type": "Löschungsankündigung",
      "state": "Hessen",
      "amtsgericht": "Amtsgericht Darmstadt",
      "registernummer": "HRB 94197",
      "registerart": "HRB",
      "company_name": "ukowapi UG (haftungsbeschränkt)",
      "company_seat": "Darmstadt",
      "details": "08.01.2026 (Bekanntmachungsdatum)\n\nHessen Amtsgericht Darmstadt HRB 94197\nLöschungsankündigung\n\nukowapi UG (haftungsbeschränkt)\nGesellschaft mit beschränkter Haftung\nDarmstadt\n\nDas Registergericht beabsichtigt die im Handelsregister eingetragene Gesellschaft von Amts wegen nach § 394 FamFG zu löschen. Die Frist zur Erhebung eines Widerspruchs gegen die beabsichtigte Löschung wird auf 3 Monate festgesetzt."
    },
    {
      "date": "2026-01-08",
      "id": "141916",
      "original_text": "Löschungsankündigung\nHessen Amtsgericht Frankfurt am Main HRB 132985\nFutureAA Business UG (haftungsbeschränkt) – Frankfurt am Main",
      "type": "Löschungsankündigung",
      "state": "Hessen",
      "amtsgericht": "Amtsgericht Frankfurt am Main",
      "registernummer": "HRB 132985",
      "registerart": "HRB",
      "company_name": "FutureAA Business UG (haftungsbeschränkt)",
      "company_seat": "Frankfurt am Main",
      "details": "08.01.2026 (Bekanntmachungsdatum)\n\nHessen Amtsgericht Frankfurt am Main HRB 132985\nLöschungsankündigung\n\nFutureAA Business UG (haftungsbeschränkt)\nGesellschaft mit beschränkter Haftung\nFrankfurt am Main\n\nEs ist beabsichtigt, die Gesellschaft wegen Vermögenslosigkeit gemäß § 394 FamFG von Amts wegen im Handelsregister zu löschen. Hiergegen kann innerhalb eines Monats nach dieser Veröffentlichung Widerspruch bei dem Amtsgericht Frankfurt am Main eingelegt werden."
    }
  ]
}