{
  "date": "2026-01-30",
  "date_of_scrape": "2026-01-31T04:35:35.438Z",
  "tool_version": "0.2.0",
  "number_of_announcements": 106,
  "announcements": [
    {
      "date": "2026-01-30",
      "id": "143900",
      "original_text": "Sonstige Registerbekanntmachung\nBayern Amtsgericht München HRB 230446\nDF Deutsche Finance Asset Management GmbH – München",
      "type": "Sonstige Registerbekanntmachung",
      "state": "Bayern",
      "amtsgericht": "Amtsgericht München",
      "registernummer": "HRB 230446",
      "registerart": "HRB",
      "company_name": "DF Deutsche Finance Asset Management GmbH",
      "company_seat": "München",
      "details": "30.01.2026 (Bekanntmachungsdatum)\n\nBayern Amtsgericht München HRB 230446\nSonstige Registerbekanntmachung 29.01.2026 (Eintragungsdatum)\n\nDF Deutsche Finance Asset Management GmbH\nGesellschaft mit beschränkter Haftung\nMünchen\n\nDen Gläubigern der Gesellschaft, deren Forderungen begründet worden sind, bevor die Eintragung der Beendigung des Gewinnabführungsvertrages in das Handelsregister nach § 10 des Handelsgesetzbuches als bekanntgemacht gilt, hat der andere Vertragsteil Sicherheit zu leisten, wenn sie sich binnen sechs Monaten nach der Bekanntmachung der Eintragung zu diesem Zweck bei ihm melden."
    },
    {
      "date": "2026-01-30",
      "id": "143901",
      "original_text": "Registerbekanntmachung nach dem Umwandlungsgesetz\nBayern Amtsgericht Traunstein HRB 21991\nKoProjektA GmbH – Bruckmühl",
      "type": "Registerbekanntmachung nach dem Umwandlungsgesetz",
      "state": "Bayern",
      "amtsgericht": "Amtsgericht Traunstein",
      "registernummer": "HRB 21991",
      "registerart": "HRB",
      "company_name": "KoProjektA GmbH",
      "company_seat": "Bruckmühl",
      "details": "30.01.2026 (Bekanntmachungsdatum)\n\nBayern Amtsgericht Traunstein HRB 21991\nRegisterbekanntmachung nach dem Umwandlungsgesetz 29.01.2026 (Eintragungsdatum)\n\nKoProjektA GmbH\nGesellschaft mit beschränkter Haftung\nBruckmühl\n\nDen Gläubigern der an der Verschmelzung beteiligten Rechtsträger ist, wenn sie binnen sechs Monaten nach dem Tag, an dem die Eintragung der Verschmelzung in das Register des Sitzes desjenigen Rechtsträgers, dessen Gläubiger sie sind, nach § 19 Abs. 3 UmwG als bekannt gemacht gilt, ihren Anspruch nach Grund und Höhe in Textform anmelden, Sicherheit zu leisten, soweit sie nicht Befriedigung verlangen können. Dieses Recht steht den Gläubigern jedoch nur zu, wenn sie glaubhaft machen, dass durch die Verschmelzung die Erfüllung ihrer Forderung gefährdet wird."
    },
    {
      "date": "2026-01-30",
      "id": "143902",
      "original_text": "Sonstige Registerbekanntmachung\nBayern Amtsgericht München HRB 100018\nStiftung Haus der Kunst München, gemeinnützige Betriebsgesellschaft mbH – München",
      "type": "Sonstige Registerbekanntmachung",
      "state": "Bayern",
      "amtsgericht": "Amtsgericht München",
      "registernummer": "HRB 100018",
      "registerart": "HRB",
      "company_name": "Stiftung Haus der Kunst München, gemeinnützige Betriebsgesellschaft mbH",
      "company_seat": "München",
      "details": "30.01.2026 (Bekanntmachungsdatum)\n\nBayern Amtsgericht München HRB 100018\nSonstige Registerbekanntmachung 29.01.2026 (Eintragungsdatum)\n\nStiftung Haus der Kunst München, gemeinnützige Betriebsgesellschaft mbH\nGesellschaft mit beschränkter Haftung\nMünchen\n\nDem #Re.Name ist eine Liste der Mitglieder des Aufsichtsrats eingereicht worden, § 52 Abs. 3 S. 2 GmbHG."
    },
    {
      "date": "2026-01-30",
      "id": "143903",
      "original_text": "Sonstige Registerbekanntmachung\nBayern Amtsgericht Schweinfurt HRB 1670\nRHÖN-KLINIKUM Aktiengesellschaft – Bad Neustadt a.d.Saale",
      "type": "Sonstige Registerbekanntmachung",
      "state": "Bayern",
      "amtsgericht": "Amtsgericht Schweinfurt",
      "registernummer": "HRB 1670",
      "registerart": "HRB",
      "company_name": "RHÖN-KLINIKUM Aktiengesellschaft",
      "company_seat": "Bad Neustadt a.d.Saale",
      "details": "30.01.2026 (Bekanntmachungsdatum)\n\nBayern Amtsgericht Schweinfurt HRB 1670\nSonstige Registerbekanntmachung 29.01.2026 (Eintragungsdatum)\n\nRHÖN-KLINIKUM Aktiengesellschaft\nAktiengesellschaft\nBad Neustadt a.d.Saale\n\nDem Amtsgericht Schweinfurt -Registergericht- ist eine Liste der Mitglieder des Aufsichtsrats eingereicht worden, § 106 AktG."
    },
    {
      "date": "2026-01-30",
      "id": "143904",
      "original_text": "Löschungsankündigung\nBayern Amtsgericht Nürnberg HRB 21505\nMA AUTOMOBILE LTD Zweigniederlassung Deutschland – Nürnberg",
      "type": "Löschungsankündigung",
      "state": "Bayern",
      "amtsgericht": "Amtsgericht Nürnberg",
      "registernummer": "HRB 21505",
      "registerart": "HRB",
      "company_name": "MA AUTOMOBILE LTD Zweigniederlassung Deutschland",
      "company_seat": "Nürnberg",
      "details": "30.01.2026 (Bekanntmachungsdatum)\n\nBayern Amtsgericht Nürnberg HRB 21505\nLöschungsankündigung\n\nMA AUTOMOBILE LTD Zweigniederlassung Deutschland\nRechtsform ausländischen Rechts HRB\nNürnberg\n\nDas Registergericht beabsichtigt, die im Handelsregister eingetragene Gesellschaft wegen Vermögenslosigkeit von Amts wegen nach § 394 FamFG zu löschen. Die Frist zur Erhebung eines Widerspruchs ist auf einen Monat festgesetzt."
    },
    {
      "date": "2026-01-30",
      "id": "143905",
      "original_text": "Registerbekanntmachung nach dem Umwandlungsgesetz\nBayern Amtsgericht Landshut HRB 10517\nBavastar GmbH – Landshut",
      "type": "Registerbekanntmachung nach dem Umwandlungsgesetz",
      "state": "Bayern",
      "amtsgericht": "Amtsgericht Landshut",
      "registernummer": "HRB 10517",
      "registerart": "HRB",
      "company_name": "Bavastar GmbH",
      "company_seat": "Landshut",
      "details": "30.01.2026 (Bekanntmachungsdatum)\n\nBayern Amtsgericht Landshut HRB 10517\nRegisterbekanntmachung nach dem Umwandlungsgesetz 29.01.2026 (Eintragungsdatum)\n\nBavastar GmbH\nGesellschaft mit beschränkter Haftung\nLandshut\n\nDen Gläubigern der an der Verschmelzung beteiligten Rechtsträger ist, wenn sie binnen sechs Monaten nach dem Tag, an dem die Eintragung der Verschmelzung in das Register des Sitzes desjenigen Rechtsträgers, dessen Gläubiger sie sind, nach § 19 Abs. 3 UmwG als bekannt gemacht gilt, ihren Anspruch nach Grund und Höhe in Textform anmelden, Sicherheit zu leisten, soweit sie nicht Befriedigung verlangen können. Dieses Recht steht den Gläubigern jedoch nur zu, wenn sie glaubhaft machen, dass durch die Verschmelzung die Erfüllung ihrer Forderung gefährdet wird."
    },
    {
      "date": "2026-01-30",
      "id": "143906",
      "original_text": "Löschungsankündigung\nBayern Amtsgericht München HRB 192936\nSolarinvest Hellas 1 UG (haftungsbeschränkt) – München",
      "type": "Löschungsankündigung",
      "state": "Bayern",
      "amtsgericht": "Amtsgericht München",
      "registernummer": "HRB 192936",
      "registerart": "HRB",
      "company_name": "Solarinvest Hellas 1 UG (haftungsbeschränkt)",
      "company_seat": "München",
      "details": "30.01.2026 (Bekanntmachungsdatum)\n\nBayern Amtsgericht München HRB 192936\nLöschungsankündigung 27.01.2026 (Eintragungsdatum)\n\nSolarinvest Hellas 1 UG (haftungsbeschränkt)\nGesellschaft mit beschränkter Haftung\nMünchen\n\nDas Registergericht beabsichtigt, die im Handelsregister eingetragene Gesellschaft wegen Vermögenslosigkeit von Amts wegen nach § 394 FamFG zu löschen. Die Frist zur Erhebung eines Widerspruchs ist auf drei Monate festgesetzt."
    },
    {
      "date": "2026-01-30",
      "id": "143907",
      "original_text": "Löschungsankündigung\nBayern Amtsgericht München HRB 224982\nRenovaris GmbH – München",
      "type": "Löschungsankündigung",
      "state": "Bayern",
      "amtsgericht": "Amtsgericht München",
      "registernummer": "HRB 224982",
      "registerart": "HRB",
      "company_name": "Renovaris GmbH",
      "company_seat": "München",
      "details": "30.01.2026 (Bekanntmachungsdatum)\n\nBayern Amtsgericht München HRB 224982\nLöschungsankündigung 29.01.2026 (Eintragungsdatum)\n\nRenovaris GmbH\nGesellschaft mit beschränkter Haftung\nMünchen\n\nDas Registergericht beabsichtigt, die im Handelsregister eingetragene Gesellschaft wegen Vermögenslosigkeit von Amts wegen nach § 394 FamFG zu löschen. Die Frist zur Erhebung eines Widerspruchs ist auf drei Monate festgesetzt."
    },
    {
      "date": "2026-01-30",
      "id": "143908",
      "original_text": "Einreichung neuer Dokumente\nBayern Amtsgericht Traunstein HRB 15590\nEBG - Eigentümer Betriebsgesellschaft Gästehaus Inzell GmbH – Inzell",
      "type": "Einreichung neuer Dokumente",
      "state": "Bayern",
      "amtsgericht": "Amtsgericht Traunstein",
      "registernummer": "HRB 15590",
      "registerart": "HRB",
      "company_name": "EBG - Eigentümer Betriebsgesellschaft Gästehaus Inzell GmbH",
      "company_seat": "Inzell",
      "details": "30.01.2026 (Bekanntmachungsdatum)\n\nBayern Amtsgericht Traunstein HRB 15590\nEinreichung neuer Dokumente\n\nEBG - Eigentümer Betriebsgesellschaft Gästehaus Inzell GmbH\nGesellschaft mit beschränkter Haftung\nInzell\n\nDem Amtsgericht Traunstein -Registergericht- ist eine Liste der Mitglieder des Aufsichtsrats eingereicht worden, § 52 Abs. 3 S. 2 GmbHG."
    },
    {
      "date": "2026-01-30",
      "id": "143909",
      "original_text": "Registerbekanntmachung nach dem Umwandlungsgesetz\nBayern Amtsgericht Regensburg GsR 382\nPhysio-Team Lappersdorf eGbR – Lappersdorf",
      "type": "Registerbekanntmachung nach dem Umwandlungsgesetz",
      "state": "Bayern",
      "amtsgericht": "Amtsgericht Regensburg",
      "registernummer": "GsR 382",
      "registerart": "GsR",
      "company_name": "Physio-Team Lappersdorf eGbR",
      "company_seat": "Lappersdorf",
      "details": "30.01.2026 (Bekanntmachungsdatum)\n\nBayern Amtsgericht Regensburg GsR 382\nRegisterbekanntmachung nach dem Umwandlungsgesetz 29.01.2026 (Eintragungsdatum)\n\nPhysio-Team Lappersdorf eGbR\nGesellschaft bürgerlichen Rechts\nLappersdorf\n\nDen Gläubigern des formwechselnden Rechtsträgers ist, wenn sie binnen sechs Monaten nach dem Tag, an dem die Eintragung des Formwechsels nach § 201 UmwG als bekannt gemacht gilt, ihren Anspruch nach Grund und Höhe in Textform anmelden, Sicherheit zu leisten, soweit sie nicht Befriedigung verlangen können. Dieses Recht steht den Gläubigern jedoch nur zu, wenn sie glaubhaft machen, dass durch den Formwechsel die Erfüllung ihrer Forderung gefährdet wird."
    },
    {
      "date": "2026-01-30",
      "id": "143910",
      "original_text": "Registerbekanntmachung nach dem Umwandlungsgesetz\nBayern Amtsgericht München HRA 121932\nHundepension Kufner-Palm e.K. – Oberhaching",
      "type": "Registerbekanntmachung nach dem Umwandlungsgesetz",
      "state": "Bayern",
      "amtsgericht": "Amtsgericht München",
      "registernummer": "HRA 121932",
      "registerart": "HRA",
      "company_name": "Hundepension Kufner-Palm e.K.",
      "company_seat": "Oberhaching",
      "details": "30.01.2026 (Bekanntmachungsdatum)\n\nBayern Amtsgericht München HRA 121932\nRegisterbekanntmachung nach dem Umwandlungsgesetz 29.01.2026 (Eintragungsdatum)\n\nHundepension Kufner-Palm e.K.\nEinzelkaufmann / Einzelkauffrau\nOberhaching\n\nDen Gläubigern der an der Ausgliederung beteiligten Rechtsträger ist, wenn sie binnen sechs Monaten nach dem Tag, an dem die Eintragung der Ausgliederung in das Register des Sitzes desjenigen Rechtsträgers, dessen Gläubiger sie sind, nach §§ 125, 19 Abs. 3 UmwG als bekannt gemacht gilt, ihren Anspruch nach Grund und Höhe in Textform anmelden, Sicherheit zu leisten, soweit sie nicht Befriedigung verlangen können. Dieses Recht steht den Gläubigern jedoch nur zu, wenn sie glaubhaft machen, dass durch die Ausgliederung die Erfüllung ihrer Forderung gefährdet wird."
    },
    {
      "date": "2026-01-30",
      "id": "143911",
      "original_text": "Einreichung neuer Dokumente\nBayern Amtsgericht Bayreuth HRB 2818\nStadtwerke Bayreuth Holding GmbH – Bayreuth",
      "type": "Einreichung neuer Dokumente",
      "state": "Bayern",
      "amtsgericht": "Amtsgericht Bayreuth",
      "registernummer": "HRB 2818",
      "registerart": "HRB",
      "company_name": "Stadtwerke Bayreuth Holding GmbH",
      "company_seat": "Bayreuth",
      "details": "30.01.2026 (Bekanntmachungsdatum)\n\nBayern Amtsgericht Bayreuth HRB 2818\nEinreichung neuer Dokumente\n\nStadtwerke Bayreuth Holding GmbH\nGesellschaft mit beschränkter Haftung\nBayreuth\n\nDem Amtsgericht Bayreuth -Registergericht- ist eine Liste der Mitglieder des Aufsichtsrats eingereicht worden, § 52 Abs. 3 S. 2 GmbHG."
    },
    {
      "date": "2026-01-30",
      "id": "143912",
      "original_text": "Einreichung neuer Dokumente\nBayern Amtsgericht Memmingen HRB 14773\nBerufsfachschule für Musik Krumbach gemeinnützige Schulträger GmbH – Krumbach",
      "type": "Einreichung neuer Dokumente",
      "state": "Bayern",
      "amtsgericht": "Amtsgericht Memmingen",
      "registernummer": "HRB 14773",
      "registerart": "HRB",
      "company_name": "Berufsfachschule für Musik Krumbach gemeinnützige Schulträger GmbH",
      "company_seat": "Krumbach",
      "details": "30.01.2026 (Bekanntmachungsdatum)\n\nBayern Amtsgericht Memmingen HRB 14773\nEinreichung neuer Dokumente\n\nBerufsfachschule für Musik Krumbach gemeinnützige Schulträger GmbH\nGesellschaft mit beschränkter Haftung\nKrumbach\n\nDem Amtsgeriicht Memmingen -Registergericht- ist eine Liste der Mitglieder des Aufsichtsrats eingereicht worden, § 52 Abs. 3 S. 2 GmbHG."
    },
    {
      "date": "2026-01-30",
      "id": "143913",
      "original_text": "Registerbekanntmachung nach dem Umwandlungsgesetz\nBayern Amtsgericht München HRB 191573\nVTC Beteiligungen GmbH – Grünwald",
      "type": "Registerbekanntmachung nach dem Umwandlungsgesetz",
      "state": "Bayern",
      "amtsgericht": "Amtsgericht München",
      "registernummer": "HRB 191573",
      "registerart": "HRB",
      "company_name": "VTC Beteiligungen GmbH",
      "company_seat": "Grünwald",
      "details": "30.01.2026 (Bekanntmachungsdatum)\n\nBayern Amtsgericht München HRB 191573\nRegisterbekanntmachung nach dem Umwandlungsgesetz 29.01.2026 (Eintragungsdatum)\n\nVTC Beteiligungen GmbH\nGesellschaft mit beschränkter Haftung\nGrünwald\n\nDen Gläubigern der an der Verschmelzung beteiligten Rechtsträger ist, wenn sie binnen sechs Monaten nach dem Tag, an dem die Eintragung der Verschmelzung in das Register des Sitzes desjenigen Rechtsträgers, dessen Gläubiger sie sind, nach § 19 Abs. 3 UmwG als bekannt gemacht gilt, ihren Anspruch nach Grund und Höhe in Textform anmelden, Sicherheit zu leisten, soweit sie nicht Befriedigung verlangen können. Dieses Recht steht den Gläubigern jedoch nur zu, wenn sie glaubhaft machen, dass durch die Verschmelzung die Erfüllung ihrer Forderung gefährdet wird."
    },
    {
      "date": "2026-01-30",
      "id": "143914",
      "original_text": "Registerbekanntmachung nach dem Umwandlungsgesetz\nBayern Amtsgericht Traunstein GnR 341\nSchlierf.IT eG – Inzell",
      "type": "Registerbekanntmachung nach dem Umwandlungsgesetz",
      "state": "Bayern",
      "amtsgericht": "Amtsgericht Traunstein",
      "registernummer": "GnR 341",
      "registerart": "GnR",
      "company_name": "Schlierf.IT eG",
      "company_seat": "Inzell",
      "details": "30.01.2026 (Bekanntmachungsdatum)\n\nBayern Amtsgericht Traunstein GnR 341\nRegisterbekanntmachung nach dem Umwandlungsgesetz 29.01.2026 (Eintragungsdatum)\n\nSchlierf.IT eG\neingetragene Genossenschaft\nInzell\n\nDen Gläubigern des formwechselnden Rechtsträgers ist, wenn sie binnen sechs Monaten nach dem Tag, an dem die Eintragung des Formwechsels nach § 201 UmwG als bekannt gemacht gilt, ihren Anspruch nach Grund und Höhe in Textform anmelden, Sicherheit zu leisten, soweit sie nicht Befriedigung verlangen können. Dieses Recht steht den Gläubigern jedoch nur zu, wenn sie glaubhaft machen, dass durch den Formwechsel die Erfüllung ihrer Forderung gefährdet wird."
    },
    {
      "date": "2026-01-30",
      "id": "143915",
      "original_text": "Löschungsankündigung\nBayern Amtsgericht München HRB 155052\nBraintribe Software Technologies GmbH – München",
      "type": "Löschungsankündigung",
      "state": "Bayern",
      "amtsgericht": "Amtsgericht München",
      "registernummer": "HRB 155052",
      "registerart": "HRB",
      "company_name": "Braintribe Software Technologies GmbH",
      "company_seat": "München",
      "details": "30.01.2026 (Bekanntmachungsdatum)\n\nBayern Amtsgericht München HRB 155052\nLöschungsankündigung\n\nBraintribe Software Technologies GmbH\nGesellschaft mit beschränkter Haftung\nMünchen\n\nDas Registergericht beabsichtigt, die im Handelsregister eingetragene Gesellschaft wegen Vermögenslosigkeit von Amts wegen nach § 394 FamFG zu löschen. Die Frist zur Erhebung eines Widerspruchs ist auf einen Monat festgesetzt."
    },
    {
      "date": "2026-01-30",
      "id": "143916",
      "original_text": "Registerbekanntmachung nach dem Umwandlungsgesetz\nBayern Amtsgericht Kempten (Allgäu) HRB 18715\nHiedl GmbH – Altusried",
      "type": "Registerbekanntmachung nach dem Umwandlungsgesetz",
      "state": "Bayern",
      "amtsgericht": "Amtsgericht Kempten (Allgäu)",
      "registernummer": "HRB 18715",
      "registerart": "HRB",
      "company_name": "Hiedl GmbH",
      "company_seat": "Altusried",
      "details": "30.01.2026 (Bekanntmachungsdatum)\n\nBayern Amtsgericht Kempten (Allgäu) HRB 18715\nRegisterbekanntmachung nach dem Umwandlungsgesetz 29.01.2026 (Eintragungsdatum)\n\nHiedl GmbH\nGesellschaft mit beschränkter Haftung\nAltusried\n\nDen Gläubigern des formwechselnden Rechtsträgers ist, wenn sie binnen sechs Monaten nach dem Tag, an dem die Eintragung des Formwechsels nach § 201 UmwG als bekannt gemacht gilt, ihren Anspruch nach Grund und Höhe in Textform anmelden, Sicherheit zu leisten, soweit sie nicht Befriedigung verlangen können. Dieses Recht steht den Gläubigern jedoch nur zu, wenn sie glaubhaft machen, dass durch den Formwechsel die Erfüllung ihrer Forderung gefährdet wird."
    },
    {
      "date": "2026-01-30",
      "id": "143917",
      "original_text": "Registerbekanntmachung nach dem Umwandlungsgesetz\nBayern Amtsgericht Traunstein HRB 28429\nSchlierf.IT GmbH – Inzell",
      "type": "Registerbekanntmachung nach dem Umwandlungsgesetz",
      "state": "Bayern",
      "amtsgericht": "Amtsgericht Traunstein",
      "registernummer": "HRB 28429",
      "registerart": "HRB",
      "company_name": "Schlierf.IT GmbH",
      "company_seat": "Inzell",
      "details": "30.01.2026 (Bekanntmachungsdatum)\n\nBayern Amtsgericht Traunstein HRB 28429\nRegisterbekanntmachung nach dem Umwandlungsgesetz 29.01.2026 (Eintragungsdatum)\n\nSchlierf.IT GmbH\nGesellschaft mit beschränkter Haftung\nInzell\n\nDen Gläubigern des formwechselnden Rechtsträgers ist, wenn sie binnen sechs Monaten nach dem Tag, an dem die Eintragung des Formwechsels nach § 201 UmwG als bekannt gemacht gilt, ihren Anspruch nach Grund und Höhe in Textform anmelden, Sicherheit zu leisten, soweit sie nicht Befriedigung verlangen können. Dieses Recht steht den Gläubigern jedoch nur zu, wenn sie glaubhaft machen, dass durch den Formwechsel die Erfüllung ihrer Forderung gefährdet wird."
    },
    {
      "date": "2026-01-30",
      "id": "143918",
      "original_text": "Löschungsankündigung\nBayern Amtsgericht Augsburg HRB 29167\nARMA GmbH – Augsburg",
      "type": "Löschungsankündigung",
      "state": "Bayern",
      "amtsgericht": "Amtsgericht Augsburg",
      "registernummer": "HRB 29167",
      "registerart": "HRB",
      "company_name": "ARMA GmbH",
      "company_seat": "Augsburg",
      "details": "30.01.2026 (Bekanntmachungsdatum)\n\nBayern Amtsgericht Augsburg HRB 29167\nLöschungsankündigung\n\nARMA GmbH\nGesellschaft mit beschränkter Haftung\nAugsburg\n\nDas Registergericht beabsichtigt, die im Handelsregister eingetragene Gesellschaft wegen Vermögenslosigkeit von Amts wegen nach § 394 FamFG zu löschen. Die Frist zur Erhebung eines Widerspruchs ist auf einen Monat festgesetzt."
    },
    {
      "date": "2026-01-30",
      "id": "143919",
      "original_text": "Registerbekanntmachung nach dem Umwandlungsgesetz\nBayern Amtsgericht Kempten (Allgäu) HRA 4178\nHiedl GmbH & Co. KG – Altusried",
      "type": "Registerbekanntmachung nach dem Umwandlungsgesetz",
      "state": "Bayern",
      "amtsgericht": "Amtsgericht Kempten (Allgäu)",
      "registernummer": "HRA 4178",
      "registerart": "HRA",
      "company_name": "Hiedl GmbH & Co. KG",
      "company_seat": "Altusried",
      "details": "30.01.2026 (Bekanntmachungsdatum)\n\nBayern Amtsgericht Kempten (Allgäu) HRA 4178\nRegisterbekanntmachung nach dem Umwandlungsgesetz 29.01.2026 (Eintragungsdatum)\n\nHiedl GmbH & Co. KG\nKommanditgesellschaft\nAltusried\n\nDen Gläubigern des formwechselnden Rechtsträgers ist, wenn sie binnen sechs Monaten nach dem Tag, an dem die Eintragung des Formwechsels nach § 201 UmwG als bekannt gemacht gilt, ihren Anspruch nach Grund und Höhe in Textform anmelden, Sicherheit zu leisten, soweit sie nicht Befriedigung verlangen können. Dieses Recht steht den Gläubigern jedoch nur zu, wenn sie glaubhaft machen, dass durch den Formwechsel die Erfüllung ihrer Forderung gefährdet wird."
    },
    {
      "date": "2026-01-30",
      "id": "143920",
      "original_text": "Einreichung neuer Dokumente\nBayern Amtsgericht Bayreuth HRB 5726\nDC Nordseekabel Beteiligungs GmbH – Bayreuth",
      "type": "Einreichung neuer Dokumente",
      "state": "Bayern",
      "amtsgericht": "Amtsgericht Bayreuth",
      "registernummer": "HRB 5726",
      "registerart": "HRB",
      "company_name": "DC Nordseekabel Beteiligungs GmbH",
      "company_seat": "Bayreuth",
      "details": "30.01.2026 (Bekanntmachungsdatum)\n\nBayern Amtsgericht Bayreuth HRB 5726\nEinreichung neuer Dokumente\n\nDC Nordseekabel Beteiligungs GmbH\nGesellschaft mit beschränkter Haftung\nBayreuth\n\nDem Amtsgericht Bayreuth -Registergericht- ist eine Liste der Mitglieder des Beirats eingereicht worden, § 52 Abs. 3 S. 2 GmbHG."
    },
    {
      "date": "2026-01-30",
      "id": "143921",
      "original_text": "Löschungsankündigung\nBayern Amtsgericht Nürnberg HRB 4303\n\"Auto-Switalla GmbH\" – Neumarkt i.d. OPf. (Stadtteil Labersricht)",
      "type": "Löschungsankündigung",
      "state": "Bayern",
      "amtsgericht": "Amtsgericht Nürnberg",
      "registernummer": "HRB 4303",
      "registerart": "HRB",
      "company_name": "\"Auto-Switalla GmbH\"",
      "company_seat": "Neumarkt i.d. OPf. (Stadtteil Labersricht)",
      "details": "30.01.2026 (Bekanntmachungsdatum)\n\nBayern Amtsgericht Nürnberg HRB 4303\nLöschungsankündigung\n\n\"Auto-Switalla GmbH\"\nGesellschaft mit beschränkter Haftung\nNeumarkt i.d. OPf. (Stadtteil Labersricht)\n\nDas Registergericht beabsichtigt, die im Handelsregister eingetragene Gesellschaft wegen Vermögenslosigkeit von Amts wegen nach § 394 FamFG zu löschen. Die Frist zur Erhebung eines Widerspruchs ist auf einen Monat festgesetzt."
    },
    {
      "date": "2026-01-30",
      "id": "143922",
      "original_text": "Registerbekanntmachung nach dem Umwandlungsgesetz\nBayern Amtsgericht München HRB 267337\nindevis IT-Security Beteiligungs GmbH – München",
      "type": "Registerbekanntmachung nach dem Umwandlungsgesetz",
      "state": "Bayern",
      "amtsgericht": "Amtsgericht München",
      "registernummer": "HRB 267337",
      "registerart": "HRB",
      "company_name": "indevis IT-Security Beteiligungs GmbH",
      "company_seat": "München",
      "details": "30.01.2026 (Bekanntmachungsdatum)\n\nBayern Amtsgericht München HRB 267337\nRegisterbekanntmachung nach dem Umwandlungsgesetz 29.01.2026 (Eintragungsdatum)\n\nindevis IT-Security Beteiligungs GmbH\nGesellschaft mit beschränkter Haftung\nMünchen\n\nDen Gläubigern der an der Verschmelzung beteiligten Rechtsträger ist, wenn sie binnen sechs Monaten nach dem Tag, an dem die Eintragung der Verschmelzung in das Register des Sitzes desjenigen Rechtsträgers, dessen Gläubiger sie sind, nach § 19 Abs. 3 UmwG als bekannt gemacht gilt, ihren Anspruch nach Grund und Höhe in Textform anmelden, Sicherheit zu leisten, soweit sie nicht Befriedigung verlangen können. Dieses Recht steht den Gläubigern jedoch nur zu, wenn sie glaubhaft machen, dass durch die Verschmelzung die Erfüllung ihrer Forderung gefährdet wird."
    },
    {
      "date": "2026-01-30",
      "id": "143923",
      "original_text": "Einreichung neuer Dokumente\nBayern Amtsgericht München HRB 256407\nLinde GmbH – Pullach i.Isartal",
      "type": "Einreichung neuer Dokumente",
      "state": "Bayern",
      "amtsgericht": "Amtsgericht München",
      "registernummer": "HRB 256407",
      "registerart": "HRB",
      "company_name": "Linde GmbH",
      "company_seat": "Pullach i.Isartal",
      "details": "30.01.2026 (Bekanntmachungsdatum)\n\nBayern Amtsgericht München HRB 256407\nEinreichung neuer Dokumente\n\nLinde GmbH\nGesellschaft mit beschränkter Haftung\nPullach i.Isartal\n\nDem Amtsgericht München -Registergericht- ist eine Liste der Mitglieder des Aufsichtsrats eingereicht worden, § 52 Abs. 3 S. 2 GmbHG."
    },
    {
      "date": "2026-01-30",
      "id": "143924",
      "original_text": "Sonstige Registerbekanntmachung\nMecklenburg-Vorpommern Amtsgericht Rostock HRB 14834\nLandesforst MV - Waldservice und Energie Gesellschaft mit beschränkter Haftung – Mühl Rosin",
      "type": "Sonstige Registerbekanntmachung",
      "state": "Mecklenburg-Vorpommern",
      "amtsgericht": "Amtsgericht Rostock",
      "registernummer": "HRB 14834",
      "registerart": "HRB",
      "company_name": "Landesforst MV - Waldservice und Energie Gesellschaft mit beschränkter Haftung",
      "company_seat": "Mühl Rosin",
      "details": "30.01.2026 (Bekanntmachungsdatum)\n\nMecklenburg-Vorpommern Amtsgericht Rostock HRB 14834\nSonstige Registerbekanntmachung\n\nLandesforst MV - Waldservice und Energie Gesellschaft mit beschränkter Haftung\nGesellschaft mit beschränkter Haftung\nMühl Rosin\n\nEine Liste der Mitglieder des Aufsichtsrats ist zum Handelsregister eingereicht worden."
    },
    {
      "date": "2026-01-30",
      "id": "143925",
      "original_text": "Einreichung neuer Dokumente\nBerlin Amtsgericht Berlin (Charlottenburg) HRB 107541\nGermany Trade and Invest - Gesellschaft für Außenwirtschaft und Standortmarketing mbH – Berlin",
      "type": "Einreichung neuer Dokumente",
      "state": "Berlin",
      "amtsgericht": "Amtsgericht Berlin (Charlottenburg)",
      "registernummer": "HRB 107541",
      "registerart": "HRB",
      "company_name": "Germany Trade and Invest - Gesellschaft für Außenwirtschaft und Standortmarketing mbH",
      "company_seat": "Berlin",
      "details": "30.01.2026 (Bekanntmachungsdatum)\n\nBerlin Amtsgericht Berlin (Charlottenburg) HRB 107541\nEinreichung neuer Dokumente\n\nGermany Trade and Invest - Gesellschaft für Außenwirtschaft und Standortmarketing mbH\nGesellschaft mit beschränkter Haftung\nBerlin\n\nAls nicht eingetragen wird veröffentlicht: Es wurde eine neue Liste der Aufsichtsratsmitglieder eingereicht (§52 GmbHG)."
    },
    {
      "date": "2026-01-30",
      "id": "143926",
      "original_text": "Löschungsankündigung\nBerlin Amtsgericht Berlin (Charlottenburg) HRB 139611\nBlisse gUG (haftungsbeschränkt) – Berlin",
      "type": "Löschungsankündigung",
      "state": "Berlin",
      "amtsgericht": "Amtsgericht Berlin (Charlottenburg)",
      "registernummer": "HRB 139611",
      "registerart": "HRB",
      "company_name": "Blisse gUG (haftungsbeschränkt)",
      "company_seat": "Berlin",
      "details": "30.01.2026 (Bekanntmachungsdatum)\n\nBerlin Amtsgericht Berlin (Charlottenburg) HRB 139611\nLöschungsankündigung\n\nBlisse gUG (haftungsbeschränkt)\nGesellschaft mit beschränkter Haftung\nBerlin\n\nBei der nachstehenden Gesellschaft wird das Amtslöschungsverfahren gemäß § 394 FamFG eingeleitet. Widerspruchsfrist 6 Wochen"
    },
    {
      "date": "2026-01-30",
      "id": "143927",
      "original_text": "Registerbekanntmachung nach dem Umwandlungsgesetz\nBerlin Amtsgericht Berlin (Charlottenburg) HRB 271733\nRaisin SE – Berlin",
      "type": "Registerbekanntmachung nach dem Umwandlungsgesetz",
      "state": "Berlin",
      "amtsgericht": "Amtsgericht Berlin (Charlottenburg)",
      "registernummer": "HRB 271733",
      "registerart": "HRB",
      "company_name": "Raisin SE",
      "company_seat": "Berlin",
      "details": "30.01.2026 (Bekanntmachungsdatum)\n\nBerlin Amtsgericht Berlin (Charlottenburg) HRB 271733\nRegisterbekanntmachung nach dem Umwandlungsgesetz 28.01.2026 (Eintragungsdatum)\n\nRaisin SE\nEuropäische Aktiengesellschaft (SE)\nBerlin\n\nZu Eintragungsnummer 4 vom 28.01.2026 wird als nicht eingetragen veröffentlicht: Den Gläubigern der an der Verschmelzung beteiligten Rechtsträger ist, wenn sie binnen sechs Monaten nach dem Tag, an dem die Eintragung der Verschmelzung in das Register des Sitzes desjenigen Rechtsträgers, dessen Gläubiger sie sind, als bekannt gemacht gilt, ihren Anspruch nach Grund und Höhe schriftlich anmelden, Sicherheit zu leisten, soweit sie nicht Befriedigung verlangen können. Dieses Recht steht den Gläubigern jedoch nur zu, wenn sie glaubhaft machen, dass durch die Verschmelzung die Erfüllung ihrer Forderung gefährdet wird. Das Recht, Sicherheitsleistung zu verlangen, steht Gläubigern nicht zu, die im Falle der Insolvenz ein Recht auf vorzugsweise Befriedigung aus einer Deckungsmasse haben, die nach gesetzlicher Vorschrift zu ihrem Schutz errichtet und staatlich überwacht ist."
    },
    {
      "date": "2026-01-30",
      "id": "143928",
      "original_text": "Löschungsankündigung\nBerlin Amtsgericht Berlin (Charlottenburg) HRB 235056\nCity Lane GmbH – Berlin",
      "type": "Löschungsankündigung",
      "state": "Berlin",
      "amtsgericht": "Amtsgericht Berlin (Charlottenburg)",
      "registernummer": "HRB 235056",
      "registerart": "HRB",
      "company_name": "City Lane GmbH",
      "company_seat": "Berlin",
      "details": "30.01.2026 (Bekanntmachungsdatum)\n\nBerlin Amtsgericht Berlin (Charlottenburg) HRB 235056\nLöschungsankündigung\n\nCity Lane GmbH\nGesellschaft mit beschränkter Haftung\nBerlin\n\nBei der nachstehenden Gesellschaft wird das Amtslöschungsverfahren gemäß § 394 FamFG eingeleitet. Widerspruchsfrist 6 Wochen"
    },
    {
      "date": "2026-01-30",
      "id": "143929",
      "original_text": "Löschungsankündigung\nBrandenburg Amtsgericht Frankfurt/Oder HRB 20040\nKSEE Transporte GmbH – Vierlinden",
      "type": "Löschungsankündigung",
      "state": "Brandenburg",
      "amtsgericht": "Amtsgericht Frankfurt/Oder",
      "registernummer": "HRB 20040",
      "registerart": "HRB",
      "company_name": "KSEE Transporte GmbH",
      "company_seat": "Vierlinden",
      "details": "30.01.2026 (Bekanntmachungsdatum)\n\nBrandenburg Amtsgericht Frankfurt/Oder HRB 20040\nLöschungsankündigung\n\nKSEE Transporte GmbH\nGesellschaft mit beschränkter Haftung\nVierlinden\n\nBei der nachstehenden Gesellschaft wird das Amtslöschungsverfahren gemäß § 394 FamFG eingeleitet."
    },
    {
      "date": "2026-01-30",
      "id": "143930",
      "original_text": "Einreichung neuer Dokumente\nBrandenburg Amtsgericht Neuruppin HRB 2141\n\"Stadtwerke Prenzlau GmbH\" – Prenzlau",
      "type": "Einreichung neuer Dokumente",
      "state": "Brandenburg",
      "amtsgericht": "Amtsgericht Neuruppin",
      "registernummer": "HRB 2141",
      "registerart": "HRB",
      "company_name": "\"Stadtwerke Prenzlau GmbH\"",
      "company_seat": "Prenzlau",
      "details": "30.01.2026 (Bekanntmachungsdatum)\n\nBrandenburg Amtsgericht Neuruppin HRB 2141\nEinreichung neuer Dokumente\n\n\"Stadtwerke Prenzlau GmbH\"\nGesellschaft mit beschränkter Haftung\nPrenzlau\n\nAls nicht eingetragen wird veröffentlicht: Eine Liste der Mitglieder des Aufsichtsrates wurde zum Handelsregister eingereicht."
    },
    {
      "date": "2026-01-30",
      "id": "143931",
      "original_text": "Löschungsankündigung\nSchleswig-Holstein Amtsgericht Lübeck HRB 11442\nBaftijari Bau GmbH – Glinde",
      "type": "Löschungsankündigung",
      "state": "Schleswig-Holstein",
      "amtsgericht": "Amtsgericht Lübeck",
      "registernummer": "HRB 11442",
      "registerart": "HRB",
      "company_name": "Baftijari Bau GmbH",
      "company_seat": "Glinde",
      "details": "30.01.2026 (Bekanntmachungsdatum)\n\nSchleswig-Holstein Amtsgericht Lübeck HRB 11442\nLöschungsankündigung\n\nBaftijari Bau GmbH\nGesellschaft mit beschränkter Haftung\nGlinde\n\nAn den Geschäftsführer, Herrn, Josip Culjak\n- per Veröffentlichung -\n\nSehr geehrter Herr Culjak,\n\nin der Handelsregistersache der\nBaftijari Bau GmbH\n\nergeben sich aus den mir vorliegenden Unterlagen Anhaltspunkte dafür, dass die Gesellschaft, als deren Geschäftsführer Sie noch eingetragen sind, vermögenslos ist:\n\nLöschungsantrag des Finanzamts Stormarn vom 10.10.2025\n\nIch beabsichtige daher, die Gesellschaft wegen Vermögenslosigkeit gemäß § 394 FamFG zu löschen.\n\nIch bestimme eine Frist von einem Monat zur Geltendmachung eines Widerspruchs gegen die Löschung, § 394 Abs. 2 S. 1 FamFG.\n\nWeiter bitte ich Sie, mir binnen derselben Frist mitzuteilen, ob die genannte Gesellschaft noch Vermögen hat, ggf. welche Vermögensgegenstände sie besitzt, ob die Gesellschaft noch Partei eines noch nicht rechtskräftig abgeschlossenen Rechtsstreits ist oder ob sonst noch eine Abwicklung stattfindet.\n\nNach Fristablauf ohne Widerspruch von Ihnen oder anderer Seite wird die Gesellschaft gelöscht.\n\nMit freundlichen Grüßen\n\nOstermann\nDipl.-Rechtspflegerin (FH)"
    },
    {
      "date": "2026-01-30",
      "id": "143932",
      "original_text": "Löschungsankündigung\nSaarland Amtsgericht Saarbrücken HRB 103854\nHP House Project UG (haftungsbeschränkt) – Merzig",
      "type": "Löschungsankündigung",
      "state": "Saarland",
      "amtsgericht": "Amtsgericht Saarbrücken",
      "registernummer": "HRB 103854",
      "registerart": "HRB",
      "company_name": "HP House Project UG (haftungsbeschränkt)",
      "company_seat": "Merzig",
      "details": "30.01.2026 (Bekanntmachungsdatum)\n\nSaarland Amtsgericht Saarbrücken HRB 103854\nLöschungsankündigung\n\nHP House Project UG (haftungsbeschränkt)\nGesellschaft mit beschränkter Haftung\nMerzig\n\nEs ist beabsichtigt, die Gesellschaft von Amts wegen gemäß § 394 FamFG wegen Vermögenslosigkeit zu löschen.\nGegen die Löschung von Amts wegen ist das Rechtsmittel des Widerspruchs statthaft. Der Widerspruch ist binnen einer Frist zwei Monaten beginnend mit dem Tag dieser Veröffentlichung durch Einreichen eines Widerspruchsschreibens -schriftlich oder zur Niederschrift der Geschäftsstelle beim Amtsgericht Saarbrücken, -zentrales Handelsregister-, Mainzerstr.178, 66121 Saarbrücken einzulegen.\nDer Widerspruch muss die Bezeichnung der angefochtenen Löschungsankündigung enthalten sowie die Erklärung, dass Widerspruch eingelegt wird. Er ist vom Widerspruchsführer oder seinem Bevollmächtigten zu unterzeichnen.\nDas Widerspruchsschreiben kann auch in der Form eines elektronischen Dokumentes eingereicht werden, das mit einer qualifizierten elektronischen Signatur nach dem Signaturgesetz versehen sein muss (§§ 14 Abs. 2 FamFG, 130a, 298 ZPO)."
    },
    {
      "date": "2026-01-30",
      "id": "143933",
      "original_text": "Löschungsankündigung\nBerlin Amtsgericht Berlin (Charlottenburg) HRB 162172\nMFE Dienstleistungs- und Sortiments Gewerkematerialien GmbH – Berlin",
      "type": "Löschungsankündigung",
      "state": "Berlin",
      "amtsgericht": "Amtsgericht Berlin (Charlottenburg)",
      "registernummer": "HRB 162172",
      "registerart": "HRB",
      "company_name": "MFE Dienstleistungs- und Sortiments Gewerkematerialien GmbH",
      "company_seat": "Berlin",
      "details": "30.01.2026 (Bekanntmachungsdatum)\n\nBerlin Amtsgericht Berlin (Charlottenburg) HRB 162172\nLöschungsankündigung\n\nMFE Dienstleistungs- und Sortiments Gewerkematerialien GmbH\nGesellschaft mit beschränkter Haftung\nBerlin\n\nBei der nachstehenden Gesellschaft wird das Amtslöschungsverfahren gemäß § 394 FamFG eingeleitet. Widerspruchsfrist 6 Wochen"
    },
    {
      "date": "2026-01-30",
      "id": "143934",
      "original_text": "Einreichung neuer Dokumente\nBaden-Württemberg Amtsgericht Mannheim HRB 738474\nabtis Holding AG – Pforzheim",
      "type": "Einreichung neuer Dokumente",
      "state": "Baden-Württemberg",
      "amtsgericht": "Amtsgericht Mannheim",
      "registernummer": "HRB 738474",
      "registerart": "HRB",
      "company_name": "abtis Holding AG",
      "company_seat": "Pforzheim",
      "details": "30.01.2026 (Bekanntmachungsdatum)\n\nBaden-Württemberg Amtsgericht Mannheim HRB 738474\nEinreichung neuer Dokumente\n\nabtis Holding AG\nAktiengesellschaft\nPforzheim\n\nDie Gesellschaft hat am 28.01.2026 die Liste über die Zusammensetzung des Aufsichtsrats zum Handelsregister eingereicht."
    },
    {
      "date": "2026-01-30",
      "id": "143935",
      "original_text": "Registerbekanntmachung nach dem Umwandlungsgesetz\nSchleswig-Holstein Amtsgericht Lübeck HRB 14524\nKOS Wulff Fusion GmbH – Beschendorf",
      "type": "Registerbekanntmachung nach dem Umwandlungsgesetz",
      "state": "Schleswig-Holstein",
      "amtsgericht": "Amtsgericht Lübeck",
      "registernummer": "HRB 14524",
      "registerart": "HRB",
      "company_name": "KOS Wulff Fusion GmbH",
      "company_seat": "Beschendorf",
      "details": "30.01.2026 (Bekanntmachungsdatum)\n\nSchleswig-Holstein Amtsgericht Lübeck HRB 14524\nRegisterbekanntmachung nach dem Umwandlungsgesetz 29.01.2026 (Eintragungsdatum)\n\nKOS Wulff Fusion GmbH\nGesellschaft mit beschränkter Haftung\nBeschendorf\n\nZu Eintragungsnummer 8 vom 29.01.2026 wird als nicht eingetragen veröffentlicht: Den Gläubigern der an der Verschmelzung beteiligten Rechtsträger ist, wenn sie binnen sechs Monaten nach dem Tag, an dem die Eintragung der Verschmelzung in das Register des Sitzes desjenigen Rechtsträgers, dessen Gläubiger sie sind, als bekannt gemacht gilt, ihren Anspruch nach Grund und Höhe schriftlich anmelden, Sicherheit zu leisten, soweit sie nicht Befriedigung verlangen können. Dieses Recht steht den Gläubigern jedoch nur zu, wenn sie glaubhaft machen, dass durch die Verschmelzung die Erfüllung ihrer Forderung gefährdet wird."
    },
    {
      "date": "2026-01-30",
      "id": "143936",
      "original_text": "Löschungsankündigung\nBrandenburg Amtsgericht Frankfurt/Oder HRB 9790\nBPK Biomasseverarbeitung GmbH – Biesenthal",
      "type": "Löschungsankündigung",
      "state": "Brandenburg",
      "amtsgericht": "Amtsgericht Frankfurt/Oder",
      "registernummer": "HRB 9790",
      "registerart": "HRB",
      "company_name": "BPK Biomasseverarbeitung GmbH",
      "company_seat": "Biesenthal",
      "details": "30.01.2026 (Bekanntmachungsdatum)\n\nBrandenburg Amtsgericht Frankfurt/Oder HRB 9790\nLöschungsankündigung\n\nBPK Biomasseverarbeitung GmbH\nGesellschaft mit beschränkter Haftung\nBiesenthal\n\nBei der nachstehenden Gesellschaft wird das Amtslöschungsverfahren gemäß § 394 FamFG eingeleitet."
    },
    {
      "date": "2026-01-30",
      "id": "143937",
      "original_text": "Sonstige Registerbekanntmachung\nHamburg Amtsgericht Hamburg HRB 12054\nHamburg Messe und Congress GmbH – Hamburg",
      "type": "Sonstige Registerbekanntmachung",
      "state": "Hamburg",
      "amtsgericht": "Amtsgericht Hamburg",
      "registernummer": "HRB 12054",
      "registerart": "HRB",
      "company_name": "Hamburg Messe und Congress GmbH",
      "company_seat": "Hamburg",
      "details": "30.01.2026 (Bekanntmachungsdatum)\n\nHamburg Amtsgericht Hamburg HRB 12054\nSonstige Registerbekanntmachung\n\nHamburg Messe und Congress GmbH\nGesellschaft mit beschränkter Haftung\nHamburg\n\nAls nicht eingetragen wird bekannt gemacht: Liste des Aufsichtsrats wurde eingereicht."
    },
    {
      "date": "2026-01-30",
      "id": "143938",
      "original_text": "Sonstige Registerbekanntmachung\nHamburg Amtsgericht Hamburg HRB 159417\nCondo Asset Management GmbH – Hamburg",
      "type": "Sonstige Registerbekanntmachung",
      "state": "Hamburg",
      "amtsgericht": "Amtsgericht Hamburg",
      "registernummer": "HRB 159417",
      "registerart": "HRB",
      "company_name": "Condo Asset Management GmbH",
      "company_seat": "Hamburg",
      "details": "30.01.2026 (Bekanntmachungsdatum)\n\nHamburg Amtsgericht Hamburg HRB 159417\nSonstige Registerbekanntmachung 30.01.2026 (Eintragungsdatum)\n\nCondo Asset Management GmbH\nGesellschaft mit beschränkter Haftung\nHamburg\n\nAls nicht eingetragen wird bekannt gemacht:  Den Gläubigern der Gesellschaft, deren Forderungen begründet worden sind, bevor die Eintragung der Vertragsbeendigung in das Handelsregister nach § 10 HGB als bekannt gemacht gilt, ist vom anderen Vertragsteil Sicherheit zu leisten, wenn sie sich binnen 6 Monaten nach Bekanntmachung der Eintragung zu diesem Zweck bei ihm melden."
    },
    {
      "date": "2026-01-30",
      "id": "143939",
      "original_text": "Registerbekanntmachung nach dem Umwandlungsgesetz\nBerlin Amtsgericht Berlin (Charlottenburg) HRB 199673\nBSMV Liegenschaften GmbH – Berlin",
      "type": "Registerbekanntmachung nach dem Umwandlungsgesetz",
      "state": "Berlin",
      "amtsgericht": "Amtsgericht Berlin (Charlottenburg)",
      "registernummer": "HRB 199673",
      "registerart": "HRB",
      "company_name": "BSMV Liegenschaften GmbH",
      "company_seat": "Berlin",
      "details": "30.01.2026 (Bekanntmachungsdatum)\n\nBerlin Amtsgericht Berlin (Charlottenburg) HRB 199673\nRegisterbekanntmachung nach dem Umwandlungsgesetz 29.01.2026 (Eintragungsdatum)\n\nBSMV Liegenschaften GmbH\nGesellschaft mit beschränkter Haftung\nBerlin\n\nZu Eintragungsnummer 14 vom 29.01.2026 wird als nicht eingetragen veröffentlicht: Den Gläubigern der an der Verschmelzung beteiligten Rechtsträger ist, wenn sie binnen sechs Monaten nach dem Tag, an dem die Eintragung der Verschmelzung in das Register des Sitzes desjenigen Rechtsträgers, dessen Gläubiger sie sind, als bekannt gemacht gilt, ihren Anspruch nach Grund und Höhe schriftlich anmelden, Sicherheit zu leisten, soweit sie nicht Befriedigung verlangen können. Dieses Recht steht den Gläubigern jedoch nur zu, wenn sie glaubhaft machen, dass durch die Verschmelzung die Erfüllung ihrer Forderung gefährdet wird. Das Recht, Sicherheitsleistung zu verlangen, steht Gläubigern nicht zu, die im Falle der Insolvenz ein Recht auf vorzugsweise Befriedigung aus einer Deckungsmasse haben, die nach gesetzlicher Vorschrift zu ihrem Schutz errichtet und staatlich überwacht ist."
    },
    {
      "date": "2026-01-30",
      "id": "143940",
      "original_text": "Registerbekanntmachung nach dem Umwandlungsgesetz\nBaden-Württemberg Amtsgericht Stuttgart HRB 590167\nKonrad Hornschuch Aktiengesellschaft – Weißbach",
      "type": "Registerbekanntmachung nach dem Umwandlungsgesetz",
      "state": "Baden-Württemberg",
      "amtsgericht": "Amtsgericht Stuttgart",
      "registernummer": "HRB 590167",
      "registerart": "HRB",
      "company_name": "Konrad Hornschuch Aktiengesellschaft",
      "company_seat": "Weißbach",
      "details": "30.01.2026 (Bekanntmachungsdatum)\n\nBaden-Württemberg Amtsgericht Stuttgart HRB 590167\nRegisterbekanntmachung nach dem Umwandlungsgesetz 30.01.2026 (Eintragungsdatum)\n\nKonrad Hornschuch Aktiengesellschaft\nAktiengesellschaft\nWeißbach\n\nDen Gläubigern des an dem Formwechsel beteiligten Rechtsträgers ist, wenn sie binnen sechs Monaten nach dem Tag, an dem die Eintragung des Formwechsels in das Register des Sitzes desjenigen Rechtsträgers, dessen Gläubiger sie sind, nach § 19 Abs. 3 UmwG als bekanntgemacht gilt, ihren Anspruch nach Grund und Höhe schriftlich anmelden, Sicherheit zu leisten, soweit sie nicht Befriedigung verlangen können. Dieses Recht steht den Gläubigern jedoch nur zu, wenn sie glaubhaft machen, dass durch den Formwechsel die Erfüllung ihrer Forderung gefährdet wird."
    },
    {
      "date": "2026-01-30",
      "id": "143941",
      "original_text": "Registerbekanntmachung nach dem Umwandlungsgesetz\nBerlin Amtsgericht Berlin (Charlottenburg) HRB 199673\nBSMV Liegenschaften GmbH – Berlin",
      "type": "Registerbekanntmachung nach dem Umwandlungsgesetz",
      "state": "Berlin",
      "amtsgericht": "Amtsgericht Berlin (Charlottenburg)",
      "registernummer": "HRB 199673",
      "registerart": "HRB",
      "company_name": "BSMV Liegenschaften GmbH",
      "company_seat": "Berlin",
      "details": "30.01.2026 (Bekanntmachungsdatum)\n\nBerlin Amtsgericht Berlin (Charlottenburg) HRB 199673\nRegisterbekanntmachung nach dem Umwandlungsgesetz 29.01.2026 (Eintragungsdatum)\n\nBSMV Liegenschaften GmbH\nGesellschaft mit beschränkter Haftung\nBerlin\n\nZu Eintragungsnummer 15 vom 29.01.2026 wird als nicht eingetragen veröffentlicht: Den Gläubigern der an der Verschmelzung beteiligten Rechtsträger ist, wenn sie binnen sechs Monaten nach dem Tag, an dem die Eintragung der Verschmelzung in das Register des Sitzes desjenigen Rechtsträgers, dessen Gläubiger sie sind, als bekannt gemacht gilt, ihren Anspruch nach Grund und Höhe schriftlich anmelden, Sicherheit zu leisten, soweit sie nicht Befriedigung verlangen können. Dieses Recht steht den Gläubigern jedoch nur zu, wenn sie glaubhaft machen, dass durch die Verschmelzung die Erfüllung ihrer Forderung gefährdet wird. Das Recht, Sicherheitsleistung zu verlangen, steht Gläubigern nicht zu, die im Falle der Insolvenz ein Recht auf vorzugsweise Befriedigung aus einer Deckungsmasse haben, die nach gesetzlicher Vorschrift zu ihrem Schutz errichtet und staatlich überwacht ist."
    },
    {
      "date": "2026-01-30",
      "id": "143942",
      "original_text": "Registerbekanntmachung nach dem Umwandlungsgesetz\nBerlin Amtsgericht Berlin (Charlottenburg) HRB 235533\nSHG Magdeburg Beteiligungsgesellschaft mbH – Berlin",
      "type": "Registerbekanntmachung nach dem Umwandlungsgesetz",
      "state": "Berlin",
      "amtsgericht": "Amtsgericht Berlin (Charlottenburg)",
      "registernummer": "HRB 235533",
      "registerart": "HRB",
      "company_name": "SHG Magdeburg Beteiligungsgesellschaft mbH",
      "company_seat": "Berlin",
      "details": "30.01.2026 (Bekanntmachungsdatum)\n\nBerlin Amtsgericht Berlin (Charlottenburg) HRB 235533\nRegisterbekanntmachung nach dem Umwandlungsgesetz 29.01.2026 (Eintragungsdatum)\n\nSHG Magdeburg Beteiligungsgesellschaft mbH\nGesellschaft mit beschränkter Haftung\nBerlin\n\nZu Eintragungsnummer 5 vom 29.01.2026 wird als nicht eingetragen veröffentlicht: Den Gläubigern der an der Verschmelzung beteiligten Rechtsträger ist, wenn sie binnen sechs Monaten nach dem Tag, an dem die Eintragung der Verschmelzung in das Register des Sitzes desjenigen Rechtsträgers, dessen Gläubiger sie sind, als bekannt gemacht gilt, ihren Anspruch nach Grund und Höhe schriftlich anmelden, Sicherheit zu leisten, soweit sie nicht Befriedigung verlangen können. Dieses Recht steht den Gläubigern jedoch nur zu, wenn sie glaubhaft machen, dass durch die Verschmelzung die Erfüllung ihrer Forderung gefährdet wird. Das Recht, Sicherheitsleistung zu verlangen, steht Gläubigern nicht zu, die im Falle der Insolvenz ein Recht auf vorzugsweise Befriedigung aus einer Deckungsmasse haben, die nach gesetzlicher Vorschrift zu ihrem Schutz errichtet und staatlich überwacht ist."
    },
    {
      "date": "2026-01-30",
      "id": "143943",
      "original_text": "Löschungsankündigung\nBerlin Amtsgericht Berlin (Charlottenburg) HRB 215347\nPSDZ Signature Life UG (haftungsbeschränkt) – Berlin",
      "type": "Löschungsankündigung",
      "state": "Berlin",
      "amtsgericht": "Amtsgericht Berlin (Charlottenburg)",
      "registernummer": "HRB 215347",
      "registerart": "HRB",
      "company_name": "PSDZ Signature Life UG (haftungsbeschränkt)",
      "company_seat": "Berlin",
      "details": "30.01.2026 (Bekanntmachungsdatum)\n\nBerlin Amtsgericht Berlin (Charlottenburg) HRB 215347\nLöschungsankündigung\n\nPSDZ Signature Life UG (haftungsbeschränkt)\nGesellschaft mit beschränkter Haftung\nBerlin\n\nBei der nachstehenden Gesellschaft wird das Amtslöschungsverfahren gemäß § 394 FamFG eingeleitet. Widerspruchsfrist 6 Wochen"
    },
    {
      "date": "2026-01-30",
      "id": "143944",
      "original_text": "Registerbekanntmachung nach dem Umwandlungsgesetz\nBaden-Württemberg Amtsgericht Stuttgart HRB 803700\nKonrad Hornschuch GmbH – Weißbach",
      "type": "Registerbekanntmachung nach dem Umwandlungsgesetz",
      "state": "Baden-Württemberg",
      "amtsgericht": "Amtsgericht Stuttgart",
      "registernummer": "HRB 803700",
      "registerart": "HRB",
      "company_name": "Konrad Hornschuch GmbH",
      "company_seat": "Weißbach",
      "details": "30.01.2026 (Bekanntmachungsdatum)\n\nBaden-Württemberg Amtsgericht Stuttgart HRB 803700\nRegisterbekanntmachung nach dem Umwandlungsgesetz 30.01.2026 (Eintragungsdatum)\n\nKonrad Hornschuch GmbH\nGesellschaft mit beschränkter Haftung\nWeißbach\n\nDen Gläubigern des an dem Formwechsel beteiligten Rechtsträgers ist, wenn sie binnen sechs Monaten nach dem Tag, an dem die Eintragung des Formwechsels in das Register des Sitzes desjenigen Rechtsträgers, dessen Gläubiger sie sind, nach § 19 Abs. 3 UmwG als bekanntgemacht gilt, ihren Anspruch nach Grund und Höhe schriftlich anmelden, Sicherheit zu leisten, soweit sie nicht Befriedigung verlangen können. Dieses Recht steht den Gläubigern jedoch nur zu, wenn sie glaubhaft machen, dass durch den Formwechsel die Erfüllung ihrer Forderung gefährdet wird."
    },
    {
      "date": "2026-01-30",
      "id": "143945",
      "original_text": "Registerbekanntmachung nach dem Umwandlungsgesetz\nBerlin Amtsgericht Berlin (Charlottenburg) HRB 203769\nSRS48 Liegenschaften GmbH – Berlin",
      "type": "Registerbekanntmachung nach dem Umwandlungsgesetz",
      "state": "Berlin",
      "amtsgericht": "Amtsgericht Berlin (Charlottenburg)",
      "registernummer": "HRB 203769",
      "registerart": "HRB",
      "company_name": "SRS48 Liegenschaften GmbH",
      "company_seat": "Berlin",
      "details": "30.01.2026 (Bekanntmachungsdatum)\n\nBerlin Amtsgericht Berlin (Charlottenburg) HRB 203769\nRegisterbekanntmachung nach dem Umwandlungsgesetz 29.01.2026 (Eintragungsdatum)\n\nSRS48 Liegenschaften GmbH\nGesellschaft mit beschränkter Haftung\nBerlin\n\nZu Eintragungsnummer 3 vom 29.01.2026 wird als nicht eingetragen veröffentlicht: Den Gläubigern der an der Verschmelzung beteiligten Rechtsträger ist, wenn sie binnen sechs Monaten nach dem Tag, an dem die Eintragung der Verschmelzung in das Register des Sitzes desjenigen Rechtsträgers, dessen Gläubiger sie sind, als bekannt gemacht gilt, ihren Anspruch nach Grund und Höhe schriftlich anmelden, Sicherheit zu leisten, soweit sie nicht Befriedigung verlangen können. Dieses Recht steht den Gläubigern jedoch nur zu, wenn sie glaubhaft machen, dass durch die Verschmelzung die Erfüllung ihrer Forderung gefährdet wird. Das Recht, Sicherheitsleistung zu verlangen, steht Gläubigern nicht zu, die im Falle der Insolvenz ein Recht auf vorzugsweise Befriedigung aus einer Deckungsmasse haben, die nach gesetzlicher Vorschrift zu ihrem Schutz errichtet und staatlich überwacht ist."
    },
    {
      "date": "2026-01-30",
      "id": "143946",
      "original_text": "Sonstige Registerbekanntmachung\nBaden-Württemberg Amtsgericht Stuttgart HRB 720779\nTorkret GmbH – Stuttgart",
      "type": "Sonstige Registerbekanntmachung",
      "state": "Baden-Württemberg",
      "amtsgericht": "Amtsgericht Stuttgart",
      "registernummer": "HRB 720779",
      "registerart": "HRB",
      "company_name": "Torkret GmbH",
      "company_seat": "Stuttgart",
      "details": "30.01.2026 (Bekanntmachungsdatum)\n\nBaden-Württemberg Amtsgericht Stuttgart HRB 720779\nSonstige Registerbekanntmachung 30.01.2026 (Eintragungsdatum)\n\nTorkret GmbH\nGesellschaft mit beschränkter Haftung\nStuttgart\n\nDen Gläubigern der Gesellschaft, deren Forderungen begründet worden sind, bevor die Eintragung der Beendigung des Vertrages in das Handelsregister nach § 10 HGB als bekanntgemacht gilt, ist vom anderen Vertragsteil Sicherheit zu leisten, wenn sie sich binnen sechs Monaten nach der Bekanntmachung zu diesem Zweck bei ihm melden."
    },
    {
      "date": "2026-01-30",
      "id": "143947",
      "original_text": "Löschungsankündigung\nBaden-Württemberg Amtsgericht Mannheim HRA 700945\nNT-Systemgastronomie GmbH & Co. KG – Pforzheim",
      "type": "Löschungsankündigung",
      "state": "Baden-Württemberg",
      "amtsgericht": "Amtsgericht Mannheim",
      "registernummer": "HRA 700945",
      "registerart": "HRA",
      "company_name": "NT-Systemgastronomie GmbH & Co. KG",
      "company_seat": "Pforzheim",
      "details": "30.01.2026 (Bekanntmachungsdatum)\n\nBaden-Württemberg Amtsgericht Mannheim HRA 700945\nLöschungsankündigung\n\nNT-Systemgastronomie GmbH & Co. KG\nKommanditgesellschaft\nPforzheim\n\nDas Gericht beabsichtigt, die Gesellschaft wegen Vermögenslosigkeit im Handelsregister von Amts wegen nach § 394 FamFG zu löschen. Die Frist zur Geltendmachung eines Widerspruchs gegen die beabsichtigte Löschung ist auf einen Monat ab Veröffentlichung bestimmt."
    },
    {
      "date": "2026-01-30",
      "id": "143948",
      "original_text": "Sonstige Registerbekanntmachung\nBaden-Württemberg Amtsgericht Mannheim HRB 714782\nVerivox Versicherungsvergleich GmbH – Heidelberg",
      "type": "Sonstige Registerbekanntmachung",
      "state": "Baden-Württemberg",
      "amtsgericht": "Amtsgericht Mannheim",
      "registernummer": "HRB 714782",
      "registerart": "HRB",
      "company_name": "Verivox Versicherungsvergleich GmbH",
      "company_seat": "Heidelberg",
      "details": "30.01.2026 (Bekanntmachungsdatum)\n\nBaden-Württemberg Amtsgericht Mannheim HRB 714782\nSonstige Registerbekanntmachung 30.01.2026 (Eintragungsdatum)\n\nVerivox Versicherungsvergleich GmbH\nGesellschaft mit beschränkter Haftung\nHeidelberg\n\nDen Gläubigern der Gesellschaft, deren Forderungen begründet worden sind, bevor die Eintragung der Beendigung des Vertrages in das Handelsregister nach § 10 HGB als bekanntgemacht gilt, ist vom anderen Vertragsteil Sicherheit zu leisten, wenn sie sich binnen sechs Monaten nach der Bekanntmachung zu diesem Zweck bei ihm melden."
    },
    {
      "date": "2026-01-30",
      "id": "143949",
      "original_text": "Registerbekanntmachung nach dem Umwandlungsgesetz\nSachsen-Anhalt Amtsgericht Stendal HRB 35154\nECS Göhler GmbH – Niedere Börde OT Samswegen",
      "type": "Registerbekanntmachung nach dem Umwandlungsgesetz",
      "state": "Sachsen-Anhalt",
      "amtsgericht": "Amtsgericht Stendal",
      "registernummer": "HRB 35154",
      "registerart": "HRB",
      "company_name": "ECS Göhler GmbH",
      "company_seat": "Niedere Börde OT Samswegen",
      "details": "30.01.2026 (Bekanntmachungsdatum)\n\nSachsen-Anhalt Amtsgericht Stendal HRB 35154\nRegisterbekanntmachung nach dem Umwandlungsgesetz 30.01.2026 (Eintragungsdatum)\n\nECS Göhler GmbH\nGesellschaft mit beschränkter Haftung\nNiedere Börde OT Samswegen\n\nNicht eingetragen:\nDen Gläubigern der an der Verschmelzung beteiligten Rechtsträger ist, wenn sie binnen sechs Monaten nach dem Tag, an dem die Eintragung der Verschmelzung nach § 19 Abs. 3 UmwG als bekanntgemacht gilt, ihren Anspruch nach Grund und Höhe schriftlich anmelden, Sicherheit zu leisten, soweit sie nicht Befriedigung verlangen können. Dieses Recht steht ihnen jedoch nur zu, wenn sie glaubhaft machen, dass durch die Verschmelzung die Erfüllung ihrer Forderung gefährdet wird."
    },
    {
      "date": "2026-01-30",
      "id": "143950",
      "original_text": "Löschungsankündigung\nBerlin Amtsgericht Berlin (Charlottenburg) HRB 218925\nCoiffeur Merci Meisterbetrieb UG (haftungsbeschränkt) – Berlin",
      "type": "Löschungsankündigung",
      "state": "Berlin",
      "amtsgericht": "Amtsgericht Berlin (Charlottenburg)",
      "registernummer": "HRB 218925",
      "registerart": "HRB",
      "company_name": "Coiffeur Merci Meisterbetrieb UG (haftungsbeschränkt)",
      "company_seat": "Berlin",
      "details": "30.01.2026 (Bekanntmachungsdatum)\n\nBerlin Amtsgericht Berlin (Charlottenburg) HRB 218925\nLöschungsankündigung\n\nCoiffeur Merci Meisterbetrieb UG (haftungsbeschränkt)\nGesellschaft mit beschränkter Haftung\nBerlin\n\nBei der nachstehenden Gesellschaft wird das Amtslöschungsverfahren gemäß § 394 FamFG eingeleitet. Widerspruchsfrist 6 Wochen"
    },
    {
      "date": "2026-01-30",
      "id": "143951",
      "original_text": "Löschungsankündigung\nBerlin Amtsgericht Berlin (Charlottenburg) HRB 223445\nAskinCakici Holding GmbH – Berlin",
      "type": "Löschungsankündigung",
      "state": "Berlin",
      "amtsgericht": "Amtsgericht Berlin (Charlottenburg)",
      "registernummer": "HRB 223445",
      "registerart": "HRB",
      "company_name": "AskinCakici Holding GmbH",
      "company_seat": "Berlin",
      "details": "30.01.2026 (Bekanntmachungsdatum)\n\nBerlin Amtsgericht Berlin (Charlottenburg) HRB 223445\nLöschungsankündigung\n\nAskinCakici Holding GmbH\nGesellschaft mit beschränkter Haftung\nBerlin\n\nBei der nachstehenden Gesellschaft wird das Amtslöschungsverfahren gemäß § 394 FamFG eingeleitet. Widerspruchsfrist 6 Wochen"
    },
    {
      "date": "2026-01-30",
      "id": "143952",
      "original_text": "Einreichung neuer Dokumente\nBrandenburg Amtsgericht Cottbus HRB 3326\nLausitz Energie Bergbau AG – Cottbus",
      "type": "Einreichung neuer Dokumente",
      "state": "Brandenburg",
      "amtsgericht": "Amtsgericht Cottbus",
      "registernummer": "HRB 3326",
      "registerart": "HRB",
      "company_name": "Lausitz Energie Bergbau AG",
      "company_seat": "Cottbus",
      "details": "30.01.2026 (Bekanntmachungsdatum)\n\nBrandenburg Amtsgericht Cottbus HRB 3326\nEinreichung neuer Dokumente\n\nLausitz Energie Bergbau AG\nAktiengesellschaft\nCottbus\n\nAls nicht eingetragen wird veröffentlicht:\nDer Vorstand hat eine Liste der Aufsichtsratsmitglieder gem. § 106 AktG zum Handelsregister eingereicht."
    },
    {
      "date": "2026-01-30",
      "id": "143953",
      "original_text": "Registerbekanntmachung nach dem Umwandlungsgesetz\nHamburg Amtsgericht Hamburg HRB 86458\nSewaCon GmbH – Hamburg",
      "type": "Registerbekanntmachung nach dem Umwandlungsgesetz",
      "state": "Hamburg",
      "amtsgericht": "Amtsgericht Hamburg",
      "registernummer": "HRB 86458",
      "registerart": "HRB",
      "company_name": "SewaCon GmbH",
      "company_seat": "Hamburg",
      "details": "30.01.2026 (Bekanntmachungsdatum)\n\nHamburg Amtsgericht Hamburg HRB 86458\nRegisterbekanntmachung nach dem Umwandlungsgesetz 30.01.2026 (Eintragungsdatum)\n\nSewaCon GmbH\nGesellschaft mit beschränkter Haftung\nHamburg\n\nAls nicht eingetragen wird bekannt gemacht:\nDen Gläubigern der an der Verschmelzung beteiligten Gesellschaften ist, wenn sie binnen sechs Monaten nach dem Tag, an dem die Eintragung der Verschmelzung in das Register des Sitzes desjenigen Rechtsträgers, dessen Gläubiger sie sind, nach § 19 Absatz 3 UmwG als bekannt gemacht gilt, ihren Anspruch nach Grund und Höhe schriftlich anmelden, Sicherheit zu leisten, soweit sie nicht Befriedigung verlangen können. Dieses Recht steht den Gläubigern jedoch nur zu, wenn sie glaubhaft machen, dass durch die Verschmelzung die Erfüllung ihrer Forderung gefährdet wird."
    },
    {
      "date": "2026-01-30",
      "id": "143954",
      "original_text": "Löschungsankündigung\nBerlin Amtsgericht Berlin (Charlottenburg) HRB 120682\nASG Transformatoren GmbH – Berlin",
      "type": "Löschungsankündigung",
      "state": "Berlin",
      "amtsgericht": "Amtsgericht Berlin (Charlottenburg)",
      "registernummer": "HRB 120682",
      "registerart": "HRB",
      "company_name": "ASG Transformatoren GmbH",
      "company_seat": "Berlin",
      "details": "30.01.2026 (Bekanntmachungsdatum)\n\nBerlin Amtsgericht Berlin (Charlottenburg) HRB 120682\nLöschungsankündigung\n\nASG Transformatoren GmbH\nGesellschaft mit beschränkter Haftung\nBerlin\n\nBei der nachstehenden Gesellschaft wird das Amtslöschungsverfahren gemäß § 394 FamFG eingeleitet. Widerspruchsfrist 6 Wochen"
    },
    {
      "date": "2026-01-30",
      "id": "143955",
      "original_text": "Löschungsankündigung\nBaden-Württemberg Amtsgericht Stuttgart HRB 785962\nOnlu Mobilfunk GmbH – Esslingen am Neckar",
      "type": "Löschungsankündigung",
      "state": "Baden-Württemberg",
      "amtsgericht": "Amtsgericht Stuttgart",
      "registernummer": "HRB 785962",
      "registerart": "HRB",
      "company_name": "Onlu Mobilfunk GmbH",
      "company_seat": "Esslingen am Neckar",
      "details": "30.01.2026 (Bekanntmachungsdatum)\n\nBaden-Württemberg Amtsgericht Stuttgart HRB 785962\nLöschungsankündigung\n\nOnlu Mobilfunk GmbH\nGesellschaft mit beschränkter Haftung\nEsslingen am Neckar\n\nAls nicht eingetragen wird bekanntgemacht:\nDas Gericht beabsichtigt, die Gesellschaft wegen Vermögenslosigkeit im Handelsregister von Amts wegen nach § 394 FamFG zu löschen. Die Frist zur Geltendmachung eines Widerspruchs gegen die beabsichtigte Löschung ist auf zwei Monate ab Veröffentlichung bestimmt."
    },
    {
      "date": "2026-01-30",
      "id": "143956",
      "original_text": "Löschungsankündigung\nBerlin Amtsgericht Berlin (Charlottenburg) HRB 178890\nCDE Custom Design Estates Berlin GmbH – Berlin",
      "type": "Löschungsankündigung",
      "state": "Berlin",
      "amtsgericht": "Amtsgericht Berlin (Charlottenburg)",
      "registernummer": "HRB 178890",
      "registerart": "HRB",
      "company_name": "CDE Custom Design Estates Berlin GmbH",
      "company_seat": "Berlin",
      "details": "30.01.2026 (Bekanntmachungsdatum)\n\nBerlin Amtsgericht Berlin (Charlottenburg) HRB 178890\nLöschungsankündigung\n\nCDE Custom Design Estates Berlin GmbH\nGesellschaft mit beschränkter Haftung\nBerlin\n\nBei der nachstehenden Gesellschaft wird das Amtslöschungsverfahren gemäß § 394 FamFG eingeleitet. Widerspruchsfrist 6 Wochen"
    },
    {
      "date": "2026-01-30",
      "id": "143957",
      "original_text": "Löschungsankündigung\nBrandenburg Amtsgericht Frankfurt/Oder HRB 18220\nJaDer Logistik und Handels GmbH – Fürstenwalde/Spree",
      "type": "Löschungsankündigung",
      "state": "Brandenburg",
      "amtsgericht": "Amtsgericht Frankfurt/Oder",
      "registernummer": "HRB 18220",
      "registerart": "HRB",
      "company_name": "JaDer Logistik und Handels GmbH",
      "company_seat": "Fürstenwalde/Spree",
      "details": "30.01.2026 (Bekanntmachungsdatum)\n\nBrandenburg Amtsgericht Frankfurt/Oder HRB 18220\nLöschungsankündigung\n\nJaDer Logistik und Handels GmbH\nGesellschaft mit beschränkter Haftung\nFürstenwalde/Spree\n\nBei der nachstehenden Gesellschaft wird das Amtslöschungsverfahren gemäß § 394 FamFG eingeleitet."
    },
    {
      "date": "2026-01-30",
      "id": "143958",
      "original_text": "Löschungsankündigung\nBaden-Württemberg Amtsgericht Mannheim HRB 705502\nMK Drehtechnik GmbH – Ötisheim",
      "type": "Löschungsankündigung",
      "state": "Baden-Württemberg",
      "amtsgericht": "Amtsgericht Mannheim",
      "registernummer": "HRB 705502",
      "registerart": "HRB",
      "company_name": "MK Drehtechnik GmbH",
      "company_seat": "Ötisheim",
      "details": "30.01.2026 (Bekanntmachungsdatum)\n\nBaden-Württemberg Amtsgericht Mannheim HRB 705502\nLöschungsankündigung\n\nMK Drehtechnik GmbH\nGesellschaft mit beschränkter Haftung\nÖtisheim\n\nDas Gericht beabsichtigt, die Gesellschaft wegen Vermögenslosigkeit im Handelsregister von Amts wegen nach § 394 FamFG zu löschen. Die Frist zur Geltendmachung eines Widerspruchs gegen die beabsichtigte Löschung ist auf einen Monat ab Veröffentlichung bestimmt."
    },
    {
      "date": "2026-01-30",
      "id": "143959",
      "original_text": "Löschungsankündigung\nSachsen-Anhalt Amtsgericht Stendal VR 46411\nJugendclub Zöschen e.V. – Zöschen",
      "type": "Löschungsankündigung",
      "state": "Sachsen-Anhalt",
      "amtsgericht": "Amtsgericht Stendal",
      "registernummer": "VR 46411",
      "registerart": "VR",
      "company_name": "Jugendclub Zöschen e.V.",
      "company_seat": "Zöschen",
      "details": "30.01.2026 (Bekanntmachungsdatum)\n\nSachsen-Anhalt Amtsgericht Stendal VR 46411\nLöschungsankündigung\n\nJugendclub Zöschen e.V.\neingetragener Verein\nZöschen\n\nDas Registergericht beabsichtigt, nachfolgende im Vereinsregister  eingetragenen Vereine von Amts wegen aufgrund Mitgliederlosigkeit zu löschen. Die Frist zu Erhebung eines Widerspruchs wird auf einen Monat festgesetzt."
    },
    {
      "date": "2026-01-30",
      "id": "143960",
      "original_text": "Sonstige Registerbekanntmachung\nHamburg Amtsgericht Hamburg HRB 188101\nOtto GmbH & Co. KGaA – Hamburg",
      "type": "Sonstige Registerbekanntmachung",
      "state": "Hamburg",
      "amtsgericht": "Amtsgericht Hamburg",
      "registernummer": "HRB 188101",
      "registerart": "HRB",
      "company_name": "Otto GmbH & Co. KGaA",
      "company_seat": "Hamburg",
      "details": "30.01.2026 (Bekanntmachungsdatum)\n\nHamburg Amtsgericht Hamburg HRB 188101\nSonstige Registerbekanntmachung\n\nOtto GmbH & Co. KGaA\nKommanditgesellschaft auf Aktien\nHamburg\n\nAls nicht eingetragen wird bekannt gemacht: Liste des Aufsichtsrats wurde eingereicht."
    },
    {
      "date": "2026-01-30",
      "id": "143961",
      "original_text": "Einreichung neuer Dokumente\nBerlin Amtsgericht Berlin (Charlottenburg) HRB 125990\nALDB GmbH – Berlin",
      "type": "Einreichung neuer Dokumente",
      "state": "Berlin",
      "amtsgericht": "Amtsgericht Berlin (Charlottenburg)",
      "registernummer": "HRB 125990",
      "registerart": "HRB",
      "company_name": "ALDB GmbH",
      "company_seat": "Berlin",
      "details": "30.01.2026 (Bekanntmachungsdatum)\n\nBerlin Amtsgericht Berlin (Charlottenburg) HRB 125990\nEinreichung neuer Dokumente\n\nALDB GmbH\nGesellschaft mit beschränkter Haftung\nBerlin\n\nAls nicht eingetragen wird veröffentlicht: Es wurde eine neue Liste der Aufsichtsratsmitglieder eingereicht (§52 GmbHG)."
    },
    {
      "date": "2026-01-30",
      "id": "143962",
      "original_text": "Einreichung neuer Dokumente\nSchleswig-Holstein Amtsgericht Pinneberg HRB 7739\nBiotic Science Holding AG – Pinneberg",
      "type": "Einreichung neuer Dokumente",
      "state": "Schleswig-Holstein",
      "amtsgericht": "Amtsgericht Pinneberg",
      "registernummer": "HRB 7739",
      "registerart": "HRB",
      "company_name": "Biotic Science Holding AG",
      "company_seat": "Pinneberg",
      "details": "30.01.2026 (Bekanntmachungsdatum)\n\nSchleswig-Holstein Amtsgericht Pinneberg HRB 7739\nEinreichung neuer Dokumente\n\nBiotic Science Holding AG\nAktiengesellschaft\nPinneberg\n\nAls nicht eingetragen wird veröffentlicht: Es wurde eine neue Liste der Aufsichtsratsmitglieder gem. § 106 AktG zum Handelsregister eingereicht."
    },
    {
      "date": "2026-01-30",
      "id": "143963",
      "original_text": "Löschungsankündigung\nBerlin Amtsgericht Berlin (Charlottenburg) HRB 204897\nMustafa Demir's Gemüse Kebap Herstellungs GmbH – Berlin",
      "type": "Löschungsankündigung",
      "state": "Berlin",
      "amtsgericht": "Amtsgericht Berlin (Charlottenburg)",
      "registernummer": "HRB 204897",
      "registerart": "HRB",
      "company_name": "Mustafa Demir's Gemüse Kebap Herstellungs GmbH",
      "company_seat": "Berlin",
      "details": "30.01.2026 (Bekanntmachungsdatum)\n\nBerlin Amtsgericht Berlin (Charlottenburg) HRB 204897\nLöschungsankündigung\n\nMustafa Demir's Gemüse Kebap Herstellungs GmbH\nGesellschaft mit beschränkter Haftung\nBerlin\n\nBei der nachstehenden Gesellschaft wird das Amtslöschungsverfahren gemäß § 394 FamFG eingeleitet. Widerspruchsfrist 6 Wochen"
    },
    {
      "date": "2026-01-30",
      "id": "143964",
      "original_text": "Einreichung neuer Dokumente\nBaden-Württemberg Amtsgericht Ulm HRB 720485\nALB FILS KLINIKUM GmbH – Göppingen",
      "type": "Einreichung neuer Dokumente",
      "state": "Baden-Württemberg",
      "amtsgericht": "Amtsgericht Ulm",
      "registernummer": "HRB 720485",
      "registerart": "HRB",
      "company_name": "ALB FILS KLINIKUM GmbH",
      "company_seat": "Göppingen",
      "details": "30.01.2026 (Bekanntmachungsdatum)\n\nBaden-Württemberg Amtsgericht Ulm HRB 720485\nEinreichung neuer Dokumente\n\nALB FILS KLINIKUM GmbH\nGesellschaft mit beschränkter Haftung\nGöppingen\n\nDie Gesellschaft hat am 29.01.2026 die Liste über die Zusammensetzung des Aufsichtsrats zum Handelsregister eingereicht."
    },
    {
      "date": "2026-01-30",
      "id": "143965",
      "original_text": "Löschungsankündigung\nBerlin Amtsgericht Berlin (Charlottenburg) HRB 173622\nDigithep GmbH – Berlin",
      "type": "Löschungsankündigung",
      "state": "Berlin",
      "amtsgericht": "Amtsgericht Berlin (Charlottenburg)",
      "registernummer": "HRB 173622",
      "registerart": "HRB",
      "company_name": "Digithep GmbH",
      "company_seat": "Berlin",
      "details": "30.01.2026 (Bekanntmachungsdatum)\n\nBerlin Amtsgericht Berlin (Charlottenburg) HRB 173622\nLöschungsankündigung\n\nDigithep GmbH\nGesellschaft mit beschränkter Haftung\nBerlin\n\nBei der nachstehenden Gesellschaft wird das Amtslöschungsverfahren gemäß § 394 FamFG eingeleitet. Widerspruchsfrist 6 Wochen"
    },
    {
      "date": "2026-01-30",
      "id": "143966",
      "original_text": "Löschungsankündigung\nBerlin Amtsgericht Berlin (Charlottenburg) HRB 243632\nSafe Side Security UG (haftungsbeschränkt) – Berlin",
      "type": "Löschungsankündigung",
      "state": "Berlin",
      "amtsgericht": "Amtsgericht Berlin (Charlottenburg)",
      "registernummer": "HRB 243632",
      "registerart": "HRB",
      "company_name": "Safe Side Security UG (haftungsbeschränkt)",
      "company_seat": "Berlin",
      "details": "30.01.2026 (Bekanntmachungsdatum)\n\nBerlin Amtsgericht Berlin (Charlottenburg) HRB 243632\nLöschungsankündigung\n\nSafe Side Security UG (haftungsbeschränkt)\nGesellschaft mit beschränkter Haftung\nBerlin\n\nBei der nachstehenden Gesellschaft wird das Amtslöschungsverfahren gemäß § 394 FamFG eingeleitet. Widerspruchsfrist 6 Wochen"
    },
    {
      "date": "2026-01-30",
      "id": "143967",
      "original_text": "Einreichung neuer Dokumente\nSachsen-Anhalt Amtsgericht Stendal HRB 13301\nWBD Industriepark Dessau GmbH – Dessau-Roßlau",
      "type": "Einreichung neuer Dokumente",
      "state": "Sachsen-Anhalt",
      "amtsgericht": "Amtsgericht Stendal",
      "registernummer": "HRB 13301",
      "registerart": "HRB",
      "company_name": "WBD Industriepark Dessau GmbH",
      "company_seat": "Dessau-Roßlau",
      "details": "30.01.2026 (Bekanntmachungsdatum)\n\nSachsen-Anhalt Amtsgericht Stendal HRB 13301\nEinreichung neuer Dokumente\n\nWBD Industriepark Dessau GmbH\nGesellschaft mit beschränkter Haftung\nDessau-Roßlau\n\nEs wurden Listen der Mitglieder des Aufsichtsrates zum Handelsregister eingereicht."
    },
    {
      "date": "2026-01-30",
      "id": "143968",
      "original_text": "Einreichung neuer Dokumente\nBaden-Württemberg Amtsgericht Stuttgart HRB 773047\nHeller Holding SE & Co. KGaA – Nürtingen",
      "type": "Einreichung neuer Dokumente",
      "state": "Baden-Württemberg",
      "amtsgericht": "Amtsgericht Stuttgart",
      "registernummer": "HRB 773047",
      "registerart": "HRB",
      "company_name": "Heller Holding SE & Co. KGaA",
      "company_seat": "Nürtingen",
      "details": "30.01.2026 (Bekanntmachungsdatum)\n\nBaden-Württemberg Amtsgericht Stuttgart HRB 773047\nEinreichung neuer Dokumente\n\nHeller Holding SE & Co. KGaA\nKommanditgesellschaft auf Aktien\nNürtingen\n\nDie Gesellschaft hat am 27.01.2026 die Liste über die Zusammensetzung des Aufsichtsrats zum Handelsregister eingereicht."
    },
    {
      "date": "2026-01-30",
      "id": "143969",
      "original_text": "Löschungsankündigung\nBaden-Württemberg Amtsgericht Mannheim HRB 726770\nWolff Vermittlungs- und Beteiligungs GmbH – Rastatt",
      "type": "Löschungsankündigung",
      "state": "Baden-Württemberg",
      "amtsgericht": "Amtsgericht Mannheim",
      "registernummer": "HRB 726770",
      "registerart": "HRB",
      "company_name": "Wolff Vermittlungs- und Beteiligungs GmbH",
      "company_seat": "Rastatt",
      "details": "30.01.2026 (Bekanntmachungsdatum)\n\nBaden-Württemberg Amtsgericht Mannheim HRB 726770\nLöschungsankündigung\n\nWolff Vermittlungs- und Beteiligungs GmbH\nGesellschaft mit beschränkter Haftung\nRastatt\n\nDas Gericht beabsichtigt, die Gesellschaft wegen Vermögenslosigkeit im Handelsregister von Amts wegen nach § 394 FamFG zu löschen. Die Frist zur Geltendmachung eines Widerspruchs gegen die beabsichtigte Löschung ist auf einen Monat ab Veröffentlichung bestimmt."
    },
    {
      "date": "2026-01-30",
      "id": "143970",
      "original_text": "Sonstige Registerbekanntmachung\nBrandenburg Amtsgericht Cottbus HRB 7025\nLausitzer VerlagsService GmbH – Cottbus",
      "type": "Sonstige Registerbekanntmachung",
      "state": "Brandenburg",
      "amtsgericht": "Amtsgericht Cottbus",
      "registernummer": "HRB 7025",
      "registerart": "HRB",
      "company_name": "Lausitzer VerlagsService GmbH",
      "company_seat": "Cottbus",
      "details": "30.01.2026 (Bekanntmachungsdatum)\n\nBrandenburg Amtsgericht Cottbus HRB 7025\nSonstige Registerbekanntmachung\n\nLausitzer VerlagsService GmbH\nGesellschaft mit beschränkter Haftung\nCottbus\n\nAls nicht eingetragen wird veröffentlicht:\nDer andere Vertragsteil hat den Gläubigern dieses Rechtsträgers, dessen Forderungen begründet worden sind, bevor die Eintragung der Beendigung dieses Vertrages in das Handelsregister nach § 10 des Handelsgesetzbuches als bekannt gemacht gilt, Sicherheit zu leisten, wenn sie sich binnen sechs Monaten nach der Bekanntmachung der Eintragung zu diesem Zweck bei ihm melden"
    },
    {
      "date": "2026-01-30",
      "id": "143971",
      "original_text": "Registerbekanntmachung nach dem Umwandlungsgesetz\nNiedersachsen Amtsgericht Osnabrück HRB 130794 früher Amtsgericht Nordhorn\nKerTec Immobilien GmbH – Nordhorn",
      "type": "Registerbekanntmachung nach dem Umwandlungsgesetz",
      "state": "Niedersachsen",
      "amtsgericht": "Amtsgericht Osnabrück",
      "registernummer": "HRB 130794",
      "registerart": "HRB",
      "company_name": "KerTec Immobilien GmbH",
      "company_seat": "Nordhorn",
      "former_amtsgericht": "Nordhorn",
      "details": "30.01.2026 (Bekanntmachungsdatum)\n\nNiedersachsen Amtsgericht Osnabrück HRB 130794 früher Amtsgericht Nordhorn\nRegisterbekanntmachung nach dem Umwandlungsgesetz 30.01.2026 (Eintragungsdatum)\n\nKerTec Immobilien GmbH\nGesellschaft mit beschränkter Haftung\nNordhorn\n\nDen Gläubigern der an der Verschmelzung beteiligten Rechtsträger ist, wenn sie binnen sechs Monaten nach dem Tag, an dem die Eintragung der Verschmelzung in das Register des Sitzes desjenigen Rechtsträgers, dessen Gläubiger sie sind, nach § 19  Abs.  3 UmwG als bekannt gemacht gilt, ihren Anspruch nach Grund und Höhe schriftlich anmelden, Sicherheit zu leisten, soweit sie nicht Befriedigung verlangen können. Dieses Recht steht den Gläubigern jedoch nur zu, wenn sie glaubhaft machen, dass durch die Verschmelzung die Erfüllung der Forderung gefährdet wird."
    },
    {
      "date": "2026-01-30",
      "id": "143972",
      "original_text": "Registerbekanntmachung nach dem Umwandlungsgesetz\nNiedersachsen Amtsgericht Hannover HRB 230132\nBenecke-Kaliko GmbH – Hannover",
      "type": "Registerbekanntmachung nach dem Umwandlungsgesetz",
      "state": "Niedersachsen",
      "amtsgericht": "Amtsgericht Hannover",
      "registernummer": "HRB 230132",
      "registerart": "HRB",
      "company_name": "Benecke-Kaliko GmbH",
      "company_seat": "Hannover",
      "details": "30.01.2026 (Bekanntmachungsdatum)\n\nNiedersachsen Amtsgericht Hannover HRB 230132\nRegisterbekanntmachung nach dem Umwandlungsgesetz 30.01.2026 (Eintragungsdatum)\n\nBenecke-Kaliko GmbH\nGesellschaft mit beschränkter Haftung\nHannover\n\nDen Gläubigern der an der formwechselnden Umwandlung beteiligten Rechtsträger ist, wenn sie binnen sechs Monaten nach dem Tag, an dem die Eintragung der Umwandlung in das Register des Sitzes desjenigen Rechtsträgers, dessen Gläubiger sie sind, nach § 19 Abs. 3 UmwG als bekannt gemacht gilt, ihren Anspruch nach Grund und Höhe schriftlich anmelden, Sicherheit zu leisten, soweit sie nicht Befriedigung verlangen können. Dieses Recht steht den Gläubigern jedoch nur zu, wenn sie glaubhaft machen, dass durch die formwechselnde Umwandlung die Erfüllung der Forderung gefährdet wird."
    },
    {
      "date": "2026-01-30",
      "id": "143973",
      "original_text": "Einreichung neuer Dokumente\nNiedersachsen Amtsgericht Braunschweig HRB 5217\nAerodata Aktiengesellschaft – Braunschweig",
      "type": "Einreichung neuer Dokumente",
      "state": "Niedersachsen",
      "amtsgericht": "Amtsgericht Braunschweig",
      "registernummer": "HRB 5217",
      "registerart": "HRB",
      "company_name": "Aerodata Aktiengesellschaft",
      "company_seat": "Braunschweig",
      "details": "30.01.2026 (Bekanntmachungsdatum)\n\nNiedersachsen Amtsgericht Braunschweig HRB 5217\nEinreichung neuer Dokumente\n\nAerodata Aktiengesellschaft\nAktiengesellschaft\nBraunschweig\n\nDie Liste der Mitglieder des Aufsichtsrats wurde beim Registergericht eingereicht."
    },
    {
      "date": "2026-01-30",
      "id": "143974",
      "original_text": "Löschungsankündigung\nNiedersachsen Amtsgericht Lüneburg HRB 202117\nCAVOK Immobilien Investment und Verwaltungsgesellschaft mbH – Lüneburg",
      "type": "Löschungsankündigung",
      "state": "Niedersachsen",
      "amtsgericht": "Amtsgericht Lüneburg",
      "registernummer": "HRB 202117",
      "registerart": "HRB",
      "company_name": "CAVOK Immobilien Investment und Verwaltungsgesellschaft mbH",
      "company_seat": "Lüneburg",
      "details": "30.01.2026 (Bekanntmachungsdatum)\n\nNiedersachsen Amtsgericht Lüneburg HRB 202117\nLöschungsankündigung 30.01.2026 (Eintragungsdatum)\n\nCAVOK Immobilien Investment und Verwaltungsgesellschaft mbH\nGesellschaft mit beschränkter Haftung\nLüneburg\n\nDas Registergericht beabsichtigt, die Gesellschaft von Amts wegen nach § 394 FamFG zu löschen. Die Frist zur Erhebung eines Widerspruchs ist auf 1 Monat ab dieser Registerbekanntmachung festgesetzt."
    },
    {
      "date": "2026-01-30",
      "id": "143975",
      "original_text": "Einreichung neuer Dokumente\nNiedersachsen Amtsgericht Hannover HRB 226113\nFamco Netz Invest AG – Hannover",
      "type": "Einreichung neuer Dokumente",
      "state": "Niedersachsen",
      "amtsgericht": "Amtsgericht Hannover",
      "registernummer": "HRB 226113",
      "registerart": "HRB",
      "company_name": "Famco Netz Invest AG",
      "company_seat": "Hannover",
      "details": "30.01.2026 (Bekanntmachungsdatum)\n\nNiedersachsen Amtsgericht Hannover HRB 226113\nEinreichung neuer Dokumente\n\nFamco Netz Invest AG\nAktiengesellschaft\nHannover\n\nDie Liste der Mitglieder des Aufsichtsrats wurde beim Registergericht eingereicht."
    },
    {
      "date": "2026-01-30",
      "id": "143976",
      "original_text": "Registerbekanntmachung nach dem Umwandlungsgesetz\nNiedersachsen Amtsgericht Hannover HRB 50169\nBenecke-Kaliko Aktiengesellschaft – Hannover",
      "type": "Registerbekanntmachung nach dem Umwandlungsgesetz",
      "state": "Niedersachsen",
      "amtsgericht": "Amtsgericht Hannover",
      "registernummer": "HRB 50169",
      "registerart": "HRB",
      "company_name": "Benecke-Kaliko Aktiengesellschaft",
      "company_seat": "Hannover",
      "details": "30.01.2026 (Bekanntmachungsdatum)\n\nNiedersachsen Amtsgericht Hannover HRB 50169\nRegisterbekanntmachung nach dem Umwandlungsgesetz 30.01.2026 (Eintragungsdatum)\n\nBenecke-Kaliko Aktiengesellschaft\nAktiengesellschaft\nHannover\n\nDen Gläubigern der an der formwechselnden Umwandlung beteiligten Rechtsträger ist, wenn sie binnen sechs Monaten nach dem Tag, an dem die Eintragung der Umwandlung in das Register des Sitzes desjenigen Rechtsträgers, dessen Gläubiger sie sind, nach § 19 Abs. 3 UmwG als bekannt gemacht gilt, ihren Anspruch nach Grund und Höhe schriftlich anmelden, Sicherheit zu leisten, soweit sie nicht Befriedigung verlangen können. Dieses Recht steht den Gläubigern jedoch nur zu, wenn sie glaubhaft machen, dass durch die formwechselnde Umwandlung die Erfüllung der Forderung gefährdet wird."
    },
    {
      "date": "2026-01-30",
      "id": "143977",
      "original_text": "Einreichung neuer Dokumente\nNiedersachsen Amtsgericht Hannover HRB 230132\nBenecke-Kaliko GmbH – Hannover",
      "type": "Einreichung neuer Dokumente",
      "state": "Niedersachsen",
      "amtsgericht": "Amtsgericht Hannover",
      "registernummer": "HRB 230132",
      "registerart": "HRB",
      "company_name": "Benecke-Kaliko GmbH",
      "company_seat": "Hannover",
      "details": "30.01.2026 (Bekanntmachungsdatum)\n\nNiedersachsen Amtsgericht Hannover HRB 230132\nEinreichung neuer Dokumente\n\nBenecke-Kaliko GmbH\nGesellschaft mit beschränkter Haftung\nHannover\n\nDie Liste der Mitglieder des Aufsichtsrats wurde beim Registergericht eingereicht."
    },
    {
      "date": "2026-01-30",
      "id": "143978",
      "original_text": "Registerbekanntmachung nach dem Umwandlungsgesetz\nNiedersachsen Amtsgericht Osnabrück HRB 214028\nKersano Fliesen GmbH – Nordhorn",
      "type": "Registerbekanntmachung nach dem Umwandlungsgesetz",
      "state": "Niedersachsen",
      "amtsgericht": "Amtsgericht Osnabrück",
      "registernummer": "HRB 214028",
      "registerart": "HRB",
      "company_name": "Kersano Fliesen GmbH",
      "company_seat": "Nordhorn",
      "details": "30.01.2026 (Bekanntmachungsdatum)\n\nNiedersachsen Amtsgericht Osnabrück HRB 214028\nRegisterbekanntmachung nach dem Umwandlungsgesetz 30.01.2026 (Eintragungsdatum)\n\nKersano Fliesen GmbH\nGesellschaft mit beschränkter Haftung\nNordhorn\n\nDen Gläubigern der an der Verschmelzung beteiligten Rechtsträger ist, wenn sie binnen sechs Monaten nach dem Tag, an dem die Eintragung der Verschmelzung in das Register des Sitzes desjenigen Rechtsträgers, dessen Gläubiger sie sind, nach § 19  Abs.  3 UmwG als bekannt gemacht gilt, ihren Anspruch nach Grund und Höhe schriftlich anmelden, Sicherheit zu leisten, soweit sie nicht Befriedigung verlangen können. Dieses Recht steht den Gläubigern jedoch nur zu, wenn sie glaubhaft machen, dass durch die Verschmelzung die Erfüllung der Forderung gefährdet wird."
    },
    {
      "date": "2026-01-30",
      "id": "143979",
      "original_text": "Registerbekanntmachung nach dem Umwandlungsgesetz\nBremen Amtsgericht Bremen HRB 2941 BHV\nNORDSEE GmbH – Bremerhaven",
      "type": "Registerbekanntmachung nach dem Umwandlungsgesetz",
      "state": "Bremen",
      "amtsgericht": "Amtsgericht Bremen",
      "registernummer": "HRB 2941 BHV",
      "registerart": "HRB",
      "company_name": "NORDSEE GmbH",
      "company_seat": "Bremerhaven",
      "details": "30.01.2026 (Bekanntmachungsdatum)\n\nBremen Amtsgericht Bremen HRB 2941 BHV\nRegisterbekanntmachung nach dem Umwandlungsgesetz 20.01.2026 (Eintragungsdatum)\n\nNORDSEE GmbH\nGesellschaft mit beschränkter Haftung\nBremerhaven\n\nZu Eintragungsnummer 40 vom 20.01.2026 wird als nicht eingetragen veröffentlicht: Gläubigern, deren Forderungen begründet worden sind, bevor die Eintragung des Beschlusses als nach § 10 des Handelsgesetzbuches bekannt gemacht gilt, ist, wenn sie sich binnen sechs Monaten nach der Bekanntmachung zu diesem Zweck melden, Sicherheit zu leisten, soweit sie nicht Befriedigung verlangen können. Dieses Recht steht den Gläubigern nicht zu, die im Fall des Insolvenzverfahrens ein Recht auf vorzugsweise Befriedigung aus der Deckungsmasse haben, die nach gesetzlicher Vorschrift zu ihrem Schutz errichtet und staatlich überwacht ist."
    },
    {
      "date": "2026-01-30",
      "id": "143980",
      "original_text": "Löschungsankündigung\nBremen Amtsgericht Bremen HRB 22324\nMIMI Management GmbH – Bremen",
      "type": "Löschungsankündigung",
      "state": "Bremen",
      "amtsgericht": "Amtsgericht Bremen",
      "registernummer": "HRB 22324",
      "registerart": "HRB",
      "company_name": "MIMI Management GmbH",
      "company_seat": "Bremen",
      "details": "30.01.2026 (Bekanntmachungsdatum)\n\nBremen Amtsgericht Bremen HRB 22324\nLöschungsankündigung\n\nMIMI Management GmbH\nGesellschaft mit beschränkter Haftung\nBremen\n\nEs ist beabsichtigt die im Handelsregister eingetragene Gesellschaft von Amts wegen gemäß § 394 FamFG zu löschen. Gegen die Löschung kann beim AG Bremen schriftlich oder zu Protokoll der Geschäftsstelle Widerspruch eingelegt werden. Widerspruchsfrist 4 Wochen."
    },
    {
      "date": "2026-01-30",
      "id": "143981",
      "original_text": "Registerbekanntmachung nach dem Umwandlungsgesetz\nRheinland-Pfalz Amtsgericht Mainz HRB 47498\nHALLEBACH+KOLLEGEN Steuerberatungsgesellschaft mbH – Osthofen",
      "type": "Registerbekanntmachung nach dem Umwandlungsgesetz",
      "state": "Rheinland-Pfalz",
      "amtsgericht": "Amtsgericht Mainz",
      "registernummer": "HRB 47498",
      "registerart": "HRB",
      "company_name": "HALLEBACH+KOLLEGEN Steuerberatungsgesellschaft mbH",
      "company_seat": "Osthofen",
      "details": "30.01.2026 (Bekanntmachungsdatum)\n\nRheinland-Pfalz Amtsgericht Mainz HRB 47498\nRegisterbekanntmachung nach dem Umwandlungsgesetz 30.01.2026 (Eintragungsdatum)\n\nHALLEBACH+KOLLEGEN Steuerberatungsgesellschaft mbH\nGesellschaft mit beschränkter Haftung\nOsthofen\n\nAls nicht eingetragen wird veröffentlicht: Den Gläubigern der an der Verschmelzung beteiligten Rechtsträger ist, wenn sie binnen sechs Monaten nach dem Tag, an dem die Eintragung der Verschmelzung in das Register des Sitzes desjenigen Rechtsträgers, dessen Gläubiger sie sind, nach § 19 Abs. 3 UmwG als bekannt gemacht gilt, ihren Anspruch nach Grund und Höhe schriftlich anmelden, Sicherheit zu leisten, soweit sie nicht Befriedigung verlangen können. Dieses Recht steht den Gläubigern jedoch nur zu, wenn sie glaubhaft machen, dass durch die Verschmelzung die Erfüllung der Forderung gefährdet wird."
    },
    {
      "date": "2026-01-30",
      "id": "143982",
      "original_text": "Löschungsankündigung\nRheinland-Pfalz Amtsgericht Zweibrücken HRB 32616\nKomfort Bau GmbH – Pirmasens",
      "type": "Löschungsankündigung",
      "state": "Rheinland-Pfalz",
      "amtsgericht": "Amtsgericht Zweibrücken",
      "registernummer": "HRB 32616",
      "registerart": "HRB",
      "company_name": "Komfort Bau GmbH",
      "company_seat": "Pirmasens",
      "details": "30.01.2026 (Bekanntmachungsdatum)\n\nRheinland-Pfalz Amtsgericht Zweibrücken HRB 32616\nLöschungsankündigung\n\nKomfort Bau GmbH\nGesellschaft mit beschränkter Haftung\nPirmasens\n\nDas Registergericht beabsichtigt die Gesellschaft von Amts wegen nach § 394 FamFG zu löschen. Die Frist zur Erhebung eines Widerspruchs ist auf einen Monat festgesetzt."
    },
    {
      "date": "2026-01-30",
      "id": "143983",
      "original_text": "Löschungsankündigung\nRheinland-Pfalz Amtsgericht Landau HRB 31509\nHHS-Haustechnik-Heizung-Sanitär UG (haftungsbeschränkt) – Zeiskam",
      "type": "Löschungsankündigung",
      "state": "Rheinland-Pfalz",
      "amtsgericht": "Amtsgericht Landau",
      "registernummer": "HRB 31509",
      "registerart": "HRB",
      "company_name": "HHS-Haustechnik-Heizung-Sanitär UG (haftungsbeschränkt)",
      "company_seat": "Zeiskam",
      "details": "30.01.2026 (Bekanntmachungsdatum)\n\nRheinland-Pfalz Amtsgericht Landau HRB 31509\nLöschungsankündigung\n\nHHS-Haustechnik-Heizung-Sanitär UG (haftungsbeschränkt)\nGesellschaft mit beschränkter Haftung\nZeiskam\n\nDas Registergericht beabsichtigt die Gesellschaft von Amts wegen nach § 394 FamFG zu löschen. Die Frist zur Erhebung eines Widerspruchs ist auf einen Monat festgesetzt."
    },
    {
      "date": "2026-01-30",
      "id": "143984",
      "original_text": "Sonstige Registerbekanntmachung\nNordrhein-Westfalen Amtsgericht Paderborn HRB 16841\nLD Realestate GmbH – Delbrück",
      "type": "Sonstige Registerbekanntmachung",
      "state": "Nordrhein-Westfalen",
      "amtsgericht": "Amtsgericht Paderborn",
      "registernummer": "HRB 16841",
      "registerart": "HRB",
      "company_name": "LD Realestate GmbH",
      "company_seat": "Delbrück",
      "details": "30.01.2026 (Bekanntmachungsdatum)\n\nNordrhein-Westfalen Amtsgericht Paderborn HRB 16841\nSonstige Registerbekanntmachung 30.01.2026 (Eintragungsdatum)\n\nLD Realestate GmbH\nGesellschaft mit beschränkter Haftung\nDelbrück\n\nAls nicht eingetragen wird veröffentlicht: Den Gläubigern der Gesellschaft, deren Forderungen begründet worden sind bevor die Eintragung der Beendigung des Beherrschungs- und Gewinnabführungsvertrages  in das Handelsregister nach § 10 des Handelsgesetzbuches als bekanntgemacht gilt, hat der andere Vertragsteil Sicherheit zu leisten, wenn sie sich binnen sechs Monaten nach der Bekanntmachung der Eintragung zu diesem Zweck bei ihm melden."
    },
    {
      "date": "2026-01-30",
      "id": "143985",
      "original_text": "Sonstige Registerbekanntmachung\nNordrhein-Westfalen Amtsgericht Essen HRA 11934\nUwe Krause Sanitär & Heizungsbau e.K., Inhaber Mathhias van Leyen – Hattingen",
      "type": "Sonstige Registerbekanntmachung",
      "state": "Nordrhein-Westfalen",
      "amtsgericht": "Amtsgericht Essen",
      "registernummer": "HRA 11934",
      "registerart": "HRA",
      "company_name": "Uwe Krause Sanitär & Heizungsbau e.K., Inhaber Mathhias van Leyen",
      "company_seat": "Hattingen",
      "details": "30.01.2026 (Bekanntmachungsdatum)\n\nNordrhein-Westfalen Amtsgericht Essen HRA 11934\nSonstige Registerbekanntmachung 30.01.2026 (Eintragungsdatum)\n\nUwe Krause Sanitär & Heizungsbau e.K., Inhaber Mathhias van Leyen\nEinzelkaufmann / Einzelkauffrau\nHattingen\n\nFolgender Haftungsausschluss wird hiermit gem. §28 II HGB bekannt gegeben:\nDer Übergang der in dem Betriebe des Geschäfts entstandenen Verbindlichkeiten und Forderungen ist beim Erwerb des\nGeschäfts durch den neuen Inhaber ausgeschlossen."
    },
    {
      "date": "2026-01-30",
      "id": "143986",
      "original_text": "Löschungsankündigung\nNordrhein-Westfalen Amtsgericht Hamm HRB 8003\nAltem GmbH – Kamen",
      "type": "Löschungsankündigung",
      "state": "Nordrhein-Westfalen",
      "amtsgericht": "Amtsgericht Hamm",
      "registernummer": "HRB 8003",
      "registerart": "HRB",
      "company_name": "Altem GmbH",
      "company_seat": "Kamen",
      "details": "30.01.2026 (Bekanntmachungsdatum)\n\nNordrhein-Westfalen Amtsgericht Hamm HRB 8003\nLöschungsankündigung\n\nAltem GmbH\nGesellschaft mit beschränkter Haftung\nKamen\n\nDas Registergericht beabsichtigt die Gesellschaft von Amts wegen nach § 394 FamFG zu löschen. Die Frist zur Erhebung eines Widerspruchs ist auf drei Monate festgesetzt."
    },
    {
      "date": "2026-01-30",
      "id": "143987",
      "original_text": "Einreichung neuer Dokumente\nNordrhein-Westfalen Amtsgericht Hagen HRB 5008\nHerdecker Gemeinnützige Wohnungsgesellschaft mit beschränkter Haftung – Herdecke",
      "type": "Einreichung neuer Dokumente",
      "state": "Nordrhein-Westfalen",
      "amtsgericht": "Amtsgericht Hagen",
      "registernummer": "HRB 5008",
      "registerart": "HRB",
      "company_name": "Herdecker Gemeinnützige Wohnungsgesellschaft mit beschränkter Haftung",
      "company_seat": "Herdecke",
      "details": "30.01.2026 (Bekanntmachungsdatum)\n\nNordrhein-Westfalen Amtsgericht Hagen HRB 5008\nEinreichung neuer Dokumente\n\nHerdecker Gemeinnützige Wohnungsgesellschaft mit beschränkter Haftung\nGesellschaft mit beschränkter Haftung\nHerdecke\n\nEs wurde aktuelle Liste mit Aufsichtsratsänderungen eingereicht."
    },
    {
      "date": "2026-01-30",
      "id": "143988",
      "original_text": "Löschungsankündigung\nNordrhein-Westfalen Amtsgericht Kleve HRB 16674\nIR Infra UG (haftungsbeschränkt) – Moers",
      "type": "Löschungsankündigung",
      "state": "Nordrhein-Westfalen",
      "amtsgericht": "Amtsgericht Kleve",
      "registernummer": "HRB 16674",
      "registerart": "HRB",
      "company_name": "IR Infra UG (haftungsbeschränkt)",
      "company_seat": "Moers",
      "details": "30.01.2026 (Bekanntmachungsdatum)\n\nNordrhein-Westfalen Amtsgericht Kleve HRB 16674\nLöschungsankündigung\n\nIR Infra UG (haftungsbeschränkt)\nGesellschaft mit beschränkter Haftung\nMoers\n\nDas Registergericht beabsichtigt die Gesellschaft von Amts wegen nach § 394 FamFG zu löschen. Die Frist zur Erhebung eines Widerspruchs ist auf einen Monat festgesetzt."
    },
    {
      "date": "2026-01-30",
      "id": "143989",
      "original_text": "Einreichung neuer Dokumente\nNordrhein-Westfalen Amtsgericht Duisburg HRB 9629\nWasserwerke Dinslaken Gesellschaft mit beschränkter Haftung – Dinslaken",
      "type": "Einreichung neuer Dokumente",
      "state": "Nordrhein-Westfalen",
      "amtsgericht": "Amtsgericht Duisburg",
      "registernummer": "HRB 9629",
      "registerart": "HRB",
      "company_name": "Wasserwerke Dinslaken Gesellschaft mit beschränkter Haftung",
      "company_seat": "Dinslaken",
      "details": "30.01.2026 (Bekanntmachungsdatum)\n\nNordrhein-Westfalen Amtsgericht Duisburg HRB 9629\nEinreichung neuer Dokumente\n\nWasserwerke Dinslaken Gesellschaft mit beschränkter Haftung\nGesellschaft mit beschränkter Haftung\nDinslaken\n\nDem Registergericht ist eine Liste der Mitglieder des Aufsichtsrates eingereicht worden."
    },
    {
      "date": "2026-01-30",
      "id": "143990",
      "original_text": "Löschungsankündigung\nNordrhein-Westfalen Amtsgericht Wuppertal HRB 30185\nRACHA GmbH – Haan",
      "type": "Löschungsankündigung",
      "state": "Nordrhein-Westfalen",
      "amtsgericht": "Amtsgericht Wuppertal",
      "registernummer": "HRB 30185",
      "registerart": "HRB",
      "company_name": "RACHA GmbH",
      "company_seat": "Haan",
      "details": "30.01.2026 (Bekanntmachungsdatum)\n\nNordrhein-Westfalen Amtsgericht Wuppertal HRB 30185\nLöschungsankündigung\n\nRACHA GmbH\nGesellschaft mit beschränkter Haftung\nHaan\n\nDas Registergericht beabsichtigt die Gesellschaft von Amts wegen nach § 394 FamFG zu löschen. Die Frist zur Erhebung eines Widerspruchs ist auf einen Monat festgesetzt."
    },
    {
      "date": "2026-01-30",
      "id": "143991",
      "original_text": "Löschungsankündigung\nNordrhein-Westfalen Amtsgericht Siegburg HRB 1320\nModehaus Schwellenbach GmbH – Neunkirchen-Seelscheid",
      "type": "Löschungsankündigung",
      "state": "Nordrhein-Westfalen",
      "amtsgericht": "Amtsgericht Siegburg",
      "registernummer": "HRB 1320",
      "registerart": "HRB",
      "company_name": "Modehaus Schwellenbach GmbH",
      "company_seat": "Neunkirchen-Seelscheid",
      "details": "30.01.2026 (Bekanntmachungsdatum)\n\nNordrhein-Westfalen Amtsgericht Siegburg HRB 1320\nLöschungsankündigung\n\nModehaus Schwellenbach GmbH\nGesellschaft mit beschränkter Haftung\nNeunkirchen-Seelscheid\n\nDas Registergericht hat glaubhafte Kenntnis erlangt, dass die Gesellschaft\nvermögenslos geworden ist, da ein Insolvenzverfahren durchgeführt und nach § 200 InsO aufgehoben wurde.\n\nEs ist daher beabsichtigt, die Gesellschaft nach § 394 FamFG im\nHandelsregister wegen Vermögenslosigkeit zu löschen.\nEinwände gegen die Löschung sind durch Widerspruch binnen einer Frist von\n3 Monaten geltend zu machen, andernfalls die Löschung erfolgen wird.\nEinzulegen ist der Widerspruch bei dem Amtsgericht Siegburg, Neue\nPoststraße 16, 53721 Siegburg, und zwar entweder schriftlich in deutscher\nSprache oder mündlich zur Niederschrift der Geschäftsstelle. Der\nWiderspruch kann auch zur Niederschrift der Geschäftsstelle eines jeden\nAmtsgerichts abgegeben werden. Der Widerspruch ist binnen der in der\nVerfügung bestimmten Frist einzulegen. Die Frist ist nur gewahrt, wenn der\nWiderspruch rechtzeitig bei dem Amtsgericht Siegburg eingeht, auch wenn\nder Widerspruch zur Niederschrift der Geschäftsstelle eines anderen\nAmtsgerichts abgegeben wurde. Die Frist beginnt jeweils mit der schriftlichen\nBekanntgabe der Verfügung an die Beteiligten. Kann die schriftliche\nBekanntgabe an einen Beteiligten nicht bewirkt werden, beginnt die Frist\nspätestens mit Ablauf von fünf Monaten nach Erlass der Verfügung. Die\nBekanntgabe ist entweder durch Zustellung oder am dritten Tage nach\nAufgabe zur Post bewirkt. Sofern die Löschung noch nicht erfolgt ist, kann der\nWiderspruch auch noch nach Ablauf der Frist eingelegt werden. Fällt das\nEnde der Frist auf einen Sonnabend, einen Sonntag oder einen allgemeinen\nFeiertag, endet die Frist mit Ablauf des nächsten Werktages. Der\nWiderspruch ist zu unterzeichnen. Eine Begründung des Widerspruchs ist\nnicht vorgeschrieben."
    },
    {
      "date": "2026-01-30",
      "id": "143992",
      "original_text": "Einreichung neuer Dokumente\nNordrhein-Westfalen Amtsgericht Köln HRB 57922\n450connect GmbH – Köln",
      "type": "Einreichung neuer Dokumente",
      "state": "Nordrhein-Westfalen",
      "amtsgericht": "Amtsgericht Köln",
      "registernummer": "HRB 57922",
      "registerart": "HRB",
      "company_name": "450connect GmbH",
      "company_seat": "Köln",
      "details": "30.01.2026 (Bekanntmachungsdatum)\n\nNordrhein-Westfalen Amtsgericht Köln HRB 57922\nEinreichung neuer Dokumente\n\n450connect GmbH\nGesellschaft mit beschränkter Haftung\nKöln\n\nDem Registergericht ist eine neue Liste der Mitglieder des Aufsichtsrates eingereicht worden."
    },
    {
      "date": "2026-01-30",
      "id": "143993",
      "original_text": "Löschungsankündigung\nNordrhein-Westfalen Amtsgericht Krefeld HRB 17754\nReteca GmbH – Tönisvorst",
      "type": "Löschungsankündigung",
      "state": "Nordrhein-Westfalen",
      "amtsgericht": "Amtsgericht Krefeld",
      "registernummer": "HRB 17754",
      "registerart": "HRB",
      "company_name": "Reteca GmbH",
      "company_seat": "Tönisvorst",
      "details": "30.01.2026 (Bekanntmachungsdatum)\n\nNordrhein-Westfalen Amtsgericht Krefeld HRB 17754\nLöschungsankündigung\n\nReteca GmbH\nGesellschaft mit beschränkter Haftung\nTönisvorst\n\nDas Registergericht beabsichtigt die Gesellschaft von Amts wegen nach § 394 FamFG zu löschen. Die Frist zur Erhebung eines Widerspruchs ist auf einen Monat festgesetzt."
    },
    {
      "date": "2026-01-30",
      "id": "143994",
      "original_text": "Registerbekanntmachung nach dem Umwandlungsgesetz\nNordrhein-Westfalen Amtsgericht Paderborn HRB 15901\nINTILION Aktiengesellschaft – Paderborn",
      "type": "Registerbekanntmachung nach dem Umwandlungsgesetz",
      "state": "Nordrhein-Westfalen",
      "amtsgericht": "Amtsgericht Paderborn",
      "registernummer": "HRB 15901",
      "registerart": "HRB",
      "company_name": "INTILION Aktiengesellschaft",
      "company_seat": "Paderborn",
      "details": "30.01.2026 (Bekanntmachungsdatum)\n\nNordrhein-Westfalen Amtsgericht Paderborn HRB 15901\nRegisterbekanntmachung nach dem Umwandlungsgesetz 30.01.2026 (Eintragungsdatum)\n\nINTILION Aktiengesellschaft\nAktiengesellschaft\nPaderborn\n\nDie Gesellschaft hat Gläubigern, deren Forderungen vor dieser Bekanntmachung begründet worden sind, Sicherheit zu leisten, soweit sie nicht Befriedigung verlangen können, wenn sie sich binnen sechs Monaten zu diesem Zweck melden."
    },
    {
      "date": "2026-01-30",
      "id": "143995",
      "original_text": "Einreichung neuer Dokumente\nNordrhein-Westfalen Amtsgericht Steinfurt HRB 8030\nBurk AG – Greven",
      "type": "Einreichung neuer Dokumente",
      "state": "Nordrhein-Westfalen",
      "amtsgericht": "Amtsgericht Steinfurt",
      "registernummer": "HRB 8030",
      "registerart": "HRB",
      "company_name": "Burk AG",
      "company_seat": "Greven",
      "details": "30.01.2026 (Bekanntmachungsdatum)\n\nNordrhein-Westfalen Amtsgericht Steinfurt HRB 8030\nEinreichung neuer Dokumente 30.01.2026 (Eintragungsdatum)\n\nBurk AG\nAktiengesellschaft\nGreven\n\nDem Registergericht ist eine Liste der Mitglieder des Aufsichtsrates eingereicht worden."
    },
    {
      "date": "2026-01-30",
      "id": "143996",
      "original_text": "Registerbekanntmachung nach dem Umwandlungsgesetz\nHessen Amtsgericht Frankfurt am Main HRB 133500\nco:listic Frankfurt GmbH – Frankfurt am Main",
      "type": "Registerbekanntmachung nach dem Umwandlungsgesetz",
      "state": "Hessen",
      "amtsgericht": "Amtsgericht Frankfurt am Main",
      "registernummer": "HRB 133500",
      "registerart": "HRB",
      "company_name": "co:listic Frankfurt GmbH",
      "company_seat": "Frankfurt am Main",
      "details": "30.01.2026 (Bekanntmachungsdatum)\n\nHessen Amtsgericht Frankfurt am Main HRB 133500\nRegisterbekanntmachung nach dem Umwandlungsgesetz 30.01.2026 (Eintragungsdatum)\n\nco:listic Frankfurt GmbH\nGesellschaft mit beschränkter Haftung\nFrankfurt am Main\n\nDen Gläubigern der an der Verschmelzung beteiligten Rechtsträger ist, wenn sie binnen sechs Monaten nach dem Tag, an dem die Eintragung der Verschmelzung in das Register des Sitzes desjenigen Rechtsträgers, dessen Gläubiger sie sind, nach § 19 Absatz 3 UmwG bekannt gemacht worden ist, ihren Anspruch nach Grund und Höhe schriftlich anmelden, Sicherheit zu leisten, soweit sie nicht Befriedigung verlangen können. Dieses Recht steht den Gläubigern jedoch nur zu, wenn sie glaubhaft machen, dass durch die Verschmelzung die Erfüllung ihrer Forderung gefährdet wird."
    },
    {
      "date": "2026-01-30",
      "id": "143997",
      "original_text": "Registerbekanntmachung nach dem Umwandlungsgesetz\nHessen Amtsgericht Wiesbaden HRB 28475\nSOLIT Vertriebs GmbH – Wiesbaden",
      "type": "Registerbekanntmachung nach dem Umwandlungsgesetz",
      "state": "Hessen",
      "amtsgericht": "Amtsgericht Wiesbaden",
      "registernummer": "HRB 28475",
      "registerart": "HRB",
      "company_name": "SOLIT Vertriebs GmbH",
      "company_seat": "Wiesbaden",
      "details": "30.01.2026 (Bekanntmachungsdatum)\n\nHessen Amtsgericht Wiesbaden HRB 28475\nRegisterbekanntmachung nach dem Umwandlungsgesetz 30.01.2026 (Eintragungsdatum)\n\nSOLIT Vertriebs GmbH\nGesellschaft mit beschränkter Haftung\nWiesbaden\n\nDen Gläubigern der an der Verschmelzung beteiligten Rechtsträger ist, wenn sie binnen sechs Monaten nach dem Tag, an dem die Eintragung der Verschmelzung in das Register des Sitzes derjenigen Rechtsträger deren Gläubiger sie sind, nach § 19 Absatz 3 UmwG bekannt gemacht worden ist, ihren Anspruch nach Grund und Höhe schriftlich anmelden, Sicherheit zu leisten, soweit sie nicht Befriedigung verlangen können. Dieses Recht steht den Gläubigern jedoch nur zu, wenn sie glaubhaft machen, dass durch die Verschmelzung die Erfüllung ihrer Forderung gefährdet wird."
    },
    {
      "date": "2026-01-30",
      "id": "143998",
      "original_text": "Löschungsankündigung\nHessen Amtsgericht Friedberg HRB 8430\nDylla Bauträger GmbH – Altenstadt (Hessen)",
      "type": "Löschungsankündigung",
      "state": "Hessen",
      "amtsgericht": "Amtsgericht Friedberg",
      "registernummer": "HRB 8430",
      "registerart": "HRB",
      "company_name": "Dylla Bauträger GmbH",
      "company_seat": "Altenstadt (Hessen)",
      "details": "30.01.2026 (Bekanntmachungsdatum)\n\nHessen Amtsgericht Friedberg HRB 8430\nLöschungsankündigung 30.01.2026 (Eintragungsdatum)\n\nDylla Bauträger GmbH\nGesellschaft mit beschränkter Haftung\nAltenstadt (Hessen)\n\nDas Registergericht beabsichtigt die im Handelsregister eingetragene Gesellschaft von Amts wegen nach § 394 FamFG zu löschen. Die Frist zur Erhebung eines Widerspruchs gegen die beabsichtigte Löschung wird auf 3 Monate festgesetzt."
    },
    {
      "date": "2026-01-30",
      "id": "143999",
      "original_text": "Registerbekanntmachung nach dem Umwandlungsgesetz\nHessen Amtsgericht Frankfurt am Main HRB 105407\nTrammell Crow Germany GmbH – Frankfurt am Main",
      "type": "Registerbekanntmachung nach dem Umwandlungsgesetz",
      "state": "Hessen",
      "amtsgericht": "Amtsgericht Frankfurt am Main",
      "registernummer": "HRB 105407",
      "registerart": "HRB",
      "company_name": "Trammell Crow Germany GmbH",
      "company_seat": "Frankfurt am Main",
      "details": "30.01.2026 (Bekanntmachungsdatum)\n\nHessen Amtsgericht Frankfurt am Main HRB 105407\nRegisterbekanntmachung nach dem Umwandlungsgesetz 30.01.2026 (Eintragungsdatum)\n\nTrammell Crow Germany GmbH\nGesellschaft mit beschränkter Haftung\nFrankfurt am Main\n\nDen Gläubigern der an der Verschmelzung beteiligten Rechtsträger ist, wenn sie binnen sechs Monaten nach dem Tag, an dem die Eintragung der Verschmelzung in das Register des Sitzes desjenigen Rechtsträgers, dessen Gläubiger sie sind, nach § 19 Absatz 3 UmwG bekannt gemacht worden ist, ihren Anspruch nach Grund und Höhe schriftlich anmelden, Sicherheit zu leisten, soweit sie nicht Befriedigung verlangen können. Dieses Recht steht den Gläubigern jedoch nur zu, wenn sie glaubhaft machen, dass durch die Verschmelzung die Erfüllung ihrer Forderung gefährdet wird."
    },
    {
      "date": "2026-01-30",
      "id": "144000",
      "original_text": "Registerbekanntmachung nach dem Umwandlungsgesetz\nHessen Amtsgericht Frankfurt am Main HRB 126607\nTCC Logistics Project 12 GmbH – Frankfurt am Main",
      "type": "Registerbekanntmachung nach dem Umwandlungsgesetz",
      "state": "Hessen",
      "amtsgericht": "Amtsgericht Frankfurt am Main",
      "registernummer": "HRB 126607",
      "registerart": "HRB",
      "company_name": "TCC Logistics Project 12 GmbH",
      "company_seat": "Frankfurt am Main",
      "details": "30.01.2026 (Bekanntmachungsdatum)\n\nHessen Amtsgericht Frankfurt am Main HRB 126607\nRegisterbekanntmachung nach dem Umwandlungsgesetz 30.01.2026 (Eintragungsdatum)\n\nTCC Logistics Project 12 GmbH\nGesellschaft mit beschränkter Haftung\nFrankfurt am Main\n\nDen Gläubigern der an der Verschmelzung beteiligten Rechtsträger ist, wenn sie binnen sechs Monaten nach dem Tag, an dem die Eintragung der Verschmelzung in das Register des Sitzes desjenigen Rechtsträgers, dessen Gläubiger sie sind, nach § 19 Absatz 3 UmwG bekannt gemacht worden ist, ihren Anspruch nach Grund und Höhe schriftlich anmelden, Sicherheit zu leisten, soweit sie nicht Befriedigung verlangen können. Dieses Recht steht den Gläubigern jedoch nur zu, wenn sie glaubhaft machen, dass durch die Verschmelzung die Erfüllung ihrer Forderung gefährdet wird."
    },
    {
      "date": "2026-01-30",
      "id": "144001",
      "original_text": "Registerbekanntmachung nach dem Umwandlungsgesetz\nHessen Amtsgericht Frankfurt am Main HRB 126571\nTCC Logistics Project 11 GmbH – Frankfurt am Main",
      "type": "Registerbekanntmachung nach dem Umwandlungsgesetz",
      "state": "Hessen",
      "amtsgericht": "Amtsgericht Frankfurt am Main",
      "registernummer": "HRB 126571",
      "registerart": "HRB",
      "company_name": "TCC Logistics Project 11 GmbH",
      "company_seat": "Frankfurt am Main",
      "details": "30.01.2026 (Bekanntmachungsdatum)\n\nHessen Amtsgericht Frankfurt am Main HRB 126571\nRegisterbekanntmachung nach dem Umwandlungsgesetz 30.01.2026 (Eintragungsdatum)\n\nTCC Logistics Project 11 GmbH\nGesellschaft mit beschränkter Haftung\nFrankfurt am Main\n\nDen Gläubigern der an der Verschmelzung beteiligten Rechtsträger ist, wenn sie binnen sechs Monaten nach dem Tag, an dem die Eintragung der Verschmelzung in das Register des Sitzes desjenigen Rechtsträgers, dessen Gläubiger sie sind, nach § 19 Absatz 3 UmwG bekannt gemacht worden ist, ihren Anspruch nach Grund und Höhe schriftlich anmelden, Sicherheit zu leisten, soweit sie nicht Befriedigung verlangen können. Dieses Recht steht den Gläubigern jedoch nur zu, wenn sie glaubhaft machen, dass durch die Verschmelzung die Erfüllung ihrer Forderung gefährdet wird."
    },
    {
      "date": "2026-01-30",
      "id": "144002",
      "original_text": "Löschungsankündigung\nHessen Amtsgericht Frankfurt am Main HRB 113047\nCubus-O GmbH – Frankfurt am Main",
      "type": "Löschungsankündigung",
      "state": "Hessen",
      "amtsgericht": "Amtsgericht Frankfurt am Main",
      "registernummer": "HRB 113047",
      "registerart": "HRB",
      "company_name": "Cubus-O GmbH",
      "company_seat": "Frankfurt am Main",
      "details": "30.01.2026 (Bekanntmachungsdatum)\n\nHessen Amtsgericht Frankfurt am Main HRB 113047\nLöschungsankündigung\n\nCubus-O GmbH\nGesellschaft mit beschränkter Haftung\nFrankfurt am Main\n\nDas Registergericht beabsichtigt die im Handelsregister eingetragene Gesellschaft von Amts wegen nach § 394 FamFG zu löschen. Die Frist zur Erhebung eines Widerspruchs gegen die beabsichtigte Löschung wird auf 1 Monat festgesetzt."
    },
    {
      "date": "2026-01-30",
      "id": "144003",
      "original_text": "Löschungsankündigung\nHessen Amtsgericht Frankfurt am Main HRB 82139\nBSN. Bau-Sanierung GmbH – Frankfurt am Main",
      "type": "Löschungsankündigung",
      "state": "Hessen",
      "amtsgericht": "Amtsgericht Frankfurt am Main",
      "registernummer": "HRB 82139",
      "registerart": "HRB",
      "company_name": "BSN. Bau-Sanierung GmbH",
      "company_seat": "Frankfurt am Main",
      "details": "30.01.2026 (Bekanntmachungsdatum)\n\nHessen Amtsgericht Frankfurt am Main HRB 82139\nLöschungsankündigung\n\nBSN. Bau-Sanierung GmbH\nGesellschaft mit beschränkter Haftung\nFrankfurt am Main\n\nDas Registergericht beabsichtigt die im Handelsregister eingetragene Gesellschaft von Amts wegen nach § 394 FamFG zu löschen. Die Frist zur Erhebung eines Widerspruchs gegen die beabsichtigte Löschung wird auf 1 Monat festgesetzt."
    },
    {
      "date": "2026-01-30",
      "id": "144004",
      "original_text": "Einreichung neuer Dokumente\nHessen Amtsgericht Bad Homburg v.d.H. HRB 6596\nDeutsche Sparkassen Leasing Verwaltungs-Aktiengesellschaft – Bad Homburg v. d. Höhe",
      "type": "Einreichung neuer Dokumente",
      "state": "Hessen",
      "amtsgericht": "Amtsgericht Bad Homburg v.d.H.",
      "registernummer": "HRB 6596",
      "registerart": "HRB",
      "company_name": "Deutsche Sparkassen Leasing Verwaltungs-Aktiengesellschaft",
      "company_seat": "Bad Homburg v. d. Höhe",
      "details": "30.01.2026 (Bekanntmachungsdatum)\n\nHessen Amtsgericht Bad Homburg v.d.H. HRB 6596\nEinreichung neuer Dokumente\n\nDeutsche Sparkassen Leasing Verwaltungs-Aktiengesellschaft\nAktiengesellschaft\nBad Homburg v. d. Höhe\n\nDurch eine Änderung in den Personen der Aufsichtsratsmitglieder ist eine Liste der Mitglieder des Aufsichtsrates zum Handelsregister eingereicht worden."
    },
    {
      "date": "2026-01-30",
      "id": "144005",
      "original_text": "Löschungsankündigung\nHessen Amtsgericht Wetzlar HRB 9296\nC S Industrie- und Handelsgesellschaft GmbH – Dillenburg",
      "type": "Löschungsankündigung",
      "state": "Hessen",
      "amtsgericht": "Amtsgericht Wetzlar",
      "registernummer": "HRB 9296",
      "registerart": "HRB",
      "company_name": "C S Industrie- und Handelsgesellschaft GmbH",
      "company_seat": "Dillenburg",
      "details": "30.01.2026 (Bekanntmachungsdatum)\n\nHessen Amtsgericht Wetzlar HRB 9296\nLöschungsankündigung\n\nC S Industrie- und Handelsgesellschaft GmbH\nGesellschaft mit beschränkter Haftung\nDillenburg\n\nDas Registergericht beabsichtigt die im Handelsregister eingetragene Gesellschaft von Amts wegen nach § 394 FamFG zu löschen. Die Frist zur Erhebung eines Widerspruchs gegen die beabsichtigte Löschung wird auf 6 Wochen festgesetzt."
    }
  ]
}