{
  "date": "2026-01-05",
  "date_of_scrape": "2026-01-06T04:22:09.032Z",
  "tool_version": "0.2.0",
  "number_of_announcements": 130,
  "announcements": [
    {
      "date": "2026-01-05",
      "id": "141431",
      "original_text": "Registerbekanntmachung nach dem Umwandlungsgesetz\nBerlin Amtsgericht Berlin (Charlottenburg) HRB 250866\nCATT Cells SE – Berlin",
      "type": "Registerbekanntmachung nach dem Umwandlungsgesetz",
      "state": "Berlin",
      "amtsgericht": "Amtsgericht Berlin (Charlottenburg)",
      "registernummer": "HRB 250866",
      "registerart": "HRB",
      "company_name": "CATT Cells SE",
      "company_seat": "Berlin",
      "details": "05.01.2026 (Bekanntmachungsdatum)\n\nBerlin Amtsgericht Berlin (Charlottenburg) HRB 250866\nRegisterbekanntmachung nach dem Umwandlungsgesetz 03.01.2026 (Eintragungsdatum)\n\nCATT Cells SE\nEuropäische Aktiengesellschaft (SE)\nBerlin\n\nZu Eintragungsnummer 6 vom 03.01.2026 wird als nicht eingetragen veröffentlicht:Den Gläubigern der an der Verschmelzung beteiligten Rechtsträger ist, wenn sie binnen sechs Monaten nach dem Tag, an dem die Eintragung der Verschmelzung in das Register des Sitzes desjenigen Rechtsträgers, dessen Gläubiger sie sind, als bekannt gemacht gilt, ihren Anspruch nach Grund und Höhe schriftlich anmelden, Sicherheit zu leisten, soweit sie nicht Befriedigung verlangen können. Dieses Recht steht den Gläubigern jedoch nur zu, wenn sie glaubhaft machen, dass durch die Verschmelzung die Erfüllung ihrer Forderung gefährdet wird. Das Recht, Sicherheitsleistung zu verlangen, steht Gläubigern nicht zu, die im Falle der Insolvenz ein Recht auf vorzugsweise Befriedigung aus einer Deckungsmasse haben, die nach gesetzlicher Vorschrift zu ihrem Schutz errichtet und staatlich überwacht ist."
    },
    {
      "date": "2026-01-05",
      "id": "141432",
      "original_text": "Sonstige Registerbekanntmachung\nBerlin Amtsgericht Berlin (Charlottenburg) HRB 192413\na&o hostels Marketing GmbH – Berlin",
      "type": "Sonstige Registerbekanntmachung",
      "state": "Berlin",
      "amtsgericht": "Amtsgericht Berlin (Charlottenburg)",
      "registernummer": "HRB 192413",
      "registerart": "HRB",
      "company_name": "a&o hostels Marketing GmbH",
      "company_seat": "Berlin",
      "details": "05.01.2026 (Bekanntmachungsdatum)\n\nBerlin Amtsgericht Berlin (Charlottenburg) HRB 192413\nSonstige Registerbekanntmachung 02.01.2026 (Eintragungsdatum)\n\na&o hostels Marketing GmbH\nGesellschaft mit beschränkter Haftung\nBerlin\n\nAls eingetragen wird veröffentlicht: Der andere Vertragsteil hat den Gläubigern dieses Rechtsträgers, deren Forderungen begründet worden sind, bevor die Eintragung der Beendigung dieses Vertrages in das Handelsregister nach § 10 des Handelsgesetzbuches als bekannt gemacht gilt, Sicherheit zu leisten, wenn sie sich binnen sechs Monaten nach der Bekanntmachung der Eintragung zu diesem Zweck bei ihm melden. Dieses Recht steht den Gläubigern nicht zu, die im Fall des Insolvenzverfahrens ein Recht auf vorzugsweise Befriedigung aus der Deckungsmasse haben, die nach gesetzlicher Vorschrift zu ihrem Schutz errichtet und staatlich überwacht ist."
    },
    {
      "date": "2026-01-05",
      "id": "141433",
      "original_text": "Einreichung neuer Dokumente\nSaarland Amtsgericht Saarbrücken HRB 110941\nNeue Energien für Wadgassen GmbH (NEW GmbH) – Wadgassen",
      "type": "Einreichung neuer Dokumente",
      "state": "Saarland",
      "amtsgericht": "Amtsgericht Saarbrücken",
      "registernummer": "HRB 110941",
      "registerart": "HRB",
      "company_name": "Neue Energien für Wadgassen GmbH (NEW GmbH)",
      "company_seat": "Wadgassen",
      "details": "05.01.2026 (Bekanntmachungsdatum)\n\nSaarland Amtsgericht Saarbrücken HRB 110941\nEinreichung neuer Dokumente 05.01.2026 (Eintragungsdatum)\n\nNeue Energien für Wadgassen GmbH (NEW GmbH)\nGesellschaft mit beschränkter Haftung\nWadgassen\n\nDie Geschäftsführung der Gesellschaft hat eine Liste der Mitglieder des Aufsichtsrats zum Handelsregister eingereicht (§ 52 Abs. 3 Satz 2 GmbHG)."
    },
    {
      "date": "2026-01-05",
      "id": "141434",
      "original_text": "Löschungsankündigung\nBerlin Amtsgericht Berlin (Charlottenburg) HRB 207051\nH&T Black GmbH – Berlin",
      "type": "Löschungsankündigung",
      "state": "Berlin",
      "amtsgericht": "Amtsgericht Berlin (Charlottenburg)",
      "registernummer": "HRB 207051",
      "registerart": "HRB",
      "company_name": "H&T Black GmbH",
      "company_seat": "Berlin",
      "details": "05.01.2026 (Bekanntmachungsdatum)\n\nBerlin Amtsgericht Berlin (Charlottenburg) HRB 207051\nLöschungsankündigung\n\nH&T Black GmbH\nGesellschaft mit beschränkter Haftung\nBerlin\n\nBei der nachstehenden Gesellschaft wird das Amtslöschungsverfahren gemäß § 394 FamFG eingeleitet. Widerspruchsfrist 6 Wochen"
    },
    {
      "date": "2026-01-05",
      "id": "141435",
      "original_text": "Einreichung neuer Dokumente\nBerlin Amtsgericht Berlin (Charlottenburg) HRB 271693\nN26 SE – Berlin",
      "type": "Einreichung neuer Dokumente",
      "state": "Berlin",
      "amtsgericht": "Amtsgericht Berlin (Charlottenburg)",
      "registernummer": "HRB 271693",
      "registerart": "HRB",
      "company_name": "N26 SE",
      "company_seat": "Berlin",
      "details": "05.01.2026 (Bekanntmachungsdatum)\n\nBerlin Amtsgericht Berlin (Charlottenburg) HRB 271693\nEinreichung neuer Dokumente\n\nN26 SE\nEuropäische Aktiengesellschaft (SE)\nBerlin\n\nAls nicht eingetragen wird veröffentlicht: Es wurde eine neue Liste der Aufsichtsratsmitglieder eingereicht (§ 106 AktG)."
    },
    {
      "date": "2026-01-05",
      "id": "141436",
      "original_text": "Sonstige Registerbekanntmachung\nBerlin Amtsgericht Berlin (Charlottenburg) HRB 34953\nLTB Lasertechnik Berlin GmbH – Berlin",
      "type": "Sonstige Registerbekanntmachung",
      "state": "Berlin",
      "amtsgericht": "Amtsgericht Berlin (Charlottenburg)",
      "registernummer": "HRB 34953",
      "registerart": "HRB",
      "company_name": "LTB Lasertechnik Berlin GmbH",
      "company_seat": "Berlin",
      "details": "05.01.2026 (Bekanntmachungsdatum)\n\nBerlin Amtsgericht Berlin (Charlottenburg) HRB 34953\nSonstige Registerbekanntmachung\n\nLTB Lasertechnik Berlin GmbH\nGesellschaft mit beschränkter Haftung\nBerlin\n\nAls nicht eingetragen wird veröffentlicht:\n\nDer andere Vertragsteil hat den Gläubigern dieses Rechtsträgers, deren Forderungen begründet worden sind, bevor die Eintragung der Beendigung dieses Vertrages in das Handelsregister nach § 10 des Handelsgesetzbuches als bekannt gemacht gilt, Sicherheit zu leisten, wenn sie sich binnen sechs Monaten nach der Bekanntmachung der Eintragung zu diesem Zweck bei ihm melden. Dieses Recht steht den Gläubigern nicht zu, die im Fall des Insolvenzverfahrens ein Recht auf vorzugsweise Befriedigung aus der Deckungsmasse haben, die nach gesetzlicher Vorschrift zu ihrem Schutz errichtet und staatlich überwacht ist."
    },
    {
      "date": "2026-01-05",
      "id": "141437",
      "original_text": "Löschungsankündigung\nBerlin Amtsgericht Berlin (Charlottenburg) HRB 150336\nMagay GmbH – Berlin",
      "type": "Löschungsankündigung",
      "state": "Berlin",
      "amtsgericht": "Amtsgericht Berlin (Charlottenburg)",
      "registernummer": "HRB 150336",
      "registerart": "HRB",
      "company_name": "Magay GmbH",
      "company_seat": "Berlin",
      "details": "05.01.2026 (Bekanntmachungsdatum)\n\nBerlin Amtsgericht Berlin (Charlottenburg) HRB 150336\nLöschungsankündigung\n\nMagay GmbH\nGesellschaft mit beschränkter Haftung\nBerlin\n\nBei der nachstehenden Gesellschaft wird das Amtslöschungsverfahren gemäß § 394 FamFG eingeleitet. Widerspruchsfrist 6 Wochen"
    },
    {
      "date": "2026-01-05",
      "id": "141438",
      "original_text": "Löschungsankündigung\nBerlin Amtsgericht Berlin (Charlottenburg) HRB 156337\nFLOMI Software Entwicklungs-, Vertriebs- und Marketinggesellschaft mbH – Berlin",
      "type": "Löschungsankündigung",
      "state": "Berlin",
      "amtsgericht": "Amtsgericht Berlin (Charlottenburg)",
      "registernummer": "HRB 156337",
      "registerart": "HRB",
      "company_name": "FLOMI Software Entwicklungs-, Vertriebs- und Marketinggesellschaft mbH",
      "company_seat": "Berlin",
      "details": "05.01.2026 (Bekanntmachungsdatum)\n\nBerlin Amtsgericht Berlin (Charlottenburg) HRB 156337\nLöschungsankündigung\n\nFLOMI Software Entwicklungs-, Vertriebs- und Marketinggesellschaft mbH\nGesellschaft mit beschränkter Haftung\nBerlin\n\nBei der nachstehenden Gesellschaft wird das Amtslöschungsverfahren gemäß § 394 FamFG eingeleitet. Widerspruchsfrist 6 Wochen"
    },
    {
      "date": "2026-01-05",
      "id": "141439",
      "original_text": "Registerbekanntmachung nach dem Umwandlungsgesetz\nBaden-Württemberg Amtsgericht Mannheim HRB 730955\nMidvale Holding GmbH – Karlsruhe",
      "type": "Registerbekanntmachung nach dem Umwandlungsgesetz",
      "state": "Baden-Württemberg",
      "amtsgericht": "Amtsgericht Mannheim",
      "registernummer": "HRB 730955",
      "registerart": "HRB",
      "company_name": "Midvale Holding GmbH",
      "company_seat": "Karlsruhe",
      "details": "05.01.2026 (Bekanntmachungsdatum)\n\nBaden-Württemberg Amtsgericht Mannheim HRB 730955\nRegisterbekanntmachung nach dem Umwandlungsgesetz 05.01.2026 (Eintragungsdatum)\n\nMidvale Holding GmbH\nGesellschaft mit beschränkter Haftung\nKarlsruhe\n\nDen Gläubigern der an der Verschmelzung beteiligten Rechtsträger ist, wenn sie binnen sechs Monaten nach dem Tag, an dem die Eintragung der Verschmelzung in das Register des Sitzes desjenigen Rechtsträgers, dessen Gläubiger sie sind, nach § 19 Abs. 3 UmwG als bekanntgemacht gilt, ihren Anspruch nach Grund und Höhe schriftlich anmelden, Sicherheit zu leisten, soweit sie nicht Befriedigung verlangen können. Dieses Recht steht den Gläubigern jedoch nur zu, wenn sie glaubhaft machen, dass durch die Verschmelzung die Erfüllung ihrer Forderung gefährdet wird."
    },
    {
      "date": "2026-01-05",
      "id": "141440",
      "original_text": "Sonstige Registerbekanntmachung\nBaden-Württemberg Amtsgericht Freiburg HRB 709346\nWindpark Vogelsberg GmbH – Konstanz",
      "type": "Sonstige Registerbekanntmachung",
      "state": "Baden-Württemberg",
      "amtsgericht": "Amtsgericht Freiburg",
      "registernummer": "HRB 709346",
      "registerart": "HRB",
      "company_name": "Windpark Vogelsberg GmbH",
      "company_seat": "Konstanz",
      "details": "05.01.2026 (Bekanntmachungsdatum)\n\nBaden-Württemberg Amtsgericht Freiburg HRB 709346\nSonstige Registerbekanntmachung 02.01.2026 (Eintragungsdatum)\n\nWindpark Vogelsberg GmbH\nGesellschaft mit beschränkter Haftung\nKonstanz\n\nAls nicht eingetragen wird bekanntgemacht:\nDen Gläubigern der Gesellschaft, deren Forderungen begründet worden sind, bevor die Eintragung der Beendigung des Vertrages in das Handelsregister nach § 10 HGB als bekanntgemacht gilt, ist vom anderen Vertragsteil Sicherheit zu leisten, wenn sie sich binnen sechs Monaten nach der Bekanntmachung zu diesem Zweck bei ihm melden."
    },
    {
      "date": "2026-01-05",
      "id": "141441",
      "original_text": "Sonstige Registerbekanntmachung\nMecklenburg-Vorpommern Amtsgericht Schwerin HRB 8410\nHuman Med AG – Schwerin",
      "type": "Sonstige Registerbekanntmachung",
      "state": "Mecklenburg-Vorpommern",
      "amtsgericht": "Amtsgericht Schwerin",
      "registernummer": "HRB 8410",
      "registerart": "HRB",
      "company_name": "Human Med AG",
      "company_seat": "Schwerin",
      "details": "05.01.2026 (Bekanntmachungsdatum)\n\nMecklenburg-Vorpommern Amtsgericht Schwerin HRB 8410\nSonstige Registerbekanntmachung 05.01.2026 (Eintragungsdatum)\n\nHuman Med AG\nAktiengesellschaft\nSchwerin"
    },
    {
      "date": "2026-01-05",
      "id": "141442",
      "original_text": "Einreichung neuer Dokumente\nBrandenburg Amtsgericht Neuruppin HRB 3341\nBBG Beteiligungs- und Beratungsgesellschaft mbH – Hennigsdorf",
      "type": "Einreichung neuer Dokumente",
      "state": "Brandenburg",
      "amtsgericht": "Amtsgericht Neuruppin",
      "registernummer": "HRB 3341",
      "registerart": "HRB",
      "company_name": "BBG Beteiligungs- und Beratungsgesellschaft mbH",
      "company_seat": "Hennigsdorf",
      "details": "05.01.2026 (Bekanntmachungsdatum)\n\nBrandenburg Amtsgericht Neuruppin HRB 3341\nEinreichung neuer Dokumente\n\nBBG Beteiligungs- und Beratungsgesellschaft mbH\nGesellschaft mit beschränkter Haftung\nHennigsdorf\n\nAls nicht eingetragen wird veröffentlicht: Eine Liste der Mitglieder des Aufsichtsrates wurde zum Handelsregister eingereicht."
    },
    {
      "date": "2026-01-05",
      "id": "141443",
      "original_text": "Registerbekanntmachung nach dem Umwandlungsgesetz\nBerlin Amtsgericht Berlin (Charlottenburg) HRB 8\nKolibri Immobilien Holding GmbH – Berlin",
      "type": "Registerbekanntmachung nach dem Umwandlungsgesetz",
      "state": "Berlin",
      "amtsgericht": "Amtsgericht Berlin (Charlottenburg)",
      "registernummer": "HRB 8",
      "registerart": "HRB",
      "company_name": "Kolibri Immobilien Holding GmbH",
      "company_seat": "Berlin",
      "details": "05.01.2026 (Bekanntmachungsdatum)\n\nBerlin Amtsgericht Berlin (Charlottenburg) HRB 8\nRegisterbekanntmachung nach dem Umwandlungsgesetz 29.12.2025 (Eintragungsdatum)\n\nKolibri Immobilien Holding GmbH\nGesellschaft mit beschränkter Haftung\nBerlin\n\nZu Eintragungsnummer 21 vom 29.12.2025 wird als nicht eingetragen veröffentlicht: Den Gläubigern der an der Verschmelzung beteiligten Rechtsträger ist, wenn sie binnen sechs Monaten nach dem Tag, an dem die Eintragung der Verschmelzung in das Register des Sitzes desjenigen Rechtsträgers, dessen Gläubiger sie sind, als bekannt gemacht gilt, ihren Anspruch nach Grund und Höhe schriftlich anmelden, Sicherheit zu leisten, soweit sie nicht Befriedigung verlangen können. Dieses Recht steht den Gläubigern jedoch nur zu, wenn sie glaubhaft machen, dass durch die Verschmelzung die Erfüllung ihrer Forderung gefährdet wird. Das Recht, Sicherheitsleistung zu verlangen, steht Gläubigern nicht zu, die im Falle der Insolvenz ein Recht auf vorzugsweise Befriedigung aus einer Deckungsmasse haben, die nach gesetzlicher Vorschrift zu ihrem Schutz errichtet und staatlich überwacht ist."
    },
    {
      "date": "2026-01-05",
      "id": "141444",
      "original_text": "Sonstige Registerbekanntmachung\nSachsen-Anhalt Amtsgericht Stendal HRB 24100\nWeber Magdeburg GmbH – Magdeburg",
      "type": "Sonstige Registerbekanntmachung",
      "state": "Sachsen-Anhalt",
      "amtsgericht": "Amtsgericht Stendal",
      "registernummer": "HRB 24100",
      "registerart": "HRB",
      "company_name": "Weber Magdeburg GmbH",
      "company_seat": "Magdeburg",
      "details": "05.01.2026 (Bekanntmachungsdatum)\n\nSachsen-Anhalt Amtsgericht Stendal HRB 24100\nSonstige Registerbekanntmachung 05.01.2026 (Eintragungsdatum)\n\nWeber Magdeburg GmbH\nGesellschaft mit beschränkter Haftung\nMagdeburg\n\nNicht eingetragen:\nAls nicht eingetragen wird veröffentlicht: Den Gläubigern der Gesellschaft, deren Forderungen begründet worden sind bevor die Eintragung der Beendigung des #DV.Art(Text=\"Art des Vertrages auswählen\",Eingabe=\"Beherrschungs- und Gewinnabführungsvertrages\",\"Beherrschungsvertrages\",\"Gewinnabführungsvertrages\",\"Teilgewinnabführungsvertrages\")  in das Handelsregister nach § 10 des Handelsgesetzbuches als bekanntgemacht gilt, hat der andere Vertragsteil Sicherheit zu leisten, wenn sie sich binnen sechs Monaten nach der Bekanntmachung der Eintragung zu diesem Zweck bei ihm melden."
    },
    {
      "date": "2026-01-05",
      "id": "141445",
      "original_text": "Sonstige Registerbekanntmachung\nSachsen-Anhalt Amtsgericht Stendal HRB 24100\nWeber Magdeburg GmbH – Magdeburg",
      "type": "Sonstige Registerbekanntmachung",
      "state": "Sachsen-Anhalt",
      "amtsgericht": "Amtsgericht Stendal",
      "registernummer": "HRB 24100",
      "registerart": "HRB",
      "company_name": "Weber Magdeburg GmbH",
      "company_seat": "Magdeburg",
      "details": "05.01.2026 (Bekanntmachungsdatum)\n\nSachsen-Anhalt Amtsgericht Stendal HRB 24100\nSonstige Registerbekanntmachung 05.01.2026 (Eintragungsdatum)\n\nWeber Magdeburg GmbH\nGesellschaft mit beschränkter Haftung\nMagdeburg\n\nNicht eingetragen:\nAls nicht eingetragen wird veröffentlicht: Den Gläubigern der Gesellschaft, deren Forderungen begründet worden sind, bevor die Eintragung der Beendigung des Ergebnisabführungsvertrages  in das Handelsregister nach § 10 des Handelsgesetzbuches als bekanntgemacht gilt, hat der andere Vertragsteil Sicherheit zu leisten, wenn sie sich binnen sechs Monaten nach der Bekanntmachung der Eintragung zu diesem Zweck bei ihm melden."
    },
    {
      "date": "2026-01-05",
      "id": "141446",
      "original_text": "Registerbekanntmachung nach dem Umwandlungsgesetz\nHamburg Amtsgericht Hamburg HRB 60801\nSENATOR International Spedition GmbH – Hamburg",
      "type": "Registerbekanntmachung nach dem Umwandlungsgesetz",
      "state": "Hamburg",
      "amtsgericht": "Amtsgericht Hamburg",
      "registernummer": "HRB 60801",
      "registerart": "HRB",
      "company_name": "SENATOR International Spedition GmbH",
      "company_seat": "Hamburg",
      "details": "05.01.2026 (Bekanntmachungsdatum)\n\nHamburg Amtsgericht Hamburg HRB 60801\nRegisterbekanntmachung nach dem Umwandlungsgesetz 05.01.2026 (Eintragungsdatum)\n\nSENATOR International Spedition GmbH\nGesellschaft mit beschränkter Haftung\nHamburg\n\nAls nicht eingetragen wird bekannt gemacht:\nDen Gläubigern der an der Verschmelzung beteiligten Gesellschaften ist, wenn sie binnen sechs Monaten nach dem Tag, an dem die Eintragung der Verschmelzung in das Register des Sitzes derjenigen Rechtsträger deren Gläubiger sie sind, nach § 19 Absatz 3 UmwG als bekannt gemacht gilt, ihren Anspruch nach Grund und Höhe schriftlich anmelden, Sicherheit zu leisten, soweit sie nicht Befriedigung verlangen können. Dieses Recht steht den Gläubigern jedoch nur zu, wenn sie glaubhaft machen, dass durch die Verschmelzung die Erfüllung ihrer Forderung gefährdet wird."
    },
    {
      "date": "2026-01-05",
      "id": "141447",
      "original_text": "Registerbekanntmachung nach dem Umwandlungsgesetz\nHamburg Amtsgericht Hamburg HRB 105125\nSENATOR International Logistics GmbH – Hamburg",
      "type": "Registerbekanntmachung nach dem Umwandlungsgesetz",
      "state": "Hamburg",
      "amtsgericht": "Amtsgericht Hamburg",
      "registernummer": "HRB 105125",
      "registerart": "HRB",
      "company_name": "SENATOR International Logistics GmbH",
      "company_seat": "Hamburg",
      "details": "05.01.2026 (Bekanntmachungsdatum)\n\nHamburg Amtsgericht Hamburg HRB 105125\nRegisterbekanntmachung nach dem Umwandlungsgesetz 05.01.2026 (Eintragungsdatum)\n\nSENATOR International Logistics GmbH\nGesellschaft mit beschränkter Haftung\nHamburg\n\nAls nicht eingetragen wird bekannt gemacht:\nDen Gläubigern der an der Verschmelzung beteiligten Gesellschaften ist, wenn sie binnen sechs Monaten nach dem Tag, an dem die Eintragung der Verschmelzung in das Register des Sitzes desjenigen Rechtsträgers, dessen Gläubiger sie sind, nach § 19 Absatz 3 UmwG als bekannt gemacht gilt, ihren Anspruch nach Grund und Höhe schriftlich anmelden, Sicherheit zu leisten, soweit sie nicht Befriedigung verlangen können. Dieses Recht steht den Gläubigern jedoch nur zu, wenn sie glaubhaft machen, dass durch die Verschmelzung die Erfüllung ihrer Forderung gefährdet wird."
    },
    {
      "date": "2026-01-05",
      "id": "141448",
      "original_text": "Registerbekanntmachung nach dem Umwandlungsgesetz\nHamburg Amtsgericht Hamburg HRB 195352\nSENATOR International Verpackungs GmbH – Hamburg",
      "type": "Registerbekanntmachung nach dem Umwandlungsgesetz",
      "state": "Hamburg",
      "amtsgericht": "Amtsgericht Hamburg",
      "registernummer": "HRB 195352",
      "registerart": "HRB",
      "company_name": "SENATOR International Verpackungs GmbH",
      "company_seat": "Hamburg",
      "details": "05.01.2026 (Bekanntmachungsdatum)\n\nHamburg Amtsgericht Hamburg HRB 195352\nRegisterbekanntmachung nach dem Umwandlungsgesetz 05.01.2026 (Eintragungsdatum)\n\nSENATOR International Verpackungs GmbH\nGesellschaft mit beschränkter Haftung\nHamburg\n\nAls nicht eingetragen wird bekannt gemacht:\nDen Gläubigern der an der Verschmelzung beteiligten Gesellschaften ist, wenn sie binnen sechs Monaten nach dem Tag, an dem die Eintragung der Verschmelzung in das Register des Sitzes desjenigen Rechtsträgers, dessen Gläubiger sie sind, nach § 19 Absatz 3 UmwG als bekannt gemacht gilt, ihren Anspruch nach Grund und Höhe schriftlich anmelden, Sicherheit zu leisten, soweit sie nicht Befriedigung verlangen können. Dieses Recht steht den Gläubigern jedoch nur zu, wenn sie glaubhaft machen, dass durch die Verschmelzung die Erfüllung ihrer Forderung gefährdet wird."
    },
    {
      "date": "2026-01-05",
      "id": "141449",
      "original_text": "Registerbekanntmachung nach dem Umwandlungsgesetz\nHamburg Amtsgericht Hamburg HRB 151294\nStar Container GmbH – Hamburg",
      "type": "Registerbekanntmachung nach dem Umwandlungsgesetz",
      "state": "Hamburg",
      "amtsgericht": "Amtsgericht Hamburg",
      "registernummer": "HRB 151294",
      "registerart": "HRB",
      "company_name": "Star Container GmbH",
      "company_seat": "Hamburg",
      "details": "05.01.2026 (Bekanntmachungsdatum)\n\nHamburg Amtsgericht Hamburg HRB 151294\nRegisterbekanntmachung nach dem Umwandlungsgesetz 05.01.2026 (Eintragungsdatum)\n\nStar Container GmbH\nGesellschaft mit beschränkter Haftung\nHamburg\n\nAls nicht eingetragen wird bekannt gemacht:\nDen Gläubigern der an der Verschmelzung beteiligten Gesellschaften ist, wenn sie binnen sechs Monaten nach dem Tag, an dem die Eintragung der Verschmelzung in das Register des Sitzes desjenigen Rechtsträgers, dessen Gläubiger sie sind, nach § 19 Absatz 3 UmwG als bekannt gemacht gilt, ihren Anspruch nach Grund und Höhe schriftlich anmelden, Sicherheit zu leisten, soweit sie nicht Befriedigung verlangen können. Dieses Recht steht den Gläubigern jedoch nur zu, wenn sie glaubhaft machen, dass durch die Verschmelzung die Erfüllung ihrer Forderung gefährdet wird."
    },
    {
      "date": "2026-01-05",
      "id": "141450",
      "original_text": "Löschungsankündigung\nBerlin Amtsgericht Berlin (Charlottenburg) HRB 215635\nB. F. Bau GmbH – Berlin",
      "type": "Löschungsankündigung",
      "state": "Berlin",
      "amtsgericht": "Amtsgericht Berlin (Charlottenburg)",
      "registernummer": "HRB 215635",
      "registerart": "HRB",
      "company_name": "B. F. Bau GmbH",
      "company_seat": "Berlin",
      "details": "05.01.2026 (Bekanntmachungsdatum)\n\nBerlin Amtsgericht Berlin (Charlottenburg) HRB 215635\nLöschungsankündigung\n\nB. F. Bau GmbH\nGesellschaft mit beschränkter Haftung\nBerlin\n\nBei der nachstehenden Gesellschaft wird das Amtslöschungsverfahren gemäß § 394 FamFG eingeleitet. Widerspruchsfrist 6 Wochen"
    },
    {
      "date": "2026-01-05",
      "id": "141451",
      "original_text": "Sonstige Registerbekanntmachung\nSchleswig-Holstein Amtsgericht Kiel HRB 21737\nidentytag GmbH – Neumünster",
      "type": "Sonstige Registerbekanntmachung",
      "state": "Schleswig-Holstein",
      "amtsgericht": "Amtsgericht Kiel",
      "registernummer": "HRB 21737",
      "registerart": "HRB",
      "company_name": "identytag GmbH",
      "company_seat": "Neumünster",
      "details": "05.01.2026 (Bekanntmachungsdatum)\n\nSchleswig-Holstein Amtsgericht Kiel HRB 21737\nSonstige Registerbekanntmachung 02.01.2026 (Eintragungsdatum)\n\nidentytag GmbH\nGesellschaft mit beschränkter Haftung\nNeumünster\n\nAls nicht eingetragen wird veröffentlicht: Den Gläubigern der Gesellschaft, deren Forderungen begründet worden sind, bevor die Eintragung der Beendigung des Vertrages in das Handelsregister nach § 10 HGB bekannt gemacht worden ist, ist vom anderen Vertragspartner Sicherheit zu leisten, wenn sie sich binnen sechs Monaten nach Bekanntmachung der Eintragung zu diesem Zweck bei ihm melden."
    },
    {
      "date": "2026-01-05",
      "id": "141452",
      "original_text": "Löschungsankündigung\nBaden-Württemberg Amtsgericht Freiburg HRB 725360\nImpulse Estate GmbH – Konstanz",
      "type": "Löschungsankündigung",
      "state": "Baden-Württemberg",
      "amtsgericht": "Amtsgericht Freiburg",
      "registernummer": "HRB 725360",
      "registerart": "HRB",
      "company_name": "Impulse Estate GmbH",
      "company_seat": "Konstanz",
      "details": "05.01.2026 (Bekanntmachungsdatum)\n\nBaden-Württemberg Amtsgericht Freiburg HRB 725360\nLöschungsankündigung\n\nImpulse Estate GmbH\nGesellschaft mit beschränkter Haftung\nKonstanz\n\nDas Gericht beabsichtigt, die Gesellschaft wegen Vermögenslosigkeit im Handelsregister von Amts wegen nach § 394 FamFG zu löschen. Die Frist zur Geltendmachung eines Widerspruchs gegen die beabsichtigte Löschung ist auf drei Wochen ab Veröffentlichung bestimmt."
    },
    {
      "date": "2026-01-05",
      "id": "141453",
      "original_text": "Einreichung neuer Dokumente\nBerlin Amtsgericht Berlin (Charlottenburg) HRB 219108\nmomox Services GmbH – Berlin",
      "type": "Einreichung neuer Dokumente",
      "state": "Berlin",
      "amtsgericht": "Amtsgericht Berlin (Charlottenburg)",
      "registernummer": "HRB 219108",
      "registerart": "HRB",
      "company_name": "momox Services GmbH",
      "company_seat": "Berlin",
      "details": "05.01.2026 (Bekanntmachungsdatum)\n\nBerlin Amtsgericht Berlin (Charlottenburg) HRB 219108\nEinreichung neuer Dokumente\n\nmomox Services GmbH\nGesellschaft mit beschränkter Haftung\nBerlin\n\nAls nicht eingetragen wird veröffentlicht: Es wurde eine neue Liste der Aufsichtsratsmitglieder eingereicht (§52 GmbHG)."
    },
    {
      "date": "2026-01-05",
      "id": "141454",
      "original_text": "Löschungsankündigung\nBaden-Württemberg Amtsgericht Mannheim HRB 734824\nInfinity EU GmbH – Wiesloch",
      "type": "Löschungsankündigung",
      "state": "Baden-Württemberg",
      "amtsgericht": "Amtsgericht Mannheim",
      "registernummer": "HRB 734824",
      "registerart": "HRB",
      "company_name": "Infinity EU GmbH",
      "company_seat": "Wiesloch",
      "details": "05.01.2026 (Bekanntmachungsdatum)\n\nBaden-Württemberg Amtsgericht Mannheim HRB 734824\nLöschungsankündigung\n\nInfinity EU GmbH\nGesellschaft mit beschränkter Haftung\nWiesloch\n\nDas Gericht beabsichtigt, die Eintragung des Geschäftsführers im Handelsregister wegen des Mangels einer wesentlichen Voraussetzung von Amts wegen nach § 395 FamFG als unzulässig zu löschen. Die Frist zur Geltendmachung eines Widerspruchs gegen die beabsichtigte Löschung ist auf einen Monat ab Veröffentlichung bestimmt."
    },
    {
      "date": "2026-01-05",
      "id": "141455",
      "original_text": "Registerbekanntmachung nach dem Umwandlungsgesetz\nBaden-Württemberg Amtsgericht Stuttgart HRB 230292\nBattenschlag Verwaltungsgesellschaft mit beschränkter Haftung – Kirchheim unter Teck",
      "type": "Registerbekanntmachung nach dem Umwandlungsgesetz",
      "state": "Baden-Württemberg",
      "amtsgericht": "Amtsgericht Stuttgart",
      "registernummer": "HRB 230292",
      "registerart": "HRB",
      "company_name": "Battenschlag Verwaltungsgesellschaft mit beschränkter Haftung",
      "company_seat": "Kirchheim unter Teck",
      "details": "05.01.2026 (Bekanntmachungsdatum)\n\nBaden-Württemberg Amtsgericht Stuttgart HRB 230292\nRegisterbekanntmachung nach dem Umwandlungsgesetz 05.01.2026 (Eintragungsdatum)\n\nBattenschlag Verwaltungsgesellschaft mit beschränkter Haftung\nGesellschaft mit beschränkter Haftung\nKirchheim unter Teck\n\nDen Gläubigern der an der Verschmelzung beteiligten Rechtsträger ist, wenn sie binnen sechs Monaten nach dem Tag, an dem die Eintragung der Verschmelzung in das Register des Sitzes desjenigen Rechtsträgers, dessen Gläubiger sie sind, nach § 19 Abs. 3 UmwG als bekanntgemacht gilt, ihren Anspruch nach Grund und Höhe schriftlich anmelden, Sicherheit zu leisten, soweit sie nicht Befriedigung verlangen können. Dieses Recht steht den Gläubigern jedoch nur zu, wenn sie glaubhaft machen, dass durch die Verschmelzung die Erfüllung ihrer Forderung gefährdet wird."
    },
    {
      "date": "2026-01-05",
      "id": "141456",
      "original_text": "Registerbekanntmachung nach dem Umwandlungsgesetz\nBerlin Amtsgericht Berlin (Charlottenburg) HRB 239676\nKIYAM GmbH – Berlin",
      "type": "Registerbekanntmachung nach dem Umwandlungsgesetz",
      "state": "Berlin",
      "amtsgericht": "Amtsgericht Berlin (Charlottenburg)",
      "registernummer": "HRB 239676",
      "registerart": "HRB",
      "company_name": "KIYAM GmbH",
      "company_seat": "Berlin",
      "details": "05.01.2026 (Bekanntmachungsdatum)\n\nBerlin Amtsgericht Berlin (Charlottenburg) HRB 239676\nRegisterbekanntmachung nach dem Umwandlungsgesetz 30.12.2025 (Eintragungsdatum)\n\nKIYAM GmbH\nGesellschaft mit beschränkter Haftung\nBerlin\n\nZu Eintragungsnummer 5 vom 30.12.2025 wird als nicht eingetragen veröffentlicht: Den Gläubigern ist, wenn sie binnen sechs Monaten nach dem Tag, an dem die Eintragung der Umwandlung als bekannt gemacht gilt, ihren Anspruch nach Grund und Höhe schriftlich anmelden, Sicherheit zu leisten, soweit sie nicht Befriedigung verlangen können. Dieses Recht steht den Gläubigern jedoch nur zu, wenn sie glaubhaft machen, dass durch die Umwandlung die Erfüllung ihrer Forderung gefährdet wird. Das Recht, Sicherheitsleistung zu verlangen, steht Gläubigern nicht zu, die im Falle der Insolvenz ein Recht auf vorzugsweise Befriedigung aus einer Deckungsmasse haben, die nach gesetzlicher Vorschrift zu ihrem Schutz errichtet und staatlich überwacht ist."
    },
    {
      "date": "2026-01-05",
      "id": "141457",
      "original_text": "Registerbekanntmachung nach dem Umwandlungsgesetz\nBerlin Amtsgericht Berlin (Charlottenburg) HRA 65078\nKIYAM GmbH & Co. KG – Berlin",
      "type": "Registerbekanntmachung nach dem Umwandlungsgesetz",
      "state": "Berlin",
      "amtsgericht": "Amtsgericht Berlin (Charlottenburg)",
      "registernummer": "HRA 65078",
      "registerart": "HRA",
      "company_name": "KIYAM GmbH & Co. KG",
      "company_seat": "Berlin",
      "details": "05.01.2026 (Bekanntmachungsdatum)\n\nBerlin Amtsgericht Berlin (Charlottenburg) HRA 65078\nRegisterbekanntmachung nach dem Umwandlungsgesetz 30.12.2025 (Eintragungsdatum)\n\nKIYAM GmbH & Co. KG\nKommanditgesellschaft\nBerlin\n\nZu Eintragungsnummer 1 vom 30.12.2025 wird als nicht eingetragen veröffentlicht: Den Gläubigern ist, wenn sie binnen sechs Monaten nach dem Tag, an dem die Eintragung der Umwandlung als bekannt gemacht gilt, ihren Anspruch nach Grund und Höhe schriftlich anmelden, Sicherheit zu leisten, soweit sie nicht Befriedigung verlangen können. Dieses Recht steht den Gläubigern jedoch nur zu, wenn sie glaubhaft machen, dass durch die Umwandlung die Erfüllung ihrer Forderung gefährdet wird. Das Recht, Sicherheitsleistung zu verlangen, steht Gläubigern nicht zu, die im Falle der Insolvenz ein Recht auf vorzugsweise Befriedigung aus einer Deckungsmasse haben, die nach gesetzlicher Vorschrift zu ihrem Schutz errichtet und staatlich überwacht ist."
    },
    {
      "date": "2026-01-05",
      "id": "141458",
      "original_text": "Registerbekanntmachung nach dem Umwandlungsgesetz\nHamburg Amtsgericht Hamburg HRA 132382\nJEKU Sanitätshaus e.K. – Hamburg",
      "type": "Registerbekanntmachung nach dem Umwandlungsgesetz",
      "state": "Hamburg",
      "amtsgericht": "Amtsgericht Hamburg",
      "registernummer": "HRA 132382",
      "registerart": "HRA",
      "company_name": "JEKU Sanitätshaus e.K.",
      "company_seat": "Hamburg",
      "details": "05.01.2026 (Bekanntmachungsdatum)\n\nHamburg Amtsgericht Hamburg HRA 132382\nRegisterbekanntmachung nach dem Umwandlungsgesetz 05.01.2026 (Eintragungsdatum)\n\nJEKU Sanitätshaus e.K.\nEinzelkaufmann\nHamburg\n\nAls nicht eingetragen wird bekannt gemacht:\nDen Gläubigern der an der Ausgliederung beteiligten Rechtsträger ist, wenn sie binnen sechs Monaten nach dem Tag, an dem die Eintragung der Ausgliederung in das Register des Sitzes desjenigen Rechtsträgers, dessen Gläubiger sie sind, nach § 19 Absatz 3 UmwG als bekannt gemacht gilt, ihren Anspruch nach Grund und Höhe schriftlich anmelden, Sicherheit zu leisten, soweit sie nicht Befriedigung verlangen können. Dieses Recht steht den Gläubigern jedoch nur zu, wenn sie glaubhaft machen, dass durch die Ausgliederung die Erfüllung ihrer Forderung gefährdet wird."
    },
    {
      "date": "2026-01-05",
      "id": "141459",
      "original_text": "Registerbekanntmachung nach dem Umwandlungsgesetz\nHamburg Amtsgericht Hamburg HRA 132341\nSanitätshaus Kutschke GmbH & Co. KG – Hamburg",
      "type": "Registerbekanntmachung nach dem Umwandlungsgesetz",
      "state": "Hamburg",
      "amtsgericht": "Amtsgericht Hamburg",
      "registernummer": "HRA 132341",
      "registerart": "HRA",
      "company_name": "Sanitätshaus Kutschke GmbH & Co. KG",
      "company_seat": "Hamburg",
      "details": "05.01.2026 (Bekanntmachungsdatum)\n\nHamburg Amtsgericht Hamburg HRA 132341\nRegisterbekanntmachung nach dem Umwandlungsgesetz 05.01.2026 (Eintragungsdatum)\n\nSanitätshaus Kutschke GmbH & Co. KG\nKommanditgesellschaft\nHamburg\n\nAls nicht eingetragen wird bekannt gemacht:\nDen Gläubigern der an der Ausgliederung beteiligten Rechtsträger ist, wenn sie binnen sechs Monaten nach dem Tag, an dem die Eintragung der Ausgliederung in das Register des Sitzes desjenigen Rechtsträgers, dessen Gläubiger sie sind, nach § 19 Absatz 3 UmwG als bekannt gemacht gilt, ihren Anspruch nach Grund und Höhe schriftlich anmelden, Sicherheit zu leisten, soweit sie nicht Befriedigung verlangen können. Dieses Recht steht den Gläubigern jedoch nur zu, wenn sie glaubhaft machen, dass durch die Ausgliederung die Erfüllung ihrer Forderung gefährdet wird."
    },
    {
      "date": "2026-01-05",
      "id": "141460",
      "original_text": "Sonstige Registerbekanntmachung\nBrandenburg Amtsgericht Potsdam HRB 25490\nSonnenhof GmbH – Zossen",
      "type": "Sonstige Registerbekanntmachung",
      "state": "Brandenburg",
      "amtsgericht": "Amtsgericht Potsdam",
      "registernummer": "HRB 25490",
      "registerart": "HRB",
      "company_name": "Sonnenhof GmbH",
      "company_seat": "Zossen",
      "details": "05.01.2026 (Bekanntmachungsdatum)\n\nBrandenburg Amtsgericht Potsdam HRB 25490\nSonstige Registerbekanntmachung\n\nSonnenhof GmbH\nGesellschaft mit beschränkter Haftung\nZossen\n\nAls nicht eingetragen wird veröffentlicht: Den Gläubigern der Gesellschaft, deren Forderungen begründet worden sind, bevor die Eintragung der Beendigung des Vertrages in das Handelsregister  nach § 10 des Handelsgesetzbuches bekannt gemacht worden ist, ist, wenn sie sich binnen sechs Monaten nach der Bekanntmachung  der Eintragung zu diesem Zweck bei ihm melden durch den anderen Vertragsteil, Sicherheit zu leisten."
    },
    {
      "date": "2026-01-05",
      "id": "141461",
      "original_text": "Registerbekanntmachung nach dem Umwandlungsgesetz\nBerlin Amtsgericht Berlin (Charlottenburg) HRB 99457\nFreund & Partner GmbH Steuerberatungsgesellschaft – Berlin",
      "type": "Registerbekanntmachung nach dem Umwandlungsgesetz",
      "state": "Berlin",
      "amtsgericht": "Amtsgericht Berlin (Charlottenburg)",
      "registernummer": "HRB 99457",
      "registerart": "HRB",
      "company_name": "Freund & Partner GmbH Steuerberatungsgesellschaft",
      "company_seat": "Berlin",
      "details": "05.01.2026 (Bekanntmachungsdatum)\n\nBerlin Amtsgericht Berlin (Charlottenburg) HRB 99457\nRegisterbekanntmachung nach dem Umwandlungsgesetz 22.12.2025 (Eintragungsdatum)\n\nFreund & Partner GmbH Steuerberatungsgesellschaft\nGesellschaft mit beschränkter Haftung\nBerlin\n\nZu Eintragungsnummer 40 vom 22.12.2025 wird als nicht eingetragen veröffentlicht:Den Gläubigern der an der Verschmelzung beteiligten Rechtsträger ist, wenn sie binnen sechs Monaten nach dem Tag, an dem die Eintragung der Verschmelzung in das Register des Sitzes desjenigen Rechtsträgers, dessen Gläubiger sie sind, als bekannt gemacht gilt, ihren Anspruch nach Grund und Höhe schriftlich anmelden, Sicherheit zu leisten, soweit sie nicht Befriedigung verlangen können. Dieses Recht steht den Gläubigern jedoch nur zu, wenn sie glaubhaft machen, dass durch die Verschmelzung die Erfüllung ihrer Forderung gefährdet wird. Das Recht, Sicherheitsleistung zu verlangen, steht Gläubigern nicht zu, die im Falle der Insolvenz ein Recht auf vorzugsweise Befriedigung aus einer Deckungsmasse haben, die nach gesetzlicher Vorschrift zu ihrem Schutz errichtet und staatlich überwacht ist."
    },
    {
      "date": "2026-01-05",
      "id": "141462",
      "original_text": "Registerbekanntmachung nach dem Umwandlungsgesetz\nBrandenburg Amtsgericht Frankfurt/Oder HRB 19413\nOlaf Zahl Fischerei GmbH – Tauche",
      "type": "Registerbekanntmachung nach dem Umwandlungsgesetz",
      "state": "Brandenburg",
      "amtsgericht": "Amtsgericht Frankfurt/Oder",
      "registernummer": "HRB 19413",
      "registerart": "HRB",
      "company_name": "Olaf Zahl Fischerei GmbH",
      "company_seat": "Tauche",
      "details": "05.01.2026 (Bekanntmachungsdatum)\n\nBrandenburg Amtsgericht Frankfurt/Oder HRB 19413\nRegisterbekanntmachung nach dem Umwandlungsgesetz 02.01.2026 (Eintragungsdatum)\n\nOlaf Zahl Fischerei GmbH\nGesellschaft mit beschränkter Haftung\nTauche\n\nZu Eintragungsnummer 5 vom 02.01.2026 wird als nicht eingetragen veröffentlicht: Als nicht eingetragen wird veröffentlicht:\nDen Gläubigern der an der Verschmelzung beteiligten Rechtsträger ist, wenn sie binnen sechs Monaten nach dem Tag, an dem die Eintragung der Verschmelzung in das Register des Sitzes desjenigen Rechtsträgers, dessen Gläubiger sie sind, als bekannt gemacht gilt, ihren Anspruch nach Grund und Höhe schriftlich anmelden, Sicherheit zu leisten, soweit sie nicht Befriedigung verlangen können. Dieses Recht steht den Gläubigern jedoch nur zu, wenn sie glaubhaft machen, dass durch die Verschmelzung die Erfüllung ihrer Forderung gefährdet wird"
    },
    {
      "date": "2026-01-05",
      "id": "141463",
      "original_text": "Registerbekanntmachung nach dem Umwandlungsgesetz\nBerlin Amtsgericht Berlin (Charlottenburg) HRB 99457\nFreund & Partner GmbH Steuerberatungsgesellschaft – Berlin",
      "type": "Registerbekanntmachung nach dem Umwandlungsgesetz",
      "state": "Berlin",
      "amtsgericht": "Amtsgericht Berlin (Charlottenburg)",
      "registernummer": "HRB 99457",
      "registerart": "HRB",
      "company_name": "Freund & Partner GmbH Steuerberatungsgesellschaft",
      "company_seat": "Berlin",
      "details": "05.01.2026 (Bekanntmachungsdatum)\n\nBerlin Amtsgericht Berlin (Charlottenburg) HRB 99457\nRegisterbekanntmachung nach dem Umwandlungsgesetz 22.12.2025 (Eintragungsdatum)\n\nFreund & Partner GmbH Steuerberatungsgesellschaft\nGesellschaft mit beschränkter Haftung\nBerlin\n\nZu Eintragungsnummer 40 vom 22.12.2025 wird als nicht eingetragen veröffentlicht: Den Gläubigern der an der Verschmelzung beteiligten Rechtsträger ist, wenn sie binnen sechs Monaten nach dem Tag, an dem die Eintragung der Verschmelzung in das Register des Sitzes desjenigen Rechtsträgers, dessen Gläubiger sie sind, als bekannt gemacht gilt, ihren Anspruch nach Grund und Höhe schriftlich anmelden, Sicherheit zu leisten, soweit sie nicht Befriedigung verlangen können. Dieses Recht steht den Gläubigern jedoch nur zu, wenn sie glaubhaft machen, dass durch die Verschmelzung die Erfüllung ihrer Forderung gefährdet wird. Das Recht, Sicherheitsleistung zu verlangen, steht Gläubigern nicht zu, die im Falle der Insolvenz ein Recht auf vorzugsweise Befriedigung aus einer Deckungsmasse haben, die nach gesetzlicher Vorschrift zu ihrem Schutz errichtet und staatlich überwacht ist."
    },
    {
      "date": "2026-01-05",
      "id": "141464",
      "original_text": "Registerbekanntmachung nach dem Umwandlungsgesetz\nBaden-Württemberg Amtsgericht Stuttgart HRB 460958\nFTC Fashion Trade Consulting GmbH – Trossingen",
      "type": "Registerbekanntmachung nach dem Umwandlungsgesetz",
      "state": "Baden-Württemberg",
      "amtsgericht": "Amtsgericht Stuttgart",
      "registernummer": "HRB 460958",
      "registerart": "HRB",
      "company_name": "FTC Fashion Trade Consulting GmbH",
      "company_seat": "Trossingen",
      "details": "05.01.2026 (Bekanntmachungsdatum)\n\nBaden-Württemberg Amtsgericht Stuttgart HRB 460958\nRegisterbekanntmachung nach dem Umwandlungsgesetz 05.01.2026 (Eintragungsdatum)\n\nFTC Fashion Trade Consulting GmbH\nGesellschaft mit beschränkter Haftung\nTrossingen\n\nAls nicht eingetragen wird bekanntgemacht:\nDen Gläubigern der an der Verschmelzung beteiligten Rechtsträger ist, wenn sie binnen sechs Monaten nach dem Tag, an dem die Eintragung der Verschmelzung in das Register des Sitzes desjenigen Rechtsträgers, dessen Gläubiger sie sind, nach § 19 Abs. 3 UmwG als bekanntgemacht gilt, ihren Anspruch nach Grund und Höhe schriftlich anmelden, Sicherheit zu leisten, soweit sie nicht Befriedigung verlangen können. Dieses Recht steht den Gläubigern jedoch nur zu, wenn sie glaubhaft machen, dass durch die Verschmelzung die Erfüllung ihrer Forderung gefährdet wird."
    },
    {
      "date": "2026-01-05",
      "id": "141465",
      "original_text": "Einreichung neuer Dokumente\nThüringen Amtsgericht Jena HRB 503633\nSüdharzwerke Nordhausen - Entsorgungsgesellschaft mbH – Nordhausen",
      "type": "Einreichung neuer Dokumente",
      "state": "Thüringen",
      "amtsgericht": "Amtsgericht Jena",
      "registernummer": "HRB 503633",
      "registerart": "HRB",
      "company_name": "Südharzwerke Nordhausen - Entsorgungsgesellschaft mbH",
      "company_seat": "Nordhausen",
      "details": "05.01.2026 (Bekanntmachungsdatum)\n\nThüringen Amtsgericht Jena HRB 503633\nEinreichung neuer Dokumente\n\nSüdharzwerke Nordhausen - Entsorgungsgesellschaft mbH\nGesellschaft mit beschränkter Haftung\nNordhausen\n\nBekanntmachung gem. § 52 Abs. 3 Satz 2 GmbHG: Aufgrund einer Veränderung in den Personen der Aufsichtsratsmitglieder ist durch die Geschäftsführer eine neue Liste zum Handelsregister eingereicht worden."
    },
    {
      "date": "2026-01-05",
      "id": "141466",
      "original_text": "Löschungsankündigung\nThüringen Amtsgericht Jena HRB 514760\nLINE GmbH – Weimar",
      "type": "Löschungsankündigung",
      "state": "Thüringen",
      "amtsgericht": "Amtsgericht Jena",
      "registernummer": "HRB 514760",
      "registerart": "HRB",
      "company_name": "LINE GmbH",
      "company_seat": "Weimar",
      "details": "05.01.2026 (Bekanntmachungsdatum)\n\nThüringen Amtsgericht Jena HRB 514760\nLöschungsankündigung\n\nLINE GmbH\nGesellschaft mit beschränkter Haftung\nWeimar\n\nDas Registergericht beabsichtigt, die im Handelsregister eingetragene Gesellschaft wegen Vermögenslosigkeit nach § 394 FamFG von Amts wegen zu löschen. Die Frist zur Erhebung eines Widerspruchs gegen die beabsichtigte Löschung wird auf 6 Wochen festgesetzt."
    },
    {
      "date": "2026-01-05",
      "id": "141467",
      "original_text": "Löschungsankündigung\nThüringen Amtsgericht Jena HRB 513168\nKing Kong GmbH – Meiningen",
      "type": "Löschungsankündigung",
      "state": "Thüringen",
      "amtsgericht": "Amtsgericht Jena",
      "registernummer": "HRB 513168",
      "registerart": "HRB",
      "company_name": "King Kong GmbH",
      "company_seat": "Meiningen",
      "details": "05.01.2026 (Bekanntmachungsdatum)\n\nThüringen Amtsgericht Jena HRB 513168\nLöschungsankündigung\n\nKing Kong GmbH\nGesellschaft mit beschränkter Haftung\nMeiningen\n\nDas Registergericht beabsichtigt, die im Handelsregister eingetragene Gesellschaft wegen Vermögenslosigkeit nach § 394 FamFG von Amts wegen zu löschen. Die Frist zur Erhebung eines Widerspruchs gegen die beabsichtigte Löschung wird auf 6 Wochen festgesetzt."
    },
    {
      "date": "2026-01-05",
      "id": "141468",
      "original_text": "Sonstige Registerbekanntmachung\nBerlin Amtsgericht Berlin (Charlottenburg) HRB 43188\nRöscher GmbH Automatisierungstechnik und Konstruktion – Berlin",
      "type": "Sonstige Registerbekanntmachung",
      "state": "Berlin",
      "amtsgericht": "Amtsgericht Berlin (Charlottenburg)",
      "registernummer": "HRB 43188",
      "registerart": "HRB",
      "company_name": "Röscher GmbH Automatisierungstechnik und Konstruktion",
      "company_seat": "Berlin",
      "details": "05.01.2026 (Bekanntmachungsdatum)\n\nBerlin Amtsgericht Berlin (Charlottenburg) HRB 43188\nSonstige Registerbekanntmachung\n\nRöscher GmbH Automatisierungstechnik und Konstruktion\nGesellschaft mit beschränkter Haftung\nBerlin\n\nAls nicht eingetragen wird veröffentlicht:Der andere Vertragsteil hat den Gläubigern dieses Rechtsträgers, deren Forderungen begründet worden sind, bevor die Eintragung der Beendigung dieses Vertrages in das Handelsregister nach § 10 des Handelsgesetzbuches als bekannt gemacht gilt, Sicherheit zu leisten, wenn sie sich binnen sechs Monaten nach der Bekanntmachung der Eintragung zu diesem Zweck bei ihm melden. Dieses Recht steht den Gläubigern nicht zu, die im Fall des Insolvenzverfahrens ein Recht auf vorzugsweise Befriedigung aus der Deckungsmasse haben, die nach gesetzlicher Vorschrift zu ihrem Schutz errichtet und staatlich überwacht ist."
    },
    {
      "date": "2026-01-05",
      "id": "141469",
      "original_text": "Registerbekanntmachung nach dem Umwandlungsgesetz\nBerlin Amtsgericht Berlin (Charlottenburg) HRB 233384\nAmpr Software GmbH – Berlin",
      "type": "Registerbekanntmachung nach dem Umwandlungsgesetz",
      "state": "Berlin",
      "amtsgericht": "Amtsgericht Berlin (Charlottenburg)",
      "registernummer": "HRB 233384",
      "registerart": "HRB",
      "company_name": "Ampr Software GmbH",
      "company_seat": "Berlin",
      "details": "05.01.2026 (Bekanntmachungsdatum)\n\nBerlin Amtsgericht Berlin (Charlottenburg) HRB 233384\nRegisterbekanntmachung nach dem Umwandlungsgesetz 02.01.2026 (Eintragungsdatum)\n\nAmpr Software GmbH\nGesellschaft mit beschränkter Haftung\nBerlin\n\nZu Eintragungsnummer 5 vom 02.01.2026 wird als nicht eingetragen veröffentlicht: Den Gläubigern der an der Verschmelzung beteiligten Rechtsträger ist, wenn sie binnen sechs Monaten nach dem Tag, an dem die Eintragung der Verschmelzung in das Register des Sitzes desjenigen Rechtsträgers, dessen Gläubiger sie sind, als bekannt gemacht gilt, ihren Anspruch nach Grund und Höhe schriftlich anmelden, Sicherheit zu leisten, soweit sie nicht Befriedigung verlangen können. Dieses Recht steht den Gläubigern jedoch nur zu, wenn sie glaubhaft machen, dass durch die Verschmelzung die Erfüllung ihrer Forderung gefährdet wird. Das Recht, Sicherheitsleistung zu verlangen, steht Gläubigern nicht zu, die im Falle der Insolvenz ein Recht auf vorzugsweise Befriedigung aus einer Deckungsmasse haben, die nach gesetzlicher Vorschrift zu ihrem Schutz errichtet und staatlich überwacht ist."
    },
    {
      "date": "2026-01-05",
      "id": "141470",
      "original_text": "Sonstige Registerbekanntmachung\nBaden-Württemberg Amtsgericht Stuttgart HRB 22235\nKoenig & Bauer MetalPrint GmbH – Stuttgart",
      "type": "Sonstige Registerbekanntmachung",
      "state": "Baden-Württemberg",
      "amtsgericht": "Amtsgericht Stuttgart",
      "registernummer": "HRB 22235",
      "registerart": "HRB",
      "company_name": "Koenig & Bauer MetalPrint GmbH",
      "company_seat": "Stuttgart",
      "details": "05.01.2026 (Bekanntmachungsdatum)\n\nBaden-Württemberg Amtsgericht Stuttgart HRB 22235\nSonstige Registerbekanntmachung 05.01.2026 (Eintragungsdatum)\n\nKoenig & Bauer MetalPrint GmbH\nGesellschaft mit beschränkter Haftung\nStuttgart\n\nAls nicht eingetragen wird bekanntgemacht:\nDen Gläubigern der Gesellschaft, deren Forderungen begründet worden sind, bevor die Eintragung der Beendigung des Vertrages in das Handelsregister nach § 10 HGB als bekanntgemacht gilt, ist vom anderen Vertragsteil Sicherheit zu leisten, wenn sie sich binnen sechs Monaten nach der Bekanntmachung zu diesem Zweck bei ihm melden."
    },
    {
      "date": "2026-01-05",
      "id": "141471",
      "original_text": "Sonstige Registerbekanntmachung\nBerlin Amtsgericht Berlin (Charlottenburg) HRB 97210\nKursana Care GmbH – Berlin",
      "type": "Sonstige Registerbekanntmachung",
      "state": "Berlin",
      "amtsgericht": "Amtsgericht Berlin (Charlottenburg)",
      "registernummer": "HRB 97210",
      "registerart": "HRB",
      "company_name": "Kursana Care GmbH",
      "company_seat": "Berlin",
      "details": "05.01.2026 (Bekanntmachungsdatum)\n\nBerlin Amtsgericht Berlin (Charlottenburg) HRB 97210\nSonstige Registerbekanntmachung\n\nKursana Care GmbH\nGesellschaft mit beschränkter Haftung\nBerlin\n\nAls nicht eingetragen wird veröffentlicht:Der andere Vertragsteil hat den Gläubigern dieses Rechtsträgers, deren Forderungen begründet worden sind, bevor die Eintragung der Beendigung dieses Vertrages in das Handelsregister nach § 10 des Handelsgesetzbuches als bekannt gemacht gilt, Sicherheit zu leisten, wenn sie sich binnen sechs Monaten nach der Bekanntmachung der Eintragung zu diesem Zweck bei ihm melden. Dieses Recht steht den Gläubigern nicht zu, die im Fall des Insolvenzverfahrens ein Recht auf vorzugsweise Befriedigung aus der Deckungsmasse haben, die nach gesetzlicher Vorschrift zu ihrem Schutz errichtet und staatlich überwacht ist."
    },
    {
      "date": "2026-01-05",
      "id": "141472",
      "original_text": "Löschungsankündigung\nSchleswig-Holstein Amtsgericht Lübeck HRB 3868\nIDE in Abwicklung GmbH – Hansestadt Lübeck",
      "type": "Löschungsankündigung",
      "state": "Schleswig-Holstein",
      "amtsgericht": "Amtsgericht Lübeck",
      "registernummer": "HRB 3868",
      "registerart": "HRB",
      "company_name": "IDE in Abwicklung GmbH",
      "company_seat": "Hansestadt Lübeck",
      "details": "05.01.2026 (Bekanntmachungsdatum)\n\nSchleswig-Holstein Amtsgericht Lübeck HRB 3868\nLöschungsankündigung\n\nIDE in Abwicklung GmbH\nGesellschaft mit beschränkter Haftung\nHansestadt Lübeck\n\nEs ist die Löschung der nachstehenden Gesellschaft wegen Vermögenslosigkeit gemäß § 394 FamFG beabsichtigt.\nWiderspruchsfrist: 1 Monat."
    },
    {
      "date": "2026-01-05",
      "id": "141473",
      "original_text": "Registerbekanntmachung nach dem Umwandlungsgesetz\nBaden-Württemberg Amtsgericht Stuttgart HRB 770645\nM.A.I. Ambulante Pflege GmbH – Stuttgart",
      "type": "Registerbekanntmachung nach dem Umwandlungsgesetz",
      "state": "Baden-Württemberg",
      "amtsgericht": "Amtsgericht Stuttgart",
      "registernummer": "HRB 770645",
      "registerart": "HRB",
      "company_name": "M.A.I. Ambulante Pflege GmbH",
      "company_seat": "Stuttgart",
      "details": "05.01.2026 (Bekanntmachungsdatum)\n\nBaden-Württemberg Amtsgericht Stuttgart HRB 770645\nRegisterbekanntmachung nach dem Umwandlungsgesetz 05.01.2026 (Eintragungsdatum)\n\nM.A.I. Ambulante Pflege GmbH\nGesellschaft mit beschränkter Haftung\nStuttgart\n\nAls nicht eingetragen wird bekanntgemacht:\nDen Gläubigern der an der Ausgliederung beteiligten Rechtsträger ist, wenn sie binnen sechs Monaten nach dem Tag, an dem die Eintragung der Ausgliederung in das Register des Sitzes desjenigen Rechtsträgers, dessen Gläubiger sie sind, nach § 19 Abs. 3 UmwG als bekanntgemacht gilt, ihren Anspruch nach Grund und Höhe schriftlich anmelden, Sicherheit zu leisten, soweit sie nicht Befriedigung verlangen können. Dieses Recht steht den Gläubigern jedoch nur zu, wenn sie glaubhaft machen, dass durch die Ausgliederung die Erfüllung ihrer Forderung gefährdet wird."
    },
    {
      "date": "2026-01-05",
      "id": "141474",
      "original_text": "Sonstige Registerbekanntmachung\nBerlin Amtsgericht Berlin (Charlottenburg) HRB 44074\nABATOR Steuerberatungsgesellschaft mbH – Berlin",
      "type": "Sonstige Registerbekanntmachung",
      "state": "Berlin",
      "amtsgericht": "Amtsgericht Berlin (Charlottenburg)",
      "registernummer": "HRB 44074",
      "registerart": "HRB",
      "company_name": "ABATOR Steuerberatungsgesellschaft mbH",
      "company_seat": "Berlin",
      "details": "05.01.2026 (Bekanntmachungsdatum)\n\nBerlin Amtsgericht Berlin (Charlottenburg) HRB 44074\nSonstige Registerbekanntmachung\n\nABATOR Steuerberatungsgesellschaft mbH\nGesellschaft mit beschränkter Haftung\nBerlin\n\nAls nicht eingetragen wird veröffentlicht: Den Gläubigern der an der Verschmelzung beteiligten Rechtsträger ist, wenn sie binnen sechs Monaten nach dem Tag, an dem die Eintragung der Verschmelzung in das Register des Sitzes desjenigen Rechtsträgers, dessen Gläubiger sie sind, als bekannt gemacht gilt, ihren Anspruch nach Grund und Höhe schriftlich anmelden, Sicherheit zu leisten, soweit sie nicht Befriedigung verlangen können. Dieses Recht steht den Gläubigern jedoch nur zu, wenn sie glaubhaft machen, dass durch die Verschmelzung die Erfüllung ihrer Forderung gefährdet wird. Das Recht, Sicherheitsleistung zu verlangen, steht Gläubigern nicht zu, die im Falle der Insolvenz ein Recht auf vorzugsweise Befriedigung aus einer Deckungsmasse haben, die nach gesetzlicher Vorschrift zu ihrem Schutz errichtet und staatlich überwacht ist."
    },
    {
      "date": "2026-01-05",
      "id": "141475",
      "original_text": "Löschungsankündigung\nSaarland Amtsgericht Saarbrücken HRB 104353\nPhoenixHanf GmbH – Saarbrücken",
      "type": "Löschungsankündigung",
      "state": "Saarland",
      "amtsgericht": "Amtsgericht Saarbrücken",
      "registernummer": "HRB 104353",
      "registerart": "HRB",
      "company_name": "PhoenixHanf GmbH",
      "company_seat": "Saarbrücken",
      "details": "05.01.2026 (Bekanntmachungsdatum)\n\nSaarland Amtsgericht Saarbrücken HRB 104353\nLöschungsankündigung\n\nPhoenixHanf GmbH\nGesellschaft mit beschränkter Haftung\nSaarbrücken\n\nEs ist beabsichtigt, die Gesellschaft von Amts wegen gemäß § 394 FamFG wegen Vermögenslosigkeit zu löschen.\nGegen die Löschung von Amts wegen ist das Rechtsmittel des Widerspruchs statthaft. Der Widerspruch ist binnen einer Frist zwei Monaten beginnend mit dem Tag dieser Veröffentlichung durch Einreichen eines Widerspruchsschreibens -schriftlich oder zur Niederschrift der Geschäftsstelle beim Amtsgericht Saarbrücken, -zentrales Handelsregister-, Mainzerstr.178, 66121 Saarbrücken einzulegen.\nDer Widerspruch muss die Bezeichnung der angefochtenen Löschungsankündigung enthalten sowie die Erklärung, dass Widerspruch eingelegt wird. Er ist vom Widerspruchsführer oder seinem Bevollmächtigten zu unterzeichnen.\nDas Widerspruchsschreiben kann auch in der Form eines elektronischen Dokumentes eingereicht werden, das mit einer qualifizierten elektronischen Signatur nach dem Signaturgesetz versehen sein muss (§§ 14 Abs. 2 FamFG, 130a, 298 ZPO)."
    },
    {
      "date": "2026-01-05",
      "id": "141476",
      "original_text": "Sonstige Registerbekanntmachung\nBerlin Amtsgericht Berlin (Charlottenburg) HRB 213583\nBautenschutz Nord GmbH – Berlin",
      "type": "Sonstige Registerbekanntmachung",
      "state": "Berlin",
      "amtsgericht": "Amtsgericht Berlin (Charlottenburg)",
      "registernummer": "HRB 213583",
      "registerart": "HRB",
      "company_name": "Bautenschutz Nord GmbH",
      "company_seat": "Berlin",
      "details": "05.01.2026 (Bekanntmachungsdatum)\n\nBerlin Amtsgericht Berlin (Charlottenburg) HRB 213583\nSonstige Registerbekanntmachung\n\nBautenschutz Nord GmbH\nGesellschaft mit beschränkter Haftung\nBerlin\n\nAls nicht eingetragen wird veröffentlicht: Der andere Vertragsteil hat den Gläubigern dieses Rechtsträgers, deren Forderungen begründet worden sind, bevor die Eintragung der Beendigung dieses Vertrages in das Handelsregister nach § 10 des Handelsgesetzbuches als bekannt gemacht gilt, Sicherheit zu leisten, wenn sie sich binnen sechs Monaten nach der Bekanntmachung der Eintragung zu diesem Zweck bei ihm melden. Dieses Recht steht den Gläubigern nicht zu, die im Fall des Insolvenzverfahrens ein Recht auf vorzugsweise Befriedigung aus der Deckungsmasse haben, die nach gesetzlicher Vorschrift zu ihrem Schutz errichtet und staatlich überwacht ist."
    },
    {
      "date": "2026-01-05",
      "id": "141477",
      "original_text": "Löschungsankündigung\nBerlin Amtsgericht Berlin (Charlottenburg) HRB 145306\nKalik GmbH – Berlin",
      "type": "Löschungsankündigung",
      "state": "Berlin",
      "amtsgericht": "Amtsgericht Berlin (Charlottenburg)",
      "registernummer": "HRB 145306",
      "registerart": "HRB",
      "company_name": "Kalik GmbH",
      "company_seat": "Berlin",
      "details": "05.01.2026 (Bekanntmachungsdatum)\n\nBerlin Amtsgericht Berlin (Charlottenburg) HRB 145306\nLöschungsankündigung\n\nKalik GmbH\nGesellschaft mit beschränkter Haftung\nBerlin\n\nBei der nachstehenden Gesellschaft wird das Amtslöschungsverfahren gemäß § 394 FamFG eingeleitet. Widerspruchsfrist 6 Wochen"
    },
    {
      "date": "2026-01-05",
      "id": "141478",
      "original_text": "Sonstige Registerbekanntmachung\nBerlin Amtsgericht Berlin (Charlottenburg) HRB 6599\nArnim Schneider Gesellschaft mit beschränkter Haftung – Berlin",
      "type": "Sonstige Registerbekanntmachung",
      "state": "Berlin",
      "amtsgericht": "Amtsgericht Berlin (Charlottenburg)",
      "registernummer": "HRB 6599",
      "registerart": "HRB",
      "company_name": "Arnim Schneider Gesellschaft mit beschränkter Haftung",
      "company_seat": "Berlin",
      "details": "05.01.2026 (Bekanntmachungsdatum)\n\nBerlin Amtsgericht Berlin (Charlottenburg) HRB 6599\nSonstige Registerbekanntmachung\n\nArnim Schneider Gesellschaft mit beschränkter Haftung\nGesellschaft mit beschränkter Haftung\nBerlin\n\nAls nicht eingetragen wird veröffentlicht: Der andere Vertragsteil hat den Gläubigern dieses Rechtsträgers, deren Forderungen begründet worden sind, bevor die Eintragung der Beendigung dieses Vertrages in das Handelsregister nach § 10 des Handelsgesetzbuches als bekannt gemacht gilt, Sicherheit zu leisten, wenn sie sich binnen sechs Monaten nach der Bekanntmachung der Eintragung zu diesem Zweck bei ihm melden. Dieses Recht steht den Gläubigern nicht zu, die im Fall des Insolvenzverfahrens ein Recht auf vorzugsweise Befriedigung aus der Deckungsmasse haben, die nach gesetzlicher Vorschrift zu ihrem Schutz errichtet und staatlich überwacht ist."
    },
    {
      "date": "2026-01-05",
      "id": "141479",
      "original_text": "Einreichung neuer Dokumente\nBerlin Amtsgericht Berlin (Charlottenburg) HRB 271697\nN26 Bank SE – Berlin",
      "type": "Einreichung neuer Dokumente",
      "state": "Berlin",
      "amtsgericht": "Amtsgericht Berlin (Charlottenburg)",
      "registernummer": "HRB 271697",
      "registerart": "HRB",
      "company_name": "N26 Bank SE",
      "company_seat": "Berlin",
      "details": "05.01.2026 (Bekanntmachungsdatum)\n\nBerlin Amtsgericht Berlin (Charlottenburg) HRB 271697\nEinreichung neuer Dokumente\n\nN26 Bank SE\nEuropäische Aktiengesellschaft (SE)\nBerlin\n\nAls nicht eingetragen wird veröffentlicht: Es wurde eine neue Liste der Aufsichtsratsmitglieder eingereicht (§ 106 AktG)."
    },
    {
      "date": "2026-01-05",
      "id": "141480",
      "original_text": "Sonstige Registerbekanntmachung\nBaden-Württemberg Amtsgericht Stuttgart HRB 214633\nJ.B.M. First Gen GmbH – Esslingen am Neckar",
      "type": "Sonstige Registerbekanntmachung",
      "state": "Baden-Württemberg",
      "amtsgericht": "Amtsgericht Stuttgart",
      "registernummer": "HRB 214633",
      "registerart": "HRB",
      "company_name": "J.B.M. First Gen GmbH",
      "company_seat": "Esslingen am Neckar",
      "details": "05.01.2026 (Bekanntmachungsdatum)\n\nBaden-Württemberg Amtsgericht Stuttgart HRB 214633\nSonstige Registerbekanntmachung 05.01.2026 (Eintragungsdatum)\n\nJ.B.M. First Gen GmbH\nGesellschaft mit beschränkter Haftung\nEsslingen am Neckar\n\nAls nicht eingetragen wird bekanntgemacht:\nDen Gläubigern der Gesellschaft, deren Forderungen begründet worden sind, bevor die Eintragung der Beendigung des Vertrages in das Handelsregister nach § 10 HGB als bekanntgemacht gilt, ist vom anderen Vertragsteil Sicherheit zu leisten, wenn sie sich binnen sechs Monaten nach der Bekanntmachung zu diesem Zweck bei ihm melden."
    },
    {
      "date": "2026-01-05",
      "id": "141481",
      "original_text": "Löschungsankündigung\nBerlin Amtsgericht Berlin (Charlottenburg) HRB 165289\nBTC Protection & Service GmbH – Berlin",
      "type": "Löschungsankündigung",
      "state": "Berlin",
      "amtsgericht": "Amtsgericht Berlin (Charlottenburg)",
      "registernummer": "HRB 165289",
      "registerart": "HRB",
      "company_name": "BTC Protection & Service GmbH",
      "company_seat": "Berlin",
      "details": "05.01.2026 (Bekanntmachungsdatum)\n\nBerlin Amtsgericht Berlin (Charlottenburg) HRB 165289\nLöschungsankündigung\n\nBTC Protection & Service GmbH\nGesellschaft mit beschränkter Haftung\nBerlin\n\nBei der nachstehenden Gesellschaft wird das Amtslöschungsverfahren gemäß § 394 FamFG eingeleitet. Widerspruchsfrist: 6 Wochen."
    },
    {
      "date": "2026-01-05",
      "id": "141482",
      "original_text": "Sonstige Registerbekanntmachung\nBerlin Amtsgericht Berlin (Charlottenburg) HRB 239061\niFunded AG – Berlin",
      "type": "Sonstige Registerbekanntmachung",
      "state": "Berlin",
      "amtsgericht": "Amtsgericht Berlin (Charlottenburg)",
      "registernummer": "HRB 239061",
      "registerart": "HRB",
      "company_name": "iFunded AG",
      "company_seat": "Berlin",
      "details": "05.01.2026 (Bekanntmachungsdatum)\n\nBerlin Amtsgericht Berlin (Charlottenburg) HRB 239061\nSonstige Registerbekanntmachung\n\niFunded AG\nAktiengesellschaft\nBerlin\n\nAls nicht eingetragen wird veröffentlicht: Den Gläubigern der Gesellschaft ist, wenn sie binnen sechs Monaten nach dieser Bekanntmachung ihren Anspruch nach Grund und Höhe schriftlich anmelden, Sicherheit zu leisten, soweit sie nicht Befriedigung verlangen können. Das Recht steht ihnen jedoch nicht zu, wenn sie im Fall eines Insolvenzverfahrens ein Recht auf vorzugsweise Befriedigung aus einer Deckungsmasse haben, die nach gesetzlicher Vorschrift zu ihrem Schutz errichtet und staatlich überwacht ist."
    },
    {
      "date": "2026-01-05",
      "id": "141483",
      "original_text": "Sonstige Registerbekanntmachung\nHamburg Amtsgericht Hamburg HRB 71693\nBÖAG Beteiligungs-Aktiengesellschaft – Hamburg",
      "type": "Sonstige Registerbekanntmachung",
      "state": "Hamburg",
      "amtsgericht": "Amtsgericht Hamburg",
      "registernummer": "HRB 71693",
      "registerart": "HRB",
      "company_name": "BÖAG Beteiligungs-Aktiengesellschaft",
      "company_seat": "Hamburg",
      "details": "05.01.2026 (Bekanntmachungsdatum)\n\nHamburg Amtsgericht Hamburg HRB 71693\nSonstige Registerbekanntmachung\n\nBÖAG Beteiligungs-Aktiengesellschaft\nAktiengesellschaft\nHamburg\n\nAls nicht eingetragen wird bekannt gemacht: Liste des Aufsichtsrats wurde eingereicht."
    },
    {
      "date": "2026-01-05",
      "id": "141484",
      "original_text": "Sonstige Registerbekanntmachung\nBaden-Württemberg Amtsgericht Stuttgart HRB 264303\nAkkodis Germany EMC GmbH – Waiblingen",
      "type": "Sonstige Registerbekanntmachung",
      "state": "Baden-Württemberg",
      "amtsgericht": "Amtsgericht Stuttgart",
      "registernummer": "HRB 264303",
      "registerart": "HRB",
      "company_name": "Akkodis Germany EMC GmbH",
      "company_seat": "Waiblingen",
      "details": "05.01.2026 (Bekanntmachungsdatum)\n\nBaden-Württemberg Amtsgericht Stuttgart HRB 264303\nSonstige Registerbekanntmachung 05.01.2026 (Eintragungsdatum)\n\nAkkodis Germany EMC GmbH\nGesellschaft mit beschränkter Haftung\nWaiblingen\n\nDen Gläubigern der Gesellschaft, deren Forderungen begründet worden sind, bevor die Eintragung der Beendigung des Vertrages in das Handelsregister nach § 10 HGB als bekanntgemacht gilt, ist vom anderen Vertragsteil Sicherheit zu leisten, wenn sie sich binnen sechs Monaten nach der Bekanntmachung zu diesem Zweck bei ihm melden."
    },
    {
      "date": "2026-01-05",
      "id": "141485",
      "original_text": "Einreichung neuer Dokumente\nBaden-Württemberg Amtsgericht Mannheim HRB 702991\nGewerbeentwicklung Baden-Baden GmbH – Baden-Baden",
      "type": "Einreichung neuer Dokumente",
      "state": "Baden-Württemberg",
      "amtsgericht": "Amtsgericht Mannheim",
      "registernummer": "HRB 702991",
      "registerart": "HRB",
      "company_name": "Gewerbeentwicklung Baden-Baden GmbH",
      "company_seat": "Baden-Baden",
      "details": "05.01.2026 (Bekanntmachungsdatum)\n\nBaden-Württemberg Amtsgericht Mannheim HRB 702991\nEinreichung neuer Dokumente\n\nGewerbeentwicklung Baden-Baden GmbH\nGesellschaft mit beschränkter Haftung\nBaden-Baden\n\nDie Gesellschaft hat am 05.01.2026 die Liste über die Zusammensetzung des Aufsichtsrats zum Handelsregister eingereicht."
    },
    {
      "date": "2026-01-05",
      "id": "141486",
      "original_text": "Sonstige Registerbekanntmachung\nSaarland Amtsgericht Saarbrücken HRB 109281\nLebenshilfe Saarlouis Wohnen gemeinnützige GmbH – Saarwellingen",
      "type": "Sonstige Registerbekanntmachung",
      "state": "Saarland",
      "amtsgericht": "Amtsgericht Saarbrücken",
      "registernummer": "HRB 109281",
      "registerart": "HRB",
      "company_name": "Lebenshilfe Saarlouis Wohnen gemeinnützige GmbH",
      "company_seat": "Saarwellingen",
      "details": "05.01.2026 (Bekanntmachungsdatum)\n\nSaarland Amtsgericht Saarbrücken HRB 109281\nSonstige Registerbekanntmachung 05.01.2026 (Eintragungsdatum)\n\nLebenshilfe Saarlouis Wohnen gemeinnützige GmbH\nGesellschaft mit beschränkter Haftung\nSaarwellingen\n\nDen Gläubigern der Gesellschaft, deren Forderungen begründet worden sind, bevor die Eintragung der Beendigung des Vertrages in das Handelsregister nach § 10 des Handelsgesetzbuches als bekanntgemacht gilt, hat der andere Vertragsteil Sicherheit zu leisten, wenn sie sich binnen sechs Monaten nach der Bekanntmachung der Eintragung zu diesem Zweck bei ihm melden."
    },
    {
      "date": "2026-01-05",
      "id": "141487",
      "original_text": "Sonstige Registerbekanntmachung\nSaarland Amtsgericht Saarbrücken HRB 109280\nLebenshilfe Saarlouis Kinder gemeinnützige GmbH – Saarwellingen",
      "type": "Sonstige Registerbekanntmachung",
      "state": "Saarland",
      "amtsgericht": "Amtsgericht Saarbrücken",
      "registernummer": "HRB 109280",
      "registerart": "HRB",
      "company_name": "Lebenshilfe Saarlouis Kinder gemeinnützige GmbH",
      "company_seat": "Saarwellingen",
      "details": "05.01.2026 (Bekanntmachungsdatum)\n\nSaarland Amtsgericht Saarbrücken HRB 109280\nSonstige Registerbekanntmachung 05.01.2026 (Eintragungsdatum)\n\nLebenshilfe Saarlouis Kinder gemeinnützige GmbH\nGesellschaft mit beschränkter Haftung\nSaarwellingen\n\nDen Gläubigern der Gesellschaft, deren Forderungen begründet worden sind, bevor die Eintragung der Beendigung des Vertrages in das Handelsregister nach § 10 des Handelsgesetzbuches als bekanntgemacht gilt, hat der andere Vertragsteil Sicherheit zu leisten, wenn sie sich binnen sechs Monaten nach der Bekanntmachung der Eintragung zu diesem Zweck bei ihm melden."
    },
    {
      "date": "2026-01-05",
      "id": "141488",
      "original_text": "Sonstige Registerbekanntmachung\nBerlin Amtsgericht Berlin (Charlottenburg) HRB 251446\nKaffee Maxim Am Tacheles GmbH – Berlin",
      "type": "Sonstige Registerbekanntmachung",
      "state": "Berlin",
      "amtsgericht": "Amtsgericht Berlin (Charlottenburg)",
      "registernummer": "HRB 251446",
      "registerart": "HRB",
      "company_name": "Kaffee Maxim Am Tacheles GmbH",
      "company_seat": "Berlin",
      "details": "05.01.2026 (Bekanntmachungsdatum)\n\nBerlin Amtsgericht Berlin (Charlottenburg) HRB 251446\nSonstige Registerbekanntmachung\n\nKaffee Maxim Am Tacheles GmbH\nGesellschaft mit beschränkter Haftung\nBerlin\n\nAls nicht eingetragen wird veröffentlicht: Der andere Vertragsteil hat den Gläubigern dieses Rechtsträgers, deren Forderungen begründet worden sind, bevor die Eintragung der Beendigung dieses Vertrages in das Handelsregister nach § 10 des Handelsgesetzbuches als bekannt gemacht gilt, Sicherheit zu leisten, wenn sie sich binnen sechs Monaten nach der Bekanntmachung der Eintragung zu diesem Zweck bei ihm melden. Dieses Recht steht den Gläubigern nicht zu, die im Fall des Insolvenzverfahrens ein Recht auf vorzugsweise Befriedigung aus der Deckungsmasse haben, die nach gesetzlicher Vorschrift zu ihrem Schutz errichtet und staatlich überwacht ist."
    },
    {
      "date": "2026-01-05",
      "id": "141489",
      "original_text": "Sonstige Registerbekanntmachung\nSaarland Amtsgericht Saarbrücken HRB 109282\nLebenshilfe Saarlouis Jugend und Familie gemeinnützige GmbH – Saarwellingen",
      "type": "Sonstige Registerbekanntmachung",
      "state": "Saarland",
      "amtsgericht": "Amtsgericht Saarbrücken",
      "registernummer": "HRB 109282",
      "registerart": "HRB",
      "company_name": "Lebenshilfe Saarlouis Jugend und Familie gemeinnützige GmbH",
      "company_seat": "Saarwellingen",
      "details": "05.01.2026 (Bekanntmachungsdatum)\n\nSaarland Amtsgericht Saarbrücken HRB 109282\nSonstige Registerbekanntmachung 05.01.2026 (Eintragungsdatum)\n\nLebenshilfe Saarlouis Jugend und Familie gemeinnützige GmbH\nGesellschaft mit beschränkter Haftung\nSaarwellingen\n\nDen Gläubigern der Gesellschaft, deren Forderungen begründet worden sind, bevor die Eintragung der Beendigung des Vertrages in das Handelsregister nach § 10 des Handelsgesetzbuches als bekanntgemacht gilt, hat der andere Vertragsteil Sicherheit zu leisten, wenn sie sich binnen sechs Monaten nach der Bekanntmachung der Eintragung zu diesem Zweck bei ihm melden."
    },
    {
      "date": "2026-01-05",
      "id": "141490",
      "original_text": "Sonstige Registerbekanntmachung\nBerlin Amtsgericht Berlin (Charlottenburg) HRB 133814\nBEOS AG – Berlin",
      "type": "Sonstige Registerbekanntmachung",
      "state": "Berlin",
      "amtsgericht": "Amtsgericht Berlin (Charlottenburg)",
      "registernummer": "HRB 133814",
      "registerart": "HRB",
      "company_name": "BEOS AG",
      "company_seat": "Berlin",
      "details": "05.01.2026 (Bekanntmachungsdatum)\n\nBerlin Amtsgericht Berlin (Charlottenburg) HRB 133814\nSonstige Registerbekanntmachung\n\nBEOS AG\nAktiengesellschaft\nBerlin\n\nAls nicht eingetragen wird veröffentlicht:\nDer andere Vertragsteil hat den Gläubigern dieses Rechtsträgers, deren Forderungen begründet worden sind, bevor die Eintragung der Beendigung dieses Vertrages in das Handelsregister nach § 10 des Handelsgesetzbuches als bekannt gemacht gilt, Sicherheit zu leisten, wenn sie sich binnen sechs Monaten nach der Bekanntmachung der Eintragung zu diesem Zweck bei ihm melden. Dieses Recht steht den Gläubigern nicht zu, die im Fall des Insolvenzverfahrens ein Recht auf vorzugsweise Befriedigung aus der Deckungsmasse haben, die nach gesetzlicher Vorschrift zu ihrem Schutz errichtet und staatlich überwacht ist."
    },
    {
      "date": "2026-01-05",
      "id": "141491",
      "original_text": "Sonstige Registerbekanntmachung\nBaden-Württemberg Amtsgericht Mannheim HRB 362955\nWäschereigruppe Südwest GmbH Dienstleistungen-Consulting – Ettlingen",
      "type": "Sonstige Registerbekanntmachung",
      "state": "Baden-Württemberg",
      "amtsgericht": "Amtsgericht Mannheim",
      "registernummer": "HRB 362955",
      "registerart": "HRB",
      "company_name": "Wäschereigruppe Südwest GmbH Dienstleistungen-Consulting",
      "company_seat": "Ettlingen",
      "details": "05.01.2026 (Bekanntmachungsdatum)\n\nBaden-Württemberg Amtsgericht Mannheim HRB 362955\nSonstige Registerbekanntmachung 05.01.2026 (Eintragungsdatum)\n\nWäschereigruppe Südwest GmbH Dienstleistungen-Consulting\nGesellschaft mit beschränkter Haftung\nEttlingen\n\nDen Gläubigern der Gesellschaft, deren Forderungen begründet worden sind, bevor die Eintragung der Beendigung des Vertrages in das Handelsregister nach § 10 HGB als bekanntgemacht gilt, ist vom anderen Vertragsteil Sicherheit zu leisten, wenn sie sich binnen sechs Monaten nach der Bekanntmachung zu diesem Zweck bei ihm melden."
    },
    {
      "date": "2026-01-05",
      "id": "141492",
      "original_text": "Einreichung neuer Dokumente\nSchleswig-Holstein Amtsgericht Kiel HRB 9 EC\nStadtwerke Eckernförde GmbH – Eckernförde",
      "type": "Einreichung neuer Dokumente",
      "state": "Schleswig-Holstein",
      "amtsgericht": "Amtsgericht Kiel",
      "registernummer": "HRB 9 EC",
      "registerart": "HRB",
      "company_name": "Stadtwerke Eckernförde GmbH",
      "company_seat": "Eckernförde",
      "details": "05.01.2026 (Bekanntmachungsdatum)\n\nSchleswig-Holstein Amtsgericht Kiel HRB 9 EC\nEinreichung neuer Dokumente\n\nStadtwerke Eckernförde GmbH\nGesellschaft mit beschränkter Haftung\nEckernförde\n\nAls nicht eingetragen wird veröffentlicht: Eine neue Liste der Aufsichtsratsmitglieder ist eingereicht worden."
    },
    {
      "date": "2026-01-05",
      "id": "141493",
      "original_text": "Löschungsankündigung\nBerlin Amtsgericht Berlin (Charlottenburg) HRB 185727\nGlow Service UG (haftungsbeschränkt) – Berlin",
      "type": "Löschungsankündigung",
      "state": "Berlin",
      "amtsgericht": "Amtsgericht Berlin (Charlottenburg)",
      "registernummer": "HRB 185727",
      "registerart": "HRB",
      "company_name": "Glow Service UG (haftungsbeschränkt)",
      "company_seat": "Berlin",
      "details": "05.01.2026 (Bekanntmachungsdatum)\n\nBerlin Amtsgericht Berlin (Charlottenburg) HRB 185727\nLöschungsankündigung\n\nGlow Service UG (haftungsbeschränkt)\nGesellschaft mit beschränkter Haftung\nBerlin\n\nBei der nachstehenden Gesellschaft wird das Amtslöschungsverfahren gemäß § 394 FamFG eingeleitet. Widerspruchsfrist 6 Wochen"
    },
    {
      "date": "2026-01-05",
      "id": "141494",
      "original_text": "Löschungsankündigung\nSachsen-Anhalt Amtsgericht Stendal HRB 25150\nRotfuchs Konzerte UG (haftungsbeschränkt) – Halle (Saale)",
      "type": "Löschungsankündigung",
      "state": "Sachsen-Anhalt",
      "amtsgericht": "Amtsgericht Stendal",
      "registernummer": "HRB 25150",
      "registerart": "HRB",
      "company_name": "Rotfuchs Konzerte UG (haftungsbeschränkt)",
      "company_seat": "Halle (Saale)",
      "details": "05.01.2026 (Bekanntmachungsdatum)\n\nSachsen-Anhalt Amtsgericht Stendal HRB 25150\nLöschungsankündigung\n\nRotfuchs Konzerte UG (haftungsbeschränkt)\nGesellschaft mit beschränkter Haftung\nHalle (Saale)\n\nDas Registergericht beabsichtigt, nachfolgende Gesellschaften wegen Vermögenslosigkeit von Amts wegen nach § 394 FamFG zu löschen. Die Frist zur Erhebung eines Widerspruchs gegen die beabsichtigte Löschung wird auf drei Monate festgesetzt."
    },
    {
      "date": "2026-01-05",
      "id": "141495",
      "original_text": "Registerbekanntmachung nach dem Umwandlungsgesetz\nSachsen Amtsgericht Dresden HRB 46178\nKnappensaal Gastro GmbH – Altenberg",
      "type": "Registerbekanntmachung nach dem Umwandlungsgesetz",
      "state": "Sachsen",
      "amtsgericht": "Amtsgericht Dresden",
      "registernummer": "HRB 46178",
      "registerart": "HRB",
      "company_name": "Knappensaal Gastro GmbH",
      "company_seat": "Altenberg",
      "details": "05.01.2026 (Bekanntmachungsdatum)\n\nSachsen Amtsgericht Dresden HRB 46178\nRegisterbekanntmachung nach dem Umwandlungsgesetz 05.01.2026 (Eintragungsdatum)\n\nKnappensaal Gastro GmbH\nGesellschaft mit beschränkter Haftung\nAltenberg\n\nDen Gläubigern der an der Verschmelzung beteiligten Rechtsträger ist, wenn sie binnen sechs Monaten nach dem Tag, an dem die Eintragung der Verschmelzung in das Register des Sitzes desjenigen Rechtsträgers, dessen Gläubiger sie sind, nach § 19 Abs. 3 UmwG als bekannt gemacht gilt, ihren Anspruch nach Grund und Höhe in Textform anmelden, Sicherheit zu leisten, soweit sie nicht Befriedigung verlangen können. Dieses Recht steht den Gläubigern jedoch nur zu, wenn sie glaubhaft machen, dass durch die Verschmelzung die Erfüllung der Forderung gefährdet wird."
    },
    {
      "date": "2026-01-05",
      "id": "141496",
      "original_text": "Löschungsankündigung\nSachsen Amtsgericht Chemnitz HRB 33561\nNew Age Vermögensgesellschaft UG (haftungsbeschränkt) – Werdau",
      "type": "Löschungsankündigung",
      "state": "Sachsen",
      "amtsgericht": "Amtsgericht Chemnitz",
      "registernummer": "HRB 33561",
      "registerart": "HRB",
      "company_name": "New Age Vermögensgesellschaft UG (haftungsbeschränkt)",
      "company_seat": "Werdau",
      "details": "05.01.2026 (Bekanntmachungsdatum)\n\nSachsen Amtsgericht Chemnitz HRB 33561\nLöschungsankündigung\n\nNew Age Vermögensgesellschaft UG (haftungsbeschränkt)\nGesellschaft mit beschränkter Haftung\nWerdau\n\nDas Registergericht beabsichtigt, die im Handelsregister eingetragene Gesellschaft von Amts wegen nach § 394 FamFG zu löschen. Die Frist zu Erhebung eines Widerspruchs gegen die beabsichtigte Löschung wird auf einen Monat festgesetzt."
    },
    {
      "date": "2026-01-05",
      "id": "141497",
      "original_text": "Sonstige Registerbekanntmachung\nNiedersachsen Amtsgericht Braunschweig HRB 1511\nHch. Perschmann GmbH – Braunschweig",
      "type": "Sonstige Registerbekanntmachung",
      "state": "Niedersachsen",
      "amtsgericht": "Amtsgericht Braunschweig",
      "registernummer": "HRB 1511",
      "registerart": "HRB",
      "company_name": "Hch. Perschmann GmbH",
      "company_seat": "Braunschweig",
      "details": "05.01.2026 (Bekanntmachungsdatum)\n\nNiedersachsen Amtsgericht Braunschweig HRB 1511\nSonstige Registerbekanntmachung 05.01.2026 (Eintragungsdatum)\n\nHch. Perschmann GmbH\nGesellschaft mit beschränkter Haftung\nBraunschweig\n\nDen Gläubigern der Gesellschaft, deren Forderungen begründet worden sind, bevor die Eintragung der Beendigung des Vertrages in das Handelsregister nach § 10 HGB als bekanntgemacht gilt, ist vom anderen Vertragsteil Sicherheit zu leisten, wenn sie sich binnen sechs Monaten nach der Bekanntmachung zu diesem Zweck bei ihm melden."
    },
    {
      "date": "2026-01-05",
      "id": "141498",
      "original_text": "Registerbekanntmachung nach dem Umwandlungsgesetz\nNiedersachsen Amtsgericht Lüneburg HRB 208588\nETS Holding GmbH – Amelinghausen",
      "type": "Registerbekanntmachung nach dem Umwandlungsgesetz",
      "state": "Niedersachsen",
      "amtsgericht": "Amtsgericht Lüneburg",
      "registernummer": "HRB 208588",
      "registerart": "HRB",
      "company_name": "ETS Holding GmbH",
      "company_seat": "Amelinghausen",
      "details": "05.01.2026 (Bekanntmachungsdatum)\n\nNiedersachsen Amtsgericht Lüneburg HRB 208588\nRegisterbekanntmachung nach dem Umwandlungsgesetz 05.01.2026 (Eintragungsdatum)\n\nETS Holding GmbH\nGesellschaft mit beschränkter Haftung\nAmelinghausen\n\nDen Gläubigern der an der Verschmelzung beteiligten Rechtsträger ist, wenn sie binnen sechs Monaten nach dem Tag, an dem die Eintragung der Verschmelzung in das Register des Sitzes desjenigen Rechtsträgers, dessen Gläubiger sie sind, nach § 19  Abs.  3 UmwG als bekannt gemacht gilt, ihren Anspruch nach Grund und Höhe schriftlich anmelden, Sicherheit zu leisten, soweit sie nicht Befriedigung verlangen können. Dieses Recht steht den Gläubigern jedoch nur zu, wenn sie glaubhaft machen, dass durch die Verschmelzung die Erfüllung der Forderung gefährdet wird."
    },
    {
      "date": "2026-01-05",
      "id": "141499",
      "original_text": "Registerbekanntmachung nach dem Umwandlungsgesetz\nNiedersachsen Amtsgericht Walsrode HRB 100990\nAndrea Behrens GmbH, Studio für Fotografie und Einrahmung – Affinghausen",
      "type": "Registerbekanntmachung nach dem Umwandlungsgesetz",
      "state": "Niedersachsen",
      "amtsgericht": "Amtsgericht Walsrode",
      "registernummer": "HRB 100990",
      "registerart": "HRB",
      "company_name": "Andrea Behrens GmbH, Studio für Fotografie und Einrahmung",
      "company_seat": "Affinghausen",
      "details": "05.01.2026 (Bekanntmachungsdatum)\n\nNiedersachsen Amtsgericht Walsrode HRB 100990\nRegisterbekanntmachung nach dem Umwandlungsgesetz 05.01.2026 (Eintragungsdatum)\n\nAndrea Behrens GmbH, Studio für Fotografie und Einrahmung\nGesellschaft mit beschränkter Haftung\nAffinghausen\n\nDen Gläubigern der an der Verschmelzung beteiligten Rechtsträger ist, wenn sie binnen sechs Monaten nach dem Tag, an dem die Eintragung der Verschmelzung in das Register des Sitzes desjenigen Rechtsträgers, dessen Gläubiger sie sind, nach § 19  Abs.  3 UmwG als bekannt gemacht gilt, ihren Anspruch nach Grund und Höhe schriftlich anmelden, Sicherheit zu leisten, soweit sie nicht Befriedigung verlangen können. Dieses Recht steht den Gläubigern jedoch nur zu, wenn sie glaubhaft machen, dass durch die Verschmelzung die Erfüllung der Forderung gefährdet wird."
    },
    {
      "date": "2026-01-05",
      "id": "141500",
      "original_text": "Sonstige Registerbekanntmachung\nNiedersachsen Amtsgericht Osnabrück HRB 15742\n3A Composites GmbH – Osnabrück",
      "type": "Sonstige Registerbekanntmachung",
      "state": "Niedersachsen",
      "amtsgericht": "Amtsgericht Osnabrück",
      "registernummer": "HRB 15742",
      "registerart": "HRB",
      "company_name": "3A Composites GmbH",
      "company_seat": "Osnabrück",
      "details": "05.01.2026 (Bekanntmachungsdatum)\n\nNiedersachsen Amtsgericht Osnabrück HRB 15742\nSonstige Registerbekanntmachung 05.01.2026 (Eintragungsdatum)\n\n3A Composites GmbH\nGesellschaft mit beschränkter Haftung\nOsnabrück\n\nDen Gläubigern der Gesellschaft, deren Forderungen begründet worden sind, bevor die Eintragung der Beendigung des Vertrages in das Handelsregister nach § 10 HGB als bekanntgemacht gilt, ist vom anderen Vertragsteil Sicherheit zu leisten, wenn sie sich binnen sechs Monaten nach der Bekanntmachung zu diesem Zweck bei ihm melden."
    },
    {
      "date": "2026-01-05",
      "id": "141501",
      "original_text": "Registerbekanntmachung nach dem Umwandlungsgesetz\nNiedersachsen Amtsgericht Hannover HRB 230022\nbbt Rechtsanwälte und Steuerberater GmbH – Hannover",
      "type": "Registerbekanntmachung nach dem Umwandlungsgesetz",
      "state": "Niedersachsen",
      "amtsgericht": "Amtsgericht Hannover",
      "registernummer": "HRB 230022",
      "registerart": "HRB",
      "company_name": "bbt Rechtsanwälte und Steuerberater GmbH",
      "company_seat": "Hannover",
      "details": "05.01.2026 (Bekanntmachungsdatum)\n\nNiedersachsen Amtsgericht Hannover HRB 230022\nRegisterbekanntmachung nach dem Umwandlungsgesetz 05.01.2026 (Eintragungsdatum)\n\nbbt Rechtsanwälte und Steuerberater GmbH\nGesellschaft mit beschränkter Haftung\nHannover\n\nDen Gläubigern der an der formwechselnden Umwandlung beteiligten Rechtsträger ist, wenn sie binnen sechs Monaten nach dem Tag, an dem die Eintragung der Umwandlung in das Register des Sitzes desjenigen Rechtsträgers, dessen Gläubiger sie sind, nach § 19 Abs. 3 UmwG als bekannt gemacht gilt, ihren Anspruch nach Grund und Höhe schriftlich anmelden, Sicherheit zu leisten, soweit sie nicht Befriedigung verlangen können. Dieses Recht steht den Gläubigern jedoch nur zu, wenn sie glaubhaft machen, dass durch die formwechselnde Umwandlung die Erfüllung der Forderung gefährdet wird."
    },
    {
      "date": "2026-01-05",
      "id": "141502",
      "original_text": "Löschungsankündigung\nNiedersachsen Amtsgericht Braunschweig HRB 202104\nVEWEJA GmbH – Braunschweig",
      "type": "Löschungsankündigung",
      "state": "Niedersachsen",
      "amtsgericht": "Amtsgericht Braunschweig",
      "registernummer": "HRB 202104",
      "registerart": "HRB",
      "company_name": "VEWEJA GmbH",
      "company_seat": "Braunschweig",
      "details": "05.01.2026 (Bekanntmachungsdatum)\n\nNiedersachsen Amtsgericht Braunschweig HRB 202104\nLöschungsankündigung\n\nVEWEJA GmbH\nGesellschaft mit beschränkter Haftung\nBraunschweig\n\nDas Registergericht beabsichtigt, die Gesellschaft von Amts wegen nach § 394 FamFG zu löschen. Die Frist zur Erhebung eines Widerspruchs ist auf 1 Monat ab dieser Registerbekanntmachung festgesetzt."
    },
    {
      "date": "2026-01-05",
      "id": "141503",
      "original_text": "Sonstige Registerbekanntmachung\nNiedersachsen Amtsgericht Lüneburg HRB 209941\nWohncarrée Kassel Mombachstraße GmbH – Winsen (Aller)",
      "type": "Sonstige Registerbekanntmachung",
      "state": "Niedersachsen",
      "amtsgericht": "Amtsgericht Lüneburg",
      "registernummer": "HRB 209941",
      "registerart": "HRB",
      "company_name": "Wohncarrée Kassel Mombachstraße GmbH",
      "company_seat": "Winsen (Aller)",
      "details": "05.01.2026 (Bekanntmachungsdatum)\n\nNiedersachsen Amtsgericht Lüneburg HRB 209941\nSonstige Registerbekanntmachung 05.01.2026 (Eintragungsdatum)\n\nWohncarrée Kassel Mombachstraße GmbH\nGesellschaft mit beschränkter Haftung\nWinsen (Aller)\n\nDen Gläubigern der Gesellschaft, deren Forderungen begründet worden sind, bevor die Eintragung der Beendigung des Vertrages in das Handelsregister nach § 10 HGB als bekanntgemacht gilt, ist vom anderen Vertragsteil Sicherheit zu leisten, wenn sie sich binnen sechs Monaten nach der Bekanntmachung zu diesem Zweck bei ihm melden."
    },
    {
      "date": "2026-01-05",
      "id": "141504",
      "original_text": "Registerbekanntmachung nach dem Umwandlungsgesetz\nNiedersachsen Amtsgericht Walsrode GsR 629\nPrieser Grundstücksgesellschaft eGbR – Osterholz-Scharmbeck",
      "type": "Registerbekanntmachung nach dem Umwandlungsgesetz",
      "state": "Niedersachsen",
      "amtsgericht": "Amtsgericht Walsrode",
      "registernummer": "GsR 629",
      "registerart": "GsR",
      "company_name": "Prieser Grundstücksgesellschaft eGbR",
      "company_seat": "Osterholz-Scharmbeck",
      "details": "05.01.2026 (Bekanntmachungsdatum)\n\nNiedersachsen Amtsgericht Walsrode GsR 629\nRegisterbekanntmachung nach dem Umwandlungsgesetz 05.01.2026 (Eintragungsdatum)\n\nPrieser Grundstücksgesellschaft eGbR\nGesellschaft bürgerlichen Rechts\nOsterholz-Scharmbeck\n\nDen Gläubigern der an der Verschmelzung beteiligten Rechtsträger ist, wenn sie binnen sechs Monaten nach dem Tag, an dem die Eintragung der Verschmelzung in das Register des Sitzes desjenigen Rechtsträgers, dessen Gläubiger sie sind, nach § 19  Abs.  3 UmwG als bekannt gemacht gilt, ihren Anspruch nach Grund und Höhe schriftlich anmelden, Sicherheit zu leisten, soweit sie nicht Befriedigung verlangen können. Dieses Recht steht den Gläubigern jedoch nur zu, wenn sie glaubhaft machen, dass durch die Verschmelzung die Erfüllung der Forderung gefährdet wird."
    },
    {
      "date": "2026-01-05",
      "id": "141505",
      "original_text": "Löschungsankündigung\nNiedersachsen Amtsgericht Osnabrück HRB 218669\nEXPLODE GmbH – Emsbüren",
      "type": "Löschungsankündigung",
      "state": "Niedersachsen",
      "amtsgericht": "Amtsgericht Osnabrück",
      "registernummer": "HRB 218669",
      "registerart": "HRB",
      "company_name": "EXPLODE GmbH",
      "company_seat": "Emsbüren",
      "details": "05.01.2026 (Bekanntmachungsdatum)\n\nNiedersachsen Amtsgericht Osnabrück HRB 218669\nLöschungsankündigung\n\nEXPLODE GmbH\nGesellschaft mit beschränkter Haftung\nEmsbüren\n\nDas Registergericht beabsichtigt, die Gesellschaft von Amts wegen nach § 394 FamFG wegen Vermögenslosigkeit zu löschen. Die Frist zur Erhebung eines Widerspruchs ist auf 1 Monat ab dieser Registerbekanntmachung festgesetzt."
    },
    {
      "date": "2026-01-05",
      "id": "141506",
      "original_text": "Löschungsankündigung\nNiedersachsen Amtsgericht Hildesheim HRB 202958\nHelmigk Bedachungen - Meisterbetrieb - UG (haftungsbeschränkt) – Uetze",
      "type": "Löschungsankündigung",
      "state": "Niedersachsen",
      "amtsgericht": "Amtsgericht Hildesheim",
      "registernummer": "HRB 202958",
      "registerart": "HRB",
      "company_name": "Helmigk Bedachungen - Meisterbetrieb - UG (haftungsbeschränkt)",
      "company_seat": "Uetze",
      "details": "05.01.2026 (Bekanntmachungsdatum)\n\nNiedersachsen Amtsgericht Hildesheim HRB 202958\nLöschungsankündigung\n\nHelmigk Bedachungen - Meisterbetrieb - UG (haftungsbeschränkt)\nGesellschaft mit beschränkter Haftung\nUetze\n\nDas Registergericht beabsichtigt, die Gesellschaft von Amts wegen nach § 394 FamFG zu löschen. Die Frist zur Erhebung eines Widerspruchs ist auf 1 Monat ab dieser Registerbekanntmachung festgesetzt."
    },
    {
      "date": "2026-01-05",
      "id": "141507",
      "original_text": "Registerbekanntmachung nach dem Umwandlungsgesetz\nNiedersachsen Amtsgericht Lüneburg HRB 213143\nPrema Holding GmbH – Amelinghausen",
      "type": "Registerbekanntmachung nach dem Umwandlungsgesetz",
      "state": "Niedersachsen",
      "amtsgericht": "Amtsgericht Lüneburg",
      "registernummer": "HRB 213143",
      "registerart": "HRB",
      "company_name": "Prema Holding GmbH",
      "company_seat": "Amelinghausen",
      "details": "05.01.2026 (Bekanntmachungsdatum)\n\nNiedersachsen Amtsgericht Lüneburg HRB 213143\nRegisterbekanntmachung nach dem Umwandlungsgesetz 05.01.2026 (Eintragungsdatum)\n\nPrema Holding GmbH\nGesellschaft mit beschränkter Haftung\nAmelinghausen\n\nDen Gläubigern der an der Verschmelzung beteiligten Rechtsträger ist, wenn sie binnen sechs Monaten nach dem Tag, an dem die Eintragung der Verschmelzung in das Register des Sitzes desjenigen Rechtsträgers, dessen Gläubiger sie sind, nach § 19  Abs.  3 UmwG als bekannt gemacht gilt, ihren Anspruch nach Grund und Höhe schriftlich anmelden, Sicherheit zu leisten, soweit sie nicht Befriedigung verlangen können. Dieses Recht steht den Gläubigern jedoch nur zu, wenn sie glaubhaft machen, dass durch die Verschmelzung die Erfüllung der Forderung gefährdet wird."
    },
    {
      "date": "2026-01-05",
      "id": "141508",
      "original_text": "Registerbekanntmachung nach dem Umwandlungsgesetz\nRheinland-Pfalz Amtsgericht Wittlich HRA 41243\ntransfer-Unternehmen für soziale Innovation Inh.: Thomas Schmitt-Schäfer e.K. – Wittlich",
      "type": "Registerbekanntmachung nach dem Umwandlungsgesetz",
      "state": "Rheinland-Pfalz",
      "amtsgericht": "Amtsgericht Wittlich",
      "registernummer": "HRA 41243",
      "registerart": "HRA",
      "company_name": "transfer-Unternehmen für soziale Innovation Inh.: Thomas Schmitt-Schäfer e.K.",
      "company_seat": "Wittlich",
      "details": "05.01.2026 (Bekanntmachungsdatum)\n\nRheinland-Pfalz Amtsgericht Wittlich HRA 41243\nRegisterbekanntmachung nach dem Umwandlungsgesetz 05.01.2026 (Eintragungsdatum)\n\ntransfer-Unternehmen für soziale Innovation Inh.: Thomas Schmitt-Schäfer e.K.\nEinzelkaufmann / Einzelkauffrau\nWittlich\n\nAls nicht eingetragen wird veröffentlicht: Den Gläubigern der an der Ausgliederung beteiligten Rechtsträger ist, wenn sie binnen sechs Monaten nac hdem Tag, an dem die Eintragung der Ausgliederung in das Register des Sitzes desjenigen Rechtsträgers, dessen Gläubiger sie sind, nach § 19 Abs. 3 UmwG als bekannt gemacht gilt, ihren Anspruch nach Grund und Höhe schriftlich anmelden, Sicherheit zu leisten, soweit sie nicht Befriedigung verlangen können. Dieses Recht steht den Gläubigern jedoch nur zu, wenn sie glaubhaft machen, dass durch die Ausgliederung die Erfüllung der Forderung gefährdet wird."
    },
    {
      "date": "2026-01-05",
      "id": "141509",
      "original_text": "Sonstige Registerbekanntmachung\nNordrhein-Westfalen Amtsgericht Aachen HRB 13602\nFRINGS Elektro-Installationstechnik GmbH – Alsdorf",
      "type": "Sonstige Registerbekanntmachung",
      "state": "Nordrhein-Westfalen",
      "amtsgericht": "Amtsgericht Aachen",
      "registernummer": "HRB 13602",
      "registerart": "HRB",
      "company_name": "FRINGS Elektro-Installationstechnik GmbH",
      "company_seat": "Alsdorf",
      "details": "05.01.2026 (Bekanntmachungsdatum)\n\nNordrhein-Westfalen Amtsgericht Aachen HRB 13602\nSonstige Registerbekanntmachung 05.01.2026 (Eintragungsdatum)\n\nFRINGS Elektro-Installationstechnik GmbH\nGesellschaft mit beschränkter Haftung\nAlsdorf\n\nAls nicht eingetragen wird veröffentlicht: Den Gläubigern der Gesellschaft, deren Forderungen begründet worden sind bevor die Eintragung der Beendigung des Beherrschungs- und Gewinnabführungsvertrages  in das Handelsregister nach § 10 des Handelsgesetzbuches als bekanntgemacht gilt, hat der andere Vertragsteil Sicherheit zu leisten, wenn sie sich binnen sechs Monaten nach der Bekanntmachung der Eintragung zu diesem Zweck bei ihm melden."
    },
    {
      "date": "2026-01-05",
      "id": "141510",
      "original_text": "Einreichung neuer Dokumente\nNordrhein-Westfalen Amtsgericht Köln HRB 107031\nIntersnack Deutschland SE – Köln",
      "type": "Einreichung neuer Dokumente",
      "state": "Nordrhein-Westfalen",
      "amtsgericht": "Amtsgericht Köln",
      "registernummer": "HRB 107031",
      "registerart": "HRB",
      "company_name": "Intersnack Deutschland SE",
      "company_seat": "Köln",
      "details": "05.01.2026 (Bekanntmachungsdatum)\n\nNordrhein-Westfalen Amtsgericht Köln HRB 107031\nEinreichung neuer Dokumente\n\nIntersnack Deutschland SE\nEuropäische Aktiengesellschaft (SE)\nKöln\n\nDem Registergericht ist eine Liste der Mitglieder des Aufsichtsrates eingereicht worden."
    },
    {
      "date": "2026-01-05",
      "id": "141511",
      "original_text": "Löschungsankündigung\nNordrhein-Westfalen Amtsgericht Hamm VR 2420\nThe Bridge United e.V. – Unna",
      "type": "Löschungsankündigung",
      "state": "Nordrhein-Westfalen",
      "amtsgericht": "Amtsgericht Hamm",
      "registernummer": "VR 2420",
      "registerart": "VR",
      "company_name": "The Bridge United e.V.",
      "company_seat": "Unna",
      "details": "05.01.2026 (Bekanntmachungsdatum)\n\nNordrhein-Westfalen Amtsgericht Hamm VR 2420\nLöschungsankündigung\n\nThe Bridge United e.V.\neingetragener Verein\nUnna\n\nDas Registergericht beabsichtigt, nachdem der Verein nach Wegfall sämtlicher Mitglieder erloschen ist, dies von Amts wegen (§ 395 FamFG) in das Vereinsregister einzutragen und das Registerblatt zu schließen.\nZugleich wird zur Geltendmachung eines Widerspruchs eine Frist von einem Monat gesetzt, die mit der Bekanntmachung beginnt. Der Widerspruch kann schriftlich oder zu Protokoll der Geschäftsstelle erhoben werden."
    },
    {
      "date": "2026-01-05",
      "id": "141512",
      "original_text": "Löschungsankündigung\nNordrhein-Westfalen Amtsgericht Dortmund HRB 28874\n3K Marketing und Vertriebsmanagement GmbH – Lünen",
      "type": "Löschungsankündigung",
      "state": "Nordrhein-Westfalen",
      "amtsgericht": "Amtsgericht Dortmund",
      "registernummer": "HRB 28874",
      "registerart": "HRB",
      "company_name": "3K Marketing und Vertriebsmanagement GmbH",
      "company_seat": "Lünen",
      "details": "05.01.2026 (Bekanntmachungsdatum)\n\nNordrhein-Westfalen Amtsgericht Dortmund HRB 28874\nLöschungsankündigung\n\n3K Marketing und Vertriebsmanagement GmbH\nGesellschaft mit beschränkter Haftung\nLünen\n\nDas Registergericht beabsichtigt die Gesellschaft von Amts wegen nach § 394 FamFG zu löschen. Die Frist zur Erhebung eines Widerspruchs ist auf zwei Monate festgesetzt."
    },
    {
      "date": "2026-01-05",
      "id": "141513",
      "original_text": "Löschungsankündigung\nNordrhein-Westfalen Amtsgericht Dortmund HRB 30834\nIhr Fensterbauer Nückel & Winter GmbH – Dortmund",
      "type": "Löschungsankündigung",
      "state": "Nordrhein-Westfalen",
      "amtsgericht": "Amtsgericht Dortmund",
      "registernummer": "HRB 30834",
      "registerart": "HRB",
      "company_name": "Ihr Fensterbauer Nückel & Winter GmbH",
      "company_seat": "Dortmund",
      "details": "05.01.2026 (Bekanntmachungsdatum)\n\nNordrhein-Westfalen Amtsgericht Dortmund HRB 30834\nLöschungsankündigung\n\nIhr Fensterbauer Nückel & Winter GmbH\nGesellschaft mit beschränkter Haftung\nDortmund\n\nDas Registergericht beabsichtigt die Gesellschaft von Amts wegen nach § 394 FamFG zu löschen. Die Frist zur Erhebung eines Widerspruchs ist auf zwei Monate festgesetzt."
    },
    {
      "date": "2026-01-05",
      "id": "141514",
      "original_text": "Löschungsankündigung\nNordrhein-Westfalen Amtsgericht Mönchengladbach HRB 22745\nTeam Brothers GmbH – Rommerskirchen",
      "type": "Löschungsankündigung",
      "state": "Nordrhein-Westfalen",
      "amtsgericht": "Amtsgericht Mönchengladbach",
      "registernummer": "HRB 22745",
      "registerart": "HRB",
      "company_name": "Team Brothers GmbH",
      "company_seat": "Rommerskirchen",
      "details": "05.01.2026 (Bekanntmachungsdatum)\n\nNordrhein-Westfalen Amtsgericht Mönchengladbach HRB 22745\nLöschungsankündigung\n\nTeam Brothers GmbH\nGesellschaft mit beschränkter Haftung\nRommerskirchen\n\nDas Registergericht beabsichtigt die Gesellschaft von Amts wegen nach § 394 FamFG zu löschen. Die Frist zur Erhebung eines Widerspruchs ist auf zwei Monate festgesetzt."
    },
    {
      "date": "2026-01-05",
      "id": "141515",
      "original_text": "Löschungsankündigung\nNordrhein-Westfalen Amtsgericht Neuss HRB 22228\nGoGo GmbH – Neuss",
      "type": "Löschungsankündigung",
      "state": "Nordrhein-Westfalen",
      "amtsgericht": "Amtsgericht Neuss",
      "registernummer": "HRB 22228",
      "registerart": "HRB",
      "company_name": "GoGo GmbH",
      "company_seat": "Neuss",
      "details": "05.01.2026 (Bekanntmachungsdatum)\n\nNordrhein-Westfalen Amtsgericht Neuss HRB 22228\nLöschungsankündigung\n\nGoGo GmbH\nGesellschaft mit beschränkter Haftung\nNeuss\n\nes ist beabsichtigt, die im Handelsregister eingetragene Gesellschaft gemäß § 394 Absatz 1 FamFG wegen Vermögenslosigkeit von Amts wegen zu löschen.\n\nFrist zur Geltendmachung eines Widerspruchs: 1 Monat"
    },
    {
      "date": "2026-01-05",
      "id": "141516",
      "original_text": "Löschungsankündigung\nNordrhein-Westfalen Amtsgericht Neuss HRB 22228\nGoGo GmbH – Neuss",
      "type": "Löschungsankündigung",
      "state": "Nordrhein-Westfalen",
      "amtsgericht": "Amtsgericht Neuss",
      "registernummer": "HRB 22228",
      "registerart": "HRB",
      "company_name": "GoGo GmbH",
      "company_seat": "Neuss",
      "details": "05.01.2026 (Bekanntmachungsdatum)\n\nNordrhein-Westfalen Amtsgericht Neuss HRB 22228\nLöschungsankündigung\n\nGoGo GmbH\nGesellschaft mit beschränkter Haftung\nNeuss\n\nes ist beabsichtigt, die im Handelsregister eingetragene Gesellschaft gemäß § 394\nAbsatz 1 FamFG wegen Vermögenslosigkeit von Amts wegen zu löschen.\nFrist zur Geltendmachung eines Widerspruchs: 1 Monat\nRechtsbehelfsbelehrung:\nGegen diese Verfügung können Sie Widerspruch einlegen. Der Widerspruch ist bei dem\nAmtsgericht Neuss, Breite Straße 48, 41460 Neuss schriftlich in deutscher Sprache oder\nzur Niederschrift der Geschäftsstelle einzulegen. Der Widerspruch kann auch zur\nNiederschrift der Geschäftsstelle eines jeden Amtsgerichtes abgegeben werden. Die\nEinlegung ist auch durch Übertragung eines elektronischen Dokuments an die elektronische\nPoststelle des Gerichts möglich. Das elektronische Dokument muss für die Bearbeitung\ndurch das Gericht geeignet und mit einer qualifizierten elektronischen Signatur der\nverantwortenden Person versehen sein oder von der verantwortenden Person signiert und\nauf einem sicheren Übermittlungsweg gemäß § 130a ZPO nach näherer Maßgabe der\nVerordnung über die technischen Rahmenbedingungen des elektronischen Rechtsverkehrs\nund über das besondere elektronische Behördenpostfach (BGBl. I, S.3803) eingereicht\nwerden. Weitere Informationen erhalten Sie auf der Internetseite www.justiz.de.\nDer Widerspruch muss spätestens innerhalb der gesetzten Frist bei dem Amtsgericht\nNeuss eingegangen sein. Dies gilt auch dann, wenn der Widerspruch zur Niederschrift der\nGeschäftsstelle eines anderen Amtsgerichtes abgegeben wurde. Die Frist beginnt mit der\nVeröffentlichung. Fällt das Ende der Frist auf einen Sonntag, einen allgemeinen Feiertag\noder Sonnabend, so endet die Frist mit Ablauf des nächsten Werktages. Der Widerspruch\nmuss die Bezeichnung der angefochtenen Verfügung sowie die Erklärung enthalten, dass\nWiderspruch gegen diese Verfügung eingelegt wird. Er ist zu unterzeichnen und soll\nbegründet werden."
    },
    {
      "date": "2026-01-05",
      "id": "141517",
      "original_text": "Sonstige Registerbekanntmachung\nNordrhein-Westfalen Amtsgericht Köln HRB 119863\nREWE Group Fruchtlogistik GmbH – Köln",
      "type": "Sonstige Registerbekanntmachung",
      "state": "Nordrhein-Westfalen",
      "amtsgericht": "Amtsgericht Köln",
      "registernummer": "HRB 119863",
      "registerart": "HRB",
      "company_name": "REWE Group Fruchtlogistik GmbH",
      "company_seat": "Köln",
      "details": "05.01.2026 (Bekanntmachungsdatum)\n\nNordrhein-Westfalen Amtsgericht Köln HRB 119863\nSonstige Registerbekanntmachung 05.01.2026 (Eintragungsdatum)\n\nREWE Group Fruchtlogistik GmbH\nGesellschaft mit beschränkter Haftung\nKöln\n\nAls nicht eingetragen wird veröffentlicht: Den Gläubigern der Gesellschaft, deren Forderungen begründet worden sind bevor die Eintragung der Beendigung des Beherrschungs- und Gewinnabführungsvertrages  in das Handelsregister nach § 10 des Handelsgesetzbuches als bekanntgemacht gilt, hat der andere Vertragsteil Sicherheit zu leisten, wenn sie sich binnen sechs Monaten nach der Bekanntmachung der Eintragung zu diesem Zweck bei ihm melden."
    },
    {
      "date": "2026-01-05",
      "id": "141518",
      "original_text": "Löschungsankündigung\nNordrhein-Westfalen Amtsgericht Essen HRB 31243\nARTA Germany GmbH – Essen",
      "type": "Löschungsankündigung",
      "state": "Nordrhein-Westfalen",
      "amtsgericht": "Amtsgericht Essen",
      "registernummer": "HRB 31243",
      "registerart": "HRB",
      "company_name": "ARTA Germany GmbH",
      "company_seat": "Essen",
      "details": "05.01.2026 (Bekanntmachungsdatum)\n\nNordrhein-Westfalen Amtsgericht Essen HRB 31243\nLöschungsankündigung\n\nARTA Germany GmbH\nGesellschaft mit beschränkter Haftung\nEssen\n\nDas Registergericht beabsichtigt die Gesellschaft von Amts wegen nach § 394 FamFG zu löschen. Die Frist zur Erhebung eines Widerspruchs ist auf einen Monat festgesetzt."
    },
    {
      "date": "2026-01-05",
      "id": "141519",
      "original_text": "Löschungsankündigung\nNordrhein-Westfalen Amtsgericht Mönchengladbach HRB 18987\nTsinghe GmbH – Schwalmtal",
      "type": "Löschungsankündigung",
      "state": "Nordrhein-Westfalen",
      "amtsgericht": "Amtsgericht Mönchengladbach",
      "registernummer": "HRB 18987",
      "registerart": "HRB",
      "company_name": "Tsinghe GmbH",
      "company_seat": "Schwalmtal",
      "details": "05.01.2026 (Bekanntmachungsdatum)\n\nNordrhein-Westfalen Amtsgericht Mönchengladbach HRB 18987\nLöschungsankündigung\n\nTsinghe GmbH\nGesellschaft mit beschränkter Haftung\nSchwalmtal\n\ngemäß § 394 Absatz 1 FamFG wegen Vermögenslosigkeit von Amts wegen zu\nlöschen. Gegen diese Verfügung kann Widerspruch eingelegt werden. Die Frist zur Erhebung eines Widerspruchs gegen die beabsichtigte Löschung von Amts wegen ist auf drei Monate festgesetzt."
    },
    {
      "date": "2026-01-05",
      "id": "141520",
      "original_text": "Löschungsankündigung\nNordrhein-Westfalen Amtsgericht Dortmund HRB 32344\nS & K Bau GmbH – Dortmund",
      "type": "Löschungsankündigung",
      "state": "Nordrhein-Westfalen",
      "amtsgericht": "Amtsgericht Dortmund",
      "registernummer": "HRB 32344",
      "registerart": "HRB",
      "company_name": "S & K Bau GmbH",
      "company_seat": "Dortmund",
      "details": "05.01.2026 (Bekanntmachungsdatum)\n\nNordrhein-Westfalen Amtsgericht Dortmund HRB 32344\nLöschungsankündigung\n\nS & K Bau GmbH\nGesellschaft mit beschränkter Haftung\nDortmund\n\nDas Registergericht beabsichtigt die Gesellschaft von Amts wegen nach § 394 FamFG zu löschen. Die Frist zur Erhebung eines Widerspruchs ist auf zwei Monate festgesetzt."
    },
    {
      "date": "2026-01-05",
      "id": "141521",
      "original_text": "Sonstige Registerbekanntmachung\nNordrhein-Westfalen Amtsgericht Köln HRB 51787\ndimedis Gesellschaft für digitale Medien Distribution mit beschränkter Haftung – Köln",
      "type": "Sonstige Registerbekanntmachung",
      "state": "Nordrhein-Westfalen",
      "amtsgericht": "Amtsgericht Köln",
      "registernummer": "HRB 51787",
      "registerart": "HRB",
      "company_name": "dimedis Gesellschaft für digitale Medien Distribution mit beschränkter Haftung",
      "company_seat": "Köln",
      "details": "05.01.2026 (Bekanntmachungsdatum)\n\nNordrhein-Westfalen Amtsgericht Köln HRB 51787\nSonstige Registerbekanntmachung 05.01.2026 (Eintragungsdatum)\n\ndimedis Gesellschaft für digitale Medien Distribution mit beschränkter Haftung\nGesellschaft mit beschränkter Haftung\nKöln\n\nAls nicht eingetragen wird veröffentlicht: Den Gläubigern der Gesellschaft, deren Forderungen begründet worden sind bevor die Eintragung der Beendigung des Gewinnabführungsvertrages  in das Handelsregister nach § 10 des Handelsgesetzbuches als bekanntgemacht gilt, hat der andere Vertragsteil Sicherheit zu leisten, wenn sie sich binnen sechs Monaten nach der Bekanntmachung der Eintragung zu diesem Zweck bei ihm melden."
    },
    {
      "date": "2026-01-05",
      "id": "141522",
      "original_text": "Sonstige Registerbekanntmachung\nNordrhein-Westfalen Amtsgericht Köln HRB 28753\nBanijay Germany Live GmbH – Köln",
      "type": "Sonstige Registerbekanntmachung",
      "state": "Nordrhein-Westfalen",
      "amtsgericht": "Amtsgericht Köln",
      "registernummer": "HRB 28753",
      "registerart": "HRB",
      "company_name": "Banijay Germany Live GmbH",
      "company_seat": "Köln",
      "details": "05.01.2026 (Bekanntmachungsdatum)\n\nNordrhein-Westfalen Amtsgericht Köln HRB 28753\nSonstige Registerbekanntmachung 05.01.2026 (Eintragungsdatum)\n\nBanijay Germany Live GmbH\nGesellschaft mit beschränkter Haftung\nKöln\n\nAls nicht eingetragen wird veröffentlicht: Den Gläubigern der Gesellschaft, deren Forderungen begründet worden sind bevor die Eintragung der Beendigung des Gewinnabführungsvertrages  in das Handelsregister nach § 10 des Handelsgesetzbuches als bekanntgemacht gilt, hat der andere Vertragsteil Sicherheit zu leisten, wenn sie sich binnen sechs Monaten nach der Bekanntmachung der Eintragung zu diesem Zweck bei ihm melden."
    },
    {
      "date": "2026-01-05",
      "id": "141523",
      "original_text": "Löschungsankündigung\nNordrhein-Westfalen Amtsgericht Gelsenkirchen HRB 14161\nDieter Voß GmbH – Bottrop",
      "type": "Löschungsankündigung",
      "state": "Nordrhein-Westfalen",
      "amtsgericht": "Amtsgericht Gelsenkirchen",
      "registernummer": "HRB 14161",
      "registerart": "HRB",
      "company_name": "Dieter Voß GmbH",
      "company_seat": "Bottrop",
      "details": "05.01.2026 (Bekanntmachungsdatum)\n\nNordrhein-Westfalen Amtsgericht Gelsenkirchen HRB 14161\nLöschungsankündigung\n\nDieter Voß GmbH\nGesellschaft mit beschränkter Haftung\nBottrop\n\nDas Gericht beabsichtigt, die Gesellschaft Dieter Voß GmbH mit Sitz in Bottrop, HRB 14161 Amtsgericht Gelsenkirchen, wegen Vermögenslosigkeit zu löschen.\n\nHiermit wird denjenigen, die an der Unterlassung der Löschung ein berechtigtes Interesse haben, gem. § 394 Abs. 2 FamFG Gelegenheit gegeben, gegen dieses Vorhaben binnen eines Monats nach dieser Bekanntmachung Widerspruch einzulegen. Der Widerspruch kann schriftlich oder zu Protokoll der Geschäftsstelle erhoben werden."
    },
    {
      "date": "2026-01-05",
      "id": "141524",
      "original_text": "Sonstige Registerbekanntmachung\nNordrhein-Westfalen Amtsgericht Düsseldorf HRB 64322\nAesica Pharmaceuticals GmbH – Monheim",
      "type": "Sonstige Registerbekanntmachung",
      "state": "Nordrhein-Westfalen",
      "amtsgericht": "Amtsgericht Düsseldorf",
      "registernummer": "HRB 64322",
      "registerart": "HRB",
      "company_name": "Aesica Pharmaceuticals GmbH",
      "company_seat": "Monheim",
      "details": "05.01.2026 (Bekanntmachungsdatum)\n\nNordrhein-Westfalen Amtsgericht Düsseldorf HRB 64322\nSonstige Registerbekanntmachung 05.01.2026 (Eintragungsdatum)\n\nAesica Pharmaceuticals GmbH\nGesellschaft mit beschränkter Haftung\nMonheim\n\nAls nicht eingetragen wird veröffentlicht: Den Gläubigern der Gesellschaft, deren Forderungen begründet worden sind bevor die Eintragung der Beendigung des Gewinnabführungsvertrages  in das Handelsregister nach § 10 des Handelsgesetzbuches als bekanntgemacht gilt, hat der andere Vertragsteil Sicherheit zu leisten, wenn sie sich binnen sechs Monaten nach der Bekanntmachung der Eintragung zu diesem Zweck bei ihm melden."
    },
    {
      "date": "2026-01-05",
      "id": "141525",
      "original_text": "Einreichung neuer Dokumente\nNordrhein-Westfalen Amtsgericht Paderborn HRB 2941\nORDIX AG Aktiengesellschaft für Softwareentwicklung, Schulung, Beratung und Systemintegration – Paderborn",
      "type": "Einreichung neuer Dokumente",
      "state": "Nordrhein-Westfalen",
      "amtsgericht": "Amtsgericht Paderborn",
      "registernummer": "HRB 2941",
      "registerart": "HRB",
      "company_name": "ORDIX AG Aktiengesellschaft für Softwareentwicklung, Schulung, Beratung und Systemintegration",
      "company_seat": "Paderborn",
      "details": "05.01.2026 (Bekanntmachungsdatum)\n\nNordrhein-Westfalen Amtsgericht Paderborn HRB 2941\nEinreichung neuer Dokumente\n\nORDIX AG Aktiengesellschaft für Softwareentwicklung, Schulung, Beratung und Systemintegration\nAktiengesellschaft\nPaderborn\n\nDem Registergericht ist eine Liste der Mitglieder des Aufsichtsrates eingereicht worden."
    },
    {
      "date": "2026-01-05",
      "id": "141526",
      "original_text": "Einreichung neuer Dokumente\nNordrhein-Westfalen Amtsgericht Düren HRB 7208\nSIG Euro Holding GmbH – Linnich",
      "type": "Einreichung neuer Dokumente",
      "state": "Nordrhein-Westfalen",
      "amtsgericht": "Amtsgericht Düren",
      "registernummer": "HRB 7208",
      "registerart": "HRB",
      "company_name": "SIG Euro Holding GmbH",
      "company_seat": "Linnich",
      "details": "05.01.2026 (Bekanntmachungsdatum)\n\nNordrhein-Westfalen Amtsgericht Düren HRB 7208\nEinreichung neuer Dokumente 05.01.2026 (Eintragungsdatum)\n\nSIG Euro Holding GmbH\nGesellschaft mit beschränkter Haftung\nLinnich"
    },
    {
      "date": "2026-01-05",
      "id": "141527",
      "original_text": "Löschungsankündigung\nNordrhein-Westfalen Amtsgericht Siegen HRB 12116\nSV-Stahlverarbeitungs-UG (haftungsbeschränkt) – Kirchhundem",
      "type": "Löschungsankündigung",
      "state": "Nordrhein-Westfalen",
      "amtsgericht": "Amtsgericht Siegen",
      "registernummer": "HRB 12116",
      "registerart": "HRB",
      "company_name": "SV-Stahlverarbeitungs-UG (haftungsbeschränkt)",
      "company_seat": "Kirchhundem",
      "details": "05.01.2026 (Bekanntmachungsdatum)\n\nNordrhein-Westfalen Amtsgericht Siegen HRB 12116\nLöschungsankündigung\n\nSV-Stahlverarbeitungs-UG (haftungsbeschränkt)\nGesellschaft mit beschränkter Haftung\nKirchhundem\n\nDas Registergericht beabsichtigt die Gesellschaft von Amts wegen nach § 394 FamFG zu löschen. Die Frist zur Erhebung eines Widerspruchs ist auf drei Monate festgesetzt."
    },
    {
      "date": "2026-01-05",
      "id": "141528",
      "original_text": "Löschungsankündigung\nNordrhein-Westfalen Amtsgericht Köln HRB 93614\nMeopin-Op UG (haftungsbeschränkt) – Köln",
      "type": "Löschungsankündigung",
      "state": "Nordrhein-Westfalen",
      "amtsgericht": "Amtsgericht Köln",
      "registernummer": "HRB 93614",
      "registerart": "HRB",
      "company_name": "Meopin-Op UG (haftungsbeschränkt)",
      "company_seat": "Köln",
      "details": "05.01.2026 (Bekanntmachungsdatum)\n\nNordrhein-Westfalen Amtsgericht Köln HRB 93614\nLöschungsankündigung\n\nMeopin-Op UG (haftungsbeschränkt)\nGesellschaft mit beschränkter Haftung\nKöln\n\nDas Registergericht beabsichtigt die Gesellschaft von Amts wegen nach § 394 FamFG zu löschen. Die Frist zur Erhebung eines Widerspruchs ist auf einen Monat festgesetzt."
    },
    {
      "date": "2026-01-05",
      "id": "141529",
      "original_text": "Sonstige Registerbekanntmachung\nNordrhein-Westfalen Amtsgericht Köln HRB 70443\nInterzero Business Solutions GmbH – Köln",
      "type": "Sonstige Registerbekanntmachung",
      "state": "Nordrhein-Westfalen",
      "amtsgericht": "Amtsgericht Köln",
      "registernummer": "HRB 70443",
      "registerart": "HRB",
      "company_name": "Interzero Business Solutions GmbH",
      "company_seat": "Köln",
      "details": "05.01.2026 (Bekanntmachungsdatum)\n\nNordrhein-Westfalen Amtsgericht Köln HRB 70443\nSonstige Registerbekanntmachung 05.01.2026 (Eintragungsdatum)\n\nInterzero Business Solutions GmbH\nGesellschaft mit beschränkter Haftung\nKöln\n\nAls nicht eingetragen wird veröffentlicht: Den Gläubigern der Gesellschaft, deren Forderungen begründet worden sind bevor die Eintragung der Beendigung des Gewinnabführungsvertrages  in das Handelsregister nach § 10 des Handelsgesetzbuches als bekanntgemacht gilt, hat der andere Vertragsteil Sicherheit zu leisten, wenn sie sich binnen sechs Monaten nach der Bekanntmachung der Eintragung zu diesem Zweck bei ihm melden."
    },
    {
      "date": "2026-01-05",
      "id": "141530",
      "original_text": "Löschungsankündigung\nNordrhein-Westfalen Amtsgericht Siegen HRB 12545\nHörnken Verwaltungs GmbH – Finnentrop",
      "type": "Löschungsankündigung",
      "state": "Nordrhein-Westfalen",
      "amtsgericht": "Amtsgericht Siegen",
      "registernummer": "HRB 12545",
      "registerart": "HRB",
      "company_name": "Hörnken Verwaltungs GmbH",
      "company_seat": "Finnentrop",
      "details": "05.01.2026 (Bekanntmachungsdatum)\n\nNordrhein-Westfalen Amtsgericht Siegen HRB 12545\nLöschungsankündigung\n\nHörnken Verwaltungs GmbH\nGesellschaft mit beschränkter Haftung\nFinnentrop\n\nDas Registergericht beabsichtigt die Gesellschaft von Amts wegen nach § 394 FamFG zu löschen. Die Frist zur Erhebung eines Widerspruchs ist auf drei Monate festgesetzt."
    },
    {
      "date": "2026-01-05",
      "id": "141531",
      "original_text": "Sonstige Registerbekanntmachung\nNordrhein-Westfalen Amtsgericht Mönchengladbach HRB 9\nGemeinnützige Wohnungs- und Siedlungsgesellschaft mbH – Mönchengladbach",
      "type": "Sonstige Registerbekanntmachung",
      "state": "Nordrhein-Westfalen",
      "amtsgericht": "Amtsgericht Mönchengladbach",
      "registernummer": "HRB 9",
      "registerart": "HRB",
      "company_name": "Gemeinnützige Wohnungs- und Siedlungsgesellschaft mbH",
      "company_seat": "Mönchengladbach",
      "details": "05.01.2026 (Bekanntmachungsdatum)\n\nNordrhein-Westfalen Amtsgericht Mönchengladbach HRB 9\nSonstige Registerbekanntmachung 30.12.2025 (Eintragungsdatum)\n\nGemeinnützige Wohnungs- und Siedlungsgesellschaft mbH\nGesellschaft mit beschränkter Haftung\nMönchengladbach\n\n106 AktG\nDem Registergericht ist eine Liste der Mitglieder des Aufsichtsrates eingereicht worden."
    },
    {
      "date": "2026-01-05",
      "id": "141532",
      "original_text": "Registerbekanntmachung nach dem Umwandlungsgesetz\nNordrhein-Westfalen Amtsgericht Düsseldorf HRB 1080\nVDI Verlag GmbH – Düsseldorf",
      "type": "Registerbekanntmachung nach dem Umwandlungsgesetz",
      "state": "Nordrhein-Westfalen",
      "amtsgericht": "Amtsgericht Düsseldorf",
      "registernummer": "HRB 1080",
      "registerart": "HRB",
      "company_name": "VDI Verlag GmbH",
      "company_seat": "Düsseldorf",
      "details": "05.01.2026 (Bekanntmachungsdatum)\n\nNordrhein-Westfalen Amtsgericht Düsseldorf HRB 1080\nRegisterbekanntmachung nach dem Umwandlungsgesetz 05.01.2026 (Eintragungsdatum)\n\nVDI Verlag GmbH\nGesellschaft mit beschränkter Haftung\nDüsseldorf\n\nDen Gläubigern der an der Verschmelzung beteiligten Rechtsträger ist, wenn sie binnen sechs Monaten nach dem Tag, an dem die Eintragung der Verschmelzung in das Register des Sitzes desjenigen Rechtsträgers, dessen Gläubiger sie sind, nach § 19 Absatz 3 UmwG als bekanntgemacht gilt, ihren Anspruch nach Grund und Höhe schriftlich anmelden, Sicherheit zu leisten, soweit sie nicht Befriedigung verlangen können. Dieses Recht steht den Gläubigern jedoch nur zu, wenn sie glaubhaft machen, dass durch die Verschmelzung die Erfüllung ihrer Forderung gefährdet wird."
    },
    {
      "date": "2026-01-05",
      "id": "141533",
      "original_text": "Registerbekanntmachung nach dem Umwandlungsgesetz\nNordrhein-Westfalen Amtsgericht Hagen HRB 7374\nZL Microdent-Attachment Verwaltungs GmbH – Breckerfeld",
      "type": "Registerbekanntmachung nach dem Umwandlungsgesetz",
      "state": "Nordrhein-Westfalen",
      "amtsgericht": "Amtsgericht Hagen",
      "registernummer": "HRB 7374",
      "registerart": "HRB",
      "company_name": "ZL Microdent-Attachment Verwaltungs GmbH",
      "company_seat": "Breckerfeld",
      "details": "05.01.2026 (Bekanntmachungsdatum)\n\nNordrhein-Westfalen Amtsgericht Hagen HRB 7374\nRegisterbekanntmachung nach dem Umwandlungsgesetz 05.01.2026 (Eintragungsdatum)\n\nZL Microdent-Attachment Verwaltungs GmbH\nGesellschaft mit beschränkter Haftung\nBreckerfeld\n\nDen Gläubigern der an der Verschmelzung beteiligten Rechtsträger ist, wenn sie binnen sechs Monaten nach dem Tag, an dem die Eintragung der Verschmelzung in das Register des Sitzes derjenigen Rechtsträger deren Gläubiger sie sind, nach § 19 Absatz 3 UmwG als bekanntgemacht gilt, ihren Anspruch nach Grund und Höhe schriftlich anmelden, Sicherheit zu leisten, soweit sie nicht Befriedigung verlangen können. Dieses Recht steht den Gläubigern jedoch nur zu, wenn sie glaubhaft machen, dass durch die Verschmelzung die Erfüllung ihrer Forderung gefährdet wird."
    },
    {
      "date": "2026-01-05",
      "id": "141534",
      "original_text": "Einreichung neuer Dokumente\nNordrhein-Westfalen Amtsgericht Düren HRB 5182\nSIG Combibloc GmbH – Linnich",
      "type": "Einreichung neuer Dokumente",
      "state": "Nordrhein-Westfalen",
      "amtsgericht": "Amtsgericht Düren",
      "registernummer": "HRB 5182",
      "registerart": "HRB",
      "company_name": "SIG Combibloc GmbH",
      "company_seat": "Linnich",
      "details": "05.01.2026 (Bekanntmachungsdatum)\n\nNordrhein-Westfalen Amtsgericht Düren HRB 5182\nEinreichung neuer Dokumente 05.01.2026 (Eintragungsdatum)\n\nSIG Combibloc GmbH\nGesellschaft mit beschränkter Haftung\nLinnich\n\nDem Registergericht ist eine neue Liste der Mitglieder des Aufsichtsrates eingereicht worden."
    },
    {
      "date": "2026-01-05",
      "id": "141535",
      "original_text": "Löschungsankündigung\nNordrhein-Westfalen Amtsgericht Neuss HRB 24098\nInteractive World (INWO) GmbH – Neuss",
      "type": "Löschungsankündigung",
      "state": "Nordrhein-Westfalen",
      "amtsgericht": "Amtsgericht Neuss",
      "registernummer": "HRB 24098",
      "registerart": "HRB",
      "company_name": "Interactive World (INWO) GmbH",
      "company_seat": "Neuss",
      "details": "05.01.2026 (Bekanntmachungsdatum)\n\nNordrhein-Westfalen Amtsgericht Neuss HRB 24098\nLöschungsankündigung\n\nInteractive World (INWO) GmbH\nGesellschaft mit beschränkter Haftung\nNeuss\n\nes ist beabsichtigt, die im Handelsregister eingetragene Gesellschaft gemäß § 394 Absatz 1 FamFG wegen Vermögenslosigkeit von Amts wegen zu löschen.\n\nFrist zur Geltendmachung eines Widerspruchs: 1 Monat\n\nRechtsbehelfsbelehrung:\nGegen diese Verfügung können Sie Widerspruch einlegen. Der Widerspruch ist bei dem Amtsgericht Neuss, Breite Straße 48, 41460 Neuss schriftlich in deutscher Sprache oder zur Niederschrift der Geschäftsstelle einzulegen. Der Widerspruch kann auch zur Niederschrift der Geschäftsstelle eines jeden Amtsgerichtes abgegeben werden. Die Einlegung ist auch durch Übertragung eines elektronischen Dokuments an die elektronische Poststelle des Gerichts möglich. Das elektronische Dokument muss für die Bearbeitung durch das Gericht geeignet und mit einer qualifizierten elektronischen Signatur der verantwortenden Person versehen sein oder von der verantwortenden Person signiert und auf einem sicheren Übermittlungsweg gemäß § 130a ZPO nach näherer Maßgabe der Verordnung über die technischen Rahmenbedingungen des elektronischen Rechtsverkehrs und über das besondere elektronische Behördenpostfach (BGBl. I, S.3803) eingereicht werden. Weitere Informationen erhalten Sie auf der Internetseite www.justiz.de.\nDer Widerspruch muss spätestens innerhalb der gesetzten Frist bei dem Amtsgericht Neuss eingegangen sein. Dies gilt auch dann, wenn der Widerspruch zur Niederschrift der Geschäftsstelle eines anderen Amtsgerichtes abgegeben wurde. Die Frist beginnt mit der Veröffentlichung. Fällt das Ende der Frist auf einen Sonntag, einen allgemeinen Feiertag oder Sonnabend, so endet die Frist mit Ablauf des nächsten Werktages. Der Widerspruch muss die Bezeichnung der angefochtenen Verfügung sowie die Erklärung enthalten, dass Widerspruch gegen diese Verfügung eingelegt wird. Er ist zu unterzeichnen und soll begründet werden."
    },
    {
      "date": "2026-01-05",
      "id": "141536",
      "original_text": "Löschungsankündigung\nNordrhein-Westfalen Amtsgericht Dortmund HRB 23082\nVithos Consulting GmbH – Dortmund",
      "type": "Löschungsankündigung",
      "state": "Nordrhein-Westfalen",
      "amtsgericht": "Amtsgericht Dortmund",
      "registernummer": "HRB 23082",
      "registerart": "HRB",
      "company_name": "Vithos Consulting GmbH",
      "company_seat": "Dortmund",
      "details": "05.01.2026 (Bekanntmachungsdatum)\n\nNordrhein-Westfalen Amtsgericht Dortmund HRB 23082\nLöschungsankündigung 22.12.2025 (Eintragungsdatum)\n\nVithos Consulting GmbH\nGesellschaft mit beschränkter Haftung\nDortmund\n\nDas Registergericht beabsichtigt die Gesellschaft von Amts wegen nach § 394 FamFG zu löschen. Die Frist zur Erhebung eines Widerspruchs ist auf zwei Monate festgesetzt."
    },
    {
      "date": "2026-01-05",
      "id": "141537",
      "original_text": "Sonstige Registerbekanntmachung\nNordrhein-Westfalen Amtsgericht Bonn HRB 25639\nSchwerpunktReha Bonn GmbH – Bonn",
      "type": "Sonstige Registerbekanntmachung",
      "state": "Nordrhein-Westfalen",
      "amtsgericht": "Amtsgericht Bonn",
      "registernummer": "HRB 25639",
      "registerart": "HRB",
      "company_name": "SchwerpunktReha Bonn GmbH",
      "company_seat": "Bonn",
      "details": "05.01.2026 (Bekanntmachungsdatum)\n\nNordrhein-Westfalen Amtsgericht Bonn HRB 25639\nSonstige Registerbekanntmachung 05.01.2026 (Eintragungsdatum)\n\nSchwerpunktReha Bonn GmbH\nGesellschaft mit beschränkter Haftung\nBonn\n\nAls nicht eingetragen wird veröffentlicht: Den Gläubigern der Gesellschaft, deren Forderungen begründet worden sind bevor die Eintragung der Beendigung des Beherrschungs- und Gewinnabführungsvertrages  in das Handelsregister nach § 10 des Handelsgesetzbuches als bekanntgemacht gilt, hat der andere Vertragsteil Sicherheit zu leisten, wenn sie sich binnen sechs Monaten nach der Bekanntmachung der Eintragung zu diesem Zweck bei ihm melden."
    },
    {
      "date": "2026-01-05",
      "id": "141538",
      "original_text": "Sonstige Registerbekanntmachung\nNordrhein-Westfalen Amtsgericht Köln HRB 35905\nPaul Starzonek Baustoff-Fachhandel GmbH – Köln",
      "type": "Sonstige Registerbekanntmachung",
      "state": "Nordrhein-Westfalen",
      "amtsgericht": "Amtsgericht Köln",
      "registernummer": "HRB 35905",
      "registerart": "HRB",
      "company_name": "Paul Starzonek Baustoff-Fachhandel GmbH",
      "company_seat": "Köln",
      "details": "05.01.2026 (Bekanntmachungsdatum)\n\nNordrhein-Westfalen Amtsgericht Köln HRB 35905\nSonstige Registerbekanntmachung 05.01.2026 (Eintragungsdatum)\n\nPaul Starzonek Baustoff-Fachhandel GmbH\nGesellschaft mit beschränkter Haftung\nKöln\n\nDen Gläubigern der Gesellschaft, deren Forderungen begründet worden sind bevor die Eintragung der Beendigung des Gewinnabführungsvertrages  in das Handelsregister nach § 10 des Handelsgesetzbuches als bekanntgemacht gilt, hat der andere Vertragsteil Sicherheit zu leisten, wenn sie sich binnen sechs Monaten nach der Bekanntmachung der Eintragung zu diesem Zweck bei ihm melden."
    },
    {
      "date": "2026-01-05",
      "id": "141539",
      "original_text": "Registerbekanntmachung nach dem Umwandlungsgesetz\nNordrhein-Westfalen Amtsgericht Siegen HRB 11111\nPolaris Beteiligung AG – Siegen",
      "type": "Registerbekanntmachung nach dem Umwandlungsgesetz",
      "state": "Nordrhein-Westfalen",
      "amtsgericht": "Amtsgericht Siegen",
      "registernummer": "HRB 11111",
      "registerart": "HRB",
      "company_name": "Polaris Beteiligung AG",
      "company_seat": "Siegen",
      "details": "05.01.2026 (Bekanntmachungsdatum)\n\nNordrhein-Westfalen Amtsgericht Siegen HRB 11111\nRegisterbekanntmachung nach dem Umwandlungsgesetz 01.01.2026 (Eintragungsdatum)\n\nPolaris Beteiligung AG\nAktiengesellschaft\nSiegen\n\nDen Gläubigern der an der formwechselnden Umwandlung beteiligten Rechtsträger ist, wenn sie binnen sechs Monaten nach dem Tag, an dem die Eintragung der formwechselnden Umwandlung in das Register des Sitzes desjenigen Rechtsträgers, dessen Gläubiger sie sind, nach § 19 Absatz 3 UmwG als bekanntgemacht gilt, ihren Anspruch nach Grund und Höhe schriftlich anmelden, Sicherheit zu leisten, soweit sie nicht Befriedigung verlangen können. Dieses Recht steht den Gläubigern jedoch nur zu, wenn sie glaubhaft machen, dass durch die formwechselnden Umwandlung die Erfüllung ihrer Forderung gefährdet wird."
    },
    {
      "date": "2026-01-05",
      "id": "141540",
      "original_text": "Löschungsankündigung\nNordrhein-Westfalen Amtsgericht Bad Oeynhausen HRA 4556\nBrockfeld & Meyer GmbH & Co. KG – Bünde",
      "type": "Löschungsankündigung",
      "state": "Nordrhein-Westfalen",
      "amtsgericht": "Amtsgericht Bad Oeynhausen",
      "registernummer": "HRA 4556",
      "registerart": "HRA",
      "company_name": "Brockfeld & Meyer GmbH & Co. KG",
      "company_seat": "Bünde",
      "details": "05.01.2026 (Bekanntmachungsdatum)\n\nNordrhein-Westfalen Amtsgericht Bad Oeynhausen HRA 4556\nLöschungsankündigung 05.12.2025 (Eintragungsdatum)\n\nBrockfeld & Meyer GmbH & Co. KG\nKommanditgesellschaft\nBünde\n\nDas Registergericht beabsichtigt die Firma von Amts wegen nach § 394 FamFG zu löschen. Die Frist zur Erhebung eines Widerspruchs ist auf einen Monat festgesetzt."
    },
    {
      "date": "2026-01-05",
      "id": "141541",
      "original_text": "Sonstige Registerbekanntmachung\nNordrhein-Westfalen Amtsgericht Aachen HRB 13606\nElektro Frings GmbH – Alsdorf",
      "type": "Sonstige Registerbekanntmachung",
      "state": "Nordrhein-Westfalen",
      "amtsgericht": "Amtsgericht Aachen",
      "registernummer": "HRB 13606",
      "registerart": "HRB",
      "company_name": "Elektro Frings GmbH",
      "company_seat": "Alsdorf",
      "details": "05.01.2026 (Bekanntmachungsdatum)\n\nNordrhein-Westfalen Amtsgericht Aachen HRB 13606\nSonstige Registerbekanntmachung 05.01.2026 (Eintragungsdatum)\n\nElektro Frings GmbH\nGesellschaft mit beschränkter Haftung\nAlsdorf\n\nAls nicht eingetragen wird veröffentlicht: Den Gläubigern der Gesellschaft, deren Forderungen begründet worden sind bevor die Eintragung der Beendigung des Beherrschungs- und Gewinnabführungsvertrages  in das Handelsregister nach § 10 des Handelsgesetzbuches als bekanntgemacht gilt, hat der andere Vertragsteil Sicherheit zu leisten, wenn sie sich binnen sechs Monaten nach der Bekanntmachung der Eintragung zu diesem Zweck bei ihm melden."
    },
    {
      "date": "2026-01-05",
      "id": "141542",
      "original_text": "Einreichung neuer Dokumente\nNordrhein-Westfalen Amtsgericht Münster HRB 3844\nGWS Gesellschaft für Warenwirtschafts-Systeme mit beschränkter Haftung – Münster",
      "type": "Einreichung neuer Dokumente",
      "state": "Nordrhein-Westfalen",
      "amtsgericht": "Amtsgericht Münster",
      "registernummer": "HRB 3844",
      "registerart": "HRB",
      "company_name": "GWS Gesellschaft für Warenwirtschafts-Systeme mit beschränkter Haftung",
      "company_seat": "Münster",
      "details": "05.01.2026 (Bekanntmachungsdatum)\n\nNordrhein-Westfalen Amtsgericht Münster HRB 3844\nEinreichung neuer Dokumente\n\nGWS Gesellschaft für Warenwirtschafts-Systeme mit beschränkter Haftung\nGesellschaft mit beschränkter Haftung\nMünster\n\nDem Registergericht ist eine neue Liste der Mitglieder des Aufsichtsrates eingereicht worden."
    },
    {
      "date": "2026-01-05",
      "id": "141543",
      "original_text": "Registerbekanntmachung nach dem Umwandlungsgesetz\nNordrhein-Westfalen Amtsgericht Steinfurt HRB 13372\nBolero Kassel Gastro GmbH – Emsdetten",
      "type": "Registerbekanntmachung nach dem Umwandlungsgesetz",
      "state": "Nordrhein-Westfalen",
      "amtsgericht": "Amtsgericht Steinfurt",
      "registernummer": "HRB 13372",
      "registerart": "HRB",
      "company_name": "Bolero Kassel Gastro GmbH",
      "company_seat": "Emsdetten",
      "details": "05.01.2026 (Bekanntmachungsdatum)\n\nNordrhein-Westfalen Amtsgericht Steinfurt HRB 13372\nRegisterbekanntmachung nach dem Umwandlungsgesetz 05.01.2026 (Eintragungsdatum)\n\nBolero Kassel Gastro GmbH\nGesellschaft mit beschränkter Haftung\nEmsdetten\n\nDen Gläubigern der an der Verschmelzung beteiligten Rechtsträger ist, wenn sie binnen sechs Monaten nach dem Tag, an dem die Eintragung der Verschmelzung in das Register des Sitzes desjenigen Rechtsträgers, dessen Gläubiger sie sind, nach § 19 Absatz 3 UmwG als bekanntgemacht gilt, ihren Anspruch nach Grund und Höhe schriftlich anmelden, Sicherheit zu leisten, soweit sie nicht Befriedigung verlangen können. Dieses Recht steht den Gläubigern jedoch nur zu, wenn sie glaubhaft machen, dass durch die Verschmelzung die Erfüllung ihrer Forderung gefährdet wird."
    },
    {
      "date": "2026-01-05",
      "id": "141544",
      "original_text": "Einreichung neuer Dokumente\nNordrhein-Westfalen Amtsgericht Bonn HRB 10752\nMeckenheimer Entwicklungs- und Wohnungsgesellschaft mbH – Meckenheim",
      "type": "Einreichung neuer Dokumente",
      "state": "Nordrhein-Westfalen",
      "amtsgericht": "Amtsgericht Bonn",
      "registernummer": "HRB 10752",
      "registerart": "HRB",
      "company_name": "Meckenheimer Entwicklungs- und Wohnungsgesellschaft mbH",
      "company_seat": "Meckenheim",
      "details": "05.01.2026 (Bekanntmachungsdatum)\n\nNordrhein-Westfalen Amtsgericht Bonn HRB 10752\nEinreichung neuer Dokumente\n\nMeckenheimer Entwicklungs- und Wohnungsgesellschaft mbH\nGesellschaft mit beschränkter Haftung\nMeckenheim\n\nDem Registergericht ist eine neue Liste der Mitglieder des Aufsichtsrates eingereicht worden."
    },
    {
      "date": "2026-01-05",
      "id": "141545",
      "original_text": "Löschungsankündigung\nNordrhein-Westfalen Amtsgericht Dortmund HRB 32728\nImmodo Unternehmergesellschaft (haftungsbeschränkt) – Dortmund",
      "type": "Löschungsankündigung",
      "state": "Nordrhein-Westfalen",
      "amtsgericht": "Amtsgericht Dortmund",
      "registernummer": "HRB 32728",
      "registerart": "HRB",
      "company_name": "Immodo Unternehmergesellschaft (haftungsbeschränkt)",
      "company_seat": "Dortmund",
      "details": "05.01.2026 (Bekanntmachungsdatum)\n\nNordrhein-Westfalen Amtsgericht Dortmund HRB 32728\nLöschungsankündigung 05.01.2026 (Eintragungsdatum)\n\nImmodo Unternehmergesellschaft (haftungsbeschränkt)\nGesellschaft mit beschränkter Haftung\nDortmund\n\nDas Registergericht beabsichtigt die Gesellschaft von Amts wegen nach § 394 FamFG zu löschen. Die Frist zur Erhebung eines Widerspruchs ist auf zwei Monate festgesetzt."
    },
    {
      "date": "2026-01-05",
      "id": "141546",
      "original_text": "Löschungsankündigung\nNordrhein-Westfalen Amtsgericht Düsseldorf HRB 99691\nHAMMA Helden GmbH – Düsseldorf",
      "type": "Löschungsankündigung",
      "state": "Nordrhein-Westfalen",
      "amtsgericht": "Amtsgericht Düsseldorf",
      "registernummer": "HRB 99691",
      "registerart": "HRB",
      "company_name": "HAMMA Helden GmbH",
      "company_seat": "Düsseldorf",
      "details": "05.01.2026 (Bekanntmachungsdatum)\n\nNordrhein-Westfalen Amtsgericht Düsseldorf HRB 99691\nLöschungsankündigung\n\nHAMMA Helden GmbH\nGesellschaft mit beschränkter Haftung\nDüsseldorf\n\nDas Registergericht beabsichtigt die Gesellschaft von Amts wegen nach § 394 FamFG zu löschen. Die Frist zur Erhebung eines Widerspruchs ist auf 3 Wochen festgesetzt.\n\nRechtsbehelfsbelehrung:\nDas Widerspruchsrecht steht jedem zu, der an der Unterlassung der Löschung ein berechtigtes Interesse hat. Der Widerspruch ist bei dem Amtsgericht Düsseldorf -Registergericht-, Werdener Straße 1, 40227 Düsseldorf schriftlich in deutscher Sprache oder zur Niederschrift der Geschäftsstelle einzulegen. Der Widerspruch kann auch zur Niederschrift der Geschäftsstelle eines jeden Amtsgerichtes abgegeben werden. Die Einlegung ist auch durch Übertragung eines elektronischen Dokuments an die elektronische Poststelle des Gerichts möglich. Das elektronische Dokument muss für die Bearbeitung durch das Gericht geeignet und mit einer qualifizierten elektronischen Signatur der verantwortenden Person versehen sein oder von der verantwortenden Person signiert und auf einem sicheren Übermittlungsweg gemäß § 130a ZPO nach näherer Maßgabe der Verordnung über die technischen Rahmenbedingungen des elektronischen Rechtsverkehrs und über das besondere elektronische Behördenpostfach (BGBl. I, S.3803) eingereicht werden. Weitere Informationen erhalten Sie auf der Internetseite www.justiz.de.\nDer Widerspruch muss spätestens innerhalb der gesetzten Frist nach dem Datum der Bekanntmachung der Löschungsankündigung bei dem Amtsgericht - Registergericht - Düsseldorf eingegangen sein.  Dies gilt auch dann, wenn der Widerspruch zur Niederschrift der Geschäftsstelle eines anderen Amtsgerichtes abgegeben wurde. Die Frist beginnt mit dem Tage der Bekanntmachung der Löschungsankündigung in dem für die Bekanntmachung der Eintragungen in das Handelsregister bestimmten elektronischen Informations- und Kommunikationssystem nach § 10 des Handelsgesetzbuches. Fällt das Ende der Frist auf einen Sonntag, einen allgemeinen Feiertag oder Sonnabend, so endet die Frist mit Ablauf des nächsten Werktages.\nDer Widerspruch muss die Bezeichnung der angefochtenen Löschungsankündigung sowie die Erklärung enthalten, dass Widerspruch gegen diese Löschungsankündigung eingelegt wird. Er ist zu unterzeichnen und soll begründet werden."
    },
    {
      "date": "2026-01-05",
      "id": "141547",
      "original_text": "Registerbekanntmachung nach dem Umwandlungsgesetz\nNordrhein-Westfalen Amtsgericht Düsseldorf HRB 75815\nPalais Vest GmbH – Düsseldorf",
      "type": "Registerbekanntmachung nach dem Umwandlungsgesetz",
      "state": "Nordrhein-Westfalen",
      "amtsgericht": "Amtsgericht Düsseldorf",
      "registernummer": "HRB 75815",
      "registerart": "HRB",
      "company_name": "Palais Vest GmbH",
      "company_seat": "Düsseldorf",
      "details": "05.01.2026 (Bekanntmachungsdatum)\n\nNordrhein-Westfalen Amtsgericht Düsseldorf HRB 75815\nRegisterbekanntmachung nach dem Umwandlungsgesetz 05.01.2026 (Eintragungsdatum)\n\nPalais Vest GmbH\nGesellschaft mit beschränkter Haftung\nDüsseldorf\n\nDen Gläubigern der an der formwechselnden Umwandlung beteiligten Rechtsträger ist, wenn sie binnen sechs Monaten nach dem Tag, an dem die Eintragung der formwechselnden Umwandlung in das Register des Sitzes desjenigen Rechtsträgers, dessen Gläubiger sie sind, nach § 19 Absatz 3 UmwG als bekanntgemacht gilt, ihren Anspruch nach Grund und Höhe schriftlich anmelden, Sicherheit zu leisten, soweit sie nicht Befriedigung verlangen können. Dieses Recht steht den Gläubigern jedoch nur zu, wenn sie glaubhaft machen, dass durch die formwechselnden Umwandlung die Erfüllung ihrer Forderung gefährdet wird."
    },
    {
      "date": "2026-01-05",
      "id": "141548",
      "original_text": "Einreichung neuer Dokumente\nNordrhein-Westfalen Amtsgericht Köln HRB 2164\nROLAND Rechtsschutz-Versicherungs-AG – Köln",
      "type": "Einreichung neuer Dokumente",
      "state": "Nordrhein-Westfalen",
      "amtsgericht": "Amtsgericht Köln",
      "registernummer": "HRB 2164",
      "registerart": "HRB",
      "company_name": "ROLAND Rechtsschutz-Versicherungs-AG",
      "company_seat": "Köln",
      "details": "05.01.2026 (Bekanntmachungsdatum)\n\nNordrhein-Westfalen Amtsgericht Köln HRB 2164\nEinreichung neuer Dokumente\n\nROLAND Rechtsschutz-Versicherungs-AG\nAktiengesellschaft\nKöln\n\nDem Registergericht ist eine neue Liste der Mitglieder des Aufsichtsrates eingereicht worden."
    },
    {
      "date": "2026-01-05",
      "id": "141549",
      "original_text": "Sonstige Registerbekanntmachung\nHessen Amtsgericht Gießen HRB 8796\nAEDIM Fulda GmbH – Schlitz",
      "type": "Sonstige Registerbekanntmachung",
      "state": "Hessen",
      "amtsgericht": "Amtsgericht Gießen",
      "registernummer": "HRB 8796",
      "registerart": "HRB",
      "company_name": "AEDIM Fulda GmbH",
      "company_seat": "Schlitz",
      "details": "05.01.2026 (Bekanntmachungsdatum)\n\nHessen Amtsgericht Gießen HRB 8796\nSonstige Registerbekanntmachung 05.01.2026 (Eintragungsdatum)\n\nAEDIM Fulda GmbH\nGesellschaft mit beschränkter Haftung\nSchlitz\n\nDen Gläubigern der Gesellschaft, deren Forderungen begründet worden sind, bevor die Eintragung der Beendigung des Vertrags in das Handelsregister nach § 10 HGB bekannt gemacht worden ist, ist vom anderen Vertragsteil Sicherheit zu leisten, wenn sie sich binnen sechs Monaten nach dieser Bekanntmachung zu diesem Zweck bei ihm melden."
    },
    {
      "date": "2026-01-05",
      "id": "141550",
      "original_text": "Registerbekanntmachung nach dem Umwandlungsgesetz\nHessen Amtsgericht Frankfurt am Main HRB 87932\nWillis Towers Watson Holding GmbH – Frankfurt am Main",
      "type": "Registerbekanntmachung nach dem Umwandlungsgesetz",
      "state": "Hessen",
      "amtsgericht": "Amtsgericht Frankfurt am Main",
      "registernummer": "HRB 87932",
      "registerart": "HRB",
      "company_name": "Willis Towers Watson Holding GmbH",
      "company_seat": "Frankfurt am Main",
      "details": "05.01.2026 (Bekanntmachungsdatum)\n\nHessen Amtsgericht Frankfurt am Main HRB 87932\nRegisterbekanntmachung nach dem Umwandlungsgesetz 05.01.2026 (Eintragungsdatum)\n\nWillis Towers Watson Holding GmbH\nGesellschaft mit beschränkter Haftung\nFrankfurt am Main\n\nDen Gläubigern der an der Verschmelzung beteiligten Rechtsträger ist, wenn sie binnen sechs Monaten nach dem Tag, an dem die Eintragung der Verschmelzung in das Register des Sitzes desjenigen Rechtsträgers, dessen Gläubiger sie sind, nach § 19 Absatz 3 UmwG bekannt gemacht worden ist, ihren Anspruch nach Grund und Höhe schriftlich anmelden, Sicherheit zu leisten, soweit sie nicht Befriedigung verlangen können. Dieses Recht steht den Gläubigern jedoch nur zu, wenn sie glaubhaft machen, dass durch die Verschmelzung die Erfüllung ihrer Forderung gefährdet wird."
    },
    {
      "date": "2026-01-05",
      "id": "141551",
      "original_text": "Registerbekanntmachung nach dem Umwandlungsgesetz\nHessen Amtsgericht Frankfurt am Main HRB 137442\nWTW Germany A GmbH – Frankfurt am Main",
      "type": "Registerbekanntmachung nach dem Umwandlungsgesetz",
      "state": "Hessen",
      "amtsgericht": "Amtsgericht Frankfurt am Main",
      "registernummer": "HRB 137442",
      "registerart": "HRB",
      "company_name": "WTW Germany A GmbH",
      "company_seat": "Frankfurt am Main",
      "details": "05.01.2026 (Bekanntmachungsdatum)\n\nHessen Amtsgericht Frankfurt am Main HRB 137442\nRegisterbekanntmachung nach dem Umwandlungsgesetz 05.01.2026 (Eintragungsdatum)\n\nWTW Germany A GmbH\nGesellschaft mit beschränkter Haftung\nFrankfurt am Main\n\nDen Gläubigern der an der Verschmelzung beteiligten Rechtsträger ist, wenn sie binnen sechs Monaten nach dem Tag, an dem die Eintragung der Verschmelzung in das Register des Sitzes desjenigen Rechtsträgers, dessen Gläubiger sie sind, nach § 19 Absatz 3 UmwG bekannt gemacht worden ist, ihren Anspruch nach Grund und Höhe schriftlich anmelden, Sicherheit zu leisten, soweit sie nicht Befriedigung verlangen können. Dieses Recht steht den Gläubigern jedoch nur zu, wenn sie glaubhaft machen, dass durch die Verschmelzung die Erfüllung ihrer Forderung gefährdet wird."
    },
    {
      "date": "2026-01-05",
      "id": "141552",
      "original_text": "Registerbekanntmachung nach dem Umwandlungsgesetz\nHessen Amtsgericht Friedberg HRB 10777\nSapurna GmbH – Echzell",
      "type": "Registerbekanntmachung nach dem Umwandlungsgesetz",
      "state": "Hessen",
      "amtsgericht": "Amtsgericht Friedberg",
      "registernummer": "HRB 10777",
      "registerart": "HRB",
      "company_name": "Sapurna GmbH",
      "company_seat": "Echzell",
      "details": "05.01.2026 (Bekanntmachungsdatum)\n\nHessen Amtsgericht Friedberg HRB 10777\nRegisterbekanntmachung nach dem Umwandlungsgesetz 05.01.2026 (Eintragungsdatum)\n\nSapurna GmbH\nGesellschaft mit beschränkter Haftung\nEchzell\n\nDen Gläubigern der an der Verschmelzung beteiligten Rechtsträger ist, wenn sie binnen sechs Monaten nach dem Tag, an dem die Eintragung der Verschmelzung in das Register des Sitzes desjenigen Rechtsträgers, dessen Gläubiger sie sind, nach § 19 Absatz 3 UmwG bekannt gemacht worden ist, ihren Anspruch nach Grund und Höhe schriftlich anmelden, Sicherheit zu leisten, soweit sie nicht Befriedigung verlangen können. Dieses Recht steht den Gläubigern jedoch nur zu, wenn sie glaubhaft machen, dass durch die Verschmelzung die Erfüllung ihrer Forderung gefährdet wird."
    },
    {
      "date": "2026-01-05",
      "id": "141553",
      "original_text": "Einreichung neuer Dokumente\nHessen Amtsgericht Frankfurt am Main HRB 82873\nYellow Automation GmbH – Frankfurt am Main",
      "type": "Einreichung neuer Dokumente",
      "state": "Hessen",
      "amtsgericht": "Amtsgericht Frankfurt am Main",
      "registernummer": "HRB 82873",
      "registerart": "HRB",
      "company_name": "Yellow Automation GmbH",
      "company_seat": "Frankfurt am Main",
      "details": "05.01.2026 (Bekanntmachungsdatum)\n\nHessen Amtsgericht Frankfurt am Main HRB 82873\nEinreichung neuer Dokumente\n\nYellow Automation GmbH\nGesellschaft mit beschränkter Haftung\nFrankfurt am Main\n\nDurch eine Änderung in den Personen der Beiratsmitgliedern ist eine Liste der Mitglieder des Beirates zum Handelsregister eingereicht worden."
    },
    {
      "date": "2026-01-05",
      "id": "141554",
      "original_text": "Löschungsankündigung\nHessen Amtsgericht Bad Hersfeld HRB 2626\nPL GmbH – Hauneck",
      "type": "Löschungsankündigung",
      "state": "Hessen",
      "amtsgericht": "Amtsgericht Bad Hersfeld",
      "registernummer": "HRB 2626",
      "registerart": "HRB",
      "company_name": "PL GmbH",
      "company_seat": "Hauneck",
      "details": "05.01.2026 (Bekanntmachungsdatum)\n\nHessen Amtsgericht Bad Hersfeld HRB 2626\nLöschungsankündigung\n\nPL GmbH\nGesellschaft mit beschränkter Haftung\nHauneck\n\nDas Registergericht beabsichtigt die im Handelsregister eingetragene Gesellschaft von Amts wegen nach § 394 FamFG zu löschen. Die Frist zur Erhebung eines Widerspruchs gegen die beabsichtigte Löschung wird auf 6 Wochen festgesetzt."
    },
    {
      "date": "2026-01-05",
      "id": "141555",
      "original_text": "Registerbekanntmachung nach dem Umwandlungsgesetz\nHessen Amtsgericht Wiesbaden HRB 34365\nTAV Verwaltungs GmbH – Wiesbaden",
      "type": "Registerbekanntmachung nach dem Umwandlungsgesetz",
      "state": "Hessen",
      "amtsgericht": "Amtsgericht Wiesbaden",
      "registernummer": "HRB 34365",
      "registerart": "HRB",
      "company_name": "TAV Verwaltungs GmbH",
      "company_seat": "Wiesbaden",
      "details": "05.01.2026 (Bekanntmachungsdatum)\n\nHessen Amtsgericht Wiesbaden HRB 34365\nRegisterbekanntmachung nach dem Umwandlungsgesetz 05.01.2026 (Eintragungsdatum)\n\nTAV Verwaltungs GmbH\nGesellschaft mit beschränkter Haftung\nWiesbaden\n\nDen Gläubigern der an der Verschmelzung beteiligten Rechtsträger ist, wenn sie binnen sechs Monaten nach dem Tag, an dem die Eintragung der Verschmelzung in das Register des Sitzes derjenigen Rechtsträger deren Gläubiger sie sind, nach § 19 Absatz 3 UmwG bekannt gemacht worden ist, ihren Anspruch nach Grund und Höhe schriftlich anmelden, Sicherheit zu leisten, soweit sie nicht Befriedigung verlangen können. Dieses Recht steht den Gläubigern jedoch nur zu, wenn sie glaubhaft machen, dass durch die Verschmelzung die Erfüllung ihrer Forderung gefährdet wird."
    },
    {
      "date": "2026-01-05",
      "id": "141556",
      "original_text": "Löschungsankündigung\nHessen Amtsgericht Offenbach am Main HRB 47935\nLahode UG (haftungsbeschränkt) – Offenbach am Main",
      "type": "Löschungsankündigung",
      "state": "Hessen",
      "amtsgericht": "Amtsgericht Offenbach am Main",
      "registernummer": "HRB 47935",
      "registerart": "HRB",
      "company_name": "Lahode UG (haftungsbeschränkt)",
      "company_seat": "Offenbach am Main",
      "details": "05.01.2026 (Bekanntmachungsdatum)\n\nHessen Amtsgericht Offenbach am Main HRB 47935\nLöschungsankündigung\n\nLahode UG (haftungsbeschränkt)\nGesellschaft mit beschränkter Haftung\nOffenbach am Main\n\nDas Registergericht beabsichtigt die im Handelsregister eingetragene Gesellschaft von Amts wegen nach § 394 FamFG zu löschen. Die Frist zur Erhebung eines Widerspruchs gegen die beabsichtigte Löschung wird auf 3 Monate festgesetzt."
    },
    {
      "date": "2026-01-05",
      "id": "141557",
      "original_text": "Registerbekanntmachung nach dem Umwandlungsgesetz\nHessen Amtsgericht Hanau HRB 97939\nP.O.S. Peak of Switzerland GmbH – Hanau",
      "type": "Registerbekanntmachung nach dem Umwandlungsgesetz",
      "state": "Hessen",
      "amtsgericht": "Amtsgericht Hanau",
      "registernummer": "HRB 97939",
      "registerart": "HRB",
      "company_name": "P.O.S. Peak of Switzerland GmbH",
      "company_seat": "Hanau",
      "details": "05.01.2026 (Bekanntmachungsdatum)\n\nHessen Amtsgericht Hanau HRB 97939\nRegisterbekanntmachung nach dem Umwandlungsgesetz 05.01.2026 (Eintragungsdatum)\n\nP.O.S. Peak of Switzerland GmbH\nGesellschaft mit beschränkter Haftung\nHanau\n\nDen Gläubigern der an der Verschmelzung beteiligten Rechtsträger ist, wenn sie binnen sechs Monaten nach dem Tag, an dem die Eintragung der Verschmelzung in das Register des Sitzes desjenigen Rechtsträgers, dessen Gläubiger sie sind, nach § 19 Absatz 3 UmwG bekannt gemacht worden ist, ihren Anspruch nach Grund und Höhe schriftlich anmelden, Sicherheit zu leisten, soweit sie nicht Befriedigung verlangen können. Dieses Recht steht den Gläubigern jedoch nur zu, wenn sie glaubhaft machen, dass durch die Verschmelzung die Erfüllung ihrer Forderung gefährdet wird."
    },
    {
      "date": "2026-01-05",
      "id": "141558",
      "original_text": "Registerbekanntmachung nach dem Umwandlungsgesetz\nHessen Amtsgericht Hanau HRB 98120\nMPB Passion GmbH – Hanau",
      "type": "Registerbekanntmachung nach dem Umwandlungsgesetz",
      "state": "Hessen",
      "amtsgericht": "Amtsgericht Hanau",
      "registernummer": "HRB 98120",
      "registerart": "HRB",
      "company_name": "MPB Passion GmbH",
      "company_seat": "Hanau",
      "details": "05.01.2026 (Bekanntmachungsdatum)\n\nHessen Amtsgericht Hanau HRB 98120\nRegisterbekanntmachung nach dem Umwandlungsgesetz 05.01.2026 (Eintragungsdatum)\n\nMPB Passion GmbH\nGesellschaft mit beschränkter Haftung\nHanau\n\nDen Gläubigern der an der Verschmelzung beteiligten Rechtsträger ist, wenn sie binnen sechs Monaten nach dem Tag, an dem die Eintragung der Verschmelzung in das Register des Sitzes desjenigen Rechtsträgers, dessen Gläubiger sie sind, nach § 19 Absatz 3 UmwG bekannt gemacht worden ist, ihren Anspruch nach Grund und Höhe schriftlich anmelden, Sicherheit zu leisten, soweit sie nicht Befriedigung verlangen können. Dieses Recht steht den Gläubigern jedoch nur zu, wenn sie glaubhaft machen, dass durch die Verschmelzung die Erfüllung ihrer Forderung gefährdet wird."
    },
    {
      "date": "2026-01-05",
      "id": "141559",
      "original_text": "Löschungsankündigung\nHessen Amtsgericht Frankfurt am Main HRB 132926\nMT Sales GmbH – Frankfurt am Main",
      "type": "Löschungsankündigung",
      "state": "Hessen",
      "amtsgericht": "Amtsgericht Frankfurt am Main",
      "registernummer": "HRB 132926",
      "registerart": "HRB",
      "company_name": "MT Sales GmbH",
      "company_seat": "Frankfurt am Main",
      "details": "05.01.2026 (Bekanntmachungsdatum)\n\nHessen Amtsgericht Frankfurt am Main HRB 132926\nLöschungsankündigung\n\nMT Sales GmbH\nGesellschaft mit beschränkter Haftung\nFrankfurt am Main\n\nEs ist beabsichtig, die Gesellschaft wegen Vermögenslosigkeit gemäß § 394 FamFG von Amts wegen im Handelsregister zu löschen. Hiergegen kann innerhalb eines Zeitraums von 1 Monat nach dieser Veröffentlichung Widerspruch bei dem Amtsgericht Frankfurt am Main eingelegt werden."
    },
    {
      "date": "2026-01-05",
      "id": "141560",
      "original_text": "Löschungsankündigung\nHessen Amtsgericht Korbach HRB 2064\nGrande Gusto Sicilia UG (haftungsbeschränkt) – Willingen",
      "type": "Löschungsankündigung",
      "state": "Hessen",
      "amtsgericht": "Amtsgericht Korbach",
      "registernummer": "HRB 2064",
      "registerart": "HRB",
      "company_name": "Grande Gusto Sicilia UG (haftungsbeschränkt)",
      "company_seat": "Willingen",
      "details": "05.01.2026 (Bekanntmachungsdatum)\n\nHessen Amtsgericht Korbach HRB 2064\nLöschungsankündigung 05.01.2026 (Eintragungsdatum)\n\nGrande Gusto Sicilia UG (haftungsbeschränkt)\nGesellschaft mit beschränkter Haftung\nWillingen\n\nDas Registergericht beabsichtigt die im Handelsregister eingetragene Gesellschaft von Amts wegen nach § 394 FamFG zu löschen. Die Frist zur Erhebung eines Widerspruchs gegen die beabsichtigte Löschung wird auf 2 Monate festgesetzt."
    }
  ]
}